{"experiment_num": 11, "backbone": "xgboost", "description": "STRICT Exp 11 \u2014 XGBoost shallow trees (max_depth=3, n_est=2000)", "config": {"paths": {"results_dir": "C:/Users/abhir/clauderesearch/autoresearch/generalized_ml_autoresearch/examples/fraud_ecommerce/autoresearch_results"}, "task_type": "binary_classification", "primary_metric": "auc_roc", "backbone": "xgboost", "backbone_config": {"n_estimators": 2000, "max_depth": 3, "learning_rate": 0.05, "subsample": 0.85, "colsample_bytree": 0.85, "reg_lambda": 1.0, "min_child_weight": 5, "scale_pos_weight": 1.0, "seed": 0, "early_stopping_rounds": 40, "n_jobs": 4}, "data": {"format": "csv", "path": "C:/Users/abhir/clauderesearch/autoresearch/generalized_ml_autoresearch/examples/fraud_ecommerce/data/features_velocity.csv", "target_columns": ["class"], "feature_columns": ["purchase_value", "device_id", "source", "browser", "age", "ip_address", "country", "time_since_signup", "purchase_hour", "purchase_dayofweek", "signup_hour", "device_id_freq", "ip_address_freq", "country_freq", "source_freq", "browser_freq", "device_fraud_rate_train", "country_fraud_rate_train"]}, "split": {"name": "holdout", "order": "time", "test_fraction": 0.2, "val_fraction": 0.1, "seed": 0}, "composite": {"higher_is_better": true, "penalty_weight": 0.05, "below_threshold": 0.5}, "description": "STRICT Exp 11 \u2014 XGBoost shallow trees (max_depth=3, n_est=2000)", "seed": 0}, "composite": 0.5337476404239133, "val_primary": 0.5416379691574721, "test_primary": 0.5337476404239133, "per_fold_test": [0.5337476404239133], "per_fold_val": [0.5416379691574721], "status": "KEEP", "seconds_elapsed": 1.3470418453216553, "timestamp": "2026-04-24T21:22:01", "secondary_metrics": {"accuracy": 0.9477532923036199, "precision": 0.2222222222222222, "recall": 0.054715622750179986, "f1": 0.0878105141536684, "f2": 0.06442861987114276, "mcc": 0.09005532842174359, "auc_pr": 0.06395733977384782, "log_loss": 0.18739468063713804, "tn": 28567.0, "fp": 266.0, "fn": 1313.0, "tp": 76.0}, "per_fold_test_reports": [{"fold_id": 0, "regime": "holdout", "task_type": "binary_classification", "n": 30222, "accuracy": 0.9477532923036199, "precision": 0.2222222222222222, "recall": 0.054715622750179986, "f1": 0.0878105141536684, "f2": 0.06442861987114276, "mcc": 0.09005532842174359, "auc_roc": 0.5337476404239133, "auc_pr": 0.06395733977384782, "log_loss": 0.18739468063713804, "tn": 28567, "fp": 266, "fn": 1313, "tp": 76}], "composite_fingerprint": "e692f018120592ed"}
{"experiment_num": 12, "backbone": "lightgbm", "description": "STRICT Exp 12 \u2014 LightGBM (Ke 2017) leaf-wise vs XGBoost level-wise", "config": {"paths": {"results_dir": "C:/Users/abhir/clauderesearch/autoresearch/generalized_ml_autoresearch/examples/fraud_ecommerce/autoresearch_results"}, "task_type": "binary_classification", "primary_metric": "auc_roc", "backbone": "lightgbm", "backbone_config": {"n_estimators": 800, "num_leaves": 63, "learning_rate": 0.04, "feature_fraction": 0.85, "bagging_fraction": 0.85, "min_data_in_leaf": 50, "reg_lambda": 1.0, "seed": 0, "early_stopping_rounds": 50, "n_jobs": 4}, "data": {"format": "csv", "path": "C:/Users/abhir/clauderesearch/autoresearch/generalized_ml_autoresearch/examples/fraud_ecommerce/data/features_velocity.csv", "target_columns": ["class"], "feature_columns": ["purchase_value", "device_id", "source", "browser", "age", "ip_address", "country", "time_since_signup", "purchase_hour", "purchase_dayofweek", "signup_hour", "device_id_freq", "ip_address_freq", "country_freq", "source_freq", "browser_freq", "device_fraud_rate_train", "country_fraud_rate_train"]}, "split": {"name": "holdout", "order": "time", "test_fraction": 0.2, "val_fraction": 0.1, "seed": 0}, "composite": {"higher_is_better": true, "penalty_weight": 0.05, "below_threshold": 0.55}, "description": "STRICT Exp 12 \u2014 LightGBM (Ke 2017) leaf-wise vs XGBoost level-wise", "seed": 0}, "composite": 0.5304904959387662, "val_primary": 0.5413208713788263, "test_primary": 0.5304904959387662, "per_fold_test": [0.5304904959387662], "per_fold_val": [0.5413208713788263], "status": "KEEP", "seconds_elapsed": 1.6571986675262451, "timestamp": "2026-04-24T21:22:57", "secondary_metrics": {"accuracy": 0.9475878499106611, "precision": 0.21902017291066284, "recall": 0.054715622750179986, "f1": 0.08755760368663594, "f2": 0.06437404709469761, "mcc": 0.08907079634380681, "auc_pr": 0.06478893319004293, "log_loss": 0.18791962319350883, "tn": 28562.0, "fp": 271.0, "fn": 1313.0, "tp": 76.0}, "per_fold_test_reports": [{"fold_id": 0, "regime": "holdout", "task_type": "binary_classification", "n": 30222, "accuracy": 0.9475878499106611, "precision": 0.21902017291066284, "recall": 0.054715622750179986, "f1": 0.08755760368663594, "f2": 0.06437404709469761, "mcc": 0.08907079634380681, "auc_roc": 0.5304904959387662, "auc_pr": 0.06478893319004293, "log_loss": 0.18791962319350883, "tn": 28562, "fp": 271, "fn": 1313, "tp": 76}], "composite_fingerprint": "6dde2c449fb3f13d"}
{"experiment_num": 13, "backbone": "catboost", "description": "STRICT Exp 13 \u2014 CatBoost (Prokhorenkova 2018) ordered boosting", "config": {"paths": {"results_dir": "C:/Users/abhir/clauderesearch/autoresearch/generalized_ml_autoresearch/examples/fraud_ecommerce/autoresearch_results"}, "task_type": "binary_classification", "primary_metric": "auc_roc", "backbone": "catboost", "backbone_config": {"iterations": 1000, "depth": 6, "learning_rate": 0.04, "l2_leaf_reg": 3.0, "bootstrap_type": "Bernoulli", "subsample": 0.85, "random_strength": 1.0, "random_state": 0, "early_stopping_rounds": 50, "thread_count": 4, "verbose": 0}, "data": {"format": "csv", "path": "C:/Users/abhir/clauderesearch/autoresearch/generalized_ml_autoresearch/examples/fraud_ecommerce/data/features_velocity.csv", "target_columns": ["class"], "feature_columns": ["purchase_value", "device_id", "source", "browser", "age", "ip_address", "country", "time_since_signup", "purchase_hour", "purchase_dayofweek", "signup_hour", "device_id_freq", "ip_address_freq", "country_freq", "source_freq", "browser_freq", "device_fraud_rate_train", "country_fraud_rate_train"]}, "split": {"name": "holdout", "order": "time", "test_fraction": 0.2, "val_fraction": 0.1, "seed": 0}, "composite": {"higher_is_better": true, "penalty_weight": 0.05, "below_threshold": 0.55}, "description": "STRICT Exp 13 \u2014 CatBoost (Prokhorenkova 2018) ordered boosting", "seed": 0}, "composite": 0.5245451469906754, "val_primary": 0.5400247525503932, "test_primary": 0.5245451469906754, "per_fold_test": [0.5245451469906754], "per_fold_val": [0.5400247525503932], "status": "KEEP", "seconds_elapsed": 2.379474639892578, "timestamp": "2026-04-24T21:23:34", "secondary_metrics": {"accuracy": 0.9475878499106611, "precision": 0.21902017291066284, "recall": 0.054715622750179986, "f1": 0.08755760368663594, "f2": 0.06437404709469761, "mcc": 0.08907079634380681, "auc_pr": 0.061204677605999, "log_loss": 0.19602838347450918, "tn": 28562.0, "fp": 271.0, "fn": 1313.0, "tp": 76.0}, "per_fold_test_reports": [{"fold_id": 0, "regime": "holdout", "task_type": "binary_classification", "n": 30222, "accuracy": 0.9475878499106611, "precision": 0.21902017291066284, "recall": 0.054715622750179986, "f1": 0.08755760368663594, "f2": 0.06437404709469761, "mcc": 0.08907079634380681, "auc_roc": 0.5245451469906754, "auc_pr": 0.061204677605999, "log_loss": 0.19602838347450918, "tn": 28562, "fp": 271, "fn": 1313, "tp": 76}], "composite_fingerprint": "6dde2c449fb3f13d"}
{"experiment_num": 14, "backbone": "ensemble", "description": "STRICT Exp 14 \u2014 Ensemble (3-GBM mean) of Exps 6, 12, 13", "config": {"backbone": "ensemble", "components": [6, 12, 13], "weighting": "weighted", "task_type": "binary_classification", "primary_metric": "auc_roc", "split": {"name": "holdout", "order": "time", "test_fraction": 0.2, "val_fraction": 0.1}, "composite": {"higher_is_better": true, "penalty_weight": 0.05, "below_threshold": 0.5}}, "composite": 0.528629090382373, "val_primary": 0.528629090382373, "test_primary": 0.528629090382373, "per_fold_test": [0.528629090382373], "per_fold_val": [], "status": "KEEP", "seconds_elapsed": 0.0, "timestamp": "2026-04-24T20:00:00", "secondary_metrics": {"accuracy": 0.9475878499106611, "auc_roc": 0.528629090382373, "auc_pr": 0.06213409457374151, "precision": 0.054715622750179986, "recall": 0.054715622750179986}, "per_fold_test_reports": [{"fold_id": 0, "regime": "holdout", "auc_roc": 0.528629090382373, "auc_pr": 0.06213409457374151, "n": 30222}], "composite_fingerprint": "synthetic-ensemble"}
