{"experiment_num": 38, "backbone": "dinov2_vits14_pca50_km", "description": "DINOv2 dinov2_vits14 + PCA(50) on DINOv2 + KMeans (denoise)", "config": {"backbone": "dinov2+pca50_km", "model": "dinov2_vits14", "downstream": "PCA(50) on DINOv2 + KMeans (denoise)"}, "composite": 0.5312208796821573, "val_primary": 0.03283978998661041, "test_primary": 0.5312208796821573, "per_fold_test": [0.5312208796821573], "per_fold_val": [0.03283978998661041], "status": "KEEP", "seconds_elapsed": 0.12996816635131836, "timestamp": "2026-04-25T23:55:36", "secondary_metrics": {"ari": 0.5312208796821573, "nmi": 0.8183577749920986, "fmi": 0.5449298772629446, "homogeneity": 0.8088125790796367, "completeness": 0.8281309565997763, "v_measure": 0.8183577749920987, "silhouette": 0.03283978998661041, "n_pred_clusters": 40, "n_noise": 0, "n_true_clusters": 40}, "per_fold_test_reports": [{"fold_id": 0, "regime": "full-dataset", "ari": 0.5312208796821573, "nmi": 0.8183577749920986, "fmi": 0.5449298772629446, "silhouette": 0.03283978998661041, "n": 400}], "composite_fingerprint": "clustering-ari-floor0.3"}
{"experiment_num": 39, "backbone": "dinov2_vits14_pca100_km", "description": "DINOv2 dinov2_vits14 + PCA(100) on DINOv2 + KMeans", "config": {"backbone": "dinov2+pca100_km", "model": "dinov2_vits14", "downstream": "PCA(100) on DINOv2 + KMeans"}, "composite": 0.5473029909681286, "val_primary": 0.07453758269548416, "test_primary": 0.5473029909681286, "per_fold_test": [0.5473029909681286], "per_fold_val": [0.07453758269548416], "status": "KEEP", "seconds_elapsed": 0.15498876571655273, "timestamp": "2026-04-25T23:55:36", "secondary_metrics": {"ari": 0.5473029909681286, "nmi": 0.8277505337087382, "fmi": 0.5607786760686818, "homogeneity": 0.818074641580322, "completeness": 0.8376580513525185, "v_measure": 0.8277505337087382, "silhouette": 0.07453758269548416, "n_pred_clusters": 40, "n_noise": 0, "n_true_clusters": 40}, "per_fold_test_reports": [{"fold_id": 0, "regime": "full-dataset", "ari": 0.5473029909681286, "nmi": 0.8277505337087382, "fmi": 0.5607786760686818, "silhouette": 0.07453758269548416, "n": 400}], "composite_fingerprint": "clustering-ari-floor0.3"}
{"experiment_num": 40, "backbone": "dinov2_vits14_umap10_km", "description": "DINOv2 dinov2_vits14 + UMAP(10) on DINOv2 + KMeans", "config": {"backbone": "dinov2+umap10_km", "model": "dinov2_vits14", "downstream": "UMAP(10) on DINOv2 + KMeans"}, "composite": 0.5981987862716099, "val_primary": 0.059152115136384964, "test_primary": 0.5981987862716099, "per_fold_test": [0.5981987862716099], "per_fold_val": [0.059152115136384964], "status": "KEEP", "seconds_elapsed": 18.623830795288086, "timestamp": "2026-04-25T23:55:55", "secondary_metrics": {"ari": 0.5981987862716099, "nmi": 0.8464586401683509, "fmi": 0.6083361366330416, "homogeneity": 0.8411138777647651, "completeness": 0.8518717623249493, "v_measure": 0.846458640168351, "silhouette": 0.059152115136384964, "n_pred_clusters": 40, "n_noise": 0, "n_true_clusters": 40}, "per_fold_test_reports": [{"fold_id": 0, "regime": "full-dataset", "ari": 0.5981987862716099, "nmi": 0.8464586401683509, "fmi": 0.6083361366330416, "silhouette": 0.059152115136384964, "n": 400}], "composite_fingerprint": "clustering-ari-floor0.3"}
{"experiment_num": 41, "backbone": "dinov2_vits14_umap2_km", "description": "DINOv2 dinov2_vits14 + UMAP(2) on DINOv2 + KMeans (extreme low dim)", "config": {"backbone": "dinov2+umap2_km", "model": "dinov2_vits14", "downstream": "UMAP(2) on DINOv2 + KMeans (extreme low dim)"}, "composite": 0.6099674502712478, "val_primary": 0.06775950640439987, "test_primary": 0.6099674502712478, "per_fold_test": [0.6099674502712478], "per_fold_val": [0.06775950640439987], "status": "KEEP", "seconds_elapsed": 0.4909071922302246, "timestamp": "2026-04-25T23:55:55", "secondary_metrics": {"ari": 0.6099674502712478, "nmi": 0.8454597188771014, "fmi": 0.6194092516808423, "homogeneity": 0.8417444549027312, "completeness": 0.8492079248695985, "v_measure": 0.8454597188771014, "silhouette": 0.06775950640439987, "n_pred_clusters": 40, "n_noise": 0, "n_true_clusters": 40}, "per_fold_test_reports": [{"fold_id": 0, "regime": "full-dataset", "ari": 0.6099674502712478, "nmi": 0.8454597188771014, "fmi": 0.6194092516808423, "silhouette": 0.06775950640439987, "n": 400}], "composite_fingerprint": "clustering-ari-floor0.3"}
{"experiment_num": 42, "backbone": "dinov2_vitb14_vitb_km", "description": "DINOv2 dinov2_vitb14 + ViT-B/14 features + KMeans (larger model, 768-dim)", "config": {"backbone": "dinov2+vitb_km", "model": "dinov2_vitb14", "downstream": "ViT-B/14 features + KMeans (larger model, 768-dim)"}, "composite": 0.5444686346364485, "val_primary": 0.03785152733325958, "test_primary": 0.5444686346364485, "per_fold_test": [0.5444686346364485], "per_fold_val": [0.03785152733325958], "status": "KEEP", "seconds_elapsed": 0.3128378391265869, "timestamp": "2026-04-25T23:55:56", "secondary_metrics": {"ari": 0.5444686346364485, "nmi": 0.8242772260912697, "fmi": 0.5584368964627969, "homogeneity": 0.8133691177158752, "completeness": 0.8354818892573505, "v_measure": 0.8242772260912699, "silhouette": 0.03785152733325958, "n_pred_clusters": 40, "n_noise": 0, "n_true_clusters": 40}, "per_fold_test_reports": [{"fold_id": 0, "regime": "full-dataset", "ari": 0.5444686346364485, "nmi": 0.8242772260912697, "fmi": 0.5584368964627969, "silhouette": 0.03785152733325958, "n": 400}], "composite_fingerprint": "clustering-ari-floor0.3"}
{"experiment_num": 43, "backbone": "dinov2_vitb14_vitb_spherical", "description": "DINOv2 dinov2_vitb14 + ViT-B/14 + L2-norm + KMeans (Spherical)", "config": {"backbone": "dinov2+vitb_spherical", "model": "dinov2_vitb14", "downstream": "ViT-B/14 + L2-norm + KMeans (Spherical)"}, "composite": 0.5387957916291694, "val_primary": 0.05063515529036522, "test_primary": 0.5387957916291694, "per_fold_test": [0.5387957916291694], "per_fold_val": [0.05063515529036522], "status": "KEEP", "seconds_elapsed": 0.3649272918701172, "timestamp": "2026-04-25T23:55:56", "secondary_metrics": {"ari": 0.5387957916291694, "nmi": 0.8119261091584845, "fmi": 0.550422066364755, "homogeneity": 0.80680152369946, "completeness": 0.8171162107247442, "v_measure": 0.8119261091584845, "silhouette": 0.05063515529036522, "n_pred_clusters": 40, "n_noise": 0, "n_true_clusters": 40}, "per_fold_test_reports": [{"fold_id": 0, "regime": "full-dataset", "ari": 0.5387957916291694, "nmi": 0.8119261091584845, "fmi": 0.550422066364755, "silhouette": 0.05063515529036522, "n": 400}], "composite_fingerprint": "clustering-ari-floor0.3"}
{"experiment_num": 44, "backbone": "dinov2_vits14_seed1", "description": "DINOv2 dinov2_vits14 + KMeans seed=1 (variance check on champion)", "config": {"backbone": "dinov2+seed1", "model": "dinov2_vits14", "downstream": "KMeans seed=1 (variance check on champion)"}, "composite": 0.5561010676325259, "val_primary": 0.09042815864086151, "test_primary": 0.5561010676325259, "per_fold_test": [0.5561010676325259], "per_fold_val": [0.09042815864086151], "status": "KEEP", "seconds_elapsed": 0.28974246978759766, "timestamp": "2026-04-25T23:55:57", "secondary_metrics": {"ari": 0.5561010676325259, "nmi": 0.8300963742831948, "fmi": 0.5685943220950442, "homogeneity": 0.8220287920851793, "completeness": 0.8383238802754432, "v_measure": 0.8300963742831948, "silhouette": 0.09042815864086151, "n_pred_clusters": 40, "n_noise": 0, "n_true_clusters": 40}, "per_fold_test_reports": [{"fold_id": 0, "regime": "full-dataset", "ari": 0.5561010676325259, "nmi": 0.8300963742831948, "fmi": 0.5685943220950442, "silhouette": 0.09042815864086151, "n": 400}], "composite_fingerprint": "clustering-ari-floor0.3"}
{"experiment_num": 45, "backbone": "dinov2_vits14_seed2", "description": "DINOv2 dinov2_vits14 + KMeans seed=2 (variance check on champion)", "config": {"backbone": "dinov2+seed2", "model": "dinov2_vits14", "downstream": "KMeans seed=2 (variance check on champion)"}, "composite": 0.5143749914983997, "val_primary": 0.07123668491840363, "test_primary": 0.5143749914983997, "per_fold_test": [0.5143749914983997], "per_fold_val": [0.07123668491840363], "status": "KEEP", "seconds_elapsed": 0.28859567642211914, "timestamp": "2026-04-25T23:55:57", "secondary_metrics": {"ari": 0.5143749914983997, "nmi": 0.8109587397115126, "fmi": 0.5286092889284919, "homogeneity": 0.8011489322557027, "completeness": 0.8210117610292539, "v_measure": 0.8109587397115126, "silhouette": 0.07123668491840363, "n_pred_clusters": 40, "n_noise": 0, "n_true_clusters": 40}, "per_fold_test_reports": [{"fold_id": 0, "regime": "full-dataset", "ari": 0.5143749914983997, "nmi": 0.8109587397115126, "fmi": 0.5286092889284919, "silhouette": 0.07123668491840363, "n": 400}], "composite_fingerprint": "clustering-ari-floor0.3"}
{"experiment_num": 46, "backbone": "dinov2_vits14_seed7", "description": "DINOv2 dinov2_vits14 + KMeans seed=7 (variance check on champion)", "config": {"backbone": "dinov2+seed7", "model": "dinov2_vits14", "downstream": "KMeans seed=7 (variance check on champion)"}, "composite": 0.5386996289362243, "val_primary": 0.06327588111162186, "test_primary": 0.5386996289362243, "per_fold_test": [0.5386996289362243], "per_fold_val": [0.06327588111162186], "status": "KEEP", "seconds_elapsed": 0.2930257320404053, "timestamp": "2026-04-25T23:55:57", "secondary_metrics": {"ari": 0.5386996289362243, "nmi": 0.8175287092829746, "fmi": 0.5513052481525131, "homogeneity": 0.8094310954383154, "completeness": 0.8257899787129386, "v_measure": 0.8175287092829746, "silhouette": 0.06327588111162186, "n_pred_clusters": 40, "n_noise": 0, "n_true_clusters": 40}, "per_fold_test_reports": [{"fold_id": 0, "regime": "full-dataset", "ari": 0.5386996289362243, "nmi": 0.8175287092829746, "fmi": 0.5513052481525131, "silhouette": 0.06327588111162186, "n": 400}], "composite_fingerprint": "clustering-ari-floor0.3"}
{"experiment_num": 47, "backbone": "spectral_hc_cosine_+_assignkmeans_(ch", "description": "Spectral hill-climb: cosine + assign=kmeans (champion config) on DINOv2 ViT-S/14 raw 384-dim", "config": {"backbone": "spectral_hill_climb", "axis": "cosine + assign=kmeans (champion config)", "model": "DINOv2 ViT-S/14 raw 384-dim"}, "composite": 0.6962579726807369, "val_primary": 0.08901702612638474, "test_primary": 0.6962579726807369, "per_fold_test": [0.6962579726807369], "per_fold_val": [0.08901702612638474], "status": "KEEP", "seconds_elapsed": 1.8542382717132568, "timestamp": "2026-04-25T23:59:33", "secondary_metrics": {"ari": 0.6962579726807369, "nmi": 0.897406840732261, "fmi": 0.7063671196545162, "homogeneity": 0.8871911591046284, "completeness": 0.9078605225179307, "v_measure": 0.8974068407322608, "silhouette": 0.08901702612638474, "n_pred_clusters": 40, "n_noise": 0, "n_true_clusters": 40}, "per_fold_test_reports": [{"fold_id": 0, "regime": "full-dataset", "ari": 0.6962579726807369, "nmi": 0.897406840732261, "fmi": 0.7063671196545162, "silhouette": 0.08901702612638474, "n": 400}], "composite_fingerprint": "clustering-ari-floor0.3"}
{"experiment_num": 48, "backbone": "spectral_hc_cosine_+_assigncluster_qr", "description": "Spectral hill-climb: cosine + assign=cluster_qr on DINOv2 ViT-S/14", "config": {"backbone": "spectral_hill_climb", "axis": "cosine + assign=cluster_qr", "model": "DINOv2 ViT-S/14"}, "composite": 0.470808576066999, "val_primary": -0.004896729718893766, "test_primary": 0.470808576066999, "per_fold_test": [0.470808576066999], "per_fold_val": [-0.004896729718893766], "status": "KEEP", "seconds_elapsed": 0.0762488842010498, "timestamp": "2026-04-25T23:59:33", "secondary_metrics": {"ari": 0.470808576066999, "nmi": 0.7628395798060833, "fmi": 0.483741540183035, "homogeneity": 0.7581707037360765, "completeness": 0.7675663148034523, "v_measure": 0.7628395798060833, "silhouette": -0.004896729718893766, "n_pred_clusters": 40, "n_noise": 0, "n_true_clusters": 40}, "per_fold_test_reports": [{"fold_id": 0, "regime": "full-dataset", "ari": 0.470808576066999, "nmi": 0.7628395798060833, "fmi": 0.483741540183035, "silhouette": -0.004896729718893766, "n": 400}], "composite_fingerprint": "clustering-ari-floor0.3"}
{"experiment_num": 49, "backbone": "spectral_hc_cosine_+_L2-normalized_fe", "description": "Spectral hill-climb: cosine + L2-normalized features on DINOv2 ViT-S/14 + L2", "config": {"backbone": "spectral_hill_climb", "axis": "cosine + L2-normalized features", "model": "DINOv2 ViT-S/14 + L2"}, "composite": 0.6962579726807369, "val_primary": 0.08901702612638474, "test_primary": 0.6962579726807369, "per_fold_test": [0.6962579726807369], "per_fold_val": [0.08901702612638474], "status": "KEEP", "seconds_elapsed": 0.16178488731384277, "timestamp": "2026-04-25T23:59:34", "secondary_metrics": {"ari": 0.6962579726807369, "nmi": 0.897406840732261, "fmi": 0.7063671196545162, "homogeneity": 0.8871911591046284, "completeness": 0.9078605225179307, "v_measure": 0.8974068407322608, "silhouette": 0.08901702612638474, "n_pred_clusters": 40, "n_noise": 0, "n_true_clusters": 40}, "per_fold_test_reports": [{"fold_id": 0, "regime": "full-dataset", "ari": 0.6962579726807369, "nmi": 0.897406840732261, "fmi": 0.7063671196545162, "silhouette": 0.08901702612638474, "n": 400}], "composite_fingerprint": "clustering-ari-floor0.3"}
{"experiment_num": 50, "backbone": "spectral_hc_nearest_neighbors_k5", "description": "Spectral hill-climb: nearest_neighbors k=5 on DINOv2 ViT-S/14", "config": {"backbone": "spectral_hill_climb", "axis": "nearest_neighbors k=5", "model": "DINOv2 ViT-S/14"}, "composite": 0.6042113791370801, "val_primary": 0.0669746994972229, "test_primary": 0.6042113791370801, "per_fold_test": [0.6042113791370801], "per_fold_val": [0.0669746994972229], "status": "KEEP", "seconds_elapsed": 0.08820247650146484, "timestamp": "2026-04-25T23:59:34", "secondary_metrics": {"ari": 0.6042113791370801, "nmi": 0.8576942273040066, "fmi": 0.6164733476173329, "homogeneity": 0.848242549889852, "completeness": 0.8673589118189122, "v_measure": 0.8576942273040066, "silhouette": 0.0669746994972229, "n_pred_clusters": 40, "n_noise": 0, "n_true_clusters": 40}, "per_fold_test_reports": [{"fold_id": 0, "regime": "full-dataset", "ari": 0.6042113791370801, "nmi": 0.8576942273040066, "fmi": 0.6164733476173329, "silhouette": 0.0669746994972229, "n": 400}], "composite_fingerprint": "clustering-ari-floor0.3"}
{"experiment_num": 51, "backbone": "spectral_hc_nearest_neighbors_k7", "description": "Spectral hill-climb: nearest_neighbors k=7 on DINOv2 ViT-S/14", "config": {"backbone": "spectral_hill_climb", "axis": "nearest_neighbors k=7", "model": "DINOv2 ViT-S/14"}, "composite": 0.6245510609984689, "val_primary": 0.08149715512990952, "test_primary": 0.6245510609984689, "per_fold_test": [0.6245510609984689], "per_fold_val": [0.08149715512990952], "status": "KEEP", "seconds_elapsed": 0.07451891899108887, "timestamp": "2026-04-25T23:59:34", "secondary_metrics": {"ari": 0.6245510609984689, "nmi": 0.8537715028657249, "fmi": 0.6340186180042737, "homogeneity": 0.8489622084470655, "completeness": 0.8586355961541647, "v_measure": 0.8537715028657248, "silhouette": 0.08149715512990952, "n_pred_clusters": 40, "n_noise": 0, "n_true_clusters": 40}, "per_fold_test_reports": [{"fold_id": 0, "regime": "full-dataset", "ari": 0.6245510609984689, "nmi": 0.8537715028657249, "fmi": 0.6340186180042737, "silhouette": 0.08149715512990952, "n": 400}], "composite_fingerprint": "clustering-ari-floor0.3"}
{"experiment_num": 52, "backbone": "spectral_hc_nearest_neighbors_k15", "description": "Spectral hill-climb: nearest_neighbors k=15 on DINOv2 ViT-S/14", "config": {"backbone": "spectral_hill_climb", "axis": "nearest_neighbors k=15", "model": "DINOv2 ViT-S/14"}, "composite": 0.5888096714197149, "val_primary": 0.05539693683385849, "test_primary": 0.5888096714197149, "per_fold_test": [0.5888096714197149], "per_fold_val": [0.05539693683385849], "status": "KEEP", "seconds_elapsed": 0.09336662292480469, "timestamp": "2026-04-25T23:59:34", "secondary_metrics": {"ari": 0.5888096714197149, "nmi": 0.83584581641772, "fmi": 0.5991681518021907, "homogeneity": 0.830915458700235, "completeness": 0.8408350333741754, "v_measure": 0.8358458164177199, "silhouette": 0.05539693683385849, "n_pred_clusters": 40, "n_noise": 0, "n_true_clusters": 40}, "per_fold_test_reports": [{"fold_id": 0, "regime": "full-dataset", "ari": 0.5888096714197149, "nmi": 0.83584581641772, "fmi": 0.5991681518021907, "silhouette": 0.05539693683385849, "n": 400}], "composite_fingerprint": "clustering-ari-floor0.3"}
{"experiment_num": 53, "backbone": "spectral_hc_nearest_neighbors_k20", "description": "Spectral hill-climb: nearest_neighbors k=20 on DINOv2 ViT-S/14", "config": {"backbone": "spectral_hill_climb", "axis": "nearest_neighbors k=20", "model": "DINOv2 ViT-S/14"}, "composite": 0.5277549222162093, "val_primary": 0.04231451824307442, "test_primary": 0.5277549222162093, "per_fold_test": [0.5277549222162093], "per_fold_val": [0.04231451824307442], "status": "KEEP", "seconds_elapsed": 0.08418965339660645, "timestamp": "2026-04-25T23:59:34", "secondary_metrics": {"ari": 0.5277549222162093, "nmi": 0.8058748636201438, "fmi": 0.5400107696569489, "homogeneity": 0.7997501697985238, "completeness": 0.8120940903808999, "v_measure": 0.8058748636201438, "silhouette": 0.04231451824307442, "n_pred_clusters": 40, "n_noise": 0, "n_true_clusters": 40}, "per_fold_test_reports": [{"fold_id": 0, "regime": "full-dataset", "ari": 0.5277549222162093, "nmi": 0.8058748636201438, "fmi": 0.5400107696569489, "silhouette": 0.04231451824307442, "n": 400}], "composite_fingerprint": "clustering-ari-floor0.3"}
{"experiment_num": 54, "backbone": "spectral_hc_nearest_neighbors_k30", "description": "Spectral hill-climb: nearest_neighbors k=30 on DINOv2 ViT-S/14", "config": {"backbone": "spectral_hill_climb", "axis": "nearest_neighbors k=30", "model": "DINOv2 ViT-S/14"}, "composite": 0.4552662802902387, "val_primary": 0.009245588444173336, "test_primary": 0.4552662802902387, "per_fold_test": [0.4552662802902387], "per_fold_val": [0.009245588444173336], "status": "KEEP", "seconds_elapsed": 0.09609246253967285, "timestamp": "2026-04-25T23:59:34", "secondary_metrics": {"ari": 0.4552662802902387, "nmi": 0.7805676867269138, "fmi": 0.4719268823340153, "homogeneity": 0.768179886219289, "completeness": 0.793361571405881, "v_measure": 0.7805676867269138, "silhouette": 0.009245588444173336, "n_pred_clusters": 40, "n_noise": 0, "n_true_clusters": 40}, "per_fold_test_reports": [{"fold_id": 0, "regime": "full-dataset", "ari": 0.4552662802902387, "nmi": 0.7805676867269138, "fmi": 0.4719268823340153, "silhouette": 0.009245588444173336, "n": 400}], "composite_fingerprint": "clustering-ari-floor0.3"}
{"experiment_num": 55, "backbone": "spectral_hc_RBF_gamma0.0001", "description": "Spectral hill-climb: RBF gamma=0.0001 on DINOv2 ViT-S/14", "config": {"backbone": "spectral_hill_climb", "axis": "RBF gamma=0.0001", "model": "DINOv2 ViT-S/14"}, "composite": 0.7170476909075352, "val_primary": 0.11009962111711502, "test_primary": 0.7170476909075352, "per_fold_test": [0.7170476909075352], "per_fold_val": [0.11009962111711502], "status": "KEEP", "seconds_elapsed": 0.13983798027038574, "timestamp": "2026-04-25T23:59:35", "secondary_metrics": {"ari": 0.7170476909075352, "nmi": 0.9101943387908112, "fmi": 0.7270880724546175, "homogeneity": 0.9006935757138449, "completeness": 0.9198976719463616, "v_measure": 0.9101943387908114, "silhouette": 0.11009962111711502, "n_pred_clusters": 40, "n_noise": 0, "n_true_clusters": 40}, "per_fold_test_reports": [{"fold_id": 0, "regime": "full-dataset", "ari": 0.7170476909075352, "nmi": 0.9101943387908112, "fmi": 0.7270880724546175, "silhouette": 0.11009962111711502, "n": 400}], "composite_fingerprint": "clustering-ari-floor0.3"}
{"experiment_num": 56, "backbone": "spectral_hc_RBF_gamma0.0005", "description": "Spectral hill-climb: RBF gamma=0.0005 on DINOv2 ViT-S/14", "config": {"backbone": "spectral_hill_climb", "axis": "RBF gamma=0.0005", "model": "DINOv2 ViT-S/14"}, "composite": 0.6960569497217444, "val_primary": 0.09419126808643341, "test_primary": 0.6960569497217444, "per_fold_test": [0.6960569497217444], "per_fold_val": [0.09419126808643341], "status": "KEEP", "seconds_elapsed": 0.1162869930267334, "timestamp": "2026-04-25T23:59:35", "secondary_metrics": {"ari": 0.6960569497217444, "nmi": 0.9001491145330627, "fmi": 0.7059662832530539, "homogeneity": 0.8909853591781328, "completeness": 0.909503326578645, "v_measure": 0.9001491145330628, "silhouette": 0.09419126808643341, "n_pred_clusters": 40, "n_noise": 0, "n_true_clusters": 40}, "per_fold_test_reports": [{"fold_id": 0, "regime": "full-dataset", "ari": 0.6960569497217444, "nmi": 0.9001491145330627, "fmi": 0.7059662832530539, "silhouette": 0.09419126808643341, "n": 400}], "composite_fingerprint": "clustering-ari-floor0.3"}
{"experiment_num": 57, "backbone": "spectral_hc_RBF_gamma0.005", "description": "Spectral hill-climb: RBF gamma=0.005 on DINOv2 ViT-S/14", "config": {"backbone": "spectral_hill_climb", "axis": "RBF gamma=0.005", "model": "DINOv2 ViT-S/14"}, "composite": 0.2628024891765207, "val_primary": 0.07638387382030487, "test_primary": 0.2628024891765207, "per_fold_test": [0.2628024891765207], "per_fold_val": [0.07638387382030487], "status": "DISCARD", "seconds_elapsed": 0.1138911247253418, "timestamp": "2026-04-25T23:59:35", "secondary_metrics": {"ari": 0.2628024891765207, "nmi": 0.7973483547955091, "fmi": 0.35716558463161246, "homogeneity": 0.73928090081719, "completeness": 0.865315288084376, "v_measure": 0.7973483547955091, "silhouette": 0.07638387382030487, "n_pred_clusters": 40, "n_noise": 0, "n_true_clusters": 40}, "per_fold_test_reports": [{"fold_id": 0, "regime": "full-dataset", "ari": 0.2628024891765207, "nmi": 0.7973483547955091, "fmi": 0.35716558463161246, "silhouette": 0.07638387382030487, "n": 400}], "composite_fingerprint": "clustering-ari-floor0.3"}
