{"experiment_num": 137, "backbone": "dec_hc_latent_dim32", "description": "DEC HC: latent_dim=32", "config": {"backbone": "dec_hill_climb", "axis": "latent_dim=32"}, "composite": 0.49549114181492504, "val_primary": 0.14478003978729248, "test_primary": 0.49549114181492504, "per_fold_test": [0.49549114181492504], "per_fold_val": [0.14478003978729248], "status": "KEEP", "seconds_elapsed": 30.811413764953613, "timestamp": "2026-04-26T01:30:50", "secondary_metrics": {"ari": 0.49549114181492504, "nmi": 0.7981860538002273, "fmi": 0.5126524308635733, "homogeneity": 0.7843543623008754, "completeness": 0.8125143320892559, "v_measure": 0.7981860538002273, "silhouette": 0.14478003978729248, "n_pred_clusters": 40, "n_noise": 0, "n_true_clusters": 40}, "per_fold_test_reports": [{"fold_id": 0, "regime": "full-dataset", "ari": 0.49549114181492504, "nmi": 0.7981860538002273, "fmi": 0.5126524308635733, "silhouette": 0.14478003978729248, "n": 400}], "composite_fingerprint": "clustering-ari-floor0.3"}
{"experiment_num": 138, "backbone": "dec_hc_latent_dim128", "description": "DEC HC: latent_dim=128", "config": {"backbone": "dec_hill_climb", "axis": "latent_dim=128"}, "composite": 0.4781216090781922, "val_primary": 0.14526304602622986, "test_primary": 0.4781216090781922, "per_fold_test": [0.4781216090781922], "per_fold_val": [0.14526304602622986], "status": "KEEP", "seconds_elapsed": 34.620948791503906, "timestamp": "2026-04-26T01:31:24", "secondary_metrics": {"ari": 0.4781216090781922, "nmi": 0.7994043648155023, "fmi": 0.49551710754578115, "homogeneity": 0.7868853943344266, "completeness": 0.8123281168498022, "v_measure": 0.7994043648155023, "silhouette": 0.14526304602622986, "n_pred_clusters": 40, "n_noise": 0, "n_true_clusters": 40}, "per_fold_test_reports": [{"fold_id": 0, "regime": "full-dataset", "ari": 0.4781216090781922, "nmi": 0.7994043648155023, "fmi": 0.49551710754578115, "silhouette": 0.14526304602622986, "n": 400}], "composite_fingerprint": "clustering-ari-floor0.3"}
{"experiment_num": 139, "backbone": "dec_hc_latent_dim256", "description": "DEC HC: latent_dim=256", "config": {"backbone": "dec_hill_climb", "axis": "latent_dim=256"}, "composite": 0.5090781387181739, "val_primary": 0.1421082615852356, "test_primary": 0.5090781387181739, "per_fold_test": [0.5090781387181739], "per_fold_val": [0.1421082615852356], "status": "KEEP", "seconds_elapsed": 39.83853602409363, "timestamp": "2026-04-26T01:32:04", "secondary_metrics": {"ari": 0.5090781387181739, "nmi": 0.8161921300765151, "fmi": 0.5266957575798685, "homogeneity": 0.8021406213272839, "completeness": 0.8307447113440147, "v_measure": 0.816192130076515, "silhouette": 0.1421082615852356, "n_pred_clusters": 40, "n_noise": 0, "n_true_clusters": 40}, "per_fold_test_reports": [{"fold_id": 0, "regime": "full-dataset", "ari": 0.5090781387181739, "nmi": 0.8161921300765151, "fmi": 0.5266957575798685, "silhouette": 0.1421082615852356, "n": 400}], "composite_fingerprint": "clustering-ari-floor0.3"}
{"experiment_num": 140, "backbone": "dec_hc_alpha0.5", "description": "DEC HC: alpha=0.5", "config": {"backbone": "dec_hill_climb", "axis": "alpha=0.5"}, "composite": 0.5104003849819161, "val_primary": 0.14926519989967346, "test_primary": 0.5104003849819161, "per_fold_test": [0.5104003849819161], "per_fold_val": [0.14926519989967346], "status": "KEEP", "seconds_elapsed": 35.365076303482056, "timestamp": "2026-04-26T01:32:40", "secondary_metrics": {"ari": 0.5104003849819161, "nmi": 0.8119795524814164, "fmi": 0.5262556945253449, "homogeneity": 0.799390543324047, "completeness": 0.8249714158394508, "v_measure": 0.8119795524814164, "silhouette": 0.14926519989967346, "n_pred_clusters": 40, "n_noise": 0, "n_true_clusters": 40}, "per_fold_test_reports": [{"fold_id": 0, "regime": "full-dataset", "ari": 0.5104003849819161, "nmi": 0.8119795524814164, "fmi": 0.5262556945253449, "silhouette": 0.14926519989967346, "n": 400}], "composite_fingerprint": "clustering-ari-floor0.3"}
{"experiment_num": 141, "backbone": "dec_hc_alpha2.0", "description": "DEC HC: alpha=2.0", "config": {"backbone": "dec_hill_climb", "axis": "alpha=2.0"}, "composite": 0.4841282459909262, "val_primary": 0.14994889497756958, "test_primary": 0.4841282459909262, "per_fold_test": [0.4841282459909262], "per_fold_val": [0.14994889497756958], "status": "KEEP", "seconds_elapsed": 35.78277635574341, "timestamp": "2026-04-26T01:33:16", "secondary_metrics": {"ari": 0.4841282459909262, "nmi": 0.8059691293311819, "fmi": 0.5021352888985229, "homogeneity": 0.7922116512100257, "completeness": 0.8202128742379681, "v_measure": 0.8059691293311818, "silhouette": 0.14994889497756958, "n_pred_clusters": 40, "n_noise": 0, "n_true_clusters": 40}, "per_fold_test_reports": [{"fold_id": 0, "regime": "full-dataset", "ari": 0.4841282459909262, "nmi": 0.8059691293311819, "fmi": 0.5021352888985229, "silhouette": 0.14994889497756958, "n": 400}], "composite_fingerprint": "clustering-ari-floor0.3"}
{"experiment_num": 142, "backbone": "dec_hc_alpha5.0", "description": "DEC HC: alpha=5.0", "config": {"backbone": "dec_hill_climb", "axis": "alpha=5.0"}, "composite": 0.47267121152047303, "val_primary": 0.14781871438026428, "test_primary": 0.47267121152047303, "per_fold_test": [0.47267121152047303], "per_fold_val": [0.14781871438026428], "status": "KEEP", "seconds_elapsed": 36.63908338546753, "timestamp": "2026-04-26T01:33:52", "secondary_metrics": {"ari": 0.47267121152047303, "nmi": 0.7933047592140959, "fmi": 0.48828550661738873, "homogeneity": 0.7827109945599208, "completeness": 0.8041892254488116, "v_measure": 0.7933047592140959, "silhouette": 0.14781871438026428, "n_pred_clusters": 40, "n_noise": 0, "n_true_clusters": 40}, "per_fold_test_reports": [{"fold_id": 0, "regime": "full-dataset", "ari": 0.47267121152047303, "nmi": 0.7933047592140959, "fmi": 0.48828550661738873, "silhouette": 0.14781871438026428, "n": 400}], "composite_fingerprint": "clustering-ari-floor0.3"}
{"experiment_num": 143, "backbone": "dec_hc_mse_weight0.0", "description": "DEC HC: mse_weight=0.0", "config": {"backbone": "dec_hill_climb", "axis": "mse_weight=0.0"}, "composite": 0.49729673064565916, "val_primary": 0.14307402074337006, "test_primary": 0.49729673064565916, "per_fold_test": [0.49729673064565916], "per_fold_val": [0.14307402074337006], "status": "KEEP", "seconds_elapsed": 36.996134519577026, "timestamp": "2026-04-26T01:34:29", "secondary_metrics": {"ari": 0.49729673064565916, "nmi": 0.8073185789106596, "fmi": 0.5119344410148932, "homogeneity": 0.7980447802117028, "completeness": 0.816810446844729, "v_measure": 0.8073185789106595, "silhouette": 0.14307402074337006, "n_pred_clusters": 40, "n_noise": 0, "n_true_clusters": 40}, "per_fold_test_reports": [{"fold_id": 0, "regime": "full-dataset", "ari": 0.49729673064565916, "nmi": 0.8073185789106596, "fmi": 0.5119344410148932, "silhouette": 0.14307402074337006, "n": 400}], "composite_fingerprint": "clustering-ari-floor0.3"}
{"experiment_num": 144, "backbone": "dec_hc_mse_weight0.5", "description": "DEC HC: mse_weight=0.5", "config": {"backbone": "dec_hill_climb", "axis": "mse_weight=0.5"}, "composite": 0.44352071043542873, "val_primary": 0.1483968049287796, "test_primary": 0.44352071043542873, "per_fold_test": [0.44352071043542873], "per_fold_val": [0.1483968049287796], "status": "KEEP", "seconds_elapsed": 38.25658059120178, "timestamp": "2026-04-26T01:35:08", "secondary_metrics": {"ari": 0.44352071043542873, "nmi": 0.7827856764650588, "fmi": 0.46342792011258416, "homogeneity": 0.7672152712530317, "completeness": 0.7990011669545087, "v_measure": 0.7827856764650588, "silhouette": 0.1483968049287796, "n_pred_clusters": 40, "n_noise": 0, "n_true_clusters": 40}, "per_fold_test_reports": [{"fold_id": 0, "regime": "full-dataset", "ari": 0.44352071043542873, "nmi": 0.7827856764650588, "fmi": 0.46342792011258416, "silhouette": 0.1483968049287796, "n": 400}], "composite_fingerprint": "clustering-ari-floor0.3"}
{"experiment_num": 145, "backbone": "dec_hc_mse_weight1.0", "description": "DEC HC: mse_weight=1.0", "config": {"backbone": "dec_hill_climb", "axis": "mse_weight=1.0"}, "composite": 0.4891301966569056, "val_primary": 0.15834541618824005, "test_primary": 0.4891301966569056, "per_fold_test": [0.4891301966569056], "per_fold_val": [0.15834541618824005], "status": "KEEP", "seconds_elapsed": 39.177085399627686, "timestamp": "2026-04-26T01:35:47", "secondary_metrics": {"ari": 0.4891301966569056, "nmi": 0.8117597317778247, "fmi": 0.508000246468308, "homogeneity": 0.7970144523533427, "completeness": 0.8270608895951417, "v_measure": 0.8117597317778247, "silhouette": 0.15834541618824005, "n_pred_clusters": 40, "n_noise": 0, "n_true_clusters": 40}, "per_fold_test_reports": [{"fold_id": 0, "regime": "full-dataset", "ari": 0.4891301966569056, "nmi": 0.8117597317778247, "fmi": 0.508000246468308, "silhouette": 0.15834541618824005, "n": 400}], "composite_fingerprint": "clustering-ari-floor0.3"}
{"experiment_num": 146, "backbone": "dec_hc_pretrain_epochs80_(2x_default)", "description": "DEC HC: pretrain_epochs=80 (2x default)", "config": {"backbone": "dec_hill_climb", "axis": "pretrain_epochs=80 (2x default)"}, "composite": 0.5002064647020781, "val_primary": 0.1402854174375534, "test_primary": 0.5002064647020781, "per_fold_test": [0.5002064647020781], "per_fold_val": [0.1402854174375534], "status": "KEEP", "seconds_elapsed": 62.37992548942566, "timestamp": "2026-04-26T01:36:50", "secondary_metrics": {"ari": 0.5002064647020781, "nmi": 0.8081118994821912, "fmi": 0.5165670386383879, "homogeneity": 0.794877259406945, "completeness": 0.8217947129133659, "v_measure": 0.8081118994821912, "silhouette": 0.1402854174375534, "n_pred_clusters": 40, "n_noise": 0, "n_true_clusters": 40}, "per_fold_test_reports": [{"fold_id": 0, "regime": "full-dataset", "ari": 0.5002064647020781, "nmi": 0.8081118994821912, "fmi": 0.5165670386383879, "silhouette": 0.1402854174375534, "n": 400}], "composite_fingerprint": "clustering-ari-floor0.3"}
