{"experiment_num": 18, "backbone": "affinity_prop", "description": "Affinity Propagation (Frey 2007 Science) on PCA(50)", "config": {"backbone": "affinity_propagation", "damping": 0.9, "pca_dim": 50}, "composite": 0.47567038878474205, "val_primary": 0.17372015118598938, "test_primary": 0.47567038878474205, "per_fold_test": [0.47567038878474205], "per_fold_val": [0.17372015118598938], "status": "KEEP", "seconds_elapsed": 0.1031036376953125, "timestamp": "2026-04-25T23:47:53", "secondary_metrics": {"ari": 0.47567038878474205, "nmi": 0.8104626969935157, "fmi": 0.4874549139604688, "homogeneity": 0.8298507254216849, "completeness": 0.7919599217279639, "v_measure": 0.8104626969935156, "silhouette": 0.17372015118598938, "n_pred_clusters": 56, "n_noise": 0, "n_true_clusters": 40}, "per_fold_test_reports": [{"fold_id": 0, "regime": "full-dataset", "ari": 0.47567038878474205, "nmi": 0.8104626969935157, "fmi": 0.4874549139604688, "silhouette": 0.17372015118598938, "n": 400}], "composite_fingerprint": "clustering-ari-floor0.3"}
{"experiment_num": 19, "backbone": "meanshift", "description": "MeanShift (Comaniciu 2002) on PCA(50)", "config": {"backbone": "meanshift", "bandwidth": "auto-estimated", "pca_dim": 50}, "composite": 0.0, "val_primary": NaN, "test_primary": 0.0, "per_fold_test": [0.0], "per_fold_val": [NaN], "status": "DISCARD", "seconds_elapsed": 0.5872786045074463, "timestamp": "2026-04-25T23:47:54", "secondary_metrics": {"ari": 0.0, "nmi": 0.0, "fmi": 0.15018785229652765, "homogeneity": 0.0, "completeness": 1.0, "v_measure": 0.0, "silhouette": NaN, "n_pred_clusters": 1, "n_noise": 0, "n_true_clusters": 40}, "per_fold_test_reports": [{"fold_id": 0, "regime": "full-dataset", "ari": 0.0, "nmi": 0.0, "fmi": 0.15018785229652765, "silhouette": NaN, "n": 400}], "composite_fingerprint": "clustering-ari-floor0.3"}
{"experiment_num": 20, "backbone": "dinov2_kmeans", "description": "DINOv2 ViT-S/14 (Oquab 2024 Meta TMLR) features + KMeans", "config": {"backbone": "dinov2+kmeans", "model": "facebookresearch/dinov2_vits14", "feature_dim": 384, "n_clusters": 40}, "composite": 0.5454743527152269, "val_primary": 0.0709543377161026, "test_primary": 0.5454743527152269, "per_fold_test": [0.5454743527152269], "per_fold_val": [0.0709543377161026], "status": "KEEP", "seconds_elapsed": 24.180395364761353, "timestamp": "2026-04-25T23:48:18", "secondary_metrics": {"ari": 0.5454743527152269, "nmi": 0.8200808889127283, "fmi": 0.5572212667681944, "homogeneity": 0.8138059635752086, "completeness": 0.8264533329489159, "v_measure": 0.8200808889127282, "silhouette": 0.0709543377161026, "n_pred_clusters": 40, "n_noise": 0, "n_true_clusters": 40}, "per_fold_test_reports": [{"fold_id": 0, "regime": "full-dataset", "ari": 0.5454743527152269, "nmi": 0.8200808889127283, "fmi": 0.5572212667681944, "silhouette": 0.0709543377161026, "n": 400}], "composite_fingerprint": "clustering-ari-floor0.3"}
{"experiment_num": 21, "backbone": "spherical_kmeans", "description": "Spherical KMeans (Dhillon 2001) on L2-norm PCA(50)", "config": {"backbone": "spherical_kmeans", "pca_dim": 50, "normalize": "L2", "n_clusters": 40}, "composite": 0.4816229887531615, "val_primary": 0.12655378878116608, "test_primary": 0.4816229887531615, "per_fold_test": [0.4816229887531615], "per_fold_val": [0.12655378878116608], "status": "KEEP", "seconds_elapsed": 0.15955853462219238, "timestamp": "2026-04-25T23:48:18", "secondary_metrics": {"ari": 0.4816229887531615, "nmi": 0.7896158360360447, "fmi": 0.49714475090805793, "homogeneity": 0.7796157538679026, "completeness": 0.7998757924428409, "v_measure": 0.7896158360360448, "silhouette": 0.12655378878116608, "n_pred_clusters": 40, "n_noise": 0, "n_true_clusters": 40}, "per_fold_test_reports": [{"fold_id": 0, "regime": "full-dataset", "ari": 0.4816229887531615, "nmi": 0.7896158360360447, "fmi": 0.49714475090805793, "silhouette": 0.12655378878116608, "n": 400}], "composite_fingerprint": "clustering-ari-floor0.3"}
{"experiment_num": 22, "backbone": "dinov2_vits14_minibatch_kmeans", "description": "DINOv2 dinov2_vits14 + MiniBatchKMeans (faster, may be less accurate)", "config": {"backbone": "dinov2+minibatch_kmeans", "model": "dinov2_vits14", "downstream": "MiniBatchKMeans (faster, may be less accurate)"}, "composite": 0.5595914906886773, "val_primary": 0.05959691107273102, "test_primary": 0.5595914906886773, "per_fold_test": [0.5595914906886773], "per_fold_val": [0.05959691107273102], "status": "KEEP", "seconds_elapsed": 1.9976301193237305, "timestamp": "2026-04-25T23:55:30", "secondary_metrics": {"ari": 0.5595914906886773, "nmi": 0.8392948483956887, "fmi": 0.5727290471810548, "homogeneity": 0.8301696452870587, "completeness": 0.848622889079232, "v_measure": 0.8392948483956887, "silhouette": 0.05959691107273102, "n_pred_clusters": 40, "n_noise": 0, "n_true_clusters": 40}, "per_fold_test_reports": [{"fold_id": 0, "regime": "full-dataset", "ari": 0.5595914906886773, "nmi": 0.8392948483956887, "fmi": 0.5727290471810548, "silhouette": 0.05959691107273102, "n": 400}], "composite_fingerprint": "clustering-ari-floor0.3"}
{"experiment_num": 23, "backbone": "dinov2_vits14_bisecting_kmeans", "description": "DINOv2 dinov2_vits14 + BisectingKMeans hierarchical bisection", "config": {"backbone": "dinov2+bisecting_kmeans", "model": "dinov2_vits14", "downstream": "BisectingKMeans hierarchical bisection"}, "composite": 0.4436897385120931, "val_primary": 0.02771398238837719, "test_primary": 0.4436897385120931, "per_fold_test": [0.4436897385120931], "per_fold_val": [0.02771398238837719], "status": "KEEP", "seconds_elapsed": 0.4928739070892334, "timestamp": "2026-04-25T23:55:31", "secondary_metrics": {"ari": 0.4436897385120931, "nmi": 0.7677855799701964, "fmi": 0.4587819032779228, "homogeneity": 0.7590812230207791, "completeness": 0.77669187765987, "v_measure": 0.7677855799701964, "silhouette": 0.02771398238837719, "n_pred_clusters": 40, "n_noise": 0, "n_true_clusters": 40}, "per_fold_test_reports": [{"fold_id": 0, "regime": "full-dataset", "ari": 0.4436897385120931, "nmi": 0.7677855799701964, "fmi": 0.4587819032779228, "silhouette": 0.02771398238837719, "n": 400}], "composite_fingerprint": "clustering-ari-floor0.3"}
{"experiment_num": 24, "backbone": "dinov2_vits14_kmeans_random", "description": "DINOv2 dinov2_vits14 + KMeans with random init (vs k-means++)", "config": {"backbone": "dinov2+kmeans_random", "model": "dinov2_vits14", "downstream": "KMeans with random init (vs k-means++)"}, "composite": 0.49995801808021345, "val_primary": 0.030405940487980843, "test_primary": 0.49995801808021345, "per_fold_test": [0.49995801808021345], "per_fold_val": [0.030405940487980843], "status": "KEEP", "seconds_elapsed": 0.0884401798248291, "timestamp": "2026-04-25T23:55:31", "secondary_metrics": {"ari": 0.49995801808021345, "nmi": 0.8090842504259723, "fmi": 0.5170424136207303, "homogeneity": 0.7955383679938729, "completeness": 0.8230994236358019, "v_measure": 0.8090842504259722, "silhouette": 0.030405940487980843, "n_pred_clusters": 40, "n_noise": 0, "n_true_clusters": 40}, "per_fold_test_reports": [{"fold_id": 0, "regime": "full-dataset", "ari": 0.49995801808021345, "nmi": 0.8090842504259723, "fmi": 0.5170424136207303, "silhouette": 0.030405940487980843, "n": 400}], "composite_fingerprint": "clustering-ari-floor0.3"}
{"experiment_num": 25, "backbone": "dinov2_vits14_kmeans_n50", "description": "DINOv2 dinov2_vits14 + KMeans n_init=50 (5x more random restarts)", "config": {"backbone": "dinov2+kmeans_n50", "model": "dinov2_vits14", "downstream": "KMeans n_init=50 (5x more random restarts)"}, "composite": 0.5851815189296629, "val_primary": 0.08913357555866241, "test_primary": 0.5851815189296629, "per_fold_test": [0.5851815189296629], "per_fold_val": [0.08913357555866241], "status": "KEEP", "seconds_elapsed": 1.5708794593811035, "timestamp": "2026-04-25T23:55:33", "secondary_metrics": {"ari": 0.5851815189296629, "nmi": 0.8456374603360391, "fmi": 0.5973506409473565, "homogeneity": 0.8367161653291516, "completeness": 0.8547510481619651, "v_measure": 0.8456374603360391, "silhouette": 0.08913357555866241, "n_pred_clusters": 40, "n_noise": 0, "n_true_clusters": 40}, "per_fold_test_reports": [{"fold_id": 0, "regime": "full-dataset", "ari": 0.5851815189296629, "nmi": 0.8456374603360391, "fmi": 0.5973506409473565, "silhouette": 0.08913357555866241, "n": 400}], "composite_fingerprint": "clustering-ari-floor0.3"}
{"experiment_num": 26, "backbone": "dinov2_vits14_spherical", "description": "DINOv2 dinov2_vits14 + L2-normalized features + KMeans (Spherical)", "config": {"backbone": "dinov2+spherical", "model": "dinov2_vits14", "downstream": "L2-normalized features + KMeans (Spherical)"}, "composite": 0.560214743749068, "val_primary": 0.04671948030591011, "test_primary": 0.560214743749068, "per_fold_test": [0.560214743749068], "per_fold_val": [0.04671948030591011], "status": "KEEP", "seconds_elapsed": 0.32251930236816406, "timestamp": "2026-04-25T23:55:33", "secondary_metrics": {"ari": 0.560214743749068, "nmi": 0.8258751196185493, "fmi": 0.5722816542874695, "homogeneity": 0.8180026199848623, "completeness": 0.8339006224524027, "v_measure": 0.8258751196185494, "silhouette": 0.04671948030591011, "n_pred_clusters": 40, "n_noise": 0, "n_true_clusters": 40}, "per_fold_test_reports": [{"fold_id": 0, "regime": "full-dataset", "ari": 0.560214743749068, "nmi": 0.8258751196185493, "fmi": 0.5722816542874695, "silhouette": 0.04671948030591011, "n": 400}], "composite_fingerprint": "clustering-ari-floor0.3"}
{"experiment_num": 27, "backbone": "dinov2_vits14_agg_ward", "description": "DINOv2 dinov2_vits14 + Agglomerative Ward (variance-minimizing merges)", "config": {"backbone": "dinov2+agg_ward", "model": "dinov2_vits14", "downstream": "Agglomerative Ward (variance-minimizing merges)"}, "composite": 0.6370946321203487, "val_primary": 0.08336355537176132, "test_primary": 0.6370946321203487, "per_fold_test": [0.6370946321203487], "per_fold_val": [0.08336355537176132], "status": "KEEP", "seconds_elapsed": 0.2617225646972656, "timestamp": "2026-04-25T23:55:34", "secondary_metrics": {"ari": 0.6370946321203487, "nmi": 0.8705842700000564, "fmi": 0.6469165218119676, "homogeneity": 0.863755068406218, "completeness": 0.877522321136698, "v_measure": 0.8705842700000566, "silhouette": 0.08336355537176132, "n_pred_clusters": 40, "n_noise": 0, "n_true_clusters": 40}, "per_fold_test_reports": [{"fold_id": 0, "regime": "full-dataset", "ari": 0.6370946321203487, "nmi": 0.8705842700000564, "fmi": 0.6469165218119676, "silhouette": 0.08336355537176132, "n": 400}], "composite_fingerprint": "clustering-ari-floor0.3"}
{"experiment_num": 28, "backbone": "dinov2_vits14_agg_avg", "description": "DINOv2 dinov2_vits14 + Agglomerative average-linkage", "config": {"backbone": "dinov2+agg_avg", "model": "dinov2_vits14", "downstream": "Agglomerative average-linkage"}, "composite": 0.4702640883329394, "val_primary": 0.02259155549108982, "test_primary": 0.4702640883329394, "per_fold_test": [0.4702640883329394], "per_fold_val": [0.02259155549108982], "status": "KEEP", "seconds_elapsed": 0.008028507232666016, "timestamp": "2026-04-25T23:55:34", "secondary_metrics": {"ari": 0.4702640883329394, "nmi": 0.8157838672030474, "fmi": 0.5029335472362698, "homogeneity": 0.7828464139830738, "completeness": 0.8516146738335845, "v_measure": 0.8157838672030473, "silhouette": 0.02259155549108982, "n_pred_clusters": 40, "n_noise": 0, "n_true_clusters": 40}, "per_fold_test_reports": [{"fold_id": 0, "regime": "full-dataset", "ari": 0.4702640883329394, "nmi": 0.8157838672030474, "fmi": 0.5029335472362698, "silhouette": 0.02259155549108982, "n": 400}], "composite_fingerprint": "clustering-ari-floor0.3"}
{"experiment_num": 29, "backbone": "dinov2_vits14_agg_complete", "description": "DINOv2 dinov2_vits14 + Agglomerative complete-linkage (max distance)", "config": {"backbone": "dinov2+agg_complete", "model": "dinov2_vits14", "downstream": "Agglomerative complete-linkage (max distance)"}, "composite": 0.48053845715556553, "val_primary": 0.023389823734760284, "test_primary": 0.48053845715556553, "per_fold_test": [0.48053845715556553], "per_fold_val": [0.023389823734760284], "status": "KEEP", "seconds_elapsed": 0.0069959163665771484, "timestamp": "2026-04-25T23:55:34", "secondary_metrics": {"ari": 0.48053845715556553, "nmi": 0.8071311527179613, "fmi": 0.49903083321354, "homogeneity": 0.7901345910546235, "completeness": 0.8248750145978028, "v_measure": 0.8071311527179613, "silhouette": 0.023389823734760284, "n_pred_clusters": 40, "n_noise": 0, "n_true_clusters": 40}, "per_fold_test_reports": [{"fold_id": 0, "regime": "full-dataset", "ari": 0.48053845715556553, "nmi": 0.8071311527179613, "fmi": 0.49903083321354, "silhouette": 0.023389823734760284, "n": 400}], "composite_fingerprint": "clustering-ari-floor0.3"}
{"experiment_num": 30, "backbone": "dinov2_vits14_agg_cosine_avg", "description": "DINOv2 dinov2_vits14 + Agglomerative cosine + average linkage", "config": {"backbone": "dinov2+agg_cosine_avg", "model": "dinov2_vits14", "downstream": "Agglomerative cosine + average linkage"}, "composite": 0.44904197209407637, "val_primary": 0.013399893417954445, "test_primary": 0.44904197209407637, "per_fold_test": [0.44904197209407637], "per_fold_val": [0.013399893417954445], "status": "KEEP", "seconds_elapsed": 0.007004261016845703, "timestamp": "2026-04-25T23:55:34", "secondary_metrics": {"ari": 0.44904197209407637, "nmi": 0.8173641124113944, "fmi": 0.48904159789519674, "homogeneity": 0.7812186004669621, "completeness": 0.857016657568678, "v_measure": 0.8173641124113944, "silhouette": 0.013399893417954445, "n_pred_clusters": 40, "n_noise": 0, "n_true_clusters": 40}, "per_fold_test_reports": [{"fold_id": 0, "regime": "full-dataset", "ari": 0.44904197209407637, "nmi": 0.8173641124113944, "fmi": 0.48904159789519674, "silhouette": 0.013399893417954445, "n": 400}], "composite_fingerprint": "clustering-ari-floor0.3"}
{"experiment_num": 31, "backbone": "dinov2_vits14_spectral_g001", "description": "DINOv2 dinov2_vits14 + Spectral RBF gamma=0.001 (small)", "config": {"backbone": "dinov2+spectral_g001", "model": "dinov2_vits14", "downstream": "Spectral RBF gamma=0.001 (small)"}, "composite": 0.5851847973642582, "val_primary": 0.08723869174718857, "test_primary": 0.5851847973642582, "per_fold_test": [0.5851847973642582], "per_fold_val": [0.08723869174718857], "status": "KEEP", "seconds_elapsed": 0.21782398223876953, "timestamp": "2026-04-25T23:55:34", "secondary_metrics": {"ari": 0.5851847973642582, "nmi": 0.8532952540771955, "fmi": 0.6006351928982613, "homogeneity": 0.8395318169025394, "completeness": 0.867517493520166, "v_measure": 0.8532952540771956, "silhouette": 0.08723869174718857, "n_pred_clusters": 40, "n_noise": 0, "n_true_clusters": 40}, "per_fold_test_reports": [{"fold_id": 0, "regime": "full-dataset", "ari": 0.5851847973642582, "nmi": 0.8532952540771955, "fmi": 0.6006351928982613, "silhouette": 0.08723869174718857, "n": 400}], "composite_fingerprint": "clustering-ari-floor0.3"}
{"experiment_num": 32, "backbone": "dinov2_vits14_spectral_g01", "description": "DINOv2 dinov2_vits14 + Spectral RBF gamma=0.01", "config": {"backbone": "dinov2+spectral_g01", "model": "dinov2_vits14", "downstream": "Spectral RBF gamma=0.01"}, "composite": 0.27667372468746504, "val_primary": 0.036097556352615356, "test_primary": 0.27667372468746504, "per_fold_test": [0.27667372468746504], "per_fold_val": [0.036097556352615356], "status": "DISCARD", "seconds_elapsed": 0.13799214363098145, "timestamp": "2026-04-25T23:55:34", "secondary_metrics": {"ari": 0.27667372468746504, "nmi": 0.7671603405783812, "fmi": 0.35322183896521125, "homogeneity": 0.7104249836189956, "completeness": 0.8337441044820765, "v_measure": 0.7671603405783811, "silhouette": 0.036097556352615356, "n_pred_clusters": 40, "n_noise": 0, "n_true_clusters": 40}, "per_fold_test_reports": [{"fold_id": 0, "regime": "full-dataset", "ari": 0.27667372468746504, "nmi": 0.7671603405783812, "fmi": 0.35322183896521125, "silhouette": 0.036097556352615356, "n": 400}], "composite_fingerprint": "clustering-ari-floor0.3"}
{"experiment_num": 33, "backbone": "dinov2_vits14_spectral_cos", "description": "DINOv2 dinov2_vits14 + Spectral cosine affinity", "config": {"backbone": "dinov2+spectral_cos", "model": "dinov2_vits14", "downstream": "Spectral cosine affinity"}, "composite": 0.6962579726807369, "val_primary": 0.08901702612638474, "test_primary": 0.6962579726807369, "per_fold_test": [0.6962579726807369], "per_fold_val": [0.08901702612638474], "status": "KEEP", "seconds_elapsed": 0.16302990913391113, "timestamp": "2026-04-25T23:55:35", "secondary_metrics": {"ari": 0.6962579726807369, "nmi": 0.897406840732261, "fmi": 0.7063671196545162, "homogeneity": 0.8871911591046284, "completeness": 0.9078605225179307, "v_measure": 0.8974068407322608, "silhouette": 0.08901702612638474, "n_pred_clusters": 40, "n_noise": 0, "n_true_clusters": 40}, "per_fold_test_reports": [{"fold_id": 0, "regime": "full-dataset", "ari": 0.6962579726807369, "nmi": 0.897406840732261, "fmi": 0.7063671196545162, "silhouette": 0.08901702612638474, "n": 400}], "composite_fingerprint": "clustering-ari-floor0.3"}
{"experiment_num": 34, "backbone": "dinov2_vits14_spectral_knn10", "description": "DINOv2 dinov2_vits14 + Spectral nearest-neighbors affinity (k=10)", "config": {"backbone": "dinov2+spectral_knn10", "model": "dinov2_vits14", "downstream": "Spectral nearest-neighbors affinity (k=10)"}, "composite": 0.6389418356148558, "val_primary": 0.07956644147634506, "test_primary": 0.6389418356148558, "per_fold_test": [0.6389418356148558], "per_fold_val": [0.07956644147634506], "status": "KEEP", "seconds_elapsed": 0.08914899826049805, "timestamp": "2026-04-25T23:55:35", "secondary_metrics": {"ari": 0.6389418356148558, "nmi": 0.8583501627126593, "fmi": 0.6477793817683721, "homogeneity": 0.8545352076552176, "completeness": 0.8621993332058941, "v_measure": 0.8583501627126595, "silhouette": 0.07956644147634506, "n_pred_clusters": 40, "n_noise": 0, "n_true_clusters": 40}, "per_fold_test_reports": [{"fold_id": 0, "regime": "full-dataset", "ari": 0.6389418356148558, "nmi": 0.8583501627126593, "fmi": 0.6477793817683721, "silhouette": 0.07956644147634506, "n": 400}], "composite_fingerprint": "clustering-ari-floor0.3"}
{"experiment_num": 35, "backbone": "dinov2_vits14_birch", "description": "DINOv2 dinov2_vits14 + Birch on DINOv2 features", "config": {"backbone": "dinov2+birch", "model": "dinov2_vits14", "downstream": "Birch on DINOv2 features"}, "composite": 0.6370946321203487, "val_primary": 0.08336355537176132, "test_primary": 0.6370946321203487, "per_fold_test": [0.6370946321203487], "per_fold_val": [0.08336355537176132], "status": "KEEP", "seconds_elapsed": 0.05336403846740723, "timestamp": "2026-04-25T23:55:35", "secondary_metrics": {"ari": 0.6370946321203487, "nmi": 0.8705842700000564, "fmi": 0.6469165218119676, "homogeneity": 0.863755068406218, "completeness": 0.877522321136698, "v_measure": 0.8705842700000566, "silhouette": 0.08336355537176132, "n_pred_clusters": 40, "n_noise": 0, "n_true_clusters": 40}, "per_fold_test_reports": [{"fold_id": 0, "regime": "full-dataset", "ari": 0.6370946321203487, "nmi": 0.8705842700000564, "fmi": 0.6469165218119676, "silhouette": 0.08336355537176132, "n": 400}], "composite_fingerprint": "clustering-ari-floor0.3"}
{"experiment_num": 36, "backbone": "dinov2_vits14_gmm_full", "description": "DINOv2 dinov2_vits14 + GMM full-covariance K=40", "config": {"backbone": "dinov2+gmm_full", "model": "dinov2_vits14", "downstream": "GMM full-covariance K=40"}, "composite": 0.523443924915671, "val_primary": 0.03414541110396385, "test_primary": 0.523443924915671, "per_fold_test": [0.523443924915671], "per_fold_val": [0.03414541110396385], "status": "KEEP", "seconds_elapsed": 0.7220091819763184, "timestamp": "2026-04-25T23:55:36", "secondary_metrics": {"ari": 0.523443924915671, "nmi": 0.813291152104493, "fmi": 0.5374649913108603, "homogeneity": 0.8033778684571762, "completeness": 0.8234521423150353, "v_measure": 0.813291152104493, "silhouette": 0.03414541110396385, "n_pred_clusters": 40, "n_noise": 0, "n_true_clusters": 40}, "per_fold_test_reports": [{"fold_id": 0, "regime": "full-dataset", "ari": 0.523443924915671, "nmi": 0.813291152104493, "fmi": 0.5374649913108603, "silhouette": 0.03414541110396385, "n": 400}], "composite_fingerprint": "clustering-ari-floor0.3"}
{"experiment_num": 37, "backbone": "dinov2_vits14_gmm_diag", "description": "DINOv2 dinov2_vits14 + GMM diagonal-covariance", "config": {"backbone": "dinov2+gmm_diag", "model": "dinov2_vits14", "downstream": "GMM diagonal-covariance"}, "composite": 0.523443924915671, "val_primary": 0.03414540737867355, "test_primary": 0.523443924915671, "per_fold_test": [0.523443924915671], "per_fold_val": [0.03414540737867355], "status": "KEEP", "seconds_elapsed": 0.08974909782409668, "timestamp": "2026-04-25T23:55:36", "secondary_metrics": {"ari": 0.523443924915671, "nmi": 0.813291152104493, "fmi": 0.5374649913108603, "homogeneity": 0.8033778684571762, "completeness": 0.8234521423150353, "v_measure": 0.813291152104493, "silhouette": 0.03414540737867355, "n_pred_clusters": 40, "n_noise": 0, "n_true_clusters": 40}, "per_fold_test_reports": [{"fold_id": 0, "regime": "full-dataset", "ari": 0.523443924915671, "nmi": 0.813291152104493, "fmi": 0.5374649913108603, "silhouette": 0.03414540737867355, "n": 400}], "composite_fingerprint": "clustering-ari-floor0.3"}
