{"experiment_num": 117, "backbone": "birch_hc_tight_threshold0.01_on_DINOv2", "description": "Birch hill-climb: tight threshold=0.01 on DINOv2 on DINOv2 ViT-S/14", "config": {"backbone": "birch_hill_climb", "axis": "tight threshold=0.01 on DINOv2", "model": "DINOv2 ViT-S/14"}, "composite": 0.6370946321203487, "val_primary": 0.08336355537176132, "test_primary": 0.6370946321203487, "per_fold_test": [0.6370946321203487], "per_fold_val": [0.08336355537176132], "status": "KEEP", "seconds_elapsed": 0.03951764106750488, "timestamp": "2026-04-26T01:26:24", "secondary_metrics": {"ari": 0.6370946321203487, "nmi": 0.8705842700000564, "fmi": 0.6469165218119676, "homogeneity": 0.863755068406218, "completeness": 0.877522321136698, "v_measure": 0.8705842700000566, "silhouette": 0.08336355537176132, "n_pred_clusters": 40, "n_noise": 0, "n_true_clusters": 40}, "per_fold_test_reports": [{"fold_id": 0, "regime": "full-dataset", "ari": 0.6370946321203487, "nmi": 0.8705842700000564, "fmi": 0.6469165218119676, "silhouette": 0.08336355537176132, "n": 400}], "composite_fingerprint": "clustering-ari-floor0.3"}
{"experiment_num": 118, "backbone": "birch_hc_tight_threshold0.02_on_DINOv2", "description": "Birch hill-climb: tight threshold=0.02 on DINOv2 on DINOv2 ViT-S/14", "config": {"backbone": "birch_hill_climb", "axis": "tight threshold=0.02 on DINOv2", "model": "DINOv2 ViT-S/14"}, "composite": 0.6370946321203487, "val_primary": 0.08336354047060013, "test_primary": 0.6370946321203487, "per_fold_test": [0.6370946321203487], "per_fold_val": [0.08336354047060013], "status": "KEEP", "seconds_elapsed": 0.03467822074890137, "timestamp": "2026-04-26T01:26:24", "secondary_metrics": {"ari": 0.6370946321203487, "nmi": 0.8705842700000564, "fmi": 0.6469165218119676, "homogeneity": 0.863755068406218, "completeness": 0.877522321136698, "v_measure": 0.8705842700000566, "silhouette": 0.08336354047060013, "n_pred_clusters": 40, "n_noise": 0, "n_true_clusters": 40}, "per_fold_test_reports": [{"fold_id": 0, "regime": "full-dataset", "ari": 0.6370946321203487, "nmi": 0.8705842700000564, "fmi": 0.6469165218119676, "silhouette": 0.08336354047060013, "n": 400}], "composite_fingerprint": "clustering-ari-floor0.3"}
{"experiment_num": 119, "backbone": "birch_hc_tight_threshold0.03_on_DINOv2", "description": "Birch hill-climb: tight threshold=0.03 on DINOv2 on DINOv2 ViT-S/14", "config": {"backbone": "birch_hill_climb", "axis": "tight threshold=0.03 on DINOv2", "model": "DINOv2 ViT-S/14"}, "composite": 0.6370946321203487, "val_primary": 0.08336354047060013, "test_primary": 0.6370946321203487, "per_fold_test": [0.6370946321203487], "per_fold_val": [0.08336354047060013], "status": "KEEP", "seconds_elapsed": 0.03955698013305664, "timestamp": "2026-04-26T01:26:24", "secondary_metrics": {"ari": 0.6370946321203487, "nmi": 0.8705842700000564, "fmi": 0.6469165218119676, "homogeneity": 0.863755068406218, "completeness": 0.877522321136698, "v_measure": 0.8705842700000566, "silhouette": 0.08336354047060013, "n_pred_clusters": 40, "n_noise": 0, "n_true_clusters": 40}, "per_fold_test_reports": [{"fold_id": 0, "regime": "full-dataset", "ari": 0.6370946321203487, "nmi": 0.8705842700000564, "fmi": 0.6469165218119676, "silhouette": 0.08336354047060013, "n": 400}], "composite_fingerprint": "clustering-ari-floor0.3"}
{"experiment_num": 120, "backbone": "birch_hc_tight_threshold0.04_on_DINOv2", "description": "Birch hill-climb: tight threshold=0.04 on DINOv2 on DINOv2 ViT-S/14", "config": {"backbone": "birch_hill_climb", "axis": "tight threshold=0.04 on DINOv2", "model": "DINOv2 ViT-S/14"}, "composite": 0.6370946321203487, "val_primary": 0.08336354047060013, "test_primary": 0.6370946321203487, "per_fold_test": [0.6370946321203487], "per_fold_val": [0.08336354047060013], "status": "KEEP", "seconds_elapsed": 0.04173874855041504, "timestamp": "2026-04-26T01:26:24", "secondary_metrics": {"ari": 0.6370946321203487, "nmi": 0.8705842700000564, "fmi": 0.6469165218119676, "homogeneity": 0.863755068406218, "completeness": 0.877522321136698, "v_measure": 0.8705842700000566, "silhouette": 0.08336354047060013, "n_pred_clusters": 40, "n_noise": 0, "n_true_clusters": 40}, "per_fold_test_reports": [{"fold_id": 0, "regime": "full-dataset", "ari": 0.6370946321203487, "nmi": 0.8705842700000564, "fmi": 0.6469165218119676, "silhouette": 0.08336354047060013, "n": 400}], "composite_fingerprint": "clustering-ari-floor0.3"}
{"experiment_num": 121, "backbone": "birch_hc_tight_threshold0.05_on_DINOv2", "description": "Birch hill-climb: tight threshold=0.05 on DINOv2 on DINOv2 ViT-S/14", "config": {"backbone": "birch_hill_climb", "axis": "tight threshold=0.05 on DINOv2", "model": "DINOv2 ViT-S/14"}, "composite": 0.6370946321203487, "val_primary": 0.08336355537176132, "test_primary": 0.6370946321203487, "per_fold_test": [0.6370946321203487], "per_fold_val": [0.08336355537176132], "status": "KEEP", "seconds_elapsed": 0.03541088104248047, "timestamp": "2026-04-26T01:26:24", "secondary_metrics": {"ari": 0.6370946321203487, "nmi": 0.8705842700000564, "fmi": 0.6469165218119676, "homogeneity": 0.863755068406218, "completeness": 0.877522321136698, "v_measure": 0.8705842700000566, "silhouette": 0.08336355537176132, "n_pred_clusters": 40, "n_noise": 0, "n_true_clusters": 40}, "per_fold_test_reports": [{"fold_id": 0, "regime": "full-dataset", "ari": 0.6370946321203487, "nmi": 0.8705842700000564, "fmi": 0.6469165218119676, "silhouette": 0.08336355537176132, "n": 400}], "composite_fingerprint": "clustering-ari-floor0.3"}
{"experiment_num": 122, "backbone": "umap_hc_n_neighbors=5_on_DINOv2", "description": "UMAP HC: n_neighbors=5 on DINOv2 on DINOv2 ViT-S/14", "config": {"backbone": "umap_hill_climb", "axis": "n_neighbors=5 on DINOv2", "model": "DINOv2 ViT-S/14"}, "composite": 0.6108865934340282, "val_primary": 0.07555730640888214, "test_primary": 0.6108865934340282, "per_fold_test": [0.6108865934340282], "per_fold_val": [0.07555730640888214], "status": "KEEP", "seconds_elapsed": 20.464459896087646, "timestamp": "2026-04-26T01:28:53", "secondary_metrics": {"ari": 0.6108865934340282, "nmi": 0.8624092599955779, "fmi": 0.6229211606681023, "homogeneity": 0.8523428039217118, "completeness": 0.87271633433718, "v_measure": 0.8624092599955779, "silhouette": 0.07555730640888214, "n_pred_clusters": 40, "n_noise": 0, "n_true_clusters": 40}, "per_fold_test_reports": [{"fold_id": 0, "regime": "full-dataset", "ari": 0.6108865934340282, "nmi": 0.8624092599955779, "fmi": 0.6229211606681023, "silhouette": 0.07555730640888214, "n": 400}], "composite_fingerprint": "clustering-ari-floor0.3"}
{"experiment_num": 123, "backbone": "umap_hc_n_neighbors=10_on_DINOv2", "description": "UMAP HC: n_neighbors=10 on DINOv2 on DINOv2 ViT-S/14", "config": {"backbone": "umap_hill_climb", "axis": "n_neighbors=10 on DINOv2", "model": "DINOv2 ViT-S/14"}, "composite": 0.6488416602393807, "val_primary": 0.08130040764808655, "test_primary": 0.6488416602393807, "per_fold_test": [0.6488416602393807], "per_fold_val": [0.08130040764808655], "status": "KEEP", "seconds_elapsed": 0.49717187881469727, "timestamp": "2026-04-26T01:28:54", "secondary_metrics": {"ari": 0.6488416602393807, "nmi": 0.8693031441933706, "fmi": 0.6578272478818714, "homogeneity": 0.8637340141329612, "completeness": 0.874944556888983, "v_measure": 0.8693031441933707, "silhouette": 0.08130040764808655, "n_pred_clusters": 40, "n_noise": 0, "n_true_clusters": 40}, "per_fold_test_reports": [{"fold_id": 0, "regime": "full-dataset", "ari": 0.6488416602393807, "nmi": 0.8693031441933706, "fmi": 0.6578272478818714, "silhouette": 0.08130040764808655, "n": 400}], "composite_fingerprint": "clustering-ari-floor0.3"}
{"experiment_num": 124, "backbone": "umap_hc_n_neighbors=30_on_DINOv2", "description": "UMAP HC: n_neighbors=30 on DINOv2 on DINOv2 ViT-S/14", "config": {"backbone": "umap_hill_climb", "axis": "n_neighbors=30 on DINOv2", "model": "DINOv2 ViT-S/14"}, "composite": 0.5679963421224004, "val_primary": 0.031733300536870956, "test_primary": 0.5679963421224004, "per_fold_test": [0.5679963421224004], "per_fold_val": [0.031733300536870956], "status": "KEEP", "seconds_elapsed": 0.6743700504302979, "timestamp": "2026-04-26T01:28:54", "secondary_metrics": {"ari": 0.5679963421224004, "nmi": 0.8311288498884076, "fmi": 0.5801195798915164, "homogeneity": 0.8236058693131498, "completeness": 0.8387905301901679, "v_measure": 0.8311288498884075, "silhouette": 0.031733300536870956, "n_pred_clusters": 40, "n_noise": 0, "n_true_clusters": 40}, "per_fold_test_reports": [{"fold_id": 0, "regime": "full-dataset", "ari": 0.5679963421224004, "nmi": 0.8311288498884076, "fmi": 0.5801195798915164, "silhouette": 0.031733300536870956, "n": 400}], "composite_fingerprint": "clustering-ari-floor0.3"}
{"experiment_num": 125, "backbone": "umap_hc_n_neighbors=50_on_DINOv2", "description": "UMAP HC: n_neighbors=50 on DINOv2 on DINOv2 ViT-S/14", "config": {"backbone": "umap_hill_climb", "axis": "n_neighbors=50 on DINOv2", "model": "DINOv2 ViT-S/14"}, "composite": 0.5689911607153654, "val_primary": 0.05129111185669899, "test_primary": 0.5689911607153654, "per_fold_test": [0.5689911607153654], "per_fold_val": [0.05129111185669899], "status": "KEEP", "seconds_elapsed": 0.7436747550964355, "timestamp": "2026-04-26T01:28:55", "secondary_metrics": {"ari": 0.5689911607153654, "nmi": 0.8279012096363452, "fmi": 0.5802575402839499, "homogeneity": 0.8219625925192843, "completeness": 0.8339262633639128, "v_measure": 0.8279012096363451, "silhouette": 0.05129111185669899, "n_pred_clusters": 40, "n_noise": 0, "n_true_clusters": 40}, "per_fold_test_reports": [{"fold_id": 0, "regime": "full-dataset", "ari": 0.5689911607153654, "nmi": 0.8279012096363452, "fmi": 0.5802575402839499, "silhouette": 0.05129111185669899, "n": 400}], "composite_fingerprint": "clustering-ari-floor0.3"}
{"experiment_num": 126, "backbone": "umap_hc_min_dist=0.0_on_DINOv2", "description": "UMAP HC: min_dist=0.0 on DINOv2 on DINOv2 ViT-S/14", "config": {"backbone": "umap_hill_climb", "axis": "min_dist=0.0 on DINOv2", "model": "DINOv2 ViT-S/14"}, "composite": 0.6247032892505934, "val_primary": 0.07407369464635849, "test_primary": 0.6247032892505934, "per_fold_test": [0.6247032892505934], "per_fold_val": [0.07407369464635849], "status": "KEEP", "seconds_elapsed": 0.5856659412384033, "timestamp": "2026-04-26T01:28:56", "secondary_metrics": {"ari": 0.6247032892505934, "nmi": 0.8606129601521761, "fmi": 0.6346653442613274, "homogeneity": 0.8540074519028799, "completeness": 0.8673214484325151, "v_measure": 0.8606129601521761, "silhouette": 0.07407369464635849, "n_pred_clusters": 40, "n_noise": 0, "n_true_clusters": 40}, "per_fold_test_reports": [{"fold_id": 0, "regime": "full-dataset", "ari": 0.6247032892505934, "nmi": 0.8606129601521761, "fmi": 0.6346653442613274, "silhouette": 0.07407369464635849, "n": 400}], "composite_fingerprint": "clustering-ari-floor0.3"}
{"experiment_num": 127, "backbone": "umap_hc_min_dist=0.3_on_DINOv2", "description": "UMAP HC: min_dist=0.3 on DINOv2 on DINOv2 ViT-S/14", "config": {"backbone": "umap_hill_climb", "axis": "min_dist=0.3 on DINOv2", "model": "DINOv2 ViT-S/14"}, "composite": 0.5949103828190492, "val_primary": 0.04385240375995636, "test_primary": 0.5949103828190492, "per_fold_test": [0.5949103828190492], "per_fold_val": [0.04385240375995636], "status": "KEEP", "seconds_elapsed": 0.5453653335571289, "timestamp": "2026-04-26T01:28:56", "secondary_metrics": {"ari": 0.5949103828190492, "nmi": 0.8437797940279815, "fmi": 0.6060395866463875, "homogeneity": 0.8362481254963251, "completeness": 0.851448363499384, "v_measure": 0.8437797940279815, "silhouette": 0.04385240375995636, "n_pred_clusters": 40, "n_noise": 0, "n_true_clusters": 40}, "per_fold_test_reports": [{"fold_id": 0, "regime": "full-dataset", "ari": 0.5949103828190492, "nmi": 0.8437797940279815, "fmi": 0.6060395866463875, "silhouette": 0.04385240375995636, "n": 400}], "composite_fingerprint": "clustering-ari-floor0.3"}
{"experiment_num": 128, "backbone": "umap_hc_min_dist=0.5_on_DINOv2", "description": "UMAP HC: min_dist=0.5 on DINOv2 on DINOv2 ViT-S/14", "config": {"backbone": "umap_hill_climb", "axis": "min_dist=0.5 on DINOv2", "model": "DINOv2 ViT-S/14"}, "composite": 0.6155961350872897, "val_primary": 0.0616922527551651, "test_primary": 0.6155961350872897, "per_fold_test": [0.6155961350872897], "per_fold_val": [0.0616922527551651], "status": "KEEP", "seconds_elapsed": 0.5433650016784668, "timestamp": "2026-04-26T01:28:57", "secondary_metrics": {"ari": 0.6155961350872897, "nmi": 0.8514044522474358, "fmi": 0.626009380101908, "homogeneity": 0.8445683637871578, "completeness": 0.8583521088227621, "v_measure": 0.8514044522474359, "silhouette": 0.0616922527551651, "n_pred_clusters": 40, "n_noise": 0, "n_true_clusters": 40}, "per_fold_test_reports": [{"fold_id": 0, "regime": "full-dataset", "ari": 0.6155961350872897, "nmi": 0.8514044522474358, "fmi": 0.626009380101908, "silhouette": 0.0616922527551651, "n": 400}], "composite_fingerprint": "clustering-ari-floor0.3"}
{"experiment_num": 129, "backbone": "umap_hc_min_dist=0.99_on_DINOv2", "description": "UMAP HC: min_dist=0.99 on DINOv2 on DINOv2 ViT-S/14", "config": {"backbone": "umap_hill_climb", "axis": "min_dist=0.99 on DINOv2", "model": "DINOv2 ViT-S/14"}, "composite": 0.5664928292046936, "val_primary": 0.06728636473417282, "test_primary": 0.5664928292046936, "per_fold_test": [0.5664928292046936], "per_fold_val": [0.06728636473417282], "status": "KEEP", "seconds_elapsed": 0.5537798404693604, "timestamp": "2026-04-26T01:28:58", "secondary_metrics": {"ari": 0.5664928292046936, "nmi": 0.8257637910973668, "fmi": 0.577175355150449, "homogeneity": 0.8212780030673387, "completeness": 0.830298850640712, "v_measure": 0.8257637910973666, "silhouette": 0.06728636473417282, "n_pred_clusters": 40, "n_noise": 0, "n_true_clusters": 40}, "per_fold_test_reports": [{"fold_id": 0, "regime": "full-dataset", "ari": 0.5664928292046936, "nmi": 0.8257637910973668, "fmi": 0.577175355150449, "silhouette": 0.06728636473417282, "n": 400}], "composite_fingerprint": "clustering-ari-floor0.3"}
{"experiment_num": 130, "backbone": "umap_hc_n_components=3_on_DINOv2", "description": "UMAP HC: n_components=3 on DINOv2 on DINOv2 ViT-S/14", "config": {"backbone": "umap_hill_climb", "axis": "n_components=3 on DINOv2", "model": "DINOv2 ViT-S/14"}, "composite": 0.6176554016130104, "val_primary": 0.04487054795026779, "test_primary": 0.6176554016130104, "per_fold_test": [0.6176554016130104], "per_fold_val": [0.04487054795026779], "status": "KEEP", "seconds_elapsed": 0.5073153972625732, "timestamp": "2026-04-26T01:28:58", "secondary_metrics": {"ari": 0.6176554016130104, "nmi": 0.8508482373359679, "fmi": 0.6279194996011035, "homogeneity": 0.8444315172956607, "completeness": 0.8573632236508338, "v_measure": 0.8508482373359679, "silhouette": 0.04487054795026779, "n_pred_clusters": 40, "n_noise": 0, "n_true_clusters": 40}, "per_fold_test_reports": [{"fold_id": 0, "regime": "full-dataset", "ari": 0.6176554016130104, "nmi": 0.8508482373359679, "fmi": 0.6279194996011035, "silhouette": 0.04487054795026779, "n": 400}], "composite_fingerprint": "clustering-ari-floor0.3"}
{"experiment_num": 131, "backbone": "umap_hc_n_components=5_on_DINOv2", "description": "UMAP HC: n_components=5 on DINOv2 on DINOv2 ViT-S/14", "config": {"backbone": "umap_hill_climb", "axis": "n_components=5 on DINOv2", "model": "DINOv2 ViT-S/14"}, "composite": 0.5859589706576354, "val_primary": 0.0479840487241745, "test_primary": 0.5859589706576354, "per_fold_test": [0.5859589706576354], "per_fold_val": [0.0479840487241745], "status": "KEEP", "seconds_elapsed": 0.5548348426818848, "timestamp": "2026-04-26T01:28:59", "secondary_metrics": {"ari": 0.5859589706576354, "nmi": 0.8412092326587306, "fmi": 0.5976062829448404, "homogeneity": 0.8334068207355662, "completeness": 0.8491591186776457, "v_measure": 0.8412092326587305, "silhouette": 0.0479840487241745, "n_pred_clusters": 40, "n_noise": 0, "n_true_clusters": 40}, "per_fold_test_reports": [{"fold_id": 0, "regime": "full-dataset", "ari": 0.5859589706576354, "nmi": 0.8412092326587306, "fmi": 0.5976062829448404, "silhouette": 0.0479840487241745, "n": 400}], "composite_fingerprint": "clustering-ari-floor0.3"}
{"experiment_num": 132, "backbone": "umap_hc_n_components=30_on_DINOv2", "description": "UMAP HC: n_components=30 on DINOv2 on DINOv2 ViT-S/14", "config": {"backbone": "umap_hill_climb", "axis": "n_components=30 on DINOv2", "model": "DINOv2 ViT-S/14"}, "composite": 0.5980366890799615, "val_primary": 0.06160927191376686, "test_primary": 0.5980366890799615, "per_fold_test": [0.5980366890799615], "per_fold_val": [0.06160927191376686], "status": "KEEP", "seconds_elapsed": 0.6499335765838623, "timestamp": "2026-04-26T01:29:00", "secondary_metrics": {"ari": 0.5980366890799615, "nmi": 0.8494981026564367, "fmi": 0.6102781976973535, "homogeneity": 0.8393624283244171, "completeness": 0.8598815545563413, "v_measure": 0.8494981026564367, "silhouette": 0.06160927191376686, "n_pred_clusters": 40, "n_noise": 0, "n_true_clusters": 40}, "per_fold_test_reports": [{"fold_id": 0, "regime": "full-dataset", "ari": 0.5980366890799615, "nmi": 0.8494981026564367, "fmi": 0.6102781976973535, "silhouette": 0.06160927191376686, "n": 400}], "composite_fingerprint": "clustering-ari-floor0.3"}
{"experiment_num": 133, "backbone": "umap_hc_n_components=50_on_DINOv2", "description": "UMAP HC: n_components=50 on DINOv2 on DINOv2 ViT-S/14", "config": {"backbone": "umap_hill_climb", "axis": "n_components=50 on DINOv2", "model": "DINOv2 ViT-S/14"}, "composite": 0.6107242710418483, "val_primary": 0.05939953401684761, "test_primary": 0.6107242710418483, "per_fold_test": [0.6107242710418483], "per_fold_val": [0.05939953401684761], "status": "KEEP", "seconds_elapsed": 0.7395665645599365, "timestamp": "2026-04-26T01:29:00", "secondary_metrics": {"ari": 0.6107242710418483, "nmi": 0.8452924265274665, "fmi": 0.6204585825377015, "homogeneity": 0.8404319998056051, "completeness": 0.850209398370487, "v_measure": 0.8452924265274666, "silhouette": 0.05939953401684761, "n_pred_clusters": 40, "n_noise": 0, "n_true_clusters": 40}, "per_fold_test_reports": [{"fold_id": 0, "regime": "full-dataset", "ari": 0.6107242710418483, "nmi": 0.8452924265274665, "fmi": 0.6204585825377015, "silhouette": 0.05939953401684761, "n": 400}], "composite_fingerprint": "clustering-ari-floor0.3"}
{"experiment_num": 134, "backbone": "umap_hc_metric=cosine", "description": "UMAP HC: metric=cosine on DINOv2 ViT-S/14", "config": {"backbone": "umap_hill_climb", "axis": "metric=cosine", "model": "DINOv2 ViT-S/14"}, "composite": 0.5999664681012663, "val_primary": 0.0677071139216423, "test_primary": 0.5999664681012663, "per_fold_test": [0.5999664681012663], "per_fold_val": [0.0677071139216423], "status": "KEEP", "seconds_elapsed": 0.6613152027130127, "timestamp": "2026-04-26T01:29:01", "secondary_metrics": {"ari": 0.5999664681012663, "nmi": 0.842116328767088, "fmi": 0.6104470341463217, "homogeneity": 0.835324837812192, "completeness": 0.8490191594756955, "v_measure": 0.842116328767088, "silhouette": 0.0677071139216423, "n_pred_clusters": 40, "n_noise": 0, "n_true_clusters": 40}, "per_fold_test_reports": [{"fold_id": 0, "regime": "full-dataset", "ari": 0.5999664681012663, "nmi": 0.842116328767088, "fmi": 0.6104470341463217, "silhouette": 0.0677071139216423, "n": 400}], "composite_fingerprint": "clustering-ari-floor0.3"}
{"experiment_num": 135, "backbone": "umap_hc_metric=manhattan", "description": "UMAP HC: metric=manhattan on DINOv2 ViT-S/14", "config": {"backbone": "umap_hill_climb", "axis": "metric=manhattan", "model": "DINOv2 ViT-S/14"}, "composite": 0.6371000116152775, "val_primary": 0.062079425901174545, "test_primary": 0.6371000116152775, "per_fold_test": [0.6371000116152775], "per_fold_val": [0.062079425901174545], "status": "KEEP", "seconds_elapsed": 0.621269702911377, "timestamp": "2026-04-26T01:29:02", "secondary_metrics": {"ari": 0.6371000116152775, "nmi": 0.8578663118650939, "fmi": 0.6463990076210717, "homogeneity": 0.8527506709452395, "completeness": 0.8630437005445238, "v_measure": 0.857866311865094, "silhouette": 0.062079425901174545, "n_pred_clusters": 40, "n_noise": 0, "n_true_clusters": 40}, "per_fold_test_reports": [{"fold_id": 0, "regime": "full-dataset", "ari": 0.6371000116152775, "nmi": 0.8578663118650939, "fmi": 0.6463990076210717, "silhouette": 0.062079425901174545, "n": 400}], "composite_fingerprint": "clustering-ari-floor0.3"}
{"experiment_num": 136, "backbone": "umap_hc_UMAP(10)_+_Spectral_cosine_dow", "description": "UMAP HC: UMAP(10) + Spectral cosine downstream on DINOv2 ViT-S/14", "config": {"backbone": "umap_hill_climb", "axis": "UMAP(10) + Spectral cosine downstream", "model": "DINOv2 ViT-S/14"}, "composite": 0.19180532552925836, "val_primary": -0.10804139822721481, "test_primary": 0.19180532552925836, "per_fold_test": [0.19180532552925836], "per_fold_val": [-0.10804139822721481], "status": "DISCARD", "seconds_elapsed": 0.6937227249145508, "timestamp": "2026-04-26T01:29:03", "secondary_metrics": {"ari": 0.19180532552925836, "nmi": 0.6401028798076009, "fmi": 0.3103057601409996, "homogeneity": 0.5275745945160811, "completeness": 0.8136490067674756, "v_measure": 0.6401028798076009, "silhouette": -0.10804139822721481, "n_pred_clusters": 40, "n_noise": 0, "n_true_clusters": 40}, "per_fold_test_reports": [{"fold_id": 0, "regime": "full-dataset", "ari": 0.19180532552925836, "nmi": 0.6401028798076009, "fmi": 0.3103057601409996, "silhouette": -0.10804139822721481, "n": 400}], "composite_fingerprint": "clustering-ari-floor0.3"}
