{"experiment_num": 78, "backbone": "ward_hc_linkagesingle_on_DINOv2", "description": "Ward hill-climb: linkage=single on DINOv2 on DINOv2 384-dim", "config": {"backbone": "ward_hill_climb", "axis": "linkage=single on DINOv2", "model": "DINOv2 384-dim"}, "composite": 0.14808570849546465, "val_primary": -0.11194010078907013, "test_primary": 0.14808570849546465, "per_fold_test": [0.14808570849546465], "per_fold_val": [-0.11194010078907013], "status": "DISCARD", "seconds_elapsed": 0.013514995574951172, "timestamp": "2026-04-26T01:26:16", "secondary_metrics": {"ari": 0.14808570849546465, "nmi": 0.6689162585111303, "fmi": 0.2801358907466468, "homogeneity": 0.5522449479256183, "completeness": 0.8480899500803303, "v_measure": 0.6689162585111302, "silhouette": -0.11194010078907013, "n_pred_clusters": 40, "n_noise": 0, "n_true_clusters": 40}, "per_fold_test_reports": [{"fold_id": 0, "regime": "full-dataset", "ari": 0.14808570849546465, "nmi": 0.6689162585111303, "fmi": 0.2801358907466468, "silhouette": -0.11194010078907013, "n": 400}], "composite_fingerprint": "clustering-ari-floor0.3"}
{"experiment_num": 79, "backbone": "ward_hc_linkagesingle_on_DINOv2_L2-nor", "description": "Ward hill-climb: linkage=single on DINOv2 L2-norm on DINOv2 L2-norm 384-dim", "config": {"backbone": "ward_hill_climb", "axis": "linkage=single on DINOv2 L2-norm", "model": "DINOv2 L2-norm 384-dim"}, "composite": 0.14373671483680803, "val_primary": -0.11189720034599304, "test_primary": 0.14373671483680803, "per_fold_test": [0.14373671483680803], "per_fold_val": [-0.11189720034599304], "status": "DISCARD", "seconds_elapsed": 0.014562129974365234, "timestamp": "2026-04-26T01:26:17", "secondary_metrics": {"ari": 0.14373671483680803, "nmi": 0.6625297036014104, "fmi": 0.27428797630149837, "homogeneity": 0.5466874556796314, "completeness": 0.8406654442297996, "v_measure": 0.6625297036014104, "silhouette": -0.11189720034599304, "n_pred_clusters": 40, "n_noise": 0, "n_true_clusters": 40}, "per_fold_test_reports": [{"fold_id": 0, "regime": "full-dataset", "ari": 0.14373671483680803, "nmi": 0.6625297036014104, "fmi": 0.27428797630149837, "silhouette": -0.11189720034599304, "n": 400}], "composite_fingerprint": "clustering-ari-floor0.3"}
{"experiment_num": 80, "backbone": "ward_hc_linkageaverage_+_cosine_distan", "description": "Ward hill-climb: linkage=average + cosine distance on DINOv2 ViT-S/14", "config": {"backbone": "ward_hill_climb", "axis": "linkage=average + cosine distance", "model": "DINOv2 ViT-S/14"}, "composite": 0.44904197209407637, "val_primary": 0.013399893417954445, "test_primary": 0.44904197209407637, "per_fold_test": [0.44904197209407637], "per_fold_val": [0.013399893417954445], "status": "KEEP", "seconds_elapsed": 0.008054494857788086, "timestamp": "2026-04-26T01:26:17", "secondary_metrics": {"ari": 0.44904197209407637, "nmi": 0.8173641124113944, "fmi": 0.48904159789519674, "homogeneity": 0.7812186004669621, "completeness": 0.857016657568678, "v_measure": 0.8173641124113944, "silhouette": 0.013399893417954445, "n_pred_clusters": 40, "n_noise": 0, "n_true_clusters": 40}, "per_fold_test_reports": [{"fold_id": 0, "regime": "full-dataset", "ari": 0.44904197209407637, "nmi": 0.8173641124113944, "fmi": 0.48904159789519674, "silhouette": 0.013399893417954445, "n": 400}], "composite_fingerprint": "clustering-ari-floor0.3"}
{"experiment_num": 81, "backbone": "ward_hc_linkagecomplete_+_cosine_dista", "description": "Ward hill-climb: linkage=complete + cosine distance on DINOv2 ViT-S/14", "config": {"backbone": "ward_hill_climb", "axis": "linkage=complete + cosine distance", "model": "DINOv2 ViT-S/14"}, "composite": 0.49255438897721643, "val_primary": 0.030587714165449142, "test_primary": 0.49255438897721643, "per_fold_test": [0.49255438897721643], "per_fold_val": [0.030587714165449142], "status": "KEEP", "seconds_elapsed": 0.008029460906982422, "timestamp": "2026-04-26T01:26:17", "secondary_metrics": {"ari": 0.49255438897721643, "nmi": 0.8111708824943628, "fmi": 0.5106832724613869, "homogeneity": 0.7937208943695052, "completeness": 0.8294053959263217, "v_measure": 0.8111708824943628, "silhouette": 0.030587714165449142, "n_pred_clusters": 40, "n_noise": 0, "n_true_clusters": 40}, "per_fold_test_reports": [{"fold_id": 0, "regime": "full-dataset", "ari": 0.49255438897721643, "nmi": 0.8111708824943628, "fmi": 0.5106832724613869, "silhouette": 0.030587714165449142, "n": 400}], "composite_fingerprint": "clustering-ari-floor0.3"}
{"experiment_num": 82, "backbone": "ward_hc_linkagesingle_+_cosine_distanc", "description": "Ward hill-climb: linkage=single + cosine distance on DINOv2 ViT-S/14", "config": {"backbone": "ward_hill_climb", "axis": "linkage=single + cosine distance", "model": "DINOv2 ViT-S/14"}, "composite": 0.14373671483680803, "val_primary": -0.11189719289541245, "test_primary": 0.14373671483680803, "per_fold_test": [0.14373671483680803], "per_fold_val": [-0.11189719289541245], "status": "DISCARD", "seconds_elapsed": 0.0070307254791259766, "timestamp": "2026-04-26T01:26:17", "secondary_metrics": {"ari": 0.14373671483680803, "nmi": 0.6625297036014104, "fmi": 0.27428797630149837, "homogeneity": 0.5466874556796314, "completeness": 0.8406654442297996, "v_measure": 0.6625297036014104, "silhouette": -0.11189719289541245, "n_pred_clusters": 40, "n_noise": 0, "n_true_clusters": 40}, "per_fold_test_reports": [{"fold_id": 0, "regime": "full-dataset", "ari": 0.14373671483680803, "nmi": 0.6625297036014104, "fmi": 0.27428797630149837, "silhouette": -0.11189719289541245, "n": 400}], "composite_fingerprint": "clustering-ari-floor0.3"}
{"experiment_num": 83, "backbone": "ward_hc_linkageaverage_+_manhattan_dis", "description": "Ward hill-climb: linkage=average + manhattan distance on DINOv2 ViT-S/14", "config": {"backbone": "ward_hill_climb", "axis": "linkage=average + manhattan distance", "model": "DINOv2 ViT-S/14"}, "composite": 0.4540464288999969, "val_primary": 0.012884939089417458, "test_primary": 0.4540464288999969, "per_fold_test": [0.4540464288999969], "per_fold_val": [0.012884939089417458], "status": "KEEP", "seconds_elapsed": 0.009000539779663086, "timestamp": "2026-04-26T01:26:17", "secondary_metrics": {"ari": 0.4540464288999969, "nmi": 0.8205974510198831, "fmi": 0.49671863096341046, "homogeneity": 0.7809861341933176, "completeness": 0.8644415968662083, "v_measure": 0.8205974510198829, "silhouette": 0.012884939089417458, "n_pred_clusters": 40, "n_noise": 0, "n_true_clusters": 40}, "per_fold_test_reports": [{"fold_id": 0, "regime": "full-dataset", "ari": 0.4540464288999969, "nmi": 0.8205974510198831, "fmi": 0.49671863096341046, "silhouette": 0.012884939089417458, "n": 400}], "composite_fingerprint": "clustering-ari-floor0.3"}
{"experiment_num": 84, "backbone": "ward_hc_linkageward_on_PCA(20)", "description": "Ward hill-climb: linkage=ward on PCA(20) on raw pixels \u2192 PCA(20)", "config": {"backbone": "ward_hill_climb", "axis": "linkage=ward on PCA(20)", "model": "raw pixels \u2192 PCA(20)"}, "composite": 0.4508223791620409, "val_primary": 0.15805934369564056, "test_primary": 0.4508223791620409, "per_fold_test": [0.4508223791620409], "per_fold_val": [0.15805934369564056], "status": "KEEP", "seconds_elapsed": 0.0019931793212890625, "timestamp": "2026-04-26T01:26:17", "secondary_metrics": {"ari": 0.4508223791620409, "nmi": 0.7909569819942255, "fmi": 0.46875260329200175, "homogeneity": 0.7777836229497203, "completeness": 0.8045842648132536, "v_measure": 0.7909569819942255, "silhouette": 0.15805934369564056, "n_pred_clusters": 40, "n_noise": 0, "n_true_clusters": 40}, "per_fold_test_reports": [{"fold_id": 0, "regime": "full-dataset", "ari": 0.4508223791620409, "nmi": 0.7909569819942255, "fmi": 0.46875260329200175, "silhouette": 0.15805934369564056, "n": 400}], "composite_fingerprint": "clustering-ari-floor0.3"}
{"experiment_num": 85, "backbone": "ward_hc_linkageward_on_PCA(50)", "description": "Ward hill-climb: linkage=ward on PCA(50) on raw pixels \u2192 PCA(50)", "config": {"backbone": "ward_hill_climb", "axis": "linkage=ward on PCA(50)", "model": "raw pixels \u2192 PCA(50)"}, "composite": 0.5159317404094375, "val_primary": 0.16078919172286987, "test_primary": 0.5159317404094375, "per_fold_test": [0.5159317404094375], "per_fold_val": [0.16078919172286987], "status": "KEEP", "seconds_elapsed": 0.0029973983764648438, "timestamp": "2026-04-26T01:26:17", "secondary_metrics": {"ari": 0.5159317404094375, "nmi": 0.8201138995109474, "fmi": 0.5323529411764706, "homogeneity": 0.8064507705391477, "completeness": 0.834247977028138, "v_measure": 0.8201138995109474, "silhouette": 0.16078919172286987, "n_pred_clusters": 40, "n_noise": 0, "n_true_clusters": 40}, "per_fold_test_reports": [{"fold_id": 0, "regime": "full-dataset", "ari": 0.5159317404094375, "nmi": 0.8201138995109474, "fmi": 0.5323529411764706, "silhouette": 0.16078919172286987, "n": 400}], "composite_fingerprint": "clustering-ari-floor0.3"}
{"experiment_num": 86, "backbone": "ward_hc_linkageward_on_PCA(100)", "description": "Ward hill-climb: linkage=ward on PCA(100) on raw pixels \u2192 PCA(100)", "config": {"backbone": "ward_hill_climb", "axis": "linkage=ward on PCA(100)", "model": "raw pixels \u2192 PCA(100)"}, "composite": 0.47368049126922995, "val_primary": 0.16557157039642334, "test_primary": 0.47368049126922995, "per_fold_test": [0.47368049126922995], "per_fold_val": [0.16557157039642334], "status": "KEEP", "seconds_elapsed": 0.003177642822265625, "timestamp": "2026-04-26T01:26:17", "secondary_metrics": {"ari": 0.47368049126922995, "nmi": 0.808118054169169, "fmi": 0.4954336150369575, "homogeneity": 0.789810089398023, "completeness": 0.8272949253590074, "v_measure": 0.8081180541691692, "silhouette": 0.16557157039642334, "n_pred_clusters": 40, "n_noise": 0, "n_true_clusters": 40}, "per_fold_test_reports": [{"fold_id": 0, "regime": "full-dataset", "ari": 0.47368049126922995, "nmi": 0.808118054169169, "fmi": 0.4954336150369575, "silhouette": 0.16557157039642334, "n": 400}], "composite_fingerprint": "clustering-ari-floor0.3"}
{"experiment_num": 87, "backbone": "ward_hc_linkageaverage_+_cosine_on_PCA", "description": "Ward hill-climb: linkage=average + cosine on PCA(20) on raw pixels \u2192 PCA(20)", "config": {"backbone": "ward_hill_climb", "axis": "linkage=average + cosine on PCA(20)", "model": "raw pixels \u2192 PCA(20)"}, "composite": 0.322286785711127, "val_primary": 0.09247531741857529, "test_primary": 0.322286785711127, "per_fold_test": [0.322286785711127], "per_fold_val": [0.09247531741857529], "status": "KEEP", "seconds_elapsed": 0.0019860267639160156, "timestamp": "2026-04-26T01:26:17", "secondary_metrics": {"ari": 0.322286785711127, "nmi": 0.7541789183256542, "fmi": 0.3778713060315504, "homogeneity": 0.7097725547678314, "completeness": 0.8045126197929775, "v_measure": 0.7541789183256541, "silhouette": 0.09247531741857529, "n_pred_clusters": 40, "n_noise": 0, "n_true_clusters": 40}, "per_fold_test_reports": [{"fold_id": 0, "regime": "full-dataset", "ari": 0.322286785711127, "nmi": 0.7541789183256542, "fmi": 0.3778713060315504, "silhouette": 0.09247531741857529, "n": 400}], "composite_fingerprint": "clustering-ari-floor0.3"}
{"experiment_num": 88, "backbone": "ward_hc_linkageaverage_+_cosine_on_PCA", "description": "Ward hill-climb: linkage=average + cosine on PCA(50) on raw pixels \u2192 PCA(50)", "config": {"backbone": "ward_hill_climb", "axis": "linkage=average + cosine on PCA(50)", "model": "raw pixels \u2192 PCA(50)"}, "composite": 0.32289207130815717, "val_primary": 0.09431645274162292, "test_primary": 0.32289207130815717, "per_fold_test": [0.32289207130815717], "per_fold_val": [0.09431645274162292], "status": "KEEP", "seconds_elapsed": 0.003002643585205078, "timestamp": "2026-04-26T01:26:17", "secondary_metrics": {"ari": 0.32289207130815717, "nmi": 0.7547321346216641, "fmi": 0.3756537496667781, "homogeneity": 0.7127726896272035, "completeness": 0.8019407157604387, "v_measure": 0.7547321346216641, "silhouette": 0.09431645274162292, "n_pred_clusters": 40, "n_noise": 0, "n_true_clusters": 40}, "per_fold_test_reports": [{"fold_id": 0, "regime": "full-dataset", "ari": 0.32289207130815717, "nmi": 0.7547321346216641, "fmi": 0.3756537496667781, "silhouette": 0.09431645274162292, "n": 400}], "composite_fingerprint": "clustering-ari-floor0.3"}
{"experiment_num": 89, "backbone": "ward_hc_linkageaverage_+_cosine_on_PCA", "description": "Ward hill-climb: linkage=average + cosine on PCA(100) on raw pixels \u2192 PCA(100)", "config": {"backbone": "ward_hill_climb", "axis": "linkage=average + cosine on PCA(100)", "model": "raw pixels \u2192 PCA(100)"}, "composite": 0.29825761606743184, "val_primary": 0.08991235494613647, "test_primary": 0.29825761606743184, "per_fold_test": [0.29825761606743184], "per_fold_val": [0.08991235494613647], "status": "DISCARD", "seconds_elapsed": 0.0030553340911865234, "timestamp": "2026-04-26T01:26:17", "secondary_metrics": {"ari": 0.29825761606743184, "nmi": 0.7443599011398334, "fmi": 0.3577490605680629, "homogeneity": 0.6972347338789558, "completeness": 0.7983170902733268, "v_measure": 0.7443599011398334, "silhouette": 0.08991235494613647, "n_pred_clusters": 40, "n_noise": 0, "n_true_clusters": 40}, "per_fold_test_reports": [{"fold_id": 0, "regime": "full-dataset", "ari": 0.29825761606743184, "nmi": 0.7443599011398334, "fmi": 0.3577490605680629, "silhouette": 0.08991235494613647, "n": 400}], "composite_fingerprint": "clustering-ari-floor0.3"}
{"experiment_num": 90, "backbone": "ward_hc_Ward_+_connectivity_kNN(k5)_on", "description": "Ward hill-climb: Ward + connectivity kNN(k=5) on DINOv2 on DINOv2 ViT-S/14 + kNN connectivity graph", "config": {"backbone": "ward_hill_climb", "axis": "Ward + connectivity kNN(k=5) on DINOv2", "model": "DINOv2 ViT-S/14 + kNN connectivity graph"}, "composite": 0.6207417284505956, "val_primary": 0.08213134855031967, "test_primary": 0.6207417284505956, "per_fold_test": [0.6207417284505956], "per_fold_val": [0.08213134855031967], "status": "KEEP", "seconds_elapsed": 3.174086809158325, "timestamp": "2026-04-26T01:26:20", "secondary_metrics": {"ari": 0.6207417284505956, "nmi": 0.8637408581898733, "fmi": 0.6310180684126041, "homogeneity": 0.8566995662738787, "completeness": 0.8708988553586562, "v_measure": 0.8637408581898732, "silhouette": 0.08213134855031967, "n_pred_clusters": 40, "n_noise": 0, "n_true_clusters": 40}, "per_fold_test_reports": [{"fold_id": 0, "regime": "full-dataset", "ari": 0.6207417284505956, "nmi": 0.8637408581898733, "fmi": 0.6310180684126041, "silhouette": 0.08213134855031967, "n": 400}], "composite_fingerprint": "clustering-ari-floor0.3"}
{"experiment_num": 91, "backbone": "ward_hc_Ward_+_connectivity_kNN(k10)_o", "description": "Ward hill-climb: Ward + connectivity kNN(k=10) on DINOv2 on DINOv2 ViT-S/14 + kNN connectivity graph", "config": {"backbone": "ward_hill_climb", "axis": "Ward + connectivity kNN(k=10) on DINOv2", "model": "DINOv2 ViT-S/14 + kNN connectivity graph"}, "composite": 0.6370946321203487, "val_primary": 0.08336354047060013, "test_primary": 0.6370946321203487, "per_fold_test": [0.6370946321203487], "per_fold_val": [0.08336354047060013], "status": "KEEP", "seconds_elapsed": 0.07235550880432129, "timestamp": "2026-04-26T01:26:21", "secondary_metrics": {"ari": 0.6370946321203487, "nmi": 0.8705842700000564, "fmi": 0.6469165218119676, "homogeneity": 0.863755068406218, "completeness": 0.877522321136698, "v_measure": 0.8705842700000566, "silhouette": 0.08336354047060013, "n_pred_clusters": 40, "n_noise": 0, "n_true_clusters": 40}, "per_fold_test_reports": [{"fold_id": 0, "regime": "full-dataset", "ari": 0.6370946321203487, "nmi": 0.8705842700000564, "fmi": 0.6469165218119676, "silhouette": 0.08336354047060013, "n": 400}], "composite_fingerprint": "clustering-ari-floor0.3"}
{"experiment_num": 92, "backbone": "ward_hc_Ward_+_connectivity_kNN(k20)_o", "description": "Ward hill-climb: Ward + connectivity kNN(k=20) on DINOv2 on DINOv2 ViT-S/14 + kNN connectivity graph", "config": {"backbone": "ward_hill_climb", "axis": "Ward + connectivity kNN(k=20) on DINOv2", "model": "DINOv2 ViT-S/14 + kNN connectivity graph"}, "composite": 0.6370946321203487, "val_primary": 0.08336355537176132, "test_primary": 0.6370946321203487, "per_fold_test": [0.6370946321203487], "per_fold_val": [0.08336355537176132], "status": "KEEP", "seconds_elapsed": 0.12170290946960449, "timestamp": "2026-04-26T01:26:21", "secondary_metrics": {"ari": 0.6370946321203487, "nmi": 0.8705842700000564, "fmi": 0.6469165218119676, "homogeneity": 0.863755068406218, "completeness": 0.877522321136698, "v_measure": 0.8705842700000566, "silhouette": 0.08336355537176132, "n_pred_clusters": 40, "n_noise": 0, "n_true_clusters": 40}, "per_fold_test_reports": [{"fold_id": 0, "regime": "full-dataset", "ari": 0.6370946321203487, "nmi": 0.8705842700000564, "fmi": 0.6469165218119676, "silhouette": 0.08336355537176132, "n": 400}], "composite_fingerprint": "clustering-ari-floor0.3"}
{"experiment_num": 93, "backbone": "ward_hc_Ward_init_+_KMeans_refine_on_D", "description": "Ward hill-climb: Ward init + KMeans refine on DINOv2 on DINOv2", "config": {"backbone": "ward_hill_climb", "axis": "Ward init + KMeans refine on DINOv2", "model": "DINOv2"}, "composite": 0.6307830528664157, "val_primary": 0.08019530028104782, "test_primary": 0.6307830528664157, "per_fold_test": [0.6307830528664157], "per_fold_val": [0.08019530028104782], "status": "KEEP", "seconds_elapsed": 0.012997627258300781, "timestamp": "2026-04-26T01:26:21", "secondary_metrics": {"ari": 0.6307830528664157, "nmi": 0.8665422994735525, "fmi": 0.6405986998407521, "homogeneity": 0.8601934875314127, "completeness": 0.8729855253395102, "v_measure": 0.8665422994735527, "silhouette": 0.08019530028104782, "n_pred_clusters": 40, "n_noise": 0, "n_true_clusters": 40}, "per_fold_test_reports": [{"fold_id": 0, "regime": "full-dataset", "ari": 0.6307830528664157, "nmi": 0.8665422994735525, "fmi": 0.6405986998407521, "silhouette": 0.08019530028104782, "n": 400}], "composite_fingerprint": "clustering-ari-floor0.3"}
{"experiment_num": 94, "backbone": "ward_hc_Ward_init_+_KMeans_refine_on_D", "description": "Ward hill-climb: Ward init + KMeans refine on DINOv2 L2-norm on DINOv2 L2-norm", "config": {"backbone": "ward_hill_climb", "axis": "Ward init + KMeans refine on DINOv2 L2-norm", "model": "DINOv2 L2-norm"}, "composite": 0.630325214698015, "val_primary": 0.07188493758440018, "test_primary": 0.630325214698015, "per_fold_test": [0.630325214698015], "per_fold_val": [0.07188493758440018], "status": "KEEP", "seconds_elapsed": 0.022000789642333984, "timestamp": "2026-04-26T01:26:21", "secondary_metrics": {"ari": 0.630325214698015, "nmi": 0.8680688294582887, "fmi": 0.6403201169858314, "homogeneity": 0.8614299357143143, "completeness": 0.8748108476104043, "v_measure": 0.8680688294582888, "silhouette": 0.07188493758440018, "n_pred_clusters": 40, "n_noise": 0, "n_true_clusters": 40}, "per_fold_test_reports": [{"fold_id": 0, "regime": "full-dataset", "ari": 0.630325214698015, "nmi": 0.8680688294582887, "fmi": 0.6403201169858314, "silhouette": 0.07188493758440018, "n": 400}], "composite_fingerprint": "clustering-ari-floor0.3"}
{"experiment_num": 95, "backbone": "ward_hc_Ward_init_+_KMeans_refine_on_P", "description": "Ward hill-climb: Ward init + KMeans refine on PCA(50) on PCA(50)", "config": {"backbone": "ward_hill_climb", "axis": "Ward init + KMeans refine on PCA(50)", "model": "PCA(50)"}, "composite": 0.5013288918148893, "val_primary": 0.16391783952713013, "test_primary": 0.5013288918148893, "per_fold_test": [0.5013288918148893], "per_fold_val": [0.16391783952713013], "status": "KEEP", "seconds_elapsed": 0.011267900466918945, "timestamp": "2026-04-26T01:26:21", "secondary_metrics": {"ari": 0.5013288918148893, "nmi": 0.8124133654467769, "fmi": 0.5180252373339234, "homogeneity": 0.7988266558420416, "completeness": 0.8264702464399344, "v_measure": 0.812413365446777, "silhouette": 0.16391783952713013, "n_pred_clusters": 40, "n_noise": 0, "n_true_clusters": 40}, "per_fold_test_reports": [{"fold_id": 0, "regime": "full-dataset", "ari": 0.5013288918148893, "nmi": 0.8124133654467769, "fmi": 0.5180252373339234, "silhouette": 0.16391783952713013, "n": 400}], "composite_fingerprint": "clustering-ari-floor0.3"}
{"experiment_num": 96, "backbone": "ward_hc_Ward_init_+_KMeans_refine_on_P", "description": "Ward hill-climb: Ward init + KMeans refine on PCA(100) on PCA(100)", "config": {"backbone": "ward_hill_climb", "axis": "Ward init + KMeans refine on PCA(100)", "model": "PCA(100)"}, "composite": 0.45911271915257473, "val_primary": 0.16769424080848694, "test_primary": 0.45911271915257473, "per_fold_test": [0.45911271915257473], "per_fold_val": [0.16769424080848694], "status": "KEEP", "seconds_elapsed": 0.012042760848999023, "timestamp": "2026-04-26T01:26:21", "secondary_metrics": {"ari": 0.45911271915257473, "nmi": 0.7993477435355836, "fmi": 0.48102607088485083, "homogeneity": 0.7814466831190527, "completeness": 0.8180881721693063, "v_measure": 0.7993477435355835, "silhouette": 0.16769424080848694, "n_pred_clusters": 40, "n_noise": 0, "n_true_clusters": 40}, "per_fold_test_reports": [{"fold_id": 0, "regime": "full-dataset", "ari": 0.45911271915257473, "nmi": 0.7993477435355836, "fmi": 0.48102607088485083, "silhouette": 0.16769424080848694, "n": 400}], "composite_fingerprint": "clustering-ari-floor0.3"}
