{"experiment_num": 97, "backbone": "birch_hc_threshold0.05_on_DINOv2", "description": "Birch hill-climb: threshold=0.05 on DINOv2 on DINOv2 ViT-S/14", "config": {"backbone": "birch_hill_climb", "axis": "threshold=0.05 on DINOv2", "model": "DINOv2 ViT-S/14"}, "composite": 0.6370946321203487, "val_primary": 0.08336355537176132, "test_primary": 0.6370946321203487, "per_fold_test": [0.6370946321203487], "per_fold_val": [0.08336355537176132], "status": "KEEP", "seconds_elapsed": 0.04562830924987793, "timestamp": "2026-04-26T01:26:21", "secondary_metrics": {"ari": 0.6370946321203487, "nmi": 0.8705842700000564, "fmi": 0.6469165218119676, "homogeneity": 0.863755068406218, "completeness": 0.877522321136698, "v_measure": 0.8705842700000566, "silhouette": 0.08336355537176132, "n_pred_clusters": 40, "n_noise": 0, "n_true_clusters": 40}, "per_fold_test_reports": [{"fold_id": 0, "regime": "full-dataset", "ari": 0.6370946321203487, "nmi": 0.8705842700000564, "fmi": 0.6469165218119676, "silhouette": 0.08336355537176132, "n": 400}], "composite_fingerprint": "clustering-ari-floor0.3"}
{"experiment_num": 98, "backbone": "birch_hc_threshold0.1_on_DINOv2", "description": "Birch hill-climb: threshold=0.1 on DINOv2 on DINOv2 ViT-S/14", "config": {"backbone": "birch_hill_climb", "axis": "threshold=0.1 on DINOv2", "model": "DINOv2 ViT-S/14"}, "composite": 0.6370946321203487, "val_primary": 0.08336355537176132, "test_primary": 0.6370946321203487, "per_fold_test": [0.6370946321203487], "per_fold_val": [0.08336355537176132], "status": "KEEP", "seconds_elapsed": 0.04490041732788086, "timestamp": "2026-04-26T01:26:21", "secondary_metrics": {"ari": 0.6370946321203487, "nmi": 0.8705842700000564, "fmi": 0.6469165218119676, "homogeneity": 0.863755068406218, "completeness": 0.877522321136698, "v_measure": 0.8705842700000566, "silhouette": 0.08336355537176132, "n_pred_clusters": 40, "n_noise": 0, "n_true_clusters": 40}, "per_fold_test_reports": [{"fold_id": 0, "regime": "full-dataset", "ari": 0.6370946321203487, "nmi": 0.8705842700000564, "fmi": 0.6469165218119676, "silhouette": 0.08336355537176132, "n": 400}], "composite_fingerprint": "clustering-ari-floor0.3"}
{"experiment_num": 99, "backbone": "birch_hc_threshold0.2_on_DINOv2", "description": "Birch hill-climb: threshold=0.2 on DINOv2 on DINOv2 ViT-S/14", "config": {"backbone": "birch_hill_climb", "axis": "threshold=0.2 on DINOv2", "model": "DINOv2 ViT-S/14"}, "composite": 0.6370946321203487, "val_primary": 0.08336354047060013, "test_primary": 0.6370946321203487, "per_fold_test": [0.6370946321203487], "per_fold_val": [0.08336354047060013], "status": "KEEP", "seconds_elapsed": 0.03877592086791992, "timestamp": "2026-04-26T01:26:21", "secondary_metrics": {"ari": 0.6370946321203487, "nmi": 0.8705842700000564, "fmi": 0.6469165218119676, "homogeneity": 0.863755068406218, "completeness": 0.877522321136698, "v_measure": 0.8705842700000566, "silhouette": 0.08336354047060013, "n_pred_clusters": 40, "n_noise": 0, "n_true_clusters": 40}, "per_fold_test_reports": [{"fold_id": 0, "regime": "full-dataset", "ari": 0.6370946321203487, "nmi": 0.8705842700000564, "fmi": 0.6469165218119676, "silhouette": 0.08336354047060013, "n": 400}], "composite_fingerprint": "clustering-ari-floor0.3"}
{"experiment_num": 100, "backbone": "birch_hc_threshold0.3_on_DINOv2", "description": "Birch hill-climb: threshold=0.3 on DINOv2 on DINOv2 ViT-S/14", "config": {"backbone": "birch_hill_climb", "axis": "threshold=0.3 on DINOv2", "model": "DINOv2 ViT-S/14"}, "composite": 0.6370946321203487, "val_primary": 0.08336355537176132, "test_primary": 0.6370946321203487, "per_fold_test": [0.6370946321203487], "per_fold_val": [0.08336355537176132], "status": "KEEP", "seconds_elapsed": 0.038504600524902344, "timestamp": "2026-04-26T01:26:22", "secondary_metrics": {"ari": 0.6370946321203487, "nmi": 0.8705842700000564, "fmi": 0.6469165218119676, "homogeneity": 0.863755068406218, "completeness": 0.877522321136698, "v_measure": 0.8705842700000566, "silhouette": 0.08336355537176132, "n_pred_clusters": 40, "n_noise": 0, "n_true_clusters": 40}, "per_fold_test_reports": [{"fold_id": 0, "regime": "full-dataset", "ari": 0.6370946321203487, "nmi": 0.8705842700000564, "fmi": 0.6469165218119676, "silhouette": 0.08336355537176132, "n": 400}], "composite_fingerprint": "clustering-ari-floor0.3"}
{"experiment_num": 101, "backbone": "birch_hc_threshold0.5_on_DINOv2", "description": "Birch hill-climb: threshold=0.5 on DINOv2 on DINOv2 ViT-S/14", "config": {"backbone": "birch_hill_climb", "axis": "threshold=0.5 on DINOv2", "model": "DINOv2 ViT-S/14"}, "composite": 0.6370946321203487, "val_primary": 0.08336355537176132, "test_primary": 0.6370946321203487, "per_fold_test": [0.6370946321203487], "per_fold_val": [0.08336355537176132], "status": "KEEP", "seconds_elapsed": 0.03349876403808594, "timestamp": "2026-04-26T01:26:22", "secondary_metrics": {"ari": 0.6370946321203487, "nmi": 0.8705842700000564, "fmi": 0.6469165218119676, "homogeneity": 0.863755068406218, "completeness": 0.877522321136698, "v_measure": 0.8705842700000566, "silhouette": 0.08336355537176132, "n_pred_clusters": 40, "n_noise": 0, "n_true_clusters": 40}, "per_fold_test_reports": [{"fold_id": 0, "regime": "full-dataset", "ari": 0.6370946321203487, "nmi": 0.8705842700000564, "fmi": 0.6469165218119676, "silhouette": 0.08336355537176132, "n": 400}], "composite_fingerprint": "clustering-ari-floor0.3"}
{"experiment_num": 102, "backbone": "birch_hc_threshold0.7_on_DINOv2", "description": "Birch hill-climb: threshold=0.7 on DINOv2 on DINOv2 ViT-S/14", "config": {"backbone": "birch_hill_climb", "axis": "threshold=0.7 on DINOv2", "model": "DINOv2 ViT-S/14"}, "composite": 0.6370946321203487, "val_primary": 0.08336355537176132, "test_primary": 0.6370946321203487, "per_fold_test": [0.6370946321203487], "per_fold_val": [0.08336355537176132], "status": "KEEP", "seconds_elapsed": 0.03751039505004883, "timestamp": "2026-04-26T01:26:22", "secondary_metrics": {"ari": 0.6370946321203487, "nmi": 0.8705842700000564, "fmi": 0.6469165218119676, "homogeneity": 0.863755068406218, "completeness": 0.877522321136698, "v_measure": 0.8705842700000566, "silhouette": 0.08336355537176132, "n_pred_clusters": 40, "n_noise": 0, "n_true_clusters": 40}, "per_fold_test_reports": [{"fold_id": 0, "regime": "full-dataset", "ari": 0.6370946321203487, "nmi": 0.8705842700000564, "fmi": 0.6469165218119676, "silhouette": 0.08336355537176132, "n": 400}], "composite_fingerprint": "clustering-ari-floor0.3"}
{"experiment_num": 103, "backbone": "birch_hc_threshold1.0_on_DINOv2", "description": "Birch hill-climb: threshold=1.0 on DINOv2 on DINOv2 ViT-S/14", "config": {"backbone": "birch_hill_climb", "axis": "threshold=1.0 on DINOv2", "model": "DINOv2 ViT-S/14"}, "composite": 0.6370946321203487, "val_primary": 0.08336354047060013, "test_primary": 0.6370946321203487, "per_fold_test": [0.6370946321203487], "per_fold_val": [0.08336354047060013], "status": "KEEP", "seconds_elapsed": 0.03722977638244629, "timestamp": "2026-04-26T01:26:22", "secondary_metrics": {"ari": 0.6370946321203487, "nmi": 0.8705842700000564, "fmi": 0.6469165218119676, "homogeneity": 0.863755068406218, "completeness": 0.877522321136698, "v_measure": 0.8705842700000566, "silhouette": 0.08336354047060013, "n_pred_clusters": 40, "n_noise": 0, "n_true_clusters": 40}, "per_fold_test_reports": [{"fold_id": 0, "regime": "full-dataset", "ari": 0.6370946321203487, "nmi": 0.8705842700000564, "fmi": 0.6469165218119676, "silhouette": 0.08336354047060013, "n": 400}], "composite_fingerprint": "clustering-ari-floor0.3"}
{"experiment_num": 104, "backbone": "birch_hc_threshold1.5_on_DINOv2", "description": "Birch hill-climb: threshold=1.5 on DINOv2 on DINOv2 ViT-S/14", "config": {"backbone": "birch_hill_climb", "axis": "threshold=1.5 on DINOv2", "model": "DINOv2 ViT-S/14"}, "composite": 0.6370946321203487, "val_primary": 0.08336355537176132, "test_primary": 0.6370946321203487, "per_fold_test": [0.6370946321203487], "per_fold_val": [0.08336355537176132], "status": "KEEP", "seconds_elapsed": 0.03528261184692383, "timestamp": "2026-04-26T01:26:22", "secondary_metrics": {"ari": 0.6370946321203487, "nmi": 0.8705842700000564, "fmi": 0.6469165218119676, "homogeneity": 0.863755068406218, "completeness": 0.877522321136698, "v_measure": 0.8705842700000566, "silhouette": 0.08336355537176132, "n_pred_clusters": 40, "n_noise": 0, "n_true_clusters": 40}, "per_fold_test_reports": [{"fold_id": 0, "regime": "full-dataset", "ari": 0.6370946321203487, "nmi": 0.8705842700000564, "fmi": 0.6469165218119676, "silhouette": 0.08336355537176132, "n": 400}], "composite_fingerprint": "clustering-ari-floor0.3"}
{"experiment_num": 105, "backbone": "birch_hc_branching_factor10_on_DINOv2", "description": "Birch hill-climb: branching_factor=10 on DINOv2 on DINOv2 ViT-S/14", "config": {"backbone": "birch_hill_climb", "axis": "branching_factor=10 on DINOv2", "model": "DINOv2 ViT-S/14"}, "composite": 0.6370946321203487, "val_primary": 0.08336354047060013, "test_primary": 0.6370946321203487, "per_fold_test": [0.6370946321203487], "per_fold_val": [0.08336354047060013], "status": "KEEP", "seconds_elapsed": 0.04033541679382324, "timestamp": "2026-04-26T01:26:22", "secondary_metrics": {"ari": 0.6370946321203487, "nmi": 0.8705842700000564, "fmi": 0.6469165218119676, "homogeneity": 0.863755068406218, "completeness": 0.877522321136698, "v_measure": 0.8705842700000566, "silhouette": 0.08336354047060013, "n_pred_clusters": 40, "n_noise": 0, "n_true_clusters": 40}, "per_fold_test_reports": [{"fold_id": 0, "regime": "full-dataset", "ari": 0.6370946321203487, "nmi": 0.8705842700000564, "fmi": 0.6469165218119676, "silhouette": 0.08336354047060013, "n": 400}], "composite_fingerprint": "clustering-ari-floor0.3"}
{"experiment_num": 106, "backbone": "birch_hc_branching_factor25_on_DINOv2", "description": "Birch hill-climb: branching_factor=25 on DINOv2 on DINOv2 ViT-S/14", "config": {"backbone": "birch_hill_climb", "axis": "branching_factor=25 on DINOv2", "model": "DINOv2 ViT-S/14"}, "composite": 0.6370946321203487, "val_primary": 0.08336355537176132, "test_primary": 0.6370946321203487, "per_fold_test": [0.6370946321203487], "per_fold_val": [0.08336355537176132], "status": "KEEP", "seconds_elapsed": 0.036590576171875, "timestamp": "2026-04-26T01:26:22", "secondary_metrics": {"ari": 0.6370946321203487, "nmi": 0.8705842700000564, "fmi": 0.6469165218119676, "homogeneity": 0.863755068406218, "completeness": 0.877522321136698, "v_measure": 0.8705842700000566, "silhouette": 0.08336355537176132, "n_pred_clusters": 40, "n_noise": 0, "n_true_clusters": 40}, "per_fold_test_reports": [{"fold_id": 0, "regime": "full-dataset", "ari": 0.6370946321203487, "nmi": 0.8705842700000564, "fmi": 0.6469165218119676, "silhouette": 0.08336355537176132, "n": 400}], "composite_fingerprint": "clustering-ari-floor0.3"}
{"experiment_num": 107, "backbone": "birch_hc_branching_factor100_on_DINOv2", "description": "Birch hill-climb: branching_factor=100 on DINOv2 on DINOv2 ViT-S/14", "config": {"backbone": "birch_hill_climb", "axis": "branching_factor=100 on DINOv2", "model": "DINOv2 ViT-S/14"}, "composite": 0.6370946321203487, "val_primary": 0.08336355537176132, "test_primary": 0.6370946321203487, "per_fold_test": [0.6370946321203487], "per_fold_val": [0.08336355537176132], "status": "KEEP", "seconds_elapsed": 0.03585672378540039, "timestamp": "2026-04-26T01:26:22", "secondary_metrics": {"ari": 0.6370946321203487, "nmi": 0.8705842700000564, "fmi": 0.6469165218119676, "homogeneity": 0.863755068406218, "completeness": 0.877522321136698, "v_measure": 0.8705842700000566, "silhouette": 0.08336355537176132, "n_pred_clusters": 40, "n_noise": 0, "n_true_clusters": 40}, "per_fold_test_reports": [{"fold_id": 0, "regime": "full-dataset", "ari": 0.6370946321203487, "nmi": 0.8705842700000564, "fmi": 0.6469165218119676, "silhouette": 0.08336355537176132, "n": 400}], "composite_fingerprint": "clustering-ari-floor0.3"}
{"experiment_num": 108, "backbone": "birch_hc_branching_factor200_on_DINOv2", "description": "Birch hill-climb: branching_factor=200 on DINOv2 on DINOv2 ViT-S/14", "config": {"backbone": "birch_hill_climb", "axis": "branching_factor=200 on DINOv2", "model": "DINOv2 ViT-S/14"}, "composite": 0.6370946321203487, "val_primary": 0.08336354047060013, "test_primary": 0.6370946321203487, "per_fold_test": [0.6370946321203487], "per_fold_val": [0.08336354047060013], "status": "KEEP", "seconds_elapsed": 0.03327298164367676, "timestamp": "2026-04-26T01:26:22", "secondary_metrics": {"ari": 0.6370946321203487, "nmi": 0.8705842700000564, "fmi": 0.6469165218119676, "homogeneity": 0.863755068406218, "completeness": 0.877522321136698, "v_measure": 0.8705842700000566, "silhouette": 0.08336354047060013, "n_pred_clusters": 40, "n_noise": 0, "n_true_clusters": 40}, "per_fold_test_reports": [{"fold_id": 0, "regime": "full-dataset", "ari": 0.6370946321203487, "nmi": 0.8705842700000564, "fmi": 0.6469165218119676, "silhouette": 0.08336354047060013, "n": 400}], "composite_fingerprint": "clustering-ari-floor0.3"}
{"experiment_num": 109, "backbone": "birch_hc_default_Birch_on_DINOv2_L2-nor", "description": "Birch hill-climb: default Birch on DINOv2 L2-norm on DINOv2 L2-norm", "config": {"backbone": "birch_hill_climb", "axis": "default Birch on DINOv2 L2-norm", "model": "DINOv2 L2-norm"}, "composite": 0.2306209024296182, "val_primary": -0.05209115892648697, "test_primary": 0.2306209024296182, "per_fold_test": [0.2306209024296182], "per_fold_val": [-0.05209115892648697], "status": "DISCARD", "seconds_elapsed": 0.007357358932495117, "timestamp": "2026-04-26T01:26:22", "secondary_metrics": {"ari": 0.2306209024296182, "nmi": 0.6719482800782651, "fmi": 0.32181533129873224, "homogeneity": 0.5780432051783254, "completeness": 0.802281649055735, "v_measure": 0.6719482800782652, "silhouette": -0.05209115892648697, "n_pred_clusters": 22, "n_noise": 0, "n_true_clusters": 40}, "per_fold_test_reports": [{"fold_id": 0, "regime": "full-dataset", "ari": 0.2306209024296182, "nmi": 0.6719482800782651, "fmi": 0.32181533129873224, "silhouette": -0.05209115892648697, "n": 400}], "composite_fingerprint": "clustering-ari-floor0.3"}
{"experiment_num": 110, "backbone": "birch_hc_default_Birch_on_PCA(50)", "description": "Birch hill-climb: default Birch on PCA(50) on PCA(50)", "config": {"backbone": "birch_hill_climb", "axis": "default Birch on PCA(50)", "model": "PCA(50)"}, "composite": 0.5286568492169416, "val_primary": 0.16080398857593536, "test_primary": 0.5286568492169416, "per_fold_test": [0.5286568492169416], "per_fold_val": [0.16080398857593536], "status": "KEEP", "seconds_elapsed": 0.013211727142333984, "timestamp": "2026-04-26T01:26:23", "secondary_metrics": {"ari": 0.5286568492169416, "nmi": 0.8253783657458292, "fmi": 0.5445171562847789, "homogeneity": 0.8123208591792976, "completeness": 0.8388625113598731, "v_measure": 0.8253783657458292, "silhouette": 0.16080398857593536, "n_pred_clusters": 40, "n_noise": 0, "n_true_clusters": 40}, "per_fold_test_reports": [{"fold_id": 0, "regime": "full-dataset", "ari": 0.5286568492169416, "nmi": 0.8253783657458292, "fmi": 0.5445171562847789, "silhouette": 0.16080398857593536, "n": 400}], "composite_fingerprint": "clustering-ari-floor0.3"}
{"experiment_num": 111, "backbone": "birch_hc_default_Birch_on_PCA(100)", "description": "Birch hill-climb: default Birch on PCA(100) on PCA(100)", "config": {"backbone": "birch_hill_climb", "axis": "default Birch on PCA(100)", "model": "PCA(100)"}, "composite": 0.47368049126922995, "val_primary": 0.16557157039642334, "test_primary": 0.47368049126922995, "per_fold_test": [0.47368049126922995], "per_fold_val": [0.16557157039642334], "status": "KEEP", "seconds_elapsed": 0.012955904006958008, "timestamp": "2026-04-26T01:26:23", "secondary_metrics": {"ari": 0.47368049126922995, "nmi": 0.808118054169169, "fmi": 0.4954336150369575, "homogeneity": 0.789810089398023, "completeness": 0.8272949253590074, "v_measure": 0.8081180541691692, "silhouette": 0.16557157039642334, "n_pred_clusters": 40, "n_noise": 0, "n_true_clusters": 40}, "per_fold_test_reports": [{"fold_id": 0, "regime": "full-dataset", "ari": 0.47368049126922995, "nmi": 0.808118054169169, "fmi": 0.4954336150369575, "silhouette": 0.16557157039642334, "n": 400}], "composite_fingerprint": "clustering-ari-floor0.3"}
{"experiment_num": 112, "backbone": "birch_hc_default_Birch_on_PCA(20)", "description": "Birch hill-climb: default Birch on PCA(20) on PCA(20)", "config": {"backbone": "birch_hill_climb", "axis": "default Birch on PCA(20)", "model": "PCA(20)"}, "composite": 0.45401229148375766, "val_primary": 0.1590787172317505, "test_primary": 0.45401229148375766, "per_fold_test": [0.45401229148375766], "per_fold_val": [0.1590787172317505], "status": "KEEP", "seconds_elapsed": 0.009999752044677734, "timestamp": "2026-04-26T01:26:23", "secondary_metrics": {"ari": 0.45401229148375766, "nmi": 0.794931718686167, "fmi": 0.4725268642383209, "homogeneity": 0.7803260145457218, "completeness": 0.8100946147687333, "v_measure": 0.7949317186861669, "silhouette": 0.1590787172317505, "n_pred_clusters": 40, "n_noise": 0, "n_true_clusters": 40}, "per_fold_test_reports": [{"fold_id": 0, "regime": "full-dataset", "ari": 0.45401229148375766, "nmi": 0.794931718686167, "fmi": 0.4725268642383209, "silhouette": 0.1590787172317505, "n": 400}], "composite_fingerprint": "clustering-ari-floor0.3"}
{"experiment_num": 113, "backbone": "birch_hc_Birch_leaves_+_KMeans_refine_o", "description": "Birch hill-climb: Birch leaves + KMeans refine on DINOv2 on DINOv2", "config": {"backbone": "birch_hill_climb", "axis": "Birch leaves + KMeans refine on DINOv2", "model": "DINOv2"}, "composite": 0.5461020738203958, "val_primary": 0.04917309805750847, "test_primary": 0.5461020738203958, "per_fold_test": [0.5461020738203958], "per_fold_val": [0.04917309805750847], "status": "KEEP", "seconds_elapsed": 0.25882792472839355, "timestamp": "2026-04-26T01:26:23", "secondary_metrics": {"ari": 0.5461020738203958, "nmi": 0.8242031966387888, "fmi": 0.5586334756826311, "homogeneity": 0.8168688926770303, "completeness": 0.8316703967494045, "v_measure": 0.8242031966387887, "silhouette": 0.04917309805750847, "n_pred_clusters": 40, "n_noise": 0, "n_true_clusters": 40}, "per_fold_test_reports": [{"fold_id": 0, "regime": "full-dataset", "ari": 0.5461020738203958, "nmi": 0.8242031966387888, "fmi": 0.5586334756826311, "silhouette": 0.04917309805750847, "n": 400}], "composite_fingerprint": "clustering-ari-floor0.3"}
{"experiment_num": 114, "backbone": "birch_hc_Birch_leaves_+_KMeans_refine_o", "description": "Birch hill-climb: Birch leaves + KMeans refine on DINOv2 L2-norm on DINOv2 L2-norm", "config": {"backbone": "birch_hill_climb", "axis": "Birch leaves + KMeans refine on DINOv2 L2-norm", "model": "DINOv2 L2-norm"}, "composite": 0.2306209024296182, "val_primary": -0.052091166377067566, "test_primary": 0.2306209024296182, "per_fold_test": [0.2306209024296182], "per_fold_val": [-0.052091166377067566], "status": "DISCARD", "seconds_elapsed": 0.015911579132080078, "timestamp": "2026-04-26T01:26:23", "secondary_metrics": {"ari": 0.2306209024296182, "nmi": 0.6719482800782651, "fmi": 0.32181533129873224, "homogeneity": 0.5780432051783254, "completeness": 0.802281649055735, "v_measure": 0.6719482800782652, "silhouette": -0.052091166377067566, "n_pred_clusters": 22, "n_noise": 0, "n_true_clusters": 40}, "per_fold_test_reports": [{"fold_id": 0, "regime": "full-dataset", "ari": 0.2306209024296182, "nmi": 0.6719482800782651, "fmi": 0.32181533129873224, "silhouette": -0.052091166377067566, "n": 400}], "composite_fingerprint": "clustering-ari-floor0.3"}
{"experiment_num": 115, "backbone": "birch_hc_Birch_leaves_+_KMeans_refine_o", "description": "Birch hill-climb: Birch leaves + KMeans refine on PCA(50) on PCA(50)", "config": {"backbone": "birch_hill_climb", "axis": "Birch leaves + KMeans refine on PCA(50)", "model": "PCA(50)"}, "composite": 0.4356222771250212, "val_primary": 0.14782100915908813, "test_primary": 0.4356222771250212, "per_fold_test": [0.4356222771250212], "per_fold_val": [0.14782100915908813], "status": "KEEP", "seconds_elapsed": 0.10882830619812012, "timestamp": "2026-04-26T01:26:23", "secondary_metrics": {"ari": 0.4356222771250212, "nmi": 0.768520586362213, "fmi": 0.45314149550024857, "homogeneity": 0.7563021312627675, "completeness": 0.7811403152694296, "v_measure": 0.7685205863622131, "silhouette": 0.14782100915908813, "n_pred_clusters": 40, "n_noise": 0, "n_true_clusters": 40}, "per_fold_test_reports": [{"fold_id": 0, "regime": "full-dataset", "ari": 0.4356222771250212, "nmi": 0.768520586362213, "fmi": 0.45314149550024857, "silhouette": 0.14782100915908813, "n": 400}], "composite_fingerprint": "clustering-ari-floor0.3"}
{"experiment_num": 116, "backbone": "birch_hc_Birch_leaves_+_KMeans_refine_o", "description": "Birch hill-climb: Birch leaves + KMeans refine on PCA(100) on PCA(100)", "config": {"backbone": "birch_hill_climb", "axis": "Birch leaves + KMeans refine on PCA(100)", "model": "PCA(100)"}, "composite": 0.423166646782971, "val_primary": 0.14794403314590454, "test_primary": 0.423166646782971, "per_fold_test": [0.423166646782971], "per_fold_val": [0.14794403314590454], "status": "KEEP", "seconds_elapsed": 0.13097572326660156, "timestamp": "2026-04-26T01:26:23", "secondary_metrics": {"ari": 0.423166646782971, "nmi": 0.7684648298836935, "fmi": 0.44265547205910266, "homogeneity": 0.754384879512002, "completeness": 0.7830803568662272, "v_measure": 0.7684648298836937, "silhouette": 0.14794403314590454, "n_pred_clusters": 40, "n_noise": 0, "n_true_clusters": 40}, "per_fold_test_reports": [{"fold_id": 0, "regime": "full-dataset", "ari": 0.423166646782971, "nmi": 0.7684648298836935, "fmi": 0.44265547205910266, "silhouette": 0.14794403314590454, "n": 400}], "composite_fingerprint": "clustering-ari-floor0.3"}
