{"experiment_num": 1, "backbone": "kmeans_raw_pixels", "description": "KMeans K=40 on raw pixels \u2014 baseline (Lloyd 1982 + Arthur 2007 init)", "config": {"backbone": "kmeans", "n_clusters": 40, "n_init": 10, "init": "k-means++", "max_iter": 300, "random_state": 0, "feature_space": "raw pixels (4096-dim, range [0,1])"}, "composite": 0.40565597278730076, "val_primary": 0.14789612591266632, "test_primary": 0.40565597278730076, "per_fold_test": [0.40565597278730076], "per_fold_val": [0.14789612591266632], "status": "KEEP", "seconds_elapsed": 6.4575324058532715, "timestamp": "2026-04-25T23:25:38", "secondary_metrics": {"ari": 0.40565597278730076, "nmi": 0.7584875079072988, "fmi": 0.4266599962560874, "homogeneity": 0.7428105545133882, "completeness": 0.7748404495029277, "v_measure": 0.7584875079072988, "silhouette": 0.14789612591266632, "n_pred_clusters": 40, "n_noise": 0, "n_true_clusters": 40}, "per_fold_test_reports": [{"fold_id": 0, "regime": "full-dataset", "ari": 0.40565597278730076, "nmi": 0.7584875079072988, "fmi": 0.4266599962560874, "silhouette": 0.14789612591266632, "n": 400}], "composite_fingerprint": "clustering-ari-floor0.3"}
{"experiment_num": 2, "backbone": "kmeans_pca50", "description": "PCA(50) + KMeans (Pearson 1901 + Steinley 2006)", "config": {"backbone": "kmeans_pca", "n_components": 50, "whiten": false, "n_clusters": 40, "random_state": 0}, "composite": 0.47800319381030565, "val_primary": 0.14846625924110413, "test_primary": 0.47800319381030565, "per_fold_test": [0.47800319381030565], "per_fold_val": [0.14846625924110413], "status": "KEEP", "seconds_elapsed": 1.6874890327453613, "timestamp": "2026-04-25T23:27:54", "secondary_metrics": {"ari": 0.47800319381030565, "nmi": 0.7951295693940573, "fmi": 0.4951600812312166, "homogeneity": 0.7824672679738852, "completeness": 0.8082084279533008, "v_measure": 0.7951295693940573, "silhouette": 0.14846625924110413, "n_pred_clusters": 40, "n_noise": 0, "n_true_clusters": 40}, "per_fold_test_reports": [{"fold_id": 0, "regime": "full-dataset", "ari": 0.47800319381030565, "nmi": 0.7951295693940573, "fmi": 0.4951600812312166, "silhouette": 0.14846625924110413, "n": 400}], "composite_fingerprint": "clustering-ari-floor0.3"}
{"experiment_num": 3, "backbone": "kmeans_pca100", "description": "PCA(100) + KMeans", "config": {"backbone": "kmeans_pca", "n_components": 100, "n_clusters": 40, "random_state": 0}, "composite": 0.46330760749724365, "val_primary": 0.15059278905391693, "test_primary": 0.46330760749724365, "per_fold_test": [0.46330760749724365], "per_fold_val": [0.15059278905391693], "status": "KEEP", "seconds_elapsed": 1.7425193786621094, "timestamp": "2026-04-25T23:33:48", "secondary_metrics": {"ari": 0.46330760749724365, "nmi": 0.7856063747599703, "fmi": 0.4820874747733375, "homogeneity": 0.7710692694775525, "completeness": 0.8007021540551894, "v_measure": 0.7856063747599703, "silhouette": 0.15059278905391693, "n_pred_clusters": 40, "n_noise": 0, "n_true_clusters": 40}, "per_fold_test_reports": [{"fold_id": 0, "regime": "full-dataset", "ari": 0.46330760749724365, "nmi": 0.7856063747599703, "fmi": 0.4820874747733375, "silhouette": 0.15059278905391693, "n": 400}], "composite_fingerprint": "clustering-ari-floor0.3"}
{"experiment_num": 3, "backbone": "kmeans_pca100", "description": "PCA(100) + KMeans", "config": {"backbone": "kmeans_pca", "n_components": 100, "n_clusters": 40, "random_state": 0}, "composite": 0.46330760749724365, "val_primary": 0.15059278905391693, "test_primary": 0.46330760749724365, "per_fold_test": [0.46330760749724365], "per_fold_val": [0.15059278905391693], "status": "KEEP", "seconds_elapsed": 1.77976393699646, "timestamp": "2026-04-25T23:34:30", "secondary_metrics": {"ari": 0.46330760749724365, "nmi": 0.7856063747599703, "fmi": 0.4820874747733375, "homogeneity": 0.7710692694775525, "completeness": 0.8007021540551894, "v_measure": 0.7856063747599703, "silhouette": 0.15059278905391693, "n_pred_clusters": 40, "n_noise": 0, "n_true_clusters": 40}, "per_fold_test_reports": [{"fold_id": 0, "regime": "full-dataset", "ari": 0.46330760749724365, "nmi": 0.7856063747599703, "fmi": 0.4820874747733375, "silhouette": 0.15059278905391693, "n": 400}], "composite_fingerprint": "clustering-ari-floor0.3"}
{"experiment_num": 4, "backbone": "kmeans_pca150", "description": "PCA(150) + KMeans", "config": {"backbone": "kmeans_pca", "n_components": 150, "n_clusters": 40, "random_state": 0}, "composite": 0.44842382835910344, "val_primary": 0.1455993801355362, "test_primary": 0.44842382835910344, "per_fold_test": [0.44842382835910344], "per_fold_val": [0.1455993801355362], "status": "KEEP", "seconds_elapsed": 0.2677748203277588, "timestamp": "2026-04-25T23:34:30", "secondary_metrics": {"ari": 0.44842382835910344, "nmi": 0.7846110162461902, "fmi": 0.4671914788829457, "homogeneity": 0.7702492596685118, "completeness": 0.7995185155465705, "v_measure": 0.7846110162461903, "silhouette": 0.1455993801355362, "n_pred_clusters": 40, "n_noise": 0, "n_true_clusters": 40}, "per_fold_test_reports": [{"fold_id": 0, "regime": "full-dataset", "ari": 0.44842382835910344, "nmi": 0.7846110162461902, "fmi": 0.4671914788829457, "silhouette": 0.1455993801355362, "n": 400}], "composite_fingerprint": "clustering-ari-floor0.3"}
{"experiment_num": 5, "backbone": "kmeans_pca_whitened", "description": "PCA(50) + whitening + KMeans", "config": {"backbone": "kmeans_pca", "n_components": 50, "whiten": true, "n_clusters": 40, "random_state": 0}, "composite": 0.3602248688747863, "val_primary": 0.07750126719474792, "test_primary": 0.3602248688747863, "per_fold_test": [0.3602248688747863], "per_fold_val": [0.07750126719474792], "status": "KEEP", "seconds_elapsed": 0.13984179496765137, "timestamp": "2026-04-25T23:34:31", "secondary_metrics": {"ari": 0.3602248688747863, "nmi": 0.7508058731566761, "fmi": 0.39078073242973904, "homogeneity": 0.7248971221148062, "completeness": 0.7786352952950315, "v_measure": 0.7508058731566761, "silhouette": 0.07750126719474792, "n_pred_clusters": 40, "n_noise": 0, "n_true_clusters": 40}, "per_fold_test_reports": [{"fold_id": 0, "regime": "full-dataset", "ari": 0.3602248688747863, "nmi": 0.7508058731566761, "fmi": 0.39078073242973904, "silhouette": 0.07750126719474792, "n": 400}], "composite_fingerprint": "clustering-ari-floor0.3"}
{"experiment_num": 6, "backbone": "spectral_rbf", "description": "Spectral clustering (RBF affinity)", "config": {"backbone": "spectral", "affinity": "rbf", "n_clusters": 40, "random_state": 0}, "composite": 0.057828619651122126, "val_primary": -0.1249934583902359, "test_primary": 0.057828619651122126, "per_fold_test": [0.057828619651122126], "per_fold_val": [-0.1249934583902359], "status": "DISCARD", "seconds_elapsed": 0.4779069423675537, "timestamp": "2026-04-25T23:34:31", "secondary_metrics": {"ari": 0.057828619651122126, "nmi": 0.455989915449404, "fmi": 0.1777524776557622, "homogeneity": 0.3423843248727992, "completeness": 0.6824226903354539, "v_measure": 0.4559899154494039, "silhouette": -0.1249934583902359, "n_pred_clusters": 27, "n_noise": 0, "n_true_clusters": 40}, "per_fold_test_reports": [{"fold_id": 0, "regime": "full-dataset", "ari": 0.057828619651122126, "nmi": 0.455989915449404, "fmi": 0.1777524776557622, "silhouette": -0.1249934583902359, "n": 400}], "composite_fingerprint": "clustering-ari-floor0.3"}
{"experiment_num": 7, "backbone": "gmm_pca_full", "description": "GMM full-cov on PCA(50) (Bishop 2006 Ch.9)", "config": {"backbone": "gmm", "covariance_type": "full", "n_components": 40, "pca_dim": 50, "random_state": 0}, "composite": 0.45450128812850704, "val_primary": 0.13937801122665405, "test_primary": 0.45450128812850704, "per_fold_test": [0.45450128812850704], "per_fold_val": [0.13937801122665405], "status": "KEEP", "seconds_elapsed": 0.11060571670532227, "timestamp": "2026-04-25T23:34:31", "secondary_metrics": {"ari": 0.45450128812850704, "nmi": 0.7735876089044104, "fmi": 0.4701677018227952, "homogeneity": 0.7638992023989959, "completeness": 0.7835249251871053, "v_measure": 0.7735876089044104, "silhouette": 0.13937801122665405, "n_pred_clusters": 40, "n_noise": 0, "n_true_clusters": 40}, "per_fold_test_reports": [{"fold_id": 0, "regime": "full-dataset", "ari": 0.45450128812850704, "nmi": 0.7735876089044104, "fmi": 0.4701677018227952, "silhouette": 0.13937801122665405, "n": 400}], "composite_fingerprint": "clustering-ari-floor0.3"}
{"experiment_num": 8, "backbone": "agg_ward", "description": "Agglomerative Ward on PCA(50) (Ward 1963)", "config": {"backbone": "agglomerative", "linkage": "ward", "n_clusters": 40, "pca_dim": 50}, "composite": 0.5159317404094375, "val_primary": 0.16078919172286987, "test_primary": 0.5159317404094375, "per_fold_test": [0.5159317404094375], "per_fold_val": [0.16078919172286987], "status": "KEEP", "seconds_elapsed": 0.25362157821655273, "timestamp": "2026-04-25T23:34:32", "secondary_metrics": {"ari": 0.5159317404094375, "nmi": 0.8201138995109474, "fmi": 0.5323529411764706, "homogeneity": 0.8064507705391477, "completeness": 0.834247977028138, "v_measure": 0.8201138995109474, "silhouette": 0.16078919172286987, "n_pred_clusters": 40, "n_noise": 0, "n_true_clusters": 40}, "per_fold_test_reports": [{"fold_id": 0, "regime": "full-dataset", "ari": 0.5159317404094375, "nmi": 0.8201138995109474, "fmi": 0.5323529411764706, "silhouette": 0.16078919172286987, "n": 400}], "composite_fingerprint": "clustering-ari-floor0.3"}
{"experiment_num": 9, "backbone": "hdbscan", "description": "HDBSCAN on PCA(50) (Campello 2013)", "config": {"backbone": "hdbscan", "min_cluster_size": 5, "min_samples": 2, "pca_dim": 50}, "composite": 0.3438352877665477, "val_primary": 0.18074986338615417, "test_primary": 0.3438352877665477, "per_fold_test": [0.3438352877665477], "per_fold_val": [0.18074986338615417], "status": "KEEP", "seconds_elapsed": 0.061380624771118164, "timestamp": "2026-04-25T23:34:32", "secondary_metrics": {"ari": 0.3438352877665477, "nmi": 0.8142179487744733, "fmi": 0.40221871078350874, "homogeneity": 0.7837259847351766, "completeness": 0.8471786273046922, "v_measure": 0.8142179487744733, "silhouette": 0.18074986338615417, "n_pred_clusters": 41, "n_noise": 79, "n_true_clusters": 40}, "per_fold_test_reports": [{"fold_id": 0, "regime": "full-dataset", "ari": 0.3438352877665477, "nmi": 0.8142179487744733, "fmi": 0.40221871078350874, "silhouette": 0.18074986338615417, "n": 400}], "composite_fingerprint": "clustering-ari-floor0.3"}
{"experiment_num": 10, "backbone": "conv_ae_kmeans", "description": "Convolutional AE (Hinton 2006) + KMeans, latent=64", "config": {"backbone": "conv_ae+kmeans", "latent_dim": 64, "epochs": 40, "lr": 0.001, "n_clusters": 40, "random_state": 0}, "composite": 0.4790179177925038, "val_primary": 0.14691990613937378, "test_primary": 0.4790179177925038, "per_fold_test": [0.4790179177925038], "per_fold_val": [0.14691990613937378], "status": "KEEP", "seconds_elapsed": 17.543678998947144, "timestamp": "2026-04-25T23:34:49", "secondary_metrics": {"ari": 0.4790179177925038, "nmi": 0.7933760294320524, "fmi": 0.49571689197084756, "homogeneity": 0.7805964811899666, "completeness": 0.8065809833828788, "v_measure": 0.7933760294320525, "silhouette": 0.14691990613937378, "n_pred_clusters": 40, "n_noise": 0, "n_true_clusters": 40}, "per_fold_test_reports": [{"fold_id": 0, "regime": "full-dataset", "ari": 0.4790179177925038, "nmi": 0.7933760294320524, "fmi": 0.49571689197084756, "silhouette": 0.14691990613937378, "n": 400}], "composite_fingerprint": "clustering-ari-floor0.3"}
{"experiment_num": 11, "backbone": "resnet18_kmeans", "description": "ResNet18-ImageNet (He 2016) penultimate features + KMeans", "config": {"backbone": "resnet18+kmeans", "pretrained": "ImageNet1K", "feature_dim": 512, "n_clusters": 40, "random_state": 0}, "composite": 0.44444164609882636, "val_primary": 0.03240331634879112, "test_primary": 0.44444164609882636, "per_fold_test": [0.44444164609882636], "per_fold_val": [0.03240331634879112], "status": "KEEP", "seconds_elapsed": 8.500165700912476, "timestamp": "2026-04-25T23:34:58", "secondary_metrics": {"ari": 0.44444164609882636, "nmi": 0.7916213177506571, "fmi": 0.4650781743125187, "homogeneity": 0.774602101600701, "completeness": 0.8094052125223765, "v_measure": 0.7916213177506571, "silhouette": 0.03240331634879112, "n_pred_clusters": 40, "n_noise": 0, "n_true_clusters": 40}, "per_fold_test_reports": [{"fold_id": 0, "regime": "full-dataset", "ari": 0.44444164609882636, "nmi": 0.7916213177506571, "fmi": 0.4650781743125187, "silhouette": 0.03240331634879112, "n": 400}], "composite_fingerprint": "clustering-ari-floor0.3"}
{"experiment_num": 12, "backbone": "dec", "description": "DEC: Deep Embedded Clustering (Xie 2016 ICML + Guo 2017 IDEC)", "config": {"backbone": "dec", "latent_dim": 64, "n_clusters": 40, "pretrain_epochs": 40, "dec_epochs": 20, "loss": "kl + 0.1*mse", "alpha": 1.0, "random_state": 0}, "composite": 0.49419804940556705, "val_primary": 0.1435536891222, "test_primary": 0.49419804940556705, "per_fold_test": [0.49419804940556705], "per_fold_val": [0.1435536891222], "status": "KEEP", "seconds_elapsed": 33.77033853530884, "timestamp": "2026-04-25T23:35:32", "secondary_metrics": {"ari": 0.49419804940556705, "nmi": 0.8035875066612643, "fmi": 0.5111019410380606, "homogeneity": 0.7916880906936825, "completeness": 0.815850087945191, "v_measure": 0.8035875066612643, "silhouette": 0.1435536891222, "n_pred_clusters": 40, "n_noise": 0, "n_true_clusters": 40}, "per_fold_test_reports": [{"fold_id": 0, "regime": "full-dataset", "ari": 0.49419804940556705, "nmi": 0.8035875066612643, "fmi": 0.5111019410380606, "silhouette": 0.1435536891222, "n": 400}], "composite_fingerprint": "clustering-ari-floor0.3"}
{"experiment_num": 13, "backbone": "simclr_kmeans", "description": "SimCLR (Chen 2020 ICML) + KMeans", "config": {"backbone": "simclr+kmeans", "latent_dim": 64, "epochs": 80, "augmentations": "hflip+noise+brightness", "loss": "NT-Xent", "temp": 0.5, "n_clusters": 40, "random_state": 0}, "composite": 0.36776914836636315, "val_primary": 0.05032045394182205, "test_primary": 0.36776914836636315, "per_fold_test": [0.36776914836636315], "per_fold_val": [0.05032045394182205], "status": "KEEP", "seconds_elapsed": 33.47001099586487, "timestamp": "2026-04-25T23:36:05", "secondary_metrics": {"ari": 0.36776914836636315, "nmi": 0.7502314961962804, "fmi": 0.3908814560624467, "homogeneity": 0.7322771823534354, "completeness": 0.7690883637715561, "v_measure": 0.7502314961962805, "silhouette": 0.05032045394182205, "n_pred_clusters": 40, "n_noise": 0, "n_true_clusters": 40}, "per_fold_test_reports": [{"fold_id": 0, "regime": "full-dataset", "ari": 0.36776914836636315, "nmi": 0.7502314961962804, "fmi": 0.3908814560624467, "silhouette": 0.05032045394182205, "n": 400}], "composite_fingerprint": "clustering-ari-floor0.3"}
{"experiment_num": 14, "backbone": "consensus_top5", "description": "CSPA consensus of top-5 methods: agg_ward, dec, conv_ae_kmeans, kmeans_pca50, kmeans_pca100", "config": {"backbone": "consensus_cspa", "base_methods": ["agg_ward", "dec", "conv_ae_kmeans", "kmeans_pca50", "kmeans_pca100"], "K": 40, "random_state": 0, "consensus_algo": "Strehl & Ghosh 2002 CSPA via SpectralClustering on co-association matrix"}, "composite": 0.47673809464414896, "val_primary": 0.15299130976200104, "test_primary": 0.47673809464414896, "per_fold_test": [0.47673809464414896], "per_fold_val": [0.15299130976200104], "status": "KEEP", "seconds_elapsed": 58.573031425476074, "timestamp": "2026-04-25T23:37:04", "secondary_metrics": {"ari": 0.47673809464414896, "nmi": 0.8081569843861359, "fmi": 0.49772987239102395, "homogeneity": 0.7913788945114313, "completeness": 0.8256619113572098, "v_measure": 0.808156984386136, "silhouette": 0.15299130976200104, "n_pred_clusters": 40, "n_noise": 0, "n_true_clusters": 40}, "per_fold_test_reports": [{"fold_id": 0, "regime": "full-dataset", "ari": 0.47673809464414896, "nmi": 0.8081569843861359, "fmi": 0.49772987239102395, "silhouette": 0.15299130976200104, "n": 400}], "composite_fingerprint": "clustering-ari-floor0.3"}
{"experiment_num": 15, "backbone": "umap_kmeans", "description": "UMAP(10) + KMeans (McInnes 2018)", "config": {"backbone": "umap+kmeans", "n_components": 10, "n_neighbors": 15, "n_clusters": 40, "random_state": 0}, "composite": 0.5001112534353257, "val_primary": 0.12777405977249146, "test_primary": 0.5001112534353257, "per_fold_test": [0.5001112534353257], "per_fold_val": [0.12777405977249146], "status": "KEEP", "seconds_elapsed": 24.757588148117065, "timestamp": "2026-04-25T23:46:58", "secondary_metrics": {"ari": 0.5001112534353257, "nmi": 0.8003449444274221, "fmi": 0.5131267582138991, "homogeneity": 0.7939332201712044, "completeness": 0.8068610727110882, "v_measure": 0.8003449444274221, "silhouette": 0.12777405977249146, "n_pred_clusters": 40, "n_noise": 0, "n_true_clusters": 40}, "per_fold_test_reports": [{"fold_id": 0, "regime": "full-dataset", "ari": 0.5001112534353257, "nmi": 0.8003449444274221, "fmi": 0.5131267582138991, "silhouette": 0.12777405977249146, "n": 400}], "composite_fingerprint": "clustering-ari-floor0.3"}
{"experiment_num": 16, "backbone": "spectral_tuned", "description": "Spectral RBF with gamma sweep on PCA(50)", "config": {"backbone": "spectral_gamma_sweep", "gammas": [0.001, 0.01, 0.1, 1.0], "pca_dim": 50, "n_clusters": 40}, "composite": 0.5251593950962972, "val_primary": 0.11586631834506989, "test_primary": 0.5251593950962972, "per_fold_test": [0.5251593950962972], "per_fold_val": [0.11586631834506989], "status": "KEEP", "seconds_elapsed": 4.605544328689575, "timestamp": "2026-04-25T23:47:02", "secondary_metrics": {"ari": 0.5251593950962972, "nmi": 0.8227635252320076, "fmi": 0.5431352031492328, "homogeneity": 0.8066997169872303, "completeness": 0.8394800888916898, "v_measure": 0.8227635252320076, "silhouette": 0.11586631834506989, "n_pred_clusters": 40, "n_noise": 0, "n_true_clusters": 40}, "per_fold_test_reports": [{"fold_id": 0, "regime": "full-dataset", "ari": 0.5251593950962972, "nmi": 0.8227635252320076, "fmi": 0.5431352031492328, "silhouette": 0.11586631834506989, "n": 400}], "composite_fingerprint": "clustering-ari-floor0.3"}
{"experiment_num": 15, "backbone": "umap_kmeans", "description": "UMAP(10) + KMeans (McInnes 2018)", "config": {"backbone": "umap+kmeans", "n_components": 10, "n_neighbors": 15, "n_clusters": 40, "random_state": 0}, "composite": 0.5001112534353257, "val_primary": 0.12777405977249146, "test_primary": 0.5001112534353257, "per_fold_test": [0.5001112534353257], "per_fold_val": [0.12777405977249146], "status": "KEEP", "seconds_elapsed": 16.04017996788025, "timestamp": "2026-04-25T23:47:48", "secondary_metrics": {"ari": 0.5001112534353257, "nmi": 0.8003449444274221, "fmi": 0.5131267582138991, "homogeneity": 0.7939332201712044, "completeness": 0.8068610727110882, "v_measure": 0.8003449444274221, "silhouette": 0.12777405977249146, "n_pred_clusters": 40, "n_noise": 0, "n_true_clusters": 40}, "per_fold_test_reports": [{"fold_id": 0, "regime": "full-dataset", "ari": 0.5001112534353257, "nmi": 0.8003449444274221, "fmi": 0.5131267582138991, "silhouette": 0.12777405977249146, "n": 400}], "composite_fingerprint": "clustering-ari-floor0.3"}
{"experiment_num": 16, "backbone": "spectral_tuned", "description": "Spectral RBF with gamma sweep on PCA(50)", "config": {"backbone": "spectral_gamma_sweep", "gammas": [0.001, 0.01, 0.1, 1.0], "pca_dim": 50, "n_clusters": 40}, "composite": 0.5251593950962972, "val_primary": 0.11586631834506989, "test_primary": 0.5251593950962972, "per_fold_test": [0.5251593950962972], "per_fold_val": [0.11586631834506989], "status": "KEEP", "seconds_elapsed": 4.546161890029907, "timestamp": "2026-04-25T23:47:53", "secondary_metrics": {"ari": 0.5251593950962972, "nmi": 0.8227635252320076, "fmi": 0.5431352031492328, "homogeneity": 0.8066997169872303, "completeness": 0.8394800888916898, "v_measure": 0.8227635252320076, "silhouette": 0.11586631834506989, "n_pred_clusters": 40, "n_noise": 0, "n_true_clusters": 40}, "per_fold_test_reports": [{"fold_id": 0, "regime": "full-dataset", "ari": 0.5251593950962972, "nmi": 0.8227635252320076, "fmi": 0.5431352031492328, "silhouette": 0.11586631834506989, "n": 400}], "composite_fingerprint": "clustering-ari-floor0.3"}
{"experiment_num": 17, "backbone": "birch", "description": "Birch (Zhang 1996) on PCA(50)", "config": {"backbone": "birch", "threshold": 0.5, "branching_factor": 50, "n_clusters": 40, "pca_dim": 50}, "composite": 0.5286568492169416, "val_primary": 0.16080398857593536, "test_primary": 0.5286568492169416, "per_fold_test": [0.5286568492169416], "per_fold_val": [0.16080398857593536], "status": "KEEP", "seconds_elapsed": 0.08078885078430176, "timestamp": "2026-04-25T23:47:53", "secondary_metrics": {"ari": 0.5286568492169416, "nmi": 0.8253783657458292, "fmi": 0.5445171562847789, "homogeneity": 0.8123208591792976, "completeness": 0.8388625113598731, "v_measure": 0.8253783657458292, "silhouette": 0.16080398857593536, "n_pred_clusters": 40, "n_noise": 0, "n_true_clusters": 40}, "per_fold_test_reports": [{"fold_id": 0, "regime": "full-dataset", "ari": 0.5286568492169416, "nmi": 0.8253783657458292, "fmi": 0.5445171562847789, "silhouette": 0.16080398857593536, "n": 400}], "composite_fingerprint": "clustering-ari-floor0.3"}
