{"experiment_num": 58, "backbone": "spectral_hc_RBF_gamma0.05", "description": "Spectral hill-climb: RBF gamma=0.05 on DINOv2 ViT-S/14", "config": {"backbone": "spectral_hill_climb", "axis": "RBF gamma=0.05", "model": "DINOv2 ViT-S/14"}, "composite": 0.050343047509586084, "val_primary": -0.08935914933681488, "test_primary": 0.050343047509586084, "per_fold_test": [0.050343047509586084], "per_fold_val": [-0.08935914933681488], "status": "DISCARD", "seconds_elapsed": 8.305369853973389, "timestamp": "2026-04-25T23:59:43", "secondary_metrics": {"ari": 0.050343047509586084, "nmi": 0.596502037128776, "fmi": 0.18414326776957002, "homogeneity": 0.4740300419878581, "completeness": 0.8043049739353665, "v_measure": 0.596502037128776, "silhouette": -0.08935914933681488, "n_pred_clusters": 40, "n_noise": 0, "n_true_clusters": 40}, "per_fold_test_reports": [{"fold_id": 0, "regime": "full-dataset", "ari": 0.050343047509586084, "nmi": 0.596502037128776, "fmi": 0.18414326776957002, "silhouette": -0.08935914933681488, "n": 400}], "composite_fingerprint": "clustering-ari-floor0.3"}
{"experiment_num": 59, "backbone": "spectral_hc_RBF_gamma0.5", "description": "Spectral hill-climb: RBF gamma=0.5 on DINOv2 ViT-S/14", "config": {"backbone": "spectral_hill_climb", "axis": "RBF gamma=0.5", "model": "DINOv2 ViT-S/14"}, "composite": 1.747441661014785e-05, "val_primary": -0.11899134516716003, "test_primary": 1.747441661014785e-05, "per_fold_test": [1.747441661014785e-05], "per_fold_val": [-0.11899134516716003], "status": "DISCARD", "seconds_elapsed": 0.522951602935791, "timestamp": "2026-04-25T23:59:44", "secondary_metrics": {"ari": 1.747441661014785e-05, "nmi": 0.02966798748045636, "fmi": 0.14798826008538785, "homogeneity": 0.015255257950041883, "completeness": 0.5371840181641895, "v_measure": 0.02966798748045636, "silhouette": -0.11899134516716003, "n_pred_clusters": 7, "n_noise": 0, "n_true_clusters": 40}, "per_fold_test_reports": [{"fold_id": 0, "regime": "full-dataset", "ari": 1.747441661014785e-05, "nmi": 0.02966798748045636, "fmi": 0.14798826008538785, "silhouette": -0.11899134516716003, "n": 400}], "composite_fingerprint": "clustering-ari-floor0.3"}
{"experiment_num": 60, "backbone": "spectral_hc_ViT-B/14_+_cosine", "description": "Spectral hill-climb: ViT-B/14 + cosine on DINOv2 ViT-B/14 768-dim", "config": {"backbone": "spectral_hill_climb", "axis": "ViT-B/14 + cosine", "model": "DINOv2 ViT-B/14 768-dim"}, "composite": 0.6551728676151244, "val_primary": 0.06727728992700577, "test_primary": 0.6551728676151244, "per_fold_test": [0.6551728676151244], "per_fold_val": [0.06727728992700577], "status": "KEEP", "seconds_elapsed": 0.16237950325012207, "timestamp": "2026-04-25T23:59:44", "secondary_metrics": {"ari": 0.6551728676151244, "nmi": 0.8804715132316818, "fmi": 0.6689503511449889, "homogeneity": 0.8652122095789727, "completeness": 0.8962787210008238, "v_measure": 0.8804715132316818, "silhouette": 0.06727728992700577, "n_pred_clusters": 40, "n_noise": 0, "n_true_clusters": 40}, "per_fold_test_reports": [{"fold_id": 0, "regime": "full-dataset", "ari": 0.6551728676151244, "nmi": 0.8804715132316818, "fmi": 0.6689503511449889, "silhouette": 0.06727728992700577, "n": 400}], "composite_fingerprint": "clustering-ari-floor0.3"}
{"experiment_num": 61, "backbone": "spectral_hc_ViT-B/14_+_cluster_qr_+_c", "description": "Spectral hill-climb: ViT-B/14 + cluster_qr + cosine on DINOv2 ViT-B/14", "config": {"backbone": "spectral_hill_climb", "axis": "ViT-B/14 + cluster_qr + cosine", "model": "DINOv2 ViT-B/14"}, "composite": 0.43172540840589824, "val_primary": 0.003273585345596075, "test_primary": 0.43172540840589824, "per_fold_test": [0.43172540840589824], "per_fold_val": [0.003273585345596075], "status": "KEEP", "seconds_elapsed": 0.13544726371765137, "timestamp": "2026-04-25T23:59:44", "secondary_metrics": {"ari": 0.43172540840589824, "nmi": 0.7494848986408607, "fmi": 0.4458001270573467, "homogeneity": 0.7443601637147125, "completeness": 0.7546806878131679, "v_measure": 0.7494848986408607, "silhouette": 0.003273585345596075, "n_pred_clusters": 40, "n_noise": 0, "n_true_clusters": 40}, "per_fold_test_reports": [{"fold_id": 0, "regime": "full-dataset", "ari": 0.43172540840589824, "nmi": 0.7494848986408607, "fmi": 0.4458001270573467, "silhouette": 0.003273585345596075, "n": 400}], "composite_fingerprint": "clustering-ari-floor0.3"}
{"experiment_num": 62, "backbone": "spectral_hc_ViT-B/14_+_L2-norm_+_cosi", "description": "Spectral hill-climb: ViT-B/14 + L2-norm + cosine on DINOv2 ViT-B/14 + L2", "config": {"backbone": "spectral_hill_climb", "axis": "ViT-B/14 + L2-norm + cosine", "model": "DINOv2 ViT-B/14 + L2"}, "composite": 0.6551728676151244, "val_primary": 0.06727729737758636, "test_primary": 0.6551728676151244, "per_fold_test": [0.6551728676151244], "per_fold_val": [0.06727729737758636], "status": "KEEP", "seconds_elapsed": 0.10352730751037598, "timestamp": "2026-04-25T23:59:45", "secondary_metrics": {"ari": 0.6551728676151244, "nmi": 0.8804715132316818, "fmi": 0.6689503511449889, "homogeneity": 0.8652122095789727, "completeness": 0.8962787210008238, "v_measure": 0.8804715132316818, "silhouette": 0.06727729737758636, "n_pred_clusters": 40, "n_noise": 0, "n_true_clusters": 40}, "per_fold_test_reports": [{"fold_id": 0, "regime": "full-dataset", "ari": 0.6551728676151244, "nmi": 0.8804715132316818, "fmi": 0.6689503511449889, "silhouette": 0.06727729737758636, "n": 400}], "composite_fingerprint": "clustering-ari-floor0.3"}
{"experiment_num": 63, "backbone": "spectral_hc_ViT-B/14_+_kNN_k10", "description": "Spectral hill-climb: ViT-B/14 + kNN k=10 on DINOv2 ViT-B/14", "config": {"backbone": "spectral_hill_climb", "axis": "ViT-B/14 + kNN k=10", "model": "DINOv2 ViT-B/14"}, "composite": 0.5489089816078507, "val_primary": 0.049602411687374115, "test_primary": 0.5489089816078507, "per_fold_test": [0.5489089816078507], "per_fold_val": [0.049602411687374115], "status": "KEEP", "seconds_elapsed": 0.10796284675598145, "timestamp": "2026-04-25T23:59:45", "secondary_metrics": {"ari": 0.5489089816078507, "nmi": 0.8214885957092065, "fmi": 0.5603178581720591, "homogeneity": 0.816469762466994, "completeness": 0.8265695120329856, "v_measure": 0.8214885957092065, "silhouette": 0.049602411687374115, "n_pred_clusters": 40, "n_noise": 0, "n_true_clusters": 40}, "per_fold_test_reports": [{"fold_id": 0, "regime": "full-dataset", "ari": 0.5489089816078507, "nmi": 0.8214885957092065, "fmi": 0.5603178581720591, "silhouette": 0.049602411687374115, "n": 400}], "composite_fingerprint": "clustering-ari-floor0.3"}
{"experiment_num": 64, "backbone": "spectral_hc_cosine_+_n_init1", "description": "Spectral hill-climb: cosine + n_init=1 on DINOv2 ViT-S/14", "config": {"backbone": "spectral_hill_climb", "axis": "cosine + n_init=1", "model": "DINOv2 ViT-S/14"}, "composite": 0.7063879264968143, "val_primary": 0.08947461098432541, "test_primary": 0.7063879264968143, "per_fold_test": [0.7063879264968143], "per_fold_val": [0.08947461098432541], "status": "KEEP", "seconds_elapsed": 0.07478785514831543, "timestamp": "2026-04-25T23:59:45", "secondary_metrics": {"ari": 0.7063879264968143, "nmi": 0.9014406506866748, "fmi": 0.7160024805875849, "homogeneity": 0.8914473771171444, "completeness": 0.9116605169199266, "v_measure": 0.9014406506866749, "silhouette": 0.08947461098432541, "n_pred_clusters": 40, "n_noise": 0, "n_true_clusters": 40}, "per_fold_test_reports": [{"fold_id": 0, "regime": "full-dataset", "ari": 0.7063879264968143, "nmi": 0.9014406506866748, "fmi": 0.7160024805875849, "silhouette": 0.08947461098432541, "n": 400}], "composite_fingerprint": "clustering-ari-floor0.3"}
{"experiment_num": 65, "backbone": "spectral_hc_cosine_+_n_init5", "description": "Spectral hill-climb: cosine + n_init=5 on DINOv2 ViT-S/14", "config": {"backbone": "spectral_hill_climb", "axis": "cosine + n_init=5", "model": "DINOv2 ViT-S/14"}, "composite": 0.6742288502356866, "val_primary": 0.09839367121458054, "test_primary": 0.6742288502356866, "per_fold_test": [0.6742288502356866], "per_fold_val": [0.09839367121458054], "status": "KEEP", "seconds_elapsed": 0.09514522552490234, "timestamp": "2026-04-25T23:59:45", "secondary_metrics": {"ari": 0.6742288502356866, "nmi": 0.8829150503577686, "fmi": 0.6843724552619623, "homogeneity": 0.8736432571098638, "completeness": 0.8923857538048784, "v_measure": 0.8829150503577687, "silhouette": 0.09839367121458054, "n_pred_clusters": 40, "n_noise": 0, "n_true_clusters": 40}, "per_fold_test_reports": [{"fold_id": 0, "regime": "full-dataset", "ari": 0.6742288502356866, "nmi": 0.8829150503577686, "fmi": 0.6843724552619623, "silhouette": 0.09839367121458054, "n": 400}], "composite_fingerprint": "clustering-ari-floor0.3"}
{"experiment_num": 66, "backbone": "spectral_hc_cosine_+_n_init25", "description": "Spectral hill-climb: cosine + n_init=25 on DINOv2 ViT-S/14", "config": {"backbone": "spectral_hill_climb", "axis": "cosine + n_init=25", "model": "DINOv2 ViT-S/14"}, "composite": 0.6962579726807369, "val_primary": 0.08901704102754593, "test_primary": 0.6962579726807369, "per_fold_test": [0.6962579726807369], "per_fold_val": [0.08901704102754593], "status": "KEEP", "seconds_elapsed": 0.23108696937561035, "timestamp": "2026-04-25T23:59:45", "secondary_metrics": {"ari": 0.6962579726807369, "nmi": 0.897406840732261, "fmi": 0.7063671196545162, "homogeneity": 0.8871911591046284, "completeness": 0.9078605225179307, "v_measure": 0.8974068407322608, "silhouette": 0.08901704102754593, "n_pred_clusters": 40, "n_noise": 0, "n_true_clusters": 40}, "per_fold_test_reports": [{"fold_id": 0, "regime": "full-dataset", "ari": 0.6962579726807369, "nmi": 0.897406840732261, "fmi": 0.7063671196545162, "silhouette": 0.08901704102754593, "n": 400}], "composite_fingerprint": "clustering-ari-floor0.3"}
{"experiment_num": 67, "backbone": "spectral_hc_cosine_+_n_init50", "description": "Spectral hill-climb: cosine + n_init=50 on DINOv2 ViT-S/14", "config": {"backbone": "spectral_hill_climb", "axis": "cosine + n_init=50", "model": "DINOv2 ViT-S/14"}, "composite": 0.6666253742927875, "val_primary": 0.08055108040571213, "test_primary": 0.6666253742927875, "per_fold_test": [0.6666253742927875], "per_fold_val": [0.08055108040571213], "status": "KEEP", "seconds_elapsed": 0.4081254005432129, "timestamp": "2026-04-25T23:59:46", "secondary_metrics": {"ari": 0.6666253742927875, "nmi": 0.8899825688977174, "fmi": 0.6780100764483227, "homogeneity": 0.8789504435768953, "completeness": 0.9012951533044563, "v_measure": 0.8899825688977173, "silhouette": 0.08055108040571213, "n_pred_clusters": 40, "n_noise": 0, "n_true_clusters": 40}, "per_fold_test_reports": [{"fold_id": 0, "regime": "full-dataset", "ari": 0.6666253742927875, "nmi": 0.8899825688977174, "fmi": 0.6780100764483227, "silhouette": 0.08055108040571213, "n": 400}], "composite_fingerprint": "clustering-ari-floor0.3"}
{"experiment_num": 68, "backbone": "spectral_hc_cosine_seed1_(variance_ch", "description": "Spectral hill-climb: cosine seed=1 (variance check) on DINOv2 ViT-S/14", "config": {"backbone": "spectral_hill_climb", "axis": "cosine seed=1 (variance check)", "model": "DINOv2 ViT-S/14"}, "composite": 0.7154451692422181, "val_primary": 0.08995284885168076, "test_primary": 0.7154451692422181, "per_fold_test": [0.7154451692422181], "per_fold_val": [0.08995284885168076], "status": "KEEP", "seconds_elapsed": 0.16969084739685059, "timestamp": "2026-04-25T23:59:46", "secondary_metrics": {"ari": 0.7154451692422181, "nmi": 0.9051289108272387, "fmi": 0.7257575757575757, "homogeneity": 0.8942081272071599, "completeness": 0.9163197391066061, "v_measure": 0.9051289108272386, "silhouette": 0.08995284885168076, "n_pred_clusters": 40, "n_noise": 0, "n_true_clusters": 40}, "per_fold_test_reports": [{"fold_id": 0, "regime": "full-dataset", "ari": 0.7154451692422181, "nmi": 0.9051289108272387, "fmi": 0.7257575757575757, "silhouette": 0.08995284885168076, "n": 400}], "composite_fingerprint": "clustering-ari-floor0.3"}
{"experiment_num": 69, "backbone": "spectral_hc_cosine_seed7_(variance_ch", "description": "Spectral hill-climb: cosine seed=7 (variance check) on DINOv2 ViT-S/14", "config": {"backbone": "spectral_hill_climb", "axis": "cosine seed=7 (variance check)", "model": "DINOv2 ViT-S/14"}, "composite": 0.659635845276928, "val_primary": 0.08037491142749786, "test_primary": 0.659635845276928, "per_fold_test": [0.659635845276928], "per_fold_val": [0.08037491142749786], "status": "KEEP", "seconds_elapsed": 0.15388822555541992, "timestamp": "2026-04-25T23:59:46", "secondary_metrics": {"ari": 0.659635845276928, "nmi": 0.8709641652787721, "fmi": 0.66962661818712, "homogeneity": 0.8634825795977211, "completeness": 0.8785765314722306, "v_measure": 0.8709641652787721, "silhouette": 0.08037491142749786, "n_pred_clusters": 40, "n_noise": 0, "n_true_clusters": 40}, "per_fold_test_reports": [{"fold_id": 0, "regime": "full-dataset", "ari": 0.659635845276928, "nmi": 0.8709641652787721, "fmi": 0.66962661818712, "silhouette": 0.08037491142749786, "n": 400}], "composite_fingerprint": "clustering-ari-floor0.3"}
{"experiment_num": 70, "backbone": "spectral_hc_cosine_seed42_(variance_c", "description": "Spectral hill-climb: cosine seed=42 (variance check) on DINOv2 ViT-S/14", "config": {"backbone": "spectral_hill_climb", "axis": "cosine seed=42 (variance check)", "model": "DINOv2 ViT-S/14"}, "composite": 0.6127483565994535, "val_primary": 0.07720460742712021, "test_primary": 0.6127483565994535, "per_fold_test": [0.6127483565994535], "per_fold_val": [0.07720460742712021], "status": "KEEP", "seconds_elapsed": 0.1403977870941162, "timestamp": "2026-04-25T23:59:46", "secondary_metrics": {"ari": 0.6127483565994535, "nmi": 0.8608661983364134, "fmi": 0.6249563440175423, "homogeneity": 0.8504178644173744, "completeness": 0.8715744647356676, "v_measure": 0.8608661983364135, "silhouette": 0.07720460742712021, "n_pred_clusters": 40, "n_noise": 0, "n_true_clusters": 40}, "per_fold_test_reports": [{"fold_id": 0, "regime": "full-dataset", "ari": 0.6127483565994535, "nmi": 0.8608661983364134, "fmi": 0.6249563440175423, "silhouette": 0.07720460742712021, "n": 400}], "composite_fingerprint": "clustering-ari-floor0.3"}
{"experiment_num": 71, "backbone": "spectral_hc_cosine_seed99_(variance_c", "description": "Spectral hill-climb: cosine seed=99 (variance check) on DINOv2 ViT-S/14", "config": {"backbone": "spectral_hill_climb", "axis": "cosine seed=99 (variance check)", "model": "DINOv2 ViT-S/14"}, "composite": 0.7194765610712617, "val_primary": 0.09272102266550064, "test_primary": 0.7194765610712617, "per_fold_test": [0.7194765610712617], "per_fold_val": [0.09272102266550064], "status": "KEEP", "seconds_elapsed": 0.2376997470855713, "timestamp": "2026-04-25T23:59:47", "secondary_metrics": {"ari": 0.7194765610712617, "nmi": 0.9003553824322281, "fmi": 0.7270355432739835, "homogeneity": 0.8945303504532298, "completeness": 0.9062567749254509, "v_measure": 0.9003553824322281, "silhouette": 0.09272102266550064, "n_pred_clusters": 40, "n_noise": 0, "n_true_clusters": 40}, "per_fold_test_reports": [{"fold_id": 0, "regime": "full-dataset", "ari": 0.7194765610712617, "nmi": 0.9003553824322281, "fmi": 0.7270355432739835, "silhouette": 0.09272102266550064, "n": 400}], "composite_fingerprint": "clustering-ari-floor0.3"}
{"experiment_num": 72, "backbone": "ward_hc_linkageward_on_DINOv2", "description": "Ward hill-climb: linkage=ward on DINOv2 on DINOv2 384-dim", "config": {"backbone": "ward_hill_climb", "axis": "linkage=ward on DINOv2", "model": "DINOv2 384-dim"}, "composite": 0.6370946321203487, "val_primary": 0.08336354047060013, "test_primary": 0.6370946321203487, "per_fold_test": [0.6370946321203487], "per_fold_val": [0.08336354047060013], "status": "KEEP", "seconds_elapsed": 0.27210092544555664, "timestamp": "2026-04-26T01:26:16", "secondary_metrics": {"ari": 0.6370946321203487, "nmi": 0.8705842700000564, "fmi": 0.6469165218119676, "homogeneity": 0.863755068406218, "completeness": 0.877522321136698, "v_measure": 0.8705842700000566, "silhouette": 0.08336354047060013, "n_pred_clusters": 40, "n_noise": 0, "n_true_clusters": 40}, "per_fold_test_reports": [{"fold_id": 0, "regime": "full-dataset", "ari": 0.6370946321203487, "nmi": 0.8705842700000564, "fmi": 0.6469165218119676, "silhouette": 0.08336354047060013, "n": 400}], "composite_fingerprint": "clustering-ari-floor0.3"}
{"experiment_num": 73, "backbone": "ward_hc_linkageward_on_DINOv2_L2-norm", "description": "Ward hill-climb: linkage=ward on DINOv2 L2-norm on DINOv2 L2-norm 384-dim", "config": {"backbone": "ward_hill_climb", "axis": "linkage=ward on DINOv2 L2-norm", "model": "DINOv2 L2-norm 384-dim"}, "composite": 0.6366142071639194, "val_primary": 0.07505092024803162, "test_primary": 0.6366142071639194, "per_fold_test": [0.6366142071639194], "per_fold_val": [0.07505092024803162], "status": "KEEP", "seconds_elapsed": 0.0084686279296875, "timestamp": "2026-04-26T01:26:16", "secondary_metrics": {"ari": 0.6366142071639194, "nmi": 0.8721129062230614, "fmi": 0.6466231505947508, "homogeneity": 0.8649915165891198, "completeness": 0.8793525286494152, "v_measure": 0.8721129062230614, "silhouette": 0.07505092024803162, "n_pred_clusters": 40, "n_noise": 0, "n_true_clusters": 40}, "per_fold_test_reports": [{"fold_id": 0, "regime": "full-dataset", "ari": 0.6366142071639194, "nmi": 0.8721129062230614, "fmi": 0.6466231505947508, "silhouette": 0.07505092024803162, "n": 400}], "composite_fingerprint": "clustering-ari-floor0.3"}
{"experiment_num": 74, "backbone": "ward_hc_linkageaverage_on_DINOv2", "description": "Ward hill-climb: linkage=average on DINOv2 on DINOv2 384-dim", "config": {"backbone": "ward_hill_climb", "axis": "linkage=average on DINOv2", "model": "DINOv2 384-dim"}, "composite": 0.4702640883329394, "val_primary": 0.02259155362844467, "test_primary": 0.4702640883329394, "per_fold_test": [0.4702640883329394], "per_fold_val": [0.02259155362844467], "status": "KEEP", "seconds_elapsed": 0.009968280792236328, "timestamp": "2026-04-26T01:26:16", "secondary_metrics": {"ari": 0.4702640883329394, "nmi": 0.8157838672030474, "fmi": 0.5029335472362698, "homogeneity": 0.7828464139830738, "completeness": 0.8516146738335845, "v_measure": 0.8157838672030473, "silhouette": 0.02259155362844467, "n_pred_clusters": 40, "n_noise": 0, "n_true_clusters": 40}, "per_fold_test_reports": [{"fold_id": 0, "regime": "full-dataset", "ari": 0.4702640883329394, "nmi": 0.8157838672030474, "fmi": 0.5029335472362698, "silhouette": 0.02259155362844467, "n": 400}], "composite_fingerprint": "clustering-ari-floor0.3"}
{"experiment_num": 75, "backbone": "ward_hc_linkageaverage_on_DINOv2_L2-no", "description": "Ward hill-climb: linkage=average on DINOv2 L2-norm on DINOv2 L2-norm 384-dim", "config": {"backbone": "ward_hill_climb", "axis": "linkage=average on DINOv2 L2-norm", "model": "DINOv2 L2-norm 384-dim"}, "composite": 0.46307472375209013, "val_primary": 0.023990117013454437, "test_primary": 0.46307472375209013, "per_fold_test": [0.46307472375209013], "per_fold_val": [0.023990117013454437], "status": "KEEP", "seconds_elapsed": 0.009196043014526367, "timestamp": "2026-04-26T01:26:16", "secondary_metrics": {"ari": 0.46307472375209013, "nmi": 0.8233638282319615, "fmi": 0.5011200979208579, "homogeneity": 0.7882374934378923, "completeness": 0.8617668623071486, "v_measure": 0.8233638282319614, "silhouette": 0.023990117013454437, "n_pred_clusters": 40, "n_noise": 0, "n_true_clusters": 40}, "per_fold_test_reports": [{"fold_id": 0, "regime": "full-dataset", "ari": 0.46307472375209013, "nmi": 0.8233638282319615, "fmi": 0.5011200979208579, "silhouette": 0.023990117013454437, "n": 400}], "composite_fingerprint": "clustering-ari-floor0.3"}
{"experiment_num": 76, "backbone": "ward_hc_linkagecomplete_on_DINOv2", "description": "Ward hill-climb: linkage=complete on DINOv2 on DINOv2 384-dim", "config": {"backbone": "ward_hill_climb", "axis": "linkage=complete on DINOv2", "model": "DINOv2 384-dim"}, "composite": 0.48053845715556553, "val_primary": 0.023389821872115135, "test_primary": 0.48053845715556553, "per_fold_test": [0.48053845715556553], "per_fold_val": [0.023389821872115135], "status": "KEEP", "seconds_elapsed": 0.009000062942504883, "timestamp": "2026-04-26T01:26:16", "secondary_metrics": {"ari": 0.48053845715556553, "nmi": 0.8071311527179613, "fmi": 0.49903083321354, "homogeneity": 0.7901345910546235, "completeness": 0.8248750145978028, "v_measure": 0.8071311527179613, "silhouette": 0.023389821872115135, "n_pred_clusters": 40, "n_noise": 0, "n_true_clusters": 40}, "per_fold_test_reports": [{"fold_id": 0, "regime": "full-dataset", "ari": 0.48053845715556553, "nmi": 0.8071311527179613, "fmi": 0.49903083321354, "silhouette": 0.023389821872115135, "n": 400}], "composite_fingerprint": "clustering-ari-floor0.3"}
{"experiment_num": 77, "backbone": "ward_hc_linkagecomplete_on_DINOv2_L2-n", "description": "Ward hill-climb: linkage=complete on DINOv2 L2-norm on DINOv2 L2-norm 384-dim", "config": {"backbone": "ward_hill_climb", "axis": "linkage=complete on DINOv2 L2-norm", "model": "DINOv2 L2-norm 384-dim"}, "composite": 0.49255438897721643, "val_primary": 0.030587710440158844, "test_primary": 0.49255438897721643, "per_fold_test": [0.49255438897721643], "per_fold_val": [0.030587710440158844], "status": "KEEP", "seconds_elapsed": 0.007957220077514648, "timestamp": "2026-04-26T01:26:16", "secondary_metrics": {"ari": 0.49255438897721643, "nmi": 0.8111708824943628, "fmi": 0.5106832724613869, "homogeneity": 0.7937208943695052, "completeness": 0.8294053959263217, "v_measure": 0.8111708824943628, "silhouette": 0.030587710440158844, "n_pred_clusters": 40, "n_noise": 0, "n_true_clusters": 40}, "per_fold_test_reports": [{"fold_id": 0, "regime": "full-dataset", "ari": 0.49255438897721643, "nmi": 0.8111708824943628, "fmi": 0.5106832724613869, "silhouette": 0.030587710440158844, "n": 400}], "composite_fingerprint": "clustering-ari-floor0.3"}
