{"experiment_num": 2, "backbone": "xgboost", "description": "XGBoost \u2014 chronological 80/20 holdout (FDB-comparable; ceiling 0.636)", "config": {"paths": {"results_dir": "C:/Users/abhir/clauderesearch/autoresearch/generalized_ml_autoresearch/examples/fraud_ecommerce/autoresearch_results"}, "task_type": "binary_classification", "primary_metric": "auc_roc", "backbone": "xgboost", "backbone_config": {"n_estimators": 600, "max_depth": 6, "learning_rate": 0.05, "subsample": 0.85, "colsample_bytree": 0.85, "reg_lambda": 1.0, "min_child_weight": 5, "seed": 0, "early_stopping_rounds": 40, "n_jobs": 4}, "data": {"format": "csv", "path": "C:/Users/abhir/clauderesearch/autoresearch/generalized_ml_autoresearch/examples/fraud_ecommerce/data/features.csv", "target_columns": ["class"], "feature_columns": null}, "split": {"name": "holdout", "order": "time", "test_fraction": 0.2, "val_fraction": 0.1, "seed": 0}, "composite": {"higher_is_better": true, "penalty_weight": 0.05, "below_threshold": 0.55}, "description": "XGBoost \u2014 chronological 80/20 holdout (FDB-comparable; ceiling 0.636)", "seed": 0}, "composite": 0.5098192997749235, "val_primary": 0.529091785816566, "test_primary": 0.5098192997749235, "per_fold_test": [0.5098192997749235], "per_fold_val": [0.529091785816566], "status": "KEEP", "seconds_elapsed": 0.8819234371185303, "timestamp": "2026-04-24T17:54:46", "secondary_metrics": {"accuracy": 0.9540401032360533, "precision": 0.0, "recall": 0.0, "f1": 0.0, "f2": 0.0, "mcc": 0.0, "auc_pr": 0.047945952283509424, "log_loss": 0.18709072117051342, "tn": 28833.0, "fp": 0.0, "fn": 1389.0, "tp": 0.0}, "per_fold_test_reports": [{"fold_id": 0, "regime": "holdout", "task_type": "binary_classification", "n": 30222, "accuracy": 0.9540401032360533, "precision": 0.0, "recall": 0.0, "f1": 0.0, "f2": 0.0, "mcc": 0.0, "auc_roc": 0.5098192997749235, "auc_pr": 0.047945952283509424, "log_loss": 0.18709072117051342, "tn": 28833, "fp": 0, "fn": 1389, "tp": 0}], "composite_fingerprint": "6dde2c449fb3f13d"}
{"experiment_num": 3, "backbone": "xgboost", "description": "XGBoost + cyclical temporal features (hour, dow, signup_hour) on chronological holdout", "config": {"paths": {"results_dir": "C:/Users/abhir/clauderesearch/autoresearch/generalized_ml_autoresearch/examples/fraud_ecommerce/autoresearch_results"}, "task_type": "binary_classification", "primary_metric": "auc_roc", "backbone": "xgboost", "backbone_config": {"n_estimators": 600, "max_depth": 6, "learning_rate": 0.05, "subsample": 0.85, "colsample_bytree": 0.85, "reg_lambda": 1.0, "min_child_weight": 5, "seed": 0, "early_stopping_rounds": 40, "n_jobs": 4}, "data": {"format": "csv", "path": "C:/Users/abhir/clauderesearch/autoresearch/generalized_ml_autoresearch/examples/fraud_ecommerce/data/features.csv", "target_columns": ["class"], "feature_columns": null}, "split": {"name": "holdout", "order": "time", "test_fraction": 0.2, "val_fraction": 0.1, "seed": 0}, "composite": {"higher_is_better": true, "penalty_weight": 0.05, "below_threshold": 0.55}, "description": "XGBoost + cyclical temporal features (hour, dow, signup_hour) on chronological holdout", "seed": 0}, "composite": 0.5116164216383031, "val_primary": 0.5134021500109798, "test_primary": 0.5116164216383031, "per_fold_test": [0.5116164216383031], "per_fold_val": [0.5134021500109798], "status": "KEEP", "seconds_elapsed": 1.7642550468444824, "timestamp": "2026-04-24T17:58:46", "secondary_metrics": {"accuracy": 0.9540401032360533, "precision": 0.0, "recall": 0.0, "f1": 0.0, "f2": 0.0, "mcc": 0.0, "auc_pr": 0.04807931960255594, "log_loss": 0.18704474210746422, "tn": 28833.0, "fp": 0.0, "fn": 1389.0, "tp": 0.0}, "per_fold_test_reports": [{"fold_id": 0, "regime": "holdout", "task_type": "binary_classification", "n": 30222, "accuracy": 0.9540401032360533, "precision": 0.0, "recall": 0.0, "f1": 0.0, "f2": 0.0, "mcc": 0.0, "auc_roc": 0.5116164216383031, "auc_pr": 0.04807931960255594, "log_loss": 0.18704474210746422, "tn": 28833, "fp": 0, "fn": 1389, "tp": 0}], "composite_fingerprint": "6dde2c449fb3f13d"}
{"experiment_num": 4, "backbone": "xgboost", "description": "Exp 4 \u2014 XGBoost chronological holdout WITHOUT the adversarial time_since_signup", "config": {"paths": {"results_dir": "C:/Users/abhir/clauderesearch/autoresearch/generalized_ml_autoresearch/examples/fraud_ecommerce/autoresearch_results"}, "task_type": "binary_classification", "primary_metric": "auc_roc", "backbone": "xgboost", "backbone_config": {"n_estimators": 600, "max_depth": 6, "learning_rate": 0.05, "subsample": 0.85, "colsample_bytree": 0.85, "reg_lambda": 1.0, "min_child_weight": 5, "seed": 0, "early_stopping_rounds": 40, "n_jobs": 4}, "data": {"format": "csv", "path": "C:/Users/abhir/clauderesearch/autoresearch/generalized_ml_autoresearch/examples/fraud_ecommerce/data/features.csv", "target_columns": ["class"], "feature_columns": ["purchase_value", "device_id", "source", "browser", "age", "ip_address", "country", "purchase_hour", "purchase_dayofweek", "signup_hour"]}, "split": {"name": "holdout", "order": "time", "test_fraction": 0.2, "val_fraction": 0.1, "seed": 0}, "composite": {"higher_is_better": true, "penalty_weight": 0.05, "below_threshold": 0.55}, "description": "Exp 4 \u2014 XGBoost chronological holdout WITHOUT the adversarial time_since_signup", "seed": 0}, "composite": 0.44597293687735867, "val_primary": 0.5054365546392817, "test_primary": 0.49597293687735866, "per_fold_test": [0.49597293687735866], "per_fold_val": [0.5054365546392817], "status": "DISCARD", "seconds_elapsed": 4.206135272979736, "timestamp": "2026-04-24T18:00:23", "secondary_metrics": {"accuracy": 0.9525511216994242, "precision": 0.058823529411764705, "recall": 0.0021598272138228943, "f1": 0.004166666666666667, "f2": 0.002675227394328518, "mcc": 0.00252569571401647, "auc_pr": 0.044988629133074456, "log_loss": 0.20797826132605995, "tn": 28785.0, "fp": 48.0, "fn": 1386.0, "tp": 3.0}, "per_fold_test_reports": [{"fold_id": 0, "regime": "holdout", "task_type": "binary_classification", "n": 30222, "accuracy": 0.9525511216994242, "precision": 0.058823529411764705, "recall": 0.0021598272138228943, "f1": 0.004166666666666667, "f2": 0.002675227394328518, "mcc": 0.00252569571401647, "auc_roc": 0.49597293687735866, "auc_pr": 0.044988629133074456, "log_loss": 0.20797826132605995, "tn": 28785, "fp": 48, "fn": 1386, "tp": 3}], "composite_fingerprint": "6dde2c449fb3f13d"}
{"experiment_num": 5, "backbone": "xgboost", "description": "Exp 5 \u2014 XGBoost + velocity/frequency features (AFD-TFI-style) on chronological holdout", "config": {"paths": {"results_dir": "C:/Users/abhir/clauderesearch/autoresearch/generalized_ml_autoresearch/examples/fraud_ecommerce/autoresearch_results"}, "task_type": "binary_classification", "primary_metric": "auc_roc", "backbone": "xgboost", "backbone_config": {"n_estimators": 600, "max_depth": 6, "learning_rate": 0.05, "subsample": 0.85, "colsample_bytree": 0.85, "reg_lambda": 1.0, "min_child_weight": 5, "seed": 0, "early_stopping_rounds": 40, "n_jobs": 4}, "data": {"format": "csv", "path": "C:/Users/abhir/clauderesearch/autoresearch/generalized_ml_autoresearch/examples/fraud_ecommerce/data/features_velocity.csv", "target_columns": ["class"], "feature_columns": ["purchase_value", "device_id", "source", "browser", "age", "ip_address", "country", "time_since_signup", "purchase_hour", "purchase_dayofweek", "signup_hour", "device_id_freq", "ip_address_freq", "country_freq", "source_freq", "browser_freq", "device_fraud_rate_train", "country_fraud_rate_train"]}, "split": {"name": "holdout", "order": "time", "test_fraction": 0.2, "val_fraction": 0.1, "seed": 0}, "composite": {"higher_is_better": true, "penalty_weight": 0.05, "below_threshold": 0.55}, "description": "Exp 5 \u2014 XGBoost + velocity/frequency features (AFD-TFI-style) on chronological holdout", "seed": 0}, "composite": 0.5296896402278037, "val_primary": 0.99884393648532, "test_primary": 0.5296896402278037, "per_fold_test": [0.5296896402278037], "per_fold_val": [0.99884393648532], "status": "KEEP", "seconds_elapsed": 2.137599468231201, "timestamp": "2026-04-24T18:01:50", "secondary_metrics": {"accuracy": 0.9460657798954404, "precision": 0.21103117505995203, "recall": 0.06335493160547156, "f1": 0.09745293466223699, "f2": 0.07366482504604052, "mcc": 0.09324426741723925, "auc_pr": 0.06706482892803232, "log_loss": 0.4794781885803735, "tn": 28504.0, "fp": 329.0, "fn": 1301.0, "tp": 88.0}, "per_fold_test_reports": [{"fold_id": 0, "regime": "holdout", "task_type": "binary_classification", "n": 30222, "accuracy": 0.9460657798954404, "precision": 0.21103117505995203, "recall": 0.06335493160547156, "f1": 0.09745293466223699, "f2": 0.07366482504604052, "mcc": 0.09324426741723925, "auc_roc": 0.5296896402278037, "auc_pr": 0.06706482892803232, "log_loss": 0.4794781885803735, "tn": 28504, "fp": 329, "fn": 1301, "tp": 88}], "composite_fingerprint": "6dde2c449fb3f13d"}
{"experiment_num": 6, "backbone": "xgboost", "description": "Exp 6 \u2014 XGBoost + velocity features (LEAKAGE FIXED: 70/10/20 alignment) on chronological holdout", "config": {"paths": {"results_dir": "C:/Users/abhir/clauderesearch/autoresearch/generalized_ml_autoresearch/examples/fraud_ecommerce/autoresearch_results"}, "task_type": "binary_classification", "primary_metric": "auc_roc", "backbone": "xgboost", "backbone_config": {"n_estimators": 600, "max_depth": 6, "learning_rate": 0.05, "subsample": 0.85, "colsample_bytree": 0.85, "reg_lambda": 1.0, "min_child_weight": 5, "seed": 0, "early_stopping_rounds": 40, "n_jobs": 4}, "data": {"format": "csv", "path": "C:/Users/abhir/clauderesearch/autoresearch/generalized_ml_autoresearch/examples/fraud_ecommerce/data/features_velocity.csv", "target_columns": ["class"], "feature_columns": ["purchase_value", "device_id", "source", "browser", "age", "ip_address", "country", "time_since_signup", "purchase_hour", "purchase_dayofweek", "signup_hour", "device_id_freq", "ip_address_freq", "country_freq", "source_freq", "browser_freq", "device_fraud_rate_train", "country_fraud_rate_train"]}, "split": {"name": "holdout", "order": "time", "test_fraction": 0.2, "val_fraction": 0.1, "seed": 0}, "composite": {"higher_is_better": true, "penalty_weight": 0.05, "below_threshold": 0.55}, "description": "Exp 6 \u2014 XGBoost + velocity features (LEAKAGE FIXED: 70/10/20 alignment) on chronological holdout", "seed": 0}, "composite": 0.5403087086272655, "val_primary": 0.5403087086272655, "test_primary": 0.5414329063642654, "per_fold_test": [0.5414329063642654], "per_fold_val": [0.5403087086272655], "status": "KEEP", "seconds_elapsed": 1.4238362312316895, "timestamp": "2026-04-24T18:03:54", "secondary_metrics": {"accuracy": 0.9475878499106611, "precision": 0.21902017291066284, "recall": 0.054715622750179986, "f1": 0.08755760368663594, "f2": 0.06437404709469761, "mcc": 0.08907079634380681, "auc_pr": 0.06533134749579153, "log_loss": 0.18747288308989782, "tn": 28562.0, "fp": 271.0, "fn": 1313.0, "tp": 76.0}, "per_fold_test_reports": [{"fold_id": 0, "regime": "holdout", "task_type": "binary_classification", "n": 30222, "accuracy": 0.9475878499106611, "precision": 0.21902017291066284, "recall": 0.054715622750179986, "f1": 0.08755760368663594, "f2": 0.06437404709469761, "mcc": 0.08907079634380681, "auc_roc": 0.5414329063642654, "auc_pr": 0.06533134749579153, "log_loss": 0.18747288308989782, "tn": 28562, "fp": 271, "fn": 1313, "tp": 76}], "composite_fingerprint": "6dde2c449fb3f13d"}
{"experiment_num": 7, "backbone": "lightgbm", "description": "Exp 7 \u2014 LightGBM (Ke 2017 NeurIPS) chronological + velocity features", "config": {"paths": {"results_dir": "C:/Users/abhir/clauderesearch/autoresearch/generalized_ml_autoresearch/examples/fraud_ecommerce/autoresearch_results"}, "task_type": "binary_classification", "primary_metric": "auc_roc", "backbone": "lightgbm", "backbone_config": {"n_estimators": 800, "num_leaves": 63, "learning_rate": 0.04, "feature_fraction": 0.85, "bagging_fraction": 0.85, "min_data_in_leaf": 50, "reg_lambda": 1.0, "seed": 0, "early_stopping_rounds": 50, "n_jobs": 4}, "data": {"format": "csv", "path": "C:/Users/abhir/clauderesearch/autoresearch/generalized_ml_autoresearch/examples/fraud_ecommerce/data/features_velocity.csv", "target_columns": ["class"], "feature_columns": ["purchase_value", "device_id", "source", "browser", "age", "ip_address", "country", "time_since_signup", "purchase_hour", "purchase_dayofweek", "signup_hour", "device_id_freq", "ip_address_freq", "country_freq", "source_freq", "browser_freq", "device_fraud_rate_train", "country_fraud_rate_train"]}, "split": {"name": "holdout", "order": "time", "test_fraction": 0.2, "val_fraction": 0.1, "seed": 0}, "composite": {"higher_is_better": true, "penalty_weight": 0.05, "below_threshold": 0.55}, "description": "Exp 7 \u2014 LightGBM (Ke 2017 NeurIPS) chronological + velocity features", "seed": 0}, "composite": 0.5304904959387662, "val_primary": 0.5413208713788263, "test_primary": 0.5304904959387662, "per_fold_test": [0.5304904959387662], "per_fold_val": [0.5413208713788263], "status": "KEEP", "seconds_elapsed": 1.5025269985198975, "timestamp": "2026-04-24T21:02:01", "secondary_metrics": {"accuracy": 0.9475878499106611, "precision": 0.21902017291066284, "recall": 0.054715622750179986, "f1": 0.08755760368663594, "f2": 0.06437404709469761, "mcc": 0.08907079634380681, "auc_pr": 0.06478893319004293, "log_loss": 0.18791962319350883, "tn": 28562.0, "fp": 271.0, "fn": 1313.0, "tp": 76.0}, "per_fold_test_reports": [{"fold_id": 0, "regime": "holdout", "task_type": "binary_classification", "n": 30222, "accuracy": 0.9475878499106611, "precision": 0.21902017291066284, "recall": 0.054715622750179986, "f1": 0.08755760368663594, "f2": 0.06437404709469761, "mcc": 0.08907079634380681, "auc_roc": 0.5304904959387662, "auc_pr": 0.06478893319004293, "log_loss": 0.18791962319350883, "tn": 28562, "fp": 271, "fn": 1313, "tp": 76}], "composite_fingerprint": "6dde2c449fb3f13d"}
{"experiment_num": 8, "backbone": "catboost", "description": "Exp 8 \u2014 CatBoost (Prokhorenkova 2018 NeurIPS) chronological + velocity features", "config": {"paths": {"results_dir": "C:/Users/abhir/clauderesearch/autoresearch/generalized_ml_autoresearch/examples/fraud_ecommerce/autoresearch_results"}, "task_type": "binary_classification", "primary_metric": "auc_roc", "backbone": "catboost", "backbone_config": {"iterations": 1000, "depth": 6, "learning_rate": 0.04, "l2_leaf_reg": 3.0, "bootstrap_type": "Bernoulli", "subsample": 0.85, "random_strength": 1.0, "random_state": 0, "early_stopping_rounds": 50, "thread_count": 4, "verbose": 0}, "data": {"format": "csv", "path": "C:/Users/abhir/clauderesearch/autoresearch/generalized_ml_autoresearch/examples/fraud_ecommerce/data/features_velocity.csv", "target_columns": ["class"], "feature_columns": ["purchase_value", "device_id", "source", "browser", "age", "ip_address", "country", "time_since_signup", "purchase_hour", "purchase_dayofweek", "signup_hour", "device_id_freq", "ip_address_freq", "country_freq", "source_freq", "browser_freq", "device_fraud_rate_train", "country_fraud_rate_train"]}, "split": {"name": "holdout", "order": "time", "test_fraction": 0.2, "val_fraction": 0.1, "seed": 0}, "composite": {"higher_is_better": true, "penalty_weight": 0.05, "below_threshold": 0.55}, "description": "Exp 8 \u2014 CatBoost (Prokhorenkova 2018 NeurIPS) chronological + velocity features", "seed": 0}, "composite": 0.5245451469906754, "val_primary": 0.5400247525503932, "test_primary": 0.5245451469906754, "per_fold_test": [0.5245451469906754], "per_fold_val": [0.5400247525503932], "status": "KEEP", "seconds_elapsed": 2.010784387588501, "timestamp": "2026-04-24T21:02:03", "secondary_metrics": {"accuracy": 0.9475878499106611, "precision": 0.21902017291066284, "recall": 0.054715622750179986, "f1": 0.08755760368663594, "f2": 0.06437404709469761, "mcc": 0.08907079634380681, "auc_pr": 0.061204677605999, "log_loss": 0.19602838347450918, "tn": 28562.0, "fp": 271.0, "fn": 1313.0, "tp": 76.0}, "per_fold_test_reports": [{"fold_id": 0, "regime": "holdout", "task_type": "binary_classification", "n": 30222, "accuracy": 0.9475878499106611, "precision": 0.21902017291066284, "recall": 0.054715622750179986, "f1": 0.08755760368663594, "f2": 0.06437404709469761, "mcc": 0.08907079634380681, "auc_roc": 0.5245451469906754, "auc_pr": 0.061204677605999, "log_loss": 0.19602838347450918, "tn": 28562, "fp": 271, "fn": 1313, "tp": 76}], "composite_fingerprint": "6dde2c449fb3f13d"}
{"experiment_num": 9, "backbone": "mlp", "description": "Exp 9 \u2014 MLP (Gu/Kelly/Xiu 2020) chronological + velocity features", "config": {"paths": {"results_dir": "C:/Users/abhir/clauderesearch/autoresearch/generalized_ml_autoresearch/examples/fraud_ecommerce/autoresearch_results"}, "task_type": "binary_classification", "primary_metric": "auc_roc", "backbone": "mlp", "backbone_config": {"hidden": [128, 64], "dropout": 0.3, "epochs": 30, "patience": 8, "lr": 0.001, "batch_size": 256, "weight_decay": 0.0001, "seed": 0}, "data": {"format": "csv", "path": "C:/Users/abhir/clauderesearch/autoresearch/generalized_ml_autoresearch/examples/fraud_ecommerce/data/features_velocity.csv", "target_columns": ["class"], "feature_columns": ["purchase_value", "device_id", "source", "browser", "age", "ip_address", "country", "time_since_signup", "purchase_hour", "purchase_dayofweek", "signup_hour", "device_id_freq", "ip_address_freq", "country_freq", "source_freq", "browser_freq", "device_fraud_rate_train", "country_fraud_rate_train"]}, "split": {"name": "holdout", "order": "time", "test_fraction": 0.2, "val_fraction": 0.1, "seed": 0}, "composite": {"higher_is_better": true, "penalty_weight": 0.05, "below_threshold": 0.55}, "description": "Exp 9 \u2014 MLP (Gu/Kelly/Xiu 2020) chronological + velocity features", "seed": 0}, "composite": 0.42750482958081565, "val_primary": 0.47750482958081564, "test_primary": 0.48834254117021586, "per_fold_test": [0.48834254117021586], "per_fold_val": [0.47750482958081564], "status": "DISCARD", "seconds_elapsed": 28.66038751602173, "timestamp": "2026-04-24T21:02:32", "secondary_metrics": {"accuracy": 0.9474224075177023, "precision": 0.2222222222222222, "recall": 0.05759539236861051, "f1": 0.09148084619782733, "f2": 0.0676132521974307, "mcc": 0.0924226597949243, "auc_pr": 0.0607420029618203, "log_loss": 0.4126349027587425, "tn": 28553.0, "fp": 280.0, "fn": 1309.0, "tp": 80.0}, "per_fold_test_reports": [{"fold_id": 0, "regime": "holdout", "task_type": "binary_classification", "n": 30222, "accuracy": 0.9474224075177023, "precision": 0.2222222222222222, "recall": 0.05759539236861051, "f1": 0.09148084619782733, "f2": 0.0676132521974307, "mcc": 0.0924226597949243, "auc_roc": 0.48834254117021586, "auc_pr": 0.0607420029618203, "log_loss": 0.4126349027587425, "tn": 28553, "fp": 280, "fn": 1309, "tp": 80}], "composite_fingerprint": "6dde2c449fb3f13d"}
{"experiment_num": 10, "backbone": "xgboost", "description": "XGBoost + ROLLING velocity features (1d/7d/30d windows)", "config": {"paths": {"results_dir": "C:\\Users\\abhir\\clauderesearch\\autoresearch\\generalized_ml_autoresearch\\examples\\fraud_ecommerce\\autoresearch_results"}, "task_type": "binary_classification", "primary_metric": "auc_roc", "backbone": "xgboost", "backbone_config": {"n_estimators": 600, "max_depth": 6, "learning_rate": 0.05, "subsample": 0.85, "colsample_bytree": 0.85, "reg_lambda": 1.0, "min_child_weight": 5, "early_stopping_rounds": 40, "n_jobs": 4, "seed": 0}, "data": {"format": "csv", "path": "C:\\Users\\abhir\\clauderesearch\\autoresearch\\generalized_ml_autoresearch\\examples\\fraud_ecommerce\\data\\features_rolling.csv", "target_columns": ["class"], "feature_columns": ["purchase_value", "device_id", "source", "browser", "age", "ip_address", "country", "time_since_signup", "purchase_hour", "purchase_dayofweek", "signup_hour", "device_id_freq", "ip_address_freq", "country_freq", "source_freq", "browser_freq", "device_fraud_rate_train", "country_fraud_rate_train", "device_id_count_1d", "device_id_count_7d", "device_id_count_30d", "ip_address_count_1d", "ip_address_count_7d", "ip_address_count_30d", "device_id_fraud_count_7d"]}, "split": {"name": "holdout", "order": "time", "test_fraction": 0.2, "val_fraction": 0.1, "seed": 0}, "composite": {"higher_is_better": true, "penalty_weight": 0.05, "below_threshold": 0.5}, "description": "XGBoost + ROLLING velocity features (1d/7d/30d windows)", "seed": 0}, "composite": 0.5255907526565496, "val_primary": 0.535186519473659, "test_primary": 0.5255907526565496, "per_fold_test": [0.5255907526565496], "per_fold_val": [0.535186519473659], "status": "KEEP", "seconds_elapsed": 1.0457658767700195, "timestamp": "2026-04-24T21:12:48", "secondary_metrics": {"accuracy": 0.9475878499106611, "precision": 0.21902017291066284, "recall": 0.054715622750179986, "f1": 0.08755760368663594, "f2": 0.06437404709469761, "mcc": 0.08907079634380681, "auc_pr": 0.0606180454354096, "log_loss": 0.18831076997849744, "tn": 28562.0, "fp": 271.0, "fn": 1313.0, "tp": 76.0}, "per_fold_test_reports": [{"fold_id": 0, "regime": "holdout", "task_type": "binary_classification", "n": 30222, "accuracy": 0.9475878499106611, "precision": 0.21902017291066284, "recall": 0.054715622750179986, "f1": 0.08755760368663594, "f2": 0.06437404709469761, "mcc": 0.08907079634380681, "auc_roc": 0.5255907526565496, "auc_pr": 0.0606180454354096, "log_loss": 0.18831076997849744, "tn": 28562, "fp": 271, "fn": 1313, "tp": 76}], "composite_fingerprint": "e692f018120592ed"}
