{"experiment_num": 35, "backbone": "catboost", "description": "CatBoost rolling, l2_leaf_reg=10.0", "config": {"paths": {"results_dir": "C:\\Users\\abhir\\clauderesearch\\autoresearch\\generalized_ml_autoresearch\\examples\\fraud_ecommerce\\autoresearch_results"}, "task_type": "binary_classification", "primary_metric": "auc_roc", "backbone": "catboost", "backbone_config": {"iterations": 1000, "depth": 6, "learning_rate": 0.04, "l2_leaf_reg": 10.0, "bootstrap_type": "Bernoulli", "subsample": 0.85, "random_strength": 1.0, "early_stopping_rounds": 50, "thread_count": 4, "verbose": 0, "seed": 0}, "data": {"format": "csv", "path": "C:\\Users\\abhir\\clauderesearch\\autoresearch\\generalized_ml_autoresearch\\examples\\fraud_ecommerce\\data\\features_rolling.csv", "target_columns": ["class"], "feature_columns": ["purchase_value", "device_id", "source", "browser", "age", "ip_address", "country", "time_since_signup", "purchase_hour", "purchase_dayofweek", "signup_hour", "device_id_freq", "ip_address_freq", "country_freq", "source_freq", "browser_freq", "device_fraud_rate_train", "country_fraud_rate_train", "device_id_count_1d", "device_id_count_7d", "device_id_count_30d", "ip_address_count_1d", "ip_address_count_7d", "ip_address_count_30d", "device_id_fraud_count_7d"]}, "split": {"name": "holdout", "order": "time", "test_fraction": 0.2, "val_fraction": 0.1, "seed": 0}, "composite": {"higher_is_better": true, "penalty_weight": 0.05, "below_threshold": 0.5}, "description": "CatBoost rolling, l2_leaf_reg=10.0", "seed": 0}, "composite": 0.5226438902887978, "val_primary": 0.5230965278628105, "test_primary": 0.5226438902887978, "per_fold_test": [0.5226438902887978], "per_fold_val": [0.5230965278628105], "status": "KEEP", "seconds_elapsed": 1.3440310955047607, "timestamp": "2026-04-24T21:13:15", "secondary_metrics": {"accuracy": 0.9474885844748858, "precision": 0.22191011235955055, "recall": 0.05687544996400288, "f1": 0.09054441260744986, "f2": 0.06681326116373477, "mcc": 0.09173888012648923, "auc_pr": 0.06394171497122633, "log_loss": 0.1952084451273813, "tn": 28556.0, "fp": 277.0, "fn": 1310.0, "tp": 79.0}, "per_fold_test_reports": [{"fold_id": 0, "regime": "holdout", "task_type": "binary_classification", "n": 30222, "accuracy": 0.9474885844748858, "precision": 0.22191011235955055, "recall": 0.05687544996400288, "f1": 0.09054441260744986, "f2": 0.06681326116373477, "mcc": 0.09173888012648923, "auc_roc": 0.5226438902887978, "auc_pr": 0.06394171497122633, "log_loss": 0.1952084451273813, "tn": 28556, "fp": 277, "fn": 1310, "tp": 79}], "composite_fingerprint": "e692f018120592ed"}
{"experiment_num": 36, "backbone": "catboost", "description": "CatBoost rolling, subsample=0.65", "config": {"paths": {"results_dir": "C:\\Users\\abhir\\clauderesearch\\autoresearch\\generalized_ml_autoresearch\\examples\\fraud_ecommerce\\autoresearch_results"}, "task_type": "binary_classification", "primary_metric": "auc_roc", "backbone": "catboost", "backbone_config": {"iterations": 1000, "depth": 6, "learning_rate": 0.04, "l2_leaf_reg": 3.0, "bootstrap_type": "Bernoulli", "subsample": 0.65, "random_strength": 1.0, "early_stopping_rounds": 50, "thread_count": 4, "verbose": 0, "seed": 0}, "data": {"format": "csv", "path": "C:\\Users\\abhir\\clauderesearch\\autoresearch\\generalized_ml_autoresearch\\examples\\fraud_ecommerce\\data\\features_rolling.csv", "target_columns": ["class"], "feature_columns": ["purchase_value", "device_id", "source", "browser", "age", "ip_address", "country", "time_since_signup", "purchase_hour", "purchase_dayofweek", "signup_hour", "device_id_freq", "ip_address_freq", "country_freq", "source_freq", "browser_freq", "device_fraud_rate_train", "country_fraud_rate_train", "device_id_count_1d", "device_id_count_7d", "device_id_count_30d", "ip_address_count_1d", "ip_address_count_7d", "ip_address_count_30d", "device_id_fraud_count_7d"]}, "split": {"name": "holdout", "order": "time", "test_fraction": 0.2, "val_fraction": 0.1, "seed": 0}, "composite": {"higher_is_better": true, "penalty_weight": 0.05, "below_threshold": 0.5}, "description": "CatBoost rolling, subsample=0.65", "seed": 0}, "composite": 0.5205393040343824, "val_primary": 0.5205393040343824, "test_primary": 0.5269162776623069, "per_fold_test": [0.5269162776623069], "per_fold_val": [0.5205393040343824], "status": "KEEP", "seconds_elapsed": 1.3525769710540771, "timestamp": "2026-04-24T21:13:17", "secondary_metrics": {"accuracy": 0.9474885844748858, "precision": 0.22191011235955055, "recall": 0.05687544996400288, "f1": 0.09054441260744986, "f2": 0.06681326116373477, "mcc": 0.09173888012648923, "auc_pr": 0.06313512083342897, "log_loss": 0.19503278016609554, "tn": 28556.0, "fp": 277.0, "fn": 1310.0, "tp": 79.0}, "per_fold_test_reports": [{"fold_id": 0, "regime": "holdout", "task_type": "binary_classification", "n": 30222, "accuracy": 0.9474885844748858, "precision": 0.22191011235955055, "recall": 0.05687544996400288, "f1": 0.09054441260744986, "f2": 0.06681326116373477, "mcc": 0.09173888012648923, "auc_roc": 0.5269162776623069, "auc_pr": 0.06313512083342897, "log_loss": 0.19503278016609554, "tn": 28556, "fp": 277, "fn": 1310, "tp": 79}], "composite_fingerprint": "e692f018120592ed"}
{"experiment_num": 37, "backbone": "catboost", "description": "CatBoost rolling, random_strength=5.0", "config": {"paths": {"results_dir": "C:\\Users\\abhir\\clauderesearch\\autoresearch\\generalized_ml_autoresearch\\examples\\fraud_ecommerce\\autoresearch_results"}, "task_type": "binary_classification", "primary_metric": "auc_roc", "backbone": "catboost", "backbone_config": {"iterations": 1000, "depth": 6, "learning_rate": 0.04, "l2_leaf_reg": 3.0, "bootstrap_type": "Bernoulli", "subsample": 0.85, "random_strength": 5.0, "early_stopping_rounds": 50, "thread_count": 4, "verbose": 0, "seed": 0}, "data": {"format": "csv", "path": "C:\\Users\\abhir\\clauderesearch\\autoresearch\\generalized_ml_autoresearch\\examples\\fraud_ecommerce\\data\\features_rolling.csv", "target_columns": ["class"], "feature_columns": ["purchase_value", "device_id", "source", "browser", "age", "ip_address", "country", "time_since_signup", "purchase_hour", "purchase_dayofweek", "signup_hour", "device_id_freq", "ip_address_freq", "country_freq", "source_freq", "browser_freq", "device_fraud_rate_train", "country_fraud_rate_train", "device_id_count_1d", "device_id_count_7d", "device_id_count_30d", "ip_address_count_1d", "ip_address_count_7d", "ip_address_count_30d", "device_id_fraud_count_7d"]}, "split": {"name": "holdout", "order": "time", "test_fraction": 0.2, "val_fraction": 0.1, "seed": 0}, "composite": {"higher_is_better": true, "penalty_weight": 0.05, "below_threshold": 0.5}, "description": "CatBoost rolling, random_strength=5.0", "seed": 0}, "composite": 0.5333395781776227, "val_primary": 0.5384891027048688, "test_primary": 0.5333395781776227, "per_fold_test": [0.5333395781776227], "per_fold_val": [0.5384891027048688], "status": "KEEP", "seconds_elapsed": 1.364917278289795, "timestamp": "2026-04-24T21:13:18", "secondary_metrics": {"accuracy": 0.9474885844748858, "precision": 0.22191011235955055, "recall": 0.05687544996400288, "f1": 0.09054441260744986, "f2": 0.06681326116373477, "mcc": 0.09173888012648923, "auc_pr": 0.068450589247497, "log_loss": 0.19200872648937375, "tn": 28556.0, "fp": 277.0, "fn": 1310.0, "tp": 79.0}, "per_fold_test_reports": [{"fold_id": 0, "regime": "holdout", "task_type": "binary_classification", "n": 30222, "accuracy": 0.9474885844748858, "precision": 0.22191011235955055, "recall": 0.05687544996400288, "f1": 0.09054441260744986, "f2": 0.06681326116373477, "mcc": 0.09173888012648923, "auc_roc": 0.5333395781776227, "auc_pr": 0.068450589247497, "log_loss": 0.19200872648937375, "tn": 28556, "fp": 277, "fn": 1310, "tp": 79}], "composite_fingerprint": "e692f018120592ed"}
{"experiment_num": 38, "backbone": "xgboost", "description": "variance check seed=1", "config": {"paths": {"results_dir": "C:\\Users\\abhir\\clauderesearch\\autoresearch\\generalized_ml_autoresearch\\examples\\fraud_ecommerce\\autoresearch_results"}, "task_type": "binary_classification", "primary_metric": "auc_roc", "backbone": "xgboost", "backbone_config": {"n_estimators": 600, "max_depth": 6, "learning_rate": 0.05, "subsample": 0.85, "colsample_bytree": 0.85, "reg_lambda": 1.0, "min_child_weight": 5, "early_stopping_rounds": 40, "n_jobs": 4, "seed": 1}, "data": {"format": "csv", "path": "C:\\Users\\abhir\\clauderesearch\\autoresearch\\generalized_ml_autoresearch\\examples\\fraud_ecommerce\\data\\features_rolling.csv", "target_columns": ["class"], "feature_columns": ["purchase_value", "device_id", "source", "browser", "age", "ip_address", "country", "time_since_signup", "purchase_hour", "purchase_dayofweek", "signup_hour", "device_id_freq", "ip_address_freq", "country_freq", "source_freq", "browser_freq", "device_fraud_rate_train", "country_fraud_rate_train", "device_id_count_1d", "device_id_count_7d", "device_id_count_30d", "ip_address_count_1d", "ip_address_count_7d", "ip_address_count_30d", "device_id_fraud_count_7d"]}, "split": {"name": "holdout", "order": "time", "test_fraction": 0.2, "val_fraction": 0.1, "seed": 0}, "composite": {"higher_is_better": true, "penalty_weight": 0.05, "below_threshold": 0.5}, "description": "variance check seed=1", "seed": 1}, "composite": 0.5229635608966078, "val_primary": 0.5339905847208153, "test_primary": 0.5229635608966078, "per_fold_test": [0.5229635608966078], "per_fold_val": [0.5339905847208153], "status": "KEEP", "seconds_elapsed": 0.971757173538208, "timestamp": "2026-04-24T21:13:19", "secondary_metrics": {"accuracy": 0.9475878499106611, "precision": 0.21902017291066284, "recall": 0.054715622750179986, "f1": 0.08755760368663594, "f2": 0.06437404709469761, "mcc": 0.08907079634380681, "auc_pr": 0.06680807809784879, "log_loss": 0.18707560404270684, "tn": 28562.0, "fp": 271.0, "fn": 1313.0, "tp": 76.0}, "per_fold_test_reports": [{"fold_id": 0, "regime": "holdout", "task_type": "binary_classification", "n": 30222, "accuracy": 0.9475878499106611, "precision": 0.21902017291066284, "recall": 0.054715622750179986, "f1": 0.08755760368663594, "f2": 0.06437404709469761, "mcc": 0.08907079634380681, "auc_roc": 0.5229635608966078, "auc_pr": 0.06680807809784879, "log_loss": 0.18707560404270684, "tn": 28562, "fp": 271, "fn": 1313, "tp": 76}], "composite_fingerprint": "e692f018120592ed"}
{"experiment_num": 39, "backbone": "xgboost", "description": "variance check seed=2", "config": {"paths": {"results_dir": "C:\\Users\\abhir\\clauderesearch\\autoresearch\\generalized_ml_autoresearch\\examples\\fraud_ecommerce\\autoresearch_results"}, "task_type": "binary_classification", "primary_metric": "auc_roc", "backbone": "xgboost", "backbone_config": {"n_estimators": 600, "max_depth": 6, "learning_rate": 0.05, "subsample": 0.85, "colsample_bytree": 0.85, "reg_lambda": 1.0, "min_child_weight": 5, "early_stopping_rounds": 40, "n_jobs": 4, "seed": 2}, "data": {"format": "csv", "path": "C:\\Users\\abhir\\clauderesearch\\autoresearch\\generalized_ml_autoresearch\\examples\\fraud_ecommerce\\data\\features_rolling.csv", "target_columns": ["class"], "feature_columns": ["purchase_value", "device_id", "source", "browser", "age", "ip_address", "country", "time_since_signup", "purchase_hour", "purchase_dayofweek", "signup_hour", "device_id_freq", "ip_address_freq", "country_freq", "source_freq", "browser_freq", "device_fraud_rate_train", "country_fraud_rate_train", "device_id_count_1d", "device_id_count_7d", "device_id_count_30d", "ip_address_count_1d", "ip_address_count_7d", "ip_address_count_30d", "device_id_fraud_count_7d"]}, "split": {"name": "holdout", "order": "time", "test_fraction": 0.2, "val_fraction": 0.1, "seed": 0}, "composite": {"higher_is_better": true, "penalty_weight": 0.05, "below_threshold": 0.5}, "description": "variance check seed=2", "seed": 2}, "composite": 0.5343397395547863, "val_primary": 0.5401531703200122, "test_primary": 0.5343397395547863, "per_fold_test": [0.5343397395547863], "per_fold_val": [0.5401531703200122], "status": "KEEP", "seconds_elapsed": 0.933128833770752, "timestamp": "2026-04-24T21:13:20", "secondary_metrics": {"accuracy": 0.9475878499106611, "precision": 0.21902017291066284, "recall": 0.054715622750179986, "f1": 0.08755760368663594, "f2": 0.06437404709469761, "mcc": 0.08907079634380681, "auc_pr": 0.06507900311377646, "log_loss": 0.18794320065163475, "tn": 28562.0, "fp": 271.0, "fn": 1313.0, "tp": 76.0}, "per_fold_test_reports": [{"fold_id": 0, "regime": "holdout", "task_type": "binary_classification", "n": 30222, "accuracy": 0.9475878499106611, "precision": 0.21902017291066284, "recall": 0.054715622750179986, "f1": 0.08755760368663594, "f2": 0.06437404709469761, "mcc": 0.08907079634380681, "auc_roc": 0.5343397395547863, "auc_pr": 0.06507900311377646, "log_loss": 0.18794320065163475, "tn": 28562, "fp": 271, "fn": 1313, "tp": 76}], "composite_fingerprint": "e692f018120592ed"}
{"experiment_num": 40, "backbone": "xgboost", "description": "variance check seed=7", "config": {"paths": {"results_dir": "C:\\Users\\abhir\\clauderesearch\\autoresearch\\generalized_ml_autoresearch\\examples\\fraud_ecommerce\\autoresearch_results"}, "task_type": "binary_classification", "primary_metric": "auc_roc", "backbone": "xgboost", "backbone_config": {"n_estimators": 600, "max_depth": 6, "learning_rate": 0.05, "subsample": 0.85, "colsample_bytree": 0.85, "reg_lambda": 1.0, "min_child_weight": 5, "early_stopping_rounds": 40, "n_jobs": 4, "seed": 7}, "data": {"format": "csv", "path": "C:\\Users\\abhir\\clauderesearch\\autoresearch\\generalized_ml_autoresearch\\examples\\fraud_ecommerce\\data\\features_rolling.csv", "target_columns": ["class"], "feature_columns": ["purchase_value", "device_id", "source", "browser", "age", "ip_address", "country", "time_since_signup", "purchase_hour", "purchase_dayofweek", "signup_hour", "device_id_freq", "ip_address_freq", "country_freq", "source_freq", "browser_freq", "device_fraud_rate_train", "country_fraud_rate_train", "device_id_count_1d", "device_id_count_7d", "device_id_count_30d", "ip_address_count_1d", "ip_address_count_7d", "ip_address_count_30d", "device_id_fraud_count_7d"]}, "split": {"name": "holdout", "order": "time", "test_fraction": 0.2, "val_fraction": 0.1, "seed": 0}, "composite": {"higher_is_better": true, "penalty_weight": 0.05, "below_threshold": 0.5}, "description": "variance check seed=7", "seed": 7}, "composite": 0.5341622446502271, "val_primary": 0.5369395890024197, "test_primary": 0.5341622446502271, "per_fold_test": [0.5341622446502271], "per_fold_val": [0.5369395890024197], "status": "KEEP", "seconds_elapsed": 1.32041335105896, "timestamp": "2026-04-24T21:13:22", "secondary_metrics": {"accuracy": 0.9475878499106611, "precision": 0.21902017291066284, "recall": 0.054715622750179986, "f1": 0.08755760368663594, "f2": 0.06437404709469761, "mcc": 0.08907079634380681, "auc_pr": 0.06946826576964275, "log_loss": 0.18774483046584298, "tn": 28562.0, "fp": 271.0, "fn": 1313.0, "tp": 76.0}, "per_fold_test_reports": [{"fold_id": 0, "regime": "holdout", "task_type": "binary_classification", "n": 30222, "accuracy": 0.9475878499106611, "precision": 0.21902017291066284, "recall": 0.054715622750179986, "f1": 0.08755760368663594, "f2": 0.06437404709469761, "mcc": 0.08907079634380681, "auc_roc": 0.5341622446502271, "auc_pr": 0.06946826576964275, "log_loss": 0.18774483046584298, "tn": 28562, "fp": 271, "fn": 1313, "tp": 76}], "composite_fingerprint": "e692f018120592ed"}
{"experiment_num": 41, "backbone": "xgboost", "description": "variance check seed=42", "config": {"paths": {"results_dir": "C:\\Users\\abhir\\clauderesearch\\autoresearch\\generalized_ml_autoresearch\\examples\\fraud_ecommerce\\autoresearch_results"}, "task_type": "binary_classification", "primary_metric": "auc_roc", "backbone": "xgboost", "backbone_config": {"n_estimators": 600, "max_depth": 6, "learning_rate": 0.05, "subsample": 0.85, "colsample_bytree": 0.85, "reg_lambda": 1.0, "min_child_weight": 5, "early_stopping_rounds": 40, "n_jobs": 4, "seed": 42}, "data": {"format": "csv", "path": "C:\\Users\\abhir\\clauderesearch\\autoresearch\\generalized_ml_autoresearch\\examples\\fraud_ecommerce\\data\\features_rolling.csv", "target_columns": ["class"], "feature_columns": ["purchase_value", "device_id", "source", "browser", "age", "ip_address", "country", "time_since_signup", "purchase_hour", "purchase_dayofweek", "signup_hour", "device_id_freq", "ip_address_freq", "country_freq", "source_freq", "browser_freq", "device_fraud_rate_train", "country_fraud_rate_train", "device_id_count_1d", "device_id_count_7d", "device_id_count_30d", "ip_address_count_1d", "ip_address_count_7d", "ip_address_count_30d", "device_id_fraud_count_7d"]}, "split": {"name": "holdout", "order": "time", "test_fraction": 0.2, "val_fraction": 0.1, "seed": 0}, "composite": {"higher_is_better": true, "penalty_weight": 0.05, "below_threshold": 0.5}, "description": "variance check seed=42", "seed": 42}, "composite": 0.5337939102249487, "val_primary": 0.5337939102249487, "test_primary": 0.5359049956681856, "per_fold_test": [0.5359049956681856], "per_fold_val": [0.5337939102249487], "status": "KEEP", "seconds_elapsed": 1.4162673950195312, "timestamp": "2026-04-24T21:13:23", "secondary_metrics": {"accuracy": 0.9475878499106611, "precision": 0.21902017291066284, "recall": 0.054715622750179986, "f1": 0.08755760368663594, "f2": 0.06437404709469761, "mcc": 0.08907079634380681, "auc_pr": 0.06625548122278056, "log_loss": 0.187174291956336, "tn": 28562.0, "fp": 271.0, "fn": 1313.0, "tp": 76.0}, "per_fold_test_reports": [{"fold_id": 0, "regime": "holdout", "task_type": "binary_classification", "n": 30222, "accuracy": 0.9475878499106611, "precision": 0.21902017291066284, "recall": 0.054715622750179986, "f1": 0.08755760368663594, "f2": 0.06437404709469761, "mcc": 0.08907079634380681, "auc_roc": 0.5359049956681856, "auc_pr": 0.06625548122278056, "log_loss": 0.187174291956336, "tn": 28562, "fp": 271, "fn": 1313, "tp": 76}], "composite_fingerprint": "e692f018120592ed"}
{"experiment_num": 42, "backbone": "xgboost", "description": "variance check seed=99", "config": {"paths": {"results_dir": "C:\\Users\\abhir\\clauderesearch\\autoresearch\\generalized_ml_autoresearch\\examples\\fraud_ecommerce\\autoresearch_results"}, "task_type": "binary_classification", "primary_metric": "auc_roc", "backbone": "xgboost", "backbone_config": {"n_estimators": 600, "max_depth": 6, "learning_rate": 0.05, "subsample": 0.85, "colsample_bytree": 0.85, "reg_lambda": 1.0, "min_child_weight": 5, "early_stopping_rounds": 40, "n_jobs": 4, "seed": 99}, "data": {"format": "csv", "path": "C:\\Users\\abhir\\clauderesearch\\autoresearch\\generalized_ml_autoresearch\\examples\\fraud_ecommerce\\data\\features_rolling.csv", "target_columns": ["class"], "feature_columns": ["purchase_value", "device_id", "source", "browser", "age", "ip_address", "country", "time_since_signup", "purchase_hour", "purchase_dayofweek", "signup_hour", "device_id_freq", "ip_address_freq", "country_freq", "source_freq", "browser_freq", "device_fraud_rate_train", "country_fraud_rate_train", "device_id_count_1d", "device_id_count_7d", "device_id_count_30d", "ip_address_count_1d", "ip_address_count_7d", "ip_address_count_30d", "device_id_fraud_count_7d"]}, "split": {"name": "holdout", "order": "time", "test_fraction": 0.2, "val_fraction": 0.1, "seed": 0}, "composite": {"higher_is_better": true, "penalty_weight": 0.05, "below_threshold": 0.5}, "description": "variance check seed=99", "seed": 99}, "composite": 0.5385648848435481, "val_primary": 0.5529089812493865, "test_primary": 0.5385648848435481, "per_fold_test": [0.5385648848435481], "per_fold_val": [0.5529089812493865], "status": "KEEP", "seconds_elapsed": 1.3541557788848877, "timestamp": "2026-04-24T21:13:25", "secondary_metrics": {"accuracy": 0.9475878499106611, "precision": 0.21902017291066284, "recall": 0.054715622750179986, "f1": 0.08755760368663594, "f2": 0.06437404709469761, "mcc": 0.08907079634380681, "auc_pr": 0.06499333823687192, "log_loss": 0.1876425808116778, "tn": 28562.0, "fp": 271.0, "fn": 1313.0, "tp": 76.0}, "per_fold_test_reports": [{"fold_id": 0, "regime": "holdout", "task_type": "binary_classification", "n": 30222, "accuracy": 0.9475878499106611, "precision": 0.21902017291066284, "recall": 0.054715622750179986, "f1": 0.08755760368663594, "f2": 0.06437404709469761, "mcc": 0.08907079634380681, "auc_roc": 0.5385648848435481, "auc_pr": 0.06499333823687192, "log_loss": 0.1876425808116778, "tn": 28562, "fp": 271, "fn": 1313, "tp": 76}], "composite_fingerprint": "e692f018120592ed"}
