{"experiment_num": 10, "backbone": "xgboost", "description": "XGBoost + ROLLING velocity features (1d/7d/30d windows)", "config": {"paths": {"results_dir": "C:\\Users\\abhir\\clauderesearch\\autoresearch\\generalized_ml_autoresearch\\examples\\fraud_ecommerce\\autoresearch_results"}, "task_type": "binary_classification", "primary_metric": "auc_roc", "backbone": "xgboost", "backbone_config": {"n_estimators": 600, "max_depth": 6, "learning_rate": 0.05, "subsample": 0.85, "colsample_bytree": 0.85, "reg_lambda": 1.0, "min_child_weight": 5, "early_stopping_rounds": 40, "n_jobs": 4, "seed": 0}, "data": {"format": "csv", "path": "C:\\Users\\abhir\\clauderesearch\\autoresearch\\generalized_ml_autoresearch\\examples\\fraud_ecommerce\\data\\features_rolling.csv", "target_columns": ["class"], "feature_columns": ["purchase_value", "device_id", "source", "browser", "age", "ip_address", "country", "time_since_signup", "purchase_hour", "purchase_dayofweek", "signup_hour", "device_id_freq", "ip_address_freq", "country_freq", "source_freq", "browser_freq", "device_fraud_rate_train", "country_fraud_rate_train", "device_id_count_1d", "device_id_count_7d", "device_id_count_30d", "ip_address_count_1d", "ip_address_count_7d", "ip_address_count_30d", "device_id_fraud_count_7d"]}, "split": {"name": "holdout", "order": "time", "test_fraction": 0.2, "val_fraction": 0.1, "seed": 0}, "composite": {"higher_is_better": true, "penalty_weight": 0.05, "below_threshold": 0.5}, "description": "XGBoost + ROLLING velocity features (1d/7d/30d windows)", "seed": 0}, "composite": 0.5255907526565496, "val_primary": 0.535186519473659, "test_primary": 0.5255907526565496, "per_fold_test": [0.5255907526565496], "per_fold_val": [0.535186519473659], "status": "KEEP", "seconds_elapsed": 1.0457658767700195, "timestamp": "2026-04-24T21:12:48", "secondary_metrics": {"accuracy": 0.9475878499106611, "precision": 0.21902017291066284, "recall": 0.054715622750179986, "f1": 0.08755760368663594, "f2": 0.06437404709469761, "mcc": 0.08907079634380681, "auc_pr": 0.0606180454354096, "log_loss": 0.18831076997849744, "tn": 28562.0, "fp": 271.0, "fn": 1313.0, "tp": 76.0}, "per_fold_test_reports": [{"fold_id": 0, "regime": "holdout", "task_type": "binary_classification", "n": 30222, "accuracy": 0.9475878499106611, "precision": 0.21902017291066284, "recall": 0.054715622750179986, "f1": 0.08755760368663594, "f2": 0.06437404709469761, "mcc": 0.08907079634380681, "auc_roc": 0.5255907526565496, "auc_pr": 0.0606180454354096, "log_loss": 0.18831076997849744, "tn": 28562, "fp": 271, "fn": 1313, "tp": 76}], "composite_fingerprint": "e692f018120592ed"}
{"experiment_num": 11, "backbone": "xgboost", "description": "XGBoost rolling, max_depth=4", "config": {"paths": {"results_dir": "C:\\Users\\abhir\\clauderesearch\\autoresearch\\generalized_ml_autoresearch\\examples\\fraud_ecommerce\\autoresearch_results"}, "task_type": "binary_classification", "primary_metric": "auc_roc", "backbone": "xgboost", "backbone_config": {"n_estimators": 600, "max_depth": 4, "learning_rate": 0.05, "subsample": 0.85, "colsample_bytree": 0.85, "reg_lambda": 1.0, "min_child_weight": 5, "early_stopping_rounds": 40, "n_jobs": 4, "seed": 0}, "data": {"format": "csv", "path": "C:\\Users\\abhir\\clauderesearch\\autoresearch\\generalized_ml_autoresearch\\examples\\fraud_ecommerce\\data\\features_rolling.csv", "target_columns": ["class"], "feature_columns": ["purchase_value", "device_id", "source", "browser", "age", "ip_address", "country", "time_since_signup", "purchase_hour", "purchase_dayofweek", "signup_hour", "device_id_freq", "ip_address_freq", "country_freq", "source_freq", "browser_freq", "device_fraud_rate_train", "country_fraud_rate_train", "device_id_count_1d", "device_id_count_7d", "device_id_count_30d", "ip_address_count_1d", "ip_address_count_7d", "ip_address_count_30d", "device_id_fraud_count_7d"]}, "split": {"name": "holdout", "order": "time", "test_fraction": 0.2, "val_fraction": 0.1, "seed": 0}, "composite": {"higher_is_better": true, "penalty_weight": 0.05, "below_threshold": 0.5}, "description": "XGBoost rolling, max_depth=4", "seed": 0}, "composite": 0.5230813664758032, "val_primary": 0.5266681913536083, "test_primary": 0.5230813664758032, "per_fold_test": [0.5230813664758032], "per_fold_val": [0.5266681913536083], "status": "KEEP", "seconds_elapsed": 0.874068021774292, "timestamp": "2026-04-24T21:12:49", "secondary_metrics": {"accuracy": 0.9475878499106611, "precision": 0.21902017291066284, "recall": 0.054715622750179986, "f1": 0.08755760368663594, "f2": 0.06437404709469761, "mcc": 0.08907079634380681, "auc_pr": 0.05745550822215802, "log_loss": 0.1883259927231476, "tn": 28562.0, "fp": 271.0, "fn": 1313.0, "tp": 76.0}, "per_fold_test_reports": [{"fold_id": 0, "regime": "holdout", "task_type": "binary_classification", "n": 30222, "accuracy": 0.9475878499106611, "precision": 0.21902017291066284, "recall": 0.054715622750179986, "f1": 0.08755760368663594, "f2": 0.06437404709469761, "mcc": 0.08907079634380681, "auc_roc": 0.5230813664758032, "auc_pr": 0.05745550822215802, "log_loss": 0.1883259927231476, "tn": 28562, "fp": 271, "fn": 1313, "tp": 76}], "composite_fingerprint": "e692f018120592ed"}
{"experiment_num": 12, "backbone": "xgboost", "description": "XGBoost rolling, max_depth=8", "config": {"paths": {"results_dir": "C:\\Users\\abhir\\clauderesearch\\autoresearch\\generalized_ml_autoresearch\\examples\\fraud_ecommerce\\autoresearch_results"}, "task_type": "binary_classification", "primary_metric": "auc_roc", "backbone": "xgboost", "backbone_config": {"n_estimators": 600, "max_depth": 8, "learning_rate": 0.05, "subsample": 0.85, "colsample_bytree": 0.85, "reg_lambda": 1.0, "min_child_weight": 5, "early_stopping_rounds": 40, "n_jobs": 4, "seed": 0}, "data": {"format": "csv", "path": "C:\\Users\\abhir\\clauderesearch\\autoresearch\\generalized_ml_autoresearch\\examples\\fraud_ecommerce\\data\\features_rolling.csv", "target_columns": ["class"], "feature_columns": ["purchase_value", "device_id", "source", "browser", "age", "ip_address", "country", "time_since_signup", "purchase_hour", "purchase_dayofweek", "signup_hour", "device_id_freq", "ip_address_freq", "country_freq", "source_freq", "browser_freq", "device_fraud_rate_train", "country_fraud_rate_train", "device_id_count_1d", "device_id_count_7d", "device_id_count_30d", "ip_address_count_1d", "ip_address_count_7d", "ip_address_count_30d", "device_id_fraud_count_7d"]}, "split": {"name": "holdout", "order": "time", "test_fraction": 0.2, "val_fraction": 0.1, "seed": 0}, "composite": {"higher_is_better": true, "penalty_weight": 0.05, "below_threshold": 0.5}, "description": "XGBoost rolling, max_depth=8", "seed": 0}, "composite": 0.5199693315971617, "val_primary": 0.5226591079974214, "test_primary": 0.5199693315971617, "per_fold_test": [0.5199693315971617], "per_fold_val": [0.5226591079974214], "status": "KEEP", "seconds_elapsed": 0.8758442401885986, "timestamp": "2026-04-24T21:12:49", "secondary_metrics": {"accuracy": 0.9475878499106611, "precision": 0.21902017291066284, "recall": 0.054715622750179986, "f1": 0.08755760368663594, "f2": 0.06437404709469761, "mcc": 0.08907079634380681, "auc_pr": 0.06287795862619514, "log_loss": 0.18830912127175384, "tn": 28562.0, "fp": 271.0, "fn": 1313.0, "tp": 76.0}, "per_fold_test_reports": [{"fold_id": 0, "regime": "holdout", "task_type": "binary_classification", "n": 30222, "accuracy": 0.9475878499106611, "precision": 0.21902017291066284, "recall": 0.054715622750179986, "f1": 0.08755760368663594, "f2": 0.06437404709469761, "mcc": 0.08907079634380681, "auc_roc": 0.5199693315971617, "auc_pr": 0.06287795862619514, "log_loss": 0.18830912127175384, "tn": 28562, "fp": 271, "fn": 1313, "tp": 76}], "composite_fingerprint": "e692f018120592ed"}
{"experiment_num": 13, "backbone": "xgboost", "description": "XGBoost rolling, learning_rate=0.02", "config": {"paths": {"results_dir": "C:\\Users\\abhir\\clauderesearch\\autoresearch\\generalized_ml_autoresearch\\examples\\fraud_ecommerce\\autoresearch_results"}, "task_type": "binary_classification", "primary_metric": "auc_roc", "backbone": "xgboost", "backbone_config": {"n_estimators": 600, "max_depth": 6, "learning_rate": 0.02, "subsample": 0.85, "colsample_bytree": 0.85, "reg_lambda": 1.0, "min_child_weight": 5, "early_stopping_rounds": 40, "n_jobs": 4, "seed": 0}, "data": {"format": "csv", "path": "C:\\Users\\abhir\\clauderesearch\\autoresearch\\generalized_ml_autoresearch\\examples\\fraud_ecommerce\\data\\features_rolling.csv", "target_columns": ["class"], "feature_columns": ["purchase_value", "device_id", "source", "browser", "age", "ip_address", "country", "time_since_signup", "purchase_hour", "purchase_dayofweek", "signup_hour", "device_id_freq", "ip_address_freq", "country_freq", "source_freq", "browser_freq", "device_fraud_rate_train", "country_fraud_rate_train", "device_id_count_1d", "device_id_count_7d", "device_id_count_30d", "ip_address_count_1d", "ip_address_count_7d", "ip_address_count_30d", "device_id_fraud_count_7d"]}, "split": {"name": "holdout", "order": "time", "test_fraction": 0.2, "val_fraction": 0.1, "seed": 0}, "composite": {"higher_is_better": true, "penalty_weight": 0.05, "below_threshold": 0.5}, "description": "XGBoost rolling, learning_rate=0.02", "seed": 0}, "composite": 0.5334607795937765, "val_primary": 0.5336640757108261, "test_primary": 0.5334607795937765, "per_fold_test": [0.5334607795937765], "per_fold_val": [0.5336640757108261], "status": "KEEP", "seconds_elapsed": 0.9642105102539062, "timestamp": "2026-04-24T21:12:50", "secondary_metrics": {"accuracy": 0.9475878499106611, "precision": 0.21902017291066284, "recall": 0.054715622750179986, "f1": 0.08755760368663594, "f2": 0.06437404709469761, "mcc": 0.08907079634380681, "auc_pr": 0.06577559271074174, "log_loss": 0.18803258007108858, "tn": 28562.0, "fp": 271.0, "fn": 1313.0, "tp": 76.0}, "per_fold_test_reports": [{"fold_id": 0, "regime": "holdout", "task_type": "binary_classification", "n": 30222, "accuracy": 0.9475878499106611, "precision": 0.21902017291066284, "recall": 0.054715622750179986, "f1": 0.08755760368663594, "f2": 0.06437404709469761, "mcc": 0.08907079634380681, "auc_roc": 0.5334607795937765, "auc_pr": 0.06577559271074174, "log_loss": 0.18803258007108858, "tn": 28562, "fp": 271, "fn": 1313, "tp": 76}], "composite_fingerprint": "e692f018120592ed"}
{"experiment_num": 14, "backbone": "xgboost", "description": "XGBoost rolling, learning_rate=0.1", "config": {"paths": {"results_dir": "C:\\Users\\abhir\\clauderesearch\\autoresearch\\generalized_ml_autoresearch\\examples\\fraud_ecommerce\\autoresearch_results"}, "task_type": "binary_classification", "primary_metric": "auc_roc", "backbone": "xgboost", "backbone_config": {"n_estimators": 600, "max_depth": 6, "learning_rate": 0.1, "subsample": 0.85, "colsample_bytree": 0.85, "reg_lambda": 1.0, "min_child_weight": 5, "early_stopping_rounds": 40, "n_jobs": 4, "seed": 0}, "data": {"format": "csv", "path": "C:\\Users\\abhir\\clauderesearch\\autoresearch\\generalized_ml_autoresearch\\examples\\fraud_ecommerce\\data\\features_rolling.csv", "target_columns": ["class"], "feature_columns": ["purchase_value", "device_id", "source", "browser", "age", "ip_address", "country", "time_since_signup", "purchase_hour", "purchase_dayofweek", "signup_hour", "device_id_freq", "ip_address_freq", "country_freq", "source_freq", "browser_freq", "device_fraud_rate_train", "country_fraud_rate_train", "device_id_count_1d", "device_id_count_7d", "device_id_count_30d", "ip_address_count_1d", "ip_address_count_7d", "ip_address_count_30d", "device_id_fraud_count_7d"]}, "split": {"name": "holdout", "order": "time", "test_fraction": 0.2, "val_fraction": 0.1, "seed": 0}, "composite": {"higher_is_better": true, "penalty_weight": 0.05, "below_threshold": 0.5}, "description": "XGBoost rolling, learning_rate=0.1", "seed": 0}, "composite": 0.5255906028402132, "val_primary": 0.5340882388955059, "test_primary": 0.5255906028402132, "per_fold_test": [0.5255906028402132], "per_fold_val": [0.5340882388955059], "status": "KEEP", "seconds_elapsed": 0.8675065040588379, "timestamp": "2026-04-24T21:12:51", "secondary_metrics": {"accuracy": 0.9475878499106611, "precision": 0.21902017291066284, "recall": 0.054715622750179986, "f1": 0.08755760368663594, "f2": 0.06437404709469761, "mcc": 0.08907079634380681, "auc_pr": 0.0606193909449219, "log_loss": 0.18840865688182012, "tn": 28562.0, "fp": 271.0, "fn": 1313.0, "tp": 76.0}, "per_fold_test_reports": [{"fold_id": 0, "regime": "holdout", "task_type": "binary_classification", "n": 30222, "accuracy": 0.9475878499106611, "precision": 0.21902017291066284, "recall": 0.054715622750179986, "f1": 0.08755760368663594, "f2": 0.06437404709469761, "mcc": 0.08907079634380681, "auc_roc": 0.5255906028402132, "auc_pr": 0.0606193909449219, "log_loss": 0.18840865688182012, "tn": 28562, "fp": 271, "fn": 1313, "tp": 76}], "composite_fingerprint": "e692f018120592ed"}
{"experiment_num": 15, "backbone": "xgboost", "description": "XGBoost rolling, min_child_weight=1", "config": {"paths": {"results_dir": "C:\\Users\\abhir\\clauderesearch\\autoresearch\\generalized_ml_autoresearch\\examples\\fraud_ecommerce\\autoresearch_results"}, "task_type": "binary_classification", "primary_metric": "auc_roc", "backbone": "xgboost", "backbone_config": {"n_estimators": 600, "max_depth": 6, "learning_rate": 0.05, "subsample": 0.85, "colsample_bytree": 0.85, "reg_lambda": 1.0, "min_child_weight": 1, "early_stopping_rounds": 40, "n_jobs": 4, "seed": 0}, "data": {"format": "csv", "path": "C:\\Users\\abhir\\clauderesearch\\autoresearch\\generalized_ml_autoresearch\\examples\\fraud_ecommerce\\data\\features_rolling.csv", "target_columns": ["class"], "feature_columns": ["purchase_value", "device_id", "source", "browser", "age", "ip_address", "country", "time_since_signup", "purchase_hour", "purchase_dayofweek", "signup_hour", "device_id_freq", "ip_address_freq", "country_freq", "source_freq", "browser_freq", "device_fraud_rate_train", "country_fraud_rate_train", "device_id_count_1d", "device_id_count_7d", "device_id_count_30d", "ip_address_count_1d", "ip_address_count_7d", "ip_address_count_30d", "device_id_fraud_count_7d"]}, "split": {"name": "holdout", "order": "time", "test_fraction": 0.2, "val_fraction": 0.1, "seed": 0}, "composite": {"higher_is_better": true, "penalty_weight": 0.05, "below_threshold": 0.5}, "description": "XGBoost rolling, min_child_weight=1", "seed": 0}, "composite": 0.5251097922779018, "val_primary": 0.532304456369835, "test_primary": 0.5251097922779018, "per_fold_test": [0.5251097922779018], "per_fold_val": [0.532304456369835], "status": "KEEP", "seconds_elapsed": 0.8895344734191895, "timestamp": "2026-04-24T21:12:52", "secondary_metrics": {"accuracy": 0.9475878499106611, "precision": 0.21902017291066284, "recall": 0.054715622750179986, "f1": 0.08755760368663594, "f2": 0.06437404709469761, "mcc": 0.08907079634380681, "auc_pr": 0.06060266578253029, "log_loss": 0.18832773402255665, "tn": 28562.0, "fp": 271.0, "fn": 1313.0, "tp": 76.0}, "per_fold_test_reports": [{"fold_id": 0, "regime": "holdout", "task_type": "binary_classification", "n": 30222, "accuracy": 0.9475878499106611, "precision": 0.21902017291066284, "recall": 0.054715622750179986, "f1": 0.08755760368663594, "f2": 0.06437404709469761, "mcc": 0.08907079634380681, "auc_roc": 0.5251097922779018, "auc_pr": 0.06060266578253029, "log_loss": 0.18832773402255665, "tn": 28562, "fp": 271, "fn": 1313, "tp": 76}], "composite_fingerprint": "e692f018120592ed"}
{"experiment_num": 16, "backbone": "xgboost", "description": "XGBoost rolling, min_child_weight=20", "config": {"paths": {"results_dir": "C:\\Users\\abhir\\clauderesearch\\autoresearch\\generalized_ml_autoresearch\\examples\\fraud_ecommerce\\autoresearch_results"}, "task_type": "binary_classification", "primary_metric": "auc_roc", "backbone": "xgboost", "backbone_config": {"n_estimators": 600, "max_depth": 6, "learning_rate": 0.05, "subsample": 0.85, "colsample_bytree": 0.85, "reg_lambda": 1.0, "min_child_weight": 20, "early_stopping_rounds": 40, "n_jobs": 4, "seed": 0}, "data": {"format": "csv", "path": "C:\\Users\\abhir\\clauderesearch\\autoresearch\\generalized_ml_autoresearch\\examples\\fraud_ecommerce\\data\\features_rolling.csv", "target_columns": ["class"], "feature_columns": ["purchase_value", "device_id", "source", "browser", "age", "ip_address", "country", "time_since_signup", "purchase_hour", "purchase_dayofweek", "signup_hour", "device_id_freq", "ip_address_freq", "country_freq", "source_freq", "browser_freq", "device_fraud_rate_train", "country_fraud_rate_train", "device_id_count_1d", "device_id_count_7d", "device_id_count_30d", "ip_address_count_1d", "ip_address_count_7d", "ip_address_count_30d", "device_id_fraud_count_7d"]}, "split": {"name": "holdout", "order": "time", "test_fraction": 0.2, "val_fraction": 0.1, "seed": 0}, "composite": {"higher_is_better": true, "penalty_weight": 0.05, "below_threshold": 0.5}, "description": "XGBoost rolling, min_child_weight=20", "seed": 0}, "composite": 0.5255901908452881, "val_primary": 0.5347310361158532, "test_primary": 0.5255901908452881, "per_fold_test": [0.5255901908452881], "per_fold_val": [0.5347310361158532], "status": "KEEP", "seconds_elapsed": 0.8547458648681641, "timestamp": "2026-04-24T21:12:53", "secondary_metrics": {"accuracy": 0.9475878499106611, "precision": 0.21902017291066284, "recall": 0.054715622750179986, "f1": 0.08755760368663594, "f2": 0.06437404709469761, "mcc": 0.08907079634380681, "auc_pr": 0.060618217076844255, "log_loss": 0.1883223755212373, "tn": 28562.0, "fp": 271.0, "fn": 1313.0, "tp": 76.0}, "per_fold_test_reports": [{"fold_id": 0, "regime": "holdout", "task_type": "binary_classification", "n": 30222, "accuracy": 0.9475878499106611, "precision": 0.21902017291066284, "recall": 0.054715622750179986, "f1": 0.08755760368663594, "f2": 0.06437404709469761, "mcc": 0.08907079634380681, "auc_roc": 0.5255901908452881, "auc_pr": 0.060618217076844255, "log_loss": 0.1883223755212373, "tn": 28562, "fp": 271, "fn": 1313, "tp": 76}], "composite_fingerprint": "e692f018120592ed"}
{"experiment_num": 17, "backbone": "xgboost", "description": "XGBoost rolling, reg_lambda=5.0", "config": {"paths": {"results_dir": "C:\\Users\\abhir\\clauderesearch\\autoresearch\\generalized_ml_autoresearch\\examples\\fraud_ecommerce\\autoresearch_results"}, "task_type": "binary_classification", "primary_metric": "auc_roc", "backbone": "xgboost", "backbone_config": {"n_estimators": 600, "max_depth": 6, "learning_rate": 0.05, "subsample": 0.85, "colsample_bytree": 0.85, "reg_lambda": 5.0, "min_child_weight": 5, "early_stopping_rounds": 40, "n_jobs": 4, "seed": 0}, "data": {"format": "csv", "path": "C:\\Users\\abhir\\clauderesearch\\autoresearch\\generalized_ml_autoresearch\\examples\\fraud_ecommerce\\data\\features_rolling.csv", "target_columns": ["class"], "feature_columns": ["purchase_value", "device_id", "source", "browser", "age", "ip_address", "country", "time_since_signup", "purchase_hour", "purchase_dayofweek", "signup_hour", "device_id_freq", "ip_address_freq", "country_freq", "source_freq", "browser_freq", "device_fraud_rate_train", "country_fraud_rate_train", "device_id_count_1d", "device_id_count_7d", "device_id_count_30d", "ip_address_count_1d", "ip_address_count_7d", "ip_address_count_30d", "device_id_fraud_count_7d"]}, "split": {"name": "holdout", "order": "time", "test_fraction": 0.2, "val_fraction": 0.1, "seed": 0}, "composite": {"higher_is_better": true, "penalty_weight": 0.05, "below_threshold": 0.5}, "description": "XGBoost rolling, reg_lambda=5.0", "seed": 0}, "composite": 0.5311358547772322, "val_primary": 0.5431323310203293, "test_primary": 0.5311358547772322, "per_fold_test": [0.5311358547772322], "per_fold_val": [0.5431323310203293], "status": "KEEP", "seconds_elapsed": 0.897996187210083, "timestamp": "2026-04-24T21:12:54", "secondary_metrics": {"accuracy": 0.9475878499106611, "precision": 0.21902017291066284, "recall": 0.054715622750179986, "f1": 0.08755760368663594, "f2": 0.06437404709469761, "mcc": 0.08907079634380681, "auc_pr": 0.0616804072612306, "log_loss": 0.18819767041009458, "tn": 28562.0, "fp": 271.0, "fn": 1313.0, "tp": 76.0}, "per_fold_test_reports": [{"fold_id": 0, "regime": "holdout", "task_type": "binary_classification", "n": 30222, "accuracy": 0.9475878499106611, "precision": 0.21902017291066284, "recall": 0.054715622750179986, "f1": 0.08755760368663594, "f2": 0.06437404709469761, "mcc": 0.08907079634380681, "auc_roc": 0.5311358547772322, "auc_pr": 0.0616804072612306, "log_loss": 0.18819767041009458, "tn": 28562, "fp": 271, "fn": 1313, "tp": 76}], "composite_fingerprint": "e692f018120592ed"}
