{"experiment_num": 18, "backbone": "xgboost", "description": "XGBoost rolling, subsample=0.65", "config": {"paths": {"results_dir": "C:\\Users\\abhir\\clauderesearch\\autoresearch\\generalized_ml_autoresearch\\examples\\fraud_ecommerce\\autoresearch_results"}, "task_type": "binary_classification", "primary_metric": "auc_roc", "backbone": "xgboost", "backbone_config": {"n_estimators": 600, "max_depth": 6, "learning_rate": 0.05, "subsample": 0.65, "colsample_bytree": 0.85, "reg_lambda": 1.0, "min_child_weight": 5, "early_stopping_rounds": 40, "n_jobs": 4, "seed": 0}, "data": {"format": "csv", "path": "C:\\Users\\abhir\\clauderesearch\\autoresearch\\generalized_ml_autoresearch\\examples\\fraud_ecommerce\\data\\features_rolling.csv", "target_columns": ["class"], "feature_columns": ["purchase_value", "device_id", "source", "browser", "age", "ip_address", "country", "time_since_signup", "purchase_hour", "purchase_dayofweek", "signup_hour", "device_id_freq", "ip_address_freq", "country_freq", "source_freq", "browser_freq", "device_fraud_rate_train", "country_fraud_rate_train", "device_id_count_1d", "device_id_count_7d", "device_id_count_30d", "ip_address_count_1d", "ip_address_count_7d", "ip_address_count_30d", "device_id_fraud_count_7d"]}, "split": {"name": "holdout", "order": "time", "test_fraction": 0.2, "val_fraction": 0.1, "seed": 0}, "composite": {"higher_is_better": true, "penalty_weight": 0.05, "below_threshold": 0.5}, "description": "XGBoost rolling, subsample=0.65", "seed": 0}, "composite": 0.5299858527941743, "val_primary": 0.5299858527941743, "test_primary": 0.5347636448786522, "per_fold_test": [0.5347636448786522], "per_fold_val": [0.5299858527941743], "status": "KEEP", "seconds_elapsed": 0.8968136310577393, "timestamp": "2026-04-24T21:12:55", "secondary_metrics": {"accuracy": 0.9475878499106611, "precision": 0.21902017291066284, "recall": 0.054715622750179986, "f1": 0.08755760368663594, "f2": 0.06437404709469761, "mcc": 0.08907079634380681, "auc_pr": 0.06316025299463934, "log_loss": 0.18830094951122575, "tn": 28562.0, "fp": 271.0, "fn": 1313.0, "tp": 76.0}, "per_fold_test_reports": [{"fold_id": 0, "regime": "holdout", "task_type": "binary_classification", "n": 30222, "accuracy": 0.9475878499106611, "precision": 0.21902017291066284, "recall": 0.054715622750179986, "f1": 0.08755760368663594, "f2": 0.06437404709469761, "mcc": 0.08907079634380681, "auc_roc": 0.5347636448786522, "auc_pr": 0.06316025299463934, "log_loss": 0.18830094951122575, "tn": 28562, "fp": 271, "fn": 1313, "tp": 76}], "composite_fingerprint": "e692f018120592ed"}
{"experiment_num": 19, "backbone": "xgboost", "description": "XGBoost rolling, colsample_bytree=0.65", "config": {"paths": {"results_dir": "C:\\Users\\abhir\\clauderesearch\\autoresearch\\generalized_ml_autoresearch\\examples\\fraud_ecommerce\\autoresearch_results"}, "task_type": "binary_classification", "primary_metric": "auc_roc", "backbone": "xgboost", "backbone_config": {"n_estimators": 600, "max_depth": 6, "learning_rate": 0.05, "subsample": 0.85, "colsample_bytree": 0.65, "reg_lambda": 1.0, "min_child_weight": 5, "early_stopping_rounds": 40, "n_jobs": 4, "seed": 0}, "data": {"format": "csv", "path": "C:\\Users\\abhir\\clauderesearch\\autoresearch\\generalized_ml_autoresearch\\examples\\fraud_ecommerce\\data\\features_rolling.csv", "target_columns": ["class"], "feature_columns": ["purchase_value", "device_id", "source", "browser", "age", "ip_address", "country", "time_since_signup", "purchase_hour", "purchase_dayofweek", "signup_hour", "device_id_freq", "ip_address_freq", "country_freq", "source_freq", "browser_freq", "device_fraud_rate_train", "country_fraud_rate_train", "device_id_count_1d", "device_id_count_7d", "device_id_count_30d", "ip_address_count_1d", "ip_address_count_7d", "ip_address_count_30d", "device_id_fraud_count_7d"]}, "split": {"name": "holdout", "order": "time", "test_fraction": 0.2, "val_fraction": 0.1, "seed": 0}, "composite": {"higher_is_better": true, "penalty_weight": 0.05, "below_threshold": 0.5}, "description": "XGBoost rolling, colsample_bytree=0.65", "seed": 0}, "composite": 0.5367065255526619, "val_primary": 0.5507073096932646, "test_primary": 0.5367065255526619, "per_fold_test": [0.5367065255526619], "per_fold_val": [0.5507073096932646], "status": "KEEP", "seconds_elapsed": 0.8944077491760254, "timestamp": "2026-04-24T21:12:56", "secondary_metrics": {"accuracy": 0.9475878499106611, "precision": 0.21902017291066284, "recall": 0.054715622750179986, "f1": 0.08755760368663594, "f2": 0.06437404709469761, "mcc": 0.08907079634380681, "auc_pr": 0.06938357731015427, "log_loss": 0.1872388736348519, "tn": 28562.0, "fp": 271.0, "fn": 1313.0, "tp": 76.0}, "per_fold_test_reports": [{"fold_id": 0, "regime": "holdout", "task_type": "binary_classification", "n": 30222, "accuracy": 0.9475878499106611, "precision": 0.21902017291066284, "recall": 0.054715622750179986, "f1": 0.08755760368663594, "f2": 0.06437404709469761, "mcc": 0.08907079634380681, "auc_roc": 0.5367065255526619, "auc_pr": 0.06938357731015427, "log_loss": 0.1872388736348519, "tn": 28562, "fp": 271, "fn": 1313, "tp": 76}], "composite_fingerprint": "e692f018120592ed"}
{"experiment_num": 20, "backbone": "lightgbm", "description": "LightGBM + ROLLING velocity features", "config": {"paths": {"results_dir": "C:\\Users\\abhir\\clauderesearch\\autoresearch\\generalized_ml_autoresearch\\examples\\fraud_ecommerce\\autoresearch_results"}, "task_type": "binary_classification", "primary_metric": "auc_roc", "backbone": "lightgbm", "backbone_config": {"n_estimators": 800, "num_leaves": 63, "learning_rate": 0.04, "feature_fraction": 0.85, "bagging_fraction": 0.85, "min_data_in_leaf": 50, "reg_lambda": 1.0, "early_stopping_rounds": 50, "n_jobs": 4, "seed": 0}, "data": {"format": "csv", "path": "C:\\Users\\abhir\\clauderesearch\\autoresearch\\generalized_ml_autoresearch\\examples\\fraud_ecommerce\\data\\features_rolling.csv", "target_columns": ["class"], "feature_columns": ["purchase_value", "device_id", "source", "browser", "age", "ip_address", "country", "time_since_signup", "purchase_hour", "purchase_dayofweek", "signup_hour", "device_id_freq", "ip_address_freq", "country_freq", "source_freq", "browser_freq", "device_fraud_rate_train", "country_fraud_rate_train", "device_id_count_1d", "device_id_count_7d", "device_id_count_30d", "ip_address_count_1d", "ip_address_count_7d", "ip_address_count_30d", "device_id_fraud_count_7d"]}, "split": {"name": "holdout", "order": "time", "test_fraction": 0.2, "val_fraction": 0.1, "seed": 0}, "composite": {"higher_is_better": true, "penalty_weight": 0.05, "below_threshold": 0.5}, "description": "LightGBM + ROLLING velocity features", "seed": 0}, "composite": 0.5294416692216595, "val_primary": 0.5523031205821606, "test_primary": 0.5294416692216595, "per_fold_test": [0.5294416692216595], "per_fold_val": [0.5523031205821606], "status": "KEEP", "seconds_elapsed": 1.1261265277862549, "timestamp": "2026-04-24T21:12:57", "secondary_metrics": {"accuracy": 0.9475878499106611, "precision": 0.21902017291066284, "recall": 0.054715622750179986, "f1": 0.08755760368663594, "f2": 0.06437404709469761, "mcc": 0.08907079634380681, "auc_pr": 0.06452970876558169, "log_loss": 0.1872848773061313, "tn": 28562.0, "fp": 271.0, "fn": 1313.0, "tp": 76.0}, "per_fold_test_reports": [{"fold_id": 0, "regime": "holdout", "task_type": "binary_classification", "n": 30222, "accuracy": 0.9475878499106611, "precision": 0.21902017291066284, "recall": 0.054715622750179986, "f1": 0.08755760368663594, "f2": 0.06437404709469761, "mcc": 0.08907079634380681, "auc_roc": 0.5294416692216595, "auc_pr": 0.06452970876558169, "log_loss": 0.1872848773061313, "tn": 28562, "fp": 271, "fn": 1313, "tp": 76}], "composite_fingerprint": "e692f018120592ed"}
{"experiment_num": 21, "backbone": "lightgbm", "description": "LightGBM rolling, num_leaves=31", "config": {"paths": {"results_dir": "C:\\Users\\abhir\\clauderesearch\\autoresearch\\generalized_ml_autoresearch\\examples\\fraud_ecommerce\\autoresearch_results"}, "task_type": "binary_classification", "primary_metric": "auc_roc", "backbone": "lightgbm", "backbone_config": {"n_estimators": 800, "num_leaves": 31, "learning_rate": 0.04, "feature_fraction": 0.85, "bagging_fraction": 0.85, "min_data_in_leaf": 50, "reg_lambda": 1.0, "early_stopping_rounds": 50, "n_jobs": 4, "seed": 0}, "data": {"format": "csv", "path": "C:\\Users\\abhir\\clauderesearch\\autoresearch\\generalized_ml_autoresearch\\examples\\fraud_ecommerce\\data\\features_rolling.csv", "target_columns": ["class"], "feature_columns": ["purchase_value", "device_id", "source", "browser", "age", "ip_address", "country", "time_since_signup", "purchase_hour", "purchase_dayofweek", "signup_hour", "device_id_freq", "ip_address_freq", "country_freq", "source_freq", "browser_freq", "device_fraud_rate_train", "country_fraud_rate_train", "device_id_count_1d", "device_id_count_7d", "device_id_count_30d", "ip_address_count_1d", "ip_address_count_7d", "ip_address_count_30d", "device_id_fraud_count_7d"]}, "split": {"name": "holdout", "order": "time", "test_fraction": 0.2, "val_fraction": 0.1, "seed": 0}, "composite": {"higher_is_better": true, "penalty_weight": 0.05, "below_threshold": 0.5}, "description": "LightGBM rolling, num_leaves=31", "seed": 0}, "composite": 0.5281250582879183, "val_primary": 0.5631898913255771, "test_primary": 0.5281250582879183, "per_fold_test": [0.5281250582879183], "per_fold_val": [0.5631898913255771], "status": "KEEP", "seconds_elapsed": 1.214843511581421, "timestamp": "2026-04-24T21:12:59", "secondary_metrics": {"accuracy": 0.9475878499106611, "precision": 0.21902017291066284, "recall": 0.054715622750179986, "f1": 0.08755760368663594, "f2": 0.06437404709469761, "mcc": 0.08907079634380681, "auc_pr": 0.06457356479944028, "log_loss": 0.18727688045371368, "tn": 28562.0, "fp": 271.0, "fn": 1313.0, "tp": 76.0}, "per_fold_test_reports": [{"fold_id": 0, "regime": "holdout", "task_type": "binary_classification", "n": 30222, "accuracy": 0.9475878499106611, "precision": 0.21902017291066284, "recall": 0.054715622750179986, "f1": 0.08755760368663594, "f2": 0.06437404709469761, "mcc": 0.08907079634380681, "auc_roc": 0.5281250582879183, "auc_pr": 0.06457356479944028, "log_loss": 0.18727688045371368, "tn": 28562, "fp": 271, "fn": 1313, "tp": 76}], "composite_fingerprint": "e692f018120592ed"}
{"experiment_num": 22, "backbone": "lightgbm", "description": "LightGBM rolling, num_leaves=127", "config": {"paths": {"results_dir": "C:\\Users\\abhir\\clauderesearch\\autoresearch\\generalized_ml_autoresearch\\examples\\fraud_ecommerce\\autoresearch_results"}, "task_type": "binary_classification", "primary_metric": "auc_roc", "backbone": "lightgbm", "backbone_config": {"n_estimators": 800, "num_leaves": 127, "learning_rate": 0.04, "feature_fraction": 0.85, "bagging_fraction": 0.85, "min_data_in_leaf": 50, "reg_lambda": 1.0, "early_stopping_rounds": 50, "n_jobs": 4, "seed": 0}, "data": {"format": "csv", "path": "C:\\Users\\abhir\\clauderesearch\\autoresearch\\generalized_ml_autoresearch\\examples\\fraud_ecommerce\\data\\features_rolling.csv", "target_columns": ["class"], "feature_columns": ["purchase_value", "device_id", "source", "browser", "age", "ip_address", "country", "time_since_signup", "purchase_hour", "purchase_dayofweek", "signup_hour", "device_id_freq", "ip_address_freq", "country_freq", "source_freq", "browser_freq", "device_fraud_rate_train", "country_fraud_rate_train", "device_id_count_1d", "device_id_count_7d", "device_id_count_30d", "ip_address_count_1d", "ip_address_count_7d", "ip_address_count_30d", "device_id_fraud_count_7d"]}, "split": {"name": "holdout", "order": "time", "test_fraction": 0.2, "val_fraction": 0.1, "seed": 0}, "composite": {"higher_is_better": true, "penalty_weight": 0.05, "below_threshold": 0.5}, "description": "LightGBM rolling, num_leaves=127", "seed": 0}, "composite": 0.5224695540119979, "val_primary": 0.5407711239135341, "test_primary": 0.5224695540119979, "per_fold_test": [0.5224695540119979], "per_fold_val": [0.5407711239135341], "status": "KEEP", "seconds_elapsed": 0.9481785297393799, "timestamp": "2026-04-24T21:13:00", "secondary_metrics": {"accuracy": 0.9475878499106611, "precision": 0.21902017291066284, "recall": 0.054715622750179986, "f1": 0.08755760368663594, "f2": 0.06437404709469761, "mcc": 0.08907079634380681, "auc_pr": 0.06225813478291171, "log_loss": 0.18729414467966915, "tn": 28562.0, "fp": 271.0, "fn": 1313.0, "tp": 76.0}, "per_fold_test_reports": [{"fold_id": 0, "regime": "holdout", "task_type": "binary_classification", "n": 30222, "accuracy": 0.9475878499106611, "precision": 0.21902017291066284, "recall": 0.054715622750179986, "f1": 0.08755760368663594, "f2": 0.06437404709469761, "mcc": 0.08907079634380681, "auc_roc": 0.5224695540119979, "auc_pr": 0.06225813478291171, "log_loss": 0.18729414467966915, "tn": 28562, "fp": 271, "fn": 1313, "tp": 76}], "composite_fingerprint": "e692f018120592ed"}
{"experiment_num": 23, "backbone": "lightgbm", "description": "LightGBM rolling, learning_rate=0.02", "config": {"paths": {"results_dir": "C:\\Users\\abhir\\clauderesearch\\autoresearch\\generalized_ml_autoresearch\\examples\\fraud_ecommerce\\autoresearch_results"}, "task_type": "binary_classification", "primary_metric": "auc_roc", "backbone": "lightgbm", "backbone_config": {"n_estimators": 800, "num_leaves": 63, "learning_rate": 0.02, "feature_fraction": 0.85, "bagging_fraction": 0.85, "min_data_in_leaf": 50, "reg_lambda": 1.0, "early_stopping_rounds": 50, "n_jobs": 4, "seed": 0}, "data": {"format": "csv", "path": "C:\\Users\\abhir\\clauderesearch\\autoresearch\\generalized_ml_autoresearch\\examples\\fraud_ecommerce\\data\\features_rolling.csv", "target_columns": ["class"], "feature_columns": ["purchase_value", "device_id", "source", "browser", "age", "ip_address", "country", "time_since_signup", "purchase_hour", "purchase_dayofweek", "signup_hour", "device_id_freq", "ip_address_freq", "country_freq", "source_freq", "browser_freq", "device_fraud_rate_train", "country_fraud_rate_train", "device_id_count_1d", "device_id_count_7d", "device_id_count_30d", "ip_address_count_1d", "ip_address_count_7d", "ip_address_count_30d", "device_id_fraud_count_7d"]}, "split": {"name": "holdout", "order": "time", "test_fraction": 0.2, "val_fraction": 0.1, "seed": 0}, "composite": {"higher_is_better": true, "penalty_weight": 0.05, "below_threshold": 0.5}, "description": "LightGBM rolling, learning_rate=0.02", "seed": 0}, "composite": 0.5273397085677741, "val_primary": 0.5437508411920488, "test_primary": 0.5273397085677741, "per_fold_test": [0.5273397085677741], "per_fold_val": [0.5437508411920488], "status": "KEEP", "seconds_elapsed": 0.9380462169647217, "timestamp": "2026-04-24T21:13:01", "secondary_metrics": {"accuracy": 0.9475878499106611, "precision": 0.21902017291066284, "recall": 0.054715622750179986, "f1": 0.08755760368663594, "f2": 0.06437404709469761, "mcc": 0.08907079634380681, "auc_pr": 0.06581781948395438, "log_loss": 0.18728028544634806, "tn": 28562.0, "fp": 271.0, "fn": 1313.0, "tp": 76.0}, "per_fold_test_reports": [{"fold_id": 0, "regime": "holdout", "task_type": "binary_classification", "n": 30222, "accuracy": 0.9475878499106611, "precision": 0.21902017291066284, "recall": 0.054715622750179986, "f1": 0.08755760368663594, "f2": 0.06437404709469761, "mcc": 0.08907079634380681, "auc_roc": 0.5273397085677741, "auc_pr": 0.06581781948395438, "log_loss": 0.18728028544634806, "tn": 28562, "fp": 271, "fn": 1313, "tp": 76}], "composite_fingerprint": "e692f018120592ed"}
{"experiment_num": 24, "backbone": "lightgbm", "description": "LightGBM rolling, learning_rate=0.08", "config": {"paths": {"results_dir": "C:\\Users\\abhir\\clauderesearch\\autoresearch\\generalized_ml_autoresearch\\examples\\fraud_ecommerce\\autoresearch_results"}, "task_type": "binary_classification", "primary_metric": "auc_roc", "backbone": "lightgbm", "backbone_config": {"n_estimators": 800, "num_leaves": 63, "learning_rate": 0.08, "feature_fraction": 0.85, "bagging_fraction": 0.85, "min_data_in_leaf": 50, "reg_lambda": 1.0, "early_stopping_rounds": 50, "n_jobs": 4, "seed": 0}, "data": {"format": "csv", "path": "C:\\Users\\abhir\\clauderesearch\\autoresearch\\generalized_ml_autoresearch\\examples\\fraud_ecommerce\\data\\features_rolling.csv", "target_columns": ["class"], "feature_columns": ["purchase_value", "device_id", "source", "browser", "age", "ip_address", "country", "time_since_signup", "purchase_hour", "purchase_dayofweek", "signup_hour", "device_id_freq", "ip_address_freq", "country_freq", "source_freq", "browser_freq", "device_fraud_rate_train", "country_fraud_rate_train", "device_id_count_1d", "device_id_count_7d", "device_id_count_30d", "ip_address_count_1d", "ip_address_count_7d", "ip_address_count_30d", "device_id_fraud_count_7d"]}, "split": {"name": "holdout", "order": "time", "test_fraction": 0.2, "val_fraction": 0.1, "seed": 0}, "composite": {"higher_is_better": true, "penalty_weight": 0.05, "below_threshold": 0.5}, "description": "LightGBM rolling, learning_rate=0.08", "seed": 0}, "composite": 0.5238207372940787, "val_primary": 0.5238207372940787, "test_primary": 0.5248539808834852, "per_fold_test": [0.5248539808834852], "per_fold_val": [0.5238207372940787], "status": "KEEP", "seconds_elapsed": 0.8368644714355469, "timestamp": "2026-04-24T21:13:01", "secondary_metrics": {"accuracy": 0.9475878499106611, "precision": 0.21902017291066284, "recall": 0.054715622750179986, "f1": 0.08755760368663594, "f2": 0.06437404709469761, "mcc": 0.08907079634380681, "auc_pr": 0.05631066068213554, "log_loss": 0.18826047250905553, "tn": 28562.0, "fp": 271.0, "fn": 1313.0, "tp": 76.0}, "per_fold_test_reports": [{"fold_id": 0, "regime": "holdout", "task_type": "binary_classification", "n": 30222, "accuracy": 0.9475878499106611, "precision": 0.21902017291066284, "recall": 0.054715622750179986, "f1": 0.08755760368663594, "f2": 0.06437404709469761, "mcc": 0.08907079634380681, "auc_roc": 0.5248539808834852, "auc_pr": 0.05631066068213554, "log_loss": 0.18826047250905553, "tn": 28562, "fp": 271, "fn": 1313, "tp": 76}], "composite_fingerprint": "e692f018120592ed"}
{"experiment_num": 25, "backbone": "lightgbm", "description": "LightGBM rolling, min_data_in_leaf=20", "config": {"paths": {"results_dir": "C:\\Users\\abhir\\clauderesearch\\autoresearch\\generalized_ml_autoresearch\\examples\\fraud_ecommerce\\autoresearch_results"}, "task_type": "binary_classification", "primary_metric": "auc_roc", "backbone": "lightgbm", "backbone_config": {"n_estimators": 800, "num_leaves": 63, "learning_rate": 0.04, "feature_fraction": 0.85, "bagging_fraction": 0.85, "min_data_in_leaf": 20, "reg_lambda": 1.0, "early_stopping_rounds": 50, "n_jobs": 4, "seed": 0}, "data": {"format": "csv", "path": "C:\\Users\\abhir\\clauderesearch\\autoresearch\\generalized_ml_autoresearch\\examples\\fraud_ecommerce\\data\\features_rolling.csv", "target_columns": ["class"], "feature_columns": ["purchase_value", "device_id", "source", "browser", "age", "ip_address", "country", "time_since_signup", "purchase_hour", "purchase_dayofweek", "signup_hour", "device_id_freq", "ip_address_freq", "country_freq", "source_freq", "browser_freq", "device_fraud_rate_train", "country_fraud_rate_train", "device_id_count_1d", "device_id_count_7d", "device_id_count_30d", "ip_address_count_1d", "ip_address_count_7d", "ip_address_count_30d", "device_id_fraud_count_7d"]}, "split": {"name": "holdout", "order": "time", "test_fraction": 0.2, "val_fraction": 0.1, "seed": 0}, "composite": {"higher_is_better": true, "penalty_weight": 0.05, "below_threshold": 0.5}, "description": "LightGBM rolling, min_data_in_leaf=20", "seed": 0}, "composite": 0.5269475268531425, "val_primary": 0.5527028449241587, "test_primary": 0.5269475268531425, "per_fold_test": [0.5269475268531425], "per_fold_val": [0.5527028449241587], "status": "KEEP", "seconds_elapsed": 0.8679115772247314, "timestamp": "2026-04-24T21:13:02", "secondary_metrics": {"accuracy": 0.9475878499106611, "precision": 0.21902017291066284, "recall": 0.054715622750179986, "f1": 0.08755760368663594, "f2": 0.06437404709469761, "mcc": 0.08907079634380681, "auc_pr": 0.06399046035579671, "log_loss": 0.18728252629778042, "tn": 28562.0, "fp": 271.0, "fn": 1313.0, "tp": 76.0}, "per_fold_test_reports": [{"fold_id": 0, "regime": "holdout", "task_type": "binary_classification", "n": 30222, "accuracy": 0.9475878499106611, "precision": 0.21902017291066284, "recall": 0.054715622750179986, "f1": 0.08755760368663594, "f2": 0.06437404709469761, "mcc": 0.08907079634380681, "auc_roc": 0.5269475268531425, "auc_pr": 0.06399046035579671, "log_loss": 0.18728252629778042, "tn": 28562, "fp": 271, "fn": 1313, "tp": 76}], "composite_fingerprint": "e692f018120592ed"}
