{"experiment_num": 26, "backbone": "lightgbm", "description": "LightGBM rolling, min_data_in_leaf=200", "config": {"paths": {"results_dir": "C:\\Users\\abhir\\clauderesearch\\autoresearch\\generalized_ml_autoresearch\\examples\\fraud_ecommerce\\autoresearch_results"}, "task_type": "binary_classification", "primary_metric": "auc_roc", "backbone": "lightgbm", "backbone_config": {"n_estimators": 800, "num_leaves": 63, "learning_rate": 0.04, "feature_fraction": 0.85, "bagging_fraction": 0.85, "min_data_in_leaf": 200, "reg_lambda": 1.0, "early_stopping_rounds": 50, "n_jobs": 4, "seed": 0}, "data": {"format": "csv", "path": "C:\\Users\\abhir\\clauderesearch\\autoresearch\\generalized_ml_autoresearch\\examples\\fraud_ecommerce\\data\\features_rolling.csv", "target_columns": ["class"], "feature_columns": ["purchase_value", "device_id", "source", "browser", "age", "ip_address", "country", "time_since_signup", "purchase_hour", "purchase_dayofweek", "signup_hour", "device_id_freq", "ip_address_freq", "country_freq", "source_freq", "browser_freq", "device_fraud_rate_train", "country_fraud_rate_train", "device_id_count_1d", "device_id_count_7d", "device_id_count_30d", "ip_address_count_1d", "ip_address_count_7d", "ip_address_count_30d", "device_id_fraud_count_7d"]}, "split": {"name": "holdout", "order": "time", "test_fraction": 0.2, "val_fraction": 0.1, "seed": 0}, "composite": {"higher_is_better": true, "penalty_weight": 0.05, "below_threshold": 0.5}, "description": "LightGBM rolling, min_data_in_leaf=200", "seed": 0}, "composite": 0.5220256482072215, "val_primary": 0.5335530636593903, "test_primary": 0.5220256482072215, "per_fold_test": [0.5220256482072215], "per_fold_val": [0.5335530636593903], "status": "KEEP", "seconds_elapsed": 0.865149974822998, "timestamp": "2026-04-24T21:13:03", "secondary_metrics": {"accuracy": 0.9475878499106611, "precision": 0.21902017291066284, "recall": 0.054715622750179986, "f1": 0.08755760368663594, "f2": 0.06437404709469761, "mcc": 0.08907079634380681, "auc_pr": 0.06270777077984963, "log_loss": 0.18731046271799368, "tn": 28562.0, "fp": 271.0, "fn": 1313.0, "tp": 76.0}, "per_fold_test_reports": [{"fold_id": 0, "regime": "holdout", "task_type": "binary_classification", "n": 30222, "accuracy": 0.9475878499106611, "precision": 0.21902017291066284, "recall": 0.054715622750179986, "f1": 0.08755760368663594, "f2": 0.06437404709469761, "mcc": 0.08907079634380681, "auc_roc": 0.5220256482072215, "auc_pr": 0.06270777077984963, "log_loss": 0.18731046271799368, "tn": 28562, "fp": 271, "fn": 1313, "tp": 76}], "composite_fingerprint": "e692f018120592ed"}
{"experiment_num": 27, "backbone": "lightgbm", "description": "LightGBM rolling, feature_fraction=0.65", "config": {"paths": {"results_dir": "C:\\Users\\abhir\\clauderesearch\\autoresearch\\generalized_ml_autoresearch\\examples\\fraud_ecommerce\\autoresearch_results"}, "task_type": "binary_classification", "primary_metric": "auc_roc", "backbone": "lightgbm", "backbone_config": {"n_estimators": 800, "num_leaves": 63, "learning_rate": 0.04, "feature_fraction": 0.65, "bagging_fraction": 0.85, "min_data_in_leaf": 50, "reg_lambda": 1.0, "early_stopping_rounds": 50, "n_jobs": 4, "seed": 0}, "data": {"format": "csv", "path": "C:\\Users\\abhir\\clauderesearch\\autoresearch\\generalized_ml_autoresearch\\examples\\fraud_ecommerce\\data\\features_rolling.csv", "target_columns": ["class"], "feature_columns": ["purchase_value", "device_id", "source", "browser", "age", "ip_address", "country", "time_since_signup", "purchase_hour", "purchase_dayofweek", "signup_hour", "device_id_freq", "ip_address_freq", "country_freq", "source_freq", "browser_freq", "device_fraud_rate_train", "country_fraud_rate_train", "device_id_count_1d", "device_id_count_7d", "device_id_count_30d", "ip_address_count_1d", "ip_address_count_7d", "ip_address_count_30d", "device_id_fraud_count_7d"]}, "split": {"name": "holdout", "order": "time", "test_fraction": 0.2, "val_fraction": 0.1, "seed": 0}, "composite": {"higher_is_better": true, "penalty_weight": 0.05, "below_threshold": 0.5}, "description": "LightGBM rolling, feature_fraction=0.65", "seed": 0}, "composite": 0.5309691965876733, "val_primary": 0.5414929552379575, "test_primary": 0.5309691965876733, "per_fold_test": [0.5309691965876733], "per_fold_val": [0.5414929552379575], "status": "KEEP", "seconds_elapsed": 0.9546332359313965, "timestamp": "2026-04-24T21:13:04", "secondary_metrics": {"accuracy": 0.9530143603997088, "precision": 0.30864197530864196, "recall": 0.017998560115190784, "f1": 0.034013605442176874, "f2": 0.022174915735320207, "mcc": 0.06503112804434234, "auc_pr": 0.06645364099683643, "log_loss": 0.18614761659981682, "tn": 28777.0, "fp": 56.0, "fn": 1364.0, "tp": 25.0}, "per_fold_test_reports": [{"fold_id": 0, "regime": "holdout", "task_type": "binary_classification", "n": 30222, "accuracy": 0.9530143603997088, "precision": 0.30864197530864196, "recall": 0.017998560115190784, "f1": 0.034013605442176874, "f2": 0.022174915735320207, "mcc": 0.06503112804434234, "auc_roc": 0.5309691965876733, "auc_pr": 0.06645364099683643, "log_loss": 0.18614761659981682, "tn": 28777, "fp": 56, "fn": 1364, "tp": 25}], "composite_fingerprint": "e692f018120592ed"}
{"experiment_num": 28, "backbone": "lightgbm", "description": "LightGBM rolling, bagging_fraction=0.65", "config": {"paths": {"results_dir": "C:\\Users\\abhir\\clauderesearch\\autoresearch\\generalized_ml_autoresearch\\examples\\fraud_ecommerce\\autoresearch_results"}, "task_type": "binary_classification", "primary_metric": "auc_roc", "backbone": "lightgbm", "backbone_config": {"n_estimators": 800, "num_leaves": 63, "learning_rate": 0.04, "feature_fraction": 0.85, "bagging_fraction": 0.65, "min_data_in_leaf": 50, "reg_lambda": 1.0, "early_stopping_rounds": 50, "n_jobs": 4, "seed": 0}, "data": {"format": "csv", "path": "C:\\Users\\abhir\\clauderesearch\\autoresearch\\generalized_ml_autoresearch\\examples\\fraud_ecommerce\\data\\features_rolling.csv", "target_columns": ["class"], "feature_columns": ["purchase_value", "device_id", "source", "browser", "age", "ip_address", "country", "time_since_signup", "purchase_hour", "purchase_dayofweek", "signup_hour", "device_id_freq", "ip_address_freq", "country_freq", "source_freq", "browser_freq", "device_fraud_rate_train", "country_fraud_rate_train", "device_id_count_1d", "device_id_count_7d", "device_id_count_30d", "ip_address_count_1d", "ip_address_count_7d", "ip_address_count_30d", "device_id_fraud_count_7d"]}, "split": {"name": "holdout", "order": "time", "test_fraction": 0.2, "val_fraction": 0.1, "seed": 0}, "composite": {"higher_is_better": true, "penalty_weight": 0.05, "below_threshold": 0.5}, "description": "LightGBM rolling, bagging_fraction=0.65", "seed": 0}, "composite": 0.5294416692216595, "val_primary": 0.5523031205821606, "test_primary": 0.5294416692216595, "per_fold_test": [0.5294416692216595], "per_fold_val": [0.5523031205821606], "status": "KEEP", "seconds_elapsed": 0.8611924648284912, "timestamp": "2026-04-24T21:13:05", "secondary_metrics": {"accuracy": 0.9475878499106611, "precision": 0.21902017291066284, "recall": 0.054715622750179986, "f1": 0.08755760368663594, "f2": 0.06437404709469761, "mcc": 0.08907079634380681, "auc_pr": 0.06452970876558169, "log_loss": 0.1872848773061313, "tn": 28562.0, "fp": 271.0, "fn": 1313.0, "tp": 76.0}, "per_fold_test_reports": [{"fold_id": 0, "regime": "holdout", "task_type": "binary_classification", "n": 30222, "accuracy": 0.9475878499106611, "precision": 0.21902017291066284, "recall": 0.054715622750179986, "f1": 0.08755760368663594, "f2": 0.06437404709469761, "mcc": 0.08907079634380681, "auc_roc": 0.5294416692216595, "auc_pr": 0.06452970876558169, "log_loss": 0.1872848773061313, "tn": 28562, "fp": 271, "fn": 1313, "tp": 76}], "composite_fingerprint": "e692f018120592ed"}
{"experiment_num": 29, "backbone": "catboost", "description": "CatBoost + ROLLING velocity features", "config": {"paths": {"results_dir": "C:\\Users\\abhir\\clauderesearch\\autoresearch\\generalized_ml_autoresearch\\examples\\fraud_ecommerce\\autoresearch_results"}, "task_type": "binary_classification", "primary_metric": "auc_roc", "backbone": "catboost", "backbone_config": {"iterations": 1000, "depth": 6, "learning_rate": 0.04, "l2_leaf_reg": 3.0, "bootstrap_type": "Bernoulli", "subsample": 0.85, "random_strength": 1.0, "early_stopping_rounds": 50, "thread_count": 4, "verbose": 0, "seed": 0}, "data": {"format": "csv", "path": "C:\\Users\\abhir\\clauderesearch\\autoresearch\\generalized_ml_autoresearch\\examples\\fraud_ecommerce\\data\\features_rolling.csv", "target_columns": ["class"], "feature_columns": ["purchase_value", "device_id", "source", "browser", "age", "ip_address", "country", "time_since_signup", "purchase_hour", "purchase_dayofweek", "signup_hour", "device_id_freq", "ip_address_freq", "country_freq", "source_freq", "browser_freq", "device_fraud_rate_train", "country_fraud_rate_train", "device_id_count_1d", "device_id_count_7d", "device_id_count_30d", "ip_address_count_1d", "ip_address_count_7d", "ip_address_count_30d", "device_id_fraud_count_7d"]}, "split": {"name": "holdout", "order": "time", "test_fraction": 0.2, "val_fraction": 0.1, "seed": 0}, "composite": {"higher_is_better": true, "penalty_weight": 0.05, "below_threshold": 0.5}, "description": "CatBoost + ROLLING velocity features", "seed": 0}, "composite": 0.5205393040343824, "val_primary": 0.5205393040343824, "test_primary": 0.5269162776623069, "per_fold_test": [0.5269162776623069], "per_fold_val": [0.5205393040343824], "status": "KEEP", "seconds_elapsed": 1.4738893508911133, "timestamp": "2026-04-24T21:13:07", "secondary_metrics": {"accuracy": 0.9474885844748858, "precision": 0.22191011235955055, "recall": 0.05687544996400288, "f1": 0.09054441260744986, "f2": 0.06681326116373477, "mcc": 0.09173888012648923, "auc_pr": 0.06313512083342897, "log_loss": 0.19503278016609554, "tn": 28556.0, "fp": 277.0, "fn": 1310.0, "tp": 79.0}, "per_fold_test_reports": [{"fold_id": 0, "regime": "holdout", "task_type": "binary_classification", "n": 30222, "accuracy": 0.9474885844748858, "precision": 0.22191011235955055, "recall": 0.05687544996400288, "f1": 0.09054441260744986, "f2": 0.06681326116373477, "mcc": 0.09173888012648923, "auc_roc": 0.5269162776623069, "auc_pr": 0.06313512083342897, "log_loss": 0.19503278016609554, "tn": 28556, "fp": 277, "fn": 1310, "tp": 79}], "composite_fingerprint": "e692f018120592ed"}
{"experiment_num": 30, "backbone": "catboost", "description": "CatBoost rolling, depth=4", "config": {"paths": {"results_dir": "C:\\Users\\abhir\\clauderesearch\\autoresearch\\generalized_ml_autoresearch\\examples\\fraud_ecommerce\\autoresearch_results"}, "task_type": "binary_classification", "primary_metric": "auc_roc", "backbone": "catboost", "backbone_config": {"iterations": 1000, "depth": 4, "learning_rate": 0.04, "l2_leaf_reg": 3.0, "bootstrap_type": "Bernoulli", "subsample": 0.85, "random_strength": 1.0, "early_stopping_rounds": 50, "thread_count": 4, "verbose": 0, "seed": 0}, "data": {"format": "csv", "path": "C:\\Users\\abhir\\clauderesearch\\autoresearch\\generalized_ml_autoresearch\\examples\\fraud_ecommerce\\data\\features_rolling.csv", "target_columns": ["class"], "feature_columns": ["purchase_value", "device_id", "source", "browser", "age", "ip_address", "country", "time_since_signup", "purchase_hour", "purchase_dayofweek", "signup_hour", "device_id_freq", "ip_address_freq", "country_freq", "source_freq", "browser_freq", "device_fraud_rate_train", "country_fraud_rate_train", "device_id_count_1d", "device_id_count_7d", "device_id_count_30d", "ip_address_count_1d", "ip_address_count_7d", "ip_address_count_30d", "device_id_fraud_count_7d"]}, "split": {"name": "holdout", "order": "time", "test_fraction": 0.2, "val_fraction": 0.1, "seed": 0}, "composite": {"higher_is_better": true, "penalty_weight": 0.05, "below_threshold": 0.5}, "description": "CatBoost rolling, depth=4", "seed": 0}, "composite": 0.5171419001174886, "val_primary": 0.5171419001174886, "test_primary": 0.5401253593188771, "per_fold_test": [0.5401253593188771], "per_fold_val": [0.5171419001174886], "status": "KEEP", "seconds_elapsed": 1.2257752418518066, "timestamp": "2026-04-24T21:13:08", "secondary_metrics": {"accuracy": 0.9474885844748858, "precision": 0.22191011235955055, "recall": 0.05687544996400288, "f1": 0.09054441260744986, "f2": 0.06681326116373477, "mcc": 0.09173888012648923, "auc_pr": 0.06465160496616253, "log_loss": 0.19471880703997446, "tn": 28556.0, "fp": 277.0, "fn": 1310.0, "tp": 79.0}, "per_fold_test_reports": [{"fold_id": 0, "regime": "holdout", "task_type": "binary_classification", "n": 30222, "accuracy": 0.9474885844748858, "precision": 0.22191011235955055, "recall": 0.05687544996400288, "f1": 0.09054441260744986, "f2": 0.06681326116373477, "mcc": 0.09173888012648923, "auc_roc": 0.5401253593188771, "auc_pr": 0.06465160496616253, "log_loss": 0.19471880703997446, "tn": 28556, "fp": 277, "fn": 1310, "tp": 79}], "composite_fingerprint": "e692f018120592ed"}
{"experiment_num": 31, "backbone": "catboost", "description": "CatBoost rolling, depth=8", "config": {"paths": {"results_dir": "C:\\Users\\abhir\\clauderesearch\\autoresearch\\generalized_ml_autoresearch\\examples\\fraud_ecommerce\\autoresearch_results"}, "task_type": "binary_classification", "primary_metric": "auc_roc", "backbone": "catboost", "backbone_config": {"iterations": 1000, "depth": 8, "learning_rate": 0.04, "l2_leaf_reg": 3.0, "bootstrap_type": "Bernoulli", "subsample": 0.85, "random_strength": 1.0, "early_stopping_rounds": 50, "thread_count": 4, "verbose": 0, "seed": 0}, "data": {"format": "csv", "path": "C:\\Users\\abhir\\clauderesearch\\autoresearch\\generalized_ml_autoresearch\\examples\\fraud_ecommerce\\data\\features_rolling.csv", "target_columns": ["class"], "feature_columns": ["purchase_value", "device_id", "source", "browser", "age", "ip_address", "country", "time_since_signup", "purchase_hour", "purchase_dayofweek", "signup_hour", "device_id_freq", "ip_address_freq", "country_freq", "source_freq", "browser_freq", "device_fraud_rate_train", "country_fraud_rate_train", "device_id_count_1d", "device_id_count_7d", "device_id_count_30d", "ip_address_count_1d", "ip_address_count_7d", "ip_address_count_30d", "device_id_fraud_count_7d"]}, "split": {"name": "holdout", "order": "time", "test_fraction": 0.2, "val_fraction": 0.1, "seed": 0}, "composite": {"higher_is_better": true, "penalty_weight": 0.05, "below_threshold": 0.5}, "description": "CatBoost rolling, depth=8", "seed": 0}, "composite": 0.5347694128076037, "val_primary": 0.5367639632820304, "test_primary": 0.5347694128076037, "per_fold_test": [0.5347694128076037], "per_fold_val": [0.5367639632820304], "status": "KEEP", "seconds_elapsed": 1.5856115818023682, "timestamp": "2026-04-24T21:13:10", "secondary_metrics": {"accuracy": 0.9475878499106611, "precision": 0.21902017291066284, "recall": 0.054715622750179986, "f1": 0.08755760368663594, "f2": 0.06437404709469761, "mcc": 0.08907079634380681, "auc_pr": 0.06694630935770843, "log_loss": 0.1975079847254901, "tn": 28562.0, "fp": 271.0, "fn": 1313.0, "tp": 76.0}, "per_fold_test_reports": [{"fold_id": 0, "regime": "holdout", "task_type": "binary_classification", "n": 30222, "accuracy": 0.9475878499106611, "precision": 0.21902017291066284, "recall": 0.054715622750179986, "f1": 0.08755760368663594, "f2": 0.06437404709469761, "mcc": 0.08907079634380681, "auc_roc": 0.5347694128076037, "auc_pr": 0.06694630935770843, "log_loss": 0.1975079847254901, "tn": 28562, "fp": 271, "fn": 1313, "tp": 76}], "composite_fingerprint": "e692f018120592ed"}
{"experiment_num": 32, "backbone": "catboost", "description": "CatBoost rolling, learning_rate=0.02", "config": {"paths": {"results_dir": "C:\\Users\\abhir\\clauderesearch\\autoresearch\\generalized_ml_autoresearch\\examples\\fraud_ecommerce\\autoresearch_results"}, "task_type": "binary_classification", "primary_metric": "auc_roc", "backbone": "catboost", "backbone_config": {"iterations": 1000, "depth": 6, "learning_rate": 0.02, "l2_leaf_reg": 3.0, "bootstrap_type": "Bernoulli", "subsample": 0.85, "random_strength": 1.0, "early_stopping_rounds": 50, "thread_count": 4, "verbose": 0, "seed": 0}, "data": {"format": "csv", "path": "C:\\Users\\abhir\\clauderesearch\\autoresearch\\generalized_ml_autoresearch\\examples\\fraud_ecommerce\\data\\features_rolling.csv", "target_columns": ["class"], "feature_columns": ["purchase_value", "device_id", "source", "browser", "age", "ip_address", "country", "time_since_signup", "purchase_hour", "purchase_dayofweek", "signup_hour", "device_id_freq", "ip_address_freq", "country_freq", "source_freq", "browser_freq", "device_fraud_rate_train", "country_fraud_rate_train", "device_id_count_1d", "device_id_count_7d", "device_id_count_30d", "ip_address_count_1d", "ip_address_count_7d", "ip_address_count_30d", "device_id_fraud_count_7d"]}, "split": {"name": "holdout", "order": "time", "test_fraction": 0.2, "val_fraction": 0.1, "seed": 0}, "composite": {"higher_is_better": true, "penalty_weight": 0.05, "below_threshold": 0.5}, "description": "CatBoost rolling, learning_rate=0.02", "seed": 0}, "composite": 0.5186162903242842, "val_primary": 0.5323009651065949, "test_primary": 0.5186162903242842, "per_fold_test": [0.5186162903242842], "per_fold_val": [0.5323009651065949], "status": "KEEP", "seconds_elapsed": 1.45404052734375, "timestamp": "2026-04-24T21:13:11", "secondary_metrics": {"accuracy": 0.9475878499106611, "precision": 0.21902017291066284, "recall": 0.054715622750179986, "f1": 0.08755760368663594, "f2": 0.06437404709469761, "mcc": 0.08907079634380681, "auc_pr": 0.06256619743541247, "log_loss": 0.19570325817091067, "tn": 28562.0, "fp": 271.0, "fn": 1313.0, "tp": 76.0}, "per_fold_test_reports": [{"fold_id": 0, "regime": "holdout", "task_type": "binary_classification", "n": 30222, "accuracy": 0.9475878499106611, "precision": 0.21902017291066284, "recall": 0.054715622750179986, "f1": 0.08755760368663594, "f2": 0.06437404709469761, "mcc": 0.08907079634380681, "auc_roc": 0.5186162903242842, "auc_pr": 0.06256619743541247, "log_loss": 0.19570325817091067, "tn": 28562, "fp": 271, "fn": 1313, "tp": 76}], "composite_fingerprint": "e692f018120592ed"}
{"experiment_num": 33, "backbone": "catboost", "description": "CatBoost rolling, learning_rate=0.08", "config": {"paths": {"results_dir": "C:\\Users\\abhir\\clauderesearch\\autoresearch\\generalized_ml_autoresearch\\examples\\fraud_ecommerce\\autoresearch_results"}, "task_type": "binary_classification", "primary_metric": "auc_roc", "backbone": "catboost", "backbone_config": {"iterations": 1000, "depth": 6, "learning_rate": 0.08, "l2_leaf_reg": 3.0, "bootstrap_type": "Bernoulli", "subsample": 0.85, "random_strength": 1.0, "early_stopping_rounds": 50, "thread_count": 4, "verbose": 0, "seed": 0}, "data": {"format": "csv", "path": "C:\\Users\\abhir\\clauderesearch\\autoresearch\\generalized_ml_autoresearch\\examples\\fraud_ecommerce\\data\\features_rolling.csv", "target_columns": ["class"], "feature_columns": ["purchase_value", "device_id", "source", "browser", "age", "ip_address", "country", "time_since_signup", "purchase_hour", "purchase_dayofweek", "signup_hour", "device_id_freq", "ip_address_freq", "country_freq", "source_freq", "browser_freq", "device_fraud_rate_train", "country_fraud_rate_train", "device_id_count_1d", "device_id_count_7d", "device_id_count_30d", "ip_address_count_1d", "ip_address_count_7d", "ip_address_count_30d", "device_id_fraud_count_7d"]}, "split": {"name": "holdout", "order": "time", "test_fraction": 0.2, "val_fraction": 0.1, "seed": 0}, "composite": {"higher_is_better": true, "penalty_weight": 0.05, "below_threshold": 0.5}, "description": "CatBoost rolling, learning_rate=0.08", "seed": 0}, "composite": 0.5214480562915907, "val_primary": 0.5227912194223528, "test_primary": 0.5214480562915907, "per_fold_test": [0.5214480562915907], "per_fold_val": [0.5227912194223528], "status": "KEEP", "seconds_elapsed": 1.2842130661010742, "timestamp": "2026-04-24T21:13:13", "secondary_metrics": {"accuracy": 0.9475878499106611, "precision": 0.21902017291066284, "recall": 0.054715622750179986, "f1": 0.08755760368663594, "f2": 0.06437404709469761, "mcc": 0.08907079634380681, "auc_pr": 0.06589804918820168, "log_loss": 0.1978860871581717, "tn": 28562.0, "fp": 271.0, "fn": 1313.0, "tp": 76.0}, "per_fold_test_reports": [{"fold_id": 0, "regime": "holdout", "task_type": "binary_classification", "n": 30222, "accuracy": 0.9475878499106611, "precision": 0.21902017291066284, "recall": 0.054715622750179986, "f1": 0.08755760368663594, "f2": 0.06437404709469761, "mcc": 0.08907079634380681, "auc_roc": 0.5214480562915907, "auc_pr": 0.06589804918820168, "log_loss": 0.1978860871581717, "tn": 28562, "fp": 271, "fn": 1313, "tp": 76}], "composite_fingerprint": "e692f018120592ed"}
