{"experiment_num": 42, "backbone": "xgboost", "description": "variance check seed=99", "config": {"paths": {"results_dir": "C:\\Users\\abhir\\clauderesearch\\autoresearch\\generalized_ml_autoresearch\\examples\\fraud_ecommerce\\autoresearch_results"}, "task_type": "binary_classification", "primary_metric": "auc_roc", "backbone": "xgboost", "backbone_config": {"n_estimators": 600, "max_depth": 6, "learning_rate": 0.05, "subsample": 0.85, "colsample_bytree": 0.85, "reg_lambda": 1.0, "min_child_weight": 5, "early_stopping_rounds": 40, "n_jobs": 4, "seed": 99}, "data": {"format": "csv", "path": "C:\\Users\\abhir\\clauderesearch\\autoresearch\\generalized_ml_autoresearch\\examples\\fraud_ecommerce\\data\\features_rolling.csv", "target_columns": ["class"], "feature_columns": ["purchase_value", "device_id", "source", "browser", "age", "ip_address", "country", "time_since_signup", "purchase_hour", "purchase_dayofweek", "signup_hour", "device_id_freq", "ip_address_freq", "country_freq", "source_freq", "browser_freq", "device_fraud_rate_train", "country_fraud_rate_train", "device_id_count_1d", "device_id_count_7d", "device_id_count_30d", "ip_address_count_1d", "ip_address_count_7d", "ip_address_count_30d", "device_id_fraud_count_7d"]}, "split": {"name": "holdout", "order": "time", "test_fraction": 0.2, "val_fraction": 0.1, "seed": 0}, "composite": {"higher_is_better": true, "penalty_weight": 0.05, "below_threshold": 0.5}, "description": "variance check seed=99", "seed": 99}, "composite": 0.5385648848435481, "val_primary": 0.5529089812493865, "test_primary": 0.5385648848435481, "per_fold_test": [0.5385648848435481], "per_fold_val": [0.5529089812493865], "status": "KEEP", "seconds_elapsed": 1.3541557788848877, "timestamp": "2026-04-24T21:13:25", "secondary_metrics": {"accuracy": 0.9475878499106611, "precision": 0.21902017291066284, "recall": 0.054715622750179986, "f1": 0.08755760368663594, "f2": 0.06437404709469761, "mcc": 0.08907079634380681, "auc_pr": 0.06499333823687192, "log_loss": 0.1876425808116778, "tn": 28562.0, "fp": 271.0, "fn": 1313.0, "tp": 76.0}, "per_fold_test_reports": [{"fold_id": 0, "regime": "holdout", "task_type": "binary_classification", "n": 30222, "accuracy": 0.9475878499106611, "precision": 0.21902017291066284, "recall": 0.054715622750179986, "f1": 0.08755760368663594, "f2": 0.06437404709469761, "mcc": 0.08907079634380681, "auc_roc": 0.5385648848435481, "auc_pr": 0.06499333823687192, "log_loss": 0.1876425808116778, "tn": 28562, "fp": 271, "fn": 1313, "tp": 76}], "composite_fingerprint": "e692f018120592ed"}
{"experiment_num": 43, "backbone": "xgboost", "description": "Exp 43 STRICT \u2014 XGBoost + scale_pos_weight=8 (Pozzolo 2015 rare-events correction)", "config": {"paths": {"results_dir": "C:/Users/abhir/clauderesearch/autoresearch/generalized_ml_autoresearch/examples/fraud_ecommerce/autoresearch_results"}, "task_type": "binary_classification", "primary_metric": "auc_roc", "backbone": "xgboost", "backbone_config": {"n_estimators": 600, "max_depth": 6, "learning_rate": 0.05, "subsample": 0.85, "colsample_bytree": 0.85, "reg_lambda": 1.0, "min_child_weight": 5, "scale_pos_weight": 8.0, "seed": 0, "early_stopping_rounds": 40, "n_jobs": 4}, "data": {"format": "csv", "path": "C:/Users/abhir/clauderesearch/autoresearch/generalized_ml_autoresearch/examples/fraud_ecommerce/data/features_velocity.csv", "target_columns": ["class"], "feature_columns": ["purchase_value", "device_id", "source", "browser", "age", "ip_address", "country", "time_since_signup", "purchase_hour", "purchase_dayofweek", "signup_hour", "device_id_freq", "ip_address_freq", "country_freq", "source_freq", "browser_freq", "device_fraud_rate_train", "country_fraud_rate_train"]}, "split": {"name": "holdout", "order": "time", "test_fraction": 0.2, "val_fraction": 0.1, "seed": 0}, "composite": {"higher_is_better": true, "penalty_weight": 0.05, "below_threshold": 0.5}, "description": "Exp 43 STRICT \u2014 XGBoost + scale_pos_weight=8 (Pozzolo 2015 rare-events correction)", "seed": 0}, "composite": 0.5403087086272655, "val_primary": 0.5403087086272655, "test_primary": 0.5414329063642654, "per_fold_test": [0.5414329063642654], "per_fold_val": [0.5403087086272655], "status": "DISCARD", "seconds_elapsed": 0.8492565155029297, "timestamp": "2026-04-24T21:16:24", "secondary_metrics": {"accuracy": 0.9475878499106611, "precision": 0.21902017291066284, "recall": 0.054715622750179986, "f1": 0.08755760368663594, "f2": 0.06437404709469761, "mcc": 0.08907079634380681, "auc_pr": 0.06533134749579153, "log_loss": 0.18747288308989782, "tn": 28562.0, "fp": 271.0, "fn": 1313.0, "tp": 76.0}, "per_fold_test_reports": [{"fold_id": 0, "regime": "holdout", "task_type": "binary_classification", "n": 30222, "accuracy": 0.9475878499106611, "precision": 0.21902017291066284, "recall": 0.054715622750179986, "f1": 0.08755760368663594, "f2": 0.06437404709469761, "mcc": 0.08907079634380681, "auc_roc": 0.5414329063642654, "auc_pr": 0.06533134749579153, "log_loss": 0.18747288308989782, "tn": 28562, "fp": 271, "fn": 1313, "tp": 76}], "composite_fingerprint": "e692f018120592ed"}
{"experiment_num": 44, "backbone": "xgboost", "description": "Exp 44 STRICT \u2014 framework-patched, scale_pos_weight=8 actually applied", "config": {"paths": {"results_dir": "C:/Users/abhir/clauderesearch/autoresearch/generalized_ml_autoresearch/examples/fraud_ecommerce/autoresearch_results"}, "task_type": "binary_classification", "primary_metric": "auc_roc", "backbone": "xgboost", "backbone_config": {"n_estimators": 600, "max_depth": 6, "learning_rate": 0.05, "subsample": 0.85, "colsample_bytree": 0.85, "reg_lambda": 1.0, "min_child_weight": 5, "scale_pos_weight": 8.0, "seed": 0, "early_stopping_rounds": 40, "n_jobs": 4}, "data": {"format": "csv", "path": "C:/Users/abhir/clauderesearch/autoresearch/generalized_ml_autoresearch/examples/fraud_ecommerce/data/features_velocity.csv", "target_columns": ["class"], "feature_columns": ["purchase_value", "device_id", "source", "browser", "age", "ip_address", "country", "time_since_signup", "purchase_hour", "purchase_dayofweek", "signup_hour", "device_id_freq", "ip_address_freq", "country_freq", "source_freq", "browser_freq", "device_fraud_rate_train", "country_fraud_rate_train"]}, "split": {"name": "holdout", "order": "time", "test_fraction": 0.2, "val_fraction": 0.1, "seed": 0}, "composite": {"higher_is_better": true, "penalty_weight": 0.05, "below_threshold": 0.5}, "description": "Exp 44 STRICT \u2014 framework-patched, scale_pos_weight=8 actually applied", "seed": 0}, "composite": 0.5273209057854785, "val_primary": 0.5273209057854785, "test_primary": 0.5436471793316777, "per_fold_test": [0.5436471793316777], "per_fold_val": [0.5273209057854785], "status": "DISCARD", "seconds_elapsed": 1.0310077667236328, "timestamp": "2026-04-24T21:17:41", "secondary_metrics": {"accuracy": 0.947323142081927, "precision": 0.21727019498607242, "recall": 0.056155507559395246, "f1": 0.08924485125858124, "f2": 0.06593406593406594, "mcc": 0.08969973100388398, "auc_pr": 0.06848384685027485, "log_loss": 0.2028278025595472, "tn": 28552.0, "fp": 281.0, "fn": 1311.0, "tp": 78.0}, "per_fold_test_reports": [{"fold_id": 0, "regime": "holdout", "task_type": "binary_classification", "n": 30222, "accuracy": 0.947323142081927, "precision": 0.21727019498607242, "recall": 0.056155507559395246, "f1": 0.08924485125858124, "f2": 0.06593406593406594, "mcc": 0.08969973100388398, "auc_roc": 0.5436471793316777, "auc_pr": 0.06848384685027485, "log_loss": 0.2028278025595472, "tn": 28552, "fp": 281, "fn": 1311, "tp": 78}], "composite_fingerprint": "e692f018120592ed"}
