{"experiment_num": 33, "backbone": "lstm", "description": "LSTM @ exp 8 baseline wd=1e-3 (up from 7e-4) - Loshchilov 2019 ICLR log-spaced AdamW WD step", "config": {"seq_len": 10, "lr": 0.001, "batch_size": 16, "epochs": 100, "weight_decay": 0.001, "patience": 15, "warmup_epochs": 0, "head_dropout": 0.1, "huber_delta": 1.0, "grad_clip": 1.0, "seed": 0, "hidden_size": null, "num_layers": null, "max_depth": null, "gbm_lr": null, "n_estimators": null}, "composite": -0.2055, "test_pos_folds": 5, "val_pos_folds": 2, "val_loss": -2.8872977991731332, "elapsed_sec": 74.9, "timestamp": "2026-04-27T18:31:40", "sharpe": 0.6091, "val_sharpe": -0.0055, "ic": 0.0139, "hit": 50.53, "psr": 0.9274, "equity": 2054.3, "return_pct": 105.43, "bh_sharpe": 0.6042, "bh_return_pct": 103.49, "excess_sharpe": 0.0048, "B_sharpe": 0.1558, "B_excess_sharpe": -1.545, "B_return_pct": -27.45, "D_sharpe": 0.6091, "D_excess_sharpe": 0.0048, "D_return_pct": 105.43, "per_window": [{"fold": "fold_1", "regime": "GFC peak crash (Lehman + Mar-2009 bottom)", "n": 115, "A_sharpe": 1.5846, "A_sortino": 1.7113, "A_excess_sharpe": 2.0287, "A_return_pct": 34.96, "A_hit_rate": 53.04, "A_n": 115, "A_bh_sharpe": -0.4441, "A_bh_return_pct": -14.4, "A_psr": 0.8587, "A_ic": 0.0888, "B_sharpe": 3.5443, "B_sortino": 4.5767, "B_excess_sharpe": 3.8422, "B_return_pct": 252.84, "B_hit_rate": 53.51, "B_n": 115, "B_bh_sharpe": -0.2978, "B_bh_return_pct": -27.23, "B_psr": 0.9939, "B_ic": 0.1827, "D_sharpe": 1.5846, "D_sortino": 1.7113, "D_excess_sharpe": 2.0287, "D_return_pct": 34.96, "D_hit_rate": 53.04, "D_n": 115, "D_bh_sharpe": -0.4441, "D_bh_return_pct": -14.4, "D_psr": 0.8587, "D_ic": 0.0888, "sharpe": 1.5846, "sortino": 1.7113, "return_pct": 34.96, "equity": 1349.6000000000001, "max_dd": 0.0, "win_rate": 53.04, "profit_factor": 0.0, "ic": 0.0888, "hit": 53.04, "psr": 0.8587, "bh_sharpe": -0.4441, "bh_return_pct": -14.4, "excess_sharpe": 2.0287, "precision": 0.5, "recall": 0.6296, "f1": 0.5574, "f2": 0.5986, "accuracy": 0.5304, "mcc": 0.0734, "tp": 34, "fp": 34, "tn": 27, "fn": 20, "A_precision": 0.5, "A_recall": 0.6296, "A_f1": 0.5574, "A_f2": 0.5986, "A_accuracy": 0.5304, "A_mcc": 0.0734, "A_tp": 34, "A_fp": 34, "A_tn": 27, "A_fn": 20}, {"fold": "fold_2", "regime": "2011 US-downgrade + EU debt", "n": 136, "A_sharpe": 0.7658, "A_sortino": 0.8754, "A_excess_sharpe": -0.9669, "A_return_pct": 7.65, "A_hit_rate": 45.93, "A_n": 136, "A_bh_sharpe": 1.7327, "A_bh_return_pct": 19.75, "A_psr": 0.714, "A_ic": 0.0197, "B_sharpe": 0.7053, "B_sortino": 0.8059, "B_excess_sharpe": -3.3606, "B_return_pct": 12.48, "B_hit_rate": 47.06, "B_n": 136, "B_bh_sharpe": 4.0659, "B_bh_return_pct": 148.68, "B_psr": 0.6988, "B_ic": 0.0818, "D_sharpe": 0.7658, "D_sortino": 0.8754, "D_excess_sharpe": -0.9669, "D_return_pct": 7.65, "D_hit_rate": 45.93, "D_n": 136, "D_bh_sharpe": 1.7327, "D_bh_return_pct": 19.75, "D_psr": 0.714, "D_ic": 0.0197, "sharpe": 0.7658, "sortino": 0.8754, "return_pct": 7.65, "equity": 1076.5, "max_dd": 0.0, "win_rate": 45.93, "profit_factor": 0.0, "ic": 0.0197, "hit": 45.93, "psr": 0.714, "bh_sharpe": 1.7327, "bh_return_pct": 19.75, "excess_sharpe": -0.9669, "precision": 0.541, "recall": 0.4231, "f1": 0.4748, "f2": 0.4424, "accuracy": 0.4632, "mcc": -0.0593, "tp": 33, "fp": 28, "tn": 30, "fn": 45, "A_precision": 0.541, "A_recall": 0.4231, "A_f1": 0.4748, "A_f2": 0.4424, "A_accuracy": 0.4632, "A_mcc": -0.0593, "A_tp": 33, "A_fp": 28, "A_tn": 30, "A_fn": 45}, {"fold": "fold_3", "regime": "Taper tantrum and 2014 H1", "n": 178, "A_sharpe": 0.8934, "A_sortino": 0.8899, "A_excess_sharpe": -0.4511, "A_return_pct": 7.89, "A_hit_rate": 53.67, "A_n": 178, "A_bh_sharpe": 1.3445, "A_bh_return_pct": 12.41, "A_psr": 0.7729, "A_ic": 0.0889, "B_sharpe": -1.0595, "B_sortino": -1.0714, "B_excess_sharpe": -4.1078, "B_return_pct": -20.19, "B_hit_rate": 44.38, "B_n": 178, "B_bh_sharpe": 3.0483, "B_bh_return_pct": 71.83, "B_psr": 0.1873, "B_ic": -0.0031, "D_sharpe": 0.8934, "D_sortino": 0.8899, "D_excess_sharpe": -0.4511, "D_return_pct": 7.89, "D_hit_rate": 53.67, "D_n": 178, "D_bh_sharpe": 1.3445, "D_bh_return_pct": 12.41, "D_psr": 0.7729, "D_ic": 0.0889, "sharpe": 0.8934, "sortino": 0.8899, "return_pct": 7.89, "equity": 1078.8999999999999, "max_dd": 0.0, "win_rate": 53.67, "profit_factor": 0.0, "ic": 0.0889, "hit": 53.67, "psr": 0.7729, "bh_sharpe": 1.3445, "bh_return_pct": 12.41, "excess_sharpe": -0.4511, "precision": 0.6235, "recall": 0.5146, "f1": 0.5638, "f2": 0.5332, "accuracy": 0.5393, "mcc": 0.0869, "tp": 53, "fp": 32, "tn": 43, "fn": 50, "A_precision": 0.6235, "A_recall": 0.5146, "A_f1": 0.5638, "A_f2": 0.5332, "A_accuracy": 0.5393, "A_mcc": 0.0869, "A_tp": 53, "A_fp": 32, "A_tn": 43, "A_fn": 50}, {"fold": "fold_4", "regime": "China devaluation and oil crash", "n": 157, "A_sharpe": 1.6279, "A_sortino": 1.6725, "A_excess_sharpe": 1.6181, "A_return_pct": 20.22, "A_hit_rate": 52.56, "A_n": 157, "A_bh_sharpe": 0.0098, "A_bh_return_pct": -1.05, "A_psr": 0.8974, "A_ic": 0.0806, "B_sharpe": 0.9596, "B_sortino": 1.0782, "B_excess_sharpe": 0.9437, "B_return_pct": 22.46, "B_hit_rate": 48.41, "B_n": 157, "B_bh_sharpe": 0.0159, "B_bh_return_pct": -5.48, "B_psr": 0.7772, "B_ic": 0.1225, "D_sharpe": 1.6279, "D_sortino": 1.6725, "D_excess_sharpe": 1.6181, "D_return_pct": 20.22, "D_hit_rate": 52.56, "D_n": 157, "D_bh_sharpe": 0.0098, "D_bh_return_pct": -1.05, "D_psr": 0.8974, "D_ic": 0.0806, "sharpe": 1.6279, "sortino": 1.6725, "return_pct": 20.22, "equity": 1202.2, "max_dd": 0.0, "win_rate": 52.56, "profit_factor": 0.0, "ic": 0.0806, "hit": 52.56, "psr": 0.8974, "bh_sharpe": 0.0098, "bh_return_pct": -1.05, "excess_sharpe": 1.6181, "precision": 0.5441, "recall": 0.4568, "f1": 0.4966, "f2": 0.4719, "accuracy": 0.5223, "mcc": 0.0493, "tp": 37, "fp": 31, "tn": 45, "fn": 44, "A_precision": 0.5441, "A_recall": 0.4568, "A_f1": 0.4966, "A_f2": 0.4719, "A_accuracy": 0.5223, "A_mcc": 0.0493, "A_tp": 37, "A_fp": 31, "A_tn": 45, "A_fn": 44}, {"fold": "fold_5", "regime": "2018 Vol-mageddon + Q4 sell-off", "n": 177, "A_sharpe": -0.1779, "A_sortino": -0.1818, "A_excess_sharpe": -0.4876, "A_return_pct": -4.62, "A_hit_rate": 50.85, "A_n": 177, "A_bh_sharpe": 0.3098, "A_bh_return_pct": 3.19, "A_psr": 0.441, "A_ic": 0.0003, "B_sharpe": -0.651, "B_sortino": -0.7287, "B_excess_sharpe": -1.5427, "B_return_pct": -24.94, "B_hit_rate": 42.61, "B_n": 177, "B_bh_sharpe": 0.8917, "B_bh_return_pct": 23.8, "B_psr": 0.295, "B_ic": -0.0004, "D_sharpe": -0.1779, "D_sortino": -0.1818, "D_excess_sharpe": -0.4876, "D_return_pct": -4.62, "D_hit_rate": 50.85, "D_n": 177, "D_bh_sharpe": 0.3098, "D_bh_return_pct": 3.19, "D_psr": 0.441, "D_ic": 0.0003, "sharpe": -0.1779, "sortino": -0.1818, "return_pct": -4.62, "equity": 953.8, "max_dd": 0.0, "win_rate": 50.85, "profit_factor": 0.0, "ic": 0.0003, "hit": 50.85, "psr": 0.441, "bh_sharpe": 0.3098, "bh_return_pct": 3.19, "excess_sharpe": -0.4876, "precision": 0.5976, "recall": 0.4757, "f1": 0.5297, "f2": 0.496, "accuracy": 0.5085, "mcc": 0.0295, "tp": 49, "fp": 33, "tn": 41, "fn": 54, "A_precision": 0.5976, "A_recall": 0.4757, "A_f1": 0.5297, "A_f2": 0.496, "A_accuracy": 0.5085, "A_mcc": 0.0295, "A_tp": 49, "A_fp": 33, "A_tn": 41, "A_fn": 54}, {"fold": "fold_6", "regime": "COVID crash and V-recovery", "n": 222, "A_sharpe": 0.7378, "A_sortino": 0.8178, "A_excess_sharpe": -0.151, "A_return_pct": 20.12, "A_hit_rate": 49.1, "A_n": 222, "A_bh_sharpe": 0.8888, "A_bh_return_pct": 26.13, "A_psr": 0.7578, "A_ic": 0.0095, "B_sharpe": -1.7073, "B_sortino": -1.8789, "B_excess_sharpe": -4.0958, "B_return_pct": -71.56, "B_hit_rate": 40.27, "B_n": 222, "B_bh_sharpe": 2.3884, "B_bh_return_pct": 243.18, "B_psr": 0.0621, "B_ic": -0.0588, "D_sharpe": 0.7378, "D_sortino": 0.8178, "D_excess_sharpe": -0.151, "D_return_pct": 20.12, "D_hit_rate": 49.1, "D_n": 222, "D_bh_sharpe": 0.8888, "D_bh_return_pct": 26.13, "D_psr": 0.7578, "D_ic": 0.0095, "sharpe": 0.7378, "sortino": 0.8178, "return_pct": 20.12, "equity": 1201.2, "max_dd": 0.0, "win_rate": 49.1, "profit_factor": 0.0, "ic": 0.0095, "hit": 49.1, "psr": 0.7578, "bh_sharpe": 0.8888, "bh_return_pct": 26.13, "excess_sharpe": -0.151, "precision": 0.6667, "recall": 0.3623, "f1": 0.4695, "f2": 0.3987, "accuracy": 0.491, "mcc": 0.0663, "tp": 50, "fp": 25, "tn": 59, "fn": 88, "A_precision": 0.6667, "A_recall": 0.3623, "A_f1": 0.4695, "A_f2": 0.3987, "A_accuracy": 0.491, "A_mcc": 0.0663, "A_tp": 50, "A_fp": 25, "A_tn": 59, "A_fn": 88}, {"fold": "fold_7", "regime": "Inflation bear, AI rally and 2025", "n": 425, "A_sharpe": -0.0277, "A_sortino": -0.0294, "A_excess_sharpe": -0.9992, "A_return_pct": -4.84, "A_hit_rate": 49.88, "A_n": 425, "A_bh_sharpe": 0.9715, "A_bh_return_pct": 37.12, "A_psr": 0.4857, "A_ic": -0.014, "B_sharpe": 0.0529, "B_sortino": 0.0576, "B_excess_sharpe": -2.4498, "B_return_pct": -12.4, "B_hit_rate": 46.93, "B_n": 425, "B_bh_sharpe": 2.5027, "B_bh_return_pct": 458.83, "B_psr": 0.5274, "B_ic": 0.0019, "D_sharpe": -0.0277, "D_sortino": -0.0294, "D_excess_sharpe": -0.9992, "D_return_pct": -4.84, "D_hit_rate": 49.88, "D_n": 425, "D_bh_sharpe": 0.9715, "D_bh_return_pct": 37.12, "D_psr": 0.4857, "D_ic": -0.014, "sharpe": -0.0277, "sortino": -0.0294, "return_pct": -4.84, "equity": 951.6, "max_dd": 0.0, "win_rate": 49.88, "profit_factor": 0.0, "ic": -0.014, "hit": 49.88, "psr": 0.4857, "bh_sharpe": 0.9715, "bh_return_pct": 37.12, "excess_sharpe": -0.9992, "precision": 0.5902, "recall": 0.484, "f1": 0.5319, "f2": 0.5021, "accuracy": 0.4988, "mcc": 0.0039, "tp": 121, "fp": 84, "tn": 91, "fn": 129, "A_precision": 0.5902, "A_recall": 0.484, "A_f1": 0.5319, "A_f2": 0.5021, "A_accuracy": 0.4988, "A_mcc": 0.0039, "A_tp": 121, "A_fp": 84, "A_tn": 91, "A_fn": 129}], "per_window_val": [{"fold": "fold_1", "regime": "GFC peak crash (Lehman + Mar-2009 bottom)", "n": 104, "A_sharpe": 1.9186, "A_sortino": 2.0025, "A_excess_sharpe": 2.0858, "A_return_pct": 24.01, "A_hit_rate": 57.84, "A_n": 104, "A_bh_sharpe": -0.1672, "A_bh_return_pct": -3.81, "A_psr": 0.8963, "A_ic": 0.2194, "B_sharpe": -0.1584, "B_sortino": -0.1863, "B_excess_sharpe": 2.1157, "B_return_pct": -9.43, "B_hit_rate": 42.72, "B_n": 104, "B_bh_sharpe": -2.2741, "B_bh_return_pct": -44.12, "B_psr": 0.4598, "B_ic": -0.1878, "D_sharpe": 1.9186, "D_sortino": 2.0025, "D_excess_sharpe": 2.0858, "D_return_pct": 24.01, "D_hit_rate": 57.84, "D_n": 104, "D_bh_sharpe": -0.1672, "D_bh_return_pct": -3.81, "D_psr": 0.8963, "D_ic": 0.2194, "sharpe": 1.9186, "sortino": 2.0025, "return_pct": 24.01, "equity": 1240.1, "max_dd": 0.0, "win_rate": 57.84, "profit_factor": 0.0, "ic": 0.2194, "hit": 57.84, "psr": 0.8963, "bh_sharpe": -0.1672, "bh_return_pct": -3.81, "excess_sharpe": 2.0858}, {"fold": "fold_2", "regime": "2011 US-downgrade + EU debt", "n": 96, "A_sharpe": 1.1808, "A_sortino": 1.226, "A_excess_sharpe": 1.455, "A_return_pct": 11.25, "A_hit_rate": 51.58, "A_n": 96, "A_bh_sharpe": -0.2741, "A_bh_return_pct": -4.09, "A_psr": 0.7638, "A_ic": 0.0984, "B_sharpe": 2.2575, "B_sortino": 2.3993, "B_excess_sharpe": 3.2849, "B_return_pct": 54.35, "B_hit_rate": 56.25, "B_n": 96, "B_bh_sharpe": -1.0274, "B_bh_return_pct": -25.58, "B_psr": 0.919, "B_ic": 0.1648, "D_sharpe": 1.1808, "D_sortino": 1.226, "D_excess_sharpe": 1.455, "D_return_pct": 11.25, "D_hit_rate": 51.58, "D_n": 96, "D_bh_sharpe": -0.2741, "D_bh_return_pct": -4.09, "D_psr": 0.7638, "D_ic": 0.0984, "sharpe": 1.1808, "sortino": 1.226, "return_pct": 11.25, "equity": 1112.5, "max_dd": 0.0, "win_rate": 51.58, "profit_factor": 0.0, "ic": 0.0984, "hit": 51.58, "psr": 0.7638, "bh_sharpe": -0.2741, "bh_return_pct": -4.09, "excess_sharpe": 1.455}, {"fold": "fold_3", "regime": "Taper tantrum and 2014 H1", "n": 54, "A_sharpe": -1.7493, "A_sortino": -1.8223, "A_excess_sharpe": -6.4491, "A_return_pct": -3.92, "A_hit_rate": 35.19, "A_n": 54, "A_bh_sharpe": 4.6998, "A_bh_return_pct": 10.46, "A_psr": 0.2086, "A_ic": -0.0582, "B_sharpe": -0.5743, "B_sortino": -0.5723, "B_excess_sharpe": -9.6069, "B_return_pct": -3.53, "B_hit_rate": 48.15, "B_n": 54, "B_bh_sharpe": 9.0326, "B_bh_return_pct": 49.18, "B_psr": 0.3962, "B_ic": 0.0956, "D_sharpe": -1.7493, "D_sortino": -1.8223, "D_excess_sharpe": -6.4491, "D_return_pct": -3.92, "D_hit_rate": 35.19, "D_n": 54, "D_bh_sharpe": 4.6998, "D_bh_return_pct": 10.46, "D_psr": 0.2086, "D_ic": -0.0582, "sharpe": -1.7493, "sortino": -1.8223, "return_pct": -3.92, "equity": 960.8, "max_dd": 0.0, "win_rate": 35.19, "profit_factor": 0.0, "ic": -0.0582, "hit": 35.19, "psr": 0.2086, "bh_sharpe": 4.6998, "bh_return_pct": 10.46, "excess_sharpe": -6.4491}, {"fold": "fold_4", "regime": "China devaluation and oil crash", "n": 96, "A_sharpe": -0.6273, "A_sortino": -0.6078, "A_excess_sharpe": -0.2032, "A_return_pct": -5.15, "A_hit_rate": 49.47, "A_n": 96, "A_bh_sharpe": -0.4241, "A_bh_return_pct": -3.73, "A_psr": 0.3502, "A_ic": -0.0705, "B_sharpe": 1.5371, "B_sortino": 2.247, "B_excess_sharpe": 2.7214, "B_return_pct": 25.14, "B_hit_rate": 47.92, "B_n": 96, "B_bh_sharpe": -1.1843, "B_bh_return_pct": -21.44, "B_psr": 0.8484, "B_ic": -0.0144, "D_sharpe": -0.6273, "D_sortino": -0.6078, "D_excess_sharpe": -0.2032, "D_return_pct": -5.15, "D_hit_rate": 49.47, "D_n": 96, "D_bh_sharpe": -0.4241, "D_bh_return_pct": -3.73, "D_psr": 0.3502, "D_ic": -0.0705, "sharpe": -0.6273, "sortino": -0.6078, "return_pct": -5.15, "equity": 948.5, "max_dd": 0.0, "win_rate": 49.47, "profit_factor": 0.0, "ic": -0.0705, "hit": 49.47, "psr": 0.3502, "bh_sharpe": -0.4241, "bh_return_pct": -3.73, "excess_sharpe": -0.2032}, {"fold": "fold_5", "regime": "2018 Vol-mageddon + Q4 sell-off", "n": 54, "A_sharpe": -4.0631, "A_sortino": -3.465, "A_excess_sharpe": -5.4911, "A_return_pct": -10.86, "A_hit_rate": 42.59, "A_n": 54, "A_bh_sharpe": 1.428, "A_bh_return_pct": 3.97, "A_psr": 0.0259, "A_ic": -0.2411, "B_sharpe": -2.8652, "B_sortino": -2.6301, "B_excess_sharpe": -7.7974, "B_return_pct": -17.76, "B_hit_rate": 44.44, "B_n": 54, "B_bh_sharpe": 4.9322, "B_bh_return_pct": 34.93, "B_psr": 0.0961, "B_ic": -0.3478, "D_sharpe": -4.0631, "D_sortino": -3.465, "D_excess_sharpe": -5.4911, "D_return_pct": -10.86, "D_hit_rate": 42.59, "D_n": 54, "D_bh_sharpe": 1.428, "D_bh_return_pct": 3.97, "D_psr": 0.0259, "D_ic": -0.2411, "sharpe": -4.0631, "sortino": -3.465, "return_pct": -10.86, "equity": 891.4, "max_dd": 0.0, "win_rate": 42.59, "profit_factor": 0.0, "ic": -0.2411, "hit": 42.59, "psr": 0.0259, "bh_sharpe": 1.428, "bh_return_pct": 3.97, "excess_sharpe": -5.4911}, {"fold": "fold_6", "regime": "COVID crash and V-recovery", "n": 75, "A_sharpe": -0.9794, "A_sortino": -0.9764, "A_excess_sharpe": -5.2789, "A_return_pct": -3.4, "A_hit_rate": 45.33, "A_n": 75, "A_bh_sharpe": 4.2994, "A_bh_return_pct": 14.68, "A_psr": 0.2974, "A_ic": 0.0413, "B_sharpe": -9.16, "B_sortino": -7.8375, "B_excess_sharpe": -23.4939, "B_return_pct": -45.39, "B_hit_rate": 22.67, "B_n": 75, "B_bh_sharpe": 14.3339, "B_bh_return_pct": 120.13, "B_psr": 0.0, "B_ic": -0.0733, "D_sharpe": -0.9794, "D_sortino": -0.9764, "D_excess_sharpe": -5.2789, "D_return_pct": -3.4, "D_hit_rate": 45.33, "D_n": 75, "D_bh_sharpe": 4.2994, "D_bh_return_pct": 14.68, "D_psr": 0.2974, "D_ic": 0.0413, "sharpe": -0.9794, "sortino": -0.9764, "return_pct": -3.4, "equity": 966.0, "max_dd": 0.0, "win_rate": 45.33, "profit_factor": 0.0, "ic": 0.0413, "hit": 45.33, "psr": 0.2974, "bh_sharpe": 4.2994, "bh_return_pct": 14.68, "excess_sharpe": -5.2789}, {"fold": "fold_7", "regime": "Inflation bear, AI rally and 2025", "n": 114, "A_sharpe": -1.7792, "A_sortino": -1.7022, "A_excess_sharpe": -4.6242, "A_return_pct": -12.3, "A_hit_rate": 45.61, "A_n": 114, "A_bh_sharpe": 2.845, "A_bh_return_pct": 21.34, "A_psr": 0.1172, "A_ic": 0.0399, "B_sharpe": -0.9593, "B_sortino": -1.0531, "B_excess_sharpe": -7.0959, "B_return_pct": -17.57, "B_hit_rate": 43.86, "B_n": 114, "B_bh_sharpe": 6.1366, "B_bh_return_pct": 155.03, "B_psr": 0.2638, "B_ic": -0.1067, "D_sharpe": -1.7792, "D_sortino": -1.7022, "D_excess_sharpe": -4.6242, "D_return_pct": -12.3, "D_hit_rate": 45.61, "D_n": 114, "D_bh_sharpe": 2.845, "D_bh_return_pct": 21.34, "D_psr": 0.1172, "D_ic": 0.0399, "sharpe": -1.7792, "sortino": -1.7022, "return_pct": -12.3, "equity": 877.0, "max_dd": 0.0, "win_rate": 45.61, "profit_factor": 0.0, "ic": 0.0399, "hit": 45.61, "psr": 0.1172, "bh_sharpe": 2.845, "bh_return_pct": 21.34, "excess_sharpe": -4.6242}], "status": "DISCARD", "precision": 0.5854, "recall": 0.4672, "f1": 0.5196, "f2": 0.4868, "accuracy": 0.5057, "mcc": 0.0242, "tp": 377, "fp": 267, "tn": 336, "fn": 430, "test_sharpe": 0.6091, "A_sharpe": 0.6091, "A_excess_sharpe": 0.0048, "A_return_pct": 105.43, "A_precision": 0.5854, "A_recall": 0.4672, "A_f1": 0.5196, "A_f2": 0.4868, "A_accuracy": 0.5057, "A_mcc": 0.0242, "A_tp": 377, "A_fp": 267, "A_tn": 336, "A_fn": 430, "A_psr": 0.9274, "A_ic": 0.0139, "A_hit_rate": 50.53, "A_bh_sharpe": 0.6042, "A_bh_return_pct": 103.49}
