{"experiment_num": 59, "backbone": "mlp", "description": "MLP @ exp 6 bs=64 (up from 32) - Keskar 2017 reverse direction; larger batch stability test", "config": {"seq_len": 10, "lr": 0.0003, "batch_size": 64, "epochs": 50, "weight_decay": 1e-05, "patience": 10, "warmup_epochs": 0, "head_dropout": 0.25, "huber_delta": 1.0, "grad_clip": 1.0, "seed": 0, "hidden_size": null, "num_layers": null, "max_depth": null, "gbm_lr": null, "n_estimators": null}, "composite": -1.5134, "test_pos_folds": 1, "val_pos_folds": 1, "val_loss": -2.8874760900339833, "elapsed_sec": 18.8, "timestamp": "2026-04-27T22:02:20", "sharpe": -0.5178, "val_sharpe": -0.9134, "ic": -0.0025, "hit": 44.99, "psr": 0.1112, "equity": 370.49999999999994, "return_pct": -62.95, "bh_sharpe": 0.6042, "bh_return_pct": 103.49, "excess_sharpe": -1.122, "B_sharpe": -0.0544, "B_excess_sharpe": -1.7552, "B_return_pct": -61.68, "D_sharpe": -0.5178, "D_excess_sharpe": -1.122, "D_return_pct": -62.95, "precision": 0.5559, "recall": 0.2032, "f1": 0.2976, "f2": 0.2328, "mcc": -0.0171, "accuracy": 0.4511, "val_precision": 0.4933, "val_recall": 0.2249, "val_f1": 0.309, "val_f2": 0.2524, "val_mcc": -0.072, "val_accuracy": 0.4418, "per_window": [{"fold": "fold_1", "regime": "GFC peak crash (Lehman + Mar-2009 bottom)", "n": 115, "A_sharpe": -0.2566, "A_sortino": -0.2502, "A_excess_sharpe": 0.1875, "A_return_pct": -10.73, "A_hit_rate": 50.43, "A_n": 115, "A_bh_sharpe": -0.4441, "A_bh_return_pct": -14.4, "A_psr": 0.4314, "A_ic": -0.1153, "A_precision": 0.2857, "A_recall": 0.037, "A_f1": 0.0656, "A_f2": 0.0448, "A_accuracy": 0.5043, "A_mcc": -0.0938, "A_tp": 2, "A_fp": 5, "A_tn": 56, "A_fn": 52, "B_sharpe": 3.0596, "B_sortino": 2.9434, "B_excess_sharpe": 3.3574, "B_return_pct": 190.08, "B_hit_rate": 62.28, "B_n": 115, "B_bh_sharpe": -0.2978, "B_bh_return_pct": -27.23, "B_psr": 0.977, "B_ic": 0.2361, "B_precision": 0.5843, "B_recall": 0.8814, "B_f1": 0.7027, "B_f2": 0.8, "B_accuracy": 0.6174, "B_mcc": 0.2636, "B_tp": 52, "B_fp": 37, "B_tn": 19, "B_fn": 7, "D_sharpe": -0.2566, "D_sortino": -0.2502, "D_excess_sharpe": 0.1875, "D_return_pct": -10.73, "D_hit_rate": 50.43, "D_n": 115, "D_bh_sharpe": -0.4441, "D_bh_return_pct": -14.4, "D_psr": 0.4314, "D_ic": -0.1153, "D_precision": 0.2857, "D_recall": 0.037, "D_f1": 0.0656, "D_f2": 0.0448, "D_accuracy": 0.5043, "D_mcc": -0.0938, "D_tp": 2, "D_fp": 5, "D_tn": 56, "D_fn": 52, "sharpe": -0.2566, "sortino": -0.2502, "return_pct": -10.73, "equity": 892.7, "max_dd": 0.0, "win_rate": 50.43, "profit_factor": 0.0, "ic": -0.1153, "hit": 50.43, "psr": 0.4314, "bh_sharpe": -0.4441, "bh_return_pct": -14.4, "excess_sharpe": 0.1875, "precision": 0.2857, "recall": 0.037, "f1": 0.0656, "f2": 0.0448, "mcc": -0.0938, "accuracy": 0.5043, "tp": 2, "fp": 5, "tn": 56, "fn": 52}, {"fold": "fold_2", "regime": "2011 US-downgrade + EU debt", "n": 136, "A_sharpe": -1.9353, "A_sortino": -1.8443, "A_excess_sharpe": -3.668, "A_return_pct": -20.17, "A_hit_rate": 43.7, "A_n": 136, "A_bh_sharpe": 1.7327, "A_bh_return_pct": 19.75, "A_psr": 0.0769, "A_ic": -0.0115, "A_precision": 0.5312, "A_recall": 0.2179, "A_f1": 0.3091, "A_f2": 0.2471, "A_accuracy": 0.4412, "A_mcc": -0.0474, "A_tp": 17, "A_fp": 15, "A_tn": 43, "A_fn": 61, "B_sharpe": 3.2618, "B_sortino": 3.6591, "B_excess_sharpe": -0.8041, "B_return_pct": 107.26, "B_hit_rate": 56.62, "B_n": 136, "B_bh_sharpe": 4.0659, "B_bh_return_pct": 148.68, "B_psr": 0.9921, "B_ic": 0.2248, "B_precision": 0.8246, "B_recall": 0.4896, "B_f1": 0.6144, "B_f2": 0.5329, "B_accuracy": 0.5662, "B_mcc": 0.2212, "B_tp": 47, "B_fp": 10, "B_tn": 30, "B_fn": 49, "D_sharpe": -1.9353, "D_sortino": -1.8443, "D_excess_sharpe": -3.668, "D_return_pct": -20.17, "D_hit_rate": 43.7, "D_n": 136, "D_bh_sharpe": 1.7327, "D_bh_return_pct": 19.75, "D_psr": 0.0769, "D_ic": -0.0115, "D_precision": 0.5312, "D_recall": 0.2179, "D_f1": 0.3091, "D_f2": 0.2471, "D_accuracy": 0.4412, "D_mcc": -0.0474, "D_tp": 17, "D_fp": 15, "D_tn": 43, "D_fn": 61, "sharpe": -1.9353, "sortino": -1.8443, "return_pct": -20.17, "equity": 798.3, "max_dd": 0.0, "win_rate": 43.7, "profit_factor": 0.0, "ic": -0.0115, "hit": 43.7, "psr": 0.0769, "bh_sharpe": 1.7327, "bh_return_pct": 19.75, "excess_sharpe": -3.668, "precision": 0.5312, "recall": 0.2179, "f1": 0.3091, "f2": 0.2471, "mcc": -0.0474, "accuracy": 0.4412, "tp": 17, "fp": 15, "tn": 43, "fn": 61}, {"fold": "fold_3", "regime": "Taper tantrum and 2014 H1", "n": 178, "A_sharpe": -0.3525, "A_sortino": -0.3772, "A_excess_sharpe": -1.6971, "A_return_pct": -3.76, "A_hit_rate": 46.33, "A_n": 178, "A_bh_sharpe": 1.3445, "A_bh_return_pct": 12.41, "A_psr": 0.3844, "A_ic": 0.043, "A_precision": 0.5952, "A_recall": 0.2427, "A_f1": 0.3448, "A_f2": 0.2753, "A_accuracy": 0.4663, "A_mcc": 0.0187, "A_tp": 25, "A_fp": 17, "A_tn": 58, "A_fn": 78, "B_sharpe": 1.6992, "B_sortino": 2.1232, "B_excess_sharpe": -1.3491, "B_return_pct": 34.26, "B_hit_rate": 46.07, "B_n": 178, "B_bh_sharpe": 3.0483, "B_bh_return_pct": 71.83, "B_psr": 0.9276, "B_ic": 0.2115, "B_precision": 0.6275, "B_recall": 0.2936, "B_f1": 0.4, "B_f2": 0.3285, "B_accuracy": 0.4607, "B_mcc": 0.0196, "B_tp": 32, "B_fp": 19, "B_tn": 50, "B_fn": 77, "D_sharpe": -0.3525, "D_sortino": -0.3772, "D_excess_sharpe": -1.6971, "D_return_pct": -3.76, "D_hit_rate": 46.33, "D_n": 178, "D_bh_sharpe": 1.3445, "D_bh_return_pct": 12.41, "D_psr": 0.3844, "D_ic": 0.043, "D_precision": 0.5952, "D_recall": 0.2427, "D_f1": 0.3448, "D_f2": 0.2753, "D_accuracy": 0.4663, "D_mcc": 0.0187, "D_tp": 25, "D_fp": 17, "D_tn": 58, "D_fn": 78, "sharpe": -0.3525, "sortino": -0.3772, "return_pct": -3.76, "equity": 962.4, "max_dd": 0.0, "win_rate": 46.33, "profit_factor": 0.0, "ic": 0.043, "hit": 46.33, "psr": 0.3844, "bh_sharpe": 1.3445, "bh_return_pct": 12.41, "excess_sharpe": -1.6971, "precision": 0.5952, "recall": 0.2427, "f1": 0.3448, "f2": 0.2753, "mcc": 0.0187, "accuracy": 0.4663, "tp": 25, "fp": 17, "tn": 58, "fn": 78}, {"fold": "fold_4", "regime": "China devaluation and oil crash", "n": 157, "A_sharpe": -0.5473, "A_sortino": -0.5558, "A_excess_sharpe": -0.5571, "A_return_pct": -7.49, "A_hit_rate": 46.79, "A_n": 157, "A_bh_sharpe": 0.0098, "A_bh_return_pct": -1.05, "A_psr": 0.3337, "A_ic": -0.0132, "A_precision": 0.4545, "A_recall": 0.1235, "A_f1": 0.1942, "A_f2": 0.1445, "A_accuracy": 0.4713, "A_mcc": -0.0496, "A_tp": 10, "A_fp": 12, "A_tn": 64, "A_fn": 71, "B_sharpe": -0.2842, "B_sortino": -0.3106, "B_excess_sharpe": -0.3001, "B_return_pct": -12.87, "B_hit_rate": 43.95, "B_n": 157, "B_bh_sharpe": 0.0159, "B_bh_return_pct": -5.48, "B_psr": 0.4117, "B_ic": -0.0672, "B_precision": 0.4694, "B_recall": 0.2706, "B_f1": 0.3433, "B_f2": 0.2956, "B_accuracy": 0.4395, "B_mcc": -0.0973, "B_tp": 23, "B_fp": 26, "B_tn": 46, "B_fn": 62, "D_sharpe": -0.5473, "D_sortino": -0.5558, "D_excess_sharpe": -0.5571, "D_return_pct": -7.49, "D_hit_rate": 46.79, "D_n": 157, "D_bh_sharpe": 0.0098, "D_bh_return_pct": -1.05, "D_psr": 0.3337, "D_ic": -0.0132, "D_precision": 0.4545, "D_recall": 0.1235, "D_f1": 0.1942, "D_f2": 0.1445, "D_accuracy": 0.4713, "D_mcc": -0.0496, "D_tp": 10, "D_fp": 12, "D_tn": 64, "D_fn": 71, "sharpe": -0.5473, "sortino": -0.5558, "return_pct": -7.49, "equity": 925.1, "max_dd": 0.0, "win_rate": 46.79, "profit_factor": 0.0, "ic": -0.0132, "hit": 46.79, "psr": 0.3337, "bh_sharpe": 0.0098, "bh_return_pct": -1.05, "excess_sharpe": -0.5571, "precision": 0.4545, "recall": 0.1235, "f1": 0.1942, "f2": 0.1445, "mcc": -0.0496, "accuracy": 0.4713, "tp": 10, "fp": 12, "tn": 64, "fn": 71}, {"fold": "fold_5", "regime": "2018 Vol-mageddon + Q4 sell-off", "n": 177, "A_sharpe": 0.288, "A_sortino": 0.3089, "A_excess_sharpe": -0.0217, "A_return_pct": 2.83, "A_hit_rate": 44.63, "A_n": 177, "A_bh_sharpe": 0.3098, "A_bh_return_pct": 3.19, "A_psr": 0.595, "A_ic": 0.0349, "A_precision": 0.5714, "A_recall": 0.1942, "A_f1": 0.2899, "A_f2": 0.2237, "A_accuracy": 0.4463, "A_mcc": -0.0106, "A_tp": 20, "A_fp": 15, "A_tn": 59, "A_fn": 83, "B_sharpe": -1.2256, "B_sortino": -1.3412, "B_excess_sharpe": -2.1172, "B_return_pct": -37.7, "B_hit_rate": 39.77, "B_n": 177, "B_bh_sharpe": 0.8917, "B_bh_return_pct": 23.8, "B_psr": 0.1563, "B_ic": -0.1469, "B_precision": 0.5217, "B_recall": 0.3303, "B_f1": 0.4045, "B_f2": 0.3564, "B_accuracy": 0.4011, "B_mcc": -0.1546, "B_tp": 36, "B_fp": 33, "B_tn": 35, "B_fn": 73, "D_sharpe": 0.288, "D_sortino": 0.3089, "D_excess_sharpe": -0.0217, "D_return_pct": 2.83, "D_hit_rate": 44.63, "D_n": 177, "D_bh_sharpe": 0.3098, "D_bh_return_pct": 3.19, "D_psr": 0.595, "D_ic": 0.0349, "D_precision": 0.5714, "D_recall": 0.1942, "D_f1": 0.2899, "D_f2": 0.2237, "D_accuracy": 0.4463, "D_mcc": -0.0106, "D_tp": 20, "D_fp": 15, "D_tn": 59, "D_fn": 83, "sharpe": 0.288, "sortino": 0.3089, "return_pct": 2.83, "equity": 1028.3, "max_dd": 0.0, "win_rate": 44.63, "profit_factor": 0.0, "ic": 0.0349, "hit": 44.63, "psr": 0.595, "bh_sharpe": 0.3098, "bh_return_pct": 3.19, "excess_sharpe": -0.0217, "precision": 0.5714, "recall": 0.1942, "f1": 0.2899, "f2": 0.2237, "mcc": -0.0106, "accuracy": 0.4463, "tp": 20, "fp": 15, "tn": 59, "fn": 83}, {"fold": "fold_6", "regime": "COVID crash and V-recovery", "n": 222, "A_sharpe": -1.0318, "A_sortino": -1.1591, "A_excess_sharpe": -1.9206, "A_return_pct": -33.4, "A_hit_rate": 40.09, "A_n": 222, "A_bh_sharpe": 0.8888, "A_bh_return_pct": 26.13, "A_psr": 0.1737, "A_ic": 0.035, "A_precision": 0.5862, "A_recall": 0.1232, "A_f1": 0.2036, "A_f2": 0.1463, "A_accuracy": 0.4009, "A_mcc": -0.0283, "A_tp": 17, "A_fp": 12, "A_tn": 72, "A_fn": 121, "B_sharpe": -1.1829, "B_sortino": -1.2314, "B_excess_sharpe": -3.5713, "B_return_pct": -60.94, "B_hit_rate": 44.8, "B_n": 222, "B_bh_sharpe": 2.3884, "B_bh_return_pct": 243.18, "B_psr": 0.1378, "B_ic": -0.0023, "B_precision": 0.6531, "B_recall": 0.2336, "B_f1": 0.3441, "B_f2": 0.268, "B_accuracy": 0.4505, "B_mcc": 0.0394, "B_tp": 32, "B_fp": 17, "B_tn": 68, "B_fn": 105, "D_sharpe": -1.0318, "D_sortino": -1.1591, "D_excess_sharpe": -1.9206, "D_return_pct": -33.4, "D_hit_rate": 40.09, "D_n": 222, "D_bh_sharpe": 0.8888, "D_bh_return_pct": 26.13, "D_psr": 0.1737, "D_ic": 0.035, "D_precision": 0.5862, "D_recall": 0.1232, "D_f1": 0.2036, "D_f2": 0.1463, "D_accuracy": 0.4009, "D_mcc": -0.0283, "D_tp": 17, "D_fp": 12, "D_tn": 72, "D_fn": 121, "sharpe": -1.0318, "sortino": -1.1591, "return_pct": -33.4, "equity": 666.0, "max_dd": 0.0, "win_rate": 40.09, "profit_factor": 0.0, "ic": 0.035, "hit": 40.09, "psr": 0.1737, "bh_sharpe": 0.8888, "bh_return_pct": 26.13, "excess_sharpe": -1.9206, "precision": 0.5862, "recall": 0.1232, "f1": 0.2036, "f2": 0.1463, "mcc": -0.0283, "accuracy": 0.4009, "tp": 17, "fp": 12, "tn": 72, "fn": 121}, {"fold": "fold_7", "regime": "Inflation bear, AI rally and 2025", "n": 425, "A_sharpe": -0.3254, "A_sortino": -0.3342, "A_excess_sharpe": -1.2969, "A_return_pct": -14.73, "A_hit_rate": 45.41, "A_n": 425, "A_bh_sharpe": 0.9715, "A_bh_return_pct": 37.12, "A_psr": 0.3354, "A_ic": -0.0147, "A_precision": 0.5703, "A_recall": 0.292, "A_f1": 0.3862, "A_f2": 0.3236, "A_accuracy": 0.4541, "A_mcc": -0.0239, "A_tp": 73, "A_fp": 55, "A_tn": 120, "A_fn": 177, "B_sharpe": -1.7328, "B_sortino": -1.6986, "B_excess_sharpe": -4.2354, "B_return_pct": -77.61, "B_hit_rate": 43.4, "B_n": 425, "B_bh_sharpe": 2.5027, "B_bh_return_pct": 458.83, "B_psr": 0.012, "B_ic": -0.0383, "B_precision": 0.5647, "B_recall": 0.365, "B_f1": 0.4434, "B_f2": 0.3928, "B_accuracy": 0.4329, "B_mcc": -0.091, "B_tp": 96, "B_fp": 74, "B_tn": 88, "B_fn": 167, "D_sharpe": -0.3254, "D_sortino": -0.3342, "D_excess_sharpe": -1.2969, "D_return_pct": -14.73, "D_hit_rate": 45.41, "D_n": 425, "D_bh_sharpe": 0.9715, "D_bh_return_pct": 37.12, "D_psr": 0.3354, "D_ic": -0.0147, "D_precision": 0.5703, "D_recall": 0.292, "D_f1": 0.3862, "D_f2": 0.3236, "D_accuracy": 0.4541, "D_mcc": -0.0239, "D_tp": 73, "D_fp": 55, "D_tn": 120, "D_fn": 177, "sharpe": -0.3254, "sortino": -0.3342, "return_pct": -14.73, "equity": 852.7, "max_dd": 0.0, "win_rate": 45.41, "profit_factor": 0.0, "ic": -0.0147, "hit": 45.41, "psr": 0.3354, "bh_sharpe": 0.9715, "bh_return_pct": 37.12, "excess_sharpe": -1.2969, "precision": 0.5703, "recall": 0.292, "f1": 0.3862, "f2": 0.3236, "mcc": -0.0239, "accuracy": 0.4541, "tp": 73, "fp": 55, "tn": 120, "fn": 177}], "per_window_val": [{"fold": "fold_1", "regime": "GFC peak crash (Lehman + Mar-2009 bottom)", "n": 104, "A_sharpe": 1.0701, "A_sortino": 1.266, "A_excess_sharpe": 1.2374, "A_return_pct": 11.94, "A_hit_rate": 50.98, "A_n": 104, "A_bh_sharpe": -0.1672, "A_bh_return_pct": -3.81, "A_psr": 0.7606, "A_ic": 0.0386, "A_precision": 0.5909, "A_recall": 0.2407, "A_f1": 0.3421, "A_f2": 0.2731, "A_accuracy": 0.5192, "A_mcc": 0.0743, "A_tp": 13, "A_fp": 9, "A_tn": 41, "A_fn": 41, "B_sharpe": -2.9276, "B_sortino": -2.5199, "B_excess_sharpe": -0.6535, "B_return_pct": -51.61, "B_hit_rate": 44.66, "B_n": 104, "B_bh_sharpe": -2.2741, "B_bh_return_pct": -44.12, "B_psr": 0.0235, "B_ic": -0.0334, "B_precision": 0.4603, "B_recall": 0.5577, "B_f1": 0.5043, "B_f2": 0.5351, "B_accuracy": 0.4519, "B_mcc": -0.0984, "B_tp": 29, "B_fp": 34, "B_tn": 18, "B_fn": 23, "D_sharpe": 1.0701, "D_sortino": 1.266, "D_excess_sharpe": 1.2374, "D_return_pct": 11.94, "D_hit_rate": 50.98, "D_n": 104, "D_bh_sharpe": -0.1672, "D_bh_return_pct": -3.81, "D_psr": 0.7606, "D_ic": 0.0386, "D_precision": 0.5909, "D_recall": 0.2407, "D_f1": 0.3421, "D_f2": 0.2731, "D_accuracy": 0.5192, "D_mcc": 0.0743, "D_tp": 13, "D_fp": 9, "D_tn": 41, "D_fn": 41, "sharpe": 1.0701, "sortino": 1.266, "return_pct": 11.94, "equity": 1119.3999999999999, "max_dd": 0.0, "win_rate": 50.98, "profit_factor": 0.0, "ic": 0.0386, "hit": 50.98, "psr": 0.7606, "bh_sharpe": -0.1672, "bh_return_pct": -3.81, "excess_sharpe": 1.2374, "precision": 0.5909, "recall": 0.2407, "f1": 0.3421, "f2": 0.2731, "mcc": 0.0743, "accuracy": 0.5192, "tp": 13, "fp": 9, "tn": 41, "fn": 41}, {"fold": "fold_2", "regime": "2011 US-downgrade + EU debt", "n": 96, "A_sharpe": -1.0869, "A_sortino": -1.2132, "A_excess_sharpe": -0.8128, "A_return_pct": -11.69, "A_hit_rate": 41.05, "A_n": 96, "A_bh_sharpe": -0.2741, "A_bh_return_pct": -4.09, "A_psr": 0.2577, "A_ic": -0.0927, "A_precision": 0.3929, "A_recall": 0.22, "A_f1": 0.2821, "A_f2": 0.2412, "A_accuracy": 0.4167, "A_mcc": -0.1644, "A_tp": 11, "A_fp": 17, "A_tn": 29, "A_fn": 39, "B_sharpe": 2.2428, "B_sortino": 2.6335, "B_excess_sharpe": 3.2702, "B_return_pct": 53.88, "B_hit_rate": 51.04, "B_n": 96, "B_bh_sharpe": -1.0274, "B_bh_return_pct": -25.58, "B_psr": 0.919, "B_ic": 0.2555, "B_precision": 0.4688, "B_recall": 0.6977, "B_f1": 0.5607, "B_f2": 0.6356, "B_accuracy": 0.5104, "B_mcc": 0.0592, "B_tp": 30, "B_fp": 34, "B_tn": 19, "B_fn": 13, "D_sharpe": -1.0869, "D_sortino": -1.2132, "D_excess_sharpe": -0.8128, "D_return_pct": -11.69, "D_hit_rate": 41.05, "D_n": 96, "D_bh_sharpe": -0.2741, "D_bh_return_pct": -4.09, "D_psr": 0.2577, "D_ic": -0.0927, "D_precision": 0.3929, "D_recall": 0.22, "D_f1": 0.2821, "D_f2": 0.2412, "D_accuracy": 0.4167, "D_mcc": -0.1644, "D_tp": 11, "D_fp": 17, "D_tn": 29, "D_fn": 39, "sharpe": -1.0869, "sortino": -1.2132, "return_pct": -11.69, "equity": 883.1, "max_dd": 0.0, "win_rate": 41.05, "profit_factor": 0.0, "ic": -0.0927, "hit": 41.05, "psr": 0.2577, "bh_sharpe": -0.2741, "bh_return_pct": -4.09, "excess_sharpe": -0.8128, "precision": 0.3929, "recall": 0.22, "f1": 0.2821, "f2": 0.2412, "mcc": -0.1644, "accuracy": 0.4167, "tp": 11, "fp": 17, "tn": 29, "fn": 39}, {"fold": "fold_3", "regime": "Taper tantrum and 2014 H1", "n": 54, "A_sharpe": -5.9563, "A_sortino": -5.2087, "A_excess_sharpe": -10.656, "A_return_pct": -11.81, "A_hit_rate": 35.19, "A_n": 54, "A_bh_sharpe": 4.6998, "A_bh_return_pct": 10.46, "A_psr": 0.0058, "A_ic": -0.091, "A_precision": 0.25, "A_recall": 0.0303, "A_f1": 0.0541, "A_f2": 0.0368, "A_accuracy": 0.3519, "A_mcc": -0.2095, "A_tp": 1, "A_fp": 3, "A_tn": 18, "A_fn": 32, "B_sharpe": -0.1772, "B_sortino": -0.1856, "B_excess_sharpe": -9.2098, "B_return_pct": -1.53, "B_hit_rate": 48.15, "B_n": 54, "B_bh_sharpe": 9.0326, "B_bh_return_pct": 49.18, "B_psr": 0.4676, "B_ic": 0.1739, "B_precision": 0.7368, "B_recall": 0.3784, "B_f1": 0.5, "B_f2": 0.4192, "B_accuracy": 0.4815, "B_mcc": 0.0819, "B_tp": 14, "B_fp": 5, "B_tn": 12, "B_fn": 23, "D_sharpe": -5.9563, "D_sortino": -5.2087, "D_excess_sharpe": -10.656, "D_return_pct": -11.81, "D_hit_rate": 35.19, "D_n": 54, "D_bh_sharpe": 4.6998, "D_bh_return_pct": 10.46, "D_psr": 0.0058, "D_ic": -0.091, "D_precision": 0.25, "D_recall": 0.0303, "D_f1": 0.0541, "D_f2": 0.0368, "D_accuracy": 0.3519, "D_mcc": -0.2095, "D_tp": 1, "D_fp": 3, "D_tn": 18, "D_fn": 32, "sharpe": -5.9563, "sortino": -5.2087, "return_pct": -11.81, "equity": 881.9, "max_dd": 0.0, "win_rate": 35.19, "profit_factor": 0.0, "ic": -0.091, "hit": 35.19, "psr": 0.0058, "bh_sharpe": 4.6998, "bh_return_pct": 10.46, "excess_sharpe": -10.656, "precision": 0.25, "recall": 0.0303, "f1": 0.0541, "f2": 0.0368, "mcc": -0.2095, "accuracy": 0.3519, "tp": 1, "fp": 3, "tn": 18, "fn": 32}, {"fold": "fold_4", "regime": "China devaluation and oil crash", "n": 96, "A_sharpe": -0.872, "A_sortino": -0.8549, "A_excess_sharpe": -0.4479, "A_return_pct": -6.82, "A_hit_rate": 47.37, "A_n": 96, "A_bh_sharpe": -0.4241, "A_bh_return_pct": -3.73, "A_psr": 0.2966, "A_ic": -0.0954, "A_precision": 0.4118, "A_recall": 0.3111, "A_f1": 0.3544, "A_f2": 0.3271, "A_accuracy": 0.4688, "A_mcc": -0.0846, "A_tp": 14, "A_fp": 20, "A_tn": 31, "A_fn": 31, "B_sharpe": 1.3697, "B_sortino": 1.3777, "B_excess_sharpe": 2.554, "B_return_pct": 21.48, "B_hit_rate": 54.17, "B_n": 96, "B_bh_sharpe": -1.1843, "B_bh_return_pct": -21.44, "B_psr": 0.7966, "B_ic": 0.0444, "B_precision": 0.5208, "B_recall": 0.5435, "B_f1": 0.5319, "B_f2": 0.5388, "B_accuracy": 0.5417, "B_mcc": 0.0834, "B_tp": 25, "B_fp": 23, "B_tn": 27, "B_fn": 21, "D_sharpe": -0.872, "D_sortino": -0.8549, "D_excess_sharpe": -0.4479, "D_return_pct": -6.82, "D_hit_rate": 47.37, "D_n": 96, "D_bh_sharpe": -0.4241, "D_bh_return_pct": -3.73, "D_psr": 0.2966, "D_ic": -0.0954, "D_precision": 0.4118, "D_recall": 0.3111, "D_f1": 0.3544, "D_f2": 0.3271, "D_accuracy": 0.4688, "D_mcc": -0.0846, "D_tp": 14, "D_fp": 20, "D_tn": 31, "D_fn": 31, "sharpe": -0.872, "sortino": -0.8549, "return_pct": -6.82, "equity": 931.8, "max_dd": 0.0, "win_rate": 47.37, "profit_factor": 0.0, "ic": -0.0954, "hit": 47.37, "psr": 0.2966, "bh_sharpe": -0.4241, "bh_return_pct": -3.73, "excess_sharpe": -0.4479, "precision": 0.4118, "recall": 0.3111, "f1": 0.3544, "f2": 0.3271, "mcc": -0.0846, "accuracy": 0.4688, "tp": 14, "fp": 20, "tn": 31, "fn": 31}, {"fold": "fold_5", "regime": "2018 Vol-mageddon + Q4 sell-off", "n": 54, "A_sharpe": -3.5964, "A_sortino": -3.2107, "A_excess_sharpe": -5.0244, "A_return_pct": -9.76, "A_hit_rate": 42.59, "A_n": 54, "A_bh_sharpe": 1.428, "A_bh_return_pct": 3.97, "A_psr": 0.0475, "A_ic": -0.2395, "A_precision": 0.4167, "A_recall": 0.1724, "A_f1": 0.2439, "A_f2": 0.1953, "A_accuracy": 0.4259, "A_mcc": -0.129, "A_tp": 5, "A_fp": 7, "A_tn": 18, "A_fn": 24, "B_sharpe": -5.3206, "B_sortino": -4.9929, "B_excess_sharpe": -10.2528, "B_return_pct": -28.95, "B_hit_rate": 33.33, "B_n": 54, "B_bh_sharpe": 4.9322, "B_bh_return_pct": 34.93, "B_psr": 0.0118, "B_ic": -0.3933, "B_precision": 0.6667, "B_recall": 0.0541, "B_f1": 0.1, "B_f2": 0.0662, "B_accuracy": 0.3333, "B_mcc": -0.0097, "B_tp": 2, "B_fp": 1, "B_tn": 16, "B_fn": 35, "D_sharpe": -3.5964, "D_sortino": -3.2107, "D_excess_sharpe": -5.0244, "D_return_pct": -9.76, "D_hit_rate": 42.59, "D_n": 54, "D_bh_sharpe": 1.428, "D_bh_return_pct": 3.97, "D_psr": 0.0475, "D_ic": -0.2395, "D_precision": 0.4167, "D_recall": 0.1724, "D_f1": 0.2439, "D_f2": 0.1953, "D_accuracy": 0.4259, "D_mcc": -0.129, "D_tp": 5, "D_fp": 7, "D_tn": 18, "D_fn": 24, "sharpe": -3.5964, "sortino": -3.2107, "return_pct": -9.76, "equity": 902.4, "max_dd": 0.0, "win_rate": 42.59, "profit_factor": 0.0, "ic": -0.2395, "hit": 42.59, "psr": 0.0475, "bh_sharpe": 1.428, "bh_return_pct": 3.97, "excess_sharpe": -5.0244, "precision": 0.4167, "recall": 0.1724, "f1": 0.2439, "f2": 0.1953, "mcc": -0.129, "accuracy": 0.4259, "tp": 5, "fp": 7, "tn": 18, "fn": 24}, {"fold": "fold_6", "regime": "COVID crash and V-recovery", "n": 75, "A_sharpe": -2.1685, "A_sortino": -2.321, "A_excess_sharpe": -6.4679, "A_return_pct": -7.11, "A_hit_rate": 38.67, "A_n": 75, "A_bh_sharpe": 4.2994, "A_bh_return_pct": 14.68, "A_psr": 0.1291, "A_ic": -0.0271, "A_precision": 0.7273, "A_recall": 0.1569, "A_f1": 0.2581, "A_f2": 0.186, "A_accuracy": 0.3867, "A_mcc": 0.042, "A_tp": 8, "A_fp": 3, "A_tn": 21, "A_fn": 43, "B_sharpe": -4.6022, "B_sortino": -4.3147, "B_excess_sharpe": -18.9361, "B_return_pct": -28.91, "B_hit_rate": 36.0, "B_n": 75, "B_bh_sharpe": 14.3339, "B_bh_return_pct": 120.13, "B_psr": 0.0081, "B_ic": 0.0967, "B_precision": 0.8947, "B_recall": 0.2698, "B_f1": 0.4146, "B_f2": 0.3137, "B_accuracy": 0.36, "B_mcc": 0.087, "B_tp": 17, "B_fp": 2, "B_tn": 10, "B_fn": 46, "D_sharpe": -2.1685, "D_sortino": -2.321, "D_excess_sharpe": -6.4679, "D_return_pct": -7.11, "D_hit_rate": 38.67, "D_n": 75, "D_bh_sharpe": 4.2994, "D_bh_return_pct": 14.68, "D_psr": 0.1291, "D_ic": -0.0271, "D_precision": 0.7273, "D_recall": 0.1569, "D_f1": 0.2581, "D_f2": 0.186, "D_accuracy": 0.3867, "D_mcc": 0.042, "D_tp": 8, "D_fp": 3, "D_tn": 21, "D_fn": 43, "sharpe": -2.1685, "sortino": -2.321, "return_pct": -7.11, "equity": 928.9000000000001, "max_dd": 0.0, "win_rate": 38.67, "profit_factor": 0.0, "ic": -0.0271, "hit": 38.67, "psr": 0.1291, "bh_sharpe": 4.2994, "bh_return_pct": 14.68, "excess_sharpe": -6.4679, "precision": 0.7273, "recall": 0.1569, "f1": 0.2581, "f2": 0.186, "mcc": 0.042, "accuracy": 0.3867, "tp": 8, "fp": 3, "tn": 21, "fn": 43}, {"fold": "fold_7", "regime": "Inflation bear, AI rally and 2025", "n": 114, "A_sharpe": -1.3962, "A_sortino": -1.3775, "A_excess_sharpe": -4.2412, "A_return_pct": -9.92, "A_hit_rate": 45.61, "A_n": 114, "A_bh_sharpe": 2.845, "A_bh_return_pct": 21.34, "A_psr": 0.1761, "A_ic": -0.0372, "A_precision": 0.5641, 