{"experiment_num": 46, "backbone": "xgboost", "description": "XGBoost @ exp 44 max_depth=3 (down from 4) - Friedman 2001 shallow-boosting", "config": {"seq_len": 60, "lr": 0.0003, "batch_size": 32, "epochs": 50, "weight_decay": 1e-05, "patience": 10, "warmup_epochs": 0, "head_dropout": 0.1, "huber_delta": 1.0, "grad_clip": 1.0, "seed": 42, "hidden_size": null, "num_layers": null, "max_depth": 3, "gbm_lr": 0.02, "n_estimators": 100}, "composite": -1.2319, "test_pos_folds": 7, "val_pos_folds": 2, "val_loss": null, "elapsed_sec": 54.5, "timestamp": "2026-04-27T19:07:26", "sharpe": 0.9873, "val_sharpe": -1.2319, "ic": 0.0242, "hit": 53.2, "psr": 0.9802, "equity": 2304.1, "return_pct": 130.41, "bh_sharpe": 1.2194, "bh_return_pct": 187.05, "excess_sharpe": -0.2321, "B_sharpe": 0.5236, "B_excess_sharpe": -2.3045, "B_return_pct": 77.35, "D_sharpe": 0.3342, "D_excess_sharpe": -0.8852, "D_return_pct": 23.65, "per_window": [{"fold": "fold_1", "regime": "GFC peak crash (Lehman + Mar-2009 bottom)", "n": 66, "A_sharpe": 2.0781, "A_sortino": 2.4223, "A_excess_sharpe": 1.506, "A_return_pct": 20.19, "A_hit_rate": 51.52, "A_n": 66, "A_bh_sharpe": 0.5721, "A_bh_return_pct": 3.85, "A_psr": 0.8591, "A_ic": 0.2142, "B_sharpe": 0.7035, "B_sortino": 0.725, "B_excess_sharpe": -1.3434, "B_return_pct": 6.65, "B_hit_rate": 50.77, "B_n": 66, "B_bh_sharpe": 2.0469, "B_bh_return_pct": 39.28, "B_psr": 0.6396, "B_ic": 0.2379, "D_sharpe": 2.535, "D_sortino": 2.8141, "D_excess_sharpe": 1.9629, "D_return_pct": 25.52, "D_hit_rate": 54.55, "D_n": 66, "D_bh_sharpe": 0.5721, "D_bh_return_pct": 3.85, "D_psr": 0.9031, "D_ic": 0.1652, "sharpe": 2.0781, "sortino": 2.4223, "return_pct": 20.19, "equity": 1201.8999999999999, "max_dd": 0.0, "win_rate": 51.52, "profit_factor": 0.0, "ic": 0.2142, "hit": 51.52, "psr": 0.8591, "bh_sharpe": 0.5721, "bh_return_pct": 3.85, "excess_sharpe": 1.506, "precision": 0.5652, "recall": 0.3714, "f1": 0.4483, "f2": 0.3988, "accuracy": 0.5152, "mcc": 0.0512, "tp": 13, "fp": 10, "tn": 21, "fn": 22, "A_precision": 0.5652, "A_recall": 0.3714, "A_f1": 0.4483, "A_f2": 0.3988, "A_accuracy": 0.5152, "A_mcc": 0.0512, "A_tp": 13, "A_fp": 10, "A_tn": 21, "A_fn": 22}, {"fold": "fold_2", "regime": "2011 US-downgrade + EU debt", "n": 87, "A_sharpe": 2.8193, "A_sortino": 3.69, "A_excess_sharpe": -2.2027, "A_return_pct": 15.82, "A_hit_rate": 53.49, "A_n": 87, "A_bh_sharpe": 5.022, "A_bh_return_pct": 29.23, "A_psr": 0.9634, "A_ic": -0.048, "B_sharpe": 9.5118, "B_sortino": 8.041, "B_excess_sharpe": -1.6252, "B_return_pct": 155.09, "B_hit_rate": 81.61, "B_n": 87, "B_bh_sharpe": 11.1369, "B_bh_return_pct": 185.4, "B_psr": 1.0, "B_ic": 0.0644, "D_sharpe": 3.4067, "D_sortino": 3.6178, "D_excess_sharpe": -1.6153, "D_return_pct": 19.37, "D_hit_rate": 61.63, "D_n": 87, "D_bh_sharpe": 5.022, "D_bh_return_pct": 29.23, "D_psr": 0.9794, "D_ic": -0.0481, "sharpe": 2.8193, "sortino": 3.69, "return_pct": 15.82, "equity": 1158.1999999999998, "max_dd": 0.0, "win_rate": 53.49, "profit_factor": 0.0, "ic": -0.048, "hit": 53.49, "psr": 0.9634, "bh_sharpe": 5.022, "bh_return_pct": 29.23, "excess_sharpe": -2.2027, "precision": 0.6061, "recall": 0.7407, "f1": 0.6667, "f2": 0.7092, "accuracy": 0.5402, "mcc": -0.0534, "tp": 40, "fp": 26, "tn": 7, "fn": 14, "A_precision": 0.6061, "A_recall": 0.7407, "A_f1": 0.6667, "A_f2": 0.7092, "A_accuracy": 0.5402, "A_mcc": -0.0534, "A_tp": 40, "A_fp": 26, "A_tn": 7, "A_fn": 14}, {"fold": "fold_3", "regime": "Taper tantrum and 2014 H1", "n": 129, "A_sharpe": 1.7678, "A_sortino": 1.4748, "A_excess_sharpe": 0.0, "A_return_pct": 11.76, "A_hit_rate": 60.94, "A_n": 129, "A_bh_sharpe": 1.7678, "A_bh_return_pct": 11.76, "A_psr": 0.8822, "A_ic": 0.1015, "B_sharpe": 4.2474, "B_sortino": 4.2072, "B_excess_sharpe": 0.0, "B_return_pct": 64.1, "B_hit_rate": 63.57, "B_n": 129, "B_bh_sharpe": 4.2474, "B_bh_return_pct": 64.1, "B_psr": 0.9981, "B_ic": -0.1234, "D_sharpe": 1.7678, "D_sortino": 1.4748, "D_excess_sharpe": 0.0, "D_return_pct": 11.76, "D_hit_rate": 60.94, "D_n": 129, "D_bh_sharpe": 1.7678, "D_bh_return_pct": 11.76, "D_psr": 0.8822, "D_ic": 0.0256, "sharpe": 1.7678, "sortino": 1.4748, "return_pct": 11.76, "equity": 1117.6, "max_dd": 0.0, "win_rate": 60.94, "profit_factor": 0.0, "ic": 0.1015, "hit": 60.94, "psr": 0.8822, "bh_sharpe": 1.7678, "bh_return_pct": 11.76, "excess_sharpe": 0.0, "precision": 0.6047, "recall": 1.0, "f1": 0.7536, "f2": 0.8844, "accuracy": 0.6047, "mcc": 0.0, "tp": 78, "fp": 51, "tn": 0, "fn": 0, "A_precision": 0.6047, "A_recall": 1.0, "A_f1": 0.7536, "A_f2": 0.8844, "A_accuracy": 0.6047, "A_mcc": 0.0, "A_tp": 78, "A_fp": 51, "A_tn": 0, "A_fn": 0}, {"fold": "fold_4", "regime": "China devaluation and oil crash", "n": 108, "A_sharpe": 0.118, "A_sortino": 0.1101, "A_excess_sharpe": 0.8078, "A_return_pct": 0.14, "A_hit_rate": 52.34, "A_n": 108, "A_bh_sharpe": -0.6898, "A_bh_return_pct": -6.71, "A_psr": 0.5306, "A_ic": 0.0464, "B_sharpe": -1.062, "B_sortino": -0.9265, "B_excess_sharpe": 0.8955, "B_return_pct": -21.5, "B_hit_rate": 50.93, "B_n": 108, "B_bh_sharpe": -1.9575, "B_bh_return_pct": -33.56, "B_psr": 0.2401, "B_ic": -0.0555, "D_sharpe": -1.41, "D_sortino": -1.2927, "D_excess_sharpe": -0.7202, "D_return_pct": -12.38, "D_hit_rate": 47.66, "D_n": 108, "D_bh_sharpe": -0.6898, "D_bh_return_pct": -6.71, "D_psr": 0.1761, "D_ic": -0.0131, "sharpe": 0.118, "sortino": 0.1101, "return_pct": 0.14, "equity": 1001.4000000000001, "max_dd": 0.0, "win_rate": 52.34, "profit_factor": 0.0, "ic": 0.0464, "hit": 52.34, "psr": 0.5306, "bh_sharpe": -0.6898, "bh_return_pct": -6.71, "excess_sharpe": 0.8078, "precision": 0.5135, "recall": 0.717, "f1": 0.5984, "f2": 0.6643, "accuracy": 0.5278, "mcc": 0.0672, "tp": 38, "fp": 36, "tn": 19, "fn": 15, "A_precision": 0.5135, "A_recall": 0.717, "A_f1": 0.5984, "A_f2": 0.6643, "A_accuracy": 0.5278, "A_mcc": 0.0672, "A_tp": 38, "A_fp": 36, "A_tn": 19, "A_fn": 15}, {"fold": "fold_5", "regime": "2018 Vol-mageddon + Q4 sell-off", "n": 128, "A_sharpe": 0.6011, "A_sortino": 0.5834, "A_excess_sharpe": -0.55, "A_return_pct": 5.97, "A_hit_rate": 54.69, "A_n": 128, "A_bh_sharpe": 1.1511, "A_bh_return_pct": 13.19, "A_psr": 0.6655, "A_ic": 0.02, "B_sharpe": -1.993, "B_sortino": -1.899, "B_excess_sharpe": -4.8048, "B_return_pct": -40.8, "B_hit_rate": 42.52, "B_n": 128, "B_bh_sharpe": 2.8119, "B_bh_return_pct": 82.25, "B_psr": 0.0756, "B_ic": -0.1564, "D_sharpe": -1.4494, "D_sortino": -1.428, "D_excess_sharpe": -2.6005, "D_return_pct": -17.12, "D_hit_rate": 47.66, "D_n": 128, "D_bh_sharpe": 1.1511, "D_bh_return_pct": 13.19, "D_psr": 0.1571, "D_ic": -0.1052, "sharpe": 0.6011, "sortino": 0.5834, "return_pct": 5.97, "equity": 1059.7, "max_dd": 0.0, "win_rate": 54.69, "profit_factor": 0.0, "ic": 0.02, "hit": 54.69, "psr": 0.6655, "bh_sharpe": 1.1511, "bh_return_pct": 13.19, "excess_sharpe": -0.55, "precision": 0.6111, "recall": 0.7051, "f1": 0.6548, "f2": 0.6841, "accuracy": 0.5469, "mcc": 0.0055, "tp": 55, "fp": 35, "tn": 15, "fn": 23, "A_precision": 0.6111, "A_recall": 0.7051, "A_f1": 0.6548, "A_f2": 0.6841, "A_accuracy": 0.5469, "A_mcc": 0.0055, "A_tp": 55, "A_fp": 35, "A_tn": 15, "A_fn": 23}, {"fold": "fold_6", "regime": "COVID crash and V-recovery", "n": 173, "A_sharpe": 1.3199, "A_sortino": 1.3565, "A_excess_sharpe": -1.0062, "A_return_pct": 22.02, "A_hit_rate": 53.18, "A_n": 173, "A_bh_sharpe": 2.3261, "A_bh_return_pct": 43.81, "A_psr": 0.8605, "A_ic": 0.0608, "B_sharpe": -0.506, "B_sortino": -0.4931, "B_excess_sharpe": -6.252, "B_return_pct": -23.22, "B_hit_rate": 48.84, "B_n": 173, "B_bh_sharpe": 5.746, "B_bh_return_pct": 499.04, "B_psr": 0.3377, "B_ic": -0.0393, "D_sharpe": -0.1547, "D_sortino": -0.1532, "D_excess_sharpe": -2.4808, "D_return_pct": -4.5, "D_hit_rate": 50.29, "D_n": 173, "D_bh_sharpe": 2.3261, "D_bh_return_pct": 43.81, "D_psr": 0.4491, "D_ic": -0.0736, "sharpe": 1.3199, "sortino": 1.3565, "return_pct": 22.02, "equity": 1220.2, "max_dd": 0.0, "win_rate": 53.18, "profit_factor": 0.0, "ic": 0.0608, "hit": 53.18, "psr": 0.8605, "bh_sharpe": 2.3261, "bh_return_pct": 43.81, "excess_sharpe": -1.0062, "precision": 0.6818, "recall": 0.531, "f1": 0.597, "f2": 0.5556, "accuracy": 0.5318, "mcc": 0.0612, "tp": 60, "fp": 28, "tn": 32, "fn": 53, "A_precision": 0.6818, "A_recall": 0.531, "A_f1": 0.597, "A_f2": 0.5556, "A_accuracy": 0.5318, "A_mcc": 0.0612, "A_tp": 60, "A_fp": 28, "A_tn": 32, "A_fn": 53}, {"fold": "fold_7", "regime": "Inflation bear, AI rally and 2025", "n": 376, "A_sharpe": 0.5121, "A_sortino": 0.5666, "A_excess_sharpe": -0.2912, "A_return_pct": 14.37, "A_hit_rate": 50.53, "A_n": 376, "A_bh_sharpe": 0.8033, "A_bh_return_pct": 26.02, "A_psr": 0.7378, "A_ic": -0.0004, "B_sharpe": 0.3852, "B_sortino": 0.4535, "B_excess_sharpe": -1.5465, "B_return_pct": 11.35, "B_hit_rate": 44.0, "B_n": 376, "B_bh_sharpe": 1.9317, "B_bh_return_pct": 222.05, "B_psr": 0.6819, "B_ic": -0.0094, "D_sharpe": 0.2973, "D_sortino": 0.3943, "D_excess_sharpe": -0.506, "D_return_pct": 6.46, "D_hit_rate": 43.09, "D_n": 376, "D_bh_sharpe": 0.8033, "D_bh_return_pct": 26.02, "D_psr": 0.6441, "D_ic": -0.0144, "sharpe": 0.5121, "sortino": 0.5666, "return_pct": 14.37, "equity": 1143.7, "max_dd": 0.0, "win_rate": 50.53, "profit_factor": 0.0, "ic": -0.0004, "hit": 50.53, "psr": 0.7378, "bh_sharpe": 0.8033, "bh_return_pct": 26.02, "excess_sharpe": -0.2912, "precision": 0.6074, "recall": 0.448, "f1": 0.5156, "f2": 0.4728, "accuracy": 0.5053, "mcc": 0.0348, "tp": 99, "fp": 64, "tn": 91, "fn": 122, "A_precision": 0.6074, "A_recall": 0.448, "A_f1": 0.5156, "A_f2": 0.4728, "A_accuracy": 0.5053, "A_mcc": 0.0348, "A_tp": 99, "A_fp": 64, "A_tn": 91, "A_fn": 122}], "per_window_val": [{"fold": "fold_1", "regime": "GFC peak crash (Lehman + Mar-2009 bottom)", "n": 65, "A_sharpe": -2.8589, "A_sortino": -2.8863, "A_excess_sharpe": -0.6333, "A_return_pct": -22.93, "A_hit_rate": 39.68, "A_n": 65, "A_bh_sharpe": -2.2257, "A_bh_return_pct": -18.74, "A_psr": 0.0918, "A_ic": -0.07, "B_sharpe": -7.1223, "B_sortino": -5.5294, "B_excess_sharpe": 0.0, "B_return_pct": -73.11, "B_hit_rate": 35.38, "B_n": 65, "B_bh_sharpe": -7.1223, "B_bh_return_pct": -73.11, "B_psr": 0.0, "B_ic": 0.0605, "D_sharpe": -2.2257, "D_sortino": -1.889, "D_excess_sharpe": 0.0, "D_return_pct": -18.74, "D_hit_rate": 46.03, "D_n": 65, "D_bh_sharpe": -2.2257, "D_bh_return_pct": -18.74, "D_psr": 0.1152, "D_ic": 0.1568, "sharpe": -2.8589, "sortino": -2.8863, "return_pct": -22.93, "equity": 770.6999999999999, "max_dd": 0.0, "win_rate": 39.68, "profit_factor": 0.0, "ic": -0.07, "hit": 39.68, "psr": 0.0918, "bh_sharpe": -2.2257, "bh_return_pct": -18.74, "excess_sharpe": -0.6333}, {"fold": "fold_2", "regime": "2011 US-downgrade + EU debt", "n": 47, "A_sharpe": 0.417, "A_sortino": 0.3785, "A_excess_sharpe": 0.6111, "A_return_pct": 1.58, "A_hit_rate": 55.32, "A_n": 47, "A_bh_sharpe": -0.1941, "A_bh_return_pct": -2.36, "A_psr": 0.5703, "A_ic": 0.0221, "B_sharpe": -1.525, "B_sortino": -1.3885, "B_excess_sharpe": 0.0873, "B_return_pct": -23.38, "B_hit_rate": 46.81, "B_n": 47, "B_bh_sharpe": -1.6123, "B_bh_return_pct": -24.3, "B_psr": 0.2525, "B_ic": 0.3753, "D_sharpe": -0.2446, "D_sortino": -0.2184, "D_excess_sharpe": -0.0505, "D_return_pct": -2.68, "D_hit_rate": 53.19, "D_n": 47, "D_bh_sharpe": -0.1941, "D_bh_return_pct": -2.36, "D_psr": 0.4582, "D_ic": 0.0838, "sharpe": 0.417, "sortino": 0.3785, "return_pct": 1.58, "equity": 1015.8000000000001, "max_dd": 0.0, "win_rate": 55.32, "profit_factor": 0.0, "ic": 0.0221, "hit": 55.32, "psr": 0.5703, "bh_sharpe": -0.1941, "bh_return_pct": -2.36, "excess_sharpe": 0.6111}, {"fold": "fold_3", "regime": "Taper tantrum and 2014 H1", "n": 5, "A_sharpe": -1.3194, "A_sortino": -1.3491, "A_excess_sharpe": 0.0, "A_return_pct": -0.21, "A_hit_rate": 40.0, "A_n": 5, "A_bh_sharpe": -1.3194, "A_bh_return_pct": -0.21, "A_psr": 0.4337, "A_ic": 0.3591, "B_sharpe": -25.8705, "B_sortino": -13.5303, "B_excess_sharpe": 0.0, "B_return_pct": -3.84, "B_hit_rate": 0.0, "B_n": 5, "B_bh_sharpe": -25.8705, "B_bh_return_pct": -3.84, "B_psr": 0.0, "B_ic": -0.2, "D_sharpe": -1.3194, "D_sortino": -1.3491, "D_excess_sharpe": 0.0, "D_return_pct": -0.21, "D_hit_rate": 40.0, "D_n": 5, "D_bh_sharpe": -1.3194, "D_bh_return_pct": -0.21, "D_psr": 0.4337, "D_ic": -0.3, "sharpe": -1.3194, "sortino": -1.3491, "return_pct": -0.21, "equity": 997.9, "max_dd": 0.0, "win_rate": 40.0, "profit_factor": 0.0, "ic": 0.3591, "hit": 40.0, "psr": 0.4337, "bh_sharpe": -1.3194, "bh_return_pct": -0.21, "excess_sharpe": 0.0}, {"fold": "fold_4", "regime": "China devaluation and oil crash", "n": 47, "A_sharpe": -0.6131, "A_sortino": -0.6024, "A_excess_sharpe": 1.2107, "A_return_pct": -3.4, "A_hit_rate": 46.81, "A_n": 47, "A_bh_sharpe": -1.8238, "A_bh_return_pct": -8.68, "A_psr": 0.3966, "A_ic": 0.0662, "B_sharpe": -2.22, "B_sortino": -1.9053, "B_excess_sharpe": 0.0, "B_return_pct": -23.98, "B_hit_rate": 44.68, "B_n": 47, "B_bh_sharpe": -2.22, "B_bh_return_pct": -23.98, "B_psr": 0.1505, "B_ic": 0.4066, "D_sharpe": -1.8238, "D_sortino": -1.7153, "D_excess_sharpe": 0.0, "D_return_pct": -8.68, "D_hit_rate": 44.68, "D_n": 47, "D_bh_sharpe": -1.8238, "D_bh_return_pct": -8.68, "D_psr": 0.2173, "D_ic": 0.2194, "sharpe": -0.6131, "sortino": -0.6024, "return_pct": -3.4, "equity": 966.0, "max_dd": 0.0, "win_rate": 46.81, "profit_factor": 0.0, "ic": 0.0662, "hit": 46.81, "psr": 0.3966, "bh_sharpe": -1.8238, "bh_return_pct": -8.68, "excess_sharpe": 1.2107}, {"fold": "fold_5", "regime": "2018 Vol-mageddon + Q4 sell-off", "n": 5, "A_sharpe": -10.1368, "A_sortino": -6.9937, "A_excess_sharpe": 0.0, "A_return_pct": -3.15, "A_hit_rate": 40.0, "A_n": 5, "A_bh_sharpe": -10.1368, "A_bh_return_pct": -3.15, "A_psr": 0.0985, "A_ic": -0.1, "B_sharpe": 5.6858, "B_sortino": 6.0578, "B_excess_sharpe": 0.0, "B_return_pct": 4.22, "B_hit_rate": 60.0, "B_n": 5, "B_bh_sharpe": 5.6858, "B_bh_return_pct": 4.22, "B_psr": 0.753, "B_ic": -0.7, "D_sharpe": -10.1368, "D_sortino": -6.9937, "D_excess_sharpe": 0.0, "D_return_pct": -3.15, "D_hit_rate": 40.0, "D_n": 5, "D_bh_sharpe": -10.1368, "D_bh_return_pct": -3.15, "D_psr": 0.0985, "D_ic": -0.9, "sharpe": -10.1368, "sortino": -6.9937, "return_pct": -3.15, "equity": 968.5, "max_dd": 0.0, "win_rate": 40.0, "profit_factor": 0.0, "ic": -0.1, "hit": 40.0, "psr": 0.0985, "bh_sharpe": -10.1368, "bh_return_pct": -3.15, "excess_sharpe": 0.0}, {"fold": "fold_6", "regime": "COVID crash and V-recovery", "n": 26, "A_sharpe": 3.2852, "A_sortino": 3.0777, "A_excess_sharpe": 0.0, "A_return_pct": 4.82, "A_hit_rate": 61.54, "A_n": 26, "A_bh_sharpe": 3.2852, "A_bh_return_pct": 4.82, "A_psr": 0.8369, "A_ic": 0.0383, "B_sharpe": 11.1931, "B_sortino": 12.5827, "B_excess_sharpe": -1.7861, "B_return_pct": 34.68, "B_hit_rate": 76.92, "B_n": 26, "B_bh_sharpe": 12.9792, "B_bh_return_pct": 38.76, "B_psr": 0.9993, "B_ic": 0.2985, "D_sharpe": 3.6519, "D_sortino": 3.2417, "D_excess_sharpe": 0.3668, "D_return_pct": 5.36, "D_hit_rate": 65.38, "D_n": 26, "D_bh_sharpe": 3.2852, "D_bh_return_pct": 4.82, "D_psr": 0.8594, "D_ic": 0.0626, "sharpe": 3.2852, "sortino": 3.0777, "return_pct": 4.82, "equity": 1048.2, "max_dd": 0.0, "win_rate": 61.54, "profit_factor": 0.0, "ic": 0.0383, "hit": 61.54, "psr": 0.8369, "bh_sharpe": 3.2852, "bh_return_pct": 4.82, "excess_sharpe": 0.0}, {"fold": "fold_7", "regime": "Inflation bear, AI rally and 2025", "n": 65, "A_sharpe": -2.6617, "A_sortino": -2.3515, "A_excess_sharpe": -4.7406, "A_return_pct": -10.13, "A_hit_rate": 47.69, "A_n": 65, "A_bh_sharpe": 2.0789, "A_bh_return_pct": 8.17, "A_psr": 0.0871, "A_ic": -0.1723, "B_sharpe": -5.2314, "B_sortino": -4.8393, "B_excess_sharpe": -10.4628, "B_return_pct": -32.36, "B_hit_rate": 32.31, "B_n": 65, "B_bh_sharpe": 5.2314, "B_bh_return_pct": 44.53, "B_psr": 0.0054, "B_ic": 0.0585, "D_sharpe": -2.0789, "D_sortino": -1.8995, "D_excess_sharpe": -4.1578, "D_return_pct": -8.11, "D_hit_rate": 46.15, "D_n": 65, "D_bh_sharpe": 2.0789, "D_bh_return_pct": 8.17, "D_psr": 0.1438, "D_ic": 0.1116, "sharpe": -2.6617, "sortino": -2.3515, "return_pct": -10.13, "equity": 898.7, "max_dd": 0.0, "win_rate": 47.69, "profit_factor": 0.0, "ic": -0.1723, "hit": 47.69, "psr": 0.0871, "bh_sharpe": 2.0789, "bh_return_pct": 8.17, "excess_sharpe": -4.7406}], "status": "DISCARD", "precision": 0.6051, "recall": 0.606, "f1": 0.6055, "f2": 0.6058, "accuracy": 0.5323, "mcc": 0.0313, "tp": 383, "fp": 250, "tn": 185, "fn": 249, "test_sharpe": 0.9873, "A_sharpe": 0.9873, "A_excess_sharpe": -0.2321, "A_return_pct": 130.41, "A_precision": 0.6051, "A_recall": 0.606, "A_f1": 0.6055, "A_f2": 0.6058, "A_accuracy": 0.5323, "A_mcc": 0.0313, "A_tp": 383, "A_fp": 250, "A_tn": 185, "A_fn": 249, "A_psr": 0.9802, "A_ic": 0.0242, "A_hit_rate": 53.2, "A_bh_sharpe": 1.2194, "A_bh_return_pct": 187.05}
