{"experiment_num": 56, "backbone": "mamba", "description": "Mamba VANILLA variant @ exp 52 HPs (vs dmamba) - Gu-Dao 2024 base architecture test", "config": {"seq_len": 60, "lr": 0.0005, "batch_size": 32, "epochs": 100, "weight_decay": 0.1, "patience": 20, "warmup_epochs": 10, "head_dropout": 0.1, "huber_delta": 1.0, "grad_clip": 1.0, "seed": 42, "hidden_size": null, "num_layers": null, "max_depth": null, "gbm_lr": null, "n_estimators": null}, "composite": -0.6715, "test_pos_folds": 3, "val_pos_folds": 3, "val_loss": -2.849755147917081, "elapsed_sec": 642.1, "timestamp": "2026-04-27T21:33:41", "sharpe": -0.2715, "val_sharpe": 0.1195, "ic": 0.0391, "hit": 43.71, "psr": 0.2887, "equity": 693.6, "return_pct": -30.64, "bh_sharpe": 1.2201, "bh_return_pct": 185.59, "excess_sharpe": -1.4916, "B_sharpe": -0.6116, "B_excess_sharpe": -3.4501, "B_return_pct": -80.84, "D_sharpe": -0.2715, "D_excess_sharpe": -1.4916, "D_return_pct": -30.64, "per_window": [{"fold": "fold_1", "regime": "GFC peak crash (Lehman + Mar-2009 bottom)", "n": 65, "A_sharpe": -0.0866, "A_sortino": -0.088, "A_excess_sharpe": -0.5128, "A_return_pct": -2.64, "A_hit_rate": 46.15, "A_n": 65, "A_bh_sharpe": 0.4262, "A_bh_return_pct": 2.34, "A_psr": 0.4826, "A_ic": -0.0944, "B_sharpe": 1.9693, "B_sortino": 2.0724, "B_excess_sharpe": 0.0816, "B_return_pct": 36.6, "B_hit_rate": 53.12, "B_n": 65, "B_bh_sharpe": 1.8877, "B_bh_return_pct": 34.48, "B_psr": 0.8391, "B_ic": 0.0102, "D_sharpe": -0.0866, "D_sortino": -0.088, "D_excess_sharpe": -0.5128, "D_return_pct": -2.64, "D_hit_rate": 46.15, "D_n": 65, "D_bh_sharpe": 0.4262, "D_bh_return_pct": 2.34, "D_psr": 0.4826, "D_ic": -0.0944, "sharpe": -0.0866, "sortino": -0.088, "return_pct": -2.64, "equity": 973.6, "max_dd": 0.0, "win_rate": 46.15, "profit_factor": 0.0, "ic": -0.0944, "hit": 46.15, "psr": 0.4826, "bh_sharpe": 0.4262, "bh_return_pct": 2.34, "excess_sharpe": -0.5128, "precision": 0.4286, "recall": 0.0882, "f1": 0.1463, "f2": 0.1049, "accuracy": 0.4615, "mcc": -0.0657, "tp": 3, "fp": 4, "tn": 27, "fn": 31, "A_precision": 0.4286, "A_recall": 0.0882, "A_f1": 0.1463, "A_f2": 0.1049, "A_accuracy": 0.4615, "A_mcc": -0.0657, "A_tp": 3, "A_fp": 4, "A_tn": 27, "A_fn": 31}, {"fold": "fold_2", "regime": "2011 US-downgrade + EU debt", "n": 86, "A_sharpe": -3.4678, "A_sortino": -3.1954, "A_excess_sharpe": -8.3361, "A_return_pct": -17.01, "A_hit_rate": 38.82, "A_n": 86, "A_bh_sharpe": 4.8682, "A_bh_return_pct": 27.91, "A_psr": 0.0196, "A_ic": -0.0148, "B_sharpe": -2.983, "B_sortino": -3.4063, "B_excess_sharpe": -14.3021, "B_return_pct": -30.32, "B_hit_rate": 31.4, "B_n": 86, "B_bh_sharpe": 11.3191, "B_bh_return_pct": 186.84, "B_psr": 0.0554, "B_ic": 0.2459, "D_sharpe": -3.4678, "D_sortino": -3.1954, "D_excess_sharpe": -8.3361, "D_return_pct": -17.01, "D_hit_rate": 38.82, "D_n": 86, "D_bh_sharpe": 4.8682, "D_bh_return_pct": 27.91, "D_psr": 0.0196, "D_ic": -0.0148, "sharpe": -3.4678, "sortino": -3.1954, "return_pct": -17.01, "equity": 829.9, "max_dd": 0.0, "win_rate": 38.82, "profit_factor": 0.0, "ic": -0.0148, "hit": 38.82, "psr": 0.0196, "bh_sharpe": 4.8682, "bh_return_pct": 27.91, "excess_sharpe": -8.3361, "precision": 0.6667, "recall": 0.0377, "f1": 0.0714, "f2": 0.0465, "accuracy": 0.3953, "mcc": 0.0197, "tp": 2, "fp": 1, "tn": 32, "fn": 51, "A_precision": 0.6667, "A_recall": 0.0377, "A_f1": 0.0714, "A_f2": 0.0465, "A_accuracy": 0.3953, "A_mcc": 0.0197, "A_tp": 2, "A_fp": 1, "A_tn": 32, "A_fn": 51}, {"fold": "fold_3", "regime": "Taper tantrum and 2014 H1", "n": 128, "A_sharpe": -1.9415, "A_sortino": -2.0241, "A_excess_sharpe": -4.0004, "A_return_pct": -12.04, "A_hit_rate": 40.16, "A_n": 128, "A_bh_sharpe": 2.0589, "A_bh_return_pct": 13.6, "A_psr": 0.0886, "A_ic": 0.0581, "B_sharpe": -2.0202, "B_sortino": -2.0551, "B_excess_sharpe": -6.5318, "B_return_pct": -22.98, "B_hit_rate": 41.41, "B_n": 128, "B_bh_sharpe": 4.5116, "B_bh_return_pct": 67.92, "B_psr": 0.0793, "B_ic": -0.0529, "D_sharpe": -1.9415, "D_sortino": -2.0241, "D_excess_sharpe": -4.0004, "D_return_pct": -12.04, "D_hit_rate": 40.16, "D_n": 128, "D_bh_sharpe": 2.0589, "D_bh_return_pct": 13.6, "D_psr": 0.0886, "D_ic": 0.0581, "sharpe": -1.9415, "sortino": -2.0241, "return_pct": -12.04, "equity": 879.6, "max_dd": 0.0, "win_rate": 40.16, "profit_factor": 0.0, "ic": 0.0581, "hit": 40.16, "psr": 0.0886, "bh_sharpe": 2.0589, "bh_return_pct": 13.6, "excess_sharpe": -4.0004, "precision": 0.5833, "recall": 0.0897, "f1": 0.1556, "f2": 0.108, "accuracy": 0.4062, "mcc": -0.0172, "tp": 7, "fp": 5, "tn": 45, "fn": 71, "A_precision": 0.5833, "A_recall": 0.0897, "A_f1": 0.1556, "A_f2": 0.108, "A_accuracy": 0.4062, "A_mcc": -0.0172, "A_tp": 7, "A_fp": 5, "A_tn": 45, "A_fn": 71}, {"fold": "fold_4", "regime": "China devaluation and oil crash", "n": 107, "A_sharpe": 1.7343, "A_sortino": 1.827, "A_excess_sharpe": 2.5375, "A_return_pct": 15.16, "A_hit_rate": 54.72, "A_n": 107, "A_bh_sharpe": -0.8032, "A_bh_return_pct": -7.58, "A_psr": 0.8717, "A_ic": 0.0753, "B_sharpe": 0.3041, "B_sortino": 0.31, "B_excess_sharpe": 2.2637, "B_return_pct": 1.57, "B_hit_rate": 49.53, "B_n": 107, "B_bh_sharpe": -1.9596, "B_bh_return_pct": -33.47, "B_psr": 0.5782, "B_ic": 0.0641, "D_sharpe": 1.7343, "D_sortino": 1.827, "D_excess_sharpe": 2.5375, "D_return_pct": 15.16, "D_hit_rate": 54.72, "D_n": 107, "D_bh_sharpe": -0.8032, "D_bh_return_pct": -7.58, "D_psr": 0.8717, "D_ic": 0.0753, "sharpe": 1.7343, "sortino": 1.827, "return_pct": 15.16, "equity": 1151.6, "max_dd": 0.0, "win_rate": 54.72, "profit_factor": 0.0, "ic": 0.0753, "hit": 54.72, "psr": 0.8717, "bh_sharpe": -0.8032, "bh_return_pct": -7.58, "excess_sharpe": 2.5375, "precision": 0.6667, "recall": 0.1538, "f1": 0.25, "f2": 0.1818, "accuracy": 0.5514, "mcc": 0.1285, "tp": 8, "fp": 4, "tn": 51, "fn": 44, "A_precision": 0.6667, "A_recall": 0.1538, "A_f1": 0.25, "A_f2": 0.1818, "A_accuracy": 0.5514, "A_mcc": 0.1285, "A_tp": 8, "A_fp": 4, "A_tn": 51, "A_fn": 44}, {"fold": "fold_5", "regime": "2018 Vol-mageddon + Q4 sell-off", "n": 127, "A_sharpe": 0.8863, "A_sortino": 1.0335, "A_excess_sharpe": -0.2968, "A_return_pct": 9.61, "A_hit_rate": 44.09, "A_n": 127, "A_bh_sharpe": 1.183, "A_bh_return_pct": 13.55, "A_psr": 0.7347, "A_ic": 0.0958, "B_sharpe": -0.9389, "B_sortino": -0.9875, "B_excess_sharpe": -3.8445, "B_return_pct": -24.12, "B_hit_rate": 42.86, "B_n": 127, "B_bh_sharpe": 2.9056, "B_bh_return_pct": 85.51, "B_psr": 0.2545, "B_ic": -0.0123, "D_sharpe": 0.8863, "D_sortino": 1.0335, "D_excess_sharpe": -0.2968, "D_return_pct": 9.61, "D_hit_rate": 44.09, "D_n": 127, "D_bh_sharpe": 1.183, "D_bh_return_pct": 13.55, "D_psr": 0.7347, "D_ic": 0.0958, "sharpe": 0.8863, "sortino": 1.0335, "return_pct": 9.61, "equity": 1096.1000000000001, "max_dd": 0.0, "win_rate": 44.09, "profit_factor": 0.0, "ic": 0.0958, "hit": 44.09, "psr": 0.7347, "bh_sharpe": 1.183, "bh_return_pct": 13.55, "excess_sharpe": -0.2968, "precision": 0.6842, "recall": 0.1667, "f1": 0.268, "f2": 0.1964, "accuracy": 0.4409, "mcc": 0.0603, "tp": 13, "fp": 6, "tn": 43, "fn": 65, "A_precision": 0.6842, "A_recall": 0.1667, "A_f1": 0.268, "A_f2": 0.1964, "A_accuracy": 0.4409, "A_mcc": 0.0603, "A_tp": 13, "A_fp": 6, "A_tn": 43, "A_fn": 65}, {"fold": "fold_6", "regime": "COVID crash and V-recovery", "n": 172, "A_sharpe": -1.9591, "A_sortino": -2.1871, "A_excess_sharpe": -4.3867, "A_return_pct": -29.0, "A_hit_rate": 37.21, "A_n": 172, "A_bh_sharpe": 2.4276, "A_bh_return_pct": 45.89, "A_psr": 0.0615, "A_ic": 0.0231, "B_sharpe": -3.1186, "B_sortino": -3.1539, "B_excess_sharpe": -8.8306, "B_return_pct": -68.25, "B_hit_rate": 39.18, "B_n": 172, "B_bh_sharpe": 5.712, "B_bh_return_pct": 489.18, "B_psr": 0.0081, "B_ic": -0.0719, "D_sharpe": -1.9591, "D_sortino": -2.1871, "D_excess_sharpe": -4.3867, "D_return_pct": -29.0, "D_hit_rate": 37.21, "D_n": 172, "D_bh_sharpe": 2.4276, "D_bh_return_pct": 45.89, "D_psr": 0.0615, "D_ic": 0.0231, "sharpe": -1.9591, "sortino": -2.1871, "return_pct": -29.0, "equity": 710.0, "max_dd": 0.0, "win_rate": 37.21, "profit_factor": 0.0, "ic": 0.0231, "hit": 37.21, "psr": 0.0615, "bh_sharpe": 2.4276, "bh_return_pct": 45.89, "excess_sharpe": -4.3867, "precision": 0.7273, "recall": 0.0708, "f1": 0.129, "f2": 0.0864, "accuracy": 0.3721, "mcc": 0.0387, "tp": 8, "fp": 3, "tn": 56, "fn": 105, "A_precision": 0.7273, "A_recall": 0.0708, "A_f1": 0.129, "A_f2": 0.0864, "A_accuracy": 0.3721, "A_mcc": 0.0387, "A_tp": 8, "A_fp": 3, "A_tn": 56, "A_fn": 105}, {"fold": "fold_7", "regime": "Inflation bear, AI rally and 2025", "n": 375, "A_sharpe": 0.3683, "A_sortino": 0.3881, "A_excess_sharpe": -0.4222, "A_return_pct": 8.89, "A_hit_rate": 45.33, "A_n": 375, "A_bh_sharpe": 0.7905, "A_bh_return_pct": 25.44, "A_psr": 0.6713, "A_ic": 0.0831, "B_sharpe": 0.3244, "B_sortino": 0.403, "B_excess_sharpe": -1.6094, "B_return_pct": 6.8, "B_hit_rate": 41.98, "B_n": 375, "B_bh_sharpe": 1.9338, "B_bh_return_pct": 221.94, "B_psr": 0.6548, "B_ic": 0.079, "D_sharpe": 0.3683, "D_sortino": 0.3881, "D_excess_sharpe": -0.4222, "D_return_pct": 8.89, "D_hit_rate": 45.33, "D_n": 375, "D_bh_sharpe": 0.7905, "D_bh_return_pct": 25.44, "D_psr": 0.6713, "D_ic": 0.0831, "sharpe": 0.3683, "sortino": 0.3881, "return_pct": 8.89, "equity": 1088.9, "max_dd": 0.0, "win_rate": 45.33, "profit_factor": 0.0, "ic": 0.0831, "hit": 45.33, "psr": 0.6713, "bh_sharpe": 0.7905, "bh_return_pct": 25.44, "excess_sharpe": -0.4222, "precision": 0.6, "recall": 0.2045, "f1": 0.3051, "f2": 0.2356, "accuracy": 0.4533, "mcc": 0.0135, "tp": 45, "fp": 30, "tn": 125, "fn": 175, "A_precision": 0.6, "A_recall": 0.2045, "A_f1": 0.3051, "A_f2": 0.2356, "A_accuracy": 0.4533, "A_mcc": 0.0135, "A_tp": 45, "A_fp": 30, "A_tn": 125, "A_fn": 175}], "per_window_val": [{"fold": "fold_1", "regime": "GFC peak crash (Lehman + Mar-2009 bottom)", "n": 37, "A_sharpe": 1.7444, "A_sortino": 1.9677, "A_excess_sharpe": 0.9859, "A_return_pct": 6.22, "A_hit_rate": 48.57, "A_n": 37, "A_bh_sharpe": 0.7585, "A_bh_return_pct": 2.39, "A_psr": 0.7483, "A_ic": 0.1698, "B_sharpe": -0.3699, "B_sortino": -0.3525, "B_excess_sharpe": -2.5146, "B_return_pct": -3.35, "B_hit_rate": 54.05, "B_n": 37, "B_bh_sharpe": 2.1447, "B_bh_return_pct": 12.13, "B_psr": 0.4445, "B_ic": 0.1505, "D_sharpe": 1.7444, "D_sortino": 1.9677, "D_excess_sharpe": 0.9859, "D_return_pct": 6.22, "D_hit_rate": 48.57, "D_n": 37, "D_bh_sharpe": 0.7585, "D_bh_return_pct": 2.39, "D_psr": 0.7483, "D_ic": 0.1698, "sharpe": 1.7444, "sortino": 1.9677, "return_pct": 6.22, "equity": 1062.2, "max_dd": 0.0, "win_rate": 48.57, "profit_factor": 0.0, "ic": 0.1698, "hit": 48.57, "psr": 0.7483, "bh_sharpe": 0.7585, "bh_return_pct": 2.39, "excess_sharpe": 0.9859}, {"fold": "fold_2", "regime": "2011 US-downgrade + EU debt", "n": 46, "A_sharpe": 0.2181, "A_sortino": 0.2502, "A_excess_sharpe": 0.272, "A_return_pct": 0.28, "A_hit_rate": 45.65, "A_n": 46, "A_bh_sharpe": -0.0539, "A_bh_return_pct": -1.46, "A_psr": 0.5368, "A_ic": 0.1435, "B_sharpe": 3.5949, "B_sortino": 4.0555, "B_excess_sharpe": 5.1362, "B_return_pct": 54.26, "B_hit_rate": 56.52, "B_n": 46, "B_bh_sharpe": -1.5413, "B_bh_return_pct": -23.36, "B_psr": 0.9357, "B_ic": 0.1513, "D_sharpe": 0.2181, "D_sortino": 0.2502, "D_excess_sharpe": 0.272, "D_return_pct": 0.28, "D_hit_rate": 45.65, "D_n": 46, "D_bh_sharpe": -0.0539, "D_bh_return_pct": -1.46, "D_psr": 0.5368, "D_ic": 0.1435, "sharpe": 0.2181, "sortino": 0.2502, "return_pct": 0.28, "equity": 1002.8, "max_dd": 0.0, "win_rate": 45.65, "profit_factor": 0.0, "ic": 0.1435, "hit": 45.65, "psr": 0.5368, "bh_sharpe": -0.0539, "bh_return_pct": -1.46, "excess_sharpe": 0.272}, {"fold": "fold_3", "regime": "Taper tantrum and 2014 H1", "n": 4, "A_sharpe": -6.3226, "A_sortino": -4.4732, "A_excess_sharpe": -12.6451, "A_return_pct": -0.58, "A_hit_rate": 50.0, "A_n": 4, "A_bh_sharpe": 6.3226, "A_bh_return_pct": 0.58, "A_psr": 0.227, "A_ic": -0.8, "B_sharpe": 23.4413, "B_sortino": 0.0, "B_excess_sharpe": 46.8826, "B_return_pct": 3.19, "B_hit_rate": 100.0, "B_n": 4, "B_bh_sharpe": -23.4413, "B_bh_return_pct": -3.13, "B_psr": 1.0, "B_ic": -0.2, "D_sharpe": -6.3226, "D_sortino": -4.4732, "D_excess_sharpe": -12.6451, "D_return_pct": -0.58, "D_hit_rate": 50.0, "D_n": 4, "D_bh_sharpe": 6.3226, "D_bh_return_pct": 0.58, "D_psr": 0.227, "D_ic": -0.8, "sharpe": -6.3226, "sortino": -4.4732, "return_pct": -0.58, "equity": 994.1999999999999, "max_dd": 0.0, "win_rate": 50.0, "profit_factor": 0.0, "ic": -0.8, "hit": 50.0, "psr": 0.227, "bh_sharpe": 6.3226, "bh_return_pct": 0.58, "excess_sharpe": -12.6451}, {"fold": "fold_4", "regime": "China devaluation and oil crash", "n": 46, "A_sharpe": -0.5924, "A_sortino": -0.4924, "A_excess_sharpe": 0.6098, "A_return_pct": -3.12, "A_hit_rate": 56.52, "A_n": 46, "A_bh_sharpe": -1.2022, "A_bh_return_pct": -5.68, "A_psr": 0.3998, "A_ic": 0.089, "B_sharpe": -0.0998, "B_sortino": -0.0742, "B_excess_sharpe": 2.212, "B_return_pct": -4.34, "B_hit_rate": 60.87, "B_n": 46, "B_bh_sharpe": -2.3118, "B_bh_return_pct": -24.51, "B_psr": 0.4831, "B_ic": 0.2168, "D_sharpe": -0.5924, "D_sortino": -0.4924, "D_excess_sharpe": 0.6098, "D_return_pct": -3.12, "D_hit_rate": 56.52, "D_n": 46, "D_bh_sharpe": -1.2022, "D_bh_return_pct": -5.68, "D_psr": 0.3998, "D_ic": 0.089, "sharpe": -0.5924, "sortino": -0.4924, "return_pct": -3.12, "equity": 968.8, "max_dd": 0.0, "win_rate": 56.52, "profit_factor": 0.0, "ic": 0.089, "hit": 56.52, "psr": 0.3998, "bh_sharpe": -1.2022, "bh_return_pct": -5.68, "excess_sharpe": 0.6098}, {"fold": "fold_5", "regime": "2018 Vol-mageddon + Q4 sell-off", "n": 4, "A_sharpe": 14.7551, "A_sortino": 18.4635, "A_excess_sharpe": 29.5102, "A_return_pct": 0.0, "A_hit_rate": 0.0, "A_n": 4, "A_bh_sharpe": -14.7551, "A_bh_return_pct": -3.52, "A_psr": 0.9192, "A_ic": -0.8, "B_sharpe": -2.1566, "B_sortino": -2.0033, "B_excess_sharpe": -4.3132, "B_return_pct": -1.41, "B_hit_rate": 50.0, "B_n": 4, "B_bh_sharpe": 2.1566, "B_bh_return_pct": 1.19, "B_psr": 0.4075, "B_ic": 0.6, "D_sharpe": 14.7551, "D_sortino": 18.4635, "D_excess_sharpe": 29.5102, "D_return_pct": 0.0, "D_hit_rate": 0.0, "D_n": 4, "D_bh_sharpe": -14.7551, "D_bh_return_pct": -3.52, "D_psr": 0.9192, "D_ic": -0.8, "sharpe": 14.7551, "sortino": 18.4635, "return_pct": 0.0, "equity": 1000.0, "max_dd": 0.0, "win_rate": 0.0, "profit_factor": 0.0, "ic": -0.8, "hit": 0.0, "psr": 0.9192, "bh_sharpe": -14.7551, "bh_return_pct": -3.52, "excess_sharpe": 29.5102}, {"fold": "fold_6", "regime": "COVID crash and V-recovery", "n": 25, "A_sharpe": -2.4138, "A_sortino": -2.536, "A_excess_sharpe": -4.8276, "A_return_pct": -3.36, "A_hit_rate": 40.0, "A_n": 25, "A_bh_sharpe": 2.4138, "A_bh_return_pct": 3.27, "A_psr": 0.2373, "A_ic": -0.1562, "B_sharpe": -6.7657, "B_sortino": -6.312, "B_excess_sharpe": -19.3312, "B_return_pct": -16.97, "B_hit_rate": 28.0, "B_n": 25, "B_bh_sharpe": 12.5655, "B_bh_return_pct": 32.76, "B_psr": 0.0339, "B_ic": 0.0969, "D_sharpe": -2.4138, "D_sortino": -2.536, "D_excess_sharpe": -4.8276, "D_return_pct": -3.36, "D_hit_rate": 40.0, "D_n": 25, "D_bh_sharpe": 2.4138, "D_bh_return_pct": 3.27, "D_psr": 0.2373, "D_ic": -0.1562, "sharpe": -2.4138, "sortino": -2.536, "return_pct": -3.36, "equity": 966.4000000000001, "max_dd": 0.0, "win_rate": 40.0, "profit_factor": 0.0, "ic": -0.1562, "hit": 40.0, "psr": 0.2373, "bh_sharpe": 2.4138, "bh_return_pct": 3.27, "excess_sharpe": -4.8276}, {"fold": "fold_7", "regime": "Inflation bear, AI rally and 2025", "n": 64, "A_sharpe": -0.6016, "A_sortino": -0.5601, "A_excess_sharpe": -2.6425, "A_return_pct": -2.63, "A_hit_rate": 51.56, "A_n": 64, "A_bh_sharpe": 2.0409, "A_bh_return_pct": 7.94, "A_psr": 0.3814, "A_ic": -0.0149, "B_sharpe": -1.4447, "B_sortino": -1.5286, "B_excess_sharpe": -6.8539, "B_return_pct": -11.32, "B_hit_rate": 42.19, "B_n": 64, "B_bh_sharpe": 5.4092, "B_bh_return_pct": 45.7, "B_psr": 0.239, "B_ic": -0.0436, "D_sharpe": -0.6016, "D_sortino": -0.5601, "D_excess_sharpe": -2.6425, "D_return_pct": -2.63, "D_hit_rate": 51.56, "D_n": 64, "D_bh_sharpe": 2.0409, "D_bh_return_pct": 7.94, "D_psr": 0.3814, "D_ic": -0.0149, "sharpe": -0.6016, "sortino": -0.5601, "return_pct": -2.63, "equity": 973.7, "max_dd": 0.0, "win_rate": 51.56, "profit_factor": 0.0, "ic": -0.0149, "hit": 51.56, "psr": 0.3814, "bh_sharpe": 2.0409, "bh_return_pct": 7.94, "excess_sharpe": -2.6425}], "status": "DISCARD", "precision": 0.6187, "recall": 0.1369, "f1": 0.2243, "f2": 0.1622, "accuracy": 0.4387, "mcc": 0.0208, "tp": 86, "fp": 53, "tn": 379, "fn": 542, "test_sharpe": -0.2715, "A_sharpe": -0.2715, "A_excess_sharpe": -1.4916, "A_return_pct": -30.64, "A_precision": 0.6187, "A_recall": 0.1369, "A_f1": 0.2243, "A_f2": 0.1622, "A_accuracy": 0.4387, "A_mcc": 0.0208, "A_tp": 86, "A_fp": 53, "A_tn": 379, "A_fn": 542, "A_psr": 0.2887, "A_ic": 0.0391, "A_hit_rate": 43.71, "A_bh_sharpe": 1.2201, "A_bh_return_pct": 185.59}
