{"experiment_num": 20, "backbone": "mamba", "description": "dMamba @ FX-Mamba-winner config seed=99 \u2014 3rd seed for stable champion declaration (seeds 42=+0.86, 0=+0.02)", "config": {"seq_len": 60, "lr": 0.0005, "batch_size": 32, "epochs": 100, "weight_decay": 0.1, "patience": 20, "warmup_epochs": 10, "head_dropout": 0.1, "huber_delta": 1.0, "grad_clip": 1.0, "seed": 99, "hidden_size": null, "num_layers": null, "max_depth": null, "gbm_lr": null, "n_estimators": null}, "composite": -0.862, "test_pos_folds": 3, "val_pos_folds": 5, "val_loss": -2.8568781076279364, "elapsed_sec": 705.3, "timestamp": "2026-04-26T22:50:11", "sharpe": -0.462, "val_sharpe": 1.3122, "ic": 0.0467, "hit": 43.33, "psr": 0.1748, "equity": 579.3, "return_pct": -42.07, "bh_sharpe": 1.2201, "bh_return_pct": 185.59, "excess_sharpe": -1.6821, "B_sharpe": 0.5658, "B_excess_sharpe": -2.2726, "B_return_pct": 92.56, "D_sharpe": -0.462, "D_excess_sharpe": -1.6821, "D_return_pct": -42.07, "per_window": [{"fold": "fold_1", "regime": "GFC peak crash (Lehman + Mar-2009 bottom)", "n": 65, "A_sharpe": 0.8359, "A_sortino": 0.8649, "A_excess_sharpe": 0.4097, "A_return_pct": 6.48, "A_hit_rate": 50.77, "A_n": 65, "A_bh_sharpe": 0.4262, "A_bh_return_pct": 2.34, "A_psr": 0.6634, "A_ic": 0.1087, "B_sharpe": 3.2612, "B_sortino": 3.8898, "B_excess_sharpe": 1.3736, "B_return_pct": 74.83, "B_hit_rate": 53.12, "B_n": 65, "B_bh_sharpe": 1.8877, "B_bh_return_pct": 34.48, "B_psr": 0.9522, "B_ic": 0.0642, "D_sharpe": 0.8359, "D_sortino": 0.8649, "D_excess_sharpe": 0.4097, "D_return_pct": 6.48, "D_hit_rate": 50.77, "D_n": 65, "D_bh_sharpe": 0.4262, "D_bh_return_pct": 2.34, "D_psr": 0.6634, "D_ic": 0.1087, "sharpe": 0.8359, "sortino": 0.8649, "return_pct": 6.48, "equity": 1064.8, "max_dd": 0.0, "win_rate": 50.77, "profit_factor": 0.0, "ic": 0.1087, "hit": 50.77, "psr": 0.6634, "bh_sharpe": 0.4262, "bh_return_pct": 2.34, "excess_sharpe": 0.4097, "precision": 0.5263, "recall": 0.5882, "f1": 0.5556, "f2": 0.5747, "accuracy": 0.5077, "mcc": 0.0077, "tp": 20, "fp": 18, "tn": 13, "fn": 14, "A_precision": 0.5263, "A_recall": 0.5882, "A_f1": 0.5556, "A_f2": 0.5747, "A_accuracy": 0.5077, "A_mcc": 0.0077, "A_tp": 20, "A_fp": 18, "A_tn": 13, "A_fn": 14}, {"fold": "fold_2", "regime": "2011 US-downgrade + EU debt", "n": 86, "A_sharpe": -4.0766, "A_sortino": -3.5376, "A_excess_sharpe": -8.9448, "A_return_pct": -19.48, "A_hit_rate": 38.82, "A_n": 86, "A_bh_sharpe": 4.8682, "A_bh_return_pct": 27.91, "A_psr": 0.0047, "A_ic": 0.1001, "B_sharpe": 3.8109, "B_sortino": 3.8445, "B_excess_sharpe": -7.5082, "B_return_pct": 50.96, "B_hit_rate": 63.95, "B_n": 86, "B_bh_sharpe": 11.3191, "B_bh_return_pct": 186.84, "B_psr": 0.987, "B_ic": 0.1112, "D_sharpe": -4.0766, "D_sortino": -3.5376, "D_excess_sharpe": -8.9448, "D_return_pct": -19.48, "D_hit_rate": 38.82, "D_n": 86, "D_bh_sharpe": 4.8682, "D_bh_return_pct": 27.91, "D_psr": 0.0047, "D_ic": 0.1001, "sharpe": -4.0766, "sortino": -3.5376, "return_pct": -19.48, "equity": 805.2, "max_dd": 0.0, "win_rate": 38.82, "profit_factor": 0.0, "ic": 0.1001, "hit": 38.82, "psr": 0.0047, "bh_sharpe": 4.8682, "bh_return_pct": 27.91, "excess_sharpe": -8.9448, "precision": 1.0, "recall": 0.0189, "f1": 0.037, "f2": 0.0235, "accuracy": 0.3953, "mcc": 0.0856, "tp": 1, "fp": 0, "tn": 33, "fn": 52, "A_precision": 1.0, "A_recall": 0.0189, "A_f1": 0.037, "A_f2": 0.0235, "A_accuracy": 0.3953, "A_mcc": 0.0856, "A_tp": 1, "A_fp": 0, "A_tn": 33, "A_fn": 52}, {"fold": "fold_3", "regime": "Taper tantrum and 2014 H1", "n": 128, "A_sharpe": -1.9342, "A_sortino": -2.19, "A_excess_sharpe": -3.9931, "A_return_pct": -12.0, "A_hit_rate": 39.37, "A_n": 128, "A_bh_sharpe": 2.0589, "A_bh_return_pct": 13.6, "A_psr": 0.0995, "A_ic": 0.0292, "B_sharpe": -0.1897, "B_sortino": -0.1908, "B_excess_sharpe": -4.7012, "B_return_pct": -3.74, "B_hit_rate": 50.0, "B_n": 128, "B_bh_sharpe": 4.5116, "B_bh_return_pct": 67.92, "B_psr": 0.4465, "B_ic": -0.1475, "D_sharpe": -1.9342, "D_sortino": -2.19, "D_excess_sharpe": -3.9931, "D_return_pct": -12.0, "D_hit_rate": 39.37, "D_n": 128, "D_bh_sharpe": 2.0589, "D_bh_return_pct": 13.6, "D_psr": 0.0995, "D_ic": 0.0292, "sharpe": -1.9342, "sortino": -2.19, "return_pct": -12.0, "equity": 880.0, "max_dd": 0.0, "win_rate": 39.37, "profit_factor": 0.0, "ic": 0.0292, "hit": 39.37, "psr": 0.0995, "bh_sharpe": 2.0589, "bh_return_pct": 13.6, "excess_sharpe": -3.9931, "precision": 1.0, "recall": 0.0128, "f1": 0.0253, "f2": 0.016, "accuracy": 0.3984, "mcc": 0.071, "tp": 1, "fp": 0, "tn": 50, "fn": 77, "A_precision": 1.0, "A_recall": 0.0128, "A_f1": 0.0253, "A_f2": 0.016, "A_accuracy": 0.3984, "A_mcc": 0.071, "A_tp": 1, "A_fp": 0, "A_tn": 50, "A_fn": 77}, {"fold": "fold_4", "regime": "China devaluation and oil crash", "n": 107, "A_sharpe": -0.9373, "A_sortino": -0.8967, "A_excess_sharpe": -0.1341, "A_return_pct": -8.64, "A_hit_rate": 49.06, "A_n": 107, "A_bh_sharpe": -0.8032, "A_bh_return_pct": -7.58, "A_psr": 0.2718, "A_ic": 0.0905, "B_sharpe": -0.546, "B_sortino": -0.5546, "B_excess_sharpe": 1.4136, "B_return_pct": -13.42, "B_hit_rate": 45.79, "B_n": 107, "B_bh_sharpe": -1.9596, "B_bh_return_pct": -33.47, "B_psr": 0.3617, "B_ic": -0.0732, "D_sharpe": -0.9373, "D_sortino": -0.8967, "D_excess_sharpe": -0.1341, "D_return_pct": -8.64, "D_hit_rate": 49.06, "D_n": 107, "D_bh_sharpe": -0.8032, "D_bh_return_pct": -7.58, "D_psr": 0.2718, "D_ic": 0.0905, "sharpe": -0.9373, "sortino": -0.8967, "return_pct": -8.64, "equity": 913.6, "max_dd": 0.0, "win_rate": 49.06, "profit_factor": 0.0, "ic": 0.0905, "hit": 49.06, "psr": 0.2718, "bh_sharpe": -0.8032, "bh_return_pct": -7.58, "excess_sharpe": -0.1341, "precision": 0.3333, "recall": 0.0385, "f1": 0.069, "f2": 0.0467, "accuracy": 0.4953, "mcc": -0.0744, "tp": 2, "fp": 4, "tn": 51, "fn": 50, "A_precision": 0.3333, "A_recall": 0.0385, "A_f1": 0.069, "A_f2": 0.0467, "A_accuracy": 0.4953, "A_mcc": -0.0744, "A_tp": 2, "A_fp": 4, "A_tn": 51, "A_fn": 50}, {"fold": "fold_5", "regime": "2018 Vol-mageddon + Q4 sell-off", "n": 127, "A_sharpe": 1.732, "A_sortino": 2.3855, "A_excess_sharpe": 0.549, "A_return_pct": 21.18, "A_hit_rate": 43.31, "A_n": 127, "A_bh_sharpe": 1.183, "A_bh_return_pct": 13.55, "A_psr": 0.9006, "A_ic": 0.1049, "B_sharpe": 1.3716, "B_sortino": 1.4013, "B_excess_sharpe": -1.534, "B_return_pct": 30.61, "B_hit_rate": 54.76, "B_n": 127, "B_bh_sharpe": 2.9056, "B_bh_return_pct": 85.51, "B_psr": 0.8336, "B_ic": 0.0351, "D_sharpe": 1.732, "D_sortino": 2.3855, "D_excess_sharpe": 0.549, "D_return_pct": 21.18, "D_hit_rate": 43.31, "D_n": 127, "D_bh_sharpe": 1.183, "D_bh_return_pct": 13.55, "D_psr": 0.9006, "D_ic": 0.1049, "sharpe": 1.732, "sortino": 2.3855, "return_pct": 21.18, "equity": 1211.8, "max_dd": 0.0, "win_rate": 43.31, "profit_factor": 0.0, "ic": 0.1049, "hit": 43.31, "psr": 0.9006, "bh_sharpe": 1.183, "bh_return_pct": 13.55, "excess_sharpe": 0.549, "precision": 0.7143, "recall": 0.1282, "f1": 0.2174, "f2": 0.1534, "accuracy": 0.4331, "mcc": 0.0724, "tp": 10, "fp": 4, "tn": 45, "fn": 68, "A_precision": 0.7143, "A_recall": 0.1282, "A_f1": 0.2174, "A_f2": 0.1534, "A_accuracy": 0.4331, "A_mcc": 0.0724, "A_tp": 10, "A_fp": 4, "A_tn": 45, "A_fn": 68}, {"fold": "fold_6", "regime": "COVID crash and V-recovery", "n": 172, "A_sharpe": -2.0734, "A_sortino": -2.2022, "A_excess_sharpe": -4.501, "A_return_pct": -30.3, "A_hit_rate": 39.53, "A_n": 172, "A_bh_sharpe": 2.4276, "A_bh_return_pct": 45.89, "A_psr": 0.0504, "A_ic": 0.0487, "B_sharpe": 0.1884, "B_sortino": 0.2098, "B_excess_sharpe": -5.5236, "B_return_pct": -2.15, "B_hit_rate": 46.78, "B_n": 172, "B_bh_sharpe": 5.712, "B_bh_return_pct": 489.18, "B_psr": 0.5618, "B_ic": -0.0161, "D_sharpe": -2.0734, "D_sortino": -2.2022, "D_excess_sharpe": -4.501, "D_return_pct": -30.3, "D_hit_rate": 39.53, "D_n": 172, "D_bh_sharpe": 2.4276, "D_bh_return_pct": 45.89, "D_psr": 0.0504, "D_ic": 0.0487, "sharpe": -2.0734, "sortino": -2.2022, "return_pct": -30.3, "equity": 697.0000000000001, "max_dd": 0.0, "win_rate": 39.53, "profit_factor": 0.0, "ic": 0.0487, "hit": 39.53, "psr": 0.0504, "bh_sharpe": 2.4276, "bh_return_pct": 45.89, "excess_sharpe": -4.501, "precision": 0.6957, "recall": 0.1416, "f1": 0.2353, "f2": 0.1684, "accuracy": 0.3953, "mcc": 0.032, "tp": 16, "fp": 7, "tn": 52, "fn": 97, "A_precision": 0.6957, "A_recall": 0.1416, "A_f1": 0.2353, "A_f2": 0.1684, "A_accuracy": 0.3953, "A_mcc": 0.032, "A_tp": 16, "A_fp": 7, "A_tn": 52, "A_fn": 97}, {"fold": "fold_7", "regime": "Inflation bear, AI rally and 2025", "n": 375, "A_sharpe": 0.0962, "A_sortino": 0.1152, "A_excess_sharpe": -0.6943, "A_return_pct": -0.49, "A_hit_rate": 44.53, "A_n": 375, "A_bh_sharpe": 0.7905, "A_bh_return_pct": 25.44, "A_psr": 0.5469, "A_ic": 0.0188, "B_sharpe": -0.3141, "B_sortino": -0.3328, "B_excess_sharpe": -2.2478, "B_return_pct": -31.5, "B_hit_rate": 47.59, "B_n": 375, "B_bh_sharpe": 1.9338, "B_bh_return_pct": 221.94, "B_psr": 0.3517, "B_ic": -0.0908, "D_sharpe": 0.0962, "D_sortino": 0.1152, "D_excess_sharpe": -0.6943, "D_return_pct": -0.49, "D_hit_rate": 44.53, "D_n": 375, "D_bh_sharpe": 0.7905, "D_bh_return_pct": 25.44, "D_psr": 0.5469, "D_ic": 0.0188, "sharpe": 0.0962, "sortino": 0.1152, "return_pct": -0.49, "equity": 995.1, "max_dd": 0.0, "win_rate": 44.53, "profit_factor": 0.0, "ic": 0.0188, "hit": 44.53, "psr": 0.5469, "bh_sharpe": 0.7905, "bh_return_pct": 25.44, "excess_sharpe": -0.6943, "precision": 0.5698, "recall": 0.2227, "f1": 0.3203, "f2": 0.2536, "accuracy": 0.4453, "mcc": -0.0187, "tp": 49, "fp": 37, "tn": 118, "fn": 171, "A_precision": 0.5698, "A_recall": 0.2227, "A_f1": 0.3203, "A_f2": 0.2536, "A_accuracy": 0.4453, "A_mcc": -0.0187, "A_tp": 49, "A_fp": 37, "A_tn": 118, "A_fn": 171}], "per_window_val": [{"fold": "fold_1", "regime": "GFC peak crash (Lehman + Mar-2009 bottom)", "n": 37, "A_sharpe": 0.9149, "A_sortino": 1.081, "A_excess_sharpe": 0.1565, "A_return_pct": 3.0, "A_hit_rate": 45.71, "A_n": 37, "A_bh_sharpe": 0.7585, "A_bh_return_pct": 2.39, "A_psr": 0.6373, "A_ic": 0.0464, "B_sharpe": 3.5887, "B_sortino": 3.5463, "B_excess_sharpe": 1.444, "B_return_pct": 21.69, "B_hit_rate": 64.86, "B_n": 37, "B_bh_sharpe": 2.1447, "B_bh_return_pct": 12.13, "B_psr": 0.9115, "B_ic": 0.3241, "D_sharpe": 0.9149, "D_sortino": 1.081, "D_excess_sharpe": 0.1565, "D_return_pct": 3.0, "D_hit_rate": 45.71, "D_n": 37, "D_bh_sharpe": 0.7585, "D_bh_return_pct": 2.39, "D_psr": 0.6373, "D_ic": 0.0464, "sharpe": 0.9149, "sortino": 1.081, "return_pct": 3.0, "equity": 1030.0, "max_dd": 0.0, "win_rate": 45.71, "profit_factor": 0.0, "ic": 0.0464, "hit": 45.71, "psr": 0.6373, "bh_sharpe": 0.7585, "bh_return_pct": 2.39, "excess_sharpe": 0.1565}, {"fold": "fold_2", "regime": "2011 US-downgrade + EU debt", "n": 46, "A_sharpe": 2.1133, "A_sortino": 3.0301, "A_excess_sharpe": 2.1672, "A_return_pct": 13.08, "A_hit_rate": 45.65, "A_n": 46, "A_bh_sharpe": -0.0539, "A_bh_return_pct": -1.46, "A_psr": 0.8281, "A_ic": -0.0508, "B_sharpe": -0.0118, "B_sortino": -0.0118, "B_excess_sharpe": 1.5295, "B_return_pct": -5.34, "B_hit_rate": 45.65, "B_n": 46, "B_bh_sharpe": -1.5413, "B_bh_return_pct": -23.36, "B_psr": 0.498, "B_ic": 0.3681, "D_sharpe": 2.1133, "D_sortino": 3.0301, "D_excess_sharpe": 2.1672, "D_return_pct": 13.08, "D_hit_rate": 45.65, "D_n": 46, "D_bh_sharpe": -0.0539, "D_bh_return_pct": -1.46, "D_psr": 0.8281, "D_ic": -0.0508, "sharpe": 2.1133, "sortino": 3.0301, "return_pct": 13.08, "equity": 1130.8, "max_dd": 0.0, "win_rate": 45.65, "profit_factor": 0.0, "ic": -0.0508, "hit": 45.65, "psr": 0.8281, "bh_sharpe": -0.0539, "bh_return_pct": -1.46, "excess_sharpe": 2.1672}, {"fold": "fold_3", "regime": "Taper tantrum and 2014 H1", "n": 4, "A_sharpe": -6.3226, "A_sortino": -4.4732, "A_excess_sharpe": -12.6451, "A_return_pct": -0.58, "A_hit_rate": 50.0, "A_n": 4, "A_bh_sharpe": 6.3226, "A_bh_return_pct": 0.58, "A_psr": 0.227, "A_ic": 0.2, "B_sharpe": 0.9274, "B_sortino": 0.9765, "B_excess_sharpe": 24.3687, "B_return_pct": 0.2, "B_hit_rate": 50.0, "B_n": 4, "B_bh_sharpe": -23.4413, "B_bh_return_pct": -3.13, "B_psr": 0.5403, "B_ic": 0.4, "D_sharpe": -6.3226, "D_sortino": -4.4732, "D_excess_sharpe": -12.6451, "D_return_pct": -0.58, "D_hit_rate": 50.0, "D_n": 4, "D_bh_sharpe": 6.3226, "D_bh_return_pct": 0.58, "D_psr": 0.227, "D_ic": 0.2, "sharpe": -6.3226, "sortino": -4.4732, "return_pct": -0.58, "equity": 994.1999999999999, "max_dd": 0.0, "win_rate": 50.0, "profit_factor": 0.0, "ic": 0.2, "hit": 50.0, "psr": 0.227, "bh_sharpe": 6.3226, "bh_return_pct": 0.58, "excess_sharpe": -12.6451}, {"fold": "fold_4", "regime": "China devaluation and oil crash", "n": 46, "A_sharpe": 1.2022, "A_sortino": 1.2517, "A_excess_sharpe": 2.4043, "A_return_pct": 4.89, "A_hit_rate": 54.35, "A_n": 46, "A_bh_sharpe": -1.2022, "A_bh_return_pct": -5.68, "A_psr": 0.6945, "A_ic": 0.0378, "B_sharpe": -1.8842, "B_sortino": -1.5406, "B_excess_sharpe": 0.4276, "B_return_pct": -21.03, "B_hit_rate": 50.0, "B_n": 46, "B_bh_sharpe": -2.3118, "B_bh_return_pct": -24.51, "B_psr": 0.195, "B_ic": 0.3014, "D_sharpe": 1.2022, "D_sortino": 1.2517, "D_excess_sharpe": 2.4043, "D_return_pct": 4.89, "D_hit_rate": 54.35, "D_n": 46, "D_bh_sharpe": -1.2022, "D_bh_return_pct": -5.68, "D_psr": 0.6945, "D_ic": 0.0378, "sharpe": 1.2022, "sortino": 1.2517, "return_pct": 4.89, "equity": 1048.8999999999999, "max_dd": 0.0, "win_rate": 54.35, "profit_factor": 0.0, "ic": 0.0378, "hit": 54.35, "psr": 0.6945, "bh_sharpe": -1.2022, "bh_return_pct": -5.68, "excess_sharpe": 2.4043}, {"fold": "fold_5", "regime": "2018 Vol-mageddon + Q4 sell-off", "n": 4, "A_sharpe": 14.7551, "A_sortino": 18.4635, "A_excess_sharpe": 29.5102, "A_return_pct": 0.0, "A_hit_rate": 0.0, "A_n": 4, "A_bh_sharpe": -14.7551, "A_bh_return_pct": -3.52, "A_psr": 0.9192, "A_ic": 0.4, "B_sharpe": 25.4133, "B_sortino": 0.0, "B_excess_sharpe": 23.2567, "B_return_pct": 8.44, "B_hit_rate": 100.0, "B_n": 4, "B_bh_sharpe": 2.1566, "B_bh_return_pct": 1.19, "B_psr": 1.0, "B_ic": 0.8, "D_sharpe": 14.7551, "D_sortino": 18.4635, "D_excess_sharpe": 29.5102, "D_return_pct": 0.0, "D_hit_rate": 0.0, "D_n": 4, "D_bh_sharpe": -14.7551, "D_bh_return_pct": -3.52, "D_psr": 0.9192, "D_ic": 0.4, "sharpe": 14.7551, "sortino": 18.4635, "return_pct": 0.0, "equity": 1000.0, "max_dd": 0.0, "win_rate": 0.0, "profit_factor": 0.0, "ic": 0.4, "hit": 0.0, "psr": 0.9192, "bh_sharpe": -14.7551, "bh_return_pct": -3.52, "excess_sharpe": 29.5102}, {"fold": "fold_6", "regime": "COVID crash and V-recovery", "n": 25, "A_sharpe": -2.4138, "A_sortino": -2.536, "A_excess_sharpe": -4.8276, "A_return_pct": -3.36, "A_hit_rate": 40.0, "A_n": 25, "A_bh_sharpe": 2.4138, "A_bh_return_pct": 3.27, "A_psr": 0.2373, "A_ic": -0.0846, "B_sharpe": 4.6822, "B_sortino": 5.3304, "B_excess_sharpe": -7.8833, "B_return_pct": 13.52, "B_hit_rate": 60.0, "B_n": 25, "B_bh_sharpe": 12.5655, "B_bh_return_pct": 32.76, "B_psr": 0.9251, "B_ic": 0.5015, "D_sharpe": -2.4138, "D_sortino": -2.536, "D_excess_sharpe": -4.8276, "D_return_pct": -3.36, "D_hit_rate": 40.0, "D_n": 25, "D_bh_sharpe": 2.4138, "D_bh_return_pct": 3.27, "D_psr": 0.2373, "D_ic": -0.0846, "sharpe": -2.4138, "sortino": -2.536, "return_pct": -3.36, "equity": 966.4000000000001, "max_dd": 0.0, "win_rate": 40.0, "profit_factor": 0.0, "ic": -0.0846, "hit": 40.0, "psr": 0.2373, "bh_sharpe": 2.4138, "bh_return_pct": 3.27, "excess_sharpe": -4.8276}, {"fold": "fold_7", "regime": "Inflation bear, AI rally and 2025", "n": 64, "A_sharpe": 1.62, "A_sortino": 1.8465, "A_excess_sharpe": -0.4209, "A_return_pct": 6.2, "A_hit_rate": 51.56, "A_n": 64, "A_bh_sharpe": 2.0409, "A_bh_return_pct": 7.94, "A_psr": 0.7955, "A_ic": 0.0683, "B_sharpe": -0.2864, "B_sortino": -0.2632, "B_excess_sharpe": -5.6955, "B_return_pct": -3.24, "B_hit_rate": 54.69, "B_n": 64, "B_bh_sharpe": 5.4092, "B_bh_return_pct": 45.7, "B_psr": 0.443, "B_ic": -0.1365, "D_sharpe": 1.62, "D_sortino": 1.8465, "D_excess_sharpe": -0.4209, "D_return_pct": 6.2, "D_hit_rate": 51.56, "D_n": 64, "D_bh_sharpe": 2.0409, "D_bh_return_pct": 7.94, "D_psr": 0.7955, "D_ic": 0.0683, "sharpe": 1.62, "sortino": 1.8465, "return_pct": 6.2, "equity": 1062.0, "max_dd": 0.0, "win_rate": 51.56, "profit_factor": 0.0, "ic": 0.0683, "hit": 51.56, "psr": 0.7955, "bh_sharpe": 2.0409, "bh_return_pct": 7.94, "excess_sharpe": -0.4209}], "status": "DISCARD", "precision": 0.5858, "recall": 0.1576, "f1": 0.2484, "f2": 0.1846, "accuracy": 0.4349, "mcc": -0.0059, "tp": 99, "fp": 70, "tn": 362, "fn": 529, "test_sharpe": -0.462, "A_sharpe": -0.462, "A_excess_sharpe": -1.6821, "A_return_pct": -42.07, "A_precision": 0.5858, "A_recall": 0.1576, "A_f1": 0.2484, "A_f2": 0.1846, "A_accuracy": 0.4349, "A_mcc": -0.0059, "A_tp": 99, "A_fp": 70, "A_tn": 362, "A_fn": 529, "A_psr": 0.1748, "A_ic": 0.0467, "A_hit_rate": 43.33, "A_bh_sharpe": 1.2201, "A_bh_return_pct": 185.59}
