{"experiment_num": 76, "backbone": "lstm", "description": "LSTM @ exp 71 1-layer bs=32 (up from 16) - batch axis test on new champion baseline", "config": {"seq_len": 10, "lr": 0.001, "batch_size": 32, "epochs": 100, "weight_decay": 0.0007, "patience": 15, "warmup_epochs": 0, "head_dropout": 0.1, "huber_delta": 1.0, "grad_clip": 1.0, "seed": 0, "hidden_size": null, "num_layers": 1, "max_depth": null, "gbm_lr": null, "n_estimators": null}, "composite": -0.0834, "test_pos_folds": 5, "val_pos_folds": 4, "val_loss": -2.876109372906098, "elapsed_sec": 38.8, "timestamp": "2026-04-27T23:11:25", "sharpe": 0.3965, "val_sharpe": 0.1166, "ic": 0.0026, "hit": 52.74, "psr": 0.8274, "equity": 1487.7, "return_pct": 48.77, "bh_sharpe": 0.6042, "bh_return_pct": 103.49, "excess_sharpe": -0.2077, "B_sharpe": 0.7685, "B_excess_sharpe": -0.9323, "B_return_pct": 345.09, "D_sharpe": 0.3965, "D_excess_sharpe": -0.2077, "D_return_pct": 48.77, "precision": 0.5683, "recall": 0.7162, "f1": 0.6338, "f2": 0.6808, "mcc": -0.013, "accuracy": 0.5262, "val_precision": 0.5511, "val_recall": 0.8359, "val_f1": 0.6643, "val_f2": 0.7576, "val_mcc": -0.0172, "val_accuracy": 0.5312, "per_window": [{"fold": "fold_1", "regime": "GFC peak crash (Lehman + Mar-2009 bottom)", "n": 115, "A_sharpe": -0.4254, "A_sortino": -0.4614, "A_excess_sharpe": 0.0187, "A_return_pct": -14.01, "A_hit_rate": 46.09, "A_n": 115, "A_bh_sharpe": -0.4441, "A_bh_return_pct": -14.4, "A_psr": 0.388, "A_ic": -0.0308, "A_precision": 0.4355, "A_recall": 0.5, "A_f1": 0.4655, "A_f2": 0.4856, "A_accuracy": 0.4609, "A_mcc": -0.0739, "A_tp": 27, "A_fp": 35, "A_tn": 26, "A_fn": 27, "B_sharpe": 1.7182, "B_sortino": 1.691, "B_excess_sharpe": 2.0161, "B_return_pct": 68.56, "B_hit_rate": 56.14, "B_n": 115, "B_bh_sharpe": -0.2978, "B_bh_return_pct": -27.23, "B_psr": 0.873, "B_ic": 0.0488, "B_precision": 0.5789, "B_recall": 0.5593, "B_f1": 0.569, "B_f2": 0.5631, "B_accuracy": 0.5652, "B_mcc": 0.1307, "B_tp": 33, "B_fp": 24, "B_tn": 32, "B_fn": 26, "D_sharpe": -0.4254, "D_sortino": -0.4614, "D_excess_sharpe": 0.0187, "D_return_pct": -14.01, "D_hit_rate": 46.09, "D_n": 115, "D_bh_sharpe": -0.4441, "D_bh_return_pct": -14.4, "D_psr": 0.388, "D_ic": -0.0308, "D_precision": 0.4355, "D_recall": 0.5, "D_f1": 0.4655, "D_f2": 0.4856, "D_accuracy": 0.4609, "D_mcc": -0.0739, "D_tp": 27, "D_fp": 35, "D_tn": 26, "D_fn": 27, "sharpe": -0.4254, "sortino": -0.4614, "return_pct": -14.01, "equity": 859.9, "max_dd": 0.0, "win_rate": 46.09, "profit_factor": 0.0, "ic": -0.0308, "hit": 46.09, "psr": 0.388, "bh_sharpe": -0.4441, "bh_return_pct": -14.4, "excess_sharpe": 0.0187, "precision": 0.4355, "recall": 0.5, "f1": 0.4655, "f2": 0.4856, "mcc": -0.0739, "accuracy": 0.4609, "tp": 27, "fp": 35, "tn": 26, "fn": 27}, {"fold": "fold_2", "regime": "2011 US-downgrade + EU debt", "n": 136, "A_sharpe": 1.3194, "A_sortino": 1.2947, "A_excess_sharpe": -0.4133, "A_return_pct": 14.44, "A_hit_rate": 56.3, "A_n": 136, "A_bh_sharpe": 1.7327, "A_bh_return_pct": 19.75, "A_psr": 0.8325, "A_ic": -0.0053, "A_precision": 0.5726, "A_recall": 0.9103, "A_f1": 0.703, "A_f2": 0.8142, "A_accuracy": 0.5588, "A_mcc": -0.0062, "A_tp": 71, "A_fp": 53, "A_tn": 5, "A_fn": 7, "B_sharpe": 2.1852, "B_sortino": 2.1392, "B_excess_sharpe": -1.8807, "B_return_pct": 60.91, "B_hit_rate": 59.56, "B_n": 136, "B_bh_sharpe": 4.0659, "B_bh_return_pct": 148.68, "B_psr": 0.9447, "B_ic": -0.0298, "B_precision": 0.6952, "B_recall": 0.7604, "B_f1": 0.7264, "B_f2": 0.7464, "B_accuracy": 0.5956, "B_mcc": -0.043, "B_tp": 73, "B_fp": 32, "B_tn": 8, "B_fn": 23, "D_sharpe": 1.3194, "D_sortino": 1.2947, "D_excess_sharpe": -0.4133, "D_return_pct": 14.44, "D_hit_rate": 56.3, "D_n": 136, "D_bh_sharpe": 1.7327, "D_bh_return_pct": 19.75, "D_psr": 0.8325, "D_ic": -0.0053, "D_precision": 0.5726, "D_recall": 0.9103, "D_f1": 0.703, "D_f2": 0.8142, "D_accuracy": 0.5588, "D_mcc": -0.0062, "D_tp": 71, "D_fp": 53, "D_tn": 5, "D_fn": 7, "sharpe": 1.3194, "sortino": 1.2947, "return_pct": 14.44, "equity": 1144.4, "max_dd": 0.0, "win_rate": 56.3, "profit_factor": 0.0, "ic": -0.0053, "hit": 56.3, "psr": 0.8325, "bh_sharpe": 1.7327, "bh_return_pct": 19.75, "excess_sharpe": -0.4133, "precision": 0.5726, "recall": 0.9103, "f1": 0.703, "f2": 0.8142, "mcc": -0.0062, "accuracy": 0.5588, "tp": 71, "fp": 53, "tn": 5, "fn": 7}, {"fold": "fold_3", "regime": "Taper tantrum and 2014 H1", "n": 178, "A_sharpe": 1.6512, "A_sortino": 1.4542, "A_excess_sharpe": 0.3067, "A_return_pct": 15.57, "A_hit_rate": 59.32, "A_n": 178, "A_bh_sharpe": 1.3445, "A_bh_return_pct": 12.41, "A_psr": 0.9083, "A_ic": 0.1013, "A_precision": 0.5872, "A_recall": 0.9806, "A_f1": 0.7345, "A_f2": 0.8647, "A_accuracy": 0.5899, "A_mcc": 0.0928, "A_tp": 101, "A_fp": 71, "A_tn": 4, "A_fn": 2, "B_sharpe": -0.7885, "B_sortino": -0.6977, "B_excess_sharpe": -3.8368, "B_return_pct": -16.02, "B_hit_rate": 51.69, "B_n": 178, "B_bh_sharpe": 3.0483, "B_bh_return_pct": 71.83, "B_psr": 0.2516, "B_ic": -0.0732, "B_precision": 0.5966, "B_recall": 0.6514, "B_f1": 0.6228, "B_f2": 0.6396, "B_accuracy": 0.5169, "B_mcc": -0.0458, "B_tp": 71, "B_fp": 48, "B_tn": 21, "B_fn": 38, "D_sharpe": 1.6512, "D_sortino": 1.4542, "D_excess_sharpe": 0.3067, "D_return_pct": 15.57, "D_hit_rate": 59.32, "D_n": 178, "D_bh_sharpe": 1.3445, "D_bh_return_pct": 12.41, "D_psr": 0.9083, "D_ic": 0.1013, "D_precision": 0.5872, "D_recall": 0.9806, "D_f1": 0.7345, "D_f2": 0.8647, "D_accuracy": 0.5899, "D_mcc": 0.0928, "D_tp": 101, "D_fp": 71, "D_tn": 4, "D_fn": 2, "sharpe": 1.6512, "sortino": 1.4542, "return_pct": 15.57, "equity": 1155.7, "max_dd": 0.0, "win_rate": 59.32, "profit_factor": 0.0, "ic": 0.1013, "hit": 59.32, "psr": 0.9083, "bh_sharpe": 1.3445, "bh_return_pct": 12.41, "excess_sharpe": 0.3067, "precision": 0.5872, "recall": 0.9806, "f1": 0.7345, "f2": 0.8647, "mcc": 0.0928, "accuracy": 0.5899, "tp": 101, "fp": 71, "tn": 4, "fn": 2}, {"fold": "fold_4", "regime": "China devaluation and oil crash", "n": 157, "A_sharpe": 0.8991, "A_sortino": 0.8943, "A_excess_sharpe": 0.8893, "A_return_pct": 10.16, "A_hit_rate": 51.28, "A_n": 157, "A_bh_sharpe": 0.0098, "A_bh_return_pct": -1.05, "A_psr": 0.7583, "A_ic": 0.1325, "A_precision": 0.5156, "A_recall": 0.8148, "A_f1": 0.6316, "A_f2": 0.7301, "A_accuracy": 0.5096, "A_mcc": -0.0013, "A_tp": 66, "A_fp": 62, "A_tn": 14, "A_fn": 15, "B_sharpe": 5.3492, "B_sortino": 6.5806, "B_excess_sharpe": 5.3333, "B_return_pct": 277.65, "B_hit_rate": 61.15, "B_n": 157, "B_bh_sharpe": 0.0159, "B_bh_return_pct": -5.48, "B_psr": 1.0, "B_ic": 0.409, "B_precision": 0.625, "B_recall": 0.7059, "B_f1": 0.663, "B_f2": 0.6881, "B_accuracy": 0.6115, "B_mcc": 0.2105, "B_tp": 60, "B_fp": 36, "B_tn": 36, "B_fn": 25, "D_sharpe": 0.8991, "D_sortino": 0.8943, "D_excess_sharpe": 0.8893, "D_return_pct": 10.16, "D_hit_rate": 51.28, "D_n": 157, "D_bh_sharpe": 0.0098, "D_bh_return_pct": -1.05, "D_psr": 0.7583, "D_ic": 0.1325, "D_precision": 0.5156, "D_recall": 0.8148, "D_f1": 0.6316, "D_f2": 0.7301, "D_accuracy": 0.5096, "D_mcc": -0.0013, "D_tp": 66, "D_fp": 62, "D_tn": 14, "D_fn": 15, "sharpe": 0.8991, "sortino": 0.8943, "return_pct": 10.16, "equity": 1101.6, "max_dd": 0.0, "win_rate": 51.28, "profit_factor": 0.0, "ic": 0.1325, "hit": 51.28, "psr": 0.7583, "bh_sharpe": 0.0098, "bh_return_pct": -1.05, "excess_sharpe": 0.8893, "precision": 0.5156, "recall": 0.8148, "f1": 0.6316, "f2": 0.7301, "mcc": -0.0013, "accuracy": 0.5096, "tp": 66, "fp": 62, "tn": 14, "fn": 15}, {"fold": "fold_5", "regime": "2018 Vol-mageddon + Q4 sell-off", "n": 177, "A_sharpe": 0.1419, "A_sortino": 0.1316, "A_excess_sharpe": -0.1679, "A_return_pct": 0.43, "A_hit_rate": 56.5, "A_n": 177, "A_bh_sharpe": 0.3098, "A_bh_return_pct": 3.19, "A_psr": 0.5472, "A_ic": 0.0577, "A_precision": 0.589, "A_recall": 0.835, "A_f1": 0.6908, "A_f2": 0.7706, "A_accuracy": 0.565, "A_mcc": 0.0313, "A_tp": 86, "A_fp": 60, "A_tn": 14, "A_fn": 17, "B_sharpe": 1.1322, "B_sortino": 1.1934, "B_excess_sharpe": 0.2406, "B_return_pct": 33.97, "B_hit_rate": 51.7, "B_n": 177, "B_bh_sharpe": 0.8917, "B_bh_return_pct": 23.8, "B_psr": 0.828, "B_ic": 0.1034, "B_precision": 0.6386, "B_recall": 0.4862, "B_f1": 0.5521, "B_f2": 0.5106, "B_accuracy": 0.5141, "B_mcc": 0.0439, "B_tp": 53, "B_fp": 30, "B_tn": 38, "B_fn": 56, "D_sharpe": 0.1419, "D_sortino": 0.1316, "D_excess_sharpe": -0.1679, "D_return_pct": 0.43, "D_hit_rate": 56.5, "D_n": 177, "D_bh_sharpe": 0.3098, "D_bh_return_pct": 3.19, "D_psr": 0.5472, "D_ic": 0.0577, "D_precision": 0.589, "D_recall": 0.835, "D_f1": 0.6908, "D_f2": 0.7706, "D_accuracy": 0.565, "D_mcc": 0.0313, "D_tp": 86, "D_fp": 60, "D_tn": 14, "D_fn": 17, "sharpe": 0.1419, "sortino": 0.1316, "return_pct": 0.43, "equity": 1004.3, "max_dd": 0.0, "win_rate": 56.5, "profit_factor": 0.0, "ic": 0.0577, "hit": 56.5, "psr": 0.5472, "bh_sharpe": 0.3098, "bh_return_pct": 3.19, "excess_sharpe": -0.1679, "precision": 0.589, "recall": 0.835, "f1": 0.6908, "f2": 0.7706, "mcc": 0.0313, "accuracy": 0.565, "tp": 86, "fp": 60, "tn": 14, "fn": 17}, {"fold": "fold_6", "regime": "COVID crash and V-recovery", "n": 222, "A_sharpe": -0.4254, "A_sortino": -0.4792, "A_excess_sharpe": -1.3142, "A_return_pct": -18.51, "A_hit_rate": 43.24, "A_n": 222, "A_bh_sharpe": 0.8888, "A_bh_return_pct": 26.13, "A_psr": 0.3466, "A_ic": -0.0551, "A_precision": 0.5566, "A_recall": 0.4275, "A_f1": 0.4836, "A_f2": 0.4483, "A_accuracy": 0.4324, "A_mcc": -0.1282, "A_tp": 59, "A_fp": 47, "A_tn": 37, "A_fn": 79, "B_sharpe": -1.5195, "B_sortino": -1.4815, "B_excess_sharpe": -3.9079, "B_return_pct": -68.28, "B_hit_rate": 44.8, "B_n": 222, "B_bh_sharpe": 2.3884, "B_bh_return_pct": 243.18, "B_psr": 0.0769, "B_ic": -0.0779, "B_precision": 0.5974, "B_recall": 0.3358, "B_f1": 0.4299, "B_f2": 0.368, "B_accuracy": 0.4505, "B_mcc": -0.0296, "B_tp": 46, "B_fp": 31, "B_tn": 54, "B_fn": 91, "D_sharpe": -0.4254, "D_sortino": -0.4792, "D_excess_sharpe": -1.3142, "D_return_pct": -18.51, "D_hit_rate": 43.24, "D_n": 222, "D_bh_sharpe": 0.8888, "D_bh_return_pct": 26.13, "D_psr": 0.3466, "D_ic": -0.0551, "D_precision": 0.5566, "D_recall": 0.4275, "D_f1": 0.4836, "D_f2": 0.4483, "D_accuracy": 0.4324, "D_mcc": -0.1282, "D_tp": 59, "D_fp": 47, "D_tn": 37, "D_fn": 79, "sharpe": -0.4254, "sortino": -0.4792, "return_pct": -18.51, "equity": 814.9, "max_dd": 0.0, "win_rate": 43.24, "profit_factor": 0.0, "ic": -0.0551, "hit": 43.24, "psr": 0.3466, "bh_sharpe": 0.8888, "bh_return_pct": 26.13, "excess_sharpe": -1.3142, "precision": 0.5566, "recall": 0.4275, "f1": 0.4836, "f2": 0.4483, "mcc": -0.1282, "accuracy": 0.4324, "tp": 59, "fp": 47, "tn": 37, "fn": 79}, {"fold": "fold_7", "regime": "Inflation bear, AI rally and 2025", "n": 425, "A_sharpe": 1.1258, "A_sortino": 1.2008, "A_excess_sharpe": 0.1543, "A_return_pct": 45.08, "A_hit_rate": 54.59, "A_n": 425, "A_bh_sharpe": 0.9715, "A_bh_return_pct": 37.12, "A_psr": 0.9347, "A_ic": 0.0405, "A_precision": 0.6022, "A_recall": 0.672, "A_f1": 0.6352, "A_f2": 0.6568, "A_accuracy": 0.5459, "A_mcc": 0.0391, "A_tp": 168, "A_fp": 111, "A_tn": 64, "A_fn": 82, "B_sharpe": 0.4843, "B_sortino": 0.4992, "B_excess_sharpe": -2.0184, "B_return_pct": 21.77, "B_hit_rate": 50.71, "B_n": 425, "B_bh_sharpe": 2.5027, "B_bh_return_pct": 458.83, "B_psr": 0.7352, "B_ic": 0.0717, "B_precision": 0.6448, "B_recall": 0.4487, "B_f1": 0.5291, "B_f2": 0.4777, "B_accuracy": 0.5059, "B_mcc": 0.0465, "B_tp": 118, "B_fp": 65, "B_tn": 97, "B_fn": 145, "D_sharpe": 1.1258, "D_sortino": 1.2008, "D_excess_sharpe": 0.1543, "D_return_pct": 45.08, "D_hit_rate": 54.59, "D_n": 425, "D_bh_sharpe": 0.9715, "D_bh_return_pct": 37.12, "D_psr": 0.9347, "D_ic": 0.0405, "D_precision": 0.6022, "D_recall": 0.672, "D_f1": 0.6352, "D_f2": 0.6568, "D_accuracy": 0.5459, "D_mcc": 0.0391, "D_tp": 168, "D_fp": 111, "D_tn": 64, "D_fn": 82, "sharpe": 1.1258, "sortino": 1.2008, "return_pct": 45.08, "equity": 1450.8000000000002, "max_dd": 0.0, "win_rate": 54.59, "profit_factor": 0.0, "ic": 0.0405, "hit": 54.59, "psr": 0.9347, "bh_sharpe": 0.9715, "bh_return_pct": 37.12, "excess_sharpe": 0.1543, "precision": 0.6022, "recall": 0.672, "f1": 0.6352, "f2": 0.6568, "mcc": 0.0391, "accuracy": 0.5459, "tp": 168, "fp": 111, "tn": 64, "fn": 82}], "per_window_val": [{"fold": "fold_1", "regime": "GFC peak crash (Lehman + Mar-2009 bottom)", "n": 104, "A_sharpe": -0.2184, "A_sortino": -0.1886, "A_excess_sharpe": -0.0512, "A_return_pct": -4.41, "A_hit_rate": 53.92, "A_n": 104, "A_bh_sharpe": -0.1672, "A_bh_return_pct": -3.81, "A_psr": 0.4441, "A_ic": 0.0517, "A_precision": 0.5455, "A_recall": 0.6667, "A_f1": 0.6, "A_f2": 0.6383, "A_accuracy": 0.5385, "A_mcc": 0.0692, "A_tp": 36, "A_fp": 30, "A_tn": 20, "A_fn": 18, "B_sharpe": -2.7097, "B_sortino": -2.7305, "B_excess_sharpe": -0.4356, "B_return_pct": -49.17, "B_hit_rate": 37.86, "B_n": 104, "B_bh_sharpe": -2.2741, "B_bh_return_pct": -44.12, "B_psr": 0.0463, "B_ic": -0.1215, "B_precision": 0.3966, "B_recall": 0.4423, "B_f1": 0.4182, "B_f2": 0.4323, "B_accuracy": 0.3846, "B_mcc": -0.2323, "B_tp": 23, "B_fp": 35, "B_tn": 17, "B_fn": 29, "D_sharpe": -0.2184, "D_sortino": -0.1886, "D_excess_sharpe": -0.0512, "D_return_pct": -4.41, "D_hit_rate": 53.92, "D_n": 104, "D_bh_sharpe": -0.1672, "D_bh_return_pct": -3.81, "D_psr": 0.4441, "D_ic": 0.0517, "D_precision": 0.5455, "D_recall": 0.6667, "D_f1": 0.6, "D_f2": 0.6383, "D_accuracy": 0.5385, "D_mcc": 0.0692, "D_tp": 36, "D_fp": 30, "D_tn": 20, "D_fn": 18, "sharpe": -0.2184, "sortino": -0.1886, "return_pct": -4.41, "equity": 955.9, "max_dd": 0.0, "win_rate": 53.92, "profit_factor": 0.0, "ic": 0.0517, "hit": 53.92, "psr": 0.4441, "bh_sharpe": -0.1672, "bh_return_pct": -3.81, "excess_sharpe": -0.0512, "precision": 0.5455, "recall": 0.6667, "f1": 0.6, "f2": 0.6383, "mcc": 0.0692, "accuracy": 0.5385, "tp": 36, "fp": 30, "tn": 20, "fn": 18}, {"fold": "fold_2", "regime": "2011 US-downgrade + EU debt", "n": 96, "A_sharpe": -1.9122, "A_sortino": -1.7549, "A_excess_sharpe": -1.6381, "A_return_pct": -18.76, "A_hit_rate": 45.26, "A_n": 96, "A_bh_sharpe": -0.2741, "A_bh_return_pct": -4.09, "A_psr": 0.1152, "A_ic": 0.031, "A_precision": 0.4824, "A_recall": 0.82, "A_f1": 0.6074, "A_f2": 0.7193, "A_accuracy": 0.4479, "A_mcc": -0.2141, "A_tp": 41, "A_fp": 44, "A_tn": 2, "A_fn": 9, "B_sharpe": -0.1217, "B_sortino": -0.1479, "B_excess_sharpe": 0.9057, "B_return_pct": -8.71, "B_hit_rate": 43.75, "B_n": 96, "B_bh_sharpe": -1.0274, "B_bh_return_pct": -25.58, "B_psr": 0.4703, "B_ic": -0.1508, "B_precision": 0.359, "B_recall": 0.3256, "B_f1": 0.3415, "B_f2": 0.3318, "B_accuracy": 0.4375, "B_mcc": -0.1479, "B_tp": 14, "B_fp": 25, "B_tn": 28, "B_fn": 29, "D_sharpe": -1.9122, "D_sortino": -1.7549, "D_excess_sharpe": -1.6381, "D_return_pct": -18.76, "D_hit_rate": 45.26, "D_n": 96, "D_bh_sharpe": -0.2741, "D_bh_return_pct": -4.09, "D_psr": 0.1152, "D_ic": 0.031, "D_precision": 0.4824, "D_recall": 0.82, "D_f1": 0.6074, "D_f2": 0.7193, "D_accuracy": 0.4479, "D_mcc": -0.2141, "D_tp": 41, "D_fp": 44, "D_tn": 2, "D_fn": 9, "sharpe": -1.9122, "sortino": -1.7549, "return_pct": -18.76, "equity": 812.4, "max_dd": 0.0, "win_rate": 45.26, "profit_factor": 0.0, "ic": 0.031, "hit": 45.26, "psr": 0.1152, "bh_sharpe": -0.2741, "bh_return_pct": -4.09, "excess_sharpe": -1.6381, "precision": 0.4824, "recall": 0.82, "f1": 0.6074, "f2": 0.7193, "mcc": -0.2141, "accuracy": 0.4479, "tp": 41, "fp": 44, "tn": 2, "fn": 9}, {"fold": "fold_3", "regime": "Taper tantrum and 2014 H1", "n": 54, "A_sharpe": 4.9853, "A_sortino": 5.1648, "A_excess_sharpe": 0.2855, "A_return_pct": 11.08, "A_hit_rate": 62.96, "A_n": 54, "A_bh_sharpe": 4.6998, "A_bh_return_pct": 10.46, "A_psr": 0.9825, "A_ic": 0.1619, "A_precision": 0.6226, "A_recall": 1.0, "A_f1": 0.7674, "A_f2": 0.8919, "A_accuracy": 0.6296, "A_mcc": 0.1722, "A_tp": 33, "A_fp": 20, "A_tn": 1, "A_fn": 0, "B_sharpe": 4.6585, "B_sortino": 5.0806, "B_excess_sharpe": -4.3741, "B_return_pct": 25.24, "B_hit_rate": 62.96, "B_n": 54, "B_bh_sharpe": 9.0326, "B_bh_return_pct": 49.18, "B_psr": 0.9832, "B_ic": 0.0211, "B_precision": 0.6809, "B_recall": 0.8649, "B_f1": 0.7619, "B_f2": 0.8205, "B_accuracy": 0.6296, "B_mcc": -0.0242, "B_tp": 32, "B_fp": 15, "B_tn": 2, "B_fn": 5, "D_sharpe": 4.9853, "D_sortino": 5.1648, "D_excess_sharpe": 0.2855, "D_return_pct": 11.08, "D_hit_rate": 62.96, "D_n": 54, "D_bh_sharpe": 4.6998, "D_bh_return_pct": 10.46, "D_psr": 0.9825, "D_ic": 0.1619, "D_precision": 0.6226, "D_recall": 1.0, "D_f1": 0.7674, "D_f2": 0.8919, "D_accuracy": 0.6296, "D_mcc": 0.1722, "D_tp": 33, "D_fp": 20, "D_tn": 1, "D_fn": 0, "sharpe": 4.9853, "sortino": 5.1648, "return_pct": 11.08, "equity": 1110.8, "max_dd": 0.0, "win_rate": 62.96, "profit_factor": 0.0, "ic": 0.1619, "hit": 62.96, "psr": 0.9825, "bh_sharpe": 4.6998, "bh_return_pct": 10.46, "excess_sharpe": 0.2855, "precision": 0.6226, "recall": 1.0, "f1": 0.7674, "f2": 0.8919, "mcc": 0.1722, "accuracy": 0.6296, "tp": 33, "fp": 20, "tn": 1, "fn": 0}, {"fold": "fold_4", "regime": "China devaluation and oil crash", "n": 96, "A_sharpe": 0.0879, "A_sortino": 0.0846, "A_excess_sharpe": 0.512, "A_return_pct": -0.06, "A_hit_rate": 49.47, "A_n": 96, "A_bh_sharpe": -0.4241, "A_bh_return_pct": -3.73, "A_psr": 0.5215, "A_ic": 0.1377, "A_precision": 0.4773, "A_recall": 0.9333, "A_f1": 0.6316, "A_f2": 0.7836, "A_accuracy": 0.4896, "A_mcc": 0.0566, "A_tp": 42, "A_fp": 46, "A_tn": 5, "A_fn": 3, "B_sharpe": -2.5762, "B_sortino": -2.4451, "B_excess_sharpe": -1.392, "B_return_pct": -37.68, "B_hit_rate": 42.71, "B_n": 96, "B_bh_sharpe": -1.1843, "B_bh_return_pct": -21.44, "B_psr": 0.0603, "B_ic": -0.0722, "B_precision": 0.4308, "B_recall": 0.6087, "B_f1": 0.5045, "B_f2": 0.5622, "B_accuracy": 0.4271, "B_mcc": -0.1403, "B_tp": 28, "B_fp": 37, "B_tn": 13, "B_fn": 18, "D_sharpe": 0.0879, "D_sortino": 0.0846, "D_excess_sharpe": 0.512, "D_return_pct": -0.06, "D_hit_rate": 49.47, "D_n": 96, "D_bh_sharpe": -0.4241, "D_bh_return_pct": -3.73, "D_psr": 0.5215, "D_ic": 0.1377, "D_precision": 0.4773, "D_recall": 0.9333, "D_f1": 0.6316, "D_f2": 0.7836, "D_accuracy": 0.4896, "D_mcc": 0.0566, "D_tp": 42, "D_fp": 46, "D_tn": 5, "D_fn": 3, "sharpe": 0.0879, "sortino": 0.0846, "return_pct": -0.06, "equity": 999.4, "max_dd": 0.0, "win_rate": 49.47, "profit_factor": 0.0, "ic": 0.1377, "hit": 49.47, "psr": 0.5215, "bh_sharpe": -0.4241, "bh_return_pct": -3.73, "excess_sharpe": 0.512, "precision": 0.4773, "recall": 0.9333, "f1": 0.6316, "f2": 0.7836, "mcc": 0.0566, "accuracy": 0.4896, "tp": 42, "fp": 46, "tn": 5, "fn": 3}, {"fold": "fold_5", "regime": "2018 Vol-mageddon + Q4 sell-off", "n": 54, "A_sharpe": -0.0231, "A_sortino": -0.0227, "A_excess_sharpe": -1.4511, "A_return_pct": -0.26, "A_hit_rate": 48.15, "A_n": 54, "A_bh_sharpe": 1.428, "A_bh_return_pct": 3.97, "A_psr": 0.4958, "A_ic": -0.047, "A_precision": 0.5106, "A_recall": 0.8276, "A_f1": 0.6316, "A_f2": 0.7362, "A_accuracy": 0.4815, "A_mcc": -0.1372, "A_tp": 24, "A_fp": 23, "A_tn": 2, "A_fn": 5, "B_sharpe": -3.3695, "B_sortino": -2.856, "B_excess_sharpe": -8.3017, "B_return_pct": -20.3, "B_hit_rate": 46.3, "B_n": 54, "B_bh_sharpe": 4.9322, "B_bh_return_pct": 34.93, "B_psr": 0.0561, "B_ic": -0.2805, "B_precision": 0.625, "B_recall": 0.5405, "B_f1": 0.5797, "B_f2": 0.5556, "B_accuracy": 0.463, "B_mcc": -0.1563, "B_tp": 20, "B_fp": 12, "B_tn": 5, "B_fn": 17, "D_sharpe": -0.0231, "D_sortino": -0.0227, "D_excess_sharpe": -1.4511, "D_return_pct": -0.26, "D_hit_rate": 48.15, "D_n": 54, "D_bh_sharpe": 1.428, "D_bh_return_pct": 3.97, "D_psr": 0.4958, "D_ic": -0.047, "D_precision": 0.5106, "D_recall": 0.8276, "D_f1": 0.6316, "D_f2": 0.7362, "D_accuracy": 0.4815, "D_mcc": -0.1372, "D_tp": 24, "D_fp": 23, "D_tn": 2, "D_fn": 5, "sharpe": -0.0231, "sortino": -0.0227, "return_pct": -0.26, "equity": 997.4, "max_dd": 0.0, "win_rate": 48.15, "profit_factor": 0.0, "ic": -0.047, "hit": 48.15, "psr": 0.4958, "bh_sharpe": 1.428, "bh_return_pct": 3.97, "excess_sharpe": -1.4511, "precision": 0.5106, "recall": 0.8276, "f1": 0.6316, "f2": 0.7362, "mcc": -0.1372, "accuracy": 0.4815, "tp": 24, "fp": 23, "tn": 2, "fn": 5}, {"fold": "fold_6", "regime": "COVID crash and V-recovery", "n": 75, "A_sharpe": 4.2994, "A_sortino": 3.8524, "A_excess_sharpe": 0.0, "A_return_pct": 14.68, "A_hit_rate": 68.0, "A_n": 75, "A_bh_sharpe": 4.2994, "A_bh_return_pct": 14.68, "A_psr": 0.9844, "A_ic": 0.0213, "A_precision": 0.68, "A_recall": 1.0, "A_f1": 0.8095, "A_f2": 0.914, "A_accuracy": 0.68, "A_mcc": 0.0, "A_tp": 51, "A_fp": 24, "A_tn": 0, "A_fn": 0, "B_sharpe": -2.3303, "B_sortino": -2.3609, "B_excess_sharpe": -16.6642, "B_return_pct": -16.68, "B_hit_rate": 40.0, "B_n": 75, "B_bh_sharpe": 14.3339, "B_bh_return_pct": 120.13, "B_psr": 0.1073, "B_ic": -0.0679, "B_precision": 0.8, "B_recall": 0.381, "B_f1": 0.5161, "B_f2": 0.4255, "B_accuracy": 0.4, "B_mcc": -0.0891, "B_tp": 24, "B_fp": 6, "B_tn": 6, "B_fn": 39, "D_sharpe": 4.2994, "D_sortino": 3.8524, "D_excess_sharpe": 0.0, "D_return_pct": 14.68, "D_hit_rate": 68.0, "D_n": 75, "D_bh_sharpe": 4.2994, "D_bh_return_pct": 14.68, "D_psr": 0.9844, "D_ic": 0.0213, "D_precision": 0.68, "D_recall": 1.0, "D_f1": 0.8095, "D_f2": 0.914, "D_accuracy": 0.68, "D_mcc": 0.0, "D_tp": 51, "D_fp": 24, "D_tn": 0, "D_fn": 0, "sharpe": 4.2994, "sortino": 3.8524, "return_pct": 14.68, "equity": 1146.8, "max_dd": 0.0, "win_rate": 68.0, "profit_factor": 0.0, "ic": 0.0213, "hit": 68.0, "psr": 0.9844, "bh_sharpe": 4.2994, "bh_return_pct": 14.68, "excess_sharpe": 0.0, "precision": 0.68, "recall": 1.0, "f1": 0.8095, "f2": 0.914, "mcc": 0.0, "accuracy": 0.68, "tp": 51, "fp": 24, "tn": 0, "fn": 0}, {"fold": "fold_7", "regime": "Inflation bear, AI rally and 2025", "n": 114, "A_sharpe": 0.3664, "A_sortino": 0.3773, "A_excess_sharpe": -2.4786, "A_return_pct": 2.07, "A_hit_rate": 50.88, "A_n": 114, "A_bh_sharpe": 2.845, "A_bh_return_pct": 21.34, "A_psr": 0.5971, "A_ic": 0.0024, "A_precision": 0.5647, "A_recall": 0.7164, "A_f1": 0.6316, "A_f2": 0.6799, "A_accuracy": 0.5088, "A_mcc": -0.08, "A_tp": 48, "A_fp": 37, "A_tn": 10, "A_fn": 19, "B_sharpe": 0.4789, "B_sortino": 0.5278, "B_excess_sharpe":