{"experiment_num": 78, "backbone": "mlp", "description": "MLP @ exp 6 wd=1e-4 (up from 1e-5 default, 10x) - Loshchilov 2019 log-spaced AdamW WD axis untested on QQQ MLP", "config": {"seq_len": 10, "lr": 0.0003, "batch_size": 32, "epochs": 50, "weight_decay": 0.0001, "patience": 10, "warmup_epochs": 0, "head_dropout": 0.25, "huber_delta": 1.0, "grad_clip": 1.0, "seed": 0, "hidden_size": null, "num_layers": null, "max_depth": null, "gbm_lr": null, "n_estimators": null}, "composite": 0.5799, "test_pos_folds": 6, "val_pos_folds": 5, "val_loss": -2.890252819752814, "elapsed_sec": 25.9, "timestamp": "2026-04-27T23:14:04", "sharpe": 0.6799, "val_sharpe": 0.7871, "ic": 0.0146, "hit": 55.93, "psr": 0.9448, "equity": 2282.4999999999995, "return_pct": 128.25, "bh_sharpe": 0.6042, "bh_return_pct": 103.49, "excess_sharpe": 0.0757, "B_sharpe": 0.4845, "B_excess_sharpe": -1.2163, "B_return_pct": 93.23, "D_sharpe": 0.6799, "D_excess_sharpe": 0.0757, "D_return_pct": 128.25, "precision": 0.5838, "recall": 0.7943, "f1": 0.673, "f2": 0.7409, "mcc": 0.0434, "accuracy": 0.5582, "val_precision": 0.5556, "val_recall": 0.8055, "val_f1": 0.6576, "val_f2": 0.739, "val_mcc": 0.0031, "val_accuracy": 0.5346, "per_window": [{"fold": "fold_1", "regime": "GFC peak crash (Lehman + Mar-2009 bottom)", "n": 115, "A_sharpe": -1.775, "A_sortino": -1.7726, "A_excess_sharpe": -1.3309, "A_return_pct": -36.43, "A_hit_rate": 42.61, "A_n": 115, "A_bh_sharpe": -0.4441, "A_bh_return_pct": -14.4, "A_psr": 0.1164, "A_ic": -0.1039, "A_precision": 0.4032, "A_recall": 0.463, "A_f1": 0.431, "A_f2": 0.4496, "A_accuracy": 0.4261, "A_mcc": -0.1438, "A_tp": 25, "A_fp": 37, "A_tn": 24, "A_fn": 29, "B_sharpe": 4.4787, "B_sortino": 5.4131, "B_excess_sharpe": 4.7765, "B_return_pct": 403.29, "B_hit_rate": 57.89, "B_n": 115, "B_bh_sharpe": -0.2978, "B_bh_return_pct": -27.23, "B_psr": 0.999, "B_ic": 0.2953, "B_precision": 0.6389, "B_recall": 0.3898, "B_f1": 0.4842, "B_f2": 0.4228, "B_accuracy": 0.5739, "B_mcc": 0.17, "B_tp": 23, "B_fp": 13, "B_tn": 43, "B_fn": 36, "D_sharpe": -1.775, "D_sortino": -1.7726, "D_excess_sharpe": -1.3309, "D_return_pct": -36.43, "D_hit_rate": 42.61, "D_n": 115, "D_bh_sharpe": -0.4441, "D_bh_return_pct": -14.4, "D_psr": 0.1164, "D_ic": -0.1039, "D_precision": 0.4032, "D_recall": 0.463, "D_f1": 0.431, "D_f2": 0.4496, "D_accuracy": 0.4261, "D_mcc": -0.1438, "D_tp": 25, "D_fp": 37, "D_tn": 24, "D_fn": 29, "sharpe": -1.775, "sortino": -1.7726, "return_pct": -36.43, "equity": 635.6999999999999, "max_dd": 0.0, "win_rate": 42.61, "profit_factor": 0.0, "ic": -0.1039, "hit": 42.61, "psr": 0.1164, "bh_sharpe": -0.4441, "bh_return_pct": -14.4, "excess_sharpe": -1.3309, "precision": 0.4032, "recall": 0.463, "f1": 0.431, "f2": 0.4496, "mcc": -0.1438, "accuracy": 0.4261, "tp": 25, "fp": 37, "tn": 24, "fn": 29}, {"fold": "fold_2", "regime": "2011 US-downgrade + EU debt", "n": 136, "A_sharpe": 1.8237, "A_sortino": 1.7642, "A_excess_sharpe": 0.091, "A_return_pct": 20.94, "A_hit_rate": 58.52, "A_n": 136, "A_bh_sharpe": 1.7327, "A_bh_return_pct": 19.75, "A_psr": 0.9074, "A_ic": -0.0508, "A_precision": 0.5827, "A_recall": 0.9487, "A_f1": 0.722, "A_f2": 0.8428, "A_accuracy": 0.5809, "A_mcc": 0.0695, "A_tp": 74, "A_fp": 53, "A_tn": 5, "A_fn": 4, "B_sharpe": 3.5198, "B_sortino": 3.4287, "B_excess_sharpe": -0.5461, "B_return_pct": 119.89, "B_hit_rate": 65.44, "B_n": 136, "B_bh_sharpe": 4.0659, "B_bh_return_pct": 148.68, "B_psr": 0.995, "B_ic": 0.0686, "B_precision": 0.8101, "B_recall": 0.6667, "B_f1": 0.7314, "B_f2": 0.6911, "B_accuracy": 0.6544, "B_mcc": 0.2693, "B_tp": 64, "B_fp": 15, "B_tn": 25, "B_fn": 32, "D_sharpe": 1.8237, "D_sortino": 1.7642, "D_excess_sharpe": 0.091, "D_return_pct": 20.94, "D_hit_rate": 58.52, "D_n": 136, "D_bh_sharpe": 1.7327, "D_bh_return_pct": 19.75, "D_psr": 0.9074, "D_ic": -0.0508, "D_precision": 0.5827, "D_recall": 0.9487, "D_f1": 0.722, "D_f2": 0.8428, "D_accuracy": 0.5809, "D_mcc": 0.0695, "D_tp": 74, "D_fp": 53, "D_tn": 5, "D_fn": 4, "sharpe": 1.8237, "sortino": 1.7642, "return_pct": 20.94, "equity": 1209.4, "max_dd": 0.0, "win_rate": 58.52, "profit_factor": 0.0, "ic": -0.0508, "hit": 58.52, "psr": 0.9074, "bh_sharpe": 1.7327, "bh_return_pct": 19.75, "excess_sharpe": 0.091, "precision": 0.5827, "recall": 0.9487, "f1": 0.722, "f2": 0.8428, "mcc": 0.0695, "accuracy": 0.5809, "tp": 74, "fp": 53, "tn": 5, "fn": 4}, {"fold": "fold_3", "regime": "Taper tantrum and 2014 H1", "n": 178, "A_sharpe": 2.1638, "A_sortino": 1.99, "A_excess_sharpe": 0.8193, "A_return_pct": 21.02, "A_hit_rate": 58.76, "A_n": 178, "A_bh_sharpe": 1.3445, "A_bh_return_pct": 12.41, "A_psr": 0.9585, "A_ic": 0.0939, "A_precision": 0.5901, "A_recall": 0.9223, "A_f1": 0.7197, "A_f2": 0.829, "A_accuracy": 0.5843, "A_mcc": 0.0711, "A_tp": 95, "A_fp": 66, "A_tn": 9, "A_fn": 8, "B_sharpe": -1.6644, "B_sortino": -1.5147, "B_excess_sharpe": -4.7128, "B_return_pct": -28.74, "B_hit_rate": 48.88, "B_n": 178, "B_bh_sharpe": 3.0483, "B_bh_return_pct": 71.83, "B_psr": 0.0797, "B_ic": -0.0063, "B_precision": 0.6, "B_recall": 0.4954, "B_f1": 0.5427, "B_f2": 0.5133, "B_accuracy": 0.4888, "B_mcc": -0.0257, "B_tp": 54, "B_fp": 36, "B_tn": 33, "B_fn": 55, "D_sharpe": 2.1638, "D_sortino": 1.99, "D_excess_sharpe": 0.8193, "D_return_pct": 21.02, "D_hit_rate": 58.76, "D_n": 178, "D_bh_sharpe": 1.3445, "D_bh_return_pct": 12.41, "D_psr": 0.9585, "D_ic": 0.0939, "D_precision": 0.5901, "D_recall": 0.9223, "D_f1": 0.7197, "D_f2": 0.829, "D_accuracy": 0.5843, "D_mcc": 0.0711, "D_tp": 95, "D_fp": 66, "D_tn": 9, "D_fn": 8, "sharpe": 2.1638, "sortino": 1.99, "return_pct": 21.02, "equity": 1210.2, "max_dd": 0.0, "win_rate": 58.76, "profit_factor": 0.0, "ic": 0.0939, "hit": 58.76, "psr": 0.9585, "bh_sharpe": 1.3445, "bh_return_pct": 12.41, "excess_sharpe": 0.8193, "precision": 0.5901, "recall": 0.9223, "f1": 0.7197, "f2": 0.829, "mcc": 0.0711, "accuracy": 0.5843, "tp": 95, "fp": 66, "tn": 9, "fn": 8}, {"fold": "fold_4", "regime": "China devaluation and oil crash", "n": 157, "A_sharpe": 1.3263, "A_sortino": 1.2782, "A_excess_sharpe": 1.3165, "A_return_pct": 15.96, "A_hit_rate": 54.49, "A_n": 157, "A_bh_sharpe": 0.0098, "A_bh_return_pct": -1.05, "A_psr": 0.8472, "A_ic": 0.0433, "A_precision": 0.5391, "A_recall": 0.7654, "A_f1": 0.6327, "A_f2": 0.7062, "A_accuracy": 0.5414, "A_mcc": 0.0768, "A_tp": 62, "A_fp": 53, "A_tn": 23, "A_fn": 19, "B_sharpe": -1.2577, "B_sortino": -1.4213, "B_excess_sharpe": -1.2736, "B_return_pct": -33.17, "B_hit_rate": 40.13, "B_n": 157, "B_bh_sharpe": 0.0159, "B_bh_return_pct": -5.48, "B_psr": 0.1672, "B_ic": 0.0166, "B_precision": 0.4, "B_recall": 0.2118, "B_f1": 0.2769, "B_f2": 0.2338, "B_accuracy": 0.4013, "B_mcc": -0.1799, "B_tp": 18, "B_fp": 27, "B_tn": 45, "B_fn": 67, "D_sharpe": 1.3263, "D_sortino": 1.2782, "D_excess_sharpe": 1.3165, "D_return_pct": 15.96, "D_hit_rate": 54.49, "D_n": 157, "D_bh_sharpe": 0.0098, "D_bh_return_pct": -1.05, "D_psr": 0.8472, "D_ic": 0.0433, "D_precision": 0.5391, "D_recall": 0.7654, "D_f1": 0.6327, "D_f2": 0.7062, "D_accuracy": 0.5414, "D_mcc": 0.0768, "D_tp": 62, "D_fp": 53, "D_tn": 23, "D_fn": 19, "sharpe": 1.3263, "sortino": 1.2782, "return_pct": 15.96, "equity": 1159.6, "max_dd": 0.0, "win_rate": 54.49, "profit_factor": 0.0, "ic": 0.0433, "hit": 54.49, "psr": 0.8472, "bh_sharpe": 0.0098, "bh_return_pct": -1.05, "excess_sharpe": 1.3165, "precision": 0.5391, "recall": 0.7654, "f1": 0.6327, "f2": 0.7062, "mcc": 0.0768, "accuracy": 0.5414, "tp": 62, "fp": 53, "tn": 23, "fn": 19}, {"fold": "fold_5", "regime": "2018 Vol-mageddon + Q4 sell-off", "n": 177, "A_sharpe": 0.9081, "A_sortino": 0.9046, "A_excess_sharpe": 0.5983, "A_return_pct": 13.66, "A_hit_rate": 55.37, "A_n": 177, "A_bh_sharpe": 0.3098, "A_bh_return_pct": 3.19, "A_psr": 0.7771, "A_ic": 0.0323, "A_precision": 0.5882, "A_recall": 0.7767, "A_f1": 0.6695, "A_f2": 0.7299, "A_accuracy": 0.5537, "A_mcc": 0.0233, "A_tp": 80, "A_fp": 56, "A_tn": 18, "A_fn": 23, "B_sharpe": 0.567, "B_sortino": 0.6226, "B_excess_sharpe": -0.3247, "B_return_pct": 11.59, "B_hit_rate": 48.86, "B_n": 177, "B_bh_sharpe": 0.8917, "B_bh_return_pct": 23.8, "B_psr": 0.6833, "B_ic": -0.0281, "B_precision": 0.6377, "B_recall": 0.4037, "B_f1": 0.4944, "B_f2": 0.4356, "B_accuracy": 0.4915, "B_mcc": 0.0359, "B_tp": 44, "B_fp": 25, "B_tn": 43, "B_fn": 65, "D_sharpe": 0.9081, "D_sortino": 0.9046, "D_excess_sharpe": 0.5983, "D_return_pct": 13.66, "D_hit_rate": 55.37, "D_n": 177, "D_bh_sharpe": 0.3098, "D_bh_return_pct": 3.19, "D_psr": 0.7771, "D_ic": 0.0323, "D_precision": 0.5882, "D_recall": 0.7767, "D_f1": 0.6695, "D_f2": 0.7299, "D_accuracy": 0.5537, "D_mcc": 0.0233, "D_tp": 80, "D_fp": 56, "D_tn": 18, "D_fn": 23, "sharpe": 0.9081, "sortino": 0.9046, "return_pct": 13.66, "equity": 1136.6000000000001, "max_dd": 0.0, "win_rate": 55.37, "profit_factor": 0.0, "ic": 0.0323, "hit": 55.37, "psr": 0.7771, "bh_sharpe": 0.3098, "bh_return_pct": 3.19, "excess_sharpe": 0.5983, "precision": 0.5882, "recall": 0.7767, "f1": 0.6695, "f2": 0.7299, "mcc": 0.0233, "accuracy": 0.5537, "tp": 80, "fp": 56, "tn": 18, "fn": 23}, {"fold": "fold_6", "regime": "COVID crash and V-recovery", "n": 222, "A_sharpe": 1.6915, "A_sortino": 1.4628, "A_excess_sharpe": 0.8027, "A_return_pct": 64.51, "A_hit_rate": 63.51, "A_n": 222, "A_bh_sharpe": 0.8888, "A_bh_return_pct": 26.13, "A_psr": 0.9371, "A_ic": 0.1031, "A_precision": 0.6524, "A_recall": 0.8841, "A_f1": 0.7508, "A_f2": 0.8254, "A_accuracy": 0.6351, "A_mcc": 0.1467, "A_tp": 122, "A_fp": 65, "A_tn": 19, "A_fn": 16, "B_sharpe": 0.4153, "B_sortino": 0.4684, "B_excess_sharpe": -1.9731, "B_return_pct": 4.41, "B_hit_rate": 47.06, "B_n": 222, "B_bh_sharpe": 2.3884, "B_bh_return_pct": 243.18, "B_psr": 0.6522, "B_ic": 0.0088, "B_precision": 0.6471, "B_recall": 0.3212, "B_f1": 0.4293, "B_f2": 0.3571, "B_accuracy": 0.473, "B_mcc": 0.0409, "B_tp": 44, "B_fp": 24, "B_tn": 61, "B_fn": 93, "D_sharpe": 1.6915, "D_sortino": 1.4628, "D_excess_sharpe": 0.8027, "D_return_pct": 64.51, "D_hit_rate": 63.51, "D_n": 222, "D_bh_sharpe": 0.8888, "D_bh_return_pct": 26.13, "D_psr": 0.9371, "D_ic": 0.1031, "D_precision": 0.6524, "D_recall": 0.8841, "D_f1": 0.7508, "D_f2": 0.8254, "D_accuracy": 0.6351, "D_mcc": 0.1467, "D_tp": 122, "D_fp": 65, "D_tn": 19, "D_fn": 16, "sharpe": 1.6915, "sortino": 1.4628, "return_pct": 64.51, "equity": 1645.1, "max_dd": 0.0, "win_rate": 63.51, "profit_factor": 0.0, "ic": 0.1031, "hit": 63.51, "psr": 0.9371, "bh_sharpe": 0.8888, "bh_return_pct": 26.13, "excess_sharpe": 0.8027, "precision": 0.6524, "recall": 0.8841, "f1": 0.7508, "f2": 0.8254, "mcc": 0.1467, "accuracy": 0.6351, "tp": 122, "fp": 65, "tn": 19, "fn": 16}, {"fold": "fold_7", "regime": "Inflation bear, AI rally and 2025", "n": 425, "A_sharpe": 0.4449, "A_sortino": 0.4283, "A_excess_sharpe": -0.5266, "A_return_pct": 13.13, "A_hit_rate": 54.35, "A_n": 425, "A_bh_sharpe": 0.9715, "A_bh_return_pct": 37.12, "A_psr": 0.7195, "A_ic": -0.0522, "A_precision": 0.5903, "A_recall": 0.732, "A_f1": 0.6536, "A_f2": 0.6985, "A_accuracy": 0.5435, "A_mcc": 0.007, "A_tp": 183, "A_fp": 127, "A_tn": 48, "A_fn": 67, "B_sharpe": -1.2842, "B_sortino": -1.2705, "B_excess_sharpe": -3.7869, "B_return_pct": -68.53, "B_hit_rate": 45.75, "B_n": 425, "B_bh_sharpe": 2.5027, "B_bh_return_pct": 458.83, "B_psr": 0.0491, "B_ic": -0.1159, "B_precision": 0.5748, "B_recall": 0.4677, "B_f1": 0.5157, "B_f2": 0.4858, "B_accuracy": 0.4565, "B_mcc": -0.0914, "B_tp": 123, "B_fp": 91, "B_tn": 71, "B_fn": 140, "D_sharpe": 0.4449, "D_sortino": 0.4283, "D_excess_sharpe": -0.5266, "D_return_pct": 13.13, "D_hit_rate": 54.35, "D_n": 425, "D_bh_sharpe": 0.9715, "D_bh_return_pct": 37.12, "D_psr": 0.7195, "D_ic": -0.0522, "D_precision": 0.5903, "D_recall": 0.732, "D_f1": 0.6536, "D_f2": 0.6985, "D_accuracy": 0.5435, "D_mcc": 0.007, "D_tp": 183, "D_fp": 127, "D_tn": 48, "D_fn": 67, "sharpe": 0.4449, "sortino": 0.4283, "return_pct": 13.13, "equity": 1131.3, "max_dd": 0.0, "win_rate": 54.35, "profit_factor": 0.0, "ic": -0.0522, "hit": 54.35, "psr": 0.7195, "bh_sharpe": 0.9715, "bh_return_pct": 37.12, "excess_sharpe": -0.5266, "precision": 0.5903, "recall": 0.732, "f1": 0.6536, "f2": 0.6985, "mcc": 0.007, "accuracy": 0.5435, "tp": 183, "fp": 127, "tn": 48, "fn": 67}], "per_window_val": [{"fold": "fold_1", "regime": "GFC peak crash (Lehman + Mar-2009 bottom)", "n": 104, "A_sharpe": 0.8753, "A_sortino": 0.947, "A_excess_sharpe": 1.0425, "A_return_pct": 9.3, "A_hit_rate": 50.98, "A_n": 104, "A_bh_sharpe": -0.1672, "A_bh_return_pct": -3.81, "A_psr": 0.7148, "A_ic": 0.073, "A_precision": 0.5286, "A_recall": 0.6852, "A_f1": 0.5968, "A_f2": 0.6469, "A_accuracy": 0.5192, "A_mcc": 0.0268, "A_tp": 37, "A_fp": 33, "A_tn": 17, "A_fn": 17, "B_sharpe": 3.5558, "B_sortino": 4.2386, "B_excess_sharpe": 5.8299, "B_return_pct": 108.23, "B_hit_rate": 56.31, "B_n": 104, "B_bh_sharpe": -2.2741, "B_bh_return_pct": -44.12, "B_psr": 0.9916, "B_ic": 0.1516, "B_precision": 0.5686, "B_recall": 0.5577, "B_f1": 0.5631, "B_f2": 0.5598, "B_accuracy": 0.5673, "B_mcc": 0.1346, "B_tp": 29, "B_fp": 22, "B_tn": 30, "B_fn": 23, "D_sharpe": 0.8753, "D_sortino": 0.947, "D_excess_sharpe": 1.0425, "D_return_pct": 9.3, "D_hit_rate": 50.98, "D_n": 104, "D_bh_sharpe": -0.1672, "D_bh_return_pct": -3.81, "D_psr": 0.7148, "D_ic": 0.073, "D_precision": 0.5286, "D_recall": 0.6852, "D_f1": 0.5968, "D_f2": 0.6469, "D_accuracy": 0.5192, "D_mcc": 0.0268, "D_tp": 37, "D_fp": 33, "D_tn": 17, "D_fn": 17, "sharpe": 0.8753, "sortino": 0.947, "return_pct": 9.3, "equity": 1093.0, "max_dd": 0.0, "win_rate": 50.98, "profit_factor": 0.0, "ic": 0.073, "hit": 50.98, "psr": 0.7148, "bh_sharpe": -0.1672, "bh_return_pct": -3.81, "excess_sharpe": 1.0425, "precision": 0.5286, "recall": 0.6852, "f1": 0.5968, "f2": 0.6469, "mcc": 0.0268, "accuracy": 0.5192, "tp": 37, "fp": 33, "tn": 17, "fn": 17}, {"fold": "fold_2", "regime": "2011 US-downgrade + EU debt", "n": 96, "A_sharpe": 0.0899, "A_sortino": 0.0883, "A_excess_sharpe": 0.3641, "A_return_pct": -0.46, "A_hit_rate": 48.42, "A_n": 96, "A_bh_sharpe": -0.2741, "A_bh_return_pct": -4.09, "A_psr": 0.522, "A_ic": -0.1661, "A_precision": 0.5, "A_recall": 0.72, "A_f1": 0.5902, "A_f2": 0.6618, "A_accuracy": 0.4792, "A_mcc": -0.0722, "A_tp": 36, "A_fp": 36, "A_tn": 10, "A_fn": 14, "B_sharpe": 2.7234, "B_sortino": 3.4901, "B_excess_sharpe": 3.7509, "B_return_pct": 70.76, "B_hit_rate": 51.04, "B_n": 96, "B_bh_sharpe": -1.0274, "B_bh_return_pct": -25.58, "B_psr": 0.9612, "B_ic": 0.0262, "B_precision": 0.4655, "B_recall": 0.6279, "B_f1": 0.5347, "B_f2": 0.587, "B_accuracy": 0.5104, "B_mcc": 0.0437, "B_tp": 27, "B_fp": 31, "B_tn": 22, "B_fn": 16, "D_sharpe": 0.0899, "D_sortino": 0.0883, "D_excess_sharpe": 0.3641, "D_return_pct": -0.46, "D_hit_rate": 48.42, "D_n": 96, "D_bh_sharpe": -0.2741, "D_bh_return_pct": -4.09, "D_psr": 0.522, "D_ic": -0.1661, "D_precision": 0.5, "D_recall": 0.72, "D_f1": 0.5902, "D_f2": 0.6618, "D_accuracy": 0.4792, "D_mcc": -0.0722, "D_tp": 36, "D_fp": 36, "D_tn": 10, "D_fn": 14, "sharpe": 0.0899, "sortino": 0.0883, "return_pct": -0.46, "equity": 995.4, "max_dd": 0.0, "win_rate": 48.42, "profit_factor": 0.0, "ic": -0.1661, "hit": 48.42, "psr": 0.522, "bh_sharpe": -0.2741, "bh_return_pct": -4.09, "excess_sharpe": 0.3641, "precision": 0.5, "recall": 0.72, "f1": 0.5902, "f2": 0.6618, "mcc": -0.0722, "accuracy": 0.4792, "tp": 36, "fp": 36, "tn": 10, "fn": 14}, {"fold": "fold_3", "regime": "Taper tantrum and 2014 H1", "n": 54, "A_sharpe": 4.9853, "A_sortino": 5.1648, "A_excess_sharpe": 0.2855, "A_return_pct": 11.08, "A_hit_rate": 62.96, "A_n": 54, "A_bh_sharpe": 4.6998, "A_bh_return_pct": 10.46, "A_psr": 0.9825, "A_ic": -0.0181, "A_precision": 0.6226, "A_recall": 1.0, "A_f1": 0.7674, "A_f2": 0.8919, "A_accuracy": 0.6296, "A_mcc": 0.1722, "A_tp": 33, "A_fp": 20, "A_tn": 1, "A_fn": 0, "B_sharpe": 3.1835, "B_sortino": 2.9207, "B_excess_sharpe": -5.8491, "B_return_pct": 16.8, "B_hit_rate": 64.81, "B_n": 54, "B_bh_sharpe": 9.0326, "B_bh_return_pct": 49.18, "B_psr": 0.9206, "B_ic": 0.0459, "B_precision": 0.7045, "B_recall": 0.8378, "B_f1": 0.7654, "B_f2": 0.8073, "B_accuracy": 0.6481, "B_mcc": 0.0874, "B_tp": 31, "B_fp": 13, "B_tn": 4, "B_fn": 6, "D_sharpe": 4.9853, "D_sortino": 5.1648, "D_excess_sharpe": 0.2855, "D_return_pct": 11.08, "D_hit_rate": 62.96, "D_n": 54, "D_bh_sharpe": 4.6998, "D_bh_return_pct": 10.46, "D_psr": 0.9825, "D_ic": -0.0181, "D_precision": 0.6226, "D_recall": 1.0, "D_f1": 0.7674, "D_f2": 0.8919, "D_accuracy": 0.6296, "D_mcc": 0.1722, "D_tp": 33, "D_fp": 20, "D_tn": 1, "D_fn": 0, "sharpe": 4.9853, "sortino": 5.1648, "return_pct": 11.08, "equity": 1110.8, "max_dd": 0.0, "win_rate": 62.96, "profit_factor": 0.0, "ic": -0.0181, "hit": 62.96, "psr": 0.9825, "bh_sharpe": 4.6998, "bh_return_pct": 10.46, "excess_sharpe": 0.2855, "precision": 0.6226, "recall": 1.0, "f1": 0.7674, "f2": 0.8919, "mcc": 0.1722, "accuracy": 0.6296, "tp": 33, "fp": 20, "tn": 1, "fn": 0}, {"fold": "fold_4", "regime": "China devaluation and oil crash", "n": 96, "A_sharpe": -0.6209, "A_sortino": -0.614, "A_excess_sharpe": -0.1968, "A_return_pct": -5.1, "A_hit_rate": 47.37, "A_n": 96, "A_bh_sharpe": -0.4241, "A_bh_return_pct": -3.73, "A_psr": 0.3517, "A_ic": -0.1001, "A_precision": 0.4516, "A_recall": 0.6222, "A_f1": 0.5234, "A_f2": 0.5785, "A_accuracy": 0.4688, "A_mcc": -0.0464, "A_tp": 28, "A_fp": 34, "A_tn": 17, "A_fn": 17, "B_sharpe": 1.9051, "B_sortino": 2.8863, "B_excess_sharpe": 3.0893, "B_return_pct": 33.11, "B_hit_rate": 46.88, "B_n": 96, "B_bh_sharpe": -1.1843, "B_bh_return_pct": -21.44, "B_psr": 0.903, "B_ic": -0.0413, "B_precision": 0.451, "B_recall": 0.5, "B_f1": 0.4742, "B_f2": 0.4894, "B_accuracy": 0.4688, "B_mcc": -0.0601, "B_tp": 23, "B_fp": 28, "B_tn": 22, "B_fn": 23, "D_sharpe": -0.6209, "D_sortino": -0.614, "D_excess_sharpe": -0.1968, "D_return_pct": -5.1, "D_hit_rate": 47.37, "D_n": 96, "D_bh_sharpe": -0.4241, "D_bh_return_pct": -3.73, "D_psr": 0.3517, "D_ic": -0.1001, "D_precision": 0.4516, "D_recall": 0.6222, "D_f1": 0.5234, "D_f2": 0.5785, "D_accuracy": 0.4688, "D_mcc": -0.0464, "D_tp": 28, "D_fp": 34, "D_tn": 17, "D_fn": 17, "sharpe": -0.6209, "sortino": -0.614, "return_pct": -5.1, "equity": 949.0, "max_dd": 0.0, "win_rate": 47.37, "profit_factor": 0.0, "ic": -0.1001, "hit": 47.37, "psr": 0.3517, "bh_sharpe": -0.4241, "bh_return_pct": -3.73, "excess_sharpe": -0.1968, "precision": 0.4516, "recall": 0.6222, "f1": 0.5234, "f2": 0.5785, "mcc": -0.0464, "accuracy": 0.4688, "tp": 28, "fp": 34, "tn": 17, "fn": 17}, {"fold": "fold_5", "regime": "2018 Vol-mageddon + Q4 sell-off", "n": 54, "A_sharpe": -0.3858, "A_sortino": -0.3653, "A_excess_sharpe": -1.8138, "A_return_pct": -1.29, "A_hit_rate": 48.15, "A_n": 54, "A_bh_sharpe": 1.428, "A_bh_return_pct": 3.97, "A_psr": 0.4295, "A_ic": -0.0701, "A_precision": 0.5111, "A_recall": 0.7931, "A_f1": 0.6216, "A_f2": 0.7143, "A_accuracy": 0.4815, "A_mcc": -0.1163, "A_tp": 23, "A_fp": 22, "A_tn": 3, "A_fn": 6, "B_sharpe": -3.124, "B_sortino": -3.033, "B_excess_sharpe": -8.0562, "B_return_pct": -19.07, "B_hit_rate": 38.89, "B_n": 54, "B_bh_sharpe": 4.9322, "B_bh_return_pct": 34.93, "B_psr": 0.0801, "B_ic": -0.4645, "B_precision": 0.625, "B_recall": 0.2703, "B_f1": 0.3774, "B_f2": 0.3049, "B_accuracy": 0.3889, "B_mcc": -0.0841, "B_tp": 10, "B_fp": 6, "B_tn": 11, "B_fn": 27, "D_sharpe": -0.3858, "D_sortino": -0.3653, "D_excess_sharpe": -1.8138, "D_return_pct": -1.29, "D_hit_rate": 48.15, "D_n": 54, "D_bh_sharpe": 1.428, "D_bh_return_pct": 3.97, "D_psr": 0.4295, "D_ic": -0.0701, "D_precision": 0.5111, "D_recall": 0.7931, "D_f1": 0.6216, "D_f2": 0.7143, "D_accuracy": 0.4815, "D_mcc": -0.1163, "D_tp": 23, "D_fp": 22, "D_tn": 3, "D_fn": 6, "sharpe": -0.3858, "sortino": -0.3653, "return_pct": -1.29, "equity": 987.1, "max_dd": 0.0, "win_rate": 48.15, "profit_factor": 0.0, "ic": -0.0701, "hit": 48.15, "psr": 0.4295, "bh_sharpe": 1.428, "bh_return_pct": 3.97, "excess_sharpe": -1.8138, "precision": 0.5111, "recall": 0.7931, "f1": 0.6216, "f2": 0.7143, "mcc": -0.1163, "accuracy": 0.4815, "tp": 23, "fp": 22, "tn": 3, "fn": 6}, {"fold": "fold_6", "regime": "COVID crash and V-recovery", "n": 75, "A_sharpe": 3.5977, "A_sortino": 3.3126, "A_excess_sharpe": -0.7017, "A_return_pct": 12.24, "A_hit_rate": 65.33, "A_n": 75, "A_bh_sharpe": 4.2994, "A_bh_return_pct": 14.68, "A_psr": 0.9675, "A_ic": -0.1448, "A_precision": 0.6712, "A_recall": 0.9608, "A_f1": 0.7903, "A_f2": 0.8845, "A_accuracy": 0.6533, "A_mcc": -0.1135, "A_tp": 49, "A_fp": 24, "A_tn": 0, "A_fn": 2, "B_sharpe": 0.7053, "B_sortino": 0.6883, "B_excess_sharpe": -13.6286, "B_return_pct": 4.44, "B_hit_rate": 54.67, "B_n": 75, "B_bh_sharpe": 14.3339, "B_bh_return_pct": 120.13, "B_psr": 0.6488, "B_ic": 0.0655, "B_precision": 0.9394, "B_recall": 0.4921, "B_f1": 0.6458, "B_f2": 0.5439, "B_accuracy": 0.5467, "B_mcc": 0.2403, "B_tp": 31, "B_fp": 2, "B_tn": 10, "B_fn": 32, "D_sharpe": 3.5977, "D_sortino": 3.3126, "D_excess_sharpe": -0.7017, "D_return_pct": 12.24, "D_hit_rate": 65.33, "D_n": 75, "D_bh_sharpe": 4.2994, "D_bh_return_pct": 14.68, "D_psr": 0.9675, "D_ic": -0.1448, "D_precision": 0.6712, "D_recall": 0.9608, "D_f1": 0.7903, "D_f2": 0.8845, "D_accuracy": 0.6533, "D_mcc": -0.1135, "D_tp": 49, "D_fp": 24, "D_tn": 0, "D_fn": 2, "sharpe": 3.5977, "sortino": 3.3126, "return_pct": 12.24, "equity": 1122.4, "max_dd": 0.0, "win_rate": 65.33, "profit_factor": 0.0, "ic": -0.1448, "hit": 65.33, "psr": 0.9675, "bh_sharpe": 4.2994, "bh_return_pct": 14.68, "excess_sharpe": -0.7017, "precision": 0.6712, "recall": 0.9608, "f1": 0.7903, "f2": 0.8845, "mcc": -0.1135, "accuracy": 0.6533, "tp": 49, "fp": 24, "tn": 0, "fn": 2}, {"fold": "fold_7", "regime": "Inflation bear, AI rally and 2025", "n": 114, "A_sharpe": 1.3517, "A_sortino": 1.3262, "A_excess_sharpe": -1.4933, "A_return_pct": 9.43, "A_hit_rate": 55.26, "A_n": 114, "A_bh_sharpe": 2.845, "A_bh_return_pct": 21.34, "A_psr": 0.8158, "A_ic": -0.0267, "A_precision": 0.5784, "A_recall": 0.8806, "A_f1": 0.6982, "A_f2": 0.7973, "A_accuracy": 0.5526, "A_mcc": -0.055, "A_tp": 59, "A_fp"