{"experiment_num": 96, "backbone": "lightgbm", "description": "LightGBM @ exp 95 NEW CHAMP n_est=1500 seed=0 - multi-seed verify", "config": {"seq_len": 60, "lr": 0.0003, "batch_size": 32, "epochs": 50, "weight_decay": 1e-05, "patience": 10, "warmup_epochs": 0, "head_dropout": 0.1, "huber_delta": 1.0, "grad_clip": 1.0, "seed": 0, "hidden_size": null, "num_layers": null, "max_depth": 4, "gbm_lr": 0.01, "n_estimators": 1500}, "composite": -0.4571, "test_pos_folds": 3, "val_pos_folds": 5, "val_loss": null, "elapsed_sec": 337.0, "timestamp": "2026-04-28T00:06:13", "sharpe": -0.0571, "val_sharpe": 1.3378, "ic": 0.0019, "hit": 47.93, "psr": 0.4533, "equity": 850.4000000000001, "return_pct": -14.96, "bh_sharpe": 1.2194, "bh_return_pct": 187.05, "excess_sharpe": -1.2765, "B_sharpe": -0.268, "B_excess_sharpe": -3.0962, "B_return_pct": -62.65, "D_sharpe": -0.2733, "D_excess_sharpe": -1.4927, "D_return_pct": -30.83, "precision": 0.5762, "recall": 0.4604, "f1": 0.5119, "f2": 0.4797, "mcc": -0.031, "accuracy": 0.4799, "val_precision": 0.5278, "val_recall": 0.7252, "val_f1": 0.6109, "val_f2": 0.6747, "val_mcc": 0.0718, "val_accuracy": 0.5346, "per_window": [{"fold": "fold_1", "regime": "GFC peak crash (Lehman + Mar-2009 bottom)", "n": 66, "A_sharpe": -1.3329, "A_sortino": -1.3811, "A_excess_sharpe": -1.905, "A_return_pct": -13.82, "A_hit_rate": 42.42, "A_n": 66, "A_bh_sharpe": 0.5721, "A_bh_return_pct": 3.85, "A_psr": 0.2508, "A_ic": 0.0528, "A_precision": 0.4615, "A_recall": 0.5143, "A_f1": 0.4865, "A_f2": 0.5028, "A_accuracy": 0.4242, "A_mcc": -0.1656, "A_tp": 18, "A_fp": 21, "A_tn": 10, "A_fn": 17, "B_sharpe": 0.8105, "B_sortino": 0.8458, "B_excess_sharpe": -1.2364, "B_return_pct": 8.94, "B_hit_rate": 49.23, "B_n": 66, "B_bh_sharpe": 2.0469, "B_bh_return_pct": 39.28, "B_psr": 0.6596, "B_ic": 0.2869, "B_precision": 0.6, "B_recall": 0.25, "B_f1": 0.3529, "B_f2": 0.283, "B_accuracy": 0.5, "B_mcc": 0.0594, "B_tp": 9, "B_fp": 6, "B_tn": 24, "B_fn": 27, "D_sharpe": 0.4143, "D_sortino": 0.4186, "D_excess_sharpe": -0.1578, "D_return_pct": 2.25, "D_hit_rate": 51.52, "D_n": 66, "D_bh_sharpe": 0.5721, "D_bh_return_pct": 3.85, "D_psr": 0.5834, "D_ic": 0.1849, "D_precision": 0.6, "D_recall": 0.2571, "D_f1": 0.36, "D_f2": 0.2903, "D_accuracy": 0.5152, "D_mcc": 0.0757, "D_tp": 9, "D_fp": 6, "D_tn": 25, "D_fn": 26, "sharpe": -1.3329, "sortino": -1.3811, "return_pct": -13.82, "equity": 861.8, "max_dd": 0.0, "win_rate": 42.42, "profit_factor": 0.0, "ic": 0.0528, "hit": 42.42, "psr": 0.2508, "bh_sharpe": 0.5721, "bh_return_pct": 3.85, "excess_sharpe": -1.905, "precision": 0.4615, "recall": 0.5143, "f1": 0.4865, "f2": 0.5028, "mcc": -0.1656, "accuracy": 0.4242, "tp": 18, "fp": 21, "tn": 10, "fn": 17}, {"fold": "fold_2", "regime": "2011 US-downgrade + EU debt", "n": 87, "A_sharpe": 3.3295, "A_sortino": 4.3556, "A_excess_sharpe": -1.6925, "A_return_pct": 18.9, "A_hit_rate": 55.81, "A_n": 87, "A_bh_sharpe": 5.022, "A_bh_return_pct": 29.23, "A_psr": 0.9837, "A_ic": 0.1175, "A_precision": 0.6471, "A_recall": 0.6111, "A_f1": 0.6286, "A_f2": 0.618, "A_accuracy": 0.5517, "A_mcc": 0.0647, "A_tp": 33, "A_fp": 18, "A_tn": 15, "A_fn": 21, "B_sharpe": 4.9136, "B_sortino": 5.5795, "B_excess_sharpe": -6.2234, "B_return_pct": 69.95, "B_hit_rate": 62.07, "B_n": 87, "B_bh_sharpe": 11.1369, "B_bh_return_pct": 185.4, "B_psr": 0.9982, "B_ic": 0.093, "B_precision": 0.8596, "B_recall": 0.6622, "B_f1": 0.7481, "B_f2": 0.6941, "B_accuracy": 0.6207, "B_mcc": 0.0351, "B_tp": 49, "B_fp": 8, "B_tn": 5, "B_fn": 25, "D_sharpe": 1.8793, "D_sortino": 2.1416, "D_excess_sharpe": -3.1427, "D_return_pct": 10.22, "D_hit_rate": 55.81, "D_n": 87, "D_bh_sharpe": 5.022, "D_bh_return_pct": 29.23, "D_psr": 0.8756, "D_ic": 0.037, "D_precision": 0.6316, "D_recall": 0.6667, "D_f1": 0.6486, "D_f2": 0.6593, "D_accuracy": 0.5517, "D_mcc": 0.0309, "D_tp": 36, "D_fp": 21, "D_tn": 12, "D_fn": 18, "sharpe": 3.3295, "sortino": 4.3556, "return_pct": 18.9, "equity": 1189.0, "max_dd": 0.0, "win_rate": 55.81, "profit_factor": 0.0, "ic": 0.1175, "hit": 55.81, "psr": 0.9837, "bh_sharpe": 5.022, "bh_return_pct": 29.23, "excess_sharpe": -1.6925, "precision": 0.6471, "recall": 0.6111, "f1": 0.6286, "f2": 0.618, "mcc": 0.0647, "accuracy": 0.5517, "tp": 33, "fp": 18, "tn": 15, "fn": 21}, {"fold": "fold_3", "regime": "Taper tantrum and 2014 H1", "n": 129, "A_sharpe": 1.573, "A_sortino": 1.6542, "A_excess_sharpe": -0.1948, "A_return_pct": 10.37, "A_hit_rate": 51.56, "A_n": 129, "A_bh_sharpe": 1.7678, "A_bh_return_pct": 11.76, "A_psr": 0.8669, "A_ic": 0.08, "A_precision": 0.6081, "A_recall": 0.5769, "A_f1": 0.5921, "A_f2": 0.5829, "A_accuracy": 0.5194, "A_mcc": 0.0082, "A_tp": 45, "A_fp": 29, "A_tn": 22, "A_fn": 33, "B_sharpe": 0.6604, "B_sortino": 0.6349, "B_excess_sharpe": -3.5869, "B_return_pct": 6.92, "B_hit_rate": 53.49, "B_n": 129, "B_bh_sharpe": 4.2474, "B_bh_return_pct": 64.1, "B_psr": 0.6802, "B_ic": -0.0026, "B_precision": 0.631, "B_recall": 0.6463, "B_f1": 0.6386, "B_f2": 0.6432, "B_accuracy": 0.5349, "B_mcc": -0.0134, "B_tp": 53, "B_fp": 31, "B_tn": 16, "B_fn": 29, "D_sharpe": 0.6118, "D_sortino": 0.5777, "D_excess_sharpe": -1.156, "D_return_pct": 3.66, "D_hit_rate": 53.12, "D_n": 129, "D_bh_sharpe": 1.7678, "D_bh_return_pct": 11.76, "D_psr": 0.6669, "D_ic": 0.0713, "D_precision": 0.6071, "D_recall": 0.6538, "D_f1": 0.6296, "D_f2": 0.6439, "D_accuracy": 0.5349, "D_mcc": 0.007, "D_tp": 51, "D_fp": 33, "D_tn": 18, "D_fn": 27, "sharpe": 1.573, "sortino": 1.6542, "return_pct": 10.37, "equity": 1103.6999999999998, "max_dd": 0.0, "win_rate": 51.56, "profit_factor": 0.0, "ic": 0.08, "hit": 51.56, "psr": 0.8669, "bh_sharpe": 1.7678, "bh_return_pct": 11.76, "excess_sharpe": -0.1948, "precision": 0.6081, "recall": 0.5769, "f1": 0.5921, "f2": 0.5829, "mcc": 0.0082, "accuracy": 0.5194, "tp": 45, "fp": 29, "tn": 22, "fn": 33}, {"fold": "fold_4", "regime": "China devaluation and oil crash", "n": 108, "A_sharpe": -0.6827, "A_sortino": -0.6443, "A_excess_sharpe": 0.007, "A_return_pct": -6.65, "A_hit_rate": 49.53, "A_n": 108, "A_bh_sharpe": -0.6898, "A_bh_return_pct": -6.71, "A_psr": 0.3275, "A_ic": 0.0517, "A_precision": 0.4906, "A_recall": 0.4906, "A_f1": 0.4906, "A_f2": 0.4906, "A_accuracy": 0.5, "A_mcc": -0.0003, "A_tp": 26, "A_fp": 27, "A_tn": 28, "A_fn": 27, "B_sharpe": -2.9247, "B_sortino": -2.687, "B_excess_sharpe": -0.9672, "B_return_pct": -44.28, "B_hit_rate": 40.74, "B_n": 108, "B_bh_sharpe": -1.9575, "B_bh_return_pct": -33.56, "B_psr": 0.025, "B_ic": -0.0824, "B_precision": 0.3818, "B_recall": 0.4118, "B_f1": 0.3962, "B_f2": 0.4054, "B_accuracy": 0.4074, "B_mcc": -0.1845, "B_tp": 21, "B_fp": 34, "B_tn": 23, "B_fn": 30, "D_sharpe": -2.1425, "D_sortino": -1.873, "D_excess_sharpe": -1.4527, "D_return_pct": -17.73, "D_hit_rate": 46.73, "D_n": 108, "D_bh_sharpe": -0.6898, "D_bh_return_pct": -6.71, "D_psr": 0.0744, "D_ic": -0.0478, "D_precision": 0.4545, "D_recall": 0.4717, "D_f1": 0.463, "D_f2": 0.4682, "D_accuracy": 0.463, "D_mcc": -0.0738, "D_tp": 25, "D_fp": 30, "D_tn": 25, "D_fn": 28, "sharpe": -0.6827, "sortino": -0.6443, "return_pct": -6.65, "equity": 933.5, "max_dd": 0.0, "win_rate": 49.53, "profit_factor": 0.0, "ic": 0.0517, "hit": 49.53, "psr": 0.3275, "bh_sharpe": -0.6898, "bh_return_pct": -6.71, "excess_sharpe": 0.007, "precision": 0.4906, "recall": 0.4906, "f1": 0.4906, "f2": 0.4906, "mcc": -0.0003, "accuracy": 0.5, "tp": 26, "fp": 27, "tn": 28, "fn": 27}, {"fold": "fold_5", "regime": "2018 Vol-mageddon + Q4 sell-off", "n": 128, "A_sharpe": 0.0942, "A_sortino": 0.1093, "A_excess_sharpe": -1.0569, "A_return_pct": -0.28, "A_hit_rate": 43.75, "A_n": 128, "A_bh_sharpe": 1.1511, "A_bh_return_pct": 13.19, "A_psr": 0.5267, "A_ic": -0.0246, "A_precision": 0.5484, "A_recall": 0.4359, "A_f1": 0.4857, "A_f2": 0.4545, "A_accuracy": 0.4375, "A_mcc": -0.1212, "A_tp": 34, "A_fp": 28, "A_tn": 22, "A_fn": 44, "B_sharpe": -3.4984, "B_sortino": -3.4631, "B_excess_sharpe": -6.3103, "B_return_pct": -57.9, "B_hit_rate": 33.86, "B_n": 128, "B_bh_sharpe": 2.8119, "B_bh_return_pct": 82.25, "B_psr": 0.0069, "B_ic": -0.0646, "B_precision": 0.5111, "B_recall": 0.2706, "B_f1": 0.3538, "B_f2": 0.2987, "B_accuracy": 0.3438, "B_mcc": -0.2384, "B_tp": 23, "B_fp": 22, "B_tn": 21, "B_fn": 62, "D_sharpe": -1.1581, "D_sortino": -1.289, "D_excess_sharpe": -2.3092, "D_return_pct": -14.19, "D_hit_rate": 41.41, "D_n": 128, "D_bh_sharpe": 1.1511, "D_bh_return_pct": 13.19, "D_psr": 0.2116, "D_ic": -0.0462, "D_precision": 0.5333, "D_recall": 0.3077, "D_f1": 0.3902, "D_f2": 0.3361, "D_accuracy": 0.4141, "D_mcc": -0.1148, "D_tp": 24, "D_fp": 21, "D_tn": 29, "D_fn": 54, "sharpe": 0.0942, "sortino": 0.1093, "return_pct": -0.28, "equity": 997.1999999999999, "max_dd": 0.0, "win_rate": 43.75, "profit_factor": 0.0, "ic": -0.0246, "hit": 43.75, "psr": 0.5267, "bh_sharpe": 1.1511, "bh_return_pct": 13.19, "excess_sharpe": -1.0569, "precision": 0.5484, "recall": 0.4359, "f1": 0.4857, "f2": 0.4545, "mcc": -0.1212, "accuracy": 0.4375, "tp": 34, "fp": 28, "tn": 22, "fn": 44}, {"fold": "fold_6", "regime": "COVID crash and V-recovery", "n": 173, "A_sharpe": -0.1046, "A_sortino": -0.1175, "A_excess_sharpe": -2.4307, "A_return_pct": -3.69, "A_hit_rate": 46.24, "A_n": 173, "A_bh_sharpe": 2.3261, "A_bh_return_pct": 43.81, "A_psr": 0.4656, "A_ic": 0.0176, "A_precision": 0.619, "A_recall": 0.4602, "A_f1": 0.5279, "A_f2": 0.4851, "A_accuracy": 0.4624, "A_mcc": -0.0697, "A_tp": 52, "A_fp": 32, "A_tn": 28, "A_fn": 61, "B_sharpe": 0.2915, "B_sortino": 0.3189, "B_excess_sharpe": -5.4545, "B_return_pct": 1.41, "B_hit_rate": 48.26, "B_n": 173, "B_bh_sharpe": 5.746, "B_bh_return_pct": 499.04, "B_psr": 0.5955, "B_ic": 0.099, "B_precision": 0.6833, "B_recall": 0.3694, "B_f1": 0.4795, "B_f2": 0.4067, "B_accuracy": 0.4855, "B_mcc": 0.0634, "B_tp": 41, "B_fp": 19, "B_tn": 43, "B_fn": 70, "D_sharpe": -0.4159, "D_sortino": -0.4631, "D_excess_sharpe": -2.742, "D_return_pct": -8.56, "D_hit_rate": 42.77, "D_n": 173, "D_bh_sharpe": 2.3261, "D_bh_return_pct": 43.81, "D_psr": 0.3662, "D_ic": -0.0003, "D_precision": 0.6167, "D_recall": 0.3274, "D_f1": 0.4277, "D_f2": 0.3613, "D_accuracy": 0.4277, "D_mcc": -0.0559, "D_tp": 37, "D_fp": 23, "D_tn": 37, "D_fn": 76, "sharpe": -0.1046, "sortino": -0.1175, "return_pct": -3.69, "equity": 963.0999999999999, "max_dd": 0.0, "win_rate": 46.24, "profit_factor": 0.0, "ic": 0.0176, "hit": 46.24, "psr": 0.4656, "bh_sharpe": 2.3261, "bh_return_pct": 43.81, "excess_sharpe": -2.4307, "precision": 0.619, "recall": 0.4602, "f1": 0.5279, "f2": 0.4851, "mcc": -0.0697, "accuracy": 0.4624, "tp": 52, "fp": 32, "tn": 28, "fn": 61}, {"fold": "fold_7", "regime": "Inflation bear, AI rally and 2025", "n": 376, "A_sharpe": -0.4142, "A_sortino": -0.4339, "A_excess_sharpe": -1.2175, "A_return_pct": -16.14, "A_hit_rate": 47.61, "A_n": 376, "A_bh_sharpe": 0.8033, "A_bh_return_pct": 26.02, "A_psr": 0.3091, "A_ic": -0.0262, "A_precision": 0.5845, "A_recall": 0.3756, "A_f1": 0.4573, "A_f2": 0.4045, "A_accuracy": 0.4761, "A_mcc": -0.0052, "A_tp": 83, "A_fp": 59, "A_tn": 96, "A_fn": 138, "B_sharpe": -0.1032, "B_sortino": -0.1159, "B_excess_sharpe": -2.0349, "B_return_pct": -20.69, "B_hit_rate": 45.07, "B_n": 376, "B_bh_sharpe": 1.9317, "B_bh_return_pct": 222.05, "B_psr": 0.45, "B_ic": -0.0518, "B_precision": 0.7234, "B_recall": 0.1498, "B_f1": 0.2482, "B_f2": 0.178, "B_accuracy": 0.4521, "B_mcc": 0.0925, "B_tp": 34, "B_fp": 13, "B_tn": 136, "B_fn": 193, "D_sharpe": -0.1472, "D_sortino": -0.1796, "D_excess_sharpe": -0.9505, "D_return_pct": -8.28, "D_hit_rate": 42.55, "D_n": 376, "D_bh_sharpe": 0.8033, "D_bh_return_pct": 26.02, "D_psr": 0.4293, "D_ic": -0.0188, "D_precision": 0.5532, "D_recall": 0.1176, "D_f1": 0.194, "D_f2": 0.1396, "D_accuracy": 0.4255, "D_mcc": -0.0265, "D_tp": 26, "D_fp": 21, "D_tn": 134, "D_fn": 195, "sharpe": -0.4142, "sortino": -0.4339, "return_pct": -16.14, "equity": 838.6, "max_dd": 0.0, "win_rate": 47.61, "profit_factor": 0.0, "ic": -0.0262, "hit": 47.61, "psr": 0.3091, "bh_sharpe": 0.8033, "bh_return_pct": 26.02, "excess_sharpe": -1.2175, "precision": 0.5845, "recall": 0.3756, "f1": 0.4573, "f2": 0.4045, "mcc": -0.0052, "accuracy": 0.4761, "tp": 83, "fp": 59, "tn": 96, "fn": 138}], "per_window_val": [{"fold": "fold_1", "regime": "GFC peak crash (Lehman + Mar-2009 bottom)", "n": 65, "A_sharpe": 1.8886, "A_sortino": 2.1039, "A_excess_sharpe": 4.1143, "A_return_pct": 16.08, "A_hit_rate": 52.38, "A_n": 65, "A_bh_sharpe": -2.2257, "A_bh_return_pct": -18.74, "A_psr": 0.836, "A_ic": 0.1648, "A_precision": 0.4821, "A_recall": 0.931, "A_f1": 0.6353, "A_f2": 0.7849, "A_accuracy": 0.5231, "A_mcc": 0.1806, "A_tp": 27, "A_fp": 29, "A_tn": 7, "A_fn": 2, "B_sharpe": -4.8065, "B_sortino": -4.0599, "B_excess_sharpe": 2.3158, "B_return_pct": -61.34, "B_hit_rate": 40.0, "B_n": 65, "B_bh_sharpe": -7.1223, "B_bh_return_pct": -73.11, "B_psr": 0.0051, "B_ic": 0.0783, "B_precision": 0.371, "B_recall": 1.0, "B_f1": 0.5412, "B_f2": 0.7468, "B_accuracy": 0.4, "B_mcc": 0.1628, "B_tp": 23, "B_fp": 39, "B_tn": 3, "B_fn": 0, "D_sharpe": -1.1614, "D_sortino": -0.9741, "D_excess_sharpe": 1.0642, "D_return_pct": -10.97, "D_hit_rate": 50.79, "D_n": 65, "D_bh_sharpe": -2.2257, "D_bh_return_pct": -18.74, "D_psr": 0.2717, "D_ic": 0.2882, "D_precision": 0.4677, "D_recall": 1.0, "D_f1": 0.6374, "D_f2": 0.8146, "D_accuracy": 0.4923, "D_mcc": 0.1974, "D_tp": 29, "D_fp": 33, "D_tn": 3, "D_fn": 0, "sharpe": 1.8886, "sortino": 2.1039, "return_pct": 16.08, "equity": 1160.8, "max_dd": 0.0, "win_rate": 52.38, "profit_factor": 0.0, "ic": 0.1648, "hit": 52.38, "psr": 0.836, "bh_sharpe": -2.2257, "bh_return_pct": -18.74, "excess_sharpe": 4.1143, "precision": 0.4821, "recall": 0.931, "f1": 0.6353, "f2": 0.7849, "mcc": 0.1806, "accuracy": 0.5231, "tp": 27, "fp": 29, "tn": 7, "fn": 2}, {"fold": "fold_2", "regime": "2011 US-downgrade + EU debt", "n": 47, "A_sharpe": 1.3085, "A_sortino": 1.3097, "A_excess_sharpe": 1.5026, "A_return_pct": 7.59, "A_hit_rate": 53.19, "A_n": 47, "A_bh_sharpe": -0.1941, "A_bh_return_pct": -2.36, "A_psr": 0.7094, "A_ic": 0.1081, "A_precision": 0.5556, "A_recall": 0.7692, "A_f1": 0.6452, "A_f2": 0.7143, "A_accuracy": 0.5319, "A_mcc": 0.0086, "A_tp": 20, "A_fp": 16, "A_tn": 5, "A_fn": 6, "B_sharpe": -0.091, "B_sortino": -0.0837, "B_excess_sharpe": 1.5214, "B_return_pct": -6.42, "B_hit_rate": 51.06, "B_n": 47, "B_bh_sharpe": -1.6123, "B_bh_return_pct": -24.3, "B_psr": 0.4845, "B_ic": 0.1633, "B_precision": 0.475, "B_recall": 0.9048, "B_f1": 0.623, "B_f2": 0.7661, "B_accuracy": 0.5106, "B_mcc": 0.1356, "B_tp": 19, "B_fp": 21, "B_tn": 5, "B_fn": 2, "D_sharpe": -0.0597, "D_sortino": -0.0502, "D_excess_sharpe": 0.1344, "D_return_pct": -1.51, "D_hit_rate": 57.45, "D_n": 47, "D_bh_sharpe": -0.1941, "D_bh_return_pct": -2.36, "D_psr": 0.4898, "D_ic": 0.0153, "D_precision": 0.575, "D_recall": 0.8846, "D_f1": 0.697, "D_f2": 0.7986, "D_accuracy": 0.5745, "D_mcc": 0.1049, "D_tp": 23, "D_fp": 17, "D_tn": 4, "D_fn": 3, "sharpe": 1.3085, "sortino": 1.3097, "return_pct": 7.59, "equity": 1075.9, "max_dd": 0.0, "win_rate": 53.19, "profit_factor": 0.0, "ic": 0.1081, "hit": 53.19, "psr": 0.7094, "bh_sharpe": -0.1941, "bh_return_pct": -2.36, "excess_sharpe": 1.5026, "precision": 0.5556, "recall": 0.7692, "f1": 0.6452, "f2": 0.7143, "mcc": 0.0086, "accuracy": 0.5319, "tp": 20, "fp": 16, "tn": 5, "fn": 6}, {"fold": "fold_3", "regime": "Taper tantrum and 2014 H1", "n": 5, "A_sharpe": 5.9118, "A_sortino": 4.2395, "A_excess_sharpe": 7.2312, "A_return_pct": 0.0, "A_hit_rate": 0.0, "A_n": 5, "A_bh_sharpe": -1.3194, "A_bh_return_pct": -0.21, "A_psr": 0.759, "A_ic": 0.7, "A_precision": 1.0, "A_recall": 0.5, "A_f1": 0.6667, "A_f2": 0.5556, "A_accuracy": 0.8, "A_mcc": 0.6124, "A_tp": 1, "A_fp": 0, "A_tn": 3, "A_fn": 1, "B_sharpe": 25.8705, "B_sortino": 0.0, "B_excess_sharpe": 51.7411, "B_return_pct": 3.95, "B_hit_rate": 100.0, "B_n": 5, "B_bh_sharpe": -25.8705, "B_bh_return_pct": -3.84, "B_psr": 1.0, "B_ic": -0.1, "B_precision": 0.0, "B_recall": 0.0, "B_f1": 0.0, "B_f2": 0.0, "B_accuracy": 1.0, "B_mcc": 0.0, "B_tp": 0, "B_fp": 0, "B_tn": 5, "B_fn": 0, "D_sharpe": 1.3194, "D_sortino": 1.268, "D_excess_sharpe": 2.6388, "D_return_pct": 0.2, "D_hit_rate": 60.0, "D_n": 5, "D_bh_sharpe": -1.3194, "D_bh_return_pct": -0.21, "D_psr": 0.5663, "D_ic": 0.1, "D_precision": 0.0, "D_recall": 0.0, "D_f1": 0.0, "D_f2": 0.0, "D_accuracy": 0.6, "D_mcc": 0.0, "D_tp": 0, "D_fp": 0, "D_tn": 3, "D_fn": 2, "sharpe": 5.9118, "sortino": 4.2395, "return_pct": 0.0, "equity": 1000.0, "max_dd": 0.0, "win_rate": 0.0, "profit_factor": 0.0, "ic": 0.7, "hit": 0.0, "psr": 0.759, "bh_sharpe": -1.3194, "bh_return_pct": -0.21, "excess_sharpe": 7.2312, "precision": 1.0, "recall": 0.5, "f1": 0.6667, "f2": 0.5556, "mcc": 0.6124, "accuracy": 0.8, "tp": 1, "fp": 0, "tn": 3, "fn": 1}, {"fold": "fold_4", "regime": "China devaluation and oil crash", "n": 47, "A_sharpe": -2.5977, "A_sortino": -2.4593, "A_excess_sharpe": -0.7739, "A_return_pct": -11.84, "A_hit_rate": 40.43, "A_n": 47, "A_bh_sharpe": -1.8238, "A_bh_return_pct": -8.68, "A_psr": 0.1344, "A_ic": 0.0062, "A_precision": 0.4103, "A_recall": 0.7619, "A_f1": 0.5333, "A_f2": 0.6504, "A_accuracy": 0.4043, "A_mcc": -0.1623, "A_tp": 16, "A_fp": 23, "A_tn": 3, "A_fn": 5, "B_sharpe": -0.3718, "B_sortino": -0.312, "B_excess_sharpe": 1.8482, "B_return_pct": -7.15, "B_hit_rate": 51.06, "B_n": 47, "B_bh_sharpe": -2.22, "B_bh_return_pct": -23.98, "B_psr": 0.4358, "B_ic": 0.599, "B_precision": 0.4762, "B_recall": 0.9524, "B_f1": 0.6349, "B_f2": 0.7937, "B_accuracy": 0.5106, "B_mcc": 0.1713, "B_tp": 20, "B_fp": 22, "B_tn": 4, "B_fn": 1, "D_sharpe": -2.08, "D_sortino": -1.9021, "D_excess_sharpe": -0.2562, "D_return_pct": -9.74, "D_hit_rate": 46.81, "D_n": 47, "D_bh_sharpe": -1.8238, "D_bh_return_pct": -8.68, "D_psr": 0.1869, "D_ic": 0.1974, "D_precision": 0.4524, "D_recall": 0.9048, "D_f1": 0.6032, "D_f2": 0.754, "D_accuracy": 0.4681, "D_mcc": 0.0325, "D_tp": 19, "D_fp": 23, "D_tn": 3, "D_fn": 2, "sharpe": -2.5977, "sortino": -2.4593, "return_pct": -11.84, "equity": 881.5999999999999, "max_dd": 0.0, "win_rate": 40.43, "profit_factor": 0.0, "ic": 0.0062, "hit": 40.43, "psr": 0.1344, "bh_sharpe": -1.8238, "bh_return_pct": -8.68, "excess_sharpe": -0.7739, "precision": 0.4103, "recall": 0.7619, "f1": 0.5333, "f2": 0.6504, "mcc": -0.1623, "accuracy": 0.4043, "tp": 16, "fp": 23, "tn": 3, "fn": 5}, {"fold": "fold_5", "regime": "2018 Vol-mageddon + Q4 sell-off", "n": 5, "A_sharpe": -10.1368, "A_sortino": -6.9937, "A_excess_sharpe": 0.0, "A_return_pct": -3.15, "A_hit_rate": 40.0, "A_n": 5, "A_bh_sharpe": -10.1368, "A_bh_return_pct": -3.15, "A_psr": 0.0985, "A_ic": 0.6, "A_precision": 0.4, "A_recall": 1.0, "A_f1": 0.5714, "A_f2": 0.7692, "A_accuracy": 0.4, "A_mcc": 0.0, "A_tp": 2, "A_fp": 3, "A_tn": 0, "A_fn": 0, "B_sharpe": 5.6858, "B_sortino": 6.0578, "B_excess_sharpe": 0.0, "B_return_pct": 4.22, "B_hit_rate": 60.0, "B_n": 5, "B_bh_sharpe": 5.6858, "B_bh_return_pct": 4.22, "B_psr": 0.753, "B_ic": 0.8, "B_precision": 0.6, "B_recall": 1.0, "B_f1": 0.75, "B_f2": 0.8824, "B_accuracy": 0.6, "B_mcc": 0.0, "B_tp": 3, "B_fp": 2, "B_tn": 0, "B_fn": 0, "D_sharpe": -10.1368, "D_sortino": -6.9937, "D_excess_sharpe": 0.0, "D_return_pct": -3.15, "D_hit_rate": 40.0, "D_n": 5, "D_bh_sharpe": -10.1368, "D_bh_return_pct": -3.15, "D_psr": 0.0985, "D_ic": 0.5, "D_precision": 0.4, "D_recall": 1.0, "D_f1": 0.5714, "D_f2": 0.7692, "D_accuracy": 0.4, "D_mcc": 0.0, "D_tp": 2, "D_fp": 3, "D_tn": 0, "D_fn": 0, "sharpe": -10.1368, "sortino": -6.9937, "return_pct": -3.15, "equity": 968.5, "max_dd": 0.0, "win_rate": 40.0, "profit_factor": 0.0, "ic": 0.6, "hit": 40.0, "psr": 0.0985, "bh_sharpe": -10.1368, "bh_return_pct": -3.15, "excess_sharpe": 0.0, "precision": 0.4, "recall": 1.0, "f1": 0.5714, "f2": 0.7692, "mcc": 0.0, "accuracy": 0.4, "tp": 2, "fp": 3, "tn": 0, "fn": 0}, {"fold": "fold_6", "regime": "COVID crash and V-recovery", "n": 26, "A_sharpe": 8.3588, "A_sortino": 10.3159, "A_excess_sharpe": 5.0736, "A_return_pct": 11.59, "A_hit_rate": 69.23, "A_n": 26, "A_bh_sharpe": 3.2852, "A_bh_return_pct": 4.82, "A_psr": 0.9949, "A_ic": 0.3525, "A_precision": 0.7222, "A_recall": 0.8125, "A_f1": 0.7647, "A_f2": 0.7927, "A_accuracy": 0.6923, "A_mcc": 0.3294, "A_tp": 13, "A_fp": 5, "A_tn": 5, "A_fn": 3, "B_sharpe": 1.1972, "B_sortino": 1.2016, "B_excess_sharpe": -11.782, "B_return_pct": 3.48, "B_hit_rate": 53.85, "B_n": 26, "B_bh_sharpe": 12.9792, "B_bh_return_pct": 38.76, "B_psr": 0.647, "B_ic": 0.505, "B_precision": 1.0, "B_recall": 0.4286, "B_f1": 0.6, "B_f2": 0.4839, "B_accuracy": 0.5385, "B_mcc": 0.355, "B_tp": 9, "B_fp": 0, "B_tn": 5, "B_fn": 12, "D_sharpe": 2.3399, "D_sortino": 2.7298, "D_excess_sharpe": -0.9453, "D_return_pct": 3.42, "D_hit_rate": 50.0, "D_n": 26, "D_bh_sharpe": 3.2852, "D_bh_return_pct": 4.82, "D_psr": 0.7715, "D_ic": 0.2998, "D_precision": 0.6667, "D_recall": 0.375, "D_f1": 0.48, "D_f2": 0.411, "D_accuracy": 0.5, "D_mcc": 0.0767, "D_tp": 6, "D_fp": 3, "D_tn": 7, "D_fn": 10, "sharpe": 8.3588, "sortino": 10.3159, "return_pct": 11.59, "equity": 1115.8999999999999, "max_dd": 0.0, "win_rate": 69.23, "profit_factor": 0.0, "ic": 0.3525, "hit": 69.23, "psr": 0.9949, "bh_sharpe": 3.2852, "bh_return_pct": 4.82, "excess_sharpe": 5.0736, "precision": 0.7222, "recall": 0.8125, "f1": 0.7647, "f2": 0.7927, "mcc": 0.3294, "accuracy": 0.6923, "tp": 13, "fp": 5, "tn": 5, "fn": 3}, {"fold": "fold_7", "regime": "Inflation bear, AI rally and 2025", "n": 65, "A_sharpe": 3.8954, "A_sortino": 4.7829, "A_excess_sharpe": 1.8165, "A_return_pct": 15.79, "A_hit_rate": 56.92, "A_n": 65, "A_bh_sharpe": 2.0789, "A_bh_return_pct": 8.17, "A_psr": 0.9797, "A_ic": 0.2943, "A_precision": 0.64, "A_recall": 0.4571, "A_f1": 0.5333, "A_f2": 0.4848, "A_accuracy": 0.5692, "A_mcc": 0.161, "A_tp": 16, "A_fp": 9, "A_tn": 21, "A_fn": 19, "B_sharpe": -3.3377, "B_sortino": -3.3361, "B_excess_sharpe": -8.5691, "B_return_pct": -22.96, "B_hit_rate": 35.38, "B_n": 65, "B_bh_sharpe": 5.2314, "B_bh_return_pct": 44.53, "B_psr": 0.0506, "B_ic": 0.