{"experiment_num": 75, "backbone": "lstm", "description": "LSTM @ exp 71 1-layer + hidden=256 - depth-vs-width tradeoff test on QQQ", "config": {"seq_len": 10, "lr": 0.001, "batch_size": 16, "epochs": 100, "weight_decay": 0.0007, "patience": 15, "warmup_epochs": 0, "head_dropout": 0.1, "huber_delta": 1.0, "grad_clip": 1.0, "seed": 0, "hidden_size": 256, "num_layers": 1, "max_depth": null, "gbm_lr": null, "n_estimators": null}, "composite": -0.225, "test_pos_folds": 5, "val_pos_folds": 2, "val_loss": -2.8835446404365426, "elapsed_sec": 96.6, "timestamp": "2026-04-27T23:10:08", "sharpe": 0.6892, "val_sharpe": -0.025, "ic": 0.0399, "hit": 46.77, "psr": 0.9517, "equity": 2321.5000000000005, "return_pct": 132.15, "bh_sharpe": 0.6042, "bh_return_pct": 103.49, "excess_sharpe": 0.085, "B_sharpe": 0.4762, "B_excess_sharpe": -1.2246, "B_return_pct": 86.04, "D_sharpe": 0.6892, "D_excess_sharpe": 0.085, "D_return_pct": 132.15, "precision": 0.6067, "recall": 0.2007, "f1": 0.3017, "f2": 0.2318, "mcc": 0.0336, "accuracy": 0.4681, "val_precision": 0.5514, "val_recall": 0.1793, "val_f1": 0.2706, "val_f2": 0.2073, "val_mcc": -0.0032, "val_accuracy": 0.4637, "per_window": [{"fold": "fold_1", "regime": "GFC peak crash (Lehman + Mar-2009 bottom)", "n": 115, "A_sharpe": 3.2387, "A_sortino": 4.0077, "A_excess_sharpe": 3.6829, "A_return_pct": 93.44, "A_hit_rate": 54.78, "A_n": 115, "A_bh_sharpe": -0.4441, "A_bh_return_pct": -14.4, "A_psr": 0.9891, "A_ic": 0.1419, "A_precision": 0.5294, "A_recall": 0.3333, "A_f1": 0.4091, "A_f2": 0.36, "A_accuracy": 0.5478, "A_mcc": 0.0777, "A_tp": 18, "A_fp": 16, "A_tn": 45, "A_fn": 36, "B_sharpe": 0.6213, "B_sortino": 0.6657, "B_excess_sharpe": 0.9191, "B_return_pct": 7.06, "B_hit_rate": 48.25, "B_n": 115, "B_bh_sharpe": -0.2978, "B_bh_return_pct": -27.23, "B_psr": 0.6621, "B_ic": 0.0686, "B_precision": 0.5, "B_recall": 0.6441, "B_f1": 0.563, "B_f2": 0.609, "B_accuracy": 0.487, "B_mcc": -0.0364, "B_tp": 38, "B_fp": 38, "B_tn": 18, "B_fn": 21, "D_sharpe": 3.2387, "D_sortino": 4.0077, "D_excess_sharpe": 3.6829, "D_return_pct": 93.44, "D_hit_rate": 54.78, "D_n": 115, "D_bh_sharpe": -0.4441, "D_bh_return_pct": -14.4, "D_psr": 0.9891, "D_ic": 0.1419, "D_precision": 0.5294, "D_recall": 0.3333, "D_f1": 0.4091, "D_f2": 0.36, "D_accuracy": 0.5478, "D_mcc": 0.0777, "D_tp": 18, "D_fp": 16, "D_tn": 45, "D_fn": 36, "sharpe": 3.2387, "sortino": 4.0077, "return_pct": 93.44, "equity": 1934.4, "max_dd": 0.0, "win_rate": 54.78, "profit_factor": 0.0, "ic": 0.1419, "hit": 54.78, "psr": 0.9891, "bh_sharpe": -0.4441, "bh_return_pct": -14.4, "excess_sharpe": 3.6829, "precision": 0.5294, "recall": 0.3333, "f1": 0.4091, "f2": 0.36, "mcc": 0.0777, "accuracy": 0.5478, "tp": 18, "fp": 16, "tn": 45, "fn": 36}, {"fold": "fold_2", "regime": "2011 US-downgrade + EU debt", "n": 136, "A_sharpe": -2.0265, "A_sortino": -2.0248, "A_excess_sharpe": -3.7593, "A_return_pct": -20.96, "A_hit_rate": 41.48, "A_n": 136, "A_bh_sharpe": 1.7327, "A_bh_return_pct": 19.75, "A_psr": 0.0712, "A_ic": 0.0086, "A_precision": 0.4444, "A_recall": 0.0513, "A_f1": 0.092, "A_f2": 0.0623, "A_accuracy": 0.4191, "A_mcc": -0.0695, "A_tp": 4, "A_fp": 5, "A_tn": 53, "A_fn": 74, "B_sharpe": 0.8985, "B_sortino": 1.0604, "B_excess_sharpe": -3.1674, "B_return_pct": 17.92, "B_hit_rate": 45.59, "B_n": 136, "B_bh_sharpe": 4.0659, "B_bh_return_pct": 148.68, "B_psr": 0.747, "B_ic": 0.1771, "B_precision": 0.6447, "B_recall": 0.5104, "B_f1": 0.5698, "B_f2": 0.5326, "B_accuracy": 0.4559, "B_mcc": -0.151, "B_tp": 49, "B_fp": 27, "B_tn": 13, "B_fn": 47, "D_sharpe": -2.0265, "D_sortino": -2.0248, "D_excess_sharpe": -3.7593, "D_return_pct": -20.96, "D_hit_rate": 41.48, "D_n": 136, "D_bh_sharpe": 1.7327, "D_bh_return_pct": 19.75, "D_psr": 0.0712, "D_ic": 0.0086, "D_precision": 0.4444, "D_recall": 0.0513, "D_f1": 0.092, "D_f2": 0.0623, "D_accuracy": 0.4191, "D_mcc": -0.0695, "D_tp": 4, "D_fp": 5, "D_tn": 53, "D_fn": 74, "sharpe": -2.0265, "sortino": -2.0248, "return_pct": -20.96, "equity": 790.4, "max_dd": 0.0, "win_rate": 41.48, "profit_factor": 0.0, "ic": 0.0086, "hit": 41.48, "psr": 0.0712, "bh_sharpe": 1.7327, "bh_return_pct": 19.75, "excess_sharpe": -3.7593, "precision": 0.4444, "recall": 0.0513, "f1": 0.092, "f2": 0.0623, "mcc": -0.0695, "accuracy": 0.4191, "tp": 4, "fp": 5, "tn": 53, "fn": 74}, {"fold": "fold_3", "regime": "Taper tantrum and 2014 H1", "n": 178, "A_sharpe": 0.2691, "A_sortino": 0.2946, "A_excess_sharpe": -1.0754, "A_return_pct": 1.89, "A_hit_rate": 47.46, "A_n": 178, "A_bh_sharpe": 1.3445, "A_bh_return_pct": 12.41, "A_psr": 0.5895, "A_ic": 0.0533, "A_precision": 0.6452, "A_recall": 0.1942, "A_f1": 0.2985, "A_f2": 0.2257, "A_accuracy": 0.4719, "A_mcc": 0.0619, "A_tp": 20, "A_fp": 11, "A_tn": 64, "A_fn": 83, "B_sharpe": -1.0655, "B_sortino": -1.1395, "B_excess_sharpe": -4.1138, "B_return_pct": -20.27, "B_hit_rate": 42.7, "B_n": 178, "B_bh_sharpe": 3.0483, "B_bh_return_pct": 71.83, "B_psr": 0.1887, "B_ic": -0.1005, "B_precision": 0.5538, "B_recall": 0.3303, "B_f1": 0.4138, "B_f2": 0.3593, "B_accuracy": 0.427, "B_mcc": -0.0911, "B_tp": 36, "B_fp": 29, "B_tn": 40, "B_fn": 73, "D_sharpe": 0.2691, "D_sortino": 0.2946, "D_excess_sharpe": -1.0754, "D_return_pct": 1.89, "D_hit_rate": 47.46, "D_n": 178, "D_bh_sharpe": 1.3445, "D_bh_return_pct": 12.41, "D_psr": 0.5895, "D_ic": 0.0533, "D_precision": 0.6452, "D_recall": 0.1942, "D_f1": 0.2985, "D_f2": 0.2257, "D_accuracy": 0.4719, "D_mcc": 0.0619, "D_tp": 20, "D_fp": 11, "D_tn": 64, "D_fn": 83, "sharpe": 0.2691, "sortino": 0.2946, "return_pct": 1.89, "equity": 1018.8999999999999, "max_dd": 0.0, "win_rate": 47.46, "profit_factor": 0.0, "ic": 0.0533, "hit": 47.46, "psr": 0.5895, "bh_sharpe": 1.3445, "bh_return_pct": 12.41, "excess_sharpe": -1.0754, "precision": 0.6452, "recall": 0.1942, "f1": 0.2985, "f2": 0.2257, "mcc": 0.0619, "accuracy": 0.4719, "tp": 20, "fp": 11, "tn": 64, "fn": 83}, {"fold": "fold_4", "regime": "China devaluation and oil crash", "n": 157, "A_sharpe": 0.9244, "A_sortino": 0.9299, "A_excess_sharpe": 0.9146, "A_return_pct": 10.5, "A_hit_rate": 51.92, "A_n": 157, "A_bh_sharpe": 0.0098, "A_bh_return_pct": -1.05, "A_psr": 0.7659, "A_ic": 0.0191, "A_precision": 0.65, "A_recall": 0.1605, "A_f1": 0.2574, "A_f2": 0.189, "A_accuracy": 0.5223, "A_mcc": 0.1025, "A_tp": 13, "A_fp": 7, "A_tn": 69, "A_fn": 68, "B_sharpe": 3.8375, "B_sortino": 3.9, "B_excess_sharpe": 3.8216, "B_return_pct": 161.54, "B_hit_rate": 60.51, "B_n": 157, "B_bh_sharpe": 0.0159, "B_bh_return_pct": -5.48, "B_psr": 0.9981, "B_ic": 0.3064, "B_precision": 0.6186, "B_recall": 0.7059, "B_f1": 0.6593, "B_f2": 0.6865, "B_accuracy": 0.6051, "B_mcc": 0.1969, "B_tp": 60, "B_fp": 37, "B_tn": 35, "B_fn": 25, "D_sharpe": 0.9244, "D_sortino": 0.9299, "D_excess_sharpe": 0.9146, "D_return_pct": 10.5, "D_hit_rate": 51.92, "D_n": 157, "D_bh_sharpe": 0.0098, "D_bh_return_pct": -1.05, "D_psr": 0.7659, "D_ic": 0.0191, "D_precision": 0.65, "D_recall": 0.1605, "D_f1": 0.2574, "D_f2": 0.189, "D_accuracy": 0.5223, "D_mcc": 0.1025, "D_tp": 13, "D_fp": 7, "D_tn": 69, "D_fn": 68, "sharpe": 0.9244, "sortino": 0.9299, "return_pct": 10.5, "equity": 1105.0, "max_dd": 0.0, "win_rate": 51.92, "profit_factor": 0.0, "ic": 0.0191, "hit": 51.92, "psr": 0.7659, "bh_sharpe": 0.0098, "bh_return_pct": -1.05, "excess_sharpe": 0.9146, "precision": 0.65, "recall": 0.1605, "f1": 0.2574, "f2": 0.189, "mcc": 0.1025, "accuracy": 0.5223, "tp": 13, "fp": 7, "tn": 69, "fn": 68}, {"fold": "fold_5", "regime": "2018 Vol-mageddon + Q4 sell-off", "n": 177, "A_sharpe": 0.5921, "A_sortino": 0.6648, "A_excess_sharpe": 0.2823, "A_return_pct": 8.01, "A_hit_rate": 45.2, "A_n": 177, "A_bh_sharpe": 0.3098, "A_bh_return_pct": 3.19, "A_psr": 0.6898, "A_ic": 0.0831, "A_precision": 0.7143, "A_recall": 0.0971, "A_f1": 0.1709, "A_f2": 0.1174, "A_accuracy": 0.452, "A_mcc": 0.0786, "A_tp": 10, "A_fp": 4, "A_tn": 70, "A_fn": 93, "B_sharpe": 1.4305, "B_sortino": 1.5759, "B_excess_sharpe": 0.5388, "B_return_pct": 47.51, "B_hit_rate": 49.43, "B_n": 177, "B_bh_sharpe": 0.8917, "B_bh_return_pct": 23.8, "B_psr": 0.8844, "B_ic": 0.1059, "B_precision": 0.6111, "B_recall": 0.5046, "B_f1": 0.5528, "B_f2": 0.5228, "B_accuracy": 0.4972, "B_mcc": -0.0098, "B_tp": 55, "B_fp": 35, "B_tn": 33, "B_fn": 54, "D_sharpe": 0.5921, "D_sortino": 0.6648, "D_excess_sharpe": 0.2823, "D_return_pct": 8.01, "D_hit_rate": 45.2, "D_n": 177, "D_bh_sharpe": 0.3098, "D_bh_return_pct": 3.19, "D_psr": 0.6898, "D_ic": 0.0831, "D_precision": 0.7143, "D_recall": 0.0971, "D_f1": 0.1709, "D_f2": 0.1174, "D_accuracy": 0.452, "D_mcc": 0.0786, "D_tp": 10, "D_fp": 4, "D_tn": 70, "D_fn": 93, "sharpe": 0.5921, "sortino": 0.6648, "return_pct": 8.01, "equity": 1080.1000000000001, "max_dd": 0.0, "win_rate": 45.2, "profit_factor": 0.0, "ic": 0.0831, "hit": 45.2, "psr": 0.6898, "bh_sharpe": 0.3098, "bh_return_pct": 3.19, "excess_sharpe": 0.2823, "precision": 0.7143, "recall": 0.0971, "f1": 0.1709, "f2": 0.1174, "mcc": 0.0786, "accuracy": 0.452, "tp": 10, "fp": 4, "tn": 70, "fn": 93}, {"fold": "fold_6", "regime": "COVID crash and V-recovery", "n": 222, "A_sharpe": 1.7298, "A_sortino": 2.3625, "A_excess_sharpe": 0.841, "A_return_pct": 66.89, "A_hit_rate": 45.95, "A_n": 222, "A_bh_sharpe": 0.8888, "A_bh_return_pct": 26.13, "A_psr": 0.9584, "A_ic": 0.0251, "A_precision": 0.7045, "A_recall": 0.2246, "A_f1": 0.3407, "A_f2": 0.2601, "A_accuracy": 0.4595, "A_mcc": 0.085, "A_tp": 31, "A_fp": 13, "A_tn": 71, "A_fn": 107, "B_sharpe": -1.7214, "B_sortino": -1.6727, "B_excess_sharpe": -4.1098, "B_return_pct": -71.96, "B_hit_rate": 42.99, "B_n": 222, "B_bh_sharpe": 2.3884, "B_bh_return_pct": 243.18, "B_psr": 0.0518, "B_ic": 0.0058, "B_precision": 0.5714, "B_recall": 0.3212, "B_f1": 0.4112, "B_f2": 0.352, "B_accuracy": 0.4324, "B_mcc": -0.0685, "B_tp": 44, "B_fp": 33, "B_tn": 52, "B_fn": 93, "D_sharpe": 1.7298, "D_sortino": 2.3625, "D_excess_sharpe": 0.841, "D_return_pct": 66.89, "D_hit_rate": 45.95, "D_n": 222, "D_bh_sharpe": 0.8888, "D_bh_return_pct": 26.13, "D_psr": 0.9584, "D_ic": 0.0251, "D_precision": 0.7045, "D_recall": 0.2246, "D_f1": 0.3407, "D_f2": 0.2601, "D_accuracy": 0.4595, "D_mcc": 0.085, "D_tp": 31, "D_fp": 13, "D_tn": 71, "D_fn": 107, "sharpe": 1.7298, "sortino": 2.3625, "return_pct": 66.89, "equity": 1668.9, "max_dd": 0.0, "win_rate": 45.95, "profit_factor": 0.0, "ic": 0.0251, "hit": 45.95, "psr": 0.9584, "bh_sharpe": 0.8888, "bh_return_pct": 26.13, "excess_sharpe": 0.841, "precision": 0.7045, "recall": 0.2246, "f1": 0.3407, "f2": 0.2601, "mcc": 0.085, "accuracy": 0.4595, "tp": 31, "fp": 13, "tn": 71, "fn": 107}, {"fold": "fold_7", "regime": "Inflation bear, AI rally and 2025", "n": 425, "A_sharpe": -0.6834, "A_sortino": -0.6988, "A_excess_sharpe": -1.6549, "A_return_pct": -25.2, "A_hit_rate": 45.18, "A_n": 425, "A_bh_sharpe": 0.9715, "A_bh_return_pct": 37.12, "A_psr": 0.185, "A_ic": -0.0148, "A_precision": 0.5739, "A_recall": 0.264, "A_f1": 0.3616, "A_f2": 0.296, "A_accuracy": 0.4518, "A_mcc": -0.0177, "A_tp": 66, "A_fp": 49, "A_tn": 126, "A_fn": 184, "B_sharpe": 0.9286, "B_sortino": 0.9056, "B_excess_sharpe": -1.574, "B_return_pct": 70.87, "B_hit_rate": 53.77, "B_n": 425, "B_bh_sharpe": 2.5027, "B_bh_return_pct": 458.83, "B_psr": 0.8837, "B_ic": 0.0489, "B_precision": 0.639, "B_recall": 0.5856, "B_f1": 0.6111, "B_f2": 0.5955, "B_accuracy": 0.5388, "B_mcc": 0.0476, "B_tp": 154, "B_fp": 87, "B_tn": 75, "B_fn": 109, "D_sharpe": -0.6834, "D_sortino": -0.6988, "D_excess_sharpe": -1.6549, "D_return_pct": -25.2, "D_hit_rate": 45.18, "D_n": 425, "D_bh_sharpe": 0.9715, "D_bh_return_pct": 37.12, "D_psr": 0.185, "D_ic": -0.0148, "D_precision": 0.5739, "D_recall": 0.264, "D_f1": 0.3616, "D_f2": 0.296, "D_accuracy": 0.4518, "D_mcc": -0.0177, "D_tp": 66, "D_fp": 49, "D_tn": 126, "D_fn": 184, "sharpe": -0.6834, "sortino": -0.6988, "return_pct": -25.2, "equity": 748.0, "max_dd": 0.0, "win_rate": 45.18, "profit_factor": 0.0, "ic": -0.0148, "hit": 45.18, "psr": 0.185, "bh_sharpe": 0.9715, "bh_return_pct": 37.12, "excess_sharpe": -1.6549, "precision": 0.5739, "recall": 0.264, "f1": 0.3616, "f2": 0.296, "mcc": -0.0177, "accuracy": 0.4518, "tp": 66, "fp": 49, "tn": 126, "fn": 184}], "per_window_val": [{"fold": "fold_1", "regime": "GFC peak crash (Lehman + Mar-2009 bottom)", "n": 104, "A_sharpe": 1.4542, "A_sortino": 1.8182, "A_excess_sharpe": 1.6214, "A_return_pct": 17.28, "A_hit_rate": 49.02, "A_n": 104, "A_bh_sharpe": -0.1672, "A_bh_return_pct": -3.81, "A_psr": 0.8352, "A_ic": 0.2143, "A_precision": 0.6667, "A_recall": 0.0741, "A_f1": 0.1333, "A_f2": 0.0901, "A_accuracy": 0.5, "A_mcc": 0.073, "A_tp": 4, "A_fp": 2, "A_tn": 48, "A_fn": 50, "B_sharpe": 0.0974, "B_sortino": 0.092, "B_excess_sharpe": 2.3714, "B_return_pct": -4.11, "B_hit_rate": 51.46, "B_n": 104, "B_bh_sharpe": -2.2741, "B_bh_return_pct": -44.12, "B_psr": 0.5248, "B_ic": 0.0404, "B_precision": 0.52, "B_recall": 0.5, "B_f1": 0.5098, "B_f2": 0.5039, "B_accuracy": 0.5192, "B_mcc": 0.0385, "B_tp": 26, "B_fp": 24, "B_tn": 28, "B_fn": 26, "D_sharpe": 1.4542, "D_sortino": 1.8182, "D_excess_sharpe": 1.6214, "D_return_pct": 17.28, "D_hit_rate": 49.02, "D_n": 104, "D_bh_sharpe": -0.1672, "D_bh_return_pct": -3.81, "D_psr": 0.8352, "D_ic": 0.2143, "D_precision": 0.6667, "D_recall": 0.0741, "D_f1": 0.1333, "D_f2": 0.0901, "D_accuracy": 0.5, "D_mcc": 0.073, "D_tp": 4, "D_fp": 2, "D_tn": 48, "D_fn": 50, "sharpe": 1.4542, "sortino": 1.8182, "return_pct": 17.28, "equity": 1172.8, "max_dd": 0.0, "win_rate": 49.02, "profit_factor": 0.0, "ic": 0.2143, "hit": 49.02, "psr": 0.8352, "bh_sharpe": -0.1672, "bh_return_pct": -3.81, "excess_sharpe": 1.6214, "precision": 0.6667, "recall": 0.0741, "f1": 0.1333, "f2": 0.0901, "mcc": 0.073, "accuracy": 0.5, "tp": 4, "fp": 2, "tn": 48, "fn": 50}, {"fold": "fold_2", "regime": "2011 US-downgrade + EU debt", "n": 96, "A_sharpe": 0.0926, "A_sortino": 0.1143, "A_excess_sharpe": 0.3667, "A_return_pct": -0.41, "A_hit_rate": 43.16, "A_n": 96, "A_bh_sharpe": -0.2741, "A_bh_return_pct": -4.09, "A_psr": 0.5227, "A_ic": -0.0726, "A_precision": 0.4, "A_recall": 0.16, "A_f1": 0.2286, "A_f2": 0.1818, "A_accuracy": 0.4375, "A_mcc": -0.1241, "A_tp": 8, "A_fp": 12, "A_tn": 34, "A_fn": 42, "B_sharpe": -0.7192, "B_sortino": -0.6449, "B_excess_sharpe": 0.3083, "B_return_pct": -20.31, "B_hit_rate": 51.04, "B_n": 96, "B_bh_sharpe": -1.0274, "B_bh_return_pct": -25.58, "B_psr": 0.3271, "B_ic": 0.0563, "B_precision": 0.4697, "B_recall": 0.7209, "B_f1": 0.5688, "B_f2": 0.6513, "B_accuracy": 0.5104, "B_mcc": 0.065, "B_tp": 31, "B_fp": 35, "B_tn": 18, "B_fn": 12, "D_sharpe": 0.0926, "D_sortino": 0.1143, "D_excess_sharpe": 0.3667, "D_return_pct": -0.41, "D_hit_rate": 43.16, "D_n": 96, "D_bh_sharpe": -0.2741, "D_bh_return_pct": -4.09, "D_psr": 0.5227, "D_ic": -0.0726, "D_precision": 0.4, "D_recall": 0.16, "D_f1": 0.2286, "D_f2": 0.1818, "D_accuracy": 0.4375, "D_mcc": -0.1241, "D_tp": 8, "D_fp": 12, "D_tn": 34, "D_fn": 42, "sharpe": 0.0926, "sortino": 0.1143, "return_pct": -0.41, "equity": 995.9, "max_dd": 0.0, "win_rate": 43.16, "profit_factor": 0.0, "ic": -0.0726, "hit": 43.16, "psr": 0.5227, "bh_sharpe": -0.2741, "bh_return_pct": -4.09, "excess_sharpe": 0.3667, "precision": 0.4, "recall": 0.16, "f1": 0.2286, "f2": 0.1818, "mcc": -0.1241, "accuracy": 0.4375, "tp": 8, "fp": 12, "tn": 34, "fn": 42}, {"fold": "fold_3", "regime": "Taper tantrum and 2014 H1", "n": 54, "A_sharpe": -0.5822, "A_sortino": -0.5923, "A_excess_sharpe": -5.282, "A_return_pct": -1.41, "A_hit_rate": 50.0, "A_n": 54, "A_bh_sharpe": 4.6998, "A_bh_return_pct": 10.46, "A_psr": 0.3954, "A_ic": 0.2243, "A_precision": 0.875, "A_recall": 0.2121, "A_f1": 0.3415, "A_f2": 0.25, "A_accuracy": 0.5, "A_mcc": 0.2257, "A_tp": 7, "A_fp": 1, "A_tn": 20, "A_fn": 26, "B_sharpe": 0.8903, "B_sortino": 0.9291, "B_excess_sharpe": -8.1422, "B_return_pct": 4.05, "B_hit_rate": 50.0, "B_n": 54, "B_bh_sharpe": 9.0326, "B_bh_return_pct": 49.18, "B_psr": 0.6582, "B_ic": 0.241, "B_precision": 0.8125, "B_recall": 0.3514, "B_f1": 0.4906, "B_f2": 0.3963, "B_accuracy": 0.5, "B_mcc": 0.1779, "B_tp": 13, "B_fp": 3, "B_tn": 14, "B_fn": 24, "D_sharpe": -0.5822, "D_sortino": -0.5923, "D_excess_sharpe": -5.282, "D_return_pct": -1.41, "D_hit_rate": 50.0, "D_n": 54, "D_bh_sharpe": 4.6998, "D_bh_return_pct": 10.46, "D_psr": 0.3954, "D_ic": 0.2243, "D_precision": 0.875, "D_recall": 0.2121, "D_f1": 0.3415, "D_f2": 0.25, "D_accuracy": 0.5, "D_mcc": 0.2257, "D_tp": 7, "D_fp": 1, "D_tn": 20, "D_fn": 26, "sharpe": -0.5822, "sortino": -0.5923, "return_pct": -1.41, "equity": 985.9, "max_dd": 0.0, "win_rate": 50.0, "profit_factor": 0.0, "ic": 0.2243, "hit": 50.0, "psr": 0.3954, "bh_sharpe": 4.6998, "bh_return_pct": 10.46, "excess_sharpe": -5.282, "precision": 0.875, "recall": 0.2121, "f1": 0.3415, "f2": 0.25, "mcc": 0.2257, "accuracy": 0.5, "tp": 7, "fp": 1, "tn": 20, "fn": 26}, {"fold": "fold_4", "regime": "China devaluation and oil crash", "n": 96, "A_sharpe": -0.7088, "A_sortino": -0.5947, "A_excess_sharpe": -0.2847, "A_return_pct": -5.71, "A_hit_rate": 52.63, "A_n": 96, "A_bh_sharpe": -0.4241, "A_bh_return_pct": -3.73, "A_psr": 0.3272, "A_ic": 0.0577, "A_precision": 0.5, "A_recall": 0.1333, "A_f1": 0.2105, "A_f2": 0.1562, "A_accuracy": 0.5312, "A_mcc": 0.0237, "A_tp": 6, "A_fp": 6, "A_tn": 45, "A_fn": 39, "B_sharpe": 0.5978, "B_sortino": 0.6428, "B_excess_sharpe": 1.7821, "B_return_pct": 6.59, "B_hit_rate": 48.96, "B_n": 96, "B_bh_sharpe": -1.1843, "B_bh_return_pct": -21.44, "B_psr": 0.6435, "B_ic": 0.0954, "B_precision": 0.4667, "B_recall": 0.4565, "B_f1": 0.4615, "B_f2": 0.4585, "B_accuracy": 0.4896, "B_mcc": -0.0235, "B_tp": 21, "B_fp": 24, "B_tn": 26, "B_fn": 25, "D_sharpe": -0.7088, "D_sortino": -0.5947, "D_excess_sharpe": -0.2847, "D_return_pct": -5.71, "D_hit_rate": 52.63, "D_n": 96, "D_bh_sharpe": -0.4241, "D_bh_return_pct": -3.73, "D_psr": 0.3272, "D_ic": 0.0577, "D_precision": 0.5, "D_recall": 0.1333, "D_f1": 0.2105, "D_f2": 0.1562, "D_accuracy": 0.5312, "D_mcc": 0.0237, "D_tp": 6, "D_fp": 6, "D_tn": 45, "D_fn": 39, "sharpe": -0.7088, "sortino": -0.5947, "return_pct": -5.71, "equity": 942.9, "max_dd": 0.0, "win_rate": 52.63, "profit_factor": 0.0, "ic": 0.0577, "hit": 52.63, "psr": 0.3272, "bh_sharpe": -0.4241, "bh_return_pct": -3.73, "excess_sharpe": -0.2847, "precision": 0.5, "recall": 0.1333, "f1": 0.2105, "f2": 0.1562, "mcc": 0.0237, "accuracy": 0.5312, "tp": 6, "fp": 6, "tn": 45, "fn": 39}, {"fold": "fold_5", "regime": "2018 Vol-mageddon + Q4 sell-off", "n": 54, "A_sharpe": -0.5676, "A_sortino": -0.599, "A_excess_sharpe": -1.9956, "A_return_pct": -1.81, "A_hit_rate": 46.3, "A_n": 54, "A_bh_sharpe": 1.428, "A_bh_return_pct": 3.97, "A_psr": 0.3979, "A_ic": -0.1688, "A_precision": 0.5, "A_recall": 0.069, "A_f1": 0.1212, "A_f2": 0.0833, "A_accuracy": 0.463, "A_mcc": -0.021, "A_tp": 2, "A_fp": 2, "A_tn": 23, "A_fn": 27, "B_sharpe": -0.6932, "B_sortino": -0.6691, "B_excess_sharpe": -5.6254, "B_return_pct": -5.41, "B_hit_rate": 50.0, "B_n": 54, "B_bh_sharpe": 4.9322, "B_bh_return_pct": 34.93, "B_psr": 0.3754, "B_ic": -0.0494, "B_precision": 0.8571, "B_recall": 0.3243, "B_f1": 0.4706, "B_f2": 0.3704, "B_accuracy": 0.5, "B_mcc": 0.219, "B_tp": 12, "B_fp": 2, "B_tn": 15, "B_fn": 25, "D_sharpe": -0.5676, "D_sortino": -0.599, "D_excess_sharpe": -1.9956, "D_return_pct": -1.81, "D_hit_rate": 46.3, "D_n": 54, "D_bh_sharpe": 1.428, "D_bh_return_pct": 3.97, "D_psr": 0.3979, "D_ic": -0.1688, "D_precision": 0.5, "D_recall": 0.069, "D_f1": 0.1212, "D_f2": 0.0833, "D_accuracy": 0.463, "D_mcc": -0.021, "D_tp": 2, "D_fp": 2, "D_tn": 23, "D_fn": 27, "sharpe": -0.5676, "sortino": -0.599, "return_pct": -1.81, "equity": 981.9, "max_dd": 0.0, "win_rate": 46.3, "profit_factor": 0.0, "ic": -0.1688, "hit": 46.3, "psr": 0.3979, "bh_sharpe": 1.428, "bh_return_pct": 3.97, "excess_sharpe": -1.9956, "precision": 0.5, "recall": 0.069, "f1": 0.1212, "f2": 0.0833, "mcc": -0.021, "accuracy": 0.463, "tp": 2, "fp": 2, "tn": 23, "fn": 27}, {"fold": "fold_6", "regime": "COVID crash and V-recovery", "n": 75, "A_sharpe": -3.5742, "A_sortino": -3.6229, "A_excess_sharpe": -7.8736, "A_return_pct": -11.18, "A_hit_rate": 34.67, "A_n": 75, "A_bh_sharpe": 4.2994, "A_bh_return_pct": 14.68, "A_psr": 0.0337, "A_ic": 0.144, "A_precision": 0.75, "A_recall": 0.0588, "A_f1": 0.1091, "A_f2": 0.0721, "A_accuracy": 0.3467, "A_mcc": 0.0356, "A_tp": 3, "A_fp": 1, "A_tn": 23, "A_fn": 48, "B_sharpe": -4.7049, "B_sortino": -4.8423, "B_excess_sharpe": -19.0389, "B_return_pct": -29.39, "B_hit_rate": 29.33, "B_n": 75, "B_bh_sharpe": 14.3339, "B_bh_return_pct": 120.13, "B_psr": 0.01, "B_ic": 0.1564, "B_precision": 0.8571, "B_recall": 0.1905, "B_f1": 0.3117, "B_f2": 0.2256, "B_accuracy": 0.2933, "B_mcc": 0.0224, "B_tp": 12, "B_fp": 2, "B_tn": 10, "B_fn": 51, "D_sharpe": -3.5742, "D_sortino": -3.6229, "D_excess_sharpe": -7.8736, "D_return_pct": -11.18, "D_hit_rate": 34.67, "D_n": 75, "D_bh_sharpe": 4.2994, "D_bh_return_pct": 14.68, "D_psr": 0.0337, "D_ic": 0.144, "D_precision": 0.75, "D_recall": 0.0588, "D_f1": 0.1091, "D_f2": 0.0721, "D_accuracy": 0.3467, "D_mcc": 0.0356, "D_tp": 3, "D_fp": 1, "D_tn": 23, "D_fn": 48, "sharpe": -3.5742, "sortino": -3.6229, "return_pct": -11.18, "equity": 888.2, "max_dd": 0.0, "win_rate": 34.67, "profit_factor": 0.0, "ic": 0.144, "hit": 34.67, "psr": 0.0337, "bh_sharpe": 4.2994, "bh_return_pct": 14.68, "excess_sharpe": -7.8736, "precision": 0.75, "recall": 0.0588, "f1": 0.1091, "f2": 0.0721, "mcc": 0.0356, "accuracy": 0.3467, "tp": 3, "fp": 1, "tn": 23, "fn": 48}, {"fold": "fold_7", "regime": "Inflation bear, AI rally and 2025", "n": 114, "A_sharpe": -0.0152, "A_sortino": -0.0161, "A_excess_sharpe": -2.8603, "A_return_pct": -0.66, "A_hit_rate": 45.61, "A_n": 114, "A_bh_sharpe": 2.845, "A_bh_return_pct": 21.34, "A_psr": 0.4959, "A_ic": -0.0011, "A_precision": 0.5472, "A_recall": 0.4328, "A_f1": 0.4833, "A_f2": 0.4517, "A_accuracy": 0.4561, "A_mcc": -0.0768, "A_tp": 29, "A_fp": 24, "A_tn": 23, "A_fn": 38, "B_sharpe": 2.3015, "B_sortino": 2.5905, "B_excess_sharpe": -3.8351, "B_return_pct": 42.43, "B_hit_ra