{"experiment_num": 92, "backbone": "lightgbm", "description": "LightGBM @ exp 10 max_depth=5 (between 4 and 6) - depth sweep mid-point", "config": {"seq_len": 60, "lr": 0.0003, "batch_size": 32, "epochs": 50, "weight_decay": 1e-05, "patience": 10, "warmup_epochs": 0, "head_dropout": 0.1, "huber_delta": 1.0, "grad_clip": 1.0, "seed": 42, "hidden_size": null, "num_layers": null, "max_depth": 5, "gbm_lr": 0.01, "n_estimators": 1000}, "composite": -0.3299, "test_pos_folds": 3, "val_pos_folds": 4, "val_loss": null, "elapsed_sec": 307.5, "timestamp": "2026-04-27T23:46:46", "sharpe": 0.3582, "val_sharpe": 0.0701, "ic": 0.0255, "hit": 47.84, "psr": 0.7708, "equity": 1264.8999999999999, "return_pct": 26.49, "bh_sharpe": 1.2194, "bh_return_pct": 187.05, "excess_sharpe": -0.8612, "B_sharpe": -0.4908, "B_excess_sharpe": -3.319, "B_return_pct": -75.9, "D_sharpe": -0.1808, "D_excess_sharpe": -1.4001, "D_return_pct": -24.42, "precision": 0.5785, "recall": 0.443, "f1": 0.5018, "f2": 0.4648, "mcc": -0.0256, "accuracy": 0.4789, "val_precision": 0.4943, "val_recall": 0.6565, "val_f1": 0.5639, "val_f2": 0.616, "val_mcc": -0.0273, "val_accuracy": 0.4885, "per_window": [{"fold": "fold_1", "regime": "GFC peak crash (Lehman + Mar-2009 bottom)", "n": 66, "A_sharpe": -1.5161, "A_sortino": -1.6064, "A_excess_sharpe": -2.0882, "A_return_pct": -15.33, "A_hit_rate": 37.88, "A_n": 66, "A_bh_sharpe": 0.5721, "A_bh_return_pct": 3.85, "A_psr": 0.222, "A_ic": -0.0039, "A_precision": 0.4167, "A_recall": 0.4286, "A_f1": 0.4225, "A_f2": 0.4261, "A_accuracy": 0.3788, "A_mcc": -0.2494, "A_tp": 15, "A_fp": 21, "A_tn": 10, "A_fn": 20, "B_sharpe": 0.7501, "B_sortino": 0.823, "B_excess_sharpe": -1.2969, "B_return_pct": 7.66, "B_hit_rate": 46.15, "B_n": 66, "B_bh_sharpe": 2.0469, "B_bh_return_pct": 39.28, "B_psr": 0.6487, "B_ic": 0.3781, "B_precision": 0.5556, "B_recall": 0.1389, "B_f1": 0.2222, "B_f2": 0.1634, "B_accuracy": 0.4697, "B_mcc": 0.0081, "B_tp": 5, "B_fp": 4, "B_tn": 26, "B_fn": 31, "D_sharpe": 0.6677, "D_sortino": 0.7115, "D_excess_sharpe": 0.0955, "D_return_pct": 4.82, "D_hit_rate": 48.48, "D_n": 66, "D_bh_sharpe": 0.5721, "D_bh_return_pct": 3.85, "D_psr": 0.6329, "D_ic": 0.1699, "D_precision": 0.5556, "D_recall": 0.1429, "D_f1": 0.2273, "D_f2": 0.1678, "D_accuracy": 0.4848, "D_mcc": 0.0201, "D_tp": 5, "D_fp": 4, "D_tn": 27, "D_fn": 30, "sharpe": -1.5161, "sortino": -1.6064, "return_pct": -15.33, "equity": 846.7, "max_dd": 0.0, "win_rate": 37.88, "profit_factor": 0.0, "ic": -0.0039, "hit": 37.88, "psr": 0.222, "bh_sharpe": 0.5721, "bh_return_pct": 3.85, "excess_sharpe": -2.0882, "precision": 0.4167, "recall": 0.4286, "f1": 0.4225, "f2": 0.4261, "mcc": -0.2494, "accuracy": 0.3788, "tp": 15, "fp": 21, "tn": 10, "fn": 20}, {"fold": "fold_2", "regime": "2011 US-downgrade + EU debt", "n": 87, "A_sharpe": 2.7201, "A_sortino": 3.5945, "A_excess_sharpe": -2.3019, "A_return_pct": 15.22, "A_hit_rate": 52.33, "A_n": 87, "A_bh_sharpe": 5.022, "A_bh_return_pct": 29.23, "A_psr": 0.9581, "A_ic": 0.0331, "A_precision": 0.6182, "A_recall": 0.6296, "A_f1": 0.6239, "A_f2": 0.6273, "A_accuracy": 0.5287, "A_mcc": -0.0068, "A_tp": 34, "A_fp": 21, "A_tn": 12, "A_fn": 20, "B_sharpe": 4.0868, "B_sortino": 4.9149, "B_excess_sharpe": -7.0502, "B_return_pct": 55.91, "B_hit_rate": 57.47, "B_n": 87, "B_bh_sharpe": 11.1369, "B_bh_return_pct": 185.4, "B_psr": 0.9931, "B_ic": 0.2132, "B_precision": 0.8491, "B_recall": 0.6081, "B_f1": 0.7087, "B_f2": 0.6447, "B_accuracy": 0.5747, "B_mcc": -0.0053, "B_tp": 45, "B_fp": 8, "B_tn": 5, "B_fn": 29, "D_sharpe": 1.2451, "D_sortino": 1.4692, "D_excess_sharpe": -3.7769, "D_return_pct": 6.54, "D_hit_rate": 51.16, "D_n": 87, "D_bh_sharpe": 5.022, "D_bh_return_pct": 29.23, "D_psr": 0.7747, "D_ic": 0.0801, "D_precision": 0.6038, "D_recall": 0.5926, "D_f1": 0.5981, "D_f2": 0.5948, "D_accuracy": 0.5057, "D_mcc": -0.0435, "D_tp": 32, "D_fp": 21, "D_tn": 12, "D_fn": 22, "sharpe": 2.7201, "sortino": 3.5945, "return_pct": 15.22, "equity": 1152.2, "max_dd": 0.0, "win_rate": 52.33, "profit_factor": 0.0, "ic": 0.0331, "hit": 52.33, "psr": 0.9581, "bh_sharpe": 5.022, "bh_return_pct": 29.23, "excess_sharpe": -2.3019, "precision": 0.6182, "recall": 0.6296, "f1": 0.6239, "f2": 0.6273, "mcc": -0.0068, "accuracy": 0.5287, "tp": 34, "fp": 21, "tn": 12, "fn": 20}, {"fold": "fold_3", "regime": "Taper tantrum and 2014 H1", "n": 129, "A_sharpe": -0.3802, "A_sortino": -0.362, "A_excess_sharpe": -2.148, "A_return_pct": -2.88, "A_hit_rate": 47.66, "A_n": 129, "A_bh_sharpe": 1.7678, "A_bh_return_pct": 11.76, "A_psr": 0.3925, "A_ic": 0.0844, "A_precision": 0.5658, "A_recall": 0.5513, "A_f1": 0.5584, "A_f2": 0.5541, "A_accuracy": 0.4729, "A_mcc": -0.0952, "A_tp": 43, "A_fp": 33, "A_tn": 18, "A_fn": 35, "B_sharpe": 2.7906, "B_sortino": 3.0378, "B_excess_sharpe": -1.4567, "B_return_pct": 38.65, "B_hit_rate": 55.04, "B_n": 129, "B_bh_sharpe": 4.2474, "B_bh_return_pct": 64.1, "B_psr": 0.9757, "B_ic": -0.0133, "B_precision": 0.6304, "B_recall": 0.7073, "B_f1": 0.6667, "B_f2": 0.6905, "B_accuracy": 0.5504, "B_mcc": -0.0171, "B_tp": 58, "B_fp": 34, "B_tn": 13, "B_fn": 24, "D_sharpe": 2.041, "D_sortino": 1.9745, "D_excess_sharpe": 0.2732, "D_return_pct": 13.75, "D_hit_rate": 56.25, "D_n": 129, "D_bh_sharpe": 1.7678, "D_bh_return_pct": 11.76, "D_psr": 0.9189, "D_ic": 0.0748, "D_precision": 0.6196, "D_recall": 0.7308, "D_f1": 0.6706, "D_f2": 0.7054, "D_accuracy": 0.5659, "D_mcc": 0.0481, "D_tp": 57, "D_fp": 35, "D_tn": 16, "D_fn": 21, "sharpe": -0.3802, "sortino": -0.362, "return_pct": -2.88, "equity": 971.1999999999999, "max_dd": 0.0, "win_rate": 47.66, "profit_factor": 0.0, "ic": 0.0844, "hit": 47.66, "psr": 0.3925, "bh_sharpe": 1.7678, "bh_return_pct": 11.76, "excess_sharpe": -2.148, "precision": 0.5658, "recall": 0.5513, "f1": 0.5584, "f2": 0.5541, "mcc": -0.0952, "accuracy": 0.4729, "tp": 43, "fp": 33, "tn": 18, "fn": 35}, {"fold": "fold_4", "regime": "China devaluation and oil crash", "n": 108, "A_sharpe": -0.2281, "A_sortino": -0.2184, "A_excess_sharpe": 0.4616, "A_return_pct": -2.86, "A_hit_rate": 49.53, "A_n": 108, "A_bh_sharpe": -0.6898, "A_bh_return_pct": -6.71, "A_psr": 0.4408, "A_ic": 0.0293, "A_precision": 0.4906, "A_recall": 0.4906, "A_f1": 0.4906, "A_f2": 0.4906, "A_accuracy": 0.5, "A_mcc": -0.0003, "A_tp": 26, "A_fp": 27, "A_tn": 28, "A_fn": 27, "B_sharpe": -2.802, "B_sortino": -2.6078, "B_excess_sharpe": -0.8445, "B_return_pct": -43.04, "B_hit_rate": 40.74, "B_n": 108, "B_bh_sharpe": -1.9575, "B_bh_return_pct": -33.56, "B_psr": 0.0311, "B_ic": -0.0913, "B_precision": 0.3818, "B_recall": 0.4118, "B_f1": 0.3962, "B_f2": 0.4054, "B_accuracy": 0.4074, "B_mcc": -0.1845, "B_tp": 21, "B_fp": 34, "B_tn": 23, "B_fn": 30, "D_sharpe": -1.7229, "D_sortino": -1.5156, "D_excess_sharpe": -1.0331, "D_return_pct": -14.72, "D_hit_rate": 48.6, "D_n": 108, "D_bh_sharpe": -0.6898, "D_bh_return_pct": -6.71, "D_psr": 0.1248, "D_ic": -0.047, "D_precision": 0.4727, "D_recall": 0.4906, "D_f1": 0.4815, "D_f2": 0.4869, "D_accuracy": 0.4815, "D_mcc": -0.0367, "D_tp": 26, "D_fp": 29, "D_tn": 26, "D_fn": 27, "sharpe": -0.2281, "sortino": -0.2184, "return_pct": -2.86, "equity": 971.4000000000001, "max_dd": 0.0, "win_rate": 49.53, "profit_factor": 0.0, "ic": 0.0293, "hit": 49.53, "psr": 0.4408, "bh_sharpe": -0.6898, "bh_return_pct": -6.71, "excess_sharpe": 0.4616, "precision": 0.4906, "recall": 0.4906, "f1": 0.4906, "f2": 0.4906, "mcc": -0.0003, "accuracy": 0.5, "tp": 26, "fp": 27, "tn": 28, "fn": 27}, {"fold": "fold_5", "regime": "2018 Vol-mageddon + Q4 sell-off", "n": 128, "A_sharpe": -0.4805, "A_sortino": -0.5343, "A_excess_sharpe": -1.6316, "A_return_pct": -6.94, "A_hit_rate": 43.75, "A_n": 128, "A_bh_sharpe": 1.1511, "A_bh_return_pct": 13.19, "A_psr": 0.3677, "A_ic": -0.0332, "A_precision": 0.5556, "A_recall": 0.3846, "A_f1": 0.4545, "A_f2": 0.4098, "A_accuracy": 0.4375, "A_mcc": -0.0942, "A_tp": 30, "A_fp": 24, "A_tn": 26, "A_fn": 48, "B_sharpe": -3.2057, "B_sortino": -3.2609, "B_excess_sharpe": -6.0176, "B_return_pct": -55.07, "B_hit_rate": 33.86, "B_n": 128, "B_bh_sharpe": 2.8119, "B_bh_return_pct": 82.25, "B_psr": 0.0129, "B_ic": -0.0698, "B_precision": 0.5098, "B_recall": 0.3059, "B_f1": 0.3824, "B_f2": 0.3325, "B_accuracy": 0.3438, "B_mcc": -0.2658, "B_tp": 26, "B_fp": 25, "B_tn": 18, "B_fn": 59, "D_sharpe": -0.3784, "D_sortino": -0.4483, "D_excess_sharpe": -1.5295, "D_return_pct": -5.79, "D_hit_rate": 42.97, "D_n": 128, "D_bh_sharpe": 1.1511, "D_bh_return_pct": 13.19, "D_psr": 0.3952, "D_ic": -0.0332, "D_precision": 0.549, "D_recall": 0.359, "D_f1": 0.4341, "D_f2": 0.3857, "D_accuracy": 0.4297, "D_mcc": -0.1007, "D_tp": 28, "D_fp": 23, "D_tn": 27, "D_fn": 50, "sharpe": -0.4805, "sortino": -0.5343, "return_pct": -6.94, "equity": 930.6, "max_dd": 0.0, "win_rate": 43.75, "profit_factor": 0.0, "ic": -0.0332, "hit": 43.75, "psr": 0.3677, "bh_sharpe": 1.1511, "bh_return_pct": 13.19, "excess_sharpe": -1.6316, "precision": 0.5556, "recall": 0.3846, "f1": 0.4545, "f2": 0.4098, "mcc": -0.0942, "accuracy": 0.4375, "tp": 30, "fp": 24, "tn": 26, "fn": 48}, {"fold": "fold_6", "regime": "COVID crash and V-recovery", "n": 173, "A_sharpe": 2.2539, "A_sortino": 2.7422, "A_excess_sharpe": -0.0721, "A_return_pct": 42.18, "A_hit_rate": 50.87, "A_n": 173, "A_bh_sharpe": 2.3261, "A_bh_return_pct": 43.81, "A_psr": 0.9722, "A_ic": 0.127, "A_precision": 0.6795, "A_recall": 0.469, "A_f1": 0.555, "A_f2": 0.5, "A_accuracy": 0.5087, "A_mcc": 0.0501, "A_tp": 53, "A_fp": 25, "A_tn": 35, "A_fn": 60, "B_sharpe": -1.0599, "B_sortino": -1.1263, "B_excess_sharpe": -6.8059, "B_return_pct": -36.54, "B_hit_rate": 45.35, "B_n": 173, "B_bh_sharpe": 5.746, "B_bh_return_pct": 499.04, "B_psr": 0.1952, "B_ic": 0.1057, "B_precision": 0.6809, "B_recall": 0.2883, "B_f1": 0.4051, "B_f2": 0.3259, "B_accuracy": 0.4566, "B_mcc": 0.05, "B_tp": 32, "B_fp": 15, "B_tn": 47, "B_fn": 79, "D_sharpe": -0.5266, "D_sortino": -0.6304, "D_excess_sharpe": -2.8527, "D_return_pct": -10.23, "D_hit_rate": 38.73, "D_n": 173, "D_bh_sharpe": 2.3261, "D_bh_return_pct": 43.81, "D_psr": 0.3334, "D_ic": 0.0209, "D_precision": 0.5745, "D_recall": 0.2389, "D_f1": 0.3375, "D_f2": 0.2705, "D_accuracy": 0.3873, "D_mcc": -0.101, "D_tp": 27, "D_fp": 20, "D_tn": 40, "D_fn": 86, "sharpe": 2.2539, "sortino": 2.7422, "return_pct": 42.18, "equity": 1421.8, "max_dd": 0.0, "win_rate": 50.87, "profit_factor": 0.0, "ic": 0.127, "hit": 50.87, "psr": 0.9722, "bh_sharpe": 2.3261, "bh_return_pct": 43.81, "excess_sharpe": -0.0721, "precision": 0.6795, "recall": 0.469, "f1": 0.555, "f2": 0.5, "mcc": 0.0501, "accuracy": 0.5087, "tp": 53, "fp": 25, "tn": 35, "fn": 60}, {"fold": "fold_7", "regime": "Inflation bear, AI rally and 2025", "n": 376, "A_sharpe": 0.2242, "A_sortino": 0.2512, "A_excess_sharpe": -0.5791, "A_return_pct": 3.86, "A_hit_rate": 48.14, "A_n": 376, "A_bh_sharpe": 0.8033, "A_bh_return_pct": 26.02, "A_psr": 0.6087, "A_ic": 0.0137, "A_precision": 0.5985, "A_recall": 0.3575, "A_f1": 0.4476, "A_f2": 0.3888, "A_accuracy": 0.4814, "A_mcc": 0.016, "A_tp": 79, "A_fp": 53, "A_tn": 102, "A_fn": 142, "B_sharpe": -0.4175, "B_sortino": -0.4738, "B_excess_sharpe": -2.3492, "B_return_pct": -36.24, "B_hit_rate": 42.67, "B_n": 376, "B_bh_sharpe": 1.9317, "B_bh_return_pct": 222.05, "B_psr": 0.3067, "B_ic": -0.0086, "B_precision": 0.625, "B_recall": 0.1322, "B_f1": 0.2182, "B_f2": 0.1569, "B_accuracy": 0.4282, "B_mcc": 0.0166, "B_tp": 30, "B_fp": 18, "B_tn": 131, "B_fn": 197, "D_sharpe": -0.4643, "D_sortino": -0.5689, "D_excess_sharpe": -1.2676, "D_return_pct": -17.51, "D_hit_rate": 40.69, "D_n": 376, "D_bh_sharpe": 0.8033, "D_bh_return_pct": 26.02, "D_psr": 0.2902, "D_ic": -0.0155, "D_precision": 0.4792, "D_recall": 0.1041, "D_f1": 0.171, "D_f2": 0.1234, "D_accuracy": 0.4069, "D_mcc": -0.0844, "D_tp": 23, "D_fp": 25, "D_tn": 130, "D_fn": 198, "sharpe": 0.2242, "sortino": 0.2512, "return_pct": 3.86, "equity": 1038.6, "max_dd": 0.0, "win_rate": 48.14, "profit_factor": 0.0, "ic": 0.0137, "hit": 48.14, "psr": 0.6087, "bh_sharpe": 0.8033, "bh_return_pct": 26.02, "excess_sharpe": -0.5791, "precision": 0.5985, "recall": 0.3575, "f1": 0.4476, "f2": 0.3888, "mcc": 0.016, "accuracy": 0.4814, "tp": 79, "fp": 53, "tn": 102, "fn": 142}], "per_window_val": [{"fold": "fold_1", "regime": "GFC peak crash (Lehman + Mar-2009 bottom)", "n": 65, "A_sharpe": 0.7456, "A_sortino": 0.8215, "A_excess_sharpe": 2.9713, "A_return_pct": 5.17, "A_hit_rate": 49.21, "A_n": 65, "A_bh_sharpe": -2.2257, "A_bh_return_pct": -18.74, "A_psr": 0.6485, "A_ic": 0.0861, "A_precision": 0.4655, "A_recall": 0.931, "A_f1": 0.6207, "A_f2": 0.7759, "A_accuracy": 0.4923, "A_mcc": 0.1121, "A_tp": 27, "A_fp": 31, "A_tn": 5, "A_fn": 2, "B_sharpe": -5.3863, "B_sortino": -4.5118, "B_excess_sharpe": 1.736, "B_return_pct": -64.86, "B_hit_rate": 38.46, "B_n": 65, "B_bh_sharpe": -7.1223, "B_bh_return_pct": -73.11, "B_psr": 0.0021, "B_ic": 0.2869, "B_precision": 0.3651, "B_recall": 1.0, "B_f1": 0.5349, "B_f2": 0.7419, "B_accuracy": 0.3846, "B_mcc": 0.1319, "B_tp": 23, "B_fp": 40, "B_tn": 2, "B_fn": 0, "D_sharpe": -1.2517, "D_sortino": -1.0657, "D_excess_sharpe": 0.974, "D_return_pct": -11.66, "D_hit_rate": 49.21, "D_n": 65, "D_bh_sharpe": -2.2257, "D_bh_return_pct": -18.74, "D_psr": 0.2558, "D_ic": 0.3377, "D_precision": 0.4603, "D_recall": 1.0, "D_f1": 0.6304, "D_f2": 0.8101, "D_accuracy": 0.4769, "D_mcc": 0.1599, "D_tp": 29, "D_fp": 34, "D_tn": 2, "D_fn": 0, "sharpe": 0.7456, "sortino": 0.8215, "return_pct": 5.17, "equity": 1051.7, "max_dd": 0.0, "win_rate": 49.21, "profit_factor": 0.0, "ic": 0.0861, "hit": 49.21, "psr": 0.6485, "bh_sharpe": -2.2257, "bh_return_pct": -18.74, "excess_sharpe": 2.9713, "precision": 0.4655, "recall": 0.931, "f1": 0.6207, "f2": 0.7759, "mcc": 0.1121, "accuracy": 0.4923, "tp": 27, "fp": 31, "tn": 5, "fn": 2}, {"fold": "fold_2", "regime": "2011 US-downgrade + EU debt", "n": 47, "A_sharpe": -1.2401, "A_sortino": -1.17, "A_excess_sharpe": -1.046, "A_return_pct": -8.74, "A_hit_rate": 46.81, "A_n": 47, "A_bh_sharpe": -0.1941, "A_bh_return_pct": -2.36, "A_psr": 0.2959, "A_ic": -0.0253, "A_precision": 0.5143, "A_recall": 0.6923, "A_f1": 0.5902, "A_f2": 0.6475, "A_accuracy": 0.4681, "A_mcc": -0.1336, "A_tp": 18, "A_fp": 17, "A_tn": 4, "A_fn": 8, "B_sharpe": 0.5383, "B_sortino": 0.492, "B_excess_sharpe": 2.1506, "B_return_pct": 2.19, "B_hit_rate": 53.19, "B_n": 47, "B_bh_sharpe": -1.6123, "B_bh_return_pct": -24.3, "B_psr": 0.59, "B_ic": 0.1605, "B_precision": 0.4878, "B_recall": 0.9524, "B_f1": 0.6452, "B_f2": 0.8, "B_accuracy": 0.5319, "B_mcc": 0.2156, "B_tp": 20, "B_fp": 21, "B_tn": 5, "B_fn": 1, "D_sharpe": -0.5684, "D_sortino": -0.4846, "D_excess_sharpe": -0.3743, "D_return_pct": -4.7, "D_hit_rate": 55.32, "D_n": 47, "D_bh_sharpe": -0.1941, "D_bh_return_pct": -2.36, "D_psr": 0.4032, "D_ic": 0.0124, "D_precision": 0.561, "D_recall": 0.8846, "D_f1": 0.6866, "D_f2": 0.7931, "D_accuracy": 0.5532, "D_mcc": 0.0409, "D_tp": 23, "D_fp": 18, "D_tn": 3, "D_fn": 3, "sharpe": -1.2401, "sortino": -1.17, "return_pct": -8.74, "equity": 912.6, "max_dd": 0.0, "win_rate": 46.81, "profit_factor": 0.0, "ic": -0.0253, "hit": 46.81, "psr": 0.2959, "bh_sharpe": -0.1941, "bh_return_pct": -2.36, "excess_sharpe": -1.046, "precision": 0.5143, "recall": 0.6923, "f1": 0.5902, "f2": 0.6475, "mcc": -0.1336, "accuracy": 0.4681, "tp": 18, "fp": 17, "tn": 4, "fn": 8}, {"fold": "fold_3", "regime": "Taper tantrum and 2014 H1", "n": 5, "A_sharpe": 0.4387, "A_sortino": 0.5303, "A_excess_sharpe": 1.7581, "A_return_pct": 0.06, "A_hit_rate": 40.0, "A_n": 5, "A_bh_sharpe": -1.3194, "A_bh_return_pct": -0.21, "A_psr": 0.5221, "A_ic": 0.0, "A_precision": 0.3333, "A_recall": 0.5, "A_f1": 0.4, "A_f2": 0.4545, "A_accuracy": 0.4, "A_mcc": -0.1667, "A_tp": 1, "A_fp": 2, "A_tn": 1, "A_fn": 1, "B_sharpe": 25.8705, "B_sortino": 0.0, "B_excess_sharpe": 51.7411, "B_return_pct": 3.95, "B_hit_rate": 100.0, "B_n": 5, "B_bh_sharpe": -25.8705, "B_bh_return_pct": -3.84, "B_psr": 1.0, "B_ic": -0.1, "B_precision": 0.0, "B_recall": 0.0, "B_f1": 0.0, "B_f2": 0.0, "B_accuracy": 1.0, "B_mcc": 0.0, "B_tp": 0, "B_fp": 0, "B_tn": 5, "B_fn": 0, "D_sharpe": 1.3194, "D_sortino": 1.268, "D_excess_sharpe": 2.6388, "D_return_pct": 0.2, "D_hit_rate": 60.0, "D_n": 5, "D_bh_sharpe": -1.3194, "D_bh_return_pct": -0.21, "D_psr": 0.5663, "D_ic": -0.4, "D_precision": 0.0, "D_recall": 0.0, "D_f1": 0.0, "D_f2": 0.0, "D_accuracy": 0.6, "D_mcc": 0.0, "D_tp": 0, "D_fp": 0, "D_tn": 3, "D_fn": 2, "sharpe": 0.4387, "sortino": 0.5303, "return_pct": 0.06, "equity": 1000.5999999999999, "max_dd": 0.0, "win_rate": 40.0, "profit_factor": 0.0, "ic": 0.0, "hit": 40.0, "psr": 0.5221, "bh_sharpe": -1.3194, "bh_return_pct": -0.21, "excess_sharpe": 1.7581, "precision": 0.3333, "recall": 0.5, "f1": 0.4, "f2": 0.4545, "mcc": -0.1667, "accuracy": 0.4, "tp": 1, "fp": 2, "tn": 1, "fn": 1}, {"fold": "fold_4", "regime": "China devaluation and oil crash", "n": 47, "A_sharpe": -1.3627, "A_sortino": -1.3811, "A_excess_sharpe": 0.4611, "A_return_pct": -6.71, "A_hit_rate": 40.43, "A_n": 47, "A_bh_sharpe": -1.8238, "A_bh_return_pct": -8.68, "A_psr": 0.2802, "A_ic": -0.0037, "A_precision": 0.4186, "A_recall": 0.8571, "A_f1": 0.5625, "A_f2": 0.7087, "A_accuracy": 0.4043, "A_mcc": -0.186, "A_tp": 18, "A_fp": 25, "A_tn": 1, "A_fn": 3, "B_sharpe": -0.7817, "B_sortino": -0.651, "B_excess_sharpe": 1.4383, "B_return_pct": -11.22, "B_hit_rate": 51.06, "B_n": 47, "B_bh_sharpe": -2.22, "B_bh_return_pct": -23.98, "B_psr": 0.3647, "B_ic": 0.5252, "B_precision": 0.4773, "B_recall": 1.0, "B_f1": 0.6462, "B_f2": 0.8203, "B_accuracy": 0.5106, "B_mcc": 0.2347, "B_tp": 21, "B_fp": 23, "B_tn": 3, "B_fn": 0, "D_sharpe": -1.9382, "D_sortino": -1.7846, "D_excess_sharpe": -0.1144, "D_return_pct": -9.16, "D_hit_rate": 46.81, "D_n": 47, "D_bh_sharpe": -1.8238, "D_bh_return_pct": -8.68, "D_psr": 0.2035, "D_ic": 0.1001, "D_precision": 0.4545, "D_recall": 0.9524, "D_f1": 0.6154, "D_f2": 0.7812, "D_accuracy": 0.4681, "D_mcc": 0.0596, "D_tp": 20, "D_fp": 24, "D_tn": 2, "D_fn": 1, "sharpe": -1.3627, "sortino": -1.3811, "return_pct": -6.71, "equity": 932.9000000000001, "max_dd": 0.0, "win_rate": 40.43, "profit_factor": 0.0, "ic": -0.0037, "hit": 40.43, "psr": 0.2802, "bh_sharpe": -1.8238, "bh_return_pct": -8.68, "excess_sharpe": 0.4611, "precision": 0.4186, "recall": 0.8571, "f1": 0.5625, "f2": 0.7087, "mcc": -0.186, "accuracy": 0.4043, "tp": 18, "fp": 25, "tn": 1, "fn": 3}, {"fold": "fold_5", "regime": "2018 Vol-mageddon + Q4 sell-off", "n": 5, "A_sharpe": -10.1368, "A_sortino": -6.9937, "A_excess_sharpe": 0.0, "A_return_pct": -3.15, "A_hit_rate": 40.0, "A_n": 5, "A_bh_sharpe": -10.1368, "A_bh_return_pct": -3.15, "A_psr": 0.0985, "A_ic": -0.2, "A_precision": 0.4, "A_recall": 1.0, "A_f1": 0.5714, "A_f2": 0.7692, "A_accuracy": 0.4, "A_mcc": 0.0, "A_tp": 2, "A_fp": 3, "A_tn": 0, "A_fn": 0, "B_sharpe": 5.6858, "B_sortino": 6.0578, "B_excess_sharpe": 0.0, "B_return_pct": 4.22, "B_hit_rate": 60.0, "B_n": 5, "B_bh_sharpe": 5.6858, "B_bh_return_pct": 4.22, "B_psr": 0.753, "B_ic": 0.7, "B_precision": 0.6, "B_recall": 1.0, "B_f1": 0.75, "B_f2": 0.8824, "B_accuracy": 0.6, "B_mcc": 0.0, "B_tp": 3, "B_fp": 2, "B_tn": 0, "B_fn": 0, "D_sharpe": -10.1368, "D_sortino": -6.9937, "D_excess_sharpe": 0.0, "D_return_pct": -3.15, "D_hit_rate": 40.0, "D_n": 5, "D_bh_sharpe": -10.1368, "D_bh_return_pct": -3.15, "D_psr": 0.0985, "D_ic": 0.5, "D_precision": 0.4, "D_recall": 1.0, "D_f1": 0.5714, "D_f2": 0.7692, "D_accuracy": 0.4, "D_mcc": 0.0, "D_tp": 2, "D_fp": 3, "D_tn": 0, "D_fn": 0, "sharpe": -10.1368, "sortino": -6.9937, "return_pct": -3.15, "equity": 968.5, "max_dd": 0.0, "win_rate": 40.0, "profit_factor": 0.0, "ic": -0.2, "hit": 40.0, "psr": 0.0985, "bh_sharpe": -10.1368, "bh_return_pct": -3.15, "excess_sharpe": 0.0, "precision": 0.4, "recall": 1.0, "f1": 0.5714, "f2": 0.7692, "mcc": 0.0, "accuracy": 0.4, "tp": 2, "fp": 3, "tn": 0, "fn": 0}, {"fold": "fold_6", "regime": "COVID crash and V-recovery", "n": 26, "A_sharpe": 5.0134, "A_sortino": 5.9421, "A_excess_sharpe": 1.7282, "A_return_pct": 7.31, "A_hit_rate": 57.69, "A_n": 26, "A_bh_sharpe": 3.2852, "A_bh_return_pct": 4.82, "A_psr": 0.9402, "A_ic": 0.2383, "A_precision": 0.6667, "A_recall": 0.625, "A_f1": 0.6452, "A_f2": 0.6329, "A_accuracy": 0.5769, "A_mcc": 0.1231, "A_tp": 10, "A_fp": 5, "A_tn": 5, "A_fn": 6, "B_sharpe": -0.8223, "B_sortino": -0.8406, "B_excess_sharpe": -13.8015, "B_return_pct": -3.2, "B_hit_rate": 46.15, "B_n": 26, "B_bh_sharpe": 12.9792, "B_bh_return_pct": 38.76, "B_psr": 0.3984, "B_ic": 0.4263, "B_precision": 1.0, "B_recall": 0.3333, "B_f1": 0.5, "B_f2": 0.3846, "B_accuracy": 0.4615, "B_mcc": 0.2962, "B_tp": 7, "B_fp": 0, "B_tn": 5, "B_fn": 14, "D_sharpe": 4.0598, "D_sortino": 5.0819, "D_excess_sharpe": 0.7746, "D_return_pct": 5.95, "D_hit_rate": 57.69, "D_n": 26, "D_bh_sharpe": 3.2852, "D_bh_return_pct": 4.82, "D_psr": 0.9086, "D_ic": 0.3668, "D_precision": 0.8571, "D_recall": 0.375, "D_f1": 0.5217, "D_f2": 0.4225, "D_accuracy": 0.5769, "D_mcc": 0.3016, "D_tp": 6, "D_fp": 1, "D_tn": 9, "D_fn": 10, "sharpe": 5.0134, "sortino": 5.9421, "return_pct": 7.31, "equity": 1073.1, "max_dd": 0.0, "win_rate": 57.69, "profit_factor": 0.0, "ic": 0.2383, "hit": 57.69, "psr": 0.9402, "bh_sharpe": 3.2852, "bh_return_pct": 4.82, "excess_sharpe": 1.7282, "precision": 0.6667, "recall": 0.625, "f1": 0.6452, "f2": 0.6329, "mcc": 0.1231, "accuracy": 0.5769, "tp": 10, "fp": 5, "tn": 5, "fn": 6}, {"fold": "fold_7", "regime": "Inflation bear, AI rally and 2025", "n": 65, "A_sharpe": 1.4536, "A_sortino": 1.5635, "A_excess_sharpe": -0.6254, "A_return_pct": 5.57, "A_hit_rate": 53.85, "A_n": 65, "A_bh_sharpe": 2.0789, "A_bh_return_pct": 8.17, "A_psr": 0.7711, "A_ic": 0.2923, "A_precision": 0.6667, "A_recall": 0.2857, "A_f1": 0.4, "A_f2": 0.3226, "A_accuracy": 0.5385, "A_mcc": 0.1409, "A_tp": 10, "A_fp": 5, "A_tn": 25, "A_fn": 25, "B_sharpe": -3.6338, "B_sortino": -3.6463, "B_excess_sharpe": -8.8652, "B_return_pct": -24.57, "B_hit_rate": 33.85, "B_n": 65, "B_bh_sharpe": 5.2314, "B_bh_return_pct": 44