{"experiment_num": 35, "backbone": "lstm", "description": "LSTM @ exp 8 baseline ep=200 pat=30 (up from 100/15) - Goyal 2017 longer training; Fischer-Krauss 2018 ep=200 prior", "config": {"seq_len": 10, "lr": 0.001, "batch_size": 16, "epochs": 200, "weight_decay": 0.0007, "patience": 30, "warmup_epochs": 0, "head_dropout": 0.1, "huber_delta": 1.0, "grad_clip": 1.0, "seed": 0, "hidden_size": null, "num_layers": null, "max_depth": null, "gbm_lr": null, "n_estimators": null}, "composite": -1.4347, "test_pos_folds": 1, "val_pos_folds": 2, "val_loss": -2.8865115968212107, "elapsed_sec": 79.8, "timestamp": "2026-04-27T18:35:59", "sharpe": -0.6759, "val_sharpe": -0.8347, "ic": 0.0284, "hit": 44.07, "psr": 0.0558, "equity": 291.5000000000001, "return_pct": -70.85, "bh_sharpe": 0.6042, "bh_return_pct": 103.49, "excess_sharpe": -1.2801, "B_sharpe": 0.836, "B_excess_sharpe": -0.8648, "B_return_pct": 442.42, "D_sharpe": -0.6759, "D_excess_sharpe": -1.2801, "D_return_pct": -70.85, "per_window": [{"fold": "fold_1", "regime": "GFC peak crash (Lehman + Mar-2009 bottom)", "n": 115, "A_sharpe": -1.0697, "A_sortino": -1.0175, "A_excess_sharpe": -0.6255, "A_return_pct": -25.62, "A_hit_rate": 49.57, "A_n": 115, "A_bh_sharpe": -0.4441, "A_bh_return_pct": -14.4, "A_psr": 0.2366, "A_ic": -0.0475, "B_sharpe": 0.2657, "B_sortino": 0.2578, "B_excess_sharpe": 0.5635, "B_return_pct": -7.82, "B_hit_rate": 53.51, "B_n": 115, "B_bh_sharpe": -0.2978, "B_bh_return_pct": -27.23, "B_psr": 0.5709, "B_ic": 0.1126, "D_sharpe": -1.0697, "D_sortino": -1.0175, "D_excess_sharpe": -0.6255, "D_return_pct": -25.62, "D_hit_rate": 49.57, "D_n": 115, "D_bh_sharpe": -0.4441, "D_bh_return_pct": -14.4, "D_psr": 0.2366, "D_ic": -0.0475, "sharpe": -1.0697, "sortino": -1.0175, "return_pct": -25.62, "equity": 743.8000000000001, "max_dd": 0.0, "win_rate": 49.57, "profit_factor": 0.0, "ic": -0.0475, "hit": 49.57, "psr": 0.2366, "bh_sharpe": -0.4441, "bh_return_pct": -14.4, "excess_sharpe": -0.6255, "precision": 0.4655, "recall": 0.5, "f1": 0.4821, "f2": 0.4927, "accuracy": 0.4957, "mcc": -0.0082, "tp": 27, "fp": 31, "tn": 30, "fn": 27, "A_precision": 0.4655, "A_recall": 0.5, "A_f1": 0.4821, "A_f2": 0.4927, "A_accuracy": 0.4957, "A_mcc": -0.0082, "A_tp": 27, "A_fp": 31, "A_tn": 30, "A_fn": 27}, {"fold": "fold_2", "regime": "2011 US-downgrade + EU debt", "n": 136, "A_sharpe": -0.5384, "A_sortino": -0.6205, "A_excess_sharpe": -2.2711, "A_return_pct": -6.88, "A_hit_rate": 42.22, "A_n": 136, "A_bh_sharpe": 1.7327, "A_bh_return_pct": 19.75, "A_psr": 0.3483, "A_ic": 0.0518, "B_sharpe": 3.0428, "B_sortino": 2.9044, "B_excess_sharpe": -1.0231, "B_return_pct": 96.95, "B_hit_rate": 63.24, "B_n": 136, "B_bh_sharpe": 4.0659, "B_bh_return_pct": 148.68, "B_psr": 0.9858, "B_ic": 0.0191, "D_sharpe": -0.5384, "D_sortino": -0.6205, "D_excess_sharpe": -2.2711, "D_return_pct": -6.88, "D_hit_rate": 42.22, "D_n": 136, "D_bh_sharpe": 1.7327, "D_bh_return_pct": 19.75, "D_psr": 0.3483, "D_ic": 0.0518, "sharpe": -0.5384, "sortino": -0.6205, "return_pct": -6.88, "equity": 931.2, "max_dd": 0.0, "win_rate": 42.22, "profit_factor": 0.0, "ic": 0.0518, "hit": 42.22, "psr": 0.3483, "bh_sharpe": 1.7327, "bh_return_pct": 19.75, "excess_sharpe": -2.2711, "precision": 0.5, "recall": 0.0897, "f1": 0.1522, "f2": 0.1074, "accuracy": 0.4265, "mcc": -0.0504, "tp": 7, "fp": 7, "tn": 51, "fn": 71, "A_precision": 0.5, "A_recall": 0.0897, "A_f1": 0.1522, "A_f2": 0.1074, "A_accuracy": 0.4265, "A_mcc": -0.0504, "A_tp": 7, "A_fp": 7, "A_tn": 51, "A_fn": 71}, {"fold": "fold_3", "regime": "Taper tantrum and 2014 H1", "n": 178, "A_sharpe": -0.3507, "A_sortino": -0.4032, "A_excess_sharpe": -1.6953, "A_return_pct": -3.74, "A_hit_rate": 45.2, "A_n": 178, "A_bh_sharpe": 1.3445, "A_bh_return_pct": 12.41, "A_psr": 0.3854, "A_ic": 0.1821, "B_sharpe": 3.6483, "B_sortino": 4.4629, "B_excess_sharpe": 0.6, "B_return_pct": 91.13, "B_hit_rate": 55.06, "B_n": 178, "B_bh_sharpe": 3.0483, "B_bh_return_pct": 71.83, "B_psr": 0.9992, "B_ic": 0.1987, "D_sharpe": -0.3507, "D_sortino": -0.4032, "D_excess_sharpe": -1.6953, "D_return_pct": -3.74, "D_hit_rate": 45.2, "D_n": 178, "D_bh_sharpe": 1.3445, "D_bh_return_pct": 12.41, "D_psr": 0.3854, "D_ic": 0.1821, "sharpe": -0.3507, "sortino": -0.4032, "return_pct": -3.74, "equity": 962.6, "max_dd": 0.0, "win_rate": 45.2, "profit_factor": 0.0, "ic": 0.1821, "hit": 45.2, "psr": 0.3854, "bh_sharpe": 1.3445, "bh_return_pct": 12.41, "excess_sharpe": -1.6953, "precision": 0.875, "recall": 0.068, "f1": 0.1261, "f2": 0.0833, "accuracy": 0.4551, "mcc": 0.1302, "tp": 7, "fp": 1, "tn": 74, "fn": 96, "A_precision": 0.875, "A_recall": 0.068, "A_f1": 0.1261, "A_f2": 0.0833, "A_accuracy": 0.4551, "A_mcc": 0.1302, "A_tp": 7, "A_fp": 1, "A_tn": 74, "A_fn": 96}, {"fold": "fold_4", "regime": "China devaluation and oil crash", "n": 157, "A_sharpe": 0.7887, "A_sortino": 0.8083, "A_excess_sharpe": 0.7789, "A_return_pct": 8.71, "A_hit_rate": 50.64, "A_n": 157, "A_bh_sharpe": 0.0098, "A_bh_return_pct": -1.05, "A_psr": 0.7323, "A_ic": 0.1794, "B_sharpe": 2.5011, "B_sortino": 2.5194, "B_excess_sharpe": 2.4852, "B_return_pct": 85.22, "B_hit_rate": 56.69, "B_n": 157, "B_bh_sharpe": 0.0159, "B_bh_return_pct": -5.48, "B_psr": 0.9727, "B_ic": 0.2989, "D_sharpe": 0.7887, "D_sortino": 0.8083, "D_excess_sharpe": 0.7789, "D_return_pct": 8.71, "D_hit_rate": 50.64, "D_n": 157, "D_bh_sharpe": 0.0098, "D_bh_return_pct": -1.05, "D_psr": 0.7323, "D_ic": 0.1794, "sharpe": 0.7887, "sortino": 0.8083, "return_pct": 8.71, "equity": 1087.1, "max_dd": 0.0, "win_rate": 50.64, "profit_factor": 0.0, "ic": 0.1794, "hit": 50.64, "psr": 0.7323, "bh_sharpe": 0.0098, "bh_return_pct": -1.05, "excess_sharpe": 0.7789, "precision": 0.6, "recall": 0.1481, "f1": 0.2376, "f2": 0.1744, "accuracy": 0.5096, "mcc": 0.0643, "tp": 12, "fp": 8, "tn": 68, "fn": 69, "A_precision": 0.6, "A_recall": 0.1481, "A_f1": 0.2376, "A_f2": 0.1744, "A_accuracy": 0.5096, "A_mcc": 0.0643, "A_tp": 12, "A_fp": 8, "A_tn": 68, "A_fn": 69}, {"fold": "fold_5", "regime": "2018 Vol-mageddon + Q4 sell-off", "n": 177, "A_sharpe": -0.267, "A_sortino": -0.2873, "A_excess_sharpe": -0.5768, "A_return_pct": -5.99, "A_hit_rate": 43.5, "A_n": 177, "A_bh_sharpe": 0.3098, "A_bh_return_pct": 3.19, "A_psr": 0.4117, "A_ic": 0.0232, "B_sharpe": 0.1832, "B_sortino": 0.1605, "B_excess_sharpe": -0.7085, "B_return_pct": -1.66, "B_hit_rate": 55.68, "B_n": 177, "B_bh_sharpe": 0.8917, "B_bh_return_pct": 23.8, "B_psr": 0.5606, "B_ic": 0.0852, "D_sharpe": -0.267, "D_sortino": -0.2873, "D_excess_sharpe": -0.5768, "D_return_pct": -5.99, "D_hit_rate": 43.5, "D_n": 177, "D_bh_sharpe": 0.3098, "D_bh_return_pct": 3.19, "D_psr": 0.4117, "D_ic": 0.0232, "sharpe": -0.267, "sortino": -0.2873, "return_pct": -5.99, "equity": 940.1, "max_dd": 0.0, "win_rate": 43.5, "profit_factor": 0.0, "ic": 0.0232, "hit": 43.5, "psr": 0.4117, "bh_sharpe": 0.3098, "bh_return_pct": 3.19, "excess_sharpe": -0.5768, "precision": 0.6364, "recall": 0.068, "f1": 0.1228, "f2": 0.0827, "accuracy": 0.435, "mcc": 0.0284, "tp": 7, "fp": 4, "tn": 70, "fn": 96, "A_precision": 0.6364, "A_recall": 0.068, "A_f1": 0.1228, "A_f2": 0.0827, "A_accuracy": 0.435, "A_mcc": 0.0284, "A_tp": 7, "A_fp": 4, "A_tn": 70, "A_fn": 96}, {"fold": "fold_6", "regime": "COVID crash and V-recovery", "n": 222, "A_sharpe": -1.1155, "A_sortino": -1.2291, "A_excess_sharpe": -2.0043, "A_return_pct": -35.24, "A_hit_rate": 39.19, "A_n": 222, "A_bh_sharpe": 0.8888, "A_bh_return_pct": 26.13, "A_psr": 0.1538, "A_ic": 0.0451, "B_sharpe": 0.9538, "B_sortino": 0.9264, "B_excess_sharpe": -1.4346, "B_return_pct": 44.58, "B_hit_rate": 53.39, "B_n": 222, "B_bh_sharpe": 2.3884, "B_bh_return_pct": 243.18, "B_psr": 0.8113, "B_ic": 0.0267, "D_sharpe": -1.1155, "D_sortino": -1.2291, "D_excess_sharpe": -2.0043, "D_return_pct": -35.24, "D_hit_rate": 39.19, "D_n": 222, "D_bh_sharpe": 0.8888, "D_bh_return_pct": 26.13, "D_psr": 0.1538, "D_ic": 0.0451, "sharpe": -1.1155, "sortino": -1.2291, "return_pct": -35.24, "equity": 647.5999999999999, "max_dd": 0.0, "win_rate": 39.19, "profit_factor": 0.0, "ic": 0.0451, "hit": 39.19, "psr": 0.1538, "bh_sharpe": 0.8888, "bh_return_pct": 26.13, "excess_sharpe": -2.0043, "precision": 0.5714, "recall": 0.087, "f1": 0.1509, "f2": 0.1047, "accuracy": 0.3919, "mcc": -0.0335, "tp": 12, "fp": 9, "tn": 75, "fn": 126, "A_precision": 0.5714, "A_recall": 0.087, "A_f1": 0.1509, "A_f2": 0.1047, "A_accuracy": 0.3919, "A_mcc": -0.0335, "A_tp": 12, "A_fp": 9, "A_tn": 75, "A_fn": 126}, {"fold": "fold_7", "regime": "Inflation bear, AI rally and 2025", "n": 425, "A_sharpe": -1.0243, "A_sortino": -1.0465, "A_excess_sharpe": -1.9958, "A_return_pct": -33.95, "A_hit_rate": 43.06, "A_n": 425, "A_bh_sharpe": 0.9715, "A_bh_return_pct": 37.12, "A_psr": 0.0884, "A_ic": -0.0026, "B_sharpe": -0.4508, "B_sortino": -0.4205, "B_excess_sharpe": -2.9535, "B_return_pct": -40.64, "B_hit_rate": 50.71, "B_n": 425, "B_bh_sharpe": 2.5027, "B_bh_return_pct": 458.83, "B_psr": 0.2783, "B_ic": -0.065, "D_sharpe": -1.0243, "D_sortino": -1.0465, "D_excess_sharpe": -1.9958, "D_return_pct": -33.95, "D_hit_rate": 43.06, "D_n": 425, "D_bh_sharpe": 0.9715, "D_bh_return_pct": 37.12, "D_psr": 0.0884, "D_ic": -0.0026, "sharpe": -1.0243, "sortino": -1.0465, "return_pct": -33.95, "equity": 660.5, "max_dd": 0.0, "win_rate": 43.06, "profit_factor": 0.0, "ic": -0.0026, "hit": 43.06, "psr": 0.0884, "bh_sharpe": 0.9715, "bh_return_pct": 37.12, "excess_sharpe": -1.9958, "precision": 0.6053, "recall": 0.092, "f1": 0.1597, "f2": 0.1108, "accuracy": 0.4306, "mcc": 0.0108, "tp": 23, "fp": 15, "tn": 160, "fn": 227, "A_precision": 0.6053, "A_recall": 0.092, "A_f1": 0.1597, "A_f2": 0.1108, "A_accuracy": 0.4306, "A_mcc": 0.0108, "A_tp": 23, "A_fp": 15, "A_tn": 160, "A_fn": 227}], "per_window_val": [{"fold": "fold_1", "regime": "GFC peak crash (Lehman + Mar-2009 bottom)", "n": 104, "A_sharpe": 0.3762, "A_sortino": 0.4193, "A_excess_sharpe": 0.5434, "A_return_pct": 2.85, "A_hit_rate": 49.02, "A_n": 104, "A_bh_sharpe": -0.1672, "A_bh_return_pct": -3.81, "A_psr": 0.596, "A_ic": 0.053, "B_sharpe": -3.4124, "B_sortino": -3.0143, "B_excess_sharpe": -1.1383, "B_return_pct": -56.43, "B_hit_rate": 40.78, "B_n": 104, "B_bh_sharpe": -2.2741, "B_bh_return_pct": -44.12, "B_psr": 0.0103, "B_ic": -0.1946, "D_sharpe": 0.3762, "D_sortino": 0.4193, "D_excess_sharpe": 0.5434, "D_return_pct": 2.85, "D_hit_rate": 49.02, "D_n": 104, "D_bh_sharpe": -0.1672, "D_bh_return_pct": -3.81, "D_psr": 0.596, "D_ic": 0.053, "sharpe": 0.3762, "sortino": 0.4193, "return_pct": 2.85, "equity": 1028.5, "max_dd": 0.0, "win_rate": 49.02, "profit_factor": 0.0, "ic": 0.053, "hit": 49.02, "psr": 0.596, "bh_sharpe": -0.1672, "bh_return_pct": -3.81, "excess_sharpe": 0.5434}, {"fold": "fold_2", "regime": "2011 US-downgrade + EU debt", "n": 96, "A_sharpe": -0.0975, "A_sortino": -0.1002, "A_excess_sharpe": 0.1766, "A_return_pct": -2.34, "A_hit_rate": 47.37, "A_n": 96, "A_bh_sharpe": -0.2741, "A_bh_return_pct": -4.09, "A_psr": 0.4761, "A_ic": 0.012, "B_sharpe": -0.58, "B_sortino": -0.5489, "B_excess_sharpe": 0.4475, "B_return_pct": -17.79, "B_hit_rate": 47.92, "B_n": 96, "B_bh_sharpe": -1.0274, "B_bh_return_pct": -25.58, "B_psr": 0.3595, "B_ic": -0.0354, "D_sharpe": -0.0975, "D_sortino": -0.1002, "D_excess_sharpe": 0.1766, "D_return_pct": -2.34, "D_hit_rate": 47.37, "D_n": 96, "D_bh_sharpe": -0.2741, "D_bh_return_pct": -4.09, "D_psr": 0.4761, "D_ic": 0.012, "sharpe": -0.0975, "sortino": -0.1002, "return_pct": -2.34, "equity": 976.6, "max_dd": 0.0, "win_rate": 47.37, "profit_factor": 0.0, "ic": 0.012, "hit": 47.37, "psr": 0.4761, "bh_sharpe": -0.2741, "bh_return_pct": -4.09, "excess_sharpe": 0.1766}, {"fold": "fold_3", "regime": "Taper tantrum and 2014 H1", "n": 54, "A_sharpe": -4.6998, "A_sortino": -4.264, "A_excess_sharpe": -9.3995, "A_return_pct": -9.68, "A_hit_rate": 38.89, "A_n": 54, "A_bh_sharpe": 4.6998, "A_bh_return_pct": 10.46, "A_psr": 0.0221, "A_ic": 0.0033, "B_sharpe": 5.8522, "B_sortino": 7.1277, "B_excess_sharpe": -3.1803, "B_return_pct": 32.04, "B_hit_rate": 62.96, "B_n": 54, "B_bh_sharpe": 9.0326, "B_bh_return_pct": 49.18, "B_psr": 0.9967, "B_ic": 0.2348, "D_sharpe": -4.6998, "D_sortino": -4.264, "D_excess_sharpe": -9.3995, "D_return_pct": -9.68, "D_hit_rate": 38.89, "D_n": 54, "D_bh_sharpe": 4.6998, "D_bh_return_pct": 10.46, "D_psr": 0.0221, "D_ic": 0.0033, "sharpe": -4.6998, "sortino": -4.264, "return_pct": -9.68, "equity": 903.2, "max_dd": 0.0, "win_rate": 38.89, "profit_factor": 0.0, "ic": 0.0033, "hit": 38.89, "psr": 0.0221, "bh_sharpe": 4.6998, "bh_return_pct": 10.46, "excess_sharpe": -9.3995}, {"fold": "fold_4", "regime": "China devaluation and oil crash", "n": 96, "A_sharpe": 0.4241, "A_sortino": 0.431, "A_excess_sharpe": 0.8483, "A_return_pct": 2.43, "A_hit_rate": 52.63, "A_n": 96, "A_bh_sharpe": -0.4241, "A_bh_return_pct": -3.73, "A_psr": 0.6029, "A_ic": 0.018, "B_sharpe": -0.066, "B_sortino": -0.0676, "B_excess_sharpe": 1.1182, "B_return_pct": -4.85, "B_hit_rate": 47.92, "B_n": 96, "B_bh_sharpe": -1.1843, "B_bh_return_pct": -21.44, "B_psr": 0.4838, "B_ic": 0.2636, "D_sharpe": 0.4241, "D_sortino": 0.431, "D_excess_sharpe": 0.8483, "D_return_pct": 2.43, "D_hit_rate": 52.63, "D_n": 96, "D_bh_sharpe": -0.4241, "D_bh_return_pct": -3.73, "D_psr": 0.6029, "D_ic": 0.018, "sharpe": 0.4241, "sortino": 0.431, "return_pct": 2.43, "equity": 1024.3, "max_dd": 0.0, "win_rate": 52.63, "profit_factor": 0.0, "ic": 0.018, "hit": 52.63, "psr": 0.6029, "bh_sharpe": -0.4241, "bh_return_pct": -3.73, "excess_sharpe": 0.8483}, {"fold": "fold_5", "regime": "2018 Vol-mageddon + Q4 sell-off", "n": 54, "A_sharpe": -1.428, "A_sortino": -1.4567, "A_excess_sharpe": -2.8559, "A_return_pct": -4.19, "A_hit_rate": 46.3, "A_n": 54, "A_bh_sharpe": 1.428, "A_bh_return_pct": 3.97, "A_psr": 0.26, "A_ic": 0.1373, "B_sharpe": 0.271, "B_sortino": 0.2733, "B_excess_sharpe": -4.6612, "B_return_pct": 0.78, "B_hit_rate": 51.85, "B_n": 54, "B_bh_sharpe": 4.9322, "B_bh_return_pct": 34.93, "B_psr": 0.5495, "B_ic": -0.0549, "D_sharpe": -1.428, "D_sortino": -1.4567, "D_excess_sharpe": -2.8559, "D_return_pct": -4.19, "D_hit_rate": 46.3, "D_n": 54, "D_bh_sharpe": 1.428, "D_bh_return_pct": 3.97, "D_psr": 0.26, "D_ic": 0.1373, "sharpe": -1.428, "sortino": -1.4567, "return_pct": -4.19, "equity": 958.0999999999999, "max_dd": 0.0, "win_rate": 46.3, "profit_factor": 0.0, "ic": 0.1373, "hit": 46.3, "psr": 0.26, "bh_sharpe": 1.428, "bh_return_pct": 3.97, "excess_sharpe": -2.8559}, {"fold": "fold_6", "regime": "COVID crash and V-recovery", "n": 75, "A_sharpe": -4.2994, "A_sortino": -4.316, "A_excess_sharpe": -8.5988, "A_return_pct": -13.12, "A_hit_rate": 32.0, "A_n": 75, "A_bh_sharpe": 4.2994, "A_bh_return_pct": 14.68, "A_psr": 0.0156, "A_ic": 0.0254, "B_sharpe": -2.5794, "B_sortino": -2.4649, "B_excess_sharpe": -16.9133, "B_return_pct": -18.17, "B_hit_rate": 42.67, "B_n": 75, "B_bh_sharpe": 14.3339, "B_bh_return_pct": 120.13, "B_psr": 0.0822, "B_ic": -0.0496, "D_sharpe": -4.2994, "D_sortino": -4.316, "D_excess_sharpe": -8.5988, "D_return_pct": -13.12, "D_hit_rate": 32.0, "D_n": 75, "D_bh_sharpe": 4.2994, "D_bh_return_pct": 14.68, "D_psr": 0.0156, "D_ic": 0.0254, "sharpe": -4.2994, "sortino": -4.316, "return_pct": -13.12, "equity": 868.8000000000001, "max_dd": 0.0, "win_rate": 32.0, "profit_factor": 0.0, "ic": 0.0254, "hit": 32.0, "psr": 0.0156, "bh_sharpe": 4.2994, "bh_return_pct": 14.68, "excess_sharpe": -8.5988}, {"fold": "fold_7", "regime": "Inflation bear, AI rally and 2025", "n": 114, "A_sharpe": -2.6925, "A_sortino": -2.4439, "A_excess_sharpe": -5.5375, "A_return_pct": -17.66, "A_hit_rate": 43.86, "A_n": 114, "A_bh_sharpe": 2.845, "A_bh_return_pct": 21.34, "A_psr": 0.033, "A_ic": 0.0193, "B_sharpe": 0.9126, "B_sortino": 0.9767, "B_excess_sharpe": -5.224, "B_return_pct": 13.05, "B_hit_rate": 52.63, "B_n": 114, "B_bh_sharpe": 6.1366, "B_bh_return_pct": 155.03, "B_psr": 0.7313, "B_ic": 0.0314, "D_sharpe": -2.6925, "D_sortino": -2.4439, "D_excess_sharpe": -5.5375, "D_return_pct": -17.66, "D_hit_rate": 43.86, "D_n": 114, "D_bh_sharpe": 2.845, "D_bh_return_pct": 21.34, "D_psr": 0.033, "D_ic": 0.0193, "sharpe": -2.6925, "sortino": -2.4439, "return_pct": -17.66, "equity": 823.4, "max_dd": 0.0, "win_rate": 43.86, "profit_factor": 0.0, "ic": 0.0193, "hit": 43.86, "psr": 0.033, "bh_sharpe": 2.845, "bh_return_pct": 21.34, "excess_sharpe": -5.5375}], "status": "DISCARD", "precision": 0.5588, "recall": 0.1177, "f1": 0.1945, "f2": 0.1398, "accuracy": 0.4418, "mcc": -0.0101, "tp": 95, "fp": 75, "tn": 528, "fn": 712, "test_sharpe": -0.6759, "A_sharpe": -0.6759, "A_excess_sharpe": -1.2801, "A_return_pct": -70.85, "A_precision": 0.5588, "A_recall": 0.1177, "A_f1": 0.1945, "A_f2": 0.1398, "A_accuracy": 0.4418, "A_mcc": -0.0101, "A_tp": 95, "A_fp": 75, "A_tn": 528, "A_fn": 712, "A_psr": 0.0558, "A_ic": 0.0284, "A_hit_rate": 44.07, "A_bh_sharpe": 0.6042, "A_bh_return_pct": 103.49}
