{"experiment_num": 88, "backbone": "xgboost", "description": "XGBoost @ exp 44 CHAMP seed=0 - multi-seed FX-paper section 6.4 seed-determinism check", "config": {"seq_len": 60, "lr": 0.0003, "batch_size": 32, "epochs": 50, "weight_decay": 1e-05, "patience": 10, "warmup_epochs": 0, "head_dropout": 0.1, "huber_delta": 1.0, "grad_clip": 1.0, "seed": 0, "hidden_size": null, "num_layers": null, "max_depth": 4, "gbm_lr": 0.02, "n_estimators": 100}, "composite": -1.2111, "test_pos_folds": 5, "val_pos_folds": 3, "val_loss": null, "elapsed_sec": 78.2, "timestamp": "2026-04-27T23:29:29", "sharpe": 0.8726, "val_sharpe": -1.0111, "ic": 0.0297, "hit": 52.07, "psr": 0.9655, "equity": 2066.0, "return_pct": 106.6, "bh_sharpe": 1.2194, "bh_return_pct": 187.05, "excess_sharpe": -0.3468, "B_sharpe": 0.6322, "B_excess_sharpe": -2.196, "B_return_pct": 119.82, "D_sharpe": 0.365, "D_excess_sharpe": -0.8544, "D_return_pct": 27.36, "precision": 0.6041, "recall": 0.5554, "f1": 0.5787, "f2": 0.5645, "mcc": 0.0263, "accuracy": 0.5211, "val_precision": 0.5027, "val_recall": 0.7176, "val_f1": 0.5912, "val_f2": 0.661, "val_mcc": -0.0038, "val_accuracy": 0.5, "per_window": [{"fold": "fold_1", "regime": "GFC peak crash (Lehman + Mar-2009 bottom)", "n": 66, "A_sharpe": 1.3845, "A_sortino": 1.5615, "A_excess_sharpe": 0.8123, "A_return_pct": 12.42, "A_hit_rate": 50.0, "A_n": 66, "A_bh_sharpe": 0.5721, "A_bh_return_pct": 3.85, "A_psr": 0.7613, "A_ic": 0.044, "A_precision": 0.5357, "A_recall": 0.4286, "A_f1": 0.4762, "A_f2": 0.4464, "A_accuracy": 0.5, "A_mcc": 0.0093, "A_tp": 15, "A_fp": 13, "A_tn": 18, "A_fn": 20, "B_sharpe": 0.7674, "B_sortino": 0.7621, "B_excess_sharpe": -1.2796, "B_return_pct": 7.99, "B_hit_rate": 52.31, "B_n": 66, "B_bh_sharpe": 2.0469, "B_bh_return_pct": 39.28, "B_psr": 0.6513, "B_ic": 0.2335, "B_precision": 0.5769, "B_recall": 0.4167, "B_f1": 0.4839, "B_f2": 0.4412, "B_accuracy": 0.5152, "B_mcc": 0.051, "B_tp": 15, "B_fp": 11, "B_tn": 19, "B_fn": 21, "D_sharpe": 2.0538, "D_sortino": 2.3213, "D_excess_sharpe": 1.4817, "D_return_pct": 19.91, "D_hit_rate": 53.03, "D_n": 66, "D_bh_sharpe": 0.5721, "D_bh_return_pct": 3.85, "D_psr": 0.8553, "D_ic": 0.144, "D_precision": 0.5769, "D_recall": 0.4286, "D_f1": 0.4918, "D_f2": 0.4518, "D_accuracy": 0.5303, "D_mcc": 0.0753, "D_tp": 15, "D_fp": 11, "D_tn": 20, "D_fn": 20, "sharpe": 1.3845, "sortino": 1.5615, "return_pct": 12.42, "equity": 1124.2, "max_dd": 0.0, "win_rate": 50.0, "profit_factor": 0.0, "ic": 0.044, "hit": 50.0, "psr": 0.7613, "bh_sharpe": 0.5721, "bh_return_pct": 3.85, "excess_sharpe": 0.8123, "precision": 0.5357, "recall": 0.4286, "f1": 0.4762, "f2": 0.4464, "mcc": 0.0093, "accuracy": 0.5, "tp": 15, "fp": 13, "tn": 18, "fn": 20}, {"fold": "fold_2", "regime": "2011 US-downgrade + EU debt", "n": 87, "A_sharpe": 4.6369, "A_sortino": 6.6221, "A_excess_sharpe": -0.3851, "A_return_pct": 26.88, "A_hit_rate": 58.14, "A_n": 87, "A_bh_sharpe": 5.022, "A_bh_return_pct": 29.23, "A_psr": 0.9991, "A_ic": 0.1008, "A_precision": 0.6216, "A_recall": 0.8519, "A_f1": 0.7187, "A_f2": 0.7931, "A_accuracy": 0.5862, "A_mcc": 0.0046, "A_tp": 46, "A_fp": 28, "A_tn": 5, "A_fn": 8, "B_sharpe": 9.8373, "B_sortino": 8.9725, "B_excess_sharpe": -1.2996, "B_return_pct": 161.23, "B_hit_rate": 80.46, "B_n": 87, "B_bh_sharpe": 11.1369, "B_bh_return_pct": 185.4, "B_psr": 1.0, "B_ic": 0.2754, "B_precision": 0.8434, "B_recall": 0.9459, "B_f1": 0.8917, "B_f2": 0.9235, "B_accuracy": 0.8046, "B_mcc": -0.092, "B_tp": 70, "B_fp": 13, "B_tn": 0, "B_fn": 4, "D_sharpe": 5.2961, "D_sortino": 6.5148, "D_excess_sharpe": 0.2741, "D_return_pct": 30.9, "D_hit_rate": 65.12, "D_n": 87, "D_bh_sharpe": 5.022, "D_bh_return_pct": 29.23, "D_psr": 0.9997, "D_ic": -0.0011, "D_precision": 0.6386, "D_recall": 0.9815, "D_f1": 0.7737, "D_f2": 0.8863, "D_accuracy": 0.6437, "D_mcc": 0.1677, "D_tp": 53, "D_fp": 30, "D_tn": 3, "D_fn": 1, "sharpe": 4.6369, "sortino": 6.6221, "return_pct": 26.88, "equity": 1268.8, "max_dd": 0.0, "win_rate": 58.14, "profit_factor": 0.0, "ic": 0.1008, "hit": 58.14, "psr": 0.9991, "bh_sharpe": 5.022, "bh_return_pct": 29.23, "excess_sharpe": -0.3851, "precision": 0.6216, "recall": 0.8519, "f1": 0.7187, "f2": 0.7931, "mcc": 0.0046, "accuracy": 0.5862, "tp": 46, "fp": 28, "tn": 5, "fn": 8}, {"fold": "fold_3", "regime": "Taper tantrum and 2014 H1", "n": 129, "A_sharpe": 2.2108, "A_sortino": 1.8604, "A_excess_sharpe": 0.443, "A_return_pct": 14.99, "A_hit_rate": 60.94, "A_n": 129, "A_bh_sharpe": 1.7678, "A_bh_return_pct": 11.76, "A_psr": 0.9271, "A_ic": 0.0456, "A_precision": 0.6098, "A_recall": 0.9615, "A_f1": 0.7463, "A_f2": 0.8621, "A_accuracy": 0.6047, "A_mcc": 0.0473, "A_tp": 75, "A_fp": 48, "A_tn": 3, "A_fn": 3, "B_sharpe": 4.2474, "B_sortino": 4.2072, "B_excess_sharpe": 0.0, "B_return_pct": 64.1, "B_hit_rate": 63.57, "B_n": 129, "B_bh_sharpe": 4.2474, "B_bh_return_pct": 64.1, "B_psr": 0.9981, "B_ic": -0.0047, "B_precision": 0.6357, "B_recall": 1.0, "B_f1": 0.7773, "B_f2": 0.8972, "B_accuracy": 0.6357, "B_mcc": 0.0, "B_tp": 82, "B_fp": 47, "B_tn": 0, "B_fn": 0, "D_sharpe": 1.7678, "D_sortino": 1.4748, "D_excess_sharpe": 0.0, "D_return_pct": 11.76, "D_hit_rate": 60.94, "D_n": 129, "D_bh_sharpe": 1.7678, "D_bh_return_pct": 11.76, "D_psr": 0.8822, "D_ic": 0.1628, "D_precision": 0.6047, "D_recall": 1.0, "D_f1": 0.7536, "D_f2": 0.8844, "D_accuracy": 0.6047, "D_mcc": 0.0, "D_tp": 78, "D_fp": 51, "D_tn": 0, "D_fn": 0, "sharpe": 2.2108, "sortino": 1.8604, "return_pct": 14.99, "equity": 1149.8999999999999, "max_dd": 0.0, "win_rate": 60.94, "profit_factor": 0.0, "ic": 0.0456, "hit": 60.94, "psr": 0.9271, "bh_sharpe": 1.7678, "bh_return_pct": 11.76, "excess_sharpe": 0.443, "precision": 0.6098, "recall": 0.9615, "f1": 0.7463, "f2": 0.8621, "mcc": 0.0473, "accuracy": 0.6047, "tp": 75, "fp": 48, "tn": 3, "fn": 3}, {"fold": "fold_4", "regime": "China devaluation and oil crash", "n": 108, "A_sharpe": 1.3747, "A_sortino": 1.3585, "A_excess_sharpe": 2.0645, "A_return_pct": 11.75, "A_hit_rate": 54.21, "A_n": 108, "A_bh_sharpe": -0.6898, "A_bh_return_pct": -6.71, "A_psr": 0.8127, "A_ic": 0.0672, "A_precision": 0.5294, "A_recall": 0.6792, "A_f1": 0.595, "A_f2": 0.6429, "A_accuracy": 0.5463, "A_mcc": 0.1009, "A_tp": 36, "A_fp": 32, "A_tn": 23, "A_fn": 17, "B_sharpe": -3.5469, "B_sortino": -3.1583, "B_excess_sharpe": -1.5894, "B_return_pct": -50.11, "B_hit_rate": 40.74, "B_n": 108, "B_bh_sharpe": -1.9575, "B_bh_return_pct": -33.56, "B_psr": 0.0083, "B_ic": -0.1496, "B_precision": 0.4, "B_recall": 0.5098, "B_f1": 0.4483, "B_f2": 0.4833, "B_accuracy": 0.4074, "B_mcc": -0.1779, "B_tp": 26, "B_fp": 39, "B_tn": 18, "B_fn": 25, "D_sharpe": -2.493, "D_sortino": -2.205, "D_excess_sharpe": -1.8032, "D_return_pct": -20.14, "D_hit_rate": 44.86, "D_n": 108, "D_bh_sharpe": -0.6898, "D_bh_return_pct": -6.71, "D_psr": 0.0467, "D_ic": -0.0547, "D_precision": 0.4462, "D_recall": 0.5472, "D_f1": 0.4915, "D_f2": 0.5235, "D_accuracy": 0.4444, "D_mcc": -0.1097, "D_tp": 29, "D_fp": 36, "D_tn": 19, "D_fn": 24, "sharpe": 1.3747, "sortino": 1.3585, "return_pct": 11.75, "equity": 1117.5, "max_dd": 0.0, "win_rate": 54.21, "profit_factor": 0.0, "ic": 0.0672, "hit": 54.21, "psr": 0.8127, "bh_sharpe": -0.6898, "bh_return_pct": -6.71, "excess_sharpe": 2.0645, "precision": 0.5294, "recall": 0.6792, "f1": 0.595, "f2": 0.6429, "mcc": 0.1009, "accuracy": 0.5463, "tp": 36, "fp": 32, "tn": 23, "fn": 17}, {"fold": "fold_5", "regime": "2018 Vol-mageddon + Q4 sell-off", "n": 128, "A_sharpe": -0.5116, "A_sortino": -0.4798, "A_excess_sharpe": -1.6627, "A_return_pct": -7.29, "A_hit_rate": 53.91, "A_n": 128, "A_bh_sharpe": 1.1511, "A_bh_return_pct": 13.19, "A_psr": 0.3589, "A_ic": -0.0562, "A_precision": 0.6067, "A_recall": 0.6923, "A_f1": 0.6467, "A_f2": 0.6733, "A_accuracy": 0.5391, "A_mcc": -0.0082, "A_tp": 54, "A_fp": 35, "A_tn": 15, "A_fn": 24, "B_sharpe": -1.5051, "B_sortino": -1.5039, "B_excess_sharpe": -4.317, "B_return_pct": -33.67, "B_hit_rate": 41.73, "B_n": 128, "B_bh_sharpe": 2.8119, "B_bh_return_pct": 82.25, "B_psr": 0.1418, "B_ic": -0.1229, "B_precision": 0.5694, "B_recall": 0.4824, "B_f1": 0.5223, "B_f2": 0.4976, "B_accuracy": 0.4141, "B_mcc": -0.2271, "B_tp": 41, "B_fp": 31, "B_tn": 12, "B_fn": 44, "D_sharpe": -0.9274, "D_sortino": -0.9526, "D_excess_sharpe": -2.0785, "D_return_pct": -11.79, "D_hit_rate": 48.44, "D_n": 128, "D_bh_sharpe": 1.1511, "D_bh_return_pct": 13.19, "D_psr": 0.2592, "D_ic": -0.0704, "D_precision": 0.5833, "D_recall": 0.5385, "D_f1": 0.56, "D_f2": 0.5469, "D_accuracy": 0.4844, "D_mcc": -0.0605, "D_tp": 42, "D_fp": 30, "D_tn": 20, "D_fn": 36, "sharpe": -0.5116, "sortino": -0.4798, "return_pct": -7.29, "equity": 927.1, "max_dd": 0.0, "win_rate": 53.91, "profit_factor": 0.0, "ic": -0.0562, "hit": 53.91, "psr": 0.3589, "bh_sharpe": 1.1511, "bh_return_pct": 13.19, "excess_sharpe": -1.6627, "precision": 0.6067, "recall": 0.6923, "f1": 0.6467, "f2": 0.6733, "mcc": -0.0082, "accuracy": 0.5391, "tp": 54, "fp": 35, "tn": 15, "fn": 24}, {"fold": "fold_6", "regime": "COVID crash and V-recovery", "n": 173, "A_sharpe": 2.3673, "A_sortino": 2.4771, "A_excess_sharpe": 0.0413, "A_return_pct": 44.79, "A_hit_rate": 56.07, "A_n": 173, "A_bh_sharpe": 2.3261, "A_bh_return_pct": 43.81, "A_psr": 0.9733, "A_ic": 0.0793, "A_precision": 0.6697, "A_recall": 0.646, "A_f1": 0.6577, "A_f2": 0.6506, "A_accuracy": 0.5607, "A_mcc": 0.0454, "A_tp": 73, "A_fp": 36, "A_tn": 24, "A_fn": 40, "B_sharpe": 2.215, "B_sortino": 2.4741, "B_excess_sharpe": -3.531, "B_return_pct": 96.5, "B_hit_rate": 54.65, "B_n": 173, "B_bh_sharpe": 5.746, "B_bh_return_pct": 499.04, "B_psr": 0.9693, "B_ic": 0.0613, "B_precision": 0.6737, "B_recall": 0.5766, "B_f1": 0.6214, "B_f2": 0.5937, "B_accuracy": 0.5491, "B_mcc": 0.0738, "B_tp": 64, "B_fp": 31, "B_tn": 31, "B_fn": 47, "D_sharpe": 0.4127, "D_sortino": 0.4418, "D_excess_sharpe": -1.9133, "D_return_pct": 4.98, "D_hit_rate": 49.13, "D_n": 173, "D_bh_sharpe": 2.3261, "D_bh_return_pct": 43.81, "D_psr": 0.6339, "D_ic": -0.029, "D_precision": 0.6316, "D_recall": 0.531, "D_f1": 0.5769, "D_f2": 0.5484, "D_accuracy": 0.4913, "D_mcc": -0.0501, "D_tp": 60, "D_fp": 35, "D_tn": 25, "D_fn": 53, "sharpe": 2.3673, "sortino": 2.4771, "return_pct": 44.79, "equity": 1447.8999999999999, "max_dd": 0.0, "win_rate": 56.07, "profit_factor": 0.0, "ic": 0.0793, "hit": 56.07, "psr": 0.9733, "bh_sharpe": 2.3261, "bh_return_pct": 43.81, "excess_sharpe": 0.0413, "precision": 0.6697, "recall": 0.646, "f1": 0.6577, "f2": 0.6506, "mcc": 0.0454, "accuracy": 0.5607, "tp": 73, "fp": 36, "tn": 24, "fn": 40}, {"fold": "fold_7", "regime": "Inflation bear, AI rally and 2025", "n": 376, "A_sharpe": -0.4107, "A_sortino": -0.4683, "A_excess_sharpe": -1.214, "A_return_pct": -16.03, "A_hit_rate": 44.95, "A_n": 376, "A_bh_sharpe": 0.8033, "A_bh_return_pct": 26.02, "A_psr": 0.3114, "A_ic": -0.0231, "A_precision": 0.5778, "A_recall": 0.2353, "A_f1": 0.3344, "A_f2": 0.2669, "A_accuracy": 0.4495, "A_mcc": -0.0114, "A_tp": 52, "A_fp": 38, "A_tn": 117, "A_fn": 169, "B_sharpe": -0.2218, "B_sortino": -0.251, "B_excess_sharpe": -2.1534, "B_return_pct": -26.97, "B_hit_rate": 43.47, "B_n": 376, "B_bh_sharpe": 1.9317, "B_bh_return_pct": 222.05, "B_psr": 0.3938, "B_ic": -0.0374, "B_precision": 0.7143, "B_recall": 0.1101, "B_f1": 0.1908, "B_f2": 0.1326, "B_accuracy": 0.4362, "B_mcc": 0.0724, "B_tp": 25, "B_fp": 10, "B_tn": 139, "B_fn": 202, "D_sharpe": 0.0554, "D_sortino": 0.0729, "D_excess_sharpe": -0.7479, "D_return_pct": -1.82, "D_hit_rate": 42.55, "D_n": 376, "D_bh_sharpe": 0.8033, "D_bh_return_pct": 26.02, "D_psr": 0.527, "D_ic": -0.0435, "D_precision": 0.5714, "D_recall": 0.0905, "D_f1": 0.1562, "D_f2": 0.1088, "D_accuracy": 0.4255, "D_mcc": -0.0106, "D_tp": 20, "D_fp": 15, "D_tn": 140, "D_fn": 201, "sharpe": -0.4107, "sortino": -0.4683, "return_pct": -16.03, "equity": 839.7, "max_dd": 0.0, "win_rate": 44.95, "profit_factor": 0.0, "ic": -0.0231, "hit": 44.95, "psr": 0.3114, "bh_sharpe": 0.8033, "bh_return_pct": 26.02, "excess_sharpe": -1.214, "precision": 0.5778, "recall": 0.2353, "f1": 0.3344, "f2": 0.2669, "mcc": -0.0114, "accuracy": 0.4495, "tp": 52, "fp": 38, "tn": 117, "fn": 169}], "per_window_val": [{"fold": "fold_1", "regime": "GFC peak crash (Lehman + Mar-2009 bottom)", "n": 65, "A_sharpe": -2.7813, "A_sortino": -2.3844, "A_excess_sharpe": -0.5556, "A_return_pct": -22.45, "A_hit_rate": 46.03, "A_n": 65, "A_bh_sharpe": -2.2257, "A_bh_return_pct": -18.74, "A_psr": 0.0713, "A_ic": 0.049, "A_precision": 0.4286, "A_recall": 0.7241, "A_f1": 0.5385, "A_f2": 0.6364, "A_accuracy": 0.4462, "A_mcc": -0.0619, "A_tp": 21, "A_fp": 28, "A_tn": 8, "A_fn": 8, "B_sharpe": -4.7869, "B_sortino": -3.6794, "B_excess_sharpe": 2.3354, "B_return_pct": -61.25, "B_hit_rate": 46.15, "B_n": 65, "B_bh_sharpe": -7.1223, "B_bh_return_pct": -73.11, "B_psr": 0.0022, "B_ic": 0.1044, "B_precision": 0.3966, "B_recall": 1.0, "B_f1": 0.5679, "B_f2": 0.7667, "B_accuracy": 0.4615, "B_mcc": 0.2571, "B_tp": 23, "B_fp": 35, "B_tn": 7, "B_fn": 0, "D_sharpe": -1.5889, "D_sortino": -1.3685, "D_excess_sharpe": 0.6368, "D_return_pct": -14.2, "D_hit_rate": 47.62, "D_n": 65, "D_bh_sharpe": -2.2257, "D_bh_return_pct": -18.74, "D_psr": 0.2006, "D_ic": 0.2809, "D_precision": 0.4483, "D_recall": 0.8966, "D_f1": 0.5977, "D_f2": 0.7471, "D_accuracy": 0.4615, "D_mcc": 0.0123, "D_tp": 26, "D_fp": 32, "D_tn": 4, "D_fn": 3, "sharpe": -2.7813, "sortino": -2.3844, "return_pct": -22.45, "equity": 775.5, "max_dd": 0.0, "win_rate": 46.03, "profit_factor": 0.0, "ic": 0.049, "hit": 46.03, "psr": 0.0713, "bh_sharpe": -2.2257, "bh_return_pct": -18.74, "excess_sharpe": -0.5556, "precision": 0.4286, "recall": 0.7241, "f1": 0.5385, "f2": 0.6364, "mcc": -0.0619, "accuracy": 0.4462, "tp": 21, "fp": 28, "tn": 8, "fn": 8}, {"fold": "fold_2", "regime": "2011 US-downgrade + EU debt", "n": 47, "A_sharpe": 0.9816, "A_sortino": 0.8801, "A_excess_sharpe": 1.1757, "A_return_pct": 5.35, "A_hit_rate": 57.45, "A_n": 47, "A_bh_sharpe": -0.1941, "A_bh_return_pct": -2.36, "A_psr": 0.6603, "A_ic": 0.2309, "A_precision": 0.575, "A_recall": 0.8846, "A_f1": 0.697, "A_f2": 0.7986, "A_accuracy": 0.5745, "A_mcc": 0.1049, "A_tp": 23, "A_fp": 17, "A_tn": 4, "A_fn": 3, "B_sharpe": -0.2078, "B_sortino": -0.1918, "B_excess_sharpe": 1.4046, "B_return_pct": -7.93, "B_hit_rate": 51.06, "B_n": 47, "B_bh_sharpe": -1.6123, "B_bh_return_pct": -24.3, "B_psr": 0.4645, "B_ic": 0.2302, "B_precision": 0.4773, "B_recall": 1.0, "B_f1": 0.6462, "B_f2": 0.8203, "B_accuracy": 0.5106, "B_mcc": 0.2347, "B_tp": 21, "B_fp": 23, "B_tn": 3, "B_fn": 0, "D_sharpe": 0.2997, "D_sortino": 0.2567, "D_excess_sharpe": 0.4938, "D_return_pct": 0.81, "D_hit_rate": 57.45, "D_n": 47, "D_bh_sharpe": -0.1941, "D_bh_return_pct": -2.36, "D_psr": 0.5507, "D_ic": 0.069, "D_precision": 0.5682, "D_recall": 0.9615, "D_f1": 0.7143, "D_f2": 0.8446, "D_accuracy": 0.5745, "D_mcc": 0.1155, "D_tp": 25, "D_fp": 19, "D_tn": 2, "D_fn": 1, "sharpe": 0.9816, "sortino": 0.8801, "return_pct": 5.35, "equity": 1053.5, "max_dd": 0.0, "win_rate": 57.45, "profit_factor": 0.0, "ic": 0.2309, "hit": 57.45, "psr": 0.6603, "bh_sharpe": -0.1941, "bh_return_pct": -2.36, "excess_sharpe": 1.1757, "precision": 0.575, "recall": 0.8846, "f1": 0.697, "f2": 0.7986, "mcc": 0.1049, "accuracy": 0.5745, "tp": 23, "fp": 17, "tn": 4, "fn": 3}, {"fold": "fold_3", "regime": "Taper tantrum and 2014 H1", "n": 5, "A_sharpe": 10.4634, "A_sortino": 21.0684, "A_excess_sharpe": 11.7829, "A_return_pct": 1.37, "A_hit_rate": 60.0, "A_n": 5, "A_bh_sharpe": -1.3194, "A_bh_return_pct": -0.21, "A_psr": 0.9289, "A_ic": 0.9, "A_precision": 0.5, "A_recall": 1.0, "A_f1": 0.6667, "A_f2": 0.8333, "A_accuracy": 0.6, "A_mcc": 0.4082, "A_tp": 2, "A_fp": 2, "A_tn": 1, "A_fn": 0, "B_sharpe": -25.8705, "B_sortino": -13.5303, "B_excess_sharpe": 0.0, "B_return_pct": -3.84, "B_hit_rate": 0.0, "B_n": 5, "B_bh_sharpe": -25.8705, "B_bh_return_pct": -3.84, "B_psr": 0.0, "B_ic": -0.2, "B_precision": 0.0, "B_recall": 0.0, "B_f1": 0.0, "B_f2": 0.0, "B_accuracy": 0.0, "B_mcc": 0.0, "B_tp": 0, "B_fp": 5, "B_tn": 0, "B_fn": 0, "D_sharpe": -1.3194, "D_sortino": -1.3491, "D_excess_sharpe": 0.0, "D_return_pct": -0.21, "D_hit_rate": 40.0, "D_n": 5, "D_bh_sharpe": -1.3194, "D_bh_return_pct": -0.21, "D_psr": 0.4337, "D_ic": -0.3, "D_precision": 0.4, "D_recall": 1.0, "D_f1": 0.5714, "D_f2": 0.7692, "D_accuracy": 0.4, "D_mcc": 0.0, "D_tp": 2, "D_fp": 3, "D_tn": 0, "D_fn": 0, "sharpe": 10.4634, "sortino": 21.0684, "return_pct": 1.37, "equity": 1013.7, "max_dd": 0.0, "win_rate": 60.0, "profit_factor": 0.0, "ic": 0.9, "hit": 60.0, "psr": 0.9289, "bh_sharpe": -1.3194, "bh_return_pct": -0.21, "excess_sharpe": 11.7829, "precision": 0.5, "recall": 1.0, "f1": 0.6667, "f2": 0.8333, "mcc": 0.4082, "accuracy": 0.6, "tp": 2, "fp": 2, "tn": 1, "fn": 0}, {"fold": "fold_4", "regime": "China devaluation and oil crash", "n": 47, "A_sharpe": -1.6009, "A_sortino": -1.4814, "A_excess_sharpe": 0.2228, "A_return_pct": -7.74, "A_hit_rate": 46.81, "A_n": 47, "A_bh_sharpe": -1.8238, "A_bh_return_pct": -8.68, "A_psr": 0.246, "A_ic": 0.0043, "A_precision": 0.4565, "A_recall": 1.0, "A_f1": 0.6269, "A_f2": 0.8077, "A_accuracy": 0.4681, "A_mcc": 0.1325, "A_tp": 21, "A_fp": 25, "A_tn": 1, "A_fn": 0, "B_sharpe": -2.22, "B_sortino": -1.9053, "B_excess_sharpe": 0.0, "B_return_pct": -23.98, "B_hit_rate": 44.68, "B_n": 47, "B_bh_sharpe": -2.22, "B_bh_return_pct": -23.98, "B_psr": 0.1505, "B_ic": 0.557, "B_precision": 0.4468, "B_recall": 1.0, "B_f1": 0.6176, "B_f2": 0.8015, "B_accuracy": 0.4468, "B_mcc": 0.0, "B_tp": 21, "B_fp": 26, "B_tn": 0, "B_fn": 0, "D_sharpe": -1.8238, "D_sortino": -1.7153, "D_excess_sharpe": 0.0, "D_return_pct": -8.68, "D_hit_rate": 44.68, "D_n": 47, "D_bh_sharpe": -1.8238, "D_bh_return_pct": -8.68, "D_psr": 0.2173, "D_ic": 0.3609, "D_precision": 0.4468, "D_recall": 1.0, "D_f1": 0.6176, "D_f2": 0.8015, "D_accuracy": 0.4468, "D_mcc": 0.0, "D_tp": 21, "D_fp": 26, "D_tn": 0, "D_fn": 0, "sharpe": -1.6009, "sortino": -1.4814, "return_pct": -7.74, "equity": 922.6, "max_dd": 0.0, "win_rate": 46.81, "profit_factor": 0.0, "ic": 0.0043, "hit": 46.81, "psr": 0.246, "bh_sharpe": -1.8238, "bh_return_pct": -8.68, "excess_sharpe": 0.2228, "precision": 0.4565, "recall": 1.0, "f1": 0.6269, "f2": 0.8077, "mcc": 0.1325, "accuracy": 0.4681, "tp": 21, "fp": 25, "tn": 1, "fn": 0}, {"fold": "fold_5", "regime": "2018 Vol-mageddon + Q4 sell-off", "n": 5, "A_sharpe": -10.1368, "A_sortino": -6.9937, "A_excess_sharpe": 0.0, "A_return_pct": -3.15, "A_hit_rate": 40.0, "A_n": 5, "A_bh_sharpe": -10.1368, "A_bh_return_pct": -3.15, "A_psr": 0.0985, "A_ic": 0.2, "A_precision": 0.4, "A_recall": 1.0, "A_f1": 0.5714, "A_f2": 0.7692, "A_accuracy": 0.4, "A_mcc": 0.0, "A_tp": 2, "A_fp": 3, "A_tn": 0, "A_fn": 0, "B_sharpe": 5.6858, "B_sortino": 6.0578, "B_excess_sharpe": 0.0, "B_return_pct": 4.22, "B_hit_rate": 60.0, "B_n": 5, "B_bh_sharpe": 5.6858, "B_bh_return_pct": 4.22, "B_psr": 0.753, "B_ic": 0.5, "B_precision": 0.6, "B_recall": 1.0, "B_f1": 0.75, "B_f2": 0.8824, "B_accuracy": 0.6, "B_mcc": 0.0, "B_tp": 3, "B_fp": 2, "B_tn": 0, "B_fn": 0, "D_sharpe": -10.1368, "D_sortino": -6.9937, "D_excess_sharpe": 0.0, "D_return_pct": -3.15, "D_hit_rate": 40.0, "D_n": 5, "D_bh_sharpe": -10.1368, "D_bh_return_pct": -3.15, "D_psr": 0.0985, "D_ic": 0.1, "D_precision": 0.4, "D_recall": 1.0, "D_f1": 0.5714, "D_f2": 0.7692, "D_accuracy": 0.4, "D_mcc": 0.0, "D_tp": 2, "D_fp": 3, "D_tn": 0, "D_fn": 0, "sharpe": -10.1368, "sortino": -6.9937, "return_pct": -3.15, "equity": 968.5, "max_dd": 0.0, "win_rate": 40.0, "profit_factor": 0.0, "ic": 0.2, "hit": 40.0, "psr": 0.0985, "bh_sharpe": -10.1368, "bh_return_pct": -3.15, "excess_sharpe": 0.0, "precision": 0.4, "recall": 1.0, "f1": 0.5714, "f2": 0.7692, "mcc": 0.0, "accuracy": 0.4, "tp": 2, "fp": 3, "tn": 0, "fn": 0}, {"fold": "fold_6", "regime": "COVID crash and V-recovery", "n": 26, "A_sharpe": 3.2852, "A_sortino": 3.0777, "A_excess_sharpe": 0.0, "A_return_pct": 4.82, "A_hit_rate": 61.54, "A_n": 26, "A_bh_sharpe": 3.2852, "A_bh_return_pct": 4.82, "A_psr": 0.8369, "A_ic": 0.1624, "A_precision": 0.6154, "A_recall": 1.0, "A_f1": 0.7619, "A_f2": 0.8889, "A_accuracy": 0.6154, "A_mcc": 0.0, "A_tp": 16, "A_fp": 10, "A_tn": 0, "A_fn": 0, "B_sharpe": 12.9792, "B_sortino": 13.8608, "B_excess_sharpe": 0.0, "B_return_pct": 38.76, "B_hit_rate": 80.77, "B_n": 26, "B_bh_sharpe": 12.9792, "B_bh_return_pct": 38.76, "B_psr": 0.9998, "B_ic": 0.4913, "B_precision": 0.8077, "B_recall": 1.0, "B_f1": 0.8936, "B_f2": 0.9545, "B_accuracy": 0.8077, "B_mcc": 0.0, "B_tp": 21, "B_fp": 5, "B_tn": 0, "B_fn": 0, "D_sharpe": 3.2852, "D_sortino": 3.0777, "D_excess_sharpe": 0.0, "D_return_pct": 4.82, "D_hit_rate": 61.54, "D_n": 26, "D_bh_sharpe": 3.2852, "D_bh_return_pct": 4.82, "D_psr": 0.8369, "D_ic": 0.2526, "D_precision": 0.6154, "D_recall": 1.0, "D_f1": 0.7619, "D_f2": 0.8889, "D_accuracy": 0.6154, "D_mcc": 0.0, "D_tp": 16, "D_fp": 10, "D_tn": 0, "D_fn": 0, "sharpe": 3.2852, "sortino": 3.0777, "return_pct": 4.82, "equity": 1048.2, "max_dd": 0.0, "win_rate": 61.54, "profit_factor": 0.0, "ic": 0.1624, "hit": 61.54, "psr": 0.8369, "bh_sharpe": 3.2852, "bh_return_pct": 4.82, "excess_sharpe": 0.0, "precision": 0.6154, "recall": 1.0, "f1": 0.7619, "f2": 0.8889, "mcc": 0.0, "accuracy": 0.6154, "tp": 16, "fp": 10, "tn": 0, "fn": 0}, {"fold": "fold_7", "regime": "Inflation bear, AI rally and 2025", "n": 65, "A_sharpe": -1.4341, "A_sortino": -1.3371, "A_excess_sharpe": -3.513, "A_return_pct": -5.78, "A_hit_rate": 47.69, "A_n": 65, "A_bh_sharpe": 2.0789, "A_bh_return_pct": 8.17, "A_psr": 0.233, "A_ic": -0.0193, "A_precision": 0.5294, "A_recall": 0.2571, "A_f1": 0.3462, "A_f2": 0.2866, "A_accuracy": 0.4769, "A_mcc": -0.0108, "A_tp": 9, "A_fp": 8, "A_tn": 22, "A_fn": 26, "B_sharpe": -3.9239, "B_sortino": -3.7361, "B_excess_sharpe": -9.1553, "B_return_pct": -26.09, "B_hit_rate": 36.92, "B_n": 65, "B_bh_sharpe": 5.2314, "B_bh_return_pct": 44.53, "B_psr": 0.0272, "B_ic": 0.0743, "B_precision": 0.7143, "B_recall": 0.1136, "B_f1": 0.1961, "B_f2": 0.1366, "