{"experiment_num": 3, "backbone": "mlp", "description": "mlp SOTA baseline (Gu-Kelly-Xiu 2020 RFS); seq=10 default; QQQ exp3", "config": {"seq_len": 10, "lr": 0.0003, "batch_size": 32, "epochs": 50, "weight_decay": 1e-05, "patience": 10, "warmup_epochs": 0, "head_dropout": 0.1, "huber_delta": 1.0, "grad_clip": 1.0, "seed": 42, "hidden_size": null, "num_layers": null, "max_depth": null, "gbm_lr": null, "n_estimators": null}, "composite": -0.2923, "test_pos_folds": 4, "val_pos_folds": 5, "val_loss": -2.8819717637201987, "elapsed_sec": 28.0, "timestamp": "2026-04-26T14:31:17", "sharpe": 0.0077, "val_sharpe": 0.3834, "ic": -0.012, "hit": 48.76, "psr": 0.5072, "equity": 822.5, "return_pct": -17.75, "bh_sharpe": 0.6042, "bh_return_pct": 103.49, "excess_sharpe": -0.5966, "B_sharpe": -0.1553, "B_excess_sharpe": -1.8562, "B_return_pct": -71.86, "D_sharpe": 0.0077, "D_excess_sharpe": -0.5966, "D_return_pct": -17.75, "per_window": [{"fold": "fold_1", "regime": "GFC peak crash (Lehman + Mar-2009 bottom)", "n": 115, "A_sharpe": 0.0281, "A_sortino": 0.0283, "A_excess_sharpe": 0.4722, "A_return_pct": -4.8, "A_hit_rate": 50.43, "A_n": 115, "A_bh_sharpe": -0.4441, "A_bh_return_pct": -14.4, "A_psr": 0.5075, "A_ic": -0.0084, "B_sharpe": 2.2537, "B_sortino": 2.3578, "B_excess_sharpe": 2.5515, "B_return_pct": 110.46, "B_hit_rate": 57.89, "B_n": 115, "B_bh_sharpe": -0.2978, "B_bh_return_pct": -27.23, "B_psr": 0.9369, "B_ic": 0.1655, "D_sharpe": 0.0281, "D_sortino": 0.0283, "D_excess_sharpe": 0.4722, "D_return_pct": -4.8, "D_hit_rate": 50.43, "D_n": 115, "D_bh_sharpe": -0.4441, "D_bh_return_pct": -14.4, "D_psr": 0.5075, "D_ic": -0.0084, "sharpe": 0.0281, "sortino": 0.0283, "return_pct": -4.8, "equity": 952.0, "max_dd": 0.0, "win_rate": 50.43, "profit_factor": 0.0, "ic": -0.0084, "hit": 50.43, "psr": 0.5075, "bh_sharpe": -0.4441, "bh_return_pct": -14.4, "excess_sharpe": 0.4722, "precision": 0.4211, "recall": 0.1481, "f1": 0.2192, "f2": 0.1702, "accuracy": 0.5043, "mcc": -0.0432, "tp": 8, "fp": 11, "tn": 50, "fn": 46, "A_precision": 0.4211, "A_recall": 0.1481, "A_f1": 0.2192, "A_f2": 0.1702, "A_accuracy": 0.5043, "A_mcc": -0.0432, "A_tp": 8, "A_fp": 11, "A_tn": 50, "A_fn": 46}, {"fold": "fold_2", "regime": "2011 US-downgrade + EU debt", "n": 136, "A_sharpe": -0.6813, "A_sortino": -0.631, "A_excess_sharpe": -2.414, "A_return_pct": -8.35, "A_hit_rate": 51.85, "A_n": 136, "A_bh_sharpe": 1.7327, "A_bh_return_pct": 19.75, "A_psr": 0.3085, "A_ic": 0.0055, "B_sharpe": 4.5272, "B_sortino": 4.4355, "B_excess_sharpe": 0.4613, "B_return_pct": 175.4, "B_hit_rate": 67.65, "B_n": 136, "B_bh_sharpe": 4.0659, "B_bh_return_pct": 148.68, "B_psr": 0.9995, "B_ic": 0.1393, "D_sharpe": -0.6813, "D_sortino": -0.631, "D_excess_sharpe": -2.414, "D_return_pct": -8.35, "D_hit_rate": 51.85, "D_n": 136, "D_bh_sharpe": 1.7327, "D_bh_return_pct": 19.75, "D_psr": 0.3085, "D_ic": 0.0055, "sharpe": -0.6813, "sortino": -0.631, "return_pct": -8.35, "equity": 916.5, "max_dd": 0.0, "win_rate": 51.85, "profit_factor": 0.0, "ic": 0.0055, "hit": 51.85, "psr": 0.3085, "bh_sharpe": 1.7327, "bh_return_pct": 19.75, "excess_sharpe": -2.414, "precision": 0.589, "recall": 0.5513, "f1": 0.5695, "f2": 0.5584, "accuracy": 0.5221, "mcc": 0.0338, "tp": 43, "fp": 30, "tn": 28, "fn": 35, "A_precision": 0.589, "A_recall": 0.5513, "A_f1": 0.5695, "A_f2": 0.5584, "A_accuracy": 0.5221, "A_mcc": 0.0338, "A_tp": 43, "A_fp": 30, "A_tn": 28, "A_fn": 35}, {"fold": "fold_3", "regime": "Taper tantrum and 2014 H1", "n": 178, "A_sharpe": 1.2091, "A_sortino": 1.223, "A_excess_sharpe": -0.1355, "A_return_pct": 11.04, "A_hit_rate": 52.54, "A_n": 178, "A_bh_sharpe": 1.3445, "A_bh_return_pct": 12.41, "A_psr": 0.8434, "A_ic": 0.0596, "B_sharpe": 4.5554, "B_sortino": 5.2148, "B_excess_sharpe": 1.5071, "B_return_pct": 123.35, "B_hit_rate": 61.24, "B_n": 178, "B_bh_sharpe": 3.0483, "B_bh_return_pct": 71.83, "B_psr": 0.9999, "B_ic": 0.1228, "D_sharpe": 1.2091, "D_sortino": 1.223, "D_excess_sharpe": -0.1355, "D_return_pct": 11.04, "D_hit_rate": 52.54, "D_n": 178, "D_bh_sharpe": 1.3445, "D_bh_return_pct": 12.41, "D_psr": 0.8434, "D_ic": 0.0596, "sharpe": 1.2091, "sortino": 1.223, "return_pct": 11.04, "equity": 1110.4, "max_dd": 0.0, "win_rate": 52.54, "profit_factor": 0.0, "ic": 0.0596, "hit": 52.54, "psr": 0.8434, "bh_sharpe": 1.3445, "bh_return_pct": 12.41, "excess_sharpe": -0.1355, "precision": 0.5672, "recall": 0.7379, "f1": 0.6414, "f2": 0.696, "accuracy": 0.5225, "mcc": -0.0406, "tp": 76, "fp": 58, "tn": 17, "fn": 27, "A_precision": 0.5672, "A_recall": 0.7379, "A_f1": 0.6414, "A_f2": 0.696, "A_accuracy": 0.5225, "A_mcc": -0.0406, "A_tp": 76, "A_fp": 58, "A_tn": 17, "A_fn": 27}, {"fold": "fold_4", "regime": "China devaluation and oil crash", "n": 157, "A_sharpe": 0.3051, "A_sortino": 0.2795, "A_excess_sharpe": 0.2953, "A_return_pct": 2.54, "A_hit_rate": 55.13, "A_n": 157, "A_bh_sharpe": 0.0098, "A_bh_return_pct": -1.05, "A_psr": 0.5946, "A_ic": 0.0701, "B_sharpe": 2.1888, "B_sortino": 2.3255, "B_excess_sharpe": 2.1729, "B_return_pct": 70.54, "B_hit_rate": 54.14, "B_n": 157, "B_bh_sharpe": 0.0159, "B_bh_return_pct": -5.48, "B_psr": 0.9567, "B_ic": 0.0934, "D_sharpe": 0.3051, "D_sortino": 0.2795, "D_excess_sharpe": 0.2953, "D_return_pct": 2.54, "D_hit_rate": 55.13, "D_n": 157, "D_bh_sharpe": 0.0098, "D_bh_return_pct": -1.05, "D_psr": 0.5946, "D_ic": 0.0701, "sharpe": 0.3051, "sortino": 0.2795, "return_pct": 2.54, "equity": 1025.4, "max_dd": 0.0, "win_rate": 55.13, "profit_factor": 0.0, "ic": 0.0701, "hit": 55.13, "psr": 0.5946, "bh_sharpe": 0.0098, "bh_return_pct": -1.05, "excess_sharpe": 0.2953, "precision": 0.6078, "recall": 0.3827, "f1": 0.4697, "f2": 0.4133, "accuracy": 0.5541, "mcc": 0.1276, "tp": 31, "fp": 20, "tn": 56, "fn": 50, "A_precision": 0.6078, "A_recall": 0.3827, "A_f1": 0.4697, "A_f2": 0.4133, "A_accuracy": 0.5541, "A_mcc": 0.1276, "A_tp": 31, "A_fp": 20, "A_tn": 56, "A_fn": 50}, {"fold": "fold_5", "regime": "2018 Vol-mageddon + Q4 sell-off", "n": 177, "A_sharpe": 2.0993, "A_sortino": 2.5386, "A_excess_sharpe": 1.7895, "A_return_pct": 37.46, "A_hit_rate": 52.54, "A_n": 177, "A_bh_sharpe": 0.3098, "A_bh_return_pct": 3.19, "A_psr": 0.9663, "A_ic": 0.0981, "B_sharpe": -0.937, "B_sortino": -0.9374, "B_excess_sharpe": -1.8286, "B_return_pct": -31.64, "B_hit_rate": 45.45, "B_n": 177, "B_bh_sharpe": 0.8917, "B_bh_return_pct": 23.8, "B_psr": 0.2168, "B_ic": -0.1149, "D_sharpe": 2.0993, "D_sortino": 2.5386, "D_excess_sharpe": 1.7895, "D_return_pct": 37.46, "D_hit_rate": 52.54, "D_n": 177, "D_bh_sharpe": 0.3098, "D_bh_return_pct": 3.19, "D_psr": 0.9663, "D_ic": 0.0981, "sharpe": 2.0993, "sortino": 2.5386, "return_pct": 37.46, "equity": 1374.6000000000001, "max_dd": 0.0, "win_rate": 52.54, "profit_factor": 0.0, "ic": 0.0981, "hit": 52.54, "psr": 0.9663, "bh_sharpe": 0.3098, "bh_return_pct": 3.19, "excess_sharpe": 1.7895, "precision": 0.6667, "recall": 0.3689, "f1": 0.475, "f2": 0.4051, "accuracy": 0.5254, "mcc": 0.1184, "tp": 38, "fp": 19, "tn": 55, "fn": 65, "A_precision": 0.6667, "A_recall": 0.3689, "A_f1": 0.475, "A_f2": 0.4051, "A_accuracy": 0.5254, "A_mcc": 0.1184, "A_tp": 38, "A_fp": 19, "A_tn": 55, "A_fn": 65}, {"fold": "fold_6", "regime": "COVID crash and V-recovery", "n": 222, "A_sharpe": -0.3907, "A_sortino": -0.4072, "A_excess_sharpe": -1.2795, "A_return_pct": -17.64, "A_hit_rate": 44.59, "A_n": 222, "A_bh_sharpe": 0.8888, "A_bh_return_pct": 26.13, "A_psr": 0.3569, "A_ic": -0.0187, "B_sharpe": -3.2741, "B_sortino": -2.7685, "B_excess_sharpe": -5.6626, "B_return_pct": -88.87, "B_hit_rate": 45.25, "B_n": 222, "B_bh_sharpe": 2.3884, "B_bh_return_pct": 243.18, "B_psr": 0.0005, "B_ic": -0.0399, "D_sharpe": -0.3907, "D_sortino": -0.4072, "D_excess_sharpe": -1.2795, "D_return_pct": -17.64, "D_hit_rate": 44.59, "D_n": 222, "D_bh_sharpe": 0.8888, "D_bh_return_pct": 26.13, "D_psr": 0.3569, "D_ic": -0.0187, "sharpe": -0.3907, "sortino": -0.4072, "return_pct": -17.64, "equity": 823.6, "max_dd": 0.0, "win_rate": 44.59, "profit_factor": 0.0, "ic": -0.0187, "hit": 44.59, "psr": 0.3569, "bh_sharpe": 0.8888, "bh_return_pct": 26.13, "excess_sharpe": -1.2795, "precision": 0.7027, "recall": 0.1884, "f1": 0.2971, "f2": 0.2207, "accuracy": 0.4459, "mcc": 0.0748, "tp": 26, "fp": 11, "tn": 73, "fn": 112, "A_precision": 0.7027, "A_recall": 0.1884, "A_f1": 0.2971, "A_f2": 0.2207, "A_accuracy": 0.4459, "A_mcc": 0.0748, "A_tp": 26, "A_fp": 11, "A_tn": 73, "A_fn": 112}, {"fold": "fold_7", "regime": "Inflation bear, AI rally and 2025", "n": 425, "A_sharpe": -0.745, "A_sortino": -0.7616, "A_excess_sharpe": -1.7165, "A_return_pct": -26.86, "A_hit_rate": 44.0, "A_n": 425, "A_bh_sharpe": 0.9715, "A_bh_return_pct": 37.12, "A_psr": 0.1637, "A_ic": -0.0812, "B_sharpe": -2.1189, "B_sortino": -1.9925, "B_excess_sharpe": -4.6216, "B_return_pct": -83.25, "B_hit_rate": 44.58, "B_n": 425, "B_bh_sharpe": 2.5027, "B_bh_return_pct": 458.83, "B_psr": 0.0028, "B_ic": -0.1458, "D_sharpe": -0.745, "D_sortino": -0.7616, "D_excess_sharpe": -1.7165, "D_return_pct": -26.86, "D_hit_rate": 44.0, "D_n": 425, "D_bh_sharpe": 0.9715, "D_bh_return_pct": 37.12, "D_psr": 0.1637, "D_ic": -0.0812, "sharpe": -0.745, "sortino": -0.7616, "return_pct": -26.86, "equity": 731.4000000000001, "max_dd": 0.0, "win_rate": 44.0, "profit_factor": 0.0, "ic": -0.0812, "hit": 44.0, "psr": 0.1637, "bh_sharpe": 0.9715, "bh_return_pct": 37.12, "excess_sharpe": -1.7165, "precision": 0.5968, "recall": 0.148, "f1": 0.2372, "f2": 0.1742, "accuracy": 0.44, "mcc": 0.0072, "tp": 37, "fp": 25, "tn": 150, "fn": 213, "A_precision": 0.5968, "A_recall": 0.148, "A_f1": 0.2372, "A_f2": 0.1742, "A_accuracy": 0.44, "A_mcc": 0.0072, "A_tp": 37, "A_fp": 25, "A_tn": 150, "A_fn": 213}], "per_window_val": [{"fold": "fold_1", "regime": "GFC peak crash (Lehman + Mar-2009 bottom)", "n": 104, "A_sharpe": 0.4502, "A_sortino": 0.481, "A_excess_sharpe": 0.6174, "A_return_pct": 3.77, "A_hit_rate": 49.02, "A_n": 104, "A_bh_sharpe": -0.1672, "A_bh_return_pct": -3.81, "A_psr": 0.6141, "A_ic": 0.0054, "B_sharpe": -2.4805, "B_sortino": -2.1981, "B_excess_sharpe": -0.2064, "B_return_pct": -46.61, "B_hit_rate": 44.66, "B_n": 104, "B_bh_sharpe": -2.2741, "B_bh_return_pct": -44.12, "B_psr": 0.0486, "B_ic": -0.0109, "D_sharpe": 0.4502, "D_sortino": 0.481, "D_excess_sharpe": 0.6174, "D_return_pct": 3.77, "D_hit_rate": 49.02, "D_n": 104, "D_bh_sharpe": -0.1672, "D_bh_return_pct": -3.81, "D_psr": 0.6141, "D_ic": 0.0054, "sharpe": 0.4502, "sortino": 0.481, "return_pct": 3.77, "equity": 1037.7, "max_dd": 0.0, "win_rate": 49.02, "profit_factor": 0.0, "ic": 0.0054, "hit": 49.02, "psr": 0.6141, "bh_sharpe": -0.1672, "bh_return_pct": -3.81, "excess_sharpe": 0.6174}, {"fold": "fold_2", "regime": "2011 US-downgrade + EU debt", "n": 96, "A_sharpe": -0.2181, "A_sortino": -0.237, "A_excess_sharpe": 0.056, "A_return_pct": -3.53, "A_hit_rate": 45.26, "A_n": 96, "A_bh_sharpe": -0.2741, "A_bh_return_pct": -4.09, "A_psr": 0.4468, "A_ic": -0.0659, "B_sharpe": 1.0915, "B_sortino": 1.0419, "B_excess_sharpe": 2.1189, "B_return_pct": 19.34, "B_hit_rate": 54.17, "B_n": 96, "B_bh_sharpe": -1.0274, "B_bh_return_pct": -25.58, "B_psr": 0.7443, "B_ic": -0.0758, "D_sharpe": -0.2181, "D_sortino": -0.237, "D_excess_sharpe": 0.056, "D_return_pct": -3.53, "D_hit_rate": 45.26, "D_n": 96, "D_bh_sharpe": -0.2741, "D_bh_return_pct": -4.09, "D_psr": 0.4468, "D_ic": -0.0659, "sharpe": -0.2181, "sortino": -0.237, "return_pct": -3.53, "equity": 964.7, "max_dd": 0.0, "win_rate": 45.26, "profit_factor": 0.0, "ic": -0.0659, "hit": 45.26, "psr": 0.4468, "bh_sharpe": -0.2741, "bh_return_pct": -4.09, "excess_sharpe": 0.056}, {"fold": "fold_3", "regime": "Taper tantrum and 2014 H1", "n": 54, "A_sharpe": 2.1929, "A_sortino": 2.0988, "A_excess_sharpe": -2.5068, "A_return_pct": 4.85, "A_hit_rate": 57.41, "A_n": 54, "A_bh_sharpe": 4.6998, "A_bh_return_pct": 10.46, "A_psr": 0.8331, "A_ic": 0.0426, "B_sharpe": 4.6622, "B_sortino": 4.7677, "B_excess_sharpe": -4.3703, "B_return_pct": 25.26, "B_hit_rate": 62.96, "B_n": 54, "B_bh_sharpe": 9.0326, "B_bh_return_pct": 49.18, "B_psr": 0.9785, "B_ic": -0.0266, "D_sharpe": 2.1929, "D_sortino": 2.0988, "D_excess_sharpe": -2.5068, "D_return_pct": 4.85, "D_hit_rate": 57.41, "D_n": 54, "D_bh_sharpe": 4.6998, "D_bh_return_pct": 10.46, "D_psr": 0.8331, "D_ic": 0.0426, "sharpe": 2.1929, "sortino": 2.0988, "return_pct": 4.85, "equity": 1048.5, "max_dd": 0.0, "win_rate": 57.41, "profit_factor": 0.0, "ic": 0.0426, "hit": 57.41, "psr": 0.8331, "bh_sharpe": 4.6998, "bh_return_pct": 10.46, "excess_sharpe": -2.5068}, {"fold": "fold_4", "regime": "China devaluation and oil crash", "n": 96, "A_sharpe": 0.6647, "A_sortino": 0.7498, "A_excess_sharpe": 1.0889, "A_return_pct": 4.24, "A_hit_rate": 49.47, "A_n": 96, "A_bh_sharpe": -0.4241, "A_bh_return_pct": -3.73, "A_psr": 0.6607, "A_ic": -0.0077, "B_sharpe": -0.0654, "B_sortino": -0.056, "B_excess_sharpe": 1.1189, "B_return_pct": -4.95, "B_hit_rate": 52.08, "B_n": 96, "B_bh_sharpe": -1.1843, "B_bh_return_pct": -21.44, "B_psr": 0.4839, "B_ic": 0.1215, "D_sharpe": 0.6647, "D_sortino": 0.7498, "D_excess_sharpe": 1.0889, "D_return_pct": 4.24, "D_hit_rate": 49.47, "D_n": 96, "D_bh_sharpe": -0.4241, "D_bh_return_pct": -3.73, "D_psr": 0.6607, "D_ic": -0.0077, "sharpe": 0.6647, "sortino": 0.7498, "return_pct": 4.24, "equity": 1042.4, "max_dd": 0.0, "win_rate": 49.47, "profit_factor": 0.0, "ic": -0.0077, "hit": 49.47, "psr": 0.6607, "bh_sharpe": -0.4241, "bh_return_pct": -3.73, "excess_sharpe": 1.0889}, {"fold": "fold_5", "regime": "2018 Vol-mageddon + Q4 sell-off", "n": 54, "A_sharpe": -2.5395, "A_sortino": -2.1343, "A_excess_sharpe": -3.9675, "A_return_pct": -7.13, "A_hit_rate": 50.0, "A_n": 54, "A_bh_sharpe": 1.428, "A_bh_return_pct": 3.97, "A_psr": 0.1145, "A_ic": -0.1053, "B_sharpe": -4.79, "B_sortino": -4.1039, "B_excess_sharpe": -9.7221, "B_return_pct": -26.77, "B_hit_rate": 40.74, "B_n": 54, "B_bh_sharpe": 4.9322, "B_bh_return_pct": 34.93, "B_psr": 0.013, "B_ic": -0.4584, "D_sharpe": -2.5395, "D_sortino": -2.1343, "D_excess_sharpe": -3.9675, "D_return_pct": -7.13, "D_hit_rate": 50.0, "D_n": 54, "D_bh_sharpe": 1.428, "D_bh_return_pct": 3.97, "D_psr": 0.1145, "D_ic": -0.1053, "sharpe": -2.5395, "sortino": -2.1343, "return_pct": -7.13, "equity": 928.6999999999999, "max_dd": 0.0, "win_rate": 50.0, "profit_factor": 0.0, "ic": -0.1053, "hit": 50.0, "psr": 0.1145, "bh_sharpe": 1.428, "bh_return_pct": 3.97, "excess_sharpe": -3.9675}, {"fold": "fold_6", "regime": "COVID crash and V-recovery", "n": 75, "A_sharpe": 1.8864, "A_sortino": 2.105, "A_excess_sharpe": -2.4131, "A_return_pct": 6.27, "A_hit_rate": 52.0, "A_n": 75, "A_bh_sharpe": 4.2994, "A_bh_return_pct": 14.68, "A_psr": 0.8497, "A_ic": 0.0983, "B_sharpe": 8.0262, "B_sortino": 8.1517, "B_excess_sharpe": -6.3077, "B_return_pct": 69.58, "B_hit_rate": 72.0, "B_n": 75, "B_bh_sharpe": 14.3339, "B_bh_return_pct": 120.13, "B_psr": 1.0, "B_ic": 0.1568, "D_sharpe": 1.8864, "D_sortino": 2.105, "D_excess_sharpe": -2.4131, "D_return_pct": 6.27, "D_hit_rate": 52.0, "D_n": 75, "D_bh_sharpe": 4.2994, "D_bh_return_pct": 14.68, "D_psr": 0.8497, "D_ic": 0.0983, "sharpe": 1.8864, "sortino": 2.105, "return_pct": 6.27, "equity": 1062.7, "max_dd": 0.0, "win_rate": 52.0, "profit_factor": 0.0, "ic": 0.0983, "hit": 52.0, "psr": 0.8497, "bh_sharpe": 4.2994, "bh_return_pct": 14.68, "excess_sharpe": -2.4131}, {"fold": "fold_7", "regime": "Inflation bear, AI rally and 2025", "n": 114, "A_sharpe": 0.9067, "A_sortino": 0.9436, "A_excess_sharpe": -1.9383, "A_return_pct": 6.05, "A_hit_rate": 51.75, "A_n": 114, "A_bh_sharpe": 2.845, "A_bh_return_pct": 21.34, "A_psr": 0.7283, "A_ic": 0.1085, "B_sharpe": 1.7216, "B_sortino": 1.8085, "B_excess_sharpe": -4.4151, "B_return_pct": 29.43, "B_hit_rate": 57.02, "B_n": 114, "B_bh_sharpe": 6.1366, "B_bh_return_pct": 155.03, "B_psr": 0.8788, "B_ic": -0.0659, "D_sharpe": 0.9067, "D_sortino": 0.9436, "D_excess_sharpe": -1.9383, "D_return_pct": 6.05, "D_hit_rate": 51.75, "D_n": 114, "D_bh_sharpe": 2.845, "D_bh_return_pct": 21.34, "D_psr": 0.7283, "D_ic": 0.1085, "sharpe": 0.9067, "sortino": 0.9436, "return_pct": 6.05, "equity": 1060.5, "max_dd": 0.0, "win_rate": 51.75, "profit_factor": 0.0, "ic": 0.1085, "hit": 51.75, "psr": 0.7283, "bh_sharpe": 2.845, "bh_return_pct": 21.34, "excess_sharpe": -1.9383}], "status": "KEEP", "precision": 0.5982, "recall": 0.3209, "f1": 0.4177, "f2": 0.3537, "accuracy": 0.4879, "mcc": 0.0347, "tp": 259, "fp": 174, "tn": 429, "fn": 548, "test_sharpe": 0.0077, "A_sharpe": 0.0077, "A_excess_sharpe": -0.5966, "A_return_pct": -17.75, "A_precision": 0.5982, "A_recall": 0.3209, "A_f1": 0.4177, "A_f2": 0.3537, "A_accuracy": 0.4879, "A_mcc": 0.0347, "A_tp": 259, "A_fp": 174, "A_tn": 429, "A_fn": 548, "A_psr": 0.5072, "A_ic": -0.012, "A_hit_rate": 48.76, "A_bh_sharpe": 0.6042, "A_bh_return_pct": 103.49}
