{"experiment_num": 9, "backbone": "lightgbm", "description": "LightGBM @ FX-Exp235-lite n_est=300 (Ke 2017 NeurIPS); QQQ exp8 \u2014 first ensemble component", "config": {"seq_len": 60, "lr": 0.0003, "batch_size": 32, "epochs": 50, "weight_decay": 1e-05, "patience": 10, "warmup_epochs": 0, "head_dropout": 0.1, "huber_delta": 1.0, "grad_clip": 1.0, "seed": 42, "hidden_size": null, "num_layers": null, "max_depth": 4, "gbm_lr": 0.01, "n_estimators": 300}, "composite": -0.4727, "test_pos_folds": 5, "val_pos_folds": 4, "val_loss": null, "elapsed_sec": 611.7, "timestamp": "2026-04-26T15:20:41", "sharpe": 0.3189, "val_sharpe": -0.2727, "ic": 0.0084, "hit": 48.59, "psr": 0.7455, "equity": 1218.3999999999999, "return_pct": 21.84, "bh_sharpe": 1.2194, "bh_return_pct": 187.05, "excess_sharpe": -0.9005, "B_sharpe": 0.5082, "B_excess_sharpe": -2.32, "B_return_pct": 72.3, "D_sharpe": 0.1613, "D_excess_sharpe": -1.0581, "D_return_pct": 4.81, "per_window": [{"fold": "fold_1", "regime": "GFC peak crash (Lehman + Mar-2009 bottom)", "n": 66, "A_sharpe": 0.1615, "A_sortino": 0.1827, "A_excess_sharpe": -0.4106, "A_return_pct": -0.25, "A_hit_rate": 42.42, "A_n": 66, "A_bh_sharpe": 0.5721, "A_bh_return_pct": 3.85, "A_psr": 0.5327, "A_ic": -0.0623, "B_sharpe": 1.0198, "B_sortino": 1.1076, "B_excess_sharpe": -1.0271, "B_return_pct": 13.62, "B_hit_rate": 47.69, "B_n": 66, "B_bh_sharpe": 2.0469, "B_bh_return_pct": 39.28, "B_psr": 0.698, "B_ic": 0.3411, "D_sharpe": 0.7897, "D_sortino": 0.8576, "D_excess_sharpe": 0.2176, "D_return_pct": 6.08, "D_hit_rate": 46.97, "D_n": 66, "D_bh_sharpe": 0.5721, "D_bh_return_pct": 3.85, "D_psr": 0.656, "D_ic": 0.0817, "sharpe": 0.1615, "sortino": 0.1827, "return_pct": -0.25, "equity": 997.5, "max_dd": 0.0, "win_rate": 42.42, "profit_factor": 0.0, "ic": -0.0623, "hit": 42.42, "psr": 0.5327, "bh_sharpe": 0.5721, "bh_return_pct": 3.85, "excess_sharpe": -0.4106, "precision": 0.4483, "recall": 0.3714, "f1": 0.4062, "f2": 0.3846, "accuracy": 0.4242, "mcc": -0.1455, "tp": 13, "fp": 16, "tn": 15, "fn": 22, "A_precision": 0.4483, "A_recall": 0.3714, "A_f1": 0.4062, "A_f2": 0.3846, "A_accuracy": 0.4242, "A_mcc": -0.1455, "A_tp": 13, "A_fp": 16, "A_tn": 15, "A_fn": 22}, {"fold": "fold_2", "regime": "2011 US-downgrade + EU debt", "n": 87, "A_sharpe": 2.2744, "A_sortino": 2.9934, "A_excess_sharpe": -2.7476, "A_return_pct": 12.56, "A_hit_rate": 51.16, "A_n": 87, "A_bh_sharpe": 5.022, "A_bh_return_pct": 29.23, "A_psr": 0.9237, "A_ic": 0.0772, "B_sharpe": 10.4651, "B_sortino": 9.4401, "B_excess_sharpe": -0.6718, "B_return_pct": 172.98, "B_hit_rate": 81.61, "B_n": 87, "B_bh_sharpe": 11.1369, "B_bh_return_pct": 185.4, "B_psr": 1.0, "B_ic": 0.223, "D_sharpe": 4.8753, "D_sortino": 5.9795, "D_excess_sharpe": -0.1467, "D_return_pct": 28.33, "D_hit_rate": 63.95, "D_n": 87, "D_bh_sharpe": 5.022, "D_bh_return_pct": 29.23, "D_psr": 0.9993, "D_ic": 0.0775, "sharpe": 2.2744, "sortino": 2.9934, "return_pct": 12.56, "equity": 1125.6, "max_dd": 0.0, "win_rate": 51.16, "profit_factor": 0.0, "ic": 0.0772, "hit": 51.16, "psr": 0.9237, "bh_sharpe": 5.022, "bh_return_pct": 29.23, "excess_sharpe": -2.7476, "precision": 0.5968, "recall": 0.6852, "f1": 0.6379, "f2": 0.6655, "accuracy": 0.5172, "mcc": -0.0776, "tp": 37, "fp": 25, "tn": 8, "fn": 17, "A_precision": 0.5968, "A_recall": 0.6852, "A_f1": 0.6379, "A_f2": 0.6655, "A_accuracy": 0.5172, "A_mcc": -0.0776, "A_tp": 37, "A_fp": 25, "A_tn": 8, "A_fn": 17}, {"fold": "fold_3", "regime": "Taper tantrum and 2014 H1", "n": 129, "A_sharpe": 1.4047, "A_sortino": 1.2833, "A_excess_sharpe": -0.3631, "A_return_pct": 9.17, "A_hit_rate": 56.25, "A_n": 129, "A_bh_sharpe": 1.7678, "A_bh_return_pct": 11.76, "A_psr": 0.8335, "A_ic": 0.0598, "B_sharpe": 4.0536, "B_sortino": 4.086, "B_excess_sharpe": -0.1938, "B_return_pct": 60.56, "B_hit_rate": 62.02, "B_n": 129, "B_bh_sharpe": 4.2474, "B_bh_return_pct": 64.1, "B_psr": 0.9972, "B_ic": -0.0628, "D_sharpe": 1.598, "D_sortino": 1.3252, "D_excess_sharpe": -0.1698, "D_return_pct": 10.54, "D_hit_rate": 60.94, "D_n": 129, "D_bh_sharpe": 1.7678, "D_bh_return_pct": 11.76, "D_psr": 0.8597, "D_ic": 0.1002, "sharpe": 1.4047, "sortino": 1.2833, "return_pct": 9.17, "equity": 1091.6999999999998, "max_dd": 0.0, "win_rate": 56.25, "profit_factor": 0.0, "ic": 0.0598, "hit": 56.25, "psr": 0.8335, "bh_sharpe": 1.7678, "bh_return_pct": 11.76, "excess_sharpe": -0.3631, "precision": 0.5981, "recall": 0.8205, "f1": 0.6919, "f2": 0.7637, "accuracy": 0.5581, "mcc": -0.0294, "tp": 64, "fp": 43, "tn": 8, "fn": 14, "A_precision": 0.5981, "A_recall": 0.8205, "A_f1": 0.6919, "A_f2": 0.7637, "A_accuracy": 0.5581, "A_mcc": -0.0294, "A_tp": 64, "A_fp": 43, "A_tn": 8, "A_fn": 14}, {"fold": "fold_4", "regime": "China devaluation and oil crash", "n": 108, "A_sharpe": -2.4318, "A_sortino": -2.2708, "A_excess_sharpe": -1.742, "A_return_pct": -19.73, "A_hit_rate": 42.99, "A_n": 108, "A_bh_sharpe": -0.6898, "A_bh_return_pct": -6.71, "A_psr": 0.0549, "A_ic": -0.0663, "B_sharpe": -3.6816, "B_sortino": -3.2682, "B_excess_sharpe": -1.7241, "B_return_pct": -51.27, "B_hit_rate": 40.74, "B_n": 108, "B_bh_sharpe": -1.9575, "B_bh_return_pct": -33.56, "B_psr": 0.0065, "B_ic": -0.1847, "D_sharpe": -2.857, "D_sortino": -2.5812, "D_excess_sharpe": -2.1673, "D_return_pct": -22.55, "D_hit_rate": 42.99, "D_n": 108, "D_bh_sharpe": -0.6898, "D_bh_return_pct": -6.71, "D_psr": 0.0283, "D_ic": -0.0925, "sharpe": -2.4318, "sortino": -2.2708, "return_pct": -19.73, "equity": 802.6999999999999, "max_dd": 0.0, "win_rate": 42.99, "profit_factor": 0.0, "ic": -0.0663, "hit": 42.99, "psr": 0.0549, "bh_sharpe": -0.6898, "bh_return_pct": -6.71, "excess_sharpe": -1.742, "precision": 0.4333, "recall": 0.4906, "f1": 0.4602, "f2": 0.4779, "accuracy": 0.4352, "mcc": -0.1284, "tp": 26, "fp": 34, "tn": 21, "fn": 27, "A_precision": 0.4333, "A_recall": 0.4906, "A_f1": 0.4602, "A_f2": 0.4779, "A_accuracy": 0.4352, "A_mcc": -0.1284, "A_tp": 26, "A_fp": 34, "A_tn": 21, "A_fn": 27}, {"fold": "fold_5", "regime": "2018 Vol-mageddon + Q4 sell-off", "n": 128, "A_sharpe": -0.5342, "A_sortino": -0.5625, "A_excess_sharpe": -1.6853, "A_return_pct": -7.54, "A_hit_rate": 46.88, "A_n": 128, "A_bh_sharpe": 1.1511, "A_bh_return_pct": 13.19, "A_psr": 0.3534, "A_ic": -0.0675, "B_sharpe": -2.7778, "B_sortino": -2.578, "B_excess_sharpe": -5.5897, "B_return_pct": -50.54, "B_hit_rate": 41.73, "B_n": 128, "B_bh_sharpe": 2.8119, "B_bh_return_pct": 82.25, "B_psr": 0.0227, "B_ic": -0.1333, "D_sharpe": -0.8502, "D_sortino": -0.9242, "D_excess_sharpe": -2.0013, "D_return_pct": -10.97, "D_hit_rate": 44.53, "D_n": 128, "D_bh_sharpe": 1.1511, "D_bh_return_pct": 13.19, "D_psr": 0.2766, "D_ic": -0.0873, "sharpe": -0.5342, "sortino": -0.5625, "return_pct": -7.54, "equity": 924.6, "max_dd": 0.0, "win_rate": 46.88, "profit_factor": 0.0, "ic": -0.0675, "hit": 46.88, "psr": 0.3534, "bh_sharpe": 1.1511, "bh_return_pct": 13.19, "excess_sharpe": -1.6853, "precision": 0.5676, "recall": 0.5385, "f1": 0.5526, "f2": 0.544, "accuracy": 0.4688, "mcc": -0.1003, "tp": 42, "fp": 32, "tn": 18, "fn": 36, "A_precision": 0.5676, "A_recall": 0.5385, "A_f1": 0.5526, "A_f2": 0.544, "A_accuracy": 0.4688, "A_mcc": -0.1003, "A_tp": 42, "A_fp": 32, "A_tn": 18, "A_fn": 36}, {"fold": "fold_6", "regime": "COVID crash and V-recovery", "n": 173, "A_sharpe": 1.2196, "A_sortino": 1.4084, "A_excess_sharpe": -1.1065, "A_return_pct": 20.03, "A_hit_rate": 47.4, "A_n": 173, "A_bh_sharpe": 2.3261, "A_bh_return_pct": 43.81, "A_psr": 0.8454, "A_ic": 0.1293, "B_sharpe": 0.8778, "B_sortino": 1.0085, "B_excess_sharpe": -4.8682, "B_return_pct": 24.34, "B_hit_rate": 49.42, "B_n": 173, "B_bh_sharpe": 5.746, "B_bh_return_pct": 499.04, "B_psr": 0.7693, "B_ic": 0.0661, "D_sharpe": -0.1966, "D_sortino": -0.2202, "D_excess_sharpe": -2.5227, "D_return_pct": -5.16, "D_hit_rate": 42.77, "D_n": 173, "D_bh_sharpe": 2.3261, "D_bh_return_pct": 43.81, "D_psr": 0.4356, "D_ic": -0.0126, "sharpe": 1.2196, "sortino": 1.4084, "return_pct": 20.03, "equity": 1200.3, "max_dd": 0.0, "win_rate": 47.4, "profit_factor": 0.0, "ic": 0.1293, "hit": 47.4, "psr": 0.8454, "bh_sharpe": 2.3261, "bh_return_pct": 43.81, "excess_sharpe": -1.1065, "precision": 0.6667, "recall": 0.3894, "f1": 0.4916, "f2": 0.4247, "accuracy": 0.474, "mcc": 0.0223, "tp": 44, "fp": 22, "tn": 38, "fn": 69, "A_precision": 0.6667, "A_recall": 0.3894, "A_f1": 0.4916, "A_f2": 0.4247, "A_accuracy": 0.474, "A_mcc": 0.0223, "A_tp": 44, "A_fp": 22, "A_tn": 38, "A_fn": 69}, {"fold": "fold_7", "regime": "Inflation bear, AI rally and 2025", "n": 376, "A_sharpe": 0.438, "A_sortino": 0.5049, "A_excess_sharpe": -0.3653, "A_return_pct": 11.58, "A_hit_rate": 49.2, "A_n": 376, "A_bh_sharpe": 0.8033, "A_bh_return_pct": 26.02, "A_psr": 0.7073, "A_ic": 0.0323, "B_sharpe": 0.438, "B_sortino": 0.4978, "B_excess_sharpe": -1.4937, "B_return_pct": 15.48, "B_hit_rate": 45.87, "B_n": 376, "B_bh_sharpe": 1.9317, "B_bh_return_pct": 222.05, "B_psr": 0.7046, "B_ic": 0.0116, "D_sharpe": 0.2985, "D_sortino": 0.3956, "D_excess_sharpe": -0.5048, "D_return_pct": 6.51, "D_hit_rate": 42.82, "D_n": 376, "D_bh_sharpe": 0.8033, "D_bh_return_pct": 26.02, "D_psr": 0.6447, "D_ic": -0.0207, "sharpe": 0.438, "sortino": 0.5049, "return_pct": 11.58, "equity": 1115.8, "max_dd": 0.0, "win_rate": 49.2, "profit_factor": 0.0, "ic": 0.0323, "hit": 49.2, "psr": 0.7073, "bh_sharpe": 0.8033, "bh_return_pct": 26.02, "excess_sharpe": -0.3653, "precision": 0.6442, "recall": 0.3032, "f1": 0.4123, "f2": 0.3391, "accuracy": 0.492, "mcc": 0.0709, "tp": 67, "fp": 37, "tn": 118, "fn": 154, "A_precision": 0.6442, "A_recall": 0.3032, "A_f1": 0.4123, "A_f2": 0.3391, "A_accuracy": 0.492, "A_mcc": 0.0709, "A_tp": 67, "A_fp": 37, "A_tn": 118, "A_fn": 154}], "per_window_val": [{"fold": "fold_1", "regime": "GFC peak crash (Lehman + Mar-2009 bottom)", "n": 65, "A_sharpe": -1.0378, "A_sortino": -0.9284, "A_excess_sharpe": 1.1878, "A_return_pct": -10.01, "A_hit_rate": 47.62, "A_n": 65, "A_bh_sharpe": -2.2257, "A_bh_return_pct": -18.74, "A_psr": 0.2958, "A_ic": 0.1074, "B_sharpe": -5.3863, "B_sortino": -4.5118, "B_excess_sharpe": 1.736, "B_return_pct": -64.86, "B_hit_rate": 38.46, "B_n": 65, "B_bh_sharpe": -7.1223, "B_bh_return_pct": -73.11, "B_psr": 0.0021, "B_ic": 0.4504, "D_sharpe": -1.2517, "D_sortino": -1.0657, "D_excess_sharpe": 0.974, "D_return_pct": -11.66, "D_hit_rate": 49.21, "D_n": 65, "D_bh_sharpe": -2.2257, "D_bh_return_pct": -18.74, "D_psr": 0.2558, "D_ic": 0.3276, "sharpe": -1.0378, "sortino": -0.9284, "return_pct": -10.01, "equity": 899.9, "max_dd": 0.0, "win_rate": 47.62, "profit_factor": 0.0, "ic": 0.1074, "hit": 47.62, "psr": 0.2958, "bh_sharpe": -2.2257, "bh_return_pct": -18.74, "excess_sharpe": 1.1878}, {"fold": "fold_2", "regime": "2011 US-downgrade + EU debt", "n": 47, "A_sharpe": 0.2005, "A_sortino": 0.1734, "A_excess_sharpe": 0.3946, "A_return_pct": 0.16, "A_hit_rate": 57.45, "A_n": 47, "A_bh_sharpe": -0.1941, "A_bh_return_pct": -2.36, "A_psr": 0.534, "A_ic": 0.1419, "B_sharpe": 0.4681, "B_sortino": 0.417, "B_excess_sharpe": 2.0805, "B_return_pct": 1.2, "B_hit_rate": 55.32, "B_n": 47, "B_bh_sharpe": -1.6123, "B_bh_return_pct": -24.3, "B_psr": 0.5786, "B_ic": 0.2307, "D_sharpe": 2.0551, "D_sortino": 1.8483, "D_excess_sharpe": 2.2492, "D_return_pct": 12.83, "D_hit_rate": 61.7, "D_n": 47, "D_bh_sharpe": -0.1941, "D_bh_return_pct": -2.36, "D_psr": 0.8031, "D_ic": 0.0145, "sharpe": 0.2005, "sortino": 0.1734, "return_pct": 0.16, "equity": 1001.6, "max_dd": 0.0, "win_rate": 57.45, "profit_factor": 0.0, "ic": 0.1419, "hit": 57.45, "psr": 0.534, "bh_sharpe": -0.1941, "bh_return_pct": -2.36, "excess_sharpe": 0.3946}, {"fold": "fold_3", "regime": "Taper tantrum and 2014 H1", "n": 5, "A_sharpe": 0.4387, "A_sortino": 0.5303, "A_excess_sharpe": 1.7581, "A_return_pct": 0.06, "A_hit_rate": 40.0, "A_n": 5, "A_bh_sharpe": -1.3194, "A_bh_return_pct": -0.21, "A_psr": 0.5221, "A_ic": 0.3, "B_sharpe": -18.6944, "B_sortino": -10.8783, "B_excess_sharpe": 7.1762, "B_return_pct": -3.45, "B_hit_rate": 20.0, "B_n": 5, "B_bh_sharpe": -25.8705, "B_bh_return_pct": -3.84, "B_psr": 0.0009, "B_ic": -0.5, "D_sharpe": -5.9118, "D_sortino": -6.1066, "D_excess_sharpe": -4.5924, "D_return_pct": -0.87, "D_hit_rate": 20.0, "D_n": 5, "D_bh_sharpe": -1.3194, "D_bh_return_pct": -0.21, "D_psr": 0.241, "D_ic": -0.5, "sharpe": 0.4387, "sortino": 0.5303, "return_pct": 0.06, "equity": 1000.5999999999999, "max_dd": 0.0, "win_rate": 40.0, "profit_factor": 0.0, "ic": 0.3, "hit": 40.0, "psr": 0.5221, "bh_sharpe": -1.3194, "bh_return_pct": -0.21, "excess_sharpe": 1.7581}, {"fold": "fold_4", "regime": "China devaluation and oil crash", "n": 47, "A_sharpe": -1.8238, "A_sortino": -1.7153, "A_excess_sharpe": 0.0, "A_return_pct": -8.68, "A_hit_rate": 44.68, "A_n": 47, "A_bh_sharpe": -1.8238, "A_bh_return_pct": -8.68, "A_psr": 0.2173, "A_ic": 0.0168, "B_sharpe": -0.2581, "B_sortino": -0.2319, "B_excess_sharpe": 1.9619, "B_return_pct": -5.97, "B_hit_rate": 48.94, "B_n": 47, "B_bh_sharpe": -2.22, "B_bh_return_pct": -23.98, "B_psr": 0.4557, "B_ic": 0.5953, "D_sharpe": -2.254, "D_sortino": -2.1818, "D_excess_sharpe": -0.4302, "D_return_pct": -10.46, "D_hit_rate": 40.43, "D_n": 47, "D_bh_sharpe": -1.8238, "D_bh_return_pct": -8.68, "D_psr": 0.1685, "D_ic": 0.1096, "sharpe": -1.8238, "sortino": -1.7153, "return_pct": -8.68, "equity": 913.2, "max_dd": 0.0, "win_rate": 44.68, "profit_factor": 0.0, "ic": 0.0168, "hit": 44.68, "psr": 0.2173, "bh_sharpe": -1.8238, "bh_return_pct": -8.68, "excess_sharpe": 0.0}, {"fold": "fold_5", "regime": "2018 Vol-mageddon + Q4 sell-off", "n": 5, "A_sharpe": -10.1368, "A_sortino": -6.9937, "A_excess_sharpe": 0.0, "A_return_pct": -3.15, "A_hit_rate": 40.0, "A_n": 5, "A_bh_sharpe": -10.1368, "A_bh_return_pct": -3.15, "A_psr": 0.0985, "A_ic": -0.4, "B_sharpe": 5.6858, "B_sortino": 6.0578, "B_excess_sharpe": 0.0, "B_return_pct": 4.22, "B_hit_rate": 60.0, "B_n": 5, "B_bh_sharpe": 5.6858, "B_bh_return_pct": 4.22, "B_psr": 0.753, "B_ic": 0.9, "D_sharpe": -10.1368, "D_sortino": -6.9937, "D_excess_sharpe": 0.0, "D_return_pct": -3.15, "D_hit_rate": 40.0, "D_n": 5, "D_bh_sharpe": -10.1368, "D_bh_return_pct": -3.15, "D_psr": 0.0985, "D_ic": 0.7, "sharpe": -10.1368, "sortino": -6.9937, "return_pct": -3.15, "equity": 968.5, "max_dd": 0.0, "win_rate": 40.0, "profit_factor": 0.0, "ic": -0.4, "hit": 40.0, "psr": 0.0985, "bh_sharpe": -10.1368, "bh_return_pct": -3.15, "excess_sharpe": 0.0}, {"fold": "fold_6", "regime": "COVID crash and V-recovery", "n": 26, "A_sharpe": 3.3248, "A_sortino": 3.7908, "A_excess_sharpe": 0.0397, "A_return_pct": 4.88, "A_hit_rate": 53.85, "A_n": 26, "A_bh_sharpe": 3.2852, "A_bh_return_pct": 4.82, "A_psr": 0.8529, "A_ic": 0.0708, "B_sharpe": 7.2458, "B_sortino": 7.9821, "B_excess_sharpe": -5.7334, "B_return_pct": 23.75, "B_hit_rate": 69.23, "B_n": 26, "B_bh_sharpe": 12.9792, "B_bh_return_pct": 38.76, "B_psr": 0.9875, "B_ic": 0.2862, "D_sharpe": -0.0265, "D_sortino": -0.0259, "D_excess_sharpe": -3.3116, "D_return_pct": -0.15, "D_hit_rate": 50.0, "D_n": 26, "D_bh_sharpe": 3.2852, "D_bh_return_pct": 4.82, "D_psr": 0.4967, "D_ic": 0.1494, "sharpe": 3.3248, "sortino": 3.7908, "return_pct": 4.88, "equity": 1048.8, "max_dd": 0.0, "win_rate": 53.85, "profit_factor": 0.0, "ic": 0.0708, "hit": 53.85, "psr": 0.8529, "bh_sharpe": 3.2852, "bh_return_pct": 4.82, "excess_sharpe": 0.0397}, {"fold": "fold_7", "regime": "Inflation bear, AI rally and 2025", "n": 65, "A_sharpe": 1.7764, "A_sortino": 2.0022, "A_excess_sharpe": -0.3025, "A_return_pct": 6.91, "A_hit_rate": 53.85, "A_n": 65, "A_bh_sharpe": 2.0789, "A_bh_return_pct": 8.17, "A_psr": 0.82, "A_ic": 0.0488, "B_sharpe": -3.3227, "B_sortino": -3.1579, "B_excess_sharpe": -8.5541, "B_return_pct": -22.88, "B_hit_rate": 40.0, "B_n": 65, "B_bh_sharpe": 5.2314, "B_bh_return_pct": 44.53, "B_psr": 0.05, "B_ic": 0.0743, "D_sharpe": -0.3647, "D_sortino": -0.3275, "D_excess_sharpe": -2.4436, "D_return_pct": -1.73, "D_hit_rate": 53.85, "D_n": 65, "D_bh_sharpe": 2.0789, "D_bh_return_pct": 8.17, "D_psr": 0.4268, "D_ic": 0.1562, "sharpe": 1.7764, "sortino": 2.0022, "return_pct": 6.91, "equity": 1069.1, "max_dd": 0.0, "win_rate": 53.85, "profit_factor": 0.0, "ic": 0.0488, "hit": 53.85, "psr": 0.82, "bh_sharpe": 2.0789, "bh_return_pct": 8.17, "excess_sharpe": -0.3025}], "status": "DISCARD", "precision": 0.5837, "recall": 0.4636, "f1": 0.5168, "f2": 0.4835, "accuracy": 0.4864, "mcc": -0.0166, "tp": 293, "fp": 209, "tn": 226, "fn": 339, "test_sharpe": 0.3189, "A_sharpe": 0.3189, "A_excess_sharpe": -0.9005, "A_return_pct": 21.84, "A_precision": 0.5837, "A_recall": 0.4636, "A_f1": 0.5168, "A_f2": 0.4835, "A_accuracy": 0.4864, "A_mcc": -0.0166, "A_tp": 293, "A_fp": 209, "A_tn": 226, "A_fn": 339, "A_psr": 0.7455, "A_ic": 0.0084, "A_hit_rate": 48.59, "A_bh_sharpe": 1.2194, "A_bh_return_pct": 187.05}
