{"experiment_num": 68, "backbone": "mlp", "description": "MLP @ exp 6 hidden_size=256 (up from 128 default) - FX paper section 4.6 architectural axis untested on QQQ", "config": {"seq_len": 10, "lr": 0.0003, "batch_size": 32, "epochs": 50, "weight_decay": 1e-05, "patience": 10, "warmup_epochs": 0, "head_dropout": 0.25, "huber_delta": 1.0, "grad_clip": 1.0, "seed": 0, "hidden_size": 256, "num_layers": null, "max_depth": null, "gbm_lr": null, "n_estimators": null}, "composite": -0.4536, "test_pos_folds": 5, "val_pos_folds": 4, "val_loss": -2.8918818217304865, "elapsed_sec": 27.2, "timestamp": "2026-04-27T22:58:55", "sharpe": 0.2854, "val_sharpe": -0.2536, "ic": 0.0052, "hit": 54.09, "psr": 0.7497, "equity": 1254.5, "return_pct": 25.45, "bh_sharpe": 0.6042, "bh_return_pct": 103.49, "excess_sharpe": -0.3188, "B_sharpe": 0.6047, "B_excess_sharpe": -1.0961, "B_return_pct": 172.31, "D_sharpe": 0.2854, "D_excess_sharpe": -0.3188, "D_return_pct": 25.45, "precision": 0.5708, "recall": 0.7893, "f1": 0.6625, "f2": 0.7332, "mcc": -0.0061, "accuracy": 0.5397, "val_precision": 0.5434, "val_recall": 0.7416, "val_f1": 0.6272, "val_f2": 0.6912, "val_mcc": -0.0404, "val_accuracy": 0.511, "per_window": [{"fold": "fold_1", "regime": "GFC peak crash (Lehman + Mar-2009 bottom)", "n": 115, "A_sharpe": 0.1431, "A_sortino": 0.1449, "A_excess_sharpe": 0.5872, "A_return_pct": -2.31, "A_hit_rate": 49.57, "A_n": 115, "A_bh_sharpe": -0.4441, "A_bh_return_pct": -14.4, "A_psr": 0.5383, "A_ic": 0.0382, "A_precision": 0.4818, "A_recall": 0.9815, "A_f1": 0.6463, "A_f2": 0.8129, "A_accuracy": 0.4957, "A_mcc": 0.1152, "A_tp": 53, "A_fp": 57, "A_tn": 4, "A_fn": 1, "B_sharpe": 3.3863, "B_sortino": 3.3803, "B_excess_sharpe": 3.6841, "B_return_pct": 230.03, "B_hit_rate": 61.4, "B_n": 115, "B_bh_sharpe": -0.2978, "B_bh_return_pct": -27.23, "B_psr": 0.9863, "B_ic": 0.2968, "B_precision": 0.5778, "B_recall": 0.8814, "B_f1": 0.698, "B_f2": 0.7975, "B_accuracy": 0.6087, "B_mcc": 0.2457, "B_tp": 52, "B_fp": 38, "B_tn": 18, "B_fn": 7, "D_sharpe": 0.1431, "D_sortino": 0.1449, "D_excess_sharpe": 0.5872, "D_return_pct": -2.31, "D_hit_rate": 49.57, "D_n": 115, "D_bh_sharpe": -0.4441, "D_bh_return_pct": -14.4, "D_psr": 0.5383, "D_ic": 0.0382, "D_precision": 0.4818, "D_recall": 0.9815, "D_f1": 0.6463, "D_f2": 0.8129, "D_accuracy": 0.4957, "D_mcc": 0.1152, "D_tp": 53, "D_fp": 57, "D_tn": 4, "D_fn": 1, "sharpe": 0.1431, "sortino": 0.1449, "return_pct": -2.31, "equity": 976.9, "max_dd": 0.0, "win_rate": 49.57, "profit_factor": 0.0, "ic": 0.0382, "hit": 49.57, "psr": 0.5383, "bh_sharpe": -0.4441, "bh_return_pct": -14.4, "excess_sharpe": 0.5872, "precision": 0.4818, "recall": 0.9815, "f1": 0.6463, "f2": 0.8129, "mcc": 0.1152, "accuracy": 0.4957, "tp": 53, "fp": 57, "tn": 4, "fn": 1}, {"fold": "fold_2", "regime": "2011 US-downgrade + EU debt", "n": 136, "A_sharpe": 1.82, "A_sortino": 1.9234, "A_excess_sharpe": 0.0872, "A_return_pct": 20.9, "A_hit_rate": 54.81, "A_n": 136, "A_bh_sharpe": 1.7327, "A_bh_return_pct": 19.75, "A_psr": 0.9105, "A_ic": -0.0237, "A_precision": 0.5727, "A_recall": 0.8077, "A_f1": 0.6702, "A_f2": 0.7464, "A_accuracy": 0.5441, "A_mcc": -0.0033, "A_tp": 63, "A_fp": 47, "A_tn": 11, "A_fn": 15, "B_sharpe": 3.4181, "B_sortino": 2.9286, "B_excess_sharpe": -0.6478, "B_return_pct": 114.77, "B_hit_rate": 69.85, "B_n": 136, "B_bh_sharpe": 4.0659, "B_bh_return_pct": 148.68, "B_psr": 0.9925, "B_ic": 0.0022, "B_precision": 0.7477, "B_recall": 0.8646, "B_f1": 0.8019, "B_f2": 0.8384, "B_accuracy": 0.6985, "B_mcc": 0.1936, "B_tp": 83, "B_fp": 28, "B_tn": 12, "B_fn": 13, "D_sharpe": 1.82, "D_sortino": 1.9234, "D_excess_sharpe": 0.0872, "D_return_pct": 20.9, "D_hit_rate": 54.81, "D_n": 136, "D_bh_sharpe": 1.7327, "D_bh_return_pct": 19.75, "D_psr": 0.9105, "D_ic": -0.0237, "D_precision": 0.5727, "D_recall": 0.8077, "D_f1": 0.6702, "D_f2": 0.7464, "D_accuracy": 0.5441, "D_mcc": -0.0033, "D_tp": 63, "D_fp": 47, "D_tn": 11, "D_fn": 15, "sharpe": 1.82, "sortino": 1.9234, "return_pct": 20.9, "equity": 1209.0, "max_dd": 0.0, "win_rate": 54.81, "profit_factor": 0.0, "ic": -0.0237, "hit": 54.81, "psr": 0.9105, "bh_sharpe": 1.7327, "bh_return_pct": 19.75, "excess_sharpe": 0.0872, "precision": 0.5727, "recall": 0.8077, "f1": 0.6702, "f2": 0.7464, "mcc": -0.0033, "accuracy": 0.5441, "tp": 63, "fp": 47, "tn": 11, "fn": 15}, {"fold": "fold_3", "regime": "Taper tantrum and 2014 H1", "n": 178, "A_sharpe": 0.3087, "A_sortino": 0.2725, "A_excess_sharpe": -1.0358, "A_return_pct": 2.26, "A_hit_rate": 54.8, "A_n": 178, "A_bh_sharpe": 1.3445, "A_bh_return_pct": 12.41, "A_psr": 0.6014, "A_ic": 0.1485, "A_precision": 0.5753, "A_recall": 0.8155, "A_f1": 0.6747, "A_f2": 0.7527, "A_accuracy": 0.5449, "A_mcc": -0.0143, "A_tp": 84, "A_fp": 62, "A_tn": 13, "A_fn": 19, "B_sharpe": 4.1917, "B_sortino": 4.3965, "B_excess_sharpe": 1.1433, "B_return_pct": 109.98, "B_hit_rate": 63.48, "B_n": 178, "B_bh_sharpe": 3.0483, "B_bh_return_pct": 71.83, "B_psr": 0.9998, "B_ic": 0.0955, "B_precision": 0.6507, "B_recall": 0.8716, "B_f1": 0.7451, "B_f2": 0.8162, "B_accuracy": 0.6348, "B_mcc": 0.168, "B_tp": 95, "B_fp": 51, "B_tn": 18, "B_fn": 14, "D_sharpe": 0.3087, "D_sortino": 0.2725, "D_excess_sharpe": -1.0358, "D_return_pct": 2.26, "D_hit_rate": 54.8, "D_n": 178, "D_bh_sharpe": 1.3445, "D_bh_return_pct": 12.41, "D_psr": 0.6014, "D_ic": 0.1485, "D_precision": 0.5753, "D_recall": 0.8155, "D_f1": 0.6747, "D_f2": 0.7527, "D_accuracy": 0.5449, "D_mcc": -0.0143, "D_tp": 84, "D_fp": 62, "D_tn": 13, "D_fn": 19, "sharpe": 0.3087, "sortino": 0.2725, "return_pct": 2.26, "equity": 1022.5999999999999, "max_dd": 0.0, "win_rate": 54.8, "profit_factor": 0.0, "ic": 0.1485, "hit": 54.8, "psr": 0.6014, "bh_sharpe": 1.3445, "bh_return_pct": 12.41, "excess_sharpe": -1.0358, "precision": 0.5753, "recall": 0.8155, "f1": 0.6747, "f2": 0.7527, "mcc": -0.0143, "accuracy": 0.5449, "tp": 84, "fp": 62, "tn": 13, "fn": 19}, {"fold": "fold_4", "regime": "China devaluation and oil crash", "n": 157, "A_sharpe": 1.3807, "A_sortino": 1.3714, "A_excess_sharpe": 1.3709, "A_return_pct": 16.72, "A_hit_rate": 54.49, "A_n": 157, "A_bh_sharpe": 0.0098, "A_bh_return_pct": -1.05, "A_psr": 0.859, "A_ic": 0.1583, "A_precision": 0.5366, "A_recall": 0.8148, "A_f1": 0.6471, "A_f2": 0.7383, "A_accuracy": 0.5414, "A_mcc": 0.0786, "A_tp": 66, "A_fp": 57, "A_tn": 19, "A_fn": 15, "B_sharpe": 1.5719, "B_sortino": 1.5511, "B_excess_sharpe": 1.556, "B_return_pct": 44.5, "B_hit_rate": 55.41, "B_n": 157, "B_bh_sharpe": 0.0159, "B_bh_return_pct": -5.48, "B_psr": 0.8894, "B_ic": 0.0859, "B_precision": 0.5664, "B_recall": 0.7529, "B_f1": 0.6465, "B_f2": 0.7064, "B_accuracy": 0.5541, "B_mcc": 0.0803, "B_tp": 64, "B_fp": 49, "B_tn": 23, "B_fn": 21, "D_sharpe": 1.3807, "D_sortino": 1.3714, "D_excess_sharpe": 1.3709, "D_return_pct": 16.72, "D_hit_rate": 54.49, "D_n": 157, "D_bh_sharpe": 0.0098, "D_bh_return_pct": -1.05, "D_psr": 0.859, "D_ic": 0.1583, "D_precision": 0.5366, "D_recall": 0.8148, "D_f1": 0.6471, "D_f2": 0.7383, "D_accuracy": 0.5414, "D_mcc": 0.0786, "D_tp": 66, "D_fp": 57, "D_tn": 19, "D_fn": 15, "sharpe": 1.3807, "sortino": 1.3714, "return_pct": 16.72, "equity": 1167.2, "max_dd": 0.0, "win_rate": 54.49, "profit_factor": 0.0, "ic": 0.1583, "hit": 54.49, "psr": 0.859, "bh_sharpe": 0.0098, "bh_return_pct": -1.05, "excess_sharpe": 1.3709, "precision": 0.5366, "recall": 0.8148, "f1": 0.6471, "f2": 0.7383, "mcc": 0.0786, "accuracy": 0.5414, "tp": 66, "fp": 57, "tn": 19, "fn": 15}, {"fold": "fold_5", "regime": "2018 Vol-mageddon + Q4 sell-off", "n": 177, "A_sharpe": -0.0374, "A_sortino": -0.0331, "A_excess_sharpe": -0.3472, "A_return_pct": -2.44, "A_hit_rate": 58.19, "A_n": 177, "A_bh_sharpe": 0.3098, "A_bh_return_pct": 3.19, "A_psr": 0.4875, "A_ic": 0.0232, "A_precision": 0.596, "A_recall": 0.8738, "A_f1": 0.7087, "A_f2": 0.7993, "A_accuracy": 0.5819, "A_mcc": 0.0689, "A_tp": 90, "A_fp": 61, "A_tn": 13, "A_fn": 13, "B_sharpe": 0.1162, "B_sortino": 0.1025, "B_excess_sharpe": -0.7755, "B_return_pct": -3.78, "B_hit_rate": 55.11, "B_n": 177, "B_bh_sharpe": 0.8917, "B_bh_return_pct": 23.8, "B_psr": 0.5386, "B_ic": -0.028, "B_precision": 0.6107, "B_recall": 0.7339, "B_f1": 0.6667, "B_f2": 0.7055, "B_accuracy": 0.548, "B_mcc": -0.0178, "B_tp": 80, "B_fp": 51, "B_tn": 17, "B_fn": 29, "D_sharpe": -0.0374, "D_sortino": -0.0331, "D_excess_sharpe": -0.3472, "D_return_pct": -2.44, "D_hit_rate": 58.19, "D_n": 177, "D_bh_sharpe": 0.3098, "D_bh_return_pct": 3.19, "D_psr": 0.4875, "D_ic": 0.0232, "D_precision": 0.596, "D_recall": 0.8738, "D_f1": 0.7087, "D_f2": 0.7993, "D_accuracy": 0.5819, "D_mcc": 0.0689, "D_tp": 90, "D_fp": 61, "D_tn": 13, "D_fn": 13, "sharpe": -0.0374, "sortino": -0.0331, "return_pct": -2.44, "equity": 975.6, "max_dd": 0.0, "win_rate": 58.19, "profit_factor": 0.0, "ic": 0.0232, "hit": 58.19, "psr": 0.4875, "bh_sharpe": 0.3098, "bh_return_pct": 3.19, "excess_sharpe": -0.3472, "precision": 0.596, "recall": 0.8738, "f1": 0.7087, "f2": 0.7993, "mcc": 0.0689, "accuracy": 0.5819, "tp": 90, "fp": 61, "tn": 13, "fn": 13}, {"fold": "fold_6", "regime": "COVID crash and V-recovery", "n": 222, "A_sharpe": 0.2389, "A_sortino": 0.2178, "A_excess_sharpe": -0.6499, "A_return_pct": 1.59, "A_hit_rate": 55.41, "A_n": 222, "A_bh_sharpe": 0.8888, "A_bh_return_pct": 26.13, "A_psr": 0.5881, "A_ic": 0.0185, "A_precision": 0.6309, "A_recall": 0.6812, "A_f1": 0.6551, "A_f2": 0.6705, "A_accuracy": 0.5541, "A_mcc": 0.0273, "A_tp": 94, "A_fp": 55, "A_tn": 29, "A_fn": 44, "B_sharpe": -1.9343, "B_sortino": -1.7893, "B_excess_sharpe": -4.3227, "B_return_pct": -75.36, "B_hit_rate": 45.7, "B_n": 222, "B_bh_sharpe": 2.3884, "B_bh_return_pct": 243.18, "B_psr": 0.033, "B_ic": -0.042, "B_precision": 0.5955, "B_recall": 0.3869, "B_f1": 0.469, "B_f2": 0.416, "B_accuracy": 0.4595, "B_mcc": -0.0364, "B_tp": 53, "B_fp": 36, "B_tn": 49, "B_fn": 84, "D_sharpe": 0.2389, "D_sortino": 0.2178, "D_excess_sharpe": -0.6499, "D_return_pct": 1.59, "D_hit_rate": 55.41, "D_n": 222, "D_bh_sharpe": 0.8888, "D_bh_return_pct": 26.13, "D_psr": 0.5881, "D_ic": 0.0185, "D_precision": 0.6309, "D_recall": 0.6812, "D_f1": 0.6551, "D_f2": 0.6705, "D_accuracy": 0.5541, "D_mcc": 0.0273, "D_tp": 94, "D_fp": 55, "D_tn": 29, "D_fn": 44, "sharpe": 0.2389, "sortino": 0.2178, "return_pct": 1.59, "equity": 1015.9, "max_dd": 0.0, "win_rate": 55.41, "profit_factor": 0.0, "ic": 0.0185, "hit": 55.41, "psr": 0.5881, "bh_sharpe": 0.8888, "bh_return_pct": 26.13, "excess_sharpe": -0.6499, "precision": 0.6309, "recall": 0.6812, "f1": 0.6551, "f2": 0.6705, "mcc": 0.0273, "accuracy": 0.5541, "tp": 94, "fp": 55, "tn": 29, "fn": 44}, {"fold": "fold_7", "regime": "Inflation bear, AI rally and 2025", "n": 425, "A_sharpe": -0.186, "A_sortino": -0.1794, "A_excess_sharpe": -1.1575, "A_return_pct": -10.22, "A_hit_rate": 52.24, "A_n": 425, "A_bh_sharpe": 0.9715, "A_bh_return_pct": 37.12, "A_psr": 0.405, "A_ic": -0.0596, "A_precision": 0.5719, "A_recall": 0.748, "A_f1": 0.6482, "A_f2": 0.7046, "A_accuracy": 0.5224, "A_mcc": -0.0608, "A_tp": 187, "A_fp": 140, "A_tn": 35, "A_fn": 63, "B_sharpe": -0.5892, "B_sortino": -0.5436, "B_excess_sharpe": -3.0919, "B_return_pct": -46.6, "B_hit_rate": 51.65, "B_n": 425, "B_bh_sharpe": 2.5027, "B_bh_return_pct": 458.83, "B_psr": 0.221, "B_ic": -0.1058, "B_precision": 0.5928, "B_recall": 0.692, "B_f1": 0.6386, "B_f2": 0.6696, "B_accuracy": 0.5153, "B_mcc": -0.0863, "B_tp": 182, "B_fp": 125, "B_tn": 37, "B_fn": 81, "D_sharpe": -0.186, "D_sortino": -0.1794, "D_excess_sharpe": -1.1575, "D_return_pct": -10.22, "D_hit_rate": 52.24, "D_n": 425, "D_bh_sharpe": 0.9715, "D_bh_return_pct": 37.12, "D_psr": 0.405, "D_ic": -0.0596, "D_precision": 0.5719, "D_recall": 0.748, "D_f1": 0.6482, "D_f2": 0.7046, "D_accuracy": 0.5224, "D_mcc": -0.0608, "D_tp": 187, "D_fp": 140, "D_tn": 35, "D_fn": 63, "sharpe": -0.186, "sortino": -0.1794, "return_pct": -10.22, "equity": 897.8, "max_dd": 0.0, "win_rate": 52.24, "profit_factor": 0.0, "ic": -0.0596, "hit": 52.24, "psr": 0.405, "bh_sharpe": 0.9715, "bh_return_pct": 37.12, "excess_sharpe": -1.1575, "precision": 0.5719, "recall": 0.748, "f1": 0.6482, "f2": 0.7046, "mcc": -0.0608, "accuracy": 0.5224, "tp": 187, "fp": 140, "tn": 35, "fn": 63}], "per_window_val": [{"fold": "fold_1", "regime": "GFC peak crash (Lehman + Mar-2009 bottom)", "n": 104, "A_sharpe": -1.5324, "A_sortino": -1.3236, "A_excess_sharpe": -1.3651, "A_return_pct": -18.55, "A_hit_rate": 48.04, "A_n": 104, "A_bh_sharpe": -0.1672, "A_bh_return_pct": -3.81, "A_psr": 0.1521, "A_ic": 0.0217, "A_precision": 0.4932, "A_recall": 0.6667, "A_f1": 0.5669, "A_f2": 0.6228, "A_accuracy": 0.4712, "A_mcc": -0.0801, "A_tp": 36, "A_fp": 37, "A_tn": 13, "A_fn": 18, "B_sharpe": -1.7923, "B_sortino": -1.5749, "B_excess_sharpe": 0.4818, "B_return_pct": -37.74, "B_hit_rate": 47.57, "B_n": 104, "B_bh_sharpe": -2.2741, "B_bh_return_pct": -44.12, "B_psr": 0.1169, "B_ic": -0.138, "B_precision": 0.4821, "B_recall": 0.5192, "B_f1": 0.5, "B_f2": 0.5114, "B_accuracy": 0.4808, "B_mcc": -0.0386, "B_tp": 27, "B_fp": 29, "B_tn": 23, "B_fn": 25, "D_sharpe": -1.5324, "D_sortino": -1.3236, "D_excess_sharpe": -1.3651, "D_return_pct": -18.55, "D_hit_rate": 48.04, "D_n": 104, "D_bh_sharpe": -0.1672, "D_bh_return_pct": -3.81, "D_psr": 0.1521, "D_ic": 0.0217, "D_precision": 0.4932, "D_recall": 0.6667, "D_f1": 0.5669, "D_f2": 0.6228, "D_accuracy": 0.4712, "D_mcc": -0.0801, "D_tp": 36, "D_fp": 37, "D_tn": 13, "D_fn": 18, "sharpe": -1.5324, "sortino": -1.3236, "return_pct": -18.55, "equity": 814.5, "max_dd": 0.0, "win_rate": 48.04, "profit_factor": 0.0, "ic": 0.0217, "hit": 48.04, "psr": 0.1521, "bh_sharpe": -0.1672, "bh_return_pct": -3.81, "excess_sharpe": -1.3651, "precision": 0.4932, "recall": 0.6667, "f1": 0.5669, "f2": 0.6228, "mcc": -0.0801, "accuracy": 0.4712, "tp": 36, "fp": 37, "tn": 13, "fn": 18}, {"fold": "fold_2", "regime": "2011 US-downgrade + EU debt", "n": 96, "A_sharpe": -0.1611, "A_sortino": -0.1506, "A_excess_sharpe": 0.113, "A_return_pct": -2.98, "A_hit_rate": 50.53, "A_n": 96, "A_bh_sharpe": -0.2741, "A_bh_return_pct": -4.09, "A_psr": 0.4605, "A_ic": -0.1921, "A_precision": 0.5111, "A_recall": 0.92, "A_f1": 0.6571, "A_f2": 0.7931, "A_accuracy": 0.5, "A_mcc": -0.0754, "A_tp": 46, "A_fp": 44, "A_tn": 2, "A_fn": 4, "B_sharpe": 0.8629, "B_sortino": 0.9747, "B_excess_sharpe": 1.8903, "B_return_pct": 13.6, "B_hit_rate": 47.92, "B_n": 96, "B_bh_sharpe": -1.0274, "B_bh_return_pct": -25.58, "B_psr": 0.7034, "B_ic": 0.1416, "B_precision": 0.4568, "B_recall": 0.8605, "B_f1": 0.5968, "B_f2": 0.7312, "B_accuracy": 0.4792, "B_mcc": 0.0415, "B_tp": 37, "B_fp": 44, "B_tn": 9, "B_fn": 6, "D_sharpe": -0.1611, "D_sortino": -0.1506, "D_excess_sharpe": 0.113, "D_return_pct": -2.98, "D_hit_rate": 50.53, "D_n": 96, "D_bh_sharpe": -0.2741, "D_bh_return_pct": -4.09, "D_psr": 0.4605, "D_ic": -0.1921, "D_precision": 0.5111, "D_recall": 0.92, "D_f1": 0.6571, "D_f2": 0.7931, "D_accuracy": 0.5, "D_mcc": -0.0754, "D_tp": 46, "D_fp": 44, "D_tn": 2, "D_fn": 4, "sharpe": -0.1611, "sortino": -0.1506, "return_pct": -2.98, "equity": 970.1999999999999, "max_dd": 0.0, "win_rate": 50.53, "profit_factor": 0.0, "ic": -0.1921, "hit": 50.53, "psr": 0.4605, "bh_sharpe": -0.2741, "bh_return_pct": -4.09, "excess_sharpe": 0.113, "precision": 0.5111, "recall": 0.92, "f1": 0.6571, "f2": 0.7931, "mcc": -0.0754, "accuracy": 0.5, "tp": 46, "fp": 44, "tn": 2, "fn": 4}, {"fold": "fold_3", "regime": "Taper tantrum and 2014 H1", "n": 54, "A_sharpe": 3.3043, "A_sortino": 2.9904, "A_excess_sharpe": -1.3955, "A_return_pct": 7.37, "A_hit_rate": 64.81, "A_n": 54, "A_bh_sharpe": 4.6998, "A_bh_return_pct": 10.46, "A_psr": 0.9241, "A_ic": 0.0475, "A_precision": 0.6522, "A_recall": 0.9091, "A_f1": 0.7595, "A_f2": 0.8427, "A_accuracy": 0.6481, "A_mcc": 0.202, "A_tp": 30, "A_fp": 16, "A_tn": 5, "A_fn": 3, "B_sharpe": 4.731, "B_sortino": 4.5851, "B_excess_sharpe": -4.3016, "B_return_pct": 25.65, "B_hit_rate": 66.67, "B_n": 54, "B_bh_sharpe": 9.0326, "B_bh_return_pct": 49.18, "B_psr": 0.9797, "B_ic": -0.0603, "B_precision": 0.6939, "B_recall": 0.9189, "B_f1": 0.7907, "B_f2": 0.8629, "B_accuracy": 0.6667, "B_mcc": 0.0586, "B_tp": 34, "B_fp": 15, "B_tn": 2, "B_fn": 3, "D_sharpe": 3.3043, "D_sortino": 2.9904, "D_excess_sharpe": -1.3955, "D_return_pct": 7.37, "D_hit_rate": 64.81, "D_n": 54, "D_bh_sharpe": 4.6998, "D_bh_return_pct": 10.46, "D_psr": 0.9241, "D_ic": 0.0475, "D_precision": 0.6522, "D_recall": 0.9091, "D_f1": 0.7595, "D_f2": 0.8427, "D_accuracy": 0.6481, "D_mcc": 0.202, "D_tp": 30, "D_fp": 16, "D_tn": 5, "D_fn": 3, "sharpe": 3.3043, "sortino": 2.9904, "return_pct": 7.37, "equity": 1073.7, "max_dd": 0.0, "win_rate": 64.81, "profit_factor": 0.0, "ic": 0.0475, "hit": 64.81, "psr": 0.9241, "bh_sharpe": 4.6998, "bh_return_pct": 10.46, "excess_sharpe": -1.3955, "precision": 0.6522, "recall": 0.9091, "f1": 0.7595, "f2": 0.8427, "mcc": 0.202, "accuracy": 0.6481, "tp": 30, "fp": 16, "tn": 5, "fn": 3}, {"fold": "fold_4", "regime": "China devaluation and oil crash", "n": 96, "A_sharpe": -2.6822, "A_sortino": -2.6629, "A_excess_sharpe": -2.258, "A_return_pct": -18.15, "A_hit_rate": 37.89, "A_n": 96, "A_bh_sharpe": -0.4241, "A_bh_return_pct": -3.73, "A_psr": 0.0542, "A_ic": -0.1438, "A_precision": 0.4, "A_recall": 0.6667, "A_f1": 0.5, "A_f2": 0.5882, "A_accuracy": 0.375, "A_mcc": -0.2604, "A_tp": 30, "A_fp": 45, "A_tn": 6, "A_fn": 15, "B_sharpe": 1.7776, "B_sortino": 1.7959, "B_excess_sharpe": 2.9619, "B_return_pct": 30.14, "B_hit_rate": 58.33, "B_n": 96, "B_bh_sharpe": -1.1843, "B_bh_return_pct": -21.44, "B_psr": 0.8606, "B_ic": 0.1261, "B_precision": 0.5417, "B_recall": 0.8478, "B_f1": 0.661, "B_f2": 0.7617, "B_accuracy": 0.5833, "B_mcc": 0.2167, "B_tp": 39, "B_fp": 33, "B_tn": 17, "B_fn": 7, "D_sharpe": -2.6822, "D_sortino": -2.6629, "D_excess_sharpe": -2.258, "D_return_pct": -18.15, "D_hit_rate": 37.89, "D_n": 96, "D_bh_sharpe": -0.4241, "D_bh_return_pct": -3.73, "D_psr": 0.0542, "D_ic": -0.1438, "D_precision": 0.4, "D_recall": 0.6667, "D_f1": 0.5, "D_f2": 0.5882, "D_accuracy": 0.375, "D_mcc": -0.2604, "D_tp": 30, "D_fp": 45, "D_tn": 6, "D_fn": 15, "sharpe": -2.6822, "sortino": -2.6629, "return_pct": -18.15, "equity": 818.5, "max_dd": 0.0, "win_rate": 37.89, "profit_factor": 0.0, "ic": -0.1438, "hit": 37.89, "psr": 0.0542, "bh_sharpe": -0.4241, "bh_return_pct": -3.73, "excess_sharpe": -2.258, "precision": 0.4, "recall": 0.6667, "f1": 0.5, "f2": 0.5882, "mcc": -0.2604, "accuracy": 0.375, "tp": 30, "fp": 45, "tn": 6, "fn": 15}, {"fold": "fold_5", "regime": "2018 Vol-mageddon + Q4 sell-off", "n": 54, "A_sharpe": 0.6582, "A_sortino": 0.6563, "A_excess_sharpe": -0.7697, "A_return_pct": 1.71, "A_hit_rate": 55.56, "A_n": 54, "A_bh_sharpe": 1.428, "A_bh_return_pct": 3.97, "A_psr": 0.6191, "A_ic": -0.0943, "A_precision": 0.5862, "A_recall": 0.5862, "A_f1": 0.5862, "A_f2": 0.5862, "A_accuracy": 0.5556, "A_mcc": 0.1062, "A_tp": 17, "A_fp": 12, "A_tn": 13, "A_fn": 12, "B_sharpe": -6.6897, "B_sortino": -5.2924, "B_excess_sharpe": -11.6219, "B_return_pct": -34.0, "B_hit_rate": 38.89, "B_n": 54, "B_bh_sharpe": 4.9322, "B_bh_return_pct": 34.93, "B_psr": 0.0007, "B_ic": -0.4591, "B_precision": 0.5625, "B_recall": 0.4865, "B_f1": 0.5217, "B_f2": 0.5, "B_accuracy": 0.3889, "B_mcc": -0.3186, "B_tp": 18, "B_fp": 14, "B_tn": 3, "B_fn": 19, "D_sharpe": 0.6582, "D_sortino": 0.6563, "D_excess_sharpe": -0.7697, "D_return_pct": 1.71, "D_hit_rate": 55.56, "D_n": 54, "D_bh_sharpe": 1.428, "D_bh_return_pct": 3.97, "D_psr": 0.6191, "D_ic": -0.0943, "D_precision": 0.5862, "D_recall": 0.5862, "D_f1": 0.5862, "D_f2": 0.5862, "D_accuracy": 0.5556, "D_mcc": 0.1062, "D_tp": 17, "D_fp": 12, "D_tn": 13, "D_fn": 12, "sharpe": 0.6582, "sortino": 0.6563, "return_pct": 1.71, "equity": 1017.0999999999999, "max_dd": 0.0, "win_rate": 55.56, "profit_factor": 0.0, "ic": -0.0943, "hit": 55.56, "psr": 0.6191, "bh_sharpe": 1.428, "bh_return_pct": 3.97, "excess_sharpe": -0.7697, "precision": 0.5862, "recall": 0.5862, "f1": 0.5862, "f2": 0.5862, "mcc": 0.1062, "accuracy": 0.5556, "tp": 17, "fp": 12, "tn": 13, "fn": 12}, {"fold": "fold_6", "regime": "COVID crash and V-recovery", "n": 75, "A_sharpe": 1.664, "A_sortino": 1.8734, "A_excess_sharpe": -2.6355, "A_return_pct": 5.49, "A_hit_rate": 52.0, "A_n": 75, "A_bh_sharpe": 4.2994, "A_bh_return_pct": 14.68, "A_psr": 0.8205, "A_ic": 0.0207, "A_precision": 0.6471, "A_recall": 0.6471, "A_f1": 0.6471, "A_f2": 0.6471, "A_accuracy": 0.52, "A_mcc": -0.1029, "A_tp": 33, "A_fp": 18, "A_tn": 6, "A_fn": 18, "B_sharpe": 5.4213, "B_sortino": 5.4979, "B_excess_sharpe": -8.9127, "B_return_pct": 45.59, "B_hit_rate": 66.67, "B_n": 75, "B_bh_sharpe": 14.3339, "B_bh_return_pct": 120.13, "B_psr": 0.9977, "B_ic": -0.0632, "B_precision": 0.8519, "B_recall": 0.7302, "B_f1": 0.7863, "B_f2": 0.7516, "B_accuracy": 0.6667, "B_mcc": 0.0518, "B_tp": 46, "B_fp": 8, "B_tn": 4, "B_fn": 17, "D_sharpe": 1.664, "D_sortino": 1.8734, "D_excess_sharpe": -2.6355, "D_return_pct": 5.49, "D_hit_rate": 52.0, "D_n": 75, "D_bh_sharpe": 4.2994, "D_bh_return_pct": 14.68, "D_psr": 0.8205, "D_ic": 0.0207, "D_precision": 0.6471, "D_recall": 0.6471, "D_f1": 0.6471, "D_f2": 0.6471, "D_accuracy": 0.52, "D_mcc": -0.1029, "D_tp": 33, "D_fp": 18, "D_tn": 6, "D_fn": 18, "sharpe": 1.664, "sortino": 1.8734, "return_pct": 5.49, "equity": 1054.8999999999999, "max_dd": 0.0, "win_rate": 52.0, "profit_factor": 0.0, "ic": 0.0207, "hit": 52.0, "psr": 0.8205, "bh_sharpe": 4.2994, "bh_return_pct": 14.68, "excess_sharpe": -2.6355, "precision": 0.6471, "recall": 0.6471, "f1": 0.6471, "f2": 0.6471, "mcc": -0.1029, "accuracy": 0.52, "tp": 33, "fp": 18, "tn": 6, "fn": 18}, {"fold": "fold_7", "regime": "Inflation bear, AI rally and 2025", "n": 114, "A_sharpe": 1.8074, "A_sortino": 1.7962, "A_excess_sharpe": -1.0376, "A_return_pct": 12.98, "A_hit_rate": 57.89, "A_n": 114, "A_bh_sharpe": 2.845, "A_bh_return_pct": 21.34, "A_psr": 0.8864, "A_ic": 0.0303, "A_precision": 0.6118, "A_recall": 0.7761, "A_f1": 0.6842, "A_f2": 0.7365, "A_accuracy": 0.5789, "A_mcc": 0.0836, "A_tp": 5