{"experiment_num": 31, "backbone": "lstm", "description": "LSTM @ FX-Exp35 hd=0.25 (FAITHFUL port; exp 5 had hd=0.1 default bug) - Srivastava 2014; CLAUDE.md FX learnings; corrects under-regularised exp 5", "config": {"seq_len": 10, "lr": 0.001, "batch_size": 16, "epochs": 100, "weight_decay": 0.0007, "patience": 15, "warmup_epochs": 0, "head_dropout": 0.25, "huber_delta": 1.0, "grad_clip": 1.0, "seed": 42, "hidden_size": null, "num_layers": null, "max_depth": null, "gbm_lr": null, "n_estimators": null}, "composite": -0.1591, "test_pos_folds": 3, "val_pos_folds": 5, "val_loss": -2.8870639294436167, "elapsed_sec": 47.3, "timestamp": "2026-04-27T18:26:26", "sharpe": 0.2409, "val_sharpe": 0.6458, "ic": 0.0147, "hit": 48.61, "psr": 0.7165, "equity": 1174.7, "return_pct": 17.47, "bh_sharpe": 0.6042, "bh_return_pct": 103.49, "excess_sharpe": -0.3633, "B_sharpe": 0.7708, "B_excess_sharpe": -0.93, "B_return_pct": 347.28, "D_sharpe": 0.2409, "D_excess_sharpe": -0.3633, "D_return_pct": 17.47, "per_window": [{"fold": "fold_1", "regime": "GFC peak crash (Lehman + Mar-2009 bottom)", "n": 115, "A_sharpe": 0.8926, "A_sortino": 1.0329, "A_excess_sharpe": 1.3367, "A_return_pct": 15.68, "A_hit_rate": 46.09, "A_n": 115, "A_bh_sharpe": -0.4441, "A_bh_return_pct": -14.4, "A_psr": 0.7282, "A_ic": -0.0016, "B_sharpe": 1.3961, "B_sortino": 1.4771, "B_excess_sharpe": 1.6939, "B_return_pct": 47.73, "B_hit_rate": 51.75, "B_n": 115, "B_bh_sharpe": -0.2978, "B_bh_return_pct": -27.23, "B_psr": 0.8254, "B_ic": 0.1595, "D_sharpe": 0.8926, "D_sortino": 1.0329, "D_excess_sharpe": 1.3367, "D_return_pct": 15.68, "D_hit_rate": 46.09, "D_n": 115, "D_bh_sharpe": -0.4441, "D_bh_return_pct": -14.4, "D_psr": 0.7282, "D_ic": -0.0016, "sharpe": 0.8926, "sortino": 1.0329, "return_pct": 15.68, "equity": 1156.8, "max_dd": 0.0, "win_rate": 46.09, "profit_factor": 0.0, "ic": -0.0016, "hit": 46.09, "psr": 0.7282, "bh_sharpe": -0.4441, "bh_return_pct": -14.4, "excess_sharpe": 1.3367, "precision": 0.4091, "recall": 0.3333, "f1": 0.3673, "f2": 0.3462, "accuracy": 0.4609, "mcc": -0.0954, "tp": 18, "fp": 26, "tn": 35, "fn": 36, "A_precision": 0.4091, "A_recall": 0.3333, "A_f1": 0.3673, "A_f2": 0.3462, "A_accuracy": 0.4609, "A_mcc": -0.0954, "A_tp": 18, "A_fp": 26, "A_tn": 35, "A_fn": 36}, {"fold": "fold_2", "regime": "2011 US-downgrade + EU debt", "n": 136, "A_sharpe": -0.927, "A_sortino": -0.8696, "A_excess_sharpe": -2.6597, "A_return_pct": -10.82, "A_hit_rate": 50.37, "A_n": 136, "A_bh_sharpe": 1.7327, "A_bh_return_pct": 19.75, "A_psr": 0.2487, "A_ic": -0.003, "B_sharpe": 2.3178, "B_sortino": 2.3249, "B_excess_sharpe": -1.7482, "B_return_pct": 66.07, "B_hit_rate": 58.82, "B_n": 136, "B_bh_sharpe": 4.0659, "B_bh_return_pct": 148.68, "B_psr": 0.9547, "B_ic": 0.0623, "D_sharpe": -0.927, "D_sortino": -0.8696, "D_excess_sharpe": -2.6597, "D_return_pct": -10.82, "D_hit_rate": 50.37, "D_n": 136, "D_bh_sharpe": 1.7327, "D_bh_return_pct": 19.75, "D_psr": 0.2487, "D_ic": -0.003, "sharpe": -0.927, "sortino": -0.8696, "return_pct": -10.82, "equity": 891.8000000000001, "max_dd": 0.0, "win_rate": 50.37, "profit_factor": 0.0, "ic": -0.003, "hit": 50.37, "psr": 0.2487, "bh_sharpe": 1.7327, "bh_return_pct": 19.75, "excess_sharpe": -2.6597, "precision": 0.5873, "recall": 0.4744, "f1": 0.5248, "f2": 0.4933, "accuracy": 0.5074, "mcc": 0.0259, "tp": 37, "fp": 26, "tn": 32, "fn": 41, "A_precision": 0.5873, "A_recall": 0.4744, "A_f1": 0.5248, "A_f2": 0.4933, "A_accuracy": 0.5074, "A_mcc": 0.0259, "A_tp": 37, "A_fp": 26, "A_tn": 32, "A_fn": 41}, {"fold": "fold_3", "regime": "Taper tantrum and 2014 H1", "n": 178, "A_sharpe": -0.0558, "A_sortino": -0.0635, "A_excess_sharpe": -1.4004, "A_return_pct": -1.1, "A_hit_rate": 45.76, "A_n": 178, "A_bh_sharpe": 1.3445, "A_bh_return_pct": 12.41, "A_psr": 0.4814, "A_ic": 0.0819, "B_sharpe": 0.2316, "B_sortino": 0.2352, "B_excess_sharpe": -2.8167, "B_return_pct": 1.86, "B_hit_rate": 48.31, "B_n": 178, "B_bh_sharpe": 3.0483, "B_bh_return_pct": 71.83, "B_psr": 0.5769, "B_ic": -0.0209, "D_sharpe": -0.0558, "D_sortino": -0.0635, "D_excess_sharpe": -1.4004, "D_return_pct": -1.1, "D_hit_rate": 45.76, "D_n": 178, "D_bh_sharpe": 1.3445, "D_bh_return_pct": 12.41, "D_psr": 0.4814, "D_ic": 0.0819, "sharpe": -0.0558, "sortino": -0.0635, "return_pct": -1.1, "equity": 989.0, "max_dd": 0.0, "win_rate": 45.76, "profit_factor": 0.0, "ic": 0.0819, "hit": 45.76, "psr": 0.4814, "bh_sharpe": 1.3445, "bh_return_pct": 12.41, "excess_sharpe": -1.4004, "precision": 0.566, "recall": 0.2913, "f1": 0.3846, "f2": 0.3226, "accuracy": 0.4607, "mcc": -0.0166, "tp": 30, "fp": 23, "tn": 52, "fn": 73, "A_precision": 0.566, "A_recall": 0.2913, "A_f1": 0.3846, "A_f2": 0.3226, "A_accuracy": 0.4607, "A_mcc": -0.0166, "A_tp": 30, "A_fp": 23, "A_tn": 52, "A_fn": 73}, {"fold": "fold_4", "regime": "China devaluation and oil crash", "n": 157, "A_sharpe": 1.4069, "A_sortino": 1.3706, "A_excess_sharpe": 1.3971, "A_return_pct": 17.09, "A_hit_rate": 55.13, "A_n": 157, "A_bh_sharpe": 0.0098, "A_bh_return_pct": -1.05, "A_psr": 0.8621, "A_ic": 0.0832, "B_sharpe": 0.8647, "B_sortino": 0.8341, "B_excess_sharpe": 0.8488, "B_return_pct": 19.24, "B_hit_rate": 52.87, "B_n": 157, "B_bh_sharpe": 0.0159, "B_bh_return_pct": -5.48, "B_psr": 0.7498, "B_ic": 0.1267, "D_sharpe": 1.4069, "D_sortino": 1.3706, "D_excess_sharpe": 1.3971, "D_return_pct": 17.09, "D_hit_rate": 55.13, "D_n": 157, "D_bh_sharpe": 0.0098, "D_bh_return_pct": -1.05, "D_psr": 0.8621, "D_ic": 0.0832, "sharpe": 1.4069, "sortino": 1.3706, "return_pct": 17.09, "equity": 1170.9, "max_dd": 0.0, "win_rate": 55.13, "profit_factor": 0.0, "ic": 0.0832, "hit": 55.13, "psr": 0.8621, "bh_sharpe": 0.0098, "bh_return_pct": -1.05, "excess_sharpe": 1.3971, "precision": 0.5694, "recall": 0.5062, "f1": 0.5359, "f2": 0.5177, "accuracy": 0.5478, "mcc": 0.0986, "tp": 41, "fp": 31, "tn": 45, "fn": 40, "A_precision": 0.5694, "A_recall": 0.5062, "A_f1": 0.5359, "A_f2": 0.5177, "A_accuracy": 0.5478, "A_mcc": 0.0986, "A_tp": 41, "A_fp": 31, "A_tn": 45, "A_fn": 40}, {"fold": "fold_5", "regime": "2018 Vol-mageddon + Q4 sell-off", "n": 177, "A_sharpe": -0.057, "A_sortino": -0.0657, "A_excess_sharpe": -0.3667, "A_return_pct": -2.74, "A_hit_rate": 43.5, "A_n": 177, "A_bh_sharpe": 0.3098, "A_bh_return_pct": 3.19, "A_psr": 0.481, "A_ic": 0.0403, "B_sharpe": 2.7181, "B_sortino": 2.6939, "B_excess_sharpe": 1.8264, "B_return_pct": 121.89, "B_hit_rate": 59.09, "B_n": 177, "B_bh_sharpe": 0.8917, "B_bh_return_pct": 23.8, "B_psr": 0.9866, "B_ic": 0.2772, "D_sharpe": -0.057, "D_sortino": -0.0657, "D_excess_sharpe": -0.3667, "D_return_pct": -2.74, "D_hit_rate": 43.5, "D_n": 177, "D_bh_sharpe": 0.3098, "D_bh_return_pct": 3.19, "D_psr": 0.481, "D_ic": 0.0403, "sharpe": -0.057, "sortino": -0.0657, "return_pct": -2.74, "equity": 972.6, "max_dd": 0.0, "win_rate": 43.5, "profit_factor": 0.0, "ic": 0.0403, "hit": 43.5, "psr": 0.481, "bh_sharpe": 0.3098, "bh_return_pct": 3.19, "excess_sharpe": -0.3667, "precision": 0.5254, "recall": 0.301, "f1": 0.3827, "f2": 0.3291, "accuracy": 0.435, "mcc": -0.081, "tp": 31, "fp": 28, "tn": 46, "fn": 72, "A_precision": 0.5254, "A_recall": 0.301, "A_f1": 0.3827, "A_f2": 0.3291, "A_accuracy": 0.435, "A_mcc": -0.081, "A_tp": 31, "A_fp": 28, "A_tn": 46, "A_fn": 72}, {"fold": "fold_6", "regime": "COVID crash and V-recovery", "n": 222, "A_sharpe": 0.3587, "A_sortino": 0.39, "A_excess_sharpe": -0.5301, "A_return_pct": 5.85, "A_hit_rate": 47.75, "A_n": 222, "A_bh_sharpe": 0.8888, "A_bh_return_pct": 26.13, "A_psr": 0.6321, "A_ic": 0.0487, "B_sharpe": -0.2052, "B_sortino": -0.1967, "B_excess_sharpe": -2.5936, "B_return_pct": -29.14, "B_hit_rate": 49.77, "B_n": 222, "B_bh_sharpe": 2.3884, "B_bh_return_pct": 243.18, "B_psr": 0.4236, "B_ic": -0.0171, "D_sharpe": 0.3587, "D_sortino": 0.39, "D_excess_sharpe": -0.5301, "D_return_pct": 5.85, "D_hit_rate": 47.75, "D_n": 222, "D_bh_sharpe": 0.8888, "D_bh_return_pct": 26.13, "D_psr": 0.6321, "D_ic": 0.0487, "sharpe": 0.3587, "sortino": 0.39, "return_pct": 5.85, "equity": 1058.5, "max_dd": 0.0, "win_rate": 47.75, "profit_factor": 0.0, "ic": 0.0487, "hit": 47.75, "psr": 0.6321, "bh_sharpe": 0.8888, "bh_return_pct": 26.13, "excess_sharpe": -0.5301, "precision": 0.5948, "recall": 0.5, "f1": 0.5433, "f2": 0.5165, "accuracy": 0.4775, "mcc": -0.0578, "tp": 69, "fp": 47, "tn": 37, "fn": 69, "A_precision": 0.5948, "A_recall": 0.5, "A_f1": 0.5433, "A_f2": 0.5165, "A_accuracy": 0.4775, "A_mcc": -0.0578, "A_tp": 69, "A_fp": 47, "A_tn": 37, "A_fn": 69}, {"fold": "fold_7", "regime": "Inflation bear, AI rally and 2025", "n": 425, "A_sharpe": -0.0175, "A_sortino": -0.0181, "A_excess_sharpe": -0.989, "A_return_pct": -4.49, "A_hit_rate": 50.12, "A_n": 425, "A_bh_sharpe": 0.9715, "A_bh_return_pct": 37.12, "A_psr": 0.491, "A_ic": -0.0371, "B_sharpe": 0.1684, "B_sortino": 0.1585, "B_excess_sharpe": -2.3342, "B_return_pct": -4.54, "B_hit_rate": 52.83, "B_n": 425, "B_bh_sharpe": 2.5027, "B_bh_return_pct": 458.83, "B_psr": 0.5863, "B_ic": 0.0017, "D_sharpe": -0.0175, "D_sortino": -0.0181, "D_excess_sharpe": -0.989, "D_return_pct": -4.49, "D_hit_rate": 50.12, "D_n": 425, "D_bh_sharpe": 0.9715, "D_bh_return_pct": 37.12, "D_psr": 0.491, "D_ic": -0.0371, "sharpe": -0.0175, "sortino": -0.0181, "return_pct": -4.49, "equity": 955.0999999999999, "max_dd": 0.0, "win_rate": 50.12, "profit_factor": 0.0, "ic": -0.0371, "hit": 50.12, "psr": 0.491, "bh_sharpe": 0.9715, "bh_return_pct": 37.12, "excess_sharpe": -0.989, "precision": 0.596, "recall": 0.472, "f1": 0.5268, "f2": 0.4925, "accuracy": 0.5012, "mcc": 0.0147, "tp": 118, "fp": 80, "tn": 95, "fn": 132, "A_precision": 0.596, "A_recall": 0.472, "A_f1": 0.5268, "A_f2": 0.4925, "A_accuracy": 0.5012, "A_mcc": 0.0147, "A_tp": 118, "A_fp": 80, "A_tn": 95, "A_fn": 132}], "per_window_val": [{"fold": "fold_1", "regime": "GFC peak crash (Lehman + Mar-2009 bottom)", "n": 104, "A_sharpe": 3.4785, "A_sortino": 4.3943, "A_excess_sharpe": 3.6457, "A_return_pct": 48.89, "A_hit_rate": 57.84, "A_n": 104, "A_bh_sharpe": -0.1672, "A_bh_return_pct": -3.81, "A_psr": 0.9929, "A_ic": 0.1617, "B_sharpe": -1.0761, "B_sortino": -1.005, "B_excess_sharpe": 1.198, "B_return_pct": -26.75, "B_hit_rate": 46.6, "B_n": 104, "B_bh_sharpe": -2.2741, "B_bh_return_pct": -44.12, "B_psr": 0.2417, "B_ic": -0.0634, "D_sharpe": 3.4785, "D_sortino": 4.3943, "D_excess_sharpe": 3.6457, "D_return_pct": 48.89, "D_hit_rate": 57.84, "D_n": 104, "D_bh_sharpe": -0.1672, "D_bh_return_pct": -3.81, "D_psr": 0.9929, "D_ic": 0.1617, "sharpe": 3.4785, "sortino": 4.3943, "return_pct": 48.89, "equity": 1488.9, "max_dd": 0.0, "win_rate": 57.84, "profit_factor": 0.0, "ic": 0.1617, "hit": 57.84, "psr": 0.9929, "bh_sharpe": -0.1672, "bh_return_pct": -3.81, "excess_sharpe": 3.6457}, {"fold": "fold_2", "regime": "2011 US-downgrade + EU debt", "n": 96, "A_sharpe": 0.0463, "A_sortino": 0.0465, "A_excess_sharpe": 0.3204, "A_return_pct": -0.89, "A_hit_rate": 49.47, "A_n": 96, "A_bh_sharpe": -0.2741, "A_bh_return_pct": -4.09, "A_psr": 0.5113, "A_ic": -0.0397, "B_sharpe": 0.4435, "B_sortino": 0.4397, "B_excess_sharpe": 1.4709, "B_return_pct": 3.33, "B_hit_rate": 50.0, "B_n": 96, "B_bh_sharpe": -1.0274, "B_bh_return_pct": -25.58, "B_psr": 0.6066, "B_ic": -0.0848, "D_sharpe": 0.0463, "D_sortino": 0.0465, "D_excess_sharpe": 0.3204, "D_return_pct": -0.89, "D_hit_rate": 49.47, "D_n": 96, "D_bh_sharpe": -0.2741, "D_bh_return_pct": -4.09, "D_psr": 0.5113, "D_ic": -0.0397, "sharpe": 0.0463, "sortino": 0.0465, "return_pct": -0.89, "equity": 991.1, "max_dd": 0.0, "win_rate": 49.47, "profit_factor": 0.0, "ic": -0.0397, "hit": 49.47, "psr": 0.5113, "bh_sharpe": -0.2741, "bh_return_pct": -4.09, "excess_sharpe": 0.3204}, {"fold": "fold_3", "regime": "Taper tantrum and 2014 H1", "n": 54, "A_sharpe": -4.3076, "A_sortino": -3.883, "A_excess_sharpe": -9.0073, "A_return_pct": -8.97, "A_hit_rate": 38.89, "A_n": 54, "A_bh_sharpe": 4.6998, "A_bh_return_pct": 10.46, "A_psr": 0.0242, "A_ic": -0.1525, "B_sharpe": 1.4834, "B_sortino": 1.686, "B_excess_sharpe": -7.5492, "B_return_pct": 7.27, "B_hit_rate": 48.15, "B_n": 54, "B_bh_sharpe": 9.0326, "B_bh_return_pct": 49.18, "B_psr": 0.7523, "B_ic": -0.0064, "D_sharpe": -4.3076, "D_sortino": -3.883, "D_excess_sharpe": -9.0073, "D_return_pct": -8.97, "D_hit_rate": 38.89, "D_n": 54, "D_bh_sharpe": 4.6998, "D_bh_return_pct": 10.46, "D_psr": 0.0242, "D_ic": -0.1525, "sharpe": -4.3076, "sortino": -3.883, "return_pct": -8.97, "equity": 910.3, "max_dd": 0.0, "win_rate": 38.89, "profit_factor": 0.0, "ic": -0.1525, "hit": 38.89, "psr": 0.0242, "bh_sharpe": 4.6998, "bh_return_pct": 10.46, "excess_sharpe": -9.0073}, {"fold": "fold_4", "regime": "China devaluation and oil crash", "n": 96, "A_sharpe": 0.6238, "A_sortino": 0.6301, "A_excess_sharpe": 1.0479, "A_return_pct": 3.93, "A_hit_rate": 50.53, "A_n": 96, "A_bh_sharpe": -0.4241, "A_bh_return_pct": -3.73, "A_psr": 0.6488, "A_ic": 0.0468, "B_sharpe": 0.3731, "B_sortino": 0.3675, "B_excess_sharpe": 1.5573, "B_return_pct": 2.55, "B_hit_rate": 51.04, "B_n": 96, "B_bh_sharpe": -1.1843, "B_bh_return_pct": -21.44, "B_psr": 0.5904, "B_ic": 0.1993, "D_sharpe": 0.6238, "D_sortino": 0.6301, "D_excess_sharpe": 1.0479, "D_return_pct": 3.93, "D_hit_rate": 50.53, "D_n": 96, "D_bh_sharpe": -0.4241, "D_bh_return_pct": -3.73, "D_psr": 0.6488, "D_ic": 0.0468, "sharpe": 0.6238, "sortino": 0.6301, "return_pct": 3.93, "equity": 1039.3, "max_dd": 0.0, "win_rate": 50.53, "profit_factor": 0.0, "ic": 0.0468, "hit": 50.53, "psr": 0.6488, "bh_sharpe": -0.4241, "bh_return_pct": -3.73, "excess_sharpe": 1.0479}, {"fold": "fold_5", "regime": "2018 Vol-mageddon + Q4 sell-off", "n": 54, "A_sharpe": 0.7946, "A_sortino": 0.8313, "A_excess_sharpe": -0.6334, "A_return_pct": 2.11, "A_hit_rate": 53.7, "A_n": 54, "A_bh_sharpe": 1.428, "A_bh_return_pct": 3.97, "A_psr": 0.6432, "A_ic": -0.0848, "B_sharpe": -1.9285, "B_sortino": -1.8681, "B_excess_sharpe": -6.8607, "B_return_pct": -12.71, "B_hit_rate": 44.44, "B_n": 54, "B_bh_sharpe": 4.9322, "B_bh_return_pct": 34.93, "B_psr": 0.19, "B_ic": -0.2563, "D_sharpe": 0.7946, "D_sortino": 0.8313, "D_excess_sharpe": -0.6334, "D_return_pct": 2.11, "D_hit_rate": 53.7, "D_n": 54, "D_bh_sharpe": 1.428, "D_bh_return_pct": 3.97, "D_psr": 0.6432, "D_ic": -0.0848, "sharpe": 0.7946, "sortino": 0.8313, "return_pct": 2.11, "equity": 1021.0999999999999, "max_dd": 0.0, "win_rate": 53.7, "profit_factor": 0.0, "ic": -0.0848, "hit": 53.7, "psr": 0.6432, "bh_sharpe": 1.428, "bh_return_pct": 3.97, "excess_sharpe": -0.6334}, {"fold": "fold_6", "regime": "COVID crash and V-recovery", "n": 75, "A_sharpe": -2.6549, "A_sortino": -2.7316, "A_excess_sharpe": -6.9543, "A_return_pct": -8.56, "A_hit_rate": 38.67, "A_n": 75, "A_bh_sharpe": 4.2994, "A_bh_return_pct": 14.68, "A_psr": 0.0844, "A_ic": 0.0409, "B_sharpe": -5.0599, "B_sortino": -4.7209, "B_excess_sharpe": -19.3938, "B_return_pct": -31.02, "B_hit_rate": 34.67, "B_n": 75, "B_bh_sharpe": 14.3339, "B_bh_return_pct": 120.13, "B_psr": 0.0045, "B_ic": -0.0527, "D_sharpe": -2.6549, "D_sortino": -2.7316, "D_excess_sharpe": -6.9543, "D_return_pct": -8.56, "D_hit_rate": 38.67, "D_n": 75, "D_bh_sharpe": 4.2994, "D_bh_return_pct": 14.68, "D_psr": 0.0844, "D_ic": 0.0409, "sharpe": -2.6549, "sortino": -2.7316, "return_pct": -8.56, "equity": 914.4, "max_dd": 0.0, "win_rate": 38.67, "profit_factor": 0.0, "ic": 0.0409, "hit": 38.67, "psr": 0.0844, "bh_sharpe": 4.2994, "bh_return_pct": 14.68, "excess_sharpe": -6.9543}, {"fold": "fold_7", "regime": "Inflation bear, AI rally and 2025", "n": 114, "A_sharpe": 0.0366, "A_sortino": 0.0384, "A_excess_sharpe": -2.8084, "A_return_pct": -0.3, "A_hit_rate": 47.37, "A_n": 114, "A_bh_sharpe": 2.845, "A_bh_return_pct": 21.34, "A_psr": 0.5098, "A_ic": -0.0501, "B_sharpe": 3.5014, "B_sortino": 3.9446, "B_excess_sharpe": -2.6353, "B_return_pct": 72.75, "B_hit_rate": 59.65, "B_n": 114, "B_bh_sharpe": 6.1366, "B_bh_return_pct": 155.03, "B_psr": 0.9919, "B_ic": 0.0165, "D_sharpe": 0.0366, "D_sortino": 0.0384, "D_excess_sharpe": -2.8084, "D_return_pct": -0.3, "D_hit_rate": 47.37, "D_n": 114, "D_bh_sharpe": 2.845, "D_bh_return_pct": 21.34, "D_psr": 0.5098, "D_ic": -0.0501, "sharpe": 0.0366, "sortino": 0.0384, "return_pct": -0.3, "equity": 997.0, "max_dd": 0.0, "win_rate": 47.37, "profit_factor": 0.0, "ic": -0.0501, "hit": 47.37, "psr": 0.5098, "bh_sharpe": 2.845, "bh_return_pct": 21.34, "excess_sharpe": -2.8084}], "status": "DISCARD", "precision": 0.5686, "recall": 0.4263, "f1": 0.4873, "f2": 0.4487, "accuracy": 0.4865, "mcc": -0.0066, "tp": 344, "fp": 261, "tn": 342, "fn": 463, "test_sharpe": 0.2409, "A_sharpe": 0.2409, "A_excess_sharpe": -0.3633, "A_return_pct": 17.47, "A_precision": 0.5686, "A_recall": 0.4263, "A_f1": 0.4873, "A_f2": 0.4487, "A_accuracy": 0.4865, "A_mcc": -0.0066, "A_tp": 344, "A_fp": 261, "A_tn": 342, "A_fn": 463, "A_psr": 0.7165, "A_ic": 0.0147, "A_hit_rate": 48.61, "A_bh_sharpe": 0.6042, "A_bh_return_pct": 103.49}
