{"experiment_num": 39, "backbone": "xgboost", "description": "XGBoost @ exp 1 max_depth=4 (down from 6) - Chen-Guestrin 2016 regularised tabular default", "config": {"seq_len": 60, "lr": 0.0003, "batch_size": 32, "epochs": 50, "weight_decay": 1e-05, "patience": 10, "warmup_epochs": 0, "head_dropout": 0.1, "huber_delta": 1.0, "grad_clip": 1.0, "seed": 42, "hidden_size": null, "num_layers": null, "max_depth": 4, "gbm_lr": 0.05, "n_estimators": 50}, "composite": -1.5423, "test_pos_folds": 5, "val_pos_folds": 1, "val_loss": null, "elapsed_sec": 49.8, "timestamp": "2026-04-27T18:52:14", "sharpe": 0.5694, "val_sharpe": -1.3423, "ic": 0.0103, "hit": 51.13, "psr": 0.8817, "equity": 1547.7, "return_pct": 54.77, "bh_sharpe": 1.2194, "bh_return_pct": 187.05, "excess_sharpe": -0.6499, "B_sharpe": -0.0763, "B_excess_sharpe": -2.9045, "B_return_pct": -45.54, "D_sharpe": 0.2314, "D_excess_sharpe": -0.988, "D_return_pct": 12.08, "per_window": [{"fold": "fold_1", "regime": "GFC peak crash (Lehman + Mar-2009 bottom)", "n": 66, "A_sharpe": 3.2503, "A_sortino": 3.6867, "A_excess_sharpe": 2.6782, "A_return_pct": 34.2, "A_hit_rate": 56.06, "A_n": 66, "A_bh_sharpe": 0.5721, "A_bh_return_pct": 3.85, "A_psr": 0.9528, "A_ic": 0.0741, "B_sharpe": 0.0873, "B_sortino": 0.0893, "B_excess_sharpe": -1.9596, "B_return_pct": -5.75, "B_hit_rate": 49.23, "B_n": 66, "B_bh_sharpe": 2.0469, "B_bh_return_pct": 39.28, "B_psr": 0.5177, "B_ic": 0.1792, "D_sharpe": 0.6322, "D_sortino": 0.6579, "D_excess_sharpe": 0.0601, "D_return_pct": 4.46, "D_hit_rate": 50.0, "D_n": 66, "D_bh_sharpe": 0.5721, "D_bh_return_pct": 3.85, "D_psr": 0.626, "D_ic": 0.0905, "sharpe": 3.2503, "sortino": 3.6867, "return_pct": 34.2, "equity": 1342.0, "max_dd": 0.0, "win_rate": 56.06, "profit_factor": 0.0, "ic": 0.0741, "hit": 56.06, "psr": 0.9528, "bh_sharpe": 0.5721, "bh_return_pct": 3.85, "excess_sharpe": 2.6782, "precision": 0.5938, "recall": 0.5429, "f1": 0.5672, "f2": 0.5523, "accuracy": 0.5606, "mcc": 0.1233, "tp": 19, "fp": 13, "tn": 18, "fn": 16, "A_precision": 0.5938, "A_recall": 0.5429, "A_f1": 0.5672, "A_f2": 0.5523, "A_accuracy": 0.5606, "A_mcc": 0.1233, "A_tp": 19, "A_fp": 13, "A_tn": 18, "A_fn": 16}, {"fold": "fold_2", "regime": "2011 US-downgrade + EU debt", "n": 87, "A_sharpe": 0.3997, "A_sortino": 0.4459, "A_excess_sharpe": -4.6223, "A_return_pct": 1.76, "A_hit_rate": 48.84, "A_n": 87, "A_bh_sharpe": 5.022, "A_bh_return_pct": 29.23, "A_psr": 0.593, "A_ic": -0.0141, "B_sharpe": 9.6779, "B_sortino": 8.8047, "B_excess_sharpe": -1.4591, "B_return_pct": 158.22, "B_hit_rate": 80.46, "B_n": 87, "B_bh_sharpe": 11.1369, "B_bh_return_pct": 185.4, "B_psr": 1.0, "B_ic": 0.0685, "D_sharpe": 4.4845, "D_sortino": 5.5399, "D_excess_sharpe": -0.5375, "D_return_pct": 25.95, "D_hit_rate": 62.79, "D_n": 87, "D_bh_sharpe": 5.022, "D_bh_return_pct": 29.23, "D_psr": 0.9983, "D_ic": 0.0454, "sharpe": 0.3997, "sortino": 0.4459, "return_pct": 1.76, "equity": 1017.6, "max_dd": 0.0, "win_rate": 48.84, "profit_factor": 0.0, "ic": -0.0141, "hit": 48.84, "psr": 0.593, "bh_sharpe": 5.022, "bh_return_pct": 29.23, "excess_sharpe": -4.6223, "precision": 0.5962, "recall": 0.5741, "f1": 0.5849, "f2": 0.5784, "accuracy": 0.4943, "mcc": -0.0616, "tp": 31, "fp": 21, "tn": 12, "fn": 23, "A_precision": 0.5962, "A_recall": 0.5741, "A_f1": 0.5849, "A_f2": 0.5784, "A_accuracy": 0.4943, "A_mcc": -0.0616, "A_tp": 31, "A_fp": 21, "A_tn": 12, "A_fn": 23}, {"fold": "fold_3", "regime": "Taper tantrum and 2014 H1", "n": 129, "A_sharpe": 0.4614, "A_sortino": 0.3866, "A_excess_sharpe": -1.3064, "A_return_pct": 2.64, "A_hit_rate": 57.03, "A_n": 129, "A_bh_sharpe": 1.7678, "A_bh_return_pct": 11.76, "A_psr": 0.627, "A_ic": -0.0366, "B_sharpe": 3.4917, "B_sortino": 3.4203, "B_excess_sharpe": -0.7557, "B_return_pct": 50.55, "B_hit_rate": 62.02, "B_n": 129, "B_bh_sharpe": 4.2474, "B_bh_return_pct": 64.1, "B_psr": 0.9919, "B_ic": -0.0985, "D_sharpe": 1.5549, "D_sortino": 1.319, "D_excess_sharpe": -0.2129, "D_return_pct": 10.24, "D_hit_rate": 59.38, "D_n": 129, "D_bh_sharpe": 1.7678, "D_bh_return_pct": 11.76, "D_psr": 0.8537, "D_ic": 0.0567, "sharpe": 0.4614, "sortino": 0.3866, "return_pct": 2.64, "equity": 1026.4, "max_dd": 0.0, "win_rate": 57.03, "profit_factor": 0.0, "ic": -0.0366, "hit": 57.03, "psr": 0.627, "bh_sharpe": 1.7678, "bh_return_pct": 11.76, "excess_sharpe": -1.3064, "precision": 0.5902, "recall": 0.9231, "f1": 0.72, "f2": 0.8295, "accuracy": 0.5659, "mcc": -0.1237, "tp": 72, "fp": 50, "tn": 1, "fn": 6, "A_precision": 0.5902, "A_recall": 0.9231, "A_f1": 0.72, "A_f2": 0.8295, "A_accuracy": 0.5659, "A_mcc": -0.1237, "A_tp": 72, "A_fp": 50, "A_tn": 1, "A_fn": 6}, {"fold": "fold_4", "regime": "China devaluation and oil crash", "n": 108, "A_sharpe": -0.274, "A_sortino": -0.2569, "A_excess_sharpe": 0.4158, "A_return_pct": -3.25, "A_hit_rate": 50.47, "A_n": 108, "A_bh_sharpe": -0.6898, "A_bh_return_pct": -6.71, "A_psr": 0.4289, "A_ic": 0.0073, "B_sharpe": -4.1826, "B_sortino": -3.7394, "B_excess_sharpe": -2.2251, "B_return_pct": -55.31, "B_hit_rate": 37.96, "B_n": 108, "B_bh_sharpe": -1.9575, "B_bh_return_pct": -33.56, "B_psr": 0.0025, "B_ic": -0.2148, "D_sharpe": -3.24, "D_sortino": -2.8777, "D_excess_sharpe": -2.5502, "D_return_pct": -24.98, "D_hit_rate": 42.06, "D_n": 108, "D_bh_sharpe": -0.6898, "D_bh_return_pct": -6.71, "D_psr": 0.0146, "D_ic": -0.1091, "sharpe": -0.274, "sortino": -0.2569, "return_pct": -3.25, "equity": 967.5, "max_dd": 0.0, "win_rate": 50.47, "profit_factor": 0.0, "ic": 0.0073, "hit": 50.47, "psr": 0.4289, "bh_sharpe": -0.6898, "bh_return_pct": -6.71, "excess_sharpe": 0.4158, "precision": 0.4925, "recall": 0.6226, "f1": 0.55, "f2": 0.5914, "accuracy": 0.5, "mcc": 0.0046, "tp": 33, "fp": 34, "tn": 21, "fn": 20, "A_precision": 0.4925, "A_recall": 0.6226, "A_f1": 0.55, "A_f2": 0.5914, "A_accuracy": 0.5, "A_mcc": 0.0046, "A_tp": 33, "A_fp": 34, "A_tn": 21, "A_fn": 20}, {"fold": "fold_5", "regime": "2018 Vol-mageddon + Q4 sell-off", "n": 128, "A_sharpe": 1.5748, "A_sortino": 1.739, "A_excess_sharpe": 0.4236, "A_return_pct": 19.04, "A_hit_rate": 54.69, "A_n": 128, "A_bh_sharpe": 1.1511, "A_bh_return_pct": 13.19, "A_psr": 0.8741, "A_ic": -0.0056, "B_sharpe": -5.1408, "B_sortino": -4.5822, "B_excess_sharpe": -7.9527, "B_return_pct": -70.32, "B_hit_rate": 33.86, "B_n": 128, "B_bh_sharpe": 2.8119, "B_bh_return_pct": 82.25, "B_psr": 0.0001, "B_ic": -0.1784, "D_sharpe": -2.9589, "D_sortino": -2.931, "D_excess_sharpe": -4.11, "D_return_pct": -30.51, "D_hit_rate": 39.84, "D_n": 128, "D_bh_sharpe": 1.1511, "D_bh_return_pct": 13.19, "D_psr": 0.0235, "D_ic": -0.1465, "sharpe": 1.5748, "sortino": 1.739, "return_pct": 19.04, "equity": 1190.3999999999999, "max_dd": 0.0, "win_rate": 54.69, "profit_factor": 0.0, "ic": -0.0056, "hit": 54.69, "psr": 0.8741, "bh_sharpe": 1.1511, "bh_return_pct": 13.19, "excess_sharpe": 0.4236, "precision": 0.622, "recall": 0.6538, "f1": 0.6375, "f2": 0.6472, "accuracy": 0.5469, "mcc": 0.0344, "tp": 51, "fp": 31, "tn": 19, "fn": 27, "A_precision": 0.622, "A_recall": 0.6538, "A_f1": 0.6375, "A_f2": 0.6472, "A_accuracy": 0.5469, "A_mcc": 0.0344, "A_tp": 51, "A_fp": 31, "A_tn": 19, "A_fn": 27}, {"fold": "fold_6", "regime": "COVID crash and V-recovery", "n": 173, "A_sharpe": 0.3713, "A_sortino": 0.3591, "A_excess_sharpe": -1.9548, "A_return_pct": 4.25, "A_hit_rate": 53.18, "A_n": 173, "A_bh_sharpe": 2.3261, "A_bh_return_pct": 43.81, "A_psr": 0.6202, "A_ic": 0.0393, "B_sharpe": 2.2183, "B_sortino": 2.5045, "B_excess_sharpe": -3.5277, "B_return_pct": 96.73, "B_hit_rate": 54.65, "B_n": 173, "B_bh_sharpe": 5.746, "B_bh_return_pct": 499.04, "B_psr": 0.9697, "B_ic": 0.0778, "D_sharpe": 2.3563, "D_sortino": 3.1196, "D_excess_sharpe": 0.0302, "D_return_pct": 44.56, "D_hit_rate": 49.13, "D_n": 173, "D_bh_sharpe": 2.3261, "D_bh_return_pct": 43.81, "D_psr": 0.9802, "D_ic": 0.0262, "sharpe": 0.3713, "sortino": 0.3591, "return_pct": 4.25, "equity": 1042.5, "max_dd": 0.0, "win_rate": 53.18, "profit_factor": 0.0, "ic": 0.0393, "hit": 53.18, "psr": 0.6202, "bh_sharpe": 2.3261, "bh_return_pct": 43.81, "excess_sharpe": -1.9548, "precision": 0.6569, "recall": 0.5929, "f1": 0.6233, "f2": 0.6047, "accuracy": 0.5318, "mcc": 0.0093, "tp": 67, "fp": 35, "tn": 25, "fn": 46, "A_precision": 0.6569, "A_recall": 0.5929, "A_f1": 0.6233, "A_f2": 0.6047, "A_accuracy": 0.5318, "A_mcc": 0.0093, "A_tp": 67, "A_fp": 35, "A_tn": 25, "A_fn": 46}, {"fold": "fold_7", "regime": "Inflation bear, AI rally and 2025", "n": 376, "A_sharpe": -0.1394, "A_sortino": -0.1574, "A_excess_sharpe": -0.9427, "A_return_pct": -8.04, "A_hit_rate": 46.81, "A_n": 376, "A_bh_sharpe": 0.8033, "A_bh_return_pct": 26.02, "A_psr": 0.4329, "A_ic": 0.0141, "B_sharpe": -0.5797, "B_sortino": -0.6466, "B_excess_sharpe": -2.5114, "B_return_pct": -43.04, "B_hit_rate": 42.93, "B_n": 376, "B_bh_sharpe": 1.9317, "B_bh_return_pct": 222.05, "B_psr": 0.242, "B_ic": -0.0303, "D_sharpe": 0.1854, "D_sortino": 0.2414, "D_excess_sharpe": -0.6179, "D_return_pct": 2.55, "D_hit_rate": 43.09, "D_n": 376, "D_bh_sharpe": 0.8033, "D_bh_return_pct": 26.02, "D_psr": 0.5905, "D_ic": -0.0333, "sharpe": -0.1394, "sortino": -0.1574, "return_pct": -8.04, "equity": 919.6, "max_dd": 0.0, "win_rate": 46.81, "profit_factor": 0.0, "ic": 0.0141, "hit": 46.81, "psr": 0.4329, "bh_sharpe": 0.8033, "bh_return_pct": 26.02, "excess_sharpe": -0.9427, "precision": 0.5946, "recall": 0.2986, "f1": 0.3976, "f2": 0.3317, "accuracy": 0.4681, "mcc": 0.009, "tp": 66, "fp": 45, "tn": 110, "fn": 155, "A_precision": 0.5946, "A_recall": 0.2986, "A_f1": 0.3976, "A_f2": 0.3317, "A_accuracy": 0.4681, "A_mcc": 0.009, "A_tp": 66, "A_fp": 45, "A_tn": 110, "A_fn": 155}], "per_window_val": [{"fold": "fold_1", "regime": "GFC peak crash (Lehman + Mar-2009 bottom)", "n": 65, "A_sharpe": -3.0404, "A_sortino": -2.7437, "A_excess_sharpe": -0.8147, "A_return_pct": -24.1, "A_hit_rate": 41.27, "A_n": 65, "A_bh_sharpe": -2.2257, "A_bh_return_pct": -18.74, "A_psr": 0.0563, "A_ic": 0.0344, "B_sharpe": -2.2605, "B_sortino": -2.1924, "B_excess_sharpe": 4.8618, "B_return_pct": -39.18, "B_hit_rate": 44.62, "B_n": 65, "B_bh_sharpe": -7.1223, "B_bh_return_pct": -73.11, "B_psr": 0.1364, "B_ic": 0.2828, "D_sharpe": -1.7033, "D_sortino": -1.422, "D_excess_sharpe": 0.5224, "D_return_pct": -15.04, "D_hit_rate": 49.21, "D_n": 65, "D_bh_sharpe": -2.2257, "D_bh_return_pct": -18.74, "D_psr": 0.1825, "D_ic": 0.1873, "sharpe": -3.0404, "sortino": -2.7437, "return_pct": -24.1, "equity": 759.0, "max_dd": 0.0, "win_rate": 41.27, "profit_factor": 0.0, "ic": 0.0344, "hit": 41.27, "psr": 0.0563, "bh_sharpe": -2.2257, "bh_return_pct": -18.74, "excess_sharpe": -0.8147}, {"fold": "fold_2", "regime": "2011 US-downgrade + EU debt", "n": 47, "A_sharpe": -1.3306, "A_sortino": -1.1199, "A_excess_sharpe": -1.1365, "A_return_pct": -9.27, "A_hit_rate": 53.19, "A_n": 47, "A_bh_sharpe": -0.1941, "A_bh_return_pct": -2.36, "A_psr": 0.2801, "A_ic": -0.1473, "B_sharpe": -1.6123, "B_sortino": -1.4959, "B_excess_sharpe": 0.0, "B_return_pct": -24.3, "B_hit_rate": 44.68, "B_n": 47, "B_bh_sharpe": -1.6123, "B_bh_return_pct": -24.3, "B_psr": 0.2404, "B_ic": 0.417, "D_sharpe": -0.1941, "D_sortino": -0.1694, "D_excess_sharpe": 0.0, "D_return_pct": -2.36, "D_hit_rate": 55.32, "D_n": 47, "D_bh_sharpe": -0.1941, "D_bh_return_pct": -2.36, "D_psr": 0.4669, "D_ic": 0.1595, "sharpe": -1.3306, "sortino": -1.1199, "return_pct": -9.27, "equity": 907.3, "max_dd": 0.0, "win_rate": 53.19, "profit_factor": 0.0, "ic": -0.1473, "hit": 53.19, "psr": 0.2801, "bh_sharpe": -0.1941, "bh_return_pct": -2.36, "excess_sharpe": -1.1365}, {"fold": "fold_3", "regime": "Taper tantrum and 2014 H1", "n": 5, "A_sharpe": -1.3194, "A_sortino": -1.3491, "A_excess_sharpe": 0.0, "A_return_pct": -0.21, "A_hit_rate": 40.0, "A_n": 5, "A_bh_sharpe": -1.3194, "A_bh_return_pct": -0.21, "A_psr": 0.4337, "A_ic": 0.3, "B_sharpe": -25.8705, "B_sortino": -13.5303, "B_excess_sharpe": 0.0, "B_return_pct": -3.84, "B_hit_rate": 0.0, "B_n": 5, "B_bh_sharpe": -25.8705, "B_bh_return_pct": -3.84, "B_psr": 0.0, "B_ic": -0.2, "D_sharpe": -1.3194, "D_sortino": -1.3491, "D_excess_sharpe": 0.0, "D_return_pct": -0.21, "D_hit_rate": 40.0, "D_n": 5, "D_bh_sharpe": -1.3194, "D_bh_return_pct": -0.21, "D_psr": 0.4337, "D_ic": -0.3, "sharpe": -1.3194, "sortino": -1.3491, "return_pct": -0.21, "equity": 997.9, "max_dd": 0.0, "win_rate": 40.0, "profit_factor": 0.0, "ic": 0.3, "hit": 40.0, "psr": 0.4337, "bh_sharpe": -1.3194, "bh_return_pct": -0.21, "excess_sharpe": 0.0}, {"fold": "fold_4", "regime": "China devaluation and oil crash", "n": 47, "A_sharpe": -0.6131, "A_sortino": -0.6024, "A_excess_sharpe": 1.2107, "A_return_pct": -3.4, "A_hit_rate": 46.81, "A_n": 47, "A_bh_sharpe": -1.8238, "A_bh_return_pct": -8.68, "A_psr": 0.3966, "A_ic": -0.2417, "B_sharpe": -2.22, "B_sortino": -1.9053, "B_excess_sharpe": 0.0, "B_return_pct": -23.98, "B_hit_rate": 44.68, "B_n": 47, "B_bh_sharpe": -2.22, "B_bh_return_pct": -23.98, "B_psr": 0.1505, "B_ic": 0.4214, "D_sharpe": -1.8238, "D_sortino": -1.7153, "D_excess_sharpe": 0.0, "D_return_pct": -8.68, "D_hit_rate": 44.68, "D_n": 47, "D_bh_sharpe": -1.8238, "D_bh_return_pct": -8.68, "D_psr": 0.2173, "D_ic": 0.2769, "sharpe": -0.6131, "sortino": -0.6024, "return_pct": -3.4, "equity": 966.0, "max_dd": 0.0, "win_rate": 46.81, "profit_factor": 0.0, "ic": -0.2417, "hit": 46.81, "psr": 0.3966, "bh_sharpe": -1.8238, "bh_return_pct": -8.68, "excess_sharpe": 1.2107}, {"fold": "fold_5", "regime": "2018 Vol-mageddon + Q4 sell-off", "n": 5, "A_sharpe": -0.8674, "A_sortino": -0.7054, "A_excess_sharpe": 9.2695, "A_return_pct": -0.36, "A_hit_rate": 60.0, "A_n": 5, "A_bh_sharpe": -10.1368, "A_bh_return_pct": -3.15, "A_psr": 0.4563, "A_ic": 0.2, "B_sharpe": 5.6858, "B_sortino": 6.0578, "B_excess_sharpe": 0.0, "B_return_pct": 4.22, "B_hit_rate": 60.0, "B_n": 5, "B_bh_sharpe": 5.6858, "B_bh_return_pct": 4.22, "B_psr": 0.753, "B_ic": -0.3, "D_sharpe": -10.1368, "D_sortino": -6.9937, "D_excess_sharpe": 0.0, "D_return_pct": -3.15, "D_hit_rate": 40.0, "D_n": 5, "D_bh_sharpe": -10.1368, "D_bh_return_pct": -3.15, "D_psr": 0.0985, "D_ic": -0.6, "sharpe": -0.8674, "sortino": -0.7054, "return_pct": -0.36, "equity": 996.4, "max_dd": 0.0, "win_rate": 60.0, "profit_factor": 0.0, "ic": 0.2, "hit": 60.0, "psr": 0.4563, "bh_sharpe": -10.1368, "bh_return_pct": -3.15, "excess_sharpe": 9.2695}, {"fold": "fold_6", "regime": "COVID crash and V-recovery", "n": 26, "A_sharpe": 4.0988, "A_sortino": 4.3059, "A_excess_sharpe": 0.8137, "A_return_pct": 6.01, "A_hit_rate": 61.54, "A_n": 26, "A_bh_sharpe": 3.2852, "A_bh_return_pct": 4.82, "A_psr": 0.8993, "A_ic": -0.0116, "B_sharpe": 7.9797, "B_sortino": 7.1242, "B_excess_sharpe": -4.9995, "B_return_pct": 25.97, "B_hit_rate": 76.92, "B_n": 26, "B_bh_sharpe": 12.9792, "B_bh_return_pct": 38.76, "B_psr": 0.989, "B_ic": 0.0605, "D_sharpe": 0.772, "D_sortino": 0.7777, "D_excess_sharpe": -2.5132, "D_return_pct": 1.05, "D_hit_rate": 50.0, "D_n": 26, "D_bh_sharpe": 3.2852, "D_bh_return_pct": 4.82, "D_psr": 0.5955, "D_ic": -0.054, "sharpe": 4.0988, "sortino": 4.3059, "return_pct": 6.01, "equity": 1060.1000000000001, "max_dd": 0.0, "win_rate": 61.54, "profit_factor": 0.0, "ic": -0.0116, "hit": 61.54, "psr": 0.8993, "bh_sharpe": 3.2852, "bh_return_pct": 4.82, "excess_sharpe": 0.8137}, {"fold": "fold_7", "regime": "Inflation bear, AI rally and 2025", "n": 65, "A_sharpe": -1.1561, "A_sortino": -1.1107, "A_excess_sharpe": -3.235, "A_return_pct": -4.75, "A_hit_rate": 49.23, "A_n": 65, "A_bh_sharpe": 2.0789, "A_bh_return_pct": 8.17, "A_psr": 0.2815, "A_ic": -0.0949, "B_sharpe": -5.2314, "B_sortino": -4.8393, "B_excess_sharpe": -10.4628, "B_return_pct": -32.36, "B_hit_rate": 32.31, "B_n": 65, "B_bh_sharpe": 5.2314, "B_bh_return_pct": 44.53, "B_psr": 0.0054, "B_ic": 0.1692, "D_sharpe": -2.0789, "D_sortino": -1.8995, "D_excess_sharpe": -4.1578, "D_return_pct": -8.11, "D_hit_rate": 46.15, "D_n": 65, "D_bh_sharpe": 2.0789, "D_bh_return_pct": 8.17, "D_psr": 0.1438, "D_ic": 0.1242, "sharpe": -1.1561, "sortino": -1.1107, "return_pct": -4.75, "equity": 952.5, "max_dd": 0.0, "win_rate": 49.23, "profit_factor": 0.0, "ic": -0.0949, "hit": 49.23, "psr": 0.2815, "bh_sharpe": 2.0789, "bh_return_pct": 8.17, "excess_sharpe": -3.235}], "status": "DISCARD", "precision": 0.5968, "recall": 0.5364, "f1": 0.565, "f2": 0.5475, "accuracy": 0.5108, "mcc": 0.0098, "tp": 339, "fp": 229, "tn": 206, "fn": 293, "test_sharpe": 0.5694, "A_sharpe": 0.5694, "A_excess_sharpe": -0.6499, "A_return_pct": 54.77, "A_precision": 0.5968, "A_recall": 0.5364, "A_f1": 0.565, "A_f2": 0.5475, "A_accuracy": 0.5108, "A_mcc": 0.0098, "A_tp": 339, "A_fp": 229, "A_tn": 206, "A_fn": 293, "A_psr": 0.8817, "A_ic": 0.0103, "A_hit_rate": 51.13, "A_bh_sharpe": 1.2194, "A_bh_return_pct": 187.05}
