{"experiment_num": 53, "backbone": "mamba", "description": "dMamba @ exp 52 d_state=64 (up from 32) - Gu-Dao 2024 upper canonical SSM state range", "config": {"seq_len": 60, "lr": 0.0005, "batch_size": 32, "epochs": 100, "weight_decay": 0.1, "patience": 20, "warmup_epochs": 10, "head_dropout": 0.1, "huber_delta": 1.0, "grad_clip": 1.0, "seed": 42, "hidden_size": null, "num_layers": null, "max_depth": null, "gbm_lr": null, "n_estimators": null}, "composite": -0.725, "test_pos_folds": 3, "val_pos_folds": 3, "val_loss": -2.8347556654330903, "elapsed_sec": 664.4, "timestamp": "2026-04-27T20:55:18", "sharpe": -0.325, "val_sharpe": 0.1635, "ic": 0.0842, "hit": 42.86, "psr": 0.2543, "equity": 659.8, "return_pct": -34.02, "bh_sharpe": 1.2201, "bh_return_pct": 185.59, "excess_sharpe": -1.5451, "B_sharpe": -1.7473, "B_excess_sharpe": -4.5857, "B_return_pct": -97.9, "D_sharpe": -0.325, "D_excess_sharpe": -1.5451, "D_return_pct": -34.02, "per_window": [{"fold": "fold_1", "regime": "GFC peak crash (Lehman + Mar-2009 bottom)", "n": 65, "A_sharpe": 0.2211, "A_sortino": 0.2151, "A_excess_sharpe": -0.2051, "A_return_pct": 0.31, "A_hit_rate": 49.23, "A_n": 65, "A_bh_sharpe": 0.4262, "A_bh_return_pct": 2.34, "A_psr": 0.5443, "A_ic": -0.0552, "B_sharpe": -4.9436, "B_sortino": -4.5721, "B_excess_sharpe": -6.8313, "B_return_pct": -63.72, "B_hit_rate": 32.81, "B_n": 65, "B_bh_sharpe": 1.8877, "B_bh_return_pct": 34.48, "B_psr": 0.0071, "B_ic": -0.1058, "D_sharpe": 0.2211, "D_sortino": 0.2151, "D_excess_sharpe": -0.2051, "D_return_pct": 0.31, "D_hit_rate": 49.23, "D_n": 65, "D_bh_sharpe": 0.4262, "D_bh_return_pct": 2.34, "D_psr": 0.5443, "D_ic": -0.0552, "sharpe": 0.2211, "sortino": 0.2151, "return_pct": 0.31, "equity": 1003.1000000000001, "max_dd": 0.0, "win_rate": 49.23, "profit_factor": 0.0, "ic": -0.0552, "hit": 49.23, "psr": 0.5443, "bh_sharpe": 0.4262, "bh_return_pct": 2.34, "excess_sharpe": -0.2051, "precision": 0.5714, "recall": 0.1176, "f1": 0.1951, "f2": 0.1399, "accuracy": 0.4923, "mcc": 0.0336, "tp": 4, "fp": 3, "tn": 28, "fn": 30, "A_precision": 0.5714, "A_recall": 0.1176, "A_f1": 0.1951, "A_f2": 0.1399, "A_accuracy": 0.4923, "A_mcc": 0.0336, "A_tp": 4, "A_fp": 3, "A_tn": 28, "A_fn": 30}, {"fold": "fold_2", "regime": "2011 US-downgrade + EU debt", "n": 86, "A_sharpe": -2.1244, "A_sortino": -2.157, "A_excess_sharpe": -6.9926, "A_return_pct": -11.09, "A_hit_rate": 41.18, "A_n": 86, "A_bh_sharpe": 4.8682, "A_bh_return_pct": 27.91, "A_psr": 0.1151, "A_ic": 0.0793, "B_sharpe": -4.3116, "B_sortino": -4.752, "B_excess_sharpe": -15.6307, "B_return_pct": -39.61, "B_hit_rate": 26.74, "B_n": 86, "B_bh_sharpe": 11.3191, "B_bh_return_pct": 186.84, "B_psr": 0.0137, "B_ic": 0.1539, "D_sharpe": -2.1244, "D_sortino": -2.157, "D_excess_sharpe": -6.9926, "D_return_pct": -11.09, "D_hit_rate": 41.18, "D_n": 86, "D_bh_sharpe": 4.8682, "D_bh_return_pct": 27.91, "D_psr": 0.1151, "D_ic": 0.0793, "sharpe": -2.1244, "sortino": -2.157, "return_pct": -11.09, "equity": 889.1, "max_dd": 0.0, "win_rate": 41.18, "profit_factor": 0.0, "ic": 0.0793, "hit": 41.18, "psr": 0.1151, "bh_sharpe": 4.8682, "bh_return_pct": 27.91, "excess_sharpe": -6.9926, "precision": 1.0, "recall": 0.0566, "f1": 0.1071, "f2": 0.0698, "accuracy": 0.4186, "mcc": 0.15, "tp": 3, "fp": 0, "tn": 33, "fn": 50, "A_precision": 1.0, "A_recall": 0.0566, "A_f1": 0.1071, "A_f2": 0.0698, "A_accuracy": 0.4186, "A_mcc": 0.15, "A_tp": 3, "A_fp": 0, "A_tn": 33, "A_fn": 50}, {"fold": "fold_3", "regime": "Taper tantrum and 2014 H1", "n": 128, "A_sharpe": -1.3217, "A_sortino": -1.5214, "A_excess_sharpe": -3.3806, "A_return_pct": -8.51, "A_hit_rate": 40.94, "A_n": 128, "A_bh_sharpe": 2.0589, "A_bh_return_pct": 13.6, "A_psr": 0.1844, "A_ic": -0.0532, "B_sharpe": -5.162, "B_sortino": -4.863, "B_excess_sharpe": -9.6736, "B_return_pct": -46.09, "B_hit_rate": 33.59, "B_n": 128, "B_bh_sharpe": 4.5116, "B_bh_return_pct": 67.92, "B_psr": 0.0003, "B_ic": -0.245, "D_sharpe": -1.3217, "D_sortino": -1.5214, "D_excess_sharpe": -3.3806, "D_return_pct": -8.51, "D_hit_rate": 40.94, "D_n": 128, "D_bh_sharpe": 2.0589, "D_bh_return_pct": 13.6, "D_psr": 0.1844, "D_ic": -0.0532, "sharpe": -1.3217, "sortino": -1.5214, "return_pct": -8.51, "equity": 914.9000000000001, "max_dd": 0.0, "win_rate": 40.94, "profit_factor": 0.0, "ic": -0.0532, "hit": 40.94, "psr": 0.1844, "bh_sharpe": 2.0589, "bh_return_pct": 13.6, "excess_sharpe": -3.3806, "precision": 0.8, "recall": 0.0513, "f1": 0.0964, "f2": 0.0631, "accuracy": 0.4141, "mcc": 0.0788, "tp": 4, "fp": 1, "tn": 49, "fn": 74, "A_precision": 0.8, "A_recall": 0.0513, "A_f1": 0.0964, "A_f2": 0.0631, "A_accuracy": 0.4141, "A_mcc": 0.0788, "A_tp": 4, "A_fp": 1, "A_tn": 49, "A_fn": 74}, {"fold": "fold_4", "regime": "China devaluation and oil crash", "n": 107, "A_sharpe": 0.2799, "A_sortino": 0.3026, "A_excess_sharpe": 1.0831, "A_return_pct": 1.56, "A_hit_rate": 47.17, "A_n": 107, "A_bh_sharpe": -0.8032, "A_bh_return_pct": -7.58, "A_psr": 0.5722, "A_ic": 0.0155, "B_sharpe": -0.3248, "B_sortino": -0.3736, "B_excess_sharpe": 1.6348, "B_return_pct": -9.71, "B_hit_rate": 43.93, "B_n": 107, "B_bh_sharpe": -1.9596, "B_bh_return_pct": -33.47, "B_psr": 0.4171, "B_ic": -0.0571, "D_sharpe": 0.2799, "D_sortino": 0.3026, "D_excess_sharpe": 1.0831, "D_return_pct": 1.56, "D_hit_rate": 47.17, "D_n": 107, "D_bh_sharpe": -0.8032, "D_bh_return_pct": -7.58, "D_psr": 0.5722, "D_ic": 0.0155, "sharpe": 0.2799, "sortino": 0.3026, "return_pct": 1.56, "equity": 1015.6, "max_dd": 0.0, "win_rate": 47.17, "profit_factor": 0.0, "ic": 0.0155, "hit": 47.17, "psr": 0.5722, "bh_sharpe": -0.8032, "bh_return_pct": -7.58, "excess_sharpe": 1.0831, "precision": 0.3913, "recall": 0.1731, "f1": 0.24, "f2": 0.1948, "accuracy": 0.4673, "mcc": -0.0991, "tp": 9, "fp": 14, "tn": 41, "fn": 43, "A_precision": 0.3913, "A_recall": 0.1731, "A_f1": 0.24, "A_f2": 0.1948, "A_accuracy": 0.4673, "A_mcc": -0.0991, "A_tp": 9, "A_fp": 14, "A_tn": 41, "A_fn": 43}, {"fold": "fold_5", "regime": "2018 Vol-mageddon + Q4 sell-off", "n": 127, "A_sharpe": -0.3034, "A_sortino": -0.3683, "A_excess_sharpe": -1.4864, "A_return_pct": -4.92, "A_hit_rate": 40.16, "A_n": 127, "A_bh_sharpe": 1.183, "A_bh_return_pct": 13.55, "A_psr": 0.4157, "A_ic": 0.0513, "B_sharpe": 0.3208, "B_sortino": 0.4052, "B_excess_sharpe": -2.5848, "B_return_pct": 2.16, "B_hit_rate": 42.06, "B_n": 127, "B_bh_sharpe": 2.9056, "B_bh_return_pct": 85.51, "B_psr": 0.5905, "B_ic": 0.1056, "D_sharpe": -0.3034, "D_sortino": -0.3683, "D_excess_sharpe": -1.4864, "D_return_pct": -4.92, "D_hit_rate": 40.16, "D_n": 127, "D_bh_sharpe": 1.183, "D_bh_return_pct": 13.55, "D_psr": 0.4157, "D_ic": 0.0513, "sharpe": -0.3034, "sortino": -0.3683, "return_pct": -4.92, "equity": 950.8, "max_dd": 0.0, "win_rate": 40.16, "profit_factor": 0.0, "ic": 0.0513, "hit": 40.16, "psr": 0.4157, "bh_sharpe": 1.183, "bh_return_pct": 13.55, "excess_sharpe": -1.4864, "precision": 0.5556, "recall": 0.1282, "f1": 0.2083, "f2": 0.1515, "accuracy": 0.4016, "mcc": -0.0489, "tp": 10, "fp": 8, "tn": 41, "fn": 68, "A_precision": 0.5556, "A_recall": 0.1282, "A_f1": 0.2083, "A_f2": 0.1515, "A_accuracy": 0.4016, "A_mcc": -0.0489, "A_tp": 10, "A_fp": 8, "A_tn": 41, "A_fn": 68}, {"fold": "fold_6", "regime": "COVID crash and V-recovery", "n": 172, "A_sharpe": 1.0103, "A_sortino": 1.2188, "A_excess_sharpe": -1.4173, "A_return_pct": 15.86, "A_hit_rate": 45.35, "A_n": 172, "A_bh_sharpe": 2.4276, "A_bh_return_pct": 45.89, "A_psr": 0.8013, "A_ic": 0.2269, "B_sharpe": -2.5355, "B_sortino": -2.4634, "B_excess_sharpe": -8.2475, "B_return_pct": -61.51, "B_hit_rate": 43.86, "B_n": 172, "B_bh_sharpe": 5.712, "B_bh_return_pct": 489.18, "B_psr": 0.0216, "B_ic": 0.0557, "D_sharpe": 1.0103, "D_sortino": 1.2188, "D_excess_sharpe": -1.4173, "D_return_pct": 15.86, "D_hit_rate": 45.35, "D_n": 172, "D_bh_sharpe": 2.4276, "D_bh_return_pct": 45.89, "D_psr": 0.8013, "D_ic": 0.2269, "sharpe": 1.0103, "sortino": 1.2188, "return_pct": 15.86, "equity": 1158.6000000000001, "max_dd": 0.0, "win_rate": 45.35, "profit_factor": 0.0, "ic": 0.2269, "hit": 45.35, "psr": 0.8013, "bh_sharpe": 2.4276, "bh_return_pct": 45.89, "excess_sharpe": -1.4173, "precision": 0.8276, "recall": 0.2124, "f1": 0.338, "f2": 0.2495, "accuracy": 0.4535, "mcc": 0.1618, "tp": 24, "fp": 5, "tn": 54, "fn": 89, "A_precision": 0.8276, "A_recall": 0.2124, "A_f1": 0.338, "A_f2": 0.2495, "A_accuracy": 0.4535, "A_mcc": 0.1618, "A_tp": 24, "A_fp": 5, "A_tn": 54, "A_fn": 89}, {"fold": "fold_7", "regime": "Inflation bear, AI rally and 2025", "n": 375, "A_sharpe": -0.8609, "A_sortino": -1.0161, "A_excess_sharpe": -1.6514, "A_return_pct": -27.72, "A_hit_rate": 41.33, "A_n": 375, "A_bh_sharpe": 0.7905, "A_bh_return_pct": 25.44, "A_psr": 0.1582, "A_ic": 0.1391, "B_sharpe": -0.7644, "B_sortino": -0.8661, "B_excess_sharpe": -2.6982, "B_return_pct": -49.83, "B_hit_rate": 41.44, "B_n": 375, "B_bh_sharpe": 1.9338, "B_bh_return_pct": 221.94, "B_psr": 0.1796, "B_ic": -0.0605, "D_sharpe": -0.8609, "D_sortino": -1.0161, "D_excess_sharpe": -1.6514, "D_return_pct": -27.72, "D_hit_rate": 41.33, "D_n": 375, "D_bh_sharpe": 0.7905, "D_bh_return_pct": 25.44, "D_psr": 0.1582, "D_ic": 0.1391, "sharpe": -0.8609, "sortino": -1.0161, "return_pct": -27.72, "equity": 722.8, "max_dd": 0.0, "win_rate": 41.33, "profit_factor": 0.0, "ic": 0.1391, "hit": 41.33, "psr": 0.1582, "bh_sharpe": 0.7905, "bh_return_pct": 25.44, "excess_sharpe": -1.6514, "precision": 0.5, "recall": 0.05, "f1": 0.0909, "f2": 0.061, "accuracy": 0.4133, "mcc": -0.0439, "tp": 11, "fp": 11, "tn": 144, "fn": 209, "A_precision": 0.5, "A_recall": 0.05, "A_f1": 0.0909, "A_f2": 0.061, "A_accuracy": 0.4133, "A_mcc": -0.0439, "A_tp": 11, "A_fp": 11, "A_tn": 144, "A_fn": 209}], "per_window_val": [{"fold": "fold_1", "regime": "GFC peak crash (Lehman + Mar-2009 bottom)", "n": 37, "A_sharpe": 2.8419, "A_sortino": 3.4339, "A_excess_sharpe": 2.0834, "A_return_pct": 10.54, "A_hit_rate": 51.43, "A_n": 37, "A_bh_sharpe": 0.7585, "A_bh_return_pct": 2.39, "A_psr": 0.8667, "A_ic": 0.2369, "B_sharpe": 3.4019, "B_sortino": 4.1629, "B_excess_sharpe": 1.2573, "B_return_pct": 20.45, "B_hit_rate": 56.76, "B_n": 37, "B_bh_sharpe": 2.1447, "B_bh_return_pct": 12.13, "B_psr": 0.9135, "B_ic": 0.0856, "D_sharpe": 2.8419, "D_sortino": 3.4339, "D_excess_sharpe": 2.0834, "D_return_pct": 10.54, "D_hit_rate": 51.43, "D_n": 37, "D_bh_sharpe": 0.7585, "D_bh_return_pct": 2.39, "D_psr": 0.8667, "D_ic": 0.2369, "sharpe": 2.8419, "sortino": 3.4339, "return_pct": 10.54, "equity": 1105.3999999999999, "max_dd": 0.0, "win_rate": 51.43, "profit_factor": 0.0, "ic": 0.2369, "hit": 51.43, "psr": 0.8667, "bh_sharpe": 0.7585, "bh_return_pct": 2.39, "excess_sharpe": 2.0834}, {"fold": "fold_2", "regime": "2011 US-downgrade + EU debt", "n": 46, "A_sharpe": 0.2791, "A_sortino": 0.3234, "A_excess_sharpe": 0.333, "A_return_pct": 0.67, "A_hit_rate": 43.48, "A_n": 46, "A_bh_sharpe": -0.0539, "A_bh_return_pct": -1.46, "A_psr": 0.5471, "A_ic": 0.1294, "B_sharpe": 3.1773, "B_sortino": 3.4402, "B_excess_sharpe": 4.7186, "B_return_pct": 46.14, "B_hit_rate": 58.7, "B_n": 46, "B_bh_sharpe": -1.5413, "B_bh_return_pct": -23.36, "B_psr": 0.9117, "B_ic": 0.0665, "D_sharpe": 0.2791, "D_sortino": 0.3234, "D_excess_sharpe": 0.333, "D_return_pct": 0.67, "D_hit_rate": 43.48, "D_n": 46, "D_bh_sharpe": -0.0539, "D_bh_return_pct": -1.46, "D_psr": 0.5471, "D_ic": 0.1294, "sharpe": 0.2791, "sortino": 0.3234, "return_pct": 0.67, "equity": 1006.6999999999999, "max_dd": 0.0, "win_rate": 43.48, "profit_factor": 0.0, "ic": 0.1294, "hit": 43.48, "psr": 0.5471, "bh_sharpe": -0.0539, "bh_return_pct": -1.46, "excess_sharpe": 0.333}, {"fold": "fold_3", "regime": "Taper tantrum and 2014 H1", "n": 4, "A_sharpe": -6.3226, "A_sortino": -4.4732, "A_excess_sharpe": -12.6451, "A_return_pct": -0.58, "A_hit_rate": 50.0, "A_n": 4, "A_bh_sharpe": 6.3226, "A_bh_return_pct": 0.58, "A_psr": 0.227, "A_ic": 0.6, "B_sharpe": 23.4413, "B_sortino": 0.0, "B_excess_sharpe": 46.8826, "B_return_pct": 3.19, "B_hit_rate": 100.0, "B_n": 4, "B_bh_sharpe": -23.4413, "B_bh_return_pct": -3.13, "B_psr": 1.0, "B_ic": 0.8, "D_sharpe": -6.3226, "D_sortino": -4.4732, "D_excess_sharpe": -12.6451, "D_return_pct": -0.58, "D_hit_rate": 50.0, "D_n": 4, "D_bh_sharpe": 6.3226, "D_bh_return_pct": 0.58, "D_psr": 0.227, "D_ic": 0.6, "sharpe": -6.3226, "sortino": -4.4732, "return_pct": -0.58, "equity": 994.1999999999999, "max_dd": 0.0, "win_rate": 50.0, "profit_factor": 0.0, "ic": 0.6, "hit": 50.0, "psr": 0.227, "bh_sharpe": 6.3226, "bh_return_pct": 0.58, "excess_sharpe": -12.6451}, {"fold": "fold_4", "regime": "China devaluation and oil crash", "n": 46, "A_sharpe": -0.5364, "A_sortino": -0.556, "A_excess_sharpe": 0.6658, "A_return_pct": -2.87, "A_hit_rate": 43.48, "A_n": 46, "A_bh_sharpe": -1.2022, "A_bh_return_pct": -5.68, "A_psr": 0.4104, "A_ic": 0.0261, "B_sharpe": 5.5057, "B_sortino": 6.9155, "B_excess_sharpe": 7.8174, "B_return_pct": 70.28, "B_hit_rate": 67.39, "B_n": 46, "B_bh_sharpe": -2.3118, "B_bh_return_pct": -24.51, "B_psr": 0.9966, "B_ic": 0.366, "D_sharpe": -0.5364, "D_sortino": -0.556, "D_excess_sharpe": 0.6658, "D_return_pct": -2.87, "D_hit_rate": 43.48, "D_n": 46, "D_bh_sharpe": -1.2022, "D_bh_return_pct": -5.68, "D_psr": 0.4104, "D_ic": 0.0261, "sharpe": -0.5364, "sortino": -0.556, "return_pct": -2.87, "equity": 971.3000000000001, "max_dd": 0.0, "win_rate": 43.48, "profit_factor": 0.0, "ic": 0.0261, "hit": 43.48, "psr": 0.4104, "bh_sharpe": -1.2022, "bh_return_pct": -5.68, "excess_sharpe": 0.6658}, {"fold": "fold_5", "regime": "2018 Vol-mageddon + Q4 sell-off", "n": 4, "A_sharpe": 14.7551, "A_sortino": 18.4635, "A_excess_sharpe": 29.5102, "A_return_pct": 0.0, "A_hit_rate": 0.0, "A_n": 4, "A_bh_sharpe": -14.7551, "A_bh_return_pct": -3.52, "A_psr": 0.9192, "A_ic": 0.4, "B_sharpe": -2.1566, "B_sortino": -2.0033, "B_excess_sharpe": -4.3132, "B_return_pct": -1.41, "B_hit_rate": 50.0, "B_n": 4, "B_bh_sharpe": 2.1566, "B_bh_return_pct": 1.19, "B_psr": 0.4075, "B_ic": -1.0, "D_sharpe": 14.7551, "D_sortino": 18.4635, "D_excess_sharpe": 29.5102, "D_return_pct": 0.0, "D_hit_rate": 0.0, "D_n": 4, "D_bh_sharpe": -14.7551, "D_bh_return_pct": -3.52, "D_psr": 0.9192, "D_ic": 0.4, "sharpe": 14.7551, "sortino": 18.4635, "return_pct": 0.0, "equity": 1000.0, "max_dd": 0.0, "win_rate": 0.0, "profit_factor": 0.0, "ic": 0.4, "hit": 0.0, "psr": 0.9192, "bh_sharpe": -14.7551, "bh_return_pct": -3.52, "excess_sharpe": 29.5102}, {"fold": "fold_6", "regime": "COVID crash and V-recovery", "n": 25, "A_sharpe": -2.4138, "A_sortino": -2.536, "A_excess_sharpe": -4.8276, "A_return_pct": -3.36, "A_hit_rate": 40.0, "A_n": 25, "A_bh_sharpe": 2.4138, "A_bh_return_pct": 3.27, "A_psr": 0.2373, "A_ic": 0.1585, "B_sharpe": -12.5655, "B_sortino": -9.4213, "B_excess_sharpe": -25.1309, "B_return_pct": -25.32, "B_hit_rate": 20.0, "B_n": 25, "B_bh_sharpe": 12.5655, "B_bh_return_pct": 32.76, "B_psr": 0.001, "B_ic": 0.5454, "D_sharpe": -2.4138, "D_sortino": -2.536, "D_excess_sharpe": -4.8276, "D_return_pct": -3.36, "D_hit_rate": 40.0, "D_n": 25, "D_bh_sharpe": 2.4138, "D_bh_return_pct": 3.27, "D_psr": 0.2373, "D_ic": 0.1585, "sharpe": -2.4138, "sortino": -2.536, "return_pct": -3.36, "equity": 966.4000000000001, "max_dd": 0.0, "win_rate": 40.0, "profit_factor": 0.0, "ic": 0.1585, "hit": 40.0, "psr": 0.2373, "bh_sharpe": 2.4138, "bh_return_pct": 3.27, "excess_sharpe": -4.8276}, {"fold": "fold_7", "regime": "Inflation bear, AI rally and 2025", "n": 64, "A_sharpe": -1.5475, "A_sortino": -1.4058, "A_excess_sharpe": -3.5883, "A_return_pct": -6.15, "A_hit_rate": 48.44, "A_n": 64, "A_bh_sharpe": 2.0409, "A_bh_return_pct": 7.94, "A_psr": 0.2163, "A_ic": -0.019, "B_sharpe": -5.1672, "B_sortino": -4.7701, "B_excess_sharpe": -10.5764, "B_return_pct": -31.84, "B_hit_rate": 32.81, "B_n": 64, "B_bh_sharpe": 5.4092, "B_bh_return_pct": 45.7, "B_psr": 0.0061, "B_ic": 0.0351, "D_sharpe": -1.5475, "D_sortino": -1.4058, "D_excess_sharpe": -3.5883, "D_return_pct": -6.15, "D_hit_rate": 48.44, "D_n": 64, "D_bh_sharpe": 2.0409, "D_bh_return_pct": 7.94, "D_psr": 0.2163, "D_ic": -0.019, "sharpe": -1.5475, "sortino": -1.4058, "return_pct": -6.15, "equity": 938.5, "max_dd": 0.0, "win_rate": 48.44, "profit_factor": 0.0, "ic": -0.019, "hit": 48.44, "psr": 0.2163, "bh_sharpe": 2.0409, "bh_return_pct": 7.94, "excess_sharpe": -3.5883}], "status": "DISCARD", "precision": 0.6075, "recall": 0.1035, "f1": 0.1769, "f2": 0.1241, "accuracy": 0.4292, "mcc": 0.0102, "tp": 65, "fp": 42, "tn": 390, "fn": 563, "test_sharpe": -0.325, "A_sharpe": -0.325, "A_excess_sharpe": -1.5451, "A_return_pct": -34.02, "A_precision": 0.6075, "A_recall": 0.1035, "A_f1": 0.1769, "A_f2": 0.1241, "A_accuracy": 0.4292, "A_mcc": 0.0102, "A_tp": 65, "A_fp": 42, "A_tn": 390, "A_fn": 563, "A_psr": 0.2543, "A_ic": 0.0842, "A_hit_rate": 42.86, "A_bh_sharpe": 1.2201, "A_bh_return_pct": 185.59}
