{"experiment_num": 7, "backbone": "mlp", "description": "MLP @ FX-Exp32 HPs seed=7 \u2014 multi-seed variance check on champion", "config": {"seq_len": 10, "lr": 0.0003, "batch_size": 32, "epochs": 50, "weight_decay": 1e-05, "patience": 10, "warmup_epochs": 0, "head_dropout": 0.25, "huber_delta": 1.0, "grad_clip": 1.0, "seed": 7, "hidden_size": null, "num_layers": null, "max_depth": null, "gbm_lr": null, "n_estimators": null}, "composite": -1.5001, "test_pos_folds": 4, "val_pos_folds": 1, "val_loss": -2.8875503387258186, "elapsed_sec": 38.6, "timestamp": "2026-04-26T14:57:55", "sharpe": -0.0343, "val_sharpe": -1.2001, "ic": -0.0082, "hit": 47.05, "psr": 0.4677, "equity": 772.5999999999999, "return_pct": -22.74, "bh_sharpe": 0.6042, "bh_return_pct": 103.49, "excess_sharpe": -0.6385, "B_sharpe": 0.3159, "B_excess_sharpe": -1.3849, "B_return_pct": 14.95, "D_sharpe": -0.0343, "D_excess_sharpe": -0.6385, "D_return_pct": -22.74, "per_window": [{"fold": "fold_1", "regime": "GFC peak crash (Lehman + Mar-2009 bottom)", "n": 115, "A_sharpe": 0.1079, "A_sortino": 0.1053, "A_excess_sharpe": 0.5521, "A_return_pct": -3.09, "A_hit_rate": 52.17, "A_n": 115, "A_bh_sharpe": -0.4441, "A_bh_return_pct": -14.4, "A_psr": 0.5289, "A_ic": -0.0751, "B_sharpe": 1.1458, "B_sortino": 1.09, "B_excess_sharpe": 1.4437, "B_return_pct": 32.95, "B_hit_rate": 56.14, "B_n": 115, "B_bh_sharpe": -0.2978, "B_bh_return_pct": -27.23, "B_psr": 0.7773, "B_ic": 0.2163, "D_sharpe": 0.1079, "D_sortino": 0.1053, "D_excess_sharpe": 0.5521, "D_return_pct": -3.09, "D_hit_rate": 52.17, "D_n": 115, "D_bh_sharpe": -0.4441, "D_bh_return_pct": -14.4, "D_psr": 0.5289, "D_ic": -0.0751, "sharpe": 0.1079, "sortino": 0.1053, "return_pct": -3.09, "equity": 969.0999999999999, "max_dd": 0.0, "win_rate": 52.17, "profit_factor": 0.0, "ic": -0.0751, "hit": 52.17, "psr": 0.5289, "bh_sharpe": -0.4441, "bh_return_pct": -14.4, "excess_sharpe": 0.5521}, {"fold": "fold_2", "regime": "2011 US-downgrade + EU debt", "n": 136, "A_sharpe": -0.8407, "A_sortino": -0.8051, "A_excess_sharpe": -2.5735, "A_return_pct": -9.96, "A_hit_rate": 47.41, "A_n": 136, "A_bh_sharpe": 1.7327, "A_bh_return_pct": 19.75, "A_psr": 0.2679, "A_ic": 0.0098, "B_sharpe": 2.5093, "B_sortino": 2.4629, "B_excess_sharpe": -1.5567, "B_return_pct": 73.8, "B_hit_rate": 61.76, "B_n": 136, "B_bh_sharpe": 4.0659, "B_bh_return_pct": 148.68, "B_psr": 0.9671, "B_ic": 0.0596, "D_sharpe": -0.8407, "D_sortino": -0.8051, "D_excess_sharpe": -2.5735, "D_return_pct": -9.96, "D_hit_rate": 47.41, "D_n": 136, "D_bh_sharpe": 1.7327, "D_bh_return_pct": 19.75, "D_psr": 0.2679, "D_ic": 0.0098, "sharpe": -0.8407, "sortino": -0.8051, "return_pct": -9.96, "equity": 900.4, "max_dd": 0.0, "win_rate": 47.41, "profit_factor": 0.0, "ic": 0.0098, "hit": 47.41, "psr": 0.2679, "bh_sharpe": 1.7327, "bh_return_pct": 19.75, "excess_sharpe": -2.5735}, {"fold": "fold_3", "regime": "Taper tantrum and 2014 H1", "n": 178, "A_sharpe": 2.7957, "A_sortino": 3.0282, "A_excess_sharpe": 1.4511, "A_return_pct": 27.98, "A_hit_rate": 59.32, "A_n": 178, "A_bh_sharpe": 1.3445, "A_bh_return_pct": 12.41, "A_psr": 0.9923, "A_ic": 0.1285, "B_sharpe": 5.1794, "B_sortino": 6.4255, "B_excess_sharpe": 2.1311, "B_return_pct": 147.64, "B_hit_rate": 59.55, "B_n": 178, "B_bh_sharpe": 3.0483, "B_bh_return_pct": 71.83, "B_psr": 1.0, "B_ic": 0.2937, "D_sharpe": 2.7957, "D_sortino": 3.0282, "D_excess_sharpe": 1.4511, "D_return_pct": 27.98, "D_hit_rate": 59.32, "D_n": 178, "D_bh_sharpe": 1.3445, "D_bh_return_pct": 12.41, "D_psr": 0.9923, "D_ic": 0.1285, "sharpe": 2.7957, "sortino": 3.0282, "return_pct": 27.98, "equity": 1279.8, "max_dd": 0.0, "win_rate": 59.32, "profit_factor": 0.0, "ic": 0.1285, "hit": 59.32, "psr": 0.9923, "bh_sharpe": 1.3445, "bh_return_pct": 12.41, "excess_sharpe": 1.4511}, {"fold": "fold_4", "regime": "China devaluation and oil crash", "n": 157, "A_sharpe": 0.6907, "A_sortino": 0.7421, "A_excess_sharpe": 0.6809, "A_return_pct": 7.44, "A_hit_rate": 50.64, "A_n": 157, "A_bh_sharpe": 0.0098, "A_bh_return_pct": -1.05, "A_psr": 0.7079, "A_ic": -0.0436, "B_sharpe": -0.6244, "B_sortino": -0.5978, "B_excess_sharpe": -0.6403, "B_return_pct": -20.66, "B_hit_rate": 48.41, "B_n": 157, "B_bh_sharpe": 0.0159, "B_bh_return_pct": -5.48, "B_psr": 0.3108, "B_ic": -0.0728, "D_sharpe": 0.6907, "D_sortino": 0.7421, "D_excess_sharpe": 0.6809, "D_return_pct": 7.44, "D_hit_rate": 50.64, "D_n": 157, "D_bh_sharpe": 0.0098, "D_bh_return_pct": -1.05, "D_psr": 0.7079, "D_ic": -0.0436, "sharpe": 0.6907, "sortino": 0.7421, "return_pct": 7.44, "equity": 1074.4, "max_dd": 0.0, "win_rate": 50.64, "profit_factor": 0.0, "ic": -0.0436, "hit": 50.64, "psr": 0.7079, "bh_sharpe": 0.0098, "bh_return_pct": -1.05, "excess_sharpe": 0.6809}, {"fold": "fold_5", "regime": "2018 Vol-mageddon + Q4 sell-off", "n": 177, "A_sharpe": 0.3488, "A_sortino": 0.3731, "A_excess_sharpe": 0.039, "A_return_pct": 3.85, "A_hit_rate": 48.59, "A_n": 177, "A_bh_sharpe": 0.3098, "A_bh_return_pct": 3.19, "A_psr": 0.6148, "A_ic": -0.0489, "B_sharpe": 0.3957, "B_sortino": 0.3656, "B_excess_sharpe": -0.4959, "B_return_pct": 5.4, "B_hit_rate": 53.41, "B_n": 177, "B_bh_sharpe": 0.8917, "B_bh_return_pct": 23.8, "B_psr": 0.6288, "B_ic": 0.0094, "D_sharpe": 0.3488, "D_sortino": 0.3731, "D_excess_sharpe": 0.039, "D_return_pct": 3.85, "D_hit_rate": 48.59, "D_n": 177, "D_bh_sharpe": 0.3098, "D_bh_return_pct": 3.19, "D_psr": 0.6148, "D_ic": -0.0489, "sharpe": 0.3488, "sortino": 0.3731, "return_pct": 3.85, "equity": 1038.5, "max_dd": 0.0, "win_rate": 48.59, "profit_factor": 0.0, "ic": -0.0489, "hit": 48.59, "psr": 0.6148, "bh_sharpe": 0.3098, "bh_return_pct": 3.19, "excess_sharpe": 0.039}, {"fold": "fold_6", "regime": "COVID crash and V-recovery", "n": 222, "A_sharpe": -0.0488, "A_sortino": -0.0592, "A_excess_sharpe": -0.9376, "A_return_pct": -7.56, "A_hit_rate": 40.99, "A_n": 222, "A_bh_sharpe": 0.8888, "A_bh_return_pct": 26.13, "A_psr": 0.4818, "A_ic": 0.1147, "B_sharpe": -0.7291, "B_sortino": -0.7029, "B_excess_sharpe": -3.1175, "B_return_pct": -48.63, "B_hit_rate": 47.96, "B_n": 222, "B_bh_sharpe": 2.3884, "B_bh_return_pct": 243.18, "B_psr": 0.2463, "B_ic": -0.0512, "D_sharpe": -0.0488, "D_sortino": -0.0592, "D_excess_sharpe": -0.9376, "D_return_pct": -7.56, "D_hit_rate": 40.99, "D_n": 222, "D_bh_sharpe": 0.8888, "D_bh_return_pct": 26.13, "D_psr": 0.4818, "D_ic": 0.1147, "sharpe": -0.0488, "sortino": -0.0592, "return_pct": -7.56, "equity": 924.4, "max_dd": 0.0, "win_rate": 40.99, "profit_factor": 0.0, "ic": 0.1147, "hit": 40.99, "psr": 0.4818, "bh_sharpe": 0.8888, "bh_return_pct": 26.13, "excess_sharpe": -0.9376}, {"fold": "fold_7", "regime": "Inflation bear, AI rally and 2025", "n": 425, "A_sharpe": -0.9824, "A_sortino": -1.0381, "A_excess_sharpe": -1.9538, "A_return_pct": -32.93, "A_hit_rate": 41.65, "A_n": 425, "A_bh_sharpe": 0.9715, "A_bh_return_pct": 37.12, "A_psr": 0.0986, "A_ic": 0.0019, "B_sharpe": -0.763, "B_sortino": -0.7239, "B_excess_sharpe": -3.2656, "B_return_pct": -53.24, "B_hit_rate": 49.06, "B_n": 425, "B_bh_sharpe": 2.5027, "B_bh_return_pct": 458.83, "B_psr": 0.1597, "B_ic": -0.0903, "D_sharpe": -0.9824, "D_sortino": -1.0381, "D_excess_sharpe": -1.9538, "D_return_pct": -32.93, "D_hit_rate": 41.65, "D_n": 425, "D_bh_sharpe": 0.9715, "D_bh_return_pct": 37.12, "D_psr": 0.0986, "D_ic": 0.0019, "sharpe": -0.9824, "sortino": -1.0381, "return_pct": -32.93, "equity": 670.7, "max_dd": 0.0, "win_rate": 41.65, "profit_factor": 0.0, "ic": 0.0019, "hit": 41.65, "psr": 0.0986, "bh_sharpe": 0.9715, "bh_return_pct": 37.12, "excess_sharpe": -1.9538}], "per_window_val": [{"fold": "fold_1", "regime": "GFC peak crash (Lehman + Mar-2009 bottom)", "n": 104, "A_sharpe": 1.4717, "A_sortino": 1.8319, "A_excess_sharpe": 1.6389, "A_return_pct": 17.53, "A_hit_rate": 50.0, "A_n": 104, "A_bh_sharpe": -0.1672, "A_bh_return_pct": -3.81, "A_psr": 0.8383, "A_ic": 0.0743, "B_sharpe": -4.6145, "B_sortino": -3.9619, "B_excess_sharpe": -2.3404, "B_return_pct": -66.11, "B_hit_rate": 38.83, "B_n": 104, "B_bh_sharpe": -2.2741, "B_bh_return_pct": -44.12, "B_psr": 0.0008, "B_ic": -0.1028, "D_sharpe": 1.4717, "D_sortino": 1.8319, "D_excess_sharpe": 1.6389, "D_return_pct": 17.53, "D_hit_rate": 50.0, "D_n": 104, "D_bh_sharpe": -0.1672, "D_bh_return_pct": -3.81, "D_psr": 0.8383, "D_ic": 0.0743, "sharpe": 1.4717, "sortino": 1.8319, "return_pct": 17.53, "equity": 1175.3, "max_dd": 0.0, "win_rate": 50.0, "profit_factor": 0.0, "ic": 0.0743, "hit": 50.0, "psr": 0.8383, "bh_sharpe": -0.1672, "bh_return_pct": -3.81, "excess_sharpe": 1.6389}, {"fold": "fold_2", "regime": "2011 US-downgrade + EU debt", "n": 96, "A_sharpe": -1.6662, "A_sortino": -1.5974, "A_excess_sharpe": -1.392, "A_return_pct": -16.72, "A_hit_rate": 44.21, "A_n": 96, "A_bh_sharpe": -0.2741, "A_bh_return_pct": -4.09, "A_psr": 0.1517, "A_ic": -0.1122, "B_sharpe": 1.8579, "B_sortino": 2.125, "B_excess_sharpe": 2.8853, "B_return_pct": 41.5, "B_hit_rate": 51.04, "B_n": 96, "B_bh_sharpe": -1.0274, "B_bh_return_pct": -25.58, "B_psr": 0.876, "B_ic": 0.1511, "D_sharpe": -1.6662, "D_sortino": -1.5974, "D_excess_sharpe": -1.392, "D_return_pct": -16.72, "D_hit_rate": 44.21, "D_n": 96, "D_bh_sharpe": -0.2741, "D_bh_return_pct": -4.09, "D_psr": 0.1517, "D_ic": -0.1122, "sharpe": -1.6662, "sortino": -1.5974, "return_pct": -16.72, "equity": 832.8, "max_dd": 0.0, "win_rate": 44.21, "profit_factor": 0.0, "ic": -0.1122, "hit": 44.21, "psr": 0.1517, "bh_sharpe": -0.2741, "bh_return_pct": -4.09, "excess_sharpe": -1.392}, {"fold": "fold_3", "regime": "Taper tantrum and 2014 H1", "n": 54, "A_sharpe": -2.5293, "A_sortino": -2.2958, "A_excess_sharpe": -7.2291, "A_return_pct": -5.54, "A_hit_rate": 42.59, "A_n": 54, "A_bh_sharpe": 4.6998, "A_bh_return_pct": 10.46, "A_psr": 0.1152, "A_ic": -0.0712, "B_sharpe": 6.0886, "B_sortino": 7.1312, "B_excess_sharpe": -2.944, "B_return_pct": 33.37, "B_hit_rate": 64.81, "B_n": 54, "B_bh_sharpe": 9.0326, "B_bh_return_pct": 49.18, "B_psr": 0.9974, "B_ic": -0.0135, "D_sharpe": -2.5293, "D_sortino": -2.2958, "D_excess_sharpe": -7.2291, "D_return_pct": -5.54, "D_hit_rate": 42.59, "D_n": 54, "D_bh_sharpe": 4.6998, "D_bh_return_pct": 10.46, "D_psr": 0.1152, "D_ic": -0.0712, "sharpe": -2.5293, "sortino": -2.2958, "return_pct": -5.54, "equity": 944.6, "max_dd": 0.0, "win_rate": 42.59, "profit_factor": 0.0, "ic": -0.0712, "hit": 42.59, "psr": 0.1152, "bh_sharpe": 4.6998, "bh_return_pct": 10.46, "excess_sharpe": -7.2291}, {"fold": "fold_4", "regime": "China devaluation and oil crash", "n": 96, "A_sharpe": -3.0969, "A_sortino": -2.5369, "A_excess_sharpe": -2.6727, "A_return_pct": -20.49, "A_hit_rate": 46.32, "A_n": 96, "A_bh_sharpe": -0.4241, "A_bh_return_pct": -3.73, "A_psr": 0.0167, "A_ic": -0.0594, "B_sharpe": -0.7476, "B_sortino": -0.6304, "B_excess_sharpe": 0.4367, "B_return_pct": -15.39, "B_hit_rate": 52.08, "B_n": 96, "B_bh_sharpe": -1.1843, "B_bh_return_pct": -21.44, "B_psr": 0.317, "B_ic": 0.1239, "D_sharpe": -3.0969, "D_sortino": -2.5369, "D_excess_sharpe": -2.6727, "D_return_pct": -20.49, "D_hit_rate": 46.32, "D_n": 96, "D_bh_sharpe": -0.4241, "D_bh_return_pct": -3.73, "D_psr": 0.0167, "D_ic": -0.0594, "sharpe": -3.0969, "sortino": -2.5369, "return_pct": -20.49, "equity": 795.1, "max_dd": 0.0, "win_rate": 46.32, "profit_factor": 0.0, "ic": -0.0594, "hit": 46.32, "psr": 0.0167, "bh_sharpe": -0.4241, "bh_return_pct": -3.73, "excess_sharpe": -2.6727}, {"fold": "fold_5", "regime": "2018 Vol-mageddon + Q4 sell-off", "n": 54, "A_sharpe": -0.6778, "A_sortino": -0.7241, "A_excess_sharpe": -2.1058, "A_return_pct": -2.11, "A_hit_rate": 42.59, "A_n": 54, "A_bh_sharpe": 1.428, "A_bh_return_pct": 3.97, "A_psr": 0.3785, "A_ic": -0.1289, "B_sharpe": -0.385, "B_sortino": -0.3452, "B_excess_sharpe": -5.3172, "B_return_pct": -3.48, "B_hit_rate": 55.56, "B_n": 54, "B_bh_sharpe": 4.9322, "B_bh_return_pct": 34.93, "B_psr": 0.4298, "B_ic": -0.2252, "D_sharpe": -0.6778, "D_sortino": -0.7241, "D_excess_sharpe": -2.1058, "D_return_pct": -2.11, "D_hit_rate": 42.59, "D_n": 54, "D_bh_sharpe": 1.428, "D_bh_return_pct": 3.97, "D_psr": 0.3785, "D_ic": -0.1289, "sharpe": -0.6778, "sortino": -0.7241, "return_pct": -2.11, "equity": 978.9, "max_dd": 0.0, "win_rate": 42.59, "profit_factor": 0.0, "ic": -0.1289, "hit": 42.59, "psr": 0.3785, "bh_sharpe": 1.428, "bh_return_pct": 3.97, "excess_sharpe": -2.1058}, {"fold": "fold_6", "regime": "COVID crash and V-recovery", "n": 75, "A_sharpe": -2.771, "A_sortino": -2.8085, "A_excess_sharpe": -7.0704, "A_return_pct": -8.9, "A_hit_rate": 38.67, "A_n": 75, "A_bh_sharpe": 4.2994, "A_bh_return_pct": 14.68, "A_psr": 0.0739, "A_ic": -0.0261, "B_sharpe": 5.091, "B_sortino": 4.3464, "B_excess_sharpe": -9.2429, "B_return_pct": 42.53, "B_hit_rate": 70.67, "B_n": 75, "B_bh_sharpe": 14.3339, "B_bh_return_pct": 120.13, "B_psr": 0.9939, "B_ic": 0.0112, "D_sharpe": -2.771, "D_sortino": -2.8085, "D_excess_sharpe": -7.0704, "D_return_pct": -8.9, "D_hit_rate": 38.67, "D_n": 75, "D_bh_sharpe": 4.2994, "D_bh_return_pct": 14.68, "D_psr": 0.0739, "D_ic": -0.0261, "sharpe": -2.771, "sortino": -2.8085, "return_pct": -8.9, "equity": 911.0, "max_dd": 0.0, "win_rate": 38.67, "profit_factor": 0.0, "ic": -0.0261, "hit": 38.67, "psr": 0.0739, "bh_sharpe": 4.2994, "bh_return_pct": 14.68, "excess_sharpe": -7.0704}, {"fold": "fold_7", "regime": "Inflation bear, AI rally and 2025", "n": 114, "A_sharpe": -2.8368, "A_sortino": -2.704, "A_excess_sharpe": -5.6818, "A_return_pct": -18.46, "A_hit_rate": 41.23, "A_n": 114, "A_bh_sharpe": 2.845, "A_bh_return_pct": 21.34, "A_psr": 0.0296, "A_ic": -0.0241, "B_sharpe": 0.2316, "B_sortino": 0.2432, "B_excess_sharpe": -5.905, "B_return_pct": 0.78, "B_hit_rate": 50.88, "B_n": 114, "B_bh_sharpe": 6.1366, "B_bh_return_pct": 155.03, "B_psr": 0.5618, "B_ic": -0.073, "D_sharpe": -2.8368, "D_sortino": -2.704, "D_excess_sharpe": -5.6818, "D_return_pct": -18.46, "D_hit_rate": 41.23, "D_n": 114, "D_bh_sharpe": 2.845, "D_bh_return_pct": 21.34, "D_psr": 0.0296, "D_ic": -0.0241, "sharpe": -2.8368, "sortino": -2.704, "return_pct": -18.46, "equity": 815.4, "max_dd": 0.0, "win_rate": 41.23, "profit_factor": 0.0, "ic": -0.0241, "hit": 41.23, "psr": 0.0296, "bh_sharpe": 2.845, "bh_return_pct": 21.34, "excess_sharpe": -5.6818}], "status": "DISCARD", "test_sharpe": -0.0343, "A_sharpe": -0.0343, "A_excess_sharpe": -0.6385, "A_return_pct": -22.74, "A_psr": 0.4677, "A_ic": -0.0082, "A_hit_rate": 47.05, "A_bh_sharpe": 0.6042, "A_bh_return_pct": 103.49}
