{"experiment_num": 48, "backbone": "mamba", "description": "dMamba @ exp 17 expand=2 (down from 4) - Gu-Dao 2024 paper default; QQQ regularisation test", "config": {"seq_len": 60, "lr": 0.0005, "batch_size": 32, "epochs": 100, "weight_decay": 0.1, "patience": 20, "warmup_epochs": 10, "head_dropout": 0.1, "huber_delta": 1.0, "grad_clip": 1.0, "seed": 42, "hidden_size": null, "num_layers": null, "max_depth": null, "gbm_lr": null, "n_estimators": null}, "composite": 1.1887, "test_pos_folds": 6, "val_pos_folds": 6, "val_loss": -2.8554521366558245, "elapsed_sec": 878.0, "timestamp": "2026-04-27T19:25:51", "sharpe": 1.2887, "val_sharpe": 2.073, "ic": 0.0792, "hit": 52.7, "psr": 0.9965, "equity": 3048.3, "return_pct": 204.83, "bh_sharpe": 1.2201, "bh_return_pct": 185.59, "excess_sharpe": 0.0686, "B_sharpe": -0.3644, "B_excess_sharpe": -3.2028, "B_return_pct": -68.96, "D_sharpe": 1.2887, "D_excess_sharpe": 0.0686, "D_return_pct": 204.83, "per_window": [{"fold": "fold_1", "regime": "GFC peak crash (Lehman + Mar-2009 bottom)", "n": 65, "A_sharpe": 1.8088, "A_sortino": 2.1583, "A_excess_sharpe": 1.3827, "A_return_pct": 16.92, "A_hit_rate": 49.23, "A_n": 65, "A_bh_sharpe": 0.4262, "A_bh_return_pct": 2.34, "A_psr": 0.8236, "A_ic": 0.1182, "B_sharpe": 0.8117, "B_sortino": 0.8695, "B_excess_sharpe": -1.076, "B_return_pct": 8.89, "B_hit_rate": 50.0, "B_n": 65, "B_bh_sharpe": 1.8877, "B_bh_return_pct": 34.48, "B_psr": 0.6594, "B_ic": 0.0482, "D_sharpe": 1.8088, "D_sortino": 2.1583, "D_excess_sharpe": 1.3827, "D_return_pct": 16.92, "D_hit_rate": 49.23, "D_n": 65, "D_bh_sharpe": 0.4262, "D_bh_return_pct": 2.34, "D_psr": 0.8236, "D_ic": 0.1182, "sharpe": 1.8088, "sortino": 2.1583, "return_pct": 16.92, "equity": 1169.2, "max_dd": 0.0, "win_rate": 49.23, "profit_factor": 0.0, "ic": 0.1182, "hit": 49.23, "psr": 0.8236, "bh_sharpe": 0.4262, "bh_return_pct": 2.34, "excess_sharpe": 1.3827, "precision": 0.5143, "recall": 0.5294, "f1": 0.5217, "f2": 0.5263, "accuracy": 0.4923, "mcc": -0.019, "tp": 18, "fp": 17, "tn": 14, "fn": 16, "A_precision": 0.5143, "A_recall": 0.5294, "A_f1": 0.5217, "A_f2": 0.5263, "A_accuracy": 0.4923, "A_mcc": -0.019, "A_tp": 18, "A_fp": 17, "A_tn": 14, "A_fn": 16}, {"fold": "fold_2", "regime": "2011 US-downgrade + EU debt", "n": 86, "A_sharpe": 5.272, "A_sortino": 6.3566, "A_excess_sharpe": 0.4038, "A_return_pct": 30.33, "A_hit_rate": 65.88, "A_n": 86, "A_bh_sharpe": 4.8682, "A_bh_return_pct": 27.91, "A_psr": 0.9997, "A_ic": 0.2646, "B_sharpe": -1.285, "B_sortino": -1.4368, "B_excess_sharpe": -12.6041, "B_return_pct": -15.54, "B_hit_rate": 39.53, "B_n": 86, "B_bh_sharpe": 11.3191, "B_bh_return_pct": 186.84, "B_psr": 0.2332, "B_ic": 0.1762, "D_sharpe": 5.272, "D_sortino": 6.3566, "D_excess_sharpe": 0.4038, "D_return_pct": 30.33, "D_hit_rate": 65.88, "D_n": 86, "D_bh_sharpe": 4.8682, "D_bh_return_pct": 27.91, "D_psr": 0.9997, "D_ic": 0.2646, "sharpe": 5.272, "sortino": 6.3566, "return_pct": 30.33, "equity": 1303.3, "max_dd": 0.0, "win_rate": 65.88, "profit_factor": 0.0, "ic": 0.2646, "hit": 65.88, "psr": 0.9997, "bh_sharpe": 4.8682, "bh_return_pct": 27.91, "excess_sharpe": 0.4038, "precision": 0.7857, "recall": 0.6226, "f1": 0.6947, "f2": 0.6496, "accuracy": 0.6628, "mcc": 0.3404, "tp": 33, "fp": 9, "tn": 24, "fn": 20, "A_precision": 0.7857, "A_recall": 0.6226, "A_f1": 0.6947, "A_f2": 0.6496, "A_accuracy": 0.6628, "A_mcc": 0.3404, "A_tp": 33, "A_fp": 9, "A_tn": 24, "A_fn": 20}, {"fold": "fold_3", "regime": "Taper tantrum and 2014 H1", "n": 128, "A_sharpe": 0.381, "A_sortino": 0.4247, "A_excess_sharpe": -1.6779, "A_return_pct": 2.07, "A_hit_rate": 46.46, "A_n": 128, "A_bh_sharpe": 2.0589, "A_bh_return_pct": 13.6, "A_psr": 0.6071, "A_ic": 0.0354, "B_sharpe": -3.9959, "B_sortino": -3.615, "B_excess_sharpe": -8.5075, "B_return_pct": -38.8, "B_hit_rate": 39.84, "B_n": 128, "B_bh_sharpe": 4.5116, "B_bh_return_pct": 67.92, "B_psr": 0.0022, "B_ic": -0.3215, "D_sharpe": 0.381, "D_sortino": 0.4247, "D_excess_sharpe": -1.6779, "D_return_pct": 2.07, "D_hit_rate": 46.46, "D_n": 128, "D_bh_sharpe": 2.0589, "D_bh_return_pct": 13.6, "D_psr": 0.6071, "D_ic": 0.0354, "sharpe": 0.381, "sortino": 0.4247, "return_pct": 2.07, "equity": 1020.6999999999999, "max_dd": 0.0, "win_rate": 46.46, "profit_factor": 0.0, "ic": 0.0354, "hit": 46.46, "psr": 0.6071, "bh_sharpe": 2.0589, "bh_return_pct": 13.6, "excess_sharpe": -1.6779, "precision": 0.5641, "recall": 0.5641, "f1": 0.5641, "f2": 0.5641, "accuracy": 0.4688, "mcc": -0.1159, "tp": 44, "fp": 34, "tn": 16, "fn": 34, "A_precision": 0.5641, "A_recall": 0.5641, "A_f1": 0.5641, "A_f2": 0.5641, "A_accuracy": 0.4688, "A_mcc": -0.1159, "A_tp": 44, "A_fp": 34, "A_tn": 16, "A_fn": 34}, {"fold": "fold_4", "regime": "China devaluation and oil crash", "n": 107, "A_sharpe": 2.7861, "A_sortino": 2.7505, "A_excess_sharpe": 3.5894, "A_return_pct": 25.85, "A_hit_rate": 56.6, "A_n": 107, "A_bh_sharpe": -0.8032, "A_bh_return_pct": -7.58, "A_psr": 0.9574, "A_ic": 0.2508, "B_sharpe": 1.0452, "B_sortino": 1.0692, "B_excess_sharpe": 3.0047, "B_return_pct": 16.7, "B_hit_rate": 52.34, "B_n": 107, "B_bh_sharpe": -1.9596, "B_bh_return_pct": -33.47, "B_psr": 0.751, "B_ic": 0.0861, "D_sharpe": 2.7861, "D_sortino": 2.7505, "D_excess_sharpe": 3.5894, "D_return_pct": 25.85, "D_hit_rate": 56.6, "D_n": 107, "D_bh_sharpe": -0.8032, "D_bh_return_pct": -7.58, "D_psr": 0.9574, "D_ic": 0.2508, "sharpe": 2.7861, "sortino": 2.7505, "return_pct": 25.85, "equity": 1258.5, "max_dd": 0.0, "win_rate": 56.6, "profit_factor": 0.0, "ic": 0.2508, "hit": 56.6, "psr": 0.9574, "bh_sharpe": -0.8032, "bh_return_pct": -7.58, "excess_sharpe": 3.5894, "precision": 0.5352, "recall": 0.7308, "f1": 0.6179, "f2": 0.681, "accuracy": 0.5607, "mcc": 0.1383, "tp": 38, "fp": 33, "tn": 22, "fn": 14, "A_precision": 0.5352, "A_recall": 0.7308, "A_f1": 0.6179, "A_f2": 0.681, "A_accuracy": 0.5607, "A_mcc": 0.1383, "A_tp": 38, "A_fp": 33, "A_tn": 22, "A_fn": 14}, {"fold": "fold_5", "regime": "2018 Vol-mageddon + Q4 sell-off", "n": 127, "A_sharpe": 1.3429, "A_sortino": 1.5069, "A_excess_sharpe": 0.1599, "A_return_pct": 15.74, "A_hit_rate": 52.76, "A_n": 127, "A_bh_sharpe": 1.183, "A_bh_return_pct": 13.55, "A_psr": 0.8352, "A_ic": 0.0637, "B_sharpe": 0.7359, "B_sortino": 0.8063, "B_excess_sharpe": -2.1697, "B_return_pct": 12.56, "B_hit_rate": 47.62, "B_n": 127, "B_bh_sharpe": 2.9056, "B_bh_return_pct": 85.51, "B_psr": 0.699, "B_ic": 0.2255, "D_sharpe": 1.3429, "D_sortino": 1.5069, "D_excess_sharpe": 0.1599, "D_return_pct": 15.74, "D_hit_rate": 52.76, "D_n": 127, "D_bh_sharpe": 1.183, "D_bh_return_pct": 13.55, "D_psr": 0.8352, "D_ic": 0.0637, "sharpe": 1.3429, "sortino": 1.5069, "return_pct": 15.74, "equity": 1157.4, "max_dd": 0.0, "win_rate": 52.76, "profit_factor": 0.0, "ic": 0.0637, "hit": 52.76, "psr": 0.8352, "bh_sharpe": 1.183, "bh_return_pct": 13.55, "excess_sharpe": 0.1599, "precision": 0.6154, "recall": 0.6154, "f1": 0.6154, "f2": 0.6154, "accuracy": 0.5276, "mcc": 0.0031, "tp": 48, "fp": 30, "tn": 19, "fn": 30, "A_precision": 0.6154, "A_recall": 0.6154, "A_f1": 0.6154, "A_f2": 0.6154, "A_accuracy": 0.5276, "A_mcc": 0.0031, "A_tp": 48, "A_fp": 30, "A_tn": 19, "A_fn": 30}, {"fold": "fold_6", "regime": "COVID crash and V-recovery", "n": 172, "A_sharpe": 2.416, "A_sortino": 2.6595, "A_excess_sharpe": -0.0116, "A_return_pct": 45.65, "A_hit_rate": 56.98, "A_n": 172, "A_bh_sharpe": 2.4276, "A_bh_return_pct": 45.89, "A_psr": 0.9797, "A_ic": 0.1071, "B_sharpe": -0.7573, "B_sortino": -0.8269, "B_excess_sharpe": -6.4694, "B_return_pct": -29.46, "B_hit_rate": 43.86, "B_n": 172, "B_bh_sharpe": 5.712, "B_bh_return_pct": 489.18, "B_psr": 0.2691, "B_ic": 0.0246, "D_sharpe": 2.416, "D_sortino": 2.6595, "D_excess_sharpe": -0.0116, "D_return_pct": 45.65, "D_hit_rate": 56.98, "D_n": 172, "D_bh_sharpe": 2.4276, "D_bh_return_pct": 45.89, "D_psr": 0.9797, "D_ic": 0.1071, "sharpe": 2.416, "sortino": 2.6595, "return_pct": 45.65, "equity": 1456.5, "max_dd": 0.0, "win_rate": 56.98, "profit_factor": 0.0, "ic": 0.1071, "hit": 56.98, "psr": 0.9797, "bh_sharpe": 2.4276, "bh_return_pct": 45.89, "excess_sharpe": -0.0116, "precision": 0.6931, "recall": 0.6195, "f1": 0.6542, "f2": 0.6329, "accuracy": 0.5698, "mcc": 0.0907, "tp": 70, "fp": 31, "tn": 28, "fn": 43, "A_precision": 0.6931, "A_recall": 0.6195, "A_f1": 0.6542, "A_f2": 0.6329, "A_accuracy": 0.5698, "A_mcc": 0.0907, "A_tp": 70, "A_fp": 31, "A_tn": 28, "A_fn": 43}, {"fold": "fold_7", "regime": "Inflation bear, AI rally and 2025", "n": 375, "A_sharpe": -0.1256, "A_sortino": -0.1314, "A_excess_sharpe": -0.9161, "A_return_pct": -7.62, "A_hit_rate": 49.33, "A_n": 375, "A_bh_sharpe": 0.7905, "A_bh_return_pct": 25.44, "A_psr": 0.4394, "A_ic": -0.0022, "B_sharpe": -0.515, "B_sortino": -0.5108, "B_excess_sharpe": -2.4488, "B_return_pct": -40.48, "B_hit_rate": 48.66, "B_n": 375, "B_bh_sharpe": 1.9338, "B_bh_return_pct": 221.94, "B_psr": 0.2656, "B_ic": -0.0627, "D_sharpe": -0.1256, "D_sortino": -0.1314, "D_excess_sharpe": -0.9161, "D_return_pct": -7.62, "D_hit_rate": 49.33, "D_n": 375, "D_bh_sharpe": 0.7905, "D_bh_return_pct": 25.44, "D_psr": 0.4394, "D_ic": -0.0022, "sharpe": -0.1256, "sortino": -0.1314, "return_pct": -7.62, "equity": 923.8, "max_dd": 0.0, "win_rate": 49.33, "profit_factor": 0.0, "ic": -0.0022, "hit": 49.33, "psr": 0.4394, "bh_sharpe": 0.7905, "bh_return_pct": 25.44, "excess_sharpe": -0.9161, "precision": 0.5833, "recall": 0.4773, "f1": 0.525, "f2": 0.4953, "accuracy": 0.4933, "mcc": -0.0065, "tp": 105, "fp": 75, "tn": 80, "fn": 115, "A_precision": 0.5833, "A_recall": 0.4773, "A_f1": 0.525, "A_f2": 0.4953, "A_accuracy": 0.4933, "A_mcc": -0.0065, "A_tp": 105, "A_fp": 75, "A_tn": 80, "A_fn": 115}], "per_window_val": [{"fold": "fold_1", "regime": "GFC peak crash (Lehman + Mar-2009 bottom)", "n": 37, "A_sharpe": 7.4099, "A_sortino": 10.1557, "A_excess_sharpe": 6.6514, "A_return_pct": 28.05, "A_hit_rate": 65.71, "A_n": 37, "A_bh_sharpe": 0.7585, "A_bh_return_pct": 2.39, "A_psr": 0.9988, "A_ic": 0.3379, "B_sharpe": 8.4902, "B_sortino": 11.4307, "B_excess_sharpe": 6.3455, "B_return_pct": 54.28, "B_hit_rate": 75.68, "B_n": 37, "B_bh_sharpe": 2.1447, "B_bh_return_pct": 12.13, "B_psr": 0.9999, "B_ic": 0.4682, "D_sharpe": 7.4099, "D_sortino": 10.1557, "D_excess_sharpe": 6.6514, "D_return_pct": 28.05, "D_hit_rate": 65.71, "D_n": 37, "D_bh_sharpe": 0.7585, "D_bh_return_pct": 2.39, "D_psr": 0.9988, "D_ic": 0.3379, "sharpe": 7.4099, "sortino": 10.1557, "return_pct": 28.05, "equity": 1280.5, "max_dd": 0.0, "win_rate": 65.71, "profit_factor": 0.0, "ic": 0.3379, "hit": 65.71, "psr": 0.9988, "bh_sharpe": 0.7585, "bh_return_pct": 2.39, "excess_sharpe": 6.6514}, {"fold": "fold_2", "regime": "2011 US-downgrade + EU debt", "n": 46, "A_sharpe": 1.1683, "A_sortino": 1.2628, "A_excess_sharpe": 1.2221, "A_return_pct": 6.54, "A_hit_rate": 50.0, "A_n": 46, "A_bh_sharpe": -0.0539, "A_bh_return_pct": -1.46, "A_psr": 0.6887, "A_ic": 0.0755, "B_sharpe": 2.228, "B_sortino": 2.9348, "B_excess_sharpe": 3.7693, "B_return_pct": 28.96, "B_hit_rate": 50.0, "B_n": 46, "B_bh_sharpe": -1.5413, "B_bh_return_pct": -23.36, "B_psr": 0.8384, "B_ic": 0.2173, "D_sharpe": 1.1683, "D_sortino": 1.2628, "D_excess_sharpe": 1.2221, "D_return_pct": 6.54, "D_hit_rate": 50.0, "D_n": 46, "D_bh_sharpe": -0.0539, "D_bh_return_pct": -1.46, "D_psr": 0.6887, "D_ic": 0.0755, "sharpe": 1.1683, "sortino": 1.2628, "return_pct": 6.54, "equity": 1065.3999999999999, "max_dd": 0.0, "win_rate": 50.0, "profit_factor": 0.0, "ic": 0.0755, "hit": 50.0, "psr": 0.6887, "bh_sharpe": -0.0539, "bh_return_pct": -1.46, "excess_sharpe": 1.2221}, {"fold": "fold_3", "regime": "Taper tantrum and 2014 H1", "n": 4, "A_sharpe": -6.3226, "A_sortino": -4.4732, "A_excess_sharpe": -12.6451, "A_return_pct": -0.58, "A_hit_rate": 50.0, "A_n": 4, "A_bh_sharpe": 6.3226, "A_bh_return_pct": 0.58, "A_psr": 0.227, "A_ic": 0.2, "B_sharpe": 14.1626, "B_sortino": 32.5623, "B_excess_sharpe": 37.6039, "B_return_pct": 0.0, "B_hit_rate": 0.0, "B_n": 4, "B_bh_sharpe": -23.4413, "B_bh_return_pct": -3.13, "B_psr": 0.9725, "B_ic": -0.4, "D_sharpe": -6.3226, "D_sortino": -4.4732, "D_excess_sharpe": -12.6451, "D_return_pct": -0.58, "D_hit_rate": 50.0, "D_n": 4, "D_bh_sharpe": 6.3226, "D_bh_return_pct": 0.58, "D_psr": 0.227, "D_ic": 0.2, "sharpe": -6.3226, "sortino": -4.4732, "return_pct": -0.58, "equity": 994.1999999999999, "max_dd": 0.0, "win_rate": 50.0, "profit_factor": 0.0, "ic": 0.2, "hit": 50.0, "psr": 0.227, "bh_sharpe": 6.3226, "bh_return_pct": 0.58, "excess_sharpe": -12.6451}, {"fold": "fold_4", "regime": "China devaluation and oil crash", "n": 46, "A_sharpe": 0.4873, "A_sortino": 0.4808, "A_excess_sharpe": 1.6895, "A_return_pct": 1.63, "A_hit_rate": 50.0, "A_n": 46, "A_bh_sharpe": -1.2022, "A_bh_return_pct": -5.68, "A_psr": 0.5813, "A_ic": 0.0336, "B_sharpe": -1.805, "B_sortino": -1.4587, "B_excess_sharpe": 0.5068, "B_return_pct": -20.37, "B_hit_rate": 50.0, "B_n": 46, "B_bh_sharpe": -2.3118, "B_bh_return_pct": -24.51, "B_psr": 0.2043, "B_ic": 0.0626, "D_sharpe": 0.4873, "D_sortino": 0.4808, "D_excess_sharpe": 1.6895, "D_return_pct": 1.63, "D_hit_rate": 50.0, "D_n": 46, "D_bh_sharpe": -1.2022, "D_bh_return_pct": -5.68, "D_psr": 0.5813, "D_ic": 0.0336, "sharpe": 0.4873, "sortino": 0.4808, "return_pct": 1.63, "equity": 1016.3, "max_dd": 0.0, "win_rate": 50.0, "profit_factor": 0.0, "ic": 0.0336, "hit": 50.0, "psr": 0.5813, "bh_sharpe": -1.2022, "bh_return_pct": -5.68, "excess_sharpe": 1.6895}, {"fold": "fold_5", "regime": "2018 Vol-mageddon + Q4 sell-off", "n": 4, "A_sharpe": 14.7551, "A_sortino": 18.4635, "A_excess_sharpe": 29.5102, "A_return_pct": 0.0, "A_hit_rate": 0.0, "A_n": 4, "A_bh_sharpe": -14.7551, "A_bh_return_pct": -3.52, "A_psr": 0.9192, "A_ic": 0.4, "B_sharpe": -2.1566, "B_sortino": -2.0033, "B_excess_sharpe": -4.3132, "B_return_pct": -1.41, "B_hit_rate": 50.0, "B_n": 4, "B_bh_sharpe": 2.1566, "B_bh_return_pct": 1.19, "B_psr": 0.4075, "B_ic": -0.4, "D_sharpe": 14.7551, "D_sortino": 18.4635, "D_excess_sharpe": 29.5102, "D_return_pct": 0.0, "D_hit_rate": 0.0, "D_n": 4, "D_bh_sharpe": -14.7551, "D_bh_return_pct": -3.52, "D_psr": 0.9192, "D_ic": 0.4, "sharpe": 14.7551, "sortino": 18.4635, "return_pct": 0.0, "equity": 1000.0, "max_dd": 0.0, "win_rate": 0.0, "profit_factor": 0.0, "ic": 0.4, "hit": 0.0, "psr": 0.9192, "bh_sharpe": -14.7551, "bh_return_pct": -3.52, "excess_sharpe": 29.5102}, {"fold": "fold_6", "regime": "COVID crash and V-recovery", "n": 25, "A_sharpe": 0.4635, "A_sortino": 0.5445, "A_excess_sharpe": -1.9502, "A_return_pct": 0.55, "A_hit_rate": 44.0, "A_n": 25, "A_bh_sharpe": 2.4138, "A_bh_return_pct": 3.27, "A_psr": 0.5572, "A_ic": 0.3692, "B_sharpe": -7.5448, "B_sortino": -6.6372, "B_excess_sharpe": -20.1103, "B_return_pct": -18.39, "B_hit_rate": 28.0, "B_n": 25, "B_bh_sharpe": 12.5655, "B_bh_return_pct": 32.76, "B_psr": 0.0173, "B_ic": 0.2177, "D_sharpe": 0.4635, "D_sortino": 0.5445, "D_excess_sharpe": -1.9502, "D_return_pct": 0.55, "D_hit_rate": 44.0, "D_n": 25, "D_bh_sharpe": 2.4138, "D_bh_return_pct": 3.27, "D_psr": 0.5572, "D_ic": 0.3692, "sharpe": 0.4635, "sortino": 0.5445, "return_pct": 0.55, "equity": 1005.5000000000001, "max_dd": 0.0, "win_rate": 44.0, "profit_factor": 0.0, "ic": 0.3692, "hit": 44.0, "psr": 0.5572, "bh_sharpe": 2.4138, "bh_return_pct": 3.27, "excess_sharpe": -1.9502}, {"fold": "fold_7", "regime": "Inflation bear, AI rally and 2025", "n": 64, "A_sharpe": 1.474, "A_sortino": 1.68, "A_excess_sharpe": -0.5668, "A_return_pct": 5.61, "A_hit_rate": 48.44, "A_n": 64, "A_bh_sharpe": 2.0409, "A_bh_return_pct": 7.94, "A_psr": 0.7716, "A_ic": 0.0026, "B_sharpe": -1.1751, "B_sortino": -1.1174, "B_excess_sharpe": -6.5843, "B_return_pct": -9.52, "B_hit_rate": 50.0, "B_n": 64, "B_bh_sharpe": 5.4092, "B_bh_return_pct": 45.7, "B_psr": 0.2791, "B_ic": -0.0878, "D_sharpe": 1.474, "D_sortino": 1.68, "D_excess_sharpe": -0.5668, "D_return_pct": 5.61, "D_hit_rate": 48.44, "D_n": 64, "D_bh_sharpe": 2.0409, "D_bh_return_pct": 7.94, "D_psr": 0.7716, "D_ic": 0.0026, "sharpe": 1.474, "sortino": 1.68, "return_pct": 5.61, "equity": 1056.1000000000001, "max_dd": 0.0, "win_rate": 48.44, "profit_factor": 0.0, "ic": 0.0026, "hit": 48.44, "psr": 0.7716, "bh_sharpe": 2.0409, "bh_return_pct": 7.94, "excess_sharpe": -0.5668}], "status": "KEEP", "precision": 0.6085, "recall": 0.5669, "f1": 0.587, "f2": 0.5747, "accuracy": 0.5274, "mcc": 0.0363, "tp": 356, "fp": 229, "tn": 203, "fn": 272, "test_sharpe": 1.2887, "A_sharpe": 1.2887, "A_excess_sharpe": 0.0686, "A_return_pct": 204.83, "A_precision": 0.6085, "A_recall": 0.5669, "A_f1": 0.587, "A_f2": 0.5747, "A_accuracy": 0.5274, "A_mcc": 0.0363, "A_tp": 356, "A_fp": 229, "A_tn": 203, "A_fn": 272, "A_psr": 0.9965, "A_ic": 0.0792, "A_hit_rate": 52.7, "A_bh_sharpe": 1.2201, "A_bh_return_pct": 185.59}
