{"experiment_num": 71, "backbone": "lstm", "description": "LSTM @ exp 8 num_layers=1 (down from 2) - FX paper section 4.6 axis test on QQQ; FX 1-layer was underfit baseline", "config": {"seq_len": 10, "lr": 0.001, "batch_size": 16, "epochs": 100, "weight_decay": 0.0007, "patience": 15, "warmup_epochs": 0, "head_dropout": 0.1, "huber_delta": 1.0, "grad_clip": 1.0, "seed": 0, "hidden_size": null, "num_layers": 1, "max_depth": null, "gbm_lr": null, "n_estimators": null}, "composite": 0.3547, "test_pos_folds": 6, "val_pos_folds": 3, "val_loss": -2.8840376570896193, "elapsed_sec": 32.5, "timestamp": "2026-04-27T23:02:14", "sharpe": 0.896, "val_sharpe": 0.4547, "ic": 0.0557, "hit": 58.21, "psr": 0.9819, "equity": 3165.6, "return_pct": 216.56, "bh_sharpe": 0.6042, "bh_return_pct": 103.49, "excess_sharpe": 0.2917, "B_sharpe": 1.1241, "B_excess_sharpe": -0.5767, "B_return_pct": 1172.52, "D_sharpe": 0.896, "D_excess_sharpe": 0.2917, "D_return_pct": 216.56, "precision": 0.5868, "recall": 0.9046, "f1": 0.7118, "f2": 0.8162, "mcc": 0.0801, "accuracy": 0.5809, "val_precision": 0.558, "val_recall": 0.8632, "val_f1": 0.6778, "val_f2": 0.7781, "val_mcc": 0.0156, "val_accuracy": 0.5447, "per_window": [{"fold": "fold_1", "regime": "GFC peak crash (Lehman + Mar-2009 bottom)", "n": 115, "A_sharpe": -0.0017, "A_sortino": -0.0018, "A_excess_sharpe": 0.4424, "A_return_pct": -5.43, "A_hit_rate": 46.96, "A_n": 115, "A_bh_sharpe": -0.4441, "A_bh_return_pct": -14.4, "A_psr": 0.4995, "A_ic": -0.0128, "A_precision": 0.4607, "A_recall": 0.7593, "A_f1": 0.5734, "A_f2": 0.6721, "A_accuracy": 0.4696, "A_mcc": -0.033, "A_tp": 41, "A_fp": 48, "A_tn": 13, "A_fn": 13, "B_sharpe": 1.6354, "B_sortino": 1.5766, "B_excess_sharpe": 1.9332, "B_return_pct": 62.78, "B_hit_rate": 56.14, "B_n": 115, "B_bh_sharpe": -0.2978, "B_bh_return_pct": -27.23, "B_psr": 0.8602, "B_ic": 0.128, "B_precision": 0.5556, "B_recall": 0.7627, "B_f1": 0.6429, "B_f2": 0.7098, "B_accuracy": 0.5652, "B_mcc": 0.1313, "B_tp": 45, "B_fp": 36, "B_tn": 20, "B_fn": 14, "D_sharpe": -0.0017, "D_sortino": -0.0018, "D_excess_sharpe": 0.4424, "D_return_pct": -5.43, "D_hit_rate": 46.96, "D_n": 115, "D_bh_sharpe": -0.4441, "D_bh_return_pct": -14.4, "D_psr": 0.4995, "D_ic": -0.0128, "D_precision": 0.4607, "D_recall": 0.7593, "D_f1": 0.5734, "D_f2": 0.6721, "D_accuracy": 0.4696, "D_mcc": -0.033, "D_tp": 41, "D_fp": 48, "D_tn": 13, "D_fn": 13, "sharpe": -0.0017, "sortino": -0.0018, "return_pct": -5.43, "equity": 945.6999999999999, "max_dd": 0.0, "win_rate": 46.96, "profit_factor": 0.0, "ic": -0.0128, "hit": 46.96, "psr": 0.4995, "bh_sharpe": -0.4441, "bh_return_pct": -14.4, "excess_sharpe": 0.4424, "precision": 0.4607, "recall": 0.7593, "f1": 0.5734, "f2": 0.6721, "mcc": -0.033, "accuracy": 0.4696, "tp": 41, "fp": 48, "tn": 13, "fn": 13}, {"fold": "fold_2", "regime": "2011 US-downgrade + EU debt", "n": 136, "A_sharpe": 1.8575, "A_sortino": 1.841, "A_excess_sharpe": 0.1247, "A_return_pct": 21.39, "A_hit_rate": 57.04, "A_n": 136, "A_bh_sharpe": 1.7327, "A_bh_return_pct": 19.75, "A_psr": 0.9117, "A_ic": 0.1277, "A_precision": 0.5812, "A_recall": 0.8718, "A_f1": 0.6974, "A_f2": 0.7925, "A_accuracy": 0.5662, "A_mcc": 0.0385, "A_tp": 68, "A_fp": 49, "A_tn": 9, "A_fn": 10, "B_sharpe": 5.1159, "B_sortino": 4.4829, "B_excess_sharpe": 1.05, "B_return_pct": 212.51, "B_hit_rate": 72.79, "B_n": 136, "B_bh_sharpe": 4.0659, "B_bh_return_pct": 148.68, "B_psr": 0.9998, "B_ic": 0.046, "B_precision": 0.7252, "B_recall": 0.9896, "B_f1": 0.837, "B_f2": 0.9223, "B_accuracy": 0.7279, "B_mcc": 0.2169, "B_tp": 95, "B_fp": 36, "B_tn": 4, "B_fn": 1, "D_sharpe": 1.8575, "D_sortino": 1.841, "D_excess_sharpe": 0.1247, "D_return_pct": 21.39, "D_hit_rate": 57.04, "D_n": 136, "D_bh_sharpe": 1.7327, "D_bh_return_pct": 19.75, "D_psr": 0.9117, "D_ic": 0.1277, "D_precision": 0.5812, "D_recall": 0.8718, "D_f1": 0.6974, "D_f2": 0.7925, "D_accuracy": 0.5662, "D_mcc": 0.0385, "D_tp": 68, "D_fp": 49, "D_tn": 9, "D_fn": 10, "sharpe": 1.8575, "sortino": 1.841, "return_pct": 21.39, "equity": 1213.9, "max_dd": 0.0, "win_rate": 57.04, "profit_factor": 0.0, "ic": 0.1277, "hit": 57.04, "psr": 0.9117, "bh_sharpe": 1.7327, "bh_return_pct": 19.75, "excess_sharpe": 0.1247, "precision": 0.5812, "recall": 0.8718, "f1": 0.6974, "f2": 0.7925, "mcc": 0.0385, "accuracy": 0.5662, "tp": 68, "fp": 49, "tn": 9, "fn": 10}, {"fold": "fold_3", "regime": "Taper tantrum and 2014 H1", "n": 178, "A_sharpe": 1.8712, "A_sortino": 1.6437, "A_excess_sharpe": 0.5267, "A_return_pct": 17.89, "A_hit_rate": 60.45, "A_n": 178, "A_bh_sharpe": 1.3445, "A_bh_return_pct": 12.41, "A_psr": 0.9329, "A_ic": 0.1908, "A_precision": 0.6081, "A_recall": 0.8738, "A_f1": 0.7171, "A_f2": 0.8036, "A_accuracy": 0.6011, "A_mcc": 0.1325, "A_tp": 90, "A_fp": 58, "A_tn": 17, "A_fn": 13, "B_sharpe": 2.5799, "B_sortino": 2.551, "B_excess_sharpe": -0.4684, "B_return_pct": 57.88, "B_hit_rate": 60.11, "B_n": 178, "B_bh_sharpe": 3.0483, "B_bh_return_pct": 71.83, "B_psr": 0.9839, "B_ic": -0.1996, "B_precision": 0.608, "B_recall": 0.9817, "B_f1": 0.7509, "B_f2": 0.8742, "B_accuracy": 0.6011, "B_mcc": -0.0848, "B_tp": 107, "B_fp": 69, "B_tn": 0, "B_fn": 2, "D_sharpe": 1.8712, "D_sortino": 1.6437, "D_excess_sharpe": 0.5267, "D_return_pct": 17.89, "D_hit_rate": 60.45, "D_n": 178, "D_bh_sharpe": 1.3445, "D_bh_return_pct": 12.41, "D_psr": 0.9329, "D_ic": 0.1908, "D_precision": 0.6081, "D_recall": 0.8738, "D_f1": 0.7171, "D_f2": 0.8036, "D_accuracy": 0.6011, "D_mcc": 0.1325, "D_tp": 90, "D_fp": 58, "D_tn": 17, "D_fn": 13, "sharpe": 1.8712, "sortino": 1.6437, "return_pct": 17.89, "equity": 1178.9, "max_dd": 0.0, "win_rate": 60.45, "profit_factor": 0.0, "ic": 0.1908, "hit": 60.45, "psr": 0.9329, "bh_sharpe": 1.3445, "bh_return_pct": 12.41, "excess_sharpe": 0.5267, "precision": 0.6081, "recall": 0.8738, "f1": 0.7171, "f2": 0.8036, "mcc": 0.1325, "accuracy": 0.6011, "tp": 90, "fp": 58, "tn": 17, "fn": 13}, {"fold": "fold_4", "regime": "China devaluation and oil crash", "n": 157, "A_sharpe": 0.9243, "A_sortino": 0.8591, "A_excess_sharpe": 0.9145, "A_return_pct": 10.5, "A_hit_rate": 55.77, "A_n": 157, "A_bh_sharpe": 0.0098, "A_bh_return_pct": -1.05, "A_psr": 0.7639, "A_ic": 0.0554, "A_precision": 0.5414, "A_recall": 0.8889, "A_f1": 0.6729, "A_f2": 0.7877, "A_accuracy": 0.5541, "A_mcc": 0.1198, "A_tp": 72, "A_fp": 61, "A_tn": 15, "A_fn": 9, "B_sharpe": 2.1117, "B_sortino": 2.0549, "B_excess_sharpe": 2.0958, "B_return_pct": 67.03, "B_hit_rate": 57.96, "B_n": 157, "B_bh_sharpe": 0.0159, "B_bh_return_pct": -5.48, "B_psr": 0.9486, "B_ic": -0.0149, "B_precision": 0.5664, "B_recall": 0.9529, "B_f1": 0.7105, "B_f2": 0.8385, "B_accuracy": 0.5796, "B_mcc": 0.1606, "B_tp": 81, "B_fp": 62, "B_tn": 10, "B_fn": 4, "D_sharpe": 0.9243, "D_sortino": 0.8591, "D_excess_sharpe": 0.9145, "D_return_pct": 10.5, "D_hit_rate": 55.77, "D_n": 157, "D_bh_sharpe": 0.0098, "D_bh_return_pct": -1.05, "D_psr": 0.7639, "D_ic": 0.0554, "D_precision": 0.5414, "D_recall": 0.8889, "D_f1": 0.6729, "D_f2": 0.7877, "D_accuracy": 0.5541, "D_mcc": 0.1198, "D_tp": 72, "D_fp": 61, "D_tn": 15, "D_fn": 9, "sharpe": 0.9243, "sortino": 0.8591, "return_pct": 10.5, "equity": 1105.0, "max_dd": 0.0, "win_rate": 55.77, "profit_factor": 0.0, "ic": 0.0554, "hit": 55.77, "psr": 0.7639, "bh_sharpe": 0.0098, "bh_return_pct": -1.05, "excess_sharpe": 0.9145, "precision": 0.5414, "recall": 0.8889, "f1": 0.6729, "f2": 0.7877, "mcc": 0.1198, "accuracy": 0.5541, "tp": 72, "fp": 61, "tn": 15, "fn": 9}, {"fold": "fold_5", "regime": "2018 Vol-mageddon + Q4 sell-off", "n": 177, "A_sharpe": 1.0675, "A_sortino": 0.9839, "A_excess_sharpe": 0.7577, "A_return_pct": 16.61, "A_hit_rate": 58.76, "A_n": 177, "A_bh_sharpe": 0.3098, "A_bh_return_pct": 3.19, "A_psr": 0.8128, "A_ic": 0.0486, "A_precision": 0.5872, "A_recall": 0.9806, "A_f1": 0.7345, "A_f2": 0.8647, "A_accuracy": 0.5876, "A_mcc": 0.0629, "A_tp": 101, "A_fp": 71, "A_tn": 3, "A_fn": 2, "B_sharpe": 0.9582, "B_sortino": 0.8082, "B_excess_sharpe": 0.0665, "B_return_pct": 26.52, "B_hit_rate": 60.8, "B_n": 177, "B_bh_sharpe": 0.8917, "B_bh_return_pct": 23.8, "B_psr": 0.7843, "B_ic": 0.2188, "B_precision": 0.6154, "B_recall": 0.9541, "B_f1": 0.7482, "B_f2": 0.8595, "B_accuracy": 0.6045, "B_mcc": -0.0041, "B_tp": 104, "B_fp": 65, "B_tn": 3, "B_fn": 5, "D_sharpe": 1.0675, "D_sortino": 0.9839, "D_excess_sharpe": 0.7577, "D_return_pct": 16.61, "D_hit_rate": 58.76, "D_n": 177, "D_bh_sharpe": 0.3098, "D_bh_return_pct": 3.19, "D_psr": 0.8128, "D_ic": 0.0486, "D_precision": 0.5872, "D_recall": 0.9806, "D_f1": 0.7345, "D_f2": 0.8647, "D_accuracy": 0.5876, "D_mcc": 0.0629, "D_tp": 101, "D_fp": 71, "D_tn": 3, "D_fn": 2, "sharpe": 1.0675, "sortino": 0.9839, "return_pct": 16.61, "equity": 1166.1, "max_dd": 0.0, "win_rate": 58.76, "profit_factor": 0.0, "ic": 0.0486, "hit": 58.76, "psr": 0.8128, "bh_sharpe": 0.3098, "bh_return_pct": 3.19, "excess_sharpe": 0.7577, "precision": 0.5872, "recall": 0.9806, "f1": 0.7345, "f2": 0.8647, "mcc": 0.0629, "accuracy": 0.5876, "tp": 101, "fp": 71, "tn": 3, "fn": 2}, {"fold": "fold_6", "regime": "COVID crash and V-recovery", "n": 222, "A_sharpe": 0.5559, "A_sortino": 0.4714, "A_excess_sharpe": -0.3329, "A_return_pct": 12.9, "A_hit_rate": 59.91, "A_n": 222, "A_bh_sharpe": 0.8888, "A_bh_return_pct": 26.13, "A_psr": 0.6961, "A_ic": 0.0161, "A_precision": 0.6269, "A_recall": 0.8768, "A_f1": 0.7311, "A_f2": 0.8121, "A_accuracy": 0.5991, "A_mcc": 0.0283, "A_tp": 121, "A_fp": 72, "A_tn": 12, "A_fn": 17, "B_sharpe": -1.9564, "B_sortino": -1.649, "B_excess_sharpe": -4.3449, "B_return_pct": -75.77, "B_hit_rate": 49.32, "B_n": 222, "B_bh_sharpe": 2.3884, "B_bh_return_pct": 243.18, "B_psr": 0.0269, "B_ic": -0.1535, "B_precision": 0.5723, "B_recall": 0.6934, "B_f1": 0.6271, "B_f2": 0.6653, "B_accuracy": 0.491, "B_mcc": -0.1588, "B_tp": 95, "B_fp": 71, "B_tn": 14, "B_fn": 42, "D_sharpe": 0.5559, "D_sortino": 0.4714, "D_excess_sharpe": -0.3329, "D_return_pct": 12.9, "D_hit_rate": 59.91, "D_n": 222, "D_bh_sharpe": 0.8888, "D_bh_return_pct": 26.13, "D_psr": 0.6961, "D_ic": 0.0161, "D_precision": 0.6269, "D_recall": 0.8768, "D_f1": 0.7311, "D_f2": 0.8121, "D_accuracy": 0.5991, "D_mcc": 0.0283, "D_tp": 121, "D_fp": 72, "D_tn": 12, "D_fn": 17, "sharpe": 0.5559, "sortino": 0.4714, "return_pct": 12.9, "equity": 1129.0, "max_dd": 0.0, "win_rate": 59.91, "profit_factor": 0.0, "ic": 0.0161, "hit": 59.91, "psr": 0.6961, "bh_sharpe": 0.8888, "bh_return_pct": 26.13, "excess_sharpe": -0.3329, "precision": 0.6269, "recall": 0.8768, "f1": 0.7311, "f2": 0.8121, "mcc": 0.0283, "accuracy": 0.5991, "tp": 121, "fp": 72, "tn": 12, "fn": 17}, {"fold": "fold_7", "regime": "Inflation bear, AI rally and 2025", "n": 425, "A_sharpe": 1.4098, "A_sortino": 1.3007, "A_excess_sharpe": 0.4383, "A_return_pct": 60.79, "A_hit_rate": 60.47, "A_n": 425, "A_bh_sharpe": 0.9715, "A_bh_return_pct": 37.12, "A_psr": 0.968, "A_ic": 0.0598, "A_precision": 0.6046, "A_recall": 0.948, "A_f1": 0.7383, "A_f2": 0.8513, "A_accuracy": 0.6047, "A_mcc": 0.1145, "A_tp": 237, "A_fp": 155, "A_tn": 20, "A_fn": 13, "B_sharpe": 1.708, "B_sortino": 1.6927, "B_excess_sharpe": -0.7947, "B_return_pct": 209.37, "B_hit_rate": 59.2, "B_n": 425, "B_bh_sharpe": 2.5027, "B_bh_return_pct": 458.83, "B_psr": 0.9877, "B_ic": -0.0225, "B_precision": 0.6254, "B_recall": 0.8441, "B_f1": 0.7184, "B_f2": 0.7889, "B_accuracy": 0.5906, "B_mcc": 0.0303, "B_tp": 222, "B_fp": 133, "B_tn": 29, "B_fn": 41, "D_sharpe": 1.4098, "D_sortino": 1.3007, "D_excess_sharpe": 0.4383, "D_return_pct": 60.79, "D_hit_rate": 60.47, "D_n": 425, "D_bh_sharpe": 0.9715, "D_bh_return_pct": 37.12, "D_psr": 0.968, "D_ic": 0.0598, "D_precision": 0.6046, "D_recall": 0.948, "D_f1": 0.7383, "D_f2": 0.8513, "D_accuracy": 0.6047, "D_mcc": 0.1145, "D_tp": 237, "D_fp": 155, "D_tn": 20, "D_fn": 13, "sharpe": 1.4098, "sortino": 1.3007, "return_pct": 60.79, "equity": 1607.8999999999999, "max_dd": 0.0, "win_rate": 60.47, "profit_factor": 0.0, "ic": 0.0598, "hit": 60.47, "psr": 0.968, "bh_sharpe": 0.9715, "bh_return_pct": 37.12, "excess_sharpe": 0.4383, "precision": 0.6046, "recall": 0.948, "f1": 0.7383, "f2": 0.8513, "mcc": 0.1145, "accuracy": 0.6047, "tp": 237, "fp": 155, "tn": 20, "fn": 13}], "per_window_val": [{"fold": "fold_1", "regime": "GFC peak crash (Lehman + Mar-2009 bottom)", "n": 104, "A_sharpe": -0.9901, "A_sortino": -0.8902, "A_excess_sharpe": -0.8229, "A_return_pct": -13.01, "A_hit_rate": 47.06, "A_n": 104, "A_bh_sharpe": -0.1672, "A_bh_return_pct": -3.81, "A_psr": 0.2571, "A_ic": 0.0518, "A_precision": 0.4943, "A_recall": 0.7963, "A_f1": 0.6099, "A_f2": 0.7096, "A_accuracy": 0.4712, "A_mcc": -0.1131, "A_tp": 43, "A_fp": 44, "A_tn": 6, "A_fn": 11, "B_sharpe": -2.7653, "B_sortino": -2.262, "B_excess_sharpe": -0.4912, "B_return_pct": -49.87, "B_hit_rate": 49.51, "B_n": 104, "B_bh_sharpe": -2.2741, "B_bh_return_pct": -44.12, "B_psr": 0.0295, "B_ic": -0.0884, "B_precision": 0.5, "B_recall": 0.6731, "B_f1": 0.5738, "B_f2": 0.6295, "B_accuracy": 0.5, "B_mcc": 0.0, "B_tp": 35, "B_fp": 35, "B_tn": 17, "B_fn": 17, "D_sharpe": -0.9901, "D_sortino": -0.8902, "D_excess_sharpe": -0.8229, "D_return_pct": -13.01, "D_hit_rate": 47.06, "D_n": 104, "D_bh_sharpe": -0.1672, "D_bh_return_pct": -3.81, "D_psr": 0.2571, "D_ic": 0.0518, "D_precision": 0.4943, "D_recall": 0.7963, "D_f1": 0.6099, "D_f2": 0.7096, "D_accuracy": 0.4712, "D_mcc": -0.1131, "D_tp": 43, "D_fp": 44, "D_tn": 6, "D_fn": 11, "sharpe": -0.9901, "sortino": -0.8902, "return_pct": -13.01, "equity": 869.9, "max_dd": 0.0, "win_rate": 47.06, "profit_factor": 0.0, "ic": 0.0518, "hit": 47.06, "psr": 0.2571, "bh_sharpe": -0.1672, "bh_return_pct": -3.81, "excess_sharpe": -0.8229, "precision": 0.4943, "recall": 0.7963, "f1": 0.6099, "f2": 0.7096, "mcc": -0.1131, "accuracy": 0.4712, "tp": 43, "fp": 44, "tn": 6, "fn": 11}, {"fold": "fold_2", "regime": "2011 US-downgrade + EU debt", "n": 96, "A_sharpe": -0.3955, "A_sortino": -0.3641, "A_excess_sharpe": -0.1214, "A_return_pct": -5.27, "A_hit_rate": 50.53, "A_n": 96, "A_bh_sharpe": -0.2741, "A_bh_return_pct": -4.09, "A_psr": 0.4034, "A_ic": 0.0138, "A_precision": 0.5116, "A_recall": 0.88, "A_f1": 0.6471, "A_f2": 0.7692, "A_accuracy": 0.5, "A_mcc": -0.054, "A_tp": 44, "A_fp": 42, "A_tn": 4, "A_fn": 6, "B_sharpe": -1.5277, "B_sortino": -1.6546, "B_excess_sharpe": -0.5003, "B_return_pct": -33.27, "B_hit_rate": 39.58, "B_n": 96, "B_bh_sharpe": -1.0274, "B_bh_return_pct": -25.58, "B_psr": 0.1794, "B_ic": 0.0245, "B_precision": 0.4118, "B_recall": 0.814, "B_f1": 0.5469, "B_f2": 0.6809, "B_accuracy": 0.3958, "B_mcc": -0.2021, "B_tp": 35, "B_fp": 50, "B_tn": 3, "B_fn": 8, "D_sharpe": -0.3955, "D_sortino": -0.3641, "D_excess_sharpe": -0.1214, "D_return_pct": -5.27, "D_hit_rate": 50.53, "D_n": 96, "D_bh_sharpe": -0.2741, "D_bh_return_pct": -4.09, "D_psr": 0.4034, "D_ic": 0.0138, "D_precision": 0.5116, "D_recall": 0.88, "D_f1": 0.6471, "D_f2": 0.7692, "D_accuracy": 0.5, "D_mcc": -0.054, "D_tp": 44, "D_fp": 42, "D_tn": 4, "D_fn": 6, "sharpe": -0.3955, "sortino": -0.3641, "return_pct": -5.27, "equity": 947.3000000000001, "max_dd": 0.0, "win_rate": 50.53, "profit_factor": 0.0, "ic": 0.0138, "hit": 50.53, "psr": 0.4034, "bh_sharpe": -0.2741, "bh_return_pct": -4.09, "excess_sharpe": -0.1214, "precision": 0.5116, "recall": 0.88, "f1": 0.6471, "f2": 0.7692, "mcc": -0.054, "accuracy": 0.5, "tp": 44, "fp": 42, "tn": 4, "fn": 6}, {"fold": "fold_3", "regime": "Taper tantrum and 2014 H1", "n": 54, "A_sharpe": 3.9729, "A_sortino": 4.4678, "A_excess_sharpe": -0.7269, "A_return_pct": 8.86, "A_hit_rate": 55.56, "A_n": 54, "A_bh_sharpe": 4.6998, "A_bh_return_pct": 10.46, "A_psr": 0.9594, "A_ic": 0.1488, "A_precision": 0.5918, "A_recall": 0.8788, "A_f1": 0.7073, "A_f2": 0.8011, "A_accuracy": 0.5556, "A_mcc": -0.1238, "A_tp": 29, "A_fp": 20, "A_tn": 1, "A_fn": 4, "B_sharpe": 9.0326, "B_sortino": 13.2979, "B_excess_sharpe": 0.0, "B_return_pct": 49.18, "B_hit_rate": 68.52, "B_n": 54, "B_bh_sharpe": 9.0326, "B_bh_return_pct": 49.18, "B_psr": 1.0, "B_ic": 0.5735, "B_precision": 0.6852, "B_recall": 1.0, "B_f1": 0.8132, "B_f2": 0.9158, "B_accuracy": 0.6852, "B_mcc": 0.0, "B_tp": 37, "B_fp": 17, "B_tn": 0, "B_fn": 0, "D_sharpe": 3.9729, "D_sortino": 4.4678, "D_excess_sharpe": -0.7269, "D_return_pct": 8.86, "D_hit_rate": 55.56, "D_n": 54, "D_bh_sharpe": 4.6998, "D_bh_return_pct": 10.46, "D_psr": 0.9594, "D_ic": 0.1488, "D_precision": 0.5918, "D_recall": 0.8788, "D_f1": 0.7073, "D_f2": 0.8011, "D_accuracy": 0.5556, "D_mcc": -0.1238, "D_tp": 29, "D_fp": 20, "D_tn": 1, "D_fn": 4, "sharpe": 3.9729, "sortino": 4.4678, "return_pct": 8.86, "equity": 1088.6, "max_dd": 0.0, "win_rate": 55.56, "profit_factor": 0.0, "ic": 0.1488, "hit": 55.56, "psr": 0.9594, "bh_sharpe": 4.6998, "bh_return_pct": 10.46, "excess_sharpe": -0.7269, "precision": 0.5918, "recall": 0.8788, "f1": 0.7073, "f2": 0.8011, "mcc": -0.1238, "accuracy": 0.5556, "tp": 29, "fp": 20, "tn": 1, "fn": 4}, {"fold": "fold_4", "regime": "China devaluation and oil crash", "n": 96, "A_sharpe": -0.0089, "A_sortino": -0.0081, "A_excess_sharpe": 0.4152, "A_return_pct": -0.77, "A_hit_rate": 54.74, "A_n": 96, "A_bh_sharpe": -0.4241, "A_bh_return_pct": -3.73, "A_psr": 0.4978, "A_ic": 0.1369, "A_precision": 0.5143, "A_recall": 0.8, "A_f1": 0.6261, "A_f2": 0.72, "A_accuracy": 0.5521, "A_mcc": 0.1497, "A_tp": 36, "A_fp": 34, "A_tn": 17, "A_fn": 9, "B_sharpe": -0.8524, "B_sortino": -0.7382, "B_excess_sharpe": 0.3319, "B_return_pct": -16.89, "B_hit_rate": 48.96, "B_n": 96, "B_bh_sharpe": -1.1843, "B_bh_return_pct": -21.44, "B_psr": 0.2926, "B_ic": 0.1492, "B_precision": 0.4835, "B_recall": 0.9565, "B_f1": 0.6423, "B_f2": 0.8, "B_accuracy": 0.4896, "B_mcc": 0.0371, "B_tp": 44, "B_fp": 47, "B_tn": 3, "B_fn": 2, "D_sharpe": -0.0089, "D_sortino": -0.0081, "D_excess_sharpe": 0.4152, "D_return_pct": -0.77, "D_hit_rate": 54.74, "D_n": 96, "D_bh_sharpe": -0.4241, "D_bh_return_pct": -3.73, "D_psr": 0.4978, "D_ic": 0.1369, "D_precision": 0.5143, "D_recall": 0.8, "D_f1": 0.6261, "D_f2": 0.72, "D_accuracy": 0.5521, "D_mcc": 0.1497, "D_tp": 36, "D_fp": 34, "D_tn": 17, "D_fn": 9, "sharpe": -0.0089, "sortino": -0.0081, "return_pct": -0.77, "equity": 992.3, "max_dd": 0.0, "win_rate": 54.74, "profit_factor": 0.0, "ic": 0.1369, "hit": 54.74, "psr": 0.4978, "bh_sharpe": -0.4241, "bh_return_pct": -3.73, "excess_sharpe": 0.4152, "precision": 0.5143, "recall": 0.8, "f1": 0.6261, "f2": 0.72, "mcc": 0.1497, "accuracy": 0.5521, "tp": 36, "fp": 34, "tn": 17, "fn": 9}, {"fold": "fold_5", "regime": "2018 Vol-mageddon + Q4 sell-off", "n": 54, "A_sharpe": -0.1355, "A_sortino": -0.1321, "A_excess_sharpe": -1.5635, "A_return_pct": -0.58, "A_hit_rate": 46.3, "A_n": 54, "A_bh_sharpe": 1.428, "A_bh_return_pct": 3.97, "A_psr": 0.4752, "A_ic": 0.1627, "A_precision": 0.5, "A_recall": 0.8276, "A_f1": 0.6234, "A_f2": 0.7317, "A_accuracy": 0.463, "A_mcc": -0.2101, "A_tp": 24, "A_fp": 24, "A_tn": 1, "A_fn": 5, "B_sharpe": -0.4991, "B_sortino": -0.4235, "B_excess_sharpe": -5.4313, "B_return_pct": -4.2, "B_hit_rate": 57.41, "B_n": 54, "B_bh_sharpe": 4.9322, "B_bh_return_pct": 34.93, "B_psr": 0.409, "B_ic": -0.1957, "B_precision": 0.6458, "B_recall": 0.8378, "B_f1": 0.7294, "B_f2": 0.7908, "B_accuracy": 0.5741, "B_mcc": -0.2397, "B_tp": 31, "B_fp": 17, "B_tn": 0, "B_fn": 6, "D_sharpe": -0.1355, "D_sortino": -0.1321, "D_excess_sharpe": -1.5635, "D_return_pct": -0.58, "D_hit_rate": 46.3, "D_n": 54, "D_bh_sharpe": 1.428, "D_bh_return_pct": 3.97, "D_psr": 0.4752, "D_ic": 0.1627, "D_precision": 0.5, "D_recall": 0.8276, "D_f1": 0.6234, "D_f2": 0.7317, "D_accuracy": 0.463, "D_mcc": -0.2101, "D_tp": 24, "D_fp": 24, "D_tn": 1, "D_fn": 5, "sharpe": -0.1355, "sortino": -0.1321, "return_pct": -0.58, "equity": 994.1999999999999, "max_dd": 0.0, "win_rate": 46.3, "profit_factor": 0.0, "ic": 0.1627, "hit": 46.3, "psr": 0.4752, "bh_sharpe": 1.428, "bh_return_pct": 3.97, "excess_sharpe": -1.5635, "precision": 0.5, "recall": 0.8276, "f1": 0.6234, "f2": 0.7317, "mcc": -0.2101, "accuracy": 0.463, "tp": 24, "fp": 24, "tn": 1, "fn": 5}, {"fold": "fold_6", "regime": "COVID crash and V-recovery", "n": 75, "A_sharpe": 5.0851, "A_sortino": 4.3393, "A_excess_sharpe": 0.7857, "A_return_pct": 17.36, "A_hit_rate": 70.67, "A_n": 75, "A_bh_sharpe": 4.2994, "A_bh_return_pct": 14.68, "A_psr": 0.9927, "A_ic": 0.1383, "A_precision": 0.7231, "A_recall": 0.9216, "A_f1": 0.8103, "A_f2": 0.8736, "A_accuracy": 0.7067, "A_mcc": 0.2354, "A_tp": 47, "A_fp": 18, "A_tn": 6, "A_fn": 4, "B_sharpe": 14.3339, "B_sortino": 13.9941, "B_excess_sharpe": 0.0, "B_return_pct": 120.13, "B_hit_rate": 84.0, "B_n": 75, "B_bh_sharpe": 14.3339, "B_bh_return_pct": 120.13, "B_psr": 1.0, "B_ic": 0.063, "B_precision": 0.84, "B_recall": 1.0, "B_f1": 0.913, "B_f2": 0.9633, "B_accuracy": 0.84, "B_mcc": 0.0, "B_tp": 63, "B_fp": 12, "B_tn": 0, "B_fn": 0, "D_sharpe": 5.0851, "D_sortino": 4.3393, "D_excess_sharpe": 0.7857, "D_return_pct": 17.36, "D_hit_rate": 70.67, "D_n": 75, "D_bh_sharpe": 4.2994, "D_bh_return_pct": 14.68, "D_psr": 0.9927, "D_ic": 0.1383, "D_precision": 0.7231, "D_recall": 0.9216, "D_f1": 0.8103, "D_f2": 0.8736, "D_accuracy": 0.7067, "D_mcc": 0.2354, "D_tp": 47, "D_fp": 18, "D_tn": 6, "D_fn": 4, "sharpe": 5.0851, "sortino": 4.3393, "return_pct": 17.36, "equity": 1173.6, "max_dd": 0.0, "win_rate": 70.67, "profit_factor": 0.0, "ic": 0.1383, "hit": 70.67, "psr": 0.9927, "bh_sharpe": 4.2994, "bh_return_pct": 14.68, "excess_sharpe": 0.7857, "precision": 0.7231, "recall": 0.9216, "f1": 0.8103, "f2": 0.8736, "mcc": 0.2354, "accuracy": 0.7067, "tp": 47, "fp": 18, "tn": 6, "fn": 4}, {"fold": "fold_7", "regime": "Inflation bear, AI rally and 2025", "n": 114, "A_sharpe": 1.9418, "A_sortino": 1.9545, "A_excess_sharpe": -0.9033, "A_return_pct": 14.04, "A_hit_rate": 57.02, "A_n": 114, "A_bh_sharpe": 2.845, "A_bh_return_pct": 21.34, "A_psr": 0.9023, "A_ic": 0.0589, "A_precision": 0.5865, "A_recall": 0.9104, "A_f1": 0.7135, "A_f2": 0.8199, "A_accuracy": 0.5702, "A_mcc": -0.0077, "A_tp": 61, "A_fp": 43, "A_tn": 4, "A_fn": 6, "B_sharpe": 5.6