{"experiment_num": 34, "backbone": "lstm", "description": "LSTM @ exp 8 baseline lr=5e-4 (down from 1e-3) - Smith 2017 cyclical LR; halved log-step for flatter minima", "config": {"seq_len": 10, "lr": 0.0005, "batch_size": 16, "epochs": 100, "weight_decay": 0.0007, "patience": 15, "warmup_epochs": 0, "head_dropout": 0.1, "huber_delta": 1.0, "grad_clip": 1.0, "seed": 0, "hidden_size": null, "num_layers": null, "max_depth": null, "gbm_lr": null, "n_estimators": null}, "composite": -0.378, "test_pos_folds": 5, "val_pos_folds": 3, "val_loss": -2.8780786910708396, "elapsed_sec": 53.3, "timestamp": "2026-04-27T18:33:29", "sharpe": 0.6228, "val_sharpe": -0.178, "ic": 0.0187, "hit": 50.96, "psr": 0.9321, "equity": 2097.9, "return_pct": 109.79, "bh_sharpe": 0.6042, "bh_return_pct": 103.49, "excess_sharpe": 0.0186, "B_sharpe": 0.3097, "B_excess_sharpe": -1.3911, "B_return_pct": 13.99, "D_sharpe": 0.6228, "D_excess_sharpe": 0.0186, "D_return_pct": 109.79, "per_window": [{"fold": "fold_1", "regime": "GFC peak crash (Lehman + Mar-2009 bottom)", "n": 115, "A_sharpe": 1.2823, "A_sortino": 1.5848, "A_excess_sharpe": 1.7264, "A_return_pct": 26.24, "A_hit_rate": 45.22, "A_n": 115, "A_bh_sharpe": -0.4441, "A_bh_return_pct": -14.4, "A_psr": 0.8115, "A_ic": 0.0543, "B_sharpe": 1.6345, "B_sortino": 1.6969, "B_excess_sharpe": 1.9324, "B_return_pct": 62.99, "B_hit_rate": 53.51, "B_n": 115, "B_bh_sharpe": -0.2978, "B_bh_return_pct": -27.23, "B_psr": 0.8628, "B_ic": 0.1223, "D_sharpe": 1.2823, "D_sortino": 1.5848, "D_excess_sharpe": 1.7264, "D_return_pct": 26.24, "D_hit_rate": 45.22, "D_n": 115, "D_bh_sharpe": -0.4441, "D_bh_return_pct": -14.4, "D_psr": 0.8115, "D_ic": 0.0543, "sharpe": 1.2823, "sortino": 1.5848, "return_pct": 26.24, "equity": 1262.3999999999999, "max_dd": 0.0, "win_rate": 45.22, "profit_factor": 0.0, "ic": 0.0543, "hit": 45.22, "psr": 0.8115, "bh_sharpe": -0.4441, "bh_return_pct": -14.4, "excess_sharpe": 1.7264, "precision": 0.4384, "recall": 0.5926, "f1": 0.5039, "f2": 0.5536, "accuracy": 0.4522, "mcc": -0.0824, "tp": 32, "fp": 41, "tn": 20, "fn": 22, "A_precision": 0.4384, "A_recall": 0.5926, "A_f1": 0.5039, "A_f2": 0.5536, "A_accuracy": 0.4522, "A_mcc": -0.0824, "A_tp": 32, "A_fp": 41, "A_tn": 20, "A_fn": 22}, {"fold": "fold_2", "regime": "2011 US-downgrade + EU debt", "n": 136, "A_sharpe": 0.953, "A_sortino": 0.9428, "A_excess_sharpe": -0.7797, "A_return_pct": 9.9, "A_hit_rate": 54.07, "A_n": 136, "A_bh_sharpe": 1.7327, "A_bh_return_pct": 19.75, "A_psr": 0.757, "A_ic": 0.0231, "B_sharpe": 0.4163, "B_sortino": 0.4323, "B_excess_sharpe": -3.6497, "B_return_pct": 4.77, "B_hit_rate": 50.74, "B_n": 136, "B_bh_sharpe": 4.0659, "B_bh_return_pct": 148.68, "B_psr": 0.62, "B_ic": -0.0084, "D_sharpe": 0.953, "D_sortino": 0.9428, "D_excess_sharpe": -0.7797, "D_return_pct": 9.9, "D_hit_rate": 54.07, "D_n": 136, "D_bh_sharpe": 1.7327, "D_bh_return_pct": 19.75, "D_psr": 0.757, "D_ic": 0.0231, "sharpe": 0.953, "sortino": 0.9428, "return_pct": 9.9, "equity": 1099.0, "max_dd": 0.0, "win_rate": 54.07, "profit_factor": 0.0, "ic": 0.0231, "hit": 54.07, "psr": 0.757, "bh_sharpe": 1.7327, "bh_return_pct": 19.75, "excess_sharpe": -0.7797, "precision": 0.5641, "recall": 0.8462, "f1": 0.6769, "f2": 0.7692, "accuracy": 0.5368, "mcc": -0.0473, "tp": 66, "fp": 51, "tn": 7, "fn": 12, "A_precision": 0.5641, "A_recall": 0.8462, "A_f1": 0.6769, "A_f2": 0.7692, "A_accuracy": 0.5368, "A_mcc": -0.0473, "A_tp": 66, "A_fp": 51, "A_tn": 7, "A_fn": 12}, {"fold": "fold_3", "regime": "Taper tantrum and 2014 H1", "n": 178, "A_sharpe": 2.8265, "A_sortino": 2.6173, "A_excess_sharpe": 1.4819, "A_return_pct": 28.33, "A_hit_rate": 60.45, "A_n": 178, "A_bh_sharpe": 1.3445, "A_bh_return_pct": 12.41, "A_psr": 0.9869, "A_ic": 0.1615, "B_sharpe": 0.8589, "B_sortino": 0.8826, "B_excess_sharpe": -2.1894, "B_return_pct": 14.68, "B_hit_rate": 49.44, "B_n": 178, "B_bh_sharpe": 3.0483, "B_bh_return_pct": 71.83, "B_psr": 0.7628, "B_ic": 0.0942, "D_sharpe": 2.8265, "D_sortino": 2.6173, "D_excess_sharpe": 1.4819, "D_return_pct": 28.33, "D_hit_rate": 60.45, "D_n": 178, "D_bh_sharpe": 1.3445, "D_bh_return_pct": 12.41, "D_psr": 0.9869, "D_ic": 0.1615, "sharpe": 2.8265, "sortino": 2.6173, "return_pct": 28.33, "equity": 1283.3000000000002, "max_dd": 0.0, "win_rate": 60.45, "profit_factor": 0.0, "ic": 0.1615, "hit": 60.45, "psr": 0.9869, "bh_sharpe": 1.3445, "bh_return_pct": 12.41, "excess_sharpe": 1.4819, "precision": 0.6053, "recall": 0.8932, "f1": 0.7216, "f2": 0.8156, "accuracy": 0.6011, "mcc": 0.1303, "tp": 92, "fp": 60, "tn": 15, "fn": 11, "A_precision": 0.6053, "A_recall": 0.8932, "A_f1": 0.7216, "A_f2": 0.8156, "A_accuracy": 0.6011, "A_mcc": 0.1303, "A_tp": 92, "A_fp": 60, "A_tn": 15, "A_fn": 11}, {"fold": "fold_4", "regime": "China devaluation and oil crash", "n": 157, "A_sharpe": -0.4414, "A_sortino": -0.4219, "A_excess_sharpe": -0.4512, "A_return_pct": -6.31, "A_hit_rate": 50.0, "A_n": 157, "A_bh_sharpe": 0.0098, "A_bh_return_pct": -1.05, "A_psr": 0.3638, "A_ic": -0.0001, "B_sharpe": 1.8908, "B_sortino": 2.1649, "B_excess_sharpe": 1.8748, "B_return_pct": 57.52, "B_hit_rate": 49.68, "B_n": 157, "B_bh_sharpe": 0.0159, "B_bh_return_pct": -5.48, "B_psr": 0.9334, "B_ic": 0.0928, "D_sharpe": -0.4414, "D_sortino": -0.4219, "D_excess_sharpe": -0.4512, "D_return_pct": -6.31, "D_hit_rate": 50.0, "D_n": 157, "D_bh_sharpe": 0.0098, "D_bh_return_pct": -1.05, "D_psr": 0.3638, "D_ic": -0.0001, "sharpe": -0.4414, "sortino": -0.4219, "return_pct": -6.31, "equity": 936.9000000000001, "max_dd": 0.0, "win_rate": 50.0, "profit_factor": 0.0, "ic": -0.0001, "hit": 50.0, "psr": 0.3638, "bh_sharpe": 0.0098, "bh_return_pct": -1.05, "excess_sharpe": -0.4512, "precision": 0.5096, "recall": 0.6543, "f1": 0.573, "f2": 0.6192, "accuracy": 0.4968, "mcc": -0.0177, "tp": 53, "fp": 51, "tn": 25, "fn": 28, "A_precision": 0.5096, "A_recall": 0.6543, "A_f1": 0.573, "A_f2": 0.6192, "A_accuracy": 0.4968, "A_mcc": -0.0177, "A_tp": 53, "A_fp": 51, "A_tn": 25, "A_fn": 28}, {"fold": "fold_5", "regime": "2018 Vol-mageddon + Q4 sell-off", "n": 177, "A_sharpe": 0.9402, "A_sortino": 1.0557, "A_excess_sharpe": 0.6304, "A_return_pct": 14.25, "A_hit_rate": 48.02, "A_n": 177, "A_bh_sharpe": 0.3098, "A_bh_return_pct": 3.19, "A_psr": 0.7861, "A_ic": 0.0495, "B_sharpe": 0.501, "B_sortino": 0.5643, "B_excess_sharpe": -0.3907, "B_return_pct": 9.2, "B_hit_rate": 46.59, "B_n": 177, "B_bh_sharpe": 0.8917, "B_bh_return_pct": 23.8, "B_psr": 0.663, "B_ic": 0.0329, "D_sharpe": 0.9402, "D_sortino": 1.0557, "D_excess_sharpe": 0.6304, "D_return_pct": 14.25, "D_hit_rate": 48.02, "D_n": 177, "D_bh_sharpe": 0.3098, "D_bh_return_pct": 3.19, "D_psr": 0.7861, "D_ic": 0.0495, "sharpe": 0.9402, "sortino": 1.0557, "return_pct": 14.25, "equity": 1142.5, "max_dd": 0.0, "win_rate": 48.02, "profit_factor": 0.0, "ic": 0.0495, "hit": 48.02, "psr": 0.7861, "bh_sharpe": 0.3098, "bh_return_pct": 3.19, "excess_sharpe": 0.6304, "precision": 0.5545, "recall": 0.5437, "f1": 0.549, "f2": 0.5458, "accuracy": 0.4802, "mcc": -0.0642, "tp": 56, "fp": 45, "tn": 29, "fn": 47, "A_precision": 0.5545, "A_recall": 0.5437, "A_f1": 0.549, "A_f2": 0.5458, "A_accuracy": 0.4802, "A_mcc": -0.0642, "A_tp": 56, "A_fp": 45, "A_tn": 29, "A_fn": 47}, {"fold": "fold_6", "regime": "COVID crash and V-recovery", "n": 222, "A_sharpe": -0.0351, "A_sortino": -0.0372, "A_excess_sharpe": -0.9239, "A_return_pct": -7.19, "A_hit_rate": 48.2, "A_n": 222, "A_bh_sharpe": 0.8888, "A_bh_return_pct": 26.13, "A_psr": 0.4869, "A_ic": -0.0096, "B_sharpe": -1.2963, "B_sortino": -1.3708, "B_excess_sharpe": -3.6847, "B_return_pct": -63.54, "B_hit_rate": 42.99, "B_n": 222, "B_bh_sharpe": 2.3884, "B_bh_return_pct": 243.18, "B_psr": 0.1168, "B_ic": -0.1728, "D_sharpe": -0.0351, "D_sortino": -0.0372, "D_excess_sharpe": -0.9239, "D_return_pct": -7.19, "D_hit_rate": 48.2, "D_n": 222, "D_bh_sharpe": 0.8888, "D_bh_return_pct": 26.13, "D_psr": 0.4869, "D_ic": -0.0096, "sharpe": -0.0351, "sortino": -0.0372, "return_pct": -7.19, "equity": 928.1, "max_dd": 0.0, "win_rate": 48.2, "profit_factor": 0.0, "ic": -0.0096, "hit": 48.2, "psr": 0.4869, "bh_sharpe": 0.8888, "bh_return_pct": 26.13, "excess_sharpe": -0.9239, "precision": 0.5935, "recall": 0.529, "f1": 0.5594, "f2": 0.5407, "accuracy": 0.482, "mcc": -0.0646, "tp": 73, "fp": 50, "tn": 34, "fn": 65, "A_precision": 0.5935, "A_recall": 0.529, "A_f1": 0.5594, "A_f2": 0.5407, "A_accuracy": 0.482, "A_mcc": -0.0646, "A_tp": 73, "A_fp": 50, "A_tn": 34, "A_fn": 65}, {"fold": "fold_7", "regime": "Inflation bear, AI rally and 2025", "n": 425, "A_sharpe": 0.5735, "A_sortino": 0.6369, "A_excess_sharpe": -0.398, "A_return_pct": 18.61, "A_hit_rate": 50.59, "A_n": 425, "A_bh_sharpe": 0.9715, "A_bh_return_pct": 37.12, "A_psr": 0.7763, "A_ic": 0.0108, "B_sharpe": 0.1283, "B_sortino": 0.14, "B_excess_sharpe": -2.3743, "B_return_pct": -7.18, "B_hit_rate": 47.88, "B_n": 425, "B_bh_sharpe": 2.5027, "B_bh_return_pct": 458.83, "B_psr": 0.5662, "B_ic": -0.0674, "D_sharpe": 0.5735, "D_sortino": 0.6369, "D_excess_sharpe": -0.398, "D_return_pct": 18.61, "D_hit_rate": 50.59, "D_n": 425, "D_bh_sharpe": 0.9715, "D_bh_return_pct": 37.12, "D_psr": 0.7763, "D_ic": 0.0108, "sharpe": 0.5735, "sortino": 0.6369, "return_pct": 18.61, "equity": 1186.1, "max_dd": 0.0, "win_rate": 50.59, "profit_factor": 0.0, "ic": 0.0108, "hit": 50.59, "psr": 0.7763, "bh_sharpe": 0.9715, "bh_return_pct": 37.12, "excess_sharpe": -0.398, "precision": 0.602, "recall": 0.472, "f1": 0.5291, "f2": 0.4933, "accuracy": 0.5059, "mcc": 0.026, "tp": 118, "fp": 78, "tn": 97, "fn": 132, "A_precision": 0.602, "A_recall": 0.472, "A_f1": 0.5291, "A_f2": 0.4933, "A_accuracy": 0.5059, "A_mcc": 0.026, "A_tp": 118, "A_fp": 78, "A_tn": 97, "A_fn": 132}], "per_window_val": [{"fold": "fold_1", "regime": "GFC peak crash (Lehman + Mar-2009 bottom)", "n": 104, "A_sharpe": 1.274, "A_sortino": 1.1931, "A_excess_sharpe": 1.4412, "A_return_pct": 14.69, "A_hit_rate": 52.94, "A_n": 104, "A_bh_sharpe": -0.1672, "A_bh_return_pct": -3.81, "A_psr": 0.783, "A_ic": 0.1851, "B_sharpe": -0.5808, "B_sortino": -0.5397, "B_excess_sharpe": 1.6933, "B_return_pct": -17.98, "B_hit_rate": 47.57, "B_n": 104, "B_bh_sharpe": -2.2741, "B_bh_return_pct": -44.12, "B_psr": 0.3534, "B_ic": 0.0833, "D_sharpe": 1.274, "D_sortino": 1.1931, "D_excess_sharpe": 1.4412, "D_return_pct": 14.69, "D_hit_rate": 52.94, "D_n": 104, "D_bh_sharpe": -0.1672, "D_bh_return_pct": -3.81, "D_psr": 0.783, "D_ic": 0.1851, "sharpe": 1.274, "sortino": 1.1931, "return_pct": 14.69, "equity": 1146.9, "max_dd": 0.0, "win_rate": 52.94, "profit_factor": 0.0, "ic": 0.1851, "hit": 52.94, "psr": 0.783, "bh_sharpe": -0.1672, "bh_return_pct": -3.81, "excess_sharpe": 1.4412}, {"fold": "fold_2", "regime": "2011 US-downgrade + EU debt", "n": 96, "A_sharpe": -1.7587, "A_sortino": -1.5656, "A_excess_sharpe": -1.4846, "A_return_pct": -17.5, "A_hit_rate": 48.42, "A_n": 96, "A_bh_sharpe": -0.2741, "A_bh_return_pct": -4.09, "A_psr": 0.1346, "A_ic": -0.1439, "B_sharpe": -1.8185, "B_sortino": -1.7201, "B_excess_sharpe": -0.7911, "B_return_pct": -37.48, "B_hit_rate": 44.79, "B_n": 96, "B_bh_sharpe": -1.0274, "B_bh_return_pct": -25.58, "B_psr": 0.128, "B_ic": -0.0674, "D_sharpe": -1.7587, "D_sortino": -1.5656, "D_excess_sharpe": -1.4846, "D_return_pct": -17.5, "D_hit_rate": 48.42, "D_n": 96, "D_bh_sharpe": -0.2741, "D_bh_return_pct": -4.09, "D_psr": 0.1346, "D_ic": -0.1439, "sharpe": -1.7587, "sortino": -1.5656, "return_pct": -17.5, "equity": 825.0, "max_dd": 0.0, "win_rate": 48.42, "profit_factor": 0.0, "ic": -0.1439, "hit": 48.42, "psr": 0.1346, "bh_sharpe": -0.2741, "bh_return_pct": -4.09, "excess_sharpe": -1.4846}, {"fold": "fold_3", "regime": "Taper tantrum and 2014 H1", "n": 54, "A_sharpe": 2.9342, "A_sortino": 3.0719, "A_excess_sharpe": -1.7656, "A_return_pct": 6.53, "A_hit_rate": 51.85, "A_n": 54, "A_bh_sharpe": 4.6998, "A_bh_return_pct": 10.46, "A_psr": 0.8973, "A_ic": 0.1395, "B_sharpe": 4.8587, "B_sortino": 6.2602, "B_excess_sharpe": -4.1738, "B_return_pct": 26.39, "B_hit_rate": 57.41, "B_n": 54, "B_bh_sharpe": 9.0326, "B_bh_return_pct": 49.18, "B_psr": 0.9892, "B_ic": 0.246, "D_sharpe": 2.9342, "D_sortino": 3.0719, "D_excess_sharpe": -1.7656, "D_return_pct": 6.53, "D_hit_rate": 51.85, "D_n": 54, "D_bh_sharpe": 4.6998, "D_bh_return_pct": 10.46, "D_psr": 0.8973, "D_ic": 0.1395, "sharpe": 2.9342, "sortino": 3.0719, "return_pct": 6.53, "equity": 1065.3, "max_dd": 0.0, "win_rate": 51.85, "profit_factor": 0.0, "ic": 0.1395, "hit": 51.85, "psr": 0.8973, "bh_sharpe": 4.6998, "bh_return_pct": 10.46, "excess_sharpe": -1.7656}, {"fold": "fold_4", "regime": "China devaluation and oil crash", "n": 96, "A_sharpe": 1.1273, "A_sortino": 1.0768, "A_excess_sharpe": 1.5514, "A_return_pct": 7.81, "A_hit_rate": 55.79, "A_n": 96, "A_bh_sharpe": -0.4241, "A_bh_return_pct": -3.73, "A_psr": 0.7536, "A_ic": 0.1409, "B_sharpe": 5.068, "B_sortino": 6.436, "B_excess_sharpe": 6.2523, "B_return_pct": 119.74, "B_hit_rate": 66.67, "B_n": 96, "B_bh_sharpe": -1.1843, "B_bh_return_pct": -21.44, "B_psr": 0.9999, "B_ic": 0.4124, "D_sharpe": 1.1273, "D_sortino": 1.0768, "D_excess_sharpe": 1.5514, "D_return_pct": 7.81, "D_hit_rate": 55.79, "D_n": 96, "D_bh_sharpe": -0.4241, "D_bh_return_pct": -3.73, "D_psr": 0.7536, "D_ic": 0.1409, "sharpe": 1.1273, "sortino": 1.0768, "return_pct": 7.81, "equity": 1078.1000000000001, "max_dd": 0.0, "win_rate": 55.79, "profit_factor": 0.0, "ic": 0.1409, "hit": 55.79, "psr": 0.7536, "bh_sharpe": -0.4241, "bh_return_pct": -3.73, "excess_sharpe": 1.5514}, {"fold": "fold_5", "regime": "2018 Vol-mageddon + Q4 sell-off", "n": 54, "A_sharpe": -1.6763, "A_sortino": -1.5584, "A_excess_sharpe": -3.1043, "A_return_pct": -4.86, "A_hit_rate": 48.15, "A_n": 54, "A_bh_sharpe": 1.428, "A_bh_return_pct": 3.97, "A_psr": 0.222, "A_ic": 0.0586, "B_sharpe": -3.2999, "B_sortino": -3.1001, "B_excess_sharpe": -8.2321, "B_return_pct": -19.95, "B_hit_rate": 42.59, "B_n": 54, "B_bh_sharpe": 4.9322, "B_bh_return_pct": 34.93, "B_psr": 0.0708, "B_ic": -0.0851, "D_sharpe": -1.6763, "D_sortino": -1.5584, "D_excess_sharpe": -3.1043, "D_return_pct": -4.86, "D_hit_rate": 48.15, "D_n": 54, "D_bh_sharpe": 1.428, "D_bh_return_pct": 3.97, "D_psr": 0.222, "D_ic": 0.0586, "sharpe": -1.6763, "sortino": -1.5584, "return_pct": -4.86, "equity": 951.4, "max_dd": 0.0, "win_rate": 48.15, "profit_factor": 0.0, "ic": 0.0586, "hit": 48.15, "psr": 0.222, "bh_sharpe": 1.428, "bh_return_pct": 3.97, "excess_sharpe": -3.1043}, {"fold": "fold_6", "regime": "COVID crash and V-recovery", "n": 75, "A_sharpe": -0.7693, "A_sortino": -0.8187, "A_excess_sharpe": -5.0687, "A_return_pct": -2.72, "A_hit_rate": 45.33, "A_n": 75, "A_bh_sharpe": 4.2994, "A_bh_return_pct": 14.68, "A_psr": 0.34, "A_ic": 0.0114, "B_sharpe": -8.4479, "B_sortino": -7.2688, "B_excess_sharpe": -22.7818, "B_return_pct": -43.4, "B_hit_rate": 25.33, "B_n": 75, "B_bh_sharpe": 14.3339, "B_bh_return_pct": 120.13, "B_psr": 0.0, "B_ic": 0.0447, "D_sharpe": -0.7693, "D_sortino": -0.8187, "D_excess_sharpe": -5.0687, "D_return_pct": -2.72, "D_hit_rate": 45.33, "D_n": 75, "D_bh_sharpe": 4.2994, "D_bh_return_pct": 14.68, "D_psr": 0.34, "D_ic": 0.0114, "sharpe": -0.7693, "sortino": -0.8187, "return_pct": -2.72, "equity": 972.8, "max_dd": 0.0, "win_rate": 45.33, "profit_factor": 0.0, "ic": 0.0114, "hit": 45.33, "psr": 0.34, "bh_sharpe": 4.2994, "bh_return_pct": 14.68, "excess_sharpe": -5.0687}, {"fold": "fold_7", "regime": "Inflation bear, AI rally and 2025", "n": 114, "A_sharpe": -1.9241, "A_sortino": -1.8404, "A_excess_sharpe": -4.7692, "A_return_pct": -13.18, "A_hit_rate": 44.74, "A_n": 114, "A_bh_sharpe": 2.845, "A_bh_return_pct": 21.34, "A_psr": 0.0991, "A_ic": -0.1189, "B_sharpe": 0.0788, "B_sortino": 0.0834, "B_excess_sharpe": -6.0579, "B_return_pct": -1.79, "B_hit_rate": 50.0, "B_n": 114, "B_bh_sharpe": 6.1366, "B_bh_return_pct": 155.03, "B_psr": 0.5211, "B_ic": -0.1228, "D_sharpe": -1.9241, "D_sortino": -1.8404, "D_excess_sharpe": -4.7692, "D_return_pct": -13.18, "D_hit_rate": 44.74, "D_n": 114, "D_bh_sharpe": 2.845, "D_bh_return_pct": 21.34, "D_psr": 0.0991, "D_ic": -0.1189, "sharpe": -1.9241, "sortino": -1.8404, "return_pct": -13.18, "equity": 868.1999999999999, "max_dd": 0.0, "win_rate": 44.74, "profit_factor": 0.0, "ic": -0.1189, "hit": 44.74, "psr": 0.0991, "bh_sharpe": 2.845, "bh_return_pct": 21.34, "excess_sharpe": -4.7692}], "status": "DISCARD", "precision": 0.5658, "recall": 0.6072, "f1": 0.5858, "f2": 0.5984, "accuracy": 0.5085, "mcc": -0.0166, "tp": 490, "fp": 376, "tn": 227, "fn": 317, "test_sharpe": 0.6228, "A_sharpe": 0.6228, "A_excess_sharpe": 0.0186, "A_return_pct": 109.79, "A_precision": 0.5658, "A_recall": 0.6072, "A_f1": 0.5858, "A_f2": 0.5984, "A_accuracy": 0.5085, "A_mcc": -0.0166, "A_tp": 490, "A_fp": 376, "A_tn": 227, "A_fn": 317, "A_psr": 0.9321, "A_ic": 0.0187, "A_hit_rate": 50.96, "A_bh_sharpe": 0.6042, "A_bh_return_pct": 103.49}
