{"experiment_num": 77, "backbone": "lstm", "description": "LSTM @ exp 71 1-layer + huber=0.1 - cross-axis combo of two QQQ findings (1-layer stability + F1-fix delta)", "config": {"seq_len": 10, "lr": 0.001, "batch_size": 16, "epochs": 100, "weight_decay": 0.0007, "patience": 15, "warmup_epochs": 0, "head_dropout": 0.1, "huber_delta": 0.1, "grad_clip": 1.0, "seed": 0, "hidden_size": null, "num_layers": 1, "max_depth": null, "gbm_lr": null, "n_estimators": null}, "composite": -0.7229, "test_pos_folds": 3, "val_pos_folds": 3, "val_loss": -2.888884162420366, "elapsed_sec": 42.7, "timestamp": "2026-04-27T23:12:42", "sharpe": 0.2303, "val_sharpe": -0.3229, "ic": 0.0201, "hit": 52.59, "psr": 0.7069, "equity": 1154.1000000000001, "return_pct": 15.41, "bh_sharpe": 0.6042, "bh_return_pct": 103.49, "excess_sharpe": -0.3739, "B_sharpe": -0.2937, "B_excess_sharpe": -1.9945, "B_return_pct": -81.27, "D_sharpe": 0.2303, "D_excess_sharpe": -0.3739, "D_return_pct": 15.41, "precision": 0.5736, "recall": 0.6667, "f1": 0.6166, "f2": 0.6457, "mcc": 0.0035, "accuracy": 0.5255, "val_precision": 0.5468, "val_recall": 0.5684, "val_f1": 0.5574, "val_f2": 0.5639, "val_mcc": -0.0188, "val_accuracy": 0.4992, "per_window": [{"fold": "fold_1", "regime": "GFC peak crash (Lehman + Mar-2009 bottom)", "n": 115, "A_sharpe": -0.7588, "A_sortino": -0.7914, "A_excess_sharpe": -0.3147, "A_return_pct": -20.24, "A_hit_rate": 44.35, "A_n": 115, "A_bh_sharpe": -0.4441, "A_bh_return_pct": -14.4, "A_psr": 0.3057, "A_ic": 0.0092, "A_precision": 0.45, "A_recall": 0.8333, "A_f1": 0.5844, "A_f2": 0.712, "A_accuracy": 0.4435, "A_mcc": -0.1012, "A_tp": 45, "A_fp": 55, "A_tn": 6, "A_fn": 9, "B_sharpe": 2.2735, "B_sortino": 2.3146, "B_excess_sharpe": 2.5714, "B_return_pct": 111.53, "B_hit_rate": 55.26, "B_n": 115, "B_bh_sharpe": -0.2978, "B_bh_return_pct": -27.23, "B_psr": 0.933, "B_ic": 0.1087, "B_precision": 0.6333, "B_recall": 0.322, "B_f1": 0.427, "B_f2": 0.3571, "B_accuracy": 0.5565, "B_mcc": 0.143, "B_tp": 19, "B_fp": 11, "B_tn": 45, "B_fn": 40, "D_sharpe": -0.7588, "D_sortino": -0.7914, "D_excess_sharpe": -0.3147, "D_return_pct": -20.24, "D_hit_rate": 44.35, "D_n": 115, "D_bh_sharpe": -0.4441, "D_bh_return_pct": -14.4, "D_psr": 0.3057, "D_ic": 0.0092, "D_precision": 0.45, "D_recall": 0.8333, "D_f1": 0.5844, "D_f2": 0.712, "D_accuracy": 0.4435, "D_mcc": -0.1012, "D_tp": 45, "D_fp": 55, "D_tn": 6, "D_fn": 9, "sharpe": -0.7588, "sortino": -0.7914, "return_pct": -20.24, "equity": 797.6, "max_dd": 0.0, "win_rate": 44.35, "profit_factor": 0.0, "ic": 0.0092, "hit": 44.35, "psr": 0.3057, "bh_sharpe": -0.4441, "bh_return_pct": -14.4, "excess_sharpe": -0.3147, "precision": 0.45, "recall": 0.8333, "f1": 0.5844, "f2": 0.712, "mcc": -0.1012, "accuracy": 0.4435, "tp": 45, "fp": 55, "tn": 6, "fn": 9}, {"fold": "fold_2", "regime": "2011 US-downgrade + EU debt", "n": 136, "A_sharpe": -0.0073, "A_sortino": -0.0076, "A_excess_sharpe": -1.74, "A_return_pct": -1.22, "A_hit_rate": 50.37, "A_n": 136, "A_bh_sharpe": 1.7327, "A_bh_return_pct": 19.75, "A_psr": 0.4979, "A_ic": -0.0459, "A_precision": 0.5658, "A_recall": 0.5513, "A_f1": 0.5584, "A_f2": 0.5541, "A_accuracy": 0.5, "A_mcc": -0.0176, "A_tp": 43, "A_fp": 33, "A_tn": 25, "A_fn": 35, "B_sharpe": -0.172, "B_sortino": -0.1459, "B_excess_sharpe": -4.2379, "B_return_pct": -9.38, "B_hit_rate": 58.09, "B_n": 136, "B_bh_sharpe": 4.0659, "B_bh_return_pct": 148.68, "B_psr": 0.4498, "B_ic": -0.0984, "B_precision": 0.6857, "B_recall": 0.75, "B_f1": 0.7164, "B_f2": 0.7362, "B_accuracy": 0.5809, "B_mcc": -0.0815, "B_tp": 72, "B_fp": 33, "B_tn": 7, "B_fn": 24, "D_sharpe": -0.0073, "D_sortino": -0.0076, "D_excess_sharpe": -1.74, "D_return_pct": -1.22, "D_hit_rate": 50.37, "D_n": 136, "D_bh_sharpe": 1.7327, "D_bh_return_pct": 19.75, "D_psr": 0.4979, "D_ic": -0.0459, "D_precision": 0.5658, "D_recall": 0.5513, "D_f1": 0.5584, "D_f2": 0.5541, "D_accuracy": 0.5, "D_mcc": -0.0176, "D_tp": 43, "D_fp": 33, "D_tn": 25, "D_fn": 35, "sharpe": -0.0073, "sortino": -0.0076, "return_pct": -1.22, "equity": 987.8, "max_dd": 0.0, "win_rate": 50.37, "profit_factor": 0.0, "ic": -0.0459, "hit": 50.37, "psr": 0.4979, "bh_sharpe": 1.7327, "bh_return_pct": 19.75, "excess_sharpe": -1.74, "precision": 0.5658, "recall": 0.5513, "f1": 0.5584, "f2": 0.5541, "mcc": -0.0176, "accuracy": 0.5, "tp": 43, "fp": 33, "tn": 25, "fn": 35}, {"fold": "fold_3", "regime": "Taper tantrum and 2014 H1", "n": 178, "A_sharpe": 1.4202, "A_sortino": 1.3771, "A_excess_sharpe": 0.0756, "A_return_pct": 13.18, "A_hit_rate": 53.67, "A_n": 178, "A_bh_sharpe": 1.3445, "A_bh_return_pct": 12.41, "A_psr": 0.877, "A_ic": 0.1861, "A_precision": 0.6064, "A_recall": 0.5534, "A_f1": 0.5787, "A_f2": 0.5632, "A_accuracy": 0.5337, "A_mcc": 0.0594, "A_tp": 57, "A_fp": 37, "A_tn": 38, "A_fn": 46, "B_sharpe": -0.0319, "B_sortino": -0.026, "B_excess_sharpe": -3.0802, "B_return_pct": -3.11, "B_hit_rate": 59.55, "B_n": 178, "B_bh_sharpe": 3.0483, "B_bh_return_pct": 71.83, "B_psr": 0.4893, "B_ic": -0.2515, "B_precision": 0.6276, "B_recall": 0.8349, "B_f1": 0.7165, "B_f2": 0.7831, "B_accuracy": 0.5955, "B_mcc": 0.0655, "B_tp": 91, "B_fp": 54, "B_tn": 15, "B_fn": 18, "D_sharpe": 1.4202, "D_sortino": 1.3771, "D_excess_sharpe": 0.0756, "D_return_pct": 13.18, "D_hit_rate": 53.67, "D_n": 178, "D_bh_sharpe": 1.3445, "D_bh_return_pct": 12.41, "D_psr": 0.877, "D_ic": 0.1861, "D_precision": 0.6064, "D_recall": 0.5534, "D_f1": 0.5787, "D_f2": 0.5632, "D_accuracy": 0.5337, "D_mcc": 0.0594, "D_tp": 57, "D_fp": 37, "D_tn": 38, "D_fn": 46, "sharpe": 1.4202, "sortino": 1.3771, "return_pct": 13.18, "equity": 1131.8, "max_dd": 0.0, "win_rate": 53.67, "profit_factor": 0.0, "ic": 0.1861, "hit": 53.67, "psr": 0.877, "bh_sharpe": 1.3445, "bh_return_pct": 12.41, "excess_sharpe": 0.0756, "precision": 0.6064, "recall": 0.5534, "f1": 0.5787, "f2": 0.5632, "mcc": 0.0594, "accuracy": 0.5337, "tp": 57, "fp": 37, "tn": 38, "fn": 46}, {"fold": "fold_4", "regime": "China devaluation and oil crash", "n": 157, "A_sharpe": -0.8877, "A_sortino": -0.7368, "A_excess_sharpe": -0.8975, "A_return_pct": -11.22, "A_hit_rate": 56.41, "A_n": 157, "A_bh_sharpe": 0.0098, "A_bh_return_pct": -1.05, "A_psr": 0.2391, "A_ic": 0.0614, "A_precision": 0.5657, "A_recall": 0.6914, "A_f1": 0.6222, "A_f2": 0.6619, "A_accuracy": 0.5669, "A_mcc": 0.13, "A_tp": 56, "A_fp": 43, "A_tn": 33, "A_fn": 25, "B_sharpe": 0.9528, "B_sortino": 1.0912, "B_excess_sharpe": 0.9369, "B_return_pct": 22.24, "B_hit_rate": 48.41, "B_n": 157, "B_bh_sharpe": 0.0159, "B_bh_return_pct": -5.48, "B_psr": 0.7761, "B_ic": 0.0426, "B_precision": 0.5233, "B_recall": 0.5294, "B_f1": 0.5263, "B_f2": 0.5282, "B_accuracy": 0.4841, "B_mcc": -0.0401, "B_tp": 45, "B_fp": 41, "B_tn": 31, "B_fn": 40, "D_sharpe": -0.8877, "D_sortino": -0.7368, "D_excess_sharpe": -0.8975, "D_return_pct": -11.22, "D_hit_rate": 56.41, "D_n": 157, "D_bh_sharpe": 0.0098, "D_bh_return_pct": -1.05, "D_psr": 0.2391, "D_ic": 0.0614, "D_precision": 0.5657, "D_recall": 0.6914, "D_f1": 0.6222, "D_f2": 0.6619, "D_accuracy": 0.5669, "D_mcc": 0.13, "D_tp": 56, "D_fp": 43, "D_tn": 33, "D_fn": 25, "sharpe": -0.8877, "sortino": -0.7368, "return_pct": -11.22, "equity": 887.8000000000001, "max_dd": 0.0, "win_rate": 56.41, "profit_factor": 0.0, "ic": 0.0614, "hit": 56.41, "psr": 0.2391, "bh_sharpe": 0.0098, "bh_return_pct": -1.05, "excess_sharpe": -0.8975, "precision": 0.5657, "recall": 0.6914, "f1": 0.6222, "f2": 0.6619, "mcc": 0.13, "accuracy": 0.5669, "tp": 56, "fp": 43, "tn": 33, "fn": 25}, {"fold": "fold_5", "regime": "2018 Vol-mageddon + Q4 sell-off", "n": 177, "A_sharpe": -0.7815, "A_sortino": -0.7898, "A_excess_sharpe": -1.0913, "A_return_pct": -13.49, "A_hit_rate": 47.46, "A_n": 177, "A_bh_sharpe": 0.3098, "A_bh_return_pct": 3.19, "A_psr": 0.2582, "A_ic": -0.0665, "A_precision": 0.549, "A_recall": 0.5437, "A_f1": 0.5463, "A_f2": 0.5447, "A_accuracy": 0.4746, "A_mcc": -0.0778, "A_tp": 56, "A_fp": 46, "A_tn": 28, "A_fn": 47, "B_sharpe": 1.1232, "B_sortino": 1.1134, "B_excess_sharpe": 0.2315, "B_return_pct": 33.58, "B_hit_rate": 55.68, "B_n": 177, "B_bh_sharpe": 0.8917, "B_bh_return_pct": 23.8, "B_psr": 0.8263, "B_ic": 0.052, "B_precision": 0.6705, "B_recall": 0.5413, "B_f1": 0.599, "B_f2": 0.563, "B_accuracy": 0.5537, "B_mcc": 0.1117, "B_tp": 59, "B_fp": 29, "B_tn": 39, "B_fn": 50, "D_sharpe": -0.7815, "D_sortino": -0.7898, "D_excess_sharpe": -1.0913, "D_return_pct": -13.49, "D_hit_rate": 47.46, "D_n": 177, "D_bh_sharpe": 0.3098, "D_bh_return_pct": 3.19, "D_psr": 0.2582, "D_ic": -0.0665, "D_precision": 0.549, "D_recall": 0.5437, "D_f1": 0.5463, "D_f2": 0.5447, "D_accuracy": 0.4746, "D_mcc": -0.0778, "D_tp": 56, "D_fp": 46, "D_tn": 28, "D_fn": 47, "sharpe": -0.7815, "sortino": -0.7898, "return_pct": -13.49, "equity": 865.1, "max_dd": 0.0, "win_rate": 47.46, "profit_factor": 0.0, "ic": -0.0665, "hit": 47.46, "psr": 0.2582, "bh_sharpe": 0.3098, "bh_return_pct": 3.19, "excess_sharpe": -1.0913, "precision": 0.549, "recall": 0.5437, "f1": 0.5463, "f2": 0.5447, "mcc": -0.0778, "accuracy": 0.4746, "tp": 56, "fp": 46, "tn": 28, "fn": 47}, {"fold": "fold_6", "regime": "COVID crash and V-recovery", "n": 222, "A_sharpe": 0.6007, "A_sortino": 0.5967, "A_excess_sharpe": -0.2881, "A_return_pct": 14.64, "A_hit_rate": 51.8, "A_n": 222, "A_bh_sharpe": 0.8888, "A_bh_return_pct": 26.13, "A_psr": 0.7113, "A_ic": 0.039, "A_precision": 0.6165, "A_recall": 0.5942, "A_f1": 0.6052, "A_f2": 0.5985, "A_accuracy": 0.518, "A_mcc": -0.0128, "A_tp": 82, "A_fp": 51, "A_tn": 33, "A_fn": 56, "B_sharpe": -2.6157, "B_sortino": -2.6512, "B_excess_sharpe": -5.0041, "B_return_pct": -83.52, "B_hit_rate": 39.37, "B_n": 222, "B_bh_sharpe": 2.3884, "B_bh_return_pct": 243.18, "B_psr": 0.0095, "B_ic": -0.234, "B_precision": 0.5169, "B_recall": 0.3358, "B_f1": 0.4071, "B_f2": 0.3611, "B_accuracy": 0.3964, "B_mcc": -0.1687, "B_tp": 46, "B_fp": 43, "B_tn": 42, "B_fn": 91, "D_sharpe": 0.6007, "D_sortino": 0.5967, "D_excess_sharpe": -0.2881, "D_return_pct": 14.64, "D_hit_rate": 51.8, "D_n": 222, "D_bh_sharpe": 0.8888, "D_bh_return_pct": 26.13, "D_psr": 0.7113, "D_ic": 0.039, "D_precision": 0.6165, "D_recall": 0.5942, "D_f1": 0.6052, "D_f2": 0.5985, "D_accuracy": 0.518, "D_mcc": -0.0128, "D_tp": 82, "D_fp": 51, "D_tn": 33, "D_fn": 56, "sharpe": 0.6007, "sortino": 0.5967, "return_pct": 14.64, "equity": 1146.4, "max_dd": 0.0, "win_rate": 51.8, "profit_factor": 0.0, "ic": 0.039, "hit": 51.8, "psr": 0.7113, "bh_sharpe": 0.8888, "bh_return_pct": 26.13, "excess_sharpe": -0.2881, "precision": 0.6165, "recall": 0.5942, "f1": 0.6052, "f2": 0.5985, "mcc": -0.0128, "accuracy": 0.518, "tp": 82, "fp": 51, "tn": 33, "fn": 56}, {"fold": "fold_7", "regime": "Inflation bear, AI rally and 2025", "n": 425, "A_sharpe": 1.1619, "A_sortino": 1.1595, "A_excess_sharpe": 0.1904, "A_return_pct": 46.97, "A_hit_rate": 56.24, "A_n": 425, "A_bh_sharpe": 0.9715, "A_bh_return_pct": 37.12, "A_psr": 0.938, "A_ic": 0.0688, "A_precision": 0.5958, "A_recall": 0.796, "A_f1": 0.6815, "A_f2": 0.7459, "A_accuracy": 0.5624, "A_mcc": 0.0295, "A_tp": 199, "A_fp": 135, "A_tn": 40, "A_fn": 51, "B_sharpe": -1.0551, "B_sortino": -1.0257, "B_excess_sharpe": -3.5577, "B_return_pct": -62.52, "B_hit_rate": 48.35, "B_n": 425, "B_bh_sharpe": 2.5027, "B_bh_return_pct": 458.83, "B_psr": 0.0875, "B_ic": -0.0927, "B_precision": 0.5788, "B_recall": 0.6008, "B_f1": 0.5896, "B_f2": 0.5962, "B_accuracy": 0.4824, "B_mcc": -0.1106, "B_tp": 158, "B_fp": 115, "B_tn": 47, "B_fn": 105, "D_sharpe": 1.1619, "D_sortino": 1.1595, "D_excess_sharpe": 0.1904, "D_return_pct": 46.97, "D_hit_rate": 56.24, "D_n": 425, "D_bh_sharpe": 0.9715, "D_bh_return_pct": 37.12, "D_psr": 0.938, "D_ic": 0.0688, "D_precision": 0.5958, "D_recall": 0.796, "D_f1": 0.6815, "D_f2": 0.7459, "D_accuracy": 0.5624, "D_mcc": 0.0295, "D_tp": 199, "D_fp": 135, "D_tn": 40, "D_fn": 51, "sharpe": 1.1619, "sortino": 1.1595, "return_pct": 46.97, "equity": 1469.7, "max_dd": 0.0, "win_rate": 56.24, "profit_factor": 0.0, "ic": 0.0688, "hit": 56.24, "psr": 0.938, "bh_sharpe": 0.9715, "bh_return_pct": 37.12, "excess_sharpe": 0.1904, "precision": 0.5958, "recall": 0.796, "f1": 0.6815, "f2": 0.7459, "mcc": 0.0295, "accuracy": 0.5624, "tp": 199, "fp": 135, "tn": 40, "fn": 51}], "per_window_val": [{"fold": "fold_1", "regime": "GFC peak crash (Lehman + Mar-2009 bottom)", "n": 104, "A_sharpe": -1.1036, "A_sortino": -0.9388, "A_excess_sharpe": -0.9364, "A_return_pct": -14.2, "A_hit_rate": 50.98, "A_n": 104, "A_bh_sharpe": -0.1672, "A_bh_return_pct": -3.81, "A_psr": 0.2324, "A_ic": -0.0496, "A_precision": 0.5211, "A_recall": 0.6852, "A_f1": 0.592, "A_f2": 0.6446, "A_accuracy": 0.5096, "A_mcc": 0.0056, "A_tp": 37, "A_fp": 34, "A_tn": 16, "A_fn": 17, "B_sharpe": 1.9155, "B_sortino": 2.549, "B_excess_sharpe": 4.1896, "B_return_pct": 45.36, "B_hit_rate": 46.6, "B_n": 104, "B_bh_sharpe": -2.2741, "B_bh_return_pct": -44.12, "B_psr": 0.9016, "B_ic": 0.1304, "B_precision": 0.4211, "B_recall": 0.1538, "B_f1": 0.2254, "B_f2": 0.1762, "B_accuracy": 0.4712, "B_mcc": -0.0747, "B_tp": 8, "B_fp": 11, "B_tn": 41, "B_fn": 44, "D_sharpe": -1.1036, "D_sortino": -0.9388, "D_excess_sharpe": -0.9364, "D_return_pct": -14.2, "D_hit_rate": 50.98, "D_n": 104, "D_bh_sharpe": -0.1672, "D_bh_return_pct": -3.81, "D_psr": 0.2324, "D_ic": -0.0496, "D_precision": 0.5211, "D_recall": 0.6852, "D_f1": 0.592, "D_f2": 0.6446, "D_accuracy": 0.5096, "D_mcc": 0.0056, "D_tp": 37, "D_fp": 34, "D_tn": 16, "D_fn": 17, "sharpe": -1.1036, "sortino": -0.9388, "return_pct": -14.2, "equity": 858.0, "max_dd": 0.0, "win_rate": 50.98, "profit_factor": 0.0, "ic": -0.0496, "hit": 50.98, "psr": 0.2324, "bh_sharpe": -0.1672, "bh_return_pct": -3.81, "excess_sharpe": -0.9364, "precision": 0.5211, "recall": 0.6852, "f1": 0.592, "f2": 0.6446, "mcc": 0.0056, "accuracy": 0.5096, "tp": 37, "fp": 34, "tn": 16, "fn": 17}, {"fold": "fold_2", "regime": "2011 US-downgrade + EU debt", "n": 96, "A_sharpe": 0.2986, "A_sortino": 0.295, "A_excess_sharpe": 0.5728, "A_return_pct": 1.69, "A_hit_rate": 49.47, "A_n": 96, "A_bh_sharpe": -0.2741, "A_bh_return_pct": -4.09, "A_psr": 0.5725, "A_ic": 0.0119, "A_precision": 0.5067, "A_recall": 0.76, "A_f1": 0.608, "A_f2": 0.6909, "A_accuracy": 0.4896, "A_mcc": -0.0536, "A_tp": 38, "A_fp": 37, "A_tn": 9, "A_fn": 12, "B_sharpe": 2.0754, "B_sortino": 2.7479, "B_excess_sharpe": 3.1029, "B_return_pct": 48.49, "B_hit_rate": 46.88, "B_n": 96, "B_bh_sharpe": -1.0274, "B_bh_return_pct": -25.58, "B_psr": 0.9091, "B_ic": -0.0051, "B_precision": 0.4333, "B_recall": 0.6047, "B_f1": 0.5049, "B_f2": 0.5603, "B_accuracy": 0.4688, "B_mcc": -0.0379, "B_tp": 26, "B_fp": 34, "B_tn": 19, "B_fn": 17, "D_sharpe": 0.2986, "D_sortino": 0.295, "D_excess_sharpe": 0.5728, "D_return_pct": 1.69, "D_hit_rate": 49.47, "D_n": 96, "D_bh_sharpe": -0.2741, "D_bh_return_pct": -4.09, "D_psr": 0.5725, "D_ic": 0.0119, "D_precision": 0.5067, "D_recall": 0.76, "D_f1": 0.608, "D_f2": 0.6909, "D_accuracy": 0.4896, "D_mcc": -0.0536, "D_tp": 38, "D_fp": 37, "D_tn": 9, "D_fn": 12, "sharpe": 0.2986, "sortino": 0.295, "return_pct": 1.69, "equity": 1016.8999999999999, "max_dd": 0.0, "win_rate": 49.47, "profit_factor": 0.0, "ic": 0.0119, "hit": 49.47, "psr": 0.5725, "bh_sharpe": -0.2741, "bh_return_pct": -4.09, "excess_sharpe": 0.5728, "precision": 0.5067, "recall": 0.76, "f1": 0.608, "f2": 0.6909, "mcc": -0.0536, "accuracy": 0.4896, "tp": 38, "fp": 37, "tn": 9, "fn": 12}, {"fold": "fold_3", "regime": "Taper tantrum and 2014 H1", "n": 54, "A_sharpe": -0.4169, "A_sortino": -0.4178, "A_excess_sharpe": -5.1167, "A_return_pct": -1.04, "A_hit_rate": 51.85, "A_n": 54, "A_bh_sharpe": 4.6998, "A_bh_return_pct": 10.46, "A_psr": 0.4246, "A_ic": 0.0815, "A_precision": 0.6667, "A_recall": 0.4242, "A_f1": 0.5185, "A_f2": 0.4575, "A_accuracy": 0.5185, "A_mcc": 0.0909, "A_tp": 14, "A_fp": 7, "A_tn": 14, "A_fn": 19, "B_sharpe": 6.829, "B_sortino": 9.6436, "B_excess_sharpe": -2.2036, "B_return_pct": 37.49, "B_hit_rate": 62.96, "B_n": 54, "B_bh_sharpe": 9.0326, "B_bh_return_pct": 49.18, "B_psr": 0.9997, "B_ic": -0.0348, "B_precision": 0.6667, "B_recall": 0.9189, "B_f1": 0.7727, "B_f2": 0.8543, "B_accuracy": 0.6296, "B_mcc": -0.1644, "B_tp": 34, "B_fp": 17, "B_tn": 0, "B_fn": 3, "D_sharpe": -0.4169, "D_sortino": -0.4178, "D_excess_sharpe": -5.1167, "D_return_pct": -1.04, "D_hit_rate": 51.85, "D_n": 54, "D_bh_sharpe": 4.6998, "D_bh_return_pct": 10.46, "D_psr": 0.4246, "D_ic": 0.0815, "D_precision": 0.6667, "D_recall": 0.4242, "D_f1": 0.5185, "D_f2": 0.4575, "D_accuracy": 0.5185, "D_mcc": 0.0909, "D_tp": 14, "D_fp": 7, "D_tn": 14, "D_fn": 19, "sharpe": -0.4169, "sortino": -0.4178, "return_pct": -1.04, "equity": 989.6, "max_dd": 0.0, "win_rate": 51.85, "profit_factor": 0.0, "ic": 0.0815, "hit": 51.85, "psr": 0.4246, "bh_sharpe": 4.6998, "bh_return_pct": 10.46, "excess_sharpe": -5.1167, "precision": 0.6667, "recall": 0.4242, "f1": 0.5185, "f2": 0.4575, "mcc": 0.0909, "accuracy": 0.5185, "tp": 14, "fp": 7, "tn": 14, "fn": 19}, {"fold": "fold_4", "regime": "China devaluation and oil crash", "n": 96, "A_sharpe": 0.9053, "A_sortino": 0.9056, "A_excess_sharpe": 1.3294, "A_return_pct": 6.08, "A_hit_rate": 50.53, "A_n": 96, "A_bh_sharpe": -0.4241, "A_bh_return_pct": -3.73, "A_psr": 0.7091, "A_ic": 0.0965, "A_precision": 0.4833, "A_recall": 0.6444, "A_f1": 0.5524, "A_f2": 0.6042, "A_accuracy": 0.5104, "A_mcc": 0.0377, "A_tp": 29, "A_fp": 31, "A_tn": 20, "A_fn": 16, "B_sharpe": -2.9251, "B_sortino": -2.4033, "B_excess_sharpe": -1.7408, "B_return_pct": -41.19, "B_hit_rate": 45.83, "B_n": 96, "B_bh_sharpe": -1.1843, "B_bh_return_pct": -21.44, "B_psr": 0.0193, "B_ic": -0.2328, "B_precision": 0.4643, "B_recall": 0.8478, "B_f1": 0.6, "B_f2": 0.7276, "B_accuracy": 0.4583, "B_mcc": -0.0788, "B_tp": 39, "B_fp": 45, "B_tn": 5, "B_fn": 7, "D_sharpe": 0.9053, "D_sortino": 0.9056, "D_excess_sharpe": 1.3294, "D_return_pct": 6.08, "D_hit_rate": 50.53, "D_n": 96, "D_bh_sharpe": -0.4241, "D_bh_return_pct": -3.73, "D_psr": 0.7091, "D_ic": 0.0965, "D_precision": 0.4833, "D_recall": 0.6444, "D_f1": 0.5524, "D_f2": 0.6042, "D_accuracy": 0.5104, "D_mcc": 0.0377, "D_tp": 29, "D_fp": 31, "D_tn": 20, "D_fn": 16, "sharpe": 0.9053, "sortino": 0.9056, "return_pct": 6.08, "equity": 1060.8, "max_dd": 0.0, "win_rate": 50.53, "profit_factor": 0.0, "ic": 0.0965, "hit": 50.53, "psr": 0.7091, "bh_sharpe": -0.4241, "bh_return_pct": -3.73, "excess_sharpe": 1.3294, "precision": 0.4833, "recall": 0.6444, "f1": 0.5524, "f2": 0.6042, "mcc": 0.0377, "accuracy": 0.5104, "tp": 29, "fp": 31, "tn": 20, "fn": 16}, {"fold": "fold_5", "regime": "2018 Vol-mageddon + Q4 sell-off", "n": 54, "A_sharpe": 0.0222, "A_sortino": 0.0205, "A_excess_sharpe": -1.4057, "A_return_pct": -0.13, "A_hit_rate": 55.56, "A_n": 54, "A_bh_sharpe": 1.428, "A_bh_return_pct": 3.97, "A_psr": 0.5041, "A_ic": 0.101, "A_precision": 0.6, "A_recall": 0.5172, "A_f1": 0.5556, "A_f2": 0.5319, "A_accuracy": 0.5556, "A_mcc": 0.1172, "A_tp": 15, "A_fp": 10, "A_tn": 15, "A_fn": 14, "B_sharpe": -1.8871, "B_sortino": -1.6746, "B_excess_sharpe": -6.8193, "B_return_pct": -12.48, "B_hit_rate": 50.0, "B_n": 54, "B_bh_sharpe": 4.9322, "B_bh_return_pct": 34.93, "B_psr": 0.1913, "B_ic": -0.3864, "B_precision": 0.619, "B_recall": 0.7027, "B_f1": 0.6582, "B_f2": 0.6842, "B_accuracy": 0.5, "B_mcc": -0.2664, "B_tp": 26, "B_fp": 16, "B_tn": 1, "B_fn": 11, "D_sharpe": 0.0222, "D_sortino": 0.0205, "D_excess_sharpe": -1.4057, "D_return_pct": -0.13, "D_hit_rate": 55.56, "D_n": 54, "D_bh_sharpe": 1.428, "D_bh_return_pct": 3.97, "D_psr": 0.5041, "D_ic": 0.101, "D_precision": 0.6, "D_recall": 0.5172, "D_f1": 0.5556, "D_f2": 0.5319, "D_accuracy": 0.5556, "D_mcc": 0.1172, "D_tp": 15, "D_fp": 10, "D_tn": 15, "D_fn": 14, "sharpe": 0.0222, "sortino": 0.0205, "return_pct": -0.13, "equity": 998.7, "max_dd": 0.0, "win_rate": 55.56, "profit_factor": 0.0, "ic": 0.101, "hit": 55.56, "psr": 0.5041, "bh_sharpe": 1.428, "bh_return_pct": 3.97, "excess_sharpe": -1.4057, "precision": 0.6, "recall": 0.5172, "f1": 0.5556, "f2": 0.5319, "mcc": 0.1172, "accuracy": 0.5556, "tp": 15, "fp": 10, "tn": 15, "fn": 14}, {"fold": "fold_6", "regime": "COVID crash and V-recovery", "n": 75, "A_sharpe": -1.7496, "A_sortino": -1.7369, "A_excess_sharpe": -6.0491, "A_return_pct": -5.83, "A_hit_rate": 42.67, "A_n": 75, "A_bh_sharpe": 4.2994, "A_bh_return_pct": 14.68, "A_psr": 0.1718, "A_ic": 0.0017, "A_precision": 0.6176, "A_recall": 0.4118, "A_f1": 0.4941, "A_f2": 0.4412, "A_accuracy": 0.4267, "A_mcc": -0.1217, "A_tp": 21, "A_fp": 13, "A_tn": 11, "A_fn": 30, "B_sharpe": 8.2394, "B_sortino": 8.278, "B_excess_sharpe": -6.0945, "B_return_pct": 71.5, "B_hit_rate": 73.33, "B_n": 75, "B_bh_sharpe": 14.3339, "B_bh_return_pct": 120.13, "B_psr": 1.0, "B_ic": 0.0267, "B_precision": 0.8308, "B_recall": 0.8571, "B_f1": 0.8438, "B_f2": 0.8517, "B_accuracy": 0.7333, "B_mcc": -0.0642, "B_tp": 54, "B_fp": 11, "B_tn": 1, "B_fn": 9, "D_sharpe": -1.7496, "D_sortino": -1.7369, "D_excess_sharpe": -6.0491, "D_return_pct": -5.83, "D_hit_rate": 42.67, "D_n": 75, "D_bh_sharpe": 4.2994, "D_bh_return_pct": 14.68, "D_psr": 0.1718, "D_ic": 0.0017, "D_precision": 0.6176, "D_recall": 0.4118, "D_f1": 0.4941, "D_f2": 0.4412, "D_accuracy": 0.4267, "D_mcc": -0.1217, "D_tp": 21, "D_fp": 13, "D_tn": 11, "D_fn": 30, "sharpe": -1.7496, "sortino": -1.7369, "return_pct": -5.83, "equity": 941.6999999999999, "max_dd": 0.0, "win_rate": 42.67, "profit_factor": 0.0, "ic": 0.0017, "hit": 42.67, "psr": 0.1718, "bh_sharpe": 4.2994, "bh_return_pct": 14.68, "excess_sharpe": -6.0491, "precision": 0.6176, "recall": 0.4118, "f1": 0.4941, "f2": 0.4412, "mcc": -0.1217, "accuracy": 0.4267, "tp": 21, "fp": 13, "tn": 11, "fn": 30}, {"fold": "fold_7", "regime": "Inflation bear, AI rally and 2025", "n": 114, "A_sharpe": -0.7126, "A_sortino": -0.6694, "A_excess_sharpe": -3.5577, "A_return_pct": -5.46, "A_hit_rate": 50.0, "A_n": 114, "A_bh_sharpe": 2.845, "A_bh_return_pct": 21.34, "A_psr": 0.3158, "A_ic": 0.0171, "A_precision": 0.5893, "A_recall": 0.4925, "A_f1": 0.5366, "A_f2": 0.5093, "A_accuracy"