{"experiment_num": 6, "backbone": "mlp", "description": "MLP @ FX champion HPs (Exp32: residual MLP head_dropout=0.25 seed=0 lr=3e-4 ep=50 pat=10 wd=1e-5) \u2014 Gu-Kelly-Xiu 2020 RFS recipe; QQQ exp6 \u2014 testing FX-MLP-winner config on QQQ", "config": {"seq_len": 10, "lr": 0.0003, "batch_size": 32, "epochs": 50, "weight_decay": 1e-05, "patience": 10, "warmup_epochs": 0, "head_dropout": 0.25, "huber_delta": 1.0, "grad_clip": 1.0, "seed": 0, "hidden_size": null, "num_layers": null, "max_depth": null, "gbm_lr": null, "n_estimators": null}, "composite": 0.5799, "test_pos_folds": 6, "val_pos_folds": 5, "val_loss": -2.8902516200208743, "elapsed_sec": 28.7, "timestamp": "2026-04-26T14:38:57", "sharpe": 0.6799, "val_sharpe": 0.7871, "ic": 0.0146, "hit": 55.93, "psr": 0.9448, "equity": 2282.4999999999995, "return_pct": 128.25, "bh_sharpe": 0.6042, "bh_return_pct": 103.49, "excess_sharpe": 0.0757, "B_sharpe": 0.4845, "B_excess_sharpe": -1.2163, "B_return_pct": 93.23, "D_sharpe": 0.6799, "D_excess_sharpe": 0.0757, "D_return_pct": 128.25, "per_window": [{"fold": "fold_1", "regime": "GFC peak crash (Lehman + Mar-2009 bottom)", "n": 115, "A_sharpe": -1.775, "A_sortino": -1.7726, "A_excess_sharpe": -1.3309, "A_return_pct": -36.43, "A_hit_rate": 42.61, "A_n": 115, "A_bh_sharpe": -0.4441, "A_bh_return_pct": -14.4, "A_psr": 0.1164, "A_ic": -0.104, "B_sharpe": 4.4787, "B_sortino": 5.4131, "B_excess_sharpe": 4.7765, "B_return_pct": 403.29, "B_hit_rate": 57.89, "B_n": 115, "B_bh_sharpe": -0.2978, "B_bh_return_pct": -27.23, "B_psr": 0.999, "B_ic": 0.2951, "D_sharpe": -1.775, "D_sortino": -1.7726, "D_excess_sharpe": -1.3309, "D_return_pct": -36.43, "D_hit_rate": 42.61, "D_n": 115, "D_bh_sharpe": -0.4441, "D_bh_return_pct": -14.4, "D_psr": 0.1164, "D_ic": -0.104, "sharpe": -1.775, "sortino": -1.7726, "return_pct": -36.43, "equity": 635.6999999999999, "max_dd": 0.0, "win_rate": 42.61, "profit_factor": 0.0, "ic": -0.104, "hit": 42.61, "psr": 0.1164, "bh_sharpe": -0.4441, "bh_return_pct": -14.4, "excess_sharpe": -1.3309, "precision": 0.4032, "recall": 0.463, "f1": 0.431, "f2": 0.4496, "accuracy": 0.4261, "mcc": -0.1438, "tp": 25, "fp": 37, "tn": 24, "fn": 29, "A_precision": 0.4032, "A_recall": 0.463, "A_f1": 0.431, "A_f2": 0.4496, "A_accuracy": 0.4261, "A_mcc": -0.1438, "A_tp": 25, "A_fp": 37, "A_tn": 24, "A_fn": 29}, {"fold": "fold_2", "regime": "2011 US-downgrade + EU debt", "n": 136, "A_sharpe": 1.8237, "A_sortino": 1.7642, "A_excess_sharpe": 0.091, "A_return_pct": 20.94, "A_hit_rate": 58.52, "A_n": 136, "A_bh_sharpe": 1.7327, "A_bh_return_pct": 19.75, "A_psr": 0.9074, "A_ic": -0.0506, "B_sharpe": 3.5198, "B_sortino": 3.4287, "B_excess_sharpe": -0.5461, "B_return_pct": 119.89, "B_hit_rate": 65.44, "B_n": 136, "B_bh_sharpe": 4.0659, "B_bh_return_pct": 148.68, "B_psr": 0.995, "B_ic": 0.0685, "D_sharpe": 1.8237, "D_sortino": 1.7642, "D_excess_sharpe": 0.091, "D_return_pct": 20.94, "D_hit_rate": 58.52, "D_n": 136, "D_bh_sharpe": 1.7327, "D_bh_return_pct": 19.75, "D_psr": 0.9074, "D_ic": -0.0506, "sharpe": 1.8237, "sortino": 1.7642, "return_pct": 20.94, "equity": 1209.4, "max_dd": 0.0, "win_rate": 58.52, "profit_factor": 0.0, "ic": -0.0506, "hit": 58.52, "psr": 0.9074, "bh_sharpe": 1.7327, "bh_return_pct": 19.75, "excess_sharpe": 0.091, "precision": 0.5827, "recall": 0.9487, "f1": 0.722, "f2": 0.8428, "accuracy": 0.5809, "mcc": 0.0695, "tp": 74, "fp": 53, "tn": 5, "fn": 4, "A_precision": 0.5827, "A_recall": 0.9487, "A_f1": 0.722, "A_f2": 0.8428, "A_accuracy": 0.5809, "A_mcc": 0.0695, "A_tp": 74, "A_fp": 53, "A_tn": 5, "A_fn": 4}, {"fold": "fold_3", "regime": "Taper tantrum and 2014 H1", "n": 178, "A_sharpe": 2.1638, "A_sortino": 1.99, "A_excess_sharpe": 0.8193, "A_return_pct": 21.02, "A_hit_rate": 58.76, "A_n": 178, "A_bh_sharpe": 1.3445, "A_bh_return_pct": 12.41, "A_psr": 0.9585, "A_ic": 0.0932, "B_sharpe": -1.6644, "B_sortino": -1.5147, "B_excess_sharpe": -4.7128, "B_return_pct": -28.74, "B_hit_rate": 48.88, "B_n": 178, "B_bh_sharpe": 3.0483, "B_bh_return_pct": 71.83, "B_psr": 0.0797, "B_ic": -0.0063, "D_sharpe": 2.1638, "D_sortino": 1.99, "D_excess_sharpe": 0.8193, "D_return_pct": 21.02, "D_hit_rate": 58.76, "D_n": 178, "D_bh_sharpe": 1.3445, "D_bh_return_pct": 12.41, "D_psr": 0.9585, "D_ic": 0.0932, "sharpe": 2.1638, "sortino": 1.99, "return_pct": 21.02, "equity": 1210.2, "max_dd": 0.0, "win_rate": 58.76, "profit_factor": 0.0, "ic": 0.0932, "hit": 58.76, "psr": 0.9585, "bh_sharpe": 1.3445, "bh_return_pct": 12.41, "excess_sharpe": 0.8193, "precision": 0.5901, "recall": 0.9223, "f1": 0.7197, "f2": 0.829, "accuracy": 0.5843, "mcc": 0.0711, "tp": 95, "fp": 66, "tn": 9, "fn": 8, "A_precision": 0.5901, "A_recall": 0.9223, "A_f1": 0.7197, "A_f2": 0.829, "A_accuracy": 0.5843, "A_mcc": 0.0711, "A_tp": 95, "A_fp": 66, "A_tn": 9, "A_fn": 8}, {"fold": "fold_4", "regime": "China devaluation and oil crash", "n": 157, "A_sharpe": 1.3263, "A_sortino": 1.2782, "A_excess_sharpe": 1.3165, "A_return_pct": 15.96, "A_hit_rate": 54.49, "A_n": 157, "A_bh_sharpe": 0.0098, "A_bh_return_pct": -1.05, "A_psr": 0.8472, "A_ic": 0.0429, "B_sharpe": -1.2577, "B_sortino": -1.4213, "B_excess_sharpe": -1.2736, "B_return_pct": -33.17, "B_hit_rate": 40.13, "B_n": 157, "B_bh_sharpe": 0.0159, "B_bh_return_pct": -5.48, "B_psr": 0.1672, "B_ic": 0.0165, "D_sharpe": 1.3263, "D_sortino": 1.2782, "D_excess_sharpe": 1.3165, "D_return_pct": 15.96, "D_hit_rate": 54.49, "D_n": 157, "D_bh_sharpe": 0.0098, "D_bh_return_pct": -1.05, "D_psr": 0.8472, "D_ic": 0.0429, "sharpe": 1.3263, "sortino": 1.2782, "return_pct": 15.96, "equity": 1159.6, "max_dd": 0.0, "win_rate": 54.49, "profit_factor": 0.0, "ic": 0.0429, "hit": 54.49, "psr": 0.8472, "bh_sharpe": 0.0098, "bh_return_pct": -1.05, "excess_sharpe": 1.3165, "precision": 0.5391, "recall": 0.7654, "f1": 0.6327, "f2": 0.7062, "accuracy": 0.5414, "mcc": 0.0768, "tp": 62, "fp": 53, "tn": 23, "fn": 19, "A_precision": 0.5391, "A_recall": 0.7654, "A_f1": 0.6327, "A_f2": 0.7062, "A_accuracy": 0.5414, "A_mcc": 0.0768, "A_tp": 62, "A_fp": 53, "A_tn": 23, "A_fn": 19}, {"fold": "fold_5", "regime": "2018 Vol-mageddon + Q4 sell-off", "n": 177, "A_sharpe": 0.9081, "A_sortino": 0.9046, "A_excess_sharpe": 0.5983, "A_return_pct": 13.66, "A_hit_rate": 55.37, "A_n": 177, "A_bh_sharpe": 0.3098, "A_bh_return_pct": 3.19, "A_psr": 0.7771, "A_ic": 0.032, "B_sharpe": 0.567, "B_sortino": 0.6226, "B_excess_sharpe": -0.3247, "B_return_pct": 11.59, "B_hit_rate": 48.86, "B_n": 177, "B_bh_sharpe": 0.8917, "B_bh_return_pct": 23.8, "B_psr": 0.6833, "B_ic": -0.028, "D_sharpe": 0.9081, "D_sortino": 0.9046, "D_excess_sharpe": 0.5983, "D_return_pct": 13.66, "D_hit_rate": 55.37, "D_n": 177, "D_bh_sharpe": 0.3098, "D_bh_return_pct": 3.19, "D_psr": 0.7771, "D_ic": 0.032, "sharpe": 0.9081, "sortino": 0.9046, "return_pct": 13.66, "equity": 1136.6000000000001, "max_dd": 0.0, "win_rate": 55.37, "profit_factor": 0.0, "ic": 0.032, "hit": 55.37, "psr": 0.7771, "bh_sharpe": 0.3098, "bh_return_pct": 3.19, "excess_sharpe": 0.5983, "precision": 0.5882, "recall": 0.7767, "f1": 0.6695, "f2": 0.7299, "accuracy": 0.5537, "mcc": 0.0233, "tp": 80, "fp": 56, "tn": 18, "fn": 23, "A_precision": 0.5882, "A_recall": 0.7767, "A_f1": 0.6695, "A_f2": 0.7299, "A_accuracy": 0.5537, "A_mcc": 0.0233, "A_tp": 80, "A_fp": 56, "A_tn": 18, "A_fn": 23}, {"fold": "fold_6", "regime": "COVID crash and V-recovery", "n": 222, "A_sharpe": 1.6915, "A_sortino": 1.4628, "A_excess_sharpe": 0.8027, "A_return_pct": 64.51, "A_hit_rate": 63.51, "A_n": 222, "A_bh_sharpe": 0.8888, "A_bh_return_pct": 26.13, "A_psr": 0.9371, "A_ic": 0.1032, "B_sharpe": 0.4153, "B_sortino": 0.4684, "B_excess_sharpe": -1.9731, "B_return_pct": 4.41, "B_hit_rate": 47.06, "B_n": 222, "B_bh_sharpe": 2.3884, "B_bh_return_pct": 243.18, "B_psr": 0.6522, "B_ic": 0.0088, "D_sharpe": 1.6915, "D_sortino": 1.4628, "D_excess_sharpe": 0.8027, "D_return_pct": 64.51, "D_hit_rate": 63.51, "D_n": 222, "D_bh_sharpe": 0.8888, "D_bh_return_pct": 26.13, "D_psr": 0.9371, "D_ic": 0.1032, "sharpe": 1.6915, "sortino": 1.4628, "return_pct": 64.51, "equity": 1645.1, "max_dd": 0.0, "win_rate": 63.51, "profit_factor": 0.0, "ic": 0.1032, "hit": 63.51, "psr": 0.9371, "bh_sharpe": 0.8888, "bh_return_pct": 26.13, "excess_sharpe": 0.8027, "precision": 0.6524, "recall": 0.8841, "f1": 0.7508, "f2": 0.8254, "accuracy": 0.6351, "mcc": 0.1467, "tp": 122, "fp": 65, "tn": 19, "fn": 16, "A_precision": 0.6524, "A_recall": 0.8841, "A_f1": 0.7508, "A_f2": 0.8254, "A_accuracy": 0.6351, "A_mcc": 0.1467, "A_tp": 122, "A_fp": 65, "A_tn": 19, "A_fn": 16}, {"fold": "fold_7", "regime": "Inflation bear, AI rally and 2025", "n": 425, "A_sharpe": 0.4449, "A_sortino": 0.4283, "A_excess_sharpe": -0.5266, "A_return_pct": 13.13, "A_hit_rate": 54.35, "A_n": 425, "A_bh_sharpe": 0.9715, "A_bh_return_pct": 37.12, "A_psr": 0.7195, "A_ic": -0.0522, "B_sharpe": -1.2842, "B_sortino": -1.2705, "B_excess_sharpe": -3.7869, "B_return_pct": -68.53, "B_hit_rate": 45.75, "B_n": 425, "B_bh_sharpe": 2.5027, "B_bh_return_pct": 458.83, "B_psr": 0.0491, "B_ic": -0.1159, "D_sharpe": 0.4449, "D_sortino": 0.4283, "D_excess_sharpe": -0.5266, "D_return_pct": 13.13, "D_hit_rate": 54.35, "D_n": 425, "D_bh_sharpe": 0.9715, "D_bh_return_pct": 37.12, "D_psr": 0.7195, "D_ic": -0.0522, "sharpe": 0.4449, "sortino": 0.4283, "return_pct": 13.13, "equity": 1131.3, "max_dd": 0.0, "win_rate": 54.35, "profit_factor": 0.0, "ic": -0.0522, "hit": 54.35, "psr": 0.7195, "bh_sharpe": 0.9715, "bh_return_pct": 37.12, "excess_sharpe": -0.5266, "precision": 0.5903, "recall": 0.732, "f1": 0.6536, "f2": 0.6985, "accuracy": 0.5435, "mcc": 0.007, "tp": 183, "fp": 127, "tn": 48, "fn": 67, "A_precision": 0.5903, "A_recall": 0.732, "A_f1": 0.6536, "A_f2": 0.6985, "A_accuracy": 0.5435, "A_mcc": 0.007, "A_tp": 183, "A_fp": 127, "A_tn": 48, "A_fn": 67}], "per_window_val": [{"fold": "fold_1", "regime": "GFC peak crash (Lehman + Mar-2009 bottom)", "n": 104, "A_sharpe": 0.8753, "A_sortino": 0.947, "A_excess_sharpe": 1.0425, "A_return_pct": 9.3, "A_hit_rate": 50.98, "A_n": 104, "A_bh_sharpe": -0.1672, "A_bh_return_pct": -3.81, "A_psr": 0.7148, "A_ic": 0.0736, "B_sharpe": 3.5558, "B_sortino": 4.2386, "B_excess_sharpe": 5.8299, "B_return_pct": 108.23, "B_hit_rate": 56.31, "B_n": 104, "B_bh_sharpe": -2.2741, "B_bh_return_pct": -44.12, "B_psr": 0.9916, "B_ic": 0.1516, "D_sharpe": 0.8753, "D_sortino": 0.947, "D_excess_sharpe": 1.0425, "D_return_pct": 9.3, "D_hit_rate": 50.98, "D_n": 104, "D_bh_sharpe": -0.1672, "D_bh_return_pct": -3.81, "D_psr": 0.7148, "D_ic": 0.0736, "sharpe": 0.8753, "sortino": 0.947, "return_pct": 9.3, "equity": 1093.0, "max_dd": 0.0, "win_rate": 50.98, "profit_factor": 0.0, "ic": 0.0736, "hit": 50.98, "psr": 0.7148, "bh_sharpe": -0.1672, "bh_return_pct": -3.81, "excess_sharpe": 1.0425}, {"fold": "fold_2", "regime": "2011 US-downgrade + EU debt", "n": 96, "A_sharpe": 0.0899, "A_sortino": 0.0883, "A_excess_sharpe": 0.3641, "A_return_pct": -0.46, "A_hit_rate": 48.42, "A_n": 96, "A_bh_sharpe": -0.2741, "A_bh_return_pct": -4.09, "A_psr": 0.522, "A_ic": -0.1661, "B_sharpe": 2.7234, "B_sortino": 3.4901, "B_excess_sharpe": 3.7509, "B_return_pct": 70.76, "B_hit_rate": 51.04, "B_n": 96, "B_bh_sharpe": -1.0274, "B_bh_return_pct": -25.58, "B_psr": 0.9612, "B_ic": 0.0256, "D_sharpe": 0.0899, "D_sortino": 0.0883, "D_excess_sharpe": 0.3641, "D_return_pct": -0.46, "D_hit_rate": 48.42, "D_n": 96, "D_bh_sharpe": -0.2741, "D_bh_return_pct": -4.09, "D_psr": 0.522, "D_ic": -0.1661, "sharpe": 0.0899, "sortino": 0.0883, "return_pct": -0.46, "equity": 995.4, "max_dd": 0.0, "win_rate": 48.42, "profit_factor": 0.0, "ic": -0.1661, "hit": 48.42, "psr": 0.522, "bh_sharpe": -0.2741, "bh_return_pct": -4.09, "excess_sharpe": 0.3641}, {"fold": "fold_3", "regime": "Taper tantrum and 2014 H1", "n": 54, "A_sharpe": 4.9853, "A_sortino": 5.1648, "A_excess_sharpe": 0.2855, "A_return_pct": 11.08, "A_hit_rate": 62.96, "A_n": 54, "A_bh_sharpe": 4.6998, "A_bh_return_pct": 10.46, "A_psr": 0.9825, "A_ic": -0.0181, "B_sharpe": 3.1835, "B_sortino": 2.9207, "B_excess_sharpe": -5.8491, "B_return_pct": 16.8, "B_hit_rate": 64.81, "B_n": 54, "B_bh_sharpe": 9.0326, "B_bh_return_pct": 49.18, "B_psr": 0.9206, "B_ic": 0.0459, "D_sharpe": 4.9853, "D_sortino": 5.1648, "D_excess_sharpe": 0.2855, "D_return_pct": 11.08, "D_hit_rate": 62.96, "D_n": 54, "D_bh_sharpe": 4.6998, "D_bh_return_pct": 10.46, "D_psr": 0.9825, "D_ic": -0.0181, "sharpe": 4.9853, "sortino": 5.1648, "return_pct": 11.08, "equity": 1110.8, "max_dd": 0.0, "win_rate": 62.96, "profit_factor": 0.0, "ic": -0.0181, "hit": 62.96, "psr": 0.9825, "bh_sharpe": 4.6998, "bh_return_pct": 10.46, "excess_sharpe": 0.2855}, {"fold": "fold_4", "regime": "China devaluation and oil crash", "n": 96, "A_sharpe": -0.6209, "A_sortino": -0.614, "A_excess_sharpe": -0.1968, "A_return_pct": -5.1, "A_hit_rate": 47.37, "A_n": 96, "A_bh_sharpe": -0.4241, "A_bh_return_pct": -3.73, "A_psr": 0.3517, "A_ic": -0.1001, "B_sharpe": 1.9051, "B_sortino": 2.8863, "B_excess_sharpe": 3.0893, "B_return_pct": 33.11, "B_hit_rate": 46.88, "B_n": 96, "B_bh_sharpe": -1.1843, "B_bh_return_pct": -21.44, "B_psr": 0.903, "B_ic": -0.0413, "D_sharpe": -0.6209, "D_sortino": -0.614, "D_excess_sharpe": -0.1968, "D_return_pct": -5.1, "D_hit_rate": 47.37, "D_n": 96, "D_bh_sharpe": -0.4241, "D_bh_return_pct": -3.73, "D_psr": 0.3517, "D_ic": -0.1001, "sharpe": -0.6209, "sortino": -0.614, "return_pct": -5.1, "equity": 949.0, "max_dd": 0.0, "win_rate": 47.37, "profit_factor": 0.0, "ic": -0.1001, "hit": 47.37, "psr": 0.3517, "bh_sharpe": -0.4241, "bh_return_pct": -3.73, "excess_sharpe": -0.1968}, {"fold": "fold_5", "regime": "2018 Vol-mageddon + Q4 sell-off", "n": 54, "A_sharpe": -0.3858, "A_sortino": -0.3653, "A_excess_sharpe": -1.8138, "A_return_pct": -1.29, "A_hit_rate": 48.15, "A_n": 54, "A_bh_sharpe": 1.428, "A_bh_return_pct": 3.97, "A_psr": 0.4295, "A_ic": -0.0701, "B_sharpe": -3.124, "B_sortino": -3.033, "B_excess_sharpe": -8.0562, "B_return_pct": -19.07, "B_hit_rate": 38.89, "B_n": 54, "B_bh_sharpe": 4.9322, "B_bh_return_pct": 34.93, "B_psr": 0.0801, "B_ic": -0.4645, "D_sharpe": -0.3858, "D_sortino": -0.3653, "D_excess_sharpe": -1.8138, "D_return_pct": -1.29, "D_hit_rate": 48.15, "D_n": 54, "D_bh_sharpe": 1.428, "D_bh_return_pct": 3.97, "D_psr": 0.4295, "D_ic": -0.0701, "sharpe": -0.3858, "sortino": -0.3653, "return_pct": -1.29, "equity": 987.1, "max_dd": 0.0, "win_rate": 48.15, "profit_factor": 0.0, "ic": -0.0701, "hit": 48.15, "psr": 0.4295, "bh_sharpe": 1.428, "bh_return_pct": 3.97, "excess_sharpe": -1.8138}, {"fold": "fold_6", "regime": "COVID crash and V-recovery", "n": 75, "A_sharpe": 3.5977, "A_sortino": 3.3126, "A_excess_sharpe": -0.7017, "A_return_pct": 12.24, "A_hit_rate": 65.33, "A_n": 75, "A_bh_sharpe": 4.2994, "A_bh_return_pct": 14.68, "A_psr": 0.9675, "A_ic": -0.1437, "B_sharpe": 0.7053, "B_sortino": 0.6883, "B_excess_sharpe": -13.6286, "B_return_pct": 4.44, "B_hit_rate": 54.67, "B_n": 75, "B_bh_sharpe": 14.3339, "B_bh_return_pct": 120.13, "B_psr": 0.6488, "B_ic": 0.0655, "D_sharpe": 3.5977, "D_sortino": 3.3126, "D_excess_sharpe": -0.7017, "D_return_pct": 12.24, "D_hit_rate": 65.33, "D_n": 75, "D_bh_sharpe": 4.2994, "D_bh_return_pct": 14.68, "D_psr": 0.9675, "D_ic": -0.1437, "sharpe": 3.5977, "sortino": 3.3126, "return_pct": 12.24, "equity": 1122.4, "max_dd": 0.0, "win_rate": 65.33, "profit_factor": 0.0, "ic": -0.1437, "hit": 65.33, "psr": 0.9675, "bh_sharpe": 4.2994, "bh_return_pct": 14.68, "excess_sharpe": -0.7017}, {"fold": "fold_7", "regime": "Inflation bear, AI rally and 2025", "n": 114, "A_sharpe": 1.3517, "A_sortino": 1.3262, "A_excess_sharpe": -1.4933, "A_return_pct": 9.43, "A_hit_rate": 55.26, "A_n": 114, "A_bh_sharpe": 2.845, "A_bh_return_pct": 21.34, "A_psr": 0.8158, "A_ic": -0.0267, "B_sharpe": 0.5609, "B_sortino": 0.5142, "B_excess_sharpe": -5.5758, "B_return_pct": 6.51, "B_hit_rate": 57.02, "B_n": 114, "B_bh_sharpe": 6.1366, "B_bh_return_pct": 155.03, "B_psr": 0.6457, "B_ic": -0.1112, "D_sharpe": 1.3517, "D_sortino": 1.3262, "D_excess_sharpe": -1.4933, "D_return_pct": 9.43, "D_hit_rate": 55.26, "D_n": 114, "D_bh_sharpe": 2.845, "D_bh_return_pct": 21.34, "D_psr": 0.8158, "D_ic": -0.0267, "sharpe": 1.3517, "sortino": 1.3262, "return_pct": 9.43, "equity": 1094.3, "max_dd": 0.0, "win_rate": 55.26, "profit_factor": 0.0, "ic": -0.0267, "hit": 55.26, "psr": 0.8158, "bh_sharpe": 2.845, "bh_return_pct": 21.34, "excess_sharpe": -1.4933}], "status": "KEEP", "precision": 0.5838, "recall": 0.7943, "f1": 0.673, "f2": 0.7409, "accuracy": 0.5582, "mcc": 0.0434, "tp": 641, "fp": 457, "tn": 146, "fn": 166, "test_sharpe": 0.6799, "A_sharpe": 0.6799, "A_excess_sharpe": 0.0757, "A_return_pct": 128.25, "A_precision": 0.5838, "A_recall": 0.7943, "A_f1": 0.673, "A_f2": 0.7409, "A_accuracy": 0.5582, "A_mcc": 0.0434, "A_tp": 641, "A_fp": 457, "A_tn": 146, "A_fn": 166, "A_psr": 0.9448, "A_ic": 0.0146, "A_hit_rate": 55.93, "A_bh_sharpe": 0.6042, "A_bh_return_pct": 103.49}
