{"experiment_num": 27, "backbone": "mlp", "description": "MLP @ FX-Exp32 lr=1e-4 (down from 3e-4) - flat-minima hill-climb on lucky-seed champ; Keskar 2017 ICLR; targets 4-seed median improvement vs exp 6 seed=0 lucky", "config": {"seq_len": 10, "lr": 0.0001, "batch_size": 32, "epochs": 50, "weight_decay": 1e-05, "patience": 10, "warmup_epochs": 0, "head_dropout": 0.25, "huber_delta": 1.0, "grad_clip": 1.0, "seed": 0, "hidden_size": null, "num_layers": null, "max_depth": null, "gbm_lr": null, "n_estimators": null}, "composite": -1.3564, "test_pos_folds": 3, "val_pos_folds": 1, "val_loss": -2.876434055186846, "elapsed_sec": 37.9, "timestamp": "2026-04-27T18:17:18", "sharpe": 0.011, "val_sharpe": -0.9564, "ic": -0.0003, "hit": 48.19, "psr": 0.5103, "equity": 827.4, "return_pct": -17.26, "bh_sharpe": 0.6042, "bh_return_pct": 103.49, "excess_sharpe": -0.5933, "B_sharpe": -0.1964, "B_excess_sharpe": -1.8972, "B_return_pct": -75.01, "D_sharpe": 0.011, "D_excess_sharpe": -0.5933, "D_return_pct": -17.26, "per_window": [{"fold": "fold_1", "regime": "GFC peak crash (Lehman + Mar-2009 bottom)", "n": 115, "A_sharpe": -0.7453, "A_sortino": -0.7383, "A_excess_sharpe": -0.3012, "A_return_pct": -20.01, "A_hit_rate": 48.7, "A_n": 115, "A_bh_sharpe": -0.4441, "A_bh_return_pct": -14.4, "A_psr": 0.3085, "A_ic": -0.1137, "B_sharpe": 1.3985, "B_sortino": 1.3273, "B_excess_sharpe": 1.6964, "B_return_pct": 47.78, "B_hit_rate": 58.77, "B_n": 115, "B_bh_sharpe": -0.2978, "B_bh_return_pct": -27.23, "B_psr": 0.8248, "B_ic": 0.1082, "D_sharpe": -0.7453, "D_sortino": -0.7383, "D_excess_sharpe": -0.3012, "D_return_pct": -20.01, "D_hit_rate": 48.7, "D_n": 115, "D_bh_sharpe": -0.4441, "D_bh_return_pct": -14.4, "D_psr": 0.3085, "D_ic": -0.1137, "sharpe": -0.7453, "sortino": -0.7383, "return_pct": -20.01, "equity": 799.9, "max_dd": 0.0, "win_rate": 48.7, "profit_factor": 0.0, "ic": -0.1137, "hit": 48.7, "psr": 0.3085, "bh_sharpe": -0.4441, "bh_return_pct": -14.4, "excess_sharpe": -0.3012, "precision": 0.4074, "recall": 0.2037, "f1": 0.2716, "f2": 0.2263, "accuracy": 0.487, "mcc": -0.069, "tp": 11, "fp": 16, "tn": 45, "fn": 43, "A_precision": 0.4074, "A_recall": 0.2037, "A_f1": 0.2716, "A_f2": 0.2263, "A_accuracy": 0.487, "A_mcc": -0.069, "A_tp": 11, "A_fp": 16, "A_tn": 45, "A_fn": 43}, {"fold": "fold_2", "regime": "2011 US-downgrade + EU debt", "n": 136, "A_sharpe": -1.3967, "A_sortino": -1.2689, "A_excess_sharpe": -3.1294, "A_return_pct": -15.32, "A_hit_rate": 48.89, "A_n": 136, "A_bh_sharpe": 1.7327, "A_bh_return_pct": 19.75, "A_psr": 0.1504, "A_ic": -0.1066, "B_sharpe": 2.3176, "B_sortino": 2.2972, "B_excess_sharpe": -1.7483, "B_return_pct": 66.07, "B_hit_rate": 59.56, "B_n": 136, "B_bh_sharpe": 4.0659, "B_bh_return_pct": 148.68, "B_psr": 0.9549, "B_ic": 0.1568, "D_sharpe": -1.3967, "D_sortino": -1.2689, "D_excess_sharpe": -3.1294, "D_return_pct": -15.32, "D_hit_rate": 48.89, "D_n": 136, "D_bh_sharpe": 1.7327, "D_bh_return_pct": 19.75, "D_psr": 0.1504, "D_ic": -0.1066, "sharpe": -1.3967, "sortino": -1.2689, "return_pct": -15.32, "equity": 846.8, "max_dd": 0.0, "win_rate": 48.89, "profit_factor": 0.0, "ic": -0.1066, "hit": 48.89, "psr": 0.1504, "bh_sharpe": 1.7327, "bh_return_pct": 19.75, "excess_sharpe": -3.1294, "precision": 0.5474, "recall": 0.6667, "f1": 0.6012, "f2": 0.6388, "accuracy": 0.4926, "mcc": -0.0805, "tp": 52, "fp": 43, "tn": 15, "fn": 26, "A_precision": 0.5474, "A_recall": 0.6667, "A_f1": 0.6012, "A_f2": 0.6388, "A_accuracy": 0.4926, "A_mcc": -0.0805, "A_tp": 52, "A_fp": 43, "A_tn": 15, "A_fn": 26}, {"fold": "fold_3", "regime": "Taper tantrum and 2014 H1", "n": 178, "A_sharpe": -0.2403, "A_sortino": -0.256, "A_excess_sharpe": -1.5849, "A_return_pct": -2.76, "A_hit_rate": 48.02, "A_n": 178, "A_bh_sharpe": 1.3445, "A_bh_return_pct": 12.41, "A_psr": 0.4205, "A_ic": 0.1073, "B_sharpe": -0.1043, "B_sortino": -0.1212, "B_excess_sharpe": -3.1526, "B_return_pct": -4.4, "B_hit_rate": 42.13, "B_n": 178, "B_bh_sharpe": 3.0483, "B_bh_return_pct": 71.83, "B_psr": 0.4652, "B_ic": 0.0317, "D_sharpe": -0.2403, "D_sortino": -0.256, "D_excess_sharpe": -1.5849, "D_return_pct": -2.76, "D_hit_rate": 48.02, "D_n": 178, "D_bh_sharpe": 1.3445, "D_bh_return_pct": 12.41, "D_psr": 0.4205, "D_ic": 0.1073, "sharpe": -0.2403, "sortino": -0.256, "return_pct": -2.76, "equity": 972.4000000000001, "max_dd": 0.0, "win_rate": 48.02, "profit_factor": 0.0, "ic": 0.1073, "hit": 48.02, "psr": 0.4205, "bh_sharpe": 1.3445, "bh_return_pct": 12.41, "excess_sharpe": -1.5849, "precision": 0.617, "recall": 0.2816, "f1": 0.3867, "f2": 0.3159, "accuracy": 0.4831, "mcc": 0.0465, "tp": 29, "fp": 18, "tn": 57, "fn": 74, "A_precision": 0.617, "A_recall": 0.2816, "A_f1": 0.3867, "A_f2": 0.3159, "A_accuracy": 0.4831, "A_mcc": 0.0465, "A_tp": 29, "A_fp": 18, "A_tn": 57, "A_fn": 74}, {"fold": "fold_4", "regime": "China devaluation and oil crash", "n": 157, "A_sharpe": 0.5906, "A_sortino": 0.6498, "A_excess_sharpe": 0.5808, "A_return_pct": 6.15, "A_hit_rate": 46.15, "A_n": 157, "A_bh_sharpe": 0.0098, "A_bh_return_pct": -1.05, "A_psr": 0.6796, "A_ic": -0.0235, "B_sharpe": 0.9156, "B_sortino": 0.9679, "B_excess_sharpe": 0.8997, "B_return_pct": 20.96, "B_hit_rate": 50.32, "B_n": 157, "B_bh_sharpe": 0.0159, "B_bh_return_pct": -5.48, "B_psr": 0.7648, "B_ic": 0.0264, "D_sharpe": 0.5906, "D_sortino": 0.6498, "D_excess_sharpe": 0.5808, "D_return_pct": 6.15, "D_hit_rate": 46.15, "D_n": 157, "D_bh_sharpe": 0.0098, "D_bh_return_pct": -1.05, "D_psr": 0.6796, "D_ic": -0.0235, "sharpe": 0.5906, "sortino": 0.6498, "return_pct": 6.15, "equity": 1061.5, "max_dd": 0.0, "win_rate": 46.15, "profit_factor": 0.0, "ic": -0.0235, "hit": 46.15, "psr": 0.6796, "bh_sharpe": 0.0098, "bh_return_pct": -1.05, "excess_sharpe": 0.5808, "precision": 0.4727, "recall": 0.321, "f1": 0.3824, "f2": 0.343, "accuracy": 0.465, "mcc": -0.0635, "tp": 26, "fp": 29, "tn": 47, "fn": 55, "A_precision": 0.4727, "A_recall": 0.321, "A_f1": 0.3824, "A_f2": 0.343, "A_accuracy": 0.465, "A_mcc": -0.0635, "A_tp": 26, "A_fp": 29, "A_tn": 47, "A_fn": 55}, {"fold": "fold_5", "regime": "2018 Vol-mageddon + Q4 sell-off", "n": 177, "A_sharpe": 0.1513, "A_sortino": 0.1539, "A_excess_sharpe": -0.1585, "A_return_pct": 0.58, "A_hit_rate": 48.59, "A_n": 177, "A_bh_sharpe": 0.3098, "A_bh_return_pct": 3.19, "A_psr": 0.5503, "A_ic": -0.0201, "B_sharpe": -1.2172, "B_sortino": -1.2839, "B_excess_sharpe": -2.1088, "B_return_pct": -37.55, "B_hit_rate": 41.48, "B_n": 177, "B_bh_sharpe": 0.8917, "B_bh_return_pct": 23.8, "B_psr": 0.1565, "B_ic": -0.1337, "D_sharpe": 0.1513, "D_sortino": 0.1539, "D_excess_sharpe": -0.1585, "D_return_pct": 0.58, "D_hit_rate": 48.59, "D_n": 177, "D_bh_sharpe": 0.3098, "D_bh_return_pct": 3.19, "D_psr": 0.5503, "D_ic": -0.0201, "sharpe": 0.1513, "sortino": 0.1539, "return_pct": 0.58, "equity": 1005.8000000000001, "max_dd": 0.0, "win_rate": 48.59, "profit_factor": 0.0, "ic": -0.0201, "hit": 48.59, "psr": 0.5503, "bh_sharpe": 0.3098, "bh_return_pct": 3.19, "excess_sharpe": -0.1585, "precision": 0.5909, "recall": 0.3786, "f1": 0.4615, "f2": 0.4079, "accuracy": 0.4859, "mcc": 0.0141, "tp": 39, "fp": 27, "tn": 47, "fn": 64, "A_precision": 0.5909, "A_recall": 0.3786, "A_f1": 0.4615, "A_f2": 0.4079, "A_accuracy": 0.4859, "A_mcc": 0.0141, "A_tp": 39, "A_fp": 27, "A_tn": 47, "A_fn": 64}, {"fold": "fold_6", "regime": "COVID crash and V-recovery", "n": 222, "A_sharpe": 1.3211, "A_sortino": 1.4753, "A_excess_sharpe": 0.4323, "A_return_pct": 45.79, "A_hit_rate": 51.35, "A_n": 222, "A_bh_sharpe": 0.8888, "A_bh_return_pct": 26.13, "A_psr": 0.8976, "A_ic": 0.0841, "B_sharpe": -1.1373, "B_sortino": -1.1077, "B_excess_sharpe": -3.5257, "B_return_pct": -59.96, "B_hit_rate": 47.51, "B_n": 222, "B_bh_sharpe": 2.3884, "B_bh_return_pct": 243.18, "B_psr": 0.1431, "B_ic": 0.0363, "D_sharpe": 1.3211, "D_sortino": 1.4753, "D_excess_sharpe": 0.4323, "D_return_pct": 45.79, "D_hit_rate": 51.35, "D_n": 222, "D_bh_sharpe": 0.8888, "D_bh_return_pct": 26.13, "D_psr": 0.8976, "D_ic": 0.0841, "sharpe": 1.3211, "sortino": 1.4753, "return_pct": 45.79, "equity": 1457.8999999999999, "max_dd": 0.0, "win_rate": 51.35, "profit_factor": 0.0, "ic": 0.0841, "hit": 51.35, "psr": 0.8976, "bh_sharpe": 0.8888, "bh_return_pct": 26.13, "excess_sharpe": 0.4323, "precision": 0.625, "recall": 0.5435, "f1": 0.5814, "f2": 0.558, "accuracy": 0.5135, "mcc": 0.0076, "tp": 75, "fp": 45, "tn": 39, "fn": 63, "A_precision": 0.625, "A_recall": 0.5435, "A_f1": 0.5814, "A_f2": 0.558, "A_accuracy": 0.5135, "A_mcc": 0.0076, "A_tp": 75, "A_fp": 45, "A_tn": 39, "A_fn": 63}, {"fold": "fold_7", "regime": "Inflation bear, AI rally and 2025", "n": 425, "A_sharpe": -0.4757, "A_sortino": -0.4729, "A_excess_sharpe": -1.4472, "A_return_pct": -19.3, "A_hit_rate": 46.82, "A_n": 425, "A_bh_sharpe": 0.9715, "A_bh_return_pct": 37.12, "A_psr": 0.2664, "A_ic": -0.0484, "B_sharpe": -1.1364, "B_sortino": -1.1054, "B_excess_sharpe": -3.6391, "B_return_pct": -64.79, "B_hit_rate": 47.64, "B_n": 425, "B_bh_sharpe": 2.5027, "B_bh_return_pct": 458.83, "B_psr": 0.0712, "B_ic": -0.0751, "D_sharpe": -0.4757, "D_sortino": -0.4729, "D_excess_sharpe": -1.4472, "D_return_pct": -19.3, "D_hit_rate": 46.82, "D_n": 425, "D_bh_sharpe": 0.9715, "D_bh_return_pct": 37.12, "D_psr": 0.2664, "D_ic": -0.0484, "sharpe": -0.4757, "sortino": -0.4729, "return_pct": -19.3, "equity": 806.9999999999999, "max_dd": 0.0, "win_rate": 46.82, "profit_factor": 0.0, "ic": -0.0484, "hit": 46.82, "psr": 0.2664, "bh_sharpe": 0.9715, "bh_return_pct": 37.12, "excess_sharpe": -1.4472, "precision": 0.5682, "recall": 0.4, "f1": 0.4695, "f2": 0.4252, "accuracy": 0.4682, "mcc": -0.0343, "tp": 100, "fp": 76, "tn": 99, "fn": 150, "A_precision": 0.5682, "A_recall": 0.4, "A_f1": 0.4695, "A_f2": 0.4252, "A_accuracy": 0.4682, "A_mcc": -0.0343, "A_tp": 100, "A_fp": 76, "A_tn": 99, "A_fn": 150}], "per_window_val": [{"fold": "fold_1", "regime": "GFC peak crash (Lehman + Mar-2009 bottom)", "n": 104, "A_sharpe": -0.3665, "A_sortino": -0.4548, "A_excess_sharpe": -0.1993, "A_return_pct": -6.08, "A_hit_rate": 41.18, "A_n": 104, "A_bh_sharpe": -0.1672, "A_bh_return_pct": -3.81, "A_psr": 0.4087, "A_ic": -0.0339, "B_sharpe": 0.1315, "B_sortino": 0.1263, "B_excess_sharpe": 2.4056, "B_return_pct": -3.34, "B_hit_rate": 51.46, "B_n": 104, "B_bh_sharpe": -2.2741, "B_bh_return_pct": -44.12, "B_psr": 0.5335, "B_ic": 0.041, "D_sharpe": -0.3665, "D_sortino": -0.4548, "D_excess_sharpe": -0.1993, "D_return_pct": -6.08, "D_hit_rate": 41.18, "D_n": 104, "D_bh_sharpe": -0.1672, "D_bh_return_pct": -3.81, "D_psr": 0.4087, "D_ic": -0.0339, "sharpe": -0.3665, "sortino": -0.4548, "return_pct": -6.08, "equity": 939.2, "max_dd": 0.0, "win_rate": 41.18, "profit_factor": 0.0, "ic": -0.0339, "hit": 41.18, "psr": 0.4087, "bh_sharpe": -0.1672, "bh_return_pct": -3.81, "excess_sharpe": -0.1993}, {"fold": "fold_2", "regime": "2011 US-downgrade + EU debt", "n": 96, "A_sharpe": 1.0826, "A_sortino": 1.3222, "A_excess_sharpe": 1.3567, "A_return_pct": 10.16, "A_hit_rate": 44.21, "A_n": 96, "A_bh_sharpe": -0.2741, "A_bh_return_pct": -4.09, "A_psr": 0.7509, "A_ic": 0.0563, "B_sharpe": 0.1338, "B_sortino": 0.1364, "B_excess_sharpe": 1.1612, "B_return_pct": -3.48, "B_hit_rate": 50.0, "B_n": 96, "B_bh_sharpe": -1.0274, "B_bh_return_pct": -25.58, "B_psr": 0.5327, "B_ic": 0.074, "D_sharpe": 1.0826, "D_sortino": 1.3222, "D_excess_sharpe": 1.3567, "D_return_pct": 10.16, "D_hit_rate": 44.21, "D_n": 96, "D_bh_sharpe": -0.2741, "D_bh_return_pct": -4.09, "D_psr": 0.7509, "D_ic": 0.0563, "sharpe": 1.0826, "sortino": 1.3222, "return_pct": 10.16, "equity": 1101.6, "max_dd": 0.0, "win_rate": 44.21, "profit_factor": 0.0, "ic": 0.0563, "hit": 44.21, "psr": 0.7509, "bh_sharpe": -0.2741, "bh_return_pct": -4.09, "excess_sharpe": 1.3567}, {"fold": "fold_3", "regime": "Taper tantrum and 2014 H1", "n": 54, "A_sharpe": -3.8144, "A_sortino": -3.5255, "A_excess_sharpe": -8.5141, "A_return_pct": -8.06, "A_hit_rate": 37.04, "A_n": 54, "A_bh_sharpe": 4.6998, "A_bh_return_pct": 10.46, "A_psr": 0.037, "A_ic": -0.1617, "B_sharpe": -1.3259, "B_sortino": -1.1412, "B_excess_sharpe": -10.3585, "B_return_pct": -7.19, "B_hit_rate": 53.7, "B_n": 54, "B_bh_sharpe": 9.0326, "B_bh_return_pct": 49.18, "B_psr": 0.2691, "B_ic": -0.1213, "D_sharpe": -3.8144, "D_sortino": -3.5255, "D_excess_sharpe": -8.5141, "D_return_pct": -8.06, "D_hit_rate": 37.04, "D_n": 54, "D_bh_sharpe": 4.6998, "D_bh_return_pct": 10.46, "D_psr": 0.037, "D_ic": -0.1617, "sharpe": -3.8144, "sortino": -3.5255, "return_pct": -8.06, "equity": 919.4, "max_dd": 0.0, "win_rate": 37.04, "profit_factor": 0.0, "ic": -0.1617, "hit": 37.04, "psr": 0.037, "bh_sharpe": 4.6998, "bh_return_pct": 10.46, "excess_sharpe": -8.5141}, {"fold": "fold_4", "regime": "China devaluation and oil crash", "n": 96, "A_sharpe": -3.8747, "A_sortino": -3.3846, "A_excess_sharpe": -3.4506, "A_return_pct": -24.59, "A_hit_rate": 37.89, "A_n": 96, "A_bh_sharpe": -0.4241, "A_bh_return_pct": -3.73, "A_psr": 0.0039, "A_ic": -0.1163, "B_sharpe": -1.4395, "B_sortino": -1.2, "B_excess_sharpe": -0.2552, "B_return_pct": -24.75, "B_hit_rate": 51.04, "B_n": 96, "B_bh_sharpe": -1.1843, "B_bh_return_pct": -21.44, "B_psr": 0.1722, "B_ic": -0.104, "D_sharpe": -3.8747, "D_sortino": -3.3846, "D_excess_sharpe": -3.4506, "D_return_pct": -24.59, "D_hit_rate": 37.89, "D_n": 96, "D_bh_sharpe": -0.4241, "D_bh_return_pct": -3.73, "D_psr": 0.0039, "D_ic": -0.1163, "sharpe": -3.8747, "sortino": -3.3846, "return_pct": -24.59, "equity": 754.1, "max_dd": 0.0, "win_rate": 37.89, "profit_factor": 0.0, "ic": -0.1163, "hit": 37.89, "psr": 0.0039, "bh_sharpe": -0.4241, "bh_return_pct": -3.73, "excess_sharpe": -3.4506}, {"fold": "fold_5", "regime": "2018 Vol-mageddon + Q4 sell-off", "n": 54, "A_sharpe": -0.9779, "A_sortino": -0.9697, "A_excess_sharpe": -2.4059, "A_return_pct": -2.95, "A_hit_rate": 50.0, "A_n": 54, "A_bh_sharpe": 1.428, "A_bh_return_pct": 3.97, "A_psr": 0.3286, "A_ic": -0.1354, "B_sharpe": -1.7702, "B_sortino": -1.8736, "B_excess_sharpe": -6.7023, "B_return_pct": -11.81, "B_hit_rate": 38.89, "B_n": 54, "B_bh_sharpe": 4.9322, "B_bh_return_pct": 34.93, "B_psr": 0.2121, "B_ic": -0.1974, "D_sharpe": -0.9779, "D_sortino": -0.9697, "D_excess_sharpe": -2.4059, "D_return_pct": -2.95, "D_hit_rate": 50.0, "D_n": 54, "D_bh_sharpe": 1.428, "D_bh_return_pct": 3.97, "D_psr": 0.3286, "D_ic": -0.1354, "sharpe": -0.9779, "sortino": -0.9697, "return_pct": -2.95, "equity": 970.5, "max_dd": 0.0, "win_rate": 50.0, "profit_factor": 0.0, "ic": -0.1354, "hit": 50.0, "psr": 0.3286, "bh_sharpe": 1.428, "bh_return_pct": 3.97, "excess_sharpe": -2.4059}, {"fold": "fold_6", "regime": "COVID crash and V-recovery", "n": 75, "A_sharpe": -1.7034, "A_sortino": -1.7342, "A_excess_sharpe": -6.0028, "A_return_pct": -5.69, "A_hit_rate": 44.0, "A_n": 75, "A_bh_sharpe": 4.2994, "A_bh_return_pct": 14.68, "A_psr": 0.1837, "A_ic": -0.0761, "B_sharpe": 0.1719, "B_sortino": 0.1728, "B_excess_sharpe": -14.162, "B_return_pct": 0.34, "B_hit_rate": 50.67, "B_n": 75, "B_bh_sharpe": 14.3339, "B_bh_return_pct": 120.13, "B_psr": 0.5371, "B_ic": 0.0861, "D_sharpe": -1.7034, "D_sortino": -1.7342, "D_excess_sharpe": -6.0028, "D_return_pct": -5.69, "D_hit_rate": 44.0, "D_n": 75, "D_bh_sharpe": 4.2994, "D_bh_return_pct": 14.68, "D_psr": 0.1837, "D_ic": -0.0761, "sharpe": -1.7034, "sortino": -1.7342, "return_pct": -5.69, "equity": 943.1, "max_dd": 0.0, "win_rate": 44.0, "profit_factor": 0.0, "ic": -0.0761, "hit": 44.0, "psr": 0.1837, "bh_sharpe": 4.2994, "bh_return_pct": 14.68, "excess_sharpe": -6.0028}, {"fold": "fold_7", "regime": "Inflation bear, AI rally and 2025", "n": 114, "A_sharpe": -1.1735, "A_sortino": -1.0787, "A_excess_sharpe": -4.0185, "A_return_pct": -8.49, "A_hit_rate": 49.12, "A_n": 114, "A_bh_sharpe": 2.845, "A_bh_return_pct": 21.34, "A_psr": 0.2136, "A_ic": -0.0294, "B_sharpe": 3.4153, "B_sortino": 3.8078, "B_excess_sharpe": -2.7213, "B_return_pct": 70.42, "B_hit_rate": 60.53, "B_n": 114, "B_bh_sharpe": 6.1366, "B_bh_return_pct": 155.03, "B_psr": 0.9906, "B_ic": 0.0024, "D_sharpe": -1.1735, "D_sortino": -1.0787, "D_excess_sharpe": -4.0185, "D_return_pct": -8.49, "D_hit_rate": 49.12, "D_n": 114, "D_bh_sharpe": 2.845, "D_bh_return_pct": 21.34, "D_psr": 0.2136, "D_ic": -0.0294, "sharpe": -1.1735, "sortino": -1.0787, "return_pct": -8.49, "equity": 915.1, "max_dd": 0.0, "win_rate": 49.12, "profit_factor": 0.0, "ic": -0.0294, "hit": 49.12, "psr": 0.2136, "bh_sharpe": 2.845, "bh_return_pct": 21.34, "excess_sharpe": -4.0185}], "status": "DISCARD", "precision": 0.5666, "recall": 0.4114, "f1": 0.4767, "f2": 0.4352, "accuracy": 0.483, "mcc": -0.0099, "tp": 332, "fp": 254, "tn": 349, "fn": 475, "test_sharpe": 0.011, "A_sharpe": 0.011, "A_excess_sharpe": -0.5933, "A_return_pct": -17.26, "A_precision": 0.5666, "A_recall": 0.4114, "A_f1": 0.4767, "A_f2": 0.4352, "A_accuracy": 0.483, "A_mcc": -0.0099, "A_tp": 332, "A_fp": 254, "A_tn": 349, "A_fn": 475, "A_psr": 0.5103, "A_ic": -0.0003, "A_hit_rate": 48.19, "A_bh_sharpe": 0.6042, "A_bh_return_pct": 103.49}
