{"experiment_num": 43, "backbone": "xgboost", "description": "XGBoost @ exp 42 n_est=150 (up from 100) - capacity hill-climb at lr=0.03", "config": {"seq_len": 60, "lr": 0.0003, "batch_size": 32, "epochs": 50, "weight_decay": 1e-05, "patience": 10, "warmup_epochs": 0, "head_dropout": 0.1, "huber_delta": 1.0, "grad_clip": 1.0, "seed": 42, "hidden_size": null, "num_layers": null, "max_depth": 4, "gbm_lr": 0.03, "n_estimators": 150}, "composite": -1.1486, "test_pos_folds": 5, "val_pos_folds": 2, "val_loss": null, "elapsed_sec": 106.4, "timestamp": "2026-04-27T19:02:04", "sharpe": 0.2695, "val_sharpe": -0.9486, "ic": 0.0004, "hit": 48.5, "psr": 0.7114, "equity": 1162.1999999999998, "return_pct": 16.22, "bh_sharpe": 1.2194, "bh_return_pct": 187.05, "excess_sharpe": -0.9499, "B_sharpe": 0.0688, "B_excess_sharpe": -2.7594, "B_return_pct": -27.57, "D_sharpe": 0.1987, "D_excess_sharpe": -1.0207, "D_return_pct": 8.62, "per_window": [{"fold": "fold_1", "regime": "GFC peak crash (Lehman + Mar-2009 bottom)", "n": 66, "A_sharpe": 1.1137, "A_sortino": 1.2158, "A_excess_sharpe": 0.5416, "A_return_pct": 9.49, "A_hit_rate": 50.0, "A_n": 66, "A_bh_sharpe": 0.5721, "A_bh_return_pct": 3.85, "A_psr": 0.7154, "A_ic": 0.0483, "B_sharpe": 1.2265, "B_sortino": 1.2076, "B_excess_sharpe": -0.8204, "B_return_pct": 18.37, "B_hit_rate": 55.38, "B_n": 66, "B_bh_sharpe": 2.0469, "B_bh_return_pct": 39.28, "B_psr": 0.7328, "B_ic": 0.1718, "D_sharpe": 2.2419, "D_sortino": 2.1714, "D_excess_sharpe": 1.6698, "D_return_pct": 22.07, "D_hit_rate": 59.09, "D_n": 66, "D_bh_sharpe": 0.5721, "D_bh_return_pct": 3.85, "D_psr": 0.8687, "D_ic": 0.252, "sharpe": 1.1137, "sortino": 1.2158, "return_pct": 9.49, "equity": 1094.9, "max_dd": 0.0, "win_rate": 50.0, "profit_factor": 0.0, "ic": 0.0483, "hit": 50.0, "psr": 0.7154, "bh_sharpe": 0.5721, "bh_return_pct": 3.85, "excess_sharpe": 0.5416, "precision": 0.5333, "recall": 0.4571, "f1": 0.4923, "f2": 0.4706, "accuracy": 0.5, "mcc": 0.0055, "tp": 16, "fp": 14, "tn": 17, "fn": 19, "A_precision": 0.5333, "A_recall": 0.4571, "A_f1": 0.4923, "A_f2": 0.4706, "A_accuracy": 0.5, "A_mcc": 0.0055, "A_tp": 16, "A_fp": 14, "A_tn": 17, "A_fn": 19}, {"fold": "fold_2", "regime": "2011 US-downgrade + EU debt", "n": 87, "A_sharpe": 2.5348, "A_sortino": 3.3106, "A_excess_sharpe": -2.4872, "A_return_pct": 14.11, "A_hit_rate": 52.33, "A_n": 87, "A_bh_sharpe": 5.022, "A_bh_return_pct": 29.23, "A_psr": 0.9451, "A_ic": 0.0467, "B_sharpe": 9.2156, "B_sortino": 9.516, "B_excess_sharpe": -1.9213, "B_return_pct": 149.5, "B_hit_rate": 75.86, "B_n": 87, "B_bh_sharpe": 11.1369, "B_bh_return_pct": 185.4, "B_psr": 1.0, "B_ic": 0.1813, "D_sharpe": 4.0079, "D_sortino": 5.0215, "D_excess_sharpe": -1.0141, "D_return_pct": 23.04, "D_hit_rate": 60.47, "D_n": 87, "D_bh_sharpe": 5.022, "D_bh_return_pct": 29.23, "D_psr": 0.9954, "D_ic": 0.0048, "sharpe": 2.5348, "sortino": 3.3106, "return_pct": 14.11, "equity": 1141.1, "max_dd": 0.0, "win_rate": 52.33, "profit_factor": 0.0, "ic": 0.0467, "hit": 52.33, "psr": 0.9451, "bh_sharpe": 5.022, "bh_return_pct": 29.23, "excess_sharpe": -2.4872, "precision": 0.614, "recall": 0.6481, "f1": 0.6306, "f2": 0.641, "accuracy": 0.5287, "mcc": -0.0189, "tp": 35, "fp": 22, "tn": 11, "fn": 19, "A_precision": 0.614, "A_recall": 0.6481, "A_f1": 0.6306, "A_f2": 0.641, "A_accuracy": 0.5287, "A_mcc": -0.0189, "A_tp": 35, "A_fp": 22, "A_tn": 11, "A_fn": 19}, {"fold": "fold_3", "regime": "Taper tantrum and 2014 H1", "n": 129, "A_sharpe": 1.0252, "A_sortino": 0.8724, "A_excess_sharpe": -0.7426, "A_return_pct": 6.5, "A_hit_rate": 57.81, "A_n": 129, "A_bh_sharpe": 1.7678, "A_bh_return_pct": 11.76, "A_psr": 0.7603, "A_ic": 0.0731, "B_sharpe": 4.9355, "B_sortino": 5.0277, "B_excess_sharpe": 0.6881, "B_return_pct": 77.04, "B_hit_rate": 65.12, "B_n": 129, "B_bh_sharpe": 4.2474, "B_bh_return_pct": 64.1, "B_psr": 0.9996, "B_ic": -0.0502, "D_sharpe": 2.1497, "D_sortino": 1.9796, "D_excess_sharpe": 0.3819, "D_return_pct": 14.54, "D_hit_rate": 59.38, "D_n": 129, "D_bh_sharpe": 1.7678, "D_bh_return_pct": 11.76, "D_psr": 0.9281, "D_ic": 0.0873, "sharpe": 1.0252, "sortino": 0.8724, "return_pct": 6.5, "equity": 1065.0, "max_dd": 0.0, "win_rate": 57.81, "profit_factor": 0.0, "ic": 0.0731, "hit": 57.81, "psr": 0.7603, "bh_sharpe": 1.7678, "bh_return_pct": 11.76, "excess_sharpe": -0.7426, "precision": 0.6, "recall": 0.8846, "f1": 0.715, "f2": 0.808, "accuracy": 0.5736, "mcc": -0.0273, "tp": 69, "fp": 46, "tn": 5, "fn": 9, "A_precision": 0.6, "A_recall": 0.8846, "A_f1": 0.715, "A_f2": 0.808, "A_accuracy": 0.5736, "A_mcc": -0.0273, "A_tp": 69, "A_fp": 46, "A_tn": 5, "A_fn": 9}, {"fold": "fold_4", "regime": "China devaluation and oil crash", "n": 108, "A_sharpe": -0.6027, "A_sortino": -0.6041, "A_excess_sharpe": 0.0871, "A_return_pct": -5.99, "A_hit_rate": 46.73, "A_n": 108, "A_bh_sharpe": -0.6898, "A_bh_return_pct": -6.71, "A_psr": 0.3474, "A_ic": -0.0065, "B_sharpe": -3.0511, "B_sortino": -2.7534, "B_excess_sharpe": -1.0936, "B_return_pct": -45.53, "B_hit_rate": 41.67, "B_n": 108, "B_bh_sharpe": -1.9575, "B_bh_return_pct": -33.56, "B_psr": 0.02, "B_ic": -0.0696, "D_sharpe": -2.2048, "D_sortino": -1.9857, "D_excess_sharpe": -1.515, "D_return_pct": -18.17, "D_hit_rate": 45.79, "D_n": 108, "D_bh_sharpe": -0.6898, "D_bh_return_pct": -6.71, "D_psr": 0.0718, "D_ic": -0.0404, "sharpe": -0.6027, "sortino": -0.6041, "return_pct": -5.99, "equity": 940.1, "max_dd": 0.0, "win_rate": 46.73, "profit_factor": 0.0, "ic": -0.0065, "hit": 46.73, "psr": 0.3474, "bh_sharpe": -0.6898, "bh_return_pct": -6.71, "excess_sharpe": 0.0871, "precision": 0.4688, "recall": 0.566, "f1": 0.5128, "f2": 0.5435, "accuracy": 0.4722, "mcc": -0.0531, "tp": 30, "fp": 34, "tn": 21, "fn": 23, "A_precision": 0.4688, "A_recall": 0.566, "A_f1": 0.5128, "A_f2": 0.5435, "A_accuracy": 0.4722, "A_mcc": -0.0531, "A_tp": 30, "A_fp": 34, "A_tn": 21, "A_fn": 23}, {"fold": "fold_5", "regime": "2018 Vol-mageddon + Q4 sell-off", "n": 128, "A_sharpe": 1.0048, "A_sortino": 1.0807, "A_excess_sharpe": -0.1463, "A_return_pct": 11.23, "A_hit_rate": 52.34, "A_n": 128, "A_bh_sharpe": 1.1511, "A_bh_return_pct": 13.19, "A_psr": 0.7652, "A_ic": 0.0468, "B_sharpe": -4.0163, "B_sortino": -3.887, "B_excess_sharpe": -6.8282, "B_return_pct": -62.4, "B_hit_rate": 33.07, "B_n": 128, "B_bh_sharpe": 2.8119, "B_bh_return_pct": 82.25, "B_psr": 0.0024, "B_ic": -0.1538, "D_sharpe": -1.9359, "D_sortino": -2.0923, "D_excess_sharpe": -3.087, "D_return_pct": -21.75, "D_hit_rate": 39.06, "D_n": 128, "D_bh_sharpe": 1.1511, "D_bh_return_pct": 13.19, "D_psr": 0.0941, "D_ic": -0.1194, "sharpe": 1.0048, "sortino": 1.0807, "return_pct": 11.23, "equity": 1112.3, "max_dd": 0.0, "win_rate": 52.34, "profit_factor": 0.0, "ic": 0.0468, "hit": 52.34, "psr": 0.7652, "bh_sharpe": 1.1511, "bh_return_pct": 13.19, "excess_sharpe": -0.1463, "precision": 0.6049, "recall": 0.6282, "f1": 0.6164, "f2": 0.6234, "accuracy": 0.5234, "mcc": -0.0119, "tp": 49, "fp": 32, "tn": 18, "fn": 29, "A_precision": 0.6049, "A_recall": 0.6282, "A_f1": 0.6164, "A_f2": 0.6234, "A_accuracy": 0.5234, "A_mcc": -0.0119, "A_tp": 49, "A_fp": 32, "A_tn": 18, "A_fn": 29}, {"fold": "fold_6", "regime": "COVID crash and V-recovery", "n": 173, "A_sharpe": 0.972, "A_sortino": 1.0489, "A_excess_sharpe": -1.3541, "A_return_pct": 15.21, "A_hit_rate": 50.29, "A_n": 173, "A_bh_sharpe": 2.3261, "A_bh_return_pct": 43.81, "A_psr": 0.7901, "A_ic": 0.0528, "B_sharpe": 0.0961, "B_sortino": 0.0954, "B_excess_sharpe": -5.6499, "B_return_pct": -5.34, "B_hit_rate": 50.0, "B_n": 173, "B_bh_sharpe": 5.746, "B_bh_return_pct": 499.04, "B_psr": 0.5316, "B_ic": 0.0697, "D_sharpe": 0.2501, "D_sortino": 0.2718, "D_excess_sharpe": -2.0759, "D_return_pct": 2.17, "D_hit_rate": 45.66, "D_n": 173, "D_bh_sharpe": 2.3261, "D_bh_return_pct": 43.81, "D_psr": 0.5819, "D_ic": -0.0318, "sharpe": 0.972, "sortino": 1.0489, "return_pct": 15.21, "equity": 1152.1, "max_dd": 0.0, "win_rate": 50.29, "profit_factor": 0.0, "ic": 0.0528, "hit": 50.29, "psr": 0.7901, "bh_sharpe": 2.3261, "bh_return_pct": 43.81, "excess_sharpe": -1.3541, "precision": 0.6709, "recall": 0.469, "f1": 0.5521, "f2": 0.4991, "accuracy": 0.5029, "mcc": 0.0341, "tp": 53, "fp": 26, "tn": 34, "fn": 60, "A_precision": 0.6709, "A_recall": 0.469, "A_f1": 0.5521, "A_f2": 0.4991, "A_accuracy": 0.5029, "A_mcc": 0.0341, "A_tp": 53, "A_fp": 26, "A_tn": 34, "A_fn": 60}, {"fold": "fold_7", "regime": "Inflation bear, AI rally and 2025", "n": 376, "A_sharpe": -0.8504, "A_sortino": -0.967, "A_excess_sharpe": -1.6536, "A_return_pct": -27.5, "A_hit_rate": 42.55, "A_n": 376, "A_bh_sharpe": 0.8033, "A_bh_return_pct": 26.02, "A_psr": 0.1596, "A_ic": -0.0661, "B_sharpe": -0.2533, "B_sortino": -0.2887, "B_excess_sharpe": -2.185, "B_return_pct": -28.55, "B_hit_rate": 42.93, "B_n": 376, "B_bh_sharpe": 1.9317, "B_bh_return_pct": 222.05, "B_psr": 0.3792, "B_ic": -0.0081, "D_sharpe": 0.0044, "D_sortino": 0.0057, "D_excess_sharpe": -0.7989, "D_return_pct": -3.49, "D_hit_rate": 42.02, "D_n": 376, "D_bh_sharpe": 0.8033, "D_bh_return_pct": 26.02, "D_psr": 0.5021, "D_ic": -0.0174, "sharpe": -0.8504, "sortino": -0.967, "return_pct": -27.5, "equity": 725.0, "max_dd": 0.0, "win_rate": 42.55, "profit_factor": 0.0, "ic": -0.0661, "hit": 42.55, "psr": 0.1596, "bh_sharpe": 0.8033, "bh_return_pct": 26.02, "excess_sharpe": -1.6536, "precision": 0.5352, "recall": 0.1719, "f1": 0.2603, "f2": 0.199, "accuracy": 0.4255, "mcc": -0.0515, "tp": 38, "fp": 33, "tn": 122, "fn": 183, "A_precision": 0.5352, "A_recall": 0.1719, "A_f1": 0.2603, "A_f2": 0.199, "A_accuracy": 0.4255, "A_mcc": -0.0515, "A_tp": 38, "A_fp": 33, "A_tn": 122, "A_fn": 183}], "per_window_val": [{"fold": "fold_1", "regime": "GFC peak crash (Lehman + Mar-2009 bottom)", "n": 65, "A_sharpe": -1.4603, "A_sortino": -1.4219, "A_excess_sharpe": 0.7653, "A_return_pct": -13.23, "A_hit_rate": 42.86, "A_n": 65, "A_bh_sharpe": -2.2257, "A_bh_return_pct": -18.74, "A_psr": 0.228, "A_ic": -0.0153, "B_sharpe": -4.8717, "B_sortino": -4.5059, "B_excess_sharpe": 2.2507, "B_return_pct": -61.67, "B_hit_rate": 36.92, "B_n": 65, "B_bh_sharpe": -7.1223, "B_bh_return_pct": -73.11, "B_psr": 0.0153, "B_ic": 0.3839, "D_sharpe": -1.9766, "D_sortino": -1.6606, "D_excess_sharpe": 0.249, "D_return_pct": -17.0, "D_hit_rate": 47.62, "D_n": 65, "D_bh_sharpe": -2.2257, "D_bh_return_pct": -18.74, "D_psr": 0.1447, "D_ic": 0.3033, "sharpe": -1.4603, "sortino": -1.4219, "return_pct": -13.23, "equity": 867.7, "max_dd": 0.0, "win_rate": 42.86, "profit_factor": 0.0, "ic": -0.0153, "hit": 42.86, "psr": 0.228, "bh_sharpe": -2.2257, "bh_return_pct": -18.74, "excess_sharpe": 0.7653}, {"fold": "fold_2", "regime": "2011 US-downgrade + EU debt", "n": 47, "A_sharpe": -0.73, "A_sortino": -0.6535, "A_excess_sharpe": -0.5359, "A_return_pct": -5.69, "A_hit_rate": 53.19, "A_n": 47, "A_bh_sharpe": -0.1941, "A_bh_return_pct": -2.36, "A_psr": 0.3768, "A_ic": -0.0707, "B_sharpe": -0.3176, "B_sortino": -0.2702, "B_excess_sharpe": 1.2947, "B_return_pct": -9.36, "B_hit_rate": 55.32, "B_n": 47, "B_bh_sharpe": -1.6123, "B_bh_return_pct": -24.3, "B_psr": 0.4457, "B_ic": 0.1573, "D_sharpe": 1.5804, "D_sortino": 1.4951, "D_excess_sharpe": 1.7745, "D_return_pct": 9.48, "D_hit_rate": 57.45, "D_n": 47, "D_bh_sharpe": -0.1941, "D_bh_return_pct": -2.36, "D_psr": 0.7464, "D_ic": 0.0602, "sharpe": -0.73, "sortino": -0.6535, "return_pct": -5.69, "equity": 943.1, "max_dd": 0.0, "win_rate": 53.19, "profit_factor": 0.0, "ic": -0.0707, "hit": 53.19, "psr": 0.3768, "bh_sharpe": -0.1941, "bh_return_pct": -2.36, "excess_sharpe": -0.5359}, {"fold": "fold_3", "regime": "Taper tantrum and 2014 H1", "n": 5, "A_sharpe": 10.4634, "A_sortino": 21.0684, "A_excess_sharpe": 11.7829, "A_return_pct": 1.37, "A_hit_rate": 60.0, "A_n": 5, "A_bh_sharpe": -1.3194, "A_bh_return_pct": -0.21, "A_psr": 0.9289, "A_ic": 0.4, "B_sharpe": 6.781, "B_sortino": 10.0408, "B_excess_sharpe": 32.6516, "B_return_pct": 1.79, "B_hit_rate": 60.0, "B_n": 5, "B_bh_sharpe": -25.8705, "B_bh_return_pct": -3.84, "B_psr": 0.8179, "B_ic": -0.1, "D_sharpe": -0.4387, "D_sortino": -0.3612, "D_excess_sharpe": 0.8807, "D_return_pct": -0.07, "D_hit_rate": 60.0, "D_n": 5, "D_bh_sharpe": -1.3194, "D_bh_return_pct": -0.21, "D_psr": 0.4779, "D_ic": -0.4, "sharpe": 10.4634, "sortino": 21.0684, "return_pct": 1.37, "equity": 1013.7, "max_dd": 0.0, "win_rate": 60.0, "profit_factor": 0.0, "ic": 0.4, "hit": 60.0, "psr": 0.9289, "bh_sharpe": -1.3194, "bh_return_pct": -0.21, "excess_sharpe": 11.7829}, {"fold": "fold_4", "regime": "China devaluation and oil crash", "n": 47, "A_sharpe": -0.9684, "A_sortino": -0.9642, "A_excess_sharpe": 0.8554, "A_return_pct": -4.99, "A_hit_rate": 44.68, "A_n": 47, "A_bh_sharpe": -1.8238, "A_bh_return_pct": -8.68, "A_psr": 0.3395, "A_ic": -0.0816, "B_sharpe": 0.312, "B_sortino": 0.2775, "B_excess_sharpe": 2.532, "B_return_pct": 0.09, "B_hit_rate": 51.06, "B_n": 47, "B_bh_sharpe": -2.22, "B_bh_return_pct": -23.98, "B_psr": 0.5524, "B_ic": 0.549, "D_sharpe": -0.138, "D_sortino": -0.1332, "D_excess_sharpe": 1.6858, "D_return_pct": -1.23, "D_hit_rate": 51.06, "D_n": 47, "D_bh_sharpe": -1.8238, "D_bh_return_pct": -8.68, "D_psr": 0.4765, "D_ic": 0.222, "sharpe": -0.9684, "sortino": -0.9642, "return_pct": -4.99, "equity": 950.0999999999999, "max_dd": 0.0, "win_rate": 44.68, "profit_factor": 0.0, "ic": -0.0816, "hit": 44.68, "psr": 0.3395, "bh_sharpe": -1.8238, "bh_return_pct": -8.68, "excess_sharpe": 0.8554}, {"fold": "fold_5", "regime": "2018 Vol-mageddon + Q4 sell-off", "n": 5, "A_sharpe": -10.1368, "A_sortino": -6.9937, "A_excess_sharpe": 0.0, "A_return_pct": -3.15, "A_hit_rate": 40.0, "A_n": 5, "A_bh_sharpe": -10.1368, "A_bh_return_pct": -3.15, "A_psr": 0.0985, "A_ic": 0.1, "B_sharpe": 5.6858, "B_sortino": 6.0578, "B_excess_sharpe": 0.0, "B_return_pct": 4.22, "B_hit_rate": 60.0, "B_n": 5, "B_bh_sharpe": 5.6858, "B_bh_return_pct": 4.22, "B_psr": 0.753, "B_ic": 0.2, "D_sharpe": -10.1368, "D_sortino": -6.9937, "D_excess_sharpe": 0.0, "D_return_pct": -3.15, "D_hit_rate": 40.0, "D_n": 5, "D_bh_sharpe": -10.1368, "D_bh_return_pct": -3.15, "D_psr": 0.0985, "D_ic": 0.1, "sharpe": -10.1368, "sortino": -6.9937, "return_pct": -3.15, "equity": 968.5, "max_dd": 0.0, "win_rate": 40.0, "profit_factor": 0.0, "ic": 0.1, "hit": 40.0, "psr": 0.0985, "bh_sharpe": -10.1368, "bh_return_pct": -3.15, "excess_sharpe": 0.0}, {"fold": "fold_6", "regime": "COVID crash and V-recovery", "n": 26, "A_sharpe": 4.5857, "A_sortino": 5.224, "A_excess_sharpe": 1.3005, "A_return_pct": 6.7, "A_hit_rate": 57.69, "A_n": 26, "A_bh_sharpe": 3.2852, "A_bh_return_pct": 4.82, "A_psr": 0.9228, "A_ic": 0.0475, "B_sharpe": 3.6669, "B_sortino": 3.3795, "B_excess_sharpe": -9.3123, "B_return_pct": 11.97, "B_hit_rate": 65.38, "B_n": 26, "B_bh_sharpe": 12.9792, "B_bh_return_pct": 38.76, "B_psr": 0.8689, "B_ic": 0.2903, "D_sharpe": 6.1513, "D_sortino": 9.9593, "D_excess_sharpe": 2.8661, "D_return_pct": 8.85, "D_hit_rate": 53.85, "D_n": 26, "D_bh_sharpe": 3.2852, "D_bh_return_pct": 4.82, "D_psr": 0.9838, "D_ic": 0.308, "sharpe": 4.5857, "sortino": 5.224, "return_pct": 6.7, "equity": 1067.0, "max_dd": 0.0, "win_rate": 57.69, "profit_factor": 0.0, "ic": 0.0475, "hit": 57.69, "psr": 0.9228, "bh_sharpe": 3.2852, "bh_return_pct": 4.82, "excess_sharpe": 1.3005}, {"fold": "fold_7", "regime": "Inflation bear, AI rally and 2025", "n": 65, "A_sharpe": -2.2516, "A_sortino": -2.105, "A_excess_sharpe": -4.3305, "A_return_pct": -8.72, "A_hit_rate": 46.15, "A_n": 65, "A_bh_sharpe": 2.0789, "A_bh_return_pct": 8.17, "A_psr": 0.1286, "A_ic": -0.0267, "B_sharpe": -4.9129, "B_sortino": -4.4741, "B_excess_sharpe": -10.1443, "B_return_pct": -30.92, "B_hit_rate": 35.38, "B_n": 65, "B_bh_sharpe": 5.2314, "B_bh_return_pct": 44.53, "B_psr": 0.0078, "B_ic": 0.0286, "D_sharpe": -1.7255, "D_sortino": -1.5414, "D_excess_sharpe": -3.8044, "D_return_pct": -6.84, "D_hit_rate": 49.23, "D_n": 65, "D_bh_sharpe": 2.0789, "D_bh_return_pct": 8.17, "D_psr": 0.1886, "D_ic": 0.0489, "sharpe": -2.2516, "sortino": -2.105, "return_pct": -8.72, "equity": 912.8000000000001, "max_dd": 0.0, "win_rate": 46.15, "profit_factor": 0.0, "ic": -0.0267, "hit": 46.15, "psr": 0.1286, "bh_sharpe": 2.0789, "bh_return_pct": 8.17, "excess_sharpe": -4.3305}], "status": "DISCARD", "precision": 0.5835, "recall": 0.4589, "f1": 0.5137, "f2": 0.4793, "accuracy": 0.4855, "mcc": -0.0167, "tp": 290, "fp": 207, "tn": 228, "fn": 342, "test_sharpe": 0.2695, "A_sharpe": 0.2695, "A_excess_sharpe": -0.9499, "A_return_pct": 16.22, "A_precision": 0.5835, "A_recall": 0.4589, "A_f1": 0.5137, "A_f2": 0.4793, "A_accuracy": 0.4855, "A_mcc": -0.0167, "A_tp": 290, "A_fp": 207, "A_tn": 228, "A_fn": 342, "A_psr": 0.7114, "A_ic": 0.0004, "A_hit_rate": 48.5, "A_bh_sharpe": 1.2194, "A_bh_return_pct": 187.05}
