{"experiment_num": 8, "backbone": "lstm", "description": "LSTM @ FX-Exp35 HPs seed=0 \u2014 multi-seed variance check (vs exp 5 seed=42)", "config": {"seq_len": 10, "lr": 0.001, "batch_size": 16, "epochs": 100, "weight_decay": 0.0007, "patience": 15, "warmup_epochs": 0, "head_dropout": 0.1, "huber_delta": 1.0, "grad_clip": 1.0, "seed": 0, "hidden_size": null, "num_layers": null, "max_depth": null, "gbm_lr": null, "n_estimators": null}, "composite": 0.2395, "test_pos_folds": 5, "val_pos_folds": 6, "val_loss": -2.8910426128574005, "elapsed_sec": 77.0, "timestamp": "2026-04-26T15:11:47", "sharpe": 0.4395, "val_sharpe": 1.3501, "ic": 0.03, "hit": 56.72, "psr": 0.8496, "equity": 1584.8, "return_pct": 58.48, "bh_sharpe": 0.6042, "bh_return_pct": 103.49, "excess_sharpe": -0.1647, "B_sharpe": 0.5282, "B_excess_sharpe": -1.1726, "B_return_pct": 119.23, "D_sharpe": 0.4395, "D_excess_sharpe": -0.1647, "D_return_pct": 58.48, "per_window": [{"fold": "fold_1", "regime": "GFC peak crash (Lehman + Mar-2009 bottom)", "n": 115, "A_sharpe": -0.1016, "A_sortino": -0.1033, "A_excess_sharpe": 0.3425, "A_return_pct": -7.54, "A_hit_rate": 48.7, "A_n": 115, "A_bh_sharpe": -0.4441, "A_bh_return_pct": -14.4, "A_psr": 0.4728, "A_ic": 0.1075, "B_sharpe": 3.228, "B_sortino": 3.3842, "B_excess_sharpe": 3.5259, "B_return_pct": 210.57, "B_hit_rate": 59.65, "B_n": 115, "B_bh_sharpe": -0.2978, "B_bh_return_pct": -27.23, "B_psr": 0.9842, "B_ic": 0.2549, "D_sharpe": -0.1016, "D_sortino": -0.1033, "D_excess_sharpe": 0.3425, "D_return_pct": -7.54, "D_hit_rate": 48.7, "D_n": 115, "D_bh_sharpe": -0.4441, "D_bh_return_pct": -14.4, "D_psr": 0.4728, "D_ic": 0.1075, "sharpe": -0.1016, "sortino": -0.1033, "return_pct": -7.54, "equity": 924.6, "max_dd": 0.0, "win_rate": 48.7, "profit_factor": 0.0, "ic": 0.1075, "hit": 48.7, "psr": 0.4728, "bh_sharpe": -0.4441, "bh_return_pct": -14.4, "excess_sharpe": 0.3425}, {"fold": "fold_2", "regime": "2011 US-downgrade + EU debt", "n": 136, "A_sharpe": 1.1858, "A_sortino": 1.1463, "A_excess_sharpe": -0.5469, "A_return_pct": 12.76, "A_hit_rate": 56.3, "A_n": 136, "A_bh_sharpe": 1.7327, "A_bh_return_pct": 19.75, "A_psr": 0.8065, "A_ic": 0.0161, "B_sharpe": 2.2803, "B_sortino": 2.8951, "B_excess_sharpe": -1.7856, "B_return_pct": 64.71, "B_hit_rate": 50.74, "B_n": 136, "B_bh_sharpe": 4.0659, "B_bh_return_pct": 148.68, "B_psr": 0.9594, "B_ic": 0.2044, "D_sharpe": 1.1858, "D_sortino": 1.1463, "D_excess_sharpe": -0.5469, "D_return_pct": 12.76, "D_hit_rate": 56.3, "D_n": 136, "D_bh_sharpe": 1.7327, "D_bh_return_pct": 19.75, "D_psr": 0.8065, "D_ic": 0.0161, "sharpe": 1.1858, "sortino": 1.1463, "return_pct": 12.76, "equity": 1127.6, "max_dd": 0.0, "win_rate": 56.3, "profit_factor": 0.0, "ic": 0.0161, "hit": 56.3, "psr": 0.8065, "bh_sharpe": 1.7327, "bh_return_pct": 19.75, "excess_sharpe": -0.5469}, {"fold": "fold_3", "regime": "Taper tantrum and 2014 H1", "n": 178, "A_sharpe": 2.7105, "A_sortino": 2.5422, "A_excess_sharpe": 1.366, "A_return_pct": 27.03, "A_hit_rate": 60.45, "A_n": 178, "A_bh_sharpe": 1.3445, "A_bh_return_pct": 12.41, "A_psr": 0.9846, "A_ic": 0.0407, "B_sharpe": -1.3504, "B_sortino": -1.4893, "B_excess_sharpe": -4.3987, "B_return_pct": -24.42, "B_hit_rate": 41.01, "B_n": 178, "B_bh_sharpe": 3.0483, "B_bh_return_pct": 71.83, "B_psr": 0.1345, "B_ic": 0.0346, "D_sharpe": 2.7105, "D_sortino": 2.5422, "D_excess_sharpe": 1.366, "D_return_pct": 27.03, "D_hit_rate": 60.45, "D_n": 178, "D_bh_sharpe": 1.3445, "D_bh_return_pct": 12.41, "D_psr": 0.9846, "D_ic": 0.0407, "sharpe": 2.7105, "sortino": 2.5422, "return_pct": 27.03, "equity": 1270.3, "max_dd": 0.0, "win_rate": 60.45, "profit_factor": 0.0, "ic": 0.0407, "hit": 60.45, "psr": 0.9846, "bh_sharpe": 1.3445, "bh_return_pct": 12.41, "excess_sharpe": 1.366}, {"fold": "fold_4", "regime": "China devaluation and oil crash", "n": 157, "A_sharpe": 0.1143, "A_sortino": 0.1102, "A_excess_sharpe": 0.1045, "A_return_pct": 0.21, "A_hit_rate": 51.28, "A_n": 157, "A_bh_sharpe": 0.0098, "A_bh_return_pct": -1.05, "A_psr": 0.5358, "A_ic": 0.0245, "B_sharpe": -0.3913, "B_sortino": -0.4397, "B_excess_sharpe": -0.4072, "B_return_pct": -15.37, "B_hit_rate": 43.31, "B_n": 157, "B_bh_sharpe": 0.0159, "B_bh_return_pct": -5.48, "B_psr": 0.3797, "B_ic": 0.0477, "D_sharpe": 0.1143, "D_sortino": 0.1102, "D_excess_sharpe": 0.1045, "D_return_pct": 0.21, "D_hit_rate": 51.28, "D_n": 157, "D_bh_sharpe": 0.0098, "D_bh_return_pct": -1.05, "D_psr": 0.5358, "D_ic": 0.0245, "sharpe": 0.1143, "sortino": 0.1102, "return_pct": 0.21, "equity": 1002.1, "max_dd": 0.0, "win_rate": 51.28, "profit_factor": 0.0, "ic": 0.0245, "hit": 51.28, "psr": 0.5358, "bh_sharpe": 0.0098, "bh_return_pct": -1.05, "excess_sharpe": 0.1045}, {"fold": "fold_5", "regime": "2018 Vol-mageddon + Q4 sell-off", "n": 177, "A_sharpe": -0.3751, "A_sortino": -0.3382, "A_excess_sharpe": -0.6849, "A_return_pct": -7.62, "A_hit_rate": 55.37, "A_n": 177, "A_bh_sharpe": 0.3098, "A_bh_return_pct": 3.19, "A_psr": 0.3769, "A_ic": -0.0218, "B_sharpe": -1.1507, "B_sortino": -1.1353, "B_excess_sharpe": -2.0424, "B_return_pct": -36.21, "B_hit_rate": 46.02, "B_n": 177, "B_bh_sharpe": 0.8917, "B_bh_return_pct": 23.8, "B_psr": 0.1685, "B_ic": -0.0437, "D_sharpe": -0.3751, "D_sortino": -0.3382, "D_excess_sharpe": -0.6849, "D_return_pct": -7.62, "D_hit_rate": 55.37, "D_n": 177, "D_bh_sharpe": 0.3098, "D_bh_return_pct": 3.19, "D_psr": 0.3769, "D_ic": -0.0218, "sharpe": -0.3751, "sortino": -0.3382, "return_pct": -7.62, "equity": 923.8, "max_dd": 0.0, "win_rate": 55.37, "profit_factor": 0.0, "ic": -0.0218, "hit": 55.37, "psr": 0.3769, "bh_sharpe": 0.3098, "bh_return_pct": 3.19, "excess_sharpe": -0.6849}, {"fold": "fold_6", "regime": "COVID crash and V-recovery", "n": 222, "A_sharpe": 0.385, "A_sortino": 0.3242, "A_excess_sharpe": -0.5038, "A_return_pct": 6.65, "A_hit_rate": 60.36, "A_n": 222, "A_bh_sharpe": 0.8888, "A_bh_return_pct": 26.13, "A_psr": 0.6395, "A_ic": 0.1108, "B_sharpe": -0.2525, "B_sortino": -0.2697, "B_excess_sharpe": -2.6409, "B_return_pct": -30.85, "B_hit_rate": 46.61, "B_n": 222, "B_bh_sharpe": 2.3884, "B_bh_return_pct": 243.18, "B_psr": 0.4068, "B_ic": -0.0163, "D_sharpe": 0.385, "D_sortino": 0.3242, "D_excess_sharpe": -0.5038, "D_return_pct": 6.65, "D_hit_rate": 60.36, "D_n": 222, "D_bh_sharpe": 0.8888, "D_bh_return_pct": 26.13, "D_psr": 0.6395, "D_ic": 0.1108, "sharpe": 0.385, "sortino": 0.3242, "return_pct": 6.65, "equity": 1066.5, "max_dd": 0.0, "win_rate": 60.36, "profit_factor": 0.0, "ic": 0.1108, "hit": 60.36, "psr": 0.6395, "bh_sharpe": 0.8888, "bh_return_pct": 26.13, "excess_sharpe": -0.5038}, {"fold": "fold_7", "regime": "Inflation bear, AI rally and 2025", "n": 425, "A_sharpe": 0.6338, "A_sortino": 0.5753, "A_excess_sharpe": -0.3377, "A_return_pct": 21.21, "A_hit_rate": 58.12, "A_n": 425, "A_bh_sharpe": 0.9715, "A_bh_return_pct": 37.12, "A_psr": 0.7961, "A_ic": 0.0343, "B_sharpe": 0.7727, "B_sortino": 0.7901, "B_excess_sharpe": -1.73, "B_return_pct": 51.9, "B_hit_rate": 52.12, "B_n": 425, "B_bh_sharpe": 2.5027, "B_bh_return_pct": 458.83, "B_psr": 0.8426, "B_ic": 0.0114, "D_sharpe": 0.6338, "D_sortino": 0.5753, "D_excess_sharpe": -0.3377, "D_return_pct": 21.21, "D_hit_rate": 58.12, "D_n": 425, "D_bh_sharpe": 0.9715, "D_bh_return_pct": 37.12, "D_psr": 0.7961, "D_ic": 0.0343, "sharpe": 0.6338, "sortino": 0.5753, "return_pct": 21.21, "equity": 1212.1, "max_dd": 0.0, "win_rate": 58.12, "profit_factor": 0.0, "ic": 0.0343, "hit": 58.12, "psr": 0.7961, "bh_sharpe": 0.9715, "bh_return_pct": 37.12, "excess_sharpe": -0.3377}], "per_window_val": [{"fold": "fold_1", "regime": "GFC peak crash (Lehman + Mar-2009 bottom)", "n": 104, "A_sharpe": 1.142, "A_sortino": 1.0598, "A_excess_sharpe": 1.3092, "A_return_pct": 12.87, "A_hit_rate": 52.94, "A_n": 104, "A_bh_sharpe": -0.1672, "A_bh_return_pct": -3.81, "A_psr": 0.7592, "A_ic": 0.093, "B_sharpe": -3.1661, "B_sortino": -2.8635, "B_excess_sharpe": -0.892, "B_return_pct": -54.05, "B_hit_rate": 39.81, "B_n": 104, "B_bh_sharpe": -2.2741, "B_bh_return_pct": -44.12, "B_psr": 0.0166, "B_ic": -0.2051, "D_sharpe": 1.142, "D_sortino": 1.0598, "D_excess_sharpe": 1.3092, "D_return_pct": 12.87, "D_hit_rate": 52.94, "D_n": 104, "D_bh_sharpe": -0.1672, "D_bh_return_pct": -3.81, "D_psr": 0.7592, "D_ic": 0.093, "sharpe": 1.142, "sortino": 1.0598, "return_pct": 12.87, "equity": 1128.7, "max_dd": 0.0, "win_rate": 52.94, "profit_factor": 0.0, "ic": 0.093, "hit": 52.94, "psr": 0.7592, "bh_sharpe": -0.1672, "bh_return_pct": -3.81, "excess_sharpe": 1.3092}, {"fold": "fold_2", "regime": "2011 US-downgrade + EU debt", "n": 96, "A_sharpe": 0.693, "A_sortino": 0.639, "A_excess_sharpe": 0.9671, "A_return_pct": 5.86, "A_hit_rate": 53.68, "A_n": 96, "A_bh_sharpe": -0.2741, "A_bh_return_pct": -4.09, "A_psr": 0.6625, "A_ic": 0.1765, "B_sharpe": -1.9023, "B_sortino": -1.713, "B_excess_sharpe": -0.8749, "B_return_pct": -38.61, "B_hit_rate": 48.96, "B_n": 96, "B_bh_sharpe": -1.0274, "B_bh_return_pct": -25.58, "B_psr": 0.1174, "B_ic": -0.0751, "D_sharpe": 0.693, "D_sortino": 0.639, "D_excess_sharpe": 0.9671, "D_return_pct": 5.86, "D_hit_rate": 53.68, "D_n": 96, "D_bh_sharpe": -0.2741, "D_bh_return_pct": -4.09, "D_psr": 0.6625, "D_ic": 0.1765, "sharpe": 0.693, "sortino": 0.639, "return_pct": 5.86, "equity": 1058.6, "max_dd": 0.0, "win_rate": 53.68, "profit_factor": 0.0, "ic": 0.1765, "hit": 53.68, "psr": 0.6625, "bh_sharpe": -0.2741, "bh_return_pct": -4.09, "excess_sharpe": 0.9671}, {"fold": "fold_3", "regime": "Taper tantrum and 2014 H1", "n": 54, "A_sharpe": 4.6998, "A_sortino": 4.9879, "A_excess_sharpe": 0.0, "A_return_pct": 10.46, "A_hit_rate": 61.11, "A_n": 54, "A_bh_sharpe": 4.6998, "A_bh_return_pct": 10.46, "A_psr": 0.9779, "A_ic": 0.0438, "B_sharpe": 2.4802, "B_sortino": 2.6084, "B_excess_sharpe": -6.5524, "B_return_pct": 12.81, "B_hit_rate": 55.56, "B_n": 54, "B_bh_sharpe": 9.0326, "B_bh_return_pct": 49.18, "B_psr": 0.8694, "B_ic": 0.1504, "D_sharpe": 4.6998, "D_sortino": 4.9879, "D_excess_sharpe": 0.0, "D_return_pct": 10.46, "D_hit_rate": 61.11, "D_n": 54, "D_bh_sharpe": 4.6998, "D_bh_return_pct": 10.46, "D_psr": 0.9779, "D_ic": 0.0438, "sharpe": 4.6998, "sortino": 4.9879, "return_pct": 10.46, "equity": 1104.6000000000001, "max_dd": 0.0, "win_rate": 61.11, "profit_factor": 0.0, "ic": 0.0438, "hit": 61.11, "psr": 0.9779, "bh_sharpe": 4.6998, "bh_return_pct": 10.46, "excess_sharpe": 0.0}, {"fold": "fold_4", "regime": "China devaluation and oil crash", "n": 96, "A_sharpe": -0.4241, "A_sortino": -0.4139, "A_excess_sharpe": 0.0, "A_return_pct": -3.73, "A_hit_rate": 47.37, "A_n": 96, "A_bh_sharpe": -0.4241, "A_bh_return_pct": -3.73, "A_psr": 0.3971, "A_ic": 0.0189, "B_sharpe": 3.5597, "B_sortino": 4.7212, "B_excess_sharpe": 4.744, "B_return_pct": 74.38, "B_hit_rate": 60.42, "B_n": 96, "B_bh_sharpe": -1.1843, "B_bh_return_pct": -21.44, "B_psr": 0.9947, "B_ic": 0.2128, "D_sharpe": -0.4241, "D_sortino": -0.4139, "D_excess_sharpe": 0.0, "D_return_pct": -3.73, "D_hit_rate": 47.37, "D_n": 96, "D_bh_sharpe": -0.4241, "D_bh_return_pct": -3.73, "D_psr": 0.3971, "D_ic": 0.0189, "sharpe": -0.4241, "sortino": -0.4139, "return_pct": -3.73, "equity": 962.7, "max_dd": 0.0, "win_rate": 47.37, "profit_factor": 0.0, "ic": 0.0189, "hit": 47.37, "psr": 0.3971, "bh_sharpe": -0.4241, "bh_return_pct": -3.73, "excess_sharpe": 0.0}, {"fold": "fold_5", "regime": "2018 Vol-mageddon + Q4 sell-off", "n": 54, "A_sharpe": 0.3827, "A_sortino": 0.3507, "A_excess_sharpe": -1.0453, "A_return_pct": 0.91, "A_hit_rate": 53.7, "A_n": 54, "A_bh_sharpe": 1.428, "A_bh_return_pct": 3.97, "A_psr": 0.5693, "A_ic": 0.0472, "B_sharpe": 0.8753, "B_sortino": 0.9124, "B_excess_sharpe": -4.0568, "B_return_pct": 4.85, "B_hit_rate": 51.85, "B_n": 54, "B_bh_sharpe": 4.9322, "B_bh_return_pct": 34.93, "B_psr": 0.6565, "B_ic": 0.1538, "D_sharpe": 0.3827, "D_sortino": 0.3507, "D_excess_sharpe": -1.0453, "D_return_pct": 0.91, "D_hit_rate": 53.7, "D_n": 54, "D_bh_sharpe": 1.428, "D_bh_return_pct": 3.97, "D_psr": 0.5693, "D_ic": 0.0472, "sharpe": 0.3827, "sortino": 0.3507, "return_pct": 0.91, "equity": 1009.1000000000001, "max_dd": 0.0, "win_rate": 53.7, "profit_factor": 0.0, "ic": 0.0472, "hit": 53.7, "psr": 0.5693, "bh_sharpe": 1.428, "bh_return_pct": 3.97, "excess_sharpe": -1.0453}, {"fold": "fold_6", "regime": "COVID crash and V-recovery", "n": 75, "A_sharpe": 5.6425, "A_sortino": 6.9339, "A_excess_sharpe": 1.343, "A_return_pct": 19.24, "A_hit_rate": 64.0, "A_n": 75, "A_bh_sharpe": 4.2994, "A_bh_return_pct": 14.68, "A_psr": 0.9994, "A_ic": 0.1397, "B_sharpe": -4.8034, "B_sortino": -4.2267, "B_excess_sharpe": -19.1373, "B_return_pct": -29.85, "B_hit_rate": 40.0, "B_n": 75, "B_bh_sharpe": 14.3339, "B_bh_return_pct": 120.13, "B_psr": 0.0053, "B_ic": -0.0706, "D_sharpe": 5.6425, "D_sortino": 6.9339, "D_excess_sharpe": 1.343, "D_return_pct": 19.24, "D_hit_rate": 64.0, "D_n": 75, "D_bh_sharpe": 4.2994, "D_bh_return_pct": 14.68, "D_psr": 0.9994, "D_ic": 0.1397, "sharpe": 5.6425, "sortino": 6.9339, "return_pct": 19.24, "equity": 1192.3999999999999, "max_dd": 0.0, "win_rate": 64.0, "profit_factor": 0.0, "ic": 0.1397, "hit": 64.0, "psr": 0.9994, "bh_sharpe": 4.2994, "bh_return_pct": 14.68, "excess_sharpe": 1.343}, {"fold": "fold_7", "regime": "Inflation bear, AI rally and 2025", "n": 114, "A_sharpe": 2.5659, "A_sortino": 2.7427, "A_excess_sharpe": -0.2792, "A_return_pct": 19.06, "A_hit_rate": 57.02, "A_n": 114, "A_bh_sharpe": 2.845, "A_bh_return_pct": 21.34, "A_psr": 0.9575, "A_ic": 0.0522, "B_sharpe": 0.7551, "B_sortino": 0.8752, "B_excess_sharpe": -5.3815, "B_return_pct": 10.1, "B_hit_rate": 48.25, "B_n": 114, "B_bh_sharpe": 6.1366, "B_bh_return_pct": 155.03, "B_psr": 0.6957, "B_ic": 0.0685, "D_sharpe": 2.5659, "D_sortino": 2.7427, "D_excess_sharpe": -0.2792, "D_return_pct": 19.06, "D_hit_rate": 57.02, "D_n": 114, "D_bh_sharpe": 2.845, "D_bh_return_pct": 21.34, "D_psr": 0.9575, "D_ic": 0.0522, "sharpe": 2.5659, "sortino": 2.7427, "return_pct": 19.06, "equity": 1190.6, "max_dd": 0.0, "win_rate": 57.02, "profit_factor": 0.0, "ic": 0.0522, "hit": 57.02, "psr": 0.9575, "bh_sharpe": 2.845, "bh_return_pct": 21.34, "excess_sharpe": -0.2792}], "status": "DISCARD", "test_sharpe": 0.4395, "A_sharpe": 0.4395, "A_excess_sharpe": -0.1647, "A_return_pct": 58.48, "A_psr": 0.8496, "A_ic": 0.03, "A_hit_rate": 56.72, "A_bh_sharpe": 0.6042, "A_bh_return_pct": 103.49}
