{"experiment_num": 30, "backbone": "mlp", "description": "MLP @ FX-Exp32 bs=16 (down from 32) - small-batch flat-minima per Keskar 2017 ICLR; last MLP HP axis before LSTM pivot", "config": {"seq_len": 10, "lr": 0.0003, "batch_size": 16, "epochs": 50, "weight_decay": 1e-05, "patience": 10, "warmup_epochs": 0, "head_dropout": 0.25, "huber_delta": 1.0, "grad_clip": 1.0, "seed": 0, "hidden_size": null, "num_layers": null, "max_depth": null, "gbm_lr": null, "n_estimators": null}, "composite": -1.5094, "test_pos_folds": 1, "val_pos_folds": 0, "val_loss": -2.8978882583759686, "elapsed_sec": 45.9, "timestamp": "2026-04-27T18:23:50", "sharpe": -0.5149, "val_sharpe": -0.9094, "ic": -0.0196, "hit": 43.43, "psr": 0.1136, "equity": 372.4000000000001, "return_pct": -62.76, "bh_sharpe": 0.6042, "bh_return_pct": 103.49, "excess_sharpe": -1.1191, "B_sharpe": -0.1703, "B_excess_sharpe": -1.8711, "B_return_pct": -72.99, "D_sharpe": -0.5149, "D_excess_sharpe": -1.1191, "D_return_pct": -62.76, "per_window": [{"fold": "fold_1", "regime": "GFC peak crash (Lehman + Mar-2009 bottom)", "n": 115, "A_sharpe": -0.078, "A_sortino": -0.076, "A_excess_sharpe": 0.3661, "A_return_pct": -7.06, "A_hit_rate": 52.17, "A_n": 115, "A_bh_sharpe": -0.4441, "A_bh_return_pct": -14.4, "A_psr": 0.4791, "A_ic": 0.0276, "B_sharpe": 1.3838, "B_sortino": 1.3489, "B_excess_sharpe": 1.6816, "B_return_pct": 46.9, "B_hit_rate": 57.02, "B_n": 115, "B_bh_sharpe": -0.2978, "B_bh_return_pct": -27.23, "B_psr": 0.8225, "B_ic": 0.1539, "D_sharpe": -0.078, "D_sortino": -0.076, "D_excess_sharpe": 0.3661, "D_return_pct": -7.06, "D_hit_rate": 52.17, "D_n": 115, "D_bh_sharpe": -0.4441, "D_bh_return_pct": -14.4, "D_psr": 0.4791, "D_ic": 0.0276, "sharpe": -0.078, "sortino": -0.076, "return_pct": -7.06, "equity": 929.4, "max_dd": 0.0, "win_rate": 52.17, "profit_factor": 0.0, "ic": 0.0276, "hit": 52.17, "psr": 0.4791, "bh_sharpe": -0.4441, "bh_return_pct": -14.4, "excess_sharpe": 0.3661, "precision": 0.4545, "recall": 0.0926, "f1": 0.1538, "f2": 0.1101, "accuracy": 0.5217, "mcc": -0.0098, "tp": 5, "fp": 6, "tn": 55, "fn": 49, "A_precision": 0.4545, "A_recall": 0.0926, "A_f1": 0.1538, "A_f2": 0.1101, "A_accuracy": 0.5217, "A_mcc": -0.0098, "A_tp": 5, "A_fp": 6, "A_tn": 55, "A_fn": 49}, {"fold": "fold_2", "regime": "2011 US-downgrade + EU debt", "n": 136, "A_sharpe": -1.3335, "A_sortino": -1.3327, "A_excess_sharpe": -3.0662, "A_return_pct": -14.73, "A_hit_rate": 44.44, "A_n": 136, "A_bh_sharpe": 1.7327, "A_bh_return_pct": 19.75, "A_psr": 0.1657, "A_ic": -0.0331, "B_sharpe": 4.1246, "B_sortino": 3.8147, "B_excess_sharpe": 0.0586, "B_return_pct": 151.97, "B_hit_rate": 68.38, "B_n": 136, "B_bh_sharpe": 4.0659, "B_bh_return_pct": 148.68, "B_psr": 0.9983, "B_ic": 0.0639, "D_sharpe": -1.3335, "D_sortino": -1.3327, "D_excess_sharpe": -3.0662, "D_return_pct": -14.73, "D_hit_rate": 44.44, "D_n": 136, "D_bh_sharpe": 1.7327, "D_bh_return_pct": 19.75, "D_psr": 0.1657, "D_ic": -0.0331, "sharpe": -1.3335, "sortino": -1.3327, "return_pct": -14.73, "equity": 852.7, "max_dd": 0.0, "win_rate": 44.44, "profit_factor": 0.0, "ic": -0.0331, "hit": 44.44, "psr": 0.1657, "bh_sharpe": 1.7327, "bh_return_pct": 19.75, "excess_sharpe": -3.0662, "precision": 0.5333, "recall": 0.3077, "f1": 0.3902, "f2": 0.3361, "accuracy": 0.4485, "mcc": -0.0572, "tp": 24, "fp": 21, "tn": 37, "fn": 54, "A_precision": 0.5333, "A_recall": 0.3077, "A_f1": 0.3902, "A_f2": 0.3361, "A_accuracy": 0.4485, "A_mcc": -0.0572, "A_tp": 24, "A_fp": 21, "A_tn": 37, "A_fn": 54}, {"fold": "fold_3", "regime": "Taper tantrum and 2014 H1", "n": 178, "A_sharpe": -0.6284, "A_sortino": -0.7114, "A_excess_sharpe": -1.973, "A_return_pct": -6.16, "A_hit_rate": 43.5, "A_n": 178, "A_bh_sharpe": 1.3445, "A_bh_return_pct": 12.41, "A_psr": 0.3019, "A_ic": 0.197, "B_sharpe": 1.3341, "B_sortino": 1.4782, "B_excess_sharpe": -1.7142, "B_return_pct": 25.4, "B_hit_rate": 49.44, "B_n": 178, "B_bh_sharpe": 3.0483, "B_bh_return_pct": 71.83, "B_psr": 0.8695, "B_ic": 0.116, "D_sharpe": -0.6284, "D_sortino": -0.7114, "D_excess_sharpe": -1.973, "D_return_pct": -6.16, "D_hit_rate": 43.5, "D_n": 178, "D_bh_sharpe": 1.3445, "D_bh_return_pct": 12.41, "D_psr": 0.3019, "D_ic": 0.197, "sharpe": -0.6284, "sortino": -0.7114, "return_pct": -6.16, "equity": 938.4, "max_dd": 0.0, "win_rate": 43.5, "profit_factor": 0.0, "ic": 0.197, "hit": 43.5, "psr": 0.3019, "bh_sharpe": 1.3445, "bh_return_pct": 12.41, "excess_sharpe": -1.973, "precision": 0.6, "recall": 0.0874, "f1": 0.1525, "f2": 0.1054, "accuracy": 0.4382, "mcc": 0.0131, "tp": 9, "fp": 6, "tn": 69, "fn": 94, "A_precision": 0.6, "A_recall": 0.0874, "A_f1": 0.1525, "A_f2": 0.1054, "A_accuracy": 0.4382, "A_mcc": 0.0131, "A_tp": 9, "A_fp": 6, "A_tn": 69, "A_fn": 94}, {"fold": "fold_4", "regime": "China devaluation and oil crash", "n": 157, "A_sharpe": -1.3349, "A_sortino": -1.3519, "A_excess_sharpe": -1.3447, "A_return_pct": -15.85, "A_hit_rate": 44.23, "A_n": 157, "A_bh_sharpe": 0.0098, "A_bh_return_pct": -1.05, "A_psr": 0.1489, "A_ic": -0.06, "B_sharpe": -1.1258, "B_sortino": -1.1724, "B_excess_sharpe": -1.1417, "B_return_pct": -30.76, "B_hit_rate": 44.59, "B_n": 157, "B_bh_sharpe": 0.0159, "B_bh_return_pct": -5.48, "B_psr": 0.1905, "B_ic": 0.0081, "D_sharpe": -1.3349, "D_sortino": -1.3519, "D_excess_sharpe": -1.3447, "D_return_pct": -15.85, "D_hit_rate": 44.23, "D_n": 157, "D_bh_sharpe": 0.0098, "D_bh_return_pct": -1.05, "D_psr": 0.1489, "D_ic": -0.06, "sharpe": -1.3349, "sortino": -1.3519, "return_pct": -15.85, "equity": 841.5, "max_dd": 0.0, "win_rate": 44.23, "profit_factor": 0.0, "ic": -0.06, "hit": 44.23, "psr": 0.1489, "bh_sharpe": 0.0098, "bh_return_pct": -1.05, "excess_sharpe": -1.3447, "precision": 0.4062, "recall": 0.1605, "f1": 0.2301, "f2": 0.1826, "accuracy": 0.4459, "mcc": -0.111, "tp": 13, "fp": 19, "tn": 57, "fn": 68, "A_precision": 0.4062, "A_recall": 0.1605, "A_f1": 0.2301, "A_f2": 0.1826, "A_accuracy": 0.4459, "A_mcc": -0.111, "A_tp": 13, "A_fp": 19, "A_tn": 57, "A_fn": 68}, {"fold": "fold_5", "regime": "2018 Vol-mageddon + Q4 sell-off", "n": 177, "A_sharpe": -0.5827, "A_sortino": -0.6564, "A_excess_sharpe": -0.8925, "A_return_pct": -10.66, "A_hit_rate": 42.37, "A_n": 177, "A_bh_sharpe": 0.3098, "A_bh_return_pct": 3.19, "A_psr": 0.315, "A_ic": -0.0863, "B_sharpe": -1.6938, "B_sortino": -1.6505, "B_excess_sharpe": -2.5855, "B_return_pct": -46.44, "B_hit_rate": 43.75, "B_n": 177, "B_bh_sharpe": 0.8917, "B_bh_return_pct": 23.8, "B_psr": 0.0783, "B_ic": -0.1633, "D_sharpe": -0.5827, "D_sortino": -0.6564, "D_excess_sharpe": -0.8925, "D_return_pct": -10.66, "D_hit_rate": 42.37, "D_n": 177, "D_bh_sharpe": 0.3098, "D_bh_return_pct": 3.19, "D_psr": 0.315, "D_ic": -0.0863, "sharpe": -0.5827, "sortino": -0.6564, "return_pct": -10.66, "equity": 893.4, "max_dd": 0.0, "win_rate": 42.37, "profit_factor": 0.0, "ic": -0.0863, "hit": 42.37, "psr": 0.315, "bh_sharpe": 0.3098, "bh_return_pct": 3.19, "excess_sharpe": -0.8925, "precision": 0.5217, "recall": 0.1165, "f1": 0.1905, "f2": 0.1379, "accuracy": 0.4237, "mcc": -0.0472, "tp": 12, "fp": 11, "tn": 63, "fn": 91, "A_precision": 0.5217, "A_recall": 0.1165, "A_f1": 0.1905, "A_f2": 0.1379, "A_accuracy": 0.4237, "A_mcc": -0.0472, "A_tp": 12, "A_fp": 11, "A_tn": 63, "A_fn": 91}, {"fold": "fold_6", "regime": "COVID crash and V-recovery", "n": 222, "A_sharpe": 0.324, "A_sortino": 0.3805, "A_excess_sharpe": -0.5648, "A_return_pct": 4.61, "A_hit_rate": 42.34, "A_n": 222, "A_bh_sharpe": 0.8888, "A_bh_return_pct": 26.13, "A_psr": 0.6194, "A_ic": 0.0467, "B_sharpe": -0.8252, "B_sortino": -0.7996, "B_excess_sharpe": -3.2137, "B_return_pct": -51.45, "B_hit_rate": 49.77, "B_n": 222, "B_bh_sharpe": 2.3884, "B_bh_return_pct": 243.18, "B_psr": 0.2208, "B_ic": -0.0264, "D_sharpe": 0.324, "D_sortino": 0.3805, "D_excess_sharpe": -0.5648, "D_return_pct": 4.61, "D_hit_rate": 42.34, "D_n": 222, "D_bh_sharpe": 0.8888, "D_bh_return_pct": 26.13, "D_psr": 0.6194, "D_ic": 0.0467, "sharpe": 0.324, "sortino": 0.3805, "return_pct": 4.61, "equity": 1046.1000000000001, "max_dd": 0.0, "win_rate": 42.34, "profit_factor": 0.0, "ic": 0.0467, "hit": 42.34, "psr": 0.6194, "bh_sharpe": 0.8888, "bh_return_pct": 26.13, "excess_sharpe": -0.5648, "precision": 0.7273, "recall": 0.1159, "f1": 0.2, "f2": 0.1394, "accuracy": 0.4234, "mcc": 0.0723, "tp": 16, "fp": 6, "tn": 78, "fn": 122, "A_precision": 0.7273, "A_recall": 0.1159, "A_f1": 0.2, "A_f2": 0.1394, "A_accuracy": 0.4234, "A_mcc": 0.0723, "A_tp": 16, "A_fp": 6, "A_tn": 78, "A_fn": 122}, {"fold": "fold_7", "regime": "Inflation bear, AI rally and 2025", "n": 425, "A_sharpe": -1.1272, "A_sortino": -1.2736, "A_excess_sharpe": -2.0986, "A_return_pct": -36.32, "A_hit_rate": 41.41, "A_n": 425, "A_bh_sharpe": 0.9715, "A_bh_return_pct": 37.12, "A_psr": 0.0831, "A_ic": -0.0738, "B_sharpe": -1.2471, "B_sortino": -1.1422, "B_excess_sharpe": -3.7497, "B_return_pct": -67.68, "B_hit_rate": 49.53, "B_n": 425, "B_bh_sharpe": 2.5027, "B_bh_return_pct": 458.83, "B_psr": 0.0509, "B_ic": -0.1563, "D_sharpe": -1.1272, "D_sortino": -1.2736, "D_excess_sharpe": -2.0986, "D_return_pct": -36.32, "D_hit_rate": 41.41, "D_n": 425, "D_bh_sharpe": 0.9715, "D_bh_return_pct": 37.12, "D_psr": 0.0831, "D_ic": -0.0738, "sharpe": -1.1272, "sortino": -1.2736, "return_pct": -36.32, "equity": 636.8000000000001, "max_dd": 0.0, "win_rate": 41.41, "profit_factor": 0.0, "ic": -0.0738, "hit": 41.41, "psr": 0.0831, "bh_sharpe": 0.9715, "bh_return_pct": 37.12, "excess_sharpe": -2.0986, "precision": 0.5062, "recall": 0.164, "f1": 0.2477, "f2": 0.1896, "accuracy": 0.4141, "mcc": -0.0809, "tp": 41, "fp": 40, "tn": 135, "fn": 209, "A_precision": 0.5062, "A_recall": 0.164, "A_f1": 0.2477, "A_f2": 0.1896, "A_accuracy": 0.4141, "A_mcc": -0.0809, "A_tp": 41, "A_fp": 40, "A_tn": 135, "A_fn": 209}], "per_window_val": [{"fold": "fold_1", "regime": "GFC peak crash (Lehman + Mar-2009 bottom)", "n": 104, "A_sharpe": -0.1994, "A_sortino": -0.2173, "A_excess_sharpe": -0.0322, "A_return_pct": -4.15, "A_hit_rate": 47.06, "A_n": 104, "A_bh_sharpe": -0.1672, "A_bh_return_pct": -3.81, "A_psr": 0.4495, "A_ic": -0.0645, "B_sharpe": -3.0713, "B_sortino": -2.6652, "B_excess_sharpe": -0.7972, "B_return_pct": -53.09, "B_hit_rate": 44.66, "B_n": 104, "B_bh_sharpe": -2.2741, "B_bh_return_pct": -44.12, "B_psr": 0.0195, "B_ic": 0.0068, "D_sharpe": -0.1994, "D_sortino": -0.2173, "D_excess_sharpe": -0.0322, "D_return_pct": -4.15, "D_hit_rate": 47.06, "D_n": 104, "D_bh_sharpe": -0.1672, "D_bh_return_pct": -3.81, "D_psr": 0.4495, "D_ic": -0.0645, "sharpe": -0.1994, "sortino": -0.2173, "return_pct": -4.15, "equity": 958.5, "max_dd": 0.0, "win_rate": 47.06, "profit_factor": 0.0, "ic": -0.0645, "hit": 47.06, "psr": 0.4495, "bh_sharpe": -0.1672, "bh_return_pct": -3.81, "excess_sharpe": -0.0322}, {"fold": "fold_2", "regime": "2011 US-downgrade + EU debt", "n": 96, "A_sharpe": -0.2082, "A_sortino": -0.2163, "A_excess_sharpe": 0.066, "A_return_pct": -3.43, "A_hit_rate": 47.37, "A_n": 96, "A_bh_sharpe": -0.2741, "A_bh_return_pct": -4.09, "A_psr": 0.4492, "A_ic": -0.0615, "B_sharpe": 3.5948, "B_sortino": 3.8382, "B_excess_sharpe": 4.6223, "B_return_pct": 104.96, "B_hit_rate": 59.38, "B_n": 96, "B_bh_sharpe": -1.0274, "B_bh_return_pct": -25.58, "B_psr": 0.9854, "B_ic": 0.2662, "D_sharpe": -0.2082, "D_sortino": -0.2163, "D_excess_sharpe": 0.066, "D_return_pct": -3.43, "D_hit_rate": 47.37, "D_n": 96, "D_bh_sharpe": -0.2741, "D_bh_return_pct": -4.09, "D_psr": 0.4492, "D_ic": -0.0615, "sharpe": -0.2082, "sortino": -0.2163, "return_pct": -3.43, "equity": 965.7, "max_dd": 0.0, "win_rate": 47.37, "profit_factor": 0.0, "ic": -0.0615, "hit": 47.37, "psr": 0.4492, "bh_sharpe": -0.2741, "bh_return_pct": -4.09, "excess_sharpe": 0.066}, {"fold": "fold_3", "regime": "Taper tantrum and 2014 H1", "n": 54, "A_sharpe": -4.9987, "A_sortino": -4.5671, "A_excess_sharpe": -9.6985, "A_return_pct": -10.21, "A_hit_rate": 37.04, "A_n": 54, "A_bh_sharpe": 4.6998, "A_bh_return_pct": 10.46, "A_psr": 0.0173, "A_ic": 0.0051, "B_sharpe": 2.9122, "B_sortino": 3.1518, "B_excess_sharpe": -6.1204, "B_return_pct": 15.25, "B_hit_rate": 55.56, "B_n": 54, "B_bh_sharpe": 9.0326, "B_bh_return_pct": 49.18, "B_psr": 0.906, "B_ic": 0.0314, "D_sharpe": -4.9987, "D_sortino": -4.5671, "D_excess_sharpe": -9.6985, "D_return_pct": -10.21, "D_hit_rate": 37.04, "D_n": 54, "D_bh_sharpe": 4.6998, "D_bh_return_pct": 10.46, "D_psr": 0.0173, "D_ic": 0.0051, "sharpe": -4.9987, "sortino": -4.5671, "return_pct": -10.21, "equity": 897.9, "max_dd": 0.0, "win_rate": 37.04, "profit_factor": 0.0, "ic": 0.0051, "hit": 37.04, "psr": 0.0173, "bh_sharpe": 4.6998, "bh_return_pct": 10.46, "excess_sharpe": -9.6985}, {"fold": "fold_4", "regime": "China devaluation and oil crash", "n": 96, "A_sharpe": -0.6199, "A_sortino": -0.5986, "A_excess_sharpe": -0.1958, "A_return_pct": -5.09, "A_hit_rate": 49.47, "A_n": 96, "A_bh_sharpe": -0.4241, "A_bh_return_pct": -3.73, "A_psr": 0.3519, "A_ic": -0.0122, "B_sharpe": 3.2983, "B_sortino": 4.9857, "B_excess_sharpe": 4.4826, "B_return_pct": 67.27, "B_hit_rate": 55.21, "B_n": 96, "B_bh_sharpe": -1.1843, "B_bh_return_pct": -21.44, "B_psr": 0.9918, "B_ic": 0.0675, "D_sharpe": -0.6199, "D_sortino": -0.5986, "D_excess_sharpe": -0.1958, "D_return_pct": -5.09, "D_hit_rate": 49.47, "D_n": 96, "D_bh_sharpe": -0.4241, "D_bh_return_pct": -3.73, "D_psr": 0.3519, "D_ic": -0.0122, "sharpe": -0.6199, "sortino": -0.5986, "return_pct": -5.09, "equity": 949.1, "max_dd": 0.0, "win_rate": 49.47, "profit_factor": 0.0, "ic": -0.0122, "hit": 49.47, "psr": 0.3519, "bh_sharpe": -0.4241, "bh_return_pct": -3.73, "excess_sharpe": -0.1958}, {"fold": "fold_5", "regime": "2018 Vol-mageddon + Q4 sell-off", "n": 54, "A_sharpe": -0.4471, "A_sortino": -0.4536, "A_excess_sharpe": -1.8751, "A_return_pct": -1.47, "A_hit_rate": 50.0, "A_n": 54, "A_bh_sharpe": 1.428, "A_bh_return_pct": 3.97, "A_psr": 0.4191, "A_ic": -0.1055, "B_sharpe": -5.2445, "B_sortino": -4.5081, "B_excess_sharpe": -10.1766, "B_return_pct": -28.65, "B_hit_rate": 38.89, "B_n": 54, "B_bh_sharpe": 4.9322, "B_bh_return_pct": 34.93, "B_psr": 0.0085, "B_ic": -0.335, "D_sharpe": -0.4471, "D_sortino": -0.4536, "D_excess_sharpe": -1.8751, "D_return_pct": -1.47, "D_hit_rate": 50.0, "D_n": 54, "D_bh_sharpe": 1.428, "D_bh_return_pct": 3.97, "D_psr": 0.4191, "D_ic": -0.1055, "sharpe": -0.4471, "sortino": -0.4536, "return_pct": -1.47, "equity": 985.3, "max_dd": 0.0, "win_rate": 50.0, "profit_factor": 0.0, "ic": -0.1055, "hit": 50.0, "psr": 0.4191, "bh_sharpe": 1.428, "bh_return_pct": 3.97, "excess_sharpe": -1.8751}, {"fold": "fold_6", "regime": "COVID crash and V-recovery", "n": 75, "A_sharpe": -4.1727, "A_sortino": -4.159, "A_excess_sharpe": -8.4722, "A_return_pct": -12.79, "A_hit_rate": 33.33, "A_n": 75, "A_bh_sharpe": 4.2994, "A_bh_return_pct": 14.68, "A_psr": 0.0178, "A_ic": -0.0045, "B_sharpe": 4.5436, "B_sortino": 4.0714, "B_excess_sharpe": -9.7904, "B_return_pct": 37.49, "B_hit_rate": 68.0, "B_n": 75, "B_bh_sharpe": 14.3339, "B_bh_return_pct": 120.13, "B_psr": 0.9893, "B_ic": -0.0268, "D_sharpe": -4.1727, "D_sortino": -4.159, "D_excess_sharpe": -8.4722, "D_return_pct": -12.79, "D_hit_rate": 33.33, "D_n": 75, "D_bh_sharpe": 4.2994, "D_bh_return_pct": 14.68, "D_psr": 0.0178, "D_ic": -0.0045, "sharpe": -4.1727, "sortino": -4.159, "return_pct": -12.79, "equity": 872.1, "max_dd": 0.0, "win_rate": 33.33, "profit_factor": 0.0, "ic": -0.0045, "hit": 33.33, "psr": 0.0178, "bh_sharpe": 4.2994, "bh_return_pct": 14.68, "excess_sharpe": -8.4722}, {"fold": "fold_7", "regime": "Inflation bear, AI rally and 2025", "n": 114, "A_sharpe": -1.3064, "A_sortino": -1.1897, "A_excess_sharpe": -4.1514, "A_return_pct": -9.35, "A_hit_rate": 50.0, "A_n": 114, "A_bh_sharpe": 2.845, "A_bh_return_pct": 21.34, "A_psr": 0.1884, "A_ic": 0.0464, "B_sharpe": 3.8603, "B_sortino": 4.1202, "B_excess_sharpe": -2.2764, "B_return_pct": 82.71, "B_hit_rate": 64.04, "B_n": 114, "B_bh_sharpe": 6.1366, "B_bh_return_pct": 155.03, "B_psr": 0.9959, "B_ic": -0.1851, "D_sharpe": -1.3064, "D_sortino": -1.1897, "D_excess_sharpe": -4.1514, "D_return_pct": -9.35, "D_hit_rate": 50.0, "D_n": 114, "D_bh_sharpe": 2.845, "D_bh_return_pct": 21.34, "D_psr": 0.1884, "D_ic": 0.0464, "sharpe": -1.3064, "sortino": -1.1897, "return_pct": -9.35, "equity": 906.5, "max_dd": 0.0, "win_rate": 50.0, "profit_factor": 0.0, "ic": 0.0464, "hit": 50.0, "psr": 0.1884, "bh_sharpe": 2.845, "bh_return_pct": 21.34, "excess_sharpe": -4.1514}], "status": "DISCARD", "precision": 0.524, "recall": 0.1487, "f1": 0.2317, "f2": 0.1736, "accuracy": 0.4355, "mcc": -0.043, "tp": 120, "fp": 109, "tn": 494, "fn": 687, "test_sharpe": -0.5149, "A_sharpe": -0.5149, "A_excess_sharpe": -1.1191, "A_return_pct": -62.76, "A_precision": 0.524, "A_recall": 0.1487, "A_f1": 0.2317, "A_f2": 0.1736, "A_accuracy": 0.4355, "A_mcc": -0.043, "A_tp": 120, "A_fp": 109, "A_tn": 494, "A_fn": 687, "A_psr": 0.1136, "A_ic": -0.0196, "A_hit_rate": 43.43, "A_bh_sharpe": 0.6042, "A_bh_return_pct": 103.49}
