{"experiment_num": 4, "backbone": "mlp", "description": "mlp seq=20 + stronger reg head_dropout=0.25 wd=1e-4 patience=15 (Gu-Kelly-Xiu 2020); hill-climb on exp3 \u2014 longer seq + more reg", "config": {"seq_len": 20, "lr": 0.0003, "batch_size": 32, "epochs": 80, "weight_decay": 0.0001, "patience": 15, "warmup_epochs": 0, "head_dropout": 0.25, "huber_delta": 1.0, "grad_clip": 1.0, "seed": 42, "hidden_size": null, "num_layers": null, "max_depth": null, "gbm_lr": null, "n_estimators": null}, "composite": -0.8341, "test_pos_folds": 3, "val_pos_folds": 6, "val_loss": -2.9023829649763497, "elapsed_sec": 32.6, "timestamp": "2026-04-26T14:32:25", "sharpe": -0.4341, "val_sharpe": 1.203, "ic": -0.0036, "hit": 49.07, "psr": 0.1579, "equity": 452.2999999999999, "return_pct": -54.77, "bh_sharpe": 0.8422, "bh_return_pct": 169.94, "excess_sharpe": -1.2763, "B_sharpe": -0.4682, "B_excess_sharpe": -2.6925, "B_return_pct": -86.49, "D_sharpe": -0.4341, "D_excess_sharpe": -1.2763, "D_return_pct": -54.77, "per_window": [{"fold": "fold_1", "regime": "GFC peak crash (Lehman + Mar-2009 bottom)", "n": 105, "A_sharpe": -0.2879, "A_sortino": -0.2757, "A_excess_sharpe": -0.0369, "A_return_pct": -9.03, "A_hit_rate": 49.52, "A_n": 105, "A_bh_sharpe": -0.251, "A_bh_return_pct": -8.39, "A_psr": 0.4265, "A_ic": -0.0066, "B_sharpe": 3.6989, "B_sortino": 4.2375, "B_excess_sharpe": 4.0704, "B_return_pct": 213.27, "B_hit_rate": 58.65, "B_n": 105, "B_bh_sharpe": -0.3715, "B_bh_return_pct": -25.13, "B_psr": 0.9926, "B_ic": 0.1525, "D_sharpe": -0.2879, "D_sortino": -0.2757, "D_excess_sharpe": -0.0369, "D_return_pct": -9.03, "D_hit_rate": 49.52, "D_n": 105, "D_bh_sharpe": -0.251, "D_bh_return_pct": -8.39, "D_psr": 0.4265, "D_ic": -0.0066, "sharpe": -0.2879, "sortino": -0.2757, "return_pct": -9.03, "equity": 909.6999999999999, "max_dd": 0.0, "win_rate": 49.52, "profit_factor": 0.0, "ic": -0.0066, "hit": 49.52, "psr": 0.4265, "bh_sharpe": -0.251, "bh_return_pct": -8.39, "excess_sharpe": -0.0369, "precision": 0.4819, "recall": 0.8, "f1": 0.6015, "f2": 0.7067, "accuracy": 0.4952, "mcc": 0.0223, "tp": 40, "fp": 43, "tn": 12, "fn": 10, "A_precision": 0.4819, "A_recall": 0.8, "A_f1": 0.6015, "A_f2": 0.7067, "A_accuracy": 0.4952, "A_mcc": 0.0223, "A_tp": 40, "A_fp": 43, "A_tn": 12, "A_fn": 10}, {"fold": "fold_2", "regime": "2011 US-downgrade + EU debt", "n": 126, "A_sharpe": -0.7874, "A_sortino": -0.8969, "A_excess_sharpe": -3.0866, "A_return_pct": -8.64, "A_hit_rate": 41.6, "A_n": 126, "A_bh_sharpe": 2.2992, "A_bh_return_pct": 24.77, "A_psr": 0.2927, "A_ic": 0.0036, "B_sharpe": 5.7267, "B_sortino": 5.6825, "B_excess_sharpe": -0.623, "B_return_pct": 211.07, "B_hit_rate": 69.84, "B_n": 126, "B_bh_sharpe": 6.3497, "B_bh_return_pct": 247.81, "B_psr": 0.9999, "B_ic": 0.2645, "D_sharpe": -0.7874, "D_sortino": -0.8969, "D_excess_sharpe": -3.0866, "D_return_pct": -8.64, "D_hit_rate": 41.6, "D_n": 126, "D_bh_sharpe": 2.2992, "D_bh_return_pct": 24.77, "D_psr": 0.2927, "D_ic": 0.0036, "sharpe": -0.7874, "sortino": -0.8969, "return_pct": -8.64, "equity": 913.6, "max_dd": 0.0, "win_rate": 41.6, "profit_factor": 0.0, "ic": 0.0036, "hit": 41.6, "psr": 0.2927, "bh_sharpe": 2.2992, "bh_return_pct": 24.77, "excess_sharpe": -3.0866, "precision": 0.4889, "recall": 0.3014, "f1": 0.3729, "f2": 0.3264, "accuracy": 0.4127, "mcc": -0.1366, "tp": 22, "fp": 23, "tn": 30, "fn": 51, "A_precision": 0.4889, "A_recall": 0.3014, "A_f1": 0.3729, "A_f2": 0.3264, "A_accuracy": 0.4127, "A_mcc": -0.1366, "A_tp": 22, "A_fp": 23, "A_tn": 30, "A_fn": 51}, {"fold": "fold_3", "regime": "Taper tantrum and 2014 H1", "n": 168, "A_sharpe": 0.5525, "A_sortino": 0.6041, "A_excess_sharpe": -1.1525, "A_return_pct": 4.25, "A_hit_rate": 49.7, "A_n": 168, "A_bh_sharpe": 1.705, "A_bh_return_pct": 14.9, "A_psr": 0.675, "A_ic": 0.0749, "B_sharpe": -2.9739, "B_sortino": -2.7377, "B_excess_sharpe": -7.3827, "B_return_pct": -41.39, "B_hit_rate": 42.86, "B_n": 168, "B_bh_sharpe": 4.4088, "B_bh_return_pct": 105.48, "B_psr": 0.0075, "B_ic": -0.1012, "D_sharpe": 0.5525, "D_sortino": 0.6041, "D_excess_sharpe": -1.1525, "D_return_pct": 4.25, "D_hit_rate": 49.7, "D_n": 168, "D_bh_sharpe": 1.705, "D_bh_return_pct": 14.9, "D_psr": 0.675, "D_ic": 0.0749, "sharpe": 0.5525, "sortino": 0.6041, "return_pct": 4.25, "equity": 1042.5, "max_dd": 0.0, "win_rate": 49.7, "profit_factor": 0.0, "ic": 0.0749, "hit": 49.7, "psr": 0.675, "bh_sharpe": 1.705, "bh_return_pct": 14.9, "excess_sharpe": -1.1525, "precision": 0.5882, "recall": 0.5051, "f1": 0.5435, "f2": 0.5198, "accuracy": 0.5, "mcc": -0.0022, "tp": 50, "fp": 35, "tn": 34, "fn": 49, "A_precision": 0.5882, "A_recall": 0.5051, "A_f1": 0.5435, "A_f2": 0.5198, "A_accuracy": 0.5, "A_mcc": -0.0022, "A_tp": 50, "A_fp": 35, "A_tn": 34, "A_fn": 49}, {"fold": "fold_4", "regime": "China devaluation and oil crash", "n": 147, "A_sharpe": 0.1654, "A_sortino": 0.1573, "A_excess_sharpe": -0.4253, "A_return_pct": 0.77, "A_hit_rate": 50.68, "A_n": 147, "A_bh_sharpe": 0.5907, "A_bh_return_pct": 5.75, "A_psr": 0.55, "A_ic": 0.0493, "B_sharpe": -0.4969, "B_sortino": -0.5504, "B_excess_sharpe": -1.2025, "B_return_pct": -16.42, "B_hit_rate": 44.22, "B_n": 147, "B_bh_sharpe": 0.7057, "B_bh_return_pct": 13.06, "B_psr": 0.3538, "B_ic": 0.0001, "D_sharpe": 0.1654, "D_sortino": 0.1573, "D_excess_sharpe": -0.4253, "D_return_pct": 0.77, "D_hit_rate": 50.68, "D_n": 147, "D_bh_sharpe": 0.5907, "D_bh_return_pct": 5.75, "D_psr": 0.55, "D_ic": 0.0493, "sharpe": 0.1654, "sortino": 0.1573, "return_pct": 0.77, "equity": 1007.7, "max_dd": 0.0, "win_rate": 50.68, "profit_factor": 0.0, "ic": 0.0493, "hit": 50.68, "psr": 0.55, "bh_sharpe": 0.5907, "bh_return_pct": 5.75, "excess_sharpe": -0.4253, "precision": 0.5342, "recall": 0.5065, "f1": 0.52, "f2": 0.5118, "accuracy": 0.5102, "mcc": 0.0208, "tp": 39, "fp": 34, "tn": 36, "fn": 38, "A_precision": 0.5342, "A_recall": 0.5065, "A_f1": 0.52, "A_f2": 0.5118, "A_accuracy": 0.5102, "A_mcc": 0.0208, "A_tp": 39, "A_fp": 34, "A_tn": 36, "A_fn": 38}, {"fold": "fold_5", "regime": "2018 Vol-mageddon + Q4 sell-off", "n": 167, "A_sharpe": -1.6582, "A_sortino": -1.6398, "A_excess_sharpe": -1.8682, "A_return_pct": -24.13, "A_hit_rate": 44.91, "A_n": 167, "A_bh_sharpe": 0.2101, "A_bh_return_pct": 1.45, "A_psr": 0.0927, "A_ic": -0.126, "B_sharpe": 0.348, "B_sortino": 0.3521, "B_excess_sharpe": -0.0523, "B_return_pct": 3.54, "B_hit_rate": 48.19, "B_n": 167, "B_bh_sharpe": 0.4003, "B_bh_return_pct": 5.17, "B_psr": 0.6109, "B_ic": 0.0592, "D_sharpe": -1.6582, "D_sortino": -1.6398, "D_excess_sharpe": -1.8682, "D_return_pct": -24.13, "D_hit_rate": 44.91, "D_n": 167, "D_bh_sharpe": 0.2101, "D_bh_return_pct": 1.45, "D_psr": 0.0927, "D_ic": -0.126, "sharpe": -1.6582, "sortino": -1.6398, "return_pct": -24.13, "equity": 758.7, "max_dd": 0.0, "win_rate": 44.91, "profit_factor": 0.0, "ic": -0.126, "hit": 44.91, "psr": 0.0927, "bh_sharpe": 0.2101, "bh_return_pct": 1.45, "excess_sharpe": -1.8682, "precision": 0.5204, "recall": 0.5312, "f1": 0.5258, "f2": 0.529, "accuracy": 0.4491, "mcc": -0.1312, "tp": 51, "fp": 47, "tn": 24, "fn": 45, "A_precision": 0.5204, "A_recall": 0.5312, "A_f1": 0.5258, "A_f2": 0.529, "A_accuracy": 0.4491, "A_mcc": -0.1312, "A_tp": 51, "A_fp": 47, "A_tn": 24, "A_fn": 45}, {"fold": "fold_6", "regime": "COVID crash and V-recovery", "n": 212, "A_sharpe": -1.0558, "A_sortino": -1.0073, "A_excess_sharpe": -2.2538, "A_return_pct": -32.46, "A_hit_rate": 47.64, "A_n": 212, "A_bh_sharpe": 1.198, "A_bh_return_pct": 37.31, "A_psr": 0.1634, "A_ic": 0.0039, "B_sharpe": -2.4114, "B_sortino": -2.3556, "B_excess_sharpe": -5.9268, "B_return_pct": -78.45, "B_hit_rate": 42.65, "B_n": 212, "B_bh_sharpe": 3.5154, "B_bh_return_pct": 471.71, "B_psr": 0.0161, "B_ic": 0.0416, "D_sharpe": -1.0558, "D_sortino": -1.0073, "D_excess_sharpe": -2.2538, "D_return_pct": -32.46, "D_hit_rate": 47.64, "D_n": 212, "D_bh_sharpe": 1.198, "D_bh_return_pct": 37.31, "D_psr": 0.1634, "D_ic": 0.0039, "sharpe": -1.0558, "sortino": -1.0073, "return_pct": -32.46, "equity": 675.4, "max_dd": 0.0, "win_rate": 47.64, "profit_factor": 0.0, "ic": 0.0039, "hit": 47.64, "psr": 0.1634, "bh_sharpe": 1.198, "bh_return_pct": 37.31, "excess_sharpe": -2.2538, "precision": 0.6375, "recall": 0.3835, "f1": 0.4789, "f2": 0.4167, "accuracy": 0.4764, "mcc": 0.0163, "tp": 51, "fp": 29, "tn": 50, "fn": 82, "A_precision": 0.6375, "A_recall": 0.3835, "A_f1": 0.4789, "A_f2": 0.4167, "A_accuracy": 0.4764, "A_mcc": 0.0163, "A_tp": 51, "A_fp": 29, "A_tn": 50, "A_fn": 82}, {"fold": "fold_7", "regime": "Inflation bear, AI rally and 2025", "n": 415, "A_sharpe": 0.1388, "A_sortino": 0.1369, "A_excess_sharpe": -0.9006, "A_return_pct": 1.1, "A_hit_rate": 52.77, "A_n": 415, "A_bh_sharpe": 1.0394, "A_bh_return_pct": 39.53, "A_psr": 0.5708, "A_ic": 0.0398, "B_sharpe": -2.5537, "B_sortino": -2.2885, "B_excess_sharpe": -5.1546, "B_return_pct": -87.31, "B_hit_rate": 45.89, "B_n": 415, "B_bh_sharpe": 2.6009, "B_bh_return_pct": 477.86, "B_psr": 0.0004, "B_ic": -0.0984, "D_sharpe": 0.1388, "D_sortino": 0.1369, "D_excess_sharpe": -0.9006, "D_return_pct": 1.1, "D_hit_rate": 52.77, "D_n": 415, "D_bh_sharpe": 1.0394, "D_bh_return_pct": 39.53, "D_psr": 0.5708, "D_ic": 0.0398, "sharpe": 0.1388, "sortino": 0.1369, "return_pct": 1.1, "equity": 1010.9999999999999, "max_dd": 0.0, "win_rate": 52.77, "profit_factor": 0.0, "ic": 0.0398, "hit": 52.77, "psr": 0.5708, "bh_sharpe": 1.0394, "bh_return_pct": 39.53, "excess_sharpe": -0.9006, "precision": 0.6161, "recall": 0.5306, "f1": 0.5702, "f2": 0.5458, "accuracy": 0.5277, "mcc": 0.0533, "tp": 130, "fp": 81, "tn": 89, "fn": 115, "A_precision": 0.6161, "A_recall": 0.5306, "A_f1": 0.5702, "A_f2": 0.5458, "A_accuracy": 0.5277, "A_mcc": 0.0533, "A_tp": 130, "A_fp": 81, "A_tn": 89, "A_fn": 115}], "per_window_val": [{"fold": "fold_1", "regime": "GFC peak crash (Lehman + Mar-2009 bottom)", "n": 84, "A_sharpe": 0.9669, "A_sortino": 0.9156, "A_excess_sharpe": 1.7841, "A_return_pct": 8.12, "A_hit_rate": 50.0, "A_n": 84, "A_bh_sharpe": -0.8172, "A_bh_return_pct": -8.74, "A_psr": 0.704, "A_ic": 0.1145, "B_sharpe": -0.0822, "B_sortino": -0.0718, "B_excess_sharpe": 3.2357, "B_return_pct": -6.68, "B_hit_rate": 53.01, "B_n": 84, "B_bh_sharpe": -3.3179, "B_bh_return_pct": -48.39, "B_psr": 0.4812, "B_ic": 0.1609, "D_sharpe": 0.9669, "D_sortino": 0.9156, "D_excess_sharpe": 1.7841, "D_return_pct": 8.12, "D_hit_rate": 50.0, "D_n": 84, "D_bh_sharpe": -0.8172, "D_bh_return_pct": -8.74, "D_psr": 0.704, "D_ic": 0.1145, "sharpe": 0.9669, "sortino": 0.9156, "return_pct": 8.12, "equity": 1081.2, "max_dd": 0.0, "win_rate": 50.0, "profit_factor": 0.0, "ic": 0.1145, "hit": 50.0, "psr": 0.704, "bh_sharpe": -0.8172, "bh_return_pct": -8.74, "excess_sharpe": 1.7841}, {"fold": "fold_2", "regime": "2011 US-downgrade + EU debt", "n": 86, "A_sharpe": 0.8136, "A_sortino": 0.8644, "A_excess_sharpe": 1.53, "A_return_pct": 6.63, "A_hit_rate": 49.41, "A_n": 86, "A_bh_sharpe": -0.7164, "A_bh_return_pct": -7.84, "A_psr": 0.6817, "A_ic": -0.013, "B_sharpe": 3.8381, "B_sortino": 5.042, "B_excess_sharpe": 5.765, "B_return_pct": 102.74, "B_hit_rate": 55.81, "B_n": 86, "B_bh_sharpe": -1.9268, "B_bh_return_pct": -36.65, "B_psr": 0.992, "B_ic": 0.22, "D_sharpe": 0.8136, "D_sortino": 0.8644, "D_excess_sharpe": 1.53, "D_return_pct": 6.63, "D_hit_rate": 49.41, "D_n": 86, "D_bh_sharpe": -0.7164, "D_bh_return_pct": -7.84, "D_psr": 0.6817, "D_ic": -0.013, "sharpe": 0.8136, "sortino": 0.8644, "return_pct": 6.63, "equity": 1066.3, "max_dd": 0.0, "win_rate": 49.41, "profit_factor": 0.0, "ic": -0.013, "hit": 49.41, "psr": 0.6817, "bh_sharpe": -0.7164, "bh_return_pct": -7.84, "excess_sharpe": 1.53}, {"fold": "fold_3", "regime": "Taper tantrum and 2014 H1", "n": 44, "A_sharpe": 2.1898, "A_sortino": 2.2827, "A_excess_sharpe": -1.4264, "A_return_pct": 3.81, "A_hit_rate": 52.27, "A_n": 44, "A_bh_sharpe": 3.6162, "A_bh_return_pct": 6.32, "A_psr": 0.8095, "A_ic": 0.0534, "B_sharpe": 7.4797, "B_sortino": 10.6229, "B_excess_sharpe": 0.3195, "B_return_pct": 30.34, "B_hit_rate": 63.64, "B_n": 44, "B_bh_sharpe": 7.1601, "B_bh_return_pct": 29.11, "B_psr": 0.9995, "B_ic": 0.2433, "D_sharpe": 2.1898, "D_sortino": 2.2827, "D_excess_sharpe": -1.4264, "D_return_pct": 3.81, "D_hit_rate": 52.27, "D_n": 44, "D_bh_sharpe": 3.6162, "D_bh_return_pct": 6.32, "D_psr": 0.8095, "D_ic": 0.0534, "sharpe": 2.1898, "sortino": 2.2827, "return_pct": 3.81, "equity": 1038.1, "max_dd": 0.0, "win_rate": 52.27, "profit_factor": 0.0, "ic": 0.0534, "hit": 52.27, "psr": 0.8095, "bh_sharpe": 3.6162, "bh_return_pct": 6.32, "excess_sharpe": -1.4264}, {"fold": "fold_4", "regime": "China devaluation and oil crash", "n": 86, "A_sharpe": 2.5137, "A_sortino": 3.1, "A_excess_sharpe": 3.1817, "A_return_pct": 17.4, "A_hit_rate": 52.94, "A_n": 86, "A_bh_sharpe": -0.668, "A_bh_return_pct": -5.02, "A_psr": 0.9385, "A_ic": 0.1355, "B_sharpe": 5.9937, "B_sortino": 9.6529, "B_excess_sharpe": 7.6073, "B_return_pct": 133.38, "B_hit_rate": 63.95, "B_n": 86, "B_bh_sharpe": -1.6136, "B_bh_return_pct": -25.2, "B_psr": 1.0, "B_ic": 0.3378, "D_sharpe": 2.5137, "D_sortino": 3.1, "D_excess_sharpe": 3.1817, "D_return_pct": 17.4, "D_hit_rate": 52.94, "D_n": 86, "D_bh_sharpe": -0.668, "D_bh_return_pct": -5.02, "D_psr": 0.9385, "D_ic": 0.1355, "sharpe": 2.5137, "sortino": 3.1, "return_pct": 17.4, "equity": 1174.0, "max_dd": 0.0, "win_rate": 52.94, "profit_factor": 0.0, "ic": 0.1355, "hit": 52.94, "psr": 0.9385, "bh_sharpe": -0.668, "bh_return_pct": -5.02, "excess_sharpe": 3.1817}, {"fold": "fold_5", "regime": "2018 Vol-mageddon + Q4 sell-off", "n": 44, "A_sharpe": -4.3673, "A_sortino": -3.7594, "A_excess_sharpe": -6.2142, "A_return_pct": -10.07, "A_hit_rate": 45.45, "A_n": 44, "A_bh_sharpe": 1.8469, "A_bh_return_pct": 4.47, "A_psr": 0.0424, "A_ic": -0.0395, "B_sharpe": -2.7186, "B_sortino": -2.5951, "B_excess_sharpe": -6.8529, "B_return_pct": -14.97, "B_hit_rate": 43.18, "B_n": 44, "B_bh_sharpe": 4.1343, "B_bh_return_pct": 24.48, "B_psr": 0.1358, "B_ic": -0.1787, "D_sharpe": -4.3673, "D_sortino": -3.7594, "D_excess_sharpe": -6.2142, "D_return_pct": -10.07, "D_hit_rate": 45.45, "D_n": 44, "D_bh_sharpe": 1.8469, "D_bh_return_pct": 4.47, "D_psr": 0.0424, "D_ic": -0.0395, "sharpe": -4.3673, "sortino": -3.7594, "return_pct": -10.07, "equity": 899.3, "max_dd": 0.0, "win_rate": 45.45, "profit_factor": 0.0, "ic": -0.0395, "hit": 45.45, "psr": 0.0424, "bh_sharpe": 1.8469, "bh_return_pct": 4.47, "excess_sharpe": -6.2142}, {"fold": "fold_6", "regime": "COVID crash and V-recovery", "n": 65, "A_sharpe": 1.3346, "A_sortino": 1.3983, "A_excess_sharpe": -2.5061, "A_return_pct": 3.67, "A_hit_rate": 52.31, "A_n": 65, "A_bh_sharpe": 3.8407, "A_bh_return_pct": 10.95, "A_psr": 0.75, "A_ic": 0.2127, "B_sharpe": 4.2993, "B_sortino": 4.201, "B_excess_sharpe": -9.6097, "B_return_pct": 29.75, "B_hit_rate": 64.62, "B_n": 65, "B_bh_sharpe": 13.909, "B_bh_return_pct": 95.23, "B_psr": 0.9817, "B_ic": 0.1778, "D_sharpe": 1.3346, "D_sortino": 1.3983, "D_excess_sharpe": -2.5061, "D_return_pct": 3.67, "D_hit_rate": 52.31, "D_n": 65, "D_bh_sharpe": 3.8407, "D_bh_return_pct": 10.95, "D_psr": 0.75, "D_ic": 0.2127, "sharpe": 1.3346, "sortino": 1.3983, "return_pct": 3.67, "equity": 1036.7, "max_dd": 0.0, "win_rate": 52.31, "profit_factor": 0.0, "ic": 0.2127, "hit": 52.31, "psr": 0.75, "bh_sharpe": 3.8407, "bh_return_pct": 10.95, "excess_sharpe": -2.5061}, {"fold": "fold_7", "regime": "Inflation bear, AI rally and 2025", "n": 104, "A_sharpe": 3.1176, "A_sortino": 3.0441, "A_excess_sharpe": -1.1172, "A_return_pct": 20.46, "A_hit_rate": 61.54, "A_n": 104, "A_bh_sharpe": 4.2348, "A_bh_return_pct": 28.47, "A_psr": 0.9745, "A_ic": 0.0297, "B_sharpe": 1.8117, "B_sortino": 1.7258, "B_excess_sharpe": -7.1177, "B_return_pct": 26.74, "B_hit_rate": 58.65, "B_n": 104, "B_bh_sharpe": 8.9294, "B_bh_return_pct": 203.71, "B_psr": 0.8732, "B_ic": -0.0137, "D_sharpe": 3.1176, "D_sortino": 3.0441, "D_excess_sharpe": -1.1172, "D_return_pct": 20.46, "D_hit_rate": 61.54, "D_n": 104, "D_bh_sharpe": 4.2348, "D_bh_return_pct": 28.47, "D_psr": 0.9745, "D_ic": 0.0297, "sharpe": 3.1176, "sortino": 3.0441, "return_pct": 20.46, "equity": 1204.6000000000001, "max_dd": 0.0, "win_rate": 61.54, "profit_factor": 0.0, "ic": 0.0297, "hit": 61.54, "psr": 0.9745, "bh_sharpe": 4.2348, "bh_return_pct": 28.47, "excess_sharpe": -1.1172}], "status": "DISCARD", "precision": 0.5674, "recall": 0.4955, "f1": 0.529, "f2": 0.5084, "accuracy": 0.491, "mcc": -0.0193, "tp": 383, "fp": 292, "tn": 275, "fn": 390, "test_sharpe": -0.4341, "A_sharpe": -0.4341, "A_excess_sharpe": -1.2763, "A_return_pct": -54.77, "A_precision": 0.5674, "A_recall": 0.4955, "A_f1": 0.529, "A_f2": 0.5084, "A_accuracy": 0.491, "A_mcc": -0.0193, "A_tp": 383, "A_fp": 292, "A_tn": 275, "A_fn": 390, "A_psr": 0.1579, "A_ic": -0.0036, "A_hit_rate": 49.07, "A_bh_sharpe": 0.8422, "A_bh_return_pct": 169.94}
