{"experiment_num": 51, "backbone": "mamba", "description": "dMamba @ exp 48 expand=2 seed=99 - 4th seed for full multi-seed median lock", "config": {"seq_len": 60, "lr": 0.0005, "batch_size": 32, "epochs": 100, "weight_decay": 0.1, "patience": 20, "warmup_epochs": 10, "head_dropout": 0.1, "huber_delta": 1.0, "grad_clip": 1.0, "seed": 99, "hidden_size": null, "num_layers": null, "max_depth": null, "gbm_lr": null, "n_estimators": null}, "composite": -1.1484, "test_pos_folds": 2, "val_pos_folds": 5, "val_loss": -2.861999779675914, "elapsed_sec": 823.8, "timestamp": "2026-04-27T20:11:08", "sharpe": -0.6484, "val_sharpe": 1.8519, "ic": 0.0082, "hit": 43.33, "psr": 0.0953, "equity": 485.30000000000007, "return_pct": -51.47, "bh_sharpe": 1.2201, "bh_return_pct": 185.59, "excess_sharpe": -1.8685, "B_sharpe": -1.4872, "B_excess_sharpe": -4.3256, "B_return_pct": -96.53, "D_sharpe": -0.6484, "D_excess_sharpe": -1.8685, "D_return_pct": -51.47, "per_window": [{"fold": "fold_1", "regime": "GFC peak crash (Lehman + Mar-2009 bottom)", "n": 65, "A_sharpe": -0.3014, "A_sortino": -0.2873, "A_excess_sharpe": -0.7276, "A_return_pct": -4.65, "A_hit_rate": 49.23, "A_n": 65, "A_bh_sharpe": 0.4262, "A_bh_return_pct": 2.34, "A_psr": 0.4395, "A_ic": 0.175, "B_sharpe": -0.5289, "B_sortino": -0.4966, "B_excess_sharpe": -2.4165, "B_return_pct": -16.63, "B_hit_rate": 50.0, "B_n": 65, "B_bh_sharpe": 1.8877, "B_bh_return_pct": 34.48, "B_psr": 0.3946, "B_ic": 0.1757, "D_sharpe": -0.3014, "D_sortino": -0.2873, "D_excess_sharpe": -0.7276, "D_return_pct": -4.65, "D_hit_rate": 49.23, "D_n": 65, "D_bh_sharpe": 0.4262, "D_bh_return_pct": 2.34, "D_psr": 0.4395, "D_ic": 0.175, "sharpe": -0.3014, "sortino": -0.2873, "return_pct": -4.65, "equity": 953.5, "max_dd": 0.0, "win_rate": 49.23, "profit_factor": 0.0, "ic": 0.175, "hit": 49.23, "psr": 0.4395, "bh_sharpe": 0.4262, "bh_return_pct": 2.34, "excess_sharpe": -0.7276, "precision": 0.5714, "recall": 0.1176, "f1": 0.1951, "f2": 0.1399, "accuracy": 0.4923, "mcc": 0.0336, "tp": 4, "fp": 3, "tn": 28, "fn": 30, "A_precision": 0.5714, "A_recall": 0.1176, "A_f1": 0.1951, "A_f2": 0.1399, "A_accuracy": 0.4923, "A_mcc": 0.0336, "A_tp": 4, "A_fp": 3, "A_tn": 28, "A_fn": 30}, {"fold": "fold_2", "regime": "2011 US-downgrade + EU debt", "n": 86, "A_sharpe": -5.0004, "A_sortino": -4.1786, "A_excess_sharpe": -9.8686, "A_return_pct": -22.96, "A_hit_rate": 37.65, "A_n": 86, "A_bh_sharpe": 4.8682, "A_bh_return_pct": 27.91, "A_psr": 0.0005, "A_ic": 0.1741, "B_sharpe": -1.5321, "B_sortino": -1.782, "B_excess_sharpe": -12.8511, "B_return_pct": -17.91, "B_hit_rate": 37.21, "B_n": 86, "B_bh_sharpe": 11.3191, "B_bh_return_pct": 186.84, "B_psr": 0.1957, "B_ic": 0.2728, "D_sharpe": -5.0004, "D_sortino": -4.1786, "D_excess_sharpe": -9.8686, "D_return_pct": -22.96, "D_hit_rate": 37.65, "D_n": 86, "D_bh_sharpe": 4.8682, "D_bh_return_pct": 27.91, "D_psr": 0.0005, "D_ic": 0.1741, "sharpe": -5.0004, "sortino": -4.1786, "return_pct": -22.96, "equity": 770.4, "max_dd": 0.0, "win_rate": 37.65, "profit_factor": 0.0, "ic": 0.1741, "hit": 37.65, "psr": 0.0005, "bh_sharpe": 4.8682, "bh_return_pct": 27.91, "excess_sharpe": -9.8686, "precision": 0.5, "recall": 0.0189, "f1": 0.0364, "f2": 0.0234, "accuracy": 0.3837, "mcc": -0.0369, "tp": 1, "fp": 1, "tn": 32, "fn": 52, "A_precision": 0.5, "A_recall": 0.0189, "A_f1": 0.0364, "A_f2": 0.0234, "A_accuracy": 0.3837, "A_mcc": -0.0369, "A_tp": 1, "A_fp": 1, "A_tn": 32, "A_fn": 52}, {"fold": "fold_3", "regime": "Taper tantrum and 2014 H1", "n": 128, "A_sharpe": -1.6431, "A_sortino": -1.9044, "A_excess_sharpe": -3.702, "A_return_pct": -10.36, "A_hit_rate": 39.37, "A_n": 128, "A_bh_sharpe": 2.0589, "A_bh_return_pct": 13.6, "A_psr": 0.1353, "A_ic": 0.0846, "B_sharpe": -2.5759, "B_sortino": -2.5383, "B_excess_sharpe": -7.0875, "B_return_pct": -27.91, "B_hit_rate": 41.41, "B_n": 128, "B_bh_sharpe": 4.5116, "B_bh_return_pct": 67.92, "B_psr": 0.0368, "B_ic": -0.0299, "D_sharpe": -1.6431, "D_sortino": -1.9044, "D_excess_sharpe": -3.702, "D_return_pct": -10.36, "D_hit_rate": 39.37, "D_n": 128, "D_bh_sharpe": 2.0589, "D_bh_return_pct": 13.6, "D_psr": 0.1353, "D_ic": 0.0846, "sharpe": -1.6431, "sortino": -1.9044, "return_pct": -10.36, "equity": 896.4, "max_dd": 0.0, "win_rate": 39.37, "profit_factor": 0.0, "ic": 0.0846, "hit": 39.37, "psr": 0.1353, "bh_sharpe": 2.0589, "bh_return_pct": 13.6, "excess_sharpe": -3.702, "precision": 0.6667, "recall": 0.0256, "f1": 0.0494, "f2": 0.0317, "accuracy": 0.3984, "mcc": 0.0182, "tp": 2, "fp": 1, "tn": 49, "fn": 76, "A_precision": 0.6667, "A_recall": 0.0256, "A_f1": 0.0494, "A_f2": 0.0317, "A_accuracy": 0.3984, "A_mcc": 0.0182, "A_tp": 2, "A_fp": 1, "A_tn": 49, "A_fn": 76}, {"fold": "fold_4", "regime": "China devaluation and oil crash", "n": 107, "A_sharpe": 1.8573, "A_sortino": 1.8024, "A_excess_sharpe": 2.6606, "A_return_pct": 16.38, "A_hit_rate": 56.6, "A_n": 107, "A_bh_sharpe": -0.8032, "A_bh_return_pct": -7.58, "A_psr": 0.881, "A_ic": 0.0863, "B_sharpe": -0.2102, "B_sortino": -0.2145, "B_excess_sharpe": 1.7494, "B_return_pct": -7.79, "B_hit_rate": 46.73, "B_n": 107, "B_bh_sharpe": -1.9596, "B_bh_return_pct": -33.47, "B_psr": 0.4458, "B_ic": -0.0282, "D_sharpe": 1.8573, "D_sortino": 1.8024, "D_excess_sharpe": 2.6606, "D_return_pct": 16.38, "D_hit_rate": 56.6, "D_n": 107, "D_bh_sharpe": -0.8032, "D_bh_return_pct": -7.58, "D_psr": 0.881, "D_ic": 0.0863, "sharpe": 1.8573, "sortino": 1.8024, "return_pct": 16.38, "equity": 1163.8, "max_dd": 0.0, "win_rate": 56.6, "profit_factor": 0.0, "ic": 0.0863, "hit": 56.6, "psr": 0.881, "bh_sharpe": -0.8032, "bh_return_pct": -7.58, "excess_sharpe": 2.6606, "precision": 0.6, "recall": 0.3462, "f1": 0.439, "f2": 0.3782, "accuracy": 0.5701, "mcc": 0.1424, "tp": 18, "fp": 12, "tn": 43, "fn": 34, "A_precision": 0.6, "A_recall": 0.3462, "A_f1": 0.439, "A_f2": 0.3782, "A_accuracy": 0.5701, "A_mcc": 0.1424, "A_tp": 18, "A_fp": 12, "A_tn": 43, "A_fn": 34}, {"fold": "fold_5", "regime": "2018 Vol-mageddon + Q4 sell-off", "n": 127, "A_sharpe": 0.7662, "A_sortino": 0.9994, "A_excess_sharpe": -0.4168, "A_return_pct": 8.06, "A_hit_rate": 42.52, "A_n": 127, "A_bh_sharpe": 1.183, "A_bh_return_pct": 13.55, "A_psr": 0.7102, "A_ic": 0.0765, "B_sharpe": 1.2632, "B_sortino": 1.5975, "B_excess_sharpe": -1.6423, "B_return_pct": 27.45, "B_hit_rate": 46.03, "B_n": 127, "B_bh_sharpe": 2.9056, "B_bh_return_pct": 85.51, "B_psr": 0.8209, "B_ic": 0.1654, "D_sharpe": 0.7662, "D_sortino": 0.9994, "D_excess_sharpe": -0.4168, "D_return_pct": 8.06, "D_hit_rate": 42.52, "D_n": 127, "D_bh_sharpe": 1.183, "D_bh_return_pct": 13.55, "D_psr": 0.7102, "D_ic": 0.0765, "sharpe": 0.7662, "sortino": 0.9994, "return_pct": 8.06, "equity": 1080.6, "max_dd": 0.0, "win_rate": 42.52, "profit_factor": 0.0, "ic": 0.0765, "hit": 42.52, "psr": 0.7102, "bh_sharpe": 1.183, "bh_return_pct": 13.55, "excess_sharpe": -0.4168, "precision": 0.5714, "recall": 0.2564, "f1": 0.354, "f2": 0.2882, "accuracy": 0.4252, "mcc": -0.0542, "tp": 20, "fp": 15, "tn": 34, "fn": 58, "A_precision": 0.5714, "A_recall": 0.2564, "A_f1": 0.354, "A_f2": 0.2882, "A_accuracy": 0.4252, "A_mcc": -0.0542, "A_tp": 20, "A_fp": 15, "A_tn": 34, "A_fn": 58}, {"fold": "fold_6", "regime": "COVID crash and V-recovery", "n": 172, "A_sharpe": -1.932, "A_sortino": -2.1504, "A_excess_sharpe": -4.3596, "A_return_pct": -28.69, "A_hit_rate": 37.21, "A_n": 172, "A_bh_sharpe": 2.4276, "A_bh_return_pct": 45.89, "A_psr": 0.0636, "A_ic": 0.0596, "B_sharpe": -4.9863, "B_sortino": -4.7407, "B_excess_sharpe": -10.6983, "B_return_pct": -82.37, "B_hit_rate": 33.92, "B_n": 172, "B_bh_sharpe": 5.712, "B_bh_return_pct": 489.18, "B_psr": 0.0001, "B_ic": -0.0936, "D_sharpe": -1.932, "D_sortino": -2.1504, "D_excess_sharpe": -4.3596, "D_return_pct": -28.69, "D_hit_rate": 37.21, "D_n": 172, "D_bh_sharpe": 2.4276, "D_bh_return_pct": 45.89, "D_psr": 0.0636, "D_ic": 0.0596, "sharpe": -1.932, "sortino": -2.1504, "return_pct": -28.69, "equity": 713.1, "max_dd": 0.0, "win_rate": 37.21, "profit_factor": 0.0, "ic": 0.0596, "hit": 37.21, "psr": 0.0636, "bh_sharpe": 2.4276, "bh_return_pct": 45.89, "excess_sharpe": -4.3596, "precision": 0.6316, "recall": 0.1062, "f1": 0.1818, "f2": 0.1274, "accuracy": 0.3721, "mcc": -0.0189, "tp": 12, "fp": 7, "tn": 52, "fn": 101, "A_precision": 0.6316, "A_recall": 0.1062, "A_f1": 0.1818, "A_f2": 0.1274, "A_accuracy": 0.3721, "A_mcc": -0.0189, "A_tp": 12, "A_fp": 7, "A_tn": 52, "A_fn": 101}, {"fold": "fold_7", "regime": "Inflation bear, AI rally and 2025", "n": 375, "A_sharpe": -0.4759, "A_sortino": -0.556, "A_excess_sharpe": -1.2663, "A_return_pct": -17.81, "A_hit_rate": 44.27, "A_n": 375, "A_bh_sharpe": 0.7905, "A_bh_return_pct": 25.44, "A_psr": 0.2857, "A_ic": -0.0993, "B_sharpe": -1.3291, "B_sortino": -1.3446, "B_excess_sharpe": -3.2629, "B_return_pct": -66.03, "B_hit_rate": 45.99, "B_n": 375, "B_bh_sharpe": 1.9338, "B_bh_return_pct": 221.94, "B_psr": 0.0563, "B_ic": -0.136, "D_sharpe": -0.4759, "D_sortino": -0.556, "D_excess_sharpe": -1.2663, "D_return_pct": -17.81, "D_hit_rate": 44.27, "D_n": 375, "D_bh_sharpe": 0.7905, "D_bh_return_pct": 25.44, "D_psr": 0.2857, "D_ic": -0.0993, "sharpe": -0.4759, "sortino": -0.556, "return_pct": -17.81, "equity": 821.9000000000001, "max_dd": 0.0, "win_rate": 44.27, "profit_factor": 0.0, "ic": -0.0993, "hit": 44.27, "psr": 0.2857, "bh_sharpe": 0.7905, "bh_return_pct": 25.44, "excess_sharpe": -1.2663, "precision": 0.5545, "recall": 0.2545, "f1": 0.3489, "f2": 0.2854, "accuracy": 0.4427, "mcc": -0.0397, "tp": 56, "fp": 45, "tn": 110, "fn": 164, "A_precision": 0.5545, "A_recall": 0.2545, "A_f1": 0.3489, "A_f2": 0.2854, "A_accuracy": 0.4427, "A_mcc": -0.0397, "A_tp": 56, "A_fp": 45, "A_tn": 110, "A_fn": 164}], "per_window_val": [{"fold": "fold_1", "regime": "GFC peak crash (Lehman + Mar-2009 bottom)", "n": 37, "A_sharpe": 4.6778, "A_sortino": 5.4055, "A_excess_sharpe": 3.9194, "A_return_pct": 17.78, "A_hit_rate": 62.86, "A_n": 37, "A_bh_sharpe": 0.7585, "A_bh_return_pct": 2.39, "A_psr": 0.9678, "A_ic": 0.3773, "B_sharpe": 5.2304, "B_sortino": 6.5615, "B_excess_sharpe": 3.0857, "B_return_pct": 32.8, "B_hit_rate": 59.46, "B_n": 37, "B_bh_sharpe": 2.1447, "B_bh_return_pct": 12.13, "B_psr": 0.9802, "B_ic": 0.3864, "D_sharpe": 4.6778, "D_sortino": 5.4055, "D_excess_sharpe": 3.9194, "D_return_pct": 17.78, "D_hit_rate": 62.86, "D_n": 37, "D_bh_sharpe": 0.7585, "D_bh_return_pct": 2.39, "D_psr": 0.9678, "D_ic": 0.3773, "sharpe": 4.6778, "sortino": 5.4055, "return_pct": 17.78, "equity": 1177.8, "max_dd": 0.0, "win_rate": 62.86, "profit_factor": 0.0, "ic": 0.3773, "hit": 62.86, "psr": 0.9678, "bh_sharpe": 0.7585, "bh_return_pct": 2.39, "excess_sharpe": 3.9194}, {"fold": "fold_2", "regime": "2011 US-downgrade + EU debt", "n": 46, "A_sharpe": 1.4707, "A_sortino": 1.8138, "A_excess_sharpe": 1.5246, "A_return_pct": 8.61, "A_hit_rate": 47.83, "A_n": 46, "A_bh_sharpe": -0.0539, "A_bh_return_pct": -1.46, "A_psr": 0.7378, "A_ic": 0.1447, "B_sharpe": 0.5143, "B_sortino": 0.4728, "B_excess_sharpe": 2.0556, "B_return_pct": 1.79, "B_hit_rate": 54.35, "B_n": 46, "B_bh_sharpe": -1.5413, "B_bh_return_pct": -23.36, "B_psr": 0.5853, "B_ic": 0.1816, "D_sharpe": 1.4707, "D_sortino": 1.8138, "D_excess_sharpe": 1.5246, "D_return_pct": 8.61, "D_hit_rate": 47.83, "D_n": 46, "D_bh_sharpe": -0.0539, "D_bh_return_pct": -1.46, "D_psr": 0.7378, "D_ic": 0.1447, "sharpe": 1.4707, "sortino": 1.8138, "return_pct": 8.61, "equity": 1086.1000000000001, "max_dd": 0.0, "win_rate": 47.83, "profit_factor": 0.0, "ic": 0.1447, "hit": 47.83, "psr": 0.7378, "bh_sharpe": -0.0539, "bh_return_pct": -1.46, "excess_sharpe": 1.5246}, {"fold": "fold_3", "regime": "Taper tantrum and 2014 H1", "n": 4, "A_sharpe": -6.3226, "A_sortino": -4.4732, "A_excess_sharpe": -12.6451, "A_return_pct": -0.58, "A_hit_rate": 50.0, "A_n": 4, "A_bh_sharpe": 6.3226, "A_bh_return_pct": 0.58, "A_psr": 0.227, "A_ic": -0.2, "B_sharpe": 23.4413, "B_sortino": 0.0, "B_excess_sharpe": 46.8826, "B_return_pct": 3.19, "B_hit_rate": 100.0, "B_n": 4, "B_bh_sharpe": -23.4413, "B_bh_return_pct": -3.13, "B_psr": 1.0, "B_ic": 0.4, "D_sharpe": -6.3226, "D_sortino": -4.4732, "D_excess_sharpe": -12.6451, "D_return_pct": -0.58, "D_hit_rate": 50.0, "D_n": 4, "D_bh_sharpe": 6.3226, "D_bh_return_pct": 0.58, "D_psr": 0.227, "D_ic": -0.2, "sharpe": -6.3226, "sortino": -4.4732, "return_pct": -0.58, "equity": 994.1999999999999, "max_dd": 0.0, "win_rate": 50.0, "profit_factor": 0.0, "ic": -0.2, "hit": 50.0, "psr": 0.227, "bh_sharpe": 6.3226, "bh_return_pct": 0.58, "excess_sharpe": -12.6451}, {"fold": "fold_4", "regime": "China devaluation and oil crash", "n": 46, "A_sharpe": 1.9751, "A_sortino": 2.4315, "A_excess_sharpe": 3.1773, "A_return_pct": 8.49, "A_hit_rate": 50.0, "A_n": 46, "A_bh_sharpe": -1.2022, "A_bh_return_pct": -5.68, "A_psr": 0.8072, "A_ic": 0.1757, "B_sharpe": 7.2773, "B_sortino": 13.1664, "B_excess_sharpe": 9.5891, "B_return_pct": 98.48, "B_hit_rate": 63.04, "B_n": 46, "B_bh_sharpe": -2.3118, "B_bh_return_pct": -24.51, "B_psr": 1.0, "B_ic": 0.5949, "D_sharpe": 1.9751, "D_sortino": 2.4315, "D_excess_sharpe": 3.1773, "D_return_pct": 8.49, "D_hit_rate": 50.0, "D_n": 46, "D_bh_sharpe": -1.2022, "D_bh_return_pct": -5.68, "D_psr": 0.8072, "D_ic": 0.1757, "sharpe": 1.9751, "sortino": 2.4315, "return_pct": 8.49, "equity": 1084.8999999999999, "max_dd": 0.0, "win_rate": 50.0, "profit_factor": 0.0, "ic": 0.1757, "hit": 50.0, "psr": 0.8072, "bh_sharpe": -1.2022, "bh_return_pct": -5.68, "excess_sharpe": 3.1773}, {"fold": "fold_5", "regime": "2018 Vol-mageddon + Q4 sell-off", "n": 4, "A_sharpe": 14.7551, "A_sortino": 18.4635, "A_excess_sharpe": 29.5102, "A_return_pct": 0.0, "A_hit_rate": 0.0, "A_n": 4, "A_bh_sharpe": -14.7551, "A_bh_return_pct": -3.52, "A_psr": 0.9192, "A_ic": -0.2, "B_sharpe": 1.4281, "B_sortino": 1.434, "B_excess_sharpe": -0.7285, "B_return_pct": 0.75, "B_hit_rate": 50.0, "B_n": 4, "B_bh_sharpe": 2.1566, "B_bh_return_pct": 1.19, "B_psr": 0.5614, "B_ic": -0.4, "D_sharpe": 14.7551, "D_sortino": 18.4635, "D_excess_sharpe": 29.5102, "D_return_pct": 0.0, "D_hit_rate": 0.0, "D_n": 4, "D_bh_sharpe": -14.7551, "D_bh_return_pct": -3.52, "D_psr": 0.9192, "D_ic": -0.2, "sharpe": 14.7551, "sortino": 18.4635, "return_pct": 0.0, "equity": 1000.0, "max_dd": 0.0, "win_rate": 0.0, "profit_factor": 0.0, "ic": -0.2, "hit": 0.0, "psr": 0.9192, "bh_sharpe": -14.7551, "bh_return_pct": -3.52, "excess_sharpe": 29.5102}, {"fold": "fold_6", "regime": "COVID crash and V-recovery", "n": 25, "A_sharpe": -0.1939, "A_sortino": -0.226, "A_excess_sharpe": -2.6077, "A_return_pct": -0.37, "A_hit_rate": 44.0, "A_n": 25, "A_bh_sharpe": 2.4138, "A_bh_return_pct": 3.27, "A_psr": 0.4762, "A_ic": -0.0985, "B_sharpe": -10.0993, "B_sortino": -8.1492, "B_excess_sharpe": -22.6648, "B_return_pct": -22.36, "B_hit_rate": 24.0, "B_n": 25, "B_bh_sharpe": 12.5655, "B_bh_return_pct": 32.76, "B_psr": 0.0036, "B_ic": 0.2054, "D_sharpe": -0.1939, "D_sortino": -0.226, "D_excess_sharpe": -2.6077, "D_return_pct": -0.37, "D_hit_rate": 44.0, "D_n": 25, "D_bh_sharpe": 2.4138, "D_bh_return_pct": 3.27, "D_psr": 0.4762, "D_ic": -0.0985, "sharpe": -0.1939, "sortino": -0.226, "return_pct": -0.37, "equity": 996.3, "max_dd": 0.0, "win_rate": 44.0, "profit_factor": 0.0, "ic": -0.0985, "hit": 44.0, "psr": 0.4762, "bh_sharpe": 2.4138, "bh_return_pct": 3.27, "excess_sharpe": -2.6077}, {"fold": "fold_7", "regime": "Inflation bear, AI rally and 2025", "n": 64, "A_sharpe": 0.4963, "A_sortino": 0.488, "A_excess_sharpe": -1.5445, "A_return_pct": 1.66, "A_hit_rate": 51.56, "A_n": 64, "A_bh_sharpe": 2.0409, "A_bh_return_pct": 7.94, "A_psr": 0.5977, "A_ic": 0.1359, "B_sharpe": 0.1179, "B_sortino": 0.1192, "B_excess_sharpe": -5.2913, "B_return_pct": -0.24, "B_hit_rate": 50.0, "B_n": 64, "B_bh_sharpe": 5.4092, "B_bh_return_pct": 45.7, "B_psr": 0.5235, "B_ic": 0.1078, "D_sharpe": 0.4963, "D_sortino": 0.488, "D_excess_sharpe": -1.5445, "D_return_pct": 1.66, "D_hit_rate": 51.56, "D_n": 64, "D_bh_sharpe": 2.0409, "D_bh_return_pct": 7.94, "D_psr": 0.5977, "D_ic": 0.1359, "sharpe": 0.4963, "sortino": 0.488, "return_pct": 1.66, "equity": 1016.5999999999999, "max_dd": 0.0, "win_rate": 51.56, "profit_factor": 0.0, "ic": 0.1359, "hit": 51.56, "psr": 0.5977, "bh_sharpe": 2.0409, "bh_return_pct": 7.94, "excess_sharpe": -1.5445}], "status": "DISCARD", "precision": 0.5736, "recall": 0.1799, "f1": 0.2739, "f2": 0.2086, "accuracy": 0.4349, "mcc": -0.0183, "tp": 113, "fp": 84, "tn": 348, "fn": 515, "test_sharpe": -0.6484, "A_sharpe": -0.6484, "A_excess_sharpe": -1.8685, "A_return_pct": -51.47, "A_precision": 0.5736, "A_recall": 0.1799, "A_f1": 0.2739, "A_f2": 0.2086, "A_accuracy": 0.4349, "A_mcc": -0.0183, "A_tp": 113, "A_fp": 84, "A_tn": 348, "A_fn": 515, "A_psr": 0.0953, "A_ic": 0.0082, "A_hit_rate": 43.33, "A_bh_sharpe": 1.2201, "A_bh_return_pct": 185.59}
