{"experiment_num": 22, "backbone": "xgboost", "description": "XGBoost @ FX-Exp203 FULL n_est=1500 (Chen-Guestrin 2016 KDD); QQQ \u2014 final FX-winner baseline. Completes the 5-component set for the mega-ensemble.", "config": {"seq_len": 60, "lr": 0.0003, "batch_size": 32, "epochs": 50, "weight_decay": 1e-05, "patience": 10, "warmup_epochs": 0, "head_dropout": 0.1, "huber_delta": 1.0, "grad_clip": 1.0, "seed": 42, "hidden_size": null, "num_layers": null, "max_depth": 4, "gbm_lr": 0.03, "n_estimators": 1500}, "composite": -1.7766, "test_pos_folds": 4, "val_pos_folds": 2, "val_loss": null, "elapsed_sec": 2340.4, "timestamp": "2026-04-26T23:05:43", "sharpe": 0.2915, "val_sharpe": -1.4766, "ic": 0.0052, "hit": 47.84, "psr": 0.7268, "equity": 1186.9, "return_pct": 18.69, "bh_sharpe": 1.2194, "bh_return_pct": 187.05, "excess_sharpe": -0.9279, "B_sharpe": -0.376, "B_excess_sharpe": -3.2042, "B_return_pct": -69.83, "D_sharpe": 0.052, "D_excess_sharpe": -1.1674, "D_return_pct": -5.59, "per_window": [{"fold": "fold_1", "regime": "GFC peak crash (Lehman + Mar-2009 bottom)", "n": 66, "A_sharpe": 1.7618, "A_sortino": 1.8752, "A_excess_sharpe": 1.1896, "A_return_pct": 16.59, "A_hit_rate": 56.06, "A_n": 66, "A_bh_sharpe": 0.5721, "A_bh_return_pct": 3.85, "A_psr": 0.8174, "A_ic": 0.0665, "B_sharpe": 1.7201, "B_sortino": 1.841, "B_excess_sharpe": -0.3268, "B_return_pct": 30.58, "B_hit_rate": 52.31, "B_n": 66, "B_bh_sharpe": 2.0469, "B_bh_return_pct": 39.28, "B_psr": 0.8092, "B_ic": 0.1909, "D_sharpe": 2.4275, "D_sortino": 2.5239, "D_excess_sharpe": 1.8553, "D_return_pct": 24.24, "D_hit_rate": 56.06, "D_n": 66, "D_bh_sharpe": 0.5721, "D_bh_return_pct": 3.85, "D_psr": 0.8885, "D_ic": 0.1942, "sharpe": 1.7618, "sortino": 1.8752, "return_pct": 16.59, "equity": 1165.8999999999999, "max_dd": 0.0, "win_rate": 56.06, "profit_factor": 0.0, "ic": 0.0665, "hit": 56.06, "psr": 0.8174, "bh_sharpe": 0.5721, "bh_return_pct": 3.85, "excess_sharpe": 1.1896, "precision": 0.6154, "recall": 0.4571, "f1": 0.5246, "f2": 0.4819, "accuracy": 0.5606, "mcc": 0.1374, "tp": 16, "fp": 10, "tn": 21, "fn": 19, "A_precision": 0.6154, "A_recall": 0.4571, "A_f1": 0.5246, "A_f2": 0.4819, "A_accuracy": 0.5606, "A_mcc": 0.1374, "A_tp": 16, "A_fp": 10, "A_tn": 21, "A_fn": 19}, {"fold": "fold_2", "regime": "2011 US-downgrade + EU debt", "n": 87, "A_sharpe": 3.3763, "A_sortino": 4.182, "A_excess_sharpe": -1.6457, "A_return_pct": 19.19, "A_hit_rate": 58.14, "A_n": 87, "A_bh_sharpe": 5.022, "A_bh_return_pct": 29.23, "A_psr": 0.9842, "A_ic": 0.1133, "B_sharpe": 7.0048, "B_sortino": 7.6318, "B_excess_sharpe": -4.1321, "B_return_pct": 107.78, "B_hit_rate": 68.97, "B_n": 87, "B_bh_sharpe": 11.1369, "B_bh_return_pct": 185.4, "B_psr": 1.0, "B_ic": 0.2808, "D_sharpe": 2.9944, "D_sortino": 3.3306, "D_excess_sharpe": -2.0275, "D_return_pct": 16.88, "D_hit_rate": 60.47, "D_n": 87, "D_bh_sharpe": 5.022, "D_bh_return_pct": 29.23, "D_psr": 0.9688, "D_ic": 0.1007, "sharpe": 3.3763, "sortino": 4.182, "return_pct": 19.19, "equity": 1191.8999999999999, "max_dd": 0.0, "win_rate": 58.14, "profit_factor": 0.0, "ic": 0.1133, "hit": 58.14, "psr": 0.9842, "bh_sharpe": 5.022, "bh_return_pct": 29.23, "excess_sharpe": -1.6457, "precision": 0.6957, "recall": 0.5926, "f1": 0.64, "f2": 0.6107, "accuracy": 0.5862, "mcc": 0.1636, "tp": 32, "fp": 14, "tn": 19, "fn": 22, "A_precision": 0.6957, "A_recall": 0.5926, "A_f1": 0.64, "A_f2": 0.6107, "A_accuracy": 0.5862, "A_mcc": 0.1636, "A_tp": 32, "A_fp": 14, "A_tn": 19, "A_fn": 22}, {"fold": "fold_3", "regime": "Taper tantrum and 2014 H1", "n": 129, "A_sharpe": 1.2581, "A_sortino": 1.215, "A_excess_sharpe": -0.5097, "A_return_pct": 8.13, "A_hit_rate": 53.91, "A_n": 129, "A_bh_sharpe": 1.7678, "A_bh_return_pct": 11.76, "A_psr": 0.8099, "A_ic": -0.0163, "B_sharpe": 4.1269, "B_sortino": 4.3138, "B_excess_sharpe": -0.1205, "B_return_pct": 61.89, "B_hit_rate": 60.47, "B_n": 129, "B_bh_sharpe": 4.2474, "B_bh_return_pct": 64.1, "B_psr": 0.9976, "B_ic": 0.0387, "D_sharpe": 2.1558, "D_sortino": 2.1497, "D_excess_sharpe": 0.388, "D_return_pct": 14.59, "D_hit_rate": 58.59, "D_n": 129, "D_bh_sharpe": 1.7678, "D_bh_return_pct": 11.76, "D_psr": 0.9372, "D_ic": 0.1182, "sharpe": 1.2581, "sortino": 1.215, "return_pct": 8.13, "equity": 1081.3, "max_dd": 0.0, "win_rate": 53.91, "profit_factor": 0.0, "ic": -0.0163, "hit": 53.91, "psr": 0.8099, "bh_sharpe": 1.7678, "bh_return_pct": 11.76, "excess_sharpe": -0.5097, "precision": 0.6184, "recall": 0.6026, "f1": 0.6104, "f2": 0.6057, "accuracy": 0.5349, "mcc": 0.0337, "tp": 47, "fp": 29, "tn": 22, "fn": 31, "A_precision": 0.6184, "A_recall": 0.6026, "A_f1": 0.6104, "A_f2": 0.6057, "A_accuracy": 0.5349, "A_mcc": 0.0337, "A_tp": 47, "A_fp": 29, "A_tn": 22, "A_fn": 31}, {"fold": "fold_4", "regime": "China devaluation and oil crash", "n": 108, "A_sharpe": -0.6623, "A_sortino": -0.5941, "A_excess_sharpe": 0.0275, "A_return_pct": -6.48, "A_hit_rate": 52.34, "A_n": 108, "A_bh_sharpe": -0.6898, "A_bh_return_pct": -6.71, "A_psr": 0.3319, "A_ic": 0.0829, "B_sharpe": -2.6412, "B_sortino": -2.4272, "B_excess_sharpe": -0.6837, "B_return_pct": -41.36, "B_hit_rate": 42.59, "B_n": 108, "B_bh_sharpe": -1.9575, "B_bh_return_pct": -33.56, "B_psr": 0.0393, "B_ic": -0.0739, "D_sharpe": -0.7772, "D_sortino": -0.7215, "D_excess_sharpe": -0.0875, "D_return_pct": -7.42, "D_hit_rate": 48.6, "D_n": 108, "D_bh_sharpe": -0.6898, "D_bh_return_pct": -6.71, "D_psr": 0.3048, "D_ic": -0.0151, "sharpe": -0.6623, "sortino": -0.5941, "return_pct": -6.48, "equity": 935.2, "max_dd": 0.0, "win_rate": 52.34, "profit_factor": 0.0, "ic": 0.0829, "hit": 52.34, "psr": 0.3319, "bh_sharpe": -0.6898, "bh_return_pct": -6.71, "excess_sharpe": 0.0275, "precision": 0.5172, "recall": 0.566, "f1": 0.5405, "f2": 0.5556, "accuracy": 0.5278, "mcc": 0.0571, "tp": 30, "fp": 28, "tn": 27, "fn": 23, "A_precision": 0.5172, "A_recall": 0.566, "A_f1": 0.5405, "A_f2": 0.5556, "A_accuracy": 0.5278, "A_mcc": 0.0571, "A_tp": 30, "A_fp": 28, "A_tn": 27, "A_fn": 23}, {"fold": "fold_5", "regime": "2018 Vol-mageddon + Q4 sell-off", "n": 128, "A_sharpe": 1.3949, "A_sortino": 1.6586, "A_excess_sharpe": 0.2437, "A_return_pct": 16.53, "A_hit_rate": 48.44, "A_n": 128, "A_bh_sharpe": 1.1511, "A_bh_return_pct": 13.19, "A_psr": 0.845, "A_ic": -0.0022, "B_sharpe": -3.5785, "B_sortino": -3.6606, "B_excess_sharpe": -6.3904, "B_return_pct": -58.63, "B_hit_rate": 31.5, "B_n": 128, "B_bh_sharpe": 2.8119, "B_bh_return_pct": 82.25, "B_psr": 0.0068, "B_ic": -0.1116, "D_sharpe": -1.071, "D_sortino": -1.2286, "D_excess_sharpe": -2.2221, "D_return_pct": -13.29, "D_hit_rate": 40.62, "D_n": 128, "D_bh_sharpe": 1.1511, "D_bh_return_pct": 13.19, "D_psr": 0.2301, "D_ic": -0.0684, "sharpe": 1.3949, "sortino": 1.6586, "return_pct": 16.53, "equity": 1165.3, "max_dd": 0.0, "win_rate": 48.44, "profit_factor": 0.0, "ic": -0.0022, "hit": 48.44, "psr": 0.845, "bh_sharpe": 1.1511, "bh_return_pct": 13.19, "excess_sharpe": 0.2437, "precision": 0.5909, "recall": 0.5, "f1": 0.5417, "f2": 0.5159, "accuracy": 0.4844, "mcc": -0.0391, "tp": 39, "fp": 27, "tn": 23, "fn": 39, "A_precision": 0.5909, "A_recall": 0.5, "A_f1": 0.5417, "A_f2": 0.5159, "A_accuracy": 0.4844, "A_mcc": -0.0391, "A_tp": 39, "A_fp": 27, "A_tn": 23, "A_fn": 39}, {"fold": "fold_6", "regime": "COVID crash and V-recovery", "n": 173, "A_sharpe": -1.141, "A_sortino": -1.1766, "A_excess_sharpe": -3.4671, "A_return_pct": -18.94, "A_hit_rate": 43.35, "A_n": 173, "A_bh_sharpe": 2.3261, "A_bh_return_pct": 43.81, "A_psr": 0.1735, "A_ic": -0.0524, "B_sharpe": -1.1513, "B_sortino": -1.2389, "B_excess_sharpe": -6.8974, "B_return_pct": -38.51, "B_hit_rate": 44.19, "B_n": 173, "B_bh_sharpe": 5.746, "B_bh_return_pct": 499.04, "B_psr": 0.1761, "B_ic": 0.067, "D_sharpe": -1.1507, "D_sortino": -1.3284, "D_excess_sharpe": -3.4768, "D_return_pct": -19.06, "D_hit_rate": 39.88, "D_n": 173, "D_bh_sharpe": 2.3261, "D_bh_return_pct": 43.81, "D_psr": 0.1776, "D_ic": -0.0158, "sharpe": -1.141, "sortino": -1.1766, "return_pct": -18.94, "equity": 810.6, "max_dd": 0.0, "win_rate": 43.35, "profit_factor": 0.0, "ic": -0.0524, "hit": 43.35, "psr": 0.1735, "bh_sharpe": 2.3261, "bh_return_pct": 43.81, "excess_sharpe": -3.4671, "precision": 0.5949, "recall": 0.4159, "f1": 0.4896, "f2": 0.4426, "accuracy": 0.4335, "mcc": -0.1122, "tp": 47, "fp": 32, "tn": 28, "fn": 66, "A_precision": 0.5949, "A_recall": 0.4159, "A_f1": 0.4896, "A_f2": 0.4426, "A_accuracy": 0.4335, "A_mcc": -0.1122, "A_tp": 47, "A_fp": 32, "A_tn": 28, "A_fn": 66}, {"fold": "fold_7", "regime": "Inflation bear, AI rally and 2025", "n": 376, "A_sharpe": -0.223, "A_sortino": -0.269, "A_excess_sharpe": -1.0263, "A_return_pct": -10.58, "A_hit_rate": 42.55, "A_n": 376, "A_bh_sharpe": 0.8033, "A_bh_return_pct": 26.02, "A_psr": 0.3939, "A_ic": 0.0024, "B_sharpe": -0.8854, "B_sortino": -0.9269, "B_excess_sharpe": -2.8171, "B_return_pct": -53.96, "B_hit_rate": 43.73, "B_n": 376, "B_bh_sharpe": 1.9317, "B_bh_return_pct": 222.05, "B_psr": 0.1414, "B_ic": -0.0552, "D_sharpe": -0.2938, "D_sortino": -0.3555, "D_excess_sharpe": -1.0971, "D_return_pct": -12.67, "D_hit_rate": 41.76, "D_n": 376, "D_bh_sharpe": 0.8033, "D_bh_return_pct": 26.02, "D_psr": 0.3619, "D_ic": -0.0214, "sharpe": -0.223, "sortino": -0.269, "return_pct": -10.58, "equity": 894.2, "max_dd": 0.0, "win_rate": 42.55, "profit_factor": 0.0, "ic": 0.0024, "hit": 42.55, "psr": 0.3939, "bh_sharpe": 0.8033, "bh_return_pct": 26.02, "excess_sharpe": -1.0263, "precision": 0.5397, "recall": 0.1538, "f1": 0.2394, "f2": 0.1795, "accuracy": 0.4255, "mcc": -0.0438, "tp": 34, "fp": 29, "tn": 126, "fn": 187, "A_precision": 0.5397, "A_recall": 0.1538, "A_f1": 0.2394, "A_f2": 0.1795, "A_accuracy": 0.4255, "A_mcc": -0.0438, "A_tp": 34, "A_fp": 29, "A_tn": 126, "A_fn": 187}], "per_window_val": [{"fold": "fold_1", "regime": "GFC peak crash (Lehman + Mar-2009 bottom)", "n": 65, "A_sharpe": -1.8501, "A_sortino": -1.6897, "A_excess_sharpe": 0.3756, "A_return_pct": -16.09, "A_hit_rate": 44.44, "A_n": 65, "A_bh_sharpe": -2.2257, "A_bh_return_pct": -18.74, "A_psr": 0.1681, "A_ic": 0.1208, "B_sharpe": -4.946, "B_sortino": -4.2179, "B_excess_sharpe": 2.1764, "B_return_pct": -62.23, "B_hit_rate": 38.46, "B_n": 65, "B_bh_sharpe": -7.1223, "B_bh_return_pct": -73.11, "B_psr": 0.0042, "B_ic": 0.2647, "D_sharpe": -1.895, "D_sortino": -1.5689, "D_excess_sharpe": 0.3307, "D_return_pct": -16.42, "D_hit_rate": 49.21, "D_n": 65, "D_bh_sharpe": -2.2257, "D_bh_return_pct": -18.74, "D_psr": 0.1553, "D_ic": 0.2941, "sharpe": -1.8501, "sortino": -1.6897, "return_pct": -16.09, "equity": 839.0999999999999, "max_dd": 0.0, "win_rate": 44.44, "profit_factor": 0.0, "ic": 0.1208, "hit": 44.44, "psr": 0.1681, "bh_sharpe": -2.2257, "bh_return_pct": -18.74, "excess_sharpe": 0.3756}, {"fold": "fold_2", "regime": "2011 US-downgrade + EU debt", "n": 47, "A_sharpe": -0.3115, "A_sortino": -0.2759, "A_excess_sharpe": -0.1174, "A_return_pct": -3.1, "A_hit_rate": 55.32, "A_n": 47, "A_bh_sharpe": -0.1941, "A_bh_return_pct": -2.36, "A_psr": 0.4469, "A_ic": 0.0093, "B_sharpe": -0.3176, "B_sortino": -0.2702, "B_excess_sharpe": 1.2947, "B_return_pct": -9.36, "B_hit_rate": 55.32, "B_n": 47, "B_bh_sharpe": -1.6123, "B_bh_return_pct": -24.3, "B_psr": 0.4457, "B_ic": 0.0865, "D_sharpe": 1.5804, "D_sortino": 1.4951, "D_excess_sharpe": 1.7745, "D_return_pct": 9.48, "D_hit_rate": 57.45, "D_n": 47, "D_bh_sharpe": -0.1941, "D_bh_return_pct": -2.36, "D_psr": 0.7464, "D_ic": -0.0227, "sharpe": -0.3115, "sortino": -0.2759, "return_pct": -3.1, "equity": 969.0, "max_dd": 0.0, "win_rate": 55.32, "profit_factor": 0.0, "ic": 0.0093, "hit": 55.32, "psr": 0.4469, "bh_sharpe": -0.1941, "bh_return_pct": -2.36, "excess_sharpe": -0.1174}, {"fold": "fold_3", "regime": "Taper tantrum and 2014 H1", "n": 5, "A_sharpe": 1.3194, "A_sortino": 1.268, "A_excess_sharpe": 2.6388, "A_return_pct": 0.2, "A_hit_rate": 60.0, "A_n": 5, "A_bh_sharpe": -1.3194, "A_bh_return_pct": -0.21, "A_psr": 0.5663, "A_ic": 0.6, "B_sharpe": 25.8705, "B_sortino": 0.0, "B_excess_sharpe": 51.7411, "B_return_pct": 3.95, "B_hit_rate": 100.0, "B_n": 5, "B_bh_sharpe": -25.8705, "B_bh_return_pct": -3.84, "B_psr": 1.0, "B_ic": 0.4, "D_sharpe": 1.3194, "D_sortino": 1.268, "D_excess_sharpe": 2.6388, "D_return_pct": 0.2, "D_hit_rate": 60.0, "D_n": 5, "D_bh_sharpe": -1.3194, "D_bh_return_pct": -0.21, "D_psr": 0.5663, "D_ic": 0.1, "sharpe": 1.3194, "sortino": 1.268, "return_pct": 0.2, "equity": 1002.0, "max_dd": 0.0, "win_rate": 60.0, "profit_factor": 0.0, "ic": 0.6, "hit": 60.0, "psr": 0.5663, "bh_sharpe": -1.3194, "bh_return_pct": -0.21, "excess_sharpe": 2.6388}, {"fold": "fold_4", "regime": "China devaluation and oil crash", "n": 47, "A_sharpe": -2.2675, "A_sortino": -2.0623, "A_excess_sharpe": -0.4437, "A_return_pct": -10.51, "A_hit_rate": 44.68, "A_n": 47, "A_bh_sharpe": -1.8238, "A_bh_return_pct": -8.68, "A_psr": 0.1647, "A_ic": -0.0348, "B_sharpe": -0.5911, "B_sortino": -0.4938, "B_excess_sharpe": 1.6289, "B_return_pct": -9.35, "B_hit_rate": 51.06, "B_n": 47, "B_bh_sharpe": -2.22, "B_bh_return_pct": -23.98, "B_psr": 0.3977, "B_ic": 0.5066, "D_sharpe": -1.9249, "D_sortino": -1.7641, "D_excess_sharpe": -0.1011, "D_return_pct": -9.1, "D_hit_rate": 46.81, "D_n": 47, "D_bh_sharpe": -1.8238, "D_bh_return_pct": -8.68, "D_psr": 0.2048, "D_ic": 0.196, "sharpe": -2.2675, "sortino": -2.0623, "return_pct": -10.51, "equity": 894.9, "max_dd": 0.0, "win_rate": 44.68, "profit_factor": 0.0, "ic": -0.0348, "hit": 44.68, "psr": 0.1647, "bh_sharpe": -1.8238, "bh_return_pct": -8.68, "excess_sharpe": -0.4437}, {"fold": "fold_5", "regime": "2018 Vol-mageddon + Q4 sell-off", "n": 5, "A_sharpe": -10.1368, "A_sortino": -6.9937, "A_excess_sharpe": 0.0, "A_return_pct": -3.15, "A_hit_rate": 40.0, "A_n": 5, "A_bh_sharpe": -10.1368, "A_bh_return_pct": -3.15, "A_psr": 0.0985, "A_ic": -0.5, "B_sharpe": 5.6858, "B_sortino": 6.0578, "B_excess_sharpe": 0.0, "B_return_pct": 4.22, "B_hit_rate": 60.0, "B_n": 5, "B_bh_sharpe": 5.6858, "B_bh_return_pct": 4.22, "B_psr": 0.753, "B_ic": 0.5, "D_sharpe": -10.1368, "D_sortino": -6.9937, "D_excess_sharpe": 0.0, "D_return_pct": -3.15, "D_hit_rate": 40.0, "D_n": 5, "D_bh_sharpe": -10.1368, "D_bh_return_pct": -3.15, "D_psr": 0.0985, "D_ic": 0.3, "sharpe": -10.1368, "sortino": -6.9937, "return_pct": -3.15, "equity": 968.5, "max_dd": 0.0, "win_rate": 40.0, "profit_factor": 0.0, "ic": -0.5, "hit": 40.0, "psr": 0.0985, "bh_sharpe": -10.1368, "bh_return_pct": -3.15, "excess_sharpe": 0.0}, {"fold": "fold_6", "regime": "COVID crash and V-recovery", "n": 26, "A_sharpe": 2.8313, "A_sortino": 3.6474, "A_excess_sharpe": -0.4539, "A_return_pct": 4.15, "A_hit_rate": 50.0, "A_n": 26, "A_bh_sharpe": 3.2852, "A_bh_return_pct": 4.82, "A_psr": 0.8214, "A_ic": 0.4393, "B_sharpe": -2.2846, "B_sortino": -2.4194, "B_excess_sharpe": -15.2638, "B_return_pct": -7.71, "B_hit_rate": 38.46, "B_n": 26, "B_bh_sharpe": 12.9792, "B_bh_return_pct": 38.76, "B_psr": 0.2429, "B_ic": 0.4851, "D_sharpe": 2.8046, "D_sortino": 3.6389, "D_excess_sharpe": -0.4805, "D_return_pct": 4.11, "D_hit_rate": 50.0, "D_n": 26, "D_bh_sharpe": 3.2852, "D_bh_return_pct": 4.82, "D_psr": 0.8205, "D_ic": 0.3368, "sharpe": 2.8313, "sortino": 3.6474, "return_pct": 4.15, "equity": 1041.5, "max_dd": 0.0, "win_rate": 50.0, "profit_factor": 0.0, "ic": 0.4393, "hit": 50.0, "psr": 0.8214, "bh_sharpe": 3.2852, "bh_return_pct": 4.82, "excess_sharpe": -0.4539}, {"fold": "fold_7", "regime": "Inflation bear, AI rally and 2025", "n": 65, "A_sharpe": -3.3462, "A_sortino": -3.0535, "A_excess_sharpe": -5.4251, "A_return_pct": -12.41, "A_hit_rate": 41.54, "A_n": 65, "A_bh_sharpe": 2.0789, "A_bh_return_pct": 8.17, "A_psr": 0.0443, "A_ic": 0.0354, "B_sharpe": -4.2481, "B_sortino": -3.9728, "B_excess_sharpe": -9.4795, "B_return_pct": -27.74, "B_hit_rate": 35.38, "B_n": 65, "B_bh_sharpe": 5.2314, "B_bh_return_pct": 44.53, "B_psr": 0.0172, "B_ic": 0.1956, "D_sharpe": -2.5735, "D_sortino": -2.3003, "D_excess_sharpe": -4.6524, "D_return_pct": -9.83, "D_hit_rate": 46.15, "D_n": 65, "D_bh_sharpe": 2.0789, "D_bh_return_pct": 8.17, "D_psr": 0.0938, "D_ic": 0.1511, "sharpe": -3.3462, "sortino": -3.0535, "return_pct": -12.41, "equity": 875.9, "max_dd": 0.0, "win_rate": 41.54, "profit_factor": 0.0, "ic": 0.0354, "hit": 41.54, "psr": 0.0443, "bh_sharpe": 2.0789, "bh_return_pct": 8.17, "excess_sharpe": -5.4251}], "status": "DISCARD", "precision": 0.5918, "recall": 0.3877, "f1": 0.4685, "f2": 0.4164, "accuracy": 0.4789, "mcc": -0.0009, "tp": 245, "fp": 169, "tn": 266, "fn": 387, "test_sharpe": 0.2915, "A_sharpe": 0.2915, "A_excess_sharpe": -0.9279, "A_return_pct": 18.69, "A_precision": 0.5918, "A_recall": 0.3877, "A_f1": 0.4685, "A_f2": 0.4164, "A_accuracy": 0.4789, "A_mcc": -0.0009, "A_tp": 245, "A_fp": 169, "A_tn": 266, "A_fn": 387, "A_psr": 0.7268, "A_ic": 0.0052, "A_hit_rate": 47.84, "A_bh_sharpe": 1.2194, "A_bh_return_pct": 187.05}
