{"experiment_num": 12, "backbone": "lightgbm", "description": "LightGBM @ FX champion HPs (Exp235: depth=4 lr=0.01 n_est=2000 seq=60) \u2014 Ke et al. 2017 NeurIPS; QQQ exp7 \u2014 testing FX-LGBM-winner config", "config": {"seq_len": 60, "lr": 0.0003, "batch_size": 32, "epochs": 50, "weight_decay": 1e-05, "patience": 10, "warmup_epochs": 0, "head_dropout": 0.1, "huber_delta": 1.0, "grad_clip": 1.0, "seed": 42, "hidden_size": null, "num_layers": null, "max_depth": 4, "gbm_lr": 0.01, "n_estimators": 2000}, "composite": 0.2885, "test_pos_folds": 6, "val_pos_folds": 5, "val_loss": null, "elapsed_sec": 2905.0, "timestamp": "2026-04-26T15:28:07", "sharpe": 0.743, "val_sharpe": 0.3885, "ic": 0.039, "hit": 49.06, "psr": 0.939, "equity": 1826.2, "return_pct": 82.62, "bh_sharpe": 1.2194, "bh_return_pct": 187.05, "excess_sharpe": -0.4763, "B_sharpe": -0.3067, "B_excess_sharpe": -3.1349, "B_return_pct": -65.35, "D_sharpe": -0.1087, "D_excess_sharpe": -1.3281, "D_return_pct": -19.03, "per_window": [{"fold": "fold_1", "regime": "GFC peak crash (Lehman + Mar-2009 bottom)", "n": 66, "A_sharpe": 0.4158, "A_sortino": 0.477, "A_excess_sharpe": -0.1563, "A_return_pct": 2.27, "A_hit_rate": 42.42, "A_n": 66, "A_bh_sharpe": 0.5721, "A_bh_return_pct": 3.85, "A_psr": 0.5838, "A_ic": 0.0492, "B_sharpe": 2.697, "B_sortino": 3.0584, "B_excess_sharpe": 0.6501, "B_return_pct": 58.04, "B_hit_rate": 52.31, "B_n": 66, "B_bh_sharpe": 2.0469, "B_bh_return_pct": 39.28, "B_psr": 0.9155, "B_ic": 0.3406, "D_sharpe": 1.2516, "D_sortino": 1.3836, "D_excess_sharpe": 0.6795, "D_return_pct": 10.97, "D_hit_rate": 48.48, "D_n": 66, "D_bh_sharpe": 0.5721, "D_bh_return_pct": 3.85, "D_psr": 0.738, "D_ic": 0.1844, "sharpe": 0.4158, "sortino": 0.477, "return_pct": 2.27, "equity": 1022.6999999999999, "max_dd": 0.0, "win_rate": 42.42, "profit_factor": 0.0, "ic": 0.0492, "hit": 42.42, "psr": 0.5838, "bh_sharpe": 0.5721, "bh_return_pct": 3.85, "excess_sharpe": -0.1563, "precision": 0.4545, "recall": 0.4286, "f1": 0.4412, "f2": 0.4335, "accuracy": 0.4242, "mcc": -0.1518, "tp": 15, "fp": 18, "tn": 13, "fn": 20, "A_precision": 0.4545, "A_recall": 0.4286, "A_f1": 0.4412, "A_f2": 0.4335, "A_accuracy": 0.4242, "A_mcc": -0.1518, "A_tp": 15, "A_fp": 18, "A_tn": 13, "A_fn": 20}, {"fold": "fold_2", "regime": "2011 US-downgrade + EU debt", "n": 87, "A_sharpe": 2.3846, "A_sortino": 3.045, "A_excess_sharpe": -2.6374, "A_return_pct": 13.22, "A_hit_rate": 51.16, "A_n": 87, "A_bh_sharpe": 5.022, "A_bh_return_pct": 29.23, "A_psr": 0.9319, "A_ic": 0.0132, "B_sharpe": 4.7306, "B_sortino": 5.4513, "B_excess_sharpe": -6.4063, "B_return_pct": 66.79, "B_hit_rate": 60.92, "B_n": 87, "B_bh_sharpe": 11.1369, "B_bh_return_pct": 185.4, "B_psr": 0.9976, "B_ic": 0.198, "D_sharpe": 1.8431, "D_sortino": 2.1305, "D_excess_sharpe": -3.1789, "D_return_pct": 10.01, "D_hit_rate": 54.65, "D_n": 87, "D_bh_sharpe": 5.022, "D_bh_return_pct": 29.23, "D_psr": 0.8709, "D_ic": 0.1012, "sharpe": 2.3846, "sortino": 3.045, "return_pct": 13.22, "equity": 1132.2, "max_dd": 0.0, "win_rate": 51.16, "profit_factor": 0.0, "ic": 0.0132, "hit": 51.16, "psr": 0.9319, "bh_sharpe": 5.022, "bh_return_pct": 29.23, "excess_sharpe": -2.6374, "precision": 0.6111, "recall": 0.6111, "f1": 0.6111, "f2": 0.6111, "accuracy": 0.5172, "mcc": -0.0253, "tp": 33, "fp": 21, "tn": 12, "fn": 21, "A_precision": 0.6111, "A_recall": 0.6111, "A_f1": 0.6111, "A_f2": 0.6111, "A_accuracy": 0.5172, "A_mcc": -0.0253, "A_tp": 33, "A_fp": 21, "A_tn": 12, "A_fn": 21}, {"fold": "fold_3", "regime": "Taper tantrum and 2014 H1", "n": 129, "A_sharpe": 0.7749, "A_sortino": 0.8449, "A_excess_sharpe": -0.9929, "A_return_pct": 4.78, "A_hit_rate": 47.66, "A_n": 129, "A_bh_sharpe": 1.7678, "A_bh_return_pct": 11.76, "A_psr": 0.7099, "A_ic": 0.0704, "B_sharpe": 2.2548, "B_sortino": 2.264, "B_excess_sharpe": -1.9926, "B_return_pct": 30.03, "B_hit_rate": 57.36, "B_n": 129, "B_bh_sharpe": 4.2474, "B_bh_return_pct": 64.1, "B_psr": 0.9435, "B_ic": 0.0022, "D_sharpe": 1.2389, "D_sortino": 1.2025, "D_excess_sharpe": -0.5289, "D_return_pct": 8.0, "D_hit_rate": 53.91, "D_n": 129, "D_bh_sharpe": 1.7678, "D_bh_return_pct": 11.76, "D_psr": 0.8066, "D_ic": 0.0932, "sharpe": 0.7749, "sortino": 0.8449, "return_pct": 4.78, "equity": 1047.8, "max_dd": 0.0, "win_rate": 47.66, "profit_factor": 0.0, "ic": 0.0704, "hit": 47.66, "psr": 0.7099, "bh_sharpe": 1.7678, "bh_return_pct": 11.76, "excess_sharpe": -0.9929, "precision": 0.5781, "recall": 0.4744, "f1": 0.5211, "f2": 0.492, "accuracy": 0.4729, "mcc": -0.0538, "tp": 37, "fp": 27, "tn": 24, "fn": 41, "A_precision": 0.5781, "A_recall": 0.4744, "A_f1": 0.5211, "A_f2": 0.492, "A_accuracy": 0.4729, "A_mcc": -0.0538, "A_tp": 37, "A_fp": 27, "A_tn": 24, "A_fn": 41}, {"fold": "fold_4", "regime": "China devaluation and oil crash", "n": 108, "A_sharpe": -0.2465, "A_sortino": -0.2329, "A_excess_sharpe": 0.4432, "A_return_pct": -3.01, "A_hit_rate": 50.47, "A_n": 108, "A_bh_sharpe": -0.6898, "A_bh_return_pct": -6.71, "A_psr": 0.436, "A_ic": 0.0643, "B_sharpe": -3.1731, "B_sortino": -2.9407, "B_excess_sharpe": -1.2156, "B_return_pct": -46.7, "B_hit_rate": 39.81, "B_n": 108, "B_bh_sharpe": -1.9575, "B_bh_return_pct": -33.56, "B_psr": 0.0175, "B_ic": -0.1199, "D_sharpe": -1.1063, "D_sortino": -1.0171, "D_excess_sharpe": -0.4165, "D_return_pct": -10.04, "D_hit_rate": 47.66, "D_n": 108, "D_bh_sharpe": -0.6898, "D_bh_return_pct": -6.71, "D_psr": 0.2323, "D_ic": -0.0316, "sharpe": -0.2465, "sortino": -0.2329, "return_pct": -3.01, "equity": 969.9, "max_dd": 0.0, "win_rate": 50.47, "profit_factor": 0.0, "ic": 0.0643, "hit": 50.47, "psr": 0.436, "bh_sharpe": -0.6898, "bh_return_pct": -6.71, "excess_sharpe": 0.4432, "precision": 0.5, "recall": 0.5094, "f1": 0.5047, "f2": 0.5075, "accuracy": 0.5093, "mcc": 0.0185, "tp": 27, "fp": 27, "tn": 28, "fn": 26, "A_precision": 0.5, "A_recall": 0.5094, "A_f1": 0.5047, "A_f2": 0.5075, "A_accuracy": 0.5093, "A_mcc": 0.0185, "A_tp": 27, "A_fp": 27, "A_tn": 28, "A_fn": 26}, {"fold": "fold_5", "regime": "2018 Vol-mageddon + Q4 sell-off", "n": 128, "A_sharpe": 1.4357, "A_sortino": 1.7459, "A_excess_sharpe": 0.2845, "A_return_pct": 17.1, "A_hit_rate": 50.0, "A_n": 128, "A_bh_sharpe": 1.1511, "A_bh_return_pct": 13.19, "A_psr": 0.8545, "A_ic": 0.0348, "B_sharpe": -3.1191, "B_sortino": -3.1834, "B_excess_sharpe": -5.931, "B_return_pct": -54.19, "B_hit_rate": 33.86, "B_n": 128, "B_bh_sharpe": 2.8119, "B_bh_return_pct": 82.25, "B_psr": 0.0149, "B_ic": -0.044, "D_sharpe": -0.4762, "D_sortino": -0.5711, "D_excess_sharpe": -1.6273, "D_return_pct": -6.89, "D_hit_rate": 41.41, "D_n": 128, "D_bh_sharpe": 1.1511, "D_bh_return_pct": 13.19, "D_psr": 0.3694, "D_ic": -0.0333, "sharpe": 1.4357, "sortino": 1.7459, "return_pct": 17.1, "equity": 1171.0, "max_dd": 0.0, "win_rate": 50.0, "profit_factor": 0.0, "ic": 0.0348, "hit": 50.0, "psr": 0.8545, "bh_sharpe": 1.1511, "bh_return_pct": 13.19, "excess_sharpe": 0.2845, "precision": 0.625, "recall": 0.4487, "f1": 0.5224, "f2": 0.4755, "accuracy": 0.5, "mcc": 0.0282, "tp": 35, "fp": 21, "tn": 29, "fn": 43, "A_precision": 0.625, "A_recall": 0.4487, "A_f1": 0.5224, "A_f2": 0.4755, "A_accuracy": 0.5, "A_mcc": 0.0282, "A_tp": 35, "A_fp": 21, "A_tn": 29, "A_fn": 43}, {"fold": "fold_6", "regime": "COVID crash and V-recovery", "n": 173, "A_sharpe": 0.9052, "A_sortino": 0.9641, "A_excess_sharpe": -1.4209, "A_return_pct": 13.94, "A_hit_rate": 50.87, "A_n": 173, "A_bh_sharpe": 2.3261, "A_bh_return_pct": 43.81, "A_psr": 0.7736, "A_ic": 0.0587, "B_sharpe": -1.6065, "B_sortino": -1.7507, "B_excess_sharpe": -7.3525, "B_return_pct": -47.41, "B_hit_rate": 41.86, "B_n": 173, "B_bh_sharpe": 5.746, "B_bh_return_pct": 499.04, "B_psr": 0.1003, "B_ic": 0.0889, "D_sharpe": -0.7361, "D_sortino": -0.8549, "D_excess_sharpe": -3.0622, "D_return_pct": -13.3, "D_hit_rate": 39.88, "D_n": 173, "D_bh_sharpe": 2.3261, "D_bh_return_pct": 43.81, "D_psr": 0.2744, "D_ic": 0.0292, "sharpe": 0.9052, "sortino": 0.9641, "return_pct": 13.94, "equity": 1139.3999999999999, "max_dd": 0.0, "win_rate": 50.87, "profit_factor": 0.0, "ic": 0.0587, "hit": 50.87, "psr": 0.7736, "bh_sharpe": 2.3261, "bh_return_pct": 43.81, "excess_sharpe": -1.4209, "precision": 0.6944, "recall": 0.4425, "f1": 0.5405, "f2": 0.4771, "accuracy": 0.5087, "mcc": 0.0732, "tp": 50, "fp": 22, "tn": 38, "fn": 63, "A_precision": 0.6944, "A_recall": 0.4425, "A_f1": 0.5405, "A_f2": 0.4771, "A_accuracy": 0.5087, "A_mcc": 0.0732, "A_tp": 50, "A_fp": 22, "A_tn": 38, "A_fn": 63}, {"fold": "fold_7", "regime": "Inflation bear, AI rally and 2025", "n": 376, "A_sharpe": 0.5632, "A_sortino": 0.6277, "A_excess_sharpe": -0.2401, "A_return_pct": 16.33, "A_hit_rate": 48.67, "A_n": 376, "A_bh_sharpe": 0.8033, "A_bh_return_pct": 26.02, "A_psr": 0.7576, "A_ic": 0.0294, "B_sharpe": -0.1138, "B_sortino": -0.1287, "B_excess_sharpe": -2.0455, "B_return_pct": -21.27, "B_hit_rate": 44.27, "B_n": 376, "B_bh_sharpe": 1.9317, "B_bh_return_pct": 222.05, "B_psr": 0.4449, "B_ic": -0.0242, "D_sharpe": -0.3899, "D_sortino": -0.4786, "D_excess_sharpe": -1.1932, "D_return_pct": -15.43, "D_hit_rate": 41.22, "D_n": 376, "D_bh_sharpe": 0.8033, "D_bh_return_pct": 26.02, "D_psr": 0.3206, "D_ic": -0.0207, "sharpe": 0.5632, "sortino": 0.6277, "return_pct": 16.33, "equity": 1163.3, "max_dd": 0.0, "win_rate": 48.67, "profit_factor": 0.0, "ic": 0.0294, "hit": 48.67, "psr": 0.7576, "bh_sharpe": 0.8033, "bh_return_pct": 26.02, "excess_sharpe": -0.2401, "precision": 0.6273, "recall": 0.3122, "f1": 0.4169, "f2": 0.3471, "accuracy": 0.4867, "mcc": 0.0516, "tp": 69, "fp": 41, "tn": 114, "fn": 152, "A_precision": 0.6273, "A_recall": 0.3122, "A_f1": 0.4169, "A_f2": 0.3471, "A_accuracy": 0.4867, "A_mcc": 0.0516, "A_tp": 69, "A_fp": 41, "A_tn": 114, "A_fn": 152}], "per_window_val": [{"fold": "fold_1", "regime": "GFC peak crash (Lehman + Mar-2009 bottom)", "n": 65, "A_sharpe": 1.1029, "A_sortino": 1.2173, "A_excess_sharpe": 3.3286, "A_return_pct": 8.49, "A_hit_rate": 50.79, "A_n": 65, "A_bh_sharpe": -2.2257, "A_bh_return_pct": -18.74, "A_psr": 0.7147, "A_ic": 0.0806, "B_sharpe": -4.8065, "B_sortino": -4.0599, "B_excess_sharpe": 2.3158, "B_return_pct": -61.34, "B_hit_rate": 40.0, "B_n": 65, "B_bh_sharpe": -7.1223, "B_bh_return_pct": -73.11, "B_psr": 0.0051, "B_ic": 0.1947, "D_sharpe": -1.1614, "D_sortino": -0.9741, "D_excess_sharpe": 1.0642, "D_return_pct": -10.97, "D_hit_rate": 50.79, "D_n": 65, "D_bh_sharpe": -2.2257, "D_bh_return_pct": -18.74, "D_psr": 0.2717, "D_ic": 0.2723, "sharpe": 1.1029, "sortino": 1.2173, "return_pct": 8.49, "equity": 1084.8999999999999, "max_dd": 0.0, "win_rate": 50.79, "profit_factor": 0.0, "ic": 0.0806, "hit": 50.79, "psr": 0.7147, "bh_sharpe": -2.2257, "bh_return_pct": -18.74, "excess_sharpe": 3.3286}, {"fold": "fold_2", "regime": "2011 US-downgrade + EU debt", "n": 47, "A_sharpe": 0.3835, "A_sortino": 0.3516, "A_excess_sharpe": 0.5775, "A_return_pct": 1.36, "A_hit_rate": 53.19, "A_n": 47, "A_bh_sharpe": -0.1941, "A_bh_return_pct": -2.36, "A_psr": 0.5646, "A_ic": 0.0128, "B_sharpe": 0.3437, "B_sortino": 0.3033, "B_excess_sharpe": 1.9561, "B_return_pct": -0.55, "B_hit_rate": 55.32, "B_n": 47, "B_bh_sharpe": -1.6123, "B_bh_return_pct": -24.3, "B_psr": 0.558, "B_ic": 0.1731, "D_sharpe": 1.1803, "D_sortino": 1.0926, "D_excess_sharpe": 1.3744, "D_return_pct": 6.71, "D_hit_rate": 57.45, "D_n": 47, "D_bh_sharpe": -0.1941, "D_bh_return_pct": -2.36, "D_psr": 0.6907, "D_ic": -0.0102, "sharpe": 0.3835, "sortino": 0.3516, "return_pct": 1.36, "equity": 1013.6, "max_dd": 0.0, "win_rate": 53.19, "profit_factor": 0.0, "ic": 0.0128, "hit": 53.19, "psr": 0.5646, "bh_sharpe": -0.1941, "bh_return_pct": -2.36, "excess_sharpe": 0.5775}, {"fold": "fold_3", "regime": "Taper tantrum and 2014 H1", "n": 5, "A_sharpe": 3.7421, "A_sortino": 3.8425, "A_excess_sharpe": 5.0616, "A_return_pct": 0.57, "A_hit_rate": 60.0, "A_n": 5, "A_bh_sharpe": -1.3194, "A_bh_return_pct": -0.21, "A_psr": 0.6797, "A_ic": 0.7, "B_sharpe": 25.8705, "B_sortino": 0.0, "B_excess_sharpe": 51.7411, "B_return_pct": 3.95, "B_hit_rate": 100.0, "B_n": 5, "B_bh_sharpe": -25.8705, "B_bh_return_pct": -3.84, "B_psr": 1.0, "B_ic": -0.2, "D_sharpe": 1.3194, "D_sortino": 1.268, "D_excess_sharpe": 2.6388, "D_return_pct": 0.2, "D_hit_rate": 60.0, "D_n": 5, "D_bh_sharpe": -1.3194, "D_bh_return_pct": -0.21, "D_psr": 0.5663, "D_ic": -0.3, "sharpe": 3.7421, "sortino": 3.8425, "return_pct": 0.57, "equity": 1005.7, "max_dd": 0.0, "win_rate": 60.0, "profit_factor": 0.0, "ic": 0.7, "hit": 60.0, "psr": 0.6797, "bh_sharpe": -1.3194, "bh_return_pct": -0.21, "excess_sharpe": 5.0616}, {"fold": "fold_4", "regime": "China devaluation and oil crash", "n": 47, "A_sharpe": -1.7029, "A_sortino": -1.6685, "A_excess_sharpe": 0.1209, "A_return_pct": -8.17, "A_hit_rate": 40.43, "A_n": 47, "A_bh_sharpe": -1.8238, "A_bh_return_pct": -8.68, "A_psr": 0.2326, "A_ic": -0.0064, "B_sharpe": -0.7817, "B_sortino": -0.651, "B_excess_sharpe": 1.4383, "B_return_pct": -11.22, "B_hit_rate": 51.06, "B_n": 47, "B_bh_sharpe": -2.22, "B_bh_return_pct": -23.98, "B_psr": 0.3647, "B_ic": 0.5697, "D_sharpe": -1.9382, "D_sortino": -1.7846, "D_excess_sharpe": -0.1144, "D_return_pct": -9.16, "D_hit_rate": 46.81, "D_n": 47, "D_bh_sharpe": -1.8238, "D_bh_return_pct": -8.68, "D_psr": 0.2035, "D_ic": 0.0661, "sharpe": -1.7029, "sortino": -1.6685, "return_pct": -8.17, "equity": 918.3, "max_dd": 0.0, "win_rate": 40.43, "profit_factor": 0.0, "ic": -0.0064, "hit": 40.43, "psr": 0.2326, "bh_sharpe": -1.8238, "bh_return_pct": -8.68, "excess_sharpe": 0.1209}, {"fold": "fold_5", "regime": "2018 Vol-mageddon + Q4 sell-off", "n": 5, "A_sharpe": -10.1368, "A_sortino": -6.9937, "A_excess_sharpe": 0.0, "A_return_pct": -3.15, "A_hit_rate": 40.0, "A_n": 5, "A_bh_sharpe": -10.1368, "A_bh_return_pct": -3.15, "A_psr": 0.0985, "A_ic": -0.1, "B_sharpe": 5.6858, "B_sortino": 6.0578, "B_excess_sharpe": 0.0, "B_return_pct": 4.22, "B_hit_rate": 60.0, "B_n": 5, "B_bh_sharpe": 5.6858, "B_bh_return_pct": 4.22, "B_psr": 0.753, "B_ic": 0.9, "D_sharpe": -10.1368, "D_sortino": -6.9937, "D_excess_sharpe": 0.0, "D_return_pct": -3.15, "D_hit_rate": 40.0, "D_n": 5, "D_bh_sharpe": -10.1368, "D_bh_return_pct": -3.15, "D_psr": 0.0985, "D_ic": 0.7, "sharpe": -10.1368, "sortino": -6.9937, "return_pct": -3.15, "equity": 968.5, "max_dd": 0.0, "win_rate": 40.0, "profit_factor": 0.0, "ic": -0.1, "hit": 40.0, "psr": 0.0985, "bh_sharpe": -10.1368, "bh_return_pct": -3.15, "excess_sharpe": 0.0}, {"fold": "fold_6", "regime": "COVID crash and V-recovery", "n": 26, "A_sharpe": 1.5563, "A_sortino": 1.7745, "A_excess_sharpe": -1.7289, "A_return_pct": 2.24, "A_hit_rate": 50.0, "A_n": 26, "A_bh_sharpe": 3.2852, "A_bh_return_pct": 4.82, "A_psr": 0.69, "A_ic": 0.1822, "B_sharpe": 1.9809, "B_sortino": 1.9608, "B_excess_sharpe": -10.9983, "B_return_pct": 6.16, "B_hit_rate": 57.69, "B_n": 26, "B_bh_sharpe": 12.9792, "B_bh_return_pct": 38.76, "B_psr": 0.733, "B_ic": 0.3915, "D_sharpe": 5.821, "D_sortino": 8.2176, "D_excess_sharpe": 2.5359, "D_return_pct": 8.41, "D_hit_rate": 53.85, "D_n": 26, "D_bh_sharpe": 3.2852, "D_bh_return_pct": 4.82, "D_psr": 0.9709, "D_ic": 0.4085, "sharpe": 1.5563, "sortino": 1.7745, "return_pct": 2.24, "equity": 1022.4, "max_dd": 0.0, "win_rate": 50.0, "profit_factor": 0.0, "ic": 0.1822, "hit": 50.0, "psr": 0.69, "bh_sharpe": 3.2852, "bh_return_pct": 4.82, "excess_sharpe": -1.7289}, {"fold": "fold_7", "regime": "Inflation bear, AI rally and 2025", "n": 65, "A_sharpe": 1.7214, "A_sortino": 1.857, "A_excess_sharpe": -0.3576, "A_return_pct": 6.68, "A_hit_rate": 55.38, "A_n": 65, "A_bh_sharpe": 2.0789, "A_bh_return_pct": 8.17, "A_psr": 0.8112, "A_ic": 0.2161, "B_sharpe": -3.9497, "B_sortino": -3.8285, "B_excess_sharpe": -9.1811, "B_return_pct": -26.23, "B_hit_rate": 33.85, "B_n": 65, "B_bh_sharpe": 5.2314, "B_bh_return_pct": 44.53, "B_psr": 0.0254, "B_ic": 0.1343, "D_sharpe": -1.2876, "D_sortino": -1.147, "D_excess_sharpe": -3.3665, "D_return_pct": -5.24, "D_hit_rate": 50.77, "D_n": 65, "D_bh_sharpe": 2.0789, "D_bh_return_pct": 8.17, "D_psr": 0.2553, "D_ic": 0.1704, "sharpe": 1.7214, "sortino": 1.857, "return_pct": 6.68, "equity": 1066.8, "max_dd": 0.0, "win_rate": 55.38, "profit_factor": 0.0, "ic": 0.2161, "hit": 55.38, "psr": 0.8112, "bh_sharpe": 2.0789, "bh_return_pct": 8.17, "excess_sharpe": -0.3576}], "status": "DISCARD", "precision": 0.6005, "recall": 0.4209, "f1": 0.4949, "f2": 0.4477, "accuracy": 0.4911, "mcc": 0.014, "tp": 266, "fp": 177, "tn": 258, "fn": 366, "test_sharpe": 0.743, "A_sharpe": 0.743, "A_excess_sharpe": -0.4763, "A_return_pct": 82.62, "A_precision": 0.6005, "A_recall": 0.4209, "A_f1": 0.4949, "A_f2": 0.4477, "A_accuracy": 0.4911, "A_mcc": 0.014, "A_tp": 266, "A_fp": 177, "A_tn": 258, "A_fn": 366, "A_psr": 0.939, "A_ic": 0.039, "A_hit_rate": 49.06, "A_bh_sharpe": 1.2194, "A_bh_return_pct": 187.05}
