{"experiment_num": 21, "backbone": "mamba", "description": "dMamba @ FX-Mamba-winner config seed=7 \u2014 4th seed (after 42=+0.86, 0=+0.02, 99=-0.86). Building toward seed-ensemble (rank-avg across all dMamba seeds = mean ~+0.5 stable signal).", "config": {"seq_len": 60, "lr": 0.0005, "batch_size": 32, "epochs": 100, "weight_decay": 0.1, "patience": 20, "warmup_epochs": 10, "head_dropout": 0.1, "huber_delta": 1.0, "grad_clip": 1.0, "seed": 7, "hidden_size": null, "num_layers": null, "max_depth": null, "gbm_lr": null, "n_estimators": null}, "composite": -0.523, "test_pos_folds": 3, "val_pos_folds": 3, "val_loss": -2.8581053809782047, "elapsed_sec": 733.4, "timestamp": "2026-04-26T23:03:54", "sharpe": -0.123, "val_sharpe": 0.0505, "ic": -0.0557, "hit": 49.39, "psr": 0.4006, "equity": 799.3, "return_pct": -20.07, "bh_sharpe": 1.2201, "bh_return_pct": 185.59, "excess_sharpe": -1.3431, "B_sharpe": -0.5837, "B_excess_sharpe": -3.4221, "B_return_pct": -79.78, "D_sharpe": -0.123, "D_excess_sharpe": -1.3431, "D_return_pct": -20.07, "per_window": [{"fold": "fold_1", "regime": "GFC peak crash (Lehman + Mar-2009 bottom)", "n": 65, "A_sharpe": 0.691, "A_sortino": 0.811, "A_excess_sharpe": 0.2648, "A_return_pct": 5.0, "A_hit_rate": 43.08, "A_n": 65, "A_bh_sharpe": 0.4262, "A_bh_return_pct": 2.34, "A_psr": 0.6369, "A_ic": -0.0804, "B_sharpe": 1.6525, "B_sortino": 1.7529, "B_excess_sharpe": -0.2352, "B_return_pct": 28.44, "B_hit_rate": 53.12, "B_n": 65, "B_bh_sharpe": 1.8877, "B_bh_return_pct": 34.48, "B_psr": 0.7982, "B_ic": 0.0708, "D_sharpe": 0.691, "D_sortino": 0.811, "D_excess_sharpe": 0.2648, "D_return_pct": 5.0, "D_hit_rate": 43.08, "D_n": 65, "D_bh_sharpe": 0.4262, "D_bh_return_pct": 2.34, "D_psr": 0.6369, "D_ic": -0.0804, "sharpe": 0.691, "sortino": 0.811, "return_pct": 5.0, "equity": 1050.0, "max_dd": 0.0, "win_rate": 43.08, "profit_factor": 0.0, "ic": -0.0804, "hit": 43.08, "psr": 0.6369, "bh_sharpe": 0.4262, "bh_return_pct": 2.34, "excess_sharpe": 0.2648, "precision": 0.4545, "recall": 0.4412, "f1": 0.4478, "f2": 0.4438, "accuracy": 0.4308, "mcc": -0.1393, "tp": 15, "fp": 18, "tn": 13, "fn": 19, "A_precision": 0.4545, "A_recall": 0.4412, "A_f1": 0.4478, "A_f2": 0.4438, "A_accuracy": 0.4308, "A_mcc": -0.1393, "A_tp": 15, "A_fp": 18, "A_tn": 13, "A_fn": 19}, {"fold": "fold_2", "regime": "2011 US-downgrade + EU debt", "n": 86, "A_sharpe": 4.2417, "A_sortino": 5.1213, "A_excess_sharpe": -0.6265, "A_return_pct": 24.14, "A_hit_rate": 62.35, "A_n": 86, "A_bh_sharpe": 4.8682, "A_bh_return_pct": 27.91, "A_psr": 0.9967, "A_ic": 0.2356, "B_sharpe": 1.0063, "B_sortino": 1.2283, "B_excess_sharpe": -10.3127, "B_return_pct": 10.22, "B_hit_rate": 45.35, "B_n": 86, "B_bh_sharpe": 11.3191, "B_bh_return_pct": 186.84, "B_psr": 0.7241, "B_ic": 0.2766, "D_sharpe": 4.2417, "D_sortino": 5.1213, "D_excess_sharpe": -0.6265, "D_return_pct": 24.14, "D_hit_rate": 62.35, "D_n": 86, "D_bh_sharpe": 4.8682, "D_bh_return_pct": 27.91, "D_psr": 0.9967, "D_ic": 0.2356, "sharpe": 4.2417, "sortino": 5.1213, "return_pct": 24.14, "equity": 1241.4, "max_dd": 0.0, "win_rate": 62.35, "profit_factor": 0.0, "ic": 0.2356, "hit": 62.35, "psr": 0.9967, "bh_sharpe": 4.8682, "bh_return_pct": 27.91, "excess_sharpe": -0.6265, "precision": 0.7059, "recall": 0.6792, "f1": 0.6923, "f2": 0.6844, "accuracy": 0.6279, "mcc": 0.2224, "tp": 36, "fp": 15, "tn": 18, "fn": 17, "A_precision": 0.7059, "A_recall": 0.6792, "A_f1": 0.6923, "A_f2": 0.6844, "A_accuracy": 0.6279, "A_mcc": 0.2224, "A_tp": 36, "A_fp": 15, "A_tn": 18, "A_fn": 17}, {"fold": "fold_3", "regime": "Taper tantrum and 2014 H1", "n": 128, "A_sharpe": 1.0768, "A_sortino": 1.0205, "A_excess_sharpe": -0.9821, "A_return_pct": 6.73, "A_hit_rate": 54.33, "A_n": 128, "A_bh_sharpe": 2.0589, "A_bh_return_pct": 13.6, "A_psr": 0.7739, "A_ic": -0.0062, "B_sharpe": -3.2542, "B_sortino": -3.0639, "B_excess_sharpe": -7.7658, "B_return_pct": -33.4, "B_hit_rate": 42.19, "B_n": 128, "B_bh_sharpe": 4.5116, "B_bh_return_pct": 67.92, "B_psr": 0.0122, "B_ic": -0.0525, "D_sharpe": 1.0768, "D_sortino": 1.0205, "D_excess_sharpe": -0.9821, "D_return_pct": 6.73, "D_hit_rate": 54.33, "D_n": 128, "D_bh_sharpe": 2.0589, "D_bh_return_pct": 13.6, "D_psr": 0.7739, "D_ic": -0.0062, "sharpe": 1.0768, "sortino": 1.0205, "return_pct": 6.73, "equity": 1067.3, "max_dd": 0.0, "win_rate": 54.33, "profit_factor": 0.0, "ic": -0.0062, "hit": 54.33, "psr": 0.7739, "bh_sharpe": 2.0589, "bh_return_pct": 13.6, "excess_sharpe": -0.9821, "precision": 0.6, "recall": 0.7692, "f1": 0.6742, "f2": 0.7282, "accuracy": 0.5469, "mcc": -0.0363, "tp": 60, "fp": 40, "tn": 10, "fn": 18, "A_precision": 0.6, "A_recall": 0.7692, "A_f1": 0.6742, "A_f2": 0.7282, "A_accuracy": 0.5469, "A_mcc": -0.0363, "A_tp": 60, "A_fp": 40, "A_tn": 10, "A_fn": 18}, {"fold": "fold_4", "regime": "China devaluation and oil crash", "n": 107, "A_sharpe": -0.6281, "A_sortino": -0.5817, "A_excess_sharpe": 0.1752, "A_return_pct": -6.16, "A_hit_rate": 49.06, "A_n": 107, "A_bh_sharpe": -0.8032, "A_bh_return_pct": -7.58, "A_psr": 0.3406, "A_ic": -0.0187, "B_sharpe": -1.8437, "B_sortino": -1.829, "B_excess_sharpe": 0.1159, "B_return_pct": -32.0, "B_hit_rate": 43.93, "B_n": 107, "B_bh_sharpe": -1.9596, "B_bh_return_pct": -33.47, "B_psr": 0.1182, "B_ic": -0.2732, "D_sharpe": -0.6281, "D_sortino": -0.5817, "D_excess_sharpe": 0.1752, "D_return_pct": -6.16, "D_hit_rate": 49.06, "D_n": 107, "D_bh_sharpe": -0.8032, "D_bh_return_pct": -7.58, "D_psr": 0.3406, "D_ic": -0.0187, "sharpe": -0.6281, "sortino": -0.5817, "return_pct": -6.16, "equity": 938.4, "max_dd": 0.0, "win_rate": 49.06, "profit_factor": 0.0, "ic": -0.0187, "hit": 49.06, "psr": 0.3406, "bh_sharpe": -0.8032, "bh_return_pct": -7.58, "excess_sharpe": 0.1752, "precision": 0.4861, "recall": 0.6731, "f1": 0.5645, "f2": 0.625, "accuracy": 0.4953, "mcc": 0.0004, "tp": 35, "fp": 37, "tn": 18, "fn": 17, "A_precision": 0.4861, "A_recall": 0.6731, "A_f1": 0.5645, "A_f2": 0.625, "A_accuracy": 0.4953, "A_mcc": 0.0004, "A_tp": 35, "A_fp": 37, "A_tn": 18, "A_fn": 17}, {"fold": "fold_5", "regime": "2018 Vol-mageddon + Q4 sell-off", "n": 127, "A_sharpe": -0.0439, "A_sortino": -0.0483, "A_excess_sharpe": -1.2269, "A_return_pct": -1.92, "A_hit_rate": 48.03, "A_n": 127, "A_bh_sharpe": 1.183, "A_bh_return_pct": 13.55, "A_psr": 0.4876, "A_ic": -0.1468, "B_sharpe": 0.0848, "B_sortino": 0.0993, "B_excess_sharpe": -2.8208, "B_return_pct": -3.42, "B_hit_rate": 41.27, "B_n": 127, "B_bh_sharpe": 2.9056, "B_bh_return_pct": 85.51, "B_psr": 0.5239, "B_ic": 0.0728, "D_sharpe": -0.0439, "D_sortino": -0.0483, "D_excess_sharpe": -1.2269, "D_return_pct": -1.92, "D_hit_rate": 48.03, "D_n": 127, "D_bh_sharpe": 1.183, "D_bh_return_pct": 13.55, "D_psr": 0.4876, "D_ic": -0.1468, "sharpe": -0.0439, "sortino": -0.0483, "return_pct": -1.92, "equity": 980.8, "max_dd": 0.0, "win_rate": 48.03, "profit_factor": 0.0, "ic": -0.1468, "hit": 48.03, "psr": 0.4876, "bh_sharpe": 1.183, "bh_return_pct": 13.55, "excess_sharpe": -1.2269, "precision": 0.5638, "recall": 0.6795, "f1": 0.6163, "f2": 0.6527, "accuracy": 0.4803, "mcc": -0.1745, "tp": 53, "fp": 41, "tn": 8, "fn": 25, "A_precision": 0.5638, "A_recall": 0.6795, "A_f1": 0.6163, "A_f2": 0.6527, "A_accuracy": 0.4803, "A_mcc": -0.1745, "A_tp": 53, "A_fp": 41, "A_tn": 8, "A_fn": 25}, {"fold": "fold_6", "regime": "COVID crash and V-recovery", "n": 172, "A_sharpe": -0.8846, "A_sortino": -0.9186, "A_excess_sharpe": -3.3122, "A_return_pct": -15.35, "A_hit_rate": 42.44, "A_n": 172, "A_bh_sharpe": 2.4276, "A_bh_return_pct": 45.89, "A_psr": 0.2331, "A_ic": 0.0182, "B_sharpe": -0.8713, "B_sortino": -0.9076, "B_excess_sharpe": -6.5833, "B_return_pct": -32.21, "B_hit_rate": 46.2, "B_n": 172, "B_bh_sharpe": 5.712, "B_bh_return_pct": 489.18, "B_psr": 0.2387, "B_ic": 0.0547, "D_sharpe": -0.8846, "D_sortino": -0.9186, "D_excess_sharpe": -3.3122, "D_return_pct": -15.35, "D_hit_rate": 42.44, "D_n": 172, "D_bh_sharpe": 2.4276, "D_bh_return_pct": 45.89, "D_psr": 0.2331, "D_ic": 0.0182, "sharpe": -0.8846, "sortino": -0.9186, "return_pct": -15.35, "equity": 846.5, "max_dd": 0.0, "win_rate": 42.44, "profit_factor": 0.0, "ic": 0.0182, "hit": 42.44, "psr": 0.2331, "bh_sharpe": 2.4276, "bh_return_pct": 45.89, "excess_sharpe": -3.3122, "precision": 0.6296, "recall": 0.3009, "f1": 0.4072, "f2": 0.336, "accuracy": 0.4244, "mcc": -0.039, "tp": 34, "fp": 20, "tn": 39, "fn": 79, "A_precision": 0.6296, "A_recall": 0.3009, "A_f1": 0.4072, "A_f2": 0.336, "A_accuracy": 0.4244, "A_mcc": -0.039, "A_tp": 34, "A_fp": 20, "A_tn": 39, "A_fn": 79}, {"fold": "fold_7", "regime": "Inflation bear, AI rally and 2025", "n": 375, "A_sharpe": -0.8002, "A_sortino": -0.7927, "A_excess_sharpe": -1.5906, "A_return_pct": -26.26, "A_hit_rate": 49.6, "A_n": 375, "A_bh_sharpe": 0.7905, "A_bh_return_pct": 25.44, "A_psr": 0.1711, "A_ic": -0.0869, "B_sharpe": -0.8227, "B_sortino": -0.9193, "B_excess_sharpe": -2.7564, "B_return_pct": -51.82, "B_hit_rate": 41.71, "B_n": 375, "B_bh_sharpe": 1.9338, "B_bh_return_pct": 221.94, "B_psr": 0.1619, "B_ic": -0.1152, "D_sharpe": -0.8002, "D_sortino": -0.7927, "D_excess_sharpe": -1.5906, "D_return_pct": -26.26, "D_hit_rate": 49.6, "D_n": 375, "D_bh_sharpe": 0.7905, "D_bh_return_pct": 25.44, "D_psr": 0.1711, "D_ic": -0.0869, "sharpe": -0.8002, "sortino": -0.7927, "return_pct": -26.26, "equity": 737.4000000000001, "max_dd": 0.0, "win_rate": 49.6, "profit_factor": 0.0, "ic": -0.0869, "hit": 49.6, "psr": 0.1711, "bh_sharpe": 0.7905, "bh_return_pct": 25.44, "excess_sharpe": -1.5906, "precision": 0.5771, "recall": 0.5273, "f1": 0.5511, "f2": 0.5365, "accuracy": 0.496, "mcc": -0.0208, "tp": 116, "fp": 85, "tn": 70, "fn": 104, "A_precision": 0.5771, "A_recall": 0.5273, "A_f1": 0.5511, "A_f2": 0.5365, "A_accuracy": 0.496, "A_mcc": -0.0208, "A_tp": 116, "A_fp": 85, "A_tn": 70, "A_fn": 104}], "per_window_val": [{"fold": "fold_1", "regime": "GFC peak crash (Lehman + Mar-2009 bottom)", "n": 37, "A_sharpe": 1.8157, "A_sortino": 2.169, "A_excess_sharpe": 1.0572, "A_return_pct": 6.49, "A_hit_rate": 42.86, "A_n": 37, "A_bh_sharpe": 0.7585, "A_bh_return_pct": 2.39, "A_psr": 0.756, "A_ic": 0.0436, "B_sharpe": 3.4417, "B_sortino": 4.1681, "B_excess_sharpe": 1.2971, "B_return_pct": 20.71, "B_hit_rate": 56.76, "B_n": 37, "B_bh_sharpe": 2.1447, "B_bh_return_pct": 12.13, "B_psr": 0.9154, "B_ic": 0.111, "D_sharpe": 1.8157, "D_sortino": 2.169, "D_excess_sharpe": 1.0572, "D_return_pct": 6.49, "D_hit_rate": 42.86, "D_n": 37, "D_bh_sharpe": 0.7585, "D_bh_return_pct": 2.39, "D_psr": 0.756, "D_ic": 0.0436, "sharpe": 1.8157, "sortino": 2.169, "return_pct": 6.49, "equity": 1064.8999999999999, "max_dd": 0.0, "win_rate": 42.86, "profit_factor": 0.0, "ic": 0.0436, "hit": 42.86, "psr": 0.756, "bh_sharpe": 0.7585, "bh_return_pct": 2.39, "excess_sharpe": 1.0572}, {"fold": "fold_2", "regime": "2011 US-downgrade + EU debt", "n": 46, "A_sharpe": -0.1119, "A_sortino": -0.1061, "A_excess_sharpe": -0.0581, "A_return_pct": -1.82, "A_hit_rate": 52.17, "A_n": 46, "A_bh_sharpe": -0.0539, "A_bh_return_pct": -1.46, "A_psr": 0.4811, "A_ic": 0.0883, "B_sharpe": 0.6172, "B_sortino": 0.5917, "B_excess_sharpe": 2.1585, "B_return_pct": 3.27, "B_hit_rate": 52.17, "B_n": 46, "B_bh_sharpe": -1.5413, "B_bh_return_pct": -23.36, "B_psr": 0.602, "B_ic": 0.2511, "D_sharpe": -0.1119, "D_sortino": -0.1061, "D_excess_sharpe": -0.0581, "D_return_pct": -1.82, "D_hit_rate": 52.17, "D_n": 46, "D_bh_sharpe": -0.0539, "D_bh_return_pct": -1.46, "D_psr": 0.4811, "D_ic": 0.0883, "sharpe": -0.1119, "sortino": -0.1061, "return_pct": -1.82, "equity": 981.8, "max_dd": 0.0, "win_rate": 52.17, "profit_factor": 0.0, "ic": 0.0883, "hit": 52.17, "psr": 0.4811, "bh_sharpe": -0.0539, "bh_return_pct": -1.46, "excess_sharpe": -0.0581}, {"fold": "fold_3", "regime": "Taper tantrum and 2014 H1", "n": 4, "A_sharpe": -8.1652, "A_sortino": -6.9337, "A_excess_sharpe": -14.4878, "A_return_pct": -0.72, "A_hit_rate": 25.0, "A_n": 4, "A_bh_sharpe": 6.3226, "A_bh_return_pct": 0.58, "A_psr": 0.1779, "A_ic": -0.4, "B_sharpe": 23.4413, "B_sortino": 0.0, "B_excess_sharpe": 46.8826, "B_return_pct": 3.19, "B_hit_rate": 100.0, "B_n": 4, "B_bh_sharpe": -23.4413, "B_bh_return_pct": -3.13, "B_psr": 1.0, "B_ic": -0.2, "D_sharpe": -8.1652, "D_sortino": -6.9337, "D_excess_sharpe": -14.4878, "D_return_pct": -0.72, "D_hit_rate": 25.0, "D_n": 4, "D_bh_sharpe": 6.3226, "D_bh_return_pct": 0.58, "D_psr": 0.1779, "D_ic": -0.4, "sharpe": -8.1652, "sortino": -6.9337, "return_pct": -0.72, "equity": 992.8000000000001, "max_dd": 0.0, "win_rate": 25.0, "profit_factor": 0.0, "ic": -0.4, "hit": 25.0, "psr": 0.1779, "bh_sharpe": 6.3226, "bh_return_pct": 0.58, "excess_sharpe": -14.4878}, {"fold": "fold_4", "regime": "China devaluation and oil crash", "n": 46, "A_sharpe": 0.8583, "A_sortino": 0.8248, "A_excess_sharpe": 2.0605, "A_return_pct": 3.31, "A_hit_rate": 54.35, "A_n": 46, "A_bh_sharpe": -1.2022, "A_bh_return_pct": -5.68, "A_psr": 0.6407, "A_ic": 0.108, "B_sharpe": 0.373, "B_sortino": 0.2955, "B_excess_sharpe": 2.6847, "B_return_pct": 0.69, "B_hit_rate": 56.52, "B_n": 46, "B_bh_sharpe": -2.3118, "B_bh_return_pct": -24.51, "B_psr": 0.5615, "B_ic": 0.4033, "D_sharpe": 0.8583, "D_sortino": 0.8248, "D_excess_sharpe": 2.0605, "D_return_pct": 3.31, "D_hit_rate": 54.35, "D_n": 46, "D_bh_sharpe": -1.2022, "D_bh_return_pct": -5.68, "D_psr": 0.6407, "D_ic": 0.108, "sharpe": 0.8583, "sortino": 0.8248, "return_pct": 3.31, "equity": 1033.1, "max_dd": 0.0, "win_rate": 54.35, "profit_factor": 0.0, "ic": 0.108, "hit": 54.35, "psr": 0.6407, "bh_sharpe": -1.2022, "bh_return_pct": -5.68, "excess_sharpe": 2.0605}, {"fold": "fold_5", "regime": "2018 Vol-mageddon + Q4 sell-off", "n": 4, "A_sharpe": -2.153, "A_sortino": -1.9225, "A_excess_sharpe": 12.6021, "A_return_pct": -0.73, "A_hit_rate": 50.0, "A_n": 4, "A_bh_sharpe": -14.7551, "A_bh_return_pct": -3.52, "A_psr": 0.407, "A_ic": 0.4, "B_sharpe": -2.1566, "B_sortino": -2.0033, "B_excess_sharpe": -4.3132, "B_return_pct": -1.41, "B_hit_rate": 50.0, "B_n": 4, "B_bh_sharpe": 2.1566, "B_bh_return_pct": 1.19, "B_psr": 0.4075, "B_ic": -1.0, "D_sharpe": -2.153, "D_sortino": -1.9225, "D_excess_sharpe": 12.6021, "D_return_pct": -0.73, "D_hit_rate": 50.0, "D_n": 4, "D_bh_sharpe": -14.7551, "D_bh_return_pct": -3.52, "D_psr": 0.407, "D_ic": 0.4, "sharpe": -2.153, "sortino": -1.9225, "return_pct": -0.73, "equity": 992.7, "max_dd": 0.0, "win_rate": 50.0, "profit_factor": 0.0, "ic": 0.4, "hit": 50.0, "psr": 0.407, "bh_sharpe": -14.7551, "bh_return_pct": -3.52, "excess_sharpe": 12.6021}, {"fold": "fold_6", "regime": "COVID crash and V-recovery", "n": 25, "A_sharpe": 0.8017, "A_sortino": 0.66, "A_excess_sharpe": -1.6121, "A_return_pct": 1.02, "A_hit_rate": 60.0, "A_n": 25, "A_bh_sharpe": 2.4138, "A_bh_return_pct": 3.27, "A_psr": 0.596, "A_ic": -0.1962, "B_sharpe": -12.5655, "B_sortino": -9.4213, "B_excess_sharpe": -25.1309, "B_return_pct": -25.32, "B_hit_rate": 20.0, "B_n": 25, "B_bh_sharpe": 12.5655, "B_bh_return_pct": 32.76, "B_psr": 0.001, "B_ic": -0.1892, "D_sharpe": 0.8017, "D_sortino": 0.66, "D_excess_sharpe": -1.6121, "D_return_pct": 1.02, "D_hit_rate": 60.0, "D_n": 25, "D_bh_sharpe": 2.4138, "D_bh_return_pct": 3.27, "D_psr": 0.596, "D_ic": -0.1962, "sharpe": 0.8017, "sortino": 0.66, "return_pct": 1.02, "equity": 1010.1999999999999, "max_dd": 0.0, "win_rate": 60.0, "profit_factor": 0.0, "ic": -0.1962, "hit": 60.0, "psr": 0.596, "bh_sharpe": 2.4138, "bh_return_pct": 3.27, "excess_sharpe": -1.6121}, {"fold": "fold_7", "regime": "Inflation bear, AI rally and 2025", "n": 64, "A_sharpe": -2.1772, "A_sortino": -2.0243, "A_excess_sharpe": -4.2181, "A_return_pct": -8.39, "A_hit_rate": 43.75, "A_n": 64, "A_bh_sharpe": 2.0409, "A_bh_return_pct": 7.94, "A_psr": 0.1337, "A_ic": -0.2053, "B_sharpe": -4.1352, "B_sortino": -4.018, "B_excess_sharpe": -9.5444, "B_return_pct": -26.97, "B_hit_rate": 35.94, "B_n": 64, "B_bh_sharpe": 5.4092, "B_bh_return_pct": 45.7, "B_psr": 0.0243, "B_ic": -0.1755, "D_sharpe": -2.1772, "D_sortino": -2.0243, "D_excess_sharpe": -4.2181, "D_return_pct": -8.39, "D_hit_rate": 43.75, "D_n": 64, "D_bh_sharpe": 2.0409, "D_bh_return_pct": 7.94, "D_psr": 0.1337, "D_ic": -0.2053, "sharpe": -2.1772, "sortino": -2.0243, "return_pct": -8.39, "equity": 916.1, "max_dd": 0.0, "win_rate": 43.75, "profit_factor": 0.0, "ic": -0.2053, "hit": 43.75, "psr": 0.1337, "bh_sharpe": 2.0409, "bh_return_pct": 7.94, "excess_sharpe": -4.2181}], "status": "DISCARD", "precision": 0.5769, "recall": 0.5557, "f1": 0.5661, "f2": 0.5598, "accuracy": 0.4953, "mcc": -0.0366, "tp": 349, "fp": 256, "tn": 176, "fn": 279, "test_sharpe": -0.123, "A_sharpe": -0.123, "A_excess_sharpe": -1.3431, "A_return_pct": -20.07, "A_precision": 0.5769, "A_recall": 0.5557, "A_f1": 0.5661, "A_f2": 0.5598, "A_accuracy": 0.4953, "A_mcc": -0.0366, "A_tp": 349, "A_fp": 256, "A_tn": 176, "A_fn": 279, "A_psr": 0.4006, "A_ic": -0.0557, "A_hit_rate": 49.39, "A_bh_sharpe": 1.2201, "A_bh_return_pct": 185.59}
