{"experiment_num": 45, "backbone": "xgboost", "description": "XGBoost @ exp 44 lr=0.01 (down from 0.02) - extending lower-lr trend", "config": {"seq_len": 60, "lr": 0.0003, "batch_size": 32, "epochs": 50, "weight_decay": 1e-05, "patience": 10, "warmup_epochs": 0, "head_dropout": 0.1, "huber_delta": 1.0, "grad_clip": 1.0, "seed": 42, "hidden_size": null, "num_layers": null, "max_depth": 4, "gbm_lr": 0.01, "n_estimators": 100}, "composite": -1.066, "test_pos_folds": 5, "val_pos_folds": 2, "val_loss": null, "elapsed_sec": 75.8, "timestamp": "2026-04-27T19:05:47", "sharpe": 0.8788, "val_sharpe": -0.866, "ic": 0.0329, "hit": 54.14, "psr": 0.9663, "equity": 2078.2, "return_pct": 107.82, "bh_sharpe": 1.2194, "bh_return_pct": 187.05, "excess_sharpe": -0.3405, "B_sharpe": 1.1598, "B_excess_sharpe": -1.6684, "B_return_pct": 517.74, "D_sharpe": 0.4012, "D_excess_sharpe": -0.8182, "D_return_pct": 31.7, "per_window": [{"fold": "fold_1", "regime": "GFC peak crash (Lehman + Mar-2009 bottom)", "n": 66, "A_sharpe": 3.6384, "A_sortino": 4.3186, "A_excess_sharpe": 3.0663, "A_return_pct": 39.06, "A_hit_rate": 56.06, "A_n": 66, "A_bh_sharpe": 0.5721, "A_bh_return_pct": 3.85, "A_psr": 0.9709, "A_ic": 0.1748, "B_sharpe": 4.301, "B_sortino": 4.6171, "B_excess_sharpe": 2.2541, "B_return_pct": 113.22, "B_hit_rate": 60.0, "B_n": 66, "B_bh_sharpe": 2.0469, "B_bh_return_pct": 39.28, "B_psr": 0.9837, "B_ic": 0.3255, "D_sharpe": 2.2577, "D_sortino": 2.5343, "D_excess_sharpe": 1.6856, "D_return_pct": 22.27, "D_hit_rate": 54.55, "D_n": 66, "D_bh_sharpe": 0.5721, "D_bh_return_pct": 3.85, "D_psr": 0.8782, "D_ic": 0.2272, "sharpe": 3.6384, "sortino": 4.3186, "return_pct": 39.06, "equity": 1390.6000000000001, "max_dd": 0.0, "win_rate": 56.06, "profit_factor": 0.0, "ic": 0.1748, "hit": 56.06, "psr": 0.9709, "bh_sharpe": 0.5721, "bh_return_pct": 3.85, "excess_sharpe": 3.0663, "precision": 0.6, "recall": 0.5143, "f1": 0.5538, "f2": 0.5294, "accuracy": 0.5606, "mcc": 0.1275, "tp": 18, "fp": 12, "tn": 19, "fn": 17, "A_precision": 0.6, "A_recall": 0.5143, "A_f1": 0.5538, "A_f2": 0.5294, "A_accuracy": 0.5606, "A_mcc": 0.1275, "A_tp": 18, "A_fp": 12, "A_tn": 19, "A_fn": 17}, {"fold": "fold_2", "regime": "2011 US-downgrade + EU debt", "n": 87, "A_sharpe": 4.057, "A_sortino": 5.7368, "A_excess_sharpe": -0.965, "A_return_pct": 23.34, "A_hit_rate": 55.81, "A_n": 87, "A_bh_sharpe": 5.022, "A_bh_return_pct": 29.23, "A_psr": 0.9964, "A_ic": -0.007, "B_sharpe": 10.4651, "B_sortino": 9.4401, "B_excess_sharpe": -0.6718, "B_return_pct": 172.98, "B_hit_rate": 81.61, "B_n": 87, "B_bh_sharpe": 11.1369, "B_bh_return_pct": 185.4, "B_psr": 1.0, "B_ic": 0.0533, "D_sharpe": 4.8753, "D_sortino": 5.9795, "D_excess_sharpe": -0.1467, "D_return_pct": 28.33, "D_hit_rate": 63.95, "D_n": 87, "D_bh_sharpe": 5.022, "D_bh_return_pct": 29.23, "D_psr": 0.9993, "D_ic": -0.04, "sharpe": 4.057, "sortino": 5.7368, "return_pct": 23.34, "equity": 1233.4, "max_dd": 0.0, "win_rate": 55.81, "profit_factor": 0.0, "ic": -0.007, "hit": 55.81, "psr": 0.9964, "bh_sharpe": 5.022, "bh_return_pct": 29.23, "excess_sharpe": -0.965, "precision": 0.6111, "recall": 0.8148, "f1": 0.6984, "f2": 0.7639, "accuracy": 0.5632, "mcc": -0.0432, "tp": 44, "fp": 28, "tn": 5, "fn": 10, "A_precision": 0.6111, "A_recall": 0.8148, "A_f1": 0.6984, "A_f2": 0.7639, "A_accuracy": 0.5632, "A_mcc": -0.0432, "A_tp": 44, "A_fp": 28, "A_tn": 5, "A_fn": 10}, {"fold": "fold_3", "regime": "Taper tantrum and 2014 H1", "n": 129, "A_sharpe": 1.8573, "A_sortino": 1.5343, "A_excess_sharpe": 0.0895, "A_return_pct": 12.41, "A_hit_rate": 61.72, "A_n": 129, "A_bh_sharpe": 1.7678, "A_bh_return_pct": 11.76, "A_psr": 0.8927, "A_ic": 0.1102, "B_sharpe": 4.2474, "B_sortino": 4.2072, "B_excess_sharpe": 0.0, "B_return_pct": 64.1, "B_hit_rate": 63.57, "B_n": 129, "B_bh_sharpe": 4.2474, "B_bh_return_pct": 64.1, "B_psr": 0.9981, "B_ic": -0.0544, "D_sharpe": 1.7678, "D_sortino": 1.4748, "D_excess_sharpe": 0.0, "D_return_pct": 11.76, "D_hit_rate": 60.94, "D_n": 129, "D_bh_sharpe": 1.7678, "D_bh_return_pct": 11.76, "D_psr": 0.8822, "D_ic": 0.0766, "sharpe": 1.8573, "sortino": 1.5343, "return_pct": 12.41, "equity": 1124.1000000000001, "max_dd": 0.0, "win_rate": 61.72, "profit_factor": 0.0, "ic": 0.1102, "hit": 61.72, "psr": 0.8927, "bh_sharpe": 1.7678, "bh_return_pct": 11.76, "excess_sharpe": 0.0895, "precision": 0.6094, "recall": 1.0, "f1": 0.7573, "f2": 0.8864, "accuracy": 0.6124, "mcc": 0.1093, "tp": 78, "fp": 50, "tn": 1, "fn": 0, "A_precision": 0.6094, "A_recall": 1.0, "A_f1": 0.7573, "A_f2": 0.8864, "A_accuracy": 0.6124, "A_mcc": 0.1093, "A_tp": 78, "A_fp": 50, "A_tn": 1, "A_fn": 0}, {"fold": "fold_4", "regime": "China devaluation and oil crash", "n": 108, "A_sharpe": -0.4132, "A_sortino": -0.3901, "A_excess_sharpe": 0.2766, "A_return_pct": -4.42, "A_hit_rate": 49.53, "A_n": 108, "A_bh_sharpe": -0.6898, "A_bh_return_pct": -6.71, "A_psr": 0.3935, "A_ic": 0.0099, "B_sharpe": -1.1402, "B_sortino": -1.0131, "B_excess_sharpe": 0.8173, "B_return_pct": -22.65, "B_hit_rate": 49.07, "B_n": 108, "B_bh_sharpe": -1.9575, "B_bh_return_pct": -33.56, "B_psr": 0.224, "B_ic": -0.0224, "D_sharpe": -1.0728, "D_sortino": -0.9764, "D_excess_sharpe": -0.383, "D_return_pct": -9.77, "D_hit_rate": 49.53, "D_n": 108, "D_bh_sharpe": -0.6898, "D_bh_return_pct": -6.71, "D_psr": 0.2399, "D_ic": -0.032, "sharpe": -0.4132, "sortino": -0.3901, "return_pct": -4.42, "equity": 955.8, "max_dd": 0.0, "win_rate": 49.53, "profit_factor": 0.0, "ic": 0.0099, "hit": 49.53, "psr": 0.3935, "bh_sharpe": -0.6898, "bh_return_pct": -6.71, "excess_sharpe": 0.2766, "precision": 0.4937, "recall": 0.7358, "f1": 0.5909, "f2": 0.6701, "accuracy": 0.5, "mcc": 0.0097, "tp": 39, "fp": 40, "tn": 15, "fn": 14, "A_precision": 0.4937, "A_recall": 0.7358, "A_f1": 0.5909, "A_f2": 0.6701, "A_accuracy": 0.5, "A_mcc": 0.0097, "A_tp": 39, "A_fp": 40, "A_tn": 15, "A_fn": 14}, {"fold": "fold_5", "regime": "2018 Vol-mageddon + Q4 sell-off", "n": 128, "A_sharpe": 0.5131, "A_sortino": 0.4953, "A_excess_sharpe": -0.638, "A_return_pct": 4.86, "A_hit_rate": 55.47, "A_n": 128, "A_bh_sharpe": 1.1511, "A_bh_return_pct": 13.19, "A_psr": 0.6425, "A_ic": -0.0054, "B_sharpe": -1.2823, "B_sortino": -1.221, "B_excess_sharpe": -4.0942, "B_return_pct": -30.13, "B_hit_rate": 46.46, "B_n": 128, "B_bh_sharpe": 2.8119, "B_bh_return_pct": 82.25, "B_psr": 0.1796, "B_ic": -0.1237, "D_sharpe": -0.5673, "D_sortino": -0.5542, "D_excess_sharpe": -1.7184, "D_return_pct": -7.91, "D_hit_rate": 51.56, "D_n": 128, "D_bh_sharpe": 1.1511, "D_bh_return_pct": 13.19, "D_psr": 0.3446, "D_ic": -0.0607, "sharpe": 0.5131, "sortino": 0.4953, "return_pct": 4.86, "equity": 1048.6, "max_dd": 0.0, "win_rate": 55.47, "profit_factor": 0.0, "ic": -0.0054, "hit": 55.47, "psr": 0.6425, "bh_sharpe": 1.1511, "bh_return_pct": 13.19, "excess_sharpe": -0.638, "precision": 0.6129, "recall": 0.7308, "f1": 0.6667, "f2": 0.7037, "accuracy": 0.5547, "mcc": 0.0118, "tp": 57, "fp": 36, "tn": 14, "fn": 21, "A_precision": 0.6129, "A_recall": 0.7308, "A_f1": 0.6667, "A_f2": 0.7037, "A_accuracy": 0.5547, "A_mcc": 0.0118, "A_tp": 57, "A_fp": 36, "A_tn": 14, "A_fn": 21}, {"fold": "fold_6", "regime": "COVID crash and V-recovery", "n": 173, "A_sharpe": 1.6809, "A_sortino": 1.7107, "A_excess_sharpe": -0.6452, "A_return_pct": 29.49, "A_hit_rate": 55.49, "A_n": 173, "A_bh_sharpe": 2.3261, "A_bh_return_pct": 43.81, "A_psr": 0.916, "A_ic": 0.0982, "B_sharpe": -0.2546, "B_sortino": -0.2523, "B_excess_sharpe": -6.0006, "B_return_pct": -16.21, "B_hit_rate": 48.84, "B_n": 173, "B_bh_sharpe": 5.746, "B_bh_return_pct": 499.04, "B_psr": 0.4166, "B_ic": 0.0117, "D_sharpe": 0.2528, "D_sortino": 0.2521, "D_excess_sharpe": -2.0733, "D_return_pct": 2.21, "D_hit_rate": 51.45, "D_n": 173, "D_bh_sharpe": 2.3261, "D_bh_return_pct": 43.81, "D_psr": 0.5826, "D_ic": -0.0485, "sharpe": 1.6809, "sortino": 1.7107, "return_pct": 29.49, "equity": 1294.8999999999999, "max_dd": 0.0, "win_rate": 55.49, "profit_factor": 0.0, "ic": 0.0982, "hit": 55.49, "psr": 0.916, "bh_sharpe": 2.3261, "bh_return_pct": 43.81, "excess_sharpe": -0.6452, "precision": 0.6731, "recall": 0.6195, "f1": 0.6452, "f2": 0.6295, "accuracy": 0.5549, "mcc": 0.0513, "tp": 70, "fp": 34, "tn": 26, "fn": 43, "A_precision": 0.6731, "A_recall": 0.6195, "A_f1": 0.6452, "A_f2": 0.6295, "A_accuracy": 0.5549, "A_mcc": 0.0513, "A_tp": 70, "A_fp": 34, "A_tn": 26, "A_fn": 43}, {"fold": "fold_7", "regime": "Inflation bear, AI rally and 2025", "n": 376, "A_sharpe": -0.4431, "A_sortino": -0.4446, "A_excess_sharpe": -1.2464, "A_return_pct": -16.94, "A_hit_rate": 51.06, "A_n": 376, "A_bh_sharpe": 0.8033, "A_bh_return_pct": 26.02, "A_psr": 0.2973, "A_ic": -0.0099, "B_sharpe": 0.7452, "B_sortino": 0.815, "B_excess_sharpe": -1.1864, "B_return_pct": 42.81, "B_hit_rate": 48.53, "B_n": 376, "B_bh_sharpe": 1.9317, "B_bh_return_pct": 222.05, "B_psr": 0.8198, "B_ic": 0.0075, "D_sharpe": -0.2543, "D_sortino": -0.2796, "D_excess_sharpe": -1.0576, "D_return_pct": -11.58, "D_hit_rate": 42.29, "D_n": 376, "D_bh_sharpe": 0.8033, "D_bh_return_pct": 26.02, "D_psr": 0.3777, "D_ic": -0.0182, "sharpe": -0.4431, "sortino": -0.4446, "return_pct": -16.94, "equity": 830.6, "max_dd": 0.0, "win_rate": 51.06, "profit_factor": 0.0, "ic": -0.0099, "hit": 51.06, "psr": 0.2973, "bh_sharpe": 0.8033, "bh_return_pct": 26.02, "excess_sharpe": -1.2464, "precision": 0.592, "recall": 0.5385, "f1": 0.564, "f2": 0.5484, "accuracy": 0.5106, "mcc": 0.0093, "tp": 119, "fp": 82, "tn": 73, "fn": 102, "A_precision": 0.592, "A_recall": 0.5385, "A_f1": 0.564, "A_f2": 0.5484, "A_accuracy": 0.5106, "A_mcc": 0.0093, "A_tp": 119, "A_fp": 82, "A_tn": 73, "A_fn": 102}], "per_window_val": [{"fold": "fold_1", "regime": "GFC peak crash (Lehman + Mar-2009 bottom)", "n": 65, "A_sharpe": -1.7571, "A_sortino": -1.7312, "A_excess_sharpe": 0.4686, "A_return_pct": -15.4, "A_hit_rate": 46.03, "A_n": 65, "A_bh_sharpe": -2.2257, "A_bh_return_pct": -18.74, "A_psr": 0.197, "A_ic": -0.0042, "B_sharpe": -6.0372, "B_sortino": -4.8747, "B_excess_sharpe": 1.0851, "B_return_pct": -68.33, "B_hit_rate": 36.92, "B_n": 65, "B_bh_sharpe": -7.1223, "B_bh_return_pct": -73.11, "B_psr": 0.0002, "B_ic": 0.044, "D_sharpe": -2.9022, "D_sortino": -2.4362, "D_excess_sharpe": -0.6766, "D_return_pct": -23.23, "D_hit_rate": 44.44, "D_n": 65, "D_bh_sharpe": -2.2257, "D_bh_return_pct": -18.74, "D_psr": 0.0557, "D_ic": 0.0771, "sharpe": -1.7571, "sortino": -1.7312, "return_pct": -15.4, "equity": 846.0, "max_dd": 0.0, "win_rate": 46.03, "profit_factor": 0.0, "ic": -0.0042, "hit": 46.03, "psr": 0.197, "bh_sharpe": -2.2257, "bh_return_pct": -18.74, "excess_sharpe": 0.4686}, {"fold": "fold_2", "regime": "2011 US-downgrade + EU debt", "n": 47, "A_sharpe": 0.5281, "A_sortino": 0.4679, "A_excess_sharpe": 0.7222, "A_return_pct": 2.31, "A_hit_rate": 57.45, "A_n": 47, "A_bh_sharpe": -0.1941, "A_bh_return_pct": -2.36, "A_psr": 0.5887, "A_ic": 0.0156, "B_sharpe": -1.6123, "B_sortino": -1.4959, "B_excess_sharpe": 0.0, "B_return_pct": -24.3, "B_hit_rate": 44.68, "B_n": 47, "B_bh_sharpe": -1.6123, "B_bh_return_pct": -24.3, "B_psr": 0.2404, "B_ic": 0.5614, "D_sharpe": -0.1941, "D_sortino": -0.1694, "D_excess_sharpe": 0.0, "D_return_pct": -2.36, "D_hit_rate": 55.32, "D_n": 47, "D_bh_sharpe": -0.1941, "D_bh_return_pct": -2.36, "D_psr": 0.4669, "D_ic": 0.1833, "sharpe": 0.5281, "sortino": 0.4679, "return_pct": 2.31, "equity": 1023.0999999999999, "max_dd": 0.0, "win_rate": 57.45, "profit_factor": 0.0, "ic": 0.0156, "hit": 57.45, "psr": 0.5887, "bh_sharpe": -0.1941, "bh_return_pct": -2.36, "excess_sharpe": 0.7222}, {"fold": "fold_3", "regime": "Taper tantrum and 2014 H1", "n": 5, "A_sharpe": -1.3194, "A_sortino": -1.3491, "A_excess_sharpe": 0.0, "A_return_pct": -0.21, "A_hit_rate": 40.0, "A_n": 5, "A_bh_sharpe": -1.3194, "A_bh_return_pct": -0.21, "A_psr": 0.4337, "A_ic": -0.1539, "B_sharpe": -25.8705, "B_sortino": -13.5303, "B_excess_sharpe": 0.0, "B_return_pct": -3.84, "B_hit_rate": 0.0, "B_n": 5, "B_bh_sharpe": -25.8705, "B_bh_return_pct": -3.84, "B_psr": 0.0, "B_ic": -0.2, "D_sharpe": -1.3194, "D_sortino": -1.3491, "D_excess_sharpe": 0.0, "D_return_pct": -0.21, "D_hit_rate": 40.0, "D_n": 5, "D_bh_sharpe": -1.3194, "D_bh_return_pct": -0.21, "D_psr": 0.4337, "D_ic": -0.3, "sharpe": -1.3194, "sortino": -1.3491, "return_pct": -0.21, "equity": 997.9, "max_dd": 0.0, "win_rate": 40.0, "profit_factor": 0.0, "ic": -0.1539, "hit": 40.0, "psr": 0.4337, "bh_sharpe": -1.3194, "bh_return_pct": -0.21, "excess_sharpe": 0.0}, {"fold": "fold_4", "regime": "China devaluation and oil crash", "n": 47, "A_sharpe": -1.8238, "A_sortino": -1.7153, "A_excess_sharpe": 0.0, "A_return_pct": -8.68, "A_hit_rate": 44.68, "A_n": 47, "A_bh_sharpe": -1.8238, "A_bh_return_pct": -8.68, "A_psr": 0.2173, "A_ic": 0.0044, "B_sharpe": -2.22, "B_sortino": -1.9053, "B_excess_sharpe": 0.0, "B_return_pct": -23.98, "B_hit_rate": 44.68, "B_n": 47, "B_bh_sharpe": -2.22, "B_bh_return_pct": -23.98, "B_psr": 0.1505, "B_ic": 0.5138, "D_sharpe": -1.8238, "D_sortino": -1.7153, "D_excess_sharpe": 0.0, "D_return_pct": -8.68, "D_hit_rate": 44.68, "D_n": 47, "D_bh_sharpe": -1.8238, "D_bh_return_pct": -8.68, "D_psr": 0.2173, "D_ic": 0.3536, "sharpe": -1.8238, "sortino": -1.7153, "return_pct": -8.68, "equity": 913.2, "max_dd": 0.0, "win_rate": 44.68, "profit_factor": 0.0, "ic": 0.0044, "hit": 44.68, "psr": 0.2173, "bh_sharpe": -1.8238, "bh_return_pct": -8.68, "excess_sharpe": 0.0}, {"fold": "fold_5", "regime": "2018 Vol-mageddon + Q4 sell-off", "n": 5, "A_sharpe": -10.1368, "A_sortino": -6.9937, "A_excess_sharpe": 0.0, "A_return_pct": -3.15, "A_hit_rate": 40.0, "A_n": 5, "A_bh_sharpe": -10.1368, "A_bh_return_pct": -3.15, "A_psr": 0.0985, "A_ic": -0.3, "B_sharpe": 5.6858, "B_sortino": 6.0578, "B_excess_sharpe": 0.0, "B_return_pct": 4.22, "B_hit_rate": 60.0, "B_n": 5, "B_bh_sharpe": 5.6858, "B_bh_return_pct": 4.22, "B_psr": 0.753, "B_ic": -0.7, "D_sharpe": -10.1368, "D_sortino": -6.9937, "D_excess_sharpe": 0.0, "D_return_pct": -3.15, "D_hit_rate": 40.0, "D_n": 5, "D_bh_sharpe": -10.1368, "D_bh_return_pct": -3.15, "D_psr": 0.0985, "D_ic": -0.9, "sharpe": -10.1368, "sortino": -6.9937, "return_pct": -3.15, "equity": 968.5, "max_dd": 0.0, "win_rate": 40.0, "profit_factor": 0.0, "ic": -0.3, "hit": 40.0, "psr": 0.0985, "bh_sharpe": -10.1368, "bh_return_pct": -3.15, "excess_sharpe": 0.0}, {"fold": "fold_6", "regime": "COVID crash and V-recovery", "n": 26, "A_sharpe": 3.2852, "A_sortino": 3.0777, "A_excess_sharpe": 0.0, "A_return_pct": 4.82, "A_hit_rate": 61.54, "A_n": 26, "A_bh_sharpe": 3.2852, "A_bh_return_pct": 4.82, "A_psr": 0.8369, "A_ic": -0.0688, "B_sharpe": 12.9792, "B_sortino": 13.8608, "B_excess_sharpe": 0.0, "B_return_pct": 38.76, "B_hit_rate": 80.77, "B_n": 26, "B_bh_sharpe": 12.9792, "B_bh_return_pct": 38.76, "B_psr": 0.9998, "B_ic": 0.2882, "D_sharpe": 3.2852, "D_sortino": 3.0777, "D_excess_sharpe": 0.0, "D_return_pct": 4.82, "D_hit_rate": 61.54, "D_n": 26, "D_bh_sharpe": 3.2852, "D_bh_return_pct": 4.82, "D_psr": 0.8369, "D_ic": -0.1282, "sharpe": 3.2852, "sortino": 3.0777, "return_pct": 4.82, "equity": 1048.2, "max_dd": 0.0, "win_rate": 61.54, "profit_factor": 0.0, "ic": -0.0688, "hit": 61.54, "psr": 0.8369, "bh_sharpe": 3.2852, "bh_return_pct": 4.82, "excess_sharpe": 0.0}, {"fold": "fold_7", "regime": "Inflation bear, AI rally and 2025", "n": 65, "A_sharpe": -1.226, "A_sortino": -1.2194, "A_excess_sharpe": -3.3049, "A_return_pct": -5.01, "A_hit_rate": 47.69, "A_n": 65, "A_bh_sharpe": 2.0789, "A_bh_return_pct": 8.17, "A_psr": 0.2709, "A_ic": -0.1941, "B_sharpe": -2.7387, "B_sortino": -2.64, "B_excess_sharpe": -7.9701, "B_return_pct": -19.55, "B_hit_rate": 41.54, "B_n": 65, "B_bh_sharpe": 5.2314, "B_bh_return_pct": 44.53, "B_psr": 0.0868, "B_ic": 0.0694, "D_sharpe": -0.495, "D_sortino": -0.4558, "D_excess_sharpe": -2.5739, "D_return_pct": -2.24, "D_hit_rate": 52.31, "D_n": 65, "D_bh_sharpe": 2.0789, "D_bh_return_pct": 8.17, "D_psr": 0.4011, "D_ic": 0.1816, "sharpe": -1.226, "sortino": -1.2194, "return_pct": -5.01, "equity": 949.9, "max_dd": 0.0, "win_rate": 47.69, "profit_factor": 0.0, "ic": -0.1941, "hit": 47.69, "psr": 0.2709, "bh_sharpe": 2.0789, "bh_return_pct": 8.17, "excess_sharpe": -3.3049}], "status": "DISCARD", "precision": 0.6011, "recall": 0.6725, "f1": 0.6348, "f2": 0.6569, "accuracy": 0.5417, "mcc": 0.0251, "tp": 425, "fp": 282, "tn": 153, "fn": 207, "test_sharpe": 0.8788, "A_sharpe": 0.8788, "A_excess_sharpe": -0.3405, "A_return_pct": 107.82, "A_precision": 0.6011, "A_recall": 0.6725, "A_f1": 0.6348, "A_f2": 0.6569, "A_accuracy": 0.5417, "A_mcc": 0.0251, "A_tp": 425, "A_fp": 282, "A_tn": 153, "A_fn": 207, "A_psr": 0.9663, "A_ic": 0.0329, "A_hit_rate": 54.14, "A_bh_sharpe": 1.2194, "A_bh_return_pct": 187.05}
