{"experiment_num": 10, "backbone": "lightgbm", "description": "LightGBM @ FX-Exp235 HPs (depth=4 lr=0.01 n_est=1000 seq=60); Ke et al. 2017 NeurIPS; QQQ exp7 \u2014 first ensemble component", "config": {"seq_len": 60, "lr": 0.0003, "batch_size": 32, "epochs": 50, "weight_decay": 1e-05, "patience": 10, "warmup_epochs": 0, "head_dropout": 0.1, "huber_delta": 1.0, "grad_clip": 1.0, "seed": 42, "hidden_size": null, "num_layers": null, "max_depth": 4, "gbm_lr": 0.01, "n_estimators": 1000}, "composite": 0.4825, "test_pos_folds": 6, "val_pos_folds": 4, "val_loss": null, "elapsed_sec": 1640.3, "timestamp": "2026-04-26T15:24:35", "sharpe": 1.0665, "val_sharpe": 0.5825, "ic": 0.0382, "hit": 48.87, "psr": 0.9876, "equity": 2484.7999999999997, "return_pct": 148.48, "bh_sharpe": 1.2194, "bh_return_pct": 187.05, "excess_sharpe": -0.1529, "B_sharpe": -0.2979, "B_excess_sharpe": -3.1261, "B_return_pct": -64.76, "D_sharpe": -0.0519, "D_excess_sharpe": -1.2713, "D_return_pct": -14.51, "per_window": [{"fold": "fold_1", "regime": "GFC peak crash (Lehman + Mar-2009 bottom)", "n": 66, "A_sharpe": 0.7395, "A_sortino": 0.8759, "A_excess_sharpe": 0.1673, "A_return_pct": 5.57, "A_hit_rate": 40.91, "A_n": 66, "A_bh_sharpe": 0.5721, "A_bh_return_pct": 3.85, "A_psr": 0.647, "A_ic": 0.003, "B_sharpe": 1.7629, "B_sortino": 1.908, "B_excess_sharpe": -0.284, "B_return_pct": 31.68, "B_hit_rate": 50.77, "B_n": 66, "B_bh_sharpe": 2.0469, "B_bh_return_pct": 39.28, "B_psr": 0.8146, "B_ic": 0.3235, "D_sharpe": 0.4902, "D_sortino": 0.5281, "D_excess_sharpe": -0.0819, "D_return_pct": 3.02, "D_hit_rate": 46.97, "D_n": 66, "D_bh_sharpe": 0.5721, "D_bh_return_pct": 3.85, "D_psr": 0.5984, "D_ic": 0.1528, "sharpe": 0.7395, "sortino": 0.8759, "return_pct": 5.57, "equity": 1055.7, "max_dd": 0.0, "win_rate": 40.91, "profit_factor": 0.0, "ic": 0.003, "hit": 40.91, "psr": 0.647, "bh_sharpe": 0.5721, "bh_return_pct": 3.85, "excess_sharpe": 0.1673, "precision": 0.4333, "recall": 0.3714, "f1": 0.4, "f2": 0.3824, "accuracy": 0.4091, "mcc": -0.1774, "tp": 13, "fp": 17, "tn": 14, "fn": 22, "A_precision": 0.4333, "A_recall": 0.3714, "A_f1": 0.4, "A_f2": 0.3824, "A_accuracy": 0.4091, "A_mcc": -0.1774, "A_tp": 13, "A_fp": 17, "A_tn": 14, "A_fn": 22}, {"fold": "fold_2", "regime": "2011 US-downgrade + EU debt", "n": 87, "A_sharpe": 1.9336, "A_sortino": 2.5464, "A_excess_sharpe": -3.0884, "A_return_pct": 10.54, "A_hit_rate": 48.84, "A_n": 87, "A_bh_sharpe": 5.022, "A_bh_return_pct": 29.23, "A_psr": 0.8857, "A_ic": 0.0023, "B_sharpe": 5.6824, "B_sortino": 6.6022, "B_excess_sharpe": -5.4545, "B_return_pct": 83.54, "B_hit_rate": 63.22, "B_n": 87, "B_bh_sharpe": 11.1369, "B_bh_return_pct": 185.4, "B_psr": 0.9996, "B_ic": 0.2027, "D_sharpe": 1.9771, "D_sortino": 2.2277, "D_excess_sharpe": -3.0449, "D_return_pct": 10.8, "D_hit_rate": 56.98, "D_n": 87, "D_bh_sharpe": 5.022, "D_bh_return_pct": 29.23, "D_psr": 0.8879, "D_ic": 0.097, "sharpe": 1.9336, "sortino": 2.5464, "return_pct": 10.54, "equity": 1105.3999999999999, "max_dd": 0.0, "win_rate": 48.84, "profit_factor": 0.0, "ic": 0.0023, "hit": 48.84, "psr": 0.8857, "bh_sharpe": 5.022, "bh_return_pct": 29.23, "excess_sharpe": -3.0884, "precision": 0.5862, "recall": 0.6296, "f1": 0.6071, "f2": 0.6204, "accuracy": 0.4943, "mcc": -0.1005, "tp": 34, "fp": 24, "tn": 9, "fn": 20, "A_precision": 0.5862, "A_recall": 0.6296, "A_f1": 0.6071, "A_f2": 0.6204, "A_accuracy": 0.4943, "A_mcc": -0.1005, "A_tp": 34, "A_fp": 24, "A_tn": 9, "A_fn": 20}, {"fold": "fold_3", "regime": "Taper tantrum and 2014 H1", "n": 129, "A_sharpe": 0.7624, "A_sortino": 0.7859, "A_excess_sharpe": -1.0054, "A_return_pct": 4.69, "A_hit_rate": 48.44, "A_n": 129, "A_bh_sharpe": 1.7678, "A_bh_return_pct": 11.76, "A_psr": 0.7049, "A_ic": 0.0533, "B_sharpe": 1.9998, "B_sortino": 2.0279, "B_excess_sharpe": -2.2475, "B_return_pct": 26.08, "B_hit_rate": 56.59, "B_n": 129, "B_bh_sharpe": 4.2474, "B_bh_return_pct": 64.1, "B_psr": 0.9214, "B_ic": 0.0038, "D_sharpe": 1.9124, "D_sortino": 1.7939, "D_excess_sharpe": 0.1446, "D_return_pct": 12.81, "D_hit_rate": 57.81, "D_n": 129, "D_bh_sharpe": 1.7678, "D_bh_return_pct": 11.76, "D_psr": 0.9052, "D_ic": 0.1151, "sharpe": 0.7624, "sortino": 0.7859, "return_pct": 4.69, "equity": 1046.8999999999999, "max_dd": 0.0, "win_rate": 48.44, "profit_factor": 0.0, "ic": 0.0533, "hit": 48.44, "psr": 0.7049, "bh_sharpe": 1.7678, "bh_return_pct": 11.76, "excess_sharpe": -1.0054, "precision": 0.5733, "recall": 0.5513, "f1": 0.5621, "f2": 0.5556, "accuracy": 0.4806, "mcc": -0.0755, "tp": 43, "fp": 32, "tn": 19, "fn": 35, "A_precision": 0.5733, "A_recall": 0.5513, "A_f1": 0.5621, "A_f2": 0.5556, "A_accuracy": 0.4806, "A_mcc": -0.0755, "A_tp": 43, "A_fp": 32, "A_tn": 19, "A_fn": 35}, {"fold": "fold_4", "regime": "China devaluation and oil crash", "n": 108, "A_sharpe": -0.0001, "A_sortino": -0.0001, "A_excess_sharpe": 0.6897, "A_return_pct": -0.9, "A_hit_rate": 51.4, "A_n": 108, "A_bh_sharpe": -0.6898, "A_bh_return_pct": -6.71, "A_psr": 0.5, "A_ic": 0.0412, "B_sharpe": -3.7659, "B_sortino": -3.4025, "B_excess_sharpe": -1.8084, "B_return_pct": -51.98, "B_hit_rate": 38.89, "B_n": 108, "B_bh_sharpe": -1.9575, "B_bh_return_pct": -33.56, "B_psr": 0.0058, "B_ic": -0.1319, "D_sharpe": -1.6146, "D_sortino": -1.4738, "D_excess_sharpe": -0.9248, "D_return_pct": -13.92, "D_hit_rate": 46.73, "D_n": 108, "D_bh_sharpe": -0.6898, "D_bh_return_pct": -6.71, "D_psr": 0.1421, "D_ic": -0.0463, "sharpe": -0.0001, "sortino": -0.0001, "return_pct": -0.9, "equity": 991.0, "max_dd": 0.0, "win_rate": 51.4, "profit_factor": 0.0, "ic": 0.0412, "hit": 51.4, "psr": 0.5, "bh_sharpe": -0.6898, "bh_return_pct": -6.71, "excess_sharpe": 0.6897, "precision": 0.5091, "recall": 0.5283, "f1": 0.5185, "f2": 0.5243, "accuracy": 0.5185, "mcc": 0.0374, "tp": 28, "fp": 27, "tn": 28, "fn": 25, "A_precision": 0.5091, "A_recall": 0.5283, "A_f1": 0.5185, "A_f2": 0.5243, "A_accuracy": 0.5185, "A_mcc": 0.0374, "A_tp": 28, "A_fp": 27, "A_tn": 28, "A_fn": 25}, {"fold": "fold_5", "regime": "2018 Vol-mageddon + Q4 sell-off", "n": 128, "A_sharpe": 0.7255, "A_sortino": 0.8687, "A_excess_sharpe": -0.4257, "A_return_pct": 7.57, "A_hit_rate": 45.31, "A_n": 128, "A_bh_sharpe": 1.1511, "A_bh_return_pct": 13.19, "A_psr": 0.6993, "A_ic": -0.0077, "B_sharpe": -2.9468, "B_sortino": -2.9816, "B_excess_sharpe": -5.7586, "B_return_pct": -52.38, "B_hit_rate": 35.43, "B_n": 128, "B_bh_sharpe": 2.8119, "B_bh_return_pct": 82.25, "B_psr": 0.0196, "B_ic": -0.0503, "D_sharpe": -0.2762, "D_sortino": -0.3279, "D_excess_sharpe": -1.4273, "D_return_pct": -4.62, "D_hit_rate": 42.97, "D_n": 128, "D_bh_sharpe": 1.1511, "D_bh_return_pct": 13.19, "D_psr": 0.4229, "D_ic": -0.0558, "sharpe": 0.7255, "sortino": 0.8687, "return_pct": 7.57, "equity": 1075.7, "max_dd": 0.0, "win_rate": 45.31, "profit_factor": 0.0, "ic": -0.0077, "hit": 45.31, "psr": 0.6993, "bh_sharpe": 1.1511, "bh_return_pct": 13.19, "excess_sharpe": -0.4257, "precision": 0.5714, "recall": 0.4103, "f1": 0.4776, "f2": 0.4348, "accuracy": 0.4531, "mcc": -0.0686, "tp": 32, "fp": 24, "tn": 26, "fn": 46, "A_precision": 0.5714, "A_recall": 0.4103, "A_f1": 0.4776, "A_f2": 0.4348, "A_accuracy": 0.4531, "A_mcc": -0.0686, "A_tp": 32, "A_fp": 24, "A_tn": 26, "A_fn": 46}, {"fold": "fold_6", "regime": "COVID crash and V-recovery", "n": 173, "A_sharpe": 1.5513, "A_sortino": 1.6821, "A_excess_sharpe": -0.7747, "A_return_pct": 26.77, "A_hit_rate": 52.6, "A_n": 173, "A_bh_sharpe": 2.3261, "A_bh_return_pct": 43.81, "A_psr": 0.9013, "A_ic": 0.0982, "B_sharpe": -0.8826, "B_sortino": -0.9779, "B_excess_sharpe": -6.6286, "B_return_pct": -32.52, "B_hit_rate": 43.6, "B_n": 173, "B_bh_sharpe": 5.746, "B_bh_return_pct": 499.04, "B_psr": 0.237, "B_ic": 0.1094, "D_sharpe": -0.2712, "D_sortino": -0.3205, "D_excess_sharpe": -2.5972, "D_return_pct": -6.33, "D_hit_rate": 40.46, "D_n": 173, "D_bh_sharpe": 2.3261, "D_bh_return_pct": 43.81, "D_psr": 0.4118, "D_ic": 0.0332, "sharpe": 1.5513, "sortino": 1.6821, "return_pct": 26.77, "equity": 1267.7, "max_dd": 0.0, "win_rate": 52.6, "profit_factor": 0.0, "ic": 0.0982, "hit": 52.6, "psr": 0.9013, "bh_sharpe": 2.3261, "bh_return_pct": 43.81, "excess_sharpe": -0.7747, "precision": 0.7183, "recall": 0.4513, "f1": 0.5543, "f2": 0.4876, "accuracy": 0.526, "mcc": 0.1142, "tp": 51, "fp": 20, "tn": 40, "fn": 62, "A_precision": 0.7183, "A_recall": 0.4513, "A_f1": 0.5543, "A_f2": 0.4876, "A_accuracy": 0.526, "A_mcc": 0.1142, "A_tp": 51, "A_fp": 20, "A_tn": 40, "A_fn": 62}, {"fold": "fold_7", "regime": "Inflation bear, AI rally and 2025", "n": 376, "A_sharpe": 1.3355, "A_sortino": 1.6809, "A_excess_sharpe": 0.5322, "A_return_pct": 50.49, "A_hit_rate": 49.2, "A_n": 376, "A_bh_sharpe": 0.8033, "A_bh_return_pct": 26.02, "A_psr": 0.959, "A_ic": 0.042, "B_sharpe": -0.1845, "B_sortino": -0.2083, "B_excess_sharpe": -2.1162, "B_return_pct": -25.05, "B_hit_rate": 44.27, "B_n": 376, "B_bh_sharpe": 1.9317, "B_bh_return_pct": 222.05, "B_psr": 0.4112, "B_ic": -0.0229, "D_sharpe": -0.3286, "D_sortino": -0.4029, "D_excess_sharpe": -1.1319, "D_return_pct": -13.68, "D_hit_rate": 41.76, "D_n": 376, "D_bh_sharpe": 0.8033, "D_bh_return_pct": 26.02, "D_psr": 0.3467, "D_ic": -0.0268, "sharpe": 1.3355, "sortino": 1.6809, "return_pct": 50.49, "equity": 1504.9, "max_dd": 0.0, "win_rate": 49.2, "profit_factor": 0.0, "ic": 0.042, "hit": 49.2, "psr": 0.959, "bh_sharpe": 0.8033, "bh_return_pct": 26.02, "excess_sharpe": 0.5322, "precision": 0.6562, "recall": 0.2851, "f1": 0.3975, "f2": 0.3214, "accuracy": 0.492, "mcc": 0.0815, "tp": 63, "fp": 33, "tn": 122, "fn": 158, "A_precision": 0.6562, "A_recall": 0.2851, "A_f1": 0.3975, "A_f2": 0.3214, "A_accuracy": 0.492, "A_mcc": 0.0815, "A_tp": 63, "A_fp": 33, "A_tn": 122, "A_fn": 158}], "per_window_val": [{"fold": "fold_1", "regime": "GFC peak crash (Lehman + Mar-2009 bottom)", "n": 65, "A_sharpe": 1.7987, "A_sortino": 2.2099, "A_excess_sharpe": 4.0244, "A_return_pct": 15.2, "A_hit_rate": 50.79, "A_n": 65, "A_bh_sharpe": -2.2257, "A_bh_return_pct": -18.74, "A_psr": 0.8301, "A_ic": 0.0885, "B_sharpe": -4.8065, "B_sortino": -4.0599, "B_excess_sharpe": 2.3158, "B_return_pct": -61.34, "B_hit_rate": 40.0, "B_n": 65, "B_bh_sharpe": -7.1223, "B_bh_return_pct": -73.11, "B_psr": 0.0051, "B_ic": 0.2838, "D_sharpe": -1.1614, "D_sortino": -0.9741, "D_excess_sharpe": 1.0642, "D_return_pct": -10.97, "D_hit_rate": 50.79, "D_n": 65, "D_bh_sharpe": -2.2257, "D_bh_return_pct": -18.74, "D_psr": 0.2717, "D_ic": 0.3054, "sharpe": 1.7987, "sortino": 2.2099, "return_pct": 15.2, "equity": 1152.0, "max_dd": 0.0, "win_rate": 50.79, "profit_factor": 0.0, "ic": 0.0885, "hit": 50.79, "psr": 0.8301, "bh_sharpe": -2.2257, "bh_return_pct": -18.74, "excess_sharpe": 4.0244}, {"fold": "fold_2", "regime": "2011 US-downgrade + EU debt", "n": 47, "A_sharpe": -0.4974, "A_sortino": -0.4681, "A_excess_sharpe": -0.3034, "A_return_pct": -4.26, "A_hit_rate": 48.94, "A_n": 47, "A_bh_sharpe": -0.1941, "A_bh_return_pct": -2.36, "A_psr": 0.4153, "A_ic": 0.028, "B_sharpe": 0.9744, "B_sortino": 0.8514, "B_excess_sharpe": 2.5868, "B_return_pct": 8.6, "B_hit_rate": 57.45, "B_n": 47, "B_bh_sharpe": -1.6123, "B_bh_return_pct": -24.3, "B_psr": 0.6582, "B_ic": 0.1726, "D_sharpe": 0.6694, "D_sortino": 0.6285, "D_excess_sharpe": 0.8635, "D_return_pct": 3.25, "D_hit_rate": 55.32, "D_n": 47, "D_bh_sharpe": -0.1941, "D_bh_return_pct": -2.36, "D_psr": 0.6119, "D_ic": -0.0105, "sharpe": -0.4974, "sortino": -0.4681, "return_pct": -4.26, "equity": 957.4, "max_dd": 0.0, "win_rate": 48.94, "profit_factor": 0.0, "ic": 0.028, "hit": 48.94, "psr": 0.4153, "bh_sharpe": -0.1941, "bh_return_pct": -2.36, "excess_sharpe": -0.3034}, {"fold": "fold_3", "regime": "Taper tantrum and 2014 H1", "n": 5, "A_sharpe": 3.7421, "A_sortino": 3.8425, "A_excess_sharpe": 5.0616, "A_return_pct": 0.57, "A_hit_rate": 60.0, "A_n": 5, "A_bh_sharpe": -1.3194, "A_bh_return_pct": -0.21, "A_psr": 0.6797, "A_ic": 0.4, "B_sharpe": 25.8705, "B_sortino": 0.0, "B_excess_sharpe": 51.7411, "B_return_pct": 3.95, "B_hit_rate": 100.0, "B_n": 5, "B_bh_sharpe": -25.8705, "B_bh_return_pct": -3.84, "B_psr": 1.0, "B_ic": -0.2, "D_sharpe": 1.3194, "D_sortino": 1.268, "D_excess_sharpe": 2.6388, "D_return_pct": 0.2, "D_hit_rate": 60.0, "D_n": 5, "D_bh_sharpe": -1.3194, "D_bh_return_pct": -0.21, "D_psr": 0.5663, "D_ic": -0.3, "sharpe": 3.7421, "sortino": 3.8425, "return_pct": 0.57, "equity": 1005.7, "max_dd": 0.0, "win_rate": 60.0, "profit_factor": 0.0, "ic": 0.4, "hit": 60.0, "psr": 0.6797, "bh_sharpe": -1.3194, "bh_return_pct": -0.21, "excess_sharpe": 5.0616}, {"fold": "fold_4", "regime": "China devaluation and oil crash", "n": 47, "A_sharpe": -2.0446, "A_sortino": -1.9516, "A_excess_sharpe": -0.2209, "A_return_pct": -9.6, "A_hit_rate": 42.55, "A_n": 47, "A_bh_sharpe": -1.8238, "A_bh_return_pct": -8.68, "A_psr": 0.1912, "A_ic": 0.0496, "B_sharpe": -0.8243, "B_sortino": -0.7011, "B_excess_sharpe": 1.3957, "B_return_pct": -11.63, "B_hit_rate": 48.94, "B_n": 47, "B_bh_sharpe": -2.22, "B_bh_return_pct": -23.98, "B_psr": 0.3575, "B_ic": 0.5833, "D_sharpe": -2.5822, "D_sortino": -2.3763, "D_excess_sharpe": -0.7584, "D_return_pct": -11.78, "D_hit_rate": 44.68, "D_n": 47, "D_bh_sharpe": -1.8238, "D_bh_return_pct": -8.68, "D_psr": 0.1365, "D_ic": 0.0745, "sharpe": -2.0446, "sortino": -1.9516, "return_pct": -9.6, "equity": 904.0, "max_dd": 0.0, "win_rate": 42.55, "profit_factor": 0.0, "ic": 0.0496, "hit": 42.55, "psr": 0.1912, "bh_sharpe": -1.8238, "bh_return_pct": -8.68, "excess_sharpe": -0.2209}, {"fold": "fold_5", "regime": "2018 Vol-mageddon + Q4 sell-off", "n": 5, "A_sharpe": -10.1368, "A_sortino": -6.9937, "A_excess_sharpe": 0.0, "A_return_pct": -3.15, "A_hit_rate": 40.0, "A_n": 5, "A_bh_sharpe": -10.1368, "A_bh_return_pct": -3.15, "A_psr": 0.0985, "A_ic": -0.2, "B_sharpe": 5.6858, "B_sortino": 6.0578, "B_excess_sharpe": 0.0, "B_return_pct": 4.22, "B_hit_rate": 60.0, "B_n": 5, "B_bh_sharpe": 5.6858, "B_bh_return_pct": 4.22, "B_psr": 0.753, "B_ic": 0.8, "D_sharpe": -10.1368, "D_sortino": -6.9937, "D_excess_sharpe": 0.0, "D_return_pct": -3.15, "D_hit_rate": 40.0, "D_n": 5, "D_bh_sharpe": -10.1368, "D_bh_return_pct": -3.15, "D_psr": 0.0985, "D_ic": 0.5, "sharpe": -10.1368, "sortino": -6.9937, "return_pct": -3.15, "equity": 968.5, "max_dd": 0.0, "win_rate": 40.0, "profit_factor": 0.0, "ic": -0.2, "hit": 40.0, "psr": 0.0985, "bh_sharpe": -10.1368, "bh_return_pct": -3.15, "excess_sharpe": 0.0}, {"fold": "fold_6", "regime": "COVID crash and V-recovery", "n": 26, "A_sharpe": 4.8005, "A_sortino": 5.2051, "A_excess_sharpe": 1.5154, "A_return_pct": 7.01, "A_hit_rate": 61.54, "A_n": 26, "A_bh_sharpe": 3.2852, "A_bh_return_pct": 4.82, "A_psr": 0.9307, "A_ic": 0.1945, "B_sharpe": 1.6224, "B_sortino": 1.5857, "B_excess_sharpe": -11.3568, "B_return_pct": 4.93, "B_hit_rate": 57.69, "B_n": 26, "B_bh_sharpe": 12.9792, "B_bh_return_pct": 38.76, "B_psr": 0.6952, "B_ic": 0.2834, "D_sharpe": 5.1853, "D_sortino": 7.1228, "D_excess_sharpe": 1.9001, "D_return_pct": 7.54, "D_hit_rate": 53.85, "D_n": 26, "D_bh_sharpe": 3.2852, "D_bh_return_pct": 4.82, "D_psr": 0.9551, "D_ic": 0.3484, "sharpe": 4.8005, "sortino": 5.2051, "return_pct": 7.01, "equity": 1070.1000000000001, "max_dd": 0.0, "win_rate": 61.54, "profit_factor": 0.0, "ic": 0.1945, "hit": 61.54, "psr": 0.9307, "bh_sharpe": 3.2852, "bh_return_pct": 4.82, "excess_sharpe": 1.5154}, {"fold": "fold_7", "regime": "Inflation bear, AI rally and 2025", "n": 65, "A_sharpe": 2.244, "A_sortino": 2.4288, "A_excess_sharpe": 0.165, "A_return_pct": 8.85, "A_hit_rate": 56.92, "A_n": 65, "A_bh_sharpe": 2.0789, "A_bh_return_pct": 8.17, "A_psr": 0.8754, "A_ic": 0.2092, "B_sharpe": -4.7915, "B_sortino": -4.5528, "B_excess_sharpe": -10.0229, "B_return_pct": -30.36, "B_hit_rate": 32.31, "B_n": 65, "B_bh_sharpe": 5.2314, "B_bh_return_pct": 44.53, "B_psr": 0.0099, "B_ic": 0.0937, "D_sharpe": -1.7056, "D_sortino": -1.5298, "D_excess_sharpe": -3.7845, "D_return_pct": -6.77, "D_hit_rate": 49.23, "D_n": 65, "D_bh_sharpe": 2.0789, "D_bh_return_pct": 8.17, "D_psr": 0.1916, "D_ic": 0.1551, "sharpe": 2.244, "sortino": 2.4288, "return_pct": 8.85, "equity": 1088.5, "max_dd": 0.0, "win_rate": 56.92, "profit_factor": 0.0, "ic": 0.2092, "hit": 56.92, "psr": 0.8754, "bh_sharpe": 2.0789, "bh_return_pct": 8.17, "excess_sharpe": 0.165}], "status": "DISCARD", "precision": 0.5986, "recall": 0.4177, "f1": 0.4921, "f2": 0.4446, "accuracy": 0.4892, "mcc": 0.0108, "tp": 264, "fp": 177, "tn": 258, "fn": 368, "test_sharpe": 1.0665, "A_sharpe": 1.0665, "A_excess_sharpe": -0.1529, "A_return_pct": 148.48, "A_precision": 0.5986, "A_recall": 0.4177, "A_f1": 0.4921, "A_f2": 0.4446, "A_accuracy": 0.4892, "A_mcc": 0.0108, "A_tp": 264, "A_fp": 177, "A_tn": 258, "A_fn": 368, "A_psr": 0.9876, "A_ic": 0.0382, "A_hit_rate": 48.87, "A_bh_sharpe": 1.2194, "A_bh_return_pct": 187.05}
