{"experiment_num": 86, "backbone": "lstm", "description": "LSTM @ exp 71 1-layer warmup=5 (up from 0) - Goyal 2017 LR warmup on 1-layer", "config": {"seq_len": 10, "lr": 0.001, "batch_size": 16, "epochs": 100, "weight_decay": 0.0007, "patience": 15, "warmup_epochs": 5, "head_dropout": 0.1, "huber_delta": 1.0, "grad_clip": 1.0, "seed": 0, "hidden_size": null, "num_layers": 1, "max_depth": null, "gbm_lr": null, "n_estimators": null}, "composite": -0.7729, "test_pos_folds": 2, "val_pos_folds": 3, "val_loss": -2.879565628141818, "elapsed_sec": 87.4, "timestamp": "2026-04-27T23:25:44", "sharpe": -0.2729, "val_sharpe": 0.3166, "ic": 0.0109, "hit": 46.06, "psr": 0.2593, "equity": 537.1, "return_pct": -46.29, "bh_sharpe": 0.6042, "bh_return_pct": 103.49, "excess_sharpe": -0.8771, "B_sharpe": 0.7608, "B_excess_sharpe": -0.94, "B_return_pct": 334.4, "D_sharpe": -0.2729, "D_excess_sharpe": -0.8771, "D_return_pct": -46.29, "precision": 0.5444, "recall": 0.3569, "f1": 0.4311, "f2": 0.3833, "mcc": -0.0437, "accuracy": 0.461, "val_precision": 0.561, "val_recall": 0.3495, "val_f1": 0.4307, "val_f2": 0.378, "val_mcc": 0.009, "val_accuracy": 0.4874, "per_window": [{"fold": "fold_1", "regime": "GFC peak crash (Lehman + Mar-2009 bottom)", "n": 115, "A_sharpe": -0.3243, "A_sortino": -0.3257, "A_excess_sharpe": 0.1198, "A_return_pct": -12.07, "A_hit_rate": 47.83, "A_n": 115, "A_bh_sharpe": -0.4441, "A_bh_return_pct": -14.4, "A_psr": 0.4137, "A_ic": 0.0772, "A_precision": 0.4681, "A_recall": 0.8148, "A_f1": 0.5946, "A_f2": 0.7097, "A_accuracy": 0.4783, "A_mcc": -0.0063, "A_tp": 44, "A_fp": 50, "A_tn": 11, "A_fn": 10, "B_sharpe": 1.3512, "B_sortino": 1.4198, "B_excess_sharpe": 1.6491, "B_return_pct": 45.18, "B_hit_rate": 53.51, "B_n": 115, "B_bh_sharpe": -0.2978, "B_bh_return_pct": -27.23, "B_psr": 0.8191, "B_ic": 0.0119, "B_precision": 0.5366, "B_recall": 0.7458, "B_f1": 0.6241, "B_f2": 0.6918, "B_accuracy": 0.5391, "B_mcc": 0.0742, "B_tp": 44, "B_fp": 38, "B_tn": 18, "B_fn": 15, "D_sharpe": -0.3243, "D_sortino": -0.3257, "D_excess_sharpe": 0.1198, "D_return_pct": -12.07, "D_hit_rate": 47.83, "D_n": 115, "D_bh_sharpe": -0.4441, "D_bh_return_pct": -14.4, "D_psr": 0.4137, "D_ic": 0.0772, "D_precision": 0.4681, "D_recall": 0.8148, "D_f1": 0.5946, "D_f2": 0.7097, "D_accuracy": 0.4783, "D_mcc": -0.0063, "D_tp": 44, "D_fp": 50, "D_tn": 11, "D_fn": 10, "sharpe": -0.3243, "sortino": -0.3257, "return_pct": -12.07, "equity": 879.3, "max_dd": 0.0, "win_rate": 47.83, "profit_factor": 0.0, "ic": 0.0772, "hit": 47.83, "psr": 0.4137, "bh_sharpe": -0.4441, "bh_return_pct": -14.4, "excess_sharpe": 0.1198, "precision": 0.4681, "recall": 0.8148, "f1": 0.5946, "f2": 0.7097, "mcc": -0.0063, "accuracy": 0.4783, "tp": 44, "fp": 50, "tn": 11, "fn": 10}, {"fold": "fold_2", "regime": "2011 US-downgrade + EU debt", "n": 136, "A_sharpe": 0.6721, "A_sortino": 0.7501, "A_excess_sharpe": -1.0606, "A_return_pct": 6.53, "A_hit_rate": 47.41, "A_n": 136, "A_bh_sharpe": 1.7327, "A_bh_return_pct": 19.75, "A_psr": 0.6898, "A_ic": 0.0804, "A_precision": 0.5854, "A_recall": 0.3077, "A_f1": 0.4034, "A_f2": 0.3399, "A_accuracy": 0.4779, "A_mcc": 0.0157, "A_tp": 24, "A_fp": 17, "A_tn": 41, "A_fn": 54, "B_sharpe": 1.6698, "B_sortino": 1.6896, "B_excess_sharpe": -2.3961, "B_return_pct": 42.19, "B_hit_rate": 56.62, "B_n": 136, "B_bh_sharpe": 4.0659, "B_bh_return_pct": 148.68, "B_psr": 0.8899, "B_ic": 0.0493, "B_precision": 0.6796, "B_recall": 0.7292, "B_f1": 0.7035, "B_f2": 0.7187, "B_accuracy": 0.5662, "B_mcc": -0.1019, "B_tp": 70, "B_fp": 33, "B_tn": 7, "B_fn": 26, "D_sharpe": 0.6721, "D_sortino": 0.7501, "D_excess_sharpe": -1.0606, "D_return_pct": 6.53, "D_hit_rate": 47.41, "D_n": 136, "D_bh_sharpe": 1.7327, "D_bh_return_pct": 19.75, "D_psr": 0.6898, "D_ic": 0.0804, "D_precision": 0.5854, "D_recall": 0.3077, "D_f1": 0.4034, "D_f2": 0.3399, "D_accuracy": 0.4779, "D_mcc": 0.0157, "D_tp": 24, "D_fp": 17, "D_tn": 41, "D_fn": 54, "sharpe": 0.6721, "sortino": 0.7501, "return_pct": 6.53, "equity": 1065.3, "max_dd": 0.0, "win_rate": 47.41, "profit_factor": 0.0, "ic": 0.0804, "hit": 47.41, "psr": 0.6898, "bh_sharpe": 1.7327, "bh_return_pct": 19.75, "excess_sharpe": -1.0606, "precision": 0.5854, "recall": 0.3077, "f1": 0.4034, "f2": 0.3399, "mcc": 0.0157, "accuracy": 0.4779, "tp": 24, "fp": 17, "tn": 41, "fn": 54}, {"fold": "fold_3", "regime": "Taper tantrum and 2014 H1", "n": 178, "A_sharpe": -1.183, "A_sortino": -1.2005, "A_excess_sharpe": -2.5275, "A_return_pct": -10.79, "A_hit_rate": 44.07, "A_n": 178, "A_bh_sharpe": 1.3445, "A_bh_return_pct": 12.41, "A_psr": 0.1615, "A_ic": 0.1011, "A_precision": 0.5526, "A_recall": 0.2039, "A_f1": 0.2979, "A_f2": 0.2333, "A_accuracy": 0.4438, "A_mcc": -0.0275, "A_tp": 21, "A_fp": 17, "A_tn": 58, "A_fn": 82, "B_sharpe": 1.9706, "B_sortino": 2.213, "B_excess_sharpe": -1.0777, "B_return_pct": 41.19, "B_hit_rate": 52.81, "B_n": 178, "B_bh_sharpe": 3.0483, "B_bh_return_pct": 71.83, "B_psr": 0.9535, "B_ic": 0.1036, "B_precision": 0.6087, "B_recall": 0.6422, "B_f1": 0.625, "B_f2": 0.6352, "B_accuracy": 0.5281, "B_mcc": -0.0102, "B_tp": 70, "B_fp": 45, "B_tn": 24, "B_fn": 39, "D_sharpe": -1.183, "D_sortino": -1.2005, "D_excess_sharpe": -2.5275, "D_return_pct": -10.79, "D_hit_rate": 44.07, "D_n": 178, "D_bh_sharpe": 1.3445, "D_bh_return_pct": 12.41, "D_psr": 0.1615, "D_ic": 0.1011, "D_precision": 0.5526, "D_recall": 0.2039, "D_f1": 0.2979, "D_f2": 0.2333, "D_accuracy": 0.4438, "D_mcc": -0.0275, "D_tp": 21, "D_fp": 17, "D_tn": 58, "D_fn": 82, "sharpe": -1.183, "sortino": -1.2005, "return_pct": -10.79, "equity": 892.1, "max_dd": 0.0, "win_rate": 44.07, "profit_factor": 0.0, "ic": 0.1011, "hit": 44.07, "psr": 0.1615, "bh_sharpe": 1.3445, "bh_return_pct": 12.41, "excess_sharpe": -2.5275, "precision": 0.5526, "recall": 0.2039, "f1": 0.2979, "f2": 0.2333, "mcc": -0.0275, "accuracy": 0.4438, "tp": 21, "fp": 17, "tn": 58, "fn": 82}, {"fold": "fold_4", "regime": "China devaluation and oil crash", "n": 157, "A_sharpe": -0.2688, "A_sortino": -0.2501, "A_excess_sharpe": -0.2786, "A_return_pct": -4.33, "A_hit_rate": 50.0, "A_n": 157, "A_bh_sharpe": 0.0098, "A_bh_return_pct": -1.05, "A_psr": 0.416, "A_ic": 0.0131, "A_precision": 0.5135, "A_recall": 0.4691, "A_f1": 0.4903, "A_f2": 0.4774, "A_accuracy": 0.4968, "A_mcc": -0.0046, "A_tp": 38, "A_fp": 36, "A_tn": 40, "A_fn": 43, "B_sharpe": 2.3473, "B_sortino": 2.5426, "B_excess_sharpe": 2.3314, "B_return_pct": 77.91, "B_hit_rate": 55.41, "B_n": 157, "B_bh_sharpe": 0.0159, "B_bh_return_pct": -5.48, "B_psr": 0.9685, "B_ic": 0.2079, "B_precision": 0.5641, "B_recall": 0.7765, "B_f1": 0.6535, "B_f2": 0.7221, "B_accuracy": 0.5541, "B_mcc": 0.0779, "B_tp": 66, "B_fp": 51, "B_tn": 21, "B_fn": 19, "D_sharpe": -0.2688, "D_sortino": -0.2501, "D_excess_sharpe": -0.2786, "D_return_pct": -4.33, "D_hit_rate": 50.0, "D_n": 157, "D_bh_sharpe": 0.0098, "D_bh_return_pct": -1.05, "D_psr": 0.416, "D_ic": 0.0131, "D_precision": 0.5135, "D_recall": 0.4691, "D_f1": 0.4903, "D_f2": 0.4774, "D_accuracy": 0.4968, "D_mcc": -0.0046, "D_tp": 38, "D_fp": 36, "D_tn": 40, "D_fn": 43, "sharpe": -0.2688, "sortino": -0.2501, "return_pct": -4.33, "equity": 956.7, "max_dd": 0.0, "win_rate": 50.0, "profit_factor": 0.0, "ic": 0.0131, "hit": 50.0, "psr": 0.416, "bh_sharpe": 0.0098, "bh_return_pct": -1.05, "excess_sharpe": -0.2786, "precision": 0.5135, "recall": 0.4691, "f1": 0.4903, "f2": 0.4774, "mcc": -0.0046, "accuracy": 0.4968, "tp": 38, "fp": 36, "tn": 40, "fn": 43}, {"fold": "fold_5", "regime": "2018 Vol-mageddon + Q4 sell-off", "n": 177, "A_sharpe": 0.5592, "A_sortino": 0.5993, "A_excess_sharpe": 0.2494, "A_return_pct": 7.45, "A_hit_rate": 49.15, "A_n": 177, "A_bh_sharpe": 0.3098, "A_bh_return_pct": 3.19, "A_psr": 0.6806, "A_ic": 0.0806, "A_precision": 0.5915, "A_recall": 0.4078, "A_f1": 0.4828, "A_f2": 0.4348, "A_accuracy": 0.4915, "A_mcc": 0.016, "A_tp": 42, "A_fp": 29, "A_tn": 45, "A_fn": 61, "B_sharpe": 0.0972, "B_sortino": 0.0922, "B_excess_sharpe": -0.7944, "B_return_pct": -4.33, "B_hit_rate": 52.27, "B_n": 177, "B_bh_sharpe": 0.8917, "B_bh_return_pct": 23.8, "B_psr": 0.5324, "B_ic": -0.0021, "B_precision": 0.6068, "B_recall": 0.6514, "B_f1": 0.6283, "B_f2": 0.642, "B_accuracy": 0.5254, "B_mcc": -0.0258, "B_tp": 71, "B_fp": 46, "B_tn": 22, "B_fn": 38, "D_sharpe": 0.5592, "D_sortino": 0.5993, "D_excess_sharpe": 0.2494, "D_return_pct": 7.45, "D_hit_rate": 49.15, "D_n": 177, "D_bh_sharpe": 0.3098, "D_bh_return_pct": 3.19, "D_psr": 0.6806, "D_ic": 0.0806, "D_precision": 0.5915, "D_recall": 0.4078, "D_f1": 0.4828, "D_f2": 0.4348, "D_accuracy": 0.4915, "D_mcc": 0.016, "D_tp": 42, "D_fp": 29, "D_tn": 45, "D_fn": 61, "sharpe": 0.5592, "sortino": 0.5993, "return_pct": 7.45, "equity": 1074.5, "max_dd": 0.0, "win_rate": 49.15, "profit_factor": 0.0, "ic": 0.0806, "hit": 49.15, "psr": 0.6806, "bh_sharpe": 0.3098, "bh_return_pct": 3.19, "excess_sharpe": 0.2494, "precision": 0.5915, "recall": 0.4078, "f1": 0.4828, "f2": 0.4348, "mcc": 0.016, "accuracy": 0.4915, "tp": 42, "fp": 29, "tn": 45, "fn": 61}, {"fold": "fold_6", "regime": "COVID crash and V-recovery", "n": 222, "A_sharpe": -0.6024, "A_sortino": -0.6123, "A_excess_sharpe": -1.4912, "A_return_pct": -23.27, "A_hit_rate": 43.69, "A_n": 222, "A_bh_sharpe": 0.8888, "A_bh_return_pct": 26.13, "A_psr": 0.2846, "A_ic": 0.005, "A_precision": 0.5823, "A_recall": 0.3333, "A_f1": 0.424, "A_f2": 0.3645, "A_accuracy": 0.4369, "A_mcc": -0.0603, "A_tp": 46, "A_fp": 33, "A_tn": 51, "A_fn": 92, "B_sharpe": -0.6877, "B_sortino": -0.6361, "B_excess_sharpe": -3.0762, "B_return_pct": -47.39, "B_hit_rate": 49.32, "B_n": 222, "B_bh_sharpe": 2.3884, "B_bh_return_pct": 243.18, "B_psr": 0.2575, "B_ic": -0.0554, "B_precision": 0.5984, "B_recall": 0.5328, "B_f1": 0.5637, "B_f2": 0.5448, "B_accuracy": 0.491, "B_mcc": -0.0426, "B_tp": 73, "B_fp": 49, "B_tn": 36, "B_fn": 64, "D_sharpe": -0.6024, "D_sortino": -0.6123, "D_excess_sharpe": -1.4912, "D_return_pct": -23.27, "D_hit_rate": 43.69, "D_n": 222, "D_bh_sharpe": 0.8888, "D_bh_return_pct": 26.13, "D_psr": 0.2846, "D_ic": 0.005, "D_precision": 0.5823, "D_recall": 0.3333, "D_f1": 0.424, "D_f2": 0.3645, "D_accuracy": 0.4369, "D_mcc": -0.0603, "D_tp": 46, "D_fp": 33, "D_tn": 51, "D_fn": 92, "sharpe": -0.6024, "sortino": -0.6123, "return_pct": -23.27, "equity": 767.3, "max_dd": 0.0, "win_rate": 43.69, "profit_factor": 0.0, "ic": 0.005, "hit": 43.69, "psr": 0.2846, "bh_sharpe": 0.8888, "bh_return_pct": 26.13, "excess_sharpe": -1.4912, "precision": 0.5823, "recall": 0.3333, "f1": 0.424, "f2": 0.3645, "mcc": -0.0603, "accuracy": 0.4369, "tp": 46, "fp": 33, "tn": 51, "fn": 92}, {"fold": "fold_7", "regime": "Inflation bear, AI rally and 2025", "n": 425, "A_sharpe": -0.4507, "A_sortino": -0.5036, "A_excess_sharpe": -1.4222, "A_return_pct": -18.5, "A_hit_rate": 44.47, "A_n": 425, "A_bh_sharpe": 0.9715, "A_bh_return_pct": 37.12, "A_psr": 0.2829, "A_ic": 0.0087, "A_precision": 0.553, "A_recall": 0.292, "A_f1": 0.3822, "A_f2": 0.3224, "A_accuracy": 0.4447, "A_mcc": -0.048, "A_tp": 73, "A_fp": 59, "A_tn": 116, "A_fn": 177, "B_sharpe": 0.8943, "B_sortino": 0.8872, "B_excess_sharpe": -1.6084, "B_return_pct": 66.47, "B_hit_rate": 52.83, "B_n": 425, "B_bh_sharpe": 2.5027, "B_bh_return_pct": 458.83, "B_psr": 0.8751, "B_ic": 0.0659, "B_precision": 0.6207, "B_recall": 0.616, "B_f1": 0.6183, "B_f2": 0.6169, "B_accuracy": 0.5294, "B_mcc": 0.0048, "B_tp": 162, "B_fp": 99, "B_tn": 63, "B_fn": 101, "D_sharpe": -0.4507, "D_sortino": -0.5036, "D_excess_sharpe": -1.4222, "D_return_pct": -18.5, "D_hit_rate": 44.47, "D_n": 425, "D_bh_sharpe": 0.9715, "D_bh_return_pct": 37.12, "D_psr": 0.2829, "D_ic": 0.0087, "D_precision": 0.553, "D_recall": 0.292, "D_f1": 0.3822, "D_f2": 0.3224, "D_accuracy": 0.4447, "D_mcc": -0.048, "D_tp": 73, "D_fp": 59, "D_tn": 116, "D_fn": 177, "sharpe": -0.4507, "sortino": -0.5036, "return_pct": -18.5, "equity": 815.0, "max_dd": 0.0, "win_rate": 44.47, "profit_factor": 0.0, "ic": 0.0087, "hit": 44.47, "psr": 0.2829, "bh_sharpe": 0.9715, "bh_return_pct": 37.12, "excess_sharpe": -1.4222, "precision": 0.553, "recall": 0.292, "f1": 0.3822, "f2": 0.3224, "mcc": -0.048, "accuracy": 0.4447, "tp": 73, "fp": 59, "tn": 116, "fn": 177}], "per_window_val": [{"fold": "fold_1", "regime": "GFC peak crash (Lehman + Mar-2009 bottom)", "n": 104, "A_sharpe": -0.619, "A_sortino": -0.529, "A_excess_sharpe": -0.4517, "A_return_pct": -8.99, "A_hit_rate": 51.96, "A_n": 104, "A_bh_sharpe": -0.1672, "A_bh_return_pct": -3.81, "A_psr": 0.3431, "A_ic": 0.0235, "A_precision": 0.5238, "A_recall": 0.6111, "A_f1": 0.5641, "A_f2": 0.5914, "A_accuracy": 0.5096, "A_mcc": 0.0114, "A_tp": 33, "A_fp": 30, "A_tn": 20, "A_fn": 21, "B_sharpe": -1.9261, "B_sortino": -1.7433, "B_excess_sharpe": 0.348, "B_return_pct": -39.58, "B_hit_rate": 44.66, "B_n": 104, "B_bh_sharpe": -2.2741, "B_bh_return_pct": -44.12, "B_psr": 0.1005, "B_ic": -0.1931, "B_precision": 0.4651, "B_recall": 0.7692, "B_f1": 0.5797, "B_f2": 0.6803, "B_accuracy": 0.4423, "B_mcc": -0.1525, "B_tp": 40, "B_fp": 46, "B_tn": 6, "B_fn": 12, "D_sharpe": -0.619, "D_sortino": -0.529, "D_excess_sharpe": -0.4517, "D_return_pct": -8.99, "D_hit_rate": 51.96, "D_n": 104, "D_bh_sharpe": -0.1672, "D_bh_return_pct": -3.81, "D_psr": 0.3431, "D_ic": 0.0235, "D_precision": 0.5238, "D_recall": 0.6111, "D_f1": 0.5641, "D_f2": 0.5914, "D_accuracy": 0.5096, "D_mcc": 0.0114, "D_tp": 33, "D_fp": 30, "D_tn": 20, "D_fn": 21, "sharpe": -0.619, "sortino": -0.529, "return_pct": -8.99, "equity": 910.1, "max_dd": 0.0, "win_rate": 51.96, "profit_factor": 0.0, "ic": 0.0235, "hit": 51.96, "psr": 0.3431, "bh_sharpe": -0.1672, "bh_return_pct": -3.81, "excess_sharpe": -0.4517, "precision": 0.5238, "recall": 0.6111, "f1": 0.5641, "f2": 0.5914, "mcc": 0.0114, "accuracy": 0.5096, "tp": 33, "fp": 30, "tn": 20, "fn": 21}, {"fold": "fold_2", "regime": "2011 US-downgrade + EU debt", "n": 96, "A_sharpe": 2.0468, "A_sortino": 2.2203, "A_excess_sharpe": 2.3209, "A_return_pct": 21.37, "A_hit_rate": 53.68, "A_n": 96, "A_bh_sharpe": -0.2741, "A_bh_return_pct": -4.09, "A_psr": 0.8934, "A_ic": 0.0717, "A_precision": 0.5472, "A_recall": 0.58, "A_f1": 0.5631, "A_f2": 0.5731, "A_accuracy": 0.5312, "A_mcc": 0.0585, "A_tp": 29, "A_fp": 24, "A_tn": 22, "A_fn": 21, "B_sharpe": -0.353, "B_sortino": -0.3228, "B_excess_sharpe": 0.6744, "B_return_pct": -13.53, "B_hit_rate": 51.04, "B_n": 96, "B_bh_sharpe": -1.0274, "B_bh_return_pct": -25.58, "B_psr": 0.4136, "B_ic": -0.1668, "B_precision": 0.4756, "B_recall": 0.907, "B_f1": 0.624, "B_f2": 0.7677, "B_accuracy": 0.5104, "B_mcc": 0.1348, "B_tp": 39, "B_fp": 43, "B_tn": 10, "B_fn": 4, "D_sharpe": 2.0468, "D_sortino": 2.2203, "D_excess_sharpe": 2.3209, "D_return_pct": 21.37, "D_hit_rate": 53.68, "D_n": 96, "D_bh_sharpe": -0.2741, "D_bh_return_pct": -4.09, "D_psr": 0.8934, "D_ic": 0.0717, "D_precision": 0.5472, "D_recall": 0.58, "D_f1": 0.5631, "D_f2": 0.5731, "D_accuracy": 0.5312, "D_mcc": 0.0585, "D_tp": 29, "D_fp": 24, "D_tn": 22, "D_fn": 21, "sharpe": 2.0468, "sortino": 2.2203, "return_pct": 21.37, "equity": 1213.7, "max_dd": 0.0, "win_rate": 53.68, "profit_factor": 0.0, "ic": 0.0717, "hit": 53.68, "psr": 0.8934, "bh_sharpe": -0.2741, "bh_return_pct": -4.09, "excess_sharpe": 2.3209, "precision": 0.5472, "recall": 0.58, "f1": 0.5631, "f2": 0.5731, "mcc": 0.0585, "accuracy": 0.5312, "tp": 29, "fp": 24, "tn": 22, "fn": 21}, {"fold": "fold_3", "regime": "Taper tantrum and 2014 H1", "n": 54, "A_sharpe": -3.3997, "A_sortino": -3.312, "A_excess_sharpe": -8.0994, "A_return_pct": -7.26, "A_hit_rate": 38.89, "A_n": 54, "A_bh_sharpe": 4.6998, "A_bh_return_pct": 10.46, "A_psr": 0.0686, "A_ic": 0.064, "A_precision": 0.5, "A_recall": 0.0606, "A_f1": 0.1081, "A_f2": 0.0735, "A_accuracy": 0.3889, "A_mcc": -0.0645, "A_tp": 2, "A_fp": 2, "A_tn": 19, "A_fn": 31, "B_sharpe": 4.2418, "B_sortino": 5.9662, "B_excess_sharpe": -4.7907, "B_return_pct": 22.86, "B_hit_rate": 51.85, "B_n": 54, "B_bh_sharpe": 9.0326, "B_bh_return_pct": 49.18, "B_psr": 0.9809, "B_ic": 0.2431, "B_precision": 0.6774, "B_recall": 0.5676, "B_f1": 0.6176, "B_f2": 0.5866, "B_accuracy": 0.5185, "B_mcc": -0.0194, "B_tp": 21, "B_fp": 10, "B_tn": 7, "B_fn": 16, "D_sharpe": -3.3997, "D_sortino": -3.312, "D_excess_sharpe": -8.0994, "D_return_pct": -7.26, "D_hit_rate": 38.89, "D_n": 54, "D_bh_sharpe": 4.6998, "D_bh_return_pct": 10.46, "D_psr": 0.0686, "D_ic": 0.064, "D_precision": 0.5, "D_recall": 0.0606, "D_f1": 0.1081, "D_f2": 0.0735, "D_accuracy": 0.3889, "D_mcc": -0.0645, "D_tp": 2, "D_fp": 2, "D_tn": 19, "D_fn": 31, "sharpe": -3.3997, "sortino": -3.312, "return_pct": -7.26, "equity": 927.4, "max_dd": 0.0, "win_rate": 38.89, "profit_factor": 0.0, "ic": 0.064, "hit": 38.89, "psr": 0.0686, "bh_sharpe": 4.6998, "bh_return_pct": 10.46, "excess_sharpe": -8.0994, "precision": 0.5, "recall": 0.0606, "f1": 0.1081, "f2": 0.0735, "mcc": -0.0645, "accuracy": 0.3889, "tp": 2, "fp": 2, "tn": 19, "fn": 31}, {"fold": "fold_4", "regime": "China devaluation and oil crash", "n": 96, "A_sharpe": 2.9177, "A_sortino": 2.899, "A_excess_sharpe": 3.3418, "A_return_pct": 22.47, "A_hit_rate": 58.95, "A_n": 96, "A_bh_sharpe": -0.4241, "A_bh_return_pct": -3.73, "A_psr": 0.9572, "A_ic": 0.1872, "A_precision": 0.56, "A_recall": 0.6222, "A_f1": 0.5895, "A_f2": 0.6087, "A_accuracy": 0.5938, "A_mcc": 0.1906, "A_tp": 28, "A_fp": 22, "A_tn": 29, "A_fn": 17, "B_sharpe": -1.7382, "B_sortino": -1.5308, "B_excess_sharpe": -0.5539, "B_return_pct": -28.44, "B_hit_rate": 44.79, "B_n": 96, "B_bh_sharpe": -1.1843, "B_bh_return_pct": -21.44, "B_psr": 0.1241, "B_ic": 0.0098, "B_precision": 0.4598, "B_recall": 0.8696, "B_f1": 0.6015, "B_f2": 0.738, "B_accuracy": 0.4479, "B_mcc": -0.1207, "B_tp": 40, "B_fp": 47, "B_tn": 3, "B_fn": 6, "D_sharpe": 2.9177, "D_sortino": 2.899, "D_excess_sharpe": 3.3418, "D_return_pct": 22.47, "D_hit_rate": 58.95, "D_n": 96, "D_bh_sharpe": -0.4241, "D_bh_return_pct": -3.73, "D_psr": 0.9572, "D_ic": 0.1872, "D_precision": 0.56, "D_recall": 0.6222, "D_f1": 0.5895, "D_f2": 0.6087, "D_accuracy": 0.5938, "D_mcc": 0.1906, "D_tp": 28, "D_fp": 22, "D_tn": 29, "D_fn": 17, "sharpe": 2.9177, "sortino": 2.899, "return_pct": 22.47, "equity": 1224.6999999999998, "max_dd": 0.0, "win_rate": 58.95, "profit_factor": 0.0, "ic": 0.1872, "hit": 58.95, "psr": 0.9572, "bh_sharpe": -0.4241, "bh_return_pct": -3.73, "excess_sharpe": 3.3418, "precision": 0.56, "recall": 0.6222, "f1": 0.5895, "f2": 0.6087, "mcc": 0.1906, "accuracy": 0.5938, "tp": 28, "fp": 22, "tn": 29, "fn": 17}, {"fold": "fold_5", "regime": "2018 Vol-mageddon + Q4 sell-off", "n": 54, "A_sharpe": 0.6484, "A_sortino": 0.6864, "A_excess_sharpe": -0.7796, "A_return_pct": 1.68, "A_hit_rate": 51.85, "A_n": 54, "A_bh_sharpe": 1.428, "A_bh_return_pct": 3.97, "A_psr": 0.6175, "A_ic": 0.1846, "A_precision": 0.8, "A_recall": 0.1379, "A_f1": 0.2353, "A_f2": 0.1653, "A_accuracy": 0.5185, "A_mcc": 0.1685, "A_tp": 4, "A_fp": 1, "A_tn": 24, "A_fn": 25, "B_sharpe": 0.8921, "B_sortino": 0.8715, "B_excess_sharpe": -4.0401, "B_return_pct": 4.97, "B_hit_rate": 53.7, "B_n": 54, "B_bh_sharpe": 4.9322, "B_bh_return_pct": 34.93, "B_psr": 0.6583, "B_ic": 0.1296, "B_precision": 0.7308, "B_recall": 0.5135, "B_f1": 0.6032, "B_f2": 0.546, "B_accuracy": 0.537, "B_mcc": 0.0946, "B_tp": 19, "B_fp": 7, "B_tn": 10, "B_fn": 18, "D_sharpe": 0.6484, "D_sortino": 0.6864, "D_excess_sharpe": -0.7796, "D_return_pct": 1.68, "D_hit_rate": 51.85, "D_n": 54, "D_bh_sharpe": 1.428, "D_bh_return_pct": 3.97, "D_psr": 0.6175, "D_ic": 0.1846, "D_precision": 0.8, "D_recall": 0.1379, "D_f1": 0.2353, "D_f2": 0.1653, "D_accuracy": 0.5185, "D_mcc": 0.1685, "D_tp": 4, "D_fp": 1, "D_tn": 24, "D_fn": 25, "sharpe": 0.6484, "sortino": 0.6864, "return_pct": 1.68, "equity": 1016.8, "max_dd": 0.0, "win_rate": 51.85, "profit_factor": 0.0, "ic": 0.1846, "hit": 51.85, "psr": 0.6175, "bh_sharpe": 1.428, "bh_return_pct": 3.97, "excess_sharpe": -0.7796, "precision": 0.8, "recall": 0.1379, "f1": 0.2353, "f2": 0.1653, "mcc": 0.1685, "accuracy": 0.5185, "tp": 4, "fp": 1, "tn": 24, "fn": 25}, {"fold": "fold_6", "regime": "COVID crash and V-recovery", "n": 75, "A_sharpe": -3.5956, "A_sortino": -3.6383, "A_excess_sharpe": -7.895, "A_return_pct": -11.24, "A_hit_rate": 34.67, "A_n": 75, "A_bh_sharpe": 4.2994, "A_bh_return_pct": 14.68, "A_psr": 0.0329, "A_ic": 0.2243, "A_precision": 1.0, "A_recall": 0.0392, "A_f1": 0.0755, "A_f2": 0.0485, "A_accuracy": 0.3467, "A_mcc": 0.1135, "A_tp": 2, "A_fp": 0, "A_tn": 24, "A_fn": 49, "B_sharpe": -6.3808, "B_sortino": -5.8033, "B_excess_sharpe": -20.7147, "B_return_pct": -36.48, "B_hit_rate": 29.33, "B_n": 75, "B_bh_sharpe": 14.3339, "B_bh_return_pct": 120.13, "B_psr": 0.0005, "B_ic": 0.2322, "B_precision": 0.8571, "B_recall": 0.1905, "B_f1": 0.3117, "B_f2": 0.2256, "B_accuracy": 0.2933, "B_mcc": 0.0224, "B_tp": 12, "B_fp": 2, "B_tn": 10, "B_fn": 51, "D_sharpe": -3.5956, "D_sortino": -3.6383, "D_excess_sharpe": -7.895, "D_return_pct": -11.24, "D_hit_rate": 34.67, "D_n": 75, "D_bh_sharpe": 4.2994, "D_bh_return_pct": 14.68, "D_psr": 0.0329, "D_ic": 0.2243, "D_precision": 1.0, "D_recall": 0.0392, "D_f1": 0.0755, "D_f2": 0.0485, "D_accuracy": 0.3467, "D_mcc": 0.1135, "D_tp": 2, "D_fp": 0, "D_tn": 24, "D_fn": 49, "sharpe": -3.5956, "sortino": -3.6383, "return_pct": -11.24, "equity": 887.5999999999999, "max_dd": 0.0, "win_rate": 34.67, "profit_factor": 0.0, "ic": 0.2243, "hit": 34.67, "psr": 0.0329, "bh_sharpe": 4.2994, "bh_return_pct": 14.68, "excess_sharpe": -7.895, "precision": 1.0, "recall": 0.0392, "f1": 0.0755, "f2": 0.0485, "mcc": 0.1135, "accuracy": 0.3467, "tp": 2, "fp": 0, "tn": 24, "fn": 49}, {"fold": "fold_7", "regime": "Inflation bear, AI rally and 2025", "n": 114, "A_sharpe": -0.2216, "A_sortino": -0.2287, "A_excess_sharpe": -3.0667, "A_return_pct": -2.11, "A_hit_rate": 46.49, "A_n": 114, "A_bh_sharpe": 2.845, "A_bh_return_pct": 21.34, "A_psr": 0.441, "A_ic": 0.0436, "A_precision": 0.6071, "A_recall": 0.2537, "A_f1": 0.3579, "A_f2": 0.2872, "A_accuracy": 0.4649, "A_mcc": 0.0225, "A_tp": 17, "A_fp": 11, "A_tn": 36, "A_fn"