{"experiment_num": 62, "backbone": "mlp", "description": "MLP @ exp 6 huber_delta=0.015 (textbook-correct per Huber 2009 1.345*sigma for QQQ noise floor 0.011) - F1 GFC robust-loss hill-climb", "config": {"seq_len": 10, "lr": 0.0003, "batch_size": 32, "epochs": 50, "weight_decay": 1e-05, "patience": 10, "warmup_epochs": 0, "head_dropout": 0.25, "huber_delta": 0.015, "grad_clip": 1.0, "seed": 0, "hidden_size": null, "num_layers": null, "max_depth": null, "gbm_lr": null, "n_estimators": null}, "composite": 0.087, "test_pos_folds": 5, "val_pos_folds": 3, "val_loss": -2.940117259853807, "elapsed_sec": 29.7, "timestamp": "2026-04-27T22:11:40", "sharpe": 0.5043, "val_sharpe": 0.287, "ic": 0.0087, "hit": 53.02, "psr": 0.8828, "equity": 1749.3000000000002, "return_pct": 74.93, "bh_sharpe": 0.6042, "bh_return_pct": 103.49, "excess_sharpe": -0.0999, "B_sharpe": 0.3396, "B_excess_sharpe": -1.3612, "B_return_pct": 22.9, "D_sharpe": 0.5043, "D_excess_sharpe": -0.0999, "D_return_pct": 74.93, "precision": 0.5721, "recall": 0.7125, "f1": 0.6347, "f2": 0.6792, "mcc": -0.0006, "accuracy": 0.5305, "val_precision": 0.5448, "val_recall": 0.6839, "val_f1": 0.6065, "val_f2": 0.6507, "val_mcc": -0.0305, "val_accuracy": 0.5076, "per_window": [{"fold": "fold_1", "regime": "GFC peak crash (Lehman + Mar-2009 bottom)", "n": 115, "A_sharpe": -0.5208, "A_sortino": -0.538, "A_excess_sharpe": -0.0766, "A_return_pct": -15.86, "A_hit_rate": 46.09, "A_n": 115, "A_bh_sharpe": -0.4441, "A_bh_return_pct": -14.4, "A_psr": 0.3634, "A_ic": 0.1503, "A_precision": 0.4649, "A_recall": 0.9815, "A_f1": 0.631, "A_f2": 0.803, "A_accuracy": 0.4609, "A_mcc": -0.0995, "A_tp": 53, "A_fp": 61, "A_tn": 0, "A_fn": 1, "B_sharpe": -0.8872, "B_sortino": -0.8445, "B_excess_sharpe": -0.5894, "B_return_pct": -43.11, "B_hit_rate": 50.0, "B_n": 115, "B_bh_sharpe": -0.2978, "B_bh_return_pct": -27.23, "B_psr": 0.2751, "B_ic": 0.1179, "B_precision": 0.5046, "B_recall": 0.9322, "B_f1": 0.6548, "B_f2": 0.7971, "B_accuracy": 0.4957, "B_mcc": -0.0721, "B_tp": 55, "B_fp": 54, "B_tn": 2, "B_fn": 4, "D_sharpe": -0.5208, "D_sortino": -0.538, "D_excess_sharpe": -0.0766, "D_return_pct": -15.86, "D_hit_rate": 46.09, "D_n": 115, "D_bh_sharpe": -0.4441, "D_bh_return_pct": -14.4, "D_psr": 0.3634, "D_ic": 0.1503, "D_precision": 0.4649, "D_recall": 0.9815, "D_f1": 0.631, "D_f2": 0.803, "D_accuracy": 0.4609, "D_mcc": -0.0995, "D_tp": 53, "D_fp": 61, "D_tn": 0, "D_fn": 1, "sharpe": -0.5208, "sortino": -0.538, "return_pct": -15.86, "equity": 841.4000000000001, "max_dd": 0.0, "win_rate": 46.09, "profit_factor": 0.0, "ic": 0.1503, "hit": 46.09, "psr": 0.3634, "bh_sharpe": -0.4441, "bh_return_pct": -14.4, "excess_sharpe": -0.0766, "precision": 0.4649, "recall": 0.9815, "f1": 0.631, "f2": 0.803, "mcc": -0.0995, "accuracy": 0.4609, "tp": 53, "fp": 61, "tn": 0, "fn": 1}, {"fold": "fold_2", "regime": "2011 US-downgrade + EU debt", "n": 136, "A_sharpe": -0.5616, "A_sortino": -0.5612, "A_excess_sharpe": -2.2944, "A_return_pct": -7.13, "A_hit_rate": 47.41, "A_n": 136, "A_bh_sharpe": 1.7327, "A_bh_return_pct": 19.75, "A_psr": 0.3407, "A_ic": -0.0518, "A_precision": 0.5319, "A_recall": 0.641, "A_f1": 0.5814, "A_f2": 0.6158, "A_accuracy": 0.4706, "A_mcc": -0.1259, "A_tp": 50, "A_fp": 44, "A_tn": 14, "A_fn": 28, "B_sharpe": 5.0324, "B_sortino": 4.4185, "B_excess_sharpe": 0.9665, "B_return_pct": 207.03, "B_hit_rate": 72.79, "B_n": 136, "B_bh_sharpe": 4.0659, "B_bh_return_pct": 148.68, "B_psr": 0.9998, "B_ic": -0.0058, "B_precision": 0.7323, "B_recall": 0.9688, "B_f1": 0.8341, "B_f2": 0.91, "B_accuracy": 0.7279, "B_mcc": 0.2177, "B_tp": 93, "B_fp": 34, "B_tn": 6, "B_fn": 3, "D_sharpe": -0.5616, "D_sortino": -0.5612, "D_excess_sharpe": -2.2944, "D_return_pct": -7.13, "D_hit_rate": 47.41, "D_n": 136, "D_bh_sharpe": 1.7327, "D_bh_return_pct": 19.75, "D_psr": 0.3407, "D_ic": -0.0518, "D_precision": 0.5319, "D_recall": 0.641, "D_f1": 0.5814, "D_f2": 0.6158, "D_accuracy": 0.4706, "D_mcc": -0.1259, "D_tp": 50, "D_fp": 44, "D_tn": 14, "D_fn": 28, "sharpe": -0.5616, "sortino": -0.5612, "return_pct": -7.13, "equity": 928.6999999999999, "max_dd": 0.0, "win_rate": 47.41, "profit_factor": 0.0, "ic": -0.0518, "hit": 47.41, "psr": 0.3407, "bh_sharpe": 1.7327, "bh_return_pct": 19.75, "excess_sharpe": -2.2944, "precision": 0.5319, "recall": 0.641, "f1": 0.5814, "f2": 0.6158, "mcc": -0.1259, "accuracy": 0.4706, "tp": 50, "fp": 44, "tn": 14, "fn": 28}, {"fold": "fold_3", "regime": "Taper tantrum and 2014 H1", "n": 178, "A_sharpe": 1.9094, "A_sortino": 1.826, "A_excess_sharpe": 0.5648, "A_return_pct": 18.29, "A_hit_rate": 56.5, "A_n": 178, "A_bh_sharpe": 1.3445, "A_bh_return_pct": 12.41, "A_psr": 0.9388, "A_ic": 0.1511, "A_precision": 0.6477, "A_recall": 0.5534, "A_f1": 0.5969, "A_f2": 0.57, "A_accuracy": 0.5674, "A_mcc": 0.1383, "A_tp": 57, "A_fp": 31, "A_tn": 44, "A_fn": 46, "B_sharpe": 3.2437, "B_sortino": 3.2754, "B_excess_sharpe": 0.1954, "B_return_pct": 77.94, "B_hit_rate": 61.8, "B_n": 178, "B_bh_sharpe": 3.0483, "B_bh_return_pct": 71.83, "B_psr": 0.9965, "B_ic": 0.049, "B_precision": 0.6228, "B_recall": 0.9541, "B_f1": 0.7536, "B_f2": 0.8624, "B_accuracy": 0.618, "B_mcc": 0.0831, "B_tp": 104, "B_fp": 63, "B_tn": 6, "B_fn": 5, "D_sharpe": 1.9094, "D_sortino": 1.826, "D_excess_sharpe": 0.5648, "D_return_pct": 18.29, "D_hit_rate": 56.5, "D_n": 178, "D_bh_sharpe": 1.3445, "D_bh_return_pct": 12.41, "D_psr": 0.9388, "D_ic": 0.1511, "D_precision": 0.6477, "D_recall": 0.5534, "D_f1": 0.5969, "D_f2": 0.57, "D_accuracy": 0.5674, "D_mcc": 0.1383, "D_tp": 57, "D_fp": 31, "D_tn": 44, "D_fn": 46, "sharpe": 1.9094, "sortino": 1.826, "return_pct": 18.29, "equity": 1182.9, "max_dd": 0.0, "win_rate": 56.5, "profit_factor": 0.0, "ic": 0.1511, "hit": 56.5, "psr": 0.9388, "bh_sharpe": 1.3445, "bh_return_pct": 12.41, "excess_sharpe": 0.5648, "precision": 0.6477, "recall": 0.5534, "f1": 0.5969, "f2": 0.57, "mcc": 0.1383, "accuracy": 0.5674, "tp": 57, "fp": 31, "tn": 44, "fn": 46}, {"fold": "fold_4", "regime": "China devaluation and oil crash", "n": 157, "A_sharpe": 0.9022, "A_sortino": 0.8721, "A_excess_sharpe": 0.8924, "A_return_pct": 10.2, "A_hit_rate": 51.92, "A_n": 157, "A_bh_sharpe": 0.0098, "A_bh_return_pct": -1.05, "A_psr": 0.7584, "A_ic": 0.0953, "A_precision": 0.525, "A_recall": 0.7778, "A_f1": 0.6269, "A_f2": 0.7095, "A_accuracy": 0.5223, "A_mcc": 0.0327, "A_tp": 63, "A_fp": 57, "A_tn": 19, "A_fn": 18, "B_sharpe": -0.2791, "B_sortino": -0.2462, "B_excess_sharpe": -0.295, "B_return_pct": -12.82, "B_hit_rate": 54.14, "B_n": 157, "B_bh_sharpe": 0.0159, "B_bh_return_pct": -5.48, "B_psr": 0.4127, "B_ic": 0.0273, "B_precision": 0.5489, "B_recall": 0.8588, "B_f1": 0.6697, "B_f2": 0.7717, "B_accuracy": 0.5414, "B_mcc": 0.0353, "B_tp": 73, "B_fp": 60, "B_tn": 12, "B_fn": 12, "D_sharpe": 0.9022, "D_sortino": 0.8721, "D_excess_sharpe": 0.8924, "D_return_pct": 10.2, "D_hit_rate": 51.92, "D_n": 157, "D_bh_sharpe": 0.0098, "D_bh_return_pct": -1.05, "D_psr": 0.7584, "D_ic": 0.0953, "D_precision": 0.525, "D_recall": 0.7778, "D_f1": 0.6269, "D_f2": 0.7095, "D_accuracy": 0.5223, "D_mcc": 0.0327, "D_tp": 63, "D_fp": 57, "D_tn": 19, "D_fn": 18, "sharpe": 0.9022, "sortino": 0.8721, "return_pct": 10.2, "equity": 1102.0, "max_dd": 0.0, "win_rate": 51.92, "profit_factor": 0.0, "ic": 0.0953, "hit": 51.92, "psr": 0.7584, "bh_sharpe": 0.0098, "bh_return_pct": -1.05, "excess_sharpe": 0.8924, "precision": 0.525, "recall": 0.7778, "f1": 0.6269, "f2": 0.7095, "mcc": 0.0327, "accuracy": 0.5223, "tp": 63, "fp": 57, "tn": 19, "fn": 18}, {"fold": "fold_5", "regime": "2018 Vol-mageddon + Q4 sell-off", "n": 177, "A_sharpe": 1.0419, "A_sortino": 1.0509, "A_excess_sharpe": 0.7321, "A_return_pct": 16.13, "A_hit_rate": 53.67, "A_n": 177, "A_bh_sharpe": 0.3098, "A_bh_return_pct": 3.19, "A_psr": 0.8088, "A_ic": 0.0079, "A_precision": 0.5946, "A_recall": 0.6408, "A_f1": 0.6168, "A_f2": 0.631, "A_accuracy": 0.5367, "A_mcc": 0.0333, "A_tp": 66, "A_fp": 45, "A_tn": 29, "A_fn": 37, "B_sharpe": -0.5317, "B_sortino": -0.4675, "B_excess_sharpe": -1.4234, "B_return_pct": -22.08, "B_hit_rate": 53.41, "B_n": 177, "B_bh_sharpe": 0.8917, "B_bh_return_pct": 23.8, "B_psr": 0.3271, "B_ic": -0.1227, "B_precision": 0.5833, "B_recall": 0.8349, "B_f1": 0.6868, "B_f2": 0.7686, "B_accuracy": 0.5311, "B_mcc": -0.182, "B_tp": 91, "B_fp": 65, "B_tn": 3, "B_fn": 18, "D_sharpe": 1.0419, "D_sortino": 1.0509, "D_excess_sharpe": 0.7321, "D_return_pct": 16.13, "D_hit_rate": 53.67, "D_n": 177, "D_bh_sharpe": 0.3098, "D_bh_return_pct": 3.19, "D_psr": 0.8088, "D_ic": 0.0079, "D_precision": 0.5946, "D_recall": 0.6408, "D_f1": 0.6168, "D_f2": 0.631, "D_accuracy": 0.5367, "D_mcc": 0.0333, "D_tp": 66, "D_fp": 45, "D_tn": 29, "D_fn": 37, "sharpe": 1.0419, "sortino": 1.0509, "return_pct": 16.13, "equity": 1161.3, "max_dd": 0.0, "win_rate": 53.67, "profit_factor": 0.0, "ic": 0.0079, "hit": 53.67, "psr": 0.8088, "bh_sharpe": 0.3098, "bh_return_pct": 3.19, "excess_sharpe": 0.7321, "precision": 0.5946, "recall": 0.6408, "f1": 0.6168, "f2": 0.631, "mcc": 0.0333, "accuracy": 0.5367, "tp": 66, "fp": 45, "tn": 29, "fn": 37}, {"fold": "fold_6", "regime": "COVID crash and V-recovery", "n": 222, "A_sharpe": 0.2809, "A_sortino": 0.2848, "A_excess_sharpe": -0.6079, "A_return_pct": 3.04, "A_hit_rate": 48.65, "A_n": 222, "A_bh_sharpe": 0.8888, "A_bh_return_pct": 26.13, "A_psr": 0.6033, "A_ic": -0.0132, "A_precision": 0.6176, "A_recall": 0.4565, "A_f1": 0.525, "A_f2": 0.4817, "A_accuracy": 0.4865, "A_mcc": -0.0076, "A_tp": 63, "A_fp": 39, "A_tn": 45, "A_fn": 75, "B_sharpe": 1.3089, "B_sortino": 1.1646, "B_excess_sharpe": -1.0796, "B_return_pct": 79.05, "B_hit_rate": 56.56, "B_n": 222, "B_bh_sharpe": 2.3884, "B_bh_return_pct": 243.18, "B_psr": 0.8813, "B_ic": 0.0737, "B_precision": 0.6306, "B_recall": 0.7226, "B_f1": 0.6735, "B_f2": 0.7021, "B_accuracy": 0.5676, "B_mcc": 0.043, "B_tp": 99, "B_fp": 58, "B_tn": 27, "B_fn": 38, "D_sharpe": 0.2809, "D_sortino": 0.2848, "D_excess_sharpe": -0.6079, "D_return_pct": 3.04, "D_hit_rate": 48.65, "D_n": 222, "D_bh_sharpe": 0.8888, "D_bh_return_pct": 26.13, "D_psr": 0.6033, "D_ic": -0.0132, "D_precision": 0.6176, "D_recall": 0.4565, "D_f1": 0.525, "D_f2": 0.4817, "D_accuracy": 0.4865, "D_mcc": -0.0076, "D_tp": 63, "D_fp": 39, "D_tn": 45, "D_fn": 75, "sharpe": 0.2809, "sortino": 0.2848, "return_pct": 3.04, "equity": 1030.4, "max_dd": 0.0, "win_rate": 48.65, "profit_factor": 0.0, "ic": -0.0132, "hit": 48.65, "psr": 0.6033, "bh_sharpe": 0.8888, "bh_return_pct": 26.13, "excess_sharpe": -0.6079, "precision": 0.6176, "recall": 0.4565, "f1": 0.525, "f2": 0.4817, "mcc": -0.0076, "accuracy": 0.4865, "tp": 63, "fp": 39, "tn": 45, "fn": 75}, {"fold": "fold_7", "regime": "Inflation bear, AI rally and 2025", "n": 425, "A_sharpe": 1.0963, "A_sortino": 1.0308, "A_excess_sharpe": 0.1248, "A_return_pct": 43.49, "A_hit_rate": 57.65, "A_n": 425, "A_bh_sharpe": 0.9715, "A_bh_return_pct": 37.12, "A_psr": 0.9246, "A_ic": 0.0209, "A_precision": 0.5931, "A_recall": 0.892, "A_f1": 0.7125, "A_f2": 0.8103, "A_accuracy": 0.5765, "A_mcc": 0.0273, "A_tp": 223, "A_fp": 153, "A_tn": 22, "A_fn": 27, "B_sharpe": -1.2393, "B_sortino": -1.1527, "B_excess_sharpe": -3.742, "B_return_pct": -67.49, "B_hit_rate": 48.11, "B_n": 425, "B_bh_sharpe": 2.5027, "B_bh_return_pct": 458.83, "B_psr": 0.052, "B_ic": -0.1681, "B_precision": 0.5724, "B_recall": 0.6312, "B_f1": 0.6004, "B_f2": 0.6185, "B_accuracy": 0.48, "B_mcc": -0.1401, "B_tp": 166, "B_fp": 124, "B_tn": 38, "B_fn": 97, "D_sharpe": 1.0963, "D_sortino": 1.0308, "D_excess_sharpe": 0.1248, "D_return_pct": 43.49, "D_hit_rate": 57.65, "D_n": 425, "D_bh_sharpe": 0.9715, "D_bh_return_pct": 37.12, "D_psr": 0.9246, "D_ic": 0.0209, "D_precision": 0.5931, "D_recall": 0.892, "D_f1": 0.7125, "D_f2": 0.8103, "D_accuracy": 0.5765, "D_mcc": 0.0273, "D_tp": 223, "D_fp": 153, "D_tn": 22, "D_fn": 27, "sharpe": 1.0963, "sortino": 1.0308, "return_pct": 43.49, "equity": 1434.9, "max_dd": 0.0, "win_rate": 57.65, "profit_factor": 0.0, "ic": 0.0209, "hit": 57.65, "psr": 0.9246, "bh_sharpe": 0.9715, "bh_return_pct": 37.12, "excess_sharpe": 0.1248, "precision": 0.5931, "recall": 0.892, "f1": 0.7125, "f2": 0.8103, "mcc": 0.0273, "accuracy": 0.5765, "tp": 223, "fp": 153, "tn": 22, "fn": 27}], "per_window_val": [{"fold": "fold_1", "regime": "GFC peak crash (Lehman + Mar-2009 bottom)", "n": 104, "A_sharpe": -0.198, "A_sortino": -0.1667, "A_excess_sharpe": -0.0308, "A_return_pct": -4.18, "A_hit_rate": 53.92, "A_n": 104, "A_bh_sharpe": -0.1672, "A_bh_return_pct": -3.81, "A_psr": 0.4493, "A_ic": 0.0709, "A_precision": 0.5275, "A_recall": 0.8889, "A_f1": 0.6621, "A_f2": 0.7818, "A_accuracy": 0.5288, "A_mcc": 0.0436, "A_tp": 48, "A_fp": 43, "A_tn": 7, "A_fn": 6, "B_sharpe": -0.5402, "B_sortino": -0.4711, "B_excess_sharpe": 1.7339, "B_return_pct": -17.23, "B_hit_rate": 52.43, "B_n": 104, "B_bh_sharpe": -2.2741, "B_bh_return_pct": -44.12, "B_psr": 0.3632, "B_ic": 0.1566, "B_precision": 0.5211, "B_recall": 0.7115, "B_f1": 0.6016, "B_f2": 0.6631, "B_accuracy": 0.5288, "B_mcc": 0.062, "B_tp": 37, "B_fp": 34, "B_tn": 18, "B_fn": 15, "D_sharpe": -0.198, "D_sortino": -0.1667, "D_excess_sharpe": -0.0308, "D_return_pct": -4.18, "D_hit_rate": 53.92, "D_n": 104, "D_bh_sharpe": -0.1672, "D_bh_return_pct": -3.81, "D_psr": 0.4493, "D_ic": 0.0709, "D_precision": 0.5275, "D_recall": 0.8889, "D_f1": 0.6621, "D_f2": 0.7818, "D_accuracy": 0.5288, "D_mcc": 0.0436, "D_tp": 48, "D_fp": 43, "D_tn": 7, "D_fn": 6, "sharpe": -0.198, "sortino": -0.1667, "return_pct": -4.18, "equity": 958.2, "max_dd": 0.0, "win_rate": 53.92, "profit_factor": 0.0, "ic": 0.0709, "hit": 53.92, "psr": 0.4493, "bh_sharpe": -0.1672, "bh_return_pct": -3.81, "excess_sharpe": -0.0308, "precision": 0.5275, "recall": 0.8889, "f1": 0.6621, "f2": 0.7818, "mcc": 0.0436, "accuracy": 0.5288, "tp": 48, "fp": 43, "tn": 7, "fn": 6}, {"fold": "fold_2", "regime": "2011 US-downgrade + EU debt", "n": 96, "A_sharpe": -1.1105, "A_sortino": -1.0662, "A_excess_sharpe": -0.8364, "A_return_pct": -11.92, "A_hit_rate": 45.26, "A_n": 96, "A_bh_sharpe": -0.2741, "A_bh_return_pct": -4.09, "A_psr": 0.2449, "A_ic": -0.0115, "A_precision": 0.4819, "A_recall": 0.8, "A_f1": 0.6015, "A_f2": 0.7067, "A_accuracy": 0.4479, "A_mcc": -0.1968, "A_tp": 40, "A_fp": 43, "A_tn": 3, "A_fn": 10, "B_sharpe": -0.5768, "B_sortino": -0.544, "B_excess_sharpe": 0.4506, "B_return_pct": -17.74, "B_hit_rate": 47.92, "B_n": 96, "B_bh_sharpe": -1.0274, "B_bh_return_pct": -25.58, "B_psr": 0.3602, "B_ic": -0.0073, "B_precision": 0.4598, "B_recall": 0.9302, "B_f1": 0.6154, "B_f2": 0.7722, "B_accuracy": 0.4792, "B_mcc": 0.0741, "B_tp": 40, "B_fp": 47, "B_tn": 6, "B_fn": 3, "D_sharpe": -1.1105, "D_sortino": -1.0662, "D_excess_sharpe": -0.8364, "D_return_pct": -11.92, "D_hit_rate": 45.26, "D_n": 96, "D_bh_sharpe": -0.2741, "D_bh_return_pct": -4.09, "D_psr": 0.2449, "D_ic": -0.0115, "D_precision": 0.4819, "D_recall": 0.8, "D_f1": 0.6015, "D_f2": 0.7067, "D_accuracy": 0.4479, "D_mcc": -0.1968, "D_tp": 40, "D_fp": 43, "D_tn": 3, "D_fn": 10, "sharpe": -1.1105, "sortino": -1.0662, "return_pct": -11.92, "equity": 880.8000000000001, "max_dd": 0.0, "win_rate": 45.26, "profit_factor": 0.0, "ic": -0.0115, "hit": 45.26, "psr": 0.2449, "bh_sharpe": -0.2741, "bh_return_pct": -4.09, "excess_sharpe": -0.8364, "precision": 0.4819, "recall": 0.8, "f1": 0.6015, "f2": 0.7067, "mcc": -0.1968, "accuracy": 0.4479, "tp": 40, "fp": 43, "tn": 3, "fn": 10}, {"fold": "fold_3", "regime": "Taper tantrum and 2014 H1", "n": 54, "A_sharpe": -1.5835, "A_sortino": -1.5453, "A_excess_sharpe": -6.2833, "A_return_pct": -3.57, "A_hit_rate": 46.3, "A_n": 54, "A_bh_sharpe": 4.6998, "A_bh_return_pct": 10.46, "A_psr": 0.2364, "A_ic": -0.1286, "A_precision": 0.6429, "A_recall": 0.2727, "A_f1": 0.383, "A_f2": 0.3082, "A_accuracy": 0.463, "A_mcc": 0.0385, "A_tp": 9, "A_fp": 5, "A_tn": 16, "A_fn": 24, "B_sharpe": 6.5501, "B_sortino": 8.8776, "B_excess_sharpe": -2.4824, "B_return_pct": 35.95, "B_hit_rate": 62.96, "B_n": 54, "B_bh_sharpe": 9.0326, "B_bh_return_pct": 49.18, "B_psr": 0.9993, "B_ic": -0.117, "B_precision": 0.6667, "B_recall": 0.9189, "B_f1": 0.7727, "B_f2": 0.8543, "B_accuracy": 0.6296, "B_mcc": -0.1644, "B_tp": 34, "B_fp": 17, "B_tn": 0, "B_fn": 3, "D_sharpe": -1.5835, "D_sortino": -1.5453, "D_excess_sharpe": -6.2833, "D_return_pct": -3.57, "D_hit_rate": 46.3, "D_n": 54, "D_bh_sharpe": 4.6998, "D_bh_return_pct": 10.46, "D_psr": 0.2364, "D_ic": -0.1286, "D_precision": 0.6429, "D_recall": 0.2727, "D_f1": 0.383, "D_f2": 0.3082, "D_accuracy": 0.463, "D_mcc": 0.0385, "D_tp": 9, "D_fp": 5, "D_tn": 16, "D_fn": 24, "sharpe": -1.5835, "sortino": -1.5453, "return_pct": -3.57, "equity": 964.3000000000001, "max_dd": 0.0, "win_rate": 46.3, "profit_factor": 0.0, "ic": -0.1286, "hit": 46.3, "psr": 0.2364, "bh_sharpe": 4.6998, "bh_return_pct": 10.46, "excess_sharpe": -6.2833, "precision": 0.6429, "recall": 0.2727, "f1": 0.383, "f2": 0.3082, "mcc": 0.0385, "accuracy": 0.463, "tp": 9, "fp": 5, "tn": 16, "fn": 24}, {"fold": "fold_4", "regime": "China devaluation and oil crash", "n": 96, "A_sharpe": 0.4605, "A_sortino": 0.4718, "A_excess_sharpe": 0.8846, "A_return_pct": 2.7, "A_hit_rate": 47.37, "A_n": 96, "A_bh_sharpe": -0.4241, "A_bh_return_pct": -3.73, "A_psr": 0.611, "A_ic": 0.102, "A_precision": 0.4559, "A_recall": 0.6889, "A_f1": 0.5487, "A_f2": 0.625, "A_accuracy": 0.4688, "A_mcc": -0.0402, "A_tp": 31, "A_fp": 37, "A_tn": 14, "A_fn": 14, "B_sharpe": -1.3117, "B_sortino": -1.1414, "B_excess_sharpe": -0.1274, "B_return_pct": -23.11, "B_hit_rate": 46.88, "B_n": 96, "B_bh_sharpe": -1.1843, "B_bh_return_pct": -21.44, "B_psr": 0.1956, "B_ic": 0.0425, "B_precision": 0.4731, "B_recall": 0.9565, "B_f1": 0.6331, "B_f2": 0.7942, "B_accuracy": 0.4688, "B_mcc": -0.0674, "B_tp": 44, "B_fp": 49, "B_tn": 1, "B_fn": 2, "D_sharpe": 0.4605, "D_sortino": 0.4718, "D_excess_sharpe": 0.8846, "D_return_pct": 2.7, "D_hit_rate": 47.37, "D_n": 96, "D_bh_sharpe": -0.4241, "D_bh_return_pct": -3.73, "D_psr": 0.611, "D_ic": 0.102, "D_precision": 0.4559, "D_recall": 0.6889, "D_f1": 0.5487, "D_f2": 0.625, "D_accuracy": 0.4688, "D_mcc": -0.0402, "D_tp": 31, "D_fp": 37, "D_tn": 14, "D_fn": 14, "sharpe": 0.4605, "sortino": 0.4718, "return_pct": 2.7, "equity": 1027.0, "max_dd": 0.0, "win_rate": 47.37, "profit_factor": 0.0, "ic": 0.102, "hit": 47.37, "psr": 0.611, "bh_sharpe": -0.4241, "bh_return_pct": -3.73, "excess_sharpe": 0.8846, "precision": 0.4559, "recall": 0.6889, "f1": 0.5487, "f2": 0.625, "mcc": -0.0402, "accuracy": 0.4688, "tp": 31, "fp": 37, "tn": 14, "fn": 14}, {"fold": "fold_5", "regime": "2018 Vol-mageddon + Q4 sell-off", "n": 54, "A_sharpe": 3.8192, "A_sortino": 4.2111, "A_excess_sharpe": 2.3913, "A_return_pct": 11.04, "A_hit_rate": 61.11, "A_n": 54, "A_bh_sharpe": 1.428, "A_bh_return_pct": 3.97, "A_psr": 0.963, "A_ic": 0.2784, "A_precision": 0.6667, "A_recall": 0.5517, "A_f1": 0.6038, "A_f2": 0.5714, "A_accuracy": 0.6111, "A_mcc": 0.2325, "A_tp": 16, "A_fp": 8, "A_tn": 17, "A_fn": 13, "B_sharpe": -0.2788, "B_sortino": -0.2553, "B_excess_sharpe": -5.2109, "B_return_pct": -2.8, "B_hit_rate": 53.7, "B_n": 54, "B_bh_sharpe": 4.9322, "B_bh_return_pct": 34.93, "B_psr": 0.4491, "B_ic": -0.4869, "B_precision": 0.6304, "B_recall": 0.7838, "B_f1": 0.6988, "B_f2": 0.7474, "B_accuracy": 0.537, "B_mcc": -0.2827, "B_tp": 29, "B_fp": 17, "B_tn": 0, "B_fn": 8, "D_sharpe": 3.8192, "D_sortino": 4.2111, "D_excess_sharpe": 2.3913, "D_return_pct": 11.04, "D_hit_rate": 61.11, "D_n": 54, "D_bh_sharpe": 1.428, "D_bh_return_pct": 3.97, "D_psr": 0.963, "D_ic": 0.2784, "D_precision": 0.6667, "D_recall": 0.5517, "D_f1": 0.6038, "D_f2": 0.5714, "D_accuracy": 0.6111, "D_mcc": 0.2325, "D_tp": 16, "D_fp": 8, "D_tn": 17, "D_fn": 13, "sharpe": 3.8192, "sortino": 4.2111, "return_pct": 11.04, "equity": 1110.4, "max_dd": 0.0, "win_rate": 61.11, "profit_factor": 0.0, "ic": 0.2784, "hit": 61.11, "psr": 0.963, "bh_sharpe": 1.428, "bh_return_pct": 3.97, "excess_sharpe": 2.3913, "precision": 0.6667, "recall": 0.5517, "f1": 0.6038, "f2": 0.5714, "mcc": 0.2325, "accuracy": 0.6111, "tp": 16, "fp": 8, "tn": 17, "fn": 13}, {"fold": "fold_6", "regime": "COVID crash and V-recovery", "n": 75, "A_sharpe": -2.5963, "A_sortino": -2.508, "A_excess_sharpe": -6.8957, "A_return_pct": -8.39, "A_hit_rate": 41.33, "A_n": 75, "A_bh_sharpe": 4.2994, "A_bh_return_pct": 14.68, "A_psr": 0.0829, "A_ic": -0.2042, "A_precision": 0.64, "A_recall": 0.3137, "A_f1": 0.4211, "A_f2": 0.3493, "A_accuracy": 0.4133, "A_mcc": -0.0606, "A_tp": 16, "A_fp": 9, "A_tn": 15, "A_fn": 35, "B_sharpe": 9.0202, "B_sortino": 9.1035, "B_excess_sharpe": -5.3138, "B_return_pct": 78.46, "B_hit_rate": 74.67, "B_n": 75, "B_bh_sharpe": 14.3339, "B_bh_return_pct": 120.13, "B_psr": 1.0, "B_ic": 0.2479, "B_precision": 0.8235, "B_recall": 0.8889, "B_f1": 0.855, "B_f2": 0.875, "B_accuracy": 0.7467, "B_mcc": -0.14, "B_tp": 56, "B_fp": 12, "B_tn": 0, "B_fn": 7, "D_sharpe": -2.5963, "D_sortino": -2.508, "D_excess_sharpe": -6.8957, "D_return_pct": -8.39, "D_hit_rate": 41.33, "D_n": 75, "D_bh_sharpe": 4.2994, "D_bh_return_pct": 14.68, "D_psr": 0.0829, "D_ic": -0.2042, "D_precision": 0.64, "D_recall": 0.3137, "D_f1": 0.4211, "D_f2": 0.3493, "D_accuracy": 0.4133, "D_mcc": -0.0606, "D_tp": 16, "D_fp": 9, "D_tn": 15, "D_fn": 35, "sharpe": -2.5963, "sortino": -2.508, "return_pct": -8.39, "equity": 916.1, "max_dd": 0.0, "win_rate": 41.33, "profit_factor": 0.0, "ic": -0.2042, "hit": 41.33, "psr": 0.0829, "bh_sharpe": 4.2994, "bh_return_pct": 14.68, "excess_sharpe": -6.8957, "precision": 0.64, "recall": 0.3137, "f1": 0.4211, "f2": 0.3493, "mcc": -0.0606, "accuracy": 0.4133, "tp": 16, "fp": 9, "tn": 15, "fn": 35}, {"fold": "fold_7", "regime": "Inflation bear, AI rally and 2025", "n": 114, "A_sharpe": 3.7033, "A_sortino": 3.904, "A_excess_sharpe": 0.8583, "A_return_pct": 28.5, "A_hit_rate": 60.53, "A_n": 114, "A_bh_sharpe": 2.845, "A_bh_return_pct": 21.34, "A_psr": 0.9929, "A_ic": 0.1526, "A_precision": 0.6019, "A_recall": 0.9701, "A_f1": 0.7429, "A_f2": 0.8644, "A_accuracy"