{"experiment_num": 37, "backbone": "lightgbm", "description": "LightGBM @ exp 10 max_depth=6 (up from 4) - Chen-Guestrin 2016 KDD canonical tabular ceiling", "config": {"seq_len": 60, "lr": 0.0003, "batch_size": 32, "epochs": 50, "weight_decay": 1e-05, "patience": 10, "warmup_epochs": 0, "head_dropout": 0.1, "huber_delta": 1.0, "grad_clip": 1.0, "seed": 42, "hidden_size": null, "num_layers": null, "max_depth": 6, "gbm_lr": 0.01, "n_estimators": 1000}, "composite": 0.3357, "test_pos_folds": 5, "val_pos_folds": 4, "val_loss": null, "elapsed_sec": 351.1, "timestamp": "2026-04-27T18:45:29", "sharpe": 0.6987, "val_sharpe": 0.5357, "ic": 0.0377, "hit": 48.59, "psr": 0.9274, "equity": 1750.8, "return_pct": 75.08, "bh_sharpe": 1.2194, "bh_return_pct": 187.05, "excess_sharpe": -0.5207, "B_sharpe": -0.3049, "B_excess_sharpe": -3.1331, "B_return_pct": -65.25, "D_sharpe": 0.1565, "D_excess_sharpe": -1.0629, "D_return_pct": 4.33, "per_window": [{"fold": "fold_1", "regime": "GFC peak crash (Lehman + Mar-2009 bottom)", "n": 66, "A_sharpe": -0.2846, "A_sortino": -0.3269, "A_excess_sharpe": -0.8567, "A_return_pct": -4.52, "A_hit_rate": 39.39, "A_n": 66, "A_bh_sharpe": 0.5721, "A_bh_return_pct": 3.85, "A_psr": 0.4427, "A_ic": 0.0187, "B_sharpe": 0.1108, "B_sortino": 0.1174, "B_excess_sharpe": -1.9362, "B_return_pct": -5.3, "B_hit_rate": 46.15, "B_n": 66, "B_bh_sharpe": 2.0469, "B_bh_return_pct": 39.28, "B_psr": 0.5224, "B_ic": 0.421, "D_sharpe": 0.2685, "D_sortino": 0.293, "D_excess_sharpe": -0.3036, "D_return_pct": 0.8, "D_hit_rate": 45.45, "D_n": 66, "D_bh_sharpe": 0.5721, "D_bh_return_pct": 3.85, "D_psr": 0.5543, "D_ic": 0.1952, "sharpe": -0.2846, "sortino": -0.3269, "return_pct": -4.52, "equity": 954.8, "max_dd": 0.0, "win_rate": 39.39, "profit_factor": 0.0, "ic": 0.0187, "hit": 39.39, "psr": 0.4427, "bh_sharpe": 0.5721, "bh_return_pct": 3.85, "excess_sharpe": -0.8567, "precision": 0.4242, "recall": 0.4, "f1": 0.4118, "f2": 0.4046, "accuracy": 0.3939, "mcc": -0.2125, "tp": 14, "fp": 19, "tn": 12, "fn": 21, "A_precision": 0.4242, "A_recall": 0.4, "A_f1": 0.4118, "A_f2": 0.4046, "A_accuracy": 0.3939, "A_mcc": -0.2125, "A_tp": 14, "A_fp": 19, "A_tn": 12, "A_fn": 21}, {"fold": "fold_2", "regime": "2011 US-downgrade + EU debt", "n": 87, "A_sharpe": 1.8249, "A_sortino": 2.1937, "A_excess_sharpe": -3.197, "A_return_pct": 9.9, "A_hit_rate": 52.33, "A_n": 87, "A_bh_sharpe": 5.022, "A_bh_return_pct": 29.23, "A_psr": 0.8686, "A_ic": 0.0723, "B_sharpe": 4.5666, "B_sortino": 5.3341, "B_excess_sharpe": -6.5703, "B_return_pct": 63.98, "B_hit_rate": 59.77, "B_n": 87, "B_bh_sharpe": 11.1369, "B_bh_return_pct": 185.4, "B_psr": 0.9968, "B_ic": 0.1832, "D_sharpe": 3.172, "D_sortino": 3.9572, "D_excess_sharpe": -1.85, "D_return_pct": 17.95, "D_hit_rate": 55.81, "D_n": 87, "D_bh_sharpe": 5.022, "D_bh_return_pct": 29.23, "D_psr": 0.9777, "D_ic": 0.0904, "sharpe": 1.8249, "sortino": 2.1937, "return_pct": 9.9, "equity": 1099.0, "max_dd": 0.0, "win_rate": 52.33, "profit_factor": 0.0, "ic": 0.0723, "hit": 52.33, "psr": 0.8686, "bh_sharpe": 5.022, "bh_return_pct": 29.23, "excess_sharpe": -3.197, "precision": 0.614, "recall": 0.6481, "f1": 0.6306, "f2": 0.641, "accuracy": 0.5287, "mcc": -0.0189, "tp": 35, "fp": 22, "tn": 11, "fn": 19, "A_precision": 0.614, "A_recall": 0.6481, "A_f1": 0.6306, "A_f2": 0.641, "A_accuracy": 0.5287, "A_mcc": -0.0189, "A_tp": 35, "A_fp": 22, "A_tn": 11, "A_fn": 19}, {"fold": "fold_3", "regime": "Taper tantrum and 2014 H1", "n": 129, "A_sharpe": 0.6493, "A_sortino": 0.6364, "A_excess_sharpe": -1.1185, "A_return_pct": 3.92, "A_hit_rate": 50.78, "A_n": 129, "A_bh_sharpe": 1.7678, "A_bh_return_pct": 11.76, "A_psr": 0.6765, "A_ic": 0.0688, "B_sharpe": 2.5787, "B_sortino": 2.6155, "B_excess_sharpe": -1.6686, "B_return_pct": 35.19, "B_hit_rate": 57.36, "B_n": 129, "B_bh_sharpe": 4.2474, "B_bh_return_pct": 64.1, "B_psr": 0.9644, "B_ic": -0.0113, "D_sharpe": 2.1898, "D_sortino": 2.0386, "D_excess_sharpe": 0.422, "D_return_pct": 14.83, "D_hit_rate": 57.03, "D_n": 129, "D_bh_sharpe": 1.7678, "D_bh_return_pct": 11.76, "D_psr": 0.9295, "D_ic": 0.1192, "sharpe": 0.6493, "sortino": 0.6364, "return_pct": 3.92, "equity": 1039.1999999999998, "max_dd": 0.0, "win_rate": 50.78, "profit_factor": 0.0, "ic": 0.0688, "hit": 50.78, "psr": 0.6765, "bh_sharpe": 1.7678, "bh_return_pct": 11.76, "excess_sharpe": -1.1185, "precision": 0.6, "recall": 0.5769, "f1": 0.5882, "f2": 0.5814, "accuracy": 0.5116, "mcc": -0.0112, "tp": 45, "fp": 30, "tn": 21, "fn": 33, "A_precision": 0.6, "A_recall": 0.5769, "A_f1": 0.5882, "A_f2": 0.5814, "A_accuracy": 0.5116, "A_mcc": -0.0112, "A_tp": 45, "A_fp": 30, "A_tn": 21, "A_fn": 33}, {"fold": "fold_4", "regime": "China devaluation and oil crash", "n": 108, "A_sharpe": -0.1901, "A_sortino": -0.1786, "A_excess_sharpe": 0.4997, "A_return_pct": -2.53, "A_hit_rate": 50.47, "A_n": 108, "A_bh_sharpe": -0.6898, "A_bh_return_pct": -6.71, "A_psr": 0.4506, "A_ic": 0.0345, "B_sharpe": -2.2438, "B_sortino": -2.0912, "B_excess_sharpe": -0.2863, "B_return_pct": -36.95, "B_hit_rate": 42.59, "B_n": 108, "B_bh_sharpe": -1.9575, "B_bh_return_pct": -33.56, "B_psr": 0.0676, "B_ic": -0.0712, "D_sharpe": -0.996, "D_sortino": -0.9198, "D_excess_sharpe": -0.3063, "D_return_pct": -9.17, "D_hit_rate": 48.6, "D_n": 108, "D_bh_sharpe": -0.6898, "D_bh_return_pct": -6.71, "D_psr": 0.2561, "D_ic": -0.0468, "sharpe": -0.1901, "sortino": -0.1786, "return_pct": -2.53, "equity": 974.7, "max_dd": 0.0, "win_rate": 50.47, "profit_factor": 0.0, "ic": 0.0345, "hit": 50.47, "psr": 0.4506, "bh_sharpe": -0.6898, "bh_return_pct": -6.71, "excess_sharpe": 0.4997, "precision": 0.5, "recall": 0.5283, "f1": 0.5138, "f2": 0.5224, "accuracy": 0.5093, "mcc": 0.0192, "tp": 28, "fp": 28, "tn": 27, "fn": 25, "A_precision": 0.5, "A_recall": 0.5283, "A_f1": 0.5138, "A_f2": 0.5224, "A_accuracy": 0.5093, "A_mcc": 0.0192, "A_tp": 28, "A_fp": 28, "A_tn": 27, "A_fn": 25}, {"fold": "fold_5", "regime": "2018 Vol-mageddon + Q4 sell-off", "n": 128, "A_sharpe": 0.6354, "A_sortino": 0.77, "A_excess_sharpe": -0.5157, "A_return_pct": 6.42, "A_hit_rate": 44.53, "A_n": 128, "A_bh_sharpe": 1.1511, "A_bh_return_pct": 13.19, "A_psr": 0.6765, "A_ic": -0.0089, "B_sharpe": -3.5272, "B_sortino": -3.621, "B_excess_sharpe": -6.3391, "B_return_pct": -58.16, "B_hit_rate": 31.5, "B_n": 128, "B_bh_sharpe": 2.8119, "B_bh_return_pct": 82.25, "B_psr": 0.0075, "B_ic": -0.0793, "D_sharpe": -0.5546, "D_sortino": -0.6561, "D_excess_sharpe": -1.7057, "D_return_pct": -7.76, "D_hit_rate": 42.19, "D_n": 128, "D_bh_sharpe": 1.1511, "D_bh_return_pct": 13.19, "D_psr": 0.3492, "D_ic": -0.0127, "sharpe": 0.6354, "sortino": 0.77, "return_pct": 6.42, "equity": 1064.2, "max_dd": 0.0, "win_rate": 44.53, "profit_factor": 0.0, "ic": -0.0089, "hit": 44.53, "psr": 0.6765, "bh_sharpe": 1.1511, "bh_return_pct": 13.19, "excess_sharpe": -0.5157, "precision": 0.5636, "recall": 0.3974, "f1": 0.4662, "f2": 0.4223, "accuracy": 0.4453, "mcc": -0.0814, "tp": 31, "fp": 24, "tn": 26, "fn": 47, "A_precision": 0.5636, "A_recall": 0.3974, "A_f1": 0.4662, "A_f2": 0.4223, "A_accuracy": 0.4453, "A_mcc": -0.0814, "A_tp": 31, "A_fp": 24, "A_tn": 26, "A_fn": 47}, {"fold": "fold_6", "regime": "COVID crash and V-recovery", "n": 173, "A_sharpe": 2.3686, "A_sortino": 2.7897, "A_excess_sharpe": 0.0425, "A_return_pct": 44.84, "A_hit_rate": 52.6, "A_n": 173, "A_bh_sharpe": 2.3261, "A_bh_return_pct": 43.81, "A_psr": 0.9774, "A_ic": 0.1292, "B_sharpe": -0.7065, "B_sortino": -0.7811, "B_excess_sharpe": -6.4525, "B_return_pct": -28.28, "B_hit_rate": 44.77, "B_n": 173, "B_bh_sharpe": 5.746, "B_bh_return_pct": 499.04, "B_psr": 0.2824, "B_ic": 0.095, "D_sharpe": -0.4674, "D_sortino": -0.5303, "D_excess_sharpe": -2.7934, "D_return_pct": -9.34, "D_hit_rate": 41.62, "D_n": 173, "D_bh_sharpe": 2.3261, "D_bh_return_pct": 43.81, "D_psr": 0.3506, "D_ic": 0.0028, "sharpe": 2.3686, "sortino": 2.7897, "return_pct": 44.84, "equity": 1448.3999999999999, "max_dd": 0.0, "win_rate": 52.6, "profit_factor": 0.0, "ic": 0.1292, "hit": 52.6, "psr": 0.9774, "bh_sharpe": 2.3261, "bh_return_pct": 43.81, "excess_sharpe": 0.0425, "precision": 0.6914, "recall": 0.4956, "f1": 0.5773, "f2": 0.5253, "accuracy": 0.526, "mcc": 0.0753, "tp": 56, "fp": 25, "tn": 35, "fn": 57, "A_precision": 0.6914, "A_recall": 0.4956, "A_f1": 0.5773, "A_f2": 0.5253, "A_accuracy": 0.526, "A_mcc": 0.0753, "A_tp": 56, "A_fp": 25, "A_tn": 35, "A_fn": 57}, {"fold": "fold_7", "regime": "Inflation bear, AI rally and 2025", "n": 376, "A_sharpe": 0.3094, "A_sortino": 0.3502, "A_excess_sharpe": -0.4939, "A_return_pct": 6.87, "A_hit_rate": 47.61, "A_n": 376, "A_bh_sharpe": 0.8033, "A_bh_return_pct": 26.02, "A_psr": 0.6487, "A_ic": 0.0163, "B_sharpe": 0.0379, "B_sortino": 0.0434, "B_excess_sharpe": -1.8937, "B_return_pct": -12.52, "B_hit_rate": 44.27, "B_n": 376, "B_bh_sharpe": 1.9317, "B_bh_return_pct": 222.05, "B_psr": 0.5185, "B_ic": -0.0181, "D_sharpe": 0.1286, "D_sortino": 0.161, "D_excess_sharpe": -0.6747, "D_return_pct": 0.6, "D_hit_rate": 42.29, "D_n": 376, "D_bh_sharpe": 0.8033, "D_bh_return_pct": 26.02, "D_psr": 0.5627, "D_ic": -0.0109, "sharpe": 0.3094, "sortino": 0.3502, "return_pct": 6.87, "equity": 1068.7, "max_dd": 0.0, "win_rate": 47.61, "profit_factor": 0.0, "ic": 0.0163, "hit": 47.61, "psr": 0.6487, "bh_sharpe": 0.8033, "bh_return_pct": 26.02, "excess_sharpe": -0.4939, "precision": 0.5923, "recall": 0.3484, "f1": 0.4387, "f2": 0.3797, "accuracy": 0.4761, "mcc": 0.0067, "tp": 77, "fp": 53, "tn": 102, "fn": 144, "A_precision": 0.5923, "A_recall": 0.3484, "A_f1": 0.4387, "A_f2": 0.3797, "A_accuracy": 0.4761, "A_mcc": 0.0067, "A_tp": 77, "A_fp": 53, "A_tn": 102, "A_fn": 144}], "per_window_val": [{"fold": "fold_1", "regime": "GFC peak crash (Lehman + Mar-2009 bottom)", "n": 65, "A_sharpe": 2.4444, "A_sortino": 2.9852, "A_excess_sharpe": 4.67, "A_return_pct": 21.7, "A_hit_rate": 53.97, "A_n": 65, "A_bh_sharpe": -2.2257, "A_bh_return_pct": -18.74, "A_psr": 0.9056, "A_ic": 0.0648, "B_sharpe": -4.8065, "B_sortino": -4.0599, "B_excess_sharpe": 2.3158, "B_return_pct": -61.34, "B_hit_rate": 40.0, "B_n": 65, "B_bh_sharpe": -7.1223, "B_bh_return_pct": -73.11, "B_psr": 0.0051, "B_ic": 0.2993, "D_sharpe": -1.1614, "D_sortino": -0.9741, "D_excess_sharpe": 1.0642, "D_return_pct": -10.97, "D_hit_rate": 50.79, "D_n": 65, "D_bh_sharpe": -2.2257, "D_bh_return_pct": -18.74, "D_psr": 0.2717, "D_ic": 0.3528, "sharpe": 2.4444, "sortino": 2.9852, "return_pct": 21.7, "equity": 1217.0, "max_dd": 0.0, "win_rate": 53.97, "profit_factor": 0.0, "ic": 0.0648, "hit": 53.97, "psr": 0.9056, "bh_sharpe": -2.2257, "bh_return_pct": -18.74, "excess_sharpe": 4.67}, {"fold": "fold_2", "regime": "2011 US-downgrade + EU debt", "n": 47, "A_sharpe": -0.7472, "A_sortino": -0.6982, "A_excess_sharpe": -0.5531, "A_return_pct": -5.79, "A_hit_rate": 48.94, "A_n": 47, "A_bh_sharpe": -0.1941, "A_bh_return_pct": -2.36, "A_psr": 0.3737, "A_ic": 0.0587, "B_sharpe": -0.5977, "B_sortino": -0.5307, "B_excess_sharpe": 1.0146, "B_return_pct": -12.84, "B_hit_rate": 51.06, "B_n": 47, "B_bh_sharpe": -1.6123, "B_bh_return_pct": -24.3, "B_psr": 0.3981, "B_ic": 0.2387, "D_sharpe": -0.8316, "D_sortino": -0.7233, "D_excess_sharpe": -0.6375, "D_return_pct": -6.31, "D_hit_rate": 53.19, "D_n": 47, "D_bh_sharpe": -0.1941, "D_bh_return_pct": -2.36, "D_psr": 0.3595, "D_ic": 0.0947, "sharpe": -0.7472, "sortino": -0.6982, "return_pct": -5.79, "equity": 942.1, "max_dd": 0.0, "win_rate": 48.94, "profit_factor": 0.0, "ic": 0.0587, "hit": 48.94, "psr": 0.3737, "bh_sharpe": -0.1941, "bh_return_pct": -2.36, "excess_sharpe": -0.5531}, {"fold": "fold_3", "regime": "Taper tantrum and 2014 H1", "n": 5, "A_sharpe": 3.7421, "A_sortino": 3.8425, "A_excess_sharpe": 5.0616, "A_return_pct": 0.57, "A_hit_rate": 60.0, "A_n": 5, "A_bh_sharpe": -1.3194, "A_bh_return_pct": -0.21, "A_psr": 0.6797, "A_ic": -0.1, "B_sharpe": 25.8705, "B_sortino": 0.0, "B_excess_sharpe": 51.7411, "B_return_pct": 3.95, "B_hit_rate": 100.0, "B_n": 5, "B_bh_sharpe": -25.8705, "B_bh_return_pct": -3.84, "B_psr": 1.0, "B_ic": 0.1, "D_sharpe": 1.3194, "D_sortino": 1.268, "D_excess_sharpe": 2.6388, "D_return_pct": 0.2, "D_hit_rate": 60.0, "D_n": 5, "D_bh_sharpe": -1.3194, "D_bh_return_pct": -0.21, "D_psr": 0.5663, "D_ic": -0.1, "sharpe": 3.7421, "sortino": 3.8425, "return_pct": 0.57, "equity": 1005.7, "max_dd": 0.0, "win_rate": 60.0, "profit_factor": 0.0, "ic": -0.1, "hit": 60.0, "psr": 0.6797, "bh_sharpe": -1.3194, "bh_return_pct": -0.21, "excess_sharpe": 5.0616}, {"fold": "fold_4", "regime": "China devaluation and oil crash", "n": 47, "A_sharpe": -2.7615, "A_sortino": -2.674, "A_excess_sharpe": -0.9377, "A_return_pct": -12.48, "A_hit_rate": 38.3, "A_n": 47, "A_bh_sharpe": -1.8238, "A_bh_return_pct": -8.68, "A_psr": 0.1214, "A_ic": 0.0289, "B_sharpe": 0.2793, "B_sortino": 0.2268, "B_excess_sharpe": 2.4993, "B_return_pct": -0.29, "B_hit_rate": 55.32, "B_n": 47, "B_bh_sharpe": -2.22, "B_bh_return_pct": -23.98, "B_psr": 0.5469, "B_ic": 0.4781, "D_sharpe": -0.9061, "D_sortino": -0.8212, "D_excess_sharpe": 0.9176, "D_return_pct": -4.71, "D_hit_rate": 51.06, "D_n": 47, "D_bh_sharpe": -1.8238, "D_bh_return_pct": -8.68, "D_psr": 0.3485, "D_ic": 0.0879, "sharpe": -2.7615, "sortino": -2.674, "return_pct": -12.48, "equity": 875.1999999999999, "max_dd": 0.0, "win_rate": 38.3, "profit_factor": 0.0, "ic": 0.0289, "hit": 38.3, "psr": 0.1214, "bh_sharpe": -1.8238, "bh_return_pct": -8.68, "excess_sharpe": -0.9377}, {"fold": "fold_5", "regime": "2018 Vol-mageddon + Q4 sell-off", "n": 5, "A_sharpe": -10.1368, "A_sortino": -6.9937, "A_excess_sharpe": 0.0, "A_return_pct": -3.15, "A_hit_rate": 40.0, "A_n": 5, "A_bh_sharpe": -10.1368, "A_bh_return_pct": -3.15, "A_psr": 0.0985, "A_ic": 0.3, "B_sharpe": 5.6858, "B_sortino": 6.0578, "B_excess_sharpe": 0.0, "B_return_pct": 4.22, "B_hit_rate": 60.0, "B_n": 5, "B_bh_sharpe": 5.6858, "B_bh_return_pct": 4.22, "B_psr": 0.753, "B_ic": 0.7, "D_sharpe": -10.1368, "D_sortino": -6.9937, "D_excess_sharpe": 0.0, "D_return_pct": -3.15, "D_hit_rate": 40.0, "D_n": 5, "D_bh_sharpe": -10.1368, "D_bh_return_pct": -3.15, "D_psr": 0.0985, "D_ic": 0.5, "sharpe": -10.1368, "sortino": -6.9937, "return_pct": -3.15, "equity": 968.5, "max_dd": 0.0, "win_rate": 40.0, "profit_factor": 0.0, "ic": 0.3, "hit": 40.0, "psr": 0.0985, "bh_sharpe": -10.1368, "bh_return_pct": -3.15, "excess_sharpe": 0.0}, {"fold": "fold_6", "regime": "COVID crash and V-recovery", "n": 26, "A_sharpe": 4.9134, "A_sortino": 5.452, "A_excess_sharpe": 1.6282, "A_return_pct": 7.17, "A_hit_rate": 61.54, "A_n": 26, "A_bh_sharpe": 3.2852, "A_bh_return_pct": 4.82, "A_psr": 0.9363, "A_ic": 0.3368, "B_sharpe": 2.5899, "B_sortino": 2.7887, "B_excess_sharpe": -10.3893, "B_return_pct": 8.26, "B_hit_rate": 53.85, "B_n": 26, "B_bh_sharpe": 12.9792, "B_bh_return_pct": 38.76, "B_psr": 0.7917, "B_ic": 0.5966, "D_sharpe": 8.9988, "D_sortino": 14.5022, "D_excess_sharpe": 5.7136, "D_return_pct": 12.32, "D_hit_rate": 65.38, "D_n": 26, "D_bh_sharpe": 3.2852, "D_bh_return_pct": 4.82, "D_psr": 0.9992, "D_ic": 0.455, "sharpe": 4.9134, "sortino": 5.452, "return_pct": 7.17, "equity": 1071.7, "max_dd": 0.0, "win_rate": 61.54, "profit_factor": 0.0, "ic": 0.3368, "hit": 61.54, "psr": 0.9363, "bh_sharpe": 3.2852, "bh_return_pct": 4.82, "excess_sharpe": 1.6282}, {"fold": "fold_7", "regime": "Inflation bear, AI rally and 2025", "n": 65, "A_sharpe": 1.7112, "A_sortino": 1.8465, "A_excess_sharpe": -0.3678, "A_return_pct": 6.64, "A_hit_rate": 55.38, "A_n": 65, "A_bh_sharpe": 2.0789, "A_bh_return_pct": 8.17, "A_psr": 0.8098, "A_ic": 0.2115, "B_sharpe": -4.3471, "B_sortino": -4.1515, "B_excess_sharpe": -9.5785, "B_return_pct": -28.23, "B_hit_rate": 33.85, "B_n": 65, "B_bh_sharpe": 5.2314, "B_bh_return_pct": 44.53, "B_psr": 0.0164, "B_ic": 0.186, "D_sharpe": -1.5891, "D_sortino": -1.4533, "D_excess_sharpe": -3.668, "D_return_pct": -6.35, "D_hit_rate": 47.69, "D_n": 65, "D_bh_sharpe": 2.0789, "D_bh_return_pct": 8.17, "D_psr": 0.2083, "D_ic": 0.1919, "sharpe": 1.7112, "sortino": 1.8465, "return_pct": 6.64, "equity": 1066.4, "max_dd": 0.0, "win_rate": 55.38, "profit_factor": 0.0, "ic": 0.2115, "hit": 55.38, "psr": 0.8098, "bh_sharpe": 2.0789, "bh_return_pct": 8.17, "excess_sharpe": -0.3678}], "status": "DISCARD", "precision": 0.5873, "recall": 0.4525, "f1": 0.5112, "f2": 0.4743, "accuracy": 0.4873, "mcc": -0.0094, "tp": 286, "fp": 201, "tn": 234, "fn": 346, "test_sharpe": 0.6987, "A_sharpe": 0.6987, "A_excess_sharpe": -0.5207, "A_return_pct": 75.08, "A_precision": 0.5873, "A_recall": 0.4525, "A_f1": 0.5112, "A_f2": 0.4743, "A_accuracy": 0.4873, "A_mcc": -0.0094, "A_tp": 286, "A_fp": 201, "A_tn": 234, "A_fn": 346, "A_psr": 0.9274, "A_ic": 0.0377, "A_hit_rate": 48.59, "A_bh_sharpe": 1.2194, "A_bh_return_pct": 187.05}
