{"experiment_num": 28, "backbone": "mlp", "description": "MLP @ FX-Exp32 ep=100 pat=20 (up from 50/10) - longer training stability; Goyal 2017, Fischer-Krauss 2018; tests training-duration as seed-variance lever", "config": {"seq_len": 10, "lr": 0.0003, "batch_size": 32, "epochs": 100, "weight_decay": 1e-05, "patience": 20, "warmup_epochs": 0, "head_dropout": 0.25, "huber_delta": 1.0, "grad_clip": 1.0, "seed": 0, "hidden_size": null, "num_layers": null, "max_depth": null, "gbm_lr": null, "n_estimators": null}, "composite": 0.3219, "test_pos_folds": 5, "val_pos_folds": 4, "val_loss": -2.8919679768772992, "elapsed_sec": 37.5, "timestamp": "2026-04-27T18:19:33", "sharpe": 0.6255, "val_sharpe": 0.5219, "ic": 0.0228, "hit": 54.66, "psr": 0.9295, "equity": 2102.0000000000005, "return_pct": 110.2, "bh_sharpe": 0.6042, "bh_return_pct": 103.49, "excess_sharpe": 0.0213, "B_sharpe": 0.6144, "B_excess_sharpe": -1.0864, "B_return_pct": 184.27, "D_sharpe": 0.6255, "D_excess_sharpe": 0.0213, "D_return_pct": 110.2, "per_window": [{"fold": "fold_1", "regime": "GFC peak crash (Lehman + Mar-2009 bottom)", "n": 115, "A_sharpe": -1.105, "A_sortino": -1.1149, "A_excess_sharpe": -0.6609, "A_return_pct": -26.22, "A_hit_rate": 44.35, "A_n": 115, "A_bh_sharpe": -0.4441, "A_bh_return_pct": -14.4, "A_psr": 0.2281, "A_ic": -0.0881, "B_sharpe": 6.3793, "B_sortino": 7.5419, "B_excess_sharpe": 6.6772, "B_return_pct": 886.69, "B_hit_rate": 64.91, "B_n": 115, "B_bh_sharpe": -0.2978, "B_bh_return_pct": -27.23, "B_psr": 1.0, "B_ic": 0.3195, "D_sharpe": -1.105, "D_sortino": -1.1149, "D_excess_sharpe": -0.6609, "D_return_pct": -26.22, "D_hit_rate": 44.35, "D_n": 115, "D_bh_sharpe": -0.4441, "D_bh_return_pct": -14.4, "D_psr": 0.2281, "D_ic": -0.0881, "sharpe": -1.105, "sortino": -1.1149, "return_pct": -26.22, "equity": 737.8, "max_dd": 0.0, "win_rate": 44.35, "profit_factor": 0.0, "ic": -0.0881, "hit": 44.35, "psr": 0.2281, "bh_sharpe": -0.4441, "bh_return_pct": -14.4, "excess_sharpe": -0.6609, "precision": 0.4138, "recall": 0.4444, "f1": 0.4286, "f2": 0.438, "accuracy": 0.4435, "mcc": -0.1127, "tp": 24, "fp": 34, "tn": 27, "fn": 30, "A_precision": 0.4138, "A_recall": 0.4444, "A_f1": 0.4286, "A_f2": 0.438, "A_accuracy": 0.4435, "A_mcc": -0.1127, "A_tp": 24, "A_fp": 34, "A_tn": 27, "A_fn": 30}, {"fold": "fold_2", "regime": "2011 US-downgrade + EU debt", "n": 136, "A_sharpe": 1.5677, "A_sortino": 1.5192, "A_excess_sharpe": -0.165, "A_return_pct": 17.6, "A_hit_rate": 57.78, "A_n": 136, "A_bh_sharpe": 1.7327, "A_bh_return_pct": 19.75, "A_psr": 0.8733, "A_ic": -0.0297, "B_sharpe": 2.3802, "B_sortino": 2.1368, "B_excess_sharpe": -1.6857, "B_return_pct": 68.55, "B_hit_rate": 65.44, "B_n": 136, "B_bh_sharpe": 4.0659, "B_bh_return_pct": 148.68, "B_psr": 0.9579, "B_ic": 0.0667, "D_sharpe": 1.5677, "D_sortino": 1.5192, "D_excess_sharpe": -0.165, "D_return_pct": 17.6, "D_hit_rate": 57.78, "D_n": 136, "D_bh_sharpe": 1.7327, "D_bh_return_pct": 19.75, "D_psr": 0.8733, "D_ic": -0.0297, "sharpe": 1.5677, "sortino": 1.5192, "return_pct": 17.6, "equity": 1176.0, "max_dd": 0.0, "win_rate": 57.78, "profit_factor": 0.0, "ic": -0.0297, "hit": 57.78, "psr": 0.8733, "bh_sharpe": 1.7327, "bh_return_pct": 19.75, "excess_sharpe": -0.165, "precision": 0.5794, "recall": 0.9359, "f1": 0.7157, "f2": 0.8333, "accuracy": 0.5735, "mcc": 0.0419, "tp": 73, "fp": 53, "tn": 5, "fn": 5, "A_precision": 0.5794, "A_recall": 0.9359, "A_f1": 0.7157, "A_f2": 0.8333, "A_accuracy": 0.5735, "A_mcc": 0.0419, "A_tp": 73, "A_fp": 53, "A_tn": 5, "A_fn": 5}, {"fold": "fold_3", "regime": "Taper tantrum and 2014 H1", "n": 178, "A_sharpe": 2.5281, "A_sortino": 2.3215, "A_excess_sharpe": 1.1836, "A_return_pct": 25.0, "A_hit_rate": 59.89, "A_n": 178, "A_bh_sharpe": 1.3445, "A_bh_return_pct": 12.41, "A_psr": 0.9775, "A_ic": 0.1021, "B_sharpe": -1.2048, "B_sortino": -1.077, "B_excess_sharpe": -4.2531, "B_return_pct": -22.34, "B_hit_rate": 51.12, "B_n": 178, "B_bh_sharpe": 3.0483, "B_bh_return_pct": 71.83, "B_psr": 0.1536, "B_ic": -0.0572, "D_sharpe": 2.5281, "D_sortino": 2.3215, "D_excess_sharpe": 1.1836, "D_return_pct": 25.0, "D_hit_rate": 59.89, "D_n": 178, "D_bh_sharpe": 1.3445, "D_bh_return_pct": 12.41, "D_psr": 0.9775, "D_ic": 0.1021, "sharpe": 2.5281, "sortino": 2.3215, "return_pct": 25.0, "equity": 1250.0, "max_dd": 0.0, "win_rate": 59.89, "profit_factor": 0.0, "ic": 0.1021, "hit": 59.89, "psr": 0.9775, "bh_sharpe": 1.3445, "bh_return_pct": 12.41, "excess_sharpe": 1.1836, "precision": 0.5963, "recall": 0.932, "f1": 0.7273, "f2": 0.8377, "accuracy": 0.5955, "mcc": 0.1098, "tp": 96, "fp": 65, "tn": 10, "fn": 7, "A_precision": 0.5963, "A_recall": 0.932, "A_f1": 0.7273, "A_f2": 0.8377, "A_accuracy": 0.5955, "A_mcc": 0.1098, "A_tp": 96, "A_fp": 65, "A_tn": 10, "A_fn": 7}, {"fold": "fold_4", "regime": "China devaluation and oil crash", "n": 157, "A_sharpe": 1.1115, "A_sortino": 1.1504, "A_excess_sharpe": 1.1017, "A_return_pct": 13.02, "A_hit_rate": 50.64, "A_n": 157, "A_bh_sharpe": 0.0098, "A_bh_return_pct": -1.05, "A_psr": 0.8078, "A_ic": 0.0562, "B_sharpe": -0.9354, "B_sortino": -1.0302, "B_excess_sharpe": -0.9513, "B_return_pct": -27.06, "B_hit_rate": 42.68, "B_n": 157, "B_bh_sharpe": 0.0159, "B_bh_return_pct": -5.48, "B_psr": 0.2343, "B_ic": 0.0232, "D_sharpe": 1.1115, "D_sortino": 1.1504, "D_excess_sharpe": 1.1017, "D_return_pct": 13.02, "D_hit_rate": 50.64, "D_n": 157, "D_bh_sharpe": 0.0098, "D_bh_return_pct": -1.05, "D_psr": 0.8078, "D_ic": 0.0562, "sharpe": 1.1115, "sortino": 1.1504, "return_pct": 13.02, "equity": 1130.1999999999998, "max_dd": 0.0, "win_rate": 50.64, "profit_factor": 0.0, "ic": 0.0562, "hit": 50.64, "psr": 0.8078, "bh_sharpe": 0.0098, "bh_return_pct": -1.05, "excess_sharpe": 1.1017, "precision": 0.5135, "recall": 0.7037, "f1": 0.5938, "f2": 0.6552, "accuracy": 0.5032, "mcc": -0.0075, "tp": 57, "fp": 54, "tn": 22, "fn": 24, "A_precision": 0.5135, "A_recall": 0.7037, "A_f1": 0.5938, "A_f2": 0.6552, "A_accuracy": 0.5032, "A_mcc": -0.0075, "A_tp": 57, "A_fp": 54, "A_tn": 22, "A_fn": 24}, {"fold": "fold_5", "regime": "2018 Vol-mageddon + Q4 sell-off", "n": 177, "A_sharpe": 1.4406, "A_sortino": 1.4776, "A_excess_sharpe": 1.1308, "A_return_pct": 23.8, "A_hit_rate": 55.93, "A_n": 177, "A_bh_sharpe": 0.3098, "A_bh_return_pct": 3.19, "A_psr": 0.8877, "A_ic": 0.0358, "B_sharpe": 0.9713, "B_sortino": 1.0608, "B_excess_sharpe": 0.0796, "B_return_pct": 27.23, "B_hit_rate": 50.57, "B_n": 177, "B_bh_sharpe": 0.8917, "B_bh_return_pct": 23.8, "B_psr": 0.7938, "B_ic": -0.0296, "D_sharpe": 1.4406, "D_sortino": 1.4776, "D_excess_sharpe": 1.1308, "D_return_pct": 23.8, "D_hit_rate": 55.93, "D_n": 177, "D_bh_sharpe": 0.3098, "D_bh_return_pct": 3.19, "D_psr": 0.8877, "D_ic": 0.0358, "sharpe": 1.4406, "sortino": 1.4776, "return_pct": 23.8, "equity": 1238.0, "max_dd": 0.0, "win_rate": 55.93, "profit_factor": 0.0, "ic": 0.0358, "hit": 55.93, "psr": 0.8877, "bh_sharpe": 0.3098, "bh_return_pct": 3.19, "excess_sharpe": 1.1308, "precision": 0.5954, "recall": 0.7573, "f1": 0.6667, "f2": 0.7182, "accuracy": 0.5593, "mcc": 0.0462, "tp": 78, "fp": 53, "tn": 21, "fn": 25, "A_precision": 0.5954, "A_recall": 0.7573, "A_f1": 0.6667, "A_f2": 0.7182, "A_accuracy": 0.5593, "A_mcc": 0.0462, "A_tp": 78, "A_fp": 53, "A_tn": 21, "A_fn": 25}, {"fold": "fold_6", "regime": "COVID crash and V-recovery", "n": 222, "A_sharpe": 1.3803, "A_sortino": 1.2467, "A_excess_sharpe": 0.4915, "A_return_pct": 48.51, "A_hit_rate": 60.81, "A_n": 222, "A_bh_sharpe": 0.8888, "A_bh_return_pct": 26.13, "A_psr": 0.897, "A_ic": 0.115, "B_sharpe": -0.4086, "B_sortino": -0.439, "B_excess_sharpe": -2.7971, "B_return_pct": -37.18, "B_hit_rate": 45.7, "B_n": 222, "B_bh_sharpe": 2.3884, "B_bh_return_pct": 243.18, "B_psr": 0.3517, "B_ic": -0.0095, "D_sharpe": 1.3803, "D_sortino": 1.2467, "D_excess_sharpe": 0.4915, "D_return_pct": 48.51, "D_hit_rate": 60.81, "D_n": 222, "D_bh_sharpe": 0.8888, "D_bh_return_pct": 26.13, "D_psr": 0.897, "D_ic": 0.115, "sharpe": 1.3803, "sortino": 1.2467, "return_pct": 48.51, "equity": 1485.1000000000001, "max_dd": 0.0, "win_rate": 60.81, "profit_factor": 0.0, "ic": 0.115, "hit": 60.81, "psr": 0.897, "bh_sharpe": 0.8888, "bh_return_pct": 26.13, "excess_sharpe": 0.4915, "precision": 0.6425, "recall": 0.8333, "f1": 0.7256, "f2": 0.7866, "accuracy": 0.6081, "mcc": 0.0877, "tp": 115, "fp": 64, "tn": 20, "fn": 23, "A_precision": 0.6425, "A_recall": 0.8333, "A_f1": 0.7256, "A_f2": 0.7866, "A_accuracy": 0.6081, "A_mcc": 0.0877, "A_tp": 115, "A_fp": 64, "A_tn": 20, "A_fn": 23}, {"fold": "fold_7", "regime": "Inflation bear, AI rally and 2025", "n": 425, "A_sharpe": -0.082, "A_sortino": -0.0797, "A_excess_sharpe": -1.0535, "A_return_pct": -6.73, "A_hit_rate": 52.0, "A_n": 425, "A_bh_sharpe": 0.9715, "A_bh_return_pct": 37.12, "A_psr": 0.4577, "A_ic": -0.0508, "B_sharpe": -1.0447, "B_sortino": -1.03, "B_excess_sharpe": -3.5474, "B_return_pct": -62.24, "B_hit_rate": 46.7, "B_n": 425, "B_bh_sharpe": 2.5027, "B_bh_return_pct": 458.83, "B_psr": 0.0886, "B_ic": -0.1122, "D_sharpe": -0.082, "D_sortino": -0.0797, "D_excess_sharpe": -1.0535, "D_return_pct": -6.73, "D_hit_rate": 52.0, "D_n": 425, "D_bh_sharpe": 0.9715, "D_bh_return_pct": 37.12, "D_psr": 0.4577, "D_ic": -0.0508, "sharpe": -0.082, "sortino": -0.0797, "return_pct": -6.73, "equity": 932.6999999999999, "max_dd": 0.0, "win_rate": 52.0, "profit_factor": 0.0, "ic": -0.0508, "hit": 52.0, "psr": 0.4577, "bh_sharpe": 0.9715, "bh_return_pct": 37.12, "excess_sharpe": -1.0535, "precision": 0.5782, "recall": 0.68, "f1": 0.625, "f2": 0.6569, "accuracy": 0.52, "mcc": -0.0305, "tp": 170, "fp": 124, "tn": 51, "fn": 80, "A_precision": 0.5782, "A_recall": 0.68, "A_f1": 0.625, "A_f2": 0.6569, "A_accuracy": 0.52, "A_mcc": -0.0305, "A_tp": 170, "A_fp": 124, "A_tn": 51, "A_fn": 80}], "per_window_val": [{"fold": "fold_1", "regime": "GFC peak crash (Lehman + Mar-2009 bottom)", "n": 104, "A_sharpe": 1.1906, "A_sortino": 1.2564, "A_excess_sharpe": 1.3578, "A_return_pct": 13.58, "A_hit_rate": 53.92, "A_n": 104, "A_bh_sharpe": -0.1672, "A_bh_return_pct": -3.81, "A_psr": 0.7805, "A_ic": 0.0587, "B_sharpe": 3.5639, "B_sortino": 4.2003, "B_excess_sharpe": 5.838, "B_return_pct": 108.59, "B_hit_rate": 57.28, "B_n": 104, "B_bh_sharpe": -2.2741, "B_bh_return_pct": -44.12, "B_psr": 0.9917, "B_ic": 0.1442, "D_sharpe": 1.1906, "D_sortino": 1.2564, "D_excess_sharpe": 1.3578, "D_return_pct": 13.58, "D_hit_rate": 53.92, "D_n": 104, "D_bh_sharpe": -0.1672, "D_bh_return_pct": -3.81, "D_psr": 0.7805, "D_ic": 0.0587, "sharpe": 1.1906, "sortino": 1.2564, "return_pct": 13.58, "equity": 1135.8, "max_dd": 0.0, "win_rate": 53.92, "profit_factor": 0.0, "ic": 0.0587, "hit": 53.92, "psr": 0.7805, "bh_sharpe": -0.1672, "bh_return_pct": -3.81, "excess_sharpe": 1.3578}, {"fold": "fold_2", "regime": "2011 US-downgrade + EU debt", "n": 96, "A_sharpe": -0.2475, "A_sortino": -0.2271, "A_excess_sharpe": 0.0266, "A_return_pct": -3.83, "A_hit_rate": 49.47, "A_n": 96, "A_bh_sharpe": -0.2741, "A_bh_return_pct": -4.09, "A_psr": 0.4393, "A_ic": -0.1479, "B_sharpe": 2.7144, "B_sortino": 3.4203, "B_excess_sharpe": 3.7418, "B_return_pct": 70.43, "B_hit_rate": 52.08, "B_n": 96, "B_bh_sharpe": -1.0274, "B_bh_return_pct": -25.58, "B_psr": 0.9606, "B_ic": 0.0139, "D_sharpe": -0.2475, "D_sortino": -0.2271, "D_excess_sharpe": 0.0266, "D_return_pct": -3.83, "D_hit_rate": 49.47, "D_n": 96, "D_bh_sharpe": -0.2741, "D_bh_return_pct": -4.09, "D_psr": 0.4393, "D_ic": -0.1479, "sharpe": -0.2475, "sortino": -0.2271, "return_pct": -3.83, "equity": 961.7, "max_dd": 0.0, "win_rate": 49.47, "profit_factor": 0.0, "ic": -0.1479, "hit": 49.47, "psr": 0.4393, "bh_sharpe": -0.2741, "bh_return_pct": -4.09, "excess_sharpe": 0.0266}, {"fold": "fold_3", "regime": "Taper tantrum and 2014 H1", "n": 54, "A_sharpe": 3.8599, "A_sortino": 4.0985, "A_excess_sharpe": -0.8398, "A_return_pct": 8.61, "A_hit_rate": 59.26, "A_n": 54, "A_bh_sharpe": 4.6998, "A_bh_return_pct": 10.46, "A_psr": 0.955, "A_ic": -0.0408, "B_sharpe": 5.2542, "B_sortino": 5.8054, "B_excess_sharpe": -3.7784, "B_return_pct": 28.64, "B_hit_rate": 62.96, "B_n": 54, "B_bh_sharpe": 9.0326, "B_bh_return_pct": 49.18, "B_psr": 0.9903, "B_ic": 0.0594, "D_sharpe": 3.8599, "D_sortino": 4.0985, "D_excess_sharpe": -0.8398, "D_return_pct": 8.61, "D_hit_rate": 59.26, "D_n": 54, "D_bh_sharpe": 4.6998, "D_bh_return_pct": 10.46, "D_psr": 0.955, "D_ic": -0.0408, "sharpe": 3.8599, "sortino": 4.0985, "return_pct": 8.61, "equity": 1086.1000000000001, "max_dd": 0.0, "win_rate": 59.26, "profit_factor": 0.0, "ic": -0.0408, "hit": 59.26, "psr": 0.955, "bh_sharpe": 4.6998, "bh_return_pct": 10.46, "excess_sharpe": -0.8398}, {"fold": "fold_4", "regime": "China devaluation and oil crash", "n": 96, "A_sharpe": -0.7535, "A_sortino": -0.7511, "A_excess_sharpe": -0.3294, "A_return_pct": -6.01, "A_hit_rate": 46.32, "A_n": 96, "A_bh_sharpe": -0.4241, "A_bh_return_pct": -3.73, "A_psr": 0.3222, "A_ic": -0.0909, "B_sharpe": 0.3313, "B_sortino": 0.3734, "B_excess_sharpe": 1.5156, "B_return_pct": 1.86, "B_hit_rate": 45.83, "B_n": 96, "B_bh_sharpe": -1.1843, "B_bh_return_pct": -21.44, "B_psr": 0.5808, "B_ic": -0.0255, "D_sharpe": -0.7535, "D_sortino": -0.7511, "D_excess_sharpe": -0.3294, "D_return_pct": -6.01, "D_hit_rate": 46.32, "D_n": 96, "D_bh_sharpe": -0.4241, "D_bh_return_pct": -3.73, "D_psr": 0.3222, "D_ic": -0.0909, "sharpe": -0.7535, "sortino": -0.7511, "return_pct": -6.01, "equity": 939.9, "max_dd": 0.0, "win_rate": 46.32, "profit_factor": 0.0, "ic": -0.0909, "hit": 46.32, "psr": 0.3222, "bh_sharpe": -0.4241, "bh_return_pct": -3.73, "excess_sharpe": -0.3294}, {"fold": "fold_5", "regime": "2018 Vol-mageddon + Q4 sell-off", "n": 54, "A_sharpe": -1.1744, "A_sortino": -1.0972, "A_excess_sharpe": -2.6024, "A_return_pct": -3.49, "A_hit_rate": 46.3, "A_n": 54, "A_bh_sharpe": 1.428, "A_bh_return_pct": 3.97, "A_psr": 0.2928, "A_ic": -0.1103, "B_sharpe": -3.0745, "B_sortino": -2.9869, "B_excess_sharpe": -8.0067, "B_return_pct": -18.82, "B_hit_rate": 38.89, "B_n": 54, "B_bh_sharpe": 4.9322, "B_bh_return_pct": 34.93, "B_psr": 0.0833, "B_ic": -0.4765, "D_sharpe": -1.1744, "D_sortino": -1.0972, "D_excess_sharpe": -2.6024, "D_return_pct": -3.49, "D_hit_rate": 46.3, "D_n": 54, "D_bh_sharpe": 1.428, "D_bh_return_pct": 3.97, "D_psr": 0.2928, "D_ic": -0.1103, "sharpe": -1.1744, "sortino": -1.0972, "return_pct": -3.49, "equity": 965.0999999999999, "max_dd": 0.0, "win_rate": 46.3, "profit_factor": 0.0, "ic": -0.1103, "hit": 46.3, "psr": 0.2928, "bh_sharpe": 1.428, "bh_return_pct": 3.97, "excess_sharpe": -2.6024}, {"fold": "fold_6", "regime": "COVID crash and V-recovery", "n": 75, "A_sharpe": 2.8617, "A_sortino": 2.6402, "A_excess_sharpe": -1.4377, "A_return_pct": 9.67, "A_hit_rate": 62.67, "A_n": 75, "A_bh_sharpe": 4.2994, "A_bh_return_pct": 14.68, "A_psr": 0.9314, "A_ic": -0.1116, "B_sharpe": 4.0648, "B_sortino": 4.0528, "B_excess_sharpe": -10.2692, "B_return_pct": 33.12, "B_hit_rate": 64.0, "B_n": 75, "B_bh_sharpe": 14.3339, "B_bh_return_pct": 120.13, "B_psr": 0.9845, "B_ic": 0.1134, "D_sharpe": 2.8617, "D_sortino": 2.6402, "D_excess_sharpe": -1.4377, "D_return_pct": 9.67, "D_hit_rate": 62.67, "D_n": 75, "D_bh_sharpe": 4.2994, "D_bh_return_pct": 14.68, "D_psr": 0.9314, "D_ic": -0.1116, "sharpe": 2.8617, "sortino": 2.6402, "return_pct": 9.67, "equity": 1096.7, "max_dd": 0.0, "win_rate": 62.67, "profit_factor": 0.0, "ic": -0.1116, "hit": 62.67, "psr": 0.9314, "bh_sharpe": 4.2994, "bh_return_pct": 14.68, "excess_sharpe": -1.4377}, {"fold": "fold_7", "regime": "Inflation bear, AI rally and 2025", "n": 114, "A_sharpe": 0.593, "A_sortino": 0.561, "A_excess_sharpe": -2.2521, "A_return_pct": 3.72, "A_hit_rate": 54.39, "A_n": 114, "A_bh_sharpe": 2.845, "A_bh_return_pct": 21.34, "A_psr": 0.6538, "A_ic": -0.0209, "B_sharpe": 0.7785, "B_sortino": 0.7005, "B_excess_sharpe": -5.3581, "B_return_pct": 10.49, "B_hit_rate": 58.77, "B_n": 114, "B_bh_sharpe": 6.1366, "B_bh_return_pct": 155.03, "B_psr": 0.6976, "B_ic": -0.1023, "D_sharpe": 0.593, "D_sortino": 0.561, "D_excess_sharpe": -2.2521, "D_return_pct": 3.72, "D_hit_rate": 54.39, "D_n": 114, "D_bh_sharpe": 2.845, "D_bh_return_pct": 21.34, "D_psr": 0.6538, "D_ic": -0.0209, "sharpe": 0.593, "sortino": 0.561, "return_pct": 3.72, "equity": 1037.1999999999998, "max_dd": 0.0, "win_rate": 54.39, "profit_factor": 0.0, "ic": -0.0209, "hit": 54.39, "psr": 0.6538, "bh_sharpe": 2.845, "bh_return_pct": 21.34, "excess_sharpe": -2.2521}], "status": "DISCARD", "precision": 0.5783, "recall": 0.7596, "f1": 0.6567, "f2": 0.7148, "accuracy": 0.5454, "mcc": 0.021, "tp": 613, "fp": 447, "tn": 156, "fn": 194, "test_sharpe": 0.6255, "A_sharpe": 0.6255, "A_excess_sharpe": 0.0213, "A_return_pct": 110.2, "A_precision": 0.5783, "A_recall": 0.7596, "A_f1": 0.6567, "A_f2": 0.7148, "A_accuracy": 0.5454, "A_mcc": 0.021, "A_tp": 613, "A_fp": 447, "A_tn": 156, "A_fn": 194, "A_psr": 0.9295, "A_ic": 0.0228, "A_hit_rate": 54.66, "A_bh_sharpe": 0.6042, "A_bh_return_pct": 103.49}
