{"experiment_num": 50, "backbone": "mamba", "description": "dMamba @ exp 48 expand=2 seed=7 - 3rd seed of multi-seed sweep", "config": {"seq_len": 60, "lr": 0.0005, "batch_size": 32, "epochs": 100, "weight_decay": 0.1, "patience": 20, "warmup_epochs": 10, "head_dropout": 0.1, "huber_delta": 1.0, "grad_clip": 1.0, "seed": 7, "hidden_size": null, "num_layers": null, "max_depth": null, "gbm_lr": null, "n_estimators": null}, "composite": 1.0182, "test_pos_folds": 6, "val_pos_folds": 5, "val_loss": -2.8738591860880893, "elapsed_sec": 827.0, "timestamp": "2026-04-27T19:56:39", "sharpe": 1.1182, "val_sharpe": 1.8779, "ic": 0.0552, "hit": 51.47, "psr": 0.9906, "equity": 2596.1, "return_pct": 159.61, "bh_sharpe": 1.2201, "bh_return_pct": 185.59, "excess_sharpe": -0.1019, "B_sharpe": 0.9867, "B_excess_sharpe": -1.8517, "B_return_pct": 338.68, "D_sharpe": 1.1182, "D_excess_sharpe": -0.1019, "D_return_pct": 159.61, "per_window": [{"fold": "fold_1", "regime": "GFC peak crash (Lehman + Mar-2009 bottom)", "n": 65, "A_sharpe": 0.8905, "A_sortino": 0.983, "A_excess_sharpe": 0.4643, "A_return_pct": 7.05, "A_hit_rate": 49.23, "A_n": 65, "A_bh_sharpe": 0.4262, "A_bh_return_pct": 2.34, "A_psr": 0.6742, "A_ic": 0.006, "B_sharpe": 1.6211, "B_sortino": 1.7902, "B_excess_sharpe": -0.2665, "B_return_pct": 27.67, "B_hit_rate": 50.0, "B_n": 65, "B_bh_sharpe": 1.8877, "B_bh_return_pct": 34.48, "B_psr": 0.794, "B_ic": 0.1471, "D_sharpe": 0.8905, "D_sortino": 0.983, "D_excess_sharpe": 0.4643, "D_return_pct": 7.05, "D_hit_rate": 49.23, "D_n": 65, "D_bh_sharpe": 0.4262, "D_bh_return_pct": 2.34, "D_psr": 0.6742, "D_ic": 0.006, "sharpe": 0.8905, "sortino": 0.983, "return_pct": 7.05, "equity": 1070.5, "max_dd": 0.0, "win_rate": 49.23, "profit_factor": 0.0, "ic": 0.006, "hit": 49.23, "psr": 0.6742, "bh_sharpe": 0.4262, "bh_return_pct": 2.34, "excess_sharpe": 0.4643, "precision": 0.5161, "recall": 0.4706, "f1": 0.4923, "f2": 0.479, "accuracy": 0.4923, "mcc": -0.0133, "tp": 16, "fp": 15, "tn": 16, "fn": 18, "A_precision": 0.5161, "A_recall": 0.4706, "A_f1": 0.4923, "A_f2": 0.479, "A_accuracy": 0.4923, "A_mcc": -0.0133, "A_tp": 16, "A_fp": 15, "A_tn": 16, "A_fn": 18}, {"fold": "fold_2", "regime": "2011 US-downgrade + EU debt", "n": 86, "A_sharpe": 3.8459, "A_sortino": 4.6757, "A_excess_sharpe": -1.0223, "A_return_pct": 21.76, "A_hit_rate": 60.0, "A_n": 86, "A_bh_sharpe": 4.8682, "A_bh_return_pct": 27.91, "A_psr": 0.9928, "A_ic": 0.155, "B_sharpe": 4.2902, "B_sortino": 4.4355, "B_excess_sharpe": -7.0289, "B_return_pct": 58.83, "B_hit_rate": 62.79, "B_n": 86, "B_bh_sharpe": 11.3191, "B_bh_return_pct": 186.84, "B_psr": 0.9932, "B_ic": 0.3193, "D_sharpe": 3.8459, "D_sortino": 4.6757, "D_excess_sharpe": -1.0223, "D_return_pct": 21.76, "D_hit_rate": 60.0, "D_n": 86, "D_bh_sharpe": 4.8682, "D_bh_return_pct": 27.91, "D_psr": 0.9928, "D_ic": 0.155, "sharpe": 3.8459, "sortino": 4.6757, "return_pct": 21.76, "equity": 1217.6, "max_dd": 0.0, "win_rate": 60.0, "profit_factor": 0.0, "ic": 0.155, "hit": 60.0, "psr": 0.9928, "bh_sharpe": 4.8682, "bh_return_pct": 27.91, "excess_sharpe": -1.0223, "precision": 0.68, "recall": 0.6415, "f1": 0.6602, "f2": 0.6489, "accuracy": 0.593, "mcc": 0.1544, "tp": 34, "fp": 16, "tn": 17, "fn": 19, "A_precision": 0.68, "A_recall": 0.6415, "A_f1": 0.6602, "A_f2": 0.6489, "A_accuracy": 0.593, "A_mcc": 0.1544, "A_tp": 34, "A_fp": 16, "A_tn": 17, "A_fn": 19}, {"fold": "fold_3", "regime": "Taper tantrum and 2014 H1", "n": 128, "A_sharpe": 1.3844, "A_sortino": 1.3851, "A_excess_sharpe": -0.6745, "A_return_pct": 8.85, "A_hit_rate": 55.12, "A_n": 128, "A_bh_sharpe": 2.0589, "A_bh_return_pct": 13.6, "A_psr": 0.8369, "A_ic": 0.1148, "B_sharpe": -1.2298, "B_sortino": -1.176, "B_excess_sharpe": -5.7414, "B_return_pct": -15.26, "B_hit_rate": 46.88, "B_n": 128, "B_bh_sharpe": 4.5116, "B_bh_return_pct": 67.92, "B_psr": 0.1899, "B_ic": -0.1013, "D_sharpe": 1.3844, "D_sortino": 1.3851, "D_excess_sharpe": -0.6745, "D_return_pct": 8.85, "D_hit_rate": 55.12, "D_n": 128, "D_bh_sharpe": 2.0589, "D_bh_return_pct": 13.6, "D_psr": 0.8369, "D_ic": 0.1148, "sharpe": 1.3844, "sortino": 1.3851, "return_pct": 8.85, "equity": 1088.5, "max_dd": 0.0, "win_rate": 55.12, "profit_factor": 0.0, "ic": 0.1148, "hit": 55.12, "psr": 0.8369, "bh_sharpe": 2.0589, "bh_return_pct": 13.6, "excess_sharpe": -0.6745, "precision": 0.6282, "recall": 0.6282, "f1": 0.6282, "f2": 0.6282, "accuracy": 0.5469, "mcc": 0.0482, "tp": 49, "fp": 29, "tn": 21, "fn": 29, "A_precision": 0.6282, "A_recall": 0.6282, "A_f1": 0.6282, "A_f2": 0.6282, "A_accuracy": 0.5469, "A_mcc": 0.0482, "A_tp": 49, "A_fp": 29, "A_tn": 21, "A_fn": 29}, {"fold": "fold_4", "regime": "China devaluation and oil crash", "n": 107, "A_sharpe": -0.9428, "A_sortino": -0.8678, "A_excess_sharpe": -0.1396, "A_return_pct": -8.69, "A_hit_rate": 52.83, "A_n": 107, "A_bh_sharpe": -0.8032, "A_bh_return_pct": -7.58, "A_psr": 0.2705, "A_ic": 0.0379, "B_sharpe": -0.8394, "B_sortino": -0.9227, "B_excess_sharpe": 1.1202, "B_return_pct": -18.03, "B_hit_rate": 41.12, "B_n": 107, "B_bh_sharpe": -1.9596, "B_bh_return_pct": -33.47, "B_psr": 0.295, "B_ic": -0.0192, "D_sharpe": -0.9428, "D_sortino": -0.8678, "D_excess_sharpe": -0.1396, "D_return_pct": -8.69, "D_hit_rate": 52.83, "D_n": 107, "D_bh_sharpe": -0.8032, "D_bh_return_pct": -7.58, "D_psr": 0.2705, "D_ic": 0.0379, "sharpe": -0.9428, "sortino": -0.8678, "return_pct": -8.69, "equity": 913.1, "max_dd": 0.0, "win_rate": 52.83, "profit_factor": 0.0, "ic": 0.0379, "hit": 52.83, "psr": 0.2705, "bh_sharpe": -0.8032, "bh_return_pct": -7.58, "excess_sharpe": -0.1396, "precision": 0.5072, "recall": 0.6731, "f1": 0.5785, "f2": 0.6318, "accuracy": 0.5234, "mcc": 0.0573, "tp": 35, "fp": 34, "tn": 21, "fn": 17, "A_precision": 0.5072, "A_recall": 0.6731, "A_f1": 0.5785, "A_f2": 0.6318, "A_accuracy": 0.5234, "A_mcc": 0.0573, "A_tp": 35, "A_fp": 34, "A_tn": 21, "A_fn": 17}, {"fold": "fold_5", "regime": "2018 Vol-mageddon + Q4 sell-off", "n": 127, "A_sharpe": 1.6615, "A_sortino": 1.9544, "A_excess_sharpe": 0.4785, "A_return_pct": 20.18, "A_hit_rate": 51.97, "A_n": 127, "A_bh_sharpe": 1.183, "A_bh_return_pct": 13.55, "A_psr": 0.8882, "A_ic": 0.104, "B_sharpe": 4.0718, "B_sortino": 4.9397, "B_excess_sharpe": 1.1662, "B_return_pct": 139.94, "B_hit_rate": 59.52, "B_n": 127, "B_bh_sharpe": 2.9056, "B_bh_return_pct": 85.51, "B_psr": 0.9989, "B_ic": 0.2777, "D_sharpe": 1.6615, "D_sortino": 1.9544, "D_excess_sharpe": 0.4785, "D_return_pct": 20.18, "D_hit_rate": 51.97, "D_n": 127, "D_bh_sharpe": 1.183, "D_bh_return_pct": 13.55, "D_psr": 0.8882, "D_ic": 0.104, "sharpe": 1.6615, "sortino": 1.9544, "return_pct": 20.18, "equity": 1201.8, "max_dd": 0.0, "win_rate": 51.97, "profit_factor": 0.0, "ic": 0.104, "hit": 51.97, "psr": 0.8882, "bh_sharpe": 1.183, "bh_return_pct": 13.55, "excess_sharpe": 0.4785, "precision": 0.6076, "recall": 0.6154, "f1": 0.6115, "f2": 0.6138, "accuracy": 0.5197, "mcc": -0.0173, "tp": 48, "fp": 31, "tn": 18, "fn": 30, "A_precision": 0.6076, "A_recall": 0.6154, "A_f1": 0.6115, "A_f2": 0.6138, "A_accuracy": 0.5197, "A_mcc": -0.0173, "A_tp": 48, "A_fp": 31, "A_tn": 18, "A_fn": 30}, {"fold": "fold_6", "regime": "COVID crash and V-recovery", "n": 172, "A_sharpe": 2.293, "A_sortino": 2.9009, "A_excess_sharpe": -0.1346, "A_return_pct": 42.81, "A_hit_rate": 50.0, "A_n": 172, "A_bh_sharpe": 2.4276, "A_bh_return_pct": 45.89, "A_psr": 0.9763, "A_ic": 0.0626, "B_sharpe": 1.3121, "B_sortino": 1.6298, "B_excess_sharpe": -4.3999, "B_return_pct": 44.25, "B_hit_rate": 46.78, "B_n": 172, "B_bh_sharpe": 5.712, "B_bh_return_pct": 489.18, "B_psr": 0.8664, "B_ic": 0.0233, "D_sharpe": 2.293, "D_sortino": 2.9009, "D_excess_sharpe": -0.1346, "D_return_pct": 42.81, "D_hit_rate": 50.0, "D_n": 172, "D_bh_sharpe": 2.4276, "D_bh_return_pct": 45.89, "D_psr": 0.9763, "D_ic": 0.0626, "sharpe": 2.293, "sortino": 2.9009, "return_pct": 42.81, "equity": 1428.1000000000001, "max_dd": 0.0, "win_rate": 50.0, "profit_factor": 0.0, "ic": 0.0626, "hit": 50.0, "psr": 0.9763, "bh_sharpe": 2.4276, "bh_return_pct": 45.89, "excess_sharpe": -0.1346, "precision": 0.6421, "recall": 0.5398, "f1": 0.5865, "f2": 0.5576, "accuracy": 0.5, "mcc": -0.0348, "tp": 61, "fp": 34, "tn": 25, "fn": 52, "A_precision": 0.6421, "A_recall": 0.5398, "A_f1": 0.5865, "A_f2": 0.5576, "A_accuracy": 0.5, "A_mcc": -0.0348, "A_tp": 61, "A_fp": 34, "A_tn": 25, "A_fn": 52}, {"fold": "fold_7", "regime": "Inflation bear, AI rally and 2025", "n": 375, "A_sharpe": 0.5748, "A_sortino": 0.6558, "A_excess_sharpe": -0.2157, "A_return_pct": 16.76, "A_hit_rate": 48.8, "A_n": 375, "A_bh_sharpe": 0.7905, "A_bh_return_pct": 25.44, "A_psr": 0.763, "A_ic": 0.058, "B_sharpe": 0.0791, "B_sortino": 0.0848, "B_excess_sharpe": -1.8547, "B_return_pct": -10.01, "B_hit_rate": 48.4, "B_n": 375, "B_bh_sharpe": 1.9338, "B_bh_return_pct": 221.94, "B_psr": 0.5384, "B_ic": 0.0104, "D_sharpe": 0.5748, "D_sortino": 0.6558, "D_excess_sharpe": -0.2157, "D_return_pct": 16.76, "D_hit_rate": 48.8, "D_n": 375, "D_bh_sharpe": 0.7905, "D_bh_return_pct": 25.44, "D_psr": 0.763, "D_ic": 0.058, "sharpe": 0.5748, "sortino": 0.6558, "return_pct": 16.76, "equity": 1167.6, "max_dd": 0.0, "win_rate": 48.8, "profit_factor": 0.0, "ic": 0.058, "hit": 48.8, "psr": 0.763, "bh_sharpe": 0.7905, "bh_return_pct": 25.44, "excess_sharpe": -0.2157, "precision": 0.5897, "recall": 0.4182, "f1": 0.4894, "f2": 0.444, "accuracy": 0.488, "mcc": 0.0053, "tp": 92, "fp": 64, "tn": 91, "fn": 128, "A_precision": 0.5897, "A_recall": 0.4182, "A_f1": 0.4894, "A_f2": 0.444, "A_accuracy": 0.488, "A_mcc": 0.0053, "A_tp": 92, "A_fp": 64, "A_tn": 91, "A_fn": 128}], "per_window_val": [{"fold": "fold_1", "regime": "GFC peak crash (Lehman + Mar-2009 bottom)", "n": 37, "A_sharpe": 3.1312, "A_sortino": 3.1398, "A_excess_sharpe": 2.3727, "A_return_pct": 11.69, "A_hit_rate": 62.86, "A_n": 37, "A_bh_sharpe": 0.7585, "A_bh_return_pct": 2.39, "A_psr": 0.8857, "A_ic": 0.1134, "B_sharpe": 2.3177, "B_sortino": 3.4374, "B_excess_sharpe": 0.173, "B_return_pct": 13.27, "B_hit_rate": 43.24, "B_n": 37, "B_bh_sharpe": 2.1447, "B_bh_return_pct": 12.13, "B_psr": 0.8254, "B_ic": 0.1532, "D_sharpe": 3.1312, "D_sortino": 3.1398, "D_excess_sharpe": 2.3727, "D_return_pct": 11.69, "D_hit_rate": 62.86, "D_n": 37, "D_bh_sharpe": 0.7585, "D_bh_return_pct": 2.39, "D_psr": 0.8857, "D_ic": 0.1134, "sharpe": 3.1312, "sortino": 3.1398, "return_pct": 11.69, "equity": 1116.9, "max_dd": 0.0, "win_rate": 62.86, "profit_factor": 0.0, "ic": 0.1134, "hit": 62.86, "psr": 0.8857, "bh_sharpe": 0.7585, "bh_return_pct": 2.39, "excess_sharpe": 2.3727}, {"fold": "fold_2", "regime": "2011 US-downgrade + EU debt", "n": 46, "A_sharpe": 3.7792, "A_sortino": 3.9147, "A_excess_sharpe": 3.833, "A_return_pct": 25.1, "A_hit_rate": 60.87, "A_n": 46, "A_bh_sharpe": -0.0539, "A_bh_return_pct": -1.46, "A_psr": 0.9384, "A_ic": 0.477, "B_sharpe": 2.6004, "B_sortino": 2.9075, "B_excess_sharpe": 4.1417, "B_return_pct": 35.43, "B_hit_rate": 54.35, "B_n": 46, "B_bh_sharpe": -1.5413, "B_bh_return_pct": -23.36, "B_psr": 0.8661, "B_ic": 0.3247, "D_sharpe": 3.7792, "D_sortino": 3.9147, "D_excess_sharpe": 3.833, "D_return_pct": 25.1, "D_hit_rate": 60.87, "D_n": 46, "D_bh_sharpe": -0.0539, "D_bh_return_pct": -1.46, "D_psr": 0.9384, "D_ic": 0.477, "sharpe": 3.7792, "sortino": 3.9147, "return_pct": 25.1, "equity": 1251.0, "max_dd": 0.0, "win_rate": 60.87, "profit_factor": 0.0, "ic": 0.477, "hit": 60.87, "psr": 0.9384, "bh_sharpe": -0.0539, "bh_return_pct": -1.46, "excess_sharpe": 3.833}, {"fold": "fold_3", "regime": "Taper tantrum and 2014 H1", "n": 4, "A_sharpe": 29.2231, "A_sortino": 0.0, "A_excess_sharpe": 22.9005, "A_return_pct": 1.39, "A_hit_rate": 100.0, "A_n": 4, "A_bh_sharpe": 6.3226, "A_bh_return_pct": 0.58, "A_psr": 1.0, "A_ic": 0.8, "B_sharpe": 16.4672, "B_sortino": 52.8824, "B_excess_sharpe": 39.9085, "B_return_pct": 0.0, "B_hit_rate": 0.0, "B_n": 4, "B_bh_sharpe": -23.4413, "B_bh_return_pct": -3.13, "B_psr": 0.9933, "B_ic": 0.8, "D_sharpe": 29.2231, "D_sortino": 0.0, "D_excess_sharpe": 22.9005, "D_return_pct": 1.39, "D_hit_rate": 100.0, "D_n": 4, "D_bh_sharpe": 6.3226, "D_bh_return_pct": 0.58, "D_psr": 1.0, "D_ic": 0.8, "sharpe": 29.2231, "sortino": 0.0, "return_pct": 1.39, "equity": 1013.9, "max_dd": 0.0, "win_rate": 100.0, "profit_factor": 0.0, "ic": 0.8, "hit": 100.0, "psr": 1.0, "bh_sharpe": 6.3226, "bh_return_pct": 0.58, "excess_sharpe": 22.9005}, {"fold": "fold_4", "regime": "China devaluation and oil crash", "n": 46, "A_sharpe": 0.4855, "A_sortino": 0.4376, "A_excess_sharpe": 1.6877, "A_return_pct": 1.62, "A_hit_rate": 56.52, "A_n": 46, "A_bh_sharpe": -1.2022, "A_bh_return_pct": -5.68, "A_psr": 0.5809, "A_ic": 0.0963, "B_sharpe": 3.2447, "B_sortino": 2.7529, "B_excess_sharpe": 5.5564, "B_return_pct": 36.61, "B_hit_rate": 67.39, "B_n": 46, "B_bh_sharpe": -2.3118, "B_bh_return_pct": -24.51, "B_psr": 0.8995, "B_ic": 0.5605, "D_sharpe": 0.4855, "D_sortino": 0.4376, "D_excess_sharpe": 1.6877, "D_return_pct": 1.62, "D_hit_rate": 56.52, "D_n": 46, "D_bh_sharpe": -1.2022, "D_bh_return_pct": -5.68, "D_psr": 0.5809, "D_ic": 0.0963, "sharpe": 0.4855, "sortino": 0.4376, "return_pct": 1.62, "equity": 1016.2, "max_dd": 0.0, "win_rate": 56.52, "profit_factor": 0.0, "ic": 0.0963, "hit": 56.52, "psr": 0.5809, "bh_sharpe": -1.2022, "bh_return_pct": -5.68, "excess_sharpe": 1.6877}, {"fold": "fold_5", "regime": "2018 Vol-mageddon + Q4 sell-off", "n": 4, "A_sharpe": 67.5526, "A_sortino": 0.0, "A_excess_sharpe": 82.3077, "A_return_pct": 5.17, "A_hit_rate": 100.0, "A_n": 4, "A_bh_sharpe": -14.7551, "A_bh_return_pct": -3.52, "A_psr": 1.0, "A_ic": 0.2, "B_sharpe": -1.4281, "B_sortino": -1.411, "B_excess_sharpe": -3.5847, "B_return_pct": -0.98, "B_hit_rate": 50.0, "B_n": 4, "B_bh_sharpe": 2.1566, "B_bh_return_pct": 1.19, "B_psr": 0.4386, "B_ic": 0.2, "D_sharpe": 67.5526, "D_sortino": 0.0, "D_excess_sharpe": 82.3077, "D_return_pct": 5.17, "D_hit_rate": 100.0, "D_n": 4, "D_bh_sharpe": -14.7551, "D_bh_return_pct": -3.52, "D_psr": 1.0, "D_ic": 0.2, "sharpe": 67.5526, "sortino": 0.0, "return_pct": 5.17, "equity": 1051.7, "max_dd": 0.0, "win_rate": 100.0, "profit_factor": 0.0, "ic": 0.2, "hit": 100.0, "psr": 1.0, "bh_sharpe": -14.7551, "bh_return_pct": -3.52, "excess_sharpe": 82.3077}, {"fold": "fold_6", "regime": "COVID crash and V-recovery", "n": 25, "A_sharpe": -1.9043, "A_sortino": -1.8044, "A_excess_sharpe": -4.3181, "A_return_pct": -2.69, "A_hit_rate": 44.0, "A_n": 25, "A_bh_sharpe": 2.4138, "A_bh_return_pct": 3.27, "A_psr": 0.2766, "A_ic": 0.0815, "B_sharpe": -3.5122, "B_sortino": -3.7214, "B_excess_sharpe": -16.0777, "B_return_pct": -9.91, "B_hit_rate": 32.0, "B_n": 25, "B_bh_sharpe": 12.5655, "B_bh_return_pct": 32.76, "B_psr": 0.1505, "B_ic": 0.0923, "D_sharpe": -1.9043, "D_sortino": -1.8044, "D_excess_sharpe": -4.3181, "D_return_pct": -2.69, "D_hit_rate": 44.0, "D_n": 25, "D_bh_sharpe": 2.4138, "D_bh_return_pct": 3.27, "D_psr": 0.2766, "D_ic": 0.0815, "sharpe": -1.9043, "sortino": -1.8044, "return_pct": -2.69, "equity": 973.0999999999999, "max_dd": 0.0, "win_rate": 44.0, "profit_factor": 0.0, "ic": 0.0815, "hit": 44.0, "psr": 0.2766, "bh_sharpe": 2.4138, "bh_return_pct": 3.27, "excess_sharpe": -4.3181}, {"fold": "fold_7", "regime": "Inflation bear, AI rally and 2025", "n": 64, "A_sharpe": -0.2384, "A_sortino": -0.2582, "A_excess_sharpe": -2.2793, "A_return_pct": -1.23, "A_hit_rate": 46.88, "A_n": 64, "A_bh_sharpe": 2.0409, "A_bh_return_pct": 7.94, "A_psr": 0.4527, "A_ic": -0.0429, "B_sharpe": 0.4362, "B_sortino": 0.4342, "B_excess_sharpe": -4.973, "B_return_pct": 2.2, "B_hit_rate": 54.69, "B_n": 64, "B_bh_sharpe": 5.4092, "B_bh_return_pct": 45.7, "B_psr": 0.5865, "B_ic": 0.098, "D_sharpe": -0.2384, "D_sortino": -0.2582, "D_excess_sharpe": -2.2793, "D_return_pct": -1.23, "D_hit_rate": 46.88, "D_n": 64, "D_bh_sharpe": 2.0409, "D_bh_return_pct": 7.94, "D_psr": 0.4527, "D_ic": -0.0429, "sharpe": -0.2384, "sortino": -0.2582, "return_pct": -1.23, "equity": 987.7, "max_dd": 0.0, "win_rate": 46.88, "profit_factor": 0.0, "ic": -0.0429, "hit": 46.88, "psr": 0.4527, "bh_sharpe": 2.0409, "bh_return_pct": 7.94, "excess_sharpe": -2.2793}], "status": "DISCARD", "precision": 0.6004, "recall": 0.5334, "f1": 0.5649, "f2": 0.5456, "accuracy": 0.5132, "mcc": 0.017, "tp": 335, "fp": 223, "tn": 209, "fn": 293, "test_sharpe": 1.1182, "A_sharpe": 1.1182, "A_excess_sharpe": -0.1019, "A_return_pct": 159.61, "A_precision": 0.6004, "A_recall": 0.5334, "A_f1": 0.5649, "A_f2": 0.5456, "A_accuracy": 0.5132, "A_mcc": 0.017, "A_tp": 335, "A_fp": 223, "A_tn": 209, "A_fn": 293, "A_psr": 0.9906, "A_ic": 0.0552, "A_hit_rate": 51.47, "A_bh_sharpe": 1.2201, "A_bh_return_pct": 185.59}
