{"experiment_num": 23, "backbone": "lstm", "description": "LSTM @ FX-Exp35 HPs seed=7 \u2014 4th LSTM seed (after 42=+0.83, 0=+0.44, 99=+0.47). LSTM has lowest seed std on QQQ; this run consolidates the multi-seed ensemble component.", "config": {"seq_len": 10, "lr": 0.001, "batch_size": 16, "epochs": 100, "weight_decay": 0.0007, "patience": 15, "warmup_epochs": 0, "head_dropout": 0.1, "huber_delta": 1.0, "grad_clip": 1.0, "seed": 7, "hidden_size": null, "num_layers": null, "max_depth": null, "gbm_lr": null, "n_estimators": null}, "composite": -1.1119, "test_pos_folds": 1, "val_pos_folds": 3, "val_loss": -2.899660987355456, "elapsed_sec": 53.3, "timestamp": "2026-04-26T23:05:49", "sharpe": -0.5057, "val_sharpe": -0.5119, "ic": 0.0032, "hit": 44.56, "psr": 0.117, "equity": 377.49999999999994, "return_pct": -62.25, "bh_sharpe": 0.6042, "bh_return_pct": 103.49, "excess_sharpe": -1.1099, "B_sharpe": 0.5591, "B_excess_sharpe": -1.1417, "B_return_pct": 140.27, "D_sharpe": -0.5057, "D_excess_sharpe": -1.1099, "D_return_pct": -62.25, "per_window": [{"fold": "fold_1", "regime": "GFC peak crash (Lehman + Mar-2009 bottom)", "n": 115, "A_sharpe": 0.4441, "A_sortino": 0.4319, "A_excess_sharpe": 0.8882, "A_return_pct": 4.53, "A_hit_rate": 53.04, "A_n": 115, "A_bh_sharpe": -0.4441, "A_bh_return_pct": -14.4, "A_psr": 0.6172, "A_ic": 0.1162, "B_sharpe": 2.1814, "B_sortino": 2.6382, "B_excess_sharpe": 2.4792, "B_return_pct": 104.36, "B_hit_rate": 47.37, "B_n": 115, "B_bh_sharpe": -0.2978, "B_bh_return_pct": -27.23, "B_psr": 0.9307, "B_ic": 0.2347, "D_sharpe": 0.4441, "D_sortino": 0.4319, "D_excess_sharpe": 0.8882, "D_return_pct": 4.53, "D_hit_rate": 53.04, "D_n": 115, "D_bh_sharpe": -0.4441, "D_bh_return_pct": -14.4, "D_psr": 0.6172, "D_ic": 0.1162, "sharpe": 0.4441, "sortino": 0.4319, "return_pct": 4.53, "equity": 1045.3, "max_dd": 0.0, "win_rate": 53.04, "profit_factor": 0.0, "ic": 0.1162, "hit": 53.04, "psr": 0.6172, "bh_sharpe": -0.4441, "bh_return_pct": -14.4, "excess_sharpe": 0.8882, "precision": 0.0, "recall": 0.0, "f1": 0.0, "f2": 0.0, "accuracy": 0.5304, "mcc": 0.0, "tp": 0, "fp": 0, "tn": 61, "fn": 54, "A_precision": 0.0, "A_recall": 0.0, "A_f1": 0.0, "A_f2": 0.0, "A_accuracy": 0.5304, "A_mcc": 0.0, "A_tp": 0, "A_fp": 0, "A_tn": 61, "A_fn": 54}, {"fold": "fold_2", "regime": "2011 US-downgrade + EU debt", "n": 136, "A_sharpe": -1.7327, "A_sortino": -1.747, "A_excess_sharpe": -3.4655, "A_return_pct": -18.39, "A_hit_rate": 42.22, "A_n": 136, "A_bh_sharpe": 1.7327, "A_bh_return_pct": 19.75, "A_psr": 0.1041, "A_ic": 0.0158, "B_sharpe": 2.1824, "B_sortino": 2.0143, "B_excess_sharpe": -1.8835, "B_return_pct": 60.8, "B_hit_rate": 63.24, "B_n": 136, "B_bh_sharpe": 4.0659, "B_bh_return_pct": 148.68, "B_psr": 0.9445, "B_ic": 0.0048, "D_sharpe": -1.7327, "D_sortino": -1.747, "D_excess_sharpe": -3.4655, "D_return_pct": -18.39, "D_hit_rate": 42.22, "D_n": 136, "D_bh_sharpe": 1.7327, "D_bh_return_pct": 19.75, "D_psr": 0.1041, "D_ic": 0.0158, "sharpe": -1.7327, "sortino": -1.747, "return_pct": -18.39, "equity": 816.1, "max_dd": 0.0, "win_rate": 42.22, "profit_factor": 0.0, "ic": 0.0158, "hit": 42.22, "psr": 0.1041, "bh_sharpe": 1.7327, "bh_return_pct": 19.75, "excess_sharpe": -3.4655, "precision": 0.0, "recall": 0.0, "f1": 0.0, "f2": 0.0, "accuracy": 0.4265, "mcc": 0.0, "tp": 0, "fp": 0, "tn": 58, "fn": 78, "A_precision": 0.0, "A_recall": 0.0, "A_f1": 0.0, "A_f2": 0.0, "A_accuracy": 0.4265, "A_mcc": 0.0, "A_tp": 0, "A_fp": 0, "A_tn": 58, "A_fn": 78}, {"fold": "fold_3", "regime": "Taper tantrum and 2014 H1", "n": 178, "A_sharpe": -1.6111, "A_sortino": -1.7556, "A_excess_sharpe": -2.9557, "A_return_pct": -14.19, "A_hit_rate": 41.24, "A_n": 178, "A_bh_sharpe": 1.3445, "A_bh_return_pct": 12.41, "A_psr": 0.0967, "A_ic": -0.0829, "B_sharpe": -2.0514, "B_sortino": -1.753, "B_excess_sharpe": -5.0998, "B_return_pct": -33.68, "B_hit_rate": 50.0, "B_n": 178, "B_bh_sharpe": 3.0483, "B_bh_return_pct": 71.83, "B_psr": 0.0381, "B_ic": -0.0786, "D_sharpe": -1.6111, "D_sortino": -1.7556, "D_excess_sharpe": -2.9557, "D_return_pct": -14.19, "D_hit_rate": 41.24, "D_n": 178, "D_bh_sharpe": 1.3445, "D_bh_return_pct": 12.41, "D_psr": 0.0967, "D_ic": -0.0829, "sharpe": -1.6111, "sortino": -1.7556, "return_pct": -14.19, "equity": 858.1, "max_dd": 0.0, "win_rate": 41.24, "profit_factor": 0.0, "ic": -0.0829, "hit": 41.24, "psr": 0.0967, "bh_sharpe": 1.3445, "bh_return_pct": 12.41, "excess_sharpe": -2.9557, "precision": 0.4, "recall": 0.0194, "f1": 0.037, "f2": 0.024, "accuracy": 0.4157, "mcc": -0.0615, "tp": 2, "fp": 3, "tn": 72, "fn": 101, "A_precision": 0.4, "A_recall": 0.0194, "A_f1": 0.037, "A_f2": 0.024, "A_accuracy": 0.4157, "A_mcc": -0.0615, "A_tp": 2, "A_fp": 3, "A_tn": 72, "A_fn": 101}, {"fold": "fold_4", "regime": "China devaluation and oil crash", "n": 157, "A_sharpe": -0.1868, "A_sortino": -0.1922, "A_excess_sharpe": -0.1966, "A_return_pct": -3.37, "A_hit_rate": 48.72, "A_n": 157, "A_bh_sharpe": 0.0098, "A_bh_return_pct": -1.05, "A_psr": 0.4417, "A_ic": 0.0447, "B_sharpe": 2.6647, "B_sortino": 2.9854, "B_excess_sharpe": 2.6487, "B_return_pct": 93.46, "B_hit_rate": 54.78, "B_n": 157, "B_bh_sharpe": 0.0159, "B_bh_return_pct": -5.48, "B_psr": 0.9828, "B_ic": 0.1844, "D_sharpe": -0.1868, "D_sortino": -0.1922, "D_excess_sharpe": -0.1966, "D_return_pct": -3.37, "D_hit_rate": 48.72, "D_n": 157, "D_bh_sharpe": 0.0098, "D_bh_return_pct": -1.05, "D_psr": 0.4417, "D_ic": 0.0447, "sharpe": -0.1868, "sortino": -0.1922, "return_pct": -3.37, "equity": 966.3000000000001, "max_dd": 0.0, "win_rate": 48.72, "profit_factor": 0.0, "ic": 0.0447, "hit": 48.72, "psr": 0.4417, "bh_sharpe": 0.0098, "bh_return_pct": -1.05, "excess_sharpe": -0.1966, "precision": 0.6667, "recall": 0.0247, "f1": 0.0476, "f2": 0.0306, "accuracy": 0.4904, "mcc": 0.0421, "tp": 2, "fp": 1, "tn": 75, "fn": 79, "A_precision": 0.6667, "A_recall": 0.0247, "A_f1": 0.0476, "A_f2": 0.0306, "A_accuracy": 0.4904, "A_mcc": 0.0421, "A_tp": 2, "A_fp": 1, "A_tn": 75, "A_fn": 79}, {"fold": "fold_5", "regime": "2018 Vol-mageddon + Q4 sell-off", "n": 177, "A_sharpe": -0.3075, "A_sortino": -0.3415, "A_excess_sharpe": -0.6173, "A_return_pct": -6.61, "A_hit_rate": 41.81, "A_n": 177, "A_bh_sharpe": 0.3098, "A_bh_return_pct": 3.19, "A_psr": 0.3987, "A_ic": -0.0145, "B_sharpe": 1.6347, "B_sortino": 1.6718, "B_excess_sharpe": 0.743, "B_return_pct": 57.52, "B_hit_rate": 56.25, "B_n": 177, "B_bh_sharpe": 0.8917, "B_bh_return_pct": 23.8, "B_psr": 0.9144, "B_ic": 0.0383, "D_sharpe": -0.3075, "D_sortino": -0.3415, "D_excess_sharpe": -0.6173, "D_return_pct": -6.61, "D_hit_rate": 41.81, "D_n": 177, "D_bh_sharpe": 0.3098, "D_bh_return_pct": 3.19, "D_psr": 0.3987, "D_ic": -0.0145, "sharpe": -0.3075, "sortino": -0.3415, "return_pct": -6.61, "equity": 933.9, "max_dd": 0.0, "win_rate": 41.81, "profit_factor": 0.0, "ic": -0.0145, "hit": 41.81, "psr": 0.3987, "bh_sharpe": 0.3098, "bh_return_pct": 3.19, "excess_sharpe": -0.6173, "precision": 0.5, "recall": 0.0097, "f1": 0.019, "f2": 0.0121, "accuracy": 0.4181, "mcc": -0.0178, "tp": 1, "fp": 1, "tn": 73, "fn": 102, "A_precision": 0.5, "A_recall": 0.0097, "A_f1": 0.019, "A_f2": 0.0121, "A_accuracy": 0.4181, "A_mcc": -0.0178, "A_tp": 1, "A_fp": 1, "A_tn": 73, "A_fn": 102}, {"fold": "fold_6", "regime": "COVID crash and V-recovery", "n": 222, "A_sharpe": -1.0827, "A_sortino": -1.2473, "A_excess_sharpe": -1.9715, "A_return_pct": -34.51, "A_hit_rate": 37.39, "A_n": 222, "A_bh_sharpe": 0.8888, "A_bh_return_pct": 26.13, "A_psr": 0.1623, "A_ic": -0.077, "B_sharpe": 0.803, "B_sortino": 0.8666, "B_excess_sharpe": -1.5855, "B_return_pct": 32.35, "B_hit_rate": 49.32, "B_n": 222, "B_bh_sharpe": 2.3884, "B_bh_return_pct": 243.18, "B_psr": 0.7754, "B_ic": -0.0495, "D_sharpe": -1.0827, "D_sortino": -1.2473, "D_excess_sharpe": -1.9715, "D_return_pct": -34.51, "D_hit_rate": 37.39, "D_n": 222, "D_bh_sharpe": 0.8888, "D_bh_return_pct": 26.13, "D_psr": 0.1623, "D_ic": -0.077, "sharpe": -1.0827, "sortino": -1.2473, "return_pct": -34.51, "equity": 654.9000000000001, "max_dd": 0.0, "win_rate": 37.39, "profit_factor": 0.0, "ic": -0.077, "hit": 37.39, "psr": 0.1623, "bh_sharpe": 0.8888, "bh_return_pct": 26.13, "excess_sharpe": -1.9715, "precision": 0.4, "recall": 0.0145, "f1": 0.028, "f2": 0.018, "accuracy": 0.3739, "mcc": -0.0694, "tp": 2, "fp": 3, "tn": 81, "fn": 136, "A_precision": 0.4, "A_recall": 0.0145, "A_f1": 0.028, "A_f2": 0.018, "A_accuracy": 0.3739, "A_mcc": -0.0694, "A_tp": 2, "A_fp": 3, "A_tn": 81, "A_fn": 136}, {"fold": "fold_7", "regime": "Inflation bear, AI rally and 2025", "n": 425, "A_sharpe": -0.2628, "A_sortino": -0.2684, "A_excess_sharpe": -1.2343, "A_return_pct": -12.75, "A_hit_rate": 47.76, "A_n": 425, "A_bh_sharpe": 0.9715, "A_bh_return_pct": 37.12, "A_psr": 0.366, "A_ic": 0.0069, "B_sharpe": -1.4696, "B_sortino": -1.4053, "B_excess_sharpe": -3.9723, "B_return_pct": -72.67, "B_hit_rate": 47.17, "B_n": 425, "B_bh_sharpe": 2.5027, "B_bh_return_pct": 458.83, "B_psr": 0.029, "B_ic": -0.1837, "D_sharpe": -0.2628, "D_sortino": -0.2684, "D_excess_sharpe": -1.2343, "D_return_pct": -12.75, "D_hit_rate": 47.76, "D_n": 425, "D_bh_sharpe": 0.9715, "D_bh_return_pct": 37.12, "D_psr": 0.366, "D_ic": 0.0069, "sharpe": -0.2628, "sortino": -0.2684, "return_pct": -12.75, "equity": 872.5, "max_dd": 0.0, "win_rate": 47.76, "profit_factor": 0.0, "ic": 0.0069, "hit": 47.76, "psr": 0.366, "bh_sharpe": 0.9715, "bh_return_pct": 37.12, "excess_sharpe": -1.2343, "precision": 0.675, "recall": 0.216, "f1": 0.3273, "f2": 0.25, "accuracy": 0.4776, "mcc": 0.0849, "tp": 54, "fp": 26, "tn": 149, "fn": 196, "A_precision": 0.675, "A_recall": 0.216, "A_f1": 0.3273, "A_f2": 0.25, "A_accuracy": 0.4776, "A_mcc": 0.0849, "A_tp": 54, "A_fp": 26, "A_tn": 149, "A_fn": 196}], "per_window_val": [{"fold": "fold_1", "regime": "GFC peak crash (Lehman + Mar-2009 bottom)", "n": 104, "A_sharpe": 0.1672, "A_sortino": 0.196, "A_excess_sharpe": 0.3344, "A_return_pct": 0.26, "A_hit_rate": 47.06, "A_n": 104, "A_bh_sharpe": -0.1672, "A_bh_return_pct": -3.81, "A_psr": 0.5428, "A_ic": 0.0159, "B_sharpe": 2.5165, "B_sortino": 3.1809, "B_excess_sharpe": 4.7906, "B_return_pct": 66.15, "B_hit_rate": 49.51, "B_n": 104, "B_bh_sharpe": -2.2741, "B_bh_return_pct": -44.12, "B_psr": 0.9545, "B_ic": -0.1146, "D_sharpe": 0.1672, "D_sortino": 0.196, "D_excess_sharpe": 0.3344, "D_return_pct": 0.26, "D_hit_rate": 47.06, "D_n": 104, "D_bh_sharpe": -0.1672, "D_bh_return_pct": -3.81, "D_psr": 0.5428, "D_ic": 0.0159, "sharpe": 0.1672, "sortino": 0.196, "return_pct": 0.26, "equity": 1002.5999999999999, "max_dd": 0.0, "win_rate": 47.06, "profit_factor": 0.0, "ic": 0.0159, "hit": 47.06, "psr": 0.5428, "bh_sharpe": -0.1672, "bh_return_pct": -3.81, "excess_sharpe": 0.3344}, {"fold": "fold_2", "regime": "2011 US-downgrade + EU debt", "n": 96, "A_sharpe": 0.2741, "A_sortino": 0.305, "A_excess_sharpe": 0.5483, "A_return_pct": 1.45, "A_hit_rate": 47.37, "A_n": 96, "A_bh_sharpe": -0.2741, "A_bh_return_pct": -4.09, "A_psr": 0.5672, "A_ic": 0.0313, "B_sharpe": -0.358, "B_sortino": -0.399, "B_excess_sharpe": 0.6695, "B_return_pct": -13.44, "B_hit_rate": 45.83, "B_n": 96, "B_bh_sharpe": -1.0274, "B_bh_return_pct": -25.58, "B_psr": 0.4137, "B_ic": -0.0782, "D_sharpe": 0.2741, "D_sortino": 0.305, "D_excess_sharpe": 0.5483, "D_return_pct": 1.45, "D_hit_rate": 47.37, "D_n": 96, "D_bh_sharpe": -0.2741, "D_bh_return_pct": -4.09, "D_psr": 0.5672, "D_ic": 0.0313, "sharpe": 0.2741, "sortino": 0.305, "return_pct": 1.45, "equity": 1014.5, "max_dd": 0.0, "win_rate": 47.37, "profit_factor": 0.0, "ic": 0.0313, "hit": 47.37, "psr": 0.5672, "bh_sharpe": -0.2741, "bh_return_pct": -4.09, "excess_sharpe": 0.5483}, {"fold": "fold_3", "regime": "Taper tantrum and 2014 H1", "n": 54, "A_sharpe": -4.6998, "A_sortino": -4.264, "A_excess_sharpe": -9.3995, "A_return_pct": -9.68, "A_hit_rate": 38.89, "A_n": 54, "A_bh_sharpe": 4.6998, "A_bh_return_pct": 10.46, "A_psr": 0.0221, "A_ic": 0.0359, "B_sharpe": 4.6335, "B_sortino": 5.0282, "B_excess_sharpe": -4.3991, "B_return_pct": 25.1, "B_hit_rate": 61.11, "B_n": 54, "B_bh_sharpe": 9.0326, "B_bh_return_pct": 49.18, "B_psr": 0.9816, "B_ic": -0.2855, "D_sharpe": -4.6998, "D_sortino": -4.264, "D_excess_sharpe": -9.3995, "D_return_pct": -9.68, "D_hit_rate": 38.89, "D_n": 54, "D_bh_sharpe": 4.6998, "D_bh_return_pct": 10.46, "D_psr": 0.0221, "D_ic": 0.0359, "sharpe": -4.6998, "sortino": -4.264, "return_pct": -9.68, "equity": 903.2, "max_dd": 0.0, "win_rate": 38.89, "profit_factor": 0.0, "ic": 0.0359, "hit": 38.89, "psr": 0.0221, "bh_sharpe": 4.6998, "bh_return_pct": 10.46, "excess_sharpe": -9.3995}, {"fold": "fold_4", "regime": "China devaluation and oil crash", "n": 96, "A_sharpe": 0.4241, "A_sortino": 0.431, "A_excess_sharpe": 0.8483, "A_return_pct": 2.43, "A_hit_rate": 52.63, "A_n": 96, "A_bh_sharpe": -0.4241, "A_bh_return_pct": -3.73, "A_psr": 0.6029, "A_ic": -0.1102, "B_sharpe": 1.0375, "B_sortino": 1.3701, "B_excess_sharpe": 2.2218, "B_return_pct": 15.0, "B_hit_rate": 51.04, "B_n": 96, "B_bh_sharpe": -1.1843, "B_bh_return_pct": -21.44, "B_psr": 0.75, "B_ic": 0.0462, "D_sharpe": 0.4241, "D_sortino": 0.431, "D_excess_sharpe": 0.8483, "D_return_pct": 2.43, "D_hit_rate": 52.63, "D_n": 96, "D_bh_sharpe": -0.4241, "D_bh_return_pct": -3.73, "D_psr": 0.6029, "D_ic": -0.1102, "sharpe": 0.4241, "sortino": 0.431, "return_pct": 2.43, "equity": 1024.3, "max_dd": 0.0, "win_rate": 52.63, "profit_factor": 0.0, "ic": -0.1102, "hit": 52.63, "psr": 0.6029, "bh_sharpe": -0.4241, "bh_return_pct": -3.73, "excess_sharpe": 0.8483}, {"fold": "fold_5", "regime": "2018 Vol-mageddon + Q4 sell-off", "n": 54, "A_sharpe": -1.2043, "A_sortino": -1.2116, "A_excess_sharpe": -2.6322, "A_return_pct": -3.58, "A_hit_rate": 48.15, "A_n": 54, "A_bh_sharpe": 1.428, "A_bh_return_pct": 3.97, "A_psr": 0.2929, "A_ic": -0.0491, "B_sharpe": -1.1286, "B_sortino": -0.9629, "B_excess_sharpe": -6.0607, "B_return_pct": -8.07, "B_hit_rate": 55.56, "B_n": 54, "B_bh_sharpe": 4.9322, "B_bh_return_pct": 34.93, "B_psr": 0.3011, "B_ic": -0.232, "D_sharpe": -1.2043, "D_sortino": -1.2116, "D_excess_sharpe": -2.6322, "D_return_pct": -3.58, "D_hit_rate": 48.15, "D_n": 54, "D_bh_sharpe": 1.428, "D_bh_return_pct": 3.97, "D_psr": 0.2929, "D_ic": -0.0491, "sharpe": -1.2043, "sortino": -1.2116, "return_pct": -3.58, "equity": 964.1999999999999, "max_dd": 0.0, "win_rate": 48.15, "profit_factor": 0.0, "ic": -0.0491, "hit": 48.15, "psr": 0.2929, "bh_sharpe": 1.428, "bh_return_pct": 3.97, "excess_sharpe": -2.6322}, {"fold": "fold_6", "regime": "COVID crash and V-recovery", "n": 75, "A_sharpe": -4.2994, "A_sortino": -4.316, "A_excess_sharpe": -8.5988, "A_return_pct": -13.12, "A_hit_rate": 32.0, "A_n": 75, "A_bh_sharpe": 4.2994, "A_bh_return_pct": 14.68, "A_psr": 0.0156, "A_ic": 0.1222, "B_sharpe": 8.2469, "B_sortino": 6.7649, "B_excess_sharpe": -6.087, "B_return_pct": 71.57, "B_hit_rate": 77.33, "B_n": 75, "B_bh_sharpe": 14.3339, "B_bh_return_pct": 120.13, "B_psr": 0.9999, "B_ic": -0.1091, "D_sharpe": -4.2994, "D_sortino": -4.316, "D_excess_sharpe": -8.5988, "D_return_pct": -13.12, "D_hit_rate": 32.0, "D_n": 75, "D_bh_sharpe": 4.2994, "D_bh_return_pct": 14.68, "D_psr": 0.0156, "D_ic": 0.1222, "sharpe": -4.2994, "sortino": -4.316, "return_pct": -13.12, "equity": 868.8000000000001, "max_dd": 0.0, "win_rate": 32.0, "profit_factor": 0.0, "ic": 0.1222, "hit": 32.0, "psr": 0.0156, "bh_sharpe": 4.2994, "bh_return_pct": 14.68, "excess_sharpe": -8.5988}, {"fold": "fold_7", "regime": "Inflation bear, AI rally and 2025", "n": 114, "A_sharpe": -0.735, "A_sortino": -0.7522, "A_excess_sharpe": -3.5801, "A_return_pct": -5.61, "A_hit_rate": 45.61, "A_n": 114, "A_bh_sharpe": 2.845, "A_bh_return_pct": 21.34, "A_psr": 0.3115, "A_ic": -0.0045, "B_sharpe": 4.5033, "B_sortino": 4.531, "B_excess_sharpe": -1.6333, "B_return_pct": 101.56, "B_hit_rate": 65.79, "B_n": 114, "B_bh_sharpe": 6.1366, "B_bh_return_pct": 155.03, "B_psr": 0.9984, "B_ic": -0.0989, "D_sharpe": -0.735, "D_sortino": -0.7522, "D_excess_sharpe": -3.5801, "D_return_pct": -5.61, "D_hit_rate": 45.61, "D_n": 114, "D_bh_sharpe": 2.845, "D_bh_return_pct": 21.34, "D_psr": 0.3115, "D_ic": -0.0045, "sharpe": -0.735, "sortino": -0.7522, "return_pct": -5.61, "equity": 943.9, "max_dd": 0.0, "win_rate": 45.61, "profit_factor": 0.0, "ic": -0.0045, "hit": 45.61, "psr": 0.3115, "bh_sharpe": 2.845, "bh_return_pct": 21.34, "excess_sharpe": -3.5801}], "status": "DISCARD", "precision": 0.6421, "recall": 0.0756, "f1": 0.1353, "f2": 0.0918, "accuracy": 0.4468, "mcc": 0.0379, "tp": 61, "fp": 34, "tn": 569, "fn": 746, "test_sharpe": -0.5057, "A_sharpe": -0.5057, "A_excess_sharpe": -1.1099, "A_return_pct": -62.25, "A_precision": 0.6421, "A_recall": 0.0756, "A_f1": 0.1353, "A_f2": 0.0918, "A_accuracy": 0.4468, "A_mcc": 0.0379, "A_tp": 61, "A_fp": 34, "A_tn": 569, "A_fn": 746, "A_psr": 0.117, "A_ic": 0.0032, "A_hit_rate": 44.56, "A_bh_sharpe": 0.6042, "A_bh_return_pct": 103.49}
