{"experiment_num": 69, "backbone": "mlp", "description": "MLP @ exp 6 hidden=96 (down from 128) - FX paper section 4.6 narrower width for small-n regularization", "config": {"seq_len": 10, "lr": 0.0003, "batch_size": 32, "epochs": 50, "weight_decay": 1e-05, "patience": 10, "warmup_epochs": 0, "head_dropout": 0.25, "huber_delta": 1.0, "grad_clip": 1.0, "seed": 0, "hidden_size": 96, "num_layers": null, "max_depth": null, "gbm_lr": null, "n_estimators": null}, "composite": 0.4424, "test_pos_folds": 6, "val_pos_folds": 6, "val_loss": -2.892042676674777, "elapsed_sec": 20.0, "timestamp": "2026-04-27T22:59:54", "sharpe": 0.6216, "val_sharpe": 0.5424, "ic": 0.0123, "hit": 53.45, "psr": 0.931, "equity": 2093.3, "return_pct": 109.33, "bh_sharpe": 0.6042, "bh_return_pct": 103.49, "excess_sharpe": 0.0174, "B_sharpe": 0.1834, "B_excess_sharpe": -1.5174, "B_return_pct": -22.68, "D_sharpe": 0.6216, "D_excess_sharpe": 0.0174, "D_return_pct": 109.33, "precision": 0.5982, "recall": 0.5663, "f1": 0.5818, "f2": 0.5724, "mcc": 0.0568, "accuracy": 0.534, "val_precision": 0.5533, "val_recall": 0.6626, "val_f1": 0.603, "val_f2": 0.6374, "val_mcc": -0.0043, "val_accuracy": 0.516, "per_window": [{"fold": "fold_1", "regime": "GFC peak crash (Lehman + Mar-2009 bottom)", "n": 115, "A_sharpe": 0.6488, "A_sortino": 0.6469, "A_excess_sharpe": 1.0929, "A_return_pct": 9.46, "A_hit_rate": 53.04, "A_n": 115, "A_bh_sharpe": -0.4441, "A_bh_return_pct": -14.4, "A_psr": 0.6685, "A_ic": 0.044, "A_precision": 0.5, "A_recall": 0.0741, "A_f1": 0.129, "A_f2": 0.0893, "A_accuracy": 0.5304, "A_mcc": 0.0167, "A_tp": 4, "A_fp": 4, "A_tn": 57, "A_fn": 50, "B_sharpe": 0.0429, "B_sortino": 0.041, "B_excess_sharpe": 0.3408, "B_return_pct": -16.09, "B_hit_rate": 52.63, "B_n": 115, "B_bh_sharpe": -0.2978, "B_bh_return_pct": -27.23, "B_psr": 0.5115, "B_ic": 0.2283, "B_precision": 0.5179, "B_recall": 0.9831, "B_f1": 0.6784, "B_f2": 0.8333, "B_accuracy": 0.5217, "B_mcc": 0.0588, "B_tp": 58, "B_fp": 54, "B_tn": 2, "B_fn": 1, "D_sharpe": 0.6488, "D_sortino": 0.6469, "D_excess_sharpe": 1.0929, "D_return_pct": 9.46, "D_hit_rate": 53.04, "D_n": 115, "D_bh_sharpe": -0.4441, "D_bh_return_pct": -14.4, "D_psr": 0.6685, "D_ic": 0.044, "D_precision": 0.5, "D_recall": 0.0741, "D_f1": 0.129, "D_f2": 0.0893, "D_accuracy": 0.5304, "D_mcc": 0.0167, "D_tp": 4, "D_fp": 4, "D_tn": 57, "D_fn": 50, "sharpe": 0.6488, "sortino": 0.6469, "return_pct": 9.46, "equity": 1094.6, "max_dd": 0.0, "win_rate": 53.04, "profit_factor": 0.0, "ic": 0.044, "hit": 53.04, "psr": 0.6685, "bh_sharpe": -0.4441, "bh_return_pct": -14.4, "excess_sharpe": 1.0929, "precision": 0.5, "recall": 0.0741, "f1": 0.129, "f2": 0.0893, "mcc": 0.0167, "accuracy": 0.5304, "tp": 4, "fp": 4, "tn": 57, "fn": 50}, {"fold": "fold_2", "regime": "2011 US-downgrade + EU debt", "n": 136, "A_sharpe": 0.7332, "A_sortino": 0.676, "A_excess_sharpe": -0.9995, "A_return_pct": 7.25, "A_hit_rate": 55.56, "A_n": 136, "A_bh_sharpe": 1.7327, "A_bh_return_pct": 19.75, "A_psr": 0.7025, "A_ic": 0.0664, "A_precision": 0.6286, "A_recall": 0.5641, "A_f1": 0.5946, "A_f2": 0.5759, "A_accuracy": 0.5588, "A_mcc": 0.1146, "A_tp": 44, "A_fp": 26, "A_tn": 32, "A_fn": 34, "B_sharpe": 4.7776, "B_sortino": 4.3136, "B_excess_sharpe": 0.7117, "B_return_pct": 190.74, "B_hit_rate": 71.32, "B_n": 136, "B_bh_sharpe": 4.0659, "B_bh_return_pct": 148.68, "B_psr": 0.9996, "B_ic": 0.0398, "B_precision": 0.7568, "B_recall": 0.875, "B_f1": 0.8116, "B_f2": 0.8485, "B_accuracy": 0.7132, "B_mcc": 0.2353, "B_tp": 84, "B_fp": 27, "B_tn": 13, "B_fn": 12, "D_sharpe": 0.7332, "D_sortino": 0.676, "D_excess_sharpe": -0.9995, "D_return_pct": 7.25, "D_hit_rate": 55.56, "D_n": 136, "D_bh_sharpe": 1.7327, "D_bh_return_pct": 19.75, "D_psr": 0.7025, "D_ic": 0.0664, "D_precision": 0.6286, "D_recall": 0.5641, "D_f1": 0.5946, "D_f2": 0.5759, "D_accuracy": 0.5588, "D_mcc": 0.1146, "D_tp": 44, "D_fp": 26, "D_tn": 32, "D_fn": 34, "sharpe": 0.7332, "sortino": 0.676, "return_pct": 7.25, "equity": 1072.5, "max_dd": 0.0, "win_rate": 55.56, "profit_factor": 0.0, "ic": 0.0664, "hit": 55.56, "psr": 0.7025, "bh_sharpe": 1.7327, "bh_return_pct": 19.75, "excess_sharpe": -0.9995, "precision": 0.6286, "recall": 0.5641, "f1": 0.5946, "f2": 0.5759, "mcc": 0.1146, "accuracy": 0.5588, "tp": 44, "fp": 26, "tn": 32, "fn": 34}, {"fold": "fold_3", "regime": "Taper tantrum and 2014 H1", "n": 178, "A_sharpe": 2.1936, "A_sortino": 2.435, "A_excess_sharpe": 0.8491, "A_return_pct": 21.35, "A_hit_rate": 54.24, "A_n": 178, "A_bh_sharpe": 1.3445, "A_bh_return_pct": 12.41, "A_psr": 0.9699, "A_ic": 0.0598, "A_precision": 0.5778, "A_recall": 0.7573, "A_f1": 0.6555, "A_f2": 0.713, "A_accuracy": 0.5393, "A_mcc": -0.0031, "A_tp": 78, "A_fp": 57, "A_tn": 18, "A_fn": 25, "B_sharpe": 3.2404, "B_sortino": 3.6254, "B_excess_sharpe": 0.1921, "B_return_pct": 77.84, "B_hit_rate": 56.74, "B_n": 178, "B_bh_sharpe": 3.0483, "B_bh_return_pct": 71.83, "B_psr": 0.997, "B_ic": 0.0314, "B_precision": 0.6231, "B_recall": 0.7431, "B_f1": 0.6778, "B_f2": 0.7155, "B_accuracy": 0.5674, "B_mcc": 0.0362, "B_tp": 81, "B_fp": 49, "B_tn": 20, "B_fn": 28, "D_sharpe": 2.1936, "D_sortino": 2.435, "D_excess_sharpe": 0.8491, "D_return_pct": 21.35, "D_hit_rate": 54.24, "D_n": 178, "D_bh_sharpe": 1.3445, "D_bh_return_pct": 12.41, "D_psr": 0.9699, "D_ic": 0.0598, "D_precision": 0.5778, "D_recall": 0.7573, "D_f1": 0.6555, "D_f2": 0.713, "D_accuracy": 0.5393, "D_mcc": -0.0031, "D_tp": 78, "D_fp": 57, "D_tn": 18, "D_fn": 25, "sharpe": 2.1936, "sortino": 2.435, "return_pct": 21.35, "equity": 1213.5, "max_dd": 0.0, "win_rate": 54.24, "profit_factor": 0.0, "ic": 0.0598, "hit": 54.24, "psr": 0.9699, "bh_sharpe": 1.3445, "bh_return_pct": 12.41, "excess_sharpe": 0.8491, "precision": 0.5778, "recall": 0.7573, "f1": 0.6555, "f2": 0.713, "mcc": -0.0031, "accuracy": 0.5393, "tp": 78, "fp": 57, "tn": 18, "fn": 25}, {"fold": "fold_4", "regime": "China devaluation and oil crash", "n": 157, "A_sharpe": -0.8973, "A_sortino": -0.8671, "A_excess_sharpe": -0.9071, "A_return_pct": -11.32, "A_hit_rate": 49.36, "A_n": 157, "A_bh_sharpe": 0.0098, "A_bh_return_pct": -1.05, "A_psr": 0.2404, "A_ic": -0.0919, "A_precision": 0.507, "A_recall": 0.4444, "A_f1": 0.4737, "A_f2": 0.4557, "A_accuracy": 0.4904, "A_mcc": -0.0161, "A_tp": 36, "A_fp": 35, "A_tn": 41, "A_fn": 45, "B_sharpe": 1.1876, "B_sortino": 1.2567, "B_excess_sharpe": 1.1717, "B_return_pct": 30.24, "B_hit_rate": 50.32, "B_n": 157, "B_bh_sharpe": 0.0159, "B_bh_return_pct": -5.48, "B_psr": 0.8246, "B_ic": 0.0676, "B_precision": 0.5412, "B_recall": 0.5412, "B_f1": 0.5412, "B_f2": 0.5412, "B_accuracy": 0.5032, "B_mcc": -0.0005, "B_tp": 46, "B_fp": 39, "B_tn": 33, "B_fn": 39, "D_sharpe": -0.8973, "D_sortino": -0.8671, "D_excess_sharpe": -0.9071, "D_return_pct": -11.32, "D_hit_rate": 49.36, "D_n": 157, "D_bh_sharpe": 0.0098, "D_bh_return_pct": -1.05, "D_psr": 0.2404, "D_ic": -0.0919, "D_precision": 0.507, "D_recall": 0.4444, "D_f1": 0.4737, "D_f2": 0.4557, "D_accuracy": 0.4904, "D_mcc": -0.0161, "D_tp": 36, "D_fp": 35, "D_tn": 41, "D_fn": 45, "sharpe": -0.8973, "sortino": -0.8671, "return_pct": -11.32, "equity": 886.8000000000001, "max_dd": 0.0, "win_rate": 49.36, "profit_factor": 0.0, "ic": -0.0919, "hit": 49.36, "psr": 0.2404, "bh_sharpe": 0.0098, "bh_return_pct": -1.05, "excess_sharpe": -0.9071, "precision": 0.507, "recall": 0.4444, "f1": 0.4737, "f2": 0.4557, "mcc": -0.0161, "accuracy": 0.4904, "tp": 36, "fp": 35, "tn": 41, "fn": 45}, {"fold": "fold_5", "regime": "2018 Vol-mageddon + Q4 sell-off", "n": 177, "A_sharpe": 1.2404, "A_sortino": 1.2656, "A_excess_sharpe": 0.9306, "A_return_pct": 19.89, "A_hit_rate": 54.8, "A_n": 177, "A_bh_sharpe": 0.3098, "A_bh_return_pct": 3.19, "A_psr": 0.8491, "A_ic": 0.027, "A_precision": 0.6237, "A_recall": 0.5631, "A_f1": 0.5918, "A_f2": 0.5743, "A_accuracy": 0.548, "A_mcc": 0.089, "A_tp": 58, "A_fp": 35, "A_tn": 39, "A_fn": 45, "B_sharpe": 1.1159, "B_sortino": 1.1098, "B_excess_sharpe": 0.2242, "B_return_pct": 33.24, "B_hit_rate": 53.98, "B_n": 177, "B_bh_sharpe": 0.8917, "B_bh_return_pct": 23.8, "B_psr": 0.8235, "B_ic": -0.1244, "B_precision": 0.6116, "B_recall": 0.6789, "B_f1": 0.6435, "B_f2": 0.6643, "B_accuracy": 0.5367, "B_mcc": -0.0128, "B_tp": 74, "B_fp": 47, "B_tn": 21, "B_fn": 35, "D_sharpe": 1.2404, "D_sortino": 1.2656, "D_excess_sharpe": 0.9306, "D_return_pct": 19.89, "D_hit_rate": 54.8, "D_n": 177, "D_bh_sharpe": 0.3098, "D_bh_return_pct": 3.19, "D_psr": 0.8491, "D_ic": 0.027, "D_precision": 0.6237, "D_recall": 0.5631, "D_f1": 0.5918, "D_f2": 0.5743, "D_accuracy": 0.548, "D_mcc": 0.089, "D_tp": 58, "D_fp": 35, "D_tn": 39, "D_fn": 45, "sharpe": 1.2404, "sortino": 1.2656, "return_pct": 19.89, "equity": 1198.9, "max_dd": 0.0, "win_rate": 54.8, "profit_factor": 0.0, "ic": 0.027, "hit": 54.8, "psr": 0.8491, "bh_sharpe": 0.3098, "bh_return_pct": 3.19, "excess_sharpe": 0.9306, "precision": 0.6237, "recall": 0.5631, "f1": 0.5918, "f2": 0.5743, "mcc": 0.089, "accuracy": 0.548, "tp": 58, "fp": 35, "tn": 39, "fn": 45}, {"fold": "fold_6", "regime": "COVID crash and V-recovery", "n": 222, "A_sharpe": 0.2599, "A_sortino": 0.2773, "A_excess_sharpe": -0.6289, "A_return_pct": 2.45, "A_hit_rate": 51.35, "A_n": 222, "A_bh_sharpe": 0.8888, "A_bh_return_pct": 26.13, "A_psr": 0.5967, "A_ic": -0.0312, "A_precision": 0.6596, "A_recall": 0.4493, "A_f1": 0.5345, "A_f2": 0.4799, "A_accuracy": 0.5135, "A_mcc": 0.0671, "A_tp": 62, "A_fp": 32, "A_tn": 52, "A_fn": 76, "B_sharpe": -1.1838, "B_sortino": -1.0664, "B_excess_sharpe": -3.5722, "B_return_pct": -61.18, "B_hit_rate": 49.77, "B_n": 222, "B_bh_sharpe": 2.3884, "B_bh_return_pct": 243.18, "B_psr": 0.1297, "B_ic": -0.0381, "B_precision": 0.6102, "B_recall": 0.5255, "B_f1": 0.5647, "B_f2": 0.5405, "B_accuracy": 0.5, "B_mcc": -0.0152, "B_tp": 72, "B_fp": 46, "B_tn": 39, "B_fn": 65, "D_sharpe": 0.2599, "D_sortino": 0.2773, "D_excess_sharpe": -0.6289, "D_return_pct": 2.45, "D_hit_rate": 51.35, "D_n": 222, "D_bh_sharpe": 0.8888, "D_bh_return_pct": 26.13, "D_psr": 0.5967, "D_ic": -0.0312, "D_precision": 0.6596, "D_recall": 0.4493, "D_f1": 0.5345, "D_f2": 0.4799, "D_accuracy": 0.5135, "D_mcc": 0.0671, "D_tp": 62, "D_fp": 32, "D_tn": 52, "D_fn": 76, "sharpe": 0.2599, "sortino": 0.2773, "return_pct": 2.45, "equity": 1024.5, "max_dd": 0.0, "win_rate": 51.35, "profit_factor": 0.0, "ic": -0.0312, "hit": 51.35, "psr": 0.5967, "bh_sharpe": 0.8888, "bh_return_pct": 26.13, "excess_sharpe": -0.6289, "precision": 0.6596, "recall": 0.4493, "f1": 0.5345, "f2": 0.4799, "mcc": 0.0671, "accuracy": 0.5135, "tp": 62, "fp": 32, "tn": 52, "fn": 76}, {"fold": "fold_7", "regime": "Inflation bear, AI rally and 2025", "n": 425, "A_sharpe": 0.9259, "A_sortino": 0.9952, "A_excess_sharpe": -0.0456, "A_return_pct": 34.9, "A_hit_rate": 54.59, "A_n": 425, "A_bh_sharpe": 0.9715, "A_bh_return_pct": 37.12, "A_psr": 0.894, "A_ic": 0.0067, "A_precision": 0.5973, "A_recall": 0.7, "A_f1": 0.6446, "A_f2": 0.6767, "A_accuracy": 0.5459, "A_mcc": 0.0273, "A_tp": 175, "A_fp": 118, "A_tn": 57, "A_fn": 75, "B_sharpe": -1.5122, "B_sortino": -1.4942, "B_excess_sharpe": -4.0149, "B_return_pct": -73.55, "B_hit_rate": 44.1, "B_n": 425, "B_bh_sharpe": 2.5027, "B_bh_return_pct": 458.83, "B_psr": 0.0248, "B_ic": -0.1124, "B_precision": 0.5613, "B_recall": 0.4525, "B_f1": 0.5011, "B_f2": 0.4707, "B_accuracy": 0.4424, "B_mcc": -0.1181, "B_tp": 119, "B_fp": 93, "B_tn": 69, "B_fn": 144, "D_sharpe": 0.9259, "D_sortino": 0.9952, "D_excess_sharpe": -0.0456, "D_return_pct": 34.9, "D_hit_rate": 54.59, "D_n": 425, "D_bh_sharpe": 0.9715, "D_bh_return_pct": 37.12, "D_psr": 0.894, "D_ic": 0.0067, "D_precision": 0.5973, "D_recall": 0.7, "D_f1": 0.6446, "D_f2": 0.6767, "D_accuracy": 0.5459, "D_mcc": 0.0273, "D_tp": 175, "D_fp": 118, "D_tn": 57, "D_fn": 75, "sharpe": 0.9259, "sortino": 0.9952, "return_pct": 34.9, "equity": 1349.0, "max_dd": 0.0, "win_rate": 54.59, "profit_factor": 0.0, "ic": 0.0067, "hit": 54.59, "psr": 0.894, "bh_sharpe": 0.9715, "bh_return_pct": 37.12, "excess_sharpe": -0.0456, "precision": 0.5973, "recall": 0.7, "f1": 0.6446, "f2": 0.6767, "mcc": 0.0273, "accuracy": 0.5459, "tp": 175, "fp": 118, "tn": 57, "fn": 75}], "per_window_val": [{"fold": "fold_1", "regime": "GFC peak crash (Lehman + Mar-2009 bottom)", "n": 104, "A_sharpe": 1.2246, "A_sortino": 1.4217, "A_excess_sharpe": 1.3918, "A_return_pct": 14.06, "A_hit_rate": 52.94, "A_n": 104, "A_bh_sharpe": -0.1672, "A_bh_return_pct": -3.81, "A_psr": 0.792, "A_ic": 0.0915, "A_precision": 0.7143, "A_recall": 0.1852, "A_f1": 0.2941, "A_f2": 0.2174, "A_accuracy": 0.5385, "A_mcc": 0.154, "A_tp": 10, "A_fp": 4, "A_tn": 46, "A_fn": 44, "B_sharpe": -1.9158, "B_sortino": -1.6907, "B_excess_sharpe": 0.3583, "B_return_pct": -39.44, "B_hit_rate": 46.6, "B_n": 104, "B_bh_sharpe": -2.2741, "B_bh_return_pct": -44.12, "B_psr": 0.101, "B_ic": -0.0376, "B_precision": 0.4727, "B_recall": 0.5, "B_f1": 0.486, "B_f2": 0.4943, "B_accuracy": 0.4712, "B_mcc": -0.0578, "B_tp": 26, "B_fp": 29, "B_tn": 23, "B_fn": 26, "D_sharpe": 1.2246, "D_sortino": 1.4217, "D_excess_sharpe": 1.3918, "D_return_pct": 14.06, "D_hit_rate": 52.94, "D_n": 104, "D_bh_sharpe": -0.1672, "D_bh_return_pct": -3.81, "D_psr": 0.792, "D_ic": 0.0915, "D_precision": 0.7143, "D_recall": 0.1852, "D_f1": 0.2941, "D_f2": 0.2174, "D_accuracy": 0.5385, "D_mcc": 0.154, "D_tp": 10, "D_fp": 4, "D_tn": 46, "D_fn": 44, "sharpe": 1.2246, "sortino": 1.4217, "return_pct": 14.06, "equity": 1140.6000000000001, "max_dd": 0.0, "win_rate": 52.94, "profit_factor": 0.0, "ic": 0.0915, "hit": 52.94, "psr": 0.792, "bh_sharpe": -0.1672, "bh_return_pct": -3.81, "excess_sharpe": 1.3918, "precision": 0.7143, "recall": 0.1852, "f1": 0.2941, "f2": 0.2174, "mcc": 0.154, "accuracy": 0.5385, "tp": 10, "fp": 4, "tn": 46, "fn": 44}, {"fold": "fold_2", "regime": "2011 US-downgrade + EU debt", "n": 96, "A_sharpe": 0.1855, "A_sortino": 0.1965, "A_excess_sharpe": 0.4597, "A_return_pct": 0.53, "A_hit_rate": 49.47, "A_n": 96, "A_bh_sharpe": -0.2741, "A_bh_return_pct": -4.09, "A_psr": 0.5455, "A_ic": -0.102, "A_precision": 0.5094, "A_recall": 0.54, "A_f1": 0.5243, "A_f2": 0.5336, "A_accuracy": 0.4896, "A_mcc": -0.0253, "A_tp": 27, "A_fp": 26, "A_tn": 20, "A_fn": 23, "B_sharpe": 2.7405, "B_sortino": 3.3436, "B_excess_sharpe": 3.7679, "B_return_pct": 71.31, "B_hit_rate": 52.08, "B_n": 96, "B_bh_sharpe": -1.0274, "B_bh_return_pct": -25.58, "B_psr": 0.9578, "B_ic": 0.2141, "B_precision": 0.4795, "B_recall": 0.814, "B_f1": 0.6034, "B_f2": 0.7143, "B_accuracy": 0.5208, "B_mcc": 0.113, "B_tp": 35, "B_fp": 38, "B_tn": 15, "B_fn": 8, "D_sharpe": 0.1855, "D_sortino": 0.1965, "D_excess_sharpe": 0.4597, "D_return_pct": 0.53, "D_hit_rate": 49.47, "D_n": 96, "D_bh_sharpe": -0.2741, "D_bh_return_pct": -4.09, "D_psr": 0.5455, "D_ic": -0.102, "D_precision": 0.5094, "D_recall": 0.54, "D_f1": 0.5243, "D_f2": 0.5336, "D_accuracy": 0.4896, "D_mcc": -0.0253, "D_tp": 27, "D_fp": 26, "D_tn": 20, "D_fn": 23, "sharpe": 0.1855, "sortino": 0.1965, "return_pct": 0.53, "equity": 1005.3000000000001, "max_dd": 0.0, "win_rate": 49.47, "profit_factor": 0.0, "ic": -0.102, "hit": 49.47, "psr": 0.5455, "bh_sharpe": -0.2741, "bh_return_pct": -4.09, "excess_sharpe": 0.4597, "precision": 0.5094, "recall": 0.54, "f1": 0.5243, "f2": 0.5336, "mcc": -0.0253, "accuracy": 0.4896, "tp": 27, "fp": 26, "tn": 20, "fn": 23}, {"fold": "fold_3", "regime": "Taper tantrum and 2014 H1", "n": 54, "A_sharpe": 4.2974, "A_sortino": 4.6303, "A_excess_sharpe": -0.4024, "A_return_pct": 9.58, "A_hit_rate": 59.26, "A_n": 54, "A_bh_sharpe": 4.6998, "A_bh_return_pct": 10.46, "A_psr": 0.9689, "A_ic": 0.1331, "A_precision": 0.6078, "A_recall": 0.9394, "A_f1": 0.7381, "A_f2": 0.847, "A_accuracy": 0.5926, "A_mcc": -0.0276, "A_tp": 31, "A_fp": 20, "A_tn": 1, "A_fn": 2, "B_sharpe": 6.3971, "B_sortino": 7.3336, "B_excess_sharpe": -2.6354, "B_return_pct": 35.09, "B_hit_rate": 66.67, "B_n": 54, "B_bh_sharpe": 9.0326, "B_bh_return_pct": 49.18, "B_psr": 0.9982, "B_ic": 0.0167, "B_precision": 0.6863, "B_recall": 0.9459, "B_f1": 0.7955, "B_f2": 0.8794, "B_accuracy": 0.6667, "B_mcc": 0.0097, "B_tp": 35, "B_fp": 16, "B_tn": 1, "B_fn": 2, "D_sharpe": 4.2974, "D_sortino": 4.6303, "D_excess_sharpe": -0.4024, "D_return_pct": 9.58, "D_hit_rate": 59.26, "D_n": 54, "D_bh_sharpe": 4.6998, "D_bh_return_pct": 10.46, "D_psr": 0.9689, "D_ic": 0.1331, "D_precision": 0.6078, "D_recall": 0.9394, "D_f1": 0.7381, "D_f2": 0.847, "D_accuracy": 0.5926, "D_mcc": -0.0276, "D_tp": 31, "D_fp": 20, "D_tn": 1, "D_fn": 2, "sharpe": 4.2974, "sortino": 4.6303, "return_pct": 9.58, "equity": 1095.8000000000002, "max_dd": 0.0, "win_rate": 59.26, "profit_factor": 0.0, "ic": 0.1331, "hit": 59.26, "psr": 0.9689, "bh_sharpe": 4.6998, "bh_return_pct": 10.46, "excess_sharpe": -0.4024, "precision": 0.6078, "recall": 0.9394, "f1": 0.7381, "f2": 0.847, "mcc": -0.0276, "accuracy": 0.5926, "tp": 31, "fp": 20, "tn": 1, "fn": 2}, {"fold": "fold_4", "regime": "China devaluation and oil crash", "n": 96, "A_sharpe": -2.3994, "A_sortino": -2.3393, "A_excess_sharpe": -1.9753, "A_return_pct": -16.51, "A_hit_rate": 38.95, "A_n": 96, "A_bh_sharpe": -0.4241, "A_bh_return_pct": -3.73, "A_psr": 0.0718, "A_ic": -0.2528, "A_precision": 0.4054, "A_recall": 0.6667, "A_f1": 0.5042, "A_f2": 0.5906, "A_accuracy": 0.3854, "A_mcc": -0.2328, "A_tp": 30, "A_fp": 44, "A_tn": 7, "A_fn": 15, "B_sharpe": 1.4761, "B_sortino": 1.6706, "B_excess_sharpe": 2.6603, "B_return_pct": 23.72, "B_hit_rate": 50.0, "B_n": 96, "B_bh_sharpe": -1.1843, "B_bh_return_pct": -21.44, "B_psr": 0.8182, "B_ic": 0.0391, "B_precision": 0.4815, "B_recall": 0.5652, "B_f1": 0.52, "B_f2": 0.5462, "B_accuracy": 0.5, "B_mcc": 0.0053, "B_tp": 26, "B_fp": 28, "B_tn": 22, "B_fn": 20, "D_sharpe": -2.3994, "D_sortino": -2.3393, "D_excess_sharpe": -1.9753, "D_return_pct": -16.51, "D_hit_rate": 38.95, "D_n": 96, "D_bh_sharpe": -0.4241, "D_bh_return_pct": -3.73, "D_psr": 0.0718, "D_ic": -0.2528, "D_precision": 0.4054, "D_recall": 0.6667, "D_f1": 0.5042, "D_f2": 0.5906, "D_accuracy": 0.3854, "D_mcc": -0.2328, "D_tp": 30, "D_fp": 44, "D_tn": 7, "D_fn": 15, "sharpe": -2.3994, "sortino": -2.3393, "return_pct": -16.51, "equity": 834.9, "max_dd": 0.0, "win_rate": 38.95, "profit_factor": 0.0, "ic": -0.2528, "hit": 38.95, "psr": 0.0718, "bh_sharpe": -0.4241, "bh_return_pct": -3.73, "excess_sharpe": -1.9753, "precision": 0.4054, "recall": 0.6667, "f1": 0.5042, "f2": 0.5906, "mcc": -0.2328, "accuracy": 0.3854, "tp": 30, "fp": 44, "tn": 7, "fn": 15}, {"fold": "fold_5", "regime": "2018 Vol-mageddon + Q4 sell-off", "n": 54, "A_sharpe": 0.3094, "A_sortino": 0.2941, "A_excess_sharpe": -1.1186, "A_return_pct": 0.7, "A_hit_rate": 51.85, "A_n": 54, "A_bh_sharpe": 1.428, "A_bh_return_pct": 3.97, "A_psr": 0.5563, "A_ic": -0.1196, "A_precision": 0.5366, "A_recall": 0.7586, "A_f1": 0.6286, "A_f2": 0.7006, "A_accuracy": 0.5185, "A_mcc": -0.0016, "A_tp": 22, "A_fp": 19, "A_tn": 6, "A_fn": 7, "B_sharpe": -5.1046, "B_sortino": -4.3538, "B_excess_sharpe": -10.0367, "B_return_pct": -28.08, "B_hit_rate": 40.74, "B_n": 54, "B_bh_sharpe": 4.9322, "B_bh_return_pct": 34.93, "B_psr": 0.0099, "B_ic": -0.5003, "B_precision": 0.5758, "B_recall": 0.5135, "B_f1": 0.5429, "B_f2": 0.5249, "B_accuracy": 0.4074, "B_mcc": -0.2954, "B_tp": 19, "B_fp": 14, "B_tn": 3, "B_fn": 18, "D_sharpe": 0.3094, "D_sortino": 0.2941, "D_excess_sharpe": -1.1186, "D_return_pct": 0.7, "D_hit_rate": 51.85, "D_n": 54, "D_bh_sharpe": 1.428, "D_bh_return_pct": 3.97, "D_psr": 0.5563, "D_ic": -0.1196, "D_precision": 0.5366, "D_recall": 0.7586, "D_f1": 0.6286, "D_f2": 0.7006, "D_accuracy": 0.5185, "D_mcc": -0.0016, "D_tp": 22, "D_fp": 19, "D_tn": 6, "D_fn": 7, "sharpe": 0.3094, "sortino": 0.2941, "return_pct": 0.7, "equity": 1006.9999999999999, "max_dd": 0.0, "win_rate": 51.85, "profit_factor": 0.0, "ic": -0.1196, "hit": 51.85, "psr": 0.5563, "bh_sharpe": 1.428, "bh_return_pct": 3.97, "excess_sharpe": -1.1186, "precision": 0.5366, "recall": 0.7586, "f1": 0.6286, "f2": 0.7006, "mcc": -0.0016, "accuracy": 0.5185, "tp": 22, "fp": 19, "tn": 6, "fn": 7}, {"fold": "fold_6", "regime": "COVID crash and V-recovery", "n": 75, "A_sharpe": 3.1326, "A_sortino": 2.8184, "A_excess_sharpe": -1.1668, "A_return_pct": 10.62, "A_hit_rate": 64.0, "A_n": 75, "A_bh_sharpe": 4.2994, "A_bh_return_pct": 14.68, "A_psr": 0.9459, "A_ic": -0.0699, "A_precision": 0.6765, "A_recall": 0.902, "A_f1": 0.7731, "A_f2": 0.8456, "A_accuracy": 0.64, "A_mcc": -0.0236, "A_tp": 46, "A_fp": 22, "A_tn": 2, "A_fn": 5, "B_sharpe": 8.2316, "B_sortino": 7.5677, "B_excess_sharpe": -6.1023, "B_return_pct": 71.43, "B_hit_rate": 76.0, "B_n": 75, "B_bh_sharpe": 14.3339, "B_bh_return_pct": 120.13, "B_psr": 1.0, "B_ic": 0.2692, "B_precision": 0.9091, "B_recall": 0.7937, "B_f1": 0.8475, "B_f2": 0.8143, "B_accuracy": 0.76, "B_mcc": 0.3125, "B_tp": 50, "B_fp": 5, "B_tn": 7, "B_fn": 13, "D_sharpe": 3.1326, "D_sortino": 2.8184, "D_excess_sharpe": -1.1668, "D_return_pct": 10.62, "D_hit_rate": 64.0, "D_n": 75, "D_bh_sharpe": 4.2994, "D_bh_return_pct": 14.68, "D_psr": 0.9459, "D_ic": -0.0699, "D_precision": 0.6765, "D_recall": 0.902, "D_f1": 0.7731, "D_f2": 0.8456, "D_accuracy": 0.64, "D_mcc": -0.0236, "D_tp": 46, "D_fp": 22, "D_tn": 2, "D_fn": 5, "sharpe": 3.1326, "sortino": 2.8184, "return_pct": 10.62, "equity": 1106.2, "max_dd": 0.0, "win_rate": 64.0, "profit_factor": 0.0, "ic": -0.0699, "hit": 64.0, "psr": 0.9459, "bh_sharpe": 4.2994, "bh_return_pct": 14.68, "excess_sharpe": -1.1668, "precision": 0.6765, "recall": 0.902, "f1": 0.7731, "f2": 0.8456, "mcc": -0.0236, "accuracy": 0.64, "tp": 46, "fp": 22, "tn": 2, "fn": 5}, {"fold": "fold_7", "regime": "Inflation bear, AI rally and 2025", "n": 114, "A_sharpe": 0.8743, "A_sortino": 0.9279, "A_excess_sharpe": -1.9707, "A_return_pct": 5.81, "A_hit_rate": 50.88, "A_n": 114, "A_bh_sharpe": 2.845, "A_bh_return_pct": 21.34, "A_psr": 0.7216, "A_ic": 0.0297, "A_precision": 0.5591, "A_recall": 0.7761, "A_f1": 0.65, "A_f2": 0.7202, "A_accuracy": 0.5088, "A_mcc": -0.1222, "A_tp": 52, "A_fp": 41, "A_tn": 6, "A_fn": 15