{"experiment_num": 90, "backbone": "lightgbm", "description": "LightGBM @ exp 10 seed=99 - 4th seed median lock", "config": {"seq_len": 60, "lr": 0.0003, "batch_size": 32, "epochs": 50, "weight_decay": 1e-05, "patience": 10, "warmup_epochs": 0, "head_dropout": 0.1, "huber_delta": 1.0, "grad_clip": 1.0, "seed": 99, "hidden_size": null, "num_layers": null, "max_depth": 4, "gbm_lr": 0.01, "n_estimators": 1000}, "composite": 0.0532, "test_pos_folds": 5, "val_pos_folds": 4, "val_loss": null, "elapsed_sec": 226.5, "timestamp": "2026-04-27T23:38:30", "sharpe": 0.5842, "val_sharpe": 0.2532, "ic": 0.0133, "hit": 47.84, "psr": 0.8885, "equity": 1569.9, "return_pct": 56.99, "bh_sharpe": 1.2194, "bh_return_pct": 187.05, "excess_sharpe": -0.6351, "B_sharpe": -0.0946, "B_excess_sharpe": -2.9228, "B_return_pct": -47.4, "D_sharpe": -0.3402, "D_excess_sharpe": -1.5596, "D_return_pct": -35.11, "precision": 0.5792, "recall": 0.4399, "f1": 0.5, "f2": 0.4621, "mcc": -0.0242, "accuracy": 0.4789, "val_precision": 0.509, "val_recall": 0.6489, "val_f1": 0.5705, "val_f2": 0.6151, "val_mcc": 0.0138, "val_accuracy": 0.5077, "per_window": [{"fold": "fold_1", "regime": "GFC peak crash (Lehman + Mar-2009 bottom)", "n": 66, "A_sharpe": 1.0877, "A_sortino": 1.2575, "A_excess_sharpe": 0.5155, "A_return_pct": 9.22, "A_hit_rate": 46.97, "A_n": 66, "A_bh_sharpe": 0.5721, "A_bh_return_pct": 3.85, "A_psr": 0.7114, "A_ic": 0.0194, "A_precision": 0.5, "A_recall": 0.4857, "A_f1": 0.4928, "A_f2": 0.4885, "A_accuracy": 0.4697, "A_mcc": -0.0626, "A_tp": 17, "A_fp": 17, "A_tn": 14, "A_fn": 18, "B_sharpe": 0.5802, "B_sortino": 0.6255, "B_excess_sharpe": -1.4668, "B_return_pct": 4.07, "B_hit_rate": 47.69, "B_n": 66, "B_bh_sharpe": 2.0469, "B_bh_return_pct": 39.28, "B_psr": 0.6161, "B_ic": 0.1904, "B_precision": 0.5833, "B_recall": 0.1944, "B_f1": 0.2917, "B_f2": 0.2244, "B_accuracy": 0.4848, "B_mcc": 0.0359, "B_tp": 7, "B_fp": 5, "B_tn": 25, "B_fn": 29, "D_sharpe": 0.245, "D_sortino": 0.2505, "D_excess_sharpe": -0.3271, "D_return_pct": 0.57, "D_hit_rate": 50.0, "D_n": 66, "D_bh_sharpe": 0.5721, "D_bh_return_pct": 3.85, "D_psr": 0.5495, "D_ic": 0.1359, "D_precision": 0.5833, "D_recall": 0.2, "D_f1": 0.2979, "D_f2": 0.2303, "D_accuracy": 0.5, "D_mcc": 0.0501, "D_tp": 7, "D_fp": 5, "D_tn": 26, "D_fn": 28, "sharpe": 1.0877, "sortino": 1.2575, "return_pct": 9.22, "equity": 1092.2, "max_dd": 0.0, "win_rate": 46.97, "profit_factor": 0.0, "ic": 0.0194, "hit": 46.97, "psr": 0.7114, "bh_sharpe": 0.5721, "bh_return_pct": 3.85, "excess_sharpe": 0.5155, "precision": 0.5, "recall": 0.4857, "f1": 0.4928, "f2": 0.4885, "mcc": -0.0626, "accuracy": 0.4697, "tp": 17, "fp": 17, "tn": 14, "fn": 18}, {"fold": "fold_2", "regime": "2011 US-downgrade + EU debt", "n": 87, "A_sharpe": 2.17, "A_sortino": 2.7155, "A_excess_sharpe": -2.852, "A_return_pct": 11.94, "A_hit_rate": 52.33, "A_n": 87, "A_bh_sharpe": 5.022, "A_bh_return_pct": 29.23, "A_psr": 0.9113, "A_ic": 0.1144, "A_precision": 0.6327, "A_recall": 0.5741, "A_f1": 0.6019, "A_f2": 0.5849, "A_accuracy": 0.5287, "A_mcc": 0.028, "A_tp": 31, "A_fp": 18, "A_tn": 15, "A_fn": 23, "B_sharpe": 4.3483, "B_sortino": 5.3283, "B_excess_sharpe": -6.7887, "B_return_pct": 60.28, "B_hit_rate": 56.32, "B_n": 87, "B_bh_sharpe": 11.1369, "B_bh_return_pct": 185.4, "B_psr": 0.9955, "B_ic": 0.2673, "B_precision": 0.8333, "B_recall": 0.6081, "B_f1": 0.7031, "B_f2": 0.6429, "B_accuracy": 0.5632, "B_mcc": -0.0619, "B_tp": 45, "B_fp": 9, "B_tn": 4, "B_fn": 29, "D_sharpe": 1.8038, "D_sortino": 2.1582, "D_excess_sharpe": -3.2182, "D_return_pct": 9.78, "D_hit_rate": 52.33, "D_n": 87, "D_bh_sharpe": 5.022, "D_bh_return_pct": 29.23, "D_psr": 0.866, "D_ic": 0.0873, "D_precision": 0.6111, "D_recall": 0.6111, "D_f1": 0.6111, "D_f2": 0.6111, "D_accuracy": 0.5172, "D_mcc": -0.0253, "D_tp": 33, "D_fp": 21, "D_tn": 12, "D_fn": 21, "sharpe": 2.17, "sortino": 2.7155, "return_pct": 11.94, "equity": 1119.3999999999999, "max_dd": 0.0, "win_rate": 52.33, "profit_factor": 0.0, "ic": 0.1144, "hit": 52.33, "psr": 0.9113, "bh_sharpe": 5.022, "bh_return_pct": 29.23, "excess_sharpe": -2.852, "precision": 0.6327, "recall": 0.5741, "f1": 0.6019, "f2": 0.5849, "mcc": 0.028, "accuracy": 0.5287, "tp": 31, "fp": 18, "tn": 15, "fn": 23}, {"fold": "fold_3", "regime": "Taper tantrum and 2014 H1", "n": 129, "A_sharpe": 2.234, "A_sortino": 2.5701, "A_excess_sharpe": 0.4662, "A_return_pct": 15.16, "A_hit_rate": 49.22, "A_n": 129, "A_bh_sharpe": 1.7678, "A_bh_return_pct": 11.76, "A_psr": 0.9435, "A_ic": 0.1154, "A_precision": 0.575, "A_recall": 0.5897, "A_f1": 0.5823, "A_f2": 0.5867, "A_accuracy": 0.4884, "A_mcc": -0.0775, "A_tp": 46, "A_fp": 34, "A_tn": 17, "A_fn": 32, "B_sharpe": 1.0965, "B_sortino": 1.0592, "B_excess_sharpe": -3.1508, "B_return_pct": 12.86, "B_hit_rate": 55.04, "B_n": 129, "B_bh_sharpe": 4.2474, "B_bh_return_pct": 64.1, "B_psr": 0.781, "B_ic": 0.035, "B_precision": 0.6304, "B_recall": 0.7073, "B_f1": 0.6667, "B_f2": 0.6905, "B_accuracy": 0.5504, "B_mcc": -0.0171, "B_tp": 58, "B_fp": 34, "B_tn": 13, "B_fn": 24, "D_sharpe": -0.1485, "D_sortino": -0.1361, "D_excess_sharpe": -1.9163, "D_return_pct": -1.39, "D_hit_rate": 51.56, "D_n": 129, "D_bh_sharpe": 1.7678, "D_bh_return_pct": 11.76, "D_psr": 0.4577, "D_ic": 0.1163, "D_precision": 0.587, "D_recall": 0.6923, "D_f1": 0.6353, "D_f2": 0.6683, "D_accuracy": 0.5194, "D_mcc": -0.0571, "D_tp": 54, "D_fp": 38, "D_tn": 13, "D_fn": 24, "sharpe": 2.234, "sortino": 2.5701, "return_pct": 15.16, "equity": 1151.6, "max_dd": 0.0, "win_rate": 49.22, "profit_factor": 0.0, "ic": 0.1154, "hit": 49.22, "psr": 0.9435, "bh_sharpe": 1.7678, "bh_return_pct": 11.76, "excess_sharpe": 0.4662, "precision": 0.575, "recall": 0.5897, "f1": 0.5823, "f2": 0.5867, "mcc": -0.0775, "accuracy": 0.4884, "tp": 46, "fp": 34, "tn": 17, "fn": 32}, {"fold": "fold_4", "regime": "China devaluation and oil crash", "n": 108, "A_sharpe": -1.0269, "A_sortino": -0.9589, "A_excess_sharpe": -0.3371, "A_return_pct": -9.41, "A_hit_rate": 48.6, "A_n": 108, "A_bh_sharpe": -0.6898, "A_bh_return_pct": -6.71, "A_psr": 0.2502, "A_ic": -0.0172, "A_precision": 0.4815, "A_recall": 0.4906, "A_f1": 0.486, "A_f2": 0.4887, "A_accuracy": 0.4907, "A_mcc": -0.0185, "A_tp": 26, "A_fp": 28, "A_tn": 27, "A_fn": 27, "B_sharpe": -1.9415, "B_sortino": -1.8214, "B_excess_sharpe": 0.016, "B_return_pct": -33.35, "B_hit_rate": 43.52, "B_n": 108, "B_bh_sharpe": -1.9575, "B_bh_return_pct": -33.56, "B_psr": 0.0987, "B_ic": -0.0603, "B_precision": 0.4074, "B_recall": 0.4314, "B_f1": 0.419, "B_f2": 0.4264, "B_accuracy": 0.4352, "B_mcc": -0.1298, "B_tp": 22, "B_fp": 32, "B_tn": 25, "B_fn": 29, "D_sharpe": -2.1875, "D_sortino": -1.9801, "D_excess_sharpe": -1.4978, "D_return_pct": -18.05, "D_hit_rate": 43.93, "D_n": 108, "D_bh_sharpe": -0.6898, "D_bh_return_pct": -6.71, "D_psr": 0.0714, "D_ic": -0.0488, "D_precision": 0.4259, "D_recall": 0.434, "D_f1": 0.4299, "D_f2": 0.4323, "D_accuracy": 0.4352, "D_mcc": -0.1297, "D_tp": 23, "D_fp": 31, "D_tn": 24, "D_fn": 30, "sharpe": -1.0269, "sortino": -0.9589, "return_pct": -9.41, "equity": 905.9000000000001, "max_dd": 0.0, "win_rate": 48.6, "profit_factor": 0.0, "ic": -0.0172, "hit": 48.6, "psr": 0.2502, "bh_sharpe": -0.6898, "bh_return_pct": -6.71, "excess_sharpe": -0.3371, "precision": 0.4815, "recall": 0.4906, "f1": 0.486, "f2": 0.4887, "mcc": -0.0185, "accuracy": 0.4907, "tp": 26, "fp": 28, "tn": 27, "fn": 27}, {"fold": "fold_5", "regime": "2018 Vol-mageddon + Q4 sell-off", "n": 128, "A_sharpe": -0.0401, "A_sortino": -0.0447, "A_excess_sharpe": -1.1912, "A_return_pct": -1.88, "A_hit_rate": 46.88, "A_n": 128, "A_bh_sharpe": 1.1511, "A_bh_return_pct": 13.19, "A_psr": 0.4887, "A_ic": -0.0242, "A_precision": 0.5926, "A_recall": 0.4103, "A_f1": 0.4848, "A_f2": 0.4372, "A_accuracy": 0.4688, "A_mcc": -0.0294, "A_tp": 32, "A_fp": 22, "A_tn": 28, "A_fn": 46, "B_sharpe": -3.58, "B_sortino": -3.4868, "B_excess_sharpe": -6.3918, "B_return_pct": -58.65, "B_hit_rate": 35.43, "B_n": 128, "B_bh_sharpe": 2.8119, "B_bh_return_pct": 82.25, "B_psr": 0.0059, "B_ic": -0.1205, "B_precision": 0.5319, "B_recall": 0.2941, "B_f1": 0.3788, "B_f2": 0.323, "B_accuracy": 0.3594, "B_mcc": -0.2131, "B_tp": 25, "B_fp": 22, "B_tn": 21, "B_fn": 60, "D_sharpe": -1.1121, "D_sortino": -1.2189, "D_excess_sharpe": -2.2632, "D_return_pct": -13.72, "D_hit_rate": 42.97, "D_n": 128, "D_bh_sharpe": 1.1511, "D_bh_return_pct": 13.19, "D_psr": 0.2206, "D_ic": -0.0523, "D_precision": 0.5532, "D_recall": 0.3333, "D_f1": 0.416, "D_f2": 0.3621, "D_accuracy": 0.4297, "D_mcc": -0.0877, "D_tp": 26, "D_fp": 21, "D_tn": 29, "D_fn": 52, "sharpe": -0.0401, "sortino": -0.0447, "return_pct": -1.88, "equity": 981.1999999999999, "max_dd": 0.0, "win_rate": 46.88, "profit_factor": 0.0, "ic": -0.0242, "hit": 46.88, "psr": 0.4887, "bh_sharpe": 1.1511, "bh_return_pct": 13.19, "excess_sharpe": -1.1912, "precision": 0.5926, "recall": 0.4103, "f1": 0.4848, "f2": 0.4372, "mcc": -0.0294, "accuracy": 0.4688, "tp": 32, "fp": 22, "tn": 28, "fn": 46}, {"fold": "fold_6", "regime": "COVID crash and V-recovery", "n": 173, "A_sharpe": 1.1305, "A_sortino": 1.3916, "A_excess_sharpe": -1.1955, "A_return_pct": 18.29, "A_hit_rate": 47.98, "A_n": 173, "A_bh_sharpe": 2.3261, "A_bh_return_pct": 43.81, "A_psr": 0.8315, "A_ic": 0.0263, "A_precision": 0.6353, "A_recall": 0.4779, "A_f1": 0.5455, "A_f2": 0.5028, "A_accuracy": 0.4798, "A_mcc": -0.0369, "A_tp": 54, "A_fp": 31, "A_tn": 29, "A_fn": 59, "B_sharpe": 0.2199, "B_sortino": 0.2484, "B_excess_sharpe": -5.5261, "B_return_pct": -1.05, "B_hit_rate": 46.51, "B_n": 173, "B_bh_sharpe": 5.746, "B_bh_return_pct": 499.04, "B_psr": 0.5723, "B_ic": 0.0922, "B_precision": 0.6939, "B_recall": 0.3063, "B_f1": 0.425, "B_f2": 0.3448, "B_accuracy": 0.4682, "B_mcc": 0.0685, "B_tp": 34, "B_fp": 15, "B_tn": 47, "B_fn": 77, "D_sharpe": -0.23, "D_sortino": -0.2601, "D_excess_sharpe": -2.556, "D_return_pct": -5.68, "D_hit_rate": 44.51, "D_n": 173, "D_bh_sharpe": 2.3261, "D_bh_return_pct": 43.81, "D_psr": 0.4249, "D_ic": -0.0068, "D_precision": 0.6735, "D_recall": 0.292, "D_f1": 0.4074, "D_f2": 0.3293, "D_accuracy": 0.4451, "D_mcc": 0.0268, "D_tp": 33, "D_fp": 16, "D_tn": 44, "D_fn": 80, "sharpe": 1.1305, "sortino": 1.3916, "return_pct": 18.29, "equity": 1182.9, "max_dd": 0.0, "win_rate": 47.98, "profit_factor": 0.0, "ic": 0.0263, "hit": 47.98, "psr": 0.8315, "bh_sharpe": 2.3261, "bh_return_pct": 43.81, "excess_sharpe": -1.1955, "precision": 0.6353, "recall": 0.4779, "f1": 0.5455, "f2": 0.5028, "mcc": -0.0369, "accuracy": 0.4798, "tp": 54, "fp": 31, "tn": 29, "fn": 59}, {"fold": "fold_7", "regime": "Inflation bear, AI rally and 2025", "n": 376, "A_sharpe": 0.2864, "A_sortino": 0.3304, "A_excess_sharpe": -0.5169, "A_return_pct": 6.05, "A_hit_rate": 46.54, "A_n": 376, "A_bh_sharpe": 0.8033, "A_bh_return_pct": 26.02, "A_psr": 0.6381, "A_ic": 0.0113, "A_precision": 0.5806, "A_recall": 0.3258, "A_f1": 0.4174, "A_f2": 0.3571, "A_accuracy": 0.4654, "A_mcc": -0.0101, "A_tp": 72, "A_fp": 52, "A_tn": 103, "A_fn": 149, "B_sharpe": 0.2652, "B_sortino": 0.3066, "B_excess_sharpe": -1.6665, "B_return_pct": 2.46, "B_hit_rate": 45.07, "B_n": 376, "B_bh_sharpe": 1.9317, "B_bh_return_pct": 222.05, "B_psr": 0.6274, "B_ic": 0.003, "B_precision": 0.6667, "B_recall": 0.185, "B_f1": 0.2897, "B_f2": 0.2163, "B_accuracy": 0.4521, "B_mcc": 0.0577, "B_tp": 42, "B_fp": 21, "B_tn": 128, "B_fn": 185, "D_sharpe": -0.2249, "D_sortino": -0.2711, "D_excess_sharpe": -1.0281, "D_return_pct": -10.63, "D_hit_rate": 43.09, "D_n": 376, "D_bh_sharpe": 0.8033, "D_bh_return_pct": 26.02, "D_psr": 0.3931, "D_ic": -0.0119, "D_precision": 0.5556, "D_recall": 0.1584, "D_f1": 0.2465, "D_f2": 0.1848, "D_accuracy": 0.4309, "D_mcc": -0.0294, "D_tp": 35, "D_fp": 28, "D_tn": 127, "D_fn": 186, "sharpe": 0.2864, "sortino": 0.3304, "return_pct": 6.05, "equity": 1060.5, "max_dd": 0.0, "win_rate": 46.54, "profit_factor": 0.0, "ic": 0.0113, "hit": 46.54, "psr": 0.6381, "bh_sharpe": 0.8033, "bh_return_pct": 26.02, "excess_sharpe": -0.5169, "precision": 0.5806, "recall": 0.3258, "f1": 0.4174, "f2": 0.3571, "mcc": -0.0101, "accuracy": 0.4654, "tp": 72, "fp": 52, "tn": 103, "fn": 149}], "per_window_val": [{"fold": "fold_1", "regime": "GFC peak crash (Lehman + Mar-2009 bottom)", "n": 65, "A_sharpe": 1.4205, "A_sortino": 1.5497, "A_excess_sharpe": 3.6461, "A_return_pct": 11.51, "A_hit_rate": 52.38, "A_n": 65, "A_bh_sharpe": -2.2257, "A_bh_return_pct": -18.74, "A_psr": 0.7681, "A_ic": 0.0755, "A_precision": 0.4821, "A_recall": 0.931, "A_f1": 0.6353, "A_f2": 0.7849, "A_accuracy": 0.5231, "A_mcc": 0.1806, "A_tp": 27, "A_fp": 29, "A_tn": 7, "A_fn": 2, "B_sharpe": -5.5303, "B_sortino": -4.6741, "B_excess_sharpe": 1.592, "B_return_pct": -65.66, "B_hit_rate": 36.92, "B_n": 65, "B_bh_sharpe": -7.1223, "B_bh_return_pct": -73.11, "B_psr": 0.0017, "B_ic": 0.0247, "B_precision": 0.3594, "B_recall": 1.0, "B_f1": 0.5287, "B_f2": 0.7372, "B_accuracy": 0.3692, "B_mcc": 0.0925, "B_tp": 23, "B_fp": 41, "B_tn": 1, "B_fn": 0, "D_sharpe": -1.9865, "D_sortino": -1.6684, "D_excess_sharpe": 0.2392, "D_return_pct": -17.07, "D_hit_rate": 47.62, "D_n": 65, "D_bh_sharpe": -2.2257, "D_bh_return_pct": -18.74, "D_psr": 0.1434, "D_ic": 0.37, "D_precision": 0.4531, "D_recall": 1.0, "D_f1": 0.6237, "D_f2": 0.8056, "D_accuracy": 0.4615, "D_mcc": 0.1122, "D_tp": 29, "D_fp": 35, "D_tn": 1, "D_fn": 0, "sharpe": 1.4205, "sortino": 1.5497, "return_pct": 11.51, "equity": 1115.1, "max_dd": 0.0, "win_rate": 52.38, "profit_factor": 0.0, "ic": 0.0755, "hit": 52.38, "psr": 0.7681, "bh_sharpe": -2.2257, "bh_return_pct": -18.74, "excess_sharpe": 3.6461, "precision": 0.4821, "recall": 0.931, "f1": 0.6353, "f2": 0.7849, "mcc": 0.1806, "accuracy": 0.5231, "tp": 27, "fp": 29, "tn": 7, "fn": 2}, {"fold": "fold_2", "regime": "2011 US-downgrade + EU debt", "n": 47, "A_sharpe": -0.3271, "A_sortino": -0.3105, "A_excess_sharpe": -0.133, "A_return_pct": -3.2, "A_hit_rate": 48.94, "A_n": 47, "A_bh_sharpe": -0.1941, "A_bh_return_pct": -2.36, "A_psr": 0.4442, "A_ic": 0.0598, "A_precision": 0.5278, "A_recall": 0.7308, "A_f1": 0.6129, "A_f2": 0.6786, "A_accuracy": 0.4894, "A_mcc": -0.0925, "A_tp": 19, "A_fp": 17, "A_tn": 4, "A_fn": 7, "B_sharpe": 0.7744, "B_sortino": 0.6755, "B_excess_sharpe": 2.3867, "B_return_pct": 5.62, "B_hit_rate": 57.45, "B_n": 47, "B_bh_sharpe": -1.6123, "B_bh_return_pct": -24.3, "B_psr": 0.6276, "B_ic": 0.1992, "B_precision": 0.5122, "B_recall": 1.0, "B_f1": 0.6774, "B_f2": 0.84, "B_accuracy": 0.5745, "B_mcc": 0.3438, "B_tp": 21, "B_fp": 20, "B_tn": 6, "B_fn": 0, "D_sharpe": -0.0371, "D_sortino": -0.0325, "D_excess_sharpe": 0.157, "D_return_pct": -1.37, "D_hit_rate": 55.32, "D_n": 47, "D_bh_sharpe": -0.1941, "D_bh_return_pct": -2.36, "D_psr": 0.4937, "D_ic": 0.0193, "D_precision": 0.561, "D_recall": 0.8846, "D_f1": 0.6866, "D_f2": 0.7931, "D_accuracy": 0.5532, "D_mcc": 0.0409, "D_tp": 23, "D_fp": 18, "D_tn": 3, "D_fn": 3, "sharpe": -0.3271, "sortino": -0.3105, "return_pct": -3.2, "equity": 968.0, "max_dd": 0.0, "win_rate": 48.94, "profit_factor": 0.0, "ic": 0.0598, "hit": 48.94, "psr": 0.4442, "bh_sharpe": -0.1941, "bh_return_pct": -2.36, "excess_sharpe": -0.133, "precision": 0.5278, "recall": 0.7308, "f1": 0.6129, "f2": 0.6786, "mcc": -0.0925, "accuracy": 0.4894, "tp": 19, "fp": 17, "tn": 4, "fn": 7}, {"fold": "fold_3", "regime": "Taper tantrum and 2014 H1", "n": 5, "A_sharpe": 1.3194, "A_sortino": 1.268, "A_excess_sharpe": 2.6388, "A_return_pct": 0.2, "A_hit_rate": 60.0, "A_n": 5, "A_bh_sharpe": -1.3194, "A_bh_return_pct": -0.21, "A_psr": 0.5663, "A_ic": 0.6, "A_precision": 0.0, "A_recall": 0.0, "A_f1": 0.0, "A_f2": 0.0, "A_accuracy": 0.6, "A_mcc": 0.0, "A_tp": 0, "A_fp": 0, "A_tn": 3, "A_fn": 2, "B_sharpe": 25.8705, "B_sortino": 0.0, "B_excess_sharpe": 51.7411, "B_return_pct": 3.95, "B_hit_rate": 100.0, "B_n": 5, "B_bh_sharpe": -25.8705, "B_bh_return_pct": -3.84, "B_psr": 1.0, "B_ic": -0.1, "B_precision": 0.0, "B_recall": 0.0, "B_f1": 0.0, "B_f2": 0.0, "B_accuracy": 1.0, "B_mcc": 0.0, "B_tp": 0, "B_fp": 0, "B_tn": 5, "B_fn": 0, "D_sharpe": 1.3194, "D_sortino": 1.268, "D_excess_sharpe": 2.6388, "D_return_pct": 0.2, "D_hit_rate": 60.0, "D_n": 5, "D_bh_sharpe": -1.3194, "D_bh_return_pct": -0.21, "D_psr": 0.5663, "D_ic": 0.1, "D_precision": 0.0, "D_recall": 0.0, "D_f1": 0.0, "D_f2": 0.0, "D_accuracy": 0.6, "D_mcc": 0.0, "D_tp": 0, "D_fp": 0, "D_tn": 3, "D_fn": 2, "sharpe": 1.3194, "sortino": 1.268, "return_pct": 0.2, "equity": 1002.0, "max_dd": 0.0, "win_rate": 60.0, "profit_factor": 0.0, "ic": 0.6, "hit": 60.0, "psr": 0.5663, "bh_sharpe": -1.3194, "bh_return_pct": -0.21, "excess_sharpe": 2.6388, "precision": 0.0, "recall": 0.0, "f1": 0.0, "f2": 0.0, "mcc": 0.0, "accuracy": 0.6, "tp": 0, "fp": 0, "tn": 3, "fn": 2}, {"fold": "fold_4", "regime": "China devaluation and oil crash", "n": 47, "A_sharpe": -1.2273, "A_sortino": -1.2411, "A_excess_sharpe": 0.5964, "A_return_pct": -6.13, "A_hit_rate": 40.43, "A_n": 47, "A_bh_sharpe": -1.8238, "A_bh_return_pct": -8.68, "A_psr": 0.2997, "A_ic": -0.0443, "A_precision": 0.4103, "A_recall": 0.7619, "A_f1": 0.5333, "A_f2": 0.6504, "A_accuracy": 0.4043, "A_mcc": -0.1623, "A_tp": 16, "A_fp": 23, "A_tn": 3, "A_fn": 5, "B_sharpe": -0.8513, "B_sortino": -0.7249, "B_excess_sharpe": 1.3687, "B_return_pct": -11.89, "B_hit_rate": 48.94, "B_n": 47, "B_bh_sharpe": -2.22, "B_bh_return_pct": -23.98, "B_psr": 0.3529, "B_ic": 0.5039, "B_precision": 0.4651, "B_recall": 0.9524, "B_f1": 0.625, "B_f2": 0.7874, "B_accuracy": 0.4894, "B_mcc": 0.1207, "B_tp": 20, "B_fp": 23, "B_tn": 3, "B_fn": 1, "D_sharpe": -0.0899, "D_sortino": -0.0889, "D_excess_sharpe": 1.7339, "D_return_pct": -1.0, "D_hit_rate": 48.94, "D_n": 47, "D_bh_sharpe": -1.8238, "D_bh_return_pct": -8.68, "D_psr": 0.4847, "D_ic": 0.1233, "D_precision": 0.4651, "D_recall": 0.9524, "D_f1": 0.625, "D_f2": 0.7874, "D_accuracy": 0.4894, "D_mcc": 0.1207, "D_tp": 20, "D_fp": 23, "D_tn": 3, "D_fn": 1, "sharpe": -1.2273, "sortino": -1.2411, "return_pct": -6.13, "equity": 938.6999999999999, "max_dd": 0.0, "win_rate": 40.43, "profit_factor": 0.0, "ic": -0.0443, "hit": 40.43, "psr": 0.2997, "bh_sharpe": -1.8238, "bh_return_pct": -8.68, "excess_sharpe": 0.5964, "precision": 0.4103, "recall": 0.7619, "f1": 0.5333, "f2": 0.6504, "mcc": -0.1623, "accuracy": 0.4043, "tp": 16, "fp": 23, "tn": 3, "fn": 5}, {"fold": "fold_5", "regime": "2018 Vol-mageddon + Q4 sell-off", "n": 5, "A_sharpe": -10.1368, "A_sortino": -6.9937, "A_excess_sharpe": 0.0, "A_return_pct": -3.15, "A_hit_rate": 40.0, "A_n": 5, "A_bh_sharpe": -10.1368, "A_bh_return_pct": -3.15, "A_psr": 0.0985, "A_ic": -0.5, "A_precision": 0.4, "A_recall": 1.0, "A_f1": 0.5714, "A_f2": 0.7692, "A_accuracy": 0.4, "A_mcc": 0.0, "A_tp": 2, "A_fp": 3, "A_tn": 0, "A_fn": 0, "B_sharpe": 5.6858, "B_sortino": 6.0578, "B_excess_sharpe": 0.0, "B_return_pct": 4.22, "B_hit_rate": 60.0, "B_n": 5, "B_bh_sharpe": 5.6858, "B_bh_return_pct": 4.22, "B_psr": 0.753, "B_ic": 0.6, "B_precision": 0.6, "B_recall": 1.0, "B_f1": 0.75, "B_f2": 0.8824, "B_accuracy": 0.6, "B_mcc": 0.0, "B_tp": 3, "B_fp": 2, "B_tn": 0, "B_fn": 0, "D_sharpe": -10.1368, "D_sortino": -6.9937, "D_excess_sharpe": 0.0, "D_return_pct": -3.15, "D_hit_rate": 40.0, "D_n": 5, "D_bh_sharpe": -10.1368, "D_bh_return_pct": -3.15, "D_psr": 0.0985, "D_ic": 0.2, "D_precision": 0.4, "D_recall": 1.0, "D_f1": 0.5714, "D_f2": 0.7692, "D_accuracy": 0.4, "D_mcc": 0.0, "D_tp": 2, "D_fp": 3, "D_tn": 0, "D_fn": 0, "sharpe": -10.1368, "sortino": -6.9937, "return_pct": -3.15, "equity": 968.5, "max_dd": 0.0, "win_rate": 40.0, "profit_factor": 0.0, "ic": -0.5, "hit": 40.0, "psr": 0.0985, "bh_sharpe": -10.1368, "bh_return_pct": -3.15, "excess_sharpe": 0.0, "precision": 0.4, "recall": 1.0, "f1": 0.5714, "f2": 0.7692, "mcc": 0.0, "accuracy": 0.4, "tp": 2, "fp": 3, "tn": 0, "fn": 0}, {"fold": "fold_6", "regime": "COVID crash and V-recovery", "n": 26, "A_sharpe": 3.2974, "A_sortino": 3.3679, "A_excess_sharpe": 0.0123, "A_return_pct": 4.84, "A_hit_rate": 57.69, "A_n": 26, "A_bh_sharpe": 3.2852, "A_bh_return_pct": 4.82, "A_psr": 0.8435, "A_ic": 0.1658, "A_precision": 0.6667, "A_recall": 0.625, "A_f1": 0.6452, "A_f2": 0.6329, "A_accuracy": 0.5769, "A_mcc": 0.1231, "A_tp": 10, "A_fp": 5, "A_tn": 5, "A_fn": 6, "B_sharpe": 5.824, "B_sortino": 4.8979, "B_excess_sharpe": -7.1552, "B_return_pct": 19.22, "B_hit_rate": 73.08, "B_n": 26, "B_bh_sharpe": 12.9792, "B_bh_return_pct": 38.76, "B_psr": 0.9531, "B_ic": 0.4291, "B_precision": 1.0, "B_recall": 0.6667, "B_f1": 0.8, "B_f2": 0.7143, "B_accuracy": 0.7308, "B_mcc": 0.527, "B_tp": 14, "B_fp": 0, "B_tn": 5, "B_fn": 7, "D_sharpe": 6.7463, "D_sortino": 11.5037, "D_excess_sharpe": 3.4611, "D_return_pct": 9.63, "D_hit_rate": 53.85, "D_n": 26, "D_bh_sharpe": 3.2852, "D_bh_return_pct": 4.82, "D_psr": 0.991, "D_ic": 0.3402, "D_precision": 0.6429, "D_recall": 0.5625, "D_f1": 0.6, "D_f2": 0.5769, "D_accuracy": 0.5385, "D_mcc": 0.061, "D_tp": 9, "D_fp": 5, "D_tn": 5, "D_fn": 7, "sharpe": 3.2974, "sortino": 3.3679, "return_pct": 4.84, "equity": 1048.4, "max_dd": 0.0, "win_rate": 57.69, "profit_factor": 0.0, "ic": 0.1658, "hit": 57.69, "psr": 0.8435, "bh_sharpe": 3.2852, "bh_return_pct": 4.82, "excess_sharpe": 0.0123, "precision": 0.6667, "recall": 0.625, "f1": 0.6452, "f2": 0.6329, "mcc": 0.1231, "accuracy": 0.5769, "tp": 10, "fp": 5, "tn": 5, "fn": 6}, {"fold": "fold_7", "regime": "Inflation bear, AI rally and 2025", "n": 65, "A_sharpe": 0.1424, "A_sortino": 0.1299, "A_excess_sharpe": -1.9365, "A_return_pct": 0.26, "A_hit_rate": 55.38, "A_n": 65, "A_bh_sharpe": 2.0789, "A_bh_return_pct": 8.17, "A_psr": 0.5286, "A_ic": 0.2898, "A_precision": 0.6875, "A_recall": 0.3143, "A_f1": 0.4314, "A_f2": 0.3526, "A_accuracy": 0.5538, "A_mcc": 0.1708, "A_tp": 11, "A_fp": 5, "A_tn": 25, "A_fn": 24, "B_sharpe": -3.8709, "B_sortino": -3.7134, "B_excess_sharpe": -9.1023, "B_return_pct": -25.82, "B_hit_rate": 35.38, "B_n": 65, "B_bh_sharpe": 5.2314, "B_bh_return_pct": 44.53, "B_psr": 0.0275, "B_ic": 0.181, "B_precision": 1.0, "B_recall": 0.0455, "B_f1": 0.087,