{"experiment_num": 32, "backbone": "lstm", "description": "LSTM @ exp 8 baseline seq=20 (up from 10) - Lim-Zohren-Roberts 2019 JFDS min effective momentum window; Fischer-Krauss 2018 LSTM seq=240 prior", "config": {"seq_len": 20, "lr": 0.001, "batch_size": 16, "epochs": 100, "weight_decay": 0.0007, "patience": 15, "warmup_epochs": 0, "head_dropout": 0.1, "huber_delta": 1.0, "grad_clip": 1.0, "seed": 0, "hidden_size": null, "num_layers": null, "max_depth": null, "gbm_lr": null, "n_estimators": null}, "composite": 0.1602, "test_pos_folds": 6, "val_pos_folds": 5, "val_loss": -2.8715511279264154, "elapsed_sec": 53.9, "timestamp": "2026-04-27T18:29:17", "sharpe": 0.3166, "val_sharpe": 0.2602, "ic": 0.0144, "hit": 52.73, "psr": 0.7667, "equity": 1294.7, "return_pct": 29.47, "bh_sharpe": 0.8422, "bh_return_pct": 169.94, "excess_sharpe": -0.5256, "B_sharpe": -0.0722, "B_excess_sharpe": -2.2965, "B_return_pct": -59.78, "D_sharpe": 0.3166, "D_excess_sharpe": -0.5256, "D_return_pct": 29.47, "per_window": [{"fold": "fold_1", "regime": "GFC peak crash (Lehman + Mar-2009 bottom)", "n": 105, "A_sharpe": 0.9047, "A_sortino": 0.9471, "A_excess_sharpe": 1.1557, "A_return_pct": 13.43, "A_hit_rate": 49.52, "A_n": 105, "A_bh_sharpe": -0.251, "A_bh_return_pct": -8.39, "A_psr": 0.7189, "A_ic": 0.1438, "B_sharpe": 2.9817, "B_sortino": 3.6405, "B_excess_sharpe": 3.3532, "B_return_pct": 146.33, "B_hit_rate": 54.81, "B_n": 105, "B_bh_sharpe": -0.3715, "B_bh_return_pct": -25.13, "B_psr": 0.9774, "B_ic": 0.2039, "D_sharpe": 0.9047, "D_sortino": 0.9471, "D_excess_sharpe": 1.1557, "D_return_pct": 13.43, "D_hit_rate": 49.52, "D_n": 105, "D_bh_sharpe": -0.251, "D_bh_return_pct": -8.39, "D_psr": 0.7189, "D_ic": 0.1438, "sharpe": 0.9047, "sortino": 0.9471, "return_pct": 13.43, "equity": 1134.3000000000002, "max_dd": 0.0, "win_rate": 49.52, "profit_factor": 0.0, "ic": 0.1438, "hit": 49.52, "psr": 0.7189, "bh_sharpe": -0.251, "bh_return_pct": -8.39, "excess_sharpe": 1.1557, "precision": 0.4824, "recall": 0.82, "f1": 0.6074, "f2": 0.7193, "accuracy": 0.4952, "mcc": 0.0254, "tp": 41, "fp": 44, "tn": 11, "fn": 9, "A_precision": 0.4824, "A_recall": 0.82, "A_f1": 0.6074, "A_f2": 0.7193, "A_accuracy": 0.4952, "A_mcc": 0.0254, "A_tp": 41, "A_fp": 44, "A_tn": 11, "A_fn": 9}, {"fold": "fold_2", "regime": "2011 US-downgrade + EU debt", "n": 126, "A_sharpe": 2.2105, "A_sortino": 2.3375, "A_excess_sharpe": -0.0888, "A_return_pct": 23.68, "A_hit_rate": 57.6, "A_n": 126, "A_bh_sharpe": 2.2992, "A_bh_return_pct": 24.77, "A_psr": 0.9433, "A_ic": 0.0692, "B_sharpe": 3.0005, "B_sortino": 3.7816, "B_excess_sharpe": -3.3492, "B_return_pct": 82.16, "B_hit_rate": 51.59, "B_n": 126, "B_bh_sharpe": 6.3497, "B_bh_return_pct": 247.81, "B_psr": 0.986, "B_ic": 0.345, "D_sharpe": 2.2105, "D_sortino": 2.3375, "D_excess_sharpe": -0.0888, "D_return_pct": 23.68, "D_hit_rate": 57.6, "D_n": 126, "D_bh_sharpe": 2.2992, "D_bh_return_pct": 24.77, "D_psr": 0.9433, "D_ic": 0.0692, "sharpe": 2.2105, "sortino": 2.3375, "return_pct": 23.68, "equity": 1236.8000000000002, "max_dd": 0.0, "win_rate": 57.6, "profit_factor": 0.0, "ic": 0.0692, "hit": 57.6, "psr": 0.9433, "bh_sharpe": 2.2992, "bh_return_pct": 24.77, "excess_sharpe": -0.0888, "precision": 0.5872, "recall": 0.8767, "f1": 0.7033, "f2": 0.798, "accuracy": 0.5714, "mcc": 0.04, "tp": 64, "fp": 45, "tn": 8, "fn": 9, "A_precision": 0.5872, "A_recall": 0.8767, "A_f1": 0.7033, "A_f2": 0.798, "A_accuracy": 0.5714, "A_mcc": 0.04, "A_tp": 64, "A_fp": 45, "A_tn": 8, "A_fn": 9}, {"fold": "fold_3", "regime": "Taper tantrum and 2014 H1", "n": 168, "A_sharpe": 1.4758, "A_sortino": 1.337, "A_excess_sharpe": -0.2292, "A_return_pct": 12.71, "A_hit_rate": 56.89, "A_n": 168, "A_bh_sharpe": 1.705, "A_bh_return_pct": 14.9, "A_psr": 0.877, "A_ic": 0.1704, "B_sharpe": -0.1463, "B_sortino": -0.1443, "B_excess_sharpe": -4.5551, "B_return_pct": -4.74, "B_hit_rate": 48.81, "B_n": 168, "B_bh_sharpe": 4.4088, "B_bh_return_pct": 105.48, "B_psr": 0.4526, "B_ic": 0.0329, "D_sharpe": 1.4758, "D_sortino": 1.337, "D_excess_sharpe": -0.2292, "D_return_pct": 12.71, "D_hit_rate": 56.89, "D_n": 168, "D_bh_sharpe": 1.705, "D_bh_return_pct": 14.9, "D_psr": 0.877, "D_ic": 0.1704, "sharpe": 1.4758, "sortino": 1.337, "return_pct": 12.71, "equity": 1127.1, "max_dd": 0.0, "win_rate": 56.89, "profit_factor": 0.0, "ic": 0.1704, "hit": 56.89, "psr": 0.877, "bh_sharpe": 1.705, "bh_return_pct": 14.9, "excess_sharpe": -0.2292, "precision": 0.5844, "recall": 0.9091, "f1": 0.7115, "f2": 0.8182, "accuracy": 0.5655, "mcc": -0.0328, "tp": 90, "fp": 64, "tn": 5, "fn": 9, "A_precision": 0.5844, "A_recall": 0.9091, "A_f1": 0.7115, "A_f2": 0.8182, "A_accuracy": 0.5655, "A_mcc": -0.0328, "A_tp": 90, "A_fp": 64, "A_tn": 5, "A_fn": 9}, {"fold": "fold_4", "regime": "China devaluation and oil crash", "n": 147, "A_sharpe": 0.7505, "A_sortino": 0.685, "A_excess_sharpe": 0.1598, "A_return_pct": 7.68, "A_hit_rate": 56.16, "A_n": 147, "A_bh_sharpe": 0.5907, "A_bh_return_pct": 5.75, "A_psr": 0.714, "A_ic": 0.0981, "B_sharpe": 2.69, "B_sortino": 3.1452, "B_excess_sharpe": 1.9844, "B_return_pct": 84.94, "B_hit_rate": 53.06, "B_n": 147, "B_bh_sharpe": 0.7057, "B_bh_return_pct": 13.06, "B_psr": 0.9818, "B_ic": 0.1674, "D_sharpe": 0.7505, "D_sortino": 0.685, "D_excess_sharpe": 0.1598, "D_return_pct": 7.68, "D_hit_rate": 56.16, "D_n": 147, "D_bh_sharpe": 0.5907, "D_bh_return_pct": 5.75, "D_psr": 0.714, "D_ic": 0.0981, "sharpe": 0.7505, "sortino": 0.685, "return_pct": 7.68, "equity": 1076.8, "max_dd": 0.0, "win_rate": 56.16, "profit_factor": 0.0, "ic": 0.0981, "hit": 56.16, "psr": 0.714, "bh_sharpe": 0.5907, "bh_return_pct": 5.75, "excess_sharpe": 0.1598, "precision": 0.5526, "recall": 0.8182, "f1": 0.6597, "f2": 0.7464, "accuracy": 0.5578, "mcc": 0.1073, "tp": 63, "fp": 51, "tn": 19, "fn": 14, "A_precision": 0.5526, "A_recall": 0.8182, "A_f1": 0.6597, "A_f2": 0.7464, "A_accuracy": 0.5578, "A_mcc": 0.1073, "A_tp": 63, "A_fp": 51, "A_tn": 19, "A_fn": 14}, {"fold": "fold_5", "regime": "2018 Vol-mageddon + Q4 sell-off", "n": 167, "A_sharpe": 0.0149, "A_sortino": 0.0142, "A_excess_sharpe": -0.1952, "A_return_pct": -1.6, "A_hit_rate": 53.29, "A_n": 167, "A_bh_sharpe": 0.2101, "A_bh_return_pct": 1.45, "A_psr": 0.5048, "A_ic": 0.0006, "B_sharpe": -0.3038, "B_sortino": -0.3303, "B_excess_sharpe": -0.7041, "B_return_pct": -15.49, "B_hit_rate": 42.77, "B_n": 167, "B_bh_sharpe": 0.4003, "B_bh_return_pct": 5.17, "B_psr": 0.4027, "B_ic": 0.0058, "D_sharpe": 0.0149, "D_sortino": 0.0142, "D_excess_sharpe": -0.1952, "D_return_pct": -1.6, "D_hit_rate": 53.29, "D_n": 167, "D_bh_sharpe": 0.2101, "D_bh_return_pct": 1.45, "D_psr": 0.5048, "D_ic": 0.0006, "sharpe": 0.0149, "sortino": 0.0142, "return_pct": -1.6, "equity": 984.0, "max_dd": 0.0, "win_rate": 53.29, "profit_factor": 0.0, "ic": 0.0006, "hit": 53.29, "psr": 0.5048, "bh_sharpe": 0.2101, "bh_return_pct": 1.45, "excess_sharpe": -0.1952, "precision": 0.575, "recall": 0.7188, "f1": 0.6389, "f2": 0.6845, "accuracy": 0.5329, "mcc": 0.0005, "tp": 69, "fp": 51, "tn": 20, "fn": 27, "A_precision": 0.575, "A_recall": 0.7188, "A_f1": 0.6389, "A_f2": 0.6845, "A_accuracy": 0.5329, "A_mcc": 0.0005, "A_tp": 69, "A_fp": 51, "A_tn": 20, "A_fn": 27}, {"fold": "fold_6", "regime": "COVID crash and V-recovery", "n": 212, "A_sharpe": -0.7442, "A_sortino": -0.7586, "A_excess_sharpe": -1.9422, "A_return_pct": -25.52, "A_hit_rate": 42.92, "A_n": 212, "A_bh_sharpe": 1.198, "A_bh_return_pct": 37.31, "A_psr": 0.2456, "A_ic": -0.0725, "B_sharpe": -3.1042, "B_sortino": -3.0201, "B_excess_sharpe": -6.6196, "B_return_pct": -85.2, "B_hit_rate": 38.86, "B_n": 212, "B_bh_sharpe": 3.5154, "B_bh_return_pct": 471.71, "B_psr": 0.0025, "B_ic": -0.1642, "D_sharpe": -0.7442, "D_sortino": -0.7586, "D_excess_sharpe": -1.9422, "D_return_pct": -25.52, "D_hit_rate": 42.92, "D_n": 212, "D_bh_sharpe": 1.198, "D_bh_return_pct": 37.31, "D_psr": 0.2456, "D_ic": -0.0725, "sharpe": -0.7442, "sortino": -0.7586, "return_pct": -25.52, "equity": 744.8000000000001, "max_dd": 0.0, "win_rate": 42.92, "profit_factor": 0.0, "ic": -0.0725, "hit": 42.92, "psr": 0.2456, "bh_sharpe": 1.198, "bh_return_pct": 37.31, "excess_sharpe": -1.9422, "precision": 0.5638, "recall": 0.3985, "f1": 0.467, "f2": 0.4233, "accuracy": 0.4292, "mcc": -0.1173, "tp": 53, "fp": 41, "tn": 38, "fn": 80, "A_precision": 0.5638, "A_recall": 0.3985, "A_f1": 0.467, "A_f2": 0.4233, "A_accuracy": 0.4292, "A_mcc": -0.1173, "A_tp": 53, "A_fp": 41, "A_tn": 38, "A_fn": 80}, {"fold": "fold_7", "regime": "Inflation bear, AI rally and 2025", "n": 415, "A_sharpe": 0.2108, "A_sortino": 0.2035, "A_excess_sharpe": -0.8286, "A_return_pct": 3.74, "A_hit_rate": 53.98, "A_n": 415, "A_bh_sharpe": 1.0394, "A_bh_return_pct": 39.53, "A_psr": 0.607, "A_ic": 0.0304, "B_sharpe": -0.9719, "B_sortino": -0.9693, "B_excess_sharpe": -3.5728, "B_return_pct": -59.32, "B_hit_rate": 45.65, "B_n": 415, "B_bh_sharpe": 2.6009, "B_bh_return_pct": 477.86, "B_psr": 0.1063, "B_ic": 0.0121, "D_sharpe": 0.2108, "D_sortino": 0.2035, "D_excess_sharpe": -0.8286, "D_return_pct": 3.74, "D_hit_rate": 53.98, "D_n": 415, "D_bh_sharpe": 1.0394, "D_bh_return_pct": 39.53, "D_psr": 0.607, "D_ic": 0.0304, "sharpe": 0.2108, "sortino": 0.2035, "return_pct": 3.74, "equity": 1037.4, "max_dd": 0.0, "win_rate": 53.98, "profit_factor": 0.0, "ic": 0.0304, "hit": 53.98, "psr": 0.607, "bh_sharpe": 1.0394, "bh_return_pct": 39.53, "excess_sharpe": -0.8286, "precision": 0.59, "recall": 0.7224, "f1": 0.6495, "f2": 0.6914, "accuracy": 0.5398, "mcc": -0.0012, "tp": 177, "fp": 123, "tn": 47, "fn": 68, "A_precision": 0.59, "A_recall": 0.7224, "A_f1": 0.6495, "A_f2": 0.6914, "A_accuracy": 0.5398, "A_mcc": -0.0012, "A_tp": 177, "A_fp": 123, "A_tn": 47, "A_fn": 68}], "per_window_val": [{"fold": "fold_1", "regime": "GFC peak crash (Lehman + Mar-2009 bottom)", "n": 84, "A_sharpe": -1.2559, "A_sortino": -1.0834, "A_excess_sharpe": -0.4387, "A_return_pct": -12.45, "A_hit_rate": 48.78, "A_n": 84, "A_bh_sharpe": -0.8172, "A_bh_return_pct": -8.74, "A_psr": 0.2254, "A_ic": 0.0496, "B_sharpe": -1.2821, "B_sortino": -1.0753, "B_excess_sharpe": 2.0358, "B_return_pct": -25.38, "B_hit_rate": 53.01, "B_n": 84, "B_bh_sharpe": -3.3179, "B_bh_return_pct": -48.39, "B_psr": 0.2235, "B_ic": -0.1475, "D_sharpe": -1.2559, "D_sortino": -1.0834, "D_excess_sharpe": -0.4387, "D_return_pct": -12.45, "D_hit_rate": 48.78, "D_n": 84, "D_bh_sharpe": -0.8172, "D_bh_return_pct": -8.74, "D_psr": 0.2254, "D_ic": 0.0496, "sharpe": -1.2559, "sortino": -1.0834, "return_pct": -12.45, "equity": 875.5, "max_dd": 0.0, "win_rate": 48.78, "profit_factor": 0.0, "ic": 0.0496, "hit": 48.78, "psr": 0.2254, "bh_sharpe": -0.8172, "bh_return_pct": -8.74, "excess_sharpe": -0.4387}, {"fold": "fold_2", "regime": "2011 US-downgrade + EU debt", "n": 86, "A_sharpe": 0.1448, "A_sortino": 0.1255, "A_excess_sharpe": 0.8612, "A_return_pct": 0.04, "A_hit_rate": 56.47, "A_n": 86, "A_bh_sharpe": -0.7164, "A_bh_return_pct": -7.84, "A_psr": 0.5334, "A_ic": -0.0186, "B_sharpe": -2.7445, "B_sortino": -2.3871, "B_excess_sharpe": -0.8177, "B_return_pct": -46.18, "B_hit_rate": 46.51, "B_n": 86, "B_bh_sharpe": -1.9268, "B_bh_return_pct": -36.65, "B_psr": 0.0485, "B_ic": -0.0996, "D_sharpe": 0.1448, "D_sortino": 0.1255, "D_excess_sharpe": 0.8612, "D_return_pct": 0.04, "D_hit_rate": 56.47, "D_n": 86, "D_bh_sharpe": -0.7164, "D_bh_return_pct": -7.84, "D_psr": 0.5334, "D_ic": -0.0186, "sharpe": 0.1448, "sortino": 0.1255, "return_pct": 0.04, "equity": 1000.4, "max_dd": 0.0, "win_rate": 56.47, "profit_factor": 0.0, "ic": -0.0186, "hit": 56.47, "psr": 0.5334, "bh_sharpe": -0.7164, "bh_return_pct": -7.84, "excess_sharpe": 0.8612}, {"fold": "fold_3", "regime": "Taper tantrum and 2014 H1", "n": 44, "A_sharpe": 3.4107, "A_sortino": 3.6127, "A_excess_sharpe": -0.2055, "A_return_pct": 5.96, "A_hit_rate": 54.55, "A_n": 44, "A_bh_sharpe": 3.6162, "A_bh_return_pct": 6.32, "A_psr": 0.9067, "A_ic": 0.0543, "B_sharpe": 2.2494, "B_sortino": 2.3569, "B_excess_sharpe": -4.9108, "B_return_pct": 8.78, "B_hit_rate": 54.55, "B_n": 44, "B_bh_sharpe": 7.1601, "B_bh_return_pct": 29.11, "B_psr": 0.8219, "B_ic": 0.254, "D_sharpe": 3.4107, "D_sortino": 3.6127, "D_excess_sharpe": -0.2055, "D_return_pct": 5.96, "D_hit_rate": 54.55, "D_n": 44, "D_bh_sharpe": 3.6162, "D_bh_return_pct": 6.32, "D_psr": 0.9067, "D_ic": 0.0543, "sharpe": 3.4107, "sortino": 3.6127, "return_pct": 5.96, "equity": 1059.6000000000001, "max_dd": 0.0, "win_rate": 54.55, "profit_factor": 0.0, "ic": 0.0543, "hit": 54.55, "psr": 0.9067, "bh_sharpe": 3.6162, "bh_return_pct": 6.32, "excess_sharpe": -0.2055}, {"fold": "fold_4", "regime": "China devaluation and oil crash", "n": 86, "A_sharpe": 0.0521, "A_sortino": 0.0498, "A_excess_sharpe": 0.7201, "A_return_pct": -0.31, "A_hit_rate": 50.59, "A_n": 86, "A_bh_sharpe": -0.668, "A_bh_return_pct": -5.02, "A_psr": 0.5121, "A_ic": 0.0621, "B_sharpe": 1.6007, "B_sortino": 1.7596, "B_excess_sharpe": 3.2143, "B_return_pct": 23.92, "B_hit_rate": 52.33, "B_n": 86, "B_bh_sharpe": -1.6136, "B_bh_return_pct": -25.2, "B_psr": 0.8237, "B_ic": 0.1882, "D_sharpe": 0.0521, "D_sortino": 0.0498, "D_excess_sharpe": 0.7201, "D_return_pct": -0.31, "D_hit_rate": 50.59, "D_n": 86, "D_bh_sharpe": -0.668, "D_bh_return_pct": -5.02, "D_psr": 0.5121, "D_ic": 0.0621, "sharpe": 0.0521, "sortino": 0.0498, "return_pct": -0.31, "equity": 996.9, "max_dd": 0.0, "win_rate": 50.59, "profit_factor": 0.0, "ic": 0.0621, "hit": 50.59, "psr": 0.5121, "bh_sharpe": -0.668, "bh_return_pct": -5.02, "excess_sharpe": 0.7201}, {"fold": "fold_5", "regime": "2018 Vol-mageddon + Q4 sell-off", "n": 44, "A_sharpe": 0.9247, "A_sortino": 0.9425, "A_excess_sharpe": -0.9222, "A_return_pct": 2.13, "A_hit_rate": 54.55, "A_n": 44, "A_bh_sharpe": 1.8469, "A_bh_return_pct": 4.47, "A_psr": 0.6495, "A_ic": 0.014, "B_sharpe": -1.8387, "B_sortino": -1.7683, "B_excess_sharpe": -5.973, "B_return_pct": -10.73, "B_hit_rate": 45.45, "B_n": 44, "B_bh_sharpe": 4.1343, "B_bh_return_pct": 24.48, "B_psr": 0.2248, "B_ic": -0.0364, "D_sharpe": 0.9247, "D_sortino": 0.9425, "D_excess_sharpe": -0.9222, "D_return_pct": 2.13, "D_hit_rate": 54.55, "D_n": 44, "D_bh_sharpe": 1.8469, "D_bh_return_pct": 4.47, "D_psr": 0.6495, "D_ic": 0.014, "sharpe": 0.9247, "sortino": 0.9425, "return_pct": 2.13, "equity": 1021.3000000000001, "max_dd": 0.0, "win_rate": 54.55, "profit_factor": 0.0, "ic": 0.014, "hit": 54.55, "psr": 0.6495, "bh_sharpe": 1.8469, "bh_return_pct": 4.47, "excess_sharpe": -0.9222}, {"fold": "fold_6", "regime": "COVID crash and V-recovery", "n": 65, "A_sharpe": -1.9864, "A_sortino": -2.096, "A_excess_sharpe": -5.8271, "A_return_pct": -5.56, "A_hit_rate": 38.46, "A_n": 65, "A_bh_sharpe": 3.8407, "A_bh_return_pct": 10.95, "A_psr": 0.1644, "A_ic": 0.0497, "B_sharpe": -13.909, "B_sortino": -10.1551, "B_excess_sharpe": -27.818, "B_return_pct": -49.6, "B_hit_rate": 15.38, "B_n": 65, "B_bh_sharpe": 13.909, "B_bh_return_pct": 95.23, "B_psr": 0.0, "B_ic": 0.064, "D_sharpe": -1.9864, "D_sortino": -2.096, "D_excess_sharpe": -5.8271, "D_return_pct": -5.56, "D_hit_rate": 38.46, "D_n": 65, "D_bh_sharpe": 3.8407, "D_bh_return_pct": 10.95, "D_psr": 0.1644, "D_ic": 0.0497, "sharpe": -1.9864, "sortino": -2.096, "return_pct": -5.56, "equity": 944.4, "max_dd": 0.0, "win_rate": 38.46, "profit_factor": 0.0, "ic": 0.0497, "hit": 38.46, "psr": 0.1644, "bh_sharpe": 3.8407, "bh_return_pct": 10.95, "excess_sharpe": -5.8271}, {"fold": "fold_7", "regime": "Inflation bear, AI rally and 2025", "n": 104, "A_sharpe": 3.0008, "A_sortino": 3.852, "A_excess_sharpe": -1.234, "A_return_pct": 19.63, "A_hit_rate": 51.92, "A_n": 104, "A_bh_sharpe": 4.2348, "A_bh_return_pct": 28.47, "A_psr": 0.9773, "A_ic": 0.1227, "B_sharpe": -0.1199, "B_sortino": -0.1365, "B_excess_sharpe": -9.0492, "B_return_pct": -4.22, "B_hit_rate": 45.19, "B_n": 104, "B_bh_sharpe": 8.9294, "B_bh_return_pct": 203.71, "B_psr": 0.4695, "B_ic": 0.1674, "D_sharpe": 3.0008, "D_sortino": 3.852, "D_excess_sharpe": -1.234, "D_return_pct": 19.63, "D_hit_rate": 51.92, "D_n": 104, "D_bh_sharpe": 4.2348, "D_bh_return_pct": 28.47, "D_psr": 0.9773, "D_ic": 0.1227, "sharpe": 3.0008, "sortino": 3.852, "return_pct": 19.63, "equity": 1196.3, "max_dd": 0.0, "win_rate": 51.92, "profit_factor": 0.0, "ic": 0.1227, "hit": 51.92, "psr": 0.9773, "bh_sharpe": 4.2348, "bh_return_pct": 28.47, "excess_sharpe": -1.234}], "status": "DISCARD", "precision": 0.5707, "recall": 0.7206, "f1": 0.6369, "f2": 0.6846, "accuracy": 0.5261, "mcc": -0.0204, "tp": 557, "fp": 419, "tn": 148, "fn": 216, "test_sharpe": 0.3166, "A_sharpe": 0.3166, "A_excess_sharpe": -0.5256, "A_return_pct": 29.47, "A_precision": 0.5707, "A_recall": 0.7206, "A_f1": 0.6369, "A_f2": 0.6846, "A_accuracy": 0.5261, "A_mcc": -0.0204, "A_tp": 557, "A_fp": 419, "A_tn": 148, "A_fn": 216, "A_psr": 0.7667, "A_ic": 0.0144, "A_hit_rate": 52.73, "A_bh_sharpe": 0.8422, "A_bh_return_pct": 169.94}
