{"experiment_num": 58, "backbone": "mlp", "description": "MLP @ FX-Exp32 lr=5e-4 (up from 3e-4) - Smith 2017 3-point LR sweep; completes 1e-4/3e-4/5e-4 curve", "config": {"seq_len": 10, "lr": 0.0005, "batch_size": 32, "epochs": 50, "weight_decay": 1e-05, "patience": 10, "warmup_epochs": 0, "head_dropout": 0.25, "huber_delta": 1.0, "grad_clip": 1.0, "seed": 0, "hidden_size": null, "num_layers": null, "max_depth": null, "gbm_lr": null, "n_estimators": null}, "composite": -0.4682, "test_pos_folds": 4, "val_pos_folds": 3, "val_loss": -2.899191493730722, "elapsed_sec": 22.0, "timestamp": "2026-04-27T22:01:20", "sharpe": 0.0363, "val_sharpe": -0.1682, "ic": 0.0054, "hit": 47.9, "psr": 0.5342, "equity": 859.6, "return_pct": -14.04, "bh_sharpe": 0.6042, "bh_return_pct": 103.49, "excess_sharpe": -0.5679, "B_sharpe": -0.3786, "B_excess_sharpe": -2.0794, "B_return_pct": -85.48, "D_sharpe": 0.0363, "D_excess_sharpe": -0.5679, "D_return_pct": -14.04, "precision": 0.5549, "recall": 0.4634, "f1": 0.5051, "f2": 0.4792, "mcc": -0.0337, "accuracy": 0.4801, "val_precision": 0.5524, "val_recall": 0.4164, "val_f1": 0.4749, "val_f2": 0.438, "val_mcc": -0.0041, "val_accuracy": 0.489, "per_window": [{"fold": "fold_1", "regime": "GFC peak crash (Lehman + Mar-2009 bottom)", "n": 115, "A_sharpe": -0.7346, "A_sortino": -0.7457, "A_excess_sharpe": -0.2905, "A_return_pct": -19.81, "A_hit_rate": 46.09, "A_n": 115, "A_bh_sharpe": -0.4441, "A_bh_return_pct": -14.4, "A_psr": 0.3111, "A_ic": -0.0496, "A_precision": 0.4643, "A_recall": 0.963, "A_f1": 0.6265, "A_f2": 0.7927, "A_accuracy": 0.4609, "A_mcc": -0.0646, "A_tp": 52, "A_fp": 60, "A_tn": 1, "A_fn": 2, "B_sharpe": 1.7787, "B_sortino": 1.8979, "B_excess_sharpe": 2.0766, "B_return_pct": 73.08, "B_hit_rate": 52.63, "B_n": 115, "B_bh_sharpe": -0.2978, "B_bh_return_pct": -27.23, "B_psr": 0.8838, "B_ic": 0.0793, "B_precision": 0.5435, "B_recall": 0.4237, "B_f1": 0.4762, "B_f2": 0.4433, "B_accuracy": 0.5217, "B_mcc": 0.0497, "B_tp": 25, "B_fp": 21, "B_tn": 35, "B_fn": 34, "D_sharpe": -0.7346, "D_sortino": -0.7457, "D_excess_sharpe": -0.2905, "D_return_pct": -19.81, "D_hit_rate": 46.09, "D_n": 115, "D_bh_sharpe": -0.4441, "D_bh_return_pct": -14.4, "D_psr": 0.3111, "D_ic": -0.0496, "D_precision": 0.4643, "D_recall": 0.963, "D_f1": 0.6265, "D_f2": 0.7927, "D_accuracy": 0.4609, "D_mcc": -0.0646, "D_tp": 52, "D_fp": 60, "D_tn": 1, "D_fn": 2, "sharpe": -0.7346, "sortino": -0.7457, "return_pct": -19.81, "equity": 801.9000000000001, "max_dd": 0.0, "win_rate": 46.09, "profit_factor": 0.0, "ic": -0.0496, "hit": 46.09, "psr": 0.3111, "bh_sharpe": -0.4441, "bh_return_pct": -14.4, "excess_sharpe": -0.2905, "precision": 0.4643, "recall": 0.963, "f1": 0.6265, "f2": 0.7927, "mcc": -0.0646, "accuracy": 0.4609, "tp": 52, "fp": 60, "tn": 1, "fn": 2}, {"fold": "fold_2", "regime": "2011 US-downgrade + EU debt", "n": 136, "A_sharpe": 0.9917, "A_sortino": 1.0971, "A_excess_sharpe": -0.741, "A_return_pct": 10.38, "A_hit_rate": 50.37, "A_n": 136, "A_bh_sharpe": 1.7327, "A_bh_return_pct": 19.75, "A_psr": 0.7689, "A_ic": -0.019, "A_precision": 0.5696, "A_recall": 0.5769, "A_f1": 0.5732, "A_f2": 0.5754, "A_accuracy": 0.5074, "A_mcc": -0.0093, "A_tp": 45, "A_fp": 34, "A_tn": 24, "A_fn": 33, "B_sharpe": 5.5406, "B_sortino": 5.1125, "B_excess_sharpe": 1.4746, "B_return_pct": 241.55, "B_hit_rate": 72.06, "B_n": 136, "B_bh_sharpe": 4.0659, "B_bh_return_pct": 148.68, "B_psr": 0.9999, "B_ic": 0.2321, "B_precision": 0.8295, "B_recall": 0.7604, "B_f1": 0.7935, "B_f2": 0.7733, "B_accuracy": 0.7206, "B_mcc": 0.3675, "B_tp": 73, "B_fp": 15, "B_tn": 25, "B_fn": 23, "D_sharpe": 0.9917, "D_sortino": 1.0971, "D_excess_sharpe": -0.741, "D_return_pct": 10.38, "D_hit_rate": 50.37, "D_n": 136, "D_bh_sharpe": 1.7327, "D_bh_return_pct": 19.75, "D_psr": 0.7689, "D_ic": -0.019, "D_precision": 0.5696, "D_recall": 0.5769, "D_f1": 0.5732, "D_f2": 0.5754, "D_accuracy": 0.5074, "D_mcc": -0.0093, "D_tp": 45, "D_fp": 34, "D_tn": 24, "D_fn": 33, "sharpe": 0.9917, "sortino": 1.0971, "return_pct": 10.38, "equity": 1103.8000000000002, "max_dd": 0.0, "win_rate": 50.37, "profit_factor": 0.0, "ic": -0.019, "hit": 50.37, "psr": 0.7689, "bh_sharpe": 1.7327, "bh_return_pct": 19.75, "excess_sharpe": -0.741, "precision": 0.5696, "recall": 0.5769, "f1": 0.5732, "f2": 0.5754, "mcc": -0.0093, "accuracy": 0.5074, "tp": 45, "fp": 34, "tn": 24, "fn": 33}, {"fold": "fold_3", "regime": "Taper tantrum and 2014 H1", "n": 178, "A_sharpe": 0.2014, "A_sortino": 0.2068, "A_excess_sharpe": -1.1432, "A_return_pct": 1.26, "A_hit_rate": 49.15, "A_n": 178, "A_bh_sharpe": 1.3445, "A_bh_return_pct": 12.41, "A_psr": 0.567, "A_ic": 0.1158, "A_precision": 0.6182, "A_recall": 0.3301, "A_f1": 0.4304, "A_f2": 0.364, "A_accuracy": 0.4944, "A_mcc": 0.0535, "A_tp": 34, "A_fp": 21, "A_tn": 54, "A_fn": 69, "B_sharpe": -1.3836, "B_sortino": -1.2316, "B_excess_sharpe": -4.4319, "B_return_pct": -24.9, "B_hit_rate": 50.56, "B_n": 178, "B_bh_sharpe": 3.0483, "B_bh_return_pct": 71.83, "B_psr": 0.1198, "B_ic": -0.041, "B_precision": 0.5882, "B_recall": 0.6422, "B_f1": 0.614, "B_f2": 0.6306, "B_accuracy": 0.5056, "B_mcc": -0.0703, "B_tp": 70, "B_fp": 49, "B_tn": 20, "B_fn": 39, "D_sharpe": 0.2014, "D_sortino": 0.2068, "D_excess_sharpe": -1.1432, "D_return_pct": 1.26, "D_hit_rate": 49.15, "D_n": 178, "D_bh_sharpe": 1.3445, "D_bh_return_pct": 12.41, "D_psr": 0.567, "D_ic": 0.1158, "D_precision": 0.6182, "D_recall": 0.3301, "D_f1": 0.4304, "D_f2": 0.364, "D_accuracy": 0.4944, "D_mcc": 0.0535, "D_tp": 34, "D_fp": 21, "D_tn": 54, "D_fn": 69, "sharpe": 0.2014, "sortino": 0.2068, "return_pct": 1.26, "equity": 1012.5999999999999, "max_dd": 0.0, "win_rate": 49.15, "profit_factor": 0.0, "ic": 0.1158, "hit": 49.15, "psr": 0.567, "bh_sharpe": 1.3445, "bh_return_pct": 12.41, "excess_sharpe": -1.1432, "precision": 0.6182, "recall": 0.3301, "f1": 0.4304, "f2": 0.364, "mcc": 0.0535, "accuracy": 0.4944, "tp": 34, "fp": 21, "tn": 54, "fn": 69}, {"fold": "fold_4", "regime": "China devaluation and oil crash", "n": 157, "A_sharpe": 0.0191, "A_sortino": 0.018, "A_excess_sharpe": 0.0093, "A_return_pct": -0.94, "A_hit_rate": 51.28, "A_n": 157, "A_bh_sharpe": 0.0098, "A_bh_return_pct": -1.05, "A_psr": 0.506, "A_ic": 0.0532, "A_precision": 0.5342, "A_recall": 0.4815, "A_f1": 0.5065, "A_f2": 0.4912, "A_accuracy": 0.5159, "A_mcc": 0.0342, "A_tp": 39, "A_fp": 34, "A_tn": 42, "A_fn": 42, "B_sharpe": 1.309, "B_sortino": 1.6595, "B_excess_sharpe": 1.2931, "B_return_pct": 34.7, "B_hit_rate": 45.86, "B_n": 157, "B_bh_sharpe": 0.0159, "B_bh_return_pct": -5.48, "B_psr": 0.8548, "B_ic": 0.0059, "B_precision": 0.5, "B_recall": 0.4588, "B_f1": 0.4785, "B_f2": 0.4665, "B_accuracy": 0.4586, "B_mcc": -0.0826, "B_tp": 39, "B_fp": 39, "B_tn": 33, "B_fn": 46, "D_sharpe": 0.0191, "D_sortino": 0.018, "D_excess_sharpe": 0.0093, "D_return_pct": -0.94, "D_hit_rate": 51.28, "D_n": 157, "D_bh_sharpe": 0.0098, "D_bh_return_pct": -1.05, "D_psr": 0.506, "D_ic": 0.0532, "D_precision": 0.5342, "D_recall": 0.4815, "D_f1": 0.5065, "D_f2": 0.4912, "D_accuracy": 0.5159, "D_mcc": 0.0342, "D_tp": 39, "D_fp": 34, "D_tn": 42, "D_fn": 42, "sharpe": 0.0191, "sortino": 0.018, "return_pct": -0.94, "equity": 990.6, "max_dd": 0.0, "win_rate": 51.28, "profit_factor": 0.0, "ic": 0.0532, "hit": 51.28, "psr": 0.506, "bh_sharpe": 0.0098, "bh_return_pct": -1.05, "excess_sharpe": 0.0093, "precision": 0.5342, "recall": 0.4815, "f1": 0.5065, "f2": 0.4912, "mcc": 0.0342, "accuracy": 0.5159, "tp": 39, "fp": 34, "tn": 42, "fn": 42}, {"fold": "fold_5", "regime": "2018 Vol-mageddon + Q4 sell-off", "n": 177, "A_sharpe": -0.6816, "A_sortino": -0.7277, "A_excess_sharpe": -0.9914, "A_return_pct": -12.08, "A_hit_rate": 44.07, "A_n": 177, "A_bh_sharpe": 0.3098, "A_bh_return_pct": 3.19, "A_psr": 0.2861, "A_ic": -0.1153, "A_precision": 0.5185, "A_recall": 0.5437, "A_f1": 0.5308, "A_f2": 0.5385, "A_accuracy": 0.4407, "A_mcc": -0.1608, "A_tp": 56, "A_fp": 52, "A_tn": 22, "A_fn": 47, "B_sharpe": -0.5357, "B_sortino": -0.4844, "B_excess_sharpe": -1.4273, "B_return_pct": -22.17, "B_hit_rate": 52.27, "B_n": 177, "B_bh_sharpe": 0.8917, "B_bh_return_pct": 23.8, "B_psr": 0.3261, "B_ic": -0.0674, "B_precision": 0.6132, "B_recall": 0.5963, "B_f1": 0.6047, "B_f2": 0.5996, "B_accuracy": 0.5198, "B_mcc": -0.0066, "B_tp": 65, "B_fp": 41, "B_tn": 27, "B_fn": 44, "D_sharpe": -0.6816, "D_sortino": -0.7277, "D_excess_sharpe": -0.9914, "D_return_pct": -12.08, "D_hit_rate": 44.07, "D_n": 177, "D_bh_sharpe": 0.3098, "D_bh_return_pct": 3.19, "D_psr": 0.2861, "D_ic": -0.1153, "D_precision": 0.5185, "D_recall": 0.5437, "D_f1": 0.5308, "D_f2": 0.5385, "D_accuracy": 0.4407, "D_mcc": -0.1608, "D_tp": 56, "D_fp": 52, "D_tn": 22, "D_fn": 47, "sharpe": -0.6816, "sortino": -0.7277, "return_pct": -12.08, "equity": 879.1999999999999, "max_dd": 0.0, "win_rate": 44.07, "profit_factor": 0.0, "ic": -0.1153, "hit": 44.07, "psr": 0.2861, "bh_sharpe": 0.3098, "bh_return_pct": 3.19, "excess_sharpe": -0.9914, "precision": 0.5185, "recall": 0.5437, "f1": 0.5308, "f2": 0.5385, "mcc": -0.1608, "accuracy": 0.4407, "tp": 56, "fp": 52, "tn": 22, "fn": 47}, {"fold": "fold_6", "regime": "COVID crash and V-recovery", "n": 222, "A_sharpe": 0.8966, "A_sortino": 0.9774, "A_excess_sharpe": 0.0078, "A_return_pct": 26.52, "A_hit_rate": 45.95, "A_n": 222, "A_bh_sharpe": 0.8888, "A_bh_return_pct": 26.13, "A_psr": 0.7968, "A_ic": 0.0887, "A_precision": 0.6071, "A_recall": 0.3696, "A_f1": 0.4595, "A_f2": 0.4009, "A_accuracy": 0.4595, "A_mcc": -0.0233, "A_tp": 51, "A_fp": 33, "A_tn": 51, "A_fn": 87, "B_sharpe": -2.0915, "B_sortino": -2.0019, "B_excess_sharpe": -4.48, "B_return_pct": -77.51, "B_hit_rate": 45.25, "B_n": 222, "B_bh_sharpe": 2.3884, "B_bh_return_pct": 243.18, "B_psr": 0.0274, "B_ic": -0.0288, "B_precision": 0.6053, "B_recall": 0.3358, "B_f1": 0.4319, "B_f2": 0.3686, "B_accuracy": 0.455, "B_mcc": -0.0176, "B_tp": 46, "B_fp": 30, "B_tn": 55, "B_fn": 91, "D_sharpe": 0.8966, "D_sortino": 0.9774, "D_excess_sharpe": 0.0078, "D_return_pct": 26.52, "D_hit_rate": 45.95, "D_n": 222, "D_bh_sharpe": 0.8888, "D_bh_return_pct": 26.13, "D_psr": 0.7968, "D_ic": 0.0887, "D_precision": 0.6071, "D_recall": 0.3696, "D_f1": 0.4595, "D_f2": 0.4009, "D_accuracy": 0.4595, "D_mcc": -0.0233, "D_tp": 51, "D_fp": 33, "D_tn": 51, "D_fn": 87, "sharpe": 0.8966, "sortino": 0.9774, "return_pct": 26.52, "equity": 1265.2, "max_dd": 0.0, "win_rate": 45.95, "profit_factor": 0.0, "ic": 0.0887, "hit": 45.95, "psr": 0.7968, "bh_sharpe": 0.8888, "bh_return_pct": 26.13, "excess_sharpe": 0.0078, "precision": 0.6071, "recall": 0.3696, "f1": 0.4595, "f2": 0.4009, "mcc": -0.0233, "accuracy": 0.4595, "tp": 51, "fp": 33, "tn": 51, "fn": 87}, {"fold": "fold_7", "regime": "Inflation bear, AI rally and 2025", "n": 425, "A_sharpe": -0.271, "A_sortino": -0.2814, "A_excess_sharpe": -1.2424, "A_return_pct": -12.96, "A_hit_rate": 48.47, "A_n": 425, "A_bh_sharpe": 0.9715, "A_bh_return_pct": 37.12, "A_psr": 0.3637, "A_ic": 0.0111, "A_precision": 0.5951, "A_recall": 0.388, "A_f1": 0.4697, "A_f2": 0.417, "A_accuracy": 0.4847, "A_mcc": 0.011, "A_tp": 97, "A_fp": 66, "A_tn": 109, "A_fn": 153, "B_sharpe": -2.3727, "B_sortino": -2.2104, "B_excess_sharpe": -4.8754, "B_return_pct": -86.13, "B_hit_rate": 43.4, "B_n": 425, "B_bh_sharpe": 2.5027, "B_bh_return_pct": 458.83, "B_psr": 0.0009, "B_ic": -0.1249, "B_precision": 0.5591, "B_recall": 0.3954, "B_f1": 0.4633, "B_f2": 0.42, "B_accuracy": 0.4329, "B_mcc": -0.1084, "B_tp": 104, "B_fp": 82, "B_tn": 80, "B_fn": 159, "D_sharpe": -0.271, "D_sortino": -0.2814, "D_excess_sharpe": -1.2424, "D_return_pct": -12.96, "D_hit_rate": 48.47, "D_n": 425, "D_bh_sharpe": 0.9715, "D_bh_return_pct": 37.12, "D_psr": 0.3637, "D_ic": 0.0111, "D_precision": 0.5951, "D_recall": 0.388, "D_f1": 0.4697, "D_f2": 0.417, "D_accuracy": 0.4847, "D_mcc": 0.011, "D_tp": 97, "D_fp": 66, "D_tn": 109, "D_fn": 153, "sharpe": -0.271, "sortino": -0.2814, "return_pct": -12.96, "equity": 870.4, "max_dd": 0.0, "win_rate": 48.47, "profit_factor": 0.0, "ic": 0.0111, "hit": 48.47, "psr": 0.3637, "bh_sharpe": 0.9715, "bh_return_pct": 37.12, "excess_sharpe": -1.2424, "precision": 0.5951, "recall": 0.388, "f1": 0.4697, "f2": 0.417, "mcc": 0.011, "accuracy": 0.4847, "tp": 97, "fp": 66, "tn": 109, "fn": 153}], "per_window_val": [{"fold": "fold_1", "regime": "GFC peak crash (Lehman + Mar-2009 bottom)", "n": 104, "A_sharpe": -0.5374, "A_sortino": -0.478, "A_excess_sharpe": -0.3702, "A_return_pct": -8.07, "A_hit_rate": 49.02, "A_n": 104, "A_bh_sharpe": -0.1672, "A_bh_return_pct": -3.81, "A_psr": 0.3633, "A_ic": 0.0153, "A_precision": 0.5, "A_recall": 0.8519, "A_f1": 0.6301, "A_f2": 0.7468, "A_accuracy": 0.4808, "A_mcc": -0.1066, "A_tp": 46, "A_fp": 46, "A_tn": 4, "A_fn": 8, "B_sharpe": 3.7813, "B_sortino": 4.5083, "B_excess_sharpe": 6.0554, "B_return_pct": 118.43, "B_hit_rate": 57.28, "B_n": 104, "B_bh_sharpe": -2.2741, "B_bh_return_pct": -44.12, "B_psr": 0.9945, "B_ic": 0.2347, "B_precision": 0.5833, "B_recall": 0.5385, "B_f1": 0.56, "B_f2": 0.5469, "B_accuracy": 0.5769, "B_mcc": 0.1543, "B_tp": 28, "B_fp": 20, "B_tn": 32, "B_fn": 24, "D_sharpe": -0.5374, "D_sortino": -0.478, "D_excess_sharpe": -0.3702, "D_return_pct": -8.07, "D_hit_rate": 49.02, "D_n": 104, "D_bh_sharpe": -0.1672, "D_bh_return_pct": -3.81, "D_psr": 0.3633, "D_ic": 0.0153, "D_precision": 0.5, "D_recall": 0.8519, "D_f1": 0.6301, "D_f2": 0.7468, "D_accuracy": 0.4808, "D_mcc": -0.1066, "D_tp": 46, "D_fp": 46, "D_tn": 4, "D_fn": 8, "sharpe": -0.5374, "sortino": -0.478, "return_pct": -8.07, "equity": 919.3, "max_dd": 0.0, "win_rate": 49.02, "profit_factor": 0.0, "ic": 0.0153, "hit": 49.02, "psr": 0.3633, "bh_sharpe": -0.1672, "bh_return_pct": -3.81, "excess_sharpe": -0.3702, "precision": 0.5, "recall": 0.8519, "f1": 0.6301, "f2": 0.7468, "mcc": -0.1066, "accuracy": 0.4808, "tp": 46, "fp": 46, "tn": 4, "fn": 8}, {"fold": "fold_2", "regime": "2011 US-downgrade + EU debt", "n": 96, "A_sharpe": 0.9478, "A_sortino": 0.9426, "A_excess_sharpe": 1.2219, "A_return_pct": 8.65, "A_hit_rate": 53.68, "A_n": 96, "A_bh_sharpe": -0.2741, "A_bh_return_pct": -4.09, "A_psr": 0.7185, "A_ic": -0.0103, "A_precision": 0.551, "A_recall": 0.54, "A_f1": 0.5455, "A_f2": 0.5422, "A_accuracy": 0.5312, "A_mcc": 0.0617, "A_tp": 27, "A_fp": 22, "A_tn": 24, "A_fn": 23, "B_sharpe": 0.4856, "B_sortino": 0.5872, "B_excess_sharpe": 1.5131, "B_return_pct": 4.51, "B_hit_rate": 43.75, "B_n": 96, "B_bh_sharpe": -1.0274, "B_bh_return_pct": -25.58, "B_psr": 0.6185, "B_ic": 0.0407, "B_precision": 0.3878, "B_recall": 0.4419, "B_f1": 0.413, "B_f2": 0.4299, "B_accuracy": 0.4375, "B_mcc": -0.1235, "B_tp": 19, "B_fp": 30, "B_tn": 23, "B_fn": 24, "D_sharpe": 0.9478, "D_sortino": 0.9426, "D_excess_sharpe": 1.2219, "D_return_pct": 8.65, "D_hit_rate": 53.68, "D_n": 96, "D_bh_sharpe": -0.2741, "D_bh_return_pct": -4.09, "D_psr": 0.7185, "D_ic": -0.0103, "D_precision": 0.551, "D_recall": 0.54, "D_f1": 0.5455, "D_f2": 0.5422, "D_accuracy": 0.5312, "D_mcc": 0.0617, "D_tp": 27, "D_fp": 22, "D_tn": 24, "D_fn": 23, "sharpe": 0.9478, "sortino": 0.9426, "return_pct": 8.65, "equity": 1086.5, "max_dd": 0.0, "win_rate": 53.68, "profit_factor": 0.0, "ic": -0.0103, "hit": 53.68, "psr": 0.7185, "bh_sharpe": -0.2741, "bh_return_pct": -4.09, "excess_sharpe": 1.2219, "precision": 0.551, "recall": 0.54, "f1": 0.5455, "f2": 0.5422, "mcc": 0.0617, "accuracy": 0.5312, "tp": 27, "fp": 22, "tn": 24, "fn": 23}, {"fold": "fold_3", "regime": "Taper tantrum and 2014 H1", "n": 54, "A_sharpe": -4.4015, "A_sortino": -4.0524, "A_excess_sharpe": -9.1013, "A_return_pct": -9.14, "A_hit_rate": 38.89, "A_n": 54, "A_bh_sharpe": 4.6998, "A_bh_return_pct": 10.46, "A_psr": 0.0288, "A_ic": -0.1322, "A_precision": 0.5, "A_recall": 0.0909, "A_f1": 0.1538, "A_f2": 0.1087, "A_accuracy": 0.3889, "A_mcc": -0.0806, "A_tp": 3, "A_fp": 3, "A_tn": 18, "A_fn": 30, "B_sharpe": 4.4468, "B_sortino": 4.6822, "B_excess_sharpe": -4.5858, "B_return_pct": 24.03, "B_hit_rate": 61.11, "B_n": 54, "B_bh_sharpe": 9.0326, "B_bh_return_pct": 49.18, "B_psr": 0.9743, "B_ic": 0.0494, "B_precision": 0.66, "B_recall": 0.8919, "B_f1": 0.7586, "B_f2": 0.8333, "B_accuracy": 0.6111, "B_mcc": -0.1917, "B_tp": 33, "B_fp": 17, "B_tn": 0, "B_fn": 4, "D_sharpe": -4.4015, "D_sortino": -4.0524, "D_excess_sharpe": -9.1013, "D_return_pct": -9.14, "D_hit_rate": 38.89, "D_n": 54, "D_bh_sharpe": 4.6998, "D_bh_return_pct": 10.46, "D_psr": 0.0288, "D_ic": -0.1322, "D_precision": 0.5, "D_recall": 0.0909, "D_f1": 0.1538, "D_f2": 0.1087, "D_accuracy": 0.3889, "D_mcc": -0.0806, "D_tp": 3, "D_fp": 3, "D_tn": 18, "D_fn": 30, "sharpe": -4.4015, "sortino": -4.0524, "return_pct": -9.14, "equity": 908.5999999999999, "max_dd": 0.0, "win_rate": 38.89, "profit_factor": 0.0, "ic": -0.1322, "hit": 38.89, "psr": 0.0288, "bh_sharpe": 4.6998, "bh_return_pct": 10.46, "excess_sharpe": -9.1013, "precision": 0.5, "recall": 0.0909, "f1": 0.1538, "f2": 0.1087, "mcc": -0.0806, "accuracy": 0.3889, "tp": 3, "fp": 3, "tn": 18, "fn": 30}, {"fold": "fold_4", "regime": "China devaluation and oil crash", "n": 96, "A_sharpe": 0.4676, "A_sortino": 0.4555, "A_excess_sharpe": 0.8917, "A_return_pct": 2.75, "A_hit_rate": 53.68, "A_n": 96, "A_bh_sharpe": -0.4241, "A_bh_return_pct": -3.73, "A_psr": 0.6129, "A_ic": 0.0826, "A_precision": 0.5, "A_recall": 0.3556, "A_f1": 0.4156, "A_f2": 0.3774, "A_accuracy": 0.5312, "A_mcc": 0.0443, "A_tp": 16, "A_fp": 16, "A_tn": 35, "A_fn": 29, "B_sharpe": 1.4299, "B_sortino": 2.0548, "B_excess_sharpe": 2.6142, "B_return_pct": 22.89, "B_hit_rate": 45.83, "B_n": 96, "B_bh_sharpe": -1.1843, "B_bh_return_pct": -21.44, "B_psr": 0.828, "B_ic": -0.066, "B_precision": 0.4483, "B_recall": 0.5652, "B_f1": 0.5, "B_f2": 0.5372, "B_accuracy": 0.4583, "B_mcc": -0.0764, "B_tp": 26, "B_fp": 32, "B_tn": 18, "B_fn": 20, "D_sharpe": 0.4676, "D_sortino": 0.4555, "D_excess_sharpe": 0.8917, "D_return_pct": 2.75, "D_hit_rate": 53.68, "D_n": 96, "D_bh_sharpe": -0.4241, "D_bh_return_pct": -3.73, "D_psr": 0.6129, "D_ic": 0.0826, "D_precision": 0.5, "D_recall": 0.3556, "D_f1": 0.4156, "D_f2": 0.3774, "D_accuracy": 0.5312, "D_mcc": 0.0443, "D_tp": 16, "D_fp": 16, "D_tn": 35, "D_fn": 29, "sharpe": 0.4676, "sortino": 0.4555, "return_pct": 2.75, "equity": 1027.5, "max_dd": 0.0, "win_rate": 53.68, "profit_factor": 0.0, "ic": 0.0826, "hit": 53.68, "psr": 0.6129, "bh_sharpe": -0.4241, "bh_return_pct": -3.73, "excess_sharpe": 0.8917, "precision": 0.5, "recall": 0.3556, "f1": 0.4156, "f2": 0.3774, "mcc": 0.0443, "accuracy": 0.5312, "tp": 16, "fp": 16, "tn": 35, "fn": 29}, {"fold": "fold_5", "regime": "2018 Vol-mageddon + Q4 sell-off", "n": 54, "A_sharpe": 1.4966, "A_sortino": 1.6029, "A_excess_sharpe": 0.0686, "A_return_pct": 4.17, "A_hit_rate": 53.7, "A_n": 54, "A_bh_sharpe": 1.428, "A_bh_return_pct": 3.97, "A_psr": 0.7557, "A_ic": 0.0719, "A_precision": 0.7, "A_recall": 0.2414, "A_f1": 0.359, "A_f2": 0.2778, "A_accuracy": 0.537, "A_mcc": 0.1558, "A_tp": 7, "A_fp": 3, "A_tn": 22, "A_fn": 22, "B_sharpe": -5.7506, "B_sortino": -4.9171, "B_excess_sharpe": -10.6828, "B_return_pct": -30.62, "B_hit_rate": 37.04, "B_n": 54, "B_bh_sharpe": 4.9322, "B_bh_return_pct": 34.93, "B_psr": 0.0045, "B_ic": -0.4692, "B_precision": 0.5429, "B_recall": 0.5135, "B_f1": 0.5278, "B_f2": 0.5191, "B_accuracy": 0.3704, "B_mcc": -0.4159, "B_tp": 19, "B_fp": 16, "B_tn": 1, "B_fn": 18, "D_sharpe": 1.4966, "D_sortino": 1.6029, "D_excess_sharpe": 0.0686, "D_return_pct": 4.17, "D_hit_rate": 53.7, "D_n": 54, "D_bh_sharpe": 1.428, "D_bh_return_pct": 3.97, "D_psr": 0.7557, "D_ic": 0.0719, "D_precision": 0.7, "D_recall": 0.2414, "D_f1": 0.359, "D_f2": 0.2778, "D_accuracy": 0.537, "D_mcc": 0.1558, "D_tp": 7, "D_fp": 3, "D_tn": 22, "D_fn": 22, "sharpe": 1.4966, "sortino": 1.6029, "return_pct": 4.17, "equity": 1041.7, "max_dd": 0.0, "win_rate": 53.7, "profit_factor": 0.0, "ic": 0.0719, "hit": 53.7, "psr": 0.7557, "bh_sharpe": 1.428, "bh_return_pct": 3.97, "excess_sharpe": 0.0686, "precision": 0.7, "recall": 0.2414, "f1": 0.359, "f2": 0.2778, "mcc": 0.1558, "accuracy": 0.537, "tp": 7, "fp": 3, "tn": 22, "fn": 22}, {"fold": "fold_6", "regime": "COVID crash and V-recovery", "n": 75, "A_sharpe": -2.6506, "A_sortino": -2.5899, "A_excess_sharpe": -6.9501, "A_return_pct": -8.55, "A_hit_rate": 40.0, "A_n": 75, "A_bh_sharpe": 4.2994, "A_bh_return_pct": 14.68, "A_psr": 0.0786, "A_ic": -0.0899, "A_precision": 0.75, "A_recall": 0.1765, "A_f1": 0.2857, "A_f2": 0.2083, "A_accuracy": 0.4, "A_mcc": 0.0655, "A_tp": 9, "A_fp": 3, "A_tn": 21, "A_fn": 42, "B_sharpe": 6.6567, "B_sortino": 6.4759, "B_excess_sharpe": -7.6772, "B_return_pct": 57.04, "B_hit_rate": 70.67, "B_n": 75, "B_bh_sharpe": 14.3339, "B_bh_return_pct": 120.13, "B_psr": 0.9996, "B_ic": 0.0726, "B_precision": 0.8254, "B_recall": 0.8254, "B_f1": 0.8254, "B_f2": 0.8254, "B_accuracy": 0.7067, "B_mcc": -0.0913, "B_tp": 52, "B_fp": 11, "B_tn": 1, "B_fn": 11, "D_sharpe": -2.6506, "D_sortino": -2.5899, "D_excess_sharpe": -6.9501, "D_return_pct": -8.55, "D_hit_rate": 40.0, "D_n": 75, "D_bh_sharpe": 4.2994, "D_bh_return_pct": 14.68, "D_psr": 0.0786, "D_ic": -0.0899, "D_precision": 0.75, "D_recall": 0.1765, "D_f1": 0.2857, "D_f2": 0.2083, "D_accuracy": 0.4, "D_mcc": 0.0655, "D_tp": 9, "D_fp": 3, "D_tn": 21, "D_fn": 42, "sharpe": -2.6506, "sortino": -2.5899, "return_pct": -8.55, "equity": 914.5, "max_dd": 0.0, "win_rate": 40.0, "profit_factor": 0.0, "ic": -0.0899, "hit": 40.0, "psr": 0.0786, "bh_sharpe": 4.2994, "bh_return_pct": 14.68, "excess_sharpe": -6.9501, "precision": 0.75, "recall": 0.1765, "f1": 0.2857, "f2": 0.2083, "mcc": 0.0655, "accuracy": 0.4, "tp": 9, "fp": 3, "tn": 21, "fn": 42}, {"fold": "fold_7", "regime": "Inflation bear, AI rally and 2025", "n": 114, "A_sharpe": -0.0949, "A_sortino": -0.0926, "A_excess_sharpe": -2.9399, "A_return_pct": -1.23, "A_hit_rate": 50.88, "A_n": 114, "A_bh_sharpe": 2.845, "A_bh_return_pct": 21.34, "A_psr": 0.4747, "A_ic": 0.073, "A_precision": 0.617, "A_recall": 0.4328, "A_f1": 0.5088, "A_f2": 0.4603, "A_accuracy": 0.5088, "A_mcc": 0.0499, "A_tp": 29, "A_fp"