{"experiment_num": 41, "backbone": "xgboost", "description": "XGBoost depth=4 n_est=200 - upper capacity boundary test (sweet spot between 100 and 300)", "config": {"seq_len": 60, "lr": 0.0003, "batch_size": 32, "epochs": 50, "weight_decay": 1e-05, "patience": 10, "warmup_epochs": 0, "head_dropout": 0.1, "huber_delta": 1.0, "grad_clip": 1.0, "seed": 42, "hidden_size": null, "num_layers": null, "max_depth": 4, "gbm_lr": 0.05, "n_estimators": 200}, "composite": -2.6905, "test_pos_folds": 4, "val_pos_folds": 2, "val_loss": null, "elapsed_sec": 138.3, "timestamp": "2026-04-27T18:57:31", "sharpe": -0.0887, "val_sharpe": -2.3905, "ic": -0.0067, "hit": 47.65, "psr": 0.4278, "equity": 825.1999999999999, "return_pct": -17.48, "bh_sharpe": 1.2194, "bh_return_pct": 187.05, "excess_sharpe": -1.308, "B_sharpe": -0.3901, "B_excess_sharpe": -3.2183, "B_return_pct": -70.62, "D_sharpe": 0.2576, "D_excess_sharpe": -0.9618, "D_return_pct": 14.93, "per_window": [{"fold": "fold_1", "regime": "GFC peak crash (Lehman + Mar-2009 bottom)", "n": 66, "A_sharpe": 0.8565, "A_sortino": 0.9205, "A_excess_sharpe": 0.2844, "A_return_pct": 6.78, "A_hit_rate": 50.0, "A_n": 66, "A_bh_sharpe": 0.5721, "A_bh_return_pct": 3.85, "A_psr": 0.6689, "A_ic": -0.0043, "B_sharpe": 0.2555, "B_sortino": 0.2555, "B_excess_sharpe": -1.7915, "B_return_pct": -2.51, "B_hit_rate": 52.31, "B_n": 66, "B_bh_sharpe": 2.0469, "B_bh_return_pct": 39.28, "B_psr": 0.5517, "B_ic": 0.159, "D_sharpe": 1.9726, "D_sortino": 1.9516, "D_excess_sharpe": 1.4005, "D_return_pct": 18.97, "D_hit_rate": 56.06, "D_n": 66, "D_bh_sharpe": 0.5721, "D_bh_return_pct": 3.85, "D_psr": 0.8382, "D_ic": 0.1448, "sharpe": 0.8565, "sortino": 0.9205, "return_pct": 6.78, "equity": 1067.8000000000002, "max_dd": 0.0, "win_rate": 50.0, "profit_factor": 0.0, "ic": -0.0043, "hit": 50.0, "psr": 0.6689, "bh_sharpe": 0.5721, "bh_return_pct": 3.85, "excess_sharpe": 0.2844, "precision": 0.5333, "recall": 0.4571, "f1": 0.4923, "f2": 0.4706, "accuracy": 0.5, "mcc": 0.0055, "tp": 16, "fp": 14, "tn": 17, "fn": 19, "A_precision": 0.5333, "A_recall": 0.4571, "A_f1": 0.4923, "A_f2": 0.4706, "A_accuracy": 0.5, "A_mcc": 0.0055, "A_tp": 16, "A_fp": 14, "A_tn": 17, "A_fn": 19}, {"fold": "fold_2", "regime": "2011 US-downgrade + EU debt", "n": 87, "A_sharpe": 2.5834, "A_sortino": 3.2954, "A_excess_sharpe": -2.4386, "A_return_pct": 14.4, "A_hit_rate": 51.16, "A_n": 87, "A_bh_sharpe": 5.022, "A_bh_return_pct": 29.23, "A_psr": 0.9469, "A_ic": -0.0158, "B_sharpe": 5.8903, "B_sortino": 6.9266, "B_excess_sharpe": -5.2466, "B_return_pct": 87.29, "B_hit_rate": 63.22, "B_n": 87, "B_bh_sharpe": 11.1369, "B_bh_return_pct": 185.4, "B_psr": 0.9998, "B_ic": 0.2642, "D_sharpe": 3.6606, "D_sortino": 4.2981, "D_excess_sharpe": -1.3614, "D_return_pct": 20.92, "D_hit_rate": 61.63, "D_n": 87, "D_bh_sharpe": 5.022, "D_bh_return_pct": 29.23, "D_psr": 0.9902, "D_ic": 0.1238, "sharpe": 2.5834, "sortino": 3.2954, "return_pct": 14.4, "equity": 1144.0000000000002, "max_dd": 0.0, "win_rate": 51.16, "profit_factor": 0.0, "ic": -0.0158, "hit": 51.16, "psr": 0.9469, "bh_sharpe": 5.022, "bh_return_pct": 29.23, "excess_sharpe": -2.4386, "precision": 0.6154, "recall": 0.5926, "f1": 0.6038, "f2": 0.597, "accuracy": 0.5172, "mcc": -0.0133, "tp": 32, "fp": 20, "tn": 13, "fn": 22, "A_precision": 0.6154, "A_recall": 0.5926, "A_f1": 0.6038, "A_f2": 0.597, "A_accuracy": 0.5172, "A_mcc": -0.0133, "A_tp": 32, "A_fp": 20, "A_tn": 13, "A_fn": 22}, {"fold": "fold_3", "regime": "Taper tantrum and 2014 H1", "n": 129, "A_sharpe": 0.9986, "A_sortino": 0.9012, "A_excess_sharpe": -0.7692, "A_return_pct": 6.32, "A_hit_rate": 55.47, "A_n": 129, "A_bh_sharpe": 1.7678, "A_bh_return_pct": 11.76, "A_psr": 0.7563, "A_ic": -0.0879, "B_sharpe": 3.4685, "B_sortino": 3.61, "B_excess_sharpe": -0.7788, "B_return_pct": 50.14, "B_hit_rate": 58.14, "B_n": 129, "B_bh_sharpe": 4.2474, "B_bh_return_pct": 64.1, "B_psr": 0.9917, "B_ic": -0.0255, "D_sharpe": 2.2252, "D_sortino": 2.2381, "D_excess_sharpe": 0.4574, "D_return_pct": 15.1, "D_hit_rate": 57.03, "D_n": 129, "D_bh_sharpe": 1.7678, "D_bh_return_pct": 11.76, "D_psr": 0.9423, "D_ic": 0.0433, "sharpe": 0.9986, "sortino": 0.9012, "return_pct": 6.32, "equity": 1063.1999999999998, "max_dd": 0.0, "win_rate": 55.47, "profit_factor": 0.0, "ic": -0.0879, "hit": 55.47, "psr": 0.7563, "bh_sharpe": 1.7678, "bh_return_pct": 11.76, "excess_sharpe": -0.7692, "precision": 0.598, "recall": 0.7821, "f1": 0.6778, "f2": 0.7367, "accuracy": 0.5504, "mcc": -0.0263, "tp": 61, "fp": 41, "tn": 10, "fn": 17, "A_precision": 0.598, "A_recall": 0.7821, "A_f1": 0.6778, "A_f2": 0.7367, "A_accuracy": 0.5504, "A_mcc": -0.0263, "A_tp": 61, "A_fp": 41, "A_tn": 10, "A_fn": 17}, {"fold": "fold_4", "regime": "China devaluation and oil crash", "n": 108, "A_sharpe": -1.2617, "A_sortino": -1.2013, "A_excess_sharpe": -0.572, "A_return_pct": -11.24, "A_hit_rate": 47.66, "A_n": 108, "A_bh_sharpe": -0.6898, "A_bh_return_pct": -6.71, "A_psr": 0.2051, "A_ic": -0.0382, "B_sharpe": -2.637, "B_sortino": -2.552, "B_excess_sharpe": -0.6795, "B_return_pct": -41.3, "B_hit_rate": 40.74, "B_n": 108, "B_bh_sharpe": -1.9575, "B_bh_return_pct": -33.56, "B_psr": 0.0441, "B_ic": -0.138, "D_sharpe": -3.2043, "D_sortino": -2.7553, "D_excess_sharpe": -2.5145, "D_return_pct": -24.75, "D_hit_rate": 44.86, "D_n": 108, "D_bh_sharpe": -0.6898, "D_bh_return_pct": -6.71, "D_psr": 0.015, "D_ic": -0.0691, "sharpe": -1.2617, "sortino": -1.2013, "return_pct": -11.24, "equity": 887.5999999999999, "max_dd": 0.0, "win_rate": 47.66, "profit_factor": 0.0, "ic": -0.0382, "hit": 47.66, "psr": 0.2051, "bh_sharpe": -0.6898, "bh_return_pct": -6.71, "excess_sharpe": -0.572, "precision": 0.4737, "recall": 0.5094, "f1": 0.4909, "f2": 0.5019, "accuracy": 0.4815, "mcc": -0.0361, "tp": 27, "fp": 30, "tn": 25, "fn": 26, "A_precision": 0.4737, "A_recall": 0.5094, "A_f1": 0.4909, "A_f2": 0.5019, "A_accuracy": 0.4815, "A_mcc": -0.0361, "A_tp": 27, "A_fp": 30, "A_tn": 25, "A_fn": 26}, {"fold": "fold_5", "regime": "2018 Vol-mageddon + Q4 sell-off", "n": 128, "A_sharpe": 1.1097, "A_sortino": 1.2327, "A_excess_sharpe": -0.0414, "A_return_pct": 12.63, "A_hit_rate": 51.56, "A_n": 128, "A_bh_sharpe": 1.1511, "A_bh_return_pct": 13.19, "A_psr": 0.7887, "A_ic": 0.0246, "B_sharpe": -3.6819, "B_sortino": -3.5431, "B_excess_sharpe": -6.4938, "B_return_pct": -59.57, "B_hit_rate": 35.43, "B_n": 128, "B_bh_sharpe": 2.8119, "B_bh_return_pct": 82.25, "B_psr": 0.0046, "B_ic": -0.1635, "D_sharpe": -0.9793, "D_sortino": -1.0794, "D_excess_sharpe": -2.1305, "D_return_pct": -12.34, "D_hit_rate": 42.97, "D_n": 128, "D_bh_sharpe": 1.1511, "D_bh_return_pct": 13.19, "D_psr": 0.2481, "D_ic": -0.1173, "sharpe": 1.1097, "sortino": 1.2327, "return_pct": 12.63, "equity": 1126.3000000000002, "max_dd": 0.0, "win_rate": 51.56, "profit_factor": 0.0, "ic": 0.0246, "hit": 51.56, "psr": 0.7887, "bh_sharpe": 1.1511, "bh_return_pct": 13.19, "excess_sharpe": -0.0414, "precision": 0.6026, "recall": 0.6026, "f1": 0.6026, "f2": 0.6026, "accuracy": 0.5156, "mcc": -0.0174, "tp": 47, "fp": 31, "tn": 19, "fn": 31, "A_precision": 0.6026, "A_recall": 0.6026, "A_f1": 0.6026, "A_f2": 0.6026, "A_accuracy": 0.5156, "A_mcc": -0.0174, "A_tp": 47, "A_fp": 31, "A_tn": 19, "A_fn": 31}, {"fold": "fold_6", "regime": "COVID crash and V-recovery", "n": 173, "A_sharpe": -0.3955, "A_sortino": -0.4023, "A_excess_sharpe": -2.7216, "A_return_pct": -8.25, "A_hit_rate": 49.71, "A_n": 173, "A_bh_sharpe": 2.3261, "A_bh_return_pct": 43.81, "A_psr": 0.3723, "A_ic": 0.0106, "B_sharpe": -1.4004, "B_sortino": -1.488, "B_excess_sharpe": -7.1464, "B_return_pct": -43.57, "B_hit_rate": 44.19, "B_n": 173, "B_bh_sharpe": 5.746, "B_bh_return_pct": 499.04, "B_psr": 0.1302, "B_ic": 0.0856, "D_sharpe": -0.0114, "D_sortino": -0.0143, "D_excess_sharpe": -2.3374, "D_return_pct": -2.17, "D_hit_rate": 41.04, "D_n": 173, "D_bh_sharpe": 2.3261, "D_bh_return_pct": 43.81, "D_psr": 0.4962, "D_ic": 0.014, "sharpe": -0.3955, "sortino": -0.4023, "return_pct": -8.25, "equity": 917.5, "max_dd": 0.0, "win_rate": 49.71, "profit_factor": 0.0, "ic": 0.0106, "hit": 49.71, "psr": 0.3723, "bh_sharpe": 2.3261, "bh_return_pct": 43.81, "excess_sharpe": -2.7216, "precision": 0.6548, "recall": 0.4867, "f1": 0.5584, "f2": 0.5131, "accuracy": 0.4971, "mcc": 0.0032, "tp": 55, "fp": 29, "tn": 31, "fn": 58, "A_precision": 0.6548, "A_recall": 0.4867, "A_f1": 0.5584, "A_f2": 0.5131, "A_accuracy": 0.4971, "A_mcc": 0.0032, "A_tp": 55, "A_fp": 29, "A_tn": 31, "A_fn": 58}, {"fold": "fold_7", "regime": "Inflation bear, AI rally and 2025", "n": 376, "A_sharpe": -0.9869, "A_sortino": -1.1336, "A_excess_sharpe": -1.7902, "A_return_pct": -30.72, "A_hit_rate": 41.49, "A_n": 376, "A_bh_sharpe": 0.8033, "A_bh_return_pct": 26.02, "A_psr": 0.1258, "A_ic": 0.0043, "B_sharpe": -0.0907, "B_sortino": -0.1022, "B_excess_sharpe": -2.0224, "B_return_pct": -20.0, "B_hit_rate": 44.53, "B_n": 376, "B_bh_sharpe": 1.9317, "B_bh_return_pct": 222.05, "B_psr": 0.456, "B_ic": -0.0718, "D_sharpe": 0.3285, "D_sortino": 0.4319, "D_excess_sharpe": -0.4748, "D_return_pct": 7.58, "D_hit_rate": 43.09, "D_n": 376, "D_bh_sharpe": 0.8033, "D_bh_return_pct": 26.02, "D_psr": 0.6586, "D_ic": -0.0573, "sharpe": -0.9869, "sortino": -1.1336, "return_pct": -30.72, "equity": 692.8000000000001, "max_dd": 0.0, "win_rate": 41.49, "profit_factor": 0.0, "ic": 0.0043, "hit": 41.49, "psr": 0.1258, "bh_sharpe": 0.8033, "bh_return_pct": 26.02, "excess_sharpe": -1.7902, "precision": 0.5077, "recall": 0.1493, "f1": 0.2308, "f2": 0.1739, "accuracy": 0.4149, "mcc": -0.0744, "tp": 33, "fp": 32, "tn": 123, "fn": 188, "A_precision": 0.5077, "A_recall": 0.1493, "A_f1": 0.2308, "A_f2": 0.1739, "A_accuracy": 0.4149, "A_mcc": -0.0744, "A_tp": 33, "A_fp": 32, "A_tn": 123, "A_fn": 188}], "per_window_val": [{"fold": "fold_1", "regime": "GFC peak crash (Lehman + Mar-2009 bottom)", "n": 65, "A_sharpe": -3.4363, "A_sortino": -2.9493, "A_excess_sharpe": -1.2106, "A_return_pct": -26.53, "A_hit_rate": 41.27, "A_n": 65, "A_bh_sharpe": -2.2257, "A_bh_return_pct": -18.74, "A_psr": 0.0296, "A_ic": 0.0244, "B_sharpe": -4.7413, "B_sortino": -4.0346, "B_excess_sharpe": 2.381, "B_return_pct": -60.91, "B_hit_rate": 40.0, "B_n": 65, "B_bh_sharpe": -7.1223, "B_bh_return_pct": -73.11, "B_psr": 0.0062, "B_ic": 0.3642, "D_sharpe": 0.5028, "D_sortino": 0.5194, "D_excess_sharpe": 2.7285, "D_return_pct": 2.96, "D_hit_rate": 50.79, "D_n": 65, "D_bh_sharpe": -2.2257, "D_bh_return_pct": -18.74, "D_psr": 0.6007, "D_ic": 0.2655, "sharpe": -3.4363, "sortino": -2.9493, "return_pct": -26.53, "equity": 734.6999999999999, "max_dd": 0.0, "win_rate": 41.27, "profit_factor": 0.0, "ic": 0.0244, "hit": 41.27, "psr": 0.0296, "bh_sharpe": -2.2257, "bh_return_pct": -18.74, "excess_sharpe": -1.2106}, {"fold": "fold_2", "regime": "2011 US-downgrade + EU debt", "n": 47, "A_sharpe": -3.2975, "A_sortino": -2.8416, "A_excess_sharpe": -3.1034, "A_return_pct": -19.79, "A_hit_rate": 44.68, "A_n": 47, "A_bh_sharpe": -0.1941, "A_bh_return_pct": -2.36, "A_psr": 0.0717, "A_ic": -0.1154, "B_sharpe": -1.171, "B_sortino": -1.0754, "B_excess_sharpe": 0.4413, "B_return_pct": -19.53, "B_hit_rate": 46.81, "B_n": 47, "B_bh_sharpe": -1.6123, "B_bh_return_pct": -24.3, "B_psr": 0.305, "B_ic": 0.2017, "D_sharpe": -0.0102, "D_sortino": -0.0087, "D_excess_sharpe": 0.1839, "D_return_pct": -1.19, "D_hit_rate": 57.45, "D_n": 47, "D_bh_sharpe": -0.1941, "D_bh_return_pct": -2.36, "D_psr": 0.4983, "D_ic": 0.1339, "sharpe": -3.2975, "sortino": -2.8416, "return_pct": -19.79, "equity": 802.1, "max_dd": 0.0, "win_rate": 44.68, "profit_factor": 0.0, "ic": -0.1154, "hit": 44.68, "psr": 0.0717, "bh_sharpe": -0.1941, "bh_return_pct": -2.36, "excess_sharpe": -3.1034}, {"fold": "fold_3", "regime": "Taper tantrum and 2014 H1", "n": 5, "A_sharpe": 18.1191, "A_sortino": 39.9504, "A_excess_sharpe": 19.4385, "A_return_pct": 0.0, "A_hit_rate": 0.0, "A_n": 5, "A_bh_sharpe": -1.3194, "A_bh_return_pct": -0.21, "A_psr": 0.9974, "A_ic": 1.0, "B_sharpe": 16.3312, "B_sortino": 33.6599, "B_excess_sharpe": 42.2017, "B_return_pct": 0.0, "B_hit_rate": 0.0, "B_n": 5, "B_bh_sharpe": -25.8705, "B_bh_return_pct": -3.84, "B_psr": 0.9931, "B_ic": -0.1, "D_sharpe": 12.0791, "D_sortino": 14.4463, "D_excess_sharpe": 13.3985, "D_return_pct": 0.0, "D_hit_rate": 0.0, "D_n": 5, "D_bh_sharpe": -1.3194, "D_bh_return_pct": -0.21, "D_psr": 0.9443, "D_ic": 0.1, "sharpe": 18.1191, "sortino": 39.9504, "return_pct": 0.0, "equity": 1000.0, "max_dd": 0.0, "win_rate": 0.0, "profit_factor": 0.0, "ic": 1.0, "hit": 0.0, "psr": 0.9974, "bh_sharpe": -1.3194, "bh_return_pct": -0.21, "excess_sharpe": 19.4385}, {"fold": "fold_4", "regime": "China devaluation and oil crash", "n": 47, "A_sharpe": -3.0647, "A_sortino": -2.8541, "A_excess_sharpe": -1.241, "A_return_pct": -13.66, "A_hit_rate": 40.43, "A_n": 47, "A_bh_sharpe": -1.8238, "A_bh_return_pct": -8.68, "A_psr": 0.0974, "A_ic": -0.0711, "B_sharpe": -0.7234, "B_sortino": -0.6036, "B_excess_sharpe": 1.4966, "B_return_pct": -10.65, "B_hit_rate": 51.06, "B_n": 47, "B_bh_sharpe": -2.22, "B_bh_return_pct": -23.98, "B_psr": 0.3748, "B_ic": 0.5782, "D_sharpe": -1.4517, "D_sortino": -1.3531, "D_excess_sharpe": 0.3721, "D_return_pct": -7.1, "D_hit_rate": 46.81, "D_n": 47, "D_bh_sharpe": -1.8238, "D_bh_return_pct": -8.68, "D_psr": 0.2665, "D_ic": 0.2443, "sharpe": -3.0647, "sortino": -2.8541, "return_pct": -13.66, "equity": 863.4, "max_dd": 0.0, "win_rate": 40.43, "profit_factor": 0.0, "ic": -0.0711, "hit": 40.43, "psr": 0.0974, "bh_sharpe": -1.8238, "bh_return_pct": -8.68, "excess_sharpe": -1.241}, {"fold": "fold_5", "regime": "2018 Vol-mageddon + Q4 sell-off", "n": 5, "A_sharpe": -5.2428, "A_sortino": -4.6528, "A_excess_sharpe": 4.894, "A_return_pct": -1.86, "A_hit_rate": 40.0, "A_n": 5, "A_bh_sharpe": -10.1368, "A_bh_return_pct": -3.15, "A_psr": 0.2615, "A_ic": 0.0, "B_sharpe": 5.6858, "B_sortino": 6.0578, "B_excess_sharpe": 0.0, "B_return_pct": 4.22, "B_hit_rate": 60.0, "B_n": 5, "B_bh_sharpe": 5.6858, "B_bh_return_pct": 4.22, "B_psr": 0.753, "B_ic": 0.5, "D_sharpe": -10.1368, "D_sortino": -6.9937, "D_excess_sharpe": 0.0, "D_return_pct": -3.15, "D_hit_rate": 40.0, "D_n": 5, "D_bh_sharpe": -10.1368, "D_bh_return_pct": -3.15, "D_psr": 0.0985, "D_ic": 0.1, "sharpe": -5.2428, "sortino": -4.6528, "return_pct": -1.86, "equity": 981.4000000000001, "max_dd": 0.0, "win_rate": 40.0, "profit_factor": 0.0, "ic": 0.0, "hit": 40.0, "psr": 0.2615, "bh_sharpe": -10.1368, "bh_return_pct": -3.15, "excess_sharpe": 4.894}, {"fold": "fold_6", "regime": "COVID crash and V-recovery", "n": 26, "A_sharpe": 2.4164, "A_sortino": 2.8733, "A_excess_sharpe": -0.8687, "A_return_pct": 3.53, "A_hit_rate": 50.0, "A_n": 26, "A_bh_sharpe": 3.2852, "A_bh_return_pct": 4.82, "A_psr": 0.7797, "A_ic": 0.1952, "B_sharpe": 6.1565, "B_sortino": 5.2456, "B_excess_sharpe": -6.8227, "B_return_pct": 20.3, "B_hit_rate": 73.08, "B_n": 26, "B_bh_sharpe": 12.9792, "B_bh_return_pct": 38.76, "B_psr": 0.9605, "B_ic": 0.3299, "D_sharpe": 7.4314, "D_sortino": 10.4202, "D_excess_sharpe": 4.1462, "D_return_pct": 10.49, "D_hit_rate": 61.54, "D_n": 26, "D_bh_sharpe": 3.2852, "D_bh_return_pct": 4.82, "D_psr": 0.9918, "D_ic": 0.373, "sharpe": 2.4164, "sortino": 2.8733, "return_pct": 3.53, "equity": 1035.3, "max_dd": 0.0, "win_rate": 50.0, "profit_factor": 0.0, "ic": 0.1952, "hit": 50.0, "psr": 0.7797, "bh_sharpe": 3.2852, "bh_return_pct": 4.82, "excess_sharpe": -0.8687}, {"fold": "fold_7", "regime": "Inflation bear, AI rally and 2025", "n": 65, "A_sharpe": -1.036, "A_sortino": -1.0548, "A_excess_sharpe": -3.1149, "A_return_pct": -4.3, "A_hit_rate": 46.15, "A_n": 65, "A_bh_sharpe": 2.0789, "A_bh_return_pct": 8.17, "A_psr": 0.3028, "A_ic": 0.0326, "B_sharpe": -5.4764, "B_sortino": -5.1127, "B_excess_sharpe": -10.7078, "B_return_pct": -33.43, "B_hit_rate": 30.77, "B_n": 65, "B_bh_sharpe": 5.2314, "B_bh_return_pct": 44.53, "B_psr": 0.0043, "B_ic": -0.0224, "D_sharpe": -2.2107, "D_sortino": -2.0519, "D_excess_sharpe": -4.2896, "D_return_pct": -8.57, "D_hit_rate": 44.62, "D_n": 65, "D_bh_sharpe": 2.0789, "D_bh_return_pct": 8.17, "D_psr": 0.1297, "D_ic": 0.0988, "sharpe": -1.036, "sortino": -1.0548, "return_pct": -4.3, "equity": 957.0, "max_dd": 0.0, "win_rate": 46.15, "profit_factor": 0.0, "ic": 0.0326, "hit": 46.15, "psr": 0.3028, "bh_sharpe": 2.0789, "bh_return_pct": 8.17, "excess_sharpe": -3.1149}], "status": "DISCARD", "precision": 0.5791, "recall": 0.4288, "f1": 0.4927, "f2": 0.4523, "accuracy": 0.477, "mcc": -0.0238, "tp": 271, "fp": 197, "tn": 238, "fn": 361, "test_sharpe": -0.0887, "A_sharpe": -0.0887, "A_excess_sharpe": -1.308, "A_return_pct": -17.48, "A_precision": 0.5791, "A_recall": 0.4288, "A_f1": 0.4927, "A_f2": 0.4523, "A_accuracy": 0.477, "A_mcc": -0.0238, "A_tp": 271, "A_fp": 197, "A_tn": 238, "A_fn": 361, "A_psr": 0.4278, "A_ic": -0.0067, "A_hit_rate": 47.65, "A_bh_sharpe": 1.2194, "A_bh_return_pct": 187.05}
