{"experiment_num": 73, "backbone": "lstm", "description": "LSTM @ exp 71 num_layers=1 seed=7 - 3rd seed for stable-champion verification", "config": {"seq_len": 10, "lr": 0.001, "batch_size": 16, "epochs": 100, "weight_decay": 0.0007, "patience": 15, "warmup_epochs": 0, "head_dropout": 0.1, "huber_delta": 1.0, "grad_clip": 1.0, "seed": 7, "hidden_size": null, "num_layers": 1, "max_depth": null, "gbm_lr": null, "n_estimators": null}, "composite": 0.606, "test_pos_folds": 7, "val_pos_folds": 5, "val_loss": -2.8772845043098747, "elapsed_sec": 52.7, "timestamp": "2026-04-27T23:05:06", "sharpe": 1.2919, "val_sharpe": 0.606, "ic": 0.0695, "hit": 53.52, "psr": 0.9992, "equity": 5769.3, "return_pct": 476.93, "bh_sharpe": 0.6042, "bh_return_pct": 103.49, "excess_sharpe": 0.6877, "B_sharpe": 1.0042, "B_excess_sharpe": -0.6966, "B_return_pct": 796.29, "D_sharpe": 1.2919, "D_excess_sharpe": 0.6877, "D_return_pct": 476.93, "precision": 0.582, "recall": 0.6642, "f1": 0.6204, "f2": 0.6459, "mcc": 0.0267, "accuracy": 0.5348, "val_precision": 0.5501, "val_recall": 0.7173, "val_f1": 0.6227, "val_f2": 0.6762, "val_mcc": -0.0153, "val_accuracy": 0.5177, "per_window": [{"fold": "fold_1", "regime": "GFC peak crash (Lehman + Mar-2009 bottom)", "n": 115, "A_sharpe": 2.0738, "A_sortino": 2.6327, "A_excess_sharpe": 2.5179, "A_return_pct": 50.43, "A_hit_rate": 47.83, "A_n": 115, "A_bh_sharpe": -0.4441, "A_bh_return_pct": -14.4, "A_psr": 0.9266, "A_ic": 0.1068, "A_precision": 0.4651, "A_recall": 0.7407, "A_f1": 0.5714, "A_f2": 0.6623, "A_accuracy": 0.4783, "A_mcc": -0.0154, "A_tp": 40, "A_fp": 46, "A_tn": 15, "A_fn": 14, "B_sharpe": 2.4033, "B_sortino": 2.428, "B_excess_sharpe": 2.7012, "B_return_pct": 123.1, "B_hit_rate": 57.89, "B_n": 115, "B_bh_sharpe": -0.2978, "B_bh_return_pct": -27.23, "B_psr": 0.9442, "B_ic": 0.2398, "B_precision": 0.5591, "B_recall": 0.8814, "B_f1": 0.6842, "B_f2": 0.7903, "B_accuracy": 0.5826, "B_mcc": 0.1896, "B_tp": 52, "B_fp": 41, "B_tn": 15, "B_fn": 7, "D_sharpe": 2.0738, "D_sortino": 2.6327, "D_excess_sharpe": 2.5179, "D_return_pct": 50.43, "D_hit_rate": 47.83, "D_n": 115, "D_bh_sharpe": -0.4441, "D_bh_return_pct": -14.4, "D_psr": 0.9266, "D_ic": 0.1068, "D_precision": 0.4651, "D_recall": 0.7407, "D_f1": 0.5714, "D_f2": 0.6623, "D_accuracy": 0.4783, "D_mcc": -0.0154, "D_tp": 40, "D_fp": 46, "D_tn": 15, "D_fn": 14, "sharpe": 2.0738, "sortino": 2.6327, "return_pct": 50.43, "equity": 1504.3, "max_dd": 0.0, "win_rate": 47.83, "profit_factor": 0.0, "ic": 0.1068, "hit": 47.83, "psr": 0.9266, "bh_sharpe": -0.4441, "bh_return_pct": -14.4, "excess_sharpe": 2.5179, "precision": 0.4651, "recall": 0.7407, "f1": 0.5714, "f2": 0.6623, "mcc": -0.0154, "accuracy": 0.4783, "tp": 40, "fp": 46, "tn": 15, "fn": 14}, {"fold": "fold_2", "regime": "2011 US-downgrade + EU debt", "n": 136, "A_sharpe": 0.8079, "A_sortino": 0.8765, "A_excess_sharpe": -0.9248, "A_return_pct": 8.15, "A_hit_rate": 49.63, "A_n": 136, "A_bh_sharpe": 1.7327, "A_bh_return_pct": 19.75, "A_psr": 0.724, "A_ic": 0.0216, "A_precision": 0.5862, "A_recall": 0.4359, "A_f1": 0.5, "A_f2": 0.4595, "A_accuracy": 0.5, "A_mcc": 0.0221, "A_tp": 34, "A_fp": 24, "A_tn": 34, "A_fn": 44, "B_sharpe": -0.2074, "B_sortino": -0.213, "B_excess_sharpe": -4.2733, "B_return_pct": -10.11, "B_hit_rate": 47.79, "B_n": 136, "B_bh_sharpe": 4.0659, "B_bh_return_pct": 148.68, "B_psr": 0.4397, "B_ic": -0.0409, "B_precision": 0.6344, "B_recall": 0.6146, "B_f1": 0.6243, "B_f2": 0.6184, "B_accuracy": 0.4779, "B_mcc": -0.2307, "B_tp": 59, "B_fp": 34, "B_tn": 6, "B_fn": 37, "D_sharpe": 0.8079, "D_sortino": 0.8765, "D_excess_sharpe": -0.9248, "D_return_pct": 8.15, "D_hit_rate": 49.63, "D_n": 136, "D_bh_sharpe": 1.7327, "D_bh_return_pct": 19.75, "D_psr": 0.724, "D_ic": 0.0216, "D_precision": 0.5862, "D_recall": 0.4359, "D_f1": 0.5, "D_f2": 0.4595, "D_accuracy": 0.5, "D_mcc": 0.0221, "D_tp": 34, "D_fp": 24, "D_tn": 34, "D_fn": 44, "sharpe": 0.8079, "sortino": 0.8765, "return_pct": 8.15, "equity": 1081.5, "max_dd": 0.0, "win_rate": 49.63, "profit_factor": 0.0, "ic": 0.0216, "hit": 49.63, "psr": 0.724, "bh_sharpe": 1.7327, "bh_return_pct": 19.75, "excess_sharpe": -0.9248, "precision": 0.5862, "recall": 0.4359, "f1": 0.5, "f2": 0.4595, "mcc": 0.0221, "accuracy": 0.5, "tp": 34, "fp": 24, "tn": 34, "fn": 44}, {"fold": "fold_3", "regime": "Taper tantrum and 2014 H1", "n": 178, "A_sharpe": 1.2877, "A_sortino": 1.2081, "A_excess_sharpe": -0.0568, "A_return_pct": 11.83, "A_hit_rate": 58.19, "A_n": 178, "A_bh_sharpe": 1.3445, "A_bh_return_pct": 12.41, "A_psr": 0.8575, "A_ic": -0.0091, "A_precision": 0.6014, "A_recall": 0.8058, "A_f1": 0.6888, "A_f2": 0.7545, "A_accuracy": 0.5787, "A_mcc": 0.0858, "A_tp": 83, "A_fp": 55, "A_tn": 20, "A_fn": 20, "B_sharpe": 3.7182, "B_sortino": 4.7453, "B_excess_sharpe": 0.6699, "B_return_pct": 93.49, "B_hit_rate": 52.81, "B_n": 178, "B_bh_sharpe": 3.0483, "B_bh_return_pct": 71.83, "B_psr": 0.9994, "B_ic": 0.2615, "B_precision": 0.6238, "B_recall": 0.578, "B_f1": 0.6, "B_f2": 0.5866, "B_accuracy": 0.5281, "B_mcc": 0.0268, "B_tp": 63, "B_fp": 38, "B_tn": 31, "B_fn": 46, "D_sharpe": 1.2877, "D_sortino": 1.2081, "D_excess_sharpe": -0.0568, "D_return_pct": 11.83, "D_hit_rate": 58.19, "D_n": 178, "D_bh_sharpe": 1.3445, "D_bh_return_pct": 12.41, "D_psr": 0.8575, "D_ic": -0.0091, "D_precision": 0.6014, "D_recall": 0.8058, "D_f1": 0.6888, "D_f2": 0.7545, "D_accuracy": 0.5787, "D_mcc": 0.0858, "D_tp": 83, "D_fp": 55, "D_tn": 20, "D_fn": 20, "sharpe": 1.2877, "sortino": 1.2081, "return_pct": 11.83, "equity": 1118.3000000000002, "max_dd": 0.0, "win_rate": 58.19, "profit_factor": 0.0, "ic": -0.0091, "hit": 58.19, "psr": 0.8575, "bh_sharpe": 1.3445, "bh_return_pct": 12.41, "excess_sharpe": -0.0568, "precision": 0.6014, "recall": 0.8058, "f1": 0.6888, "f2": 0.7545, "mcc": 0.0858, "accuracy": 0.5787, "tp": 83, "fp": 55, "tn": 20, "fn": 20}, {"fold": "fold_4", "regime": "China devaluation and oil crash", "n": 157, "A_sharpe": 1.9149, "A_sortino": 2.0078, "A_excess_sharpe": 1.9051, "A_return_pct": 24.38, "A_hit_rate": 53.21, "A_n": 157, "A_bh_sharpe": 0.0098, "A_bh_return_pct": -1.05, "A_psr": 0.932, "A_ic": 0.1394, "A_precision": 0.534, "A_recall": 0.679, "A_f1": 0.5978, "A_f2": 0.644, "A_accuracy": 0.5287, "A_mcc": 0.0499, "A_tp": 55, "A_fp": 48, "A_tn": 28, "A_fn": 26, "B_sharpe": 3.5999, "B_sortino": 3.7093, "B_excess_sharpe": 3.584, "B_return_pct": 146.32, "B_hit_rate": 59.87, "B_n": 157, "B_bh_sharpe": 0.0159, "B_bh_return_pct": -5.48, "B_psr": 0.9971, "B_ic": 0.3461, "B_precision": 0.5887, "B_recall": 0.8588, "B_f1": 0.6986, "B_f2": 0.7866, "B_accuracy": 0.5987, "B_mcc": 0.184, "B_tp": 73, "B_fp": 51, "B_tn": 21, "B_fn": 12, "D_sharpe": 1.9149, "D_sortino": 2.0078, "D_excess_sharpe": 1.9051, "D_return_pct": 24.38, "D_hit_rate": 53.21, "D_n": 157, "D_bh_sharpe": 0.0098, "D_bh_return_pct": -1.05, "D_psr": 0.932, "D_ic": 0.1394, "D_precision": 0.534, "D_recall": 0.679, "D_f1": 0.5978, "D_f2": 0.644, "D_accuracy": 0.5287, "D_mcc": 0.0499, "D_tp": 55, "D_fp": 48, "D_tn": 28, "D_fn": 26, "sharpe": 1.9149, "sortino": 2.0078, "return_pct": 24.38, "equity": 1243.8, "max_dd": 0.0, "win_rate": 53.21, "profit_factor": 0.0, "ic": 0.1394, "hit": 53.21, "psr": 0.932, "bh_sharpe": 0.0098, "bh_return_pct": -1.05, "excess_sharpe": 1.9051, "precision": 0.534, "recall": 0.679, "f1": 0.5978, "f2": 0.644, "mcc": 0.0499, "accuracy": 0.5287, "tp": 55, "fp": 48, "tn": 28, "fn": 26}, {"fold": "fold_5", "regime": "2018 Vol-mageddon + Q4 sell-off", "n": 177, "A_sharpe": 3.0118, "A_sortino": 3.581, "A_excess_sharpe": 2.702, "A_return_pct": 58.43, "A_hit_rate": 57.06, "A_n": 177, "A_bh_sharpe": 0.3098, "A_bh_return_pct": 3.19, "A_psr": 0.9959, "A_ic": 0.2017, "A_precision": 0.6195, "A_recall": 0.6796, "A_f1": 0.6481, "A_f2": 0.6667, "A_accuracy": 0.5706, "A_mcc": 0.1012, "A_tp": 70, "A_fp": 43, "A_tn": 31, "A_fn": 33, "B_sharpe": 0.5489, "B_sortino": 0.4958, "B_excess_sharpe": -0.3428, "B_return_pct": 10.81, "B_hit_rate": 56.82, "B_n": 177, "B_bh_sharpe": 0.8917, "B_bh_return_pct": 23.8, "B_psr": 0.6757, "B_ic": 0.0839, "B_precision": 0.6176, "B_recall": 0.7706, "B_f1": 0.6857, "B_f2": 0.7343, "B_accuracy": 0.565, "B_mcc": 0.0068, "B_tp": 84, "B_fp": 52, "B_tn": 16, "B_fn": 25, "D_sharpe": 3.0118, "D_sortino": 3.581, "D_excess_sharpe": 2.702, "D_return_pct": 58.43, "D_hit_rate": 57.06, "D_n": 177, "D_bh_sharpe": 0.3098, "D_bh_return_pct": 3.19, "D_psr": 0.9959, "D_ic": 0.2017, "D_precision": 0.6195, "D_recall": 0.6796, "D_f1": 0.6481, "D_f2": 0.6667, "D_accuracy": 0.5706, "D_mcc": 0.1012, "D_tp": 70, "D_fp": 43, "D_tn": 31, "D_fn": 33, "sharpe": 3.0118, "sortino": 3.581, "return_pct": 58.43, "equity": 1584.3, "max_dd": 0.0, "win_rate": 57.06, "profit_factor": 0.0, "ic": 0.2017, "hit": 57.06, "psr": 0.9959, "bh_sharpe": 0.3098, "bh_return_pct": 3.19, "excess_sharpe": 2.702, "precision": 0.6195, "recall": 0.6796, "f1": 0.6481, "f2": 0.6667, "mcc": 0.1012, "accuracy": 0.5706, "tp": 70, "fp": 43, "tn": 31, "fn": 33}, {"fold": "fold_6", "regime": "COVID crash and V-recovery", "n": 222, "A_sharpe": 1.3866, "A_sortino": 1.5338, "A_excess_sharpe": 0.4978, "A_return_pct": 48.97, "A_hit_rate": 53.6, "A_n": 222, "A_bh_sharpe": 0.8888, "A_bh_return_pct": 26.13, "A_psr": 0.9084, "A_ic": 0.1048, "A_precision": 0.6357, "A_recall": 0.5942, "A_f1": 0.6142, "A_f2": 0.6021, "A_accuracy": 0.536, "A_mcc": 0.0341, "A_tp": 82, "A_fp": 47, "A_tn": 37, "A_fn": 56, "B_sharpe": -0.0093, "B_sortino": -0.009, "B_excess_sharpe": -2.3978, "B_return_pct": -20.04, "B_hit_rate": 50.23, "B_n": 222, "B_bh_sharpe": 2.3884, "B_bh_return_pct": 243.18, "B_psr": 0.4965, "B_ic": 0.095, "B_precision": 0.6452, "B_recall": 0.438, "B_f1": 0.5217, "B_f2": 0.468, "B_accuracy": 0.5045, "B_mcc": 0.049, "B_tp": 60, "B_fp": 33, "B_tn": 52, "B_fn": 77, "D_sharpe": 1.3866, "D_sortino": 1.5338, "D_excess_sharpe": 0.4978, "D_return_pct": 48.97, "D_hit_rate": 53.6, "D_n": 222, "D_bh_sharpe": 0.8888, "D_bh_return_pct": 26.13, "D_psr": 0.9084, "D_ic": 0.1048, "D_precision": 0.6357, "D_recall": 0.5942, "D_f1": 0.6142, "D_f2": 0.6021, "D_accuracy": 0.536, "D_mcc": 0.0341, "D_tp": 82, "D_fp": 47, "D_tn": 37, "D_fn": 56, "sharpe": 1.3866, "sortino": 1.5338, "return_pct": 48.97, "equity": 1489.7, "max_dd": 0.0, "win_rate": 53.6, "profit_factor": 0.0, "ic": 0.1048, "hit": 53.6, "psr": 0.9084, "bh_sharpe": 0.8888, "bh_return_pct": 26.13, "excess_sharpe": 0.4978, "precision": 0.6357, "recall": 0.5942, "f1": 0.6142, "f2": 0.6021, "mcc": 0.0341, "accuracy": 0.536, "tp": 82, "fp": 47, "tn": 37, "fn": 56}, {"fold": "fold_7", "regime": "Inflation bear, AI rally and 2025", "n": 425, "A_sharpe": 0.3184, "A_sortino": 0.322, "A_excess_sharpe": -0.6531, "A_return_pct": 8.02, "A_hit_rate": 52.94, "A_n": 425, "A_bh_sharpe": 0.9715, "A_bh_return_pct": 37.12, "A_psr": 0.6615, "A_ic": 0.0245, "A_precision": 0.585, "A_recall": 0.688, "A_f1": 0.6324, "A_f2": 0.6646, "A_accuracy": 0.5294, "A_mcc": -0.0097, "A_tp": 172, "A_fp": 122, "A_tn": 53, "A_fn": 78, "B_sharpe": 0.3024, "B_sortino": 0.2982, "B_excess_sharpe": -2.2003, "B_return_pct": 5.84, "B_hit_rate": 51.18, "B_n": 425, "B_bh_sharpe": 2.5027, "B_bh_return_pct": 458.83, "B_psr": 0.6523, "B_ic": 0.0078, "B_precision": 0.6211, "B_recall": 0.5361, "B_f1": 0.5755, "B_f2": 0.5512, "B_accuracy": 0.5106, "B_mcc": 0.0051, "B_tp": 141, "B_fp": 86, "B_tn": 76, "B_fn": 122, "D_sharpe": 0.3184, "D_sortino": 0.322, "D_excess_sharpe": -0.6531, "D_return_pct": 8.02, "D_hit_rate": 52.94, "D_n": 425, "D_bh_sharpe": 0.9715, "D_bh_return_pct": 37.12, "D_psr": 0.6615, "D_ic": 0.0245, "D_precision": 0.585, "D_recall": 0.688, "D_f1": 0.6324, "D_f2": 0.6646, "D_accuracy": 0.5294, "D_mcc": -0.0097, "D_tp": 172, "D_fp": 122, "D_tn": 53, "D_fn": 78, "sharpe": 0.3184, "sortino": 0.322, "return_pct": 8.02, "equity": 1080.2, "max_dd": 0.0, "win_rate": 52.94, "profit_factor": 0.0, "ic": 0.0245, "hit": 52.94, "psr": 0.6615, "bh_sharpe": 0.9715, "bh_return_pct": 37.12, "excess_sharpe": -0.6531, "precision": 0.585, "recall": 0.688, "f1": 0.6324, "f2": 0.6646, "mcc": -0.0097, "accuracy": 0.5294, "tp": 172, "fp": 122, "tn": 53, "fn": 78}], "per_window_val": [{"fold": "fold_1", "regime": "GFC peak crash (Lehman + Mar-2009 bottom)", "n": 104, "A_sharpe": 0.1433, "A_sortino": 0.1274, "A_excess_sharpe": 0.3105, "A_return_pct": -0.08, "A_hit_rate": 52.94, "A_n": 104, "A_bh_sharpe": -0.1672, "A_bh_return_pct": -3.81, "A_psr": 0.5363, "A_ic": 0.0129, "A_precision": 0.54, "A_recall": 0.5, "A_f1": 0.5192, "A_f2": 0.5075, "A_accuracy": 0.5192, "A_mcc": 0.04, "A_tp": 27, "A_fp": 23, "A_tn": 27, "A_fn": 27, "B_sharpe": -0.9693, "B_sortino": -0.8096, "B_excess_sharpe": 1.3048, "B_return_pct": -24.98, "B_hit_rate": 53.4, "B_n": 104, "B_bh_sharpe": -2.2741, "B_bh_return_pct": -44.12, "B_psr": 0.2622, "B_ic": -0.0796, "B_precision": 0.5172, "B_recall": 0.8654, "B_f1": 0.6475, "B_f2": 0.7627, "B_accuracy": 0.5288, "B_mcc": 0.078, "B_tp": 45, "B_fp": 42, "B_tn": 10, "B_fn": 7, "D_sharpe": 0.1433, "D_sortino": 0.1274, "D_excess_sharpe": 0.3105, "D_return_pct": -0.08, "D_hit_rate": 52.94, "D_n": 104, "D_bh_sharpe": -0.1672, "D_bh_return_pct": -3.81, "D_psr": 0.5363, "D_ic": 0.0129, "D_precision": 0.54, "D_recall": 0.5, "D_f1": 0.5192, "D_f2": 0.5075, "D_accuracy": 0.5192, "D_mcc": 0.04, "D_tp": 27, "D_fp": 23, "D_tn": 27, "D_fn": 27, "sharpe": 0.1433, "sortino": 0.1274, "return_pct": -0.08, "equity": 999.1999999999999, "max_dd": 0.0, "win_rate": 52.94, "profit_factor": 0.0, "ic": 0.0129, "hit": 52.94, "psr": 0.5363, "bh_sharpe": -0.1672, "bh_return_pct": -3.81, "excess_sharpe": 0.3105, "precision": 0.54, "recall": 0.5, "f1": 0.5192, "f2": 0.5075, "mcc": 0.04, "accuracy": 0.5192, "tp": 27, "fp": 23, "tn": 27, "fn": 27}, {"fold": "fold_2", "regime": "2011 US-downgrade + EU debt", "n": 96, "A_sharpe": 0.2527, "A_sortino": 0.2826, "A_excess_sharpe": 0.5269, "A_return_pct": 1.22, "A_hit_rate": 45.26, "A_n": 96, "A_bh_sharpe": -0.2741, "A_bh_return_pct": -4.09, "A_psr": 0.5618, "A_ic": -0.0165, "A_precision": 0.4776, "A_recall": 0.64, "A_f1": 0.547, "A_f2": 0.5993, "A_accuracy": 0.4479, "A_mcc": -0.1315, "A_tp": 32, "A_fp": 35, "A_tn": 11, "A_fn": 18, "B_sharpe": 0.4159, "B_sortino": 0.4151, "B_excess_sharpe": 1.4433, "B_return_pct": 2.68, "B_hit_rate": 47.92, "B_n": 96, "B_bh_sharpe": -1.0274, "B_bh_return_pct": -25.58, "B_psr": 0.6001, "B_ic": 0.0959, "B_precision": 0.4598, "B_recall": 0.9302, "B_f1": 0.6154, "B_f2": 0.7722, "B_accuracy": 0.4792, "B_mcc": 0.0741, "B_tp": 40, "B_fp": 47, "B_tn": 6, "B_fn": 3, "D_sharpe": 0.2527, "D_sortino": 0.2826, "D_excess_sharpe": 0.5269, "D_return_pct": 1.22, "D_hit_rate": 45.26, "D_n": 96, "D_bh_sharpe": -0.2741, "D_bh_return_pct": -4.09, "D_psr": 0.5618, "D_ic": -0.0165, "D_precision": 0.4776, "D_recall": 0.64, "D_f1": 0.547, "D_f2": 0.5993, "D_accuracy": 0.4479, "D_mcc": -0.1315, "D_tp": 32, "D_fp": 35, "D_tn": 11, "D_fn": 18, "sharpe": 0.2527, "sortino": 0.2826, "return_pct": 1.22, "equity": 1012.2, "max_dd": 0.0, "win_rate": 45.26, "profit_factor": 0.0, "ic": -0.0165, "hit": 45.26, "psr": 0.5618, "bh_sharpe": -0.2741, "bh_return_pct": -4.09, "excess_sharpe": 0.5269, "precision": 0.4776, "recall": 0.64, "f1": 0.547, "f2": 0.5993, "mcc": -0.1315, "accuracy": 0.4479, "tp": 32, "fp": 35, "tn": 11, "fn": 18}, {"fold": "fold_3", "regime": "Taper tantrum and 2014 H1", "n": 54, "A_sharpe": 2.0327, "A_sortino": 1.9774, "A_excess_sharpe": -2.6671, "A_return_pct": 4.48, "A_hit_rate": 57.41, "A_n": 54, "A_bh_sharpe": 4.6998, "A_bh_return_pct": 10.46, "A_psr": 0.8191, "A_ic": 0.0002, "A_precision": 0.6136, "A_recall": 0.8182, "A_f1": 0.7013, "A_f2": 0.767, "A_accuracy": 0.5741, "A_mcc": 0.0109, "A_tp": 27, "A_fp": 17, "A_tn": 4, "A_fn": 6, "B_sharpe": 0.6323, "B_sortino": 0.6541, "B_excess_sharpe": -8.4003, "B_return_pct": 2.68, "B_hit_rate": 50.0, "B_n": 54, "B_bh_sharpe": 9.0326, "B_bh_return_pct": 49.18, "B_psr": 0.614, "B_ic": 0.0496, "B_precision": 0.6786, "B_recall": 0.5135, "B_f1": 0.5846, "B_f2": 0.5398, "B_accuracy": 0.5, "B_mcc": -0.0148, "B_tp": 19, "B_fp": 9, "B_tn": 8, "B_fn": 18, "D_sharpe": 2.0327, "D_sortino": 1.9774, "D_excess_sharpe": -2.6671, "D_return_pct": 4.48, "D_hit_rate": 57.41, "D_n": 54, "D_bh_sharpe": 4.6998, "D_bh_return_pct": 10.46, "D_psr": 0.8191, "D_ic": 0.0002, "D_precision": 0.6136, "D_recall": 0.8182, "D_f1": 0.7013, "D_f2": 0.767, "D_accuracy": 0.5741, "D_mcc": 0.0109, "D_tp": 27, "D_fp": 17, "D_tn": 4, "D_fn": 6, "sharpe": 2.0327, "sortino": 1.9774, "return_pct": 4.48, "equity": 1044.8, "max_dd": 0.0, "win_rate": 57.41, "profit_factor": 0.0, "ic": 0.0002, "hit": 57.41, "psr": 0.8191, "bh_sharpe": 4.6998, "bh_return_pct": 10.46, "excess_sharpe": -2.6671, "precision": 0.6136, "recall": 0.8182, "f1": 0.7013, "f2": 0.767, "mcc": 0.0109, "accuracy": 0.5741, "tp": 27, "fp": 17, "tn": 4, "fn": 6}, {"fold": "fold_4", "regime": "China devaluation and oil crash", "n": 96, "A_sharpe": 0.9202, "A_sortino": 0.9764, "A_excess_sharpe": 1.3443, "A_return_pct": 6.2, "A_hit_rate": 48.42, "A_n": 96, "A_bh_sharpe": -0.4241, "A_bh_return_pct": -3.73, "A_psr": 0.7136, "A_ic": 0.0307, "A_precision": 0.4722, "A_recall": 0.7556, "A_f1": 0.5812, "A_f2": 0.6746, "A_accuracy": 0.4896, "A_mcc": 0.0121, "A_tp": 34, "A_fp": 38, "A_tn": 13, "A_fn": 11, "B_sharpe": -2.1807, "B_sortino": -1.7841, "B_excess_sharpe": -0.9964, "B_return_pct": -33.54, "B_hit_rate": 48.96, "B_n": 96, "B_bh_sharpe": -1.1843, "B_bh_return_pct": -21.44, "B_psr": 0.068, "B_ic": 0.0302, "B_precision": 0.4805, "B_recall": 0.8043, "B_f1": 0.6016, "B_f2": 0.7088, "B_accuracy": 0.4896, "B_mcc": 0.0055, "B_tp": 37, "B_fp": 40, "B_tn": 10, "B_fn": 9, "D_sharpe": 0.9202, "D_sortino": 0.9764, "D_excess_sharpe": 1.3443, "D_return_pct": 6.2, "D_hit_rate": 48.42, "D_n": 96, "D_bh_sharpe": -0.4241, "D_bh_return_pct": -3.73, "D_psr": 0.7136, "D_ic": 0.0307, "D_precision": 0.4722, "D_recall": 0.7556, "D_f1": 0.5812, "D_f2": 0.6746, "D_accuracy": 0.4896, "D_mcc": 0.0121, "D_tp": 34, "D_fp": 38, "D_tn": 13, "D_fn": 11, "sharpe": 0.9202, "sortino": 0.9764, "return_pct": 6.2, "equity": 1062.0, "max_dd": 0.0, "win_rate": 48.42, "profit_factor": 0.0, "ic": 0.0307, "hit": 48.42, "psr": 0.7136, "bh_sharpe": -0.4241, "bh_return_pct": -3.73, "excess_sharpe": 1.3443, "precision": 0.4722, "recall": 0.7556, "f1": 0.5812, "f2": 0.6746, "mcc": 0.0121, "accuracy": 0.4896, "tp": 34, "fp": 38, "tn": 13, "fn": 11}, {"fold": "fold_5", "regime": "2018 Vol-mageddon + Q4 sell-off", "n": 54, "A_sharpe": -0.7332, "A_sortino": -0.6799, "A_excess_sharpe": -2.1612, "A_return_pct": -2.27, "A_hit_rate": 50.0, "A_n": 54, "A_bh_sharpe": 1.428, "A_bh_return_pct": 3.97, "A_psr": 0.3675, "A_ic": -0.0235, "A_precision": 0.5278, "A_recall": 0.6552, "A_f1": 0.5846, "A_f2": 0.625, "A_accuracy": 0.5, "A_mcc": -0.0263, "A_tp": 19, "A_fp": 17, "A_tn": 8, "A_fn": 10, "B_sharpe": -1.6278, "B_sortino": -1.3836, "B_excess_sharpe": -6.56, "B_return_pct": -11.01, "B_hit_rate": 53.7, "B_n": 54, "B_bh_sharpe": 4.9322, "B_bh_return_pct": 34.93, "B_psr": 0.2249, "B_ic": -0.1103, "B_precision": 0.65, "B_recall": 0.7027, "B_f1": 0.6753, "B_f2": 0.6915, "B_accuracy": 0.537, "B_mcc": -0.1281, "B_tp": 26, "B_fp": 14, "B_tn": 3, "B_fn": 11, "D_sharpe": -0.7332, "D_sortino": -0.6799, "D_excess_sharpe": -2.1612, "D_return_pct": -2.27, "D_hit_rate": 50.0, "D_n": 54, "D_bh_sharpe": 1.428, "D_bh_return_pct": 3.97, "D_psr": 0.3675, "D_ic": -0.0235, "D_precision": 0.5278, "D_recall": 0.6552, "D_f1": 0.5846, "D_f2": 0.625, "D_accuracy": 0.5, "D_mcc": -0.0263, "D_tp": 19, "D_fp": 17, "D_tn": 8, "D_fn": 10, "sharpe": -0.7332, "sortino": -0.6799, "return_pct": -2.27, "equity": 977.3, "max_dd": 0.0, "win_rate": 50.0, "profit_factor": 0.0, "ic": -0.0235, "hit": 50.0, "psr": 0.3675, "bh_sharpe": 1.428, "bh_return_pct": 3.97, "excess_sharpe": -2.1612, "precision": 0.5278, "recall": 0.6552, "f1": 0.5846, "f2": 0.625, "mcc": -0.0263, "accuracy": 0.5, "tp": 19, "fp": 17, "tn": 8, "fn": 10}, {"fold": "fold_6", "regime": "COVID crash and V-recovery", "n": 75, "A_sharpe": 5.0428, "A_sortino": 5.1899, "A_excess_sharpe": 0.7434, "A_return_pct": 17.22, "A_hit_rate": 65.33, "A_n": 75, "A_bh_sharpe": 4.2994, "A_bh_return_pct": 14.68, "A_psr": 0.9951, "A_ic": 0.1824, "A_precision": 0.7049, "A_recall": 0.8431, "A_f1": 0.7679, "A_f2": 0.8113, "A_accuracy": 0.6533, "A_mcc": 0.1115, "A_tp": 43, "A_fp": 18, "A_tn": 6, "A_fn": 8, "B_sharpe": -1.4764, "B_sortino": -1.5676, "B_excess_sharpe": -15.8103, "B_return_pct": -11.29, "B_hit_rate": 40.0, "B_n": 75, "B_bh_sharpe": 14.3339, "B_bh_return_pct": 120.13, "B_psr": 0.214, "B_ic": -0.035, "B_precision": 0.8214, "B_recall": 0.3651, "B_f1": 0.5055, "B_f2": 0.4107, "B_accuracy": 0.4, "B_mcc": -0.0391, "B_tp": 23, "B_fp": 5, "B_tn": 7, "B_fn": 40, "D_sharpe": 5.0428, "D_sortino": 5.1899, "D_excess_sharpe": 0.7434, "D_return_pct": 17.22, "D_hit_rate": 65.33, "D_n": 75, "D_bh_sharpe": 4.2994, "D_bh_return_pct": 14.68, "D_psr": 0.9951, "D_ic": 0.1824, "D_precision": 0.7049, "D_recall": 0.8431, "D_f1": 0.7679, "D_f2": 0.8113, "D_accuracy": 0.6533, "D_mcc": 0.1115, "D_tp": 43, "D_fp": 18, "D_tn": 6, "D_fn": 8, "sharpe": 5.0428, "sortino": 5.1899, "return_pct": 17.22, "equity": 1172.1999999999998, "max_dd": 0.0, "win_rate": 65.33, "profit_factor": 0.0, "ic": 0.1824, "hit": 65.33, "psr": 0.9951, "bh_sharpe": 4.2994, "bh_return_pct": 14.68, "excess_sharpe": 0.7434, "precision": 0.7049, "recall": 0.8431, "f1": 0.7679, "f2": 0.8113, "mcc": 0.1115, "accuracy": 0.6533, "tp": 43, "fp": 18, "tn": 6, "fn": 8}, {"fold": "fold_7", "regime": "Inflation bear, AI rally and 2025", "n": 114, "A_sharpe": -0.0459, "A_sortino": -0.0467, "A_excess_sharpe": -2.8909, "A_return_pct": -0.88, "A_hit_rate": 49.12, "A_n": 114, "A_bh_sharpe": 2.845, "A_bh_return_pct": 21.34, "A_psr": 0.4877, "A_ic": -0.1102, "A_precision": 0.5455, "A_recall": 0.806, "A_f1": 0.6506, "A_f2": 0.7357, "A_accuracy": 0.4912, "A_mcc": -0.2206, "A_tp": 54, "A_fp": 45, "A_tn": 2, "A_fn": 13, "B_sharpe": -0.5954, "B_sortino": -0.6647, "B_excess_sharpe": -6.732, "B_return_pct": -