{"experiment_num": 49, "backbone": "mamba", "description": "dMamba @ exp 48 NEW CHAMP seed=0 - multi-seed variance check (vs seed=42 +1.19)", "config": {"seq_len": 60, "lr": 0.0005, "batch_size": 32, "epochs": 100, "weight_decay": 0.1, "patience": 20, "warmup_epochs": 10, "head_dropout": 0.1, "huber_delta": 1.0, "grad_clip": 1.0, "seed": 0, "hidden_size": null, "num_layers": null, "max_depth": null, "gbm_lr": null, "n_estimators": null}, "composite": 0.698, "test_pos_folds": 6, "val_pos_folds": 5, "val_loss": -2.868855493258586, "elapsed_sec": 899.6, "timestamp": "2026-04-27T19:42:06", "sharpe": 0.798, "val_sharpe": 0.9257, "ic": 0.0437, "hit": 51.18, "psr": 0.9514, "equity": 1917.4, "return_pct": 91.74, "bh_sharpe": 1.2201, "bh_return_pct": 185.59, "excess_sharpe": -0.4221, "B_sharpe": 0.77, "B_excess_sharpe": -2.0685, "B_return_pct": 186.5, "D_sharpe": 0.798, "D_excess_sharpe": -0.4221, "D_return_pct": 91.74, "per_window": [{"fold": "fold_1", "regime": "GFC peak crash (Lehman + Mar-2009 bottom)", "n": 65, "A_sharpe": 0.0685, "A_sortino": 0.0748, "A_excess_sharpe": -0.3577, "A_return_pct": -1.15, "A_hit_rate": 47.69, "A_n": 65, "A_bh_sharpe": 0.4262, "A_bh_return_pct": 2.34, "A_psr": 0.5138, "A_ic": -0.0333, "B_sharpe": -1.0031, "B_sortino": -1.0587, "B_excess_sharpe": -2.8908, "B_return_pct": -24.03, "B_hit_rate": 42.19, "B_n": 65, "B_bh_sharpe": 1.8877, "B_bh_return_pct": 34.48, "B_psr": 0.3077, "B_ic": -0.1078, "D_sharpe": 0.0685, "D_sortino": 0.0748, "D_excess_sharpe": -0.3577, "D_return_pct": -1.15, "D_hit_rate": 47.69, "D_n": 65, "D_bh_sharpe": 0.4262, "D_bh_return_pct": 2.34, "D_psr": 0.5138, "D_ic": -0.0333, "sharpe": 0.0685, "sortino": 0.0748, "return_pct": -1.15, "equity": 988.5, "max_dd": 0.0, "win_rate": 47.69, "profit_factor": 0.0, "ic": -0.0333, "hit": 47.69, "psr": 0.5138, "bh_sharpe": 0.4262, "bh_return_pct": 2.34, "excess_sharpe": -0.3577, "precision": 0.5, "recall": 0.5588, "f1": 0.5278, "f2": 0.546, "accuracy": 0.4769, "mcc": -0.0548, "tp": 19, "fp": 19, "tn": 12, "fn": 15, "A_precision": 0.5, "A_recall": 0.5588, "A_f1": 0.5278, "A_f2": 0.546, "A_accuracy": 0.4769, "A_mcc": -0.0548, "A_tp": 19, "A_fp": 19, "A_tn": 12, "A_fn": 15}, {"fold": "fold_2", "regime": "2011 US-downgrade + EU debt", "n": 86, "A_sharpe": 4.1187, "A_sortino": 5.1902, "A_excess_sharpe": -0.7496, "A_return_pct": 23.4, "A_hit_rate": 58.82, "A_n": 86, "A_bh_sharpe": 4.8682, "A_bh_return_pct": 27.91, "A_psr": 0.9957, "A_ic": 0.0812, "B_sharpe": 3.9046, "B_sortino": 4.0389, "B_excess_sharpe": -7.4145, "B_return_pct": 52.48, "B_hit_rate": 62.79, "B_n": 86, "B_bh_sharpe": 11.3191, "B_bh_return_pct": 186.84, "B_psr": 0.9886, "B_ic": 0.0717, "D_sharpe": 4.1187, "D_sortino": 5.1902, "D_excess_sharpe": -0.7496, "D_return_pct": 23.4, "D_hit_rate": 58.82, "D_n": 86, "D_bh_sharpe": 4.8682, "D_bh_return_pct": 27.91, "D_psr": 0.9957, "D_ic": 0.0812, "sharpe": 4.1187, "sortino": 5.1902, "return_pct": 23.4, "equity": 1234.0, "max_dd": 0.0, "win_rate": 58.82, "profit_factor": 0.0, "ic": 0.0812, "hit": 58.82, "psr": 0.9957, "bh_sharpe": 4.8682, "bh_return_pct": 27.91, "excess_sharpe": -0.7496, "precision": 0.6349, "recall": 0.7547, "f1": 0.6897, "f2": 0.7273, "accuracy": 0.5814, "mcc": 0.0634, "tp": 40, "fp": 23, "tn": 10, "fn": 13, "A_precision": 0.6349, "A_recall": 0.7547, "A_f1": 0.6897, "A_f2": 0.7273, "A_accuracy": 0.5814, "A_mcc": 0.0634, "A_tp": 40, "A_fp": 23, "A_tn": 10, "A_fn": 13}, {"fold": "fold_3", "regime": "Taper tantrum and 2014 H1", "n": 128, "A_sharpe": 2.0552, "A_sortino": 2.5265, "A_excess_sharpe": -0.0038, "A_return_pct": 13.57, "A_hit_rate": 49.61, "A_n": 128, "A_bh_sharpe": 2.0589, "A_bh_return_pct": 13.6, "A_psr": 0.9356, "A_ic": 0.1498, "B_sharpe": -2.2548, "B_sortino": -2.3461, "B_excess_sharpe": -6.7664, "B_return_pct": -25.11, "B_hit_rate": 39.84, "B_n": 128, "B_bh_sharpe": 4.5116, "B_bh_return_pct": 67.92, "B_psr": 0.0592, "B_ic": -0.101, "D_sharpe": 2.0552, "D_sortino": 2.5265, "D_excess_sharpe": -0.0038, "D_return_pct": 13.57, "D_hit_rate": 49.61, "D_n": 128, "D_bh_sharpe": 2.0589, "D_bh_return_pct": 13.6, "D_psr": 0.9356, "D_ic": 0.1498, "sharpe": 2.0552, "sortino": 2.5265, "return_pct": 13.57, "equity": 1135.6999999999998, "max_dd": 0.0, "win_rate": 49.61, "profit_factor": 0.0, "ic": 0.1498, "hit": 49.61, "psr": 0.9356, "bh_sharpe": 2.0589, "bh_return_pct": 13.6, "excess_sharpe": -0.0038, "precision": 0.6207, "recall": 0.4615, "f1": 0.5294, "f2": 0.4865, "accuracy": 0.5, "mcc": 0.0211, "tp": 36, "fp": 22, "tn": 28, "fn": 42, "A_precision": 0.6207, "A_recall": 0.4615, "A_f1": 0.5294, "A_f2": 0.4865, "A_accuracy": 0.5, "A_mcc": 0.0211, "A_tp": 36, "A_fp": 22, "A_tn": 28, "A_fn": 42}, {"fold": "fold_4", "regime": "China devaluation and oil crash", "n": 107, "A_sharpe": -1.7026, "A_sortino": -1.4957, "A_excess_sharpe": -0.8994, "A_return_pct": -14.47, "A_hit_rate": 50.0, "A_n": 107, "A_bh_sharpe": -0.8032, "A_bh_return_pct": -7.58, "A_psr": 0.13, "A_ic": 0.0274, "B_sharpe": 1.9688, "B_sortino": 2.0622, "B_excess_sharpe": 3.9283, "B_return_pct": 38.48, "B_hit_rate": 54.21, "B_n": 107, "B_bh_sharpe": -1.9596, "B_bh_return_pct": -33.47, "B_psr": 0.8983, "B_ic": 0.2058, "D_sharpe": -1.7026, "D_sortino": -1.4957, "D_excess_sharpe": -0.8994, "D_return_pct": -14.47, "D_hit_rate": 50.0, "D_n": 107, "D_bh_sharpe": -0.8032, "D_bh_return_pct": -7.58, "D_psr": 0.13, "D_ic": 0.0274, "sharpe": -1.7026, "sortino": -1.4957, "return_pct": -14.47, "equity": 855.3, "max_dd": 0.0, "win_rate": 50.0, "profit_factor": 0.0, "ic": 0.0274, "hit": 50.0, "psr": 0.13, "bh_sharpe": -0.8032, "bh_return_pct": -7.58, "excess_sharpe": -0.8994, "precision": 0.4932, "recall": 0.6923, "f1": 0.576, "f2": 0.6406, "accuracy": 0.5047, "mcc": 0.021, "tp": 36, "fp": 37, "tn": 18, "fn": 16, "A_precision": 0.4932, "A_recall": 0.6923, "A_f1": 0.576, "A_f2": 0.6406, "A_accuracy": 0.5047, "A_mcc": 0.021, "A_tp": 36, "A_fp": 37, "A_tn": 18, "A_fn": 16}, {"fold": "fold_5", "regime": "2018 Vol-mageddon + Q4 sell-off", "n": 127, "A_sharpe": 1.6207, "A_sortino": 2.0126, "A_excess_sharpe": 0.4377, "A_return_pct": 19.6, "A_hit_rate": 48.03, "A_n": 127, "A_bh_sharpe": 1.183, "A_bh_return_pct": 13.55, "A_psr": 0.8827, "A_ic": 0.1092, "B_sharpe": 0.9256, "B_sortino": 1.0248, "B_excess_sharpe": -1.98, "B_return_pct": 17.68, "B_hit_rate": 47.62, "B_n": 127, "B_bh_sharpe": 2.9056, "B_bh_return_pct": 85.51, "B_psr": 0.7441, "B_ic": 0.2477, "D_sharpe": 1.6207, "D_sortino": 2.0126, "D_excess_sharpe": 0.4377, "D_return_pct": 19.6, "D_hit_rate": 48.03, "D_n": 127, "D_bh_sharpe": 1.183, "D_bh_return_pct": 13.55, "D_psr": 0.8827, "D_ic": 0.1092, "sharpe": 1.6207, "sortino": 2.0126, "return_pct": 19.6, "equity": 1196.0, "max_dd": 0.0, "win_rate": 48.03, "profit_factor": 0.0, "ic": 0.1092, "hit": 48.03, "psr": 0.8827, "bh_sharpe": 1.183, "bh_return_pct": 13.55, "excess_sharpe": 0.4377, "precision": 0.625, "recall": 0.3846, "f1": 0.4762, "f2": 0.4167, "accuracy": 0.4803, "mcc": 0.0173, "tp": 30, "fp": 18, "tn": 31, "fn": 48, "A_precision": 0.625, "A_recall": 0.3846, "A_f1": 0.4762, "A_f2": 0.4167, "A_accuracy": 0.4803, "A_mcc": 0.0173, "A_tp": 30, "A_fp": 18, "A_tn": 31, "A_fn": 48}, {"fold": "fold_6", "regime": "COVID crash and V-recovery", "n": 172, "A_sharpe": 2.1011, "A_sortino": 2.3626, "A_excess_sharpe": -0.3265, "A_return_pct": 38.45, "A_hit_rate": 53.49, "A_n": 172, "A_bh_sharpe": 2.4276, "A_bh_return_pct": 45.89, "A_psr": 0.9607, "A_ic": 0.1247, "B_sharpe": 2.0536, "B_sortino": 2.3193, "B_excess_sharpe": -3.6584, "B_return_pct": 85.6, "B_hit_rate": 53.22, "B_n": 172, "B_bh_sharpe": 5.712, "B_bh_return_pct": 489.18, "B_psr": 0.9581, "B_ic": 0.1939, "D_sharpe": 2.1011, "D_sortino": 2.3626, "D_excess_sharpe": -0.3265, "D_return_pct": 38.45, "D_hit_rate": 53.49, "D_n": 172, "D_bh_sharpe": 2.4276, "D_bh_return_pct": 45.89, "D_psr": 0.9607, "D_ic": 0.1247, "sharpe": 2.1011, "sortino": 2.3626, "return_pct": 38.45, "equity": 1384.5, "max_dd": 0.0, "win_rate": 53.49, "profit_factor": 0.0, "ic": 0.1247, "hit": 53.49, "psr": 0.9607, "bh_sharpe": 2.4276, "bh_return_pct": 45.89, "excess_sharpe": -0.3265, "precision": 0.6941, "recall": 0.5221, "f1": 0.596, "f2": 0.5493, "accuracy": 0.5349, "mcc": 0.0773, "tp": 59, "fp": 26, "tn": 33, "fn": 54, "A_precision": 0.6941, "A_recall": 0.5221, "A_f1": 0.596, "A_f2": 0.5493, "A_accuracy": 0.5349, "A_mcc": 0.0773, "A_tp": 59, "A_fp": 26, "A_tn": 33, "A_fn": 54}, {"fold": "fold_7", "regime": "Inflation bear, AI rally and 2025", "n": 375, "A_sharpe": 0.0426, "A_sortino": 0.044, "A_excess_sharpe": -0.7478, "A_return_pct": -2.27, "A_hit_rate": 50.93, "A_n": 375, "A_bh_sharpe": 0.7905, "A_bh_return_pct": 25.44, "A_psr": 0.5207, "A_ic": -0.0088, "B_sharpe": 0.3595, "B_sortino": 0.3493, "B_excess_sharpe": -1.5742, "B_return_pct": 9.17, "B_hit_rate": 53.21, "B_n": 375, "B_bh_sharpe": 1.9338, "B_bh_return_pct": 221.94, "B_psr": 0.6694, "B_ic": -0.0071, "D_sharpe": 0.0426, "D_sortino": 0.044, "D_excess_sharpe": -0.7478, "D_return_pct": -2.27, "D_hit_rate": 50.93, "D_n": 375, "D_bh_sharpe": 0.7905, "D_bh_return_pct": 25.44, "D_psr": 0.5207, "D_ic": -0.0088, "sharpe": 0.0426, "sortino": 0.044, "return_pct": -2.27, "equity": 977.3, "max_dd": 0.0, "win_rate": 50.93, "profit_factor": 0.0, "ic": -0.0088, "hit": 50.93, "psr": 0.5207, "bh_sharpe": 0.7905, "bh_return_pct": 25.44, "excess_sharpe": -0.7478, "precision": 0.5744, "recall": 0.6318, "f1": 0.6017, "f2": 0.6194, "accuracy": 0.5093, "mcc": -0.0337, "tp": 139, "fp": 103, "tn": 52, "fn": 81, "A_precision": 0.5744, "A_recall": 0.6318, "A_f1": 0.6017, "A_f2": 0.6194, "A_accuracy": 0.5093, "A_mcc": -0.0337, "A_tp": 139, "A_fp": 103, "A_tn": 52, "A_fn": 81}], "per_window_val": [{"fold": "fold_1", "regime": "GFC peak crash (Lehman + Mar-2009 bottom)", "n": 37, "A_sharpe": 4.1385, "A_sortino": 4.8821, "A_excess_sharpe": 3.38, "A_return_pct": 15.67, "A_hit_rate": 57.14, "A_n": 37, "A_bh_sharpe": 0.7585, "A_bh_return_pct": 2.39, "A_psr": 0.947, "A_ic": 0.2448, "B_sharpe": 2.8734, "B_sortino": 3.9455, "B_excess_sharpe": 0.7288, "B_return_pct": 16.93, "B_hit_rate": 51.35, "B_n": 37, "B_bh_sharpe": 2.1447, "B_bh_return_pct": 12.13, "B_psr": 0.8785, "B_ic": 0.2065, "D_sharpe": 4.1385, "D_sortino": 4.8821, "D_excess_sharpe": 3.38, "D_return_pct": 15.67, "D_hit_rate": 57.14, "D_n": 37, "D_bh_sharpe": 0.7585, "D_bh_return_pct": 2.39, "D_psr": 0.947, "D_ic": 0.2448, "sharpe": 4.1385, "sortino": 4.8821, "return_pct": 15.67, "equity": 1156.7, "max_dd": 0.0, "win_rate": 57.14, "profit_factor": 0.0, "ic": 0.2448, "hit": 57.14, "psr": 0.947, "bh_sharpe": 0.7585, "bh_return_pct": 2.39, "excess_sharpe": 3.38}, {"fold": "fold_2", "regime": "2011 US-downgrade + EU debt", "n": 46, "A_sharpe": 1.0927, "A_sortino": 1.115, "A_excess_sharpe": 1.1466, "A_return_pct": 6.03, "A_hit_rate": 54.35, "A_n": 46, "A_bh_sharpe": -0.0539, "A_bh_return_pct": -1.46, "A_psr": 0.678, "A_ic": 0.0813, "B_sharpe": 1.1743, "B_sortino": 1.3627, "B_excess_sharpe": 2.7156, "B_return_pct": 11.66, "B_hit_rate": 47.83, "B_n": 46, "B_bh_sharpe": -1.5413, "B_bh_return_pct": -23.36, "B_psr": 0.6921, "B_ic": 0.2569, "D_sharpe": 1.0927, "D_sortino": 1.115, "D_excess_sharpe": 1.1466, "D_return_pct": 6.03, "D_hit_rate": 54.35, "D_n": 46, "D_bh_sharpe": -0.0539, "D_bh_return_pct": -1.46, "D_psr": 0.678, "D_ic": 0.0813, "sharpe": 1.0927, "sortino": 1.115, "return_pct": 6.03, "equity": 1060.3, "max_dd": 0.0, "win_rate": 54.35, "profit_factor": 0.0, "ic": 0.0813, "hit": 54.35, "psr": 0.678, "bh_sharpe": -0.0539, "bh_return_pct": -1.46, "excess_sharpe": 1.1466}, {"fold": "fold_3", "regime": "Taper tantrum and 2014 H1", "n": 4, "A_sharpe": 8.1652, "A_sortino": 8.617, "A_excess_sharpe": 1.8427, "A_return_pct": 0.0, "A_hit_rate": 0.0, "A_n": 4, "A_bh_sharpe": 6.3226, "A_bh_return_pct": 0.58, "A_psr": 0.8221, "A_ic": 0.8, "B_sharpe": 14.1626, "B_sortino": 32.5623, "B_excess_sharpe": 37.6039, "B_return_pct": 0.0, "B_hit_rate": 0.0, "B_n": 4, "B_bh_sharpe": -23.4413, "B_bh_return_pct": -3.13, "B_psr": 0.9725, "B_ic": 0.4, "D_sharpe": 8.1652, "D_sortino": 8.617, "D_excess_sharpe": 1.8427, "D_return_pct": 0.0, "D_hit_rate": 0.0, "D_n": 4, "D_bh_sharpe": 6.3226, "D_bh_return_pct": 0.58, "D_psr": 0.8221, "D_ic": 0.8, "sharpe": 8.1652, "sortino": 8.617, "return_pct": 0.0, "equity": 1000.0, "max_dd": 0.0, "win_rate": 0.0, "profit_factor": 0.0, "ic": 0.8, "hit": 0.0, "psr": 0.8221, "bh_sharpe": 6.3226, "bh_return_pct": 0.58, "excess_sharpe": 1.8427}, {"fold": "fold_4", "regime": "China devaluation and oil crash", "n": 46, "A_sharpe": 0.4747, "A_sortino": 0.4543, "A_excess_sharpe": 1.6769, "A_return_pct": 1.58, "A_hit_rate": 52.17, "A_n": 46, "A_bh_sharpe": -1.2022, "A_bh_return_pct": -5.68, "A_psr": 0.5792, "A_ic": 0.1051, "B_sharpe": 1.7245, "B_sortino": 1.5957, "B_excess_sharpe": 4.0363, "B_return_pct": 16.57, "B_hit_rate": 58.7, "B_n": 46, "B_bh_sharpe": -2.3118, "B_bh_return_pct": -24.51, "B_psr": 0.7619, "B_ic": 0.4707, "D_sharpe": 0.4747, "D_sortino": 0.4543, "D_excess_sharpe": 1.6769, "D_return_pct": 1.58, "D_hit_rate": 52.17, "D_n": 46, "D_bh_sharpe": -1.2022, "D_bh_return_pct": -5.68, "D_psr": 0.5792, "D_ic": 0.1051, "sharpe": 0.4747, "sortino": 0.4543, "return_pct": 1.58, "equity": 1015.8000000000001, "max_dd": 0.0, "win_rate": 52.17, "profit_factor": 0.0, "ic": 0.1051, "hit": 52.17, "psr": 0.5792, "bh_sharpe": -1.2022, "bh_return_pct": -5.68, "excess_sharpe": 1.6769}, {"fold": "fold_5", "regime": "2018 Vol-mageddon + Q4 sell-off", "n": 4, "A_sharpe": 7.4976, "A_sortino": 6.2036, "A_excess_sharpe": 22.2527, "A_return_pct": 0.0, "A_hit_rate": 0.0, "A_n": 4, "A_bh_sharpe": -14.7551, "A_bh_return_pct": -3.52, "A_psr": 0.7727, "A_ic": 0.8, "B_sharpe": 2.397, "B_sortino": 1.6958, "B_excess_sharpe": 0.2404, "B_return_pct": 0.0, "B_hit_rate": 0.0, "B_n": 4, "B_bh_sharpe": 2.1566, "B_bh_return_pct": 1.19, "B_psr": 0.6011, "B_ic": 0.6, "D_sharpe": 7.4976, "D_sortino": 6.2036, "D_excess_sharpe": 22.2527, "D_return_pct": 0.0, "D_hit_rate": 0.0, "D_n": 4, "D_bh_sharpe": -14.7551, "D_bh_return_pct": -3.52, "D_psr": 0.7727, "D_ic": 0.8, "sharpe": 7.4976, "sortino": 6.2036, "return_pct": 0.0, "equity": 1000.0, "max_dd": 0.0, "win_rate": 0.0, "profit_factor": 0.0, "ic": 0.8, "hit": 0.0, "psr": 0.7727, "bh_sharpe": -14.7551, "bh_return_pct": -3.52, "excess_sharpe": 22.2527}, {"fold": "fold_6", "regime": "COVID crash and V-recovery", "n": 25, "A_sharpe": -4.7756, "A_sortino": -4.1024, "A_excess_sharpe": -7.1894, "A_return_pct": -6.25, "A_hit_rate": 40.0, "A_n": 25, "A_bh_sharpe": 2.4138, "A_bh_return_pct": 3.27, "A_psr": 0.0646, "A_ic": -0.07, "B_sharpe": -6.0671, "B_sortino": -5.8593, "B_excess_sharpe": -18.6326, "B_return_pct": -15.61, "B_hit_rate": 28.0, "B_n": 25, "B_bh_sharpe": 12.5655, "B_bh_return_pct": 32.76, "B_psr": 0.0473, "B_ic": 0.0554, "D_sharpe": -4.7756, "D_sortino": -4.1024, "D_excess_sharpe": -7.1894, "D_return_pct": -6.25, "D_hit_rate": 40.0, "D_n": 25, "D_bh_sharpe": 2.4138, "D_bh_return_pct": 3.27, "D_psr": 0.0646, "D_ic": -0.07, "sharpe": -4.7756, "sortino": -4.1024, "return_pct": -6.25, "equity": 937.5, "max_dd": 0.0, "win_rate": 40.0, "profit_factor": 0.0, "ic": -0.07, "hit": 40.0, "psr": 0.0646, "bh_sharpe": 2.4138, "bh_return_pct": 3.27, "excess_sharpe": -7.1894}, {"fold": "fold_7", "regime": "Inflation bear, AI rally and 2025", "n": 64, "A_sharpe": -0.2107, "A_sortino": -0.2245, "A_excess_sharpe": -2.2515, "A_return_pct": -1.12, "A_hit_rate": 45.31, "A_n": 64, "A_bh_sharpe": 2.0409, "A_bh_return_pct": 7.94, "A_psr": 0.4581, "A_ic": 0.0514, "B_sharpe": 5.6205, "B_sortino": 5.5787, "B_excess_sharpe": 0.2113, "B_return_pct": 47.68, "B_hit_rate": 70.31, "B_n": 64, "B_bh_sharpe": 5.4092, "B_bh_return_pct": 45.7, "B_psr": 0.9969, "B_ic": 0.1476, "D_sharpe": -0.2107, "D_sortino": -0.2245, "D_excess_sharpe": -2.2515, "D_return_pct": -1.12, "D_hit_rate": 45.31, "D_n": 64, "D_bh_sharpe": 2.0409, "D_bh_return_pct": 7.94, "D_psr": 0.4581, "D_ic": 0.0514, "sharpe": -0.2107, "sortino": -0.2245, "return_pct": -1.12, "equity": 988.8000000000001, "max_dd": 0.0, "win_rate": 45.31, "profit_factor": 0.0, "ic": 0.0514, "hit": 45.31, "psr": 0.4581, "bh_sharpe": 2.0409, "bh_return_pct": 7.94, "excess_sharpe": -2.2515}], "status": "DISCARD", "precision": 0.5914, "recall": 0.5717, "f1": 0.5814, "f2": 0.5755, "accuracy": 0.5123, "mcc": -0.0024, "tp": 359, "fp": 248, "tn": 184, "fn": 269, "test_sharpe": 0.798, "A_sharpe": 0.798, "A_excess_sharpe": -0.4221, "A_return_pct": 91.74, "A_precision": 0.5914, "A_recall": 0.5717, "A_f1": 0.5814, "A_f2": 0.5755, "A_accuracy": 0.5123, "A_mcc": -0.0024, "A_tp": 359, "A_fp": 248, "A_tn": 184, "A_fn": 269, "A_psr": 0.9514, "A_ic": 0.0437, "A_hit_rate": 51.18, "A_bh_sharpe": 1.2201, "A_bh_return_pct": 185.59}
