{"experiment_num": 15, "backbone": "mamba", "description": "Mamba @ SOTA recipe (Gu-Dao 2024 COLM arXiv:2312.00752); seq=60, lr=5e-4, wd=0.1, warmup=10; QQQ first Mamba \u2014 testing GPU-saturating backbone", "config": {"seq_len": 60, "lr": 0.0005, "batch_size": 32, "epochs": 100, "weight_decay": 0.1, "patience": 20, "warmup_epochs": 10, "head_dropout": 0.1, "huber_delta": 1.0, "grad_clip": 1.0, "seed": 42, "hidden_size": null, "num_layers": null, "max_depth": null, "gbm_lr": null, "n_estimators": null}, "composite": -0.1865, "test_pos_folds": 5, "val_pos_folds": 3, "val_loss": -2.8535526199678403, "elapsed_sec": 15647.7, "timestamp": "2026-04-26T21:31:38", "sharpe": 0.7814, "val_sharpe": 0.0135, "ic": -0.0408, "hit": 57.71, "psr": 0.9456, "equity": 1886.5, "return_pct": 88.65, "bh_sharpe": 1.2201, "bh_return_pct": 185.59, "excess_sharpe": -0.4387, "B_sharpe": 0.1351, "B_excess_sharpe": -2.7033, "B_return_pct": -17.57, "D_sharpe": 0.7814, "D_excess_sharpe": -0.4387, "D_return_pct": 88.65, "per_window": [{"fold": "fold_1", "regime": "GFC peak crash (Lehman + Mar-2009 bottom)", "n": 65, "A_sharpe": -1.4419, "A_sortino": -1.4966, "A_excess_sharpe": -1.868, "A_return_pct": -14.58, "A_hit_rate": 44.62, "A_n": 65, "A_bh_sharpe": 0.4262, "A_bh_return_pct": 2.34, "A_psr": 0.2382, "A_ic": -0.1282, "B_sharpe": 0.0362, "B_sortino": 0.0393, "B_excess_sharpe": -1.8515, "B_return_pct": -6.64, "B_hit_rate": 45.31, "B_n": 65, "B_bh_sharpe": 1.8877, "B_bh_return_pct": 34.48, "B_psr": 0.5073, "B_ic": -0.0015, "D_sharpe": -1.4419, "D_sortino": -1.4966, "D_excess_sharpe": -1.868, "D_return_pct": -14.58, "D_hit_rate": 44.62, "D_n": 65, "D_bh_sharpe": 0.4262, "D_bh_return_pct": 2.34, "D_psr": 0.2382, "D_ic": -0.1282, "sharpe": -1.4419, "sortino": -1.4966, "return_pct": -14.58, "equity": 854.1999999999999, "max_dd": 0.0, "win_rate": 44.62, "profit_factor": 0.0, "ic": -0.1282, "hit": 44.62, "psr": 0.2382, "bh_sharpe": 0.4262, "bh_return_pct": 2.34, "excess_sharpe": -1.868, "precision": 0.4821, "recall": 0.7941, "f1": 0.6, "f2": 0.7031, "accuracy": 0.4462, "mcc": -0.2044, "tp": 27, "fp": 29, "tn": 2, "fn": 7, "A_precision": 0.4821, "A_recall": 0.7941, "A_f1": 0.6, "A_f2": 0.7031, "A_accuracy": 0.4462, "A_mcc": -0.2044, "A_tp": 27, "A_fp": 29, "A_tn": 2, "A_fn": 7}, {"fold": "fold_2", "regime": "2011 US-downgrade + EU debt", "n": 86, "A_sharpe": 4.8682, "A_sortino": 6.2819, "A_excess_sharpe": 0.0, "A_return_pct": 27.91, "A_hit_rate": 62.35, "A_n": 86, "A_bh_sharpe": 4.8682, "A_bh_return_pct": 27.91, "A_psr": 0.9993, "A_ic": -0.0294, "B_sharpe": 5.3166, "B_sortino": 5.2163, "B_excess_sharpe": -6.0025, "B_return_pct": 76.37, "B_hit_rate": 67.44, "B_n": 86, "B_bh_sharpe": 11.3191, "B_bh_return_pct": 186.84, "B_psr": 0.9986, "B_ic": 0.2495, "D_sharpe": 4.8682, "D_sortino": 6.2819, "D_excess_sharpe": 0.0, "D_return_pct": 27.91, "D_hit_rate": 62.35, "D_n": 86, "D_bh_sharpe": 4.8682, "D_bh_return_pct": 27.91, "D_psr": 0.9993, "D_ic": -0.0294, "sharpe": 4.8682, "sortino": 6.2819, "return_pct": 27.91, "equity": 1279.1000000000001, "max_dd": 0.0, "win_rate": 62.35, "profit_factor": 0.0, "ic": -0.0294, "hit": 62.35, "psr": 0.9993, "bh_sharpe": 4.8682, "bh_return_pct": 27.91, "excess_sharpe": 0.0, "precision": 0.6163, "recall": 1.0, "f1": 0.7626, "f2": 0.8893, "accuracy": 0.6163, "mcc": 0.0, "tp": 53, "fp": 33, "tn": 0, "fn": 0, "A_precision": 0.6163, "A_recall": 1.0, "A_f1": 0.7626, "A_f2": 0.8893, "A_accuracy": 0.6163, "A_mcc": 0.0, "A_tp": 53, "A_fp": 33, "A_tn": 0, "A_fn": 0}, {"fold": "fold_3", "regime": "Taper tantrum and 2014 H1", "n": 128, "A_sharpe": 2.0589, "A_sortino": 1.7259, "A_excess_sharpe": 0.0, "A_return_pct": 13.6, "A_hit_rate": 61.42, "A_n": 128, "A_bh_sharpe": 2.0589, "A_bh_return_pct": 13.6, "A_psr": 0.913, "A_ic": -0.0274, "B_sharpe": 0.9918, "B_sortino": 0.9449, "B_excess_sharpe": -3.5198, "B_return_pct": 11.26, "B_hit_rate": 55.47, "B_n": 128, "B_bh_sharpe": 4.5116, "B_bh_return_pct": 67.92, "B_psr": 0.7575, "B_ic": -0.1961, "D_sharpe": 2.0589, "D_sortino": 1.7259, "D_excess_sharpe": 0.0, "D_return_pct": 13.6, "D_hit_rate": 61.42, "D_n": 128, "D_bh_sharpe": 2.0589, "D_bh_return_pct": 13.6, "D_psr": 0.913, "D_ic": -0.0274, "sharpe": 2.0589, "sortino": 1.7259, "return_pct": 13.6, "equity": 1136.0000000000002, "max_dd": 0.0, "win_rate": 61.42, "profit_factor": 0.0, "ic": -0.0274, "hit": 61.42, "psr": 0.913, "bh_sharpe": 2.0589, "bh_return_pct": 13.6, "excess_sharpe": 0.0, "precision": 0.6094, "recall": 1.0, "f1": 0.7573, "f2": 0.8864, "accuracy": 0.6094, "mcc": 0.0, "tp": 78, "fp": 50, "tn": 0, "fn": 0, "A_precision": 0.6094, "A_recall": 1.0, "A_f1": 0.7573, "A_f2": 0.8864, "A_accuracy": 0.6094, "A_mcc": 0.0, "A_tp": 78, "A_fp": 50, "A_tn": 0, "A_fn": 0}, {"fold": "fold_4", "regime": "China devaluation and oil crash", "n": 107, "A_sharpe": -0.3119, "A_sortino": -0.2934, "A_excess_sharpe": 0.4913, "A_return_pct": -3.55, "A_hit_rate": 50.94, "A_n": 107, "A_bh_sharpe": -0.8032, "A_bh_return_pct": -7.58, "A_psr": 0.4196, "A_ic": -0.0379, "B_sharpe": 1.1653, "B_sortino": 1.2334, "B_excess_sharpe": 3.1249, "B_return_pct": 19.36, "B_hit_rate": 52.34, "B_n": 107, "B_bh_sharpe": -1.9596, "B_bh_return_pct": -33.47, "B_psr": 0.7762, "B_ic": 0.1926, "D_sharpe": -0.3119, "D_sortino": -0.2934, "D_excess_sharpe": 0.4913, "D_return_pct": -3.55, "D_hit_rate": 50.94, "D_n": 107, "D_bh_sharpe": -0.8032, "D_bh_return_pct": -7.58, "D_psr": 0.4196, "D_ic": -0.0379, "sharpe": -0.3119, "sortino": -0.2934, "return_pct": -3.55, "equity": 964.5, "max_dd": 0.0, "win_rate": 50.94, "profit_factor": 0.0, "ic": -0.0379, "hit": 50.94, "psr": 0.4196, "bh_sharpe": -0.8032, "bh_return_pct": -7.58, "excess_sharpe": 0.4913, "precision": 0.5, "recall": 0.9615, "f1": 0.6579, "f2": 0.8117, "accuracy": 0.514, "mcc": 0.106, "tp": 50, "fp": 50, "tn": 5, "fn": 2, "A_precision": 0.5, "A_recall": 0.9615, "A_f1": 0.6579, "A_f2": 0.8117, "A_accuracy": 0.514, "A_mcc": 0.106, "A_tp": 50, "A_fp": 50, "A_tn": 5, "A_fn": 2}, {"fold": "fold_5", "regime": "2018 Vol-mageddon + Q4 sell-off", "n": 127, "A_sharpe": 1.202, "A_sortino": 1.0963, "A_excess_sharpe": 0.019, "A_return_pct": 13.81, "A_hit_rate": 61.42, "A_n": 127, "A_bh_sharpe": 1.183, "A_bh_return_pct": 13.55, "A_psr": 0.8033, "A_ic": 0.0057, "B_sharpe": 0.5544, "B_sortino": 0.5096, "B_excess_sharpe": -2.3512, "B_return_pct": 7.78, "B_hit_rate": 54.76, "B_n": 127, "B_bh_sharpe": 2.9056, "B_bh_return_pct": 85.51, "B_psr": 0.6513, "B_ic": -0.0454, "D_sharpe": 1.202, "D_sortino": 1.0963, "D_excess_sharpe": 0.019, "D_return_pct": 13.81, "D_hit_rate": 61.42, "D_n": 127, "D_bh_sharpe": 1.183, "D_bh_return_pct": 13.55, "D_psr": 0.8033, "D_ic": 0.0057, "sharpe": 1.202, "sortino": 1.0963, "return_pct": 13.81, "equity": 1138.1000000000001, "max_dd": 0.0, "win_rate": 61.42, "profit_factor": 0.0, "ic": 0.0057, "hit": 61.42, "psr": 0.8033, "bh_sharpe": 1.183, "bh_return_pct": 13.55, "excess_sharpe": 0.019, "precision": 0.6198, "recall": 0.9615, "f1": 0.7538, "f2": 0.8661, "accuracy": 0.6142, "mcc": 0.0522, "tp": 75, "fp": 46, "tn": 3, "fn": 3, "A_precision": 0.6198, "A_recall": 0.9615, "A_f1": 0.7538, "A_f2": 0.8661, "A_accuracy": 0.6142, "A_mcc": 0.0522, "A_tp": 75, "A_fp": 46, "A_tn": 3, "A_fn": 3}, {"fold": "fold_6", "regime": "COVID crash and V-recovery", "n": 172, "A_sharpe": 1.215, "A_sortino": 1.0361, "A_excess_sharpe": -1.2126, "A_return_pct": 19.8, "A_hit_rate": 60.47, "A_n": 172, "A_bh_sharpe": 2.4276, "A_bh_return_pct": 45.89, "A_psr": 0.8348, "A_ic": -0.1436, "B_sharpe": -2.7265, "B_sortino": -2.6828, "B_excess_sharpe": -8.4385, "B_return_pct": -63.89, "B_hit_rate": 40.94, "B_n": 172, "B_bh_sharpe": 5.712, "B_bh_return_pct": 489.18, "B_psr": 0.0148, "B_ic": -0.1298, "D_sharpe": 1.215, "D_sortino": 1.0361, "D_excess_sharpe": -1.2126, "D_return_pct": 19.8, "D_hit_rate": 60.47, "D_n": 172, "D_bh_sharpe": 2.4276, "D_bh_return_pct": 45.89, "D_psr": 0.8348, "D_ic": -0.1436, "sharpe": 1.215, "sortino": 1.0361, "return_pct": 19.8, "equity": 1198.0, "max_dd": 0.0, "win_rate": 60.47, "profit_factor": 0.0, "ic": -0.1436, "hit": 60.47, "psr": 0.8348, "bh_sharpe": 2.4276, "bh_return_pct": 45.89, "excess_sharpe": -1.2126, "precision": 0.6471, "recall": 0.8761, "f1": 0.7444, "f2": 0.8182, "accuracy": 0.6047, "mcc": -0.0593, "tp": 99, "fp": 54, "tn": 5, "fn": 14, "A_precision": 0.6471, "A_recall": 0.8761, "A_f1": 0.7444, "A_f2": 0.8182, "A_accuracy": 0.6047, "A_mcc": -0.0593, "A_tp": 99, "A_fp": 54, "A_tn": 5, "A_fn": 14}, {"fold": "fold_7", "regime": "Inflation bear, AI rally and 2025", "n": 375, "A_sharpe": 0.5451, "A_sortino": 0.5074, "A_excess_sharpe": -0.2454, "A_return_pct": 15.58, "A_hit_rate": 57.07, "A_n": 375, "A_bh_sharpe": 0.7905, "A_bh_return_pct": 25.44, "A_psr": 0.7485, "A_ic": -0.0039, "B_sharpe": 0.1882, "B_sortino": 0.1828, "B_excess_sharpe": -1.7456, "B_return_pct": -3.17, "B_hit_rate": 51.07, "B_n": 375, "B_bh_sharpe": 1.9338, "B_bh_return_pct": 221.94, "B_psr": 0.5905, "B_ic": 0.0284, "D_sharpe": 0.5451, "D_sortino": 0.5074, "D_excess_sharpe": -0.2454, "D_return_pct": 15.58, "D_hit_rate": 57.07, "D_n": 375, "D_bh_sharpe": 0.7905, "D_bh_return_pct": 25.44, "D_psr": 0.7485, "D_ic": -0.0039, "sharpe": 0.5451, "sortino": 0.5074, "return_pct": 15.58, "equity": 1155.8, "max_dd": 0.0, "win_rate": 57.07, "profit_factor": 0.0, "ic": -0.0039, "hit": 57.07, "psr": 0.7485, "bh_sharpe": 0.7905, "bh_return_pct": 25.44, "excess_sharpe": -0.2454, "precision": 0.5817, "recall": 0.9545, "f1": 0.7229, "f2": 0.8461, "accuracy": 0.5707, "mcc": -0.051, "tp": 210, "fp": 151, "tn": 4, "fn": 10, "A_precision": 0.5817, "A_recall": 0.9545, "A_f1": 0.7229, "A_f2": 0.8461, "A_accuracy": 0.5707, "A_mcc": -0.051, "A_tp": 210, "A_fp": 151, "A_tn": 4, "A_fn": 10}], "per_window_val": [{"fold": "fold_1", "regime": "GFC peak crash (Lehman + Mar-2009 bottom)", "n": 37, "A_sharpe": 0.7166, "A_sortino": 0.6353, "A_excess_sharpe": -0.0419, "A_return_pct": 2.23, "A_hit_rate": 57.14, "A_n": 37, "A_bh_sharpe": 0.7585, "A_bh_return_pct": 2.39, "A_psr": 0.606, "A_ic": 0.2082, "B_sharpe": 2.5417, "B_sortino": 2.9381, "B_excess_sharpe": 0.3971, "B_return_pct": 14.73, "B_hit_rate": 59.46, "B_n": 37, "B_bh_sharpe": 2.1447, "B_bh_return_pct": 12.13, "B_psr": 0.8446, "B_ic": 0.1477, "D_sharpe": 0.7166, "D_sortino": 0.6353, "D_excess_sharpe": -0.0419, "D_return_pct": 2.23, "D_hit_rate": 57.14, "D_n": 37, "D_bh_sharpe": 0.7585, "D_bh_return_pct": 2.39, "D_psr": 0.606, "D_ic": 0.2082, "sharpe": 0.7166, "sortino": 0.6353, "return_pct": 2.23, "equity": 1022.3, "max_dd": 0.0, "win_rate": 57.14, "profit_factor": 0.0, "ic": 0.2082, "hit": 57.14, "psr": 0.606, "bh_sharpe": 0.7585, "bh_return_pct": 2.39, "excess_sharpe": -0.0419}, {"fold": "fold_2", "regime": "2011 US-downgrade + EU debt", "n": 46, "A_sharpe": -0.0539, "A_sortino": -0.0464, "A_excess_sharpe": 0.0, "A_return_pct": -1.46, "A_hit_rate": 56.52, "A_n": 46, "A_bh_sharpe": -0.0539, "A_bh_return_pct": -1.46, "A_psr": 0.4909, "A_ic": 0.0921, "B_sharpe": 3.0101, "B_sortino": 3.5187, "B_excess_sharpe": 4.5514, "B_return_pct": 42.99, "B_hit_rate": 54.35, "B_n": 46, "B_bh_sharpe": -1.5413, "B_bh_return_pct": -23.36, "B_psr": 0.9013, "B_ic": 0.3005, "D_sharpe": -0.0539, "D_sortino": -0.0464, "D_excess_sharpe": 0.0, "D_return_pct": -1.46, "D_hit_rate": 56.52, "D_n": 46, "D_bh_sharpe": -0.0539, "D_bh_return_pct": -1.46, "D_psr": 0.4909, "D_ic": 0.0921, "sharpe": -0.0539, "sortino": -0.0464, "return_pct": -1.46, "equity": 985.4000000000001, "max_dd": 0.0, "win_rate": 56.52, "profit_factor": 0.0, "ic": 0.0921, "hit": 56.52, "psr": 0.4909, "bh_sharpe": -0.0539, "bh_return_pct": -1.46, "excess_sharpe": 0.0}, {"fold": "fold_3", "regime": "Taper tantrum and 2014 H1", "n": 4, "A_sharpe": 6.3226, "A_sortino": 11.1859, "A_excess_sharpe": 0.0, "A_return_pct": 0.58, "A_hit_rate": 50.0, "A_n": 4, "A_bh_sharpe": 6.3226, "A_bh_return_pct": 0.58, "A_psr": 0.773, "A_ic": -0.4, "B_sharpe": -23.4413, "B_sortino": -13.1441, "B_excess_sharpe": 0.0, "B_return_pct": -3.13, "B_hit_rate": 0.0, "B_n": 4, "B_bh_sharpe": -23.4413, "B_bh_return_pct": -3.13, "B_psr": 0.0, "B_ic": 1.0, "D_sharpe": 6.3226, "D_sortino": 11.1859, "D_excess_sharpe": 0.0, "D_return_pct": 0.58, "D_hit_rate": 50.0, "D_n": 4, "D_bh_sharpe": 6.3226, "D_bh_return_pct": 0.58, "D_psr": 0.773, "D_ic": -0.4, "sharpe": 6.3226, "sortino": 11.1859, "return_pct": 0.58, "equity": 1005.8000000000001, "max_dd": 0.0, "win_rate": 50.0, "profit_factor": 0.0, "ic": -0.4, "hit": 50.0, "psr": 0.773, "bh_sharpe": 6.3226, "bh_return_pct": 0.58, "excess_sharpe": 0.0}, {"fold": "fold_4", "regime": "China devaluation and oil crash", "n": 46, "A_sharpe": -0.6359, "A_sortino": -0.6096, "A_excess_sharpe": 0.5663, "A_return_pct": -3.3, "A_hit_rate": 47.83, "A_n": 46, "A_bh_sharpe": -1.2022, "A_bh_return_pct": -5.68, "A_psr": 0.3938, "A_ic": 0.1667, "B_sharpe": -0.7255, "B_sortino": -0.5967, "B_excess_sharpe": 1.5863, "B_return_pct": -10.59, "B_hit_rate": 52.17, "B_n": 46, "B_bh_sharpe": -2.3118, "B_bh_return_pct": -24.51, "B_psr": 0.3758, "B_ic": 0.1567, "D_sharpe": -0.6359, "D_sortino": -0.6096, "D_excess_sharpe": 0.5663, "D_return_pct": -3.3, "D_hit_rate": 47.83, "D_n": 46, "D_bh_sharpe": -1.2022, "D_bh_return_pct": -5.68, "D_psr": 0.3938, "D_ic": 0.1667, "sharpe": -0.6359, "sortino": -0.6096, "return_pct": -3.3, "equity": 967.0, "max_dd": 0.0, "win_rate": 47.83, "profit_factor": 0.0, "ic": 0.1667, "hit": 47.83, "psr": 0.3938, "bh_sharpe": -1.2022, "bh_return_pct": -5.68, "excess_sharpe": 0.5663}, {"fold": "fold_5", "regime": "2018 Vol-mageddon + Q4 sell-off", "n": 4, "A_sharpe": -7.4976, "A_sortino": -7.0103, "A_excess_sharpe": 7.2575, "A_return_pct": -2.23, "A_hit_rate": 25.0, "A_n": 4, "A_bh_sharpe": -14.7551, "A_bh_return_pct": -3.52, "A_psr": 0.2273, "A_ic": -0.4, "B_sharpe": -1.4281, "B_sortino": -1.411, "B_excess_sharpe": -3.5847, "B_return_pct": -0.98, "B_hit_rate": 50.0, "B_n": 4, "B_bh_sharpe": 2.1566, "B_bh_return_pct": 1.19, "B_psr": 0.4386, "B_ic": 0.2, "D_sharpe": -7.4976, "D_sortino": -7.0103, "D_excess_sharpe": 7.2575, "D_return_pct": -2.23, "D_hit_rate": 25.0, "D_n": 4, "D_bh_sharpe": -14.7551, "D_bh_return_pct": -3.52, "D_psr": 0.2273, "D_ic": -0.4, "sharpe": -7.4976, "sortino": -7.0103, "return_pct": -2.23, "equity": 977.7, "max_dd": 0.0, "win_rate": 25.0, "profit_factor": 0.0, "ic": -0.4, "hit": 25.0, "psr": 0.2273, "bh_sharpe": -14.7551, "bh_return_pct": -3.52, "excess_sharpe": 7.2575}, {"fold": "fold_6", "regime": "COVID crash and V-recovery", "n": 25, "A_sharpe": 2.4138, "A_sortino": 2.2045, "A_excess_sharpe": 0.0, "A_return_pct": 3.27, "A_hit_rate": 60.0, "A_n": 25, "A_bh_sharpe": 2.4138, "A_bh_return_pct": 3.27, "A_psr": 0.7627, "A_ic": -0.0138, "B_sharpe": -2.2867, "B_sortino": -2.3495, "B_excess_sharpe": -14.8522, "B_return_pct": -6.8, "B_hit_rate": 40.0, "B_n": 25, "B_bh_sharpe": 12.5655, "B_bh_return_pct": 32.76, "B_psr": 0.2449, "B_ic": 0.3715, "D_sharpe": 2.4138, "D_sortino": 2.2045, "D_excess_sharpe": 0.0, "D_return_pct": 3.27, "D_hit_rate": 60.0, "D_n": 25, "D_bh_sharpe": 2.4138, "D_bh_return_pct": 3.27, "D_psr": 0.7627, "D_ic": -0.0138, "sharpe": 2.4138, "sortino": 2.2045, "return_pct": 3.27, "equity": 1032.7, "max_dd": 0.0, "win_rate": 60.0, "profit_factor": 0.0, "ic": -0.0138, "hit": 60.0, "psr": 0.7627, "bh_sharpe": 2.4138, "bh_return_pct": 3.27, "excess_sharpe": 0.0}, {"fold": "fold_7", "regime": "Inflation bear, AI rally and 2025", "n": 64, "A_sharpe": -0.2327, "A_sortino": -0.2288, "A_excess_sharpe": -2.2736, "A_return_pct": -1.21, "A_hit_rate": 48.44, "A_n": 64, "A_bh_sharpe": 2.0409, "A_bh_return_pct": 7.94, "A_psr": 0.4536, "A_ic": 0.0093, "B_sharpe": -1.79, "B_sortino": -1.7952, "B_excess_sharpe": -7.1992, "B_return_pct": -13.58, "B_hit_rate": 43.75, "B_n": 64, "B_bh_sharpe": 5.4092, "B_bh_return_pct": 45.7, "B_psr": 0.1888, "B_ic": 0.041, "D_sharpe": -0.2327, "D_sortino": -0.2288, "D_excess_sharpe": -2.2736, "D_return_pct": -1.21, "D_hit_rate": 48.44, "D_n": 64, "D_bh_sharpe": 2.0409, "D_bh_return_pct": 7.94, "D_psr": 0.4536, "D_ic": 0.0093, "sharpe": -0.2327, "sortino": -0.2288, "return_pct": -1.21, "equity": 987.9, "max_dd": 0.0, "win_rate": 48.44, "profit_factor": 0.0, "ic": 0.0093, "hit": 48.44, "psr": 0.4536, "bh_sharpe": 2.0409, "bh_return_pct": 7.94, "excess_sharpe": -2.2736}], "status": "DISCARD", "precision": 0.5891, "recall": 0.9427, "f1": 0.725, "f2": 0.8416, "accuracy": 0.5764, "mcc": -0.0296, "tp": 592, "fp": 413, "tn": 19, "fn": 36, "test_sharpe": 0.7814, "A_sharpe": 0.7814, "A_excess_sharpe": -0.4387, "A_return_pct": 88.65, "A_precision": 0.5891, "A_recall": 0.9427, "A_f1": 0.725, "A_f2": 0.8416, "A_accuracy": 0.5764, "A_mcc": -0.0296, "A_tp": 592, "A_fp": 413, "A_tn": 19, "A_fn": 36, "A_psr": 0.9456, "A_ic": -0.0408, "A_hit_rate": 57.71, "A_bh_sharpe": 1.2201, "A_bh_return_pct": 185.59}
