{"experiment_num": 13, "backbone": "mlp", "description": "MLP @ FX-Exp32 HPs seed=99 \u2014 4th seed for MLP variance estimate", "config": {"seq_len": 10, "lr": 0.0003, "batch_size": 32, "epochs": 50, "weight_decay": 1e-05, "patience": 10, "warmup_epochs": 0, "head_dropout": 0.25, "huber_delta": 1.0, "grad_clip": 1.0, "seed": 99, "hidden_size": null, "num_layers": null, "max_depth": null, "gbm_lr": null, "n_estimators": null}, "composite": -1.1962, "test_pos_folds": 4, "val_pos_folds": 2, "val_loss": -2.889934626236734, "elapsed_sec": 36.8, "timestamp": "2026-04-26T15:28:38", "sharpe": 0.1386, "val_sharpe": -0.8962, "ic": 0.0103, "hit": 48.54, "psr": 0.6284, "equity": 1004.0, "return_pct": 0.4, "bh_sharpe": 0.6042, "bh_return_pct": 103.49, "excess_sharpe": -0.4657, "B_sharpe": 0.2475, "B_excess_sharpe": -1.4533, "B_return_pct": -6.25, "D_sharpe": 0.1386, "D_excess_sharpe": -0.4657, "D_return_pct": 0.4, "per_window": [{"fold": "fold_1", "regime": "GFC peak crash (Lehman + Mar-2009 bottom)", "n": 115, "A_sharpe": -0.3568, "A_sortino": -0.375, "A_excess_sharpe": 0.0873, "A_return_pct": -12.7, "A_hit_rate": 45.22, "A_n": 115, "A_bh_sharpe": -0.4441, "A_bh_return_pct": -14.4, "A_psr": 0.4053, "A_ic": -0.0586, "B_sharpe": 0.5955, "B_sortino": 0.5618, "B_excess_sharpe": 0.8933, "B_return_pct": 5.72, "B_hit_rate": 55.26, "B_n": 115, "B_bh_sharpe": -0.2978, "B_bh_return_pct": -27.23, "B_psr": 0.655, "B_ic": 0.3068, "D_sharpe": -0.3568, "D_sortino": -0.375, "D_excess_sharpe": 0.0873, "D_return_pct": -12.7, "D_hit_rate": 45.22, "D_n": 115, "D_bh_sharpe": -0.4441, "D_bh_return_pct": -14.4, "D_psr": 0.4053, "D_ic": -0.0586, "sharpe": -0.3568, "sortino": -0.375, "return_pct": -12.7, "equity": 873.0, "max_dd": 0.0, "win_rate": 45.22, "profit_factor": 0.0, "ic": -0.0586, "hit": 45.22, "psr": 0.4053, "bh_sharpe": -0.4441, "bh_return_pct": -14.4, "excess_sharpe": 0.0873, "precision": 0.4571, "recall": 0.8889, "f1": 0.6038, "f2": 0.7477, "accuracy": 0.4522, "mcc": -0.0807, "tp": 48, "fp": 57, "tn": 4, "fn": 6, "A_precision": 0.4571, "A_recall": 0.8889, "A_f1": 0.6038, "A_f2": 0.7477, "A_accuracy": 0.4522, "A_mcc": -0.0807, "A_tp": 48, "A_fp": 57, "A_tn": 4, "A_fn": 6}, {"fold": "fold_2", "regime": "2011 US-downgrade + EU debt", "n": 136, "A_sharpe": -0.9801, "A_sortino": -0.9903, "A_excess_sharpe": -2.7128, "A_return_pct": -11.34, "A_hit_rate": 45.19, "A_n": 136, "A_bh_sharpe": 1.7327, "A_bh_return_pct": 19.75, "A_psr": 0.2377, "A_ic": -0.1328, "B_sharpe": 3.2298, "B_sortino": 2.8867, "B_excess_sharpe": -0.8361, "B_return_pct": 105.67, "B_hit_rate": 67.65, "B_n": 136, "B_bh_sharpe": 4.0659, "B_bh_return_pct": 148.68, "B_psr": 0.9897, "B_ic": -0.0457, "D_sharpe": -0.9801, "D_sortino": -0.9903, "D_excess_sharpe": -2.7128, "D_return_pct": -11.34, "D_hit_rate": 45.19, "D_n": 136, "D_bh_sharpe": 1.7327, "D_bh_return_pct": 19.75, "D_psr": 0.2377, "D_ic": -0.1328, "sharpe": -0.9801, "sortino": -0.9903, "return_pct": -11.34, "equity": 886.6, "max_dd": 0.0, "win_rate": 45.19, "profit_factor": 0.0, "ic": -0.1328, "hit": 45.19, "psr": 0.2377, "bh_sharpe": 1.7327, "bh_return_pct": 19.75, "excess_sharpe": -2.7128, "precision": 0.519, "recall": 0.5256, "f1": 0.5223, "f2": 0.5243, "accuracy": 0.4485, "mcc": -0.1298, "tp": 41, "fp": 38, "tn": 20, "fn": 37, "A_precision": 0.519, "A_recall": 0.5256, "A_f1": 0.5223, "A_f2": 0.5243, "A_accuracy": 0.4485, "A_mcc": -0.1298, "A_tp": 41, "A_fp": 38, "A_tn": 20, "A_fn": 37}, {"fold": "fold_3", "regime": "Taper tantrum and 2014 H1", "n": 178, "A_sharpe": 1.7482, "A_sortino": 1.7567, "A_excess_sharpe": 0.4036, "A_return_pct": 16.59, "A_hit_rate": 54.24, "A_n": 178, "A_bh_sharpe": 1.3445, "A_bh_return_pct": 12.41, "A_psr": 0.9247, "A_ic": 0.1695, "B_sharpe": 2.7584, "B_sortino": 2.9768, "B_excess_sharpe": -0.2899, "B_return_pct": 63.09, "B_hit_rate": 56.18, "B_n": 178, "B_bh_sharpe": 3.0483, "B_bh_return_pct": 71.83, "B_psr": 0.9897, "B_ic": 0.0237, "D_sharpe": 1.7482, "D_sortino": 1.7567, "D_excess_sharpe": 0.4036, "D_return_pct": 16.59, "D_hit_rate": 54.24, "D_n": 178, "D_bh_sharpe": 1.3445, "D_bh_return_pct": 12.41, "D_psr": 0.9247, "D_ic": 0.1695, "sharpe": 1.7482, "sortino": 1.7567, "return_pct": 16.59, "equity": 1165.8999999999999, "max_dd": 0.0, "win_rate": 54.24, "profit_factor": 0.0, "ic": 0.1695, "hit": 54.24, "psr": 0.9247, "bh_sharpe": 1.3445, "bh_return_pct": 12.41, "excess_sharpe": 0.4036, "precision": 0.6196, "recall": 0.5534, "f1": 0.5846, "f2": 0.5655, "accuracy": 0.5449, "mcc": 0.0857, "tp": 57, "fp": 35, "tn": 40, "fn": 46, "A_precision": 0.6196, "A_recall": 0.5534, "A_f1": 0.5846, "A_f2": 0.5655, "A_accuracy": 0.5449, "A_mcc": 0.0857, "A_tp": 57, "A_fp": 35, "A_tn": 40, "A_fn": 46}, {"fold": "fold_4", "regime": "China devaluation and oil crash", "n": 157, "A_sharpe": 0.5398, "A_sortino": 0.4967, "A_excess_sharpe": 0.53, "A_return_pct": 5.49, "A_hit_rate": 54.49, "A_n": 157, "A_bh_sharpe": 0.0098, "A_bh_return_pct": -1.05, "A_psr": 0.6633, "A_ic": 0.0404, "B_sharpe": 0.8229, "B_sortino": 0.7892, "B_excess_sharpe": 0.807, "B_return_pct": 17.92, "B_hit_rate": 55.41, "B_n": 157, "B_bh_sharpe": 0.0159, "B_bh_return_pct": -5.48, "B_psr": 0.7408, "B_ic": 0.0576, "D_sharpe": 0.5398, "D_sortino": 0.4967, "D_excess_sharpe": 0.53, "D_return_pct": 5.49, "D_hit_rate": 54.49, "D_n": 157, "D_bh_sharpe": 0.0098, "D_bh_return_pct": -1.05, "D_psr": 0.6633, "D_ic": 0.0404, "sharpe": 0.5398, "sortino": 0.4967, "return_pct": 5.49, "equity": 1054.8999999999999, "max_dd": 0.0, "win_rate": 54.49, "profit_factor": 0.0, "ic": 0.0404, "hit": 54.49, "psr": 0.6633, "bh_sharpe": 0.0098, "bh_return_pct": -1.05, "excess_sharpe": 0.53, "precision": 0.5556, "recall": 0.6173, "f1": 0.5848, "f2": 0.6039, "accuracy": 0.5478, "mcc": 0.0919, "tp": 50, "fp": 40, "tn": 36, "fn": 31, "A_precision": 0.5556, "A_recall": 0.6173, "A_f1": 0.5848, "A_f2": 0.6039, "A_accuracy": 0.5478, "A_mcc": 0.0919, "A_tp": 50, "A_fp": 40, "A_tn": 36, "A_fn": 31}, {"fold": "fold_5", "regime": "2018 Vol-mageddon + Q4 sell-off", "n": 177, "A_sharpe": -0.1747, "A_sortino": -0.1843, "A_excess_sharpe": -0.4845, "A_return_pct": -4.58, "A_hit_rate": 46.89, "A_n": 177, "A_bh_sharpe": 0.3098, "A_bh_return_pct": 3.19, "A_psr": 0.4421, "A_ic": -0.0227, "B_sharpe": -0.5771, "B_sortino": -0.5205, "B_excess_sharpe": -1.4687, "B_return_pct": -23.22, "B_hit_rate": 51.7, "B_n": 177, "B_bh_sharpe": 0.8917, "B_bh_return_pct": 23.8, "B_psr": 0.3134, "B_ic": 0.0218, "D_sharpe": -0.1747, "D_sortino": -0.1843, "D_excess_sharpe": -0.4845, "D_return_pct": -4.58, "D_hit_rate": 46.89, "D_n": 177, "D_bh_sharpe": 0.3098, "D_bh_return_pct": 3.19, "D_psr": 0.4421, "D_ic": -0.0227, "sharpe": -0.1747, "sortino": -0.1843, "return_pct": -4.58, "equity": 954.2, "max_dd": 0.0, "win_rate": 46.89, "profit_factor": 0.0, "ic": -0.0227, "hit": 46.89, "psr": 0.4421, "bh_sharpe": 0.3098, "bh_return_pct": 3.19, "excess_sharpe": -0.4845, "precision": 0.5556, "recall": 0.4369, "f1": 0.4891, "f2": 0.4564, "accuracy": 0.4689, "mcc": -0.0491, "tp": 45, "fp": 36, "tn": 38, "fn": 58, "A_precision": 0.5556, "A_recall": 0.4369, "A_f1": 0.4891, "A_f2": 0.4564, "A_accuracy": 0.4689, "A_mcc": -0.0491, "A_tp": 45, "A_fp": 36, "A_tn": 38, "A_fn": 58}, {"fold": "fold_6", "regime": "COVID crash and V-recovery", "n": 222, "A_sharpe": 0.4478, "A_sortino": 0.4656, "A_excess_sharpe": -0.441, "A_return_pct": 8.94, "A_hit_rate": 46.85, "A_n": 222, "A_bh_sharpe": 0.8888, "A_bh_return_pct": 26.13, "A_psr": 0.6614, "A_ic": 0.0546, "B_sharpe": -0.1142, "B_sortino": -0.1092, "B_excess_sharpe": -2.5026, "B_return_pct": -25.0, "B_hit_rate": 51.13, "B_n": 222, "B_bh_sharpe": 2.3884, "B_bh_return_pct": 243.18, "B_psr": 0.4574, "B_ic": -0.0021, "D_sharpe": 0.4478, "D_sortino": 0.4656, "D_excess_sharpe": -0.441, "D_return_pct": 8.94, "D_hit_rate": 46.85, "D_n": 222, "D_bh_sharpe": 0.8888, "D_bh_return_pct": 26.13, "D_psr": 0.6614, "D_ic": 0.0546, "sharpe": 0.4478, "sortino": 0.4656, "return_pct": 8.94, "equity": 1089.3999999999999, "max_dd": 0.0, "win_rate": 46.85, "profit_factor": 0.0, "ic": 0.0546, "hit": 46.85, "psr": 0.6614, "bh_sharpe": 0.8888, "bh_return_pct": 26.13, "excess_sharpe": -0.441, "precision": 0.598, "recall": 0.442, "f1": 0.5083, "f2": 0.4664, "accuracy": 0.4685, "mcc": -0.0448, "tp": 61, "fp": 41, "tn": 43, "fn": 77, "A_precision": 0.598, "A_recall": 0.442, "A_f1": 0.5083, "A_f2": 0.4664, "A_accuracy": 0.4685, "A_mcc": -0.0448, "A_tp": 61, "A_fp": 41, "A_tn": 43, "A_fn": 77}, {"fold": "fold_7", "regime": "Inflation bear, AI rally and 2025", "n": 425, "A_sharpe": 0.147, "A_sortino": 0.1594, "A_excess_sharpe": -0.8245, "A_return_pct": 1.44, "A_hit_rate": 47.53, "A_n": 425, "A_bh_sharpe": 0.9715, "A_bh_return_pct": 37.12, "A_psr": 0.5759, "A_ic": 0.0337, "B_sharpe": -1.0033, "B_sortino": -0.9906, "B_excess_sharpe": -3.5059, "B_return_pct": -61.06, "B_hit_rate": 46.23, "B_n": 425, "B_bh_sharpe": 2.5027, "B_bh_return_pct": 458.83, "B_psr": 0.0958, "B_ic": -0.1252, "D_sharpe": 0.147, "D_sortino": 0.1594, "D_excess_sharpe": -0.8245, "D_return_pct": 1.44, "D_hit_rate": 47.53, "D_n": 425, "D_bh_sharpe": 0.9715, "D_bh_return_pct": 37.12, "D_psr": 0.5759, "D_ic": 0.0337, "sharpe": 0.147, "sortino": 0.1594, "return_pct": 1.44, "equity": 1014.4, "max_dd": 0.0, "win_rate": 47.53, "profit_factor": 0.0, "ic": 0.0337, "hit": 47.53, "psr": 0.5759, "bh_sharpe": 0.9715, "bh_return_pct": 37.12, "excess_sharpe": -0.8245, "precision": 0.5839, "recall": 0.376, "f1": 0.4574, "f2": 0.4048, "accuracy": 0.4753, "mcc": -0.007, "tp": 94, "fp": 67, "tn": 108, "fn": 156, "A_precision": 0.5839, "A_recall": 0.376, "A_f1": 0.4574, "A_f2": 0.4048, "A_accuracy": 0.4753, "A_mcc": -0.007, "A_tp": 94, "A_fp": 67, "A_tn": 108, "A_fn": 156}], "per_window_val": [{"fold": "fold_1", "regime": "GFC peak crash (Lehman + Mar-2009 bottom)", "n": 104, "A_sharpe": -1.5556, "A_sortino": -1.375, "A_excess_sharpe": -1.3884, "A_return_pct": -18.78, "A_hit_rate": 46.08, "A_n": 104, "A_bh_sharpe": -0.1672, "A_bh_return_pct": -3.81, "A_psr": 0.1487, "A_ic": -0.0101, "B_sharpe": -4.2954, "B_sortino": -3.6219, "B_excess_sharpe": -2.0213, "B_return_pct": -63.82, "B_hit_rate": 40.78, "B_n": 104, "B_bh_sharpe": -2.2741, "B_bh_return_pct": -44.12, "B_psr": 0.0014, "B_ic": 0.0032, "D_sharpe": -1.5556, "D_sortino": -1.375, "D_excess_sharpe": -1.3884, "D_return_pct": -18.78, "D_hit_rate": 46.08, "D_n": 104, "D_bh_sharpe": -0.1672, "D_bh_return_pct": -3.81, "D_psr": 0.1487, "D_ic": -0.0101, "sharpe": -1.5556, "sortino": -1.375, "return_pct": -18.78, "equity": 812.2, "max_dd": 0.0, "win_rate": 46.08, "profit_factor": 0.0, "ic": -0.0101, "hit": 46.08, "psr": 0.1487, "bh_sharpe": -0.1672, "bh_return_pct": -3.81, "excess_sharpe": -1.3884}, {"fold": "fold_2", "regime": "2011 US-downgrade + EU debt", "n": 96, "A_sharpe": 0.8116, "A_sortino": 0.7517, "A_excess_sharpe": 1.0857, "A_return_pct": 7.14, "A_hit_rate": 54.74, "A_n": 96, "A_bh_sharpe": -0.2741, "A_bh_return_pct": -4.09, "A_psr": 0.6881, "A_ic": 0.0719, "B_sharpe": 0.247, "B_sortino": 0.2855, "B_excess_sharpe": 1.2744, "B_return_pct": -0.96, "B_hit_rate": 43.75, "B_n": 96, "B_bh_sharpe": -1.0274, "B_bh_return_pct": -25.58, "B_psr": 0.5605, "B_ic": 0.0463, "D_sharpe": 0.8116, "D_sortino": 0.7517, "D_excess_sharpe": 1.0857, "D_return_pct": 7.14, "D_hit_rate": 54.74, "D_n": 96, "D_bh_sharpe": -0.2741, "D_bh_return_pct": -4.09, "D_psr": 0.6881, "D_ic": 0.0719, "sharpe": 0.8116, "sortino": 0.7517, "return_pct": 7.14, "equity": 1071.3999999999999, "max_dd": 0.0, "win_rate": 54.74, "profit_factor": 0.0, "ic": 0.0719, "hit": 54.74, "psr": 0.6881, "bh_sharpe": -0.2741, "bh_return_pct": -4.09, "excess_sharpe": 1.0857}, {"fold": "fold_3", "regime": "Taper tantrum and 2014 H1", "n": 54, "A_sharpe": -3.8115, "A_sortino": -3.4632, "A_excess_sharpe": -8.5113, "A_return_pct": -8.05, "A_hit_rate": 38.89, "A_n": 54, "A_bh_sharpe": 4.6998, "A_bh_return_pct": 10.46, "A_psr": 0.0377, "A_ic": -0.1963, "B_sharpe": 9.0326, "B_sortino": 13.2979, "B_excess_sharpe": 0.0, "B_return_pct": 49.18, "B_hit_rate": 68.52, "B_n": 54, "B_bh_sharpe": 9.0326, "B_bh_return_pct": 49.18, "B_psr": 1.0, "B_ic": 0.1325, "D_sharpe": -3.8115, "D_sortino": -3.4632, "D_excess_sharpe": -8.5113, "D_return_pct": -8.05, "D_hit_rate": 38.89, "D_n": 54, "D_bh_sharpe": 4.6998, "D_bh_return_pct": 10.46, "D_psr": 0.0377, "D_ic": -0.1963, "sharpe": -3.8115, "sortino": -3.4632, "return_pct": -8.05, "equity": 919.5, "max_dd": 0.0, "win_rate": 38.89, "profit_factor": 0.0, "ic": -0.1963, "hit": 38.89, "psr": 0.0377, "bh_sharpe": 4.6998, "bh_return_pct": 10.46, "excess_sharpe": -8.5113}, {"fold": "fold_4", "regime": "China devaluation and oil crash", "n": 96, "A_sharpe": 2.4721, "A_sortino": 2.7744, "A_excess_sharpe": 2.8962, "A_return_pct": 18.72, "A_hit_rate": 58.95, "A_n": 96, "A_bh_sharpe": -0.4241, "A_bh_return_pct": -3.73, "A_psr": 0.9448, "A_ic": 0.0733, "B_sharpe": 0.9717, "B_sortino": 1.0386, "B_excess_sharpe": 2.156, "B_return_pct": 13.59, "B_hit_rate": 51.04, "B_n": 96, "B_bh_sharpe": -1.1843, "B_bh_return_pct": -21.44, "B_psr": 0.7248, "B_ic": 0.1179, "D_sharpe": 2.4721, "D_sortino": 2.7744, "D_excess_sharpe": 2.8962, "D_return_pct": 18.72, "D_hit_rate": 58.95, "D_n": 96, "D_bh_sharpe": -0.4241, "D_bh_return_pct": -3.73, "D_psr": 0.9448, "D_ic": 0.0733, "sharpe": 2.4721, "sortino": 2.7744, "return_pct": 18.72, "equity": 1187.2, "max_dd": 0.0, "win_rate": 58.95, "profit_factor": 0.0, "ic": 0.0733, "hit": 58.95, "psr": 0.9448, "bh_sharpe": -0.4241, "bh_return_pct": -3.73, "excess_sharpe": 2.8962}, {"fold": "fold_5", "regime": "2018 Vol-mageddon + Q4 sell-off", "n": 54, "A_sharpe": -5.695, "A_sortino": -4.5829, "A_excess_sharpe": -7.123, "A_return_pct": -14.44, "A_hit_rate": 40.74, "A_n": 54, "A_bh_sharpe": 1.428, "A_bh_return_pct": 3.97, "A_psr": 0.0025, "A_ic": -0.1976, "B_sharpe": -1.1502, "B_sortino": -1.1356, "B_excess_sharpe": -6.0824, "B_return_pct": -8.2, "B_hit_rate": 46.3, "B_n": 54, "B_bh_sharpe": 4.9322, "B_bh_return_pct": 34.93, "B_psr": 0.2997, "B_ic": -0.2884, "D_sharpe": -5.695, "D_sortino": -4.5829, "D_excess_sharpe": -7.123, "D_return_pct": -14.44, "D_hit_rate": 40.74, "D_n": 54, "D_bh_sharpe": 1.428, "D_bh_return_pct": 3.97, "D_psr": 0.0025, "D_ic": -0.1976, "sharpe": -5.695, "sortino": -4.5829, "return_pct": -14.44, "equity": 855.6, "max_dd": 0.0, "win_rate": 40.74, "profit_factor": 0.0, "ic": -0.1976, "hit": 40.74, "psr": 0.0025, "bh_sharpe": 1.428, "bh_return_pct": 3.97, "excess_sharpe": -7.123}, {"fold": "fold_6", "regime": "COVID crash and V-recovery", "n": 75, "A_sharpe": -4.4239, "A_sortino": -4.359, "A_excess_sharpe": -8.7234, "A_return_pct": -13.45, "A_hit_rate": 32.0, "A_n": 75, "A_bh_sharpe": 4.2994, "A_bh_return_pct": 14.68, "A_psr": 0.0123, "A_ic": -0.0461, "B_sharpe": 3.1885, "B_sortino": 2.8063, "B_excess_sharpe": -11.1455, "B_return_pct": 25.25, "B_hit_rate": 65.33, "B_n": 75, "B_bh_sharpe": 14.3339, "B_bh_return_pct": 120.13, "B_psr": 0.9506, "B_ic": -0.1376, "D_sharpe": -4.4239, "D_sortino": -4.359, "D_excess_sharpe": -8.7234, "D_return_pct": -13.45, "D_hit_rate": 32.0, "D_n": 75, "D_bh_sharpe": 4.2994, "D_bh_return_pct": 14.68, "D_psr": 0.0123, "D_ic": -0.0461, "sharpe": -4.4239, "sortino": -4.359, "return_pct": -13.45, "equity": 865.5, "max_dd": 0.0, "win_rate": 32.0, "profit_factor": 0.0, "ic": -0.0461, "hit": 32.0, "psr": 0.0123, "bh_sharpe": 4.2994, "bh_return_pct": 14.68, "excess_sharpe": -8.7234}, {"fold": "fold_7", "regime": "Inflation bear, AI rally and 2025", "n": 114, "A_sharpe": -1.7547, "A_sortino": -1.5919, "A_excess_sharpe": -4.5998, "A_return_pct": -12.15, "A_hit_rate": 48.25, "A_n": 114, "A_bh_sharpe": 2.845, "A_bh_return_pct": 21.34, "A_psr": 0.1166, "A_ic": -0.0798, "B_sharpe": 3.5979, "B_sortino": 3.8955, "B_excess_sharpe": -2.5387, "B_return_pct": 75.39, "B_hit_rate": 62.28, "B_n": 114, "B_bh_sharpe": 6.1366, "B_bh_return_pct": 155.03, "B_psr": 0.9931, "B_ic": 0.0012, "D_sharpe": -1.7547, "D_sortino": -1.5919, "D_excess_sharpe": -4.5998, "D_return_pct": -12.15, "D_hit_rate": 48.25, "D_n": 114, "D_bh_sharpe": 2.845, "D_bh_return_pct": 21.34, "D_psr": 0.1166, "D_ic": -0.0798, "sharpe": -1.7547, "sortino": -1.5919, "return_pct": -12.15, "equity": 878.5000000000001, "max_dd": 0.0, "win_rate": 48.25, "profit_factor": 0.0, "ic": -0.0798, "hit": 48.25, "psr": 0.1166, "bh_sharpe": 2.845, "bh_return_pct": 21.34, "excess_sharpe": -4.5998}], "status": "DISCARD", "precision": 0.5577, "recall": 0.4907, "f1": 0.5221, "f2": 0.5028, "accuracy": 0.4858, "mcc": -0.0297, "tp": 396, "fp": 314, "tn": 289, "fn": 411, "test_sharpe": 0.1386, "A_sharpe": 0.1386, "A_excess_sharpe": -0.4657, "A_return_pct": 0.4, "A_precision": 0.5577, "A_recall": 0.4907, "A_f1": 0.5221, "A_f2": 0.5028, "A_accuracy": 0.4858, "A_mcc": -0.0297, "A_tp": 396, "A_fp": 314, "A_tn": 289, "A_fn": 411, "A_psr": 0.6284, "A_ic": 0.0103, "A_hit_rate": 48.54, "A_bh_sharpe": 0.6042, "A_bh_return_pct": 103.49}
