{"experiment_num": 82, "backbone": "lstm", "description": "LSTM @ exp 71 1-layer ep=200 pat=30 - Fischer-Krauss 2018 daily-LSTM canonical training horizon on smaller-capacity 1-layer", "config": {"seq_len": 10, "lr": 0.001, "batch_size": 16, "epochs": 200, "weight_decay": 0.0007, "patience": 30, "warmup_epochs": 0, "head_dropout": 0.1, "huber_delta": 1.0, "grad_clip": 1.0, "seed": 0, "hidden_size": null, "num_layers": 1, "max_depth": null, "gbm_lr": null, "n_estimators": null}, "composite": -0.2944, "test_pos_folds": 5, "val_pos_folds": 3, "val_loss": -2.881907249180503, "elapsed_sec": 69.4, "timestamp": "2026-04-27T23:19:16", "sharpe": 0.1158, "val_sharpe": -0.0944, "ic": 0.022, "hit": 52.74, "psr": 0.6078, "equity": 969.5, "return_pct": -3.05, "bh_sharpe": 0.6042, "bh_return_pct": 103.49, "excess_sharpe": -0.4885, "B_sharpe": 2.0302, "B_excess_sharpe": 0.3294, "B_return_pct": 18326.93, "D_sharpe": 0.1158, "D_excess_sharpe": -0.4885, "D_return_pct": -3.05, "precision": 0.5672, "recall": 0.7323, "f1": 0.6393, "f2": 0.692, "mcc": -0.0176, "accuracy": 0.527, "val_precision": 0.5426, "val_recall": 0.7933, "val_f1": 0.6444, "val_f2": 0.7262, "val_mcc": -0.0508, "val_accuracy": 0.5143, "per_window": [{"fold": "fold_1", "regime": "GFC peak crash (Lehman + Mar-2009 bottom)", "n": 115, "A_sharpe": 0.4381, "A_sortino": 0.4538, "A_excess_sharpe": 0.8822, "A_return_pct": 4.43, "A_hit_rate": 51.3, "A_n": 115, "A_bh_sharpe": -0.4441, "A_bh_return_pct": -14.4, "A_psr": 0.6162, "A_ic": 0.0322, "A_precision": 0.4828, "A_recall": 0.5185, "A_f1": 0.5, "A_f2": 0.5109, "A_accuracy": 0.513, "A_mcc": 0.0267, "A_tp": 28, "A_fp": 30, "A_tn": 31, "A_fn": 26, "B_sharpe": 1.6448, "B_sortino": 1.6002, "B_excess_sharpe": 1.9426, "B_return_pct": 63.55, "B_hit_rate": 57.02, "B_n": 115, "B_bh_sharpe": -0.2978, "B_bh_return_pct": -27.23, "B_psr": 0.8629, "B_ic": 0.1824, "B_precision": 0.5556, "B_recall": 0.8475, "B_f1": 0.6711, "B_f2": 0.7669, "B_accuracy": 0.5739, "B_mcc": 0.1614, "B_tp": 50, "B_fp": 40, "B_tn": 16, "B_fn": 9, "D_sharpe": 0.4381, "D_sortino": 0.4538, "D_excess_sharpe": 0.8822, "D_return_pct": 4.43, "D_hit_rate": 51.3, "D_n": 115, "D_bh_sharpe": -0.4441, "D_bh_return_pct": -14.4, "D_psr": 0.6162, "D_ic": 0.0322, "D_precision": 0.4828, "D_recall": 0.5185, "D_f1": 0.5, "D_f2": 0.5109, "D_accuracy": 0.513, "D_mcc": 0.0267, "D_tp": 28, "D_fp": 30, "D_tn": 31, "D_fn": 26, "sharpe": 0.4381, "sortino": 0.4538, "return_pct": 4.43, "equity": 1044.3, "max_dd": 0.0, "win_rate": 51.3, "profit_factor": 0.0, "ic": 0.0322, "hit": 51.3, "psr": 0.6162, "bh_sharpe": -0.4441, "bh_return_pct": -14.4, "excess_sharpe": 0.8822, "precision": 0.4828, "recall": 0.5185, "f1": 0.5, "f2": 0.5109, "mcc": 0.0267, "accuracy": 0.513, "tp": 28, "fp": 30, "tn": 31, "fn": 26}, {"fold": "fold_2", "regime": "2011 US-downgrade + EU debt", "n": 136, "A_sharpe": 1.5873, "A_sortino": 1.7206, "A_excess_sharpe": -0.1455, "A_return_pct": 17.86, "A_hit_rate": 52.59, "A_n": 136, "A_bh_sharpe": 1.7327, "A_bh_return_pct": 19.75, "A_psr": 0.8795, "A_ic": 0.0548, "A_precision": 0.5714, "A_recall": 0.7179, "A_f1": 0.6364, "A_f2": 0.6829, "A_accuracy": 0.5294, "A_mcc": -0.0068, "A_tp": 56, "A_fp": 42, "A_tn": 16, "A_fn": 22, "B_sharpe": 0.8849, "B_sortino": 0.8577, "B_excess_sharpe": -3.181, "B_return_pct": 17.49, "B_hit_rate": 56.62, "B_n": 136, "B_bh_sharpe": 4.0659, "B_bh_return_pct": 148.68, "B_psr": 0.742, "B_ic": -0.1051, "B_precision": 0.6729, "B_recall": 0.75, "B_f1": 0.7094, "B_f2": 0.7332, "B_accuracy": 0.5662, "B_mcc": -0.1391, "B_tp": 72, "B_fp": 35, "B_tn": 5, "B_fn": 24, "D_sharpe": 1.5873, "D_sortino": 1.7206, "D_excess_sharpe": -0.1455, "D_return_pct": 17.86, "D_hit_rate": 52.59, "D_n": 136, "D_bh_sharpe": 1.7327, "D_bh_return_pct": 19.75, "D_psr": 0.8795, "D_ic": 0.0548, "D_precision": 0.5714, "D_recall": 0.7179, "D_f1": 0.6364, "D_f2": 0.6829, "D_accuracy": 0.5294, "D_mcc": -0.0068, "D_tp": 56, "D_fp": 42, "D_tn": 16, "D_fn": 22, "sharpe": 1.5873, "sortino": 1.7206, "return_pct": 17.86, "equity": 1178.6, "max_dd": 0.0, "win_rate": 52.59, "profit_factor": 0.0, "ic": 0.0548, "hit": 52.59, "psr": 0.8795, "bh_sharpe": 1.7327, "bh_return_pct": 19.75, "excess_sharpe": -0.1455, "precision": 0.5714, "recall": 0.7179, "f1": 0.6364, "f2": 0.6829, "mcc": -0.0068, "accuracy": 0.5294, "tp": 56, "fp": 42, "tn": 16, "fn": 22}, {"fold": "fold_3", "regime": "Taper tantrum and 2014 H1", "n": 178, "A_sharpe": 1.7655, "A_sortino": 1.5672, "A_excess_sharpe": 0.421, "A_return_pct": 16.77, "A_hit_rate": 58.76, "A_n": 178, "A_bh_sharpe": 1.3445, "A_bh_return_pct": 12.41, "A_psr": 0.921, "A_ic": 0.1401, "A_precision": 0.5924, "A_recall": 0.9029, "A_f1": 0.7154, "A_f2": 0.8172, "A_accuracy": 0.5843, "A_mcc": 0.0759, "A_tp": 93, "A_fp": 64, "A_tn": 11, "A_fn": 10, "B_sharpe": 5.415, "B_sortino": 6.3693, "B_excess_sharpe": 2.3667, "B_return_pct": 157.24, "B_hit_rate": 62.36, "B_n": 178, "B_bh_sharpe": 3.0483, "B_bh_return_pct": 71.83, "B_psr": 1.0, "B_ic": 0.1786, "B_precision": 0.6641, "B_recall": 0.7798, "B_f1": 0.7173, "B_f2": 0.7535, "B_accuracy": 0.6236, "B_mcc": 0.1698, "B_tp": 85, "B_fp": 43, "B_tn": 26, "B_fn": 24, "D_sharpe": 1.7655, "D_sortino": 1.5672, "D_excess_sharpe": 0.421, "D_return_pct": 16.77, "D_hit_rate": 58.76, "D_n": 178, "D_bh_sharpe": 1.3445, "D_bh_return_pct": 12.41, "D_psr": 0.921, "D_ic": 0.1401, "D_precision": 0.5924, "D_recall": 0.9029, "D_f1": 0.7154, "D_f2": 0.8172, "D_accuracy": 0.5843, "D_mcc": 0.0759, "D_tp": 93, "D_fp": 64, "D_tn": 11, "D_fn": 10, "sharpe": 1.7655, "sortino": 1.5672, "return_pct": 16.77, "equity": 1167.7, "max_dd": 0.0, "win_rate": 58.76, "profit_factor": 0.0, "ic": 0.1401, "hit": 58.76, "psr": 0.921, "bh_sharpe": 1.3445, "bh_return_pct": 12.41, "excess_sharpe": 0.421, "precision": 0.5924, "recall": 0.9029, "f1": 0.7154, "f2": 0.8172, "mcc": 0.0759, "accuracy": 0.5843, "tp": 93, "fp": 64, "tn": 11, "fn": 10}, {"fold": "fold_4", "regime": "China devaluation and oil crash", "n": 157, "A_sharpe": 0.5373, "A_sortino": 0.5164, "A_excess_sharpe": 0.5275, "A_return_pct": 5.46, "A_hit_rate": 51.28, "A_n": 157, "A_bh_sharpe": 0.0098, "A_bh_return_pct": -1.05, "A_psr": 0.6628, "A_ic": 0.1276, "A_precision": 0.5175, "A_recall": 0.7284, "A_f1": 0.6051, "A_f2": 0.6735, "A_accuracy": 0.5096, "A_mcc": 0.0053, "A_tp": 59, "A_fp": 55, "A_tn": 21, "A_fn": 22, "B_sharpe": 3.2695, "B_sortino": 3.2519, "B_excess_sharpe": 3.2536, "B_return_pct": 126.36, "B_hit_rate": 61.15, "B_n": 157, "B_bh_sharpe": 0.0159, "B_bh_return_pct": -5.48, "B_psr": 0.994, "B_ic": 0.2051, "B_precision": 0.5896, "B_recall": 0.9294, "B_f1": 0.7215, "B_f2": 0.8333, "B_accuracy": 0.6115, "B_mcc": 0.2332, "B_tp": 79, "B_fp": 55, "B_tn": 17, "B_fn": 6, "D_sharpe": 0.5373, "D_sortino": 0.5164, "D_excess_sharpe": 0.5275, "D_return_pct": 5.46, "D_hit_rate": 51.28, "D_n": 157, "D_bh_sharpe": 0.0098, "D_bh_return_pct": -1.05, "D_psr": 0.6628, "D_ic": 0.1276, "D_precision": 0.5175, "D_recall": 0.7284, "D_f1": 0.6051, "D_f2": 0.6735, "D_accuracy": 0.5096, "D_mcc": 0.0053, "D_tp": 59, "D_fp": 55, "D_tn": 21, "D_fn": 22, "sharpe": 0.5373, "sortino": 0.5164, "return_pct": 5.46, "equity": 1054.6, "max_dd": 0.0, "win_rate": 51.28, "profit_factor": 0.0, "ic": 0.1276, "hit": 51.28, "psr": 0.6628, "bh_sharpe": 0.0098, "bh_return_pct": -1.05, "excess_sharpe": 0.5275, "precision": 0.5175, "recall": 0.7284, "f1": 0.6051, "f2": 0.6735, "mcc": 0.0053, "accuracy": 0.5096, "tp": 59, "fp": 55, "tn": 21, "fn": 22}, {"fold": "fold_5", "regime": "2018 Vol-mageddon + Q4 sell-off", "n": 177, "A_sharpe": -0.4267, "A_sortino": -0.4173, "A_excess_sharpe": -0.7365, "A_return_pct": -8.39, "A_hit_rate": 52.54, "A_n": 177, "A_bh_sharpe": 0.3098, "A_bh_return_pct": 3.19, "A_psr": 0.3613, "A_ic": -0.0105, "A_precision": 0.5655, "A_recall": 0.7961, "A_f1": 0.6613, "A_f2": 0.7361, "A_accuracy": 0.5254, "A_mcc": -0.0708, "A_tp": 82, "A_fp": 63, "A_tn": 11, "A_fn": 21, "B_sharpe": 2.214, "B_sortino": 1.8887, "B_excess_sharpe": 1.3224, "B_return_pct": 89.3, "B_hit_rate": 64.2, "B_n": 177, "B_bh_sharpe": 0.8917, "B_bh_return_pct": 23.8, "B_psr": 0.9623, "B_ic": 0.1397, "B_precision": 0.651, "B_recall": 0.8899, "B_f1": 0.7519, "B_f2": 0.8291, "B_accuracy": 0.6384, "B_mcc": 0.1669, "B_tp": 97, "B_fp": 52, "B_tn": 16, "B_fn": 12, "D_sharpe": -0.4267, "D_sortino": -0.4173, "D_excess_sharpe": -0.7365, "D_return_pct": -8.39, "D_hit_rate": 52.54, "D_n": 177, "D_bh_sharpe": 0.3098, "D_bh_return_pct": 3.19, "D_psr": 0.3613, "D_ic": -0.0105, "D_precision": 0.5655, "D_recall": 0.7961, "D_f1": 0.6613, "D_f2": 0.7361, "D_accuracy": 0.5254, "D_mcc": -0.0708, "D_tp": 82, "D_fp": 63, "D_tn": 11, "D_fn": 21, "sharpe": -0.4267, "sortino": -0.4173, "return_pct": -8.39, "equity": 916.1, "max_dd": 0.0, "win_rate": 52.54, "profit_factor": 0.0, "ic": -0.0105, "hit": 52.54, "psr": 0.3613, "bh_sharpe": 0.3098, "bh_return_pct": 3.19, "excess_sharpe": -0.7365, "precision": 0.5655, "recall": 0.7961, "f1": 0.6613, "f2": 0.7361, "mcc": -0.0708, "accuracy": 0.5254, "tp": 82, "fp": 63, "tn": 11, "fn": 21}, {"fold": "fold_6", "regime": "COVID crash and V-recovery", "n": 222, "A_sharpe": -1.2454, "A_sortino": -1.1341, "A_excess_sharpe": -2.1342, "A_return_pct": -38.05, "A_hit_rate": 47.75, "A_n": 222, "A_bh_sharpe": 0.8888, "A_bh_return_pct": 26.13, "A_psr": 0.1155, "A_ic": -0.0324, "A_precision": 0.5775, "A_recall": 0.5942, "A_f1": 0.5857, "A_f2": 0.5908, "A_accuracy": 0.4775, "A_mcc": -0.1213, "A_tp": 82, "A_fp": 60, "A_tn": 24, "A_fn": 56, "B_sharpe": -0.367, "B_sortino": -0.363, "B_excess_sharpe": -2.7554, "B_return_pct": -35.83, "B_hit_rate": 47.06, "B_n": 222, "B_bh_sharpe": 2.3884, "B_bh_return_pct": 243.18, "B_psr": 0.3651, "B_ic": -0.0179, "B_precision": 0.5877, "B_recall": 0.4891, "B_f1": 0.5339, "B_f2": 0.506, "B_accuracy": 0.473, "B_mcc": -0.0621, "B_tp": 67, "B_fp": 47, "B_tn": 38, "B_fn": 70, "D_sharpe": -1.2454, "D_sortino": -1.1341, "D_excess_sharpe": -2.1342, "D_return_pct": -38.05, "D_hit_rate": 47.75, "D_n": 222, "D_bh_sharpe": 0.8888, "D_bh_return_pct": 26.13, "D_psr": 0.1155, "D_ic": -0.0324, "D_precision": 0.5775, "D_recall": 0.5942, "D_f1": 0.5857, "D_f2": 0.5908, "D_accuracy": 0.4775, "D_mcc": -0.1213, "D_tp": 82, "D_fp": 60, "D_tn": 24, "D_fn": 56, "sharpe": -1.2454, "sortino": -1.1341, "return_pct": -38.05, "equity": 619.5, "max_dd": 0.0, "win_rate": 47.75, "profit_factor": 0.0, "ic": -0.0324, "hit": 47.75, "psr": 0.1155, "bh_sharpe": 0.8888, "bh_return_pct": 26.13, "excess_sharpe": -2.1342, "precision": 0.5775, "recall": 0.5942, "f1": 0.5857, "f2": 0.5908, "mcc": -0.1213, "accuracy": 0.4775, "tp": 82, "fp": 60, "tn": 24, "fn": 56}, {"fold": "fold_7", "regime": "Inflation bear, AI rally and 2025", "n": 425, "A_sharpe": 0.4341, "A_sortino": 0.4329, "A_excess_sharpe": -0.5374, "A_return_pct": 12.69, "A_hit_rate": 53.88, "A_n": 425, "A_bh_sharpe": 0.9715, "A_bh_return_pct": 37.12, "A_psr": 0.7155, "A_ic": 0.0166, "A_precision": 0.5823, "A_recall": 0.764, "A_f1": 0.6609, "A_f2": 0.7191, "A_accuracy": 0.5388, "A_mcc": -0.0221, "A_tp": 191, "A_fp": 137, "A_tn": 38, "A_fn": 59, "B_sharpe": 3.723, "B_sortino": 3.821, "B_excess_sharpe": 1.2203, "B_return_pct": 1255.86, "B_hit_rate": 63.68, "B_n": 425, "B_bh_sharpe": 2.5027, "B_bh_return_pct": 458.83, "B_psr": 1.0, "B_ic": 0.1479, "B_precision": 0.6687, "B_recall": 0.8137, "B_f1": 0.7341, "B_f2": 0.7799, "B_accuracy": 0.6353, "B_mcc": 0.1795, "B_tp": 214, "B_fp": 106, "B_tn": 56, "B_fn": 49, "D_sharpe": 0.4341, "D_sortino": 0.4329, "D_excess_sharpe": -0.5374, "D_return_pct": 12.69, "D_hit_rate": 53.88, "D_n": 425, "D_bh_sharpe": 0.9715, "D_bh_return_pct": 37.12, "D_psr": 0.7155, "D_ic": 0.0166, "D_precision": 0.5823, "D_recall": 0.764, "D_f1": 0.6609, "D_f2": 0.7191, "D_accuracy": 0.5388, "D_mcc": -0.0221, "D_tp": 191, "D_fp": 137, "D_tn": 38, "D_fn": 59, "sharpe": 0.4341, "sortino": 0.4329, "return_pct": 12.69, "equity": 1126.9, "max_dd": 0.0, "win_rate": 53.88, "profit_factor": 0.0, "ic": 0.0166, "hit": 53.88, "psr": 0.7155, "bh_sharpe": 0.9715, "bh_return_pct": 37.12, "excess_sharpe": -0.5374, "precision": 0.5823, "recall": 0.764, "f1": 0.6609, "f2": 0.7191, "mcc": -0.0221, "accuracy": 0.5388, "tp": 191, "fp": 137, "tn": 38, "fn": 59}], "per_window_val": [{"fold": "fold_1", "regime": "GFC peak crash (Lehman + Mar-2009 bottom)", "n": 104, "A_sharpe": -0.7496, "A_sortino": -0.6573, "A_excess_sharpe": -0.5824, "A_return_pct": -10.43, "A_hit_rate": 49.02, "A_n": 104, "A_bh_sharpe": -0.1672, "A_bh_return_pct": -3.81, "A_psr": 0.3115, "A_ic": 0.0808, "A_precision": 0.5065, "A_recall": 0.7222, "A_f1": 0.5954, "A_f2": 0.6655, "A_accuracy": 0.4904, "A_mcc": -0.0431, "A_tp": 39, "A_fp": 38, "A_tn": 12, "A_fn": 15, "B_sharpe": -0.9731, "B_sortino": -0.8414, "B_excess_sharpe": 1.301, "B_return_pct": -25.03, "B_hit_rate": 52.43, "B_n": 104, "B_bh_sharpe": -2.2741, "B_bh_return_pct": -44.12, "B_psr": 0.2623, "B_ic": -0.1015, "B_precision": 0.5132, "B_recall": 0.75, "B_f1": 0.6094, "B_f2": 0.6866, "B_accuracy": 0.5192, "B_mcc": 0.0434, "B_tp": 39, "B_fp": 37, "B_tn": 15, "B_fn": 13, "D_sharpe": -0.7496, "D_sortino": -0.6573, "D_excess_sharpe": -0.5824, "D_return_pct": -10.43, "D_hit_rate": 49.02, "D_n": 104, "D_bh_sharpe": -0.1672, "D_bh_return_pct": -3.81, "D_psr": 0.3115, "D_ic": 0.0808, "D_precision": 0.5065, "D_recall": 0.7222, "D_f1": 0.5954, "D_f2": 0.6655, "D_accuracy": 0.4904, "D_mcc": -0.0431, "D_tp": 39, "D_fp": 38, "D_tn": 12, "D_fn": 15, "sharpe": -0.7496, "sortino": -0.6573, "return_pct": -10.43, "equity": 895.6999999999999, "max_dd": 0.0, "win_rate": 49.02, "profit_factor": 0.0, "ic": 0.0808, "hit": 49.02, "psr": 0.3115, "bh_sharpe": -0.1672, "bh_return_pct": -3.81, "excess_sharpe": -0.5824, "precision": 0.5065, "recall": 0.7222, "f1": 0.5954, "f2": 0.6655, "mcc": -0.0431, "accuracy": 0.4904, "tp": 39, "fp": 38, "tn": 12, "fn": 15}, {"fold": "fold_2", "regime": "2011 US-downgrade + EU debt", "n": 96, "A_sharpe": -1.3883, "A_sortino": -1.2864, "A_excess_sharpe": -1.1141, "A_return_pct": -14.36, "A_hit_rate": 47.37, "A_n": 96, "A_bh_sharpe": -0.2741, "A_bh_return_pct": -4.09, "A_psr": 0.1933, "A_ic": -0.0185, "A_precision": 0.494, "A_recall": 0.82, "A_f1": 0.6165, "A_f2": 0.7244, "A_accuracy": 0.4688, "A_mcc": -0.1358, "A_tp": 41, "A_fp": 42, "A_tn": 4, "A_fn": 9, "B_sharpe": -2.319, "B_sortino": -2.1947, "B_excess_sharpe": -1.2916, "B_return_pct": -43.94, "B_hit_rate": 41.67, "B_n": 96, "B_bh_sharpe": -1.0274, "B_bh_return_pct": -25.58, "B_psr": 0.0719, "B_ic": -0.0564, "B_precision": 0.4085, "B_recall": 0.6744, "B_f1": 0.5088, "B_f2": 0.5967, "B_accuracy": 0.4167, "B_mcc": -0.1337, "B_tp": 29, "B_fp": 42, "B_tn": 11, "B_fn": 14, "D_sharpe": -1.3883, "D_sortino": -1.2864, "D_excess_sharpe": -1.1141, "D_return_pct": -14.36, "D_hit_rate": 47.37, "D_n": 96, "D_bh_sharpe": -0.2741, "D_bh_return_pct": -4.09, "D_psr": 0.1933, "D_ic": -0.0185, "D_precision": 0.494, "D_recall": 0.82, "D_f1": 0.6165, "D_f2": 0.7244, "D_accuracy": 0.4688, "D_mcc": -0.1358, "D_tp": 41, "D_fp": 42, "D_tn": 4, "D_fn": 9, "sharpe": -1.3883, "sortino": -1.2864, "return_pct": -14.36, "equity": 856.4000000000001, "max_dd": 0.0, "win_rate": 47.37, "profit_factor": 0.0, "ic": -0.0185, "hit": 47.37, "psr": 0.1933, "bh_sharpe": -0.2741, "bh_return_pct": -4.09, "excess_sharpe": -1.1141, "precision": 0.494, "recall": 0.82, "f1": 0.6165, "f2": 0.7244, "mcc": -0.1358, "accuracy": 0.4688, "tp": 41, "fp": 42, "tn": 4, "fn": 9}, {"fold": "fold_3", "regime": "Taper tantrum and 2014 H1", "n": 54, "A_sharpe": 4.1689, "A_sortino": 4.3069, "A_excess_sharpe": -0.5308, "A_return_pct": 9.3, "A_hit_rate": 61.11, "A_n": 54, "A_bh_sharpe": 4.6998, "A_bh_return_pct": 10.46, "A_psr": 0.9648, "A_ic": 0.1295, "A_precision": 0.6304, "A_recall": 0.8788, "A_f1": 0.7342, "A_f2": 0.8146, "A_accuracy": 0.6111, "A_mcc": 0.095, "A_tp": 29, "A_fp": 17, "A_tn": 4, "A_fn": 4, "B_sharpe": 5.8064, "B_sortino": 5.7345, "B_excess_sharpe": -3.2262, "B_return_pct": 31.78, "B_hit_rate": 70.37, "B_n": 54, "B_bh_sharpe": 9.0326, "B_bh_return_pct": 49.18, "B_psr": 0.995, "B_ic": 0.1497, "B_precision": 0.7561, "B_recall": 0.8378, "B_f1": 0.7949, "B_f2": 0.8201, "B_accuracy": 0.7037, "B_mcc": 0.2712, "B_tp": 31, "B_fp": 10, "B_tn": 7, "B_fn": 6, "D_sharpe": 4.1689, "D_sortino": 4.3069, "D_excess_sharpe": -0.5308, "D_return_pct": 9.3, "D_hit_rate": 61.11, "D_n": 54, "D_bh_sharpe": 4.6998, "D_bh_return_pct": 10.46, "D_psr": 0.9648, "D_ic": 0.1295, "D_precision": 0.6304, "D_recall": 0.8788, "D_f1": 0.7342, "D_f2": 0.8146, "D_accuracy": 0.6111, "D_mcc": 0.095, "D_tp": 29, "D_fp": 17, "D_tn": 4, "D_fn": 4, "sharpe": 4.1689, "sortino": 4.3069, "return_pct": 9.3, "equity": 1093.0, "max_dd": 0.0, "win_rate": 61.11, "profit_factor": 0.0, "ic": 0.1295, "hit": 61.11, "psr": 0.9648, "bh_sharpe": 4.6998, "bh_return_pct": 10.46, "excess_sharpe": -0.5308, "precision": 0.6304, "recall": 0.8788, "f1": 0.7342, "f2": 0.8146, "mcc": 0.095, "accuracy": 0.6111, "tp": 29, "fp": 17, "tn": 4, "fn": 4}, {"fold": "fold_4", "regime": "China devaluation and oil crash", "n": 96, "A_sharpe": -0.0607, "A_sortino": -0.0602, "A_excess_sharpe": 0.3634, "A_return_pct": -1.14, "A_hit_rate": 47.37, "A_n": 96, "A_bh_sharpe": -0.4241, "A_bh_return_pct": -3.73, "A_psr": 0.4851, "A_ic": 0.0334, "A_precision": 0.4675, "A_recall": 0.8, "A_f1": 0.5902, "A_f2": 0.7004, "A_accuracy": 0.4792, "A_mcc": -0.0049, "A_tp": 36, "A_fp": 41, "A_tn": 10, "A_fn": 9, "B_sharpe": -2.5442, "B_sortino": -2.2199, "B_excess_sharpe": -1.36, "B_return_pct": -37.41, "B_hit_rate": 42.71, "B_n": 96, "B_bh_sharpe": -1.1843, "B_bh_return_pct": -21.44, "B_psr": 0.0401, "B_ic": 0.0447, "B_precision": 0.4416, "B_recall": 0.7391, "B_f1": 0.5528, "B_f2": 0.6513, "B_accuracy": 0.4271, "B_mcc": -0.1516, "B_tp": 34, "B_fp": 43, "B_tn": 7, "B_fn": 12, "D_sharpe": -0.0607, "D_sortino": -0.0602, "D_excess_sharpe": 0.3634, "D_return_pct": -1.14, "D_hit_rate": 47.37, "D_n": 96, "D_bh_sharpe": -0.4241, "D_bh_return_pct": -3.73, "D_psr": 0.4851, "D_ic": 0.0334, "D_precision": 0.4675, "D_recall": 0.8, "D_f1": 0.5902, "D_f2": 0.7004, "D_accuracy": 0.4792, "D_mcc": -0.0049, "D_tp": 36, "D_fp": 41, "D_tn": 10, "D_fn": 9, "sharpe": -0.0607, "sortino": -0.0602, "return_pct": -1.14, "equity": 988.6, "max_dd": 0.0, "win_rate": 47.37, "profit_factor": 0.0, "ic": 0.0334, "hit": 47.37, "psr": 0.4851, "bh_sharpe": -0.4241, "bh_return_pct": -3.73, "excess_sharpe": 0.3634, "precision": 0.4675, "recall": 0.8, "f1": 0.5902, "f2": 0.7004, "mcc": -0.0049, "accuracy": 0.4792, "tp": 36, "fp": 41, "tn": 10, "fn": 9}, {"fold": "fold_5", "regime": "2018 Vol-mageddon + Q4 sell-off", "n": 54, "A_sharpe": -0.7907, "A_sortino": -0.7424, "A_excess_sharpe": -2.2187, "A_return_pct": -2.43, "A_hit_rate": 48.15, "A_n": 54, "A_bh_sharpe": 1.428, "A_bh_return_pct": 3.97, "A_psr": 0.3574, "A_ic": 0.0934, "A_precision": 0.5102, "A_recall": 0.8621, "A_f1": 0.641, "A_f2": 0.7576, "A_accuracy": 0.4815, "A_mcc": -0.1685, "A_tp": 25, "A_fp": 24, "A_tn": 1, "A_fn": 4, "B_sharpe": -2.515, "B_sortino": -2.0893, "B_excess_sharpe": -7.4472, "B_return_pct": -15.92, "B_hit_rate": 51.85, "B_n": 54, "B_bh_sharpe": 4.9322, "B_bh_return_pct": 34.93, "B_psr": 0.1198, "B_ic": -0.187, "B_precision": 0.6486, "B_recall": 0.6486, "B_f1": 0.6486, "B_f2": 0.6486, "B_accuracy": 0.5185, "B_mcc": -0.1161, "B_tp": 24, "B_fp": 13, "B_tn": 4, "B_fn": 13, "D_sharpe": -0.7907, "D_sortino": -0.7424, "D_excess_sharpe": -2.2187, "D_return_pct": -2.43, "D_hit_rate": 48.15, "D_n": 54, "D_bh_sharpe": 1.428, "D_bh_return_pct": 3.97, "D_psr": 0.3574, "D_ic": 0.0934, "D_precision": 0.5102, "D_recall": 0.8621, "D_f1": 0.641, "D_f2": 0.7576, "D_accuracy": 0.4815, "D_mcc": -0.1685, "D_tp": 25, "D_fp": 24, "D_tn": 1, "D_fn": 4, "sharpe": -0.7907, "sortino": -0.7424, "return_pct": -2.43, "equity": 975.7, "max_dd": 0.0, "win_rate": 48.15, "profit_factor": 0.0, "ic": 0.0934, "hit": 48.15, "psr": 0.3574, "bh_sharpe": 1.428, "bh_return_pct": 3.97, "excess_sharpe": -2.2187, "precision": 0.5102, "recall": 0.8621, "f1": 0.641, "f2": 0.7576, "mcc": -0.1685, "accuracy": 0.4815, "tp": 25, "fp": 24, "tn": 1, "fn": 4}, {"fold": "fold_6", "regime": "COVID crash and V-recovery", "n": 75, "A_sharpe": 2.3744, "A_sortino": 2.0726, "A_excess_sharpe": -1.925, "A_return_pct": 7.97, "A_hit_rate": 62.67, "A_n": 75, "A_bh_sharpe": 4.2994, "A_bh_return_pct": 14.68, "A_psr": 0.8897, "A_ic": 0.0589, "A_precision": 0.7091, "A_recall": 0.7647, "A_f1": 0.7358, "A_f2": 0.7529, "A_accuracy": 0.6267, "A_mcc": 0.1034, "A_tp": 39, "A_fp": 16, "A_tn": 8, "A_fn": 12, "B_sharpe": -2.0306, "B_sortino": -2.0495, "B_excess_sharpe": -16.3646, "B_return_pct": -14.84, "B_hit_rate": 42.67, "B_n": 75, "B_bh_sharpe": 14.3339, "B_bh_return_pct": 120.13, "B_psr": 0.1399, "B_ic": -0.0622, "B_precision": 0.8846, "B_recall": 0.3651, "B_f1": 0.5169, "B_f2": 0.4137, "B_accuracy": 0.4267, "B_mcc": 0.0886, "B_tp": 23, "B_fp": 3, "B_tn": 9, "B_fn": 40, "D_sharpe": 2.3744, "D_sortino": 2.0726, "D_excess_sharpe": -1.925, "D_return_pct": 7.97, "D_hit_rate": 62.67, "D_n": 75, "D_bh_sharpe": 4.2994, "D_bh_return_pct": 14.68, "D_psr": 0.8897, "D_ic": 0.0589, "D_precision": 0.7091, "D_recall": 0.7647, "D_f1": 0.7358, "D_f2": 0.7529, "D_accuracy": 0.6267, "D_mcc": 0.1034, "D_tp": 39, "D_fp": 16, "D_tn": 8, "D_fn": 12, "sharpe": 2.3744, "sortino": 2.0726, "return_pct": 7.97, "equity": 1079.6999999999998, "max_dd": 0.0, "win_rate": 62.67, "profit_factor": 0.0, "ic": 0.0589, "hit": 62.67, "psr": 0.8897, "bh_sharpe": 4.2994, "bh_return_pct": 14.68, "excess_sharpe": -1.925, "precision": 0.7091, "recall": 0.7647, "f1": 0.7358, "f2": 0.7529, "mcc": 0.1034, "accuracy": 0.6267, "tp": 39, "fp": 16, "tn": 8, "fn": 12}, {"fold": "fold_7", "regime": "Inflation bear, AI rally and 2025", "n": 114, "A_sharpe": 0.646, "A_sortino": 0.6846, "A_excess_sharpe": -2.199, "A_return_pct": 4.11, "A_hit_rate": 50.0, "A_n": 114, "A_bh_sharpe": 2.845, "A_bh_return_pct": 21.34, "A_psr": 0.6678, "A_ic": 0.0056, "A_precision": 0.5532, "A_recall": 0.7761, "A_f1": 0.646, "A_f2": 0.7182, "A_accuracy": 0