{"experiment_num": 40, "backbone": "xgboost", "description": "XGBoost depth=4 n_est=100 - capacity test between 50 (best) and 300 (worse)", "config": {"seq_len": 60, "lr": 0.0003, "batch_size": 32, "epochs": 50, "weight_decay": 1e-05, "patience": 10, "warmup_epochs": 0, "head_dropout": 0.1, "huber_delta": 1.0, "grad_clip": 1.0, "seed": 42, "hidden_size": null, "num_layers": null, "max_depth": 4, "gbm_lr": 0.05, "n_estimators": 100}, "composite": -1.335, "test_pos_folds": 4, "val_pos_folds": 2, "val_loss": null, "elapsed_sec": 79.0, "timestamp": "2026-04-27T18:54:25", "sharpe": 0.0349, "val_sharpe": -1.035, "ic": -0.0034, "hit": 47.74, "psr": 0.5287, "equity": 928.8, "return_pct": -7.12, "bh_sharpe": 1.2194, "bh_return_pct": 187.05, "excess_sharpe": -1.1844, "B_sharpe": 0.0596, "B_excess_sharpe": -2.7686, "B_return_pct": -28.77, "D_sharpe": 0.2338, "D_excess_sharpe": -0.9855, "D_return_pct": 12.34, "per_window": [{"fold": "fold_1", "regime": "GFC peak crash (Lehman + Mar-2009 bottom)", "n": 66, "A_sharpe": 2.0617, "A_sortino": 2.3187, "A_excess_sharpe": 1.4896, "A_return_pct": 20.0, "A_hit_rate": 53.03, "A_n": 66, "A_bh_sharpe": 0.5721, "A_bh_return_pct": 3.85, "A_psr": 0.8563, "A_ic": 0.0176, "B_sharpe": 1.4637, "B_sortino": 1.443, "B_excess_sharpe": -0.5832, "B_return_pct": 24.1, "B_hit_rate": 56.92, "B_n": 66, "B_bh_sharpe": 2.0469, "B_bh_return_pct": 39.28, "B_psr": 0.771, "B_ic": 0.1519, "D_sharpe": 2.1111, "D_sortino": 2.0601, "D_excess_sharpe": 1.539, "D_return_pct": 20.55, "D_hit_rate": 57.58, "D_n": 66, "D_bh_sharpe": 0.5721, "D_bh_return_pct": 3.85, "D_psr": 0.8542, "D_ic": 0.1145, "sharpe": 2.0617, "sortino": 2.3187, "return_pct": 20.0, "equity": 1200.0, "max_dd": 0.0, "win_rate": 53.03, "profit_factor": 0.0, "ic": 0.0176, "hit": 53.03, "psr": 0.8563, "bh_sharpe": 0.5721, "bh_return_pct": 3.85, "excess_sharpe": 1.4896, "precision": 0.5625, "recall": 0.5143, "f1": 0.5373, "f2": 0.5233, "accuracy": 0.5303, "mcc": 0.0626, "tp": 18, "fp": 14, "tn": 17, "fn": 17, "A_precision": 0.5625, "A_recall": 0.5143, "A_f1": 0.5373, "A_f2": 0.5233, "A_accuracy": 0.5303, "A_mcc": 0.0626, "A_tp": 18, "A_fp": 14, "A_tn": 17, "A_fn": 17}, {"fold": "fold_2", "regime": "2011 US-downgrade + EU debt", "n": 87, "A_sharpe": 0.9644, "A_sortino": 1.0968, "A_excess_sharpe": -4.0576, "A_return_pct": 4.93, "A_hit_rate": 48.84, "A_n": 87, "A_bh_sharpe": 5.022, "A_bh_return_pct": 29.23, "A_psr": 0.7167, "A_ic": -0.0469, "B_sharpe": 7.7956, "B_sortino": 7.9701, "B_excess_sharpe": -3.3413, "B_return_pct": 122.62, "B_hit_rate": 72.41, "B_n": 87, "B_bh_sharpe": 11.1369, "B_bh_return_pct": 185.4, "B_psr": 1.0, "B_ic": 0.2488, "D_sharpe": 3.773, "D_sortino": 4.365, "D_excess_sharpe": -1.249, "D_return_pct": 21.6, "D_hit_rate": 61.63, "D_n": 87, "D_bh_sharpe": 5.022, "D_bh_return_pct": 29.23, "D_psr": 0.9916, "D_ic": 0.0747, "sharpe": 0.9644, "sortino": 1.0968, "return_pct": 4.93, "equity": 1049.3, "max_dd": 0.0, "win_rate": 48.84, "profit_factor": 0.0, "ic": -0.0469, "hit": 48.84, "psr": 0.7167, "bh_sharpe": 5.022, "bh_return_pct": 29.23, "excess_sharpe": -4.0576, "precision": 0.5962, "recall": 0.5741, "f1": 0.5849, "f2": 0.5784, "accuracy": 0.4943, "mcc": -0.0616, "tp": 31, "fp": 21, "tn": 12, "fn": 23, "A_precision": 0.5962, "A_recall": 0.5741, "A_f1": 0.5849, "A_f2": 0.5784, "A_accuracy": 0.4943, "A_mcc": -0.0616, "A_tp": 31, "A_fp": 21, "A_tn": 12, "A_fn": 23}, {"fold": "fold_3", "regime": "Taper tantrum and 2014 H1", "n": 129, "A_sharpe": 1.0493, "A_sortino": 0.9119, "A_excess_sharpe": -0.7185, "A_return_pct": 6.67, "A_hit_rate": 57.03, "A_n": 129, "A_bh_sharpe": 1.7678, "A_bh_return_pct": 11.76, "A_psr": 0.7657, "A_ic": 0.0304, "B_sharpe": 4.3907, "B_sortino": 4.5017, "B_excess_sharpe": 0.1434, "B_return_pct": 66.75, "B_hit_rate": 62.79, "B_n": 129, "B_bh_sharpe": 4.2474, "B_bh_return_pct": 64.1, "B_psr": 0.9987, "B_ic": 0.0261, "D_sharpe": 2.8059, "D_sortino": 2.5375, "D_excess_sharpe": 1.0381, "D_return_pct": 19.4, "D_hit_rate": 61.72, "D_n": 129, "D_bh_sharpe": 1.7678, "D_bh_return_pct": 11.76, "D_psr": 0.9687, "D_ic": 0.0892, "sharpe": 1.0493, "sortino": 0.9119, "return_pct": 6.67, "equity": 1066.7, "max_dd": 0.0, "win_rate": 57.03, "profit_factor": 0.0, "ic": 0.0304, "hit": 57.03, "psr": 0.7657, "bh_sharpe": 1.7678, "bh_return_pct": 11.76, "excess_sharpe": -0.7185, "precision": 0.6, "recall": 0.8462, "f1": 0.7021, "f2": 0.782, "accuracy": 0.5659, "mcc": -0.0229, "tp": 66, "fp": 44, "tn": 7, "fn": 12, "A_precision": 0.6, "A_recall": 0.8462, "A_f1": 0.7021, "A_f2": 0.782, "A_accuracy": 0.5659, "A_mcc": -0.0229, "A_tp": 66, "A_fp": 44, "A_tn": 7, "A_fn": 12}, {"fold": "fold_4", "regime": "China devaluation and oil crash", "n": 108, "A_sharpe": -2.263, "A_sortino": -2.0661, "A_excess_sharpe": -1.5732, "A_return_pct": -18.57, "A_hit_rate": 45.79, "A_n": 108, "A_bh_sharpe": -0.6898, "A_bh_return_pct": -6.71, "A_psr": 0.0682, "A_ic": -0.0257, "B_sharpe": -3.7277, "B_sortino": -3.5686, "B_excess_sharpe": -1.7702, "B_return_pct": -51.65, "B_hit_rate": 36.11, "B_n": 108, "B_bh_sharpe": -1.9575, "B_bh_return_pct": -33.56, "B_psr": 0.0084, "B_ic": -0.1326, "D_sharpe": -3.2045, "D_sortino": -2.7893, "D_excess_sharpe": -2.5148, "D_return_pct": -24.76, "D_hit_rate": 43.93, "D_n": 108, "D_bh_sharpe": -0.6898, "D_bh_return_pct": -6.71, "D_psr": 0.0152, "D_ic": -0.0639, "sharpe": -2.263, "sortino": -2.0661, "return_pct": -18.57, "equity": 814.3000000000001, "max_dd": 0.0, "win_rate": 45.79, "profit_factor": 0.0, "ic": -0.0257, "hit": 45.79, "psr": 0.0682, "bh_sharpe": -0.6898, "bh_return_pct": -6.71, "excess_sharpe": -1.5732, "precision": 0.459, "recall": 0.5283, "f1": 0.4912, "f2": 0.5128, "accuracy": 0.463, "mcc": -0.0723, "tp": 28, "fp": 33, "tn": 22, "fn": 25, "A_precision": 0.459, "A_recall": 0.5283, "A_f1": 0.4912, "A_f2": 0.5128, "A_accuracy": 0.463, "A_mcc": -0.0723, "A_tp": 28, "A_fp": 33, "A_tn": 22, "A_fn": 25}, {"fold": "fold_5", "regime": "2018 Vol-mageddon + Q4 sell-off", "n": 128, "A_sharpe": -0.3062, "A_sortino": -0.3271, "A_excess_sharpe": -1.4573, "A_return_pct": -4.97, "A_hit_rate": 47.66, "A_n": 128, "A_bh_sharpe": 1.1511, "A_bh_return_pct": 13.19, "A_psr": 0.4144, "A_ic": -0.0276, "B_sharpe": -3.5418, "B_sortino": -3.3759, "B_excess_sharpe": -6.3536, "B_return_pct": -58.3, "B_hit_rate": 37.01, "B_n": 128, "B_bh_sharpe": 2.8119, "B_bh_return_pct": 82.25, "B_psr": 0.006, "B_ic": -0.1856, "D_sharpe": -0.9987, "D_sortino": -1.1189, "D_excess_sharpe": -2.1498, "D_return_pct": -12.54, "D_hit_rate": 41.41, "D_n": 128, "D_bh_sharpe": 1.1511, "D_bh_return_pct": 13.19, "D_psr": 0.244, "D_ic": -0.1349, "sharpe": -0.3062, "sortino": -0.3271, "return_pct": -4.97, "equity": 950.3000000000001, "max_dd": 0.0, "win_rate": 47.66, "profit_factor": 0.0, "ic": -0.0276, "hit": 47.66, "psr": 0.4144, "bh_sharpe": 1.1511, "bh_return_pct": 13.19, "excess_sharpe": -1.4573, "precision": 0.5714, "recall": 0.5641, "f1": 0.5677, "f2": 0.5656, "accuracy": 0.4766, "mcc": -0.0956, "tp": 44, "fp": 33, "tn": 17, "fn": 34, "A_precision": 0.5714, "A_recall": 0.5641, "A_f1": 0.5677, "A_f2": 0.5656, "A_accuracy": 0.4766, "A_mcc": -0.0956, "A_tp": 44, "A_fp": 33, "A_tn": 17, "A_fn": 34}, {"fold": "fold_6", "regime": "COVID crash and V-recovery", "n": 173, "A_sharpe": 0.173, "A_sortino": 0.1865, "A_excess_sharpe": -2.1531, "A_return_pct": 0.87, "A_hit_rate": 47.98, "A_n": 173, "A_bh_sharpe": 2.3261, "A_bh_return_pct": 43.81, "A_psr": 0.5569, "A_ic": 0.0384, "B_sharpe": 0.01, "B_sortino": 0.0109, "B_excess_sharpe": -5.736, "B_return_pct": -8.03, "B_hit_rate": 48.26, "B_n": 173, "B_bh_sharpe": 5.746, "B_bh_return_pct": 499.04, "B_psr": 0.5033, "B_ic": 0.0849, "D_sharpe": -0.0555, "D_sortino": -0.0668, "D_excess_sharpe": -2.3816, "D_return_pct": -2.9, "D_hit_rate": 40.46, "D_n": 173, "D_bh_sharpe": 2.3261, "D_bh_return_pct": 43.81, "D_psr": 0.4817, "D_ic": 0.0034, "sharpe": 0.173, "sortino": 0.1865, "return_pct": 0.87, "equity": 1008.6999999999999, "max_dd": 0.0, "win_rate": 47.98, "profit_factor": 0.0, "ic": 0.0384, "hit": 47.98, "psr": 0.5569, "bh_sharpe": 2.3261, "bh_return_pct": 43.81, "excess_sharpe": -2.1531, "precision": 0.6292, "recall": 0.4956, "f1": 0.5545, "f2": 0.5176, "accuracy": 0.4798, "mcc": -0.0518, "tp": 56, "fp": 33, "tn": 27, "fn": 57, "A_precision": 0.6292, "A_recall": 0.4956, "A_f1": 0.5545, "A_f2": 0.5176, "A_accuracy": 0.4798, "A_mcc": -0.0518, "A_tp": 56, "A_fp": 33, "A_tn": 27, "A_fn": 57}, {"fold": "fold_7", "regime": "Inflation bear, AI rally and 2025", "n": 376, "A_sharpe": -0.2507, "A_sortino": -0.294, "A_excess_sharpe": -1.054, "A_return_pct": -11.4, "A_hit_rate": 43.88, "A_n": 376, "A_bh_sharpe": 0.8033, "A_bh_return_pct": 26.02, "A_psr": 0.3812, "A_ic": 0.0101, "B_sharpe": -0.031, "B_sortino": -0.035, "B_excess_sharpe": -1.9627, "B_return_pct": -16.62, "B_hit_rate": 44.53, "B_n": 376, "B_bh_sharpe": 1.9317, "B_bh_return_pct": 222.05, "B_psr": 0.4849, "B_ic": -0.0271, "D_sharpe": 0.1234, "D_sortino": 0.1604, "D_excess_sharpe": -0.6799, "D_return_pct": 0.44, "D_hit_rate": 42.55, "D_n": 376, "D_bh_sharpe": 0.8033, "D_bh_return_pct": 26.02, "D_psr": 0.5603, "D_ic": -0.0447, "sharpe": -0.2507, "sortino": -0.294, "return_pct": -11.4, "equity": 886.0, "max_dd": 0.0, "win_rate": 43.88, "profit_factor": 0.0, "ic": 0.0101, "hit": 43.88, "psr": 0.3812, "bh_sharpe": 0.8033, "bh_return_pct": 26.02, "excess_sharpe": -1.054, "precision": 0.5758, "recall": 0.1719, "f1": 0.2648, "f2": 0.2, "accuracy": 0.4388, "mcc": -0.0113, "tp": 38, "fp": 28, "tn": 127, "fn": 183, "A_precision": 0.5758, "A_recall": 0.1719, "A_f1": 0.2648, "A_f2": 0.2, "A_accuracy": 0.4388, "A_mcc": -0.0113, "A_tp": 38, "A_fp": 28, "A_tn": 127, "A_fn": 183}], "per_window_val": [{"fold": "fold_1", "regime": "GFC peak crash (Lehman + Mar-2009 bottom)", "n": 65, "A_sharpe": -1.6776, "A_sortino": -1.5217, "A_excess_sharpe": 0.548, "A_return_pct": -14.84, "A_hit_rate": 46.03, "A_n": 65, "A_bh_sharpe": -2.2257, "A_bh_return_pct": -18.74, "A_psr": 0.1921, "A_ic": 0.0592, "B_sharpe": -2.4336, "B_sortino": -2.4777, "B_excess_sharpe": 4.6888, "B_return_pct": -41.04, "B_hit_rate": 43.08, "B_n": 65, "B_bh_sharpe": -7.1223, "B_bh_return_pct": -73.11, "B_psr": 0.1267, "B_ic": 0.3811, "D_sharpe": 0.5667, "D_sortino": 0.5863, "D_excess_sharpe": 2.7923, "D_return_pct": 3.54, "D_hit_rate": 50.79, "D_n": 65, "D_bh_sharpe": -2.2257, "D_bh_return_pct": -18.74, "D_psr": 0.6132, "D_ic": 0.2699, "sharpe": -1.6776, "sortino": -1.5217, "return_pct": -14.84, "equity": 851.6, "max_dd": 0.0, "win_rate": 46.03, "profit_factor": 0.0, "ic": 0.0592, "hit": 46.03, "psr": 0.1921, "bh_sharpe": -2.2257, "bh_return_pct": -18.74, "excess_sharpe": 0.548}, {"fold": "fold_2", "regime": "2011 US-downgrade + EU debt", "n": 47, "A_sharpe": -1.3997, "A_sortino": -1.1801, "A_excess_sharpe": -1.2056, "A_return_pct": -9.67, "A_hit_rate": 53.19, "A_n": 47, "A_bh_sharpe": -0.1941, "A_bh_return_pct": -2.36, "A_psr": 0.27, "A_ic": -0.008, "B_sharpe": -0.0326, "B_sortino": -0.0309, "B_excess_sharpe": 1.5797, "B_return_pct": -5.65, "B_hit_rate": 48.94, "B_n": 47, "B_bh_sharpe": -1.6123, "B_bh_return_pct": -24.3, "B_psr": 0.4944, "B_ic": 0.2339, "D_sharpe": 0.2523, "D_sortino": 0.2103, "D_excess_sharpe": 0.4464, "D_return_pct": 0.5, "D_hit_rate": 59.57, "D_n": 47, "D_bh_sharpe": -0.1941, "D_bh_return_pct": -2.36, "D_psr": 0.5427, "D_ic": 0.0933, "sharpe": -1.3997, "sortino": -1.1801, "return_pct": -9.67, "equity": 903.3, "max_dd": 0.0, "win_rate": 53.19, "profit_factor": 0.0, "ic": -0.008, "hit": 53.19, "psr": 0.27, "bh_sharpe": -0.1941, "bh_return_pct": -2.36, "excess_sharpe": -1.2056}, {"fold": "fold_3", "regime": "Taper tantrum and 2014 H1", "n": 5, "A_sharpe": 18.1191, "A_sortino": 39.9504, "A_excess_sharpe": 19.4385, "A_return_pct": 0.0, "A_hit_rate": 0.0, "A_n": 5, "A_bh_sharpe": -1.3194, "A_bh_return_pct": -0.21, "A_psr": 0.9974, "A_ic": 0.9, "B_sharpe": -3.4221, "B_sortino": -3.3187, "B_excess_sharpe": 22.4484, "B_return_pct": -0.98, "B_hit_rate": 40.0, "B_n": 5, "B_bh_sharpe": -25.8705, "B_bh_return_pct": -3.84, "B_psr": 0.336, "B_ic": -0.1, "D_sharpe": -2.362, "D_sortino": -2.3218, "D_excess_sharpe": -1.0426, "D_return_pct": -0.37, "D_hit_rate": 40.0, "D_n": 5, "D_bh_sharpe": -1.3194, "D_bh_return_pct": -0.21, "D_psr": 0.3828, "D_ic": 0.1, "sharpe": 18.1191, "sortino": 39.9504, "return_pct": 0.0, "equity": 1000.0, "max_dd": 0.0, "win_rate": 0.0, "profit_factor": 0.0, "ic": 0.9, "hit": 0.0, "psr": 0.9974, "bh_sharpe": -1.3194, "bh_return_pct": -0.21, "excess_sharpe": 19.4385}, {"fold": "fold_4", "regime": "China devaluation and oil crash", "n": 47, "A_sharpe": -1.0692, "A_sortino": -1.0514, "A_excess_sharpe": 0.7546, "A_return_pct": -5.43, "A_hit_rate": 44.68, "A_n": 47, "A_bh_sharpe": -1.8238, "A_bh_return_pct": -8.68, "A_psr": 0.3238, "A_ic": -0.1325, "B_sharpe": -2.22, "B_sortino": -1.9053, "B_excess_sharpe": 0.0, "B_return_pct": -23.98, "B_hit_rate": 44.68, "B_n": 47, "B_bh_sharpe": -2.22, "B_bh_return_pct": -23.98, "B_psr": 0.1505, "B_ic": 0.5557, "D_sharpe": -1.8238, "D_sortino": -1.7153, "D_excess_sharpe": 0.0, "D_return_pct": -8.68, "D_hit_rate": 44.68, "D_n": 47, "D_bh_sharpe": -1.8238, "D_bh_return_pct": -8.68, "D_psr": 0.2173, "D_ic": 0.3302, "sharpe": -1.0692, "sortino": -1.0514, "return_pct": -5.43, "equity": 945.6999999999999, "max_dd": 0.0, "win_rate": 44.68, "profit_factor": 0.0, "ic": -0.1325, "hit": 44.68, "psr": 0.3238, "bh_sharpe": -1.8238, "bh_return_pct": -8.68, "excess_sharpe": 0.7546}, {"fold": "fold_5", "regime": "2018 Vol-mageddon + Q4 sell-off", "n": 5, "A_sharpe": -5.2428, "A_sortino": -4.6528, "A_excess_sharpe": 4.894, "A_return_pct": -1.86, "A_hit_rate": 40.0, "A_n": 5, "A_bh_sharpe": -10.1368, "A_bh_return_pct": -3.15, "A_psr": 0.2615, "A_ic": 0.0, "B_sharpe": 5.6858, "B_sortino": 6.0578, "B_excess_sharpe": 0.0, "B_return_pct": 4.22, "B_hit_rate": 60.0, "B_n": 5, "B_bh_sharpe": 5.6858, "B_bh_return_pct": 4.22, "B_psr": 0.753, "B_ic": 0.6, "D_sharpe": -10.1368, "D_sortino": -6.9937, "D_excess_sharpe": 0.0, "D_return_pct": -3.15, "D_hit_rate": 40.0, "D_n": 5, "D_bh_sharpe": -10.1368, "D_bh_return_pct": -3.15, "D_psr": 0.0985, "D_ic": 0.2, "sharpe": -5.2428, "sortino": -4.6528, "return_pct": -1.86, "equity": 981.4000000000001, "max_dd": 0.0, "win_rate": 40.0, "profit_factor": 0.0, "ic": 0.0, "hit": 40.0, "psr": 0.2615, "bh_sharpe": -10.1368, "bh_return_pct": -3.15, "excess_sharpe": 4.894}, {"fold": "fold_6", "regime": "COVID crash and V-recovery", "n": 26, "A_sharpe": 2.7248, "A_sortino": 3.3676, "A_excess_sharpe": -0.5604, "A_return_pct": 3.99, "A_hit_rate": 46.15, "A_n": 26, "A_bh_sharpe": 3.2852, "A_bh_return_pct": 4.82, "A_psr": 0.8072, "A_ic": -0.0154, "B_sharpe": 5.2128, "B_sortino": 4.908, "B_excess_sharpe": -7.7664, "B_return_pct": 17.21, "B_hit_rate": 69.23, "B_n": 26, "B_bh_sharpe": 12.9792, "B_bh_return_pct": 38.76, "B_psr": 0.9438, "B_ic": 0.3026, "D_sharpe": 1.6942, "D_sortino": 2.2224, "D_excess_sharpe": -1.591, "D_return_pct": 2.44, "D_hit_rate": 42.31, "D_n": 26, "D_bh_sharpe": 3.2852, "D_bh_return_pct": 4.82, "D_psr": 0.7076, "D_ic": 0.1385, "sharpe": 2.7248, "sortino": 3.3676, "return_pct": 3.99, "equity": 1039.9, "max_dd": 0.0, "win_rate": 46.15, "profit_factor": 0.0, "ic": -0.0154, "hit": 46.15, "psr": 0.8072, "bh_sharpe": 3.2852, "bh_return_pct": 4.82, "excess_sharpe": -0.5604}, {"fold": "fold_7", "regime": "Inflation bear, AI rally and 2025", "n": 65, "A_sharpe": -0.9554, "A_sortino": -0.9297, "A_excess_sharpe": -3.0343, "A_return_pct": -3.99, "A_hit_rate": 50.77, "A_n": 65, "A_bh_sharpe": 2.0789, "A_bh_return_pct": 8.17, "A_psr": 0.3168, "A_ic": 0.0302, "B_sharpe": -4.4671, "B_sortino": -4.2266, "B_excess_sharpe": -9.6985, "B_return_pct": -28.82, "B_hit_rate": 33.85, "B_n": 65, "B_bh_sharpe": 5.2314, "B_bh_return_pct": 44.53, "B_psr": 0.0139, "B_ic": 0.075, "D_sharpe": -1.2172, "D_sortino": -1.1449, "D_excess_sharpe": -3.2961, "D_return_pct": -4.97, "D_hit_rate": 47.69, "D_n": 65, "D_bh_sharpe": 2.0789, "D_bh_return_pct": 8.17, "D_psr": 0.2681, "D_ic": 0.0389, "sharpe": -0.9554, "sortino": -0.9297, "return_pct": -3.99, "equity": 960.0999999999999, "max_dd": 0.0, "win_rate": 50.77, "profit_factor": 0.0, "ic": 0.0302, "hit": 50.77, "psr": 0.3168, "bh_sharpe": 2.0789, "bh_return_pct": 8.17, "excess_sharpe": -3.0343}], "status": "DISCARD", "precision": 0.577, "recall": 0.4446, "f1": 0.5022, "f2": 0.466, "accuracy": 0.478, "mcc": -0.0286, "tp": 281, "fp": 206, "tn": 229, "fn": 351, "test_sharpe": 0.0349, "A_sharpe": 0.0349, "A_excess_sharpe": -1.1844, "A_return_pct": -7.12, "A_precision": 0.577, "A_recall": 0.4446, "A_f1": 0.5022, "A_f2": 0.466, "A_accuracy": 0.478, "A_mcc": -0.0286, "A_tp": 281, "A_fp": 206, "A_tn": 229, "A_fn": 351, "A_psr": 0.5287, "A_ic": -0.0034, "A_hit_rate": 47.74, "A_bh_sharpe": 1.2194, "A_bh_return_pct": 187.05}
