{"experiment_num": 67, "backbone": "lstm", "description": "LSTM @ exp 66 huber=0.1 seed=42 - multi-seed verify exp 66's F1 record (was +1.61 seed=0)", "config": {"seq_len": 10, "lr": 0.001, "batch_size": 16, "epochs": 100, "weight_decay": 0.0007, "patience": 15, "warmup_epochs": 0, "head_dropout": 0.1, "huber_delta": 0.1, "grad_clip": 1.0, "seed": 42, "hidden_size": null, "num_layers": null, "max_depth": null, "gbm_lr": null, "n_estimators": null}, "composite": -0.0253, "test_pos_folds": 5, "val_pos_folds": 4, "val_loss": -2.8800231891780035, "elapsed_sec": 45.1, "timestamp": "2026-04-27T22:57:22", "sharpe": 0.1747, "val_sharpe": 0.7444, "ic": 0.0137, "hit": 55.79, "psr": 0.66, "equity": 1060.0, "return_pct": 6.0, "bh_sharpe": 0.6042, "bh_return_pct": 103.49, "excess_sharpe": -0.4295, "B_sharpe": 0.1077, "B_excess_sharpe": -1.5931, "B_return_pct": -38.33, "D_sharpe": 0.1747, "D_excess_sharpe": -0.4295, "D_return_pct": 6.0, "precision": 0.5693, "recall": 0.9269, "f1": 0.7053, "f2": 0.8234, "mcc": -0.0231, "accuracy": 0.5567, "val_precision": 0.5552, "val_recall": 0.9635, "val_f1": 0.7044, "val_f2": 0.84, "val_mcc": 0.0037, "val_accuracy": 0.5514, "per_window": [{"fold": "fold_1", "regime": "GFC peak crash (Lehman + Mar-2009 bottom)", "n": 115, "A_sharpe": -0.9004, "A_sortino": -0.8953, "A_excess_sharpe": -0.4563, "A_return_pct": -22.74, "A_hit_rate": 46.96, "A_n": 115, "A_bh_sharpe": -0.4441, "A_bh_return_pct": -14.4, "A_psr": 0.273, "A_ic": 0.0878, "A_precision": 0.4673, "A_recall": 0.9259, "A_f1": 0.6211, "A_f2": 0.774, "A_accuracy": 0.4696, "A_mcc": -0.0167, "A_tp": 50, "A_fp": 57, "A_tn": 4, "A_fn": 4, "B_sharpe": 0.3776, "B_sortino": 0.3738, "B_excess_sharpe": 0.6754, "B_return_pct": -3.38, "B_hit_rate": 52.63, "B_n": 115, "B_bh_sharpe": -0.2978, "B_bh_return_pct": -27.23, "B_psr": 0.6002, "B_ic": 0.2914, "B_precision": 0.5208, "B_recall": 0.8475, "B_f1": 0.6452, "B_f2": 0.753, "B_accuracy": 0.5217, "B_mcc": 0.035, "B_tp": 50, "B_fp": 46, "B_tn": 10, "B_fn": 9, "D_sharpe": -0.9004, "D_sortino": -0.8953, "D_excess_sharpe": -0.4563, "D_return_pct": -22.74, "D_hit_rate": 46.96, "D_n": 115, "D_bh_sharpe": -0.4441, "D_bh_return_pct": -14.4, "D_psr": 0.273, "D_ic": 0.0878, "D_precision": 0.4673, "D_recall": 0.9259, "D_f1": 0.6211, "D_f2": 0.774, "D_accuracy": 0.4696, "D_mcc": -0.0167, "D_tp": 50, "D_fp": 57, "D_tn": 4, "D_fn": 4, "sharpe": -0.9004, "sortino": -0.8953, "return_pct": -22.74, "equity": 772.5999999999999, "max_dd": 0.0, "win_rate": 46.96, "profit_factor": 0.0, "ic": 0.0878, "hit": 46.96, "psr": 0.273, "bh_sharpe": -0.4441, "bh_return_pct": -14.4, "excess_sharpe": -0.4563, "precision": 0.4673, "recall": 0.9259, "f1": 0.6211, "f2": 0.774, "mcc": -0.0167, "accuracy": 0.4696, "tp": 50, "fp": 57, "tn": 4, "fn": 4}, {"fold": "fold_2", "regime": "2011 US-downgrade + EU debt", "n": 136, "A_sharpe": 1.9003, "A_sortino": 1.8077, "A_excess_sharpe": 0.1676, "A_return_pct": 21.96, "A_hit_rate": 59.26, "A_n": 136, "A_bh_sharpe": 1.7327, "A_bh_return_pct": 19.75, "A_psr": 0.9157, "A_ic": -0.0137, "A_precision": 0.5821, "A_recall": 1.0, "A_f1": 0.7358, "A_f2": 0.8744, "A_accuracy": 0.5882, "A_mcc": 0.1417, "A_tp": 78, "A_fp": 56, "A_tn": 2, "A_fn": 0, "B_sharpe": 1.3128, "B_sortino": 1.3218, "B_excess_sharpe": -2.7531, "B_return_pct": 30.41, "B_hit_rate": 55.88, "B_n": 136, "B_bh_sharpe": 4.0659, "B_bh_return_pct": 148.68, "B_psr": 0.8326, "B_ic": 0.0999, "B_precision": 0.6915, "B_recall": 0.6771, "B_f1": 0.6842, "B_f2": 0.6799, "B_accuracy": 0.5588, "B_mcc": -0.0473, "B_tp": 65, "B_fp": 29, "B_tn": 11, "B_fn": 31, "D_sharpe": 1.9003, "D_sortino": 1.8077, "D_excess_sharpe": 0.1676, "D_return_pct": 21.96, "D_hit_rate": 59.26, "D_n": 136, "D_bh_sharpe": 1.7327, "D_bh_return_pct": 19.75, "D_psr": 0.9157, "D_ic": -0.0137, "D_precision": 0.5821, "D_recall": 1.0, "D_f1": 0.7358, "D_f2": 0.8744, "D_accuracy": 0.5882, "D_mcc": 0.1417, "D_tp": 78, "D_fp": 56, "D_tn": 2, "D_fn": 0, "sharpe": 1.9003, "sortino": 1.8077, "return_pct": 21.96, "equity": 1219.6, "max_dd": 0.0, "win_rate": 59.26, "profit_factor": 0.0, "ic": -0.0137, "hit": 59.26, "psr": 0.9157, "bh_sharpe": 1.7327, "bh_return_pct": 19.75, "excess_sharpe": 0.1676, "precision": 0.5821, "recall": 1.0, "f1": 0.7358, "f2": 0.8744, "mcc": 0.1417, "accuracy": 0.5882, "tp": 78, "fp": 56, "tn": 2, "fn": 0}, {"fold": "fold_3", "regime": "Taper tantrum and 2014 H1", "n": 178, "A_sharpe": 1.6482, "A_sortino": 1.485, "A_excess_sharpe": 0.3037, "A_return_pct": 15.54, "A_hit_rate": 58.19, "A_n": 178, "A_bh_sharpe": 1.3445, "A_bh_return_pct": 12.41, "A_psr": 0.9083, "A_ic": 0.0283, "A_precision": 0.5795, "A_recall": 0.9903, "A_f1": 0.7312, "A_f2": 0.8673, "A_accuracy": 0.5787, "A_mcc": 0.017, "A_tp": 102, "A_fp": 74, "A_tn": 1, "A_fn": 1, "B_sharpe": -0.0494, "B_sortino": -0.049, "B_excess_sharpe": -3.0977, "B_return_pct": -3.42, "B_hit_rate": 48.88, "B_n": 178, "B_bh_sharpe": 3.0483, "B_bh_return_pct": 71.83, "B_psr": 0.4835, "B_ic": -0.0283, "B_precision": 0.5672, "B_recall": 0.6972, "B_f1": 0.6255, "B_f2": 0.6667, "B_accuracy": 0.4888, "B_mcc": -0.1619, "B_tp": 76, "B_fp": 58, "B_tn": 11, "B_fn": 33, "D_sharpe": 1.6482, "D_sortino": 1.485, "D_excess_sharpe": 0.3037, "D_return_pct": 15.54, "D_hit_rate": 58.19, "D_n": 178, "D_bh_sharpe": 1.3445, "D_bh_return_pct": 12.41, "D_psr": 0.9083, "D_ic": 0.0283, "D_precision": 0.5795, "D_recall": 0.9903, "D_f1": 0.7312, "D_f2": 0.8673, "D_accuracy": 0.5787, "D_mcc": 0.017, "D_tp": 102, "D_fp": 74, "D_tn": 1, "D_fn": 1, "sharpe": 1.6482, "sortino": 1.485, "return_pct": 15.54, "equity": 1155.4, "max_dd": 0.0, "win_rate": 58.19, "profit_factor": 0.0, "ic": 0.0283, "hit": 58.19, "psr": 0.9083, "bh_sharpe": 1.3445, "bh_return_pct": 12.41, "excess_sharpe": 0.3037, "precision": 0.5795, "recall": 0.9903, "f1": 0.7312, "f2": 0.8673, "mcc": 0.017, "accuracy": 0.5787, "tp": 102, "fp": 74, "tn": 1, "fn": 1}, {"fold": "fold_4", "regime": "China devaluation and oil crash", "n": 157, "A_sharpe": -0.5774, "A_sortino": -0.5542, "A_excess_sharpe": -0.5872, "A_return_pct": -7.83, "A_hit_rate": 49.36, "A_n": 157, "A_bh_sharpe": 0.0098, "A_bh_return_pct": -1.05, "A_psr": 0.3243, "A_ic": 0.0321, "A_precision": 0.5034, "A_recall": 0.9259, "A_f1": 0.6522, "A_f2": 0.7928, "A_accuracy": 0.4904, "A_mcc": -0.1085, "A_tp": 75, "A_fp": 74, "A_tn": 2, "A_fn": 6, "B_sharpe": -0.48, "B_sortino": -0.4978, "B_excess_sharpe": -0.4959, "B_return_pct": -17.43, "B_hit_rate": 45.86, "B_n": 157, "B_bh_sharpe": 0.0159, "B_bh_return_pct": -5.48, "B_psr": 0.353, "B_ic": -0.0439, "B_precision": 0.5, "B_recall": 0.6824, "B_f1": 0.5771, "B_f2": 0.636, "B_accuracy": 0.4586, "B_mcc": -0.1398, "B_tp": 58, "B_fp": 58, "B_tn": 14, "B_fn": 27, "D_sharpe": -0.5774, "D_sortino": -0.5542, "D_excess_sharpe": -0.5872, "D_return_pct": -7.83, "D_hit_rate": 49.36, "D_n": 157, "D_bh_sharpe": 0.0098, "D_bh_return_pct": -1.05, "D_psr": 0.3243, "D_ic": 0.0321, "D_precision": 0.5034, "D_recall": 0.9259, "D_f1": 0.6522, "D_f2": 0.7928, "D_accuracy": 0.4904, "D_mcc": -0.1085, "D_tp": 75, "D_fp": 74, "D_tn": 2, "D_fn": 6, "sharpe": -0.5774, "sortino": -0.5542, "return_pct": -7.83, "equity": 921.6999999999999, "max_dd": 0.0, "win_rate": 49.36, "profit_factor": 0.0, "ic": 0.0321, "hit": 49.36, "psr": 0.3243, "bh_sharpe": 0.0098, "bh_return_pct": -1.05, "excess_sharpe": -0.5872, "precision": 0.5034, "recall": 0.9259, "f1": 0.6522, "f2": 0.7928, "mcc": -0.1085, "accuracy": 0.4904, "tp": 75, "fp": 74, "tn": 2, "fn": 6}, {"fold": "fold_5", "regime": "2018 Vol-mageddon + Q4 sell-off", "n": 177, "A_sharpe": 0.1262, "A_sortino": 0.1166, "A_excess_sharpe": -0.1836, "A_return_pct": 0.18, "A_hit_rate": 55.37, "A_n": 177, "A_bh_sharpe": 0.3098, "A_bh_return_pct": 3.19, "A_psr": 0.542, "A_ic": 0.0666, "A_precision": 0.5769, "A_recall": 0.8738, "A_f1": 0.695, "A_f2": 0.7923, "A_accuracy": 0.5537, "A_mcc": -0.0276, "A_tp": 90, "A_fp": 66, "A_tn": 8, "A_fn": 13, "B_sharpe": 0.6168, "B_sortino": 0.5712, "B_excess_sharpe": -0.2749, "B_return_pct": 13.29, "B_hit_rate": 55.68, "B_n": 177, "B_bh_sharpe": 0.8917, "B_bh_return_pct": 23.8, "B_psr": 0.6958, "B_ic": 0.0823, "B_precision": 0.6348, "B_recall": 0.6697, "B_f1": 0.6518, "B_f2": 0.6624, "B_accuracy": 0.5593, "B_mcc": 0.0531, "B_tp": 73, "B_fp": 42, "B_tn": 26, "B_fn": 36, "D_sharpe": 0.1262, "D_sortino": 0.1166, "D_excess_sharpe": -0.1836, "D_return_pct": 0.18, "D_hit_rate": 55.37, "D_n": 177, "D_bh_sharpe": 0.3098, "D_bh_return_pct": 3.19, "D_psr": 0.542, "D_ic": 0.0666, "D_precision": 0.5769, "D_recall": 0.8738, "D_f1": 0.695, "D_f2": 0.7923, "D_accuracy": 0.5537, "D_mcc": -0.0276, "D_tp": 90, "D_fp": 66, "D_tn": 8, "D_fn": 13, "sharpe": 0.1262, "sortino": 0.1166, "return_pct": 0.18, "equity": 1001.8000000000001, "max_dd": 0.0, "win_rate": 55.37, "profit_factor": 0.0, "ic": 0.0666, "hit": 55.37, "psr": 0.542, "bh_sharpe": 0.3098, "bh_return_pct": 3.19, "excess_sharpe": -0.1836, "precision": 0.5769, "recall": 0.8738, "f1": 0.695, "f2": 0.7923, "mcc": -0.0276, "accuracy": 0.5537, "tp": 90, "fp": 66, "tn": 8, "fn": 13}, {"fold": "fold_6", "regime": "COVID crash and V-recovery", "n": 222, "A_sharpe": 0.3445, "A_sortino": 0.2984, "A_excess_sharpe": -0.5443, "A_return_pct": 5.22, "A_hit_rate": 58.56, "A_n": 222, "A_bh_sharpe": 0.8888, "A_bh_return_pct": 26.13, "A_psr": 0.6256, "A_ic": 0.0347, "A_precision": 0.6186, "A_recall": 0.8696, "A_f1": 0.7229, "A_f2": 0.8043, "A_accuracy": 0.5856, "A_mcc": -0.0166, "A_tp": 120, "A_fp": 74, "A_tn": 10, "A_fn": 18, "B_sharpe": -0.86, "B_sortino": -0.7887, "B_excess_sharpe": -3.2485, "B_return_pct": -52.68, "B_hit_rate": 49.32, "B_n": 222, "B_bh_sharpe": 2.3884, "B_bh_return_pct": 243.18, "B_psr": 0.207, "B_ic": -0.0629, "B_precision": 0.594, "B_recall": 0.5766, "B_f1": 0.5852, "B_f2": 0.58, "B_accuracy": 0.4955, "B_mcc": -0.0582, "B_tp": 79, "B_fp": 54, "B_tn": 31, "B_fn": 58, "D_sharpe": 0.3445, "D_sortino": 0.2984, "D_excess_sharpe": -0.5443, "D_return_pct": 5.22, "D_hit_rate": 58.56, "D_n": 222, "D_bh_sharpe": 0.8888, "D_bh_return_pct": 26.13, "D_psr": 0.6256, "D_ic": 0.0347, "D_precision": 0.6186, "D_recall": 0.8696, "D_f1": 0.7229, "D_f2": 0.8043, "D_accuracy": 0.5856, "D_mcc": -0.0166, "D_tp": 120, "D_fp": 74, "D_tn": 10, "D_fn": 18, "sharpe": 0.3445, "sortino": 0.2984, "return_pct": 5.22, "equity": 1052.2, "max_dd": 0.0, "win_rate": 58.56, "profit_factor": 0.0, "ic": 0.0347, "hit": 58.56, "psr": 0.6256, "bh_sharpe": 0.8888, "bh_return_pct": 26.13, "excess_sharpe": -0.5443, "precision": 0.6186, "recall": 0.8696, "f1": 0.7229, "f2": 0.8043, "mcc": -0.0166, "accuracy": 0.5856, "tp": 120, "fp": 74, "tn": 10, "fn": 18}, {"fold": "fold_7", "regime": "Inflation bear, AI rally and 2025", "n": 425, "A_sharpe": 0.1141, "A_sortino": 0.1025, "A_excess_sharpe": -0.8574, "A_return_pct": 0.22, "A_hit_rate": 57.18, "A_n": 425, "A_bh_sharpe": 0.9715, "A_bh_return_pct": 37.12, "A_psr": 0.5589, "A_ic": -0.0031, "A_precision": 0.5854, "A_recall": 0.932, "A_f1": 0.7191, "A_f2": 0.8333, "A_accuracy": 0.5718, "A_mcc": -0.0219, "A_tp": 233, "A_fp": 165, "A_tn": 10, "A_fn": 17, "B_sharpe": 0.4058, "B_sortino": 0.3753, "B_excess_sharpe": -2.0968, "B_return_pct": 14.5, "B_hit_rate": 54.48, "B_n": 425, "B_bh_sharpe": 2.5027, "B_bh_return_pct": 458.83, "B_psr": 0.6998, "B_ic": -0.0617, "B_precision": 0.6018, "B_recall": 0.7757, "B_f1": 0.6777, "B_f2": 0.7333, "B_accuracy": 0.5435, "B_mcc": -0.0697, "B_tp": 204, "B_fp": 135, "B_tn": 27, "B_fn": 59, "D_sharpe": 0.1141, "D_sortino": 0.1025, "D_excess_sharpe": -0.8574, "D_return_pct": 0.22, "D_hit_rate": 57.18, "D_n": 425, "D_bh_sharpe": 0.9715, "D_bh_return_pct": 37.12, "D_psr": 0.5589, "D_ic": -0.0031, "D_precision": 0.5854, "D_recall": 0.932, "D_f1": 0.7191, "D_f2": 0.8333, "D_accuracy": 0.5718, "D_mcc": -0.0219, "D_tp": 233, "D_fp": 165, "D_tn": 10, "D_fn": 17, "sharpe": 0.1141, "sortino": 0.1025, "return_pct": 0.22, "equity": 1002.1999999999999, "max_dd": 0.0, "win_rate": 57.18, "profit_factor": 0.0, "ic": -0.0031, "hit": 57.18, "psr": 0.5589, "bh_sharpe": 0.9715, "bh_return_pct": 37.12, "excess_sharpe": -0.8574, "precision": 0.5854, "recall": 0.932, "f1": 0.7191, "f2": 0.8333, "mcc": -0.0219, "accuracy": 0.5718, "tp": 233, "fp": 165, "tn": 10, "fn": 17}], "per_window_val": [{"fold": "fold_1", "regime": "GFC peak crash (Lehman + Mar-2009 bottom)", "n": 104, "A_sharpe": -0.6493, "A_sortino": -0.5607, "A_excess_sharpe": -0.4821, "A_return_pct": -9.32, "A_hit_rate": 50.98, "A_n": 104, "A_bh_sharpe": -0.1672, "A_bh_return_pct": -3.81, "A_psr": 0.3357, "A_ic": -0.0329, "A_precision": 0.5109, "A_recall": 0.8704, "A_f1": 0.6438, "A_f2": 0.763, "A_accuracy": 0.5, "A_mcc": -0.0463, "A_tp": 47, "A_fp": 45, "A_tn": 5, "A_fn": 7, "B_sharpe": -5.1038, "B_sortino": -4.5071, "B_excess_sharpe": -2.8297, "B_return_pct": -69.27, "B_hit_rate": 34.95, "B_n": 104, "B_bh_sharpe": -2.2741, "B_bh_return_pct": -44.12, "B_psr": 0.0003, "B_ic": -0.3912, "B_precision": 0.371, "B_recall": 0.4423, "B_f1": 0.4035, "B_f2": 0.4259, "B_accuracy": 0.3462, "B_mcc": -0.3135, "B_tp": 23, "B_fp": 39, "B_tn": 13, "B_fn": 29, "D_sharpe": -0.6493, "D_sortino": -0.5607, "D_excess_sharpe": -0.4821, "D_return_pct": -9.32, "D_hit_rate": 50.98, "D_n": 104, "D_bh_sharpe": -0.1672, "D_bh_return_pct": -3.81, "D_psr": 0.3357, "D_ic": -0.0329, "D_precision": 0.5109, "D_recall": 0.8704, "D_f1": 0.6438, "D_f2": 0.763, "D_accuracy": 0.5, "D_mcc": -0.0463, "D_tp": 47, "D_fp": 45, "D_tn": 5, "D_fn": 7, "sharpe": -0.6493, "sortino": -0.5607, "return_pct": -9.32, "equity": 906.8000000000001, "max_dd": 0.0, "win_rate": 50.98, "profit_factor": 0.0, "ic": -0.0329, "hit": 50.98, "psr": 0.3357, "bh_sharpe": -0.1672, "bh_return_pct": -3.81, "excess_sharpe": -0.4821, "precision": 0.5109, "recall": 0.8704, "f1": 0.6438, "f2": 0.763, "mcc": -0.0463, "accuracy": 0.5, "tp": 47, "fp": 45, "tn": 5, "fn": 7}, {"fold": "fold_2", "regime": "2011 US-downgrade + EU debt", "n": 96, "A_sharpe": -0.2741, "A_sortino": -0.2465, "A_excess_sharpe": 0.0, "A_return_pct": -4.09, "A_hit_rate": 52.63, "A_n": 96, "A_bh_sharpe": -0.2741, "A_bh_return_pct": -4.09, "A_psr": 0.4328, "A_ic": -0.063, "A_precision": 0.5208, "A_recall": 1.0, "A_f1": 0.6849, "A_f2": 0.8446, "A_accuracy": 0.5208, "A_mcc": 0.0, "A_tp": 50, "A_fp": 46, "A_tn": 0, "A_fn": 0, "B_sharpe": -3.208, "B_sortino": -2.9559, "B_excess_sharpe": -2.1805, "B_return_pct": -53.63, "B_hit_rate": 39.58, "B_n": 96, "B_bh_sharpe": -1.0274, "B_bh_return_pct": -25.58, "B_psr": 0.0206, "B_ic": -0.1077, "B_precision": 0.381, "B_recall": 0.5581, "B_f1": 0.4528, "B_f2": 0.5106, "B_accuracy": 0.3958, "B_mcc": -0.1861, "B_tp": 24, "B_fp": 39, "B_tn": 14, "B_fn": 19, "D_sharpe": -0.2741, "D_sortino": -0.2465, "D_excess_sharpe": 0.0, "D_return_pct": -4.09, "D_hit_rate": 52.63, "D_n": 96, "D_bh_sharpe": -0.2741, "D_bh_return_pct": -4.09, "D_psr": 0.4328, "D_ic": -0.063, "D_precision": 0.5208, "D_recall": 1.0, "D_f1": 0.6849, "D_f2": 0.8446, "D_accuracy": 0.5208, "D_mcc": 0.0, "D_tp": 50, "D_fp": 46, "D_tn": 0, "D_fn": 0, "sharpe": -0.2741, "sortino": -0.2465, "return_pct": -4.09, "equity": 959.0999999999999, "max_dd": 0.0, "win_rate": 52.63, "profit_factor": 0.0, "ic": -0.063, "hit": 52.63, "psr": 0.4328, "bh_sharpe": -0.2741, "bh_return_pct": -4.09, "excess_sharpe": 0.0, "precision": 0.5208, "recall": 1.0, "f1": 0.6849, "f2": 0.8446, "mcc": 0.0, "accuracy": 0.5208, "tp": 50, "fp": 46, "tn": 0, "fn": 0}, {"fold": "fold_3", "regime": "Taper tantrum and 2014 H1", "n": 54, "A_sharpe": 4.6998, "A_sortino": 4.9879, "A_excess_sharpe": 0.0, "A_return_pct": 10.46, "A_hit_rate": 61.11, "A_n": 54, "A_bh_sharpe": 4.6998, "A_bh_return_pct": 10.46, "A_psr": 0.9779, "A_ic": -0.0238, "A_precision": 0.6111, "A_recall": 1.0, "A_f1": 0.7586, "A_f2": 0.8871, "A_accuracy": 0.6111, "A_mcc": 0.0, "A_tp": 33, "A_fp": 21, "A_tn": 0, "A_fn": 0, "B_sharpe": 6.8284, "B_sortino": 10.4594, "B_excess_sharpe": -2.2042, "B_return_pct": 37.49, "B_hit_rate": 61.11, "B_n": 54, "B_bh_sharpe": 9.0326, "B_bh_return_pct": 49.18, "B_psr": 0.9997, "B_ic": 0.033, "B_precision": 0.6667, "B_recall": 0.8649, "B_f1": 0.7529, "B_f2": 0.8163, "B_accuracy": 0.6111, "B_mcc": -0.1128, "B_tp": 32, "B_fp": 16, "B_tn": 1, "B_fn": 5, "D_sharpe": 4.6998, "D_sortino": 4.9879, "D_excess_sharpe": 0.0, "D_return_pct": 10.46, "D_hit_rate": 61.11, "D_n": 54, "D_bh_sharpe": 4.6998, "D_bh_return_pct": 10.46, "D_psr": 0.9779, "D_ic": -0.0238, "D_precision": 0.6111, "D_recall": 1.0, "D_f1": 0.7586, "D_f2": 0.8871, "D_accuracy": 0.6111, "D_mcc": 0.0, "D_tp": 33, "D_fp": 21, "D_tn": 0, "D_fn": 0, "sharpe": 4.6998, "sortino": 4.9879, "return_pct": 10.46, "equity": 1104.6000000000001, "max_dd": 0.0, "win_rate": 61.11, "profit_factor": 0.0, "ic": -0.0238, "hit": 61.11, "psr": 0.9779, "bh_sharpe": 4.6998, "bh_return_pct": 10.46, "excess_sharpe": 0.0, "precision": 0.6111, "recall": 1.0, "f1": 0.7586, "f2": 0.8871, "mcc": 0.0, "accuracy": 0.6111, "tp": 33, "fp": 21, "tn": 0, "fn": 0}, {"fold": "fold_4", "regime": "China devaluation and oil crash", "n": 96, "A_sharpe": -1.0259, "A_sortino": -0.9878, "A_excess_sharpe": -0.6018, "A_return_pct": -7.86, "A_hit_rate": 46.32, "A_n": 96, "A_bh_sharpe": -0.4241, "A_bh_return_pct": -3.73, "A_psr": 0.264, "A_ic": 0.0364, "A_precision": 0.4624, "A_recall": 0.9556, "A_f1": 0.6232, "A_f2": 0.7875, "A_accuracy": 0.4583, "A_mcc": -0.0712, "A_tp": 43, "A_fp": 50, "A_tn": 1, "A_fn": 2, "B_sharpe": 1.7943, "B_sortino": 2.0172, "B_excess_sharpe": 2.9786, "B_return_pct": 30.51, "B_hit_rate": 51.04, "B_n": 96, "B_bh_sharpe": -1.1843, "B_bh_return_pct": -21.44, "B_psr": 0.8642, "B_ic": 0.2063, "B_precision": 0.4925, "B_recall": 0.7174, "B_f1": 0.5841, "B_f2": 0.6574, "B_accuracy": 0.5104, "B_mcc": 0.0407, "B_tp": 33, "B_fp": 34, "B_tn": 16, "B_fn": 13, "D_sharpe": -1.0259, "D_sortino": -0.9878, "D_excess_sharpe": -0.6018, "D_return_pct": -7.86, "D_hit_rate": 46.32, "D_n": 96, "D_bh_sharpe": -0.4241, "D_bh_return_pct": -3.73, "D_psr": 0.264, "D_ic": 0.0364, "D_precision": 0.4624, "D_recall": 0.9556, "D_f1": 0.6232, "D_f2": 0.7875, "D_accuracy": 0.4583, "D_mcc": -0.0712, "D_tp": 43, "D_fp": 50, "D_tn": 1, "D_fn": 2, "sharpe": -1.0259, "sortino": -0.9878, "return_pct": -7.86, "equity": 921.4, "max_dd": 0.0, "win_rate": 46.32, "profit_factor": 0.0, "ic": 0.0364, "hit": 46.32, "psr": 0.264, "bh_sharpe": -0.4241, "bh_return_pct": -3.73, "excess_sharpe": -0.6018, "precision": 0.4624, "recall": 0.9556, "f1": 0.6232, "f2": 0.7875, "mcc": -0.0712, "accuracy": 0.4583, "tp": 43, "fp": 50, "tn": 1, "fn": 2}, {"fold": "fold_5", "regime": "2018 Vol-mageddon + Q4 sell-off", "n": 54, "A_sharpe": 2.8896, "A_sortino": 2.9508, "A_excess_sharpe": 1.4617, "A_return_pct": 8.3, "A_hit_rate": 55.56, "A_n": 54, "A_bh_sharpe": 1.428, "A_bh_return_pct": 3.97, "A_psr": 0.8988, "A_ic": 0.1218, "A_precision": 0.551, "A_recall": 0.931, "A_f1": 0.6923, "A_f2": 0.8182, "A_accuracy": 0.5556, "A_mcc": 0.0878, "A_tp": 27, "A_fp": 22, "A_tn": 3, "A_fn": 2, "B_sharpe": -0.5094, "B_sortino": -0.4577, "B_excess_sharpe": -5.4416, "B_return_pct": -4.26, "B_hit_rate": 55.56, "B_n": 54, "B_bh_sharpe": 4.9322, "B_bh_return_pct": 34.93, "B_psr": 0.4076, "B_ic": -0.1808, "B_precision": 0.6757, "B_recall": 0.6757, "B_f1": 0.6757, "B_f2": 0.6757, "B_accuracy": 0.5556, "B_mcc": -0.0302, "B_tp": 25, "B_fp": 12, "B_tn": 5, "B_fn": 12, "D_sharpe": 2.8896, "D_sortino": 2.9508, "D_excess_sharpe": 1.4617, "D_return_pct": 8.3, "D_hit_rate": 55.56, "D_n": 54, "D_bh_sharpe": 1.428, "D_bh_return_pct": 3.97, "D_psr": 0.8988, "D_ic": 0.1218, "D_precision": 0.551, "D_recall": 0.931, "D_f1": 0.6923, "D_f2": 0.8182, "D_accuracy": 0.5556, "D_mcc": 0.0878, "D_tp": 27, "D_fp": 22, "D_tn": 3, "D_fn": 2, "sharpe": 2.8896, "sortino": 2.9508, "return_pct": 8.3, "equity": 1083.0, "max_dd": 0.0, "win_rate": 55.56, "profit_factor": 0.0, "ic": 0.1218, "hit": 55.56, "psr": 0.8988, "bh_sharpe": 1.428, "bh_return_pct": 3.97, "excess_sharpe": 1.4617, "precision": 0.551, "recall": 0.931, "f1": 0.6923, "f2": 0.8182, "mcc": 0.0878, "accuracy": 0.5556, "tp": 27, "fp": 22, "tn": 3, "fn": 2}, {"fold": "fold_6", "regime": "COVID crash and V-recovery", "n": 75, "A_sharpe": 4.2994, "A_sortino": 3.8524, "A_excess_sharpe": 0.0, "A_return_pct": 14.68, "A_hit_rate": 68.0, "A_n": 75, "A_bh_sharpe": 4.2994, "A_bh_return_pct": 14.68, "A_psr": 0.9844, "A_ic": 0.0086, "A_precision": 0.68, "A_recall": 1.0, "A_f1": 0.8095, "A_f2": 0.914, "A_accuracy": 0.68, "A_mcc": 0.0, "A_tp": 51, "A_fp": 24, "A_tn": 0, "A_fn": 0, "B_sharpe": 3.0676, "B_sortino": 3.3837, "B_excess_sharpe": -11.2664, "B_return_pct": 24.19, "B_hit_rate": 57.33, "B_n": 75, "B_bh_sharpe": 14.3339, "B_bh_return_pct": 120.13, "B_psr": 0.9531, "B_ic": 0.1143, "B_precision": 0.8298, "B_recall": 0.619, "B_f1": 0.7091, "B_f2": 0.6522, "B_accuracy": 0.5733, "B_mcc": -0.0361, "B_tp": 39, "B_fp": 8, "B_tn": 4, "B_fn": 24, "D_sharpe": 4.2994, "D_sortino": 3.8524, "D_excess_sharpe": 0.0, "D_return_pct": 14.68, "D_hit_rate": 68.0, "D_n": 75, "D_bh_sharpe": 4.2994, "D_bh_return_pct": 14.68, "D_psr": 0.9844, "D_ic": 0.0086, "D_precision": 0.68, "D_recall": 1.0, "D_f1": 0.8095, "D_f2": 0.914, "D_accuracy": 0.68, "D_mcc": 0.0, "D_tp": 51, "D_fp": 24, "D_tn": 0, "D_fn": 0, "sharpe": 4.2994, "sortino": 3.8524, "return_pct": 14.68, "equity": 1146.8, "max_dd": 0.0, "win_rate": 68.0, "profit_factor": 0.0, "ic": 0.0086, "hit": 68.0, "psr": 0.9844, "bh_sharpe": 4.2994, "bh_return_pct": 14.68, "excess_sharpe": 0.0, "precision": 0.68, "recall": 1.0, "f1": 0.8095, "f2": 0.914, "mcc": 0.0, "accuracy": 0.68, "tp": 51, "fp": 24, "tn": 0, "fn": 0}, {"fold": "fold_7", "regime": "Inflation bear, AI rally and 2025", "n": 114, "A_sharpe": 3.1508, "A_sortino": 3.3332, "A_excess_sharpe": 0.3058, "A_return_pct": 23.87, "A_hit_rate": 58.77, "A_n": 114, "A_bh_sharpe": 2.845, "A_bh_return_pct": 21.34, "A_psr": 0.982, "A_ic": -0.0909, "A_precision": 0.5893, "A_recall": 0.9851, "A_f1": 0.7374, "A_f2": 0.8684, "A_accuracy": 0.5877, "A_mcc": 0.0238, "A_tp": 66, "A_fp": 46, "A_tn": 1, "A_fn": 1, "B_sharpe": 3.8435, "B_sortino": 4.2007, "B_ex