{"experiment_num": 44, "backbone": "xgboost", "description": "XGBoost @ exp 42 lr=0.02 (down from 0.03) - even slower learning at sweet-spot n_est=100", "config": {"seq_len": 60, "lr": 0.0003, "batch_size": 32, "epochs": 50, "weight_decay": 1e-05, "patience": 10, "warmup_epochs": 0, "head_dropout": 0.1, "huber_delta": 1.0, "grad_clip": 1.0, "seed": 42, "hidden_size": null, "num_layers": null, "max_depth": 4, "gbm_lr": 0.02, "n_estimators": 100}, "composite": -0.2517, "test_pos_folds": 6, "val_pos_folds": 2, "val_loss": null, "elapsed_sec": 74.9, "timestamp": "2026-04-27T19:03:55", "sharpe": 0.4412, "val_sharpe": -0.1517, "ic": -0.0003, "hit": 52.26, "psr": 0.8192, "equity": 1369.0, "return_pct": 36.9, "bh_sharpe": 1.2194, "bh_return_pct": 187.05, "excess_sharpe": -0.7782, "B_sharpe": 0.6699, "B_excess_sharpe": -2.1583, "B_return_pct": 136.59, "D_sharpe": 0.6183, "D_excess_sharpe": -0.6011, "D_return_pct": 62.19, "per_window": [{"fold": "fold_1", "regime": "GFC peak crash (Lehman + Mar-2009 bottom)", "n": 66, "A_sharpe": 1.7587, "A_sortino": 1.8976, "A_excess_sharpe": 1.1866, "A_return_pct": 16.56, "A_hit_rate": 53.03, "A_n": 66, "A_bh_sharpe": 0.5721, "A_bh_return_pct": 3.85, "A_psr": 0.8156, "A_ic": 0.1307, "B_sharpe": 1.4326, "B_sortino": 1.5093, "B_excess_sharpe": -0.6143, "B_return_pct": 23.33, "B_hit_rate": 50.77, "B_n": 66, "B_bh_sharpe": 2.0469, "B_bh_return_pct": 39.28, "B_psr": 0.7659, "B_ic": 0.2572, "D_sharpe": 3.0316, "D_sortino": 3.4687, "D_excess_sharpe": 2.4595, "D_return_pct": 31.51, "D_hit_rate": 54.55, "D_n": 66, "D_bh_sharpe": 0.5721, "D_bh_return_pct": 3.85, "D_psr": 0.9402, "D_ic": 0.2196, "sharpe": 1.7587, "sortino": 1.8976, "return_pct": 16.56, "equity": 1165.6, "max_dd": 0.0, "win_rate": 53.03, "profit_factor": 0.0, "ic": 0.1307, "hit": 53.03, "psr": 0.8156, "bh_sharpe": 0.5721, "bh_return_pct": 3.85, "excess_sharpe": 1.1866, "precision": 0.5625, "recall": 0.5143, "f1": 0.5373, "f2": 0.5233, "accuracy": 0.5303, "mcc": 0.0626, "tp": 18, "fp": 14, "tn": 17, "fn": 17, "A_precision": 0.5625, "A_recall": 0.5143, "A_f1": 0.5373, "A_f2": 0.5233, "A_accuracy": 0.5303, "A_mcc": 0.0626, "A_tp": 18, "A_fp": 14, "A_tn": 17, "A_fn": 17}, {"fold": "fold_2", "regime": "2011 US-downgrade + EU debt", "n": 87, "A_sharpe": 1.585, "A_sortino": 1.7612, "A_excess_sharpe": -3.437, "A_return_pct": 8.5, "A_hit_rate": 53.49, "A_n": 87, "A_bh_sharpe": 5.022, "A_bh_return_pct": 29.23, "A_psr": 0.8288, "A_ic": -0.054, "B_sharpe": 9.9329, "B_sortino": 9.5191, "B_excess_sharpe": -1.2041, "B_return_pct": 163.02, "B_hit_rate": 79.31, "B_n": 87, "B_bh_sharpe": 11.1369, "B_bh_return_pct": 185.4, "B_psr": 1.0, "B_ic": 0.1523, "D_sharpe": 4.6509, "D_sortino": 5.8855, "D_excess_sharpe": -0.3711, "D_return_pct": 26.96, "D_hit_rate": 61.63, "D_n": 87, "D_bh_sharpe": 5.022, "D_bh_return_pct": 29.23, "D_psr": 0.9988, "D_ic": -0.0645, "sharpe": 1.585, "sortino": 1.7612, "return_pct": 8.5, "equity": 1085.0, "max_dd": 0.0, "win_rate": 53.49, "profit_factor": 0.0, "ic": -0.054, "hit": 53.49, "psr": 0.8288, "bh_sharpe": 5.022, "bh_return_pct": 29.23, "excess_sharpe": -3.437, "precision": 0.6094, "recall": 0.7222, "f1": 0.661, "f2": 0.6964, "accuracy": 0.5402, "mcc": -0.0389, "tp": 39, "fp": 25, "tn": 8, "fn": 15, "A_precision": 0.6094, "A_recall": 0.7222, "A_f1": 0.661, "A_f2": 0.6964, "A_accuracy": 0.5402, "A_mcc": -0.0389, "A_tp": 39, "A_fp": 25, "A_tn": 8, "A_fn": 15}, {"fold": "fold_3", "regime": "Taper tantrum and 2014 H1", "n": 129, "A_sharpe": 1.7606, "A_sortino": 1.4835, "A_excess_sharpe": -0.0072, "A_return_pct": 11.71, "A_hit_rate": 60.16, "A_n": 129, "A_bh_sharpe": 1.7678, "A_bh_return_pct": 11.76, "A_psr": 0.8813, "A_ic": 0.0563, "B_sharpe": 4.2474, "B_sortino": 4.2072, "B_excess_sharpe": 0.0, "B_return_pct": 64.1, "B_hit_rate": 63.57, "B_n": 129, "B_bh_sharpe": 4.2474, "B_bh_return_pct": 64.1, "B_psr": 0.9981, "B_ic": -0.0336, "D_sharpe": 1.7678, "D_sortino": 1.4748, "D_excess_sharpe": 0.0, "D_return_pct": 11.76, "D_hit_rate": 60.94, "D_n": 129, "D_bh_sharpe": 1.7678, "D_bh_return_pct": 11.76, "D_psr": 0.8822, "D_ic": 0.0934, "sharpe": 1.7606, "sortino": 1.4835, "return_pct": 11.71, "equity": 1117.1, "max_dd": 0.0, "win_rate": 60.16, "profit_factor": 0.0, "ic": 0.0563, "hit": 60.16, "psr": 0.8813, "bh_sharpe": 1.7678, "bh_return_pct": 11.76, "excess_sharpe": -0.0072, "precision": 0.6016, "recall": 0.9872, "f1": 0.7476, "f2": 0.875, "accuracy": 0.5969, "mcc": -0.0715, "tp": 77, "fp": 51, "tn": 0, "fn": 1, "A_precision": 0.6016, "A_recall": 0.9872, "A_f1": 0.7476, "A_f2": 0.875, "A_accuracy": 0.5969, "A_mcc": -0.0715, "A_tp": 77, "A_fp": 51, "A_tn": 0, "A_fn": 1}, {"fold": "fold_4", "regime": "China devaluation and oil crash", "n": 108, "A_sharpe": 0.3033, "A_sortino": 0.2742, "A_excess_sharpe": 0.993, "A_return_pct": 1.77, "A_hit_rate": 55.14, "A_n": 108, "A_bh_sharpe": -0.6898, "A_bh_return_pct": -6.71, "A_psr": 0.578, "A_ic": 0.0165, "B_sharpe": -1.5108, "B_sortino": -1.3428, "B_excess_sharpe": 0.4467, "B_return_pct": -27.82, "B_hit_rate": 48.15, "B_n": 108, "B_bh_sharpe": -1.9575, "B_bh_return_pct": -33.56, "B_psr": 0.1564, "B_ic": -0.0487, "D_sharpe": -1.1354, "D_sortino": -1.0446, "D_excess_sharpe": -0.4456, "D_return_pct": -10.26, "D_hit_rate": 48.6, "D_n": 108, "D_bh_sharpe": -0.6898, "D_bh_return_pct": -6.71, "D_psr": 0.2274, "D_ic": 0.0137, "sharpe": 0.3033, "sortino": 0.2742, "return_pct": 1.77, "equity": 1017.7, "max_dd": 0.0, "win_rate": 55.14, "profit_factor": 0.0, "ic": 0.0165, "hit": 55.14, "psr": 0.578, "bh_sharpe": -0.6898, "bh_return_pct": -6.71, "excess_sharpe": 0.993, "precision": 0.5333, "recall": 0.7547, "f1": 0.625, "f2": 0.6969, "accuracy": 0.5556, "mcc": 0.1284, "tp": 40, "fp": 35, "tn": 20, "fn": 13, "A_precision": 0.5333, "A_recall": 0.7547, "A_f1": 0.625, "A_f2": 0.6969, "A_accuracy": 0.5556, "A_mcc": 0.1284, "A_tp": 40, "A_fp": 35, "A_tn": 20, "A_fn": 13}, {"fold": "fold_5", "regime": "2018 Vol-mageddon + Q4 sell-off", "n": 128, "A_sharpe": 0.8326, "A_sortino": 0.8795, "A_excess_sharpe": -0.3185, "A_return_pct": 8.96, "A_hit_rate": 53.12, "A_n": 128, "A_bh_sharpe": 1.1511, "A_bh_return_pct": 13.19, "A_psr": 0.725, "A_ic": -0.0137, "B_sharpe": -1.8564, "B_sortino": -1.8024, "B_excess_sharpe": -4.6683, "B_return_pct": -38.89, "B_hit_rate": 43.31, "B_n": 128, "B_bh_sharpe": 2.8119, "B_bh_return_pct": 82.25, "B_psr": 0.0932, "B_ic": -0.1417, "D_sharpe": -0.3512, "D_sortino": -0.3832, "D_excess_sharpe": -1.5023, "D_return_pct": -5.48, "D_hit_rate": 47.66, "D_n": 128, "D_bh_sharpe": 1.1511, "D_bh_return_pct": 13.19, "D_psr": 0.4023, "D_ic": -0.059, "sharpe": 0.8326, "sortino": 0.8795, "return_pct": 8.96, "equity": 1089.6, "max_dd": 0.0, "win_rate": 53.12, "profit_factor": 0.0, "ic": -0.0137, "hit": 53.12, "psr": 0.725, "bh_sharpe": 1.1511, "bh_return_pct": 13.19, "excess_sharpe": -0.3185, "precision": 0.6098, "recall": 0.641, "f1": 0.625, "f2": 0.6345, "accuracy": 0.5312, "mcc": 0.001, "tp": 50, "fp": 32, "tn": 18, "fn": 28, "A_precision": 0.6098, "A_recall": 0.641, "A_f1": 0.625, "A_f2": 0.6345, "A_accuracy": 0.5312, "A_mcc": 0.001, "A_tp": 50, "A_fp": 32, "A_tn": 18, "A_fn": 28}, {"fold": "fold_6", "regime": "COVID crash and V-recovery", "n": 173, "A_sharpe": 1.1948, "A_sortino": 1.1529, "A_excess_sharpe": -1.1313, "A_return_pct": 19.52, "A_hit_rate": 55.49, "A_n": 173, "A_bh_sharpe": 2.3261, "A_bh_return_pct": 43.81, "A_psr": 0.8353, "A_ic": 0.1188, "B_sharpe": -0.5389, "B_sortino": -0.5523, "B_excess_sharpe": -6.2849, "B_return_pct": -24.05, "B_hit_rate": 47.09, "B_n": 173, "B_bh_sharpe": 5.746, "B_bh_return_pct": 499.04, "B_psr": 0.3285, "B_ic": -0.0098, "D_sharpe": 0.2151, "D_sortino": 0.2337, "D_excess_sharpe": -2.1109, "D_return_pct": 1.58, "D_hit_rate": 47.4, "D_n": 173, "D_bh_sharpe": 2.3261, "D_bh_return_pct": 43.81, "D_psr": 0.5706, "D_ic": -0.0431, "sharpe": 1.1948, "sortino": 1.1529, "return_pct": 19.52, "equity": 1195.2, "max_dd": 0.0, "win_rate": 55.49, "profit_factor": 0.0, "ic": 0.1188, "hit": 55.49, "psr": 0.8353, "bh_sharpe": 2.3261, "bh_return_pct": 43.81, "excess_sharpe": -1.1313, "precision": 0.725, "recall": 0.5133, "f1": 0.601, "f2": 0.5451, "accuracy": 0.5549, "mcc": 0.14, "tp": 58, "fp": 22, "tn": 38, "fn": 55, "A_precision": 0.725, "A_recall": 0.5133, "A_f1": 0.601, "A_f2": 0.5451, "A_accuracy": 0.5549, "A_mcc": 0.14, "A_tp": 58, "A_fp": 22, "A_tn": 38, "A_fn": 55}, {"fold": "fold_7", "regime": "Inflation bear, AI rally and 2025", "n": 376, "A_sharpe": -0.8249, "A_sortino": -0.8651, "A_excess_sharpe": -1.6282, "A_return_pct": -26.89, "A_hit_rate": 46.54, "A_n": 376, "A_bh_sharpe": 0.8033, "A_bh_return_pct": 26.02, "A_psr": 0.1651, "A_ic": -0.0649, "B_sharpe": 0.6378, "B_sortino": 0.7353, "B_excess_sharpe": -1.2939, "B_return_pct": 32.66, "B_hit_rate": 46.4, "B_n": 376, "B_bh_sharpe": 1.9317, "B_bh_return_pct": 222.05, "B_psr": 0.784, "B_ic": 0.0014, "D_sharpe": 0.1365, "D_sortino": 0.1761, "D_excess_sharpe": -0.6668, "D_return_pct": 0.88, "D_hit_rate": 42.82, "D_n": 376, "D_bh_sharpe": 0.8033, "D_bh_return_pct": 26.02, "D_psr": 0.5667, "D_ic": -0.0021, "sharpe": -0.8249, "sortino": -0.8651, "return_pct": -26.89, "equity": 731.1, "max_dd": 0.0, "win_rate": 46.54, "profit_factor": 0.0, "ic": -0.0649, "hit": 46.54, "psr": 0.1651, "bh_sharpe": 0.8033, "bh_return_pct": 26.02, "excess_sharpe": -1.6282, "precision": 0.5556, "recall": 0.4525, "f1": 0.4988, "f2": 0.4699, "accuracy": 0.4654, "mcc": -0.0627, "tp": 100, "fp": 80, "tn": 75, "fn": 121, "A_precision": 0.5556, "A_recall": 0.4525, "A_f1": 0.4988, "A_f2": 0.4699, "A_accuracy": 0.4654, "A_mcc": -0.0627, "A_tp": 100, "A_fp": 80, "A_tn": 75, "A_fn": 121}], "per_window_val": [{"fold": "fold_1", "regime": "GFC peak crash (Lehman + Mar-2009 bottom)", "n": 65, "A_sharpe": -0.3791, "A_sortino": -0.4124, "A_excess_sharpe": 1.8466, "A_return_pct": -4.66, "A_hit_rate": 47.62, "A_n": 65, "A_bh_sharpe": -2.2257, "A_bh_return_pct": -18.74, "A_psr": 0.425, "A_ic": 0.0385, "B_sharpe": -6.478, "B_sortino": -5.0888, "B_excess_sharpe": 0.6443, "B_return_pct": -70.41, "B_hit_rate": 36.92, "B_n": 65, "B_bh_sharpe": -7.1223, "B_bh_return_pct": -73.11, "B_psr": 0.0, "B_ic": 0.3604, "D_sharpe": -2.1336, "D_sortino": -1.7861, "D_excess_sharpe": 0.092, "D_return_pct": -18.1, "D_hit_rate": 47.62, "D_n": 65, "D_bh_sharpe": -2.2257, "D_bh_return_pct": -18.74, "D_psr": 0.1256, "D_ic": 0.2961, "sharpe": -0.3791, "sortino": -0.4124, "return_pct": -4.66, "equity": 953.4, "max_dd": 0.0, "win_rate": 47.62, "profit_factor": 0.0, "ic": 0.0385, "hit": 47.62, "psr": 0.425, "bh_sharpe": -2.2257, "bh_return_pct": -18.74, "excess_sharpe": 1.8466}, {"fold": "fold_2", "regime": "2011 US-downgrade + EU debt", "n": 47, "A_sharpe": 0.5281, "A_sortino": 0.4679, "A_excess_sharpe": 0.7222, "A_return_pct": 2.31, "A_hit_rate": 57.45, "A_n": 47, "A_bh_sharpe": -0.1941, "A_bh_return_pct": -2.36, "A_psr": 0.5887, "A_ic": -0.0027, "B_sharpe": -1.525, "B_sortino": -1.3885, "B_excess_sharpe": 0.0873, "B_return_pct": -23.38, "B_hit_rate": 46.81, "B_n": 47, "B_bh_sharpe": -1.6123, "B_bh_return_pct": -24.3, "B_psr": 0.2525, "B_ic": 0.3324, "D_sharpe": -0.2446, "D_sortino": -0.2184, "D_excess_sharpe": -0.0505, "D_return_pct": -2.68, "D_hit_rate": 53.19, "D_n": 47, "D_bh_sharpe": -0.1941, "D_bh_return_pct": -2.36, "D_psr": 0.4582, "D_ic": 0.1552, "sharpe": 0.5281, "sortino": 0.4679, "return_pct": 2.31, "equity": 1023.0999999999999, "max_dd": 0.0, "win_rate": 57.45, "profit_factor": 0.0, "ic": -0.0027, "hit": 57.45, "psr": 0.5887, "bh_sharpe": -0.1941, "bh_return_pct": -2.36, "excess_sharpe": 0.7222}, {"fold": "fold_3", "regime": "Taper tantrum and 2014 H1", "n": 5, "A_sharpe": -1.3194, "A_sortino": -1.3491, "A_excess_sharpe": 0.0, "A_return_pct": -0.21, "A_hit_rate": 40.0, "A_n": 5, "A_bh_sharpe": -1.3194, "A_bh_return_pct": -0.21, "A_psr": 0.4337, "A_ic": 0.3, "B_sharpe": -25.8705, "B_sortino": -13.5303, "B_excess_sharpe": 0.0, "B_return_pct": -3.84, "B_hit_rate": 0.0, "B_n": 5, "B_bh_sharpe": -25.8705, "B_bh_return_pct": -3.84, "B_psr": 0.0, "B_ic": -0.2, "D_sharpe": -1.3194, "D_sortino": -1.3491, "D_excess_sharpe": 0.0, "D_return_pct": -0.21, "D_hit_rate": 40.0, "D_n": 5, "D_bh_sharpe": -1.3194, "D_bh_return_pct": -0.21, "D_psr": 0.4337, "D_ic": -0.3, "sharpe": -1.3194, "sortino": -1.3491, "return_pct": -0.21, "equity": 997.9, "max_dd": 0.0, "win_rate": 40.0, "profit_factor": 0.0, "ic": 0.3, "hit": 40.0, "psr": 0.4337, "bh_sharpe": -1.3194, "bh_return_pct": -0.21, "excess_sharpe": 0.0}, {"fold": "fold_4", "regime": "China devaluation and oil crash", "n": 47, "A_sharpe": -0.7484, "A_sortino": -0.7327, "A_excess_sharpe": 1.0753, "A_return_pct": -4.01, "A_hit_rate": 46.81, "A_n": 47, "A_bh_sharpe": -1.8238, "A_bh_return_pct": -8.68, "A_psr": 0.3745, "A_ic": 0.0617, "B_sharpe": -2.22, "B_sortino": -1.9053, "B_excess_sharpe": 0.0, "B_return_pct": -23.98, "B_hit_rate": 44.68, "B_n": 47, "B_bh_sharpe": -2.22, "B_bh_return_pct": -23.98, "B_psr": 0.1505, "B_ic": 0.5865, "D_sharpe": -1.8238, "D_sortino": -1.7153, "D_excess_sharpe": 0.0, "D_return_pct": -8.68, "D_hit_rate": 44.68, "D_n": 47, "D_bh_sharpe": -1.8238, "D_bh_return_pct": -8.68, "D_psr": 0.2173, "D_ic": 0.2957, "sharpe": -0.7484, "sortino": -0.7327, "return_pct": -4.01, "equity": 959.9, "max_dd": 0.0, "win_rate": 46.81, "profit_factor": 0.0, "ic": 0.0617, "hit": 46.81, "psr": 0.3745, "bh_sharpe": -1.8238, "bh_return_pct": -8.68, "excess_sharpe": 1.0753}, {"fold": "fold_5", "regime": "2018 Vol-mageddon + Q4 sell-off", "n": 5, "A_sharpe": -10.1368, "A_sortino": -6.9937, "A_excess_sharpe": 0.0, "A_return_pct": -3.15, "A_hit_rate": 40.0, "A_n": 5, "A_bh_sharpe": -10.1368, "A_bh_return_pct": -3.15, "A_psr": 0.0985, "A_ic": 0.2, "B_sharpe": 5.6858, "B_sortino": 6.0578, "B_excess_sharpe": 0.0, "B_return_pct": 4.22, "B_hit_rate": 60.0, "B_n": 5, "B_bh_sharpe": 5.6858, "B_bh_return_pct": 4.22, "B_psr": 0.753, "B_ic": -0.9, "D_sharpe": -10.1368, "D_sortino": -6.9937, "D_excess_sharpe": 0.0, "D_return_pct": -3.15, "D_hit_rate": 40.0, "D_n": 5, "D_bh_sharpe": -10.1368, "D_bh_return_pct": -3.15, "D_psr": 0.0985, "D_ic": -1.0, "sharpe": -10.1368, "sortino": -6.9937, "return_pct": -3.15, "equity": 968.5, "max_dd": 0.0, "win_rate": 40.0, "profit_factor": 0.0, "ic": 0.2, "hit": 40.0, "psr": 0.0985, "bh_sharpe": -10.1368, "bh_return_pct": -3.15, "excess_sharpe": 0.0}, {"fold": "fold_6", "regime": "COVID crash and V-recovery", "n": 26, "A_sharpe": 2.5916, "A_sortino": 2.5328, "A_excess_sharpe": -0.6936, "A_return_pct": 3.79, "A_hit_rate": 57.69, "A_n": 26, "A_bh_sharpe": 3.2852, "A_bh_return_pct": 4.82, "A_psr": 0.7852, "A_ic": -0.1405, "B_sharpe": 14.2206, "B_sortino": 17.7913, "B_excess_sharpe": 1.2414, "B_return_pct": 41.29, "B_hit_rate": 80.77, "B_n": 26, "B_bh_sharpe": 12.9792, "B_bh_return_pct": 38.76, "B_psr": 1.0, "B_ic": 0.3798, "D_sharpe": 3.7166, "D_sortino": 3.108, "D_excess_sharpe": 0.4315, "D_return_pct": 5.45, "D_hit_rate": 69.23, "D_n": 26, "D_bh_sharpe": 3.2852, "D_bh_return_pct": 4.82, "D_psr": 0.863, "D_ic": 0.0202, "sharpe": 2.5916, "sortino": 2.5328, "return_pct": 3.79, "equity": 1037.9, "max_dd": 0.0, "win_rate": 57.69, "profit_factor": 0.0, "ic": -0.1405, "hit": 57.69, "psr": 0.7852, "bh_sharpe": 3.2852, "bh_return_pct": 4.82, "excess_sharpe": -0.6936}, {"fold": "fold_7", "regime": "Inflation bear, AI rally and 2025", "n": 65, "A_sharpe": -0.3093, "A_sortino": -0.2773, "A_excess_sharpe": -2.3882, "A_return_pct": -1.52, "A_hit_rate": 55.38, "A_n": 65, "A_bh_sharpe": 2.0789, "A_bh_return_pct": 8.17, "A_psr": 0.4379, "A_ic": -0.151, "B_sharpe": -5.0606, "B_sortino": -4.72, "B_excess_sharpe": -10.292, "B_return_pct": -31.6, "B_hit_rate": 32.31, "B_n": 65, "B_bh_sharpe": 5.2314, "B_bh_return_pct": 44.53, "B_psr": 0.0067, "B_ic": 0.0119, "D_sharpe": -1.9471, "D_sortino": -1.7868, "D_excess_sharpe": -4.026, "D_return_pct": -7.64, "D_hit_rate": 46.15, "D_n": 65, "D_bh_sharpe": 2.0789, "D_bh_return_pct": 8.17, "D_psr": 0.1596, "D_ic": 0.1158, "sharpe": -0.3093, "sortino": -0.2773, "return_pct": -1.52, "equity": 984.8, "max_dd": 0.0, "win_rate": 55.38, "profit_factor": 0.0, "ic": -0.151, "hit": 55.38, "psr": 0.4379, "bh_sharpe": 2.0789, "bh_return_pct": 8.17, "excess_sharpe": -2.3882}], "status": "DISCARD", "precision": 0.5959, "recall": 0.6044, "f1": 0.6002, "f2": 0.6027, "accuracy": 0.523, "mcc": 0.0091, "tp": 382, "fp": 259, "tn": 176, "fn": 250, "test_sharpe": 0.4412, "A_sharpe": 0.4412, "A_excess_sharpe": -0.7782, "A_return_pct": 36.9, "A_precision": 0.5959, "A_recall": 0.6044, "A_f1": 0.6002, "A_f2": 0.6027, "A_accuracy": 0.523, "A_mcc": 0.0091, "A_tp": 382, "A_fp": 259, "A_tn": 176, "A_fn": 250, "A_psr": 0.8192, "A_ic": -0.0003, "A_hit_rate": 52.26, "A_bh_sharpe": 1.2194, "A_bh_return_pct": 187.05}
