{"experiment_num": 74, "backbone": "lstm", "description": "LSTM @ exp 71 num_layers=1 seed=99 - 4th seed for stable-champion median lock", "config": {"seq_len": 10, "lr": 0.001, "batch_size": 16, "epochs": 100, "weight_decay": 0.0007, "patience": 15, "warmup_epochs": 0, "head_dropout": 0.1, "huber_delta": 1.0, "grad_clip": 1.0, "seed": 99, "hidden_size": null, "num_layers": 1, "max_depth": null, "gbm_lr": null, "n_estimators": null}, "composite": 0.7365, "test_pos_folds": 6, "val_pos_folds": 4, "val_loss": -2.8796344575351247, "elapsed_sec": 70.0, "timestamp": "2026-04-27T23:06:58", "sharpe": 1.297, "val_sharpe": 0.8365, "ic": 0.0688, "hit": 53.73, "psr": 0.9992, "equity": 5812.3, "return_pct": 481.23, "bh_sharpe": 0.6042, "bh_return_pct": 103.49, "excess_sharpe": 0.6927, "B_sharpe": 0.9543, "B_excess_sharpe": -0.7465, "B_return_pct": 674.44, "D_sharpe": 1.297, "D_excess_sharpe": 0.6927, "D_return_pct": 481.23, "precision": 0.5889, "recall": 0.6283, "f1": 0.6079, "f2": 0.62, "mcc": 0.0418, "accuracy": 0.5362, "val_precision": 0.5582, "val_recall": 0.5684, "val_f1": 0.5633, "val_f2": 0.5663, "val_mcc": 0.0078, "val_accuracy": 0.511, "per_window": [{"fold": "fold_1", "regime": "GFC peak crash (Lehman + Mar-2009 bottom)", "n": 115, "A_sharpe": 2.154, "A_sortino": 2.2003, "A_excess_sharpe": 2.5982, "A_return_pct": 52.98, "A_hit_rate": 56.52, "A_n": 115, "A_bh_sharpe": -0.4441, "A_bh_return_pct": -14.4, "A_psr": 0.9244, "A_ic": 0.0654, "A_precision": 0.527, "A_recall": 0.7222, "A_f1": 0.6094, "A_f2": 0.6724, "A_accuracy": 0.5652, "A_mcc": 0.1547, "A_tp": 39, "A_fp": 35, "A_tn": 26, "A_fn": 15, "B_sharpe": 0.2019, "B_sortino": 0.2002, "B_excess_sharpe": 0.4997, "B_return_pct": -10.29, "B_hit_rate": 50.0, "B_n": 115, "B_bh_sharpe": -0.2978, "B_bh_return_pct": -27.23, "B_psr": 0.554, "B_ic": 0.074, "B_precision": 0.5161, "B_recall": 0.5424, "B_f1": 0.5289, "B_f2": 0.5369, "B_accuracy": 0.5043, "B_mcc": 0.0067, "B_tp": 32, "B_fp": 30, "B_tn": 26, "B_fn": 27, "D_sharpe": 2.154, "D_sortino": 2.2003, "D_excess_sharpe": 2.5982, "D_return_pct": 52.98, "D_hit_rate": 56.52, "D_n": 115, "D_bh_sharpe": -0.4441, "D_bh_return_pct": -14.4, "D_psr": 0.9244, "D_ic": 0.0654, "D_precision": 0.527, "D_recall": 0.7222, "D_f1": 0.6094, "D_f2": 0.6724, "D_accuracy": 0.5652, "D_mcc": 0.1547, "D_tp": 39, "D_fp": 35, "D_tn": 26, "D_fn": 15, "sharpe": 2.154, "sortino": 2.2003, "return_pct": 52.98, "equity": 1529.7999999999997, "max_dd": 0.0, "win_rate": 56.52, "profit_factor": 0.0, "ic": 0.0654, "hit": 56.52, "psr": 0.9244, "bh_sharpe": -0.4441, "bh_return_pct": -14.4, "excess_sharpe": 2.5982, "precision": 0.527, "recall": 0.7222, "f1": 0.6094, "f2": 0.6724, "mcc": 0.1547, "accuracy": 0.5652, "tp": 39, "fp": 35, "tn": 26, "fn": 15}, {"fold": "fold_2", "regime": "2011 US-downgrade + EU debt", "n": 136, "A_sharpe": 0.3136, "A_sortino": 0.313, "A_excess_sharpe": -1.4192, "A_return_pct": 2.37, "A_hit_rate": 51.85, "A_n": 136, "A_bh_sharpe": 1.7327, "A_bh_return_pct": 19.75, "A_psr": 0.5908, "A_ic": 0.0079, "A_precision": 0.5638, "A_recall": 0.6795, "A_f1": 0.6163, "A_f2": 0.6527, "A_accuracy": 0.5147, "A_mcc": -0.0293, "A_tp": 53, "A_fp": 41, "A_tn": 17, "A_fn": 25, "B_sharpe": 2.928, "B_sortino": 3.0533, "B_excess_sharpe": -1.1379, "B_return_pct": 91.77, "B_hit_rate": 58.09, "B_n": 136, "B_bh_sharpe": 4.0659, "B_bh_return_pct": 148.68, "B_psr": 0.9834, "B_ic": 0.176, "B_precision": 0.7097, "B_recall": 0.6875, "B_f1": 0.6984, "B_f2": 0.6918, "B_accuracy": 0.5809, "B_mcc": 0.0122, "B_tp": 66, "B_fp": 27, "B_tn": 13, "B_fn": 30, "D_sharpe": 0.3136, "D_sortino": 0.313, "D_excess_sharpe": -1.4192, "D_return_pct": 2.37, "D_hit_rate": 51.85, "D_n": 136, "D_bh_sharpe": 1.7327, "D_bh_return_pct": 19.75, "D_psr": 0.5908, "D_ic": 0.0079, "D_precision": 0.5638, "D_recall": 0.6795, "D_f1": 0.6163, "D_f2": 0.6527, "D_accuracy": 0.5147, "D_mcc": -0.0293, "D_tp": 53, "D_fp": 41, "D_tn": 17, "D_fn": 25, "sharpe": 0.3136, "sortino": 0.313, "return_pct": 2.37, "equity": 1023.7, "max_dd": 0.0, "win_rate": 51.85, "profit_factor": 0.0, "ic": 0.0079, "hit": 51.85, "psr": 0.5908, "bh_sharpe": 1.7327, "bh_return_pct": 19.75, "excess_sharpe": -1.4192, "precision": 0.5638, "recall": 0.6795, "f1": 0.6163, "f2": 0.6527, "mcc": -0.0293, "accuracy": 0.5147, "tp": 53, "fp": 41, "tn": 17, "fn": 25}, {"fold": "fold_3", "regime": "Taper tantrum and 2014 H1", "n": 178, "A_sharpe": 1.9586, "A_sortino": 1.7426, "A_excess_sharpe": 0.6141, "A_return_pct": 18.82, "A_hit_rate": 61.02, "A_n": 178, "A_bh_sharpe": 1.3445, "A_bh_return_pct": 12.41, "A_psr": 0.9429, "A_ic": 0.151, "A_precision": 0.6187, "A_recall": 0.835, "A_f1": 0.7107, "A_f2": 0.7804, "A_accuracy": 0.6067, "A_mcc": 0.1531, "A_tp": 86, "A_fp": 53, "A_tn": 22, "A_fn": 17, "B_sharpe": 3.8417, "B_sortino": 4.1801, "B_excess_sharpe": 0.7934, "B_return_pct": 97.68, "B_hit_rate": 58.99, "B_n": 178, "B_bh_sharpe": 3.0483, "B_bh_return_pct": 71.83, "B_psr": 0.9993, "B_ic": 0.2114, "B_precision": 0.6667, "B_recall": 0.6606, "B_f1": 0.6636, "B_f2": 0.6618, "B_accuracy": 0.5899, "B_mcc": 0.1385, "B_tp": 72, "B_fp": 36, "B_tn": 33, "B_fn": 37, "D_sharpe": 1.9586, "D_sortino": 1.7426, "D_excess_sharpe": 0.6141, "D_return_pct": 18.82, "D_hit_rate": 61.02, "D_n": 178, "D_bh_sharpe": 1.3445, "D_bh_return_pct": 12.41, "D_psr": 0.9429, "D_ic": 0.151, "D_precision": 0.6187, "D_recall": 0.835, "D_f1": 0.7107, "D_f2": 0.7804, "D_accuracy": 0.6067, "D_mcc": 0.1531, "D_tp": 86, "D_fp": 53, "D_tn": 22, "D_fn": 17, "sharpe": 1.9586, "sortino": 1.7426, "return_pct": 18.82, "equity": 1188.1999999999998, "max_dd": 0.0, "win_rate": 61.02, "profit_factor": 0.0, "ic": 0.151, "hit": 61.02, "psr": 0.9429, "bh_sharpe": 1.3445, "bh_return_pct": 12.41, "excess_sharpe": 0.6141, "precision": 0.6187, "recall": 0.835, "f1": 0.7107, "f2": 0.7804, "mcc": 0.1531, "accuracy": 0.6067, "tp": 86, "fp": 53, "tn": 22, "fn": 17}, {"fold": "fold_4", "regime": "China devaluation and oil crash", "n": 157, "A_sharpe": 3.1808, "A_sortino": 3.4403, "A_excess_sharpe": 3.171, "A_return_pct": 44.12, "A_hit_rate": 55.77, "A_n": 157, "A_bh_sharpe": 0.0098, "A_bh_return_pct": -1.05, "A_psr": 0.9927, "A_ic": 0.1788, "A_precision": 0.5478, "A_recall": 0.7778, "A_f1": 0.6429, "A_f2": 0.7175, "A_accuracy": 0.5541, "A_mcc": 0.1056, "A_tp": 63, "A_fp": 52, "A_tn": 24, "A_fn": 18, "B_sharpe": 4.0989, "B_sortino": 4.7587, "B_excess_sharpe": 4.0829, "B_return_pct": 179.34, "B_hit_rate": 57.96, "B_n": 157, "B_bh_sharpe": 0.0159, "B_bh_return_pct": -5.48, "B_psr": 0.9995, "B_ic": 0.3099, "B_precision": 0.6118, "B_recall": 0.6118, "B_f1": 0.6118, "B_f2": 0.6118, "B_accuracy": 0.5796, "B_mcc": 0.1534, "B_tp": 52, "B_fp": 33, "B_tn": 39, "B_fn": 33, "D_sharpe": 3.1808, "D_sortino": 3.4403, "D_excess_sharpe": 3.171, "D_return_pct": 44.12, "D_hit_rate": 55.77, "D_n": 157, "D_bh_sharpe": 0.0098, "D_bh_return_pct": -1.05, "D_psr": 0.9927, "D_ic": 0.1788, "D_precision": 0.5478, "D_recall": 0.7778, "D_f1": 0.6429, "D_f2": 0.7175, "D_accuracy": 0.5541, "D_mcc": 0.1056, "D_tp": 63, "D_fp": 52, "D_tn": 24, "D_fn": 18, "sharpe": 3.1808, "sortino": 3.4403, "return_pct": 44.12, "equity": 1441.2, "max_dd": 0.0, "win_rate": 55.77, "profit_factor": 0.0, "ic": 0.1788, "hit": 55.77, "psr": 0.9927, "bh_sharpe": 0.0098, "bh_return_pct": -1.05, "excess_sharpe": 3.171, "precision": 0.5478, "recall": 0.7778, "f1": 0.6429, "f2": 0.7175, "mcc": 0.1056, "accuracy": 0.5541, "tp": 63, "fp": 52, "tn": 24, "fn": 18}, {"fold": "fold_5", "regime": "2018 Vol-mageddon + Q4 sell-off", "n": 177, "A_sharpe": 2.5751, "A_sortino": 3.0138, "A_excess_sharpe": 2.2653, "A_return_pct": 48.09, "A_hit_rate": 53.67, "A_n": 177, "A_bh_sharpe": 0.3098, "A_bh_return_pct": 3.19, "A_psr": 0.9864, "A_ic": 0.1641, "A_precision": 0.6082, "A_recall": 0.5728, "A_f1": 0.59, "A_f2": 0.5796, "A_accuracy": 0.5367, "A_mcc": 0.0588, "A_tp": 59, "A_fp": 38, "A_tn": 36, "A_fn": 44, "B_sharpe": 2.3854, "B_sortino": 2.6394, "B_excess_sharpe": 1.4938, "B_return_pct": 99.98, "B_hit_rate": 52.84, "B_n": 177, "B_bh_sharpe": 0.8917, "B_bh_return_pct": 23.8, "B_psr": 0.9765, "B_ic": 0.2145, "B_precision": 0.6444, "B_recall": 0.5321, "B_f1": 0.5829, "B_f2": 0.5513, "B_accuracy": 0.5311, "B_mcc": 0.0599, "B_tp": 58, "B_fp": 32, "B_tn": 36, "B_fn": 51, "D_sharpe": 2.5751, "D_sortino": 3.0138, "D_excess_sharpe": 2.2653, "D_return_pct": 48.09, "D_hit_rate": 53.67, "D_n": 177, "D_bh_sharpe": 0.3098, "D_bh_return_pct": 3.19, "D_psr": 0.9864, "D_ic": 0.1641, "D_precision": 0.6082, "D_recall": 0.5728, "D_f1": 0.59, "D_f2": 0.5796, "D_accuracy": 0.5367, "D_mcc": 0.0588, "D_tp": 59, "D_fp": 38, "D_tn": 36, "D_fn": 44, "sharpe": 2.5751, "sortino": 3.0138, "return_pct": 48.09, "equity": 1480.9, "max_dd": 0.0, "win_rate": 53.67, "profit_factor": 0.0, "ic": 0.1641, "hit": 53.67, "psr": 0.9864, "bh_sharpe": 0.3098, "bh_return_pct": 3.19, "excess_sharpe": 2.2653, "precision": 0.6082, "recall": 0.5728, "f1": 0.59, "f2": 0.5796, "mcc": 0.0588, "accuracy": 0.5367, "tp": 59, "fp": 38, "tn": 36, "fn": 44}, {"fold": "fold_6", "regime": "COVID crash and V-recovery", "n": 222, "A_sharpe": 1.5281, "A_sortino": 1.8538, "A_excess_sharpe": 0.6393, "A_return_pct": 56.17, "A_hit_rate": 52.25, "A_n": 222, "A_bh_sharpe": 0.8888, "A_bh_return_pct": 26.13, "A_psr": 0.9347, "A_ic": 0.0326, "A_precision": 0.6231, "A_recall": 0.587, "A_f1": 0.6045, "A_f2": 0.5938, "A_accuracy": 0.5225, "A_mcc": 0.0036, "A_tp": 81, "A_fp": 49, "A_tn": 35, "A_fn": 57, "B_sharpe": -1.2671, "B_sortino": -1.2956, "B_excess_sharpe": -3.6556, "B_return_pct": -62.98, "B_hit_rate": 43.89, "B_n": 222, "B_bh_sharpe": 2.3884, "B_bh_return_pct": 243.18, "B_psr": 0.1187, "B_ic": -0.0226, "B_precision": 0.6226, "B_recall": 0.2409, "B_f1": 0.3474, "B_f2": 0.2745, "B_accuracy": 0.4414, "B_mcc": 0.0064, "B_tp": 33, "B_fp": 20, "B_tn": 65, "B_fn": 104, "D_sharpe": 1.5281, "D_sortino": 1.8538, "D_excess_sharpe": 0.6393, "D_return_pct": 56.17, "D_hit_rate": 52.25, "D_n": 222, "D_bh_sharpe": 0.8888, "D_bh_return_pct": 26.13, "D_psr": 0.9347, "D_ic": 0.0326, "D_precision": 0.6231, "D_recall": 0.587, "D_f1": 0.6045, "D_f2": 0.5938, "D_accuracy": 0.5225, "D_mcc": 0.0036, "D_tp": 81, "D_fp": 49, "D_tn": 35, "D_fn": 57, "sharpe": 1.5281, "sortino": 1.8538, "return_pct": 56.17, "equity": 1561.7, "max_dd": 0.0, "win_rate": 52.25, "profit_factor": 0.0, "ic": 0.0326, "hit": 52.25, "psr": 0.9347, "bh_sharpe": 0.8888, "bh_return_pct": 26.13, "excess_sharpe": 0.6393, "precision": 0.6231, "recall": 0.587, "f1": 0.6045, "f2": 0.5938, "mcc": 0.0036, "accuracy": 0.5225, "tp": 81, "fp": 49, "tn": 35, "fn": 57}, {"fold": "fold_7", "regime": "Inflation bear, AI rally and 2025", "n": 425, "A_sharpe": -0.0695, "A_sortino": -0.0726, "A_excess_sharpe": -1.041, "A_return_pct": -6.28, "A_hit_rate": 50.59, "A_n": 425, "A_bh_sharpe": 0.9715, "A_bh_return_pct": 37.12, "A_psr": 0.4642, "A_ic": 0.0205, "A_precision": 0.5943, "A_recall": 0.504, "A_f1": 0.5455, "A_f2": 0.5198, "A_accuracy": 0.5059, "A_mcc": 0.0124, "A_tp": 126, "A_fp": 86, "A_tn": 89, "A_fn": 124, "B_sharpe": 0.3519, "B_sortino": 0.3707, "B_excess_sharpe": -2.1508, "B_return_pct": 10.11, "B_hit_rate": 49.29, "B_n": 425, "B_bh_sharpe": 2.5027, "B_bh_return_pct": 458.83, "B_psr": 0.6764, "B_ic": 0.0185, "B_precision": 0.6313, "B_recall": 0.4297, "B_f1": 0.5113, "B_f2": 0.459, "B_accuracy": 0.4918, "B_mcc": 0.0219, "B_tp": 113, "B_fp": 66, "B_tn": 96, "B_fn": 150, "D_sharpe": -0.0695, "D_sortino": -0.0726, "D_excess_sharpe": -1.041, "D_return_pct": -6.28, "D_hit_rate": 50.59, "D_n": 425, "D_bh_sharpe": 0.9715, "D_bh_return_pct": 37.12, "D_psr": 0.4642, "D_ic": 0.0205, "D_precision": 0.5943, "D_recall": 0.504, "D_f1": 0.5455, "D_f2": 0.5198, "D_accuracy": 0.5059, "D_mcc": 0.0124, "D_tp": 126, "D_fp": 86, "D_tn": 89, "D_fn": 124, "sharpe": -0.0695, "sortino": -0.0726, "return_pct": -6.28, "equity": 937.2, "max_dd": 0.0, "win_rate": 50.59, "profit_factor": 0.0, "ic": 0.0205, "hit": 50.59, "psr": 0.4642, "bh_sharpe": 0.9715, "bh_return_pct": 37.12, "excess_sharpe": -1.041, "precision": 0.5943, "recall": 0.504, "f1": 0.5455, "f2": 0.5198, "mcc": 0.0124, "accuracy": 0.5059, "tp": 126, "fp": 86, "tn": 89, "fn": 124}], "per_window_val": [{"fold": "fold_1", "regime": "GFC peak crash (Lehman + Mar-2009 bottom)", "n": 104, "A_sharpe": 2.0328, "A_sortino": 2.5559, "A_excess_sharpe": 2.2001, "A_return_pct": 25.72, "A_hit_rate": 50.0, "A_n": 104, "A_bh_sharpe": -0.1672, "A_bh_return_pct": -3.81, "A_psr": 0.9149, "A_ic": 0.1384, "A_precision": 0.5122, "A_recall": 0.3889, "A_f1": 0.4421, "A_f2": 0.4086, "A_accuracy": 0.4904, "A_mcc": -0.0114, "A_tp": 21, "A_fp": 20, "A_tn": 30, "A_fn": 33, "B_sharpe": -3.6937, "B_sortino": -3.2574, "B_excess_sharpe": -1.4196, "B_return_pct": -58.96, "B_hit_rate": 40.78, "B_n": 104, "B_bh_sharpe": -2.2741, "B_bh_return_pct": -44.12, "B_psr": 0.0065, "B_ic": -0.1992, "B_precision": 0.4138, "B_recall": 0.4615, "B_f1": 0.4364, "B_f2": 0.4511, "B_accuracy": 0.4038, "B_mcc": -0.1936, "B_tp": 24, "B_fp": 34, "B_tn": 18, "B_fn": 28, "D_sharpe": 2.0328, "D_sortino": 2.5559, "D_excess_sharpe": 2.2001, "D_return_pct": 25.72, "D_hit_rate": 50.0, "D_n": 104, "D_bh_sharpe": -0.1672, "D_bh_return_pct": -3.81, "D_psr": 0.9149, "D_ic": 0.1384, "D_precision": 0.5122, "D_recall": 0.3889, "D_f1": 0.4421, "D_f2": 0.4086, "D_accuracy": 0.4904, "D_mcc": -0.0114, "D_tp": 21, "D_fp": 20, "D_tn": 30, "D_fn": 33, "sharpe": 2.0328, "sortino": 2.5559, "return_pct": 25.72, "equity": 1257.2, "max_dd": 0.0, "win_rate": 50.0, "profit_factor": 0.0, "ic": 0.1384, "hit": 50.0, "psr": 0.9149, "bh_sharpe": -0.1672, "bh_return_pct": -3.81, "excess_sharpe": 2.2001, "precision": 0.5122, "recall": 0.3889, "f1": 0.4421, "f2": 0.4086, "mcc": -0.0114, "accuracy": 0.4904, "tp": 21, "fp": 20, "tn": 30, "fn": 33}, {"fold": "fold_2", "regime": "2011 US-downgrade + EU debt", "n": 96, "A_sharpe": 0.9788, "A_sortino": 0.9878, "A_excess_sharpe": 1.253, "A_return_pct": 8.99, "A_hit_rate": 50.53, "A_n": 96, "A_bh_sharpe": -0.2741, "A_bh_return_pct": -4.09, "A_psr": 0.7238, "A_ic": 0.0789, "A_precision": 0.5172, "A_recall": 0.6, "A_f1": 0.5556, "A_f2": 0.5814, "A_accuracy": 0.5, "A_mcc": -0.0089, "A_tp": 30, "A_fp": 28, "A_tn": 18, "A_fn": 20, "B_sharpe": 1.6205, "B_sortino": 1.9727, "B_excess_sharpe": 2.6479, "B_return_pct": 34.36, "B_hit_rate": 47.92, "B_n": 96, "B_bh_sharpe": -1.0274, "B_bh_return_pct": -25.58, "B_psr": 0.8452, "B_ic": 0.2039, "B_precision": 0.4545, "B_recall": 0.814, "B_f1": 0.5833, "B_f2": 0.7028, "B_accuracy": 0.4792, "B_mcc": 0.0268, "B_tp": 35, "B_fp": 42, "B_tn": 11, "B_fn": 8, "D_sharpe": 0.9788, "D_sortino": 0.9878, "D_excess_sharpe": 1.253, "D_return_pct": 8.99, "D_hit_rate": 50.53, "D_n": 96, "D_bh_sharpe": -0.2741, "D_bh_return_pct": -4.09, "D_psr": 0.7238, "D_ic": 0.0789, "D_precision": 0.5172, "D_recall": 0.6, "D_f1": 0.5556, "D_f2": 0.5814, "D_accuracy": 0.5, "D_mcc": -0.0089, "D_tp": 30, "D_fp": 28, "D_tn": 18, "D_fn": 20, "sharpe": 0.9788, "sortino": 0.9878, "return_pct": 8.99, "equity": 1089.9, "max_dd": 0.0, "win_rate": 50.53, "profit_factor": 0.0, "ic": 0.0789, "hit": 50.53, "psr": 0.7238, "bh_sharpe": -0.2741, "bh_return_pct": -4.09, "excess_sharpe": 1.253, "precision": 0.5172, "recall": 0.6, "f1": 0.5556, "f2": 0.5814, "mcc": -0.0089, "accuracy": 0.5, "tp": 30, "fp": 28, "tn": 18, "fn": 20}, {"fold": "fold_3", "regime": "Taper tantrum and 2014 H1", "n": 54, "A_sharpe": 2.0385, "A_sortino": 2.1372, "A_excess_sharpe": -2.6612, "A_return_pct": 4.5, "A_hit_rate": 55.56, "A_n": 54, "A_bh_sharpe": 4.6998, "A_bh_return_pct": 10.46, "A_psr": 0.8232, "A_ic": 0.1377, "A_precision": 0.6047, "A_recall": 0.7879, "A_f1": 0.6842, "A_f2": 0.7429, "A_accuracy": 0.5556, "A_mcc": -0.0262, "A_tp": 26, "A_fp": 17, "A_tn": 4, "A_fn": 7, "B_sharpe": 2.9662, "B_sortino": 2.9927, "B_excess_sharpe": -6.0664, "B_return_pct": 15.56, "B_hit_rate": 57.41, "B_n": 54, "B_bh_sharpe": 9.0326, "B_bh_return_pct": 49.18, "B_psr": 0.9062, "B_ic": 0.3208, "B_precision": 0.75, "B_recall": 0.5676, "B_f1": 0.6462, "B_f2": 0.5966, "B_accuracy": 0.5741, "B_mcc": 0.1448, "B_tp": 21, "B_fp": 7, "B_tn": 10, "B_fn": 16, "D_sharpe": 2.0385, "D_sortino": 2.1372, "D_excess_sharpe": -2.6612, "D_return_pct": 4.5, "D_hit_rate": 55.56, "D_n": 54, "D_bh_sharpe": 4.6998, "D_bh_return_pct": 10.46, "D_psr": 0.8232, "D_ic": 0.1377, "D_precision": 0.6047, "D_recall": 0.7879, "D_f1": 0.6842, "D_f2": 0.7429, "D_accuracy": 0.5556, "D_mcc": -0.0262, "D_tp": 26, "D_fp": 17, "D_tn": 4, "D_fn": 7, "sharpe": 2.0385, "sortino": 2.1372, "return_pct": 4.5, "equity": 1045.0, "max_dd": 0.0, "win_rate": 55.56, "profit_factor": 0.0, "ic": 0.1377, "hit": 55.56, "psr": 0.8232, "bh_sharpe": 4.6998, "bh_return_pct": 10.46, "excess_sharpe": -2.6612, "precision": 0.6047, "recall": 0.7879, "f1": 0.6842, "f2": 0.7429, "mcc": -0.0262, "accuracy": 0.5556, "tp": 26, "fp": 17, "tn": 4, "fn": 7}, {"fold": "fold_4", "regime": "China devaluation and oil crash", "n": 96, "A_sharpe": -0.7117, "A_sortino": -0.6594, "A_excess_sharpe": -0.2875, "A_return_pct": -5.73, "A_hit_rate": 49.47, "A_n": 96, "A_bh_sharpe": -0.4241, "A_bh_return_pct": -3.73, "A_psr": 0.3302, "A_ic": 0.0227, "A_precision": 0.473, "A_recall": 0.7778, "A_f1": 0.5882, "A_f2": 0.689, "A_accuracy": 0.4896, "A_mcc": 0.0155, "A_tp": 35, "A_fp": 39, "A_tn": 12, "A_fn": 10, "B_sharpe": 0.547, "B_sortino": 0.5247, "B_excess_sharpe": 1.7313, "B_return_pct": 5.64, "B_hit_rate": 53.12, "B_n": 96, "B_bh_sharpe": -1.1843, "B_bh_return_pct": -21.44, "B_psr": 0.6309, "B_ic": 0.2033, "B_precision": 0.5065, "B_recall": 0.8478, "B_f1": 0.6341, "B_f2": 0.7471, "B_accuracy": 0.5312, "B_mcc": 0.1101, "B_tp": 39, "B_fp": 38, "B_tn": 12, "B_fn": 7, "D_sharpe": -0.7117, "D_sortino": -0.6594, "D_excess_sharpe": -0.2875, "D_return_pct": -5.73, "D_hit_rate": 49.47, "D_n": 96, "D_bh_sharpe": -0.4241, "D_bh_return_pct": -3.73, "D_psr": 0.3302, "D_ic": 0.0227, "D_precision": 0.473, "D_recall": 0.7778, "D_f1": 0.5882, "D_f2": 0.689, "D_accuracy": 0.4896, "D_mcc": 0.0155, "D_tp": 35, "D_fp": 39, "D_tn": 12, "D_fn": 10, "sharpe": -0.7117, "sortino": -0.6594, "return_pct": -5.73, "equity": 942.6999999999999, "max_dd": 0.0, "win_rate": 49.47, "profit_factor": 0.0, "ic": 0.0227, "hit": 49.47, "psr": 0.3302, "bh_sharpe": -0.4241, "bh_return_pct": -3.73, "excess_sharpe": -0.2875, "precision": 0.473, "recall": 0.7778, "f1": 0.5882, "f2": 0.689, "mcc": 0.0155, "accuracy": 0.4896, "tp": 35, "fp": 39, "tn": 12, "fn": 10}, {"fold": "fold_5", "regime": "2018 Vol-mageddon + Q4 sell-off", "n": 54, "A_sharpe": -0.5569, "A_sortino": -0.5263, "A_excess_sharpe": -1.9848, "A_return_pct": -1.78, "A_hit_rate": 51.85, "A_n": 54, "A_bh_sharpe": 1.428, "A_bh_return_pct": 3.97, "A_psr": 0.3993, "A_ic": -0.1229, "A_precision": 0.56, "A_recall": 0.4828, "A_f1": 0.5185, "A_f2": 0.4965, "A_accuracy": 0.5185, "A_mcc": 0.0428, "A_tp": 14, "A_fp": 11, "A_tn": 14, "A_fn": 15, "B_sharpe": -3.1356, "B_sortino": -2.8212, "B_excess_sharpe": -8.0678, "B_return_pct": -19.13, "B_hit_rate": 46.3, "B_n": 54, "B_bh_sharpe": 4.9322, "B_bh_return_pct": 34.93, "B_psr": 0.0789, "B_ic": -0.3157, "B_precision": 0.6818, "B_recall": 0.4054, "B_f1": 0.5085, "B_f2": 0.4412, "B_accuracy": 0.463, "B_mcc": -0.006, "B_tp": 15, "B_fp": 7, "B_tn": 10, "B_fn": 22, "D_sharpe": -0.5569, "D_sortino": -0.5263, "D_excess_sharpe": -1.9848, "D_return_pct": -1.78, "D_hit_rate": 51.85, "D_n": 54, "D_bh_sharpe": 1.428, "D_bh_return_pct": 3.97, "D_psr": 0.3993, "D_ic": -0.1229, "D_precision": 0.56, "D_recall": 0.4828, "D_f1": 0.5185, "D_f2": 0.4965, "D_accuracy": 0.5185, "D_mcc": 0.0428, "D_tp": 14, "D_fp": 11, "D_tn": 14, "D_fn": 15, "sharpe": -0.5569, "sortino": -0.5263, "return_pct": -1.78, "equity": 982.1999999999999, "max_dd": 0.0, "win_rate": 51.85, "profit_factor": 0.0, "ic": -0.1229, "hit": 51.85, "psr": 0.3993, "bh_sharpe": 1.428, "bh_return_pct": 3.97, "excess_sharpe": -1.9848, "precision": 0.56, "recall": 0.4828, "f1": 0.5185, "f2": 0.4965, "mcc": 0.0428, "accuracy": 0.5185, "tp": 14, "fp": 11, "tn": 14, "fn": 15}, {"fold": "fold_6", "regime": "COVID crash and V-recovery", "n": 75, "A_sharpe": 3.0712, "A_sortino": 2.8584, "A_excess_sharpe": -1.2282, "A_return_pct": 10.4, "A_hit_rate": 65.33, "A_n": 75, "A_bh_sharpe": 4.2994, "A_bh_return_pct": 14.68, "A_psr": 0.9493, "A_ic": 0.1634, "A_precision": 0.7451, "A_recall": 0.7451, "A_f1": 0.7451, "A_f2": 0.7451, "A_accuracy": 0.6533, "A_mcc": 0.2034, "A_tp": 38, "A_fp": 13, "A_tn": 11, "A_fn": 13, "B_sharpe": -4.2988, "B_sortino": -4.4327, "B_excess_sharpe": -18.6328, "B_return_pct": -27.45, "B_hit_rate": 30.67, "B_n": 75, "B_bh_sharpe": 14.3339, "B_bh_return_pct": 120.13, "B_psr": 0.0152, "B_ic": -0.0168, "B_precision": 0.7391, "B_recall": 0.2698, "B_f1": 0.3953, "B_f2": 0.3091, "B_accuracy": 0.3067, "B_mcc": -0.183, "B_tp": 17, "B_fp": 6, "B_tn": 6, "B_fn": 46, "D_sharpe": 3.0712, "D_sortino": 2.8584, "D_excess_sharpe": -1.2282, "D_return_pct": 10.4, "D_hit_rate": 65.33, "D_n": 75, "D_bh_sharpe": 4.2994, "D_bh_return_pct": 14.68, "D_psr": 0.9493, "D_ic": 0.1634, "D_precision": 0.7451, "D_recall": 0.7451, "D_f1": 0.7451, "D_f2": 0.7451, "D_accuracy": 0.6533, "D_mcc": 0.2034, "D_tp": 38, "D_fp": 13, "D_tn": 11, "D_fn": 13, "sharpe": 3.0712, "sortino": 2.8584, "return_pct": 10.4, "equity": 1104.0, "max_dd": 0.0, "win_rate": 65.33, "profit_factor": 0.0, "ic": 0.1634, "hit": 65.33, "psr": 0.9493, "bh_sharpe": 4.2994, "bh_return_pct": 14.68, "excess_sharpe": -1.2282, "precision": 0.7451, "recall": 0.7451, "f1": 0.7451, "f2": 0.7451, "mcc": 0.2034, "accuracy": 0.6533, "tp": 38, "fp": 13, "tn": 11, "fn": 13}, {"fold": "fold_7", "regime": "Inflation bear, AI rally and 2025", "n": 114, "A_sharpe": -0.3079, "A_sortino": -0.3355, "A_excess_sharpe": -3.153, "A_return_pct": -2.71, "A_hit_rate": 43.86, "A_n": 114, "A_bh_sharpe": 2.845, "A_bh_return_pct": 21.34, "A_psr": 0.4185, "A_ic": -0.0374, "A_precision": 0.5349, "A_recall": 0.3433, "A_f1": 0.4182, "A_f2": 0.3698, "A_accuracy": 0.4386, "A_mcc": -0.0835, "A_tp": 23, "A_fp": 20, "A_tn": 27, "A_fn": 44, "