{"experiment_num": 93, "backbone": "lightgbm", "description": "LightGBM @ exp 10 gbm_lr=0.005 (down from 0.01) - slower learning at fixed n_est", "config": {"seq_len": 60, "lr": 0.0003, "batch_size": 32, "epochs": 50, "weight_decay": 1e-05, "patience": 10, "warmup_epochs": 0, "head_dropout": 0.1, "huber_delta": 1.0, "grad_clip": 1.0, "seed": 42, "hidden_size": null, "num_layers": null, "max_depth": 4, "gbm_lr": 0.005, "n_estimators": 1000}, "composite": -0.8, "test_pos_folds": 4, "val_pos_folds": 4, "val_loss": null, "elapsed_sec": 217.8, "timestamp": "2026-04-27T23:50:54", "sharpe": 0.4079, "val_sharpe": -0.5, "ic": 0.0255, "hit": 47.74, "psr": 0.8014, "equity": 1326.6, "return_pct": 32.66, "bh_sharpe": 1.2194, "bh_return_pct": 187.05, "excess_sharpe": -0.8114, "B_sharpe": 0.0456, "B_excess_sharpe": -2.7826, "B_return_pct": -30.66, "D_sharpe": 0.0727, "D_excess_sharpe": -1.1467, "D_return_pct": -3.7, "precision": 0.5764, "recall": 0.4478, "f1": 0.504, "f2": 0.4687, "mcc": -0.0299, "accuracy": 0.478, "val_precision": 0.5085, "val_recall": 0.687, "val_f1": 0.5844, "val_f2": 0.6419, "val_mcc": 0.0135, "val_accuracy": 0.5077, "per_window": [{"fold": "fold_1", "regime": "GFC peak crash (Lehman + Mar-2009 bottom)", "n": 66, "A_sharpe": -0.4804, "A_sortino": -0.5586, "A_excess_sharpe": -1.0525, "A_return_pct": -6.33, "A_hit_rate": 37.88, "A_n": 66, "A_bh_sharpe": 0.5721, "A_bh_return_pct": 3.85, "A_psr": 0.4041, "A_ic": -0.014, "A_precision": 0.4118, "A_recall": 0.4, "A_f1": 0.4058, "A_f2": 0.4023, "A_accuracy": 0.3788, "A_mcc": -0.2448, "A_tp": 14, "A_fp": 20, "A_tn": 11, "A_fn": 21, "B_sharpe": 2.3003, "B_sortino": 2.6172, "B_excess_sharpe": 0.2534, "B_return_pct": 46.35, "B_hit_rate": 50.77, "B_n": 66, "B_bh_sharpe": 2.0469, "B_bh_return_pct": 39.28, "B_psr": 0.8797, "B_ic": 0.3352, "B_precision": 0.6667, "B_recall": 0.2222, "B_f1": 0.3333, "B_f2": 0.2564, "B_accuracy": 0.5152, "B_mcc": 0.1148, "B_tp": 8, "B_fp": 4, "B_tn": 26, "B_fn": 28, "D_sharpe": 2.2406, "D_sortino": 2.4016, "D_excess_sharpe": 1.6685, "D_return_pct": 22.06, "D_hit_rate": 53.03, "D_n": 66, "D_bh_sharpe": 0.5721, "D_bh_return_pct": 3.85, "D_psr": 0.8705, "D_ic": 0.1737, "D_precision": 0.6667, "D_recall": 0.2286, "D_f1": 0.3404, "D_f2": 0.2632, "D_accuracy": 0.5303, "D_mcc": 0.1288, "D_tp": 8, "D_fp": 4, "D_tn": 27, "D_fn": 27, "sharpe": -0.4804, "sortino": -0.5586, "return_pct": -6.33, "equity": 936.6999999999999, "max_dd": 0.0, "win_rate": 37.88, "profit_factor": 0.0, "ic": -0.014, "hit": 37.88, "psr": 0.4041, "bh_sharpe": 0.5721, "bh_return_pct": 3.85, "excess_sharpe": -1.0525, "precision": 0.4118, "recall": 0.4, "f1": 0.4058, "f2": 0.4023, "mcc": -0.2448, "accuracy": 0.3788, "tp": 14, "fp": 20, "tn": 11, "fn": 21}, {"fold": "fold_2", "regime": "2011 US-downgrade + EU debt", "n": 87, "A_sharpe": 1.4917, "A_sortino": 1.918, "A_excess_sharpe": -3.5303, "A_return_pct": 7.96, "A_hit_rate": 48.84, "A_n": 87, "A_bh_sharpe": 5.022, "A_bh_return_pct": 29.23, "A_psr": 0.8203, "A_ic": 0.1184, "A_precision": 0.5893, "A_recall": 0.6111, "A_f1": 0.6, "A_f2": 0.6066, "A_accuracy": 0.4943, "A_mcc": -0.087, "A_tp": 33, "A_fp": 23, "A_tn": 10, "A_fn": 21, "B_sharpe": 6.4789, "B_sortino": 7.1147, "B_excess_sharpe": -4.658, "B_return_pct": 98.03, "B_hit_rate": 67.82, "B_n": 87, "B_bh_sharpe": 11.1369, "B_bh_return_pct": 185.4, "B_psr": 0.9999, "B_ic": 0.1598, "B_precision": 0.8286, "B_recall": 0.7838, "B_f1": 0.8056, "B_f2": 0.7923, "B_accuracy": 0.6782, "B_mcc": -0.1252, "B_tp": 58, "B_fp": 12, "B_tn": 1, "B_fn": 16, "D_sharpe": 2.9414, "D_sortino": 3.6788, "D_excess_sharpe": -2.0806, "D_return_pct": 16.56, "D_hit_rate": 54.65, "D_n": 87, "D_bh_sharpe": 5.022, "D_bh_return_pct": 29.23, "D_psr": 0.9682, "D_ic": 0.0166, "D_precision": 0.6, "D_recall": 0.7778, "D_f1": 0.6774, "D_f2": 0.7343, "D_accuracy": 0.5402, "D_mcc": -0.0865, "D_tp": 42, "D_fp": 28, "D_tn": 5, "D_fn": 12, "sharpe": 1.4917, "sortino": 1.918, "return_pct": 7.96, "equity": 1079.6000000000001, "max_dd": 0.0, "win_rate": 48.84, "profit_factor": 0.0, "ic": 0.1184, "hit": 48.84, "psr": 0.8203, "bh_sharpe": 5.022, "bh_return_pct": 29.23, "excess_sharpe": -3.5303, "precision": 0.5893, "recall": 0.6111, "f1": 0.6, "f2": 0.6066, "mcc": -0.087, "accuracy": 0.4943, "tp": 33, "fp": 23, "tn": 10, "fn": 21}, {"fold": "fold_3", "regime": "Taper tantrum and 2014 H1", "n": 129, "A_sharpe": 0.6196, "A_sortino": 0.5679, "A_excess_sharpe": -1.1482, "A_return_pct": 3.71, "A_hit_rate": 53.12, "A_n": 129, "A_bh_sharpe": 1.7678, "A_bh_return_pct": 11.76, "A_psr": 0.6683, "A_ic": 0.105, "A_precision": 0.5895, "A_recall": 0.7179, "A_f1": 0.6474, "A_f2": 0.688, "A_accuracy": 0.5271, "A_mcc": -0.0519, "A_tp": 56, "A_fp": 39, "A_tn": 12, "A_fn": 22, "B_sharpe": 3.3757, "B_sortino": 3.4152, "B_excess_sharpe": -0.8717, "B_return_pct": 48.53, "B_hit_rate": 60.47, "B_n": 129, "B_bh_sharpe": 4.2474, "B_bh_return_pct": 64.1, "B_psr": 0.9905, "B_ic": -0.0045, "B_precision": 0.6372, "B_recall": 0.878, "B_f1": 0.7385, "B_f2": 0.8163, "B_accuracy": 0.6047, "B_mcc": 0.0083, "B_tp": 72, "B_fp": 41, "B_tn": 6, "B_fn": 10, "D_sharpe": 1.5981, "D_sortino": 1.4277, "D_excess_sharpe": -0.1697, "D_return_pct": 10.55, "D_hit_rate": 57.81, "D_n": 129, "D_bh_sharpe": 1.7678, "D_bh_return_pct": 11.76, "D_psr": 0.8626, "D_ic": 0.1008, "D_precision": 0.6018, "D_recall": 0.8718, "D_f1": 0.712, "D_f2": 0.8, "D_accuracy": 0.5736, "D_mcc": -0.0157, "D_tp": 68, "D_fp": 45, "D_tn": 6, "D_fn": 10, "sharpe": 0.6196, "sortino": 0.5679, "return_pct": 3.71, "equity": 1037.1, "max_dd": 0.0, "win_rate": 53.12, "profit_factor": 0.0, "ic": 0.105, "hit": 53.12, "psr": 0.6683, "bh_sharpe": 1.7678, "bh_return_pct": 11.76, "excess_sharpe": -1.1482, "precision": 0.5895, "recall": 0.7179, "f1": 0.6474, "f2": 0.688, "mcc": -0.0519, "accuracy": 0.5271, "tp": 56, "fp": 39, "tn": 12, "fn": 22}, {"fold": "fold_4", "regime": "China devaluation and oil crash", "n": 108, "A_sharpe": -0.4311, "A_sortino": -0.4253, "A_excess_sharpe": 0.2586, "A_return_pct": -4.57, "A_hit_rate": 46.73, "A_n": 108, "A_bh_sharpe": -0.6898, "A_bh_return_pct": -6.71, "A_psr": 0.3891, "A_ic": 0.0332, "A_precision": 0.4677, "A_recall": 0.5472, "A_f1": 0.5043, "A_f2": 0.5292, "A_accuracy": 0.4722, "A_mcc": -0.0534, "A_tp": 29, "A_fp": 33, "A_tn": 22, "A_fn": 24, "B_sharpe": -3.2569, "B_sortino": -2.9188, "B_excess_sharpe": -1.2994, "B_return_pct": -47.49, "B_hit_rate": 41.67, "B_n": 108, "B_bh_sharpe": -1.9575, "B_bh_return_pct": -33.56, "B_psr": 0.0142, "B_ic": -0.1435, "B_precision": 0.3966, "B_recall": 0.451, "B_f1": 0.422, "B_f2": 0.4389, "B_accuracy": 0.4167, "B_mcc": -0.1633, "B_tp": 23, "B_fp": 35, "B_tn": 22, "B_fn": 28, "D_sharpe": -1.5293, "D_sortino": -1.377, "D_excess_sharpe": -0.8395, "D_return_pct": -13.28, "D_hit_rate": 47.66, "D_n": 108, "D_bh_sharpe": -0.6898, "D_bh_return_pct": -6.71, "D_psr": 0.1546, "D_ic": -0.0652, "D_precision": 0.4655, "D_recall": 0.5094, "D_f1": 0.4865, "D_f2": 0.5, "D_accuracy": 0.4722, "D_mcc": -0.0543, "D_tp": 27, "D_fp": 31, "D_tn": 24, "D_fn": 26, "sharpe": -0.4311, "sortino": -0.4253, "return_pct": -4.57, "equity": 954.3000000000001, "max_dd": 0.0, "win_rate": 46.73, "profit_factor": 0.0, "ic": 0.0332, "hit": 46.73, "psr": 0.3891, "bh_sharpe": -0.6898, "bh_return_pct": -6.71, "excess_sharpe": 0.2586, "precision": 0.4677, "recall": 0.5472, "f1": 0.5043, "f2": 0.5292, "mcc": -0.0534, "accuracy": 0.4722, "tp": 29, "fp": 33, "tn": 22, "fn": 24}, {"fold": "fold_5", "regime": "2018 Vol-mageddon + Q4 sell-off", "n": 128, "A_sharpe": 0.5288, "A_sortino": 0.6019, "A_excess_sharpe": -0.6223, "A_return_pct": 5.07, "A_hit_rate": 48.44, "A_n": 128, "A_bh_sharpe": 1.1511, "A_bh_return_pct": 13.19, "A_psr": 0.6478, "A_ic": -0.0417, "A_precision": 0.5882, "A_recall": 0.5128, "A_f1": 0.5479, "A_f2": 0.5263, "A_accuracy": 0.4844, "A_mcc": -0.0461, "A_tp": 40, "A_fp": 28, "A_tn": 22, "A_fn": 38, "B_sharpe": -4.1166, "B_sortino": -4.0009, "B_excess_sharpe": -6.9285, "B_return_pct": -63.2, "B_hit_rate": 32.28, "B_n": 128, "B_bh_sharpe": 2.8119, "B_bh_return_pct": 82.25, "B_psr": 0.0019, "B_ic": -0.0944, "B_precision": 0.4898, "B_recall": 0.2824, "B_f1": 0.3582, "B_f2": 0.3085, "B_accuracy": 0.3281, "B_mcc": -0.2906, "B_tp": 24, "B_fp": 25, "B_tn": 18, "B_fn": 61, "D_sharpe": -1.3129, "D_sortino": -1.4532, "D_excess_sharpe": -2.464, "D_return_pct": -15.76, "D_hit_rate": 41.41, "D_n": 128, "D_bh_sharpe": 1.1511, "D_bh_return_pct": 13.19, "D_psr": 0.1831, "D_ic": -0.0818, "D_precision": 0.5306, "D_recall": 0.3333, "D_f1": 0.4094, "D_f2": 0.3601, "D_accuracy": 0.4141, "D_mcc": -0.1271, "D_tp": 26, "D_fp": 23, "D_tn": 27, "D_fn": 52, "sharpe": 0.5288, "sortino": 0.6019, "return_pct": 5.07, "equity": 1050.7, "max_dd": 0.0, "win_rate": 48.44, "profit_factor": 0.0, "ic": -0.0417, "hit": 48.44, "psr": 0.6478, "bh_sharpe": 1.1511, "bh_return_pct": 13.19, "excess_sharpe": -0.6223, "precision": 0.5882, "recall": 0.5128, "f1": 0.5479, "f2": 0.5263, "mcc": -0.0461, "accuracy": 0.4844, "tp": 40, "fp": 28, "tn": 22, "fn": 38}, {"fold": "fold_6", "regime": "COVID crash and V-recovery", "n": 173, "A_sharpe": 2.5577, "A_sortino": 2.9379, "A_excess_sharpe": 0.2317, "A_return_pct": 49.31, "A_hit_rate": 54.91, "A_n": 173, "A_bh_sharpe": 2.3261, "A_bh_return_pct": 43.81, "A_psr": 0.9851, "A_ic": 0.1542, "A_precision": 0.7059, "A_recall": 0.531, "A_f1": 0.6061, "A_f2": 0.5587, "A_accuracy": 0.5491, "A_mcc": 0.1088, "A_tp": 60, "A_fp": 25, "A_tn": 35, "A_fn": 53, "B_sharpe": -0.1264, "B_sortino": -0.1418, "B_excess_sharpe": -5.8724, "B_return_pct": -12.27, "B_hit_rate": 45.93, "B_n": 173, "B_bh_sharpe": 5.746, "B_bh_return_pct": 499.04, "B_psr": 0.4585, "B_ic": 0.0881, "B_precision": 0.6552, "B_recall": 0.3423, "B_f1": 0.4497, "B_f2": 0.3785, "B_accuracy": 0.4624, "B_mcc": 0.0201, "B_tp": 38, "B_fp": 20, "B_tn": 42, "B_fn": 73, "D_sharpe": -0.2653, "D_sortino": -0.3101, "D_excess_sharpe": -2.5914, "D_return_pct": -6.23, "D_hit_rate": 41.62, "D_n": 173, "D_bh_sharpe": 2.3261, "D_bh_return_pct": 43.81, "D_psr": 0.4136, "D_ic": -0.0323, "D_precision": 0.6034, "D_recall": 0.3097, "D_f1": 0.4094, "D_f2": 0.3431, "D_accuracy": 0.4162, "D_mcc": -0.0742, "D_tp": 35, "D_fp": 23, "D_tn": 37, "D_fn": 78, "sharpe": 2.5577, "sortino": 2.9379, "return_pct": 49.31, "equity": 1493.1000000000001, "max_dd": 0.0, "win_rate": 54.91, "profit_factor": 0.0, "ic": 0.1542, "hit": 54.91, "psr": 0.9851, "bh_sharpe": 2.3261, "bh_return_pct": 43.81, "excess_sharpe": 0.2317, "precision": 0.7059, "recall": 0.531, "f1": 0.6061, "f2": 0.5587, "mcc": 0.1088, "accuracy": 0.5491, "tp": 60, "fp": 25, "tn": 35, "fn": 53}, {"fold": "fold_7", "regime": "Inflation bear, AI rally and 2025", "n": 376, "A_sharpe": -0.3922, "A_sortino": -0.4526, "A_excess_sharpe": -1.1955, "A_return_pct": -15.51, "A_hit_rate": 44.15, "A_n": 376, "A_bh_sharpe": 0.8033, "A_bh_return_pct": 26.02, "A_psr": 0.3192, "A_ic": -0.0002, "A_precision": 0.5604, "A_recall": 0.2308, "A_f1": 0.3269, "A_f2": 0.2615, "A_accuracy": 0.4415, "A_mcc": -0.0314, "A_tp": 51, "A_fp": 40, "A_tn": 115, "A_fn": 170, "B_sharpe": 0.157, "B_sortino": 0.1798, "B_excess_sharpe": -1.7747, "B_return_pct": -4.97, "B_hit_rate": 44.8, "B_n": 376, "B_bh_sharpe": 1.9317, "B_bh_return_pct": 222.05, "B_psr": 0.5762, "B_ic": -0.0129, "B_precision": 0.75, "B_recall": 0.1322, "B_f1": 0.2247, "B_f2": 0.1582, "B_accuracy": 0.4495, "B_mcc": 0.1032, "B_tp": 30, "B_fp": 10, "B_tn": 139, "B_fn": 197, "D_sharpe": -0.2241, "D_sortino": -0.2707, "D_excess_sharpe": -1.0274, "D_return_pct": -10.61, "D_hit_rate": 43.35, "D_n": 376, "D_bh_sharpe": 0.8033, "D_bh_return_pct": 26.02, "D_psr": 0.3935, "D_ic": -0.0391, "D_precision": 0.6, "D_recall": 0.1086, "D_f1": 0.1839, "D_f2": 0.1299, "D_accuracy": 0.4335, "D_mcc": 0.0086, "D_tp": 24, "D_fp": 16, "D_tn": 139, "D_fn": 197, "sharpe": -0.3922, "sortino": -0.4526, "return_pct": -15.51, "equity": 844.9, "max_dd": 0.0, "win_rate": 44.15, "profit_factor": 0.0, "ic": -0.0002, "hit": 44.15, "psr": 0.3192, "bh_sharpe": 0.8033, "bh_return_pct": 26.02, "excess_sharpe": -1.1955, "precision": 0.5604, "recall": 0.2308, "f1": 0.3269, "f2": 0.2615, "mcc": -0.0314, "accuracy": 0.4415, "tp": 51, "fp": 40, "tn": 115, "fn": 170}], "per_window_val": [{"fold": "fold_1", "regime": "GFC peak crash (Lehman + Mar-2009 bottom)", "n": 65, "A_sharpe": -1.6549, "A_sortino": -1.5361, "A_excess_sharpe": 0.5707, "A_return_pct": -14.68, "A_hit_rate": 42.86, "A_n": 65, "A_bh_sharpe": -2.2257, "A_bh_return_pct": -18.74, "A_psr": 0.1942, "A_ic": -0.0559, "A_precision": 0.431, "A_recall": 0.8621, "A_f1": 0.5747, "A_f2": 0.7184, "A_accuracy": 0.4308, "A_mcc": -0.0876, "A_tp": 25, "A_fp": 33, "A_tn": 3, "A_fn": 4, "B_sharpe": -5.3863, "B_sortino": -4.5118, "B_excess_sharpe": 1.736, "B_return_pct": -64.86, "B_hit_rate": 38.46, "B_n": 65, "B_bh_sharpe": -7.1223, "B_bh_return_pct": -73.11, "B_psr": 0.0021, "B_ic": 0.3943, "B_precision": 0.3651, "B_recall": 1.0, "B_f1": 0.5349, "B_f2": 0.7419, "B_accuracy": 0.3846, "B_mcc": 0.1319, "B_tp": 23, "B_fp": 40, "B_tn": 2, "B_fn": 0, "D_sharpe": -1.2517, "D_sortino": -1.0657, "D_excess_sharpe": 0.974, "D_return_pct": -11.66, "D_hit_rate": 49.21, "D_n": 65, "D_bh_sharpe": -2.2257, "D_bh_return_pct": -18.74, "D_psr": 0.2558, "D_ic": 0.3662, "D_precision": 0.4603, "D_recall": 1.0, "D_f1": 0.6304, "D_f2": 0.8101, "D_accuracy": 0.4769, "D_mcc": 0.1599, "D_tp": 29, "D_fp": 34, "D_tn": 2, "D_fn": 0, "sharpe": -1.6549, "sortino": -1.5361, "return_pct": -14.68, "equity": 853.1999999999999, "max_dd": 0.0, "win_rate": 42.86, "profit_factor": 0.0, "ic": -0.0559, "hit": 42.86, "psr": 0.1942, "bh_sharpe": -2.2257, "bh_return_pct": -18.74, "excess_sharpe": 0.5707, "precision": 0.431, "recall": 0.8621, "f1": 0.5747, "f2": 0.7184, "mcc": -0.0876, "accuracy": 0.4308, "tp": 25, "fp": 33, "tn": 3, "fn": 4}, {"fold": "fold_2", "regime": "2011 US-downgrade + EU debt", "n": 47, "A_sharpe": 0.3012, "A_sortino": 0.2616, "A_excess_sharpe": 0.4953, "A_return_pct": 0.82, "A_hit_rate": 57.45, "A_n": 47, "A_bh_sharpe": -0.1941, "A_bh_return_pct": -2.36, "A_psr": 0.5509, "A_ic": 0.0619, "A_precision": 0.5789, "A_recall": 0.8462, "A_f1": 0.6875, "A_f2": 0.7746, "A_accuracy": 0.5745, "A_mcc": 0.1065, "A_tp": 22, "A_fp": 16, "A_tn": 5, "A_fn": 4, "B_sharpe": -0.9952, "B_sortino": -0.8763, "B_excess_sharpe": 0.6172, "B_return_pct": -17.54, "B_hit_rate": 51.06, "B_n": 47, "B_bh_sharpe": -1.6123, "B_bh_return_pct": -24.3, "B_psr": 0.3326, "B_ic": 0.2617, "B_precision": 0.4773, "B_recall": 1.0, "B_f1": 0.6462, "B_f2": 0.8203, "B_accuracy": 0.5106, "B_mcc": 0.2347, "B_tp": 21, "B_fp": 23, "B_tn": 3, "B_fn": 0, "D_sharpe": -0.1658, "D_sortino": -0.1483, "D_excess_sharpe": 0.0283, "D_return_pct": -2.18, "D_hit_rate": 53.19, "D_n": 47, "D_bh_sharpe": -0.1941, "D_bh_return_pct": -2.36, "D_psr": 0.4717, "D_ic": 0.0448, "D_precision": 0.5455, "D_recall": 0.9231, "D_f1": 0.6857, "D_f2": 0.8108, "D_accuracy": 0.5319, "D_mcc": -0.0596, "D_tp": 24, "D_fp": 20, "D_tn": 1, "D_fn": 2, "sharpe": 0.3012, "sortino": 0.2616, "return_pct": 0.82, "equity": 1008.1999999999999, "max_dd": 0.0, "win_rate": 57.45, "profit_factor": 0.0, "ic": 0.0619, "hit": 57.45, "psr": 0.5509, "bh_sharpe": -0.1941, "bh_return_pct": -2.36, "excess_sharpe": 0.4953, "precision": 0.5789, "recall": 0.8462, "f1": 0.6875, "f2": 0.7746, "mcc": 0.1065, "accuracy": 0.5745, "tp": 22, "fp": 16, "tn": 5, "fn": 4}, {"fold": "fold_3", "regime": "Taper tantrum and 2014 H1", "n": 5, "A_sharpe": 3.7421, "A_sortino": 3.8425, "A_excess_sharpe": 5.0616, "A_return_pct": 0.57, "A_hit_rate": 60.0, "A_n": 5, "A_bh_sharpe": -1.3194, "A_bh_return_pct": -0.21, "A_psr": 0.6797, "A_ic": -0.1, "A_precision": 0.5, "A_recall": 0.5, "A_f1": 0.5, "A_f2": 0.5, "A_accuracy": 0.6, "A_mcc": 0.1667, "A_tp": 1, "A_fp": 1, "A_tn": 2, "A_fn": 1, "B_sharpe": 25.8705, "B_sortino": 0.0, "B_excess_sharpe": 51.7411, "B_return_pct": 3.95, "B_hit_rate": 100.0, "B_n": 5, "B_bh_sharpe": -25.8705, "B_bh_return_pct": -3.84, "B_psr": 1.0, "B_ic": -0.5, "B_precision": 0.0, "B_recall": 0.0, "B_f1": 0.0, "B_f2": 0.0, "B_accuracy": 1.0, "B_mcc": 0.0, "B_tp": 0, "B_fp": 0, "B_tn": 5, "B_fn": 0, "D_sharpe": 1.3194, "D_sortino": 1.268, "D_excess_sharpe": 2.6388, "D_return_pct": 0.2, "D_hit_rate": 60.0, "D_n": 5, "D_bh_sharpe": -1.3194, "D_bh_return_pct": -0.21, "D_psr": 0.5663, "D_ic": -0.5, "D_precision": 0.0, "D_recall": 0.0, "D_f1": 0.0, "D_f2": 0.0, "D_accuracy": 0.6, "D_mcc": 0.0, "D_tp": 0, "D_fp": 0, "D_tn": 3, "D_fn": 2, "sharpe": 3.7421, "sortino": 3.8425, "return_pct": 0.57, "equity": 1005.7, "max_dd": 0.0, "win_rate": 60.0, "profit_factor": 0.0, "ic": -0.1, "hit": 60.0, "psr": 0.6797, "bh_sharpe": -1.3194, "bh_return_pct": -0.21, "excess_sharpe": 5.0616, "precision": 0.5, "recall": 0.5, "f1": 0.5, "f2": 0.5, "mcc": 0.1667, "accuracy": 0.6, "tp": 1, "fp": 1, "tn": 2, "fn": 1}, {"fold": "fold_4", "regime": "China devaluation and oil crash", "n": 47, "A_sharpe": -1.8949, "A_sortino": -1.7783, "A_excess_sharpe": -0.0711, "A_return_pct": -8.98, "A_hit_rate": 44.68, "A_n": 47, "A_bh_sharpe": -1.8238, "A_bh_return_pct": -8.68, "A_psr": 0.2086, "A_ic": 0.0623, "A_precision": 0.4444, "A_recall": 0.9524, "A_f1": 0.6061, "A_f2": 0.7752, "A_accuracy": 0.4468, "A_mcc": -0.0226, "A_tp": 20, "A_fp": 25, "A_tn": 1, "A_fn": 1, "B_sharpe": -0.8071, "B_sortino": -0.7313, "B_excess_sharpe": 1.4129, "B_return_pct": -11.44, "B_hit_rate": 46.81, "B_n": 47, "B_bh_sharpe": -2.22, "B_bh_return_pct": -23.98, "B_psr": 0.3615, "B_ic": 0.6011, "B_precision": 0.4565, "B_recall": 1.0, "B_f1": 0.6269, "B_f2": 0.8077, "B_accuracy": 0.4681, "B_mcc": 0.1325, "B_tp": 21, "B_fp": 25, "B_tn": 1, "B_fn": 0, "D_sharpe": -2.1863, "D_sortino": -2.0797, "D_excess_sharpe": -0.3625, "D_return_pct": -10.18, "D_hit_rate": 42.55, "D_n": 47, "D_bh_sharpe": -1.8238, "D_bh_return_pct": -8.68, "D_psr": 0.1755, "D_ic": 0.1969, "D_precision": 0.4348, "D_recall": 0.9524, "D_f1": 0.597, "D_f2": 0.7692, "D_accuracy": 0.4255, "D_mcc": -0.1641, "D_tp": 20, "D_fp": 26, "D_tn": 0, "D_fn": 1, "sharpe": -1.8949, "sortino": -1.7783, "return_pct": -8.98, "equity": 910.2, "max_dd": 0.0, "win_rate": 44.68, "profit_factor": 0.0, "ic": 0.0623, "hit": 44.68, "psr": 0.2086, "bh_sharpe": -1.8238, "bh_return_pct": -8.68, "excess_sharpe": -0.0711, "precision": 0.4444, "recall": 0.9524, "f1": 0.6061, "f2": 0.7752, "mcc": -0.0226, "accuracy": 0.4468, "tp": 20, "fp": 25, "tn": 1, "fn": 1}, {"fold": "fold_5", "regime": "2018 Vol-mageddon + Q4 sell-off", "n": 5, "A_sharpe": -10.1368, "A_sortino": -6.9937, "A_excess_sharpe": 0.0, "A_return_pct": -3.15, "A_hit_rate": 40.0, "A_n": 5, "A_bh_sharpe": -10.1368, "A_bh_return_pct": -3.15, "A_psr": 0.0985, "A_ic": -0.4, "A_precision": 0.4, "A_recall": 1.0, "A_f1": 0.5714, "A_f2": 0.7692, "A_accuracy": 0.4, "A_mcc": 0.0, "A_tp": 2, "A_fp": 3, "A_tn": 0, "A_fn": 0, "B_sharpe": 5.6858, "B_sortino": 6.0578, "B_excess_sharpe": 0.0, "B_return_pct": 4.22, "B_hit_rate": 60.0, "B_n": 5, "B_bh_sharpe": 5.6858, "B_bh_return_pct": 4.22, "B_psr": 0.753, "B_ic": 0.9, "B_precision": 0.6, "B_recall": 1.0, "B_f1": 0.75, "B_f2": 0.8824, "B_accuracy": 0.6, "B_mcc": 0.0, "B_tp": 3, "B_fp": 2, "B_tn": 0, "B_fn": 0, "D_sharpe": -10.1368, "D_sortino": -6.9937, "D_excess_sharpe": 0.0, "D_return_pct": -3.15, "D_hit_rate": 40.0, "D_n": 5, "D_bh_sharpe": -10.1368, "D_bh_return_pct": -3.15, "D_psr": 0.0985, "D_ic": 0.7, "D_precision": 0.4, "D_recall": 1.0, "D_f1": 0.5714, "D_f2": 0.7692, "D_accuracy": 0.4, "D_mcc": 0.0, "D_tp": 2, "D_fp": 3, "D_tn": 0, "D_fn": 0, "sharpe": -10.1368, "sortino": -6.9937, "return_pct": -3.15, "equity": 968.5, "max_dd": 0.0, "win_rate": 40.0, "profit_factor": 0.0, "ic": -0.4, "hit": 40.0, "psr": 0.0985, "bh_sharpe": -10.1368, "bh_return_pct": -3.15, "excess_sharpe": 0.0, "precision": 0.4, "recall": 1.0, "f1": 0.5714, "f2": 0.7692, "mcc": 0.0, "accuracy": 0.4, "tp": 2, "fp": 3, "tn": 0, "fn": 0}, {"fold": "fold_6", "regime": "COVID crash and V-recovery", "n": 26, "A_sharpe": 4.7834, "A_sortino": 5.4669, "A_excess_sharpe": 1.4983, "A_return_pct": 6.98, "A_hit_rate": 57.69, "A_n": 26, "A_bh_sharpe": 3.2852, "A_bh_return_pct": 4.82, "A_psr": 0.9304, "A_ic": 0.1542, "A_precision": 0.6316, "A_recall": 0.75, "A_f1": 0.6857, "A_f2": 0.7229, "A_accuracy": 0.5769, "A_mcc": 0.0548, "A_tp": 12, "A_fp": 7, "A_tn": 3, "A_fn": 4, "B_sharpe": 6.512, "B_sortino": 6.5784, "B_excess_sharpe": -6.4672, "B_return_pct": 21.45, "B_hit_rate": 69.23, "B_n": 26, "B_bh_sharpe": 12.9792, "B_bh_return_pct": 38.76, "B_psr": 0.9748, "B_ic": 0.4468, "B_precision": 1.0, "B_recall": 0.619, "B_f1": 0.7647, "B_f2": 0.6701, "B_accuracy": 0.6923, "B_mcc": 0.488, "B_tp": 13, "B_fp": 0, "B_tn": 5, "B_fn": 8, "D_sharpe": 3.5606, "D_sortino": 4.6629, "D_excess_sharpe": 0.2754, "D_return_pct": 5.23, "D_hit_rate": 50.0, "D_n": 26, "D_bh_sharpe": 3.2852, "D_bh_return_pct": 4.82, "D_psr": 0.8766, "D_ic": 0.2349, "D_precision": 0.6154, "D_recall": 0.5, "D_f1": 0.5517, "D_f2": 0.5195, "D_accuracy": 0.5, "D_mcc": 0.0, "D_tp": 8, "D_fp": 5, "D_tn": 5, "D_fn": 8, "sharpe": 4.7834, "sortino": 5.4669, "return_pct": 6.98, "equity": 1069.8000000000002, "max_dd": 0.0, "win_rate": 57.69, "profit_factor": 0.0, "ic": 0.1542, "hit": 57.69, "psr": 0.9304, "bh_sharpe": 3.2852, "bh_return_pct": 4.82, "excess_sharpe": 1.4983, "precision": 0.6316, "recall": 0.75, "f1": 0.6857, "f2": 0.7229, "mcc": 0.0548, "accuracy": 0.5769, "tp": 12, "fp": 7, "tn": 3, "fn": 4}, {"fold": "fold_7", "regime": "Inflation bear, AI rally and 2025", "n": 65, "A_sharpe": 0.8283, "A_sortino": 0.7698, "A_excess_sharpe": -1.2506, "A_return_pct": 3.01, "A_hit_rate": 55.38, "A_n": 65, "A_bh_sharpe": 2.0789, "A_bh_return_pct": 8.17, "A_psr": 0.6602, "A_ic": 0.1747, "A_precision": 0.8, "A_recall": 0.2286, "A_f1": 0.3556, "A_f2": 0.2667, "A_accuracy": 0.5538, "A_mcc": 0.2237, "A_tp": 8, "A_fp": 2, "A_tn": 28, "A_fn": 27, "B_sharpe": -3.4525, "B_sortino": -3.4182, "B_excess_sharpe": -8.6839, "B_return_pct": -23.59, "B_hit_rate": 35.38, "B_n": 65, "B_bh_sharpe": 5.2314, "B_bh_return_pct": 44