{"experiment_num": 99, "backbone": "catboost", "description": "CatBoost lr=0.02 n_est=500 - smaller capacity at productive lr", "config": {"seq_len": 60, "lr": 0.0003, "batch_size": 32, "epochs": 50, "weight_decay": 1e-05, "patience": 10, "warmup_epochs": 0, "head_dropout": 0.1, "huber_delta": 1.0, "grad_clip": 1.0, "seed": 42, "hidden_size": null, "num_layers": null, "max_depth": 4, "gbm_lr": 0.02, "n_estimators": 500}, "composite": -0.8456, "test_pos_folds": 3, "val_pos_folds": 2, "val_loss": null, "elapsed_sec": 673.8, "timestamp": "2026-04-28T00:46:47", "sharpe": 0.2334, "val_sharpe": -0.4456, "ic": 0.0108, "hit": 49.72, "psr": 0.6851, "equity": 1122.6000000000001, "return_pct": 12.26, "bh_sharpe": 1.2194, "bh_return_pct": 187.05, "excess_sharpe": -0.986, "B_sharpe": 0.0176, "B_excess_sharpe": -2.8106, "B_return_pct": -34.43, "D_sharpe": 0.3212, "D_excess_sharpe": -0.8981, "D_return_pct": 22.13, "precision": 0.5938, "recall": 0.481, "f1": 0.5315, "f2": 0.5, "mcc": 0.0028, "accuracy": 0.4977, "val_precision": 0.5104, "val_recall": 0.7481, "val_f1": 0.6068, "val_f2": 0.6844, "val_mcc": 0.0221, "val_accuracy": 0.5115, "per_window": [{"fold": "fold_1", "regime": "GFC peak crash (Lehman + Mar-2009 bottom)", "n": 66, "A_sharpe": -0.3036, "A_sortino": -0.3012, "A_excess_sharpe": -0.8757, "A_return_pct": -4.7, "A_hit_rate": 50.0, "A_n": 66, "A_bh_sharpe": 0.5721, "A_bh_return_pct": 3.85, "A_psr": 0.4388, "A_ic": 0.0474, "A_precision": 0.5278, "A_recall": 0.5429, "A_f1": 0.5352, "A_f2": 0.5398, "A_accuracy": 0.5, "A_mcc": -0.0055, "A_tp": 19, "A_fp": 17, "A_tn": 14, "A_fn": 16, "B_sharpe": 0.4555, "B_sortino": 0.4772, "B_excess_sharpe": -1.5914, "B_return_pct": 1.51, "B_hit_rate": 50.77, "B_n": 66, "B_bh_sharpe": 2.0469, "B_bh_return_pct": 39.28, "B_psr": 0.5917, "B_ic": 0.1188, "B_precision": 0.5429, "B_recall": 0.5278, "B_f1": 0.5352, "B_f2": 0.5307, "B_accuracy": 0.5, "B_mcc": -0.0055, "B_tp": 19, "B_fp": 16, "B_tn": 14, "B_fn": 17, "D_sharpe": 3.0072, "D_sortino": 2.9223, "D_excess_sharpe": 2.435, "D_return_pct": 31.19, "D_hit_rate": 60.61, "D_n": 66, "D_bh_sharpe": 0.5721, "D_bh_return_pct": 3.85, "D_psr": 0.9311, "D_ic": 0.118, "D_precision": 0.6286, "D_recall": 0.6286, "D_f1": 0.6286, "D_f2": 0.6286, "D_accuracy": 0.6061, "D_mcc": 0.2092, "D_tp": 22, "D_fp": 13, "D_tn": 18, "D_fn": 13, "sharpe": -0.3036, "sortino": -0.3012, "return_pct": -4.7, "equity": 953.0, "max_dd": 0.0, "win_rate": 50.0, "profit_factor": 0.0, "ic": 0.0474, "hit": 50.0, "psr": 0.4388, "bh_sharpe": 0.5721, "bh_return_pct": 3.85, "excess_sharpe": -0.8757, "precision": 0.5278, "recall": 0.5429, "f1": 0.5352, "f2": 0.5398, "mcc": -0.0055, "accuracy": 0.5, "tp": 19, "fp": 17, "tn": 14, "fn": 16}, {"fold": "fold_2", "regime": "2011 US-downgrade + EU debt", "n": 87, "A_sharpe": 5.0801, "A_sortino": 6.9, "A_excess_sharpe": 0.0581, "A_return_pct": 29.58, "A_hit_rate": 60.47, "A_n": 87, "A_bh_sharpe": 5.022, "A_bh_return_pct": 29.23, "A_psr": 0.9996, "A_ic": 0.1641, "A_precision": 0.6389, "A_recall": 0.8519, "A_f1": 0.7302, "A_f2": 0.7986, "A_accuracy": 0.6092, "A_mcc": 0.0822, "A_tp": 46, "A_fp": 26, "A_tn": 7, "A_fn": 8, "B_sharpe": 7.2979, "B_sortino": 7.4943, "B_excess_sharpe": -3.839, "B_return_pct": 113.26, "B_hit_rate": 72.41, "B_n": 87, "B_bh_sharpe": 11.1369, "B_bh_return_pct": 185.4, "B_psr": 1.0, "B_ic": 0.1803, "B_precision": 0.8378, "B_recall": 0.8378, "B_f1": 0.8378, "B_f2": 0.8378, "B_accuracy": 0.7241, "B_mcc": -0.0852, "B_tp": 62, "B_fp": 12, "B_tn": 1, "B_fn": 12, "D_sharpe": 5.2009, "D_sortino": 6.7051, "D_excess_sharpe": 0.1789, "D_return_pct": 30.32, "D_hit_rate": 63.95, "D_n": 87, "D_bh_sharpe": 5.022, "D_bh_return_pct": 29.23, "D_psr": 0.9997, "D_ic": 0.0636, "D_precision": 0.6486, "D_recall": 0.8889, "D_f1": 0.75, "D_f2": 0.8276, "D_accuracy": 0.6322, "D_mcc": 0.1375, "D_tp": 48, "D_fp": 26, "D_tn": 7, "D_fn": 6, "sharpe": 5.0801, "sortino": 6.9, "return_pct": 29.58, "equity": 1295.8, "max_dd": 0.0, "win_rate": 60.47, "profit_factor": 0.0, "ic": 0.1641, "hit": 60.47, "psr": 0.9996, "bh_sharpe": 5.022, "bh_return_pct": 29.23, "excess_sharpe": 0.0581, "precision": 0.6389, "recall": 0.8519, "f1": 0.7302, "f2": 0.7986, "mcc": 0.0822, "accuracy": 0.6092, "tp": 46, "fp": 26, "tn": 7, "fn": 8}, {"fold": "fold_3", "regime": "Taper tantrum and 2014 H1", "n": 129, "A_sharpe": 1.834, "A_sortino": 1.5458, "A_excess_sharpe": 0.0662, "A_return_pct": 12.24, "A_hit_rate": 60.16, "A_n": 129, "A_bh_sharpe": 1.7678, "A_bh_return_pct": 11.76, "A_psr": 0.89, "A_ic": 0.0473, "A_precision": 0.6032, "A_recall": 0.9744, "A_f1": 0.7451, "A_f2": 0.8676, "A_accuracy": 0.5969, "A_mcc": -0.0196, "A_tp": 76, "A_fp": 50, "A_tn": 1, "A_fn": 2, "B_sharpe": 4.5027, "B_sortino": 4.5661, "B_excess_sharpe": 0.2553, "B_return_pct": 68.84, "B_hit_rate": 63.57, "B_n": 129, "B_bh_sharpe": 4.2474, "B_bh_return_pct": 64.1, "B_psr": 0.9989, "B_ic": -0.0241, "B_precision": 0.6446, "B_recall": 0.9512, "B_f1": 0.7685, "B_f2": 0.8686, "B_accuracy": 0.6357, "B_mcc": 0.0725, "B_tp": 78, "B_fp": 43, "B_tn": 4, "B_fn": 4, "D_sharpe": 2.4193, "D_sortino": 2.0704, "D_excess_sharpe": 0.6515, "D_return_pct": 16.52, "D_hit_rate": 62.5, "D_n": 129, "D_bh_sharpe": 1.7678, "D_bh_return_pct": 11.76, "D_psr": 0.9456, "D_ic": 0.0559, "D_precision": 0.6198, "D_recall": 0.9615, "D_f1": 0.7538, "D_f2": 0.8661, "D_accuracy": 0.6202, "D_mcc": 0.1208, "D_tp": 75, "D_fp": 46, "D_tn": 5, "D_fn": 3, "sharpe": 1.834, "sortino": 1.5458, "return_pct": 12.24, "equity": 1122.4, "max_dd": 0.0, "win_rate": 60.16, "profit_factor": 0.0, "ic": 0.0473, "hit": 60.16, "psr": 0.89, "bh_sharpe": 1.7678, "bh_return_pct": 11.76, "excess_sharpe": 0.0662, "precision": 0.6032, "recall": 0.9744, "f1": 0.7451, "f2": 0.8676, "mcc": -0.0196, "accuracy": 0.5969, "tp": 76, "fp": 50, "tn": 1, "fn": 2}, {"fold": "fold_4", "regime": "China devaluation and oil crash", "n": 108, "A_sharpe": -1.8693, "A_sortino": -1.6746, "A_excess_sharpe": -1.1796, "A_return_pct": -15.78, "A_hit_rate": 46.73, "A_n": 108, "A_bh_sharpe": -0.6898, "A_bh_return_pct": -6.71, "A_psr": 0.1061, "A_ic": 0.0015, "A_precision": 0.4677, "A_recall": 0.5472, "A_f1": 0.5043, "A_f2": 0.5292, "A_accuracy": 0.4722, "A_mcc": -0.0534, "A_tp": 29, "A_fp": 33, "A_tn": 22, "A_fn": 24, "B_sharpe": -2.4958, "B_sortino": -2.2023, "B_excess_sharpe": -0.5383, "B_return_pct": -39.8, "B_hit_rate": 45.37, "B_n": 108, "B_bh_sharpe": -1.9575, "B_bh_return_pct": -33.56, "B_psr": 0.0463, "B_ic": -0.1351, "B_precision": 0.4412, "B_recall": 0.5882, "B_f1": 0.5042, "B_f2": 0.5515, "B_accuracy": 0.4537, "B_mcc": -0.0811, "B_tp": 30, "B_fp": 38, "B_tn": 19, "B_fn": 21, "D_sharpe": -1.8805, "D_sortino": -1.7049, "D_excess_sharpe": -1.1907, "D_return_pct": -15.87, "D_hit_rate": 45.79, "D_n": 108, "D_bh_sharpe": -0.6898, "D_bh_return_pct": -6.71, "D_psr": 0.105, "D_ic": -0.0406, "D_precision": 0.4559, "D_recall": 0.5849, "D_f1": 0.5124, "D_f2": 0.5536, "D_accuracy": 0.4537, "D_mcc": -0.0909, "D_tp": 31, "D_fp": 37, "D_tn": 18, "D_fn": 22, "sharpe": -1.8693, "sortino": -1.6746, "return_pct": -15.78, "equity": 842.2, "max_dd": 0.0, "win_rate": 46.73, "profit_factor": 0.0, "ic": 0.0015, "hit": 46.73, "psr": 0.1061, "bh_sharpe": -0.6898, "bh_return_pct": -6.71, "excess_sharpe": -1.1796, "precision": 0.4677, "recall": 0.5472, "f1": 0.5043, "f2": 0.5292, "mcc": -0.0534, "accuracy": 0.4722, "tp": 29, "fp": 33, "tn": 22, "fn": 24}, {"fold": "fold_5", "regime": "2018 Vol-mageddon + Q4 sell-off", "n": 128, "A_sharpe": -1.2269, "A_sortino": -1.1964, "A_excess_sharpe": -2.378, "A_return_pct": -14.9, "A_hit_rate": 48.44, "A_n": 128, "A_bh_sharpe": 1.1511, "A_bh_return_pct": 13.19, "A_psr": 0.1956, "A_ic": -0.1308, "A_precision": 0.5732, "A_recall": 0.6026, "A_f1": 0.5875, "A_f2": 0.5964, "A_accuracy": 0.4844, "A_mcc": -0.0991, "A_tp": 47, "A_fp": 35, "A_tn": 15, "A_fn": 31, "B_sharpe": -3.3, "B_sortino": -3.0717, "B_excess_sharpe": -6.1119, "B_return_pct": -56.01, "B_hit_rate": 40.16, "B_n": 128, "B_bh_sharpe": 2.8119, "B_bh_return_pct": 82.25, "B_psr": 0.0092, "B_ic": -0.1352, "B_precision": 0.5738, "B_recall": 0.4118, "B_f1": 0.4795, "B_f2": 0.4364, "B_accuracy": 0.4062, "B_mcc": -0.1824, "B_tp": 35, "B_fp": 26, "B_tn": 17, "B_fn": 50, "D_sharpe": -1.9513, "D_sortino": -1.9584, "D_excess_sharpe": -3.1024, "D_return_pct": -21.89, "D_hit_rate": 44.53, "D_n": 128, "D_bh_sharpe": 1.1511, "D_bh_return_pct": 13.19, "D_psr": 0.0907, "D_ic": -0.1063, "D_precision": 0.5574, "D_recall": 0.4359, "D_f1": 0.4892, "D_f2": 0.4558, "D_accuracy": 0.4453, "D_mcc": -0.1017, "D_tp": 34, "D_fp": 27, "D_tn": 23, "D_fn": 44, "sharpe": -1.2269, "sortino": -1.1964, "return_pct": -14.9, "equity": 851.0, "max_dd": 0.0, "win_rate": 48.44, "profit_factor": 0.0, "ic": -0.1308, "hit": 48.44, "psr": 0.1956, "bh_sharpe": 1.1511, "bh_return_pct": 13.19, "excess_sharpe": -2.378, "precision": 0.5732, "recall": 0.6026, "f1": 0.5875, "f2": 0.5964, "mcc": -0.0991, "accuracy": 0.4844, "tp": 47, "fp": 35, "tn": 15, "fn": 31}, {"fold": "fold_6", "regime": "COVID crash and V-recovery", "n": 173, "A_sharpe": 1.7949, "A_sortino": 2.028, "A_excess_sharpe": -0.5312, "A_return_pct": 31.94, "A_hit_rate": 52.6, "A_n": 173, "A_bh_sharpe": 2.3261, "A_bh_return_pct": 43.81, "A_psr": 0.9343, "A_ic": 0.0927, "A_precision": 0.7013, "A_recall": 0.4779, "A_f1": 0.5684, "A_f2": 0.5104, "A_accuracy": 0.526, "A_mcc": 0.0905, "A_tp": 54, "A_fp": 23, "A_tn": 37, "A_fn": 59, "B_sharpe": 1.433, "B_sortino": 1.5863, "B_excess_sharpe": -4.3131, "B_return_pct": 50.53, "B_hit_rate": 52.33, "B_n": 173, "B_bh_sharpe": 5.746, "B_bh_return_pct": 499.04, "B_psr": 0.8857, "B_ic": 0.0907, "B_precision": 0.6986, "B_recall": 0.4595, "B_f1": 0.5543, "B_f2": 0.4932, "B_accuracy": 0.526, "B_mcc": 0.1016, "B_tp": 51, "B_fp": 22, "B_tn": 40, "B_fn": 60, "D_sharpe": 0.5432, "D_sortino": 0.6274, "D_excess_sharpe": -1.7828, "D_return_pct": 7.29, "D_hit_rate": 45.66, "D_n": 173, "D_bh_sharpe": 2.3261, "D_bh_return_pct": 43.81, "D_psr": 0.6744, "D_ic": -0.0082, "D_precision": 0.6301, "D_recall": 0.4071, "D_f1": 0.4946, "D_f2": 0.4381, "D_accuracy": 0.4566, "D_mcc": -0.0414, "D_tp": 46, "D_fp": 27, "D_tn": 33, "D_fn": 67, "sharpe": 1.7949, "sortino": 2.028, "return_pct": 31.94, "equity": 1319.3999999999999, "max_dd": 0.0, "win_rate": 52.6, "profit_factor": 0.0, "ic": 0.0927, "hit": 52.6, "psr": 0.9343, "bh_sharpe": 2.3261, "bh_return_pct": 43.81, "excess_sharpe": -0.5312, "precision": 0.7013, "recall": 0.4779, "f1": 0.5684, "f2": 0.5104, "mcc": 0.0905, "accuracy": 0.526, "tp": 54, "fp": 23, "tn": 37, "fn": 59}, {"fold": "fold_7", "regime": "Inflation bear, AI rally and 2025", "n": 376, "A_sharpe": -0.3517, "A_sortino": -0.4127, "A_excess_sharpe": -1.155, "A_return_pct": -14.35, "A_hit_rate": 43.62, "A_n": 376, "A_bh_sharpe": 0.8033, "A_bh_return_pct": 26.02, "A_psr": 0.3365, "A_ic": 0.0178, "A_precision": 0.5789, "A_recall": 0.1493, "A_f1": 0.2374, "A_f2": 0.1753, "A_accuracy": 0.4362, "A_mcc": -0.0076, "A_tp": 33, "A_fp": 24, "A_tn": 131, "A_fn": 188, "B_sharpe": -0.9204, "B_sortino": -1.0374, "B_excess_sharpe": -2.8521, "B_return_pct": -55.0, "B_hit_rate": 40.8, "B_n": 376, "B_bh_sharpe": 1.9317, "B_bh_return_pct": 222.05, "B_psr": 0.1352, "B_ic": -0.0369, "B_precision": 0.8571, "B_recall": 0.0264, "B_f1": 0.0513, "B_f2": 0.0328, "B_accuracy": 0.4096, "B_mcc": 0.0714, "B_tp": 6, "B_fp": 1, "B_tn": 148, "B_fn": 221, "D_sharpe": -0.3074, "D_sortino": -0.3949, "D_excess_sharpe": -1.1107, "D_return_pct": -13.05, "D_hit_rate": 41.49, "D_n": 376, "D_bh_sharpe": 0.8033, "D_bh_return_pct": 26.02, "D_psr": 0.3565, "D_ic": -0.0173, "D_precision": 0.5714, "D_recall": 0.0181, "D_f1": 0.0351, "D_f2": 0.0224, "D_accuracy": 0.4149, "D_mcc": -0.0046, "D_tp": 4, "D_fp": 3, "D_tn": 152, "D_fn": 217, "sharpe": -0.3517, "sortino": -0.4127, "return_pct": -14.35, "equity": 856.5, "max_dd": 0.0, "win_rate": 43.62, "profit_factor": 0.0, "ic": 0.0178, "hit": 43.62, "psr": 0.3365, "bh_sharpe": 0.8033, "bh_return_pct": 26.02, "excess_sharpe": -1.155, "precision": 0.5789, "recall": 0.1493, "f1": 0.2374, "f2": 0.1753, "mcc": -0.0076, "accuracy": 0.4362, "tp": 33, "fp": 24, "tn": 131, "fn": 188}], "per_window_val": [{"fold": "fold_1", "regime": "GFC peak crash (Lehman + Mar-2009 bottom)", "n": 65, "A_sharpe": -1.3763, "A_sortino": -1.1421, "A_excess_sharpe": 0.8494, "A_return_pct": -12.61, "A_hit_rate": 52.38, "A_n": 65, "A_bh_sharpe": -2.2257, "A_bh_return_pct": -18.74, "A_psr": 0.236, "A_ic": -0.0022, "A_precision": 0.4746, "A_recall": 0.9655, "A_f1": 0.6364, "A_f2": 0.8, "A_accuracy": 0.5077, "A_mcc": 0.1793, "A_tp": 28, "A_fp": 31, "A_tn": 5, "A_fn": 1, "B_sharpe": -0.3191, "B_sortino": -0.3679, "B_excess_sharpe": 6.8032, "B_return_pct": -12.12, "B_hit_rate": 47.69, "B_n": 65, "B_bh_sharpe": -7.1223, "B_bh_return_pct": -73.11, "B_psr": 0.4368, "B_ic": 0.4372, "B_precision": 0.4035, "B_recall": 1.0, "B_f1": 0.575, "B_f2": 0.7718, "B_accuracy": 0.4769, "B_mcc": 0.2772, "B_tp": 23, "B_fp": 34, "B_tn": 8, "B_fn": 0, "D_sharpe": 2.194, "D_sortino": 2.1612, "D_excess_sharpe": 4.4197, "D_return_pct": 19.14, "D_hit_rate": 58.73, "D_n": 65, "D_bh_sharpe": -2.2257, "D_bh_return_pct": -18.74, "D_psr": 0.8676, "D_ic": 0.2981, "D_precision": 0.5088, "D_recall": 1.0, "D_f1": 0.6744, "D_f2": 0.8382, "D_accuracy": 0.5692, "D_mcc": 0.3362, "D_tp": 29, "D_fp": 28, "D_tn": 8, "D_fn": 0, "sharpe": -1.3763, "sortino": -1.1421, "return_pct": -12.61, "equity": 873.9, "max_dd": 0.0, "win_rate": 52.38, "profit_factor": 0.0, "ic": -0.0022, "hit": 52.38, "psr": 0.236, "bh_sharpe": -2.2257, "bh_return_pct": -18.74, "excess_sharpe": 0.8494, "precision": 0.4746, "recall": 0.9655, "f1": 0.6364, "f2": 0.8, "mcc": 0.1793, "accuracy": 0.5077, "tp": 28, "fp": 31, "tn": 5, "fn": 1}, {"fold": "fold_2", "regime": "2011 US-downgrade + EU debt", "n": 47, "A_sharpe": 1.7085, "A_sortino": 1.5831, "A_excess_sharpe": 1.9026, "A_return_pct": 10.38, "A_hit_rate": 59.57, "A_n": 47, "A_bh_sharpe": -0.1941, "A_bh_return_pct": -2.36, "A_psr": 0.7628, "A_ic": 0.2033, "A_precision": 0.5814, "A_recall": 0.9615, "A_f1": 0.7246, "A_f2": 0.8503, "A_accuracy": 0.5957, "A_mcc": 0.186, "A_tp": 25, "A_fp": 18, "A_tn": 3, "A_fn": 1, "B_sharpe": 0.293, "B_sortino": 0.2668, "B_excess_sharpe": 1.9053, "B_return_pct": -1.25, "B_hit_rate": 53.19, "B_n": 47, "B_bh_sharpe": -1.6123, "B_bh_return_pct": -24.3, "B_psr": 0.5495, "B_ic": 0.2974, "B_precision": 0.4884, "B_recall": 1.0, "B_f1": 0.6562, "B_f2": 0.8268, "B_accuracy": 0.5319, "B_mcc": 0.2741, "B_tp": 21, "B_fp": 22, "B_tn": 4, "B_fn": 0, "D_sharpe": 1.7672, "D_sortino": 1.63, "D_excess_sharpe": 1.9612, "D_return_pct": 10.79, "D_hit_rate": 59.57, "D_n": 47, "D_bh_sharpe": -0.1941, "D_bh_return_pct": -2.36, "D_psr": 0.7699, "D_ic": 0.1096, "D_precision": 0.5814, "D_recall": 0.9615, "D_f1": 0.7246, "D_f2": 0.8503, "D_accuracy": 0.5957, "D_mcc": 0.186, "D_tp": 25, "D_fp": 18, "D_tn": 3, "D_fn": 1, "sharpe": 1.7085, "sortino": 1.5831, "return_pct": 10.38, "equity": 1103.8000000000002, "max_dd": 0.0, "win_rate": 59.57, "profit_factor": 0.0, "ic": 0.2033, "hit": 59.57, "psr": 0.7628, "bh_sharpe": -0.1941, "bh_return_pct": -2.36, "excess_sharpe": 1.9026, "precision": 0.5814, "recall": 0.9615, "f1": 0.7246, "f2": 0.8503, "mcc": 0.186, "accuracy": 0.5957, "tp": 25, "fp": 18, "tn": 3, "fn": 1}, {"fold": "fold_3", "regime": "Taper tantrum and 2014 H1", "n": 5, "A_sharpe": -7.0052, "A_sortino": -5.3515, "A_excess_sharpe": -5.6858, "A_return_pct": -1.01, "A_hit_rate": 40.0, "A_n": 5, "A_bh_sharpe": -1.3194, "A_bh_return_pct": -0.21, "A_psr": 0.1708, "A_ic": -0.5, "A_precision": 0.3333, "A_recall": 0.5, "A_f1": 0.4, "A_f2": 0.4545, "A_accuracy": 0.4, "A_mcc": -0.1667, "A_tp": 1, "A_fp": 2, "A_tn": 1, "A_fn": 1, "B_sharpe": -18.6944, "B_sortino": -10.8783, "B_excess_sharpe": 7.1762, "B_return_pct": -3.45, "B_hit_rate": 20.0, "B_n": 5, "B_bh_sharpe": -25.8705, "B_bh_return_pct": -3.84, "B_psr": 0.0009, "B_ic": -0.2, "B_precision": 0.0, "B_recall": 0.0, "B_f1": 0.0, "B_f2": 0.0, "B_accuracy": 0.2, "B_mcc": 0.0, "B_tp": 0, "B_fp": 4, "B_tn": 1, "B_fn": 0, "D_sharpe": -5.9118, "D_sortino": -6.1066, "D_excess_sharpe": -4.5924, "D_return_pct": -0.87, "D_hit_rate": 20.0, "D_n": 5, "D_bh_sharpe": -1.3194, "D_bh_return_pct": -0.21, "D_psr": 0.241, "D_ic": -0.3, "D_precision": 0.25, "D_recall": 0.5, "D_f1": 0.3333, "D_f2": 0.4167, "D_accuracy": 0.2, "D_mcc": -0.6124, "D_tp": 1, "D_fp": 3, "D_tn": 0, "D_fn": 1, "sharpe": -7.0052, "sortino": -5.3515, "return_pct": -1.01, "equity": 989.9, "max_dd": 0.0, "win_rate": 40.0, "profit_factor": 0.0, "ic": -0.5, "hit": 40.0, "psr": 0.1708, "bh_sharpe": -1.3194, "bh_return_pct": -0.21, "excess_sharpe": -5.6858, "precision": 0.3333, "recall": 0.5, "f1": 0.4, "f2": 0.4545, "mcc": -0.1667, "accuracy": 0.4, "tp": 1, "fp": 2, "tn": 1, "fn": 1}, {"fold": "fold_4", "regime": "China devaluation and oil crash", "n": 47, "A_sharpe": -2.1863, "A_sortino": -2.0797, "A_excess_sharpe": -0.3625, "A_return_pct": -10.18, "A_hit_rate": 42.55, "A_n": 47, "A_bh_sharpe": -1.8238, "A_bh_return_pct": -8.68, "A_psr": 0.1755, "A_ic": 0.0345, "A_precision": 0.4348, "A_recall": 0.9524, "A_f1": 0.597, "A_f2": 0.7692, "A_accuracy": 0.4255, "A_mcc": -0.1641, "A_tp": 20, "A_fp": 26, "A_tn": 0, "A_fn": 1, "B_sharpe": -2.3514, "B_sortino": -2.0531, "B_excess_sharpe": -0.1314, "B_return_pct": -25.04, "B_hit_rate": 42.55, "B_n": 47, "B_bh_sharpe": -2.22, "B_bh_return_pct": -23.98, "B_psr": 0.1358, "B_ic": 0.5146, "B_precision": 0.4348, "B_recall": 0.9524, "B_f1": 0.597, "B_f2": 0.7692, "B_accuracy": 0.4255, "B_mcc": -0.1641, "B_tp": 20, "B_fp": 26, "B_tn": 0, "B_fn": 1, "D_sharpe": -0.4563, "D_sortino": -0.4562, "D_excess_sharpe": 1.3675, "D_return_pct": -2.69, "D_hit_rate": 46.81, "D_n": 47, "D_bh_sharpe": -1.8238, "D_bh_return_pct": -8.68, "D_psr": 0.4227, "D_ic": 0.18, "D_precision": 0.4565, "D_recall": 1.0, "D_f1": 0.6269, "D_f2": 0.8077, "D_accuracy": 0.4681, "D_mcc": 0.1325, "D_tp": 21, "D_fp": 25, "D_tn": 1, "D_fn": 0, "sharpe": -2.1863, "sortino": -2.0797, "return_pct": -10.18, "equity": 898.2, "max_dd": 0.0, "win_rate": 42.55, "profit_factor": 0.0, "ic": 0.0345, "hit": 42.55, "psr": 0.1755, "bh_sharpe": -1.8238, "bh_return_pct": -8.68, "excess_sharpe": -0.3625, "precision": 0.4348, "recall": 0.9524, "f1": 0.597, "f2": 0.7692, "mcc": -0.1641, "accuracy": 0.4255, "tp": 20, "fp": 26, "tn": 0, "fn": 1}, {"fold": "fold_5", "regime": "2018 Vol-mageddon + Q4 sell-off", "n": 5, "A_sharpe": -10.1368, "A_sortino": -6.9937, "A_excess_sharpe": 0.0, "A_return_pct": -3.15, "A_hit_rate": 40.0, "A_n": 5, "A_bh_sharpe": -10.1368, "A_bh_return_pct": -3.15, "A_psr": 0.0985, "A_ic": 0.8, "A_precision": 0.4, "A_recall": 1.0, "A_f1": 0.5714, "A_f2": 0.7692, "A_accuracy": 0.4, "A_mcc": 0.0, "A_tp": 2, "A_fp": 3, "A_tn": 0, "A_fn": 0, "B_sharpe": 5.6858, "B_sortino": 6.0578, "B_excess_sharpe": 0.0, "B_return_pct": 4.22, "B_hit_rate": 60.0, "B_n": 5, "B_bh_sharpe": 5.6858, "B_bh_return_pct": 4.22, "B_psr": 0.753, "B_ic": 0.1, "B_precision": 0.6, "B_recall": 1.0, "B_f1": 0.75, "B_f2": 0.8824, "B_accuracy": 0.6, "B_mcc": 0.0, "B_tp": 3, "B_fp": 2, "B_tn": 0, "B_fn": 0, "D_sharpe": -10.1368, "D_sortino": -6.9937, "D_excess_sharpe": 0.0, "D_return_pct": -3.15, "D_hit_rate": 40.0, "D_n": 5, "D_bh_sharpe": -10.1368, "D_bh_return_pct": -3.15, "D_psr": 0.0985, "D_ic": 0.0, "D_precision": 0.4, "D_recall": 1.0, "D_f1": 0.5714, "D_f2": 0.7692, "D_accuracy": 0.4, "D_mcc": 0.0, "D_tp": 2, "D_fp": 3, "D_tn": 0, "D_fn": 0, "sharpe": -10.1368, "sortino": -6.9937, "return_pct": -3.15, "equity": 968.5, "max_dd": 0.0, "win_rate": 40.0, "profit_factor": 0.0, "ic": 0.8, "hit": 40.0, "psr": 0.0985, "bh_sharpe": -10.1368, "bh_return_pct": -3.15, "excess_sharpe": 0.0, "precision": 0.4, "recall": 1.0, "f1": 0.5714, "f2": 0.7692, "mcc": 0.0, "accuracy": 0.4, "tp": 2, "fp": 3, "tn": 0, "fn": 0}, {"fold": "fold_6", "regime": "COVID crash and V-recovery", "n": 26, "A_sharpe": 5.899, "A_sortino": 7.219, "A_excess_sharpe": 2.6138, "A_return_pct": 8.52, "A_hit_rate": 61.54, "A_n": 26, "A_bh_sharpe": 3.2852, "A_bh_return_pct": 4.82, "A_psr": 0.9698, "A_ic": 0.1303, "A_precision": 0.625, "A_recall": 0.9375, "A_f1": 0.75, "A_f2": 0.8523, "A_accuracy": 0.6154, "A_mcc": 0.0685, "A_tp": 15, "A_fp": 9, "A_tn": 1, "A_fn": 1, "B_sharpe": 3.5864, "B_sortino": 3.7162, "B_excess_sharpe": -9.3928, "B_return_pct": 11.69, "B_hit_rate": 61.54, "B_n": 26, "B_bh_sharpe": 12.9792, "B_bh_return_pct": 38.76, "B_psr": 0.8708, "B_ic": 0.4585, "B_precision": 1.0, "B_recall": 0.5238, "B_f1": 0.6875, "B_f2": 0.5789, "B_accuracy": 0.6154, "B_mcc": 0.4179, "B_tp": 11, "B_fp": 0, "B_tn": 5, "B_fn": 10, "D_sharpe": -0.0933, "D_sortino": -0.1062, "D_excess_sharpe": -3.3785, "D_return_pct": -0.25, "D_hit_rate": 42.31, "D_n": 26, "D_bh_sharpe": 3.2852, "D_bh_return_pct": 4.82, "D_psr": 0.4883, "D_ic": 0.1262, "D_precision": 0.5455, "D_recall": 0.375, "D_f1": 0.4444, "D_f2": 0.4, "D_accuracy": 0.4231, "D_mcc": -0.1231, "D_tp": 6, "D_fp": 5, "D_tn": 5, "D_fn": 10, "sharpe": 5.899, "sortino": 7.219, "return_pct": 8.52, "equity": 1085.2, "max_dd": 0.0, "win_rate": 61.54, "profit_factor": 0.0, "ic": 0.1303, "hit": 61.54, "psr": 0.9698, "bh_sharpe": 3.2852, "bh_return_pct": 4.82, "excess_sharpe": 2.6138, "precision": 0.625, "recall": 0.9375, "f1": 0.75, "f2": 0.8523, "mcc": 0.0685, "accuracy": 0.6154, "tp": 15, "fp": 9, "tn": 1, "fn": 1}, {"fold": "fold_7", "regime": "Inflation bear, AI rally and 2025", "n": 65, "A_sharpe": -1.3209, "A_sortino": -1.1938, "A_excess_sharpe": -3.3998, "A_return_pct": -5.36, "A_hit_rate": 49.23, "A_n": 65, "A_bh_sharpe": 2.0789, "A_bh_return_pct": 8.17, "A_psr": 0.2498, "A_ic": 0.2348, "A_precision": 0.5833, "A_recall": 0.2, "A_f1": 0.2979, "A_f2": 0.2303, "A_accuracy": 0.4923, "A_mcc": 0.0428, "A_tp": 7, "A_fp": 5, "A_tn": 25, "A_fn": 28, "B_sharpe": -5.2314, "B_sortino": -4.8393, "B_excess_sharpe": -10.4628, "B_return_pct": -32.36, "B_hit_rate": 32.31, "B_n": 65, "B_bh_sharpe": 5.2314, "B_bh_return_pct": 44.53, "B_psr": 0.0054, "B_ic": -0.0115, "B_precisi