{"experiment_num": 89, "backbone": "lightgbm", "description": "LightGBM @ exp 10 CHAMP seed=7 - 3rd seed for stable median (seeds 42,0 done)", "config": {"seq_len": 60, "lr": 0.0003, "batch_size": 32, "epochs": 50, "weight_decay": 1e-05, "patience": 10, "warmup_epochs": 0, "head_dropout": 0.1, "huber_delta": 1.0, "grad_clip": 1.0, "seed": 7, "hidden_size": null, "num_layers": null, "max_depth": 4, "gbm_lr": 0.01, "n_estimators": 1000}, "composite": 0.0925, "test_pos_folds": 5, "val_pos_folds": 4, "val_loss": null, "elapsed_sec": 232.7, "timestamp": "2026-04-27T23:34:07", "sharpe": 0.5311, "val_sharpe": 0.2925, "ic": 0.0418, "hit": 47.27, "psr": 0.8654, "equity": 1492.1, "return_pct": 49.21, "bh_sharpe": 1.2194, "bh_return_pct": 187.05, "excess_sharpe": -0.6883, "B_sharpe": -0.2843, "B_excess_sharpe": -3.1125, "B_return_pct": -63.8, "D_sharpe": 0.0968, "D_excess_sharpe": -1.1226, "D_return_pct": -1.47, "precision": 0.5742, "recall": 0.4288, "f1": 0.4909, "f2": 0.4517, "mcc": -0.0329, "accuracy": 0.4733, "val_precision": 0.5357, "val_recall": 0.687, "val_f1": 0.602, "val_f2": 0.6503, "val_mcc": 0.0861, "val_accuracy": 0.5423, "per_window": [{"fold": "fold_1", "regime": "GFC peak crash (Lehman + Mar-2009 bottom)", "n": 66, "A_sharpe": 0.808, "A_sortino": 0.8924, "A_excess_sharpe": 0.2359, "A_return_pct": 6.27, "A_hit_rate": 45.45, "A_n": 66, "A_bh_sharpe": 0.5721, "A_bh_return_pct": 3.85, "A_psr": 0.6593, "A_ic": 0.1634, "A_precision": 0.4857, "A_recall": 0.4857, "A_f1": 0.4857, "A_f2": 0.4857, "A_accuracy": 0.4545, "A_mcc": -0.0949, "A_tp": 17, "A_fp": 18, "A_tn": 13, "A_fn": 18, "B_sharpe": 2.4699, "B_sortino": 2.7562, "B_excess_sharpe": 0.423, "B_return_pct": 51.26, "B_hit_rate": 53.85, "B_n": 66, "B_bh_sharpe": 2.0469, "B_bh_return_pct": 39.28, "B_psr": 0.8968, "B_ic": 0.2815, "B_precision": 0.6087, "B_recall": 0.3889, "B_f1": 0.4746, "B_f2": 0.4192, "B_accuracy": 0.5303, "B_mcc": 0.0929, "B_tp": 14, "B_fp": 9, "B_tn": 21, "B_fn": 22, "D_sharpe": 1.8216, "D_sortino": 1.7674, "D_excess_sharpe": 1.2494, "D_return_pct": 17.25, "D_hit_rate": 57.58, "D_n": 66, "D_bh_sharpe": 0.5721, "D_bh_return_pct": 3.85, "D_psr": 0.8197, "D_ic": 0.238, "D_precision": 0.6522, "D_recall": 0.4286, "D_f1": 0.5172, "D_f2": 0.4601, "D_accuracy": 0.5758, "D_mcc": 0.1786, "D_tp": 15, "D_fp": 8, "D_tn": 23, "D_fn": 20, "sharpe": 0.808, "sortino": 0.8924, "return_pct": 6.27, "equity": 1062.7, "max_dd": 0.0, "win_rate": 45.45, "profit_factor": 0.0, "ic": 0.1634, "hit": 45.45, "psr": 0.6593, "bh_sharpe": 0.5721, "bh_return_pct": 3.85, "excess_sharpe": 0.2359, "precision": 0.4857, "recall": 0.4857, "f1": 0.4857, "f2": 0.4857, "mcc": -0.0949, "accuracy": 0.4545, "tp": 17, "fp": 18, "tn": 13, "fn": 18}, {"fold": "fold_2", "regime": "2011 US-downgrade + EU debt", "n": 87, "A_sharpe": 2.7903, "A_sortino": 3.274, "A_excess_sharpe": -2.2317, "A_return_pct": 15.65, "A_hit_rate": 58.14, "A_n": 87, "A_bh_sharpe": 5.022, "A_bh_return_pct": 29.23, "A_psr": 0.9599, "A_ic": 0.1776, "A_precision": 0.6552, "A_recall": 0.7037, "A_f1": 0.6786, "A_f2": 0.6934, "A_accuracy": 0.5862, "A_mcc": 0.1005, "A_tp": 38, "A_fp": 20, "A_tn": 13, "A_fn": 16, "B_sharpe": 4.8359, "B_sortino": 5.7172, "B_excess_sharpe": -6.301, "B_return_pct": 68.61, "B_hit_rate": 59.77, "B_n": 87, "B_bh_sharpe": 11.1369, "B_bh_return_pct": 185.4, "B_psr": 0.998, "B_ic": 0.2099, "B_precision": 0.8197, "B_recall": 0.6757, "B_f1": 0.7407, "B_f2": 0.7003, "B_accuracy": 0.5977, "B_mcc": -0.1328, "B_tp": 50, "B_fp": 11, "B_tn": 2, "B_fn": 24, "D_sharpe": 2.6633, "D_sortino": 3.0353, "D_excess_sharpe": -2.3587, "D_return_pct": 14.88, "D_hit_rate": 58.14, "D_n": 87, "D_bh_sharpe": 5.022, "D_bh_return_pct": 29.23, "D_psr": 0.951, "D_ic": 0.0585, "D_precision": 0.6393, "D_recall": 0.7222, "D_f1": 0.6783, "D_f2": 0.704, "D_accuracy": 0.5747, "D_mcc": 0.0589, "D_tp": 39, "D_fp": 22, "D_tn": 11, "D_fn": 15, "sharpe": 2.7903, "sortino": 3.274, "return_pct": 15.65, "equity": 1156.5, "max_dd": 0.0, "win_rate": 58.14, "profit_factor": 0.0, "ic": 0.1776, "hit": 58.14, "psr": 0.9599, "bh_sharpe": 5.022, "bh_return_pct": 29.23, "excess_sharpe": -2.2317, "precision": 0.6552, "recall": 0.7037, "f1": 0.6786, "f2": 0.6934, "mcc": 0.1005, "accuracy": 0.5862, "tp": 38, "fp": 20, "tn": 13, "fn": 16}, {"fold": "fold_3", "regime": "Taper tantrum and 2014 H1", "n": 129, "A_sharpe": 1.5234, "A_sortino": 1.7744, "A_excess_sharpe": -0.2444, "A_return_pct": 10.01, "A_hit_rate": 46.09, "A_n": 129, "A_bh_sharpe": 1.7678, "A_bh_return_pct": 11.76, "A_psr": 0.862, "A_ic": 0.0838, "A_precision": 0.5488, "A_recall": 0.5769, "A_f1": 0.5625, "A_f2": 0.5711, "A_accuracy": 0.4574, "A_mcc": -0.1509, "A_tp": 45, "A_fp": 37, "A_tn": 14, "A_fn": 33, "B_sharpe": 3.0215, "B_sortino": 3.1704, "B_excess_sharpe": -1.2259, "B_return_pct": 42.5, "B_hit_rate": 58.14, "B_n": 129, "B_bh_sharpe": 4.2474, "B_bh_return_pct": 64.1, "B_psr": 0.9832, "B_ic": 0.0298, "B_precision": 0.6489, "B_recall": 0.7439, "B_f1": 0.6932, "B_f2": 0.7227, "B_accuracy": 0.5814, "B_mcc": 0.0452, "B_tp": 61, "B_fp": 33, "B_tn": 14, "B_fn": 21, "D_sharpe": 1.9293, "D_sortino": 1.8875, "D_excess_sharpe": 0.1615, "D_return_pct": 12.93, "D_hit_rate": 54.69, "D_n": 129, "D_bh_sharpe": 1.7678, "D_bh_return_pct": 11.76, "D_psr": 0.9072, "D_ic": 0.1358, "D_precision": 0.6064, "D_recall": 0.7308, "D_f1": 0.6628, "D_f2": 0.702, "D_accuracy": 0.5504, "D_mcc": 0.0058, "D_tp": 57, "D_fp": 37, "D_tn": 14, "D_fn": 21, "sharpe": 1.5234, "sortino": 1.7744, "return_pct": 10.01, "equity": 1100.1000000000001, "max_dd": 0.0, "win_rate": 46.09, "profit_factor": 0.0, "ic": 0.0838, "hit": 46.09, "psr": 0.862, "bh_sharpe": 1.7678, "bh_return_pct": 11.76, "excess_sharpe": -0.2444, "precision": 0.5488, "recall": 0.5769, "f1": 0.5625, "f2": 0.5711, "mcc": -0.1509, "accuracy": 0.4574, "tp": 45, "fp": 37, "tn": 14, "fn": 33}, {"fold": "fold_4", "regime": "China devaluation and oil crash", "n": 108, "A_sharpe": 0.7494, "A_sortino": 0.7017, "A_excess_sharpe": 1.4392, "A_return_pct": 5.83, "A_hit_rate": 54.21, "A_n": 108, "A_bh_sharpe": -0.6898, "A_bh_return_pct": -6.71, "A_psr": 0.6857, "A_ic": 0.0834, "A_precision": 0.5345, "A_recall": 0.5849, "A_f1": 0.5586, "A_f2": 0.5741, "A_accuracy": 0.5463, "A_mcc": 0.0942, "A_tp": 31, "A_fp": 27, "A_tn": 28, "A_fn": 22, "B_sharpe": -2.6494, "B_sortino": -2.4338, "B_excess_sharpe": -0.6919, "B_return_pct": -41.45, "B_hit_rate": 42.59, "B_n": 108, "B_bh_sharpe": -1.9575, "B_bh_return_pct": -33.56, "B_psr": 0.0388, "B_ic": -0.1191, "B_precision": 0.3962, "B_recall": 0.4118, "B_f1": 0.4038, "B_f2": 0.4086, "B_accuracy": 0.4259, "B_mcc": -0.1494, "B_tp": 21, "B_fp": 32, "B_tn": 25, "B_fn": 30, "D_sharpe": -1.1463, "D_sortino": -1.0403, "D_excess_sharpe": -0.4565, "D_return_pct": -10.35, "D_hit_rate": 48.6, "D_n": 108, "D_bh_sharpe": -0.6898, "D_bh_return_pct": -6.71, "D_psr": 0.2241, "D_ic": -0.0176, "D_precision": 0.4717, "D_recall": 0.4717, "D_f1": 0.4717, "D_f2": 0.4717, "D_accuracy": 0.4815, "D_mcc": -0.0374, "D_tp": 25, "D_fp": 28, "D_tn": 27, "D_fn": 28, "sharpe": 0.7494, "sortino": 0.7017, "return_pct": 5.83, "equity": 1058.3, "max_dd": 0.0, "win_rate": 54.21, "profit_factor": 0.0, "ic": 0.0834, "hit": 54.21, "psr": 0.6857, "bh_sharpe": -0.6898, "bh_return_pct": -6.71, "excess_sharpe": 1.4392, "precision": 0.5345, "recall": 0.5849, "f1": 0.5586, "f2": 0.5741, "mcc": 0.0942, "accuracy": 0.5463, "tp": 31, "fp": 27, "tn": 28, "fn": 22}, {"fold": "fold_5", "regime": "2018 Vol-mageddon + Q4 sell-off", "n": 128, "A_sharpe": -1.021, "A_sortino": -1.0817, "A_excess_sharpe": -2.1721, "A_return_pct": -12.78, "A_hit_rate": 44.53, "A_n": 128, "A_bh_sharpe": 1.1511, "A_bh_return_pct": 13.19, "A_psr": 0.2385, "A_ic": -0.0125, "A_precision": 0.5636, "A_recall": 0.3974, "A_f1": 0.4662, "A_f2": 0.4223, "A_accuracy": 0.4453, "A_mcc": -0.0814, "A_tp": 31, "A_fp": 24, "A_tn": 26, "A_fn": 47, "B_sharpe": -3.4392, "B_sortino": -3.5531, "B_excess_sharpe": -6.2511, "B_return_pct": -57.33, "B_hit_rate": 32.28, "B_n": 128, "B_bh_sharpe": 2.8119, "B_bh_return_pct": 82.25, "B_psr": 0.0091, "B_ic": -0.0393, "B_precision": 0.4889, "B_recall": 0.2588, "B_f1": 0.3385, "B_f2": 0.2857, "B_accuracy": 0.3281, "B_mcc": -0.2731, "B_tp": 22, "B_fp": 23, "B_tn": 20, "B_fn": 63, "D_sharpe": -0.3565, "D_sortino": -0.422, "D_excess_sharpe": -1.5077, "D_return_pct": -5.54, "D_hit_rate": 42.97, "D_n": 128, "D_bh_sharpe": 1.1511, "D_bh_return_pct": 13.19, "D_psr": 0.4011, "D_ic": -0.0134, "D_precision": 0.5556, "D_recall": 0.3205, "D_f1": 0.4065, "D_f2": 0.3501, "D_accuracy": 0.4297, "D_mcc": -0.0812, "D_tp": 25, "D_fp": 20, "D_tn": 30, "D_fn": 53, "sharpe": -1.021, "sortino": -1.0817, "return_pct": -12.78, "equity": 872.1999999999999, "max_dd": 0.0, "win_rate": 44.53, "profit_factor": 0.0, "ic": -0.0125, "hit": 44.53, "psr": 0.2385, "bh_sharpe": 1.1511, "bh_return_pct": 13.19, "excess_sharpe": -2.1721, "precision": 0.5636, "recall": 0.3974, "f1": 0.4662, "f2": 0.4223, "mcc": -0.0814, "accuracy": 0.4453, "tp": 31, "fp": 24, "tn": 26, "fn": 47}, {"fold": "fold_6", "regime": "COVID crash and V-recovery", "n": 173, "A_sharpe": 1.9948, "A_sortino": 2.3763, "A_excess_sharpe": -0.3313, "A_return_pct": 36.32, "A_hit_rate": 50.87, "A_n": 173, "A_bh_sharpe": 2.3261, "A_bh_return_pct": 43.81, "A_psr": 0.9549, "A_ic": 0.0901, "A_precision": 0.6707, "A_recall": 0.4867, "A_f1": 0.5641, "A_f2": 0.515, "A_accuracy": 0.5087, "A_mcc": 0.035, "A_tp": 55, "A_fp": 27, "A_tn": 33, "A_fn": 58, "B_sharpe": -1.5616, "B_sortino": -1.6681, "B_excess_sharpe": -7.3076, "B_return_pct": -46.61, "B_hit_rate": 42.44, "B_n": 173, "B_bh_sharpe": 5.746, "B_bh_return_pct": 499.04, "B_psr": 0.105, "B_ic": 0.0573, "B_precision": 0.6071, "B_recall": 0.3063, "B_f1": 0.4072, "B_f2": 0.34, "B_accuracy": 0.4277, "B_mcc": -0.0497, "B_tp": 34, "B_fp": 22, "B_tn": 40, "B_fn": 77, "D_sharpe": -0.2583, "D_sortino": -0.2759, "D_excess_sharpe": -2.5843, "D_return_pct": -6.13, "D_hit_rate": 46.24, "D_n": 173, "D_bh_sharpe": 2.3261, "D_bh_return_pct": 43.81, "D_psr": 0.4157, "D_ic": 0.0137, "D_precision": 0.6786, "D_recall": 0.3363, "D_f1": 0.4497, "D_f2": 0.374, "D_accuracy": 0.4624, "D_mcc": 0.0369, "D_tp": 38, "D_fp": 18, "D_tn": 42, "D_fn": 75, "sharpe": 1.9948, "sortino": 2.3763, "return_pct": 36.32, "equity": 1363.2, "max_dd": 0.0, "win_rate": 50.87, "profit_factor": 0.0, "ic": 0.0901, "hit": 50.87, "psr": 0.9549, "bh_sharpe": 2.3261, "bh_return_pct": 43.81, "excess_sharpe": -0.3313, "precision": 0.6707, "recall": 0.4867, "f1": 0.5641, "f2": 0.515, "mcc": 0.035, "accuracy": 0.5087, "tp": 55, "fp": 27, "tn": 33, "fn": 58}, {"fold": "fold_7", "regime": "Inflation bear, AI rally and 2025", "n": 376, "A_sharpe": -0.281, "A_sortino": -0.3376, "A_excess_sharpe": -1.0843, "A_return_pct": -12.3, "A_hit_rate": 42.82, "A_n": 376, "A_bh_sharpe": 0.8033, "A_bh_return_pct": 26.02, "A_psr": 0.3677, "A_ic": -0.0097, "A_precision": 0.5294, "A_recall": 0.2443, "A_f1": 0.3344, "A_f2": 0.2738, "A_accuracy": 0.4282, "A_mcc": -0.0723, "A_tp": 54, "A_fp": 48, "A_tn": 107, "A_fn": 167, "B_sharpe": -0.1897, "B_sortino": -0.2123, "B_excess_sharpe": -2.1213, "B_return_pct": -25.32, "B_hit_rate": 44.8, "B_n": 376, "B_bh_sharpe": 1.9317, "B_bh_return_pct": 222.05, "B_psr": 0.4088, "B_ic": -0.0304, "B_precision": 0.75, "B_recall": 0.1322, "B_f1": 0.2247, "B_f2": 0.1582, "B_accuracy": 0.4495, "B_mcc": 0.1032, "B_tp": 30, "B_fp": 10, "B_tn": 139, "B_fn": 197, "D_sharpe": -0.501, "D_sortino": -0.5992, "D_excess_sharpe": -1.3043, "D_return_pct": -18.52, "D_hit_rate": 41.76, "D_n": 376, "D_bh_sharpe": 0.8033, "D_bh_return_pct": 26.02, "D_psr": 0.2756, "D_ic": -0.0209, "D_precision": 0.525, "D_recall": 0.095, "D_f1": 0.1609, "D_f2": 0.1136, "D_accuracy": 0.4176, "D_mcc": -0.044, "D_tp": 21, "D_fp": 19, "D_tn": 136, "D_fn": 200, "sharpe": -0.281, "sortino": -0.3376, "return_pct": -12.3, "equity": 877.0, "max_dd": 0.0, "win_rate": 42.82, "profit_factor": 0.0, "ic": -0.0097, "hit": 42.82, "psr": 0.3677, "bh_sharpe": 0.8033, "bh_return_pct": 26.02, "excess_sharpe": -1.0843, "precision": 0.5294, "recall": 0.2443, "f1": 0.3344, "f2": 0.2738, "mcc": -0.0723, "accuracy": 0.4282, "tp": 54, "fp": 48, "tn": 107, "fn": 167}], "per_window_val": [{"fold": "fold_1", "regime": "GFC peak crash (Lehman + Mar-2009 bottom)", "n": 65, "A_sharpe": -0.8838, "A_sortino": -0.73, "A_excess_sharpe": 1.3419, "A_return_pct": -8.8, "A_hit_rate": 52.38, "A_n": 65, "A_bh_sharpe": -2.2257, "A_bh_return_pct": -18.74, "A_psr": 0.323, "A_ic": 0.1319, "A_precision": 0.4828, "A_recall": 0.9655, "A_f1": 0.6437, "A_f2": 0.8046, "A_accuracy": 0.5231, "A_mcc": 0.212, "A_tp": 28, "A_fp": 30, "A_tn": 6, "A_fn": 1, "B_sharpe": -5.5303, "B_sortino": -4.6741, "B_excess_sharpe": 1.592, "B_return_pct": -65.66, "B_hit_rate": 36.92, "B_n": 65, "B_bh_sharpe": -7.1223, "B_bh_return_pct": -73.11, "B_psr": 0.0017, "B_ic": 0.1271, "B_precision": 0.3594, "B_recall": 1.0, "B_f1": 0.5287, "B_f2": 0.7372, "B_accuracy": 0.3692, "B_mcc": 0.0925, "B_tp": 23, "B_fp": 41, "B_tn": 1, "B_fn": 0, "D_sharpe": -1.9865, "D_sortino": -1.6684, "D_excess_sharpe": 0.2392, "D_return_pct": -17.07, "D_hit_rate": 47.62, "D_n": 65, "D_bh_sharpe": -2.2257, "D_bh_return_pct": -18.74, "D_psr": 0.1434, "D_ic": 0.3348, "D_precision": 0.4531, "D_recall": 1.0, "D_f1": 0.6237, "D_f2": 0.8056, "D_accuracy": 0.4615, "D_mcc": 0.1122, "D_tp": 29, "D_fp": 35, "D_tn": 1, "D_fn": 0, "sharpe": -0.8838, "sortino": -0.73, "return_pct": -8.8, "equity": 912.0, "max_dd": 0.0, "win_rate": 52.38, "profit_factor": 0.0, "ic": 0.1319, "hit": 52.38, "psr": 0.323, "bh_sharpe": -2.2257, "bh_return_pct": -18.74, "excess_sharpe": 1.3419, "precision": 0.4828, "recall": 0.9655, "f1": 0.6437, "f2": 0.8046, "mcc": 0.212, "accuracy": 0.5231, "tp": 28, "fp": 30, "tn": 6, "fn": 1}, {"fold": "fold_2", "regime": "2011 US-downgrade + EU debt", "n": 47, "A_sharpe": 1.9951, "A_sortino": 1.9142, "A_excess_sharpe": 2.1892, "A_return_pct": 12.4, "A_hit_rate": 57.45, "A_n": 47, "A_bh_sharpe": -0.1941, "A_bh_return_pct": -2.36, "A_psr": 0.7963, "A_ic": 0.1252, "A_precision": 0.5833, "A_recall": 0.8077, "A_f1": 0.6774, "A_f2": 0.75, "A_accuracy": 0.5745, "A_mcc": 0.1097, "A_tp": 21, "A_fp": 15, "A_tn": 6, "A_fn": 5, "B_sharpe": -1.0357, "B_sortino": -0.9314, "B_excess_sharpe": 0.5766, "B_return_pct": -18.0, "B_hit_rate": 48.94, "B_n": 47, "B_bh_sharpe": -1.6123, "B_bh_return_pct": -24.3, "B_psr": 0.3262, "B_ic": 0.1768, "B_precision": 0.4651, "B_recall": 0.9524, "B_f1": 0.625, "B_f2": 0.7874, "B_accuracy": 0.4894, "B_mcc": 0.1207, "B_tp": 20, "B_fp": 23, "B_tn": 3, "B_fn": 1, "D_sharpe": -1.0165, "D_sortino": -0.9022, "D_excess_sharpe": -0.8224, "D_return_pct": -7.42, "D_hit_rate": 51.06, "D_n": 47, "D_bh_sharpe": -0.1941, "D_bh_return_pct": -2.36, "D_psr": 0.3297, "D_ic": 0.0037, "D_precision": 0.5349, "D_recall": 0.8846, "D_f1": 0.6667, "D_f2": 0.7823, "D_accuracy": 0.5106, "D_mcc": -0.1207, "D_tp": 23, "D_fp": 20, "D_tn": 1, "D_fn": 3, "sharpe": 1.9951, "sortino": 1.9142, "return_pct": 12.4, "equity": 1124.0, "max_dd": 0.0, "win_rate": 57.45, "profit_factor": 0.0, "ic": 0.1252, "hit": 57.45, "psr": 0.7963, "bh_sharpe": -0.1941, "bh_return_pct": -2.36, "excess_sharpe": 2.1892, "precision": 0.5833, "recall": 0.8077, "f1": 0.6774, "f2": 0.75, "mcc": 0.1097, "accuracy": 0.5745, "tp": 21, "fp": 15, "tn": 6, "fn": 5}, {"fold": "fold_3", "regime": "Taper tantrum and 2014 H1", "n": 5, "A_sharpe": 5.9118, "A_sortino": 4.2395, "A_excess_sharpe": 7.2312, "A_return_pct": 0.0, "A_hit_rate": 0.0, "A_n": 5, "A_bh_sharpe": -1.3194, "A_bh_return_pct": -0.21, "A_psr": 0.759, "A_ic": 0.6, "A_precision": 1.0, "A_recall": 0.5, "A_f1": 0.6667, "A_f2": 0.5556, "A_accuracy": 0.8, "A_mcc": 0.6124, "A_tp": 1, "A_fp": 0, "A_tn": 3, "A_fn": 1, "B_sharpe": 25.8705, "B_sortino": 0.0, "B_excess_sharpe": 51.7411, "B_return_pct": 3.95, "B_hit_rate": 100.0, "B_n": 5, "B_bh_sharpe": -25.8705, "B_bh_return_pct": -3.84, "B_psr": 1.0, "B_ic": -0.2, "B_precision": 0.0, "B_recall": 0.0, "B_f1": 0.0, "B_f2": 0.0, "B_accuracy": 1.0, "B_mcc": 0.0, "B_tp": 0, "B_fp": 0, "B_tn": 5, "B_fn": 0, "D_sharpe": 1.3194, "D_sortino": 1.268, "D_excess_sharpe": 2.6388, "D_return_pct": 0.2, "D_hit_rate": 60.0, "D_n": 5, "D_bh_sharpe": -1.3194, "D_bh_return_pct": -0.21, "D_psr": 0.5663, "D_ic": -0.3, "D_precision": 0.0, "D_recall": 0.0, "D_f1": 0.0, "D_f2": 0.0, "D_accuracy": 0.6, "D_mcc": 0.0, "D_tp": 0, "D_fp": 0, "D_tn": 3, "D_fn": 2, "sharpe": 5.9118, "sortino": 4.2395, "return_pct": 0.0, "equity": 1000.0, "max_dd": 0.0, "win_rate": 0.0, "profit_factor": 0.0, "ic": 0.6, "hit": 0.0, "psr": 0.759, "bh_sharpe": -1.3194, "bh_return_pct": -0.21, "excess_sharpe": 7.2312, "precision": 1.0, "recall": 0.5, "f1": 0.6667, "f2": 0.5556, "mcc": 0.6124, "accuracy": 0.8, "tp": 1, "fp": 0, "tn": 3, "fn": 1}, {"fold": "fold_4", "regime": "China devaluation and oil crash", "n": 47, "A_sharpe": -2.7384, "A_sortino": -2.5816, "A_excess_sharpe": -0.9147, "A_return_pct": -12.39, "A_hit_rate": 40.43, "A_n": 47, "A_bh_sharpe": -1.8238, "A_bh_return_pct": -8.68, "A_psr": 0.1224, "A_ic": -0.0508, "A_precision": 0.4054, "A_recall": 0.7143, "A_f1": 0.5172, "A_f2": 0.6198, "A_accuracy": 0.4043, "A_mcc": -0.1602, "A_tp": 15, "A_fp": 22, "A_tn": 4, "A_fn": 6, "B_sharpe": -0.7234, "B_sortino": -0.6036, "B_excess_sharpe": 1.4966, "B_return_pct": -10.65, "B_hit_rate": 51.06, "B_n": 47, "B_bh_sharpe": -2.22, "B_bh_return_pct": -23.98, "B_psr": 0.3748, "B_ic": 0.4739, "B_precision": 0.4773, "B_recall": 1.0, "B_f1": 0.6462, "B_f2": 0.8203, "B_accuracy": 0.5106, "B_mcc": 0.2347, "B_tp": 21, "B_fp": 23, "B_tn": 3, "B_fn": 0, "D_sharpe": -1.4517, "D_sortino": -1.3531, "D_excess_sharpe": 0.3721, "D_return_pct": -7.1, "D_hit_rate": 46.81, "D_n": 47, "D_bh_sharpe": -1.8238, "D_bh_return_pct": -8.68, "D_psr": 0.2665, "D_ic": 0.1188, "D_precision": 0.4545, "D_recall": 0.9524, "D_f1": 0.6154, "D_f2": 0.7812, "D_accuracy": 0.4681, "D_mcc": 0.0596, "D_tp": 20, "D_fp": 24, "D_tn": 2, "D_fn": 1, "sharpe": -2.7384, "sortino": -2.5816, "return_pct": -12.39, "equity": 876.1, "max_dd": 0.0, "win_rate": 40.43, "profit_factor": 0.0, "ic": -0.0508, "hit": 40.43, "psr": 0.1224, "bh_sharpe": -1.8238, "bh_return_pct": -8.68, "excess_sharpe": -0.9147, "precision": 0.4054, "recall": 0.7143, "f1": 0.5172, "f2": 0.6198, "mcc": -0.1602, "accuracy": 0.4043, "tp": 15, "fp": 22, "tn": 4, "fn": 6}, {"fold": "fold_5", "regime": "2018 Vol-mageddon + Q4 sell-off", "n": 5, "A_sharpe": -10.1368, "A_sortino": -6.9937, "A_excess_sharpe": 0.0, "A_return_pct": -3.15, "A_hit_rate": 40.0, "A_n": 5, "A_bh_sharpe": -10.1368, "A_bh_return_pct": -3.15, "A_psr": 0.0985, "A_ic": 0.8, "A_precision": 0.4, "A_recall": 1.0, "A_f1": 0.5714, "A_f2": 0.7692, "A_accuracy": 0.4, "A_mcc": 0.0, "A_tp": 2, "A_fp": 3, "A_tn": 0, "A_fn": 0, "B_sharpe": 5.6858, "B_sortino": 6.0578, "B_excess_sharpe": 0.0, "B_return_pct": 4.22, "B_hit_rate": 60.0, "B_n": 5, "B_bh_sharpe": 5.6858, "B_bh_return_pct": 4.22, "B_psr": 0.753, "B_ic": 0.7, "B_precision": 0.6, "B_recall": 1.0, "B_f1": 0.75, "B_f2": 0.8824, "B_accuracy": 0.6, "B_mcc": 0.0, "B_tp": 3, "B_fp": 2, "B_tn": 0, "B_fn": 0, "D_sharpe": -10.1368, "D_sortino": -6.9937, "D_excess_sharpe": 0.0, "D_return_pct": -3.15, "D_hit_rate": 40.0, "D_n": 5, "D_bh_sharpe": -10.1368, "D_bh_return_pct": -3.15, "D_psr": 0.0985, "D_ic": 0.4, "D_precision": 0.4, "D_recall": 1.0, "D_f1": 0.5714, "D_f2": 0.7692, "D_accuracy": 0.4, "D_mcc": 0.0, "D_tp": 2, "D_fp": 3, "D_tn": 0, "D_fn": 0, "sharpe": -10.1368, "sortino": -6.9937, "return_pct": -3.15, "equity": 968.5, "max_dd": 0.0, "win_rate": 40.0, "profit_factor": 0.0, "ic": 0.8, "hit": 40.0, "psr": 0.0985, "bh_sharpe": -10.1368, "bh_return_pct": -3.15, "excess_sharpe": 0.0, "precision": 0.4, "recall": 1.0, "f1": 0.5714, "f2": 0.7692, "mcc": 0.0, "accuracy": 0.4, "tp": 2, "fp": 3, "tn": 0, "fn": 0}, {"fold": "fold_6", "regime": "COVID crash and V-recovery", "n": 26, "A_sharpe": 6.5333, "A_sortino": 8.3043, "A_excess_sharpe": 3.2481, "A_return_pct": 9.35, "A_hit_rate": 61.54, "A_n": 26, "A_bh_sharpe": 3.2852, "A_bh_return_pct": 4.82, "A_psr": 0.9802, "A_ic": 0.4195, "A_precision": 0.7143, "A_recall": 0.625, "A_f1": 0.6667, "A_f2": 0.641, "A_accuracy": 0.6154, "A_mcc": 0.2196, "A_tp": 10, "A_fp": 4, "A_tn": 6, "A_fn": 6, "B_sharpe": -2.0051, "B_sortino": -1.9575, "B_excess_sharpe": -14.9843, "B_return_pct": -6.87, "B_hit_rate": 46.15, "B_n": 26, "B_bh_sharpe": 12.9792, "B_bh_return_pct": 38.76, "B_psr": 0.268, "B_ic": 0.4961, "B_precision": 1.0, "B_recall": 0.3333, "B_f1": 0.5, "B_f2": 0.3846, "B_accuracy": 0.4615, "B_mcc": 0.2962, "B_tp": 7, "B_fp": 0, "B_tn": 5, "B_fn": 14, "D_sharpe": 2.4602, "D_sortino": 3.1003, "D_excess_sharpe": -0.825, "D_return_pct": 3.6, "D_hit_rate": 50.0, "D_n": 26, "D_bh_sharpe": 3.2852, "D_bh_return_pct": 4.82, "D_psr": 0.788, "D_ic": 0.3703, "D_precision": 0.7143, "D_recall": 0.3125, "D_f1": 0.4348, "D_f2": 0.3521, "D_accuracy": 0.5, "D_mcc": 0.1234, "D_tp": 5, "D_fp": 2, "D_tn": 8, "D_fn": 11, "sharpe": 6.5333, "sortino": 8.3043, "return_pct": 9.35, "equity": 1093.5, "max_dd": 0.0, "win_rate": 61.54, "profit_factor": 0.0, "ic": 0.4195, "hit": 61.54, "psr": 0.9802, "bh_sharpe": 3.2852, "bh_return_pct": 4.82, "excess_sharpe": 3.2481, "precision": 0.7143, "recall": 0.625, "f1": 0.6667, "f2": 0.641, "mcc": 0.2196, "accuracy": 0.6154, "tp": 10, "fp": 4, "tn": 6, "fn": 6}, {"fold": "fold_7", "regime": "Inflation bear, AI rally and 2025", "n": 65, "A_sharpe": 2.2468, "A_sortino": 2.1196, "A_excess_sharpe": 0.1679, "A_return_pct": 8.86, "A_hit_rate": 60.0, "A_n": 65, "A_bh_sharpe": 2.0789, "A_bh_return_pct": 8.17, "A_psr": 0.8646, "A_ic": 0.2327, "A_precision": 0.7647, "A_recall": 0.3714, "A_f1": 0.5, "A_f2": 0.414, "A_accuracy": 0.6, "A_mcc": 0.2701, "A_tp": 13, "A_fp": 4, "A_tn": 26, "A_fn": 22, "B_sharpe": -2.4294, "B_sortino": -2.4416, "B_excess_sharpe": -7.6608, "B_return_pct": -17.7, "B_hit_rate": 38.46, "B_n": 65, "B_bh_sharpe": 5.2314, "B_bh_return_pct": 44.53, "B_psr": 0.1128, "B_ic": 0.0814, "B_precision": 1.0, "B_r