{"experiment_num": 79, "backbone": "mlp", "description": "MLP @ exp 6 warmup=5 (up from 0) - Goyal 2017 LR warmup stability axis untested on QQQ MLP", "config": {"seq_len": 10, "lr": 0.0003, "batch_size": 32, "epochs": 50, "weight_decay": 1e-05, "patience": 10, "warmup_epochs": 5, "head_dropout": 0.25, "huber_delta": 1.0, "grad_clip": 1.0, "seed": 0, "hidden_size": null, "num_layers": null, "max_depth": null, "gbm_lr": null, "n_estimators": null}, "composite": 0.9735, "test_pos_folds": 7, "val_pos_folds": 5, "val_loss": -2.894193250855547, "elapsed_sec": 25.7, "timestamp": "2026-04-27T23:15:08", "sharpe": 1.0394, "val_sharpe": 0.9735, "ic": 0.0024, "hit": 54.51, "psr": 0.9939, "equity": 3940.8999999999996, "return_pct": 294.09, "bh_sharpe": 0.6042, "bh_return_pct": 103.49, "excess_sharpe": 0.4352, "B_sharpe": 0.2259, "B_excess_sharpe": -1.4749, "B_return_pct": -11.26, "D_sharpe": 1.0394, "D_excess_sharpe": 0.4352, "D_return_pct": 294.09, "precision": 0.581, "recall": 0.7336, "f1": 0.6484, "f2": 0.697, "mcc": 0.0281, "accuracy": 0.5447, "val_precision": 0.5577, "val_recall": 0.7052, "val_f1": 0.6228, "val_f2": 0.6697, "val_mcc": 0.0089, "val_accuracy": 0.5261, "per_window": [{"fold": "fold_1", "regime": "GFC peak crash (Lehman + Mar-2009 bottom)", "n": 115, "A_sharpe": 0.2129, "A_sortino": 0.2214, "A_excess_sharpe": 0.6571, "A_return_pct": -0.74, "A_hit_rate": 50.43, "A_n": 115, "A_bh_sharpe": -0.4441, "A_bh_return_pct": -14.4, "A_psr": 0.557, "A_ic": -0.0473, "A_precision": 0.4754, "A_recall": 0.537, "A_f1": 0.5043, "A_f2": 0.5235, "A_accuracy": 0.5043, "A_mcc": 0.0124, "A_tp": 29, "A_fp": 32, "A_tn": 29, "A_fn": 25, "B_sharpe": 3.2583, "B_sortino": 3.3158, "B_excess_sharpe": 3.5561, "B_return_pct": 214.09, "B_hit_rate": 60.53, "B_n": 115, "B_bh_sharpe": -0.2978, "B_bh_return_pct": -27.23, "B_psr": 0.9842, "B_ic": 0.186, "B_precision": 0.5942, "B_recall": 0.6949, "B_f1": 0.6406, "B_f2": 0.6721, "B_accuracy": 0.6, "B_mcc": 0.1989, "B_tp": 41, "B_fp": 28, "B_tn": 28, "B_fn": 18, "D_sharpe": 0.2129, "D_sortino": 0.2214, "D_excess_sharpe": 0.6571, "D_return_pct": -0.74, "D_hit_rate": 50.43, "D_n": 115, "D_bh_sharpe": -0.4441, "D_bh_return_pct": -14.4, "D_psr": 0.557, "D_ic": -0.0473, "D_precision": 0.4754, "D_recall": 0.537, "D_f1": 0.5043, "D_f2": 0.5235, "D_accuracy": 0.5043, "D_mcc": 0.0124, "D_tp": 29, "D_fp": 32, "D_tn": 29, "D_fn": 25, "sharpe": 0.2129, "sortino": 0.2214, "return_pct": -0.74, "equity": 992.6, "max_dd": 0.0, "win_rate": 50.43, "profit_factor": 0.0, "ic": -0.0473, "hit": 50.43, "psr": 0.557, "bh_sharpe": -0.4441, "bh_return_pct": -14.4, "excess_sharpe": 0.6571, "precision": 0.4754, "recall": 0.537, "f1": 0.5043, "f2": 0.5235, "mcc": 0.0124, "accuracy": 0.5043, "tp": 29, "fp": 32, "tn": 29, "fn": 25}, {"fold": "fold_2", "regime": "2011 US-downgrade + EU debt", "n": 136, "A_sharpe": 0.4354, "A_sortino": 0.4122, "A_excess_sharpe": -1.2974, "A_return_pct": 3.76, "A_hit_rate": 54.81, "A_n": 136, "A_bh_sharpe": 1.7327, "A_bh_return_pct": 19.75, "A_psr": 0.6249, "A_ic": -0.1372, "A_precision": 0.5635, "A_recall": 0.9103, "A_f1": 0.6961, "A_f2": 0.8105, "A_accuracy": 0.5441, "A_mcc": -0.072, "A_tp": 71, "A_fp": 55, "A_tn": 3, "A_fn": 7, "B_sharpe": 4.6965, "B_sortino": 4.7794, "B_excess_sharpe": 0.6306, "B_return_pct": 185.74, "B_hit_rate": 66.91, "B_n": 136, "B_bh_sharpe": 4.0659, "B_bh_return_pct": 148.68, "B_psr": 0.9997, "B_ic": 0.2245, "B_precision": 0.84, "B_recall": 0.6562, "B_f1": 0.7368, "B_f2": 0.6863, "B_accuracy": 0.6691, "B_mcc": 0.3264, "B_tp": 63, "B_fp": 12, "B_tn": 28, "B_fn": 33, "D_sharpe": 0.4354, "D_sortino": 0.4122, "D_excess_sharpe": -1.2974, "D_return_pct": 3.76, "D_hit_rate": 54.81, "D_n": 136, "D_bh_sharpe": 1.7327, "D_bh_return_pct": 19.75, "D_psr": 0.6249, "D_ic": -0.1372, "D_precision": 0.5635, "D_recall": 0.9103, "D_f1": 0.6961, "D_f2": 0.8105, "D_accuracy": 0.5441, "D_mcc": -0.072, "D_tp": 71, "D_fp": 55, "D_tn": 3, "D_fn": 7, "sharpe": 0.4354, "sortino": 0.4122, "return_pct": 3.76, "equity": 1037.6000000000001, "max_dd": 0.0, "win_rate": 54.81, "profit_factor": 0.0, "ic": -0.1372, "hit": 54.81, "psr": 0.6249, "bh_sharpe": 1.7327, "bh_return_pct": 19.75, "excess_sharpe": -1.2974, "precision": 0.5635, "recall": 0.9103, "f1": 0.6961, "f2": 0.8105, "mcc": -0.072, "accuracy": 0.5441, "tp": 71, "fp": 55, "tn": 3, "fn": 7}, {"fold": "fold_3", "regime": "Taper tantrum and 2014 H1", "n": 178, "A_sharpe": 2.9065, "A_sortino": 3.0363, "A_excess_sharpe": 1.5619, "A_return_pct": 29.23, "A_hit_rate": 58.19, "A_n": 178, "A_bh_sharpe": 1.3445, "A_bh_return_pct": 12.41, "A_psr": 0.9926, "A_ic": 0.1661, "A_precision": 0.5986, "A_recall": 0.8544, "A_f1": 0.704, "A_f2": 0.7871, "A_accuracy": 0.5843, "A_mcc": 0.0881, "A_tp": 88, "A_fp": 59, "A_tn": 16, "A_fn": 15, "B_sharpe": 0.8739, "B_sortino": 0.9605, "B_excess_sharpe": -2.1744, "B_return_pct": 15.02, "B_hit_rate": 50.0, "B_n": 178, "B_bh_sharpe": 3.0483, "B_bh_return_pct": 71.83, "B_psr": 0.7701, "B_ic": -0.0228, "B_precision": 0.6163, "B_recall": 0.4862, "B_f1": 0.5436, "B_f2": 0.5077, "B_accuracy": 0.5, "B_mcc": 0.0078, "B_tp": 53, "B_fp": 33, "B_tn": 36, "B_fn": 56, "D_sharpe": 2.9065, "D_sortino": 3.0363, "D_excess_sharpe": 1.5619, "D_return_pct": 29.23, "D_hit_rate": 58.19, "D_n": 178, "D_bh_sharpe": 1.3445, "D_bh_return_pct": 12.41, "D_psr": 0.9926, "D_ic": 0.1661, "D_precision": 0.5986, "D_recall": 0.8544, "D_f1": 0.704, "D_f2": 0.7871, "D_accuracy": 0.5843, "D_mcc": 0.0881, "D_tp": 88, "D_fp": 59, "D_tn": 16, "D_fn": 15, "sharpe": 2.9065, "sortino": 3.0363, "return_pct": 29.23, "equity": 1292.3, "max_dd": 0.0, "win_rate": 58.19, "profit_factor": 0.0, "ic": 0.1661, "hit": 58.19, "psr": 0.9926, "bh_sharpe": 1.3445, "bh_return_pct": 12.41, "excess_sharpe": 1.5619, "precision": 0.5986, "recall": 0.8544, "f1": 0.704, "f2": 0.7871, "mcc": 0.0881, "accuracy": 0.5843, "tp": 88, "fp": 59, "tn": 16, "fn": 15}, {"fold": "fold_4", "regime": "China devaluation and oil crash", "n": 157, "A_sharpe": 1.2486, "A_sortino": 1.4075, "A_excess_sharpe": 1.2388, "A_return_pct": 14.89, "A_hit_rate": 49.36, "A_n": 157, "A_bh_sharpe": 0.0098, "A_bh_return_pct": -1.05, "A_psr": 0.8398, "A_ic": -0.0076, "A_precision": 0.5052, "A_recall": 0.6049, "A_f1": 0.5506, "A_f2": 0.5819, "A_accuracy": 0.4904, "A_mcc": -0.0274, "A_tp": 49, "A_fp": 48, "A_tn": 28, "A_fn": 32, "B_sharpe": 0.7666, "B_sortino": 0.9111, "B_excess_sharpe": 0.7506, "B_return_pct": 16.2, "B_hit_rate": 45.22, "B_n": 157, "B_bh_sharpe": 0.0159, "B_bh_return_pct": -5.48, "B_psr": 0.7292, "B_ic": 0.0718, "B_precision": 0.4906, "B_recall": 0.3059, "B_f1": 0.3768, "B_f2": 0.3308, "B_accuracy": 0.4522, "B_mcc": -0.0728, "B_tp": 26, "B_fp": 27, "B_tn": 45, "B_fn": 59, "D_sharpe": 1.2486, "D_sortino": 1.4075, "D_excess_sharpe": 1.2388, "D_return_pct": 14.89, "D_hit_rate": 49.36, "D_n": 157, "D_bh_sharpe": 0.0098, "D_bh_return_pct": -1.05, "D_psr": 0.8398, "D_ic": -0.0076, "D_precision": 0.5052, "D_recall": 0.6049, "D_f1": 0.5506, "D_f2": 0.5819, "D_accuracy": 0.4904, "D_mcc": -0.0274, "D_tp": 49, "D_fp": 48, "D_tn": 28, "D_fn": 32, "sharpe": 1.2486, "sortino": 1.4075, "return_pct": 14.89, "equity": 1148.9, "max_dd": 0.0, "win_rate": 49.36, "profit_factor": 0.0, "ic": -0.0076, "hit": 49.36, "psr": 0.8398, "bh_sharpe": 0.0098, "bh_return_pct": -1.05, "excess_sharpe": 1.2388, "precision": 0.5052, "recall": 0.6049, "f1": 0.5506, "f2": 0.5819, "mcc": -0.0274, "accuracy": 0.4904, "tp": 49, "fp": 48, "tn": 28, "fn": 32}, {"fold": "fold_5", "regime": "2018 Vol-mageddon + Q4 sell-off", "n": 177, "A_sharpe": 0.8094, "A_sortino": 0.8425, "A_excess_sharpe": 0.4996, "A_return_pct": 11.87, "A_hit_rate": 53.67, "A_n": 177, "A_bh_sharpe": 0.3098, "A_bh_return_pct": 3.19, "A_psr": 0.7526, "A_ic": -0.0414, "A_precision": 0.5913, "A_recall": 0.6602, "A_f1": 0.6239, "A_f2": 0.6452, "A_accuracy": 0.5367, "A_mcc": 0.0259, "A_tp": 68, "A_fp": 47, "A_tn": 27, "A_fn": 35, "B_sharpe": 1.332, "B_sortino": 1.5778, "B_excess_sharpe": 0.4403, "B_return_pct": 42.99, "B_hit_rate": 47.73, "B_n": 177, "B_bh_sharpe": 0.8917, "B_bh_return_pct": 23.8, "B_psr": 0.8716, "B_ic": 0.0128, "B_precision": 0.6333, "B_recall": 0.3486, "B_f1": 0.4497, "B_f2": 0.3831, "B_accuracy": 0.4746, "B_mcc": 0.0258, "B_tp": 38, "B_fp": 22, "B_tn": 46, "B_fn": 71, "D_sharpe": 0.8094, "D_sortino": 0.8425, "D_excess_sharpe": 0.4996, "D_return_pct": 11.87, "D_hit_rate": 53.67, "D_n": 177, "D_bh_sharpe": 0.3098, "D_bh_return_pct": 3.19, "D_psr": 0.7526, "D_ic": -0.0414, "D_precision": 0.5913, "D_recall": 0.6602, "D_f1": 0.6239, "D_f2": 0.6452, "D_accuracy": 0.5367, "D_mcc": 0.0259, "D_tp": 68, "D_fp": 47, "D_tn": 27, "D_fn": 35, "sharpe": 0.8094, "sortino": 0.8425, "return_pct": 11.87, "equity": 1118.7, "max_dd": 0.0, "win_rate": 53.67, "profit_factor": 0.0, "ic": -0.0414, "hit": 53.67, "psr": 0.7526, "bh_sharpe": 0.3098, "bh_return_pct": 3.19, "excess_sharpe": 0.4996, "precision": 0.5913, "recall": 0.6602, "f1": 0.6239, "f2": 0.6452, "mcc": 0.0259, "accuracy": 0.5367, "tp": 68, "fp": 47, "tn": 27, "fn": 35}, {"fold": "fold_6", "regime": "COVID crash and V-recovery", "n": 222, "A_sharpe": 2.6363, "A_sortino": 2.8294, "A_excess_sharpe": 1.7475, "A_return_pct": 123.91, "A_hit_rate": 62.16, "A_n": 222, "A_bh_sharpe": 0.8888, "A_bh_return_pct": 26.13, "A_psr": 0.9958, "A_ic": 0.0865, "A_precision": 0.6534, "A_recall": 0.8333, "A_f1": 0.7325, "A_f2": 0.7898, "A_accuracy": 0.6216, "A_mcc": 0.1282, "A_tp": 115, "A_fp": 61, "A_tn": 23, "A_fn": 23, "B_sharpe": -1.7044, "B_sortino": -1.7207, "B_excess_sharpe": -4.0929, "B_return_pct": -71.57, "B_hit_rate": 44.34, "B_n": 222, "B_bh_sharpe": 2.3884, "B_bh_return_pct": 243.18, "B_psr": 0.0593, "B_ic": -0.0697, "B_precision": 0.6522, "B_recall": 0.219, "B_f1": 0.3279, "B_f2": 0.2525, "B_accuracy": 0.4459, "B_mcc": 0.0369, "B_tp": 30, "B_fp": 16, "B_tn": 69, "B_fn": 107, "D_sharpe": 2.6363, "D_sortino": 2.8294, "D_excess_sharpe": 1.7475, "D_return_pct": 123.91, "D_hit_rate": 62.16, "D_n": 222, "D_bh_sharpe": 0.8888, "D_bh_return_pct": 26.13, "D_psr": 0.9958, "D_ic": 0.0865, "D_precision": 0.6534, "D_recall": 0.8333, "D_f1": 0.7325, "D_f2": 0.7898, "D_accuracy": 0.6216, "D_mcc": 0.1282, "D_tp": 115, "D_fp": 61, "D_tn": 23, "D_fn": 23, "sharpe": 2.6363, "sortino": 2.8294, "return_pct": 123.91, "equity": 2239.0999999999995, "max_dd": 0.0, "win_rate": 62.16, "profit_factor": 0.0, "ic": 0.0865, "hit": 62.16, "psr": 0.9958, "bh_sharpe": 0.8888, "bh_return_pct": 26.13, "excess_sharpe": 1.7475, "precision": 0.6534, "recall": 0.8333, "f1": 0.7325, "f2": 0.7898, "mcc": 0.1282, "accuracy": 0.6216, "tp": 115, "fp": 61, "tn": 23, "fn": 23}, {"fold": "fold_7", "regime": "Inflation bear, AI rally and 2025", "n": 425, "A_sharpe": 0.1854, "A_sortino": 0.1849, "A_excess_sharpe": -0.7861, "A_return_pct": 2.88, "A_hit_rate": 52.24, "A_n": 425, "A_bh_sharpe": 0.9715, "A_bh_return_pct": 37.12, "A_psr": 0.5954, "A_ic": -0.0435, "A_precision": 0.5791, "A_recall": 0.688, "A_f1": 0.6289, "A_f2": 0.6631, "A_accuracy": 0.5224, "A_mcc": -0.0282, "A_tp": 172, "A_fp": 125, "A_tn": 50, "A_fn": 78, "B_sharpe": -2.01, "B_sortino": -1.9512, "B_excess_sharpe": -4.5127, "B_return_pct": -81.8, "B_hit_rate": 44.1, "B_n": 425, "B_bh_sharpe": 2.5027, "B_bh_return_pct": 458.83, "B_psr": 0.0051, "B_ic": -0.1518, "B_precision": 0.5571, "B_recall": 0.4639, "B_f1": 0.5062, "B_f2": 0.4799, "B_accuracy": 0.44, "B_mcc": -0.1311, "B_tp": 122, "B_fp": 97, "B_tn": 65, "B_fn": 141, "D_sharpe": 0.1854, "D_sortino": 0.1849, "D_excess_sharpe": -0.7861, "D_return_pct": 2.88, "D_hit_rate": 52.24, "D_n": 425, "D_bh_sharpe": 0.9715, "D_bh_return_pct": 37.12, "D_psr": 0.5954, "D_ic": -0.0435, "D_precision": 0.5791, "D_recall": 0.688, "D_f1": 0.6289, "D_f2": 0.6631, "D_accuracy": 0.5224, "D_mcc": -0.0282, "D_tp": 172, "D_fp": 125, "D_tn": 50, "D_fn": 78, "sharpe": 0.1854, "sortino": 0.1849, "return_pct": 2.88, "equity": 1028.8, "max_dd": 0.0, "win_rate": 52.24, "profit_factor": 0.0, "ic": -0.0435, "hit": 52.24, "psr": 0.5954, "bh_sharpe": 0.9715, "bh_return_pct": 37.12, "excess_sharpe": -0.7861, "precision": 0.5791, "recall": 0.688, "f1": 0.6289, "f2": 0.6631, "mcc": -0.0282, "accuracy": 0.5224, "tp": 172, "fp": 125, "tn": 50, "fn": 78}], "per_window_val": [{"fold": "fold_1", "regime": "GFC peak crash (Lehman + Mar-2009 bottom)", "n": 104, "A_sharpe": 1.7385, "A_sortino": 1.9718, "A_excess_sharpe": 1.9057, "A_return_pct": 21.36, "A_hit_rate": 52.94, "A_n": 104, "A_bh_sharpe": -0.1672, "A_bh_return_pct": -3.81, "A_psr": 0.8747, "A_ic": 0.032, "A_precision": 0.5455, "A_recall": 0.6667, "A_f1": 0.6, "A_f2": 0.6383, "A_accuracy": 0.5385, "A_mcc": 0.0692, "A_tp": 36, "A_fp": 30, "A_tn": 20, "A_fn": 18, "B_sharpe": 1.3073, "B_sortino": 1.4116, "B_excess_sharpe": 3.5814, "B_return_pct": 26.61, "B_hit_rate": 52.43, "B_n": 104, "B_bh_sharpe": -2.2741, "B_bh_return_pct": -44.12, "B_psr": 0.8026, "B_ic": 0.0723, "B_precision": 0.5263, "B_recall": 0.5769, "B_f1": 0.5505, "B_f2": 0.566, "B_accuracy": 0.5288, "B_mcc": 0.058, "B_tp": 30, "B_fp": 27, "B_tn": 25, "B_fn": 22, "D_sharpe": 1.7385, "D_sortino": 1.9718, "D_excess_sharpe": 1.9057, "D_return_pct": 21.36, "D_hit_rate": 52.94, "D_n": 104, "D_bh_sharpe": -0.1672, "D_bh_return_pct": -3.81, "D_psr": 0.8747, "D_ic": 0.032, "D_precision": 0.5455, "D_recall": 0.6667, "D_f1": 0.6, "D_f2": 0.6383, "D_accuracy": 0.5385, "D_mcc": 0.0692, "D_tp": 36, "D_fp": 30, "D_tn": 20, "D_fn": 18, "sharpe": 1.7385, "sortino": 1.9718, "return_pct": 21.36, "equity": 1213.6, "max_dd": 0.0, "win_rate": 52.94, "profit_factor": 0.0, "ic": 0.032, "hit": 52.94, "psr": 0.8747, "bh_sharpe": -0.1672, "bh_return_pct": -3.81, "excess_sharpe": 1.9057, "precision": 0.5455, "recall": 0.6667, "f1": 0.6, "f2": 0.6383, "mcc": 0.0692, "accuracy": 0.5385, "tp": 36, "fp": 30, "tn": 20, "fn": 18}, {"fold": "fold_2", "regime": "2011 US-downgrade + EU debt", "n": 96, "A_sharpe": -0.0919, "A_sortino": -0.0907, "A_excess_sharpe": 0.1823, "A_return_pct": -2.29, "A_hit_rate": 47.37, "A_n": 96, "A_bh_sharpe": -0.2741, "A_bh_return_pct": -4.09, "A_psr": 0.4775, "A_ic": -0.0461, "A_precision": 0.5, "A_recall": 0.66, "A_f1": 0.569, "A_f2": 0.6203, "A_accuracy": 0.4792, "A_mcc": -0.0619, "A_tp": 33, "A_fp": 33, "A_tn": 13, "A_fn": 17, "B_sharpe": 4.5902, "B_sortino": 5.1739, "B_excess_sharpe": 5.6177, "B_return_pct": 150.82, "B_hit_rate": 60.42, "B_n": 96, "B_bh_sharpe": -1.0274, "B_bh_return_pct": -25.58, "B_psr": 0.9974, "B_ic": 0.2763, "B_precision": 0.5397, "B_recall": 0.7907, "B_f1": 0.6415, "B_f2": 0.7234, "B_accuracy": 0.6042, "B_mcc": 0.255, "B_tp": 34, "B_fp": 29, "B_tn": 24, "B_fn": 9, "D_sharpe": -0.0919, "D_sortino": -0.0907, "D_excess_sharpe": 0.1823, "D_return_pct": -2.29, "D_hit_rate": 47.37, "D_n": 96, "D_bh_sharpe": -0.2741, "D_bh_return_pct": -4.09, "D_psr": 0.4775, "D_ic": -0.0461, "D_precision": 0.5, "D_recall": 0.66, "D_f1": 0.569, "D_f2": 0.6203, "D_accuracy": 0.4792, "D_mcc": -0.0619, "D_tp": 33, "D_fp": 33, "D_tn": 13, "D_fn": 17, "sharpe": -0.0919, "sortino": -0.0907, "return_pct": -2.29, "equity": 977.1, "max_dd": 0.0, "win_rate": 47.37, "profit_factor": 0.0, "ic": -0.0461, "hit": 47.37, "psr": 0.4775, "bh_sharpe": -0.2741, "bh_return_pct": -4.09, "excess_sharpe": 0.1823, "precision": 0.5, "recall": 0.66, "f1": 0.569, "f2": 0.6203, "mcc": -0.0619, "accuracy": 0.4792, "tp": 33, "fp": 33, "tn": 13, "fn": 17}, {"fold": "fold_3", "regime": "Taper tantrum and 2014 H1", "n": 54, "A_sharpe": 4.8357, "A_sortino": 5.1398, "A_excess_sharpe": 0.1359, "A_return_pct": 10.76, "A_hit_rate": 61.11, "A_n": 54, "A_bh_sharpe": 4.6998, "A_bh_return_pct": 10.46, "A_psr": 0.9802, "A_ic": 0.0013, "A_precision": 0.6154, "A_recall": 0.9697, "A_f1": 0.7529, "A_f2": 0.8696, "A_accuracy": 0.6111, "A_mcc": 0.0447, "A_tp": 32, "A_fp": 20, "A_tn": 1, "A_fn": 1, "B_sharpe": 1.7808, "B_sortino": 1.7933, "B_excess_sharpe": -7.2518, "B_return_pct": 8.91, "B_hit_rate": 53.7, "B_n": 54, "B_bh_sharpe": 9.0326, "B_bh_return_pct": 49.18, "B_psr": 0.7891, "B_ic": -0.1224, "B_precision": 0.6579, "B_recall": 0.6757, "B_f1": 0.6667, "B_f2": 0.672, "B_accuracy": 0.537, "B_mcc": -0.0906, "B_tp": 25, "B_fp": 13, "B_tn": 4, "B_fn": 12, "D_sharpe": 4.8357, "D_sortino": 5.1398, "D_excess_sharpe": 0.1359, "D_return_pct": 10.76, "D_hit_rate": 61.11, "D_n": 54, "D_bh_sharpe": 4.6998, "D_bh_return_pct": 10.46, "D_psr": 0.9802, "D_ic": 0.0013, "D_precision": 0.6154, "D_recall": 0.9697, "D_f1": 0.7529, "D_f2": 0.8696, "D_accuracy": 0.6111, "D_mcc": 0.0447, "D_tp": 32, "D_fp": 20, "D_tn": 1, "D_fn": 1, "sharpe": 4.8357, "sortino": 5.1398, "return_pct": 10.76, "equity": 1107.6, "max_dd": 0.0, "win_rate": 61.11, "profit_factor": 0.0, "ic": 0.0013, "hit": 61.11, "psr": 0.9802, "bh_sharpe": 4.6998, "bh_return_pct": 10.46, "excess_sharpe": 0.1359, "precision": 0.6154, "recall": 0.9697, "f1": 0.7529, "f2": 0.8696, "mcc": 0.0447, "accuracy": 0.6111, "tp": 32, "fp": 20, "tn": 1, "fn": 1}, {"fold": "fold_4", "regime": "China devaluation and oil crash", "n": 96, "A_sharpe": -0.5876, "A_sortino": -0.5748, "A_excess_sharpe": -0.1635, "A_return_pct": -4.87, "A_hit_rate": 48.42, "A_n": 96, "A_bh_sharpe": -0.4241, "A_bh_return_pct": -3.73, "A_psr": 0.3592, "A_ic": -0.0908, "A_precision": 0.4286, "A_recall": 0.3333, "A_f1": 0.375, "A_f2": 0.3488, "A_accuracy": 0.4792, "A_mcc": -0.061, "A_tp": 15, "A_fp": 20, "A_tn": 31, "A_fn": 30, "B_sharpe": 1.0991, "B_sortino": 1.236, "B_excess_sharpe": 2.2834, "B_return_pct": 16.08, "B_hit_rate": 48.96, "B_n": 96, "B_bh_sharpe": -1.1843, "B_bh_return_pct": -21.44, "B_psr": 0.751, "B_ic": -0.0485, "B_precision": 0.4717, "B_recall": 0.5435, "B_f1": 0.5051, "B_f2": 0.5274, "B_accuracy": 0.4896, "B_mcc": -0.0166, "B_tp": 25, "B_fp": 28, "B_tn": 22, "B_fn": 21, "D_sharpe": -0.5876, "D_sortino": -0.5748, "D_excess_sharpe": -0.1635, "D_return_pct": -4.87, "D_hit_rate": 48.42, "D_n": 96, "D_bh_sharpe": -0.4241, "D_bh_return_pct": -3.73, "D_psr": 0.3592, "D_ic": -0.0908, "D_precision": 0.4286, "D_recall": 0.3333, "D_f1": 0.375, "D_f2": 0.3488, "D_accuracy": 0.4792, "D_mcc": -0.061, "D_tp": 15, "D_fp": 20, "D_tn": 31, "D_fn": 30, "sharpe": -0.5876, "sortino": -0.5748, "return_pct": -4.87, "equity": 951.3000000000001, "max_dd": 0.0, "win_rate": 48.42, "profit_factor": 0.0, "ic": -0.0908, "hit": 48.42, "psr": 0.3592, "bh_sharpe": -0.4241, "bh_return_pct": -3.73, "excess_sharpe": -0.1635, "precision": 0.4286, "recall": 0.3333, "f1": 0.375, "f2": 0.3488, "mcc": -0.061, "accuracy": 0.4792, "tp": 15, "fp": 20, "tn": 31, "fn": 30}, {"fold": "fold_5", "regime": "2018 Vol-mageddon + Q4 sell-off", "n": 54, "A_sharpe": 1.1683, "A_sortino": 1.1213, "A_excess_sharpe": -0.2596, "A_return_pct": 3.2, "A_hit_rate": 53.7, "A_n": 54, "A_bh_sharpe": 1.428, "A_bh_return_pct": 3.97, "A_psr": 0.7014, "A_ic": 0.0313, "A_precision": 0.5476, "A_recall": 0.7931, "A_f1": 0.6479, "A_f2": 0.7278, "A_accuracy": 0.537, "A_mcc": 0.0397, "A_tp": 23, "A_fp": 19, "A_tn": 6, "A_fn": 6, "B_sharpe": -2.6909, "B_sortino": -2.5353, "B_excess_sharpe": -7.6231, "B_return_pct": -16.85, "B_hit_rate": 42.59, "B_n": 54, "B_bh_sharpe": 4.9322, "B_bh_return_pct": 34.93, "B_psr": 0.109, "B_ic": -0.2478, "B_precision": 0.6364, "B_recall": 0.3784, "B_f1": 0.4746, "B_f2": 0.4118, "B_accuracy": 0.4259, "B_mcc": -0.0872, "B_tp": 14, "B_fp": 8, "B_tn": 9, "B_fn": 23, "D_sharpe": 1.1683, "D_sortino": 1.1213, "D_excess_sharpe": -0.2596, "D_return_pct": 3.2, "D_hit_rate": 53.7, "D_n": 54, "D_bh_sharpe": 1.428, "D_bh_return_pct": 3.97, "D_psr": 0.7014, "D_ic": 0.0313, "D_precision": 0.5476, "D_recall": 0.7931, "D_f1": 0.6479, "D_f2": 0.7278, "D_accuracy": 0.537, "D_mcc": 0.0397, "D_tp": 23, "D_fp": 19, "D_tn": 6, "D_fn": 6, "sharpe": 1.1683, "sortino": 1.1213, "return_pct": 3.2, "equity": 1032.0, "max_dd": 0.0, "win_rate": 53.7, "profit_factor": 0.0, "ic": 0.0313, "hit": 53.7, "psr": 0.7014, "bh_sharpe": 1.428, "bh_return_pct": 3.97, "excess_sharpe": -0.2596, "precision": 0.5476, "recall": 0.7931, "f1": 0.6479, "f2": 0.7278, "mcc": 0.0397, "accuracy": 0.537, "tp": 23, "fp": 19, "tn": 6, "fn": 6}, {"fold": "fold_6", "regime": "COVID crash and V-recovery", "n": 75, "A_sharpe": 0.2341, "A_sortino": 0.2236, "A_excess_sharpe": -4.0653, "A_return_pct": 0.6, "A_hit_rate": 53.33, "A_n": 75, "A_bh_sharpe": 4.2994, "A_bh_return_pct": 14.68, "A_psr": 0.5504, "A_ic": -0.12, "A_precision": 0.625, "A_recall": 0.7843, "A_f1": 0.6957, "A_f2": 0.7463, "A_accuracy": 0.5333, "A_mcc": -0.2844, "A_tp": 40, "A_fp": 24, "A_tn": 0, "A_fn": 11, "B_sharpe": -0.6813, "B_sortino": -0.6711, "B_excess_sharpe": -15.0152, "B_return_pct": -5.88, "B_hit_rate": 49.33, "B_n": 75, "B_bh_sharpe": 14.3339, "B_bh_return_pct": 120.13, "B_psr": 0.3562, "B_ic": 0.0364, "B_precision": 0.9032, "B_recall": 0.4444, "B_f1": 0.5957, "B_f2": 0.4947, "B_accuracy": 0.4933, "B_mcc": 0.1448, "B_tp": 28, "B_fp": 3, "B_tn": 9, "B_fn": 35, "D_sharpe": 0.2341, "D_sortino": 0.2236, "D_excess_sharpe": -4.0653, "D_return_pct": 0.6, "D_hit_rate": 53.33, "D_n": 75, "D_bh_sharpe": 4.2994, "D_bh_return_pct": 14.68, "D_psr": 0.5504, "D_ic": -0.12, "D_precision": 0.625, "D_recall": 0.7843, "D_f1": 0.6957, "D_f2": 0.7463, "D_accuracy": 0.5333, "D_mcc": -0.2844, "D_tp": 40, "D_fp": 24, "D_tn": 0, "D_fn": 11, "sharpe": 0.2341, "sortino": 0.2236, "return_pct": 0.6, "equity": 1006.0, "max_dd": 0.0, "win_rate": 53.33, "profit_factor": 0.0, "ic": -0.12, "hit": 53.33, "psr": 0.5504, "bh_sharpe": 4.2994, "bh_return_pct": 14.68, "excess_sharpe": -4.0653, "precision": 0.625, "recall": 0.7843, "f1": 0.6957, "f2": 0.7463, "mcc": -0.2844, "accuracy": 0.5333, "tp": 40, "fp": 24, "tn": 0, "fn": 11}, {"fold": "fold_7", "regime": "Inflation bear, AI rally and 2025", "n": 114, "A_sharpe": 2.3422, "A_sortino": 2.6092, "A_excess_sharpe": -0.5028, "A_return_pct": 17.25, "A_hit_rate": 54.39, "A_n": 114, "A_bh_sharpe": 2.845, "A_bh_return_pct": 21.34, "A_psr": 0.9443, "A_ic": 0.0459, "A_precision": 0.5824, "A_recall": 0.791, "A_f1": 0.6709, "A_f2": 0.7382, "A_accuracy": 0.5439, "A_mcc": -0.0214, "A_tp": 53, "A_fp": 38, "A_tn": 9, "A_