{"experiment_num": 70, "backbone": "mlp", "description": "MLP @ exp 6 hidden=64 (further narrower from 96) - val regime fit hill-climb", "config": {"seq_len": 10, "lr": 0.0003, "batch_size": 32, "epochs": 50, "weight_decay": 1e-05, "patience": 10, "warmup_epochs": 0, "head_dropout": 0.25, "huber_delta": 1.0, "grad_clip": 1.0, "seed": 0, "hidden_size": 64, "num_layers": null, "max_depth": null, "gbm_lr": null, "n_estimators": null}, "composite": -0.9746, "test_pos_folds": 4, "val_pos_folds": 2, "val_loss": -2.890229872467144, "elapsed_sec": 30.6, "timestamp": "2026-04-27T23:00:58", "sharpe": 0.1045, "val_sharpe": -0.6746, "ic": -0.0374, "hit": 51.03, "psr": 0.5976, "equity": 953.7, "return_pct": -4.63, "bh_sharpe": 0.6042, "bh_return_pct": 103.49, "excess_sharpe": -0.4997, "B_sharpe": 0.1606, "B_excess_sharpe": -1.5402, "B_return_pct": -27.43, "D_sharpe": 0.1045, "D_excess_sharpe": -0.4997, "D_return_pct": -4.63, "precision": 0.5765, "recall": 0.5415, "f1": 0.5585, "f2": 0.5482, "mcc": 0.0091, "accuracy": 0.5099, "val_precision": 0.5327, "val_recall": 0.6444, "val_f1": 0.5832, "val_f2": 0.6184, "val_mcc": -0.0637, "val_accuracy": 0.489, "per_window": [{"fold": "fold_1", "regime": "GFC peak crash (Lehman + Mar-2009 bottom)", "n": 115, "A_sharpe": -0.6145, "A_sortino": -0.6091, "A_excess_sharpe": -0.1704, "A_return_pct": -17.65, "A_hit_rate": 46.96, "A_n": 115, "A_bh_sharpe": -0.4441, "A_bh_return_pct": -14.4, "A_psr": 0.3391, "A_ic": -0.0299, "A_precision": 0.3333, "A_recall": 0.1296, "A_f1": 0.1867, "A_f2": 0.1477, "A_accuracy": 0.4696, "A_mcc": -0.129, "A_tp": 7, "A_fp": 14, "A_tn": 47, "A_fn": 47, "B_sharpe": 4.2649, "B_sortino": 4.5033, "B_excess_sharpe": 4.5627, "B_return_pct": 363.93, "B_hit_rate": 64.04, "B_n": 115, "B_bh_sharpe": -0.2978, "B_bh_return_pct": -27.23, "B_psr": 0.998, "B_ic": 0.1823, "B_precision": 0.5934, "B_recall": 0.9153, "B_f1": 0.72, "B_f2": 0.8257, "B_accuracy": 0.6348, "B_mcc": 0.3131, "B_tp": 54, "B_fp": 37, "B_tn": 19, "B_fn": 5, "D_sharpe": -0.6145, "D_sortino": -0.6091, "D_excess_sharpe": -0.1704, "D_return_pct": -17.65, "D_hit_rate": 46.96, "D_n": 115, "D_bh_sharpe": -0.4441, "D_bh_return_pct": -14.4, "D_psr": 0.3391, "D_ic": -0.0299, "D_precision": 0.3333, "D_recall": 0.1296, "D_f1": 0.1867, "D_f2": 0.1477, "D_accuracy": 0.4696, "D_mcc": -0.129, "D_tp": 7, "D_fp": 14, "D_tn": 47, "D_fn": 47, "sharpe": -0.6145, "sortino": -0.6091, "return_pct": -17.65, "equity": 823.5, "max_dd": 0.0, "win_rate": 46.96, "profit_factor": 0.0, "ic": -0.0299, "hit": 46.96, "psr": 0.3391, "bh_sharpe": -0.4441, "bh_return_pct": -14.4, "excess_sharpe": -0.1704, "precision": 0.3333, "recall": 0.1296, "f1": 0.1867, "f2": 0.1477, "mcc": -0.129, "accuracy": 0.4696, "tp": 7, "fp": 14, "tn": 47, "fn": 47}, {"fold": "fold_2", "regime": "2011 US-downgrade + EU debt", "n": 136, "A_sharpe": 1.29, "A_sortino": 1.3934, "A_excess_sharpe": -0.4427, "A_return_pct": 14.07, "A_hit_rate": 52.59, "A_n": 136, "A_bh_sharpe": 1.7327, "A_bh_return_pct": 19.75, "A_psr": 0.8298, "A_ic": -0.0569, "A_precision": 0.5875, "A_recall": 0.6026, "A_f1": 0.5949, "A_f2": 0.5995, "A_accuracy": 0.5294, "A_mcc": 0.0338, "A_tp": 47, "A_fp": 33, "A_tn": 25, "A_fn": 31, "B_sharpe": 2.7388, "B_sortino": 2.5707, "B_excess_sharpe": -1.3271, "B_return_pct": 83.45, "B_hit_rate": 63.97, "B_n": 136, "B_bh_sharpe": 4.0659, "B_bh_return_pct": 148.68, "B_psr": 0.9764, "B_ic": -0.0484, "B_precision": 0.7238, "B_recall": 0.7917, "B_f1": 0.7562, "B_f2": 0.7771, "B_accuracy": 0.6397, "B_mcc": 0.0724, "B_tp": 76, "B_fp": 29, "B_tn": 11, "B_fn": 20, "D_sharpe": 1.29, "D_sortino": 1.3934, "D_excess_sharpe": -0.4427, "D_return_pct": 14.07, "D_hit_rate": 52.59, "D_n": 136, "D_bh_sharpe": 1.7327, "D_bh_return_pct": 19.75, "D_psr": 0.8298, "D_ic": -0.0569, "D_precision": 0.5875, "D_recall": 0.6026, "D_f1": 0.5949, "D_f2": 0.5995, "D_accuracy": 0.5294, "D_mcc": 0.0338, "D_tp": 47, "D_fp": 33, "D_tn": 25, "D_fn": 31, "sharpe": 1.29, "sortino": 1.3934, "return_pct": 14.07, "equity": 1140.7, "max_dd": 0.0, "win_rate": 52.59, "profit_factor": 0.0, "ic": -0.0569, "hit": 52.59, "psr": 0.8298, "bh_sharpe": 1.7327, "bh_return_pct": 19.75, "excess_sharpe": -0.4427, "precision": 0.5875, "recall": 0.6026, "f1": 0.5949, "f2": 0.5995, "mcc": 0.0338, "accuracy": 0.5294, "tp": 47, "fp": 33, "tn": 25, "fn": 31}, {"fold": "fold_3", "regime": "Taper tantrum and 2014 H1", "n": 178, "A_sharpe": 1.1476, "A_sortino": 1.2118, "A_excess_sharpe": -0.1969, "A_return_pct": 10.42, "A_hit_rate": 51.41, "A_n": 178, "A_bh_sharpe": 1.3445, "A_bh_return_pct": 12.41, "A_psr": 0.833, "A_ic": 0.0349, "A_precision": 0.5625, "A_recall": 0.699, "A_f1": 0.6234, "A_f2": 0.6667, "A_accuracy": 0.5112, "A_mcc": -0.0523, "A_tp": 72, "A_fp": 56, "A_tn": 19, "A_fn": 31, "B_sharpe": 4.2912, "B_sortino": 5.4399, "B_excess_sharpe": 1.2429, "B_return_pct": 113.6, "B_hit_rate": 56.18, "B_n": 178, "B_bh_sharpe": 3.0483, "B_bh_return_pct": 71.83, "B_psr": 0.9999, "B_ic": 0.1528, "B_precision": 0.6598, "B_recall": 0.5872, "B_f1": 0.6214, "B_f2": 0.6004, "B_accuracy": 0.5618, "B_mcc": 0.1065, "B_tp": 64, "B_fp": 33, "B_tn": 36, "B_fn": 45, "D_sharpe": 1.1476, "D_sortino": 1.2118, "D_excess_sharpe": -0.1969, "D_return_pct": 10.42, "D_hit_rate": 51.41, "D_n": 178, "D_bh_sharpe": 1.3445, "D_bh_return_pct": 12.41, "D_psr": 0.833, "D_ic": 0.0349, "D_precision": 0.5625, "D_recall": 0.699, "D_f1": 0.6234, "D_f2": 0.6667, "D_accuracy": 0.5112, "D_mcc": -0.0523, "D_tp": 72, "D_fp": 56, "D_tn": 19, "D_fn": 31, "sharpe": 1.1476, "sortino": 1.2118, "return_pct": 10.42, "equity": 1104.2, "max_dd": 0.0, "win_rate": 51.41, "profit_factor": 0.0, "ic": 0.0349, "hit": 51.41, "psr": 0.833, "bh_sharpe": 1.3445, "bh_return_pct": 12.41, "excess_sharpe": -0.1969, "precision": 0.5625, "recall": 0.699, "f1": 0.6234, "f2": 0.6667, "mcc": -0.0523, "accuracy": 0.5112, "tp": 72, "fp": 56, "tn": 19, "fn": 31}, {"fold": "fold_4", "regime": "China devaluation and oil crash", "n": 157, "A_sharpe": -0.4696, "A_sortino": -0.4447, "A_excess_sharpe": -0.4794, "A_return_pct": -6.62, "A_hit_rate": 50.0, "A_n": 157, "A_bh_sharpe": 0.0098, "A_bh_return_pct": -1.05, "A_psr": 0.3554, "A_ic": -0.0325, "A_precision": 0.5139, "A_recall": 0.4568, "A_f1": 0.4837, "A_f2": 0.4672, "A_accuracy": 0.4968, "A_mcc": -0.0037, "A_tp": 37, "A_fp": 35, "A_tn": 41, "A_fn": 44, "B_sharpe": -0.523, "B_sortino": -0.5648, "B_excess_sharpe": -0.5389, "B_return_pct": -18.38, "B_hit_rate": 43.95, "B_n": 157, "B_bh_sharpe": 0.0159, "B_bh_return_pct": -5.48, "B_psr": 0.3412, "B_ic": 0.0265, "B_precision": 0.4805, "B_recall": 0.4353, "B_f1": 0.4568, "B_f2": 0.4436, "B_accuracy": 0.4395, "B_mcc": -0.1199, "B_tp": 37, "B_fp": 40, "B_tn": 32, "B_fn": 48, "D_sharpe": -0.4696, "D_sortino": -0.4447, "D_excess_sharpe": -0.4794, "D_return_pct": -6.62, "D_hit_rate": 50.0, "D_n": 157, "D_bh_sharpe": 0.0098, "D_bh_return_pct": -1.05, "D_psr": 0.3554, "D_ic": -0.0325, "D_precision": 0.5139, "D_recall": 0.4568, "D_f1": 0.4837, "D_f2": 0.4672, "D_accuracy": 0.4968, "D_mcc": -0.0037, "D_tp": 37, "D_fp": 35, "D_tn": 41, "D_fn": 44, "sharpe": -0.4696, "sortino": -0.4447, "return_pct": -6.62, "equity": 933.8, "max_dd": 0.0, "win_rate": 50.0, "profit_factor": 0.0, "ic": -0.0325, "hit": 50.0, "psr": 0.3554, "bh_sharpe": 0.0098, "bh_return_pct": -1.05, "excess_sharpe": -0.4794, "precision": 0.5139, "recall": 0.4568, "f1": 0.4837, "f2": 0.4672, "mcc": -0.0037, "accuracy": 0.4968, "tp": 37, "fp": 35, "tn": 41, "fn": 44}, {"fold": "fold_5", "regime": "2018 Vol-mageddon + Q4 sell-off", "n": 177, "A_sharpe": 0.2896, "A_sortino": 0.2919, "A_excess_sharpe": -0.0202, "A_return_pct": 2.87, "A_hit_rate": 53.67, "A_n": 177, "A_bh_sharpe": 0.3098, "A_bh_return_pct": 3.19, "A_psr": 0.5959, "A_ic": -0.0263, "A_precision": 0.6129, "A_recall": 0.5534, "A_f1": 0.5816, "A_f2": 0.5644, "A_accuracy": 0.5367, "A_mcc": 0.0661, "A_tp": 57, "A_fp": 36, "A_tn": 38, "A_fn": 46, "B_sharpe": 1.3732, "B_sortino": 1.2339, "B_excess_sharpe": 0.4815, "B_return_pct": 44.7, "B_hit_rate": 59.09, "B_n": 177, "B_bh_sharpe": 0.8917, "B_bh_return_pct": 23.8, "B_psr": 0.8693, "B_ic": -0.0037, "B_precision": 0.6552, "B_recall": 0.6972, "B_f1": 0.6756, "B_f2": 0.6884, "B_accuracy": 0.5876, "B_mcc": 0.1116, "B_tp": 76, "B_fp": 40, "B_tn": 28, "B_fn": 33, "D_sharpe": 0.2896, "D_sortino": 0.2919, "D_excess_sharpe": -0.0202, "D_return_pct": 2.87, "D_hit_rate": 53.67, "D_n": 177, "D_bh_sharpe": 0.3098, "D_bh_return_pct": 3.19, "D_psr": 0.5959, "D_ic": -0.0263, "D_precision": 0.6129, "D_recall": 0.5534, "D_f1": 0.5816, "D_f2": 0.5644, "D_accuracy": 0.5367, "D_mcc": 0.0661, "D_tp": 57, "D_fp": 36, "D_tn": 38, "D_fn": 46, "sharpe": 0.2896, "sortino": 0.2919, "return_pct": 2.87, "equity": 1028.7, "max_dd": 0.0, "win_rate": 53.67, "profit_factor": 0.0, "ic": -0.0263, "hit": 53.67, "psr": 0.5959, "bh_sharpe": 0.3098, "bh_return_pct": 3.19, "excess_sharpe": -0.0202, "precision": 0.6129, "recall": 0.5534, "f1": 0.5816, "f2": 0.5644, "mcc": 0.0661, "accuracy": 0.5367, "tp": 57, "fp": 36, "tn": 38, "fn": 46}, {"fold": "fold_6", "regime": "COVID crash and V-recovery", "n": 222, "A_sharpe": 0.8731, "A_sortino": 0.8858, "A_excess_sharpe": -0.0157, "A_return_pct": 25.58, "A_hit_rate": 54.95, "A_n": 222, "A_bh_sharpe": 0.8888, "A_bh_return_pct": 26.13, "A_psr": 0.7931, "A_ic": -0.0154, "A_precision": 0.6508, "A_recall": 0.5942, "A_f1": 0.6212, "A_f2": 0.6047, "A_accuracy": 0.5495, "A_mcc": 0.0689, "A_tp": 82, "A_fp": 44, "A_tn": 40, "A_fn": 56, "B_sharpe": -2.0902, "B_sortino": -1.8646, "B_excess_sharpe": -4.4786, "B_return_pct": -77.58, "B_hit_rate": 47.51, "B_n": 222, "B_bh_sharpe": 2.3884, "B_bh_return_pct": 243.18, "B_psr": 0.0225, "B_ic": -0.092, "B_precision": 0.604, "B_recall": 0.4453, "B_f1": 0.5126, "B_f2": 0.47, "B_accuracy": 0.4775, "B_mcc": -0.0247, "B_tp": 61, "B_fp": 40, "B_tn": 45, "B_fn": 76, "D_sharpe": 0.8731, "D_sortino": 0.8858, "D_excess_sharpe": -0.0157, "D_return_pct": 25.58, "D_hit_rate": 54.95, "D_n": 222, "D_bh_sharpe": 0.8888, "D_bh_return_pct": 26.13, "D_psr": 0.7931, "D_ic": -0.0154, "D_precision": 0.6508, "D_recall": 0.5942, "D_f1": 0.6212, "D_f2": 0.6047, "D_accuracy": 0.5495, "D_mcc": 0.0689, "D_tp": 82, "D_fp": 44, "D_tn": 40, "D_fn": 56, "sharpe": 0.8731, "sortino": 0.8858, "return_pct": 25.58, "equity": 1255.8, "max_dd": 0.0, "win_rate": 54.95, "profit_factor": 0.0, "ic": -0.0154, "hit": 54.95, "psr": 0.7931, "bh_sharpe": 0.8888, "bh_return_pct": 26.13, "excess_sharpe": -0.0157, "precision": 0.6508, "recall": 0.5942, "f1": 0.6212, "f2": 0.6047, "mcc": 0.0689, "accuracy": 0.5495, "tp": 82, "fp": 44, "tn": 40, "fn": 56}, {"fold": "fold_7", "regime": "Inflation bear, AI rally and 2025", "n": 425, "A_sharpe": -0.6341, "A_sortino": -0.6748, "A_excess_sharpe": -1.6056, "A_return_pct": -23.78, "A_hit_rate": 48.71, "A_n": 425, "A_bh_sharpe": 0.9715, "A_bh_return_pct": 37.12, "A_psr": 0.2128, "A_ic": -0.0836, "A_precision": 0.5672, "A_recall": 0.54, "A_f1": 0.5533, "A_f2": 0.5452, "A_accuracy": 0.4871, "A_mcc": -0.0482, "A_tp": 135, "A_fp": 103, "A_tn": 72, "A_fn": 115, "B_sharpe": -2.2603, "B_sortino": -2.0505, "B_excess_sharpe": -4.7629, "B_return_pct": -84.93, "B_hit_rate": 46.7, "B_n": 425, "B_bh_sharpe": 2.5027, "B_bh_return_pct": 458.83, "B_psr": 0.0015, "B_ic": -0.1307, "B_precision": 0.5709, "B_recall": 0.5513, "B_f1": 0.5609, "B_f2": 0.5551, "B_accuracy": 0.4659, "B_mcc": -0.1203, "B_tp": 145, "B_fp": 109, "B_tn": 53, "B_fn": 118, "D_sharpe": -0.6341, "D_sortino": -0.6748, "D_excess_sharpe": -1.6056, "D_return_pct": -23.78, "D_hit_rate": 48.71, "D_n": 425, "D_bh_sharpe": 0.9715, "D_bh_return_pct": 37.12, "D_psr": 0.2128, "D_ic": -0.0836, "D_precision": 0.5672, "D_recall": 0.54, "D_f1": 0.5533, "D_f2": 0.5452, "D_accuracy": 0.4871, "D_mcc": -0.0482, "D_tp": 135, "D_fp": 103, "D_tn": 72, "D_fn": 115, "sharpe": -0.6341, "sortino": -0.6748, "return_pct": -23.78, "equity": 762.2, "max_dd": 0.0, "win_rate": 48.71, "profit_factor": 0.0, "ic": -0.0836, "hit": 48.71, "psr": 0.2128, "bh_sharpe": 0.9715, "bh_return_pct": 37.12, "excess_sharpe": -1.6056, "precision": 0.5672, "recall": 0.54, "f1": 0.5533, "f2": 0.5452, "mcc": -0.0482, "accuracy": 0.4871, "tp": 135, "fp": 103, "tn": 72, "fn": 115}], "per_window_val": [{"fold": "fold_1", "regime": "GFC peak crash (Lehman + Mar-2009 bottom)", "n": 104, "A_sharpe": -1.387, "A_sortino": -1.4539, "A_excess_sharpe": -1.2198, "A_return_pct": -17.07, "A_hit_rate": 43.14, "A_n": 104, "A_bh_sharpe": -0.1672, "A_bh_return_pct": -3.81, "A_psr": 0.1951, "A_ic": -0.1086, "A_precision": 0.4528, "A_recall": 0.4444, "A_f1": 0.4486, "A_f2": 0.4461, "A_accuracy": 0.4327, "A_mcc": -0.1355, "A_tp": 24, "A_fp": 29, "A_tn": 21, "A_fn": 30, "B_sharpe": -0.8335, "B_sortino": -0.7381, "B_excess_sharpe": 1.4406, "B_return_pct": -22.6, "B_hit_rate": 50.49, "B_n": 104, "B_bh_sharpe": -2.2741, "B_bh_return_pct": -44.12, "B_psr": 0.2935, "B_ic": -0.0521, "B_precision": 0.5085, "B_recall": 0.5769, "B_f1": 0.5405, "B_f2": 0.5618, "B_accuracy": 0.5096, "B_mcc": 0.0194, "B_tp": 30, "B_fp": 29, "B_tn": 23, "B_fn": 22, "D_sharpe": -1.387, "D_sortino": -1.4539, "D_excess_sharpe": -1.2198, "D_return_pct": -17.07, "D_hit_rate": 43.14, "D_n": 104, "D_bh_sharpe": -0.1672, "D_bh_return_pct": -3.81, "D_psr": 0.1951, "D_ic": -0.1086, "D_precision": 0.4528, "D_recall": 0.4444, "D_f1": 0.4486, "D_f2": 0.4461, "D_accuracy": 0.4327, "D_mcc": -0.1355, "D_tp": 24, "D_fp": 29, "D_tn": 21, "D_fn": 30, "sharpe": -1.387, "sortino": -1.4539, "return_pct": -17.07, "equity": 829.3000000000001, "max_dd": 0.0, "win_rate": 43.14, "profit_factor": 0.0, "ic": -0.1086, "hit": 43.14, "psr": 0.1951, "bh_sharpe": -0.1672, "bh_return_pct": -3.81, "excess_sharpe": -1.2198, "precision": 0.4528, "recall": 0.4444, "f1": 0.4486, "f2": 0.4461, "mcc": -0.1355, "accuracy": 0.4327, "tp": 24, "fp": 29, "tn": 21, "fn": 30}, {"fold": "fold_2", "regime": "2011 US-downgrade + EU debt", "n": 96, "A_sharpe": -1.9441, "A_sortino": -1.7784, "A_excess_sharpe": -1.67, "A_return_pct": -19.01, "A_hit_rate": 45.26, "A_n": 96, "A_bh_sharpe": -0.2741, "A_bh_return_pct": -4.09, "A_psr": 0.1115, "A_ic": -0.0394, "A_precision": 0.4789, "A_recall": 0.68, "A_f1": 0.562, "A_f2": 0.6273, "A_accuracy": 0.4479, "A_mcc": -0.1415, "A_tp": 34, "A_fp": 37, "A_tn": 9, "A_fn": 16, "B_sharpe": 1.4312, "B_sortino": 1.5738, "B_excess_sharpe": 2.4586, "B_return_pct": 28.83, "B_hit_rate": 52.08, "B_n": 96, "B_bh_sharpe": -1.0274, "B_bh_return_pct": -25.58, "B_psr": 0.8127, "B_ic": 0.0416, "B_precision": 0.4789, "B_recall": 0.7907, "B_f1": 0.5965, "B_f2": 0.6996, "B_accuracy": 0.5208, "B_mcc": 0.1049, "B_tp": 34, "B_fp": 37, "B_tn": 16, "B_fn": 9, "D_sharpe": -1.9441, "D_sortino": -1.7784, "D_excess_sharpe": -1.67, "D_return_pct": -19.01, "D_hit_rate": 45.26, "D_n": 96, "D_bh_sharpe": -0.2741, "D_bh_return_pct": -4.09, "D_psr": 0.1115, "D_ic": -0.0394, "D_precision": 0.4789, "D_recall": 0.68, "D_f1": 0.562, "D_f2": 0.6273, "D_accuracy": 0.4479, "D_mcc": -0.1415, "D_tp": 34, "D_fp": 37, "D_tn": 9, "D_fn": 16, "sharpe": -1.9441, "sortino": -1.7784, "return_pct": -19.01, "equity": 809.9, "max_dd": 0.0, "win_rate": 45.26, "profit_factor": 0.0, "ic": -0.0394, "hit": 45.26, "psr": 0.1115, "bh_sharpe": -0.2741, "bh_return_pct": -4.09, "excess_sharpe": -1.67, "precision": 0.4789, "recall": 0.68, "f1": 0.562, "f2": 0.6273, "mcc": -0.1415, "accuracy": 0.4479, "tp": 34, "fp": 37, "tn": 9, "fn": 16}, {"fold": "fold_3", "regime": "Taper tantrum and 2014 H1", "n": 54, "A_sharpe": 2.8352, "A_sortino": 3.2314, "A_excess_sharpe": -1.8645, "A_return_pct": 6.31, "A_hit_rate": 51.85, "A_n": 54, "A_bh_sharpe": 4.6998, "A_bh_return_pct": 10.46, "A_psr": 0.8996, "A_ic": -0.1905, "A_precision": 0.5745, "A_recall": 0.8182, "A_f1": 0.675, "A_f2": 0.7542, "A_accuracy": 0.5185, "A_mcc": -0.1948, "A_tp": 27, "A_fp": 20, "A_tn": 1, "A_fn": 6, "B_sharpe": 7.0798, "B_sortino": 8.3807, "B_excess_sharpe": -1.9528, "B_return_pct": 38.87, "B_hit_rate": 66.67, "B_n": 54, "B_bh_sharpe": 9.0326, "B_bh_return_pct": 49.18, "B_psr": 0.9993, "B_ic": 0.0461, "B_precision": 0.7021, "B_recall": 0.8919, "B_f1": 0.7857, "B_f2": 0.8462, "B_accuracy": 0.6667, "B_mcc": 0.0945, "B_tp": 33, "B_fp": 14, "B_tn": 3, "B_fn": 4, "D_sharpe": 2.8352, "D_sortino": 3.2314, "D_excess_sharpe": -1.8645, "D_return_pct": 6.31, "D_hit_rate": 51.85, "D_n": 54, "D_bh_sharpe": 4.6998, "D_bh_return_pct": 10.46, "D_psr": 0.8996, "D_ic": -0.1905, "D_precision": 0.5745, "D_recall": 0.8182, "D_f1": 0.675, "D_f2": 0.7542, "D_accuracy": 0.5185, "D_mcc": -0.1948, "D_tp": 27, "D_fp": 20, "D_tn": 1, "D_fn": 6, "sharpe": 2.8352, "sortino": 3.2314, "return_pct": 6.31, "equity": 1063.1, "max_dd": 0.0, "win_rate": 51.85, "profit_factor": 0.0, "ic": -0.1905, "hit": 51.85, "psr": 0.8996, "bh_sharpe": 4.6998, "bh_return_pct": 10.46, "excess_sharpe": -1.8645, "precision": 0.5745, "recall": 0.8182, "f1": 0.675, "f2": 0.7542, "mcc": -0.1948, "accuracy": 0.5185, "tp": 27, "fp": 20, "tn": 1, "fn": 6}, {"fold": "fold_4", "regime": "China devaluation and oil crash", "n": 96, "A_sharpe": -0.4522, "A_sortino": -0.4399, "A_excess_sharpe": -0.0281, "A_return_pct": -3.93, "A_hit_rate": 49.47, "A_n": 96, "A_bh_sharpe": -0.4241, "A_bh_return_pct": -3.73, "A_psr": 0.3907, "A_ic": -0.0976, "A_precision": 0.4706, "A_recall": 0.7111, "A_f1": 0.5664, "A_f2": 0.6452, "A_accuracy": 0.4896, "A_mcc": 0.0057, "A_tp": 32, "A_fp": 36, "A_tn": 15, "A_fn": 13, "B_sharpe": 3.3643, "B_sortino": 5.0175, "B_excess_sharpe": 4.5485, "B_return_pct": 69.04, "B_hit_rate": 55.21, "B_n": 96, "B_bh_sharpe": -1.1843, "B_bh_return_pct": -21.44, "B_psr": 0.9927, "B_ic": 0.0708, "B_precision": 0.5273, "B_recall": 0.6304, "B_f1": 0.5743, "B_f2": 0.6067, "B_accuracy": 0.5521, "B_mcc": 0.1115, "B_tp": 29, "B_fp": 26, "B_tn": 24, "B_fn": 17, "D_sharpe": -0.4522, "D_sortino": -0.4399, "D_excess_sharpe": -0.0281, "D_return_pct": -3.93, "D_hit_rate": 49.47, "D_n": 96, "D_bh_sharpe": -0.4241, "D_bh_return_pct": -3.73, "D_psr": 0.3907, "D_ic": -0.0976, "D_precision": 0.4706, "D_recall": 0.7111, "D_f1": 0.5664, "D_f2": 0.6452, "D_accuracy": 0.4896, "D_mcc": 0.0057, "D_tp": 32, "D_fp": 36, "D_tn": 15, "D_fn": 13, "sharpe": -0.4522, "sortino": -0.4399, "return_pct": -3.93, "equity": 960.7, "max_dd": 0.0, "win_rate": 49.47, "profit_factor": 0.0, "ic": -0.0976, "hit": 49.47, "psr": 0.3907, "bh_sharpe": -0.4241, "bh_return_pct": -3.73, "excess_sharpe": -0.0281, "precision": 0.4706, "recall": 0.7111, "f1": 0.5664, "f2": 0.6452, "mcc": 0.0057, "accuracy": 0.4896, "tp": 32, "fp": 36, "tn": 15, "fn": 13}, {"fold": "fold_5", "regime": "2018 Vol-mageddon + Q4 sell-off", "n": 54, "A_sharpe": -0.6913, "A_sortino": -0.6386, "A_excess_sharpe": -2.1192, "A_return_pct": -2.15, "A_hit_rate": 50.0, "A_n": 54, "A_bh_sharpe": 1.428, "A_bh_return_pct": 3.97, "A_psr": 0.3748, "A_ic": -0.1605, "A_precision": 0.5278, "A_recall": 0.6552, "A_f1": 0.5846, "A_f2": 0.625, "A_accuracy": 0.5, "A_mcc": -0.0263, "A_tp": 19, "A_fp": 17, "A_tn": 8, "A_fn": 10, "B_sharpe": -6.4609, "B_sortino": -5.3907, "B_excess_sharpe": -11.3931, "B_return_pct": -33.21, "B_hit_rate": 35.19, "B_n": 54, "B_bh_sharpe": 4.9322, "B_bh_return_pct": 34.93, "B_psr": 0.0014, "B_ic": -0.4172, "B_precision": 0.5385, "B_recall": 0.3784, "B_f1": 0.4444, "B_f2": 0.4023, "B_accuracy": 0.3519, "B_mcc": -0.3044, "B_tp": 14, "B_fp": 12, "B_tn": 5, "B_fn": 23, "D_sharpe": -0.6913, "D_sortino": -0.6386, "D_excess_sharpe": -2.1192, "D_return_pct": -2.15, "D_hit_rate": 50.0, "D_n": 54, "D_bh_sharpe": 1.428, "D_bh_return_pct": 3.97, "D_psr": 0.3748, "D_ic": -0.1605, "D_precision": 0.5278, "D_recall": 0.6552, "D_f1": 0.5846, "D_f2": 0.625, "D_accuracy": 0.5, "D_mcc": -0.0263, "D_tp": 19, "D_fp": 17, "D_tn": 8, "D_fn": 10, "sharpe": -0.6913, "sortino": -0.6386, "return_pct": -2.15, "equity": 978.5, "max_dd": 0.0, "win_rate": 50.0, "profit_factor": 0.0, "ic": -0.1605, "hit": 50.0, "psr": 0.3748, "bh_sharpe": 1.428, "bh_return_pct": 3.97, "excess_sharpe": -2.1192, "precision": 0.5278, "recall": 0.6552, "f1": 0.5846, "f2": 0.625, "mcc": -0.0263, "accuracy": 0.5, "tp": 19, "fp": 17, "tn": 8, "fn": 10}, {"fold": "fold_6", "regime": "COVID crash and V-recovery", "n": 75, "A_sharpe": 1.2328, "A_sortino": 1.214, "A_excess_sharpe": -3.0666, "A_return_pct": 4.0, "A_hit_rate": 53.33, "A_n": 75, "A_bh_sharpe": 4.2994, "A_bh_return_pct": 14.68, "A_psr": 0.7454, "A_ic": -0.0535, "A_precision": 0.6481, "A_recall": 0.6863, "A_f1": 0.6667, "A_f2": 0.6783, "A_accuracy": 0.5333, "A_mcc": -0.1095, "A_tp": 35, "A_fp": 19, "A_tn": 5, "A_fn": 16, "B_sharpe": 5.4784, "B_sortino": 5.3722, "B_excess_sharpe": -8.8555, "B_return_pct": 46.12, "B_hit_rate": 68.0, "B_n": 75, "B_bh_sharpe": 14.3339, "B_bh_return_pct": 120.13, "B_psr": 0.9977, "B_ic": -0.0343, "B_precision": 0.8679, "B_recall": 0.7302, "B_f1": 0.7931, "B_f2": 0.7541, "B_accuracy": 0.68, "B_mcc": 0.1182, "B_tp": 46, "B_fp": 7, "B_tn": 5, "B_fn": 17, "D_sharpe": 1.2328, "D_sortino": 1.214, "D_excess_sharpe": -3.0666, "D_return_pct": 4.0, "D_hit_rate": 53.33, "D_n": 75, "D_bh_sharpe": 4.2994, "D_bh_return_pct": 14.68, "D_psr": 0.7454, "D_ic": -0.0535, "D_precision": 0.6481, "D_recall": 0.6863, "D_f1": 0.6667, "D_f2": 0.6783, "D_accuracy": 0.5333, "D_mcc": -0.1095, "D_tp": 35, "D_fp": 19, "D_tn": 5, "D_fn": 16, "sharpe": 1.2328, "sortino": 1.214, "return_pct": 4.0, "equity": 1040.0, "max_dd": 0.0, "win_rate": 53.33, "profit_factor": 0.0, "ic": -0.0535, "hit": 53.33, "psr": 0.7454, "bh_sharpe": 4.2994, "bh_return_pct": 14.68, "excess_sharpe": -3.0666, "precision": 0.6481, "recall": 0.6863, "f1": 0.6667, "f2": 0.6783, "mcc": -0.1095, "accuracy": 0.5333, "tp": 35, "fp": 19, "tn": 5, "fn": 16}, {"fold": "fold_7", "regime": "Inflation bear, AI rally and 2025", "n": 114, "A_sharpe": -0.1316, "A_sortino": -0.1227, "A_excess_sharpe": -2.9767, "A_return_pct": -1.48, "A_hit_rate": 52.63, "A_n": 114, "A_bh_sharpe": 2.845, "A_bh_return_pct": 21.34, "A_psr": 0.4648, "A_ic": 0.0276, "A_precision": 0.5942, "A_recall": 0.6119, "A_f1": 0.6029, "A_f2": 0.6083, "A_accuracy": 0