{"experiment_num": 60, "backbone": "mlp", "description": "MLP @ exp 6 hd=0.20 (down from 0.25) - Srivastava 2014; less reg untested direction", "config": {"seq_len": 10, "lr": 0.0003, "batch_size": 32, "epochs": 50, "weight_decay": 1e-05, "patience": 10, "warmup_epochs": 0, "head_dropout": 0.2, "huber_delta": 1.0, "grad_clip": 1.0, "seed": 0, "hidden_size": null, "num_layers": null, "max_depth": null, "gbm_lr": null, "n_estimators": null}, "composite": -0.9226, "test_pos_folds": 3, "val_pos_folds": 1, "val_loss": -2.8903291470686865, "elapsed_sec": 33.8, "timestamp": "2026-04-27T22:03:32", "sharpe": -0.2367, "val_sharpe": -0.5226, "ic": -0.0164, "hit": 45.63, "psr": 0.2882, "equity": 567.9000000000001, "return_pct": -43.21, "bh_sharpe": 0.6042, "bh_return_pct": 103.49, "excess_sharpe": -0.8409, "B_sharpe": -0.3298, "B_excess_sharpe": -2.0306, "B_return_pct": -83.04, "D_sharpe": -0.2367, "D_excess_sharpe": -0.8409, "D_return_pct": -43.21, "precision": 0.5938, "recall": 0.1648, "f1": 0.258, "f2": 0.1926, "mcc": 0.0188, "accuracy": 0.4574, "val_precision": 0.514, "val_recall": 0.1672, "val_f1": 0.2523, "val_f2": 0.1933, "val_mcc": -0.0385, "val_accuracy": 0.4503, "per_window": [{"fold": "fold_1", "regime": "GFC peak crash (Lehman + Mar-2009 bottom)", "n": 115, "A_sharpe": 0.8372, "A_sortino": 0.8241, "A_excess_sharpe": 1.2813, "A_return_pct": 14.19, "A_hit_rate": 54.78, "A_n": 115, "A_bh_sharpe": -0.4441, "A_bh_return_pct": -14.4, "A_psr": 0.7129, "A_ic": -0.012, "A_precision": 0.6, "A_recall": 0.1111, "A_f1": 0.1875, "A_f2": 0.1327, "A_accuracy": 0.5478, "A_mcc": 0.0807, "A_tp": 6, "A_fp": 4, "A_tn": 57, "A_fn": 48, "B_sharpe": 2.2287, "B_sortino": 2.695, "B_excess_sharpe": 2.5265, "B_return_pct": 108.72, "B_hit_rate": 50.0, "B_n": 115, "B_bh_sharpe": -0.2978, "B_bh_return_pct": -27.23, "B_psr": 0.9384, "B_ic": 0.0853, "B_precision": 0.5143, "B_recall": 0.3051, "B_f1": 0.383, "B_f2": 0.3321, "B_accuracy": 0.4957, "B_mcc": 0.0016, "B_tp": 18, "B_fp": 17, "B_tn": 39, "B_fn": 41, "D_sharpe": 0.8372, "D_sortino": 0.8241, "D_excess_sharpe": 1.2813, "D_return_pct": 14.19, "D_hit_rate": 54.78, "D_n": 115, "D_bh_sharpe": -0.4441, "D_bh_return_pct": -14.4, "D_psr": 0.7129, "D_ic": -0.012, "D_precision": 0.6, "D_recall": 0.1111, "D_f1": 0.1875, "D_f2": 0.1327, "D_accuracy": 0.5478, "D_mcc": 0.0807, "D_tp": 6, "D_fp": 4, "D_tn": 57, "D_fn": 48, "sharpe": 0.8372, "sortino": 0.8241, "return_pct": 14.19, "equity": 1141.8999999999999, "max_dd": 0.0, "win_rate": 54.78, "profit_factor": 0.0, "ic": -0.012, "hit": 54.78, "psr": 0.7129, "bh_sharpe": -0.4441, "bh_return_pct": -14.4, "excess_sharpe": 1.2813, "precision": 0.6, "recall": 0.1111, "f1": 0.1875, "f2": 0.1327, "mcc": 0.0807, "accuracy": 0.5478, "tp": 6, "fp": 4, "tn": 57, "fn": 48}, {"fold": "fold_2", "regime": "2011 US-downgrade + EU debt", "n": 136, "A_sharpe": -1.2426, "A_sortino": -1.1418, "A_excess_sharpe": -2.9754, "A_return_pct": -13.88, "A_hit_rate": 48.89, "A_n": 136, "A_bh_sharpe": 1.7327, "A_bh_return_pct": 19.75, "A_psr": 0.1792, "A_ic": -0.056, "A_precision": 0.5882, "A_recall": 0.3846, "A_f1": 0.4651, "A_f2": 0.4132, "A_accuracy": 0.4926, "A_mcc": 0.023, "A_tp": 30, "A_fp": 21, "A_tn": 37, "A_fn": 48, "B_sharpe": 1.2259, "B_sortino": 1.0913, "B_excess_sharpe": -2.84, "B_return_pct": 27.64, "B_hit_rate": 61.03, "B_n": 136, "B_bh_sharpe": 4.0659, "B_bh_return_pct": 148.68, "B_psr": 0.8133, "B_ic": 0.1014, "B_precision": 0.7722, "B_recall": 0.6354, "B_f1": 0.6971, "B_f2": 0.6587, "B_accuracy": 0.6103, "B_mcc": 0.1712, "B_tp": 61, "B_fp": 18, "B_tn": 22, "B_fn": 35, "D_sharpe": -1.2426, "D_sortino": -1.1418, "D_excess_sharpe": -2.9754, "D_return_pct": -13.88, "D_hit_rate": 48.89, "D_n": 136, "D_bh_sharpe": 1.7327, "D_bh_return_pct": 19.75, "D_psr": 0.1792, "D_ic": -0.056, "D_precision": 0.5882, "D_recall": 0.3846, "D_f1": 0.4651, "D_f2": 0.4132, "D_accuracy": 0.4926, "D_mcc": 0.023, "D_tp": 30, "D_fp": 21, "D_tn": 37, "D_fn": 48, "sharpe": -1.2426, "sortino": -1.1418, "return_pct": -13.88, "equity": 861.1999999999999, "max_dd": 0.0, "win_rate": 48.89, "profit_factor": 0.0, "ic": -0.056, "hit": 48.89, "psr": 0.1792, "bh_sharpe": 1.7327, "bh_return_pct": 19.75, "excess_sharpe": -2.9754, "precision": 0.5882, "recall": 0.3846, "f1": 0.4651, "f2": 0.4132, "mcc": 0.023, "accuracy": 0.4926, "tp": 30, "fp": 21, "tn": 37, "fn": 48}, {"fold": "fold_3", "regime": "Taper tantrum and 2014 H1", "n": 178, "A_sharpe": 0.2743, "A_sortino": 0.3197, "A_excess_sharpe": -1.0702, "A_return_pct": 1.94, "A_hit_rate": 46.89, "A_n": 178, "A_bh_sharpe": 1.3445, "A_bh_return_pct": 12.41, "A_psr": 0.5915, "A_ic": 0.0686, "A_precision": 0.6552, "A_recall": 0.1845, "A_f1": 0.2879, "A_f2": 0.2154, "A_accuracy": 0.4719, "A_mcc": 0.0684, "A_tp": 19, "A_fp": 10, "A_tn": 65, "A_fn": 84, "B_sharpe": -0.7645, "B_sortino": -0.7342, "B_excess_sharpe": -3.8128, "B_return_pct": -15.63, "B_hit_rate": 48.31, "B_n": 178, "B_bh_sharpe": 3.0483, "B_bh_return_pct": 71.83, "B_psr": 0.26, "B_ic": -0.1019, "B_precision": 0.5934, "B_recall": 0.4954, "B_f1": 0.54, "B_f2": 0.5123, "B_accuracy": 0.4831, "B_mcc": -0.0398, "B_tp": 54, "B_fp": 37, "B_tn": 32, "B_fn": 55, "D_sharpe": 0.2743, "D_sortino": 0.3197, "D_excess_sharpe": -1.0702, "D_return_pct": 1.94, "D_hit_rate": 46.89, "D_n": 178, "D_bh_sharpe": 1.3445, "D_bh_return_pct": 12.41, "D_psr": 0.5915, "D_ic": 0.0686, "D_precision": 0.6552, "D_recall": 0.1845, "D_f1": 0.2879, "D_f2": 0.2154, "D_accuracy": 0.4719, "D_mcc": 0.0684, "D_tp": 19, "D_fp": 10, "D_tn": 65, "D_fn": 84, "sharpe": 0.2743, "sortino": 0.3197, "return_pct": 1.94, "equity": 1019.4000000000001, "max_dd": 0.0, "win_rate": 46.89, "profit_factor": 0.0, "ic": 0.0686, "hit": 46.89, "psr": 0.5915, "bh_sharpe": 1.3445, "bh_return_pct": 12.41, "excess_sharpe": -1.0702, "precision": 0.6552, "recall": 0.1845, "f1": 0.2879, "f2": 0.2154, "mcc": 0.0684, "accuracy": 0.4719, "tp": 19, "fp": 10, "tn": 65, "fn": 84}, {"fold": "fold_4", "regime": "China devaluation and oil crash", "n": 157, "A_sharpe": 0.1293, "A_sortino": 0.1338, "A_excess_sharpe": 0.1195, "A_return_pct": 0.39, "A_hit_rate": 48.72, "A_n": 157, "A_bh_sharpe": 0.0098, "A_bh_return_pct": -1.05, "A_psr": 0.5406, "A_ic": 0.0291, "A_precision": 0.52, "A_recall": 0.1605, "A_f1": 0.2453, "A_f2": 0.1862, "A_accuracy": 0.4904, "A_mcc": 0.0035, "A_tp": 13, "A_fp": 12, "A_tn": 64, "A_fn": 68, "B_sharpe": -0.4534, "B_sortino": -0.5343, "B_excess_sharpe": -0.4693, "B_return_pct": -16.78, "B_hit_rate": 40.76, "B_n": 157, "B_bh_sharpe": 0.0159, "B_bh_return_pct": -5.48, "B_psr": 0.3618, "B_ic": 0.0459, "B_precision": 0.4167, "B_recall": 0.2353, "B_f1": 0.3008, "B_f2": 0.2577, "B_accuracy": 0.4076, "B_mcc": -0.1661, "B_tp": 20, "B_fp": 28, "B_tn": 44, "B_fn": 65, "D_sharpe": 0.1293, "D_sortino": 0.1338, "D_excess_sharpe": 0.1195, "D_return_pct": 0.39, "D_hit_rate": 48.72, "D_n": 157, "D_bh_sharpe": 0.0098, "D_bh_return_pct": -1.05, "D_psr": 0.5406, "D_ic": 0.0291, "D_precision": 0.52, "D_recall": 0.1605, "D_f1": 0.2453, "D_f2": 0.1862, "D_accuracy": 0.4904, "D_mcc": 0.0035, "D_tp": 13, "D_fp": 12, "D_tn": 64, "D_fn": 68, "sharpe": 0.1293, "sortino": 0.1338, "return_pct": 0.39, "equity": 1003.9, "max_dd": 0.0, "win_rate": 48.72, "profit_factor": 0.0, "ic": 0.0291, "hit": 48.72, "psr": 0.5406, "bh_sharpe": 0.0098, "bh_return_pct": -1.05, "excess_sharpe": 0.1195, "precision": 0.52, "recall": 0.1605, "f1": 0.2453, "f2": 0.1862, "mcc": 0.0035, "accuracy": 0.4904, "tp": 13, "fp": 12, "tn": 64, "fn": 68}, {"fold": "fold_5", "regime": "2018 Vol-mageddon + Q4 sell-off", "n": 177, "A_sharpe": -0.1243, "A_sortino": -0.1362, "A_excess_sharpe": -0.4341, "A_return_pct": -3.8, "A_hit_rate": 43.5, "A_n": 177, "A_bh_sharpe": 0.3098, "A_bh_return_pct": 3.19, "A_psr": 0.4586, "A_ic": 0.0046, "A_precision": 0.6364, "A_recall": 0.068, "A_f1": 0.1228, "A_f2": 0.0827, "A_accuracy": 0.435, "A_mcc": 0.0284, "A_tp": 7, "A_fp": 4, "A_tn": 70, "A_fn": 96, "B_sharpe": 0.317, "B_sortino": 0.3419, "B_excess_sharpe": -0.5747, "B_return_pct": 2.85, "B_hit_rate": 47.73, "B_n": 177, "B_bh_sharpe": 0.8917, "B_bh_return_pct": 23.8, "B_psr": 0.6047, "B_ic": -0.0231, "B_precision": 0.6133, "B_recall": 0.422, "B_f1": 0.5, "B_f2": 0.4501, "B_accuracy": 0.4802, "B_mcc": -0.0044, "B_tp": 46, "B_fp": 29, "B_tn": 39, "B_fn": 63, "D_sharpe": -0.1243, "D_sortino": -0.1362, "D_excess_sharpe": -0.4341, "D_return_pct": -3.8, "D_hit_rate": 43.5, "D_n": 177, "D_bh_sharpe": 0.3098, "D_bh_return_pct": 3.19, "D_psr": 0.4586, "D_ic": 0.0046, "D_precision": 0.6364, "D_recall": 0.068, "D_f1": 0.1228, "D_f2": 0.0827, "D_accuracy": 0.435, "D_mcc": 0.0284, "D_tp": 7, "D_fp": 4, "D_tn": 70, "D_fn": 96, "sharpe": -0.1243, "sortino": -0.1362, "return_pct": -3.8, "equity": 962.0, "max_dd": 0.0, "win_rate": 43.5, "profit_factor": 0.0, "ic": 0.0046, "hit": 43.5, "psr": 0.4586, "bh_sharpe": 0.3098, "bh_return_pct": 3.19, "excess_sharpe": -0.4341, "precision": 0.6364, "recall": 0.068, "f1": 0.1228, "f2": 0.0827, "mcc": 0.0284, "accuracy": 0.435, "tp": 7, "fp": 4, "tn": 70, "fn": 96}, {"fold": "fold_6", "regime": "COVID crash and V-recovery", "n": 222, "A_sharpe": -0.6177, "A_sortino": -0.7025, "A_excess_sharpe": -1.5065, "A_return_pct": -23.57, "A_hit_rate": 40.54, "A_n": 222, "A_bh_sharpe": 0.8888, "A_bh_return_pct": 26.13, "A_psr": 0.2844, "A_ic": 0.0479, "A_precision": 0.6875, "A_recall": 0.0797, "A_f1": 0.1429, "A_f2": 0.0968, "A_accuracy": 0.4054, "A_mcc": 0.0379, "A_tp": 11, "A_fp": 5, "A_tn": 79, "A_fn": 127, "B_sharpe": -0.6438, "B_sortino": -0.7056, "B_excess_sharpe": -3.0322, "B_return_pct": -45.56, "B_hit_rate": 45.25, "B_n": 222, "B_bh_sharpe": 2.3884, "B_bh_return_pct": 243.18, "B_psr": 0.2759, "B_ic": -0.0756, "B_precision": 0.6538, "B_recall": 0.2482, "B_f1": 0.3598, "B_f2": 0.2833, "B_accuracy": 0.455, "B_mcc": 0.0418, "B_tp": 34, "B_fp": 18, "B_tn": 67, "B_fn": 103, "D_sharpe": -0.6177, "D_sortino": -0.7025, "D_excess_sharpe": -1.5065, "D_return_pct": -23.57, "D_hit_rate": 40.54, "D_n": 222, "D_bh_sharpe": 0.8888, "D_bh_return_pct": 26.13, "D_psr": 0.2844, "D_ic": 0.0479, "D_precision": 0.6875, "D_recall": 0.0797, "D_f1": 0.1429, "D_f2": 0.0968, "D_accuracy": 0.4054, "D_mcc": 0.0379, "D_tp": 11, "D_fp": 5, "D_tn": 79, "D_fn": 127, "sharpe": -0.6177, "sortino": -0.7025, "return_pct": -23.57, "equity": 764.3, "max_dd": 0.0, "win_rate": 40.54, "profit_factor": 0.0, "ic": 0.0479, "hit": 40.54, "psr": 0.2844, "bh_sharpe": 0.8888, "bh_return_pct": 26.13, "excess_sharpe": -1.5065, "precision": 0.6875, "recall": 0.0797, "f1": 0.1429, "f2": 0.0968, "mcc": 0.0379, "accuracy": 0.4054, "tp": 11, "fp": 5, "tn": 79, "fn": 127}, {"fold": "fold_7", "regime": "Inflation bear, AI rally and 2025", "n": 425, "A_sharpe": -0.6135, "A_sortino": -0.6376, "A_excess_sharpe": -1.585, "A_return_pct": -23.26, "A_hit_rate": 44.0, "A_n": 425, "A_bh_sharpe": 0.9715, "A_bh_return_pct": 37.12, "A_psr": 0.2107, "A_ic": -0.0834, "A_precision": 0.5732, "A_recall": 0.188, "A_f1": 0.2831, "A_f2": 0.2172, "A_accuracy": 0.44, "A_mcc": -0.015, "A_tp": 47, "A_fp": 35, "A_tn": 140, "A_fn": 203, "B_sharpe": -2.1667, "B_sortino": -2.1613, "B_excess_sharpe": -4.6694, "B_return_pct": -83.81, "B_hit_rate": 41.75, "B_n": 425, "B_bh_sharpe": 2.5027, "B_bh_return_pct": 458.83, "B_psr": 0.003, "B_ic": -0.19, "B_precision": 0.5336, "B_recall": 0.4525, "B_f1": 0.4897, "B_f2": 0.4667, "B_accuracy": 0.4165, "B_mcc": -0.1843, "B_tp": 119, "B_fp": 104, "B_tn": 58, "B_fn": 144, "D_sharpe": -0.6135, "D_sortino": -0.6376, "D_excess_sharpe": -1.585, "D_return_pct": -23.26, "D_hit_rate": 44.0, "D_n": 425, "D_bh_sharpe": 0.9715, "D_bh_return_pct": 37.12, "D_psr": 0.2107, "D_ic": -0.0834, "D_precision": 0.5732, "D_recall": 0.188, "D_f1": 0.2831, "D_f2": 0.2172, "D_accuracy": 0.44, "D_mcc": -0.015, "D_tp": 47, "D_fp": 35, "D_tn": 140, "D_fn": 203, "sharpe": -0.6135, "sortino": -0.6376, "return_pct": -23.26, "equity": 767.4, "max_dd": 0.0, "win_rate": 44.0, "profit_factor": 0.0, "ic": -0.0834, "hit": 44.0, "psr": 0.2107, "bh_sharpe": 0.9715, "bh_return_pct": 37.12, "excess_sharpe": -1.585, "precision": 0.5732, "recall": 0.188, "f1": 0.2831, "f2": 0.2172, "mcc": -0.015, "accuracy": 0.44, "tp": 47, "fp": 35, "tn": 140, "fn": 203}], "per_window_val": [{"fold": "fold_1", "regime": "GFC peak crash (Lehman + Mar-2009 bottom)", "n": 104, "A_sharpe": 0.7792, "A_sortino": 0.9242, "A_excess_sharpe": 0.9464, "A_return_pct": 8.04, "A_hit_rate": 48.04, "A_n": 104, "A_bh_sharpe": -0.1672, "A_bh_return_pct": -3.81, "A_psr": 0.6951, "A_ic": 0.0873, "A_precision": 0.5294, "A_recall": 0.1667, "A_f1": 0.2535, "A_f2": 0.1931, "A_accuracy": 0.4904, "A_mcc": 0.009, "A_tp": 9, "A_fp": 8, "A_tn": 42, "A_fn": 45, "B_sharpe": 3.5322, "B_sortino": 4.4317, "B_excess_sharpe": 5.8063, "B_return_pct": 107.19, "B_hit_rate": 53.4, "B_n": 104, "B_bh_sharpe": -2.2741, "B_bh_return_pct": -44.12, "B_psr": 0.9915, "B_ic": 0.1983, "B_precision": 0.5588, "B_recall": 0.3654, "B_f1": 0.4419, "B_f2": 0.3926, "B_accuracy": 0.5385, "B_mcc": 0.082, "B_tp": 19, "B_fp": 15, "B_tn": 37, "B_fn": 33, "D_sharpe": 0.7792, "D_sortino": 0.9242, "D_excess_sharpe": 0.9464, "D_return_pct": 8.04, "D_hit_rate": 48.04, "D_n": 104, "D_bh_sharpe": -0.1672, "D_bh_return_pct": -3.81, "D_psr": 0.6951, "D_ic": 0.0873, "D_precision": 0.5294, "D_recall": 0.1667, "D_f1": 0.2535, "D_f2": 0.1931, "D_accuracy": 0.4904, "D_mcc": 0.009, "D_tp": 9, "D_fp": 8, "D_tn": 42, "D_fn": 45, "sharpe": 0.7792, "sortino": 0.9242, "return_pct": 8.04, "equity": 1080.4, "max_dd": 0.0, "win_rate": 48.04, "profit_factor": 0.0, "ic": 0.0873, "hit": 48.04, "psr": 0.6951, "bh_sharpe": -0.1672, "bh_return_pct": -3.81, "excess_sharpe": 0.9464, "precision": 0.5294, "recall": 0.1667, "f1": 0.2535, "f2": 0.1931, "mcc": 0.009, "accuracy": 0.4904, "tp": 9, "fp": 8, "tn": 42, "fn": 45}, {"fold": "fold_2", "regime": "2011 US-downgrade + EU debt", "n": 96, "A_sharpe": -0.8667, "A_sortino": -0.9753, "A_excess_sharpe": -0.5926, "A_return_pct": -9.7, "A_hit_rate": 41.05, "A_n": 96, "A_bh_sharpe": -0.2741, "A_bh_return_pct": -4.09, "A_psr": 0.3008, "A_ic": -0.0859, "A_precision": 0.3333, "A_recall": 0.12, "A_f1": 0.1765, "A_f2": 0.1376, "A_accuracy": 0.4167, "A_mcc": -0.1803, "A_tp": 6, "A_fp": 12, "A_tn": 34, "A_fn": 44, "B_sharpe": -0.9213, "B_sortino": -1.0578, "B_excess_sharpe": 0.1061, "B_return_pct": -23.65, "B_hit_rate": 39.58, "B_n": 96, "B_bh_sharpe": -1.0274, "B_bh_return_pct": -25.58, "B_psr": 0.2898, "B_ic": -0.0091, "B_precision": 0.3333, "B_recall": 0.3488, "B_f1": 0.3409, "B_f2": 0.3456, "B_accuracy": 0.3958, "B_mcc": -0.2164, "B_tp": 15, "B_fp": 30, "B_tn": 23, "B_fn": 28, "D_sharpe": -0.8667, "D_sortino": -0.9753, "D_excess_sharpe": -0.5926, "D_return_pct": -9.7, "D_hit_rate": 41.05, "D_n": 96, "D_bh_sharpe": -0.2741, "D_bh_return_pct": -4.09, "D_psr": 0.3008, "D_ic": -0.0859, "D_precision": 0.3333, "D_recall": 0.12, "D_f1": 0.1765, "D_f2": 0.1376, "D_accuracy": 0.4167, "D_mcc": -0.1803, "D_tp": 6, "D_fp": 12, "D_tn": 34, "D_fn": 44, "sharpe": -0.8667, "sortino": -0.9753, "return_pct": -9.7, "equity": 903.0, "max_dd": 0.0, "win_rate": 41.05, "profit_factor": 0.0, "ic": -0.0859, "hit": 41.05, "psr": 0.3008, "bh_sharpe": -0.2741, "bh_return_pct": -4.09, "excess_sharpe": -0.5926, "precision": 0.3333, "recall": 0.12, "f1": 0.1765, "f2": 0.1376, "mcc": -0.1803, "accuracy": 0.4167, "tp": 6, "fp": 12, "tn": 34, "fn": 44}, {"fold": "fold_3", "regime": "Taper tantrum and 2014 H1", "n": 54, "A_sharpe": -2.6835, "A_sortino": -2.7345, "A_excess_sharpe": -7.3832, "A_return_pct": -5.85, "A_hit_rate": 40.74, "A_n": 54, "A_bh_sharpe": 4.6998, "A_bh_return_pct": 10.46, "A_psr": 0.1221, "A_ic": -0.0138, "A_precision": 0.5714, "A_recall": 0.1212, "A_f1": 0.2, "A_f2": 0.1439, "A_accuracy": 0.4074, "A_mcc": -0.0314, "A_tp": 4, "A_fp": 3, "A_tn": 18, "A_fn": 29, "B_sharpe": 2.8752, "B_sortino": 3.035, "B_excess_sharpe": -6.1574, "B_return_pct": 15.04, "B_hit_rate": 57.41, "B_n": 54, "B_bh_sharpe": 9.0326, "B_bh_return_pct": 49.18, "B_psr": 0.9033, "B_ic": 0.0346, "B_precision": 0.6522, "B_recall": 0.8108, "B_f1": 0.7229, "B_f2": 0.7732, "B_accuracy": 0.5741, "B_mcc": -0.1704, "B_tp": 30, "B_fp": 16, "B_tn": 1, "B_fn": 7, "D_sharpe": -2.6835, "D_sortino": -2.7345, "D_excess_sharpe": -7.3832, "D_return_pct": -5.85, "D_hit_rate": 40.74, "D_n": 54, "D_bh_sharpe": 4.6998, "D_bh_return_pct": 10.46, "D_psr": 0.1221, "D_ic": -0.0138, "D_precision": 0.5714, "D_recall": 0.1212, "D_f1": 0.2, "D_f2": 0.1439, "D_accuracy": 0.4074, "D_mcc": -0.0314, "D_tp": 4, "D_fp": 3, "D_tn": 18, "D_fn": 29, "sharpe": -2.6835, "sortino": -2.7345, "return_pct": -5.85, "equity": 941.5, "max_dd": 0.0, "win_rate": 40.74, "profit_factor": 0.0, "ic": -0.0138, "hit": 40.74, "psr": 0.1221, "bh_sharpe": 4.6998, "bh_return_pct": 10.46, "excess_sharpe": -7.3832, "precision": 0.5714, "recall": 0.1212, "f1": 0.2, "f2": 0.1439, "mcc": -0.0314, "accuracy": 0.4074, "tp": 4, "fp": 3, "tn": 18, "fn": 29}, {"fold": "fold_4", "regime": "China devaluation and oil crash", "n": 96, "A_sharpe": -0.0917, "A_sortino": -0.0932, "A_excess_sharpe": 0.3324, "A_return_pct": -1.36, "A_hit_rate": 50.53, "A_n": 96, "A_bh_sharpe": -0.4241, "A_bh_return_pct": -3.73, "A_psr": 0.4776, "A_ic": -0.0113, "A_precision": 0.4211, "A_recall": 0.1778, "A_f1": 0.25, "A_f2": 0.201, "A_accuracy": 0.5, "A_mcc": -0.0475, "A_tp": 8, "A_fp": 11, "A_tn": 40, "A_fn": 37, "B_sharpe": 2.2451, "B_sortino": 3.3398, "B_excess_sharpe": 3.4294, "B_return_pct": 40.87, "B_hit_rate": 51.04, "B_n": 96, "B_bh_sharpe": -1.1843, "B_bh_return_pct": -21.44, "B_psr": 0.9413, "B_ic": 0.0541, "B_precision": 0.4889, "B_recall": 0.4783, "B_f1": 0.4835, "B_f2": 0.4803, "B_accuracy": 0.5104, "B_mcc": 0.0183, "B_tp": 22, "B_fp": 23, "B_tn": 27, "B_fn": 24, "D_sharpe": -0.0917, "D_sortino": -0.0932, "D_excess_sharpe": 0.3324, "D_return_pct": -1.36, "D_hit_rate": 50.53, "D_n": 96, "D_bh_sharpe": -0.4241, "D_bh_return_pct": -3.73, "D_psr": 0.4776, "D_ic": -0.0113, "D_precision": 0.4211, "D_recall": 0.1778, "D_f1": 0.25, "D_f2": 0.201, "D_accuracy": 0.5, "D_mcc": -0.0475, "D_tp": 8, "D_fp": 11, "D_tn": 40, "D_fn": 37, "sharpe": -0.0917, "sortino": -0.0932, "return_pct": -1.36, "equity": 986.4, "max_dd": 0.0, "win_rate": 50.53, "profit_factor": 0.0, "ic": -0.0113, "hit": 50.53, "psr": 0.4776, "bh_sharpe": -0.4241, "bh_return_pct": -3.73, "excess_sharpe": 0.3324, "precision": 0.4211, "recall": 0.1778, "f1": 0.25, "f2": 0.201, "mcc": -0.0475, "accuracy": 0.5, "tp": 8, "fp": 11, "tn": 40, "fn": 37}, {"fold": "fold_5", "regime": "2018 Vol-mageddon + Q4 sell-off", "n": 54, "A_sharpe": -0.7855, "A_sortino": -0.8035, "A_excess_sharpe": -2.2134, "A_return_pct": -2.42, "A_hit_rate": 48.15, "A_n": 54, "A_bh_sharpe": 1.428, "A_bh_return_pct": 3.97, "A_psr": 0.3604, "A_ic": -0.198, "A_precision": 0.6667, "A_recall": 0.069, "A_f1": 0.125, "A_f2": 0.084, "A_accuracy": 0.4815, "A_mcc": 0.0631, "A_tp": 2, "A_fp": 1, "A_tn": 24, "A_fn": 27, "B_sharpe": -3.3561, "B_sortino": -3.2831, "B_excess_sharpe": -8.2883, "B_return_pct": -20.23, "B_hit_rate": 37.04, "B_n": 54, "B_bh_sharpe": 4.9322, "B_bh_return_pct": 34.93, "B_psr": 0.0665, "B_ic": -0.4675, "B_precision": 0.5714, "B_recall": 0.3243, "B_f1": 0.4138, "B_f2": 0.355, "B_accuracy": 0.3704, "B_mcc": -0.1954, "B_tp": 12, "B_fp": 9, "B_tn": 8, "B_fn": 25, "D_sharpe": -0.7855, "D_sortino": -0.8035, "D_excess_sharpe": -2.2134, "D_return_pct": -2.42, "D_hit_rate": 48.15, "D_n": 54, "D_bh_sharpe": 1.428, "D_bh_return_pct": 3.97, "D_psr": 0.3604, "D_ic": -0.198, "D_precision": 0.6667, "D_recall": 0.069, "D_f1": 0.125, "D_f2": 0.084, "D_accuracy": 0.4815, "D_mcc": 0.0631, "D_tp": 2, "D_fp": 1, "D_tn": 24, "D_fn": 27, "sharpe": -0.7855, "sortino": -0.8035, "return_pct": -2.42, "equity": 975.8, "max_dd": 0.0, "win_rate": 48.15, "profit_factor": 0.0, "ic": -0.198, "hit": 48.15, "psr": 0.3604, "bh_sharpe": 1.428, "bh_return_pct": 3.97, "excess_sharpe": -2.2134, "precision": 0.6667, "recall": 0.069, "f1": 0.125, "f2": 0.084, "mcc": 0.0631, "accuracy": 0.4815, "tp": 2, "fp": 1, "tn": 24, "fn": 27}, {"fold": "fold_6", "regime": "COVID crash and V-recovery", "n": 75, "A_sharpe": -4.1875, "A_sortino": -4.149, "A_excess_sharpe": -8.4869, "A_return_pct": -12.83, "A_hit_rate": 33.33, "A_n": 75, "A_bh_sharpe": 4.2994, "A_bh_return_pct": 14.68, "A_psr": 0.0171, "A_ic": -0.0535, "A_precision": 0.6667, "A_recall": 0.0392, "A_f1": 0.0741, "A_f2": 0.0483, "A_accuracy": 0.3333, "A_mcc": -0.0058, "A_tp": 2, "A_fp": 1, "A_tn": 23, "A_fn": 49, "B_sharpe": 3.554, "B_sortino": 3.5755, "B_excess_sharpe": -10.7799, "B_return_pct": 28.51, "B_hit_rate": 61.33, "B_n": 75, "B_bh_sharpe": 14.3339, "B_bh_return_pct": 120.13, "B_psr": 0.9703, "B_ic": 0.102, "B_precision": 0.925, "B_recall": 0.5873, "B_f1": 0.7184, "B_f2": 0.6336, "B_accuracy": 0.6133, "B_mcc": 0.2479, "B_tp": 37, "B_fp": 3, "B_tn": 9, "B_fn": 26, "D_sharpe": -4.1875, "D_sortino": -4.149, "D_excess_sharpe": -8.4869, "D_return_pct": -12.83, "D_hit_rate": 33.33, "D_n": 75, "D_bh_sharpe": 4.2994, "D_bh_return_pct": 14.68, "D_psr": 0.0171, "D_ic": -0.0535, "D_precision": 0.6667, "D_recall": 0.0392, "D_f1": 0.0741, "D_f2": 0.0483, "D_accuracy": 0.3333, "D_mcc": -0.0058, "D_tp": 2, "D_fp": 1, "D_tn": 23, "D_fn": 49, "sharpe": -4.1875, "sortino": -4.149, "return_pct": -12.83, "equity": 871.7, "max_dd": 0.0, "win_rate": 33.33, "profit_factor": 0.0, "ic": -0.0535, "hit": 33.33, "psr": 0.0171, "bh_sharpe": 4.2994, "bh_return_pct": 14.68, "excess_sharpe": -8.4869, "precision": 0.6667, "recall": 0.0392, "f1": 0.0741, "f2": 0.0483, "mcc": -0.0058, "accuracy": 0.3333, "tp": 2, "fp": 1, "tn": 23, "fn": 49}, {"fold": "fold_7", "regime": "Inflation bear, AI rally and 2025", "n": 114, "A_sharpe": -0.492, "A_sortino": -0.4973, "A_excess_sharpe": -3.3371, "A_return_pct": -3.97, "A_hit_rate": 48.25, "A_n": 114, "A_bh_sharpe": 2.845, "A_bh_return_pct": 21.34, "A_psr": 0.3711, "A_ic": -0.0461, "A_precision": 0.6, "A_recall": 0.3582, "A_f1": 0.4486, "A_f2": 0.3896, "A_accuracy": 0.4825, "A_mcc": 0.0183, "A_tp": 24, "A_fp": 16, "A_