{"experiment_num": 64, "backbone": "catboost", "description": "CatBoost @ LightGBM-exp10 config (depth=4 lr=0.01 n_est=1000 seq=60) - 3-way GBM ensemble setup per FX paper section 4.5", "config": {"seq_len": 60, "lr": 0.0003, "batch_size": 32, "epochs": 50, "weight_decay": 1e-05, "patience": 10, "warmup_epochs": 0, "head_dropout": 0.1, "huber_delta": 1.0, "grad_clip": 1.0, "seed": 42, "hidden_size": null, "num_layers": null, "max_depth": 4, "gbm_lr": 0.01, "n_estimators": 1000}, "composite": -0.8395, "test_pos_folds": 4, "val_pos_folds": 2, "val_loss": null, "elapsed_sec": 1316.8, "timestamp": "2026-04-27T22:50:09", "sharpe": 0.2322, "val_sharpe": -0.5395, "ic": 0.011, "hit": 48.87, "psr": 0.6843, "equity": 1121.5, "return_pct": 12.15, "bh_sharpe": 1.2194, "bh_return_pct": 187.05, "excess_sharpe": -0.9872, "B_sharpe": 0.1025, "B_excess_sharpe": -2.7257, "B_return_pct": -22.49, "D_sharpe": 0.1882, "D_excess_sharpe": -1.0312, "D_return_pct": 7.56, "precision": 0.5893, "recall": 0.4541, "f1": 0.513, "f2": 0.476, "mcc": -0.0056, "accuracy": 0.4892, "val_precision": 0.4946, "val_recall": 0.7023, "val_f1": 0.5804, "val_f2": 0.6479, "val_mcc": -0.0292, "val_accuracy": 0.4885, "per_window": [{"fold": "fold_1", "regime": "GFC peak crash (Lehman + Mar-2009 bottom)", "n": 66, "A_sharpe": 0.3047, "A_sortino": 0.3427, "A_excess_sharpe": -0.2674, "A_return_pct": 1.17, "A_hit_rate": 43.94, "A_n": 66, "A_bh_sharpe": 0.5721, "A_bh_return_pct": 3.85, "A_psr": 0.5616, "A_ic": 0.0575, "A_precision": 0.4706, "A_recall": 0.4571, "A_f1": 0.4638, "A_f2": 0.4598, "A_accuracy": 0.4394, "A_mcc": -0.1233, "A_tp": 16, "A_fp": 18, "A_tn": 13, "A_fn": 19, "B_sharpe": 1.7903, "B_sortino": 1.8649, "B_excess_sharpe": -0.2567, "B_return_pct": 32.39, "B_hit_rate": 53.85, "B_n": 66, "B_bh_sharpe": 2.0469, "B_bh_return_pct": 39.28, "B_psr": 0.8182, "B_ic": 0.1537, "B_precision": 0.561, "B_recall": 0.6389, "B_f1": 0.5974, "B_f2": 0.6216, "B_accuracy": 0.5303, "B_mcc": 0.0399, "B_tp": 23, "B_fp": 18, "B_tn": 12, "B_fn": 13, "D_sharpe": 3.0985, "D_sortino": 3.2858, "D_excess_sharpe": 2.5264, "D_return_pct": 32.33, "D_hit_rate": 60.61, "D_n": 66, "D_bh_sharpe": 0.5721, "D_bh_return_pct": 3.85, "D_psr": 0.9445, "D_ic": 0.1354, "D_precision": 0.6098, "D_recall": 0.7143, "D_f1": 0.6579, "D_f2": 0.6906, "D_accuracy": 0.6061, "D_mcc": 0.2039, "D_tp": 25, "D_fp": 16, "D_tn": 15, "D_fn": 10, "sharpe": 0.3047, "sortino": 0.3427, "return_pct": 1.17, "equity": 1011.7, "max_dd": 0.0, "win_rate": 43.94, "profit_factor": 0.0, "ic": 0.0575, "hit": 43.94, "psr": 0.5616, "bh_sharpe": 0.5721, "bh_return_pct": 3.85, "excess_sharpe": -0.2674, "precision": 0.4706, "recall": 0.4571, "f1": 0.4638, "f2": 0.4598, "mcc": -0.1233, "accuracy": 0.4394, "tp": 16, "fp": 18, "tn": 13, "fn": 19}, {"fold": "fold_2", "regime": "2011 US-downgrade + EU debt", "n": 87, "A_sharpe": 3.6093, "A_sortino": 4.8068, "A_excess_sharpe": -1.4127, "A_return_pct": 20.61, "A_hit_rate": 56.98, "A_n": 87, "A_bh_sharpe": 5.022, "A_bh_return_pct": 29.23, "A_psr": 0.9907, "A_ic": 0.1067, "A_precision": 0.6269, "A_recall": 0.7778, "A_f1": 0.6942, "A_f2": 0.742, "A_accuracy": 0.5747, "A_mcc": 0.0233, "A_tp": 42, "A_fp": 25, "A_tn": 8, "A_fn": 12, "B_sharpe": 9.3246, "B_sortino": 9.0544, "B_excess_sharpe": -1.8123, "B_return_pct": 151.56, "B_hit_rate": 78.16, "B_n": 87, "B_bh_sharpe": 11.1369, "B_bh_return_pct": 185.4, "B_psr": 1.0, "B_ic": 0.1194, "B_precision": 0.8395, "B_recall": 0.9189, "B_f1": 0.8774, "B_f2": 0.9019, "B_accuracy": 0.7816, "B_mcc": -0.1141, "B_tp": 68, "B_fp": 13, "B_tn": 0, "B_fn": 6, "D_sharpe": 4.8891, "D_sortino": 6.1088, "D_excess_sharpe": -0.1329, "D_return_pct": 28.42, "D_hit_rate": 62.79, "D_n": 87, "D_bh_sharpe": 5.022, "D_bh_return_pct": 29.23, "D_psr": 0.9993, "D_ic": 0.0391, "D_precision": 0.6296, "D_recall": 0.9444, "D_f1": 0.7556, "D_f2": 0.8586, "D_accuracy": 0.6207, "D_mcc": 0.0677, "D_tp": 51, "D_fp": 30, "D_tn": 3, "D_fn": 3, "sharpe": 3.6093, "sortino": 4.8068, "return_pct": 20.61, "equity": 1206.1, "max_dd": 0.0, "win_rate": 56.98, "profit_factor": 0.0, "ic": 0.1067, "hit": 56.98, "psr": 0.9907, "bh_sharpe": 5.022, "bh_return_pct": 29.23, "excess_sharpe": -1.4127, "precision": 0.6269, "recall": 0.7778, "f1": 0.6942, "f2": 0.742, "mcc": 0.0233, "accuracy": 0.5747, "tp": 42, "fp": 25, "tn": 8, "fn": 12}, {"fold": "fold_3", "regime": "Taper tantrum and 2014 H1", "n": 129, "A_sharpe": 1.9963, "A_sortino": 1.6738, "A_excess_sharpe": 0.2285, "A_return_pct": 13.42, "A_hit_rate": 60.94, "A_n": 129, "A_bh_sharpe": 1.7678, "A_bh_return_pct": 11.76, "A_psr": 0.9076, "A_ic": 0.0635, "A_precision": 0.6063, "A_recall": 0.9872, "A_f1": 0.7512, "A_f2": 0.877, "A_accuracy": 0.6047, "A_mcc": 0.0269, "A_tp": 77, "A_fp": 50, "A_tn": 1, "A_fn": 1, "B_sharpe": 3.2108, "B_sortino": 3.1559, "B_excess_sharpe": -1.0365, "B_return_pct": 45.7, "B_hit_rate": 61.24, "B_n": 129, "B_bh_sharpe": 4.2474, "B_bh_return_pct": 64.1, "B_psr": 0.9869, "B_ic": -0.0857, "B_precision": 0.6356, "B_recall": 0.9146, "B_f1": 0.75, "B_f2": 0.8408, "B_accuracy": 0.6124, "B_mcc": -0.0004, "B_tp": 75, "B_fp": 43, "B_tn": 4, "B_fn": 7, "D_sharpe": 1.6606, "D_sortino": 1.3983, "D_excess_sharpe": -0.1072, "D_return_pct": 10.99, "D_hit_rate": 60.16, "D_n": 129, "D_bh_sharpe": 1.7678, "D_bh_return_pct": 11.76, "D_psr": 0.8685, "D_ic": 0.0773, "D_precision": 0.6102, "D_recall": 0.9231, "D_f1": 0.7347, "D_f2": 0.8372, "D_accuracy": 0.5969, "D_mcc": 0.037, "D_tp": 72, "D_fp": 46, "D_tn": 5, "D_fn": 6, "sharpe": 1.9963, "sortino": 1.6738, "return_pct": 13.42, "equity": 1134.1999999999998, "max_dd": 0.0, "win_rate": 60.94, "profit_factor": 0.0, "ic": 0.0635, "hit": 60.94, "psr": 0.9076, "bh_sharpe": 1.7678, "bh_return_pct": 11.76, "excess_sharpe": 0.2285, "precision": 0.6063, "recall": 0.9872, "f1": 0.7512, "f2": 0.877, "mcc": 0.0269, "accuracy": 0.6047, "tp": 77, "fp": 50, "tn": 1, "fn": 1}, {"fold": "fold_4", "regime": "China devaluation and oil crash", "n": 108, "A_sharpe": -0.8197, "A_sortino": -0.7087, "A_excess_sharpe": -0.1299, "A_return_pct": -7.76, "A_hit_rate": 53.27, "A_n": 108, "A_bh_sharpe": -0.6898, "A_bh_return_pct": -6.71, "A_psr": 0.2941, "A_ic": 0.0397, "A_precision": 0.5217, "A_recall": 0.6792, "A_f1": 0.5902, "A_f2": 0.6406, "A_accuracy": 0.537, "A_mcc": 0.0825, "A_tp": 36, "A_fp": 33, "A_tn": 22, "A_fn": 17, "B_sharpe": -3.4513, "B_sortino": -3.0307, "B_excess_sharpe": -1.4938, "B_return_pct": -49.27, "B_hit_rate": 42.59, "B_n": 108, "B_bh_sharpe": -1.9575, "B_bh_return_pct": -33.56, "B_psr": 0.0099, "B_ic": -0.1111, "B_precision": 0.4179, "B_recall": 0.549, "B_f1": 0.4746, "B_f2": 0.5166, "B_accuracy": 0.4259, "B_mcc": -0.1391, "B_tp": 28, "B_fp": 39, "B_tn": 18, "B_fn": 23, "D_sharpe": -1.7625, "D_sortino": -1.5901, "D_excess_sharpe": -1.0728, "D_return_pct": -15.01, "D_hit_rate": 46.73, "D_n": 108, "D_bh_sharpe": -0.6898, "D_bh_return_pct": -6.71, "D_psr": 0.1202, "D_ic": -0.0324, "D_precision": 0.4627, "D_recall": 0.5849, "D_f1": 0.5167, "D_f2": 0.5556, "D_accuracy": 0.463, "D_mcc": -0.0717, "D_tp": 31, "D_fp": 36, "D_tn": 19, "D_fn": 22, "sharpe": -0.8197, "sortino": -0.7087, "return_pct": -7.76, "equity": 922.4, "max_dd": 0.0, "win_rate": 53.27, "profit_factor": 0.0, "ic": 0.0397, "hit": 53.27, "psr": 0.2941, "bh_sharpe": -0.6898, "bh_return_pct": -6.71, "excess_sharpe": -0.1299, "precision": 0.5217, "recall": 0.6792, "f1": 0.5902, "f2": 0.6406, "mcc": 0.0825, "accuracy": 0.537, "tp": 36, "fp": 33, "tn": 22, "fn": 17}, {"fold": "fold_5", "regime": "2018 Vol-mageddon + Q4 sell-off", "n": 128, "A_sharpe": -0.7474, "A_sortino": -0.7392, "A_excess_sharpe": -1.8985, "A_return_pct": -9.87, "A_hit_rate": 50.0, "A_n": 128, "A_bh_sharpe": 1.1511, "A_bh_return_pct": 13.19, "A_psr": 0.2998, "A_ic": -0.0589, "A_precision": 0.5897, "A_recall": 0.5897, "A_f1": 0.5897, "A_f2": 0.5897, "A_accuracy": 0.5, "A_mcc": -0.0503, "A_tp": 46, "A_fp": 32, "A_tn": 18, "A_fn": 32, "B_sharpe": -3.4672, "B_sortino": -3.2805, "B_excess_sharpe": -6.2791, "B_return_pct": -57.61, "B_hit_rate": 37.8, "B_n": 128, "B_bh_sharpe": 2.8119, "B_bh_return_pct": 82.25, "B_psr": 0.0068, "B_ic": -0.1121, "B_precision": 0.5536, "B_recall": 0.3647, "B_f1": 0.4397, "B_f2": 0.3914, "B_accuracy": 0.3828, "B_mcc": -0.2063, "B_tp": 31, "B_fp": 25, "B_tn": 18, "B_fn": 54, "D_sharpe": -1.9583, "D_sortino": -1.9788, "D_excess_sharpe": -3.1094, "D_return_pct": -21.96, "D_hit_rate": 43.75, "D_n": 128, "D_bh_sharpe": 1.1511, "D_bh_return_pct": 13.19, "D_psr": 0.0899, "D_ic": -0.0973, "D_precision": 0.5536, "D_recall": 0.3974, "D_f1": 0.4627, "D_f2": 0.4212, "D_accuracy": 0.4375, "D_mcc": -0.1009, "D_tp": 31, "D_fp": 25, "D_tn": 25, "D_fn": 47, "sharpe": -0.7474, "sortino": -0.7392, "return_pct": -9.87, "equity": 901.3, "max_dd": 0.0, "win_rate": 50.0, "profit_factor": 0.0, "ic": -0.0589, "hit": 50.0, "psr": 0.2998, "bh_sharpe": 1.1511, "bh_return_pct": 13.19, "excess_sharpe": -1.8985, "precision": 0.5897, "recall": 0.5897, "f1": 0.5897, "f2": 0.5897, "mcc": -0.0503, "accuracy": 0.5, "tp": 46, "fp": 32, "tn": 18, "fn": 32}, {"fold": "fold_6", "regime": "COVID crash and V-recovery", "n": 173, "A_sharpe": 1.731, "A_sortino": 2.0154, "A_excess_sharpe": -0.595, "A_return_pct": 30.57, "A_hit_rate": 50.87, "A_n": 173, "A_bh_sharpe": 2.3261, "A_bh_return_pct": 43.81, "A_psr": 0.9276, "A_ic": 0.0878, "A_precision": 0.7059, "A_recall": 0.4248, "A_f1": 0.5304, "A_f2": 0.4615, "A_accuracy": 0.5087, "A_mcc": 0.0891, "A_tp": 48, "A_fp": 20, "A_tn": 40, "A_fn": 65, "B_sharpe": 1.3683, "B_sortino": 1.5374, "B_excess_sharpe": -4.3777, "B_return_pct": 47.23, "B_hit_rate": 51.16, "B_n": 173, "B_bh_sharpe": 5.746, "B_bh_return_pct": 499.04, "B_psr": 0.8749, "B_ic": 0.0772, "B_precision": 0.6957, "B_recall": 0.4324, "B_f1": 0.5333, "B_f2": 0.4678, "B_accuracy": 0.5145, "B_mcc": 0.0918, "B_tp": 48, "B_fp": 21, "B_tn": 41, "B_fn": 63, "D_sharpe": -0.009, "D_sortino": -0.0105, "D_excess_sharpe": -2.335, "D_return_pct": -2.14, "D_hit_rate": 42.2, "D_n": 173, "D_bh_sharpe": 2.3261, "D_bh_return_pct": 43.81, "D_psr": 0.497, "D_ic": -0.0319, "D_precision": 0.5942, "D_recall": 0.3628, "D_f1": 0.4505, "D_f2": 0.3935, "D_accuracy": 0.422, "D_mcc": -0.1009, "D_tp": 41, "D_fp": 28, "D_tn": 32, "D_fn": 72, "sharpe": 1.731, "sortino": 2.0154, "return_pct": 30.57, "equity": 1305.7, "max_dd": 0.0, "win_rate": 50.87, "profit_factor": 0.0, "ic": 0.0878, "hit": 50.87, "psr": 0.9276, "bh_sharpe": 2.3261, "bh_return_pct": 43.81, "excess_sharpe": -0.595, "precision": 0.7059, "recall": 0.4248, "f1": 0.5304, "f2": 0.4615, "mcc": 0.0891, "accuracy": 0.5087, "tp": 48, "fp": 20, "tn": 40, "fn": 65}, {"fold": "fold_7", "regime": "Inflation bear, AI rally and 2025", "n": 376, "A_sharpe": -0.7624, "A_sortino": -0.9042, "A_excess_sharpe": -1.5657, "A_return_pct": -25.34, "A_hit_rate": 41.22, "A_n": 376, "A_bh_sharpe": 0.8033, "A_bh_return_pct": 26.02, "A_psr": 0.1855, "A_ic": 0.0027, "A_precision": 0.5, "A_recall": 0.0995, "A_f1": 0.166, "A_f2": 0.1185, "A_accuracy": 0.4122, "A_mcc": -0.0649, "A_tp": 22, "A_fp": 22, "A_tn": 133, "A_fn": 199, "B_sharpe": -0.7551, "B_sortino": -0.8591, "B_excess_sharpe": -2.6868, "B_return_pct": -49.55, "B_hit_rate": 41.07, "B_n": 376, "B_bh_sharpe": 1.9317, "B_bh_return_pct": 222.05, "B_psr": 0.1822, "B_ic": 0.0169, "B_precision": 0.875, "B_recall": 0.0308, "B_f1": 0.0596, "B_f2": 0.0382, "B_accuracy": 0.4122, "B_mcc": 0.0818, "B_tp": 7, "B_fp": 1, "B_tn": 148, "B_fn": 220, "D_sharpe": -0.2763, "D_sortino": -0.3543, "D_excess_sharpe": -1.0796, "D_return_pct": -12.14, "D_hit_rate": 41.76, "D_n": 376, "D_bh_sharpe": 0.8033, "D_bh_return_pct": 26.02, "D_psr": 0.3702, "D_ic": -0.0044, "D_precision": 0.625, "D_recall": 0.0226, "D_f1": 0.0437, "D_f2": 0.028, "D_accuracy": 0.4176, "D_mcc": 0.0112, "D_tp": 5, "D_fp": 3, "D_tn": 152, "D_fn": 216, "sharpe": -0.7624, "sortino": -0.9042, "return_pct": -25.34, "equity": 746.5999999999999, "max_dd": 0.0, "win_rate": 41.22, "profit_factor": 0.0, "ic": 0.0027, "hit": 41.22, "psr": 0.1855, "bh_sharpe": 0.8033, "bh_return_pct": 26.02, "excess_sharpe": -1.5657, "precision": 0.5, "recall": 0.0995, "f1": 0.166, "f2": 0.1185, "mcc": -0.0649, "accuracy": 0.4122, "tp": 22, "fp": 22, "tn": 133, "fn": 199}], "per_window_val": [{"fold": "fold_1", "regime": "GFC peak crash (Lehman + Mar-2009 bottom)", "n": 65, "A_sharpe": -1.7038, "A_sortino": -1.5563, "A_excess_sharpe": 0.5219, "A_return_pct": -15.03, "A_hit_rate": 44.44, "A_n": 65, "A_bh_sharpe": -2.2257, "A_bh_return_pct": -18.74, "A_psr": 0.188, "A_ic": 0.0555, "A_precision": 0.4355, "A_recall": 0.931, "A_f1": 0.5934, "A_f2": 0.7584, "A_accuracy": 0.4308, "A_mcc": -0.0976, "A_tp": 27, "A_fp": 35, "A_tn": 1, "A_fn": 2, "B_sharpe": -1.5555, "B_sortino": -1.7881, "B_excess_sharpe": 5.5669, "B_return_pct": -30.49, "B_hit_rate": 41.54, "B_n": 65, "B_bh_sharpe": -7.1223, "B_bh_return_pct": -73.11, "B_psr": 0.2303, "B_ic": 0.4838, "B_precision": 0.377, "B_recall": 1.0, "B_f1": 0.5476, "B_f2": 0.7516, "B_accuracy": 0.4154, "B_mcc": 0.1895, "B_tp": 23, "B_fp": 38, "B_tn": 4, "B_fn": 0, "D_sharpe": 0.2549, "D_sortino": 0.2518, "D_excess_sharpe": 2.4806, "D_return_pct": 0.76, "D_hit_rate": 52.38, "D_n": 65, "D_bh_sharpe": -2.2257, "D_bh_return_pct": -18.74, "D_psr": 0.5513, "D_ic": 0.2674, "D_precision": 0.4754, "D_recall": 1.0, "D_f1": 0.6444, "D_f2": 0.8192, "D_accuracy": 0.5077, "D_mcc": 0.2298, "D_tp": 29, "D_fp": 32, "D_tn": 4, "D_fn": 0, "sharpe": -1.7038, "sortino": -1.5563, "return_pct": -15.03, "equity": 849.7, "max_dd": 0.0, "win_rate": 44.44, "profit_factor": 0.0, "ic": 0.0555, "hit": 44.44, "psr": 0.188, "bh_sharpe": -2.2257, "bh_return_pct": -18.74, "excess_sharpe": 0.5219, "precision": 0.4355, "recall": 0.931, "f1": 0.5934, "f2": 0.7584, "mcc": -0.0976, "accuracy": 0.4308, "tp": 27, "fp": 35, "tn": 1, "fn": 2}, {"fold": "fold_2", "regime": "2011 US-downgrade + EU debt", "n": 47, "A_sharpe": 1.9641, "A_sortino": 1.6644, "A_excess_sharpe": 2.1582, "A_return_pct": 12.18, "A_hit_rate": 63.83, "A_n": 47, "A_bh_sharpe": -0.1941, "A_bh_return_pct": -2.36, "A_psr": 0.7906, "A_ic": 0.0458, "A_precision": 0.6098, "A_recall": 0.9615, "A_f1": 0.7463, "A_f2": 0.8621, "A_accuracy": 0.6383, "A_mcc": 0.2974, "A_tp": 25, "A_fp": 16, "A_tn": 5, "A_fn": 1, "B_sharpe": -1.525, "B_sortino": -1.3885, "B_excess_sharpe": 0.0873, "B_return_pct": -23.38, "B_hit_rate": 46.81, "B_n": 47, "B_bh_sharpe": -1.6123, "B_bh_return_pct": -24.3, "B_psr": 0.2525, "B_ic": 0.2446, "B_precision": 0.4565, "B_recall": 1.0, "B_f1": 0.6269, "B_f2": 0.8077, "B_accuracy": 0.4681, "B_mcc": 0.1325, "B_tp": 21, "B_fp": 25, "B_tn": 1, "B_fn": 0, "D_sharpe": -0.2446, "D_sortino": -0.2184, "D_excess_sharpe": -0.0505, "D_return_pct": -2.68, "D_hit_rate": 53.19, "D_n": 47, "D_bh_sharpe": -0.1941, "D_bh_return_pct": -2.36, "D_psr": 0.4582, "D_ic": 0.0547, "D_precision": 0.5435, "D_recall": 0.9615, "D_f1": 0.6944, "D_f2": 0.8333, "D_accuracy": 0.5319, "D_mcc": -0.1325, "D_tp": 25, "D_fp": 21, "D_tn": 0, "D_fn": 1, "sharpe": 1.9641, "sortino": 1.6644, "return_pct": 12.18, "equity": 1121.8, "max_dd": 0.0, "win_rate": 63.83, "profit_factor": 0.0, "ic": 0.0458, "hit": 63.83, "psr": 0.7906, "bh_sharpe": -0.1941, "bh_return_pct": -2.36, "excess_sharpe": 2.1582, "precision": 0.6098, "recall": 0.9615, "f1": 0.7463, "f2": 0.8621, "mcc": 0.2974, "accuracy": 0.6383, "tp": 25, "fp": 16, "tn": 5, "fn": 1}, {"fold": "fold_3", "regime": "Taper tantrum and 2014 H1", "n": 5, "A_sharpe": -28.2393, "A_sortino": -13.8379, "A_excess_sharpe": -26.9199, "A_return_pct": -2.15, "A_hit_rate": 0.0, "A_n": 5, "A_bh_sharpe": -1.3194, "A_bh_return_pct": -0.21, "A_psr": 0.0, "A_ic": -0.7, "A_precision": 0.0, "A_recall": 0.0, "A_f1": 0.0, "A_f2": 0.0, "A_accuracy": 0.0, "A_mcc": -1.0, "A_tp": 0, "A_fp": 3, "A_tn": 0, "A_fn": 2, "B_sharpe": -18.6944, "B_sortino": -10.8783, "B_excess_sharpe": 7.1762, "B_return_pct": -3.45, "B_hit_rate": 20.0, "B_n": 5, "B_bh_sharpe": -25.8705, "B_bh_return_pct": -3.84, "B_psr": 0.0009, "B_ic": -0.5, "B_precision": 0.0, "B_recall": 0.0, "B_f1": 0.0, "B_f2": 0.0, "B_accuracy": 0.2, "B_mcc": 0.0, "B_tp": 0, "B_fp": 4, "B_tn": 1, "B_fn": 0, "D_sharpe": -5.9118, "D_sortino": -6.1066, "D_excess_sharpe": -4.5924, "D_return_pct": -0.87, "D_hit_rate": 20.0, "D_n": 5, "D_bh_sharpe": -1.3194, "D_bh_return_pct": -0.21, "D_psr": 0.241, "D_ic": -0.5, "D_precision": 0.25, "D_recall": 0.5, "D_f1": 0.3333, "D_f2": 0.4167, "D_accuracy": 0.2, "D_mcc": -0.6124, "D_tp": 1, "D_fp": 3, "D_tn": 0, "D_fn": 1, "sharpe": -28.2393, "sortino": -13.8379, "return_pct": -2.15, "equity": 978.5, "max_dd": 0.0, "win_rate": 0.0, "profit_factor": 0.0, "ic": -0.7, "hit": 0.0, "psr": 0.0, "bh_sharpe": -1.3194, "bh_return_pct": -0.21, "excess_sharpe": -26.9199, "precision": 0.0, "recall": 0.0, "f1": 0.0, "f2": 0.0, "mcc": -1.0, "accuracy": 0.0, "tp": 0, "fp": 3, "tn": 0, "fn": 2}, {"fold": "fold_4", "regime": "China devaluation and oil crash", "n": 47, "A_sharpe": -1.8238, "A_sortino": -1.7153, "A_excess_sharpe": 0.0, "A_return_pct": -8.68, "A_hit_rate": 44.68, "A_n": 47, "A_bh_sharpe": -1.8238, "A_bh_return_pct": -8.68, "A_psr": 0.2173, "A_ic": 0.0593, "A_precision": 0.4468, "A_recall": 1.0, "A_f1": 0.6176, "A_f2": 0.8015, "A_accuracy": 0.4468, "A_mcc": 0.0, "A_tp": 21, "A_fp": 26, "A_tn": 0, "A_fn": 0, "B_sharpe": -2.3514, "B_sortino": -2.0531, "B_excess_sharpe": -0.1314, "B_return_pct": -25.04, "B_hit_rate": 42.55, "B_n": 47, "B_bh_sharpe": -2.22, "B_bh_return_pct": -23.98, "B_psr": 0.1358, "B_ic": 0.6131, "B_precision": 0.4348, "B_recall": 0.9524, "B_f1": 0.597, "B_f2": 0.7692, "B_accuracy": 0.4255, "B_mcc": -0.1641, "B_tp": 20, "B_fp": 26, "B_tn": 0, "B_fn": 1, "D_sharpe": -0.4563, "D_sortino": -0.4562, "D_excess_sharpe": 1.3675, "D_return_pct": -2.69, "D_hit_rate": 46.81, "D_n": 47, "D_bh_sharpe": -1.8238, "D_bh_return_pct": -8.68, "D_psr": 0.4227, "D_ic": 0.2663, "D_precision": 0.4565, "D_recall": 1.0, "D_f1": 0.6269, "D_f2": 0.8077, "D_accuracy": 0.4681, "D_mcc": 0.1325, "D_tp": 21, "D_fp": 25, "D_tn": 1, "D_fn": 0, "sharpe": -1.8238, "sortino": -1.7153, "return_pct": -8.68, "equity": 913.2, "max_dd": 0.0, "win_rate": 44.68, "profit_factor": 0.0, "ic": 0.0593, "hit": 44.68, "psr": 0.2173, "bh_sharpe": -1.8238, "bh_return_pct": -8.68, "excess_sharpe": 0.0, "precision": 0.4468, "recall": 1.0, "f1": 0.6176, "f2": 0.8015, "mcc": 0.0, "accuracy": 0.4468, "tp": 21, "fp": 26, "tn": 0, "fn": 0}, {"fold": "fold_5", "regime": "2018 Vol-mageddon + Q4 sell-off", "n": 5, "A_sharpe": -10.1368, "A_sortino": -6.9937, "A_excess_sharpe": 0.0, "A_return_pct": -3.15, "A_hit_rate": 40.0, "A_n": 5, "A_bh_sharpe": -10.1368, "A_bh_return_pct": -3.15, "A_psr": 0.0985, "A_ic": 0.0, "A_precision": 0.4, "A_recall": 1.0, "A_f1": 0.5714, "A_f2": 0.7692, "A_accuracy": 0.4, "A_mcc": 0.0, "A_tp": 2, "A_fp": 3, "A_tn": 0, "A_fn": 0, "B_sharpe": 5.6858, "B_sortino": 6.0578, "B_excess_sharpe": 0.0, "B_return_pct": 4.22, "B_hit_rate": 60.0, "B_n": 5, "B_bh_sharpe": 5.6858, "B_bh_return_pct": 4.22, "B_psr": 0.753, "B_ic": 0.3, "B_precision": 0.6, "B_recall": 1.0, "B_f1": 0.75, "B_f2": 0.8824, "B_accuracy": 0.6, "B_mcc": 0.0, "B_tp": 3, "B_fp": 2, "B_tn": 0, "B_fn": 0, "D_sharpe": -10.1368, "D_sortino": -6.9937, "D_excess_sharpe": 0.0, "D_return_pct": -3.15, "D_hit_rate": 40.0, "D_n": 5, "D_bh_sharpe": -10.1368, "D_bh_return_pct": -3.15, "D_psr": 0.0985, "D_ic": 0.1, "D_precision": 0.4, "D_recall": 1.0, "D_f1": 0.5714, "D_f2": 0.7692, "D_accuracy": 0.4, "D_mcc": 0.0, "D_tp": 2, "D_fp": 3, "D_tn": 0, "D_fn": 0, "sharpe": -10.1368, "sortino": -6.9937, "return_pct": -3.15, "equity": 968.5, "max_dd": 0.0, "win_rate": 40.0, "profit_factor": 0.0, "ic": 0.0, "hit": 40.0, "psr": 0.0985, "bh_sharpe": -10.1368, "bh_return_pct": -3.15, "excess_sharpe": 0.0, "precision": 0.4, "recall": 1.0, "f1": 0.5714, "f2": 0.7692, "mcc": 0.0, "accuracy": 0.4, "tp": 2, "fp": 3, "tn": 0, "fn": 0}, {"fold": "fold_6", "regime": "COVID crash and V-recovery", "n": 26, "A_sharpe": 4.5182, "A_sortino": 4.1078, "A_excess_sharpe": 1.233, "A_return_pct": 6.61, "A_hit_rate": 65.38, "A_n": 26, "A_bh_sharpe": 3.2852, "A_bh_return_pct": 4.82, "A_psr": 0.9025, "A_ic": 0.0947, "A_precision": 0.64, "A_recall": 1.0, "A_f1": 0.7805, "A_f2": 0.8989, "A_accuracy": 0.6538, "A_mcc": 0.253, "A_tp": 16, "A_fp": 9, "A_tn": 1, "A_fn": 0, "B_sharpe": 10.6522, "B_sortino": 11.2214, "B_excess_sharpe": -2.327, "B_return_pct": 33.34, "B_hit_rate": 76.92, "B_n": 26, "B_bh_sharpe": 12.9792, "B_bh_return_pct": 38.76, "B_psr": 0.9988, "B_ic": 0.4865, "B_precision": 1.0, "B_recall": 0.7143, "B_f1": 0.8333, "B_f2": 0.7576, "B_accuracy": 0.7692, "B_mcc": 0.5698, "B_tp": 15, "B_fp": 0, "B_tn": 5, "B_fn": 6, "D_sharpe": 3.871, "D_sortino": 4.4786, "D_excess_sharpe": 0.5859, "D_return_pct": 5.68, "D_hit_rate": 57.69, "D_n": 26, "D_bh_sharpe": 3.2852, "D_bh_return_pct": 4.82, "D_psr": 0.8926, "D_ic": 0.2274, "D_precision": 0.6667, "D_recall": 0.625, "D_f1": 0.6452, "D_f2": 0.6329, "D_accuracy": 0.5769, "D_mcc": 0.1231, "D_tp": 10, "D_fp": 5, "D_tn": 5, "D_fn": 6, "sharpe": 4.5182, "sortino": 4.1078, "return_pct": 6.61, "equity": 1066.1000000000001, "max_dd": 0.0, "win_rate": 65.38, "profit_factor": 0.0, "ic": 0.0947, "hit": 65.38, "psr": 0.9025, "bh_sharpe": 3.2852, "bh_return_pct": 4.82, "excess_sharpe": 1.233, "precision": 0.64, "recall": 1.0, "f1": 0.7805, "f2": 0.8989, "mcc": 0.253, "accuracy": 0.6538, "tp": 16, "fp": 9, "tn": 1, "fn": 0}, {"fold": "fold_7", "regime": "Inflation bear, AI rally and 2025", "n": 65, "A_sharpe": -1.3446, "A_sortino": -1.2998, "A_excess_sharpe": -3.4236, "A_return_pct": -5.45, "A_hit_rate": 44.62, "A_n": 65, "A_bh_sharpe": 2.0789, "A_bh_return_pct": 8.17, "A_psr": 0.2472, "A_ic": 0.0768, "A_precision": 0.3333, "A_recall": 0.0286, "A_f1": 0.0526, "A_f2": 0.035, "A_accuracy": 0.4462, "A_mcc": -0.0905, "A_tp": 1, "A_fp": 2, "A_tn": 28, "A_fn": 34, "B_sharpe": -5.2314, "B_sortino": -4.8393, "B_excess_sharpe": -10.4628, "B_return_pct": -32.36, "B_hit_rate": 32.31, "B_n": 65, "B_bh_sharpe": 5.2314, "B_bh_return_pct": 44.53, "B_p