{"experiment_num": 19, "backbone": "mamba", "description": "dMamba @ FX-Mamba-winner config seed=0 \u2014 multi-seed variance verification on the new global champion (exp 17 was seed=42)", "config": {"seq_len": 60, "lr": 0.0005, "batch_size": 32, "epochs": 100, "weight_decay": 0.1, "patience": 20, "warmup_epochs": 10, "head_dropout": 0.1, "huber_delta": 1.0, "grad_clip": 1.0, "seed": 0, "hidden_size": null, "num_layers": null, "max_depth": null, "gbm_lr": null, "n_estimators": null}, "composite": 0.0169, "test_pos_folds": 5, "val_pos_folds": 4, "val_loss": -2.8395934653493153, "elapsed_sec": 888.7, "timestamp": "2026-04-26T22:37:34", "sharpe": 0.5952, "val_sharpe": 0.2169, "ic": -0.0071, "hit": 56.29, "psr": 0.8896, "equity": 1581.3999999999999, "return_pct": 58.14, "bh_sharpe": 1.2201, "bh_return_pct": 185.59, "excess_sharpe": -0.6249, "B_sharpe": 1.1815, "B_excess_sharpe": -1.6569, "B_return_pct": 539.75, "D_sharpe": 0.5952, "D_excess_sharpe": -0.6249, "D_return_pct": 58.14, "per_window": [{"fold": "fold_1", "regime": "GFC peak crash (Lehman + Mar-2009 bottom)", "n": 65, "A_sharpe": 0.1506, "A_sortino": 0.1525, "A_excess_sharpe": -0.2756, "A_return_pct": -0.36, "A_hit_rate": 50.77, "A_n": 65, "A_bh_sharpe": 0.4262, "A_bh_return_pct": 2.34, "A_psr": 0.5303, "A_ic": -0.032, "B_sharpe": 1.45, "B_sortino": 1.5832, "B_excess_sharpe": -0.4376, "B_return_pct": 23.48, "B_hit_rate": 51.56, "B_n": 65, "B_bh_sharpe": 1.8877, "B_bh_return_pct": 34.48, "B_psr": 0.769, "B_ic": 0.0666, "D_sharpe": 0.1506, "D_sortino": 0.1525, "D_excess_sharpe": -0.2756, "D_return_pct": -0.36, "D_hit_rate": 50.77, "D_n": 65, "D_bh_sharpe": 0.4262, "D_bh_return_pct": 2.34, "D_psr": 0.5303, "D_ic": -0.032, "sharpe": 0.1506, "sortino": 0.1525, "return_pct": -0.36, "equity": 996.4, "max_dd": 0.0, "win_rate": 50.77, "profit_factor": 0.0, "ic": -0.032, "hit": 50.77, "psr": 0.5303, "bh_sharpe": 0.4262, "bh_return_pct": 2.34, "excess_sharpe": -0.2756, "precision": 0.5172, "recall": 0.8824, "f1": 0.6522, "f2": 0.7732, "accuracy": 0.5077, "mcc": -0.0336, "tp": 30, "fp": 28, "tn": 3, "fn": 4, "A_precision": 0.5172, "A_recall": 0.8824, "A_f1": 0.6522, "A_f2": 0.7732, "A_accuracy": 0.5077, "A_mcc": -0.0336, "A_tp": 30, "A_fp": 28, "A_tn": 3, "A_fn": 4}, {"fold": "fold_2", "regime": "2011 US-downgrade + EU debt", "n": 86, "A_sharpe": 5.475, "A_sortino": 6.8978, "A_excess_sharpe": 0.6068, "A_return_pct": 31.55, "A_hit_rate": 64.71, "A_n": 86, "A_bh_sharpe": 4.8682, "A_bh_return_pct": 27.91, "A_psr": 0.9998, "A_ic": 0.2675, "B_sharpe": 7.293, "B_sortino": 7.5736, "B_excess_sharpe": -4.026, "B_return_pct": 112.17, "B_hit_rate": 73.26, "B_n": 86, "B_bh_sharpe": 11.3191, "B_bh_return_pct": 186.84, "B_psr": 1.0, "B_ic": 0.1514, "D_sharpe": 5.475, "D_sortino": 6.8978, "D_excess_sharpe": 0.6068, "D_return_pct": 31.55, "D_hit_rate": 64.71, "D_n": 86, "D_bh_sharpe": 4.8682, "D_bh_return_pct": 27.91, "D_psr": 0.9998, "D_ic": 0.2675, "sharpe": 5.475, "sortino": 6.8978, "return_pct": 31.55, "equity": 1315.5, "max_dd": 0.0, "win_rate": 64.71, "profit_factor": 0.0, "ic": 0.2675, "hit": 64.71, "psr": 0.9998, "bh_sharpe": 4.8682, "bh_return_pct": 27.91, "excess_sharpe": 0.6068, "precision": 0.6375, "recall": 0.9623, "f1": 0.7669, "f2": 0.8733, "accuracy": 0.6395, "mcc": 0.1593, "tp": 51, "fp": 29, "tn": 4, "fn": 2, "A_precision": 0.6375, "A_recall": 0.9623, "A_f1": 0.7669, "A_f2": 0.8733, "A_accuracy": 0.6395, "A_mcc": 0.1593, "A_tp": 51, "A_fp": 29, "A_tn": 4, "A_fn": 2}, {"fold": "fold_3", "regime": "Taper tantrum and 2014 H1", "n": 128, "A_sharpe": 1.6928, "A_sortino": 1.4242, "A_excess_sharpe": -0.3661, "A_return_pct": 11.0, "A_hit_rate": 60.63, "A_n": 128, "A_bh_sharpe": 2.0589, "A_bh_return_pct": 13.6, "A_psr": 0.8719, "A_ic": 0.1389, "B_sharpe": -0.8207, "B_sortino": -0.856, "B_excess_sharpe": -5.3323, "B_return_pct": -10.91, "B_hit_rate": 45.31, "B_n": 128, "B_bh_sharpe": 4.5116, "B_bh_return_pct": 67.92, "B_psr": 0.2808, "B_ic": -0.0614, "D_sharpe": 1.6928, "D_sortino": 1.4242, "D_excess_sharpe": -0.3661, "D_return_pct": 11.0, "D_hit_rate": 60.63, "D_n": 128, "D_bh_sharpe": 2.0589, "D_bh_return_pct": 13.6, "D_psr": 0.8719, "D_ic": 0.1389, "sharpe": 1.6928, "sortino": 1.4242, "return_pct": 11.0, "equity": 1110.0, "max_dd": 0.0, "win_rate": 60.63, "profit_factor": 0.0, "ic": 0.1389, "hit": 60.63, "psr": 0.8719, "bh_sharpe": 2.0589, "bh_return_pct": 13.6, "excess_sharpe": -0.3661, "precision": 0.6116, "recall": 0.9487, "f1": 0.7437, "f2": 0.8545, "accuracy": 0.6016, "mcc": 0.0187, "tp": 74, "fp": 47, "tn": 3, "fn": 4, "A_precision": 0.6116, "A_recall": 0.9487, "A_f1": 0.7437, "A_f2": 0.8545, "A_accuracy": 0.6016, "A_mcc": 0.0187, "A_tp": 74, "A_fp": 47, "A_tn": 3, "A_fn": 4}, {"fold": "fold_4", "regime": "China devaluation and oil crash", "n": 107, "A_sharpe": -0.3486, "A_sortino": -0.326, "A_excess_sharpe": 0.4546, "A_return_pct": -3.85, "A_hit_rate": 50.94, "A_n": 107, "A_bh_sharpe": -0.8032, "A_bh_return_pct": -7.58, "A_psr": 0.4103, "A_ic": 0.0506, "B_sharpe": 2.9436, "B_sortino": 3.1413, "B_excess_sharpe": 4.9032, "B_return_pct": 65.26, "B_hit_rate": 57.01, "B_n": 107, "B_bh_sharpe": -1.9596, "B_bh_return_pct": -33.47, "B_psr": 0.9718, "B_ic": 0.364, "D_sharpe": -0.3486, "D_sortino": -0.326, "D_excess_sharpe": 0.4546, "D_return_pct": -3.85, "D_hit_rate": 50.94, "D_n": 107, "D_bh_sharpe": -0.8032, "D_bh_return_pct": -7.58, "D_psr": 0.4103, "D_ic": 0.0506, "sharpe": -0.3486, "sortino": -0.326, "return_pct": -3.85, "equity": 961.5, "max_dd": 0.0, "win_rate": 50.94, "profit_factor": 0.0, "ic": 0.0506, "hit": 50.94, "psr": 0.4103, "bh_sharpe": -0.8032, "bh_return_pct": -7.58, "excess_sharpe": 0.4546, "precision": 0.4949, "recall": 0.9423, "f1": 0.649, "f2": 0.798, "accuracy": 0.5047, "mcc": 0.0631, "tp": 49, "fp": 50, "tn": 5, "fn": 3, "A_precision": 0.4949, "A_recall": 0.9423, "A_f1": 0.649, "A_f2": 0.798, "A_accuracy": 0.5047, "A_mcc": 0.0631, "A_tp": 49, "A_fp": 50, "A_tn": 5, "A_fn": 3}, {"fold": "fold_5", "regime": "2018 Vol-mageddon + Q4 sell-off", "n": 127, "A_sharpe": 0.9288, "A_sortino": 0.8554, "A_excess_sharpe": -0.2542, "A_return_pct": 10.17, "A_hit_rate": 59.84, "A_n": 127, "A_bh_sharpe": 1.183, "A_bh_return_pct": 13.55, "A_psr": 0.7451, "A_ic": 0.0776, "B_sharpe": 0.0096, "B_sortino": 0.01, "B_excess_sharpe": -2.896, "B_return_pct": -5.16, "B_hit_rate": 46.03, "B_n": 127, "B_bh_sharpe": 2.9056, "B_bh_return_pct": 85.51, "B_psr": 0.5027, "B_ic": 0.2137, "D_sharpe": 0.9288, "D_sortino": 0.8554, "D_excess_sharpe": -0.2542, "D_return_pct": 10.17, "D_hit_rate": 59.84, "D_n": 127, "D_bh_sharpe": 1.183, "D_bh_return_pct": 13.55, "D_psr": 0.7451, "D_ic": 0.0776, "sharpe": 0.9288, "sortino": 0.8554, "return_pct": 10.17, "equity": 1101.6999999999998, "max_dd": 0.0, "win_rate": 59.84, "profit_factor": 0.0, "ic": 0.0776, "hit": 59.84, "psr": 0.7451, "bh_sharpe": 1.183, "bh_return_pct": 13.55, "excess_sharpe": -0.2542, "precision": 0.6134, "recall": 0.9359, "f1": 0.7411, "f2": 0.8469, "accuracy": 0.5984, "mcc": -0.0058, "tp": 73, "fp": 46, "tn": 3, "fn": 5, "A_precision": 0.6134, "A_recall": 0.9359, "A_f1": 0.7411, "A_f2": 0.8469, "A_accuracy": 0.5984, "A_mcc": -0.0058, "A_tp": 73, "A_fp": 46, "A_tn": 3, "A_fn": 5}, {"fold": "fold_6", "regime": "COVID crash and V-recovery", "n": 172, "A_sharpe": 0.7356, "A_sortino": 0.7709, "A_excess_sharpe": -1.692, "A_return_pct": 10.71, "A_hit_rate": 52.91, "A_n": 172, "A_bh_sharpe": 2.4276, "A_bh_return_pct": 45.89, "A_psr": 0.7293, "A_ic": -0.0307, "B_sharpe": 0.2179, "B_sortino": 0.2357, "B_excess_sharpe": -5.4941, "B_return_pct": -1.16, "B_hit_rate": 48.54, "B_n": 172, "B_bh_sharpe": 5.712, "B_bh_return_pct": 489.18, "B_psr": 0.5714, "B_ic": 0.0075, "D_sharpe": 0.7356, "D_sortino": 0.7709, "D_excess_sharpe": -1.692, "D_return_pct": 10.71, "D_hit_rate": 52.91, "D_n": 172, "D_bh_sharpe": 2.4276, "D_bh_return_pct": 45.89, "D_psr": 0.7293, "D_ic": -0.0307, "sharpe": 0.7356, "sortino": 0.7709, "return_pct": 10.71, "equity": 1107.1, "max_dd": 0.0, "win_rate": 52.91, "profit_factor": 0.0, "ic": -0.0307, "hit": 52.91, "psr": 0.7293, "bh_sharpe": 2.4276, "bh_return_pct": 45.89, "excess_sharpe": -1.692, "precision": 0.6404, "recall": 0.646, "f1": 0.6432, "f2": 0.6449, "accuracy": 0.5291, "mcc": -0.0491, "tp": 73, "fp": 41, "tn": 18, "fn": 40, "A_precision": 0.6404, "A_recall": 0.646, "A_f1": 0.6432, "A_f2": 0.6449, "A_accuracy": 0.5291, "A_mcc": -0.0491, "A_tp": 73, "A_fp": 41, "A_tn": 18, "A_fn": 40}, {"fold": "fold_7", "regime": "Inflation bear, AI rally and 2025", "n": 375, "A_sharpe": -0.1153, "A_sortino": -0.1055, "A_excess_sharpe": -0.9058, "A_return_pct": -7.32, "A_hit_rate": 55.73, "A_n": 375, "A_bh_sharpe": 0.7905, "A_bh_return_pct": 25.44, "A_psr": 0.4443, "A_ic": -0.0216, "B_sharpe": 1.057, "B_sortino": 1.1332, "B_excess_sharpe": -0.8767, "B_return_pct": 76.93, "B_hit_rate": 50.27, "B_n": 375, "B_bh_sharpe": 1.9338, "B_bh_return_pct": 221.94, "B_psr": 0.9019, "B_ic": 0.0388, "D_sharpe": -0.1153, "D_sortino": -0.1055, "D_excess_sharpe": -0.9058, "D_return_pct": -7.32, "D_hit_rate": 55.73, "D_n": 375, "D_bh_sharpe": 0.7905, "D_bh_return_pct": 25.44, "D_psr": 0.4443, "D_ic": -0.0216, "sharpe": -0.1153, "sortino": -0.1055, "return_pct": -7.32, "equity": 926.8, "max_dd": 0.0, "win_rate": 55.73, "profit_factor": 0.0, "ic": -0.0216, "hit": 55.73, "psr": 0.4443, "bh_sharpe": 0.7905, "bh_return_pct": 25.44, "excess_sharpe": -0.9058, "precision": 0.5839, "recall": 0.8545, "f1": 0.6937, "f2": 0.782, "accuracy": 0.5573, "mcc": -0.0141, "tp": 188, "fp": 134, "tn": 21, "fn": 32, "A_precision": 0.5839, "A_recall": 0.8545, "A_f1": 0.6937, "A_f2": 0.782, "A_accuracy": 0.5573, "A_mcc": -0.0141, "A_tp": 188, "A_fp": 134, "A_tn": 21, "A_fn": 32}], "per_window_val": [{"fold": "fold_1", "regime": "GFC peak crash (Lehman + Mar-2009 bottom)", "n": 37, "A_sharpe": 0.371, "A_sortino": 0.3317, "A_excess_sharpe": -0.3875, "A_return_pct": 0.92, "A_hit_rate": 57.14, "A_n": 37, "A_bh_sharpe": 0.7585, "A_bh_return_pct": 2.39, "A_psr": 0.5556, "A_ic": 0.0569, "B_sharpe": -1.6281, "B_sortino": -1.7786, "B_excess_sharpe": -3.7728, "B_return_pct": -10.27, "B_hit_rate": 40.54, "B_n": 37, "B_bh_sharpe": 2.1447, "B_bh_return_pct": 12.13, "B_psr": 0.2751, "B_ic": -0.1449, "D_sharpe": 0.371, "D_sortino": 0.3317, "D_excess_sharpe": -0.3875, "D_return_pct": 0.92, "D_hit_rate": 57.14, "D_n": 37, "D_bh_sharpe": 0.7585, "D_bh_return_pct": 2.39, "D_psr": 0.5556, "D_ic": 0.0569, "sharpe": 0.371, "sortino": 0.3317, "return_pct": 0.92, "equity": 1009.2, "max_dd": 0.0, "win_rate": 57.14, "profit_factor": 0.0, "ic": 0.0569, "hit": 57.14, "psr": 0.5556, "bh_sharpe": 0.7585, "bh_return_pct": 2.39, "excess_sharpe": -0.3875}, {"fold": "fold_2", "regime": "2011 US-downgrade + EU debt", "n": 46, "A_sharpe": -0.0139, "A_sortino": -0.012, "A_excess_sharpe": 0.04, "A_return_pct": -1.21, "A_hit_rate": 56.52, "A_n": 46, "A_bh_sharpe": -0.0539, "A_bh_return_pct": -1.46, "A_psr": 0.4977, "A_ic": 0.0101, "B_sharpe": 2.8766, "B_sortino": 3.4237, "B_excess_sharpe": 4.4179, "B_return_pct": 40.5, "B_hit_rate": 52.17, "B_n": 46, "B_bh_sharpe": -1.5413, "B_bh_return_pct": -23.36, "B_psr": 0.8911, "B_ic": 0.1682, "D_sharpe": -0.0139, "D_sortino": -0.012, "D_excess_sharpe": 0.04, "D_return_pct": -1.21, "D_hit_rate": 56.52, "D_n": 46, "D_bh_sharpe": -0.0539, "D_bh_return_pct": -1.46, "D_psr": 0.4977, "D_ic": 0.0101, "sharpe": -0.0139, "sortino": -0.012, "return_pct": -1.21, "equity": 987.9, "max_dd": 0.0, "win_rate": 56.52, "profit_factor": 0.0, "ic": 0.0101, "hit": 56.52, "psr": 0.4977, "bh_sharpe": -0.0539, "bh_return_pct": -1.46, "excess_sharpe": 0.04}, {"fold": "fold_3", "regime": "Taper tantrum and 2014 H1", "n": 4, "A_sharpe": 6.3226, "A_sortino": 11.1859, "A_excess_sharpe": 0.0, "A_return_pct": 0.58, "A_hit_rate": 50.0, "A_n": 4, "A_bh_sharpe": 6.3226, "A_bh_return_pct": 0.58, "A_psr": 0.773, "A_ic": 0.2, "B_sharpe": 23.4413, "B_sortino": 0.0, "B_excess_sharpe": 46.8826, "B_return_pct": 3.19, "B_hit_rate": 100.0, "B_n": 4, "B_bh_sharpe": -23.4413, "B_bh_return_pct": -3.13, "B_psr": 1.0, "B_ic": 0.4, "D_sharpe": 6.3226, "D_sortino": 11.1859, "D_excess_sharpe": 0.0, "D_return_pct": 0.58, "D_hit_rate": 50.0, "D_n": 4, "D_bh_sharpe": 6.3226, "D_bh_return_pct": 0.58, "D_psr": 0.773, "D_ic": 0.2, "sharpe": 6.3226, "sortino": 11.1859, "return_pct": 0.58, "equity": 1005.8000000000001, "max_dd": 0.0, "win_rate": 50.0, "profit_factor": 0.0, "ic": 0.2, "hit": 50.0, "psr": 0.773, "bh_sharpe": 6.3226, "bh_return_pct": 0.58, "excess_sharpe": 0.0}, {"fold": "fold_4", "regime": "China devaluation and oil crash", "n": 46, "A_sharpe": -0.902, "A_sortino": -0.8561, "A_excess_sharpe": 0.3002, "A_return_pct": -4.43, "A_hit_rate": 47.83, "A_n": 46, "A_bh_sharpe": -1.2022, "A_bh_return_pct": -5.68, "A_psr": 0.3512, "A_ic": 0.1121, "B_sharpe": 1.8964, "B_sortino": 1.9297, "B_excess_sharpe": 4.2082, "B_return_pct": 18.72, "B_hit_rate": 52.17, "B_n": 46, "B_bh_sharpe": -2.3118, "B_bh_return_pct": -24.51, "B_psr": 0.7829, "B_ic": 0.4087, "D_sharpe": -0.902, "D_sortino": -0.8561, "D_excess_sharpe": 0.3002, "D_return_pct": -4.43, "D_hit_rate": 47.83, "D_n": 46, "D_bh_sharpe": -1.2022, "D_bh_return_pct": -5.68, "D_psr": 0.3512, "D_ic": 0.1121, "sharpe": -0.902, "sortino": -0.8561, "return_pct": -4.43, "equity": 955.7, "max_dd": 0.0, "win_rate": 47.83, "profit_factor": 0.0, "ic": 0.1121, "hit": 47.83, "psr": 0.3512, "bh_sharpe": -1.2022, "bh_return_pct": -5.68, "excess_sharpe": 0.3002}, {"fold": "fold_5", "regime": "2018 Vol-mageddon + Q4 sell-off", "n": 4, "A_sharpe": -14.7551, "A_sortino": -9.7882, "A_excess_sharpe": 0.0, "A_return_pct": -3.52, "A_hit_rate": 25.0, "A_n": 4, "A_bh_sharpe": -14.7551, "A_bh_return_pct": -3.52, "A_psr": 0.0808, "A_ic": 1.0, "B_sharpe": -2.1566, "B_sortino": -2.0033, "B_excess_sharpe": -4.3132, "B_return_pct": -1.41, "B_hit_rate": 50.0, "B_n": 4, "B_bh_sharpe": 2.1566, "B_bh_return_pct": 1.19, "B_psr": 0.4075, "B_ic": -0.2, "D_sharpe": -14.7551, "D_sortino": -9.7882, "D_excess_sharpe": 0.0, "D_return_pct": -3.52, "D_hit_rate": 25.0, "D_n": 4, "D_bh_sharpe": -14.7551, "D_bh_return_pct": -3.52, "D_psr": 0.0808, "D_ic": 1.0, "sharpe": -14.7551, "sortino": -9.7882, "return_pct": -3.52, "equity": 964.8, "max_dd": 0.0, "win_rate": 25.0, "profit_factor": 0.0, "ic": 1.0, "hit": 25.0, "psr": 0.0808, "bh_sharpe": -14.7551, "bh_return_pct": -3.52, "excess_sharpe": 0.0}, {"fold": "fold_6", "regime": "COVID crash and V-recovery", "n": 25, "A_sharpe": 2.4138, "A_sortino": 2.2045, "A_excess_sharpe": 0.0, "A_return_pct": 3.27, "A_hit_rate": 60.0, "A_n": 25, "A_bh_sharpe": 2.4138, "A_bh_return_pct": 3.27, "A_psr": 0.7627, "A_ic": 0.2038, "B_sharpe": -6.4005, "B_sortino": -6.4527, "B_excess_sharpe": -18.966, "B_return_pct": -16.27, "B_hit_rate": 24.0, "B_n": 25, "B_bh_sharpe": 12.5655, "B_bh_return_pct": 32.76, "B_psr": 0.0469, "B_ic": 0.2808, "D_sharpe": 2.4138, "D_sortino": 2.2045, "D_excess_sharpe": 0.0, "D_return_pct": 3.27, "D_hit_rate": 60.0, "D_n": 25, "D_bh_sharpe": 2.4138, "D_bh_return_pct": 3.27, "D_psr": 0.7627, "D_ic": 0.2038, "sharpe": 2.4138, "sortino": 2.2045, "return_pct": 3.27, "equity": 1032.7, "max_dd": 0.0, "win_rate": 60.0, "profit_factor": 0.0, "ic": 0.2038, "hit": 60.0, "psr": 0.7627, "bh_sharpe": 2.4138, "bh_return_pct": 3.27, "excess_sharpe": 0.0}, {"fold": "fold_7", "regime": "Inflation bear, AI rally and 2025", "n": 64, "A_sharpe": 1.7948, "A_sortino": 2.041, "A_excess_sharpe": -0.246, "A_return_pct": 6.92, "A_hit_rate": 51.56, "A_n": 64, "A_bh_sharpe": 2.0409, "A_bh_return_pct": 7.94, "A_psr": 0.8189, "A_ic": 0.0689, "B_sharpe": -1.8202, "B_sortino": -1.8558, "B_excess_sharpe": -7.2294, "B_return_pct": -13.77, "B_hit_rate": 45.31, "B_n": 64, "B_bh_sharpe": 5.4092, "B_bh_return_pct": 45.7, "B_psr": 0.1878, "B_ic": 0.0651, "D_sharpe": 1.7948, "D_sortino": 2.041, "D_excess_sharpe": -0.246, "D_return_pct": 6.92, "D_hit_rate": 51.56, "D_n": 64, "D_bh_sharpe": 2.0409, "D_bh_return_pct": 7.94, "D_psr": 0.8189, "D_ic": 0.0689, "sharpe": 1.7948, "sortino": 2.041, "return_pct": 6.92, "equity": 1069.1999999999998, "max_dd": 0.0, "win_rate": 51.56, "profit_factor": 0.0, "ic": 0.0689, "hit": 51.56, "psr": 0.8189, "bh_sharpe": 2.0409, "bh_return_pct": 7.94, "excess_sharpe": -0.246}], "status": "DISCARD", "precision": 0.5893, "recall": 0.8567, "f1": 0.6982, "f2": 0.7854, "accuracy": 0.5613, "mcc": -0.0162, "tp": 538, "fp": 375, "tn": 57, "fn": 90, "test_sharpe": 0.5952, "A_sharpe": 0.5952, "A_excess_sharpe": -0.6249, "A_return_pct": 58.14, "A_precision": 0.5893, "A_recall": 0.8567, "A_f1": 0.6982, "A_f2": 0.7854, "A_accuracy": 0.5613, "A_mcc": -0.0162, "A_tp": 538, "A_fp": 375, "A_tn": 57, "A_fn": 90, "A_psr": 0.8896, "A_ic": -0.0071, "A_hit_rate": 56.29, "A_bh_sharpe": 1.2201, "A_bh_return_pct": 185.59}
