{"experiment_num": 101, "backbone": "mlp", "description": "MLP @ exp 6 seq_len=5 (down from 10) - smaller-window hill-climb (extended 50-exp budget)", "config": {"seq_len": 5, "lr": 0.0003, "batch_size": 32, "epochs": 50, "weight_decay": 1e-05, "patience": 10, "warmup_epochs": 0, "head_dropout": 0.25, "huber_delta": 1.0, "grad_clip": 1.0, "seed": 0, "hidden_size": null, "num_layers": null, "max_depth": null, "gbm_lr": null, "n_estimators": null}, "composite": -0.4066, "test_pos_folds": 5, "val_pos_folds": 4, "val_loss": -2.895873957900639, "elapsed_sec": 54.4, "timestamp": "2026-04-28T01:50:55", "sharpe": 0.4014, "val_sharpe": -0.2066, "ic": -0.0162, "hit": 53.05, "psr": 0.8318, "equity": 1515.2, "return_pct": 51.52, "bh_sharpe": 0.6494, "bh_return_pct": 123.64, "excess_sharpe": -0.248, "B_sharpe": 0.5666, "B_excess_sharpe": -1.1577, "B_return_pct": 149.13, "D_sharpe": 0.4014, "D_excess_sharpe": -0.248, "D_return_pct": 51.52, "precision": 0.5725, "recall": 0.7062, "f1": 0.6324, "f2": 0.6747, "mcc": 0.0007, "accuracy": 0.5301, "val_precision": 0.5255, "val_recall": 0.685, "val_f1": 0.5947, "val_f2": 0.6458, "val_mcc": -0.0667, "val_accuracy": 0.4897, "per_window": [{"fold": "fold_1", "regime": "GFC peak crash (Lehman + Mar-2009 bottom)", "n": 120, "A_sharpe": -0.7841, "A_sortino": -0.8601, "A_excess_sharpe": -0.4955, "A_return_pct": -22.56, "A_hit_rate": 42.5, "A_n": 120, "A_bh_sharpe": -0.2885, "A_bh_return_pct": -12.54, "A_psr": 0.2973, "A_ic": -0.1009, "A_precision": 0.4386, "A_recall": 0.9091, "A_f1": 0.5917, "A_f2": 0.7485, "A_accuracy": 0.425, "A_mcc": -0.1727, "A_tp": 50, "A_fp": 64, "A_tn": 1, "A_fn": 5, "B_sharpe": 1.2469, "B_sortino": 1.2135, "B_excess_sharpe": 1.6056, "B_return_pct": 40.51, "B_hit_rate": 55.46, "B_n": 120, "B_bh_sharpe": -0.3587, "B_bh_return_pct": -29.72, "B_psr": 0.8023, "B_ic": 0.2361, "B_precision": 0.5455, "B_recall": 0.7742, "B_f1": 0.64, "B_f2": 0.7143, "B_accuracy": 0.55, "B_mcc": 0.0955, "B_tp": 48, "B_fp": 40, "B_tn": 18, "B_fn": 14, "D_sharpe": -0.7841, "D_sortino": -0.8601, "D_excess_sharpe": -0.4955, "D_return_pct": -22.56, "D_hit_rate": 42.5, "D_n": 120, "D_bh_sharpe": -0.2885, "D_bh_return_pct": -12.54, "D_psr": 0.2973, "D_ic": -0.1009, "D_precision": 0.4386, "D_recall": 0.9091, "D_f1": 0.5917, "D_f2": 0.7485, "D_accuracy": 0.425, "D_mcc": -0.1727, "D_tp": 50, "D_fp": 64, "D_tn": 1, "D_fn": 5, "sharpe": -0.7841, "sortino": -0.8601, "return_pct": -22.56, "equity": 774.4, "max_dd": 0.0, "win_rate": 42.5, "profit_factor": 0.0, "ic": -0.1009, "hit": 42.5, "psr": 0.2973, "bh_sharpe": -0.2885, "bh_return_pct": -12.54, "excess_sharpe": -0.4955, "precision": 0.4386, "recall": 0.9091, "f1": 0.5917, "f2": 0.7485, "mcc": -0.1727, "accuracy": 0.425, "tp": 50, "fp": 64, "tn": 1, "fn": 5}, {"fold": "fold_2", "regime": "2011 US-downgrade + EU debt", "n": 141, "A_sharpe": 2.9712, "A_sortino": 3.1362, "A_excess_sharpe": 1.0316, "A_return_pct": 38.8, "A_hit_rate": 60.71, "A_n": 141, "A_bh_sharpe": 1.9396, "A_bh_return_pct": 23.61, "A_psr": 0.988, "A_ic": 0.1035, "A_precision": 0.6383, "A_recall": 0.7317, "A_f1": 0.6818, "A_f2": 0.7109, "A_accuracy": 0.6028, "A_mcc": 0.1627, "A_tp": 60, "A_fp": 34, "A_tn": 25, "A_fn": 22, "B_sharpe": 1.065, "B_sortino": 1.0036, "B_excess_sharpe": -3.5493, "B_return_pct": 24.08, "B_hit_rate": 58.16, "B_n": 141, "B_bh_sharpe": 4.6143, "B_bh_return_pct": 197.68, "B_psr": 0.7861, "B_ic": -0.0401, "B_precision": 0.71, "B_recall": 0.703, "B_f1": 0.7065, "B_f2": 0.7044, "B_accuracy": 0.5816, "B_mcc": -0.0219, "B_tp": 71, "B_fp": 29, "B_tn": 11, "B_fn": 30, "D_sharpe": 2.9712, "D_sortino": 3.1362, "D_excess_sharpe": 1.0316, "D_return_pct": 38.8, "D_hit_rate": 60.71, "D_n": 141, "D_bh_sharpe": 1.9396, "D_bh_return_pct": 23.61, "D_psr": 0.988, "D_ic": 0.1035, "D_precision": 0.6383, "D_recall": 0.7317, "D_f1": 0.6818, "D_f2": 0.7109, "D_accuracy": 0.6028, "D_mcc": 0.1627, "D_tp": 60, "D_fp": 34, "D_tn": 25, "D_fn": 22, "sharpe": 2.9712, "sortino": 3.1362, "return_pct": 38.8, "equity": 1388.0, "max_dd": 0.0, "win_rate": 60.71, "profit_factor": 0.0, "ic": 0.1035, "hit": 60.71, "psr": 0.988, "bh_sharpe": 1.9396, "bh_return_pct": 23.61, "excess_sharpe": 1.0316, "precision": 0.6383, "recall": 0.7317, "f1": 0.6818, "f2": 0.7109, "mcc": 0.1627, "accuracy": 0.6028, "tp": 60, "fp": 34, "tn": 25, "fn": 22}, {"fold": "fold_3", "regime": "Taper tantrum and 2014 H1", "n": 183, "A_sharpe": 2.5987, "A_sortino": 2.6984, "A_excess_sharpe": 1.181, "A_return_pct": 26.99, "A_hit_rate": 56.59, "A_n": 183, "A_bh_sharpe": 1.4177, "A_bh_return_pct": 13.74, "A_psr": 0.9857, "A_ic": 0.1601, "A_precision": 0.6195, "A_recall": 0.6604, "A_f1": 0.6393, "A_f2": 0.6518, "A_accuracy": 0.5683, "A_mcc": 0.1035, "A_tp": 70, "A_fp": 43, "A_tn": 34, "A_fn": 36, "B_sharpe": 3.6089, "B_sortino": 4.3637, "B_excess_sharpe": 0.2325, "B_return_pct": 93.28, "B_hit_rate": 54.64, "B_n": 183, "B_bh_sharpe": 3.3763, "B_bh_return_pct": 85.28, "B_psr": 0.9991, "B_ic": 0.2021, "B_precision": 0.6325, "B_recall": 0.6491, "B_f1": 0.6407, "B_f2": 0.6457, "B_accuracy": 0.5464, "B_mcc": 0.0262, "B_tp": 74, "B_fp": 43, "B_tn": 26, "B_fn": 40, "D_sharpe": 2.5987, "D_sortino": 2.6984, "D_excess_sharpe": 1.181, "D_return_pct": 26.99, "D_hit_rate": 56.59, "D_n": 183, "D_bh_sharpe": 1.4177, "D_bh_return_pct": 13.74, "D_psr": 0.9857, "D_ic": 0.1601, "D_precision": 0.6195, "D_recall": 0.6604, "D_f1": 0.6393, "D_f2": 0.6518, "D_accuracy": 0.5683, "D_mcc": 0.1035, "D_tp": 70, "D_fp": 43, "D_tn": 34, "D_fn": 36, "sharpe": 2.5987, "sortino": 2.6984, "return_pct": 26.99, "equity": 1269.9, "max_dd": 0.0, "win_rate": 56.59, "profit_factor": 0.0, "ic": 0.1601, "hit": 56.59, "psr": 0.9857, "bh_sharpe": 1.4177, "bh_return_pct": 13.74, "excess_sharpe": 1.181, "precision": 0.6195, "recall": 0.6604, "f1": 0.6393, "f2": 0.6518, "mcc": 0.1035, "accuracy": 0.5683, "tp": 70, "fp": 43, "tn": 34, "fn": 36}, {"fold": "fold_4", "regime": "China devaluation and oil crash", "n": 162, "A_sharpe": 0.4825, "A_sortino": 0.4574, "A_excess_sharpe": 0.3623, "A_return_pct": 4.9, "A_hit_rate": 54.04, "A_n": 162, "A_bh_sharpe": 0.1202, "A_bh_return_pct": 0.29, "A_psr": 0.6495, "A_ic": 0.0424, "A_precision": 0.5378, "A_recall": 0.7619, "A_f1": 0.6305, "A_f2": 0.7033, "A_accuracy": 0.537, "A_mcc": 0.0642, "A_tp": 64, "A_fp": 55, "A_tn": 23, "A_fn": 20, "B_sharpe": 2.8327, "B_sortino": 3.5193, "B_excess_sharpe": 2.5622, "B_return_pct": 105.57, "B_hit_rate": 51.85, "B_n": 162, "B_bh_sharpe": 0.2705, "B_bh_return_pct": 1.43, "B_psr": 0.9906, "B_ic": 0.0771, "B_precision": 0.5652, "B_recall": 0.5778, "B_f1": 0.5714, "B_f2": 0.5752, "B_accuracy": 0.5185, "B_mcc": 0.0223, "B_tp": 52, "B_fp": 40, "B_tn": 32, "B_fn": 38, "D_sharpe": 0.4825, "D_sortino": 0.4574, "D_excess_sharpe": 0.3623, "D_return_pct": 4.9, "D_hit_rate": 54.04, "D_n": 162, "D_bh_sharpe": 0.1202, "D_bh_return_pct": 0.29, "D_psr": 0.6495, "D_ic": 0.0424, "D_precision": 0.5378, "D_recall": 0.7619, "D_f1": 0.6305, "D_f2": 0.7033, "D_accuracy": 0.537, "D_mcc": 0.0642, "D_tp": 64, "D_fp": 55, "D_tn": 23, "D_fn": 20, "sharpe": 0.4825, "sortino": 0.4574, "return_pct": 4.9, "equity": 1049.0, "max_dd": 0.0, "win_rate": 54.04, "profit_factor": 0.0, "ic": 0.0424, "hit": 54.04, "psr": 0.6495, "bh_sharpe": 0.1202, "bh_return_pct": 0.29, "excess_sharpe": 0.3623, "precision": 0.5378, "recall": 0.7619, "f1": 0.6305, "f2": 0.7033, "mcc": 0.0642, "accuracy": 0.537, "tp": 64, "fp": 55, "tn": 23, "fn": 20}, {"fold": "fold_5", "regime": "2018 Vol-mageddon + Q4 sell-off", "n": 182, "A_sharpe": 1.7557, "A_sortino": 1.9239, "A_excess_sharpe": 1.4624, "A_return_pct": 30.74, "A_hit_rate": 56.04, "A_n": 182, "A_bh_sharpe": 0.2933, "A_bh_return_pct": 2.99, "A_psr": 0.9375, "A_ic": -0.0438, "A_precision": 0.5926, "A_recall": 0.7619, "A_f1": 0.6667, "A_f2": 0.7207, "A_accuracy": 0.5604, "A_mcc": 0.0538, "A_tp": 80, "A_fp": 55, "A_tn": 22, "A_fn": 25, "B_sharpe": -0.5193, "B_sortino": -0.4525, "B_excess_sharpe": -1.288, "B_return_pct": -21.98, "B_hit_rate": 54.14, "B_n": 182, "B_bh_sharpe": 0.7687, "B_bh_return_pct": 19.39, "B_psr": 0.3286, "B_ic": -0.0185, "B_precision": 0.594, "B_recall": 0.7248, "B_f1": 0.6529, "B_f2": 0.6942, "B_accuracy": 0.5385, "B_mcc": -0.0165, "B_tp": 79, "B_fp": 54, "B_tn": 19, "B_fn": 30, "D_sharpe": 1.7557, "D_sortino": 1.9239, "D_excess_sharpe": 1.4624, "D_return_pct": 30.74, "D_hit_rate": 56.04, "D_n": 182, "D_bh_sharpe": 0.2933, "D_bh_return_pct": 2.99, "D_psr": 0.9375, "D_ic": -0.0438, "D_precision": 0.5926, "D_recall": 0.7619, "D_f1": 0.6667, "D_f2": 0.7207, "D_accuracy": 0.5604, "D_mcc": 0.0538, "D_tp": 80, "D_fp": 55, "D_tn": 22, "D_fn": 25, "sharpe": 1.7557, "sortino": 1.9239, "return_pct": 30.74, "equity": 1307.3999999999999, "max_dd": 0.0, "win_rate": 56.04, "profit_factor": 0.0, "ic": -0.0438, "hit": 56.04, "psr": 0.9375, "bh_sharpe": 0.2933, "bh_return_pct": 2.99, "excess_sharpe": 1.4624, "precision": 0.5926, "recall": 0.7619, "f1": 0.6667, "f2": 0.7207, "mcc": 0.0538, "accuracy": 0.5604, "tp": 80, "fp": 55, "tn": 22, "fn": 25}, {"fold": "fold_6", "regime": "COVID crash and V-recovery", "n": 227, "A_sharpe": -0.4649, "A_sortino": -0.471, "A_excess_sharpe": -1.4127, "A_return_pct": -19.83, "A_hit_rate": 45.37, "A_n": 227, "A_bh_sharpe": 0.9478, "A_bh_return_pct": 29.11, "A_psr": 0.3289, "A_ic": 0.0474, "A_precision": 0.5978, "A_recall": 0.3873, "A_f1": 0.4701, "A_f2": 0.4167, "A_accuracy": 0.4537, "A_mcc": -0.0473, "A_tp": 55, "A_fp": 37, "A_tn": 48, "A_fn": 87, "B_sharpe": -1.0103, "B_sortino": -0.9776, "B_excess_sharpe": -3.4387, "B_return_pct": -57.12, "B_hit_rate": 47.35, "B_n": 227, "B_bh_sharpe": 2.4284, "B_bh_return_pct": 257.91, "B_psr": 0.1681, "B_ic": -0.1119, "B_precision": 0.6122, "B_recall": 0.4255, "B_f1": 0.5021, "B_f2": 0.4532, "B_accuracy": 0.4758, "B_mcc": -0.016, "B_tp": 60, "B_fp": 38, "B_tn": 48, "B_fn": 81, "D_sharpe": -0.4649, "D_sortino": -0.471, "D_excess_sharpe": -1.4127, "D_return_pct": -19.83, "D_hit_rate": 45.37, "D_n": 227, "D_bh_sharpe": 0.9478, "D_bh_return_pct": 29.11, "D_psr": 0.3289, "D_ic": 0.0474, "D_precision": 0.5978, "D_recall": 0.3873, "D_f1": 0.4701, "D_f2": 0.4167, "D_accuracy": 0.4537, "D_mcc": -0.0473, "D_tp": 55, "D_fp": 37, "D_tn": 48, "D_fn": 87, "sharpe": -0.4649, "sortino": -0.471, "return_pct": -19.83, "equity": 801.7, "max_dd": 0.0, "win_rate": 45.37, "profit_factor": 0.0, "ic": 0.0474, "hit": 45.37, "psr": 0.3289, "bh_sharpe": 0.9478, "bh_return_pct": 29.11, "excess_sharpe": -1.4127, "precision": 0.5978, "recall": 0.3873, "f1": 0.4701, "f2": 0.4167, "mcc": -0.0473, "accuracy": 0.4537, "tp": 55, "fp": 37, "tn": 48, "fn": 87}, {"fold": "fold_7", "regime": "Inflation bear, AI rally and 2025", "n": 430, "A_sharpe": 0.134, "A_sortino": 0.1267, "A_excess_sharpe": -0.8145, "A_return_pct": 0.97, "A_hit_rate": 54.42, "A_n": 430, "A_bh_sharpe": 0.9486, "A_bh_return_pct": 36.39, "A_psr": 0.5696, "A_ic": -0.0834, "A_precision": 0.5807, "A_recall": 0.8103, "A_f1": 0.6766, "A_f2": 0.7509, "A_accuracy": 0.5442, "A_mcc": -0.0332, "A_tp": 205, "A_fp": 148, "A_tn": 29, "A_fn": 48, "B_sharpe": 0.3195, "B_sortino": 0.3195, "B_excess_sharpe": -1.9759, "B_return_pct": 7.5, "B_hit_rate": 53.38, "B_n": 430, "B_bh_sharpe": 2.2954, "B_bh_return_pct": 388.61, "B_psr": 0.6621, "B_ic": -0.0747, "B_precision": 0.6131, "B_recall": 0.6388, "B_f1": 0.6257, "B_f2": 0.6335, "B_accuracy": 0.5326, "B_mcc": 0.0041, "B_tp": 168, "B_fp": 106, "B_tn": 61, "B_fn": 95, "D_sharpe": 0.134, "D_sortino": 0.1267, "D_excess_sharpe": -0.8145, "D_return_pct": 0.97, "D_hit_rate": 54.42, "D_n": 430, "D_bh_sharpe": 0.9486, "D_bh_return_pct": 36.39, "D_psr": 0.5696, "D_ic": -0.0834, "D_precision": 0.5807, "D_recall": 0.8103, "D_f1": 0.6766, "D_f2": 0.7509, "D_accuracy": 0.5442, "D_mcc": -0.0332, "D_tp": 205, "D_fp": 148, "D_tn": 29, "D_fn": 48, "sharpe": 0.134, "sortino": 0.1267, "return_pct": 0.97, "equity": 1009.7, "max_dd": 0.0, "win_rate": 54.42, "profit_factor": 0.0, "ic": -0.0834, "hit": 54.42, "psr": 0.5696, "bh_sharpe": 0.9486, "bh_return_pct": 36.39, "excess_sharpe": -0.8145, "precision": 0.5807, "recall": 0.8103, "f1": 0.6766, "f2": 0.7509, "mcc": -0.0332, "accuracy": 0.5442, "tp": 205, "fp": 148, "tn": 29, "fn": 48}], "per_window_val": [{"fold": "fold_1", "regime": "GFC peak crash (Lehman + Mar-2009 bottom)", "n": 114, "A_sharpe": -0.868, "A_sortino": -0.7867, "A_excess_sharpe": 0.1748, "A_return_pct": -12.67, "A_hit_rate": 48.21, "A_n": 114, "A_bh_sharpe": -1.0428, "A_bh_return_pct": -14.67, "A_psr": 0.2762, "A_ic": 0.0342, "A_precision": 0.4725, "A_recall": 0.7818, "A_f1": 0.589, "A_f2": 0.6913, "A_accuracy": 0.4737, "A_mcc": -0.0395, "A_tp": 43, "A_fp": 48, "A_tn": 11, "A_fn": 12, "B_sharpe": -1.1495, "B_sortino": -1.1089, "B_excess_sharpe": 1.9371, "B_return_pct": -31.31, "B_hit_rate": 46.02, "B_n": 114, "B_bh_sharpe": -3.0866, "B_bh_return_pct": -58.06, "B_psr": 0.22, "B_ic": -0.0373, "B_precision": 0.4462, "B_recall": 0.537, "B_f1": 0.4874, "B_f2": 0.516, "B_accuracy": 0.4649, "B_mcc": -0.0635, "B_tp": 29, "B_fp": 36, "B_tn": 24, "B_fn": 25, "D_sharpe": -0.868, "D_sortino": -0.7867, "D_excess_sharpe": 0.1748, "D_return_pct": -12.67, "D_hit_rate": 48.21, "D_n": 114, "D_bh_sharpe": -1.0428, "D_bh_return_pct": -14.67, "D_psr": 0.2762, "D_ic": 0.0342, "D_precision": 0.4725, "D_recall": 0.7818, "D_f1": 0.589, "D_f2": 0.6913, "D_accuracy": 0.4737, "D_mcc": -0.0395, "D_tp": 43, "D_fp": 48, "D_tn": 11, "D_fn": 12, "sharpe": -0.868, "sortino": -0.7867, "return_pct": -12.67, "equity": 873.3, "max_dd": 0.0, "win_rate": 48.21, "profit_factor": 0.0, "ic": 0.0342, "hit": 48.21, "psr": 0.2762, "bh_sharpe": -1.0428, "bh_return_pct": -14.67, "excess_sharpe": 0.1748, "precision": 0.4725, "recall": 0.7818, "f1": 0.589, "f2": 0.6913, "mcc": -0.0395, "accuracy": 0.4737, "tp": 43, "fp": 48, "tn": 11, "fn": 12}, {"fold": "fold_2", "regime": "2011 US-downgrade + EU debt", "n": 101, "A_sharpe": -0.9216, "A_sortino": -0.8562, "A_excess_sharpe": -0.5766, "A_return_pct": -10.46, "A_hit_rate": 48.0, "A_n": 101, "A_bh_sharpe": -0.3451, "A_bh_return_pct": -4.89, "A_psr": 0.2781, "A_ic": -0.0506, "A_precision": 0.4881, "A_recall": 0.8039, "A_f1": 0.6074, "A_f2": 0.7118, "A_accuracy": 0.4752, "A_mcc": -0.0749, "A_tp": 41, "A_fp": 43, "A_tn": 7, "A_fn": 10, "B_sharpe": -0.5006, "B_sortino": -0.5017, "B_excess_sharpe": 0.5013, "B_return_pct": -16.58, "B_hit_rate": 45.54, "B_n": 101, "B_bh_sharpe": -1.0019, "B_bh_return_pct": -25.64, "B_psr": 0.3756, "B_ic": -0.0517, "B_precision": 0.4359, "B_recall": 0.7556, "B_f1": 0.5528, "B_f2": 0.6589, "B_accuracy": 0.4554, "B_mcc": -0.0357, "B_tp": 34, "B_fp": 44, "B_tn": 12, "B_fn": 11, "D_sharpe": -0.9216, "D_sortino": -0.8562, "D_excess_sharpe": -0.5766, "D_return_pct": -10.46, "D_hit_rate": 48.0, "D_n": 101, "D_bh_sharpe": -0.3451, "D_bh_return_pct": -4.89, "D_psr": 0.2781, "D_ic": -0.0506, "D_precision": 0.4881, "D_recall": 0.8039, "D_f1": 0.6074, "D_f2": 0.7118, "D_accuracy": 0.4752, "D_mcc": -0.0749, "D_tp": 41, "D_fp": 43, "D_tn": 7, "D_fn": 10, "sharpe": -0.9216, "sortino": -0.8562, "return_pct": -10.46, "equity": 895.4, "max_dd": 0.0, "win_rate": 48.0, "profit_factor": 0.0, "ic": -0.0506, "hit": 48.0, "psr": 0.2781, "bh_sharpe": -0.3451, "bh_return_pct": -4.89, "excess_sharpe": -0.5766, "precision": 0.4881, "recall": 0.8039, "f1": 0.6074, "f2": 0.7118, "mcc": -0.0749, "accuracy": 0.4752, "tp": 41, "fp": 43, "tn": 7, "fn": 10}, {"fold": "fold_3", "regime": "Taper tantrum and 2014 H1", "n": 59, "A_sharpe": 0.6704, "A_sortino": 0.6748, "A_excess_sharpe": -3.5932, "A_return_pct": 1.7, "A_hit_rate": 49.15, "A_n": 59, "A_bh_sharpe": 4.2636, "A_bh_return_pct": 11.88, "A_psr": 0.6254, "A_ic": -0.0278, "A_precision": 0.575, "A_recall": 0.6389, "A_f1": 0.6053, "A_f2": 0.625, "A_accuracy": 0.4915, "A_mcc": -0.1046, "A_tp": 23, "A_fp": 17, "A_tn": 6, "A_fn": 13, "B_sharpe": 10.3208, "B_sortino": 15.0286, "B_excess_sharpe": -0.0646, "B_return_pct": 72.4, "B_hit_rate": 72.88, "B_n": 59, "B_bh_sharpe": 10.3855, "B_bh_return_pct": 72.82, "B_psr": 1.0, "B_ic": 0.4599, "B_precision": 0.7955, "B_recall": 0.8333, "B_f1": 0.814, "B_f2": 0.8255, "B_accuracy": 0.7288, "B_mcc": 0.3161, "B_tp": 35, "B_fp": 9, "B_tn": 8, "B_fn": 7, "D_sharpe": 0.6704, "D_sortino": 0.6748, "D_excess_sharpe": -3.5932, "D_return_pct": 1.7, "D_hit_rate": 49.15, "D_n": 59, "D_bh_sharpe": 4.2636, "D_bh_return_pct": 11.88, "D_psr": 0.6254, "D_ic": -0.0278, "D_precision": 0.575, "D_recall": 0.6389, "D_f1": 0.6053, "D_f2": 0.625, "D_accuracy": 0.4915, "D_mcc": -0.1046, "D_tp": 23, "D_fp": 17, "D_tn": 6, "D_fn": 13, "sharpe": 0.6704, "sortino": 0.6748, "return_pct": 1.7, "equity": 1016.9999999999999, "max_dd": 0.0, "win_rate": 49.15, "profit_factor": 0.0, "ic": -0.0278, "hit": 49.15, "psr": 0.6254, "bh_sharpe": 4.2636, "bh_return_pct": 11.88, "excess_sharpe": -3.5932, "precision": 0.575, "recall": 0.6389, "f1": 0.6053, "f2": 0.625, "mcc": -0.1046, "accuracy": 0.4915, "tp": 23, "fp": 17, "tn": 6, "fn": 13}, {"fold": "fold_4", "regime": "China devaluation and oil crash", "n": 101, "A_sharpe": -0.7445, "A_sortino": -0.7581, "A_excess_sharpe": -0.4815, "A_return_pct": -6.11, "A_hit_rate": 45.0, "A_n": 101, "A_bh_sharpe": -0.2631, "A_bh_return_pct": -2.65, "A_psr": 0.32, "A_ic": -0.0643, "A_precision": 0.4407, "A_recall": 0.5417, "A_f1": 0.486, "A_f2": 0.5179, "A_accuracy": 0.4554, "A_mcc": -0.082, "A_tp": 26, "A_fp": 33, "A_tn": 20, "A_fn": 22, "B_sharpe": 3.8946, "B_sortino": 5.1254, "B_excess_sharpe": 5.0005, "B_return_pct": 87.24, "B_hit_rate": 64.36, "B_n": 101, "B_bh_sharpe": -1.1059, "B_bh_return_pct": -20.84, "B_psr": 0.9984, "B_ic": 0.1941, "B_precision": 0.625, "B_recall": 0.7, "B_f1": 0.6604, "B_f2": 0.6836, "B_accuracy": 0.6436, "B_mcc": 0.2899, "B_tp": 35, "B_fp": 21, "B_tn": 30, "B_fn": 15, "D_sharpe": -0.7445, "D_sortino": -0.7581, "D_excess_sharpe": -0.4815, "D_return_pct": -6.11, "D_hit_rate": 45.0, "D_n": 101, "D_bh_sharpe": -0.2631, "D_bh_return_pct": -2.65, "D_psr": 0.32, "D_ic": -0.0643, "D_precision": 0.4407, "D_recall": 0.5417, "D_f1": 0.486, "D_f2": 0.5179, "D_accuracy": 0.4554, "D_mcc": -0.082, "D_tp": 26, "D_fp": 33, "D_tn": 20, "D_fn": 22, "sharpe": -0.7445, "sortino": -0.7581, "return_pct": -6.11, "equity": 938.9, "max_dd": 0.0, "win_rate": 45.0, "profit_factor": 0.0, "ic": -0.0643, "hit": 45.0, "psr": 0.32, "bh_sharpe": -0.2631, "bh_return_pct": -2.65, "excess_sharpe": -0.4815, "precision": 0.4407, "recall": 0.5417, "f1": 0.486, "f2": 0.5179, "mcc": -0.082, "accuracy": 0.4554, "tp": 26, "fp": 33, "tn": 20, "fn": 22}, {"fold": "fold_5", "regime": "2018 Vol-mageddon + Q4 sell-off", "n": 59, "A_sharpe": 1.5553, "A_sortino": 1.5049, "A_excess_sharpe": -0.4588, "A_return_pct": 4.69, "A_hit_rate": 57.63, "A_n": 59, "A_bh_sharpe": 2.0141, "A_bh_return_pct": 6.15, "A_psr": 0.7719, "A_ic": 0.2217, "A_precision": 0.6207, "A_recall": 0.5625, "A_f1": 0.5902, "A_f2": 0.5732, "A_accuracy": 0.5763, "A_mcc": 0.1546, "A_tp": 18, "A_fp": 11, "A_tn": 16, "A_fn": 14, "B_sharpe": -2.8449, "B_sortino": -2.6312, "B_excess_sharpe": -7.7503, "B_return_pct": -18.67, "B_hit_rate": 44.07, "B_n": 59, "B_bh_sharpe": 4.9054, "B_bh_return_pct": 37.42, "B_psr": 0.0883, "B_ic": -0.1687, "B_precision": 0.6522, "B_recall": 0.375, "B_f1": 0.4762, "B_f2": 0.4098, "B_accuracy": 0.4407, "B_mcc": -0.0441, "B_tp": 15, "B_fp": 8, "B_tn": 11, "B_fn": 25, "D_sharpe": 1.5553, "D_sortino": 1.5049, "D_excess_sharpe": -0.4588, "D_return_pct": 4.69, "D_hit_rate": 57.63, "D_n": 59, "D_bh_sharpe": 2.0141, "D_bh_return_pct": 6.15, "D_psr": 0.7719, "D_ic": 0.2217, "D_precision": 0.6207, "D_recall": 0.5625, "D_f1": 0.5902, "D_f2": 0.5732, "D_accuracy": 0.5763, "D_mcc": 0.1546, "D_tp": 18, "D_fp": 11, "D_tn": 16, "D_fn": 14, "sharpe": 1.5553, "sortino": 1.5049, "return_pct": 4.69, "equity": 1046.8999999999999, "max_dd": 0.0, "win_rate": 57.63, "profit_factor": 0.0, "ic": 0.2217, "hit": 57.63, "psr": 0.7719, "bh_sharpe": 2.0141, "bh_return_pct": 6.15, "excess_sharpe": -0.4588, "precision": 0.6207, "recall": 0.5625, "f1": 0.5902, "f2": 0.5732, "mcc": 0.1546, "accuracy": 0.5763, "tp": 18, "fp": 11, "tn": 16, "fn": 14}, {"fold": "fold_6", "regime": "COVID crash and V-recovery", "n": 80, "A_sharpe": 0.3838, "A_sortino": 0.4016, "A_excess_sharpe": -3.9284, "A_return_pct": 1.21, "A_hit_rate": 46.25, "A_n": 80, "A_bh_sharpe": 4.3122, "A_bh_return_pct": 16.38, "A_psr": 0.5849, "A_ic": 0.0813, "A_precision": 0.641, "A_recall": 0.463, "A_f1": 0.5376, "A_f2": 0.4902, "A_accuracy": 0.4625, "A_mcc": -0.0707, "A_tp": 25, "A_fp": 14, "A_tn": 12, "A_fn": 29, "B_sharpe": 4.0523, "B_sortino": 4.1107, "B_excess_sharpe": -10.7159, "B_return_pct": 37.87, "B_hit_rate": 62.5, "B_n": 80, "B_bh_sharpe": 14.7681, "B_bh_return_pct": 146.98, "B_psr": 0.9869, "B_ic": 0.0821, "B_precision": 0.913, "B_recall": 0.6176, "B_f1": 0.7368, "B_f2": 0.6604, "B_accuracy": 0.625, "B_mcc": 0.2054, "B_tp": 42, "B_fp": 4, "B_tn": 8, "B_fn": 26, "D_sharpe": 0.3838, "D_sortino": 0.4016, "D_excess_sharpe": -3.9284, "D_return_pct": 1.21, "D_hit_rate": 46.25, "D_n": 80, "D_bh_sharpe": 4.3122, "D_bh_return_pct": 16.38, "D_psr": 0.5849, "D_ic": 0.0813, "D_precision": 0.641, "D_recall": 0.463, "D_f1": 0.5376, "D_f2": 0.4902, "D_accuracy": 0.4625, "D_mcc": -0.0707, "D_tp": 25, "D_fp": 14, "D_tn": 12, "D_fn": 29, "sharpe": 0.3838, "sortino": 0.4016, "return_pct": 1.21, "equity": 1012.1, "max_dd": 0.0, "win_rate": 46.25, "profit_factor": 0.0, "ic": 0.0813, "hit": 46.25, "psr": 0.5849, "bh_sharpe": 4.3122, "bh_return_pct": 16.38, "excess_sharpe": -3.9284, "precision": 0.641, "recall": 0.463, "f1": 0.5376, "f2": 0.4902, "mcc": -0.0707, "accuracy": 0.4625, "tp": 25, "fp": 14, "tn": 12, "fn": 29}, {"fold": "fold_7", "regime": "Inflation bear, AI rally and 2025", "n": 119, "A_sharpe": 1.1182, "A_sortino": 1.1816, "A_excess_sharpe": -1.652, "A_return_pct": 7.93, "A_hit_rate": 52.1, "A_n": 119, "A_bh_sharpe": 2.7702, "A_bh_return_pct": 21.52, "A_psr": 0.7789, "A_ic": -0.0801, "A_precision": 0.5596, "A_recall": 0.8714, "A_f1": 0.6816, "A_f2": 0.7841, "A_accuracy": 0.521, "A_mcc