{"experiment_num": 54, "backbone": "mamba", "description": "dMamba @ exp 52 NEW CHAMP d_state=32 seed=0 - multi-seed verification", "config": {"seq_len": 60, "lr": 0.0005, "batch_size": 32, "epochs": 100, "weight_decay": 0.1, "patience": 20, "warmup_epochs": 10, "head_dropout": 0.1, "huber_delta": 1.0, "grad_clip": 1.0, "seed": 0, "hidden_size": null, "num_layers": null, "max_depth": null, "gbm_lr": null, "n_estimators": null}, "composite": 0.1874, "test_pos_folds": 4, "val_pos_folds": 4, "val_loss": -2.849837459294142, "elapsed_sec": 564.7, "timestamp": "2026-04-27T21:05:19", "sharpe": 0.4874, "val_sharpe": 0.607, "ic": 0.0047, "hit": 55.25, "psr": 0.8417, "equity": 1427.6, "return_pct": 42.76, "bh_sharpe": 1.2201, "bh_return_pct": 185.59, "excess_sharpe": -0.7327, "B_sharpe": 1.9427, "B_excess_sharpe": -0.8957, "B_return_pct": 2677.79, "D_sharpe": 0.4874, "D_excess_sharpe": -0.7327, "D_return_pct": 42.76, "per_window": [{"fold": "fold_1", "regime": "GFC peak crash (Lehman + Mar-2009 bottom)", "n": 65, "A_sharpe": -0.2469, "A_sortino": -0.2458, "A_excess_sharpe": -0.6731, "A_return_pct": -4.14, "A_hit_rate": 49.23, "A_n": 65, "A_bh_sharpe": 0.4262, "A_bh_return_pct": 2.34, "A_psr": 0.4505, "A_ic": 0.0378, "B_sharpe": -0.8484, "B_sortino": -0.944, "B_excess_sharpe": -2.7361, "B_return_pct": -21.64, "B_hit_rate": 40.62, "B_n": 65, "B_bh_sharpe": 1.8877, "B_bh_return_pct": 34.48, "B_psr": 0.336, "B_ic": -0.1318, "D_sharpe": -0.2469, "D_sortino": -0.2458, "D_excess_sharpe": -0.6731, "D_return_pct": -4.14, "D_hit_rate": 49.23, "D_n": 65, "D_bh_sharpe": 0.4262, "D_bh_return_pct": 2.34, "D_psr": 0.4505, "D_ic": 0.0378, "sharpe": -0.2469, "sortino": -0.2458, "return_pct": -4.14, "equity": 958.6, "max_dd": 0.0, "win_rate": 49.23, "profit_factor": 0.0, "ic": 0.0378, "hit": 49.23, "psr": 0.4505, "bh_sharpe": 0.4262, "bh_return_pct": 2.34, "excess_sharpe": -0.6731, "precision": 0.5094, "recall": 0.7941, "f1": 0.6207, "f2": 0.7143, "accuracy": 0.4923, "mcc": -0.0574, "tp": 27, "fp": 26, "tn": 5, "fn": 7, "A_precision": 0.5094, "A_recall": 0.7941, "A_f1": 0.6207, "A_f2": 0.7143, "A_accuracy": 0.4923, "A_mcc": -0.0574, "A_tp": 27, "A_fp": 26, "A_tn": 5, "A_fn": 7}, {"fold": "fold_2", "regime": "2011 US-downgrade + EU debt", "n": 86, "A_sharpe": 4.5656, "A_sortino": 5.9266, "A_excess_sharpe": -0.3027, "A_return_pct": 26.09, "A_hit_rate": 61.18, "A_n": 86, "A_bh_sharpe": 4.8682, "A_bh_return_pct": 27.91, "A_psr": 0.9986, "A_ic": -0.0852, "B_sharpe": 7.7216, "B_sortino": 6.6054, "B_excess_sharpe": -3.5974, "B_return_pct": 120.13, "B_hit_rate": 77.91, "B_n": 86, "B_bh_sharpe": 11.3191, "B_bh_return_pct": 186.84, "B_psr": 1.0, "B_ic": -0.0175, "D_sharpe": 4.5656, "D_sortino": 5.9266, "D_excess_sharpe": -0.3027, "D_return_pct": 26.09, "D_hit_rate": 61.18, "D_n": 86, "D_bh_sharpe": 4.8682, "D_bh_return_pct": 27.91, "D_psr": 0.9986, "D_ic": -0.0852, "sharpe": 4.5656, "sortino": 5.9266, "return_pct": 26.09, "equity": 1260.8999999999999, "max_dd": 0.0, "win_rate": 61.18, "profit_factor": 0.0, "ic": -0.0852, "hit": 61.18, "psr": 0.9986, "bh_sharpe": 4.8682, "bh_return_pct": 27.91, "excess_sharpe": -0.3027, "precision": 0.6118, "recall": 0.9811, "f1": 0.7536, "f2": 0.8754, "accuracy": 0.6047, "mcc": -0.0856, "tp": 52, "fp": 33, "tn": 0, "fn": 1, "A_precision": 0.6118, "A_recall": 0.9811, "A_f1": 0.7536, "A_f2": 0.8754, "A_accuracy": 0.6047, "A_mcc": -0.0856, "A_tp": 52, "A_fp": 33, "A_tn": 0, "A_fn": 1}, {"fold": "fold_3", "regime": "Taper tantrum and 2014 H1", "n": 128, "A_sharpe": 0.2043, "A_sortino": 0.1815, "A_excess_sharpe": -1.8546, "A_return_pct": 0.91, "A_hit_rate": 53.54, "A_n": 128, "A_bh_sharpe": 2.0589, "A_bh_return_pct": 13.6, "A_psr": 0.5574, "A_ic": -0.0933, "B_sharpe": 3.4598, "B_sortino": 3.4529, "B_excess_sharpe": -1.0518, "B_return_pct": 49.25, "B_hit_rate": 60.94, "B_n": 128, "B_bh_sharpe": 4.5116, "B_bh_return_pct": 67.92, "B_psr": 0.9912, "B_ic": -0.0108, "D_sharpe": 0.2043, "D_sortino": 0.1815, "D_excess_sharpe": -1.8546, "D_return_pct": 0.91, "D_hit_rate": 53.54, "D_n": 128, "D_bh_sharpe": 2.0589, "D_bh_return_pct": 13.6, "D_psr": 0.5574, "D_ic": -0.0933, "sharpe": 0.2043, "sortino": 0.1815, "return_pct": 0.91, "equity": 1009.1000000000001, "max_dd": 0.0, "win_rate": 53.54, "profit_factor": 0.0, "ic": -0.0933, "hit": 53.54, "psr": 0.5574, "bh_sharpe": 2.0589, "bh_return_pct": 13.6, "excess_sharpe": -1.8546, "precision": 0.5818, "recall": 0.8205, "f1": 0.6809, "f2": 0.7583, "accuracy": 0.5312, "mcc": -0.1396, "tp": 64, "fp": 46, "tn": 4, "fn": 14, "A_precision": 0.5818, "A_recall": 0.8205, "A_f1": 0.6809, "A_f2": 0.7583, "A_accuracy": 0.5312, "A_mcc": -0.1396, "A_tp": 64, "A_fp": 46, "A_tn": 4, "A_fn": 14}, {"fold": "fold_4", "regime": "China devaluation and oil crash", "n": 107, "A_sharpe": -0.2037, "A_sortino": -0.2012, "A_excess_sharpe": 0.5995, "A_return_pct": -2.63, "A_hit_rate": 50.0, "A_n": 107, "A_bh_sharpe": -0.8032, "A_bh_return_pct": -7.58, "A_psr": 0.4474, "A_ic": 0.0891, "B_sharpe": 0.0202, "B_sortino": 0.0213, "B_excess_sharpe": 1.9798, "B_return_pct": -3.69, "B_hit_rate": 47.66, "B_n": 107, "B_bh_sharpe": -1.9596, "B_bh_return_pct": -33.47, "B_psr": 0.5052, "B_ic": -0.0178, "D_sharpe": -0.2037, "D_sortino": -0.2012, "D_excess_sharpe": 0.5995, "D_return_pct": -2.63, "D_hit_rate": 50.0, "D_n": 107, "D_bh_sharpe": -0.8032, "D_bh_return_pct": -7.58, "D_psr": 0.4474, "D_ic": 0.0891, "sharpe": -0.2037, "sortino": -0.2012, "return_pct": -2.63, "equity": 973.7, "max_dd": 0.0, "win_rate": 50.0, "profit_factor": 0.0, "ic": 0.0891, "hit": 50.0, "psr": 0.4474, "bh_sharpe": -0.8032, "bh_return_pct": -7.58, "excess_sharpe": 0.5995, "precision": 0.4889, "recall": 0.8462, "f1": 0.6197, "f2": 0.7383, "accuracy": 0.4953, "mcc": 0.0134, "tp": 44, "fp": 46, "tn": 9, "fn": 8, "A_precision": 0.4889, "A_recall": 0.8462, "A_f1": 0.6197, "A_f2": 0.7383, "A_accuracy": 0.4953, "A_mcc": 0.0134, "A_tp": 44, "A_fp": 46, "A_tn": 9, "A_fn": 8}, {"fold": "fold_5", "regime": "2018 Vol-mageddon + Q4 sell-off", "n": 127, "A_sharpe": 1.3568, "A_sortino": 1.216, "A_excess_sharpe": 0.1738, "A_return_pct": 15.92, "A_hit_rate": 62.99, "A_n": 127, "A_bh_sharpe": 1.183, "A_bh_return_pct": 13.55, "A_psr": 0.8321, "A_ic": 0.1335, "B_sharpe": 3.4664, "B_sortino": 3.1142, "B_excess_sharpe": 0.5608, "B_return_pct": 110.17, "B_hit_rate": 65.08, "B_n": 127, "B_bh_sharpe": 2.9056, "B_bh_return_pct": 85.51, "B_psr": 0.989, "B_ic": 0.1768, "D_sharpe": 1.3568, "D_sortino": 1.216, "D_excess_sharpe": 0.1738, "D_return_pct": 15.92, "D_hit_rate": 62.99, "D_n": 127, "D_bh_sharpe": 1.183, "D_bh_return_pct": 13.55, "D_psr": 0.8321, "D_ic": 0.1335, "sharpe": 1.3568, "sortino": 1.216, "return_pct": 15.92, "equity": 1159.2, "max_dd": 0.0, "win_rate": 62.99, "profit_factor": 0.0, "ic": 0.1335, "hit": 62.99, "psr": 0.8321, "bh_sharpe": 1.183, "bh_return_pct": 13.55, "excess_sharpe": 0.1738, "precision": 0.6476, "recall": 0.8718, "f1": 0.7432, "f2": 0.8153, "accuracy": 0.6299, "mcc": 0.1501, "tp": 68, "fp": 37, "tn": 12, "fn": 10, "A_precision": 0.6476, "A_recall": 0.8718, "A_f1": 0.7432, "A_f2": 0.8153, "A_accuracy": 0.6299, "A_mcc": 0.1501, "A_tp": 68, "A_fp": 37, "A_tn": 12, "A_fn": 10}, {"fold": "fold_6", "regime": "COVID crash and V-recovery", "n": 172, "A_sharpe": -0.6481, "A_sortino": -0.6083, "A_excess_sharpe": -3.0757, "A_return_pct": -11.98, "A_hit_rate": 51.74, "A_n": 172, "A_bh_sharpe": 2.4276, "A_bh_return_pct": 45.89, "A_psr": 0.2964, "A_ic": -0.07, "B_sharpe": 4.7915, "B_sortino": 4.6845, "B_excess_sharpe": -0.9205, "B_return_pct": 348.45, "B_hit_rate": 64.33, "B_n": 172, "B_bh_sharpe": 5.712, "B_bh_return_pct": 489.18, "B_psr": 0.9998, "B_ic": 0.1915, "D_sharpe": -0.6481, "D_sortino": -0.6083, "D_excess_sharpe": -3.0757, "D_return_pct": -11.98, "D_hit_rate": 51.74, "D_n": 172, "D_bh_sharpe": 2.4276, "D_bh_return_pct": 45.89, "D_psr": 0.2964, "D_ic": -0.07, "sharpe": -0.6481, "sortino": -0.6083, "return_pct": -11.98, "equity": 880.1999999999999, "max_dd": 0.0, "win_rate": 51.74, "profit_factor": 0.0, "ic": -0.07, "hit": 51.74, "psr": 0.2964, "bh_sharpe": 2.4276, "bh_return_pct": 45.89, "excess_sharpe": -3.0757, "precision": 0.6172, "recall": 0.6991, "f1": 0.6556, "f2": 0.681, "accuracy": 0.5174, "mcc": -0.143, "tp": 79, "fp": 49, "tn": 10, "fn": 34, "A_precision": 0.6172, "A_recall": 0.6991, "A_f1": 0.6556, "A_f2": 0.681, "A_accuracy": 0.5174, "A_mcc": -0.143, "A_tp": 79, "A_fp": 49, "A_tn": 10, "A_fn": 34}, {"fold": "fold_7", "regime": "Inflation bear, AI rally and 2025", "n": 375, "A_sharpe": 0.6021, "A_sortino": 0.5732, "A_excess_sharpe": -0.1883, "A_return_pct": 17.81, "A_hit_rate": 56.0, "A_n": 375, "A_bh_sharpe": 0.7905, "A_bh_return_pct": 25.44, "A_psr": 0.7707, "A_ic": 0.0385, "B_sharpe": 0.4832, "B_sortino": 0.4847, "B_excess_sharpe": -1.4506, "B_return_pct": 18.87, "B_hit_rate": 51.07, "B_n": 375, "B_bh_sharpe": 1.9338, "B_bh_return_pct": 221.94, "B_psr": 0.7215, "B_ic": -0.0349, "D_sharpe": 0.6021, "D_sortino": 0.5732, "D_excess_sharpe": -0.1883, "D_return_pct": 17.81, "D_hit_rate": 56.0, "D_n": 375, "D_bh_sharpe": 0.7905, "D_bh_return_pct": 25.44, "D_psr": 0.7707, "D_ic": 0.0385, "sharpe": 0.6021, "sortino": 0.5732, "return_pct": 17.81, "equity": 1178.1, "max_dd": 0.0, "win_rate": 56.0, "profit_factor": 0.0, "ic": 0.0385, "hit": 56.0, "psr": 0.7707, "bh_sharpe": 0.7905, "bh_return_pct": 25.44, "excess_sharpe": -0.1883, "precision": 0.5862, "recall": 0.85, "f1": 0.6939, "f2": 0.7798, "accuracy": 0.56, "mcc": -0.0022, "tp": 187, "fp": 132, "tn": 23, "fn": 33, "A_precision": 0.5862, "A_recall": 0.85, "A_f1": 0.6939, "A_f2": 0.7798, "A_accuracy": 0.56, "A_mcc": -0.0022, "A_tp": 187, "A_fp": 132, "A_tn": 23, "A_fn": 33}], "per_window_val": [{"fold": "fold_1", "regime": "GFC peak crash (Lehman + Mar-2009 bottom)", "n": 37, "A_sharpe": 2.4732, "A_sortino": 2.2707, "A_excess_sharpe": 1.7148, "A_return_pct": 9.08, "A_hit_rate": 60.0, "A_n": 37, "A_bh_sharpe": 0.7585, "A_bh_return_pct": 2.39, "A_psr": 0.8168, "A_ic": 0.0415, "B_sharpe": -1.5283, "B_sortino": -1.4474, "B_excess_sharpe": -3.673, "B_return_pct": -9.74, "B_hit_rate": 51.35, "B_n": 37, "B_bh_sharpe": 2.1447, "B_bh_return_pct": 12.13, "B_psr": 0.2854, "B_ic": -0.0775, "D_sharpe": 2.4732, "D_sortino": 2.2707, "D_excess_sharpe": 1.7148, "D_return_pct": 9.08, "D_hit_rate": 60.0, "D_n": 37, "D_bh_sharpe": 0.7585, "D_bh_return_pct": 2.39, "D_psr": 0.8168, "D_ic": 0.0415, "sharpe": 2.4732, "sortino": 2.2707, "return_pct": 9.08, "equity": 1090.8, "max_dd": 0.0, "win_rate": 60.0, "profit_factor": 0.0, "ic": 0.0415, "hit": 60.0, "psr": 0.8168, "bh_sharpe": 0.7585, "bh_return_pct": 2.39, "excess_sharpe": 1.7148}, {"fold": "fold_2", "regime": "2011 US-downgrade + EU debt", "n": 46, "A_sharpe": -0.5349, "A_sortino": -0.4798, "A_excess_sharpe": -0.4811, "A_return_pct": -4.45, "A_hit_rate": 52.17, "A_n": 46, "A_bh_sharpe": -0.0539, "A_bh_return_pct": -1.46, "A_psr": 0.4099, "A_ic": 0.052, "B_sharpe": -2.0316, "B_sortino": -1.8415, "B_excess_sharpe": -0.4903, "B_return_pct": -28.3, "B_hit_rate": 45.65, "B_n": 46, "B_bh_sharpe": -1.5413, "B_bh_return_pct": -23.36, "B_psr": 0.189, "B_ic": 0.0747, "D_sharpe": -0.5349, "D_sortino": -0.4798, "D_excess_sharpe": -0.4811, "D_return_pct": -4.45, "D_hit_rate": 52.17, "D_n": 46, "D_bh_sharpe": -0.0539, "D_bh_return_pct": -1.46, "D_psr": 0.4099, "D_ic": 0.052, "sharpe": -0.5349, "sortino": -0.4798, "return_pct": -4.45, "equity": 955.5, "max_dd": 0.0, "win_rate": 52.17, "profit_factor": 0.0, "ic": 0.052, "hit": 52.17, "psr": 0.4099, "bh_sharpe": -0.0539, "bh_return_pct": -1.46, "excess_sharpe": -0.4811}, {"fold": "fold_3", "regime": "Taper tantrum and 2014 H1", "n": 4, "A_sharpe": 6.3226, "A_sortino": 11.1859, "A_excess_sharpe": 0.0, "A_return_pct": 0.58, "A_hit_rate": 50.0, "A_n": 4, "A_bh_sharpe": 6.3226, "A_bh_return_pct": 0.58, "A_psr": 0.773, "A_ic": -0.4, "B_sharpe": -23.4413, "B_sortino": -13.1441, "B_excess_sharpe": 0.0, "B_return_pct": -3.13, "B_hit_rate": 0.0, "B_n": 4, "B_bh_sharpe": -23.4413, "B_bh_return_pct": -3.13, "B_psr": 0.0, "B_ic": 0.2, "D_sharpe": 6.3226, "D_sortino": 11.1859, "D_excess_sharpe": 0.0, "D_return_pct": 0.58, "D_hit_rate": 50.0, "D_n": 4, "D_bh_sharpe": 6.3226, "D_bh_return_pct": 0.58, "D_psr": 0.773, "D_ic": -0.4, "sharpe": 6.3226, "sortino": 11.1859, "return_pct": 0.58, "equity": 1005.8000000000001, "max_dd": 0.0, "win_rate": 50.0, "profit_factor": 0.0, "ic": -0.4, "hit": 50.0, "psr": 0.773, "bh_sharpe": 6.3226, "bh_return_pct": 0.58, "excess_sharpe": 0.0}, {"fold": "fold_4", "regime": "China devaluation and oil crash", "n": 46, "A_sharpe": 0.5506, "A_sortino": 0.5121, "A_excess_sharpe": 1.7527, "A_return_pct": 1.92, "A_hit_rate": 54.35, "A_n": 46, "A_bh_sharpe": -1.2022, "A_bh_return_pct": -5.68, "A_psr": 0.5915, "A_ic": 0.3296, "B_sharpe": 3.2519, "B_sortino": 2.8382, "B_excess_sharpe": 5.5637, "B_return_pct": 36.7, "B_hit_rate": 65.22, "B_n": 46, "B_bh_sharpe": -2.3118, "B_bh_return_pct": -24.51, "B_psr": 0.8989, "B_ic": 0.5107, "D_sharpe": 0.5506, "D_sortino": 0.5121, "D_excess_sharpe": 1.7527, "D_return_pct": 1.92, "D_hit_rate": 54.35, "D_n": 46, "D_bh_sharpe": -1.2022, "D_bh_return_pct": -5.68, "D_psr": 0.5915, "D_ic": 0.3296, "sharpe": 0.5506, "sortino": 0.5121, "return_pct": 1.92, "equity": 1019.2000000000002, "max_dd": 0.0, "win_rate": 54.35, "profit_factor": 0.0, "ic": 0.3296, "hit": 54.35, "psr": 0.5915, "bh_sharpe": -1.2022, "bh_return_pct": -5.68, "excess_sharpe": 1.7527}, {"fold": "fold_5", "regime": "2018 Vol-mageddon + Q4 sell-off", "n": 4, "A_sharpe": -2.153, "A_sortino": -1.9225, "A_excess_sharpe": 12.6021, "A_return_pct": -0.73, "A_hit_rate": 50.0, "A_n": 4, "A_bh_sharpe": -14.7551, "A_bh_return_pct": -3.52, "A_psr": 0.407, "A_ic": 0.4, "B_sharpe": -10.8481, "B_sortino": -8.0895, "B_excess_sharpe": -13.0047, "B_return_pct": -5.43, "B_hit_rate": 25.0, "B_n": 4, "B_bh_sharpe": 2.1566, "B_bh_return_pct": 1.19, "B_psr": 0.099, "B_ic": -0.8, "D_sharpe": -2.153, "D_sortino": -1.9225, "D_excess_sharpe": 12.6021, "D_return_pct": -0.73, "D_hit_rate": 50.0, "D_n": 4, "D_bh_sharpe": -14.7551, "D_bh_return_pct": -3.52, "D_psr": 0.407, "D_ic": 0.4, "sharpe": -2.153, "sortino": -1.9225, "return_pct": -0.73, "equity": 992.7, "max_dd": 0.0, "win_rate": 50.0, "profit_factor": 0.0, "ic": 0.4, "hit": 50.0, "psr": 0.407, "bh_sharpe": -14.7551, "bh_return_pct": -3.52, "excess_sharpe": 12.6021}, {"fold": "fold_6", "regime": "COVID crash and V-recovery", "n": 25, "A_sharpe": 5.1249, "A_sortino": 6.1482, "A_excess_sharpe": 2.7111, "A_return_pct": 6.91, "A_hit_rate": 60.0, "A_n": 25, "A_bh_sharpe": 2.4138, "A_bh_return_pct": 3.27, "A_psr": 0.9459, "A_ic": 0.1069, "B_sharpe": 10.4646, "B_sortino": 8.8424, "B_excess_sharpe": -2.1009, "B_return_pct": 28.51, "B_hit_rate": 80.0, "B_n": 25, "B_bh_sharpe": 12.5655, "B_bh_return_pct": 32.76, "B_psr": 0.9954, "B_ic": 0.4554, "D_sharpe": 5.1249, "D_sortino": 6.1482, "D_excess_sharpe": 2.7111, "D_return_pct": 6.91, "D_hit_rate": 60.0, "D_n": 25, "D_bh_sharpe": 2.4138, "D_bh_return_pct": 3.27, "D_psr": 0.9459, "D_ic": 0.1069, "sharpe": 5.1249, "sortino": 6.1482, "return_pct": 6.91, "equity": 1069.1, "max_dd": 0.0, "win_rate": 60.0, "profit_factor": 0.0, "ic": 0.1069, "hit": 60.0, "psr": 0.9459, "bh_sharpe": 2.4138, "bh_return_pct": 3.27, "excess_sharpe": 2.7111}, {"fold": "fold_7", "regime": "Inflation bear, AI rally and 2025", "n": 64, "A_sharpe": -0.4639, "A_sortino": -0.4021, "A_excess_sharpe": -2.5047, "A_return_pct": -2.1, "A_hit_rate": 56.25, "A_n": 64, "A_bh_sharpe": 2.0409, "A_bh_return_pct": 7.94, "A_psr": 0.4078, "A_ic": 0.212, "B_sharpe": 0.4506, "B_sortino": 0.3809, "B_excess_sharpe": -4.9585, "B_return_pct": 2.3, "B_hit_rate": 60.94, "B_n": 64, "B_bh_sharpe": 5.4092, "B_bh_return_pct": 45.7, "B_psr": 0.5887, "B_ic": -0.1229, "D_sharpe": -0.4639, "D_sortino": -0.4021, "D_excess_sharpe": -2.5047, "D_return_pct": -2.1, "D_hit_rate": 56.25, "D_n": 64, "D_bh_sharpe": 2.0409, "D_bh_return_pct": 7.94, "D_psr": 0.4078, "D_ic": 0.212, "sharpe": -0.4639, "sortino": -0.4021, "return_pct": -2.1, "equity": 979.0, "max_dd": 0.0, "win_rate": 56.25, "profit_factor": 0.0, "ic": 0.212, "hit": 56.25, "psr": 0.4078, "bh_sharpe": 2.0409, "bh_return_pct": 7.94, "excess_sharpe": -2.5047}], "status": "DISCARD", "precision": 0.5854, "recall": 0.8296, "f1": 0.6864, "f2": 0.7657, "accuracy": 0.5509, "mcc": -0.0329, "tp": 521, "fp": 369, "tn": 63, "fn": 107, "test_sharpe": 0.4874, "A_sharpe": 0.4874, "A_excess_sharpe": -0.7327, "A_return_pct": 42.76, "A_precision": 0.5854, "A_recall": 0.8296, "A_f1": 0.6864, "A_f2": 0.7657, "A_accuracy": 0.5509, "A_mcc": -0.0329, "A_tp": 521, "A_fp": 369, "A_tn": 63, "A_fn": 107, "A_psr": 0.8417, "A_ic": 0.0047, "A_hit_rate": 55.25, "A_bh_sharpe": 1.2201, "A_bh_return_pct": 185.59}
