{"experiment_num": 29, "backbone": "mlp", "description": "MLP @ FX-Exp32 hd=0.30 (up from 0.25) - mild reg increase; Srivastava 2014 JMLR; tests dropout as variance-reduction lever", "config": {"seq_len": 10, "lr": 0.0003, "batch_size": 32, "epochs": 50, "weight_decay": 1e-05, "patience": 10, "warmup_epochs": 0, "head_dropout": 0.3, "huber_delta": 1.0, "grad_clip": 1.0, "seed": 0, "hidden_size": null, "num_layers": null, "max_depth": null, "gbm_lr": null, "n_estimators": null}, "composite": 0.132, "test_pos_folds": 6, "val_pos_folds": 4, "val_loss": -2.894058681459089, "elapsed_sec": 32.8, "timestamp": "2026-04-27T18:21:44", "sharpe": 0.232, "val_sharpe": 0.556, "ic": 0.024, "hit": 51.17, "psr": 0.7086, "equity": 1157.8, "return_pct": 15.78, "bh_sharpe": 0.6042, "bh_return_pct": 103.49, "excess_sharpe": -0.3722, "B_sharpe": 0.3484, "B_excess_sharpe": -1.3524, "B_return_pct": 28.44, "D_sharpe": 0.232, "D_excess_sharpe": -0.3722, "D_return_pct": 15.78, "per_window": [{"fold": "fold_1", "regime": "GFC peak crash (Lehman + Mar-2009 bottom)", "n": 115, "A_sharpe": 0.3366, "A_sortino": 0.3617, "A_excess_sharpe": 0.7807, "A_return_pct": 2.08, "A_hit_rate": 49.57, "A_n": 115, "A_bh_sharpe": -0.4441, "A_bh_return_pct": -14.4, "A_psr": 0.5898, "A_ic": -0.0049, "B_sharpe": 4.0254, "B_sortino": 4.6234, "B_excess_sharpe": 4.3232, "B_return_pct": 324.02, "B_hit_rate": 58.77, "B_n": 115, "B_bh_sharpe": -0.2978, "B_bh_return_pct": -27.23, "B_psr": 0.9972, "B_ic": 0.3318, "D_sharpe": 0.3366, "D_sortino": 0.3617, "D_excess_sharpe": 0.7807, "D_return_pct": 2.08, "D_hit_rate": 49.57, "D_n": 115, "D_bh_sharpe": -0.4441, "D_bh_return_pct": -14.4, "D_psr": 0.5898, "D_ic": -0.0049, "sharpe": 0.3366, "sortino": 0.3617, "return_pct": 2.08, "equity": 1020.8, "max_dd": 0.0, "win_rate": 49.57, "profit_factor": 0.0, "ic": -0.0049, "hit": 49.57, "psr": 0.5898, "bh_sharpe": -0.4441, "bh_return_pct": -14.4, "excess_sharpe": 0.7807, "precision": 0.475, "recall": 0.7037, "f1": 0.5672, "f2": 0.6419, "accuracy": 0.4957, "mcc": 0.0165, "tp": 38, "fp": 42, "tn": 19, "fn": 16, "A_precision": 0.475, "A_recall": 0.7037, "A_f1": 0.5672, "A_f2": 0.6419, "A_accuracy": 0.4957, "A_mcc": 0.0165, "A_tp": 38, "A_fp": 42, "A_tn": 19, "A_fn": 16}, {"fold": "fold_2", "regime": "2011 US-downgrade + EU debt", "n": 136, "A_sharpe": 0.1586, "A_sortino": 0.1617, "A_excess_sharpe": -1.5741, "A_return_pct": 0.62, "A_hit_rate": 49.63, "A_n": 136, "A_bh_sharpe": 1.7327, "A_bh_return_pct": 19.75, "A_psr": 0.5462, "A_ic": -0.0362, "B_sharpe": 2.3014, "B_sortino": 2.2245, "B_excess_sharpe": -1.7645, "B_return_pct": 65.44, "B_hit_rate": 61.76, "B_n": 136, "B_bh_sharpe": 4.0659, "B_bh_return_pct": 148.68, "B_psr": 0.9542, "B_ic": 0.1475, "D_sharpe": 0.1586, "D_sortino": 0.1617, "D_excess_sharpe": -1.5741, "D_return_pct": 0.62, "D_hit_rate": 49.63, "D_n": 136, "D_bh_sharpe": 1.7327, "D_bh_return_pct": 19.75, "D_psr": 0.5462, "D_ic": -0.0362, "sharpe": 0.1586, "sortino": 0.1617, "return_pct": 0.62, "equity": 1006.1999999999999, "max_dd": 0.0, "win_rate": 49.63, "profit_factor": 0.0, "ic": -0.0362, "hit": 49.63, "psr": 0.5462, "bh_sharpe": 1.7327, "bh_return_pct": 19.75, "excess_sharpe": -1.5741, "precision": 0.5521, "recall": 0.6795, "f1": 0.6092, "f2": 0.6495, "accuracy": 0.5, "mcc": -0.0672, "tp": 53, "fp": 43, "tn": 15, "fn": 25, "A_precision": 0.5521, "A_recall": 0.6795, "A_f1": 0.6092, "A_f2": 0.6495, "A_accuracy": 0.5, "A_mcc": -0.0672, "A_tp": 53, "A_fp": 43, "A_tn": 15, "A_fn": 25}, {"fold": "fold_3", "regime": "Taper tantrum and 2014 H1", "n": 178, "A_sharpe": 0.5222, "A_sortino": 0.5025, "A_excess_sharpe": -0.8223, "A_return_pct": 4.28, "A_hit_rate": 51.41, "A_n": 178, "A_bh_sharpe": 1.3445, "A_bh_return_pct": 12.41, "A_psr": 0.6681, "A_ic": 0.1115, "B_sharpe": -0.8099, "B_sortino": -0.8113, "B_excess_sharpe": -3.8582, "B_return_pct": -16.35, "B_hit_rate": 45.51, "B_n": 178, "B_bh_sharpe": 3.0483, "B_bh_return_pct": 71.83, "B_psr": 0.2484, "B_ic": 0.0382, "D_sharpe": 0.5222, "D_sortino": 0.5025, "D_excess_sharpe": -0.8223, "D_return_pct": 4.28, "D_hit_rate": 51.41, "D_n": 178, "D_bh_sharpe": 1.3445, "D_bh_return_pct": 12.41, "D_psr": 0.6681, "D_ic": 0.1115, "sharpe": 0.5222, "sortino": 0.5025, "return_pct": 4.28, "equity": 1042.8, "max_dd": 0.0, "win_rate": 51.41, "profit_factor": 0.0, "ic": 0.1115, "hit": 51.41, "psr": 0.6681, "bh_sharpe": 1.3445, "bh_return_pct": 12.41, "excess_sharpe": -0.8223, "precision": 0.563, "recall": 0.7379, "f1": 0.6387, "f2": 0.6947, "accuracy": 0.5169, "mcc": -0.0563, "tp": 76, "fp": 59, "tn": 16, "fn": 27, "A_precision": 0.563, "A_recall": 0.7379, "A_f1": 0.6387, "A_f2": 0.6947, "A_accuracy": 0.5169, "A_mcc": -0.0563, "A_tp": 76, "A_fp": 59, "A_tn": 16, "A_fn": 27}, {"fold": "fold_4", "regime": "China devaluation and oil crash", "n": 157, "A_sharpe": 1.0262, "A_sortino": 1.0614, "A_excess_sharpe": 1.0164, "A_return_pct": 11.86, "A_hit_rate": 46.79, "A_n": 157, "A_bh_sharpe": 0.0098, "A_bh_return_pct": -1.05, "A_psr": 0.7872, "A_ic": 0.0927, "B_sharpe": 0.1614, "B_sortino": 0.1843, "B_excess_sharpe": 0.1455, "B_return_pct": -1.54, "B_hit_rate": 45.22, "B_n": 157, "B_bh_sharpe": 0.0159, "B_bh_return_pct": -5.48, "B_psr": 0.5507, "B_ic": 0.004, "D_sharpe": 1.0262, "D_sortino": 1.0614, "D_excess_sharpe": 1.0164, "D_return_pct": 11.86, "D_hit_rate": 46.79, "D_n": 157, "D_bh_sharpe": 0.0098, "D_bh_return_pct": -1.05, "D_psr": 0.7872, "D_ic": 0.0927, "sharpe": 1.0262, "sortino": 1.0614, "return_pct": 11.86, "equity": 1118.6000000000001, "max_dd": 0.0, "win_rate": 46.79, "profit_factor": 0.0, "ic": 0.0927, "hit": 46.79, "psr": 0.7872, "bh_sharpe": 0.0098, "bh_return_pct": -1.05, "excess_sharpe": 1.0164, "precision": 0.4875, "recall": 0.4815, "f1": 0.4845, "f2": 0.4827, "accuracy": 0.4713, "mcc": -0.058, "tp": 39, "fp": 41, "tn": 35, "fn": 42, "A_precision": 0.4875, "A_recall": 0.4815, "A_f1": 0.4845, "A_f2": 0.4827, "A_accuracy": 0.4713, "A_mcc": -0.058, "A_tp": 39, "A_fp": 41, "A_tn": 35, "A_fn": 42}, {"fold": "fold_5", "regime": "2018 Vol-mageddon + Q4 sell-off", "n": 177, "A_sharpe": 0.3898, "A_sortino": 0.396, "A_excess_sharpe": 0.08, "A_return_pct": 4.55, "A_hit_rate": 53.11, "A_n": 177, "A_bh_sharpe": 0.3098, "A_bh_return_pct": 3.19, "A_psr": 0.6281, "A_ic": -0.0036, "B_sharpe": 0.8724, "B_sortino": 0.9645, "B_excess_sharpe": -0.0193, "B_return_pct": 23.21, "B_hit_rate": 48.86, "B_n": 177, "B_bh_sharpe": 0.8917, "B_bh_return_pct": 23.8, "B_psr": 0.7688, "B_ic": -0.0203, "D_sharpe": 0.3898, "D_sortino": 0.396, "D_excess_sharpe": 0.08, "D_return_pct": 4.55, "D_hit_rate": 53.11, "D_n": 177, "D_bh_sharpe": 0.3098, "D_bh_return_pct": 3.19, "D_psr": 0.6281, "D_ic": -0.0036, "sharpe": 0.3898, "sortino": 0.396, "return_pct": 4.55, "equity": 1045.5, "max_dd": 0.0, "win_rate": 53.11, "profit_factor": 0.0, "ic": -0.0036, "hit": 53.11, "psr": 0.6281, "bh_sharpe": 0.3098, "bh_return_pct": 3.19, "excess_sharpe": 0.08, "precision": 0.602, "recall": 0.5728, "f1": 0.5871, "f2": 0.5784, "accuracy": 0.5311, "mcc": 0.0454, "tp": 59, "fp": 39, "tn": 35, "fn": 44, "A_precision": 0.602, "A_recall": 0.5728, "A_f1": 0.5871, "A_f2": 0.5784, "A_accuracy": 0.5311, "A_mcc": 0.0454, "A_tp": 59, "A_fp": 39, "A_tn": 35, "A_fn": 44}, {"fold": "fold_6", "regime": "COVID crash and V-recovery", "n": 222, "A_sharpe": 0.1149, "A_sortino": 0.1149, "A_excess_sharpe": -0.7739, "A_return_pct": -2.49, "A_hit_rate": 50.45, "A_n": 222, "A_bh_sharpe": 0.8888, "A_bh_return_pct": 26.13, "A_psr": 0.5428, "A_ic": 0.0504, "B_sharpe": -0.724, "B_sortino": -0.7854, "B_excess_sharpe": -3.1125, "B_return_pct": -48.23, "B_hit_rate": 44.34, "B_n": 222, "B_bh_sharpe": 2.3884, "B_bh_return_pct": 243.18, "B_psr": 0.2513, "B_ic": -0.0347, "D_sharpe": 0.1149, "D_sortino": 0.1149, "D_excess_sharpe": -0.7739, "D_return_pct": -2.49, "D_hit_rate": 50.45, "D_n": 222, "D_bh_sharpe": 0.8888, "D_bh_return_pct": 26.13, "D_psr": 0.5428, "D_ic": 0.0504, "sharpe": 0.1149, "sortino": 0.1149, "return_pct": -2.49, "equity": 975.1, "max_dd": 0.0, "win_rate": 50.45, "profit_factor": 0.0, "ic": 0.0504, "hit": 50.45, "psr": 0.5428, "bh_sharpe": 0.8888, "bh_return_pct": 26.13, "excess_sharpe": -0.7739, "precision": 0.6296, "recall": 0.4928, "f1": 0.5528, "f2": 0.5152, "accuracy": 0.5045, "mcc": 0.0161, "tp": 68, "fp": 40, "tn": 44, "fn": 70, "A_precision": 0.6296, "A_recall": 0.4928, "A_f1": 0.5528, "A_f2": 0.5152, "A_accuracy": 0.5045, "A_mcc": 0.0161, "A_tp": 68, "A_fp": 40, "A_tn": 44, "A_fn": 70}, {"fold": "fold_7", "regime": "Inflation bear, AI rally and 2025", "n": 425, "A_sharpe": -0.0381, "A_sortino": -0.0365, "A_excess_sharpe": -1.0096, "A_return_pct": -5.22, "A_hit_rate": 53.18, "A_n": 425, "A_bh_sharpe": 0.9715, "A_bh_return_pct": 37.12, "A_psr": 0.4803, "A_ic": 0.016, "B_sharpe": -1.1497, "B_sortino": -1.1169, "B_excess_sharpe": -3.6523, "B_return_pct": -65.15, "B_hit_rate": 46.7, "B_n": 425, "B_bh_sharpe": 2.5027, "B_bh_return_pct": 458.83, "B_psr": 0.0685, "B_ic": -0.0931, "D_sharpe": -0.0381, "D_sortino": -0.0365, "D_excess_sharpe": -1.0096, "D_return_pct": -5.22, "D_hit_rate": 53.18, "D_n": 425, "D_bh_sharpe": 0.9715, "D_bh_return_pct": 37.12, "D_psr": 0.4803, "D_ic": 0.016, "sharpe": -0.0381, "sortino": -0.0365, "return_pct": -5.22, "equity": 947.8, "max_dd": 0.0, "win_rate": 53.18, "profit_factor": 0.0, "ic": 0.016, "hit": 53.18, "psr": 0.4803, "bh_sharpe": 0.9715, "bh_return_pct": 37.12, "excess_sharpe": -1.0096, "precision": 0.5934, "recall": 0.648, "f1": 0.6195, "f2": 0.6363, "accuracy": 0.5318, "mcc": 0.0141, "tp": 162, "fp": 111, "tn": 64, "fn": 88, "A_precision": 0.5934, "A_recall": 0.648, "A_f1": 0.6195, "A_f2": 0.6363, "A_accuracy": 0.5318, "A_mcc": 0.0141, "A_tp": 162, "A_fp": 111, "A_tn": 64, "A_fn": 88}], "per_window_val": [{"fold": "fold_1", "regime": "GFC peak crash (Lehman + Mar-2009 bottom)", "n": 104, "A_sharpe": 1.3405, "A_sortino": 1.4132, "A_excess_sharpe": 1.5077, "A_return_pct": 15.66, "A_hit_rate": 52.94, "A_n": 104, "A_bh_sharpe": -0.1672, "A_bh_return_pct": -3.81, "A_psr": 0.8078, "A_ic": 0.0703, "B_sharpe": 3.3214, "B_sortino": 3.865, "B_excess_sharpe": 5.5955, "B_return_pct": 98.03, "B_hit_rate": 57.28, "B_n": 104, "B_bh_sharpe": -2.2741, "B_bh_return_pct": -44.12, "B_psr": 0.9871, "B_ic": 0.1401, "D_sharpe": 1.3405, "D_sortino": 1.4132, "D_excess_sharpe": 1.5077, "D_return_pct": 15.66, "D_hit_rate": 52.94, "D_n": 104, "D_bh_sharpe": -0.1672, "D_bh_return_pct": -3.81, "D_psr": 0.8078, "D_ic": 0.0703, "sharpe": 1.3405, "sortino": 1.4132, "return_pct": 15.66, "equity": 1156.6000000000001, "max_dd": 0.0, "win_rate": 52.94, "profit_factor": 0.0, "ic": 0.0703, "hit": 52.94, "psr": 0.8078, "bh_sharpe": -0.1672, "bh_return_pct": -3.81, "excess_sharpe": 1.5077}, {"fold": "fold_2", "regime": "2011 US-downgrade + EU debt", "n": 96, "A_sharpe": 0.3041, "A_sortino": 0.3037, "A_excess_sharpe": 0.5783, "A_return_pct": 1.75, "A_hit_rate": 48.42, "A_n": 96, "A_bh_sharpe": -0.2741, "A_bh_return_pct": -4.09, "A_psr": 0.5738, "A_ic": -0.1103, "B_sharpe": 0.8835, "B_sortino": 1.0421, "B_excess_sharpe": 1.911, "B_return_pct": 14.14, "B_hit_rate": 45.83, "B_n": 96, "B_bh_sharpe": -1.0274, "B_bh_return_pct": -25.58, "B_psr": 0.7085, "B_ic": -0.0853, "D_sharpe": 0.3041, "D_sortino": 0.3037, "D_excess_sharpe": 0.5783, "D_return_pct": 1.75, "D_hit_rate": 48.42, "D_n": 96, "D_bh_sharpe": -0.2741, "D_bh_return_pct": -4.09, "D_psr": 0.5738, "D_ic": -0.1103, "sharpe": 0.3041, "sortino": 0.3037, "return_pct": 1.75, "equity": 1017.5000000000001, "max_dd": 0.0, "win_rate": 48.42, "profit_factor": 0.0, "ic": -0.1103, "hit": 48.42, "psr": 0.5738, "bh_sharpe": -0.2741, "bh_return_pct": -4.09, "excess_sharpe": 0.5783}, {"fold": "fold_3", "regime": "Taper tantrum and 2014 H1", "n": 54, "A_sharpe": 4.5829, "A_sortino": 4.6347, "A_excess_sharpe": -0.1169, "A_return_pct": 10.21, "A_hit_rate": 64.81, "A_n": 54, "A_bh_sharpe": 4.6998, "A_bh_return_pct": 10.46, "A_psr": 0.9762, "A_ic": -0.0396, "B_sharpe": 0.4767, "B_sortino": 0.4679, "B_excess_sharpe": -8.5559, "B_return_pct": 1.86, "B_hit_rate": 51.85, "B_n": 54, "B_bh_sharpe": 9.0326, "B_bh_return_pct": 49.18, "B_psr": 0.5863, "B_ic": -0.1809, "D_sharpe": 4.5829, "D_sortino": 4.6347, "D_excess_sharpe": -0.1169, "D_return_pct": 10.21, "D_hit_rate": 64.81, "D_n": 54, "D_bh_sharpe": 4.6998, "D_bh_return_pct": 10.46, "D_psr": 0.9762, "D_ic": -0.0396, "sharpe": 4.5829, "sortino": 4.6347, "return_pct": 10.21, "equity": 1102.1000000000001, "max_dd": 0.0, "win_rate": 64.81, "profit_factor": 0.0, "ic": -0.0396, "hit": 64.81, "psr": 0.9762, "bh_sharpe": 4.6998, "bh_return_pct": 10.46, "excess_sharpe": -0.1169}, {"fold": "fold_4", "regime": "China devaluation and oil crash", "n": 96, "A_sharpe": -0.33, "A_sortino": -0.3367, "A_excess_sharpe": 0.0941, "A_return_pct": -3.07, "A_hit_rate": 45.26, "A_n": 96, "A_bh_sharpe": -0.4241, "A_bh_return_pct": -3.73, "A_psr": 0.4197, "A_ic": -0.0304, "B_sharpe": 2.2581, "B_sortino": 3.3979, "B_excess_sharpe": 3.4424, "B_return_pct": 41.16, "B_hit_rate": 48.96, "B_n": 96, "B_bh_sharpe": -1.1843, "B_bh_return_pct": -21.44, "B_psr": 0.9411, "B_ic": -0.0284, "D_sharpe": -0.33, "D_sortino": -0.3367, "D_excess_sharpe": 0.0941, "D_return_pct": -3.07, "D_hit_rate": 45.26, "D_n": 96, "D_bh_sharpe": -0.4241, "D_bh_return_pct": -3.73, "D_psr": 0.4197, "D_ic": -0.0304, "sharpe": -0.33, "sortino": -0.3367, "return_pct": -3.07, "equity": 969.3000000000001, "max_dd": 0.0, "win_rate": 45.26, "profit_factor": 0.0, "ic": -0.0304, "hit": 45.26, "psr": 0.4197, "bh_sharpe": -0.4241, "bh_return_pct": -3.73, "excess_sharpe": 0.0941}, {"fold": "fold_5", "regime": "2018 Vol-mageddon + Q4 sell-off", "n": 54, "A_sharpe": -4.3482, "A_sortino": -3.5327, "A_excess_sharpe": -5.7762, "A_return_pct": -11.52, "A_hit_rate": 44.44, "A_n": 54, "A_bh_sharpe": 1.428, "A_bh_return_pct": 3.97, "A_psr": 0.016, "A_ic": -0.0064, "B_sharpe": -4.1066, "B_sortino": -3.8238, "B_excess_sharpe": -9.0388, "B_return_pct": -23.78, "B_hit_rate": 37.04, "B_n": 54, "B_bh_sharpe": 4.9322, "B_bh_return_pct": 34.93, "B_psr": 0.0324, "B_ic": -0.546, "D_sharpe": -4.3482, "D_sortino": -3.5327, "D_excess_sharpe": -5.7762, "D_return_pct": -11.52, "D_hit_rate": 44.44, "D_n": 54, "D_bh_sharpe": 1.428, "D_bh_return_pct": 3.97, "D_psr": 0.016, "D_ic": -0.0064, "sharpe": -4.3482, "sortino": -3.5327, "return_pct": -11.52, "equity": 884.8000000000001, "max_dd": 0.0, "win_rate": 44.44, "profit_factor": 0.0, "ic": -0.0064, "hit": 44.44, "psr": 0.016, "bh_sharpe": 1.428, "bh_return_pct": 3.97, "excess_sharpe": -5.7762}, {"fold": "fold_6", "regime": "COVID crash and V-recovery", "n": 75, "A_sharpe": -0.7232, "A_sortino": -0.7973, "A_excess_sharpe": -5.0226, "A_return_pct": -2.57, "A_hit_rate": 42.67, "A_n": 75, "A_bh_sharpe": 4.2994, "A_bh_return_pct": 14.68, "A_psr": 0.3491, "A_ic": -0.0787, "B_sharpe": 2.0063, "B_sortino": 2.0779, "B_excess_sharpe": -12.3276, "B_return_pct": 15.02, "B_hit_rate": 56.0, "B_n": 75, "B_bh_sharpe": 14.3339, "B_bh_return_pct": 120.13, "B_psr": 0.8613, "B_ic": 0.1271, "D_sharpe": -0.7232, "D_sortino": -0.7973, "D_excess_sharpe": -5.0226, "D_return_pct": -2.57, "D_hit_rate": 42.67, "D_n": 75, "D_bh_sharpe": 4.2994, "D_bh_return_pct": 14.68, "D_psr": 0.3491, "D_ic": -0.0787, "sharpe": -0.7232, "sortino": -0.7973, "return_pct": -2.57, "equity": 974.3000000000001, "max_dd": 0.0, "win_rate": 42.67, "profit_factor": 0.0, "ic": -0.0787, "hit": 42.67, "psr": 0.3491, "bh_sharpe": 4.2994, "bh_return_pct": 14.68, "excess_sharpe": -5.0226}, {"fold": "fold_7", "regime": "Inflation bear, AI rally and 2025", "n": 114, "A_sharpe": 2.0396, "A_sortino": 1.8934, "A_excess_sharpe": -0.8055, "A_return_pct": 14.82, "A_hit_rate": 60.53, "A_n": 114, "A_bh_sharpe": 2.845, "A_bh_return_pct": 21.34, "A_psr": 0.9103, "A_ic": 0.0147, "B_sharpe": 0.6768, "B_sortino": 0.5758, "B_excess_sharpe": -5.4598, "B_return_pct": 8.6, "B_hit_rate": 60.53, "B_n": 114, "B_bh_sharpe": 6.1366, "B_bh_return_pct": 155.03, "B_psr": 0.6731, "B_ic": 0.0194, "D_sharpe": 2.0396, "D_sortino": 1.8934, "D_excess_sharpe": -0.8055, "D_return_pct": 14.82, "D_hit_rate": 60.53, "D_n": 114, "D_bh_sharpe": 2.845, "D_bh_return_pct": 21.34, "D_psr": 0.9103, "D_ic": 0.0147, "sharpe": 2.0396, "sortino": 1.8934, "return_pct": 14.82, "equity": 1148.2, "max_dd": 0.0, "win_rate": 60.53, "profit_factor": 0.0, "ic": 0.0147, "hit": 60.53, "psr": 0.9103, "bh_sharpe": 2.845, "bh_return_pct": 21.34, "excess_sharpe": -0.8055}], "status": "DISCARD", "precision": 0.569, "recall": 0.6134, "f1": 0.5903, "f2": 0.604, "accuracy": 0.5128, "mcc": -0.0087, "tp": 495, "fp": 375, "tn": 228, "fn": 312, "test_sharpe": 0.232, "A_sharpe": 0.232, "A_excess_sharpe": -0.3722, "A_return_pct": 15.78, "A_precision": 0.569, "A_recall": 0.6134, "A_f1": 0.5903, "A_f2": 0.604, "A_accuracy": 0.5128, "A_mcc": -0.0087, "A_tp": 495, "A_fp": 375, "A_tn": 228, "A_fn": 312, "A_psr": 0.7086, "A_ic": 0.024, "A_hit_rate": 51.17, "A_bh_sharpe": 0.6042, "A_bh_return_pct": 103.49}
