{"experiment_num": 17, "backbone": "mamba", "description": "dMamba @ FX-Mamba-winner config (variant=dmamba expand=4 \u2014 Liu 2025 arXiv:2602.09081); Gu-Dao 2024; QQQ \u2014 FX-Mamba-phase champion retry (kwarg fix)", "config": {"seq_len": 60, "lr": 0.0005, "batch_size": 32, "epochs": 100, "weight_decay": 0.1, "patience": 20, "warmup_epochs": 10, "head_dropout": 0.1, "huber_delta": 1.0, "grad_clip": 1.0, "seed": 42, "hidden_size": null, "num_layers": null, "max_depth": null, "gbm_lr": null, "n_estimators": null}, "composite": 0.8625, "test_pos_folds": 7, "val_pos_folds": 4, "val_loss": -2.8678495736248726, "elapsed_sec": 2473.1, "timestamp": "2026-04-26T22:15:12", "sharpe": 0.8625, "val_sharpe": 1.1645, "ic": 0.0177, "hit": 55.53, "psr": 0.9627, "equity": 2037.7, "return_pct": 103.77, "bh_sharpe": 1.2201, "bh_return_pct": 185.59, "excess_sharpe": -0.3576, "B_sharpe": 0.1753, "B_excess_sharpe": -2.6631, "B_return_pct": -10.51, "D_sharpe": 0.8625, "D_excess_sharpe": -0.3576, "D_return_pct": 103.77, "per_window": [{"fold": "fold_1", "regime": "GFC peak crash (Lehman + Mar-2009 bottom)", "n": 65, "A_sharpe": 0.6565, "A_sortino": 0.6952, "A_excess_sharpe": 0.2303, "A_return_pct": 4.65, "A_hit_rate": 50.77, "A_n": 65, "A_bh_sharpe": 0.4262, "A_bh_return_pct": 2.34, "A_psr": 0.6302, "A_ic": 0.0459, "B_sharpe": -0.0116, "B_sortino": -0.0121, "B_excess_sharpe": -1.8993, "B_return_pct": -7.55, "B_hit_rate": 46.88, "B_n": 65, "B_bh_sharpe": 1.8877, "B_bh_return_pct": 34.48, "B_psr": 0.4977, "B_ic": 0.0584, "D_sharpe": 0.6565, "D_sortino": 0.6952, "D_excess_sharpe": 0.2303, "D_return_pct": 4.65, "D_hit_rate": 50.77, "D_n": 65, "D_bh_sharpe": 0.4262, "D_bh_return_pct": 2.34, "D_psr": 0.6302, "D_ic": 0.0459, "sharpe": 0.6565, "sortino": 0.6952, "return_pct": 4.65, "equity": 1046.5, "max_dd": 0.0, "win_rate": 50.77, "profit_factor": 0.0, "ic": 0.0459, "hit": 50.77, "psr": 0.6302, "bh_sharpe": 0.4262, "bh_return_pct": 2.34, "excess_sharpe": 0.2303, "precision": 0.5357, "recall": 0.4412, "f1": 0.4839, "f2": 0.4573, "accuracy": 0.5077, "mcc": 0.022, "tp": 15, "fp": 13, "tn": 18, "fn": 19, "A_precision": 0.5357, "A_recall": 0.4412, "A_f1": 0.4839, "A_f2": 0.4573, "A_accuracy": 0.5077, "A_mcc": 0.022, "A_tp": 15, "A_fp": 13, "A_tn": 18, "A_fn": 19}, {"fold": "fold_2", "regime": "2011 US-downgrade + EU debt", "n": 86, "A_sharpe": 5.0947, "A_sortino": 7.004, "A_excess_sharpe": 0.2265, "A_return_pct": 29.27, "A_hit_rate": 62.35, "A_n": 86, "A_bh_sharpe": 4.8682, "A_bh_return_pct": 27.91, "A_psr": 0.9997, "A_ic": 0.1525, "B_sharpe": 0.7091, "B_sortino": 0.8245, "B_excess_sharpe": -10.61, "B_return_pct": 6.48, "B_hit_rate": 46.51, "B_n": 86, "B_bh_sharpe": 11.3191, "B_bh_return_pct": 186.84, "B_psr": 0.6614, "B_ic": 0.2296, "D_sharpe": 5.0947, "D_sortino": 7.004, "D_excess_sharpe": 0.2265, "D_return_pct": 29.27, "D_hit_rate": 62.35, "D_n": 86, "D_bh_sharpe": 4.8682, "D_bh_return_pct": 27.91, "D_psr": 0.9997, "D_ic": 0.1525, "sharpe": 5.0947, "sortino": 7.004, "return_pct": 29.27, "equity": 1292.7, "max_dd": 0.0, "win_rate": 62.35, "profit_factor": 0.0, "ic": 0.1525, "hit": 62.35, "psr": 0.9997, "bh_sharpe": 4.8682, "bh_return_pct": 27.91, "excess_sharpe": 0.2265, "precision": 0.6721, "recall": 0.7736, "f1": 0.7193, "f2": 0.7509, "accuracy": 0.6279, "mcc": 0.1794, "tp": 41, "fp": 20, "tn": 13, "fn": 12, "A_precision": 0.6721, "A_recall": 0.7736, "A_f1": 0.7193, "A_f2": 0.7509, "A_accuracy": 0.6279, "A_mcc": 0.1794, "A_tp": 41, "A_fp": 20, "A_tn": 13, "A_fn": 12}, {"fold": "fold_3", "regime": "Taper tantrum and 2014 H1", "n": 128, "A_sharpe": 1.0168, "A_sortino": 0.9024, "A_excess_sharpe": -1.0421, "A_return_pct": 6.32, "A_hit_rate": 55.12, "A_n": 128, "A_bh_sharpe": 2.0589, "A_bh_return_pct": 13.6, "A_psr": 0.758, "A_ic": -0.0604, "B_sharpe": -5.3495, "B_sortino": -4.8315, "B_excess_sharpe": -9.861, "B_return_pct": -47.15, "B_hit_rate": 33.59, "B_n": 128, "B_bh_sharpe": 4.5116, "B_bh_return_pct": 67.92, "B_psr": 0.0001, "B_ic": -0.3532, "D_sharpe": 1.0168, "D_sortino": 0.9024, "D_excess_sharpe": -1.0421, "D_return_pct": 6.32, "D_hit_rate": 55.12, "D_n": 128, "D_bh_sharpe": 2.0589, "D_bh_return_pct": 13.6, "D_psr": 0.758, "D_ic": -0.0604, "sharpe": 1.0168, "sortino": 0.9024, "return_pct": 6.32, "equity": 1063.1999999999998, "max_dd": 0.0, "win_rate": 55.12, "profit_factor": 0.0, "ic": -0.0604, "hit": 55.12, "psr": 0.758, "bh_sharpe": 2.0589, "bh_return_pct": 13.6, "excess_sharpe": -1.0421, "precision": 0.5847, "recall": 0.8846, "f1": 0.7041, "f2": 0.8023, "accuracy": 0.5469, "mcc": -0.1734, "tp": 69, "fp": 49, "tn": 1, "fn": 9, "A_precision": 0.5847, "A_recall": 0.8846, "A_f1": 0.7041, "A_f2": 0.8023, "A_accuracy": 0.5469, "A_mcc": -0.1734, "A_tp": 69, "A_fp": 49, "A_tn": 1, "A_fn": 9}, {"fold": "fold_4", "regime": "China devaluation and oil crash", "n": 107, "A_sharpe": 0.2139, "A_sortino": 0.182, "A_excess_sharpe": 1.0171, "A_return_pct": 0.97, "A_hit_rate": 56.6, "A_n": 107, "A_bh_sharpe": -0.8032, "A_bh_return_pct": -7.58, "A_psr": 0.5549, "A_ic": 0.1076, "B_sharpe": 0.421, "B_sortino": 0.4383, "B_excess_sharpe": 2.3805, "B_return_pct": 3.84, "B_hit_rate": 50.47, "B_n": 107, "B_bh_sharpe": -1.9596, "B_bh_return_pct": -33.47, "B_psr": 0.6079, "B_ic": 0.0715, "D_sharpe": 0.2139, "D_sortino": 0.182, "D_excess_sharpe": 1.0171, "D_return_pct": 0.97, "D_hit_rate": 56.6, "D_n": 107, "D_bh_sharpe": -0.8032, "D_bh_return_pct": -7.58, "D_psr": 0.5549, "D_ic": 0.1076, "sharpe": 0.2139, "sortino": 0.182, "return_pct": 0.97, "equity": 1009.7, "max_dd": 0.0, "win_rate": 56.6, "profit_factor": 0.0, "ic": 0.1076, "hit": 56.6, "psr": 0.5549, "bh_sharpe": -0.8032, "bh_return_pct": -7.58, "excess_sharpe": 1.0171, "precision": 0.5357, "recall": 0.8654, "f1": 0.6618, "f2": 0.7705, "accuracy": 0.5701, "mcc": 0.1902, "tp": 45, "fp": 39, "tn": 16, "fn": 7, "A_precision": 0.5357, "A_recall": 0.8654, "A_f1": 0.6618, "A_f2": 0.7705, "A_accuracy": 0.5701, "A_mcc": 0.1902, "A_tp": 45, "A_fp": 39, "A_tn": 16, "A_fn": 7}, {"fold": "fold_5", "regime": "2018 Vol-mageddon + Q4 sell-off", "n": 127, "A_sharpe": 0.8351, "A_sortino": 0.8718, "A_excess_sharpe": -0.3479, "A_return_pct": 8.95, "A_hit_rate": 55.12, "A_n": 127, "A_bh_sharpe": 1.183, "A_bh_return_pct": 13.55, "A_psr": 0.7254, "A_ic": 0.0488, "B_sharpe": 3.1855, "B_sortino": 3.4688, "B_excess_sharpe": 0.2799, "B_return_pct": 97.62, "B_hit_rate": 57.14, "B_n": 127, "B_bh_sharpe": 2.9056, "B_bh_return_pct": 85.51, "B_psr": 0.987, "B_ic": 0.295, "D_sharpe": 0.8351, "D_sortino": 0.8718, "D_excess_sharpe": -0.3479, "D_return_pct": 8.95, "D_hit_rate": 55.12, "D_n": 127, "D_bh_sharpe": 1.183, "D_bh_return_pct": 13.55, "D_psr": 0.7254, "D_ic": 0.0488, "sharpe": 0.8351, "sortino": 0.8718, "return_pct": 8.95, "equity": 1089.5, "max_dd": 0.0, "win_rate": 55.12, "profit_factor": 0.0, "ic": 0.0488, "hit": 55.12, "psr": 0.7254, "bh_sharpe": 1.183, "bh_return_pct": 13.55, "excess_sharpe": -0.3479, "precision": 0.6105, "recall": 0.7436, "f1": 0.6705, "f2": 0.7125, "accuracy": 0.5512, "mcc": -0.0129, "tp": 58, "fp": 37, "tn": 12, "fn": 20, "A_precision": 0.6105, "A_recall": 0.7436, "A_f1": 0.6705, "A_f2": 0.7125, "A_accuracy": 0.5512, "A_mcc": -0.0129, "A_tp": 58, "A_fp": 37, "A_tn": 12, "A_fn": 20}, {"fold": "fold_6", "regime": "COVID crash and V-recovery", "n": 172, "A_sharpe": 0.3319, "A_sortino": 0.331, "A_excess_sharpe": -2.0957, "A_return_pct": 3.55, "A_hit_rate": 52.91, "A_n": 172, "A_bh_sharpe": 2.4276, "A_bh_return_pct": 45.89, "A_psr": 0.6079, "A_ic": -0.0394, "B_sharpe": 0.2727, "B_sortino": 0.3088, "B_excess_sharpe": -5.4393, "B_return_pct": 0.76, "B_hit_rate": 46.78, "B_n": 172, "B_bh_sharpe": 5.712, "B_bh_return_pct": 489.18, "B_psr": 0.5893, "B_ic": 0.0147, "D_sharpe": 0.3319, "D_sortino": 0.331, "D_excess_sharpe": -2.0957, "D_return_pct": 3.55, "D_hit_rate": 52.91, "D_n": 172, "D_bh_sharpe": 2.4276, "D_bh_return_pct": 45.89, "D_psr": 0.6079, "D_ic": -0.0394, "sharpe": 0.3319, "sortino": 0.331, "return_pct": 3.55, "equity": 1035.5, "max_dd": 0.0, "win_rate": 52.91, "profit_factor": 0.0, "ic": -0.0394, "hit": 52.91, "psr": 0.6079, "bh_sharpe": 2.4276, "bh_return_pct": 45.89, "excess_sharpe": -2.0957, "precision": 0.6404, "recall": 0.646, "f1": 0.6432, "f2": 0.6449, "accuracy": 0.5291, "mcc": -0.0491, "tp": 73, "fp": 41, "tn": 18, "fn": 40, "A_precision": 0.6404, "A_recall": 0.646, "A_f1": 0.6432, "A_f2": 0.6449, "A_accuracy": 0.5291, "A_mcc": -0.0491, "A_tp": 73, "A_fp": 41, "A_tn": 18, "A_fn": 40}, {"fold": "fold_7", "regime": "Inflation bear, AI rally and 2025", "n": 375, "A_sharpe": 0.7643, "A_sortino": 0.7509, "A_excess_sharpe": -0.0261, "A_return_pct": 24.36, "A_hit_rate": 56.0, "A_n": 375, "A_bh_sharpe": 0.7905, "A_bh_return_pct": 25.44, "A_psr": 0.828, "A_ic": 0.0071, "B_sharpe": -0.0332, "B_sortino": -0.0347, "B_excess_sharpe": -1.9669, "B_return_pct": -16.81, "B_hit_rate": 48.4, "B_n": 375, "B_bh_sharpe": 1.9338, "B_bh_return_pct": 221.94, "B_psr": 0.4839, "B_ic": -0.0701, "D_sharpe": 0.7643, "D_sortino": 0.7509, "D_excess_sharpe": -0.0261, "D_return_pct": 24.36, "D_hit_rate": 56.0, "D_n": 375, "D_bh_sharpe": 0.7905, "D_bh_return_pct": 25.44, "D_psr": 0.828, "D_ic": 0.0071, "sharpe": 0.7643, "sortino": 0.7509, "return_pct": 24.36, "equity": 1243.6000000000001, "max_dd": 0.0, "win_rate": 56.0, "profit_factor": 0.0, "ic": 0.0071, "hit": 56.0, "psr": 0.828, "bh_sharpe": 0.7905, "bh_return_pct": 25.44, "excess_sharpe": -0.0261, "precision": 0.6054, "recall": 0.7182, "f1": 0.657, "f2": 0.6924, "accuracy": 0.56, "mcc": 0.0575, "tp": 158, "fp": 103, "tn": 52, "fn": 62, "A_precision": 0.6054, "A_recall": 0.7182, "A_f1": 0.657, "A_f2": 0.6924, "A_accuracy": 0.56, "A_mcc": 0.0575, "A_tp": 158, "A_fp": 103, "A_tn": 52, "A_fn": 62}], "per_window_val": [{"fold": "fold_1", "regime": "GFC peak crash (Lehman + Mar-2009 bottom)", "n": 37, "A_sharpe": 4.8719, "A_sortino": 5.4251, "A_excess_sharpe": 4.1135, "A_return_pct": 18.54, "A_hit_rate": 62.86, "A_n": 37, "A_bh_sharpe": 0.7585, "A_bh_return_pct": 2.39, "A_psr": 0.9697, "A_ic": 0.4818, "B_sharpe": 2.8916, "B_sortino": 3.5515, "B_excess_sharpe": 0.7469, "B_return_pct": 17.04, "B_hit_rate": 56.76, "B_n": 37, "B_bh_sharpe": 2.1447, "B_bh_return_pct": 12.13, "B_psr": 0.8768, "B_ic": 0.2432, "D_sharpe": 4.8719, "D_sortino": 5.4251, "D_excess_sharpe": 4.1135, "D_return_pct": 18.54, "D_hit_rate": 62.86, "D_n": 37, "D_bh_sharpe": 0.7585, "D_bh_return_pct": 2.39, "D_psr": 0.9697, "D_ic": 0.4818, "sharpe": 4.8719, "sortino": 5.4251, "return_pct": 18.54, "equity": 1185.4, "max_dd": 0.0, "win_rate": 62.86, "profit_factor": 0.0, "ic": 0.4818, "hit": 62.86, "psr": 0.9697, "bh_sharpe": 0.7585, "bh_return_pct": 2.39, "excess_sharpe": 4.1135}, {"fold": "fold_2", "regime": "2011 US-downgrade + EU debt", "n": 46, "A_sharpe": -0.1754, "A_sortino": -0.1774, "A_excess_sharpe": -0.1215, "A_return_pct": -2.22, "A_hit_rate": 45.65, "A_n": 46, "A_bh_sharpe": -0.0539, "A_bh_return_pct": -1.46, "A_psr": 0.4704, "A_ic": -0.0047, "B_sharpe": 3.3936, "B_sortino": 4.0807, "B_excess_sharpe": 4.9348, "B_return_pct": 50.39, "B_hit_rate": 56.52, "B_n": 46, "B_bh_sharpe": -1.5413, "B_bh_return_pct": -23.36, "B_psr": 0.9328, "B_ic": 0.2802, "D_sharpe": -0.1754, "D_sortino": -0.1774, "D_excess_sharpe": -0.1215, "D_return_pct": -2.22, "D_hit_rate": 45.65, "D_n": 46, "D_bh_sharpe": -0.0539, "D_bh_return_pct": -1.46, "D_psr": 0.4704, "D_ic": -0.0047, "sharpe": -0.1754, "sortino": -0.1774, "return_pct": -2.22, "equity": 977.8, "max_dd": 0.0, "win_rate": 45.65, "profit_factor": 0.0, "ic": -0.0047, "hit": 45.65, "psr": 0.4704, "bh_sharpe": -0.0539, "bh_return_pct": -1.46, "excess_sharpe": -0.1215}, {"fold": "fold_3", "regime": "Taper tantrum and 2014 H1", "n": 4, "A_sharpe": 6.3226, "A_sortino": 11.1859, "A_excess_sharpe": 0.0, "A_return_pct": 0.58, "A_hit_rate": 50.0, "A_n": 4, "A_bh_sharpe": 6.3226, "A_bh_return_pct": 0.58, "A_psr": 0.773, "A_ic": -0.4, "B_sharpe": 10.6651, "B_sortino": 32.1081, "B_excess_sharpe": 34.1064, "B_return_pct": 2.13, "B_hit_rate": 50.0, "B_n": 4, "B_bh_sharpe": -23.4413, "B_bh_return_pct": -3.13, "B_psr": 0.9141, "B_ic": 0.8, "D_sharpe": 6.3226, "D_sortino": 11.1859, "D_excess_sharpe": 0.0, "D_return_pct": 0.58, "D_hit_rate": 50.0, "D_n": 4, "D_bh_sharpe": 6.3226, "D_bh_return_pct": 0.58, "D_psr": 0.773, "D_ic": -0.4, "sharpe": 6.3226, "sortino": 11.1859, "return_pct": 0.58, "equity": 1005.8000000000001, "max_dd": 0.0, "win_rate": 50.0, "profit_factor": 0.0, "ic": -0.4, "hit": 50.0, "psr": 0.773, "bh_sharpe": 6.3226, "bh_return_pct": 0.58, "excess_sharpe": 0.0}, {"fold": "fold_4", "regime": "China devaluation and oil crash", "n": 46, "A_sharpe": -0.0365, "A_sortino": -0.0348, "A_excess_sharpe": 1.1657, "A_return_pct": -0.7, "A_hit_rate": 50.0, "A_n": 46, "A_bh_sharpe": -1.2022, "A_bh_return_pct": -5.68, "A_psr": 0.4938, "A_ic": 0.0871, "B_sharpe": 0.6696, "B_sortino": 0.6905, "B_excess_sharpe": 2.9814, "B_return_pct": 4.1, "B_hit_rate": 47.83, "B_n": 46, "B_bh_sharpe": -2.3118, "B_bh_return_pct": -24.51, "B_psr": 0.611, "B_ic": 0.45, "D_sharpe": -0.0365, "D_sortino": -0.0348, "D_excess_sharpe": 1.1657, "D_return_pct": -0.7, "D_hit_rate": 50.0, "D_n": 46, "D_bh_sharpe": -1.2022, "D_bh_return_pct": -5.68, "D_psr": 0.4938, "D_ic": 0.0871, "sharpe": -0.0365, "sortino": -0.0348, "return_pct": -0.7, "equity": 993.0, "max_dd": 0.0, "win_rate": 50.0, "profit_factor": 0.0, "ic": 0.0871, "hit": 50.0, "psr": 0.4938, "bh_sharpe": -1.2022, "bh_return_pct": -5.68, "excess_sharpe": 1.1657}, {"fold": "fold_5", "regime": "2018 Vol-mageddon + Q4 sell-off", "n": 4, "A_sharpe": -1.5091, "A_sortino": -1.4061, "A_excess_sharpe": 13.246, "A_return_pct": -0.53, "A_hit_rate": 50.0, "A_n": 4, "A_bh_sharpe": -14.7551, "A_bh_return_pct": -3.52, "A_psr": 0.4347, "A_ic": 0.8, "B_sharpe": 25.4133, "B_sortino": 0.0, "B_excess_sharpe": 23.2567, "B_return_pct": 8.44, "B_hit_rate": 100.0, "B_n": 4, "B_bh_sharpe": 2.1566, "B_bh_return_pct": 1.19, "B_psr": 1.0, "B_ic": 0.8, "D_sharpe": -1.5091, "D_sortino": -1.4061, "D_excess_sharpe": 13.246, "D_return_pct": -0.53, "D_hit_rate": 50.0, "D_n": 4, "D_bh_sharpe": -14.7551, "D_bh_return_pct": -3.52, "D_psr": 0.4347, "D_ic": 0.8, "sharpe": -1.5091, "sortino": -1.4061, "return_pct": -0.53, "equity": 994.7, "max_dd": 0.0, "win_rate": 50.0, "profit_factor": 0.0, "ic": 0.8, "hit": 50.0, "psr": 0.4347, "bh_sharpe": -14.7551, "bh_return_pct": -3.52, "excess_sharpe": 13.246}, {"fold": "fold_6", "regime": "COVID crash and V-recovery", "n": 25, "A_sharpe": 2.1175, "A_sortino": 1.9425, "A_excess_sharpe": -0.2963, "A_return_pct": 2.86, "A_hit_rate": 60.0, "A_n": 25, "A_bh_sharpe": 2.4138, "A_bh_return_pct": 3.27, "A_psr": 0.7367, "A_ic": -0.1169, "B_sharpe": 0.0481, "B_sortino": 0.0615, "B_excess_sharpe": -12.5174, "B_return_pct": -0.29, "B_hit_rate": 36.0, "B_n": 25, "B_bh_sharpe": 12.5655, "B_bh_return_pct": 32.76, "B_psr": 0.5059, "B_ic": 0.0246, "D_sharpe": 2.1175, "D_sortino": 1.9425, "D_excess_sharpe": -0.2963, "D_return_pct": 2.86, "D_hit_rate": 60.0, "D_n": 25, "D_bh_sharpe": 2.4138, "D_bh_return_pct": 3.27, "D_psr": 0.7367, "D_ic": -0.1169, "sharpe": 2.1175, "sortino": 1.9425, "return_pct": 2.86, "equity": 1028.6, "max_dd": 0.0, "win_rate": 60.0, "profit_factor": 0.0, "ic": -0.1169, "hit": 60.0, "psr": 0.7367, "bh_sharpe": 2.4138, "bh_return_pct": 3.27, "excess_sharpe": -0.2963}, {"fold": "fold_7", "regime": "Inflation bear, AI rally and 2025", "n": 64, "A_sharpe": 1.4734, "A_sortino": 1.8072, "A_excess_sharpe": -0.5675, "A_return_pct": 5.6, "A_hit_rate": 43.75, "A_n": 64, "A_bh_sharpe": 2.0409, "A_bh_return_pct": 7.94, "A_psr": 0.7728, "A_ic": 0.1559, "B_sharpe": 0.3198, "B_sortino": 0.2929, "B_excess_sharpe": -5.0894, "B_return_pct": 1.3, "B_hit_rate": 57.81, "B_n": 64, "B_bh_sharpe": 5.4092, "B_bh_return_pct": 45.7, "B_psr": 0.5635, "B_ic": -0.0081, "D_sharpe": 1.4734, "D_sortino": 1.8072, "D_excess_sharpe": -0.5675, "D_return_pct": 5.6, "D_hit_rate": 43.75, "D_n": 64, "D_bh_sharpe": 2.0409, "D_bh_return_pct": 7.94, "D_psr": 0.7728, "D_ic": 0.1559, "sharpe": 1.4734, "sortino": 1.8072, "return_pct": 5.6, "equity": 1056.0, "max_dd": 0.0, "win_rate": 43.75, "profit_factor": 0.0, "ic": 0.1559, "hit": 43.75, "psr": 0.7728, "bh_sharpe": 2.0409, "bh_return_pct": 7.94, "excess_sharpe": -0.5675}], "status": "KEEP", "precision": 0.6032, "recall": 0.7309, "f1": 0.6609, "f2": 0.7012, "accuracy": 0.5557, "mcc": 0.0347, "tp": 459, "fp": 302, "tn": 130, "fn": 169, "test_sharpe": 0.8625, "A_sharpe": 0.8625, "A_excess_sharpe": -0.3576, "A_return_pct": 103.77, "A_precision": 0.6032, "A_recall": 0.7309, "A_f1": 0.6609, "A_f2": 0.7012, "A_accuracy": 0.5557, "A_mcc": 0.0347, "A_tp": 459, "A_fp": 302, "A_tn": 130, "A_fn": 169, "A_psr": 0.9627, "A_ic": 0.0177, "A_hit_rate": 55.53, "A_bh_sharpe": 1.2201, "A_bh_return_pct": 185.59}
