{"experiment_num": 14, "backbone": "catboost", "description": "CatBoost @ FX-Exp236-lite n_est=500 (Prokhorenkova 2018 NeurIPS); QQQ \u2014 3rd ensemble component (depth/iterations remap)", "config": {"seq_len": 60, "lr": 0.0003, "batch_size": 32, "epochs": 50, "weight_decay": 1e-05, "patience": 10, "warmup_epochs": 0, "head_dropout": 0.1, "huber_delta": 1.0, "grad_clip": 1.0, "seed": 42, "hidden_size": null, "num_layers": null, "max_depth": 4, "gbm_lr": 0.01, "n_estimators": 500}, "composite": -1.7077, "test_pos_folds": 5, "val_pos_folds": 1, "val_loss": null, "elapsed_sec": 1076.7, "timestamp": "2026-04-26T15:45:58", "sharpe": 0.4944, "val_sharpe": -1.5077, "ic": 0.0102, "hit": 52.26, "psr": 0.8474, "equity": 1440.6000000000001, "return_pct": 44.06, "bh_sharpe": 1.2194, "bh_return_pct": 187.05, "excess_sharpe": -0.7249, "B_sharpe": 0.3007, "B_excess_sharpe": -2.5274, "B_return_pct": 14.52, "D_sharpe": 0.1643, "D_excess_sharpe": -1.055, "D_return_pct": 5.13, "per_window": [{"fold": "fold_1", "regime": "GFC peak crash (Lehman + Mar-2009 bottom)", "n": 66, "A_sharpe": 0.856, "A_sortino": 0.9153, "A_excess_sharpe": 0.2839, "A_return_pct": 6.77, "A_hit_rate": 50.0, "A_n": 66, "A_bh_sharpe": 0.5721, "A_bh_return_pct": 3.85, "A_psr": 0.6688, "A_ic": 0.0676, "B_sharpe": 1.5112, "B_sortino": 1.5253, "B_excess_sharpe": -0.5357, "B_return_pct": 25.29, "B_hit_rate": 55.38, "B_n": 66, "B_bh_sharpe": 2.0469, "B_bh_return_pct": 39.28, "B_psr": 0.7786, "B_ic": 0.22, "D_sharpe": 1.0942, "D_sortino": 1.1066, "D_excess_sharpe": 0.5221, "D_return_pct": 9.29, "D_hit_rate": 56.06, "D_n": 66, "D_bh_sharpe": 0.5721, "D_bh_return_pct": 3.85, "D_psr": 0.712, "D_ic": 0.1375, "sharpe": 0.856, "sortino": 0.9153, "return_pct": 6.77, "equity": 1067.7, "max_dd": 0.0, "win_rate": 50.0, "profit_factor": 0.0, "ic": 0.0676, "hit": 50.0, "psr": 0.6688, "bh_sharpe": 0.5721, "bh_return_pct": 3.85, "excess_sharpe": 0.2839, "precision": 0.5278, "recall": 0.5429, "f1": 0.5352, "f2": 0.5398, "accuracy": 0.5, "mcc": -0.0055, "tp": 19, "fp": 17, "tn": 14, "fn": 16, "A_precision": 0.5278, "A_recall": 0.5429, "A_f1": 0.5352, "A_f2": 0.5398, "A_accuracy": 0.5, "A_mcc": -0.0055, "A_tp": 19, "A_fp": 17, "A_tn": 14, "A_fn": 16}, {"fold": "fold_2", "regime": "2011 US-downgrade + EU debt", "n": 87, "A_sharpe": 5.0267, "A_sortino": 6.6672, "A_excess_sharpe": 0.0047, "A_return_pct": 29.26, "A_hit_rate": 62.79, "A_n": 87, "A_bh_sharpe": 5.022, "A_bh_return_pct": 29.23, "A_psr": 0.9996, "A_ic": 0.1097, "B_sharpe": 10.4651, "B_sortino": 9.4401, "B_excess_sharpe": -0.6718, "B_return_pct": 172.98, "B_hit_rate": 81.61, "B_n": 87, "B_bh_sharpe": 11.1369, "B_bh_return_pct": 185.4, "B_psr": 1.0, "B_ic": 0.0889, "D_sharpe": 4.8753, "D_sortino": 5.9795, "D_excess_sharpe": -0.1467, "D_return_pct": 28.33, "D_hit_rate": 63.95, "D_n": 87, "D_bh_sharpe": 5.022, "D_bh_return_pct": 29.23, "D_psr": 0.9993, "D_ic": 0.0247, "sharpe": 5.0267, "sortino": 6.6672, "return_pct": 29.26, "equity": 1292.6, "max_dd": 0.0, "win_rate": 62.79, "profit_factor": 0.0, "ic": 0.1097, "hit": 62.79, "psr": 0.9996, "bh_sharpe": 5.022, "bh_return_pct": 29.23, "excess_sharpe": 0.0047, "precision": 0.641, "recall": 0.9259, "f1": 0.7576, "f2": 0.8503, "accuracy": 0.6322, "mcc": 0.1234, "tp": 50, "fp": 28, "tn": 5, "fn": 4, "A_precision": 0.641, "A_recall": 0.9259, "A_f1": 0.7576, "A_f2": 0.8503, "A_accuracy": 0.6322, "A_mcc": 0.1234, "A_tp": 50, "A_fp": 28, "A_tn": 5, "A_fn": 4}, {"fold": "fold_3", "regime": "Taper tantrum and 2014 H1", "n": 129, "A_sharpe": 1.7678, "A_sortino": 1.4748, "A_excess_sharpe": 0.0, "A_return_pct": 11.76, "A_hit_rate": 60.94, "A_n": 129, "A_bh_sharpe": 1.7678, "A_bh_return_pct": 11.76, "A_psr": 0.8822, "A_ic": 0.108, "B_sharpe": 4.2474, "B_sortino": 4.2072, "B_excess_sharpe": 0.0, "B_return_pct": 64.1, "B_hit_rate": 63.57, "B_n": 129, "B_bh_sharpe": 4.2474, "B_bh_return_pct": 64.1, "B_psr": 0.9981, "B_ic": -0.0881, "D_sharpe": 1.7678, "D_sortino": 1.4748, "D_excess_sharpe": 0.0, "D_return_pct": 11.76, "D_hit_rate": 60.94, "D_n": 129, "D_bh_sharpe": 1.7678, "D_bh_return_pct": 11.76, "D_psr": 0.8822, "D_ic": 0.0769, "sharpe": 1.7678, "sortino": 1.4748, "return_pct": 11.76, "equity": 1117.6, "max_dd": 0.0, "win_rate": 60.94, "profit_factor": 0.0, "ic": 0.108, "hit": 60.94, "psr": 0.8822, "bh_sharpe": 1.7678, "bh_return_pct": 11.76, "excess_sharpe": 0.0, "precision": 0.6047, "recall": 1.0, "f1": 0.7536, "f2": 0.8844, "accuracy": 0.6047, "mcc": 0.0, "tp": 78, "fp": 51, "tn": 0, "fn": 0, "A_precision": 0.6047, "A_recall": 1.0, "A_f1": 0.7536, "A_f2": 0.8844, "A_accuracy": 0.6047, "A_mcc": 0.0, "A_tp": 78, "A_fp": 51, "A_tn": 0, "A_fn": 0}, {"fold": "fold_4", "regime": "China devaluation and oil crash", "n": 108, "A_sharpe": -0.021, "A_sortino": -0.0189, "A_excess_sharpe": 0.6688, "A_return_pct": -1.08, "A_hit_rate": 54.21, "A_n": 108, "A_bh_sharpe": -0.6898, "A_bh_return_pct": -6.71, "A_psr": 0.4945, "A_ic": 0.0344, "B_sharpe": -1.8452, "B_sortino": -1.649, "B_excess_sharpe": 0.1123, "B_return_pct": -32.16, "B_hit_rate": 46.3, "B_n": 108, "B_bh_sharpe": -1.9575, "B_bh_return_pct": -33.56, "B_psr": 0.1079, "B_ic": -0.121, "D_sharpe": -1.2857, "D_sortino": -1.209, "D_excess_sharpe": -0.5959, "D_return_pct": -11.43, "D_hit_rate": 46.73, "D_n": 108, "D_bh_sharpe": -0.6898, "D_bh_return_pct": -6.71, "D_psr": 0.199, "D_ic": -0.0455, "sharpe": -0.021, "sortino": -0.0189, "return_pct": -1.08, "equity": 989.1999999999999, "max_dd": 0.0, "win_rate": 54.21, "profit_factor": 0.0, "ic": 0.0344, "hit": 54.21, "psr": 0.4945, "bh_sharpe": -0.6898, "bh_return_pct": -6.71, "excess_sharpe": 0.6688, "precision": 0.5244, "recall": 0.8113, "f1": 0.637, "f2": 0.7313, "accuracy": 0.5463, "mcc": 0.1195, "tp": 43, "fp": 39, "tn": 16, "fn": 10, "A_precision": 0.5244, "A_recall": 0.8113, "A_f1": 0.637, "A_f2": 0.7313, "A_accuracy": 0.5463, "A_mcc": 0.1195, "A_tp": 43, "A_fp": 39, "A_tn": 16, "A_fn": 10}, {"fold": "fold_5", "regime": "2018 Vol-mageddon + Q4 sell-off", "n": 128, "A_sharpe": 0.3615, "A_sortino": 0.3492, "A_excess_sharpe": -0.7896, "A_return_pct": 2.97, "A_hit_rate": 57.03, "A_n": 128, "A_bh_sharpe": 1.1511, "A_bh_return_pct": 13.19, "A_psr": 0.6017, "A_ic": -0.0597, "B_sharpe": -2.1656, "B_sortino": -2.133, "B_excess_sharpe": -4.9774, "B_return_pct": -43.1, "B_hit_rate": 40.94, "B_n": 128, "B_bh_sharpe": 2.8119, "B_bh_return_pct": 82.25, "B_psr": 0.0623, "B_ic": -0.1092, "D_sharpe": -0.8512, "D_sortino": -0.8993, "D_excess_sharpe": -2.0023, "D_return_pct": -10.99, "D_hit_rate": 46.88, "D_n": 128, "D_bh_sharpe": 1.1511, "D_bh_return_pct": 13.19, "D_psr": 0.2765, "D_ic": -0.0899, "sharpe": 0.3615, "sortino": 0.3492, "return_pct": 2.97, "equity": 1029.7, "max_dd": 0.0, "win_rate": 57.03, "profit_factor": 0.0, "ic": -0.0597, "hit": 57.03, "psr": 0.6017, "bh_sharpe": 1.1511, "bh_return_pct": 13.19, "excess_sharpe": -0.7896, "precision": 0.6211, "recall": 0.7564, "f1": 0.6821, "f2": 0.7248, "accuracy": 0.5703, "mcc": 0.0406, "tp": 59, "fp": 36, "tn": 14, "fn": 19, "A_precision": 0.6211, "A_recall": 0.7564, "A_f1": 0.6821, "A_f2": 0.7248, "A_accuracy": 0.5703, "A_mcc": 0.0406, "A_tp": 59, "A_fp": 36, "A_tn": 14, "A_fn": 19}, {"fold": "fold_6", "regime": "COVID crash and V-recovery", "n": 173, "A_sharpe": 0.6508, "A_sortino": 0.6874, "A_excess_sharpe": -1.6753, "A_return_pct": 9.22, "A_hit_rate": 49.71, "A_n": 173, "A_bh_sharpe": 2.3261, "A_bh_return_pct": 43.81, "A_psr": 0.7048, "A_ic": 0.0751, "B_sharpe": 1.1342, "B_sortino": 1.2677, "B_excess_sharpe": -4.6118, "B_return_pct": 35.82, "B_hit_rate": 50.58, "B_n": 173, "B_bh_sharpe": 5.746, "B_bh_return_pct": 499.04, "B_psr": 0.8291, "B_ic": 0.0458, "D_sharpe": 0.0189, "D_sortino": 0.0217, "D_excess_sharpe": -2.3072, "D_return_pct": -1.69, "D_hit_rate": 43.93, "D_n": 173, "D_bh_sharpe": 2.3261, "D_bh_return_pct": 43.81, "D_psr": 0.5062, "D_ic": -0.04, "sharpe": 0.6508, "sortino": 0.6874, "return_pct": 9.22, "equity": 1092.2, "max_dd": 0.0, "win_rate": 49.71, "profit_factor": 0.0, "ic": 0.0751, "hit": 49.71, "psr": 0.7048, "bh_sharpe": 2.3261, "bh_return_pct": 43.81, "excess_sharpe": -1.6753, "precision": 0.6413, "recall": 0.5221, "f1": 0.5756, "f2": 0.5423, "accuracy": 0.4971, "mcc": -0.0266, "tp": 59, "fp": 33, "tn": 27, "fn": 54, "A_precision": 0.6413, "A_recall": 0.5221, "A_f1": 0.5756, "A_f2": 0.5423, "A_accuracy": 0.4971, "A_mcc": -0.0266, "A_tp": 59, "A_fp": 33, "A_tn": 27, "A_fn": 54}, {"fold": "fold_7", "regime": "Inflation bear, AI rally and 2025", "n": 376, "A_sharpe": -0.4115, "A_sortino": -0.462, "A_excess_sharpe": -1.2148, "A_return_pct": -16.05, "A_hit_rate": 46.28, "A_n": 376, "A_bh_sharpe": 0.8033, "A_bh_return_pct": 26.02, "A_psr": 0.3111, "A_ic": -0.0154, "B_sharpe": -1.1302, "B_sortino": -1.2538, "B_excess_sharpe": -3.0619, "B_return_pct": -61.08, "B_hit_rate": 40.53, "B_n": 376, "B_bh_sharpe": 1.9317, "B_bh_return_pct": 222.05, "B_psr": 0.0886, "B_ic": 0.0381, "D_sharpe": -0.3218, "D_sortino": -0.4143, "D_excess_sharpe": -1.1251, "D_return_pct": -13.47, "D_hit_rate": 41.22, "D_n": 376, "D_bh_sharpe": 0.8033, "D_bh_return_pct": 26.02, "D_psr": 0.3502, "D_ic": 0.0287, "sharpe": -0.4115, "sortino": -0.462, "return_pct": -16.05, "equity": 839.5, "max_dd": 0.0, "win_rate": 46.28, "profit_factor": 0.0, "ic": -0.0154, "hit": 46.28, "psr": 0.3111, "bh_sharpe": 0.8033, "bh_return_pct": 26.02, "excess_sharpe": -1.2148, "precision": 0.5736, "recall": 0.3348, "f1": 0.4229, "f2": 0.3653, "accuracy": 0.4628, "mcc": -0.0207, "tp": 74, "fp": 55, "tn": 100, "fn": 147, "A_precision": 0.5736, "A_recall": 0.3348, "A_f1": 0.4229, "A_f2": 0.3653, "A_accuracy": 0.4628, "A_mcc": -0.0207, "A_tp": 74, "A_fp": 55, "A_tn": 100, "A_fn": 147}], "per_window_val": [{"fold": "fold_1", "regime": "GFC peak crash (Lehman + Mar-2009 bottom)", "n": 65, "A_sharpe": -2.6035, "A_sortino": -2.1763, "A_excess_sharpe": -0.3779, "A_return_pct": -21.29, "A_hit_rate": 46.03, "A_n": 65, "A_bh_sharpe": -2.2257, "A_bh_return_pct": -18.74, "A_psr": 0.0783, "A_ic": -0.1579, "B_sharpe": -5.4624, "B_sortino": -4.6514, "B_excess_sharpe": 1.6599, "B_return_pct": -65.28, "B_hit_rate": 36.92, "B_n": 65, "B_bh_sharpe": -7.1223, "B_bh_return_pct": -73.11, "B_psr": 0.0022, "B_ic": 0.4242, "D_sharpe": -0.3103, "D_sortino": -0.3187, "D_excess_sharpe": 1.9154, "D_return_pct": -4.09, "D_hit_rate": 47.62, "D_n": 65, "D_bh_sharpe": -2.2257, "D_bh_return_pct": -18.74, "D_psr": 0.4382, "D_ic": 0.2144, "sharpe": -2.6035, "sortino": -2.1763, "return_pct": -21.29, "equity": 787.1, "max_dd": 0.0, "win_rate": 46.03, "profit_factor": 0.0, "ic": -0.1579, "hit": 46.03, "psr": 0.0783, "bh_sharpe": -2.2257, "bh_return_pct": -18.74, "excess_sharpe": -0.3779}, {"fold": "fold_2", "regime": "2011 US-downgrade + EU debt", "n": 47, "A_sharpe": -0.5246, "A_sortino": -0.4276, "A_excess_sharpe": -0.3305, "A_return_pct": -4.43, "A_hit_rate": 57.45, "A_n": 47, "A_bh_sharpe": -0.1941, "A_bh_return_pct": -2.36, "A_psr": 0.4103, "A_ic": 0.1085, "B_sharpe": -1.6123, "B_sortino": -1.4959, "B_excess_sharpe": 0.0, "B_return_pct": -24.3, "B_hit_rate": 44.68, "B_n": 47, "B_bh_sharpe": -1.6123, "B_bh_return_pct": -24.3, "B_psr": 0.2404, "B_ic": 0.4004, "D_sharpe": -0.1941, "D_sortino": -0.1694, "D_excess_sharpe": 0.0, "D_return_pct": -2.36, "D_hit_rate": 55.32, "D_n": 47, "D_bh_sharpe": -0.1941, "D_bh_return_pct": -2.36, "D_psr": 0.4669, "D_ic": 0.1976, "sharpe": -0.5246, "sortino": -0.4276, "return_pct": -4.43, "equity": 955.7, "max_dd": 0.0, "win_rate": 57.45, "profit_factor": 0.0, "ic": 0.1085, "hit": 57.45, "psr": 0.4103, "bh_sharpe": -0.1941, "bh_return_pct": -2.36, "excess_sharpe": -0.3305}, {"fold": "fold_3", "regime": "Taper tantrum and 2014 H1", "n": 5, "A_sharpe": -1.3194, "A_sortino": -1.3491, "A_excess_sharpe": 0.0, "A_return_pct": -0.21, "A_hit_rate": 40.0, "A_n": 5, "A_bh_sharpe": -1.3194, "A_bh_return_pct": -0.21, "A_psr": 0.4337, "A_ic": -0.2, "B_sharpe": -25.8705, "B_sortino": -13.5303, "B_excess_sharpe": 0.0, "B_return_pct": -3.84, "B_hit_rate": 0.0, "B_n": 5, "B_bh_sharpe": -25.8705, "B_bh_return_pct": -3.84, "B_psr": 0.0, "B_ic": -0.5, "D_sharpe": -1.3194, "D_sortino": -1.3491, "D_excess_sharpe": 0.0, "D_return_pct": -0.21, "D_hit_rate": 40.0, "D_n": 5, "D_bh_sharpe": -1.3194, "D_bh_return_pct": -0.21, "D_psr": 0.4337, "D_ic": -0.5, "sharpe": -1.3194, "sortino": -1.3491, "return_pct": -0.21, "equity": 997.9, "max_dd": 0.0, "win_rate": 40.0, "profit_factor": 0.0, "ic": -0.2, "hit": 40.0, "psr": 0.4337, "bh_sharpe": -1.3194, "bh_return_pct": -0.21, "excess_sharpe": 0.0}, {"fold": "fold_4", "regime": "China devaluation and oil crash", "n": 47, "A_sharpe": -1.8238, "A_sortino": -1.7153, "A_excess_sharpe": 0.0, "A_return_pct": -8.68, "A_hit_rate": 44.68, "A_n": 47, "A_bh_sharpe": -1.8238, "A_bh_return_pct": -8.68, "A_psr": 0.2173, "A_ic": 0.0222, "B_sharpe": -2.22, "B_sortino": -1.9053, "B_excess_sharpe": 0.0, "B_return_pct": -23.98, "B_hit_rate": 44.68, "B_n": 47, "B_bh_sharpe": -2.22, "B_bh_return_pct": -23.98, "B_psr": 0.1505, "B_ic": 0.6011, "D_sharpe": -1.8238, "D_sortino": -1.7153, "D_excess_sharpe": 0.0, "D_return_pct": -8.68, "D_hit_rate": 44.68, "D_n": 47, "D_bh_sharpe": -1.8238, "D_bh_return_pct": -8.68, "D_psr": 0.2173, "D_ic": 0.2554, "sharpe": -1.8238, "sortino": -1.7153, "return_pct": -8.68, "equity": 913.2, "max_dd": 0.0, "win_rate": 44.68, "profit_factor": 0.0, "ic": 0.0222, "hit": 44.68, "psr": 0.2173, "bh_sharpe": -1.8238, "bh_return_pct": -8.68, "excess_sharpe": 0.0}, {"fold": "fold_5", "regime": "2018 Vol-mageddon + Q4 sell-off", "n": 5, "A_sharpe": -10.1368, "A_sortino": -6.9937, "A_excess_sharpe": 0.0, "A_return_pct": -3.15, "A_hit_rate": 40.0, "A_n": 5, "A_bh_sharpe": -10.1368, "A_bh_return_pct": -3.15, "A_psr": 0.0985, "A_ic": -0.4, "B_sharpe": 5.6858, "B_sortino": 6.0578, "B_excess_sharpe": 0.0, "B_return_pct": 4.22, "B_hit_rate": 60.0, "B_n": 5, "B_bh_sharpe": 5.6858, "B_bh_return_pct": 4.22, "B_psr": 0.753, "B_ic": 0.4, "D_sharpe": -10.1368, "D_sortino": -6.9937, "D_excess_sharpe": 0.0, "D_return_pct": -3.15, "D_hit_rate": 40.0, "D_n": 5, "D_bh_sharpe": -10.1368, "D_bh_return_pct": -3.15, "D_psr": 0.0985, "D_ic": 0.3, "sharpe": -10.1368, "sortino": -6.9937, "return_pct": -3.15, "equity": 968.5, "max_dd": 0.0, "win_rate": 40.0, "profit_factor": 0.0, "ic": -0.4, "hit": 40.0, "psr": 0.0985, "bh_sharpe": -10.1368, "bh_return_pct": -3.15, "excess_sharpe": 0.0}, {"fold": "fold_6", "regime": "COVID crash and V-recovery", "n": 26, "A_sharpe": 3.2852, "A_sortino": 3.0777, "A_excess_sharpe": 0.0, "A_return_pct": 4.82, "A_hit_rate": 61.54, "A_n": 26, "A_bh_sharpe": 3.2852, "A_bh_return_pct": 4.82, "A_psr": 0.8369, "A_ic": -0.0653, "B_sharpe": 23.1107, "B_sortino": 16.1021, "B_excess_sharpe": 10.1315, "B_return_pct": 0.0, "B_hit_rate": 0.0, "B_n": 26, "B_bh_sharpe": 12.9792, "B_bh_return_pct": 38.76, "B_psr": 1.0, "B_ic": 0.4687, "D_sharpe": 3.7225, "D_sortino": 3.5751, "D_excess_sharpe": 0.4373, "D_return_pct": 5.46, "D_hit_rate": 61.54, "D_n": 26, "D_bh_sharpe": 3.2852, "D_bh_return_pct": 4.82, "D_psr": 0.8648, "D_ic": 0.1084, "sharpe": 3.2852, "sortino": 3.0777, "return_pct": 4.82, "equity": 1048.2, "max_dd": 0.0, "win_rate": 61.54, "profit_factor": 0.0, "ic": -0.0653, "hit": 61.54, "psr": 0.8369, "bh_sharpe": 3.2852, "bh_return_pct": 4.82, "excess_sharpe": 0.0}, {"fold": "fold_7", "regime": "Inflation bear, AI rally and 2025", "n": 65, "A_sharpe": -2.1128, "A_sortino": -1.8778, "A_excess_sharpe": -4.1918, "A_return_pct": -8.23, "A_hit_rate": 47.69, "A_n": 65, "A_bh_sharpe": 2.0789, "A_bh_return_pct": 8.17, "A_psr": 0.1379, "A_ic": -0.0547, "B_sharpe": -5.2314, "B_sortino": -4.8393, "B_excess_sharpe": -10.4628, "B_return_pct": -32.36, "B_hit_rate": 32.31, "B_n": 65, "B_bh_sharpe": 5.2314, "B_bh_return_pct": 44.53, "B_psr": 0.0054, "B_ic": -0.0186, "D_sharpe": -2.0789, "D_sortino": -1.8995, "D_excess_sharpe": -4.1578, "D_return_pct": -8.11, "D_hit_rate": 46.15, "D_n": 65, "D_bh_sharpe": 2.0789, "D_bh_return_pct": 8.17, "D_psr": 0.1438, "D_ic": -0.0128, "sharpe": -2.1128, "sortino": -1.8778, "return_pct": -8.23, "equity": 917.6999999999999, "max_dd": 0.0, "win_rate": 47.69, "profit_factor": 0.0, "ic": -0.0547, "hit": 47.69, "psr": 0.1379, "bh_sharpe": 2.0789, "bh_return_pct": 8.17, "excess_sharpe": -4.1918}], "status": "DISCARD", "precision": 0.5959, "recall": 0.6044, "f1": 0.6002, "f2": 0.6027, "accuracy": 0.523, "mcc": 0.0091, "tp": 382, "fp": 259, "tn": 176, "fn": 250, "test_sharpe": 0.4944, "A_sharpe": 0.4944, "A_excess_sharpe": -0.7249, "A_return_pct": 44.06, "A_precision": 0.5959, "A_recall": 0.6044, "A_f1": 0.6002, "A_f2": 0.6027, "A_accuracy": 0.523, "A_mcc": 0.0091, "A_tp": 382, "A_fp": 259, "A_tn": 176, "A_fn": 250, "A_psr": 0.8474, "A_ic": 0.0102, "A_hit_rate": 52.26, "A_bh_sharpe": 1.2194, "A_bh_return_pct": 187.05}
