{"experiment_num": 72, "backbone": "lstm", "description": "LSTM @ exp 71 NEW LSTM CHAMP num_layers=1 seed=42 - multi-seed verify (was +0.35 seed=0)", "config": {"seq_len": 10, "lr": 0.001, "batch_size": 16, "epochs": 100, "weight_decay": 0.0007, "patience": 15, "warmup_epochs": 0, "head_dropout": 0.1, "huber_delta": 1.0, "grad_clip": 1.0, "seed": 42, "hidden_size": null, "num_layers": 1, "max_depth": null, "gbm_lr": null, "n_estimators": null}, "composite": 0.315, "test_pos_folds": 6, "val_pos_folds": 4, "val_loss": -2.8942640362461343, "elapsed_sec": 42.5, "timestamp": "2026-04-27T23:03:39", "sharpe": 0.6575, "val_sharpe": 0.415, "ic": 0.037, "hit": 51.31, "psr": 0.9397, "equity": 2207.5, "return_pct": 120.75, "bh_sharpe": 0.6042, "bh_return_pct": 103.49, "excess_sharpe": 0.0533, "B_sharpe": 0.7233, "B_excess_sharpe": -0.9775, "B_return_pct": 288.1, "D_sharpe": 0.6575, "D_excess_sharpe": 0.0533, "D_return_pct": 120.75, "precision": 0.5813, "recall": 0.5403, "f1": 0.5601, "f2": 0.548, "mcc": 0.0194, "accuracy": 0.5142, "val_precision": 0.5551, "val_recall": 0.4286, "val_f1": 0.4837, "val_f2": 0.449, "val_mcc": 0.0005, "val_accuracy": 0.4924, "per_window": [{"fold": "fold_1", "regime": "GFC peak crash (Lehman + Mar-2009 bottom)", "n": 115, "A_sharpe": 0.2713, "A_sortino": 0.2733, "A_excess_sharpe": 0.7154, "A_return_pct": 0.56, "A_hit_rate": 51.3, "A_n": 115, "A_bh_sharpe": -0.4441, "A_bh_return_pct": -14.4, "A_psr": 0.5724, "A_ic": 0.1022, "A_precision": 0.4875, "A_recall": 0.7222, "A_f1": 0.5821, "A_f2": 0.6588, "A_accuracy": 0.513, "A_mcc": 0.0543, "A_tp": 39, "A_fp": 41, "A_tn": 20, "A_fn": 15, "B_sharpe": 1.7206, "B_sortino": 1.7886, "B_excess_sharpe": 2.0184, "B_return_pct": 68.84, "B_hit_rate": 53.51, "B_n": 115, "B_bh_sharpe": -0.2978, "B_bh_return_pct": -27.23, "B_psr": 0.8745, "B_ic": 0.0982, "B_precision": 0.5362, "B_recall": 0.6271, "B_f1": 0.5781, "B_f2": 0.6066, "B_accuracy": 0.5304, "B_mcc": 0.0568, "B_tp": 37, "B_fp": 32, "B_tn": 24, "B_fn": 22, "D_sharpe": 0.2713, "D_sortino": 0.2733, "D_excess_sharpe": 0.7154, "D_return_pct": 0.56, "D_hit_rate": 51.3, "D_n": 115, "D_bh_sharpe": -0.4441, "D_bh_return_pct": -14.4, "D_psr": 0.5724, "D_ic": 0.1022, "D_precision": 0.4875, "D_recall": 0.7222, "D_f1": 0.5821, "D_f2": 0.6588, "D_accuracy": 0.513, "D_mcc": 0.0543, "D_tp": 39, "D_fp": 41, "D_tn": 20, "D_fn": 15, "sharpe": 0.2713, "sortino": 0.2733, "return_pct": 0.56, "equity": 1005.6, "max_dd": 0.0, "win_rate": 51.3, "profit_factor": 0.0, "ic": 0.1022, "hit": 51.3, "psr": 0.5724, "bh_sharpe": -0.4441, "bh_return_pct": -14.4, "excess_sharpe": 0.7154, "precision": 0.4875, "recall": 0.7222, "f1": 0.5821, "f2": 0.6588, "mcc": 0.0543, "accuracy": 0.513, "tp": 39, "fp": 41, "tn": 20, "fn": 15}, {"fold": "fold_2", "regime": "2011 US-downgrade + EU debt", "n": 136, "A_sharpe": 1.6589, "A_sortino": 1.9443, "A_excess_sharpe": -0.0738, "A_return_pct": 18.79, "A_hit_rate": 48.89, "A_n": 136, "A_bh_sharpe": 1.7327, "A_bh_return_pct": 19.75, "A_psr": 0.8912, "A_ic": 0.0443, "A_precision": 0.6154, "A_recall": 0.3077, "A_f1": 0.4103, "A_f2": 0.3419, "A_accuracy": 0.4926, "A_mcc": 0.0537, "A_tp": 24, "A_fp": 15, "A_tn": 43, "A_fn": 54, "B_sharpe": 1.5615, "B_sortino": 1.7099, "B_excess_sharpe": -2.5045, "B_return_pct": 38.55, "B_hit_rate": 53.68, "B_n": 136, "B_bh_sharpe": 4.0659, "B_bh_return_pct": 148.68, "B_psr": 0.877, "B_ic": 0.3029, "B_precision": 0.8367, "B_recall": 0.4271, "B_f1": 0.5655, "B_f2": 0.4734, "B_accuracy": 0.5368, "B_mcc": 0.2155, "B_tp": 41, "B_fp": 8, "B_tn": 32, "B_fn": 55, "D_sharpe": 1.6589, "D_sortino": 1.9443, "D_excess_sharpe": -0.0738, "D_return_pct": 18.79, "D_hit_rate": 48.89, "D_n": 136, "D_bh_sharpe": 1.7327, "D_bh_return_pct": 19.75, "D_psr": 0.8912, "D_ic": 0.0443, "D_precision": 0.6154, "D_recall": 0.3077, "D_f1": 0.4103, "D_f2": 0.3419, "D_accuracy": 0.4926, "D_mcc": 0.0537, "D_tp": 24, "D_fp": 15, "D_tn": 43, "D_fn": 54, "sharpe": 1.6589, "sortino": 1.9443, "return_pct": 18.79, "equity": 1187.8999999999999, "max_dd": 0.0, "win_rate": 48.89, "profit_factor": 0.0, "ic": 0.0443, "hit": 48.89, "psr": 0.8912, "bh_sharpe": 1.7327, "bh_return_pct": 19.75, "excess_sharpe": -0.0738, "precision": 0.6154, "recall": 0.3077, "f1": 0.4103, "f2": 0.3419, "mcc": 0.0537, "accuracy": 0.4926, "tp": 24, "fp": 15, "tn": 43, "fn": 54}, {"fold": "fold_3", "regime": "Taper tantrum and 2014 H1", "n": 178, "A_sharpe": 0.3368, "A_sortino": 0.3919, "A_excess_sharpe": -1.0078, "A_return_pct": 2.53, "A_hit_rate": 46.89, "A_n": 178, "A_bh_sharpe": 1.3445, "A_bh_return_pct": 12.41, "A_psr": 0.612, "A_ic": 0.0049, "A_precision": 0.6364, "A_recall": 0.2039, "A_f1": 0.3088, "A_f2": 0.236, "A_accuracy": 0.4719, "A_mcc": 0.0558, "A_tp": 21, "A_fp": 12, "A_tn": 63, "A_fn": 82, "B_sharpe": 1.5809, "B_sortino": 1.8864, "B_excess_sharpe": -1.4674, "B_return_pct": 31.33, "B_hit_rate": 49.44, "B_n": 178, "B_bh_sharpe": 3.0483, "B_bh_return_pct": 71.83, "B_psr": 0.9125, "B_ic": 0.0452, "B_precision": 0.6418, "B_recall": 0.3945, "B_f1": 0.4886, "B_f2": 0.4274, "B_accuracy": 0.4944, "B_mcc": 0.0469, "B_tp": 43, "B_fp": 24, "B_tn": 45, "B_fn": 66, "D_sharpe": 0.3368, "D_sortino": 0.3919, "D_excess_sharpe": -1.0078, "D_return_pct": 2.53, "D_hit_rate": 46.89, "D_n": 178, "D_bh_sharpe": 1.3445, "D_bh_return_pct": 12.41, "D_psr": 0.612, "D_ic": 0.0049, "D_precision": 0.6364, "D_recall": 0.2039, "D_f1": 0.3088, "D_f2": 0.236, "D_accuracy": 0.4719, "D_mcc": 0.0558, "D_tp": 21, "D_fp": 12, "D_tn": 63, "D_fn": 82, "sharpe": 0.3368, "sortino": 0.3919, "return_pct": 2.53, "equity": 1025.3000000000002, "max_dd": 0.0, "win_rate": 46.89, "profit_factor": 0.0, "ic": 0.0049, "hit": 46.89, "psr": 0.612, "bh_sharpe": 1.3445, "bh_return_pct": 12.41, "excess_sharpe": -1.0078, "precision": 0.6364, "recall": 0.2039, "f1": 0.3088, "f2": 0.236, "mcc": 0.0558, "accuracy": 0.4719, "tp": 21, "fp": 12, "tn": 63, "fn": 82}, {"fold": "fold_4", "regime": "China devaluation and oil crash", "n": 157, "A_sharpe": -1.1017, "A_sortino": -1.0536, "A_excess_sharpe": -1.1115, "A_return_pct": -13.47, "A_hit_rate": 46.15, "A_n": 157, "A_bh_sharpe": 0.0098, "A_bh_return_pct": -1.05, "A_psr": 0.1914, "A_ic": -0.0503, "A_precision": 0.4746, "A_recall": 0.3457, "A_f1": 0.4, "A_f2": 0.3655, "A_accuracy": 0.465, "A_mcc": -0.0642, "A_tp": 28, "A_fp": 31, "A_tn": 45, "A_fn": 53, "B_sharpe": -0.9968, "B_sortino": -1.0588, "B_excess_sharpe": -1.0127, "B_return_pct": -28.3, "B_hit_rate": 41.4, "B_n": 157, "B_bh_sharpe": 0.0159, "B_bh_return_pct": -5.48, "B_psr": 0.2177, "B_ic": 0.0374, "B_precision": 0.4568, "B_recall": 0.4353, "B_f1": 0.4458, "B_f2": 0.4394, "B_accuracy": 0.414, "B_mcc": -0.1753, "B_tp": 37, "B_fp": 44, "B_tn": 28, "B_fn": 48, "D_sharpe": -1.1017, "D_sortino": -1.0536, "D_excess_sharpe": -1.1115, "D_return_pct": -13.47, "D_hit_rate": 46.15, "D_n": 157, "D_bh_sharpe": 0.0098, "D_bh_return_pct": -1.05, "D_psr": 0.1914, "D_ic": -0.0503, "D_precision": 0.4746, "D_recall": 0.3457, "D_f1": 0.4, "D_f2": 0.3655, "D_accuracy": 0.465, "D_mcc": -0.0642, "D_tp": 28, "D_fp": 31, "D_tn": 45, "D_fn": 53, "sharpe": -1.1017, "sortino": -1.0536, "return_pct": -13.47, "equity": 865.3, "max_dd": 0.0, "win_rate": 46.15, "profit_factor": 0.0, "ic": -0.0503, "hit": 46.15, "psr": 0.1914, "bh_sharpe": 0.0098, "bh_return_pct": -1.05, "excess_sharpe": -1.1115, "precision": 0.4746, "recall": 0.3457, "f1": 0.4, "f2": 0.3655, "mcc": -0.0642, "accuracy": 0.465, "tp": 28, "fp": 31, "tn": 45, "fn": 53}, {"fold": "fold_5", "regime": "2018 Vol-mageddon + Q4 sell-off", "n": 177, "A_sharpe": 1.3703, "A_sortino": 1.4343, "A_excess_sharpe": 1.0605, "A_return_pct": 22.42, "A_hit_rate": 54.8, "A_n": 177, "A_bh_sharpe": 0.3098, "A_bh_return_pct": 3.19, "A_psr": 0.877, "A_ic": 0.0613, "A_precision": 0.6075, "A_recall": 0.6311, "A_f1": 0.619, "A_f2": 0.6262, "A_accuracy": 0.548, "A_mcc": 0.0641, "A_tp": 65, "A_fp": 42, "A_tn": 32, "A_fn": 38, "B_sharpe": 1.2072, "B_sortino": 1.2046, "B_excess_sharpe": 0.3155, "B_return_pct": 37.21, "B_hit_rate": 53.41, "B_n": 177, "B_bh_sharpe": 0.8917, "B_bh_return_pct": 23.8, "B_psr": 0.8415, "B_ic": 0.0948, "B_precision": 0.614, "B_recall": 0.6422, "B_f1": 0.6278, "B_f2": 0.6364, "B_accuracy": 0.5311, "B_mcc": -0.0049, "B_tp": 70, "B_fp": 44, "B_tn": 24, "B_fn": 39, "D_sharpe": 1.3703, "D_sortino": 1.4343, "D_excess_sharpe": 1.0605, "D_return_pct": 22.42, "D_hit_rate": 54.8, "D_n": 177, "D_bh_sharpe": 0.3098, "D_bh_return_pct": 3.19, "D_psr": 0.877, "D_ic": 0.0613, "D_precision": 0.6075, "D_recall": 0.6311, "D_f1": 0.619, "D_f2": 0.6262, "D_accuracy": 0.548, "D_mcc": 0.0641, "D_tp": 65, "D_fp": 42, "D_tn": 32, "D_fn": 38, "sharpe": 1.3703, "sortino": 1.4343, "return_pct": 22.42, "equity": 1224.2, "max_dd": 0.0, "win_rate": 54.8, "profit_factor": 0.0, "ic": 0.0613, "hit": 54.8, "psr": 0.877, "bh_sharpe": 0.3098, "bh_return_pct": 3.19, "excess_sharpe": 1.0605, "precision": 0.6075, "recall": 0.6311, "f1": 0.619, "f2": 0.6262, "mcc": 0.0641, "accuracy": 0.548, "tp": 65, "fp": 42, "tn": 32, "fn": 38}, {"fold": "fold_6", "regime": "COVID crash and V-recovery", "n": 222, "A_sharpe": 0.3414, "A_sortino": 0.3498, "A_excess_sharpe": -0.5474, "A_return_pct": 5.14, "A_hit_rate": 47.75, "A_n": 222, "A_bh_sharpe": 0.8888, "A_bh_return_pct": 26.13, "A_psr": 0.6248, "A_ic": -0.0017, "A_precision": 0.6038, "A_recall": 0.4638, "A_f1": 0.5246, "A_f2": 0.4863, "A_accuracy": 0.4775, "A_mcc": -0.0352, "A_tp": 64, "A_fp": 42, "A_tn": 42, "A_fn": 74, "B_sharpe": 0.5125, "B_sortino": 0.4745, "B_excess_sharpe": -1.876, "B_return_pct": 10.03, "B_hit_rate": 52.49, "B_n": 222, "B_bh_sharpe": 2.3884, "B_bh_return_pct": 243.18, "B_psr": 0.6825, "B_ic": 0.1148, "B_precision": 0.629, "B_recall": 0.5693, "B_f1": 0.5977, "B_f2": 0.5804, "B_accuracy": 0.527, "B_mcc": 0.0276, "B_tp": 78, "B_fp": 46, "B_tn": 39, "B_fn": 59, "D_sharpe": 0.3414, "D_sortino": 0.3498, "D_excess_sharpe": -0.5474, "D_return_pct": 5.14, "D_hit_rate": 47.75, "D_n": 222, "D_bh_sharpe": 0.8888, "D_bh_return_pct": 26.13, "D_psr": 0.6248, "D_ic": -0.0017, "D_precision": 0.6038, "D_recall": 0.4638, "D_f1": 0.5246, "D_f2": 0.4863, "D_accuracy": 0.4775, "D_mcc": -0.0352, "D_tp": 64, "D_fp": 42, "D_tn": 42, "D_fn": 74, "sharpe": 0.3414, "sortino": 0.3498, "return_pct": 5.14, "equity": 1051.3999999999999, "max_dd": 0.0, "win_rate": 47.75, "profit_factor": 0.0, "ic": -0.0017, "hit": 47.75, "psr": 0.6248, "bh_sharpe": 0.8888, "bh_return_pct": 26.13, "excess_sharpe": -0.5474, "precision": 0.6038, "recall": 0.4638, "f1": 0.5246, "f2": 0.4863, "mcc": -0.0352, "accuracy": 0.4775, "tp": 64, "fp": 42, "tn": 42, "fn": 74}, {"fold": "fold_7", "regime": "Inflation bear, AI rally and 2025", "n": 425, "A_sharpe": 1.4274, "A_sortino": 1.4353, "A_excess_sharpe": 0.4559, "A_return_pct": 61.83, "A_hit_rate": 56.24, "A_n": 425, "A_bh_sharpe": 0.9715, "A_bh_return_pct": 37.12, "A_psr": 0.9707, "A_ic": 0.0835, "A_precision": 0.5982, "A_recall": 0.78, "A_f1": 0.6771, "A_f2": 0.7353, "A_accuracy": 0.5624, "A_mcc": 0.0366, "A_tp": 195, "A_fp": 131, "A_tn": 44, "A_fn": 55, "B_sharpe": 0.4301, "B_sortino": 0.4038, "B_excess_sharpe": -2.0725, "B_return_pct": 16.69, "B_hit_rate": 54.48, "B_n": 425, "B_bh_sharpe": 2.5027, "B_bh_return_pct": 458.83, "B_psr": 0.7108, "B_ic": 0.007, "B_precision": 0.5945, "B_recall": 0.8251, "B_f1": 0.6911, "B_f2": 0.7657, "B_accuracy": 0.5435, "B_mcc": -0.1234, "B_tp": 217, "B_fp": 148, "B_tn": 14, "B_fn": 46, "D_sharpe": 1.4274, "D_sortino": 1.4353, "D_excess_sharpe": 0.4559, "D_return_pct": 61.83, "D_hit_rate": 56.24, "D_n": 425, "D_bh_sharpe": 0.9715, "D_bh_return_pct": 37.12, "D_psr": 0.9707, "D_ic": 0.0835, "D_precision": 0.5982, "D_recall": 0.78, "D_f1": 0.6771, "D_f2": 0.7353, "D_accuracy": 0.5624, "D_mcc": 0.0366, "D_tp": 195, "D_fp": 131, "D_tn": 44, "D_fn": 55, "sharpe": 1.4274, "sortino": 1.4353, "return_pct": 61.83, "equity": 1618.3000000000002, "max_dd": 0.0, "win_rate": 56.24, "profit_factor": 0.0, "ic": 0.0835, "hit": 56.24, "psr": 0.9707, "bh_sharpe": 0.9715, "bh_return_pct": 37.12, "excess_sharpe": 0.4559, "precision": 0.5982, "recall": 0.78, "f1": 0.6771, "f2": 0.7353, "mcc": 0.0366, "accuracy": 0.5624, "tp": 195, "fp": 131, "tn": 44, "fn": 55}], "per_window_val": [{"fold": "fold_1", "regime": "GFC peak crash (Lehman + Mar-2009 bottom)", "n": 104, "A_sharpe": 1.014, "A_sortino": 1.166, "A_excess_sharpe": 1.1812, "A_return_pct": 11.17, "A_hit_rate": 49.02, "A_n": 104, "A_bh_sharpe": -0.1672, "A_bh_return_pct": -3.81, "A_psr": 0.7467, "A_ic": 0.0602, "A_precision": 0.5098, "A_recall": 0.4815, "A_f1": 0.4952, "A_f2": 0.4869, "A_accuracy": 0.4904, "A_mcc": -0.0185, "A_tp": 26, "A_fp": 25, "A_tn": 25, "A_fn": 28, "B_sharpe": -3.8723, "B_sortino": -3.3764, "B_excess_sharpe": -1.5982, "B_return_pct": -60.48, "B_hit_rate": 40.78, "B_n": 104, "B_bh_sharpe": -2.2741, "B_bh_return_pct": -44.12, "B_psr": 0.0043, "B_ic": -0.1362, "B_precision": 0.4138, "B_recall": 0.4615, "B_f1": 0.4364, "B_f2": 0.4511, "B_accuracy": 0.4038, "B_mcc": -0.1936, "B_tp": 24, "B_fp": 34, "B_tn": 18, "B_fn": 28, "D_sharpe": 1.014, "D_sortino": 1.166, "D_excess_sharpe": 1.1812, "D_return_pct": 11.17, "D_hit_rate": 49.02, "D_n": 104, "D_bh_sharpe": -0.1672, "D_bh_return_pct": -3.81, "D_psr": 0.7467, "D_ic": 0.0602, "D_precision": 0.5098, "D_recall": 0.4815, "D_f1": 0.4952, "D_f2": 0.4869, "D_accuracy": 0.4904, "D_mcc": -0.0185, "D_tp": 26, "D_fp": 25, "D_tn": 25, "D_fn": 28, "sharpe": 1.014, "sortino": 1.166, "return_pct": 11.17, "equity": 1111.6999999999998, "max_dd": 0.0, "win_rate": 49.02, "profit_factor": 0.0, "ic": 0.0602, "hit": 49.02, "psr": 0.7467, "bh_sharpe": -0.1672, "bh_return_pct": -3.81, "excess_sharpe": 1.1812, "precision": 0.5098, "recall": 0.4815, "f1": 0.4952, "f2": 0.4869, "mcc": -0.0185, "accuracy": 0.4904, "tp": 26, "fp": 25, "tn": 25, "fn": 28}, {"fold": "fold_2", "regime": "2011 US-downgrade + EU debt", "n": 96, "A_sharpe": -1.461, "A_sortino": -1.2417, "A_excess_sharpe": -1.1869, "A_return_pct": -14.99, "A_hit_rate": 50.53, "A_n": 96, "A_bh_sharpe": -0.2741, "A_bh_return_pct": -4.09, "A_psr": 0.1755, "A_ic": 0.0495, "A_precision": 0.5455, "A_recall": 0.36, "A_f1": 0.4337, "A_f2": 0.3863, "A_accuracy": 0.5104, "A_mcc": 0.0357, "A_tp": 18, "A_fp": 15, "A_tn": 31, "A_fn": 32, "B_sharpe": 0.5884, "B_sortino": 0.5994, "B_excess_sharpe": 1.6158, "B_return_pct": 6.85, "B_hit_rate": 53.12, "B_n": 96, "B_bh_sharpe": -1.0274, "B_bh_return_pct": -25.58, "B_psr": 0.6416, "B_ic": 0.0506, "B_precision": 0.4792, "B_recall": 0.5349, "B_f1": 0.5055, "B_f2": 0.5227, "B_accuracy": 0.5312, "B_mcc": 0.0628, "B_tp": 23, "B_fp": 25, "B_tn": 28, "B_fn": 20, "D_sharpe": -1.461, "D_sortino": -1.2417, "D_excess_sharpe": -1.1869, "D_return_pct": -14.99, "D_hit_rate": 50.53, "D_n": 96, "D_bh_sharpe": -0.2741, "D_bh_return_pct": -4.09, "D_psr": 0.1755, "D_ic": 0.0495, "D_precision": 0.5455, "D_recall": 0.36, "D_f1": 0.4337, "D_f2": 0.3863, "D_accuracy": 0.5104, "D_mcc": 0.0357, "D_tp": 18, "D_fp": 15, "D_tn": 31, "D_fn": 32, "sharpe": -1.461, "sortino": -1.2417, "return_pct": -14.99, "equity": 850.1, "max_dd": 0.0, "win_rate": 50.53, "profit_factor": 0.0, "ic": 0.0495, "hit": 50.53, "psr": 0.1755, "bh_sharpe": -0.2741, "bh_return_pct": -4.09, "excess_sharpe": -1.1869, "precision": 0.5455, "recall": 0.36, "f1": 0.4337, "f2": 0.3863, "mcc": 0.0357, "accuracy": 0.5104, "tp": 18, "fp": 15, "tn": 31, "fn": 32}, {"fold": "fold_3", "regime": "Taper tantrum and 2014 H1", "n": 54, "A_sharpe": -0.9559, "A_sortino": -1.0498, "A_excess_sharpe": -5.6557, "A_return_pct": -2.22, "A_hit_rate": 42.59, "A_n": 54, "A_bh_sharpe": 4.6998, "A_bh_return_pct": 10.46, "A_psr": 0.333, "A_ic": 0.0784, "A_precision": 0.6667, "A_recall": 0.1212, "A_f1": 0.2051, "A_f2": 0.1449, "A_accuracy": 0.4259, "A_mcc": 0.0403, "A_tp": 4, "A_fp": 2, "A_tn": 19, "A_fn": 29, "B_sharpe": -5.9991, "B_sortino": -5.1131, "B_excess_sharpe": -15.0317, "B_return_pct": -25.67, "B_hit_rate": 35.19, "B_n": 54, "B_bh_sharpe": 9.0326, "B_bh_return_pct": 49.18, "B_psr": 0.0025, "B_ic": 0.1216, "B_precision": 0.75, "B_recall": 0.0811, "B_f1": 0.1463, "B_f2": 0.0987, "B_accuracy": 0.3519, "B_mcc": 0.0395, "B_tp": 3, "B_fp": 1, "B_tn": 16, "B_fn": 34, "D_sharpe": -0.9559, "D_sortino": -1.0498, "D_excess_sharpe": -5.6557, "D_return_pct": -2.22, "D_hit_rate": 42.59, "D_n": 54, "D_bh_sharpe": 4.6998, "D_bh_return_pct": 10.46, "D_psr": 0.333, "D_ic": 0.0784, "D_precision": 0.6667, "D_recall": 0.1212, "D_f1": 0.2051, "D_f2": 0.1449, "D_accuracy": 0.4259, "D_mcc": 0.0403, "D_tp": 4, "D_fp": 2, "D_tn": 19, "D_fn": 29, "sharpe": -0.9559, "sortino": -1.0498, "return_pct": -2.22, "equity": 977.8, "max_dd": 0.0, "win_rate": 42.59, "profit_factor": 0.0, "ic": 0.0784, "hit": 42.59, "psr": 0.333, "bh_sharpe": 4.6998, "bh_return_pct": 10.46, "excess_sharpe": -5.6557, "precision": 0.6667, "recall": 0.1212, "f1": 0.2051, "f2": 0.1449, "mcc": 0.0403, "accuracy": 0.4259, "tp": 4, "fp": 2, "tn": 19, "fn": 29}, {"fold": "fold_4", "regime": "China devaluation and oil crash", "n": 96, "A_sharpe": 0.0628, "A_sortino": 0.0754, "A_excess_sharpe": 0.4869, "A_return_pct": -0.24, "A_hit_rate": 41.05, "A_n": 96, "A_bh_sharpe": -0.4241, "A_bh_return_pct": -3.73, "A_psr": 0.5154, "A_ic": -0.0793, "A_precision": 0.3878, "A_recall": 0.4222, "A_f1": 0.4043, "A_f2": 0.4148, "A_accuracy": 0.4167, "A_mcc": -0.1657, "A_tp": 19, "A_fp": 30, "A_tn": 21, "A_fn": 26, "B_sharpe": 2.1738, "B_sortino": 3.105, "B_excess_sharpe": 3.3581, "B_return_pct": 39.2, "B_hit_rate": 52.08, "B_n": 96, "B_bh_sharpe": -1.1843, "B_bh_return_pct": -21.44, "B_psr": 0.9328, "B_ic": 0.1363, "B_precision": 0.5, "B_recall": 0.5435, "B_f1": 0.5208, "B_f2": 0.5342, "B_accuracy": 0.5208, "B_mcc": 0.0435, "B_tp": 25, "B_fp": 25, "B_tn": 25, "B_fn": 21, "D_sharpe": 0.0628, "D_sortino": 0.0754, "D_excess_sharpe": 0.4869, "D_return_pct": -0.24, "D_hit_rate": 41.05, "D_n": 96, "D_bh_sharpe": -0.4241, "D_bh_return_pct": -3.73, "D_psr": 0.5154, "D_ic": -0.0793, "D_precision": 0.3878, "D_recall": 0.4222, "D_f1": 0.4043, "D_f2": 0.4148, "D_accuracy": 0.4167, "D_mcc": -0.1657, "D_tp": 19, "D_fp": 30, "D_tn": 21, "D_fn": 26, "sharpe": 0.0628, "sortino": 0.0754, "return_pct": -0.24, "equity": 997.6, "max_dd": 0.0, "win_rate": 41.05, "profit_factor": 0.0, "ic": -0.0793, "hit": 41.05, "psr": 0.5154, "bh_sharpe": -0.4241, "bh_return_pct": -3.73, "excess_sharpe": 0.4869, "precision": 0.3878, "recall": 0.4222, "f1": 0.4043, "f2": 0.4148, "mcc": -0.1657, "accuracy": 0.4167, "tp": 19, "fp": 30, "tn": 21, "fn": 26}, {"fold": "fold_5", "regime": "2018 Vol-mageddon + Q4 sell-off", "n": 54, "A_sharpe": 2.5435, "A_sortino": 2.4833, "A_excess_sharpe": 1.1155, "A_return_pct": 7.27, "A_hit_rate": 57.41, "A_n": 54, "A_bh_sharpe": 1.428, "A_bh_return_pct": 3.97, "A_psr": 0.8697, "A_ic": 0.1935, "A_precision": 0.625, "A_recall": 0.5172, "A_f1": 0.566, "A_f2": 0.5357, "A_accuracy": 0.5741, "A_mcc": 0.1578, "A_tp": 15, "A_fp": 9, "A_tn": 16, "A_fn": 14, "B_sharpe": 1.5318, "B_sortino": 1.5301, "B_excess_sharpe": -3.4004, "B_return_pct": 9.44, "B_hit_rate": 55.56, "B_n": 54, "B_bh_sharpe": 4.9322, "B_bh_return_pct": 34.93, "B_psr": 0.7584, "B_ic": 0.0183, "B_precision": 0.697, "B_recall": 0.6216, "B_f1": 0.6571, "B_f2": 0.6354, "B_accuracy": 0.5556, "B_mcc": 0.0318, "B_tp": 23, "B_fp": 10, "B_tn": 7, "B_fn": 14, "D_sharpe": 2.5435, "D_sortino": 2.4833, "D_excess_sharpe": 1.1155, "D_return_pct": 7.27, "D_hit_rate": 57.41, "D_n": 54, "D_bh_sharpe": 1.428, "D_bh_return_pct": 3.97, "D_psr": 0.8697, "D_ic": 0.1935, "D_precision": 0.625, "D_recall": 0.5172, "D_f1": 0.566, "D_f2": 0.5357, "D_accuracy": 0.5741, "D_mcc": 0.1578, "D_tp": 15, "D_fp": 9, "D_tn": 16, "D_fn": 14, "sharpe": 2.5435, "sortino": 2.4833, "return_pct": 7.27, "equity": 1072.7, "max_dd": 0.0, "win_rate": 57.41, "profit_factor": 0.0, "ic": 0.1935, "hit": 57.41, "psr": 0.8697, "bh_sharpe": 1.428, "bh_return_pct": 3.97, "excess_sharpe": 1.1155, "precision": 0.625, "recall": 0.5172, "f1": 0.566, "f2": 0.5357, "mcc": 0.1578, "accuracy": 0.5741, "tp": 15, "fp": 9, "tn": 16, "fn": 14}, {"fold": "fold_6", "regime": "COVID crash and V-recovery", "n": 75, "A_sharpe": -3.4218, "A_sortino": -3.1915, "A_excess_sharpe": -7.7212, "A_return_pct": -10.75, "A_hit_rate": 38.67, "A_n": 75, "A_bh_sharpe": 4.2994, "A_bh_return_pct": 14.68, "A_psr": 0.0301, "A_ic": 0.1371, "A_precision": 0.7778, "A_recall": 0.1373, "A_f1": 0.2333, "A_f2": 0.1643, "A_accuracy": 0.3867, "A_mcc": 0.0774, "A_tp": 7, "A_fp": 2, "A_tn": 22, "A_fn": 44, "B_sharpe": -0.4117, "B_sortino": -0.4362, "B_excess_sharpe": -14.7456, "B_return_pct": -3.95, "B_hit_rate": 45.33, "B_n": 75, "B_bh_sharpe": 14.3339, "B_bh_return_pct": 120.13, "B_psr": 0.4119, "B_ic": 0.075, "B_precision": 0.8438, "B_recall": 0.4286, "B_f1": 0.5684, "B_f2": 0.4754, "B_accuracy": 0.4533, "B_mcc": 0.0088, "B_tp": 27, "B_fp": 5, "B_tn": 7, "B_fn": 36, "D_sharpe": -3.4218, "D_sortino": -3.1915, "D_excess_sharpe": -7.7212, "D_return_pct": -10.75, "D_hit_rate": 38.67, "D_n": 75, "D_bh_sharpe": 4.2994, "D_bh_return_pct": 14.68, "D_psr": 0.0301, "D_ic": 0.1371, "D_precision": 0.7778, "D_recall": 0.1373, "D_f1": 0.2333, "D_f2": 0.1643, "D_accuracy": 0.3867, "D_mcc": 0.0774, "D_tp": 7, "D_fp": 2, "D_tn": 22, "D_fn": 44, "sharpe": -3.4218, "sortino": -3.1915, "return_pct": -10.75, "equity": 892.5, "max_dd": 0.0, "win_rate": 38.67, "profit_factor": 0.0, "ic": 0.1371, "hit": 38.67, "psr": 0.0301, "bh_sharpe": 4.2994, "bh_return_pct": 14.68, "excess_sharpe": -7.7212, "precision": 0.7778, "recall": 0.1373, "f1": 0.2333, "f2": 0.1643, "mcc": 0.0774, "accuracy": 0.3867, "tp": 7, "fp": 2, "tn": 22, "fn": 44}, {"fold": "fold_7", "regime": "Inflation bear, AI rally and 2025", "n": 114, "A_sharpe": 4.086, "A_sortino": 4.1409, "A_excess_sharpe": 1.241, "A_return_pct": 31.74, "A_hit_rate": 60.53, "A_n": 114, "A_bh_sharpe": 2.845, "A_bh_return_pct": 21.34, "A_psr": 0.9948, "A_ic": 0.2636, "A_precision": 0.6341, "A_recall": 0.7761, "A_f1": 0.698, "A_f2": 0.7429, "A_accuracy": 0.6053, "A_mcc": 0.151, "A_tp": 52, "A_fp": 30, "