{"experiment_num": 36, "backbone": "lstm", "description": "LSTM @ exp 8 baseline warmup=5 (up from 0) - Goyal 2017 LR warmup for stability", "config": {"seq_len": 10, "lr": 0.001, "batch_size": 16, "epochs": 100, "weight_decay": 0.0007, "patience": 15, "warmup_epochs": 5, "head_dropout": 0.1, "huber_delta": 1.0, "grad_clip": 1.0, "seed": 0, "hidden_size": null, "num_layers": null, "max_depth": null, "gbm_lr": null, "n_estimators": null}, "composite": -0.1459, "test_pos_folds": 4, "val_pos_folds": 5, "val_loss": -2.895197163946914, "elapsed_sec": 49.2, "timestamp": "2026-04-27T18:37:56", "sharpe": 0.1541, "val_sharpe": 0.2467, "ic": 0.0137, "hit": 47.9, "psr": 0.6424, "equity": 1028.8999999999999, "return_pct": 2.89, "bh_sharpe": 0.6042, "bh_return_pct": 103.49, "excess_sharpe": -0.4501, "B_sharpe": 0.43, "B_excess_sharpe": -1.2708, "B_return_pct": 61.47, "D_sharpe": 0.1541, "D_excess_sharpe": -0.4501, "D_return_pct": 2.89, "per_window": [{"fold": "fold_1", "regime": "GFC peak crash (Lehman + Mar-2009 bottom)", "n": 115, "A_sharpe": -1.3033, "A_sortino": -1.166, "A_excess_sharpe": -0.8591, "A_return_pct": -29.45, "A_hit_rate": 49.57, "A_n": 115, "A_bh_sharpe": -0.4441, "A_bh_return_pct": -14.4, "A_psr": 0.1852, "A_ic": -0.0475, "B_sharpe": -0.321, "B_sortino": -0.3342, "B_excess_sharpe": -0.0231, "B_return_pct": -27.84, "B_hit_rate": 46.49, "B_n": 115, "B_bh_sharpe": -0.2978, "B_bh_return_pct": -27.23, "B_psr": 0.4146, "B_ic": 0.076, "D_sharpe": -1.3033, "D_sortino": -1.166, "D_excess_sharpe": -0.8591, "D_return_pct": -29.45, "D_hit_rate": 49.57, "D_n": 115, "D_bh_sharpe": -0.4441, "D_bh_return_pct": -14.4, "D_psr": 0.1852, "D_ic": -0.0475, "sharpe": -1.3033, "sortino": -1.166, "return_pct": -29.45, "equity": 705.5, "max_dd": 0.0, "win_rate": 49.57, "profit_factor": 0.0, "ic": -0.0475, "hit": 49.57, "psr": 0.1852, "bh_sharpe": -0.4441, "bh_return_pct": -14.4, "excess_sharpe": -0.8591, "precision": 0.4333, "recall": 0.2407, "f1": 0.3095, "f2": 0.2642, "accuracy": 0.4957, "mcc": -0.0431, "tp": 13, "fp": 17, "tn": 44, "fn": 41, "A_precision": 0.4333, "A_recall": 0.2407, "A_f1": 0.3095, "A_f2": 0.2642, "A_accuracy": 0.4957, "A_mcc": -0.0431, "A_tp": 13, "A_fp": 17, "A_tn": 44, "A_fn": 41}, {"fold": "fold_2", "regime": "2011 US-downgrade + EU debt", "n": 136, "A_sharpe": -1.9992, "A_sortino": -1.9815, "A_excess_sharpe": -3.7319, "A_return_pct": -20.72, "A_hit_rate": 41.48, "A_n": 136, "A_bh_sharpe": 1.7327, "A_bh_return_pct": 19.75, "A_psr": 0.0726, "A_ic": 0.0891, "B_sharpe": 3.3367, "B_sortino": 3.0059, "B_excess_sharpe": -0.7292, "B_return_pct": 110.8, "B_hit_rate": 66.91, "B_n": 136, "B_bh_sharpe": 4.0659, "B_bh_return_pct": 148.68, "B_psr": 0.9914, "B_ic": 0.1008, "D_sharpe": -1.9992, "D_sortino": -1.9815, "D_excess_sharpe": -3.7319, "D_return_pct": -20.72, "D_hit_rate": 41.48, "D_n": 136, "D_bh_sharpe": 1.7327, "D_bh_return_pct": 19.75, "D_psr": 0.0726, "D_ic": 0.0891, "sharpe": -1.9992, "sortino": -1.9815, "return_pct": -20.72, "equity": 792.8, "max_dd": 0.0, "win_rate": 41.48, "profit_factor": 0.0, "ic": 0.0891, "hit": 41.48, "psr": 0.0726, "bh_sharpe": 1.7327, "bh_return_pct": 19.75, "excess_sharpe": -3.7319, "precision": 0.4706, "recall": 0.1026, "f1": 0.1684, "f2": 0.1216, "accuracy": 0.4191, "mcc": -0.0787, "tp": 8, "fp": 9, "tn": 49, "fn": 70, "A_precision": 0.4706, "A_recall": 0.1026, "A_f1": 0.1684, "A_f2": 0.1216, "A_accuracy": 0.4191, "A_mcc": -0.0787, "A_tp": 8, "A_fp": 9, "A_tn": 49, "A_fn": 70}, {"fold": "fold_3", "regime": "Taper tantrum and 2014 H1", "n": 178, "A_sharpe": -0.4583, "A_sortino": -0.4482, "A_excess_sharpe": -1.8029, "A_return_pct": -4.69, "A_hit_rate": 50.28, "A_n": 178, "A_bh_sharpe": 1.3445, "A_bh_return_pct": 12.41, "A_psr": 0.3507, "A_ic": -0.0629, "B_sharpe": 4.02, "B_sortino": 4.2654, "B_excess_sharpe": 0.9717, "B_return_pct": 103.88, "B_hit_rate": 62.36, "B_n": 178, "B_bh_sharpe": 3.0483, "B_bh_return_pct": 71.83, "B_psr": 0.9996, "B_ic": 0.1711, "D_sharpe": -0.4583, "D_sortino": -0.4482, "D_excess_sharpe": -1.8029, "D_return_pct": -4.69, "D_hit_rate": 50.28, "D_n": 178, "D_bh_sharpe": 1.3445, "D_bh_return_pct": 12.41, "D_psr": 0.3507, "D_ic": -0.0629, "sharpe": -0.4583, "sortino": -0.4482, "return_pct": -4.69, "equity": 953.0999999999999, "max_dd": 0.0, "win_rate": 50.28, "profit_factor": 0.0, "ic": -0.0629, "hit": 50.28, "psr": 0.3507, "bh_sharpe": 1.3445, "bh_return_pct": 12.41, "excess_sharpe": -1.8029, "precision": 0.6094, "recall": 0.3786, "f1": 0.4671, "f2": 0.4097, "accuracy": 0.5, "mcc": 0.0466, "tp": 39, "fp": 25, "tn": 50, "fn": 64, "A_precision": 0.6094, "A_recall": 0.3786, "A_f1": 0.4671, "A_f2": 0.4097, "A_accuracy": 0.5, "A_mcc": 0.0466, "A_tp": 39, "A_fp": 25, "A_tn": 50, "A_fn": 64}, {"fold": "fold_4", "regime": "China devaluation and oil crash", "n": 157, "A_sharpe": 0.7645, "A_sortino": 0.8012, "A_excess_sharpe": 0.7547, "A_return_pct": 8.4, "A_hit_rate": 51.92, "A_n": 157, "A_bh_sharpe": 0.0098, "A_bh_return_pct": -1.05, "A_psr": 0.7275, "A_ic": 0.037, "B_sharpe": 0.906, "B_sortino": 0.8911, "B_excess_sharpe": 0.8901, "B_return_pct": 20.62, "B_hit_rate": 54.14, "B_n": 157, "B_bh_sharpe": 0.0159, "B_bh_return_pct": -5.48, "B_psr": 0.7614, "B_ic": 0.1176, "D_sharpe": 0.7645, "D_sortino": 0.8012, "D_excess_sharpe": 0.7547, "D_return_pct": 8.4, "D_hit_rate": 51.92, "D_n": 157, "D_bh_sharpe": 0.0098, "D_bh_return_pct": -1.05, "D_psr": 0.7275, "D_ic": 0.037, "sharpe": 0.7645, "sortino": 0.8012, "return_pct": 8.4, "equity": 1084.0, "max_dd": 0.0, "win_rate": 51.92, "profit_factor": 0.0, "ic": 0.037, "hit": 51.92, "psr": 0.7275, "bh_sharpe": 0.0098, "bh_return_pct": -1.05, "excess_sharpe": 0.7547, "precision": 0.5789, "recall": 0.2716, "f1": 0.3697, "f2": 0.3039, "accuracy": 0.5223, "mcc": 0.0713, "tp": 22, "fp": 16, "tn": 60, "fn": 59, "A_precision": 0.5789, "A_recall": 0.2716, "A_f1": 0.3697, "A_f2": 0.3039, "A_accuracy": 0.5223, "A_mcc": 0.0713, "A_tp": 22, "A_fp": 16, "A_tn": 60, "A_fn": 59}, {"fold": "fold_5", "regime": "2018 Vol-mageddon + Q4 sell-off", "n": 177, "A_sharpe": 0.8852, "A_sortino": 1.0598, "A_excess_sharpe": 0.5754, "A_return_pct": 13.25, "A_hit_rate": 45.76, "A_n": 177, "A_bh_sharpe": 0.3098, "A_bh_return_pct": 3.19, "A_psr": 0.7744, "A_ic": 0.0311, "B_sharpe": 0.2928, "B_sortino": 0.2683, "B_excess_sharpe": -0.5988, "B_return_pct": 1.95, "B_hit_rate": 54.55, "B_n": 177, "B_bh_sharpe": 0.8917, "B_bh_return_pct": 23.8, "B_psr": 0.5963, "B_ic": 0.0205, "D_sharpe": 0.8852, "D_sortino": 1.0598, "D_excess_sharpe": 0.5754, "D_return_pct": 13.25, "D_hit_rate": 45.76, "D_n": 177, "D_bh_sharpe": 0.3098, "D_bh_return_pct": 3.19, "D_psr": 0.7744, "D_ic": 0.0311, "sharpe": 0.8852, "sortino": 1.0598, "return_pct": 13.25, "equity": 1132.5, "max_dd": 0.0, "win_rate": 45.76, "profit_factor": 0.0, "ic": 0.0311, "hit": 45.76, "psr": 0.7744, "bh_sharpe": 0.3098, "bh_return_pct": 3.19, "excess_sharpe": 0.5754, "precision": 0.5714, "recall": 0.2718, "f1": 0.3684, "f2": 0.3037, "accuracy": 0.4576, "mcc": -0.0132, "tp": 28, "fp": 21, "tn": 53, "fn": 75, "A_precision": 0.5714, "A_recall": 0.2718, "A_f1": 0.3684, "A_f2": 0.3037, "A_accuracy": 0.4576, "A_mcc": -0.0132, "A_tp": 28, "A_fp": 21, "A_tn": 53, "A_fn": 75}, {"fold": "fold_6", "regime": "COVID crash and V-recovery", "n": 222, "A_sharpe": 1.5389, "A_sortino": 1.8466, "A_excess_sharpe": 0.6501, "A_return_pct": 56.68, "A_hit_rate": 50.45, "A_n": 222, "A_bh_sharpe": 0.8888, "A_bh_return_pct": 26.13, "A_psr": 0.9332, "A_ic": 0.0113, "B_sharpe": -2.9478, "B_sortino": -2.5325, "B_excess_sharpe": -5.3362, "B_return_pct": -86.54, "B_hit_rate": 45.7, "B_n": 222, "B_bh_sharpe": 2.3884, "B_bh_return_pct": 243.18, "B_psr": 0.0018, "B_ic": -0.1569, "D_sharpe": 1.5389, "D_sortino": 1.8466, "D_excess_sharpe": 0.6501, "D_return_pct": 56.68, "D_hit_rate": 50.45, "D_n": 222, "D_bh_sharpe": 0.8888, "D_bh_return_pct": 26.13, "D_psr": 0.9332, "D_ic": 0.0113, "sharpe": 1.5389, "sortino": 1.8466, "return_pct": 56.68, "equity": 1566.8, "max_dd": 0.0, "win_rate": 50.45, "profit_factor": 0.0, "ic": 0.0113, "hit": 50.45, "psr": 0.9332, "bh_sharpe": 0.8888, "bh_return_pct": 26.13, "excess_sharpe": 0.6501, "precision": 0.6273, "recall": 0.5, "f1": 0.5565, "f2": 0.5211, "accuracy": 0.5045, "mcc": 0.0115, "tp": 69, "fp": 41, "tn": 43, "fn": 69, "A_precision": 0.6273, "A_recall": 0.5, "A_f1": 0.5565, "A_f2": 0.5211, "A_accuracy": 0.5045, "A_mcc": 0.0115, "A_tp": 69, "A_fp": 41, "A_tn": 43, "A_fn": 69}, {"fold": "fold_7", "regime": "Inflation bear, AI rally and 2025", "n": 425, "A_sharpe": 0.1166, "A_sortino": 0.1317, "A_excess_sharpe": -0.8549, "A_return_pct": 0.33, "A_hit_rate": 46.59, "A_n": 425, "A_bh_sharpe": 0.9715, "A_bh_return_pct": 37.12, "A_psr": 0.5604, "A_ic": 0.0149, "B_sharpe": 1.7304, "B_sortino": 1.7457, "B_excess_sharpe": -0.7723, "B_return_pct": 214.53, "B_hit_rate": 57.55, "B_n": 425, "B_bh_sharpe": 2.5027, "B_bh_return_pct": 458.83, "B_psr": 0.9883, "B_ic": 0.0472, "D_sharpe": 0.1166, "D_sortino": 0.1317, "D_excess_sharpe": -0.8549, "D_return_pct": 0.33, "D_hit_rate": 46.59, "D_n": 425, "D_bh_sharpe": 0.9715, "D_bh_return_pct": 37.12, "D_psr": 0.5604, "D_ic": 0.0149, "sharpe": 0.1166, "sortino": 0.1317, "return_pct": 0.33, "equity": 1003.3000000000001, "max_dd": 0.0, "win_rate": 46.59, "profit_factor": 0.0, "ic": 0.0149, "hit": 46.59, "psr": 0.5604, "bh_sharpe": 0.9715, "bh_return_pct": 37.12, "excess_sharpe": -0.8549, "precision": 0.5804, "recall": 0.332, "f1": 0.4224, "f2": 0.3631, "accuracy": 0.4659, "mcc": -0.0113, "tp": 83, "fp": 60, "tn": 115, "fn": 167, "A_precision": 0.5804, "A_recall": 0.332, "A_f1": 0.4224, "A_f2": 0.3631, "A_accuracy": 0.4659, "A_mcc": -0.0113, "A_tp": 83, "A_fp": 60, "A_tn": 115, "A_fn": 167}], "per_window_val": [{"fold": "fold_1", "regime": "GFC peak crash (Lehman + Mar-2009 bottom)", "n": 104, "A_sharpe": 1.069, "A_sortino": 1.2802, "A_excess_sharpe": 1.2362, "A_return_pct": 11.92, "A_hit_rate": 49.02, "A_n": 104, "A_bh_sharpe": -0.1672, "A_bh_return_pct": -3.81, "A_psr": 0.76, "A_ic": 0.0232, "B_sharpe": -2.8907, "B_sortino": -2.5506, "B_excess_sharpe": -0.6166, "B_return_pct": -51.21, "B_hit_rate": 43.69, "B_n": 104, "B_bh_sharpe": -2.2741, "B_bh_return_pct": -44.12, "B_psr": 0.0262, "B_ic": -0.2538, "D_sharpe": 1.069, "D_sortino": 1.2802, "D_excess_sharpe": 1.2362, "D_return_pct": 11.92, "D_hit_rate": 49.02, "D_n": 104, "D_bh_sharpe": -0.1672, "D_bh_return_pct": -3.81, "D_psr": 0.76, "D_ic": 0.0232, "sharpe": 1.069, "sortino": 1.2802, "return_pct": 11.92, "equity": 1119.2, "max_dd": 0.0, "win_rate": 49.02, "profit_factor": 0.0, "ic": 0.0232, "hit": 49.02, "psr": 0.76, "bh_sharpe": -0.1672, "bh_return_pct": -3.81, "excess_sharpe": 1.2362}, {"fold": "fold_2", "regime": "2011 US-downgrade + EU debt", "n": 96, "A_sharpe": 0.3992, "A_sortino": 0.4267, "A_excess_sharpe": 0.6733, "A_return_pct": 2.75, "A_hit_rate": 50.53, "A_n": 96, "A_bh_sharpe": -0.2741, "A_bh_return_pct": -4.09, "A_psr": 0.5974, "A_ic": 0.1242, "B_sharpe": -1.8096, "B_sortino": -1.7523, "B_excess_sharpe": -0.7821, "B_return_pct": -37.36, "B_hit_rate": 41.67, "B_n": 96, "B_bh_sharpe": -1.0274, "B_bh_return_pct": -25.58, "B_psr": 0.128, "B_ic": 0.1246, "D_sharpe": 0.3992, "D_sortino": 0.4267, "D_excess_sharpe": 0.6733, "D_return_pct": 2.75, "D_hit_rate": 50.53, "D_n": 96, "D_bh_sharpe": -0.2741, "D_bh_return_pct": -4.09, "D_psr": 0.5974, "D_ic": 0.1242, "sharpe": 0.3992, "sortino": 0.4267, "return_pct": 2.75, "equity": 1027.5, "max_dd": 0.0, "win_rate": 50.53, "profit_factor": 0.0, "ic": 0.1242, "hit": 50.53, "psr": 0.5974, "bh_sharpe": -0.2741, "bh_return_pct": -4.09, "excess_sharpe": 0.6733}, {"fold": "fold_3", "regime": "Taper tantrum and 2014 H1", "n": 54, "A_sharpe": -0.4666, "A_sortino": -0.4439, "A_excess_sharpe": -5.1664, "A_return_pct": -1.15, "A_hit_rate": 51.85, "A_n": 54, "A_bh_sharpe": 4.6998, "A_bh_return_pct": 10.46, "A_psr": 0.4153, "A_ic": 0.0878, "B_sharpe": 9.0326, "B_sortino": 13.2979, "B_excess_sharpe": 0.0, "B_return_pct": 49.18, "B_hit_rate": 68.52, "B_n": 54, "B_bh_sharpe": 9.0326, "B_bh_return_pct": 49.18, "B_psr": 1.0, "B_ic": 0.0183, "D_sharpe": -0.4666, "D_sortino": -0.4439, "D_excess_sharpe": -5.1664, "D_return_pct": -1.15, "D_hit_rate": 51.85, "D_n": 54, "D_bh_sharpe": 4.6998, "D_bh_return_pct": 10.46, "D_psr": 0.4153, "D_ic": 0.0878, "sharpe": -0.4666, "sortino": -0.4439, "return_pct": -1.15, "equity": 988.5, "max_dd": 0.0, "win_rate": 51.85, "profit_factor": 0.0, "ic": 0.0878, "hit": 51.85, "psr": 0.4153, "bh_sharpe": 4.6998, "bh_return_pct": 10.46, "excess_sharpe": -5.1664}, {"fold": "fold_4", "regime": "China devaluation and oil crash", "n": 96, "A_sharpe": 0.81, "A_sortino": 1.0367, "A_excess_sharpe": 1.2341, "A_return_pct": 5.36, "A_hit_rate": 48.42, "A_n": 96, "A_bh_sharpe": -0.4241, "A_bh_return_pct": -3.73, "A_psr": 0.697, "A_ic": 0.0123, "B_sharpe": 3.5229, "B_sortino": 4.936, "B_excess_sharpe": 4.7072, "B_return_pct": 73.37, "B_hit_rate": 58.33, "B_n": 96, "B_bh_sharpe": -1.1843, "B_bh_return_pct": -21.44, "B_psr": 0.9946, "B_ic": 0.3153, "D_sharpe": 0.81, "D_sortino": 1.0367, "D_excess_sharpe": 1.2341, "D_return_pct": 5.36, "D_hit_rate": 48.42, "D_n": 96, "D_bh_sharpe": -0.4241, "D_bh_return_pct": -3.73, "D_psr": 0.697, "D_ic": 0.0123, "sharpe": 0.81, "sortino": 1.0367, "return_pct": 5.36, "equity": 1053.6000000000001, "max_dd": 0.0, "win_rate": 48.42, "profit_factor": 0.0, "ic": 0.0123, "hit": 48.42, "psr": 0.697, "bh_sharpe": -0.4241, "bh_return_pct": -3.73, "excess_sharpe": 1.2341}, {"fold": "fold_5", "regime": "2018 Vol-mageddon + Q4 sell-off", "n": 54, "A_sharpe": 0.5651, "A_sortino": 0.6036, "A_excess_sharpe": -0.8629, "A_return_pct": 1.44, "A_hit_rate": 48.15, "A_n": 54, "A_bh_sharpe": 1.428, "A_bh_return_pct": 3.97, "A_psr": 0.6026, "A_ic": -0.0055, "B_sharpe": 2.8943, "B_sortino": 2.7377, "B_excess_sharpe": -2.0379, "B_return_pct": 19.37, "B_hit_rate": 61.11, "B_n": 54, "B_bh_sharpe": 4.9322, "B_bh_return_pct": 34.93, "B_psr": 0.9008, "B_ic": -0.0248, "D_sharpe": 0.5651, "D_sortino": 0.6036, "D_excess_sharpe": -0.8629, "D_return_pct": 1.44, "D_hit_rate": 48.15, "D_n": 54, "D_bh_sharpe": 1.428, "D_bh_return_pct": 3.97, "D_psr": 0.6026, "D_ic": -0.0055, "sharpe": 0.5651, "sortino": 0.6036, "return_pct": 1.44, "equity": 1014.4, "max_dd": 0.0, "win_rate": 48.15, "profit_factor": 0.0, "ic": -0.0055, "hit": 48.15, "psr": 0.6026, "bh_sharpe": 1.428, "bh_return_pct": 3.97, "excess_sharpe": -0.8629}, {"fold": "fold_6", "regime": "COVID crash and V-recovery", "n": 75, "A_sharpe": -3.6843, "A_sortino": -3.4817, "A_excess_sharpe": -7.9837, "A_return_pct": -11.48, "A_hit_rate": 37.33, "A_n": 75, "A_bh_sharpe": 4.2994, "A_bh_return_pct": 14.68, "A_psr": 0.0236, "A_ic": -0.1329, "B_sharpe": 7.8661, "B_sortino": 6.9534, "B_excess_sharpe": -6.4678, "B_return_pct": 68.12, "B_hit_rate": 73.33, "B_n": 75, "B_bh_sharpe": 14.3339, "B_bh_return_pct": 120.13, "B_psr": 0.9998, "B_ic": 0.179, "D_sharpe": -3.6843, "D_sortino": -3.4817, "D_excess_sharpe": -7.9837, "D_return_pct": -11.48, "D_hit_rate": 37.33, "D_n": 75, "D_bh_sharpe": 4.2994, "D_bh_return_pct": 14.68, "D_psr": 0.0236, "D_ic": -0.1329, "sharpe": -3.6843, "sortino": -3.4817, "return_pct": -11.48, "equity": 885.1999999999999, "max_dd": 0.0, "win_rate": 37.33, "profit_factor": 0.0, "ic": -0.1329, "hit": 37.33, "psr": 0.0236, "bh_sharpe": 4.2994, "bh_return_pct": 14.68, "excess_sharpe": -7.9837}, {"fold": "fold_7", "regime": "Inflation bear, AI rally and 2025", "n": 114, "A_sharpe": 0.039, "A_sortino": 0.0402, "A_excess_sharpe": -2.8061, "A_return_pct": -0.28, "A_hit_rate": 49.12, "A_n": 114, "A_bh_sharpe": 2.845, "A_bh_return_pct": 21.34, "A_psr": 0.5104, "A_ic": 0.0856, "B_sharpe": 5.3193, "B_sortino": 6.339, "B_excess_sharpe": -0.8174, "B_return_pct": 127.35, "B_hit_rate": 63.16, "B_n": 114, "B_bh_sharpe": 6.1366, "B_bh_return_pct": 155.03, "B_psr": 0.9999, "B_ic": 0.0821, "D_sharpe": 0.039, "D_sortino": 0.0402, "D_excess_sharpe": -2.8061, "D_return_pct": -0.28, "D_hit_rate": 49.12, "D_n": 114, "D_bh_sharpe": 2.845, "D_bh_return_pct": 21.34, "D_psr": 0.5104, "D_ic": 0.0856, "sharpe": 0.039, "sortino": 0.0402, "return_pct": -0.28, "equity": 997.1999999999999, "max_dd": 0.0, "win_rate": 49.12, "profit_factor": 0.0, "ic": 0.0856, "hit": 49.12, "psr": 0.5104, "bh_sharpe": 2.845, "bh_return_pct": 21.34, "excess_sharpe": -2.8061}], "status": "DISCARD", "precision": 0.5809, "recall": 0.3247, "f1": 0.4165, "f2": 0.3561, "accuracy": 0.4794, "mcc": 0.0119, "tp": 262, "fp": 189, "tn": 414, "fn": 545, "test_sharpe": 0.1541, "A_sharpe": 0.1541, "A_excess_sharpe": -0.4501, "A_return_pct": 2.89, "A_precision": 0.5809, "A_recall": 0.3247, "A_f1": 0.4165, "A_f2": 0.3561, "A_accuracy": 0.4794, "A_mcc": 0.0119, "A_tp": 262, "A_fp": 189, "A_tn": 414, "A_fn": 545, "A_psr": 0.6424, "A_ic": 0.0137, "A_hit_rate": 47.9, "A_bh_sharpe": 0.6042, "A_bh_return_pct": 103.49}
