{"experiment_num": 85, "backbone": "lstm", "description": "LSTM @ exp 71 1-layer lr=5e-4 (down from 1e-3) - Smith 2017 flat-minima on 1-layer baseline", "config": {"seq_len": 10, "lr": 0.0005, "batch_size": 16, "epochs": 100, "weight_decay": 0.0007, "patience": 15, "warmup_epochs": 0, "head_dropout": 0.1, "huber_delta": 1.0, "grad_clip": 1.0, "seed": 0, "hidden_size": null, "num_layers": 1, "max_depth": null, "gbm_lr": null, "n_estimators": null}, "composite": -0.5911, "test_pos_folds": 3, "val_pos_folds": 3, "val_loss": -2.8664012502055947, "elapsed_sec": 48.2, "timestamp": "2026-04-27T23:23:45", "sharpe": -0.1911, "val_sharpe": -0.0082, "ic": 0.0058, "hit": 43.85, "psr": 0.3257, "equity": 608.2, "return_pct": -39.18, "bh_sharpe": 0.6042, "bh_return_pct": 103.49, "excess_sharpe": -0.7953, "B_sharpe": 1.1407, "B_excess_sharpe": -0.5601, "B_return_pct": 1251.1, "D_sharpe": -0.1911, "D_excess_sharpe": -0.7953, "D_return_pct": -39.18, "precision": 0.5478, "recall": 0.1066, "f1": 0.1784, "f2": 0.127, "mcc": -0.0176, "accuracy": 0.4383, "val_precision": 0.6087, "val_recall": 0.1702, "val_f1": 0.266, "val_f2": 0.1989, "val_mcc": 0.0465, "val_accuracy": 0.4789, "per_window": [{"fold": "fold_1", "regime": "GFC peak crash (Lehman + Mar-2009 bottom)", "n": 115, "A_sharpe": 0.6281, "A_sortino": 0.6048, "A_excess_sharpe": 1.0722, "A_return_pct": 8.88, "A_hit_rate": 50.43, "A_n": 115, "A_bh_sharpe": -0.4441, "A_bh_return_pct": -14.4, "A_psr": 0.6619, "A_ic": 0.016, "A_precision": 0.4516, "A_recall": 0.2593, "A_f1": 0.3294, "A_f2": 0.2834, "A_accuracy": 0.5043, "A_mcc": -0.0219, "A_tp": 14, "A_fp": 17, "A_tn": 44, "A_fn": 40, "B_sharpe": 0.5517, "B_sortino": 0.5271, "B_excess_sharpe": 0.8495, "B_return_pct": 3.84, "B_hit_rate": 54.39, "B_n": 115, "B_bh_sharpe": -0.2978, "B_bh_return_pct": -27.23, "B_psr": 0.6443, "B_ic": 0.1213, "B_precision": 0.5522, "B_recall": 0.6271, "B_f1": 0.5873, "B_f2": 0.6106, "B_accuracy": 0.5478, "B_mcc": 0.0926, "B_tp": 37, "B_fp": 30, "B_tn": 26, "B_fn": 22, "D_sharpe": 0.6281, "D_sortino": 0.6048, "D_excess_sharpe": 1.0722, "D_return_pct": 8.88, "D_hit_rate": 50.43, "D_n": 115, "D_bh_sharpe": -0.4441, "D_bh_return_pct": -14.4, "D_psr": 0.6619, "D_ic": 0.016, "D_precision": 0.4516, "D_recall": 0.2593, "D_f1": 0.3294, "D_f2": 0.2834, "D_accuracy": 0.5043, "D_mcc": -0.0219, "D_tp": 14, "D_fp": 17, "D_tn": 44, "D_fn": 40, "sharpe": 0.6281, "sortino": 0.6048, "return_pct": 8.88, "equity": 1088.8, "max_dd": 0.0, "win_rate": 50.43, "profit_factor": 0.0, "ic": 0.016, "hit": 50.43, "psr": 0.6619, "bh_sharpe": -0.4441, "bh_return_pct": -14.4, "excess_sharpe": 1.0722, "precision": 0.4516, "recall": 0.2593, "f1": 0.3294, "f2": 0.2834, "mcc": -0.0219, "accuracy": 0.5043, "tp": 14, "fp": 17, "tn": 44, "fn": 40}, {"fold": "fold_2", "regime": "2011 US-downgrade + EU debt", "n": 136, "A_sharpe": 0.0083, "A_sortino": 0.0092, "A_excess_sharpe": -1.7245, "A_return_pct": -1.05, "A_hit_rate": 45.19, "A_n": 136, "A_bh_sharpe": 1.7327, "A_bh_return_pct": 19.75, "A_psr": 0.5024, "A_ic": 0.1692, "A_precision": 0.5769, "A_recall": 0.1923, "A_f1": 0.2885, "A_f2": 0.2219, "A_accuracy": 0.4559, "A_mcc": 0.0033, "A_tp": 15, "A_fp": 11, "A_tn": 47, "A_fn": 63, "B_sharpe": 4.4858, "B_sortino": 4.1762, "B_excess_sharpe": 0.4199, "B_return_pct": 172.9, "B_hit_rate": 69.12, "B_n": 136, "B_bh_sharpe": 4.0659, "B_bh_return_pct": 148.68, "B_psr": 0.9993, "B_ic": 0.1918, "B_precision": 0.7547, "B_recall": 0.8333, "B_f1": 0.7921, "B_f2": 0.8163, "B_accuracy": 0.6912, "B_mcc": 0.2015, "B_tp": 80, "B_fp": 26, "B_tn": 14, "B_fn": 16, "D_sharpe": 0.0083, "D_sortino": 0.0092, "D_excess_sharpe": -1.7245, "D_return_pct": -1.05, "D_hit_rate": 45.19, "D_n": 136, "D_bh_sharpe": 1.7327, "D_bh_return_pct": 19.75, "D_psr": 0.5024, "D_ic": 0.1692, "D_precision": 0.5769, "D_recall": 0.1923, "D_f1": 0.2885, "D_f2": 0.2219, "D_accuracy": 0.4559, "D_mcc": 0.0033, "D_tp": 15, "D_fp": 11, "D_tn": 47, "D_fn": 63, "sharpe": 0.0083, "sortino": 0.0092, "return_pct": -1.05, "equity": 989.5, "max_dd": 0.0, "win_rate": 45.19, "profit_factor": 0.0, "ic": 0.1692, "hit": 45.19, "psr": 0.5024, "bh_sharpe": 1.7327, "bh_return_pct": 19.75, "excess_sharpe": -1.7245, "precision": 0.5769, "recall": 0.1923, "f1": 0.2885, "f2": 0.2219, "mcc": 0.0033, "accuracy": 0.4559, "tp": 15, "fp": 11, "tn": 47, "fn": 63}, {"fold": "fold_3", "regime": "Taper tantrum and 2014 H1", "n": 178, "A_sharpe": -1.3706, "A_sortino": -1.4873, "A_excess_sharpe": -2.7152, "A_return_pct": -12.3, "A_hit_rate": 42.37, "A_n": 178, "A_bh_sharpe": 1.3445, "A_bh_return_pct": 12.41, "A_psr": 0.1327, "A_ic": -0.0143, "A_precision": 0.5, "A_recall": 0.068, "A_f1": 0.1197, "A_f2": 0.0822, "A_accuracy": 0.4213, "A_mcc": -0.0465, "A_tp": 7, "A_fp": 7, "A_tn": 68, "A_fn": 96, "B_sharpe": 3.9928, "B_sortino": 3.9836, "B_excess_sharpe": 0.9445, "B_return_pct": 102.92, "B_hit_rate": 63.48, "B_n": 178, "B_bh_sharpe": 3.0483, "B_bh_return_pct": 71.83, "B_psr": 0.9994, "B_ic": 0.194, "B_precision": 0.6467, "B_recall": 0.8899, "B_f1": 0.749, "B_f2": 0.8276, "B_accuracy": 0.6348, "B_mcc": 0.163, "B_tp": 97, "B_fp": 53, "B_tn": 16, "B_fn": 12, "D_sharpe": -1.3706, "D_sortino": -1.4873, "D_excess_sharpe": -2.7152, "D_return_pct": -12.3, "D_hit_rate": 42.37, "D_n": 178, "D_bh_sharpe": 1.3445, "D_bh_return_pct": 12.41, "D_psr": 0.1327, "D_ic": -0.0143, "D_precision": 0.5, "D_recall": 0.068, "D_f1": 0.1197, "D_f2": 0.0822, "D_accuracy": 0.4213, "D_mcc": -0.0465, "D_tp": 7, "D_fp": 7, "D_tn": 68, "D_fn": 96, "sharpe": -1.3706, "sortino": -1.4873, "return_pct": -12.3, "equity": 877.0, "max_dd": 0.0, "win_rate": 42.37, "profit_factor": 0.0, "ic": -0.0143, "hit": 42.37, "psr": 0.1327, "bh_sharpe": 1.3445, "bh_return_pct": 12.41, "excess_sharpe": -2.7152, "precision": 0.5, "recall": 0.068, "f1": 0.1197, "f2": 0.0822, "mcc": -0.0465, "accuracy": 0.4213, "tp": 7, "fp": 7, "tn": 68, "fn": 96}, {"fold": "fold_4", "regime": "China devaluation and oil crash", "n": 157, "A_sharpe": -0.5996, "A_sortino": -0.6061, "A_excess_sharpe": -0.6094, "A_return_pct": -8.08, "A_hit_rate": 46.15, "A_n": 157, "A_bh_sharpe": 0.0098, "A_bh_return_pct": -1.05, "A_psr": 0.3188, "A_ic": 0.005, "A_precision": 0.3, "A_recall": 0.037, "A_f1": 0.0659, "A_f2": 0.0449, "A_accuracy": 0.4586, "A_mcc": -0.1127, "A_tp": 3, "A_fp": 7, "A_tn": 69, "A_fn": 78, "B_sharpe": 2.3698, "B_sortino": 2.3984, "B_excess_sharpe": 2.3539, "B_return_pct": 78.93, "B_hit_rate": 57.32, "B_n": 157, "B_bh_sharpe": 0.0159, "B_bh_return_pct": -5.48, "B_psr": 0.9675, "B_ic": 0.1883, "B_precision": 0.5703, "B_recall": 0.8588, "B_f1": 0.6854, "B_f2": 0.7799, "B_accuracy": 0.5732, "B_mcc": 0.1219, "B_tp": 73, "B_fp": 55, "B_tn": 17, "B_fn": 12, "D_sharpe": -0.5996, "D_sortino": -0.6061, "D_excess_sharpe": -0.6094, "D_return_pct": -8.08, "D_hit_rate": 46.15, "D_n": 157, "D_bh_sharpe": 0.0098, "D_bh_return_pct": -1.05, "D_psr": 0.3188, "D_ic": 0.005, "D_precision": 0.3, "D_recall": 0.037, "D_f1": 0.0659, "D_f2": 0.0449, "D_accuracy": 0.4586, "D_mcc": -0.1127, "D_tp": 3, "D_fp": 7, "D_tn": 69, "D_fn": 78, "sharpe": -0.5996, "sortino": -0.6061, "return_pct": -8.08, "equity": 919.2, "max_dd": 0.0, "win_rate": 46.15, "profit_factor": 0.0, "ic": 0.005, "hit": 46.15, "psr": 0.3188, "bh_sharpe": 0.0098, "bh_return_pct": -1.05, "excess_sharpe": -0.6094, "precision": 0.3, "recall": 0.037, "f1": 0.0659, "f2": 0.0449, "mcc": -0.1127, "accuracy": 0.4586, "tp": 3, "fp": 7, "tn": 69, "fn": 78}, {"fold": "fold_5", "regime": "2018 Vol-mageddon + Q4 sell-off", "n": 177, "A_sharpe": 1.0021, "A_sortino": 1.1758, "A_excess_sharpe": 0.6923, "A_return_pct": 15.39, "A_hit_rate": 44.63, "A_n": 177, "A_bh_sharpe": 0.3098, "A_bh_return_pct": 3.19, "A_psr": 0.7996, "A_ic": 0.1066, "A_precision": 0.6923, "A_recall": 0.0874, "A_f1": 0.1552, "A_f2": 0.1059, "A_accuracy": 0.4463, "A_mcc": 0.063, "A_tp": 9, "A_fp": 4, "A_tn": 70, "A_fn": 94, "B_sharpe": 0.6603, "B_sortino": 0.6253, "B_excess_sharpe": -0.2314, "B_return_pct": 14.93, "B_hit_rate": 55.68, "B_n": 177, "B_bh_sharpe": 0.8917, "B_bh_return_pct": 23.8, "B_psr": 0.7089, "B_ic": 0.0014, "B_precision": 0.6154, "B_recall": 0.7339, "B_f1": 0.6695, "B_f2": 0.7067, "B_accuracy": 0.5537, "B_mcc": -0.0015, "B_tp": 80, "B_fp": 50, "B_tn": 18, "B_fn": 29, "D_sharpe": 1.0021, "D_sortino": 1.1758, "D_excess_sharpe": 0.6923, "D_return_pct": 15.39, "D_hit_rate": 44.63, "D_n": 177, "D_bh_sharpe": 0.3098, "D_bh_return_pct": 3.19, "D_psr": 0.7996, "D_ic": 0.1066, "D_precision": 0.6923, "D_recall": 0.0874, "D_f1": 0.1552, "D_f2": 0.1059, "D_accuracy": 0.4463, "D_mcc": 0.063, "D_tp": 9, "D_fp": 4, "D_tn": 70, "D_fn": 94, "sharpe": 1.0021, "sortino": 1.1758, "return_pct": 15.39, "equity": 1153.8999999999999, "max_dd": 0.0, "win_rate": 44.63, "profit_factor": 0.0, "ic": 0.1066, "hit": 44.63, "psr": 0.7996, "bh_sharpe": 0.3098, "bh_return_pct": 3.19, "excess_sharpe": 0.6923, "precision": 0.6923, "recall": 0.0874, "f1": 0.1552, "f2": 0.1059, "mcc": 0.063, "accuracy": 0.4463, "tp": 9, "fp": 4, "tn": 70, "fn": 94}, {"fold": "fold_6", "regime": "COVID crash and V-recovery", "n": 222, "A_sharpe": -0.5215, "A_sortino": -0.6012, "A_excess_sharpe": -1.4103, "A_return_pct": -21.08, "A_hit_rate": 39.19, "A_n": 222, "A_bh_sharpe": 0.8888, "A_bh_return_pct": 26.13, "A_psr": 0.3145, "A_ic": -0.096, "A_precision": 0.56, "A_recall": 0.1014, "A_f1": 0.1718, "A_f2": 0.1213, "A_accuracy": 0.3919, "A_mcc": -0.0453, "A_tp": 14, "A_fp": 11, "A_tn": 73, "A_fn": 124, "B_sharpe": -0.2056, "B_sortino": -0.227, "B_excess_sharpe": -2.594, "B_return_pct": -28.76, "B_hit_rate": 45.7, "B_n": 222, "B_bh_sharpe": 2.3884, "B_bh_return_pct": 243.18, "B_psr": 0.4239, "B_ic": -0.0484, "B_precision": 0.6545, "B_recall": 0.2628, "B_f1": 0.375, "B_f2": 0.2985, "B_accuracy": 0.4595, "B_mcc": 0.0442, "B_tp": 36, "B_fp": 19, "B_tn": 66, "B_fn": 101, "D_sharpe": -0.5215, "D_sortino": -0.6012, "D_excess_sharpe": -1.4103, "D_return_pct": -21.08, "D_hit_rate": 39.19, "D_n": 222, "D_bh_sharpe": 0.8888, "D_bh_return_pct": 26.13, "D_psr": 0.3145, "D_ic": -0.096, "D_precision": 0.56, "D_recall": 0.1014, "D_f1": 0.1718, "D_f2": 0.1213, "D_accuracy": 0.3919, "D_mcc": -0.0453, "D_tp": 14, "D_fp": 11, "D_tn": 73, "D_fn": 124, "sharpe": -0.5215, "sortino": -0.6012, "return_pct": -21.08, "equity": 789.2, "max_dd": 0.0, "win_rate": 39.19, "profit_factor": 0.0, "ic": -0.096, "hit": 39.19, "psr": 0.3145, "bh_sharpe": 0.8888, "bh_return_pct": 26.13, "excess_sharpe": -1.4103, "precision": 0.56, "recall": 0.1014, "f1": 0.1718, "f2": 0.1213, "mcc": -0.0453, "accuracy": 0.3919, "tp": 14, "fp": 11, "tn": 73, "fn": 124}, {"fold": "fold_7", "regime": "Inflation bear, AI rally and 2025", "n": 425, "A_sharpe": -0.6076, "A_sortino": -0.6195, "A_excess_sharpe": -1.5791, "A_return_pct": -23.11, "A_hit_rate": 43.53, "A_n": 425, "A_bh_sharpe": 0.9715, "A_bh_return_pct": 37.12, "A_psr": 0.2113, "A_ic": 0.0274, "A_precision": 0.6316, "A_recall": 0.096, "A_f1": 0.1667, "A_f2": 0.1156, "A_accuracy": 0.4353, "A_mcc": 0.0276, "A_tp": 24, "A_fp": 14, "A_tn": 161, "A_fn": 226, "B_sharpe": 0.8433, "B_sortino": 0.8998, "B_excess_sharpe": -1.6593, "B_return_pct": 60.39, "B_hit_rate": 50.71, "B_n": 425, "B_bh_sharpe": 2.5027, "B_bh_return_pct": 458.83, "B_psr": 0.8645, "B_ic": 0.037, "B_precision": 0.6216, "B_recall": 0.5247, "B_f1": 0.5691, "B_f2": 0.5416, "B_accuracy": 0.5082, "B_mcc": 0.006, "B_tp": 138, "B_fp": 84, "B_tn": 78, "B_fn": 125, "D_sharpe": -0.6076, "D_sortino": -0.6195, "D_excess_sharpe": -1.5791, "D_return_pct": -23.11, "D_hit_rate": 43.53, "D_n": 425, "D_bh_sharpe": 0.9715, "D_bh_return_pct": 37.12, "D_psr": 0.2113, "D_ic": 0.0274, "D_precision": 0.6316, "D_recall": 0.096, "D_f1": 0.1667, "D_f2": 0.1156, "D_accuracy": 0.4353, "D_mcc": 0.0276, "D_tp": 24, "D_fp": 14, "D_tn": 161, "D_fn": 226, "sharpe": -0.6076, "sortino": -0.6195, "return_pct": -23.11, "equity": 768.9, "max_dd": 0.0, "win_rate": 43.53, "profit_factor": 0.0, "ic": 0.0274, "hit": 43.53, "psr": 0.2113, "bh_sharpe": 0.9715, "bh_return_pct": 37.12, "excess_sharpe": -1.5791, "precision": 0.6316, "recall": 0.096, "f1": 0.1667, "f2": 0.1156, "mcc": 0.0276, "accuracy": 0.4353, "tp": 24, "fp": 14, "tn": 161, "fn": 226}], "per_window_val": [{"fold": "fold_1", "regime": "GFC peak crash (Lehman + Mar-2009 bottom)", "n": 104, "A_sharpe": 0.5376, "A_sortino": 0.6417, "A_excess_sharpe": 0.7049, "A_return_pct": 4.9, "A_hit_rate": 47.06, "A_n": 104, "A_bh_sharpe": -0.1672, "A_bh_return_pct": -3.81, "A_psr": 0.6368, "A_ic": 0.0373, "A_precision": 0.5, "A_recall": 0.2778, "A_f1": 0.3571, "A_f2": 0.3049, "A_accuracy": 0.4808, "A_mcc": -0.0245, "A_tp": 15, "A_fp": 15, "A_tn": 35, "A_fn": 39, "B_sharpe": -3.6354, "B_sortino": -3.077, "B_excess_sharpe": -1.3613, "B_return_pct": -58.45, "B_hit_rate": 43.69, "B_n": 104, "B_bh_sharpe": -2.2741, "B_bh_return_pct": -44.12, "B_psr": 0.0064, "B_ic": -0.1433, "B_precision": 0.4507, "B_recall": 0.6154, "B_f1": 0.5203, "B_f2": 0.5735, "B_accuracy": 0.4327, "B_mcc": -0.1446, "B_tp": 32, "B_fp": 39, "B_tn": 13, "B_fn": 20, "D_sharpe": 0.5376, "D_sortino": 0.6417, "D_excess_sharpe": 0.7049, "D_return_pct": 4.9, "D_hit_rate": 47.06, "D_n": 104, "D_bh_sharpe": -0.1672, "D_bh_return_pct": -3.81, "D_psr": 0.6368, "D_ic": 0.0373, "D_precision": 0.5, "D_recall": 0.2778, "D_f1": 0.3571, "D_f2": 0.3049, "D_accuracy": 0.4808, "D_mcc": -0.0245, "D_tp": 15, "D_fp": 15, "D_tn": 35, "D_fn": 39, "sharpe": 0.5376, "sortino": 0.6417, "return_pct": 4.9, "equity": 1049.0, "max_dd": 0.0, "win_rate": 47.06, "profit_factor": 0.0, "ic": 0.0373, "hit": 47.06, "psr": 0.6368, "bh_sharpe": -0.1672, "bh_return_pct": -3.81, "excess_sharpe": 0.7049, "precision": 0.5, "recall": 0.2778, "f1": 0.3571, "f2": 0.3049, "mcc": -0.0245, "accuracy": 0.4808, "tp": 15, "fp": 15, "tn": 35, "fn": 39}, {"fold": "fold_2", "regime": "2011 US-downgrade + EU debt", "n": 96, "A_sharpe": 0.8753, "A_sortino": 0.9275, "A_excess_sharpe": 1.1494, "A_return_pct": 7.86, "A_hit_rate": 52.63, "A_n": 96, "A_bh_sharpe": -0.2741, "A_bh_return_pct": -4.09, "A_psr": 0.7067, "A_ic": -0.0281, "A_precision": 0.6087, "A_recall": 0.28, "A_f1": 0.3836, "A_f2": 0.3139, "A_accuracy": 0.5312, "A_mcc": 0.0987, "A_tp": 14, "A_fp": 9, "A_tn": 37, "A_fn": 36, "B_sharpe": 1.2478, "B_sortino": 1.5534, "B_excess_sharpe": 2.2753, "B_return_pct": 23.76, "B_hit_rate": 44.79, "B_n": 96, "B_bh_sharpe": -1.0274, "B_bh_return_pct": -25.58, "B_psr": 0.7826, "B_ic": -0.0311, "B_precision": 0.4375, "B_recall": 0.814, "B_f1": 0.5691, "B_f2": 0.6944, "B_accuracy": 0.4479, "B_mcc": -0.0468, "B_tp": 35, "B_fp": 45, "B_tn": 8, "B_fn": 8, "D_sharpe": 0.8753, "D_sortino": 0.9275, "D_excess_sharpe": 1.1494, "D_return_pct": 7.86, "D_hit_rate": 52.63, "D_n": 96, "D_bh_sharpe": -0.2741, "D_bh_return_pct": -4.09, "D_psr": 0.7067, "D_ic": -0.0281, "D_precision": 0.6087, "D_recall": 0.28, "D_f1": 0.3836, "D_f2": 0.3139, "D_accuracy": 0.5312, "D_mcc": 0.0987, "D_tp": 14, "D_fp": 9, "D_tn": 37, "D_fn": 36, "sharpe": 0.8753, "sortino": 0.9275, "return_pct": 7.86, "equity": 1078.6, "max_dd": 0.0, "win_rate": 52.63, "profit_factor": 0.0, "ic": -0.0281, "hit": 52.63, "psr": 0.7067, "bh_sharpe": -0.2741, "bh_return_pct": -4.09, "excess_sharpe": 1.1494, "precision": 0.6087, "recall": 0.28, "f1": 0.3836, "f2": 0.3139, "mcc": 0.0987, "accuracy": 0.5312, "tp": 14, "fp": 9, "tn": 37, "fn": 36}, {"fold": "fold_3", "regime": "Taper tantrum and 2014 H1", "n": 54, "A_sharpe": -0.3159, "A_sortino": -0.3536, "A_excess_sharpe": -5.0157, "A_return_pct": -0.82, "A_hit_rate": 46.3, "A_n": 54, "A_bh_sharpe": 4.6998, "A_bh_return_pct": 10.46, "A_psr": 0.4428, "A_ic": 0.3479, "A_precision": 0.7, "A_recall": 0.2121, "A_f1": 0.3256, "A_f2": 0.2465, "A_accuracy": 0.463, "A_mcc": 0.0869, "A_tp": 7, "A_fp": 3, "A_tn": 18, "A_fn": 26, "B_sharpe": 9.1564, "B_sortino": 13.6935, "B_excess_sharpe": 0.1238, "B_return_pct": 49.81, "B_hit_rate": 68.52, "B_n": 54, "B_bh_sharpe": 9.0326, "B_bh_return_pct": 49.18, "B_psr": 1.0, "B_ic": -0.148, "B_precision": 0.6923, "B_recall": 0.973, "B_f1": 0.809, "B_f2": 0.9, "B_accuracy": 0.6852, "B_mcc": 0.0782, "B_tp": 36, "B_fp": 16, "B_tn": 1, "B_fn": 1, "D_sharpe": -0.3159, "D_sortino": -0.3536, "D_excess_sharpe": -5.0157, "D_return_pct": -0.82, "D_hit_rate": 46.3, "D_n": 54, "D_bh_sharpe": 4.6998, "D_bh_return_pct": 10.46, "D_psr": 0.4428, "D_ic": 0.3479, "D_precision": 0.7, "D_recall": 0.2121, "D_f1": 0.3256, "D_f2": 0.2465, "D_accuracy": 0.463, "D_mcc": 0.0869, "D_tp": 7, "D_fp": 3, "D_tn": 18, "D_fn": 26, "sharpe": -0.3159, "sortino": -0.3536, "return_pct": -0.82, "equity": 991.8000000000001, "max_dd": 0.0, "win_rate": 46.3, "profit_factor": 0.0, "ic": 0.3479, "hit": 46.3, "psr": 0.4428, "bh_sharpe": 4.6998, "bh_return_pct": 10.46, "excess_sharpe": -5.0157, "precision": 0.7, "recall": 0.2121, "f1": 0.3256, "f2": 0.2465, "mcc": 0.0869, "accuracy": 0.463, "tp": 7, "fp": 3, "tn": 18, "fn": 26}, {"fold": "fold_4", "regime": "China devaluation and oil crash", "n": 96, "A_sharpe": 2.0735, "A_sortino": 1.9957, "A_excess_sharpe": 2.4977, "A_return_pct": 15.4, "A_hit_rate": 60.0, "A_n": 96, "A_bh_sharpe": -0.4241, "A_bh_return_pct": -3.73, "A_psr": 0.8941, "A_ic": 0.0856, "A_precision": 0.6842, "A_recall": 0.2889, "A_f1": 0.4062, "A_f2": 0.3266, "A_accuracy": 0.6042, "A_mcc": 0.2145, "A_tp": 13, "A_fp": 6, "A_tn": 45, "A_fn": 32, "B_sharpe": -2.6882, "B_sortino": -2.2692, "B_excess_sharpe": -1.504, "B_return_pct": -38.88, "B_hit_rate": 44.79, "B_n": 96, "B_bh_sharpe": -1.1843, "B_bh_return_pct": -21.44, "B_psr": 0.0308, "B_ic": -0.0863, "B_precision": 0.4533, "B_recall": 0.7391, "B_f1": 0.562, "B_f2": 0.6564, "B_accuracy": 0.4479, "B_mcc": -0.0977, "B_tp": 34, "B_fp": 41, "B_tn": 9, "B_fn": 12, "D_sharpe": 2.0735, "D_sortino": 1.9957, "D_excess_sharpe": 2.4977, "D_return_pct": 15.4, "D_hit_rate": 60.0, "D_n": 96, "D_bh_sharpe": -0.4241, "D_bh_return_pct": -3.73, "D_psr": 0.8941, "D_ic": 0.0856, "D_precision": 0.6842, "D_recall": 0.2889, "D_f1": 0.4062, "D_f2": 0.3266, "D_accuracy": 0.6042, "D_mcc": 0.2145, "D_tp": 13, "D_fp": 6, "D_tn": 45, "D_fn": 32, "sharpe": 2.0735, "sortino": 1.9957, "return_pct": 15.4, "equity": 1154.0, "max_dd": 0.0, "win_rate": 60.0, "profit_factor": 0.0, "ic": 0.0856, "hit": 60.0, "psr": 0.8941, "bh_sharpe": -0.4241, "bh_return_pct": -3.73, "excess_sharpe": 2.4977, "precision": 0.6842, "recall": 0.2889, "f1": 0.4062, "f2": 0.3266, "mcc": 0.2145, "accuracy": 0.6042, "tp": 13, "fp": 6, "tn": 45, "fn": 32}, {"fold": "fold_5", "regime": "2018 Vol-mageddon + Q4 sell-off", "n": 54, "A_sharpe": -1.5848, "A_sortino": -1.6407, "A_excess_sharpe": -3.0128, "A_return_pct": -4.61, "A_hit_rate": 44.44, "A_n": 54, "A_bh_sharpe": 1.428, "A_bh_return_pct": 3.97, "A_psr": 0.2384, "A_ic": -0.0046, "A_precision": 0.0, "A_recall": 0.0, "A_f1": 0.0, "A_f2": 0.0, "A_accuracy": 0.4444, "A_mcc": -0.1479, "A_tp": 0, "A_fp": 1, "A_tn": 24, "A_fn": 29, "B_sharpe": -1.6305, "B_sortino": -1.3835, "B_excess_sharpe": -6.5627, "B_return_pct": -11.02, "B_hit_rate": 53.7, "B_n": 54, "B_bh_sharpe": 4.9322, "B_bh_return_pct": 34.93, "B_psr": 0.2242, "B_ic": -0.1151, "B_precision": 0.6667, "B_recall": 0.6486, "B_f1": 0.6575, "B_f2": 0.6522, "B_accuracy": 0.537, "B_mcc": -0.0564, "B_tp": 24, "B_fp": 12, "B_tn": 5, "B_fn": 13, "D_sharpe": -1.5848, "D_sortino": -1.6407, "D_excess_sharpe": -3.0128, "D_return_pct": -4.61, "D_hit_rate": 44.44, "D_n": 54, "D_bh_sharpe": 1.428, "D_bh_return_pct": 3.97, "D_psr": 0.2384, "D_ic": -0.0046, "D_precision": 0.0, "D_recall": 0.0, "D_f1": 0.0, "D_f2": 0.0, "D_accuracy": 0.4444, "D_mcc": -0.1479, "D_tp": 0, "D_fp": 1, "D_tn": 24, "D_fn": 29, "sharpe": -1.5848, "sortino": -1.6407, "return_pct": -4.61, "equity": 953.9, "max_dd": 0.0, "win_rate": 44.44, "profit_factor": 0.0, "ic": -0.0046, "hit": 44.44, "psr": 0.2384, "bh_sharpe": 1.428, "bh_return_pct": 3.97, "excess_sharpe": -3.0128, "precision": 0.0, "recall": 0.0, "f1": 0.0, "f2": 0.0, "mcc": -0.1479, "accuracy": 0.4444, "tp": 0, "fp": 1, "tn": 24, "fn": 29}, {"fold": "fold_6", "regime": "COVID crash and V-recovery", "n": 75, "A_sharpe": -3.5956, "A_sortino": -3.6383, "A_excess_sharpe": -7.895, "A_return_pct": -11.24, "A_hit_rate": 34.67, "A_n": 75, "A_bh_sharpe": 4.2994, "A_bh_return_pct": 14.68, "A_psr": 0.0329, "A_ic": -0.0815, "A_precision": 1.0, "A_recall": 0.0392, "A_f1": 0.0755, "A_f2": 0.0485, "A_accuracy": 0.3467, "A_mcc": 0.1135, "A_tp": 2, "A_fp": 0, "A_tn": 24, "A_fn": 49, "B_sharpe": -7.8089, "B_sortino": -6.9479, "B_excess_sharpe": -22.1429, "B_return_pct": -41.46, "B_hit_rate": 25.33, "B_n": 75, "B_bh_sharpe": 14.3339, "B_bh_return_pct": 120.13, "B_psr": 0.0001, "B_ic": 0.0809, "B_precision": 0.8182, "B_recall": 0.1429, "B_f1": 0.2432, "B_f2": 0.1711, "B_accuracy": 0.2533, "B_mcc": -0.0247, "B_tp": 9, "B_fp": 2, "B_tn": 10, "B_fn": 54, "D_sharpe": -3.5956, "D_sortino": -3.6383, "D_excess_sharpe": -7.895, "D_return_pct": -11.24, "D_hit_rate": 34.67, "D_n": 75, "D_bh_sharpe": 4.2994, "D_bh_return_pct": 14.68, "D_psr": 0.0329, "D_ic": -0.0815, "D_precision": 1.0, "D_recall": 0.0392, "D_f1": 0.0755, "D_f2": 0.0485, "D_accuracy": 0.3467, "D_mcc": 0.1135, "D_tp": 2, "D_fp": 0, "D_tn": 24, "D_fn": 49, "sharpe": -3.5956, "sortino": -3.6383, "return_pct": -11.24, "equity": 887.5999999999999, "max_dd": 0.0, "win_rate": 34.67, "profit_factor": 0.0, "ic": -0.0815, "hit": 34.67, "psr": 0.0329, "bh_sharpe": 4.2994, "bh_return_pct": 14.68, "excess_sharpe": -7.895, "precision": 1.0, "recall": 0.0392, "f1": 0.0755, "f2": 0.0485, "mcc": 0.1135, "accuracy": 0.3467, "tp": 2, "fp": 0, "tn": 24, "fn": 49}, {"fold": "fold_7", "regime": "Inflation bear, AI rally and 2025", "n": 114, "A_sharpe": -1.9793, "A_sortino": -1.8946, "A_excess_sharpe": -4.8243, "A_return_pct": -13.51, "A_hit_rate": 43.86, "A_n": 114, "A_bh_sharpe": 2.845, "A_bh_return_pct": 21.34, "A_psr": 0.0917, "A_ic": 0.0799, "A_precision": 0.7143, "A_recall": 0.0746, "A_f1": 0.1351, "A_f2": 0.0909, "A_accuracy": 0.4386, "A_mcc": 0.0658, "A_tp": 5, "A_fp": 2, "A_tn": 45, "A_fn": 62, "B_sharpe": 3.3966, "B_sortino": 3.