{"experiment_num": 2, "backbone": "xgboost", "description": "xgboost SOTA-lite n_est=300 (Chen-Guestrin 2016 KDD); regime-aware folds + extended features; QQQ baseline", "config": {"seq_len": 60, "lr": 0.0003, "batch_size": 32, "epochs": 50, "weight_decay": 1e-05, "patience": 10, "warmup_epochs": 0, "head_dropout": 0.1, "huber_delta": 1.0, "grad_clip": 1.0, "seed": 42, "hidden_size": null, "num_layers": null, "max_depth": 4, "gbm_lr": 0.05, "n_estimators": 300}, "composite": -2.3923, "test_pos_folds": 5, "val_pos_folds": 1, "val_loss": null, "elapsed_sec": 335.3, "timestamp": "2026-04-26T12:03:40", "sharpe": -0.0045, "val_sharpe": -2.1923, "ic": -0.0018, "hit": 47.65, "psr": 0.4963, "equity": 894.4, "return_pct": -10.56, "bh_sharpe": 1.2194, "bh_return_pct": 187.05, "excess_sharpe": -1.2239, "B_sharpe": -0.3909, "B_excess_sharpe": -3.219, "B_return_pct": -70.66, "D_sharpe": 0.0605, "D_excess_sharpe": -1.1588, "D_return_pct": -4.8, "per_window": [{"fold": "fold_1", "regime": "GFC peak crash (Lehman + Mar-2009 bottom)", "n": 66, "A_sharpe": 0.0019, "A_sortino": 0.0021, "A_excess_sharpe": -0.5702, "A_return_pct": -1.79, "A_hit_rate": 46.97, "A_n": 66, "A_bh_sharpe": 0.5721, "A_bh_return_pct": 3.85, "A_psr": 0.5004, "A_ic": -0.0122, "B_sharpe": 1.421, "B_sortino": 1.4375, "B_excess_sharpe": -0.6259, "B_return_pct": 23.07, "B_hit_rate": 55.38, "B_n": 66, "B_bh_sharpe": 2.0469, "B_bh_return_pct": 39.28, "B_psr": 0.7648, "B_ic": 0.1781, "D_sharpe": 1.0105, "D_sortino": 1.0217, "D_excess_sharpe": 0.4384, "D_return_pct": 8.39, "D_hit_rate": 53.03, "D_n": 66, "D_bh_sharpe": 0.5721, "D_bh_return_pct": 3.85, "D_psr": 0.6958, "D_ic": 0.1603, "sharpe": 0.0019, "sortino": 0.0021, "return_pct": -1.79, "equity": 982.1, "max_dd": 0.0, "win_rate": 46.97, "profit_factor": 0.0, "ic": -0.0122, "hit": 46.97, "psr": 0.5004, "bh_sharpe": 0.5721, "bh_return_pct": 3.85, "excess_sharpe": -0.5702, "precision": 0.5, "recall": 0.4571, "f1": 0.4776, "f2": 0.4651, "accuracy": 0.4697, "mcc": -0.0589, "tp": 16, "fp": 16, "tn": 15, "fn": 19, "A_precision": 0.5, "A_recall": 0.4571, "A_f1": 0.4776, "A_f2": 0.4651, "A_accuracy": 0.4697, "A_mcc": -0.0589, "A_tp": 16, "A_fp": 16, "A_tn": 15, "A_fn": 19}, {"fold": "fold_2", "regime": "2011 US-downgrade + EU debt", "n": 87, "A_sharpe": 2.2166, "A_sortino": 2.8001, "A_excess_sharpe": -2.8054, "A_return_pct": 12.22, "A_hit_rate": 51.16, "A_n": 87, "A_bh_sharpe": 5.022, "A_bh_return_pct": 29.23, "A_psr": 0.9159, "A_ic": 0.0267, "B_sharpe": 5.5624, "B_sortino": 6.4892, "B_excess_sharpe": -5.5745, "B_return_pct": 81.39, "B_hit_rate": 63.22, "B_n": 87, "B_bh_sharpe": 11.1369, "B_bh_return_pct": 185.4, "B_psr": 0.9995, "B_ic": 0.2497, "D_sharpe": 3.5136, "D_sortino": 4.2507, "D_excess_sharpe": -1.5084, "D_return_pct": 20.02, "D_hit_rate": 59.3, "D_n": 87, "D_bh_sharpe": 5.022, "D_bh_return_pct": 29.23, "D_psr": 0.9874, "D_ic": 0.1373, "sharpe": 2.2166, "sortino": 2.8001, "return_pct": 12.22, "equity": 1122.2, "max_dd": 0.0, "win_rate": 51.16, "profit_factor": 0.0, "ic": 0.0267, "hit": 51.16, "psr": 0.9159, "bh_sharpe": 5.022, "bh_return_pct": 29.23, "excess_sharpe": -2.8054, "precision": 0.6154, "recall": 0.5926, "f1": 0.6038, "f2": 0.597, "accuracy": 0.5172, "mcc": -0.0133, "tp": 32, "fp": 20, "tn": 13, "fn": 22, "A_precision": 0.6154, "A_recall": 0.5926, "A_f1": 0.6038, "A_f2": 0.597, "A_accuracy": 0.5172, "A_mcc": -0.0133, "A_tp": 32, "A_fp": 20, "A_tn": 13, "A_fn": 22}, {"fold": "fold_3", "regime": "Taper tantrum and 2014 H1", "n": 129, "A_sharpe": 1.5566, "A_sortino": 1.3831, "A_excess_sharpe": -0.2112, "A_return_pct": 10.25, "A_hit_rate": 57.81, "A_n": 129, "A_bh_sharpe": 1.7678, "A_bh_return_pct": 11.76, "A_psr": 0.8561, "A_ic": -0.0678, "B_sharpe": 1.8458, "B_sortino": 1.8562, "B_excess_sharpe": -2.4016, "B_return_pct": 23.73, "B_hit_rate": 55.04, "B_n": 129, "B_bh_sharpe": 4.2474, "B_bh_return_pct": 64.1, "B_psr": 0.9031, "B_ic": -0.0171, "D_sharpe": 1.2975, "D_sortino": 1.339, "D_excess_sharpe": -0.4703, "D_return_pct": 8.41, "D_hit_rate": 53.12, "D_n": 129, "D_bh_sharpe": 1.7678, "D_bh_return_pct": 11.76, "D_psr": 0.8231, "D_ic": 0.0428, "sharpe": 1.5566, "sortino": 1.3831, "return_pct": 10.25, "equity": 1102.5, "max_dd": 0.0, "win_rate": 57.81, "profit_factor": 0.0, "ic": -0.0678, "hit": 57.81, "psr": 0.8561, "bh_sharpe": 1.7678, "bh_return_pct": 11.76, "excess_sharpe": -0.2112, "precision": 0.6237, "recall": 0.7436, "f1": 0.6784, "f2": 0.716, "accuracy": 0.5736, "mcc": 0.0625, "tp": 58, "fp": 35, "tn": 16, "fn": 20, "A_precision": 0.6237, "A_recall": 0.7436, "A_f1": 0.6784, "A_f2": 0.716, "A_accuracy": 0.5736, "A_mcc": 0.0625, "A_tp": 58, "A_fp": 35, "A_tn": 16, "A_fn": 20}, {"fold": "fold_4", "regime": "China devaluation and oil crash", "n": 108, "A_sharpe": -0.6547, "A_sortino": -0.6431, "A_excess_sharpe": 0.035, "A_return_pct": -6.42, "A_hit_rate": 46.73, "A_n": 108, "A_bh_sharpe": -0.6898, "A_bh_return_pct": -6.71, "A_psr": 0.3345, "A_ic": 0.0126, "B_sharpe": -2.8601, "B_sortino": -2.7889, "B_excess_sharpe": -0.9026, "B_return_pct": -43.62, "B_hit_rate": 38.89, "B_n": 108, "B_bh_sharpe": -1.9575, "B_bh_return_pct": -33.56, "B_psr": 0.0326, "B_ic": -0.1399, "D_sharpe": -2.3594, "D_sortino": -2.0651, "D_excess_sharpe": -1.6697, "D_return_pct": -19.24, "D_hit_rate": 46.73, "D_n": 108, "D_bh_sharpe": -0.6898, "D_bh_return_pct": -6.71, "D_psr": 0.0564, "D_ic": -0.0592, "sharpe": -0.6547, "sortino": -0.6431, "return_pct": -6.42, "equity": 935.8, "max_dd": 0.0, "win_rate": 46.73, "profit_factor": 0.0, "ic": 0.0126, "hit": 46.73, "psr": 0.3345, "bh_sharpe": -0.6898, "bh_return_pct": -6.71, "excess_sharpe": 0.035, "precision": 0.4643, "recall": 0.4906, "f1": 0.4771, "f2": 0.4851, "accuracy": 0.4722, "mcc": -0.0549, "tp": 26, "fp": 30, "tn": 25, "fn": 27, "A_precision": 0.4643, "A_recall": 0.4906, "A_f1": 0.4771, "A_f2": 0.4851, "A_accuracy": 0.4722, "A_mcc": -0.0549, "A_tp": 26, "A_fp": 30, "A_tn": 25, "A_fn": 27}, {"fold": "fold_5", "regime": "2018 Vol-mageddon + Q4 sell-off", "n": 128, "A_sharpe": 0.7521, "A_sortino": 0.8282, "A_excess_sharpe": -0.399, "A_return_pct": 7.92, "A_hit_rate": 50.0, "A_n": 128, "A_bh_sharpe": 1.1511, "A_bh_return_pct": 13.19, "A_psr": 0.7055, "A_ic": 0.0133, "B_sharpe": -3.7474, "B_sortino": -3.6234, "B_excess_sharpe": -6.5593, "B_return_pct": -60.14, "B_hit_rate": 34.65, "B_n": 128, "B_bh_sharpe": 2.8119, "B_bh_return_pct": 82.25, "B_psr": 0.0041, "B_ic": -0.1635, "D_sharpe": -1.0657, "D_sortino": -1.1809, "D_excess_sharpe": -2.2168, "D_return_pct": -13.24, "D_hit_rate": 42.19, "D_n": 128, "D_bh_sharpe": 1.1511, "D_bh_return_pct": 13.19, "D_psr": 0.23, "D_ic": -0.1168, "sharpe": 0.7521, "sortino": 0.8282, "return_pct": 7.92, "equity": 1079.2, "max_dd": 0.0, "win_rate": 50.0, "profit_factor": 0.0, "ic": 0.0133, "hit": 50.0, "psr": 0.7055, "bh_sharpe": 1.1511, "bh_return_pct": 13.19, "excess_sharpe": -0.399, "precision": 0.5921, "recall": 0.5769, "f1": 0.5844, "f2": 0.5799, "accuracy": 0.5, "mcc": -0.0428, "tp": 45, "fp": 31, "tn": 19, "fn": 33, "A_precision": 0.5921, "A_recall": 0.5769, "A_f1": 0.5844, "A_f2": 0.5799, "A_accuracy": 0.5, "A_mcc": -0.0428, "A_tp": 45, "A_fp": 31, "A_tn": 19, "A_fn": 33}, {"fold": "fold_6", "regime": "COVID crash and V-recovery", "n": 173, "A_sharpe": 0.1522, "A_sortino": 0.1591, "A_excess_sharpe": -2.1739, "A_return_pct": 0.52, "A_hit_rate": 49.71, "A_n": 173, "A_bh_sharpe": 2.3261, "A_bh_return_pct": 43.81, "A_psr": 0.5501, "A_ic": 0.0008, "B_sharpe": -1.6508, "B_sortino": -1.7957, "B_excess_sharpe": -7.3968, "B_return_pct": -48.21, "B_hit_rate": 41.28, "B_n": 173, "B_bh_sharpe": 5.746, "B_bh_return_pct": 499.04, "B_psr": 0.094, "B_ic": 0.0945, "D_sharpe": -0.6608, "D_sortino": -0.8128, "D_excess_sharpe": -2.9869, "D_return_pct": -12.2, "D_hit_rate": 39.31, "D_n": 173, "D_bh_sharpe": 2.3261, "D_bh_return_pct": 43.81, "D_psr": 0.2962, "D_ic": 0.0189, "sharpe": 0.1522, "sortino": 0.1591, "return_pct": 0.52, "equity": 1005.2, "max_dd": 0.0, "win_rate": 49.71, "profit_factor": 0.0, "ic": 0.0008, "hit": 49.71, "psr": 0.5501, "bh_sharpe": 2.3261, "bh_return_pct": 43.81, "excess_sharpe": -2.1739, "precision": 0.6625, "recall": 0.469, "f1": 0.5492, "f2": 0.4981, "accuracy": 0.4971, "mcc": 0.0182, "tp": 53, "fp": 27, "tn": 33, "fn": 60, "A_precision": 0.6625, "A_recall": 0.469, "A_f1": 0.5492, "A_f2": 0.4981, "A_accuracy": 0.4971, "A_mcc": 0.0182, "A_tp": 53, "A_fp": 27, "A_tn": 33, "A_fn": 60}, {"fold": "fold_7", "regime": "Inflation bear, AI rally and 2025", "n": 376, "A_sharpe": -0.8497, "A_sortino": -0.9788, "A_excess_sharpe": -1.653, "A_return_pct": -27.48, "A_hit_rate": 42.02, "A_n": 376, "A_bh_sharpe": 0.8033, "A_bh_return_pct": 26.02, "A_psr": 0.1601, "A_ic": 0.0098, "B_sharpe": 0.0989, "B_sortino": 0.1117, "B_excess_sharpe": -1.8328, "B_return_pct": -8.74, "B_hit_rate": 45.07, "B_n": 376, "B_bh_sharpe": 1.9317, "B_bh_return_pct": 222.05, "B_psr": 0.5481, "B_ic": -0.0723, "D_sharpe": 0.3874, "D_sortino": 0.5108, "D_excess_sharpe": -0.4159, "D_return_pct": 9.72, "D_hit_rate": 43.09, "D_n": 376, "D_bh_sharpe": 0.8033, "D_bh_return_pct": 26.02, "D_psr": 0.6857, "D_ic": -0.0579, "sharpe": -0.8497, "sortino": -0.9788, "return_pct": -27.48, "equity": 725.2, "max_dd": 0.0, "win_rate": 42.02, "profit_factor": 0.0, "ic": 0.0098, "hit": 42.02, "psr": 0.1601, "bh_sharpe": 0.8033, "bh_return_pct": 26.02, "excess_sharpe": -1.653, "precision": 0.5263, "recall": 0.1357, "f1": 0.2158, "f2": 0.1594, "accuracy": 0.4202, "mcc": -0.0528, "tp": 30, "fp": 27, "tn": 128, "fn": 191, "A_precision": 0.5263, "A_recall": 0.1357, "A_f1": 0.2158, "A_f2": 0.1594, "A_accuracy": 0.4202, "A_mcc": -0.0528, "A_tp": 30, "A_fp": 27, "A_tn": 128, "A_fn": 191}], "per_window_val": [{"fold": "fold_1", "regime": "GFC peak crash (Lehman + Mar-2009 bottom)", "n": 65, "A_sharpe": -3.2887, "A_sortino": -2.7918, "A_excess_sharpe": -1.0631, "A_return_pct": -25.64, "A_hit_rate": 42.86, "A_n": 65, "A_bh_sharpe": -2.2257, "A_bh_return_pct": -18.74, "A_psr": 0.0356, "A_ic": -0.0148, "B_sharpe": -2.742, "B_sortino": -2.8058, "B_excess_sharpe": 4.3803, "B_return_pct": -44.28, "B_hit_rate": 41.54, "B_n": 65, "B_bh_sharpe": -7.1223, "B_bh_return_pct": -73.11, "B_psr": 0.1022, "B_ic": 0.3564, "D_sharpe": 0.746, "D_sortino": 0.7608, "D_excess_sharpe": 2.9717, "D_return_pct": 5.17, "D_hit_rate": 52.38, "D_n": 65, "D_bh_sharpe": -2.2257, "D_bh_return_pct": -18.74, "D_psr": 0.6477, "D_ic": 0.29, "sharpe": -3.2887, "sortino": -2.7918, "return_pct": -25.64, "equity": 743.6, "max_dd": 0.0, "win_rate": 42.86, "profit_factor": 0.0, "ic": -0.0148, "hit": 42.86, "psr": 0.0356, "bh_sharpe": -2.2257, "bh_return_pct": -18.74, "excess_sharpe": -1.0631}, {"fold": "fold_2", "regime": "2011 US-downgrade + EU debt", "n": 47, "A_sharpe": -3.6137, "A_sortino": -3.1514, "A_excess_sharpe": -3.4196, "A_return_pct": -21.3, "A_hit_rate": 42.55, "A_n": 47, "A_bh_sharpe": -0.1941, "A_bh_return_pct": -2.36, "A_psr": 0.0548, "A_ic": -0.1155, "B_sharpe": -1.171, "B_sortino": -1.0754, "B_excess_sharpe": 0.4413, "B_return_pct": -19.53, "B_hit_rate": 46.81, "B_n": 47, "B_bh_sharpe": -1.6123, "B_bh_return_pct": -24.3, "B_psr": 0.305, "B_ic": 0.1678, "D_sharpe": -0.0102, "D_sortino": -0.0087, "D_excess_sharpe": 0.1839, "D_return_pct": -1.19, "D_hit_rate": 57.45, "D_n": 47, "D_bh_sharpe": -0.1941, "D_bh_return_pct": -2.36, "D_psr": 0.4983, "D_ic": 0.1223, "sharpe": -3.6137, "sortino": -3.1514, "return_pct": -21.3, "equity": 787.0, "max_dd": 0.0, "win_rate": 42.55, "profit_factor": 0.0, "ic": -0.1155, "hit": 42.55, "psr": 0.0548, "bh_sharpe": -0.1941, "bh_return_pct": -2.36, "excess_sharpe": -3.4196}, {"fold": "fold_3", "regime": "Taper tantrum and 2014 H1", "n": 5, "A_sharpe": -0.5833, "A_sortino": -0.6746, "A_excess_sharpe": 0.7361, "A_return_pct": -0.1, "A_hit_rate": 40.0, "A_n": 5, "A_bh_sharpe": -1.3194, "A_bh_return_pct": -0.21, "A_psr": 0.4709, "A_ic": 0.6, "B_sharpe": 16.3312, "B_sortino": 33.6599, "B_excess_sharpe": 42.2017, "B_return_pct": 0.0, "B_hit_rate": 0.0, "B_n": 5, "B_bh_sharpe": -25.8705, "B_bh_return_pct": -3.84, "B_psr": 0.9931, "B_ic": -0.1, "D_sharpe": 12.0791, "D_sortino": 14.4463, "D_excess_sharpe": 13.3985, "D_return_pct": 0.0, "D_hit_rate": 0.0, "D_n": 5, "D_bh_sharpe": -1.3194, "D_bh_return_pct": -0.21, "D_psr": 0.9443, "D_ic": 0.1, "sharpe": -0.5833, "sortino": -0.6746, "return_pct": -0.1, "equity": 999.0, "max_dd": 0.0, "win_rate": 40.0, "profit_factor": 0.0, "ic": 0.6, "hit": 40.0, "psr": 0.4709, "bh_sharpe": -1.3194, "bh_return_pct": -0.21, "excess_sharpe": 0.7361}, {"fold": "fold_4", "regime": "China devaluation and oil crash", "n": 47, "A_sharpe": -0.5729, "A_sortino": -0.5758, "A_excess_sharpe": 1.2508, "A_return_pct": -3.22, "A_hit_rate": 44.68, "A_n": 47, "A_bh_sharpe": -1.8238, "A_bh_return_pct": -8.68, "A_psr": 0.4032, "A_ic": 0.0223, "B_sharpe": -0.7234, "B_sortino": -0.6036, "B_excess_sharpe": 1.4966, "B_return_pct": -10.65, "B_hit_rate": 51.06, "B_n": 47, "B_bh_sharpe": -2.22, "B_bh_return_pct": -23.98, "B_psr": 0.3748, "B_ic": 0.5693, "D_sharpe": -1.4517, "D_sortino": -1.3531, "D_excess_sharpe": 0.3721, "D_return_pct": -7.1, "D_hit_rate": 46.81, "D_n": 47, "D_bh_sharpe": -1.8238, "D_bh_return_pct": -8.68, "D_psr": 0.2665, "D_ic": 0.1714, "sharpe": -0.5729, "sortino": -0.5758, "return_pct": -3.22, "equity": 967.8, "max_dd": 0.0, "win_rate": 44.68, "profit_factor": 0.0, "ic": 0.0223, "hit": 44.68, "psr": 0.4032, "bh_sharpe": -1.8238, "bh_return_pct": -8.68, "excess_sharpe": 1.2508}, {"fold": "fold_5", "regime": "2018 Vol-mageddon + Q4 sell-off", "n": 5, "A_sharpe": -5.2428, "A_sortino": -4.6528, "A_excess_sharpe": 4.894, "A_return_pct": -1.86, "A_hit_rate": 40.0, "A_n": 5, "A_bh_sharpe": -10.1368, "A_bh_return_pct": -3.15, "A_psr": 0.2615, "A_ic": 0.0, "B_sharpe": 5.6858, "B_sortino": 6.0578, "B_excess_sharpe": 0.0, "B_return_pct": 4.22, "B_hit_rate": 60.0, "B_n": 5, "B_bh_sharpe": 5.6858, "B_bh_return_pct": 4.22, "B_psr": 0.753, "B_ic": 0.5, "D_sharpe": -10.1368, "D_sortino": -6.9937, "D_excess_sharpe": 0.0, "D_return_pct": -3.15, "D_hit_rate": 40.0, "D_n": 5, "D_bh_sharpe": -10.1368, "D_bh_return_pct": -3.15, "D_psr": 0.0985, "D_ic": 0.1, "sharpe": -5.2428, "sortino": -4.6528, "return_pct": -1.86, "equity": 981.4000000000001, "max_dd": 0.0, "win_rate": 40.0, "profit_factor": 0.0, "ic": 0.0, "hit": 40.0, "psr": 0.2615, "bh_sharpe": -10.1368, "bh_return_pct": -3.15, "excess_sharpe": 4.894}, {"fold": "fold_6", "regime": "COVID crash and V-recovery", "n": 26, "A_sharpe": 2.4814, "A_sortino": 2.3673, "A_excess_sharpe": -0.8038, "A_return_pct": 3.63, "A_hit_rate": 61.54, "A_n": 26, "A_bh_sharpe": 3.2852, "A_bh_return_pct": 4.82, "A_psr": 0.7795, "A_ic": 0.2321, "B_sharpe": 7.2148, "B_sortino": 6.7683, "B_excess_sharpe": -5.7644, "B_return_pct": 23.65, "B_hit_rate": 73.08, "B_n": 26, "B_bh_sharpe": 12.9792, "B_bh_return_pct": 38.76, "B_psr": 0.9823, "B_ic": 0.3682, "D_sharpe": 3.5049, "D_sortino": 4.1527, "D_excess_sharpe": 0.2198, "D_return_pct": 5.15, "D_hit_rate": 53.85, "D_n": 26, "D_bh_sharpe": 3.2852, "D_bh_return_pct": 4.82, "D_psr": 0.867, "D_ic": 0.2424, "sharpe": 2.4814, "sortino": 2.3673, "return_pct": 3.63, "equity": 1036.3, "max_dd": 0.0, "win_rate": 61.54, "profit_factor": 0.0, "ic": 0.2321, "hit": 61.54, "psr": 0.7795, "bh_sharpe": 3.2852, "bh_return_pct": 4.82, "excess_sharpe": -0.8038}, {"fold": "fold_7", "regime": "Inflation bear, AI rally and 2025", "n": 65, "A_sharpe": -1.9516, "A_sortino": -2.0181, "A_excess_sharpe": -4.0305, "A_return_pct": -7.65, "A_hit_rate": 41.54, "A_n": 65, "A_bh_sharpe": 2.0789, "A_bh_return_pct": 8.17, "A_psr": 0.1697, "A_ic": 0.0219, "B_sharpe": -5.0206, "B_sortino": -4.7073, "B_excess_sharpe": -10.252, "B_return_pct": -31.41, "B_hit_rate": 32.31, "B_n": 65, "B_bh_sharpe": 5.2314, "B_bh_return_pct": 44.53, "B_psr": 0.0073, "B_ic": 0.0196, "D_sharpe": -2.025, "D_sortino": -1.8593, "D_excess_sharpe": -4.1039, "D_return_pct": -7.92, "D_hit_rate": 46.15, "D_n": 65, "D_bh_sharpe": 2.0789, "D_bh_return_pct": 8.17, "D_psr": 0.1506, "D_ic": 0.1387, "sharpe": -1.9516, "sortino": -2.0181, "return_pct": -7.65, "equity": 923.5, "max_dd": 0.0, "win_rate": 41.54, "profit_factor": 0.0, "ic": 0.0219, "hit": 41.54, "psr": 0.1697, "bh_sharpe": 2.0789, "bh_return_pct": 8.17, "excess_sharpe": -4.0305}], "status": "DISCARD", "precision": 0.583, "recall": 0.4114, "f1": 0.4824, "f2": 0.4371, "accuracy": 0.477, "mcc": -0.0161, "tp": 260, "fp": 186, "tn": 249, "fn": 372, "test_sharpe": -0.0045, "A_sharpe": -0.0045, "A_excess_sharpe": -1.2239, "A_return_pct": -10.56, "A_precision": 0.583, "A_recall": 0.4114, "A_f1": 0.4824, "A_f2": 0.4371, "A_accuracy": 0.477, "A_mcc": -0.0161, "A_tp": 260, "A_fp": 186, "A_tn": 249, "A_fn": 372, "A_psr": 0.4963, "A_ic": -0.0018, "A_hit_rate": 47.65, "A_bh_sharpe": 1.2194, "A_bh_return_pct": 187.05}
