{"experiment_num": 81, "backbone": "mlp", "description": "MLP @ exp 79 warmup=5 seed=7 - 3rd seed multi-seed", "config": {"seq_len": 10, "lr": 0.0003, "batch_size": 32, "epochs": 50, "weight_decay": 1e-05, "patience": 10, "warmup_epochs": 5, "head_dropout": 0.25, "huber_delta": 1.0, "grad_clip": 1.0, "seed": 7, "hidden_size": null, "num_layers": null, "max_depth": null, "gbm_lr": null, "n_estimators": null}, "composite": -0.4907, "test_pos_folds": 4, "val_pos_folds": 3, "val_loss": -2.8862161342852435, "elapsed_sec": 23.5, "timestamp": "2026-04-27T23:17:13", "sharpe": 0.3151, "val_sharpe": -0.1907, "ic": 0.0427, "hit": 49.68, "psr": 0.7721, "equity": 1313.1999999999998, "return_pct": 31.32, "bh_sharpe": 0.6042, "bh_return_pct": 103.49, "excess_sharpe": -0.2891, "B_sharpe": 0.3091, "B_excess_sharpe": -1.3917, "B_return_pct": 13.06, "D_sharpe": 0.3151, "D_excess_sharpe": -0.2891, "D_return_pct": 31.32, "precision": 0.5801, "recall": 0.4399, "f1": 0.5004, "f2": 0.4622, "mcc": 0.0137, "accuracy": 0.4972, "val_precision": 0.5867, "val_recall": 0.3495, "val_f1": 0.4381, "val_f2": 0.3803, "val_mcc": 0.0451, "val_accuracy": 0.5025, "per_window": [{"fold": "fold_1", "regime": "GFC peak crash (Lehman + Mar-2009 bottom)", "n": 115, "A_sharpe": -0.5686, "A_sortino": -0.6237, "A_excess_sharpe": -0.1245, "A_return_pct": -16.74, "A_hit_rate": 42.61, "A_n": 115, "A_bh_sharpe": -0.4441, "A_bh_return_pct": -14.4, "A_psr": 0.352, "A_ic": -0.0518, "A_precision": 0.4091, "A_recall": 0.5, "A_f1": 0.45, "A_f2": 0.4787, "A_accuracy": 0.4261, "A_mcc": -0.1406, "A_tp": 27, "A_fp": 39, "A_tn": 22, "A_fn": 27, "B_sharpe": 4.872, "B_sortino": 5.0582, "B_excess_sharpe": 5.1699, "B_return_pct": 481.26, "B_hit_rate": 66.67, "B_n": 115, "B_bh_sharpe": -0.2978, "B_bh_return_pct": -27.23, "B_psr": 0.9994, "B_ic": 0.2235, "B_precision": 0.6136, "B_recall": 0.9153, "B_f1": 0.7347, "B_f2": 0.8333, "B_accuracy": 0.6609, "B_mcc": 0.3633, "B_tp": 54, "B_fp": 34, "B_tn": 22, "B_fn": 5, "D_sharpe": -0.5686, "D_sortino": -0.6237, "D_excess_sharpe": -0.1245, "D_return_pct": -16.74, "D_hit_rate": 42.61, "D_n": 115, "D_bh_sharpe": -0.4441, "D_bh_return_pct": -14.4, "D_psr": 0.352, "D_ic": -0.0518, "D_precision": 0.4091, "D_recall": 0.5, "D_f1": 0.45, "D_f2": 0.4787, "D_accuracy": 0.4261, "D_mcc": -0.1406, "D_tp": 27, "D_fp": 39, "D_tn": 22, "D_fn": 27, "sharpe": -0.5686, "sortino": -0.6237, "return_pct": -16.74, "equity": 832.6, "max_dd": 0.0, "win_rate": 42.61, "profit_factor": 0.0, "ic": -0.0518, "hit": 42.61, "psr": 0.352, "bh_sharpe": -0.4441, "bh_return_pct": -14.4, "excess_sharpe": -0.1245, "precision": 0.4091, "recall": 0.5, "f1": 0.45, "f2": 0.4787, "mcc": -0.1406, "accuracy": 0.4261, "tp": 27, "fp": 39, "tn": 22, "fn": 27}, {"fold": "fold_2", "regime": "2011 US-downgrade + EU debt", "n": 136, "A_sharpe": -0.537, "A_sortino": -0.6009, "A_excess_sharpe": -2.2698, "A_return_pct": -6.87, "A_hit_rate": 42.96, "A_n": 136, "A_bh_sharpe": 1.7327, "A_bh_return_pct": 19.75, "A_psr": 0.3484, "A_ic": -0.0456, "A_precision": 0.5, "A_recall": 0.3333, "A_f1": 0.4, "A_f2": 0.3571, "A_accuracy": 0.4265, "A_mcc": -0.117, "A_tp": 26, "A_fp": 26, "A_tn": 32, "A_fn": 52, "B_sharpe": 3.6725, "B_sortino": 3.5718, "B_excess_sharpe": -0.3934, "B_return_pct": 127.63, "B_hit_rate": 64.71, "B_n": 136, "B_bh_sharpe": 4.0659, "B_bh_return_pct": 148.68, "B_psr": 0.9958, "B_ic": -0.0457, "B_precision": 0.7105, "B_recall": 0.8438, "B_f1": 0.7714, "B_f2": 0.8133, "B_accuracy": 0.6471, "B_mcc": 0.0232, "B_tp": 81, "B_fp": 33, "B_tn": 7, "B_fn": 15, "D_sharpe": -0.537, "D_sortino": -0.6009, "D_excess_sharpe": -2.2698, "D_return_pct": -6.87, "D_hit_rate": 42.96, "D_n": 136, "D_bh_sharpe": 1.7327, "D_bh_return_pct": 19.75, "D_psr": 0.3484, "D_ic": -0.0456, "D_precision": 0.5, "D_recall": 0.3333, "D_f1": 0.4, "D_f2": 0.3571, "D_accuracy": 0.4265, "D_mcc": -0.117, "D_tp": 26, "D_fp": 26, "D_tn": 32, "D_fn": 52, "sharpe": -0.537, "sortino": -0.6009, "return_pct": -6.87, "equity": 931.3000000000001, "max_dd": 0.0, "win_rate": 42.96, "profit_factor": 0.0, "ic": -0.0456, "hit": 42.96, "psr": 0.3484, "bh_sharpe": 1.7327, "bh_return_pct": 19.75, "excess_sharpe": -2.2698, "precision": 0.5, "recall": 0.3333, "f1": 0.4, "f2": 0.3571, "mcc": -0.117, "accuracy": 0.4265, "tp": 26, "fp": 26, "tn": 32, "fn": 52}, {"fold": "fold_3", "regime": "Taper tantrum and 2014 H1", "n": 178, "A_sharpe": 0.4069, "A_sortino": 0.4001, "A_excess_sharpe": -0.9376, "A_return_pct": 3.19, "A_hit_rate": 51.98, "A_n": 178, "A_bh_sharpe": 1.3445, "A_bh_return_pct": 12.41, "A_psr": 0.633, "A_ic": 0.1842, "A_precision": 0.6875, "A_recall": 0.3204, "A_f1": 0.4371, "A_f2": 0.3587, "A_accuracy": 0.5225, "A_mcc": 0.1339, "A_tp": 33, "A_fp": 15, "A_tn": 60, "A_fn": 70, "B_sharpe": 1.3445, "B_sortino": 1.284, "B_excess_sharpe": -1.7038, "B_return_pct": 25.63, "B_hit_rate": 56.18, "B_n": 178, "B_bh_sharpe": 3.0483, "B_bh_return_pct": 71.83, "B_psr": 0.8674, "B_ic": 0.0708, "B_precision": 0.626, "B_recall": 0.7064, "B_f1": 0.6638, "B_f2": 0.6887, "B_accuracy": 0.5618, "B_mcc": 0.0419, "B_tp": 77, "B_fp": 46, "B_tn": 23, "B_fn": 32, "D_sharpe": 0.4069, "D_sortino": 0.4001, "D_excess_sharpe": -0.9376, "D_return_pct": 3.19, "D_hit_rate": 51.98, "D_n": 178, "D_bh_sharpe": 1.3445, "D_bh_return_pct": 12.41, "D_psr": 0.633, "D_ic": 0.1842, "D_precision": 0.6875, "D_recall": 0.3204, "D_f1": 0.4371, "D_f2": 0.3587, "D_accuracy": 0.5225, "D_mcc": 0.1339, "D_tp": 33, "D_fp": 15, "D_tn": 60, "D_fn": 70, "sharpe": 0.4069, "sortino": 0.4001, "return_pct": 3.19, "equity": 1031.9, "max_dd": 0.0, "win_rate": 51.98, "profit_factor": 0.0, "ic": 0.1842, "hit": 51.98, "psr": 0.633, "bh_sharpe": 1.3445, "bh_return_pct": 12.41, "excess_sharpe": -0.9376, "precision": 0.6875, "recall": 0.3204, "f1": 0.4371, "f2": 0.3587, "mcc": 0.1339, "accuracy": 0.5225, "tp": 33, "fp": 15, "tn": 60, "fn": 70}, {"fold": "fold_4", "regime": "China devaluation and oil crash", "n": 157, "A_sharpe": -1.2301, "A_sortino": -1.1637, "A_excess_sharpe": -1.2399, "A_return_pct": -14.79, "A_hit_rate": 46.79, "A_n": 157, "A_bh_sharpe": 0.0098, "A_bh_return_pct": -1.05, "A_psr": 0.1645, "A_ic": -0.0703, "A_precision": 0.4865, "A_recall": 0.4444, "A_f1": 0.4645, "A_f2": 0.4523, "A_accuracy": 0.4713, "A_mcc": -0.0556, "A_tp": 36, "A_fp": 38, "A_tn": 38, "A_fn": 45, "B_sharpe": -0.622, "B_sortino": -0.6439, "B_excess_sharpe": -0.6379, "B_return_pct": -20.57, "B_hit_rate": 46.5, "B_n": 157, "B_bh_sharpe": 0.0159, "B_bh_return_pct": -5.48, "B_psr": 0.3131, "B_ic": -0.107, "B_precision": 0.5052, "B_recall": 0.5765, "B_f1": 0.5385, "B_f2": 0.5606, "B_accuracy": 0.465, "B_mcc": -0.0925, "B_tp": 49, "B_fp": 48, "B_tn": 24, "B_fn": 36, "D_sharpe": -1.2301, "D_sortino": -1.1637, "D_excess_sharpe": -1.2399, "D_return_pct": -14.79, "D_hit_rate": 46.79, "D_n": 157, "D_bh_sharpe": 0.0098, "D_bh_return_pct": -1.05, "D_psr": 0.1645, "D_ic": -0.0703, "D_precision": 0.4865, "D_recall": 0.4444, "D_f1": 0.4645, "D_f2": 0.4523, "D_accuracy": 0.4713, "D_mcc": -0.0556, "D_tp": 36, "D_fp": 38, "D_tn": 38, "D_fn": 45, "sharpe": -1.2301, "sortino": -1.1637, "return_pct": -14.79, "equity": 852.1, "max_dd": 0.0, "win_rate": 46.79, "profit_factor": 0.0, "ic": -0.0703, "hit": 46.79, "psr": 0.1645, "bh_sharpe": 0.0098, "bh_return_pct": -1.05, "excess_sharpe": -1.2399, "precision": 0.4865, "recall": 0.4444, "f1": 0.4645, "f2": 0.4523, "mcc": -0.0556, "accuracy": 0.4713, "tp": 36, "fp": 38, "tn": 38, "fn": 45}, {"fold": "fold_5", "regime": "2018 Vol-mageddon + Q4 sell-off", "n": 177, "A_sharpe": 1.9864, "A_sortino": 2.2782, "A_excess_sharpe": 1.6767, "A_return_pct": 35.03, "A_hit_rate": 53.11, "A_n": 177, "A_bh_sharpe": 0.3098, "A_bh_return_pct": 3.19, "A_psr": 0.957, "A_ic": 0.0917, "A_precision": 0.6087, "A_recall": 0.5437, "A_f1": 0.5744, "A_f2": 0.5556, "A_accuracy": 0.5311, "A_mcc": 0.0565, "A_tp": 56, "A_fp": 36, "A_tn": 38, "A_fn": 47, "B_sharpe": 2.3366, "B_sortino": 2.1259, "B_excess_sharpe": 1.4449, "B_return_pct": 96.79, "B_hit_rate": 61.36, "B_n": 177, "B_bh_sharpe": 0.8917, "B_bh_return_pct": 23.8, "B_psr": 0.9698, "B_ic": 0.0646, "B_precision": 0.6449, "B_recall": 0.8165, "B_f1": 0.7206, "B_f2": 0.7753, "B_accuracy": 0.6102, "B_mcc": 0.1126, "B_tp": 89, "B_fp": 49, "B_tn": 19, "B_fn": 20, "D_sharpe": 1.9864, "D_sortino": 2.2782, "D_excess_sharpe": 1.6767, "D_return_pct": 35.03, "D_hit_rate": 53.11, "D_n": 177, "D_bh_sharpe": 0.3098, "D_bh_return_pct": 3.19, "D_psr": 0.957, "D_ic": 0.0917, "D_precision": 0.6087, "D_recall": 0.5437, "D_f1": 0.5744, "D_f2": 0.5556, "D_accuracy": 0.5311, "D_mcc": 0.0565, "D_tp": 56, "D_fp": 36, "D_tn": 38, "D_fn": 47, "sharpe": 1.9864, "sortino": 2.2782, "return_pct": 35.03, "equity": 1350.3, "max_dd": 0.0, "win_rate": 53.11, "profit_factor": 0.0, "ic": 0.0917, "hit": 53.11, "psr": 0.957, "bh_sharpe": 0.3098, "bh_return_pct": 3.19, "excess_sharpe": 1.6767, "precision": 0.6087, "recall": 0.5437, "f1": 0.5744, "f2": 0.5556, "mcc": 0.0565, "accuracy": 0.5311, "tp": 56, "fp": 36, "tn": 38, "fn": 47}, {"fold": "fold_6", "regime": "COVID crash and V-recovery", "n": 222, "A_sharpe": 0.6013, "A_sortino": 0.6323, "A_excess_sharpe": -0.2875, "A_return_pct": 14.66, "A_hit_rate": 46.4, "A_n": 222, "A_bh_sharpe": 0.8888, "A_bh_return_pct": 26.13, "A_psr": 0.7115, "A_ic": 0.0977, "A_precision": 0.6301, "A_recall": 0.3333, "A_f1": 0.436, "A_f2": 0.368, "A_accuracy": 0.464, "A_mcc": 0.0123, "A_tp": 46, "A_fp": 27, "A_tn": 57, "A_fn": 92, "B_sharpe": -2.3929, "B_sortino": -2.2073, "B_excess_sharpe": -4.7813, "B_return_pct": -81.29, "B_hit_rate": 42.99, "B_n": 222, "B_bh_sharpe": 2.3884, "B_bh_return_pct": 243.18, "B_psr": 0.0109, "B_ic": -0.0917, "B_precision": 0.5487, "B_recall": 0.4526, "B_f1": 0.496, "B_f2": 0.469, "B_accuracy": 0.4324, "B_mcc": -0.1434, "B_tp": 62, "B_fp": 51, "B_tn": 34, "B_fn": 75, "D_sharpe": 0.6013, "D_sortino": 0.6323, "D_excess_sharpe": -0.2875, "D_return_pct": 14.66, "D_hit_rate": 46.4, "D_n": 222, "D_bh_sharpe": 0.8888, "D_bh_return_pct": 26.13, "D_psr": 0.7115, "D_ic": 0.0977, "D_precision": 0.6301, "D_recall": 0.3333, "D_f1": 0.436, "D_f2": 0.368, "D_accuracy": 0.464, "D_mcc": 0.0123, "D_tp": 46, "D_fp": 27, "D_tn": 57, "D_fn": 92, "sharpe": 0.6013, "sortino": 0.6323, "return_pct": 14.66, "equity": 1146.6000000000001, "max_dd": 0.0, "win_rate": 46.4, "profit_factor": 0.0, "ic": 0.0977, "hit": 46.4, "psr": 0.7115, "bh_sharpe": 0.8888, "bh_return_pct": 26.13, "excess_sharpe": -0.2875, "precision": 0.6301, "recall": 0.3333, "f1": 0.436, "f2": 0.368, "mcc": 0.0123, "accuracy": 0.464, "tp": 46, "fp": 27, "tn": 57, "fn": 92}, {"fold": "fold_7", "regime": "Inflation bear, AI rally and 2025", "n": 425, "A_sharpe": 0.7049, "A_sortino": 0.6951, "A_excess_sharpe": -0.2666, "A_return_pct": 24.41, "A_hit_rate": 54.12, "A_n": 425, "A_bh_sharpe": 0.9715, "A_bh_return_pct": 37.12, "A_psr": 0.8225, "A_ic": 0.0814, "A_precision": 0.6329, "A_recall": 0.524, "A_f1": 0.5733, "A_f2": 0.5427, "A_accuracy": 0.5412, "A_mcc": 0.0883, "A_tp": 131, "A_fp": 76, "A_tn": 99, "A_fn": 119, "B_sharpe": -1.6819, "B_sortino": -1.5224, "B_excess_sharpe": -4.1845, "B_return_pct": -76.75, "B_hit_rate": 48.82, "B_n": 425, "B_bh_sharpe": 2.5027, "B_bh_return_pct": 458.83, "B_psr": 0.0135, "B_ic": -0.1475, "B_precision": 0.5738, "B_recall": 0.6654, "B_f1": 0.6162, "B_f2": 0.6448, "B_accuracy": 0.4871, "B_mcc": -0.1479, "B_tp": 175, "B_fp": 130, "B_tn": 32, "B_fn": 88, "D_sharpe": 0.7049, "D_sortino": 0.6951, "D_excess_sharpe": -0.2666, "D_return_pct": 24.41, "D_hit_rate": 54.12, "D_n": 425, "D_bh_sharpe": 0.9715, "D_bh_return_pct": 37.12, "D_psr": 0.8225, "D_ic": 0.0814, "D_precision": 0.6329, "D_recall": 0.524, "D_f1": 0.5733, "D_f2": 0.5427, "D_accuracy": 0.5412, "D_mcc": 0.0883, "D_tp": 131, "D_fp": 76, "D_tn": 99, "D_fn": 119, "sharpe": 0.7049, "sortino": 0.6951, "return_pct": 24.41, "equity": 1244.1, "max_dd": 0.0, "win_rate": 54.12, "profit_factor": 0.0, "ic": 0.0814, "hit": 54.12, "psr": 0.8225, "bh_sharpe": 0.9715, "bh_return_pct": 37.12, "excess_sharpe": -0.2666, "precision": 0.6329, "recall": 0.524, "f1": 0.5733, "f2": 0.5427, "mcc": 0.0883, "accuracy": 0.5412, "tp": 131, "fp": 76, "tn": 99, "fn": 119}], "per_window_val": [{"fold": "fold_1", "regime": "GFC peak crash (Lehman + Mar-2009 bottom)", "n": 104, "A_sharpe": -1.6198, "A_sortino": -1.4149, "A_excess_sharpe": -1.4526, "A_return_pct": -19.4, "A_hit_rate": 48.04, "A_n": 104, "A_bh_sharpe": -0.1672, "A_bh_return_pct": -3.81, "A_psr": 0.14, "A_ic": -0.0047, "A_precision": 0.5152, "A_recall": 0.3148, "A_f1": 0.3908, "A_f2": 0.3414, "A_accuracy": 0.4904, "A_mcc": -0.0056, "A_tp": 17, "A_fp": 16, "A_tn": 34, "A_fn": 37, "B_sharpe": -1.5322, "B_sortino": -1.3768, "B_excess_sharpe": 0.7419, "B_return_pct": -33.97, "B_hit_rate": 46.6, "B_n": 104, "B_bh_sharpe": -2.2741, "B_bh_return_pct": -44.12, "B_psr": 0.1556, "B_ic": -0.0574, "B_precision": 0.4706, "B_recall": 0.4615, "B_f1": 0.466, "B_f2": 0.4633, "B_accuracy": 0.4712, "B_mcc": -0.0577, "B_tp": 24, "B_fp": 27, "B_tn": 25, "B_fn": 28, "D_sharpe": -1.6198, "D_sortino": -1.4149, "D_excess_sharpe": -1.4526, "D_return_pct": -19.4, "D_hit_rate": 48.04, "D_n": 104, "D_bh_sharpe": -0.1672, "D_bh_return_pct": -3.81, "D_psr": 0.14, "D_ic": -0.0047, "D_precision": 0.5152, "D_recall": 0.3148, "D_f1": 0.3908, "D_f2": 0.3414, "D_accuracy": 0.4904, "D_mcc": -0.0056, "D_tp": 17, "D_fp": 16, "D_tn": 34, "D_fn": 37, "sharpe": -1.6198, "sortino": -1.4149, "return_pct": -19.4, "equity": 806.0, "max_dd": 0.0, "win_rate": 48.04, "profit_factor": 0.0, "ic": -0.0047, "hit": 48.04, "psr": 0.14, "bh_sharpe": -0.1672, "bh_return_pct": -3.81, "excess_sharpe": -1.4526, "precision": 0.5152, "recall": 0.3148, "f1": 0.3908, "f2": 0.3414, "mcc": -0.0056, "accuracy": 0.4904, "tp": 17, "fp": 16, "tn": 34, "fn": 37}, {"fold": "fold_2", "regime": "2011 US-downgrade + EU debt", "n": 96, "A_sharpe": 0.7531, "A_sortino": 0.6971, "A_excess_sharpe": 1.0272, "A_return_pct": 6.51, "A_hit_rate": 56.84, "A_n": 96, "A_bh_sharpe": -0.2741, "A_bh_return_pct": -4.09, "A_psr": 0.6768, "A_ic": 0.0182, "A_precision": 0.58, "A_recall": 0.58, "A_f1": 0.58, "A_f2": 0.58, "A_accuracy": 0.5625, "A_mcc": 0.1235, "A_tp": 29, "A_fp": 21, "A_tn": 25, "A_fn": 21, "B_sharpe": 3.5842, "B_sortino": 4.8196, "B_excess_sharpe": 4.6116, "B_return_pct": 104.75, "B_hit_rate": 55.21, "B_n": 96, "B_bh_sharpe": -1.0274, "B_bh_return_pct": -25.58, "B_psr": 0.9919, "B_ic": 0.1559, "B_precision": 0.5, "B_recall": 0.7907, "B_f1": 0.6126, "B_f2": 0.7083, "B_accuracy": 0.5521, "B_mcc": 0.1632, "B_tp": 34, "B_fp": 34, "B_tn": 19, "B_fn": 9, "D_sharpe": 0.7531, "D_sortino": 0.6971, "D_excess_sharpe": 1.0272, "D_return_pct": 6.51, "D_hit_rate": 56.84, "D_n": 96, "D_bh_sharpe": -0.2741, "D_bh_return_pct": -4.09, "D_psr": 0.6768, "D_ic": 0.0182, "D_precision": 0.58, "D_recall": 0.58, "D_f1": 0.58, "D_f2": 0.58, "D_accuracy": 0.5625, "D_mcc": 0.1235, "D_tp": 29, "D_fp": 21, "D_tn": 25, "D_fn": 21, "sharpe": 0.7531, "sortino": 0.6971, "return_pct": 6.51, "equity": 1065.1, "max_dd": 0.0, "win_rate": 56.84, "profit_factor": 0.0, "ic": 0.0182, "hit": 56.84, "psr": 0.6768, "bh_sharpe": -0.2741, "bh_return_pct": -4.09, "excess_sharpe": 1.0272, "precision": 0.58, "recall": 0.58, "f1": 0.58, "f2": 0.58, "mcc": 0.1235, "accuracy": 0.5625, "tp": 29, "fp": 21, "tn": 25, "fn": 21}, {"fold": "fold_3", "regime": "Taper tantrum and 2014 H1", "n": 54, "A_sharpe": -1.2939, "A_sortino": -1.365, "A_excess_sharpe": -5.9937, "A_return_pct": -2.95, "A_hit_rate": 44.44, "A_n": 54, "A_bh_sharpe": 4.6998, "A_bh_return_pct": 10.46, "A_psr": 0.2805, "A_ic": -0.1613, "A_precision": 1.0, "A_recall": 0.0909, "A_f1": 0.1667, "A_f2": 0.1111, "A_accuracy": 0.4444, "A_mcc": 0.1935, "A_tp": 3, "A_fp": 0, "A_tn": 21, "A_fn": 30, "B_sharpe": 2.9945, "B_sortino": 3.0102, "B_excess_sharpe": -6.0381, "B_return_pct": 15.72, "B_hit_rate": 59.26, "B_n": 54, "B_bh_sharpe": 9.0326, "B_bh_return_pct": 49.18, "B_psr": 0.9099, "B_ic": -0.1427, "B_precision": 0.6531, "B_recall": 0.8649, "B_f1": 0.7442, "B_f2": 0.8122, "B_accuracy": 0.5926, "B_mcc": -0.2165, "B_tp": 32, "B_fp": 17, "B_tn": 0, "B_fn": 5, "D_sharpe": -1.2939, "D_sortino": -1.365, "D_excess_sharpe": -5.9937, "D_return_pct": -2.95, "D_hit_rate": 44.44, "D_n": 54, "D_bh_sharpe": 4.6998, "D_bh_return_pct": 10.46, "D_psr": 0.2805, "D_ic": -0.1613, "D_precision": 1.0, "D_recall": 0.0909, "D_f1": 0.1667, "D_f2": 0.1111, "D_accuracy": 0.4444, "D_mcc": 0.1935, "D_tp": 3, "D_fp": 0, "D_tn": 21, "D_fn": 30, "sharpe": -1.2939, "sortino": -1.365, "return_pct": -2.95, "equity": 970.5, "max_dd": 0.0, "win_rate": 44.44, "profit_factor": 0.0, "ic": -0.1613, "hit": 44.44, "psr": 0.2805, "bh_sharpe": 4.6998, "bh_return_pct": 10.46, "excess_sharpe": -5.9937, "precision": 1.0, "recall": 0.0909, "f1": 0.1667, "f2": 0.1111, "mcc": 0.1935, "accuracy": 0.4444, "tp": 3, "fp": 0, "tn": 21, "fn": 30}, {"fold": "fold_4", "regime": "China devaluation and oil crash", "n": 96, "A_sharpe": 2.068, "A_sortino": 1.9527, "A_excess_sharpe": 2.4922, "A_return_pct": 15.36, "A_hit_rate": 58.95, "A_n": 96, "A_bh_sharpe": -0.4241, "A_bh_return_pct": -3.73, "A_psr": 0.8915, "A_ic": 0.1239, "A_precision": 0.5714, "A_recall": 0.5333, "A_f1": 0.5517, "A_f2": 0.5405, "A_accuracy": 0.5938, "A_mcc": 0.1815, "A_tp": 24, "A_fp": 18, "A_tn": 33, "A_fn": 21, "B_sharpe": 3.7076, "B_sortino": 6.3501, "B_excess_sharpe": 4.8919, "B_return_pct": 78.55, "B_hit_rate": 55.21, "B_n": 96, "B_bh_sharpe": -1.1843, "B_bh_return_pct": -21.44, "B_psr": 0.9979, "B_ic": 0.1441, "B_precision": 0.5273, "B_recall": 0.6304, "B_f1": 0.5743, "B_f2": 0.6067, "B_accuracy": 0.5521, "B_mcc": 0.1115, "B_tp": 29, "B_fp": 26, "B_tn": 24, "B_fn": 17, "D_sharpe": 2.068, "D_sortino": 1.9527, "D_excess_sharpe": 2.4922, "D_return_pct": 15.36, "D_hit_rate": 58.95, "D_n": 96, "D_bh_sharpe": -0.4241, "D_bh_return_pct": -3.73, "D_psr": 0.8915, "D_ic": 0.1239, "D_precision": 0.5714, "D_recall": 0.5333, "D_f1": 0.5517, "D_f2": 0.5405, "D_accuracy": 0.5938, "D_mcc": 0.1815, "D_tp": 24, "D_fp": 18, "D_tn": 33, "D_fn": 21, "sharpe": 2.068, "sortino": 1.9527, "return_pct": 15.36, "equity": 1153.6, "max_dd": 0.0, "win_rate": 58.95, "profit_factor": 0.0, "ic": 0.1239, "hit": 58.95, "psr": 0.8915, "bh_sharpe": -0.4241, "bh_return_pct": -3.73, "excess_sharpe": 2.4922, "precision": 0.5714, "recall": 0.5333, "f1": 0.5517, "f2": 0.5405, "mcc": 0.1815, "accuracy": 0.5938, "tp": 24, "fp": 18, "tn": 33, "fn": 21}, {"fold": "fold_5", "regime": "2018 Vol-mageddon + Q4 sell-off", "n": 54, "A_sharpe": -1.7817, "A_sortino": -1.6258, "A_excess_sharpe": -3.2096, "A_return_pct": -5.14, "A_hit_rate": 50.0, "A_n": 54, "A_bh_sharpe": 1.428, "A_bh_return_pct": 3.97, "A_psr": 0.2083, "A_ic": 0.0439, "A_precision": 0.5714, "A_recall": 0.2759, "A_f1": 0.3721, "A_f2": 0.3077, "A_accuracy": 0.5, "A_mcc": 0.0408, "A_tp": 8, "A_fp": 6, "A_tn": 19, "A_fn": 21, "B_sharpe": -6.1013, "B_sortino": -4.6964, "B_excess_sharpe": -11.0334, "B_return_pct": -31.93, "B_hit_rate": 44.44, "B_n": 54, "B_bh_sharpe": 4.9322, "B_bh_return_pct": 34.93, "B_psr": 0.0018, "B_ic": -0.4131, "B_precision": 0.5897, "B_recall": 0.6216, "B_f1": 0.6053, "B_f2": 0.615, "B_accuracy": 0.4444, "B_mcc": -0.3314, "B_tp": 23, "B_fp": 16, "B_tn": 1, "B_fn": 14, "D_sharpe": -1.7817, "D_sortino": -1.6258, "D_excess_sharpe": -3.2096, "D_return_pct": -5.14, "D_hit_rate": 50.0, "D_n": 54, "D_bh_sharpe": 1.428, "D_bh_return_pct": 3.97, "D_psr": 0.2083, "D_ic": 0.0439, "D_precision": 0.5714, "D_recall": 0.2759, "D_f1": 0.3721, "D_f2": 0.3077, "D_accuracy": 0.5, "D_mcc": 0.0408, "D_tp": 8, "D_fp": 6, "D_tn": 19, "D_fn": 21, "sharpe": -1.7817, "sortino": -1.6258, "return_pct": -5.14, "equity": 948.6, "max_dd": 0.0, "win_rate": 50.0, "profit_factor": 0.0, "ic": 0.0439, "hit": 50.0, "psr": 0.2083, "bh_sharpe": 1.428, "bh_return_pct": 3.97, "excess_sharpe": -3.2096, "precision": 0.5714, "recall": 0.2759, "f1": 0.3721, "f2": 0.3077, "mcc": 0.0408, "accuracy": 0.5, "tp": 8, "fp": 6, "tn": 19, "fn": 21}, {"fold": "fold_6", "regime": "COVID crash and V-recovery", "n": 75, "A_sharpe": -2.8749, "A_sortino": -3.0532, "A_excess_sharpe": -7.1743, "A_return_pct": -9.2, "A_hit_rate": 34.67, "A_n": 75, "A_bh_sharpe": 4.2994, "A_bh_return_pct": 14.68, "A_psr": 0.0691, "A_ic": -0.1014, "A_precision": 0.6667, "A_recall": 0.0784, "A_f1": 0.1404, "A_f2": 0.0952, "A_accuracy": 0.3467, "A_mcc": -0.0084, "A_tp": 4, "A_fp": 2, "A_tn": 22, "A_fn": 47, "B_sharpe": 10.8892, "B_sortino": 9.5843, "B_excess_sharpe": -3.4448, "B_return_pct": 94.35, "B_hit_rate": 80.0, "B_n": 75, "B_bh_sharpe": 14.3339, "B_bh_return_pct": 120.13, "B_psr": 1.0, "B_ic": 0.0068, "B_precision": 0.875, "B_recall": 0.8889, "B_f1": 0.8819, "B_f2": 0.8861, "B_accuracy": 0.8, "B_mcc": 0.2303, "B_tp": 56, "B_fp": 8, "B_tn": 4, "B_fn": 7, "D_sharpe": -2.8749, "D_sortino": -3.0532, "D_excess_sharpe": -7.1743, "D_return_pct": -9.2, "D_hit_rate": 34.67, "D_n": 75, "D_bh_sharpe": 4.2994, "D_bh_return_pct": 14.68, "D_psr": 0.0691, "D_ic": -0.1014, "D_precision": 0.6667, "D_recall": 0.0784, "D_f1": 0.1404, "D_f2": 0.0952, "D_accuracy": 0.3467, "D_mcc": -0.0084, "D_tp": 4, "D_fp": 2, "D_tn": 22, "D_fn": 47, "sharpe": -2.8749, "sortino": -3.0532, "return_pct": -9.2, "equity": 908.0, "max_dd": 0.0, "win_rate": 34.67, "profit_factor": 0.0, "ic": -0.1014, "hit": 34.67, "psr": 0.0691, "bh_sharpe": 4.2994, "bh_return_pct": 14.68, "excess_sharpe": -7.1743, "precision": 0.6667, "recall": 0.0784, "f1": 0.1404, "f2": 0.0952, "mcc": -0.0084, "accuracy": 0.3467, "tp": 4, "fp": 2, "tn": 22, "fn": 47}, {"fold": "fold_7", "regime": "Inflation bear, AI rally and 2025", "n": 114, "A_sharpe": 0.7451, "A_sortino": 0.7405, "A_excess_sharpe": -2.0999, "A_return_pct": 4.85, "A_hit_rate": 51.75, "A_n": 114, "A_bh_sharpe": 2.845, "A_bh_return_pct": 21.34, "A_psr": 0.6906, "A_ic": 0.0406, "A_precision": 0.625, "A_recall": 0.4478, "A_f1": 0.5217, "A_f2": 0.4747, "A_accuracy": 0.5175, "A_mcc": 0.0646, "A_tp": 30, "A_fp": 18, "A_tn": 29, "A_fn": 37, "B_sharpe": 0.7474, "B_sortino": 0.6942,