{"experiment_num": 63, "backbone": "xgboost", "description": "XGBoost @ LightGBM-exp10 config (depth=4 lr=0.01 n_est=1000 seq=60) - FX paper section 4.5 3-way GBM ensemble setup; matches LGB exp 10 +0.48", "config": {"seq_len": 60, "lr": 0.0003, "batch_size": 32, "epochs": 50, "weight_decay": 1e-05, "patience": 10, "warmup_epochs": 0, "head_dropout": 0.1, "huber_delta": 1.0, "grad_clip": 1.0, "seed": 42, "hidden_size": null, "num_layers": null, "max_depth": 4, "gbm_lr": 0.01, "n_estimators": 1000}, "composite": -0.1275, "test_pos_folds": 5, "val_pos_folds": 4, "val_loss": null, "elapsed_sec": 610.5, "timestamp": "2026-04-27T22:27:24", "sharpe": 0.3544, "val_sharpe": 0.0725, "ic": -0.0019, "hit": 47.18, "psr": 0.7691, "equity": 1260.6999999999998, "return_pct": 26.07, "bh_sharpe": 1.2194, "bh_return_pct": 187.05, "excess_sharpe": -0.865, "B_sharpe": 0.0982, "B_excess_sharpe": -2.73, "B_return_pct": -23.14, "D_sharpe": 0.1735, "D_excess_sharpe": -1.0459, "D_return_pct": 6.05, "precision": 0.5878, "recall": 0.3655, "f1": 0.4507, "f2": 0.3954, "mcc": -0.007, "accuracy": 0.4724, "val_precision": 0.5163, "val_recall": 0.6031, "val_f1": 0.5563, "val_f2": 0.5835, "val_mcc": 0.0299, "val_accuracy": 0.5154, "per_window": [{"fold": "fold_1", "regime": "GFC peak crash (Lehman + Mar-2009 bottom)", "n": 66, "A_sharpe": 1.6289, "A_sortino": 1.9194, "A_excess_sharpe": 1.0568, "A_return_pct": 15.11, "A_hit_rate": 50.0, "A_n": 66, "A_bh_sharpe": 0.5721, "A_bh_return_pct": 3.85, "A_psr": 0.8008, "A_ic": 0.052, "A_precision": 0.5455, "A_recall": 0.3429, "A_f1": 0.4211, "A_f2": 0.3704, "A_accuracy": 0.5, "A_mcc": 0.0215, "A_tp": 12, "A_fp": 10, "A_tn": 21, "A_fn": 23, "B_sharpe": 1.0763, "B_sortino": 1.1438, "B_excess_sharpe": -0.9707, "B_return_pct": 14.92, "B_hit_rate": 50.77, "B_n": 66, "B_bh_sharpe": 2.0469, "B_bh_return_pct": 39.28, "B_psr": 0.7082, "B_ic": 0.2065, "B_precision": 0.5882, "B_recall": 0.2778, "B_f1": 0.3774, "B_f2": 0.3106, "B_accuracy": 0.5, "B_mcc": 0.0506, "B_tp": 10, "B_fp": 7, "B_tn": 23, "B_fn": 26, "D_sharpe": 1.4905, "D_sortino": 1.5227, "D_excess_sharpe": 0.9183, "D_return_pct": 13.57, "D_hit_rate": 54.55, "D_n": 66, "D_bh_sharpe": 0.5721, "D_bh_return_pct": 3.85, "D_psr": 0.7748, "D_ic": 0.2354, "D_precision": 0.6471, "D_recall": 0.3143, "D_f1": 0.4231, "D_f2": 0.3503, "D_accuracy": 0.5455, "D_mcc": 0.1378, "D_tp": 11, "D_fp": 6, "D_tn": 25, "D_fn": 24, "sharpe": 1.6289, "sortino": 1.9194, "return_pct": 15.11, "equity": 1151.1, "max_dd": 0.0, "win_rate": 50.0, "profit_factor": 0.0, "ic": 0.052, "hit": 50.0, "psr": 0.8008, "bh_sharpe": 0.5721, "bh_return_pct": 3.85, "excess_sharpe": 1.0568, "precision": 0.5455, "recall": 0.3429, "f1": 0.4211, "f2": 0.3704, "mcc": 0.0215, "accuracy": 0.5, "tp": 12, "fp": 10, "tn": 21, "fn": 23}, {"fold": "fold_2", "regime": "2011 US-downgrade + EU debt", "n": 87, "A_sharpe": 1.3665, "A_sortino": 1.7871, "A_excess_sharpe": -3.6555, "A_return_pct": 7.24, "A_hit_rate": 48.84, "A_n": 87, "A_bh_sharpe": 5.022, "A_bh_return_pct": 29.23, "A_psr": 0.7993, "A_ic": 0.0107, "A_precision": 0.6, "A_recall": 0.5556, "A_f1": 0.5769, "A_f2": 0.5639, "A_accuracy": 0.4943, "A_mcc": -0.0496, "A_tp": 30, "A_fp": 20, "A_tn": 13, "A_fn": 24, "B_sharpe": 8.5834, "B_sortino": 9.3899, "B_excess_sharpe": -2.5535, "B_return_pct": 137.53, "B_hit_rate": 72.41, "B_n": 87, "B_bh_sharpe": 11.1369, "B_bh_return_pct": 185.4, "B_psr": 1.0, "B_ic": 0.2617, "B_precision": 0.8676, "B_recall": 0.7973, "B_f1": 0.831, "B_f2": 0.8104, "B_accuracy": 0.7241, "B_mcc": 0.0906, "B_tp": 59, "B_fp": 9, "B_tn": 4, "B_fn": 15, "D_sharpe": 4.7752, "D_sortino": 5.8905, "D_excess_sharpe": -0.2468, "D_return_pct": 27.72, "D_hit_rate": 63.95, "D_n": 87, "D_bh_sharpe": 5.022, "D_bh_return_pct": 29.23, "D_psr": 0.9991, "D_ic": 0.117, "D_precision": 0.6618, "D_recall": 0.8333, "D_f1": 0.7377, "D_f2": 0.7923, "D_accuracy": 0.6322, "D_mcc": 0.1601, "D_tp": 45, "D_fp": 23, "D_tn": 10, "D_fn": 9, "sharpe": 1.3665, "sortino": 1.7871, "return_pct": 7.24, "equity": 1072.4, "max_dd": 0.0, "win_rate": 48.84, "profit_factor": 0.0, "ic": 0.0107, "hit": 48.84, "psr": 0.7993, "bh_sharpe": 5.022, "bh_return_pct": 29.23, "excess_sharpe": -3.6555, "precision": 0.6, "recall": 0.5556, "f1": 0.5769, "f2": 0.5639, "mcc": -0.0496, "accuracy": 0.4943, "tp": 30, "fp": 20, "tn": 13, "fn": 24}, {"fold": "fold_3", "regime": "Taper tantrum and 2014 H1", "n": 129, "A_sharpe": 0.4595, "A_sortino": 0.4312, "A_excess_sharpe": -1.3083, "A_return_pct": 2.63, "A_hit_rate": 51.56, "A_n": 129, "A_bh_sharpe": 1.7678, "A_bh_return_pct": 11.76, "A_psr": 0.6272, "A_ic": -0.0325, "A_precision": 0.5806, "A_recall": 0.6923, "A_f1": 0.6316, "A_f2": 0.6667, "A_accuracy": 0.5116, "A_mcc": -0.0789, "A_tp": 54, "A_fp": 39, "A_tn": 12, "A_fn": 24, "B_sharpe": 2.7455, "B_sortino": 2.7, "B_excess_sharpe": -1.5019, "B_return_pct": 37.91, "B_hit_rate": 59.69, "B_n": 129, "B_bh_sharpe": 4.2474, "B_bh_return_pct": 64.1, "B_psr": 0.9721, "B_ic": 0.0079, "B_precision": 0.6471, "B_recall": 0.8049, "B_f1": 0.7174, "B_f2": 0.7674, "B_accuracy": 0.5969, "B_mcc": 0.046, "B_tp": 66, "B_fp": 36, "B_tn": 11, "B_fn": 16, "D_sharpe": 1.3041, "D_sortino": 1.1692, "D_excess_sharpe": -0.4637, "D_return_pct": 8.46, "D_hit_rate": 57.03, "D_n": 129, "D_bh_sharpe": 1.7678, "D_bh_return_pct": 11.76, "D_psr": 0.8159, "D_ic": 0.1201, "D_precision": 0.6078, "D_recall": 0.7949, "D_f1": 0.6889, "D_f2": 0.7488, "D_accuracy": 0.5659, "D_mcc": 0.0127, "D_tp": 62, "D_fp": 40, "D_tn": 11, "D_fn": 16, "sharpe": 0.4595, "sortino": 0.4312, "return_pct": 2.63, "equity": 1026.3, "max_dd": 0.0, "win_rate": 51.56, "profit_factor": 0.0, "ic": -0.0325, "hit": 51.56, "psr": 0.6272, "bh_sharpe": 1.7678, "bh_return_pct": 11.76, "excess_sharpe": -1.3083, "precision": 0.5806, "recall": 0.6923, "f1": 0.6316, "f2": 0.6667, "mcc": -0.0789, "accuracy": 0.5116, "tp": 54, "fp": 39, "tn": 12, "fn": 24}, {"fold": "fold_4", "regime": "China devaluation and oil crash", "n": 108, "A_sharpe": -0.4641, "A_sortino": -0.4303, "A_excess_sharpe": 0.2257, "A_return_pct": -4.85, "A_hit_rate": 50.47, "A_n": 108, "A_bh_sharpe": -0.6898, "A_bh_return_pct": -6.71, "A_psr": 0.3805, "A_ic": 0.0409, "A_precision": 0.5, "A_recall": 0.5283, "A_f1": 0.5138, "A_f2": 0.5224, "A_accuracy": 0.5093, "A_mcc": 0.0192, "A_tp": 28, "A_fp": 28, "A_tn": 27, "A_fn": 25, "B_sharpe": -2.747, "B_sortino": -2.4925, "B_excess_sharpe": -0.7895, "B_return_pct": -42.47, "B_hit_rate": 42.59, "B_n": 108, "B_bh_sharpe": -1.9575, "B_bh_return_pct": -33.56, "B_psr": 0.0327, "B_ic": -0.0612, "B_precision": 0.4035, "B_recall": 0.451, "B_f1": 0.4259, "B_f2": 0.4406, "B_accuracy": 0.4259, "B_mcc": -0.1455, "B_tp": 23, "B_fp": 34, "B_tn": 23, "B_fn": 28, "D_sharpe": -1.3025, "D_sortino": -1.139, "D_excess_sharpe": -0.6127, "D_return_pct": -11.56, "D_hit_rate": 50.47, "D_n": 108, "D_bh_sharpe": -0.6898, "D_bh_return_pct": -6.71, "D_psr": 0.1931, "D_ic": -0.0403, "D_precision": 0.4912, "D_recall": 0.5283, "D_f1": 0.5091, "D_f2": 0.5204, "D_accuracy": 0.5, "D_mcc": 0.001, "D_tp": 28, "D_fp": 29, "D_tn": 26, "D_fn": 25, "sharpe": -0.4641, "sortino": -0.4303, "return_pct": -4.85, "equity": 951.5, "max_dd": 0.0, "win_rate": 50.47, "profit_factor": 0.0, "ic": 0.0409, "hit": 50.47, "psr": 0.3805, "bh_sharpe": -0.6898, "bh_return_pct": -6.71, "excess_sharpe": 0.2257, "precision": 0.5, "recall": 0.5283, "f1": 0.5138, "f2": 0.5224, "mcc": 0.0192, "accuracy": 0.5093, "tp": 28, "fp": 28, "tn": 27, "fn": 25}, {"fold": "fold_5", "regime": "2018 Vol-mageddon + Q4 sell-off", "n": 128, "A_sharpe": 0.6869, "A_sortino": 0.7855, "A_excess_sharpe": -0.4642, "A_return_pct": 7.08, "A_hit_rate": 47.66, "A_n": 128, "A_bh_sharpe": 1.1511, "A_bh_return_pct": 13.19, "A_psr": 0.6893, "A_ic": -0.0353, "A_precision": 0.5873, "A_recall": 0.4744, "A_f1": 0.5248, "A_f2": 0.4933, "A_accuracy": 0.4766, "A_mcc": -0.0445, "A_tp": 37, "A_fp": 26, "A_tn": 24, "A_fn": 41, "B_sharpe": -3.9018, "B_sortino": -3.7719, "B_excess_sharpe": -6.7137, "B_return_pct": -61.46, "B_hit_rate": 33.86, "B_n": 128, "B_bh_sharpe": 2.8119, "B_bh_return_pct": 82.25, "B_psr": 0.003, "B_ic": -0.1337, "B_precision": 0.5098, "B_recall": 0.3059, "B_f1": 0.3824, "B_f2": 0.3325, "B_accuracy": 0.3438, "B_mcc": -0.2658, "B_tp": 26, "B_fp": 25, "B_tn": 18, "B_fn": 59, "D_sharpe": -1.6526, "D_sortino": -1.7625, "D_excess_sharpe": -2.8037, "D_return_pct": -19.09, "D_hit_rate": 41.41, "D_n": 128, "D_bh_sharpe": 1.1511, "D_bh_return_pct": 13.19, "D_psr": 0.1285, "D_ic": -0.077, "D_precision": 0.5294, "D_recall": 0.3462, "D_f1": 0.4186, "D_f2": 0.3719, "D_accuracy": 0.4141, "D_mcc": -0.1334, "D_tp": 27, "D_fp": 24, "D_tn": 26, "D_fn": 51, "sharpe": 0.6869, "sortino": 0.7855, "return_pct": 7.08, "equity": 1070.8, "max_dd": 0.0, "win_rate": 47.66, "profit_factor": 0.0, "ic": -0.0353, "hit": 47.66, "psr": 0.6893, "bh_sharpe": 1.1511, "bh_return_pct": 13.19, "excess_sharpe": -0.4642, "precision": 0.5873, "recall": 0.4744, "f1": 0.5248, "f2": 0.4933, "mcc": -0.0445, "accuracy": 0.4766, "tp": 37, "fp": 26, "tn": 24, "fn": 41}, {"fold": "fold_6", "regime": "COVID crash and V-recovery", "n": 173, "A_sharpe": 0.661, "A_sortino": 0.6767, "A_excess_sharpe": -1.665, "A_return_pct": 9.4, "A_hit_rate": 50.29, "A_n": 173, "A_bh_sharpe": 2.3261, "A_bh_return_pct": 43.81, "A_psr": 0.7068, "A_ic": 0.023, "A_precision": 0.7015, "A_recall": 0.4159, "A_f1": 0.5222, "A_f2": 0.4528, "A_accuracy": 0.5029, "A_mcc": 0.0807, "A_tp": 47, "A_fp": 20, "A_tn": 40, "A_fn": 66, "B_sharpe": 0.1337, "B_sortino": 0.1485, "B_excess_sharpe": -5.6123, "B_return_pct": -3.99, "B_hit_rate": 46.51, "B_n": 173, "B_bh_sharpe": 5.746, "B_bh_return_pct": 499.04, "B_psr": 0.5441, "B_ic": 0.0807, "B_precision": 0.6557, "B_recall": 0.3604, "B_f1": 0.4651, "B_f2": 0.396, "B_accuracy": 0.4682, "B_mcc": 0.0217, "B_tp": 40, "B_fp": 21, "B_tn": 41, "B_fn": 71, "D_sharpe": -0.1948, "D_sortino": -0.2165, "D_excess_sharpe": -2.5209, "D_return_pct": -5.13, "D_hit_rate": 45.66, "D_n": 173, "D_bh_sharpe": 2.3261, "D_bh_return_pct": 43.81, "D_psr": 0.4363, "D_ic": -0.0196, "D_precision": 0.6557, "D_recall": 0.354, "D_f1": 0.4598, "D_f2": 0.3899, "D_accuracy": 0.4566, "D_mcc": 0.004, "D_tp": 40, "D_fp": 21, "D_tn": 39, "D_fn": 73, "sharpe": 0.661, "sortino": 0.6767, "return_pct": 9.4, "equity": 1094.0, "max_dd": 0.0, "win_rate": 50.29, "profit_factor": 0.0, "ic": 0.023, "hit": 50.29, "psr": 0.7068, "bh_sharpe": 2.3261, "bh_return_pct": 43.81, "excess_sharpe": -1.665, "precision": 0.7015, "recall": 0.4159, "f1": 0.5222, "f2": 0.4528, "mcc": 0.0807, "accuracy": 0.5029, "tp": 47, "fp": 20, "tn": 40, "fn": 66}, {"fold": "fold_7", "regime": "Inflation bear, AI rally and 2025", "n": 376, "A_sharpe": -0.2284, "A_sortino": -0.2887, "A_excess_sharpe": -1.0317, "A_return_pct": -10.73, "A_hit_rate": 42.29, "A_n": 376, "A_bh_sharpe": 0.8033, "A_bh_return_pct": 26.02, "A_psr": 0.3917, "A_ic": -0.0132, "A_precision": 0.5476, "A_recall": 0.1041, "A_f1": 0.1749, "A_f2": 0.1242, "A_accuracy": 0.4229, "A_mcc": -0.0289, "A_tp": 23, "A_fp": 19, "A_tn": 136, "A_fn": 198, "B_sharpe": 0.1704, "B_sortino": 0.1936, "B_excess_sharpe": -1.7613, "B_return_pct": -4.09, "B_hit_rate": 45.33, "B_n": 376, "B_bh_sharpe": 1.9317, "B_bh_return_pct": 222.05, "B_psr": 0.5826, "B_ic": -0.0156, "B_precision": 0.7619, "B_recall": 0.141, "B_f1": 0.2379, "B_f2": 0.1684, "B_accuracy": 0.4548, "B_mcc": 0.1147, "B_tp": 32, "B_fp": 10, "B_tn": 139, "B_fn": 195, "D_sharpe": 0.0892, "D_sortino": 0.1184, "D_excess_sharpe": -0.7141, "D_return_pct": -0.7, "D_hit_rate": 41.76, "D_n": 376, "D_bh_sharpe": 0.8033, "D_bh_return_pct": 26.02, "D_psr": 0.5436, "D_ic": -0.0333, "D_precision": 0.5238, "D_recall": 0.0995, "D_f1": 0.1673, "D_f2": 0.1188, "D_accuracy": 0.4176, "D_mcc": -0.0461, "D_tp": 22, "D_fp": 20, "D_tn": 135, "D_fn": 199, "sharpe": -0.2284, "sortino": -0.2887, "return_pct": -10.73, "equity": 892.7, "max_dd": 0.0, "win_rate": 42.29, "profit_factor": 0.0, "ic": -0.0132, "hit": 42.29, "psr": 0.3917, "bh_sharpe": 0.8033, "bh_return_pct": 26.02, "excess_sharpe": -1.0317, "precision": 0.5476, "recall": 0.1041, "f1": 0.1749, "f2": 0.1242, "mcc": -0.0289, "accuracy": 0.4229, "tp": 23, "fp": 19, "tn": 136, "fn": 198}], "per_window_val": [{"fold": "fold_1", "regime": "GFC peak crash (Lehman + Mar-2009 bottom)", "n": 65, "A_sharpe": -1.7158, "A_sortino": -1.5294, "A_excess_sharpe": 0.5098, "A_return_pct": -15.12, "A_hit_rate": 46.03, "A_n": 65, "A_bh_sharpe": -2.2257, "A_bh_return_pct": -18.74, "A_psr": 0.1848, "A_ic": 0.0075, "A_precision": 0.4423, "A_recall": 0.7931, "A_f1": 0.5679, "A_f2": 0.6845, "A_accuracy": 0.4615, "A_mcc": -0.0155, "A_tp": 23, "A_fp": 29, "A_tn": 7, "A_fn": 6, "B_sharpe": -3.3387, "B_sortino": -3.0849, "B_excess_sharpe": 3.7836, "B_return_pct": -50.09, "B_hit_rate": 41.54, "B_n": 65, "B_bh_sharpe": -7.1223, "B_bh_return_pct": -73.11, "B_psr": 0.0471, "B_ic": 0.3278, "B_precision": 0.377, "B_recall": 1.0, "B_f1": 0.5476, "B_f2": 0.7516, "B_accuracy": 0.4154, "B_mcc": 0.1895, "B_tp": 23, "B_fp": 38, "B_tn": 4, "B_fn": 0, "D_sharpe": 0.7364, "D_sortino": 0.7507, "D_excess_sharpe": 2.962, "D_return_pct": 5.08, "D_hit_rate": 52.38, "D_n": 65, "D_bh_sharpe": -2.2257, "D_bh_return_pct": -18.74, "D_psr": 0.6459, "D_ic": 0.3219, "D_precision": 0.4754, "D_recall": 1.0, "D_f1": 0.6444, "D_f2": 0.8192, "D_accuracy": 0.5077, "D_mcc": 0.2298, "D_tp": 29, "D_fp": 32, "D_tn": 4, "D_fn": 0, "sharpe": -1.7158, "sortino": -1.5294, "return_pct": -15.12, "equity": 848.8, "max_dd": 0.0, "win_rate": 46.03, "profit_factor": 0.0, "ic": 0.0075, "hit": 46.03, "psr": 0.1848, "bh_sharpe": -2.2257, "bh_return_pct": -18.74, "excess_sharpe": 0.5098, "precision": 0.4423, "recall": 0.7931, "f1": 0.5679, "f2": 0.6845, "mcc": -0.0155, "accuracy": 0.4615, "tp": 23, "fp": 29, "tn": 7, "fn": 6}, {"fold": "fold_2", "regime": "2011 US-downgrade + EU debt", "n": 47, "A_sharpe": 2.2916, "A_sortino": 2.1736, "A_excess_sharpe": 2.4857, "A_return_pct": 14.52, "A_hit_rate": 59.57, "A_n": 47, "A_bh_sharpe": -0.1941, "A_bh_return_pct": -2.36, "A_psr": 0.8288, "A_ic": 0.0428, "A_precision": 0.6061, "A_recall": 0.7692, "A_f1": 0.678, "A_f2": 0.7299, "A_accuracy": 0.5957, "A_mcc": 0.1633, "A_tp": 20, "A_fp": 13, "A_tn": 8, "A_fn": 6, "B_sharpe": 0.8188, "B_sortino": 0.7147, "B_excess_sharpe": 2.4311, "B_return_pct": 6.27, "B_hit_rate": 57.45, "B_n": 47, "B_bh_sharpe": -1.6123, "B_bh_return_pct": -24.3, "B_psr": 0.6346, "B_ic": 0.224, "B_precision": 0.5122, "B_recall": 1.0, "B_f1": 0.6774, "B_f2": 0.84, "B_accuracy": 0.5745, "B_mcc": 0.3438, "B_tp": 21, "B_fp": 20, "B_tn": 6, "B_fn": 0, "D_sharpe": 1.8475, "D_sortino": 1.7063, "D_excess_sharpe": 2.0416, "D_return_pct": 11.36, "D_hit_rate": 59.57, "D_n": 47, "D_bh_sharpe": -0.1941, "D_bh_return_pct": -2.36, "D_psr": 0.7795, "D_ic": 0.0553, "D_precision": 0.5854, "D_recall": 0.9231, "D_f1": 0.7164, "D_f2": 0.8276, "D_accuracy": 0.5957, "D_mcc": 0.1692, "D_tp": 24, "D_fp": 17, "D_tn": 4, "D_fn": 2, "sharpe": 2.2916, "sortino": 2.1736, "return_pct": 14.52, "equity": 1145.2, "max_dd": 0.0, "win_rate": 59.57, "profit_factor": 0.0, "ic": 0.0428, "hit": 59.57, "psr": 0.8288, "bh_sharpe": -0.1941, "bh_return_pct": -2.36, "excess_sharpe": 2.4857, "precision": 0.6061, "recall": 0.7692, "f1": 0.678, "f2": 0.7299, "mcc": 0.1633, "accuracy": 0.5957, "tp": 20, "fp": 13, "tn": 8, "fn": 6}, {"fold": "fold_3", "regime": "Taper tantrum and 2014 H1", "n": 5, "A_sharpe": 5.9118, "A_sortino": 4.2395, "A_excess_sharpe": 7.2312, "A_return_pct": 0.0, "A_hit_rate": 0.0, "A_n": 5, "A_bh_sharpe": -1.3194, "A_bh_return_pct": -0.21, "A_psr": 0.759, "A_ic": 0.7, "A_precision": 1.0, "A_recall": 0.5, "A_f1": 0.6667, "A_f2": 0.5556, "A_accuracy": 0.8, "A_mcc": 0.6124, "A_tp": 1, "A_fp": 0, "A_tn": 3, "A_fn": 1, "B_sharpe": 25.8705, "B_sortino": 0.0, "B_excess_sharpe": 51.7411, "B_return_pct": 3.95, "B_hit_rate": 100.0, "B_n": 5, "B_bh_sharpe": -25.8705, "B_bh_return_pct": -3.84, "B_psr": 1.0, "B_ic": -0.2, "B_precision": 0.0, "B_recall": 0.0, "B_f1": 0.0, "B_f2": 0.0, "B_accuracy": 1.0, "B_mcc": 0.0, "B_tp": 0, "B_fp": 0, "B_tn": 5, "B_fn": 0, "D_sharpe": 1.3194, "D_sortino": 1.268, "D_excess_sharpe": 2.6388, "D_return_pct": 0.2, "D_hit_rate": 60.0, "D_n": 5, "D_bh_sharpe": -1.3194, "D_bh_return_pct": -0.21, "D_psr": 0.5663, "D_ic": -0.3, "D_precision": 0.0, "D_recall": 0.0, "D_f1": 0.0, "D_f2": 0.0, "D_accuracy": 0.6, "D_mcc": 0.0, "D_tp": 0, "D_fp": 0, "D_tn": 3, "D_fn": 2, "sharpe": 5.9118, "sortino": 4.2395, "return_pct": 0.0, "equity": 1000.0, "max_dd": 0.0, "win_rate": 0.0, "profit_factor": 0.0, "ic": 0.7, "hit": 0.0, "psr": 0.759, "bh_sharpe": -1.3194, "bh_return_pct": -0.21, "excess_sharpe": 7.2312, "precision": 1.0, "recall": 0.5, "f1": 0.6667, "f2": 0.5556, "mcc": 0.6124, "accuracy": 0.8, "tp": 1, "fp": 0, "tn": 3, "fn": 1}, {"fold": "fold_4", "regime": "China devaluation and oil crash", "n": 47, "A_sharpe": 0.0885, "A_sortino": 0.0846, "A_excess_sharpe": 1.9123, "A_return_pct": -0.17, "A_hit_rate": 51.06, "A_n": 47, "A_bh_sharpe": -1.8238, "A_bh_return_pct": -8.68, "A_psr": 0.5151, "A_ic": 0.0058, "A_precision": 0.475, "A_recall": 0.9048, "A_f1": 0.623, "A_f2": 0.7661, "A_accuracy": 0.5106, "A_mcc": 0.1356, "A_tp": 19, "A_fp": 21, "A_tn": 5, "A_fn": 2, "B_sharpe": 0.091, "B_sortino": 0.0825, "B_excess_sharpe": 2.311, "B_return_pct": -2.3, "B_hit_rate": 48.94, "B_n": 47, "B_bh_sharpe": -2.22, "B_bh_return_pct": -23.98, "B_psr": 0.5155, "B_ic": 0.5767, "B_precision": 0.4651, "B_recall": 0.9524, "B_f1": 0.625, "B_f2": 0.7874, "B_accuracy": 0.4894, "B_mcc": 0.1207, "B_tp": 20, "B_fp": 23, "B_tn": 3, "B_fn": 1, "D_sharpe": -0.9318, "D_sortino": -0.943, "D_excess_sharpe": 0.892, "D_return_pct": -4.83, "D_hit_rate": 44.68, "D_n": 47, "D_bh_sharpe": -1.8238, "D_bh_return_pct": -8.68, "D_psr": 0.3457, "D_ic": 0.2362, "D_precision": 0.4419, "D_recall": 0.9048, "D_f1": 0.5938, "D_f2": 0.748, "D_accuracy": 0.4468, "D_mcc": -0.0326, "D_tp": 19, "D_fp": 24, "D_tn": 2, "D_fn": 2, "sharpe": 0.0885, "sortino": 0.0846, "return_pct": -0.17, "equity": 998.3, "max_dd": 0.0, "win_rate": 51.06, "profit_factor": 0.0, "ic": 0.0058, "hit": 51.06, "psr": 0.5151, "bh_sharpe": -1.8238, "bh_return_pct": -8.68, "excess_sharpe": 1.9123, "precision": 0.475, "recall": 0.9048, "f1": 0.623, "f2": 0.7661, "mcc": 0.1356, "accuracy": 0.5106, "tp": 19, "fp": 21, "tn": 5, "fn": 2}, {"fold": "fold_5", "regime": "2018 Vol-mageddon + Q4 sell-off", "n": 5, "A_sharpe": -10.1368, "A_sortino": -6.9937, "A_excess_sharpe": 0.0, "A_return_pct": -3.15, "A_hit_rate": 40.0, "A_n": 5, "A_bh_sharpe": -10.1368, "A_bh_return_pct": -3.15, "A_psr": 0.0985, "A_ic": -0.2, "A_precision": 0.4, "A_recall": 1.0, "A_f1": 0.5714, "A_f2": 0.7692, "A_accuracy": 0.4, "A_mcc": 0.0, "A_tp": 2, "A_fp": 3, "A_tn": 0, "A_fn": 0, "B_sharpe": 5.6858, "B_sortino": 6.0578, "B_excess_sharpe": 0.0, "B_return_pct": 4.22, "B_hit_rate": 60.0, "B_n": 5, "B_bh_sharpe": 5.6858, "B_bh_return_pct": 4.22, "B_psr": 0.753, "B_ic": 0.6, "B_precision": 0.6, "B_recall": 1.0, "B_f1": 0.75, "B_f2": 0.8824, "B_accuracy": 0.6, "B_mcc": 0.0, "B_tp": 3, "B_fp": 2, "B_tn": 0, "B_fn": 0, "D_sharpe": -10.1368, "D_sortino": -6.9937, "D_excess_sharpe": 0.0, "D_return_pct": -3.15, "D_hit_rate": 40.0, "D_n": 5, "D_bh_sharpe": -10.1368, "D_bh_return_pct": -3.15, "D_psr": 0.0985, "D_ic": 0.3, "D_precision": 0.4, "D_recall": 1.0, "D_f1": 0.5714, "D_f2": 0.7692, "D_accuracy": 0.4, "D_mcc": 0.0, "D_tp": 2, "D_fp": 3, "D_tn": 0, "D_fn": 0, "sharpe": -10.1368, "sortino": -6.9937, "return_pct": -3.15, "equity": 968.5, "max_dd": 0.0, "win_rate": 40.0, "profit_factor": 0.0, "ic": -0.2, "hit": 40.0, "psr": 0.0985, "bh_sharpe": -10.1368, "bh_return_pct": -3.15, "excess_sharpe": 0.0, "precision": 0.4, "recall": 1.0, "f1": 0.5714, "f2": 0.7692, "mcc": 0.0, "accuracy": 0.4, "tp": 2, "fp": 3, "tn": 0, "fn": 0}, {"fold": "fold_6", "regime": "COVID crash and V-recovery", "n": 26, "A_sharpe": 5.8335, "A_sortino": 8.1689, "A_excess_sharpe": 2.5483, "A_return_pct": 8.43, "A_hit_rate": 53.85, "A_n": 26, "A_bh_sharpe": 3.2852, "A_bh_return_pct": 4.82, "A_psr": 0.9701, "A_ic": 0.3032, "A_precision": 0.6, "A_recall": 0.75, "A_f1": 0.6667, "A_f2": 0.7143, "A_accuracy": 0.5385, "A_mcc": -0.0577, "A_tp": 12, "A_fp": 8, "A_tn": 2, "A_fn": 4, "B_sharpe": 4.762, "B_sortino": 4.2141, "B_excess_sharpe": -8.2172, "B_return_pct": 15.7, "B_hit_rate": 69.23, "B_n": 26, "B_bh_sharpe": 12.9792, "B_bh_return_pct": 38.76, "B_psr": 0.9218, "B_ic": 0.3983, "B_precision": 1.0, "B_recall": 0.619, "B_f1": 0.7647, "B_f2": 0.6701, "B_accuracy": 0.6923, "B_mcc": 0.488, "B_tp": 13, "B_fp": 0, "B_tn": 5, "B_fn": 8, "D_sharpe": 4.5323, "D_sortino": 6.3276, "D_excess_sharpe": 1.2471, "D_return_pct": 6.63, "D_hit_rate": 50.0, "D_n": 26, "D_bh_sharpe": 3.2852, "D_bh_return_pct": 4.82, "D_psr": 0.9313, "D_ic": 0.2978, "D_precision": 0.6154, "D_recall": 0.5, "D_f1": 0.5517, "D_f2": 0.5195, "D_accuracy": 0.5, "D_mcc": 0.0, "D_tp": 8, "D_fp": 5, "D_tn": 5, "D_fn": 8, "sharpe": 5.8335, "sortino": 8.1689, "return_pct": 8.43, "equity": 1084.3, "max_dd": 0.0, "win_rate": 53.85, "profit_factor": 0.0, "ic": 0.3032, "hit": 53.85, "psr": 0.9701, "bh_sharpe": 3.2852, "bh_return_pct": 4.82, "excess_sharpe": 2.5483, "precision": 0.6, "recall": 0.75, "f1": 0.6667, "f2": 0.7143, "mcc": -0.0577, "accuracy": 0.5385, "tp": 12, "fp": 8, "tn": 2, "fn": 4}, {"fold": "fold_7", "regime": "Inflation bear, AI rally and 2025", "n": 65, "A_sharpe": -1.0439, "A_sortino": -0.9697, "A_excess_sharpe": -3.1228, "A_return_pct": -4.33, "A_hit_rate": 49.23, "A_n": 65, "A_bh_sharpe": 2.0789, "A_bh_return_pct": 8.17, "A_psr": 0.2979, "A_ic": 0.0384, "A_precision": 1.0, "A_recall": 0.0571, "A_f1": 0.1081, "A_f2": 0.0704, "A_accuracy": 0.4923, "A_mcc": 0.165, "A_tp": 2, "A_fp": 0, "A_tn": 30, "A_fn": 33, "B_sharpe": -5.2314, "B_sortino": -4.8393, "B_excess_sharpe": -10.4628, "B_return_pct": -32.36, "B_hit_rate": 32.31, "B_n": 65, "B_bh_sharpe": 5.2314, "B_bh_return_pct": 44.53, "B_psr": 0.0054, "B_ic": 0.1777, "B_precision": 0.0, "B_recal