{"experiment_num": 66, "backbone": "lstm", "description": "LSTM @ exp 8 huber_delta=0.1 (F1-fix delta from MLP exp 65 finding) - test if cell-state recurrence handles F1/F2 tradeoff better than MLP flatten", "config": {"seq_len": 10, "lr": 0.001, "batch_size": 16, "epochs": 100, "weight_decay": 0.0007, "patience": 15, "warmup_epochs": 0, "head_dropout": 0.1, "huber_delta": 0.1, "grad_clip": 1.0, "seed": 0, "hidden_size": null, "num_layers": null, "max_depth": null, "gbm_lr": null, "n_estimators": null}, "composite": -0.3267, "test_pos_folds": 5, "val_pos_folds": 2, "val_loss": -2.883470052008283, "elapsed_sec": 85.8, "timestamp": "2026-04-27T22:54:56", "sharpe": 0.1044, "val_sharpe": -0.1267, "ic": 0.0215, "hit": 48.19, "psr": 0.5976, "equity": 954.4, "return_pct": -4.56, "bh_sharpe": 0.6042, "bh_return_pct": 103.49, "excess_sharpe": -0.4999, "B_sharpe": 0.3374, "B_excess_sharpe": -1.3634, "B_return_pct": 23.46, "D_sharpe": 0.1044, "D_excess_sharpe": -0.4999, "D_return_pct": -4.56, "precision": 0.5605, "recall": 0.4362, "f1": 0.4906, "f2": 0.4564, "mcc": -0.0214, "accuracy": 0.4816, "val_precision": 0.543, "val_recall": 0.4225, "val_f1": 0.4752, "val_f2": 0.4421, "val_mcc": -0.0208, "val_accuracy": 0.4823, "per_window": [{"fold": "fold_1", "regime": "GFC peak crash (Lehman + Mar-2009 bottom)", "n": 115, "A_sharpe": 1.6062, "A_sortino": 1.6208, "A_excess_sharpe": 2.0503, "A_return_pct": 35.59, "A_hit_rate": 56.52, "A_n": 115, "A_bh_sharpe": -0.4441, "A_bh_return_pct": -14.4, "A_psr": 0.8604, "A_ic": 0.0972, "A_precision": 0.5294, "A_recall": 0.6667, "A_f1": 0.5902, "A_f2": 0.6338, "A_accuracy": 0.5652, "A_mcc": 0.1442, "A_tp": 36, "A_fp": 32, "A_tn": 29, "A_fn": 18, "B_sharpe": 1.8309, "B_sortino": 1.9366, "B_excess_sharpe": 2.1288, "B_return_pct": 76.95, "B_hit_rate": 55.26, "B_n": 115, "B_bh_sharpe": -0.2978, "B_bh_return_pct": -27.23, "B_psr": 0.8917, "B_ic": 0.1008, "B_precision": 0.55, "B_recall": 0.7458, "B_f1": 0.6331, "B_f2": 0.6962, "B_accuracy": 0.5565, "B_mcc": 0.1118, "B_tp": 44, "B_fp": 36, "B_tn": 20, "B_fn": 15, "D_sharpe": 1.6062, "D_sortino": 1.6208, "D_excess_sharpe": 2.0503, "D_return_pct": 35.59, "D_hit_rate": 56.52, "D_n": 115, "D_bh_sharpe": -0.4441, "D_bh_return_pct": -14.4, "D_psr": 0.8604, "D_ic": 0.0972, "D_precision": 0.5294, "D_recall": 0.6667, "D_f1": 0.5902, "D_f2": 0.6338, "D_accuracy": 0.5652, "D_mcc": 0.1442, "D_tp": 36, "D_fp": 32, "D_tn": 29, "D_fn": 18, "sharpe": 1.6062, "sortino": 1.6208, "return_pct": 35.59, "equity": 1355.9, "max_dd": 0.0, "win_rate": 56.52, "profit_factor": 0.0, "ic": 0.0972, "hit": 56.52, "psr": 0.8604, "bh_sharpe": -0.4441, "bh_return_pct": -14.4, "excess_sharpe": 2.0503, "precision": 0.5294, "recall": 0.6667, "f1": 0.5902, "f2": 0.6338, "mcc": 0.1442, "accuracy": 0.5652, "tp": 36, "fp": 32, "tn": 29, "fn": 18}, {"fold": "fold_2", "regime": "2011 US-downgrade + EU debt", "n": 136, "A_sharpe": 0.2812, "A_sortino": 0.3087, "A_excess_sharpe": -1.4516, "A_return_pct": 2.0, "A_hit_rate": 46.67, "A_n": 136, "A_bh_sharpe": 1.7327, "A_bh_return_pct": 19.75, "A_psr": 0.5818, "A_ic": 0.0114, "A_precision": 0.5352, "A_recall": 0.4872, "A_f1": 0.5101, "A_f2": 0.4961, "A_accuracy": 0.4632, "A_mcc": -0.081, "A_tp": 38, "A_fp": 33, "A_tn": 25, "A_fn": 40, "B_sharpe": 1.5893, "B_sortino": 1.6925, "B_excess_sharpe": -2.4767, "B_return_pct": 39.45, "B_hit_rate": 52.94, "B_n": 136, "B_bh_sharpe": 4.0659, "B_bh_return_pct": 148.68, "B_psr": 0.8789, "B_ic": 0.0961, "B_precision": 0.6818, "B_recall": 0.625, "B_f1": 0.6522, "B_f2": 0.6356, "B_accuracy": 0.5294, "B_mcc": -0.0715, "B_tp": 60, "B_fp": 28, "B_tn": 12, "B_fn": 36, "D_sharpe": 0.2812, "D_sortino": 0.3087, "D_excess_sharpe": -1.4516, "D_return_pct": 2.0, "D_hit_rate": 46.67, "D_n": 136, "D_bh_sharpe": 1.7327, "D_bh_return_pct": 19.75, "D_psr": 0.5818, "D_ic": 0.0114, "D_precision": 0.5352, "D_recall": 0.4872, "D_f1": 0.5101, "D_f2": 0.4961, "D_accuracy": 0.4632, "D_mcc": -0.081, "D_tp": 38, "D_fp": 33, "D_tn": 25, "D_fn": 40, "sharpe": 0.2812, "sortino": 0.3087, "return_pct": 2.0, "equity": 1020.0, "max_dd": 0.0, "win_rate": 46.67, "profit_factor": 0.0, "ic": 0.0114, "hit": 46.67, "psr": 0.5818, "bh_sharpe": 1.7327, "bh_return_pct": 19.75, "excess_sharpe": -1.4516, "precision": 0.5352, "recall": 0.4872, "f1": 0.5101, "f2": 0.4961, "mcc": -0.081, "accuracy": 0.4632, "tp": 38, "fp": 33, "tn": 25, "fn": 40}, {"fold": "fold_3", "regime": "Taper tantrum and 2014 H1", "n": 178, "A_sharpe": 1.5587, "A_sortino": 1.7405, "A_excess_sharpe": 0.2141, "A_return_pct": 14.62, "A_hit_rate": 53.67, "A_n": 178, "A_bh_sharpe": 1.3445, "A_bh_return_pct": 12.41, "A_psr": 0.91, "A_ic": 0.109, "A_precision": 0.6265, "A_recall": 0.5049, "A_f1": 0.5591, "A_f2": 0.5253, "A_accuracy": 0.5393, "A_mcc": 0.0906, "A_tp": 52, "A_fp": 31, "A_tn": 44, "A_fn": 51, "B_sharpe": 3.1537, "B_sortino": 3.1526, "B_excess_sharpe": 0.1054, "B_return_pct": 75.09, "B_hit_rate": 60.11, "B_n": 178, "B_bh_sharpe": 3.0483, "B_bh_return_pct": 71.83, "B_psr": 0.9949, "B_ic": 0.1446, "B_precision": 0.6696, "B_recall": 0.6881, "B_f1": 0.6787, "B_f2": 0.6843, "B_accuracy": 0.6011, "B_mcc": 0.1532, "B_tp": 75, "B_fp": 37, "B_tn": 32, "B_fn": 34, "D_sharpe": 1.5587, "D_sortino": 1.7405, "D_excess_sharpe": 0.2141, "D_return_pct": 14.62, "D_hit_rate": 53.67, "D_n": 178, "D_bh_sharpe": 1.3445, "D_bh_return_pct": 12.41, "D_psr": 0.91, "D_ic": 0.109, "D_precision": 0.6265, "D_recall": 0.5049, "D_f1": 0.5591, "D_f2": 0.5253, "D_accuracy": 0.5393, "D_mcc": 0.0906, "D_tp": 52, "D_fp": 31, "D_tn": 44, "D_fn": 51, "sharpe": 1.5587, "sortino": 1.7405, "return_pct": 14.62, "equity": 1146.1999999999998, "max_dd": 0.0, "win_rate": 53.67, "profit_factor": 0.0, "ic": 0.109, "hit": 53.67, "psr": 0.91, "bh_sharpe": 1.3445, "bh_return_pct": 12.41, "excess_sharpe": 0.2141, "precision": 0.6265, "recall": 0.5049, "f1": 0.5591, "f2": 0.5253, "mcc": 0.0906, "accuracy": 0.5393, "tp": 52, "fp": 31, "tn": 44, "fn": 51}, {"fold": "fold_4", "regime": "China devaluation and oil crash", "n": 157, "A_sharpe": 0.5152, "A_sortino": 0.5111, "A_excess_sharpe": 0.5054, "A_return_pct": 5.18, "A_hit_rate": 49.36, "A_n": 157, "A_bh_sharpe": 0.0098, "A_bh_return_pct": -1.05, "A_psr": 0.6566, "A_ic": 0.1165, "A_precision": 0.5056, "A_recall": 0.5556, "A_f1": 0.5294, "A_f2": 0.5448, "A_accuracy": 0.4904, "A_mcc": -0.0236, "A_tp": 45, "A_fp": 44, "A_tn": 32, "A_fn": 36, "B_sharpe": 3.3654, "B_sortino": 3.6741, "B_excess_sharpe": 3.3495, "B_return_pct": 132.06, "B_hit_rate": 58.6, "B_n": 157, "B_bh_sharpe": 0.0159, "B_bh_return_pct": -5.48, "B_psr": 0.996, "B_ic": 0.2798, "B_precision": 0.5943, "B_recall": 0.7412, "B_f1": 0.6597, "B_f2": 0.7063, "B_accuracy": 0.586, "B_mcc": 0.1532, "B_tp": 63, "B_fp": 43, "B_tn": 29, "B_fn": 22, "D_sharpe": 0.5152, "D_sortino": 0.5111, "D_excess_sharpe": 0.5054, "D_return_pct": 5.18, "D_hit_rate": 49.36, "D_n": 157, "D_bh_sharpe": 0.0098, "D_bh_return_pct": -1.05, "D_psr": 0.6566, "D_ic": 0.1165, "D_precision": 0.5056, "D_recall": 0.5556, "D_f1": 0.5294, "D_f2": 0.5448, "D_accuracy": 0.4904, "D_mcc": -0.0236, "D_tp": 45, "D_fp": 44, "D_tn": 32, "D_fn": 36, "sharpe": 0.5152, "sortino": 0.5111, "return_pct": 5.18, "equity": 1051.8000000000002, "max_dd": 0.0, "win_rate": 49.36, "profit_factor": 0.0, "ic": 0.1165, "hit": 49.36, "psr": 0.6566, "bh_sharpe": 0.0098, "bh_return_pct": -1.05, "excess_sharpe": 0.5054, "precision": 0.5056, "recall": 0.5556, "f1": 0.5294, "f2": 0.5448, "mcc": -0.0236, "accuracy": 0.4904, "tp": 45, "fp": 44, "tn": 32, "fn": 36}, {"fold": "fold_5", "regime": "2018 Vol-mageddon + Q4 sell-off", "n": 177, "A_sharpe": 0.4218, "A_sortino": 0.4303, "A_excess_sharpe": 0.112, "A_return_pct": 5.09, "A_hit_rate": 50.85, "A_n": 177, "A_bh_sharpe": 0.3098, "A_bh_return_pct": 3.19, "A_psr": 0.638, "A_ic": 0.0705, "A_precision": 0.5976, "A_recall": 0.4757, "A_f1": 0.5297, "A_f2": 0.496, "A_accuracy": 0.5085, "A_mcc": 0.0295, "A_tp": 49, "A_fp": 33, "A_tn": 41, "A_fn": 54, "B_sharpe": -0.6552, "B_sortino": -0.6862, "B_excess_sharpe": -1.5469, "B_return_pct": -25.09, "B_hit_rate": 43.75, "B_n": 177, "B_bh_sharpe": 0.8917, "B_bh_return_pct": 23.8, "B_psr": 0.2923, "B_ic": 0.0172, "B_precision": 0.5581, "B_recall": 0.4404, "B_f1": 0.4923, "B_f2": 0.4598, "B_accuracy": 0.4407, "B_mcc": -0.1153, "B_tp": 48, "B_fp": 38, "B_tn": 30, "B_fn": 61, "D_sharpe": 0.4218, "D_sortino": 0.4303, "D_excess_sharpe": 0.112, "D_return_pct": 5.09, "D_hit_rate": 50.85, "D_n": 177, "D_bh_sharpe": 0.3098, "D_bh_return_pct": 3.19, "D_psr": 0.638, "D_ic": 0.0705, "D_precision": 0.5976, "D_recall": 0.4757, "D_f1": 0.5297, "D_f2": 0.496, "D_accuracy": 0.5085, "D_mcc": 0.0295, "D_tp": 49, "D_fp": 33, "D_tn": 41, "D_fn": 54, "sharpe": 0.4218, "sortino": 0.4303, "return_pct": 5.09, "equity": 1050.8999999999999, "max_dd": 0.0, "win_rate": 50.85, "profit_factor": 0.0, "ic": 0.0705, "hit": 50.85, "psr": 0.638, "bh_sharpe": 0.3098, "bh_return_pct": 3.19, "excess_sharpe": 0.112, "precision": 0.5976, "recall": 0.4757, "f1": 0.5297, "f2": 0.496, "mcc": 0.0295, "accuracy": 0.5085, "tp": 49, "fp": 33, "tn": 41, "fn": 54}, {"fold": "fold_6", "regime": "COVID crash and V-recovery", "n": 222, "A_sharpe": -0.4924, "A_sortino": -0.5468, "A_excess_sharpe": -1.3811, "A_return_pct": -20.31, "A_hit_rate": 43.24, "A_n": 222, "A_bh_sharpe": 0.8888, "A_bh_return_pct": 26.13, "A_psr": 0.3242, "A_ic": 0.0359, "A_precision": 0.5811, "A_recall": 0.3116, "A_f1": 0.4057, "A_f2": 0.3435, "A_accuracy": 0.4324, "A_mcc": -0.0591, "A_tp": 43, "A_fp": 31, "A_tn": 53, "A_fn": 95, "B_sharpe": -0.4939, "B_sortino": -0.4918, "B_excess_sharpe": -2.8824, "B_return_pct": -40.58, "B_hit_rate": 47.96, "B_n": 222, "B_bh_sharpe": 2.3884, "B_bh_return_pct": 243.18, "B_psr": 0.3216, "B_ic": 0.013, "B_precision": 0.6618, "B_recall": 0.3285, "B_f1": 0.439, "B_f2": 0.3653, "B_accuracy": 0.482, "B_mcc": 0.061, "B_tp": 45, "B_fp": 23, "B_tn": 62, "B_fn": 92, "D_sharpe": -0.4924, "D_sortino": -0.5468, "D_excess_sharpe": -1.3811, "D_return_pct": -20.31, "D_hit_rate": 43.24, "D_n": 222, "D_bh_sharpe": 0.8888, "D_bh_return_pct": 26.13, "D_psr": 0.3242, "D_ic": 0.0359, "D_precision": 0.5811, "D_recall": 0.3116, "D_f1": 0.4057, "D_f2": 0.3435, "D_accuracy": 0.4324, "D_mcc": -0.0591, "D_tp": 43, "D_fp": 31, "D_tn": 53, "D_fn": 95, "sharpe": -0.4924, "sortino": -0.5468, "return_pct": -20.31, "equity": 796.9000000000001, "max_dd": 0.0, "win_rate": 43.24, "profit_factor": 0.0, "ic": 0.0359, "hit": 43.24, "psr": 0.3242, "bh_sharpe": 0.8888, "bh_return_pct": 26.13, "excess_sharpe": -1.3811, "precision": 0.5811, "recall": 0.3116, "f1": 0.4057, "f2": 0.3435, "mcc": -0.0591, "accuracy": 0.4324, "tp": 43, "fp": 31, "tn": 53, "fn": 95}, {"fold": "fold_7", "regime": "Inflation bear, AI rally and 2025", "n": 425, "A_sharpe": -0.9321, "A_sortino": -0.9885, "A_excess_sharpe": -1.9036, "A_return_pct": -31.64, "A_hit_rate": 45.18, "A_n": 425, "A_bh_sharpe": 0.9715, "A_bh_return_pct": 37.12, "A_psr": 0.1217, "A_ic": -0.0548, "A_precision": 0.5528, "A_recall": 0.356, "A_f1": 0.4331, "A_f2": 0.3833, "A_accuracy": 0.4518, "A_mcc": -0.0562, "A_tp": 89, "A_fp": 72, "A_tn": 103, "A_fn": 161, "B_sharpe": -1.4548, "B_sortino": -1.4657, "B_excess_sharpe": -3.9574, "B_return_pct": -72.34, "B_hit_rate": 44.81, "B_n": 425, "B_bh_sharpe": 2.5027, "B_bh_return_pct": 458.83, "B_psr": 0.0314, "B_ic": -0.1565, "B_precision": 0.5722, "B_recall": 0.4221, "B_f1": 0.4858, "B_f2": 0.4454, "B_accuracy": 0.4471, "B_mcc": -0.088, "B_tp": 111, "B_fp": 83, "B_tn": 79, "B_fn": 152, "D_sharpe": -0.9321, "D_sortino": -0.9885, "D_excess_sharpe": -1.9036, "D_return_pct": -31.64, "D_hit_rate": 45.18, "D_n": 425, "D_bh_sharpe": 0.9715, "D_bh_return_pct": 37.12, "D_psr": 0.1217, "D_ic": -0.0548, "D_precision": 0.5528, "D_recall": 0.356, "D_f1": 0.4331, "D_f2": 0.3833, "D_accuracy": 0.4518, "D_mcc": -0.0562, "D_tp": 89, "D_fp": 72, "D_tn": 103, "D_fn": 161, "sharpe": -0.9321, "sortino": -0.9885, "return_pct": -31.64, "equity": 683.6, "max_dd": 0.0, "win_rate": 45.18, "profit_factor": 0.0, "ic": -0.0548, "hit": 45.18, "psr": 0.1217, "bh_sharpe": 0.9715, "bh_return_pct": 37.12, "excess_sharpe": -1.9036, "precision": 0.5528, "recall": 0.356, "f1": 0.4331, "f2": 0.3833, "mcc": -0.0562, "accuracy": 0.4518, "tp": 89, "fp": 72, "tn": 103, "fn": 161}], "per_window_val": [{"fold": "fold_1", "regime": "GFC peak crash (Lehman + Mar-2009 bottom)", "n": 104, "A_sharpe": 1.3428, "A_sortino": 1.2639, "A_excess_sharpe": 1.51, "A_return_pct": 15.66, "A_hit_rate": 54.9, "A_n": 104, "A_bh_sharpe": -0.1672, "A_bh_return_pct": -3.81, "A_psr": 0.7965, "A_ic": 0.156, "A_precision": 0.5484, "A_recall": 0.6296, "A_f1": 0.5862, "A_f2": 0.6115, "A_accuracy": 0.5385, "A_mcc": 0.0709, "A_tp": 34, "A_fp": 28, "A_tn": 22, "A_fn": 20, "B_sharpe": -0.6595, "B_sortino": -0.7329, "B_excess_sharpe": 1.6146, "B_return_pct": -19.26, "B_hit_rate": 44.66, "B_n": 104, "B_bh_sharpe": -2.2741, "B_bh_return_pct": -44.12, "B_psr": 0.3392, "B_ic": -0.1171, "B_precision": 0.4531, "B_recall": 0.5577, "B_f1": 0.5, "B_f2": 0.5331, "B_accuracy": 0.4423, "B_mcc": -0.1186, "B_tp": 29, "B_fp": 35, "B_tn": 17, "B_fn": 23, "D_sharpe": 1.3428, "D_sortino": 1.2639, "D_excess_sharpe": 1.51, "D_return_pct": 15.66, "D_hit_rate": 54.9, "D_n": 104, "D_bh_sharpe": -0.1672, "D_bh_return_pct": -3.81, "D_psr": 0.7965, "D_ic": 0.156, "D_precision": 0.5484, "D_recall": 0.6296, "D_f1": 0.5862, "D_f2": 0.6115, "D_accuracy": 0.5385, "D_mcc": 0.0709, "D_tp": 34, "D_fp": 28, "D_tn": 22, "D_fn": 20, "sharpe": 1.3428, "sortino": 1.2639, "return_pct": 15.66, "equity": 1156.6000000000001, "max_dd": 0.0, "win_rate": 54.9, "profit_factor": 0.0, "ic": 0.156, "hit": 54.9, "psr": 0.7965, "bh_sharpe": -0.1672, "bh_return_pct": -3.81, "excess_sharpe": 1.51, "precision": 0.5484, "recall": 0.6296, "f1": 0.5862, "f2": 0.6115, "mcc": 0.0709, "accuracy": 0.5385, "tp": 34, "fp": 28, "tn": 22, "fn": 20}, {"fold": "fold_2", "regime": "2011 US-downgrade + EU debt", "n": 96, "A_sharpe": 0.9223, "A_sortino": 0.9228, "A_excess_sharpe": 1.1964, "A_return_pct": 8.36, "A_hit_rate": 52.63, "A_n": 96, "A_bh_sharpe": -0.2741, "A_bh_return_pct": -4.09, "A_psr": 0.7131, "A_ic": 0.0809, "A_precision": 0.5333, "A_recall": 0.64, "A_f1": 0.5818, "A_f2": 0.6154, "A_accuracy": 0.5208, "A_mcc": 0.0323, "A_tp": 32, "A_fp": 28, "A_tn": 18, "A_fn": 18, "B_sharpe": 0.5934, "B_sortino": 0.543, "B_excess_sharpe": 1.6208, "B_return_pct": 6.82, "B_hit_rate": 55.21, "B_n": 96, "B_bh_sharpe": -1.0274, "B_bh_return_pct": -25.58, "B_psr": 0.6407, "B_ic": -0.0007, "B_precision": 0.5, "B_recall": 0.7442, "B_f1": 0.5981, "B_f2": 0.678, "B_accuracy": 0.5521, "B_mcc": 0.1481, "B_tp": 32, "B_fp": 32, "B_tn": 21, "B_fn": 11, "D_sharpe": 0.9223, "D_sortino": 0.9228, "D_excess_sharpe": 1.1964, "D_return_pct": 8.36, "D_hit_rate": 52.63, "D_n": 96, "D_bh_sharpe": -0.2741, "D_bh_return_pct": -4.09, "D_psr": 0.7131, "D_ic": 0.0809, "D_precision": 0.5333, "D_recall": 0.64, "D_f1": 0.5818, "D_f2": 0.6154, "D_accuracy": 0.5208, "D_mcc": 0.0323, "D_tp": 32, "D_fp": 28, "D_tn": 18, "D_fn": 18, "sharpe": 0.9223, "sortino": 0.9228, "return_pct": 8.36, "equity": 1083.6, "max_dd": 0.0, "win_rate": 52.63, "profit_factor": 0.0, "ic": 0.0809, "hit": 52.63, "psr": 0.7131, "bh_sharpe": -0.2741, "bh_return_pct": -4.09, "excess_sharpe": 1.1964, "precision": 0.5333, "recall": 0.64, "f1": 0.5818, "f2": 0.6154, "mcc": 0.0323, "accuracy": 0.5208, "tp": 32, "fp": 28, "tn": 18, "fn": 18}, {"fold": "fold_3", "regime": "Taper tantrum and 2014 H1", "n": 54, "A_sharpe": -2.4245, "A_sortino": -2.2754, "A_excess_sharpe": -7.1243, "A_return_pct": -5.32, "A_hit_rate": 42.59, "A_n": 54, "A_bh_sharpe": 4.6998, "A_bh_return_pct": 10.46, "A_psr": 0.1295, "A_ic": 0.0252, "A_precision": 0.5625, "A_recall": 0.2727, "A_f1": 0.3673, "A_f2": 0.3041, "A_accuracy": 0.4259, "A_mcc": -0.0647, "A_tp": 9, "A_fp": 7, "A_tn": 14, "A_fn": 24, "B_sharpe": 1.9951, "B_sortino": 2.3039, "B_excess_sharpe": -7.0374, "B_return_pct": 10.1, "B_hit_rate": 51.85, "B_n": 54, "B_bh_sharpe": 9.0326, "B_bh_return_pct": 49.18, "B_psr": 0.8239, "B_ic": 0.1132, "B_precision": 0.6897, "B_recall": 0.5405, "B_f1": 0.6061, "B_f2": 0.565, "B_accuracy": 0.5185, "B_mcc": 0.0104, "B_tp": 20, "B_fp": 9, "B_tn": 8, "B_fn": 17, "D_sharpe": -2.4245, "D_sortino": -2.2754, "D_excess_sharpe": -7.1243, "D_return_pct": -5.32, "D_hit_rate": 42.59, "D_n": 54, "D_bh_sharpe": 4.6998, "D_bh_return_pct": 10.46, "D_psr": 0.1295, "D_ic": 0.0252, "D_precision": 0.5625, "D_recall": 0.2727, "D_f1": 0.3673, "D_f2": 0.3041, "D_accuracy": 0.4259, "D_mcc": -0.0647, "D_tp": 9, "D_fp": 7, "D_tn": 14, "D_fn": 24, "sharpe": -2.4245, "sortino": -2.2754, "return_pct": -5.32, "equity": 946.8, "max_dd": 0.0, "win_rate": 42.59, "profit_factor": 0.0, "ic": 0.0252, "hit": 42.59, "psr": 0.1295, "bh_sharpe": 4.6998, "bh_return_pct": 10.46, "excess_sharpe": -7.1243, "precision": 0.5625, "recall": 0.2727, "f1": 0.3673, "f2": 0.3041, "mcc": -0.0647, "accuracy": 0.4259, "tp": 9, "fp": 7, "tn": 14, "fn": 24}, {"fold": "fold_4", "regime": "China devaluation and oil crash", "n": 96, "A_sharpe": -1.9702, "A_sortino": -1.7626, "A_excess_sharpe": -1.5461, "A_return_pct": -13.92, "A_hit_rate": 48.42, "A_n": 96, "A_bh_sharpe": -0.4241, "A_bh_return_pct": -3.73, "A_psr": 0.1127, "A_ic": 0.0019, "A_precision": 0.4667, "A_recall": 0.6222, "A_f1": 0.5333, "A_f2": 0.5833, "A_accuracy": 0.4896, "A_mcc": -0.0054, "A_tp": 28, "A_fp": 32, "A_tn": 19, "A_fn": 17, "B_sharpe": -0.0788, "B_sortino": -0.1002, "B_excess_sharpe": 1.1055, "B_return_pct": -4.95, "B_hit_rate": 42.71, "B_n": 96, "B_bh_sharpe": -1.1843, "B_bh_return_pct": -21.44, "B_psr": 0.4808, "B_ic": -0.0343, "B_precision": 0.4348, "B_recall": 0.6522, "B_f1": 0.5217, "B_f2": 0.5929, "B_accuracy": 0.4271, "B_mcc": -0.142, "B_tp": 30, "B_fp": 39, "B_tn": 11, "B_fn": 16, "D_sharpe": -1.9702, "D_sortino": -1.7626, "D_excess_sharpe": -1.5461, "D_return_pct": -13.92, "D_hit_rate": 48.42, "D_n": 96, "D_bh_sharpe": -0.4241, "D_bh_return_pct": -3.73, "D_psr": 0.1127, "D_ic": 0.0019, "D_precision": 0.4667, "D_recall": 0.6222, "D_f1": 0.5333, "D_f2": 0.5833, "D_accuracy": 0.4896, "D_mcc": -0.0054, "D_tp": 28, "D_fp": 32, "D_tn": 19, "D_fn": 17, "sharpe": -1.9702, "sortino": -1.7626, "return_pct": -13.92, "equity": 860.8, "max_dd": 0.0, "win_rate": 48.42, "profit_factor": 0.0, "ic": 0.0019, "hit": 48.42, "psr": 0.1127, "bh_sharpe": -0.4241, "bh_return_pct": -3.73, "excess_sharpe": -1.5461, "precision": 0.4667, "recall": 0.6222, "f1": 0.5333, "f2": 0.5833, "mcc": -0.0054, "accuracy": 0.4896, "tp": 28, "fp": 32, "tn": 19, "fn": 17}, {"fold": "fold_5", "regime": "2018 Vol-mageddon + Q4 sell-off", "n": 54, "A_sharpe": -0.479, "A_sortino": -0.4755, "A_excess_sharpe": -1.907, "A_return_pct": -1.56, "A_hit_rate": 50.0, "A_n": 54, "A_bh_sharpe": 1.428, "A_bh_return_pct": 3.97, "A_psr": 0.4133, "A_ic": 0.0227, "A_precision": 0.625, "A_recall": 0.1724, "A_f1": 0.2703, "A_f2": 0.2016, "A_accuracy": 0.5, "A_mcc": 0.0736, "A_tp": 5, "A_fp": 3, "A_tn": 22, "A_fn": 24, "B_sharpe": -1.3303, "B_sortino": -1.3154, "B_excess_sharpe": -6.2625, "B_return_pct": -9.27, "B_hit_rate": 46.3, "B_n": 54, "B_bh_sharpe": 4.9322, "B_bh_return_pct": 34.93, "B_psr": 0.272, "B_ic": -0.2701, "B_precision": 0.8333, "B_recall": 0.2703, "B_f1": 0.4082, "B_f2": 0.3125, "B_accuracy": 0.463, "B_mcc": 0.1705, "B_tp": 10, "B_fp": 2, "B_tn": 15, "B_fn": 27, "D_sharpe": -0.479, "D_sortino": -0.4755, "D_excess_sharpe": -1.907, "D_return_pct": -1.56, "D_hit_rate": 50.0, "D_n": 54, "D_bh_sharpe": 1.428, "D_bh_return_pct": 3.97, "D_psr": 0.4133, "D_ic": 0.0227, "D_precision": 0.625, "D_recall": 0.1724, "D_f1": 0.2703, "D_f2": 0.2016, "D_accuracy": 0.5, "D_mcc": 0.0736, "D_tp": 5, "D_fp": 3, "D_tn": 22, "D_fn": 24, "sharpe": -0.479, "sortino": -0.4755, "return_pct": -1.56, "equity": 984.4000000000001, "max_dd": 0.0, "win_rate": 50.0, "profit_factor": 0.0, "ic": 0.0227, "hit": 50.0, "psr": 0.4133, "bh_sharpe": 1.428, "bh_return_pct": 3.97, "excess_sharpe": -1.907, "precision": 0.625, "recall": 0.1724, "f1": 0.2703, "f2": 0.2016, "mcc": 0.0736, "accuracy": 0.5, "tp": 5, "fp": 3, "tn": 22, "fn": 24}, {"fold": "fold_6", "regime": "COVID crash and V-recovery", "n": 75, "A_sharpe": -2.0907, "A_sortino": -2.2576, "A_excess_sharpe": -6.3901, "A_return_pct": -6.87, "A_hit_rate": 38.67, "A_n": 75, "A_bh_sharpe": 4.2994, "A_bh_return_pct": 14.68, "A_psr": 0.138, "A_ic": 0.1057, "A_precision": 0.7273, "A_recall": 0.1569, "A_f1": 0.2581, "A_f2": 0.186, "A_accuracy": 0.3867, "A_mcc": 0.042, "A_tp": 8, "A_fp": 3, "A_tn": 21, "A_fn": 43, "B_sharpe": -6.2775, "B_sortino": -5.8665, "B_excess_sharpe": -20.6115, "B_return_pct": -36.09, "B_hit_rate": 28.0, "B_n": 75, "B_bh_sharpe": 14.3339, "B_bh_return_pct": 120.13, "B_psr": 0.0008, "B_ic": 0.0761, "B_precision": 0.8462, "B_recall": 0.1746, "B_f1": 0.2895, "B_f2": 0.2075, "B_accuracy": 0.28, "B_mcc": 0.0077, "B_tp": 11, "B_fp": 2, "B_tn": 10, "B_fn": 52, "D_sharpe": -2.0907, "D_sortino": -2.2576, "D_excess_sharpe": -6.3901, "D_return_pct": -6.87, "D_hit_rate": 38.67, "D_n": 75, "D_bh_sharpe": 4.2994, "D_bh_return_pct": 14.68, "D_psr": 0.138, "D_ic": 0.1057, "D_precision": 0.7273, "D_recall": 0.1569, "D_f1": 0.2581, "D_f2": 0.186, "D_accuracy": 0.3867, "D_mcc": 0.042, "D_tp": 8, "D_fp": 3, "D_tn": 21, "D_fn": 43, "sharpe": -2.0907, "sortino": -2.2576, "return_pct": -6.87, "equity": 931.3000000000001, "max_dd": 0.0, "win_rate": 38.67, "profit_factor": 0.0, "ic": 0.1057, "hit": 38.67, "psr": 0.138, "bh_sharpe": 4.2994, "bh_return_pct": 14.68, "excess_sharpe": -6.3901, "precision": 0.7273, "recall": 0.1569, "f1": 0.2581, "f2": 0.186, "mcc": 0.042, "accuracy": 0.3867, "tp": 8, "fp": 3, "tn": 21, "fn": 43}, {"fold": "fold_7", "regime": "Inflation bear, AI rally and 2025", "n": 114, "A_sharpe": -0.5545, "A_sortino": -0.5619, "A_excess_sharpe": -3.3995, "A_return_pct": -4.4, "A_hit_rate": 47.37, "A_n": 114, "A_bh_sharpe": 2.845, "A_bh_return_pct": 21.34, "A_psr": 0.3555, "A_ic": 0.0462, "A_precision": 0.5897, "A_recall": 0.343