{"experiment_num": 25, "backbone": "mlp", "description": "MLP @ FX-Exp32 seq_len 10 -> 60 (equity-window hill-climb); Fischer-Krauss 2018 EJOR seq=240 prior; Lim-Zohren-Roberts 2019 quarterly window; targets trend-capture on F3/F6/F7", "config": {"seq_len": 60, "lr": 0.0003, "batch_size": 32, "epochs": 50, "weight_decay": 1e-05, "patience": 10, "warmup_epochs": 0, "head_dropout": 0.25, "huber_delta": 1.0, "grad_clip": 1.0, "seed": 0, "hidden_size": null, "num_layers": null, "max_depth": null, "gbm_lr": null, "n_estimators": null}, "composite": -0.4399, "test_pos_folds": 3, "val_pos_folds": 4, "val_loss": -2.8408429010779455, "elapsed_sec": 32.6, "timestamp": "2026-04-27T16:26:31", "sharpe": -0.0399, "val_sharpe": 0.921, "ic": -0.0055, "hit": 49.76, "psr": 0.4674, "equity": 865.1, "return_pct": -13.49, "bh_sharpe": 1.2201, "bh_return_pct": 185.59, "excess_sharpe": -1.26, "B_sharpe": 0.2191, "B_excess_sharpe": -2.6193, "B_return_pct": -2.77, "D_sharpe": -0.0399, "D_excess_sharpe": -1.26, "D_return_pct": -13.49, "per_window": [{"fold": "fold_1", "regime": "GFC peak crash (Lehman + Mar-2009 bottom)", "n": 65, "A_sharpe": -0.7365, "A_sortino": -0.7477, "A_excess_sharpe": -1.1627, "A_return_pct": -8.57, "A_hit_rate": 47.69, "A_n": 65, "A_bh_sharpe": 0.4262, "A_bh_return_pct": 2.34, "A_psr": 0.3561, "A_ic": -0.2065, "B_sharpe": 3.3186, "B_sortino": 3.5642, "B_excess_sharpe": 1.431, "B_return_pct": 76.64, "B_hit_rate": 57.81, "B_n": 65, "B_bh_sharpe": 1.8877, "B_bh_return_pct": 34.48, "B_psr": 0.952, "B_ic": 0.2834, "D_sharpe": -0.7365, "D_sortino": -0.7477, "D_excess_sharpe": -1.1627, "D_return_pct": -8.57, "D_hit_rate": 47.69, "D_n": 65, "D_bh_sharpe": 0.4262, "D_bh_return_pct": 2.34, "D_psr": 0.3561, "D_ic": -0.2065, "sharpe": -0.7365, "sortino": -0.7477, "return_pct": -8.57, "equity": 914.3, "max_dd": 0.0, "win_rate": 47.69, "profit_factor": 0.0, "ic": -0.2065, "hit": 47.69, "psr": 0.3561, "bh_sharpe": 0.4262, "bh_return_pct": 2.34, "excess_sharpe": -1.1627, "precision": 0.5, "recall": 0.8235, "f1": 0.6222, "f2": 0.7292, "accuracy": 0.4769, "mcc": -0.1153, "tp": 28, "fp": 28, "tn": 3, "fn": 6, "A_precision": 0.5, "A_recall": 0.8235, "A_f1": 0.6222, "A_f2": 0.7292, "A_accuracy": 0.4769, "A_mcc": -0.1153, "A_tp": 28, "A_fp": 28, "A_tn": 3, "A_fn": 6}, {"fold": "fold_2", "regime": "2011 US-downgrade + EU debt", "n": 86, "A_sharpe": 1.7624, "A_sortino": 2.183, "A_excess_sharpe": -3.1058, "A_return_pct": 9.42, "A_hit_rate": 50.59, "A_n": 86, "A_bh_sharpe": 4.8682, "A_bh_return_pct": 27.91, "A_psr": 0.8593, "A_ic": 0.1546, "B_sharpe": -1.4469, "B_sortino": -1.4675, "B_excess_sharpe": -12.7659, "B_return_pct": -17.11, "B_hit_rate": 46.51, "B_n": 86, "B_bh_sharpe": 11.3191, "B_bh_return_pct": 186.84, "B_psr": 0.2058, "B_ic": -0.1232, "D_sharpe": 1.7624, "D_sortino": 2.183, "D_excess_sharpe": -3.1058, "D_return_pct": 9.42, "D_hit_rate": 50.59, "D_n": 86, "D_bh_sharpe": 4.8682, "D_bh_return_pct": 27.91, "D_psr": 0.8593, "D_ic": 0.1546, "sharpe": 1.7624, "sortino": 2.183, "return_pct": 9.42, "equity": 1094.2, "max_dd": 0.0, "win_rate": 50.59, "profit_factor": 0.0, "ic": 0.1546, "hit": 50.59, "psr": 0.8593, "bh_sharpe": 4.8682, "bh_return_pct": 27.91, "excess_sharpe": -3.1058, "precision": 0.6774, "recall": 0.3962, "f1": 0.5, "f2": 0.4321, "accuracy": 0.5116, "mcc": 0.0944, "tp": 21, "fp": 10, "tn": 23, "fn": 32, "A_precision": 0.6774, "A_recall": 0.3962, "A_f1": 0.5, "A_f2": 0.4321, "A_accuracy": 0.5116, "A_mcc": 0.0944, "A_tp": 21, "A_fp": 10, "A_tn": 23, "A_fn": 32}, {"fold": "fold_3", "regime": "Taper tantrum and 2014 H1", "n": 128, "A_sharpe": -2.0497, "A_sortino": -2.3141, "A_excess_sharpe": -4.1086, "A_return_pct": -12.63, "A_hit_rate": 39.37, "A_n": 128, "A_bh_sharpe": 2.0589, "A_bh_return_pct": 13.6, "A_psr": 0.0879, "A_ic": -0.0966, "B_sharpe": 0.2605, "B_sortino": 0.2635, "B_excess_sharpe": -4.251, "B_return_pct": 1.73, "B_hit_rate": 50.78, "B_n": 128, "B_bh_sharpe": 4.5116, "B_bh_return_pct": 67.92, "B_psr": 0.5734, "B_ic": -0.0734, "D_sharpe": -2.0497, "D_sortino": -2.3141, "D_excess_sharpe": -4.1086, "D_return_pct": -12.63, "D_hit_rate": 39.37, "D_n": 128, "D_bh_sharpe": 2.0589, "D_bh_return_pct": 13.6, "D_psr": 0.0879, "D_ic": -0.0966, "sharpe": -2.0497, "sortino": -2.3141, "return_pct": -12.63, "equity": 873.7, "max_dd": 0.0, "win_rate": 39.37, "profit_factor": 0.0, "ic": -0.0966, "hit": 39.37, "psr": 0.0879, "bh_sharpe": 2.0589, "bh_return_pct": 13.6, "excess_sharpe": -4.1086, "precision": 0.6667, "recall": 0.0256, "f1": 0.0494, "f2": 0.0317, "accuracy": 0.3984, "mcc": 0.0182, "tp": 2, "fp": 1, "tn": 49, "fn": 76, "A_precision": 0.6667, "A_recall": 0.0256, "A_f1": 0.0494, "A_f2": 0.0317, "A_accuracy": 0.3984, "A_mcc": 0.0182, "A_tp": 2, "A_fp": 1, "A_tn": 49, "A_fn": 76}, {"fold": "fold_4", "regime": "China devaluation and oil crash", "n": 107, "A_sharpe": -0.4313, "A_sortino": -0.4089, "A_excess_sharpe": 0.3719, "A_return_pct": -4.54, "A_hit_rate": 50.94, "A_n": 107, "A_bh_sharpe": -0.8032, "A_bh_return_pct": -7.58, "A_psr": 0.3896, "A_ic": -0.0041, "B_sharpe": -1.7007, "B_sortino": -1.5066, "B_excess_sharpe": 0.2589, "B_return_pct": -30.2, "B_hit_rate": 51.4, "B_n": 107, "B_bh_sharpe": -1.9596, "B_bh_return_pct": -33.47, "B_psr": 0.1338, "B_ic": -0.1507, "D_sharpe": -0.4313, "D_sortino": -0.4089, "D_excess_sharpe": 0.3719, "D_return_pct": -4.54, "D_hit_rate": 50.94, "D_n": 107, "D_bh_sharpe": -0.8032, "D_bh_return_pct": -7.58, "D_psr": 0.3896, "D_ic": -0.0041, "sharpe": -0.4313, "sortino": -0.4089, "return_pct": -4.54, "equity": 954.6, "max_dd": 0.0, "win_rate": 50.94, "profit_factor": 0.0, "ic": -0.0041, "hit": 50.94, "psr": 0.3896, "bh_sharpe": -0.8032, "bh_return_pct": -7.58, "excess_sharpe": 0.3719, "precision": 0.4941, "recall": 0.8077, "f1": 0.6131, "f2": 0.7167, "accuracy": 0.5047, "mcc": 0.032, "tp": 42, "fp": 43, "tn": 12, "fn": 10, "A_precision": 0.4941, "A_recall": 0.8077, "A_f1": 0.6131, "A_f2": 0.7167, "A_accuracy": 0.5047, "A_mcc": 0.032, "A_tp": 42, "A_fp": 43, "A_tn": 12, "A_fn": 10}, {"fold": "fold_5", "regime": "2018 Vol-mageddon + Q4 sell-off", "n": 127, "A_sharpe": 0.9797, "A_sortino": 1.087, "A_excess_sharpe": -0.2033, "A_return_pct": 10.85, "A_hit_rate": 51.18, "A_n": 127, "A_bh_sharpe": 1.183, "A_bh_return_pct": 13.55, "A_psr": 0.7595, "A_ic": 0.0247, "B_sharpe": 0.8433, "B_sortino": 0.8732, "B_excess_sharpe": -2.0623, "B_return_pct": 15.44, "B_hit_rate": 52.38, "B_n": 127, "B_bh_sharpe": 2.9056, "B_bh_return_pct": 85.51, "B_psr": 0.7253, "B_ic": 0.1508, "D_sharpe": 0.9797, "D_sortino": 1.087, "D_excess_sharpe": -0.2033, "D_return_pct": 10.85, "D_hit_rate": 51.18, "D_n": 127, "D_bh_sharpe": 1.183, "D_bh_return_pct": 13.55, "D_psr": 0.7595, "D_ic": 0.0247, "sharpe": 0.9797, "sortino": 1.087, "return_pct": 10.85, "equity": 1108.5, "max_dd": 0.0, "win_rate": 51.18, "profit_factor": 0.0, "ic": 0.0247, "hit": 51.18, "psr": 0.7595, "bh_sharpe": 1.183, "bh_return_pct": 13.55, "excess_sharpe": -0.2033, "precision": 0.629, "recall": 0.5, "f1": 0.5571, "f2": 0.5214, "accuracy": 0.5118, "mcc": 0.0298, "tp": 39, "fp": 23, "tn": 26, "fn": 39, "A_precision": 0.629, "A_recall": 0.5, "A_f1": 0.5571, "A_f2": 0.5214, "A_accuracy": 0.5118, "A_mcc": 0.0298, "A_tp": 39, "A_fp": 23, "A_tn": 26, "A_fn": 39}, {"fold": "fold_6", "regime": "COVID crash and V-recovery", "n": 172, "A_sharpe": 0.3394, "A_sortino": 0.3552, "A_excess_sharpe": -2.0882, "A_return_pct": 3.68, "A_hit_rate": 50.0, "A_n": 172, "A_bh_sharpe": 2.4276, "A_bh_return_pct": 45.89, "A_psr": 0.6103, "A_ic": -0.0605, "B_sharpe": 1.825, "B_sortino": 1.8328, "B_excess_sharpe": -3.887, "B_return_pct": 71.62, "B_hit_rate": 55.56, "B_n": 172, "B_bh_sharpe": 5.712, "B_bh_return_pct": 489.18, "B_psr": 0.9322, "B_ic": 0.1682, "D_sharpe": 0.3394, "D_sortino": 0.3552, "D_excess_sharpe": -2.0882, "D_return_pct": 3.68, "D_hit_rate": 50.0, "D_n": 172, "D_bh_sharpe": 2.4276, "D_bh_return_pct": 45.89, "D_psr": 0.6103, "D_ic": -0.0605, "sharpe": 0.3394, "sortino": 0.3552, "return_pct": 3.68, "equity": 1036.8, "max_dd": 0.0, "win_rate": 50.0, "profit_factor": 0.0, "ic": -0.0605, "hit": 50.0, "psr": 0.6103, "bh_sharpe": 2.4276, "bh_return_pct": 45.89, "excess_sharpe": -2.0882, "precision": 0.6337, "recall": 0.5664, "f1": 0.5981, "f2": 0.5787, "accuracy": 0.5, "mcc": -0.0586, "tp": 64, "fp": 37, "tn": 22, "fn": 49, "A_precision": 0.6337, "A_recall": 0.5664, "A_f1": 0.5981, "A_f2": 0.5787, "A_accuracy": 0.5, "A_mcc": -0.0586, "A_tp": 64, "A_fp": 37, "A_tn": 22, "A_fn": 49}, {"fold": "fold_7", "regime": "Inflation bear, AI rally and 2025", "n": 375, "A_sharpe": -0.1961, "A_sortino": -0.1941, "A_excess_sharpe": -0.9866, "A_return_pct": -9.78, "A_hit_rate": 52.53, "A_n": 375, "A_bh_sharpe": 0.7905, "A_bh_return_pct": 25.44, "A_psr": 0.4062, "A_ic": 0.0179, "B_sharpe": -0.8479, "B_sortino": -0.779, "B_excess_sharpe": -2.7817, "B_return_pct": -52.8, "B_hit_rate": 50.53, "B_n": 375, "B_bh_sharpe": 1.9338, "B_bh_return_pct": 221.94, "B_psr": 0.1486, "B_ic": 0.0191, "D_sharpe": -0.1961, "D_sortino": -0.1941, "D_excess_sharpe": -0.9866, "D_return_pct": -9.78, "D_hit_rate": 52.53, "D_n": 375, "D_bh_sharpe": 0.7905, "D_bh_return_pct": 25.44, "D_psr": 0.4062, "D_ic": 0.0179, "sharpe": -0.1961, "sortino": -0.1941, "return_pct": -9.78, "equity": 902.2, "max_dd": 0.0, "win_rate": 52.53, "profit_factor": 0.0, "ic": 0.0179, "hit": 52.53, "psr": 0.4062, "bh_sharpe": 0.7905, "bh_return_pct": 25.44, "excess_sharpe": -0.9866, "precision": 0.5854, "recall": 0.6545, "f1": 0.618, "f2": 0.6394, "accuracy": 0.5253, "mcc": -0.0036, "tp": 144, "fp": 102, "tn": 53, "fn": 76, "A_precision": 0.5854, "A_recall": 0.6545, "A_f1": 0.618, "A_f2": 0.6394, "A_accuracy": 0.5253, "A_mcc": -0.0036, "A_tp": 144, "A_fp": 102, "A_tn": 53, "A_fn": 76}], "per_window_val": [{"fold": "fold_1", "regime": "GFC peak crash (Lehman + Mar-2009 bottom)", "n": 37, "A_sharpe": 2.5517, "A_sortino": 3.2033, "A_excess_sharpe": 1.7932, "A_return_pct": 9.4, "A_hit_rate": 48.57, "A_n": 37, "A_bh_sharpe": 0.7585, "A_bh_return_pct": 2.39, "A_psr": 0.8412, "A_ic": 0.2177, "B_sharpe": 3.162, "B_sortino": 3.2347, "B_excess_sharpe": 1.0173, "B_return_pct": 18.83, "B_hit_rate": 62.16, "B_n": 37, "B_bh_sharpe": 2.1447, "B_bh_return_pct": 12.13, "B_psr": 0.8847, "B_ic": -0.1648, "D_sharpe": 2.5517, "D_sortino": 3.2033, "D_excess_sharpe": 1.7932, "D_return_pct": 9.4, "D_hit_rate": 48.57, "D_n": 37, "D_bh_sharpe": 0.7585, "D_bh_return_pct": 2.39, "D_psr": 0.8412, "D_ic": 0.2177, "sharpe": 2.5517, "sortino": 3.2033, "return_pct": 9.4, "equity": 1094.0, "max_dd": 0.0, "win_rate": 48.57, "profit_factor": 0.0, "ic": 0.2177, "hit": 48.57, "psr": 0.8412, "bh_sharpe": 0.7585, "bh_return_pct": 2.39, "excess_sharpe": 1.7932}, {"fold": "fold_2", "regime": "2011 US-downgrade + EU debt", "n": 46, "A_sharpe": 0.7679, "A_sortino": 0.8518, "A_excess_sharpe": 0.8218, "A_return_pct": 3.86, "A_hit_rate": 47.83, "A_n": 46, "A_bh_sharpe": -0.0539, "A_bh_return_pct": -1.46, "A_psr": 0.6279, "A_ic": -0.0087, "B_sharpe": 0.4937, "B_sortino": 0.4537, "B_excess_sharpe": 2.035, "B_return_pct": 1.48, "B_hit_rate": 52.17, "B_n": 46, "B_bh_sharpe": -1.5413, "B_bh_return_pct": -23.36, "B_psr": 0.5818, "B_ic": 0.3495, "D_sharpe": 0.7679, "D_sortino": 0.8518, "D_excess_sharpe": 0.8218, "D_return_pct": 3.86, "D_hit_rate": 47.83, "D_n": 46, "D_bh_sharpe": -0.0539, "D_bh_return_pct": -1.46, "D_psr": 0.6279, "D_ic": -0.0087, "sharpe": 0.7679, "sortino": 0.8518, "return_pct": 3.86, "equity": 1038.6, "max_dd": 0.0, "win_rate": 47.83, "profit_factor": 0.0, "ic": -0.0087, "hit": 47.83, "psr": 0.6279, "bh_sharpe": -0.0539, "bh_return_pct": -1.46, "excess_sharpe": 0.8218}, {"fold": "fold_3", "regime": "Taper tantrum and 2014 H1", "n": 4, "A_sharpe": -6.3226, "A_sortino": -4.4732, "A_excess_sharpe": -12.6451, "A_return_pct": -0.58, "A_hit_rate": 50.0, "A_n": 4, "A_bh_sharpe": 6.3226, "A_bh_return_pct": 0.58, "A_psr": 0.227, "A_ic": 0.2, "B_sharpe": -0.9274, "B_sortino": -0.8822, "B_excess_sharpe": 22.5139, "B_return_pct": -0.24, "B_hit_rate": 50.0, "B_n": 4, "B_bh_sharpe": -23.4413, "B_bh_return_pct": -3.13, "B_psr": 0.4597, "B_ic": 0.0, "D_sharpe": -6.3226, "D_sortino": -4.4732, "D_excess_sharpe": -12.6451, "D_return_pct": -0.58, "D_hit_rate": 50.0, "D_n": 4, "D_bh_sharpe": 6.3226, "D_bh_return_pct": 0.58, "D_psr": 0.227, "D_ic": 0.2, "sharpe": -6.3226, "sortino": -4.4732, "return_pct": -0.58, "equity": 994.1999999999999, "max_dd": 0.0, "win_rate": 50.0, "profit_factor": 0.0, "ic": 0.2, "hit": 50.0, "psr": 0.227, "bh_sharpe": 6.3226, "bh_return_pct": 0.58, "excess_sharpe": -12.6451}, {"fold": "fold_4", "regime": "China devaluation and oil crash", "n": 46, "A_sharpe": 2.1706, "A_sortino": 2.2281, "A_excess_sharpe": 3.3727, "A_return_pct": 9.41, "A_hit_rate": 54.35, "A_n": 46, "A_bh_sharpe": -1.2022, "A_bh_return_pct": -5.68, "A_psr": 0.8158, "A_ic": 0.2965, "B_sharpe": -0.0295, "B_sortino": -0.0296, "B_excess_sharpe": 2.2823, "B_return_pct": -3.48, "B_hit_rate": 50.0, "B_n": 46, "B_bh_sharpe": -2.3118, "B_bh_return_pct": -24.51, "B_psr": 0.495, "B_ic": 0.201, "D_sharpe": 2.1706, "D_sortino": 2.2281, "D_excess_sharpe": 3.3727, "D_return_pct": 9.41, "D_hit_rate": 54.35, "D_n": 46, "D_bh_sharpe": -1.2022, "D_bh_return_pct": -5.68, "D_psr": 0.8158, "D_ic": 0.2965, "sharpe": 2.1706, "sortino": 2.2281, "return_pct": 9.41, "equity": 1094.1000000000001, "max_dd": 0.0, "win_rate": 54.35, "profit_factor": 0.0, "ic": 0.2965, "hit": 54.35, "psr": 0.8158, "bh_sharpe": -1.2022, "bh_return_pct": -5.68, "excess_sharpe": 3.3727}, {"fold": "fold_5", "regime": "2018 Vol-mageddon + Q4 sell-off", "n": 4, "A_sharpe": -14.7551, "A_sortino": -9.7882, "A_excess_sharpe": 0.0, "A_return_pct": -3.52, "A_hit_rate": 25.0, "A_n": 4, "A_bh_sharpe": -14.7551, "A_bh_return_pct": -3.52, "A_psr": 0.0808, "A_ic": -0.8, "B_sharpe": 10.8481, "B_sortino": 15.773, "B_excess_sharpe": 8.6915, "B_return_pct": 0.0, "B_hit_rate": 0.0, "B_n": 4, "B_bh_sharpe": 2.1566, "B_bh_return_pct": 1.19, "B_psr": 0.901, "B_ic": 0.8, "D_sharpe": -14.7551, "D_sortino": -9.7882, "D_excess_sharpe": 0.0, "D_return_pct": -3.52, "D_hit_rate": 25.0, "D_n": 4, "D_bh_sharpe": -14.7551, "D_bh_return_pct": -3.52, "D_psr": 0.0808, "D_ic": -0.8, "sharpe": -14.7551, "sortino": -9.7882, "return_pct": -3.52, "equity": 964.8, "max_dd": 0.0, "win_rate": 25.0, "profit_factor": 0.0, "ic": -0.8, "hit": 25.0, "psr": 0.0808, "bh_sharpe": -14.7551, "bh_return_pct": -3.52, "excess_sharpe": 0.0}, {"fold": "fold_6", "regime": "COVID crash and V-recovery", "n": 25, "A_sharpe": 6.7432, "A_sortino": 7.5939, "A_excess_sharpe": 4.3294, "A_return_pct": 8.91, "A_hit_rate": 68.0, "A_n": 25, "A_bh_sharpe": 2.4138, "A_bh_return_pct": 3.27, "A_psr": 0.9801, "A_ic": 0.1254, "B_sharpe": -0.8565, "B_sortino": -0.9008, "B_excess_sharpe": -13.422, "B_return_pct": -2.88, "B_hit_rate": 44.0, "B_n": 25, "B_bh_sharpe": 12.5655, "B_bh_return_pct": 32.76, "B_psr": 0.3963, "B_ic": 0.3685, "D_sharpe": 6.7432, "D_sortino": 7.5939, "D_excess_sharpe": 4.3294, "D_return_pct": 8.91, "D_hit_rate": 68.0, "D_n": 25, "D_bh_sharpe": 2.4138, "D_bh_return_pct": 3.27, "D_psr": 0.9801, "D_ic": 0.1254, "sharpe": 6.7432, "sortino": 7.5939, "return_pct": 8.91, "equity": 1089.1, "max_dd": 0.0, "win_rate": 68.0, "profit_factor": 0.0, "ic": 0.1254, "hit": 68.0, "psr": 0.9801, "bh_sharpe": 2.4138, "bh_return_pct": 3.27, "excess_sharpe": 4.3294}, {"fold": "fold_7", "regime": "Inflation bear, AI rally and 2025", "n": 64, "A_sharpe": -2.2223, "A_sortino": -2.132, "A_excess_sharpe": -4.2632, "A_return_pct": -8.55, "A_hit_rate": 43.75, "A_n": 64, "A_bh_sharpe": 2.0409, "A_bh_return_pct": 7.94, "A_psr": 0.1335, "A_ic": -0.2123, "B_sharpe": 0.7067, "B_sortino": 0.7344, "B_excess_sharpe": -4.7024, "B_return_pct": 4.31, "B_hit_rate": 48.44, "B_n": 64, "B_bh_sharpe": 5.4092, "B_bh_return_pct": 45.7, "B_psr": 0.6377, "B_ic": -0.0037, "D_sharpe": -2.2223, "D_sortino": -2.132, "D_excess_sharpe": -4.2632, "D_return_pct": -8.55, "D_hit_rate": 43.75, "D_n": 64, "D_bh_sharpe": 2.0409, "D_bh_return_pct": 7.94, "D_psr": 0.1335, "D_ic": -0.2123, "sharpe": -2.2223, "sortino": -2.132, "return_pct": -8.55, "equity": 914.5, "max_dd": 0.0, "win_rate": 43.75, "profit_factor": 0.0, "ic": -0.2123, "hit": 43.75, "psr": 0.1335, "bh_sharpe": 2.0409, "bh_return_pct": 7.94, "excess_sharpe": -4.2632}], "status": "DISCARD", "precision": 0.5822, "recall": 0.5414, "f1": 0.5611, "f2": 0.5491, "accuracy": 0.4981, "mcc": -0.0231, "tp": 340, "fp": 244, "tn": 188, "fn": 288, "test_sharpe": -0.0399, "A_sharpe": -0.0399, "A_excess_sharpe": -1.26, "A_return_pct": -13.49, "A_precision": 0.5822, "A_recall": 0.5414, "A_f1": 0.5611, "A_f2": 0.5491, "A_accuracy": 0.4981, "A_mcc": -0.0231, "A_tp": 340, "A_fp": 244, "A_tn": 188, "A_fn": 288, "A_psr": 0.4674, "A_ic": -0.0055, "A_hit_rate": 49.76, "A_bh_sharpe": 1.2201, "A_bh_return_pct": 185.59}
