{"experiment_num": 97, "backbone": "lightgbm", "description": "LightGBM n_est=1500 seed=7 - 3rd seed multi-seed", "config": {"seq_len": 60, "lr": 0.0003, "batch_size": 32, "epochs": 50, "weight_decay": 1e-05, "patience": 10, "warmup_epochs": 0, "head_dropout": 0.1, "huber_delta": 1.0, "grad_clip": 1.0, "seed": 7, "hidden_size": null, "num_layers": null, "max_depth": 4, "gbm_lr": 0.01, "n_estimators": 1500}, "composite": -0.1402, "test_pos_folds": 5, "val_pos_folds": 5, "val_loss": null, "elapsed_sec": 337.4, "timestamp": "2026-04-28T00:12:26", "sharpe": 0.0598, "val_sharpe": 0.8506, "ic": 0.0346, "hit": 45.86, "psr": 0.549, "equity": 951.0, "return_pct": -4.9, "bh_sharpe": 1.2194, "bh_return_pct": 187.05, "excess_sharpe": -1.1596, "B_sharpe": -0.1107, "B_excess_sharpe": -2.9389, "B_return_pct": -48.99, "D_sharpe": 0.3481, "D_excess_sharpe": -0.8713, "D_return_pct": 25.3, "precision": 0.5589, "recall": 0.413, "f1": 0.475, "f2": 0.4357, "mcc": -0.06, "accuracy": 0.4592, "val_precision": 0.5422, "val_recall": 0.687, "val_f1": 0.6061, "val_f2": 0.6522, "val_mcc": 0.1019, "val_accuracy": 0.55, "per_window": [{"fold": "fold_1", "regime": "GFC peak crash (Lehman + Mar-2009 bottom)", "n": 66, "A_sharpe": 0.2649, "A_sortino": 0.295, "A_excess_sharpe": -0.3072, "A_return_pct": 0.77, "A_hit_rate": 42.42, "A_n": 66, "A_bh_sharpe": 0.5721, "A_bh_return_pct": 3.85, "A_psr": 0.5535, "A_ic": 0.1595, "A_precision": 0.4571, "A_recall": 0.4571, "A_f1": 0.4571, "A_f2": 0.4571, "A_accuracy": 0.4242, "A_mcc": -0.1558, "A_tp": 16, "A_fp": 19, "A_tn": 12, "A_fn": 19, "B_sharpe": 2.8651, "B_sortino": 3.1826, "B_excess_sharpe": 0.8181, "B_return_pct": 63.22, "B_hit_rate": 55.38, "B_n": 66, "B_bh_sharpe": 2.0469, "B_bh_return_pct": 39.28, "B_psr": 0.9282, "B_ic": 0.2838, "B_precision": 0.6154, "B_recall": 0.4444, "B_f1": 0.5161, "B_f2": 0.4706, "B_accuracy": 0.5455, "B_mcc": 0.1132, "B_tp": 16, "B_fp": 10, "B_tn": 20, "B_fn": 20, "D_sharpe": 3.8472, "D_sortino": 4.0295, "D_excess_sharpe": 3.2751, "D_return_pct": 41.7, "D_hit_rate": 62.12, "D_n": 66, "D_bh_sharpe": 0.5721, "D_bh_return_pct": 3.85, "D_psr": 0.9743, "D_ic": 0.2352, "D_precision": 0.6923, "D_recall": 0.5143, "D_f1": 0.5902, "D_f2": 0.5422, "D_accuracy": 0.6212, "D_mcc": 0.2617, "D_tp": 18, "D_fp": 8, "D_tn": 23, "D_fn": 17, "sharpe": 0.2649, "sortino": 0.295, "return_pct": 0.77, "equity": 1007.7, "max_dd": 0.0, "win_rate": 42.42, "profit_factor": 0.0, "ic": 0.1595, "hit": 42.42, "psr": 0.5535, "bh_sharpe": 0.5721, "bh_return_pct": 3.85, "excess_sharpe": -0.3072, "precision": 0.4571, "recall": 0.4571, "f1": 0.4571, "f2": 0.4571, "mcc": -0.1558, "accuracy": 0.4242, "tp": 16, "fp": 19, "tn": 12, "fn": 19}, {"fold": "fold_2", "regime": "2011 US-downgrade + EU debt", "n": 87, "A_sharpe": 1.6937, "A_sortino": 2.099, "A_excess_sharpe": -3.3283, "A_return_pct": 9.14, "A_hit_rate": 51.16, "A_n": 87, "A_bh_sharpe": 5.022, "A_bh_return_pct": 29.23, "A_psr": 0.8514, "A_ic": 0.1401, "A_precision": 0.6154, "A_recall": 0.5926, "A_f1": 0.6038, "A_f2": 0.597, "A_accuracy": 0.5172, "A_mcc": -0.0133, "A_tp": 32, "A_fp": 20, "A_tn": 13, "A_fn": 22, "B_sharpe": 4.6642, "B_sortino": 5.5883, "B_excess_sharpe": -6.4727, "B_return_pct": 65.65, "B_hit_rate": 58.62, "B_n": 87, "B_bh_sharpe": 11.1369, "B_bh_return_pct": 185.4, "B_psr": 0.9974, "B_ic": 0.2273, "B_precision": 0.8167, "B_recall": 0.6622, "B_f1": 0.7313, "B_f2": 0.6882, "B_accuracy": 0.5862, "B_mcc": -0.1418, "B_tp": 49, "B_fp": 11, "B_tn": 2, "B_fn": 25, "D_sharpe": 2.5664, "D_sortino": 2.9645, "D_excess_sharpe": -2.4556, "D_return_pct": 14.3, "D_hit_rate": 56.98, "D_n": 87, "D_bh_sharpe": 5.022, "D_bh_return_pct": 29.23, "D_psr": 0.9444, "D_ic": 0.0868, "D_precision": 0.6333, "D_recall": 0.7037, "D_f1": 0.6667, "D_f2": 0.6884, "D_accuracy": 0.5632, "D_mcc": 0.0388, "D_tp": 38, "D_fp": 22, "D_tn": 11, "D_fn": 16, "sharpe": 1.6937, "sortino": 2.099, "return_pct": 9.14, "equity": 1091.3999999999999, "max_dd": 0.0, "win_rate": 51.16, "profit_factor": 0.0, "ic": 0.1401, "hit": 51.16, "psr": 0.8514, "bh_sharpe": 5.022, "bh_return_pct": 29.23, "excess_sharpe": -3.3283, "precision": 0.6154, "recall": 0.5926, "f1": 0.6038, "f2": 0.597, "mcc": -0.0133, "accuracy": 0.5172, "tp": 32, "fp": 20, "tn": 13, "fn": 22}, {"fold": "fold_3", "regime": "Taper tantrum and 2014 H1", "n": 129, "A_sharpe": 0.4223, "A_sortino": 0.457, "A_excess_sharpe": -1.3455, "A_return_pct": 2.38, "A_hit_rate": 45.31, "A_n": 129, "A_bh_sharpe": 1.7678, "A_bh_return_pct": 11.76, "A_psr": 0.6183, "A_ic": 0.0775, "A_precision": 0.5467, "A_recall": 0.5256, "A_f1": 0.5359, "A_f2": 0.5297, "A_accuracy": 0.4496, "A_mcc": -0.1398, "A_tp": 41, "A_fp": 34, "A_tn": 17, "A_fn": 37, "B_sharpe": 2.4355, "B_sortino": 2.5388, "B_excess_sharpe": -1.8119, "B_return_pct": 32.89, "B_hit_rate": 55.81, "B_n": 129, "B_bh_sharpe": 4.2474, "B_bh_return_pct": 64.1, "B_psr": 0.9568, "B_ic": 0.0134, "B_precision": 0.6374, "B_recall": 0.7073, "B_f1": 0.6705, "B_f2": 0.6921, "B_accuracy": 0.5581, "B_mcc": 0.0055, "B_tp": 58, "B_fp": 33, "B_tn": 14, "B_fn": 24, "D_sharpe": 1.7657, "D_sortino": 1.7383, "D_excess_sharpe": -0.0021, "D_return_pct": 11.75, "D_hit_rate": 53.91, "D_n": 129, "D_bh_sharpe": 1.7678, "D_bh_return_pct": 11.76, "D_psr": 0.8883, "D_ic": 0.1326, "D_precision": 0.6044, "D_recall": 0.7051, "D_f1": 0.6509, "D_f2": 0.6824, "D_accuracy": 0.5426, "D_mcc": -0.0008, "D_tp": 55, "D_fp": 36, "D_tn": 15, "D_fn": 23, "sharpe": 0.4223, "sortino": 0.457, "return_pct": 2.38, "equity": 1023.8000000000001, "max_dd": 0.0, "win_rate": 45.31, "profit_factor": 0.0, "ic": 0.0775, "hit": 45.31, "psr": 0.6183, "bh_sharpe": 1.7678, "bh_return_pct": 11.76, "excess_sharpe": -1.3455, "precision": 0.5467, "recall": 0.5256, "f1": 0.5359, "f2": 0.5297, "mcc": -0.1398, "accuracy": 0.4496, "tp": 41, "fp": 34, "tn": 17, "fn": 37}, {"fold": "fold_4", "regime": "China devaluation and oil crash", "n": 108, "A_sharpe": 0.4963, "A_sortino": 0.4721, "A_excess_sharpe": 1.1861, "A_return_pct": 3.51, "A_hit_rate": 52.34, "A_n": 108, "A_bh_sharpe": -0.6898, "A_bh_return_pct": -6.71, "A_psr": 0.6261, "A_ic": 0.085, "A_precision": 0.5179, "A_recall": 0.5472, "A_f1": 0.5321, "A_f2": 0.541, "A_accuracy": 0.5278, "A_mcc": 0.0563, "A_tp": 29, "A_fp": 27, "A_tn": 28, "A_fn": 24, "B_sharpe": -2.1282, "B_sortino": -2.0803, "B_excess_sharpe": -0.1707, "B_return_pct": -35.59, "B_hit_rate": 41.67, "B_n": 108, "B_bh_sharpe": -1.9575, "B_bh_return_pct": -33.56, "B_psr": 0.0833, "B_ic": -0.1013, "B_precision": 0.3889, "B_recall": 0.4118, "B_f1": 0.4, "B_f2": 0.407, "B_accuracy": 0.4167, "B_mcc": -0.1669, "B_tp": 21, "B_fp": 33, "B_tn": 24, "B_fn": 30, "D_sharpe": -0.5333, "D_sortino": -0.4889, "D_excess_sharpe": 0.1564, "D_return_pct": -5.42, "D_hit_rate": 49.53, "D_n": 108, "D_bh_sharpe": -0.6898, "D_bh_return_pct": -6.71, "D_psr": 0.363, "D_ic": -0.0004, "D_precision": 0.4815, "D_recall": 0.4906, "D_f1": 0.486, "D_f2": 0.4887, "D_accuracy": 0.4907, "D_mcc": -0.0185, "D_tp": 26, "D_fp": 28, "D_tn": 27, "D_fn": 27, "sharpe": 0.4963, "sortino": 0.4721, "return_pct": 3.51, "equity": 1035.1, "max_dd": 0.0, "win_rate": 52.34, "profit_factor": 0.0, "ic": 0.085, "hit": 52.34, "psr": 0.6261, "bh_sharpe": -0.6898, "bh_return_pct": -6.71, "excess_sharpe": 1.1861, "precision": 0.5179, "recall": 0.5472, "f1": 0.5321, "f2": 0.541, "mcc": 0.0563, "accuracy": 0.5278, "tp": 29, "fp": 27, "tn": 28, "fn": 24}, {"fold": "fold_5", "regime": "2018 Vol-mageddon + Q4 sell-off", "n": 128, "A_sharpe": -1.6883, "A_sortino": -1.7268, "A_excess_sharpe": -2.8394, "A_return_pct": -19.43, "A_hit_rate": 42.97, "A_n": 128, "A_bh_sharpe": 1.1511, "A_bh_return_pct": 13.19, "A_psr": 0.1219, "A_ic": -0.0211, "A_precision": 0.5439, "A_recall": 0.3974, "A_f1": 0.4593, "A_f2": 0.4201, "A_accuracy": 0.4297, "A_mcc": -0.1203, "A_tp": 31, "A_fp": 26, "A_tn": 24, "A_fn": 47, "B_sharpe": -2.9078, "B_sortino": -3.0933, "B_excess_sharpe": -5.7197, "B_return_pct": -51.95, "B_hit_rate": 33.07, "B_n": 128, "B_bh_sharpe": 2.8119, "B_bh_return_pct": 82.25, "B_psr": 0.0228, "B_ic": -0.0362, "B_precision": 0.5, "B_recall": 0.2588, "B_f1": 0.3411, "B_f2": 0.2865, "B_accuracy": 0.3359, "B_mcc": -0.2514, "B_tp": 22, "B_fp": 22, "B_tn": 21, "B_fn": 63, "D_sharpe": -0.3269, "D_sortino": -0.3842, "D_excess_sharpe": -1.478, "D_return_pct": -5.2, "D_hit_rate": 43.75, "D_n": 128, "D_bh_sharpe": 1.1511, "D_bh_return_pct": 13.19, "D_psr": 0.4091, "D_ic": -0.0094, "D_precision": 0.5682, "D_recall": 0.3205, "D_f1": 0.4098, "D_f2": 0.3511, "D_accuracy": 0.4375, "D_mcc": -0.0611, "D_tp": 25, "D_fp": 19, "D_tn": 31, "D_fn": 53, "sharpe": -1.6883, "sortino": -1.7268, "return_pct": -19.43, "equity": 805.6999999999999, "max_dd": 0.0, "win_rate": 42.97, "profit_factor": 0.0, "ic": -0.0211, "hit": 42.97, "psr": 0.1219, "bh_sharpe": 1.1511, "bh_return_pct": 13.19, "excess_sharpe": -2.8394, "precision": 0.5439, "recall": 0.3974, "f1": 0.4593, "f2": 0.4201, "mcc": -0.1203, "accuracy": 0.4297, "tp": 31, "fp": 26, "tn": 24, "fn": 47}, {"fold": "fold_6", "regime": "COVID crash and V-recovery", "n": 173, "A_sharpe": 1.2395, "A_sortino": 1.4386, "A_excess_sharpe": -1.0866, "A_return_pct": 20.43, "A_hit_rate": 49.13, "A_n": 173, "A_bh_sharpe": 2.3261, "A_bh_return_pct": 43.81, "A_psr": 0.8516, "A_ic": 0.0754, "A_precision": 0.6506, "A_recall": 0.4779, "A_f1": 0.551, "A_f2": 0.5047, "A_accuracy": 0.4913, "A_mcc": -0.0052, "A_tp": 54, "A_fp": 29, "A_tn": 31, "A_fn": 59, "B_sharpe": -0.8212, "B_sortino": -0.9302, "B_excess_sharpe": -6.5672, "B_return_pct": -31.06, "B_hit_rate": 43.02, "B_n": 173, "B_bh_sharpe": 5.746, "B_bh_return_pct": 499.04, "B_psr": 0.2527, "B_ic": 0.0576, "B_precision": 0.6226, "B_recall": 0.2973, "B_f1": 0.4024, "B_f2": 0.332, "B_accuracy": 0.4335, "B_mcc": -0.0263, "B_tp": 33, "B_fp": 20, "B_tn": 42, "B_fn": 78, "D_sharpe": -0.7223, "D_sortino": -0.7824, "D_excess_sharpe": -3.0484, "D_return_pct": -13.11, "D_hit_rate": 43.35, "D_n": 173, "D_bh_sharpe": 2.3261, "D_bh_return_pct": 43.81, "D_psr": 0.2769, "D_ic": 0.0118, "D_precision": 0.6415, "D_recall": 0.3009, "D_f1": 0.4096, "D_f2": 0.3366, "D_accuracy": 0.4335, "D_mcc": -0.0163, "D_tp": 34, "D_fp": 19, "D_tn": 41, "D_fn": 79, "sharpe": 1.2395, "sortino": 1.4386, "return_pct": 20.43, "equity": 1204.3, "max_dd": 0.0, "win_rate": 49.13, "profit_factor": 0.0, "ic": 0.0754, "hit": 49.13, "psr": 0.8516, "bh_sharpe": 2.3261, "bh_return_pct": 43.81, "excess_sharpe": -1.0866, "precision": 0.6506, "recall": 0.4779, "f1": 0.551, "f2": 0.5047, "mcc": -0.0052, "accuracy": 0.4913, "tp": 54, "fp": 29, "tn": 31, "fn": 59}, {"fold": "fold_7", "regime": "Inflation bear, AI rally and 2025", "n": 376, "A_sharpe": -0.4059, "A_sortino": -0.4609, "A_excess_sharpe": -1.2092, "A_return_pct": -15.9, "A_hit_rate": 43.09, "A_n": 376, "A_bh_sharpe": 0.8033, "A_bh_return_pct": 26.02, "A_psr": 0.313, "A_ic": -0.0117, "A_precision": 0.5321, "A_recall": 0.2624, "A_f1": 0.3515, "A_f2": 0.292, "A_accuracy": 0.4309, "A_mcc": -0.0722, "A_tp": 58, "A_fp": 51, "A_tn": 104, "A_fn": 163, "B_sharpe": -0.3559, "B_sortino": -0.3944, "B_excess_sharpe": -2.2876, "B_return_pct": -33.46, "B_hit_rate": 44.8, "B_n": 376, "B_bh_sharpe": 1.9317, "B_bh_return_pct": 222.05, "B_psr": 0.3331, "B_ic": -0.0462, "B_precision": 0.7174, "B_recall": 0.1454, "B_f1": 0.2418, "B_f2": 0.173, "B_accuracy": 0.4495, "B_mcc": 0.0868, "B_tp": 33, "B_fp": 13, "B_tn": 136, "B_fn": 194, "D_sharpe": -0.2418, "D_sortino": -0.2927, "D_excess_sharpe": -1.0451, "D_return_pct": -11.14, "D_hit_rate": 42.29, "D_n": 376, "D_bh_sharpe": 0.8033, "D_bh_return_pct": 26.02, "D_psr": 0.3853, "D_ic": -0.0129, "D_precision": 0.5435, "D_recall": 0.1131, "D_f1": 0.1873, "D_f2": 0.1344, "D_accuracy": 0.4229, "D_mcc": -0.0336, "D_tp": 25, "D_fp": 21, "D_tn": 134, "D_fn": 196, "sharpe": -0.4059, "sortino": -0.4609, "return_pct": -15.9, "equity": 841.0, "max_dd": 0.0, "win_rate": 43.09, "profit_factor": 0.0, "ic": -0.0117, "hit": 43.09, "psr": 0.313, "bh_sharpe": 0.8033, "bh_return_pct": 26.02, "excess_sharpe": -1.2092, "precision": 0.5321, "recall": 0.2624, "f1": 0.3515, "f2": 0.292, "mcc": -0.0722, "accuracy": 0.4309, "tp": 58, "fp": 51, "tn": 104, "fn": 163}], "per_window_val": [{"fold": "fold_1", "regime": "GFC peak crash (Lehman + Mar-2009 bottom)", "n": 65, "A_sharpe": 1.0135, "A_sortino": 1.0151, "A_excess_sharpe": 3.2392, "A_return_pct": 7.64, "A_hit_rate": 53.97, "A_n": 65, "A_bh_sharpe": -2.2257, "A_bh_return_pct": -18.74, "A_psr": 0.6968, "A_ic": 0.1514, "A_precision": 0.4912, "A_recall": 0.9655, "A_f1": 0.6512, "A_f2": 0.8092, "A_accuracy": 0.5385, "A_mcc": 0.242, "A_tp": 28, "A_fp": 29, "A_tn": 7, "A_fn": 1, "B_sharpe": -5.5303, "B_sortino": -4.6741, "B_excess_sharpe": 1.592, "B_return_pct": -65.66, "B_hit_rate": 36.92, "B_n": 65, "B_bh_sharpe": -7.1223, "B_bh_return_pct": -73.11, "B_psr": 0.0017, "B_ic": 0.11, "B_precision": 0.3594, "B_recall": 1.0, "B_f1": 0.5287, "B_f2": 0.7372, "B_accuracy": 0.3692, "B_mcc": 0.0925, "B_tp": 23, "B_fp": 41, "B_tn": 1, "B_fn": 0, "D_sharpe": -1.9865, "D_sortino": -1.6684, "D_excess_sharpe": 0.2392, "D_return_pct": -17.07, "D_hit_rate": 47.62, "D_n": 65, "D_bh_sharpe": -2.2257, "D_bh_return_pct": -18.74, "D_psr": 0.1434, "D_ic": 0.3317, "D_precision": 0.4531, "D_recall": 1.0, "D_f1": 0.6237, "D_f2": 0.8056, "D_accuracy": 0.4615, "D_mcc": 0.1122, "D_tp": 29, "D_fp": 35, "D_tn": 1, "D_fn": 0, "sharpe": 1.0135, "sortino": 1.0151, "return_pct": 7.64, "equity": 1076.4, "max_dd": 0.0, "win_rate": 53.97, "profit_factor": 0.0, "ic": 0.1514, "hit": 53.97, "psr": 0.6968, "bh_sharpe": -2.2257, "bh_return_pct": -18.74, "excess_sharpe": 3.2392, "precision": 0.4912, "recall": 0.9655, "f1": 0.6512, "f2": 0.8092, "mcc": 0.242, "accuracy": 0.5385, "tp": 28, "fp": 29, "tn": 7, "fn": 1}, {"fold": "fold_2", "regime": "2011 US-downgrade + EU debt", "n": 47, "A_sharpe": 1.9174, "A_sortino": 1.8395, "A_excess_sharpe": 2.1115, "A_return_pct": 11.85, "A_hit_rate": 57.45, "A_n": 47, "A_bh_sharpe": -0.1941, "A_bh_return_pct": -2.36, "A_psr": 0.7876, "A_ic": 0.1025, "A_precision": 0.5833, "A_recall": 0.8077, "A_f1": 0.6774, "A_f2": 0.75, "A_accuracy": 0.5745, "A_mcc": 0.1097, "A_tp": 21, "A_fp": 15, "A_tn": 6, "A_fn": 5, "B_sharpe": -0.5977, "B_sortino": -0.5307, "B_excess_sharpe": 1.0146, "B_return_pct": -12.84, "B_hit_rate": 51.06, "B_n": 47, "B_bh_sharpe": -1.6123, "B_bh_return_pct": -24.3, "B_psr": 0.3981, "B_ic": 0.1493, "B_precision": 0.4762, "B_recall": 0.9524, "B_f1": 0.6349, "B_f2": 0.7937, "B_accuracy": 0.5106, "B_mcc": 0.1713, "B_tp": 20, "B_fp": 22, "B_tn": 4, "B_fn": 1, "D_sharpe": -0.8316, "D_sortino": -0.7233, "D_excess_sharpe": -0.6375, "D_return_pct": -6.31, "D_hit_rate": 53.19, "D_n": 47, "D_bh_sharpe": -0.1941, "D_bh_return_pct": -2.36, "D_psr": 0.3595, "D_ic": 0.0059, "D_precision": 0.5476, "D_recall": 0.8846, "D_f1": 0.6765, "D_f2": 0.7877, "D_accuracy": 0.5319, "D_mcc": -0.0325, "D_tp": 23, "D_fp": 19, "D_tn": 2, "D_fn": 3, "sharpe": 1.9174, "sortino": 1.8395, "return_pct": 11.85, "equity": 1118.5, "max_dd": 0.0, "win_rate": 57.45, "profit_factor": 0.0, "ic": 0.1025, "hit": 57.45, "psr": 0.7876, "bh_sharpe": -0.1941, "bh_return_pct": -2.36, "excess_sharpe": 2.1115, "precision": 0.5833, "recall": 0.8077, "f1": 0.6774, "f2": 0.75, "mcc": 0.1097, "accuracy": 0.5745, "tp": 21, "fp": 15, "tn": 6, "fn": 5}, {"fold": "fold_3", "regime": "Taper tantrum and 2014 H1", "n": 5, "A_sharpe": 5.9118, "A_sortino": 4.2395, "A_excess_sharpe": 7.2312, "A_return_pct": 0.0, "A_hit_rate": 0.0, "A_n": 5, "A_bh_sharpe": -1.3194, "A_bh_return_pct": -0.21, "A_psr": 0.759, "A_ic": 0.6, "A_precision": 1.0, "A_recall": 0.5, "A_f1": 0.6667, "A_f2": 0.5556, "A_accuracy": 0.8, "A_mcc": 0.6124, "A_tp": 1, "A_fp": 0, "A_tn": 3, "A_fn": 1, "B_sharpe": 25.8705, "B_sortino": 0.0, "B_excess_sharpe": 51.7411, "B_return_pct": 3.95, "B_hit_rate": 100.0, "B_n": 5, "B_bh_sharpe": -25.8705, "B_bh_return_pct": -3.84, "B_psr": 1.0, "B_ic": -0.2, "B_precision": 0.0, "B_recall": 0.0, "B_f1": 0.0, "B_f2": 0.0, "B_accuracy": 1.0, "B_mcc": 0.0, "B_tp": 0, "B_fp": 0, "B_tn": 5, "B_fn": 0, "D_sharpe": 1.3194, "D_sortino": 1.268, "D_excess_sharpe": 2.6388, "D_return_pct": 0.2, "D_hit_rate": 60.0, "D_n": 5, "D_bh_sharpe": -1.3194, "D_bh_return_pct": -0.21, "D_psr": 0.5663, "D_ic": -0.3, "D_precision": 0.0, "D_recall": 0.0, "D_f1": 0.0, "D_f2": 0.0, "D_accuracy": 0.6, "D_mcc": 0.0, "D_tp": 0, "D_fp": 0, "D_tn": 3, "D_fn": 2, "sharpe": 5.9118, "sortino": 4.2395, "return_pct": 0.0, "equity": 1000.0, "max_dd": 0.0, "win_rate": 0.0, "profit_factor": 0.0, "ic": 0.6, "hit": 0.0, "psr": 0.759, "bh_sharpe": -1.3194, "bh_return_pct": -0.21, "excess_sharpe": 7.2312, "precision": 1.0, "recall": 0.5, "f1": 0.6667, "f2": 0.5556, "mcc": 0.6124, "accuracy": 0.8, "tp": 1, "fp": 0, "tn": 3, "fn": 1}, {"fold": "fold_4", "regime": "China devaluation and oil crash", "n": 47, "A_sharpe": -2.7384, "A_sortino": -2.5816, "A_excess_sharpe": -0.9147, "A_return_pct": -12.39, "A_hit_rate": 40.43, "A_n": 47, "A_bh_sharpe": -1.8238, "A_bh_return_pct": -8.68, "A_psr": 0.1224, "A_ic": -0.0519, "A_precision": 0.4054, "A_recall": 0.7143, "A_f1": 0.5172, "A_f2": 0.6198, "A_accuracy": 0.4043, "A_mcc": -0.1602, "A_tp": 15, "A_fp": 22, "A_tn": 4, "A_fn": 6, "B_sharpe": -0.3294, "B_sortino": -0.2704, "B_excess_sharpe": 1.8906, "B_return_pct": -6.72, "B_hit_rate": 53.19, "B_n": 47, "B_bh_sharpe": -2.22, "B_bh_return_pct": -23.98, "B_psr": 0.4432, "B_ic": 0.4954, "B_precision": 0.4884, "B_recall": 1.0, "B_f1": 0.6562, "B_f2": 0.8268, "B_accuracy": 0.5319, "B_mcc": 0.2741, "B_tp": 21, "B_fp": 22, "B_tn": 4, "B_fn": 0, "D_sharpe": -1.4435, "D_sortino": -1.3184, "D_excess_sharpe": 0.3803, "D_return_pct": -7.06, "D_hit_rate": 48.94, "D_n": 47, "D_bh_sharpe": -1.8238, "D_bh_return_pct": -8.68, "D_psr": 0.2677, "D_ic": 0.0739, "D_precision": 0.4651, "D_recall": 0.9524, "D_f1": 0.625, "D_f2": 0.7874, "D_accuracy": 0.4894, "D_mcc": 0.1207, "D_tp": 20, "D_fp": 23, "D_tn": 3, "D_fn": 1, "sharpe": -2.7384, "sortino": -2.5816, "return_pct": -12.39, "equity": 876.1, "max_dd": 0.0, "win_rate": 40.43, "profit_factor": 0.0, "ic": -0.0519, "hit": 40.43, "psr": 0.1224, "bh_sharpe": -1.8238, "bh_return_pct": -8.68, "excess_sharpe": -0.9147, "precision": 0.4054, "recall": 0.7143, "f1": 0.5172, "f2": 0.6198, "mcc": -0.1602, "accuracy": 0.4043, "tp": 15, "fp": 22, "tn": 4, "fn": 6}, {"fold": "fold_5", "regime": "2018 Vol-mageddon + Q4 sell-off", "n": 5, "A_sharpe": -10.1368, "A_sortino": -6.9937, "A_excess_sharpe": 0.0, "A_return_pct": -3.15, "A_hit_rate": 40.0, "A_n": 5, "A_bh_sharpe": -10.1368, "A_bh_return_pct": -3.15, "A_psr": 0.0985, "A_ic": 0.5, "A_precision": 0.4, "A_recall": 1.0, "A_f1": 0.5714, "A_f2": 0.7692, "A_accuracy": 0.4, "A_mcc": 0.0, "A_tp": 2, "A_fp": 3, "A_tn": 0, "A_fn": 0, "B_sharpe": 5.6858, "B_sortino": 6.0578, "B_excess_sharpe": 0.0, "B_return_pct": 4.22, "B_hit_rate": 60.0, "B_n": 5, "B_bh_sharpe": 5.6858, "B_bh_return_pct": 4.22, "B_psr": 0.753, "B_ic": 0.7, "B_precision": 0.6, "B_recall": 1.0, "B_f1": 0.75, "B_f2": 0.8824, "B_accuracy": 0.6, "B_mcc": 0.0, "B_tp": 3, "B_fp": 2, "B_tn": 0, "B_fn": 0, "D_sharpe": -10.1368, "D_sortino": -6.9937, "D_excess_sharpe": 0.0, "D_return_pct": -3.15, "D_hit_rate": 40.0, "D_n": 5, "D_bh_sharpe": -10.1368, "D_bh_return_pct": -3.15, "D_psr": 0.0985, "D_ic": 0.4, "D_precision": 0.4, "D_recall": 1.0, "D_f1": 0.5714, "D_f2": 0.7692, "D_accuracy": 0.4, "D_mcc": 0.0, "D_tp": 2, "D_fp": 3, "D_tn": 0, "D_fn": 0, "sharpe": -10.1368, "sortino": -6.9937, "return_pct": -3.15, "equity": 968.5, "max_dd": 0.0, "win_rate": 40.0, "profit_factor": 0.0, "ic": 0.5, "hit": 40.0, "psr": 0.0985, "bh_sharpe": -10.1368, "bh_return_pct": -3.15, "excess_sharpe": 0.0, "precision": 0.4, "recall": 1.0, "f1": 0.5714, "f2": 0.7692, "mcc": 0.0, "accuracy": 0.4, "tp": 2, "fp": 3, "tn": 0, "fn": 0}, {"fold": "fold_6", "regime": "COVID crash and V-recovery", "n": 26, "A_sharpe": 5.5066, "A_sortino": 6.8394, "A_excess_sharpe": 2.2214, "A_return_pct": 7.99, "A_hit_rate": 61.54, "A_n": 26, "A_bh_sharpe": 3.2852, "A_bh_return_pct": 4.82, "A_psr": 0.9615, "A_ic": 0.4537, "A_precision": 0.75, "A_recall": 0.5625, "A_f1": 0.6429, "A_f2": 0.5921, "A_accuracy": 0.6154, "A_mcc": 0.2562, "A_tp": 9, "A_fp": 3, "A_tn": 7, "A_fn": 7, "B_sharpe": -1.1584, "B_sortino": -1.1136, "B_excess_sharpe": -14.1376, "B_return_pct": -4.26, "B_hit_rate": 50.0, "B_n": 26, "B_bh_sharpe": 12.9792, "B_bh_return_pct": 38.76, "B_psr": 0.3586, "B_ic": 0.5118, "B_precision": 1.0, "B_recall": 0.381, "B_f1": 0.5517, "B_f2": 0.4348, "B_accuracy": 0.5, "B_mcc": 0.3253, "B_tp": 8, "B_fp": 0, "B_tn": 5, "B_fn": 13, "D_sharpe": 3.6509, "D_sortino": 4.6118, "D_excess_sharpe": 0.3657, "D_return_pct": 5.36, "D_hit_rate": 53.85, "D_n": 26, "D_bh_sharpe": 3.2852, "D_bh_return_pct": 4.82, "D_psr": 0.8828, "D_ic": 0.4516, "D_precision": 0.75, "D_recall": 0.375, "D_f1": 0.5, "D_f2": 0.4167, "D_accuracy": 0.5385, "D_mcc": 0.1845, "D_tp": 6, "D_fp": 2, "D_tn": 8, "D_fn": 10, "sharpe": 5.5066, "sortino": 6.8394, "return_pct": 7.99, "equity": 1079.9, "max_dd": 0.0, "win_rate": 61.54, "profit_factor": 0.0, "ic": 0.4537, "hit": 61.54, "psr": 0.9615, "bh_sharpe": 3.2852, "bh_return_pct": 4.82, "excess_sharpe": 2.2214, "precision": 0.75, "recall": 0.5625, "f1": 0.6429, "f2": 0.5921, "mcc": 0.2562, "accuracy": 0.6154, "tp": 9, "fp": 3, "tn": 7, "fn": 7}, {"fold": "fold_7", "regime": "Inflation bear, AI rally and 2025", "n": 65, "A_sharpe": 2.3722, "A_sortino": 2.1943, "A_excess_sharpe": 0.2933, "A_return_pct": 9.39, "A_hit_rate": 61.54, "A_n": 65, "A_bh_sharpe": 2.0789, "A_bh_return_pct": 8.17, "A_psr": 0.8767, "A_ic": 0.2437, "A_precision": 0.7778, "A_recall": 0.4, "A_f1": 0.5283, "A_f2": 0.443, "A_accuracy": 0.6154, "A_mcc": 0.2971, "A_tp": 14, "A_fp": 4, "A_tn": 26, "A_fn": 21, "B_sharpe": -2.4294, "B_sortino": -2.4416, "B_excess_sharpe": -7.6608, "B_return_pct": -17.7, "B_hit_rate": 38.46, "B_n": 65, "B_bh_sharpe": 5.2314, "B_bh_return_pct": 44.53, "B_psr": 0.1128, "B_ic": 0.0948, "B_precision": 1.0, "B_recall": 0.090