{"experiment_num": 100, "backbone": "catboost", "description": "CatBoost lr=0.02 n_est=2000 - combine best CatBoost findings (lr from exp 98, capacity from exp 18) - exp 100 milestone", "config": {"seq_len": 60, "lr": 0.0003, "batch_size": 32, "epochs": 50, "weight_decay": 1e-05, "patience": 10, "warmup_epochs": 0, "head_dropout": 0.1, "huber_delta": 1.0, "grad_clip": 1.0, "seed": 42, "hidden_size": null, "num_layers": null, "max_depth": 4, "gbm_lr": 0.02, "n_estimators": 2000}, "composite": -0.8764, "test_pos_folds": 3, "val_pos_folds": 1, "val_loss": null, "elapsed_sec": 2594.9, "timestamp": "2026-04-28T01:31:06", "sharpe": -0.1626, "val_sharpe": -0.4764, "ic": 0.0008, "hit": 46.43, "psr": 0.3694, "equity": 768.9, "return_pct": -23.11, "bh_sharpe": 1.2194, "bh_return_pct": 187.05, "excess_sharpe": -1.382, "B_sharpe": -0.4677, "B_excess_sharpe": -3.2958, "B_return_pct": -74.78, "D_sharpe": -0.1659, "D_excess_sharpe": -1.3852, "D_return_pct": -23.34, "precision": 0.5761, "recall": 0.3655, "f1": 0.4472, "f2": 0.3943, "mcc": -0.0257, "accuracy": 0.4649, "val_precision": 0.4967, "val_recall": 0.5725, "val_f1": 0.5319, "val_f2": 0.5556, "val_mcc": -0.0168, "val_accuracy": 0.4923, "per_window": [{"fold": "fold_1", "regime": "GFC peak crash (Lehman + Mar-2009 bottom)", "n": 66, "A_sharpe": -2.6182, "A_sortino": -2.5708, "A_excess_sharpe": -3.1903, "A_return_pct": -23.8, "A_hit_rate": 40.91, "A_n": 66, "A_bh_sharpe": 0.5721, "A_bh_return_pct": 3.85, "A_psr": 0.0954, "A_ic": -0.005, "A_precision": 0.4, "A_recall": 0.2286, "A_f1": 0.2909, "A_f2": 0.25, "A_accuracy": 0.4091, "A_mcc": -0.1722, "A_tp": 8, "A_fp": 12, "A_tn": 19, "A_fn": 27, "B_sharpe": 1.1262, "B_sortino": 1.2103, "B_excess_sharpe": -0.9207, "B_return_pct": 16.08, "B_hit_rate": 50.77, "B_n": 66, "B_bh_sharpe": 2.0469, "B_bh_return_pct": 39.28, "B_psr": 0.7172, "B_ic": 0.1892, "B_precision": 0.5517, "B_recall": 0.4444, "B_f1": 0.4923, "B_f2": 0.4624, "B_accuracy": 0.5, "B_mcc": 0.0111, "B_tp": 16, "B_fp": 13, "B_tn": 17, "B_fn": 20, "D_sharpe": 2.4474, "D_sortino": 2.4874, "D_excess_sharpe": 1.8752, "D_return_pct": 24.48, "D_hit_rate": 57.58, "D_n": 66, "D_bh_sharpe": 0.5721, "D_bh_return_pct": 3.85, "D_psr": 0.8904, "D_ic": 0.1592, "D_precision": 0.6207, "D_recall": 0.5143, "D_f1": 0.5625, "D_f2": 0.5325, "D_accuracy": 0.5758, "D_mcc": 0.1603, "D_tp": 18, "D_fp": 11, "D_tn": 20, "D_fn": 17, "sharpe": -2.6182, "sortino": -2.5708, "return_pct": -23.8, "equity": 762.0, "max_dd": 0.0, "win_rate": 40.91, "profit_factor": 0.0, "ic": -0.005, "hit": 40.91, "psr": 0.0954, "bh_sharpe": 0.5721, "bh_return_pct": 3.85, "excess_sharpe": -3.1903, "precision": 0.4, "recall": 0.2286, "f1": 0.2909, "f2": 0.25, "mcc": -0.1722, "accuracy": 0.4091, "tp": 8, "fp": 12, "tn": 19, "fn": 27}, {"fold": "fold_2", "regime": "2011 US-downgrade + EU debt", "n": 87, "A_sharpe": 4.0159, "A_sortino": 4.9797, "A_excess_sharpe": -1.0061, "A_return_pct": 23.08, "A_hit_rate": 60.47, "A_n": 87, "A_bh_sharpe": 5.022, "A_bh_return_pct": 29.23, "A_psr": 0.9952, "A_ic": 0.1257, "A_precision": 0.6852, "A_recall": 0.6852, "A_f1": 0.6852, "A_f2": 0.6852, "A_accuracy": 0.6092, "A_mcc": 0.17, "A_tp": 37, "A_fp": 17, "A_tn": 16, "A_fn": 17, "B_sharpe": 5.5535, "B_sortino": 5.9808, "B_excess_sharpe": -5.5834, "B_return_pct": 81.23, "B_hit_rate": 65.52, "B_n": 87, "B_bh_sharpe": 11.1369, "B_bh_return_pct": 185.4, "B_psr": 0.9994, "B_ic": 0.2419, "B_precision": 0.8929, "B_recall": 0.6757, "B_f1": 0.7692, "B_f2": 0.7102, "B_accuracy": 0.6552, "B_mcc": 0.1594, "B_tp": 50, "B_fp": 6, "B_tn": 7, "B_fn": 24, "D_sharpe": 2.2838, "D_sortino": 2.6321, "D_excess_sharpe": -2.7382, "D_return_pct": 12.62, "D_hit_rate": 56.98, "D_n": 87, "D_bh_sharpe": 5.022, "D_bh_return_pct": 29.23, "D_psr": 0.9216, "D_ic": 0.0918, "D_precision": 0.6429, "D_recall": 0.6667, "D_f1": 0.6545, "D_f2": 0.6618, "D_accuracy": 0.5632, "D_mcc": 0.0614, "D_tp": 36, "D_fp": 20, "D_tn": 13, "D_fn": 18, "sharpe": 4.0159, "sortino": 4.9797, "return_pct": 23.08, "equity": 1230.8, "max_dd": 0.0, "win_rate": 60.47, "profit_factor": 0.0, "ic": 0.1257, "hit": 60.47, "psr": 0.9952, "bh_sharpe": 5.022, "bh_return_pct": 29.23, "excess_sharpe": -1.0061, "precision": 0.6852, "recall": 0.6852, "f1": 0.6852, "f2": 0.6852, "mcc": 0.17, "accuracy": 0.6092, "tp": 37, "fp": 17, "tn": 16, "fn": 17}, {"fold": "fold_3", "regime": "Taper tantrum and 2014 H1", "n": 129, "A_sharpe": 0.212, "A_sortino": 0.1976, "A_excess_sharpe": -1.5558, "A_return_pct": 0.97, "A_hit_rate": 50.78, "A_n": 129, "A_bh_sharpe": 1.7678, "A_bh_return_pct": 11.76, "A_psr": 0.5598, "A_ic": 0.0556, "A_precision": 0.5729, "A_recall": 0.7051, "A_f1": 0.6322, "A_f2": 0.674, "A_accuracy": 0.5039, "A_mcc": -0.1107, "A_tp": 55, "A_fp": 41, "A_tn": 10, "A_fn": 23, "B_sharpe": 1.9657, "B_sortino": 1.9262, "B_excess_sharpe": -2.2817, "B_return_pct": 25.55, "B_hit_rate": 57.36, "B_n": 129, "B_bh_sharpe": 4.2474, "B_bh_return_pct": 64.1, "B_psr": 0.9162, "B_ic": -0.0121, "B_precision": 0.6311, "B_recall": 0.7927, "B_f1": 0.7027, "B_f2": 0.7541, "B_accuracy": 0.5736, "B_mcc": -0.019, "B_tp": 65, "B_fp": 38, "B_tn": 9, "B_fn": 17, "D_sharpe": 0.8386, "D_sortino": 0.7413, "D_excess_sharpe": -0.9292, "D_return_pct": 5.21, "D_hit_rate": 57.03, "D_n": 129, "D_bh_sharpe": 1.7678, "D_bh_return_pct": 11.76, "D_psr": 0.7211, "D_ic": 0.0887, "D_precision": 0.6117, "D_recall": 0.8077, "D_f1": 0.6961, "D_f2": 0.759, "D_accuracy": 0.5736, "D_mcc": 0.0285, "D_tp": 63, "D_fp": 40, "D_tn": 11, "D_fn": 15, "sharpe": 0.212, "sortino": 0.1976, "return_pct": 0.97, "equity": 1009.7, "max_dd": 0.0, "win_rate": 50.78, "profit_factor": 0.0, "ic": 0.0556, "hit": 50.78, "psr": 0.5598, "bh_sharpe": 1.7678, "bh_return_pct": 11.76, "excess_sharpe": -1.5558, "precision": 0.5729, "recall": 0.7051, "f1": 0.6322, "f2": 0.674, "mcc": -0.1107, "accuracy": 0.5039, "tp": 55, "fp": 41, "tn": 10, "fn": 23}, {"fold": "fold_4", "regime": "China devaluation and oil crash", "n": 108, "A_sharpe": -0.1125, "A_sortino": -0.1083, "A_excess_sharpe": 0.5772, "A_return_pct": -1.87, "A_hit_rate": 50.47, "A_n": 108, "A_bh_sharpe": -0.6898, "A_bh_return_pct": -6.71, "A_psr": 0.4708, "A_ic": 0.0019, "A_precision": 0.5, "A_recall": 0.5094, "A_f1": 0.5047, "A_f2": 0.5075, "A_accuracy": 0.5093, "A_mcc": 0.0185, "A_tp": 27, "A_fp": 27, "A_tn": 28, "A_fn": 26, "B_sharpe": -4.0298, "B_sortino": -3.6343, "B_excess_sharpe": -2.0723, "B_return_pct": -54.12, "B_hit_rate": 37.96, "B_n": 108, "B_bh_sharpe": -1.9575, "B_bh_return_pct": -33.56, "B_psr": 0.0035, "B_ic": -0.1076, "B_precision": 0.3519, "B_recall": 0.3725, "B_f1": 0.3619, "B_f2": 0.3682, "B_accuracy": 0.3796, "B_mcc": -0.2411, "B_tp": 19, "B_fp": 35, "B_tn": 22, "B_fn": 32, "D_sharpe": -1.6377, "D_sortino": -1.5055, "D_excess_sharpe": -0.9479, "D_return_pct": -14.09, "D_hit_rate": 45.79, "D_n": 108, "D_bh_sharpe": -0.6898, "D_bh_return_pct": -6.71, "D_psr": 0.1385, "D_ic": -0.0158, "D_precision": 0.4444, "D_recall": 0.4528, "D_f1": 0.4486, "D_f2": 0.4511, "D_accuracy": 0.4537, "D_mcc": -0.0926, "D_tp": 24, "D_fp": 30, "D_tn": 25, "D_fn": 29, "sharpe": -0.1125, "sortino": -0.1083, "return_pct": -1.87, "equity": 981.3, "max_dd": 0.0, "win_rate": 50.47, "profit_factor": 0.0, "ic": 0.0019, "hit": 50.47, "psr": 0.4708, "bh_sharpe": -0.6898, "bh_return_pct": -6.71, "excess_sharpe": 0.5772, "precision": 0.5, "recall": 0.5094, "f1": 0.5047, "f2": 0.5075, "mcc": 0.0185, "accuracy": 0.5093, "tp": 27, "fp": 27, "tn": 28, "fn": 26}, {"fold": "fold_5", "regime": "2018 Vol-mageddon + Q4 sell-off", "n": 128, "A_sharpe": -1.1077, "A_sortino": -1.1712, "A_excess_sharpe": -2.2588, "A_return_pct": -13.68, "A_hit_rate": 43.75, "A_n": 128, "A_bh_sharpe": 1.1511, "A_bh_return_pct": 13.19, "A_psr": 0.2203, "A_ic": -0.0698, "A_precision": 0.5429, "A_recall": 0.4872, "A_f1": 0.5135, "A_f2": 0.4974, "A_accuracy": 0.4375, "A_mcc": -0.1498, "A_tp": 38, "A_fp": 32, "A_tn": 18, "A_fn": 40, "B_sharpe": -4.1124, "B_sortino": -3.9456, "B_excess_sharpe": -6.9243, "B_return_pct": -63.17, "B_hit_rate": 33.86, "B_n": 128, "B_bh_sharpe": 2.8119, "B_bh_return_pct": 82.25, "B_psr": 0.0019, "B_ic": -0.1279, "B_precision": 0.5088, "B_recall": 0.3412, "B_f1": 0.4085, "B_f2": 0.3652, "B_accuracy": 0.3438, "B_mcc": -0.2946, "B_tp": 29, "B_fp": 28, "B_tn": 15, "B_fn": 56, "D_sharpe": -2.0167, "D_sortino": -2.083, "D_excess_sharpe": -3.1678, "D_return_pct": -22.49, "D_hit_rate": 41.41, "D_n": 128, "D_bh_sharpe": 1.1511, "D_bh_return_pct": 13.19, "D_psr": 0.0841, "D_ic": -0.079, "D_precision": 0.5263, "D_recall": 0.3846, "D_f1": 0.4444, "D_f2": 0.4065, "D_accuracy": 0.4141, "D_mcc": -0.1525, "D_tp": 30, "D_fp": 27, "D_tn": 23, "D_fn": 48, "sharpe": -1.1077, "sortino": -1.1712, "return_pct": -13.68, "equity": 863.1999999999999, "max_dd": 0.0, "win_rate": 43.75, "profit_factor": 0.0, "ic": -0.0698, "hit": 43.75, "psr": 0.2203, "bh_sharpe": 1.1511, "bh_return_pct": 13.19, "excess_sharpe": -2.2588, "precision": 0.5429, "recall": 0.4872, "f1": 0.5135, "f2": 0.4974, "mcc": -0.1498, "accuracy": 0.4375, "tp": 38, "fp": 32, "tn": 18, "fn": 40}, {"fold": "fold_6", "regime": "COVID crash and V-recovery", "n": 173, "A_sharpe": 0.8292, "A_sortino": 0.9666, "A_excess_sharpe": -1.4969, "A_return_pct": 12.52, "A_hit_rate": 47.4, "A_n": 173, "A_bh_sharpe": 2.3261, "A_bh_return_pct": 43.81, "A_psr": 0.7564, "A_ic": 0.0505, "A_precision": 0.6667, "A_recall": 0.3894, "A_f1": 0.4916, "A_f2": 0.4247, "A_accuracy": 0.474, "A_mcc": 0.0223, "A_tp": 44, "A_fp": 22, "A_tn": 38, "A_fn": 69, "B_sharpe": 0.2601, "B_sortino": 0.2842, "B_excess_sharpe": -5.4859, "B_return_pct": 0.33, "B_hit_rate": 48.84, "B_n": 173, "B_bh_sharpe": 5.746, "B_bh_return_pct": 499.04, "B_psr": 0.5854, "B_ic": 0.0956, "B_precision": 0.7091, "B_recall": 0.3514, "B_f1": 0.4699, "B_f2": 0.3908, "B_accuracy": 0.4913, "B_mcc": 0.0961, "B_tp": 39, "B_fp": 16, "B_tn": 46, "B_fn": 72, "D_sharpe": 0.063, "D_sortino": 0.0735, "D_excess_sharpe": -2.263, "D_return_pct": -0.96, "D_hit_rate": 43.35, "D_n": 173, "D_bh_sharpe": 2.3261, "D_bh_return_pct": 43.81, "D_psr": 0.5208, "D_ic": 0.0002, "D_precision": 0.6364, "D_recall": 0.3097, "D_f1": 0.4167, "D_f2": 0.3452, "D_accuracy": 0.4335, "D_mcc": -0.0241, "D_tp": 35, "D_fp": 20, "D_tn": 40, "D_fn": 78, "sharpe": 0.8292, "sortino": 0.9666, "return_pct": 12.52, "equity": 1125.2, "max_dd": 0.0, "win_rate": 47.4, "profit_factor": 0.0, "ic": 0.0505, "hit": 47.4, "psr": 0.7564, "bh_sharpe": 2.3261, "bh_return_pct": 43.81, "excess_sharpe": -1.4969, "precision": 0.6667, "recall": 0.3894, "f1": 0.4916, "f2": 0.4247, "mcc": 0.0223, "accuracy": 0.474, "tp": 44, "fp": 22, "tn": 38, "fn": 69}, {"fold": "fold_7", "regime": "Inflation bear, AI rally and 2025", "n": 376, "A_sharpe": -0.3681, "A_sortino": -0.443, "A_excess_sharpe": -1.1714, "A_return_pct": -14.82, "A_hit_rate": 42.02, "A_n": 376, "A_bh_sharpe": 0.8033, "A_bh_return_pct": 26.02, "A_psr": 0.3296, "A_ic": 0.009, "A_precision": 0.5366, "A_recall": 0.0995, "A_f1": 0.1679, "A_f2": 0.1189, "A_accuracy": 0.4202, "A_mcc": -0.0364, "A_tp": 22, "A_fp": 19, "A_tn": 136, "A_fn": 199, "B_sharpe": -0.596, "B_sortino": -0.6751, "B_excess_sharpe": -2.5277, "B_return_pct": -43.66, "B_hit_rate": 42.13, "B_n": 376, "B_bh_sharpe": 1.9317, "B_bh_return_pct": 222.05, "B_psr": 0.2362, "B_ic": -0.0614, "B_precision": 0.7778, "B_recall": 0.0617, "B_f1": 0.1143, "B_f2": 0.0756, "B_accuracy": 0.4229, "B_mcc": 0.0798, "B_tp": 14, "B_fp": 4, "B_tn": 145, "B_fn": 213, "D_sharpe": -0.6006, "D_sortino": -0.711, "D_excess_sharpe": -1.4039, "D_return_pct": -21.19, "D_hit_rate": 41.76, "D_n": 376, "D_bh_sharpe": 0.8033, "D_bh_return_pct": 26.02, "D_psr": 0.2385, "D_ic": -0.0176, "D_precision": 0.5556, "D_recall": 0.0452, "D_f1": 0.0837, "D_f2": 0.0554, "D_accuracy": 0.4176, "D_mcc": -0.0147, "D_tp": 10, "D_fp": 8, "D_tn": 147, "D_fn": 211, "sharpe": -0.3681, "sortino": -0.443, "return_pct": -14.82, "equity": 851.8, "max_dd": 0.0, "win_rate": 42.02, "profit_factor": 0.0, "ic": 0.009, "hit": 42.02, "psr": 0.3296, "bh_sharpe": 0.8033, "bh_return_pct": 26.02, "excess_sharpe": -1.1714, "precision": 0.5366, "recall": 0.0995, "f1": 0.1679, "f2": 0.1189, "mcc": -0.0364, "accuracy": 0.4202, "tp": 22, "fp": 19, "tn": 136, "fn": 199}], "per_window_val": [{"fold": "fold_1", "regime": "GFC peak crash (Lehman + Mar-2009 bottom)", "n": 65, "A_sharpe": -0.3905, "A_sortino": -0.3681, "A_excess_sharpe": 1.8351, "A_return_pct": -4.78, "A_hit_rate": 49.21, "A_n": 65, "A_bh_sharpe": -2.2257, "A_bh_return_pct": -18.74, "A_psr": 0.4215, "A_ic": 0.1508, "A_precision": 0.4615, "A_recall": 0.8276, "A_f1": 0.5926, "A_f2": 0.7143, "A_accuracy": 0.4923, "A_mcc": 0.0619, "A_tp": 24, "A_fp": 28, "A_tn": 8, "A_fn": 5, "B_sharpe": -0.9765, "B_sortino": -1.0909, "B_excess_sharpe": 6.1458, "B_return_pct": -22.46, "B_hit_rate": 46.15, "B_n": 65, "B_bh_sharpe": -7.1223, "B_bh_return_pct": -73.11, "B_psr": 0.3173, "B_ic": 0.3937, "B_precision": 0.3966, "B_recall": 1.0, "B_f1": 0.5679, "B_f2": 0.7667, "B_accuracy": 0.4615, "B_mcc": 0.2571, "B_tp": 23, "B_fp": 35, "B_tn": 7, "B_fn": 0, "D_sharpe": 1.2932, "D_sortino": 1.2601, "D_excess_sharpe": 3.5188, "D_return_pct": 10.28, "D_hit_rate": 57.14, "D_n": 65, "D_bh_sharpe": -2.2257, "D_bh_return_pct": -18.74, "D_psr": 0.7449, "D_ic": 0.3675, "D_precision": 0.5, "D_recall": 1.0, "D_f1": 0.6667, "D_f2": 0.8333, "D_accuracy": 0.5538, "D_mcc": 0.3118, "D_tp": 29, "D_fp": 29, "D_tn": 7, "D_fn": 0, "sharpe": -0.3905, "sortino": -0.3681, "return_pct": -4.78, "equity": 952.2, "max_dd": 0.0, "win_rate": 49.21, "profit_factor": 0.0, "ic": 0.1508, "hit": 49.21, "psr": 0.4215, "bh_sharpe": -2.2257, "bh_return_pct": -18.74, "excess_sharpe": 1.8351, "precision": 0.4615, "recall": 0.8276, "f1": 0.5926, "f2": 0.7143, "mcc": 0.0619, "accuracy": 0.4923, "tp": 24, "fp": 28, "tn": 8, "fn": 5}, {"fold": "fold_2", "regime": "2011 US-downgrade + EU debt", "n": 47, "A_sharpe": -0.4767, "A_sortino": -0.4467, "A_excess_sharpe": -0.2826, "A_return_pct": -4.13, "A_hit_rate": 51.06, "A_n": 47, "A_bh_sharpe": -0.1941, "A_bh_return_pct": -2.36, "A_psr": 0.419, "A_ic": 0.0178, "A_precision": 0.5484, "A_recall": 0.6538, "A_f1": 0.5965, "A_f2": 0.6296, "A_accuracy": 0.5106, "A_mcc": -0.0135, "A_tp": 17, "A_fp": 14, "A_tn": 7, "A_fn": 9, "B_sharpe": 0.9933, "B_sortino": 0.8924, "B_excess_sharpe": 2.6057, "B_return_pct": 8.89, "B_hit_rate": 55.32, "B_n": 47, "B_bh_sharpe": -1.6123, "B_bh_return_pct": -24.3, "B_psr": 0.6611, "B_ic": 0.1928, "B_precision": 0.5, "B_recall": 0.9524, "B_f1": 0.6557, "B_f2": 0.8065, "B_accuracy": 0.5532, "B_mcc": 0.2558, "B_tp": 20, "B_fp": 20, "B_tn": 6, "B_fn": 1, "D_sharpe": 0.7679, "D_sortino": 0.7043, "D_excess_sharpe": 0.962, "D_return_pct": 3.91, "D_hit_rate": 57.45, "D_n": 47, "D_bh_sharpe": -0.1941, "D_bh_return_pct": -2.36, "D_psr": 0.6277, "D_ic": 0.0149, "D_precision": 0.575, "D_recall": 0.8846, "D_f1": 0.697, "D_f2": 0.7986, "D_accuracy": 0.5745, "D_mcc": 0.1049, "D_tp": 23, "D_fp": 17, "D_tn": 4, "D_fn": 3, "sharpe": -0.4767, "sortino": -0.4467, "return_pct": -4.13, "equity": 958.7, "max_dd": 0.0, "win_rate": 51.06, "profit_factor": 0.0, "ic": 0.0178, "hit": 51.06, "psr": 0.419, "bh_sharpe": -0.1941, "bh_return_pct": -2.36, "excess_sharpe": -0.2826, "precision": 0.5484, "recall": 0.6538, "f1": 0.5965, "f2": 0.6296, "mcc": -0.0135, "accuracy": 0.5106, "tp": 17, "fp": 14, "tn": 7, "fn": 9}, {"fold": "fold_3", "regime": "Taper tantrum and 2014 H1", "n": 5, "A_sharpe": -10.4634, "A_sortino": -7.0126, "A_excess_sharpe": -9.144, "A_return_pct": -1.37, "A_hit_rate": 40.0, "A_n": 5, "A_bh_sharpe": -1.3194, "A_bh_return_pct": -0.21, "A_psr": 0.0711, "A_ic": -0.8, "A_precision": 0.0, "A_recall": 0.0, "A_f1": 0.0, "A_f2": 0.0, "A_accuracy": 0.4, "A_mcc": -0.4082, "A_tp": 0, "A_fp": 1, "A_tn": 2, "A_fn": 2, "B_sharpe": 25.8705, "B_sortino": 0.0, "B_excess_sharpe": 51.7411, "B_return_pct": 3.95, "B_hit_rate": 100.0, "B_n": 5, "B_bh_sharpe": -25.8705, "B_bh_return_pct": -3.84, "B_psr": 1.0, "B_ic": -0.2, "B_precision": 0.0, "B_recall": 0.0, "B_f1": 0.0, "B_f2": 0.0, "B_accuracy": 1.0, "B_mcc": 0.0, "B_tp": 0, "B_fp": 0, "B_tn": 5, "B_fn": 0, "D_sharpe": 1.3194, "D_sortino": 1.268, "D_excess_sharpe": 2.6388, "D_return_pct": 0.2, "D_hit_rate": 60.0, "D_n": 5, "D_bh_sharpe": -1.3194, "D_bh_return_pct": -0.21, "D_psr": 0.5663, "D_ic": -0.3, "D_precision": 0.0, "D_recall": 0.0, "D_f1": 0.0, "D_f2": 0.0, "D_accuracy": 0.6, "D_mcc": 0.0, "D_tp": 0, "D_fp": 0, "D_tn": 3, "D_fn": 2, "sharpe": -10.4634, "sortino": -7.0126, "return_pct": -1.37, "equity": 986.3, "max_dd": 0.0, "win_rate": 40.0, "profit_factor": 0.0, "ic": -0.8, "hit": 40.0, "psr": 0.0711, "bh_sharpe": -1.3194, "bh_return_pct": -0.21, "excess_sharpe": -9.144, "precision": 0.0, "recall": 0.0, "f1": 0.0, "f2": 0.0, "mcc": -0.4082, "accuracy": 0.4, "tp": 0, "fp": 1, "tn": 2, "fn": 2}, {"fold": "fold_4", "regime": "China devaluation and oil crash", "n": 47, "A_sharpe": -1.4163, "A_sortino": -1.374, "A_excess_sharpe": 0.4075, "A_return_pct": -6.94, "A_hit_rate": 44.68, "A_n": 47, "A_bh_sharpe": -1.8238, "A_bh_return_pct": -8.68, "A_psr": 0.2728, "A_ic": -0.0015, "A_precision": 0.4359, "A_recall": 0.8095, "A_f1": 0.5667, "A_f2": 0.6911, "A_accuracy": 0.4468, "A_mcc": -0.0485, "A_tp": 17, "A_fp": 22, "A_tn": 4, "A_fn": 4, "B_sharpe": -1.3059, "B_sortino": -1.1251, "B_excess_sharpe": 0.9141, "B_return_pct": -16.14, "B_hit_rate": 46.81, "B_n": 47, "B_bh_sharpe": -2.22, "B_bh_return_pct": -23.98, "B_psr": 0.2778, "B_ic": 0.5195, "B_precision": 0.4545, "B_recall": 0.9524, "B_f1": 0.6154, "B_f2": 0.7812, "B_accuracy": 0.4681, "B_mcc": 0.0596, "B_tp": 20, "B_fp": 24, "B_tn": 2, "B_fn": 1, "D_sharpe": -0.5766, "D_sortino": -0.5759, "D_excess_sharpe": 1.2472, "D_return_pct": -3.23, "D_hit_rate": 46.81, "D_n": 47, "D_bh_sharpe": -1.8238, "D_bh_return_pct": -8.68, "D_psr": 0.4028, "D_ic": 0.148, "D_precision": 0.4545, "D_recall": 0.9524, "D_f1": 0.6154, "D_f2": 0.7812, "D_accuracy": 0.4681, "D_mcc": 0.0596, "D_tp": 20, "D_fp": 24, "D_tn": 2, "D_fn": 1, "sharpe": -1.4163, "sortino": -1.374, "return_pct": -6.94, "equity": 930.6, "max_dd": 0.0, "win_rate": 44.68, "profit_factor": 0.0, "ic": -0.0015, "hit": 44.68, "psr": 0.2728, "bh_sharpe": -1.8238, "bh_return_pct": -8.68, "excess_sharpe": 0.4075, "precision": 0.4359, "recall": 0.8095, "f1": 0.5667, "f2": 0.6911, "mcc": -0.0485, "accuracy": 0.4468, "tp": 17, "fp": 22, "tn": 4, "fn": 4}, {"fold": "fold_5", "regime": "2018 Vol-mageddon + Q4 sell-off", "n": 5, "A_sharpe": -10.1368, "A_sortino": -6.9937, "A_excess_sharpe": 0.0, "A_return_pct": -3.15, "A_hit_rate": 40.0, "A_n": 5, "A_bh_sharpe": -10.1368, "A_bh_return_pct": -3.15, "A_psr": 0.0985, "A_ic": 0.6, "A_precision": 0.4, "A_recall": 1.0, "A_f1": 0.5714, "A_f2": 0.7692, "A_accuracy": 0.4, "A_mcc": 0.0, "A_tp": 2, "A_fp": 3, "A_tn": 0, "A_fn": 0, "B_sharpe": 5.6858, "B_sortino": 6.0578, "B_excess_sharpe": 0.0, "B_return_pct": 4.22, "B_hit_rate": 60.0, "B_n": 5, "B_bh_sharpe": 5.6858, "B_bh_return_pct": 4.22, "B_psr": 0.753, "B_ic": 0.9, "B_precision": 0.6, "B_recall": 1.0, "B_f1": 0.75, "B_f2": 0.8824, "B_accuracy": 0.6, "B_mcc": 0.0, "B_tp": 3, "B_fp": 2, "B_tn": 0, "B_fn": 0, "D_sharpe": -10.1368, "D_sortino": -6.9937, "D_excess_sharpe": 0.0, "D_return_pct": -3.15, "D_hit_rate": 40.0, "D_n": 5, "D_bh_sharpe": -10.1368, "D_bh_return_pct": -3.15, "D_psr": 0.0985, "D_ic": 0.7, "D_precision": 0.4, "D_recall": 1.0, "D_f1": 0.5714, "D_f2": 0.7692, "D_accuracy": 0.4, "D_mcc": 0.0, "D_tp": 2, "D_fp": 3, "D_tn": 0, "D_fn": 0, "sharpe": -10.1368, "sortino": -6.9937, "return_pct": -3.15, "equity": 968.5, "max_dd": 0.0, "win_rate": 40.0, "profit_factor": 0.0, "ic": 0.6, "hit": 40.0, "psr": 0.0985, "bh_sharpe": -10.1368, "bh_return_pct": -3.15, "excess_sharpe": 0.0, "precision": 0.4, "recall": 1.0, "f1": 0.5714, "f2": 0.7692, "mcc": 0.0, "accuracy": 0.4, "tp": 2, "fp": 3, "tn": 0, "fn": 0}, {"fold": "fold_6", "regime": "COVID crash and V-recovery", "n": 26, "A_sharpe": 6.0809, "A_sortino": 8.2191, "A_excess_sharpe": 2.7958, "A_return_pct": 8.76, "A_hit_rate": 57.69, "A_n": 26, "A_bh_sharpe": 3.2852, "A_bh_return_pct": 4.82, "A_psr": 0.9747, "A_ic": 0.2506, "A_precision": 0.6316, "A_recall": 0.75, "A_f1": 0.6857, "A_f2": 0.7229, "A_accuracy": 0.5769, "A_mcc": 0.0548, "A_tp": 12, "A_fp": 7, "A_tn": 3, "A_fn": 4, "B_sharpe": -0.5734, "B_sortino": -0.5711, "B_excess_sharpe": -13.5526, "B_return_pct": -2.4, "B_hit_rate": 50.0, "B_n": 26, "B_bh_sharpe": 12.9792, "B_bh_return_pct": 38.76, "B_psr": 0.4286, "B_ic": 0.4968, "B_precision": 1.0, "B_recall": 0.381, "B_f1": 0.5517, "B_f2": 0.4348, "B_accuracy": 0.5, "B_mcc": 0.3253, "B_tp": 8, "B_fp": 0, "B_tn": 5, "B_fn": 13, "D_sharpe": 2.2939, "D_sortino": 2.9716, "D_excess_sharpe": -0.9913, "D_return_pct": 3.35, "D_hit_rate": 46.15, "D_n": 26, "D_bh_sharpe": 3.2852, "D_bh_return_pct": 4.82, "D_psr": 0.7717, "D_ic": 0.2855, "D_precision": 0.625, "D_recall": 0.3125, "D_f1": 0.4167, "D_f2": 0.3472, "D_accuracy": 0.4615, "D_mcc": 0.0132, "D_tp": 5, "D_fp": 3, "D_tn": 7, "D_fn": 11, "sharpe": 6.0809, "sortino": 8.2191, "return_pct": 8.76, "equity": 1087.6, "max_dd": 0.0, "win_rate": 57.69, "profit_factor": 0.0, "ic": 0.2506, "hit": 57.69, "psr": 0.9747, "bh_sharpe": 3.2852, "bh_return_pct": 4.82, "excess_sharpe": 2.7958, "precision": 0.6316, "recall": 0.75, "f1": 0.6857, "f2": 0.7229, "mcc": 0.0548, "accuracy": 0.5769, "tp": 12, "fp": 7, "tn": 3, "fn": 4}, {"fold": "fold_7", "regime": "Inflation bear, AI rally and 2025", "n": 65, "A_sharpe": -0.9936, "A_sortino": -0.9226, "A_excess_sharpe": -3.0725, "A_return_pct": -4.14, "A_hit_rate": 49.23, "A_n": 65, "A_bh_sharpe": 2.0789, "A_bh_return_pct": 8.17, "A_psr": 0.3068, "A_ic": 0.2094, "A_precision": 0.75, "A_recall": 0.0857, "A_f1": 0.1538, "A_f2": 0.1042, "A_accuracy": 0.4923, "A_mcc": 0.1087, "A_tp": 3, "A_fp": 1, "A_tn": 29, "A_fn": 32, "B_sharpe": -5.2314, "B_sortino": -4.8393, "B_excess_sharpe": -10.4628, "B_return_pct": -32.36, "B_hit_rate": 32.31, "B_n": 65, "B_bh_sharpe": 5.2314, "B_bh_return_pct": 44.53, "