{"experiment_num": 57, "backbone": "mamba", "description": "dMamba @ exp 52 lr=3e-4 (down from 5e-4) - Smith 2017 + Keskar 2017 flat-minima", "config": {"seq_len": 60, "lr": 0.0003, "batch_size": 32, "epochs": 100, "weight_decay": 0.1, "patience": 20, "warmup_epochs": 10, "head_dropout": 0.1, "huber_delta": 1.0, "grad_clip": 1.0, "seed": 42, "hidden_size": null, "num_layers": null, "max_depth": null, "gbm_lr": null, "n_estimators": null}, "composite": -0.5972, "test_pos_folds": 3, "val_pos_folds": 4, "val_loss": -2.8392519824272764, "elapsed_sec": 954.4, "timestamp": "2026-04-27T21:50:46", "sharpe": -0.1972, "val_sharpe": 0.2716, "ic": -0.0052, "hit": 46.74, "psr": 0.3437, "equity": 745.0, "return_pct": -25.5, "bh_sharpe": 1.2201, "bh_return_pct": 185.59, "excess_sharpe": -1.4173, "B_sharpe": -1.3117, "B_excess_sharpe": -4.1501, "B_return_pct": -95.12, "D_sharpe": -0.1972, "D_excess_sharpe": -1.4173, "D_return_pct": -25.5, "per_window": [{"fold": "fold_1", "regime": "GFC peak crash (Lehman + Mar-2009 bottom)", "n": 65, "A_sharpe": 0.2596, "A_sortino": 0.2549, "A_excess_sharpe": -0.1666, "A_return_pct": 0.69, "A_hit_rate": 52.31, "A_n": 65, "A_bh_sharpe": 0.4262, "A_bh_return_pct": 2.34, "A_psr": 0.552, "A_ic": 0.0208, "B_sharpe": -0.3374, "B_sortino": -0.3239, "B_excess_sharpe": -2.225, "B_return_pct": -13.38, "B_hit_rate": 50.0, "B_n": 65, "B_bh_sharpe": 1.8877, "B_bh_return_pct": 34.48, "B_psr": 0.4324, "B_ic": 0.1182, "D_sharpe": 0.2596, "D_sortino": 0.2549, "D_excess_sharpe": -0.1666, "D_return_pct": 0.69, "D_hit_rate": 52.31, "D_n": 65, "D_bh_sharpe": 0.4262, "D_bh_return_pct": 2.34, "D_psr": 0.552, "D_ic": 0.0208, "sharpe": 0.2596, "sortino": 0.2549, "return_pct": 0.69, "equity": 1006.8999999999999, "max_dd": 0.0, "win_rate": 52.31, "profit_factor": 0.0, "ic": 0.0208, "hit": 52.31, "psr": 0.552, "bh_sharpe": 0.4262, "bh_return_pct": 2.34, "excess_sharpe": -0.1666, "precision": 0.5455, "recall": 0.5294, "f1": 0.5373, "f2": 0.5325, "accuracy": 0.5231, "mcc": 0.0455, "tp": 18, "fp": 15, "tn": 16, "fn": 16, "A_precision": 0.5455, "A_recall": 0.5294, "A_f1": 0.5373, "A_f2": 0.5325, "A_accuracy": 0.5231, "A_mcc": 0.0455, "A_tp": 18, "A_fp": 15, "A_tn": 16, "A_fn": 16}, {"fold": "fold_2", "regime": "2011 US-downgrade + EU debt", "n": 86, "A_sharpe": -2.0707, "A_sortino": -2.4356, "A_excess_sharpe": -6.939, "A_return_pct": -10.83, "A_hit_rate": 36.47, "A_n": 86, "A_bh_sharpe": 4.8682, "A_bh_return_pct": 27.91, "A_psr": 0.1351, "A_ic": 0.1166, "B_sharpe": -2.9617, "B_sortino": -3.1368, "B_excess_sharpe": -14.2808, "B_return_pct": -30.16, "B_hit_rate": 36.05, "B_n": 86, "B_bh_sharpe": 11.3191, "B_bh_return_pct": 186.84, "B_psr": 0.0537, "B_ic": 0.1781, "D_sharpe": -2.0707, "D_sortino": -2.4356, "D_excess_sharpe": -6.939, "D_return_pct": -10.83, "D_hit_rate": 36.47, "D_n": 86, "D_bh_sharpe": 4.8682, "D_bh_return_pct": 27.91, "D_psr": 0.1351, "D_ic": 0.1166, "sharpe": -2.0707, "sortino": -2.4356, "return_pct": -10.83, "equity": 891.6999999999999, "max_dd": 0.0, "win_rate": 36.47, "profit_factor": 0.0, "ic": 0.1166, "hit": 36.47, "psr": 0.1351, "bh_sharpe": 4.8682, "bh_return_pct": 27.91, "excess_sharpe": -6.939, "precision": 0.4545, "recall": 0.0943, "f1": 0.1562, "f2": 0.1121, "accuracy": 0.3721, "mcc": -0.1274, "tp": 5, "fp": 6, "tn": 27, "fn": 48, "A_precision": 0.4545, "A_recall": 0.0943, "A_f1": 0.1562, "A_f2": 0.1121, "A_accuracy": 0.3721, "A_mcc": -0.1274, "A_tp": 5, "A_fp": 6, "A_tn": 27, "A_fn": 48}, {"fold": "fold_3", "regime": "Taper tantrum and 2014 H1", "n": 128, "A_sharpe": 3.8015, "A_sortino": 4.3211, "A_excess_sharpe": 1.7426, "A_return_pct": 26.38, "A_hit_rate": 58.27, "A_n": 128, "A_bh_sharpe": 2.0589, "A_bh_return_pct": 13.6, "A_psr": 0.996, "A_ic": 0.2187, "B_sharpe": -2.2432, "B_sortino": -2.0805, "B_excess_sharpe": -6.7548, "B_return_pct": -25.01, "B_hit_rate": 45.31, "B_n": 128, "B_bh_sharpe": 4.5116, "B_bh_return_pct": 67.92, "B_psr": 0.0543, "B_ic": -0.1799, "D_sharpe": 3.8015, "D_sortino": 4.3211, "D_excess_sharpe": 1.7426, "D_return_pct": 26.38, "D_hit_rate": 58.27, "D_n": 128, "D_bh_sharpe": 2.0589, "D_bh_return_pct": 13.6, "D_psr": 0.996, "D_ic": 0.2187, "sharpe": 3.8015, "sortino": 4.3211, "return_pct": 26.38, "equity": 1263.8, "max_dd": 0.0, "win_rate": 58.27, "profit_factor": 0.0, "ic": 0.2187, "hit": 58.27, "psr": 0.996, "bh_sharpe": 2.0589, "bh_return_pct": 13.6, "excess_sharpe": 1.7426, "precision": 0.7273, "recall": 0.5128, "f1": 0.6015, "f2": 0.545, "accuracy": 0.5859, "mcc": 0.2098, "tp": 40, "fp": 15, "tn": 35, "fn": 38, "A_precision": 0.7273, "A_recall": 0.5128, "A_f1": 0.6015, "A_f2": 0.545, "A_accuracy": 0.5859, "A_mcc": 0.2098, "A_tp": 40, "A_fp": 15, "A_tn": 35, "A_fn": 38}, {"fold": "fold_4", "regime": "China devaluation and oil crash", "n": 107, "A_sharpe": -0.3422, "A_sortino": -0.3014, "A_excess_sharpe": 0.461, "A_return_pct": -3.8, "A_hit_rate": 52.83, "A_n": 107, "A_bh_sharpe": -0.8032, "A_bh_return_pct": -7.58, "A_psr": 0.4116, "A_ic": 0.0251, "B_sharpe": -0.1107, "B_sortino": -0.109, "B_excess_sharpe": 1.8488, "B_return_pct": -6.06, "B_hit_rate": 48.6, "B_n": 107, "B_bh_sharpe": -1.9596, "B_bh_return_pct": -33.47, "B_psr": 0.4714, "B_ic": -0.0016, "D_sharpe": -0.3422, "D_sortino": -0.3014, "D_excess_sharpe": 0.461, "D_return_pct": -3.8, "D_hit_rate": 52.83, "D_n": 107, "D_bh_sharpe": -0.8032, "D_bh_return_pct": -7.58, "D_psr": 0.4116, "D_ic": 0.0251, "sharpe": -0.3422, "sortino": -0.3014, "return_pct": -3.8, "equity": 962.0, "max_dd": 0.0, "win_rate": 52.83, "profit_factor": 0.0, "ic": 0.0251, "hit": 52.83, "psr": 0.4116, "bh_sharpe": -0.8032, "bh_return_pct": -7.58, "excess_sharpe": 0.461, "precision": 0.5208, "recall": 0.4808, "f1": 0.5, "f2": 0.4883, "accuracy": 0.5327, "mcc": 0.0629, "tp": 25, "fp": 23, "tn": 32, "fn": 27, "A_precision": 0.5208, "A_recall": 0.4808, "A_f1": 0.5, "A_f2": 0.4883, "A_accuracy": 0.5327, "A_mcc": 0.0629, "A_tp": 25, "A_fp": 23, "A_tn": 32, "A_fn": 27}, {"fold": "fold_5", "regime": "2018 Vol-mageddon + Q4 sell-off", "n": 127, "A_sharpe": 0.652, "A_sortino": 0.7782, "A_excess_sharpe": -0.531, "A_return_pct": 6.6, "A_hit_rate": 45.67, "A_n": 127, "A_bh_sharpe": 1.183, "A_bh_return_pct": 13.55, "A_psr": 0.6801, "A_ic": 0.051, "B_sharpe": -0.0133, "B_sortino": -0.0148, "B_excess_sharpe": -2.9189, "B_return_pct": -5.64, "B_hit_rate": 43.65, "B_n": 127, "B_bh_sharpe": 2.9056, "B_bh_return_pct": 85.51, "B_psr": 0.4962, "B_ic": 0.1286, "D_sharpe": 0.652, "D_sortino": 0.7782, "D_excess_sharpe": -0.531, "D_return_pct": 6.6, "D_hit_rate": 45.67, "D_n": 127, "D_bh_sharpe": 1.183, "D_bh_return_pct": 13.55, "D_psr": 0.6801, "D_ic": 0.051, "sharpe": 0.652, "sortino": 0.7782, "return_pct": 6.6, "equity": 1066.0, "max_dd": 0.0, "win_rate": 45.67, "profit_factor": 0.0, "ic": 0.051, "hit": 45.67, "psr": 0.6801, "bh_sharpe": 1.183, "bh_return_pct": 13.55, "excess_sharpe": -0.531, "precision": 0.6098, "recall": 0.3205, "f1": 0.4202, "f2": 0.3541, "accuracy": 0.4567, "mcc": -0.0063, "tp": 25, "fp": 16, "tn": 33, "fn": 53, "A_precision": 0.6098, "A_recall": 0.3205, "A_f1": 0.4202, "A_f2": 0.3541, "A_accuracy": 0.4567, "A_mcc": -0.0063, "A_tp": 25, "A_fp": 16, "A_tn": 33, "A_fn": 53}, {"fold": "fold_6", "regime": "COVID crash and V-recovery", "n": 172, "A_sharpe": -0.625, "A_sortino": -0.7503, "A_excess_sharpe": -3.0526, "A_return_pct": -11.62, "A_hit_rate": 39.53, "A_n": 172, "A_bh_sharpe": 2.4276, "A_bh_return_pct": 45.89, "A_psr": 0.3061, "A_ic": -0.0425, "B_sharpe": -4.7819, "B_sortino": -4.8736, "B_excess_sharpe": -10.4939, "B_return_pct": -81.23, "B_hit_rate": 32.16, "B_n": 172, "B_bh_sharpe": 5.712, "B_bh_return_pct": 489.18, "B_psr": 0.0003, "B_ic": -0.2777, "D_sharpe": -0.625, "D_sortino": -0.7503, "D_excess_sharpe": -3.0526, "D_return_pct": -11.62, "D_hit_rate": 39.53, "D_n": 172, "D_bh_sharpe": 2.4276, "D_bh_return_pct": 45.89, "D_psr": 0.3061, "D_ic": -0.0425, "sharpe": -0.625, "sortino": -0.7503, "return_pct": -11.62, "equity": 883.8000000000001, "max_dd": 0.0, "win_rate": 39.53, "profit_factor": 0.0, "ic": -0.0425, "hit": 39.53, "psr": 0.3061, "bh_sharpe": 2.4276, "bh_return_pct": 45.89, "excess_sharpe": -3.0526, "precision": 0.6, "recall": 0.2389, "f1": 0.3418, "f2": 0.2716, "accuracy": 0.3953, "mcc": -0.0714, "tp": 27, "fp": 18, "tn": 41, "fn": 86, "A_precision": 0.6, "A_recall": 0.2389, "A_f1": 0.3418, "A_f2": 0.2716, "A_accuracy": 0.3953, "A_mcc": -0.0714, "A_tp": 27, "A_fp": 18, "A_tn": 41, "A_fn": 86}, {"fold": "fold_7", "regime": "Inflation bear, AI rally and 2025", "n": 375, "A_sharpe": -0.8538, "A_sortino": -0.9205, "A_excess_sharpe": -1.6442, "A_return_pct": -27.55, "A_hit_rate": 46.13, "A_n": 375, "A_bh_sharpe": 0.7905, "A_bh_return_pct": 25.44, "A_psr": 0.1585, "A_ic": -0.0228, "B_sharpe": -0.3968, "B_sortino": -0.426, "B_excess_sharpe": -2.3305, "B_return_pct": -35.3, "B_hit_rate": 46.52, "B_n": 375, "B_bh_sharpe": 1.9338, "B_bh_return_pct": 221.94, "B_psr": 0.3156, "B_ic": -0.0502, "D_sharpe": -0.8538, "D_sortino": -0.9205, "D_excess_sharpe": -1.6442, "D_return_pct": -27.55, "D_hit_rate": 46.13, "D_n": 375, "D_bh_sharpe": 0.7905, "D_bh_return_pct": 25.44, "D_psr": 0.1585, "D_ic": -0.0228, "sharpe": -0.8538, "sortino": -0.9205, "return_pct": -27.55, "equity": 724.4999999999999, "max_dd": 0.0, "win_rate": 46.13, "profit_factor": 0.0, "ic": -0.0228, "hit": 46.13, "psr": 0.1585, "bh_sharpe": 0.7905, "bh_return_pct": 25.44, "excess_sharpe": -1.6442, "precision": 0.5714, "recall": 0.3273, "f1": 0.4162, "f2": 0.3579, "accuracy": 0.4613, "mcc": -0.022, "tp": 72, "fp": 54, "tn": 101, "fn": 148, "A_precision": 0.5714, "A_recall": 0.3273, "A_f1": 0.4162, "A_f2": 0.3579, "A_accuracy": 0.4613, "A_mcc": -0.022, "A_tp": 72, "A_fp": 54, "A_tn": 101, "A_fn": 148}], "per_window_val": [{"fold": "fold_1", "regime": "GFC peak crash (Lehman + Mar-2009 bottom)", "n": 37, "A_sharpe": 5.0328, "A_sortino": 6.4965, "A_excess_sharpe": 4.2744, "A_return_pct": 19.16, "A_hit_rate": 57.14, "A_n": 37, "A_bh_sharpe": 0.7585, "A_bh_return_pct": 2.39, "A_psr": 0.9776, "A_ic": 0.3098, "B_sharpe": 8.1227, "B_sortino": 10.7492, "B_excess_sharpe": 5.9781, "B_return_pct": 51.95, "B_hit_rate": 70.27, "B_n": 37, "B_bh_sharpe": 2.1447, "B_bh_return_pct": 12.13, "B_psr": 0.9997, "B_ic": 0.5488, "D_sharpe": 5.0328, "D_sortino": 6.4965, "D_excess_sharpe": 4.2744, "D_return_pct": 19.16, "D_hit_rate": 57.14, "D_n": 37, "D_bh_sharpe": 0.7585, "D_bh_return_pct": 2.39, "D_psr": 0.9776, "D_ic": 0.3098, "sharpe": 5.0328, "sortino": 6.4965, "return_pct": 19.16, "equity": 1191.6, "max_dd": 0.0, "win_rate": 57.14, "profit_factor": 0.0, "ic": 0.3098, "hit": 57.14, "psr": 0.9776, "bh_sharpe": 0.7585, "bh_return_pct": 2.39, "excess_sharpe": 4.2744}, {"fold": "fold_2", "regime": "2011 US-downgrade + EU debt", "n": 46, "A_sharpe": -1.1964, "A_sortino": -1.2057, "A_excess_sharpe": -1.1425, "A_return_pct": -8.38, "A_hit_rate": 43.48, "A_n": 46, "A_bh_sharpe": -0.0539, "A_bh_return_pct": -1.46, "A_psr": 0.3064, "A_ic": -0.035, "B_sharpe": -0.9521, "B_sortino": -1.0709, "B_excess_sharpe": 0.5892, "B_return_pct": -16.77, "B_hit_rate": 41.3, "B_n": 46, "B_bh_sharpe": -1.5413, "B_bh_return_pct": -23.36, "B_psr": 0.3458, "B_ic": 0.1475, "D_sharpe": -1.1964, "D_sortino": -1.2057, "D_excess_sharpe": -1.1425, "D_return_pct": -8.38, "D_hit_rate": 43.48, "D_n": 46, "D_bh_sharpe": -0.0539, "D_bh_return_pct": -1.46, "D_psr": 0.3064, "D_ic": -0.035, "sharpe": -1.1964, "sortino": -1.2057, "return_pct": -8.38, "equity": 916.2, "max_dd": 0.0, "win_rate": 43.48, "profit_factor": 0.0, "ic": -0.035, "hit": 43.48, "psr": 0.3064, "bh_sharpe": -0.0539, "bh_return_pct": -1.46, "excess_sharpe": -1.1425}, {"fold": "fold_3", "regime": "Taper tantrum and 2014 H1", "n": 4, "A_sharpe": 8.1652, "A_sortino": 8.617, "A_excess_sharpe": 1.8427, "A_return_pct": 0.0, "A_hit_rate": 0.0, "A_n": 4, "A_bh_sharpe": 6.3226, "A_bh_return_pct": 0.58, "A_psr": 0.8221, "A_ic": 0.4, "B_sharpe": 14.1626, "B_sortino": 32.5623, "B_excess_sharpe": 37.6039, "B_return_pct": 0.0, "B_hit_rate": 0.0, "B_n": 4, "B_bh_sharpe": -23.4413, "B_bh_return_pct": -3.13, "B_psr": 0.9725, "B_ic": 0.0, "D_sharpe": 8.1652, "D_sortino": 8.617, "D_excess_sharpe": 1.8427, "D_return_pct": 0.0, "D_hit_rate": 0.0, "D_n": 4, "D_bh_sharpe": 6.3226, "D_bh_return_pct": 0.58, "D_psr": 0.8221, "D_ic": 0.4, "sharpe": 8.1652, "sortino": 8.617, "return_pct": 0.0, "equity": 1000.0, "max_dd": 0.0, "win_rate": 0.0, "profit_factor": 0.0, "ic": 0.4, "hit": 0.0, "psr": 0.8221, "bh_sharpe": 6.3226, "bh_return_pct": 0.58, "excess_sharpe": 1.8427}, {"fold": "fold_4", "regime": "China devaluation and oil crash", "n": 46, "A_sharpe": -1.2886, "A_sortino": -1.3855, "A_excess_sharpe": -0.0865, "A_return_pct": -6.04, "A_hit_rate": 36.96, "A_n": 46, "A_bh_sharpe": -1.2022, "A_bh_return_pct": -5.68, "A_psr": 0.2941, "A_ic": 0.0165, "B_sharpe": -1.5195, "B_sortino": -1.2851, "B_excess_sharpe": 0.7922, "B_return_pct": -17.9, "B_hit_rate": 47.83, "B_n": 46, "B_bh_sharpe": -2.3118, "B_bh_return_pct": -24.51, "B_psr": 0.247, "B_ic": 0.0843, "D_sharpe": -1.2886, "D_sortino": -1.3855, "D_excess_sharpe": -0.0865, "D_return_pct": -6.04, "D_hit_rate": 36.96, "D_n": 46, "D_bh_sharpe": -1.2022, "D_bh_return_pct": -5.68, "D_psr": 0.2941, "D_ic": 0.0165, "sharpe": -1.2886, "sortino": -1.3855, "return_pct": -6.04, "equity": 939.6, "max_dd": 0.0, "win_rate": 36.96, "profit_factor": 0.0, "ic": 0.0165, "hit": 36.96, "psr": 0.2941, "bh_sharpe": -1.2022, "bh_return_pct": -5.68, "excess_sharpe": -0.0865}, {"fold": "fold_5", "regime": "2018 Vol-mageddon + Q4 sell-off", "n": 4, "A_sharpe": 7.4976, "A_sortino": 6.2036, "A_excess_sharpe": 22.2527, "A_return_pct": 0.0, "A_hit_rate": 0.0, "A_n": 4, "A_bh_sharpe": -14.7551, "A_bh_return_pct": -3.52, "A_psr": 0.7727, "A_ic": 0.4, "B_sharpe": 25.4133, "B_sortino": 0.0, "B_excess_sharpe": 23.2567, "B_return_pct": 8.44, "B_hit_rate": 100.0, "B_n": 4, "B_bh_sharpe": 2.1566, "B_bh_return_pct": 1.19, "B_psr": 1.0, "B_ic": 0.8, "D_sharpe": 7.4976, "D_sortino": 6.2036, "D_excess_sharpe": 22.2527, "D_return_pct": 0.0, "D_hit_rate": 0.0, "D_n": 4, "D_bh_sharpe": -14.7551, "D_bh_return_pct": -3.52, "D_psr": 0.7727, "D_ic": 0.4, "sharpe": 7.4976, "sortino": 6.2036, "return_pct": 0.0, "equity": 1000.0, "max_dd": 0.0, "win_rate": 0.0, "profit_factor": 0.0, "ic": 0.4, "hit": 0.0, "psr": 0.7727, "bh_sharpe": -14.7551, "bh_return_pct": -3.52, "excess_sharpe": 22.2527}, {"fold": "fold_6", "regime": "COVID crash and V-recovery", "n": 25, "A_sharpe": -2.5243, "A_sortino": -2.6202, "A_excess_sharpe": -4.9381, "A_return_pct": -3.5, "A_hit_rate": 40.0, "A_n": 25, "A_bh_sharpe": 2.4138, "A_bh_return_pct": 3.27, "A_psr": 0.227, "A_ic": 0.0562, "B_sharpe": -6.7657, "B_sortino": -6.312, "B_excess_sharpe": -19.3312, "B_return_pct": -16.97, "B_hit_rate": 28.0, "B_n": 25, "B_bh_sharpe": 12.5655, "B_bh_return_pct": 32.76, "B_psr": 0.0339, "B_ic": 0.4185, "D_sharpe": -2.5243, "D_sortino": -2.6202, "D_excess_sharpe": -4.9381, "D_return_pct": -3.5, "D_hit_rate": 40.0, "D_n": 25, "D_bh_sharpe": 2.4138, "D_bh_return_pct": 3.27, "D_psr": 0.227, "D_ic": 0.0562, "sharpe": -2.5243, "sortino": -2.6202, "return_pct": -3.5, "equity": 965.0, "max_dd": 0.0, "win_rate": 40.0, "profit_factor": 0.0, "ic": 0.0562, "hit": 40.0, "psr": 0.227, "bh_sharpe": 2.4138, "bh_return_pct": 3.27, "excess_sharpe": -4.9381}, {"fold": "fold_7", "regime": "Inflation bear, AI rally and 2025", "n": 64, "A_sharpe": 0.4269, "A_sortino": 0.4934, "A_excess_sharpe": -1.614, "A_return_pct": 1.38, "A_hit_rate": 45.31, "A_n": 64, "A_bh_sharpe": 2.0409, "A_bh_return_pct": 7.94, "A_psr": 0.585, "A_ic": 0.0467, "B_sharpe": -5.5753, "B_sortino": -4.7633, "B_excess_sharpe": -10.9844, "B_return_pct": -33.61, "B_hit_rate": 37.5, "B_n": 64, "B_bh_sharpe": 5.4092, "B_bh_return_pct": 45.7, "B_psr": 0.0025, "B_ic": -0.2759, "D_sharpe": 0.4269, "D_sortino": 0.4934, "D_excess_sharpe": -1.614, "D_return_pct": 1.38, "D_hit_rate": 45.31, "D_n": 64, "D_bh_sharpe": 2.0409, "D_bh_return_pct": 7.94, "D_psr": 0.585, "D_ic": 0.0467, "sharpe": 0.4269, "sortino": 0.4934, "return_pct": 1.38, "equity": 1013.8000000000001, "max_dd": 0.0, "win_rate": 45.31, "profit_factor": 0.0, "ic": 0.0467, "hit": 45.31, "psr": 0.585, "bh_sharpe": 2.0409, "bh_return_pct": 7.94, "excess_sharpe": -1.614}], "status": "DISCARD", "precision": 0.5905, "recall": 0.3376, "f1": 0.4296, "f2": 0.3692, "accuracy": 0.4689, "mcc": -0.0028, "tp": 212, "fp": 147, "tn": 285, "fn": 416, "test_sharpe": -0.1972, "A_sharpe": -0.1972, "A_excess_sharpe": -1.4173, "A_return_pct": -25.5, "A_precision": 0.5905, "A_recall": 0.3376, "A_f1": 0.4296, "A_f2": 0.3692, "A_accuracy": 0.4689, "A_mcc": -0.0028, "A_tp": 212, "A_fp": 147, "A_tn": 285, "A_fn": 416, "A_psr": 0.3437, "A_ic": -0.0052, "A_hit_rate": 46.74, "A_bh_sharpe": 1.2201, "A_bh_return_pct": 185.59}
