{"experiment_num": 55, "backbone": "mamba", "description": "dMamba @ exp 52 d_state=32 seed=7 - 3rd seed multi-seed", "config": {"seq_len": 60, "lr": 0.0005, "batch_size": 32, "epochs": 100, "weight_decay": 0.1, "patience": 20, "warmup_epochs": 10, "head_dropout": 0.1, "huber_delta": 1.0, "grad_clip": 1.0, "seed": 7, "hidden_size": null, "num_layers": null, "max_depth": null, "gbm_lr": null, "n_estimators": null}, "composite": 0.9729, "test_pos_folds": 6, "val_pos_folds": 4, "val_loss": -2.8641391686633626, "elapsed_sec": 962.0, "timestamp": "2026-04-27T21:22:02", "sharpe": 1.0729, "val_sharpe": 1.0739, "ic": 0.0311, "hit": 56.1, "psr": 0.9867, "equity": 2486.2000000000003, "return_pct": 148.62, "bh_sharpe": 1.2201, "bh_return_pct": 185.59, "excess_sharpe": -0.1472, "B_sharpe": 0.9958, "B_excess_sharpe": -1.8426, "B_return_pct": 346.32, "D_sharpe": 1.0729, "D_excess_sharpe": -0.1472, "D_return_pct": 148.62, "per_window": [{"fold": "fold_1", "regime": "GFC peak crash (Lehman + Mar-2009 bottom)", "n": 65, "A_sharpe": -0.0614, "A_sortino": -0.0661, "A_excess_sharpe": -0.4876, "A_return_pct": -2.39, "A_hit_rate": 44.62, "A_n": 65, "A_bh_sharpe": 0.4262, "A_bh_return_pct": 2.34, "A_psr": 0.4877, "A_ic": 0.0368, "B_sharpe": 2.9635, "B_sortino": 3.1908, "B_excess_sharpe": 1.0759, "B_return_pct": 65.26, "B_hit_rate": 56.25, "B_n": 65, "B_bh_sharpe": 1.8877, "B_bh_return_pct": 34.48, "B_psr": 0.9319, "B_ic": 0.1152, "D_sharpe": -0.0614, "D_sortino": -0.0661, "D_excess_sharpe": -0.4876, "D_return_pct": -2.39, "D_hit_rate": 44.62, "D_n": 65, "D_bh_sharpe": 0.4262, "D_bh_return_pct": 2.34, "D_psr": 0.4877, "D_ic": 0.0368, "sharpe": -0.0614, "sortino": -0.0661, "return_pct": -2.39, "equity": 976.1, "max_dd": 0.0, "win_rate": 44.62, "profit_factor": 0.0, "ic": 0.0368, "hit": 44.62, "psr": 0.4877, "bh_sharpe": 0.4262, "bh_return_pct": 2.34, "excess_sharpe": -0.4876, "precision": 0.4615, "recall": 0.3529, "f1": 0.4, "f2": 0.3704, "accuracy": 0.4462, "mcc": -0.1006, "tp": 12, "fp": 14, "tn": 17, "fn": 22, "A_precision": 0.4615, "A_recall": 0.3529, "A_f1": 0.4, "A_f2": 0.3704, "A_accuracy": 0.4462, "A_mcc": -0.1006, "A_tp": 12, "A_fp": 14, "A_tn": 17, "A_fn": 22}, {"fold": "fold_2", "regime": "2011 US-downgrade + EU debt", "n": 86, "A_sharpe": 1.9175, "A_sortino": 1.6639, "A_excess_sharpe": -2.9507, "A_return_pct": 10.31, "A_hit_rate": 63.53, "A_n": 86, "A_bh_sharpe": 4.8682, "A_bh_return_pct": 27.91, "A_psr": 0.8608, "A_ic": 0.0349, "B_sharpe": 2.7732, "B_sortino": 3.0896, "B_excess_sharpe": -8.5458, "B_return_pct": 34.78, "B_hit_rate": 54.65, "B_n": 86, "B_bh_sharpe": 11.3191, "B_bh_return_pct": 186.84, "B_psr": 0.9482, "B_ic": 0.2019, "D_sharpe": 1.9175, "D_sortino": 1.6639, "D_excess_sharpe": -2.9507, "D_return_pct": 10.31, "D_hit_rate": 63.53, "D_n": 86, "D_bh_sharpe": 4.8682, "D_bh_return_pct": 27.91, "D_psr": 0.8608, "D_ic": 0.0349, "sharpe": 1.9175, "sortino": 1.6639, "return_pct": 10.31, "equity": 1103.1, "max_dd": 0.0, "win_rate": 63.53, "profit_factor": 0.0, "ic": 0.0349, "hit": 63.53, "psr": 0.8608, "bh_sharpe": 4.8682, "bh_return_pct": 27.91, "excess_sharpe": -2.9507, "precision": 0.6567, "recall": 0.8302, "f1": 0.7333, "f2": 0.7885, "accuracy": 0.6279, "mcc": 0.1562, "tp": 44, "fp": 23, "tn": 10, "fn": 9, "A_precision": 0.6567, "A_recall": 0.8302, "A_f1": 0.7333, "A_f2": 0.7885, "A_accuracy": 0.6279, "A_mcc": 0.1562, "A_tp": 44, "A_fp": 23, "A_tn": 10, "A_fn": 9}, {"fold": "fold_3", "regime": "Taper tantrum and 2014 H1", "n": 128, "A_sharpe": 1.5312, "A_sortino": 1.495, "A_excess_sharpe": -0.5277, "A_return_pct": 9.87, "A_hit_rate": 57.48, "A_n": 128, "A_bh_sharpe": 2.0589, "A_bh_return_pct": 13.6, "A_psr": 0.8615, "A_ic": -0.052, "B_sharpe": -1.2756, "B_sortino": -1.1642, "B_excess_sharpe": -5.7871, "B_return_pct": -15.73, "B_hit_rate": 49.22, "B_n": 128, "B_bh_sharpe": 4.5116, "B_bh_return_pct": 67.92, "B_psr": 0.1799, "B_ic": -0.1395, "D_sharpe": 1.5312, "D_sortino": 1.495, "D_excess_sharpe": -0.5277, "D_return_pct": 9.87, "D_hit_rate": 57.48, "D_n": 128, "D_bh_sharpe": 2.0589, "D_bh_return_pct": 13.6, "D_psr": 0.8615, "D_ic": -0.052, "sharpe": 1.5312, "sortino": 1.495, "return_pct": 9.87, "equity": 1098.7, "max_dd": 0.0, "win_rate": 57.48, "profit_factor": 0.0, "ic": -0.052, "hit": 57.48, "psr": 0.8615, "bh_sharpe": 2.0589, "bh_return_pct": 13.6, "excess_sharpe": -0.5277, "precision": 0.6139, "recall": 0.7949, "f1": 0.6927, "f2": 0.7506, "accuracy": 0.5703, "mcc": 0.0178, "tp": 62, "fp": 39, "tn": 11, "fn": 16, "A_precision": 0.6139, "A_recall": 0.7949, "A_f1": 0.6927, "A_f2": 0.7506, "A_accuracy": 0.5703, "A_mcc": 0.0178, "A_tp": 62, "A_fp": 39, "A_tn": 11, "A_fn": 16}, {"fold": "fold_4", "regime": "China devaluation and oil crash", "n": 107, "A_sharpe": 1.7672, "A_sortino": 1.8619, "A_excess_sharpe": 2.5705, "A_return_pct": 15.49, "A_hit_rate": 55.66, "A_n": 107, "A_bh_sharpe": -0.8032, "A_bh_return_pct": -7.58, "A_psr": 0.8761, "A_ic": 0.1167, "B_sharpe": -0.4296, "B_sortino": -0.4991, "B_excess_sharpe": 1.53, "B_return_pct": -11.47, "B_hit_rate": 42.06, "B_n": 107, "B_bh_sharpe": -1.9596, "B_bh_return_pct": -33.47, "B_psr": 0.3911, "B_ic": -0.0636, "D_sharpe": 1.7672, "D_sortino": 1.8619, "D_excess_sharpe": 2.5705, "D_return_pct": 15.49, "D_hit_rate": 55.66, "D_n": 107, "D_bh_sharpe": -0.8032, "D_bh_return_pct": -7.58, "D_psr": 0.8761, "D_ic": 0.1167, "sharpe": 1.7672, "sortino": 1.8619, "return_pct": 15.49, "equity": 1154.9, "max_dd": 0.0, "win_rate": 55.66, "profit_factor": 0.0, "ic": 0.1167, "hit": 55.66, "psr": 0.8761, "bh_sharpe": -0.8032, "bh_return_pct": -7.58, "excess_sharpe": 2.5705, "precision": 0.527, "recall": 0.75, "f1": 0.619, "f2": 0.6915, "accuracy": 0.5514, "mcc": 0.123, "tp": 39, "fp": 35, "tn": 20, "fn": 13, "A_precision": 0.527, "A_recall": 0.75, "A_f1": 0.619, "A_f2": 0.6915, "A_accuracy": 0.5514, "A_mcc": 0.123, "A_tp": 39, "A_fp": 35, "A_tn": 20, "A_fn": 13}, {"fold": "fold_5", "regime": "2018 Vol-mageddon + Q4 sell-off", "n": 127, "A_sharpe": 1.9127, "A_sortino": 1.9215, "A_excess_sharpe": 0.7297, "A_return_pct": 23.77, "A_hit_rate": 60.63, "A_n": 127, "A_bh_sharpe": 1.183, "A_bh_return_pct": 13.55, "A_psr": 0.9163, "A_ic": 0.1402, "B_sharpe": 2.7361, "B_sortino": 3.1851, "B_excess_sharpe": -0.1695, "B_return_pct": 78.74, "B_hit_rate": 52.38, "B_n": 127, "B_bh_sharpe": 2.9056, "B_bh_return_pct": 85.51, "B_psr": 0.9751, "B_ic": 0.2414, "D_sharpe": 1.9127, "D_sortino": 1.9215, "D_excess_sharpe": 0.7297, "D_return_pct": 23.77, "D_hit_rate": 60.63, "D_n": 127, "D_bh_sharpe": 1.183, "D_bh_return_pct": 13.55, "D_psr": 0.9163, "D_ic": 0.1402, "sharpe": 1.9127, "sortino": 1.9215, "return_pct": 23.77, "equity": 1237.7, "max_dd": 0.0, "win_rate": 60.63, "profit_factor": 0.0, "ic": 0.1402, "hit": 60.63, "psr": 0.9163, "bh_sharpe": 1.183, "bh_return_pct": 13.55, "excess_sharpe": 0.7297, "precision": 0.64, "recall": 0.8205, "f1": 0.7191, "f2": 0.7767, "accuracy": 0.6063, "mcc": 0.1021, "tp": 64, "fp": 36, "tn": 13, "fn": 14, "A_precision": 0.64, "A_recall": 0.8205, "A_f1": 0.7191, "A_f2": 0.7767, "A_accuracy": 0.6063, "A_mcc": 0.1021, "A_tp": 64, "A_fp": 36, "A_tn": 13, "A_fn": 14}, {"fold": "fold_6", "regime": "COVID crash and V-recovery", "n": 172, "A_sharpe": 2.0996, "A_sortino": 2.0446, "A_excess_sharpe": -0.328, "A_return_pct": 38.4, "A_hit_rate": 57.56, "A_n": 172, "A_bh_sharpe": 2.4276, "A_bh_return_pct": 45.89, "A_psr": 0.9546, "A_ic": 0.0306, "B_sharpe": 0.6819, "B_sortino": 0.7986, "B_excess_sharpe": -5.0301, "B_return_pct": 16.08, "B_hit_rate": 45.61, "B_n": 172, "B_bh_sharpe": 5.712, "B_bh_return_pct": 489.18, "B_psr": 0.715, "B_ic": -0.0675, "D_sharpe": 2.0996, "D_sortino": 2.0446, "D_excess_sharpe": -0.328, "D_return_pct": 38.4, "D_hit_rate": 57.56, "D_n": 172, "D_bh_sharpe": 2.4276, "D_bh_return_pct": 45.89, "D_psr": 0.9546, "D_ic": 0.0306, "sharpe": 2.0996, "sortino": 2.0446, "return_pct": 38.4, "equity": 1384.0, "max_dd": 0.0, "win_rate": 57.56, "profit_factor": 0.0, "ic": 0.0306, "hit": 57.56, "psr": 0.9546, "bh_sharpe": 2.4276, "bh_return_pct": 45.89, "excess_sharpe": -0.328, "precision": 0.6351, "recall": 0.8319, "f1": 0.7203, "f2": 0.7833, "accuracy": 0.5756, "mcc": -0.1143, "tp": 94, "fp": 54, "tn": 5, "fn": 19, "A_precision": 0.6351, "A_recall": 0.8319, "A_f1": 0.7203, "A_f2": 0.7833, "A_accuracy": 0.5756, "A_mcc": -0.1143, "A_tp": 94, "A_fp": 54, "A_tn": 5, "A_fn": 19}, {"fold": "fold_7", "regime": "Inflation bear, AI rally and 2025", "n": 375, "A_sharpe": 0.2921, "A_sortino": 0.2904, "A_excess_sharpe": -0.4983, "A_return_pct": 6.22, "A_hit_rate": 53.87, "A_n": 375, "A_bh_sharpe": 0.7905, "A_bh_return_pct": 25.44, "A_psr": 0.6401, "A_ic": -0.0143, "B_sharpe": 0.6039, "B_sortino": 0.6212, "B_excess_sharpe": -1.3299, "B_return_pct": 29.45, "B_hit_rate": 52.94, "B_n": 375, "B_bh_sharpe": 1.9338, "B_bh_return_pct": 221.94, "B_psr": 0.7705, "B_ic": -0.0171, "D_sharpe": 0.2921, "D_sortino": 0.2904, "D_excess_sharpe": -0.4983, "D_return_pct": 6.22, "D_hit_rate": 53.87, "D_n": 375, "D_bh_sharpe": 0.7905, "D_bh_return_pct": 25.44, "D_psr": 0.6401, "D_ic": -0.0143, "sharpe": 0.2921, "sortino": 0.2904, "return_pct": 6.22, "equity": 1062.2, "max_dd": 0.0, "win_rate": 53.87, "profit_factor": 0.0, "ic": -0.0143, "hit": 53.87, "psr": 0.6401, "bh_sharpe": 0.7905, "bh_return_pct": 25.44, "excess_sharpe": -0.4983, "precision": 0.5728, "recall": 0.8409, "f1": 0.6814, "f2": 0.7689, "accuracy": 0.5387, "mcc": -0.0704, "tp": 185, "fp": 138, "tn": 17, "fn": 35, "A_precision": 0.5728, "A_recall": 0.8409, "A_f1": 0.6814, "A_f2": 0.7689, "A_accuracy": 0.5387, "A_mcc": -0.0704, "A_tp": 185, "A_fp": 138, "A_tn": 17, "A_fn": 35}], "per_window_val": [{"fold": "fold_1", "regime": "GFC peak crash (Lehman + Mar-2009 bottom)", "n": 37, "A_sharpe": 0.0607, "A_sortino": 0.0561, "A_excess_sharpe": -0.6977, "A_return_pct": -0.25, "A_hit_rate": 54.29, "A_n": 37, "A_bh_sharpe": 0.7585, "A_bh_return_pct": 2.39, "A_psr": 0.5092, "A_ic": 0.0946, "B_sharpe": 1.582, "B_sortino": 1.7613, "B_excess_sharpe": -0.5627, "B_return_pct": 8.52, "B_hit_rate": 54.05, "B_n": 37, "B_bh_sharpe": 2.1447, "B_bh_return_pct": 12.13, "B_psr": 0.7297, "B_ic": 0.0315, "D_sharpe": 0.0607, "D_sortino": 0.0561, "D_excess_sharpe": -0.6977, "D_return_pct": -0.25, "D_hit_rate": 54.29, "D_n": 37, "D_bh_sharpe": 0.7585, "D_bh_return_pct": 2.39, "D_psr": 0.5092, "D_ic": 0.0946, "sharpe": 0.0607, "sortino": 0.0561, "return_pct": -0.25, "equity": 997.5, "max_dd": 0.0, "win_rate": 54.29, "profit_factor": 0.0, "ic": 0.0946, "hit": 54.29, "psr": 0.5092, "bh_sharpe": 0.7585, "bh_return_pct": 2.39, "excess_sharpe": -0.6977}, {"fold": "fold_2", "regime": "2011 US-downgrade + EU debt", "n": 46, "A_sharpe": 4.0255, "A_sortino": 5.0284, "A_excess_sharpe": 4.0793, "A_return_pct": 26.93, "A_hit_rate": 58.7, "A_n": 46, "A_bh_sharpe": -0.0539, "A_bh_return_pct": -1.46, "A_psr": 0.9636, "A_ic": 0.1003, "B_sharpe": 3.5791, "B_sortino": 5.2638, "B_excess_sharpe": 5.1204, "B_return_pct": 54.08, "B_hit_rate": 47.83, "B_n": 46, "B_bh_sharpe": -1.5413, "B_bh_return_pct": -23.36, "B_psr": 0.9478, "B_ic": 0.2729, "D_sharpe": 4.0255, "D_sortino": 5.0284, "D_excess_sharpe": 4.0793, "D_return_pct": 26.93, "D_hit_rate": 58.7, "D_n": 46, "D_bh_sharpe": -0.0539, "D_bh_return_pct": -1.46, "D_psr": 0.9636, "D_ic": 0.1003, "sharpe": 4.0255, "sortino": 5.0284, "return_pct": 26.93, "equity": 1269.3, "max_dd": 0.0, "win_rate": 58.7, "profit_factor": 0.0, "ic": 0.1003, "hit": 58.7, "psr": 0.9636, "bh_sharpe": -0.0539, "bh_return_pct": -1.46, "excess_sharpe": 4.0793}, {"fold": "fold_3", "regime": "Taper tantrum and 2014 H1", "n": 4, "A_sharpe": 6.3226, "A_sortino": 11.1859, "A_excess_sharpe": 0.0, "A_return_pct": 0.58, "A_hit_rate": 50.0, "A_n": 4, "A_bh_sharpe": 6.3226, "A_bh_return_pct": 0.58, "A_psr": 0.773, "A_ic": 0.8, "B_sharpe": 14.1626, "B_sortino": 32.5623, "B_excess_sharpe": 37.6039, "B_return_pct": 0.0, "B_hit_rate": 0.0, "B_n": 4, "B_bh_sharpe": -23.4413, "B_bh_return_pct": -3.13, "B_psr": 0.9725, "B_ic": 0.0, "D_sharpe": 6.3226, "D_sortino": 11.1859, "D_excess_sharpe": 0.0, "D_return_pct": 0.58, "D_hit_rate": 50.0, "D_n": 4, "D_bh_sharpe": 6.3226, "D_bh_return_pct": 0.58, "D_psr": 0.773, "D_ic": 0.8, "sharpe": 6.3226, "sortino": 11.1859, "return_pct": 0.58, "equity": 1005.8000000000001, "max_dd": 0.0, "win_rate": 50.0, "profit_factor": 0.0, "ic": 0.8, "hit": 50.0, "psr": 0.773, "bh_sharpe": 6.3226, "bh_return_pct": 0.58, "excess_sharpe": 0.0}, {"fold": "fold_4", "regime": "China devaluation and oil crash", "n": 46, "A_sharpe": -0.8136, "A_sortino": -0.7466, "A_excess_sharpe": 0.3886, "A_return_pct": -4.06, "A_hit_rate": 50.0, "A_n": 46, "A_bh_sharpe": -1.2022, "A_bh_return_pct": -5.68, "A_psr": 0.3648, "A_ic": -0.0551, "B_sharpe": 0.0326, "B_sortino": 0.03, "B_excess_sharpe": 2.3444, "B_return_pct": -2.92, "B_hit_rate": 47.83, "B_n": 46, "B_bh_sharpe": -2.3118, "B_bh_return_pct": -24.51, "B_psr": 0.5055, "B_ic": 0.2898, "D_sharpe": -0.8136, "D_sortino": -0.7466, "D_excess_sharpe": 0.3886, "D_return_pct": -4.06, "D_hit_rate": 50.0, "D_n": 46, "D_bh_sharpe": -1.2022, "D_bh_return_pct": -5.68, "D_psr": 0.3648, "D_ic": -0.0551, "sharpe": -0.8136, "sortino": -0.7466, "return_pct": -4.06, "equity": 959.4, "max_dd": 0.0, "win_rate": 50.0, "profit_factor": 0.0, "ic": -0.0551, "hit": 50.0, "psr": 0.3648, "bh_sharpe": -1.2022, "bh_return_pct": -5.68, "excess_sharpe": 0.3886}, {"fold": "fold_5", "regime": "2018 Vol-mageddon + Q4 sell-off", "n": 4, "A_sharpe": -14.7551, "A_sortino": -9.7882, "A_excess_sharpe": 0.0, "A_return_pct": -3.52, "A_hit_rate": 25.0, "A_n": 4, "A_bh_sharpe": -14.7551, "A_bh_return_pct": -3.52, "A_psr": 0.0808, "A_ic": -0.2, "B_sharpe": 2.1566, "B_sortino": 2.3016, "B_excess_sharpe": 0.0, "B_return_pct": 1.19, "B_hit_rate": 50.0, "B_n": 4, "B_bh_sharpe": 2.1566, "B_bh_return_pct": 1.19, "B_psr": 0.5925, "B_ic": 0.8, "D_sharpe": -14.7551, "D_sortino": -9.7882, "D_excess_sharpe": 0.0, "D_return_pct": -3.52, "D_hit_rate": 25.0, "D_n": 4, "D_bh_sharpe": -14.7551, "D_bh_return_pct": -3.52, "D_psr": 0.0808, "D_ic": -0.2, "sharpe": -14.7551, "sortino": -9.7882, "return_pct": -3.52, "equity": 964.8, "max_dd": 0.0, "win_rate": 25.0, "profit_factor": 0.0, "ic": -0.2, "hit": 25.0, "psr": 0.0808, "bh_sharpe": -14.7551, "bh_return_pct": -3.52, "excess_sharpe": 0.0}, {"fold": "fold_6", "regime": "COVID crash and V-recovery", "n": 25, "A_sharpe": 5.0635, "A_sortino": 6.5323, "A_excess_sharpe": 2.6497, "A_return_pct": 6.83, "A_hit_rate": 60.0, "A_n": 25, "A_bh_sharpe": 2.4138, "A_bh_return_pct": 3.27, "A_psr": 0.9523, "A_ic": 0.0315, "B_sharpe": -5.2143, "B_sortino": -5.2182, "B_excess_sharpe": -17.7798, "B_return_pct": -13.84, "B_hit_rate": 28.0, "B_n": 25, "B_bh_sharpe": 12.5655, "B_bh_return_pct": 32.76, "B_psr": 0.0679, "B_ic": -0.09, "D_sharpe": 5.0635, "D_sortino": 6.5323, "D_excess_sharpe": 2.6497, "D_return_pct": 6.83, "D_hit_rate": 60.0, "D_n": 25, "D_bh_sharpe": 2.4138, "D_bh_return_pct": 3.27, "D_psr": 0.9523, "D_ic": 0.0315, "sharpe": 5.0635, "sortino": 6.5323, "return_pct": 6.83, "equity": 1068.3, "max_dd": 0.0, "win_rate": 60.0, "profit_factor": 0.0, "ic": 0.0315, "hit": 60.0, "psr": 0.9523, "bh_sharpe": 2.4138, "bh_return_pct": 3.27, "excess_sharpe": 2.6497}, {"fold": "fold_7", "regime": "Inflation bear, AI rally and 2025", "n": 64, "A_sharpe": -0.5859, "A_sortino": -0.6093, "A_excess_sharpe": -2.6267, "A_return_pct": -2.57, "A_hit_rate": 46.88, "A_n": 64, "A_bh_sharpe": 2.0409, "A_bh_return_pct": 7.94, "A_psr": 0.3854, "A_ic": -0.1744, "B_sharpe": 3.2323, "B_sortino": 2.94, "B_excess_sharpe": -2.1769, "B_return_pct": 25.67, "B_hit_rate": 67.19, "B_n": 64, "B_bh_sharpe": 5.4092, "B_bh_return_pct": 45.7, "B_psr": 0.9437, "B_ic": 0.0739, "D_sharpe": -0.5859, "D_sortino": -0.6093, "D_excess_sharpe": -2.6267, "D_return_pct": -2.57, "D_hit_rate": 46.88, "D_n": 64, "D_bh_sharpe": 2.0409, "D_bh_return_pct": 7.94, "D_psr": 0.3854, "D_ic": -0.1744, "sharpe": -0.5859, "sortino": -0.6093, "return_pct": -2.57, "equity": 974.3000000000001, "max_dd": 0.0, "win_rate": 46.88, "profit_factor": 0.0, "ic": -0.1744, "hit": 46.88, "psr": 0.3854, "bh_sharpe": 2.0409, "bh_return_pct": 7.94, "excess_sharpe": -2.6267}], "status": "DISCARD", "precision": 0.5959, "recall": 0.7962, "f1": 0.6817, "f2": 0.746, "accuracy": 0.5594, "mcc": 0.0139, "tp": 500, "fp": 339, "tn": 93, "fn": 128, "test_sharpe": 1.0729, "A_sharpe": 1.0729, "A_excess_sharpe": -0.1472, "A_return_pct": 148.62, "A_precision": 0.5959, "A_recall": 0.7962, "A_f1": 0.6817, "A_f2": 0.746, "A_accuracy": 0.5594, "A_mcc": 0.0139, "A_tp": 500, "A_fp": 339, "A_tn": 93, "A_fn": 128, "A_psr": 0.9867, "A_ic": 0.0311, "A_hit_rate": 56.1, "A_bh_sharpe": 1.2201, "A_bh_return_pct": 185.59}
