{"experiment_num": 61, "backbone": "mlp", "description": "MLP @ exp 6 huber_delta=0.3 (down from 1.0) - Huber 1964 robust loss for F1 GFC tail-heavy crash residuals; per-fold analysis identified F1 anti-skill at -1.78 as the dominant deficiency", "config": {"seq_len": 10, "lr": 0.0003, "batch_size": 32, "epochs": 50, "weight_decay": 1e-05, "patience": 10, "warmup_epochs": 0, "head_dropout": 0.25, "huber_delta": 0.3, "grad_clip": 1.0, "seed": 0, "hidden_size": null, "num_layers": null, "max_depth": null, "gbm_lr": null, "n_estimators": null}, "composite": 0.4818, "test_pos_folds": 6, "val_pos_folds": 5, "val_loss": -2.8900128122525914, "elapsed_sec": 25.7, "timestamp": "2026-04-27T22:08:13", "sharpe": 0.5818, "val_sharpe": 0.7245, "ic": 0.0141, "hit": 56.08, "psr": 0.9146, "equity": 1967.3, "return_pct": 96.73, "bh_sharpe": 0.6042, "bh_return_pct": 103.49, "excess_sharpe": -0.0224, "B_sharpe": -0.1544, "B_excess_sharpe": -1.8552, "B_return_pct": -71.36, "D_sharpe": 0.5818, "D_excess_sharpe": -0.0224, "D_return_pct": 96.73, "precision": 0.5749, "recall": 0.8848, "f1": 0.6969, "f2": 0.7987, "mcc": 0.014, "accuracy": 0.5596, "val_precision": 0.5605, "val_recall": 0.8875, "val_f1": 0.6871, "val_f2": 0.7948, "val_mcc": 0.0306, "val_accuracy": 0.5514, "per_window": [{"fold": "fold_1", "regime": "GFC peak crash (Lehman + Mar-2009 bottom)", "n": 115, "A_sharpe": -1.2663, "A_sortino": -1.2947, "A_excess_sharpe": -0.8222, "A_return_pct": -28.81, "A_hit_rate": 43.48, "A_n": 115, "A_bh_sharpe": -0.4441, "A_bh_return_pct": -14.4, "A_psr": 0.199, "A_ic": -0.1304, "A_precision": 0.4466, "A_recall": 0.8519, "A_f1": 0.586, "A_f2": 0.721, "A_accuracy": 0.4348, "A_mcc": -0.1348, "A_tp": 46, "A_fp": 57, "A_tn": 4, "A_fn": 8, "B_sharpe": 3.9879, "B_sortino": 4.7261, "B_excess_sharpe": 4.2857, "B_return_pct": 318.1, "B_hit_rate": 57.02, "B_n": 115, "B_bh_sharpe": -0.2978, "B_bh_return_pct": -27.23, "B_psr": 0.9971, "B_ic": 0.2781, "B_precision": 0.6452, "B_recall": 0.339, "B_f1": 0.4444, "B_f2": 0.3745, "B_accuracy": 0.5652, "B_mcc": 0.1606, "B_tp": 20, "B_fp": 11, "B_tn": 45, "B_fn": 39, "D_sharpe": -1.2663, "D_sortino": -1.2947, "D_excess_sharpe": -0.8222, "D_return_pct": -28.81, "D_hit_rate": 43.48, "D_n": 115, "D_bh_sharpe": -0.4441, "D_bh_return_pct": -14.4, "D_psr": 0.199, "D_ic": -0.1304, "D_precision": 0.4466, "D_recall": 0.8519, "D_f1": 0.586, "D_f2": 0.721, "D_accuracy": 0.4348, "D_mcc": -0.1348, "D_tp": 46, "D_fp": 57, "D_tn": 4, "D_fn": 8, "sharpe": -1.2663, "sortino": -1.2947, "return_pct": -28.81, "equity": 711.9, "max_dd": 0.0, "win_rate": 43.48, "profit_factor": 0.0, "ic": -0.1304, "hit": 43.48, "psr": 0.199, "bh_sharpe": -0.4441, "bh_return_pct": -14.4, "excess_sharpe": -0.8222, "precision": 0.4466, "recall": 0.8519, "f1": 0.586, "f2": 0.721, "mcc": -0.1348, "accuracy": 0.4348, "tp": 46, "fp": 57, "tn": 4, "fn": 8}, {"fold": "fold_2", "regime": "2011 US-downgrade + EU debt", "n": 136, "A_sharpe": 1.9278, "A_sortino": 1.9042, "A_excess_sharpe": 0.1951, "A_return_pct": 22.32, "A_hit_rate": 57.04, "A_n": 136, "A_bh_sharpe": 1.7327, "A_bh_return_pct": 19.75, "A_psr": 0.919, "A_ic": -0.0628, "A_precision": 0.5714, "A_recall": 0.9744, "A_f1": 0.7204, "A_f2": 0.8539, "A_accuracy": 0.5662, "A_mcc": -0.0283, "A_tp": 76, "A_fp": 57, "A_tn": 1, "A_fn": 2, "B_sharpe": 2.1032, "B_sortino": 2.0154, "B_excess_sharpe": -1.9627, "B_return_pct": 57.78, "B_hit_rate": 60.29, "B_n": 136, "B_bh_sharpe": 4.0659, "B_bh_return_pct": 148.68, "B_psr": 0.9372, "B_ic": 0.0934, "B_precision": 0.8, "B_recall": 0.5833, "B_f1": 0.6747, "B_f2": 0.6167, "B_accuracy": 0.6029, "B_mcc": 0.2127, "B_tp": 56, "B_fp": 14, "B_tn": 26, "B_fn": 40, "D_sharpe": 1.9278, "D_sortino": 1.9042, "D_excess_sharpe": 0.1951, "D_return_pct": 22.32, "D_hit_rate": 57.04, "D_n": 136, "D_bh_sharpe": 1.7327, "D_bh_return_pct": 19.75, "D_psr": 0.919, "D_ic": -0.0628, "D_precision": 0.5714, "D_recall": 0.9744, "D_f1": 0.7204, "D_f2": 0.8539, "D_accuracy": 0.5662, "D_mcc": -0.0283, "D_tp": 76, "D_fp": 57, "D_tn": 1, "D_fn": 2, "sharpe": 1.9278, "sortino": 1.9042, "return_pct": 22.32, "equity": 1223.2, "max_dd": 0.0, "win_rate": 57.04, "profit_factor": 0.0, "ic": -0.0628, "hit": 57.04, "psr": 0.919, "bh_sharpe": 1.7327, "bh_return_pct": 19.75, "excess_sharpe": 0.1951, "precision": 0.5714, "recall": 0.9744, "f1": 0.7204, "f2": 0.8539, "mcc": -0.0283, "accuracy": 0.5662, "tp": 76, "fp": 57, "tn": 1, "fn": 2}, {"fold": "fold_3", "regime": "Taper tantrum and 2014 H1", "n": 178, "A_sharpe": 2.1987, "A_sortino": 1.9413, "A_excess_sharpe": 0.8541, "A_return_pct": 21.4, "A_hit_rate": 59.89, "A_n": 178, "A_bh_sharpe": 1.3445, "A_bh_return_pct": 12.41, "A_psr": 0.9582, "A_ic": 0.1252, "A_precision": 0.5928, "A_recall": 0.9612, "A_f1": 0.7333, "A_f2": 0.8549, "A_accuracy": 0.5955, "A_mcc": 0.1118, "A_tp": 99, "A_fp": 68, "A_tn": 7, "A_fn": 4, "B_sharpe": -1.8678, "B_sortino": -1.7783, "B_excess_sharpe": -4.9161, "B_return_pct": -31.38, "B_hit_rate": 44.38, "B_n": 178, "B_bh_sharpe": 3.0483, "B_bh_return_pct": 71.83, "B_psr": 0.0576, "B_ic": 0.0369, "B_precision": 0.5781, "B_recall": 0.3394, "B_f1": 0.4277, "B_f2": 0.37, "B_accuracy": 0.4438, "B_mcc": -0.0526, "B_tp": 37, "B_fp": 27, "B_tn": 42, "B_fn": 72, "D_sharpe": 2.1987, "D_sortino": 1.9413, "D_excess_sharpe": 0.8541, "D_return_pct": 21.4, "D_hit_rate": 59.89, "D_n": 178, "D_bh_sharpe": 1.3445, "D_bh_return_pct": 12.41, "D_psr": 0.9582, "D_ic": 0.1252, "D_precision": 0.5928, "D_recall": 0.9612, "D_f1": 0.7333, "D_f2": 0.8549, "D_accuracy": 0.5955, "D_mcc": 0.1118, "D_tp": 99, "D_fp": 68, "D_tn": 7, "D_fn": 4, "sharpe": 2.1987, "sortino": 1.9413, "return_pct": 21.4, "equity": 1214.0, "max_dd": 0.0, "win_rate": 59.89, "profit_factor": 0.0, "ic": 0.1252, "hit": 59.89, "psr": 0.9582, "bh_sharpe": 1.3445, "bh_return_pct": 12.41, "excess_sharpe": 0.8541, "precision": 0.5928, "recall": 0.9612, "f1": 0.7333, "f2": 0.8549, "mcc": 0.1118, "accuracy": 0.5955, "tp": 99, "fp": 68, "tn": 7, "fn": 4}, {"fold": "fold_4", "regime": "China devaluation and oil crash", "n": 157, "A_sharpe": 0.8556, "A_sortino": 0.8249, "A_excess_sharpe": 0.8458, "A_return_pct": 9.59, "A_hit_rate": 53.21, "A_n": 157, "A_bh_sharpe": 0.0098, "A_bh_return_pct": -1.05, "A_psr": 0.7474, "A_ic": 0.0813, "A_precision": 0.5263, "A_recall": 0.8642, "A_f1": 0.6542, "A_f2": 0.7659, "A_accuracy": 0.5287, "A_mcc": 0.049, "A_tp": 70, "A_fp": 63, "A_tn": 13, "A_fn": 11, "B_sharpe": -0.7159, "B_sortino": -0.8207, "B_excess_sharpe": -0.7319, "B_return_pct": -22.55, "B_hit_rate": 40.76, "B_n": 157, "B_bh_sharpe": 0.0159, "B_bh_return_pct": -5.48, "B_psr": 0.289, "B_ic": 0.0089, "B_precision": 0.375, "B_recall": 0.1412, "B_f1": 0.2051, "B_f2": 0.1613, "B_accuracy": 0.4076, "B_mcc": -0.169, "B_tp": 12, "B_fp": 20, "B_tn": 52, "B_fn": 73, "D_sharpe": 0.8556, "D_sortino": 0.8249, "D_excess_sharpe": 0.8458, "D_return_pct": 9.59, "D_hit_rate": 53.21, "D_n": 157, "D_bh_sharpe": 0.0098, "D_bh_return_pct": -1.05, "D_psr": 0.7474, "D_ic": 0.0813, "D_precision": 0.5263, "D_recall": 0.8642, "D_f1": 0.6542, "D_f2": 0.7659, "D_accuracy": 0.5287, "D_mcc": 0.049, "D_tp": 70, "D_fp": 63, "D_tn": 13, "D_fn": 11, "sharpe": 0.8556, "sortino": 0.8249, "return_pct": 9.59, "equity": 1095.9, "max_dd": 0.0, "win_rate": 53.21, "profit_factor": 0.0, "ic": 0.0813, "hit": 53.21, "psr": 0.7474, "bh_sharpe": 0.0098, "bh_return_pct": -1.05, "excess_sharpe": 0.8458, "precision": 0.5263, "recall": 0.8642, "f1": 0.6542, "f2": 0.7659, "mcc": 0.049, "accuracy": 0.5287, "tp": 70, "fp": 63, "tn": 13, "fn": 11}, {"fold": "fold_5", "regime": "2018 Vol-mageddon + Q4 sell-off", "n": 177, "A_sharpe": 1.1969, "A_sortino": 1.1279, "A_excess_sharpe": 0.8871, "A_return_pct": 19.06, "A_hit_rate": 57.63, "A_n": 177, "A_bh_sharpe": 0.3098, "A_bh_return_pct": 3.19, "A_psr": 0.8401, "A_ic": 0.0035, "A_precision": 0.5864, "A_recall": 0.9223, "A_f1": 0.717, "A_f2": 0.8275, "A_accuracy": 0.5763, "A_mcc": 0.03, "A_tp": 95, "A_fp": 67, "A_tn": 7, "A_fn": 8, "B_sharpe": -0.4495, "B_sortino": -0.5042, "B_excess_sharpe": -1.3411, "B_return_pct": -19.84, "B_hit_rate": 43.75, "B_n": 177, "B_bh_sharpe": 0.8917, "B_bh_return_pct": 23.8, "B_psr": 0.3547, "B_ic": -0.0419, "B_precision": 0.6, "B_recall": 0.2752, "B_f1": 0.3774, "B_f2": 0.3086, "B_accuracy": 0.4407, "B_mcc": -0.0204, "B_tp": 30, "B_fp": 20, "B_tn": 48, "B_fn": 79, "D_sharpe": 1.1969, "D_sortino": 1.1279, "D_excess_sharpe": 0.8871, "D_return_pct": 19.06, "D_hit_rate": 57.63, "D_n": 177, "D_bh_sharpe": 0.3098, "D_bh_return_pct": 3.19, "D_psr": 0.8401, "D_ic": 0.0035, "D_precision": 0.5864, "D_recall": 0.9223, "D_f1": 0.717, "D_f2": 0.8275, "D_accuracy": 0.5763, "D_mcc": 0.03, "D_tp": 95, "D_fp": 67, "D_tn": 7, "D_fn": 8, "sharpe": 1.1969, "sortino": 1.1279, "return_pct": 19.06, "equity": 1190.6, "max_dd": 0.0, "win_rate": 57.63, "profit_factor": 0.0, "ic": 0.0035, "hit": 57.63, "psr": 0.8401, "bh_sharpe": 0.3098, "bh_return_pct": 3.19, "excess_sharpe": 0.8871, "precision": 0.5864, "recall": 0.9223, "f1": 0.717, "f2": 0.8275, "mcc": 0.03, "accuracy": 0.5763, "tp": 95, "fp": 67, "tn": 7, "fn": 8}, {"fold": "fold_6", "regime": "COVID crash and V-recovery", "n": 222, "A_sharpe": 0.8244, "A_sortino": 0.7117, "A_excess_sharpe": -0.0644, "A_return_pct": 23.5, "A_hit_rate": 61.26, "A_n": 222, "A_bh_sharpe": 0.8888, "A_bh_return_pct": 26.13, "A_psr": 0.7769, "A_ic": 0.0914, "A_precision": 0.6275, "A_recall": 0.9275, "A_f1": 0.7485, "A_f2": 0.8466, "A_accuracy": 0.6126, "A_mcc": 0.0405, "A_tp": 128, "A_fp": 76, "A_tn": 8, "A_fn": 10, "B_sharpe": -0.4793, "B_sortino": -0.5329, "B_excess_sharpe": -2.8677, "B_return_pct": -39.78, "B_hit_rate": 44.8, "B_n": 222, "B_bh_sharpe": 2.3884, "B_bh_return_pct": 243.18, "B_psr": 0.3282, "B_ic": 0.0006, "B_precision": 0.6829, "B_recall": 0.2044, "B_f1": 0.3146, "B_f2": 0.2377, "B_accuracy": 0.4505, "B_mcc": 0.0644, "B_tp": 28, "B_fp": 13, "B_tn": 72, "B_fn": 109, "D_sharpe": 0.8244, "D_sortino": 0.7117, "D_excess_sharpe": -0.0644, "D_return_pct": 23.5, "D_hit_rate": 61.26, "D_n": 222, "D_bh_sharpe": 0.8888, "D_bh_return_pct": 26.13, "D_psr": 0.7769, "D_ic": 0.0914, "D_precision": 0.6275, "D_recall": 0.9275, "D_f1": 0.7485, "D_f2": 0.8466, "D_accuracy": 0.6126, "D_mcc": 0.0405, "D_tp": 128, "D_fp": 76, "D_tn": 8, "D_fn": 10, "sharpe": 0.8244, "sortino": 0.7117, "return_pct": 23.5, "equity": 1234.9999999999998, "max_dd": 0.0, "win_rate": 61.26, "profit_factor": 0.0, "ic": 0.0914, "hit": 61.26, "psr": 0.7769, "bh_sharpe": 0.8888, "bh_return_pct": 26.13, "excess_sharpe": -0.0644, "precision": 0.6275, "recall": 0.9275, "f1": 0.7485, "f2": 0.8466, "mcc": 0.0405, "accuracy": 0.6126, "tp": 128, "fp": 76, "tn": 8, "fn": 10}, {"fold": "fold_7", "regime": "Inflation bear, AI rally and 2025", "n": 425, "A_sharpe": 0.5012, "A_sortino": 0.4763, "A_excess_sharpe": -0.4703, "A_return_pct": 15.48, "A_hit_rate": 55.29, "A_n": 425, "A_bh_sharpe": 0.9715, "A_bh_return_pct": 37.12, "A_psr": 0.7437, "A_ic": -0.038, "A_precision": 0.5882, "A_recall": 0.8, "A_f1": 0.678, "A_f2": 0.7463, "A_accuracy": 0.5529, "A_mcc": 0.0, "A_tp": 200, "A_fp": 140, "A_tn": 35, "A_fn": 50, "B_sharpe": -2.1069, "B_sortino": -2.0754, "B_excess_sharpe": -4.6095, "B_return_pct": -83.07, "B_hit_rate": 42.45, "B_n": 425, "B_bh_sharpe": 2.5027, "B_bh_return_pct": 458.83, "B_psr": 0.0036, "B_ic": -0.1256, "B_precision": 0.5459, "B_recall": 0.4068, "B_f1": 0.4662, "B_f2": 0.4287, "B_accuracy": 0.4235, "B_mcc": -0.1389, "B_tp": 107, "B_fp": 89, "B_tn": 73, "B_fn": 156, "D_sharpe": 0.5012, "D_sortino": 0.4763, "D_excess_sharpe": -0.4703, "D_return_pct": 15.48, "D_hit_rate": 55.29, "D_n": 425, "D_bh_sharpe": 0.9715, "D_bh_return_pct": 37.12, "D_psr": 0.7437, "D_ic": -0.038, "D_precision": 0.5882, "D_recall": 0.8, "D_f1": 0.678, "D_f2": 0.7463, "D_accuracy": 0.5529, "D_mcc": 0.0, "D_tp": 200, "D_fp": 140, "D_tn": 35, "D_fn": 50, "sharpe": 0.5012, "sortino": 0.4763, "return_pct": 15.48, "equity": 1154.8, "max_dd": 0.0, "win_rate": 55.29, "profit_factor": 0.0, "ic": -0.038, "hit": 55.29, "psr": 0.7437, "bh_sharpe": 0.9715, "bh_return_pct": 37.12, "excess_sharpe": -0.4703, "precision": 0.5882, "recall": 0.8, "f1": 0.678, "f2": 0.7463, "mcc": 0.0, "accuracy": 0.5529, "tp": 200, "fp": 140, "tn": 35, "fn": 50}], "per_window_val": [{"fold": "fold_1", "regime": "GFC peak crash (Lehman + Mar-2009 bottom)", "n": 104, "A_sharpe": 0.2166, "A_sortino": 0.2198, "A_excess_sharpe": 0.3838, "A_return_pct": 0.85, "A_hit_rate": 51.96, "A_n": 104, "A_bh_sharpe": -0.1672, "A_bh_return_pct": -3.81, "A_psr": 0.5553, "A_ic": 0.062, "A_precision": 0.5238, "A_recall": 0.8148, "A_f1": 0.6377, "A_f2": 0.7333, "A_accuracy": 0.5192, "A_mcc": 0.0188, "A_tp": 44, "A_fp": 40, "A_tn": 10, "A_fn": 10, "B_sharpe": 3.5542, "B_sortino": 4.2419, "B_excess_sharpe": 5.8283, "B_return_pct": 108.15, "B_hit_rate": 56.31, "B_n": 104, "B_bh_sharpe": -2.2741, "B_bh_return_pct": -44.12, "B_psr": 0.9916, "B_ic": 0.1148, "B_precision": 0.5745, "B_recall": 0.5192, "B_f1": 0.5455, "B_f2": 0.5294, "B_accuracy": 0.5673, "B_mcc": 0.1352, "B_tp": 27, "B_fp": 20, "B_tn": 32, "B_fn": 25, "D_sharpe": 0.2166, "D_sortino": 0.2198, "D_excess_sharpe": 0.3838, "D_return_pct": 0.85, "D_hit_rate": 51.96, "D_n": 104, "D_bh_sharpe": -0.1672, "D_bh_return_pct": -3.81, "D_psr": 0.5553, "D_ic": 0.062, "D_precision": 0.5238, "D_recall": 0.8148, "D_f1": 0.6377, "D_f2": 0.7333, "D_accuracy": 0.5192, "D_mcc": 0.0188, "D_tp": 44, "D_fp": 40, "D_tn": 10, "D_fn": 10, "sharpe": 0.2166, "sortino": 0.2198, "return_pct": 0.85, "equity": 1008.5, "max_dd": 0.0, "win_rate": 51.96, "profit_factor": 0.0, "ic": 0.062, "hit": 51.96, "psr": 0.5553, "bh_sharpe": -0.1672, "bh_return_pct": -3.81, "excess_sharpe": 0.3838, "precision": 0.5238, "recall": 0.8148, "f1": 0.6377, "f2": 0.7333, "mcc": 0.0188, "accuracy": 0.5192, "tp": 44, "fp": 40, "tn": 10, "fn": 10}, {"fold": "fold_2", "regime": "2011 US-downgrade + EU debt", "n": 96, "A_sharpe": -0.5908, "A_sortino": -0.5277, "A_excess_sharpe": -0.3167, "A_return_pct": -7.14, "A_hit_rate": 50.53, "A_n": 96, "A_bh_sharpe": -0.2741, "A_bh_return_pct": -4.09, "A_psr": 0.3566, "A_ic": -0.1818, "A_precision": 0.5125, "A_recall": 0.82, "A_f1": 0.6308, "A_f2": 0.7321, "A_accuracy": 0.5, "A_mcc": -0.0373, "A_tp": 41, "A_fp": 39, "A_tn": 7, "A_fn": 9, "B_sharpe": 3.4485, "B_sortino": 4.6965, "B_excess_sharpe": 4.4759, "B_return_pct": 99.04, "B_hit_rate": 52.08, "B_n": 96, "B_bh_sharpe": -1.0274, "B_bh_return_pct": -25.58, "B_psr": 0.9889, "B_ic": 0.07, "B_precision": 0.4727, "B_recall": 0.6047, "B_f1": 0.5306, "B_f2": 0.5727, "B_accuracy": 0.5208, "B_mcc": 0.0578, "B_tp": 26, "B_fp": 29, "B_tn": 24, "B_fn": 17, "D_sharpe": -0.5908, "D_sortino": -0.5277, "D_excess_sharpe": -0.3167, "D_return_pct": -7.14, "D_hit_rate": 50.53, "D_n": 96, "D_bh_sharpe": -0.2741, "D_bh_return_pct": -4.09, "D_psr": 0.3566, "D_ic": -0.1818, "D_precision": 0.5125, "D_recall": 0.82, "D_f1": 0.6308, "D_f2": 0.7321, "D_accuracy": 0.5, "D_mcc": -0.0373, "D_tp": 41, "D_fp": 39, "D_tn": 7, "D_fn": 9, "sharpe": -0.5908, "sortino": -0.5277, "return_pct": -7.14, "equity": 928.6, "max_dd": 0.0, "win_rate": 50.53, "profit_factor": 0.0, "ic": -0.1818, "hit": 50.53, "psr": 0.3566, "bh_sharpe": -0.2741, "bh_return_pct": -4.09, "excess_sharpe": -0.3167, "precision": 0.5125, "recall": 0.82, "f1": 0.6308, "f2": 0.7321, "mcc": -0.0373, "accuracy": 0.5, "tp": 41, "fp": 39, "tn": 7, "fn": 9}, {"fold": "fold_3", "regime": "Taper tantrum and 2014 H1", "n": 54, "A_sharpe": 4.9853, "A_sortino": 5.1648, "A_excess_sharpe": 0.2855, "A_return_pct": 11.08, "A_hit_rate": 62.96, "A_n": 54, "A_bh_sharpe": 4.6998, "A_bh_return_pct": 10.46, "A_psr": 0.9825, "A_ic": -0.0129, "A_precision": 0.6226, "A_recall": 1.0, "A_f1": 0.7674, "A_f2": 0.8919, "A_accuracy": 0.6296, "A_mcc": 0.1722, "A_tp": 33, "A_fp": 20, "A_tn": 1, "A_fn": 0, "B_sharpe": 3.8679, "B_sortino": 3.6028, "B_excess_sharpe": -5.1647, "B_return_pct": 20.71, "B_hit_rate": 64.81, "B_n": 54, "B_bh_sharpe": 9.0326, "B_bh_return_pct": 49.18, "B_psr": 0.9537, "B_ic": 0.0799, "B_precision": 0.75, "B_recall": 0.7297, "B_f1": 0.7397, "B_f2": 0.7337, "B_accuracy": 0.6481, "B_mcc": 0.1974, "B_tp": 27, "B_fp": 9, "B_tn": 8, "B_fn": 10, "D_sharpe": 4.9853, "D_sortino": 5.1648, "D_excess_sharpe": 0.2855, "D_return_pct": 11.08, "D_hit_rate": 62.96, "D_n": 54, "D_bh_sharpe": 4.6998, "D_bh_return_pct": 10.46, "D_psr": 0.9825, "D_ic": -0.0129, "D_precision": 0.6226, "D_recall": 1.0, "D_f1": 0.7674, "D_f2": 0.8919, "D_accuracy": 0.6296, "D_mcc": 0.1722, "D_tp": 33, "D_fp": 20, "D_tn": 1, "D_fn": 0, "sharpe": 4.9853, "sortino": 5.1648, "return_pct": 11.08, "equity": 1110.8, "max_dd": 0.0, "win_rate": 62.96, "profit_factor": 0.0, "ic": -0.0129, "hit": 62.96, "psr": 0.9825, "bh_sharpe": 4.6998, "bh_return_pct": 10.46, "excess_sharpe": 0.2855, "precision": 0.6226, "recall": 1.0, "f1": 0.7674, "f2": 0.8919, "mcc": 0.1722, "accuracy": 0.6296, "tp": 33, "fp": 20, "tn": 1, "fn": 0}, {"fold": "fold_4", "regime": "China devaluation and oil crash", "n": 96, "A_sharpe": -0.9808, "A_sortino": -0.9425, "A_excess_sharpe": -0.5566, "A_return_pct": -7.56, "A_hit_rate": 47.37, "A_n": 96, "A_bh_sharpe": -0.4241, "A_bh_return_pct": -3.73, "A_psr": 0.2736, "A_ic": -0.0634, "A_precision": 0.4583, "A_recall": 0.7333, "A_f1": 0.5641, "A_f2": 0.6548, "A_accuracy": 0.4688, "A_mcc": -0.0362, "A_tp": 33, "A_fp": 39, "A_tn": 12, "A_fn": 12, "B_sharpe": 2.0242, "B_sortino": 2.9718, "B_excess_sharpe": 3.2084, "B_return_pct": 35.78, "B_hit_rate": 50.0, "B_n": 96, "B_bh_sharpe": -1.1843, "B_bh_return_pct": -21.44, "B_psr": 0.9173, "B_ic": -0.0107, "B_precision": 0.4762, "B_recall": 0.4348, "B_f1": 0.4545, "B_f2": 0.4425, "B_accuracy": 0.5, "B_mcc": -0.0053, "B_tp": 20, "B_fp": 22, "B_tn": 28, "B_fn": 26, "D_sharpe": -0.9808, "D_sortino": -0.9425, "D_excess_sharpe": -0.5566, "D_return_pct": -7.56, "D_hit_rate": 47.37, "D_n": 96, "D_bh_sharpe": -0.4241, "D_bh_return_pct": -3.73, "D_psr": 0.2736, "D_ic": -0.0634, "D_precision": 0.4583, "D_recall": 0.7333, "D_f1": 0.5641, "D_f2": 0.6548, "D_accuracy": 0.4688, "D_mcc": -0.0362, "D_tp": 33, "D_fp": 39, "D_tn": 12, "D_fn": 12, "sharpe": -0.9808, "sortino": -0.9425, "return_pct": -7.56, "equity": 924.4, "max_dd": 0.0, "win_rate": 47.37, "profit_factor": 0.0, "ic": -0.0634, "hit": 47.37, "psr": 0.2736, "bh_sharpe": -0.4241, "bh_return_pct": -3.73, "excess_sharpe": -0.5566, "precision": 0.4583, "recall": 0.7333, "f1": 0.5641, "f2": 0.6548, "mcc": -0.0362, "accuracy": 0.4688, "tp": 33, "fp": 39, "tn": 12, "fn": 12}, {"fold": "fold_5", "regime": "2018 Vol-mageddon + Q4 sell-off", "n": 54, "A_sharpe": 1.3636, "A_sortino": 1.3618, "A_excess_sharpe": -0.0644, "A_return_pct": 3.78, "A_hit_rate": 51.85, "A_n": 54, "A_bh_sharpe": 1.428, "A_bh_return_pct": 3.97, "A_psr": 0.7311, "A_ic": -0.0027, "A_precision": 0.5294, "A_recall": 0.931, "A_f1": 0.675, "A_f2": 0.8084, "A_accuracy": 0.5185, "A_mcc": -0.0631, "A_tp": 27, "A_fp": 24, "A_tn": 1, "A_fn": 2, "B_sharpe": -4.1894, "B_sortino": -3.9079, "B_excess_sharpe": -9.1216, "B_return_pct": -24.15, "B_hit_rate": 37.04, "B_n": 54, "B_bh_sharpe": 4.9322, "B_bh_return_pct": 34.93, "B_psr": 0.0305, "B_ic": -0.3901, "B_precision": 0.6364, "B_recall": 0.1892, "B_f1": 0.2917, "B_f2": 0.2201, "B_accuracy": 0.3704, "B_mcc": -0.0532, "B_tp": 7, "B_fp": 4, "B_tn": 13, "B_fn": 30, "D_sharpe": 1.3636, "D_sortino": 1.3618, "D_excess_sharpe": -0.0644, "D_return_pct": 3.78, "D_hit_rate": 51.85, "D_n": 54, "D_bh_sharpe": 1.428, "D_bh_return_pct": 3.97, "D_psr": 0.7311, "D_ic": -0.0027, "D_precision": 0.5294, "D_recall": 0.931, "D_f1": 0.675, "D_f2": 0.8084, "D_accuracy": 0.5185, "D_mcc": -0.0631, "D_tp": 27, "D_fp": 24, "D_tn": 1, "D_fn": 2, "sharpe": 1.3636, "sortino": 1.3618, "return_pct": 3.78, "equity": 1037.8, "max_dd": 0.0, "win_rate": 51.85, "profit_factor": 0.0, "ic": -0.0027, "hit": 51.85, "psr": 0.7311, "bh_sharpe": 1.428, "bh_return_pct": 3.97, "excess_sharpe": -0.0644, "precision": 0.5294, "recall": 0.931, "f1": 0.675, "f2": 0.8084, "mcc": -0.0631, "accuracy": 0.5185, "tp": 27, "fp": 24, "tn": 1, "fn": 2}, {"fold": "fold_6", "regime": "COVID crash and V-recovery", "n": 75, "A_sharpe": 3.8105, "A_sortino": 3.443, "A_excess_sharpe": -0.4889, "A_return_pct": 12.98, "A_hit_rate": 66.67, "A_n": 75, "A_bh_sharpe": 4.2994, "A_bh_return_pct": 14.68, "A_psr": 0.9738, "A_ic": -0.1418, "A_precision": 0.6757, "A_recall": 0.9804, "A_f1": 0.8, "A_f2": 0.8993, "A_accuracy": 0.6667, "A_mcc": -0.0797, "A_tp": 50, "A_fp": 24, "A_tn": 0, "A_fn": 1, "B_sharpe": -3.3485, "B_sortino": -3.0255, "B_excess_sharpe": -17.6824, "B_return_pct": -22.54, "B_hit_rate": 44.0, "B_n": 75, "B_bh_sharpe": 14.3339, "B_bh_return_pct": 120.13, "B_psr": 0.0353, "B_ic": 0.0681, "B_precision": 0.9565, "B_recall": 0.3492, "B_f1": 0.5116, "B_f2": 0.4, "B_accuracy": 0.44, "B_mcc": 0.2114, "B_tp": 22, "B_fp": 1, "B_tn": 11, "B_fn": 41, "D_sharpe": 3.8105, "D_sortino": 3.443, "D_excess_sharpe": -0.4889, "D_return_pct": 12.98, "D_hit_rate": 66.67, "D_n": 75, "D_bh_sharpe": 4.2994, "D_bh_return_pct": 14.68, "D_psr": 0.9738, "D_ic": -0.1418, "D_precision": 0.6757, "D_recall": 0.9804, "D_f1": 0.8, "D_f2": 0.8993, "D_accuracy": 0.6667, "D_mcc": -0.0797, "D_tp": 50, "D_fp": 24, "D_tn": 0, "D_fn": 1, "sharpe": 3.8105, "sortino": 3.443, "return_pct": 12.98, "equity": 1129.8, "max_dd": 0.0, "win_rate": 66.67, "profit_factor": 0.0, "ic": -0.1418, "hit": 66.67, "psr": 0.9738, "bh_sharpe": 4.2994, "bh_return_pct": 14.68, "excess_sharpe": -0.4889, "precision": 0.6757, "recall": 0.9804, "f1": 0.8, "f2": 0.8993, "mcc": -0.0797, "accuracy": 0.6667, "tp": 50, "fp": 24, "tn": 0, "fn": 1}, {"fold": "fold_7", "regime": "Inflation bear, AI rally and 2025", "n": 114, "A_sharpe": 2.6399, "A_sortino": 2.5836, "A_excess_sharpe": -0.2051, "A_return_pct": 19.66, "A_hit_rate": 59.65, "A_n": 114, "A_bh_sharpe": 2.845, "A_bh_return_pct": 21.34, "A_psr": 0.9585, "A_ic": -0.011, "A_precision": 0.5981, "A_recall": 0.9552, "A_f1": 0.7356, "A_f2": 0.8533, "A_accuracy": 0.5965, "A_mcc": 0.0827, "A_