{"experiment_num": 38, "backbone": "lightgbm", "description": "LightGBM @ exp 10 gbm_lr=0.02 (up from 0.01) - Chen-Guestrin 2016 lr range [0.03,0.1] test", "config": {"seq_len": 60, "lr": 0.0003, "batch_size": 32, "epochs": 50, "weight_decay": 1e-05, "patience": 10, "warmup_epochs": 0, "head_dropout": 0.1, "huber_delta": 1.0, "grad_clip": 1.0, "seed": 42, "hidden_size": null, "num_layers": null, "max_depth": 4, "gbm_lr": 0.02, "n_estimators": 1000}, "composite": -0.3646, "test_pos_folds": 4, "val_pos_folds": 3, "val_loss": null, "elapsed_sec": 227.0, "timestamp": "2026-04-27T18:50:20", "sharpe": 0.5554, "val_sharpe": -0.0646, "ic": 0.0259, "hit": 47.46, "psr": 0.8758, "equity": 1527.0000000000002, "return_pct": 52.7, "bh_sharpe": 1.2194, "bh_return_pct": 187.05, "excess_sharpe": -0.664, "B_sharpe": -0.0735, "B_excess_sharpe": -2.9017, "B_return_pct": -45.14, "D_sharpe": -0.0018, "D_excess_sharpe": -1.2211, "D_return_pct": -10.32, "per_window": [{"fold": "fold_1", "regime": "GFC peak crash (Lehman + Mar-2009 bottom)", "n": 66, "A_sharpe": 2.5056, "A_sortino": 2.9595, "A_excess_sharpe": 1.9334, "A_return_pct": 25.17, "A_hit_rate": 46.97, "A_n": 66, "A_bh_sharpe": 0.5721, "A_bh_return_pct": 3.85, "A_psr": 0.8972, "A_ic": 0.0216, "B_sharpe": 4.136, "B_sortino": 4.4769, "B_excess_sharpe": 2.089, "B_return_pct": 106.96, "B_hit_rate": 60.0, "B_n": 66, "B_bh_sharpe": 2.0469, "B_bh_return_pct": 39.28, "B_psr": 0.981, "B_ic": 0.4279, "D_sharpe": 2.8922, "D_sortino": 2.9298, "D_excess_sharpe": 2.3201, "D_return_pct": 29.8, "D_hit_rate": 59.09, "D_n": 66, "D_bh_sharpe": 0.5721, "D_bh_return_pct": 3.85, "D_psr": 0.9257, "D_ic": 0.2312, "sharpe": 2.5056, "sortino": 2.9595, "return_pct": 25.17, "equity": 1251.7, "max_dd": 0.0, "win_rate": 46.97, "profit_factor": 0.0, "ic": 0.0216, "hit": 46.97, "psr": 0.8972, "bh_sharpe": 0.5721, "bh_return_pct": 3.85, "excess_sharpe": 1.9334, "precision": 0.5, "recall": 0.5429, "f1": 0.5205, "f2": 0.5337, "accuracy": 0.4697, "mcc": -0.0707, "tp": 19, "fp": 19, "tn": 12, "fn": 16, "A_precision": 0.5, "A_recall": 0.5429, "A_f1": 0.5205, "A_f2": 0.5337, "A_accuracy": 0.4697, "A_mcc": -0.0707, "A_tp": 19, "A_fp": 19, "A_tn": 12, "A_fn": 16}, {"fold": "fold_2", "regime": "2011 US-downgrade + EU debt", "n": 87, "A_sharpe": 3.6573, "A_sortino": 4.7366, "A_excess_sharpe": -1.3647, "A_return_pct": 20.9, "A_hit_rate": 58.14, "A_n": 87, "A_bh_sharpe": 5.022, "A_bh_return_pct": 29.23, "A_psr": 0.9911, "A_ic": 0.1882, "B_sharpe": 5.0949, "B_sortino": 5.975, "B_excess_sharpe": -6.042, "B_return_pct": 73.12, "B_hit_rate": 60.92, "B_n": 87, "B_bh_sharpe": 11.1369, "B_bh_return_pct": 185.4, "B_psr": 0.9988, "B_ic": 0.269, "D_sharpe": 1.8056, "D_sortino": 2.1413, "D_excess_sharpe": -3.2164, "D_return_pct": 9.79, "D_hit_rate": 52.33, "D_n": 87, "D_bh_sharpe": 5.022, "D_bh_return_pct": 29.23, "D_psr": 0.8659, "D_ic": 0.1047, "sharpe": 3.6573, "sortino": 4.7366, "return_pct": 20.9, "equity": 1209.0, "max_dd": 0.0, "win_rate": 58.14, "profit_factor": 0.0, "ic": 0.1882, "hit": 58.14, "psr": 0.9911, "bh_sharpe": 5.022, "bh_return_pct": 29.23, "excess_sharpe": -1.3647, "precision": 0.6667, "recall": 0.6667, "f1": 0.6667, "f2": 0.6667, "accuracy": 0.5862, "mcc": 0.1212, "tp": 36, "fp": 18, "tn": 15, "fn": 18, "A_precision": 0.6667, "A_recall": 0.6667, "A_f1": 0.6667, "A_f2": 0.6667, "A_accuracy": 0.5862, "A_mcc": 0.1212, "A_tp": 36, "A_fp": 18, "A_tn": 15, "A_fn": 18}, {"fold": "fold_3", "regime": "Taper tantrum and 2014 H1", "n": 129, "A_sharpe": 0.9698, "A_sortino": 1.1057, "A_excess_sharpe": -0.798, "A_return_pct": 6.12, "A_hit_rate": 48.44, "A_n": 129, "A_bh_sharpe": 1.7678, "A_bh_return_pct": 11.76, "A_psr": 0.7591, "A_ic": 0.0708, "B_sharpe": 2.4578, "B_sortino": 2.4637, "B_excess_sharpe": -1.7896, "B_return_pct": 33.25, "B_hit_rate": 57.36, "B_n": 129, "B_bh_sharpe": 4.2474, "B_bh_return_pct": 64.1, "B_psr": 0.9572, "B_ic": 0.0535, "D_sharpe": 2.217, "D_sortino": 2.2045, "D_excess_sharpe": 0.4492, "D_return_pct": 15.03, "D_hit_rate": 55.47, "D_n": 129, "D_bh_sharpe": 1.7678, "D_bh_return_pct": 11.76, "D_psr": 0.9354, "D_ic": 0.1277, "sharpe": 0.9698, "sortino": 1.1057, "return_pct": 6.12, "equity": 1061.1999999999998, "max_dd": 0.0, "win_rate": 48.44, "profit_factor": 0.0, "ic": 0.0708, "hit": 48.44, "psr": 0.7591, "bh_sharpe": 1.7678, "bh_return_pct": 11.76, "excess_sharpe": -0.798, "precision": 0.5811, "recall": 0.5513, "f1": 0.5658, "f2": 0.557, "accuracy": 0.4884, "mcc": -0.0559, "tp": 43, "fp": 31, "tn": 20, "fn": 35, "A_precision": 0.5811, "A_recall": 0.5513, "A_f1": 0.5658, "A_f2": 0.557, "A_accuracy": 0.4884, "A_mcc": -0.0559, "A_tp": 43, "A_fp": 31, "A_tn": 20, "A_fn": 35}, {"fold": "fold_4", "regime": "China devaluation and oil crash", "n": 108, "A_sharpe": -0.5217, "A_sortino": -0.4932, "A_excess_sharpe": 0.1681, "A_return_pct": -5.32, "A_hit_rate": 48.6, "A_n": 108, "A_bh_sharpe": -0.6898, "A_bh_return_pct": -6.71, "A_psr": 0.3663, "A_ic": 0.0272, "B_sharpe": -2.3701, "B_sortino": -2.2313, "B_excess_sharpe": -0.4126, "B_return_pct": -38.39, "B_hit_rate": 41.67, "B_n": 108, "B_bh_sharpe": -1.9575, "B_bh_return_pct": -33.56, "B_psr": 0.0578, "B_ic": -0.0621, "D_sharpe": -1.2772, "D_sortino": -1.1254, "D_excess_sharpe": -0.5874, "D_return_pct": -11.37, "D_hit_rate": 49.53, "D_n": 108, "D_bh_sharpe": -0.6898, "D_bh_return_pct": -6.71, "D_psr": 0.1977, "D_ic": -0.0289, "sharpe": -0.5217, "sortino": -0.4932, "return_pct": -5.32, "equity": 946.8, "max_dd": 0.0, "win_rate": 48.6, "profit_factor": 0.0, "ic": 0.0272, "hit": 48.6, "psr": 0.3663, "bh_sharpe": -0.6898, "bh_return_pct": -6.71, "excess_sharpe": 0.1681, "precision": 0.4821, "recall": 0.5094, "f1": 0.4954, "f2": 0.5037, "accuracy": 0.4907, "mcc": -0.0178, "tp": 27, "fp": 29, "tn": 26, "fn": 26, "A_precision": 0.4821, "A_recall": 0.5094, "A_f1": 0.4954, "A_f2": 0.5037, "A_accuracy": 0.4907, "A_mcc": -0.0178, "A_tp": 27, "A_fp": 29, "A_tn": 26, "A_fn": 26}, {"fold": "fold_5", "regime": "2018 Vol-mageddon + Q4 sell-off", "n": 128, "A_sharpe": -0.3274, "A_sortino": -0.3817, "A_excess_sharpe": -1.4786, "A_return_pct": -5.21, "A_hit_rate": 42.97, "A_n": 128, "A_bh_sharpe": 1.1511, "A_bh_return_pct": 13.19, "A_psr": 0.4088, "A_ic": -0.017, "B_sharpe": -2.8102, "B_sortino": -2.8578, "B_excess_sharpe": -5.6221, "B_return_pct": -50.89, "B_hit_rate": 35.43, "B_n": 128, "B_bh_sharpe": 2.8119, "B_bh_return_pct": 82.25, "B_psr": 0.0244, "B_ic": -0.0824, "D_sharpe": -0.6441, "D_sortino": -0.7212, "D_excess_sharpe": -1.7952, "D_return_pct": -8.75, "D_hit_rate": 44.53, "D_n": 128, "D_bh_sharpe": 1.1511, "D_bh_return_pct": 13.19, "D_psr": 0.3263, "D_ic": -0.0263, "sharpe": -0.3274, "sortino": -0.3817, "return_pct": -5.21, "equity": 947.9, "max_dd": 0.0, "win_rate": 42.97, "profit_factor": 0.0, "ic": -0.017, "hit": 42.97, "psr": 0.4088, "bh_sharpe": 1.1511, "bh_return_pct": 13.19, "excess_sharpe": -1.4786, "precision": 0.5397, "recall": 0.4359, "f1": 0.4823, "f2": 0.4533, "accuracy": 0.4297, "mcc": -0.1406, "tp": 34, "fp": 29, "tn": 21, "fn": 44, "A_precision": 0.5397, "A_recall": 0.4359, "A_f1": 0.4823, "A_f2": 0.4533, "A_accuracy": 0.4297, "A_mcc": -0.1406, "A_tp": 34, "A_fp": 29, "A_tn": 21, "A_fn": 44}, {"fold": "fold_6", "regime": "COVID crash and V-recovery", "n": 173, "A_sharpe": 1.1474, "A_sortino": 1.3399, "A_excess_sharpe": -1.1787, "A_return_pct": 18.61, "A_hit_rate": 47.98, "A_n": 173, "A_bh_sharpe": 2.3261, "A_bh_return_pct": 43.81, "A_psr": 0.8325, "A_ic": 0.0849, "B_sharpe": -0.619, "B_sortino": -0.6906, "B_excess_sharpe": -6.365, "B_return_pct": -26.07, "B_hit_rate": 44.19, "B_n": 173, "B_bh_sharpe": 5.746, "B_bh_return_pct": 499.04, "B_psr": 0.3067, "B_ic": 0.1324, "D_sharpe": -0.9572, "D_sortino": -1.1075, "D_excess_sharpe": -3.2832, "D_return_pct": -16.42, "D_hit_rate": 39.88, "D_n": 173, "D_bh_sharpe": 2.3261, "D_bh_return_pct": 43.81, "D_psr": 0.2194, "D_ic": 0.0266, "sharpe": 1.1474, "sortino": 1.3399, "return_pct": 18.61, "equity": 1186.1, "max_dd": 0.0, "win_rate": 47.98, "profit_factor": 0.0, "ic": 0.0849, "hit": 47.98, "psr": 0.8325, "bh_sharpe": 2.3261, "bh_return_pct": 43.81, "excess_sharpe": -1.1787, "precision": 0.6716, "recall": 0.3982, "f1": 0.5, "f2": 0.4335, "accuracy": 0.4798, "mcc": 0.0308, "tp": 45, "fp": 22, "tn": 38, "fn": 68, "A_precision": 0.6716, "A_recall": 0.3982, "A_f1": 0.5, "A_f2": 0.4335, "A_accuracy": 0.4798, "A_mcc": 0.0308, "A_tp": 45, "A_fp": 22, "A_tn": 38, "A_fn": 68}, {"fold": "fold_7", "regime": "Inflation bear, AI rally and 2025", "n": 376, "A_sharpe": -0.2255, "A_sortino": -0.2485, "A_excess_sharpe": -1.0288, "A_return_pct": -10.67, "A_hit_rate": 45.74, "A_n": 376, "A_bh_sharpe": 0.8033, "A_bh_return_pct": 26.02, "A_psr": 0.3925, "A_ic": -0.0008, "B_sharpe": -0.7292, "B_sortino": -0.8227, "B_excess_sharpe": -2.6609, "B_return_pct": -48.63, "B_hit_rate": 42.13, "B_n": 376, "B_bh_sharpe": 1.9317, "B_bh_return_pct": 222.05, "B_psr": 0.1905, "B_ic": -0.0357, "D_sharpe": -0.5211, "D_sortino": -0.6225, "D_excess_sharpe": -1.3244, "D_return_pct": -19.07, "D_hit_rate": 40.69, "D_n": 376, "D_bh_sharpe": 0.8033, "D_bh_return_pct": 26.02, "D_psr": 0.2676, "D_ic": -0.0093, "sharpe": -0.2255, "sortino": -0.2485, "return_pct": -10.67, "equity": 893.3, "max_dd": 0.0, "win_rate": 45.74, "profit_factor": 0.0, "ic": -0.0008, "hit": 45.74, "psr": 0.3925, "bh_sharpe": 0.8033, "bh_return_pct": 26.02, "excess_sharpe": -1.0288, "precision": 0.563, "recall": 0.3439, "f1": 0.427, "f2": 0.3729, "accuracy": 0.4574, "mcc": -0.0377, "tp": 76, "fp": 59, "tn": 96, "fn": 145, "A_precision": 0.563, "A_recall": 0.3439, "A_f1": 0.427, "A_f2": 0.3729, "A_accuracy": 0.4574, "A_mcc": -0.0377, "A_tp": 76, "A_fp": 59, "A_tn": 96, "A_fn": 145}], "per_window_val": [{"fold": "fold_1", "regime": "GFC peak crash (Lehman + Mar-2009 bottom)", "n": 65, "A_sharpe": 1.7007, "A_sortino": 2.1359, "A_excess_sharpe": 3.9264, "A_return_pct": 14.24, "A_hit_rate": 49.21, "A_n": 65, "A_bh_sharpe": -2.2257, "A_bh_return_pct": -18.74, "A_psr": 0.8163, "A_ic": 0.0787, "B_sharpe": -4.9982, "B_sortino": -4.2507, "B_excess_sharpe": 2.1241, "B_return_pct": -62.55, "B_hit_rate": 38.46, "B_n": 65, "B_bh_sharpe": -7.1223, "B_bh_return_pct": -73.11, "B_psr": 0.0038, "B_ic": 0.1534, "D_sharpe": -0.8676, "D_sortino": -0.7659, "D_excess_sharpe": 1.358, "D_return_pct": -8.67, "D_hit_rate": 49.21, "D_n": 65, "D_bh_sharpe": -2.2257, "D_bh_return_pct": -18.74, "D_psr": 0.3274, "D_ic": 0.4299, "sharpe": 1.7007, "sortino": 2.1359, "return_pct": 14.24, "equity": 1142.4, "max_dd": 0.0, "win_rate": 49.21, "profit_factor": 0.0, "ic": 0.0787, "hit": 49.21, "psr": 0.8163, "bh_sharpe": -2.2257, "bh_return_pct": -18.74, "excess_sharpe": 3.9264}, {"fold": "fold_2", "regime": "2011 US-downgrade + EU debt", "n": 47, "A_sharpe": -2.2313, "A_sortino": -2.0722, "A_excess_sharpe": -2.0372, "A_return_pct": -14.31, "A_hit_rate": 44.68, "A_n": 47, "A_bh_sharpe": -0.1941, "A_bh_return_pct": -2.36, "A_psr": 0.1668, "A_ic": -0.1094, "B_sharpe": 0.5383, "B_sortino": 0.492, "B_excess_sharpe": 2.1506, "B_return_pct": 2.19, "B_hit_rate": 53.19, "B_n": 47, "B_bh_sharpe": -1.6123, "B_bh_return_pct": -24.3, "B_psr": 0.59, "B_ic": 0.2091, "D_sharpe": -0.5684, "D_sortino": -0.4846, "D_excess_sharpe": -0.3743, "D_return_pct": -4.7, "D_hit_rate": 55.32, "D_n": 47, "D_bh_sharpe": -0.1941, "D_bh_return_pct": -2.36, "D_psr": 0.4032, "D_ic": 0.0109, "sharpe": -2.2313, "sortino": -2.0722, "return_pct": -14.31, "equity": 856.9, "max_dd": 0.0, "win_rate": 44.68, "profit_factor": 0.0, "ic": -0.1094, "hit": 44.68, "psr": 0.1668, "bh_sharpe": -0.1941, "bh_return_pct": -2.36, "excess_sharpe": -2.0372}, {"fold": "fold_3", "regime": "Taper tantrum and 2014 H1", "n": 5, "A_sharpe": -0.5833, "A_sortino": -0.6746, "A_excess_sharpe": 0.7361, "A_return_pct": -0.1, "A_hit_rate": 40.0, "A_n": 5, "A_bh_sharpe": -1.3194, "A_bh_return_pct": -0.21, "A_psr": 0.4709, "A_ic": -0.1, "B_sharpe": 25.8705, "B_sortino": 0.0, "B_excess_sharpe": 51.7411, "B_return_pct": 3.95, "B_hit_rate": 100.0, "B_n": 5, "B_bh_sharpe": -25.8705, "B_bh_return_pct": -3.84, "B_psr": 1.0, "B_ic": -0.1, "D_sharpe": 1.3194, "D_sortino": 1.268, "D_excess_sharpe": 2.6388, "D_return_pct": 0.2, "D_hit_rate": 60.0, "D_n": 5, "D_bh_sharpe": -1.3194, "D_bh_return_pct": -0.21, "D_psr": 0.5663, "D_ic": 0.1, "sharpe": -0.5833, "sortino": -0.6746, "return_pct": -0.1, "equity": 999.0, "max_dd": 0.0, "win_rate": 40.0, "profit_factor": 0.0, "ic": -0.1, "hit": 40.0, "psr": 0.4709, "bh_sharpe": -1.3194, "bh_return_pct": -0.21, "excess_sharpe": 0.7361}, {"fold": "fold_4", "regime": "China devaluation and oil crash", "n": 47, "A_sharpe": -2.3771, "A_sortino": -2.3697, "A_excess_sharpe": -0.5533, "A_return_pct": -10.95, "A_hit_rate": 36.17, "A_n": 47, "A_bh_sharpe": -1.8238, "A_bh_return_pct": -8.68, "A_psr": 0.1558, "A_ic": -0.0446, "B_sharpe": 0.0144, "B_sortino": 0.0116, "B_excess_sharpe": 2.2344, "B_return_pct": -3.14, "B_hit_rate": 55.32, "B_n": 47, "B_bh_sharpe": -2.22, "B_bh_return_pct": -23.98, "B_psr": 0.5024, "B_ic": 0.4481, "D_sharpe": -1.1563, "D_sortino": -1.0386, "D_excess_sharpe": 0.6675, "D_return_pct": -5.82, "D_hit_rate": 51.06, "D_n": 47, "D_bh_sharpe": -1.8238, "D_bh_return_pct": -8.68, "D_psr": 0.3096, "D_ic": 0.0265, "sharpe": -2.3771, "sortino": -2.3697, "return_pct": -10.95, "equity": 890.5000000000001, "max_dd": 0.0, "win_rate": 36.17, "profit_factor": 0.0, "ic": -0.0446, "hit": 36.17, "psr": 0.1558, "bh_sharpe": -1.8238, "bh_return_pct": -8.68, "excess_sharpe": -0.5533}, {"fold": "fold_5", "regime": "2018 Vol-mageddon + Q4 sell-off", "n": 5, "A_sharpe": -10.1368, "A_sortino": -6.9937, "A_excess_sharpe": 0.0, "A_return_pct": -3.15, "A_hit_rate": 40.0, "A_n": 5, "A_bh_sharpe": -10.1368, "A_bh_return_pct": -3.15, "A_psr": 0.0985, "A_ic": -0.2, "B_sharpe": 5.6858, "B_sortino": 6.0578, "B_excess_sharpe": 0.0, "B_return_pct": 4.22, "B_hit_rate": 60.0, "B_n": 5, "B_bh_sharpe": 5.6858, "B_bh_return_pct": 4.22, "B_psr": 0.753, "B_ic": 0.9, "D_sharpe": -10.1368, "D_sortino": -6.9937, "D_excess_sharpe": 0.0, "D_return_pct": -3.15, "D_hit_rate": 40.0, "D_n": 5, "D_bh_sharpe": -10.1368, "D_bh_return_pct": -3.15, "D_psr": 0.0985, "D_ic": 0.7, "sharpe": -10.1368, "sortino": -6.9937, "return_pct": -3.15, "equity": 968.5, "max_dd": 0.0, "win_rate": 40.0, "profit_factor": 0.0, "ic": -0.2, "hit": 40.0, "psr": 0.0985, "bh_sharpe": -10.1368, "bh_return_pct": -3.15, "excess_sharpe": 0.0}, {"fold": "fold_6", "regime": "COVID crash and V-recovery", "n": 26, "A_sharpe": 0.598, "A_sortino": 0.6164, "A_excess_sharpe": -2.6872, "A_return_pct": 0.79, "A_hit_rate": 50.0, "A_n": 26, "A_bh_sharpe": 3.2852, "A_bh_return_pct": 4.82, "A_psr": 0.5747, "A_ic": 0.1911, "B_sharpe": 1.8684, "B_sortino": 1.9326, "B_excess_sharpe": -11.1108, "B_return_pct": 5.78, "B_hit_rate": 53.85, "B_n": 26, "B_bh_sharpe": 12.9792, "B_bh_return_pct": 38.76, "B_psr": 0.7215, "B_ic": 0.4325, "D_sharpe": 5.9575, "D_sortino": 8.0361, "D_excess_sharpe": 2.6723, "D_return_pct": 8.59, "D_hit_rate": 57.69, "D_n": 26, "D_bh_sharpe": 3.2852, "D_bh_return_pct": 4.82, "D_psr": 0.9734, "D_ic": 0.3723, "sharpe": 0.598, "sortino": 0.6164, "return_pct": 0.79, "equity": 1007.9, "max_dd": 0.0, "win_rate": 50.0, "profit_factor": 0.0, "ic": 0.1911, "hit": 50.0, "psr": 0.5747, "bh_sharpe": 3.2852, "bh_return_pct": 4.82, "excess_sharpe": -2.6872}, {"fold": "fold_7", "regime": "Inflation bear, AI rally and 2025", "n": 65, "A_sharpe": 2.8647, "A_sortino": 3.2299, "A_excess_sharpe": 0.7858, "A_return_pct": 11.46, "A_hit_rate": 56.92, "A_n": 65, "A_bh_sharpe": 2.0789, "A_bh_return_pct": 8.17, "A_psr": 0.9305, "A_ic": 0.2346, "B_sharpe": -2.8797, "B_sortino": -2.8877, "B_excess_sharpe": -8.1111, "B_return_pct": -20.37, "B_hit_rate": 36.92, "B_n": 65, "B_bh_sharpe": 5.2314, "B_bh_return_pct": 44.53, "B_psr": 0.0768, "B_ic": 0.2167, "D_sharpe": -1.602, "D_sortino": -1.4638, "D_excess_sharpe": -3.6809, "D_return_pct": -6.39, "D_hit_rate": 47.69, "D_n": 65, "D_bh_sharpe": 2.0789, "D_bh_return_pct": 8.17, "D_psr": 0.2064, "D_ic": 0.2556, "sharpe": 2.8647, "sortino": 3.2299, "return_pct": 11.46, "equity": 1114.6000000000001, "max_dd": 0.0, "win_rate": 56.92, "profit_factor": 0.0, "ic": 0.2346, "hit": 56.92, "psr": 0.9305, "bh_sharpe": 2.0789, "bh_return_pct": 8.17, "excess_sharpe": 0.7858}], "status": "DISCARD", "precision": 0.5749, "recall": 0.443, "f1": 0.5004, "f2": 0.4643, "accuracy": 0.4761, "mcc": -0.0324, "tp": 280, "fp": 207, "tn": 228, "fn": 352, "test_sharpe": 0.5554, "A_sharpe": 0.5554, "A_excess_sharpe": -0.664, "A_return_pct": 52.7, "A_precision": 0.5749, "A_recall": 0.443, "A_f1": 0.5004, "A_f2": 0.4643, "A_accuracy": 0.4761, "A_mcc": -0.0324, "A_tp": 280, "A_fp": 207, "A_tn": 228, "A_fn": 352, "A_psr": 0.8758, "A_ic": 0.0259, "A_hit_rate": 47.46, "A_bh_sharpe": 1.2194, "A_bh_return_pct": 187.05}
