{"experiment_num": 94, "backbone": "lightgbm", "description": "LightGBM @ exp 10 max_depth=3 (down from 4) - shallow tree test", "config": {"seq_len": 60, "lr": 0.0003, "batch_size": 32, "epochs": 50, "weight_decay": 1e-05, "patience": 10, "warmup_epochs": 0, "head_dropout": 0.1, "huber_delta": 1.0, "grad_clip": 1.0, "seed": 42, "hidden_size": null, "num_layers": null, "max_depth": 3, "gbm_lr": 0.01, "n_estimators": 1000}, "composite": -0.0376, "test_pos_folds": 4, "val_pos_folds": 4, "val_loss": null, "elapsed_sec": 150.4, "timestamp": "2026-04-27T23:53:56", "sharpe": 0.4488, "val_sharpe": 0.2624, "ic": 0.0287, "hit": 47.27, "psr": 0.8248, "equity": 1379.6999999999998, "return_pct": 37.97, "bh_sharpe": 1.2194, "bh_return_pct": 187.05, "excess_sharpe": -0.7705, "B_sharpe": 0.1574, "B_excess_sharpe": -2.6708, "B_return_pct": -13.61, "D_sharpe": 0.019, "D_excess_sharpe": -1.2004, "D_return_pct": -8.51, "precision": 0.5785, "recall": 0.4082, "f1": 0.4787, "f2": 0.4338, "mcc": -0.0239, "accuracy": 0.4733, "val_precision": 0.5058, "val_recall": 0.6641, "val_f1": 0.5743, "val_f2": 0.625, "val_mcc": 0.0055, "val_accuracy": 0.5038, "per_window": [{"fold": "fold_1", "regime": "GFC peak crash (Lehman + Mar-2009 bottom)", "n": 66, "A_sharpe": -0.2958, "A_sortino": -0.3542, "A_excess_sharpe": -0.8679, "A_return_pct": -4.62, "A_hit_rate": 36.36, "A_n": 66, "A_bh_sharpe": 0.5721, "A_bh_return_pct": 3.85, "A_psr": 0.4405, "A_ic": -0.0033, "A_precision": 0.3871, "A_recall": 0.3429, "A_f1": 0.3636, "A_f2": 0.3509, "A_accuracy": 0.3636, "A_mcc": -0.27, "A_tp": 12, "A_fp": 19, "A_tn": 12, "A_fn": 23, "B_sharpe": 2.1013, "B_sortino": 2.3094, "B_excess_sharpe": 0.0544, "B_return_pct": 40.74, "B_hit_rate": 50.77, "B_n": 66, "B_bh_sharpe": 2.0469, "B_bh_return_pct": 39.28, "B_psr": 0.8567, "B_ic": 0.3381, "B_precision": 0.7, "B_recall": 0.1944, "B_f1": 0.3043, "B_f2": 0.2273, "B_accuracy": 0.5152, "B_mcc": 0.1312, "B_tp": 7, "B_fp": 3, "B_tn": 27, "B_fn": 29, "D_sharpe": 2.1633, "D_sortino": 2.4694, "D_excess_sharpe": 1.5912, "D_return_pct": 21.17, "D_hit_rate": 53.03, "D_n": 66, "D_bh_sharpe": 0.5721, "D_bh_return_pct": 3.85, "D_psr": 0.8681, "D_ic": 0.2056, "D_precision": 0.7, "D_recall": 0.2, "D_f1": 0.3111, "D_f2": 0.2333, "D_accuracy": 0.5303, "D_mcc": 0.1437, "D_tp": 7, "D_fp": 3, "D_tn": 28, "D_fn": 28, "sharpe": -0.2958, "sortino": -0.3542, "return_pct": -4.62, "equity": 953.8, "max_dd": 0.0, "win_rate": 36.36, "profit_factor": 0.0, "ic": -0.0033, "hit": 36.36, "psr": 0.4405, "bh_sharpe": 0.5721, "bh_return_pct": 3.85, "excess_sharpe": -0.8679, "precision": 0.3871, "recall": 0.3429, "f1": 0.3636, "f2": 0.3509, "mcc": -0.27, "accuracy": 0.3636, "tp": 12, "fp": 19, "tn": 12, "fn": 23}, {"fold": "fold_2", "regime": "2011 US-downgrade + EU debt", "n": 87, "A_sharpe": 1.5333, "A_sortino": 1.8989, "A_excess_sharpe": -3.4887, "A_return_pct": 8.2, "A_hit_rate": 51.16, "A_n": 87, "A_bh_sharpe": 5.022, "A_bh_return_pct": 29.23, "A_psr": 0.8266, "A_ic": 0.0716, "A_precision": 0.6071, "A_recall": 0.6296, "A_f1": 0.6182, "A_f2": 0.625, "A_accuracy": 0.5172, "A_mcc": -0.0375, "A_tp": 34, "A_fp": 22, "A_tn": 11, "A_fn": 20, "B_sharpe": 7.8489, "B_sortino": 8.3618, "B_excess_sharpe": -3.2881, "B_return_pct": 123.63, "B_hit_rate": 72.41, "B_n": 87, "B_bh_sharpe": 11.1369, "B_bh_return_pct": 185.4, "B_psr": 1.0, "B_ic": 0.1454, "B_precision": 0.8472, "B_recall": 0.8243, "B_f1": 0.8356, "B_f2": 0.8288, "B_accuracy": 0.7241, "B_mcc": -0.0206, "B_tp": 61, "B_fp": 11, "B_tn": 2, "B_fn": 13, "D_sharpe": 3.9522, "D_sortino": 5.0347, "D_excess_sharpe": -1.0698, "D_return_pct": 22.7, "D_hit_rate": 59.3, "D_n": 87, "D_bh_sharpe": 5.022, "D_bh_return_pct": 29.23, "D_psr": 0.9949, "D_ic": 0.095, "D_precision": 0.625, "D_recall": 0.8333, "D_f1": 0.7143, "D_f2": 0.7812, "D_accuracy": 0.5862, "D_mcc": 0.0195, "D_tp": 45, "D_fp": 27, "D_tn": 6, "D_fn": 9, "sharpe": 1.5333, "sortino": 1.8989, "return_pct": 8.2, "equity": 1082.0, "max_dd": 0.0, "win_rate": 51.16, "profit_factor": 0.0, "ic": 0.0716, "hit": 51.16, "psr": 0.8266, "bh_sharpe": 5.022, "bh_return_pct": 29.23, "excess_sharpe": -3.4887, "precision": 0.6071, "recall": 0.6296, "f1": 0.6182, "f2": 0.625, "mcc": -0.0375, "accuracy": 0.5172, "tp": 34, "fp": 22, "tn": 11, "fn": 20}, {"fold": "fold_3", "regime": "Taper tantrum and 2014 H1", "n": 129, "A_sharpe": -0.0674, "A_sortino": -0.0657, "A_excess_sharpe": -1.8352, "A_return_pct": -0.86, "A_hit_rate": 48.44, "A_n": 129, "A_bh_sharpe": 1.7678, "A_bh_return_pct": 11.76, "A_psr": 0.4808, "A_ic": 0.0002, "A_precision": 0.5696, "A_recall": 0.5769, "A_f1": 0.5732, "A_f2": 0.5754, "A_accuracy": 0.4806, "A_mcc": -0.0901, "A_tp": 45, "A_fp": 34, "A_tn": 17, "A_fn": 33, "B_sharpe": 2.7693, "B_sortino": 2.8033, "B_excess_sharpe": -1.478, "B_return_pct": 38.3, "B_hit_rate": 58.91, "B_n": 129, "B_bh_sharpe": 4.2474, "B_bh_return_pct": 64.1, "B_psr": 0.974, "B_ic": -0.0229, "B_precision": 0.6436, "B_recall": 0.7927, "B_f1": 0.7104, "B_f2": 0.7576, "B_accuracy": 0.5891, "B_mcc": 0.0312, "B_tp": 65, "B_fp": 36, "B_tn": 11, "B_fn": 17, "D_sharpe": 1.4784, "D_sortino": 1.4009, "D_excess_sharpe": -0.2894, "D_return_pct": 9.69, "D_hit_rate": 55.47, "D_n": 129, "D_bh_sharpe": 1.7678, "D_bh_return_pct": 11.76, "D_psr": 0.8472, "D_ic": 0.0625, "D_precision": 0.604, "D_recall": 0.7821, "D_f1": 0.6816, "D_f2": 0.7385, "D_accuracy": 0.5581, "D_mcc": -0.0027, "D_tp": 61, "D_fp": 40, "D_tn": 11, "D_fn": 17, "sharpe": -0.0674, "sortino": -0.0657, "return_pct": -0.86, "equity": 991.4, "max_dd": 0.0, "win_rate": 48.44, "profit_factor": 0.0, "ic": 0.0002, "hit": 48.44, "psr": 0.4808, "bh_sharpe": 1.7678, "bh_return_pct": 11.76, "excess_sharpe": -1.8352, "precision": 0.5696, "recall": 0.5769, "f1": 0.5732, "f2": 0.5754, "mcc": -0.0901, "accuracy": 0.4806, "tp": 45, "fp": 34, "tn": 17, "fn": 33}, {"fold": "fold_4", "regime": "China devaluation and oil crash", "n": 108, "A_sharpe": 0.3447, "A_sortino": 0.3258, "A_excess_sharpe": 1.0345, "A_return_pct": 2.14, "A_hit_rate": 52.34, "A_n": 108, "A_bh_sharpe": -0.6898, "A_bh_return_pct": -6.71, "A_psr": 0.5885, "A_ic": 0.0024, "A_precision": 0.5161, "A_recall": 0.6038, "A_f1": 0.5565, "A_f2": 0.5839, "A_accuracy": 0.5278, "A_mcc": 0.059, "A_tp": 32, "A_fp": 30, "A_tn": 25, "A_fn": 21, "B_sharpe": -3.4993, "B_sortino": -3.1263, "B_excess_sharpe": -1.5418, "B_return_pct": -49.69, "B_hit_rate": 40.74, "B_n": 108, "B_bh_sharpe": -1.9575, "B_bh_return_pct": -33.56, "B_psr": 0.0091, "B_ic": -0.1565, "B_precision": 0.386, "B_recall": 0.4314, "B_f1": 0.4074, "B_f2": 0.4215, "B_accuracy": 0.4074, "B_mcc": -0.1827, "B_tp": 22, "B_fp": 35, "B_tn": 22, "B_fn": 29, "D_sharpe": -1.8511, "D_sortino": -1.6651, "D_excess_sharpe": -1.1613, "D_return_pct": -15.65, "D_hit_rate": 46.73, "D_n": 108, "D_bh_sharpe": -0.6898, "D_bh_return_pct": -6.71, "D_psr": 0.1087, "D_ic": -0.057, "D_precision": 0.4561, "D_recall": 0.4906, "D_f1": 0.4727, "D_f2": 0.4833, "D_accuracy": 0.463, "D_mcc": -0.0732, "D_tp": 26, "D_fp": 31, "D_tn": 24, "D_fn": 27, "sharpe": 0.3447, "sortino": 0.3258, "return_pct": 2.14, "equity": 1021.4000000000001, "max_dd": 0.0, "win_rate": 52.34, "profit_factor": 0.0, "ic": 0.0024, "hit": 52.34, "psr": 0.5885, "bh_sharpe": -0.6898, "bh_return_pct": -6.71, "excess_sharpe": 1.0345, "precision": 0.5161, "recall": 0.6038, "f1": 0.5565, "f2": 0.5839, "mcc": 0.059, "accuracy": 0.5278, "tp": 32, "fp": 30, "tn": 25, "fn": 21}, {"fold": "fold_5", "regime": "2018 Vol-mageddon + Q4 sell-off", "n": 128, "A_sharpe": 1.1443, "A_sortino": 1.4047, "A_excess_sharpe": -0.0068, "A_return_pct": 13.1, "A_hit_rate": 46.88, "A_n": 128, "A_bh_sharpe": 1.1511, "A_bh_return_pct": 13.19, "A_psr": 0.7976, "A_ic": -0.0006, "A_precision": 0.5926, "A_recall": 0.4103, "A_f1": 0.4848, "A_f2": 0.4372, "A_accuracy": 0.4688, "A_mcc": -0.0294, "A_tp": 32, "A_fp": 22, "A_tn": 28, "A_fn": 46, "B_sharpe": -2.8945, "B_sortino": -2.7343, "B_excess_sharpe": -5.7064, "B_return_pct": -51.83, "B_hit_rate": 40.16, "B_n": 128, "B_bh_sharpe": 2.8119, "B_bh_return_pct": 82.25, "B_psr": 0.019, "B_ic": -0.1019, "B_precision": 0.5738, "B_recall": 0.4118, "B_f1": 0.4795, "B_f2": 0.4364, "B_accuracy": 0.4062, "B_mcc": -0.1824, "B_tp": 35, "B_fp": 26, "B_tn": 17, "B_fn": 50, "D_sharpe": -0.9537, "D_sortino": -1.0675, "D_excess_sharpe": -2.1048, "D_return_pct": -12.07, "D_hit_rate": 41.41, "D_n": 128, "D_bh_sharpe": 1.1511, "D_bh_return_pct": 13.19, "D_psr": 0.2536, "D_ic": -0.0721, "D_precision": 0.5246, "D_recall": 0.4103, "D_f1": 0.4604, "D_f2": 0.429, "D_accuracy": 0.4141, "D_mcc": -0.1658, "D_tp": 32, "D_fp": 29, "D_tn": 21, "D_fn": 46, "sharpe": 1.1443, "sortino": 1.4047, "return_pct": 13.1, "equity": 1131.0, "max_dd": 0.0, "win_rate": 46.88, "profit_factor": 0.0, "ic": -0.0006, "hit": 46.88, "psr": 0.7976, "bh_sharpe": 1.1511, "bh_return_pct": 13.19, "excess_sharpe": -0.0068, "precision": 0.5926, "recall": 0.4103, "f1": 0.4848, "f2": 0.4372, "mcc": -0.0294, "accuracy": 0.4688, "tp": 32, "fp": 22, "tn": 28, "fn": 46}, {"fold": "fold_6", "regime": "COVID crash and V-recovery", "n": 173, "A_sharpe": -0.0217, "A_sortino": -0.023, "A_excess_sharpe": -2.3478, "A_return_pct": -2.35, "A_hit_rate": 47.4, "A_n": 173, "A_bh_sharpe": 2.3261, "A_bh_return_pct": 43.81, "A_psr": 0.4928, "A_ic": 0.0558, "A_precision": 0.6486, "A_recall": 0.4248, "A_f1": 0.5134, "A_f2": 0.4563, "A_accuracy": 0.474, "A_mcc": -0.0082, "A_tp": 48, "A_fp": 26, "A_tn": 34, "A_fn": 65, "B_sharpe": 0.6181, "B_sortino": 0.7007, "B_excess_sharpe": -5.1279, "B_return_pct": 13.62, "B_hit_rate": 48.26, "B_n": 173, "B_bh_sharpe": 5.746, "B_bh_return_pct": 499.04, "B_psr": 0.697, "B_ic": 0.086, "B_precision": 0.6719, "B_recall": 0.3874, "B_f1": 0.4914, "B_f2": 0.4232, "B_accuracy": 0.4855, "B_mcc": 0.0483, "B_tp": 43, "B_fp": 21, "B_tn": 41, "B_fn": 68, "D_sharpe": -0.4229, "D_sortino": -0.4921, "D_excess_sharpe": -2.749, "D_return_pct": -8.66, "D_hit_rate": 41.62, "D_n": 173, "D_bh_sharpe": 2.3261, "D_bh_return_pct": 43.81, "D_psr": 0.3644, "D_ic": -0.0035, "D_precision": 0.5938, "D_recall": 0.3363, "D_f1": 0.4294, "D_f2": 0.3682, "D_accuracy": 0.4162, "D_mcc": -0.0957, "D_tp": 38, "D_fp": 26, "D_tn": 34, "D_fn": 75, "sharpe": -0.0217, "sortino": -0.023, "return_pct": -2.35, "equity": 976.5, "max_dd": 0.0, "win_rate": 47.4, "profit_factor": 0.0, "ic": 0.0558, "hit": 47.4, "psr": 0.4928, "bh_sharpe": 2.3261, "bh_return_pct": 43.81, "excess_sharpe": -2.3478, "precision": 0.6486, "recall": 0.4248, "f1": 0.5134, "f2": 0.4563, "mcc": -0.0082, "accuracy": 0.474, "tp": 48, "fp": 26, "tn": 34, "fn": 65}, {"fold": "fold_7", "regime": "Inflation bear, AI rally and 2025", "n": 376, "A_sharpe": 0.6437, "A_sortino": 0.8095, "A_excess_sharpe": -0.1596, "A_return_pct": 19.53, "A_hit_rate": 46.54, "A_n": 376, "A_bh_sharpe": 0.8033, "A_bh_return_pct": 26.02, "A_psr": 0.7919, "A_ic": 0.0722, "A_precision": 0.6111, "A_recall": 0.2489, "A_f1": 0.3537, "A_f2": 0.2823, "A_accuracy": 0.4654, "A_mcc": 0.0266, "A_tp": 55, "A_fp": 35, "A_tn": 120, "A_fn": 166, "B_sharpe": -0.2408, "B_sortino": -0.2733, "B_excess_sharpe": -2.1725, "B_return_pct": -27.92, "B_hit_rate": 43.47, "B_n": 376, "B_bh_sharpe": 1.9317, "B_bh_return_pct": 222.05, "B_psr": 0.385, "B_ic": -0.0465, "B_precision": 0.6531, "B_recall": 0.141, "B_f1": 0.2319, "B_f2": 0.1672, "B_accuracy": 0.4362, "B_mcc": 0.039, "B_tp": 32, "B_fp": 17, "B_tn": 132, "B_fn": 195, "D_sharpe": -0.4524, "D_sortino": -0.5513, "D_excess_sharpe": -1.2557, "D_return_pct": -17.19, "D_hit_rate": 41.49, "D_n": 376, "D_bh_sharpe": 0.8033, "D_bh_return_pct": 26.02, "D_psr": 0.2949, "D_ic": -0.0452, "D_precision": 0.5102, "D_recall": 0.1131, "D_f1": 0.1852, "D_f2": 0.134, "D_accuracy": 0.4149, "D_mcc": -0.061, "D_tp": 25, "D_fp": 24, "D_tn": 131, "D_fn": 196, "sharpe": 0.6437, "sortino": 0.8095, "return_pct": 19.53, "equity": 1195.3, "max_dd": 0.0, "win_rate": 46.54, "profit_factor": 0.0, "ic": 0.0722, "hit": 46.54, "psr": 0.7919, "bh_sharpe": 0.8033, "bh_return_pct": 26.02, "excess_sharpe": -0.1596, "precision": 0.6111, "recall": 0.2489, "f1": 0.3537, "f2": 0.2823, "mcc": 0.0266, "accuracy": 0.4654, "tp": 55, "fp": 35, "tn": 120, "fn": 166}], "per_window_val": [{"fold": "fold_1", "regime": "GFC peak crash (Lehman + Mar-2009 bottom)", "n": 65, "A_sharpe": 1.107, "A_sortino": 1.371, "A_excess_sharpe": 3.3327, "A_return_pct": 8.53, "A_hit_rate": 47.62, "A_n": 65, "A_bh_sharpe": -2.2257, "A_bh_return_pct": -18.74, "A_psr": 0.7183, "A_ic": -0.0044, "A_precision": 0.4545, "A_recall": 0.8621, "A_f1": 0.5952, "A_f2": 0.731, "A_accuracy": 0.4769, "A_mcc": 0.0396, "A_tp": 25, "A_fp": 30, "A_tn": 6, "A_fn": 4, "B_sharpe": -4.8065, "B_sortino": -4.0599, "B_excess_sharpe": 2.3158, "B_return_pct": -61.34, "B_hit_rate": 40.0, "B_n": 65, "B_bh_sharpe": -7.1223, "B_bh_return_pct": -73.11, "B_psr": 0.0051, "B_ic": 0.2215, "B_precision": 0.371, "B_recall": 1.0, "B_f1": 0.5412, "B_f2": 0.7468, "B_accuracy": 0.4, "B_mcc": 0.1628, "B_tp": 23, "B_fp": 39, "B_tn": 3, "B_fn": 0, "D_sharpe": -1.1614, "D_sortino": -0.9741, "D_excess_sharpe": 1.0642, "D_return_pct": -10.97, "D_hit_rate": 50.79, "D_n": 65, "D_bh_sharpe": -2.2257, "D_bh_return_pct": -18.74, "D_psr": 0.2717, "D_ic": 0.3641, "D_precision": 0.4677, "D_recall": 1.0, "D_f1": 0.6374, "D_f2": 0.8146, "D_accuracy": 0.4923, "D_mcc": 0.1974, "D_tp": 29, "D_fp": 33, "D_tn": 3, "D_fn": 0, "sharpe": 1.107, "sortino": 1.371, "return_pct": 8.53, "equity": 1085.3, "max_dd": 0.0, "win_rate": 47.62, "profit_factor": 0.0, "ic": -0.0044, "hit": 47.62, "psr": 0.7183, "bh_sharpe": -2.2257, "bh_return_pct": -18.74, "excess_sharpe": 3.3327, "precision": 0.4545, "recall": 0.8621, "f1": 0.5952, "f2": 0.731, "mcc": 0.0396, "accuracy": 0.4769, "tp": 25, "fp": 30, "tn": 6, "fn": 4}, {"fold": "fold_2", "regime": "2011 US-downgrade + EU debt", "n": 47, "A_sharpe": -0.3826, "A_sortino": -0.3523, "A_excess_sharpe": -0.1885, "A_return_pct": -3.55, "A_hit_rate": 51.06, "A_n": 47, "A_bh_sharpe": -0.1941, "A_bh_return_pct": -2.36, "A_psr": 0.4347, "A_ic": -0.0572, "A_precision": 0.5429, "A_recall": 0.7308, "A_f1": 0.623, "A_f2": 0.6835, "A_accuracy": 0.5106, "A_mcc": -0.0355, "A_tp": 19, "A_fp": 16, "A_tn": 5, "A_fn": 7, "B_sharpe": 0.7744, "B_sortino": 0.6755, "B_excess_sharpe": 2.3867, "B_return_pct": 5.62, "B_hit_rate": 57.45, "B_n": 47, "B_bh_sharpe": -1.6123, "B_bh_return_pct": -24.3, "B_psr": 0.6276, "B_ic": 0.2469, "B_precision": 0.5122, "B_recall": 1.0, "B_f1": 0.6774, "B_f2": 0.84, "B_accuracy": 0.5745, "B_mcc": 0.3438, "B_tp": 21, "B_fp": 20, "B_tn": 6, "B_fn": 0, "D_sharpe": -0.0371, "D_sortino": -0.0325, "D_excess_sharpe": 0.157, "D_return_pct": -1.37, "D_hit_rate": 55.32, "D_n": 47, "D_bh_sharpe": -0.1941, "D_bh_return_pct": -2.36, "D_psr": 0.4937, "D_ic": -0.0338, "D_precision": 0.561, "D_recall": 0.8846, "D_f1": 0.6866, "D_f2": 0.7931, "D_accuracy": 0.5532, "D_mcc": 0.0409, "D_tp": 23, "D_fp": 18, "D_tn": 3, "D_fn": 3, "sharpe": -0.3826, "sortino": -0.3523, "return_pct": -3.55, "equity": 964.5, "max_dd": 0.0, "win_rate": 51.06, "profit_factor": 0.0, "ic": -0.0572, "hit": 51.06, "psr": 0.4347, "bh_sharpe": -0.1941, "bh_return_pct": -2.36, "excess_sharpe": -0.1885, "precision": 0.5429, "recall": 0.7308, "f1": 0.623, "f2": 0.6835, "mcc": -0.0355, "accuracy": 0.5106, "tp": 19, "fp": 16, "tn": 5, "fn": 7}, {"fold": "fold_3", "regime": "Taper tantrum and 2014 H1", "n": 5, "A_sharpe": 3.7421, "A_sortino": 3.8425, "A_excess_sharpe": 5.0616, "A_return_pct": 0.57, "A_hit_rate": 60.0, "A_n": 5, "A_bh_sharpe": -1.3194, "A_bh_return_pct": -0.21, "A_psr": 0.6797, "A_ic": 0.4, "A_precision": 0.5, "A_recall": 0.5, "A_f1": 0.5, "A_f2": 0.5, "A_accuracy": 0.6, "A_mcc": 0.1667, "A_tp": 1, "A_fp": 1, "A_tn": 2, "A_fn": 1, "B_sharpe": 9.8721, "B_sortino": 10.3422, "B_excess_sharpe": 35.7427, "B_return_pct": 0.0, "B_hit_rate": 0.0, "B_n": 5, "B_bh_sharpe": -25.8705, "B_bh_return_pct": -3.84, "B_psr": 0.8993, "B_ic": -0.3, "B_precision": 0.0, "B_recall": 0.0, "B_f1": 0.0, "B_f2": 0.0, "B_accuracy": 0.8, "B_mcc": 0.0, "B_tp": 0, "B_fp": 1, "B_tn": 4, "B_fn": 0, "D_sharpe": -10.4634, "D_sortino": -7.0126, "D_excess_sharpe": -9.144, "D_return_pct": -1.37, "D_hit_rate": 40.0, "D_n": 5, "D_bh_sharpe": -1.3194, "D_bh_return_pct": -0.21, "D_psr": 0.0711, "D_ic": -0.7, "D_precision": 0.0, "D_recall": 0.0, "D_f1": 0.0, "D_f2": 0.0, "D_accuracy": 0.4, "D_mcc": -0.4082, "D_tp": 0, "D_fp": 1, "D_tn": 2, "D_fn": 2, "sharpe": 3.7421, "sortino": 3.8425, "return_pct": 0.57, "equity": 1005.7, "max_dd": 0.0, "win_rate": 60.0, "profit_factor": 0.0, "ic": 0.4, "hit": 60.0, "psr": 0.6797, "bh_sharpe": -1.3194, "bh_return_pct": -0.21, "excess_sharpe": 5.0616, "precision": 0.5, "recall": 0.5, "f1": 0.5, "f2": 0.5, "mcc": 0.1667, "accuracy": 0.6, "tp": 1, "fp": 1, "tn": 2, "fn": 1}, {"fold": "fold_4", "regime": "China devaluation and oil crash", "n": 47, "A_sharpe": -1.9621, "A_sortino": -1.8752, "A_excess_sharpe": -0.1383, "A_return_pct": -9.26, "A_hit_rate": 42.55, "A_n": 47, "A_bh_sharpe": -1.8238, "A_bh_return_pct": -8.68, "A_psr": 0.2007, "A_ic": 0.0064, "A_precision": 0.4318, "A_recall": 0.9048, "A_f1": 0.5846, "A_f2": 0.7422, "A_accuracy": 0.4255, "A_mcc": -0.1155, "A_tp": 19, "A_fp": 25, "A_tn": 1, "A_fn": 2, "B_sharpe": -1.8052, "B_sortino": -1.5322, "B_excess_sharpe": 0.4148, "B_return_pct": -20.54, "B_hit_rate": 46.81, "B_n": 47, "B_bh_sharpe": -2.22, "B_bh_return_pct": -23.98, "B_psr": 0.2033, "B_ic": 0.5312, "B_precision": 0.4565, "B_recall": 1.0, "B_f1": 0.6269, "B_f2": 0.8077, "B_accuracy": 0.4681, "B_mcc": 0.1325, "B_tp": 21, "B_fp": 25, "B_tn": 1, "B_fn": 0, "D_sharpe": -1.9733, "D_sortino": -1.8877, "D_excess_sharpe": -0.1495, "D_return_pct": -9.3, "D_hit_rate": 42.55, "D_n": 47, "D_bh_sharpe": -1.8238, "D_bh_return_pct": -8.68, "D_psr": 0.1994, "D_ic": 0.1393, "D_precision": 0.4348, "D_recall": 0.9524, "D_f1": 0.597, "D_f2": 0.7692, "D_accuracy": 0.4255, "D_mcc": -0.1641, "D_tp": 20, "D_fp": 26, "D_tn": 0, "D_fn": 1, "sharpe": -1.9621, "sortino": -1.8752, "return_pct": -9.26, "equity": 907.4, "max_dd": 0.0, "win_rate": 42.55, "profit_factor": 0.0, "ic": 0.0064, "hit": 42.55, "psr": 0.2007, "bh_sharpe": -1.8238, "bh_return_pct": -8.68, "excess_sharpe": -0.1383, "precision": 0.4318, "recall": 0.9048, "f1": 0.5846, "f2": 0.7422, "mcc": -0.1155, "accuracy": 0.4255, "tp": 19, "fp": 25, "tn": 1, "fn": 2}, {"fold": "fold_5", "regime": "2018 Vol-mageddon + Q4 sell-off", "n": 5, "A_sharpe": -10.1368, "A_sortino": -6.9937, "A_excess_sharpe": 0.0, "A_return_pct": -3.15, "A_hit_rate": 40.0, "A_n": 5, "A_bh_sharpe": -10.1368, "A_bh_return_pct": -3.15, "A_psr": 0.0985, "A_ic": 0.5, "A_precision": 0.4, "A_recall": 1.0, "A_f1": 0.5714, "A_f2": 0.7692, "A_accuracy": 0.4, "A_mcc": 0.0, "A_tp": 2, "A_fp": 3, "A_tn": 0, "A_fn": 0, "B_sharpe": 5.6858, "B_sortino": 6.0578, "B_excess_sharpe": 0.0, "B_return_pct": 4.22, "B_hit_rate": 60.0, "B_n": 5, "B_bh_sharpe": 5.6858, "B_bh_return_pct": 4.22, "B_psr": 0.753, "B_ic": 0.9, "B_precision": 0.6, "B_recall": 1.0, "B_f1": 0.75, "B_f2": 0.8824, "B_accuracy": 0.6, "B_mcc": 0.0, "B_tp": 3, "B_fp": 2, "B_tn": 0, "B_fn": 0, "D_sharpe": -10.1368, "D_sortino": -6.9937, "D_excess_sharpe": 0.0, "D_return_pct": -3.15, "D_hit_rate": 40.0, "D_n": 5, "D_bh_sharpe": -10.1368, "D_bh_return_pct": -3.15, "D_psr": 0.0985, "D_ic": 0.7, "D_precision": 0.4, "D_recall": 1.0, "D_f1": 0.5714, "D_f2": 0.7692, "D_accuracy": 0.4, "D_mcc": 0.0, "D_tp": 2, "D_fp": 3, "D_tn": 0, "D_fn": 0, "sharpe": -10.1368, "sortino": -6.9937, "return_pct": -3.15, "equity": 968.5, "max_dd": 0.0, "win_rate": 40.0, "profit_factor": 0.0, "ic": 0.5, "hit": 40.0, "psr": 0.0985, "bh_sharpe": -10.1368, "bh_return_pct": -3.15, "excess_sharpe": 0.0, "precision": 0.4, "recall": 1.0, "f1": 0.5714, "f2": 0.7692, "mcc": 0.0, "accuracy": 0.4, "tp": 2, "fp": 3, "tn": 0, "fn": 0}, {"fold": "fold_6", "regime": "COVID crash and V-recovery", "n": 26, "A_sharpe": 5.4027, "A_sortino": 5.5779, "A_excess_sharpe": 2.1176, "A_return_pct": 7.84, "A_hit_rate": 65.38, "A_n": 26, "A_bh_sharpe": 3.2852, "A_bh_return_pct": 4.82, "A_psr": 0.9494, "A_ic": 0.0325, "A_precision": 0.6842, "A_recall": 0.8125, "A_f1": 0.7429, "A_f2": 0.7831, "A_accuracy": 0.6538, "A_mcc": 0.2331, "A_tp": 13, "A_fp": 6, "A_tn": 4, "A_fn": 3, "B_sharpe": 4.762, "B_sortino": 4.2141, "B_excess_sharpe": -8.2172, "B_return_pct": 15.7, "B_hit_rate": 69.23, "B_n": 26, "B_bh_sharpe": 12.9792, "B_bh_return_pct": 38.76, "B_psr": 0.9218, "B_ic": 0.3258, "B_precision": 1.0, "B_recall": 0.619, "B_f1": 0.7647, "B_f2": 0.6701, "B_accuracy": 0.6923, "B_mcc": 0.488, "B_tp": 13, "B_fp": 0, "B_tn": 5, "B_fn": 8, "D_sharpe": 4.5323, "D_sortino": 6.3276, "D_excess_sharpe": 1.2471, "D_return_pct": 6.63, "D_hit_rate": 50.0, "D_n": 26, "D_bh_sharpe": 3.2852, "D_bh_return_pct": 4.82, "D_psr": 0.9313, "D_ic": 0.1918, "D_precision": 0.6154, "D_recall": 0.5, "D_f1": 0.5517, "D_f2": 0.5195, "D_accuracy": 0.5, "D_mcc": 0.0, "D_tp": 8, "D_fp": 5, "D_tn": 5, "D_fn": 8, "sharpe": 5.4027, "sortino": 5.5779, "return_pct": 7.84, "equity": 1078.4, "max_dd": 0.0, "win_rate": 65.38, "profit_factor": 0.0, "ic": 0.0325, "hit": 65.38, "psr": 0.9494, "bh_sharpe": 3.2852, "bh_return_pct": 4.82, "excess_sharpe": 2.1176, "precision": 0.6842, "recall": 0.8125, "f1": 0.7429, "f2": 0.7831, "mcc": 0.2331, "accuracy": 0.6538, "tp": 13, "fp": 6, "tn": 4, "fn": 3}, {"fold": "fold_7", "regime": "Inflation bear, AI rally and 2025", "n": 65, "A_sharpe": 1.0356, "A_sortino": 1.1367, "A_excess_sharpe": -1.0433, "A_return_pct": 3.86, "A_hit_rate": 52.31, "A_n": 65, "A_bh_sharpe": 2.0789, "A_bh_return_pct": 8.17, "A_psr": 0.7017, "A_ic": 0.1793, "A_precision": 0.6667, "A_recall": 0.2286, "A_f1": 0.3404, "A_f2": 0.2632, "A_accuracy": 0.5231, "A_mcc": 0.1224, "A_tp": 8, "A_fp": 4, "A_tn": 26, "A_fn": 27, "B_sharpe": -2.3395, "B_sortino": -2.3246, "B_excess_sharpe": -7.5709, "B_return_pct": -17.15, "B_hit_rate": 40.0, "B_n": 65, "B_bh_sharpe": 5.2314, "B_bh_return_pct": 44.53, "B_psr": 0.1212, "B_ic": 0.1147, "B_precision": 1.0, "B_recall": 0.1136, "