{"experiment_num": 95, "backbone": "lightgbm", "description": "LightGBM @ exp 10 n_est=1500 (between 1000 and 2000) - capacity refinement", "config": {"seq_len": 60, "lr": 0.0003, "batch_size": 32, "epochs": 50, "weight_decay": 1e-05, "patience": 10, "warmup_epochs": 0, "head_dropout": 0.1, "huber_delta": 1.0, "grad_clip": 1.0, "seed": 42, "hidden_size": null, "num_layers": null, "max_depth": 4, "gbm_lr": 0.01, "n_estimators": 1500}, "composite": 0.6105, "test_pos_folds": 6, "val_pos_folds": 4, "val_loss": null, "elapsed_sec": 339.2, "timestamp": "2026-04-28T00:00:06", "sharpe": 0.9812, "val_sharpe": 0.7105, "ic": 0.0382, "hit": 49.44, "psr": 0.9801, "equity": 2291.1000000000004, "return_pct": 129.11, "bh_sharpe": 1.2194, "bh_return_pct": 187.05, "excess_sharpe": -0.2382, "B_sharpe": -0.2075, "B_excess_sharpe": -3.0357, "B_return_pct": -57.87, "D_sharpe": -0.0662, "D_excess_sharpe": -1.2855, "D_return_pct": -15.67, "precision": 0.604, "recall": 0.4272, "f1": 0.5005, "f2": 0.4538, "mcc": 0.0202, "accuracy": 0.4948, "val_precision": 0.5116, "val_recall": 0.6718, "val_f1": 0.5809, "val_f2": 0.6322, "val_mcc": 0.0218, "val_accuracy": 0.5115, "per_window": [{"fold": "fold_1", "regime": "GFC peak crash (Lehman + Mar-2009 bottom)", "n": 66, "A_sharpe": 1.184, "A_sortino": 1.3997, "A_excess_sharpe": 0.6119, "A_return_pct": 10.25, "A_hit_rate": 43.94, "A_n": 66, "A_bh_sharpe": 0.5721, "A_bh_return_pct": 3.85, "A_psr": 0.7276, "A_ic": 0.026, "A_precision": 0.4688, "A_recall": 0.4286, "A_f1": 0.4478, "A_f2": 0.436, "A_accuracy": 0.4394, "A_mcc": -0.1197, "A_tp": 15, "A_fp": 17, "A_tn": 14, "A_fn": 20, "B_sharpe": 2.697, "B_sortino": 3.0584, "B_excess_sharpe": 0.6501, "B_return_pct": 58.04, "B_hit_rate": 52.31, "B_n": 66, "B_bh_sharpe": 2.0469, "B_bh_return_pct": 39.28, "B_psr": 0.9155, "B_ic": 0.3298, "B_precision": 0.6667, "B_recall": 0.2778, "B_f1": 0.3922, "B_f2": 0.3145, "B_accuracy": 0.5303, "B_mcc": 0.132, "B_tp": 10, "B_fp": 5, "B_tn": 25, "B_fn": 26, "D_sharpe": 1.2516, "D_sortino": 1.3836, "D_excess_sharpe": 0.6795, "D_return_pct": 10.97, "D_hit_rate": 48.48, "D_n": 66, "D_bh_sharpe": 0.5721, "D_bh_return_pct": 3.85, "D_psr": 0.738, "D_ic": 0.1724, "D_precision": 0.5333, "D_recall": 0.2286, "D_f1": 0.32, "D_f2": 0.2581, "D_accuracy": 0.4848, "D_mcc": 0.0033, "D_tp": 8, "D_fp": 7, "D_tn": 24, "D_fn": 27, "sharpe": 1.184, "sortino": 1.3997, "return_pct": 10.25, "equity": 1102.5, "max_dd": 0.0, "win_rate": 43.94, "profit_factor": 0.0, "ic": 0.026, "hit": 43.94, "psr": 0.7276, "bh_sharpe": 0.5721, "bh_return_pct": 3.85, "excess_sharpe": 0.6119, "precision": 0.4688, "recall": 0.4286, "f1": 0.4478, "f2": 0.436, "mcc": -0.1197, "accuracy": 0.4394, "tp": 15, "fp": 17, "tn": 14, "fn": 20}, {"fold": "fold_2", "regime": "2011 US-downgrade + EU debt", "n": 87, "A_sharpe": 2.6036, "A_sortino": 3.4697, "A_excess_sharpe": -2.4184, "A_return_pct": 14.52, "A_hit_rate": 51.16, "A_n": 87, "A_bh_sharpe": 5.022, "A_bh_return_pct": 29.23, "A_psr": 0.9506, "A_ic": 0.0181, "A_precision": 0.6034, "A_recall": 0.6481, "A_f1": 0.625, "A_f2": 0.6387, "A_accuracy": 0.5172, "A_mcc": -0.0503, "A_tp": 35, "A_fp": 23, "A_tn": 10, "A_fn": 19, "B_sharpe": 5.1885, "B_sortino": 5.9958, "B_excess_sharpe": -5.9484, "B_return_pct": 74.76, "B_hit_rate": 62.07, "B_n": 87, "B_bh_sharpe": 11.1369, "B_bh_return_pct": 185.4, "B_psr": 0.999, "B_ic": 0.1984, "B_precision": 0.8596, "B_recall": 0.6622, "B_f1": 0.7481, "B_f2": 0.6941, "B_accuracy": 0.6207, "B_mcc": 0.0351, "B_tp": 49, "B_fp": 8, "B_tn": 5, "B_fn": 25, "D_sharpe": 1.9598, "D_sortino": 2.238, "D_excess_sharpe": -3.0622, "D_return_pct": 10.7, "D_hit_rate": 55.81, "D_n": 87, "D_bh_sharpe": 5.022, "D_bh_return_pct": 29.23, "D_psr": 0.8858, "D_ic": 0.0963, "D_precision": 0.6316, "D_recall": 0.6667, "D_f1": 0.6486, "D_f2": 0.6593, "D_accuracy": 0.5517, "D_mcc": 0.0309, "D_tp": 36, "D_fp": 21, "D_tn": 12, "D_fn": 18, "sharpe": 2.6036, "sortino": 3.4697, "return_pct": 14.52, "equity": 1145.2, "max_dd": 0.0, "win_rate": 51.16, "profit_factor": 0.0, "ic": 0.0181, "hit": 51.16, "psr": 0.9506, "bh_sharpe": 5.022, "bh_return_pct": 29.23, "excess_sharpe": -2.4184, "precision": 0.6034, "recall": 0.6481, "f1": 0.625, "f2": 0.6387, "mcc": -0.0503, "accuracy": 0.5172, "tp": 35, "fp": 23, "tn": 10, "fn": 19}, {"fold": "fold_3", "regime": "Taper tantrum and 2014 H1", "n": 129, "A_sharpe": 0.8235, "A_sortino": 0.9026, "A_excess_sharpe": -0.9443, "A_return_pct": 5.11, "A_hit_rate": 46.88, "A_n": 129, "A_bh_sharpe": 1.7678, "A_bh_return_pct": 11.76, "A_psr": 0.7215, "A_ic": 0.0627, "A_precision": 0.5634, "A_recall": 0.5128, "A_f1": 0.5369, "A_f2": 0.5222, "A_accuracy": 0.4651, "A_mcc": -0.0934, "A_tp": 40, "A_fp": 31, "A_tn": 20, "A_fn": 38, "B_sharpe": 2.3622, "B_sortino": 2.3971, "B_excess_sharpe": -1.8851, "B_return_pct": 31.72, "B_hit_rate": 57.36, "B_n": 129, "B_bh_sharpe": 4.2474, "B_bh_return_pct": 64.1, "B_psr": 0.9518, "B_ic": 0.0034, "B_precision": 0.6484, "B_recall": 0.7195, "B_f1": 0.6821, "B_f2": 0.7041, "B_accuracy": 0.5736, "B_mcc": 0.0408, "B_tp": 59, "B_fp": 32, "B_tn": 15, "B_fn": 23, "D_sharpe": 1.579, "D_sortino": 1.4842, "D_excess_sharpe": -0.1888, "D_return_pct": 10.41, "D_hit_rate": 57.03, "D_n": 129, "D_bh_sharpe": 1.7678, "D_bh_return_pct": 11.76, "D_psr": 0.8629, "D_ic": 0.1024, "D_precision": 0.6264, "D_recall": 0.7308, "D_f1": 0.6746, "D_f2": 0.7072, "D_accuracy": 0.5736, "D_mcc": 0.0688, "D_tp": 57, "D_fp": 34, "D_tn": 17, "D_fn": 21, "sharpe": 0.8235, "sortino": 0.9026, "return_pct": 5.11, "equity": 1051.1, "max_dd": 0.0, "win_rate": 46.88, "profit_factor": 0.0, "ic": 0.0627, "hit": 46.88, "psr": 0.7215, "bh_sharpe": 1.7678, "bh_return_pct": 11.76, "excess_sharpe": -0.9443, "precision": 0.5634, "recall": 0.5128, "f1": 0.5369, "f2": 0.5222, "mcc": -0.0934, "accuracy": 0.4651, "tp": 40, "fp": 31, "tn": 20, "fn": 38}, {"fold": "fold_4", "regime": "China devaluation and oil crash", "n": 108, "A_sharpe": -0.1353, "A_sortino": -0.1268, "A_excess_sharpe": 0.5545, "A_return_pct": -2.06, "A_hit_rate": 51.4, "A_n": 108, "A_bh_sharpe": -0.6898, "A_bh_return_pct": -6.71, "A_psr": 0.4648, "A_ic": 0.0522, "A_precision": 0.5094, "A_recall": 0.5094, "A_f1": 0.5094, "A_f2": 0.5094, "A_accuracy": 0.5185, "A_mcc": 0.0367, "A_tp": 27, "A_fp": 26, "A_tn": 29, "A_fn": 26, "B_sharpe": -3.1731, "B_sortino": -2.9407, "B_excess_sharpe": -1.2156, "B_return_pct": -46.7, "B_hit_rate": 39.81, "B_n": 108, "B_bh_sharpe": -1.9575, "B_bh_return_pct": -33.56, "B_psr": 0.0175, "B_ic": -0.1287, "B_precision": 0.3704, "B_recall": 0.3922, "B_f1": 0.381, "B_f2": 0.3876, "B_accuracy": 0.3981, "B_mcc": -0.204, "B_tp": 20, "B_fp": 34, "B_tn": 23, "B_fn": 31, "D_sharpe": -1.1063, "D_sortino": -1.0171, "D_excess_sharpe": -0.4165, "D_return_pct": -10.04, "D_hit_rate": 47.66, "D_n": 108, "D_bh_sharpe": -0.6898, "D_bh_return_pct": -6.71, "D_psr": 0.2323, "D_ic": -0.0376, "D_precision": 0.463, "D_recall": 0.4717, "D_f1": 0.4673, "D_f2": 0.4699, "D_accuracy": 0.4722, "D_mcc": -0.0556, "D_tp": 25, "D_fp": 29, "D_tn": 26, "D_fn": 28, "sharpe": -0.1353, "sortino": -0.1268, "return_pct": -2.06, "equity": 979.4000000000001, "max_dd": 0.0, "win_rate": 51.4, "profit_factor": 0.0, "ic": 0.0522, "hit": 51.4, "psr": 0.4648, "bh_sharpe": -0.6898, "bh_return_pct": -6.71, "excess_sharpe": 0.5545, "precision": 0.5094, "recall": 0.5094, "f1": 0.5094, "f2": 0.5094, "mcc": 0.0367, "accuracy": 0.5185, "tp": 27, "fp": 26, "tn": 29, "fn": 26}, {"fold": "fold_5", "regime": "2018 Vol-mageddon + Q4 sell-off", "n": 128, "A_sharpe": 1.3771, "A_sortino": 1.6872, "A_excess_sharpe": 0.226, "A_return_pct": 16.29, "A_hit_rate": 49.22, "A_n": 128, "A_bh_sharpe": 1.1511, "A_bh_return_pct": 13.19, "A_psr": 0.8442, "A_ic": 0.0281, "A_precision": 0.6182, "A_recall": 0.4359, "A_f1": 0.5113, "A_f2": 0.4632, "A_accuracy": 0.4922, "A_mcc": 0.0157, "A_tp": 34, "A_fp": 21, "A_tn": 29, "A_fn": 44, "B_sharpe": -3.1288, "B_sortino": -3.1923, "B_excess_sharpe": -5.9407, "B_return_pct": -54.29, "B_hit_rate": 33.86, "B_n": 128, "B_bh_sharpe": 2.8119, "B_bh_return_pct": 82.25, "B_psr": 0.0146, "B_ic": -0.0407, "B_precision": 0.5094, "B_recall": 0.3176, "B_f1": 0.3913, "B_f2": 0.3435, "B_accuracy": 0.3438, "B_mcc": -0.2752, "B_tp": 27, "B_fp": 26, "B_tn": 17, "B_fn": 58, "D_sharpe": -0.4607, "D_sortino": -0.5527, "D_excess_sharpe": -1.6118, "D_return_pct": -6.71, "D_hit_rate": 41.41, "D_n": 128, "D_bh_sharpe": 1.1511, "D_bh_return_pct": 13.19, "D_psr": 0.3735, "D_ic": -0.0369, "D_precision": 0.5283, "D_recall": 0.359, "D_f1": 0.4275, "D_f2": 0.3836, "D_accuracy": 0.4141, "D_mcc": -0.1397, "D_tp": 28, "D_fp": 25, "D_tn": 25, "D_fn": 50, "sharpe": 1.3771, "sortino": 1.6872, "return_pct": 16.29, "equity": 1162.9, "max_dd": 0.0, "win_rate": 49.22, "profit_factor": 0.0, "ic": 0.0281, "hit": 49.22, "psr": 0.8442, "bh_sharpe": 1.1511, "bh_return_pct": 13.19, "excess_sharpe": 0.226, "precision": 0.6182, "recall": 0.4359, "f1": 0.5113, "f2": 0.4632, "mcc": 0.0157, "accuracy": 0.4922, "tp": 34, "fp": 21, "tn": 29, "fn": 44}, {"fold": "fold_6", "regime": "COVID crash and V-recovery", "n": 173, "A_sharpe": 1.2401, "A_sortino": 1.3188, "A_excess_sharpe": -1.086, "A_return_pct": 20.43, "A_hit_rate": 52.02, "A_n": 173, "A_bh_sharpe": 2.3261, "A_bh_return_pct": 43.81, "A_psr": 0.848, "A_ic": 0.0696, "A_precision": 0.7083, "A_recall": 0.4513, "A_f1": 0.5514, "A_f2": 0.4866, "A_accuracy": 0.5202, "A_mcc": 0.0978, "A_tp": 51, "A_fp": 21, "A_tn": 39, "A_fn": 62, "B_sharpe": -1.2976, "B_sortino": -1.4268, "B_excess_sharpe": -7.0436, "B_return_pct": -41.53, "B_hit_rate": 42.44, "B_n": 173, "B_bh_sharpe": 5.746, "B_bh_return_pct": 499.04, "B_psr": 0.1487, "B_ic": 0.0959, "B_precision": 0.6364, "B_recall": 0.2523, "B_f1": 0.3613, "B_f2": 0.2869, "B_accuracy": 0.4277, "B_mcc": -0.0064, "B_tp": 28, "B_fp": 16, "B_tn": 46, "B_fn": 83, "D_sharpe": -0.8287, "D_sortino": -0.9604, "D_excess_sharpe": -3.1548, "D_return_pct": -14.63, "D_hit_rate": 39.31, "D_n": 173, "D_bh_sharpe": 2.3261, "D_bh_return_pct": 43.81, "D_psr": 0.2502, "D_ic": 0.0254, "D_precision": 0.5909, "D_recall": 0.2301, "D_f1": 0.3312, "D_f2": 0.2621, "D_accuracy": 0.3931, "D_mcc": -0.0764, "D_tp": 26, "D_fp": 18, "D_tn": 42, "D_fn": 87, "sharpe": 1.2401, "sortino": 1.3188, "return_pct": 20.43, "equity": 1204.3, "max_dd": 0.0, "win_rate": 52.02, "profit_factor": 0.0, "ic": 0.0696, "hit": 52.02, "psr": 0.848, "bh_sharpe": 2.3261, "bh_return_pct": 43.81, "excess_sharpe": -1.086, "precision": 0.7083, "recall": 0.4513, "f1": 0.5514, "f2": 0.4866, "mcc": 0.0978, "accuracy": 0.5202, "tp": 51, "fp": 21, "tn": 39, "fn": 62}, {"fold": "fold_7", "regime": "Inflation bear, AI rally and 2025", "n": 376, "A_sharpe": 0.7989, "A_sortino": 0.9218, "A_excess_sharpe": -0.0043, "A_return_pct": 25.87, "A_hit_rate": 49.2, "A_n": 376, "A_bh_sharpe": 0.8033, "A_bh_return_pct": 26.02, "A_psr": 0.8422, "A_ic": 0.0315, "A_precision": 0.6415, "A_recall": 0.3077, "A_f1": 0.4159, "A_f2": 0.3434, "A_accuracy": 0.492, "A_mcc": 0.0684, "A_tp": 68, "A_fp": 38, "A_tn": 117, "A_fn": 153, "B_sharpe": -0.068, "B_sortino": -0.0764, "B_excess_sharpe": -1.9996, "B_return_pct": -18.73, "B_hit_rate": 45.07, "B_n": 376, "B_bh_sharpe": 1.9317, "B_bh_return_pct": 222.05, "B_psr": 0.467, "B_ic": -0.0222, "B_precision": 0.7234, "B_recall": 0.1498, "B_f1": 0.2482, "B_f2": 0.178, "B_accuracy": 0.4521, "B_mcc": 0.0925, "B_tp": 34, "B_fp": 13, "B_tn": 136, "B_fn": 193, "D_sharpe": -0.3126, "D_sortino": -0.3841, "D_excess_sharpe": -1.1159, "D_return_pct": -13.22, "D_hit_rate": 41.49, "D_n": 376, "D_bh_sharpe": 0.8033, "D_bh_return_pct": 26.02, "D_psr": 0.3537, "D_ic": -0.0207, "D_precision": 0.5106, "D_recall": 0.1086, "D_f1": 0.1791, "D_f2": 0.1289, "D_accuracy": 0.4149, "D_mcc": -0.0592, "D_tp": 24, "D_fp": 23, "D_tn": 132, "D_fn": 197, "sharpe": 0.7989, "sortino": 0.9218, "return_pct": 25.87, "equity": 1258.6999999999998, "max_dd": 0.0, "win_rate": 49.2, "profit_factor": 0.0, "ic": 0.0315, "hit": 49.2, "psr": 0.8422, "bh_sharpe": 0.8033, "bh_return_pct": 26.02, "excess_sharpe": -0.0043, "precision": 0.6415, "recall": 0.3077, "f1": 0.4159, "f2": 0.3434, "mcc": 0.0684, "accuracy": 0.492, "tp": 68, "fp": 38, "tn": 117, "fn": 153}], "per_window_val": [{"fold": "fold_1", "regime": "GFC peak crash (Lehman + Mar-2009 bottom)", "n": 65, "A_sharpe": 1.7987, "A_sortino": 2.2099, "A_excess_sharpe": 4.0244, "A_return_pct": 15.2, "A_hit_rate": 50.79, "A_n": 65, "A_bh_sharpe": -2.2257, "A_bh_return_pct": -18.74, "A_psr": 0.8301, "A_ic": 0.0808, "A_precision": 0.4737, "A_recall": 0.931, "A_f1": 0.6279, "A_f2": 0.7803, "A_accuracy": 0.5077, "A_mcc": 0.1478, "A_tp": 27, "A_fp": 30, "A_tn": 6, "A_fn": 2, "B_sharpe": -4.8065, "B_sortino": -4.0599, "B_excess_sharpe": 2.3158, "B_return_pct": -61.34, "B_hit_rate": 40.0, "B_n": 65, "B_bh_sharpe": -7.1223, "B_bh_return_pct": -73.11, "B_psr": 0.0051, "B_ic": 0.2204, "B_precision": 0.371, "B_recall": 1.0, "B_f1": 0.5412, "B_f2": 0.7468, "B_accuracy": 0.4, "B_mcc": 0.1628, "B_tp": 23, "B_fp": 39, "B_tn": 3, "B_fn": 0, "D_sharpe": -1.1614, "D_sortino": -0.9741, "D_excess_sharpe": 1.0642, "D_return_pct": -10.97, "D_hit_rate": 50.79, "D_n": 65, "D_bh_sharpe": -2.2257, "D_bh_return_pct": -18.74, "D_psr": 0.2717, "D_ic": 0.2808, "D_precision": 0.4677, "D_recall": 1.0, "D_f1": 0.6374, "D_f2": 0.8146, "D_accuracy": 0.4923, "D_mcc": 0.1974, "D_tp": 29, "D_fp": 33, "D_tn": 3, "D_fn": 0, "sharpe": 1.7987, "sortino": 2.2099, "return_pct": 15.2, "equity": 1152.0, "max_dd": 0.0, "win_rate": 50.79, "profit_factor": 0.0, "ic": 0.0808, "hit": 50.79, "psr": 0.8301, "bh_sharpe": -2.2257, "bh_return_pct": -18.74, "excess_sharpe": 4.0244, "precision": 0.4737, "recall": 0.931, "f1": 0.6279, "f2": 0.7803, "mcc": 0.1478, "accuracy": 0.5077, "tp": 27, "fp": 30, "tn": 6, "fn": 2}, {"fold": "fold_2", "regime": "2011 US-downgrade + EU debt", "n": 47, "A_sharpe": -0.1289, "A_sortino": -0.1167, "A_excess_sharpe": 0.0651, "A_return_pct": -1.95, "A_hit_rate": 53.19, "A_n": 47, "A_bh_sharpe": -0.1941, "A_bh_return_pct": -2.36, "A_psr": 0.478, "A_ic": 0.0126, "A_precision": 0.5526, "A_recall": 0.8077, "A_f1": 0.6563, "A_f2": 0.7394, "A_accuracy": 0.5319, "A_mcc": -0.0023, "A_tp": 21, "A_fp": 17, "A_tn": 4, "A_fn": 5, "B_sharpe": 0.9744, "B_sortino": 0.8514, "B_excess_sharpe": 2.5868, "B_return_pct": 8.6, "B_hit_rate": 57.45, "B_n": 47, "B_bh_sharpe": -1.6123, "B_bh_return_pct": -24.3, "B_psr": 0.6582, "B_ic": 0.1805, "B_precision": 0.5128, "B_recall": 0.9524, "B_f1": 0.6667, "B_f2": 0.813, "B_accuracy": 0.5745, "B_mcc": 0.2932, "B_tp": 20, "B_fp": 19, "B_tn": 7, "B_fn": 1, "D_sharpe": 0.6694, "D_sortino": 0.6285, "D_excess_sharpe": 0.8635, "D_return_pct": 3.25, "D_hit_rate": 55.32, "D_n": 47, "D_bh_sharpe": -0.1941, "D_bh_return_pct": -2.36, "D_psr": 0.6119, "D_ic": -0.0169, "D_precision": 0.5641, "D_recall": 0.8462, "D_f1": 0.6769, "D_f2": 0.7692, "D_accuracy": 0.5532, "D_mcc": 0.0485, "D_tp": 22, "D_fp": 17, "D_tn": 4, "D_fn": 4, "sharpe": -0.1289, "sortino": -0.1167, "return_pct": -1.95, "equity": 980.5, "max_dd": 0.0, "win_rate": 53.19, "profit_factor": 0.0, "ic": 0.0126, "hit": 53.19, "psr": 0.478, "bh_sharpe": -0.1941, "bh_return_pct": -2.36, "excess_sharpe": 0.0651, "precision": 0.5526, "recall": 0.8077, "f1": 0.6563, "f2": 0.7394, "mcc": -0.0023, "accuracy": 0.5319, "tp": 21, "fp": 17, "tn": 4, "fn": 5}, {"fold": "fold_3", "regime": "Taper tantrum and 2014 H1", "n": 5, "A_sharpe": 3.7421, "A_sortino": 3.8425, "A_excess_sharpe": 5.0616, "A_return_pct": 0.57, "A_hit_rate": 60.0, "A_n": 5, "A_bh_sharpe": -1.3194, "A_bh_return_pct": -0.21, "A_psr": 0.6797, "A_ic": 0.4, "A_precision": 0.5, "A_recall": 0.5, "A_f1": 0.5, "A_f2": 0.5, "A_accuracy": 0.6, "A_mcc": 0.1667, "A_tp": 1, "A_fp": 1, "A_tn": 2, "A_fn": 1, "B_sharpe": 25.8705, "B_sortino": 0.0, "B_excess_sharpe": 51.7411, "B_return_pct": 3.95, "B_hit_rate": 100.0, "B_n": 5, "B_bh_sharpe": -25.8705, "B_bh_return_pct": -3.84, "B_psr": 1.0, "B_ic": -0.2, "B_precision": 0.0, "B_recall": 0.0, "B_f1": 0.0, "B_f2": 0.0, "B_accuracy": 1.0, "B_mcc": 0.0, "B_tp": 0, "B_fp": 0, "B_tn": 5, "B_fn": 0, "D_sharpe": 1.3194, "D_sortino": 1.268, "D_excess_sharpe": 2.6388, "D_return_pct": 0.2, "D_hit_rate": 60.0, "D_n": 5, "D_bh_sharpe": -1.3194, "D_bh_return_pct": -0.21, "D_psr": 0.5663, "D_ic": -0.3, "D_precision": 0.0, "D_recall": 0.0, "D_f1": 0.0, "D_f2": 0.0, "D_accuracy": 0.6, "D_mcc": 0.0, "D_tp": 0, "D_fp": 0, "D_tn": 3, "D_fn": 2, "sharpe": 3.7421, "sortino": 3.8425, "return_pct": 0.57, "equity": 1005.7, "max_dd": 0.0, "win_rate": 60.0, "profit_factor": 0.0, "ic": 0.4, "hit": 60.0, "psr": 0.6797, "bh_sharpe": -1.3194, "bh_return_pct": -0.21, "excess_sharpe": 5.0616, "precision": 0.5, "recall": 0.5, "f1": 0.5, "f2": 0.5, "mcc": 0.1667, "accuracy": 0.6, "tp": 1, "fp": 1, "tn": 2, "fn": 1}, {"fold": "fold_4", "regime": "China devaluation and oil crash", "n": 47, "A_sharpe": -1.0708, "A_sortino": -1.0495, "A_excess_sharpe": 0.753, "A_return_pct": -5.44, "A_hit_rate": 42.55, "A_n": 47, "A_bh_sharpe": -1.8238, "A_bh_return_pct": -8.68, "A_psr": 0.3227, "A_ic": -0.0013, "A_precision": 0.425, "A_recall": 0.8095, "A_f1": 0.5574, "A_f2": 0.6855, "A_accuracy": 0.4255, "A_mcc": -0.1049, "A_tp": 17, "A_fp": 23, "A_tn": 3, "A_fn": 4, "B_sharpe": -0.7817, "B_sortino": -0.651, "B_excess_sharpe": 1.4383, "B_return_pct": -11.22, "B_hit_rate": 51.06, "B_n": 47, "B_bh_sharpe": -2.22, "B_bh_return_pct": -23.98, "B_psr": 0.3647, "B_ic": 0.5791, "B_precision": 0.4773, "B_recall": 1.0, "B_f1": 0.6462, "B_f2": 0.8203, "B_accuracy": 0.5106, "B_mcc": 0.2347, "B_tp": 21, "B_fp": 23, "B_tn": 3, "B_fn": 0, "D_sharpe": -1.9382, "D_sortino": -1.7846, "D_excess_sharpe": -0.1144, "D_return_pct": -9.16, "D_hit_rate": 46.81, "D_n": 47, "D_bh_sharpe": -1.8238, "D_bh_return_pct": -8.68, "D_psr": 0.2035, "D_ic": 0.063, "D_precision": 0.4545, "D_recall": 0.9524, "D_f1": 0.6154, "D_f2": 0.7812, "D_accuracy": 0.4681, "D_mcc": 0.0596, "D_tp": 20, "D_fp": 24, "D_tn": 2, "D_fn": 1, "sharpe": -1.0708, "sortino": -1.0495, "return_pct": -5.44, "equity": 945.6, "max_dd": 0.0, "win_rate": 42.55, "profit_factor": 0.0, "ic": -0.0013, "hit": 42.55, "psr": 0.3227, "bh_sharpe": -1.8238, "bh_return_pct": -8.68, "excess_sharpe": 0.753, "precision": 0.425, "recall": 0.8095, "f1": 0.5574, "f2": 0.6855, "mcc": -0.1049, "accuracy": 0.4255, "tp": 17, "fp": 23, "tn": 3, "fn": 4}, {"fold": "fold_5", "regime": "2018 Vol-mageddon + Q4 sell-off", "n": 5, "A_sharpe": -10.1368, "A_sortino": -6.9937, "A_excess_sharpe": 0.0, "A_return_pct": -3.15, "A_hit_rate": 40.0, "A_n": 5, "A_bh_sharpe": -10.1368, "A_bh_return_pct": -3.15, "A_psr": 0.0985, "A_ic": -0.1, "A_precision": 0.4, "A_recall": 1.0, "A_f1": 0.5714, "A_f2": 0.7692, "A_accuracy": 0.4, "A_mcc": 0.0, "A_tp": 2, "A_fp": 3, "A_tn": 0, "A_fn": 0, "B_sharpe": 5.6858, "B_sortino": 6.0578, "B_excess_sharpe": 0.0, "B_return_pct": 4.22, "B_hit_rate": 60.0, "B_n": 5, "B_bh_sharpe": 5.6858, "B_bh_return_pct": 4.22, "B_psr": 0.753, "B_ic": 0.9, "B_precision": 0.6, "B_recall": 1.0, "B_f1": 0.75, "B_f2": 0.8824, "B_accuracy": 0.6, "B_mcc": 0.0, "B_tp": 3, "B_fp": 2, "B_tn": 0, "B_fn": 0, "D_sharpe": -10.1368, "D_sortino": -6.9937, "D_excess_sharpe": 0.0, "D_return_pct": -3.15, "D_hit_rate": 40.0, "D_n": 5, "D_bh_sharpe": -10.1368, "D_bh_return_pct": -3.15, "D_psr": 0.0985, "D_ic": 0.7, "D_precision": 0.4, "D_recall": 1.0, "D_f1": 0.5714, "D_f2": 0.7692, "D_accuracy": 0.4, "D_mcc": 0.0, "D_tp": 2, "D_fp": 3, "D_tn": 0, "D_fn": 0, "sharpe": -10.1368, "sortino": -6.9937, "return_pct": -3.15, "equity": 968.5, "max_dd": 0.0, "win_rate": 40.0, "profit_factor": 0.0, "ic": -0.1, "hit": 40.0, "psr": 0.0985, "bh_sharpe": -10.1368, "bh_return_pct": -3.15, "excess_sharpe": 0.0, "precision": 0.4, "recall": 1.0, "f1": 0.5714, "f2": 0.7692, "mcc": 0.0, "accuracy": 0.4, "tp": 2, "fp": 3, "tn": 0, "fn": 0}, {"fold": "fold_6", "regime": "COVID crash and V-recovery", "n": 26, "A_sharpe": 4.0626, "A_sortino": 4.5908, "A_excess_sharpe": 0.7774, "A_return_pct": 5.96, "A_hit_rate": 57.69, "A_n": 26, "A_bh_sharpe": 3.2852, "A_bh_return_pct": 4.82, "A_psr": 0.8987, "A_ic": 0.1672, "A_precision": 0.6667, "A_recall": 0.625, "A_f1": 0.6452, "A_f2": 0.6329, "A_accuracy": 0.5769, "A_mcc": 0.1231, "A_tp": 10, "A_fp": 5, "A_tn": 5, "A_fn": 6, "B_sharpe": 2.5465, "B_sortino": 2.4136, "B_excess_sharpe": -10.4327, "B_return_pct": 8.11, "B_hit_rate": 61.54, "B_n": 26, "B_bh_sharpe": 12.9792, "B_bh_return_pct": 38.76, "B_psr": 0.7862, "B_ic": 0.3135, "B_precision": 1.0, "B_recall": 0.5238, "B_f1": 0.6875, "B_f2": 0.5789, "B_accuracy": 0.6154, "B_mcc": 0.4179, "B_tp": 11, "B_fp": 0, "B_tn": 5, "B_fn": 10, "D_sharpe": 4.7914, "D_sortino": 6.8527, "D_excess_sharpe": 1.5062, "D_return_pct": 7.0, "D_hit_rate": 50.0, "D_n": 26, "D_bh_sharpe": 3.2852, "D_bh_return_pct": 4.82, "D_psr": 0.9425, "D_ic": 0.388, "D_precision": 0.6364, "D_recall": 0.4375, "D_f1": 0.5185, "D_f2": 0.4667, "D_accuracy": 0.5, "D_mcc": 0.0369, "D_tp": 7, "D_fp": 4, "D_tn": 6, "D_fn": 9, "sharpe": 4.0626, "sortino": 4.5908, "return_pct": 5.96, "equity": 1059.6000000000001, "max_dd": 0.0, "win_rate": 57.69, "profit_factor": 0.0, "ic": 0.1672, "hit": 57.69, "psr": 0.8987, "bh_sharpe": 3.2852, "bh_return_pct": 4.82, "excess_sharpe": 0.7774, "precision": 0.6667, "recall": 0.625, "f1": 0.6452, "f2": 0.6329, "mcc": 0.1231, "accuracy": 0.5769, "tp": 10, "fp": 5, "tn": 5, "fn": 6}, {"fold": "fold_7", "regime": "Inflation bear, AI rally and 2025", "n": 65, "A_sharpe": 1.6262, "A_sortino": 1.7842, "A_excess_sharpe": -0.4527, "A_return_pct": 6.28, "A_hit_rate": 53.85, "A_n": 65, "A_bh_sharpe": 2.0789, "A_bh_return_pct": 8.17, "A_psr": 0.7978, "A_ic": 0.2184, "A_precision": 0.6667, "A_recall": 0.2857, "A_f1": 0.4, "A_f2": 0.3226, "A_accuracy": 0.5385, "A_mcc": 0.1409, "A_tp": 10, "A_fp": 5, "A_tn": 25, "A_fn": 25, "B_sharpe": -3.9497, "B_sortino": -3.8285, "B_excess_sharpe": -9.1811, "B_return_pct": -26.23, "B_hit_rate": 33.85, "B_n": 65, "B_bh_sharpe": 5.2314, "B_bh_return_pct": 44.53, "B_psr": 0.0254, "B_ic": 0.1306, "B_precision":