{"experiment_num": 5, "backbone": "lstm", "description": "LSTM @ FX champion HPs (Exp35: wd=7e-4 bs=16 seed=42 lr=1e-3 ep=100 pat=15) \u2014 Fischer-Krauss 2018 EJOR; QQQ exp5 \u2014 directly testing FX-winner config on QQQ", "config": {"seq_len": 10, "lr": 0.001, "batch_size": 16, "epochs": 100, "weight_decay": 0.0007, "patience": 15, "warmup_epochs": 0, "head_dropout": 0.1, "huber_delta": 1.0, "grad_clip": 1.0, "seed": 42, "hidden_size": null, "num_layers": null, "max_depth": null, "gbm_lr": null, "n_estimators": null}, "composite": -0.1318, "test_pos_folds": 7, "val_pos_folds": 5, "val_loss": -2.879089468848243, "elapsed_sec": 91.8, "timestamp": "2026-04-26T14:38:00", "sharpe": 0.8339, "val_sharpe": -0.1318, "ic": 0.0605, "hit": 54.3, "psr": 0.9768, "equity": 2886.8999999999996, "return_pct": 188.69, "bh_sharpe": 0.6042, "bh_return_pct": 103.49, "excess_sharpe": 0.2297, "B_sharpe": 0.6044, "B_excess_sharpe": -1.0964, "B_return_pct": 172.58, "D_sharpe": 0.8339, "D_excess_sharpe": 0.2297, "D_return_pct": 188.69, "per_window": [{"fold": "fold_1", "regime": "GFC peak crash (Lehman + Mar-2009 bottom)", "n": 115, "A_sharpe": 1.0657, "A_sortino": 1.1339, "A_excess_sharpe": 1.5098, "A_return_pct": 20.2, "A_hit_rate": 50.43, "A_n": 115, "A_bh_sharpe": -0.4441, "A_bh_return_pct": -14.4, "A_psr": 0.7635, "A_ic": 0.1112, "B_sharpe": 1.6991, "B_sortino": 1.736, "B_excess_sharpe": 1.9969, "B_return_pct": 67.39, "B_hit_rate": 55.26, "B_n": 115, "B_bh_sharpe": -0.2978, "B_bh_return_pct": -27.23, "B_psr": 0.8719, "B_ic": 0.1781, "D_sharpe": 1.0657, "D_sortino": 1.1339, "D_excess_sharpe": 1.5098, "D_return_pct": 20.2, "D_hit_rate": 50.43, "D_n": 115, "D_bh_sharpe": -0.4441, "D_bh_return_pct": -14.4, "D_psr": 0.7635, "D_ic": 0.1112, "sharpe": 1.0657, "sortino": 1.1339, "return_pct": 20.2, "equity": 1202.0, "max_dd": 0.0, "win_rate": 50.43, "profit_factor": 0.0, "ic": 0.1112, "hit": 50.43, "psr": 0.7635, "bh_sharpe": -0.4441, "bh_return_pct": -14.4, "excess_sharpe": 1.5098, "precision": 0.4842, "recall": 0.8519, "f1": 0.6174, "f2": 0.7395, "accuracy": 0.5043, "mcc": 0.064, "tp": 46, "fp": 49, "tn": 12, "fn": 8, "A_precision": 0.4842, "A_recall": 0.8519, "A_f1": 0.6174, "A_f2": 0.7395, "A_accuracy": 0.5043, "A_mcc": 0.064, "A_tp": 46, "A_fp": 49, "A_tn": 12, "A_fn": 8}, {"fold": "fold_2", "regime": "2011 US-downgrade + EU debt", "n": 136, "A_sharpe": 0.8155, "A_sortino": 0.8621, "A_excess_sharpe": -0.9172, "A_return_pct": 8.24, "A_hit_rate": 51.85, "A_n": 136, "A_bh_sharpe": 1.7327, "A_bh_return_pct": 19.75, "A_psr": 0.7261, "A_ic": -0.0242, "B_sharpe": 0.2982, "B_sortino": 0.3226, "B_excess_sharpe": -3.7677, "B_return_pct": 1.78, "B_hit_rate": 47.79, "B_n": 136, "B_bh_sharpe": 4.0659, "B_bh_return_pct": 148.68, "B_psr": 0.5866, "B_ic": 0.0078, "D_sharpe": 0.8155, "D_sortino": 0.8621, "D_excess_sharpe": -0.9172, "D_return_pct": 8.24, "D_hit_rate": 51.85, "D_n": 136, "D_bh_sharpe": 1.7327, "D_bh_return_pct": 19.75, "D_psr": 0.7261, "D_ic": -0.0242, "sharpe": 0.8155, "sortino": 0.8621, "return_pct": 8.24, "equity": 1082.4, "max_dd": 0.0, "win_rate": 51.85, "profit_factor": 0.0, "ic": -0.0242, "hit": 51.85, "psr": 0.7261, "bh_sharpe": 1.7327, "bh_return_pct": 19.75, "excess_sharpe": -0.9172, "precision": 0.5545, "recall": 0.7821, "f1": 0.6489, "f2": 0.7227, "accuracy": 0.5147, "mcc": -0.079, "tp": 61, "fp": 49, "tn": 9, "fn": 17, "A_precision": 0.5545, "A_recall": 0.7821, "A_f1": 0.6489, "A_f2": 0.7227, "A_accuracy": 0.5147, "A_mcc": -0.079, "A_tp": 61, "A_fp": 49, "A_tn": 9, "A_fn": 17}, {"fold": "fold_3", "regime": "Taper tantrum and 2014 H1", "n": 178, "A_sharpe": 1.0269, "A_sortino": 0.9456, "A_excess_sharpe": -0.3176, "A_return_pct": 9.21, "A_hit_rate": 55.37, "A_n": 178, "A_bh_sharpe": 1.3445, "A_bh_return_pct": 12.41, "A_psr": 0.8011, "A_ic": 0.1255, "B_sharpe": 1.5694, "B_sortino": 1.6636, "B_excess_sharpe": -1.4789, "B_return_pct": 31.03, "B_hit_rate": 51.69, "B_n": 178, "B_bh_sharpe": 3.0483, "B_bh_return_pct": 71.83, "B_psr": 0.9048, "B_ic": 0.145, "D_sharpe": 1.0269, "D_sortino": 0.9456, "D_excess_sharpe": -0.3176, "D_return_pct": 9.21, "D_hit_rate": 55.37, "D_n": 178, "D_bh_sharpe": 1.3445, "D_bh_return_pct": 12.41, "D_psr": 0.8011, "D_ic": 0.1255, "sharpe": 1.0269, "sortino": 0.9456, "return_pct": 9.21, "equity": 1092.1000000000001, "max_dd": 0.0, "win_rate": 55.37, "profit_factor": 0.0, "ic": 0.1255, "hit": 55.37, "psr": 0.8011, "bh_sharpe": 1.3445, "bh_return_pct": 12.41, "excess_sharpe": -0.3176, "precision": 0.5723, "recall": 0.8835, "f1": 0.6947, "f2": 0.7968, "accuracy": 0.5506, "mcc": -0.0371, "tp": 91, "fp": 68, "tn": 7, "fn": 12, "A_precision": 0.5723, "A_recall": 0.8835, "A_f1": 0.6947, "A_f2": 0.7968, "A_accuracy": 0.5506, "A_mcc": -0.0371, "A_tp": 91, "A_fp": 68, "A_tn": 7, "A_fn": 12}, {"fold": "fold_4", "regime": "China devaluation and oil crash", "n": 157, "A_sharpe": 1.2211, "A_sortino": 1.1786, "A_excess_sharpe": 1.2113, "A_return_pct": 14.51, "A_hit_rate": 54.49, "A_n": 157, "A_bh_sharpe": 0.0098, "A_bh_return_pct": -1.05, "A_psr": 0.8282, "A_ic": 0.1346, "B_sharpe": 1.1807, "B_sortino": 1.2382, "B_excess_sharpe": 1.1648, "B_return_pct": 30.0, "B_hit_rate": 51.59, "B_n": 157, "B_bh_sharpe": 0.0159, "B_bh_return_pct": -5.48, "B_psr": 0.8234, "B_ic": 0.1708, "D_sharpe": 1.2211, "D_sortino": 1.1786, "D_excess_sharpe": 1.2113, "D_return_pct": 14.51, "D_hit_rate": 54.49, "D_n": 157, "D_bh_sharpe": 0.0098, "D_bh_return_pct": -1.05, "D_psr": 0.8282, "D_ic": 0.1346, "sharpe": 1.2211, "sortino": 1.1786, "return_pct": 14.51, "equity": 1145.1, "max_dd": 0.0, "win_rate": 54.49, "profit_factor": 0.0, "ic": 0.1346, "hit": 54.49, "psr": 0.8282, "bh_sharpe": 0.0098, "bh_return_pct": -1.05, "excess_sharpe": 1.2113, "precision": 0.5333, "recall": 0.8889, "f1": 0.6667, "f2": 0.7843, "accuracy": 0.5414, "mcc": 0.0863, "tp": 72, "fp": 63, "tn": 13, "fn": 9, "A_precision": 0.5333, "A_recall": 0.8889, "A_f1": 0.6667, "A_f2": 0.7843, "A_accuracy": 0.5414, "A_mcc": 0.0863, "A_tp": 72, "A_fp": 63, "A_tn": 13, "A_fn": 9}, {"fold": "fold_5", "regime": "2018 Vol-mageddon + Q4 sell-off", "n": 177, "A_sharpe": 0.2699, "A_sortino": 0.2506, "A_excess_sharpe": -0.0399, "A_return_pct": 2.53, "A_hit_rate": 55.93, "A_n": 177, "A_bh_sharpe": 0.3098, "A_bh_return_pct": 3.19, "A_psr": 0.5892, "A_ic": 0.0299, "B_sharpe": 0.8967, "B_sortino": 0.9731, "B_excess_sharpe": 0.005, "B_return_pct": 24.13, "B_hit_rate": 48.3, "B_n": 177, "B_bh_sharpe": 0.8917, "B_bh_return_pct": 23.8, "B_psr": 0.7732, "B_ic": 0.2076, "D_sharpe": 0.2699, "D_sortino": 0.2506, "D_excess_sharpe": -0.0399, "D_return_pct": 2.53, "D_hit_rate": 55.93, "D_n": 177, "D_bh_sharpe": 0.3098, "D_bh_return_pct": 3.19, "D_psr": 0.5892, "D_ic": 0.0299, "sharpe": 0.2699, "sortino": 0.2506, "return_pct": 2.53, "equity": 1025.3000000000002, "max_dd": 0.0, "win_rate": 55.93, "profit_factor": 0.0, "ic": 0.0299, "hit": 55.93, "psr": 0.5892, "bh_sharpe": 0.3098, "bh_return_pct": 3.19, "excess_sharpe": -0.0399, "precision": 0.5862, "recall": 0.8252, "f1": 0.6855, "f2": 0.763, "accuracy": 0.5593, "mcc": 0.0185, "tp": 85, "fp": 60, "tn": 14, "fn": 18, "A_precision": 0.5862, "A_recall": 0.8252, "A_f1": 0.6855, "A_f2": 0.763, "A_accuracy": 0.5593, "A_mcc": 0.0185, "A_tp": 85, "A_fp": 60, "A_tn": 14, "A_fn": 18}, {"fold": "fold_6", "regime": "COVID crash and V-recovery", "n": 222, "A_sharpe": 1.6177, "A_sortino": 1.7102, "A_excess_sharpe": 0.7289, "A_return_pct": 60.75, "A_hit_rate": 56.76, "A_n": 222, "A_bh_sharpe": 0.8888, "A_bh_return_pct": 26.13, "A_psr": 0.9397, "A_ic": 0.1259, "B_sharpe": 0.3861, "B_sortino": 0.366, "B_excess_sharpe": -2.0023, "B_return_pct": 1.95, "B_hit_rate": 52.04, "B_n": 222, "B_bh_sharpe": 2.3884, "B_bh_return_pct": 243.18, "B_psr": 0.6404, "B_ic": 0.0734, "D_sharpe": 1.6177, "D_sortino": 1.7102, "D_excess_sharpe": 0.7289, "D_return_pct": 60.75, "D_hit_rate": 56.76, "D_n": 222, "D_bh_sharpe": 0.8888, "D_bh_return_pct": 26.13, "D_psr": 0.9397, "D_ic": 0.1259, "sharpe": 1.6177, "sortino": 1.7102, "return_pct": 60.75, "equity": 1607.5, "max_dd": 0.0, "win_rate": 56.76, "profit_factor": 0.0, "ic": 0.1259, "hit": 56.76, "psr": 0.9397, "bh_sharpe": 0.8888, "bh_return_pct": 26.13, "excess_sharpe": 0.7289, "precision": 0.6312, "recall": 0.7319, "f1": 0.6779, "f2": 0.7093, "accuracy": 0.5676, "mcc": 0.0319, "tp": 101, "fp": 59, "tn": 25, "fn": 37, "A_precision": 0.6312, "A_recall": 0.7319, "A_f1": 0.6779, "A_f2": 0.7093, "A_accuracy": 0.5676, "A_mcc": 0.0319, "A_tp": 101, "A_fp": 59, "A_tn": 25, "A_fn": 37}, {"fold": "fold_7", "regime": "Inflation bear, AI rally and 2025", "n": 425, "A_sharpe": 0.3093, "A_sortino": 0.302, "A_excess_sharpe": -0.6621, "A_return_pct": 7.65, "A_hit_rate": 53.65, "A_n": 425, "A_bh_sharpe": 0.9715, "A_bh_return_pct": 37.12, "A_psr": 0.6568, "A_ic": 0.0407, "B_sharpe": -0.1596, "B_sortino": -0.1489, "B_excess_sharpe": -2.6623, "B_return_pct": -25.78, "B_hit_rate": 52.12, "B_n": 425, "B_bh_sharpe": 2.5027, "B_bh_return_pct": 458.83, "B_psr": 0.4178, "B_ic": 0.0317, "D_sharpe": 0.3093, "D_sortino": 0.302, "D_excess_sharpe": -0.6621, "D_return_pct": 7.65, "D_hit_rate": 53.65, "D_n": 425, "D_bh_sharpe": 0.9715, "D_bh_return_pct": 37.12, "D_psr": 0.6568, "D_ic": 0.0407, "sharpe": 0.3093, "sortino": 0.302, "return_pct": 7.65, "equity": 1076.5, "max_dd": 0.0, "win_rate": 53.65, "profit_factor": 0.0, "ic": 0.0407, "hit": 53.65, "psr": 0.6568, "bh_sharpe": 0.9715, "bh_return_pct": 37.12, "excess_sharpe": -0.6621, "precision": 0.5892, "recall": 0.7, "f1": 0.6399, "f2": 0.6746, "accuracy": 0.5365, "mcc": 0.0031, "tp": 175, "fp": 122, "tn": 53, "fn": 75, "A_precision": 0.5892, "A_recall": 0.7, "A_f1": 0.6399, "A_f2": 0.6746, "A_accuracy": 0.5365, "A_mcc": 0.0031, "A_tp": 175, "A_fp": 122, "A_tn": 53, "A_fn": 75}], "per_window_val": [{"fold": "fold_1", "regime": "GFC peak crash (Lehman + Mar-2009 bottom)", "n": 104, "A_sharpe": -0.4519, "A_sortino": -0.3909, "A_excess_sharpe": -0.2847, "A_return_pct": -7.11, "A_hit_rate": 51.96, "A_n": 104, "A_bh_sharpe": -0.1672, "A_bh_return_pct": -3.81, "A_psr": 0.3847, "A_ic": 0.0746, "B_sharpe": -3.8705, "B_sortino": -3.4604, "B_excess_sharpe": -1.5964, "B_return_pct": -60.46, "B_hit_rate": 38.83, "B_n": 104, "B_bh_sharpe": -2.2741, "B_bh_return_pct": -44.12, "B_psr": 0.0047, "B_ic": -0.244, "D_sharpe": -0.4519, "D_sortino": -0.3909, "D_excess_sharpe": -0.2847, "D_return_pct": -7.11, "D_hit_rate": 51.96, "D_n": 104, "D_bh_sharpe": -0.1672, "D_bh_return_pct": -3.81, "D_psr": 0.3847, "D_ic": 0.0746, "sharpe": -0.4519, "sortino": -0.3909, "return_pct": -7.11, "equity": 928.9000000000001, "max_dd": 0.0, "win_rate": 51.96, "profit_factor": 0.0, "ic": 0.0746, "hit": 51.96, "psr": 0.3847, "bh_sharpe": -0.1672, "bh_return_pct": -3.81, "excess_sharpe": -0.2847}, {"fold": "fold_2", "regime": "2011 US-downgrade + EU debt", "n": 96, "A_sharpe": 0.269, "A_sortino": 0.2666, "A_excess_sharpe": 0.5431, "A_return_pct": 1.38, "A_hit_rate": 49.47, "A_n": 96, "A_bh_sharpe": -0.2741, "A_bh_return_pct": -4.09, "A_psr": 0.5654, "A_ic": 0.0414, "B_sharpe": -0.5994, "B_sortino": -0.5483, "B_excess_sharpe": 0.4281, "B_return_pct": -18.14, "B_hit_rate": 51.04, "B_n": 96, "B_bh_sharpe": -1.0274, "B_bh_return_pct": -25.58, "B_psr": 0.3551, "B_ic": 0.1076, "D_sharpe": 0.269, "D_sortino": 0.2666, "D_excess_sharpe": 0.5431, "D_return_pct": 1.38, "D_hit_rate": 49.47, "D_n": 96, "D_bh_sharpe": -0.2741, "D_bh_return_pct": -4.09, "D_psr": 0.5654, "D_ic": 0.0414, "sharpe": 0.269, "sortino": 0.2666, "return_pct": 1.38, "equity": 1013.8000000000001, "max_dd": 0.0, "win_rate": 49.47, "profit_factor": 0.0, "ic": 0.0414, "hit": 49.47, "psr": 0.5654, "bh_sharpe": -0.2741, "bh_return_pct": -4.09, "excess_sharpe": 0.5431}, {"fold": "fold_3", "regime": "Taper tantrum and 2014 H1", "n": 54, "A_sharpe": 1.118, "A_sortino": 1.108, "A_excess_sharpe": -3.5817, "A_return_pct": 2.4, "A_hit_rate": 50.0, "A_n": 54, "A_bh_sharpe": 4.6998, "A_bh_return_pct": 10.46, "A_psr": 0.6925, "A_ic": 0.0151, "B_sharpe": 0.3357, "B_sortino": 0.3504, "B_excess_sharpe": -8.6969, "B_return_pct": 1.12, "B_hit_rate": 48.15, "B_n": 54, "B_bh_sharpe": 9.0326, "B_bh_return_pct": 49.18, "B_psr": 0.5612, "B_ic": 0.0907, "D_sharpe": 1.118, "D_sortino": 1.108, "D_excess_sharpe": -3.5817, "D_return_pct": 2.4, "D_hit_rate": 50.0, "D_n": 54, "D_bh_sharpe": 4.6998, "D_bh_return_pct": 10.46, "D_psr": 0.6925, "D_ic": 0.0151, "sharpe": 1.118, "sortino": 1.108, "return_pct": 2.4, "equity": 1024.0, "max_dd": 0.0, "win_rate": 50.0, "profit_factor": 0.0, "ic": 0.0151, "hit": 50.0, "psr": 0.6925, "bh_sharpe": 4.6998, "bh_return_pct": 10.46, "excess_sharpe": -3.5817}, {"fold": "fold_4", "regime": "China devaluation and oil crash", "n": 96, "A_sharpe": -2.1947, "A_sortino": -2.0634, "A_excess_sharpe": -1.7706, "A_return_pct": -15.29, "A_hit_rate": 43.16, "A_n": 96, "A_bh_sharpe": -0.4241, "A_bh_return_pct": -3.73, "A_psr": 0.0894, "A_ic": 0.0162, "B_sharpe": 1.1885, "B_sortino": 1.2447, "B_excess_sharpe": 2.3728, "B_return_pct": 17.84, "B_hit_rate": 52.08, "B_n": 96, "B_bh_sharpe": -1.1843, "B_bh_return_pct": -21.44, "B_psr": 0.7667, "B_ic": 0.1389, "D_sharpe": -2.1947, "D_sortino": -2.0634, "D_excess_sharpe": -1.7706, "D_return_pct": -15.29, "D_hit_rate": 43.16, "D_n": 96, "D_bh_sharpe": -0.4241, "D_bh_return_pct": -3.73, "D_psr": 0.0894, "D_ic": 0.0162, "sharpe": -2.1947, "sortino": -2.0634, "return_pct": -15.29, "equity": 847.0999999999999, "max_dd": 0.0, "win_rate": 43.16, "profit_factor": 0.0, "ic": 0.0162, "hit": 43.16, "psr": 0.0894, "bh_sharpe": -0.4241, "bh_return_pct": -3.73, "excess_sharpe": -1.7706}, {"fold": "fold_5", "regime": "2018 Vol-mageddon + Q4 sell-off", "n": 54, "A_sharpe": 0.4871, "A_sortino": 0.4664, "A_excess_sharpe": -0.9408, "A_return_pct": 1.21, "A_hit_rate": 50.0, "A_n": 54, "A_bh_sharpe": 1.428, "A_bh_return_pct": 3.97, "A_psr": 0.5878, "A_ic": -0.0405, "B_sharpe": -3.0043, "B_sortino": -2.7656, "B_excess_sharpe": -7.9364, "B_return_pct": -18.47, "B_hit_rate": 44.44, "B_n": 54, "B_bh_sharpe": 4.9322, "B_bh_return_pct": 34.93, "B_psr": 0.0869, "B_ic": -0.1835, "D_sharpe": 0.4871, "D_sortino": 0.4664, "D_excess_sharpe": -0.9408, "D_return_pct": 1.21, "D_hit_rate": 50.0, "D_n": 54, "D_bh_sharpe": 1.428, "D_bh_return_pct": 3.97, "D_psr": 0.5878, "D_ic": -0.0405, "sharpe": 0.4871, "sortino": 0.4664, "return_pct": 1.21, "equity": 1012.1, "max_dd": 0.0, "win_rate": 50.0, "profit_factor": 0.0, "ic": -0.0405, "hit": 50.0, "psr": 0.5878, "bh_sharpe": 1.428, "bh_return_pct": 3.97, "excess_sharpe": -0.9408}, {"fold": "fold_6", "regime": "COVID crash and V-recovery", "n": 75, "A_sharpe": 2.0237, "A_sortino": 2.1999, "A_excess_sharpe": -2.2757, "A_return_pct": 6.74, "A_hit_rate": 50.67, "A_n": 75, "A_bh_sharpe": 4.2994, "A_bh_return_pct": 14.68, "A_psr": 0.8602, "A_ic": 0.1479, "B_sharpe": -2.4539, "B_sortino": -2.3225, "B_excess_sharpe": -16.7878, "B_return_pct": -17.43, "B_hit_rate": 44.0, "B_n": 75, "B_bh_sharpe": 14.3339, "B_bh_return_pct": 120.13, "B_psr": 0.0926, "B_ic": -0.0203, "D_sharpe": 2.0237, "D_sortino": 2.1999, "D_excess_sharpe": -2.2757, "D_return_pct": 6.74, "D_hit_rate": 50.67, "D_n": 75, "D_bh_sharpe": 4.2994, "D_bh_return_pct": 14.68, "D_psr": 0.8602, "D_ic": 0.1479, "sharpe": 2.0237, "sortino": 2.1999, "return_pct": 6.74, "equity": 1067.3999999999999, "max_dd": 0.0, "win_rate": 50.67, "profit_factor": 0.0, "ic": 0.1479, "hit": 50.67, "psr": 0.8602, "bh_sharpe": 4.2994, "bh_return_pct": 14.68, "excess_sharpe": -2.2757}, {"fold": "fold_7", "regime": "Inflation bear, AI rally and 2025", "n": 114, "A_sharpe": 0.2411, "A_sortino": 0.2486, "A_excess_sharpe": -2.6039, "A_return_pct": 1.16, "A_hit_rate": 48.25, "A_n": 114, "A_bh_sharpe": 2.845, "A_bh_return_pct": 21.34, "A_psr": 0.5641, "A_ic": -0.0225, "B_sharpe": -0.9536, "B_sortino": -0.9816, "B_excess_sharpe": -7.0902, "B_return_pct": -17.5, "B_hit_rate": 48.25, "B_n": 114, "B_bh_sharpe": 6.1366, "B_bh_return_pct": 155.03, "B_psr": 0.2644, "B_ic": -0.0596, "D_sharpe": 0.2411, "D_sortino": 0.2486, "D_excess_sharpe": -2.6039, "D_return_pct": 1.16, "D_hit_rate": 48.25, "D_n": 114, "D_bh_sharpe": 2.845, "D_bh_return_pct": 21.34, "D_psr": 0.5641, "D_ic": -0.0225, "sharpe": 0.2411, "sortino": 0.2486, "return_pct": 1.16, "equity": 1011.6, "max_dd": 0.0, "win_rate": 48.25, "profit_factor": 0.0, "ic": -0.0225, "hit": 48.25, "psr": 0.5641, "bh_sharpe": 2.845, "bh_return_pct": 21.34, "excess_sharpe": -2.6039}], "status": "KEEP", "precision": 0.5731, "recall": 0.7819, "f1": 0.6614, "f2": 0.7288, "accuracy": 0.5418, "mcc": 0.003, "tp": 631, "fp": 470, "tn": 133, "fn": 176, "test_sharpe": 0.8339, "A_sharpe": 0.8339, "A_excess_sharpe": 0.2297, "A_return_pct": 188.69, "A_precision": 0.5731, "A_recall": 0.7819, "A_f1": 0.6614, "A_f2": 0.7288, "A_accuracy": 0.5418, "A_mcc": 0.003, "A_tp": 631, "A_fp": 470, "A_tn": 133, "A_fn": 176, "A_psr": 0.9768, "A_ic": 0.0605, "A_hit_rate": 54.3, "A_bh_sharpe": 0.6042, "A_bh_return_pct": 103.49}
