{"experiment_num": 65, "backbone": "mlp", "description": "MLP @ exp 6 huber_delta=0.1 (interpolate between 0.3 no-effect and 0.015 over-aggressive) - Huber 1964 + Huber 2009; F1 GFC robust-loss compromise", "config": {"seq_len": 10, "lr": 0.0003, "batch_size": 32, "epochs": 50, "weight_decay": 1e-05, "patience": 10, "warmup_epochs": 0, "head_dropout": 0.25, "huber_delta": 0.1, "grad_clip": 1.0, "seed": 0, "hidden_size": null, "num_layers": null, "max_depth": null, "gbm_lr": null, "n_estimators": null}, "composite": -0.6802, "test_pos_folds": 4, "val_pos_folds": 4, "val_loss": -2.894174939665384, "elapsed_sec": 37.6, "timestamp": "2026-04-27T22:52:28", "sharpe": 0.4721, "val_sharpe": -0.3802, "ic": 0.0033, "hit": 46.84, "psr": 0.8705, "equity": 1669.3000000000002, "return_pct": 66.93, "bh_sharpe": 0.6042, "bh_return_pct": 103.49, "excess_sharpe": -0.1322, "B_sharpe": -0.1889, "B_excess_sharpe": -1.8897, "B_return_pct": -74.63, "D_sharpe": 0.4721, "D_excess_sharpe": -0.1322, "D_return_pct": 66.93, "precision": 0.5875, "recall": 0.2454, "f1": 0.3462, "f2": 0.2777, "mcc": 0.0172, "accuracy": 0.4695, "val_precision": 0.5303, "val_recall": 0.2128, "val_f1": 0.3037, "val_f2": 0.2417, "val_mcc": -0.0264, "val_accuracy": 0.4587, "per_window": [{"fold": "fold_1", "regime": "GFC peak crash (Lehman + Mar-2009 bottom)", "n": 115, "A_sharpe": 0.8683, "A_sortino": 1.0375, "A_excess_sharpe": 1.3124, "A_return_pct": 15.08, "A_hit_rate": 46.96, "A_n": 115, "A_bh_sharpe": -0.4441, "A_bh_return_pct": -14.4, "A_psr": 0.7239, "A_ic": -0.0265, "A_precision": 0.4314, "A_recall": 0.4074, "A_f1": 0.419, "A_f2": 0.412, "A_accuracy": 0.4696, "A_mcc": -0.0683, "A_tp": 22, "A_fp": 29, "A_tn": 32, "A_fn": 32, "B_sharpe": 2.3544, "B_sortino": 2.1424, "B_excess_sharpe": 2.6522, "B_return_pct": 118.41, "B_hit_rate": 62.28, "B_n": 115, "B_bh_sharpe": -0.2978, "B_bh_return_pct": -27.23, "B_psr": 0.938, "B_ic": 0.3008, "B_precision": 0.5926, "B_recall": 0.8136, "B_f1": 0.6857, "B_f2": 0.7571, "B_accuracy": 0.6174, "B_mcc": 0.2456, "B_tp": 48, "B_fp": 33, "B_tn": 23, "B_fn": 11, "D_sharpe": 0.8683, "D_sortino": 1.0375, "D_excess_sharpe": 1.3124, "D_return_pct": 15.08, "D_hit_rate": 46.96, "D_n": 115, "D_bh_sharpe": -0.4441, "D_bh_return_pct": -14.4, "D_psr": 0.7239, "D_ic": -0.0265, "D_precision": 0.4314, "D_recall": 0.4074, "D_f1": 0.419, "D_f2": 0.412, "D_accuracy": 0.4696, "D_mcc": -0.0683, "D_tp": 22, "D_fp": 29, "D_tn": 32, "D_fn": 32, "sharpe": 0.8683, "sortino": 1.0375, "return_pct": 15.08, "equity": 1150.8, "max_dd": 0.0, "win_rate": 46.96, "profit_factor": 0.0, "ic": -0.0265, "hit": 46.96, "psr": 0.7239, "bh_sharpe": -0.4441, "bh_return_pct": -14.4, "excess_sharpe": 1.3124, "precision": 0.4314, "recall": 0.4074, "f1": 0.419, "f2": 0.412, "mcc": -0.0683, "accuracy": 0.4696, "tp": 22, "fp": 29, "tn": 32, "fn": 32}, {"fold": "fold_2", "regime": "2011 US-downgrade + EU debt", "n": 136, "A_sharpe": -0.8935, "A_sortino": -0.9551, "A_excess_sharpe": -2.6262, "A_return_pct": -10.48, "A_hit_rate": 45.19, "A_n": 136, "A_bh_sharpe": 1.7327, "A_bh_return_pct": 19.75, "A_psr": 0.2598, "A_ic": -0.006, "A_precision": 0.5588, "A_recall": 0.2436, "A_f1": 0.3393, "A_f2": 0.2746, "A_accuracy": 0.4559, "A_mcc": -0.0172, "A_tp": 19, "A_fp": 15, "A_tn": 43, "A_fn": 59, "B_sharpe": 7.1469, "B_sortino": 6.9435, "B_excess_sharpe": 3.081, "B_return_pct": 368.41, "B_hit_rate": 75.74, "B_n": 136, "B_bh_sharpe": 4.0659, "B_bh_return_pct": 148.68, "B_psr": 1.0, "B_ic": 0.2636, "B_precision": 0.8247, "B_recall": 0.8333, "B_f1": 0.829, "B_f2": 0.8316, "B_accuracy": 0.7574, "B_mcc": 0.4114, "B_tp": 80, "B_fp": 17, "B_tn": 23, "B_fn": 16, "D_sharpe": -0.8935, "D_sortino": -0.9551, "D_excess_sharpe": -2.6262, "D_return_pct": -10.48, "D_hit_rate": 45.19, "D_n": 136, "D_bh_sharpe": 1.7327, "D_bh_return_pct": 19.75, "D_psr": 0.2598, "D_ic": -0.006, "D_precision": 0.5588, "D_recall": 0.2436, "D_f1": 0.3393, "D_f2": 0.2746, "D_accuracy": 0.4559, "D_mcc": -0.0172, "D_tp": 19, "D_fp": 15, "D_tn": 43, "D_fn": 59, "sharpe": -0.8935, "sortino": -0.9551, "return_pct": -10.48, "equity": 895.2, "max_dd": 0.0, "win_rate": 45.19, "profit_factor": 0.0, "ic": -0.006, "hit": 45.19, "psr": 0.2598, "bh_sharpe": 1.7327, "bh_return_pct": 19.75, "excess_sharpe": -2.6262, "precision": 0.5588, "recall": 0.2436, "f1": 0.3393, "f2": 0.2746, "mcc": -0.0172, "accuracy": 0.4559, "tp": 19, "fp": 15, "tn": 43, "fn": 59}, {"fold": "fold_3", "regime": "Taper tantrum and 2014 H1", "n": 178, "A_sharpe": 1.5049, "A_sortino": 1.7595, "A_excess_sharpe": 0.1604, "A_return_pct": 14.06, "A_hit_rate": 51.41, "A_n": 178, "A_bh_sharpe": 1.3445, "A_bh_return_pct": 12.41, "A_psr": 0.903, "A_ic": 0.1728, "A_precision": 0.7297, "A_recall": 0.2621, "A_f1": 0.3857, "A_f2": 0.3007, "A_accuracy": 0.5169, "A_mcc": 0.1567, "A_tp": 27, "A_fp": 10, "A_tn": 65, "A_fn": 76, "B_sharpe": 4.0329, "B_sortino": 4.1225, "B_excess_sharpe": 0.9846, "B_return_pct": 104.33, "B_hit_rate": 62.92, "B_n": 178, "B_bh_sharpe": 3.0483, "B_bh_return_pct": 71.83, "B_psr": 0.9995, "B_ic": 0.058, "B_precision": 0.6352, "B_recall": 0.9266, "B_f1": 0.7537, "B_f2": 0.8487, "B_accuracy": 0.6292, "B_mcc": 0.1357, "B_tp": 101, "B_fp": 58, "B_tn": 11, "B_fn": 8, "D_sharpe": 1.5049, "D_sortino": 1.7595, "D_excess_sharpe": 0.1604, "D_return_pct": 14.06, "D_hit_rate": 51.41, "D_n": 178, "D_bh_sharpe": 1.3445, "D_bh_return_pct": 12.41, "D_psr": 0.903, "D_ic": 0.1728, "D_precision": 0.7297, "D_recall": 0.2621, "D_f1": 0.3857, "D_f2": 0.3007, "D_accuracy": 0.5169, "D_mcc": 0.1567, "D_tp": 27, "D_fp": 10, "D_tn": 65, "D_fn": 76, "sharpe": 1.5049, "sortino": 1.7595, "return_pct": 14.06, "equity": 1140.6000000000001, "max_dd": 0.0, "win_rate": 51.41, "profit_factor": 0.0, "ic": 0.1728, "hit": 51.41, "psr": 0.903, "bh_sharpe": 1.3445, "bh_return_pct": 12.41, "excess_sharpe": 0.1604, "precision": 0.7297, "recall": 0.2621, "f1": 0.3857, "f2": 0.3007, "mcc": 0.1567, "accuracy": 0.5169, "tp": 27, "fp": 10, "tn": 65, "fn": 76}, {"fold": "fold_4", "regime": "China devaluation and oil crash", "n": 157, "A_sharpe": -0.3408, "A_sortino": -0.3214, "A_excess_sharpe": -0.3505, "A_return_pct": -5.16, "A_hit_rate": 49.36, "A_n": 157, "A_bh_sharpe": 0.0098, "A_bh_return_pct": -1.05, "A_psr": 0.3939, "A_ic": 0.0392, "A_precision": 0.5217, "A_recall": 0.2963, "A_f1": 0.378, "A_f2": 0.3243, "A_accuracy": 0.4968, "A_mcc": 0.0075, "A_tp": 24, "A_fp": 22, "A_tn": 54, "A_fn": 57, "B_sharpe": -1.4135, "B_sortino": -1.4191, "B_excess_sharpe": -1.4294, "B_return_pct": -35.98, "B_hit_rate": 43.31, "B_n": 157, "B_bh_sharpe": 0.0159, "B_bh_return_pct": -5.48, "B_psr": 0.1337, "B_ic": -0.0955, "B_precision": 0.4778, "B_recall": 0.5059, "B_f1": 0.4914, "B_f2": 0.5, "B_accuracy": 0.4331, "B_mcc": -0.148, "B_tp": 43, "B_fp": 47, "B_tn": 25, "B_fn": 42, "D_sharpe": -0.3408, "D_sortino": -0.3214, "D_excess_sharpe": -0.3505, "D_return_pct": -5.16, "D_hit_rate": 49.36, "D_n": 157, "D_bh_sharpe": 0.0098, "D_bh_return_pct": -1.05, "D_psr": 0.3939, "D_ic": 0.0392, "D_precision": 0.5217, "D_recall": 0.2963, "D_f1": 0.378, "D_f2": 0.3243, "D_accuracy": 0.4968, "D_mcc": 0.0075, "D_tp": 24, "D_fp": 22, "D_tn": 54, "D_fn": 57, "sharpe": -0.3408, "sortino": -0.3214, "return_pct": -5.16, "equity": 948.4, "max_dd": 0.0, "win_rate": 49.36, "profit_factor": 0.0, "ic": 0.0392, "hit": 49.36, "psr": 0.3939, "bh_sharpe": 0.0098, "bh_return_pct": -1.05, "excess_sharpe": -0.3505, "precision": 0.5217, "recall": 0.2963, "f1": 0.378, "f2": 0.3243, "mcc": 0.0075, "accuracy": 0.4968, "tp": 24, "fp": 22, "tn": 54, "fn": 57}, {"fold": "fold_5", "regime": "2018 Vol-mageddon + Q4 sell-off", "n": 177, "A_sharpe": 0.7009, "A_sortino": 0.8519, "A_excess_sharpe": 0.3911, "A_return_pct": 9.94, "A_hit_rate": 44.63, "A_n": 177, "A_bh_sharpe": 0.3098, "A_bh_return_pct": 3.19, "A_psr": 0.7242, "A_ic": -0.0359, "A_precision": 0.549, "A_recall": 0.2718, "A_f1": 0.3636, "A_f2": 0.3024, "A_accuracy": 0.4463, "A_mcc": -0.0424, "A_tp": 28, "A_fp": 23, "A_tn": 51, "A_fn": 75, "B_sharpe": -1.1339, "B_sortino": -1.0583, "B_excess_sharpe": -2.0255, "B_return_pct": -35.9, "B_hit_rate": 47.16, "B_n": 177, "B_bh_sharpe": 0.8917, "B_bh_return_pct": 23.8, "B_psr": 0.1687, "B_ic": -0.0622, "B_precision": 0.5714, "B_recall": 0.5505, "B_f1": 0.5607, "B_f2": 0.5545, "B_accuracy": 0.4689, "B_mcc": -0.1102, "B_tp": 60, "B_fp": 45, "B_tn": 23, "B_fn": 49, "D_sharpe": 0.7009, "D_sortino": 0.8519, "D_excess_sharpe": 0.3911, "D_return_pct": 9.94, "D_hit_rate": 44.63, "D_n": 177, "D_bh_sharpe": 0.3098, "D_bh_return_pct": 3.19, "D_psr": 0.7242, "D_ic": -0.0359, "D_precision": 0.549, "D_recall": 0.2718, "D_f1": 0.3636, "D_f2": 0.3024, "D_accuracy": 0.4463, "D_mcc": -0.0424, "D_tp": 28, "D_fp": 23, "D_tn": 51, "D_fn": 75, "sharpe": 0.7009, "sortino": 0.8519, "return_pct": 9.94, "equity": 1099.3999999999999, "max_dd": 0.0, "win_rate": 44.63, "profit_factor": 0.0, "ic": -0.0359, "hit": 44.63, "psr": 0.7242, "bh_sharpe": 0.3098, "bh_return_pct": 3.19, "excess_sharpe": 0.3911, "precision": 0.549, "recall": 0.2718, "f1": 0.3636, "f2": 0.3024, "mcc": -0.0424, "accuracy": 0.4463, "tp": 28, "fp": 23, "tn": 51, "fn": 75}, {"fold": "fold_6", "regime": "COVID crash and V-recovery", "n": 222, "A_sharpe": 1.8868, "A_sortino": 2.3496, "A_excess_sharpe": 0.9981, "A_return_pct": 75.52, "A_hit_rate": 45.95, "A_n": 222, "A_bh_sharpe": 0.8888, "A_bh_return_pct": 26.13, "A_psr": 0.9621, "A_ic": 0.042, "A_precision": 0.6957, "A_recall": 0.2319, "A_f1": 0.3478, "A_f2": 0.2676, "A_accuracy": 0.4595, "A_mcc": 0.078, "A_tp": 32, "A_fp": 14, "A_tn": 70, "A_fn": 106, "B_sharpe": -3.4484, "B_sortino": -3.0611, "B_excess_sharpe": -5.8368, "B_return_pct": -89.92, "B_hit_rate": 41.18, "B_n": 222, "B_bh_sharpe": 2.3884, "B_bh_return_pct": 243.18, "B_psr": 0.0004, "B_ic": -0.0537, "B_precision": 0.5368, "B_recall": 0.3723, "B_f1": 0.4397, "B_f2": 0.3966, "B_accuracy": 0.4144, "B_mcc": -0.1428, "B_tp": 51, "B_fp": 44, "B_tn": 41, "B_fn": 86, "D_sharpe": 1.8868, "D_sortino": 2.3496, "D_excess_sharpe": 0.9981, "D_return_pct": 75.52, "D_hit_rate": 45.95, "D_n": 222, "D_bh_sharpe": 0.8888, "D_bh_return_pct": 26.13, "D_psr": 0.9621, "D_ic": 0.042, "D_precision": 0.6957, "D_recall": 0.2319, "D_f1": 0.3478, "D_f2": 0.2676, "D_accuracy": 0.4595, "D_mcc": 0.078, "D_tp": 32, "D_fp": 14, "D_tn": 70, "D_fn": 106, "sharpe": 1.8868, "sortino": 2.3496, "return_pct": 75.52, "equity": 1755.1999999999998, "max_dd": 0.0, "win_rate": 45.95, "profit_factor": 0.0, "ic": 0.042, "hit": 45.95, "psr": 0.9621, "bh_sharpe": 0.8888, "bh_return_pct": 26.13, "excess_sharpe": 0.9981, "precision": 0.6957, "recall": 0.2319, "f1": 0.3478, "f2": 0.2676, "mcc": 0.078, "accuracy": 0.4595, "tp": 32, "fp": 14, "tn": 70, "fn": 106}, {"fold": "fold_7", "regime": "Inflation bear, AI rally and 2025", "n": 425, "A_sharpe": -0.584, "A_sortino": -0.634, "A_excess_sharpe": -1.5555, "A_return_pct": -22.38, "A_hit_rate": 45.88, "A_n": 425, "A_bh_sharpe": 0.9715, "A_bh_return_pct": 37.12, "A_psr": 0.2294, "A_ic": -0.0076, "A_precision": 0.6389, "A_recall": 0.184, "A_f1": 0.2857, "A_f2": 0.2146, "A_accuracy": 0.4588, "A_mcc": 0.0465, "A_tp": 46, "A_fp": 26, "A_tn": 149, "A_fn": 204, "B_sharpe": -1.3744, "B_sortino": -1.304, "B_excess_sharpe": -3.877, "B_return_pct": -70.65, "B_hit_rate": 46.7, "B_n": 425, "B_bh_sharpe": 2.5027, "B_bh_return_pct": 458.83, "B_psr": 0.0361, "B_ic": -0.1214, "B_precision": 0.5703, "B_recall": 0.5551, "B_f1": 0.5626, "B_f2": 0.5581, "B_accuracy": 0.4659, "B_mcc": -0.1229, "B_tp": 146, "B_fp": 110, "B_tn": 52, "B_fn": 117, "D_sharpe": -0.584, "D_sortino": -0.634, "D_excess_sharpe": -1.5555, "D_return_pct": -22.38, "D_hit_rate": 45.88, "D_n": 425, "D_bh_sharpe": 0.9715, "D_bh_return_pct": 37.12, "D_psr": 0.2294, "D_ic": -0.0076, "D_precision": 0.6389, "D_recall": 0.184, "D_f1": 0.2857, "D_f2": 0.2146, "D_accuracy": 0.4588, "D_mcc": 0.0465, "D_tp": 46, "D_fp": 26, "D_tn": 149, "D_fn": 204, "sharpe": -0.584, "sortino": -0.634, "return_pct": -22.38, "equity": 776.2, "max_dd": 0.0, "win_rate": 45.88, "profit_factor": 0.0, "ic": -0.0076, "hit": 45.88, "psr": 0.2294, "bh_sharpe": 0.9715, "bh_return_pct": 37.12, "excess_sharpe": -1.5555, "precision": 0.6389, "recall": 0.184, "f1": 0.2857, "f2": 0.2146, "mcc": 0.0465, "accuracy": 0.4588, "tp": 46, "fp": 26, "tn": 149, "fn": 204}], "per_window_val": [{"fold": "fold_1", "regime": "GFC peak crash (Lehman + Mar-2009 bottom)", "n": 104, "A_sharpe": 0.7482, "A_sortino": 0.805, "A_excess_sharpe": 0.9154, "A_return_pct": 7.62, "A_hit_rate": 50.0, "A_n": 104, "A_bh_sharpe": -0.1672, "A_bh_return_pct": -3.81, "A_psr": 0.6857, "A_ic": 0.0508, "A_precision": 0.5429, "A_recall": 0.3519, "A_f1": 0.427, "A_f2": 0.3785, "A_accuracy": 0.5096, "A_mcc": 0.0337, "A_tp": 19, "A_fp": 16, "A_tn": 34, "A_fn": 35, "B_sharpe": -2.1712, "B_sortino": -1.9438, "B_excess_sharpe": 0.1029, "B_return_pct": -42.81, "B_hit_rate": 44.66, "B_n": 104, "B_bh_sharpe": -2.2741, "B_bh_return_pct": -44.12, "B_psr": 0.0738, "B_ic": -0.0514, "B_precision": 0.4561, "B_recall": 0.5, "B_f1": 0.4771, "B_f2": 0.4906, "B_accuracy": 0.4519, "B_mcc": -0.0966, "B_tp": 26, "B_fp": 31, "B_tn": 21, "B_fn": 26, "D_sharpe": 0.7482, "D_sortino": 0.805, "D_excess_sharpe": 0.9154, "D_return_pct": 7.62, "D_hit_rate": 50.0, "D_n": 104, "D_bh_sharpe": -0.1672, "D_bh_return_pct": -3.81, "D_psr": 0.6857, "D_ic": 0.0508, "D_precision": 0.5429, "D_recall": 0.3519, "D_f1": 0.427, "D_f2": 0.3785, "D_accuracy": 0.5096, "D_mcc": 0.0337, "D_tp": 19, "D_fp": 16, "D_tn": 34, "D_fn": 35, "sharpe": 0.7482, "sortino": 0.805, "return_pct": 7.62, "equity": 1076.2, "max_dd": 0.0, "win_rate": 50.0, "profit_factor": 0.0, "ic": 0.0508, "hit": 50.0, "psr": 0.6857, "bh_sharpe": -0.1672, "bh_return_pct": -3.81, "excess_sharpe": 0.9154, "precision": 0.5429, "recall": 0.3519, "f1": 0.427, "f2": 0.3785, "mcc": 0.0337, "accuracy": 0.5096, "tp": 19, "fp": 16, "tn": 34, "fn": 35}, {"fold": "fold_2", "regime": "2011 US-downgrade + EU debt", "n": 96, "A_sharpe": 1.0358, "A_sortino": 1.1068, "A_excess_sharpe": 1.3099, "A_return_pct": 9.62, "A_hit_rate": 50.53, "A_n": 96, "A_bh_sharpe": -0.2741, "A_bh_return_pct": -4.09, "A_psr": 0.7376, "A_ic": 0.0302, "A_precision": 0.5278, "A_recall": 0.38, "A_f1": 0.4419, "A_f2": 0.4025, "A_accuracy": 0.5, "A_mcc": 0.0108, "A_tp": 19, "A_fp": 17, "A_tn": 29, "A_fn": 31, "B_sharpe": -0.5768, "B_sortino": -0.544, "B_excess_sharpe": 0.4506, "B_return_pct": -17.74, "B_hit_rate": 47.92, "B_n": 96, "B_bh_sharpe": -1.0274, "B_bh_return_pct": -25.58, "B_psr": 0.3602, "B_ic": -0.0008, "B_precision": 0.4598, "B_recall": 0.9302, "B_f1": 0.6154, "B_f2": 0.7722, "B_accuracy": 0.4792, "B_mcc": 0.0741, "B_tp": 40, "B_fp": 47, "B_tn": 6, "B_fn": 3, "D_sharpe": 1.0358, "D_sortino": 1.1068, "D_excess_sharpe": 1.3099, "D_return_pct": 9.62, "D_hit_rate": 50.53, "D_n": 96, "D_bh_sharpe": -0.2741, "D_bh_return_pct": -4.09, "D_psr": 0.7376, "D_ic": 0.0302, "D_precision": 0.5278, "D_recall": 0.38, "D_f1": 0.4419, "D_f2": 0.4025, "D_accuracy": 0.5, "D_mcc": 0.0108, "D_tp": 19, "D_fp": 17, "D_tn": 29, "D_fn": 31, "sharpe": 1.0358, "sortino": 1.1068, "return_pct": 9.62, "equity": 1096.2, "max_dd": 0.0, "win_rate": 50.53, "profit_factor": 0.0, "ic": 0.0302, "hit": 50.53, "psr": 0.7376, "bh_sharpe": -0.2741, "bh_return_pct": -4.09, "excess_sharpe": 1.3099, "precision": 0.5278, "recall": 0.38, "f1": 0.4419, "f2": 0.4025, "mcc": 0.0108, "accuracy": 0.5, "tp": 19, "fp": 17, "tn": 29, "fn": 31}, {"fold": "fold_3", "regime": "Taper tantrum and 2014 H1", "n": 54, "A_sharpe": -4.6998, "A_sortino": -4.264, "A_excess_sharpe": -9.3995, "A_return_pct": -9.68, "A_hit_rate": 38.89, "A_n": 54, "A_bh_sharpe": 4.6998, "A_bh_return_pct": 10.46, "A_psr": 0.0221, "A_ic": 0.0058, "A_precision": 0.0, "A_recall": 0.0, "A_f1": 0.0, "A_f2": 0.0, "A_accuracy": 0.3889, "A_mcc": 0.0, "A_tp": 0, "A_fp": 0, "A_tn": 21, "A_fn": 33, "B_sharpe": 5.2542, "B_sortino": 5.8054, "B_excess_sharpe": -3.7784, "B_return_pct": 28.64, "B_hit_rate": 62.96, "B_n": 54, "B_bh_sharpe": 9.0326, "B_bh_return_pct": 49.18, "B_psr": 0.9903, "B_ic": -0.0848, "B_precision": 0.6667, "B_recall": 0.9189, "B_f1": 0.7727, "B_f2": 0.8543, "B_accuracy": 0.6296, "B_mcc": -0.1644, "B_tp": 34, "B_fp": 17, "B_tn": 0, "B_fn": 3, "D_sharpe": -4.6998, "D_sortino": -4.264, "D_excess_sharpe": -9.3995, "D_return_pct": -9.68, "D_hit_rate": 38.89, "D_n": 54, "D_bh_sharpe": 4.6998, "D_bh_return_pct": 10.46, "D_psr": 0.0221, "D_ic": 0.0058, "D_precision": 0.0, "D_recall": 0.0, "D_f1": 0.0, "D_f2": 0.0, "D_accuracy": 0.3889, "D_mcc": 0.0, "D_tp": 0, "D_fp": 0, "D_tn": 21, "D_fn": 33, "sharpe": -4.6998, "sortino": -4.264, "return_pct": -9.68, "equity": 903.2, "max_dd": 0.0, "win_rate": 38.89, "profit_factor": 0.0, "ic": 0.0058, "hit": 38.89, "psr": 0.0221, "bh_sharpe": 4.6998, "bh_return_pct": 10.46, "excess_sharpe": -9.3995, "precision": 0.0, "recall": 0.0, "f1": 0.0, "f2": 0.0, "mcc": 0.0, "accuracy": 0.3889, "tp": 0, "fp": 0, "tn": 21, "fn": 33}, {"fold": "fold_4", "regime": "China devaluation and oil crash", "n": 96, "A_sharpe": 1.0253, "A_sortino": 1.0677, "A_excess_sharpe": 1.4494, "A_return_pct": 7.01, "A_hit_rate": 50.53, "A_n": 96, "A_bh_sharpe": -0.4241, "A_bh_return_pct": -3.73, "A_psr": 0.7349, "A_ic": 0.0013, "A_precision": 0.4444, "A_recall": 0.2667, "A_f1": 0.3333, "A_f2": 0.2899, "A_accuracy": 0.5, "A_mcc": -0.0305, "A_tp": 12, "A_fp": 15, "A_tn": 36, "A_fn": 33, "B_sharpe": 0.8375, "B_sortino": 0.8335, "B_excess_sharpe": 2.0218, "B_return_pct": 11.0, "B_hit_rate": 53.12, "B_n": 96, "B_bh_sharpe": -1.1843, "B_bh_return_pct": -21.44, "B_psr": 0.6954, "B_ic": 0.0731, "B_precision": 0.5068, "B_recall": 0.8043, "B_f1": 0.6218, "B_f2": 0.7198, "B_accuracy": 0.5312, "B_mcc": 0.0987, "B_tp": 37, "B_fp": 36, "B_tn": 14, "B_fn": 9, "D_sharpe": 1.0253, "D_sortino": 1.0677, "D_excess_sharpe": 1.4494, "D_return_pct": 7.01, "D_hit_rate": 50.53, "D_n": 96, "D_bh_sharpe": -0.4241, "D_bh_return_pct": -3.73, "D_psr": 0.7349, "D_ic": 0.0013, "D_precision": 0.4444, "D_recall": 0.2667, "D_f1": 0.3333, "D_f2": 0.2899, "D_accuracy": 0.5, "D_mcc": -0.0305, "D_tp": 12, "D_fp": 15, "D_tn": 36, "D_fn": 33, "sharpe": 1.0253, "sortino": 1.0677, "return_pct": 7.01, "equity": 1070.1000000000001, "max_dd": 0.0, "win_rate": 50.53, "profit_factor": 0.0, "ic": 0.0013, "hit": 50.53, "psr": 0.7349, "bh_sharpe": -0.4241, "bh_return_pct": -3.73, "excess_sharpe": 1.4494, "precision": 0.4444, "recall": 0.2667, "f1": 0.3333, "f2": 0.2899, "mcc": -0.0305, "accuracy": 0.5, "tp": 12, "fp": 15, "tn": 36, "fn": 33}, {"fold": "fold_5", "regime": "2018 Vol-mageddon + Q4 sell-off", "n": 54, "A_sharpe": 0.7422, "A_sortino": 0.7576, "A_excess_sharpe": -0.6858, "A_return_pct": 1.96, "A_hit_rate": 53.7, "A_n": 54, "A_bh_sharpe": 1.428, "A_bh_return_pct": 3.97, "A_psr": 0.6338, "A_ic": 0.2142, "A_precision": 0.7, "A_recall": 0.2414, "A_f1": 0.359, "A_f2": 0.2778, "A_accuracy": 0.537, "A_mcc": 0.1558, "A_tp": 7, "A_fp": 3, "A_tn": 22, "A_fn": 22, "B_sharpe": -6.3031, "B_sortino": -4.9884, "B_excess_sharpe": -11.2352, "B_return_pct": -32.65, "B_hit_rate": 40.74, "B_n": 54, "B_bh_sharpe": 4.9322, "B_bh_return_pct": 34.93, "B_psr": 0.0014, "B_ic": -0.5274, "B_precision": 0.5641, "B_recall": 0.5946, "B_f1": 0.5789, "B_f2": 0.5882, "B_accuracy": 0.4074, "B_mcc": -0.4204, "B_tp": 22, "B_fp": 17, "B_tn": 0, "B_fn": 15, "D_sharpe": 0.7422, "D_sortino": 0.7576, "D_excess_sharpe": -0.6858, "D_return_pct": 1.96, "D_hit_rate": 53.7, "D_n": 54, "D_bh_sharpe": 1.428, "D_bh_return_pct": 3.97, "D_psr": 0.6338, "D_ic": 0.2142, "D_precision": 0.7, "D_recall": 0.2414, "D_f1": 0.359, "D_f2": 0.2778, "D_accuracy": 0.537, "D_mcc": 0.1558, "D_tp": 7, "D_fp": 3, "D_tn": 22, "D_fn": 22, "sharpe": 0.7422, "sortino": 0.7576, "return_pct": 1.96, "equity": 1019.6, "max_dd": 0.0, "win_rate": 53.7, "profit_factor": 0.0, "ic": 0.2142, "hit": 53.7, "psr": 0.6338, "bh_sharpe": 1.428, "bh_return_pct": 3.97, "excess_sharpe": -0.6858, "precision": 0.7, "recall": 0.2414, "f1": 0.359, "f2": 0.2778, "mcc": 0.1558, "accuracy": 0.537, "tp": 7, "fp": 3, "tn": 22, "fn": 22}, {"fold": "fold_6", "regime": "COVID crash and V-recovery", "n": 75, "A_sharpe": -3.4731, "A_sortino": -3.6187, "A_excess_sharpe": -7.7725, "A_return_pct": -10.9, "A_hit_rate": 33.33, "A_n": 75, "A_bh_sharpe": 4.2994, "A_bh_return_pct": 14.68, "A_psr": 0.0387, "A_ic": -0.1592, "A_precision": 0.6667, "A_recall": 0.0392, "A_f1": 0.0741, "A_f2": 0.0483, "A_accuracy": 0.3333, "A_mcc": -0.0058, "A_tp": 2, "A_fp": 1, "A_tn": 23, "A_fn": 49, "B_sharpe": 8.3427, "B_sortino": 8.0629, "B_excess_sharpe": -5.9912, "B_return_pct": 72.43, "B_hit_rate": 74.67, "B_n": 75, "B_bh_sharpe": 14.3339, "B_bh_return_pct": 120.13, "B_psr": 1.0, "B_ic": 0.1849, "B_precision": 0.8667, "B_recall": 0.8254, "B_f1": 0.8455, "B_f2": 0.8333, "B_accuracy": 0.7467, "B_mcc": 0.1455, "B_tp": 52, "B_fp": 8, "B_tn": 4, "B_fn": 11, "D_sharpe": -3.4731, "D_sortino": -3.6187, "D_excess_sharpe": -7.7725, "D_return_pct": -10.9, "D_hit_rate": 33.33, "D_n": 75, "D_bh_sharpe": 4.2994, "D_bh_return_pct": 14.68, "D_psr": 0.0387, "D_ic": -0.1592, "D_precision": 0.6667, "D_recall": 0.0392, "D_f1": 0.0741, "D_f2": 0.0483, "D_accuracy": 0.3333, "D_mcc": -0.0058, "D_tp": 2, "D_fp": 1, "D_tn": 23, "D_fn": 49, "sharpe": -3.4731, "sortino": -3.6187, "return_pct": -10.9, "equity": 891.0, "max_dd": 0.0, "win_rate": 33.33, "profit_factor": 0.0, "ic": -0.1592, "hit": 33.33, "psr": 0.0387, "bh_sharpe": 4.2994, "bh_return_pct": 14.68, "excess_sharpe": -7.7725, "precision": 0.6667, "recall": 0.0392, "f1": 0.0741, "f2": 0.0483, "mcc": -0.0058, "accuracy": 0.3333, "tp": 2, "fp": 1, "tn": 23, "fn": 49}, {"fold": "fold_7", "regime": "Inflation bear, AI rally and 2025", "n": 114, "A_sharpe": -3.7932, "A_sortino": -3.3364, "A_excess_sharpe": -6.6382, "A_return_pct": -23.5, "A_hit_rate": 42.11, "A_n": 114, "A_bh_sharpe": 2.845, "A_bh_return_pct": 21.34, "A_psr": 0.0046, "A_ic": 0.0286, "A_precision": 0.5238, "A_recall": 0.1642, "A_f1": 0.25, "A_f2": 0.1903, "A_accuracy": 0.4211, "A_mcc": -0.0