{"experiment_num": 16, "backbone": "mlp", "description": "MLP @ FX-Exp32 HPs seed=42 \u2014 fills the missing seed (we have 0,7,99). 4-seed multi-seed table will resolve whether MLP champion (exp 6 +0.58 at seed=0) is luck or repeatable.", "config": {"seq_len": 10, "lr": 0.0003, "batch_size": 32, "epochs": 50, "weight_decay": 1e-05, "patience": 10, "warmup_epochs": 0, "head_dropout": 0.25, "huber_delta": 1.0, "grad_clip": 1.0, "seed": 42, "hidden_size": null, "num_layers": null, "max_depth": null, "gbm_lr": null, "n_estimators": null}, "composite": -1.5008, "test_pos_folds": 2, "val_pos_folds": 2, "val_loss": -2.8822637251617533, "elapsed_sec": 36.0, "timestamp": "2026-04-26T22:13:56", "sharpe": -0.4997, "val_sharpe": -1.0008, "ic": -0.0369, "hit": 46.98, "psr": 0.1195, "equity": 380.8, "return_pct": -61.92, "bh_sharpe": 0.6042, "bh_return_pct": 103.49, "excess_sharpe": -1.104, "B_sharpe": 0.4116, "B_excess_sharpe": -1.2892, "B_return_pct": 53.93, "D_sharpe": -0.4997, "D_excess_sharpe": -1.104, "D_return_pct": -61.92, "per_window": [{"fold": "fold_1", "regime": "GFC peak crash (Lehman + Mar-2009 bottom)", "n": 115, "A_sharpe": -0.3422, "A_sortino": -0.3311, "A_excess_sharpe": 0.1019, "A_return_pct": -12.42, "A_hit_rate": 52.17, "A_n": 115, "A_bh_sharpe": -0.4441, "A_bh_return_pct": -14.4, "A_psr": 0.409, "A_ic": -0.0196, "B_sharpe": 1.4096, "B_sortino": 1.6409, "B_excess_sharpe": 1.7074, "B_return_pct": 48.96, "B_hit_rate": 47.37, "B_n": 115, "B_bh_sharpe": -0.2978, "B_bh_return_pct": -27.23, "B_psr": 0.8315, "B_ic": 0.203, "D_sharpe": -0.3422, "D_sortino": -0.3311, "D_excess_sharpe": 0.1019, "D_return_pct": -12.42, "D_hit_rate": 52.17, "D_n": 115, "D_bh_sharpe": -0.4441, "D_bh_return_pct": -14.4, "D_psr": 0.409, "D_ic": -0.0196, "sharpe": -0.3422, "sortino": -0.3311, "return_pct": -12.42, "equity": 875.8000000000001, "max_dd": 0.0, "win_rate": 52.17, "profit_factor": 0.0, "ic": -0.0196, "hit": 52.17, "psr": 0.409, "bh_sharpe": -0.4441, "bh_return_pct": -14.4, "excess_sharpe": 0.1019, "precision": 0.4706, "recall": 0.1481, "f1": 0.2254, "f2": 0.1717, "accuracy": 0.5217, "mcc": 0.0009, "tp": 8, "fp": 9, "tn": 52, "fn": 46, "A_precision": 0.4706, "A_recall": 0.1481, "A_f1": 0.2254, "A_f2": 0.1717, "A_accuracy": 0.5217, "A_mcc": 0.0009, "A_tp": 8, "A_fp": 9, "A_tn": 52, "A_fn": 46}, {"fold": "fold_2", "regime": "2011 US-downgrade + EU debt", "n": 136, "A_sharpe": -1.14, "A_sortino": -1.115, "A_excess_sharpe": -2.8728, "A_return_pct": -12.89, "A_hit_rate": 45.93, "A_n": 136, "A_bh_sharpe": 1.7327, "A_bh_return_pct": 19.75, "A_psr": 0.2018, "A_ic": -0.0254, "B_sharpe": 6.8627, "B_sortino": 6.9324, "B_excess_sharpe": 2.7968, "B_return_pct": 344.02, "B_hit_rate": 72.79, "B_n": 136, "B_bh_sharpe": 4.0659, "B_bh_return_pct": 148.68, "B_psr": 1.0, "B_ic": 0.2495, "D_sharpe": -1.14, "D_sortino": -1.115, "D_excess_sharpe": -2.8728, "D_return_pct": -12.89, "D_hit_rate": 45.93, "D_n": 136, "D_bh_sharpe": 1.7327, "D_bh_return_pct": 19.75, "D_psr": 0.2018, "D_ic": -0.0254, "sharpe": -1.14, "sortino": -1.115, "return_pct": -12.89, "equity": 871.1, "max_dd": 0.0, "win_rate": 45.93, "profit_factor": 0.0, "ic": -0.0254, "hit": 45.93, "psr": 0.2018, "bh_sharpe": 1.7327, "bh_return_pct": 19.75, "excess_sharpe": -2.8728, "precision": 0.561, "recall": 0.2949, "f1": 0.3866, "f2": 0.3258, "accuracy": 0.4632, "mcc": -0.0167, "tp": 23, "fp": 18, "tn": 40, "fn": 55, "A_precision": 0.561, "A_recall": 0.2949, "A_f1": 0.3866, "A_f2": 0.3258, "A_accuracy": 0.4632, "A_mcc": -0.0167, "A_tp": 23, "A_fp": 18, "A_tn": 40, "A_fn": 55}, {"fold": "fold_3", "regime": "Taper tantrum and 2014 H1", "n": 178, "A_sharpe": 0.4982, "A_sortino": 0.5288, "A_excess_sharpe": -0.8463, "A_return_pct": 4.06, "A_hit_rate": 48.59, "A_n": 178, "A_bh_sharpe": 1.3445, "A_bh_return_pct": 12.41, "A_psr": 0.6624, "A_ic": 0.0278, "B_sharpe": 2.7241, "B_sortino": 2.8289, "B_excess_sharpe": -0.3243, "B_return_pct": 62.08, "B_hit_rate": 58.43, "B_n": 178, "B_bh_sharpe": 3.0483, "B_bh_return_pct": 71.83, "B_psr": 0.9888, "B_ic": 0.0814, "D_sharpe": 0.4982, "D_sortino": 0.5288, "D_excess_sharpe": -0.8463, "D_return_pct": 4.06, "D_hit_rate": 48.59, "D_n": 178, "D_bh_sharpe": 1.3445, "D_bh_return_pct": 12.41, "D_psr": 0.6624, "D_ic": 0.0278, "sharpe": 0.4982, "sortino": 0.5288, "return_pct": 4.06, "equity": 1040.6, "max_dd": 0.0, "win_rate": 48.59, "profit_factor": 0.0, "ic": 0.0278, "hit": 48.59, "psr": 0.6624, "bh_sharpe": 1.3445, "bh_return_pct": 12.41, "excess_sharpe": -0.8463, "precision": 0.5478, "recall": 0.6117, "f1": 0.578, "f2": 0.5977, "accuracy": 0.4831, "mcc": -0.0843, "tp": 63, "fp": 52, "tn": 23, "fn": 40, "A_precision": 0.5478, "A_recall": 0.6117, "A_f1": 0.578, "A_f2": 0.5977, "A_accuracy": 0.4831, "A_mcc": -0.0843, "A_tp": 63, "A_fp": 52, "A_tn": 23, "A_fn": 40}, {"fold": "fold_4", "regime": "China devaluation and oil crash", "n": 157, "A_sharpe": -0.3337, "A_sortino": -0.3513, "A_excess_sharpe": -0.3435, "A_return_pct": -5.07, "A_hit_rate": 46.15, "A_n": 157, "A_bh_sharpe": 0.0098, "A_bh_return_pct": -1.05, "A_psr": 0.3967, "A_ic": -0.0611, "B_sharpe": -1.0142, "B_sortino": -1.032, "B_excess_sharpe": -1.0301, "B_return_pct": -28.63, "B_hit_rate": 46.5, "B_n": 157, "B_bh_sharpe": 0.0159, "B_bh_return_pct": -5.48, "B_psr": 0.2143, "B_ic": -0.0968, "D_sharpe": -0.3337, "D_sortino": -0.3513, "D_excess_sharpe": -0.3435, "D_return_pct": -5.07, "D_hit_rate": 46.15, "D_n": 157, "D_bh_sharpe": 0.0098, "D_bh_return_pct": -1.05, "D_psr": 0.3967, "D_ic": -0.0611, "sharpe": -0.3337, "sortino": -0.3513, "return_pct": -5.07, "equity": 949.3000000000001, "max_dd": 0.0, "win_rate": 46.15, "profit_factor": 0.0, "ic": -0.0611, "hit": 46.15, "psr": 0.3967, "bh_sharpe": 0.0098, "bh_return_pct": -1.05, "excess_sharpe": -0.3435, "precision": 0.4595, "recall": 0.2099, "f1": 0.2881, "f2": 0.2355, "accuracy": 0.465, "mcc": -0.0627, "tp": 17, "fp": 20, "tn": 56, "fn": 64, "A_precision": 0.4595, "A_recall": 0.2099, "A_f1": 0.2881, "A_f2": 0.2355, "A_accuracy": 0.465, "A_mcc": -0.0627, "A_tp": 17, "A_fp": 20, "A_tn": 56, "A_fn": 64}, {"fold": "fold_5", "regime": "2018 Vol-mageddon + Q4 sell-off", "n": 177, "A_sharpe": 0.2074, "A_sortino": 0.1996, "A_excess_sharpe": -0.1024, "A_return_pct": 1.5, "A_hit_rate": 52.54, "A_n": 177, "A_bh_sharpe": 0.3098, "A_bh_return_pct": 3.19, "A_psr": 0.5687, "A_ic": 0.0123, "B_sharpe": -2.2564, "B_sortino": -2.0672, "B_excess_sharpe": -3.148, "B_return_pct": -55.24, "B_hit_rate": 44.89, "B_n": 177, "B_bh_sharpe": 0.8917, "B_bh_return_pct": 23.8, "B_psr": 0.0273, "B_ic": -0.1859, "D_sharpe": 0.2074, "D_sortino": 0.1996, "D_excess_sharpe": -0.1024, "D_return_pct": 1.5, "D_hit_rate": 52.54, "D_n": 177, "D_bh_sharpe": 0.3098, "D_bh_return_pct": 3.19, "D_psr": 0.5687, "D_ic": 0.0123, "sharpe": 0.2074, "sortino": 0.1996, "return_pct": 1.5, "equity": 1014.9999999999999, "max_dd": 0.0, "win_rate": 52.54, "profit_factor": 0.0, "ic": 0.0123, "hit": 52.54, "psr": 0.5687, "bh_sharpe": 0.3098, "bh_return_pct": 3.19, "excess_sharpe": -0.1024, "precision": 0.6792, "recall": 0.3495, "f1": 0.4615, "f2": 0.3871, "accuracy": 0.5254, "mcc": 0.129, "tp": 36, "fp": 17, "tn": 57, "fn": 67, "A_precision": 0.6792, "A_recall": 0.3495, "A_f1": 0.4615, "A_f2": 0.3871, "A_accuracy": 0.5254, "A_mcc": 0.129, "A_tp": 36, "A_fp": 17, "A_tn": 57, "A_fn": 67}, {"fold": "fold_6", "regime": "COVID crash and V-recovery", "n": 222, "A_sharpe": -0.9393, "A_sortino": -1.0341, "A_excess_sharpe": -1.8281, "A_return_pct": -31.32, "A_hit_rate": 42.34, "A_n": 222, "A_bh_sharpe": 0.8888, "A_bh_return_pct": 26.13, "A_psr": 0.1952, "A_ic": 0.0294, "B_sharpe": -0.9764, "B_sortino": -0.8704, "B_excess_sharpe": -3.3649, "B_return_pct": -55.92, "B_hit_rate": 51.58, "B_n": 222, "B_bh_sharpe": 2.3884, "B_bh_return_pct": 243.18, "B_psr": 0.1769, "B_ic": 0.039, "D_sharpe": -0.9393, "D_sortino": -1.0341, "D_excess_sharpe": -1.8281, "D_return_pct": -31.32, "D_hit_rate": 42.34, "D_n": 222, "D_bh_sharpe": 0.8888, "D_bh_return_pct": 26.13, "D_psr": 0.1952, "D_ic": 0.0294, "sharpe": -0.9393, "sortino": -1.0341, "return_pct": -31.32, "equity": 686.8000000000001, "max_dd": 0.0, "win_rate": 42.34, "profit_factor": 0.0, "ic": 0.0294, "hit": 42.34, "psr": 0.1952, "bh_sharpe": 0.8888, "bh_return_pct": 26.13, "excess_sharpe": -1.8281, "precision": 0.7083, "recall": 0.1232, "f1": 0.2099, "f2": 0.1476, "accuracy": 0.4234, "mcc": 0.0622, "tp": 17, "fp": 7, "tn": 77, "fn": 121, "A_precision": 0.7083, "A_recall": 0.1232, "A_f1": 0.2099, "A_f2": 0.1476, "A_accuracy": 0.4234, "A_mcc": 0.0622, "A_tp": 17, "A_fp": 7, "A_tn": 77, "A_fn": 121}, {"fold": "fold_7", "regime": "Inflation bear, AI rally and 2025", "n": 425, "A_sharpe": -0.7688, "A_sortino": -0.7673, "A_excess_sharpe": -1.7402, "A_return_pct": -27.49, "A_hit_rate": 45.65, "A_n": 425, "A_bh_sharpe": 0.9715, "A_bh_return_pct": 37.12, "A_psr": 0.1558, "A_ic": -0.0509, "B_sharpe": 0.2508, "B_sortino": 0.2761, "B_excess_sharpe": -2.2518, "B_return_pct": 1.98, "B_hit_rate": 48.11, "B_n": 425, "B_bh_sharpe": 2.5027, "B_bh_return_pct": 458.83, "B_psr": 0.6281, "B_ic": -0.0464, "D_sharpe": -0.7688, "D_sortino": -0.7673, "D_excess_sharpe": -1.7402, "D_return_pct": -27.49, "D_hit_rate": 45.65, "D_n": 425, "D_bh_sharpe": 0.9715, "D_bh_return_pct": 37.12, "D_psr": 0.1558, "D_ic": -0.0509, "sharpe": -0.7688, "sortino": -0.7673, "return_pct": -27.49, "equity": 725.1, "max_dd": 0.0, "win_rate": 45.65, "profit_factor": 0.0, "ic": -0.0509, "hit": 45.65, "psr": 0.1558, "bh_sharpe": 0.9715, "bh_return_pct": 37.12, "excess_sharpe": -1.7402, "precision": 0.5629, "recall": 0.34, "f1": 0.4239, "f2": 0.3692, "accuracy": 0.4565, "mcc": -0.0382, "tp": 85, "fp": 66, "tn": 109, "fn": 165, "A_precision": 0.5629, "A_recall": 0.34, "A_f1": 0.4239, "A_f2": 0.3692, "A_accuracy": 0.4565, "A_mcc": -0.0382, "A_tp": 85, "A_fp": 66, "A_tn": 109, "A_fn": 165}], "per_window_val": [{"fold": "fold_1", "regime": "GFC peak crash (Lehman + Mar-2009 bottom)", "n": 104, "A_sharpe": 0.2224, "A_sortino": 0.2546, "A_excess_sharpe": 0.3897, "A_return_pct": 0.93, "A_hit_rate": 48.04, "A_n": 104, "A_bh_sharpe": -0.1672, "A_bh_return_pct": -3.81, "A_psr": 0.557, "A_ic": -0.0591, "B_sharpe": -0.1862, "B_sortino": -0.2077, "B_excess_sharpe": 2.0879, "B_return_pct": -10.01, "B_hit_rate": 46.6, "B_n": 104, "B_bh_sharpe": -2.2741, "B_bh_return_pct": -44.12, "B_psr": 0.4528, "B_ic": 0.1219, "D_sharpe": 0.2224, "D_sortino": 0.2546, "D_excess_sharpe": 0.3897, "D_return_pct": 0.93, "D_hit_rate": 48.04, "D_n": 104, "D_bh_sharpe": -0.1672, "D_bh_return_pct": -3.81, "D_psr": 0.557, "D_ic": -0.0591, "sharpe": 0.2224, "sortino": 0.2546, "return_pct": 0.93, "equity": 1009.3000000000001, "max_dd": 0.0, "win_rate": 48.04, "profit_factor": 0.0, "ic": -0.0591, "hit": 48.04, "psr": 0.557, "bh_sharpe": -0.1672, "bh_return_pct": -3.81, "excess_sharpe": 0.3897}, {"fold": "fold_2", "regime": "2011 US-downgrade + EU debt", "n": 96, "A_sharpe": -1.3615, "A_sortino": -1.3714, "A_excess_sharpe": -1.0873, "A_return_pct": -14.12, "A_hit_rate": 45.26, "A_n": 96, "A_bh_sharpe": -0.2741, "A_bh_return_pct": -4.09, "A_psr": 0.2055, "A_ic": -0.1589, "B_sharpe": -0.9685, "B_sortino": -0.9103, "B_excess_sharpe": 0.0589, "B_return_pct": -24.6, "B_hit_rate": 46.88, "B_n": 96, "B_bh_sharpe": -1.0274, "B_bh_return_pct": -25.58, "B_psr": 0.2728, "B_ic": -0.1894, "D_sharpe": -1.3615, "D_sortino": -1.3714, "D_excess_sharpe": -1.0873, "D_return_pct": -14.12, "D_hit_rate": 45.26, "D_n": 96, "D_bh_sharpe": -0.2741, "D_bh_return_pct": -4.09, "D_psr": 0.2055, "D_ic": -0.1589, "sharpe": -1.3615, "sortino": -1.3714, "return_pct": -14.12, "equity": 858.8, "max_dd": 0.0, "win_rate": 45.26, "profit_factor": 0.0, "ic": -0.1589, "hit": 45.26, "psr": 0.2055, "bh_sharpe": -0.2741, "bh_return_pct": -4.09, "excess_sharpe": -1.0873}, {"fold": "fold_3", "regime": "Taper tantrum and 2014 H1", "n": 54, "A_sharpe": 3.1453, "A_sortino": 3.1156, "A_excess_sharpe": -1.5545, "A_return_pct": 7.01, "A_hit_rate": 59.26, "A_n": 54, "A_bh_sharpe": 4.6998, "A_bh_return_pct": 10.46, "A_psr": 0.9165, "A_ic": 0.1452, "B_sharpe": 4.8659, "B_sortino": 5.1969, "B_excess_sharpe": -4.1666, "B_return_pct": 26.43, "B_hit_rate": 62.96, "B_n": 54, "B_bh_sharpe": 9.0326, "B_bh_return_pct": 49.18, "B_psr": 0.9851, "B_ic": -0.0311, "D_sharpe": 3.1453, "D_sortino": 3.1156, "D_excess_sharpe": -1.5545, "D_return_pct": 7.01, "D_hit_rate": 59.26, "D_n": 54, "D_bh_sharpe": 4.6998, "D_bh_return_pct": 10.46, "D_psr": 0.9165, "D_ic": 0.1452, "sharpe": 3.1453, "sortino": 3.1156, "return_pct": 7.01, "equity": 1070.1000000000001, "max_dd": 0.0, "win_rate": 59.26, "profit_factor": 0.0, "ic": 0.1452, "hit": 59.26, "psr": 0.9165, "bh_sharpe": 4.6998, "bh_return_pct": 10.46, "excess_sharpe": -1.5545}, {"fold": "fold_4", "regime": "China devaluation and oil crash", "n": 96, "A_sharpe": -3.8015, "A_sortino": -3.0941, "A_excess_sharpe": -3.3774, "A_return_pct": -24.22, "A_hit_rate": 42.11, "A_n": 96, "A_bh_sharpe": -0.4241, "A_bh_return_pct": -3.73, "A_psr": 0.0028, "A_ic": -0.1338, "B_sharpe": -0.0327, "B_sortino": -0.0269, "B_excess_sharpe": 1.1515, "B_return_pct": -4.42, "B_hit_rate": 55.21, "B_n": 96, "B_bh_sharpe": -1.1843, "B_bh_return_pct": -21.44, "B_psr": 0.492, "B_ic": 0.2069, "D_sharpe": -3.8015, "D_sortino": -3.0941, "D_excess_sharpe": -3.3774, "D_return_pct": -24.22, "D_hit_rate": 42.11, "D_n": 96, "D_bh_sharpe": -0.4241, "D_bh_return_pct": -3.73, "D_psr": 0.0028, "D_ic": -0.1338, "sharpe": -3.8015, "sortino": -3.0941, "return_pct": -24.22, "equity": 757.8000000000001, "max_dd": 0.0, "win_rate": 42.11, "profit_factor": 0.0, "ic": -0.1338, "hit": 42.11, "psr": 0.0028, "bh_sharpe": -0.4241, "bh_return_pct": -3.73, "excess_sharpe": -3.3774}, {"fold": "fold_5", "regime": "2018 Vol-mageddon + Q4 sell-off", "n": 54, "A_sharpe": -2.2772, "A_sortino": -1.9906, "A_excess_sharpe": -3.7052, "A_return_pct": -6.45, "A_hit_rate": 46.3, "A_n": 54, "A_bh_sharpe": 1.428, "A_bh_return_pct": 3.97, "A_psr": 0.1397, "A_ic": -0.1314, "B_sharpe": -1.9026, "B_sortino": -1.9017, "B_excess_sharpe": -6.8347, "B_return_pct": -12.57, "B_hit_rate": 40.74, "B_n": 54, "B_bh_sharpe": 4.9322, "B_bh_return_pct": 34.93, "B_psr": 0.1922, "B_ic": -0.2404, "D_sharpe": -2.2772, "D_sortino": -1.9906, "D_excess_sharpe": -3.7052, "D_return_pct": -6.45, "D_hit_rate": 46.3, "D_n": 54, "D_bh_sharpe": 1.428, "D_bh_return_pct": 3.97, "D_psr": 0.1397, "D_ic": -0.1314, "sharpe": -2.2772, "sortino": -1.9906, "return_pct": -6.45, "equity": 935.5, "max_dd": 0.0, "win_rate": 46.3, "profit_factor": 0.0, "ic": -0.1314, "hit": 46.3, "psr": 0.1397, "bh_sharpe": 1.428, "bh_return_pct": 3.97, "excess_sharpe": -3.7052}, {"fold": "fold_6", "regime": "COVID crash and V-recovery", "n": 75, "A_sharpe": -0.6877, "A_sortino": -0.703, "A_excess_sharpe": -4.9871, "A_return_pct": -2.46, "A_hit_rate": 46.67, "A_n": 75, "A_bh_sharpe": 4.2994, "A_bh_return_pct": 14.68, "A_psr": 0.3553, "A_ic": 0.1018, "B_sharpe": 8.5787, "B_sortino": 7.9865, "B_excess_sharpe": -5.7552, "B_return_pct": 74.54, "B_hit_rate": 74.67, "B_n": 75, "B_bh_sharpe": 14.3339, "B_bh_return_pct": 120.13, "B_psr": 1.0, "B_ic": -0.1196, "D_sharpe": -0.6877, "D_sortino": -0.703, "D_excess_sharpe": -4.9871, "D_return_pct": -2.46, "D_hit_rate": 46.67, "D_n": 75, "D_bh_sharpe": 4.2994, "D_bh_return_pct": 14.68, "D_psr": 0.3553, "D_ic": 0.1018, "sharpe": -0.6877, "sortino": -0.703, "return_pct": -2.46, "equity": 975.4000000000001, "max_dd": 0.0, "win_rate": 46.67, "profit_factor": 0.0, "ic": 0.1018, "hit": 46.67, "psr": 0.3553, "bh_sharpe": 4.2994, "bh_return_pct": 14.68, "excess_sharpe": -4.9871}, {"fold": "fold_7", "regime": "Inflation bear, AI rally and 2025", "n": 114, "A_sharpe": -1.147, "A_sortino": -1.1324, "A_excess_sharpe": -3.992, "A_return_pct": -8.32, "A_hit_rate": 45.61, "A_n": 114, "A_bh_sharpe": 2.845, "A_bh_return_pct": 21.34, "A_psr": 0.2212, "A_ic": 0.0452, "B_sharpe": 1.7539, "B_sortino": 2.0811, "B_excess_sharpe": -4.3828, "B_return_pct": 30.13, "B_hit_rate": 50.0, "B_n": 114, "B_bh_sharpe": 6.1366, "B_bh_return_pct": 155.03, "B_psr": 0.8852, "B_ic": -0.1541, "D_sharpe": -1.147, "D_sortino": -1.1324, "D_excess_sharpe": -3.992, "D_return_pct": -8.32, "D_hit_rate": 45.61, "D_n": 114, "D_bh_sharpe": 2.845, "D_bh_return_pct": 21.34, "D_psr": 0.2212, "D_ic": 0.0452, "sharpe": -1.147, "sortino": -1.1324, "return_pct": -8.32, "equity": 916.8000000000001, "max_dd": 0.0, "win_rate": 45.61, "profit_factor": 0.0, "ic": 0.0452, "hit": 45.61, "psr": 0.2212, "bh_sharpe": 2.845, "bh_return_pct": 21.34, "excess_sharpe": -3.992}], "status": "DISCARD", "precision": 0.5685, "recall": 0.3086, "f1": 0.4, "f2": 0.3396, "accuracy": 0.4702, "mcc": -0.0052, "tp": 249, "fp": 189, "tn": 414, "fn": 558, "test_sharpe": -0.4997, "A_sharpe": -0.4997, "A_excess_sharpe": -1.104, "A_return_pct": -61.92, "A_precision": 0.5685, "A_recall": 0.3086, "A_f1": 0.4, "A_f2": 0.3396, "A_accuracy": 0.4702, "A_mcc": -0.0052, "A_tp": 249, "A_fp": 189, "A_tn": 414, "A_fn": 558, "A_psr": 0.1195, "A_ic": -0.0369, "A_hit_rate": 46.98, "A_bh_sharpe": 0.6042, "A_bh_return_pct": 103.49}
