{"experiment_num": 52, "backbone": "mamba", "description": "dMamba @ exp 48 d_state=32 (up from 16) - SSM memory capacity test; Gu-Dao 2024 canonical range", "config": {"seq_len": 60, "lr": 0.0005, "batch_size": 32, "epochs": 100, "weight_decay": 0.1, "patience": 20, "warmup_epochs": 10, "head_dropout": 0.1, "huber_delta": 1.0, "grad_clip": 1.0, "seed": 42, "hidden_size": null, "num_layers": null, "max_depth": null, "gbm_lr": null, "n_estimators": null}, "composite": 1.3216, "test_pos_folds": 7, "val_pos_folds": 5, "val_loss": -2.8653103967683506, "elapsed_sec": 1867.9, "timestamp": "2026-04-27T20:43:17", "sharpe": 1.3216, "val_sharpe": 1.4831, "ic": 0.0737, "hit": 52.51, "psr": 0.9972, "equity": 3144.4, "return_pct": 214.44, "bh_sharpe": 1.2201, "bh_return_pct": 185.59, "excess_sharpe": 0.1015, "B_sharpe": -0.8373, "B_excess_sharpe": -3.6757, "B_return_pct": -87.69, "D_sharpe": 1.3216, "D_excess_sharpe": 0.1015, "D_return_pct": 214.44, "per_window": [{"fold": "fold_1", "regime": "GFC peak crash (Lehman + Mar-2009 bottom)", "n": 65, "A_sharpe": 1.4185, "A_sortino": 1.5231, "A_excess_sharpe": 0.9923, "A_return_pct": 12.64, "A_hit_rate": 53.85, "A_n": 65, "A_bh_sharpe": 0.4262, "A_bh_return_pct": 2.34, "A_psr": 0.7652, "A_ic": 0.1738, "B_sharpe": 1.5037, "B_sortino": 1.5181, "B_excess_sharpe": -0.384, "B_return_pct": 24.69, "B_hit_rate": 53.12, "B_n": 65, "B_bh_sharpe": 1.8877, "B_bh_return_pct": 34.48, "B_psr": 0.7739, "B_ic": 0.1565, "D_sharpe": 1.4185, "D_sortino": 1.5231, "D_excess_sharpe": 0.9923, "D_return_pct": 12.64, "D_hit_rate": 53.85, "D_n": 65, "D_bh_sharpe": 0.4262, "D_bh_return_pct": 2.34, "D_psr": 0.7652, "D_ic": 0.1738, "sharpe": 1.4185, "sortino": 1.5231, "return_pct": 12.64, "equity": 1126.4, "max_dd": 0.0, "win_rate": 53.85, "profit_factor": 0.0, "ic": 0.1738, "hit": 53.85, "psr": 0.7652, "bh_sharpe": 0.4262, "bh_return_pct": 2.34, "excess_sharpe": 0.9923, "precision": 0.55, "recall": 0.6471, "f1": 0.5946, "f2": 0.625, "accuracy": 0.5385, "mcc": 0.0682, "tp": 22, "fp": 18, "tn": 13, "fn": 12, "A_precision": 0.55, "A_recall": 0.6471, "A_f1": 0.5946, "A_f2": 0.625, "A_accuracy": 0.5385, "A_mcc": 0.0682, "A_tp": 22, "A_fp": 18, "A_tn": 13, "A_fn": 12}, {"fold": "fold_2", "regime": "2011 US-downgrade + EU debt", "n": 86, "A_sharpe": 4.2076, "A_sortino": 5.1606, "A_excess_sharpe": -0.6607, "A_return_pct": 23.93, "A_hit_rate": 60.0, "A_n": 86, "A_bh_sharpe": 4.8682, "A_bh_return_pct": 27.91, "A_psr": 0.9963, "A_ic": 0.4401, "B_sharpe": -0.2282, "B_sortino": -0.248, "B_excess_sharpe": -11.5473, "B_return_pct": -4.53, "B_hit_rate": 45.35, "B_n": 86, "B_bh_sharpe": 11.3191, "B_bh_return_pct": 186.84, "B_psr": 0.4474, "B_ic": 0.236, "D_sharpe": 4.2076, "D_sortino": 5.1606, "D_excess_sharpe": -0.6607, "D_return_pct": 23.93, "D_hit_rate": 60.0, "D_n": 86, "D_bh_sharpe": 4.8682, "D_bh_return_pct": 27.91, "D_psr": 0.9963, "D_ic": 0.4401, "sharpe": 4.2076, "sortino": 5.1606, "return_pct": 23.93, "equity": 1239.3000000000002, "max_dd": 0.0, "win_rate": 60.0, "profit_factor": 0.0, "ic": 0.4401, "hit": 60.0, "psr": 0.9963, "bh_sharpe": 4.8682, "bh_return_pct": 27.91, "excess_sharpe": -0.6607, "precision": 0.7879, "recall": 0.4906, "f1": 0.6047, "f2": 0.5306, "accuracy": 0.6047, "mcc": 0.2784, "tp": 26, "fp": 7, "tn": 26, "fn": 27, "A_precision": 0.7879, "A_recall": 0.4906, "A_f1": 0.6047, "A_f2": 0.5306, "A_accuracy": 0.6047, "A_mcc": 0.2784, "A_tp": 26, "A_fp": 7, "A_tn": 26, "A_fn": 27}, {"fold": "fold_3", "regime": "Taper tantrum and 2014 H1", "n": 128, "A_sharpe": 3.4674, "A_sortino": 4.7687, "A_excess_sharpe": 1.4085, "A_return_pct": 23.89, "A_hit_rate": 53.54, "A_n": 128, "A_bh_sharpe": 2.0589, "A_bh_return_pct": 13.6, "A_psr": 0.9968, "A_ic": 0.1681, "B_sharpe": -4.3552, "B_sortino": -3.8712, "B_excess_sharpe": -8.8668, "B_return_pct": -41.19, "B_hit_rate": 39.84, "B_n": 128, "B_bh_sharpe": 4.5116, "B_bh_return_pct": 67.92, "B_psr": 0.001, "B_ic": -0.3011, "D_sharpe": 3.4674, "D_sortino": 4.7687, "D_excess_sharpe": 1.4085, "D_return_pct": 23.89, "D_hit_rate": 53.54, "D_n": 128, "D_bh_sharpe": 2.0589, "D_bh_return_pct": 13.6, "D_psr": 0.9968, "D_ic": 0.1681, "sharpe": 3.4674, "sortino": 4.7687, "return_pct": 23.89, "equity": 1238.9, "max_dd": 0.0, "win_rate": 53.54, "profit_factor": 0.0, "ic": 0.1681, "hit": 53.54, "psr": 0.9968, "bh_sharpe": 2.0589, "bh_return_pct": 13.6, "excess_sharpe": 1.4085, "precision": 0.6234, "recall": 0.6154, "f1": 0.6194, "f2": 0.617, "accuracy": 0.5391, "mcc": 0.0353, "tp": 48, "fp": 29, "tn": 21, "fn": 30, "A_precision": 0.6234, "A_recall": 0.6154, "A_f1": 0.6194, "A_f2": 0.617, "A_accuracy": 0.5391, "A_mcc": 0.0353, "A_tp": 48, "A_fp": 29, "A_tn": 21, "A_fn": 30}, {"fold": "fold_4", "regime": "China devaluation and oil crash", "n": 107, "A_sharpe": 0.0264, "A_sortino": 0.0236, "A_excess_sharpe": 0.8296, "A_return_pct": -0.66, "A_hit_rate": 52.83, "A_n": 107, "A_bh_sharpe": -0.8032, "A_bh_return_pct": -7.58, "A_psr": 0.5068, "A_ic": 0.0414, "B_sharpe": -1.2303, "B_sortino": -1.252, "B_excess_sharpe": 0.7293, "B_return_pct": -23.82, "B_hit_rate": 42.99, "B_n": 107, "B_bh_sharpe": -1.9596, "B_bh_return_pct": -33.47, "B_psr": 0.2131, "B_ic": -0.0617, "D_sharpe": 0.0264, "D_sortino": 0.0236, "D_excess_sharpe": 0.8296, "D_return_pct": -0.66, "D_hit_rate": 52.83, "D_n": 107, "D_bh_sharpe": -0.8032, "D_bh_return_pct": -7.58, "D_psr": 0.5068, "D_ic": 0.0414, "sharpe": 0.0264, "sortino": 0.0236, "return_pct": -0.66, "equity": 993.4, "max_dd": 0.0, "win_rate": 52.83, "profit_factor": 0.0, "ic": 0.0414, "hit": 52.83, "psr": 0.5068, "bh_sharpe": -0.8032, "bh_return_pct": -7.58, "excess_sharpe": 0.8296, "precision": 0.5172, "recall": 0.5769, "f1": 0.5455, "f2": 0.5639, "accuracy": 0.5327, "mcc": 0.068, "tp": 30, "fp": 28, "tn": 27, "fn": 22, "A_precision": 0.5172, "A_recall": 0.5769, "A_f1": 0.5455, "A_f2": 0.5639, "A_accuracy": 0.5327, "A_mcc": 0.068, "A_tp": 30, "A_fp": 28, "A_tn": 27, "A_fn": 22}, {"fold": "fold_5", "regime": "2018 Vol-mageddon + Q4 sell-off", "n": 127, "A_sharpe": 2.5159, "A_sortino": 2.7174, "A_excess_sharpe": 1.3328, "A_return_pct": 32.77, "A_hit_rate": 56.69, "A_n": 127, "A_bh_sharpe": 1.183, "A_bh_return_pct": 13.55, "A_psr": 0.9644, "A_ic": 0.1618, "B_sharpe": 0.9862, "B_sortino": 1.009, "B_excess_sharpe": -1.9194, "B_return_pct": 19.36, "B_hit_rate": 53.17, "B_n": 127, "B_bh_sharpe": 2.9056, "B_bh_return_pct": 85.51, "B_psr": 0.7572, "B_ic": 0.0926, "D_sharpe": 2.5159, "D_sortino": 2.7174, "D_excess_sharpe": 1.3328, "D_return_pct": 32.77, "D_hit_rate": 56.69, "D_n": 127, "D_bh_sharpe": 1.183, "D_bh_return_pct": 13.55, "D_psr": 0.9644, "D_ic": 0.1618, "sharpe": 2.5159, "sortino": 2.7174, "return_pct": 32.77, "equity": 1327.7, "max_dd": 0.0, "win_rate": 56.69, "profit_factor": 0.0, "ic": 0.1618, "hit": 56.69, "psr": 0.9644, "bh_sharpe": 1.183, "bh_return_pct": 13.55, "excess_sharpe": 1.3328, "precision": 0.6716, "recall": 0.5769, "f1": 0.6207, "f2": 0.5937, "accuracy": 0.5669, "mcc": 0.1248, "tp": 45, "fp": 22, "tn": 27, "fn": 33, "A_precision": 0.6716, "A_recall": 0.5769, "A_f1": 0.6207, "A_f2": 0.5937, "A_accuracy": 0.5669, "A_mcc": 0.1248, "A_tp": 45, "A_fp": 22, "A_tn": 27, "A_fn": 33}, {"fold": "fold_6", "regime": "COVID crash and V-recovery", "n": 172, "A_sharpe": 1.3832, "A_sortino": 1.6583, "A_excess_sharpe": -1.0444, "A_return_pct": 23.18, "A_hit_rate": 48.26, "A_n": 172, "A_bh_sharpe": 2.4276, "A_bh_return_pct": 45.89, "A_psr": 0.8778, "A_ic": 0.0511, "B_sharpe": -3.1208, "B_sortino": -3.3875, "B_excess_sharpe": -8.8328, "B_return_pct": -68.26, "B_hit_rate": 33.92, "B_n": 172, "B_bh_sharpe": 5.712, "B_bh_return_pct": 489.18, "B_psr": 0.0089, "B_ic": -0.212, "D_sharpe": 1.3832, "D_sortino": 1.6583, "D_excess_sharpe": -1.0444, "D_return_pct": 23.18, "D_hit_rate": 48.26, "D_n": 172, "D_bh_sharpe": 2.4276, "D_bh_return_pct": 45.89, "D_psr": 0.8778, "D_ic": 0.0511, "sharpe": 1.3832, "sortino": 1.6583, "return_pct": 23.18, "equity": 1231.8, "max_dd": 0.0, "win_rate": 48.26, "profit_factor": 0.0, "ic": 0.0511, "hit": 48.26, "psr": 0.8778, "bh_sharpe": 2.4276, "bh_return_pct": 45.89, "excess_sharpe": -1.0444, "precision": 0.6935, "recall": 0.3805, "f1": 0.4914, "f2": 0.4183, "accuracy": 0.4826, "mcc": 0.0578, "tp": 43, "fp": 19, "tn": 40, "fn": 70, "A_precision": 0.6935, "A_recall": 0.3805, "A_f1": 0.4914, "A_f2": 0.4183, "A_accuracy": 0.4826, "A_mcc": 0.0578, "A_tp": 43, "A_fp": 19, "A_tn": 40, "A_fn": 70}, {"fold": "fold_7", "regime": "Inflation bear, AI rally and 2025", "n": 375, "A_sharpe": 0.4479, "A_sortino": 0.4869, "A_excess_sharpe": -0.3425, "A_return_pct": 11.92, "A_hit_rate": 50.67, "A_n": 375, "A_bh_sharpe": 0.7905, "A_bh_return_pct": 25.44, "A_psr": 0.7104, "A_ic": 0.0348, "B_sharpe": -0.4833, "B_sortino": -0.5351, "B_excess_sharpe": -2.4171, "B_return_pct": -39.07, "B_hit_rate": 44.65, "B_n": 375, "B_bh_sharpe": 1.9338, "B_bh_return_pct": 221.94, "B_psr": 0.2797, "B_ic": -0.0735, "D_sharpe": 0.4479, "D_sortino": 0.4869, "D_excess_sharpe": -0.3425, "D_return_pct": 11.92, "D_hit_rate": 50.67, "D_n": 375, "D_bh_sharpe": 0.7905, "D_bh_return_pct": 25.44, "D_psr": 0.7104, "D_ic": 0.0348, "sharpe": 0.4479, "sortino": 0.4869, "return_pct": 11.92, "equity": 1119.2, "max_dd": 0.0, "win_rate": 50.67, "profit_factor": 0.0, "ic": 0.0348, "hit": 50.67, "psr": 0.7104, "bh_sharpe": 0.7905, "bh_return_pct": 25.44, "excess_sharpe": -0.3425, "precision": 0.6101, "recall": 0.4409, "f1": 0.5119, "f2": 0.4668, "accuracy": 0.5067, "mcc": 0.0408, "tp": 97, "fp": 62, "tn": 93, "fn": 123, "A_precision": 0.6101, "A_recall": 0.4409, "A_f1": 0.5119, "A_f2": 0.4668, "A_accuracy": 0.5067, "A_mcc": 0.0408, "A_tp": 97, "A_fp": 62, "A_tn": 93, "A_fn": 123}], "per_window_val": [{"fold": "fold_1", "regime": "GFC peak crash (Lehman + Mar-2009 bottom)", "n": 37, "A_sharpe": 5.6402, "A_sortino": 6.2557, "A_excess_sharpe": 4.8818, "A_return_pct": 21.5, "A_hit_rate": 62.86, "A_n": 37, "A_bh_sharpe": 0.7585, "A_bh_return_pct": 2.39, "A_psr": 0.9835, "A_ic": 0.2072, "B_sharpe": 0.0545, "B_sortino": 0.0559, "B_excess_sharpe": -2.0902, "B_return_pct": -0.87, "B_hit_rate": 54.05, "B_n": 37, "B_bh_sharpe": 2.1447, "B_bh_return_pct": 12.13, "B_psr": 0.5082, "B_ic": 0.0782, "D_sharpe": 5.6402, "D_sortino": 6.2557, "D_excess_sharpe": 4.8818, "D_return_pct": 21.5, "D_hit_rate": 62.86, "D_n": 37, "D_bh_sharpe": 0.7585, "D_bh_return_pct": 2.39, "D_psr": 0.9835, "D_ic": 0.2072, "sharpe": 5.6402, "sortino": 6.2557, "return_pct": 21.5, "equity": 1215.0, "max_dd": 0.0, "win_rate": 62.86, "profit_factor": 0.0, "ic": 0.2072, "hit": 62.86, "psr": 0.9835, "bh_sharpe": 0.7585, "bh_return_pct": 2.39, "excess_sharpe": 4.8818}, {"fold": "fold_2", "regime": "2011 US-downgrade + EU debt", "n": 46, "A_sharpe": 1.3837, "A_sortino": 1.4374, "A_excess_sharpe": 1.4376, "A_return_pct": 8.0, "A_hit_rate": 52.17, "A_n": 46, "A_bh_sharpe": -0.0539, "A_bh_return_pct": -1.46, "A_psr": 0.7191, "A_ic": 0.1577, "B_sharpe": 4.2247, "B_sortino": 5.3579, "B_excess_sharpe": 5.766, "B_return_pct": 67.17, "B_hit_rate": 56.52, "B_n": 46, "B_bh_sharpe": -1.5413, "B_bh_return_pct": -23.36, "B_psr": 0.9694, "B_ic": 0.3573, "D_sharpe": 1.3837, "D_sortino": 1.4374, "D_excess_sharpe": 1.4376, "D_return_pct": 8.0, "D_hit_rate": 52.17, "D_n": 46, "D_bh_sharpe": -0.0539, "D_bh_return_pct": -1.46, "D_psr": 0.7191, "D_ic": 0.1577, "sharpe": 1.3837, "sortino": 1.4374, "return_pct": 8.0, "equity": 1080.0, "max_dd": 0.0, "win_rate": 52.17, "profit_factor": 0.0, "ic": 0.1577, "hit": 52.17, "psr": 0.7191, "bh_sharpe": -0.0539, "bh_return_pct": -1.46, "excess_sharpe": 1.4376}, {"fold": "fold_3", "regime": "Taper tantrum and 2014 H1", "n": 4, "A_sharpe": 8.1652, "A_sortino": 8.617, "A_excess_sharpe": 1.8427, "A_return_pct": 0.0, "A_hit_rate": 0.0, "A_n": 4, "A_bh_sharpe": 6.3226, "A_bh_return_pct": 0.58, "A_psr": 0.8221, "A_ic": 0.8, "B_sharpe": 14.1626, "B_sortino": 32.5623, "B_excess_sharpe": 37.6039, "B_return_pct": 0.0, "B_hit_rate": 0.0, "B_n": 4, "B_bh_sharpe": -23.4413, "B_bh_return_pct": -3.13, "B_psr": 0.9725, "B_ic": 0.8, "D_sharpe": 8.1652, "D_sortino": 8.617, "D_excess_sharpe": 1.8427, "D_return_pct": 0.0, "D_hit_rate": 0.0, "D_n": 4, "D_bh_sharpe": 6.3226, "D_bh_return_pct": 0.58, "D_psr": 0.8221, "D_ic": 0.8, "sharpe": 8.1652, "sortino": 8.617, "return_pct": 0.0, "equity": 1000.0, "max_dd": 0.0, "win_rate": 0.0, "profit_factor": 0.0, "ic": 0.8, "hit": 0.0, "psr": 0.8221, "bh_sharpe": 6.3226, "bh_return_pct": 0.58, "excess_sharpe": 1.8427}, {"fold": "fold_4", "regime": "China devaluation and oil crash", "n": 46, "A_sharpe": -1.5033, "A_sortino": -1.5251, "A_excess_sharpe": -0.3011, "A_return_pct": -6.92, "A_hit_rate": 41.3, "A_n": 46, "A_bh_sharpe": -1.2022, "A_bh_return_pct": -5.68, "A_psr": 0.2639, "A_ic": -0.1534, "B_sharpe": 1.5525, "B_sortino": 1.524, "B_excess_sharpe": 3.8643, "B_return_pct": 14.46, "B_hit_rate": 54.35, "B_n": 46, "B_bh_sharpe": -2.3118, "B_bh_return_pct": -24.51, "B_psr": 0.7404, "B_ic": 0.3372, "D_sharpe": -1.5033, "D_sortino": -1.5251, "D_excess_sharpe": -0.3011, "D_return_pct": -6.92, "D_hit_rate": 41.3, "D_n": 46, "D_bh_sharpe": -1.2022, "D_bh_return_pct": -5.68, "D_psr": 0.2639, "D_ic": -0.1534, "sharpe": -1.5033, "sortino": -1.5251, "return_pct": -6.92, "equity": 930.8, "max_dd": 0.0, "win_rate": 41.3, "profit_factor": 0.0, "ic": -0.1534, "hit": 41.3, "psr": 0.2639, "bh_sharpe": -1.2022, "bh_return_pct": -5.68, "excess_sharpe": -0.3011}, {"fold": "fold_5", "regime": "2018 Vol-mageddon + Q4 sell-off", "n": 4, "A_sharpe": -1.5091, "A_sortino": -1.4061, "A_excess_sharpe": 13.246, "A_return_pct": -0.53, "A_hit_rate": 50.0, "A_n": 4, "A_bh_sharpe": -14.7551, "A_bh_return_pct": -3.52, "A_psr": 0.4347, "A_ic": 1.0, "B_sharpe": 20.3467, "B_sortino": 104.8151, "B_excess_sharpe": 18.1901, "B_return_pct": 0.0, "B_hit_rate": 0.0, "B_n": 4, "B_bh_sharpe": 2.1566, "B_bh_return_pct": 1.19, "B_psr": 0.9993, "B_ic": 1.0, "D_sharpe": -1.5091, "D_sortino": -1.4061, "D_excess_sharpe": 13.246, "D_return_pct": -0.53, "D_hit_rate": 50.0, "D_n": 4, "D_bh_sharpe": -14.7551, "D_bh_return_pct": -3.52, "D_psr": 0.4347, "D_ic": 1.0, "sharpe": -1.5091, "sortino": -1.4061, "return_pct": -0.53, "equity": 994.7, "max_dd": 0.0, "win_rate": 50.0, "profit_factor": 0.0, "ic": 1.0, "hit": 50.0, "psr": 0.4347, "bh_sharpe": -14.7551, "bh_return_pct": -3.52, "excess_sharpe": 13.246}, {"fold": "fold_6", "regime": "COVID crash and V-recovery", "n": 25, "A_sharpe": 0.3704, "A_sortino": 0.3605, "A_excess_sharpe": -2.0434, "A_return_pct": 0.42, "A_hit_rate": 52.0, "A_n": 25, "A_bh_sharpe": 2.4138, "A_bh_return_pct": 3.27, "A_psr": 0.5454, "A_ic": 0.1977, "B_sharpe": -1.0136, "B_sortino": -1.0886, "B_excess_sharpe": -13.5791, "B_return_pct": -3.33, "B_hit_rate": 40.0, "B_n": 25, "B_bh_sharpe": 12.5655, "B_bh_return_pct": 32.76, "B_psr": 0.3776, "B_ic": 0.1931, "D_sharpe": 0.3704, "D_sortino": 0.3605, "D_excess_sharpe": -2.0434, "D_return_pct": 0.42, "D_hit_rate": 52.0, "D_n": 25, "D_bh_sharpe": 2.4138, "D_bh_return_pct": 3.27, "D_psr": 0.5454, "D_ic": 0.1977, "sharpe": 0.3704, "sortino": 0.3605, "return_pct": 0.42, "equity": 1004.1999999999999, "max_dd": 0.0, "win_rate": 52.0, "profit_factor": 0.0, "ic": 0.1977, "hit": 52.0, "psr": 0.5454, "bh_sharpe": 2.4138, "bh_return_pct": 3.27, "excess_sharpe": -2.0434}, {"fold": "fold_7", "regime": "Inflation bear, AI rally and 2025", "n": 64, "A_sharpe": 2.2828, "A_sortino": 2.533, "A_excess_sharpe": 0.2419, "A_return_pct": 8.94, "A_hit_rate": 56.25, "A_n": 64, "A_bh_sharpe": 2.0409, "A_bh_return_pct": 7.94, "A_psr": 0.8781, "A_ic": 0.1257, "B_sharpe": -2.4069, "B_sortino": -2.1671, "B_excess_sharpe": -7.8161, "B_return_pct": -17.43, "B_hit_rate": 48.44, "B_n": 64, "B_bh_sharpe": 5.4092, "B_bh_return_pct": 45.7, "B_psr": 0.1147, "B_ic": -0.1226, "D_sharpe": 2.2828, "D_sortino": 2.533, "D_excess_sharpe": 0.2419, "D_return_pct": 8.94, "D_hit_rate": 56.25, "D_n": 64, "D_bh_sharpe": 2.0409, "D_bh_return_pct": 7.94, "D_psr": 0.8781, "D_ic": 0.1257, "sharpe": 2.2828, "sortino": 2.533, "return_pct": 8.94, "equity": 1089.3999999999999, "max_dd": 0.0, "win_rate": 56.25, "profit_factor": 0.0, "ic": 0.1257, "hit": 56.25, "psr": 0.8781, "bh_sharpe": 2.0409, "bh_return_pct": 7.94, "excess_sharpe": 0.2419}], "status": "KEEP", "precision": 0.627, "recall": 0.4952, "f1": 0.5534, "f2": 0.517, "accuracy": 0.5264, "mcc": 0.066, "tp": 311, "fp": 185, "tn": 247, "fn": 317, "test_sharpe": 1.3216, "A_sharpe": 1.3216, "A_excess_sharpe": 0.1015, "A_return_pct": 214.44, "A_precision": 0.627, "A_recall": 0.4952, "A_f1": 0.5534, "A_f2": 0.517, "A_accuracy": 0.5264, "A_mcc": 0.066, "A_tp": 311, "A_fp": 185, "A_tn": 247, "A_fn": 317, "A_psr": 0.9972, "A_ic": 0.0737, "A_hit_rate": 52.51, "A_bh_sharpe": 1.2201, "A_bh_return_pct": 185.59}
