{"experiment_num": 91, "backbone": "lightgbm", "description": "LightGBM @ exp 10 n_est=500 (down from 1000) - capacity sweet-spot test between 300 and 1000", "config": {"seq_len": 60, "lr": 0.0003, "batch_size": 32, "epochs": 50, "weight_decay": 1e-05, "patience": 10, "warmup_epochs": 0, "head_dropout": 0.1, "huber_delta": 1.0, "grad_clip": 1.0, "seed": 42, "hidden_size": null, "num_layers": null, "max_depth": 4, "gbm_lr": 0.01, "n_estimators": 500}, "composite": -0.7554, "test_pos_folds": 5, "val_pos_folds": 4, "val_loss": null, "elapsed_sec": 117.6, "timestamp": "2026-04-27T23:41:09", "sharpe": 0.7433, "val_sharpe": -0.5554, "ic": 0.0283, "hit": 48.5, "psr": 0.9401, "equity": 1827.0, "return_pct": 82.7, "bh_sharpe": 1.2194, "bh_return_pct": 187.05, "excess_sharpe": -0.4761, "B_sharpe": 0.2965, "B_excess_sharpe": -2.5316, "B_return_pct": 13.67, "D_sharpe": 0.1018, "D_excess_sharpe": -1.1176, "D_return_pct": -0.97, "precision": 0.5928, "recall": 0.4193, "f1": 0.4912, "f2": 0.4454, "mcc": 0.0009, "accuracy": 0.4855, "val_precision": 0.5082, "val_recall": 0.7099, "val_f1": 0.5924, "val_f2": 0.6577, "val_mcc": 0.0134, "val_accuracy": 0.5077, "per_window": [{"fold": "fold_1", "regime": "GFC peak crash (Lehman + Mar-2009 bottom)", "n": 66, "A_sharpe": 0.4451, "A_sortino": 0.523, "A_excess_sharpe": -0.127, "A_return_pct": 2.57, "A_hit_rate": 40.91, "A_n": 66, "A_bh_sharpe": 0.5721, "A_bh_return_pct": 3.85, "A_psr": 0.5897, "A_ic": -0.0344, "A_precision": 0.4375, "A_recall": 0.4, "A_f1": 0.4179, "A_f2": 0.407, "A_accuracy": 0.4091, "A_mcc": -0.1804, "A_tp": 14, "A_fp": 18, "A_tn": 13, "A_fn": 21, "B_sharpe": 1.2471, "B_sortino": 1.3399, "B_excess_sharpe": -0.7999, "B_return_pct": 18.88, "B_hit_rate": 49.23, "B_n": 66, "B_bh_sharpe": 2.0469, "B_bh_return_pct": 39.28, "B_psr": 0.7369, "B_ic": 0.3043, "B_precision": 0.6364, "B_recall": 0.1944, "B_f1": 0.2979, "B_f2": 0.2258, "B_accuracy": 0.5, "B_mcc": 0.0816, "B_tp": 7, "B_fp": 4, "B_tn": 26, "B_fn": 29, "D_sharpe": 0.2311, "D_sortino": 0.241, "D_excess_sharpe": -0.3411, "D_return_pct": 0.43, "D_hit_rate": 48.48, "D_n": 66, "D_bh_sharpe": 0.5721, "D_bh_return_pct": 3.85, "D_psr": 0.5467, "D_ic": 0.1266, "D_precision": 0.5455, "D_recall": 0.1714, "D_f1": 0.2609, "D_f2": 0.1987, "D_accuracy": 0.4848, "D_mcc": 0.0136, "D_tp": 6, "D_fp": 5, "D_tn": 26, "D_fn": 29, "sharpe": 0.4451, "sortino": 0.523, "return_pct": 2.57, "equity": 1025.7, "max_dd": 0.0, "win_rate": 40.91, "profit_factor": 0.0, "ic": -0.0344, "hit": 40.91, "psr": 0.5897, "bh_sharpe": 0.5721, "bh_return_pct": 3.85, "excess_sharpe": -0.127, "precision": 0.4375, "recall": 0.4, "f1": 0.4179, "f2": 0.407, "mcc": -0.1804, "accuracy": 0.4091, "tp": 14, "fp": 18, "tn": 13, "fn": 21}, {"fold": "fold_2", "regime": "2011 US-downgrade + EU debt", "n": 87, "A_sharpe": 2.0114, "A_sortino": 2.6181, "A_excess_sharpe": -3.0106, "A_return_pct": 11.0, "A_hit_rate": 50.0, "A_n": 87, "A_bh_sharpe": 5.022, "A_bh_return_pct": 29.23, "A_psr": 0.8952, "A_ic": 0.0493, "A_precision": 0.5932, "A_recall": 0.6481, "A_f1": 0.6195, "A_f2": 0.6364, "A_accuracy": 0.5057, "A_mcc": -0.0822, "A_tp": 35, "A_fp": 24, "A_tn": 9, "A_fn": 19, "B_sharpe": 7.9573, "B_sortino": 8.5922, "B_excess_sharpe": -3.1796, "B_return_pct": 125.68, "B_hit_rate": 72.41, "B_n": 87, "B_bh_sharpe": 11.1369, "B_bh_return_pct": 185.4, "B_psr": 1.0, "B_ic": 0.207, "B_precision": 0.8571, "B_recall": 0.8108, "B_f1": 0.8333, "B_f2": 0.8197, "B_accuracy": 0.7241, "B_mcc": 0.0374, "B_tp": 60, "B_fp": 10, "B_tn": 3, "B_fn": 14, "D_sharpe": 3.8816, "D_sortino": 4.7414, "D_excess_sharpe": -1.1404, "D_return_pct": 22.26, "D_hit_rate": 61.63, "D_n": 87, "D_bh_sharpe": 5.022, "D_bh_return_pct": 29.23, "D_psr": 0.994, "D_ic": 0.0859, "D_precision": 0.6429, "D_recall": 0.8333, "D_f1": 0.7258, "D_f2": 0.7867, "D_accuracy": 0.6092, "D_mcc": 0.0927, "D_tp": 45, "D_fp": 25, "D_tn": 8, "D_fn": 9, "sharpe": 2.0114, "sortino": 2.6181, "return_pct": 11.0, "equity": 1110.0, "max_dd": 0.0, "win_rate": 50.0, "profit_factor": 0.0, "ic": 0.0493, "hit": 50.0, "psr": 0.8952, "bh_sharpe": 5.022, "bh_return_pct": 29.23, "excess_sharpe": -3.0106, "precision": 0.5932, "recall": 0.6481, "f1": 0.6195, "f2": 0.6364, "mcc": -0.0822, "accuracy": 0.5057, "tp": 35, "fp": 24, "tn": 9, "fn": 19}, {"fold": "fold_3", "regime": "Taper tantrum and 2014 H1", "n": 129, "A_sharpe": 1.1531, "A_sortino": 1.0677, "A_excess_sharpe": -0.6147, "A_return_pct": 7.4, "A_hit_rate": 54.69, "A_n": 129, "A_bh_sharpe": 1.7678, "A_bh_return_pct": 11.76, "A_psr": 0.7882, "A_ic": 0.0595, "A_precision": 0.596, "A_recall": 0.7564, "A_f1": 0.6667, "A_f2": 0.7178, "A_accuracy": 0.5426, "A_mcc": -0.0323, "A_tp": 59, "A_fp": 40, "A_tn": 11, "A_fn": 19, "B_sharpe": 2.8962, "B_sortino": 2.9774, "B_excess_sharpe": -1.3512, "B_return_pct": 40.4, "B_hit_rate": 58.14, "B_n": 129, "B_bh_sharpe": 4.2474, "B_bh_return_pct": 64.1, "B_psr": 0.9788, "B_ic": -0.0285, "B_precision": 0.625, "B_recall": 0.8537, "B_f1": 0.7216, "B_f2": 0.7955, "B_accuracy": 0.5814, "B_mcc": -0.0569, "B_tp": 70, "B_fp": 42, "B_tn": 5, "B_fn": 12, "D_sharpe": 1.5183, "D_sortino": 1.3672, "D_excess_sharpe": -0.2495, "D_return_pct": 9.98, "D_hit_rate": 57.03, "D_n": 129, "D_bh_sharpe": 1.7678, "D_bh_return_pct": 11.76, "D_psr": 0.8509, "D_ic": 0.1486, "D_precision": 0.5982, "D_recall": 0.859, "D_f1": 0.7053, "D_f2": 0.7901, "D_accuracy": 0.5659, "D_mcc": -0.0338, "D_tp": 67, "D_fp": 45, "D_tn": 6, "D_fn": 11, "sharpe": 1.1531, "sortino": 1.0677, "return_pct": 7.4, "equity": 1074.0, "max_dd": 0.0, "win_rate": 54.69, "profit_factor": 0.0, "ic": 0.0595, "hit": 54.69, "psr": 0.7882, "bh_sharpe": 1.7678, "bh_return_pct": 11.76, "excess_sharpe": -0.6147, "precision": 0.596, "recall": 0.7564, "f1": 0.6667, "f2": 0.7178, "mcc": -0.0323, "accuracy": 0.5426, "tp": 59, "fp": 40, "tn": 11, "fn": 19}, {"fold": "fold_4", "regime": "China devaluation and oil crash", "n": 108, "A_sharpe": -1.2606, "A_sortino": -1.1997, "A_excess_sharpe": -0.5708, "A_return_pct": -11.23, "A_hit_rate": 45.79, "A_n": 108, "A_bh_sharpe": -0.6898, "A_bh_return_pct": -6.71, "A_psr": 0.2038, "A_ic": -0.0084, "A_precision": 0.4561, "A_recall": 0.4906, "A_f1": 0.4727, "A_f2": 0.4833, "A_accuracy": 0.463, "A_mcc": -0.0732, "A_tp": 26, "A_fp": 31, "A_tn": 24, "A_fn": 27, "B_sharpe": -3.4473, "B_sortino": -3.0688, "B_excess_sharpe": -1.4898, "B_return_pct": -49.23, "B_hit_rate": 41.67, "B_n": 108, "B_bh_sharpe": -1.9575, "B_bh_return_pct": -33.56, "B_psr": 0.0102, "B_ic": -0.1622, "B_precision": 0.4062, "B_recall": 0.5098, "B_f1": 0.4522, "B_f2": 0.4851, "B_accuracy": 0.4167, "B_mcc": -0.1594, "B_tp": 26, "B_fp": 38, "B_tn": 19, "B_fn": 25, "D_sharpe": -2.5684, "D_sortino": -2.3176, "D_excess_sharpe": -1.8787, "D_return_pct": -20.65, "D_hit_rate": 43.93, "D_n": 108, "D_bh_sharpe": -0.6898, "D_bh_return_pct": -6.71, "D_psr": 0.0431, "D_ic": -0.0693, "D_precision": 0.4375, "D_recall": 0.5283, "D_f1": 0.4786, "D_f2": 0.5072, "D_accuracy": 0.4352, "D_mcc": -0.1284, "D_tp": 28, "D_fp": 36, "D_tn": 19, "D_fn": 25, "sharpe": -1.2606, "sortino": -1.1997, "return_pct": -11.23, "equity": 887.6999999999999, "max_dd": 0.0, "win_rate": 45.79, "profit_factor": 0.0, "ic": -0.0084, "hit": 45.79, "psr": 0.2038, "bh_sharpe": -0.6898, "bh_return_pct": -6.71, "excess_sharpe": -0.5708, "precision": 0.4561, "recall": 0.4906, "f1": 0.4727, "f2": 0.4833, "mcc": -0.0732, "accuracy": 0.463, "tp": 26, "fp": 31, "tn": 24, "fn": 27}, {"fold": "fold_5", "regime": "2018 Vol-mageddon + Q4 sell-off", "n": 128, "A_sharpe": -1.3009, "A_sortino": -1.3924, "A_excess_sharpe": -2.452, "A_return_pct": -15.64, "A_hit_rate": 42.19, "A_n": 128, "A_bh_sharpe": 1.1511, "A_bh_return_pct": 13.19, "A_psr": 0.1837, "A_ic": -0.049, "A_precision": 0.5333, "A_recall": 0.4103, "A_f1": 0.4638, "A_f2": 0.4301, "A_accuracy": 0.4219, "A_mcc": -0.1464, "A_tp": 32, "A_fp": 28, "A_tn": 22, "A_fn": 46, "B_sharpe": -2.6396, "B_sortino": -2.6194, "B_excess_sharpe": -5.4515, "B_return_pct": -48.95, "B_hit_rate": 38.58, "B_n": 128, "B_bh_sharpe": 2.8119, "B_bh_return_pct": 82.25, "B_psr": 0.0315, "B_ic": -0.0644, "B_precision": 0.5574, "B_recall": 0.4, "B_f1": 0.4658, "B_f2": 0.4239, "B_accuracy": 0.3906, "B_mcc": -0.2155, "B_tp": 34, "B_fp": 27, "B_tn": 16, "B_fn": 51, "D_sharpe": -1.0639, "D_sortino": -1.1927, "D_excess_sharpe": -2.215, "D_return_pct": -13.22, "D_hit_rate": 42.97, "D_n": 128, "D_bh_sharpe": 1.1511, "D_bh_return_pct": 13.19, "D_psr": 0.2315, "D_ic": -0.0777, "D_precision": 0.541, "D_recall": 0.4231, "D_f1": 0.4748, "D_f2": 0.4424, "D_accuracy": 0.4297, "D_mcc": -0.1338, "D_tp": 33, "D_fp": 28, "D_tn": 22, "D_fn": 45, "sharpe": -1.3009, "sortino": -1.3924, "return_pct": -15.64, "equity": 843.6, "max_dd": 0.0, "win_rate": 42.19, "profit_factor": 0.0, "ic": -0.049, "hit": 42.19, "psr": 0.1837, "bh_sharpe": 1.1511, "bh_return_pct": 13.19, "excess_sharpe": -2.452, "precision": 0.5333, "recall": 0.4103, "f1": 0.4638, "f2": 0.4301, "mcc": -0.1464, "accuracy": 0.4219, "tp": 32, "fp": 28, "tn": 22, "fn": 46}, {"fold": "fold_6", "regime": "COVID crash and V-recovery", "n": 173, "A_sharpe": 2.172, "A_sortino": 2.4152, "A_excess_sharpe": -0.154, "A_return_pct": 40.3, "A_hit_rate": 53.76, "A_n": 173, "A_bh_sharpe": 2.3261, "A_bh_return_pct": 43.81, "A_psr": 0.9647, "A_ic": 0.1378, "A_precision": 0.7538, "A_recall": 0.4336, "A_f1": 0.5506, "A_f2": 0.4739, "A_accuracy": 0.5376, "A_mcc": 0.1641, "A_tp": 49, "A_fp": 16, "A_tn": 44, "A_fn": 64, "B_sharpe": 0.9901, "B_sortino": 1.1475, "B_excess_sharpe": -4.7559, "B_return_pct": 29.26, "B_hit_rate": 48.84, "B_n": 173, "B_bh_sharpe": 5.746, "B_bh_return_pct": 499.04, "B_psr": 0.7973, "B_ic": 0.1079, "B_precision": 0.6825, "B_recall": 0.3874, "B_f1": 0.4943, "B_f2": 0.4241, "B_accuracy": 0.4913, "B_mcc": 0.0646, "B_tp": 43, "B_fp": 20, "B_tn": 42, "B_fn": 68, "D_sharpe": 0.5648, "D_sortino": 0.6792, "D_excess_sharpe": -1.7613, "D_return_pct": 7.68, "D_hit_rate": 43.35, "D_n": 173, "D_bh_sharpe": 2.3261, "D_bh_return_pct": 43.81, "D_psr": 0.6811, "D_ic": 0.0208, "D_precision": 0.619, "D_recall": 0.3451, "D_f1": 0.4432, "D_f2": 0.3786, "D_accuracy": 0.4335, "D_mcc": -0.0543, "D_tp": 39, "D_fp": 24, "D_tn": 36, "D_fn": 74, "sharpe": 2.172, "sortino": 2.4152, "return_pct": 40.3, "equity": 1403.0, "max_dd": 0.0, "win_rate": 53.76, "profit_factor": 0.0, "ic": 0.1378, "hit": 53.76, "psr": 0.9647, "bh_sharpe": 2.3261, "bh_return_pct": 43.81, "excess_sharpe": -0.154, "precision": 0.7538, "recall": 0.4336, "f1": 0.5506, "f2": 0.4739, "mcc": 0.1641, "accuracy": 0.5376, "tp": 49, "fp": 16, "tn": 44, "fn": 64}, {"fold": "fold_7", "regime": "Inflation bear, AI rally and 2025", "n": 376, "A_sharpe": 1.1652, "A_sortino": 1.5043, "A_excess_sharpe": 0.3619, "A_return_pct": 42.23, "A_hit_rate": 47.87, "A_n": 376, "A_bh_sharpe": 0.8033, "A_bh_return_pct": 26.02, "A_psr": 0.9348, "A_ic": 0.0371, "A_precision": 0.6667, "A_recall": 0.2262, "A_f1": 0.3378, "A_f2": 0.2607, "A_accuracy": 0.4787, "A_mcc": 0.08, "A_tp": 50, "A_fp": 25, "A_tn": 130, "A_fn": 171, "B_sharpe": 0.08, "B_sortino": 0.0929, "B_excess_sharpe": -1.8517, "B_return_pct": -9.91, "B_hit_rate": 43.73, "B_n": 376, "B_bh_sharpe": 1.9317, "B_bh_return_pct": 222.05, "B_psr": 0.5389, "B_ic": -0.0127, "B_precision": 0.7222, "B_recall": 0.1145, "B_f1": 0.1977, "B_f2": 0.1377, "B_accuracy": 0.4388, "B_mcc": 0.0788, "B_tp": 26, "B_fp": 10, "B_tn": 139, "B_fn": 201, "D_sharpe": 0.0774, "D_sortino": 0.1011, "D_excess_sharpe": -0.7259, "D_return_pct": -1.09, "D_hit_rate": 42.82, "D_n": 376, "D_bh_sharpe": 0.8033, "D_bh_return_pct": 26.02, "D_psr": 0.5378, "D_ic": -0.0331, "D_precision": 0.5833, "D_recall": 0.095, "D_f1": 0.1634, "D_f2": 0.1141, "D_accuracy": 0.4282, "D_mcc": -0.0029, "D_tp": 21, "D_fp": 15, "D_tn": 140, "D_fn": 200, "sharpe": 1.1652, "sortino": 1.5043, "return_pct": 42.23, "equity": 1422.3, "max_dd": 0.0, "win_rate": 47.87, "profit_factor": 0.0, "ic": 0.0371, "hit": 47.87, "psr": 0.9348, "bh_sharpe": 0.8033, "bh_return_pct": 26.02, "excess_sharpe": 0.3619, "precision": 0.6667, "recall": 0.2262, "f1": 0.3378, "f2": 0.2607, "mcc": 0.08, "accuracy": 0.4787, "tp": 50, "fp": 25, "tn": 130, "fn": 171}], "per_window_val": [{"fold": "fold_1", "regime": "GFC peak crash (Lehman + Mar-2009 bottom)", "n": 65, "A_sharpe": -1.5753, "A_sortino": -1.436, "A_excess_sharpe": 0.6504, "A_return_pct": -14.09, "A_hit_rate": 44.44, "A_n": 65, "A_bh_sharpe": -2.2257, "A_bh_return_pct": -18.74, "A_psr": 0.2057, "A_ic": 0.0741, "A_precision": 0.4407, "A_recall": 0.8966, "A_f1": 0.5909, "A_f2": 0.7429, "A_accuracy": 0.4462, "A_mcc": -0.0345, "A_tp": 26, "A_fp": 33, "A_tn": 3, "A_fn": 3, "B_sharpe": -4.8065, "B_sortino": -4.0599, "B_excess_sharpe": 2.3158, "B_return_pct": -61.34, "B_hit_rate": 40.0, "B_n": 65, "B_bh_sharpe": -7.1223, "B_bh_return_pct": -73.11, "B_psr": 0.0051, "B_ic": 0.4064, "B_precision": 0.371, "B_recall": 1.0, "B_f1": 0.5412, "B_f2": 0.7468, "B_accuracy": 0.4, "B_mcc": 0.1628, "B_tp": 23, "B_fp": 39, "B_tn": 3, "B_fn": 0, "D_sharpe": -1.1614, "D_sortino": -0.9741, "D_excess_sharpe": 1.0642, "D_return_pct": -10.97, "D_hit_rate": 50.79, "D_n": 65, "D_bh_sharpe": -2.2257, "D_bh_return_pct": -18.74, "D_psr": 0.2717, "D_ic": 0.3508, "D_precision": 0.4677, "D_recall": 1.0, "D_f1": 0.6374, "D_f2": 0.8146, "D_accuracy": 0.4923, "D_mcc": 0.1974, "D_tp": 29, "D_fp": 33, "D_tn": 3, "D_fn": 0, "sharpe": -1.5753, "sortino": -1.436, "return_pct": -14.09, "equity": 859.1, "max_dd": 0.0, "win_rate": 44.44, "profit_factor": 0.0, "ic": 0.0741, "hit": 44.44, "psr": 0.2057, "bh_sharpe": -2.2257, "bh_return_pct": -18.74, "excess_sharpe": 0.6504, "precision": 0.4407, "recall": 0.8966, "f1": 0.5909, "f2": 0.7429, "mcc": -0.0345, "accuracy": 0.4462, "tp": 26, "fp": 33, "tn": 3, "fn": 3}, {"fold": "fold_2", "regime": "2011 US-downgrade + EU debt", "n": 47, "A_sharpe": 0.2005, "A_sortino": 0.1734, "A_excess_sharpe": 0.3946, "A_return_pct": 0.16, "A_hit_rate": 57.45, "A_n": 47, "A_bh_sharpe": -0.1941, "A_bh_return_pct": -2.36, "A_psr": 0.534, "A_ic": 0.104, "A_precision": 0.575, "A_recall": 0.8846, "A_f1": 0.697, "A_f2": 0.7986, "A_accuracy": 0.5745, "A_mcc": 0.1049, "A_tp": 23, "A_fp": 17, "A_tn": 4, "A_fn": 3, "B_sharpe": 0.7783, "B_sortino": 0.6962, "B_excess_sharpe": 2.3907, "B_return_pct": 5.68, "B_hit_rate": 55.32, "B_n": 47, "B_bh_sharpe": -1.6123, "B_bh_return_pct": -24.3, "B_psr": 0.6283, "B_ic": 0.1358, "B_precision": 0.5, "B_recall": 0.9524, "B_f1": 0.6557, "B_f2": 0.8065, "B_accuracy": 0.5532, "B_mcc": 0.2558, "B_tp": 20, "B_fp": 20, "B_tn": 6, "B_fn": 1, "D_sharpe": 0.9884, "D_sortino": 0.909, "D_excess_sharpe": 1.1825, "D_return_pct": 5.4, "D_hit_rate": 57.45, "D_n": 47, "D_bh_sharpe": -0.1941, "D_bh_return_pct": -2.36, "D_psr": 0.662, "D_ic": -0.0215, "D_precision": 0.575, "D_recall": 0.8846, "D_f1": 0.697, "D_f2": 0.7986, "D_accuracy": 0.5745, "D_mcc": 0.1049, "D_tp": 23, "D_fp": 17, "D_tn": 4, "D_fn": 3, "sharpe": 0.2005, "sortino": 0.1734, "return_pct": 0.16, "equity": 1001.6, "max_dd": 0.0, "win_rate": 57.45, "profit_factor": 0.0, "ic": 0.104, "hit": 57.45, "psr": 0.534, "bh_sharpe": -0.1941, "bh_return_pct": -2.36, "excess_sharpe": 0.3946, "precision": 0.575, "recall": 0.8846, "f1": 0.697, "f2": 0.7986, "mcc": 0.1049, "accuracy": 0.5745, "tp": 23, "fp": 17, "tn": 4, "fn": 3}, {"fold": "fold_3", "regime": "Taper tantrum and 2014 H1", "n": 5, "A_sharpe": 3.7421, "A_sortino": 3.8425, "A_excess_sharpe": 5.0616, "A_return_pct": 0.57, "A_hit_rate": 60.0, "A_n": 5, "A_bh_sharpe": -1.3194, "A_bh_return_pct": -0.21, "A_psr": 0.6797, "A_ic": 0.4, "A_precision": 0.5, "A_recall": 0.5, "A_f1": 0.5, "A_f2": 0.5, "A_accuracy": 0.6, "A_mcc": 0.1667, "A_tp": 1, "A_fp": 1, "A_tn": 2, "A_fn": 1, "B_sharpe": 9.8721, "B_sortino": 10.3422, "B_excess_sharpe": 35.7427, "B_return_pct": 0.0, "B_hit_rate": 0.0, "B_n": 5, "B_bh_sharpe": -25.8705, "B_bh_return_pct": -3.84, "B_psr": 0.8993, "B_ic": -0.2, "B_precision": 0.0, "B_recall": 0.0, "B_f1": 0.0, "B_f2": 0.0, "B_accuracy": 0.8, "B_mcc": 0.0, "B_tp": 0, "B_fp": 1, "B_tn": 4, "B_fn": 0, "D_sharpe": -10.4634, "D_sortino": -7.0126, "D_excess_sharpe": -9.144, "D_return_pct": -1.37, "D_hit_rate": 40.0, "D_n": 5, "D_bh_sharpe": -1.3194, "D_bh_return_pct": -0.21, "D_psr": 0.0711, "D_ic": -0.3, "D_precision": 0.0, "D_recall": 0.0, "D_f1": 0.0, "D_f2": 0.0, "D_accuracy": 0.4, "D_mcc": -0.4082, "D_tp": 0, "D_fp": 1, "D_tn": 2, "D_fn": 2, "sharpe": 3.7421, "sortino": 3.8425, "return_pct": 0.57, "equity": 1005.7, "max_dd": 0.0, "win_rate": 60.0, "profit_factor": 0.0, "ic": 0.4, "hit": 60.0, "psr": 0.6797, "bh_sharpe": -1.3194, "bh_return_pct": -0.21, "excess_sharpe": 5.0616, "precision": 0.5, "recall": 0.5, "f1": 0.5, "f2": 0.5, "mcc": 0.1667, "accuracy": 0.6, "tp": 1, "fp": 1, "tn": 2, "fn": 1}, {"fold": "fold_4", "regime": "China devaluation and oil crash", "n": 47, "A_sharpe": -1.8238, "A_sortino": -1.7153, "A_excess_sharpe": 0.0, "A_return_pct": -8.68, "A_hit_rate": 44.68, "A_n": 47, "A_bh_sharpe": -1.8238, "A_bh_return_pct": -8.68, "A_psr": 0.2173, "A_ic": 0.0205, "A_precision": 0.4468, "A_recall": 1.0, "A_f1": 0.6176, "A_f2": 0.8015, "A_accuracy": 0.4468, "A_mcc": 0.0, "A_tp": 21, "A_fp": 26, "A_tn": 0, "A_fn": 0, "B_sharpe": -0.2581, "B_sortino": -0.2319, "B_excess_sharpe": 1.9619, "B_return_pct": -5.97, "B_hit_rate": 48.94, "B_n": 47, "B_bh_sharpe": -2.22, "B_bh_return_pct": -23.98, "B_psr": 0.4557, "B_ic": 0.5955, "B_precision": 0.4667, "B_recall": 1.0, "B_f1": 0.6364, "B_f2": 0.814, "B_accuracy": 0.4894, "B_mcc": 0.1895, "B_tp": 21, "B_fp": 24, "B_tn": 2, "B_fn": 0, "D_sharpe": -2.254, "D_sortino": -2.1818, "D_excess_sharpe": -0.4302, "D_return_pct": -10.46, "D_hit_rate": 40.43, "D_n": 47, "D_bh_sharpe": -1.8238, "D_bh_return_pct": -8.68, "D_psr": 0.1685, "D_ic": 0.1103, "D_precision": 0.4222, "D_recall": 0.9048, "D_f1": 0.5758, "D_f2": 0.7364, "D_accuracy": 0.4043, "D_mcc": -0.2346, "D_tp": 19, "D_fp": 26, "D_tn": 0, "D_fn": 2, "sharpe": -1.8238, "sortino": -1.7153, "return_pct": -8.68, "equity": 913.2, "max_dd": 0.0, "win_rate": 44.68, "profit_factor": 0.0, "ic": 0.0205, "hit": 44.68, "psr": 0.2173, "bh_sharpe": -1.8238, "bh_return_pct": -8.68, "excess_sharpe": 0.0, "precision": 0.4468, "recall": 1.0, "f1": 0.6176, "f2": 0.8015, "mcc": 0.0, "accuracy": 0.4468, "tp": 21, "fp": 26, "tn": 0, "fn": 0}, {"fold": "fold_5", "regime": "2018 Vol-mageddon + Q4 sell-off", "n": 5, "A_sharpe": -10.1368, "A_sortino": -6.9937, "A_excess_sharpe": 0.0, "A_return_pct": -3.15, "A_hit_rate": 40.0, "A_n": 5, "A_bh_sharpe": -10.1368, "A_bh_return_pct": -3.15, "A_psr": 0.0985, "A_ic": -0.2, "A_precision": 0.4, "A_recall": 1.0, "A_f1": 0.5714, "A_f2": 0.7692, "A_accuracy": 0.4, "A_mcc": 0.0, "A_tp": 2, "A_fp": 3, "A_tn": 0, "A_fn": 0, "B_sharpe": 5.6858, "B_sortino": 6.0578, "B_excess_sharpe": 0.0, "B_return_pct": 4.22, "B_hit_rate": 60.0, "B_n": 5, "B_bh_sharpe": 5.6858, "B_bh_return_pct": 4.22, "B_psr": 0.753, "B_ic": 0.9, "B_precision": 0.6, "B_recall": 1.0, "B_f1": 0.75, "B_f2": 0.8824, "B_accuracy": 0.6, "B_mcc": 0.0, "B_tp": 3, "B_fp": 2, "B_tn": 0, "B_fn": 0, "D_sharpe": -10.1368, "D_sortino": -6.9937, "D_excess_sharpe": 0.0, "D_return_pct": -3.15, "D_hit_rate": 40.0, "D_n": 5, "D_bh_sharpe": -10.1368, "D_bh_return_pct": -3.15, "D_psr": 0.0985, "D_ic": 0.7, "D_precision": 0.4, "D_recall": 1.0, "D_f1": 0.5714, "D_f2": 0.7692, "D_accuracy": 0.4, "D_mcc": 0.0, "D_tp": 2, "D_fp": 3, "D_tn": 0, "D_fn": 0, "sharpe": -10.1368, "sortino": -6.9937, "return_pct": -3.15, "equity": 968.5, "max_dd": 0.0, "win_rate": 40.0, "profit_factor": 0.0, "ic": -0.2, "hit": 40.0, "psr": 0.0985, "bh_sharpe": -10.1368, "bh_return_pct": -3.15, "excess_sharpe": 0.0, "precision": 0.4, "recall": 1.0, "f1": 0.5714, "f2": 0.7692, "mcc": 0.0, "accuracy": 0.4, "tp": 2, "fp": 3, "tn": 0, "fn": 0}, {"fold": "fold_6", "regime": "COVID crash and V-recovery", "n": 26, "A_sharpe": 3.9585, "A_sortino": 4.1286, "A_excess_sharpe": 0.6734, "A_return_pct": 5.81, "A_hit_rate": 61.54, "A_n": 26, "A_bh_sharpe": 3.2852, "A_bh_return_pct": 4.82, "A_psr": 0.8914, "A_ic": 0.001, "A_precision": 0.6667, "A_recall": 0.75, "A_f1": 0.7059, "A_f2": 0.7317, "A_accuracy": 0.6154, "A_mcc": 0.1581, "A_tp": 12, "A_fp": 6, "A_tn": 4, "A_fn": 4, "B_sharpe": -0.5734, "B_sortino": -0.5711, "B_excess_sharpe": -13.5526, "B_return_pct": -2.4, "B_hit_rate": 50.0, "B_n": 26, "B_bh_sharpe": 12.9792, "B_bh_return_pct": 38.76, "B_psr": 0.4286, "B_ic": 0.334, "B_precision": 1.0, "B_recall": 0.381, "B_f1": 0.5517, "B_f2": 0.4348, "B_accuracy": 0.5, "B_mcc": 0.3253, "B_tp": 8, "B_fp": 0, "B_tn": 5, "B_fn": 13, "D_sharpe": 2.2939, "D_sortino": 2.9716, "D_excess_sharpe": -0.9913, "D_return_pct": 3.35, "D_hit_rate": 46.15, "D_n": 26, "D_bh_sharpe": 3.2852, "D_bh_return_pct": 4.82, "D_psr": 0.7717, "D_ic": 0.2082, "D_precision": 0.625, "D_recall": 0.3125, "D_f1": 0.4167, "D_f2": 0.3472, "D_accuracy": 0.4615, "D_mcc": 0.0132, "D_tp": 5, "D_fp": 3, "D_tn": 7, "D_fn": 11, "sharpe": 3.9585, "sortino": 4.1286, "return_pct": 5.81, "equity": 1058.1000000000001, "max_dd": 0.0, "win_rate": 61.54, "profit_factor": 0.0, "ic": 0.001, "hit": 61.54, "psr": 0.8914, "bh_sharpe": 3.2852, "bh_return_pct": 4.82, "excess_sharpe": 0.6734, "precision": 0.6667, "recall": 0.75, "f1": 0.7059, "f2": 0.7317, "mcc": 0.1581, "accuracy": 0.6154, "tp": 12, "fp": 6, "tn": 4, "fn": 4}, {"fold": "fold_7", "regime": "Inflation bear, AI rally and 2025", "n": 65, "A_sharpe": 0.633, "A_sortino": 0.6711, "A_excess_sharpe": -1.4459, "A_return_pct": 2.22, "A_hit_rate": 52.31, "A_n": 65, "A_bh_sharpe": 2.0789, "A_bh_return_pct": 8.17, "A_psr": 0.6261, "A_ic": 0.0708, "A_precision": 0.6667, "A_recall": 0.2286, "A_f1": 0.3404, "A_f2": 0.2632, "A_accuracy": 0.5231, "A_mcc": 0.1224, "A_tp": 8, "A_fp": 4, "A_tn": 26, "A_fn": 27, "B_sharpe": -5.6937, "B_sortino": -5.1636, "B_excess_sharpe": -10.9251, "B_return_pct": -34.35, "B_hit_rate": 32.31, "B_n": 65, "B_bh_sharpe": 5.2314, "B_bh_return_pct": 44.53, "B_psr": 0.0029, "B_ic": 0.1208, "B_precision": 0.5, "B_recall": 0.0455, "B_f1": 0.0833