{"experiment_num": 11, "backbone": "lstm", "description": "LSTM @ FX-Exp35 HPs seed=99 \u2014 3rd seed for variance estimate (vs seeds 42, 0)", "config": {"seq_len": 10, "lr": 0.001, "batch_size": 16, "epochs": 100, "weight_decay": 0.0007, "patience": 15, "warmup_epochs": 0, "head_dropout": 0.1, "huber_delta": 1.0, "grad_clip": 1.0, "seed": 99, "hidden_size": null, "num_layers": null, "max_depth": null, "gbm_lr": null, "n_estimators": null}, "composite": -0.5692, "test_pos_folds": 5, "val_pos_folds": 3, "val_loss": -2.873570015217361, "elapsed_sec": 85.1, "timestamp": "2026-04-26T15:25:42", "sharpe": 0.4739, "val_sharpe": -0.3692, "ic": 0.0117, "hit": 45.7, "psr": 0.8716, "equity": 1674.1, "return_pct": 67.41, "bh_sharpe": 0.6042, "bh_return_pct": 103.49, "excess_sharpe": -0.1304, "B_sharpe": 0.3271, "B_excess_sharpe": -1.3737, "B_return_pct": 19.4, "D_sharpe": 0.4739, "D_excess_sharpe": -0.1304, "D_return_pct": 67.41, "per_window": [{"fold": "fold_1", "regime": "GFC peak crash (Lehman + Mar-2009 bottom)", "n": 115, "A_sharpe": 2.8493, "A_sortino": 3.4062, "A_excess_sharpe": 3.2934, "A_return_pct": 78.0, "A_hit_rate": 53.91, "A_n": 115, "A_bh_sharpe": -0.4441, "A_bh_return_pct": -14.4, "A_psr": 0.9767, "A_ic": 0.1378, "B_sharpe": 2.6782, "B_sortino": 2.9756, "B_excess_sharpe": 2.976, "B_return_pct": 150.04, "B_hit_rate": 57.02, "B_n": 115, "B_bh_sharpe": -0.2978, "B_bh_return_pct": -27.23, "B_psr": 0.9667, "B_ic": 0.1956, "D_sharpe": 2.8493, "D_sortino": 3.4062, "D_excess_sharpe": 3.2934, "D_return_pct": 78.0, "D_hit_rate": 53.91, "D_n": 115, "D_bh_sharpe": -0.4441, "D_bh_return_pct": -14.4, "D_psr": 0.9767, "D_ic": 0.1378, "sharpe": 2.8493, "sortino": 3.4062, "return_pct": 78.0, "equity": 1780.0, "max_dd": 0.0, "win_rate": 53.91, "profit_factor": 0.0, "ic": 0.1378, "hit": 53.91, "psr": 0.9767, "bh_sharpe": -0.4441, "bh_return_pct": -14.4, "excess_sharpe": 3.2934, "precision": 0.5091, "recall": 0.5185, "f1": 0.5138, "f2": 0.5166, "accuracy": 0.5391, "mcc": 0.0758, "tp": 28, "fp": 27, "tn": 34, "fn": 26, "A_precision": 0.5091, "A_recall": 0.5185, "A_f1": 0.5138, "A_f2": 0.5166, "A_accuracy": 0.5391, "A_mcc": 0.0758, "A_tp": 28, "A_fp": 27, "A_tn": 34, "A_fn": 26}, {"fold": "fold_2", "regime": "2011 US-downgrade + EU debt", "n": 136, "A_sharpe": 1.1167, "A_sortino": 1.3171, "A_excess_sharpe": -0.6161, "A_return_pct": 11.91, "A_hit_rate": 46.67, "A_n": 136, "A_bh_sharpe": 1.7327, "A_bh_return_pct": 19.75, "A_psr": 0.7965, "A_ic": 0.0434, "B_sharpe": 3.0929, "B_sortino": 3.0382, "B_excess_sharpe": -0.973, "B_return_pct": 99.27, "B_hit_rate": 62.5, "B_n": 136, "B_bh_sharpe": 4.0659, "B_bh_return_pct": 148.68, "B_psr": 0.9875, "B_ic": 0.0395, "D_sharpe": 1.1167, "D_sortino": 1.3171, "D_excess_sharpe": -0.6161, "D_return_pct": 11.91, "D_hit_rate": 46.67, "D_n": 136, "D_bh_sharpe": 1.7327, "D_bh_return_pct": 19.75, "D_psr": 0.7965, "D_ic": 0.0434, "sharpe": 1.1167, "sortino": 1.3171, "return_pct": 11.91, "equity": 1119.1, "max_dd": 0.0, "win_rate": 46.67, "profit_factor": 0.0, "ic": 0.0434, "hit": 46.67, "psr": 0.7965, "bh_sharpe": 1.7327, "bh_return_pct": 19.75, "excess_sharpe": -0.6161, "precision": 0.625, "recall": 0.1923, "f1": 0.2941, "f2": 0.2232, "accuracy": 0.4706, "mcc": 0.0482, "tp": 15, "fp": 9, "tn": 49, "fn": 63, "A_precision": 0.625, "A_recall": 0.1923, "A_f1": 0.2941, "A_f2": 0.2232, "A_accuracy": 0.4706, "A_mcc": 0.0482, "A_tp": 15, "A_fp": 9, "A_tn": 49, "A_fn": 63}, {"fold": "fold_3", "regime": "Taper tantrum and 2014 H1", "n": 178, "A_sharpe": 1.0793, "A_sortino": 1.2888, "A_excess_sharpe": -0.2653, "A_return_pct": 9.73, "A_hit_rate": 49.15, "A_n": 178, "A_bh_sharpe": 1.3445, "A_bh_return_pct": 12.41, "A_psr": 0.8231, "A_ic": 0.1783, "B_sharpe": -0.3119, "B_sortino": -0.3252, "B_excess_sharpe": -3.3603, "B_return_pct": -8.09, "B_hit_rate": 46.63, "B_n": 178, "B_bh_sharpe": 3.0483, "B_bh_return_pct": 71.83, "B_psr": 0.397, "B_ic": -0.0688, "D_sharpe": 1.0793, "D_sortino": 1.2888, "D_excess_sharpe": -0.2653, "D_return_pct": 9.73, "D_hit_rate": 49.15, "D_n": 178, "D_bh_sharpe": 1.3445, "D_bh_return_pct": 12.41, "D_psr": 0.8231, "D_ic": 0.1783, "sharpe": 1.0793, "sortino": 1.2888, "return_pct": 9.73, "equity": 1097.3, "max_dd": 0.0, "win_rate": 49.15, "profit_factor": 0.0, "ic": 0.1783, "hit": 49.15, "psr": 0.8231, "bh_sharpe": 1.3445, "bh_return_pct": 12.41, "excess_sharpe": -0.2653, "precision": 0.7407, "recall": 0.1942, "f1": 0.3077, "f2": 0.2278, "accuracy": 0.4944, "mcc": 0.1388, "tp": 20, "fp": 7, "tn": 68, "fn": 83, "A_precision": 0.7407, "A_recall": 0.1942, "A_f1": 0.3077, "A_f2": 0.2278, "A_accuracy": 0.4944, "A_mcc": 0.1388, "A_tp": 20, "A_fp": 7, "A_tn": 68, "A_fn": 83}, {"fold": "fold_4", "regime": "China devaluation and oil crash", "n": 157, "A_sharpe": 0.1583, "A_sortino": 0.1499, "A_excess_sharpe": 0.1485, "A_return_pct": 0.74, "A_hit_rate": 50.0, "A_n": 157, "A_bh_sharpe": 0.0098, "A_bh_return_pct": -1.05, "A_psr": 0.5494, "A_ic": 0.0938, "B_sharpe": -0.0442, "B_sortino": -0.0442, "B_excess_sharpe": -0.0601, "B_return_pct": -7.0, "B_hit_rate": 47.77, "B_n": 157, "B_bh_sharpe": 0.0159, "B_bh_return_pct": -5.48, "B_psr": 0.4861, "B_ic": 0.0119, "D_sharpe": 0.1583, "D_sortino": 0.1499, "D_excess_sharpe": 0.1485, "D_return_pct": 0.74, "D_hit_rate": 50.0, "D_n": 157, "D_bh_sharpe": 0.0098, "D_bh_return_pct": -1.05, "D_psr": 0.5494, "D_ic": 0.0938, "sharpe": 0.1583, "sortino": 0.1499, "return_pct": 0.74, "equity": 1007.4000000000001, "max_dd": 0.0, "win_rate": 50.0, "profit_factor": 0.0, "ic": 0.0938, "hit": 50.0, "psr": 0.5494, "bh_sharpe": 0.0098, "bh_return_pct": -1.05, "excess_sharpe": 0.1485, "precision": 0.5333, "recall": 0.2963, "f1": 0.381, "f2": 0.3252, "accuracy": 0.5032, "mcc": 0.0221, "tp": 24, "fp": 21, "tn": 55, "fn": 57, "A_precision": 0.5333, "A_recall": 0.2963, "A_f1": 0.381, "A_f2": 0.3252, "A_accuracy": 0.5032, "A_mcc": 0.0221, "A_tp": 24, "A_fp": 21, "A_tn": 55, "A_fn": 57}, {"fold": "fold_5", "regime": "2018 Vol-mageddon + Q4 sell-off", "n": 177, "A_sharpe": -0.1287, "A_sortino": -0.1475, "A_excess_sharpe": -0.4385, "A_return_pct": -3.86, "A_hit_rate": 41.81, "A_n": 177, "A_bh_sharpe": 0.3098, "A_bh_return_pct": 3.19, "A_psr": 0.4573, "A_ic": 0.037, "B_sharpe": 1.612, "B_sortino": 1.7476, "B_excess_sharpe": 0.7203, "B_return_pct": 56.37, "B_hit_rate": 51.14, "B_n": 177, "B_bh_sharpe": 0.8917, "B_bh_return_pct": 23.8, "B_psr": 0.9111, "B_ic": 0.2084, "D_sharpe": -0.1287, "D_sortino": -0.1475, "D_excess_sharpe": -0.4385, "D_return_pct": -3.86, "D_hit_rate": 41.81, "D_n": 177, "D_bh_sharpe": 0.3098, "D_bh_return_pct": 3.19, "D_psr": 0.4573, "D_ic": 0.037, "sharpe": -0.1287, "sortino": -0.1475, "return_pct": -3.86, "equity": 961.4, "max_dd": 0.0, "win_rate": 41.81, "profit_factor": 0.0, "ic": 0.037, "hit": 41.81, "psr": 0.4573, "bh_sharpe": 0.3098, "bh_return_pct": 3.19, "excess_sharpe": -0.4385, "precision": 0.5, "recall": 0.2039, "f1": 0.2897, "f2": 0.2313, "accuracy": 0.4181, "mcc": -0.0926, "tp": 21, "fp": 21, "tn": 53, "fn": 82, "A_precision": 0.5, "A_recall": 0.2039, "A_f1": 0.2897, "A_f2": 0.2313, "A_accuracy": 0.4181, "A_mcc": -0.0926, "A_tp": 21, "A_fp": 21, "A_tn": 53, "A_fn": 82}, {"fold": "fold_6", "regime": "COVID crash and V-recovery", "n": 222, "A_sharpe": 0.3576, "A_sortino": 0.4198, "A_excess_sharpe": -0.5312, "A_return_pct": 5.83, "A_hit_rate": 43.24, "A_n": 222, "A_bh_sharpe": 0.8888, "A_bh_return_pct": 26.13, "A_psr": 0.632, "A_ic": -0.003, "B_sharpe": -1.2962, "B_sortino": -1.2286, "B_excess_sharpe": -3.6847, "B_return_pct": -63.74, "B_hit_rate": 45.7, "B_n": 222, "B_bh_sharpe": 2.3884, "B_bh_return_pct": 243.18, "B_psr": 0.1087, "B_ic": -0.0725, "D_sharpe": 0.3576, "D_sortino": 0.4198, "D_excess_sharpe": -0.5312, "D_return_pct": 5.83, "D_hit_rate": 43.24, "D_n": 222, "D_bh_sharpe": 0.8888, "D_bh_return_pct": 26.13, "D_psr": 0.632, "D_ic": -0.003, "sharpe": 0.3576, "sortino": 0.4198, "return_pct": 5.83, "equity": 1058.3, "max_dd": 0.0, "win_rate": 43.24, "profit_factor": 0.0, "ic": -0.003, "hit": 43.24, "psr": 0.632, "bh_sharpe": 0.8888, "bh_return_pct": 26.13, "excess_sharpe": -0.5312, "precision": 0.65, "recall": 0.1884, "f1": 0.2921, "f2": 0.2196, "accuracy": 0.4324, "mcc": 0.0274, "tp": 26, "fp": 14, "tn": 70, "fn": 112, "A_precision": 0.65, "A_recall": 0.1884, "A_f1": 0.2921, "A_f2": 0.2196, "A_accuracy": 0.4324, "A_mcc": 0.0274, "A_tp": 26, "A_fp": 14, "A_tn": 70, "A_fn": 112}, {"fold": "fold_7", "regime": "Inflation bear, AI rally and 2025", "n": 425, "A_sharpe": -0.6882, "A_sortino": -0.7675, "A_excess_sharpe": -1.6597, "A_return_pct": -25.28, "A_hit_rate": 43.06, "A_n": 425, "A_bh_sharpe": 0.9715, "A_bh_return_pct": 37.12, "A_psr": 0.1926, "A_ic": -0.0264, "B_sharpe": -0.6897, "B_sortino": -0.6463, "B_excess_sharpe": -3.1924, "B_return_pct": -50.55, "B_hit_rate": 50.0, "B_n": 425, "B_bh_sharpe": 2.5027, "B_bh_return_pct": 458.83, "B_psr": 0.1841, "B_ic": -0.0514, "D_sharpe": -0.6882, "D_sortino": -0.7675, "D_excess_sharpe": -1.6597, "D_return_pct": -25.28, "D_hit_rate": 43.06, "D_n": 425, "D_bh_sharpe": 0.9715, "D_bh_return_pct": 37.12, "D_psr": 0.1926, "D_ic": -0.0264, "sharpe": -0.6882, "sortino": -0.7675, "return_pct": -25.28, "equity": 747.1999999999999, "max_dd": 0.0, "win_rate": 43.06, "profit_factor": 0.0, "ic": -0.0264, "hit": 43.06, "psr": 0.1926, "bh_sharpe": 0.9715, "bh_return_pct": 37.12, "excess_sharpe": -1.6597, "precision": 0.5667, "recall": 0.136, "f1": 0.2194, "f2": 0.1604, "accuracy": 0.4306, "mcc": -0.0178, "tp": 34, "fp": 26, "tn": 149, "fn": 216, "A_precision": 0.5667, "A_recall": 0.136, "A_f1": 0.2194, "A_f2": 0.1604, "A_accuracy": 0.4306, "A_mcc": -0.0178, "A_tp": 34, "A_fp": 26, "A_tn": 149, "A_fn": 216}], "per_window_val": [{"fold": "fold_1", "regime": "GFC peak crash (Lehman + Mar-2009 bottom)", "n": 104, "A_sharpe": 0.0348, "A_sortino": 0.0307, "A_excess_sharpe": 0.202, "A_return_pct": -1.4, "A_hit_rate": 52.94, "A_n": 104, "A_bh_sharpe": -0.1672, "A_bh_return_pct": -3.81, "A_psr": 0.5089, "A_ic": 0.0741, "B_sharpe": 0.7187, "B_sortino": 0.8204, "B_excess_sharpe": 2.9928, "B_return_pct": 10.74, "B_hit_rate": 48.54, "B_n": 104, "B_bh_sharpe": -2.2741, "B_bh_return_pct": -44.12, "B_psr": 0.6796, "B_ic": -0.0366, "D_sharpe": 0.0348, "D_sortino": 0.0307, "D_excess_sharpe": 0.202, "D_return_pct": -1.4, "D_hit_rate": 52.94, "D_n": 104, "D_bh_sharpe": -0.1672, "D_bh_return_pct": -3.81, "D_psr": 0.5089, "D_ic": 0.0741, "sharpe": 0.0348, "sortino": 0.0307, "return_pct": -1.4, "equity": 986.0, "max_dd": 0.0, "win_rate": 52.94, "profit_factor": 0.0, "ic": 0.0741, "hit": 52.94, "psr": 0.5089, "bh_sharpe": -0.1672, "bh_return_pct": -3.81, "excess_sharpe": 0.202}, {"fold": "fold_2", "regime": "2011 US-downgrade + EU debt", "n": 96, "A_sharpe": 1.4003, "A_sortino": 1.5254, "A_excess_sharpe": 1.6745, "A_return_pct": 13.75, "A_hit_rate": 50.53, "A_n": 96, "A_bh_sharpe": -0.2741, "A_bh_return_pct": -4.09, "A_psr": 0.8046, "A_ic": -0.0121, "B_sharpe": -0.3519, "B_sortino": -0.3156, "B_excess_sharpe": 0.6755, "B_return_pct": -13.52, "B_hit_rate": 52.08, "B_n": 96, "B_bh_sharpe": -1.0274, "B_bh_return_pct": -25.58, "B_psr": 0.4138, "B_ic": 0.0597, "D_sharpe": 1.4003, "D_sortino": 1.5254, "D_excess_sharpe": 1.6745, "D_return_pct": 13.75, "D_hit_rate": 50.53, "D_n": 96, "D_bh_sharpe": -0.2741, "D_bh_return_pct": -4.09, "D_psr": 0.8046, "D_ic": -0.0121, "sharpe": 1.4003, "sortino": 1.5254, "return_pct": 13.75, "equity": 1137.5, "max_dd": 0.0, "win_rate": 50.53, "profit_factor": 0.0, "ic": -0.0121, "hit": 50.53, "psr": 0.8046, "bh_sharpe": -0.2741, "bh_return_pct": -4.09, "excess_sharpe": 1.6745}, {"fold": "fold_3", "regime": "Taper tantrum and 2014 H1", "n": 54, "A_sharpe": -2.3261, "A_sortino": -2.4483, "A_excess_sharpe": -7.0259, "A_return_pct": -5.12, "A_hit_rate": 38.89, "A_n": 54, "A_bh_sharpe": 4.6998, "A_bh_return_pct": 10.46, "A_psr": 0.1527, "A_ic": 0.0978, "B_sharpe": 5.2261, "B_sortino": 6.4495, "B_excess_sharpe": -3.8065, "B_return_pct": 28.48, "B_hit_rate": 61.11, "B_n": 54, "B_bh_sharpe": 9.0326, "B_bh_return_pct": 49.18, "B_psr": 0.993, "B_ic": 0.2729, "D_sharpe": -2.3261, "D_sortino": -2.4483, "D_excess_sharpe": -7.0259, "D_return_pct": -5.12, "D_hit_rate": 38.89, "D_n": 54, "D_bh_sharpe": 4.6998, "D_bh_return_pct": 10.46, "D_psr": 0.1527, "D_ic": 0.0978, "sharpe": -2.3261, "sortino": -2.4483, "return_pct": -5.12, "equity": 948.8, "max_dd": 0.0, "win_rate": 38.89, "profit_factor": 0.0, "ic": 0.0978, "hit": 38.89, "psr": 0.1527, "bh_sharpe": 4.6998, "bh_return_pct": 10.46, "excess_sharpe": -7.0259}, {"fold": "fold_4", "regime": "China devaluation and oil crash", "n": 96, "A_sharpe": 0.9492, "A_sortino": 0.8981, "A_excess_sharpe": 1.3733, "A_return_pct": 6.42, "A_hit_rate": 55.79, "A_n": 96, "A_bh_sharpe": -0.4241, "A_bh_return_pct": -3.73, "A_psr": 0.7185, "A_ic": 0.1238, "B_sharpe": -0.9798, "B_sortino": -0.8019, "B_excess_sharpe": 0.2045, "B_return_pct": -18.67, "B_hit_rate": 52.08, "B_n": 96, "B_bh_sharpe": -1.1843, "B_bh_return_pct": -21.44, "B_psr": 0.2631, "B_ic": 0.3435, "D_sharpe": 0.9492, "D_sortino": 0.8981, "D_excess_sharpe": 1.3733, "D_return_pct": 6.42, "D_hit_rate": 55.79, "D_n": 96, "D_bh_sharpe": -0.4241, "D_bh_return_pct": -3.73, "D_psr": 0.7185, "D_ic": 0.1238, "sharpe": 0.9492, "sortino": 0.8981, "return_pct": 6.42, "equity": 1064.2, "max_dd": 0.0, "win_rate": 55.79, "profit_factor": 0.0, "ic": 0.1238, "hit": 55.79, "psr": 0.7185, "bh_sharpe": -0.4241, "bh_return_pct": -3.73, "excess_sharpe": 1.3733}, {"fold": "fold_5", "regime": "2018 Vol-mageddon + Q4 sell-off", "n": 54, "A_sharpe": -1.0042, "A_sortino": -0.977, "A_excess_sharpe": -2.4321, "A_return_pct": -3.02, "A_hit_rate": 50.0, "A_n": 54, "A_bh_sharpe": 1.428, "A_bh_return_pct": 3.97, "A_psr": 0.3237, "A_ic": 0.1108, "B_sharpe": 1.9894, "B_sortino": 2.0023, "B_excess_sharpe": -2.9428, "B_return_pct": 12.72, "B_hit_rate": 57.41, "B_n": 54, "B_bh_sharpe": 4.9322, "B_bh_return_pct": 34.93, "B_psr": 0.8185, "B_ic": 0.0511, "D_sharpe": -1.0042, "D_sortino": -0.977, "D_excess_sharpe": -2.4321, "D_return_pct": -3.02, "D_hit_rate": 50.0, "D_n": 54, "D_bh_sharpe": 1.428, "D_bh_return_pct": 3.97, "D_psr": 0.3237, "D_ic": 0.1108, "sharpe": -1.0042, "sortino": -0.977, "return_pct": -3.02, "equity": 969.8, "max_dd": 0.0, "win_rate": 50.0, "profit_factor": 0.0, "ic": 0.1108, "hit": 50.0, "psr": 0.3237, "bh_sharpe": 1.428, "bh_return_pct": 3.97, "excess_sharpe": -2.4321}, {"fold": "fold_6", "regime": "COVID crash and V-recovery", "n": 75, "A_sharpe": -2.979, "A_sortino": -3.0703, "A_excess_sharpe": -7.2784, "A_return_pct": -9.5, "A_hit_rate": 36.0, "A_n": 75, "A_bh_sharpe": 4.2994, "A_bh_return_pct": 14.68, "A_psr": 0.061, "A_ic": 0.1555, "B_sharpe": 1.8702, "B_sortino": 2.1877, "B_excess_sharpe": -12.4638, "B_return_pct": 13.88, "B_hit_rate": 48.0, "B_n": 75, "B_bh_sharpe": 14.3339, "B_bh_return_pct": 120.13, "B_psr": 0.8465, "B_ic": 0.1728, "D_sharpe": -2.979, "D_sortino": -3.0703, "D_excess_sharpe": -7.2784, "D_return_pct": -9.5, "D_hit_rate": 36.0, "D_n": 75, "D_bh_sharpe": 4.2994, "D_bh_return_pct": 14.68, "D_psr": 0.061, "D_ic": 0.1555, "sharpe": -2.979, "sortino": -3.0703, "return_pct": -9.5, "equity": 905.0, "max_dd": 0.0, "win_rate": 36.0, "profit_factor": 0.0, "ic": 0.1555, "hit": 36.0, "psr": 0.061, "bh_sharpe": 4.2994, "bh_return_pct": 14.68, "excess_sharpe": -7.2784}, {"fold": "fold_7", "regime": "Inflation bear, AI rally and 2025", "n": 114, "A_sharpe": -3.0938, "A_sortino": -2.7498, "A_excess_sharpe": -5.9389, "A_return_pct": -19.86, "A_hit_rate": 43.86, "A_n": 114, "A_bh_sharpe": 2.845, "A_bh_return_pct": 21.34, "A_psr": 0.017, "A_ic": -0.0983, "B_sharpe": 1.2049, "B_sortino": 1.3368, "B_excess_sharpe": -4.9318, "B_return_pct": 18.74, "B_hit_rate": 51.75, "B_n": 114, "B_bh_sharpe": 6.1366, "B_bh_return_pct": 155.03, "B_psr": 0.7933, "B_ic": 0.0446, "D_sharpe": -3.0938, "D_sortino": -2.7498, "D_excess_sharpe": -5.9389, "D_return_pct": -19.86, "D_hit_rate": 43.86, "D_n": 114, "D_bh_sharpe": 2.845, "D_bh_return_pct": 21.34, "D_psr": 0.017, "D_ic": -0.0983, "sharpe": -3.0938, "sortino": -2.7498, "return_pct": -19.86, "equity": 801.4, "max_dd": 0.0, "win_rate": 43.86, "profit_factor": 0.0, "ic": -0.0983, "hit": 43.86, "psr": 0.017, "bh_sharpe": 2.845, "bh_return_pct": 21.34, "excess_sharpe": -5.9389}], "status": "DISCARD", "precision": 0.5734, "recall": 0.2082, "f1": 0.3055, "f2": 0.2386, "accuracy": 0.4582, "mcc": 0.0011, "tp": 168, "fp": 125, "tn": 478, "fn": 639, "test_sharpe": 0.4739, "A_sharpe": 0.4739, "A_excess_sharpe": -0.1304, "A_return_pct": 67.41, "A_precision": 0.5734, "A_recall": 0.2082, "A_f1": 0.3055, "A_f2": 0.2386, "A_accuracy": 0.4582, "A_mcc": 0.0011, "A_tp": 168, "A_fp": 125, "A_tn": 478, "A_fn": 639, "A_psr": 0.8716, "A_ic": 0.0117, "A_hit_rate": 45.7, "A_bh_sharpe": 0.6042, "A_bh_return_pct": 103.49}
