{"experiment_num": 18, "backbone": "catboost", "description": "CatBoost @ FX-Exp236 FULL n_est=2000 (Prokhorenkova 2018 NeurIPS); QQQ \u2014 testing the long-run path now that harness reaping is fixed", "config": {"seq_len": 60, "lr": 0.0003, "batch_size": 32, "epochs": 50, "weight_decay": 1e-05, "patience": 10, "warmup_epochs": 0, "head_dropout": 0.1, "huber_delta": 1.0, "grad_clip": 1.0, "seed": 42, "hidden_size": null, "num_layers": null, "max_depth": 4, "gbm_lr": 0.01, "n_estimators": 2000}, "composite": -0.9217, "test_pos_folds": 5, "val_pos_folds": 2, "val_loss": null, "elapsed_sec": 18919.4, "timestamp": "2026-04-26T22:26:01", "sharpe": 0.5942, "val_sharpe": -0.7217, "ic": 0.019, "hit": 48.5, "psr": 0.8927, "equity": 1585.0, "return_pct": 58.5, "bh_sharpe": 1.2194, "bh_return_pct": 187.05, "excess_sharpe": -0.6252, "B_sharpe": -0.351, "B_excess_sharpe": -3.1792, "B_return_pct": -68.26, "D_sharpe": 0.0026, "D_excess_sharpe": -1.2168, "D_return_pct": -9.94, "per_window": [{"fold": "fold_1", "regime": "GFC peak crash (Lehman + Mar-2009 bottom)", "n": 66, "A_sharpe": 2.1163, "A_sortino": 2.534, "A_excess_sharpe": 1.5442, "A_return_pct": 20.63, "A_hit_rate": 50.0, "A_n": 66, "A_bh_sharpe": 0.5721, "A_bh_return_pct": 3.85, "A_psr": 0.8641, "A_ic": 0.0823, "B_sharpe": 2.383, "B_sortino": 2.5881, "B_excess_sharpe": 0.336, "B_return_pct": 48.7, "B_hit_rate": 53.85, "B_n": 66, "B_bh_sharpe": 2.0469, "B_bh_return_pct": 39.28, "B_psr": 0.887, "B_ic": 0.1877, "D_sharpe": 3.5612, "D_sortino": 4.0569, "D_excess_sharpe": 2.9891, "D_return_pct": 38.08, "D_hit_rate": 57.58, "D_n": 66, "D_bh_sharpe": 0.5721, "D_bh_return_pct": 3.85, "D_psr": 0.9668, "D_ic": 0.1767, "sharpe": 2.1163, "sortino": 2.534, "return_pct": 20.63, "equity": 1206.3, "max_dd": 0.0, "win_rate": 50.0, "profit_factor": 0.0, "ic": 0.0823, "hit": 50.0, "psr": 0.8641, "bh_sharpe": 0.5721, "bh_return_pct": 3.85, "excess_sharpe": 1.5442, "precision": 0.5357, "recall": 0.4286, "f1": 0.4762, "f2": 0.4464, "accuracy": 0.5, "mcc": 0.0093, "tp": 15, "fp": 13, "tn": 18, "fn": 20, "A_precision": 0.5357, "A_recall": 0.4286, "A_f1": 0.4762, "A_f2": 0.4464, "A_accuracy": 0.5, "A_mcc": 0.0093, "A_tp": 15, "A_fp": 13, "A_tn": 18, "A_fn": 20}, {"fold": "fold_2", "regime": "2011 US-downgrade + EU debt", "n": 87, "A_sharpe": 2.9088, "A_sortino": 4.0013, "A_excess_sharpe": -2.1132, "A_return_pct": 16.36, "A_hit_rate": 53.49, "A_n": 87, "A_bh_sharpe": 5.022, "A_bh_return_pct": 29.23, "A_psr": 0.9699, "A_ic": 0.1177, "B_sharpe": 6.7368, "B_sortino": 7.3257, "B_excess_sharpe": -4.4002, "B_return_pct": 102.8, "B_hit_rate": 68.97, "B_n": 87, "B_bh_sharpe": 11.1369, "B_bh_return_pct": 185.4, "B_psr": 0.9999, "B_ic": 0.2097, "D_sharpe": 3.8793, "D_sortino": 4.7441, "D_excess_sharpe": -1.1427, "D_return_pct": 22.25, "D_hit_rate": 60.47, "D_n": 87, "D_bh_sharpe": 5.022, "D_bh_return_pct": 29.23, "D_psr": 0.9936, "D_ic": 0.0799, "sharpe": 2.9088, "sortino": 4.0013, "return_pct": 16.36, "equity": 1163.6, "max_dd": 0.0, "win_rate": 53.49, "profit_factor": 0.0, "ic": 0.1177, "hit": 53.49, "psr": 0.9699, "bh_sharpe": 5.022, "bh_return_pct": 29.23, "excess_sharpe": -2.1132, "precision": 0.6458, "recall": 0.5741, "f1": 0.6078, "f2": 0.5871, "accuracy": 0.5402, "mcc": 0.0575, "tp": 31, "fp": 17, "tn": 16, "fn": 23, "A_precision": 0.6458, "A_recall": 0.5741, "A_f1": 0.6078, "A_f2": 0.5871, "A_accuracy": 0.5402, "A_mcc": 0.0575, "A_tp": 31, "A_fp": 17, "A_tn": 16, "A_fn": 23}, {"fold": "fold_3", "regime": "Taper tantrum and 2014 H1", "n": 129, "A_sharpe": 1.8092, "A_sortino": 1.6404, "A_excess_sharpe": 0.0414, "A_return_pct": 12.06, "A_hit_rate": 57.03, "A_n": 129, "A_bh_sharpe": 1.7678, "A_bh_return_pct": 11.76, "A_psr": 0.8902, "A_ic": 0.0947, "B_sharpe": 3.3577, "B_sortino": 3.3421, "B_excess_sharpe": -0.8897, "B_return_pct": 48.22, "B_hit_rate": 61.24, "B_n": 129, "B_bh_sharpe": 4.2474, "B_bh_return_pct": 64.1, "B_psr": 0.9901, "B_ic": -0.0532, "D_sharpe": 1.651, "D_sortino": 1.4613, "D_excess_sharpe": -0.1168, "D_return_pct": 10.92, "D_hit_rate": 58.59, "D_n": 129, "D_bh_sharpe": 1.7678, "D_bh_return_pct": 11.76, "D_psr": 0.8699, "D_ic": 0.0936, "sharpe": 1.8092, "sortino": 1.6404, "return_pct": 12.06, "equity": 1120.6000000000001, "max_dd": 0.0, "win_rate": 57.03, "profit_factor": 0.0, "ic": 0.0947, "hit": 57.03, "psr": 0.8902, "bh_sharpe": 1.7678, "bh_return_pct": 11.76, "excess_sharpe": 0.0414, "precision": 0.5982, "recall": 0.859, "f1": 0.7053, "f2": 0.7901, "accuracy": 0.5659, "mcc": -0.0338, "tp": 67, "fp": 45, "tn": 6, "fn": 11, "A_precision": 0.5982, "A_recall": 0.859, "A_f1": 0.7053, "A_f2": 0.7901, "A_accuracy": 0.5659, "A_mcc": -0.0338, "A_tp": 67, "A_fp": 45, "A_tn": 6, "A_fn": 11}, {"fold": "fold_4", "regime": "China devaluation and oil crash", "n": 108, "A_sharpe": 0.4556, "A_sortino": 0.4274, "A_excess_sharpe": 1.1454, "A_return_pct": 3.14, "A_hit_rate": 54.21, "A_n": 108, "A_bh_sharpe": -0.6898, "A_bh_return_pct": -6.71, "A_psr": 0.6163, "A_ic": 0.0376, "B_sharpe": -4.0359, "B_sortino": -3.5932, "B_excess_sharpe": -2.0784, "B_return_pct": -54.17, "B_hit_rate": 38.89, "B_n": 108, "B_bh_sharpe": -1.9575, "B_bh_return_pct": -33.56, "B_psr": 0.0033, "B_ic": -0.0891, "D_sharpe": -1.3053, "D_sortino": -1.1977, "D_excess_sharpe": -0.6156, "D_return_pct": -11.58, "D_hit_rate": 46.73, "D_n": 108, "D_bh_sharpe": -0.6898, "D_bh_return_pct": -6.71, "D_psr": 0.1933, "D_ic": -0.0137, "sharpe": 0.4556, "sortino": 0.4274, "return_pct": 3.14, "equity": 1031.4, "max_dd": 0.0, "win_rate": 54.21, "profit_factor": 0.0, "ic": 0.0376, "hit": 54.21, "psr": 0.6163, "bh_sharpe": -0.6898, "bh_return_pct": -6.71, "excess_sharpe": 1.1454, "precision": 0.5323, "recall": 0.6226, "f1": 0.5739, "f2": 0.6022, "accuracy": 0.5463, "mcc": 0.0964, "tp": 33, "fp": 29, "tn": 26, "fn": 20, "A_precision": 0.5323, "A_recall": 0.6226, "A_f1": 0.5739, "A_f2": 0.6022, "A_accuracy": 0.5463, "A_mcc": 0.0964, "A_tp": 33, "A_fp": 29, "A_tn": 26, "A_fn": 20}, {"fold": "fold_5", "regime": "2018 Vol-mageddon + Q4 sell-off", "n": 128, "A_sharpe": -0.2078, "A_sortino": -0.2216, "A_excess_sharpe": -1.359, "A_return_pct": -3.84, "A_hit_rate": 47.66, "A_n": 128, "A_bh_sharpe": 1.1511, "A_bh_return_pct": 13.19, "A_psr": 0.4415, "A_ic": -0.0428, "B_sharpe": -4.5152, "B_sortino": -4.3044, "B_excess_sharpe": -7.3271, "B_return_pct": -66.2, "B_hit_rate": 33.07, "B_n": 128, "B_bh_sharpe": 2.8119, "B_bh_return_pct": 82.25, "B_psr": 0.0009, "B_ic": -0.1173, "D_sharpe": -1.9103, "D_sortino": -2.0353, "D_excess_sharpe": -3.0614, "D_return_pct": -21.51, "D_hit_rate": 40.62, "D_n": 128, "D_bh_sharpe": 1.1511, "D_bh_return_pct": 13.19, "D_psr": 0.0968, "D_ic": -0.0807, "sharpe": -0.2078, "sortino": -0.2216, "return_pct": -3.84, "equity": 961.6, "max_dd": 0.0, "win_rate": 47.66, "profit_factor": 0.0, "ic": -0.0428, "hit": 47.66, "psr": 0.4415, "bh_sharpe": 1.1511, "bh_return_pct": 13.19, "excess_sharpe": -1.359, "precision": 0.5797, "recall": 0.5128, "f1": 0.5442, "f2": 0.5249, "accuracy": 0.4766, "mcc": -0.0658, "tp": 40, "fp": 29, "tn": 21, "fn": 38, "A_precision": 0.5797, "A_recall": 0.5128, "A_f1": 0.5442, "A_f2": 0.5249, "A_accuracy": 0.4766, "A_mcc": -0.0658, "A_tp": 40, "A_fp": 29, "A_tn": 21, "A_fn": 38}, {"fold": "fold_6", "regime": "COVID crash and V-recovery", "n": 173, "A_sharpe": 1.8749, "A_sortino": 2.357, "A_excess_sharpe": -0.4512, "A_return_pct": 33.69, "A_hit_rate": 49.71, "A_n": 173, "A_bh_sharpe": 2.3261, "A_bh_return_pct": 43.81, "A_psr": 0.9469, "A_ic": 0.0677, "B_sharpe": -0.0, "B_sortino": -0.0001, "B_excess_sharpe": -5.7461, "B_return_pct": -8.35, "B_hit_rate": 47.67, "B_n": 173, "B_bh_sharpe": 5.746, "B_bh_return_pct": 499.04, "B_psr": 0.5, "B_ic": 0.1294, "D_sharpe": -0.4711, "D_sortino": -0.5564, "D_excess_sharpe": -2.7971, "D_return_pct": -9.39, "D_hit_rate": 39.88, "D_n": 173, "D_bh_sharpe": 2.3261, "D_bh_return_pct": 43.81, "D_psr": 0.3498, "D_ic": 0.0023, "sharpe": 1.8749, "sortino": 2.357, "return_pct": 33.69, "equity": 1336.9, "max_dd": 0.0, "win_rate": 49.71, "profit_factor": 0.0, "ic": 0.0677, "hit": 49.71, "psr": 0.9469, "bh_sharpe": 2.3261, "bh_return_pct": 43.81, "excess_sharpe": -0.4512, "precision": 0.6912, "recall": 0.4159, "f1": 0.5193, "f2": 0.4519, "accuracy": 0.4971, "mcc": 0.0642, "tp": 47, "fp": 21, "tn": 39, "fn": 66, "A_precision": 0.6912, "A_recall": 0.4159, "A_f1": 0.5193, "A_f2": 0.4519, "A_accuracy": 0.4971, "A_mcc": 0.0642, "A_tp": 47, "A_fp": 21, "A_tn": 39, "A_fn": 66}, {"fold": "fold_7", "regime": "Inflation bear, AI rally and 2025", "n": 376, "A_sharpe": -0.7095, "A_sortino": -0.8304, "A_excess_sharpe": -1.5128, "A_return_pct": -24.01, "A_hit_rate": 42.29, "A_n": 376, "A_bh_sharpe": 0.8033, "A_bh_return_pct": 26.02, "A_psr": 0.2017, "A_ic": 0.0053, "B_sharpe": -0.7679, "B_sortino": -0.8733, "B_excess_sharpe": -2.6996, "B_return_pct": -49.99, "B_hit_rate": 41.07, "B_n": 376, "B_bh_sharpe": 1.9317, "B_bh_return_pct": 222.05, "B_psr": 0.1782, "B_ic": -0.0228, "D_sharpe": -0.6898, "D_sortino": -0.8261, "D_excess_sharpe": -1.4931, "D_return_pct": -23.51, "D_hit_rate": 41.22, "D_n": 376, "D_bh_sharpe": 0.8033, "D_bh_return_pct": 26.02, "D_psr": 0.2084, "D_ic": -0.0102, "sharpe": -0.7095, "sortino": -0.8304, "return_pct": -24.01, "equity": 759.9, "max_dd": 0.0, "win_rate": 42.29, "profit_factor": 0.0, "ic": 0.0053, "hit": 42.29, "psr": 0.2017, "bh_sharpe": 0.8033, "bh_return_pct": 26.02, "excess_sharpe": -1.5128, "precision": 0.5588, "recall": 0.086, "f1": 0.149, "f2": 0.1035, "accuracy": 0.4229, "mcc": -0.0185, "tp": 19, "fp": 15, "tn": 140, "fn": 202, "A_precision": 0.5588, "A_recall": 0.086, "A_f1": 0.149, "A_f2": 0.1035, "A_accuracy": 0.4229, "A_mcc": -0.0185, "A_tp": 19, "A_fp": 15, "A_tn": 140, "A_fn": 202}], "per_window_val": [{"fold": "fold_1", "regime": "GFC peak crash (Lehman + Mar-2009 bottom)", "n": 65, "A_sharpe": -1.4286, "A_sortino": -1.2576, "A_excess_sharpe": 0.7971, "A_return_pct": -13.0, "A_hit_rate": 49.21, "A_n": 65, "A_bh_sharpe": -2.2257, "A_bh_return_pct": -18.74, "A_psr": 0.2297, "A_ic": 0.0691, "B_sharpe": -3.1823, "B_sortino": -2.9101, "B_excess_sharpe": 3.9401, "B_return_pct": -48.67, "B_hit_rate": 43.08, "B_n": 65, "B_bh_sharpe": -7.1223, "B_bh_return_pct": -73.11, "B_psr": 0.0547, "B_ic": 0.4239, "D_sharpe": 1.0055, "D_sortino": 1.0122, "D_excess_sharpe": 3.2312, "D_return_pct": 7.57, "D_hit_rate": 53.97, "D_n": 65, "D_bh_sharpe": -2.2257, "D_bh_return_pct": -18.74, "D_psr": 0.6956, "D_ic": 0.3286, "sharpe": -1.4286, "sortino": -1.2576, "return_pct": -13.0, "equity": 870.0, "max_dd": 0.0, "win_rate": 49.21, "profit_factor": 0.0, "ic": 0.0691, "hit": 49.21, "psr": 0.2297, "bh_sharpe": -2.2257, "bh_return_pct": -18.74, "excess_sharpe": 0.7971}, {"fold": "fold_2", "regime": "2011 US-downgrade + EU debt", "n": 47, "A_sharpe": 0.665, "A_sortino": 0.6003, "A_excess_sharpe": 0.8591, "A_return_pct": 3.22, "A_hit_rate": 57.45, "A_n": 47, "A_bh_sharpe": -0.1941, "A_bh_return_pct": -2.36, "A_psr": 0.611, "A_ic": 0.0642, "B_sharpe": 0.4034, "B_sortino": 0.3683, "B_excess_sharpe": 2.0157, "B_return_pct": 0.29, "B_hit_rate": 53.19, "B_n": 47, "B_bh_sharpe": -1.6123, "B_bh_return_pct": -24.3, "B_psr": 0.5679, "B_ic": 0.1384, "D_sharpe": -0.0011, "D_sortino": -0.001, "D_excess_sharpe": 0.1929, "D_return_pct": -1.14, "D_hit_rate": 55.32, "D_n": 47, "D_bh_sharpe": -0.1941, "D_bh_return_pct": -2.36, "D_psr": 0.4998, "D_ic": 0.0163, "sharpe": 0.665, "sortino": 0.6003, "return_pct": 3.22, "equity": 1032.2, "max_dd": 0.0, "win_rate": 57.45, "profit_factor": 0.0, "ic": 0.0642, "hit": 57.45, "psr": 0.611, "bh_sharpe": -0.1941, "bh_return_pct": -2.36, "excess_sharpe": 0.8591}, {"fold": "fold_3", "regime": "Taper tantrum and 2014 H1", "n": 5, "A_sharpe": -0.5833, "A_sortino": -0.6746, "A_excess_sharpe": 0.7361, "A_return_pct": -0.1, "A_hit_rate": 40.0, "A_n": 5, "A_bh_sharpe": -1.3194, "A_bh_return_pct": -0.21, "A_psr": 0.4709, "A_ic": -0.1, "B_sharpe": 25.8705, "B_sortino": 0.0, "B_excess_sharpe": 51.7411, "B_return_pct": 3.95, "B_hit_rate": 100.0, "B_n": 5, "B_bh_sharpe": -25.8705, "B_bh_return_pct": -3.84, "B_psr": 1.0, "B_ic": -0.7, "D_sharpe": 1.3194, "D_sortino": 1.268, "D_excess_sharpe": 2.6388, "D_return_pct": 0.2, "D_hit_rate": 60.0, "D_n": 5, "D_bh_sharpe": -1.3194, "D_bh_return_pct": -0.21, "D_psr": 0.5663, "D_ic": -0.8, "sharpe": -0.5833, "sortino": -0.6746, "return_pct": -0.1, "equity": 999.0, "max_dd": 0.0, "win_rate": 40.0, "profit_factor": 0.0, "ic": -0.1, "hit": 40.0, "psr": 0.4709, "bh_sharpe": -1.3194, "bh_return_pct": -0.21, "excess_sharpe": 0.7361}, {"fold": "fold_4", "regime": "China devaluation and oil crash", "n": 47, "A_sharpe": -2.1863, "A_sortino": -2.0797, "A_excess_sharpe": -0.3625, "A_return_pct": -10.18, "A_hit_rate": 42.55, "A_n": 47, "A_bh_sharpe": -1.8238, "A_bh_return_pct": -8.68, "A_psr": 0.1755, "A_ic": 0.0131, "B_sharpe": -2.3514, "B_sortino": -2.0531, "B_excess_sharpe": -0.1314, "B_return_pct": -25.04, "B_hit_rate": 42.55, "B_n": 47, "B_bh_sharpe": -2.22, "B_bh_return_pct": -23.98, "B_psr": 0.1358, "B_ic": 0.59, "D_sharpe": -0.4563, "D_sortino": -0.4562, "D_excess_sharpe": 1.3675, "D_return_pct": -2.69, "D_hit_rate": 46.81, "D_n": 47, "D_bh_sharpe": -1.8238, "D_bh_return_pct": -8.68, "D_psr": 0.4227, "D_ic": 0.2128, "sharpe": -2.1863, "sortino": -2.0797, "return_pct": -10.18, "equity": 898.2, "max_dd": 0.0, "win_rate": 42.55, "profit_factor": 0.0, "ic": 0.0131, "hit": 42.55, "psr": 0.1755, "bh_sharpe": -1.8238, "bh_return_pct": -8.68, "excess_sharpe": -0.3625}, {"fold": "fold_5", "regime": "2018 Vol-mageddon + Q4 sell-off", "n": 5, "A_sharpe": -10.1368, "A_sortino": -6.9937, "A_excess_sharpe": 0.0, "A_return_pct": -3.15, "A_hit_rate": 40.0, "A_n": 5, "A_bh_sharpe": -10.1368, "A_bh_return_pct": -3.15, "A_psr": 0.0985, "A_ic": 0.1, "B_sharpe": 5.6858, "B_sortino": 6.0578, "B_excess_sharpe": 0.0, "B_return_pct": 4.22, "B_hit_rate": 60.0, "B_n": 5, "B_bh_sharpe": 5.6858, "B_bh_return_pct": 4.22, "B_psr": 0.753, "B_ic": 0.8, "D_sharpe": -10.1368, "D_sortino": -6.9937, "D_excess_sharpe": 0.0, "D_return_pct": -3.15, "D_hit_rate": 40.0, "D_n": 5, "D_bh_sharpe": -10.1368, "D_bh_return_pct": -3.15, "D_psr": 0.0985, "D_ic": 0.5, "sharpe": -10.1368, "sortino": -6.9937, "return_pct": -3.15, "equity": 968.5, "max_dd": 0.0, "win_rate": 40.0, "profit_factor": 0.0, "ic": 0.1, "hit": 40.0, "psr": 0.0985, "bh_sharpe": -10.1368, "bh_return_pct": -3.15, "excess_sharpe": 0.0}, {"fold": "fold_6", "regime": "COVID crash and V-recovery", "n": 26, "A_sharpe": 5.3391, "A_sortino": 7.4478, "A_excess_sharpe": 2.0539, "A_return_pct": 7.76, "A_hit_rate": 53.85, "A_n": 26, "A_bh_sharpe": 3.2852, "A_bh_return_pct": 4.82, "A_psr": 0.9589, "A_ic": 0.1658, "B_sharpe": 1.5294, "B_sortino": 1.4852, "B_excess_sharpe": -11.4498, "B_return_pct": 4.62, "B_hit_rate": 57.69, "B_n": 26, "B_bh_sharpe": 12.9792, "B_bh_return_pct": 38.76, "B_psr": 0.6848, "B_ic": 0.4537, "D_sharpe": 4.5762, "D_sortino": 5.907, "D_excess_sharpe": 1.291, "D_return_pct": 6.69, "D_hit_rate": 53.85, "D_n": 26, "D_bh_sharpe": 3.2852, "D_bh_return_pct": 4.82, "D_psr": 0.9306, "D_ic": 0.3005, "sharpe": 5.3391, "sortino": 7.4478, "return_pct": 7.76, "equity": 1077.6, "max_dd": 0.0, "win_rate": 53.85, "profit_factor": 0.0, "ic": 0.1658, "hit": 53.85, "psr": 0.9589, "bh_sharpe": 3.2852, "bh_return_pct": 4.82, "excess_sharpe": 2.0539}, {"fold": "fold_7", "regime": "Inflation bear, AI rally and 2025", "n": 65, "A_sharpe": -1.4782, "A_sortino": -1.3726, "A_excess_sharpe": -3.5571, "A_return_pct": -5.94, "A_hit_rate": 47.69, "A_n": 65, "A_bh_sharpe": 2.0789, "A_bh_return_pct": 8.17, "A_psr": 0.226, "A_ic": 0.0586, "B_sharpe": -5.2314, "B_sortino": -4.8393, "B_excess_sharpe": -10.4628, "B_return_pct": -32.36, "B_hit_rate": 32.31, "B_n": 65, "B_bh_sharpe": 5.2314, "B_bh_return_pct": 44.53, "B_psr": 0.0054, "B_ic": 0.2128, "D_sharpe": -2.0789, "D_sortino": -1.8995, "D_excess_sharpe": -4.1578, "D_return_pct": -8.11, "D_hit_rate": 46.15, "D_n": 65, "D_bh_sharpe": 2.0789, "D_bh_return_pct": 8.17, "D_psr": 0.1438, "D_ic": 0.1216, "sharpe": -1.4782, "sortino": -1.3726, "return_pct": -5.94, "equity": 940.6, "max_dd": 0.0, "win_rate": 47.69, "profit_factor": 0.0, "ic": 0.0586, "hit": 47.69, "psr": 0.226, "bh_sharpe": 2.0789, "bh_return_pct": 8.17, "excess_sharpe": -3.5571}], "status": "DISCARD", "precision": 0.5986, "recall": 0.3987, "f1": 0.4786, "f2": 0.4273, "accuracy": 0.4855, "mcc": 0.0103, "tp": 252, "fp": 169, "tn": 266, "fn": 380, "test_sharpe": 0.5942, "A_sharpe": 0.5942, "A_excess_sharpe": -0.6252, "A_return_pct": 58.5, "A_precision": 0.5986, "A_recall": 0.3987, "A_f1": 0.4786, "A_f2": 0.4273, "A_accuracy": 0.4855, "A_mcc": 0.0103, "A_tp": 252, "A_fp": 169, "A_tn": 266, "A_fn": 380, "A_psr": 0.8927, "A_ic": 0.019, "A_hit_rate": 48.5, "A_bh_sharpe": 1.2194, "A_bh_return_pct": 187.05}
