{"experiment_num": 87, "backbone": "lstm", "description": "LSTM @ exp 71 1-layer hd=0.15 (up from 0.1) - Srivastava 2014 mild reg final cheap-tier slot", "config": {"seq_len": 10, "lr": 0.001, "batch_size": 16, "epochs": 100, "weight_decay": 0.0007, "patience": 15, "warmup_epochs": 0, "head_dropout": 0.15, "huber_delta": 1.0, "grad_clip": 1.0, "seed": 0, "hidden_size": null, "num_layers": 1, "max_depth": null, "gbm_lr": null, "n_estimators": null}, "composite": -1.1144, "test_pos_folds": 2, "val_pos_folds": 4, "val_loss": -2.876834909188205, "elapsed_sec": 36.8, "timestamp": "2026-04-27T23:26:52", "sharpe": -0.6144, "val_sharpe": -0.0276, "ic": -0.0254, "hit": 44.42, "psr": 0.0749, "equity": 320.19999999999993, "return_pct": -67.98, "bh_sharpe": 0.6042, "bh_return_pct": 103.49, "excess_sharpe": -1.2187, "B_sharpe": -1.2207, "B_excess_sharpe": -2.9215, "B_return_pct": -98.82, "D_sharpe": -0.6144, "D_excess_sharpe": -1.2187, "D_return_pct": -67.98, "precision": 0.5676, "recall": 0.1301, "f1": 0.2117, "f2": 0.1538, "mcc": -0.0037, "accuracy": 0.4454, "val_precision": 0.5758, "val_recall": 0.1155, "val_f1": 0.1924, "val_f2": 0.1375, "val_mcc": 0.0149, "val_accuracy": 0.4621, "per_window": [{"fold": "fold_1", "regime": "GFC peak crash (Lehman + Mar-2009 bottom)", "n": 115, "A_sharpe": -0.9763, "A_sortino": -0.9254, "A_excess_sharpe": -0.5322, "A_return_pct": -24.05, "A_hit_rate": 49.57, "A_n": 115, "A_bh_sharpe": -0.4441, "A_bh_return_pct": -14.4, "A_psr": 0.2555, "A_ic": -0.1751, "A_precision": 0.3889, "A_recall": 0.1296, "A_f1": 0.1944, "A_f2": 0.1496, "A_accuracy": 0.4957, "A_mcc": -0.0696, "A_tp": 7, "A_fp": 11, "A_tn": 50, "A_fn": 47, "B_sharpe": -2.3444, "B_sortino": -2.1212, "B_excess_sharpe": -2.0466, "B_return_pct": -68.86, "B_hit_rate": 44.74, "B_n": 115, "B_bh_sharpe": -0.2978, "B_bh_return_pct": -27.23, "B_psr": 0.0536, "B_ic": 0.0446, "B_precision": 0.4333, "B_recall": 0.2203, "B_f1": 0.2921, "B_f2": 0.2444, "B_accuracy": 0.4522, "B_mcc": -0.0947, "B_tp": 13, "B_fp": 17, "B_tn": 39, "B_fn": 46, "D_sharpe": -0.9763, "D_sortino": -0.9254, "D_excess_sharpe": -0.5322, "D_return_pct": -24.05, "D_hit_rate": 49.57, "D_n": 115, "D_bh_sharpe": -0.4441, "D_bh_return_pct": -14.4, "D_psr": 0.2555, "D_ic": -0.1751, "D_precision": 0.3889, "D_recall": 0.1296, "D_f1": 0.1944, "D_f2": 0.1496, "D_accuracy": 0.4957, "D_mcc": -0.0696, "D_tp": 7, "D_fp": 11, "D_tn": 50, "D_fn": 47, "sharpe": -0.9763, "sortino": -0.9254, "return_pct": -24.05, "equity": 759.5, "max_dd": 0.0, "win_rate": 49.57, "profit_factor": 0.0, "ic": -0.1751, "hit": 49.57, "psr": 0.2555, "bh_sharpe": -0.4441, "bh_return_pct": -14.4, "excess_sharpe": -0.5322, "precision": 0.3889, "recall": 0.1296, "f1": 0.1944, "f2": 0.1496, "mcc": -0.0696, "accuracy": 0.4957, "tp": 7, "fp": 11, "tn": 50, "fn": 47}, {"fold": "fold_2", "regime": "2011 US-downgrade + EU debt", "n": 136, "A_sharpe": 0.8514, "A_sortino": 0.8981, "A_excess_sharpe": -0.8813, "A_return_pct": 8.67, "A_hit_rate": 50.37, "A_n": 136, "A_bh_sharpe": 1.7327, "A_bh_return_pct": 19.75, "A_psr": 0.7336, "A_ic": 0.1702, "A_precision": 0.6774, "A_recall": 0.2692, "A_f1": 0.3853, "A_f2": 0.3061, "A_accuracy": 0.5074, "A_mcc": 0.1141, "A_tp": 21, "A_fp": 10, "A_tn": 48, "A_fn": 57, "B_sharpe": -1.3045, "B_sortino": -1.2535, "B_excess_sharpe": -5.3704, "B_return_pct": -31.27, "B_hit_rate": 47.79, "B_n": 136, "B_bh_sharpe": 4.0659, "B_bh_return_pct": 148.68, "B_psr": 0.1705, "B_ic": -0.0637, "B_precision": 0.6761, "B_recall": 0.5, "B_f1": 0.5749, "B_f2": 0.5275, "B_accuracy": 0.4779, "B_mcc": -0.0684, "B_tp": 48, "B_fp": 23, "B_tn": 17, "B_fn": 48, "D_sharpe": 0.8514, "D_sortino": 0.8981, "D_excess_sharpe": -0.8813, "D_return_pct": 8.67, "D_hit_rate": 50.37, "D_n": 136, "D_bh_sharpe": 1.7327, "D_bh_return_pct": 19.75, "D_psr": 0.7336, "D_ic": 0.1702, "D_precision": 0.6774, "D_recall": 0.2692, "D_f1": 0.3853, "D_f2": 0.3061, "D_accuracy": 0.5074, "D_mcc": 0.1141, "D_tp": 21, "D_fp": 10, "D_tn": 48, "D_fn": 57, "sharpe": 0.8514, "sortino": 0.8981, "return_pct": 8.67, "equity": 1086.7, "max_dd": 0.0, "win_rate": 50.37, "profit_factor": 0.0, "ic": 0.1702, "hit": 50.37, "psr": 0.7336, "bh_sharpe": 1.7327, "bh_return_pct": 19.75, "excess_sharpe": -0.8813, "precision": 0.6774, "recall": 0.2692, "f1": 0.3853, "f2": 0.3061, "mcc": 0.1141, "accuracy": 0.5074, "tp": 21, "fp": 10, "tn": 48, "fn": 57}, {"fold": "fold_3", "regime": "Taper tantrum and 2014 H1", "n": 178, "A_sharpe": -0.9064, "A_sortino": -1.0227, "A_excess_sharpe": -2.251, "A_return_pct": -8.51, "A_hit_rate": 42.94, "A_n": 178, "A_bh_sharpe": 1.3445, "A_bh_return_pct": 12.41, "A_psr": 0.2289, "A_ic": -0.0376, "A_precision": 0.5556, "A_recall": 0.0971, "A_f1": 0.1653, "A_f2": 0.1163, "A_accuracy": 0.4326, "A_mcc": -0.0157, "A_tp": 10, "A_fp": 8, "A_tn": 67, "A_fn": 93, "B_sharpe": -2.1347, "B_sortino": -1.9632, "B_excess_sharpe": -5.1831, "B_return_pct": -34.69, "B_hit_rate": 44.94, "B_n": 178, "B_bh_sharpe": 3.0483, "B_bh_return_pct": 71.83, "B_psr": 0.0345, "B_ic": -0.21, "B_precision": 0.5591, "B_recall": 0.4771, "B_f1": 0.5149, "B_f2": 0.4915, "B_accuracy": 0.4494, "B_mcc": -0.1143, "B_tp": 52, "B_fp": 41, "B_tn": 28, "B_fn": 57, "D_sharpe": -0.9064, "D_sortino": -1.0227, "D_excess_sharpe": -2.251, "D_return_pct": -8.51, "D_hit_rate": 42.94, "D_n": 178, "D_bh_sharpe": 1.3445, "D_bh_return_pct": 12.41, "D_psr": 0.2289, "D_ic": -0.0376, "D_precision": 0.5556, "D_recall": 0.0971, "D_f1": 0.1653, "D_f2": 0.1163, "D_accuracy": 0.4326, "D_mcc": -0.0157, "D_tp": 10, "D_fp": 8, "D_tn": 67, "D_fn": 93, "sharpe": -0.9064, "sortino": -1.0227, "return_pct": -8.51, "equity": 914.9000000000001, "max_dd": 0.0, "win_rate": 42.94, "profit_factor": 0.0, "ic": -0.0376, "hit": 42.94, "psr": 0.2289, "bh_sharpe": 1.3445, "bh_return_pct": 12.41, "excess_sharpe": -2.251, "precision": 0.5556, "recall": 0.0971, "f1": 0.1653, "f2": 0.1163, "mcc": -0.0157, "accuracy": 0.4326, "tp": 10, "fp": 8, "tn": 67, "fn": 93}, {"fold": "fold_4", "regime": "China devaluation and oil crash", "n": 157, "A_sharpe": -0.733, "A_sortino": -0.7153, "A_excess_sharpe": -0.7428, "A_return_pct": -9.54, "A_hit_rate": 48.08, "A_n": 157, "A_bh_sharpe": 0.0098, "A_bh_return_pct": -1.05, "A_psr": 0.2822, "A_ic": -0.0851, "A_precision": 0.5, "A_recall": 0.0988, "A_f1": 0.1649, "A_f2": 0.1176, "A_accuracy": 0.4841, "A_mcc": -0.0107, "A_tp": 8, "A_fp": 8, "A_tn": 68, "A_fn": 73, "B_sharpe": 0.0302, "B_sortino": 0.0314, "B_excess_sharpe": 0.0143, "B_return_pct": -5.03, "B_hit_rate": 50.32, "B_n": 157, "B_bh_sharpe": 0.0159, "B_bh_return_pct": -5.48, "B_psr": 0.5095, "B_ic": -0.0052, "B_precision": 0.5614, "B_recall": 0.3765, "B_f1": 0.4507, "B_f2": 0.403, "B_accuracy": 0.5032, "B_mcc": 0.0303, "B_tp": 32, "B_fp": 25, "B_tn": 47, "B_fn": 53, "D_sharpe": -0.733, "D_sortino": -0.7153, "D_excess_sharpe": -0.7428, "D_return_pct": -9.54, "D_hit_rate": 48.08, "D_n": 157, "D_bh_sharpe": 0.0098, "D_bh_return_pct": -1.05, "D_psr": 0.2822, "D_ic": -0.0851, "D_precision": 0.5, "D_recall": 0.0988, "D_f1": 0.1649, "D_f2": 0.1176, "D_accuracy": 0.4841, "D_mcc": -0.0107, "D_tp": 8, "D_fp": 8, "D_tn": 68, "D_fn": 73, "sharpe": -0.733, "sortino": -0.7153, "return_pct": -9.54, "equity": 904.6, "max_dd": 0.0, "win_rate": 48.08, "profit_factor": 0.0, "ic": -0.0851, "hit": 48.08, "psr": 0.2822, "bh_sharpe": 0.0098, "bh_return_pct": -1.05, "excess_sharpe": -0.7428, "precision": 0.5, "recall": 0.0988, "f1": 0.1649, "f2": 0.1176, "mcc": -0.0107, "accuracy": 0.4841, "tp": 8, "fp": 8, "tn": 68, "fn": 73}, {"fold": "fold_5", "regime": "2018 Vol-mageddon + Q4 sell-off", "n": 177, "A_sharpe": -0.4388, "A_sortino": -0.4731, "A_excess_sharpe": -0.7486, "A_return_pct": -8.57, "A_hit_rate": 41.81, "A_n": 177, "A_bh_sharpe": 0.3098, "A_bh_return_pct": 3.19, "A_psr": 0.3568, "A_ic": 0.0288, "A_precision": 0.5, "A_recall": 0.0583, "A_f1": 0.1043, "A_f2": 0.0708, "A_accuracy": 0.4181, "A_mcc": -0.0448, "A_tp": 6, "A_fp": 6, "A_tn": 68, "A_fn": 97, "B_sharpe": 0.6835, "B_sortino": 0.7349, "B_excess_sharpe": -0.2081, "B_return_pct": 15.89, "B_hit_rate": 50.57, "B_n": 177, "B_bh_sharpe": 0.8917, "B_bh_return_pct": 23.8, "B_psr": 0.7175, "B_ic": 0.0402, "B_precision": 0.6438, "B_recall": 0.4312, "B_f1": 0.5165, "B_f2": 0.4617, "B_accuracy": 0.5028, "B_mcc": 0.0483, "B_tp": 47, "B_fp": 26, "B_tn": 42, "B_fn": 62, "D_sharpe": -0.4388, "D_sortino": -0.4731, "D_excess_sharpe": -0.7486, "D_return_pct": -8.57, "D_hit_rate": 41.81, "D_n": 177, "D_bh_sharpe": 0.3098, "D_bh_return_pct": 3.19, "D_psr": 0.3568, "D_ic": 0.0288, "D_precision": 0.5, "D_recall": 0.0583, "D_f1": 0.1043, "D_f2": 0.0708, "D_accuracy": 0.4181, "D_mcc": -0.0448, "D_tp": 6, "D_fp": 6, "D_tn": 68, "D_fn": 97, "sharpe": -0.4388, "sortino": -0.4731, "return_pct": -8.57, "equity": 914.3, "max_dd": 0.0, "win_rate": 41.81, "profit_factor": 0.0, "ic": 0.0288, "hit": 41.81, "psr": 0.3568, "bh_sharpe": 0.3098, "bh_return_pct": 3.19, "excess_sharpe": -0.7486, "precision": 0.5, "recall": 0.0583, "f1": 0.1043, "f2": 0.0708, "mcc": -0.0448, "accuracy": 0.4181, "tp": 6, "fp": 6, "tn": 68, "fn": 97}, {"fold": "fold_6", "regime": "COVID crash and V-recovery", "n": 222, "A_sharpe": -1.7927, "A_sortino": -1.8917, "A_excess_sharpe": -2.6815, "A_return_pct": -48.2, "A_hit_rate": 39.19, "A_n": 222, "A_bh_sharpe": 0.8888, "A_bh_return_pct": 26.13, "A_psr": 0.0531, "A_ic": -0.0427, "A_precision": 0.5652, "A_recall": 0.0942, "A_f1": 0.1615, "A_f2": 0.113, "A_accuracy": 0.3919, "A_mcc": -0.0395, "A_tp": 13, "A_fp": 10, "A_tn": 74, "A_fn": 125, "B_sharpe": -2.3926, "B_sortino": -2.5894, "B_excess_sharpe": -4.781, "B_return_pct": -81.14, "B_hit_rate": 38.91, "B_n": 222, "B_bh_sharpe": 2.3884, "B_bh_return_pct": 243.18, "B_psr": 0.0182, "B_ic": -0.2436, "B_precision": 0.5192, "B_recall": 0.1971, "B_f1": 0.2857, "B_f2": 0.225, "B_accuracy": 0.3919, "B_mcc": -0.1114, "B_tp": 27, "B_fp": 25, "B_tn": 60, "B_fn": 110, "D_sharpe": -1.7927, "D_sortino": -1.8917, "D_excess_sharpe": -2.6815, "D_return_pct": -48.2, "D_hit_rate": 39.19, "D_n": 222, "D_bh_sharpe": 0.8888, "D_bh_return_pct": 26.13, "D_psr": 0.0531, "D_ic": -0.0427, "D_precision": 0.5652, "D_recall": 0.0942, "D_f1": 0.1615, "D_f2": 0.113, "D_accuracy": 0.3919, "D_mcc": -0.0395, "D_tp": 13, "D_fp": 10, "D_tn": 74, "D_fn": 125, "sharpe": -1.7927, "sortino": -1.8917, "return_pct": -48.2, "equity": 518.0, "max_dd": 0.0, "win_rate": 39.19, "profit_factor": 0.0, "ic": -0.0427, "hit": 39.19, "psr": 0.0531, "bh_sharpe": 0.8888, "bh_return_pct": 26.13, "excess_sharpe": -2.6815, "precision": 0.5652, "recall": 0.0942, "f1": 0.1615, "f2": 0.113, "mcc": -0.0395, "accuracy": 0.3919, "tp": 13, "fp": 10, "tn": 74, "fn": 125}, {"fold": "fold_7", "regime": "Inflation bear, AI rally and 2025", "n": 425, "A_sharpe": 0.0789, "A_sortino": 0.0983, "A_excess_sharpe": -0.8926, "A_return_pct": -1.02, "A_hit_rate": 44.24, "A_n": 425, "A_bh_sharpe": 0.9715, "A_bh_return_pct": 37.12, "A_psr": 0.5409, "A_ic": 0.0159, "A_precision": 0.597, "A_recall": 0.16, "A_f1": 0.2524, "A_f2": 0.1874, "A_accuracy": 0.4424, "A_mcc": 0.0077, "A_tp": 40, "A_fp": 27, "A_tn": 148, "A_fn": 210, "B_sharpe": -0.9433, "B_sortino": -0.9298, "B_excess_sharpe": -3.446, "B_return_pct": -59.2, "B_hit_rate": 47.17, "B_n": 425, "B_bh_sharpe": 2.5027, "B_bh_return_pct": 458.83, "B_psr": 0.1118, "B_ic": -0.0996, "B_precision": 0.6258, "B_recall": 0.3688, "B_f1": 0.4641, "B_f2": 0.4018, "B_accuracy": 0.4729, "B_mcc": 0.0109, "B_tp": 97, "B_fp": 58, "B_tn": 104, "B_fn": 166, "D_sharpe": 0.0789, "D_sortino": 0.0983, "D_excess_sharpe": -0.8926, "D_return_pct": -1.02, "D_hit_rate": 44.24, "D_n": 425, "D_bh_sharpe": 0.9715, "D_bh_return_pct": 37.12, "D_psr": 0.5409, "D_ic": 0.0159, "D_precision": 0.597, "D_recall": 0.16, "D_f1": 0.2524, "D_f2": 0.1874, "D_accuracy": 0.4424, "D_mcc": 0.0077, "D_tp": 40, "D_fp": 27, "D_tn": 148, "D_fn": 210, "sharpe": 0.0789, "sortino": 0.0983, "return_pct": -1.02, "equity": 989.8000000000001, "max_dd": 0.0, "win_rate": 44.24, "profit_factor": 0.0, "ic": 0.0159, "hit": 44.24, "psr": 0.5409, "bh_sharpe": 0.9715, "bh_return_pct": 37.12, "excess_sharpe": -0.8926, "precision": 0.597, "recall": 0.16, "f1": 0.2524, "f2": 0.1874, "mcc": 0.0077, "accuracy": 0.4424, "tp": 40, "fp": 27, "tn": 148, "fn": 210}], "per_window_val": [{"fold": "fold_1", "regime": "GFC peak crash (Lehman + Mar-2009 bottom)", "n": 104, "A_sharpe": 1.7807, "A_sortino": 2.1987, "A_excess_sharpe": 1.9479, "A_return_pct": 21.98, "A_hit_rate": 50.0, "A_n": 104, "A_bh_sharpe": -0.1672, "A_bh_return_pct": -3.81, "A_psr": 0.8848, "A_ic": 0.1382, "A_precision": 0.5484, "A_recall": 0.3148, "A_f1": 0.4, "A_f2": 0.3441, "A_accuracy": 0.5096, "A_mcc": 0.038, "A_tp": 17, "A_fp": 14, "A_tn": 36, "A_fn": 37, "B_sharpe": 3.5857, "B_sortino": 4.7337, "B_excess_sharpe": 5.8598, "B_return_pct": 109.63, "B_hit_rate": 54.37, "B_n": 104, "B_bh_sharpe": -2.2741, "B_bh_return_pct": -44.12, "B_psr": 0.9937, "B_ic": 0.0494, "B_precision": 0.5926, "B_recall": 0.3077, "B_f1": 0.4051, "B_f2": 0.3404, "B_accuracy": 0.5481, "B_mcc": 0.1097, "B_tp": 16, "B_fp": 11, "B_tn": 41, "B_fn": 36, "D_sharpe": 1.7807, "D_sortino": 2.1987, "D_excess_sharpe": 1.9479, "D_return_pct": 21.98, "D_hit_rate": 50.0, "D_n": 104, "D_bh_sharpe": -0.1672, "D_bh_return_pct": -3.81, "D_psr": 0.8848, "D_ic": 0.1382, "D_precision": 0.5484, "D_recall": 0.3148, "D_f1": 0.4, "D_f2": 0.3441, "D_accuracy": 0.5096, "D_mcc": 0.038, "D_tp": 17, "D_fp": 14, "D_tn": 36, "D_fn": 37, "sharpe": 1.7807, "sortino": 2.1987, "return_pct": 21.98, "equity": 1219.8, "max_dd": 0.0, "win_rate": 50.0, "profit_factor": 0.0, "ic": 0.1382, "hit": 50.0, "psr": 0.8848, "bh_sharpe": -0.1672, "bh_return_pct": -3.81, "excess_sharpe": 1.9479, "precision": 0.5484, "recall": 0.3148, "f1": 0.4, "f2": 0.3441, "mcc": 0.038, "accuracy": 0.5096, "tp": 17, "fp": 14, "tn": 36, "fn": 37}, {"fold": "fold_2", "regime": "2011 US-downgrade + EU debt", "n": 96, "A_sharpe": 0.4197, "A_sortino": 0.4769, "A_excess_sharpe": 0.6939, "A_return_pct": 2.97, "A_hit_rate": 46.32, "A_n": 96, "A_bh_sharpe": -0.2741, "A_bh_return_pct": -4.09, "A_psr": 0.6024, "A_ic": 0.0615, "A_precision": 0.4444, "A_recall": 0.08, "A_f1": 0.1356, "A_f2": 0.0957, "A_accuracy": 0.4688, "A_mcc": -0.0492, "A_tp": 4, "A_fp": 5, "A_tn": 41, "A_fn": 46, "B_sharpe": 0.3786, "B_sortino": 0.4541, "B_excess_sharpe": 1.406, "B_return_pct": 2.04, "B_hit_rate": 44.79, "B_n": 96, "B_bh_sharpe": -1.0274, "B_bh_return_pct": -25.58, "B_psr": 0.5927, "B_ic": -0.0594, "B_precision": 0.3333, "B_recall": 0.2326, "B_f1": 0.274, "B_f2": 0.2475, "B_accuracy": 0.4479, "B_mcc": -0.1553, "B_tp": 10, "B_fp": 20, "B_tn": 33, "B_fn": 33, "D_sharpe": 0.4197, "D_sortino": 0.4769, "D_excess_sharpe": 0.6939, "D_return_pct": 2.97, "D_hit_rate": 46.32, "D_n": 96, "D_bh_sharpe": -0.2741, "D_bh_return_pct": -4.09, "D_psr": 0.6024, "D_ic": 0.0615, "D_precision": 0.4444, "D_recall": 0.08, "D_f1": 0.1356, "D_f2": 0.0957, "D_accuracy": 0.4688, "D_mcc": -0.0492, "D_tp": 4, "D_fp": 5, "D_tn": 41, "D_fn": 46, "sharpe": 0.4197, "sortino": 0.4769, "return_pct": 2.97, "equity": 1029.7, "max_dd": 0.0, "win_rate": 46.32, "profit_factor": 0.0, "ic": 0.0615, "hit": 46.32, "psr": 0.6024, "bh_sharpe": -0.2741, "bh_return_pct": -4.09, "excess_sharpe": 0.6939, "precision": 0.4444, "recall": 0.08, "f1": 0.1356, "f2": 0.0957, "mcc": -0.0492, "accuracy": 0.4688, "tp": 4, "fp": 5, "tn": 41, "fn": 46}, {"fold": "fold_3", "regime": "Taper tantrum and 2014 H1", "n": 54, "A_sharpe": 1.3118, "A_sortino": 1.5024, "A_excess_sharpe": -3.388, "A_return_pct": 2.84, "A_hit_rate": 48.15, "A_n": 54, "A_bh_sharpe": 4.6998, "A_bh_return_pct": 10.46, "A_psr": 0.7286, "A_ic": 0.1657, "A_precision": 0.6923, "A_recall": 0.2727, "A_f1": 0.3913, "A_f2": 0.3103, "A_accuracy": 0.4815, "A_mcc": 0.0938, "A_tp": 9, "A_fp": 4, "A_tn": 17, "A_fn": 24, "B_sharpe": 4.4062, "B_sortino": 4.0742, "B_excess_sharpe": -4.6264, "B_return_pct": 23.79, "B_hit_rate": 66.67, "B_n": 54, "B_bh_sharpe": 9.0326, "B_bh_return_pct": 49.18, "B_psr": 0.9704, "B_ic": 0.0797, "B_precision": 0.7714, "B_recall": 0.7297, "B_f1": 0.75, "B_f2": 0.7377, "B_accuracy": 0.6667, "B_mcc": 0.252, "B_tp": 27, "B_fp": 8, "B_tn": 9, "B_fn": 10, "D_sharpe": 1.3118, "D_sortino": 1.5024, "D_excess_sharpe": -3.388, "D_return_pct": 2.84, "D_hit_rate": 48.15, "D_n": 54, "D_bh_sharpe": 4.6998, "D_bh_return_pct": 10.46, "D_psr": 0.7286, "D_ic": 0.1657, "D_precision": 0.6923, "D_recall": 0.2727, "D_f1": 0.3913, "D_f2": 0.3103, "D_accuracy": 0.4815, "D_mcc": 0.0938, "D_tp": 9, "D_fp": 4, "D_tn": 17, "D_fn": 24, "sharpe": 1.3118, "sortino": 1.5024, "return_pct": 2.84, "equity": 1028.4, "max_dd": 0.0, "win_rate": 48.15, "profit_factor": 0.0, "ic": 0.1657, "hit": 48.15, "psr": 0.7286, "bh_sharpe": 4.6998, "bh_return_pct": 10.46, "excess_sharpe": -3.388, "precision": 0.6923, "recall": 0.2727, "f1": 0.3913, "f2": 0.3103, "mcc": 0.0938, "accuracy": 0.4815, "tp": 9, "fp": 4, "tn": 17, "fn": 24}, {"fold": "fold_4", "regime": "China devaluation and oil crash", "n": 96, "A_sharpe": 0.5179, "A_sortino": 0.5365, "A_excess_sharpe": 0.9421, "A_return_pct": 3.13, "A_hit_rate": 51.58, "A_n": 96, "A_bh_sharpe": -0.4241, "A_bh_return_pct": -3.73, "A_psr": 0.625, "A_ic": 0.0432, "A_precision": 0.3333, "A_recall": 0.0222, "A_f1": 0.0417, "A_f2": 0.0273, "A_accuracy": 0.5208, "A_mcc": -0.0487, "A_tp": 1, "A_fp": 2, "A_tn": 49, "A_fn": 44, "B_sharpe": 3.1759, "B_sortino": 5.1914, "B_excess_sharpe": 4.3602, "B_return_pct": 64.03, "B_hit_rate": 51.04, "B_n": 96, "B_bh_sharpe": -1.1843, "B_bh_return_pct": -21.44, "B_psr": 0.9904, "B_ic": 0.0283, "B_precision": 0.4889, "B_recall": 0.4783, "B_f1": 0.4835, "B_f2": 0.4803, "B_accuracy": 0.5104, "B_mcc": 0.0183, "B_tp": 22, "B_fp": 23, "B_tn": 27, "B_fn": 24, "D_sharpe": 0.5179, "D_sortino": 0.5365, "D_excess_sharpe": 0.9421, "D_return_pct": 3.13, "D_hit_rate": 51.58, "D_n": 96, "D_bh_sharpe": -0.4241, "D_bh_return_pct": -3.73, "D_psr": 0.625, "D_ic": 0.0432, "D_precision": 0.3333, "D_recall": 0.0222, "D_f1": 0.0417, "D_f2": 0.0273, "D_accuracy": 0.5208, "D_mcc": -0.0487, "D_tp": 1, "D_fp": 2, "D_tn": 49, "D_fn": 44, "sharpe": 0.5179, "sortino": 0.5365, "return_pct": 3.13, "equity": 1031.3000000000002, "max_dd": 0.0, "win_rate": 51.58, "profit_factor": 0.0, "ic": 0.0432, "hit": 51.58, "psr": 0.625, "bh_sharpe": -0.4241, "bh_return_pct": -3.73, "excess_sharpe": 0.9421, "precision": 0.3333, "recall": 0.0222, "f1": 0.0417, "f2": 0.0273, "mcc": -0.0487, "accuracy": 0.5208, "tp": 1, "fp": 2, "tn": 49, "fn": 44}, {"fold": "fold_5", "regime": "2018 Vol-mageddon + Q4 sell-off", "n": 54, "A_sharpe": -0.7979, "A_sortino": -0.8183, "A_excess_sharpe": -2.2258, "A_return_pct": -2.45, "A_hit_rate": 48.15, "A_n": 54, "A_bh_sharpe": 1.428, "A_bh_return_pct": 3.97, "A_psr": 0.3583, "A_ic": 0.0301, "A_precision": 0.6667, "A_recall": 0.069, "A_f1": 0.125, "A_f2": 0.084, "A_accuracy": 0.4815, "A_mcc": 0.0631, "A_tp": 2, "A_fp": 1, "A_tn": 24, "A_fn": 27, "B_sharpe": -0.2996, "B_sortino": -0.2593, "B_excess_sharpe": -5.2318, "B_return_pct": -2.94, "B_hit_rate": 57.41, "B_n": 54, "B_bh_sharpe": 4.9322, "B_bh_return_pct": 34.93, "B_psr": 0.4452, "B_ic": -0.2547, "B_precision": 0.6591, "B_recall": 0.7838, "B_f1": 0.716, "B_f2": 0.7552, "B_accuracy": 0.5741, "B_mcc": -0.1179, "B_tp": 29, "B_fp": 15, "B_tn": 2, "B_fn": 8, "D_sharpe": -0.7979, "D_sortino": -0.8183, "D_excess_sharpe": -2.2258, "D_return_pct": -2.45, "D_hit_rate": 48.15, "D_n": 54, "D_bh_sharpe": 1.428, "D_bh_return_pct": 3.97, "D_psr": 0.3583, "D_ic": 0.0301, "D_precision": 0.6667, "D_recall": 0.069, "D_f1": 0.125, "D_f2": 0.084, "D_accuracy": 0.4815, "D_mcc": 0.0631, "D_tp": 2, "D_fp": 1, "D_tn": 24, "D_fn": 27, "sharpe": -0.7979, "sortino": -0.8183, "return_pct": -2.45, "equity": 975.5, "max_dd": 0.0, "win_rate": 48.15, "profit_factor": 0.0, "ic": 0.0301, "hit": 48.15, "psr": 0.3583, "bh_sharpe": 1.428, "bh_return_pct": 3.97, "excess_sharpe": -2.2258, "precision": 0.6667, "recall": 0.069, "f1": 0.125, "f2": 0.084, "mcc": 0.0631, "accuracy": 0.4815, "tp": 2, "fp": 1, "tn": 24, "fn": 27}, {"fold": "fold_6", "regime": "COVID crash and V-recovery", "n": 75, "A_sharpe": -4.2994, "A_sortino": -4.316, "A_excess_sharpe": -8.5988, "A_return_pct": -13.12, "A_hit_rate": 32.0, "A_n": 75, "A_bh_sharpe": 4.2994, "A_bh_return_pct": 14.68, "A_psr": 0.0156, "A_ic": -0.006, "A_precision": 0.0, "A_recall": 0.0, "A_f1": 0.0, "A_f2": 0.0, "A_accuracy": 0.32, "A_mcc": 0.0, "A_tp": 0, "A_fp": 0, "A_tn": 24, "A_fn": 51, "B_sharpe": 0.6209, "B_sortino": 0.5597, "B_excess_sharpe": -13.713, "B_return_pct": 3.78, "B_hit_rate": 57.33, "B_n": 75, "B_bh_sharpe": 14.3339, "B_bh_return_pct": 120.13, "B_psr": 0.6311, "B_ic": -0.3922, "B_precision": 0.7925, "B_recall": 0.6667, "B_f1": 0.7241, "B_f2": 0.6885, "B_accuracy": 0.5733, "B_mcc": -0.2013, "B_tp": 42, "B_fp": 11, "B_tn": 1, "B_fn": 21, "D_sharpe": -4.2994, "D_sortino": -4.316, "D_excess_sharpe": -8.5988, "D_return_pct": -13.12, "D_hit_rate": 32.0, "D_n": 75, "D_bh_sharpe": 4.2994, "D_bh_return_pct": 14.68, "D_psr": 0.0156, "D_ic": -0.006, "D_precision": 0.0, "D_recall": 0.0, "D_f1": 0.0, "D_f2": 0.0, "D_accuracy": 0.32, "D_mcc": 0.0, "D_tp": 0, "D_fp": 0, "D_tn": 24, "D_fn": 51, "sharpe": -4.2994, "sortino": -4.316, "return_pct": -13.12, "equity": 868.8000000000001, "max_dd": 0.0, "win_rate": 32.0, "profit_factor": 0.0, "ic": -0.006, "hit": 32.0, "psr": 0.0156, "bh_sharpe": 4.2994, "bh_return_pct": 14.68, "excess_sharpe": -8.5988, "precision": 0.0, "recall": 0.0, "f1": 0.0, "f2": 0.0, "mcc": 0.0, "accuracy": 0.32, "tp": 0, "fp": 0, "tn": 24, "fn": 51}, {"fold": "fold_7", "regime": "Inflation bear, AI rally and 2025", "n": 114, "A_sharpe": -2.5374, "A_sortino": -2.3404, "A_excess_sharpe": -5.3824, "A_return_pct": -16.78, "A_hit_rate": 43.86, "A_n": 114, "A_bh_sharpe": 2.845, "A_bh_return_pct": 21.34, "A_psr": 0.0427, "A_ic": 0.0484, "A_precision": 0.7143, "A_recall": 0.0746, "A_f1": 0.1351, "A_f2": 0.0909, "A_accuracy": 0.4386, "A_mcc": 0.0658, "A_tp": 5, "A_fp": 2, "A_tn": 45, "A_fn"