{"experiment_num": 47, "backbone": "xgboost", "description": "XGBoost depth=3 n_est=200 lr=0.02 - shallow + more capacity test", "config": {"seq_len": 60, "lr": 0.0003, "batch_size": 32, "epochs": 50, "weight_decay": 1e-05, "patience": 10, "warmup_epochs": 0, "head_dropout": 0.1, "huber_delta": 1.0, "grad_clip": 1.0, "seed": 42, "hidden_size": null, "num_layers": null, "max_depth": 3, "gbm_lr": 0.02, "n_estimators": 200}, "composite": -0.751, "test_pos_folds": 6, "val_pos_folds": 3, "val_loss": null, "elapsed_sec": 89.4, "timestamp": "2026-04-27T19:09:45", "sharpe": 0.6433, "val_sharpe": -0.651, "ic": 0.0237, "hit": 50.38, "psr": 0.911, "equity": 1661.2, "return_pct": 66.12, "bh_sharpe": 1.2194, "bh_return_pct": 187.05, "excess_sharpe": -0.576, "B_sharpe": 0.2749, "B_excess_sharpe": -2.5533, "B_return_pct": 8.75, "D_sharpe": 0.2571, "D_excess_sharpe": -0.9622, "D_return_pct": 14.87, "per_window": [{"fold": "fold_1", "regime": "GFC peak crash (Lehman + Mar-2009 bottom)", "n": 66, "A_sharpe": 1.2848, "A_sortino": 1.4713, "A_excess_sharpe": 0.7127, "A_return_pct": 11.34, "A_hit_rate": 50.0, "A_n": 66, "A_bh_sharpe": 0.5721, "A_bh_return_pct": 3.85, "A_psr": 0.7461, "A_ic": 0.1337, "B_sharpe": 0.8146, "B_sortino": 0.7927, "B_excess_sharpe": -1.2323, "B_return_pct": 9.03, "B_hit_rate": 55.38, "B_n": 66, "B_bh_sharpe": 2.0469, "B_bh_return_pct": 39.28, "B_psr": 0.6604, "B_ic": 0.2592, "D_sharpe": 2.4977, "D_sortino": 2.8589, "D_excess_sharpe": 1.9255, "D_return_pct": 25.08, "D_hit_rate": 53.03, "D_n": 66, "D_bh_sharpe": 0.5721, "D_bh_return_pct": 3.85, "D_psr": 0.9008, "D_ic": 0.1872, "sharpe": 1.2848, "sortino": 1.4713, "return_pct": 11.34, "equity": 1113.3999999999999, "max_dd": 0.0, "win_rate": 50.0, "profit_factor": 0.0, "ic": 0.1337, "hit": 50.0, "psr": 0.7461, "bh_sharpe": 0.5721, "bh_return_pct": 3.85, "excess_sharpe": 0.7127, "precision": 0.5385, "recall": 0.4, "f1": 0.459, "f2": 0.4217, "accuracy": 0.5, "mcc": 0.0132, "tp": 14, "fp": 12, "tn": 19, "fn": 21, "A_precision": 0.5385, "A_recall": 0.4, "A_f1": 0.459, "A_f2": 0.4217, "A_accuracy": 0.5, "A_mcc": 0.0132, "A_tp": 14, "A_fp": 12, "A_tn": 19, "A_fn": 21}, {"fold": "fold_2", "regime": "2011 US-downgrade + EU debt", "n": 87, "A_sharpe": 3.1678, "A_sortino": 4.0213, "A_excess_sharpe": -1.8542, "A_return_pct": 17.92, "A_hit_rate": 56.98, "A_n": 87, "A_bh_sharpe": 5.022, "A_bh_return_pct": 29.23, "A_psr": 0.9786, "A_ic": -0.0264, "B_sharpe": 10.5076, "B_sortino": 9.4689, "B_excess_sharpe": -0.6294, "B_return_pct": 173.77, "B_hit_rate": 81.61, "B_n": 87, "B_bh_sharpe": 11.1369, "B_bh_return_pct": 185.4, "B_psr": 1.0, "B_ic": 0.1796, "D_sharpe": 4.7488, "D_sortino": 5.7859, "D_excess_sharpe": -0.2732, "D_return_pct": 27.56, "D_hit_rate": 63.95, "D_n": 87, "D_bh_sharpe": 5.022, "D_bh_return_pct": 29.23, "D_psr": 0.999, "D_ic": -0.0303, "sharpe": 3.1678, "sortino": 4.0213, "return_pct": 17.92, "equity": 1179.2, "max_dd": 0.0, "win_rate": 56.98, "profit_factor": 0.0, "ic": -0.0264, "hit": 56.98, "psr": 0.9786, "bh_sharpe": 5.022, "bh_return_pct": 29.23, "excess_sharpe": -1.8542, "precision": 0.6441, "recall": 0.7037, "f1": 0.6726, "f2": 0.6909, "accuracy": 0.5747, "mcc": 0.0699, "tp": 38, "fp": 21, "tn": 12, "fn": 16, "A_precision": 0.6441, "A_recall": 0.7037, "A_f1": 0.6726, "A_f2": 0.6909, "A_accuracy": 0.5747, "A_mcc": 0.0699, "A_tp": 38, "A_fp": 21, "A_tn": 12, "A_fn": 16}, {"fold": "fold_3", "regime": "Taper tantrum and 2014 H1", "n": 129, "A_sharpe": 1.8062, "A_sortino": 1.5222, "A_excess_sharpe": 0.0384, "A_return_pct": 12.04, "A_hit_rate": 60.16, "A_n": 129, "A_bh_sharpe": 1.7678, "A_bh_return_pct": 11.76, "A_psr": 0.8868, "A_ic": 0.102, "B_sharpe": 3.5002, "B_sortino": 3.4516, "B_excess_sharpe": -0.7472, "B_return_pct": 50.7, "B_hit_rate": 62.02, "B_n": 129, "B_bh_sharpe": 4.2474, "B_bh_return_pct": 64.1, "B_psr": 0.9921, "B_ic": -0.0745, "D_sharpe": 1.7103, "D_sortino": 1.4599, "D_excess_sharpe": -0.0575, "D_return_pct": 11.35, "D_hit_rate": 59.38, "D_n": 129, "D_bh_sharpe": 1.7678, "D_bh_return_pct": 11.76, "D_psr": 0.8751, "D_ic": 0.0325, "sharpe": 1.8062, "sortino": 1.5222, "return_pct": 12.04, "equity": 1120.4, "max_dd": 0.0, "win_rate": 60.16, "profit_factor": 0.0, "ic": 0.102, "hit": 60.16, "psr": 0.8868, "bh_sharpe": 1.7678, "bh_return_pct": 11.76, "excess_sharpe": 0.0384, "precision": 0.6066, "recall": 0.9487, "f1": 0.74, "f2": 0.8525, "accuracy": 0.5969, "mcc": 0.0163, "tp": 74, "fp": 48, "tn": 3, "fn": 4, "A_precision": 0.6066, "A_recall": 0.9487, "A_f1": 0.74, "A_f2": 0.8525, "A_accuracy": 0.5969, "A_mcc": 0.0163, "A_tp": 74, "A_fp": 48, "A_tn": 3, "A_fn": 4}, {"fold": "fold_4", "regime": "China devaluation and oil crash", "n": 108, "A_sharpe": 0.3528, "A_sortino": 0.3318, "A_excess_sharpe": 1.0426, "A_return_pct": 2.22, "A_hit_rate": 53.27, "A_n": 108, "A_bh_sharpe": -0.6898, "A_bh_return_pct": -6.71, "A_psr": 0.5906, "A_ic": 0.0634, "B_sharpe": -2.4437, "B_sortino": -2.2218, "B_excess_sharpe": -0.4862, "B_return_pct": -39.22, "B_hit_rate": 42.59, "B_n": 108, "B_bh_sharpe": -1.9575, "B_bh_return_pct": -33.56, "B_psr": 0.0499, "B_ic": -0.0917, "D_sharpe": -1.3643, "D_sortino": -1.2644, "D_excess_sharpe": -0.6745, "D_return_pct": -12.03, "D_hit_rate": 46.73, "D_n": 108, "D_bh_sharpe": -0.6898, "D_bh_return_pct": -6.71, "D_psr": 0.1841, "D_ic": -0.0333, "sharpe": 0.3528, "sortino": 0.3318, "return_pct": 2.22, "equity": 1022.2, "max_dd": 0.0, "win_rate": 53.27, "profit_factor": 0.0, "ic": 0.0634, "hit": 53.27, "psr": 0.5906, "bh_sharpe": -0.6898, "bh_return_pct": -6.71, "excess_sharpe": 1.0426, "precision": 0.5246, "recall": 0.6038, "f1": 0.5614, "f2": 0.5861, "accuracy": 0.537, "mcc": 0.0771, "tp": 32, "fp": 29, "tn": 26, "fn": 21, "A_precision": 0.5246, "A_recall": 0.6038, "A_f1": 0.5614, "A_f2": 0.5861, "A_accuracy": 0.537, "A_mcc": 0.0771, "A_tp": 32, "A_fp": 29, "A_tn": 26, "A_fn": 21}, {"fold": "fold_5", "regime": "2018 Vol-mageddon + Q4 sell-off", "n": 128, "A_sharpe": 0.4823, "A_sortino": 0.5075, "A_excess_sharpe": -0.6688, "A_return_pct": 4.48, "A_hit_rate": 52.34, "A_n": 128, "A_bh_sharpe": 1.1511, "A_bh_return_pct": 13.19, "A_psr": 0.6349, "A_ic": 0.053, "B_sharpe": -3.4257, "B_sortino": -3.2456, "B_excess_sharpe": -6.2376, "B_return_pct": -57.22, "B_hit_rate": 37.8, "B_n": 128, "B_bh_sharpe": 2.8119, "B_bh_return_pct": 82.25, "B_psr": 0.0073, "B_ic": -0.1711, "D_sharpe": -2.2324, "D_sortino": -2.2703, "D_excess_sharpe": -3.3835, "D_return_pct": -24.42, "D_hit_rate": 42.19, "D_n": 128, "D_bh_sharpe": 1.1511, "D_bh_return_pct": 13.19, "D_psr": 0.0648, "D_ic": -0.1113, "sharpe": 0.4823, "sortino": 0.5075, "return_pct": 4.48, "equity": 1044.8, "max_dd": 0.0, "win_rate": 52.34, "profit_factor": 0.0, "ic": 0.053, "hit": 52.34, "psr": 0.6349, "bh_sharpe": 1.1511, "bh_return_pct": 13.19, "excess_sharpe": -0.6688, "precision": 0.6104, "recall": 0.6026, "f1": 0.6065, "f2": 0.6041, "accuracy": 0.5234, "mcc": 0.0026, "tp": 47, "fp": 30, "tn": 20, "fn": 31, "A_precision": 0.6104, "A_recall": 0.6026, "A_f1": 0.6065, "A_f2": 0.6041, "A_accuracy": 0.5234, "A_mcc": 0.0026, "A_tp": 47, "A_fp": 30, "A_tn": 20, "A_fn": 31}, {"fold": "fold_6", "regime": "COVID crash and V-recovery", "n": 173, "A_sharpe": 1.8695, "A_sortino": 2.2309, "A_excess_sharpe": -0.4566, "A_return_pct": 33.57, "A_hit_rate": 50.87, "A_n": 173, "A_bh_sharpe": 2.3261, "A_bh_return_pct": 43.81, "A_psr": 0.9439, "A_ic": 0.0844, "B_sharpe": 0.4607, "B_sortino": 0.4659, "B_excess_sharpe": -5.2853, "B_return_pct": 7.47, "B_hit_rate": 51.16, "B_n": 173, "B_bh_sharpe": 5.746, "B_bh_return_pct": 499.04, "B_psr": 0.6482, "B_ic": 0.0221, "D_sharpe": 0.0451, "D_sortino": 0.0446, "D_excess_sharpe": -2.2809, "D_return_pct": -1.27, "D_hit_rate": 50.29, "D_n": 173, "D_bh_sharpe": 2.3261, "D_bh_return_pct": 43.81, "D_psr": 0.5149, "D_ic": -0.0331, "sharpe": 1.8695, "sortino": 2.2309, "return_pct": 33.57, "equity": 1335.7, "max_dd": 0.0, "win_rate": 50.87, "profit_factor": 0.0, "ic": 0.0844, "hit": 50.87, "psr": 0.9439, "bh_sharpe": 2.3261, "bh_return_pct": 43.81, "excess_sharpe": -0.4566, "precision": 0.7121, "recall": 0.4159, "f1": 0.5251, "f2": 0.4537, "accuracy": 0.5087, "mcc": 0.0973, "tp": 47, "fp": 19, "tn": 41, "fn": 66, "A_precision": 0.7121, "A_recall": 0.4159, "A_f1": 0.5251, "A_f2": 0.4537, "A_accuracy": 0.5087, "A_mcc": 0.0973, "A_tp": 47, "A_fp": 19, "A_tn": 41, "A_fn": 66}, {"fold": "fold_7", "regime": "Inflation bear, AI rally and 2025", "n": 376, "A_sharpe": -0.5874, "A_sortino": -0.7086, "A_excess_sharpe": -1.3907, "A_return_pct": -20.83, "A_hit_rate": 43.88, "A_n": 376, "A_bh_sharpe": 0.8033, "A_bh_return_pct": 26.02, "A_psr": 0.2447, "A_ic": -0.0181, "B_sharpe": 0.0217, "B_sortino": 0.0256, "B_excess_sharpe": -1.91, "B_return_pct": -13.48, "B_hit_rate": 42.4, "B_n": 376, "B_bh_sharpe": 1.9317, "B_bh_return_pct": 222.05, "B_psr": 0.5106, "B_ic": -0.0053, "D_sharpe": 0.0651, "D_sortino": 0.0849, "D_excess_sharpe": -0.7382, "D_return_pct": -1.5, "D_hit_rate": 42.55, "D_n": 376, "D_bh_sharpe": 0.8033, "D_bh_return_pct": 26.02, "D_psr": 0.5318, "D_ic": -0.0124, "sharpe": -0.5874, "sortino": -0.7086, "return_pct": -20.83, "equity": 791.7, "max_dd": 0.0, "win_rate": 43.88, "profit_factor": 0.0, "ic": -0.0181, "hit": 43.88, "psr": 0.2447, "bh_sharpe": 0.8033, "bh_return_pct": 26.02, "excess_sharpe": -1.3907, "precision": 0.561, "recall": 0.2081, "f1": 0.3036, "f2": 0.2381, "accuracy": 0.4388, "mcc": -0.0287, "tp": 46, "fp": 36, "tn": 119, "fn": 175, "A_precision": 0.561, "A_recall": 0.2081, "A_f1": 0.3036, "A_f2": 0.2381, "A_accuracy": 0.4388, "A_mcc": -0.0287, "A_tp": 46, "A_fp": 36, "A_tn": 119, "A_fn": 175}], "per_window_val": [{"fold": "fold_1", "regime": "GFC peak crash (Lehman + Mar-2009 bottom)", "n": 65, "A_sharpe": -2.8786, "A_sortino": -2.8589, "A_excess_sharpe": -0.6529, "A_return_pct": -23.05, "A_hit_rate": 41.27, "A_n": 65, "A_bh_sharpe": -2.2257, "A_bh_return_pct": -18.74, "A_psr": 0.0903, "A_ic": -0.0567, "B_sharpe": -1.1965, "B_sortino": -1.4297, "B_excess_sharpe": 5.9259, "B_return_pct": -25.6, "B_hit_rate": 41.54, "B_n": 65, "B_bh_sharpe": -7.1223, "B_bh_return_pct": -73.11, "B_psr": 0.2829, "B_ic": 0.3466, "D_sharpe": -0.4856, "D_sortino": -0.4812, "D_excess_sharpe": 1.74, "D_return_pct": -5.55, "D_hit_rate": 49.21, "D_n": 65, "D_bh_sharpe": -2.2257, "D_bh_return_pct": -18.74, "D_psr": 0.404, "D_ic": 0.2315, "sharpe": -2.8786, "sortino": -2.8589, "return_pct": -23.05, "equity": 769.5, "max_dd": 0.0, "win_rate": 41.27, "profit_factor": 0.0, "ic": -0.0567, "hit": 41.27, "psr": 0.0903, "bh_sharpe": -2.2257, "bh_return_pct": -18.74, "excess_sharpe": -0.6529}, {"fold": "fold_2", "regime": "2011 US-downgrade + EU debt", "n": 47, "A_sharpe": 1.3407, "A_sortino": 1.1882, "A_excess_sharpe": 1.5348, "A_return_pct": 7.81, "A_hit_rate": 59.57, "A_n": 47, "A_bh_sharpe": -0.1941, "A_bh_return_pct": -2.36, "A_psr": 0.7125, "A_ic": 0.0005, "B_sharpe": -1.2827, "B_sortino": -1.1483, "B_excess_sharpe": 0.3296, "B_return_pct": -20.77, "B_hit_rate": 48.94, "B_n": 47, "B_bh_sharpe": -1.6123, "B_bh_return_pct": -24.3, "B_psr": 0.2879, "B_ic": 0.229, "D_sharpe": 1.3144, "D_sortino": 1.2716, "D_excess_sharpe": 1.5085, "D_return_pct": 7.63, "D_hit_rate": 55.32, "D_n": 47, "D_bh_sharpe": -0.1941, "D_bh_return_pct": -2.36, "D_psr": 0.7103, "D_ic": 0.0593, "sharpe": 1.3407, "sortino": 1.1882, "return_pct": 7.81, "equity": 1078.1000000000001, "max_dd": 0.0, "win_rate": 59.57, "profit_factor": 0.0, "ic": 0.0005, "hit": 59.57, "psr": 0.7125, "bh_sharpe": -0.1941, "bh_return_pct": -2.36, "excess_sharpe": 1.5348}, {"fold": "fold_3", "regime": "Taper tantrum and 2014 H1", "n": 5, "A_sharpe": 10.4634, "A_sortino": 21.0684, "A_excess_sharpe": 11.7829, "A_return_pct": 1.37, "A_hit_rate": 60.0, "A_n": 5, "A_bh_sharpe": -1.3194, "A_bh_return_pct": -0.21, "A_psr": 0.9289, "A_ic": 0.6, "B_sharpe": -18.6944, "B_sortino": -10.8783, "B_excess_sharpe": 7.1762, "B_return_pct": -3.45, "B_hit_rate": 20.0, "B_n": 5, "B_bh_sharpe": -25.8705, "B_bh_return_pct": -3.84, "B_psr": 0.0009, "B_ic": -0.2, "D_sharpe": -5.9118, "D_sortino": -6.1066, "D_excess_sharpe": -4.5924, "D_return_pct": -0.87, "D_hit_rate": 20.0, "D_n": 5, "D_bh_sharpe": -1.3194, "D_bh_return_pct": -0.21, "D_psr": 0.241, "D_ic": -0.3, "sharpe": 10.4634, "sortino": 21.0684, "return_pct": 1.37, "equity": 1013.7, "max_dd": 0.0, "win_rate": 60.0, "profit_factor": 0.0, "ic": 0.6, "hit": 60.0, "psr": 0.9289, "bh_sharpe": -1.3194, "bh_return_pct": -0.21, "excess_sharpe": 11.7829}, {"fold": "fold_4", "regime": "China devaluation and oil crash", "n": 47, "A_sharpe": -0.9684, "A_sortino": -0.9642, "A_excess_sharpe": 0.8554, "A_return_pct": -4.99, "A_hit_rate": 44.68, "A_n": 47, "A_bh_sharpe": -1.8238, "A_bh_return_pct": -8.68, "A_psr": 0.3395, "A_ic": -0.0664, "B_sharpe": -2.22, "B_sortino": -1.9053, "B_excess_sharpe": 0.0, "B_return_pct": -23.98, "B_hit_rate": 44.68, "B_n": 47, "B_bh_sharpe": -2.22, "B_bh_return_pct": -23.98, "B_psr": 0.1505, "B_ic": 0.4881, "D_sharpe": -1.8238, "D_sortino": -1.7153, "D_excess_sharpe": 0.0, "D_return_pct": -8.68, "D_hit_rate": 44.68, "D_n": 47, "D_bh_sharpe": -1.8238, "D_bh_return_pct": -8.68, "D_psr": 0.2173, "D_ic": 0.2005, "sharpe": -0.9684, "sortino": -0.9642, "return_pct": -4.99, "equity": 950.0999999999999, "max_dd": 0.0, "win_rate": 44.68, "profit_factor": 0.0, "ic": -0.0664, "hit": 44.68, "psr": 0.3395, "bh_sharpe": -1.8238, "bh_return_pct": -8.68, "excess_sharpe": 0.8554}, {"fold": "fold_5", "regime": "2018 Vol-mageddon + Q4 sell-off", "n": 5, "A_sharpe": -10.1368, "A_sortino": -6.9937, "A_excess_sharpe": 0.0, "A_return_pct": -3.15, "A_hit_rate": 40.0, "A_n": 5, "A_bh_sharpe": -10.1368, "A_bh_return_pct": -3.15, "A_psr": 0.0985, "A_ic": 0.0, "B_sharpe": 5.6858, "B_sortino": 6.0578, "B_excess_sharpe": 0.0, "B_return_pct": 4.22, "B_hit_rate": 60.0, "B_n": 5, "B_bh_sharpe": 5.6858, "B_bh_return_pct": 4.22, "B_psr": 0.753, "B_ic": -0.6, "D_sharpe": -10.1368, "D_sortino": -6.9937, "D_excess_sharpe": 0.0, "D_return_pct": -3.15, "D_hit_rate": 40.0, "D_n": 5, "D_bh_sharpe": -10.1368, "D_bh_return_pct": -3.15, "D_psr": 0.0985, "D_ic": -0.8, "sharpe": -10.1368, "sortino": -6.9937, "return_pct": -3.15, "equity": 968.5, "max_dd": 0.0, "win_rate": 40.0, "profit_factor": 0.0, "ic": 0.0, "hit": 40.0, "psr": 0.0985, "bh_sharpe": -10.1368, "bh_return_pct": -3.15, "excess_sharpe": 0.0}, {"fold": "fold_6", "regime": "COVID crash and V-recovery", "n": 26, "A_sharpe": 5.6377, "A_sortino": 7.2549, "A_excess_sharpe": 2.3526, "A_return_pct": 8.16, "A_hit_rate": 57.69, "A_n": 26, "A_bh_sharpe": 3.2852, "A_bh_return_pct": 4.82, "A_psr": 0.9646, "A_ic": 0.0181, "B_sharpe": 13.308, "B_sortino": 14.422, "B_excess_sharpe": 0.3288, "B_return_pct": 39.45, "B_hit_rate": 80.77, "B_n": 26, "B_bh_sharpe": 12.9792, "B_bh_return_pct": 38.76, "B_psr": 0.9999, "B_ic": 0.4147, "D_sharpe": 5.6139, "D_sortino": 6.7311, "D_excess_sharpe": 2.3288, "D_return_pct": 8.13, "D_hit_rate": 61.54, "D_n": 26, "D_bh_sharpe": 3.2852, "D_bh_return_pct": 4.82, "D_psr": 0.963, "D_ic": 0.1685, "sharpe": 5.6377, "sortino": 7.2549, "return_pct": 8.16, "equity": 1081.6, "max_dd": 0.0, "win_rate": 57.69, "profit_factor": 0.0, "ic": 0.0181, "hit": 57.69, "psr": 0.9646, "bh_sharpe": 3.2852, "bh_return_pct": 4.82, "excess_sharpe": 2.3526}, {"fold": "fold_7", "regime": "Inflation bear, AI rally and 2025", "n": 65, "A_sharpe": -0.857, "A_sortino": -0.9061, "A_excess_sharpe": -2.9359, "A_return_pct": -3.62, "A_hit_rate": 44.62, "A_n": 65, "A_bh_sharpe": 2.0789, "A_bh_return_pct": 8.17, "A_psr": 0.3345, "A_ic": -0.0615, "B_sharpe": -4.1798, "B_sortino": -4.0523, "B_excess_sharpe": -9.4112, "B_return_pct": -27.4, "B_hit_rate": 33.85, "B_n": 65, "B_bh_sharpe": 5.2314, "B_bh_return_pct": 44.53, "B_psr": 0.0209, "B_ic": 0.2365, "D_sharpe": -1.4755, "D_sortino": -1.3588, "D_excess_sharpe": -3.5544, "D_return_pct": -5.93, "D_hit_rate": 47.69, "D_n": 65, "D_bh_sharpe": 2.0789, "D_bh_return_pct": 8.17, "D_psr": 0.2256, "D_ic": 0.0928, "sharpe": -0.857, "sortino": -0.9061, "return_pct": -3.62, "equity": 963.8, "max_dd": 0.0, "win_rate": 44.62, "profit_factor": 0.0, "ic": -0.0615, "hit": 44.62, "psr": 0.3345, "bh_sharpe": 2.0789, "bh_return_pct": 8.17, "excess_sharpe": -2.9359}], "status": "DISCARD", "precision": 0.6045, "recall": 0.4715, "f1": 0.5298, "f2": 0.4932, "accuracy": 0.5042, "mcc": 0.0229, "tp": 298, "fp": 195, "tn": 240, "fn": 334, "test_sharpe": 0.6433, "A_sharpe": 0.6433, "A_excess_sharpe": -0.576, "A_return_pct": 66.12, "A_precision": 0.6045, "A_recall": 0.4715, "A_f1": 0.5298, "A_f2": 0.4932, "A_accuracy": 0.5042, "A_mcc": 0.0229, "A_tp": 298, "A_fp": 195, "A_tn": 240, "A_fn": 334, "A_psr": 0.911, "A_ic": 0.0237, "A_hit_rate": 50.38, "A_bh_sharpe": 1.2194, "A_bh_return_pct": 187.05}
