{"experiment_num": 80, "backbone": "mlp", "description": "MLP @ exp 79 NEW CHAMP warmup=5 seed=42 - multi-seed verify (was +0.97 seed=0)", "config": {"seq_len": 10, "lr": 0.0003, "batch_size": 32, "epochs": 50, "weight_decay": 1e-05, "patience": 10, "warmup_epochs": 5, "head_dropout": 0.25, "huber_delta": 1.0, "grad_clip": 1.0, "seed": 42, "hidden_size": null, "num_layers": null, "max_depth": null, "gbm_lr": null, "n_estimators": null}, "composite": -0.7138, "test_pos_folds": 4, "val_pos_folds": 2, "val_loss": -2.8835928251128173, "elapsed_sec": 24.0, "timestamp": "2026-04-27T23:16:12", "sharpe": -0.0832, "val_sharpe": -0.4138, "ic": 0.0021, "hit": 47.83, "psr": 0.4221, "equity": 716.9000000000001, "return_pct": -28.31, "bh_sharpe": 0.6042, "bh_return_pct": 103.49, "excess_sharpe": -0.6874, "B_sharpe": -0.4134, "B_excess_sharpe": -2.1142, "B_return_pct": -86.84, "D_sharpe": -0.0832, "D_excess_sharpe": -0.6874, "D_return_pct": -28.31, "precision": 0.5762, "recall": 0.342, "f1": 0.4292, "f2": 0.3723, "mcc": 0.0056, "accuracy": 0.4794, "val_precision": 0.5093, "val_recall": 0.3343, "val_f1": 0.4037, "val_f2": 0.359, "val_mcc": -0.0694, "val_accuracy": 0.4519, "per_window": [{"fold": "fold_1", "regime": "GFC peak crash (Lehman + Mar-2009 bottom)", "n": 115, "A_sharpe": 1.4296, "A_sortino": 1.4517, "A_excess_sharpe": 1.8737, "A_return_pct": 30.35, "A_hit_rate": 53.91, "A_n": 115, "A_bh_sharpe": -0.4441, "A_bh_return_pct": -14.4, "A_psr": 0.8305, "A_ic": 0.1013, "A_precision": 0.5106, "A_recall": 0.4444, "A_f1": 0.4752, "A_f2": 0.4563, "A_accuracy": 0.5391, "A_mcc": 0.0684, "A_tp": 24, "A_fp": 23, "A_tn": 38, "A_fn": 30, "B_sharpe": 0.7144, "B_sortino": 0.8554, "B_excess_sharpe": 1.0122, "B_return_pct": 11.76, "B_hit_rate": 45.61, "B_n": 115, "B_bh_sharpe": -0.2978, "B_bh_return_pct": -27.23, "B_psr": 0.6867, "B_ic": 0.1231, "B_precision": 0.4583, "B_recall": 0.3729, "B_f1": 0.4112, "B_f2": 0.3873, "B_accuracy": 0.4522, "B_mcc": -0.0926, "B_tp": 22, "B_fp": 26, "B_tn": 30, "B_fn": 37, "D_sharpe": 1.4296, "D_sortino": 1.4517, "D_excess_sharpe": 1.8737, "D_return_pct": 30.35, "D_hit_rate": 53.91, "D_n": 115, "D_bh_sharpe": -0.4441, "D_bh_return_pct": -14.4, "D_psr": 0.8305, "D_ic": 0.1013, "D_precision": 0.5106, "D_recall": 0.4444, "D_f1": 0.4752, "D_f2": 0.4563, "D_accuracy": 0.5391, "D_mcc": 0.0684, "D_tp": 24, "D_fp": 23, "D_tn": 38, "D_fn": 30, "sharpe": 1.4296, "sortino": 1.4517, "return_pct": 30.35, "equity": 1303.5, "max_dd": 0.0, "win_rate": 53.91, "profit_factor": 0.0, "ic": 0.1013, "hit": 53.91, "psr": 0.8305, "bh_sharpe": -0.4441, "bh_return_pct": -14.4, "excess_sharpe": 1.8737, "precision": 0.5106, "recall": 0.4444, "f1": 0.4752, "f2": 0.4563, "mcc": 0.0684, "accuracy": 0.5391, "tp": 24, "fp": 23, "tn": 38, "fn": 30}, {"fold": "fold_2", "regime": "2011 US-downgrade + EU debt", "n": 136, "A_sharpe": -2.9821, "A_sortino": -2.8198, "A_excess_sharpe": -4.7148, "A_return_pct": -28.66, "A_hit_rate": 41.48, "A_n": 136, "A_bh_sharpe": 1.7327, "A_bh_return_pct": 19.75, "A_psr": 0.0157, "A_ic": -0.118, "A_precision": 0.4921, "A_recall": 0.3974, "A_f1": 0.4397, "A_f2": 0.4133, "A_accuracy": 0.4191, "A_mcc": -0.153, "A_tp": 31, "A_fp": 32, "A_tn": 26, "A_fn": 47, "B_sharpe": 3.0138, "B_sortino": 3.2142, "B_excess_sharpe": -1.0521, "B_return_pct": 95.65, "B_hit_rate": 57.35, "B_n": 136, "B_bh_sharpe": 4.0659, "B_bh_return_pct": 148.68, "B_psr": 0.986, "B_ic": 0.1752, "B_precision": 0.7794, "B_recall": 0.5521, "B_f1": 0.6463, "B_f2": 0.5863, "B_accuracy": 0.5735, "B_mcc": 0.1614, "B_tp": 53, "B_fp": 15, "B_tn": 25, "B_fn": 43, "D_sharpe": -2.9821, "D_sortino": -2.8198, "D_excess_sharpe": -4.7148, "D_return_pct": -28.66, "D_hit_rate": 41.48, "D_n": 136, "D_bh_sharpe": 1.7327, "D_bh_return_pct": 19.75, "D_psr": 0.0157, "D_ic": -0.118, "D_precision": 0.4921, "D_recall": 0.3974, "D_f1": 0.4397, "D_f2": 0.4133, "D_accuracy": 0.4191, "D_mcc": -0.153, "D_tp": 31, "D_fp": 32, "D_tn": 26, "D_fn": 47, "sharpe": -2.9821, "sortino": -2.8198, "return_pct": -28.66, "equity": 713.4000000000001, "max_dd": 0.0, "win_rate": 41.48, "profit_factor": 0.0, "ic": -0.118, "hit": 41.48, "psr": 0.0157, "bh_sharpe": 1.7327, "bh_return_pct": 19.75, "excess_sharpe": -4.7148, "precision": 0.4921, "recall": 0.3974, "f1": 0.4397, "f2": 0.4133, "mcc": -0.153, "accuracy": 0.4191, "tp": 31, "fp": 32, "tn": 26, "fn": 47}, {"fold": "fold_3", "regime": "Taper tantrum and 2014 H1", "n": 178, "A_sharpe": 1.9297, "A_sortino": 2.4229, "A_excess_sharpe": 0.5851, "A_return_pct": 18.51, "A_hit_rate": 49.15, "A_n": 178, "A_bh_sharpe": 1.3445, "A_bh_return_pct": 12.41, "A_psr": 0.9541, "A_ic": 0.2363, "A_precision": 0.6757, "A_recall": 0.2427, "A_f1": 0.3571, "A_f2": 0.2784, "A_accuracy": 0.4944, "A_mcc": 0.1007, "A_tp": 25, "A_fp": 12, "A_tn": 63, "A_fn": 78, "B_sharpe": 2.4578, "B_sortino": 3.0129, "B_excess_sharpe": -0.5906, "B_return_pct": 54.43, "B_hit_rate": 50.56, "B_n": 178, "B_bh_sharpe": 3.0483, "B_bh_return_pct": 71.83, "B_psr": 0.9833, "B_ic": 0.21, "B_precision": 0.6567, "B_recall": 0.4037, "B_f1": 0.5, "B_f2": 0.4374, "B_accuracy": 0.5056, "B_mcc": 0.0707, "B_tp": 44, "B_fp": 23, "B_tn": 46, "B_fn": 65, "D_sharpe": 1.9297, "D_sortino": 2.4229, "D_excess_sharpe": 0.5851, "D_return_pct": 18.51, "D_hit_rate": 49.15, "D_n": 178, "D_bh_sharpe": 1.3445, "D_bh_return_pct": 12.41, "D_psr": 0.9541, "D_ic": 0.2363, "D_precision": 0.6757, "D_recall": 0.2427, "D_f1": 0.3571, "D_f2": 0.2784, "D_accuracy": 0.4944, "D_mcc": 0.1007, "D_tp": 25, "D_fp": 12, "D_tn": 63, "D_fn": 78, "sharpe": 1.9297, "sortino": 2.4229, "return_pct": 18.51, "equity": 1185.1000000000001, "max_dd": 0.0, "win_rate": 49.15, "profit_factor": 0.0, "ic": 0.2363, "hit": 49.15, "psr": 0.9541, "bh_sharpe": 1.3445, "bh_return_pct": 12.41, "excess_sharpe": 0.5851, "precision": 0.6757, "recall": 0.2427, "f1": 0.3571, "f2": 0.2784, "mcc": 0.1007, "accuracy": 0.4944, "tp": 25, "fp": 12, "tn": 63, "fn": 78}, {"fold": "fold_4", "regime": "China devaluation and oil crash", "n": 157, "A_sharpe": -0.7862, "A_sortino": -0.7372, "A_excess_sharpe": -0.796, "A_return_pct": -10.12, "A_hit_rate": 49.36, "A_n": 157, "A_bh_sharpe": 0.0098, "A_bh_return_pct": -1.05, "A_psr": 0.2671, "A_ic": 0.0164, "A_precision": 0.5227, "A_recall": 0.284, "A_f1": 0.368, "A_f2": 0.3125, "A_accuracy": 0.4968, "A_mcc": 0.0085, "A_tp": 23, "A_fp": 21, "A_tn": 55, "A_fn": 58, "B_sharpe": -0.582, "B_sortino": -0.6634, "B_excess_sharpe": -0.598, "B_return_pct": -19.67, "B_hit_rate": 40.76, "B_n": 157, "B_bh_sharpe": 0.0159, "B_bh_return_pct": -5.48, "B_psr": 0.3249, "B_ic": 0.1565, "B_precision": 0.375, "B_recall": 0.1412, "B_f1": 0.2051, "B_f2": 0.1613, "B_accuracy": 0.4076, "B_mcc": -0.169, "B_tp": 12, "B_fp": 20, "B_tn": 52, "B_fn": 73, "D_sharpe": -0.7862, "D_sortino": -0.7372, "D_excess_sharpe": -0.796, "D_return_pct": -10.12, "D_hit_rate": 49.36, "D_n": 157, "D_bh_sharpe": 0.0098, "D_bh_return_pct": -1.05, "D_psr": 0.2671, "D_ic": 0.0164, "D_precision": 0.5227, "D_recall": 0.284, "D_f1": 0.368, "D_f2": 0.3125, "D_accuracy": 0.4968, "D_mcc": 0.0085, "D_tp": 23, "D_fp": 21, "D_tn": 55, "D_fn": 58, "sharpe": -0.7862, "sortino": -0.7372, "return_pct": -10.12, "equity": 898.8000000000001, "max_dd": 0.0, "win_rate": 49.36, "profit_factor": 0.0, "ic": 0.0164, "hit": 49.36, "psr": 0.2671, "bh_sharpe": 0.0098, "bh_return_pct": -1.05, "excess_sharpe": -0.796, "precision": 0.5227, "recall": 0.284, "f1": 0.368, "f2": 0.3125, "mcc": 0.0085, "accuracy": 0.4968, "tp": 23, "fp": 21, "tn": 55, "fn": 58}, {"fold": "fold_5", "regime": "2018 Vol-mageddon + Q4 sell-off", "n": 177, "A_sharpe": 0.0786, "A_sortino": 0.084, "A_excess_sharpe": -0.2312, "A_return_pct": -0.58, "A_hit_rate": 50.28, "A_n": 177, "A_bh_sharpe": 0.3098, "A_bh_return_pct": 3.19, "A_psr": 0.5262, "A_ic": 0.0716, "A_precision": 0.6, "A_recall": 0.4369, "A_f1": 0.5056, "A_f2": 0.462, "A_accuracy": 0.5028, "A_mcc": 0.0314, "A_tp": 45, "A_fp": 30, "A_tn": 44, "A_fn": 58, "B_sharpe": -0.4502, "B_sortino": -0.533, "B_excess_sharpe": -1.3419, "B_return_pct": -19.85, "B_hit_rate": 40.91, "B_n": 177, "B_bh_sharpe": 0.8917, "B_bh_return_pct": 23.8, "B_psr": 0.3547, "B_ic": -0.0429, "B_precision": 0.5676, "B_recall": 0.1927, "B_f1": 0.2877, "B_f2": 0.222, "B_accuracy": 0.4124, "B_mcc": -0.051, "B_tp": 21, "B_fp": 16, "B_tn": 52, "B_fn": 88, "D_sharpe": 0.0786, "D_sortino": 0.084, "D_excess_sharpe": -0.2312, "D_return_pct": -0.58, "D_hit_rate": 50.28, "D_n": 177, "D_bh_sharpe": 0.3098, "D_bh_return_pct": 3.19, "D_psr": 0.5262, "D_ic": 0.0716, "D_precision": 0.6, "D_recall": 0.4369, "D_f1": 0.5056, "D_f2": 0.462, "D_accuracy": 0.5028, "D_mcc": 0.0314, "D_tp": 45, "D_fp": 30, "D_tn": 44, "D_fn": 58, "sharpe": 0.0786, "sortino": 0.084, "return_pct": -0.58, "equity": 994.1999999999999, "max_dd": 0.0, "win_rate": 50.28, "profit_factor": 0.0, "ic": 0.0716, "hit": 50.28, "psr": 0.5262, "bh_sharpe": 0.3098, "bh_return_pct": 3.19, "excess_sharpe": -0.2312, "precision": 0.6, "recall": 0.4369, "f1": 0.5056, "f2": 0.462, "mcc": 0.0314, "accuracy": 0.5028, "tp": 45, "fp": 30, "tn": 44, "fn": 58}, {"fold": "fold_6", "regime": "COVID crash and V-recovery", "n": 222, "A_sharpe": 0.0241, "A_sortino": 0.0244, "A_excess_sharpe": -0.8647, "A_return_pct": -5.43, "A_hit_rate": 47.75, "A_n": 222, "A_bh_sharpe": 0.8888, "A_bh_return_pct": 26.13, "A_psr": 0.509, "A_ic": 0.0304, "A_precision": 0.6897, "A_recall": 0.2899, "A_f1": 0.4082, "A_f2": 0.3279, "A_accuracy": 0.4775, "A_mcc": 0.0834, "A_tp": 40, "A_fp": 18, "A_tn": 66, "A_fn": 98, "B_sharpe": -1.7893, "B_sortino": -1.7314, "B_excess_sharpe": -4.1777, "B_return_pct": -73.07, "B_hit_rate": 44.34, "B_n": 222, "B_bh_sharpe": 2.3884, "B_bh_return_pct": 243.18, "B_psr": 0.0464, "B_ic": -0.0882, "B_precision": 0.6094, "B_recall": 0.2847, "B_f1": 0.3881, "B_f2": 0.3186, "B_accuracy": 0.4459, "B_mcc": -0.0101, "B_tp": 39, "B_fp": 25, "B_tn": 60, "B_fn": 98, "D_sharpe": 0.0241, "D_sortino": 0.0244, "D_excess_sharpe": -0.8647, "D_return_pct": -5.43, "D_hit_rate": 47.75, "D_n": 222, "D_bh_sharpe": 0.8888, "D_bh_return_pct": 26.13, "D_psr": 0.509, "D_ic": 0.0304, "D_precision": 0.6897, "D_recall": 0.2899, "D_f1": 0.4082, "D_f2": 0.3279, "D_accuracy": 0.4775, "D_mcc": 0.0834, "D_tp": 40, "D_fp": 18, "D_tn": 66, "D_fn": 98, "sharpe": 0.0241, "sortino": 0.0244, "return_pct": -5.43, "equity": 945.6999999999999, "max_dd": 0.0, "win_rate": 47.75, "profit_factor": 0.0, "ic": 0.0304, "hit": 47.75, "psr": 0.509, "bh_sharpe": 0.8888, "bh_return_pct": 26.13, "excess_sharpe": -0.8647, "precision": 0.6897, "recall": 0.2899, "f1": 0.4082, "f2": 0.3279, "mcc": 0.0834, "accuracy": 0.4775, "tp": 40, "fp": 18, "tn": 66, "fn": 98}, {"fold": "fold_7", "regime": "Inflation bear, AI rally and 2025", "n": 425, "A_sharpe": -0.607, "A_sortino": -0.6723, "A_excess_sharpe": -1.5785, "A_return_pct": -23.02, "A_hit_rate": 46.12, "A_n": 425, "A_bh_sharpe": 0.9715, "A_bh_return_pct": 37.12, "A_psr": 0.222, "A_ic": -0.0767, "A_precision": 0.5677, "A_recall": 0.352, "A_f1": 0.4346, "A_f2": 0.381, "A_accuracy": 0.4612, "A_mcc": -0.0315, "A_tp": 88, "A_fp": 67, "A_tn": 108, "A_fn": 162, "B_sharpe": -1.7309, "B_sortino": -1.8798, "B_excess_sharpe": -4.2336, "B_return_pct": -77.52, "B_hit_rate": 40.09, "B_n": 425, "B_bh_sharpe": 2.5027, "B_bh_return_pct": 458.83, "B_psr": 0.0155, "B_ic": -0.1425, "B_precision": 0.531, "B_recall": 0.2928, "B_f1": 0.3775, "B_f2": 0.3216, "B_accuracy": 0.4024, "B_mcc": -0.1301, "B_tp": 77, "B_fp": 68, "B_tn": 94, "B_fn": 186, "D_sharpe": -0.607, "D_sortino": -0.6723, "D_excess_sharpe": -1.5785, "D_return_pct": -23.02, "D_hit_rate": 46.12, "D_n": 425, "D_bh_sharpe": 0.9715, "D_bh_return_pct": 37.12, "D_psr": 0.222, "D_ic": -0.0767, "D_precision": 0.5677, "D_recall": 0.352, "D_f1": 0.4346, "D_f2": 0.381, "D_accuracy": 0.4612, "D_mcc": -0.0315, "D_tp": 88, "D_fp": 67, "D_tn": 108, "D_fn": 162, "sharpe": -0.607, "sortino": -0.6723, "return_pct": -23.02, "equity": 769.8000000000001, "max_dd": 0.0, "win_rate": 46.12, "profit_factor": 0.0, "ic": -0.0767, "hit": 46.12, "psr": 0.222, "bh_sharpe": 0.9715, "bh_return_pct": 37.12, "excess_sharpe": -1.5785, "precision": 0.5677, "recall": 0.352, "f1": 0.4346, "f2": 0.381, "mcc": -0.0315, "accuracy": 0.4612, "tp": 88, "fp": 67, "tn": 108, "fn": 162}], "per_window_val": [{"fold": "fold_1", "regime": "GFC peak crash (Lehman + Mar-2009 bottom)", "n": 104, "A_sharpe": 0.736, "A_sortino": 0.8699, "A_excess_sharpe": 0.9032, "A_return_pct": 7.47, "A_hit_rate": 47.06, "A_n": 104, "A_bh_sharpe": -0.1672, "A_bh_return_pct": -3.81, "A_psr": 0.6842, "A_ic": -0.0229, "A_precision": 0.4923, "A_recall": 0.5926, "A_f1": 0.5378, "A_f2": 0.5694, "A_accuracy": 0.4712, "A_mcc": -0.0696, "A_tp": 32, "A_fp": 33, "A_tn": 17, "A_fn": 22, "B_sharpe": 1.5884, "B_sortino": 1.9724, "B_excess_sharpe": 3.8625, "B_return_pct": 35.0, "B_hit_rate": 47.57, "B_n": 104, "B_bh_sharpe": -2.2741, "B_bh_return_pct": -44.12, "B_psr": 0.854, "B_ic": -0.0801, "B_precision": 0.475, "B_recall": 0.3654, "B_f1": 0.413, "B_f2": 0.3831, "B_accuracy": 0.4808, "B_mcc": -0.0395, "B_tp": 19, "B_fp": 21, "B_tn": 31, "B_fn": 33, "D_sharpe": 0.736, "D_sortino": 0.8699, "D_excess_sharpe": 0.9032, "D_return_pct": 7.47, "D_hit_rate": 47.06, "D_n": 104, "D_bh_sharpe": -0.1672, "D_bh_return_pct": -3.81, "D_psr": 0.6842, "D_ic": -0.0229, "D_precision": 0.4923, "D_recall": 0.5926, "D_f1": 0.5378, "D_f2": 0.5694, "D_accuracy": 0.4712, "D_mcc": -0.0696, "D_tp": 32, "D_fp": 33, "D_tn": 17, "D_fn": 22, "sharpe": 0.736, "sortino": 0.8699, "return_pct": 7.47, "equity": 1074.7, "max_dd": 0.0, "win_rate": 47.06, "profit_factor": 0.0, "ic": -0.0229, "hit": 47.06, "psr": 0.6842, "bh_sharpe": -0.1672, "bh_return_pct": -3.81, "excess_sharpe": 0.9032, "precision": 0.4923, "recall": 0.5926, "f1": 0.5378, "f2": 0.5694, "mcc": -0.0696, "accuracy": 0.4712, "tp": 32, "fp": 33, "tn": 17, "fn": 22}, {"fold": "fold_2", "regime": "2011 US-downgrade + EU debt", "n": 96, "A_sharpe": -0.6151, "A_sortino": -0.6311, "A_excess_sharpe": -0.341, "A_return_pct": -7.36, "A_hit_rate": 45.26, "A_n": 96, "A_bh_sharpe": -0.2741, "A_bh_return_pct": -4.09, "A_psr": 0.3529, "A_ic": -0.0825, "A_precision": 0.4571, "A_recall": 0.32, "A_f1": 0.3765, "A_f2": 0.3404, "A_accuracy": 0.4479, "A_mcc": -0.0966, "A_tp": 16, "A_fp": 19, "A_tn": 27, "A_fn": 34, "B_sharpe": -3.7049, "B_sortino": -3.251, "B_excess_sharpe": -2.6775, "B_return_pct": -58.19, "B_hit_rate": 42.71, "B_n": 96, "B_bh_sharpe": -1.0274, "B_bh_return_pct": -25.58, "B_psr": 0.0094, "B_ic": -0.1796, "B_precision": 0.3846, "B_recall": 0.4651, "B_f1": 0.4211, "B_f2": 0.4464, "B_accuracy": 0.4271, "B_mcc": -0.1384, "B_tp": 20, "B_fp": 32, "B_tn": 21, "B_fn": 23, "D_sharpe": -0.6151, "D_sortino": -0.6311, "D_excess_sharpe": -0.341, "D_return_pct": -7.36, "D_hit_rate": 45.26, "D_n": 96, "D_bh_sharpe": -0.2741, "D_bh_return_pct": -4.09, "D_psr": 0.3529, "D_ic": -0.0825, "D_precision": 0.4571, "D_recall": 0.32, "D_f1": 0.3765, "D_f2": 0.3404, "D_accuracy": 0.4479, "D_mcc": -0.0966, "D_tp": 16, "D_fp": 19, "D_tn": 27, "D_fn": 34, "sharpe": -0.6151, "sortino": -0.6311, "return_pct": -7.36, "equity": 926.4, "max_dd": 0.0, "win_rate": 45.26, "profit_factor": 0.0, "ic": -0.0825, "hit": 45.26, "psr": 0.3529, "bh_sharpe": -0.2741, "bh_return_pct": -4.09, "excess_sharpe": -0.341, "precision": 0.4571, "recall": 0.32, "f1": 0.3765, "f2": 0.3404, "mcc": -0.0966, "accuracy": 0.4479, "tp": 16, "fp": 19, "tn": 27, "fn": 34}, {"fold": "fold_3", "regime": "Taper tantrum and 2014 H1", "n": 54, "A_sharpe": -2.5483, "A_sortino": -2.5682, "A_excess_sharpe": -7.2481, "A_return_pct": -5.57, "A_hit_rate": 42.59, "A_n": 54, "A_bh_sharpe": 4.6998, "A_bh_return_pct": 10.46, "A_psr": 0.1335, "A_ic": -0.0147, "A_precision": 0.6667, "A_recall": 0.1212, "A_f1": 0.2051, "A_f2": 0.1449, "A_accuracy": 0.4259, "A_mcc": 0.0403, "A_tp": 4, "A_fp": 2, "A_tn": 19, "A_fn": 29, "B_sharpe": 2.7609, "B_sortino": 2.954, "B_excess_sharpe": -6.2716, "B_return_pct": 14.4, "B_hit_rate": 55.56, "B_n": 54, "B_bh_sharpe": 9.0326, "B_bh_return_pct": 49.18, "B_psr": 0.8942, "B_ic": 0.1514, "B_precision": 0.6585, "B_recall": 0.7297, "B_f1": 0.6923, "B_f2": 0.7143, "B_accuracy": 0.5556, "B_mcc": -0.1019, "B_tp": 27, "B_fp": 14, "B_tn": 3, "B_fn": 10, "D_sharpe": -2.5483, "D_sortino": -2.5682, "D_excess_sharpe": -7.2481, "D_return_pct": -5.57, "D_hit_rate": 42.59, "D_n": 54, "D_bh_sharpe": 4.6998, "D_bh_return_pct": 10.46, "D_psr": 0.1335, "D_ic": -0.0147, "D_precision": 0.6667, "D_recall": 0.1212, "D_f1": 0.2051, "D_f2": 0.1449, "D_accuracy": 0.4259, "D_mcc": 0.0403, "D_tp": 4, "D_fp": 2, "D_tn": 19, "D_fn": 29, "sharpe": -2.5483, "sortino": -2.5682, "return_pct": -5.57, "equity": 944.3000000000001, "max_dd": 0.0, "win_rate": 42.59, "profit_factor": 0.0, "ic": -0.0147, "hit": 42.59, "psr": 0.1335, "bh_sharpe": 4.6998, "bh_return_pct": 10.46, "excess_sharpe": -7.2481, "precision": 0.6667, "recall": 0.1212, "f1": 0.2051, "f2": 0.1449, "mcc": 0.0403, "accuracy": 0.4259, "tp": 4, "fp": 2, "tn": 19, "fn": 29}, {"fold": "fold_4", "regime": "China devaluation and oil crash", "n": 96, "A_sharpe": -0.2904, "A_sortino": -0.3189, "A_excess_sharpe": 0.1337, "A_return_pct": -2.78, "A_hit_rate": 48.42, "A_n": 96, "A_bh_sharpe": -0.4241, "A_bh_return_pct": -3.73, "A_psr": 0.4298, "A_ic": -0.077, "A_precision": 0.4474, "A_recall": 0.3778, "A_f1": 0.4096, "A_f2": 0.3899, "A_accuracy": 0.4896, "A_mcc": -0.0347, "A_tp": 17, "A_fp": 21, "A_tn": 30, "A_fn": 28, "B_sharpe": 4.0943, "B_sortino": 6.8386, "B_excess_sharpe": 5.2786, "B_return_pct": 89.67, "B_hit_rate": 56.25, "B_n": 96, "B_bh_sharpe": -1.1843, "B_bh_return_pct": -21.44, "B_psr": 0.9993, "B_ic": 0.1973, "B_precision": 0.55, "B_recall": 0.4783, "B_f1": 0.5116, "B_f2": 0.4911, "B_accuracy": 0.5625, "B_mcc": 0.1198, "B_tp": 22, "B_fp": 18, "B_tn": 32, "B_fn": 24, "D_sharpe": -0.2904, "D_sortino": -0.3189, "D_excess_sharpe": 0.1337, "D_return_pct": -2.78, "D_hit_rate": 48.42, "D_n": 96, "D_bh_sharpe": -0.4241, "D_bh_return_pct": -3.73, "D_psr": 0.4298, "D_ic": -0.077, "D_precision": 0.4474, "D_recall": 0.3778, "D_f1": 0.4096, "D_f2": 0.3899, "D_accuracy": 0.4896, "D_mcc": -0.0347, "D_tp": 17, "D_fp": 21, "D_tn": 30, "D_fn": 28, "sharpe": -0.2904, "sortino": -0.3189, "return_pct": -2.78, "equity": 972.1999999999999, "max_dd": 0.0, "win_rate": 48.42, "profit_factor": 0.0, "ic": -0.077, "hit": 48.42, "psr": 0.4298, "bh_sharpe": -0.4241, "bh_return_pct": -3.73, "excess_sharpe": 0.1337, "precision": 0.4474, "recall": 0.3778, "f1": 0.4096, "f2": 0.3899, "mcc": -0.0347, "accuracy": 0.4896, "tp": 17, "fp": 21, "tn": 30, "fn": 28}, {"fold": "fold_5", "regime": "2018 Vol-mageddon + Q4 sell-off", "n": 54, "A_sharpe": 1.1113, "A_sortino": 1.1598, "A_excess_sharpe": -0.3166, "A_return_pct": 3.04, "A_hit_rate": 51.85, "A_n": 54, "A_bh_sharpe": 1.428, "A_bh_return_pct": 3.97, "A_psr": 0.6955, "A_ic": 0.1268, "A_precision": 0.56, "A_recall": 0.4828, "A_f1": 0.5185, "A_f2": 0.4965, "A_accuracy": 0.5185, "A_mcc": 0.0428, "A_tp": 14, "A_fp": 11, "A_tn": 14, "A_fn": 15, "B_sharpe": -4.7596, "B_sortino": -4.5491, "B_excess_sharpe": -9.6918, "B_return_pct": -26.64, "B_hit_rate": 31.48, "B_n": 54, "B_bh_sharpe": 4.9322, "B_bh_return_pct": 34.93, "B_psr": 0.0179, "B_ic": -0.4763, "B_precision": 0.5, "B_recall": 0.1892, "B_f1": 0.2745, "B_f2": 0.216, "B_accuracy": 0.3148, "B_mcc": -0.2359, "B_tp": 7, "B_fp": 7, "B_tn": 10, "B_fn": 30, "D_sharpe": 1.1113, "D_sortino": 1.1598, "D_excess_sharpe": -0.3166, "D_return_pct": 3.04, "D_hit_rate": 51.85, "D_n": 54, "D_bh_sharpe": 1.428, "D_bh_return_pct": 3.97, "D_psr": 0.6955, "D_ic": 0.1268, "D_precision": 0.56, "D_recall": 0.4828, "D_f1": 0.5185, "D_f2": 0.4965, "D_accuracy": 0.5185, "D_mcc": 0.0428, "D_tp": 14, "D_fp": 11, "D_tn": 14, "D_fn": 15, "sharpe": 1.1113, "sortino": 1.1598, "return_pct": 3.04, "equity": 1030.4, "max_dd": 0.0, "win_rate": 51.85, "profit_factor": 0.0, "ic": 0.1268, "hit": 51.85, "psr": 0.6955, "bh_sharpe": 1.428, "bh_return_pct": 3.97, "excess_sharpe": -0.3166, "precision": 0.56, "recall": 0.4828, "f1": 0.5185, "f2": 0.4965, "mcc": 0.0428, "accuracy": 0.5185, "tp": 14, "fp": 11, "tn": 14, "fn": 15}, {"fold": "fold_6", "regime": "COVID crash and V-recovery", "n": 75, "A_sharpe": -0.5989, "A_sortino": -0.6577, "A_excess_sharpe": -4.8983, "A_return_pct": -2.17, "A_hit_rate": 42.67, "A_n": 75, "A_bh_sharpe": 4.2994, "A_bh_return_pct": 14.68, "A_psr": 0.3736, "A_ic": 0.0808, "A_precision": 0.7857, "A_recall": 0.2157, "A_f1": 0.3385, "A_f2": 0.2523, "A_accuracy": 0.4267, "A_mcc": 0.1086, "A_tp": 11, "A_fp": 3, "A_tn": 21, "A_fn": 40, "B_sharpe": -3.532, "B_sortino": -3.2804, "B_excess_sharpe": -17.866, "B_return_pct": -23.53, "B_hit_rate": 42.67, "B_n": 75, "B_bh_sharpe": 14.3339, "B_bh_return_pct": 120.13, "B_psr": 0.0319, "B_ic": -0.0387, "B_precision": 0.9545, "B_recall": 0.3333, "B_f1": 0.4941, "B_f2": 0.3832, "B_accuracy": 0.4267, "B_mcc": 0.2013, "B_tp": 21, "B_fp": 1, "B_tn": 11, "B_fn": 42, "D_sharpe": -0.5989, "D_sortino": -0.6577, "D_excess_sharpe": -4.8983, "D_return_pct": -2.17, "D_hit_rate": 42.67, "D_n": 75, "D_bh_sharpe": 4.2994, "D_bh_return_pct": 14.68, "D_psr": 0.3736, "D_ic": 0.0808, "D_precision": 0.7857, "D_recall": 0.2157, "D_f1": 0.3385, "D_f2": 0.2523, "D_accuracy": 0.4267, "D_mcc": 0.1086, "D_tp": 11, "D_fp": 3, "D_tn": 21, "D_fn": 40, "sharpe": -0.5989, "sortino": -0.6577, "return_pct": -2.17, "equity": 978.3, "max_dd": 0.0, "win_rate": 42.67, "profit_factor": 0.0, "ic": 0.0808, "hit": 42.67, "psr": 0.3736, "bh_sharpe": 4.2994, "bh_return_pct": 14.68, "excess_sharpe": -4.8983, "precision": 0.7857, "recall": 0.2157, "f1": 0.3385, "f2": 0.2523, "mcc": 0.1086, "accuracy": 0.4267, "tp": 11, "fp": 3, "tn": 21, "fn": 40}, {"fold": "fold_7", "regime": "Inflation bear, AI rally and 2025", "n": 114, "A_sharpe": -2.2903, "A_sortino": -2.2736, "A_excess_sharpe": -5.1353, "A_return_pct": -15.35, "A_hit_rate": 40.35, "A_n": 114, "A_bh_sharpe": 2.845, "A_bh_return_pct": 21.34, "A_psr": 0.064, "A_ic": -0.0255, "A_precision": 0.4848