{"experiment_num": 42, "backbone": "xgboost", "description": "XGBoost depth=4 n_est=100 lr=0.03 (down from 0.05) - slower learning at sweet-spot capacity", "config": {"seq_len": 60, "lr": 0.0003, "batch_size": 32, "epochs": 50, "weight_decay": 1e-05, "patience": 10, "warmup_epochs": 0, "head_dropout": 0.1, "huber_delta": 1.0, "grad_clip": 1.0, "seed": 42, "hidden_size": null, "num_layers": null, "max_depth": 4, "gbm_lr": 0.03, "n_estimators": 100}, "composite": -0.5587, "test_pos_folds": 5, "val_pos_folds": 3, "val_loss": null, "elapsed_sec": 77.5, "timestamp": "2026-04-27T18:59:38", "sharpe": 0.1891, "val_sharpe": -0.3587, "ic": 0.0054, "hit": 50.0, "psr": 0.6518, "equity": 1076.2, "return_pct": 7.62, "bh_sharpe": 1.2194, "bh_return_pct": 187.05, "excess_sharpe": -1.0302, "B_sharpe": -0.0279, "B_excess_sharpe": -2.856, "B_return_pct": -40.16, "D_sharpe": 0.3589, "D_excess_sharpe": -0.8605, "D_return_pct": 26.58, "per_window": [{"fold": "fold_1", "regime": "GFC peak crash (Lehman + Mar-2009 bottom)", "n": 66, "A_sharpe": 1.9912, "A_sortino": 2.2341, "A_excess_sharpe": 1.4191, "A_return_pct": 19.19, "A_hit_rate": 51.52, "A_n": 66, "A_bh_sharpe": 0.5721, "A_bh_return_pct": 3.85, "A_psr": 0.8462, "A_ic": 0.0951, "B_sharpe": -0.4973, "B_sortino": -0.4854, "B_excess_sharpe": -2.5442, "B_return_pct": -16.2, "B_hit_rate": 50.77, "B_n": 66, "B_bh_sharpe": 2.0469, "B_bh_return_pct": 39.28, "B_psr": 0.4004, "B_ic": 0.0915, "D_sharpe": 2.3796, "D_sortino": 2.338, "D_excess_sharpe": 1.8074, "D_return_pct": 23.67, "D_hit_rate": 57.58, "D_n": 66, "D_bh_sharpe": 0.5721, "D_bh_return_pct": 3.85, "D_psr": 0.8815, "D_ic": 0.2233, "sharpe": 1.9912, "sortino": 2.2341, "return_pct": 19.19, "equity": 1191.8999999999999, "max_dd": 0.0, "win_rate": 51.52, "profit_factor": 0.0, "ic": 0.0951, "hit": 51.52, "psr": 0.8462, "bh_sharpe": 0.5721, "bh_return_pct": 3.85, "excess_sharpe": 1.4191, "precision": 0.5455, "recall": 0.5143, "f1": 0.5294, "f2": 0.5202, "accuracy": 0.5152, "mcc": 0.0304, "tp": 18, "fp": 15, "tn": 16, "fn": 17, "A_precision": 0.5455, "A_recall": 0.5143, "A_f1": 0.5294, "A_f2": 0.5202, "A_accuracy": 0.5152, "A_mcc": 0.0304, "A_tp": 18, "A_fp": 15, "A_tn": 16, "A_fn": 17}, {"fold": "fold_2", "regime": "2011 US-downgrade + EU debt", "n": 87, "A_sharpe": 1.2874, "A_sortino": 1.5994, "A_excess_sharpe": -3.7345, "A_return_pct": 6.78, "A_hit_rate": 51.16, "A_n": 87, "A_bh_sharpe": 5.022, "A_bh_return_pct": 29.23, "A_psr": 0.7841, "A_ic": -0.0505, "B_sharpe": 10.1433, "B_sortino": 9.4264, "B_excess_sharpe": -0.9936, "B_return_pct": 166.97, "B_hit_rate": 80.46, "B_n": 87, "B_bh_sharpe": 11.1369, "B_bh_return_pct": 185.4, "B_psr": 1.0, "B_ic": 0.1955, "D_sharpe": 4.7557, "D_sortino": 5.9255, "D_excess_sharpe": -0.2663, "D_return_pct": 27.6, "D_hit_rate": 62.79, "D_n": 87, "D_bh_sharpe": 5.022, "D_bh_return_pct": 29.23, "D_psr": 0.9991, "D_ic": 0.0057, "sharpe": 1.2874, "sortino": 1.5994, "return_pct": 6.78, "equity": 1067.8000000000002, "max_dd": 0.0, "win_rate": 51.16, "profit_factor": 0.0, "ic": -0.0505, "hit": 51.16, "psr": 0.7841, "bh_sharpe": 5.022, "bh_return_pct": 29.23, "excess_sharpe": -3.7345, "precision": 0.6034, "recall": 0.6481, "f1": 0.625, "f2": 0.6387, "accuracy": 0.5172, "mcc": -0.0503, "tp": 35, "fp": 23, "tn": 10, "fn": 19, "A_precision": 0.6034, "A_recall": 0.6481, "A_f1": 0.625, "A_f2": 0.6387, "A_accuracy": 0.5172, "A_mcc": -0.0503, "A_tp": 35, "A_fp": 23, "A_tn": 10, "A_fn": 19}, {"fold": "fold_3", "regime": "Taper tantrum and 2014 H1", "n": 129, "A_sharpe": 2.025, "A_sortino": 1.716, "A_excess_sharpe": 0.2572, "A_return_pct": 13.63, "A_hit_rate": 60.94, "A_n": 129, "A_bh_sharpe": 1.7678, "A_bh_return_pct": 11.76, "A_psr": 0.9112, "A_ic": 0.0527, "B_sharpe": 3.7152, "B_sortino": 3.7192, "B_excess_sharpe": -0.5322, "B_return_pct": 54.48, "B_hit_rate": 62.02, "B_n": 129, "B_bh_sharpe": 4.2474, "B_bh_return_pct": 64.1, "B_psr": 0.9948, "B_ic": -0.0329, "D_sharpe": 1.9646, "D_sortino": 1.7365, "D_excess_sharpe": 0.1968, "D_return_pct": 13.19, "D_hit_rate": 59.38, "D_n": 129, "D_bh_sharpe": 1.7678, "D_bh_return_pct": 11.76, "D_psr": 0.9075, "D_ic": 0.0757, "sharpe": 2.025, "sortino": 1.716, "return_pct": 13.63, "equity": 1136.3000000000002, "max_dd": 0.0, "win_rate": 60.94, "profit_factor": 0.0, "ic": 0.0527, "hit": 60.94, "psr": 0.9112, "bh_sharpe": 1.7678, "bh_return_pct": 11.76, "excess_sharpe": 0.2572, "precision": 0.6154, "recall": 0.9231, "f1": 0.7385, "f2": 0.8392, "accuracy": 0.6047, "mcc": 0.0685, "tp": 72, "fp": 45, "tn": 6, "fn": 6, "A_precision": 0.6154, "A_recall": 0.9231, "A_f1": 0.7385, "A_f2": 0.8392, "A_accuracy": 0.6047, "A_mcc": 0.0685, "A_tp": 72, "A_fp": 45, "A_tn": 6, "A_fn": 6}, {"fold": "fold_4", "regime": "China devaluation and oil crash", "n": 108, "A_sharpe": -1.5078, "A_sortino": -1.4143, "A_excess_sharpe": -0.8181, "A_return_pct": -13.12, "A_hit_rate": 46.73, "A_n": 108, "A_bh_sharpe": -0.6898, "A_bh_return_pct": -6.71, "A_psr": 0.161, "A_ic": -0.007, "B_sharpe": -2.7865, "B_sortino": -2.5396, "B_excess_sharpe": -0.829, "B_return_pct": -42.88, "B_hit_rate": 41.67, "B_n": 108, "B_bh_sharpe": -1.9575, "B_bh_return_pct": -33.56, "B_psr": 0.0305, "B_ic": -0.0749, "D_sharpe": -1.8279, "D_sortino": -1.6778, "D_excess_sharpe": -1.1381, "D_return_pct": -15.48, "D_hit_rate": 45.79, "D_n": 108, "D_bh_sharpe": -0.6898, "D_bh_return_pct": -6.71, "D_psr": 0.1134, "D_ic": -0.0484, "sharpe": -1.5078, "sortino": -1.4143, "return_pct": -13.12, "equity": 868.8000000000001, "max_dd": 0.0, "win_rate": 46.73, "profit_factor": 0.0, "ic": -0.007, "hit": 46.73, "psr": 0.161, "bh_sharpe": -0.6898, "bh_return_pct": -6.71, "excess_sharpe": -0.8181, "precision": 0.4615, "recall": 0.566, "f1": 0.5085, "f2": 0.5415, "accuracy": 0.463, "mcc": -0.0718, "tp": 30, "fp": 35, "tn": 20, "fn": 23, "A_precision": 0.4615, "A_recall": 0.566, "A_f1": 0.5085, "A_f2": 0.5415, "A_accuracy": 0.463, "A_mcc": -0.0718, "A_tp": 30, "A_fp": 35, "A_tn": 20, "A_fn": 23}, {"fold": "fold_5", "regime": "2018 Vol-mageddon + Q4 sell-off", "n": 128, "A_sharpe": 1.5413, "A_sortino": 1.6704, "A_excess_sharpe": 0.3901, "A_return_pct": 18.57, "A_hit_rate": 53.91, "A_n": 128, "A_bh_sharpe": 1.1511, "A_bh_return_pct": 13.19, "A_psr": 0.8675, "A_ic": 0.0523, "B_sharpe": -2.7015, "B_sortino": -2.6048, "B_excess_sharpe": -5.5134, "B_return_pct": -49.68, "B_hit_rate": 38.58, "B_n": 128, "B_bh_sharpe": 2.8119, "B_bh_return_pct": 82.25, "B_psr": 0.0262, "B_ic": -0.1651, "D_sharpe": -1.4448, "D_sortino": -1.5025, "D_excess_sharpe": -2.5959, "D_return_pct": -17.07, "D_hit_rate": 44.53, "D_n": 128, "D_bh_sharpe": 1.1511, "D_bh_return_pct": 13.19, "D_psr": 0.1592, "D_ic": -0.0953, "sharpe": 1.5413, "sortino": 1.6704, "return_pct": 18.57, "equity": 1185.7, "max_dd": 0.0, "win_rate": 53.91, "profit_factor": 0.0, "ic": 0.0523, "hit": 53.91, "psr": 0.8675, "bh_sharpe": 1.1511, "bh_return_pct": 13.19, "excess_sharpe": 0.3901, "precision": 0.6234, "recall": 0.6154, "f1": 0.6194, "f2": 0.617, "accuracy": 0.5391, "mcc": 0.0353, "tp": 48, "fp": 29, "tn": 21, "fn": 30, "A_precision": 0.6234, "A_recall": 0.6154, "A_f1": 0.6194, "A_f2": 0.617, "A_accuracy": 0.5391, "A_mcc": 0.0353, "A_tp": 48, "A_fp": 29, "A_tn": 21, "A_fn": 30}, {"fold": "fold_6", "regime": "COVID crash and V-recovery", "n": 173, "A_sharpe": 0.9706, "A_sortino": 0.9774, "A_excess_sharpe": -1.3554, "A_return_pct": 15.17, "A_hit_rate": 52.02, "A_n": 173, "A_bh_sharpe": 2.3261, "A_bh_return_pct": 43.81, "A_psr": 0.787, "A_ic": 0.0918, "B_sharpe": -0.8035, "B_sortino": -0.792, "B_excess_sharpe": -6.5495, "B_return_pct": -30.75, "B_hit_rate": 46.51, "B_n": 173, "B_bh_sharpe": 5.746, "B_bh_return_pct": 499.04, "B_psr": 0.2529, "B_ic": 0.0492, "D_sharpe": -0.0042, "D_sortino": -0.0042, "D_excess_sharpe": -2.3303, "D_return_pct": -2.08, "D_hit_rate": 50.29, "D_n": 173, "D_bh_sharpe": 2.3261, "D_bh_return_pct": 43.81, "D_psr": 0.4986, "D_ic": -0.0298, "sharpe": 0.9706, "sortino": 0.9774, "return_pct": 15.17, "equity": 1151.7, "max_dd": 0.0, "win_rate": 52.02, "profit_factor": 0.0, "ic": 0.0918, "hit": 52.02, "psr": 0.787, "bh_sharpe": 2.3261, "bh_return_pct": 43.81, "excess_sharpe": -1.3554, "precision": 0.6667, "recall": 0.531, "f1": 0.5911, "f2": 0.5535, "accuracy": 0.5202, "mcc": 0.0295, "tp": 60, "fp": 30, "tn": 30, "fn": 53, "A_precision": 0.6667, "A_recall": 0.531, "A_f1": 0.5911, "A_f2": 0.5535, "A_accuracy": 0.5202, "A_mcc": 0.0295, "A_tp": 60, "A_fp": 30, "A_tn": 30, "A_fn": 53}, {"fold": "fold_7", "regime": "Inflation bear, AI rally and 2025", "n": 376, "A_sharpe": -1.2857, "A_sortino": -1.3846, "A_excess_sharpe": -2.089, "A_return_pct": -37.28, "A_hit_rate": 44.41, "A_n": 376, "A_bh_sharpe": 0.8033, "A_bh_return_pct": 26.02, "A_psr": 0.0701, "A_ic": -0.0741, "B_sharpe": 0.0299, "B_sortino": 0.0343, "B_excess_sharpe": -1.9018, "B_return_pct": -13.01, "B_hit_rate": 43.73, "B_n": 376, "B_bh_sharpe": 1.9317, "B_bh_return_pct": 222.05, "B_psr": 0.5146, "B_ic": -0.017, "D_sharpe": 0.2059, "D_sortino": 0.2652, "D_excess_sharpe": -0.5974, "D_return_pct": 3.25, "D_hit_rate": 43.35, "D_n": 376, "D_bh_sharpe": 0.8033, "D_bh_return_pct": 26.02, "D_psr": 0.6003, "D_ic": -0.0014, "sharpe": -1.2857, "sortino": -1.3846, "return_pct": -37.28, "equity": 627.1999999999999, "max_dd": 0.0, "win_rate": 44.41, "profit_factor": 0.0, "ic": -0.0741, "hit": 44.41, "psr": 0.0701, "bh_sharpe": 0.8033, "bh_return_pct": 26.02, "excess_sharpe": -2.089, "precision": 0.5462, "recall": 0.3213, "f1": 0.4046, "f2": 0.3501, "accuracy": 0.4441, "mcc": -0.0615, "tp": 71, "fp": 59, "tn": 96, "fn": 150, "A_precision": 0.5462, "A_recall": 0.3213, "A_f1": 0.4046, "A_f2": 0.3501, "A_accuracy": 0.4441, "A_mcc": -0.0615, "A_tp": 71, "A_fp": 59, "A_tn": 96, "A_fn": 150}], "per_window_val": [{"fold": "fold_1", "regime": "GFC peak crash (Lehman + Mar-2009 bottom)", "n": 65, "A_sharpe": 0.3945, "A_sortino": 0.4897, "A_excess_sharpe": 2.6202, "A_return_pct": 2.01, "A_hit_rate": 44.44, "A_n": 65, "A_bh_sharpe": -2.2257, "A_bh_return_pct": -18.74, "A_psr": 0.5799, "A_ic": -0.0006, "B_sharpe": -5.1462, "B_sortino": -4.7807, "B_excess_sharpe": 1.9761, "B_return_pct": -63.37, "B_hit_rate": 35.38, "B_n": 65, "B_bh_sharpe": -7.1223, "B_bh_return_pct": -73.11, "B_psr": 0.0123, "B_ic": 0.3447, "D_sharpe": -1.7953, "D_sortino": -1.4893, "D_excess_sharpe": 0.4303, "D_return_pct": -15.71, "D_hit_rate": 49.21, "D_n": 65, "D_bh_sharpe": -2.2257, "D_bh_return_pct": -18.74, "D_psr": 0.1689, "D_ic": 0.2536, "sharpe": 0.3945, "sortino": 0.4897, "return_pct": 2.01, "equity": 1020.1, "max_dd": 0.0, "win_rate": 44.44, "profit_factor": 0.0, "ic": -0.0006, "hit": 44.44, "psr": 0.5799, "bh_sharpe": -2.2257, "bh_return_pct": -18.74, "excess_sharpe": 2.6202}, {"fold": "fold_2", "regime": "2011 US-downgrade + EU debt", "n": 47, "A_sharpe": -0.73, "A_sortino": -0.6535, "A_excess_sharpe": -0.5359, "A_return_pct": -5.69, "A_hit_rate": 53.19, "A_n": 47, "A_bh_sharpe": -0.1941, "A_bh_return_pct": -2.36, "A_psr": 0.3768, "A_ic": 0.0049, "B_sharpe": -0.3579, "B_sortino": -0.3116, "B_excess_sharpe": 1.2544, "B_return_pct": -9.87, "B_hit_rate": 53.19, "B_n": 47, "B_bh_sharpe": -1.6123, "B_bh_return_pct": -24.3, "B_psr": 0.4388, "B_ic": 0.4059, "D_sharpe": 0.7248, "D_sortino": 0.6815, "D_excess_sharpe": 0.9189, "D_return_pct": 3.63, "D_hit_rate": 55.32, "D_n": 47, "D_bh_sharpe": -0.1941, "D_bh_return_pct": -2.36, "D_psr": 0.6208, "D_ic": 0.1707, "sharpe": -0.73, "sortino": -0.6535, "return_pct": -5.69, "equity": 943.1, "max_dd": 0.0, "win_rate": 53.19, "profit_factor": 0.0, "ic": 0.0049, "hit": 53.19, "psr": 0.3768, "bh_sharpe": -0.1941, "bh_return_pct": -2.36, "excess_sharpe": -0.5359}, {"fold": "fold_3", "regime": "Taper tantrum and 2014 H1", "n": 5, "A_sharpe": 10.4634, "A_sortino": 21.0684, "A_excess_sharpe": 11.7829, "A_return_pct": 1.37, "A_hit_rate": 60.0, "A_n": 5, "A_bh_sharpe": -1.3194, "A_bh_return_pct": -0.21, "A_psr": 0.9289, "A_ic": 0.7, "B_sharpe": -25.8705, "B_sortino": -13.5303, "B_excess_sharpe": 0.0, "B_return_pct": -3.84, "B_hit_rate": 0.0, "B_n": 5, "B_bh_sharpe": -25.8705, "B_bh_return_pct": -3.84, "B_psr": 0.0, "B_ic": -0.2, "D_sharpe": -1.3194, "D_sortino": -1.3491, "D_excess_sharpe": 0.0, "D_return_pct": -0.21, "D_hit_rate": 40.0, "D_n": 5, "D_bh_sharpe": -1.3194, "D_bh_return_pct": -0.21, "D_psr": 0.4337, "D_ic": -0.3, "sharpe": 10.4634, "sortino": 21.0684, "return_pct": 1.37, "equity": 1013.7, "max_dd": 0.0, "win_rate": 60.0, "profit_factor": 0.0, "ic": 0.7, "hit": 60.0, "psr": 0.9289, "bh_sharpe": -1.3194, "bh_return_pct": -0.21, "excess_sharpe": 11.7829}, {"fold": "fold_4", "regime": "China devaluation and oil crash", "n": 47, "A_sharpe": -0.9684, "A_sortino": -0.9642, "A_excess_sharpe": 0.8554, "A_return_pct": -4.99, "A_hit_rate": 44.68, "A_n": 47, "A_bh_sharpe": -1.8238, "A_bh_return_pct": -8.68, "A_psr": 0.3395, "A_ic": -0.0047, "B_sharpe": -2.3514, "B_sortino": -2.0531, "B_excess_sharpe": -0.1314, "B_return_pct": -25.04, "B_hit_rate": 42.55, "B_n": 47, "B_bh_sharpe": -2.22, "B_bh_return_pct": -23.98, "B_psr": 0.1358, "B_ic": 0.5471, "D_sharpe": -0.4563, "D_sortino": -0.4562, "D_excess_sharpe": 1.3675, "D_return_pct": -2.69, "D_hit_rate": 46.81, "D_n": 47, "D_bh_sharpe": -1.8238, "D_bh_return_pct": -8.68, "D_psr": 0.4227, "D_ic": 0.2506, "sharpe": -0.9684, "sortino": -0.9642, "return_pct": -4.99, "equity": 950.0999999999999, "max_dd": 0.0, "win_rate": 44.68, "profit_factor": 0.0, "ic": -0.0047, "hit": 44.68, "psr": 0.3395, "bh_sharpe": -1.8238, "bh_return_pct": -8.68, "excess_sharpe": 0.8554}, {"fold": "fold_5", "regime": "2018 Vol-mageddon + Q4 sell-off", "n": 5, "A_sharpe": -10.1368, "A_sortino": -6.9937, "A_excess_sharpe": 0.0, "A_return_pct": -3.15, "A_hit_rate": 40.0, "A_n": 5, "A_bh_sharpe": -10.1368, "A_bh_return_pct": -3.15, "A_psr": 0.0985, "A_ic": 0.8, "B_sharpe": 5.6858, "B_sortino": 6.0578, "B_excess_sharpe": 0.0, "B_return_pct": 4.22, "B_hit_rate": 60.0, "B_n": 5, "B_bh_sharpe": 5.6858, "B_bh_return_pct": 4.22, "B_psr": 0.753, "B_ic": 0.6, "D_sharpe": -10.1368, "D_sortino": -6.9937, "D_excess_sharpe": 0.0, "D_return_pct": -3.15, "D_hit_rate": 40.0, "D_n": 5, "D_bh_sharpe": -10.1368, "D_bh_return_pct": -3.15, "D_psr": 0.0985, "D_ic": 0.2, "sharpe": -10.1368, "sortino": -6.9937, "return_pct": -3.15, "equity": 968.5, "max_dd": 0.0, "win_rate": 40.0, "profit_factor": 0.0, "ic": 0.8, "hit": 40.0, "psr": 0.0985, "bh_sharpe": -10.1368, "bh_return_pct": -3.15, "excess_sharpe": 0.0}, {"fold": "fold_6", "regime": "COVID crash and V-recovery", "n": 26, "A_sharpe": 4.5857, "A_sortino": 5.224, "A_excess_sharpe": 1.3005, "A_return_pct": 6.7, "A_hit_rate": 57.69, "A_n": 26, "A_bh_sharpe": 3.2852, "A_bh_return_pct": 4.82, "A_psr": 0.9228, "A_ic": 0.1262, "B_sharpe": 6.3606, "B_sortino": 6.1668, "B_excess_sharpe": -6.6186, "B_return_pct": 20.96, "B_hit_rate": 69.23, "B_n": 26, "B_bh_sharpe": 12.9792, "B_bh_return_pct": 38.76, "B_psr": 0.9687, "B_ic": 0.2574, "D_sharpe": 4.7039, "D_sortino": 5.1847, "D_excess_sharpe": 1.4188, "D_return_pct": 6.87, "D_hit_rate": 57.69, "D_n": 26, "D_bh_sharpe": 3.2852, "D_bh_return_pct": 4.82, "D_psr": 0.9195, "D_ic": 0.2793, "sharpe": 4.5857, "sortino": 5.224, "return_pct": 6.7, "equity": 1067.0, "max_dd": 0.0, "win_rate": 57.69, "profit_factor": 0.0, "ic": 0.1262, "hit": 57.69, "psr": 0.9228, "bh_sharpe": 3.2852, "bh_return_pct": 4.82, "excess_sharpe": 1.3005}, {"fold": "fold_7", "regime": "Inflation bear, AI rally and 2025", "n": 65, "A_sharpe": -2.2545, "A_sortino": -2.1242, "A_excess_sharpe": -4.3335, "A_return_pct": -8.73, "A_hit_rate": 46.15, "A_n": 65, "A_bh_sharpe": 2.0789, "A_bh_return_pct": 8.17, "A_psr": 0.1291, "A_ic": -0.0795, "B_sharpe": -4.5502, "B_sortino": -4.1389, "B_excess_sharpe": -9.7816, "B_return_pct": -29.22, "B_hit_rate": 36.92, "B_n": 65, "B_bh_sharpe": 5.2314, "B_bh_return_pct": 44.53, "B_psr": 0.0119, "B_ic": 0.0136, "D_sharpe": -1.2035, "D_sortino": -1.0767, "D_excess_sharpe": -3.2824, "D_return_pct": -4.92, "D_hit_rate": 50.77, "D_n": 65, "D_bh_sharpe": 2.0789, "D_bh_return_pct": 8.17, "D_psr": 0.2695, "D_ic": 0.0216, "sharpe": -2.2545, "sortino": -2.1242, "return_pct": -8.73, "equity": 912.6999999999999, "max_dd": 0.0, "win_rate": 46.15, "profit_factor": 0.0, "ic": -0.0795, "hit": 46.15, "psr": 0.1291, "bh_sharpe": 2.0789, "bh_return_pct": 8.17, "excess_sharpe": -4.3335}], "status": "DISCARD", "precision": 0.586, "recall": 0.5285, "f1": 0.5557, "f2": 0.5391, "accuracy": 0.4995, "mcc": -0.0138, "tp": 334, "fp": 236, "tn": 199, "fn": 298, "test_sharpe": 0.1891, "A_sharpe": 0.1891, "A_excess_sharpe": -1.0302, "A_return_pct": 7.62, "A_precision": 0.586, "A_recall": 0.5285, "A_f1": 0.5557, "A_f2": 0.5391, "A_accuracy": 0.4995, "A_mcc": -0.0138, "A_tp": 334, "A_fp": 236, "A_tn": 199, "A_fn": 298, "A_psr": 0.6518, "A_ic": 0.0054, "A_hit_rate": 50.0, "A_bh_sharpe": 1.2194, "A_bh_return_pct": 187.05}
