{"experiment_num": 83, "backbone": "lstm", "description": "LSTM @ exp 71 1-layer wd=1e-3 (up from 7e-4) - Loshchilov 2019 log-spaced AdamW WD on 1-layer baseline", "config": {"seq_len": 10, "lr": 0.001, "batch_size": 16, "epochs": 100, "weight_decay": 0.001, "patience": 15, "warmup_epochs": 0, "head_dropout": 0.1, "huber_delta": 1.0, "grad_clip": 1.0, "seed": 0, "hidden_size": null, "num_layers": 1, "max_depth": null, "gbm_lr": null, "n_estimators": null}, "composite": -0.4171, "test_pos_folds": 3, "val_pos_folds": 5, "val_loss": -2.885341854963898, "elapsed_sec": 43.5, "timestamp": "2026-04-27T23:20:36", "sharpe": -0.0171, "val_sharpe": 0.1442, "ic": 0.0354, "hit": 45.98, "psr": 0.4839, "equity": 794.2, "return_pct": -20.58, "bh_sharpe": 0.6042, "bh_return_pct": 103.49, "excess_sharpe": -0.6214, "B_sharpe": 1.5872, "B_excess_sharpe": -0.1136, "B_return_pct": 4936.8, "D_sharpe": -0.0171, "D_excess_sharpe": -0.6214, "D_return_pct": -20.58, "precision": 0.5714, "recall": 0.233, "f1": 0.331, "f2": 0.2643, "mcc": -0.001, "accuracy": 0.461, "val_precision": 0.5446, "val_recall": 0.1854, "val_f1": 0.2766, "val_f2": 0.2136, "val_mcc": -0.0099, "val_accuracy": 0.4621, "per_window": [{"fold": "fold_1", "regime": "GFC peak crash (Lehman + Mar-2009 bottom)", "n": 115, "A_sharpe": 1.3852, "A_sortino": 1.3992, "A_excess_sharpe": 1.8293, "A_return_pct": 29.08, "A_hit_rate": 54.78, "A_n": 115, "A_bh_sharpe": -0.4441, "A_bh_return_pct": -14.4, "A_psr": 0.8242, "A_ic": 0.0361, "A_precision": 0.5192, "A_recall": 0.5, "A_f1": 0.5094, "A_f2": 0.5037, "A_accuracy": 0.5478, "A_mcc": 0.0904, "A_tp": 27, "A_fp": 25, "A_tn": 36, "A_fn": 27, "B_sharpe": 0.7007, "B_sortino": 0.6644, "B_excess_sharpe": 0.9985, "B_return_pct": 10.44, "B_hit_rate": 54.39, "B_n": 115, "B_bh_sharpe": -0.2978, "B_bh_return_pct": -27.23, "B_psr": 0.6804, "B_ic": 0.1001, "B_precision": 0.5686, "B_recall": 0.4915, "B_f1": 0.5273, "B_f2": 0.5052, "B_accuracy": 0.5478, "B_mcc": 0.0993, "B_tp": 29, "B_fp": 22, "B_tn": 34, "B_fn": 30, "D_sharpe": 1.3852, "D_sortino": 1.3992, "D_excess_sharpe": 1.8293, "D_return_pct": 29.08, "D_hit_rate": 54.78, "D_n": 115, "D_bh_sharpe": -0.4441, "D_bh_return_pct": -14.4, "D_psr": 0.8242, "D_ic": 0.0361, "D_precision": 0.5192, "D_recall": 0.5, "D_f1": 0.5094, "D_f2": 0.5037, "D_accuracy": 0.5478, "D_mcc": 0.0904, "D_tp": 27, "D_fp": 25, "D_tn": 36, "D_fn": 27, "sharpe": 1.3852, "sortino": 1.3992, "return_pct": 29.08, "equity": 1290.8, "max_dd": 0.0, "win_rate": 54.78, "profit_factor": 0.0, "ic": 0.0361, "hit": 54.78, "psr": 0.8242, "bh_sharpe": -0.4441, "bh_return_pct": -14.4, "excess_sharpe": 1.8293, "precision": 0.5192, "recall": 0.5, "f1": 0.5094, "f2": 0.5037, "mcc": 0.0904, "accuracy": 0.5478, "tp": 27, "fp": 25, "tn": 36, "fn": 27}, {"fold": "fold_2", "regime": "2011 US-downgrade + EU debt", "n": 136, "A_sharpe": -3.845, "A_sortino": -3.5013, "A_excess_sharpe": -5.5777, "A_return_pct": -34.78, "A_hit_rate": 38.52, "A_n": 136, "A_bh_sharpe": 1.7327, "A_bh_return_pct": 19.75, "A_psr": 0.0021, "A_ic": 0.0346, "A_precision": 0.2727, "A_recall": 0.0385, "A_f1": 0.0674, "A_f2": 0.0464, "A_accuracy": 0.3897, "A_mcc": -0.1804, "A_tp": 3, "A_fp": 8, "A_tn": 50, "A_fn": 75, "B_sharpe": 2.5318, "B_sortino": 2.3951, "B_excess_sharpe": -1.5341, "B_return_pct": 74.71, "B_hit_rate": 62.5, "B_n": 136, "B_bh_sharpe": 4.0659, "B_bh_return_pct": 148.68, "B_psr": 0.9668, "B_ic": 0.0164, "B_precision": 0.6991, "B_recall": 0.8229, "B_f1": 0.756, "B_f2": 0.7948, "B_accuracy": 0.625, "B_mcc": -0.0329, "B_tp": 79, "B_fp": 34, "B_tn": 6, "B_fn": 17, "D_sharpe": -3.845, "D_sortino": -3.5013, "D_excess_sharpe": -5.5777, "D_return_pct": -34.78, "D_hit_rate": 38.52, "D_n": 136, "D_bh_sharpe": 1.7327, "D_bh_return_pct": 19.75, "D_psr": 0.0021, "D_ic": 0.0346, "D_precision": 0.2727, "D_recall": 0.0385, "D_f1": 0.0674, "D_f2": 0.0464, "D_accuracy": 0.3897, "D_mcc": -0.1804, "D_tp": 3, "D_fp": 8, "D_tn": 50, "D_fn": 75, "sharpe": -3.845, "sortino": -3.5013, "return_pct": -34.78, "equity": 652.2, "max_dd": 0.0, "win_rate": 38.52, "profit_factor": 0.0, "ic": 0.0346, "hit": 38.52, "psr": 0.0021, "bh_sharpe": 1.7327, "bh_return_pct": 19.75, "excess_sharpe": -5.5777, "precision": 0.2727, "recall": 0.0385, "f1": 0.0674, "f2": 0.0464, "mcc": -0.1804, "accuracy": 0.3897, "tp": 3, "fp": 8, "tn": 50, "fn": 75}, {"fold": "fold_3", "regime": "Taper tantrum and 2014 H1", "n": 178, "A_sharpe": -1.4396, "A_sortino": -1.6129, "A_excess_sharpe": -2.7842, "A_return_pct": -12.85, "A_hit_rate": 41.24, "A_n": 178, "A_bh_sharpe": 1.3445, "A_bh_return_pct": 12.41, "A_psr": 0.123, "A_ic": -0.1061, "A_precision": 0.0, "A_recall": 0.0, "A_f1": 0.0, "A_f2": 0.0, "A_accuracy": 0.4157, "A_mcc": -0.0881, "A_tp": 0, "A_fp": 1, "A_tn": 74, "A_fn": 103, "B_sharpe": 2.6603, "B_sortino": 2.4949, "B_excess_sharpe": -0.388, "B_return_pct": 60.19, "B_hit_rate": 60.11, "B_n": 178, "B_bh_sharpe": 3.0483, "B_bh_return_pct": 71.83, "B_psr": 0.984, "B_ic": 0.0234, "B_precision": 0.6319, "B_recall": 0.8349, "B_f1": 0.7194, "B_f2": 0.7845, "B_accuracy": 0.6011, "B_mcc": 0.0827, "B_tp": 91, "B_fp": 53, "B_tn": 16, "B_fn": 18, "D_sharpe": -1.4396, "D_sortino": -1.6129, "D_excess_sharpe": -2.7842, "D_return_pct": -12.85, "D_hit_rate": 41.24, "D_n": 178, "D_bh_sharpe": 1.3445, "D_bh_return_pct": 12.41, "D_psr": 0.123, "D_ic": -0.1061, "D_precision": 0.0, "D_recall": 0.0, "D_f1": 0.0, "D_f2": 0.0, "D_accuracy": 0.4157, "D_mcc": -0.0881, "D_tp": 0, "D_fp": 1, "D_tn": 74, "D_fn": 103, "sharpe": -1.4396, "sortino": -1.6129, "return_pct": -12.85, "equity": 871.4999999999999, "max_dd": 0.0, "win_rate": 41.24, "profit_factor": 0.0, "ic": -0.1061, "hit": 41.24, "psr": 0.123, "bh_sharpe": 1.3445, "bh_return_pct": 12.41, "excess_sharpe": -2.7842, "precision": 0.0, "recall": 0.0, "f1": 0.0, "f2": 0.0, "mcc": -0.0881, "accuracy": 0.4157, "tp": 0, "fp": 1, "tn": 74, "fn": 103}, {"fold": "fold_4", "regime": "China devaluation and oil crash", "n": 157, "A_sharpe": -0.2616, "A_sortino": -0.2591, "A_excess_sharpe": -0.2714, "A_return_pct": -4.25, "A_hit_rate": 48.72, "A_n": 157, "A_bh_sharpe": 0.0098, "A_bh_return_pct": -1.05, "A_psr": 0.4185, "A_ic": 0.1571, "A_precision": 0.5455, "A_recall": 0.0741, "A_f1": 0.1304, "A_f2": 0.0896, "A_accuracy": 0.4904, "A_mcc": 0.0162, "A_tp": 6, "A_fp": 5, "A_tn": 71, "A_fn": 75, "B_sharpe": 0.9867, "B_sortino": 0.9278, "B_excess_sharpe": 0.9707, "B_return_pct": 23.29, "B_hit_rate": 56.69, "B_n": 157, "B_bh_sharpe": 0.0159, "B_bh_return_pct": -5.48, "B_psr": 0.7797, "B_ic": 0.0733, "B_precision": 0.568, "B_recall": 0.8353, "B_f1": 0.6762, "B_f2": 0.7634, "B_accuracy": 0.5669, "B_mcc": 0.1055, "B_tp": 71, "B_fp": 54, "B_tn": 18, "B_fn": 14, "D_sharpe": -0.2616, "D_sortino": -0.2591, "D_excess_sharpe": -0.2714, "D_return_pct": -4.25, "D_hit_rate": 48.72, "D_n": 157, "D_bh_sharpe": 0.0098, "D_bh_return_pct": -1.05, "D_psr": 0.4185, "D_ic": 0.1571, "D_precision": 0.5455, "D_recall": 0.0741, "D_f1": 0.1304, "D_f2": 0.0896, "D_accuracy": 0.4904, "D_mcc": 0.0162, "D_tp": 6, "D_fp": 5, "D_tn": 71, "D_fn": 75, "sharpe": -0.2616, "sortino": -0.2591, "return_pct": -4.25, "equity": 957.5, "max_dd": 0.0, "win_rate": 48.72, "profit_factor": 0.0, "ic": 0.1571, "hit": 48.72, "psr": 0.4185, "bh_sharpe": 0.0098, "bh_return_pct": -1.05, "excess_sharpe": -0.2714, "precision": 0.5455, "recall": 0.0741, "f1": 0.1304, "f2": 0.0896, "mcc": 0.0162, "accuracy": 0.4904, "tp": 6, "fp": 5, "tn": 71, "fn": 75}, {"fold": "fold_5", "regime": "2018 Vol-mageddon + Q4 sell-off", "n": 177, "A_sharpe": 0.707, "A_sortino": 0.8783, "A_excess_sharpe": 0.3972, "A_return_pct": 10.05, "A_hit_rate": 43.5, "A_n": 177, "A_bh_sharpe": 0.3098, "A_bh_return_pct": 3.19, "A_psr": 0.7261, "A_ic": 0.1316, "A_precision": 0.5882, "A_recall": 0.0971, "A_f1": 0.1667, "A_f2": 0.1166, "A_accuracy": 0.435, "A_mcc": 0.0042, "A_tp": 10, "A_fp": 7, "A_tn": 67, "A_fn": 93, "B_sharpe": 1.3337, "B_sortino": 1.1721, "B_excess_sharpe": 0.4421, "B_return_pct": 42.9, "B_hit_rate": 61.36, "B_n": 177, "B_bh_sharpe": 0.8917, "B_bh_return_pct": 23.8, "B_psr": 0.8639, "B_ic": 0.0704, "B_precision": 0.6454, "B_recall": 0.8349, "B_f1": 0.728, "B_f2": 0.7886, "B_accuracy": 0.6158, "B_mcc": 0.1203, "B_tp": 91, "B_fp": 50, "B_tn": 18, "B_fn": 18, "D_sharpe": 0.707, "D_sortino": 0.8783, "D_excess_sharpe": 0.3972, "D_return_pct": 10.05, "D_hit_rate": 43.5, "D_n": 177, "D_bh_sharpe": 0.3098, "D_bh_return_pct": 3.19, "D_psr": 0.7261, "D_ic": 0.1316, "D_precision": 0.5882, "D_recall": 0.0971, "D_f1": 0.1667, "D_f2": 0.1166, "D_accuracy": 0.435, "D_mcc": 0.0042, "D_tp": 10, "D_fp": 7, "D_tn": 67, "D_fn": 93, "sharpe": 0.707, "sortino": 0.8783, "return_pct": 10.05, "equity": 1100.5, "max_dd": 0.0, "win_rate": 43.5, "profit_factor": 0.0, "ic": 0.1316, "hit": 43.5, "psr": 0.7261, "bh_sharpe": 0.3098, "bh_return_pct": 3.19, "excess_sharpe": 0.3972, "precision": 0.5882, "recall": 0.0971, "f1": 0.1667, "f2": 0.1166, "mcc": 0.0042, "accuracy": 0.435, "tp": 10, "fp": 7, "tn": 67, "fn": 93}, {"fold": "fold_6", "regime": "COVID crash and V-recovery", "n": 222, "A_sharpe": 0.8998, "A_sortino": 1.181, "A_excess_sharpe": 0.011, "A_return_pct": 26.85, "A_hit_rate": 42.79, "A_n": 222, "A_bh_sharpe": 0.8888, "A_bh_return_pct": 26.13, "A_psr": 0.8081, "A_ic": 0.1417, "A_precision": 0.6279, "A_recall": 0.1957, "A_f1": 0.2983, "A_f2": 0.2269, "A_accuracy": 0.4279, "A_mcc": 0.0064, "A_tp": 27, "A_fp": 16, "A_tn": 68, "A_fn": 111, "B_sharpe": 1.9059, "B_sortino": 2.038, "B_excess_sharpe": -0.4825, "B_return_pct": 158.53, "B_hit_rate": 52.94, "B_n": 222, "B_bh_sharpe": 2.3884, "B_bh_return_pct": 243.18, "B_psr": 0.9617, "B_ic": 0.0448, "B_precision": 0.6176, "B_recall": 0.6131, "B_f1": 0.6154, "B_f2": 0.614, "B_accuracy": 0.527, "B_mcc": 0.0014, "B_tp": 84, "B_fp": 52, "B_tn": 33, "B_fn": 53, "D_sharpe": 0.8998, "D_sortino": 1.181, "D_excess_sharpe": 0.011, "D_return_pct": 26.85, "D_hit_rate": 42.79, "D_n": 222, "D_bh_sharpe": 0.8888, "D_bh_return_pct": 26.13, "D_psr": 0.8081, "D_ic": 0.1417, "D_precision": 0.6279, "D_recall": 0.1957, "D_f1": 0.2983, "D_f2": 0.2269, "D_accuracy": 0.4279, "D_mcc": 0.0064, "D_tp": 27, "D_fp": 16, "D_tn": 68, "D_fn": 111, "sharpe": 0.8998, "sortino": 1.181, "return_pct": 26.85, "equity": 1268.5, "max_dd": 0.0, "win_rate": 42.79, "profit_factor": 0.0, "ic": 0.1417, "hit": 42.79, "psr": 0.8081, "bh_sharpe": 0.8888, "bh_return_pct": 26.13, "excess_sharpe": 0.011, "precision": 0.6279, "recall": 0.1957, "f1": 0.2983, "f2": 0.2269, "mcc": 0.0064, "accuracy": 0.4279, "tp": 27, "fp": 16, "tn": 68, "fn": 111}, {"fold": "fold_7", "regime": "Inflation bear, AI rally and 2025", "n": 425, "A_sharpe": -0.4686, "A_sortino": -0.4966, "A_excess_sharpe": -1.4401, "A_return_pct": -19.02, "A_hit_rate": 49.65, "A_n": 425, "A_bh_sharpe": 0.9715, "A_bh_return_pct": 37.12, "A_psr": 0.2757, "A_ic": -0.053, "A_precision": 0.5928, "A_recall": 0.46, "A_f1": 0.518, "A_f2": 0.4816, "A_accuracy": 0.4965, "A_mcc": 0.0085, "A_tp": 115, "A_fp": 79, "A_tn": 96, "A_fn": 135, "B_sharpe": 1.9022, "B_sortino": 1.8628, "B_excess_sharpe": -0.6005, "B_return_pct": 257.77, "B_hit_rate": 58.73, "B_n": 425, "B_bh_sharpe": 2.5027, "B_bh_return_pct": 458.83, "B_psr": 0.9932, "B_ic": 0.0551, "B_precision": 0.6364, "B_recall": 0.7719, "B_f1": 0.6976, "B_f2": 0.7403, "B_accuracy": 0.5859, "B_mcc": 0.0627, "B_tp": 203, "B_fp": 116, "B_tn": 46, "B_fn": 60, "D_sharpe": -0.4686, "D_sortino": -0.4966, "D_excess_sharpe": -1.4401, "D_return_pct": -19.02, "D_hit_rate": 49.65, "D_n": 425, "D_bh_sharpe": 0.9715, "D_bh_return_pct": 37.12, "D_psr": 0.2757, "D_ic": -0.053, "D_precision": 0.5928, "D_recall": 0.46, "D_f1": 0.518, "D_f2": 0.4816, "D_accuracy": 0.4965, "D_mcc": 0.0085, "D_tp": 115, "D_fp": 79, "D_tn": 96, "D_fn": 135, "sharpe": -0.4686, "sortino": -0.4966, "return_pct": -19.02, "equity": 809.8, "max_dd": 0.0, "win_rate": 49.65, "profit_factor": 0.0, "ic": -0.053, "hit": 49.65, "psr": 0.2757, "bh_sharpe": 0.9715, "bh_return_pct": 37.12, "excess_sharpe": -1.4401, "precision": 0.5928, "recall": 0.46, "f1": 0.518, "f2": 0.4816, "mcc": 0.0085, "accuracy": 0.4965, "tp": 115, "fp": 79, "tn": 96, "fn": 135}], "per_window_val": [{"fold": "fold_1", "regime": "GFC peak crash (Lehman + Mar-2009 bottom)", "n": 104, "A_sharpe": 0.9514, "A_sortino": 1.14, "A_excess_sharpe": 1.1186, "A_return_pct": 10.33, "A_hit_rate": 49.02, "A_n": 104, "A_bh_sharpe": -0.1672, "A_bh_return_pct": -3.81, "A_psr": 0.7347, "A_ic": -0.0108, "A_precision": 0.55, "A_recall": 0.2037, "A_f1": 0.2973, "A_f2": 0.2331, "A_accuracy": 0.5, "A_mcc": 0.03, "A_tp": 11, "A_fp": 9, "A_tn": 41, "A_fn": 43, "B_sharpe": -0.8296, "B_sortino": -0.7595, "B_excess_sharpe": 1.4445, "B_return_pct": -22.47, "B_hit_rate": 50.49, "B_n": 104, "B_bh_sharpe": -2.2741, "B_bh_return_pct": -44.12, "B_psr": 0.2968, "B_ic": -0.0478, "B_precision": 0.5135, "B_recall": 0.3654, "B_f1": 0.427, "B_f2": 0.3878, "B_accuracy": 0.5096, "B_mcc": 0.0201, "B_tp": 19, "B_fp": 18, "B_tn": 34, "B_fn": 33, "D_sharpe": 0.9514, "D_sortino": 1.14, "D_excess_sharpe": 1.1186, "D_return_pct": 10.33, "D_hit_rate": 49.02, "D_n": 104, "D_bh_sharpe": -0.1672, "D_bh_return_pct": -3.81, "D_psr": 0.7347, "D_ic": -0.0108, "D_precision": 0.55, "D_recall": 0.2037, "D_f1": 0.2973, "D_f2": 0.2331, "D_accuracy": 0.5, "D_mcc": 0.03, "D_tp": 11, "D_fp": 9, "D_tn": 41, "D_fn": 43, "sharpe": 0.9514, "sortino": 1.14, "return_pct": 10.33, "equity": 1103.3, "max_dd": 0.0, "win_rate": 49.02, "profit_factor": 0.0, "ic": -0.0108, "hit": 49.02, "psr": 0.7347, "bh_sharpe": -0.1672, "bh_return_pct": -3.81, "excess_sharpe": 1.1186, "precision": 0.55, "recall": 0.2037, "f1": 0.2973, "f2": 0.2331, "mcc": 0.03, "accuracy": 0.5, "tp": 11, "fp": 9, "tn": 41, "fn": 43}, {"fold": "fold_2", "regime": "2011 US-downgrade + EU debt", "n": 96, "A_sharpe": 0.8029, "A_sortino": 0.9597, "A_excess_sharpe": 1.0771, "A_return_pct": 7.07, "A_hit_rate": 47.37, "A_n": 96, "A_bh_sharpe": -0.2741, "A_bh_return_pct": -4.09, "A_psr": 0.6922, "A_ic": -0.0122, "A_precision": 0.5, "A_recall": 0.1, "A_f1": 0.1667, "A_f2": 0.119, "A_accuracy": 0.4792, "A_mcc": -0.0142, "A_tp": 5, "A_fp": 5, "A_tn": 41, "A_fn": 45, "B_sharpe": 2.3238, "B_sortino": 3.1384, "B_excess_sharpe": 3.3513, "B_return_pct": 56.74, "B_hit_rate": 47.92, "B_n": 96, "B_bh_sharpe": -1.0274, "B_bh_return_pct": -25.58, "B_psr": 0.9349, "B_ic": 0.0025, "B_precision": 0.4364, "B_recall": 0.5581, "B_f1": 0.4898, "B_f2": 0.5286, "B_accuracy": 0.4792, "B_mcc": -0.0269, "B_tp": 24, "B_fp": 31, "B_tn": 22, "B_fn": 19, "D_sharpe": 0.8029, "D_sortino": 0.9597, "D_excess_sharpe": 1.0771, "D_return_pct": 7.07, "D_hit_rate": 47.37, "D_n": 96, "D_bh_sharpe": -0.2741, "D_bh_return_pct": -4.09, "D_psr": 0.6922, "D_ic": -0.0122, "D_precision": 0.5, "D_recall": 0.1, "D_f1": 0.1667, "D_f2": 0.119, "D_accuracy": 0.4792, "D_mcc": -0.0142, "D_tp": 5, "D_fp": 5, "D_tn": 41, "D_fn": 45, "sharpe": 0.8029, "sortino": 0.9597, "return_pct": 7.07, "equity": 1070.7, "max_dd": 0.0, "win_rate": 47.37, "profit_factor": 0.0, "ic": -0.0122, "hit": 47.37, "psr": 0.6922, "bh_sharpe": -0.2741, "bh_return_pct": -4.09, "excess_sharpe": 1.0771, "precision": 0.5, "recall": 0.1, "f1": 0.1667, "f2": 0.119, "mcc": -0.0142, "accuracy": 0.4792, "tp": 5, "fp": 5, "tn": 41, "fn": 45}, {"fold": "fold_3", "regime": "Taper tantrum and 2014 H1", "n": 54, "A_sharpe": -4.6998, "A_sortino": -4.264, "A_excess_sharpe": -9.3995, "A_return_pct": -9.68, "A_hit_rate": 38.89, "A_n": 54, "A_bh_sharpe": 4.6998, "A_bh_return_pct": 10.46, "A_psr": 0.0221, "A_ic": -0.1492, "A_precision": 0.0, "A_recall": 0.0, "A_f1": 0.0, "A_f2": 0.0, "A_accuracy": 0.3889, "A_mcc": 0.0, "A_tp": 0, "A_fp": 0, "A_tn": 21, "A_fn": 33, "B_sharpe": 7.3092, "B_sortino": 8.8326, "B_excess_sharpe": -1.7233, "B_return_pct": 40.12, "B_hit_rate": 66.67, "B_n": 54, "B_bh_sharpe": 9.0326, "B_bh_return_pct": 49.18, "B_psr": 0.9995, "B_ic": -0.0825, "B_precision": 0.6792, "B_recall": 0.973, "B_f1": 0.8, "B_f2": 0.8955, "B_accuracy": 0.6667, "B_mcc": -0.0931, "B_tp": 36, "B_fp": 17, "B_tn": 0, "B_fn": 1, "D_sharpe": -4.6998, "D_sortino": -4.264, "D_excess_sharpe": -9.3995, "D_return_pct": -9.68, "D_hit_rate": 38.89, "D_n": 54, "D_bh_sharpe": 4.6998, "D_bh_return_pct": 10.46, "D_psr": 0.0221, "D_ic": -0.1492, "D_precision": 0.0, "D_recall": 0.0, "D_f1": 0.0, "D_f2": 0.0, "D_accuracy": 0.3889, "D_mcc": 0.0, "D_tp": 0, "D_fp": 0, "D_tn": 21, "D_fn": 33, "sharpe": -4.6998, "sortino": -4.264, "return_pct": -9.68, "equity": 903.2, "max_dd": 0.0, "win_rate": 38.89, "profit_factor": 0.0, "ic": -0.1492, "hit": 38.89, "psr": 0.0221, "bh_sharpe": 4.6998, "bh_return_pct": 10.46, "excess_sharpe": -9.3995, "precision": 0.0, "recall": 0.0, "f1": 0.0, "f2": 0.0, "mcc": 0.0, "accuracy": 0.3889, "tp": 0, "fp": 0, "tn": 21, "fn": 33}, {"fold": "fold_4", "regime": "China devaluation and oil crash", "n": 96, "A_sharpe": 0.4112, "A_sortino": 0.4575, "A_excess_sharpe": 0.8353, "A_return_pct": 2.33, "A_hit_rate": 50.53, "A_n": 96, "A_bh_sharpe": -0.4241, "A_bh_return_pct": -3.73, "A_psr": 0.6007, "A_ic": -0.0582, "A_precision": 0.25, "A_recall": 0.0222, "A_f1": 0.0408, "A_f2": 0.0272, "A_accuracy": 0.5104, "A_mcc": -0.0914, "A_tp": 1, "A_fp": 3, "A_tn": 48, "A_fn": 44, "B_sharpe": 1.1283, "B_sortino": 1.1553, "B_excess_sharpe": 2.3125, "B_return_pct": 16.64, "B_hit_rate": 53.12, "B_n": 96, "B_bh_sharpe": -1.1843, "B_bh_return_pct": -21.44, "B_psr": 0.7551, "B_ic": 0.0429, "B_precision": 0.5065, "B_recall": 0.8478, "B_f1": 0.6341, "B_f2": 0.7471, "B_accuracy": 0.5312, "B_mcc": 0.1101, "B_tp": 39, "B_fp": 38, "B_tn": 12, "B_fn": 7, "D_sharpe": 0.4112, "D_sortino": 0.4575, "D_excess_sharpe": 0.8353, "D_return_pct": 2.33, "D_hit_rate": 50.53, "D_n": 96, "D_bh_sharpe": -0.4241, "D_bh_return_pct": -3.73, "D_psr": 0.6007, "D_ic": -0.0582, "D_precision": 0.25, "D_recall": 0.0222, "D_f1": 0.0408, "D_f2": 0.0272, "D_accuracy": 0.5104, "D_mcc": -0.0914, "D_tp": 1, "D_fp": 3, "D_tn": 48, "D_fn": 44, "sharpe": 0.4112, "sortino": 0.4575, "return_pct": 2.33, "equity": 1023.3000000000001, "max_dd": 0.0, "win_rate": 50.53, "profit_factor": 0.0, "ic": -0.0582, "hit": 50.53, "psr": 0.6007, "bh_sharpe": -0.4241, "bh_return_pct": -3.73, "excess_sharpe": 0.8353, "precision": 0.25, "recall": 0.0222, "f1": 0.0408, "f2": 0.0272, "mcc": -0.0914, "accuracy": 0.5104, "tp": 1, "fp": 3, "tn": 48, "fn": 44}, {"fold": "fold_5", "regime": "2018 Vol-mageddon + Q4 sell-off", "n": 54, "A_sharpe": 0.1104, "A_sortino": 0.1226, "A_excess_sharpe": -1.3175, "A_return_pct": 0.13, "A_hit_rate": 46.3, "A_n": 54, "A_bh_sharpe": 1.428, "A_bh_return_pct": 3.97, "A_psr": 0.5202, "A_ic": 0.0523, "A_precision": 0.5, "A_recall": 0.069, "A_f1": 0.1212, "A_f2": 0.0833, "A_accuracy": 0.463, "A_mcc": -0.021, "A_tp": 2, "A_fp": 2, "A_tn": 23, "A_fn": 27, "B_sharpe": -0.1785, "B_sortino": -0.1458, "B_excess_sharpe": -5.1107, "B_return_pct": -2.16, "B_hit_rate": 61.11, "B_n": 54, "B_bh_sharpe": 4.9322, "B_bh_return_pct": 34.93, "B_psr": 0.4673, "B_ic": -0.1803, "B_precision": 0.6905, "B_recall": 0.7838, "B_f1": 0.7342, "B_f2": 0.7632, "B_accuracy": 0.6111, "B_mcc": 0.0213, "B_tp": 29, "B_fp": 13, "B_tn": 4, "B_fn": 8, "D_sharpe": 0.1104, "D_sortino": 0.1226, "D_excess_sharpe": -1.3175, "D_return_pct": 0.13, "D_hit_rate": 46.3, "D_n": 54, "D_bh_sharpe": 1.428, "D_bh_return_pct": 3.97, "D_psr": 0.5202, "D_ic": 0.0523, "D_precision": 0.5, "D_recall": 0.069, "D_f1": 0.1212, "D_f2": 0.0833, "D_accuracy": 0.463, "D_mcc": -0.021, "D_tp": 2, "D_fp": 2, "D_tn": 23, "D_fn": 27, "sharpe": 0.1104, "sortino": 0.1226, "return_pct": 0.13, "equity": 1001.3000000000001, "max_dd": 0.0, "win_rate": 46.3, "profit_factor": 0.0, "ic": 0.0523, "hit": 46.3, "psr": 0.5202, "bh_sharpe": 1.428, "bh_return_pct": 3.97, "excess_sharpe": -1.3175, "precision": 0.5, "recall": 0.069, "f1": 0.1212, "f2": 0.0833, "mcc": -0.021, "accuracy": 0.463, "tp": 2, "fp": 2, "tn": 23, "fn": 27}, {"fold": "fold_6", "regime": "COVID crash and V-recovery", "n": 75, "A_sharpe": -3.5408, "A_sortino": -3.5979, "A_excess_sharpe": -7.8402, "A_return_pct": -11.08, "A_hit_rate": 34.67, "A_n": 75, "A_bh_sharpe": 4.2994, "A_bh_return_pct": 14.68, "A_psr": 0.035, "A_ic": 0.1388, "A_precision": 1.0, "A_recall": 0.0392, "A_f1": 0.0755, "A_f2": 0.0485, "A_accuracy": 0.3467, "A_mcc": 0.1135, "A_tp": 2, "A_fp": 0, "A_tn": 24, "A_fn": 49, "B_sharpe": 7.1365, "B_sortino": 6.7111, "B_excess_sharpe": -7.1975, "B_return_pct": 61.46, "B_hit_rate": 72.0, "B_n": 75, "B_bh_sharpe": 14.3339, "B_bh_return_pct": 120.13, "B_psr": 0.9997, "B_ic": 0.1478, "B_precision": 0.8621, "B_recall": 0.7937, "B_f1": 0.8264, "B_f2": 0.8065, "B_accuracy": 0.72, "B_mcc": 0.1112, "B_tp": 50, "B_fp": 8, "B_tn": 4, "B_fn": 13, "D_sharpe": -3.5408, "D_sortino": -3.5979, "D_excess_sharpe": -7.8402, "D_return_pct": -11.08, "D_hit_rate": 34.67, "D_n": 75, "D_bh_sharpe": 4.2994, "D_bh_return_pct": 14.68, "D_psr": 0.035, "D_ic": 0.1388, "D_precision": 1.0, "D_recall": 0.0392, "D_f1": 0.0755, "D_f2": 0.0485, "D_accuracy": 0.3467, "D_mcc": 0.1135, "D_tp": 2, "D_fp": 0, "D_tn": 24, "D_fn": 49, "sharpe": -3.5408, "sortino": -3.5979, "return_pct": -11.08, "equity": 889.2, "max_dd": 0.0, "win_rate": 34.67, "profit_factor": 0.0, "ic": 0.1388, "hit": 34.67, "psr": 0.035, "bh_sharpe": 4.2994, "bh_return_pct": 14.68, "excess_sharpe": -7.8402, "precision": 1.0, "recall": 0.0392, "f1": 0.0755, "f2": 0.0485, "mcc": 0.1135, "accuracy": 0.3467, "tp": 2, "fp": 0, "tn": 24, "fn": 49}, {"fold": "fold_7", "regime": "Inflation bear, AI rally and 2025", "n": 114, "A_sharpe": 0.7667, "A_sortino": 0.8211, "A_excess_sharpe": -2.0783, "A_return_pct": 5.01, "A_hit_rate": 48.25, "A_n": 114, "A_bh_sharpe": 2.845, "A_bh_return_pct": 21.34, "A_psr": 0.6961, "A_ic": 0.0407, "A_precision": 0.5556, "A_recall": 0.597, "A_f1": 0.5755, "A_f2": 0.5882, "A_accuracy": 0.4825, "A_mcc": -0.0856, "A_tp": 40, "A_fp": 32, "A_tn": 15, "A_fn": 27, "B_sharpe": 3.1875, "B_sortino": 2.9634, "B_excess_sharpe": -2.9491, "B_return_pct": 64.31, "B_hit_rate": 63.16, "B_n": 114, "B_bh_sharpe