{"experiment_num": 26, "backbone": "lstm", "description": "LSTM @ FX-Exp35 seq_len 10 -> 60 (equity-window hill-climb on positive-excess anchor); Fischer-Krauss 2018 seq=240 prior; Lim-Zohren-Roberts 2019 quarterly window; Hochreiter-Schmidhuber 1997 LSTM", "config": {"seq_len": 60, "lr": 0.001, "batch_size": 16, "epochs": 100, "weight_decay": 0.0007, "patience": 15, "warmup_epochs": 0, "head_dropout": 0.1, "huber_delta": 1.0, "grad_clip": 1.0, "seed": 42, "hidden_size": null, "num_layers": null, "max_depth": null, "gbm_lr": null, "n_estimators": null}, "composite": -0.0992, "test_pos_folds": 4, "val_pos_folds": 4, "val_loss": -2.8616967370024824, "elapsed_sec": 69.9, "timestamp": "2026-04-27T16:30:14", "sharpe": 0.2008, "val_sharpe": 0.3373, "ic": 0.0192, "hit": 51.09, "psr": 0.6601, "equity": 1087.3999999999999, "return_pct": 8.74, "bh_sharpe": 1.2201, "bh_return_pct": 185.59, "excess_sharpe": -1.0193, "B_sharpe": -0.3667, "B_excess_sharpe": -3.2051, "B_return_pct": -69.15, "D_sharpe": 0.2008, "D_excess_sharpe": -1.0193, "D_return_pct": 8.74, "per_window": [{"fold": "fold_1", "regime": "GFC peak crash (Lehman + Mar-2009 bottom)", "n": 65, "A_sharpe": 0.8817, "A_sortino": 0.9757, "A_excess_sharpe": 0.4555, "A_return_pct": 6.95, "A_hit_rate": 46.15, "A_n": 65, "A_bh_sharpe": 0.4262, "A_bh_return_pct": 2.34, "A_psr": 0.6719, "A_ic": 0.0503, "B_sharpe": -1.659, "B_sortino": -1.6737, "B_excess_sharpe": -3.5467, "B_return_pct": -33.21, "B_hit_rate": 43.75, "B_n": 65, "B_bh_sharpe": 1.8877, "B_bh_return_pct": 34.48, "B_psr": 0.2044, "B_ic": -0.0233, "D_sharpe": 0.8817, "D_sortino": 0.9757, "D_excess_sharpe": 0.4555, "D_return_pct": 6.95, "D_hit_rate": 46.15, "D_n": 65, "D_bh_sharpe": 0.4262, "D_bh_return_pct": 2.34, "D_psr": 0.6719, "D_ic": 0.0503, "sharpe": 0.8817, "sortino": 0.9757, "return_pct": 6.95, "equity": 1069.5000000000002, "max_dd": 0.0, "win_rate": 46.15, "profit_factor": 0.0, "ic": 0.0503, "hit": 46.15, "psr": 0.6719, "bh_sharpe": 0.4262, "bh_return_pct": 2.34, "excess_sharpe": 0.4555, "precision": 0.4762, "recall": 0.2941, "f1": 0.3636, "f2": 0.3185, "accuracy": 0.4615, "mcc": -0.0649, "tp": 10, "fp": 11, "tn": 20, "fn": 24, "A_precision": 0.4762, "A_recall": 0.2941, "A_f1": 0.3636, "A_f2": 0.3185, "A_accuracy": 0.4615, "A_mcc": -0.0649, "A_tp": 10, "A_fp": 11, "A_tn": 20, "A_fn": 24}, {"fold": "fold_2", "regime": "2011 US-downgrade + EU debt", "n": 86, "A_sharpe": 2.3583, "A_sortino": 3.0213, "A_excess_sharpe": -2.5099, "A_return_pct": 12.89, "A_hit_rate": 51.76, "A_n": 86, "A_bh_sharpe": 4.8682, "A_bh_return_pct": 27.91, "A_psr": 0.9287, "A_ic": 0.0415, "B_sharpe": -1.975, "B_sortino": -2.1189, "B_excess_sharpe": -13.2941, "B_return_pct": -21.97, "B_hit_rate": 39.53, "B_n": 86, "B_bh_sharpe": 11.3191, "B_bh_return_pct": 186.84, "B_psr": 0.1349, "B_ic": 0.0859, "D_sharpe": 2.3583, "D_sortino": 3.0213, "D_excess_sharpe": -2.5099, "D_return_pct": 12.89, "D_hit_rate": 51.76, "D_n": 86, "D_bh_sharpe": 4.8682, "D_bh_return_pct": 27.91, "D_psr": 0.9287, "D_ic": 0.0415, "sharpe": 2.3583, "sortino": 3.0213, "return_pct": 12.89, "equity": 1128.9, "max_dd": 0.0, "win_rate": 51.76, "profit_factor": 0.0, "ic": 0.0415, "hit": 51.76, "psr": 0.9287, "bh_sharpe": 4.8682, "bh_return_pct": 27.91, "excess_sharpe": -2.5099, "precision": 0.6341, "recall": 0.4906, "f1": 0.5532, "f2": 0.5138, "accuracy": 0.5116, "mcc": 0.0351, "tp": 26, "fp": 15, "tn": 18, "fn": 27, "A_precision": 0.6341, "A_recall": 0.4906, "A_f1": 0.5532, "A_f2": 0.5138, "A_accuracy": 0.5116, "A_mcc": 0.0351, "A_tp": 26, "A_fp": 15, "A_tn": 18, "A_fn": 27}, {"fold": "fold_3", "regime": "Taper tantrum and 2014 H1", "n": 128, "A_sharpe": 1.583, "A_sortino": 1.4092, "A_excess_sharpe": -0.4759, "A_return_pct": 10.23, "A_hit_rate": 56.69, "A_n": 128, "A_bh_sharpe": 2.0589, "A_bh_return_pct": 13.6, "A_psr": 0.8574, "A_ic": 0.1409, "B_sharpe": 3.0344, "B_sortino": 3.4598, "B_excess_sharpe": -1.4772, "B_return_pct": 42.1, "B_hit_rate": 55.47, "B_n": 128, "B_bh_sharpe": 4.5116, "B_bh_return_pct": 67.92, "B_psr": 0.9848, "B_ic": 0.1187, "D_sharpe": 1.583, "D_sortino": 1.4092, "D_excess_sharpe": -0.4759, "D_return_pct": 10.23, "D_hit_rate": 56.69, "D_n": 128, "D_bh_sharpe": 2.0589, "D_bh_return_pct": 13.6, "D_psr": 0.8574, "D_ic": 0.1409, "sharpe": 1.583, "sortino": 1.4092, "return_pct": 10.23, "equity": 1102.3, "max_dd": 0.0, "win_rate": 56.69, "profit_factor": 0.0, "ic": 0.1409, "hit": 56.69, "psr": 0.8574, "bh_sharpe": 2.0589, "bh_return_pct": 13.6, "excess_sharpe": -0.4759, "precision": 0.6036, "recall": 0.859, "f1": 0.709, "f2": 0.792, "accuracy": 0.5703, "mcc": -0.0302, "tp": 67, "fp": 44, "tn": 6, "fn": 11, "A_precision": 0.6036, "A_recall": 0.859, "A_f1": 0.709, "A_f2": 0.792, "A_accuracy": 0.5703, "A_mcc": -0.0302, "A_tp": 67, "A_fp": 44, "A_tn": 6, "A_fn": 11}, {"fold": "fold_4", "regime": "China devaluation and oil crash", "n": 107, "A_sharpe": -1.224, "A_sortino": -1.0638, "A_excess_sharpe": -0.4208, "A_return_pct": -10.88, "A_hit_rate": 51.89, "A_n": 107, "A_bh_sharpe": -0.8032, "A_bh_return_pct": -7.58, "A_psr": 0.2096, "A_ic": 0.0517, "B_sharpe": 1.9012, "B_sortino": 2.1041, "B_excess_sharpe": 3.8607, "B_return_pct": 36.81, "B_hit_rate": 53.27, "B_n": 107, "B_bh_sharpe": -1.9596, "B_bh_return_pct": -33.47, "B_psr": 0.8949, "B_ic": 0.0477, "D_sharpe": -1.224, "D_sortino": -1.0638, "D_excess_sharpe": -0.4208, "D_return_pct": -10.88, "D_hit_rate": 51.89, "D_n": 107, "D_bh_sharpe": -0.8032, "D_bh_return_pct": -7.58, "D_psr": 0.2096, "D_ic": 0.0517, "sharpe": -1.224, "sortino": -1.0638, "return_pct": -10.88, "equity": 891.2, "max_dd": 0.0, "win_rate": 51.89, "profit_factor": 0.0, "ic": 0.0517, "hit": 51.89, "psr": 0.2096, "bh_sharpe": -0.8032, "bh_return_pct": -7.58, "excess_sharpe": -0.4208, "precision": 0.5, "recall": 0.5962, "f1": 0.5439, "f2": 0.5741, "accuracy": 0.514, "mcc": 0.0329, "tp": 31, "fp": 31, "tn": 24, "fn": 21, "A_precision": 0.5, "A_recall": 0.5962, "A_f1": 0.5439, "A_f2": 0.5741, "A_accuracy": 0.514, "A_mcc": 0.0329, "A_tp": 31, "A_fp": 31, "A_tn": 24, "A_fn": 21}, {"fold": "fold_5", "regime": "2018 Vol-mageddon + Q4 sell-off", "n": 127, "A_sharpe": -0.1803, "A_sortino": -0.1769, "A_excess_sharpe": -1.3633, "A_return_pct": -3.52, "A_hit_rate": 51.97, "A_n": 127, "A_bh_sharpe": 1.183, "A_bh_return_pct": 13.55, "A_psr": 0.4494, "A_ic": 0.0699, "B_sharpe": 0.9008, "B_sortino": 1.0043, "B_excess_sharpe": -2.0048, "B_return_pct": 17.01, "B_hit_rate": 47.62, "B_n": 127, "B_bh_sharpe": 2.9056, "B_bh_return_pct": 85.51, "B_psr": 0.7387, "B_ic": 0.1738, "D_sharpe": -0.1803, "D_sortino": -0.1769, "D_excess_sharpe": -1.3633, "D_return_pct": -3.52, "D_hit_rate": 51.97, "D_n": 127, "D_bh_sharpe": 1.183, "D_bh_return_pct": 13.55, "D_psr": 0.4494, "D_ic": 0.0699, "sharpe": -0.1803, "sortino": -0.1769, "return_pct": -3.52, "equity": 964.8, "max_dd": 0.0, "win_rate": 51.97, "profit_factor": 0.0, "ic": 0.0699, "hit": 51.97, "psr": 0.4494, "bh_sharpe": 1.183, "bh_return_pct": 13.55, "excess_sharpe": -1.3633, "precision": 0.6164, "recall": 0.5769, "f1": 0.596, "f2": 0.5844, "accuracy": 0.5197, "mcc": 0.0054, "tp": 45, "fp": 28, "tn": 21, "fn": 33, "A_precision": 0.6164, "A_recall": 0.5769, "A_f1": 0.596, "A_f2": 0.5844, "A_accuracy": 0.5197, "A_mcc": 0.0054, "A_tp": 45, "A_fp": 28, "A_tn": 21, "A_fn": 33}, {"fold": "fold_6", "regime": "COVID crash and V-recovery", "n": 172, "A_sharpe": -0.3415, "A_sortino": -0.3895, "A_excess_sharpe": -2.7691, "A_return_pct": -7.38, "A_hit_rate": 42.44, "A_n": 172, "A_bh_sharpe": 2.4276, "A_bh_return_pct": 45.89, "A_psr": 0.3898, "A_ic": -0.0014, "B_sharpe": -1.1327, "B_sortino": -1.2864, "B_excess_sharpe": -6.8447, "B_return_pct": -38.0, "B_hit_rate": 42.11, "B_n": 172, "B_bh_sharpe": 5.712, "B_bh_return_pct": 489.18, "B_psr": 0.1821, "B_ic": 0.0477, "D_sharpe": -0.3415, "D_sortino": -0.3895, "D_excess_sharpe": -2.7691, "D_return_pct": -7.38, "D_hit_rate": 42.44, "D_n": 172, "D_bh_sharpe": 2.4276, "D_bh_return_pct": 45.89, "D_psr": 0.3898, "D_ic": -0.0014, "sharpe": -0.3415, "sortino": -0.3895, "return_pct": -7.38, "equity": 926.2, "max_dd": 0.0, "win_rate": 42.44, "profit_factor": 0.0, "ic": -0.0014, "hit": 42.44, "psr": 0.3898, "bh_sharpe": 2.4276, "bh_return_pct": 45.89, "excess_sharpe": -2.7691, "precision": 0.5972, "recall": 0.3805, "f1": 0.4649, "f2": 0.4103, "accuracy": 0.4244, "mcc": -0.1068, "tp": 43, "fp": 29, "tn": 30, "fn": 70, "A_precision": 0.5972, "A_recall": 0.3805, "A_f1": 0.4649, "A_f2": 0.4103, "A_accuracy": 0.4244, "A_mcc": -0.1068, "A_tp": 43, "A_fp": 29, "A_tn": 30, "A_fn": 70}, {"fold": "fold_7", "regime": "Inflation bear, AI rally and 2025", "n": 375, "A_sharpe": 0.1883, "A_sortino": 0.1832, "A_excess_sharpe": -0.6022, "A_return_pct": 2.59, "A_hit_rate": 53.33, "A_n": 375, "A_bh_sharpe": 0.7905, "A_bh_return_pct": 25.44, "A_psr": 0.5911, "A_ic": 0.0145, "B_sharpe": -1.0182, "B_sortino": -0.9515, "B_excess_sharpe": -2.952, "B_return_pct": -58.03, "B_hit_rate": 48.66, "B_n": 375, "B_bh_sharpe": 1.9338, "B_bh_return_pct": 221.94, "B_psr": 0.1052, "B_ic": -0.0517, "D_sharpe": 0.1883, "D_sortino": 0.1832, "D_excess_sharpe": -0.6022, "D_return_pct": 2.59, "D_hit_rate": 53.33, "D_n": 375, "D_bh_sharpe": 0.7905, "D_bh_return_pct": 25.44, "D_psr": 0.5911, "D_ic": 0.0145, "sharpe": 0.1883, "sortino": 0.1832, "return_pct": 2.59, "equity": 1025.9, "max_dd": 0.0, "win_rate": 53.33, "profit_factor": 0.0, "ic": 0.0145, "hit": 53.33, "psr": 0.5911, "bh_sharpe": 0.7905, "bh_return_pct": 25.44, "excess_sharpe": -0.6022, "precision": 0.5849, "recall": 0.7045, "f1": 0.6392, "f2": 0.6769, "accuracy": 0.5333, "mcc": -0.0056, "tp": 155, "fp": 110, "tn": 45, "fn": 65, "A_precision": 0.5849, "A_recall": 0.7045, "A_f1": 0.6392, "A_f2": 0.6769, "A_accuracy": 0.5333, "A_mcc": -0.0056, "A_tp": 155, "A_fp": 110, "A_tn": 45, "A_fn": 65}], "per_window_val": [{"fold": "fold_1", "regime": "GFC peak crash (Lehman + Mar-2009 bottom)", "n": 37, "A_sharpe": 3.3976, "A_sortino": 3.8472, "A_excess_sharpe": 2.6391, "A_return_pct": 12.74, "A_hit_rate": 57.14, "A_n": 37, "A_bh_sharpe": 0.7585, "A_bh_return_pct": 2.39, "A_psr": 0.9067, "A_ic": 0.2397, "B_sharpe": 5.4877, "B_sortino": 5.8199, "B_excess_sharpe": 3.3431, "B_return_pct": 34.54, "B_hit_rate": 70.27, "B_n": 37, "B_bh_sharpe": 2.1447, "B_bh_return_pct": 12.13, "B_psr": 0.9855, "B_ic": 0.3338, "D_sharpe": 3.3976, "D_sortino": 3.8472, "D_excess_sharpe": 2.6391, "D_return_pct": 12.74, "D_hit_rate": 57.14, "D_n": 37, "D_bh_sharpe": 0.7585, "D_bh_return_pct": 2.39, "D_psr": 0.9067, "D_ic": 0.2397, "sharpe": 3.3976, "sortino": 3.8472, "return_pct": 12.74, "equity": 1127.3999999999999, "max_dd": 0.0, "win_rate": 57.14, "profit_factor": 0.0, "ic": 0.2397, "hit": 57.14, "psr": 0.9067, "bh_sharpe": 0.7585, "bh_return_pct": 2.39, "excess_sharpe": 2.6391}, {"fold": "fold_2", "regime": "2011 US-downgrade + EU debt", "n": 46, "A_sharpe": 0.6056, "A_sortino": 0.5823, "A_excess_sharpe": 0.6595, "A_return_pct": 2.78, "A_hit_rate": 52.17, "A_n": 46, "A_bh_sharpe": -0.0539, "A_bh_return_pct": -1.46, "A_psr": 0.6002, "A_ic": -0.0512, "B_sharpe": -1.0926, "B_sortino": -1.1441, "B_excess_sharpe": 0.4486, "B_return_pct": -18.39, "B_hit_rate": 43.48, "B_n": 46, "B_bh_sharpe": -1.5413, "B_bh_return_pct": -23.36, "B_psr": 0.3237, "B_ic": 0.1557, "D_sharpe": 0.6056, "D_sortino": 0.5823, "D_excess_sharpe": 0.6595, "D_return_pct": 2.78, "D_hit_rate": 52.17, "D_n": 46, "D_bh_sharpe": -0.0539, "D_bh_return_pct": -1.46, "D_psr": 0.6002, "D_ic": -0.0512, "sharpe": 0.6056, "sortino": 0.5823, "return_pct": 2.78, "equity": 1027.8, "max_dd": 0.0, "win_rate": 52.17, "profit_factor": 0.0, "ic": -0.0512, "hit": 52.17, "psr": 0.6002, "bh_sharpe": -0.0539, "bh_return_pct": -1.46, "excess_sharpe": 0.6595}, {"fold": "fold_3", "regime": "Taper tantrum and 2014 H1", "n": 4, "A_sharpe": 6.3226, "A_sortino": 11.1859, "A_excess_sharpe": 0.0, "A_return_pct": 0.58, "A_hit_rate": 50.0, "A_n": 4, "A_bh_sharpe": 6.3226, "A_bh_return_pct": 0.58, "A_psr": 0.773, "A_ic": 0.4, "B_sharpe": 23.4413, "B_sortino": 0.0, "B_excess_sharpe": 46.8826, "B_return_pct": 3.19, "B_hit_rate": 100.0, "B_n": 4, "B_bh_sharpe": -23.4413, "B_bh_return_pct": -3.13, "B_psr": 1.0, "B_ic": 0.8, "D_sharpe": 6.3226, "D_sortino": 11.1859, "D_excess_sharpe": 0.0, "D_return_pct": 0.58, "D_hit_rate": 50.0, "D_n": 4, "D_bh_sharpe": 6.3226, "D_bh_return_pct": 0.58, "D_psr": 0.773, "D_ic": 0.4, "sharpe": 6.3226, "sortino": 11.1859, "return_pct": 0.58, "equity": 1005.8000000000001, "max_dd": 0.0, "win_rate": 50.0, "profit_factor": 0.0, "ic": 0.4, "hit": 50.0, "psr": 0.773, "bh_sharpe": 6.3226, "bh_return_pct": 0.58, "excess_sharpe": 0.0}, {"fold": "fold_4", "regime": "China devaluation and oil crash", "n": 46, "A_sharpe": -1.2178, "A_sortino": -1.0726, "A_excess_sharpe": -0.0156, "A_return_pct": -5.75, "A_hit_rate": 52.17, "A_n": 46, "A_bh_sharpe": -1.2022, "A_bh_return_pct": -5.68, "A_psr": 0.3022, "A_ic": 0.1176, "B_sharpe": 0.2179, "B_sortino": 0.1789, "B_excess_sharpe": 2.5297, "B_return_pct": -0.98, "B_hit_rate": 54.35, "B_n": 46, "B_bh_sharpe": -2.3118, "B_bh_return_pct": -24.51, "B_psr": 0.5363, "B_ic": 0.5587, "D_sharpe": -1.2178, "D_sortino": -1.0726, "D_excess_sharpe": -0.0156, "D_return_pct": -5.75, "D_hit_rate": 52.17, "D_n": 46, "D_bh_sharpe": -1.2022, "D_bh_return_pct": -5.68, "D_psr": 0.3022, "D_ic": 0.1176, "sharpe": -1.2178, "sortino": -1.0726, "return_pct": -5.75, "equity": 942.5, "max_dd": 0.0, "win_rate": 52.17, "profit_factor": 0.0, "ic": 0.1176, "hit": 52.17, "psr": 0.3022, "bh_sharpe": -1.2022, "bh_return_pct": -5.68, "excess_sharpe": -0.0156}, {"fold": "fold_5", "regime": "2018 Vol-mageddon + Q4 sell-off", "n": 4, "A_sharpe": -14.7551, "A_sortino": -9.7882, "A_excess_sharpe": 0.0, "A_return_pct": -3.52, "A_hit_rate": 25.0, "A_n": 4, "A_bh_sharpe": -14.7551, "A_bh_return_pct": -3.52, "A_psr": 0.0808, "A_ic": 0.8, "B_sharpe": 20.3467, "B_sortino": 104.8151, "B_excess_sharpe": 18.1901, "B_return_pct": 0.0, "B_hit_rate": 0.0, "B_n": 4, "B_bh_sharpe": 2.1566, "B_bh_return_pct": 1.19, "B_psr": 0.9993, "B_ic": 0.8, "D_sharpe": -14.7551, "D_sortino": -9.7882, "D_excess_sharpe": 0.0, "D_return_pct": -3.52, "D_hit_rate": 25.0, "D_n": 4, "D_bh_sharpe": -14.7551, "D_bh_return_pct": -3.52, "D_psr": 0.0808, "D_ic": 0.8, "sharpe": -14.7551, "sortino": -9.7882, "return_pct": -3.52, "equity": 964.8, "max_dd": 0.0, "win_rate": 25.0, "profit_factor": 0.0, "ic": 0.8, "hit": 25.0, "psr": 0.0808, "bh_sharpe": -14.7551, "bh_return_pct": -3.52, "excess_sharpe": 0.0}, {"fold": "fold_6", "regime": "COVID crash and V-recovery", "n": 25, "A_sharpe": -2.4138, "A_sortino": -2.536, "A_excess_sharpe": -4.8276, "A_return_pct": -3.36, "A_hit_rate": 40.0, "A_n": 25, "A_bh_sharpe": 2.4138, "A_bh_return_pct": 3.27, "A_psr": 0.2373, "A_ic": -0.1815, "B_sharpe": -2.4639, "B_sortino": -2.6963, "B_excess_sharpe": -15.0293, "B_return_pct": -7.26, "B_hit_rate": 36.0, "B_n": 25, "B_bh_sharpe": 12.5655, "B_bh_return_pct": 32.76, "B_psr": 0.2323, "B_ic": 0.5308, "D_sharpe": -2.4138, "D_sortino": -2.536, "D_excess_sharpe": -4.8276, "D_return_pct": -3.36, "D_hit_rate": 40.0, "D_n": 25, "D_bh_sharpe": 2.4138, "D_bh_return_pct": 3.27, "D_psr": 0.2373, "D_ic": -0.1815, "sharpe": -2.4138, "sortino": -2.536, "return_pct": -3.36, "equity": 966.4000000000001, "max_dd": 0.0, "win_rate": 40.0, "profit_factor": 0.0, "ic": -0.1815, "hit": 40.0, "psr": 0.2373, "bh_sharpe": 2.4138, "bh_return_pct": 3.27, "excess_sharpe": -4.8276}, {"fold": "fold_7", "regime": "Inflation bear, AI rally and 2025", "n": 64, "A_sharpe": 0.6561, "A_sortino": 0.7393, "A_excess_sharpe": -1.3847, "A_return_pct": 2.3, "A_hit_rate": 46.88, "A_n": 64, "A_bh_sharpe": 2.0409, "A_bh_return_pct": 7.94, "A_psr": 0.6294, "A_ic": 0.094, "B_sharpe": -0.8298, "B_sortino": -0.7201, "B_excess_sharpe": -6.2389, "B_return_pct": -7.14, "B_hit_rate": 54.69, "B_n": 64, "B_bh_sharpe": 5.4092, "B_bh_return_pct": 45.7, "B_psr": 0.3378, "B_ic": 0.1111, "D_sharpe": 0.6561, "D_sortino": 0.7393, "D_excess_sharpe": -1.3847, "D_return_pct": 2.3, "D_hit_rate": 46.88, "D_n": 64, "D_bh_sharpe": 2.0409, "D_bh_return_pct": 7.94, "D_psr": 0.6294, "D_ic": 0.094, "sharpe": 0.6561, "sortino": 0.7393, "return_pct": 2.3, "equity": 1022.9999999999999, "max_dd": 0.0, "win_rate": 46.88, "profit_factor": 0.0, "ic": 0.094, "hit": 46.88, "psr": 0.6294, "bh_sharpe": 2.0409, "bh_return_pct": 7.94, "excess_sharpe": -1.3847}], "status": "DISCARD", "precision": 0.5845, "recall": 0.6003, "f1": 0.5923, "f2": 0.5971, "accuracy": 0.5104, "mcc": -0.0202, "tp": 377, "fp": 268, "tn": 164, "fn": 251, "test_sharpe": 0.2008, "A_sharpe": 0.2008, "A_excess_sharpe": -1.0193, "A_return_pct": 8.74, "A_precision": 0.5845, "A_recall": 0.6003, "A_f1": 0.5923, "A_f2": 0.5971, "A_accuracy": 0.5104, "A_mcc": -0.0202, "A_tp": 377, "A_fp": 268, "A_tn": 164, "A_fn": 251, "A_psr": 0.6601, "A_ic": 0.0192, "A_hit_rate": 51.09, "A_bh_sharpe": 1.2201, "A_bh_return_pct": 185.59}
