{"experiment_num": 98, "backbone": "catboost", "description": "CatBoost @ exp 18 lr=0.02 n_est=1000 - faster lr per XGBoost finding", "config": {"seq_len": 60, "lr": 0.0003, "batch_size": 32, "epochs": 50, "weight_decay": 1e-05, "patience": 10, "warmup_epochs": 0, "head_dropout": 0.1, "huber_delta": 1.0, "grad_clip": 1.0, "seed": 42, "hidden_size": null, "num_layers": null, "max_depth": 4, "gbm_lr": 0.02, "n_estimators": 1000}, "composite": -0.5596, "test_pos_folds": 3, "val_pos_folds": 3, "val_loss": null, "elapsed_sec": 1316.2, "timestamp": "2026-04-28T00:35:00", "sharpe": -0.1596, "val_sharpe": -0.0533, "ic": 0.0002, "hit": 48.4, "psr": 0.3717, "equity": 771.0, "return_pct": -22.9, "bh_sharpe": 1.2194, "bh_return_pct": 187.05, "excess_sharpe": -1.379, "B_sharpe": -0.5251, "B_excess_sharpe": -3.3533, "B_return_pct": -77.48, "D_sharpe": -0.0097, "D_excess_sharpe": -1.2291, "D_return_pct": -11.0, "precision": 0.5899, "recall": 0.4256, "f1": 0.4945, "f2": 0.4507, "mcc": -0.0042, "accuracy": 0.4845, "val_precision": 0.5145, "val_recall": 0.6794, "val_f1": 0.5855, "val_f2": 0.6385, "val_mcc": 0.0299, "val_accuracy": 0.5154, "per_window": [{"fold": "fold_1", "regime": "GFC peak crash (Lehman + Mar-2009 bottom)", "n": 66, "A_sharpe": -1.8029, "A_sortino": -1.7437, "A_excess_sharpe": -2.375, "A_return_pct": -17.65, "A_hit_rate": 45.45, "A_n": 66, "A_bh_sharpe": 0.5721, "A_bh_return_pct": 3.85, "A_psr": 0.1812, "A_ic": -0.0304, "A_precision": 0.4815, "A_recall": 0.3714, "A_f1": 0.4194, "A_f2": 0.3892, "A_accuracy": 0.4545, "A_mcc": -0.0814, "A_tp": 13, "A_fp": 14, "A_tn": 17, "A_fn": 22, "B_sharpe": 0.5192, "B_sortino": 0.5507, "B_excess_sharpe": -1.5278, "B_return_pct": 2.81, "B_hit_rate": 49.23, "B_n": 66, "B_bh_sharpe": 2.0469, "B_bh_return_pct": 39.28, "B_psr": 0.6042, "B_ic": 0.1426, "B_precision": 0.5278, "B_recall": 0.5278, "B_f1": 0.5278, "B_f2": 0.5278, "B_accuracy": 0.4848, "B_mcc": -0.0389, "B_tp": 19, "B_fp": 17, "B_tn": 13, "B_fn": 17, "D_sharpe": 2.3817, "D_sortino": 2.3228, "D_excess_sharpe": 1.8096, "D_return_pct": 23.7, "D_hit_rate": 59.09, "D_n": 66, "D_bh_sharpe": 0.5721, "D_bh_return_pct": 3.85, "D_psr": 0.883, "D_ic": 0.1591, "D_precision": 0.6111, "D_recall": 0.6286, "D_f1": 0.6197, "D_f2": 0.625, "D_accuracy": 0.5909, "D_mcc": 0.1774, "D_tp": 22, "D_fp": 14, "D_tn": 17, "D_fn": 13, "sharpe": -1.8029, "sortino": -1.7437, "return_pct": -17.65, "equity": 823.5, "max_dd": 0.0, "win_rate": 45.45, "profit_factor": 0.0, "ic": -0.0304, "hit": 45.45, "psr": 0.1812, "bh_sharpe": 0.5721, "bh_return_pct": 3.85, "excess_sharpe": -2.375, "precision": 0.4815, "recall": 0.3714, "f1": 0.4194, "f2": 0.3892, "mcc": -0.0814, "accuracy": 0.4545, "tp": 13, "fp": 14, "tn": 17, "fn": 22}, {"fold": "fold_2", "regime": "2011 US-downgrade + EU debt", "n": 87, "A_sharpe": 5.6236, "A_sortino": 7.2138, "A_excess_sharpe": 0.6016, "A_return_pct": 32.89, "A_hit_rate": 65.12, "A_n": 87, "A_bh_sharpe": 5.022, "A_bh_return_pct": 29.23, "A_psr": 0.9999, "A_ic": 0.1533, "A_precision": 0.6875, "A_recall": 0.8148, "A_f1": 0.7458, "A_f2": 0.7857, "A_accuracy": 0.6552, "A_mcc": 0.2297, "A_tp": 44, "A_fp": 20, "A_tn": 13, "A_fn": 10, "B_sharpe": 5.3829, "B_sortino": 6.1512, "B_excess_sharpe": -5.7541, "B_return_pct": 78.19, "B_hit_rate": 62.07, "B_n": 87, "B_bh_sharpe": 11.1369, "B_bh_return_pct": 185.4, "B_psr": 0.9992, "B_ic": 0.191, "B_precision": 0.8361, "B_recall": 0.6892, "B_f1": 0.7556, "B_f2": 0.7143, "B_accuracy": 0.6207, "B_mcc": -0.0623, "B_tp": 51, "B_fp": 10, "B_tn": 3, "B_fn": 23, "D_sharpe": 3.0446, "D_sortino": 3.593, "D_excess_sharpe": -1.9774, "D_return_pct": 17.18, "D_hit_rate": 58.14, "D_n": 87, "D_bh_sharpe": 5.022, "D_bh_return_pct": 29.23, "D_psr": 0.972, "D_ic": 0.0538, "D_precision": 0.6393, "D_recall": 0.7222, "D_f1": 0.6783, "D_f2": 0.704, "D_accuracy": 0.5747, "D_mcc": 0.0589, "D_tp": 39, "D_fp": 22, "D_tn": 11, "D_fn": 15, "sharpe": 5.6236, "sortino": 7.2138, "return_pct": 32.89, "equity": 1328.8999999999999, "max_dd": 0.0, "win_rate": 65.12, "profit_factor": 0.0, "ic": 0.1533, "hit": 65.12, "psr": 0.9999, "bh_sharpe": 5.022, "bh_return_pct": 29.23, "excess_sharpe": 0.6016, "precision": 0.6875, "recall": 0.8148, "f1": 0.7458, "f2": 0.7857, "mcc": 0.2297, "accuracy": 0.6552, "tp": 44, "fp": 20, "tn": 13, "fn": 10}, {"fold": "fold_3", "regime": "Taper tantrum and 2014 H1", "n": 129, "A_sharpe": 0.3577, "A_sortino": 0.3153, "A_excess_sharpe": -1.4101, "A_return_pct": 1.94, "A_hit_rate": 53.12, "A_n": 129, "A_bh_sharpe": 1.7678, "A_bh_return_pct": 11.76, "A_psr": 0.5996, "A_ic": -0.017, "A_precision": 0.5739, "A_recall": 0.8462, "A_f1": 0.6839, "A_f2": 0.7728, "A_accuracy": 0.5271, "A_mcc": -0.1802, "A_tp": 66, "A_fp": 49, "A_tn": 2, "A_fn": 12, "B_sharpe": 3.2707, "B_sortino": 3.3402, "B_excess_sharpe": -0.9766, "B_return_pct": 46.73, "B_hit_rate": 59.69, "B_n": 129, "B_bh_sharpe": 4.2474, "B_bh_return_pct": 64.1, "B_psr": 0.9887, "B_ic": -0.004, "B_precision": 0.6339, "B_recall": 0.8659, "B_f1": 0.732, "B_f2": 0.8068, "B_accuracy": 0.5969, "B_mcc": -0.0092, "B_tp": 71, "B_fp": 41, "B_tn": 6, "B_fn": 11, "D_sharpe": 1.6181, "D_sortino": 1.432, "D_excess_sharpe": -0.1497, "D_return_pct": 10.69, "D_hit_rate": 58.59, "D_n": 129, "D_bh_sharpe": 1.7678, "D_bh_return_pct": 11.76, "D_psr": 0.8654, "D_ic": 0.1056, "D_precision": 0.6071, "D_recall": 0.8718, "D_f1": 0.7158, "D_f2": 0.8019, "D_accuracy": 0.5814, "D_mcc": 0.0131, "D_tp": 68, "D_fp": 44, "D_tn": 7, "D_fn": 10, "sharpe": 0.3577, "sortino": 0.3153, "return_pct": 1.94, "equity": 1019.4000000000001, "max_dd": 0.0, "win_rate": 53.12, "profit_factor": 0.0, "ic": -0.017, "hit": 53.12, "psr": 0.5996, "bh_sharpe": 1.7678, "bh_return_pct": 11.76, "excess_sharpe": -1.4101, "precision": 0.5739, "recall": 0.8462, "f1": 0.6839, "f2": 0.7728, "mcc": -0.1802, "accuracy": 0.5271, "tp": 66, "fp": 49, "tn": 2, "fn": 12}, {"fold": "fold_4", "regime": "China devaluation and oil crash", "n": 108, "A_sharpe": -1.8517, "A_sortino": -1.6457, "A_excess_sharpe": -1.1619, "A_return_pct": -15.66, "A_hit_rate": 47.66, "A_n": 108, "A_bh_sharpe": -0.6898, "A_bh_return_pct": -6.71, "A_psr": 0.1084, "A_ic": -0.0148, "A_precision": 0.4754, "A_recall": 0.5472, "A_f1": 0.5088, "A_f2": 0.5311, "A_accuracy": 0.4815, "A_mcc": -0.0349, "A_tp": 29, "A_fp": 32, "A_tn": 23, "A_fn": 24, "B_sharpe": -3.6438, "B_sortino": -3.3042, "B_excess_sharpe": -1.6863, "B_return_pct": -50.95, "B_hit_rate": 38.89, "B_n": 108, "B_bh_sharpe": -1.9575, "B_bh_return_pct": -33.56, "B_psr": 0.0072, "B_ic": -0.1262, "B_precision": 0.377, "B_recall": 0.451, "B_f1": 0.4107, "B_f2": 0.434, "B_accuracy": 0.3889, "B_mcc": -0.2172, "B_tp": 23, "B_fp": 38, "B_tn": 19, "B_fn": 28, "D_sharpe": -2.2723, "D_sortino": -1.9952, "D_excess_sharpe": -1.5826, "D_return_pct": -18.64, "D_hit_rate": 46.73, "D_n": 108, "D_bh_sharpe": -0.6898, "D_bh_return_pct": -6.71, "D_psr": 0.0635, "D_ic": -0.0307, "D_precision": 0.459, "D_recall": 0.5283, "D_f1": 0.4912, "D_f2": 0.5128, "D_accuracy": 0.463, "D_mcc": -0.0723, "D_tp": 28, "D_fp": 33, "D_tn": 22, "D_fn": 25, "sharpe": -1.8517, "sortino": -1.6457, "return_pct": -15.66, "equity": 843.4000000000001, "max_dd": 0.0, "win_rate": 47.66, "profit_factor": 0.0, "ic": -0.0148, "hit": 47.66, "psr": 0.1084, "bh_sharpe": -0.6898, "bh_return_pct": -6.71, "excess_sharpe": -1.1619, "precision": 0.4754, "recall": 0.5472, "f1": 0.5088, "f2": 0.5311, "mcc": -0.0349, "accuracy": 0.4815, "tp": 29, "fp": 32, "tn": 23, "fn": 24}, {"fold": "fold_5", "regime": "2018 Vol-mageddon + Q4 sell-off", "n": 128, "A_sharpe": -1.5596, "A_sortino": -1.5631, "A_excess_sharpe": -2.7107, "A_return_pct": -18.2, "A_hit_rate": 44.53, "A_n": 128, "A_bh_sharpe": 1.1511, "A_bh_return_pct": 13.19, "A_psr": 0.1396, "A_ic": -0.0882, "A_precision": 0.5493, "A_recall": 0.5, "A_f1": 0.5235, "A_f2": 0.5091, "A_accuracy": 0.4453, "A_mcc": -0.1374, "A_tp": 39, "A_fp": 32, "A_tn": 18, "A_fn": 39, "B_sharpe": -3.9572, "B_sortino": -3.7646, "B_excess_sharpe": -6.7691, "B_return_pct": -61.92, "B_hit_rate": 35.43, "B_n": 128, "B_bh_sharpe": 2.8119, "B_bh_return_pct": 82.25, "B_psr": 0.0026, "B_ic": -0.143, "B_precision": 0.5263, "B_recall": 0.3529, "B_f1": 0.4225, "B_f2": 0.3778, "B_accuracy": 0.3594, "B_mcc": -0.2613, "B_tp": 30, "B_fp": 27, "B_tn": 16, "B_fn": 55, "D_sharpe": -1.8896, "D_sortino": -1.9292, "D_excess_sharpe": -3.0407, "D_return_pct": -21.32, "D_hit_rate": 42.97, "D_n": 128, "D_bh_sharpe": 1.1511, "D_bh_return_pct": 13.19, "D_psr": 0.0974, "D_ic": -0.1003, "D_precision": 0.5439, "D_recall": 0.3974, "D_f1": 0.4593, "D_f2": 0.4201, "D_accuracy": 0.4297, "D_mcc": -0.1203, "D_tp": 31, "D_fp": 26, "D_tn": 24, "D_fn": 47, "sharpe": -1.5596, "sortino": -1.5631, "return_pct": -18.2, "equity": 818.0000000000001, "max_dd": 0.0, "win_rate": 44.53, "profit_factor": 0.0, "ic": -0.0882, "hit": 44.53, "psr": 0.1396, "bh_sharpe": 1.1511, "bh_return_pct": 13.19, "excess_sharpe": -2.7107, "precision": 0.5493, "recall": 0.5, "f1": 0.5235, "f2": 0.5091, "mcc": -0.1374, "accuracy": 0.4453, "tp": 39, "fp": 32, "tn": 18, "fn": 39}, {"fold": "fold_6", "regime": "COVID crash and V-recovery", "n": 173, "A_sharpe": 1.455, "A_sortino": 1.5422, "A_excess_sharpe": -0.871, "A_return_pct": 24.78, "A_hit_rate": 52.6, "A_n": 173, "A_bh_sharpe": 2.3261, "A_bh_return_pct": 43.81, "A_psr": 0.886, "A_ic": 0.1162, "A_precision": 0.7313, "A_recall": 0.4336, "A_f1": 0.5444, "A_f2": 0.4721, "A_accuracy": 0.526, "A_mcc": 0.1306, "A_tp": 49, "A_fp": 18, "A_tn": 42, "A_fn": 64, "B_sharpe": 0.2686, "B_sortino": 0.2916, "B_excess_sharpe": -5.4774, "B_return_pct": 0.62, "B_hit_rate": 48.84, "B_n": 173, "B_bh_sharpe": 5.746, "B_bh_return_pct": 499.04, "B_psr": 0.5881, "B_ic": 0.1032, "B_precision": 0.6949, "B_recall": 0.3694, "B_f1": 0.4824, "B_f2": 0.4076, "B_accuracy": 0.4913, "B_mcc": 0.08, "B_tp": 41, "B_fp": 18, "B_tn": 44, "B_fn": 70, "D_sharpe": 0.0788, "D_sortino": 0.0945, "D_excess_sharpe": -2.2473, "D_return_pct": -0.7, "D_hit_rate": 42.2, "D_n": 173, "D_bh_sharpe": 2.3261, "D_bh_return_pct": 43.81, "D_psr": 0.526, "D_ic": -0.0049, "D_precision": 0.6102, "D_recall": 0.3186, "D_f1": 0.4186, "D_f2": 0.3523, "D_accuracy": 0.422, "D_mcc": -0.065, "D_tp": 36, "D_fp": 23, "D_tn": 37, "D_fn": 77, "sharpe": 1.455, "sortino": 1.5422, "return_pct": 24.78, "equity": 1247.8, "max_dd": 0.0, "win_rate": 52.6, "profit_factor": 0.0, "ic": 0.1162, "hit": 52.6, "psr": 0.886, "bh_sharpe": 2.3261, "bh_return_pct": 43.81, "excess_sharpe": -0.871, "precision": 0.7313, "recall": 0.4336, "f1": 0.5444, "f2": 0.4721, "mcc": 0.1306, "accuracy": 0.526, "tp": 49, "fp": 18, "tn": 42, "fn": 64}, {"fold": "fold_7", "regime": "Inflation bear, AI rally and 2025", "n": 376, "A_sharpe": -0.5456, "A_sortino": -0.6368, "A_excess_sharpe": -1.3489, "A_return_pct": -19.73, "A_hit_rate": 43.09, "A_n": 376, "A_bh_sharpe": 0.8033, "A_bh_return_pct": 26.02, "A_psr": 0.2584, "A_ic": -0.0002, "A_precision": 0.5686, "A_recall": 0.1312, "A_f1": 0.2132, "A_f2": 0.1551, "A_accuracy": 0.4309, "A_mcc": -0.0154, "A_tp": 29, "A_fp": 22, "A_tn": 133, "A_fn": 192, "B_sharpe": -0.9341, "B_sortino": -1.0567, "B_excess_sharpe": -2.8658, "B_return_pct": -55.42, "B_hit_rate": 40.53, "B_n": 376, "B_bh_sharpe": 1.9317, "B_bh_return_pct": 222.05, "B_psr": 0.1318, "B_ic": -0.0394, "B_precision": 0.6667, "B_recall": 0.0352, "B_f1": 0.0669, "B_f2": 0.0435, "B_accuracy": 0.4069, "B_mcc": 0.0234, "B_tp": 8, "B_fp": 4, "B_tn": 145, "B_fn": 219, "D_sharpe": -0.2963, "D_sortino": -0.3717, "D_excess_sharpe": -1.0996, "D_return_pct": -12.73, "D_hit_rate": 42.29, "D_n": 376, "D_bh_sharpe": 0.8033, "D_bh_return_pct": 26.02, "D_psr": 0.3613, "D_ic": -0.0277, "D_precision": 0.6667, "D_recall": 0.0362, "D_f1": 0.0687, "D_f2": 0.0446, "D_accuracy": 0.4229, "D_mcc": 0.0291, "D_tp": 8, "D_fp": 4, "D_tn": 151, "D_fn": 213, "sharpe": -0.5456, "sortino": -0.6368, "return_pct": -19.73, "equity": 802.6999999999999, "max_dd": 0.0, "win_rate": 43.09, "profit_factor": 0.0, "ic": -0.0002, "hit": 43.09, "psr": 0.2584, "bh_sharpe": 0.8033, "bh_return_pct": 26.02, "excess_sharpe": -1.3489, "precision": 0.5686, "recall": 0.1312, "f1": 0.2132, "f2": 0.1551, "mcc": -0.0154, "accuracy": 0.4309, "tp": 29, "fp": 22, "tn": 133, "fn": 192}], "per_window_val": [{"fold": "fold_1", "regime": "GFC peak crash (Lehman + Mar-2009 bottom)", "n": 65, "A_sharpe": -0.4255, "A_sortino": -0.4009, "A_excess_sharpe": 1.8002, "A_return_pct": -5.07, "A_hit_rate": 49.21, "A_n": 65, "A_bh_sharpe": -2.2257, "A_bh_return_pct": -18.74, "A_psr": 0.4146, "A_ic": 0.0902, "A_precision": 0.4545, "A_recall": 0.8621, "A_f1": 0.5952, "A_f2": 0.731, "A_accuracy": 0.4769, "A_mcc": 0.0396, "A_tp": 25, "A_fp": 30, "A_tn": 6, "A_fn": 4, "B_sharpe": -0.1259, "B_sortino": -0.147, "B_excess_sharpe": 6.9965, "B_return_pct": -8.82, "B_hit_rate": 47.69, "B_n": 65, "B_bh_sharpe": -7.1223, "B_bh_return_pct": -73.11, "B_psr": 0.4748, "B_ic": 0.476, "B_precision": 0.4035, "B_recall": 1.0, "B_f1": 0.575, "B_f2": 0.7718, "B_accuracy": 0.4769, "B_mcc": 0.2772, "B_tp": 23, "B_fp": 34, "B_tn": 8, "B_fn": 0, "D_sharpe": 1.7866, "D_sortino": 1.734, "D_excess_sharpe": 4.0122, "D_return_pct": 15.07, "D_hit_rate": 58.73, "D_n": 65, "D_bh_sharpe": -2.2257, "D_bh_return_pct": -18.74, "D_psr": 0.8185, "D_ic": 0.3662, "D_precision": 0.5088, "D_recall": 1.0, "D_f1": 0.6744, "D_f2": 0.8382, "D_accuracy": 0.5692, "D_mcc": 0.3362, "D_tp": 29, "D_fp": 28, "D_tn": 8, "D_fn": 0, "sharpe": -0.4255, "sortino": -0.4009, "return_pct": -5.07, "equity": 949.3000000000001, "max_dd": 0.0, "win_rate": 49.21, "profit_factor": 0.0, "ic": 0.0902, "hit": 49.21, "psr": 0.4146, "bh_sharpe": -2.2257, "bh_return_pct": -18.74, "excess_sharpe": 1.8002, "precision": 0.4545, "recall": 0.8621, "f1": 0.5952, "f2": 0.731, "mcc": 0.0396, "accuracy": 0.4769, "tp": 25, "fp": 30, "tn": 6, "fn": 4}, {"fold": "fold_2", "regime": "2011 US-downgrade + EU debt", "n": 47, "A_sharpe": 1.1128, "A_sortino": 1.0532, "A_excess_sharpe": 1.3069, "A_return_pct": 6.25, "A_hit_rate": 55.32, "A_n": 47, "A_bh_sharpe": -0.1941, "A_bh_return_pct": -2.36, "A_psr": 0.6804, "A_ic": 0.1436, "A_precision": 0.5758, "A_recall": 0.7308, "A_f1": 0.6441, "A_f2": 0.6934, "A_accuracy": 0.5532, "A_mcc": 0.0697, "A_tp": 19, "A_fp": 14, "A_tn": 7, "A_fn": 7, "B_sharpe": 0.6432, "B_sortino": 0.5749, "B_excess_sharpe": 2.2556, "B_return_pct": 3.7, "B_hit_rate": 55.32, "B_n": 47, "B_bh_sharpe": -1.6123, "B_bh_return_pct": -24.3, "B_psr": 0.6069, "B_ic": 0.2258, "B_precision": 0.5, "B_recall": 1.0, "B_f1": 0.6667, "B_f2": 0.8333, "B_accuracy": 0.5532, "B_mcc": 0.3101, "B_tp": 21, "B_fp": 21, "B_tn": 5, "B_fn": 0, "D_sharpe": 1.5609, "D_sortino": 1.476, "D_excess_sharpe": 1.7549, "D_return_pct": 9.34, "D_hit_rate": 57.45, "D_n": 47, "D_bh_sharpe": -0.1941, "D_bh_return_pct": -2.36, "D_psr": 0.7438, "D_ic": 0.0538, "D_precision": 0.5714, "D_recall": 0.9231, "D_f1": 0.7059, "D_f2": 0.8219, "D_accuracy": 0.5745, "D_mcc": 0.1063, "D_tp": 24, "D_fp": 18, "D_tn": 3, "D_fn": 2, "sharpe": 1.1128, "sortino": 1.0532, "return_pct": 6.25, "equity": 1062.5, "max_dd": 0.0, "win_rate": 55.32, "profit_factor": 0.0, "ic": 0.1436, "hit": 55.32, "psr": 0.6804, "bh_sharpe": -0.1941, "bh_return_pct": -2.36, "excess_sharpe": 1.3069, "precision": 0.5758, "recall": 0.7308, "f1": 0.6441, "f2": 0.6934, "mcc": 0.0697, "accuracy": 0.5532, "tp": 19, "fp": 14, "tn": 7, "fn": 7}, {"fold": "fold_3", "regime": "Taper tantrum and 2014 H1", "n": 5, "A_sharpe": 1.3194, "A_sortino": 1.268, "A_excess_sharpe": 2.6388, "A_return_pct": 0.2, "A_hit_rate": 60.0, "A_n": 5, "A_bh_sharpe": -1.3194, "A_bh_return_pct": -0.21, "A_psr": 0.5663, "A_ic": -1.0, "A_precision": 0.0, "A_recall": 0.0, "A_f1": 0.0, "A_f2": 0.0, "A_accuracy": 0.6, "A_mcc": 0.0, "A_tp": 0, "A_fp": 0, "A_tn": 3, "A_fn": 2, "B_sharpe": 25.8705, "B_sortino": 0.0, "B_excess_sharpe": 51.7411, "B_return_pct": 3.95, "B_hit_rate": 100.0, "B_n": 5, "B_bh_sharpe": -25.8705, "B_bh_return_pct": -3.84, "B_psr": 1.0, "B_ic": -0.2, "B_precision": 0.0, "B_recall": 0.0, "B_f1": 0.0, "B_f2": 0.0, "B_accuracy": 1.0, "B_mcc": 0.0, "B_tp": 0, "B_fp": 0, "B_tn": 5, "B_fn": 0, "D_sharpe": 1.3194, "D_sortino": 1.268, "D_excess_sharpe": 2.6388, "D_return_pct": 0.2, "D_hit_rate": 60.0, "D_n": 5, "D_bh_sharpe": -1.3194, "D_bh_return_pct": -0.21, "D_psr": 0.5663, "D_ic": -0.3, "D_precision": 0.0, "D_recall": 0.0, "D_f1": 0.0, "D_f2": 0.0, "D_accuracy": 0.6, "D_mcc": 0.0, "D_tp": 0, "D_fp": 0, "D_tn": 3, "D_fn": 2, "sharpe": 1.3194, "sortino": 1.268, "return_pct": 0.2, "equity": 1002.0, "max_dd": 0.0, "win_rate": 60.0, "profit_factor": 0.0, "ic": -1.0, "hit": 60.0, "psr": 0.5663, "bh_sharpe": -1.3194, "bh_return_pct": -0.21, "excess_sharpe": 2.6388, "precision": 0.0, "recall": 0.0, "f1": 0.0, "f2": 0.0, "mcc": 0.0, "accuracy": 0.6, "tp": 0, "fp": 0, "tn": 3, "fn": 2}, {"fold": "fold_4", "regime": "China devaluation and oil crash", "n": 47, "A_sharpe": -2.254, "A_sortino": -2.1818, "A_excess_sharpe": -0.4302, "A_return_pct": -10.46, "A_hit_rate": 40.43, "A_n": 47, "A_bh_sharpe": -1.8238, "A_bh_return_pct": -8.68, "A_psr": 0.1685, "A_ic": 0.0015, "A_precision": 0.4222, "A_recall": 0.9048, "A_f1": 0.5758, "A_f2": 0.7364, "A_accuracy": 0.4043, "A_mcc": -0.2346, "A_tp": 19, "A_fp": 26, "A_tn": 0, "A_fn": 2, "B_sharpe": -2.3514, "B_sortino": -2.0531, "B_excess_sharpe": -0.1314, "B_return_pct": -25.04, "B_hit_rate": 42.55, "B_n": 47, "B_bh_sharpe": -2.22, "B_bh_return_pct": -23.98, "B_psr": 0.1358, "B_ic": 0.5469, "B_precision": 0.4348, "B_recall": 0.9524, "B_f1": 0.597, "B_f2": 0.7692, "B_accuracy": 0.4255, "B_mcc": -0.1641, "B_tp": 20, "B_fp": 26, "B_tn": 0, "B_fn": 1, "D_sharpe": -0.4563, "D_sortino": -0.4562, "D_excess_sharpe": 1.3675, "D_return_pct": -2.69, "D_hit_rate": 46.81, "D_n": 47, "D_bh_sharpe": -1.8238, "D_bh_return_pct": -8.68, "D_psr": 0.4227, "D_ic": 0.1906, "D_precision": 0.4565, "D_recall": 1.0, "D_f1": 0.6269, "D_f2": 0.8077, "D_accuracy": 0.4681, "D_mcc": 0.1325, "D_tp": 21, "D_fp": 25, "D_tn": 1, "D_fn": 0, "sharpe": -2.254, "sortino": -2.1818, "return_pct": -10.46, "equity": 895.4, "max_dd": 0.0, "win_rate": 40.43, "profit_factor": 0.0, "ic": 0.0015, "hit": 40.43, "psr": 0.1685, "bh_sharpe": -1.8238, "bh_return_pct": -8.68, "excess_sharpe": -0.4302, "precision": 0.4222, "recall": 0.9048, "f1": 0.5758, "f2": 0.7364, "mcc": -0.2346, "accuracy": 0.4043, "tp": 19, "fp": 26, "tn": 0, "fn": 2}, {"fold": "fold_5", "regime": "2018 Vol-mageddon + Q4 sell-off", "n": 5, "A_sharpe": -10.1368, "A_sortino": -6.9937, "A_excess_sharpe": 0.0, "A_return_pct": -3.15, "A_hit_rate": 40.0, "A_n": 5, "A_bh_sharpe": -10.1368, "A_bh_return_pct": -3.15, "A_psr": 0.0985, "A_ic": 0.6, "A_precision": 0.4, "A_recall": 1.0, "A_f1": 0.5714, "A_f2": 0.7692, "A_accuracy": 0.4, "A_mcc": 0.0, "A_tp": 2, "A_fp": 3, "A_tn": 0, "A_fn": 0, "B_sharpe": 5.6858, "B_sortino": 6.0578, "B_excess_sharpe": 0.0, "B_return_pct": 4.22, "B_hit_rate": 60.0, "B_n": 5, "B_bh_sharpe": 5.6858, "B_bh_return_pct": 4.22, "B_psr": 0.753, "B_ic": 0.5, "B_precision": 0.6, "B_recall": 1.0, "B_f1": 0.75, "B_f2": 0.8824, "B_accuracy": 0.6, "B_mcc": 0.0, "B_tp": 3, "B_fp": 2, "B_tn": 0, "B_fn": 0, "D_sharpe": -10.1368, "D_sortino": -6.9937, "D_excess_sharpe": 0.0, "D_return_pct": -3.15, "D_hit_rate": 40.0, "D_n": 5, "D_bh_sharpe": -10.1368, "D_bh_return_pct": -3.15, "D_psr": 0.0985, "D_ic": 0.2, "D_precision": 0.4, "D_recall": 1.0, "D_f1": 0.5714, "D_f2": 0.7692, "D_accuracy": 0.4, "D_mcc": 0.0, "D_tp": 2, "D_fp": 3, "D_tn": 0, "D_fn": 0, "sharpe": -10.1368, "sortino": -6.9937, "return_pct": -3.15, "equity": 968.5, "max_dd": 0.0, "win_rate": 40.0, "profit_factor": 0.0, "ic": 0.6, "hit": 40.0, "psr": 0.0985, "bh_sharpe": -10.1368, "bh_return_pct": -3.15, "excess_sharpe": 0.0, "precision": 0.4, "recall": 1.0, "f1": 0.5714, "f2": 0.7692, "mcc": 0.0, "accuracy": 0.4, "tp": 2, "fp": 3, "tn": 0, "fn": 0}, {"fold": "fold_6", "regime": "COVID crash and V-recovery", "n": 26, "A_sharpe": 6.4964, "A_sortino": 8.7719, "A_excess_sharpe": 3.2112, "A_return_pct": 9.3, "A_hit_rate": 57.69, "A_n": 26, "A_bh_sharpe": 3.2852, "A_bh_return_pct": 4.82, "A_psr": 0.9806, "A_ic": -0.012, "A_precision": 0.619, "A_recall": 0.8125, "A_f1": 0.7027, "A_f2": 0.7647, "A_accuracy": 0.5769, "A_mcc": 0.0154, "A_tp": 13, "A_fp": 8, "A_tn": 2, "A_fn": 3, "B_sharpe": 0.2124, "B_sortino": 0.2066, "B_excess_sharpe": -12.7668, "B_return_pct": 0.17, "B_hit_rate": 53.85, "B_n": 26, "B_bh_sharpe": 12.9792, "B_bh_return_pct": 38.76, "B_psr": 0.5267, "B_ic": 0.4523, "B_precision": 1.0, "B_recall": 0.4286, "B_f1": 0.6, "B_f2": 0.4839, "B_accuracy": 0.5385, "B_mcc": 0.355, "B_tp": 9, "B_fp": 0, "B_tn": 5, "B_fn": 12, "D_sharpe": 1.0437, "D_sortino": 1.3309, "D_excess_sharpe": -2.2415, "D_return_pct": 1.46, "D_hit_rate": 42.31, "D_n": 26, "D_bh_sharpe": 3.2852, "D_bh_return_pct": 4.82, "D_psr": 0.631, "D_ic": 0.265, "D_precision": 0.5556, "D_recall": 0.3125, "D_f1": 0.4, "D_f2": 0.3425, "D_accuracy": 0.4231, "D_mcc": -0.0895, "D_tp": 5, "D_fp": 4, "D_tn": 6, "D_fn": 11, "sharpe": 6.4964, "sortino": 8.7719, "return_pct": 9.3, "equity": 1093.0, "max_dd": 0.0, "win_rate": 57.69, "profit_factor": 0.0, "ic": -0.012, "hit": 57.69, "psr": 0.9806, "bh_sharpe": 3.2852, "bh_return_pct": 4.82, "excess_sharpe": 3.2112, "precision": 0.619, "recall": 0.8125, "f1": 0.7027, "f2": 0.7647, "mcc": 0.0154, "accuracy": 0.5769, "tp": 13, "fp": 8, "tn": 2, "fn": 3}, {"fold": "fold_7", "regime": "Inflation bear, AI rally and 2025", "n": 65, "A_sharpe": -0.1331, "A_sortino": -0.1137, "A_excess_sharpe": -2.212, "A_return_pct": -0.83, "A_hit_rate": 58.46, "A_n": 65, "A_bh_sharpe": 2.0789, "A_bh_return_pct": 8.17, "A_psr": 0.4732, "A_ic": 0.1978, "A_precision": 0.7857, "A_recall": 0.3143, "A_f1": 0.449, "A_f2": 0.3571, "A_accuracy": 0.5846, "A_mcc": 0.2599, "A_tp": 11, "A_fp": 3, "A_tn": 27, "A_fn": 24, "B_sharpe": -5.2314, "B_sortino": -4.8393, "B_excess_sharpe": -10.4628, "B_return_pct": -32.36, "B_hit_rate": 32.31, "B_n": 65, "B_bh_sharpe": 5.2314, "B_bh_return_pct": 44.53, "B_psr": 0.0054, "B