{"experiment_num": 24, "backbone": "lightgbm", "description": "LightGBM @ FX-Exp235 HPs seed=0 - multi-seed variance check (vs exp 10 seed=42 +0.48); same discipline that exposed dMamba lucky-seed; Lakshminarayanan 2017 NeurIPS", "config": {"seq_len": 60, "lr": 0.0003, "batch_size": 32, "epochs": 50, "weight_decay": 1e-05, "patience": 10, "warmup_epochs": 0, "head_dropout": 0.1, "huber_delta": 1.0, "grad_clip": 1.0, "seed": 0, "hidden_size": null, "num_layers": null, "max_depth": 4, "gbm_lr": 0.01, "n_estimators": 1000}, "composite": 0.0663, "test_pos_folds": 4, "val_pos_folds": 5, "val_loss": null, "elapsed_sec": 252.4, "timestamp": "2026-04-27T14:00:05", "sharpe": 0.3663, "val_sharpe": 1.8623, "ic": 0.0066, "hit": 48.68, "psr": 0.7758, "equity": 1274.7, "return_pct": 27.47, "bh_sharpe": 1.2194, "bh_return_pct": 187.05, "excess_sharpe": -0.853, "B_sharpe": -0.4948, "B_excess_sharpe": -3.323, "B_return_pct": -76.11, "D_sharpe": -0.4022, "D_excess_sharpe": -1.6215, "D_return_pct": -38.84, "per_window": [{"fold": "fold_1", "regime": "GFC peak crash (Lehman + Mar-2009 bottom)", "n": 66, "A_sharpe": -1.3398, "A_sortino": -1.4064, "A_excess_sharpe": -1.912, "A_return_pct": -13.87, "A_hit_rate": 40.91, "A_n": 66, "A_bh_sharpe": 0.5721, "A_bh_return_pct": 3.85, "A_psr": 0.2497, "A_ic": 0.0667, "B_sharpe": -0.0657, "B_sortino": -0.0682, "B_excess_sharpe": -2.1126, "B_return_pct": -8.62, "B_hit_rate": 46.15, "B_n": 66, "B_bh_sharpe": 2.0469, "B_bh_return_pct": 39.28, "B_psr": 0.4867, "B_ic": 0.2848, "D_sharpe": 0.5824, "D_sortino": 0.5918, "D_excess_sharpe": 0.0103, "D_return_pct": 3.95, "D_hit_rate": 51.52, "D_n": 66, "D_bh_sharpe": 0.5721, "D_bh_return_pct": 3.85, "D_psr": 0.6163, "D_ic": 0.1809, "sharpe": -1.3398, "sortino": -1.4064, "return_pct": -13.87, "equity": 861.3, "max_dd": 0.0, "win_rate": 40.91, "profit_factor": 0.0, "ic": 0.0667, "hit": 40.91, "psr": 0.2497, "bh_sharpe": 0.5721, "bh_return_pct": 3.85, "excess_sharpe": -1.912, "precision": 0.4474, "recall": 0.4857, "f1": 0.4658, "f2": 0.4775, "accuracy": 0.4091, "mcc": -0.1936, "tp": 17, "fp": 21, "tn": 10, "fn": 18, "A_precision": 0.4474, "A_recall": 0.4857, "A_f1": 0.4658, "A_f2": 0.4775, "A_accuracy": 0.4091, "A_mcc": -0.1936, "A_tp": 17, "A_fp": 21, "A_tn": 10, "A_fn": 18}, {"fold": "fold_2", "regime": "2011 US-downgrade + EU debt", "n": 87, "A_sharpe": 3.8459, "A_sortino": 5.1246, "A_excess_sharpe": -1.1761, "A_return_pct": 22.05, "A_hit_rate": 56.98, "A_n": 87, "A_bh_sharpe": 5.022, "A_bh_return_pct": 29.23, "A_psr": 0.9937, "A_ic": 0.1427, "B_sharpe": 4.3766, "B_sortino": 4.9851, "B_excess_sharpe": -6.7604, "B_return_pct": 60.76, "B_hit_rate": 59.77, "B_n": 87, "B_bh_sharpe": 11.1369, "B_bh_return_pct": 185.4, "B_psr": 0.9954, "B_ic": 0.08, "D_sharpe": 2.6557, "D_sortino": 3.2069, "D_excess_sharpe": -2.3663, "D_return_pct": 14.84, "D_hit_rate": 55.81, "D_n": 87, "D_bh_sharpe": 5.022, "D_bh_return_pct": 29.23, "D_psr": 0.952, "D_ic": 0.0316, "sharpe": 3.8459, "sortino": 5.1246, "return_pct": 22.05, "equity": 1220.5, "max_dd": 0.0, "win_rate": 56.98, "profit_factor": 0.0, "ic": 0.1427, "hit": 56.98, "psr": 0.9937, "bh_sharpe": 5.022, "bh_return_pct": 29.23, "excess_sharpe": -1.1761, "precision": 0.6538, "recall": 0.6296, "f1": 0.6415, "f2": 0.6343, "accuracy": 0.5632, "mcc": 0.0833, "tp": 34, "fp": 18, "tn": 15, "fn": 20, "A_precision": 0.6538, "A_recall": 0.6296, "A_f1": 0.6415, "A_f2": 0.6343, "A_accuracy": 0.5632, "A_mcc": 0.0833, "A_tp": 34, "A_fp": 18, "A_tn": 15, "A_fn": 20}, {"fold": "fold_3", "regime": "Taper tantrum and 2014 H1", "n": 129, "A_sharpe": 2.4512, "A_sortino": 2.6959, "A_excess_sharpe": 0.6834, "A_return_pct": 16.76, "A_hit_rate": 51.56, "A_n": 129, "A_bh_sharpe": 1.7678, "A_bh_return_pct": 11.76, "A_psr": 0.957, "A_ic": 0.0892, "B_sharpe": 1.1279, "B_sortino": 1.1301, "B_excess_sharpe": -3.1195, "B_return_pct": 13.3, "B_hit_rate": 53.49, "B_n": 129, "B_bh_sharpe": 4.2474, "B_bh_return_pct": 64.1, "B_psr": 0.788, "B_ic": 0.0168, "D_sharpe": 0.2046, "D_sortino": 0.192, "D_excess_sharpe": -1.5632, "D_return_pct": 0.93, "D_hit_rate": 51.56, "D_n": 129, "D_bh_sharpe": 1.7678, "D_bh_return_pct": 11.76, "D_psr": 0.5577, "D_ic": 0.0829, "sharpe": 2.4512, "sortino": 2.6959, "return_pct": 16.76, "equity": 1167.6, "max_dd": 0.0, "win_rate": 51.56, "profit_factor": 0.0, "ic": 0.0892, "hit": 51.56, "psr": 0.957, "bh_sharpe": 1.7678, "bh_return_pct": 11.76, "excess_sharpe": 0.6834, "precision": 0.6026, "recall": 0.6026, "f1": 0.6026, "f2": 0.6026, "accuracy": 0.5194, "mcc": -0.0053, "tp": 47, "fp": 31, "tn": 20, "fn": 31, "A_precision": 0.6026, "A_recall": 0.6026, "A_f1": 0.6026, "A_f2": 0.6026, "A_accuracy": 0.5194, "A_mcc": -0.0053, "A_tp": 47, "A_fp": 31, "A_tn": 20, "A_fn": 31}, {"fold": "fold_4", "regime": "China devaluation and oil crash", "n": 108, "A_sharpe": -0.534, "A_sortino": -0.5181, "A_excess_sharpe": 0.1558, "A_return_pct": -5.43, "A_hit_rate": 47.66, "A_n": 108, "A_bh_sharpe": -0.6898, "A_bh_return_pct": -6.71, "A_psr": 0.3635, "A_ic": 0.0432, "B_sharpe": -3.6822, "B_sortino": -3.3341, "B_excess_sharpe": -1.7247, "B_return_pct": -51.28, "B_hit_rate": 38.89, "B_n": 108, "B_bh_sharpe": -1.9575, "B_bh_return_pct": -33.56, "B_psr": 0.0067, "B_ic": -0.0926, "D_sharpe": -2.3638, "D_sortino": -2.0549, "D_excess_sharpe": -1.6741, "D_return_pct": -19.27, "D_hit_rate": 46.73, "D_n": 108, "D_bh_sharpe": -0.6898, "D_bh_return_pct": -6.71, "D_psr": 0.0553, "D_ic": -0.0585, "sharpe": -0.534, "sortino": -0.5181, "return_pct": -5.43, "equity": 945.6999999999999, "max_dd": 0.0, "win_rate": 47.66, "profit_factor": 0.0, "ic": 0.0432, "hit": 47.66, "psr": 0.3635, "bh_sharpe": -0.6898, "bh_return_pct": -6.71, "excess_sharpe": 0.1558, "precision": 0.4727, "recall": 0.4906, "f1": 0.4815, "f2": 0.4869, "accuracy": 0.4815, "mcc": -0.0367, "tp": 26, "fp": 29, "tn": 26, "fn": 27, "A_precision": 0.4727, "A_recall": 0.4906, "A_f1": 0.4815, "A_f2": 0.4869, "A_accuracy": 0.4815, "A_mcc": -0.0367, "A_tp": 26, "A_fp": 29, "A_tn": 26, "A_fn": 27}, {"fold": "fold_5", "regime": "2018 Vol-mageddon + Q4 sell-off", "n": 128, "A_sharpe": -0.1341, "A_sortino": -0.1513, "A_excess_sharpe": -1.2853, "A_return_pct": -2.98, "A_hit_rate": 45.31, "A_n": 128, "A_bh_sharpe": 1.1511, "A_bh_return_pct": 13.19, "A_psr": 0.4622, "A_ic": -0.0286, "B_sharpe": -3.4984, "B_sortino": -3.4631, "B_excess_sharpe": -6.3103, "B_return_pct": -57.9, "B_hit_rate": 33.86, "B_n": 128, "B_bh_sharpe": 2.8119, "B_bh_return_pct": 82.25, "B_psr": 0.0069, "B_ic": -0.0813, "D_sharpe": -1.1581, "D_sortino": -1.289, "D_excess_sharpe": -2.3092, "D_return_pct": -14.19, "D_hit_rate": 41.41, "D_n": 128, "D_bh_sharpe": 1.1511, "D_bh_return_pct": 13.19, "D_psr": 0.2116, "D_ic": -0.0541, "sharpe": -0.1341, "sortino": -0.1513, "return_pct": -2.98, "equity": 970.1999999999999, "max_dd": 0.0, "win_rate": 45.31, "profit_factor": 0.0, "ic": -0.0286, "hit": 45.31, "psr": 0.4622, "bh_sharpe": 1.1511, "bh_return_pct": 13.19, "excess_sharpe": -1.2853, "precision": 0.5625, "recall": 0.4615, "f1": 0.507, "f2": 0.4787, "accuracy": 0.4531, "mcc": -0.0961, "tp": 36, "fp": 28, "tn": 22, "fn": 42, "A_precision": 0.5625, "A_recall": 0.4615, "A_f1": 0.507, "A_f2": 0.4787, "A_accuracy": 0.4531, "A_mcc": -0.0961, "A_tp": 36, "A_fp": 28, "A_tn": 22, "A_fn": 42}, {"fold": "fold_6", "regime": "COVID crash and V-recovery", "n": 173, "A_sharpe": 0.8554, "A_sortino": 0.9842, "A_excess_sharpe": -1.4707, "A_return_pct": 13.01, "A_hit_rate": 48.55, "A_n": 173, "A_bh_sharpe": 2.3261, "A_bh_return_pct": 43.81, "A_psr": 0.7632, "A_ic": 0.0381, "B_sharpe": 0.7013, "B_sortino": 0.7809, "B_excess_sharpe": -5.0447, "B_return_pct": 16.92, "B_hit_rate": 48.84, "B_n": 173, "B_bh_sharpe": 5.746, "B_bh_return_pct": 499.04, "B_psr": 0.7205, "B_ic": 0.1136, "D_sharpe": -0.44, "D_sortino": -0.4909, "D_excess_sharpe": -2.7661, "D_return_pct": -8.93, "D_hit_rate": 42.2, "D_n": 173, "D_bh_sharpe": 2.3261, "D_bh_return_pct": 43.81, "D_psr": 0.3588, "D_ic": 0.0008, "sharpe": 0.8554, "sortino": 0.9842, "return_pct": 13.01, "equity": 1130.1000000000001, "max_dd": 0.0, "win_rate": 48.55, "profit_factor": 0.0, "ic": 0.0381, "hit": 48.55, "psr": 0.7632, "bh_sharpe": 2.3261, "bh_return_pct": 43.81, "excess_sharpe": -1.4707, "precision": 0.6395, "recall": 0.4867, "f1": 0.5528, "f2": 0.5112, "accuracy": 0.4855, "mcc": -0.0285, "tp": 55, "fp": 31, "tn": 29, "fn": 58, "A_precision": 0.6395, "A_recall": 0.4867, "A_f1": 0.5528, "A_f2": 0.5112, "A_accuracy": 0.4855, "A_mcc": -0.0285, "A_tp": 55, "A_fp": 31, "A_tn": 29, "A_fn": 58}, {"fold": "fold_7", "regime": "Inflation bear, AI rally and 2025", "n": 376, "A_sharpe": 0.1162, "A_sortino": 0.1251, "A_excess_sharpe": -0.6871, "A_return_pct": 0.17, "A_hit_rate": 48.67, "A_n": 376, "A_bh_sharpe": 0.8033, "A_bh_return_pct": 26.02, "A_psr": 0.5566, "A_ic": -0.0169, "B_sharpe": -0.5083, "B_sortino": -0.5639, "B_excess_sharpe": -2.44, "B_return_pct": -40.14, "B_hit_rate": 43.73, "B_n": 376, "B_bh_sharpe": 1.9317, "B_bh_return_pct": 222.05, "B_psr": 0.2694, "B_ic": -0.0559, "D_sharpe": -0.5385, "D_sortino": -0.6486, "D_excess_sharpe": -1.3418, "D_return_pct": -19.54, "D_hit_rate": 41.76, "D_n": 376, "D_bh_sharpe": 0.8033, "D_bh_return_pct": 26.02, "D_psr": 0.2614, "D_ic": -0.0217, "sharpe": 0.1162, "sortino": 0.1251, "return_pct": 0.17, "equity": 1001.7, "max_dd": 0.0, "win_rate": 48.67, "profit_factor": 0.0, "ic": -0.0169, "hit": 48.67, "psr": 0.5566, "bh_sharpe": 0.8033, "bh_return_pct": 26.02, "excess_sharpe": -0.6871, "precision": 0.6029, "recall": 0.371, "f1": 0.4594, "f2": 0.402, "accuracy": 0.4867, "mcc": 0.0232, "tp": 82, "fp": 54, "tn": 101, "fn": 139, "A_precision": 0.6029, "A_recall": 0.371, "A_f1": 0.4594, "A_f2": 0.402, "A_accuracy": 0.4867, "A_mcc": 0.0232, "A_tp": 82, "A_fp": 54, "A_tn": 101, "A_fn": 139}], "per_window_val": [{"fold": "fold_1", "regime": "GFC peak crash (Lehman + Mar-2009 bottom)", "n": 65, "A_sharpe": 3.4295, "A_sortino": 4.0413, "A_excess_sharpe": 5.6551, "A_return_pct": 32.06, "A_hit_rate": 55.56, "A_n": 65, "A_bh_sharpe": -2.2257, "A_bh_return_pct": -18.74, "A_psr": 0.9642, "A_ic": 0.1972, "B_sharpe": -4.8065, "B_sortino": -4.0599, "B_excess_sharpe": 2.3158, "B_return_pct": -61.34, "B_hit_rate": 40.0, "B_n": 65, "B_bh_sharpe": -7.1223, "B_bh_return_pct": -73.11, "B_psr": 0.0051, "B_ic": 0.1226, "D_sharpe": -1.1614, "D_sortino": -0.9741, "D_excess_sharpe": 1.0642, "D_return_pct": -10.97, "D_hit_rate": 50.79, "D_n": 65, "D_bh_sharpe": -2.2257, "D_bh_return_pct": -18.74, "D_psr": 0.2717, "D_ic": 0.2865, "sharpe": 3.4295, "sortino": 4.0413, "return_pct": 32.06, "equity": 1320.6, "max_dd": 0.0, "win_rate": 55.56, "profit_factor": 0.0, "ic": 0.1972, "hit": 55.56, "psr": 0.9642, "bh_sharpe": -2.2257, "bh_return_pct": -18.74, "excess_sharpe": 5.6551}, {"fold": "fold_2", "regime": "2011 US-downgrade + EU debt", "n": 47, "A_sharpe": 1.3085, "A_sortino": 1.3097, "A_excess_sharpe": 1.5026, "A_return_pct": 7.59, "A_hit_rate": 53.19, "A_n": 47, "A_bh_sharpe": -0.1941, "A_bh_return_pct": -2.36, "A_psr": 0.7094, "A_ic": 0.1411, "B_sharpe": -0.5977, "B_sortino": -0.5307, "B_excess_sharpe": 1.0146, "B_return_pct": -12.84, "B_hit_rate": 51.06, "B_n": 47, "B_bh_sharpe": -1.6123, "B_bh_return_pct": -24.3, "B_psr": 0.3981, "B_ic": 0.1598, "D_sharpe": -0.8316, "D_sortino": -0.7233, "D_excess_sharpe": -0.6375, "D_return_pct": -6.31, "D_hit_rate": 53.19, "D_n": 47, "D_bh_sharpe": -0.1941, "D_bh_return_pct": -2.36, "D_psr": 0.3595, "D_ic": 0.0096, "sharpe": 1.3085, "sortino": 1.3097, "return_pct": 7.59, "equity": 1075.9, "max_dd": 0.0, "win_rate": 53.19, "profit_factor": 0.0, "ic": 0.1411, "hit": 53.19, "psr": 0.7094, "bh_sharpe": -0.1941, "bh_return_pct": -2.36, "excess_sharpe": 1.5026}, {"fold": "fold_3", "regime": "Taper tantrum and 2014 H1", "n": 5, "A_sharpe": 5.9118, "A_sortino": 4.2395, "A_excess_sharpe": 7.2312, "A_return_pct": 0.0, "A_hit_rate": 0.0, "A_n": 5, "A_bh_sharpe": -1.3194, "A_bh_return_pct": -0.21, "A_psr": 0.759, "A_ic": 0.9, "B_sharpe": 25.8705, "B_sortino": 0.0, "B_excess_sharpe": 51.7411, "B_return_pct": 3.95, "B_hit_rate": 100.0, "B_n": 5, "B_bh_sharpe": -25.8705, "B_bh_return_pct": -3.84, "B_psr": 1.0, "B_ic": -0.1, "D_sharpe": 1.3194, "D_sortino": 1.268, "D_excess_sharpe": 2.6388, "D_return_pct": 0.2, "D_hit_rate": 60.0, "D_n": 5, "D_bh_sharpe": -1.3194, "D_bh_return_pct": -0.21, "D_psr": 0.5663, "D_ic": 0.1, "sharpe": 5.9118, "sortino": 4.2395, "return_pct": 0.0, "equity": 1000.0, "max_dd": 0.0, "win_rate": 0.0, "profit_factor": 0.0, "ic": 0.9, "hit": 0.0, "psr": 0.759, "bh_sharpe": -1.3194, "bh_return_pct": -0.21, "excess_sharpe": 7.2312}, {"fold": "fold_4", "regime": "China devaluation and oil crash", "n": 47, "A_sharpe": -2.6578, "A_sortino": -2.5142, "A_excess_sharpe": -0.834, "A_return_pct": -12.08, "A_hit_rate": 40.43, "A_n": 47, "A_bh_sharpe": -1.8238, "A_bh_return_pct": -8.68, "A_psr": 0.1292, "A_ic": 0.0072, "B_sharpe": -0.8243, "B_sortino": -0.7011, "B_excess_sharpe": 1.3957, "B_return_pct": -11.63, "B_hit_rate": 48.94, "B_n": 47, "B_bh_sharpe": -2.22, "B_bh_return_pct": -23.98, "B_psr": 0.3575, "B_ic": 0.6033, "D_sharpe": -2.5822, "D_sortino": -2.3763, "D_excess_sharpe": -0.7584, "D_return_pct": -11.78, "D_hit_rate": 44.68, "D_n": 47, "D_bh_sharpe": -1.8238, "D_bh_return_pct": -8.68, "D_psr": 0.1365, "D_ic": 0.2103, "sharpe": -2.6578, "sortino": -2.5142, "return_pct": -12.08, "equity": 879.1999999999999, "max_dd": 0.0, "win_rate": 40.43, "profit_factor": 0.0, "ic": 0.0072, "hit": 40.43, "psr": 0.1292, "bh_sharpe": -1.8238, "bh_return_pct": -8.68, "excess_sharpe": -0.834}, {"fold": "fold_5", "regime": "2018 Vol-mageddon + Q4 sell-off", "n": 5, "A_sharpe": -10.1368, "A_sortino": -6.9937, "A_excess_sharpe": 0.0, "A_return_pct": -3.15, "A_hit_rate": 40.0, "A_n": 5, "A_bh_sharpe": -10.1368, "A_bh_return_pct": -3.15, "A_psr": 0.0985, "A_ic": 0.7, "B_sharpe": 5.6858, "B_sortino": 6.0578, "B_excess_sharpe": 0.0, "B_return_pct": 4.22, "B_hit_rate": 60.0, "B_n": 5, "B_bh_sharpe": 5.6858, "B_bh_return_pct": 4.22, "B_psr": 0.753, "B_ic": 0.8, "D_sharpe": -10.1368, "D_sortino": -6.9937, "D_excess_sharpe": 0.0, "D_return_pct": -3.15, "D_hit_rate": 40.0, "D_n": 5, "D_bh_sharpe": -10.1368, "D_bh_return_pct": -3.15, "D_psr": 0.0985, "D_ic": 0.5, "sharpe": -10.1368, "sortino": -6.9937, "return_pct": -3.15, "equity": 968.5, "max_dd": 0.0, "win_rate": 40.0, "profit_factor": 0.0, "ic": 0.7, "hit": 40.0, "psr": 0.0985, "bh_sharpe": -10.1368, "bh_return_pct": -3.15, "excess_sharpe": 0.0}, {"fold": "fold_6", "regime": "COVID crash and V-recovery", "n": 26, "A_sharpe": 8.332, "A_sortino": 10.9139, "A_excess_sharpe": 5.0468, "A_return_pct": 11.56, "A_hit_rate": 65.38, "A_n": 26, "A_bh_sharpe": 3.2852, "A_bh_return_pct": 4.82, "A_psr": 0.9949, "A_ic": 0.4106, "B_sharpe": 5.7196, "B_sortino": 5.4043, "B_excess_sharpe": -7.2596, "B_return_pct": 18.88, "B_hit_rate": 69.23, "B_n": 26, "B_bh_sharpe": 12.9792, "B_bh_return_pct": 38.76, "B_psr": 0.9553, "B_ic": 0.5412, "D_sharpe": 5.4739, "D_sortino": 7.0437, "D_excess_sharpe": 2.1887, "D_return_pct": 7.94, "D_hit_rate": 57.69, "D_n": 26, "D_bh_sharpe": 3.2852, "D_bh_return_pct": 4.82, "D_psr": 0.9616, "D_ic": 0.3347, "sharpe": 8.332, "sortino": 10.9139, "return_pct": 11.56, "equity": 1115.6, "max_dd": 0.0, "win_rate": 65.38, "profit_factor": 0.0, "ic": 0.4106, "hit": 65.38, "psr": 0.9949, "bh_sharpe": 3.2852, "bh_return_pct": 4.82, "excess_sharpe": 5.0468}, {"fold": "fold_7", "regime": "Inflation bear, AI rally and 2025", "n": 65, "A_sharpe": 4.3318, "A_sortino": 5.1532, "A_excess_sharpe": 2.2529, "A_return_pct": 17.61, "A_hit_rate": 60.0, "A_n": 65, "A_bh_sharpe": 2.0789, "A_bh_return_pct": 8.17, "A_psr": 0.9884, "A_ic": 0.265, "B_sharpe": -4.3471, "B_sortino": -4.1515, "B_excess_sharpe": -9.5785, "B_return_pct": -28.23, "B_hit_rate": 33.85, "B_n": 65, "B_bh_sharpe": 5.2314, "B_bh_return_pct": 44.53, "B_psr": 0.0164, "B_ic": 0.2794, "D_sharpe": -1.5891, "D_sortino": -1.4533, "D_excess_sharpe": -3.668, "D_return_pct": -6.35, "D_hit_rate": 47.69, "D_n": 65, "D_bh_sharpe": 2.0789, "D_bh_return_pct": 8.17, "D_psr": 0.2083, "D_ic": 0.1444, "sharpe": 4.3318, "sortino": 5.1532, "return_pct": 17.61, "equity": 1176.1, "max_dd": 0.0, "win_rate": 60.0, "profit_factor": 0.0, "ic": 0.265, "hit": 60.0, "psr": 0.9884, "bh_sharpe": 2.0789, "bh_return_pct": 8.17, "excess_sharpe": 2.2529}], "status": "DISCARD", "precision": 0.5835, "recall": 0.4699, "f1": 0.5206, "f2": 0.489, "accuracy": 0.4873, "mcc": -0.0171, "tp": 297, "fp": 212, "tn": 223, "fn": 335, "test_sharpe": 0.3663, "A_sharpe": 0.3663, "A_excess_sharpe": -0.853, "A_return_pct": 27.47, "A_precision": 0.5835, "A_recall": 0.4699, "A_f1": 0.5206, "A_f2": 0.489, "A_accuracy": 0.4873, "A_mcc": -0.0171, "A_tp": 297, "A_fp": 212, "A_tn": 223, "A_fn": 335, "A_psr": 0.7758, "A_ic": 0.0066, "A_hit_rate": 48.68, "A_bh_sharpe": 1.2194, "A_bh_return_pct": 187.05}
