{"backbone": "xgboost", "description": "Exp22 seq=40", "config": {"seq_len": 40, "lr": 0.0003, "batch_size": 32, "epochs": 20, "weight_decay": 1e-05, "patience": 5, "grad_clip": 1.0, "warmup_epochs": 0, "huber_delta": 1.0, "head_dropout": 0.1, "seed": 42, "max_depth": 4, "gbm_lr": 0.01, "het_loss": false}, "composite": 9.0462, "test_pos_folds": 6, "val_pos_folds": 6, "val_loss": 0.0, "elapsed_sec": 307.7, "timestamp": "2026-04-21T06:44:34", "sharpe": 9.4728, "psr": 1.0, "equity": 10520.42, "sortino": 12.658, "return_pct": 952.04, "max_dd": 6.02, "win_rate": 79.58, "profit_factor": 5.299, "ic": 0.7055, "hit": 79.16, "precision": 0.8011, "recall": 0.7757, "f1": 0.7882, "f2": 0.7807, "mcc": 0.586, "accuracy": 0.7929, "per_window": [{"fold": "fold_1", "regime": "Pre-crisis upturn + GFC onset", "sharpe": -0.4052, "sortino": -0.6661, "return_pct": -1.4, "equity": 985.98, "max_dd": 5.28, "win_rate": 47.22, "profit_factor": 0.938, "ic": 0.0313, "hit": 46.58, "n": 73, "precision": 0.4474, "recall": 0.4857, "f1": 0.4658, "f2": 0.4775, "mcc": -0.0669, "accuracy": 0.4658, "tp": 17, "fp": 21, "tn": 17, "fn": 18}, {"fold": "fold_2", "regime": "Post-crash recovery", "sharpe": 0.806, "sortino": 1.238, "return_pct": 2.71, "equity": 1027.13, "max_dd": 6.02, "win_rate": 54.55, "profit_factor": 1.136, "ic": 0.0179, "hit": 54.55, "n": 77, "precision": 0.575, "recall": 0.561, "f1": 0.5679, "f2": 0.5637, "mcc": 0.0886, "accuracy": 0.5455, "tp": 23, "fp": 17, "tn": 19, "fn": 18}, {"fold": "fold_3", "regime": "Eurozone debt plateau", "sharpe": 14.7743, "sortino": 23.2371, "return_pct": 31.99, "equity": 1319.94, "max_dd": 1.32, "win_rate": 86.49, "profit_factor": 12.094, "ic": 0.8135, "hit": 84.21, "n": 76, "precision": 0.8947, "recall": 0.8095, "f1": 0.85, "f2": 0.8252, "mcc": 0.688, "accuracy": 0.8421, "tp": 34, "fp": 4, "tn": 30, "fn": 8}, {"fold": "fold_4", "regime": "Strong USD downturn", "sharpe": 14.7302, "sortino": 45.4165, "return_pct": 97.73, "equity": 1977.29, "max_dd": 0.56, "win_rate": 89.78, "profit_factor": 24.032, "ic": 0.8699, "hit": 89.13, "n": 138, "precision": 0.9375, "recall": 0.8571, "f1": 0.8955, "f2": 0.8721, "mcc": 0.8003, "accuracy": 0.8986, "tp": 60, "fp": 4, "tn": 64, "fn": 10}, {"fold": "fold_5", "regime": "Low-vol plateau", "sharpe": 15.161, "sortino": 71.6912, "return_pct": 34.83, "equity": 1348.29, "max_dd": 0.23, "win_rate": 84.85, "profit_factor": 21.549, "ic": 0.8931, "hit": 84.85, "n": 132, "precision": 0.8387, "recall": 0.8387, "f1": 0.8387, "f2": 0.8387, "mcc": 0.6959, "accuracy": 0.8485, "tp": 52, "fp": 10, "tn": 60, "fn": 10}, {"fold": "fold_6", "regime": "EUR crisis downturn", "sharpe": 15.586, "sortino": 41.0388, "return_pct": 78.91, "equity": 1789.12, "max_dd": 0.76, "win_rate": 82.96, "profit_factor": 15.992, "ic": 0.8901, "hit": 82.96, "n": 135, "precision": 0.8475, "recall": 0.7812, "f1": 0.813, "f2": 0.7937, "mcc": 0.6589, "accuracy": 0.8296, "tp": 50, "fp": 9, "tn": 62, "fn": 14}, {"fold": "fold_7", "regime": "Recent mixed/upturn", "sharpe": 14.0994, "sortino": 25.4158, "return_pct": 65.0, "equity": 1650.02, "max_dd": 1.02, "win_rate": 88.64, "profit_factor": 17.851, "ic": 0.897, "hit": 88.64, "n": 132, "precision": 0.8788, "recall": 0.8923, "f1": 0.8855, "f2": 0.8896, "mcc": 0.7728, "accuracy": 0.8864, "tp": 58, "fp": 8, "tn": 59, "fn": 7}], "val_sharpe": 9.2462, "val_psr": 1.0, "val_equity": 3961.2, "val_sortino": 13.4129, "val_return_pct": 296.12, "val_max_dd": 6.73, "val_win_rate": 76.71, "val_profit_factor": 5.083, "val_ic": 0.6577, "val_hit": 76.16, "val_precision": 0.7308, "val_recall": 0.8352, "val_f1": 0.7795, "val_f2": 0.812, "val_mcc": 0.5441, "val_accuracy": 0.7688, "val_per_window": [{"fold": "fold_1", "regime": "Pre-crisis upturn + GFC onset", "sharpe": 2.0088, "sortino": 3.4583, "return_pct": 4.0, "equity": 1039.96, "max_dd": 3.69, "win_rate": 47.44, "profit_factor": 1.397, "ic": -0.0323, "hit": 46.84, "n": 79, "precision": 0.5, "recall": 0.7073, "f1": 0.5859, "f2": 0.6532, "mcc": -0.0632, "accuracy": 0.481, "tp": 29, "fp": 29, "tn": 9, "fn": 12}, {"fold": "fold_2", "regime": "Post-crash recovery", "sharpe": -0.0283, "sortino": -0.048, "return_pct": -0.23, "equity": 997.65, "max_dd": 6.73, "win_rate": 48.72, "profit_factor": 0.995, "ic": -0.1002, "hit": 48.72, "n": 78, "precision": 0.5227, "recall": 0.5476, "f1": 0.5349, "f2": 0.5425, "mcc": -0.0359, "accuracy": 0.4872, "tp": 23, "fp": 21, "tn": 15, "fn": 19}, {"fold": "fold_3", "regime": "Eurozone debt plateau", "sharpe": 16.3681, "sortino": 40.8036, "return_pct": 42.44, "equity": 1424.38, "max_dd": 0.62, "win_rate": 88.75, "profit_factor": 30.044, "ic": 0.8611, "hit": 87.65, "n": 81, "precision": 0.814, "recall": 0.9722, "f1": 0.8861, "f2": 0.9358, "mcc": 0.791, "accuracy": 0.8889, "tp": 35, "fp": 8, "tn": 37, "fn": 1}, {"fold": "fold_4", "regime": "Strong USD downturn", "sharpe": 17.7093, "sortino": 60.6969, "return_pct": 40.14, "equity": 1401.42, "max_dd": 0.64, "win_rate": 89.87, "profit_factor": 30.353, "ic": 0.927, "hit": 88.75, "n": 80, "precision": 0.8947, "recall": 0.8947, "f1": 0.8947, "f2": 0.8947, "mcc": 0.7995, "accuracy": 0.9, "tp": 34, "fp": 4, "tn": 38, "fn": 4}, {"fold": "fold_5", "regime": "Low-vol plateau", "sharpe": 15.0686, "sortino": 76.164, "return_pct": 30.81, "equity": 1308.15, "max_dd": 0.29, "win_rate": 86.59, "profit_factor": 25.491, "ic": 0.9196, "hit": 86.59, "n": 82, "precision": 0.8333, "recall": 0.9302, "f1": 0.8791, "f2": 0.9091, "mcc": 0.735, "accuracy": 0.8659, "tp": 40, "fp": 8, "tn": 31, "fn": 3}, {"fold": "fold_6", "regime": "EUR crisis downturn", "sharpe": 16.6525, "sortino": 139.835, "return_pct": 19.36, "equity": 1193.55, "max_dd": 0.15, "win_rate": 90.91, "profit_factor": 59.054, "ic": 0.9268, "hit": 89.74, "n": 78, "precision": 0.8788, "recall": 0.9062, "f1": 0.8923, "f2": 0.9006, "mcc": 0.8157, "accuracy": 0.9103, "tp": 29, "fp": 4, "tn": 42, "fn": 3}, {"fold": "fold_7", "regime": "Recent mixed/upturn", "sharpe": 15.9639, "sortino": 67.0778, "return_pct": 22.5, "equity": 1225.0, "max_dd": 0.24, "win_rate": 83.75, "profit_factor": 20.589, "ic": 0.8788, "hit": 83.75, "n": 80, "precision": 0.7917, "recall": 0.9268, "f1": 0.8539, "f2": 0.8962, "mcc": 0.684, "accuracy": 0.8375, "tp": 38, "fp": 10, "tn": 29, "fn": 3}], "train_sharpe": 10.9229, "train_psr": 1.0, "train_equity": 2542157.25, "train_sortino": 143.3755, "train_return_pct": 254115.73, "train_max_dd": 0.23, "train_win_rate": 93.67, "train_profit_factor": 120.358, "train_ic": 0.9764, "train_hit": 93.3, "train_precision": 0.9325, "train_recall": 0.9447, "train_f1": 0.9386, "train_f2": 0.9422, "train_mcc": 0.8702, "train_accuracy": 0.9353, "train_per_window": [{"fold": "all_train", "regime": "Training data", "sharpe": 10.9229, "sortino": 143.3755, "return_pct": 254115.73, "equity": 2542157.25, "max_dd": 0.23, "win_rate": 93.67, "profit_factor": 120.358, "ic": 0.9764, "hit": 93.3, "n": 1761, "precision": 0.9325, "recall": 0.9447, "f1": 0.9386, "f2": 0.9422, "mcc": 0.8702, "accuracy": 0.9353, "tp": 871, "fp": 63, "tn": 776, "fn": 51}], "experiment_num": 199, "status": "KEEP"}
{"backbone": "xgboost", "description": "Exp23 seq=15", "config": {"seq_len": 15, "lr": 0.0003, "batch_size": 32, "epochs": 20, "weight_decay": 1e-05, "patience": 5, "grad_clip": 1.0, "warmup_epochs": 0, "huber_delta": 1.0, "head_dropout": 0.1, "seed": 42, "max_depth": 4, "gbm_lr": 0.01, "het_loss": false}, "composite": 7.7058, "test_pos_folds": 6, "val_pos_folds": 6, "val_loss": 0.0, "elapsed_sec": 126.6, "timestamp": "2026-04-21T06:46:50", "sharpe": 7.9058, "psr": 1.0, "equity": 17478.28, "sortino": 7.8298, "return_pct": 1647.83, "max_dd": 7.54, "win_rate": 78.69, "profit_factor": 4.793, "ic": 0.6873, "hit": 78.36, "precision": 0.8104, "recall": 0.7387, "f1": 0.7729, "f2": 0.752, "mcc": 0.5731, "accuracy": 0.7857, "per_window": [{"fold": "fold_1", "regime": "Pre-crisis upturn + GFC onset", "sharpe": -0.0325, "sortino": -0.036, "return_pct": -0.96, "equity": 990.4, "max_dd": 7.54, "win_rate": 51.55, "profit_factor": 0.992, "ic": 0.2193, "hit": 51.02, "n": 98, "precision": 0.6364, "recall": 0.14, "f1": 0.2295, "f2": 0.1659, "mcc": 0.0897, "accuracy": 0.5204, "tp": 7, "fp": 4, "tn": 44, "fn": 43}, {"fold": "fold_2", "regime": "Post-crash recovery", "sharpe": 1.3815, "sortino": 2.7128, "return_pct": 6.27, "equity": 1062.72, "max_dd": 5.53, "win_rate": 52.94, "profit_factor": 1.24, "ic": 0.0146, "hit": 52.94, "n": 102, "precision": 0.5102, "recall": 0.5102, "f1": 0.5102, "f2": 0.5102, "mcc": 0.0574, "accuracy": 0.5294, "tp": 25, "fp": 24, "tn": 29, "fn": 24}, {"fold": "fold_3", "regime": "Eurozone debt plateau", "sharpe": 14.4801, "sortino": 23.162, "return_pct": 43.87, "equity": 1438.67, "max_dd": 1.32, "win_rate": 85.86, "profit_factor": 11.315, "ic": 0.781, "hit": 84.16, "n": 101, "precision": 0.8654, "recall": 0.8333, "f1": 0.8491, "f2": 0.8396, "mcc": 0.6831, "accuracy": 0.8416, "tp": 45, "fp": 7, "tn": 40, "fn": 9}, {"fold": "fold_4", "regime": "Strong USD downturn", "sharpe": 15.9974, "sortino": 51.5341, "return_pct": 134.77, "equity": 2347.66, "max_dd": 0.56, "win_rate": 91.98, "profit_factor": 37.416, "ic": 0.9133, "hit": 91.41, "n": 163, "precision": 0.9268, "recall": 0.9157, "f1": 0.9212, "f2": 0.9179, "mcc": 0.8405, "accuracy": 0.9202, "tp": 76, "fp": 6, "tn": 74, "fn": 7}, {"fold": "fold_5", "regime": "Low-vol plateau", "sharpe": 14.9671, "sortino": 69.2186, "return_pct": 40.88, "equity": 1408.83, "max_dd": 0.23, "win_rate": 83.44, "profit_factor": 19.621, "ic": 0.8995, "hit": 83.44, "n": 157, "precision": 0.8158, "recall": 0.8378, "f1": 0.8267, "f2": 0.8333, "mcc": 0.6684, "accuracy": 0.8344, "tp": 62, "fp": 14, "tn": 69, "fn": 12}, {"fold": "fold_6", "regime": "EUR crisis downturn", "sharpe": 15.4214, "sortino": 64.6737, "return_pct": 97.77, "equity": 1977.7, "max_dd": 0.43, "win_rate": 81.25, "profit_factor": 17.093, "ic": 0.8759, "hit": 81.25, "n": 160, "precision": 0.8169, "recall": 0.7733, "f1": 0.7945, "f2": 0.7817, "mcc": 0.6231, "accuracy": 0.8125, "tp": 58, "fp": 13, "tn": 72, "fn": 17}, {"fold": "fold_7", "regime": "Recent mixed/upturn", "sharpe": 12.3555, "sortino": 15.1153, "return_pct": 76.46, "equity": 1764.64, "max_dd": 1.64, "win_rate": 86.62, "profit_factor": 10.084, "ic": 0.8417, "hit": 86.62, "n": 157, "precision": 0.8519, "recall": 0.8846, "f1": 0.8679, "f2": 0.8779, "mcc": 0.7331, "accuracy": 0.8662, "tp": 69, "fp": 12, "tn": 67, "fn": 9}], "val_sharpe": 8.2379, "val_psr": 1.0, "val_equity": 5282.2, "val_sortino": 10.0729, "val_return_pct": 428.22, "val_max_dd": 13.14, "val_win_rate": 76.37, "val_profit_factor": 4.222, "val_ic": 0.6755, "val_hit": 75.85, "val_precision": 0.7263, "val_recall": 0.8138, "val_f1": 0.7676, "val_f2": 0.7946, "val_mcc": 0.5357, "val_accuracy": 0.7653, "val_per_window": [{"fold": "fold_1", "regime": "Pre-crisis upturn + GFC onset", "sharpe": 2.1013, "sortino": 3.6472, "return_pct": 5.15, "equity": 1051.47, "max_dd": 2.38, "win_rate": 50.49, "profit_factor": 1.418, "ic": 0.0404, "hit": 50.0, "n": 104, "precision": 0.5054, "recall": 0.9038, "f1": 0.6483, "f2": 0.7807, "mcc": 0.0313, "accuracy": 0.5096, "tp": 47, "fp": 46, "tn": 6, "fn": 5}, {"fold": "fold_2", "regime": "Post-crash recovery", "sharpe": -1.1828, "sortino": -1.8101, "return_pct": -5.58, "equity": 944.2, "max_dd": 13.14, "win_rate": 49.51, "profit_factor": 0.829, "ic": -0.107, "hit": 49.51, "n": 103, "precision": 0.5957, "recall": 0.459, "f1": 0.5185, "f2": 0.4811, "mcc": 0.0065, "accuracy": 0.4951, "tp": 28, "fp": 19, "tn": 23, "fn": 33}, {"fold": "fold_3", "regime": "Eurozone debt plateau", "sharpe": 15.7546, "sortino": 44.1488, "return_pct": 54.8, "equity": 1547.98, "max_dd": 0.62, "win_rate": 86.54, "profit_factor": 19.97, "ic": 0.854, "hit": 84.91, "n": 106, "precision": 0.7959, "recall": 0.907, "f1": 0.8478, "f2": 0.8824, "mcc": 0.7369, "accuracy": 0.8679, "tp": 39, "fp": 10, "tn": 53, "fn": 4}, {"fold": "fold_4", "regime": "Strong USD downturn", "sharpe": 16.0356, "sortino": 56.2136, "return_pct": 46.04, "equity": 1460.43, "max_dd": 0.64, "win_rate": 88.46, "profit_factor": 28.799, "ic": 0.93, "hit": 87.62, "n": 105, "precision": 0.9048, "recall": 0.8261, "f1": 0.8636, "f2": 0.8407, "mcc": 0.768, "accuracy": 0.8857, "tp": 38, "fp": 4, "tn": 55, "fn": 8}, {"fold": "fold_5", "regime": "Low-vol plateau", "sharpe": 15.5057, "sortino": 76.6502, "return_pct": 43.16, "equity": 1431.55, "max_dd": 0.25, "win_rate": 85.05, "profit_factor": 22.684, "ic": 0.9186, "hit": 85.05, "n": 107, "precision": 0.8148, "recall": 0.88, "f1": 0.8462, "f2": 0.8661, "mcc": 0.7031, "accuracy": 0.8505, "tp": 44, "fp": 10, "tn": 47, "fn": 6}, {"fold": "fold_6", "regime": "EUR crisis downturn", "sharpe": 16.5898, "sortino": 114.9216, "return_pct": 28.58, "equity": 1285.84, "max_dd": 0.15, "win_rate": 90.2, "profit_factor": 46.67, "ic": 0.9316, "hit": 89.32, "n": 103, "precision": 0.8571, "recall": 0.9333, "f1": 0.8936, "f2": 0.917, "mcc": 0.8071, "accuracy": 0.9029, "tp": 42, "fp": 7, "tn": 51, "fn": 3}, {"fold": "fold_7", "regime": "Recent mixed/upturn", "sharpe": 14.8691, "sortino": 36.5962, "return_pct": 27.85, "equity": 1278.54, "max_dd": 0.5, "win_rate": 83.81, "profit_factor": 14.824, "ic": 0.8724, "hit": 83.81, "n": 105, "precision": 0.807, "recall": 0.8846, "f1": 0.844, "f2": 0.8679, "mcc": 0.6795, "accuracy": 0.8381, "tp": 46, "fp": 11, "tn": 42, "fn": 6}], "train_sharpe": 10.5808, "train_psr": 1.0, "train_equity": 29403848.0, "train_sortino": 85.8986, "train_return_pct": 2940284.8, "train_max_dd": 0.53, "train_win_rate": 91.57, "train_profit_factor": 64.471, "train_ic": 0.9581, "train_hit": 91.18, "train_precision": 0.9058, "train_recall": 0.9284, "train_f1": 0.9169, "train_f2": 0.9238, "train_mcc": 0.828, "train_accuracy": 0.914, "train_per_window": [{"fold": "all_train", "regime": "Training data", "sharpe": 10.5808, "sortino": 85.8986, "return_pct": 2940284.8, "equity": 29403848.0, "max_dd": 0.53, "win_rate": 91.57, "profit_factor": 64.471, "ic": 0.9581, "hit": 91.18, "n": 2348, "precision": 0.9058, "recall": 0.9284, "f1": 0.9169, "f2": 0.9238, "mcc": 0.828, "accuracy": 0.914, "tp": 1115, "fp": 116, "tn": 1031, "fn": 86}], "experiment_num": 200, "status": "DISCARD"}
{"backbone": "xgboost", "description": "Exp24 seq=20 lr=0.005", "config": {"seq_len": 20, "lr": 0.0003, "batch_size": 32, "epochs": 20, "weight_decay": 1e-05, "patience": 5, "grad_clip": 1.0, "warmup_epochs": 0, "huber_delta": 1.0, "head_dropout": 0.1, "seed": 42, "max_depth": 4, "gbm_lr": 0.005, "het_loss": false}, "composite": 7.903, "test_pos_folds": 7, "val_pos_folds": 6, "val_loss": 0.0, "elapsed_sec": 154.6, "timestamp": "2026-04-21T06:49:35", "sharpe": 8.0363, "psr": 1.0, "equity": 16624.64, "sortino": 7.7865, "return_pct": 1562.46, "max_dd": 7.54, "win_rate": 79.42, "profit_factor": 4.992, "ic": 0.7033, "hit": 79.07, "precision": 0.8043, "recall": 0.7624, "f1": 0.7828, "f2": 0.7705, "mcc": 0.586, "accuracy": 0.7929, "per_window": [{"fold": "fold_1", "regime": "Pre-crisis upturn + GFC onset", "sharpe": 0.4797, "sortino": 0.5345, "return_pct": 2.79, "equity": 1027.91, "max_dd": 7.54, "win_rate": 50.0, "profit_factor": 1.122, "ic": 0.0032, "hit": 49.46, "n": 93, "precision": 0.525, "recall": 0.4375, "f1": 0.4773, "f2": 0.4526, "mcc": 0.0154, "accuracy": 0.5054, "tp": 21, "fp": 19, "tn": 26, "fn": 27}, {"fold": "fold_2", "regime": "Post-crash recovery", "sharpe": 1.3689, "sortino": 2.6709, "return_pct": 5.98, "equity": 1059.78, "max_dd": 3.43, "win_rate": 52.58, "profit_factor": 1.239, "ic": 0.0054, "hit": 52.58, "n": 97, "precision": 0.5128, "recall": 0.4255, "f1": 0.4651, "f2": 0.4405, "mcc": 0.0464, "accuracy": 0.5258, "tp": 20, "fp": 19, "tn": 31, "fn": 27}, {"fold": "fold_3", "regime": "Eurozone debt plateau", "sharpe": 15.8602, "sortino": 24.7035, "return_pct": 44.47, "equity": 1444.66, "max_dd": 1.32, "win_rate": 88.3, "profit_factor": 15.699, "ic": 0.8237, "hit": 86.46, "n": 96, "precision": 0.8776, "recall": 0.86, "f1": 0.8687, "f2": 0.8635, "mcc": 0.7291, "accuracy": 0.8646, "tp": 43, "fp": 6, "tn": 40, "fn": 7}, {"fold": "fold_4", "regime": "Strong USD downturn", "sharpe": 15.0987, "sortino": 30.7115, "return_pct": 124.34, "equity": 2243.39, "max_dd": 0.97, "win_rate": 91.72, "profit_factor": 24.672, "ic": 0.8955, "hit": 91.14, "n": 158, "precision": 0.9342, "recall": 0.8987, "f1": 0.9161, "f2": 0.9056, "mcc": 0.836, "accuracy": 0.9177, "tp": 71, "fp": 5, "tn": 74, "fn": 8}, {"fold": "fold_5", "regime": "Low-vol plateau", "sharpe": 15.6564, "sortino": 69.1159, "return_pct": 40.7, "equity": 1407.02, "max_dd": 0.23, "win_rate": 86.18, "profit_factor": 25.576, "ic": 0.9131, "hit": 86.18, "n": 152, "precision": 0.8451, "recall": 0.8571, "f1": 0.8511, "f2": 0.8547, "mcc": 0.7223, "accuracy": 0.8618, "tp": 60, "fp": 11, "tn": 71, "fn": 10}, {"fold": "fold_6", "regime": "EUR crisis downturn", "sharpe": 14.1479, "sortino": 43.1637, "return_pct": 88.11, "equity": 1881.09, "max_dd": 0.76, "win_rate": 80.0, "profit_factor": 12.547, "ic": 0.8852, "hit": 80.0, "n": 155, "precision": 0.806, "recall": 0.75, "f1": 0.777, "f2": 0.7606, "mcc": 0.5974, "accuracy": 0.8, "tp": 54, "fp": 13, "tn": 70, "fn": 18}, {"fold": "fold_7", "regime": "Recent mixed/upturn", "sharpe": 13.6004, "sortino": 15.1035, "return_pct": 77.91, "equity": 1779.11, "max_dd": 1.64, "win_rate": 88.82, "profit_factor": 14.147, "ic": 0.8632, "hit": 88.82, "n": 152, "precision": 0.8831, "recall": 0.8947, "f1": 0.8889, "f2": 0.8924, "mcc": 0.7764, "accuracy": 0.8882, "tp": 68, "fp": 9, "tn": 67, "fn": 8}], "val_sharpe": 8.003, "val_psr": 1.0, "val_equity": 4668.95, "val_sortino": 9.9902, "val_return_pct": 366.89, "val_max_dd": 15.73, "val_win_rate": 76.77, "val_profit_factor": 4.03, "val_ic": 0.6869, "val_hit": 76.22, "val_precision": 0.7354, "val_recall": 0.8, "val_f1": 0.7663, "val_f2": 0.7862, "val_mcc": 0.5413, "val_accuracy": 0.7693, "val_per_window": [{"fold": "fold_1", "regime": "Pre-crisis upturn + GFC onset", "sharpe": 1.7503, "sortino": 3.0994, "return_pct": 4.08, "equity": 1040.85, "max_dd": 4.11, "win_rate": 48.98, "profit_factor": 1.338, "ic": 0.0255, "hit": 48.48, "n": 99, "precision": 0.4935, "recall": 0.7755, "f1": 0.6032, "f2": 0.696, "mcc": -0.0054, "accuracy": 0.4949, "tp": 38, "fp": 39, "tn": 11, "fn": 11}, {"fold": "fold_2", "regime": "Post-crash recovery", "sharpe": -2.6853, "sortino": -4.152, "return_pct": -10.78, "equity": 892.2, "max_dd": 15.73, "win_rate": 45.92, "profit_factor": 0.652, "ic": -0.0998, "hit": 45.92, "n": 98, "precision": 0.5385, "recall": 0.4912, "f1": 0.5138, "f2": 0.5, "mcc": -0.093, "accuracy": 0.4592, "tp": 28, "fp": 24, "tn": 17, "fn": 29}, {"fold": "fold_3", "regime": "Eurozone debt plateau", "sharpe": 16.1421, "sortino": 44.064, "return_pct": 53.44, "equity": 1534.43, "max_dd": 0.62, "win_rate": 87.88, "profit_factor": 23.659, "ic": 0.8579, "hit": 86.14, "n": 101, "precision": 0.8182, "recall": 0.9, "f1": 0.8571, "f2": 0.8824, "mcc": 0.7584, "accuracy": 0.8812, "tp": 36, "fp": 8, "tn": 53, "fn": 4}, {"fold": "fold_4", "regime": "Strong USD downturn", "sharpe": 16.4593, "sortino": 49.533, "return_pct": 45.28, "equity": 1452.8, "max_dd": 0.92, "win_rate": 89.9, "profit_factor": 29.2, "ic": 0.9226, "hit": 89.0, "n": 100, "precision": 0.9474, "recall": 0.8182, "f1": 0.878, "f2": 0.8411, "mcc": 0.8002, "accuracy": 0.9, "tp": 36, "fp": 2, "tn": 54, "fn": 8}, {"fold": "fold_5", "regime": "Low-vol plateau", "sharpe": 15.1379, "sortino": 72.1099, "return_pct": 40.07, "equity": 1400.67, "max_dd": 0.25, "win_rate": 86.27, "profit_factor": 23.15, "ic": 0.9201, "hit": 86.27, "n": 102, "precision": 0.8302, "recall": 0.898, "f1": 0.8627, "f2": 0.8835, "mcc": 0.7281, "accuracy": 0.8627, "tp": 44, "fp": 9, "tn": 44, "fn": 5}, {"fold": "fold_6", "regime": "EUR crisis downturn", "sharpe": 16.7989, "sortino": 109.2324, "return_pct": 27.2, "equity": 1271.98, "max_dd": 0.15, "win_rate": 91.75, "profit_factor": 57.23, "ic": 0.9375, "hit": 90.82, "n": 98, "precision": 0.8864, "recall": 0.9286, "f1": 0.907, "f2": 0.9198, "mcc": 0.835, "accuracy": 0.9184, "tp": 39, "fp": 5, "tn": 51, "fn": 3}, {"fold": "fold_7", "regime": "Recent mixed/upturn", "sharpe": 14.7671, "sortino": 30.4209, "return_pct": 26.59, "equity": 1265.9, "max_dd": 0.5, "win_rate": 86.0, "profit_factor": 14.15, "ic": 0.8807, "hit": 86.0, "n": 100, "precision": 0.8431, "recall": 0.8776, "f1": 0.86, "f2": 0.8704, "mcc": 0.7207, "accuracy": 0.86, "tp": 43, "fp": 8, "tn": 43, "fn": 6}], "train_sharpe": 9.5037, "train_psr": 1.0, "train_equity": 9317763.0, "train_sortino": 47.1696, "train_return_pct": 931676.3, "train_max_dd": 1.29, "train_win_rate": 85.44, "train_profit_factor": 19.908, "train_ic": 0.8779, "train_hit": 85.05, "train_precision": 0.8497, "train_recall": 0.8654, "train_f1": 0.8575, "train_f2": 0.8623, "train_mcc": 0.7054, "train_accuracy": 0.8528, "train_per_window": [{"fold": "all_train", "regime": "Training data", "sharpe": 9.5037, "sortino": 47.1696, "return_pct": 931676.3, "equity": 9317763.0, "max_dd": 1.29, "win_rate": 85.44, "profit_factor": 19.908, "ic": 0.8779, "hit": 85.05, "n": 2221, "precision": 0.8497, "recall": 0.8654, "f1": 0.8575, "f2": 0.8623, "mcc": 0.7054, "accuracy": 0.8528, "tp": 984, "fp": 174, "tn": 910, "fn": 153}], "experiment_num": 201, "status": "DISCARD"}
