{"backbone": "lstm", "description": "lstm: Exp32 bs=16 seed=99 variance check (Exp29 stability)", "config": {"seq_len": 10, "lr": 0.001, "batch_size": 16, "epochs": 100, "weight_decay": 0.001, "patience": 15, "grad_clip": 1.0, "warmup_epochs": 0, "huber_delta": 1.0, "head_dropout": 0.25, "seed": 99, "het_loss": false}, "composite": 5.4372, "test_pos_folds": 6, "val_pos_folds": 7, "val_loss": 2.8e-05, "elapsed_sec": 45.6, "timestamp": "2026-04-19T19:44:17", "sharpe": 5.5372, "psr": 1.0, "equity": 8724.45, "sortino": 9.6245, "return_pct": 772.45, "max_dd": 5.24, "win_rate": 68.94, "profit_factor": 2.868, "ic": 0.5171, "hit": 68.65, "aleatoric_mean": 1.4e-05, "epistemic_mean": 2.8e-05, "confidence_mean": 1.0, "precision": 0.6351, "recall": 0.8649, "f1": 0.7324, "f2": 0.8065, "mcc": 0.4041, "accuracy": 0.6876, "per_window": [{"fold": "fold_1", "regime": "Pre-crisis upturn + GFC onset", "sharpe": 3.5345, "sortino": 10.739, "return_pct": 29.57, "equity": 1295.74, "max_dd": 3.69, "win_rate": 58.82, "profit_factor": 2.374, "ic": 0.1388, "hit": 58.25, "n": 103, "precision": 0.5625, "recall": 0.8491, "f1": 0.6767, "f2": 0.7705, "mcc": 0.1789, "accuracy": 0.5825, "tp": 45, "fp": 35, "tn": 15, "fn": 8, "aleatoric_mean": 1.9e-05, "epistemic_mean": 3.8e-05, "confidence_mean": 0.9999, "aleatoric_std": 1e-05, "epistemic_std": 2e-05}, {"fold": "fold_2", "regime": "Post-crash recovery", "sharpe": -0.1063, "sortino": -0.171, "return_pct": -0.78, "equity": 992.21, "max_dd": 5.24, "win_rate": 54.21, "profit_factor": 0.983, "ic": 0.1506, "hit": 54.21, "n": 107, "precision": 0.5116, "recall": 0.8627, "f1": 0.6423, "f2": 0.7586, "mcc": 0.1418, "accuracy": 0.5421, "tp": 44, "fp": 42, "tn": 14, "fn": 7, "aleatoric_mean": 1.7e-05, "epistemic_mean": 3.3e-05, "confidence_mean": 1.0, "aleatoric_std": 6e-06, "epistemic_std": 1.2e-05}, {"fold": "fold_3", "regime": "Eurozone debt plateau", "sharpe": 5.8591, "sortino": 8.7469, "return_pct": 21.37, "equity": 1213.65, "max_dd": 2.54, "win_rate": 72.12, "profit_factor": 2.517, "ic": 0.5272, "hit": 70.75, "n": 106, "precision": 0.6711, "recall": 0.8947, "f1": 0.7669, "f2": 0.8388, "mcc": 0.4256, "accuracy": 0.7075, "tp": 51, "fp": 25, "tn": 24, "fn": 6, "aleatoric_mean": 1.4e-05, "epistemic_mean": 2.9e-05, "confidence_mean": 1.0, "aleatoric_std": 5e-06, "epistemic_std": 1e-05}, {"fold": "fold_4", "regime": "Strong USD downturn", "sharpe": 7.0409, "sortino": 12.7155, "return_pct": 64.27, "equity": 1642.66, "max_dd": 2.07, "win_rate": 71.86, "profit_factor": 3.353, "ic": 0.7137, "hit": 71.43, "n": 168, "precision": 0.6535, "recall": 0.9651, "f1": 0.7793, "f2": 0.8811, "mcc": 0.4987, "accuracy": 0.7202, "tp": 83, "fp": 44, "tn": 38, "fn": 3, "aleatoric_mean": 1.1e-05, "epistemic_mean": 2.2e-05, "confidence_mean": 1.0, "aleatoric_std": 4e-06, "epistemic_std": 7e-06}, {"fold": "fold_5", "regime": "Low-vol plateau", "sharpe": 8.6951, "sortino": 19.9753, "return_pct": 28.83, "equity": 1288.32, "max_dd": 1.5, "win_rate": 69.14, "profit_factor": 4.468, "ic": 0.6446, "hit": 69.14, "n": 162, "precision": 0.6226, "recall": 0.8684, "f1": 0.7253, "f2": 0.8049, "mcc": 0.4232, "accuracy": 0.6914, "tp": 66, "fp": 40, "tn": 46, "fn": 10, "aleatoric_mean": 9e-06, "epistemic_mean": 1.9e-05, "confidence_mean": 1.0, "aleatoric_std": 4e-06, "epistemic_std": 8e-06}, {"fold": "fold_6", "regime": "EUR crisis downturn", "sharpe": 8.6776, "sortino": 14.4205, "return_pct": 61.05, "equity": 1610.52, "max_dd": 2.25, "win_rate": 72.12, "profit_factor": 4.197, "ic": 0.6382, "hit": 72.12, "n": 165, "precision": 0.6742, "recall": 0.7792, "f1": 0.7229, "f2": 0.7557, "mcc": 0.4501, "accuracy": 0.7212, "tp": 60, "fp": 29, "tn": 59, "fn": 17, "aleatoric_mean": 1.5e-05, "epistemic_mean": 2.9e-05, "confidence_mean": 1.0, "aleatoric_std": 5e-06, "epistemic_std": 1.1e-05}, {"fold": "fold_7", "regime": "Recent mixed/upturn", "sharpe": 9.8149, "sortino": 16.1221, "return_pct": 64.05, "equity": 1640.54, "max_dd": 1.64, "win_rate": 76.54, "profit_factor": 5.783, "ic": 0.6695, "hit": 76.54, "n": 162, "precision": 0.7363, "recall": 0.8272, "f1": 0.7791, "f2": 0.8072, "mcc": 0.535, "accuracy": 0.7654, "tp": 67, "fp": 24, "tn": 57, "fn": 14, "aleatoric_mean": 1.6e-05, "epistemic_mean": 3.1e-05, "confidence_mean": 1.0, "aleatoric_std": 5e-06, "epistemic_std": 1e-05}], "val_sharpe": 5.8577, "val_psr": 1.0, "val_equity": 3654.61, "val_sortino": 8.8652, "val_return_pct": 265.46, "val_max_dd": 8.86, "val_win_rate": 65.92, "val_profit_factor": 2.733, "val_ic": 0.4871, "val_hit": 65.49, "val_aleatoric_mean": 1.1e-05, "val_epistemic_mean": 2.1e-05, "val_confidence_mean": 1.0, "val_precision": 0.592, "val_recall": 0.8904, "val_f1": 0.7112, "val_f2": 0.8089, "val_mcc": 0.3701, "val_accuracy": 0.6562, "val_per_window": [{"fold": "fold_1", "regime": "Pre-crisis upturn + GFC onset", "sharpe": 1.8422, "sortino": 3.2171, "return_pct": 4.65, "equity": 1046.52, "max_dd": 2.95, "win_rate": 49.07, "profit_factor": 1.358, "ic": 0.0486, "hit": 48.62, "n": 109, "precision": 0.4947, "recall": 0.8545, "f1": 0.6267, "f2": 0.746, "mcc": -0.0513, "accuracy": 0.4862, "tp": 47, "fp": 48, "tn": 6, "fn": 8, "aleatoric_mean": 9e-06, "epistemic_mean": 1.7e-05, "confidence_mean": 1.0, "aleatoric_std": 3e-06, "epistemic_std": 7e-06}, {"fold": "fold_2", "regime": "Post-crash recovery", "sharpe": 0.4203, "sortino": 0.6575, "return_pct": 1.78, "equity": 1017.8, "max_dd": 8.86, "win_rate": 51.85, "profit_factor": 1.069, "ic": -0.0883, "hit": 51.85, "n": 108, "precision": 0.5632, "recall": 0.7778, "f1": 0.6533, "f2": 0.7227, "mcc": -0.083, "accuracy": 0.5185, "tp": 49, "fp": 38, "tn": 7, "fn": 14, "aleatoric_mean": 1.5e-05, "epistemic_mean": 2.9e-05, "confidence_mean": 1.0, "aleatoric_std": 6e-06, "epistemic_std": 1.2e-05}, {"fold": "fold_3", "regime": "Eurozone debt plateau", "sharpe": 7.2024, "sortino": 16.0408, "return_pct": 30.14, "equity": 1301.44, "max_dd": 2.04, "win_rate": 62.39, "profit_factor": 3.274, "ic": 0.6848, "hit": 61.26, "n": 111, "precision": 0.5222, "recall": 1.0, "f1": 0.6861, "f2": 0.8453, "mcc": 0.4139, "accuracy": 0.6126, "tp": 47, "fp": 43, "tn": 21, "fn": 0, "aleatoric_mean": 1.1e-05, "epistemic_mean": 2.2e-05, "confidence_mean": 1.0, "aleatoric_std": 5e-06, "epistemic_std": 9e-06}, {"fold": "fold_4", "regime": "Strong USD downturn", "sharpe": 8.8556, "sortino": 18.7827, "return_pct": 30.66, "equity": 1306.61, "max_dd": 1.46, "win_rate": 72.48, "profit_factor": 4.548, "ic": 0.748, "hit": 71.82, "n": 110, "precision": 0.6232, "recall": 0.9149, "f1": 0.7414, "f2": 0.8366, "mcc": 0.5138, "accuracy": 0.7273, "tp": 43, "fp": 26, "tn": 37, "fn": 4, "aleatoric_mean": 1.1e-05, "epistemic_mean": 2.2e-05, "confidence_mean": 1.0, "aleatoric_std": 4e-06, "epistemic_std": 7e-06}, {"fold": "fold_5", "regime": "Low-vol plateau", "sharpe": 9.0698, "sortino": 23.4478, "return_pct": 29.91, "equity": 1299.06, "max_dd": 1.12, "win_rate": 69.64, "profit_factor": 4.784, "ic": 0.6985, "hit": 69.64, "n": 112, "precision": 0.6203, "recall": 0.9245, "f1": 0.7424, "f2": 0.8419, "mcc": 0.4557, "accuracy": 0.6964, "tp": 49, "fp": 30, "tn": 29, "fn": 4, "aleatoric_mean": 9e-06, "epistemic_mean": 1.8e-05, "confidence_mean": 1.0, "aleatoric_std": 3e-06, "epistemic_std": 7e-06}, {"fold": "fold_6", "regime": "EUR crisis downturn", "sharpe": 11.9771, "sortino": 29.3617, "return_pct": 24.41, "equity": 1244.05, "max_dd": 0.45, "win_rate": 80.37, "profit_factor": 9.218, "ic": 0.7637, "hit": 79.63, "n": 108, "precision": 0.7193, "recall": 0.8723, "f1": 0.7885, "f2": 0.8367, "mcc": 0.6058, "accuracy": 0.7963, "tp": 41, "fp": 16, "tn": 45, "fn": 6, "aleatoric_mean": 9e-06, "epistemic_mean": 1.8e-05, "confidence_mean": 1.0, "aleatoric_std": 3e-06, "epistemic_std": 5e-06}, {"fold": "fold_7", "regime": "Recent mixed/upturn", "sharpe": 11.4288, "sortino": 25.6365, "return_pct": 24.85, "equity": 1248.5, "max_dd": 0.69, "win_rate": 75.45, "profit_factor": 6.851, "ic": 0.7177, "hit": 75.45, "n": 110, "precision": 0.6806, "recall": 0.9245, "f1": 0.784, "f2": 0.8627, "mcc": 0.5475, "accuracy": 0.7545, "tp": 49, "fp": 23, "tn": 34, "fn": 4, "aleatoric_mean": 1.2e-05, "epistemic_mean": 2.3e-05, "confidence_mean": 1.0, "aleatoric_std": 4e-06, "epistemic_std": 8e-06}], "train_sharpe": 5.3608, "train_psr": 1.0, "train_equity": 473326.44, "train_sortino": 12.9603, "train_return_pct": 47232.64, "train_max_dd": 7.08, "train_win_rate": 68.35, "train_profit_factor": 3.492, "train_ic": 0.5958, "train_hit": 68.08, "train_precision": 0.6293, "train_recall": 0.9246, "train_f1": 0.7489, "train_f2": 0.8453, "train_mcc": 0.4049, "train_accuracy": 0.6812, "train_per_window": [{"fold": "all_train", "regime": "Training data", "sharpe": 5.3608, "sortino": 12.9603, "return_pct": 47232.64, "equity": 473326.44, "max_dd": 7.08, "win_rate": 68.35, "profit_factor": 3.492, "ic": 0.5958, "hit": 68.08, "n": 2478, "precision": 0.6293, "recall": 0.9246, "f1": 0.7489, "f2": 0.8453, "mcc": 0.4049, "accuracy": 0.6812, "tp": 1178, "fp": 694, "tn": 510, "fn": 96}], "experiment_num": 137, "status": "DISCARD"}
{"backbone": "lstm", "description": "lstm: Exp33 bs=24 midpoint bs=32/bs=16 (Smith 2018 linear scaling)", "config": {"seq_len": 10, "lr": 0.001, "batch_size": 24, "epochs": 100, "weight_decay": 0.001, "patience": 15, "grad_clip": 1.0, "warmup_epochs": 0, "huber_delta": 1.0, "head_dropout": 0.25, "seed": 42, "het_loss": false}, "composite": 6.0024, "test_pos_folds": 7, "val_pos_folds": 7, "val_loss": 2.8e-05, "elapsed_sec": 39.5, "timestamp": "2026-04-19T19:45:39", "sharpe": 6.0024, "psr": 1.0, "equity": 10255.02, "sortino": 11.0514, "return_pct": 925.5, "max_dd": 6.38, "win_rate": 69.35, "profit_factor": 3.155, "ic": 0.5306, "hit": 69.06, "aleatoric_mean": 8e-06, "epistemic_mean": 1.7e-05, "confidence_mean": 1.0, "precision": 0.6353, "recall": 0.8836, "f1": 0.7391, "f2": 0.8195, "mcc": 0.4182, "accuracy": 0.6917, "per_window": [{"fold": "fold_1", "regime": "Pre-crisis upturn + GFC onset", "sharpe": 3.4707, "sortino": 11.0454, "return_pct": 28.98, "equity": 1289.82, "max_dd": 3.8, "win_rate": 57.84, "profit_factor": 2.334, "ic": 0.1415, "hit": 57.28, "n": 103, "precision": 0.5556, "recall": 0.8491, "f1": 0.6716, "f2": 0.7679, "mcc": 0.1574, "accuracy": 0.5728, "tp": 45, "fp": 36, "tn": 14, "fn": 8, "aleatoric_mean": 1.1e-05, "epistemic_mean": 2.3e-05, "confidence_mean": 1.0, "aleatoric_std": 5e-06, "epistemic_std": 1e-05}, {"fold": "fold_2", "regime": "Post-crash recovery", "sharpe": 0.1435, "sortino": 0.2463, "return_pct": 0.42, "equity": 1004.18, "max_dd": 5.68, "win_rate": 51.4, "profit_factor": 1.023, "ic": 0.0788, "hit": 51.4, "n": 107, "precision": 0.4943, "recall": 0.8431, "f1": 0.6232, "f2": 0.7388, "mcc": 0.0736, "accuracy": 0.514, "tp": 43, "fp": 44, "tn": 12, "fn": 8, "aleatoric_mean": 9e-06, "epistemic_mean": 1.9e-05, "confidence_mean": 1.0, "aleatoric_std": 4e-06, "epistemic_std": 8e-06}, {"fold": "fold_3", "regime": "Eurozone debt plateau", "sharpe": 5.0952, "sortino": 8.7086, "return_pct": 18.62, "equity": 1186.17, "max_dd": 4.67, "win_rate": 68.27, "profit_factor": 2.23, "ic": 0.5437, "hit": 66.98, "n": 106, "precision": 0.6222, "recall": 0.9825, "f1": 0.7619, "f2": 0.8805, "mcc": 0.4019, "accuracy": 0.6698, "tp": 56, "fp": 34, "tn": 15, "fn": 1, "aleatoric_mean": 9e-06, "epistemic_mean": 1.9e-05, "confidence_mean": 1.0, "aleatoric_std": 4e-06, "epistemic_std": 8e-06}, {"fold": "fold_4", "regime": "Strong USD downturn", "sharpe": 10.9861, "sortino": 17.772, "return_pct": 101.06, "equity": 2010.63, "max_dd": 1.81, "win_rate": 82.63, "profit_factor": 7.287, "ic": 0.7593, "hit": 82.14, "n": 168, "precision": 0.7822, "recall": 0.9186, "f1": 0.8449, "f2": 0.8876, "mcc": 0.6639, "accuracy": 0.8274, "tp": 79, "fp": 22, "tn": 60, "fn": 7, "aleatoric_mean": 7e-06, "epistemic_mean": 1.3e-05, "confidence_mean": 1.0, "aleatoric_std": 3e-06, "epistemic_std": 6e-06}, {"fold": "fold_5", "regime": "Low-vol plateau", "sharpe": 7.879, "sortino": 15.635, "return_pct": 26.41, "equity": 1264.13, "max_dd": 1.33, "win_rate": 67.28, "profit_factor": 3.842, "ic": 0.7144, "hit": 67.28, "n": 162, "precision": 0.595, "recall": 0.9474, "f1": 0.731, "f2": 0.8471, "mcc": 0.4334, "accuracy": 0.6728, "tp": 72, "fp": 49, "tn": 37, "fn": 4, "aleatoric_mean": 6e-06, "epistemic_mean": 1.2e-05, "confidence_mean": 1.0, "aleatoric_std": 2e-06, "epistemic_std": 4e-06}, {"fold": "fold_6", "regime": "EUR crisis downturn", "sharpe": 9.6391, "sortino": 19.4176, "return_pct": 67.52, "equity": 1675.18, "max_dd": 2.26, "win_rate": 73.94, "profit_factor": 4.982, "ic": 0.7215, "hit": 73.94, "n": 165, "precision": 0.6735, "recall": 0.8571, "f1": 0.7543, "f2": 0.8128, "mcc": 0.5013, "accuracy": 0.7394, "tp": 66, "fp": 32, "tn": 56, "fn": 11, "aleatoric_mean": 9e-06, "epistemic_mean": 1.8e-05, "confidence_mean": 1.0, "aleatoric_std": 3e-06, "epistemic_std": 7e-06}, {"fold": "fold_7", "regime": "Recent mixed/upturn", "sharpe": 8.6366, "sortino": 13.935, "return_pct": 56.77, "equity": 1567.7, "max_dd": 1.64, "win_rate": 72.84, "profit_factor": 4.568, "ic": 0.6288, "hit": 72.84, "n": 162, "precision": 0.7033, "recall": 0.7901, "f1": 0.7442, "f2": 0.7711, "mcc": 0.4603, "accuracy": 0.7284, "tp": 64, "fp": 27, "tn": 54, "fn": 17, "aleatoric_mean": 9e-06, "epistemic_mean": 1.7e-05, "confidence_mean": 1.0, "aleatoric_std": 3e-06, "epistemic_std": 6e-06}], "val_sharpe": 6.6419, "val_psr": 1.0, "val_equity": 4246.22, "val_sortino": 9.9618, "val_return_pct": 324.62, "val_max_dd": 7.0, "val_win_rate": 66.97, "val_profit_factor": 3.146, "val_ic": 0.5739, "val_hit": 66.54, "val_aleatoric_mean": 7e-06, "val_epistemic_mean": 1.4e-05, "val_confidence_mean": 1.0, "val_precision": 0.6011, "val_recall": 0.8877, "val_f1": 0.7168, "val_f2": 0.8104, "val_mcc": 0.3866, "val_accuracy": 0.6667, "val_per_window": [{"fold": "fold_1", "regime": "Pre-crisis upturn + GFC onset", "sharpe": 0.6157, "sortino": 0.9847, "return_pct": 1.49, "equity": 1014.91, "max_dd": 4.01, "win_rate": 49.07, "profit_factor": 1.107, "ic": 0.0296, "hit": 48.62, "n": 109, "precision": 0.495, "recall": 0.9091, "f1": 0.641, "f2": 0.7788, "mcc": -0.0678, "accuracy": 0.4862, "tp": 50, "fp": 51, "tn": 3, "fn": 5, "aleatoric_mean": 8e-06, "epistemic_mean": 1.6e-05, "confidence_mean": 1.0, "aleatoric_std": 5e-06, "epistemic_std": 1e-05}, {"fold": "fold_2", "regime": "Post-crash recovery", "sharpe": 0.4956, "sortino": 0.7711, "return_pct": 2.15, "equity": 1021.53, "max_dd": 7.0, "win_rate": 51.85, "profit_factor": 1.081, "ic": 0.0292, "hit": 51.85, "n": 108, "precision": 0.5753, "recall": 0.6667, "f1": 0.6176, "f2": 0.6462, "mcc": -0.0234, "accuracy": 0.5185, "tp": 42, "fp": 31, "tn": 14, "fn": 21, "aleatoric_mean": 8e-06, "epistemic_mean": 1.7e-05, "confidence_mean": 1.0, "aleatoric_std": 3e-06, "epistemic_std": 6e-06}, {"fold": "fold_3", "regime": "Eurozone debt plateau", "sharpe": 12.3075, "sortino": 32.1238, "return_pct": 47.94, "equity": 1479.37, "max_dd": 0.95, "win_rate": 77.06, "profit_factor": 8.477, "ic": 0.8391, "hit": 75.68, "n": 111, "precision": 0.6567, "recall": 0.9362, "f1": 0.7719, "f2": 0.8627, "mcc": 0.5826, "accuracy": 0.7658, "tp": 44, "fp": 23, "tn": 41, "fn": 3, "aleatoric_mean": 6e-06, "epistemic_mean": 1.3e-05, "confidence_mean": 1.0, "aleatoric_std": 2e-06, "epistemic_std": 4e-06}, {"fold": "fold_4", "regime": "Strong USD downturn", "sharpe": 9.6136, "sortino": 23.6988, "return_pct": 32.9, "equity": 1329.03, "max_dd": 1.34, "win_rate": 71.56, "profit_factor": 5.249, "ic": 0.7806, "hit": 70.91, "n": 110, "precision": 0.6, "recall": 0.9574, "f1": 0.7377, "f2": 0.8555, "mcc": 0.5111, "accuracy": 0.7091, "tp": 45, "fp": 30, "tn": 33, "fn": 2, "aleatoric_mean": 7e-06, "epistemic_mean": 1.4e-05, "confidence_mean": 1.0, "aleatoric_std": 3e-06, "epistemic_std": 5e-06}, {"fold": "fold_5", "regime": "Low-vol plateau", "sharpe": 10.9961, "sortino": 37.5695, "return_pct": 35.05, "equity": 1350.54, "max_dd": 0.9, "win_rate": 71.43, "profit_factor": 7.029, "ic": 0.7873, "hit": 71.43, "n": 112, "precision": 0.64, "recall": 0.9057, "f1": 0.75, "f2": 0.8362, "mcc": 0.4756, "accuracy": 0.7143, "tp": 48, "fp": 27, "tn": 32, "fn": 5, "aleatoric_mean": 6e-06, "epistemic_mean": 1.2e-05, "confidence_mean": 1.0, "aleatoric_std": 2e-06, "epistemic_std": 4e-06}, {"fold": "fold_6", "regime": "EUR crisis downturn", "sharpe": 13.2769, "sortino": 68.7099, "return_pct": 26.19, "equity": 1261.94, "max_dd": 0.33, "win_rate": 76.64, "profit_factor": 12.957, "ic": 0.8696, "hit": 75.93, "n": 108, "precision": 0.6522, "recall": 0.9574, "f1": 0.7759, "f2": 0.8755, "mcc": 0.5822, "accuracy": 0.7593, "tp": 45, "fp": 24, "tn": 37, "fn": 2, "aleatoric_mean": 6e-06, "epistemic_mean": 1.2e-05, "confidence_mean": 1.0, "aleatoric_std": 2e-06, "epistemic_std": 4e-06}, {"fold": "fold_7", "regime": "Recent mixed/upturn", "sharpe": 9.883, "sortino": 26.978, "return_pct": 22.23, "equity": 1222.26, "max_dd": 0.72, "win_rate": 70.91, "profit_factor": 5.137, "ic": 0.7303, "hit": 70.91, "n": 110, "precision": 0.6329, "recall": 0.9434, "f1": 0.7576, "f2": 0.8591, "mcc": 0.4827, "accuracy": 0.7091, "tp": 50, "fp": 29, "tn": 28, "fn": 3, "aleatoric_mean": 8e-06, "epistemic_mean": 1.7e-05, "confidence_mean": 1.0, "aleatoric_std": 3e-06, "epistemic_std": 6e-06}], "train_sharpe": 6.2898, "train_psr": 1.0, "train_equity": 1215515.88, "train_sortino": 16.038, "train_return_pct": 121451.59, "train_max_dd": 7.27, "train_win_rate": 71.15, "train_profit_factor": 4.536, "train_ic": 0.6912, "train_hit": 70.86, "train_precision": 0.6527, "train_recall": 0.9309, "train_f1": 0.7674, "train_f2": 0.8578, "train_mcc": 0.4598, "train_accuracy": 0.7098, "train_per_window": [{"fold": "all_train", "regime": "Training data", "sharpe": 6.2898, "sortino": 16.038, "return_pct": 121451.59, "equity": 1215515.88, "max_dd": 7.27, "win_rate": 71.15, "profit_factor": 4.536, "ic": 0.6912, "hit": 70.86, "n": 2478, "precision": 0.6527, "recall": 0.9309, "f1": 0.7674, "f2": 0.8578, "mcc": 0.4598, "accuracy": 0.7098, "tp": 1186, "fp": 631, "tn": 573, "fn": 88}], "experiment_num": 138, "status": "DISCARD"}
