{"backbone": "nbeats", "description": "nbeats: Exp7 seed=0", "config": {"seq_len": 60, "lr": 0.001, "batch_size": 32, "epochs": 100, "weight_decay": 0.0001, "patience": 20, "grad_clip": 1.0, "warmup_epochs": 0, "huber_delta": 1.0, "head_dropout": 0.1, "seed": 0, "het_loss": false}, "composite": -1.9516, "test_pos_folds": 0, "val_pos_folds": 5, "val_loss": 3.2e-05, "elapsed_sec": 67.0, "timestamp": "2026-04-21T12:39:23", "sharpe": -1.0516, "psr": 0.0486, "equity": 774.03, "sortino": -1.5219, "return_pct": -22.6, "max_dd": 24.29, "win_rate": 48.79, "profit_factor": 0.838, "ic": -0.0763, "hit": 48.48, "aleatoric_mean": 1.4e-05, "epistemic_mean": 2.8e-05, "confidence_mean": 1.0, "precision": 0.4905, "recall": 0.9161, "f1": 0.6389, "f2": 0.7806, "mcc": -0.0514, "accuracy": 0.4848, "per_window": [{"fold": "fold_1", "regime": "Pre-crisis upturn + GFC onset", "sharpe": -0.032, "sortino": -0.0568, "return_pct": -0.17, "equity": 998.26, "max_dd": 3.8, "win_rate": 48.08, "profit_factor": 0.995, "ic": -0.1111, "hit": 47.17, "n": 53, "precision": 0.4808, "recall": 0.9615, "f1": 0.641, "f2": 0.8013, "mcc": -0.1413, "accuracy": 0.4717, "tp": 25, "fp": 27, "tn": 0, "fn": 1, "aleatoric_mean": 1.4e-05, "epistemic_mean": 2.8e-05, "confidence_mean": 1.0, "aleatoric_std": 4e-06, "epistemic_std": 8e-06}, {"fold": "fold_2", "regime": "Post-crash recovery", "sharpe": -3.0573, "sortino": -4.6599, "return_pct": -8.39, "equity": 916.09, "max_dd": 9.66, "win_rate": 47.37, "profit_factor": 0.612, "ic": -0.258, "hit": 47.37, "n": 57, "precision": 0.5094, "recall": 0.871, "f1": 0.6429, "f2": 0.7627, "mcc": -0.2516, "accuracy": 0.4737, "tp": 27, "fp": 26, "tn": 0, "fn": 4, "aleatoric_mean": 1.4e-05, "epistemic_mean": 2.7e-05, "confidence_mean": 1.0, "aleatoric_std": 5e-06, "epistemic_std": 1e-05}, {"fold": "fold_3", "regime": "Eurozone debt plateau", "sharpe": -0.0318, "sortino": -0.0619, "return_pct": -0.13, "equity": 998.73, "max_dd": 5.4, "win_rate": 59.26, "profit_factor": 0.995, "ic": -0.1874, "hit": 57.14, "n": 56, "precision": 0.58, "recall": 0.9062, "f1": 0.7073, "f2": 0.8146, "mcc": 0.05, "accuracy": 0.5714, "tp": 29, "fp": 21, "tn": 3, "fn": 3, "aleatoric_mean": 1.4e-05, "epistemic_mean": 2.8e-05, "confidence_mean": 1.0, "aleatoric_std": 5e-06, "epistemic_std": 1.1e-05}, {"fold": "fold_4", "regime": "Strong USD downturn", "sharpe": -0.4892, "sortino": -0.7631, "return_pct": -2.71, "equity": 972.9, "max_dd": 8.43, "win_rate": 49.57, "profit_factor": 0.921, "ic": -0.0076, "hit": 49.15, "n": 118, "precision": 0.5, "recall": 0.9, "f1": 0.6429, "f2": 0.7759, "mcc": -0.0557, "accuracy": 0.4915, "tp": 54, "fp": 54, "tn": 4, "fn": 6, "aleatoric_mean": 1.4e-05, "epistemic_mean": 2.8e-05, "confidence_mean": 1.0, "aleatoric_std": 5e-06, "epistemic_std": 9e-06}, {"fold": "fold_5", "regime": "Low-vol plateau", "sharpe": -0.3262, "sortino": -0.5614, "return_pct": -0.79, "equity": 992.11, "max_dd": 2.68, "win_rate": 45.54, "profit_factor": 0.947, "ic": -0.0291, "hit": 45.54, "n": 112, "precision": 0.45, "recall": 0.8824, "f1": 0.596, "f2": 0.7401, "mcc": -0.0311, "accuracy": 0.4554, "tp": 45, "fp": 55, "tn": 6, "fn": 6, "aleatoric_mean": 1.4e-05, "epistemic_mean": 2.8e-05, "confidence_mean": 1.0, "aleatoric_std": 4e-06, "epistemic_std": 9e-06}, {"fold": "fold_6", "regime": "EUR crisis downturn", "sharpe": -2.4467, "sortino": -3.8832, "return_pct": -10.52, "equity": 894.77, "max_dd": 13.2, "win_rate": 46.96, "profit_factor": 0.679, "ic": -0.0108, "hit": 46.96, "n": 115, "precision": 0.4636, "recall": 0.9623, "f1": 0.6258, "f2": 0.7919, "mcc": 0.026, "accuracy": 0.4696, "tp": 51, "fp": 59, "tn": 3, "fn": 2, "aleatoric_mean": 1.4e-05, "epistemic_mean": 2.9e-05, "confidence_mean": 1.0, "aleatoric_std": 5e-06, "epistemic_std": 9e-06}, {"fold": "fold_7", "regime": "Recent mixed/upturn", "sharpe": -0.4105, "sortino": -0.5338, "return_pct": -1.87, "equity": 981.27, "max_dd": 5.09, "win_rate": 49.11, "profit_factor": 0.932, "ic": -0.0948, "hit": 49.11, "n": 112, "precision": 0.5, "recall": 0.9298, "f1": 0.6503, "f2": 0.7934, "mcc": -0.0751, "accuracy": 0.4911, "tp": 53, "fp": 53, "tn": 2, "fn": 4, "aleatoric_mean": 1.4e-05, "epistemic_mean": 2.8e-05, "confidence_mean": 1.0, "aleatoric_std": 5e-06, "epistemic_std": 9e-06}], "val_sharpe": 0.5405, "val_psr": 0.7573, "val_equity": 1064.95, "val_sortino": 0.865, "val_return_pct": 6.49, "val_max_dd": 9.46, "val_win_rate": 50.48, "val_profit_factor": 1.094, "val_ic": -0.038, "val_hit": 50.24, "val_aleatoric_mean": 1.4e-05, "val_epistemic_mean": 2.8e-05, "val_confidence_mean": 1.0, "val_precision": 0.4974, "val_recall": 0.932, "val_f1": 0.6486, "val_f2": 0.7934, "val_mcc": 0.0319, "val_accuracy": 0.5024, "val_per_window": [{"fold": "fold_1", "regime": "Pre-crisis upturn + GFC onset", "sharpe": 2.5882, "sortino": 3.9536, "return_pct": 4.08, "equity": 1040.78, "max_dd": 2.95, "win_rate": 56.9, "profit_factor": 1.532, "ic": -0.0791, "hit": 55.93, "n": 59, "precision": 0.5472, "recall": 0.9355, "f1": 0.6905, "f2": 0.8192, "mcc": 0.1294, "accuracy": 0.5593, "tp": 29, "fp": 24, "tn": 4, "fn": 2, "aleatoric_mean": 1.4e-05, "epistemic_mean": 2.8e-05, "confidence_mean": 1.0, "aleatoric_std": 5e-06, "epistemic_std": 9e-06}, {"fold": "fold_2", "regime": "Post-crash recovery", "sharpe": 1.4544, "sortino": 2.1726, "return_pct": 2.8, "equity": 1027.96, "max_dd": 2.18, "win_rate": 55.17, "profit_factor": 1.265, "ic": 0.1617, "hit": 55.17, "n": 58, "precision": 0.5455, "recall": 0.9677, "f1": 0.6977, "f2": 0.838, "mcc": 0.0942, "accuracy": 0.5517, "tp": 30, "fp": 25, "tn": 2, "fn": 1, "aleatoric_mean": 1.4e-05, "epistemic_mean": 2.8e-05, "confidence_mean": 1.0, "aleatoric_std": 4e-06, "epistemic_std": 8e-06}, {"fold": "fold_3", "regime": "Eurozone debt plateau", "sharpe": 1.8376, "sortino": 3.766, "return_pct": 4.29, "equity": 1042.89, "max_dd": 3.3, "win_rate": 47.54, "profit_factor": 1.359, "ic": -0.0467, "hit": 47.54, "n": 61, "precision": 0.4545, "recall": 0.9259, "f1": 0.6098, "f2": 0.7669, "mcc": 0.0727, "accuracy": 0.4754, "tp": 25, "fp": 30, "tn": 4, "fn": 2, "aleatoric_mean": 1.4e-05, "epistemic_mean": 2.7e-05, "confidence_mean": 1.0, "aleatoric_std": 5e-06, "epistemic_std": 1e-05}, {"fold": "fold_4", "regime": "Strong USD downturn", "sharpe": -1.9098, "sortino": -3.1981, "return_pct": -4.16, "equity": 958.36, "max_dd": 5.62, "win_rate": 46.67, "profit_factor": 0.746, "ic": -0.136, "hit": 46.67, "n": 60, "precision": 0.4727, "recall": 0.8966, "f1": 0.619, "f2": 0.7602, "mcc": -0.0704, "accuracy": 0.4667, "tp": 26, "fp": 29, "tn": 2, "fn": 3, "aleatoric_mean": 1.3e-05, "epistemic_mean": 2.7e-05, "confidence_mean": 1.0, "aleatoric_std": 4e-06, "epistemic_std": 8e-06}, {"fold": "fold_5", "regime": "Low-vol plateau", "sharpe": 0.1117, "sortino": 0.1739, "return_pct": 0.13, "equity": 1001.33, "max_dd": 3.51, "win_rate": 51.61, "profit_factor": 1.018, "ic": -0.1337, "hit": 51.61, "n": 62, "precision": 0.5167, "recall": 0.9688, "f1": 0.6739, "f2": 0.8245, "mcc": 0.0059, "accuracy": 0.5161, "tp": 31, "fp": 29, "tn": 1, "fn": 1, "aleatoric_mean": 1.5e-05, "epistemic_mean": 3e-05, "confidence_mean": 1.0, "aleatoric_std": 5e-06, "epistemic_std": 1e-05}, {"fold": "fold_6", "regime": "EUR crisis downturn", "sharpe": -4.2285, "sortino": -5.8184, "return_pct": -4.2, "equity": 958.03, "max_dd": 4.19, "win_rate": 38.6, "profit_factor": 0.498, "ic": -0.0323, "hit": 37.93, "n": 58, "precision": 0.3889, "recall": 0.875, "f1": 0.5385, "f2": 0.7, "mcc": -0.1858, "accuracy": 0.3793, "tp": 21, "fp": 33, "tn": 1, "fn": 3, "aleatoric_mean": 1.4e-05, "epistemic_mean": 2.8e-05, "confidence_mean": 1.0, "aleatoric_std": 4e-06, "epistemic_std": 8e-06}, {"fold": "fold_7", "regime": "Recent mixed/upturn", "sharpe": 3.0072, "sortino": 6.1745, "return_pct": 3.82, "equity": 1038.17, "max_dd": 1.36, "win_rate": 56.67, "profit_factor": 1.635, "ic": -0.0087, "hit": 56.67, "n": 60, "precision": 0.5556, "recall": 0.9375, "f1": 0.6977, "f2": 0.8242, "mcc": 0.1336, "accuracy": 0.5667, "tp": 30, "fp": 24, "tn": 4, "fn": 2, "aleatoric_mean": 1.5e-05, "epistemic_mean": 3e-05, "confidence_mean": 1.0, "aleatoric_std": 5e-06, "epistemic_std": 1e-05}], "train_sharpe": 0.3601, "train_psr": 0.8075, "train_equity": 1235.2, "train_sortino": 0.4683, "train_return_pct": 23.52, "train_max_dd": 18.43, "train_win_rate": 52.15, "train_profit_factor": 1.086, "train_ic": 0.0217, "train_hit": 51.88, "train_precision": 0.5188, "train_recall": 1.0, "train_f1": 0.6832, "train_f2": 0.8435, "train_mcc": 0.0, "train_accuracy": 0.5188, "train_per_window": [{"fold": "all_train", "regime": "Training data", "sharpe": 0.3601, "sortino": 0.4683, "return_pct": 23.52, "equity": 1235.2, "max_dd": 18.43, "win_rate": 52.15, "profit_factor": 1.086, "ic": 0.0217, "hit": 51.88, "n": 1382, "precision": 0.5188, "recall": 1.0, "f1": 0.6832, "f2": 0.8435, "mcc": 0.0, "accuracy": 0.5188, "tp": 717, "fp": 665, "tn": 0, "fn": 0}], "experiment_num": 249, "status": "DISCARD"}
{"backbone": "nbeats", "description": "nbeats: Exp8 seed=13 variance", "config": {"seq_len": 60, "lr": 0.001, "batch_size": 32, "epochs": 100, "weight_decay": 0.0001, "patience": 20, "grad_clip": 1.0, "warmup_epochs": 0, "huber_delta": 1.0, "head_dropout": 0.1, "seed": 13, "het_loss": false}, "composite": -1.9549, "test_pos_folds": 2, "val_pos_folds": 2, "val_loss": 3.3e-05, "elapsed_sec": 40.2, "timestamp": "2026-04-21T12:40:13", "sharpe": -0.9549, "psr": 0.065, "equity": 791.61, "sortino": -1.3578, "return_pct": -20.84, "max_dd": 25.74, "win_rate": 50.24, "profit_factor": 0.852, "ic": -0.0513, "hit": 49.92, "aleatoric_mean": 0.000273, "epistemic_mean": 0.000546, "confidence_mean": 0.9992, "precision": 0.5015, "recall": 0.5258, "f1": 0.5134, "f2": 0.5208, "mcc": 0.0082, "accuracy": 0.504, "per_window": [{"fold": "fold_1", "regime": "Pre-crisis upturn + GFC onset", "sharpe": -0.2336, "sortino": -0.4304, "return_pct": -0.6, "equity": 994.01, "max_dd": 4.66, "win_rate": 46.15, "profit_factor": 0.965, "ic": -0.0689, "hit": 45.28, "n": 53, "precision": 0.4583, "recall": 0.4231, "f1": 0.44, "f2": 0.4297, "mcc": -0.0587, "accuracy": 0.4717, "tp": 11, "fp": 13, "tn": 14, "fn": 15, "aleatoric_mean": 0.000262, "epistemic_mean": 0.000524, "confidence_mean": 0.9992, "aleatoric_std": 8.2e-05, "epistemic_std": 0.000165}, {"fold": "fold_2", "regime": "Post-crash recovery", "sharpe": 0.2443, "sortino": 0.4427, "return_pct": 0.52, "equity": 1005.19, "max_dd": 6.96, "win_rate": 50.88, "profit_factor": 1.04, "ic": -0.0473, "hit": 50.88, "n": 57, "precision": 0.5429, "recall": 0.6129, "f1": 0.5758, "f2": 0.5975, "mcc": -0.0025, "accuracy": 0.5088, "tp": 19, "fp": 16, "tn": 10, "fn": 12, "aleatoric_mean": 0.000267, "epistemic_mean": 0.000534, "confidence_mean": 0.9992, "aleatoric_std": 8.5e-05, "epistemic_std": 0.00017}, {"fold": "fold_3", "regime": "Eurozone debt plateau", "sharpe": 2.1679, "sortino": 3.4588, "return_pct": 3.81, "equity": 1038.11, "max_dd": 4.29, "win_rate": 59.26, "profit_factor": 1.413, "ic": 0.195, "hit": 57.14, "n": 56, "precision": 0.6562, "recall": 0.6562, "f1": 0.6562, "f2": 0.6562, "mcc": 0.1979, "accuracy": 0.6071, "tp": 21, "fp": 11, "tn": 13, "fn": 11, "aleatoric_mean": 0.000273, "epistemic_mean": 0.000547, "confidence_mean": 0.9992, "aleatoric_std": 9.8e-05, "epistemic_std": 0.000196}, {"fold": "fold_4", "regime": "Strong USD downturn", "sharpe": -2.2518, "sortino": -2.9907, "return_pct": -10.91, "equity": 890.87, "max_dd": 11.49, "win_rate": 52.14, "profit_factor": 0.685, "ic": -0.0724, "hit": 51.69, "n": 118, "precision": 0.5246, "recall": 0.5333, "f1": 0.5289, "f2": 0.5316, "mcc": 0.0333, "accuracy": 0.5169, "tp": 32, "fp": 29, "tn": 29, "fn": 28, "aleatoric_mean": 0.00028, "epistemic_mean": 0.00056, "confidence_mean": 0.9992, "aleatoric_std": 0.000101, "epistemic_std": 0.000202}, {"fold": "fold_5", "regime": "Low-vol plateau", "sharpe": -1.5653, "sortino": -2.2773, "return_pct": -3.5, "equity": 964.96, "max_dd": 4.31, "win_rate": 49.11, "profit_factor": 0.771, "ic": -0.097, "hit": 49.11, "n": 112, "precision": 0.4423, "recall": 0.451, "f1": 0.4466, "f2": 0.4492, "mcc": -0.0244, "accuracy": 0.4911, "tp": 23, "fp": 29, "tn": 32, "fn": 28, "aleatoric_mean": 0.000276, "epistemic_mean": 0.000552, "confidence_mean": 0.9992, "aleatoric_std": 8.2e-05, "epistemic_std": 0.000163}, {"fold": "fold_6", "regime": "EUR crisis downturn", "sharpe": -0.5947, "sortino": -0.9828, "return_pct": -2.86, "equity": 971.41, "max_dd": 11.08, "win_rate": 44.35, "profit_factor": 0.91, "ic": -0.0304, "hit": 44.35, "n": 115, "precision": 0.4179, "recall": 0.5283, "f1": 0.4667, "f2": 0.5018, "mcc": -0.1018, "accuracy": 0.4435, "tp": 28, "fp": 39, "tn": 23, "fn": 25, "aleatoric_mean": 0.000276, "epistemic_mean": 0.000551, "confidence_mean": 0.9992, "aleatoric_std": 9.4e-05, "epistemic_std": 0.000189}, {"fold": "fold_7", "regime": "Recent mixed/upturn", "sharpe": -2.149, "sortino": -2.638, "return_pct": -8.61, "equity": 913.91, "max_dd": 8.24, "win_rate": 52.68, "profit_factor": 0.691, "ic": -0.1418, "hit": 52.68, "n": 112, "precision": 0.537, "recall": 0.5088, "f1": 0.5225, "f2": 0.5142, "mcc": 0.0543, "accuracy": 0.5268, "tp": 29, "fp": 25, "tn": 30, "fn": 28, "aleatoric_mean": 0.000268, "epistemic_mean": 0.000536, "confidence_mean": 0.9992, "aleatoric_std": 9.1e-05, "epistemic_std": 0.000182}], "val_sharpe": -0.2093, "val_psr": 0.3939, "val_equity": 969.54, "val_sortino": -0.3227, "val_return_pct": -3.05, "val_max_dd": 10.52, "val_win_rate": 49.52, "val_profit_factor": 0.966, "val_ic": -0.0301, "val_hit": 49.28, "val_aleatoric_mean": 0.000275, "val_epistemic_mean": 0.00055, "val_confidence_mean": 0.9992, "val_precision": 0.4874, "val_recall": 0.4709, "val_f1": 0.479, "val_f2": 0.4741, "val_mcc": -0.0103, "val_accuracy": 0.4952, "val_per_window": [{"fold": "fold_1", "regime": "Pre-crisis upturn + GFC onset", "sharpe": 2.6996, "sortino": 4.959, "return_pct": 4.25, "equity": 1042.55, "max_dd": 2.3, "win_rate": 48.28, "profit_factor": 1.561, "ic": 0.0899, "hit": 47.46, "n": 59, "precision": 0.5, "recall": 0.3871, "f1": 0.4364, "f2": 0.4054, "mcc": -0.0422, "accuracy": 0.4746, "tp": 12, "fp": 12, "tn": 16, "fn": 19, "aleatoric_mean": 0.000277, "epistemic_mean": 0.000554, "confidence_mean": 0.9992, "aleatoric_std": 9.1e-05, "epistemic_std": 0.000182}, {"fold": "fold_2", "regime": "Post-crash recovery", "sharpe": -0.6832, "sortino": -1.1253, "return_pct": -1.41, "equity": 985.87, "max_dd": 4.66, "win_rate": 46.55, "profit_factor": 0.895, "ic": -0.1002, "hit": 46.55, "n": 58, "precision": 0.5, "recall": 0.3871, "f1": 0.4364, "f2": 0.4054, "mcc": -0.0581, "accuracy": 0.4655, "tp": 12, "fp": 12, "tn": 15, "fn": 19, "aleatoric_mean": 0.000261, "epistemic_mean": 0.000522, "confidence_mean": 0.9992, "aleatoric_std": 9.1e-05, "epistemic_std": 0.000183}, {"fold": "fold_3", "regime": "Eurozone debt plateau", "sharpe": 0.5084, "sortino": 0.7894, "return_pct": 1.09, "equity": 1010.92, "max_dd": 3.35, "win_rate": 50.82, "profit_factor": 1.088, "ic": 0.0669, "hit": 50.82, "n": 61, "precision": 0.4483, "recall": 0.4815, "f1": 0.4643, "f2": 0.4745, "mcc": 0.0108, "accuracy": 0.5082, "tp": 13, "fp": 16, "tn": 18, "fn": 14, "aleatoric_mean": 0.000277, "epistemic_mean": 0.000555, "confidence_mean": 0.9992, "aleatoric_std": 9.6e-05, "epistemic_std": 0.000192}, {"fold": "fold_4", "regime": "Strong USD downturn", "sharpe": -0.6982, "sortino": -1.2266, "return_pct": -1.62, "equity": 983.85, "max_dd": 5.47, "win_rate": 53.33, "profit_factor": 0.898, "ic": -0.0427, "hit": 53.33, "n": 60, "precision": 0.5135, "recall": 0.6552, "f1": 0.5758, "f2": 0.6209, "mcc": 0.0766, "accuracy": 0.5333, "tp": 19, "fp": 18, "tn": 13, "fn": 10, "aleatoric_mean": 0.000283, "epistemic_mean": 0.000567, "confidence_mean": 0.9992, "aleatoric_std": 8.2e-05, "epistemic_std": 0.000164}, {"fold": "fold_5", "regime": "Low-vol plateau", "sharpe": -0.9352, "sortino": -1.5024, "return_pct": -1.67, "equity": 983.31, "max_dd": 4.31, "win_rate": 50.0, "profit_factor": 0.859, "ic": 0.0015, "hit": 50.0, "n": 62, "precision": 0.5152, "recall": 0.5312, "f1": 0.5231, "f2": 0.528, "mcc": -0.0021, "accuracy": 0.5, "tp": 17, "fp": 16, "tn": 14, "fn": 15, "aleatoric_mean": 0.000276, "epistemic_mean": 0.000552, "confidence_mean": 0.9992, "aleatoric_std": 9.8e-05, "epistemic_std": 0.000196}, {"fold": "fold_6", "regime": "EUR crisis downturn", "sharpe": -1.8537, "sortino": -2.6543, "return_pct": -1.93, "equity": 980.74, "max_dd": 2.9, "win_rate": 49.12, "profit_factor": 0.738, "ic": -0.1449, "hit": 48.28, "n": 58, "precision": 0.381, "recall": 0.3333, "f1": 0.3556, "f2": 0.3419, "mcc": -0.0502, "accuracy": 0.5, "tp": 8, "fp": 13, "tn": 21, "fn": 16, "aleatoric_mean": 0.000272, "epistemic_mean": 0.000543, "confidence_mean": 0.9992, "aleatoric_std": 8.3e-05, "epistemic_std": 0.000166}, {"fold": "fold_7", "regime": "Recent mixed/upturn", "sharpe": -1.2796, "sortino": -1.8199, "return_pct": -1.65, "equity": 983.47, "max_dd": 3.7, "win_rate": 48.33, "profit_factor": 0.812, "ic": -0.0442, "hit": 48.33, "n": 60, "precision": 0.5161, "recall": 0.5, "f1": 0.5079, "f2": 0.5031, "mcc": -0.0357, "accuracy": 0.4833, "tp": 16, "fp": 15, "tn": 13, "fn": 16, "aleatoric_mean": 0.000277, "epistemic_mean": 0.000553, "confidence_mean": 0.9992, "aleatoric_std": 9.3e-05, "epistemic_std": 0.000186}], "train_sharpe": 0.4451, "train_psr": 0.8593, "train_equity": 1312.39, "train_sortino": 0.5822, "train_return_pct": 31.24, "train_max_dd": 17.43, "train_win_rate": 51.64, "train_profit_factor": 1.108, "train_ic": 0.0404, "train_hit": 51.37, "train_precision": 0.5219, "train_recall": 0.7657, "train_f1": 0.6207, "train_f2": 0.7003, "train_mcc": 0.0109, "train_accuracy": 0.5145, "train_per_window": [{"fold": "all_train", "regime": "Training data", "sharpe": 0.4451, "sortino": 0.5822, "return_pct": 31.24, "equity": 1312.39, "max_dd": 17.43, "win_rate": 51.64, "profit_factor": 1.108, "ic": 0.0404, "hit": 51.37, "n": 1382, "precision": 0.5219, "recall": 0.7657, "f1": 0.6207, "f2": 0.7003, "mcc": 0.0109, "accuracy": 0.5145, "tp": 549, "fp": 503, "tn": 162, "fn": 168}], "experiment_num": 250, "status": "DISCARD"}
