{"backbone": "xgboost", "description": "xgboost: Exp4 max_depth=3 even shallower", "config": {"seq_len": 10, "lr": 0.0003, "batch_size": 32, "epochs": 20, "weight_decay": 1e-05, "patience": 5, "grad_clip": 1.0, "warmup_epochs": 0, "huber_delta": 1.0, "head_dropout": 0.1, "seed": 42, "max_depth": 3, "het_loss": false}, "composite": 7.5262, "test_pos_folds": 6, "val_pos_folds": 6, "val_loss": 0.0, "elapsed_sec": 52.7, "timestamp": "2026-04-20T22:07:33", "sharpe": 7.7262, "psr": 1.0, "equity": 17909.54, "sortino": 7.6702, "return_pct": 1690.95, "max_dd": 7.54, "win_rate": 78.33, "profit_factor": 4.582, "ic": 0.6713, "hit": 78.01, "precision": 0.8004, "recall": 0.7422, "f1": 0.7702, "f2": 0.7532, "mcc": 0.5632, "accuracy": 0.7811, "per_window": [{"fold": "fold_1", "regime": "Pre-crisis upturn + GFC onset", "sharpe": -0.0417, "sortino": -0.0465, "return_pct": -1.05, "equity": 989.51, "max_dd": 7.54, "win_rate": 51.96, "profit_factor": 0.99, "ic": 0.2443, "hit": 51.46, "n": 103, "precision": 0.6667, "recall": 0.1509, "f1": 0.2462, "f2": 0.1786, "mcc": 0.1105, "accuracy": 0.5243, "tp": 8, "fp": 4, "tn": 46, "fn": 45}, {"fold": "fold_2", "regime": "Post-crash recovery", "sharpe": 1.6091, "sortino": 2.9807, "return_pct": 7.7, "equity": 1076.96, "max_dd": 5.54, "win_rate": 56.07, "profit_factor": 1.287, "ic": 0.0312, "hit": 56.07, "n": 107, "precision": 0.5385, "recall": 0.549, "f1": 0.5437, "f2": 0.5469, "mcc": 0.1204, "accuracy": 0.5607, "tp": 28, "fp": 24, "tn": 32, "fn": 23}, {"fold": "fold_3", "regime": "Eurozone debt plateau", "sharpe": 14.0937, "sortino": 24.3539, "return_pct": 45.16, "equity": 1451.57, "max_dd": 1.32, "win_rate": 84.62, "profit_factor": 10.573, "ic": 0.7317, "hit": 83.02, "n": 106, "precision": 0.8305, "recall": 0.8596, "f1": 0.8448, "f2": 0.8537, "mcc": 0.6579, "accuracy": 0.8302, "tp": 49, "fp": 10, "tn": 39, "fn": 8}, {"fold": "fold_4", "regime": "Strong USD downturn", "sharpe": 14.1954, "sortino": 18.5272, "return_pct": 126.8, "equity": 2268.01, "max_dd": 1.81, "win_rate": 90.42, "profit_factor": 16.965, "ic": 0.8653, "hit": 89.88, "n": 168, "precision": 0.8966, "recall": 0.907, "f1": 0.9017, "f2": 0.9049, "mcc": 0.7975, "accuracy": 0.8988, "tp": 78, "fp": 9, "tn": 73, "fn": 8}, {"fold": "fold_5", "regime": "Low-vol plateau", "sharpe": 14.8024, "sortino": 69.6615, "return_pct": 43.33, "equity": 1433.33, "max_dd": 0.23, "win_rate": 82.1, "profit_factor": 19.079, "ic": 0.8941, "hit": 82.1, "n": 162, "precision": 0.8219, "recall": 0.7895, "f1": 0.8054, "f2": 0.7958, "mcc": 0.6402, "accuracy": 0.821, "tp": 60, "fp": 13, "tn": 73, "fn": 16}, {"fold": "fold_6", "regime": "EUR crisis downturn", "sharpe": 15.0841, "sortino": 59.7211, "return_pct": 98.52, "equity": 1985.17, "max_dd": 0.43, "win_rate": 82.42, "profit_factor": 16.158, "ic": 0.8763, "hit": 82.42, "n": 165, "precision": 0.8158, "recall": 0.8052, "f1": 0.8105, "f2": 0.8073, "mcc": 0.6467, "accuracy": 0.8242, "tp": 62, "fp": 14, "tn": 74, "fn": 15}, {"fold": "fold_7", "regime": "Recent mixed/upturn", "sharpe": 12.5569, "sortino": 16.9434, "return_pct": 79.41, "equity": 1794.06, "max_dd": 1.64, "win_rate": 85.19, "profit_factor": 10.894, "ic": 0.8301, "hit": 85.19, "n": 162, "precision": 0.8276, "recall": 0.8889, "f1": 0.8571, "f2": 0.8759, "mcc": 0.7056, "accuracy": 0.8519, "tp": 72, "fp": 15, "tn": 66, "fn": 9}], "val_sharpe": 7.919, "val_psr": 1.0, "val_equity": 5332.42, "val_sortino": 10.3923, "val_return_pct": 433.24, "val_max_dd": 10.0, "val_win_rate": 73.92, "val_profit_factor": 3.982, "val_ic": 0.6492, "val_hit": 73.44, "val_precision": 0.7017, "val_recall": 0.7863, "val_f1": 0.7416, "val_f2": 0.7678, "val_mcc": 0.484, "val_accuracy": 0.7396, "val_per_window": [{"fold": "fold_1", "regime": "Pre-crisis upturn + GFC onset", "sharpe": 1.8191, "sortino": 3.3227, "return_pct": 4.59, "equity": 1045.93, "max_dd": 2.41, "win_rate": 48.15, "profit_factor": 1.352, "ic": -0.0357, "hit": 47.71, "n": 109, "precision": 0.4889, "recall": 0.8, "f1": 0.6069, "f2": 0.7097, "mcc": -0.0683, "accuracy": 0.4771, "tp": 44, "fp": 46, "tn": 8, "fn": 11}, {"fold": "fold_2", "regime": "Post-crash recovery", "sharpe": -0.7609, "sortino": -1.2007, "return_pct": -3.89, "equity": 961.12, "max_dd": 10.0, "win_rate": 50.0, "profit_factor": 0.887, "ic": -0.0602, "hit": 50.0, "n": 108, "precision": 0.5789, "recall": 0.5238, "f1": 0.55, "f2": 0.534, "mcc": -0.0094, "accuracy": 0.5, "tp": 33, "fp": 24, "tn": 21, "fn": 30}, {"fold": "fold_3", "regime": "Eurozone debt plateau", "sharpe": 14.6785, "sortino": 39.8771, "return_pct": 54.36, "equity": 1543.6, "max_dd": 0.62, "win_rate": 85.32, "profit_factor": 14.896, "ic": 0.8452, "hit": 83.78, "n": 111, "precision": 0.8163, "recall": 0.8511, "f1": 0.8333, "f2": 0.8439, "mcc": 0.7069, "accuracy": 0.8559, "tp": 40, "fp": 9, "tn": 55, "fn": 7}, {"fold": "fold_4", "regime": "Strong USD downturn", "sharpe": 15.1261, "sortino": 50.4323, "return_pct": 46.12, "equity": 1461.2, "max_dd": 0.59, "win_rate": 85.32, "profit_factor": 20.167, "ic": 0.891, "hit": 84.55, "n": 110, "precision": 0.878, "recall": 0.766, "f1": 0.8182, "f2": 0.786, "mcc": 0.7024, "accuracy": 0.8545, "tp": 36, "fp": 5, "tn": 58, "fn": 11}, {"fold": "fold_5", "regime": "Low-vol plateau", "sharpe": 14.5423, "sortino": 60.2353, "return_pct": 42.86, "equity": 1428.63, "max_dd": 0.34, "win_rate": 82.14, "profit_factor": 17.311, "ic": 0.9055, "hit": 82.14, "n": 112, "precision": 0.7895, "recall": 0.8491, "f1": 0.8182, "f2": 0.8364, "mcc": 0.6448, "accuracy": 0.8214, "tp": 45, "fp": 12, "tn": 47, "fn": 8}, {"fold": "fold_6", "regime": "EUR crisis downturn", "sharpe": 14.8575, "sortino": 65.589, "return_pct": 28.13, "equity": 1281.26, "max_dd": 0.25, "win_rate": 84.11, "profit_factor": 21.855, "ic": 0.9144, "hit": 83.33, "n": 108, "precision": 0.7885, "recall": 0.8723, "f1": 0.8283, "f2": 0.8542, "mcc": 0.6866, "accuracy": 0.8426, "tp": 41, "fp": 11, "tn": 50, "fn": 6}, {"fold": "fold_7", "regime": "Recent mixed/upturn", "sharpe": 13.9296, "sortino": 46.7185, "return_pct": 28.48, "equity": 1284.83, "max_dd": 0.34, "win_rate": 81.82, "profit_factor": 11.601, "ic": 0.8309, "hit": 81.82, "n": 110, "precision": 0.7619, "recall": 0.9057, "f1": 0.8276, "f2": 0.8727, "mcc": 0.649, "accuracy": 0.8182, "tp": 48, "fp": 15, "tn": 42, "fn": 5}], "train_sharpe": 10.9683, "train_psr": 1.0, "train_equity": 59942352.0, "train_sortino": 144.8878, "train_return_pct": 5994135.2, "train_max_dd": 0.23, "train_win_rate": 94.37, "train_profit_factor": 138.795, "train_ic": 0.9812, "train_hit": 93.99, "train_precision": 0.9346, "train_recall": 0.9537, "train_f1": 0.9441, "train_f2": 0.9498, "train_mcc": 0.8838, "train_accuracy": 0.9419, "train_per_window": [{"fold": "all_train", "regime": "Training data", "sharpe": 10.9683, "sortino": 144.8878, "return_pct": 5994135.2, "equity": 59942352.0, "max_dd": 0.23, "win_rate": 94.37, "profit_factor": 138.795, "ic": 0.9812, "hit": 93.99, "n": 2478, "precision": 0.9346, "recall": 0.9537, "f1": 0.9441, "f2": 0.9498, "mcc": 0.8838, "accuracy": 0.9419, "tp": 1215, "fp": 85, "tn": 1119, "fn": 59}], "experiment_num": 181, "status": "DISCARD"}
{"backbone": "xgboost", "description": "xgboost: Exp5 max_depth=5 between 4 and 6", "config": {"seq_len": 10, "lr": 0.0003, "batch_size": 32, "epochs": 20, "weight_decay": 1e-05, "patience": 5, "grad_clip": 1.0, "warmup_epochs": 0, "huber_delta": 1.0, "head_dropout": 0.1, "seed": 42, "max_depth": 5, "het_loss": false}, "composite": 7.0501, "test_pos_folds": 5, "val_pos_folds": 6, "val_loss": 0.0, "elapsed_sec": 108.7, "timestamp": "2026-04-20T22:09:42", "sharpe": 7.3501, "psr": 1.0, "equity": 15947.09, "sortino": 7.2827, "return_pct": 1494.71, "max_dd": 12.01, "win_rate": 78.02, "profit_factor": 4.21, "ic": 0.6686, "hit": 77.7, "precision": 0.8037, "recall": 0.7318, "f1": 0.7661, "f2": 0.7451, "mcc": 0.5598, "accuracy": 0.779, "per_window": [{"fold": "fold_1", "regime": "Pre-crisis upturn + GFC onset", "sharpe": -0.5467, "sortino": -0.6173, "return_pct": -4.83, "equity": 951.73, "max_dd": 7.81, "win_rate": 50.0, "profit_factor": 0.879, "ic": 0.1935, "hit": 49.51, "n": 103, "precision": 0.6, "recall": 0.1132, "f1": 0.1905, "f2": 0.1351, "mcc": 0.0561, "accuracy": 0.5049, "tp": 6, "fp": 4, "tn": 46, "fn": 47}, {"fold": "fold_2", "regime": "Post-crash recovery", "sharpe": -0.2139, "sortino": -0.3782, "return_pct": -1.29, "equity": 987.1, "max_dd": 10.01, "win_rate": 48.6, "profit_factor": 0.967, "ic": -0.0379, "hit": 48.6, "n": 107, "precision": 0.4643, "recall": 0.5098, "f1": 0.486, "f2": 0.5, "mcc": -0.0259, "accuracy": 0.486, "tp": 26, "fp": 30, "tn": 26, "fn": 25}, {"fold": "fold_3", "regime": "Eurozone debt plateau", "sharpe": 13.7178, "sortino": 25.2429, "return_pct": 44.33, "equity": 1443.35, "max_dd": 1.32, "win_rate": 81.73, "profit_factor": 9.789, "ic": 0.7644, "hit": 80.19, "n": 106, "precision": 0.8333, "recall": 0.7895, "f1": 0.8108, "f2": 0.7979, "mcc": 0.6042, "accuracy": 0.8019, "tp": 45, "fp": 9, "tn": 40, "fn": 12}, {"fold": "fold_4", "regime": "Strong USD downturn", "sharpe": 14.5699, "sortino": 17.5872, "return_pct": 129.51, "equity": 2295.07, "max_dd": 1.81, "win_rate": 91.62, "profit_factor": 19.299, "ic": 0.8815, "hit": 91.07, "n": 168, "precision": 0.9186, "recall": 0.9186, "f1": 0.9186, "f2": 0.9186, "mcc": 0.8332, "accuracy": 0.9167, "tp": 79, "fp": 7, "tn": 75, "fn": 7}, {"fold": "fold_5", "regime": "Low-vol plateau", "sharpe": 15.0297, "sortino": 64.5851, "return_pct": 43.75, "equity": 1437.55, "max_dd": 0.23, "win_rate": 84.57, "profit_factor": 20.671, "ic": 0.888, "hit": 84.57, "n": 162, "precision": 0.84, "recall": 0.8289, "f1": 0.8344, "f2": 0.8311, "mcc": 0.69, "accuracy": 0.8457, "tp": 63, "fp": 12, "tn": 74, "fn": 13}, {"fold": "fold_6", "regime": "EUR crisis downturn", "sharpe": 15.0832, "sortino": 59.4839, "return_pct": 98.51, "equity": 1985.13, "max_dd": 0.43, "win_rate": 81.82, "profit_factor": 16.154, "ic": 0.8782, "hit": 81.82, "n": 165, "precision": 0.8052, "recall": 0.8052, "f1": 0.8052, "f2": 0.8052, "mcc": 0.6347, "accuracy": 0.8182, "tp": 62, "fp": 15, "tn": 73, "fn": 15}, {"fold": "fold_7", "regime": "Recent mixed/upturn", "sharpe": 12.5881, "sortino": 14.8626, "return_pct": 79.57, "equity": 1795.66, "max_dd": 1.64, "win_rate": 88.27, "profit_factor": 10.984, "ic": 0.8292, "hit": 88.27, "n": 162, "precision": 0.8875, "recall": 0.8765, "f1": 0.882, "f2": 0.8787, "mcc": 0.7655, "accuracy": 0.8827, "tp": 71, "fp": 9, "tn": 72, "fn": 10}], "val_sharpe": 7.6055, "val_psr": 1.0, "val_equity": 5052.22, "val_sortino": 9.6197, "val_return_pct": 405.22, "val_max_dd": 16.53, "val_win_rate": 74.18, "val_profit_factor": 3.755, "val_ic": 0.6656, "val_hit": 73.7, "val_precision": 0.7, "val_recall": 0.8055, "val_f1": 0.749, "val_f2": 0.7819, "val_mcc": 0.4944, "val_accuracy": 0.7435, "val_per_window": [{"fold": "fold_1", "regime": "Pre-crisis upturn + GFC onset", "sharpe": 2.0369, "sortino": 3.7082, "return_pct": 5.16, "equity": 1051.57, "max_dd": 2.08, "win_rate": 50.0, "profit_factor": 1.402, "ic": -0.0288, "hit": 49.54, "n": 109, "precision": 0.5054, "recall": 0.8545, "f1": 0.6351, "f2": 0.7508, "mcc": 0.0038, "accuracy": 0.5046, "tp": 47, "fp": 46, "tn": 8, "fn": 8}, {"fold": "fold_2", "regime": "Post-crash recovery", "sharpe": -1.8921, "sortino": -2.9799, "return_pct": -8.97, "equity": 910.3, "max_dd": 16.24, "win_rate": 50.0, "profit_factor": 0.742, "ic": -0.131, "hit": 50.0, "n": 108, "precision": 0.5789, "recall": 0.5238, "f1": 0.55, "f2": 0.534, "mcc": -0.0094, "accuracy": 0.5, "tp": 33, "fp": 24, "tn": 21, "fn": 30}, {"fold": "fold_3", "regime": "Eurozone debt plateau", "sharpe": 13.6557, "sortino": 32.5487, "return_pct": 51.73, "equity": 1517.3, "max_dd": 0.7, "win_rate": 81.65, "profit_factor": 11.478, "ic": 0.8394, "hit": 80.18, "n": 111, "precision": 0.7455, "recall": 0.8723, "f1": 0.8039, "f2": 0.8436, "mcc": 0.6459, "accuracy": 0.8198, "tp": 41, "fp": 14, "tn": 50, "fn": 6}, {"fold": "fold_4", "regime": "Strong USD downturn", "sharpe": 15.4307, "sortino": 49.3427, "return_pct": 46.7, "equity": 1467.0, "max_dd": 0.64, "win_rate": 87.16, "profit_factor": 22.511, "ic": 0.9181, "hit": 86.36, "n": 110, "precision": 0.9024, "recall": 0.7872, "f1": 0.8409, "f2": 0.8079, "mcc": 0.7404, "accuracy": 0.8727, "tp": 37, "fp": 4, "tn": 59, "fn": 10}, {"fold": "fold_5", "regime": "Low-vol plateau", "sharpe": 14.5423, "sortino": 60.2353, "return_pct": 42.86, "equity": 1428.63, "max_dd": 0.34, "win_rate": 82.14, "profit_factor": 17.311, "ic": 0.9061, "hit": 82.14, "n": 112, "precision": 0.7895, "recall": 0.8491, "f1": 0.8182, "f2": 0.8364, "mcc": 0.6448, "accuracy": 0.8214, "tp": 45, "fp": 12, "tn": 47, "fn": 8}, {"fold": "fold_6", "regime": "EUR crisis downturn", "sharpe": 15.1303, "sortino": 64.0746, "return_pct": 28.43, "equity": 1284.34, "max_dd": 0.25, "win_rate": 85.98, "profit_factor": 24.416, "ic": 0.9243, "hit": 85.19, "n": 108, "precision": 0.8077, "recall": 0.8936, "f1": 0.8485, "f2": 0.875, "mcc": 0.724, "accuracy": 0.8611, "tp": 42, "fp": 10, "tn": 51, "fn": 5}, {"fold": "fold_7", "regime": "Recent mixed/upturn", "sharpe": 14.5141, "sortino": 52.6153, "return_pct": 29.23, "equity": 1292.3, "max_dd": 0.34, "win_rate": 81.82, "profit_factor": 13.357, "ic": 0.8552, "hit": 81.82, "n": 110, "precision": 0.7538, "recall": 0.9245, "f1": 0.8305, "f2": 0.8845, "mcc": 0.6543, "accuracy": 0.8182, "tp": 49, "fp": 16, "tn": 41, "fn": 4}], "train_sharpe": 11.1848, "train_psr": 1.0, "train_equity": 69406312.0, "train_sortino": 506.7402, "train_return_pct": 6940531.2, "train_max_dd": 0.06, "train_win_rate": 98.34, "train_profit_factor": 1587.014, "train_ic": 0.9983, "train_hit": 97.94, "train_precision": 0.9804, "train_recall": 0.9827, "train_f1": 0.9816, "train_f2": 0.9823, "train_mcc": 0.962, "train_accuracy": 0.981, "train_per_window": [{"fold": "all_train", "regime": "Training data", "sharpe": 11.1848, "sortino": 506.7402, "return_pct": 6940531.2, "equity": 69406312.0, "max_dd": 0.06, "win_rate": 98.34, "profit_factor": 1587.014, "ic": 0.9983, "hit": 97.94, "n": 2478, "precision": 0.9804, "recall": 0.9827, "f1": 0.9816, "f2": 0.9823, "mcc": 0.962, "accuracy": 0.981, "tp": 1252, "fp": 25, "tn": 1179, "fn": 22}], "experiment_num": 182, "status": "DISCARD"}
{"backbone": "xgboost", "description": "xgboost: Exp6 depth=4 lr=0.01 slower convergence", "config": {"seq_len": 10, "lr": 0.0003, "batch_size": 32, "epochs": 20, "weight_decay": 1e-05, "patience": 5, "grad_clip": 1.0, "warmup_epochs": 0, "huber_delta": 1.0, "head_dropout": 0.1, "seed": 42, "max_depth": 4, "gbm_lr": 0.01, "het_loss": false}, "composite": 7.7601, "test_pos_folds": 7, "val_pos_folds": 6, "val_loss": 0.0, "elapsed_sec": 84.8, "timestamp": "2026-04-20T22:12:01", "sharpe": 7.8601, "psr": 1.0, "equity": 18650.4, "sortino": 7.6462, "return_pct": 1765.04, "max_dd": 7.54, "win_rate": 79.05, "profit_factor": 4.725, "ic": 0.682, "hit": 78.73, "precision": 0.8151, "recall": 0.7422, "f1": 0.7769, "f2": 0.7557, "mcc": 0.5804, "accuracy": 0.7893, "per_window": [{"fold": "fold_1", "regime": "Pre-crisis upturn + GFC onset", "sharpe": 0.1917, "sortino": 0.2067, "return_pct": 0.75, "equity": 1007.49, "max_dd": 7.54, "win_rate": 54.9, "profit_factor": 1.046, "ic": 0.2682, "hit": 54.37, "n": 103, "precision": 0.7333, "recall": 0.2075, "f1": 0.3235, "f2": 0.2423, "mcc": 0.1807, "accuracy": 0.5534, "tp": 11, "fp": 4, "tn": 46, "fn": 42}, {"fold": "fold_2", "regime": "Post-crash recovery", "sharpe": 2.2866, "sortino": 4.2367, "return_pct": 11.18, "equity": 1111.76, "max_dd": 5.33, "win_rate": 56.07, "profit_factor": 1.431, "ic": 0.0635, "hit": 56.07, "n": 107, "precision": 0.54, "recall": 0.5294, "f1": 0.5347, "f2": 0.5315, "mcc": 0.1188, "accuracy": 0.5607, "tp": 27, "fp": 23, "tn": 33, "fn": 24}, {"fold": "fold_3", "regime": "Eurozone debt plateau", "sharpe": 14.2841, "sortino": 23.8993, "return_pct": 45.56, "equity": 1455.64, "max_dd": 1.32, "win_rate": 84.62, "profit_factor": 11.003, "ic": 0.7503, "hit": 83.02, "n": 106, "precision": 0.8421, "recall": 0.8421, "f1": 0.8421, "f2": 0.8421, "mcc": 0.6584, "accuracy": 0.8302, "tp": 48, "fp": 9, "tn": 40, "fn": 9}, {"fold": "fold_4", "regime": "Strong USD downturn", "sharpe": 14.3348, "sortino": 18.3618, "return_pct": 127.82, "equity": 2278.16, "max_dd": 1.81, "win_rate": 90.42, "profit_factor": 17.778, "ic": 0.8761, "hit": 89.88, "n": 168, "precision": 0.9268, "recall": 0.8837, "f1": 0.9048, "f2": 0.892, "mcc": 0.8106, "accuracy": 0.9048, "tp": 76, "fp": 6, "tn": 76, "fn": 10}, {"fold": "fold_5", "regime": "Low-vol plateau", "sharpe": 15.3677, "sortino": 70.0515, "return_pct": 44.37, "equity": 1443.66, "max_dd": 0.23, "win_rate": 85.19, "profit_factor": 23.481, "ic": 0.9033, "hit": 85.19, "n": 162, "precision": 0.8421, "recall": 0.8421, "f1": 0.8421, "f2": 0.8421, "mcc": 0.7026, "accuracy": 0.8519, "tp": 64, "fp": 12, "tn": 74, "fn": 12}, {"fold": "fold_6", "regime": "EUR crisis downturn", "sharpe": 14.8522, "sortino": 59.1985, "return_pct": 97.4, "equity": 1974.04, "max_dd": 0.43, "win_rate": 81.21, "profit_factor": 15.158, "ic": 0.882, "hit": 81.21, "n": 165, "precision": 0.8026, "recall": 0.7922, "f1": 0.7974, "f2": 0.7943, "mcc": 0.6223, "accuracy": 0.8121, "tp": 61, "fp": 15, "tn": 73, "fn": 16}, {"fold": "fold_7", "regime": "Recent mixed/upturn", "sharpe": 11.9456, "sortino": 14.8836, "return_pct": 76.19, "equity": 1761.9, "max_dd": 1.64, "win_rate": 85.8, "profit_factor": 9.321, "ic": 0.8226, "hit": 85.8, "n": 162, "precision": 0.8537, "recall": 0.8642, "f1": 0.8589, "f2": 0.8621, "mcc": 0.7161, "accuracy": 0.858, "tp": 70, "fp": 12, "tn": 69, "fn": 11}], "val_sharpe": 7.951, "val_psr": 1.0, "val_equity": 5361.49, "val_sortino": 10.0084, "val_return_pct": 436.15, "val_max_dd": 13.01, "val_win_rate": 74.18, "val_profit_factor": 4.007, "val_ic": 0.6819, "val_hit": 73.7, "val_precision": 0.7022, "val_recall": 0.7945, "val_f1": 0.7455, "val_f2": 0.7742, "val_mcc": 0.4901, "val_accuracy": 0.7422, "val_per_window": [{"fold": "fold_1", "regime": "Pre-crisis upturn + GFC onset", "sharpe": 2.4874, "sortino": 4.6043, "return_pct": 6.32, "equity": 1063.24, "max_dd": 2.99, "win_rate": 49.07, "profit_factor": 1.512, "ic": 0.0042, "hit": 48.62, "n": 109, "precision": 0.4945, "recall": 0.8182, "f1": 0.6164, "f2": 0.7235, "mcc": -0.0453, "accuracy": 0.4862, "tp": 45, "fp": 46, "tn": 8, "fn": 10}, {"fold": "fold_2", "regime": "Post-crash recovery", "sharpe": -1.7209, "sortino": -2.6664, "return_pct": -8.23, "equity": 917.75, "max_dd": 13.01, "win_rate": 47.22, "profit_factor": 0.762, "ic": -0.0656, "hit": 47.22, "n": 108, "precision": 0.5517, "recall": 0.5079, "f1": 0.5289, "f2": 0.5161, "mcc": -0.0691, "accuracy": 0.4722, "tp": 32, "fp": 26, "tn": 19, "fn": 31}, {"fold": "fold_3", "regime": "Eurozone debt plateau", "sharpe": 15.2555, "sortino": 41.6013, "return_pct": 55.75, "equity": 1557.55, "max_dd": 0.64, "win_rate": 86.24, "profit_factor": 17.556, "ic": 0.8488, "hit": 84.68, "n": 111, "precision": 0.7963, "recall": 0.9149, "f1": 0.8515, "f2": 0.8884, "mcc": 0.7345, "accuracy": 0.8649, "tp": 43, "fp": 11, "tn": 53, "fn": 4}, {"fold": "fold_4", "regime": "Strong USD downturn", "sharpe": 15.4774, "sortino": 49.7788, "return_pct": 46.79, "equity": 1467.88, "max_dd": 0.64, "win_rate": 86.24, "profit_factor": 22.911, "ic": 0.9261, "hit": 85.45, "n": 110, "precision": 0.881, "recall": 0.7872, "f1": 0.8315, "f2": 0.8043, "mcc": 0.7208, "accuracy": 0.8636, "tp": 37, "fp": 5, "tn": 58, "fn": 10}, {"fold": "fold_5", "regime": "Low-vol plateau", "sharpe": 15.0602, "sortino": 76.4187, "return_pct": 43.83, "equity": 1438.33, "max_dd": 0.25, "win_rate": 83.04, "profit_factor": 20.646, "ic": 0.9169, "hit": 83.04, "n": 112, "precision": 0.8036, "recall": 0.8491, "f1": 0.8257, "f2": 0.8396, "mcc": 0.6617, "accuracy": 0.8304, "tp": 45, "fp": 11, "tn": 48, "fn": 8}, {"fold": "fold_6", "regime": "EUR crisis downturn", "sharpe": 15.4214, "sortino": 107.4093, "return_pct": 28.75, "equity": 1287.54, "max_dd": 0.15, "win_rate": 85.05, "profit_factor": 27.765, "ic": 0.9222, "hit": 84.26, "n": 108, "precision": 0.8039, "recall": 0.8723, "f1": 0.8367, "f2": 0.8577, "mcc": 0.7035, "accuracy": 0.8519, "tp": 41, "fp": 10, "tn": 51, "fn": 6}, {"fold": "fold_7", "regime": "Recent mixed/upturn", "sharpe": 14.9572, "sortino": 56.163, "return_pct": 29.77, "equity": 1297.72, "max_dd": 0.34, "win_rate": 81.82, "profit_factor": 14.963, "ic": 0.8748, "hit": 81.82, "n": 110, "precision": 0.7705, "recall": 0.8868, "f1": 0.8246, "f2": 0.8608, "mcc": 0.6446, "accuracy": 0.8182, "tp": 47, "fp": 14, "tn": 43, "fn": 6}], "train_sharpe": 10.6086, "train_psr": 1.0, "train_equity": 46694892.0, "train_sortino": 83.0623, "train_return_pct": 4669389.2, "train_max_dd": 0.53, "train_win_rate": 90.92, "train_profit_factor": 53.741, "train_ic": 0.9492, "train_hit": 90.56, "train_precision": 0.9017, "train_recall": 0.9215, "train_f1": 0.9115, "train_f2": 0.9175, "train_mcc": 0.8159, "train_accuracy": 0.908, "train_per_window": [{"fold": "all_train", "regime": "Training data", "sharpe": 10.6086, "sortino": 83.0623, "return_pct": 4669389.2, "equity": 46694892.0, "max_dd": 0.53, "win_rate": 90.92, "profit_factor": 53.741, "ic": 0.9492, "hit": 90.56, "n": 2478, "precision": 0.9017, "recall": 0.9215, "f1": 0.9115, "f2": 0.9175, "mcc": 0.8159, "accuracy": 0.908, "tp": 1174, "fp": 128, "tn": 1076, "fn": 100}], "experiment_num": 183, "status": "KEEP"}
