{"backbone": "lstm", "description": "lstm: Exp40 hidden=96 smaller capacity at champion config", "config": {"seq_len": 10, "lr": 0.001, "batch_size": 16, "epochs": 100, "weight_decay": 0.0007, "patience": 15, "grad_clip": 1.0, "warmup_epochs": 0, "huber_delta": 1.0, "head_dropout": 0.25, "seed": 42, "hidden_size": 96, "het_loss": false}, "composite": 4.0498, "test_pos_folds": 6, "val_pos_folds": 7, "val_loss": 3.1e-05, "elapsed_sec": 54.8, "timestamp": "2026-04-19T19:55:15", "sharpe": 4.1498, "psr": 1.0, "equity": 5249.88, "sortino": 7.6412, "return_pct": 424.99, "max_dd": 7.45, "win_rate": 61.92, "profit_factor": 2.179, "ic": 0.508, "hit": 61.66, "aleatoric_mean": 8e-06, "epistemic_mean": 1.7e-05, "confidence_mean": 1.0, "precision": 0.5687, "recall": 0.9293, "f1": 0.7056, "f2": 0.8247, "mcc": 0.3049, "accuracy": 0.6166, "per_window": [{"fold": "fold_1", "regime": "Pre-crisis upturn + GFC onset", "sharpe": 3.2196, "sortino": 9.7876, "return_pct": 26.66, "equity": 1266.62, "max_dd": 2.64, "win_rate": 54.9, "profit_factor": 2.187, "ic": 0.2678, "hit": 54.37, "n": 103, "precision": 0.5312, "recall": 0.9623, "f1": 0.6846, "f2": 0.8279, "mcc": 0.1236, "accuracy": 0.5437, "tp": 51, "fp": 45, "tn": 5, "fn": 2, "aleatoric_mean": 1.2e-05, "epistemic_mean": 2.3e-05, "confidence_mean": 1.0, "aleatoric_std": 6e-06, "epistemic_std": 1.3e-05}, {"fold": "fold_2", "regime": "Post-crash recovery", "sharpe": -0.9747, "sortino": -1.595, "return_pct": -4.82, "equity": 951.78, "max_dd": 6.53, "win_rate": 50.47, "profit_factor": 0.858, "ic": 0.0414, "hit": 50.47, "n": 107, "precision": 0.4896, "recall": 0.9216, "f1": 0.6395, "f2": 0.7833, "mcc": 0.0766, "accuracy": 0.5047, "tp": 47, "fp": 49, "tn": 7, "fn": 4, "aleatoric_mean": 1e-05, "epistemic_mean": 1.9e-05, "confidence_mean": 1.0, "aleatoric_std": 6e-06, "epistemic_std": 1.1e-05}, {"fold": "fold_3", "regime": "Eurozone debt plateau", "sharpe": 3.7362, "sortino": 6.0351, "return_pct": 13.61, "equity": 1136.11, "max_dd": 6.75, "win_rate": 66.35, "profit_factor": 1.799, "ic": 0.6277, "hit": 65.09, "n": 106, "precision": 0.6087, "recall": 0.9825, "f1": 0.7517, "f2": 0.875, "mcc": 0.3648, "accuracy": 0.6509, "tp": 56, "fp": 36, "tn": 13, "fn": 1, "aleatoric_mean": 1.1e-05, "epistemic_mean": 2.2e-05, "confidence_mean": 1.0, "aleatoric_std": 6e-06, "epistemic_std": 1.2e-05}, {"fold": "fold_4", "regime": "Strong USD downturn", "sharpe": 5.0006, "sortino": 8.8704, "return_pct": 44.28, "equity": 1442.85, "max_dd": 3.95, "win_rate": 65.27, "profit_factor": 2.336, "ic": 0.7328, "hit": 64.88, "n": 168, "precision": 0.5957, "recall": 0.9767, "f1": 0.7401, "f2": 0.866, "mcc": 0.3833, "accuracy": 0.6488, "tp": 84, "fp": 57, "tn": 25, "fn": 2, "aleatoric_mean": 7e-06, "epistemic_mean": 1.4e-05, "confidence_mean": 1.0, "aleatoric_std": 3e-06, "epistemic_std": 7e-06}, {"fold": "fold_5", "regime": "Low-vol plateau", "sharpe": 3.5947, "sortino": 6.5552, "return_pct": 12.3, "equity": 1123.0, "max_dd": 2.4, "win_rate": 56.17, "profit_factor": 1.823, "ic": 0.6329, "hit": 56.17, "n": 162, "precision": 0.5185, "recall": 0.9211, "f1": 0.6635, "f2": 0.7973, "mcc": 0.2213, "accuracy": 0.5617, "tp": 70, "fp": 65, "tn": 21, "fn": 6, "aleatoric_mean": 5e-06, "epistemic_mean": 1.1e-05, "confidence_mean": 1.0, "aleatoric_std": 2e-06, "epistemic_std": 4e-06}, {"fold": "fold_6", "regime": "EUR crisis downturn", "sharpe": 10.4035, "sortino": 20.8469, "return_pct": 72.47, "equity": 1724.67, "max_dd": 2.25, "win_rate": 72.73, "profit_factor": 5.734, "ic": 0.6892, "hit": 72.73, "n": 165, "precision": 0.6633, "recall": 0.8442, "f1": 0.7429, "f2": 0.8005, "mcc": 0.4766, "accuracy": 0.7273, "tp": 65, "fp": 33, "tn": 55, "fn": 12, "aleatoric_mean": 8e-06, "epistemic_mean": 1.7e-05, "confidence_mean": 1.0, "aleatoric_std": 4e-06, "epistemic_std": 8e-06}, {"fold": "fold_7", "regime": "Recent mixed/upturn", "sharpe": 5.6774, "sortino": 10.184, "return_pct": 37.16, "equity": 1371.64, "max_dd": 3.1, "win_rate": 62.35, "profit_factor": 2.647, "ic": 0.5669, "hit": 62.35, "n": 162, "precision": 0.5781, "recall": 0.9136, "f1": 0.7081, "f2": 0.8186, "mcc": 0.3032, "accuracy": 0.6235, "tp": 74, "fp": 54, "tn": 27, "fn": 7, "aleatoric_mean": 9e-06, "epistemic_mean": 1.7e-05, "confidence_mean": 1.0, "aleatoric_std": 3e-06, "epistemic_std": 7e-06}], "val_sharpe": 5.5745, "val_psr": 1.0, "val_equity": 3455.55, "val_sortino": 8.8465, "val_return_pct": 245.55, "val_max_dd": 5.19, "val_win_rate": 62.65, "val_profit_factor": 2.599, "val_ic": 0.5281, "val_hit": 62.24, "val_aleatoric_mean": 7e-06, "val_epistemic_mean": 1.3e-05, "val_confidence_mean": 1.0, "val_precision": 0.5628, "val_recall": 0.9205, "val_f1": 0.6985, "val_f2": 0.8167, "val_mcc": 0.3276, "val_accuracy": 0.6224, "val_per_window": [{"fold": "fold_1", "regime": "Pre-crisis upturn + GFC onset", "sharpe": 1.0905, "sortino": 1.7177, "return_pct": 2.71, "equity": 1027.1, "max_dd": 2.96, "win_rate": 50.93, "profit_factor": 1.198, "ic": -0.0569, "hit": 50.46, "n": 109, "precision": 0.5048, "recall": 0.9636, "f1": 0.6625, "f2": 0.8154, "mcc": 0.0018, "accuracy": 0.5046, "tp": 53, "fp": 52, "tn": 2, "fn": 2, "aleatoric_mean": 6e-06, "epistemic_mean": 1.3e-05, "confidence_mean": 1.0, "aleatoric_std": 3e-06, "epistemic_std": 6e-06}, {"fold": "fold_2", "regime": "Post-crash recovery", "sharpe": 1.6925, "sortino": 2.5429, "return_pct": 8.22, "equity": 1082.17, "max_dd": 5.19, "win_rate": 55.56, "profit_factor": 1.306, "ic": 0.0761, "hit": 55.56, "n": 108, "precision": 0.5949, "recall": 0.746, "f1": 0.662, "f2": 0.71, "mcc": 0.0388, "accuracy": 0.5556, "tp": 47, "fp": 32, "tn": 13, "fn": 16, "aleatoric_mean": 9e-06, "epistemic_mean": 1.7e-05, "confidence_mean": 1.0, "aleatoric_std": 3e-06, "epistemic_std": 7e-06}, {"fold": "fold_3", "regime": "Eurozone debt plateau", "sharpe": 8.6028, "sortino": 22.0263, "return_pct": 35.54, "equity": 1355.43, "max_dd": 0.88, "win_rate": 64.22, "profit_factor": 4.175, "ic": 0.7911, "hit": 63.06, "n": 111, "precision": 0.5349, "recall": 0.9787, "f1": 0.6917, "f2": 0.8394, "mcc": 0.4184, "accuracy": 0.6306, "tp": 46, "fp": 40, "tn": 24, "fn": 1, "aleatoric_mean": 7e-06, "epistemic_mean": 1.3e-05, "confidence_mean": 1.0, "aleatoric_std": 3e-06, "epistemic_std": 6e-06}, {"fold": "fold_4", "regime": "Strong USD downturn", "sharpe": 8.5709, "sortino": 21.3446, "return_pct": 29.79, "equity": 1297.93, "max_dd": 1.2, "win_rate": 66.06, "profit_factor": 4.314, "ic": 0.78, "hit": 65.45, "n": 110, "precision": 0.5584, "recall": 0.9149, "f1": 0.6935, "f2": 0.8113, "mcc": 0.405, "accuracy": 0.6545, "tp": 43, "fp": 34, "tn": 29, "fn": 4, "aleatoric_mean": 7e-06, "epistemic_mean": 1.4e-05, "confidence_mean": 1.0, "aleatoric_std": 3e-06, "epistemic_std": 5e-06}, {"fold": "fold_5", "regime": "Low-vol plateau", "sharpe": 7.2378, "sortino": 13.8448, "return_pct": 24.43, "equity": 1244.33, "max_dd": 2.78, "win_rate": 67.86, "profit_factor": 3.416, "ic": 0.7363, "hit": 67.86, "n": 112, "precision": 0.6, "recall": 0.9623, "f1": 0.7391, "f2": 0.8586, "mcc": 0.4506, "accuracy": 0.6786, "tp": 51, "fp": 34, "tn": 25, "fn": 2, "aleatoric_mean": 5e-06, "epistemic_mean": 1e-05, "confidence_mean": 1.0, "aleatoric_std": 2e-06, "epistemic_std": 4e-06}, {"fold": "fold_6", "regime": "EUR crisis downturn", "sharpe": 12.476, "sortino": 29.4927, "return_pct": 25.11, "equity": 1251.14, "max_dd": 0.67, "win_rate": 79.44, "profit_factor": 10.438, "ic": 0.8228, "hit": 78.7, "n": 108, "precision": 0.6765, "recall": 0.9787, "f1": 0.8, "f2": 0.8984, "mcc": 0.6345, "accuracy": 0.787, "tp": 46, "fp": 22, "tn": 39, "fn": 1, "aleatoric_mean": 5e-06, "epistemic_mean": 1e-05, "confidence_mean": 1.0, "aleatoric_std": 2e-06, "epistemic_std": 3e-06}, {"fold": "fold_7", "regime": "Recent mixed/upturn", "sharpe": 5.6326, "sortino": 14.8346, "return_pct": 13.51, "equity": 1135.12, "max_dd": 1.23, "win_rate": 54.55, "profit_factor": 2.488, "ic": 0.6992, "hit": 54.55, "n": 110, "precision": 0.5155, "recall": 0.9434, "f1": 0.6667, "f2": 0.8091, "mcc": 0.1839, "accuracy": 0.5455, "tp": 50, "fp": 47, "tn": 10, "fn": 3, "aleatoric_mean": 7e-06, "epistemic_mean": 1.4e-05, "confidence_mean": 1.0, "aleatoric_std": 2e-06, "epistemic_std": 5e-06}], "train_sharpe": 5.2776, "train_psr": 1.0, "train_equity": 433851.59, "train_sortino": 12.8186, "train_return_pct": 43285.16, "train_max_dd": 5.15, "train_win_rate": 67.42, "train_profit_factor": 3.415, "train_ic": 0.6624, "train_hit": 67.15, "train_precision": 0.6146, "train_recall": 0.9702, "train_f1": 0.7525, "train_f2": 0.8696, "train_mcc": 0.4173, "train_accuracy": 0.6719, "train_per_window": [{"fold": "all_train", "regime": "Training data", "sharpe": 5.2776, "sortino": 12.8186, "return_pct": 43285.16, "equity": 433851.59, "max_dd": 5.15, "win_rate": 67.42, "profit_factor": 3.415, "ic": 0.6624, "hit": 67.15, "n": 2478, "precision": 0.6146, "recall": 0.9702, "f1": 0.7525, "f2": 0.8696, "mcc": 0.4173, "accuracy": 0.6719, "tp": 1236, "fp": 775, "tn": 429, "fn": 38}], "experiment_num": 145, "status": "DISCARD"}
{"backbone": "lstm", "description": "lstm: Exp41 seq=12 slightly longer window", "config": {"seq_len": 12, "lr": 0.001, "batch_size": 16, "epochs": 100, "weight_decay": 0.0007, "patience": 15, "grad_clip": 1.0, "warmup_epochs": 0, "huber_delta": 1.0, "head_dropout": 0.25, "seed": 42, "het_loss": false}, "composite": 4.3504, "test_pos_folds": 7, "val_pos_folds": 5, "val_loss": 2.9e-05, "elapsed_sec": 43.6, "timestamp": "2026-04-19T19:56:22", "sharpe": 4.5504, "psr": 1.0, "equity": 5976.06, "sortino": 5.3555, "return_pct": 497.61, "max_dd": 8.42, "win_rate": 66.7, "profit_factor": 2.356, "ic": 0.441, "hit": 66.42, "aleatoric_mean": 1.3e-05, "epistemic_mean": 2.7e-05, "confidence_mean": 1.0, "precision": 0.6689, "recall": 0.6435, "f1": 0.6559, "f2": 0.6484, "mcc": 0.3325, "accuracy": 0.6663, "per_window": [{"fold": "fold_1", "regime": "Pre-crisis upturn + GFC onset", "sharpe": 1.07, "sortino": 1.1284, "return_pct": 7.67, "equity": 1076.69, "max_dd": 8.42, "win_rate": 56.0, "profit_factor": 1.292, "ic": 0.1954, "hit": 55.45, "n": 101, "precision": 0.6061, "recall": 0.3846, "f1": 0.4706, "f2": 0.4149, "mcc": 0.1271, "accuracy": 0.5545, "tp": 20, "fp": 13, "tn": 36, "fn": 32, "aleatoric_mean": 1.6e-05, "epistemic_mean": 3.3e-05, "confidence_mean": 1.0, "aleatoric_std": 6e-06, "epistemic_std": 1.3e-05}, {"fold": "fold_2", "regime": "Post-crash recovery", "sharpe": 1.0145, "sortino": 1.7592, "return_pct": 4.59, "equity": 1045.88, "max_dd": 4.74, "win_rate": 55.24, "profit_factor": 1.172, "ic": 0.1121, "hit": 55.24, "n": 105, "precision": 0.5256, "recall": 0.8039, "f1": 0.6357, "f2": 0.727, "mcc": 0.1358, "accuracy": 0.5524, "tp": 41, "fp": 37, "tn": 17, "fn": 10, "aleatoric_mean": 1.6e-05, "epistemic_mean": 3.2e-05, "confidence_mean": 1.0, "aleatoric_std": 7e-06, "epistemic_std": 1.5e-05}, {"fold": "fold_3", "regime": "Eurozone debt plateau", "sharpe": 7.2874, "sortino": 11.3943, "return_pct": 25.96, "equity": 1259.6, "max_dd": 4.4, "win_rate": 72.55, "profit_factor": 3.152, "ic": 0.4814, "hit": 71.15, "n": 104, "precision": 0.6901, "recall": 0.875, "f1": 0.7717, "f2": 0.8305, "mcc": 0.4463, "accuracy": 0.7212, "tp": 49, "fp": 22, "tn": 26, "fn": 7, "aleatoric_mean": 1.8e-05, "epistemic_mean": 3.5e-05, "confidence_mean": 0.9999, "aleatoric_std": 7e-06, "epistemic_std": 1.4e-05}, {"fold": "fold_4", "regime": "Strong USD downturn", "sharpe": 7.5995, "sortino": 13.9719, "return_pct": 68.86, "equity": 1688.59, "max_dd": 4.07, "win_rate": 70.3, "profit_factor": 3.723, "ic": 0.6693, "hit": 69.88, "n": 166, "precision": 0.8723, "recall": 0.4881, "f1": 0.626, "f2": 0.5352, "mcc": 0.4605, "accuracy": 0.7048, "tp": 41, "fp": 6, "tn": 76, "fn": 43, "aleatoric_mean": 1.3e-05, "epistemic_mean": 2.6e-05, "confidence_mean": 1.0, "aleatoric_std": 5e-06, "epistemic_std": 1e-05}, {"fold": "fold_5", "regime": "Low-vol plateau", "sharpe": 7.3555, "sortino": 13.3759, "return_pct": 24.59, "equity": 1245.89, "max_dd": 1.01, "win_rate": 68.12, "profit_factor": 3.491, "ic": 0.5792, "hit": 68.12, "n": 160, "precision": 0.6471, "recall": 0.7237, "f1": 0.6832, "f2": 0.7069, "mcc": 0.3668, "accuracy": 0.6813, "tp": 55, "fp": 30, "tn": 54, "fn": 21, "aleatoric_mean": 8e-06, "epistemic_mean": 1.6e-05, "confidence_mean": 1.0, "aleatoric_std": 3e-06, "epistemic_std": 6e-06}, {"fold": "fold_6", "regime": "EUR crisis downturn", "sharpe": 8.0618, "sortino": 12.427, "return_pct": 56.31, "equity": 1563.07, "max_dd": 3.2, "win_rate": 71.17, "profit_factor": 3.758, "ic": 0.6146, "hit": 71.17, "n": 163, "precision": 0.6747, "recall": 0.7368, "f1": 0.7044, "f2": 0.7235, "mcc": 0.4256, "accuracy": 0.7117, "tp": 56, "fp": 27, "tn": 60, "fn": 20, "aleatoric_mean": 1.3e-05, "epistemic_mean": 2.6e-05, "confidence_mean": 1.0, "aleatoric_std": 5e-06, "epistemic_std": 1e-05}, {"fold": "fold_7", "regime": "Recent mixed/upturn", "sharpe": 4.3874, "sortino": 5.0776, "return_pct": 28.12, "equity": 1281.22, "max_dd": 5.42, "win_rate": 67.5, "profit_factor": 2.103, "ic": 0.491, "hit": 67.5, "n": 160, "precision": 0.7288, "recall": 0.5443, "f1": 0.6232, "f2": 0.5733, "mcc": 0.3593, "accuracy": 0.675, "tp": 43, "fp": 16, "tn": 65, "fn": 36, "aleatoric_mean": 1.4e-05, "epistemic_mean": 2.7e-05, "confidence_mean": 1.0, "aleatoric_std": 6e-06, "epistemic_std": 1.2e-05}], "val_sharpe": 5.4726, "val_psr": 1.0, "val_equity": 3319.08, "val_sortino": 7.9257, "val_return_pct": 231.91, "val_max_dd": 10.92, "val_win_rate": 66.22, "val_profit_factor": 2.555, "val_ic": 0.4432, "val_hit": 65.78, "val_aleatoric_mean": 1.1e-05, "val_epistemic_mean": 2.2e-05, "val_confidence_mean": 1.0, "val_precision": 0.6301, "val_recall": 0.688, "val_f1": 0.6578, "val_f2": 0.6756, "val_mcc": 0.3208, "val_accuracy": 0.6592, "val_per_window": [{"fold": "fold_1", "regime": "Pre-crisis upturn + GFC onset", "sharpe": -1.5295, "sortino": -2.3676, "return_pct": -3.78, "equity": 962.17, "max_dd": 7.69, "win_rate": 48.11, "profit_factor": 0.775, "ic": -0.0833, "hit": 47.66, "n": 107, "precision": 0.4762, "recall": 0.566, "f1": 0.5172, "f2": 0.5455, "mcc": -0.0458, "accuracy": 0.4766, "tp": 30, "fp": 33, "tn": 21, "fn": 23, "aleatoric_mean": 1e-05, "epistemic_mean": 2.1e-05, "confidence_mean": 1.0, "aleatoric_std": 4e-06, "epistemic_std": 9e-06}, {"fold": "fold_2", "regime": "Post-crash recovery", "sharpe": -1.014, "sortino": -1.5546, "return_pct": -4.96, "equity": 950.42, "max_dd": 10.5, "win_rate": 49.06, "profit_factor": 0.852, "ic": 0.062, "hit": 49.06, "n": 106, "precision": 0.6957, "recall": 0.254, "f1": 0.3721, "f2": 0.2909, "mcc": 0.1086, "accuracy": 0.4906, "tp": 16, "fp": 7, "tn": 36, "fn": 47, "aleatoric_mean": 1.4e-05, "epistemic_mean": 2.8e-05, "confidence_mean": 1.0, "aleatoric_std": 6e-06, "epistemic_std": 1.1e-05}, {"fold": "fold_3", "regime": "Eurozone debt plateau", "sharpe": 8.4204, "sortino": 17.0827, "return_pct": 34.34, "equity": 1343.36, "max_dd": 1.3, "win_rate": 67.29, "profit_factor": 4.036, "ic": 0.6377, "hit": 66.06, "n": 109, "precision": 0.5606, "recall": 0.8222, "f1": 0.6667, "f2": 0.752, "mcc": 0.3718, "accuracy": 0.6606, "tp": 37, "fp": 29, "tn": 35, "fn": 8, "aleatoric_mean": 1.1e-05, "epistemic_mean": 2.2e-05, "confidence_mean": 1.0, "aleatoric_std": 4e-06, "epistemic_std": 7e-06}, {"fold": "fold_4", "regime": "Strong USD downturn", "sharpe": 10.4078, "sortino": 22.9975, "return_pct": 34.6, "equity": 1346.04, "max_dd": 1.2, "win_rate": 77.57, "profit_factor": 6.188, "ic": 0.7227, "hit": 76.85, "n": 108, "precision": 0.6774, "recall": 0.8936, "f1": 0.7706, "f2": 0.84, "mcc": 0.5672, "accuracy": 0.7685, "tp": 42, "fp": 20, "tn": 41, "fn": 5, "aleatoric_mean": 1.3e-05, "epistemic_mean": 2.7e-05, "confidence_mean": 1.0, "aleatoric_std": 5e-06, "epistemic_std": 1e-05}, {"fold": "fold_5", "regime": "Low-vol plateau", "sharpe": 12.604, "sortino": 37.8076, "return_pct": 38.28, "equity": 1382.84, "max_dd": 0.54, "win_rate": 78.18, "profit_factor": 10.04, "ic": 0.7529, "hit": 78.18, "n": 110, "precision": 0.7547, "recall": 0.7843, "f1": 0.7692, "f2": 0.7782, "mcc": 0.5629, "accuracy": 0.7818, "tp": 40, "fp": 13, "tn": 46, "fn": 11, "aleatoric_mean": 8e-06, "epistemic_mean": 1.6e-05, "confidence_mean": 1.0, "aleatoric_std": 3e-06, "epistemic_std": 5e-06}, {"fold": "fold_6", "regime": "EUR crisis downturn", "sharpe": 11.9737, "sortino": 26.1089, "return_pct": 24.13, "equity": 1241.31, "max_dd": 0.55, "win_rate": 79.05, "profit_factor": 9.012, "ic": 0.7311, "hit": 78.3, "n": 106, "precision": 0.7358, "recall": 0.8298, "f1": 0.78, "f2": 0.8091, "mcc": 0.5887, "accuracy": 0.7925, "tp": 39, "fp": 14, "tn": 45, "fn": 8, "aleatoric_mean": 9e-06, "epistemic_mean": 1.7e-05, "confidence_mean": 1.0, "aleatoric_std": 3e-06, "epistemic_std": 6e-06}, {"fold": "fold_7", "regime": "Recent mixed/upturn", "sharpe": 7.4616, "sortino": 17.8463, "return_pct": 16.94, "equity": 1169.37, "max_dd": 1.39, "win_rate": 63.89, "profit_factor": 3.377, "ic": 0.5625, "hit": 63.89, "n": 108, "precision": 0.5972, "recall": 0.8113, "f1": 0.688, "f2": 0.757, "mcc": 0.3012, "accuracy": 0.6389, "tp": 43, "fp": 29, "tn": 26, "fn": 10, "aleatoric_mean": 1.2e-05, "epistemic_mean": 2.4e-05, "confidence_mean": 1.0, "aleatoric_std": 5e-06, "epistemic_std": 1e-05}], "train_sharpe": 5.7901, "train_psr": 1.0, "train_equity": 668555.75, "train_sortino": 14.8103, "train_return_pct": 66755.57, "train_max_dd": 5.97, "train_win_rate": 68.87, "train_profit_factor": 3.945, "train_ic": 0.5919, "train_hit": 68.59, "train_precision": 0.7387, "train_recall": 0.604, "train_f1": 0.6646, "train_f2": 0.6269, "train_mcc": 0.3857, "train_accuracy": 0.6884, "train_per_window": [{"fold": "all_train", "regime": "Training data", "sharpe": 5.7901, "sortino": 14.8103, "return_pct": 66755.57, "equity": 668555.75, "max_dd": 5.97, "win_rate": 68.87, "profit_factor": 3.945, "ic": 0.5919, "hit": 68.59, "n": 2426, "precision": 0.7387, "recall": 0.604, "f1": 0.6646, "f2": 0.6269, "mcc": 0.3857, "accuracy": 0.6884, "tp": 749, "fp": 265, "tn": 921, "fn": 491}], "experiment_num": 146, "status": "DISCARD"}
