{"backbone": "lightgbm", "description": "lgbm: Exp2 num_leaves=31 standard", "config": {"seq_len": 10, "lr": 0.0003, "batch_size": 32, "epochs": 20, "weight_decay": 1e-05, "patience": 5, "grad_clip": 1.0, "warmup_epochs": 0, "huber_delta": 1.0, "head_dropout": 0.1, "seed": 42, "num_leaves": 31, "het_loss": false}, "composite": 7.4053, "test_pos_folds": 6, "val_pos_folds": 6, "val_loss": 0.0, "elapsed_sec": 32.8, "timestamp": "2026-04-21T07:01:04", "sharpe": 7.6053, "psr": 1.0, "equity": 17259.68, "sortino": 7.8246, "return_pct": 1625.97, "max_dd": 7.74, "win_rate": 76.99, "profit_factor": 4.458, "ic": 0.6406, "hit": 76.67, "precision": 0.7918, "recall": 0.7193, "f1": 0.7538, "f2": 0.7327, "mcc": 0.5371, "accuracy": 0.7677, "per_window": [{"fold": "fold_1", "regime": "Pre-crisis upturn + GFC onset", "sharpe": -0.556, "sortino": -0.6477, "return_pct": -4.89, "equity": 951.05, "max_dd": 7.74, "win_rate": 47.06, "profit_factor": 0.877, "ic": -0.003, "hit": 46.6, "n": 103, "precision": 0.4615, "recall": 0.2264, "f1": 0.3038, "f2": 0.2521, "mcc": -0.0617, "accuracy": 0.466, "tp": 12, "fp": 14, "tn": 36, "fn": 41}, {"fold": "fold_2", "regime": "Post-crash recovery", "sharpe": 1.7075, "sortino": 3.0741, "return_pct": 8.2, "equity": 1081.97, "max_dd": 4.21, "win_rate": 52.34, "profit_factor": 1.307, "ic": -0.0118, "hit": 52.34, "n": 107, "precision": 0.5, "recall": 0.4118, "f1": 0.4516, "f2": 0.4268, "mcc": 0.0376, "accuracy": 0.5234, "tp": 21, "fp": 21, "tn": 35, "fn": 30}, {"fold": "fold_3", "regime": "Eurozone debt plateau", "sharpe": 15.4416, "sortino": 22.034, "return_pct": 47.91, "equity": 1479.11, "max_dd": 1.32, "win_rate": 88.46, "profit_factor": 14.236, "ic": 0.8104, "hit": 86.79, "n": 106, "precision": 0.9057, "recall": 0.8421, "f1": 0.8727, "f2": 0.8541, "mcc": 0.738, "accuracy": 0.8679, "tp": 48, "fp": 5, "tn": 44, "fn": 9}, {"fold": "fold_4", "regime": "Strong USD downturn", "sharpe": 14.4876, "sortino": 33.1997, "return_pct": 128.92, "equity": 2289.18, "max_dd": 0.97, "win_rate": 89.22, "profit_factor": 18.743, "ic": 0.878, "hit": 88.69, "n": 168, "precision": 0.9146, "recall": 0.8721, "f1": 0.8929, "f2": 0.8803, "mcc": 0.7867, "accuracy": 0.8929, "tp": 75, "fp": 7, "tn": 75, "fn": 11}, {"fold": "fold_5", "regime": "Low-vol plateau", "sharpe": 15.2333, "sortino": 80.3879, "return_pct": 44.12, "equity": 1441.25, "max_dd": 0.23, "win_rate": 83.33, "profit_factor": 22.291, "ic": 0.892, "hit": 83.33, "n": 162, "precision": 0.8182, "recall": 0.8289, "f1": 0.8235, "f2": 0.8268, "mcc": 0.6657, "accuracy": 0.8333, "tp": 63, "fp": 14, "tn": 72, "fn": 13}, {"fold": "fold_6", "regime": "EUR crisis downturn", "sharpe": 14.9414, "sortino": 60.111, "return_pct": 97.83, "equity": 1978.34, "max_dd": 0.43, "win_rate": 80.61, "profit_factor": 15.531, "ic": 0.862, "hit": 80.61, "n": 165, "precision": 0.8, "recall": 0.7792, "f1": 0.7895, "f2": 0.7833, "mcc": 0.6099, "accuracy": 0.8061, "tp": 60, "fp": 15, "tn": 73, "fn": 17}, {"fold": "fold_7", "regime": "Recent mixed/upturn", "sharpe": 11.494, "sortino": 15.7905, "return_pct": 73.74, "equity": 1737.37, "max_dd": 1.64, "win_rate": 82.1, "profit_factor": 8.362, "ic": 0.8042, "hit": 82.1, "n": 162, "precision": 0.8171, "recall": 0.8272, "f1": 0.8221, "f2": 0.8251, "mcc": 0.642, "accuracy": 0.821, "tp": 67, "fp": 15, "tn": 66, "fn": 14}], "val_sharpe": 8.3503, "val_psr": 1.0, "val_equity": 5731.7, "val_sortino": 10.6714, "val_return_pct": 473.17, "val_max_dd": 9.33, "val_win_rate": 75.62, "val_profit_factor": 4.323, "val_ic": 0.6528, "val_hit": 75.13, "val_precision": 0.7007, "val_recall": 0.8466, "val_f1": 0.7667, "val_f2": 0.8127, "val_mcc": 0.5242, "val_accuracy": 0.7552, "val_per_window": [{"fold": "fold_1", "regime": "Pre-crisis upturn + GFC onset", "sharpe": 2.6123, "sortino": 5.096, "return_pct": 6.65, "equity": 1066.47, "max_dd": 2.13, "win_rate": 50.93, "profit_factor": 1.543, "ic": -0.094, "hit": 50.46, "n": 109, "precision": 0.5054, "recall": 0.8545, "f1": 0.6351, "f2": 0.7508, "mcc": 0.0038, "accuracy": 0.5046, "tp": 47, "fp": 46, "tn": 8, "fn": 8}, {"fold": "fold_2", "regime": "Post-crash recovery", "sharpe": -0.4602, "sortino": -0.712, "return_pct": -2.48, "equity": 975.22, "max_dd": 9.33, "win_rate": 48.15, "profit_factor": 0.93, "ic": -0.1147, "hit": 48.15, "n": 108, "precision": 0.5507, "recall": 0.6032, "f1": 0.5758, "f2": 0.5919, "mcc": -0.088, "accuracy": 0.4815, "tp": 38, "fp": 31, "tn": 14, "fn": 25}, {"fold": "fold_3", "regime": "Eurozone debt plateau", "sharpe": 15.3918, "sortino": 40.6716, "return_pct": 56.08, "equity": 1560.75, "max_dd": 0.64, "win_rate": 86.24, "profit_factor": 18.293, "ic": 0.8528, "hit": 84.68, "n": 111, "precision": 0.7818, "recall": 0.9149, "f1": 0.8431, "f2": 0.8848, "mcc": 0.7188, "accuracy": 0.8559, "tp": 43, "fp": 12, "tn": 52, "fn": 4}, {"fold": "fold_4", "regime": "Strong USD downturn", "sharpe": 16.1705, "sortino": 46.8114, "return_pct": 48.05, "equity": 1480.5, "max_dd": 0.39, "win_rate": 91.74, "profit_factor": 30.604, "ic": 0.9244, "hit": 90.91, "n": 110, "precision": 0.913, "recall": 0.8936, "f1": 0.9032, "f2": 0.8974, "mcc": 0.8325, "accuracy": 0.9182, "tp": 42, "fp": 4, "tn": 59, "fn": 5}, {"fold": "fold_5", "regime": "Low-vol plateau", "sharpe": 14.7026, "sortino": 62.3291, "return_pct": 43.17, "equity": 1431.67, "max_dd": 0.34, "win_rate": 83.04, "profit_factor": 18.244, "ic": 0.9155, "hit": 83.04, "n": 112, "precision": 0.7931, "recall": 0.8679, "f1": 0.8288, "f2": 0.8519, "mcc": 0.664, "accuracy": 0.8304, "tp": 46, "fp": 12, "tn": 47, "fn": 7}, {"fold": "fold_6", "regime": "EUR crisis downturn", "sharpe": 14.8217, "sortino": 63.1087, "return_pct": 28.08, "equity": 1280.85, "max_dd": 0.25, "win_rate": 84.11, "profit_factor": 21.552, "ic": 0.9123, "hit": 83.33, "n": 108, "precision": 0.7778, "recall": 0.8936, "f1": 0.8317, "f2": 0.8678, "mcc": 0.691, "accuracy": 0.8426, "tp": 42, "fp": 12, "tn": 49, "fn": 5}, {"fold": "fold_7", "regime": "Recent mixed/upturn", "sharpe": 15.2012, "sortino": 55.0177, "return_pct": 30.06, "equity": 1300.62, "max_dd": 0.34, "win_rate": 84.55, "profit_factor": 15.976, "ic": 0.8728, "hit": 84.55, "n": 110, "precision": 0.7727, "recall": 0.9623, "f1": 0.8571, "f2": 0.9173, "mcc": 0.7131, "accuracy": 0.8455, "tp": 51, "fp": 15, "tn": 42, "fn": 2}], "train_sharpe": 11.1246, "train_psr": 1.0, "train_equity": 66653140.0, "train_sortino": 247.2531, "train_return_pct": 6665214.0, "train_max_dd": 0.2, "train_win_rate": 96.72, "train_profit_factor": 410.391, "train_ic": 0.9927, "train_hit": 96.33, "train_precision": 0.9611, "train_recall": 0.9702, "train_f1": 0.9656, "train_f2": 0.9683, "train_mcc": 0.9289, "train_accuracy": 0.9645, "train_per_window": [{"fold": "all_train", "regime": "Training data", "sharpe": 11.1246, "sortino": 247.2531, "return_pct": 6665214.0, "equity": 66653140.0, "max_dd": 0.2, "win_rate": 96.72, "profit_factor": 410.391, "ic": 0.9927, "hit": 96.33, "n": 2478, "precision": 0.9611, "recall": 0.9702, "f1": 0.9656, "f2": 0.9683, "mcc": 0.9289, "accuracy": 0.9645, "tp": 1236, "fp": 50, "tn": 1154, "fn": 38}], "experiment_num": 205, "status": "DISCARD"}
{"backbone": "lightgbm", "description": "lgbm: Exp3 num_leaves=127 deeper", "config": {"seq_len": 10, "lr": 0.0003, "batch_size": 32, "epochs": 20, "weight_decay": 1e-05, "patience": 5, "grad_clip": 1.0, "warmup_epochs": 0, "huber_delta": 1.0, "head_dropout": 0.1, "seed": 42, "num_leaves": 127, "het_loss": false}, "composite": 7.4954, "test_pos_folds": 6, "val_pos_folds": 6, "val_loss": 0.0, "elapsed_sec": 31.8, "timestamp": "2026-04-21T07:01:46", "sharpe": 7.7533, "psr": 1.0, "equity": 18057.9, "sortino": 7.7852, "return_pct": 1705.79, "max_dd": 7.74, "win_rate": 78.33, "profit_factor": 4.611, "ic": 0.6442, "hit": 78.01, "precision": 0.8078, "recall": 0.7339, "f1": 0.7691, "f2": 0.7476, "mcc": 0.5661, "accuracy": 0.7821, "per_window": [{"fold": "fold_1", "regime": "Pre-crisis upturn + GFC onset", "sharpe": -0.6861, "sortino": -0.8061, "return_pct": -5.84, "equity": 941.58, "max_dd": 7.74, "win_rate": 46.08, "profit_factor": 0.85, "ic": 0.024, "hit": 45.63, "n": 103, "precision": 0.4545, "recall": 0.1887, "f1": 0.2667, "f2": 0.2137, "mcc": -0.0626, "accuracy": 0.466, "tp": 10, "fp": 12, "tn": 38, "fn": 43}, {"fold": "fold_2", "regime": "Post-crash recovery", "sharpe": 1.9799, "sortino": 3.5455, "return_pct": 9.59, "equity": 1095.93, "max_dd": 3.43, "win_rate": 53.27, "profit_factor": 1.364, "ic": -0.0184, "hit": 53.27, "n": 107, "precision": 0.5128, "recall": 0.3922, "f1": 0.4444, "f2": 0.4115, "mcc": 0.0549, "accuracy": 0.5327, "tp": 20, "fp": 19, "tn": 37, "fn": 31}, {"fold": "fold_3", "regime": "Eurozone debt plateau", "sharpe": 14.0785, "sortino": 21.5449, "return_pct": 45.12, "equity": 1451.24, "max_dd": 1.38, "win_rate": 86.54, "profit_factor": 10.539, "ic": 0.8061, "hit": 84.91, "n": 106, "precision": 0.902, "recall": 0.807, "f1": 0.8519, "f2": 0.8244, "mcc": 0.7035, "accuracy": 0.8491, "tp": 46, "fp": 5, "tn": 44, "fn": 11}, {"fold": "fold_4", "regime": "Strong USD downturn", "sharpe": 14.3402, "sortino": 29.7976, "return_pct": 127.85, "equity": 2278.55, "max_dd": 0.97, "win_rate": 90.42, "profit_factor": 17.81, "ic": 0.883, "hit": 89.88, "n": 168, "precision": 0.9167, "recall": 0.8953, "f1": 0.9059, "f2": 0.8995, "mcc": 0.8098, "accuracy": 0.9048, "tp": 77, "fp": 7, "tn": 75, "fn": 9}, {"fold": "fold_5", "regime": "Low-vol plateau", "sharpe": 15.5098, "sortino": 74.0256, "return_pct": 44.62, "equity": 1446.18, "max_dd": 0.23, "win_rate": 84.57, "profit_factor": 24.859, "ic": 0.9022, "hit": 84.57, "n": 162, "precision": 0.8228, "recall": 0.8553, "f1": 0.8387, "f2": 0.8486, "mcc": 0.6914, "accuracy": 0.8457, "tp": 65, "fp": 14, "tn": 72, "fn": 11}, {"fold": "fold_6", "regime": "EUR crisis downturn", "sharpe": 15.181, "sortino": 62.6508, "return_pct": 98.98, "equity": 1989.78, "max_dd": 0.43, "win_rate": 81.21, "profit_factor": 16.607, "ic": 0.8586, "hit": 81.21, "n": 165, "precision": 0.8026, "recall": 0.7922, "f1": 0.7974, "f2": 0.7943, "mcc": 0.6223, "accuracy": 0.8121, "tp": 61, "fp": 15, "tn": 73, "fn": 16}, {"fold": "fold_7", "regime": "Recent mixed/upturn", "sharpe": 13.4548, "sortino": 16.797, "return_pct": 83.91, "equity": 1839.08, "max_dd": 1.64, "win_rate": 88.27, "profit_factor": 14.033, "ic": 0.8075, "hit": 88.27, "n": 162, "precision": 0.8605, "recall": 0.9136, "f1": 0.8862, "f2": 0.9024, "mcc": 0.7669, "accuracy": 0.8827, "tp": 74, "fp": 12, "tn": 69, "fn": 7}], "val_sharpe": 7.6954, "val_psr": 1.0, "val_equity": 5131.71, "val_sortino": 9.6572, "val_return_pct": 413.17, "val_max_dd": 14.42, "val_win_rate": 74.05, "val_profit_factor": 3.819, "val_ic": 0.6367, "val_hit": 73.57, "val_precision": 0.6871, "val_recall": 0.8301, "val_f1": 0.7519, "val_f2": 0.7969, "val_mcc": 0.4926, "val_accuracy": 0.7396, "val_per_window": [{"fold": "fold_1", "regime": "Pre-crisis upturn + GFC onset", "sharpe": 0.545, "sortino": 0.9876, "return_pct": 1.31, "equity": 1013.1, "max_dd": 2.88, "win_rate": 43.52, "profit_factor": 1.095, "ic": -0.1155, "hit": 43.12, "n": 109, "precision": 0.4615, "recall": 0.7636, "f1": 0.5753, "f2": 0.6752, "mcc": -0.1936, "accuracy": 0.4312, "tp": 42, "fp": 49, "tn": 5, "fn": 13}, {"fold": "fold_2", "regime": "Post-crash recovery", "sharpe": -1.6092, "sortino": -2.4267, "return_pct": -7.73, "equity": 922.66, "max_dd": 14.42, "win_rate": 48.15, "profit_factor": 0.776, "ic": -0.1488, "hit": 48.15, "n": 108, "precision": 0.5522, "recall": 0.5873, "f1": 0.5692, "f2": 0.5799, "mcc": -0.0806, "accuracy": 0.4815, "tp": 37, "fp": 30, "tn": 15, "fn": 26}, {"fold": "fold_3", "regime": "Eurozone debt plateau", "sharpe": 15.2385, "sortino": 41.4383, "return_pct": 55.71, "equity": 1557.15, "max_dd": 0.64, "win_rate": 85.32, "profit_factor": 17.467, "ic": 0.844, "hit": 83.78, "n": 111, "precision": 0.7679, "recall": 0.9149, "f1": 0.835, "f2": 0.8811, "mcc": 0.7034, "accuracy": 0.8468, "tp": 43, "fp": 13, "tn": 51, "fn": 4}, {"fold": "fold_4", "regime": "Strong USD downturn", "sharpe": 15.7309, "sortino": 48.7482, "return_pct": 47.26, "equity": 1472.58, "max_dd": 0.59, "win_rate": 88.07, "profit_factor": 25.302, "ic": 0.9147, "hit": 87.27, "n": 110, "precision": 0.8542, "recall": 0.8723, "f1": 0.8632, "f2": 0.8686, "mcc": 0.7593, "accuracy": 0.8818, "tp": 41, "fp": 7, "tn": 56, "fn": 6}, {"fold": "fold_5", "regime": "Low-vol plateau", "sharpe": 14.9444, "sortino": 68.1615, "return_pct": 43.62, "equity": 1436.19, "max_dd": 0.3, "win_rate": 83.93, "profit_factor": 19.815, "ic": 0.9036, "hit": 83.93, "n": 112, "precision": 0.807, "recall": 0.8679, "f1": 0.8364, "f2": 0.855, "mcc": 0.6806, "accuracy": 0.8393, "tp": 46, "fp": 11, "tn": 48, "fn": 7}, {"fold": "fold_6", "regime": "EUR crisis downturn", "sharpe": 15.0507, "sortino": 64.2422, "return_pct": 28.34, "equity": 1283.44, "max_dd": 0.25, "win_rate": 85.05, "profit_factor": 23.618, "ic": 0.9097, "hit": 84.26, "n": 108, "precision": 0.7818, "recall": 0.9149, "f1": 0.8431, "f2": 0.8848, "mcc": 0.7122, "accuracy": 0.8519, "tp": 43, "fp": 12, "tn": 49, "fn": 4}, {"fold": "fold_7", "regime": "Recent mixed/upturn", "sharpe": 15.0546, "sortino": 56.4575, "return_pct": 29.89, "equity": 1298.89, "max_dd": 0.34, "win_rate": 83.64, "profit_factor": 15.355, "ic": 0.8745, "hit": 83.64, "n": 110, "precision": 0.7612, "recall": 0.9623, "f1": 0.85, "f2": 0.914, "mcc": 0.6979, "accuracy": 0.8364, "tp": 51, "fp": 16, "tn": 41, "fn": 2}], "train_sharpe": 11.1314, "train_psr": 1.0, "train_equity": 66958728.0, "train_sortino": 277.7088, "train_return_pct": 6695772.8, "train_max_dd": 0.12, "train_win_rate": 96.76, "train_profit_factor": 447.96, "train_ic": 0.9925, "train_hit": 96.37, "train_precision": 0.9583, "train_recall": 0.9741, "train_f1": 0.9661, "train_f2": 0.9709, "train_mcc": 0.9298, "train_accuracy": 0.9649, "train_per_window": [{"fold": "all_train", "regime": "Training data", "sharpe": 11.1314, "sortino": 277.7088, "return_pct": 6695772.8, "equity": 66958728.0, "max_dd": 0.12, "win_rate": 96.76, "profit_factor": 447.96, "ic": 0.9925, "hit": 96.37, "n": 2478, "precision": 0.9583, "recall": 0.9741, "f1": 0.9661, "f2": 0.9709, "mcc": 0.9298, "accuracy": 0.9649, "tp": 1241, "fp": 54, "tn": 1150, "fn": 33}], "experiment_num": 206, "status": "DISCARD"}
{"backbone": "lightgbm", "description": "lgbm: Exp4 num_leaves=15 shallow", "config": {"seq_len": 10, "lr": 0.0003, "batch_size": 32, "epochs": 20, "weight_decay": 1e-05, "patience": 5, "grad_clip": 1.0, "warmup_epochs": 0, "huber_delta": 1.0, "head_dropout": 0.1, "seed": 42, "num_leaves": 15, "het_loss": false}, "composite": 7.4013, "test_pos_folds": 6, "val_pos_folds": 6, "val_loss": 0.0, "elapsed_sec": 34.2, "timestamp": "2026-04-21T07:02:30", "sharpe": 7.6013, "psr": 1.0, "equity": 17238.44, "sortino": 7.6484, "return_pct": 1623.84, "max_dd": 7.54, "win_rate": 78.12, "profit_factor": 4.454, "ic": 0.6427, "hit": 77.8, "precision": 0.8069, "recall": 0.7297, "f1": 0.7664, "f2": 0.744, "mcc": 0.5621, "accuracy": 0.7801, "per_window": [{"fold": "fold_1", "regime": "Pre-crisis upturn + GFC onset", "sharpe": -0.2406, "sortino": -0.2721, "return_pct": -2.56, "equity": 974.44, "max_dd": 7.54, "win_rate": 50.98, "profit_factor": 0.945, "ic": 0.0135, "hit": 50.49, "n": 103, "precision": 0.5556, "recall": 0.283, "f1": 0.375, "f2": 0.3138, "mcc": 0.0489, "accuracy": 0.5146, "tp": 15, "fp": 12, "tn": 38, "fn": 38}, {"fold": "fold_2", "regime": "Post-crash recovery", "sharpe": 0.8928, "sortino": 1.5879, "return_pct": 4.09, "equity": 1040.9, "max_dd": 5.84, "win_rate": 51.4, "profit_factor": 1.15, "ic": -0.0217, "hit": 51.4, "n": 107, "precision": 0.4878, "recall": 0.3922, "f1": 0.4348, "f2": 0.4082, "mcc": 0.0176, "accuracy": 0.514, "tp": 20, "fp": 21, "tn": 35, "fn": 31}, {"fold": "fold_3", "regime": "Eurozone debt plateau", "sharpe": 14.4291, "sortino": 22.1935, "return_pct": 45.87, "equity": 1458.7, "max_dd": 1.38, "win_rate": 86.54, "profit_factor": 11.347, "ic": 0.8041, "hit": 84.91, "n": 106, "precision": 0.902, "recall": 0.807, "f1": 0.8519, "f2": 0.8244, "mcc": 0.7035, "accuracy": 0.8491, "tp": 46, "fp": 5, "tn": 44, "fn": 11}, {"fold": "fold_4", "regime": "Strong USD downturn", "sharpe": 14.5139, "sortino": 31.9119, "return_pct": 129.11, "equity": 2291.07, "max_dd": 0.97, "win_rate": 89.82, "profit_factor": 18.918, "ic": 0.8737, "hit": 89.29, "n": 168, "precision": 0.9059, "recall": 0.8953, "f1": 0.9006, "f2": 0.8974, "mcc": 0.7976, "accuracy": 0.8988, "tp": 77, "fp": 8, "tn": 74, "fn": 9}, {"fold": "fold_5", "regime": "Low-vol plateau", "sharpe": 15.2857, "sortino": 70.9812, "return_pct": 44.22, "equity": 1442.19, "max_dd": 0.23, "win_rate": 84.57, "profit_factor": 22.743, "ic": 0.901, "hit": 84.57, "n": 162, "precision": 0.8312, "recall": 0.8421, "f1": 0.8366, "f2": 0.8399, "mcc": 0.6905, "accuracy": 0.8457, "tp": 64, "fp": 13, "tn": 73, "fn": 12}, {"fold": "fold_6", "regime": "EUR crisis downturn", "sharpe": 15.1666, "sortino": 59.2369, "return_pct": 98.91, "equity": 1989.09, "max_dd": 0.43, "win_rate": 82.42, "profit_factor": 16.539, "ic": 0.8683, "hit": 82.42, "n": 165, "precision": 0.8333, "recall": 0.7792, "f1": 0.8054, "f2": 0.7895, "mcc": 0.6467, "accuracy": 0.8242, "tp": 60, "fp": 12, "tn": 76, "fn": 17}, {"fold": "fold_7", "regime": "Recent mixed/upturn", "sharpe": 12.1495, "sortino": 16.009, "return_pct": 77.28, "equity": 1772.76, "max_dd": 1.64, "win_rate": 84.57, "profit_factor": 9.807, "ic": 0.8064, "hit": 84.57, "n": 162, "precision": 0.8415, "recall": 0.8519, "f1": 0.8466, "f2": 0.8498, "mcc": 0.6914, "accuracy": 0.8457, "tp": 69, "fp": 13, "tn": 68, "fn": 12}], "val_sharpe": 8.031, "val_psr": 1.0, "val_equity": 5434.6, "val_sortino": 10.4134, "val_return_pct": 443.46, "val_max_dd": 8.76, "val_win_rate": 74.71, "val_profit_factor": 4.068, "val_ic": 0.6502, "val_hit": 74.22, "val_precision": 0.6959, "val_recall": 0.8274, "val_f1": 0.7559, "val_f2": 0.7973, "val_mcc": 0.5035, "val_accuracy": 0.7461, "val_per_window": [{"fold": "fold_1", "regime": "Pre-crisis upturn + GFC onset", "sharpe": 0.8876, "sortino": 1.6675, "return_pct": 2.19, "equity": 1021.88, "max_dd": 3.42, "win_rate": 47.22, "profit_factor": 1.159, "ic": -0.0474, "hit": 46.79, "n": 109, "precision": 0.4835, "recall": 0.8, "f1": 0.6027, "f2": 0.7074, "mcc": -0.0948, "accuracy": 0.4679, "tp": 44, "fp": 47, "tn": 7, "fn": 11}, {"fold": "fold_2", "regime": "Post-crash recovery", "sharpe": -0.3306, "sortino": -0.509, "return_pct": -1.86, "equity": 981.37, "max_dd": 8.76, "win_rate": 49.07, "profit_factor": 0.949, "ic": -0.1201, "hit": 49.07, "n": 108, "precision": 0.5571, "recall": 0.619, "f1": 0.5865, "f2": 0.6056, "mcc": -0.0721, "accuracy": 0.4907, "tp": 39, "fp": 31, "tn": 14, "fn": 24}, {"fold": "fold_3", "regime": "Eurozone debt plateau", "sharpe": 14.6115, "sortino": 30.9451, "return_pct": 54.19, "equity": 1541.95, "max_dd": 0.7, "win_rate": 85.32, "profit_factor": 14.629, "ic": 0.8602, "hit": 83.78, "n": 111, "precision": 0.7679, "recall": 0.9149, "f1": 0.835, "f2": 0.8811, "mcc": 0.7034, "accuracy": 0.8468, "tp": 43, "fp": 13, "tn": 51, "fn": 4}, {"fold": "fold_4", "regime": "Strong USD downturn", "sharpe": 16.4012, "sortino": 52.1346, "return_pct": 48.45, "equity": 1484.54, "max_dd": 0.59, "win_rate": 90.83, "profit_factor": 34.215, "ic": 0.9201, "hit": 90.0, "n": 110, "precision": 0.9302, "recall": 0.8511, "f1": 0.8889, "f2": 0.8658, "mcc": 0.8145, "accuracy": 0.9091, "tp": 40, "fp": 3, "tn": 60, "fn": 7}, {"fold": "fold_5", "regime": "Low-vol plateau", "sharpe": 14.6296, "sortino": 59.3437, "return_pct": 43.03, "equity": 1430.29, "max_dd": 0.34, "win_rate": 83.04, "profit_factor": 17.809, "ic": 0.9164, "hit": 83.04, "n": 112, "precision": 0.7833, "recall": 0.8868, "f1": 0.8319, "f2": 0.864, "mcc": 0.6672, "accuracy": 0.8304, "tp": 47, "fp": 13, "tn": 46, "fn": 6}, {"fold": "fold_6", "regime": "EUR crisis downturn", "sharpe": 14.4262, "sortino": 64.1601, "return_pct": 27.62, "equity": 1276.24, "max_dd": 0.25, "win_rate": 82.24, "profit_factor": 18.624, "ic": 0.9158, "hit": 81.48, "n": 108, "precision": 0.7692, "recall": 0.8511, "f1": 0.8081, "f2": 0.8333, "mcc": 0.6493, "accuracy": 0.8241, "tp": 40, "fp": 12, "tn": 49, "fn": 7}, {"fold": "fold_7", "regime": "Recent mixed/upturn", "sharpe": 14.8918, "sortino": 54.3951, "return_pct": 29.69, "equity": 1296.94, "max_dd": 0.34, "win_rate": 84.55, "profit_factor": 14.708, "ic": 0.8705, "hit": 84.55, "n": 110, "precision": 0.7903, "recall": 0.9245, "f1": 0.8522, "f2": 0.8942, "mcc": 0.7017, "accuracy": 0.8455, "tp": 49, "fp": 13, "tn": 44, "fn": 4}], "train_sharpe": 11.0834, "train_psr": 1.0, "train_equity": 64826124.0, "train_sortino": 209.2795, "train_return_pct": 6482512.4, "train_max_dd": 0.2, "train_win_rate": 95.87, "train_profit_factor": 271.65, "train_ic": 0.9902, "train_hit": 95.48, "train_precision": 0.9498, "train_recall": 0.9662, "train_f1": 0.958, "train_f2": 0.9629, "train_mcc": 0.9129, "train_accuracy": 0.9564, "train_per_window": [{"fold": "all_train", "regime": "Training data", "sharpe": 11.0834, "sortino": 209.2795, "return_pct": 6482512.4, "equity": 64826124.0, "max_dd": 0.2, "win_rate": 95.87, "profit_factor": 271.65, "ic": 0.9902, "hit": 95.48, "n": 2478, "precision": 0.9498, "recall": 0.9662, "f1": 0.958, "f2": 0.9629, "mcc": 0.9129, "accuracy": 0.9564, "tp": 1231, "fp": 65, "tn": 1139, "fn": 43}], "experiment_num": 207, "status": "DISCARD"}
