{"backbone": "lightgbm", "description": "lgbm: Exp5 lr=0.01 (XGBoost winning lr)", "config": {"seq_len": 10, "lr": 0.0003, "batch_size": 32, "epochs": 20, "weight_decay": 1e-05, "patience": 5, "grad_clip": 1.0, "warmup_epochs": 0, "huber_delta": 1.0, "head_dropout": 0.1, "seed": 42, "gbm_lr": 0.01, "het_loss": false}, "composite": 7.3056, "test_pos_folds": 6, "val_pos_folds": 6, "val_loss": 0.0, "elapsed_sec": 55.4, "timestamp": "2026-04-21T07:03:36", "sharpe": 7.5056, "psr": 1.0, "equity": 16737.68, "sortino": 7.6604, "return_pct": 1573.77, "max_dd": 7.71, "win_rate": 77.5, "profit_factor": 4.359, "ic": 0.6481, "hit": 77.18, "precision": 0.8028, "recall": 0.7193, "f1": 0.7588, "f2": 0.7346, "mcc": 0.5501, "accuracy": 0.7739, "per_window": [{"fold": "fold_1", "regime": "Pre-crisis upturn + GFC onset", "sharpe": -0.3116, "sortino": -0.3639, "return_pct": -3.09, "equity": 969.13, "max_dd": 7.54, "win_rate": 47.06, "profit_factor": 0.929, "ic": 0.0321, "hit": 46.6, "n": 103, "precision": 0.4783, "recall": 0.2075, "f1": 0.2895, "f2": 0.234, "mcc": -0.0389, "accuracy": 0.4757, "tp": 11, "fp": 12, "tn": 38, "fn": 42}, {"fold": "fold_2", "regime": "Post-crash recovery", "sharpe": 0.1377, "sortino": 0.2411, "return_pct": 0.39, "equity": 1003.91, "max_dd": 7.71, "win_rate": 49.53, "profit_factor": 1.022, "ic": -0.0112, "hit": 49.53, "n": 107, "precision": 0.4681, "recall": 0.4314, "f1": 0.449, "f2": 0.4382, "mcc": -0.0152, "accuracy": 0.4953, "tp": 22, "fp": 25, "tn": 31, "fn": 29}, {"fold": "fold_3", "regime": "Eurozone debt plateau", "sharpe": 14.8557, "sortino": 23.4465, "return_pct": 46.75, "equity": 1467.5, "max_dd": 1.32, "win_rate": 85.58, "profit_factor": 12.451, "ic": 0.7984, "hit": 83.96, "n": 106, "precision": 0.9, "recall": 0.7895, "f1": 0.8411, "f2": 0.8094, "mcc": 0.6866, "accuracy": 0.8396, "tp": 45, "fp": 5, "tn": 44, "fn": 12}, {"fold": "fold_4", "regime": "Strong USD downturn", "sharpe": 14.5391, "sortino": 33.0194, "return_pct": 129.29, "equity": 2292.87, "max_dd": 0.97, "win_rate": 89.82, "profit_factor": 19.088, "ic": 0.8742, "hit": 89.29, "n": 168, "precision": 0.9367, "recall": 0.8605, "f1": 0.897, "f2": 0.8747, "mcc": 0.8007, "accuracy": 0.8988, "tp": 74, "fp": 5, "tn": 77, "fn": 12}, {"fold": "fold_5", "regime": "Low-vol plateau", "sharpe": 15.4056, "sortino": 70.0367, "return_pct": 44.43, "equity": 1444.34, "max_dd": 0.23, "win_rate": 85.19, "profit_factor": 23.836, "ic": 0.9093, "hit": 85.19, "n": 162, "precision": 0.8421, "recall": 0.8421, "f1": 0.8421, "f2": 0.8421, "mcc": 0.7026, "accuracy": 0.8519, "tp": 64, "fp": 12, "tn": 74, "fn": 12}, {"fold": "fold_6", "regime": "EUR crisis downturn", "sharpe": 14.3663, "sortino": 42.674, "return_pct": 95.01, "equity": 1950.12, "max_dd": 0.87, "win_rate": 80.61, "profit_factor": 13.345, "ic": 0.8668, "hit": 80.61, "n": 165, "precision": 0.8082, "recall": 0.7662, "f1": 0.7867, "f2": 0.7743, "mcc": 0.6098, "accuracy": 0.8061, "tp": 59, "fp": 14, "tn": 74, "fn": 18}, {"fold": "fold_7", "regime": "Recent mixed/upturn", "sharpe": 12.9726, "sortino": 17.6547, "return_pct": 81.52, "equity": 1815.23, "max_dd": 1.64, "win_rate": 86.42, "profit_factor": 12.198, "ic": 0.8096, "hit": 86.42, "n": 162, "precision": 0.8554, "recall": 0.8765, "f1": 0.8659, "f2": 0.8722, "mcc": 0.7286, "accuracy": 0.8642, "tp": 71, "fp": 12, "tn": 69, "fn": 10}], "val_sharpe": 7.825, "val_psr": 1.0, "val_equity": 5247.53, "val_sortino": 9.934, "val_return_pct": 424.75, "val_max_dd": 13.6, "val_win_rate": 74.44, "val_profit_factor": 3.913, "val_ic": 0.6527, "val_hit": 73.96, "val_precision": 0.6979, "val_recall": 0.8164, "val_f1": 0.7525, "val_f2": 0.7896, "val_mcc": 0.4989, "val_accuracy": 0.7448, "val_per_window": [{"fold": "fold_1", "regime": "Pre-crisis upturn + GFC onset", "sharpe": 1.7546, "sortino": 3.3419, "return_pct": 4.43, "equity": 1044.25, "max_dd": 2.33, "win_rate": 46.3, "profit_factor": 1.338, "ic": -0.0923, "hit": 45.87, "n": 109, "precision": 0.4787, "recall": 0.8182, "f1": 0.604, "f2": 0.7166, "mcc": -0.1295, "accuracy": 0.4587, "tp": 45, "fp": 49, "tn": 5, "fn": 10}, {"fold": "fold_2", "regime": "Post-crash recovery", "sharpe": -1.8216, "sortino": -2.8577, "return_pct": -8.66, "equity": 913.35, "max_dd": 13.6, "win_rate": 45.37, "profit_factor": 0.75, "ic": -0.1554, "hit": 45.37, "n": 108, "precision": 0.5312, "recall": 0.5397, "f1": 0.5354, "f2": 0.538, "mcc": -0.1274, "accuracy": 0.4537, "tp": 34, "fp": 30, "tn": 15, "fn": 29}, {"fold": "fold_3", "regime": "Eurozone debt plateau", "sharpe": 14.6115, "sortino": 30.9451, "return_pct": 54.19, "equity": 1541.95, "max_dd": 0.7, "win_rate": 85.32, "profit_factor": 14.629, "ic": 0.8509, "hit": 83.78, "n": 111, "precision": 0.7818, "recall": 0.9149, "f1": 0.8431, "f2": 0.8848, "mcc": 0.7188, "accuracy": 0.8559, "tp": 43, "fp": 12, "tn": 52, "fn": 4}, {"fold": "fold_4", "regime": "Strong USD downturn", "sharpe": 15.365, "sortino": 52.4185, "return_pct": 46.58, "equity": 1465.76, "max_dd": 0.49, "win_rate": 86.24, "profit_factor": 21.969, "ic": 0.9223, "hit": 85.45, "n": 110, "precision": 0.8636, "recall": 0.8085, "f1": 0.8352, "f2": 0.819, "mcc": 0.7202, "accuracy": 0.8636, "tp": 38, "fp": 6, "tn": 57, "fn": 9}, {"fold": "fold_5", "regime": "Low-vol plateau", "sharpe": 15.6247, "sortino": 89.1597, "return_pct": 44.84, "equity": 1448.44, "max_dd": 0.25, "win_rate": 84.82, "profit_factor": 25.683, "ic": 0.9194, "hit": 84.82, "n": 112, "precision": 0.8214, "recall": 0.8679, "f1": 0.844, "f2": 0.8582, "mcc": 0.6974, "accuracy": 0.8482, "tp": 46, "fp": 10, "tn": 49, "fn": 7}, {"fold": "fold_6", "regime": "EUR crisis downturn", "sharpe": 15.2276, "sortino": 62.4689, "return_pct": 28.54, "equity": 1285.42, "max_dd": 0.25, "win_rate": 85.98, "profit_factor": 25.454, "ic": 0.9259, "hit": 85.19, "n": 108, "precision": 0.7963, "recall": 0.9149, "f1": 0.8515, "f2": 0.8884, "mcc": 0.7284, "accuracy": 0.8611, "tp": 43, "fp": 11, "tn": 50, "fn": 4}, {"fold": "fold_7", "regime": "Recent mixed/upturn", "sharpe": 15.7986, "sortino": 60.5691, "return_pct": 30.75, "equity": 1307.47, "max_dd": 0.34, "win_rate": 86.36, "profit_factor": 18.954, "ic": 0.8852, "hit": 86.36, "n": 110, "precision": 0.8167, "recall": 0.9245, "f1": 0.8673, "f2": 0.9007, "mcc": 0.7341, "accuracy": 0.8636, "tp": 49, "fp": 11, "tn": 46, "fn": 4}], "train_sharpe": 10.8925, "train_psr": 1.0, "train_equity": 56909188.0, "train_sortino": 127.4408, "train_return_pct": 5690818.8, "train_max_dd": 0.26, "train_win_rate": 93.27, "train_profit_factor": 104.661, "train_ic": 0.969, "train_hit": 92.9, "train_precision": 0.9218, "train_recall": 0.9443, "train_f1": 0.9329, "train_f2": 0.9397, "train_mcc": 0.8604, "train_accuracy": 0.9302, "train_per_window": [{"fold": "all_train", "regime": "Training data", "sharpe": 10.8925, "sortino": 127.4408, "return_pct": 5690818.8, "equity": 56909188.0, "max_dd": 0.26, "win_rate": 93.27, "profit_factor": 104.661, "ic": 0.969, "hit": 92.9, "n": 2478, "precision": 0.9218, "recall": 0.9443, "f1": 0.9329, "f2": 0.9397, "mcc": 0.8604, "accuracy": 0.9302, "tp": 1203, "fp": 102, "tn": 1102, "fn": 71}], "experiment_num": 208, "status": "DISCARD"}
{"backbone": "lightgbm", "description": "lgbm: Exp6 lr=0.01 num_leaves=31", "config": {"seq_len": 10, "lr": 0.0003, "batch_size": 32, "epochs": 20, "weight_decay": 1e-05, "patience": 5, "grad_clip": 1.0, "warmup_epochs": 0, "huber_delta": 1.0, "head_dropout": 0.1, "seed": 42, "gbm_lr": 0.01, "num_leaves": 31, "het_loss": false}, "composite": 7.239, "test_pos_folds": 6, "val_pos_folds": 6, "val_loss": 0.0, "elapsed_sec": 56.9, "timestamp": "2026-04-21T07:04:43", "sharpe": 7.5192, "psr": 1.0, "equity": 16807.85, "sortino": 7.6513, "return_pct": 1580.79, "max_dd": 7.84, "win_rate": 77.61, "profit_factor": 4.372, "ic": 0.6473, "hit": 77.29, "precision": 0.7973, "recall": 0.7277, "f1": 0.7609, "f2": 0.7406, "mcc": 0.5493, "accuracy": 0.7739, "per_window": [{"fold": "fold_1", "regime": "Pre-crisis upturn + GFC onset", "sharpe": -0.321, "sortino": -0.3772, "return_pct": -3.16, "equity": 968.43, "max_dd": 7.54, "win_rate": 46.08, "profit_factor": 0.927, "ic": 0.0311, "hit": 45.63, "n": 103, "precision": 0.44, "recall": 0.2075, "f1": 0.2821, "f2": 0.2321, "mcc": -0.0845, "accuracy": 0.4563, "tp": 11, "fp": 14, "tn": 36, "fn": 42}, {"fold": "fold_2", "regime": "Post-crash recovery", "sharpe": 0.255, "sortino": 0.4417, "return_pct": 0.96, "equity": 1009.57, "max_dd": 7.84, "win_rate": 49.53, "profit_factor": 1.041, "ic": 0.0033, "hit": 49.53, "n": 107, "precision": 0.4681, "recall": 0.4314, "f1": 0.449, "f2": 0.4382, "mcc": -0.0152, "accuracy": 0.4953, "tp": 22, "fp": 25, "tn": 31, "fn": 29}, {"fold": "fold_3", "regime": "Eurozone debt plateau", "sharpe": 14.8557, "sortino": 23.4465, "return_pct": 46.75, "equity": 1467.5, "max_dd": 1.32, "win_rate": 85.58, "profit_factor": 12.451, "ic": 0.7963, "hit": 83.96, "n": 106, "precision": 0.9, "recall": 0.7895, "f1": 0.8411, "f2": 0.8094, "mcc": 0.6866, "accuracy": 0.8396, "tp": 45, "fp": 5, "tn": 44, "fn": 12}, {"fold": "fold_4", "regime": "Strong USD downturn", "sharpe": 14.4361, "sortino": 31.6284, "return_pct": 128.55, "equity": 2285.48, "max_dd": 0.97, "win_rate": 90.42, "profit_factor": 18.408, "ic": 0.871, "hit": 89.88, "n": 168, "precision": 0.9375, "recall": 0.8721, "f1": 0.9036, "f2": 0.8844, "mcc": 0.8118, "accuracy": 0.9048, "tp": 75, "fp": 5, "tn": 77, "fn": 11}, {"fold": "fold_5", "regime": "Low-vol plateau", "sharpe": 15.6483, "sortino": 76.9747, "return_pct": 44.86, "equity": 1448.61, "max_dd": 0.23, "win_rate": 85.8, "profit_factor": 26.34, "ic": 0.9108, "hit": 85.8, "n": 162, "precision": 0.8354, "recall": 0.8684, "f1": 0.8516, "f2": 0.8616, "mcc": 0.7161, "accuracy": 0.858, "tp": 66, "fp": 13, "tn": 73, "fn": 10}, {"fold": "fold_6", "regime": "EUR crisis downturn", "sharpe": 14.4038, "sortino": 42.5094, "return_pct": 95.2, "equity": 1951.99, "max_dd": 0.87, "win_rate": 81.21, "profit_factor": 13.473, "ic": 0.8661, "hit": 81.21, "n": 165, "precision": 0.8108, "recall": 0.7792, "f1": 0.7947, "f2": 0.7853, "mcc": 0.6221, "accuracy": 0.8121, "tp": 60, "fp": 14, "tn": 74, "fn": 17}, {"fold": "fold_7", "regime": "Recent mixed/upturn", "sharpe": 12.9219, "sortino": 17.9043, "return_pct": 81.27, "equity": 1812.68, "max_dd": 1.64, "win_rate": 85.8, "profit_factor": 12.027, "ic": 0.8107, "hit": 85.8, "n": 162, "precision": 0.8452, "recall": 0.8765, "f1": 0.8606, "f2": 0.8701, "mcc": 0.7165, "accuracy": 0.858, "tp": 71, "fp": 13, "tn": 68, "fn": 10}], "val_sharpe": 7.439, "val_psr": 1.0, "val_equity": 4906.87, "val_sortino": 9.3456, "val_return_pct": 390.69, "val_max_dd": 17.12, "val_win_rate": 73.53, "val_profit_factor": 3.64, "val_ic": 0.6475, "val_hit": 73.05, "val_precision": 0.691, "val_recall": 0.8027, "val_f1": 0.7427, "val_f2": 0.7776, "val_mcc": 0.4797, "val_accuracy": 0.7357, "val_per_window": [{"fold": "fold_1", "regime": "Pre-crisis upturn + GFC onset", "sharpe": 1.5542, "sortino": 2.9885, "return_pct": 3.91, "equity": 1039.07, "max_dd": 2.33, "win_rate": 44.44, "profit_factor": 1.294, "ic": -0.1184, "hit": 44.04, "n": 109, "precision": 0.4674, "recall": 0.7818, "f1": 0.585, "f2": 0.6891, "mcc": -0.1731, "accuracy": 0.4404, "tp": 43, "fp": 49, "tn": 5, "fn": 12}, {"fold": "fold_2", "regime": "Post-crash recovery", "sharpe": -2.9889, "sortino": -4.595, "return_pct": -13.53, "equity": 864.69, "max_dd": 17.12, "win_rate": 42.59, "profit_factor": 0.624, "ic": -0.1691, "hit": 42.59, "n": 108, "precision": 0.5082, "recall": 0.4921, "f1": 0.5, "f2": 0.4952, "mcc": -0.1736, "accuracy": 0.4259, "tp": 31, "fp": 30, "tn": 15, "fn": 32}, {"fold": "fold_3", "regime": "Eurozone debt plateau", "sharpe": 14.6115, "sortino": 30.9451, "return_pct": 54.19, "equity": 1541.95, "max_dd": 0.7, "win_rate": 85.32, "profit_factor": 14.629, "ic": 0.8501, "hit": 83.78, "n": 111, "precision": 0.7818, "recall": 0.9149, "f1": 0.8431, "f2": 0.8848, "mcc": 0.7188, "accuracy": 0.8559, "tp": 43, "fp": 12, "tn": 52, "fn": 4}, {"fold": "fold_4", "regime": "Strong USD downturn", "sharpe": 14.9879, "sortino": 52.7418, "return_pct": 45.85, "equity": 1458.52, "max_dd": 0.64, "win_rate": 85.32, "profit_factor": 19.232, "ic": 0.9204, "hit": 84.55, "n": 110, "precision": 0.8298, "recall": 0.8298, "f1": 0.8298, "f2": 0.8298, "mcc": 0.7028, "accuracy": 0.8545, "tp": 39, "fp": 8, "tn": 55, "fn": 8}, {"fold": "fold_5", "regime": "Low-vol plateau", "sharpe": 15.2117, "sortino": 75.4662, "return_pct": 44.11, "equity": 1441.09, "max_dd": 0.29, "win_rate": 83.93, "profit_factor": 21.826, "ic": 0.9185, "hit": 83.93, "n": 112, "precision": 0.807, "recall": 0.8679, "f1": 0.8364, "f2": 0.855, "mcc": 0.6806, "accuracy": 0.8393, "tp": 46, "fp": 11, "tn": 48, "fn": 7}, {"fold": "fold_6", "regime": "EUR crisis downturn", "sharpe": 15.2276, "sortino": 62.4689, "return_pct": 28.54, "equity": 1285.42, "max_dd": 0.25, "win_rate": 85.98, "profit_factor": 25.454, "ic": 0.9252, "hit": 85.19, "n": 108, "precision": 0.7963, "recall": 0.9149, "f1": 0.8515, "f2": 0.8884, "mcc": 0.7284, "accuracy": 0.8611, "tp": 43, "fp": 11, "tn": 50, "fn": 4}, {"fold": "fold_7", "regime": "Recent mixed/upturn", "sharpe": 16.1138, "sortino": 59.6625, "return_pct": 31.09, "equity": 1310.95, "max_dd": 0.34, "win_rate": 86.36, "profit_factor": 20.895, "ic": 0.8799, "hit": 86.36, "n": 110, "precision": 0.8276, "recall": 0.9057, "f1": 0.8649, "f2": 0.8889, "mcc": 0.7308, "accuracy": 0.8636, "tp": 48, "fp": 10, "tn": 47, "fn": 5}], "train_sharpe": 10.879, "train_psr": 1.0, "train_equity": 56381964.0, "train_sortino": 122.3035, "train_return_pct": 5638096.4, "train_max_dd": 0.3, "train_win_rate": 93.15, "train_profit_factor": 100.23, "train_ic": 0.9684, "train_hit": 92.78, "train_precision": 0.9223, "train_recall": 0.9411, "train_f1": 0.9316, "train_f2": 0.9373, "train_mcc": 0.8579, "train_accuracy": 0.929, "train_per_window": [{"fold": "all_train", "regime": "Training data", "sharpe": 10.879, "sortino": 122.3035, "return_pct": 5638096.4, "equity": 56381964.0, "max_dd": 0.3, "win_rate": 93.15, "profit_factor": 100.23, "ic": 0.9684, "hit": 92.78, "n": 2478, "precision": 0.9223, "recall": 0.9411, "f1": 0.9316, "f2": 0.9373, "mcc": 0.8579, "accuracy": 0.929, "tp": 1199, "fp": 101, "tn": 1103, "fn": 75}], "experiment_num": 209, "status": "DISCARD"}
{"backbone": "lightgbm", "description": "lgbm: Exp7 max_depth=4 (mirror XGB champ)", "config": {"seq_len": 10, "lr": 0.0003, "batch_size": 32, "epochs": 20, "weight_decay": 1e-05, "patience": 5, "grad_clip": 1.0, "warmup_epochs": 0, "huber_delta": 1.0, "head_dropout": 0.1, "seed": 42, "max_depth": 4, "gbm_lr": 0.01, "het_loss": false}, "composite": 7.5813, "test_pos_folds": 6, "val_pos_folds": 6, "val_loss": 0.0, "elapsed_sec": 38.5, "timestamp": "2026-04-21T07:05:32", "sharpe": 7.7813, "psr": 1.0, "equity": 18211.84, "sortino": 7.8619, "return_pct": 1721.18, "max_dd": 7.54, "win_rate": 77.92, "profit_factor": 4.64, "ic": 0.6591, "hit": 77.6, "precision": 0.7973, "recall": 0.736, "f1": 0.7654, "f2": 0.7475, "mcc": 0.5551, "accuracy": 0.777, "per_window": [{"fold": "fold_1", "regime": "Pre-crisis upturn + GFC onset", "sharpe": -0.2049, "sortino": -0.2343, "return_pct": -2.29, "equity": 977.13, "max_dd": 7.54, "win_rate": 49.02, "profit_factor": 0.953, "ic": 0.0296, "hit": 48.54, "n": 103, "precision": 0.5, "recall": 0.283, "f1": 0.3614, "f2": 0.3099, "mcc": -0.0187, "accuracy": 0.4854, "tp": 15, "fp": 15, "tn": 35, "fn": 38}, {"fold": "fold_2", "regime": "Post-crash recovery", "sharpe": 1.709, "sortino": 3.039, "return_pct": 8.2, "equity": 1082.05, "max_dd": 4.2, "win_rate": 53.27, "profit_factor": 1.307, "ic": 0.0031, "hit": 53.27, "n": 107, "precision": 0.5111, "recall": 0.451, "f1": 0.4792, "f2": 0.4618, "mcc": 0.0588, "accuracy": 0.5327, "tp": 23, "fp": 22, "tn": 34, "fn": 28}, {"fold": "fold_3", "regime": "Eurozone debt plateau", "sharpe": 14.6735, "sortino": 23.7805, "return_pct": 46.38, "equity": 1463.78, "max_dd": 1.32, "win_rate": 85.58, "profit_factor": 11.962, "ic": 0.7972, "hit": 83.96, "n": 106, "precision": 0.8846, "recall": 0.807, "f1": 0.844, "f2": 0.8214, "mcc": 0.6827, "accuracy": 0.8396, "tp": 46, "fp": 6, "tn": 43, "fn": 11}, {"fold": "fold_4", "regime": "Strong USD downturn", "sharpe": 14.6681, "sortino": 32.4126, "return_pct": 130.21, "equity": 2302.07, "max_dd": 0.97, "win_rate": 89.82, "profit_factor": 19.998, "ic": 0.8766, "hit": 89.29, "n": 168, "precision": 0.9259, "recall": 0.8721, "f1": 0.8982, "f2": 0.8824, "mcc": 0.7992, "accuracy": 0.8988, "tp": 75, "fp": 6, "tn": 76, "fn": 11}, {"fold": "fold_5", "regime": "Low-vol plateau", "sharpe": 15.3735, "sortino": 71.3072, "return_pct": 44.38, "equity": 1443.76, "max_dd": 0.23, "win_rate": 85.19, "profit_factor": 23.535, "ic": 0.8999, "hit": 85.19, "n": 162, "precision": 0.8333, "recall": 0.8553, "f1": 0.8442, "f2": 0.8508, "mcc": 0.7032, "accuracy": 0.8519, "tp": 65, "fp": 13, "tn": 73, "fn": 11}, {"fold": "fold_6", "regime": "EUR crisis downturn", "sharpe": 14.9192, "sortino": 60.4062, "return_pct": 97.73, "equity": 1977.27, "max_dd": 0.43, "win_rate": 81.21, "profit_factor": 15.437, "ic": 0.8747, "hit": 81.21, "n": 165, "precision": 0.8108, "recall": 0.7792, "f1": 0.7947, "f2": 0.7853, "mcc": 0.6221, "accuracy": 0.8121, "tp": 60, "fp": 14, "tn": 74, "fn": 17}, {"fold": "fold_7", "regime": "Recent mixed/upturn", "sharpe": 12.4899, "sortino": 17.7735, "return_pct": 79.06, "equity": 1790.59, "max_dd": 1.64, "win_rate": 84.57, "profit_factor": 10.703, "ic": 0.8231, "hit": 84.57, "n": 162, "precision": 0.8333, "recall": 0.8642, "f1": 0.8485, "f2": 0.8578, "mcc": 0.6918, "accuracy": 0.8457, "tp": 70, "fp": 14, "tn": 67, "fn": 11}], "val_sharpe": 7.9208, "val_psr": 1.0, "val_equity": 5334.11, "val_sortino": 10.4129, "val_return_pct": 433.41, "val_max_dd": 12.19, "val_win_rate": 73.79, "val_profit_factor": 3.984, "val_ic": 0.6622, "val_hit": 73.31, "val_precision": 0.6925, "val_recall": 0.8082, "val_f1": 0.7459, "val_f2": 0.7821, "val_mcc": 0.4855, "val_accuracy": 0.7383, "val_per_window": [{"fold": "fold_1", "regime": "Pre-crisis upturn + GFC onset", "sharpe": 1.9933, "sortino": 3.7822, "return_pct": 5.04, "equity": 1050.44, "max_dd": 2.08, "win_rate": 50.0, "profit_factor": 1.392, "ic": 0.0118, "hit": 49.54, "n": 109, "precision": 0.5, "recall": 0.8, "f1": 0.6154, "f2": 0.7143, "mcc": -0.0188, "accuracy": 0.4954, "tp": 44, "fp": 44, "tn": 10, "fn": 11}, {"fold": "fold_2", "regime": "Post-crash recovery", "sharpe": -1.1532, "sortino": -1.8391, "return_pct": -5.69, "equity": 943.08, "max_dd": 12.19, "win_rate": 45.37, "profit_factor": 0.834, "ic": -0.1142, "hit": 45.37, "n": 108, "precision": 0.5303, "recall": 0.5556, "f1": 0.5426, "f2": 0.5503, "mcc": -0.1348, "accuracy": 0.4537, "tp": 35, "fp": 31, "tn": 14, "fn": 28}, {"fold": "fold_3", "regime": "Eurozone debt plateau", "sharpe": 14.4755, "sortino": 31.152, "return_pct": 53.85, "equity": 1538.55, "max_dd": 0.7, "win_rate": 84.4, "profit_factor": 14.106, "ic": 0.8549, "hit": 82.88, "n": 111, "precision": 0.7778, "recall": 0.8936, "f1": 0.8317, "f2": 0.8678, "mcc": 0.698, "accuracy": 0.8468, "tp": 42, "fp": 12, "tn": 52, "fn": 5}, {"fold": "fold_4", "regime": "Strong USD downturn", "sharpe": 15.939, "sortino": 57.3116, "return_pct": 47.64, "equity": 1476.36, "max_dd": 0.39, "win_rate": 88.07, "profit_factor": 27.598, "ic": 0.9317, "hit": 87.27, "n": 110, "precision": 0.8864, "recall": 0.8298, "f1": 0.8571, "f2": 0.8405, "mcc": 0.7578, "accuracy": 0.8818, "tp": 39, "fp": 5, "tn": 58, "fn": 8}, {"fold": "fold_5", "regime": "Low-vol plateau", "sharpe": 14.1282, "sortino": 57.2601, "return_pct": 42.06, "equity": 1420.58, "max_dd": 0.34, "win_rate": 81.25, "profit_factor": 15.222, "ic": 0.9137, "hit": 81.25, "n": 112, "precision": 0.7759, "recall": 0.8491, "f1": 0.8108, "f2": 0.8333, "mcc": 0.6282, "accuracy": 0.8125, "tp": 45, "fp": 13, "tn": 46, "fn": 8}, {"fold": "fold_6", "regime": "EUR crisis downturn", "sharpe": 15.3487, "sortino": 104.7083, "return_pct": 28.68, "equity": 1286.75, "max_dd": 0.19, "win_rate": 84.11, "profit_factor": 26.857, "ic": 0.9294, "hit": 83.33, "n": 108, "precision": 0.7885, "recall": 0.8723, "f1": 0.8283, "f2": 0.8542, "mcc": 0.6866, "accuracy": 0.8426, "tp": 41, "fp": 11, "tn": 50, "fn": 6}, {"fold": "fold_7", "regime": "Recent mixed/upturn", "sharpe": 14.8827, "sortino": 55.6644, "return_pct": 29.68, "equity": 1296.83, "max_dd": 0.37, "win_rate": 82.73, "profit_factor": 14.673, "ic": 0.8677, "hit": 82.73, "n": 110, "precision": 0.7656, "recall": 0.9245, "f1": 0.8376, "f2": 0.8877, "mcc": 0.67, "accuracy": 0.8273, "tp": 49, "fp": 15, "tn": 42, "fn": 4}], "train_sharpe": 10.0889, "train_psr": 1.0, "train_equity": 32093458.0, "train_sortino": 55.511, "train_return_pct": 3209245.8, "train_max_dd": 1.02, "train_win_rate": 87.68, "train_profit_factor": 27.608, "train_ic": 0.908, "train_hit": 87.33, "train_precision": 0.864, "train_recall": 0.898, "train_f1": 0.8807, "train_f2": 0.891, "train_mcc": 0.7499, "train_accuracy": 0.8749, "train_per_window": [{"fold": "all_train", "regime": "Training data", "sharpe": 10.0889, "sortino": 55.511, "return_pct": 3209245.8, "equity": 32093458.0, "max_dd": 1.02, "win_rate": 87.68, "profit_factor": 27.608, "ic": 0.908, "hit": 87.33, "n": 2478, "precision": 0.864, "recall": 0.898, "f1": 0.8807, "f2": 0.891, "mcc": 0.7499, "accuracy": 0.8749, "tp": 1144, "fp": 180, "tn": 1024, "fn": 130}], "experiment_num": 210, "status": "DISCARD"}
