{"backbone": "lstm", "description": "lstm: Exp42 grad_clip=1.5 between 1.0 and 2.0", "config": {"seq_len": 10, "lr": 0.001, "batch_size": 16, "epochs": 100, "weight_decay": 0.0007, "patience": 15, "grad_clip": 1.5, "warmup_epochs": 0, "huber_delta": 1.0, "head_dropout": 0.25, "seed": 42, "het_loss": false}, "composite": 5.969, "test_pos_folds": 7, "val_pos_folds": 5, "val_loss": 2.8e-05, "elapsed_sec": 50.7, "timestamp": "2026-04-19T19:57:38", "sharpe": 6.169, "psr": 1.0, "equity": 10851.05, "sortino": 7.0085, "return_pct": 985.1, "max_dd": 7.54, "win_rate": 71.83, "profit_factor": 3.266, "ic": 0.5624, "hit": 71.53, "aleatoric_mean": 6e-06, "epistemic_mean": 1.1e-05, "confidence_mean": 1.0, "precision": 0.7569, "recall": 0.6279, "f1": 0.6864, "f2": 0.65, "mcc": 0.4378, "accuracy": 0.7163, "per_window": [{"fold": "fold_1", "regime": "Pre-crisis upturn + GFC onset", "sharpe": 0.1015, "sortino": 0.1145, "return_pct": 0.05, "equity": 1000.5, "max_dd": 7.54, "win_rate": 50.0, "profit_factor": 1.024, "ic": 0.1565, "hit": 49.51, "n": 103, "precision": 0.5455, "recall": 0.2264, "f1": 0.32, "f2": 0.2564, "mcc": 0.0322, "accuracy": 0.5049, "tp": 12, "fp": 10, "tn": 40, "fn": 41, "aleatoric_mean": 8e-06, "epistemic_mean": 1.5e-05, "confidence_mean": 1.0, "aleatoric_std": 3e-06, "epistemic_std": 6e-06}, {"fold": "fold_2", "regime": "Post-crash recovery", "sharpe": 1.1971, "sortino": 2.169, "return_pct": 5.61, "equity": 1056.11, "max_dd": 4.7, "win_rate": 53.27, "profit_factor": 1.206, "ic": 0.0949, "hit": 53.27, "n": 107, "precision": 0.5111, "recall": 0.451, "f1": 0.4792, "f2": 0.4618, "mcc": 0.0588, "accuracy": 0.5327, "tp": 23, "fp": 22, "tn": 34, "fn": 28, "aleatoric_mean": 8e-06, "epistemic_mean": 1.5e-05, "confidence_mean": 1.0, "aleatoric_std": 5e-06, "epistemic_std": 9e-06}, {"fold": "fold_3", "regime": "Eurozone debt plateau", "sharpe": 9.8348, "sortino": 15.6844, "return_pct": 34.35, "equity": 1343.52, "max_dd": 2.22, "win_rate": 76.92, "profit_factor": 4.817, "ic": 0.5592, "hit": 75.47, "n": 106, "precision": 0.7385, "recall": 0.8421, "f1": 0.7869, "f2": 0.8191, "mcc": 0.5069, "accuracy": 0.7547, "tp": 48, "fp": 17, "tn": 32, "fn": 9, "aleatoric_mean": 6e-06, "epistemic_mean": 1.3e-05, "confidence_mean": 1.0, "aleatoric_std": 3e-06, "epistemic_std": 7e-06}, {"fold": "fold_4", "regime": "Strong USD downturn", "sharpe": 10.4142, "sortino": 18.0743, "return_pct": 96.03, "equity": 1960.25, "max_dd": 1.81, "win_rate": 80.84, "profit_factor": 6.443, "ic": 0.7757, "hit": 80.36, "n": 168, "precision": 0.8955, "recall": 0.6977, "f1": 0.7843, "f2": 0.7299, "mcc": 0.6251, "accuracy": 0.8036, "tp": 60, "fp": 7, "tn": 75, "fn": 26, "aleatoric_mean": 5e-06, "epistemic_mean": 9e-06, "confidence_mean": 1.0, "aleatoric_std": 2e-06, "epistemic_std": 4e-06}, {"fold": "fold_5", "regime": "Low-vol plateau", "sharpe": 13.0712, "sortino": 45.3623, "return_pct": 39.86, "equity": 1398.63, "max_dd": 0.27, "win_rate": 79.63, "profit_factor": 11.44, "ic": 0.7934, "hit": 79.63, "n": 162, "precision": 0.8525, "recall": 0.6842, "f1": 0.7591, "f2": 0.7123, "mcc": 0.5969, "accuracy": 0.7963, "tp": 52, "fp": 9, "tn": 77, "fn": 24, "aleatoric_mean": 4e-06, "epistemic_mean": 7e-06, "confidence_mean": 1.0, "aleatoric_std": 1e-06, "epistemic_std": 3e-06}, {"fold": "fold_6", "regime": "EUR crisis downturn", "sharpe": 11.7041, "sortino": 25.1353, "return_pct": 80.46, "equity": 1804.57, "max_dd": 1.64, "win_rate": 75.15, "profit_factor": 7.371, "ic": 0.7687, "hit": 75.15, "n": 165, "precision": 0.8, "recall": 0.6234, "f1": 0.7007, "f2": 0.6522, "mcc": 0.5051, "accuracy": 0.7515, "tp": 48, "fp": 12, "tn": 76, "fn": 29, "aleatoric_mean": 5e-06, "epistemic_mean": 1e-05, "confidence_mean": 1.0, "aleatoric_std": 2e-06, "epistemic_std": 4e-06}, {"fold": "fold_7", "regime": "Recent mixed/upturn", "sharpe": 8.2797, "sortino": 13.0664, "return_pct": 54.49, "equity": 1544.94, "max_dd": 1.64, "win_rate": 74.07, "profit_factor": 4.264, "ic": 0.662, "hit": 74.07, "n": 162, "precision": 0.7468, "recall": 0.7284, "f1": 0.7375, "f2": 0.732, "mcc": 0.4816, "accuracy": 0.7407, "tp": 59, "fp": 20, "tn": 61, "fn": 22, "aleatoric_mean": 6e-06, "epistemic_mean": 1.3e-05, "confidence_mean": 1.0, "aleatoric_std": 2e-06, "epistemic_std": 4e-06}], "val_sharpe": 6.415, "val_psr": 1.0, "val_equity": 4069.0, "val_sortino": 9.1778, "val_return_pct": 306.9, "val_max_dd": 10.11, "val_win_rate": 68.68, "val_profit_factor": 3.019, "val_ic": 0.5561, "val_hit": 68.23, "val_aleatoric_mean": 5e-06, "val_epistemic_mean": 9e-06, "val_confidence_mean": 1.0, "val_precision": 0.7072, "val_recall": 0.589, "val_f1": 0.6428, "val_f2": 0.6094, "val_mcc": 0.376, "val_accuracy": 0.6888, "val_per_window": [{"fold": "fold_1", "regime": "Pre-crisis upturn + GFC onset", "sharpe": -0.33, "sortino": -0.5182, "return_pct": -0.9, "equity": 990.97, "max_dd": 5.9, "win_rate": 45.37, "profit_factor": 0.947, "ic": -0.0126, "hit": 44.95, "n": 109, "precision": 0.4545, "recall": 0.3636, "f1": 0.404, "f2": 0.3788, "mcc": -0.0823, "accuracy": 0.4587, "tp": 20, "fp": 24, "tn": 30, "fn": 35, "aleatoric_mean": 5e-06, "epistemic_mean": 9e-06, "confidence_mean": 1.0, "aleatoric_std": 2e-06, "epistemic_std": 4e-06}, {"fold": "fold_2", "regime": "Post-crash recovery", "sharpe": -1.2623, "sortino": -2.0103, "return_pct": -6.19, "equity": 938.14, "max_dd": 10.11, "win_rate": 45.37, "profit_factor": 0.819, "ic": 0.0085, "hit": 45.37, "n": 108, "precision": 0.5476, "recall": 0.3651, "f1": 0.4381, "f2": 0.3912, "mcc": -0.0578, "accuracy": 0.4537, "tp": 23, "fp": 19, "tn": 26, "fn": 40, "aleatoric_mean": 7e-06, "epistemic_mean": 1.4e-05, "confidence_mean": 1.0, "aleatoric_std": 3e-06, "epistemic_std": 6e-06}, {"fold": "fold_3", "regime": "Eurozone debt plateau", "sharpe": 12.2956, "sortino": 28.2687, "return_pct": 47.9, "equity": 1479.02, "max_dd": 0.7, "win_rate": 84.4, "profit_factor": 8.456, "ic": 0.8082, "hit": 82.88, "n": 111, "precision": 0.8571, "recall": 0.766, "f1": 0.809, "f2": 0.7826, "mcc": 0.6848, "accuracy": 0.8468, "tp": 36, "fp": 6, "tn": 58, "fn": 11, "aleatoric_mean": 4e-06, "epistemic_mean": 8e-06, "confidence_mean": 1.0, "aleatoric_std": 2e-06, "epistemic_std": 4e-06}, {"fold": "fold_4", "regime": "Strong USD downturn", "sharpe": 13.9262, "sortino": 48.5088, "return_pct": 43.69, "equity": 1436.92, "max_dd": 0.47, "win_rate": 81.65, "profit_factor": 13.887, "ic": 0.8095, "hit": 80.91, "n": 110, "precision": 0.8293, "recall": 0.7234, "f1": 0.7727, "f2": 0.7424, "mcc": 0.6264, "accuracy": 0.8182, "tp": 34, "fp": 7, "tn": 56, "fn": 13, "aleatoric_mean": 4e-06, "epistemic_mean": 8e-06, "confidence_mean": 1.0, "aleatoric_std": 2e-06, "epistemic_std": 3e-06}, {"fold": "fold_5", "regime": "Low-vol plateau", "sharpe": 9.5529, "sortino": 27.8739, "return_pct": 31.26, "equity": 1312.58, "max_dd": 0.91, "win_rate": 68.75, "profit_factor": 5.249, "ic": 0.7858, "hit": 68.75, "n": 112, "precision": 0.7812, "recall": 0.4717, "f1": 0.5882, "f2": 0.5123, "mcc": 0.3902, "accuracy": 0.6875, "tp": 25, "fp": 7, "tn": 52, "fn": 28, "aleatoric_mean": 4e-06, "epistemic_mean": 7e-06, "confidence_mean": 1.0, "aleatoric_std": 1e-06, "epistemic_std": 3e-06}, {"fold": "fold_6", "regime": "EUR crisis downturn", "sharpe": 13.6245, "sortino": 54.0493, "return_pct": 26.64, "equity": 1266.41, "max_dd": 0.25, "win_rate": 83.18, "profit_factor": 14.348, "ic": 0.8845, "hit": 82.41, "n": 108, "precision": 0.8718, "recall": 0.7234, "f1": 0.7907, "f2": 0.7489, "mcc": 0.6621, "accuracy": 0.8333, "tp": 34, "fp": 5, "tn": 56, "fn": 13, "aleatoric_mean": 3e-06, "epistemic_mean": 7e-06, "confidence_mean": 1.0, "aleatoric_std": 1e-06, "epistemic_std": 2e-06}, {"fold": "fold_7", "regime": "Recent mixed/upturn", "sharpe": 10.8449, "sortino": 24.1286, "return_pct": 23.89, "equity": 1238.94, "max_dd": 0.69, "win_rate": 71.82, "profit_factor": 6.131, "ic": 0.7086, "hit": 71.82, "n": 110, "precision": 0.6719, "recall": 0.8113, "f1": 0.735, "f2": 0.779, "mcc": 0.4487, "accuracy": 0.7182, "tp": 43, "fp": 21, "tn": 36, "fn": 10, "aleatoric_mean": 5e-06, "epistemic_mean": 1e-05, "confidence_mean": 1.0, "aleatoric_std": 2e-06, "epistemic_std": 4e-06}], "train_sharpe": 6.7277, "train_psr": 1.0, "train_equity": 1860630.75, "train_sortino": 17.5825, "train_return_pct": 185963.08, "train_max_dd": 10.41, "train_win_rate": 73.54, "train_profit_factor": 5.185, "train_ic": 0.7002, "train_hit": 73.24, "train_precision": 0.8315, "train_recall": 0.6083, "train_f1": 0.7026, "train_f2": 0.6428, "train_mcc": 0.4931, "train_accuracy": 0.7353, "train_per_window": [{"fold": "all_train", "regime": "Training data", "sharpe": 6.7277, "sortino": 17.5825, "return_pct": 185963.08, "equity": 1860630.75, "max_dd": 10.41, "win_rate": 73.54, "profit_factor": 5.185, "ic": 0.7002, "hit": 73.24, "n": 2478, "precision": 0.8315, "recall": 0.6083, "f1": 0.7026, "f2": 0.6428, "mcc": 0.4931, "accuracy": 0.7353, "tp": 775, "fp": 157, "tn": 1047, "fn": 499}], "experiment_num": 147, "status": "DISCARD"}
{"backbone": "lstm", "description": "lstm: Exp43 huber=1.5 wider Huber delta", "config": {"seq_len": 10, "lr": 0.001, "batch_size": 16, "epochs": 100, "weight_decay": 0.0007, "patience": 15, "grad_clip": 1.0, "warmup_epochs": 0, "huber_delta": 1.5, "head_dropout": 0.25, "seed": 42, "het_loss": false}, "composite": 6.4242, "test_pos_folds": 7, "val_pos_folds": 6, "val_loss": 2.8e-05, "elapsed_sec": 54.3, "timestamp": "2026-04-19T19:58:56", "sharpe": 6.5242, "psr": 1.0, "equity": 12222.92, "sortino": 7.2971, "return_pct": 1122.29, "max_dd": 7.54, "win_rate": 73.07, "profit_factor": 3.519, "ic": 0.5598, "hit": 72.76, "aleatoric_mean": 6e-06, "epistemic_mean": 1.1e-05, "confidence_mean": 1.0, "precision": 0.7348, "recall": 0.7027, "f1": 0.7184, "f2": 0.7089, "mcc": 0.4554, "accuracy": 0.7276, "per_window": [{"fold": "fold_1", "regime": "Pre-crisis upturn + GFC onset", "sharpe": 0.9135, "sortino": 1.0158, "return_pct": 6.5, "equity": 1065.05, "max_dd": 7.54, "win_rate": 51.96, "profit_factor": 1.241, "ic": 0.1287, "hit": 51.46, "n": 103, "precision": 0.5405, "recall": 0.3774, "f1": 0.4444, "f2": 0.4016, "mcc": 0.0389, "accuracy": 0.5146, "tp": 20, "fp": 17, "tn": 33, "fn": 33, "aleatoric_mean": 7e-06, "epistemic_mean": 1.5e-05, "confidence_mean": 1.0, "aleatoric_std": 3e-06, "epistemic_std": 6e-06}, {"fold": "fold_2", "regime": "Post-crash recovery", "sharpe": 0.4024, "sortino": 0.7304, "return_pct": 1.67, "equity": 1016.74, "max_dd": 6.09, "win_rate": 52.34, "profit_factor": 1.065, "ic": 0.0797, "hit": 52.34, "n": 107, "precision": 0.5, "recall": 0.4902, "f1": 0.495, "f2": 0.4921, "mcc": 0.0438, "accuracy": 0.5234, "tp": 25, "fp": 25, "tn": 31, "fn": 26, "aleatoric_mean": 8e-06, "epistemic_mean": 1.5e-05, "confidence_mean": 1.0, "aleatoric_std": 5e-06, "epistemic_std": 9e-06}, {"fold": "fold_3", "regime": "Eurozone debt plateau", "sharpe": 9.7509, "sortino": 15.7593, "return_pct": 34.11, "equity": 1341.06, "max_dd": 2.22, "win_rate": 76.92, "profit_factor": 4.749, "ic": 0.5752, "hit": 75.47, "n": 106, "precision": 0.7313, "recall": 0.8596, "f1": 0.7903, "f2": 0.8305, "mcc": 0.509, "accuracy": 0.7547, "tp": 49, "fp": 18, "tn": 31, "fn": 8, "aleatoric_mean": 6e-06, "epistemic_mean": 1.2e-05, "confidence_mean": 1.0, "aleatoric_std": 3e-06, "epistemic_std": 6e-06}, {"fold": "fold_4", "regime": "Strong USD downturn", "sharpe": 11.378, "sortino": 17.832, "return_pct": 104.44, "equity": 2044.42, "max_dd": 1.81, "win_rate": 84.43, "profit_factor": 7.955, "ic": 0.7704, "hit": 83.93, "n": 168, "precision": 0.8831, "recall": 0.7907, "f1": 0.8344, "f2": 0.8076, "mcc": 0.6831, "accuracy": 0.8393, "tp": 68, "fp": 9, "tn": 73, "fn": 18, "aleatoric_mean": 5e-06, "epistemic_mean": 9e-06, "confidence_mean": 1.0, "aleatoric_std": 2e-06, "epistemic_std": 4e-06}, {"fold": "fold_5", "regime": "Low-vol plateau", "sharpe": 13.5237, "sortino": 51.3119, "return_pct": 40.82, "equity": 1408.16, "max_dd": 0.24, "win_rate": 79.63, "profit_factor": 12.907, "ic": 0.8019, "hit": 79.63, "n": 162, "precision": 0.7945, "recall": 0.7632, "f1": 0.7785, "f2": 0.7692, "mcc": 0.5905, "accuracy": 0.7963, "tp": 58, "fp": 15, "tn": 71, "fn": 18, "aleatoric_mean": 4e-06, "epistemic_mean": 7e-06, "confidence_mean": 1.0, "aleatoric_std": 1e-06, "epistemic_std": 2e-06}, {"fold": "fold_6", "regime": "EUR crisis downturn", "sharpe": 12.328, "sortino": 30.1131, "return_pct": 84.09, "equity": 1840.88, "max_dd": 1.31, "win_rate": 76.97, "profit_factor": 8.374, "ic": 0.7608, "hit": 76.97, "n": 165, "precision": 0.7671, "recall": 0.7273, "f1": 0.7467, "f2": 0.7349, "mcc": 0.5365, "accuracy": 0.7697, "tp": 56, "fp": 17, "tn": 71, "fn": 21, "aleatoric_mean": 5e-06, "epistemic_mean": 1e-05, "confidence_mean": 1.0, "aleatoric_std": 2e-06, "epistemic_std": 4e-06}, {"fold": "fold_7", "regime": "Recent mixed/upturn", "sharpe": 8.962, "sortino": 14.7354, "return_pct": 58.82, "equity": 1588.18, "max_dd": 1.64, "win_rate": 75.31, "profit_factor": 4.868, "ic": 0.6658, "hit": 75.31, "n": 162, "precision": 0.747, "recall": 0.7654, "f1": 0.7561, "f2": 0.7617, "mcc": 0.5063, "accuracy": 0.7531, "tp": 62, "fp": 21, "tn": 60, "fn": 19, "aleatoric_mean": 6e-06, "epistemic_mean": 1.3e-05, "confidence_mean": 1.0, "aleatoric_std": 2e-06, "epistemic_std": 4e-06}], "val_sharpe": 7.1539, "val_psr": 1.0, "val_equity": 4663.84, "val_sortino": 9.8643, "val_return_pct": 366.38, "val_max_dd": 7.34, "val_win_rate": 71.3, "val_profit_factor": 3.454, "val_ic": 0.5638, "val_hit": 70.83, "val_aleatoric_mean": 5e-06, "val_epistemic_mean": 9e-06, "val_confidence_mean": 1.0, "val_precision": 0.6973, "val_recall": 0.7068, "val_f1": 0.702, "val_f2": 0.7049, "val_mcc": 0.4287, "val_accuracy": 0.7148, "val_per_window": [{"fold": "fold_1", "regime": "Pre-crisis upturn + GFC onset", "sharpe": 0.4646, "sortino": 0.7365, "return_pct": 1.1, "equity": 1011.05, "max_dd": 5.33, "win_rate": 47.22, "profit_factor": 1.08, "ic": 0.0285, "hit": 46.79, "n": 109, "precision": 0.4839, "recall": 0.5455, "f1": 0.5128, "f2": 0.5319, "mcc": -0.0476, "accuracy": 0.4771, "tp": 30, "fp": 32, "tn": 22, "fn": 25, "aleatoric_mean": 5e-06, "epistemic_mean": 9e-06, "confidence_mean": 1.0, "aleatoric_std": 2e-06, "epistemic_std": 4e-06}, {"fold": "fold_2", "regime": "Post-crash recovery", "sharpe": -0.0006, "sortino": -0.0009, "return_pct": -0.28, "equity": 997.22, "max_dd": 7.34, "win_rate": 49.07, "profit_factor": 1.0, "ic": 0.009, "hit": 49.07, "n": 108, "precision": 0.5714, "recall": 0.5079, "f1": 0.5378, "f2": 0.5195, "mcc": -0.0251, "accuracy": 0.4907, "tp": 32, "fp": 24, "tn": 21, "fn": 31, "aleatoric_mean": 7e-06, "epistemic_mean": 1.5e-05, "confidence_mean": 1.0, "aleatoric_std": 3e-06, "epistemic_std": 6e-06}, {"fold": "fold_3", "regime": "Eurozone debt plateau", "sharpe": 13.807, "sortino": 28.1214, "return_pct": 52.13, "equity": 1521.32, "max_dd": 0.7, "win_rate": 88.07, "profit_factor": 11.906, "ic": 0.8019, "hit": 86.49, "n": 111, "precision": 0.8542, "recall": 0.8723, "f1": 0.8632, "f2": 0.8686, "mcc": 0.7609, "accuracy": 0.8829, "tp": 41, "fp": 7, "tn": 57, "fn": 6, "aleatoric_mean": 4e-06, "epistemic_mean": 8e-06, "confidence_mean": 1.0, "aleatoric_std": 2e-06, "epistemic_std": 3e-06}, {"fold": "fold_4", "regime": "Strong USD downturn", "sharpe": 13.5837, "sortino": 34.2603, "return_pct": 42.96, "equity": 1429.56, "max_dd": 0.82, "win_rate": 82.57, "profit_factor": 12.645, "ic": 0.8085, "hit": 81.82, "n": 110, "precision": 0.7917, "recall": 0.8085, "f1": 0.8, "f2": 0.8051, "mcc": 0.6481, "accuracy": 0.8273, "tp": 38, "fp": 10, "tn": 53, "fn": 9, "aleatoric_mean": 4e-06, "epistemic_mean": 8e-06, "confidence_mean": 1.0, "aleatoric_std": 2e-06, "epistemic_std": 3e-06}, {"fold": "fold_5", "regime": "Low-vol plateau", "sharpe": 10.8261, "sortino": 28.1787, "return_pct": 34.63, "equity": 1346.26, "max_dd": 0.7, "win_rate": 75.89, "profit_factor": 6.782, "ic": 0.7903, "hit": 75.89, "n": 112, "precision": 0.825, "recall": 0.6226, "f1": 0.7097, "f2": 0.6548, "mcc": 0.5252, "accuracy": 0.7589, "tp": 33, "fp": 7, "tn": 52, "fn": 20, "aleatoric_mean": 3e-06, "epistemic_mean": 7e-06, "confidence_mean": 1.0, "aleatoric_std": 1e-06, "epistemic_std": 3e-06}, {"fold": "fold_6", "regime": "EUR crisis downturn", "sharpe": 13.8743, "sortino": 54.687, "return_pct": 26.95, "equity": 1269.55, "max_dd": 0.25, "win_rate": 83.18, "profit_factor": 15.497, "ic": 0.8853, "hit": 82.41, "n": 108, "precision": 0.8222, "recall": 0.7872, "f1": 0.8043, "f2": 0.794, "mcc": 0.6598, "accuracy": 0.8333, "tp": 37, "fp": 8, "tn": 53, "fn": 10, "aleatoric_mean": 3e-06, "epistemic_mean": 7e-06, "confidence_mean": 1.0, "aleatoric_std": 1e-06, "epistemic_std": 2e-06}, {"fold": "fold_7", "regime": "Recent mixed/upturn", "sharpe": 11.1786, "sortino": 25.1001, "return_pct": 24.45, "equity": 1244.46, "max_dd": 0.69, "win_rate": 72.73, "profit_factor": 6.53, "ic": 0.7118, "hit": 72.73, "n": 110, "precision": 0.662, "recall": 0.8868, "f1": 0.7581, "f2": 0.8304, "mcc": 0.4865, "accuracy": 0.7273, "tp": 47, "fp": 24, "tn": 33, "fn": 6, "aleatoric_mean": 5e-06, "epistemic_mean": 1e-05, "confidence_mean": 1.0, "aleatoric_std": 2e-06, "epistemic_std": 4e-06}], "train_sharpe": 7.0973, "train_psr": 1.0, "train_equity": 2639122.25, "train_sortino": 18.4888, "train_return_pct": 263812.22, "train_max_dd": 6.87, "train_win_rate": 75.61, "train_profit_factor": 5.843, "train_ic": 0.696, "train_hit": 75.3, "train_precision": 0.7932, "train_recall": 0.7104, "train_f1": 0.7495, "train_f2": 0.7255, "train_mcc": 0.5158, "train_accuracy": 0.7559, "train_per_window": [{"fold": "all_train", "regime": "Training data", "sharpe": 7.0973, "sortino": 18.4888, "return_pct": 263812.22, "equity": 2639122.25, "max_dd": 6.87, "win_rate": 75.61, "profit_factor": 5.843, "ic": 0.696, "hit": 75.3, "n": 2478, "precision": 0.7932, "recall": 0.7104, "f1": 0.7495, "f2": 0.7255, "mcc": 0.5158, "accuracy": 0.7559, "tp": 905, "fp": 236, "tn": 968, "fn": 369}], "experiment_num": 148, "status": "KEEP"}
