{"backbone": "lfm2-350m", "description": "H-Exp7: lr=3e-5 epochs=35 push further", "config": {"seq_len": 60, "lr": 3e-05, "batch_size": 32, "epochs": 35, "weight_decay": 1e-05, "patience": 10, "grad_clip": 1.0, "warmup_epochs": 0, "huber_delta": 1.0, "head_dropout": 0.1}, "composite": -0.9775, "test_pos_folds": 2, "val_pos_folds": 3, "val_loss": -1.850673, "elapsed_sec": 449.1, "timestamp": "2026-04-12T09:21:46", "sharpe": -0.0775, "psr": 0.4515, "equity": 971.27, "sortino": -0.1145, "return_pct": -2.87, "max_dd": 17.53, "win_rate": 48.79, "profit_factor": 0.987, "ic": -0.0643, "hit": 48.48, "aleatoric_mean": 0.034544, "epistemic_mean": 0.00603, "confidence_mean": 0.962, "per_window": [{"fold": "fold_1", "regime": "Pre-crisis upturn + GFC onset", "sharpe": 0.086, "sortino": 0.1575, "return_pct": 0.08, "equity": 1000.76, "max_dd": 5.04, "win_rate": 44.23, "profit_factor": 1.013, "ic": 0.0015, "hit": 43.4, "n": 53, "aleatoric_mean": 0.077378, "epistemic_mean": 0.005304, "confidence_mean": 0.9251, "aleatoric_std": 0.044585, "epistemic_std": 0.001919}, {"fold": "fold_2", "regime": "Post-crash recovery", "sharpe": -1.2448, "sortino": -1.8326, "return_pct": -3.66, "equity": 963.4, "max_dd": 9.52, "win_rate": 54.39, "profit_factor": 0.819, "ic": -0.215, "hit": 54.39, "n": 57, "aleatoric_mean": 0.065302, "epistemic_mean": 0.007233, "confidence_mean": 0.9336, "aleatoric_std": 0.040784, "epistemic_std": 0.002693}, {"fold": "fold_3", "regime": "Eurozone debt plateau", "sharpe": 6.8428, "sortino": 12.4691, "return_pct": 11.72, "equity": 1117.15, "max_dd": 0.97, "win_rate": 62.96, "profit_factor": 3.006, "ic": 0.4361, "hit": 60.71, "n": 56, "aleatoric_mean": 0.044735, "epistemic_mean": 0.005322, "confidence_mean": 0.9531, "aleatoric_std": 0.032111, "epistemic_std": 0.002366}, {"fold": "fold_4", "regime": "Strong USD downturn", "sharpe": -0.8836, "sortino": -1.2492, "return_pct": -4.63, "equity": 953.72, "max_dd": 12.12, "win_rate": 47.01, "profit_factor": 0.862, "ic": -0.1373, "hit": 46.61, "n": 118, "aleatoric_mean": 0.025632, "epistemic_mean": 0.006979, "confidence_mean": 0.9689, "aleatoric_std": 0.023642, "epistemic_std": 0.002976}, {"fold": "fold_5", "regime": "Low-vol plateau", "sharpe": -0.3351, "sortino": -0.5487, "return_pct": -0.81, "equity": 991.91, "max_dd": 4.28, "win_rate": 46.43, "profit_factor": 0.946, "ic": -0.1714, "hit": 46.43, "n": 112, "aleatoric_mean": 0.011201, "epistemic_mean": 0.006771, "confidence_mean": 0.9824, "aleatoric_std": 0.008903, "epistemic_std": 0.002659}, {"fold": "fold_6", "regime": "EUR crisis downturn", "sharpe": -0.946, "sortino": -1.5146, "return_pct": -4.38, "equity": 956.21, "max_dd": 7.35, "win_rate": 47.83, "profit_factor": 0.861, "ic": -0.0896, "hit": 47.83, "n": 115, "aleatoric_mean": 0.044488, "epistemic_mean": 0.005596, "confidence_mean": 0.9532, "aleatoric_std": 0.033431, "epistemic_std": 0.002237}, {"fold": "fold_7", "regime": "Recent mixed/upturn", "sharpe": -0.029, "sortino": -0.0498, "return_pct": -0.31, "equity": 996.89, "max_dd": 5.55, "win_rate": 46.43, "profit_factor": 0.995, "ic": 0.049, "hit": 46.43, "n": 112, "aleatoric_mean": 0.016049, "epistemic_mean": 0.004821, "confidence_mean": 0.9799, "aleatoric_std": 0.019742, "epistemic_std": 0.001732}], "val_sharpe": 0.4266, "val_psr": 0.7088, "val_equity": 1049.88, "val_sortino": 0.6748, "val_return_pct": 4.99, "val_max_dd": 11.15, "val_win_rate": 51.68, "val_profit_factor": 1.074, "val_ic": 0.0678, "val_hit": 51.44, "val_aleatoric_mean": 0.046904, "val_epistemic_mean": 0.00603, "val_confidence_mean": 0.9541, "val_per_window": [{"fold": "fold_1", "regime": "Pre-crisis upturn + GFC onset", "sharpe": 0.9769, "sortino": 1.467, "return_pct": 1.5, "equity": 1015.04, "max_dd": 2.72, "win_rate": 56.9, "profit_factor": 1.174, "ic": 0.0313, "hit": 55.93, "n": 59, "aleatoric_mean": 0.153944, "epistemic_mean": 0.004239, "confidence_mean": 0.8768, "aleatoric_std": 0.150368, "epistemic_std": 0.001725}, {"fold": "fold_2", "regime": "Post-crash recovery", "sharpe": -0.2339, "sortino": -0.3632, "return_pct": -0.54, "equity": 994.59, "max_dd": 4.92, "win_rate": 50.0, "profit_factor": 0.963, "ic": 0.0584, "hit": 50.0, "n": 58, "aleatoric_mean": 0.093869, "epistemic_mean": 0.00532, "confidence_mean": 0.9117, "aleatoric_std": 0.051317, "epistemic_std": 0.002477}, {"fold": "fold_3", "regime": "Eurozone debt plateau", "sharpe": -0.366, "sortino": -0.7319, "return_pct": -0.98, "equity": 990.25, "max_dd": 6.48, "win_rate": 40.98, "profit_factor": 0.941, "ic": -0.0974, "hit": 40.98, "n": 61, "aleatoric_mean": 0.019467, "epistemic_mean": 0.007525, "confidence_mean": 0.9739, "aleatoric_std": 0.013186, "epistemic_std": 0.003227}, {"fold": "fold_4", "regime": "Strong USD downturn", "sharpe": -0.1589, "sortino": -0.2766, "return_pct": -0.45, "equity": 995.52, "max_dd": 6.3, "win_rate": 58.33, "profit_factor": 0.976, "ic": 0.0921, "hit": 58.33, "n": 60, "aleatoric_mean": 0.020428, "epistemic_mean": 0.006996, "confidence_mean": 0.9737, "aleatoric_std": 0.021642, "epistemic_std": 0.003186}, {"fold": "fold_5", "regime": "Low-vol plateau", "sharpe": 2.7556, "sortino": 4.962, "return_pct": 4.77, "equity": 1047.65, "max_dd": 1.5, "win_rate": 56.45, "profit_factor": 1.564, "ic": 0.2373, "hit": 56.45, "n": 62, "aleatoric_mean": 0.00986, "epistemic_mean": 0.006361, "confidence_mean": 0.9841, "aleatoric_std": 0.006893, "epistemic_std": 0.002439}, {"fold": "fold_6", "regime": "EUR crisis downturn", "sharpe": -1.2568, "sortino": -2.0739, "return_pct": -1.32, "equity": 986.78, "max_dd": 2.05, "win_rate": 45.61, "profit_factor": 0.814, "ic": -0.1473, "hit": 44.83, "n": 58, "aleatoric_mean": 0.006464, "epistemic_mean": 0.007008, "confidence_mean": 0.9867, "aleatoric_std": 0.004243, "epistemic_std": 0.002444}, {"fold": "fold_7", "regime": "Recent mixed/upturn", "sharpe": 1.6157, "sortino": 2.2814, "return_pct": 2.04, "equity": 1020.43, "max_dd": 1.97, "win_rate": 53.33, "profit_factor": 1.302, "ic": 0.1431, "hit": 53.33, "n": 60, "aleatoric_mean": 0.02799, "epistemic_mean": 0.004703, "confidence_mean": 0.9689, "aleatoric_std": 0.026158, "epistemic_std": 0.001561}], "train_sharpe": 1.4705, "train_psr": 0.9952, "train_equity": 2712.19, "train_sortino": 1.5793, "train_return_pct": 171.22, "train_max_dd": 21.78, "train_win_rate": 55.35, "train_profit_factor": 1.405, "train_ic": 0.1519, "train_hit": 55.07, "train_per_window": [{"fold": "all_train", "regime": "Training data", "sharpe": 1.4705, "sortino": 1.5793, "return_pct": 171.22, "equity": 2712.19, "max_dd": 21.78, "win_rate": 55.35, "profit_factor": 1.405, "ic": 0.1519, "hit": 55.07, "n": 1382}], "experiment_num": 29, "status": "DISCARD"}
{"backbone": "lfm2-350m", "description": "H-Exp8: wd=5e-5 regularize het-heads", "config": {"seq_len": 60, "lr": 3e-05, "batch_size": 32, "epochs": 30, "weight_decay": 5e-05, "patience": 8, "grad_clip": 1.0, "warmup_epochs": 0, "huber_delta": 1.0, "head_dropout": 0.1}, "composite": -1.7737, "test_pos_folds": 4, "val_pos_folds": 2, "val_loss": -1.641747, "elapsed_sec": 394.7, "timestamp": "2026-04-12T09:30:40", "sharpe": 0.3711, "psr": 0.7213, "equity": 1078.59, "sortino": 0.6391, "return_pct": 7.86, "max_dd": 7.48, "win_rate": 49.6, "profit_factor": 1.064, "ic": -0.0111, "hit": 49.28, "aleatoric_mean": 0.060562, "epistemic_mean": 0.008121, "confidence_mean": 0.9389, "per_window": [{"fold": "fold_1", "regime": "Pre-crisis upturn + GFC onset", "sharpe": -1.9136, "sortino": -3.367, "return_pct": -4.04, "equity": 959.58, "max_dd": 4.69, "win_rate": 44.23, "profit_factor": 0.746, "ic": -0.0659, "hit": 43.4, "n": 53, "aleatoric_mean": 0.11334, "epistemic_mean": 0.006505, "confidence_mean": 0.8992, "aleatoric_std": 0.101256, "epistemic_std": 0.002654}, {"fold": "fold_2", "regime": "Post-crash recovery", "sharpe": 0.6832, "sortino": 1.3616, "return_pct": 1.79, "equity": 1017.87, "max_dd": 5.21, "win_rate": 40.35, "profit_factor": 1.116, "ic": -0.0608, "hit": 40.35, "n": 57, "aleatoric_mean": 0.109475, "epistemic_mean": 0.006073, "confidence_mean": 0.9014, "aleatoric_std": 0.089955, "epistemic_std": 0.002798}, {"fold": "fold_3", "regime": "Eurozone debt plateau", "sharpe": -0.7115, "sortino": -1.093, "return_pct": -1.32, "equity": 986.77, "max_dd": 3.21, "win_rate": 46.3, "profit_factor": 0.893, "ic": -0.0991, "hit": 44.64, "n": 56, "aleatoric_mean": 0.0682, "epistemic_mean": 0.007569, "confidence_mean": 0.9315, "aleatoric_std": 0.051338, "epistemic_std": 0.003044}, {"fold": "fold_4", "regime": "Strong USD downturn", "sharpe": 2.0283, "sortino": 4.0766, "return_pct": 10.42, "equity": 1104.16, "max_dd": 3.74, "win_rate": 53.85, "profit_factor": 1.406, "ic": 0.1361, "hit": 53.39, "n": 118, "aleatoric_mean": 0.045185, "epistemic_mean": 0.007078, "confidence_mean": 0.9522, "aleatoric_std": 0.052281, "epistemic_std": 0.003146}, {"fold": "fold_5", "regime": "Low-vol plateau", "sharpe": -2.6603, "sortino": -3.8561, "return_pct": -5.79, "equity": 942.05, "max_dd": 6.59, "win_rate": 40.18, "profit_factor": 0.642, "ic": -0.1332, "hit": 40.18, "n": 112, "aleatoric_mean": 0.026602, "epistemic_mean": 0.008787, "confidence_mean": 0.9661, "aleatoric_std": 0.019631, "epistemic_std": 0.003359}, {"fold": "fold_6", "regime": "EUR crisis downturn", "sharpe": 0.4993, "sortino": 0.8375, "return_pct": 2.05, "equity": 1020.47, "max_dd": 7.17, "win_rate": 58.26, "profit_factor": 1.082, "ic": 0.0583, "hit": 58.26, "n": 115, "aleatoric_mean": 0.094402, "epistemic_mean": 0.007017, "confidence_mean": 0.9111, "aleatoric_std": 0.069838, "epistemic_std": 0.0031}, {"fold": "fold_7", "regime": "Recent mixed/upturn", "sharpe": 1.3291, "sortino": 2.3974, "return_pct": 5.43, "equity": 1054.29, "max_dd": 3.99, "win_rate": 54.46, "profit_factor": 1.256, "ic": 0.0145, "hit": 54.46, "n": 112, "aleatoric_mean": 0.022291, "epistemic_mean": 0.011769, "confidence_mean": 0.9676, "aleatoric_std": 0.026225, "epistemic_std": 0.004081}], "val_sharpe": -0.9737, "val_psr": 0.1058, "val_equity": 881.22, "val_sortino": -1.468, "val_return_pct": -11.88, "val_max_dd": 17.95, "val_win_rate": 48.08, "val_profit_factor": 0.85, "val_ic": -0.0138, "val_hit": 47.85, "val_aleatoric_mean": 0.062215, "val_epistemic_mean": 0.008738, "val_confidence_mean": 0.9396, "val_per_window": [{"fold": "fold_1", "regime": "Pre-crisis upturn + GFC onset", "sharpe": -3.1121, "sortino": -4.3654, "return_pct": -4.78, "equity": 952.21, "max_dd": 5.21, "win_rate": 43.1, "profit_factor": 0.598, "ic": -0.1648, "hit": 42.37, "n": 59, "aleatoric_mean": 0.196384, "epistemic_mean": 0.00577, "confidence_mean": 0.8496, "aleatoric_std": 0.183735, "epistemic_std": 0.002351}, {"fold": "fold_2", "regime": "Post-crash recovery", "sharpe": -3.0476, "sortino": -4.485, "return_pct": -5.78, "equity": 942.18, "max_dd": 6.08, "win_rate": 43.1, "profit_factor": 0.61, "ic": -0.2696, "hit": 43.1, "n": 58, "aleatoric_mean": 0.104164, "epistemic_mean": 0.005913, "confidence_mean": 0.9031, "aleatoric_std": 0.057386, "epistemic_std": 0.002238}, {"fold": "fold_3", "regime": "Eurozone debt plateau", "sharpe": -3.0577, "sortino": -5.3119, "return_pct": -6.96, "equity": 930.43, "max_dd": 6.47, "win_rate": 37.7, "profit_factor": 0.6, "ic": -0.217, "hit": 37.7, "n": 61, "aleatoric_mean": 0.023031, "epistemic_mean": 0.009645, "confidence_mean": 0.9686, "aleatoric_std": 0.017014, "epistemic_std": 0.005003}, {"fold": "fold_4", "regime": "Strong USD downturn", "sharpe": 2.2674, "sortino": 4.096, "return_pct": 4.93, "equity": 1049.32, "max_dd": 3.4, "win_rate": 58.33, "profit_factor": 1.416, "ic": 0.2988, "hit": 58.33, "n": 60, "aleatoric_mean": 0.034037, "epistemic_mean": 0.009624, "confidence_mean": 0.9593, "aleatoric_std": 0.039113, "epistemic_std": 0.004534}, {"fold": "fold_5", "regime": "Low-vol plateau", "sharpe": -0.5634, "sortino": -0.8821, "return_pct": -1.03, "equity": 989.66, "max_dd": 5.0, "win_rate": 48.39, "profit_factor": 0.913, "ic": -0.0965, "hit": 48.39, "n": 62, "aleatoric_mean": 0.027413, "epistemic_mean": 0.009053, "confidence_mean": 0.9652, "aleatoric_std": 0.023124, "epistemic_std": 0.004069}, {"fold": "fold_6", "regime": "EUR crisis downturn", "sharpe": 4.6429, "sortino": 6.4069, "return_pct": 4.74, "equity": 1047.35, "max_dd": 1.26, "win_rate": 63.16, "profit_factor": 2.15, "ic": 0.527, "hit": 62.07, "n": 58, "aleatoric_mean": 0.016972, "epistemic_mean": 0.008772, "confidence_mean": 0.975, "aleatoric_std": 0.009995, "epistemic_std": 0.003032}, {"fold": "fold_7", "regime": "Recent mixed/upturn", "sharpe": -2.3284, "sortino": -3.3214, "return_pct": -2.94, "equity": 970.62, "max_dd": 4.33, "win_rate": 43.33, "profit_factor": 0.684, "ic": -0.0011, "hit": 43.33, "n": 60, "aleatoric_mean": 0.037443, "epistemic_mean": 0.012223, "confidence_mean": 0.9534, "aleatoric_std": 0.030302, "epistemic_std": 0.004396}], "train_sharpe": 1.0289, "train_psr": 0.9775, "train_equity": 1984.48, "train_sortino": 1.1255, "train_return_pct": 98.45, "train_max_dd": 23.33, "train_win_rate": 53.24, "train_profit_factor": 1.268, "train_ic": 0.1196, "train_hit": 52.97, "train_per_window": [{"fold": "all_train", "regime": "Training data", "sharpe": 1.0289, "sortino": 1.1255, "return_pct": 98.45, "equity": 1984.48, "max_dd": 23.33, "win_rate": 53.24, "profit_factor": 1.268, "ic": 0.1196, "hit": 52.97, "n": 1382}], "experiment_num": 30, "status": "DISCARD"}
{"backbone": "lfm2-350m", "description": "H-Exp9: hd=0.15 regularize wider het-heads", "config": {"seq_len": 60, "lr": 3e-05, "batch_size": 32, "epochs": 30, "weight_decay": 1e-05, "patience": 8, "grad_clip": 1.0, "warmup_epochs": 0, "huber_delta": 1.0, "head_dropout": 0.15}, "composite": -1.1028, "test_pos_folds": 2, "val_pos_folds": 3, "val_loss": -1.670073, "elapsed_sec": 400.6, "timestamp": "2026-04-12T09:39:27", "sharpe": -0.0576, "psr": 0.464, "equity": 975.84, "sortino": -0.0938, "return_pct": -2.42, "max_dd": 19.78, "win_rate": 48.79, "profit_factor": 0.99, "ic": 0.0203, "hit": 48.48, "aleatoric_mean": 0.069982, "epistemic_mean": 0.012224, "confidence_mean": 0.9272, "per_window": [{"fold": "fold_1", "regime": "Pre-crisis upturn + GFC onset", "sharpe": -0.2751, "sortino": -0.4938, "return_pct": -0.69, "equity": 993.14, "max_dd": 4.33, "win_rate": 48.08, "profit_factor": 0.959, "ic": -0.0265, "hit": 47.17, "n": 53, "aleatoric_mean": 0.108681, "epistemic_mean": 0.014743, "confidence_mean": 0.8926, "aleatoric_std": 0.063419, "epistemic_std": 0.005836}, {"fold": "fold_2", "regime": "Post-crash recovery", "sharpe": 3.8113, "sortino": 6.4661, "return_pct": 10.98, "equity": 1109.76, "max_dd": 5.92, "win_rate": 57.89, "profit_factor": 1.845, "ic": 0.3321, "hit": 57.89, "n": 57, "aleatoric_mean": 0.163172, "epistemic_mean": 0.011823, "confidence_mean": 0.8569, "aleatoric_std": 0.10225, "epistemic_std": 0.004351}, {"fold": "fold_3", "regime": "Eurozone debt plateau", "sharpe": -0.3915, "sortino": -0.6181, "return_pct": -0.76, "equity": 992.38, "max_dd": 4.75, "win_rate": 46.3, "profit_factor": 0.94, "ic": 0.1358, "hit": 44.64, "n": 56, "aleatoric_mean": 0.073672, "epistemic_mean": 0.015143, "confidence_mean": 0.92, "aleatoric_std": 0.05048, "epistemic_std": 0.007844}, {"fold": "fold_4", "regime": "Strong USD downturn", "sharpe": -0.2968, "sortino": -0.5305, "return_pct": -1.76, "equity": 982.42, "max_dd": 9.83, "win_rate": 45.3, "profit_factor": 0.951, "ic": -0.0767, "hit": 44.92, "n": 118, "aleatoric_mean": 0.067461, "epistemic_mean": 0.012959, "confidence_mean": 0.928, "aleatoric_std": 0.060803, "epistemic_std": 0.005191}, {"fold": "fold_5", "regime": "Low-vol plateau", "sharpe": -1.9054, "sortino": -2.6023, "return_pct": -4.23, "equity": 957.72, "max_dd": 6.38, "win_rate": 44.64, "profit_factor": 0.728, "ic": -0.002, "hit": 44.64, "n": 112, "aleatoric_mean": 0.023812, "epistemic_mean": 0.011757, "confidence_mean": 0.9658, "aleatoric_std": 0.015698, "epistemic_std": 0.004877}, {"fold": "fold_6", "regime": "EUR crisis downturn", "sharpe": -1.8949, "sortino": -2.8701, "return_pct": -8.33, "equity": 916.67, "max_dd": 12.27, "win_rate": 51.3, "profit_factor": 0.741, "ic": 0.0047, "hit": 51.3, "n": 115, "aleatoric_mean": 0.090098, "epistemic_mean": 0.009534, "confidence_mean": 0.9115, "aleatoric_std": 0.055804, "epistemic_std": 0.003832}, {"fold": "fold_7", "regime": "Recent mixed/upturn", "sharpe": 0.8668, "sortino": 1.6608, "return_pct": 3.45, "equity": 1034.47, "max_dd": 5.68, "win_rate": 50.89, "profit_factor": 1.16, "ic": 0.2202, "hit": 50.89, "n": 112, "aleatoric_mean": 0.03057, "epistemic_mean": 0.012233, "confidence_mean": 0.9598, "aleatoric_std": 0.033422, "epistemic_std": 0.004733}], "val_sharpe": -0.2028, "val_psr": 0.3973, "val_equity": 970.33, "val_sortino": -0.328, "val_return_pct": -2.97, "val_max_dd": 9.45, "val_win_rate": 47.36, "val_profit_factor": 0.967, "val_ic": 0.0006, "val_hit": 47.13, "val_aleatoric_mean": 0.070332, "val_epistemic_mean": 0.012606, "val_confidence_mean": 0.9288, "val_per_window": [{"fold": "fold_1", "regime": "Pre-crisis upturn + GFC onset", "sharpe": 1.4336, "sortino": 2.1973, "return_pct": 2.24, "equity": 1022.35, "max_dd": 2.28, "win_rate": 51.72, "profit_factor": 1.266, "ic": 0.0279, "hit": 50.85, "n": 59, "aleatoric_mean": 0.190039, "epistemic_mean": 0.010138, "confidence_mean": 0.8457, "aleatoric_std": 0.15282, "epistemic_std": 0.004464}, {"fold": "fold_2", "regime": "Post-crash recovery", "sharpe": -0.6578, "sortino": -1.0905, "return_pct": -1.36, "equity": 986.36, "max_dd": 6.47, "win_rate": 51.72, "profit_factor": 0.899, "ic": 0.1074, "hit": 51.72, "n": 58, "aleatoric_mean": 0.139267, "epistemic_mean": 0.013345, "confidence_mean": 0.8706, "aleatoric_std": 0.071158, "epistemic_std": 0.006015}, {"fold": "fold_3", "regime": "Eurozone debt plateau", "sharpe": 1.0016, "sortino": 1.9124, "return_pct": 2.27, "equity": 1022.73, "max_dd": 4.68, "win_rate": 47.54, "profit_factor": 1.182, "ic": -0.0176, "hit": 47.54, "n": 61, "aleatoric_mean": 0.041199, "epistemic_mean": 0.016789, "confidence_mean": 0.9456, "aleatoric_std": 0.022553, "epistemic_std": 0.006383}, {"fold": "fold_4", "regime": "Strong USD downturn", "sharpe": -0.8983, "sortino": -1.5334, "return_pct": -2.04, "equity": 979.56, "max_dd": 3.26, "win_rate": 45.0, "profit_factor": 0.871, "ic": -0.0555, "hit": 45.0, "n": 60, "aleatoric_mean": 0.036765, "epistemic_mean": 0.013556, "confidence_mean": 0.9529, "aleatoric_std": 0.034143, "epistemic_std": 0.005553}, {"fold": "fold_5", "regime": "Low-vol plateau", "sharpe": -1.496, "sortino": -2.5676, "return_pct": -2.61, "equity": 973.86, "max_dd": 5.09, "win_rate": 40.32, "profit_factor": 0.785, "ic": -0.1045, "hit": 40.32, "n": 62, "aleatoric_mean": 0.026977, "epistemic_mean": 0.010456, "confidence_mean": 0.9642, "aleatoric_std": 0.018235, "epistemic_std": 0.004364}, {"fold": "fold_6", "regime": "EUR crisis downturn", "sharpe": 1.0647, "sortino": 2.2981, "return_pct": 1.09, "equity": 1010.91, "max_dd": 2.78, "win_rate": 42.11, "profit_factor": 1.191, "ic": 0.024, "hit": 41.38, "n": 58, "aleatoric_mean": 0.012593, "epistemic_mean": 0.010768, "confidence_mean": 0.9772, "aleatoric_std": 0.006364, "epistemic_std": 0.003759}, {"fold": "fold_7", "regime": "Recent mixed/upturn", "sharpe": -1.9156, "sortino": -2.5554, "return_pct": -2.44, "equity": 975.62, "max_dd": 3.85, "win_rate": 53.33, "profit_factor": 0.731, "ic": 0.0697, "hit": 53.33, "n": 60, "aleatoric_mean": 0.049784, "epistemic_mean": 0.013114, "confidence_mean": 0.9418, "aleatoric_std": 0.036714, "epistemic_std": 0.00423}], "train_sharpe": 0.4254, "train_psr": 0.8252, "train_equity": 1291.62, "train_sortino": 0.4587, "train_return_pct": 29.16, "train_max_dd": 20.34, "train_win_rate": 52.36, "train_profit_factor": 1.103, "train_ic": 0.0711, "train_hit": 52.1, "train_per_window": [{"fold": "all_train", "regime": "Training data", "sharpe": 0.4254, "sortino": 0.4587, "return_pct": 29.16, "equity": 1291.62, "max_dd": 20.34, "win_rate": 52.36, "profit_factor": 1.103, "ic": 0.0711, "hit": 52.1, "n": 1382}], "experiment_num": 31, "status": "DISCARD"}
