{"backbone": "catboost", "description": "catboost: Exp13 seed=0 variance", "config": {"seq_len": 10, "lr": 0.0003, "batch_size": 32, "epochs": 20, "weight_decay": 1e-05, "patience": 5, "grad_clip": 1.0, "warmup_epochs": 0, "huber_delta": 1.0, "head_dropout": 0.1, "seed": 0, "gbm_lr": 0.01, "depth": 4, "het_loss": false}, "composite": 7.9196, "test_pos_folds": 7, "val_pos_folds": 6, "val_loss": 0.0, "elapsed_sec": 252.5, "timestamp": "2026-04-21T10:06:50", "sharpe": 8.0196, "psr": 1.0, "equity": 19562.82, "sortino": 7.8748, "return_pct": 1856.28, "max_dd": 7.54, "win_rate": 78.95, "profit_factor": 4.903, "ic": 0.695, "hit": 78.62, "precision": 0.8062, "recall": 0.7526, "f1": 0.7785, "f2": 0.7627, "mcc": 0.5775, "accuracy": 0.7883, "per_window": [{"fold": "fold_1", "regime": "Pre-crisis upturn + GFC onset", "sharpe": 0.8073, "sortino": 0.8849, "return_pct": 5.64, "equity": 1056.4, "max_dd": 7.54, "win_rate": 52.94, "profit_factor": 1.21, "ic": 0.1711, "hit": 52.43, "n": 103, "precision": 0.5806, "recall": 0.3396, "f1": 0.4286, "f2": 0.3704, "mcc": 0.0868, "accuracy": 0.534, "tp": 18, "fp": 13, "tn": 37, "fn": 35}, {"fold": "fold_2", "regime": "Post-crash recovery", "sharpe": 0.7639, "sortino": 1.3673, "return_pct": 3.45, "equity": 1034.5, "max_dd": 5.74, "win_rate": 52.34, "profit_factor": 1.127, "ic": -0.0281, "hit": 52.34, "n": 107, "precision": 0.5, "recall": 0.4118, "f1": 0.4516, "f2": 0.4268, "mcc": 0.0376, "accuracy": 0.5234, "tp": 21, "fp": 21, "tn": 35, "fn": 30}, {"fold": "fold_3", "regime": "Eurozone debt plateau", "sharpe": 14.1038, "sortino": 22.967, "return_pct": 45.18, "equity": 1451.79, "max_dd": 1.38, "win_rate": 84.62, "profit_factor": 10.595, "ic": 0.8124, "hit": 83.02, "n": 106, "precision": 0.8679, "recall": 0.807, "f1": 0.8364, "f2": 0.8185, "mcc": 0.6623, "accuracy": 0.8302, "tp": 46, "fp": 7, "tn": 42, "fn": 11}, {"fold": "fold_4", "regime": "Strong USD downturn", "sharpe": 15.9471, "sortino": 43.5405, "return_pct": 138.92, "equity": 2389.19, "max_dd": 0.56, "win_rate": 92.81, "profit_factor": 35.261, "ic": 0.8979, "hit": 92.26, "n": 168, "precision": 0.9405, "recall": 0.9186, "f1": 0.9294, "f2": 0.9229, "mcc": 0.8574, "accuracy": 0.9286, "tp": 79, "fp": 5, "tn": 77, "fn": 7}, {"fold": "fold_5", "regime": "Low-vol plateau", "sharpe": 15.0464, "sortino": 69.7052, "return_pct": 43.79, "equity": 1437.85, "max_dd": 0.23, "win_rate": 83.95, "profit_factor": 20.797, "ic": 0.9121, "hit": 83.95, "n": 162, "precision": 0.8125, "recall": 0.8553, "f1": 0.8333, "f2": 0.8464, "mcc": 0.6796, "accuracy": 0.8395, "tp": 65, "fp": 15, "tn": 71, "fn": 11}, {"fold": "fold_6", "regime": "EUR crisis downturn", "sharpe": 15.6282, "sortino": 63.1854, "return_pct": 101.06, "equity": 2010.6, "max_dd": 0.43, "win_rate": 83.64, "profit_factor": 18.952, "ic": 0.884, "hit": 83.64, "n": 165, "precision": 0.8289, "recall": 0.8182, "f1": 0.8235, "f2": 0.8203, "mcc": 0.671, "accuracy": 0.8364, "tp": 63, "fp": 13, "tn": 75, "fn": 14}, {"fold": "fold_7", "regime": "Recent mixed/upturn", "sharpe": 12.3857, "sortino": 15.912, "return_pct": 78.52, "equity": 1785.17, "max_dd": 1.64, "win_rate": 85.19, "profit_factor": 10.417, "ic": 0.8402, "hit": 85.19, "n": 162, "precision": 0.8434, "recall": 0.8642, "f1": 0.8537, "f2": 0.86, "mcc": 0.7039, "accuracy": 0.8519, "tp": 70, "fp": 13, "tn": 68, "fn": 11}], "val_sharpe": 8.4863, "val_psr": 1.0, "val_equity": 5860.78, "val_sortino": 10.722, "val_return_pct": 486.08, "val_max_dd": 9.68, "val_win_rate": 76.54, "val_profit_factor": 4.438, "val_ic": 0.691, "val_hit": 76.04, "val_precision": 0.7279, "val_recall": 0.8137, "val_f1": 0.7684, "val_f2": 0.795, "val_mcc": 0.5387, "val_accuracy": 0.7669, "val_per_window": [{"fold": "fold_1", "regime": "Pre-crisis upturn + GFC onset", "sharpe": 1.5102, "sortino": 2.6074, "return_pct": 3.79, "equity": 1037.93, "max_dd": 4.05, "win_rate": 49.07, "profit_factor": 1.285, "ic": -0.041, "hit": 48.62, "n": 109, "precision": 0.5, "recall": 0.7818, "f1": 0.6099, "f2": 0.7026, "mcc": -0.0177, "accuracy": 0.4954, "tp": 43, "fp": 43, "tn": 11, "fn": 12}, {"fold": "fold_2", "regime": "Post-crash recovery", "sharpe": -0.0708, "sortino": -0.1132, "return_pct": -0.62, "equity": 993.83, "max_dd": 9.68, "win_rate": 49.07, "profit_factor": 0.989, "ic": -0.0497, "hit": 49.07, "n": 108, "precision": 0.5714, "recall": 0.5079, "f1": 0.5378, "f2": 0.5195, "mcc": -0.0251, "accuracy": 0.4907, "tp": 32, "fp": 24, "tn": 21, "fn": 31}, {"fold": "fold_3", "regime": "Eurozone debt plateau", "sharpe": 14.6276, "sortino": 30.8797, "return_pct": 54.23, "equity": 1542.34, "max_dd": 0.7, "win_rate": 86.24, "profit_factor": 14.692, "ic": 0.8582, "hit": 84.68, "n": 111, "precision": 0.7963, "recall": 0.9149, "f1": 0.8515, "f2": 0.8884, "mcc": 0.7345, "accuracy": 0.8649, "tp": 43, "fp": 11, "tn": 53, "fn": 4}, {"fold": "fold_4", "regime": "Strong USD downturn", "sharpe": 16.6352, "sortino": 49.8878, "return_pct": 48.86, "equity": 1488.56, "max_dd": 0.59, "win_rate": 91.74, "profit_factor": 38.717, "ic": 0.9447, "hit": 90.91, "n": 110, "precision": 0.9318, "recall": 0.8723, "f1": 0.9011, "f2": 0.8836, "mcc": 0.8328, "accuracy": 0.9182, "tp": 41, "fp": 3, "tn": 60, "fn": 6}, {"fold": "fold_5", "regime": "Low-vol plateau", "sharpe": 16.0288, "sortino": 80.7547, "return_pct": 45.54, "equity": 1455.4, "max_dd": 0.25, "win_rate": 86.61, "profit_factor": 30.73, "ic": 0.9227, "hit": 86.61, "n": 112, "precision": 0.8393, "recall": 0.8868, "f1": 0.8624, "f2": 0.8769, "mcc": 0.7332, "accuracy": 0.8661, "tp": 47, "fp": 9, "tn": 50, "fn": 6}, {"fold": "fold_6", "regime": "EUR crisis downturn", "sharpe": 15.9794, "sortino": 101.4068, "return_pct": 29.35, "equity": 1293.47, "max_dd": 0.15, "win_rate": 87.85, "profit_factor": 36.983, "ic": 0.9375, "hit": 87.04, "n": 108, "precision": 0.8269, "recall": 0.9149, "f1": 0.8687, "f2": 0.8958, "mcc": 0.7614, "accuracy": 0.8796, "tp": 43, "fp": 9, "tn": 52, "fn": 4}, {"fold": "fold_7", "regime": "Recent mixed/upturn", "sharpe": 16.4535, "sortino": 70.848, "return_pct": 31.46, "equity": 1314.59, "max_dd": 0.23, "win_rate": 84.55, "profit_factor": 23.373, "ic": 0.8907, "hit": 84.55, "n": 110, "precision": 0.8, "recall": 0.9057, "f1": 0.8496, "f2": 0.8824, "mcc": 0.6976, "accuracy": 0.8455, "tp": 48, "fp": 12, "tn": 45, "fn": 5}], "train_sharpe": 8.7689, "train_psr": 1.0, "train_equity": 11460706.0, "train_sortino": 29.6465, "train_return_pct": 1145970.6, "train_max_dd": 3.89, "train_win_rate": 82.17, "train_profit_factor": 11.379, "train_ic": 0.8321, "train_hit": 81.84, "train_precision": 0.8149, "train_recall": 0.843, "train_f1": 0.8287, "train_f2": 0.8372, "train_mcc": 0.6414, "train_accuracy": 0.8208, "train_per_window": [{"fold": "all_train", "regime": "Training data", "sharpe": 8.7689, "sortino": 29.6465, "return_pct": 1145970.6, "equity": 11460706.0, "max_dd": 3.89, "win_rate": 82.17, "profit_factor": 11.379, "ic": 0.8321, "hit": 81.84, "n": 2478, "precision": 0.8149, "recall": 0.843, "f1": 0.8287, "f2": 0.8372, "mcc": 0.6414, "accuracy": 0.8208, "tp": 1074, "fp": 244, "tn": 960, "fn": 200}], "experiment_num": 232, "status": "DISCARD"}
{"backbone": "catboost", "description": "catboost: Exp14 seed=99 variance", "config": {"seq_len": 10, "lr": 0.0003, "batch_size": 32, "epochs": 20, "weight_decay": 1e-05, "patience": 5, "grad_clip": 1.0, "warmup_epochs": 0, "huber_delta": 1.0, "head_dropout": 0.1, "seed": 99, "gbm_lr": 0.01, "depth": 4, "het_loss": false}, "composite": 7.8699, "test_pos_folds": 7, "val_pos_folds": 6, "val_loss": 0.0, "elapsed_sec": 252.5, "timestamp": "2026-04-21T10:11:13", "sharpe": 7.9699, "psr": 1.0, "equity": 19274.86, "sortino": 7.7981, "return_pct": 1827.49, "max_dd": 7.54, "win_rate": 79.05, "profit_factor": 4.847, "ic": 0.7018, "hit": 78.73, "precision": 0.8022, "recall": 0.7588, "f1": 0.7799, "f2": 0.7671, "mcc": 0.5771, "accuracy": 0.7883, "per_window": [{"fold": "fold_1", "regime": "Pre-crisis upturn + GFC onset", "sharpe": 0.4067, "sortino": 0.4498, "return_pct": 2.43, "equity": 1024.33, "max_dd": 7.54, "win_rate": 51.96, "profit_factor": 1.101, "ic": 0.2083, "hit": 51.46, "n": 103, "precision": 0.5455, "recall": 0.3396, "f1": 0.4186, "f2": 0.3673, "mcc": 0.0424, "accuracy": 0.5146, "tp": 18, "fp": 15, "tn": 35, "fn": 35}, {"fold": "fold_2", "regime": "Post-crash recovery", "sharpe": 0.8683, "sortino": 1.5477, "return_pct": 3.97, "equity": 1039.68, "max_dd": 4.89, "win_rate": 51.4, "profit_factor": 1.146, "ic": -0.011, "hit": 51.4, "n": 107, "precision": 0.4884, "recall": 0.4118, "f1": 0.4468, "f2": 0.4251, "mcc": 0.0193, "accuracy": 0.514, "tp": 21, "fp": 22, "tn": 34, "fn": 30}, {"fold": "fold_3", "regime": "Eurozone debt plateau", "sharpe": 15.1374, "sortino": 24.7107, "return_pct": 47.32, "equity": 1473.15, "max_dd": 1.32, "win_rate": 87.5, "profit_factor": 13.266, "ic": 0.8013, "hit": 85.85, "n": 106, "precision": 0.8889, "recall": 0.8421, "f1": 0.8649, "f2": 0.8511, "mcc": 0.7177, "accuracy": 0.8585, "tp": 48, "fp": 6, "tn": 43, "fn": 9}, {"fold": "fold_4", "regime": "Strong USD downturn", "sharpe": 15.8069, "sortino": 45.6085, "return_pct": 138.0, "equity": 2379.99, "max_dd": 0.56, "win_rate": 91.62, "profit_factor": 32.717, "ic": 0.8995, "hit": 91.07, "n": 168, "precision": 0.9286, "recall": 0.907, "f1": 0.9176, "f2": 0.9112, "mcc": 0.8336, "accuracy": 0.9167, "tp": 78, "fp": 6, "tn": 76, "fn": 8}, {"fold": "fold_5", "regime": "Low-vol plateau", "sharpe": 15.2586, "sortino": 71.0536, "return_pct": 44.17, "equity": 1441.71, "max_dd": 0.2, "win_rate": 84.57, "profit_factor": 22.508, "ic": 0.916, "hit": 84.57, "n": 162, "precision": 0.8148, "recall": 0.8684, "f1": 0.8408, "f2": 0.8571, "mcc": 0.6927, "accuracy": 0.8457, "tp": 66, "fp": 15, "tn": 71, "fn": 10}, {"fold": "fold_6", "regime": "EUR crisis downturn", "sharpe": 15.4098, "sortino": 62.773, "return_pct": 100.05, "equity": 2000.51, "max_dd": 0.43, "win_rate": 83.03, "profit_factor": 17.746, "ic": 0.8826, "hit": 83.03, "n": 165, "precision": 0.8182, "recall": 0.8182, "f1": 0.8182, "f2": 0.8182, "mcc": 0.6591, "accuracy": 0.8303, "tp": 63, "fp": 14, "tn": 74, "fn": 14}, {"fold": "fold_7", "regime": "Recent mixed/upturn", "sharpe": 12.4754, "sortino": 15.5097, "return_pct": 78.98, "equity": 1789.84, "max_dd": 1.64, "win_rate": 86.42, "profit_factor": 10.663, "ic": 0.8393, "hit": 86.42, "n": 162, "precision": 0.8554, "recall": 0.8765, "f1": 0.8659, "f2": 0.8722, "mcc": 0.7286, "accuracy": 0.8642, "tp": 71, "fp": 12, "tn": 69, "fn": 10}], "val_sharpe": 8.6499, "val_psr": 1.0, "val_equity": 6018.08, "val_sortino": 10.8384, "val_return_pct": 501.81, "val_max_dd": 10.39, "val_win_rate": 77.2, "val_profit_factor": 4.58, "val_ic": 0.6891, "val_hit": 76.69, "val_precision": 0.7382, "val_recall": 0.811, "val_f1": 0.7728, "val_f2": 0.7953, "val_mcc": 0.5503, "val_accuracy": 0.7734, "val_per_window": [{"fold": "fold_1", "regime": "Pre-crisis upturn + GFC onset", "sharpe": 3.0278, "sortino": 6.2363, "return_pct": 7.72, "equity": 1077.2, "max_dd": 2.2, "win_rate": 52.78, "profit_factor": 1.654, "ic": -0.0288, "hit": 52.29, "n": 109, "precision": 0.5244, "recall": 0.7818, "f1": 0.6277, "f2": 0.7119, "mcc": 0.069, "accuracy": 0.5321, "tp": 43, "fp": 39, "tn": 15, "fn": 12}, {"fold": "fold_2", "regime": "Post-crash recovery", "sharpe": -0.2659, "sortino": -0.4206, "return_pct": -1.55, "equity": 984.46, "max_dd": 10.39, "win_rate": 49.07, "profit_factor": 0.959, "ic": -0.0577, "hit": 49.07, "n": 108, "precision": 0.5714, "recall": 0.5079, "f1": 0.5378, "f2": 0.5195, "mcc": -0.0251, "accuracy": 0.4907, "tp": 32, "fp": 24, "tn": 21, "fn": 31}, {"fold": "fold_3", "regime": "Eurozone debt plateau", "sharpe": 14.6115, "sortino": 30.9451, "return_pct": 54.19, "equity": 1541.95, "max_dd": 0.7, "win_rate": 85.32, "profit_factor": 14.629, "ic": 0.8588, "hit": 83.78, "n": 111, "precision": 0.7818, "recall": 0.9149, "f1": 0.8431, "f2": 0.8848, "mcc": 0.7188, "accuracy": 0.8559, "tp": 43, "fp": 12, "tn": 52, "fn": 4}, {"fold": "fold_4", "regime": "Strong USD downturn", "sharpe": 16.3168, "sortino": 53.6308, "return_pct": 48.31, "equity": 1483.07, "max_dd": 0.64, "win_rate": 89.91, "profit_factor": 32.812, "ic": 0.9404, "hit": 89.09, "n": 110, "precision": 0.9091, "recall": 0.8511, "f1": 0.8791, "f2": 0.8621, "mcc": 0.7953, "accuracy": 0.9, "tp": 40, "fp": 4, "tn": 59, "fn": 7}, {"fold": "fold_5", "regime": "Low-vol plateau", "sharpe": 16.0388, "sortino": 82.3153, "return_pct": 45.56, "equity": 1455.57, "max_dd": 0.25, "win_rate": 87.5, "profit_factor": 30.875, "ic": 0.9225, "hit": 87.5, "n": 112, "precision": 0.8545, "recall": 0.8868, "f1": 0.8704, "f2": 0.8801, "mcc": 0.7502, "accuracy": 0.875, "tp": 47, "fp": 8, "tn": 51, "fn": 6}, {"fold": "fold_6", "regime": "EUR crisis downturn", "sharpe": 16.0045, "sortino": 104.0188, "return_pct": 29.37, "equity": 1293.73, "max_dd": 0.15, "win_rate": 88.79, "profit_factor": 37.522, "ic": 0.9344, "hit": 87.96, "n": 108, "precision": 0.8431, "recall": 0.9149, "f1": 0.8776, "f2": 0.8996, "mcc": 0.7783, "accuracy": 0.8889, "tp": 43, "fp": 8, "tn": 53, "fn": 4}, {"fold": "fold_7", "regime": "Recent mixed/upturn", "sharpe": 16.7636, "sortino": 68.4904, "return_pct": 31.78, "equity": 1317.82, "max_dd": 0.23, "win_rate": 86.36, "profit_factor": 26.086, "ic": 0.8957, "hit": 86.36, "n": 110, "precision": 0.8276, "recall": 0.9057, "f1": 0.8649, "f2": 0.8889, "mcc": 0.7308, "accuracy": 0.8636, "tp": 48, "fp": 10, "tn": 47, "fn": 5}], "train_sharpe": 8.6925, "train_psr": 1.0, "train_equity": 10760166.0, "train_sortino": 28.7847, "train_return_pct": 1075916.6, "train_max_dd": 3.89, "train_win_rate": 81.89, "train_profit_factor": 10.964, "train_ic": 0.8306, "train_hit": 81.56, "train_precision": 0.812, "train_recall": 0.8407, "train_f1": 0.8261, "train_f2": 0.8348, "train_mcc": 0.6358, "train_accuracy": 0.818, "train_per_window": [{"fold": "all_train", "regime": "Training data", "sharpe": 8.6925, "sortino": 28.7847, "return_pct": 1075916.6, "equity": 10760166.0, "max_dd": 3.89, "win_rate": 81.89, "profit_factor": 10.964, "ic": 0.8306, "hit": 81.56, "n": 2478, "precision": 0.812, "recall": 0.8407, "f1": 0.8261, "f2": 0.8348, "mcc": 0.6358, "accuracy": 0.818, "tp": 1071, "fp": 248, "tn": 956, "fn": 203}], "experiment_num": 233, "status": "DISCARD"}
{"backbone": "catboost", "description": "catboost: Exp15 seed=13 variance", "config": {"seq_len": 10, "lr": 0.0003, "batch_size": 32, "epochs": 20, "weight_decay": 1e-05, "patience": 5, "grad_clip": 1.0, "warmup_epochs": 0, "huber_delta": 1.0, "head_dropout": 0.1, "seed": 13, "gbm_lr": 0.01, "depth": 4, "het_loss": false}, "composite": 7.9134, "test_pos_folds": 7, "val_pos_folds": 6, "val_loss": 0.0, "elapsed_sec": 251.2, "timestamp": "2026-04-21T10:15:34", "sharpe": 8.0134, "psr": 1.0, "equity": 19526.98, "sortino": 7.9123, "return_pct": 1852.7, "max_dd": 7.54, "win_rate": 78.74, "profit_factor": 4.896, "ic": 0.6942, "hit": 78.42, "precision": 0.7969, "recall": 0.7588, "f1": 0.7774, "f2": 0.7662, "mcc": 0.5708, "accuracy": 0.7852, "per_window": [{"fold": "fold_1", "regime": "Pre-crisis upturn + GFC onset", "sharpe": 0.6925, "sortino": 0.7765, "return_pct": 4.71, "equity": 1047.11, "max_dd": 7.54, "win_rate": 50.0, "profit_factor": 1.178, "ic": 0.1602, "hit": 49.51, "n": 103, "precision": 0.5135, "recall": 0.3585, "f1": 0.4222, "f2": 0.3815, "mcc": -0.0016, "accuracy": 0.4951, "tp": 19, "fp": 18, "tn": 32, "fn": 34}, {"fold": "fold_2", "regime": "Post-crash recovery", "sharpe": 1.2565, "sortino": 2.1987, "return_pct": 5.91, "equity": 1059.1, "max_dd": 4.72, "win_rate": 54.21, "profit_factor": 1.218, "ic": -0.0008, "hit": 54.21, "n": 107, "precision": 0.5217, "recall": 0.4706, "f1": 0.4948, "f2": 0.48, "mcc": 0.0784, "accuracy": 0.5421, "tp": 24, "fp": 22, "tn": 34, "fn": 27}, {"fold": "fold_3", "regime": "Eurozone debt plateau", "sharpe": 12.7242, "sortino": 22.2585, "return_pct": 42.04, "equity": 1420.43, "max_dd": 1.38, "win_rate": 82.69, "profit_factor": 8.059, "ic": 0.7869, "hit": 81.13, "n": 106, "precision": 0.8491, "recall": 0.7895, "f1": 0.8182, "f2": 0.8007, "mcc": 0.6244, "accuracy": 0.8113, "tp": 45, "fp": 8, "tn": 41, "fn": 12}, {"fold": "fold_4", "regime": "Strong USD downturn", "sharpe": 15.8812, "sortino": 44.5174, "return_pct": 138.49, "equity": 2384.87, "max_dd": 0.56, "win_rate": 92.22, "profit_factor": 34.023, "ic": 0.8906, "hit": 91.67, "n": 168, "precision": 0.9294, "recall": 0.9186, "f1": 0.924, "f2": 0.9207, "mcc": 0.8453, "accuracy": 0.9226, "tp": 79, "fp": 6, "tn": 76, "fn": 7}, {"fold": "fold_5", "regime": "Low-vol plateau", "sharpe": 15.2586, "sortino": 71.0536, "return_pct": 44.17, "equity": 1441.71, "max_dd": 0.2, "win_rate": 84.57, "profit_factor": 22.508, "ic": 0.9112, "hit": 84.57, "n": 162, "precision": 0.8148, "recall": 0.8684, "f1": 0.8408, "f2": 0.8571, "mcc": 0.6927, "accuracy": 0.8457, "tp": 66, "fp": 15, "tn": 71, "fn": 10}, {"fold": "fold_6", "regime": "EUR crisis downturn", "sharpe": 14.9725, "sortino": 42.6339, "return_pct": 97.98, "equity": 1979.84, "max_dd": 0.76, "win_rate": 83.03, "profit_factor": 15.664, "ic": 0.8822, "hit": 83.03, "n": 165, "precision": 0.8267, "recall": 0.8052, "f1": 0.8158, "f2": 0.8094, "mcc": 0.6587, "accuracy": 0.8303, "tp": 62, "fp": 13, "tn": 75, "fn": 15}, {"fold": "fold_7", "regime": "Recent mixed/upturn", "sharpe": 13.0881, "sortino": 17.6817, "return_pct": 82.1, "equity": 1821.01, "max_dd": 1.64, "win_rate": 86.42, "profit_factor": 12.603, "ic": 0.8415, "hit": 86.42, "n": 162, "precision": 0.8642, "recall": 0.8642, "f1": 0.8642, "f2": 0.8642, "mcc": 0.7284, "accuracy": 0.8642, "tp": 70, "fp": 11, "tn": 70, "fn": 11}], "val_sharpe": 8.2221, "val_psr": 1.0, "val_equity": 5611.42, "val_sortino": 10.255, "val_return_pct": 461.14, "val_max_dd": 10.91, "val_win_rate": 76.41, "val_profit_factor": 4.218, "val_ic": 0.6901, "val_hit": 75.91, "val_precision": 0.7244, "val_recall": 0.8137, "val_f1": 0.7665, "val_f2": 0.7941, "val_mcc": 0.5339, "val_accuracy": 0.7643, "val_per_window": [{"fold": "fold_1", "regime": "Pre-crisis upturn + GFC onset", "sharpe": 1.2861, "sortino": 2.2364, "return_pct": 3.21, "equity": 1032.14, "max_dd": 4.05, "win_rate": 49.07, "profit_factor": 1.238, "ic": 0.0513, "hit": 48.62, "n": 109, "precision": 0.4945, "recall": 0.8182, "f1": 0.6164, "f2": 0.7235, "mcc": -0.0453, "accuracy": 0.4862, "tp": 45, "fp": 46, "tn": 8, "fn": 10}, {"fold": "fold_2", "regime": "Post-crash recovery", "sharpe": -0.8494, "sortino": -1.3437, "return_pct": -4.3, "equity": 957.01, "max_dd": 10.91, "win_rate": 47.22, "profit_factor": 0.874, "ic": -0.0636, "hit": 47.22, "n": 108, "precision": 0.5517, "recall": 0.5079, "f1": 0.5289, "f2": 0.5161, "mcc": -0.0691, "accuracy": 0.4722, "tp": 32, "fp": 26, "tn": 19, "fn": 31}, {"fold": "fold_3", "regime": "Eurozone debt plateau", "sharpe": 15.1035, "sortino": 31.0759, "return_pct": 55.39, "equity": 1553.94, "max_dd": 0.7, "win_rate": 87.16, "profit_factor": 16.787, "ic": 0.8613, "hit": 85.59, "n": 111, "precision": 0.8113, "recall": 0.9149, "f1": 0.86, "f2": 0.8921, "mcc": 0.7505, "accuracy": 0.8739, "tp": 43, "fp": 10, "tn": 54, "fn": 4}, {"fold": "fold_4", "regime": "Strong USD downturn", "sharpe": 16.4027, "sortino": 52.1766, "return_pct": 48.46, "equity": 1484.56, "max_dd": 0.59, "win_rate": 90.83, "profit_factor": 34.241, "ic": 0.9381, "hit": 90.0, "n": 110, "precision": 0.9111, "recall": 0.8723, "f1": 0.8913, "f2": 0.8798, "mcc": 0.8138, "accuracy": 0.9091, "tp": 41, "fp": 4, "tn": 59, "fn": 6}, {"fold": "fold_5", "regime": "Low-vol plateau", "sharpe": 15.3528, "sortino": 72.5635, "return_pct": 44.36, "equity": 1443.63, "max_dd": 0.25, "win_rate": 83.93, "profit_factor": 23.028, "ic": 0.9249, "hit": 83.93, "n": 112, "precision": 0.8182, "recall": 0.8491, "f1": 0.8333, "f2": 0.8427, "mcc": 0.6787, "accuracy": 0.8393, "tp": 45, "fp": 10, "tn": 49, "fn": 8}, {"fold": "fold_6", "regime": "EUR crisis downturn", "sharpe": 16.0045, "sortino": 104.0188, "return_pct": 29.37, "equity": 1293.73, "max_dd": 0.15, "win_rate": 88.79, "profit_factor": 37.522, "ic": 0.9352, "hit": 87.96, "n": 108, "precision": 0.8431, "recall": 0.9149, "f1": 0.8776, "f2": 0.8996, "mcc": 0.7783, "accuracy": 0.8889, "tp": 43, "fp": 8, "tn": 53, "fn": 4}, {"fold": "fold_7", "regime": "Recent mixed/upturn", "sharpe": 16.8317, "sortino": 68.069, "return_pct": 31.85, "equity": 1318.52, "max_dd": 0.23, "win_rate": 87.27, "profit_factor": 26.752, "ic": 0.8936, "hit": 87.27, "n": 110, "precision": 0.8421, "recall": 0.9057, "f1": 0.8727, "f2": 0.8922, "mcc": 0.7478, "accuracy": 0.8727, "tp": 48, "fp": 9, "tn": 48, "fn": 5}], "train_sharpe": 8.7442, "train_psr": 1.0, "train_equity": 11229213.0, "train_sortino": 27.6931, "train_return_pct": 1122821.3, "train_max_dd": 3.89, "train_win_rate": 82.41, "train_profit_factor": 11.242, "train_ic": 0.8324, "train_hit": 82.08, "train_precision": 0.8148, "train_recall": 0.8493, "train_f1": 0.8317, "train_f2": 0.8422, "train_mcc": 0.6464, "train_accuracy": 0.8232, "train_per_window": [{"fold": "all_train", "regime": "Training data", "sharpe": 8.7442, "sortino": 27.6931, "return_pct": 1122821.3, "equity": 11229213.0, "max_dd": 3.89, "win_rate": 82.41, "profit_factor": 11.242, "ic": 0.8324, "hit": 82.08, "n": 2478, "precision": 0.8148, "recall": 0.8493, "f1": 0.8317, "f2": 0.8422, "mcc": 0.6464, "accuracy": 0.8232, "tp": 1082, "fp": 246, "tn": 958, "fn": 192}], "experiment_num": 234, "status": "DISCARD"}
