{"backbone": "mlp", "description": "mlp: Exp3 128h/64head ep=50 pat=10 seed=42", "config": {"seq_len": 10, "lr": 0.0003, "batch_size": 32, "epochs": 50, "weight_decay": 1e-05, "patience": 10, "grad_clip": 1.0, "warmup_epochs": 0, "huber_delta": 1.0, "head_dropout": 0.1, "seed": 42, "het_loss": false}, "composite": 0.1382, "test_pos_folds": 5, "val_pos_folds": 5, "val_loss": 4e-05, "elapsed_sec": 12.9, "timestamp": "2026-04-12T17:29:43", "sharpe": 0.8201, "psr": 0.9552, "equity": 1377.63, "sortino": 1.3907, "return_pct": 37.76, "max_dd": 13.35, "win_rate": 52.73, "profit_factor": 1.164, "ic": 0.0509, "hit": 52.52, "aleatoric_mean": 7.8e-05, "epistemic_mean": 0.000157, "confidence_mean": 0.9998, "per_window": [{"fold": "fold_1", "regime": "Pre-crisis upturn + GFC onset", "sharpe": 2.3471, "sortino": 6.6101, "return_pct": 18.77, "equity": 1187.74, "max_dd": 5.21, "win_rate": 50.98, "profit_factor": 1.755, "ic": 0.0521, "hit": 50.49, "n": 103, "aleatoric_mean": 0.000103, "epistemic_mean": 0.000207, "confidence_mean": 0.9997, "aleatoric_std": 5.4e-05, "epistemic_std": 0.000109}, {"fold": "fold_2", "regime": "Post-crash recovery", "sharpe": -0.3245, "sortino": -0.5858, "return_pct": -1.81, "equity": 981.88, "max_dd": 5.73, "win_rate": 43.93, "profit_factor": 0.95, "ic": -0.0144, "hit": 43.93, "n": 107, "aleatoric_mean": 8.8e-05, "epistemic_mean": 0.000176, "confidence_mean": 0.9997, "aleatoric_std": 4e-05, "epistemic_std": 8e-05}, {"fold": "fold_3", "regime": "Eurozone debt plateau", "sharpe": -0.2777, "sortino": -0.5231, "return_pct": -1.13, "equity": 988.71, "max_dd": 5.21, "win_rate": 52.88, "profit_factor": 0.957, "ic": -0.0057, "hit": 51.89, "n": 106, "aleatoric_mean": 8.3e-05, "epistemic_mean": 0.000166, "confidence_mean": 0.9998, "aleatoric_std": 3.6e-05, "epistemic_std": 7.1e-05}, {"fold": "fold_4", "regime": "Strong USD downturn", "sharpe": 0.7772, "sortino": 1.109, "return_pct": 5.75, "equity": 1057.46, "max_dd": 6.88, "win_rate": 55.69, "profit_factor": 1.139, "ic": 0.1447, "hit": 55.36, "n": 168, "aleatoric_mean": 9.1e-05, "epistemic_mean": 0.000183, "confidence_mean": 0.9997, "aleatoric_std": 3.7e-05, "epistemic_std": 7.4e-05}, {"fold": "fold_5", "regime": "Low-vol plateau", "sharpe": 3.0418, "sortino": 4.4045, "return_pct": 10.38, "equity": 1103.75, "max_dd": 2.11, "win_rate": 59.26, "profit_factor": 1.661, "ic": 0.208, "hit": 59.26, "n": 162, "aleatoric_mean": 4.7e-05, "epistemic_mean": 9.3e-05, "confidence_mean": 0.9999, "aleatoric_std": 2.1e-05, "epistemic_std": 4.2e-05}, {"fold": "fold_6", "regime": "EUR crisis downturn", "sharpe": 0.0942, "sortino": 0.1472, "return_pct": 0.29, "equity": 1002.9, "max_dd": 8.83, "win_rate": 53.33, "profit_factor": 1.015, "ic": 0.0812, "hit": 53.33, "n": 165, "aleatoric_mean": 9.8e-05, "epistemic_mean": 0.000197, "confidence_mean": 0.9997, "aleatoric_std": 5.3e-05, "epistemic_std": 0.000107}, {"fold": "fold_7", "regime": "Recent mixed/upturn", "sharpe": 0.3899, "sortino": 0.5845, "return_pct": 2.07, "equity": 1020.68, "max_dd": 10.37, "win_rate": 49.38, "profit_factor": 1.068, "ic": 0.0428, "hit": 49.38, "n": 162, "aleatoric_mean": 5.1e-05, "epistemic_mean": 0.000102, "confidence_mean": 0.9998, "aleatoric_std": 2.5e-05, "epistemic_std": 4.9e-05}], "val_sharpe": 0.5382, "val_psr": 0.8261, "val_equity": 1125.79, "val_sortino": 0.8107, "val_return_pct": 12.58, "val_max_dd": 10.61, "val_win_rate": 50.33, "val_profit_factor": 1.095, "val_ic": 0.0795, "val_hit": 50.0, "val_aleatoric_mean": 5.8e-05, "val_epistemic_mean": 0.000117, "val_confidence_mean": 0.9998, "val_per_window": [{"fold": "fold_1", "regime": "Pre-crisis upturn + GFC onset", "sharpe": 1.6371, "sortino": 2.9017, "return_pct": 4.12, "equity": 1041.21, "max_dd": 3.17, "win_rate": 49.07, "profit_factor": 1.312, "ic": 0.0682, "hit": 48.62, "n": 109, "aleatoric_mean": 6.3e-05, "epistemic_mean": 0.000126, "confidence_mean": 0.9998, "aleatoric_std": 4.8e-05, "epistemic_std": 9.7e-05}, {"fold": "fold_2", "regime": "Post-crash recovery", "sharpe": -0.009, "sortino": -0.016, "return_pct": -0.32, "equity": 996.82, "max_dd": 6.84, "win_rate": 44.44, "profit_factor": 0.999, "ic": -0.0545, "hit": 44.44, "n": 108, "aleatoric_mean": 6.9e-05, "epistemic_mean": 0.000137, "confidence_mean": 0.9998, "aleatoric_std": 3.5e-05, "epistemic_std": 7e-05}, {"fold": "fold_3", "regime": "Eurozone debt plateau", "sharpe": 1.3536, "sortino": 2.1021, "return_pct": 5.41, "equity": 1054.12, "max_dd": 6.6, "win_rate": 55.96, "profit_factor": 1.246, "ic": 0.1731, "hit": 54.95, "n": 111, "aleatoric_mean": 8.1e-05, "epistemic_mean": 0.000161, "confidence_mean": 0.9998, "aleatoric_std": 3.8e-05, "epistemic_std": 7.6e-05}, {"fold": "fold_4", "regime": "Strong USD downturn", "sharpe": -2.1957, "sortino": -2.8941, "return_pct": -7.41, "equity": 925.9, "max_dd": 7.73, "win_rate": 49.54, "profit_factor": 0.695, "ic": 0.1999, "hit": 49.09, "n": 110, "aleatoric_mean": 5.6e-05, "epistemic_mean": 0.000113, "confidence_mean": 0.9998, "aleatoric_std": 2.1e-05, "epistemic_std": 4.2e-05}, {"fold": "fold_5", "regime": "Low-vol plateau", "sharpe": 0.7893, "sortino": 1.4836, "return_pct": 2.54, "equity": 1025.38, "max_dd": 3.26, "win_rate": 49.11, "profit_factor": 1.14, "ic": 0.0119, "hit": 49.11, "n": 112, "aleatoric_mean": 5.2e-05, "epistemic_mean": 0.000104, "confidence_mean": 0.9998, "aleatoric_std": 2.1e-05, "epistemic_std": 4.2e-05}, {"fold": "fold_6", "regime": "EUR crisis downturn", "sharpe": 1.4332, "sortino": 2.1764, "return_pct": 3.26, "equity": 1032.6, "max_dd": 2.32, "win_rate": 50.47, "profit_factor": 1.273, "ic": -0.046, "hit": 50.0, "n": 108, "aleatoric_mean": 4.2e-05, "epistemic_mean": 8.4e-05, "confidence_mean": 0.9999, "aleatoric_std": 1.6e-05, "epistemic_std": 3.3e-05}, {"fold": "fold_7", "regime": "Recent mixed/upturn", "sharpe": 2.0625, "sortino": 3.096, "return_pct": 4.96, "equity": 1049.62, "max_dd": 2.75, "win_rate": 53.64, "profit_factor": 1.393, "ic": 0.1758, "hit": 53.64, "n": 110, "aleatoric_mean": 4.6e-05, "epistemic_mean": 9.2e-05, "confidence_mean": 0.9999, "aleatoric_std": 1.7e-05, "epistemic_std": 3.4e-05}], "train_sharpe": 3.4345, "train_psr": 1.0, "train_equity": 57177.55, "train_sortino": 8.3668, "train_return_pct": 5617.76, "train_max_dd": 7.62, "train_win_rate": 59.16, "train_profit_factor": 2.158, "train_ic": 0.3843, "train_hit": 58.92, "train_per_window": [{"fold": "all_train", "regime": "Training data", "sharpe": 3.4345, "sortino": 8.3668, "return_pct": 5617.76, "equity": 57177.55, "max_dd": 7.62, "win_rate": 59.16, "profit_factor": 2.158, "ic": 0.3843, "hit": 58.92, "n": 2478}], "experiment_num": 59, "status": "DISCARD"}
{"backbone": "mlp", "description": "mlp: Exp4 wd=1e-3 strong L2 reg (Gu2020)", "config": {"seq_len": 10, "lr": 0.0003, "batch_size": 32, "epochs": 50, "weight_decay": 0.001, "patience": 10, "grad_clip": 1.0, "warmup_epochs": 0, "huber_delta": 1.0, "head_dropout": 0.1, "seed": 42, "het_loss": false}, "composite": 0.1382, "test_pos_folds": 5, "val_pos_folds": 5, "val_loss": 4e-05, "elapsed_sec": 13.5, "timestamp": "2026-04-12T17:30:53", "sharpe": 0.8201, "psr": 0.9552, "equity": 1377.63, "sortino": 1.3907, "return_pct": 37.76, "max_dd": 13.35, "win_rate": 52.73, "profit_factor": 1.164, "ic": 0.051, "hit": 52.52, "aleatoric_mean": 7.8e-05, "epistemic_mean": 0.000156, "confidence_mean": 0.9998, "per_window": [{"fold": "fold_1", "regime": "Pre-crisis upturn + GFC onset", "sharpe": 2.3471, "sortino": 6.6101, "return_pct": 18.77, "equity": 1187.74, "max_dd": 5.21, "win_rate": 50.98, "profit_factor": 1.755, "ic": 0.0512, "hit": 50.49, "n": 103, "aleatoric_mean": 0.000103, "epistemic_mean": 0.000206, "confidence_mean": 0.9997, "aleatoric_std": 5.4e-05, "epistemic_std": 0.000108}, {"fold": "fold_2", "regime": "Post-crash recovery", "sharpe": -0.3245, "sortino": -0.5858, "return_pct": -1.81, "equity": 981.88, "max_dd": 5.73, "win_rate": 43.93, "profit_factor": 0.95, "ic": -0.0141, "hit": 43.93, "n": 107, "aleatoric_mean": 8.8e-05, "epistemic_mean": 0.000176, "confidence_mean": 0.9997, "aleatoric_std": 4e-05, "epistemic_std": 8e-05}, {"fold": "fold_3", "regime": "Eurozone debt plateau", "sharpe": -0.2777, "sortino": -0.5231, "return_pct": -1.13, "equity": 988.71, "max_dd": 5.21, "win_rate": 52.88, "profit_factor": 0.957, "ic": -0.0055, "hit": 51.89, "n": 106, "aleatoric_mean": 8.3e-05, "epistemic_mean": 0.000166, "confidence_mean": 0.9998, "aleatoric_std": 3.6e-05, "epistemic_std": 7.1e-05}, {"fold": "fold_4", "regime": "Strong USD downturn", "sharpe": 0.7772, "sortino": 1.109, "return_pct": 5.75, "equity": 1057.46, "max_dd": 6.88, "win_rate": 55.69, "profit_factor": 1.139, "ic": 0.1461, "hit": 55.36, "n": 168, "aleatoric_mean": 9.1e-05, "epistemic_mean": 0.000183, "confidence_mean": 0.9997, "aleatoric_std": 3.7e-05, "epistemic_std": 7.4e-05}, {"fold": "fold_5", "regime": "Low-vol plateau", "sharpe": 3.0418, "sortino": 4.4045, "return_pct": 10.38, "equity": 1103.75, "max_dd": 2.11, "win_rate": 59.26, "profit_factor": 1.661, "ic": 0.2076, "hit": 59.26, "n": 162, "aleatoric_mean": 4.7e-05, "epistemic_mean": 9.3e-05, "confidence_mean": 0.9999, "aleatoric_std": 2.1e-05, "epistemic_std": 4.2e-05}, {"fold": "fold_6", "regime": "EUR crisis downturn", "sharpe": 0.0942, "sortino": 0.1472, "return_pct": 0.29, "equity": 1002.9, "max_dd": 8.83, "win_rate": 53.33, "profit_factor": 1.015, "ic": 0.0813, "hit": 53.33, "n": 165, "aleatoric_mean": 9.8e-05, "epistemic_mean": 0.000196, "confidence_mean": 0.9997, "aleatoric_std": 5.3e-05, "epistemic_std": 0.000107}, {"fold": "fold_7", "regime": "Recent mixed/upturn", "sharpe": 0.3899, "sortino": 0.5845, "return_pct": 2.07, "equity": 1020.68, "max_dd": 10.37, "win_rate": 49.38, "profit_factor": 1.068, "ic": 0.0428, "hit": 49.38, "n": 162, "aleatoric_mean": 5.1e-05, "epistemic_mean": 0.000101, "confidence_mean": 0.9998, "aleatoric_std": 2.5e-05, "epistemic_std": 4.9e-05}], "val_sharpe": 0.5382, "val_psr": 0.8261, "val_equity": 1125.79, "val_sortino": 0.8107, "val_return_pct": 12.58, "val_max_dd": 10.61, "val_win_rate": 50.33, "val_profit_factor": 1.095, "val_ic": 0.0796, "val_hit": 50.0, "val_aleatoric_mean": 5.8e-05, "val_epistemic_mean": 0.000116, "val_confidence_mean": 0.9998, "val_per_window": [{"fold": "fold_1", "regime": "Pre-crisis upturn + GFC onset", "sharpe": 1.6371, "sortino": 2.9017, "return_pct": 4.12, "equity": 1041.21, "max_dd": 3.17, "win_rate": 49.07, "profit_factor": 1.312, "ic": 0.0678, "hit": 48.62, "n": 109, "aleatoric_mean": 6.3e-05, "epistemic_mean": 0.000126, "confidence_mean": 0.9998, "aleatoric_std": 4.8e-05, "epistemic_std": 9.7e-05}, {"fold": "fold_2", "regime": "Post-crash recovery", "sharpe": -0.009, "sortino": -0.016, "return_pct": -0.32, "equity": 996.82, "max_dd": 6.84, "win_rate": 44.44, "profit_factor": 0.999, "ic": -0.0535, "hit": 44.44, "n": 108, "aleatoric_mean": 6.8e-05, "epistemic_mean": 0.000137, "confidence_mean": 0.9998, "aleatoric_std": 3.5e-05, "epistemic_std": 7e-05}, {"fold": "fold_3", "regime": "Eurozone debt plateau", "sharpe": 1.3536, "sortino": 2.1021, "return_pct": 5.41, "equity": 1054.12, "max_dd": 6.6, "win_rate": 55.96, "profit_factor": 1.246, "ic": 0.1734, "hit": 54.95, "n": 111, "aleatoric_mean": 8.1e-05, "epistemic_mean": 0.000161, "confidence_mean": 0.9998, "aleatoric_std": 3.8e-05, "epistemic_std": 7.6e-05}, {"fold": "fold_4", "regime": "Strong USD downturn", "sharpe": -2.1957, "sortino": -2.8941, "return_pct": -7.41, "equity": 925.9, "max_dd": 7.73, "win_rate": 49.54, "profit_factor": 0.695, "ic": 0.2023, "hit": 49.09, "n": 110, "aleatoric_mean": 5.6e-05, "epistemic_mean": 0.000113, "confidence_mean": 0.9998, "aleatoric_std": 2.1e-05, "epistemic_std": 4.2e-05}, {"fold": "fold_5", "regime": "Low-vol plateau", "sharpe": 0.7893, "sortino": 1.4836, "return_pct": 2.54, "equity": 1025.38, "max_dd": 3.26, "win_rate": 49.11, "profit_factor": 1.14, "ic": 0.0106, "hit": 49.11, "n": 112, "aleatoric_mean": 5.2e-05, "epistemic_mean": 0.000103, "confidence_mean": 0.9998, "aleatoric_std": 2.1e-05, "epistemic_std": 4.2e-05}, {"fold": "fold_6", "regime": "EUR crisis downturn", "sharpe": 1.4332, "sortino": 2.1764, "return_pct": 3.26, "equity": 1032.6, "max_dd": 2.32, "win_rate": 50.47, "profit_factor": 1.273, "ic": -0.0457, "hit": 50.0, "n": 108, "aleatoric_mean": 4.2e-05, "epistemic_mean": 8.3e-05, "confidence_mean": 0.9999, "aleatoric_std": 1.6e-05, "epistemic_std": 3.3e-05}, {"fold": "fold_7", "regime": "Recent mixed/upturn", "sharpe": 2.0625, "sortino": 3.096, "return_pct": 4.96, "equity": 1049.62, "max_dd": 2.75, "win_rate": 53.64, "profit_factor": 1.393, "ic": 0.1764, "hit": 53.64, "n": 110, "aleatoric_mean": 4.6e-05, "epistemic_mean": 9.2e-05, "confidence_mean": 0.9999, "aleatoric_std": 1.7e-05, "epistemic_std": 3.4e-05}], "train_sharpe": 3.4345, "train_psr": 1.0, "train_equity": 57177.55, "train_sortino": 8.3668, "train_return_pct": 5617.76, "train_max_dd": 7.62, "train_win_rate": 59.16, "train_profit_factor": 2.158, "train_ic": 0.3846, "train_hit": 58.92, "train_per_window": [{"fold": "all_train", "regime": "Training data", "sharpe": 3.4345, "sortino": 8.3668, "return_pct": 5617.76, "equity": 57177.55, "max_dd": 7.62, "win_rate": 59.16, "profit_factor": 2.158, "ic": 0.3846, "hit": 58.92, "n": 2478}], "experiment_num": 60, "status": "DISCARD"}
{"backbone": "mlp", "description": "mlp: Exp5 champion config seed=0 (variance check)", "config": {"seq_len": 10, "lr": 0.0003, "batch_size": 32, "epochs": 50, "weight_decay": 1e-05, "patience": 10, "grad_clip": 1.0, "warmup_epochs": 0, "huber_delta": 1.0, "head_dropout": 0.1, "seed": 0, "het_loss": false}, "composite": 0.7757, "test_pos_folds": 5, "val_pos_folds": 5, "val_loss": 3.8e-05, "elapsed_sec": 12.8, "timestamp": "2026-04-12T17:32:14", "sharpe": 1.4838, "psr": 0.9993, "equity": 1814.78, "sortino": 2.5394, "return_pct": 81.48, "max_dd": 21.2, "win_rate": 53.77, "profit_factor": 1.316, "ic": 0.1189, "hit": 53.55, "aleatoric_mean": 6.1e-05, "epistemic_mean": 0.000122, "confidence_mean": 0.9998, "per_window": [{"fold": "fold_1", "regime": "Pre-crisis upturn + GFC onset", "sharpe": 0.4274, "sortino": 1.2189, "return_pct": 2.63, "equity": 1026.25, "max_dd": 13.37, "win_rate": 43.14, "profit_factor": 1.106, "ic": -0.0498, "hit": 42.72, "n": 103, "aleatoric_mean": 8.2e-05, "epistemic_mean": 0.000164, "confidence_mean": 0.9998, "aleatoric_std": 4.2e-05, "epistemic_std": 8.5e-05}, {"fold": "fold_2", "regime": "Post-crash recovery", "sharpe": -0.5167, "sortino": -0.8651, "return_pct": -2.71, "equity": 972.87, "max_dd": 8.21, "win_rate": 51.4, "profit_factor": 0.922, "ic": 0.1078, "hit": 51.4, "n": 107, "aleatoric_mean": 6.8e-05, "epistemic_mean": 0.000136, "confidence_mean": 0.9998, "aleatoric_std": 3e-05, "epistemic_std": 6.1e-05}, {"fold": "fold_3", "regime": "Eurozone debt plateau", "sharpe": 2.91, "sortino": 4.7295, "return_pct": 10.53, "equity": 1105.3, "max_dd": 3.41, "win_rate": 57.69, "profit_factor": 1.579, "ic": 0.2164, "hit": 56.6, "n": 106, "aleatoric_mean": 6.6e-05, "epistemic_mean": 0.000131, "confidence_mean": 0.9998, "aleatoric_std": 3.8e-05, "epistemic_std": 7.7e-05}, {"fold": "fold_4", "regime": "Strong USD downturn", "sharpe": 1.6292, "sortino": 2.3509, "return_pct": 12.93, "equity": 1129.27, "max_dd": 5.04, "win_rate": 55.09, "profit_factor": 1.315, "ic": 0.1608, "hit": 54.76, "n": 168, "aleatoric_mean": 6.8e-05, "epistemic_mean": 0.000136, "confidence_mean": 0.9998, "aleatoric_std": 3.4e-05, "epistemic_std": 6.8e-05}, {"fold": "fold_5", "regime": "Low-vol plateau", "sharpe": -0.3319, "sortino": -0.5181, "return_pct": -1.19, "equity": 988.15, "max_dd": 5.34, "win_rate": 49.38, "profit_factor": 0.946, "ic": 0.0116, "hit": 49.38, "n": 162, "aleatoric_mean": 4.2e-05, "epistemic_mean": 8.4e-05, "confidence_mean": 0.9999, "aleatoric_std": 1.8e-05, "epistemic_std": 3.5e-05}, {"fold": "fold_6", "regime": "EUR crisis downturn", "sharpe": 2.4084, "sortino": 3.6061, "return_pct": 15.83, "equity": 1158.3, "max_dd": 6.06, "win_rate": 55.15, "profit_factor": 1.476, "ic": 0.1864, "hit": 55.15, "n": 165, "aleatoric_mean": 6.9e-05, "epistemic_mean": 0.000138, "confidence_mean": 0.9998, "aleatoric_std": 3.9e-05, "epistemic_std": 7.9e-05}, {"fold": "fold_7", "regime": "Recent mixed/upturn", "sharpe": 4.2279, "sortino": 7.8027, "return_pct": 27.23, "equity": 1272.33, "max_dd": 2.3, "win_rate": 61.11, "profit_factor": 2.054, "ic": 0.1929, "hit": 61.11, "n": 162, "aleatoric_mean": 4.4e-05, "epistemic_mean": 8.8e-05, "confidence_mean": 0.9999, "aleatoric_std": 1.5e-05, "epistemic_std": 2.9e-05}], "val_sharpe": 1.1757, "val_psr": 0.9797, "val_equity": 1308.95, "val_sortino": 1.8085, "val_return_pct": 30.89, "val_max_dd": 11.2, "val_win_rate": 50.98, "val_profit_factor": 1.22, "val_ic": 0.0573, "val_hit": 50.65, "val_aleatoric_mean": 4.7e-05, "val_epistemic_mean": 9.5e-05, "val_confidence_mean": 0.9999, "val_per_window": [{"fold": "fold_1", "regime": "Pre-crisis upturn + GFC onset", "sharpe": 3.7253, "sortino": 8.2576, "return_pct": 9.51, "equity": 1095.1, "max_dd": 1.56, "win_rate": 52.78, "profit_factor": 1.86, "ic": 0.192, "hit": 52.29, "n": 109, "aleatoric_mean": 5e-05, "epistemic_mean": 0.000101, "confidence_mean": 0.9998, "aleatoric_std": 3.4e-05, "epistemic_std": 6.8e-05}, {"fold": "fold_2", "regime": "Post-crash recovery", "sharpe": 0.2676, "sortino": 0.4619, "return_pct": 1.03, "equity": 1010.29, "max_dd": 5.01, "win_rate": 46.3, "profit_factor": 1.043, "ic": -0.0618, "hit": 46.3, "n": 108, "aleatoric_mean": 6.1e-05, "epistemic_mean": 0.000121, "confidence_mean": 0.9998, "aleatoric_std": 2.3e-05, "epistemic_std": 4.5e-05}, {"fold": "fold_3", "regime": "Eurozone debt plateau", "sharpe": -0.4208, "sortino": -0.6328, "return_pct": -1.87, "equity": 981.3, "max_dd": 8.57, "win_rate": 47.71, "profit_factor": 0.934, "ic": 0.0565, "hit": 46.85, "n": 111, "aleatoric_mean": 5.6e-05, "epistemic_mean": 0.000113, "confidence_mean": 0.9998, "aleatoric_std": 1.9e-05, "epistemic_std": 3.7e-05}, {"fold": "fold_4", "regime": "Strong USD downturn", "sharpe": 0.236, "sortino": 0.3204, "return_pct": 0.68, "equity": 1006.84, "max_dd": 5.62, "win_rate": 53.21, "profit_factor": 1.04, "ic": -0.0498, "hit": 52.73, "n": 110, "aleatoric_mean": 4e-05, "epistemic_mean": 8.1e-05, "confidence_mean": 0.9999, "aleatoric_std": 1.5e-05, "epistemic_std": 3.1e-05}, {"fold": "fold_5", "regime": "Low-vol plateau", "sharpe": 4.3273, "sortino": 8.421, "return_pct": 14.81, "equity": 1148.11, "max_dd": 1.8, "win_rate": 58.93, "profit_factor": 2.062, "ic": 0.2482, "hit": 58.93, "n": 112, "aleatoric_mean": 4.3e-05, "epistemic_mean": 8.6e-05, "confidence_mean": 0.9999, "aleatoric_std": 2e-05, "epistemic_std": 3.9e-05}, {"fold": "fold_6", "regime": "EUR crisis downturn", "sharpe": 2.4053, "sortino": 4.1666, "return_pct": 5.53, "equity": 1055.33, "max_dd": 1.23, "win_rate": 55.14, "profit_factor": 1.5, "ic": 0.0837, "hit": 54.63, "n": 108, "aleatoric_mean": 4e-05, "epistemic_mean": 7.9e-05, "confidence_mean": 0.9999, "aleatoric_std": 1.4e-05, "epistemic_std": 2.7e-05}, {"fold": "fold_7", "regime": "Recent mixed/upturn", "sharpe": -0.4636, "sortino": -0.9071, "return_pct": -1.17, "equity": 988.29, "max_dd": 4.13, "win_rate": 42.73, "profit_factor": 0.928, "ic": -0.0284, "hit": 42.73, "n": 110, "aleatoric_mean": 4.2e-05, "epistemic_mean": 8.3e-05, "confidence_mean": 0.9999, "aleatoric_std": 1.6e-05, "epistemic_std": 3.1e-05}], "train_sharpe": 3.4173, "train_psr": 1.0, "train_equity": 56057.26, "train_sortino": 8.0161, "train_return_pct": 5505.73, "train_max_dd": 8.86, "train_win_rate": 60.01, "train_profit_factor": 2.149, "train_ic": 0.3262, "train_hit": 59.77, "train_per_window": [{"fold": "all_train", "regime": "Training data", "sharpe": 3.4173, "sortino": 8.0161, "return_pct": 5505.73, "equity": 56057.26, "max_dd": 8.86, "win_rate": 60.01, "profit_factor": 2.149, "ic": 0.3262, "hit": 59.77, "n": 2478}], "experiment_num": 61, "status": "KEEP"}
