{"backbone": "mlp", "description": "mlp: Exp24 champion config seed=7 variance", "config": {"seq_len": 10, "lr": 0.0005, "batch_size": 32, "epochs": 50, "weight_decay": 1e-05, "patience": 10, "grad_clip": 1.0, "warmup_epochs": 0, "huber_delta": 1.0, "head_dropout": 0.15, "seed": 7, "het_loss": false}, "composite": 4.2386, "test_pos_folds": 6, "val_pos_folds": 6, "val_loss": 3.9e-05, "elapsed_sec": 25.5, "timestamp": "2026-04-14T16:17:41", "sharpe": 4.4386, "psr": 1.0, "equity": 5851.29, "sortino": 5.3697, "return_pct": 485.13, "max_dd": 9.08, "win_rate": 66.36, "profit_factor": 2.305, "ic": 0.3882, "hit": 66.08, "aleatoric_mean": 4.1e-05, "epistemic_mean": 8.1e-05, "confidence_mean": 0.9999, "per_window": [{"fold": "fold_1", "regime": "Pre-crisis upturn + GFC onset", "sharpe": -0.0363, "sortino": -0.0392, "return_pct": -1.01, "equity": 989.92, "max_dd": 8.04, "win_rate": 54.9, "profit_factor": 0.991, "ic": -0.0199, "hit": 54.37, "n": 103, "aleatoric_mean": 7.4e-05, "epistemic_mean": 0.000147, "confidence_mean": 0.9998, "aleatoric_std": 7.7e-05, "epistemic_std": 0.000155}, {"fold": "fold_2", "regime": "Post-crash recovery", "sharpe": 0.7088, "sortino": 1.1451, "return_pct": 3.18, "equity": 1031.77, "max_dd": 5.45, "win_rate": 54.21, "profit_factor": 1.117, "ic": 0.019, "hit": 54.21, "n": 107, "aleatoric_mean": 3.1e-05, "epistemic_mean": 6.2e-05, "confidence_mean": 0.9999, "aleatoric_std": 2.2e-05, "epistemic_std": 4.5e-05}, {"fold": "fold_3", "regime": "Eurozone debt plateau", "sharpe": 6.5894, "sortino": 10.7861, "return_pct": 23.93, "equity": 1239.3, "max_dd": 1.94, "win_rate": 72.12, "profit_factor": 2.829, "ic": 0.4243, "hit": 70.75, "n": 106, "aleatoric_mean": 4.9e-05, "epistemic_mean": 9.9e-05, "confidence_mean": 0.9999, "aleatoric_std": 3.5e-05, "epistemic_std": 7e-05}, {"fold": "fold_4", "regime": "Strong USD downturn", "sharpe": 8.2495, "sortino": 14.3768, "return_pct": 75.96, "equity": 1759.61, "max_dd": 3.03, "win_rate": 73.05, "profit_factor": 4.191, "ic": 0.5492, "hit": 72.62, "n": 168, "aleatoric_mean": 5.3e-05, "epistemic_mean": 0.000106, "confidence_mean": 0.9998, "aleatoric_std": 3.7e-05, "epistemic_std": 7.3e-05}, {"fold": "fold_5", "regime": "Low-vol plateau", "sharpe": 8.1885, "sortino": 21.0756, "return_pct": 27.34, "equity": 1273.43, "max_dd": 0.71, "win_rate": 69.14, "profit_factor": 4.066, "ic": 0.5561, "hit": 69.14, "n": 162, "aleatoric_mean": 2e-05, "epistemic_mean": 4e-05, "confidence_mean": 0.9999, "aleatoric_std": 1.1e-05, "epistemic_std": 2.3e-05}, {"fold": "fold_6", "regime": "EUR crisis downturn", "sharpe": 6.3352, "sortino": 11.1312, "return_pct": 44.42, "equity": 1444.23, "max_dd": 2.25, "win_rate": 66.67, "profit_factor": 2.812, "ic": 0.4913, "hit": 66.67, "n": 165, "aleatoric_mean": 4e-05, "epistemic_mean": 8e-05, "confidence_mean": 0.9999, "aleatoric_std": 3.2e-05, "epistemic_std": 6.4e-05}, {"fold": "fold_7", "regime": "Recent mixed/upturn", "sharpe": 6.5139, "sortino": 9.8105, "return_pct": 42.84, "equity": 1428.43, "max_dd": 2.98, "win_rate": 67.9, "profit_factor": 3.073, "ic": 0.5912, "hit": 67.9, "n": 162, "aleatoric_mean": 2.9e-05, "epistemic_mean": 5.8e-05, "confidence_mean": 0.9999, "aleatoric_std": 1.6e-05, "epistemic_std": 3.3e-05}], "val_sharpe": 5.4419, "val_psr": 1.0, "val_equity": 3364.94, "val_sortino": 8.4168, "val_return_pct": 236.49, "val_max_dd": 8.92, "val_win_rate": 64.88, "val_profit_factor": 2.539, "val_ic": 0.4137, "val_hit": 64.45, "val_aleatoric_mean": 2.4e-05, "val_epistemic_mean": 4.8e-05, "val_confidence_mean": 0.9999, "val_per_window": [{"fold": "fold_1", "regime": "Pre-crisis upturn + GFC onset", "sharpe": 1.5065, "sortino": 2.7057, "return_pct": 3.78, "equity": 1037.83, "max_dd": 1.85, "win_rate": 52.78, "profit_factor": 1.284, "ic": 0.0782, "hit": 52.29, "n": 109, "aleatoric_mean": 2.5e-05, "epistemic_mean": 5.1e-05, "confidence_mean": 0.9999, "aleatoric_std": 3e-05, "epistemic_std": 6.1e-05}, {"fold": "fold_2", "regime": "Post-crash recovery", "sharpe": -1.1638, "sortino": -1.8543, "return_pct": -5.74, "equity": 942.6, "max_dd": 8.92, "win_rate": 44.44, "profit_factor": 0.832, "ic": -0.1037, "hit": 44.44, "n": 108, "aleatoric_mean": 3.6e-05, "epistemic_mean": 7.2e-05, "confidence_mean": 0.9999, "aleatoric_std": 3.4e-05, "epistemic_std": 6.8e-05}, {"fold": "fold_3", "regime": "Eurozone debt plateau", "sharpe": 9.0663, "sortino": 21.6674, "return_pct": 37.25, "equity": 1372.49, "max_dd": 0.84, "win_rate": 70.64, "profit_factor": 4.534, "ic": 0.5635, "hit": 69.37, "n": 111, "aleatoric_mean": 3.8e-05, "epistemic_mean": 7.6e-05, "confidence_mean": 0.9999, "aleatoric_std": 3.1e-05, "epistemic_std": 6.2e-05}, {"fold": "fold_4", "regime": "Strong USD downturn", "sharpe": 9.7081, "sortino": 24.5461, "return_pct": 33.18, "equity": 1331.76, "max_dd": 0.89, "win_rate": 72.48, "profit_factor": 5.346, "ic": 0.6783, "hit": 71.82, "n": 110, "aleatoric_mean": 2e-05, "epistemic_mean": 4e-05, "confidence_mean": 0.9999, "aleatoric_std": 1.8e-05, "epistemic_std": 3.5e-05}, {"fold": "fold_5", "regime": "Low-vol plateau", "sharpe": 10.0447, "sortino": 26.0212, "return_pct": 32.59, "equity": 1325.92, "max_dd": 0.62, "win_rate": 73.21, "profit_factor": 5.782, "ic": 0.6628, "hit": 73.21, "n": 112, "aleatoric_mean": 1.8e-05, "epistemic_mean": 3.7e-05, "confidence_mean": 0.9999, "aleatoric_std": 1.3e-05, "epistemic_std": 2.7e-05}, {"fold": "fold_6", "regime": "EUR crisis downturn", "sharpe": 11.134, "sortino": 31.2006, "return_pct": 23.14, "equity": 1231.42, "max_dd": 0.49, "win_rate": 73.83, "profit_factor": 7.576, "ic": 0.7166, "hit": 73.15, "n": 108, "aleatoric_mean": 1.3e-05, "epistemic_mean": 2.7e-05, "confidence_mean": 1.0, "aleatoric_std": 5e-06, "epistemic_std": 1e-05}, {"fold": "fold_7", "regime": "Recent mixed/upturn", "sharpe": 6.4097, "sortino": 13.1211, "return_pct": 15.26, "equity": 1152.56, "max_dd": 1.05, "win_rate": 66.36, "profit_factor": 2.828, "ic": 0.4989, "hit": 66.36, "n": 110, "aleatoric_mean": 1.5e-05, "epistemic_mean": 3e-05, "confidence_mean": 1.0, "aleatoric_std": 1e-05, "epistemic_std": 1.9e-05}], "train_sharpe": 7.4246, "train_psr": 1.0, "train_equity": 3570091.75, "train_sortino": 21.5914, "train_return_pct": 356909.17, "train_max_dd": 4.48, "train_win_rate": 75.41, "train_profit_factor": 6.537, "train_ic": 0.6896, "train_hit": 75.1, "train_per_window": [{"fold": "all_train", "regime": "Training data", "sharpe": 7.4246, "sortino": 21.5914, "return_pct": 356909.17, "equity": 3570091.75, "max_dd": 4.48, "win_rate": 75.41, "profit_factor": 6.537, "ic": 0.6896, "hit": 75.1, "n": 2478}], "experiment_num": 80, "status": "DISCARD"}
{"backbone": "mlp", "description": "mlp: Exp25 3-layer residual (Telgarsky2016) seed=0", "config": {"seq_len": 10, "lr": 0.0005, "batch_size": 32, "epochs": 50, "weight_decay": 1e-05, "patience": 10, "grad_clip": 1.0, "warmup_epochs": 0, "huber_delta": 1.0, "head_dropout": 0.15, "seed": 0, "het_loss": false}, "composite": 3.8364, "test_pos_folds": 7, "val_pos_folds": 6, "val_loss": 3.7e-05, "elapsed_sec": 22.6, "timestamp": "2026-04-14T16:18:57", "sharpe": 3.9738, "psr": 1.0, "equity": 4909.62, "sortino": 6.8927, "return_pct": 390.96, "max_dd": 6.54, "win_rate": 61.92, "profit_factor": 2.106, "ic": 0.3533, "hit": 61.66, "aleatoric_mean": 5.3e-05, "epistemic_mean": 0.000105, "confidence_mean": 0.9998, "per_window": [{"fold": "fold_1", "regime": "Pre-crisis upturn + GFC onset", "sharpe": 2.3139, "sortino": 6.7258, "return_pct": 18.48, "equity": 1184.8, "max_dd": 3.86, "win_rate": 54.9, "profit_factor": 1.741, "ic": 0.0947, "hit": 54.37, "n": 103, "aleatoric_mean": 8.5e-05, "epistemic_mean": 0.00017, "confidence_mean": 0.9997, "aleatoric_std": 8.1e-05, "epistemic_std": 0.000161}, {"fold": "fold_2", "regime": "Post-crash recovery", "sharpe": 1.0451, "sortino": 1.6938, "return_pct": 4.85, "equity": 1048.49, "max_dd": 5.28, "win_rate": 55.14, "profit_factor": 1.178, "ic": 0.1215, "hit": 55.14, "n": 107, "aleatoric_mean": 4.1e-05, "epistemic_mean": 8.3e-05, "confidence_mean": 0.9999, "aleatoric_std": 2.6e-05, "epistemic_std": 5.2e-05}, {"fold": "fold_3", "regime": "Eurozone debt plateau", "sharpe": 4.2298, "sortino": 6.565, "return_pct": 15.44, "equity": 1154.42, "max_dd": 2.2, "win_rate": 67.31, "profit_factor": 1.945, "ic": 0.4276, "hit": 66.04, "n": 106, "aleatoric_mean": 6.5e-05, "epistemic_mean": 0.00013, "confidence_mean": 0.9998, "aleatoric_std": 3.8e-05, "epistemic_std": 7.6e-05}, {"fold": "fold_4", "regime": "Strong USD downturn", "sharpe": 7.0069, "sortino": 14.1588, "return_pct": 63.93, "equity": 1639.35, "max_dd": 2.14, "win_rate": 65.87, "profit_factor": 3.332, "ic": 0.4884, "hit": 65.48, "n": 168, "aleatoric_mean": 7.7e-05, "epistemic_mean": 0.000153, "confidence_mean": 0.9998, "aleatoric_std": 4.8e-05, "epistemic_std": 9.6e-05}, {"fold": "fold_5", "regime": "Low-vol plateau", "sharpe": 5.7399, "sortino": 10.3374, "return_pct": 19.61, "equity": 1196.1, "max_dd": 1.88, "win_rate": 63.58, "profit_factor": 2.629, "ic": 0.4347, "hit": 63.58, "n": 162, "aleatoric_mean": 3.2e-05, "epistemic_mean": 6.3e-05, "confidence_mean": 0.9999, "aleatoric_std": 1.6e-05, "epistemic_std": 3.3e-05}, {"fold": "fold_6", "regime": "EUR crisis downturn", "sharpe": 6.1018, "sortino": 10.0165, "return_pct": 42.72, "equity": 1427.19, "max_dd": 3.04, "win_rate": 63.64, "profit_factor": 2.705, "ic": 0.4586, "hit": 63.64, "n": 165, "aleatoric_mean": 4.9e-05, "epistemic_mean": 9.8e-05, "confidence_mean": 0.9999, "aleatoric_std": 3.2e-05, "epistemic_std": 6.4e-05}, {"fold": "fold_7", "regime": "Recent mixed/upturn", "sharpe": 3.5103, "sortino": 4.4911, "return_pct": 22.34, "equity": 1223.37, "max_dd": 6.54, "win_rate": 59.88, "profit_factor": 1.815, "ic": 0.3904, "hit": 59.88, "n": 162, "aleatoric_mean": 3.1e-05, "epistemic_mean": 6.2e-05, "confidence_mean": 0.9999, "aleatoric_std": 1.8e-05, "epistemic_std": 3.5e-05}], "val_sharpe": 3.9364, "val_psr": 1.0, "val_equity": 2455.17, "val_sortino": 5.7692, "val_return_pct": 145.52, "val_max_dd": 14.96, "val_win_rate": 59.63, "val_profit_factor": 1.953, "val_ic": 0.3173, "val_hit": 59.24, "val_aleatoric_mean": 3.2e-05, "val_epistemic_mean": 6.3e-05, "val_confidence_mean": 0.9999, "val_per_window": [{"fold": "fold_1", "regime": "Pre-crisis upturn + GFC onset", "sharpe": 0.3135, "sortino": 0.4916, "return_pct": 0.72, "equity": 1007.2, "max_dd": 3.06, "win_rate": 45.37, "profit_factor": 1.053, "ic": -0.0551, "hit": 44.95, "n": 109, "aleatoric_mean": 2.7e-05, "epistemic_mean": 5.5e-05, "confidence_mean": 0.9999, "aleatoric_std": 3e-05, "epistemic_std": 6e-05}, {"fold": "fold_2", "regime": "Post-crash recovery", "sharpe": -1.4882, "sortino": -2.1785, "return_pct": -7.2, "equity": 928.02, "max_dd": 12.79, "win_rate": 46.3, "profit_factor": 0.791, "ic": -0.0867, "hit": 46.3, "n": 108, "aleatoric_mean": 5.3e-05, "epistemic_mean": 0.000106, "confidence_mean": 0.9998, "aleatoric_std": 4.4e-05, "epistemic_std": 8.8e-05}, {"fold": "fold_3", "regime": "Eurozone debt plateau", "sharpe": 8.5585, "sortino": 19.9293, "return_pct": 35.38, "equity": 1353.77, "max_dd": 1.44, "win_rate": 66.06, "profit_factor": 4.142, "ic": 0.5769, "hit": 64.86, "n": 111, "aleatoric_mean": 4.2e-05, "epistemic_mean": 8.4e-05, "confidence_mean": 0.9999, "aleatoric_std": 3.3e-05, "epistemic_std": 6.6e-05}, {"fold": "fold_4", "regime": "Strong USD downturn", "sharpe": 5.5511, "sortino": 7.1155, "return_pct": 19.81, "equity": 1198.12, "max_dd": 1.79, "win_rate": 72.48, "profit_factor": 2.529, "ic": 0.5102, "hit": 71.82, "n": 110, "aleatoric_mean": 2.8e-05, "epistemic_mean": 5.7e-05, "confidence_mean": 0.9999, "aleatoric_std": 2.4e-05, "epistemic_std": 4.7e-05}, {"fold": "fold_5", "regime": "Low-vol plateau", "sharpe": 7.3599, "sortino": 16.9554, "return_pct": 24.81, "equity": 1248.14, "max_dd": 1.24, "win_rate": 64.29, "profit_factor": 3.491, "ic": 0.5396, "hit": 64.29, "n": 112, "aleatoric_mean": 3.2e-05, "epistemic_mean": 6.3e-05, "confidence_mean": 0.9999, "aleatoric_std": 2e-05, "epistemic_std": 4e-05}, {"fold": "fold_6", "regime": "EUR crisis downturn", "sharpe": 8.4356, "sortino": 23.8864, "return_pct": 18.53, "equity": 1185.31, "max_dd": 0.73, "win_rate": 66.36, "profit_factor": 4.357, "ic": 0.5234, "hit": 65.74, "n": 108, "aleatoric_mean": 1.9e-05, "epistemic_mean": 3.8e-05, "confidence_mean": 0.9999, "aleatoric_std": 7e-06, "epistemic_std": 1.4e-05}, {"fold": "fold_7", "regime": "Recent mixed/upturn", "sharpe": 3.9082, "sortino": 8.6283, "return_pct": 9.46, "equity": 1094.63, "max_dd": 1.45, "win_rate": 56.36, "profit_factor": 1.877, "ic": 0.3523, "hit": 56.36, "n": 110, "aleatoric_mean": 2e-05, "epistemic_mean": 4.1e-05, "confidence_mean": 0.9999, "aleatoric_std": 1.4e-05, "epistemic_std": 2.8e-05}], "train_sharpe": 6.1634, "train_psr": 1.0, "train_equity": 1072546.5, "train_sortino": 16.7011, "train_return_pct": 107154.65, "train_max_dd": 4.66, "train_win_rate": 70.14, "train_profit_factor": 4.371, "train_ic": 0.6066, "train_hit": 69.85, "train_per_window": [{"fold": "all_train", "regime": "Training data", "sharpe": 6.1634, "sortino": 16.7011, "return_pct": 107154.65, "equity": 1072546.5, "max_dd": 4.66, "win_rate": 70.14, "profit_factor": 4.371, "ic": 0.6066, "hit": 69.85, "n": 2478}], "experiment_num": 81, "status": "DISCARD"}
{"backbone": "mlp", "description": "mlp: Exp26 residual hidden=64 smaller model seed=0", "config": {"seq_len": 10, "lr": 0.0005, "batch_size": 32, "epochs": 50, "weight_decay": 1e-05, "patience": 10, "grad_clip": 1.0, "warmup_epochs": 0, "huber_delta": 1.0, "head_dropout": 0.15, "seed": 0, "het_loss": false}, "composite": 5.4022, "test_pos_folds": 7, "val_pos_folds": 6, "val_loss": 3.8e-05, "elapsed_sec": 28.5, "timestamp": "2026-04-14T16:20:07", "sharpe": 6.1205, "psr": 1.0, "equity": 10677.08, "sortino": 11.1215, "return_pct": 967.71, "max_dd": 4.13, "win_rate": 69.14, "profit_factor": 3.233, "ic": 0.4846, "hit": 68.86, "aleatoric_mean": 2.6e-05, "epistemic_mean": 5.2e-05, "confidence_mean": 0.9999, "per_window": [{"fold": "fold_1", "regime": "Pre-crisis upturn + GFC onset", "sharpe": 2.4608, "sortino": 6.7778, "return_pct": 19.79, "equity": 1197.85, "max_dd": 3.29, "win_rate": 60.78, "profit_factor": 1.805, "ic": 0.1893, "hit": 60.19, "n": 103, "aleatoric_mean": 5.3e-05, "epistemic_mean": 0.000105, "confidence_mean": 0.9998, "aleatoric_std": 7e-05, "epistemic_std": 0.00014}, {"fold": "fold_2", "regime": "Post-crash recovery", "sharpe": 0.4393, "sortino": 0.7648, "return_pct": 1.85, "equity": 1018.54, "max_dd": 3.47, "win_rate": 51.4, "profit_factor": 1.071, "ic": 0.0821, "hit": 51.4, "n": 107, "aleatoric_mean": 2.1e-05, "epistemic_mean": 4.2e-05, "confidence_mean": 0.9999, "aleatoric_std": 1.5e-05, "epistemic_std": 3e-05}, {"fold": "fold_3", "regime": "Eurozone debt plateau", "sharpe": 9.7583, "sortino": 18.8138, "return_pct": 34.13, "equity": 1341.27, "max_dd": 1.32, "win_rate": 75.96, "profit_factor": 4.755, "ic": 0.5838, "hit": 74.53, "n": 106, "aleatoric_mean": 2.8e-05, "epistemic_mean": 5.5e-05, "confidence_mean": 0.9999, "aleatoric_std": 1.4e-05, "epistemic_std": 2.9e-05}, {"fold": "fold_4", "regime": "Strong USD downturn", "sharpe": 9.7799, "sortino": 19.4179, "return_pct": 90.3, "equity": 1902.97, "max_dd": 1.81, "win_rate": 75.45, "profit_factor": 5.651, "ic": 0.6653, "hit": 75.0, "n": 168, "aleatoric_mean": 3.6e-05, "epistemic_mean": 7.3e-05, "confidence_mean": 0.9999, "aleatoric_std": 2.9e-05, "epistemic_std": 5.8e-05}, {"fold": "fold_5", "regime": "Low-vol plateau", "sharpe": 8.8545, "sortino": 16.1387, "return_pct": 29.29, "equity": 1292.92, "max_dd": 1.43, "win_rate": 70.99, "profit_factor": 4.604, "ic": 0.6397, "hit": 70.99, "n": 162, "aleatoric_mean": 1.2e-05, "epistemic_mean": 2.5e-05, "confidence_mean": 1.0, "aleatoric_std": 7e-06, "epistemic_std": 1.3e-05}, {"fold": "fold_6", "regime": "EUR crisis downturn", "sharpe": 10.2166, "sortino": 21.4343, "return_pct": 71.27, "equity": 1712.74, "max_dd": 2.27, "win_rate": 71.52, "profit_factor": 5.538, "ic": 0.6433, "hit": 71.52, "n": 165, "aleatoric_mean": 2.5e-05, "epistemic_mean": 4.9e-05, "confidence_mean": 0.9999, "aleatoric_std": 1.7e-05, "epistemic_std": 3.3e-05}, {"fold": "fold_7", "regime": "Recent mixed/upturn", "sharpe": 8.3325, "sortino": 14.3213, "return_pct": 54.83, "equity": 1548.32, "max_dd": 1.64, "win_rate": 70.99, "profit_factor": 4.308, "ic": 0.6209, "hit": 70.99, "n": 162, "aleatoric_mean": 1.7e-05, "epistemic_mean": 3.4e-05, "confidence_mean": 0.9999, "aleatoric_std": 1e-05, "epistemic_std": 2e-05}], "val_sharpe": 5.5022, "val_psr": 1.0, "val_equity": 3405.94, "val_sortino": 8.2572, "val_return_pct": 240.59, "val_max_dd": 9.21, "val_win_rate": 66.06, "val_profit_factor": 2.566, "val_ic": 0.4576, "val_hit": 65.62, "val_aleatoric_mean": 1.5e-05, "val_epistemic_mean": 3e-05, "val_confidence_mean": 1.0, "val_per_window": [{"fold": "fold_1", "regime": "Pre-crisis upturn + GFC onset", "sharpe": 0.0212, "sortino": 0.0342, "return_pct": -0.02, "equity": 999.8, "max_dd": 2.91, "win_rate": 47.22, "profit_factor": 1.004, "ic": -0.0694, "hit": 46.79, "n": 109, "aleatoric_mean": 1.6e-05, "epistemic_mean": 3.1e-05, "confidence_mean": 1.0, "aleatoric_std": 2e-05, "epistemic_std": 4e-05}, {"fold": "fold_2", "regime": "Post-crash recovery", "sharpe": -1.0281, "sortino": -1.5972, "return_pct": -5.12, "equity": 948.78, "max_dd": 9.21, "win_rate": 46.3, "profit_factor": 0.85, "ic": 0.0431, "hit": 46.3, "n": 108, "aleatoric_mean": 2.8e-05, "epistemic_mean": 5.5e-05, "confidence_mean": 0.9999, "aleatoric_std": 2.2e-05, "epistemic_std": 4.3e-05}, {"fold": "fold_3", "regime": "Eurozone debt plateau", "sharpe": 11.0234, "sortino": 30.4677, "return_pct": 43.97, "equity": 1439.69, "max_dd": 0.84, "win_rate": 78.9, "profit_factor": 6.531, "ic": 0.6739, "hit": 77.48, "n": 111, "aleatoric_mean": 1.8e-05, "epistemic_mean": 3.6e-05, "confidence_mean": 0.9999, "aleatoric_std": 1.3e-05, "epistemic_std": 2.5e-05}, {"fold": "fold_4", "regime": "Strong USD downturn", "sharpe": 7.8607, "sortino": 16.5925, "return_pct": 27.57, "equity": 1275.68, "max_dd": 1.08, "win_rate": 71.56, "profit_factor": 3.79, "ic": 0.6028, "hit": 70.91, "n": 110, "aleatoric_mean": 1.4e-05, "epistemic_mean": 2.7e-05, "confidence_mean": 1.0, "aleatoric_std": 1.2e-05, "epistemic_std": 2.5e-05}, {"fold": "fold_5", "regime": "Low-vol plateau", "sharpe": 10.5961, "sortino": 28.9438, "return_pct": 34.04, "equity": 1340.39, "max_dd": 0.62, "win_rate": 75.0, "profit_factor": 6.466, "ic": 0.724, "hit": 75.0, "n": 112, "aleatoric_mean": 1.3e-05, "epistemic_mean": 2.6e-05, "confidence_mean": 1.0, "aleatoric_std": 1e-05, "epistemic_std": 1.9e-05}, {"fold": "fold_6", "regime": "EUR crisis downturn", "sharpe": 9.2138, "sortino": 21.1712, "return_pct": 19.95, "equity": 1199.5, "max_dd": 0.82, "win_rate": 71.03, "profit_factor": 5.067, "ic": 0.721, "hit": 70.37, "n": 108, "aleatoric_mean": 8e-06, "epistemic_mean": 1.6e-05, "confidence_mean": 1.0, "aleatoric_std": 4e-06, "epistemic_std": 8e-06}, {"fold": "fold_7", "regime": "Recent mixed/upturn", "sharpe": 9.5361, "sortino": 25.4132, "return_pct": 21.6, "equity": 1215.96, "max_dd": 0.72, "win_rate": 71.82, "profit_factor": 4.828, "ic": 0.6004, "hit": 71.82, "n": 110, "aleatoric_mean": 9e-06, "epistemic_mean": 1.8e-05, "confidence_mean": 1.0, "aleatoric_std": 6e-06, "epistemic_std": 1.1e-05}], "train_sharpe": 7.9764, "train_psr": 1.0, "train_equity": 5846122.0, "train_sortino": 23.4815, "train_return_pct": 584512.2, "train_max_dd": 4.92, "train_win_rate": 78.24, "train_profit_factor": 8.03, "train_ic": 0.7554, "train_hit": 77.93, "train_per_window": [{"fold": "all_train", "regime": "Training data", "sharpe": 7.9764, "sortino": 23.4815, "return_pct": 584512.2, "equity": 5846122.0, "max_dd": 4.92, "win_rate": 78.24, "profit_factor": 8.03, "ic": 0.7554, "hit": 77.93, "n": 2478}], "experiment_num": 82, "status": "KEEP"}
