{"backbone": "lfm2-350m", "description": "Exp15: head_dropout=0.2 (was 0.1). 636K params on 1382 samples. Cite: Srivastava2014 recommends 0.2-0.5 for small datasets, Hu2022 LoRA uses 0.05-0.2 for adapters", "config": {"seq_len": 60, "lr": 3e-05, "batch_size": 32, "epochs": 20, "weight_decay": 1e-05, "patience": 5, "grad_clip": 1.0, "warmup_epochs": 0, "huber_delta": 1.0, "head_dropout": 0.2}, "composite": -0.8279, "test_pos_folds": 3, "val_pos_folds": 4, "val_loss": 0.000976, "elapsed_sec": 226.5, "timestamp": "2026-04-11T19:52:58", "sharpe": 0.1181, "psr": 0.5736, "equity": 1016.69, "sortino": 0.178, "return_pct": 1.67, "max_dd": 16.78, "win_rate": 48.79, "profit_factor": 1.02, "ic": 0.0196, "hit": 48.48, "per_window": [{"fold": "fold_1", "regime": "Pre-crisis upturn + GFC onset", "sharpe": 0.9112, "sortino": 1.7724, "return_pct": 1.83, "equity": 1018.35, "max_dd": 2.75, "win_rate": 51.92, "profit_factor": 1.15, "ic": -0.0181, "hit": 50.94, "n": 53}, {"fold": "fold_2", "regime": "Post-crash recovery", "sharpe": 3.5882, "sortino": 5.9441, "return_pct": 10.32, "equity": 1103.24, "max_dd": 3.62, "win_rate": 57.89, "profit_factor": 1.779, "ic": 0.194, "hit": 57.89, "n": 57}, {"fold": "fold_3", "regime": "Eurozone debt plateau", "sharpe": -1.8954, "sortino": -3.2009, "return_pct": -3.35, "equity": 966.48, "max_dd": 7.21, "win_rate": 40.74, "profit_factor": 0.739, "ic": 0.0874, "hit": 39.29, "n": 56}, {"fold": "fold_4", "regime": "Strong USD downturn", "sharpe": -1.5568, "sortino": -2.2481, "return_pct": -7.79, "equity": 922.07, "max_dd": 9.33, "win_rate": 42.74, "profit_factor": 0.77, "ic": -0.1082, "hit": 42.37, "n": 118}, {"fold": "fold_5", "regime": "Low-vol plateau", "sharpe": -2.0734, "sortino": -3.034, "return_pct": -4.58, "equity": 954.18, "max_dd": 6.58, "win_rate": 42.86, "profit_factor": 0.708, "ic": -0.1117, "hit": 42.86, "n": 112}, {"fold": "fold_6", "regime": "EUR crisis downturn", "sharpe": 3.4349, "sortino": 5.8292, "return_pct": 16.07, "equity": 1160.74, "max_dd": 5.28, "win_rate": 59.13, "profit_factor": 1.723, "ic": 0.2859, "hit": 59.13, "n": 115}, {"fold": "fold_7", "regime": "Recent mixed/upturn", "sharpe": -2.0691, "sortino": -2.671, "return_pct": -8.31, "equity": 916.86, "max_dd": 9.8, "win_rate": 48.21, "profit_factor": 0.701, "ic": -0.0481, "hit": 48.21, "n": 112}], "val_sharpe": -0.1279, "val_psr": 0.4347, "val_equity": 979.47, "val_sortino": -0.2129, "val_return_pct": -2.05, "val_max_dd": 9.72, "val_win_rate": 48.8, "val_profit_factor": 0.979, "val_ic": 0.0174, "val_hit": 48.56, "val_per_window": [{"fold": "fold_1", "regime": "Pre-crisis upturn + GFC onset", "sharpe": 0.5751, "sortino": 0.9054, "return_pct": 0.86, "equity": 1008.61, "max_dd": 3.64, "win_rate": 51.72, "profit_factor": 1.099, "ic": 0.1342, "hit": 50.85, "n": 59}, {"fold": "fold_2", "regime": "Post-crash recovery", "sharpe": 1.5214, "sortino": 2.8775, "return_pct": 2.93, "equity": 1029.3, "max_dd": 2.66, "win_rate": 50.0, "profit_factor": 1.279, "ic": 0.1076, "hit": 50.0, "n": 58}, {"fold": "fold_3", "regime": "Eurozone debt plateau", "sharpe": 0.4506, "sortino": 0.8096, "return_pct": 0.95, "equity": 1009.54, "max_dd": 4.66, "win_rate": 54.1, "profit_factor": 1.078, "ic": -0.1088, "hit": 54.1, "n": 61}, {"fold": "fold_4", "regime": "Strong USD downturn", "sharpe": -0.0591, "sortino": -0.114, "return_pct": -0.23, "equity": 997.7, "max_dd": 3.76, "win_rate": 43.33, "profit_factor": 0.991, "ic": 0.1407, "hit": 43.33, "n": 60}, {"fold": "fold_5", "regime": "Low-vol plateau", "sharpe": -1.5412, "sortino": -2.4229, "return_pct": -2.69, "equity": 973.11, "max_dd": 5.68, "win_rate": 50.0, "profit_factor": 0.779, "ic": 0.0877, "hit": 50.0, "n": 62}, {"fold": "fold_6", "regime": "EUR crisis downturn", "sharpe": 0.8384, "sortino": 1.5512, "return_pct": 0.85, "equity": 1008.54, "max_dd": 2.06, "win_rate": 49.12, "profit_factor": 1.147, "ic": -0.0852, "hit": 48.28, "n": 58}, {"fold": "fold_7", "regime": "Recent mixed/upturn", "sharpe": -3.7154, "sortino": -4.9632, "return_pct": -4.56, "equity": 954.43, "max_dd": 4.5, "win_rate": 43.33, "profit_factor": 0.544, "ic": -0.2263, "hit": 43.33, "n": 60}], "train_sharpe": 1.1033, "train_psr": 0.9824, "train_equity": 2091.92, "train_sortino": 1.1603, "train_return_pct": 109.19, "train_max_dd": 18.54, "train_win_rate": 54.91, "train_profit_factor": 1.29, "train_ic": 0.123, "train_hit": 54.63, "train_per_window": [{"fold": "all_train", "regime": "Training data", "sharpe": 1.1033, "sortino": 1.1603, "return_pct": 109.19, "equity": 2091.92, "max_dd": 18.54, "win_rate": 54.91, "profit_factor": 1.29, "ic": 0.123, "hit": 54.63, "n": 1382}], "experiment_num": 15, "status": "DISCARD"}
{"backbone": "lfm2-350m", "description": "huber_delta=0.75 compromise", "config": {"seq_len": 60, "lr": 3e-05, "batch_size": 32, "epochs": 20, "weight_decay": 1e-05, "patience": 5, "grad_clip": 1.0, "warmup_epochs": 0, "huber_delta": 0.75, "head_dropout": 0.1}, "composite": -0.2721, "test_pos_folds": 3, "val_pos_folds": 6, "val_loss": 0.00101, "elapsed_sec": 227.0, "timestamp": "2026-04-11T20:08:27", "sharpe": 0.2279, "psr": 0.6394, "equity": 1043.08, "sortino": 0.3176, "return_pct": 4.31, "max_dd": 9.5, "win_rate": 51.86, "profit_factor": 1.039, "ic": 0.0357, "hit": 51.52, "per_window": [{"fold": "fold_1", "regime": "Pre-crisis upturn + GFC onset", "sharpe": -0.172, "sortino": -0.2827, "return_pct": -0.47, "equity": 995.31, "max_dd": 4.92, "win_rate": 50.0, "profit_factor": 0.974, "ic": 0.1392, "hit": 49.06, "n": 53}, {"fold": "fold_2", "regime": "Post-crash recovery", "sharpe": -0.8021, "sortino": -1.2748, "return_pct": -2.44, "equity": 975.59, "max_dd": 9.5, "win_rate": 47.37, "profit_factor": 0.879, "ic": -0.2175, "hit": 47.37, "n": 57}, {"fold": "fold_3", "regime": "Eurozone debt plateau", "sharpe": 4.2895, "sortino": 9.6656, "return_pct": 7.55, "equity": 1075.48, "max_dd": 1.61, "win_rate": 59.26, "profit_factor": 1.985, "ic": 0.2423, "hit": 57.14, "n": 56}, {"fold": "fold_4", "regime": "Strong USD downturn", "sharpe": -1.1608, "sortino": -1.4932, "return_pct": -5.95, "equity": 940.52, "max_dd": 7.64, "win_rate": 49.57, "profit_factor": 0.823, "ic": -0.0258, "hit": 49.15, "n": 118}, {"fold": "fold_5", "regime": "Low-vol plateau", "sharpe": 1.7431, "sortino": 2.4347, "return_pct": 3.92, "equity": 1039.22, "max_dd": 3.04, "win_rate": 58.04, "profit_factor": 1.337, "ic": 0.2474, "hit": 58.04, "n": 112}, {"fold": "fold_6", "regime": "EUR crisis downturn", "sharpe": 0.8018, "sortino": 1.327, "return_pct": 3.44, "equity": 1034.44, "max_dd": 4.77, "win_rate": 50.43, "profit_factor": 1.135, "ic": 0.0574, "hit": 50.43, "n": 115}, {"fold": "fold_7", "regime": "Recent mixed/upturn", "sharpe": -0.2476, "sortino": -0.332, "return_pct": -1.21, "equity": 987.9, "max_dd": 5.36, "win_rate": 49.11, "profit_factor": 0.958, "ic": -0.1138, "hit": 49.11, "n": 112}], "val_sharpe": 2.8722, "val_psr": 0.9999, "val_equity": 1417.99, "val_sortino": 5.6609, "val_return_pct": 41.8, "val_max_dd": 5.32, "val_win_rate": 53.12, "val_profit_factor": 1.616, "val_ic": 0.1185, "val_hit": 52.87, "val_per_window": [{"fold": "fold_1", "regime": "Pre-crisis upturn + GFC onset", "sharpe": 2.961, "sortino": 5.1159, "return_pct": 4.67, "equity": 1046.68, "max_dd": 3.69, "win_rate": 58.62, "profit_factor": 1.63, "ic": -0.0576, "hit": 57.63, "n": 59}, {"fold": "fold_2", "regime": "Post-crash recovery", "sharpe": 4.6577, "sortino": 8.4869, "return_pct": 9.07, "equity": 1090.74, "max_dd": 2.26, "win_rate": 63.79, "profit_factor": 2.133, "ic": 0.3076, "hit": 63.79, "n": 58}, {"fold": "fold_3", "regime": "Eurozone debt plateau", "sharpe": 4.1585, "sortino": 10.3018, "return_pct": 9.85, "equity": 1098.48, "max_dd": 2.35, "win_rate": 52.46, "profit_factor": 2.008, "ic": 0.2933, "hit": 52.46, "n": 61}, {"fold": "fold_4", "regime": "Strong USD downturn", "sharpe": 4.9275, "sortino": 12.6859, "return_pct": 10.74, "equity": 1107.44, "max_dd": 1.68, "win_rate": 55.0, "profit_factor": 2.13, "ic": 0.2042, "hit": 55.0, "n": 60}, {"fold": "fold_5", "regime": "Low-vol plateau", "sharpe": 0.7976, "sortino": 1.3731, "return_pct": 1.33, "equity": 1013.31, "max_dd": 5.32, "win_rate": 46.77, "profit_factor": 1.138, "ic": -0.0632, "hit": 46.77, "n": 62}, {"fold": "fold_6", "regime": "EUR crisis downturn", "sharpe": -0.0161, "sortino": -0.0293, "return_pct": -0.04, "equity": 999.6, "max_dd": 1.6, "win_rate": 49.12, "profit_factor": 0.997, "ic": -0.0971, "hit": 48.28, "n": 58}, {"fold": "fold_7", "regime": "Recent mixed/upturn", "sharpe": 0.6501, "sortino": 0.9881, "return_pct": 0.8, "equity": 1008.0, "max_dd": 2.57, "win_rate": 46.67, "profit_factor": 1.112, "ic": -0.0204, "hit": 46.67, "n": 60}], "train_sharpe": 2.5381, "train_psr": 1.0, "train_equity": 5727.29, "train_sortino": 5.9984, "train_return_pct": 472.73, "train_max_dd": 5.73, "train_win_rate": 57.67, "train_profit_factor": 1.81, "train_ic": 0.2231, "train_hit": 57.38, "train_per_window": [{"fold": "all_train", "regime": "Training data", "sharpe": 2.5381, "sortino": 5.9984, "return_pct": 472.73, "equity": 5727.29, "max_dd": 5.73, "win_rate": 57.67, "profit_factor": 1.81, "ic": 0.2231, "hit": 57.38, "n": 1382}], "experiment_num": 16, "status": "DISCARD"}
{"backbone": "lfm2-350m", "description": "seq_len=90 longer context", "config": {"seq_len": 90, "lr": 3e-05, "batch_size": 32, "epochs": 20, "weight_decay": 1e-05, "patience": 5, "grad_clip": 1.0, "warmup_epochs": 0, "huber_delta": 1.0, "head_dropout": 0.1}, "composite": -0.3775, "test_pos_folds": 5, "val_pos_folds": 3, "val_loss": 0.002067, "elapsed_sec": 209.5, "timestamp": "2026-04-11T20:12:47", "sharpe": 1.2595, "psr": 0.9455, "equity": 1202.23, "sortino": 1.9253, "return_pct": 20.22, "max_dd": 10.94, "win_rate": 50.73, "profit_factor": 1.237, "ic": 0.0926, "hit": 50.36, "per_window": [{"fold": "fold_1", "regime": "Pre-crisis upturn + GFC onset", "sharpe": 3.1813, "sortino": 7.3469, "return_pct": 2.89, "equity": 1028.93, "max_dd": 1.68, "win_rate": 54.55, "profit_factor": 1.627, "ic": 0.0988, "hit": 52.17, "n": 23}, {"fold": "fold_2", "regime": "Post-crash recovery", "sharpe": -0.9668, "sortino": -1.461, "return_pct": -1.31, "equity": 986.9, "max_dd": 3.26, "win_rate": 44.44, "profit_factor": 0.852, "ic": -0.3242, "hit": 44.44, "n": 27}, {"fold": "fold_3", "regime": "Eurozone debt plateau", "sharpe": 0.4534, "sortino": 0.7659, "return_pct": 0.36, "equity": 1003.59, "max_dd": 2.24, "win_rate": 45.83, "profit_factor": 1.075, "ic": 0.0226, "hit": 42.31, "n": 26}, {"fold": "fold_4", "regime": "Strong USD downturn", "sharpe": -1.9692, "sortino": -2.9949, "return_pct": -7.65, "equity": 923.51, "max_dd": 7.95, "win_rate": 39.77, "profit_factor": 0.713, "ic": -0.0879, "hit": 39.77, "n": 88}, {"fold": "fold_5", "regime": "Low-vol plateau", "sharpe": 0.4319, "sortino": 0.6731, "return_pct": 0.72, "equity": 1007.24, "max_dd": 1.82, "win_rate": 46.34, "profit_factor": 1.074, "ic": 0.0281, "hit": 46.34, "n": 82}, {"fold": "fold_6", "regime": "EUR crisis downturn", "sharpe": 5.8579, "sortino": 9.106, "return_pct": 20.37, "equity": 1203.74, "max_dd": 2.4, "win_rate": 64.71, "profit_factor": 2.552, "ic": 0.3199, "hit": 64.71, "n": 85}, {"fold": "fold_7", "regime": "Recent mixed/upturn", "sharpe": 2.087, "sortino": 3.452, "return_pct": 5.36, "equity": 1053.58, "max_dd": 2.4, "win_rate": 54.88, "profit_factor": 1.409, "ic": 0.2328, "hit": 54.88, "n": 82}], "val_sharpe": 0.2225, "val_psr": 0.5802, "val_equity": 1010.79, "val_sortino": 0.4309, "val_return_pct": 1.08, "val_max_dd": 6.18, "val_win_rate": 51.46, "val_profit_factor": 1.036, "val_ic": -0.0598, "val_hit": 50.96, "val_per_window": [{"fold": "fold_1", "regime": "Pre-crisis upturn + GFC onset", "sharpe": -6.0142, "sortino": -8.9133, "return_pct": -4.2, "equity": 958.0, "max_dd": 4.97, "win_rate": 42.86, "profit_factor": 0.376, "ic": 0.0532, "hit": 41.38, "n": 29}, {"fold": "fold_2", "regime": "Post-crash recovery", "sharpe": -0.5125, "sortino": -0.8925, "return_pct": -0.38, "equity": 996.23, "max_dd": 1.55, "win_rate": 46.43, "profit_factor": 0.922, "ic": -0.1478, "hit": 46.43, "n": 28}, {"fold": "fold_3", "regime": "Eurozone debt plateau", "sharpe": 1.7638, "sortino": 4.1295, "return_pct": 1.7, "equity": 1016.99, "max_dd": 2.19, "win_rate": 54.84, "profit_factor": 1.315, "ic": -0.1867, "hit": 54.84, "n": 31}, {"fold": "fold_4", "regime": "Strong USD downturn", "sharpe": 3.2613, "sortino": 10.5847, "return_pct": 3.38, "equity": 1033.77, "max_dd": 0.95, "win_rate": 63.33, "profit_factor": 1.654, "ic": 0.1341, "hit": 63.33, "n": 30}, {"fold": "fold_5", "regime": "Low-vol plateau", "sharpe": 3.5293, "sortino": 7.3427, "return_pct": 3.31, "equity": 1033.13, "max_dd": 2.48, "win_rate": 59.38, "profit_factor": 1.768, "ic": 0.1184, "hit": 59.38, "n": 32}, {"fold": "fold_6", "regime": "EUR crisis downturn", "sharpe": -0.491, "sortino": -0.9131, "return_pct": -0.23, "equity": 997.74, "max_dd": 1.42, "win_rate": 44.44, "profit_factor": 0.925, "ic": -0.2047, "hit": 42.86, "n": 28}, {"fold": "fold_7", "regime": "Recent mixed/upturn", "sharpe": -3.387, "sortino": -6.0096, "return_pct": -2.27, "equity": 977.29, "max_dd": 2.67, "win_rate": 46.67, "profit_factor": 0.607, "ic": -0.0287, "hit": 46.67, "n": 30}], "train_sharpe": 1.8152, "train_psr": 0.9999, "train_equity": 1900.32, "train_sortino": 3.3274, "train_return_pct": 90.03, "train_max_dd": 9.65, "train_win_rate": 53.17, "train_profit_factor": 1.348, "train_ic": 0.1212, "train_hit": 53.01, "train_per_window": [{"fold": "all_train", "regime": "Training data", "sharpe": 1.8152, "sortino": 3.3274, "return_pct": 90.03, "equity": 1900.32, "max_dd": 9.65, "win_rate": 53.17, "profit_factor": 1.348, "ic": 0.1212, "hit": 53.01, "n": 1013}], "experiment_num": 17, "status": "DISCARD"}
{"backbone": "lfm2-350m", "description": "grad_clip=0.5 tighter clipping", "config": {"seq_len": 60, "lr": 3e-05, "batch_size": 32, "epochs": 20, "weight_decay": 1e-05, "patience": 5, "grad_clip": 0.5, "warmup_epochs": 0, "huber_delta": 1.0, "head_dropout": 0.1}, "composite": -0.6484, "test_pos_folds": 4, "val_pos_folds": 6, "val_loss": 0.000881, "elapsed_sec": 273.0, "timestamp": "2026-04-11T20:17:55", "sharpe": 0.4615, "psr": 0.7654, "equity": 1101.53, "sortino": 0.6781, "return_pct": 10.15, "max_dd": 12.19, "win_rate": 53.63, "profit_factor": 1.081, "ic": 0.05, "hit": 53.29, "per_window": [{"fold": "fold_1", "regime": "Pre-crisis upturn + GFC onset", "sharpe": 3.5939, "sortino": 5.7888, "return_pct": 7.58, "equity": 1075.83, "max_dd": 2.52, "win_rate": 59.62, "profit_factor": 1.735, "ic": 0.399, "hit": 58.49, "n": 53}, {"fold": "fold_2", "regime": "Post-crash recovery", "sharpe": -1.8048, "sortino": -2.6506, "return_pct": -5.17, "equity": 948.31, "max_dd": 8.99, "win_rate": 50.88, "profit_factor": 0.749, "ic": -0.0166, "hit": 50.88, "n": 57}, {"fold": "fold_3", "regime": "Eurozone debt plateau", "sharpe": -2.8078, "sortino": -4.4669, "return_pct": -4.85, "equity": 951.45, "max_dd": 5.74, "win_rate": 48.15, "profit_factor": 0.639, "ic": -0.0974, "hit": 46.43, "n": 56}, {"fold": "fold_4", "regime": "Strong USD downturn", "sharpe": 0.8733, "sortino": 1.1708, "return_pct": 4.23, "equity": 1042.25, "max_dd": 7.42, "win_rate": 55.56, "profit_factor": 1.158, "ic": 0.2463, "hit": 55.08, "n": 118}, {"fold": "fold_5", "regime": "Low-vol plateau", "sharpe": 2.1315, "sortino": 3.9923, "return_pct": 4.82, "equity": 1048.16, "max_dd": 2.57, "win_rate": 58.93, "profit_factor": 1.426, "ic": 0.0839, "hit": 58.93, "n": 112}, {"fold": "fold_6", "regime": "EUR crisis downturn", "sharpe": 1.0292, "sortino": 1.7162, "return_pct": 4.5, "equity": 1045.04, "max_dd": 4.49, "win_rate": 52.17, "profit_factor": 1.177, "ic": -0.07, "hit": 52.17, "n": 115}, {"fold": "fold_7", "regime": "Recent mixed/upturn", "sharpe": -0.0993, "sortino": -0.1765, "return_pct": -0.6, "equity": 993.99, "max_dd": 5.68, "win_rate": 49.11, "profit_factor": 0.983, "ic": 0.1139, "hit": 49.11, "n": 112}], "val_sharpe": -0.2484, "val_psr": 0.3744, "val_equity": 964.8, "val_sortino": -0.3616, "val_return_pct": -3.52, "val_max_dd": 15.66, "val_win_rate": 49.76, "val_profit_factor": 0.959, "val_ic": 0.0235, "val_hit": 49.52, "val_per_window": [{"fold": "fold_1", "regime": "Pre-crisis upturn + GFC onset", "sharpe": 1.2833, "sortino": 1.9758, "return_pct": 1.99, "equity": 1019.94, "max_dd": 3.42, "win_rate": 53.45, "profit_factor": 1.235, "ic": 0.1105, "hit": 52.54, "n": 59}, {"fold": "fold_2", "regime": "Post-crash recovery", "sharpe": 3.1776, "sortino": 5.3408, "return_pct": 6.22, "equity": 1062.15, "max_dd": 1.63, "win_rate": 58.62, "profit_factor": 1.674, "ic": 0.2844, "hit": 58.62, "n": 58}, {"fold": "fold_3", "regime": "Eurozone debt plateau", "sharpe": -6.4177, "sortino": -8.3135, "return_pct": -13.22, "equity": 867.81, "max_dd": 12.2, "win_rate": 37.7, "profit_factor": 0.337, "ic": -0.3721, "hit": 37.7, "n": 61}, {"fold": "fold_4", "regime": "Strong USD downturn", "sharpe": 0.6216, "sortino": 1.0849, "return_pct": 1.27, "equity": 1012.67, "max_dd": 2.67, "win_rate": 48.33, "profit_factor": 1.1, "ic": 0.146, "hit": 48.33, "n": 60}, {"fold": "fold_5", "regime": "Low-vol plateau", "sharpe": 0.3205, "sortino": 0.541, "return_pct": 0.5, "equity": 1004.97, "max_dd": 3.42, "win_rate": 53.23, "profit_factor": 1.053, "ic": 0.1564, "hit": 53.23, "n": 62}, {"fold": "fold_6", "regime": "EUR crisis downturn", "sharpe": 0.2444, "sortino": 0.4414, "return_pct": 0.23, "equity": 1002.32, "max_dd": 2.12, "win_rate": 49.12, "profit_factor": 1.041, "ic": -0.1952, "hit": 48.28, "n": 58}, {"fold": "fold_7", "regime": "Recent mixed/upturn", "sharpe": 0.499, "sortino": 0.7399, "return_pct": 0.61, "equity": 1006.06, "max_dd": 4.28, "win_rate": 48.33, "profit_factor": 1.085, "ic": 0.0013, "hit": 48.33, "n": 60}], "train_sharpe": 2.0909, "train_psr": 1.0, "train_equity": 4203.52, "train_sortino": 4.7259, "train_return_pct": 320.35, "train_max_dd": 6.27, "train_win_rate": 55.42, "train_profit_factor": 1.626, "train_ic": 0.1712, "train_hit": 55.14, "train_per_window": [{"fold": "all_train", "regime": "Training data", "sharpe": 2.0909, "sortino": 4.7259, "return_pct": 320.35, "equity": 4203.52, "max_dd": 6.27, "win_rate": 55.42, "profit_factor": 1.626, "ic": 0.1712, "hit": 55.14, "n": 1382}], "experiment_num": 18, "status": "DISCARD"}
