{"backbone": "lstm", "description": "lstm: Exp5 hd=0.30 push dropout further (Srivastava2014)", "config": {"seq_len": 10, "lr": 0.001, "batch_size": 32, "epochs": 100, "weight_decay": 1e-05, "patience": 15, "grad_clip": 1.0, "warmup_epochs": 0, "huber_delta": 1.0, "head_dropout": 0.3, "seed": 0, "het_loss": false}, "composite": 6.0221, "test_pos_folds": 6, "val_pos_folds": 7, "val_loss": 2.7e-05, "elapsed_sec": 33.7, "timestamp": "2026-04-19T18:10:17", "sharpe": 6.1221, "psr": 1.0, "equity": 10682.66, "sortino": 10.9319, "return_pct": 968.27, "max_dd": 8.78, "win_rate": 69.97, "profit_factor": 3.234, "ic": 0.5246, "hit": 69.68, "aleatoric_mean": 1.3e-05, "epistemic_mean": 2.7e-05, "confidence_mean": 1.0, "precision": 0.6965, "recall": 0.6965, "f1": 0.6965, "f2": 0.6965, "mcc": 0.3997, "accuracy": 0.6999, "per_window": [{"fold": "fold_1", "regime": "Pre-crisis upturn + GFC onset", "sharpe": 2.378, "sortino": 6.8712, "return_pct": 19.05, "equity": 1190.49, "max_dd": 4.25, "win_rate": 54.9, "profit_factor": 1.768, "ic": 0.0917, "hit": 54.37, "n": 103, "precision": 0.56, "recall": 0.5283, "f1": 0.5437, "f2": 0.5344, "mcc": 0.0883, "accuracy": 0.5437, "tp": 28, "fp": 22, "tn": 28, "fn": 25, "aleatoric_mean": 2.6e-05, "epistemic_mean": 5.1e-05, "confidence_mean": 0.9999, "aleatoric_std": 2.7e-05, "epistemic_std": 5.5e-05}, {"fold": "fold_2", "regime": "Post-crash recovery", "sharpe": -0.2839, "sortino": -0.4985, "return_pct": -1.62, "equity": 983.79, "max_dd": 8.78, "win_rate": 50.47, "profit_factor": 0.956, "ic": 0.0768, "hit": 50.47, "n": 107, "precision": 0.4853, "recall": 0.6471, "f1": 0.5546, "f2": 0.6066, "mcc": 0.0229, "accuracy": 0.5047, "tp": 33, "fp": 35, "tn": 21, "fn": 18, "aleatoric_mean": 1.4e-05, "epistemic_mean": 2.8e-05, "confidence_mean": 1.0, "aleatoric_std": 8e-06, "epistemic_std": 1.6e-05}, {"fold": "fold_3", "regime": "Eurozone debt plateau", "sharpe": 7.7615, "sortino": 12.7546, "return_pct": 27.89, "equity": 1278.94, "max_dd": 1.65, "win_rate": 75.96, "profit_factor": 3.417, "ic": 0.6212, "hit": 74.53, "n": 106, "precision": 0.7222, "recall": 0.9123, "f1": 0.8062, "f2": 0.8667, "mcc": 0.5385, "accuracy": 0.7642, "tp": 52, "fp": 20, "tn": 29, "fn": 5, "aleatoric_mean": 1.6e-05, "epistemic_mean": 3.2e-05, "confidence_mean": 1.0, "aleatoric_std": 1e-05, "epistemic_std": 1.9e-05}, {"fold": "fold_4", "regime": "Strong USD downturn", "sharpe": 9.9724, "sortino": 18.1136, "return_pct": 92.05, "equity": 1920.51, "max_dd": 1.81, "win_rate": 77.84, "profit_factor": 5.877, "ic": 0.7165, "hit": 77.38, "n": 168, "precision": 0.8551, "recall": 0.686, "f1": 0.7613, "f2": 0.7143, "mcc": 0.5731, "accuracy": 0.7798, "tp": 59, "fp": 10, "tn": 72, "fn": 27, "aleatoric_mean": 1.2e-05, "epistemic_mean": 2.3e-05, "confidence_mean": 1.0, "aleatoric_std": 5e-06, "epistemic_std": 1.1e-05}, {"fold": "fold_5", "regime": "Low-vol plateau", "sharpe": 10.2421, "sortino": 31.1109, "return_pct": 33.11, "equity": 1331.11, "max_dd": 0.54, "win_rate": 71.6, "profit_factor": 6.037, "ic": 0.6955, "hit": 71.6, "n": 162, "precision": 0.6705, "recall": 0.7763, "f1": 0.7195, "f2": 0.7526, "mcc": 0.4399, "accuracy": 0.716, "tp": 59, "fp": 29, "tn": 57, "fn": 17, "aleatoric_mean": 8e-06, "epistemic_mean": 1.5e-05, "confidence_mean": 1.0, "aleatoric_std": 3e-06, "epistemic_std": 5e-06}, {"fold": "fold_6", "regime": "EUR crisis downturn", "sharpe": 12.3246, "sortino": 34.1954, "return_pct": 84.07, "equity": 1840.69, "max_dd": 1.08, "win_rate": 78.18, "profit_factor": 8.368, "ic": 0.7774, "hit": 78.18, "n": 165, "precision": 0.806, "recall": 0.7013, "f1": 0.75, "f2": 0.72, "mcc": 0.5624, "accuracy": 0.7818, "tp": 54, "fp": 13, "tn": 75, "fn": 23, "aleatoric_mean": 1.3e-05, "epistemic_mean": 2.6e-05, "confidence_mean": 1.0, "aleatoric_std": 7e-06, "epistemic_std": 1.4e-05}, {"fold": "fold_7", "regime": "Recent mixed/upturn", "sharpe": 7.8267, "sortino": 12.0938, "return_pct": 51.56, "equity": 1515.62, "max_dd": 2.24, "win_rate": 70.37, "profit_factor": 3.913, "ic": 0.6665, "hit": 70.37, "n": 162, "precision": 0.7463, "recall": 0.6173, "f1": 0.6757, "f2": 0.6394, "mcc": 0.4136, "accuracy": 0.7037, "tp": 50, "fp": 17, "tn": 64, "fn": 31, "aleatoric_mean": 1.2e-05, "epistemic_mean": 2.4e-05, "confidence_mean": 1.0, "aleatoric_std": 5e-06, "epistemic_std": 9e-06}], "val_sharpe": 6.6489, "val_psr": 1.0, "val_equity": 4251.75, "val_sortino": 9.8605, "val_return_pct": 325.18, "val_max_dd": 5.37, "val_win_rate": 67.1, "val_profit_factor": 3.15, "val_ic": 0.52, "val_hit": 66.67, "val_aleatoric_mean": 1e-05, "val_epistemic_mean": 2e-05, "val_confidence_mean": 1.0, "val_precision": 0.6306, "val_recall": 0.7342, "val_f1": 0.6785, "val_f2": 0.7109, "val_mcc": 0.3462, "val_accuracy": 0.6693, "val_per_window": [{"fold": "fold_1", "regime": "Pre-crisis upturn + GFC onset", "sharpe": 0.9126, "sortino": 1.5141, "return_pct": 2.25, "equity": 1022.52, "max_dd": 3.14, "win_rate": 45.37, "profit_factor": 1.163, "ic": 0.061, "hit": 44.95, "n": 109, "precision": 0.4756, "recall": 0.7091, "f1": 0.5693, "f2": 0.6457, "mcc": -0.101, "accuracy": 0.4587, "tp": 39, "fp": 43, "tn": 11, "fn": 16, "aleatoric_mean": 1e-05, "epistemic_mean": 2e-05, "confidence_mean": 1.0, "aleatoric_std": 5e-06, "epistemic_std": 1e-05}, {"fold": "fold_2", "regime": "Post-crash recovery", "sharpe": 0.3015, "sortino": 0.4699, "return_pct": 1.2, "equity": 1011.95, "max_dd": 5.37, "win_rate": 50.0, "profit_factor": 1.049, "ic": -0.0091, "hit": 50.0, "n": 108, "precision": 0.5789, "recall": 0.5238, "f1": 0.55, "f2": 0.534, "mcc": -0.0094, "accuracy": 0.5, "tp": 33, "fp": 24, "tn": 21, "fn": 30, "aleatoric_mean": 1.4e-05, "epistemic_mean": 2.8e-05, "confidence_mean": 1.0, "aleatoric_std": 6e-06, "epistemic_std": 1.2e-05}, {"fold": "fold_3", "regime": "Eurozone debt plateau", "sharpe": 8.9127, "sortino": 21.3508, "return_pct": 36.69, "equity": 1366.88, "max_dd": 1.43, "win_rate": 65.14, "profit_factor": 4.411, "ic": 0.7757, "hit": 63.96, "n": 111, "precision": 0.5443, "recall": 0.9149, "f1": 0.6825, "f2": 0.8052, "mcc": 0.3844, "accuracy": 0.6396, "tp": 43, "fp": 36, "tn": 28, "fn": 4, "aleatoric_mean": 9e-06, "epistemic_mean": 1.7e-05, "confidence_mean": 1.0, "aleatoric_std": 4e-06, "epistemic_std": 7e-06}, {"fold": "fold_4", "regime": "Strong USD downturn", "sharpe": 13.4165, "sortino": 36.8941, "return_pct": 42.59, "equity": 1425.89, "max_dd": 0.64, "win_rate": 81.65, "profit_factor": 12.099, "ic": 0.7403, "hit": 80.91, "n": 110, "precision": 0.8293, "recall": 0.7234, "f1": 0.7727, "f2": 0.7424, "mcc": 0.6264, "accuracy": 0.8182, "tp": 34, "fp": 7, "tn": 56, "fn": 13, "aleatoric_mean": 1e-05, "epistemic_mean": 2e-05, "confidence_mean": 1.0, "aleatoric_std": 4e-06, "epistemic_std": 7e-06}, {"fold": "fold_5", "regime": "Low-vol plateau", "sharpe": 11.4176, "sortino": 42.2797, "return_pct": 36.09, "equity": 1360.95, "max_dd": 1.09, "win_rate": 70.54, "profit_factor": 7.695, "ic": 0.7729, "hit": 70.54, "n": 112, "precision": 0.6923, "recall": 0.6792, "f1": 0.6857, "f2": 0.6818, "mcc": 0.4085, "accuracy": 0.7054, "tp": 36, "fp": 16, "tn": 43, "fn": 17, "aleatoric_mean": 8e-06, "epistemic_mean": 1.5e-05, "confidence_mean": 1.0, "aleatoric_std": 3e-06, "epistemic_std": 6e-06}, {"fold": "fold_6", "regime": "EUR crisis downturn", "sharpe": 14.5895, "sortino": 57.8549, "return_pct": 27.82, "equity": 1278.16, "max_dd": 0.25, "win_rate": 85.05, "profit_factor": 19.748, "ic": 0.855, "hit": 84.26, "n": 108, "precision": 0.8261, "recall": 0.8085, "f1": 0.8172, "f2": 0.812, "mcc": 0.6791, "accuracy": 0.8426, "tp": 38, "fp": 8, "tn": 53, "fn": 9, "aleatoric_mean": 7e-06, "epistemic_mean": 1.5e-05, "confidence_mean": 1.0, "aleatoric_std": 2e-06, "epistemic_std": 5e-06}, {"fold": "fold_7", "regime": "Recent mixed/upturn", "sharpe": 9.321, "sortino": 21.3427, "return_pct": 21.2, "equity": 1211.97, "max_dd": 0.88, "win_rate": 71.82, "profit_factor": 4.647, "ic": 0.6302, "hit": 71.82, "n": 110, "precision": 0.6618, "recall": 0.8491, "f1": 0.7438, "f2": 0.8036, "mcc": 0.4582, "accuracy": 0.7182, "tp": 45, "fp": 23, "tn": 34, "fn": 8, "aleatoric_mean": 1.2e-05, "epistemic_mean": 2.4e-05, "confidence_mean": 1.0, "aleatoric_std": 5e-06, "epistemic_std": 1e-05}], "train_sharpe": 6.9874, "train_psr": 1.0, "train_equity": 2380703.25, "train_sortino": 16.0139, "train_return_pct": 237970.33, "train_max_dd": 4.23, "train_win_rate": 75.65, "train_profit_factor": 5.635, "train_ic": 0.6757, "train_hit": 75.34, "train_precision": 0.7478, "train_recall": 0.7912, "train_f1": 0.7689, "train_f2": 0.7821, "train_mcc": 0.5106, "train_accuracy": 0.7554, "train_per_window": [{"fold": "all_train", "regime": "Training data", "sharpe": 6.9874, "sortino": 16.0139, "return_pct": 237970.33, "equity": 2380703.25, "max_dd": 4.23, "win_rate": 75.65, "profit_factor": 5.635, "ic": 0.6757, "hit": 75.34, "n": 2478, "precision": 0.7478, "recall": 0.7912, "f1": 0.7689, "f2": 0.7821, "mcc": 0.5106, "accuracy": 0.7554, "tp": 1008, "fp": 340, "tn": 864, "fn": 266}], "experiment_num": 109, "status": "DISCARD"}
{"backbone": "lstm", "description": "lstm: Exp6 hidden=64 Gu2020 reduced-capacity LSTM", "config": {"seq_len": 10, "lr": 0.001, "batch_size": 32, "epochs": 100, "weight_decay": 1e-05, "patience": 15, "grad_clip": 1.0, "warmup_epochs": 0, "huber_delta": 1.0, "head_dropout": 0.25, "seed": 0, "hidden_size": 64, "het_loss": false}, "composite": 6.0725, "test_pos_folds": 7, "val_pos_folds": 6, "val_loss": 2.8e-05, "elapsed_sec": 33.7, "timestamp": "2026-04-19T18:11:18", "sharpe": 6.2282, "psr": 1.0, "equity": 11073.96, "sortino": 11.2711, "return_pct": 1007.4, "max_dd": 5.84, "win_rate": 70.9, "profit_factor": 3.306, "ic": 0.5553, "hit": 70.61, "aleatoric_mean": 1.2e-05, "epistemic_mean": 2.3e-05, "confidence_mean": 1.0, "precision": 0.7506, "recall": 0.6133, "f1": 0.6751, "f2": 0.6366, "mcc": 0.422, "accuracy": 0.7081, "per_window": [{"fold": "fold_1", "regime": "Pre-crisis upturn + GFC onset", "sharpe": 2.0743, "sortino": 5.863, "return_pct": 16.37, "equity": 1163.71, "max_dd": 5.84, "win_rate": 55.88, "profit_factor": 1.641, "ic": 0.1573, "hit": 55.34, "n": 103, "precision": 0.5574, "recall": 0.6415, "f1": 0.5965, "f2": 0.6227, "mcc": 0.1032, "accuracy": 0.5534, "tp": 34, "fp": 27, "tn": 23, "fn": 19, "aleatoric_mean": 2.1e-05, "epistemic_mean": 4.3e-05, "confidence_mean": 0.9999, "aleatoric_std": 1.9e-05, "epistemic_std": 3.8e-05}, {"fold": "fold_2", "regime": "Post-crash recovery", "sharpe": 1.6623, "sortino": 3.0701, "return_pct": 7.97, "equity": 1079.67, "max_dd": 5.39, "win_rate": 57.01, "profit_factor": 1.298, "ic": 0.1097, "hit": 57.01, "n": 107, "precision": 0.5397, "recall": 0.6667, "f1": 0.5965, "f2": 0.6367, "mcc": 0.151, "accuracy": 0.5701, "tp": 34, "fp": 29, "tn": 27, "fn": 17, "aleatoric_mean": 1.3e-05, "epistemic_mean": 2.6e-05, "confidence_mean": 1.0, "aleatoric_std": 7e-06, "epistemic_std": 1.5e-05}, {"fold": "fold_3", "regime": "Eurozone debt plateau", "sharpe": 11.2617, "sortino": 20.8779, "return_pct": 38.34, "equity": 1383.44, "max_dd": 1.32, "win_rate": 82.69, "profit_factor": 6.166, "ic": 0.6848, "hit": 81.13, "n": 106, "precision": 0.8393, "recall": 0.8246, "f1": 0.8319, "f2": 0.8275, "mcc": 0.6401, "accuracy": 0.8208, "tp": 47, "fp": 9, "tn": 40, "fn": 10, "aleatoric_mean": 1.4e-05, "epistemic_mean": 2.7e-05, "confidence_mean": 1.0, "aleatoric_std": 7e-06, "epistemic_std": 1.4e-05}, {"fold": "fold_4", "regime": "Strong USD downturn", "sharpe": 8.4098, "sortino": 15.5046, "return_pct": 77.49, "equity": 1774.93, "max_dd": 1.81, "win_rate": 73.65, "profit_factor": 4.321, "ic": 0.741, "hit": 73.21, "n": 168, "precision": 0.9375, "recall": 0.5233, "f1": 0.6716, "f2": 0.574, "mcc": 0.5385, "accuracy": 0.7381, "tp": 45, "fp": 3, "tn": 79, "fn": 41, "aleatoric_mean": 1e-05, "epistemic_mean": 2e-05, "confidence_mean": 1.0, "aleatoric_std": 5e-06, "epistemic_std": 1e-05}, {"fold": "fold_5", "regime": "Low-vol plateau", "sharpe": 10.3101, "sortino": 27.9836, "return_pct": 33.29, "equity": 1332.89, "max_dd": 0.81, "win_rate": 74.07, "profit_factor": 6.121, "ic": 0.7382, "hit": 74.07, "n": 162, "precision": 0.8148, "recall": 0.5789, "f1": 0.6769, "f2": 0.6145, "mcc": 0.4898, "accuracy": 0.7407, "tp": 44, "fp": 10, "tn": 76, "fn": 32, "aleatoric_mean": 6e-06, "epistemic_mean": 1.3e-05, "confidence_mean": 1.0, "aleatoric_std": 2e-06, "epistemic_std": 4e-06}, {"fold": "fold_6", "regime": "EUR crisis downturn", "sharpe": 12.2285, "sortino": 43.7502, "return_pct": 83.52, "equity": 1835.18, "max_dd": 0.82, "win_rate": 76.97, "profit_factor": 8.202, "ic": 0.7769, "hit": 76.97, "n": 165, "precision": 0.8679, "recall": 0.5974, "f1": 0.7077, "f2": 0.6371, "mcc": 0.5533, "accuracy": 0.7697, "tp": 46, "fp": 7, "tn": 81, "fn": 31, "aleatoric_mean": 1.1e-05, "epistemic_mean": 2.2e-05, "confidence_mean": 1.0, "aleatoric_std": 6e-06, "epistemic_std": 1.2e-05}, {"fold": "fold_7", "regime": "Recent mixed/upturn", "sharpe": 7.0955, "sortino": 10.9279, "return_pct": 46.74, "equity": 1467.41, "max_dd": 2.24, "win_rate": 69.75, "profit_factor": 3.417, "ic": 0.6558, "hit": 69.75, "n": 162, "precision": 0.7759, "recall": 0.5556, "f1": 0.6475, "f2": 0.589, "mcc": 0.412, "accuracy": 0.6975, "tp": 45, "fp": 13, "tn": 68, "fn": 36, "aleatoric_mean": 1.1e-05, "epistemic_mean": 2.2e-05, "confidence_mean": 1.0, "aleatoric_std": 4e-06, "epistemic_std": 9e-06}], "val_sharpe": 6.1725, "val_psr": 1.0, "val_equity": 3885.06, "val_sortino": 9.2104, "val_return_pct": 288.51, "val_max_dd": 9.22, "val_win_rate": 67.23, "val_profit_factor": 2.891, "val_ic": 0.5201, "val_hit": 66.8, "val_aleatoric_mean": 8e-06, "val_epistemic_mean": 1.7e-05, "val_confidence_mean": 1.0, "val_precision": 0.6958, "val_recall": 0.5452, "val_f1": 0.6114, "val_f2": 0.5699, "val_mcc": 0.3402, "val_accuracy": 0.6706, "val_per_window": [{"fold": "fold_1", "regime": "Pre-crisis upturn + GFC onset", "sharpe": 0.1168, "sortino": 0.1861, "return_pct": 0.22, "equity": 1002.21, "max_dd": 3.71, "win_rate": 46.3, "profit_factor": 1.02, "ic": 0.0017, "hit": 45.87, "n": 109, "precision": 0.4694, "recall": 0.4182, "f1": 0.4423, "f2": 0.4275, "mcc": -0.0636, "accuracy": 0.4679, "tp": 23, "fp": 26, "tn": 28, "fn": 32, "aleatoric_mean": 9e-06, "epistemic_mean": 1.7e-05, "confidence_mean": 1.0, "aleatoric_std": 5e-06, "epistemic_std": 1e-05}, {"fold": "fold_2", "regime": "Post-crash recovery", "sharpe": -0.8186, "sortino": -1.3326, "return_pct": -4.16, "equity": 958.44, "max_dd": 9.22, "win_rate": 46.3, "profit_factor": 0.879, "ic": -0.0131, "hit": 46.3, "n": 108, "precision": 0.5676, "recall": 0.3333, "f1": 0.42, "f2": 0.3633, "mcc": -0.0231, "accuracy": 0.463, "tp": 21, "fp": 16, "tn": 29, "fn": 42, "aleatoric_mean": 1.2e-05, "epistemic_mean": 2.4e-05, "confidence_mean": 1.0, "aleatoric_std": 7e-06, "epistemic_std": 1.3e-05}, {"fold": "fold_3", "regime": "Eurozone debt plateau", "sharpe": 11.1461, "sortino": 25.7167, "return_pct": 44.36, "equity": 1443.63, "max_dd": 0.94, "win_rate": 73.39, "profit_factor": 6.69, "ic": 0.7921, "hit": 72.07, "n": 111, "precision": 0.6176, "recall": 0.8936, "f1": 0.7304, "f2": 0.8203, "mcc": 0.4943, "accuracy": 0.7207, "tp": 42, "fp": 26, "tn": 38, "fn": 5, "aleatoric_mean": 8e-06, "epistemic_mean": 1.6e-05, "confidence_mean": 1.0, "aleatoric_std": 3e-06, "epistemic_std": 7e-06}, {"fold": "fold_4", "regime": "Strong USD downturn", "sharpe": 12.2128, "sortino": 32.7167, "return_pct": 39.8, "equity": 1398.05, "max_dd": 0.82, "win_rate": 78.9, "profit_factor": 9.02, "ic": 0.7391, "hit": 78.18, "n": 110, "precision": 0.9286, "recall": 0.5532, "f1": 0.6933, "f2": 0.6019, "mcc": 0.5922, "accuracy": 0.7909, "tp": 26, "fp": 2, "tn": 61, "fn": 21, "aleatoric_mean": 8e-06, "epistemic_mean": 1.6e-05, "confidence_mean": 1.0, "aleatoric_std": 3e-06, "epistemic_std": 6e-06}, {"fold": "fold_5", "regime": "Low-vol plateau", "sharpe": 10.9039, "sortino": 30.918, "return_pct": 34.82, "equity": 1348.23, "max_dd": 1.2, "win_rate": 73.21, "profit_factor": 6.894, "ic": 0.7762, "hit": 73.21, "n": 112, "precision": 0.8966, "recall": 0.4906, "f1": 0.6341, "f2": 0.5394, "mcc": 0.5012, "accuracy": 0.7321, "tp": 26, "fp": 3, "tn": 56, "fn": 27, "aleatoric_mean": 7e-06, "epistemic_mean": 1.3e-05, "confidence_mean": 1.0, "aleatoric_std": 3e-06, "epistemic_std": 7e-06}, {"fold": "fold_6", "regime": "EUR crisis downturn", "sharpe": 11.2094, "sortino": 29.4831, "return_pct": 23.26, "equity": 1232.58, "max_dd": 0.77, "win_rate": 74.77, "profit_factor": 7.705, "ic": 0.8499, "hit": 74.07, "n": 108, "precision": 0.7879, "recall": 0.5532, "f1": 0.65, "f2": 0.5882, "mcc": 0.4719, "accuracy": 0.7407, "tp": 26, "fp": 7, "tn": 54, "fn": 21, "aleatoric_mean": 6e-06, "epistemic_mean": 1.2e-05, "confidence_mean": 1.0, "aleatoric_std": 2e-06, "epistemic_std": 4e-06}, {"fold": "fold_7", "regime": "Recent mixed/upturn", "sharpe": 8.9995, "sortino": 18.7907, "return_pct": 20.59, "equity": 1205.91, "max_dd": 0.79, "win_rate": 77.27, "profit_factor": 4.392, "ic": 0.6951, "hit": 77.27, "n": 110, "precision": 0.8333, "recall": 0.6604, "f1": 0.7368, "f2": 0.689, "mcc": 0.5529, "accuracy": 0.7727, "tp": 35, "fp": 7, "tn": 50, "fn": 18, "aleatoric_mean": 1e-05, "epistemic_mean": 1.9e-05, "confidence_mean": 1.0, "aleatoric_std": 4e-06, "epistemic_std": 9e-06}], "train_sharpe": 6.7494, "train_psr": 1.0, "train_equity": 1899551.38, "train_sortino": 16.798, "train_return_pct": 189855.14, "train_max_dd": 4.82, "train_win_rate": 73.7, "train_profit_factor": 5.22, "train_ic": 0.6932, "train_hit": 73.41, "train_precision": 0.8152, "train_recall": 0.6303, "train_f1": 0.7109, "train_f2": 0.6603, "train_mcc": 0.4893, "train_accuracy": 0.7365, "train_per_window": [{"fold": "all_train", "regime": "Training data", "sharpe": 6.7494, "sortino": 16.798, "return_pct": 189855.14, "equity": 1899551.38, "max_dd": 4.82, "win_rate": 73.7, "profit_factor": 5.22, "ic": 0.6932, "hit": 73.41, "n": 2478, "precision": 0.8152, "recall": 0.6303, "f1": 0.7109, "f2": 0.6603, "mcc": 0.4893, "accuracy": 0.7365, "tp": 803, "fp": 182, "tn": 1022, "fn": 471}], "experiment_num": 110, "status": "KEEP"}
