{"backbone": "lfm2-350m", "description": "H-Exp4: lr=5e-5 push mean harder", "config": {"seq_len": 60, "lr": 5e-05, "batch_size": 32, "epochs": 20, "weight_decay": 1e-05, "patience": 5, "grad_clip": 1.0, "warmup_epochs": 0, "huber_delta": 1.0, "head_dropout": 0.1}, "composite": -0.8214, "test_pos_folds": 3, "val_pos_folds": 3, "val_loss": -1.72191, "elapsed_sec": 276.7, "timestamp": "2026-04-12T09:00:16", "sharpe": 0.0636, "psr": 0.5399, "equity": 1003.86, "sortino": 0.1114, "return_pct": 0.39, "max_dd": 17.91, "win_rate": 46.37, "profit_factor": 1.011, "ic": -0.018, "hit": 46.07, "aleatoric_mean": 0.050184, "epistemic_mean": 0.008691, "confidence_mean": 0.9461, "per_window": [{"fold": "fold_1", "regime": "Pre-crisis upturn + GFC onset", "sharpe": -0.5942, "sortino": -1.0023, "return_pct": -1.35, "equity": 986.47, "max_dd": 4.22, "win_rate": 50.0, "profit_factor": 0.913, "ic": -0.1014, "hit": 49.06, "n": 53, "aleatoric_mean": 0.102474, "epistemic_mean": 0.00751, "confidence_mean": 0.9034, "aleatoric_std": 0.062184, "epistemic_std": 0.003041}, {"fold": "fold_2", "regime": "Post-crash recovery", "sharpe": 3.087, "sortino": 5.8495, "return_pct": 8.85, "equity": 1088.53, "max_dd": 3.77, "win_rate": 50.88, "profit_factor": 1.641, "ic": 0.1234, "hit": 50.88, "n": 57, "aleatoric_mean": 0.073417, "epistemic_mean": 0.008545, "confidence_mean": 0.9261, "aleatoric_std": 0.051625, "epistemic_std": 0.00304}, {"fold": "fold_3", "regime": "Eurozone debt plateau", "sharpe": -0.4512, "sortino": -0.7268, "return_pct": -0.87, "equity": 991.33, "max_dd": 4.65, "win_rate": 42.59, "profit_factor": 0.931, "ic": 0.0595, "hit": 41.07, "n": 56, "aleatoric_mean": 0.065486, "epistemic_mean": 0.007138, "confidence_mean": 0.9339, "aleatoric_std": 0.046564, "epistemic_std": 0.002445}, {"fold": "fold_4", "regime": "Strong USD downturn", "sharpe": 0.0684, "sortino": 0.1357, "return_pct": 0.07, "equity": 1000.74, "max_dd": 6.99, "win_rate": 46.15, "profit_factor": 1.012, "ic": -0.0741, "hit": 45.76, "n": 118, "aleatoric_mean": 0.040204, "epistemic_mean": 0.007468, "confidence_mean": 0.9556, "aleatoric_std": 0.03737, "epistemic_std": 0.003276}, {"fold": "fold_5", "regime": "Low-vol plateau", "sharpe": -1.7146, "sortino": -2.71, "return_pct": -3.82, "equity": 961.77, "max_dd": 4.33, "win_rate": 46.43, "profit_factor": 0.752, "ic": -0.1155, "hit": 46.43, "n": 112, "aleatoric_mean": 0.020852, "epistemic_mean": 0.007857, "confidence_mean": 0.9723, "aleatoric_std": 0.015143, "epistemic_std": 0.003718}, {"fold": "fold_6", "regime": "EUR crisis downturn", "sharpe": -1.4834, "sortino": -2.586, "return_pct": -6.65, "equity": 933.54, "max_dd": 12.3, "win_rate": 39.13, "profit_factor": 0.791, "ic": -0.074, "hit": 39.13, "n": 115, "aleatoric_mean": 0.076183, "epistemic_mean": 0.007485, "confidence_mean": 0.9242, "aleatoric_std": 0.044218, "epistemic_std": 0.002873}, {"fold": "fold_7", "regime": "Recent mixed/upturn", "sharpe": 1.2197, "sortino": 2.1884, "return_pct": 4.96, "equity": 1049.58, "max_dd": 5.35, "win_rate": 51.79, "profit_factor": 1.233, "ic": 0.0479, "hit": 51.79, "n": 112, "aleatoric_mean": 0.019118, "epistemic_mean": 0.013463, "confidence_mean": 0.9687, "aleatoric_std": 0.020143, "epistemic_std": 0.005217}], "val_sharpe": -0.0214, "val_psr": 0.489, "val_equity": 992.62, "val_sortino": -0.0324, "val_return_pct": -0.74, "val_max_dd": 7.7, "val_win_rate": 51.2, "val_profit_factor": 0.996, "val_ic": -0.0104, "val_hit": 50.96, "val_aleatoric_mean": 0.051595, "val_epistemic_mean": 0.00871, "val_confidence_mean": 0.9474, "val_per_window": [{"fold": "fold_1", "regime": "Pre-crisis upturn + GFC onset", "sharpe": -0.1661, "sortino": -0.2751, "return_pct": -0.32, "equity": 996.84, "max_dd": 3.07, "win_rate": 50.0, "profit_factor": 0.973, "ic": 0.0205, "hit": 49.15, "n": 59, "aleatoric_mean": 0.168841, "epistemic_mean": 0.006809, "confidence_mean": 0.8645, "aleatoric_std": 0.157346, "epistemic_std": 0.002344}, {"fold": "fold_2", "regime": "Post-crash recovery", "sharpe": -1.6993, "sortino": -2.3785, "return_pct": -3.34, "equity": 966.58, "max_dd": 7.7, "win_rate": 53.45, "profit_factor": 0.76, "ic": -0.081, "hit": 53.45, "n": 58, "aleatoric_mean": 0.069515, "epistemic_mean": 0.008137, "confidence_mean": 0.9287, "aleatoric_std": 0.031242, "epistemic_std": 0.003429}, {"fold": "fold_3", "regime": "Eurozone debt plateau", "sharpe": 0.9066, "sortino": 1.5727, "return_pct": 2.04, "equity": 1020.45, "max_dd": 5.57, "win_rate": 54.1, "profit_factor": 1.163, "ic": 0.0981, "hit": 54.1, "n": 61, "aleatoric_mean": 0.019675, "epistemic_mean": 0.008581, "confidence_mean": 0.9727, "aleatoric_std": 0.012198, "epistemic_std": 0.002981}, {"fold": "fold_4", "regime": "Strong USD downturn", "sharpe": 1.0508, "sortino": 1.8298, "return_pct": 2.22, "equity": 1022.2, "max_dd": 4.94, "win_rate": 50.0, "profit_factor": 1.175, "ic": 0.0196, "hit": 50.0, "n": 60, "aleatoric_mean": 0.026699, "epistemic_mean": 0.009572, "confidence_mean": 0.9655, "aleatoric_std": 0.025053, "epistemic_std": 0.003827}, {"fold": "fold_5", "regime": "Low-vol plateau", "sharpe": -0.0181, "sortino": -0.0266, "return_pct": -0.09, "equity": 999.07, "max_dd": 2.65, "win_rate": 48.39, "profit_factor": 0.997, "ic": -0.0718, "hit": 48.39, "n": 62, "aleatoric_mean": 0.021554, "epistemic_mean": 0.009908, "confidence_mean": 0.9696, "aleatoric_std": 0.013585, "epistemic_std": 0.004656}, {"fold": "fold_6", "regime": "EUR crisis downturn", "sharpe": 2.5485, "sortino": 4.5303, "return_pct": 2.64, "equity": 1026.36, "max_dd": 1.32, "win_rate": 56.14, "profit_factor": 1.519, "ic": 0.1179, "hit": 55.17, "n": 58, "aleatoric_mean": 0.015224, "epistemic_mean": 0.008309, "confidence_mean": 0.9771, "aleatoric_std": 0.008615, "epistemic_std": 0.003051}, {"fold": "fold_7", "regime": "Recent mixed/upturn", "sharpe": -2.9565, "sortino": -4.0051, "return_pct": -3.68, "equity": 963.16, "max_dd": 4.41, "win_rate": 46.67, "profit_factor": 0.617, "ic": -0.1095, "hit": 46.67, "n": 60, "aleatoric_mean": 0.042528, "epistemic_mean": 0.009554, "confidence_mean": 0.9514, "aleatoric_std": 0.035316, "epistemic_std": 0.004498}], "train_sharpe": 0.2752, "train_psr": 0.7231, "train_equity": 1158.57, "train_sortino": 0.2535, "train_return_pct": 15.86, "train_max_dd": 39.91, "train_win_rate": 51.49, "train_profit_factor": 1.065, "train_ic": 0.0724, "train_hit": 51.23, "train_per_window": [{"fold": "all_train", "regime": "Training data", "sharpe": 0.2752, "sortino": 0.2535, "return_pct": 15.86, "equity": 1158.57, "max_dd": 39.91, "win_rate": 51.49, "profit_factor": 1.065, "ic": 0.0724, "hit": 51.23, "n": 1382}], "experiment_num": 26, "status": "DISCARD"}
{"backbone": "lfm2-350m", "description": "H-Exp5: lr=3e-5 epochs=30 longer training", "config": {"seq_len": 60, "lr": 3e-05, "batch_size": 32, "epochs": 30, "weight_decay": 1e-05, "patience": 8, "grad_clip": 1.0, "warmup_epochs": 0, "huber_delta": 1.0, "head_dropout": 0.1}, "composite": 0.0226, "test_pos_folds": 6, "val_pos_folds": 2, "val_loss": -1.715327, "elapsed_sec": 395.4, "timestamp": "2026-04-12T09:07:34", "sharpe": 1.8513, "psr": 0.9985, "equity": 1519.66, "sortino": 3.1057, "return_pct": 51.97, "max_dd": 11.24, "win_rate": 54.12, "profit_factor": 1.365, "ic": 0.1149, "hit": 53.77, "aleatoric_mean": 0.061841, "epistemic_mean": 0.007187, "confidence_mean": 0.9385, "per_window": [{"fold": "fold_1", "regime": "Pre-crisis upturn + GFC onset", "sharpe": 2.1881, "sortino": 4.3659, "return_pct": 4.58, "equity": 1045.82, "max_dd": 3.81, "win_rate": 51.92, "profit_factor": 1.399, "ic": -0.0258, "hit": 50.94, "n": 53, "aleatoric_mean": 0.13906, "epistemic_mean": 0.00586, "confidence_mean": 0.8785, "aleatoric_std": 0.093222, "epistemic_std": 0.002689}, {"fold": "fold_2", "regime": "Post-crash recovery", "sharpe": 2.7928, "sortino": 4.7543, "return_pct": 7.99, "equity": 1079.86, "max_dd": 2.43, "win_rate": 57.89, "profit_factor": 1.565, "ic": 0.177, "hit": 57.89, "n": 57, "aleatoric_mean": 0.121675, "epistemic_mean": 0.005731, "confidence_mean": 0.892, "aleatoric_std": 0.091435, "epistemic_std": 0.003235}, {"fold": "fold_3", "regime": "Eurozone debt plateau", "sharpe": 5.5367, "sortino": 10.7822, "return_pct": 9.64, "equity": 1096.42, "max_dd": 1.48, "win_rate": 59.26, "profit_factor": 2.428, "ic": 0.293, "hit": 57.14, "n": 56, "aleatoric_mean": 0.078287, "epistemic_mean": 0.006043, "confidence_mean": 0.9242, "aleatoric_std": 0.052489, "epistemic_std": 0.002817}, {"fold": "fold_4", "regime": "Strong USD downturn", "sharpe": -0.1237, "sortino": -0.2212, "return_pct": -0.89, "equity": 991.05, "max_dd": 11.24, "win_rate": 47.86, "profit_factor": 0.979, "ic": -0.0039, "hit": 47.46, "n": 118, "aleatoric_mean": 0.049952, "epistemic_mean": 0.008068, "confidence_mean": 0.9471, "aleatoric_std": 0.052492, "epistemic_std": 0.003377}, {"fold": "fold_5", "regime": "Low-vol plateau", "sharpe": 1.8957, "sortino": 3.3593, "return_pct": 4.27, "equity": 1042.73, "max_dd": 2.84, "win_rate": 57.14, "profit_factor": 1.371, "ic": 0.079, "hit": 57.14, "n": 112, "aleatoric_mean": 0.021163, "epistemic_mean": 0.008387, "confidence_mean": 0.9715, "aleatoric_std": 0.015949, "epistemic_std": 0.003375}, {"fold": "fold_6", "regime": "EUR crisis downturn", "sharpe": 2.5764, "sortino": 4.1933, "return_pct": 11.89, "equity": 1118.93, "max_dd": 4.22, "win_rate": 57.39, "profit_factor": 1.503, "ic": 0.3259, "hit": 57.39, "n": 115, "aleatoric_mean": 0.075691, "epistemic_mean": 0.006148, "confidence_mean": 0.9266, "aleatoric_std": 0.056131, "epistemic_std": 0.002913}, {"fold": "fold_7", "regime": "Recent mixed/upturn", "sharpe": 1.4934, "sortino": 2.6606, "return_pct": 6.14, "equity": 1061.4, "max_dd": 4.31, "win_rate": 50.89, "profit_factor": 1.292, "ic": 0.168, "hit": 50.89, "n": 112, "aleatoric_mean": 0.025608, "epistemic_mean": 0.008065, "confidence_mean": 0.9681, "aleatoric_std": 0.030561, "epistemic_std": 0.003376}], "val_sharpe": 0.6226, "val_psr": 0.7905, "val_equity": 1075.94, "val_sortino": 1.1005, "val_return_pct": 7.59, "val_max_dd": 7.4, "val_win_rate": 47.6, "val_profit_factor": 1.109, "val_ic": -0.002, "val_hit": 47.37, "val_aleatoric_mean": 0.08405, "val_epistemic_mean": 0.007077, "val_confidence_mean": 0.93, "val_per_window": [{"fold": "fold_1", "regime": "Pre-crisis upturn + GFC onset", "sharpe": -0.4481, "sortino": -0.8611, "return_pct": -0.76, "equity": 992.39, "max_dd": 4.75, "win_rate": 44.83, "profit_factor": 0.929, "ic": -0.0061, "hit": 44.07, "n": 59, "aleatoric_mean": 0.307355, "epistemic_mean": 0.00585, "confidence_mean": 0.8062, "aleatoric_std": 0.348231, "epistemic_std": 0.003018}, {"fold": "fold_2", "regime": "Post-crash recovery", "sharpe": -2.0388, "sortino": -3.689, "return_pct": -3.97, "equity": 960.3, "max_dd": 6.03, "win_rate": 37.93, "profit_factor": 0.719, "ic": -0.2083, "hit": 37.93, "n": 58, "aleatoric_mean": 0.13044, "epistemic_mean": 0.005125, "confidence_mean": 0.8826, "aleatoric_std": 0.054966, "epistemic_std": 0.002595}, {"fold": "fold_3", "regime": "Eurozone debt plateau", "sharpe": 4.9329, "sortino": 10.101, "return_pct": 11.65, "equity": 1116.48, "max_dd": 2.92, "win_rate": 60.66, "profit_factor": 2.292, "ic": 0.1879, "hit": 60.66, "n": 61, "aleatoric_mean": 0.027099, "epistemic_mean": 0.008786, "confidence_mean": 0.9656, "aleatoric_std": 0.017442, "epistemic_std": 0.003727}, {"fold": "fold_4", "regime": "Strong USD downturn", "sharpe": -0.8373, "sortino": -1.5197, "return_pct": -1.91, "equity": 980.87, "max_dd": 3.57, "win_rate": 45.0, "profit_factor": 0.879, "ic": -0.1117, "hit": 45.0, "n": 60, "aleatoric_mean": 0.032609, "epistemic_mean": 0.007248, "confidence_mean": 0.9627, "aleatoric_std": 0.036153, "epistemic_std": 0.002836}, {"fold": "fold_5", "regime": "Low-vol plateau", "sharpe": -0.7788, "sortino": -1.3069, "return_pct": -1.4, "equity": 985.97, "max_dd": 5.94, "win_rate": 46.77, "profit_factor": 0.881, "ic": -0.0869, "hit": 46.77, "n": 62, "aleatoric_mean": 0.018531, "epistemic_mean": 0.008065, "confidence_mean": 0.9743, "aleatoric_std": 0.015329, "epistemic_std": 0.002754}, {"fold": "fold_6", "regime": "EUR crisis downturn", "sharpe": -0.0195, "sortino": -0.0321, "return_pct": -0.04, "equity": 999.56, "max_dd": 2.27, "win_rate": 40.35, "profit_factor": 0.997, "ic": -0.0259, "hit": 39.66, "n": 58, "aleatoric_mean": 0.012853, "epistemic_mean": 0.007972, "confidence_mean": 0.9797, "aleatoric_std": 0.008561, "epistemic_std": 0.00257}, {"fold": "fold_7", "regime": "Recent mixed/upturn", "sharpe": 3.6392, "sortino": 7.7134, "return_pct": 4.61, "equity": 1046.08, "max_dd": 1.78, "win_rate": 56.67, "profit_factor": 1.814, "ic": 0.171, "hit": 56.67, "n": 60, "aleatoric_mean": 0.065493, "epistemic_mean": 0.006375, "confidence_mean": 0.9351, "aleatoric_std": 0.054227, "epistemic_std": 0.002752}], "train_sharpe": 2.0511, "train_psr": 1.0, "train_equity": 4088.65, "train_sortino": 4.788, "train_return_pct": 308.86, "train_max_dd": 7.86, "train_win_rate": 56.8, "train_profit_factor": 1.611, "train_ic": 0.1673, "train_hit": 56.51, "train_per_window": [{"fold": "all_train", "regime": "Training data", "sharpe": 2.0511, "sortino": 4.788, "return_pct": 308.86, "equity": 4088.65, "max_dd": 7.86, "win_rate": 56.8, "profit_factor": 1.611, "ic": 0.1673, "hit": 56.51, "n": 1382}], "experiment_num": 27, "status": "DISCARD"}
{"backbone": "lfm2-350m", "description": "H-Exp6: lr=3e-5 epochs=25 sweet spot", "config": {"seq_len": 60, "lr": 3e-05, "batch_size": 32, "epochs": 25, "weight_decay": 1e-05, "patience": 6, "grad_clip": 1.0, "warmup_epochs": 0, "huber_delta": 1.0, "head_dropout": 0.1}, "composite": -0.4319, "test_pos_folds": 4, "val_pos_folds": 4, "val_loss": -1.617866, "elapsed_sec": 346.2, "timestamp": "2026-04-12T09:13:55", "sharpe": 0.1681, "psr": 0.604, "equity": 1028.62, "sortino": 0.2487, "return_pct": 2.86, "max_dd": 19.28, "win_rate": 48.95, "profit_factor": 1.029, "ic": 0.0459, "hit": 48.64, "aleatoric_mean": 0.080554, "epistemic_mean": 0.007407, "confidence_mean": 0.9253, "per_window": [{"fold": "fold_1", "regime": "Pre-crisis upturn + GFC onset", "sharpe": 0.8528, "sortino": 1.705, "return_pct": 1.71, "equity": 1017.1, "max_dd": 6.35, "win_rate": 50.0, "profit_factor": 1.14, "ic": 0.0015, "hit": 49.06, "n": 53, "aleatoric_mean": 0.190607, "epistemic_mean": 0.00691, "confidence_mean": 0.851, "aleatoric_std": 0.187686, "epistemic_std": 0.002698}, {"fold": "fold_2", "regime": "Post-crash recovery", "sharpe": 2.5494, "sortino": 4.3906, "return_pct": 7.27, "equity": 1072.68, "max_dd": 3.5, "win_rate": 52.63, "profit_factor": 1.505, "ic": 0.1381, "hit": 52.63, "n": 57, "aleatoric_mean": 0.17182, "epistemic_mean": 0.007264, "confidence_mean": 0.8581, "aleatoric_std": 0.138655, "epistemic_std": 0.003278}, {"fold": "fold_3", "regime": "Eurozone debt plateau", "sharpe": 0.6412, "sortino": 0.9935, "return_pct": 1.07, "equity": 1010.72, "max_dd": 2.06, "win_rate": 50.0, "profit_factor": 1.108, "ic": 0.0112, "hit": 48.21, "n": 56, "aleatoric_mean": 0.102631, "epistemic_mean": 0.007577, "confidence_mean": 0.9041, "aleatoric_std": 0.07114, "epistemic_std": 0.003525}, {"fold": "fold_4", "regime": "Strong USD downturn", "sharpe": -1.0237, "sortino": -1.3731, "return_pct": -5.3, "equity": 947.02, "max_dd": 13.02, "win_rate": 47.01, "profit_factor": 0.842, "ic": -0.0172, "hit": 46.61, "n": 118, "aleatoric_mean": 0.069367, "epistemic_mean": 0.0081, "confidence_mean": 0.9312, "aleatoric_std": 0.06812, "epistemic_std": 0.003623}, {"fold": "fold_5", "regime": "Low-vol plateau", "sharpe": -2.387, "sortino": -3.3005, "return_pct": -5.23, "equity": 947.66, "max_dd": 6.74, "win_rate": 42.86, "profit_factor": 0.672, "ic": -0.0562, "hit": 42.86, "n": 112, "aleatoric_mean": 0.01817, "epistemic_mean": 0.007872, "confidence_mean": 0.9748, "aleatoric_std": 0.016382, "epistemic_std": 0.003058}, {"fold": "fold_6", "regime": "EUR crisis downturn", "sharpe": 1.7685, "sortino": 3.2544, "return_pct": 8.0, "equity": 1080.02, "max_dd": 3.32, "win_rate": 54.78, "profit_factor": 1.323, "ic": 0.1226, "hit": 54.78, "n": 115, "aleatoric_mean": 0.086822, "epistemic_mean": 0.007103, "confidence_mean": 0.9171, "aleatoric_std": 0.066803, "epistemic_std": 0.003138}, {"fold": "fold_7", "regime": "Recent mixed/upturn", "sharpe": -0.8813, "sortino": -1.1421, "return_pct": -3.76, "equity": 962.39, "max_dd": 6.48, "win_rate": 48.21, "profit_factor": 0.86, "ic": 0.0607, "hit": 48.21, "n": 112, "aleatoric_mean": 0.038723, "epistemic_mean": 0.006744, "confidence_mean": 0.958, "aleatoric_std": 0.04531, "epistemic_std": 0.002617}], "val_sharpe": 0.6244, "val_psr": 0.7879, "val_equity": 1076.17, "val_sortino": 0.8998, "val_return_pct": 7.62, "val_max_dd": 6.63, "val_win_rate": 54.33, "val_profit_factor": 1.11, "val_ic": 0.0946, "val_hit": 54.07, "val_aleatoric_mean": 0.089729, "val_epistemic_mean": 0.007867, "val_confidence_mean": 0.9241, "val_per_window": [{"fold": "fold_1", "regime": "Pre-crisis upturn + GFC onset", "sharpe": 0.0166, "sortino": 0.0267, "return_pct": -0.03, "equity": 999.73, "max_dd": 2.65, "win_rate": 48.28, "profit_factor": 1.003, "ic": -0.036, "hit": 47.46, "n": 59, "aleatoric_mean": 0.270693, "epistemic_mean": 0.006411, "confidence_mean": 0.8194, "aleatoric_std": 0.297154, "epistemic_std": 0.003866}, {"fold": "fold_2", "regime": "Post-crash recovery", "sharpe": -0.511, "sortino": -0.859, "return_pct": -1.08, "equity": 989.2, "max_dd": 4.73, "win_rate": 53.45, "profit_factor": 0.921, "ic": 0.013, "hit": 53.45, "n": 58, "aleatoric_mean": 0.177266, "epistemic_mean": 0.006812, "confidence_mean": 0.8562, "aleatoric_std": 0.155098, "epistemic_std": 0.002975}, {"fold": "fold_3", "regime": "Eurozone debt plateau", "sharpe": 3.7023, "sortino": 4.0914, "return_pct": 8.77, "equity": 1087.69, "max_dd": 3.01, "win_rate": 68.85, "profit_factor": 1.859, "ic": 0.4721, "hit": 68.85, "n": 61, "aleatoric_mean": 0.045357, "epistemic_mean": 0.009855, "confidence_mean": 0.9487, "aleatoric_std": 0.037201, "epistemic_std": 0.004738}, {"fold": "fold_4", "regime": "Strong USD downturn", "sharpe": -1.1132, "sortino": -2.0049, "return_pct": -2.5, "equity": 974.99, "max_dd": 4.54, "win_rate": 48.33, "profit_factor": 0.843, "ic": -0.0308, "hit": 48.33, "n": 60, "aleatoric_mean": 0.038505, "epistemic_mean": 0.009233, "confidence_mean": 0.9556, "aleatoric_std": 0.040109, "epistemic_std": 0.004183}, {"fold": "fold_5", "regime": "Low-vol plateau", "sharpe": 0.4868, "sortino": 0.7041, "return_pct": 0.79, "equity": 1007.87, "max_dd": 4.04, "win_rate": 54.84, "profit_factor": 1.082, "ic": 0.1129, "hit": 54.84, "n": 62, "aleatoric_mean": 0.017751, "epistemic_mean": 0.008731, "confidence_mean": 0.9743, "aleatoric_std": 0.01317, "epistemic_std": 0.003655}, {"fold": "fold_6", "regime": "EUR crisis downturn", "sharpe": 2.0848, "sortino": 2.9209, "return_pct": 2.16, "equity": 1021.56, "max_dd": 1.56, "win_rate": 56.14, "profit_factor": 1.408, "ic": 0.2118, "hit": 55.17, "n": 58, "aleatoric_mean": 0.010872, "epistemic_mean": 0.007604, "confidence_mean": 0.9819, "aleatoric_std": 0.006729, "epistemic_std": 0.002435}, {"fold": "fold_7", "regime": "Recent mixed/upturn", "sharpe": -0.2367, "sortino": -0.4153, "return_pct": -0.34, "equity": 996.63, "max_dd": 2.52, "win_rate": 50.0, "profit_factor": 0.962, "ic": -0.1547, "hit": 50.0, "n": 60, "aleatoric_mean": 0.074108, "epistemic_mean": 0.006295, "confidence_mean": 0.9287, "aleatoric_std": 0.067772, "epistemic_std": 0.003079}], "train_sharpe": 0.952, "train_psr": 0.9983, "train_equity": 1885.69, "train_sortino": 2.0666, "train_return_pct": 88.57, "train_max_dd": 17.0, "train_win_rate": 53.16, "train_profit_factor": 1.245, "train_ic": 0.0744, "train_hit": 52.89, "train_per_window": [{"fold": "all_train", "regime": "Training data", "sharpe": 0.952, "sortino": 2.0666, "return_pct": 88.57, "equity": 1885.69, "max_dd": 17.0, "win_rate": 53.16, "profit_factor": 1.245, "ic": 0.0744, "hit": 52.89, "n": 1382}], "experiment_num": 28, "status": "DISCARD"}
