{"experiment_num": 1, "description": "lr=1e-4 baseline", "status": "KEEP", "config": {"seq_len": 60, "lr": 0.0001, "batch_size": 32, "epochs": 20, "weight_decay": 1e-05, "patience": 5, "grad_clip": 1.0}, "composite": -1.2637, "test_pos_folds": 5, "val_pos_folds": 3, "sharpe": 1.2466, "psr": 0.9723, "equity": 1322.11, "ic": 0.1401, "hit": 56.02, "per_window": [{"fold": "fold_1", "regime": "Pre-crisis upturn + GFC onset", "sharpe": 0.9369, "sortino": 1.6923, "return_pct": 1.89, "equity": 1018.9, "max_dd": 3.04, "win_rate": 53.85, "profit_factor": 1.155, "ic": 0.1331, "hit": 52.83, "n": 53}, {"fold": "fold_2", "regime": "Post-crash recovery", "sharpe": -0.78, "sortino": -1.1839, "return_pct": -2.38, "equity": 976.21, "max_dd": 8.31, "win_rate": 49.12, "profit_factor": 0.882, "ic": 0.1529, "hit": 49.12, "n": 57}, {"fold": "fold_3", "regime": "Eurozone debt plateau", "sharpe": 2.0279, "sortino": 4.5248, "return_pct": 3.56, "equity": 1035.6, "max_dd": 2.98, "win_rate": 61.11, "profit_factor": 1.382, "ic": 0.0755, "hit": 58.93, "n": 56}, {"fold": "fold_4", "regime": "Strong USD downturn", "sharpe": 1.2901, "sortino": 1.6248, "return_pct": 6.43, "equity": 1064.3, "max_dd": 5.28, "win_rate": 53.85, "profit_factor": 1.242, "ic": 0.2255, "hit": 53.39, "n": 118}, {"fold": "fold_5", "regime": "Low-vol plateau", "sharpe": 1.1273, "sortino": 1.5205, "return_pct": 2.51, "equity": 1025.07, "max_dd": 1.81, "win_rate": 56.25, "profit_factor": 1.206, "ic": -0.0078, "hit": 56.25, "n": 112}, {"fold": "fold_6", "regime": "EUR crisis downturn", "sharpe": 3.8428, "sortino": 6.3394, "return_pct": 18.07, "equity": 1180.66, "max_dd": 4.9, "win_rate": 66.09, "profit_factor": 1.838, "ic": 0.2779, "hit": 66.09, "n": 115}, {"fold": "fold_7", "regime": "Recent mixed/upturn", "sharpe": -0.0394, "sortino": -0.0492, "return_pct": -0.36, "equity": 996.44, "max_dd": 5.27, "win_rate": 51.79, "profit_factor": 0.993, "ic": 0.0483, "hit": 51.79, "n": 112}], "val_loss": 0.000494, "val_sharpe": -0.6637, "val_ic": -0.0193, "val_hit": 46.41, "val_per_window": [{"fold": "fold_1", "regime": "Pre-crisis upturn + GFC onset", "sharpe": 2.1724, "sortino": 4.0233, "return_pct": 3.42, "equity": 1034.17, "max_dd": 2.18, "win_rate": 50.0, "profit_factor": 1.431, "ic": -0.0026, "hit": 49.15, "n": 59}, {"fold": "fold_2", "regime": "Post-crash recovery", "sharpe": -0.2175, "sortino": -0.3459, "return_pct": -0.51, "equity": 994.91, "max_dd": 4.96, "win_rate": 55.17, "profit_factor": 0.965, "ic": 0.0509, "hit": 55.17, "n": 58}, {"fold": "fold_3", "regime": "Eurozone debt plateau", "sharpe": -3.3364, "sortino": -4.5486, "return_pct": -7.53, "equity": 924.66, "max_dd": 8.66, "win_rate": 34.43, "profit_factor": 0.572, "ic": -0.235, "hit": 34.43, "n": 61}, {"fold": "fold_4", "regime": "Strong USD downturn", "sharpe": -0.3957, "sortino": -0.5869, "return_pct": -0.96, "equity": 990.37, "max_dd": 4.92, "win_rate": 53.33, "profit_factor": 0.941, "ic": 0.131, "hit": 53.33, "n": 60}, {"fold": "fold_5", "regime": "Low-vol plateau", "sharpe": -1.927, "sortino": -3.1851, "return_pct": -3.33, "equity": 966.72, "max_dd": 4.26, "win_rate": 37.1, "profit_factor": 0.732, "ic": -0.03, "hit": 37.1, "n": 62}, {"fold": "fold_6", "regime": "EUR crisis downturn", "sharpe": 0.2145, "sortino": 0.4031, "return_pct": 0.2, "equity": 1002.0, "max_dd": 3.34, "win_rate": 45.61, "profit_factor": 1.036, "ic": -0.0971, "hit": 44.83, "n": 58}, {"fold": "fold_7", "regime": "Recent mixed/upturn", "sharpe": 0.3054, "sortino": 0.4668, "return_pct": 0.36, "equity": 1003.57, "max_dd": 3.02, "win_rate": 51.67, "profit_factor": 1.051, "ic": -0.1776, "hit": 51.67, "n": 60}], "train_sharpe": 3.4085, "train_ic": 0.3029, "train_per_window": [{"fold": "all_train", "regime": "Training data (holed)", "sharpe": 3.4085, "sortino": 9.8593, "return_pct": 933.21, "equity": 10332.07, "max_dd": 4.93, "win_rate": 58.84, "profit_factor": 2.243, "ic": 0.3029, "hit": 58.54, "n": 1382}], "elapsed_sec": 226.7, "timestamp": "2026-04-11T09:41:40"}
{"experiment_num": 2, "description": "lr=5e-5 conservative", "status": "KEEP", "config": {"seq_len": 60, "lr": 5e-05, "batch_size": 32, "epochs": 20, "weight_decay": 1e-05, "patience": 5, "grad_clip": 1.0}, "composite": 0.1311, "test_pos_folds": 5, "val_pos_folds": 6, "sharpe": 0.4311, "psr": 0.7511, "equity": 1093.77, "ic": 0.038, "hit": 51.52, "per_window": [{"fold": "fold_1", "regime": "Pre-crisis upturn + GFC onset", "sharpe": 0.1526, "sortino": 0.2624, "return_pct": 0.22, "equity": 1002.17, "max_dd": 2.83, "win_rate": 51.92, "profit_factor": 1.024, "ic": -0.0303, "hit": 50.94, "n": 53}, {"fold": "fold_2", "regime": "Post-crash recovery", "sharpe": -2.4396, "sortino": -3.7807, "return_pct": -6.83, "equity": 931.7, "max_dd": 8.99, "win_rate": 47.37, "profit_factor": 0.676, "ic": -0.0708, "hit": 47.37, "n": 57}, {"fold": "fold_3", "regime": "Eurozone debt plateau", "sharpe": 0.7365, "sortino": 1.276, "return_pct": 1.24, "equity": 1012.42, "max_dd": 2.39, "win_rate": 59.26, "profit_factor": 1.125, "ic": 0.121, "hit": 57.14, "n": 56}, {"fold": "fold_4", "regime": "Strong USD downturn", "sharpe": 3.8507, "sortino": 9.441, "return_pct": 20.52, "equity": 1205.19, "max_dd": 4.17, "win_rate": 55.56, "profit_factor": 1.914, "ic": 0.155, "hit": 55.08, "n": 118}, {"fold": "fold_5", "regime": "Low-vol plateau", "sharpe": 0.726, "sortino": 1.2874, "return_pct": 1.59, "equity": 1015.9, "max_dd": 2.09, "win_rate": 51.79, "profit_factor": 1.128, "ic": 0.1186, "hit": 51.79, "n": 112}, {"fold": "fold_6", "regime": "EUR crisis downturn", "sharpe": 0.1506, "sortino": 0.2451, "return_pct": 0.46, "equity": 1004.57, "max_dd": 6.37, "win_rate": 49.57, "profit_factor": 1.024, "ic": 0.1918, "hit": 49.57, "n": 115}, {"fold": "fold_7", "regime": "Recent mixed/upturn", "sharpe": -1.4363, "sortino": -1.8179, "return_pct": -5.93, "equity": 940.73, "max_dd": 7.02, "win_rate": 49.11, "profit_factor": 0.782, "ic": 0.1524, "hit": 49.11, "n": 112}], "val_loss": 0.000641, "val_sharpe": 2.6947, "val_ic": 0.1652, "val_hit": 56.22, "val_per_window": [{"fold": "fold_1", "regime": "Pre-crisis upturn + GFC onset", "sharpe": 2.6185, "sortino": 5.045, "return_pct": 4.13, "equity": 1041.26, "max_dd": 2.02, "win_rate": 53.45, "profit_factor": 1.54, "ic": 0.1368, "hit": 52.54, "n": 59}, {"fold": "fold_2", "regime": "Post-crash recovery", "sharpe": 3.4791, "sortino": 5.4559, "return_pct": 6.81, "equity": 1068.06, "max_dd": 2.47, "win_rate": 62.07, "profit_factor": 1.758, "ic": 0.1161, "hit": 62.07, "n": 58}, {"fold": "fold_3", "regime": "Eurozone debt plateau", "sharpe": 2.5555, "sortino": 5.3187, "return_pct": 6.02, "equity": 1060.22, "max_dd": 2.88, "win_rate": 47.54, "profit_factor": 1.532, "ic": 0.2597, "hit": 47.54, "n": 61}, {"fold": "fold_4", "regime": "Strong USD downturn", "sharpe": 3.4525, "sortino": 7.9539, "return_pct": 7.56, "equity": 1075.59, "max_dd": 2.66, "win_rate": 56.67, "profit_factor": 1.698, "ic": 0.2168, "hit": 56.67, "n": 60}, {"fold": "fold_5", "regime": "Low-vol plateau", "sharpe": 2.8967, "sortino": 4.3206, "return_pct": 5.01, "equity": 1050.1, "max_dd": 2.84, "win_rate": 59.68, "profit_factor": 1.6, "ic": 0.2169, "hit": 59.68, "n": 62}, {"fold": "fold_6", "regime": "EUR crisis downturn", "sharpe": -0.1887, "sortino": -0.238, "return_pct": -0.22, "equity": 997.8, "max_dd": 2.42, "win_rate": 54.39, "profit_factor": 0.97, "ic": 0.1333, "hit": 53.45, "n": 58}, {"fold": "fold_7", "regime": "Recent mixed/upturn", "sharpe": 3.5244, "sortino": 4.3428, "return_pct": 4.47, "equity": 1044.65, "max_dd": 1.51, "win_rate": 61.67, "profit_factor": 1.78, "ic": 0.3842, "hit": 61.67, "n": 60}], "train_sharpe": 2.9857, "train_ic": 0.2526, "train_per_window": [{"fold": "all_train", "regime": "Training data (holed)", "sharpe": 2.9857, "sortino": 8.5183, "return_pct": 677.46, "equity": 7774.59, "max_dd": 4.33, "win_rate": 57.38, "profit_factor": 2.019, "ic": 0.2526, "hit": 57.09, "n": 1382}], "elapsed_sec": 205.6, "timestamp": "2026-04-11T09:45:05"}
{"experiment_num": 3, "description": "lr=3e-5 very conservative", "status": "KEEP", "config": {"seq_len": 60, "lr": 3e-05, "batch_size": 32, "epochs": 20, "weight_decay": 1e-05, "patience": 5, "grad_clip": 1.0}, "composite": 1.6148, "test_pos_folds": 5, "val_pos_folds": 6, "sharpe": 1.9148, "psr": 0.9989, "equity": 1541.89, "ic": 0.1275, "hit": 53.29, "per_window": [{"fold": "fold_1", "regime": "Pre-crisis upturn + GFC onset", "sharpe": -0.2736, "sortino": -0.4913, "return_pct": -0.68, "equity": 993.17, "max_dd": 3.55, "win_rate": 50.0, "profit_factor": 0.959, "ic": 0.0027, "hit": 49.06, "n": 53}, {"fold": "fold_2", "regime": "Post-crash recovery", "sharpe": -3.2957, "sortino": -5.1448, "return_pct": -8.98, "equity": 910.23, "max_dd": 11.09, "win_rate": 36.84, "profit_factor": 0.589, "ic": -0.0882, "hit": 36.84, "n": 57}, {"fold": "fold_3", "regime": "Eurozone debt plateau", "sharpe": 4.4567, "sortino": 7.5352, "return_pct": 7.83, "equity": 1078.34, "max_dd": 2.37, "win_rate": 57.41, "profit_factor": 2.039, "ic": 0.3894, "hit": 55.36, "n": 56}, {"fold": "fold_4", "regime": "Strong USD downturn", "sharpe": 3.7731, "sortino": 8.3627, "return_pct": 20.08, "equity": 1200.84, "max_dd": 3.18, "win_rate": 55.56, "profit_factor": 1.889, "ic": 0.2452, "hit": 55.08, "n": 118}, {"fold": "fold_5", "regime": "Low-vol plateau", "sharpe": 2.6906, "sortino": 3.8018, "return_pct": 6.1, "equity": 1060.99, "max_dd": 1.8, "win_rate": 56.25, "profit_factor": 1.566, "ic": 0.3316, "hit": 56.25, "n": 112}, {"fold": "fold_6", "regime": "EUR crisis downturn", "sharpe": 3.4407, "sortino": 6.0461, "return_pct": 16.1, "equity": 1161.02, "max_dd": 4.89, "win_rate": 58.26, "profit_factor": 1.724, "ic": 0.1264, "hit": 58.26, "n": 115}, {"fold": "fold_7", "regime": "Recent mixed/upturn", "sharpe": 1.6747, "sortino": 2.9276, "return_pct": 6.93, "equity": 1069.27, "max_dd": 3.84, "win_rate": 52.68, "profit_factor": 1.333, "ic": 0.0257, "hit": 52.68, "n": 112}], "val_loss": 0.001122, "val_sharpe": 2.961, "val_ic": 0.1841, "val_hit": 55.26, "val_per_window": [{"fold": "fold_1", "regime": "Pre-crisis upturn + GFC onset", "sharpe": -0.575, "sortino": -0.8801, "return_pct": -0.96, "equity": 990.4, "max_dd": 3.9, "win_rate": 46.55, "profit_factor": 0.91, "ic": -0.1449, "hit": 45.76, "n": 59}, {"fold": "fold_2", "regime": "Post-crash recovery", "sharpe": 2.4417, "sortino": 4.1631, "return_pct": 4.76, "equity": 1047.61, "max_dd": 2.37, "win_rate": 51.72, "profit_factor": 1.485, "ic": 0.0216, "hit": 51.72, "n": 58}, {"fold": "fold_3", "regime": "Eurozone debt plateau", "sharpe": 4.0917, "sortino": 9.1189, "return_pct": 9.69, "equity": 1096.91, "max_dd": 1.99, "win_rate": 57.38, "profit_factor": 1.986, "ic": 0.3994, "hit": 57.38, "n": 61}, {"fold": "fold_4", "regime": "Strong USD downturn", "sharpe": 3.6449, "sortino": 7.1154, "return_pct": 7.98, "equity": 1079.81, "max_dd": 1.8, "win_rate": 53.33, "profit_factor": 1.749, "ic": 0.1671, "hit": 53.33, "n": 60}, {"fold": "fold_5", "regime": "Low-vol plateau", "sharpe": 2.2399, "sortino": 3.6264, "return_pct": 3.86, "equity": 1038.64, "max_dd": 2.55, "win_rate": 58.06, "profit_factor": 1.438, "ic": 0.1767, "hit": 58.06, "n": 62}, {"fold": "fold_6", "regime": "EUR crisis downturn", "sharpe": 7.3291, "sortino": 19.4293, "return_pct": 7.17, "equity": 1071.65, "max_dd": 1.08, "win_rate": 64.91, "profit_factor": 3.398, "ic": 0.4043, "hit": 63.79, "n": 58}, {"fold": "fold_7", "regime": "Recent mixed/upturn", "sharpe": 3.7672, "sortino": 8.8938, "return_pct": 4.77, "equity": 1047.66, "max_dd": 1.22, "win_rate": 56.67, "profit_factor": 1.853, "ic": 0.3669, "hit": 56.67, "n": 60}], "train_sharpe": 2.174, "train_ic": 0.191, "train_per_window": [{"fold": "all_train", "regime": "Training data (holed)", "sharpe": 2.174, "sortino": 5.4554, "return_pct": 345.34, "equity": 4453.41, "max_dd": 6.53, "win_rate": 56.29, "profit_factor": 1.659, "ic": 0.191, "hit": 56.01, "n": 1382}], "elapsed_sec": 212.3, "timestamp": "2026-04-11T09:48:38"}
{"experiment_num": 4, "description": "lr=2e-4 moderate", "status": "DISCARD", "config": {"seq_len": 60, "lr": 0.0002, "batch_size": 32, "epochs": 20, "weight_decay": 1e-05, "patience": 5, "grad_clip": 1.0}, "composite": 0.1518, "test_pos_folds": 3, "val_pos_folds": 4, "sharpe": 0.8518, "psr": 0.9065, "equity": 1206.36, "ic": 0.0539, "hit": 53.77, "per_window": [{"fold": "fold_1", "regime": "Pre-crisis upturn + GFC onset", "sharpe": -1.3836, "sortino": -2.5798, "return_pct": -2.98, "equity": 970.23, "max_dd": 6.88, "win_rate": 48.08, "profit_factor": 0.809, "ic": -0.0845, "hit": 47.17, "n": 53}, {"fold": "fold_2", "regime": "Post-crash recovery", "sharpe": -2.3612, "sortino": -3.8019, "return_pct": -6.63, "equity": 933.72, "max_dd": 7.23, "win_rate": 40.35, "profit_factor": 0.685, "ic": -0.1634, "hit": 40.35, "n": 57}, {"fold": "fold_3", "regime": "Eurozone debt plateau", "sharpe": 4.8661, "sortino": 11.0046, "return_pct": 8.53, "equity": 1085.28, "max_dd": 1.86, "win_rate": 62.96, "profit_factor": 2.178, "ic": 0.2457, "hit": 60.71, "n": 56}, {"fold": "fold_4", "regime": "Strong USD downturn", "sharpe": 0.5542, "sortino": 0.6555, "return_pct": 2.56, "equity": 1025.6, "max_dd": 6.56, "win_rate": 59.83, "profit_factor": 1.097, "ic": 0.015, "hit": 59.32, "n": 118}, {"fold": "fold_5", "regime": "Low-vol plateau", "sharpe": -0.1544, "sortino": -0.2231, "return_pct": -0.4, "equity": 995.96, "max_dd": 3.25, "win_rate": 50.89, "profit_factor": 0.975, "ic": -0.0253, "hit": 50.89, "n": 112}, {"fold": "fold_6", "regime": "EUR crisis downturn", "sharpe": 4.4074, "sortino": 7.7797, "return_pct": 20.82, "equity": 1208.21, "max_dd": 4.17, "win_rate": 60.0, "profit_factor": 2.011, "ic": 0.3356, "hit": 60.0, "n": 115}, {"fold": "fold_7", "regime": "Recent mixed/upturn", "sharpe": -0.0935, "sortino": -0.1189, "return_pct": -0.58, "equity": 994.22, "max_dd": 5.68, "win_rate": 50.89, "profit_factor": 0.984, "ic": 0.0296, "hit": 50.89, "n": 112}], "val_loss": 0.000311, "val_sharpe": 1.6272, "val_ic": 0.113, "val_hit": 53.83, "val_per_window": [{"fold": "fold_1", "regime": "Pre-crisis upturn + GFC onset", "sharpe": -2.9095, "sortino": -4.1442, "return_pct": -4.49, "equity": 955.12, "max_dd": 4.97, "win_rate": 43.1, "profit_factor": 0.619, "ic": -0.2163, "hit": 42.37, "n": 59}, {"fold": "fold_2", "regime": "Post-crash recovery", "sharpe": -0.6026, "sortino": -0.9728, "return_pct": -1.26, "equity": 987.43, "max_dd": 3.92, "win_rate": 48.28, "profit_factor": 0.907, "ic": 0.1618, "hit": 48.28, "n": 58}, {"fold": "fold_3", "regime": "Eurozone debt plateau", "sharpe": 6.5329, "sortino": 8.5375, "return_pct": 15.22, "equity": 1152.15, "max_dd": 1.35, "win_rate": 72.13, "profit_factor": 3.027, "ic": 0.4302, "hit": 72.13, "n": 61}, {"fold": "fold_4", "regime": "Strong USD downturn", "sharpe": 1.9389, "sortino": 3.1399, "return_pct": 4.2, "equity": 1041.99, "max_dd": 2.8, "win_rate": 58.33, "profit_factor": 1.346, "ic": 0.2709, "hit": 58.33, "n": 60}, {"fold": "fold_5", "regime": "Low-vol plateau", "sharpe": 4.5974, "sortino": 9.8127, "return_pct": 7.91, "equity": 1079.07, "max_dd": 1.29, "win_rate": 58.06, "profit_factor": 2.114, "ic": 0.3054, "hit": 58.06, "n": 62}, {"fold": "fold_6", "regime": "EUR crisis downturn", "sharpe": 2.0895, "sortino": 3.6008, "return_pct": 2.16, "equity": 1021.61, "max_dd": 1.88, "win_rate": 56.14, "profit_factor": 1.409, "ic": 0.1111, "hit": 55.17, "n": 58}, {"fold": "fold_7", "regime": "Recent mixed/upturn", "sharpe": -1.8355, "sortino": -3.0945, "return_pct": -2.34, "equity": 976.6, "max_dd": 2.95, "win_rate": 41.67, "profit_factor": 0.741, "ic": -0.1451, "hit": 41.67, "n": 60}], "train_sharpe": 4.8479, "train_ic": 0.4417, "train_per_window": [{"fold": "all_train", "regime": "Training data (holed)", "sharpe": 4.8479, "sortino": 14.6645, "return_pct": 2521.36, "equity": 26213.59, "max_dd": 4.56, "win_rate": 65.31, "profit_factor": 3.286, "ic": 0.4417, "hit": 64.98, "n": 1382}], "elapsed_sec": 221.6, "timestamp": "2026-04-11T09:52:19"}
{"experiment_num": 5, "description": "lr=3e-4 aggressive", "status": "DISCARD", "config": {"seq_len": 60, "lr": 0.0003, "batch_size": 32, "epochs": 20, "weight_decay": 1e-05, "patience": 5, "grad_clip": 1.0}, "composite": 0.4828, "test_pos_folds": 6, "val_pos_folds": 5, "sharpe": 1.1702, "psr": 0.9679, "equity": 1298.98, "ic": 0.1235, "hit": 54.9, "per_window": [{"fold": "fold_1", "regime": "Pre-crisis upturn + GFC onset", "sharpe": 1.5435, "sortino": 2.8518, "return_pct": 3.19, "equity": 1031.94, "max_dd": 3.34, "win_rate": 50.0, "profit_factor": 1.267, "ic": 0.241, "hit": 49.06, "n": 53}, {"fold": "fold_2", "regime": "Post-crash recovery", "sharpe": -1.8047, "sortino": -2.9019, "return_pct": -5.17, "equity": 948.31, "max_dd": 6.91, "win_rate": 43.86, "profit_factor": 0.749, "ic": -0.0196, "hit": 43.86, "n": 57}, {"fold": "fold_3", "regime": "Eurozone debt plateau", "sharpe": 1.7862, "sortino": 3.1462, "return_pct": 3.13, "equity": 1031.26, "max_dd": 1.52, "win_rate": 57.41, "profit_factor": 1.329, "ic": 0.1834, "hit": 55.36, "n": 56}, {"fold": "fold_4", "regime": "Strong USD downturn", "sharpe": 0.284, "sortino": 0.5011, "return_pct": 1.17, "equity": 1011.71, "max_dd": 11.81, "win_rate": 50.43, "profit_factor": 1.049, "ic": 0.0096, "hit": 50.0, "n": 118}, {"fold": "fold_5", "regime": "Low-vol plateau", "sharpe": 3.8074, "sortino": 7.0083, "return_pct": 8.64, "equity": 1086.39, "max_dd": 2.08, "win_rate": 62.5, "profit_factor": 1.889, "ic": 0.2807, "hit": 62.5, "n": 112}, {"fold": "fold_6", "regime": "EUR crisis downturn", "sharpe": 1.4383, "sortino": 2.3411, "return_pct": 6.43, "equity": 1064.3, "max_dd": 3.14, "win_rate": 58.26, "profit_factor": 1.255, "ic": 0.0413, "hit": 58.26, "n": 115}, {"fold": "fold_7", "regime": "Recent mixed/upturn", "sharpe": 2.3839, "sortino": 4.2381, "return_pct": 10.03, "equity": 1100.32, "max_dd": 2.5, "win_rate": 57.14, "profit_factor": 1.506, "ic": 0.324, "hit": 57.14, "n": 112}], "val_loss": 0.000203, "val_sharpe": 0.7828, "val_ic": 0.1029, "val_hit": 50.72, "val_per_window": [{"fold": "fold_1", "regime": "Pre-crisis upturn + GFC onset", "sharpe": -0.2933, "sortino": -0.4396, "return_pct": -0.52, "equity": 994.83, "max_dd": 5.65, "win_rate": 53.45, "profit_factor": 0.953, "ic": -0.0635, "hit": 52.54, "n": 59}, {"fold": "fold_2", "regime": "Post-crash recovery", "sharpe": 1.0891, "sortino": 1.9171, "return_pct": 2.07, "equity": 1020.69, "max_dd": 4.17, "win_rate": 51.72, "profit_factor": 1.193, "ic": 0.1759, "hit": 51.72, "n": 58}, {"fold": "fold_3", "regime": "Eurozone debt plateau", "sharpe": -1.6591, "sortino": -3.3946, "return_pct": -3.94, "equity": 960.65, "max_dd": 6.97, "win_rate": 42.62, "profit_factor": 0.758, "ic": -0.0804, "hit": 42.62, "n": 61}, {"fold": "fold_4", "regime": "Strong USD downturn", "sharpe": 1.4649, "sortino": 2.4542, "return_pct": 3.14, "equity": 1031.42, "max_dd": 4.79, "win_rate": 55.0, "profit_factor": 1.252, "ic": 0.2915, "hit": 55.0, "n": 60}, {"fold": "fold_5", "regime": "Low-vol plateau", "sharpe": 3.459, "sortino": 5.4332, "return_pct": 5.98, "equity": 1059.82, "max_dd": 2.88, "win_rate": 56.45, "profit_factor": 1.754, "ic": 0.2205, "hit": 56.45, "n": 62}, {"fold": "fold_6", "regime": "EUR crisis downturn", "sharpe": 1.2278, "sortino": 2.0829, "return_pct": 1.26, "equity": 1012.62, "max_dd": 2.66, "win_rate": 49.12, "profit_factor": 1.223, "ic": 0.1644, "hit": 48.28, "n": 58}, {"fold": "fold_7", "regime": "Recent mixed/upturn", "sharpe": 1.3189, "sortino": 2.622, "return_pct": 1.66, "equity": 1016.61, "max_dd": 2.34, "win_rate": 48.33, "profit_factor": 1.24, "ic": 0.0, "hit": 48.33, "n": 60}], "train_sharpe": 5.5093, "train_ic": 0.5349, "train_per_window": [{"fold": "all_train", "regime": "Training data (holed)", "sharpe": 5.5093, "sortino": 17.2277, "return_pct": 3833.13, "equity": 39331.33, "max_dd": 2.77, "win_rate": 68.29, "profit_factor": 3.984, "ic": 0.5349, "hit": 67.95, "n": 1382}], "elapsed_sec": 219.5, "timestamp": "2026-04-11T09:55:59"}
