{"backbone": "mlp", "description": "mlp: Exp44 warmup=3 stabilize residual-MLP early training (Goyal2017) seed=0", "config": {"seq_len": 10, "lr": 0.0005, "batch_size": 32, "epochs": 50, "weight_decay": 1e-05, "patience": 10, "grad_clip": 1.0, "warmup_epochs": 3, "huber_delta": 0.5, "head_dropout": 0.15, "seed": 0, "het_loss": false}, "composite": 4.894, "test_pos_folds": 7, "val_pos_folds": 6, "val_loss": 4.1e-05, "elapsed_sec": 34.6, "timestamp": "2026-04-19T17:35:02", "sharpe": 4.994, "psr": 1.0, "equity": 7182.88, "sortino": 9.162, "return_pct": 618.29, "max_dd": 4.61, "win_rate": 65.53, "profit_factor": 2.572, "ic": 0.4229, "hit": 65.26, "aleatoric_mean": 5e-05, "epistemic_mean": 9.9e-05, "confidence_mean": 0.9999, "precision": 0.636, "recall": 0.7048, "f1": 0.6686, "f2": 0.6899, "mcc": 0.3119, "accuracy": 0.6547, "per_window": [{"fold": "fold_1", "regime": "Pre-crisis upturn + GFC onset", "sharpe": 2.6127, "sortino": 7.1563, "return_pct": 21.14, "equity": 1211.44, "max_dd": 2.32, "win_rate": 60.78, "profit_factor": 1.875, "ic": 0.1623, "hit": 60.19, "n": 103, "precision": 0.6383, "recall": 0.566, "f1": 0.6, "f2": 0.5792, "mcc": 0.2268, "accuracy": 0.6117, "tp": 30, "fp": 17, "tn": 33, "fn": 23, "aleatoric_mean": 9.6e-05, "epistemic_mean": 0.000193, "confidence_mean": 0.9997, "aleatoric_std": 0.000122, "epistemic_std": 0.000245}, {"fold": "fold_2", "regime": "Post-crash recovery", "sharpe": 2.4138, "sortino": 4.0436, "return_pct": 11.83, "equity": 1118.34, "max_dd": 3.36, "win_rate": 58.88, "profit_factor": 1.46, "ic": 0.1525, "hit": 58.88, "n": 107, "precision": 0.5493, "recall": 0.7647, "f1": 0.6393, "f2": 0.7091, "mcc": 0.2043, "accuracy": 0.5888, "tp": 39, "fp": 32, "tn": 24, "fn": 12, "aleatoric_mean": 3.5e-05, "epistemic_mean": 7.1e-05, "confidence_mean": 0.9999, "aleatoric_std": 2.4e-05, "epistemic_std": 4.8e-05}, {"fold": "fold_3", "regime": "Eurozone debt plateau", "sharpe": 8.531, "sortino": 16.2589, "return_pct": 30.38, "equity": 1303.78, "max_dd": 1.36, "win_rate": 73.08, "profit_factor": 3.875, "ic": 0.5764, "hit": 71.7, "n": 106, "precision": 0.6901, "recall": 0.8596, "f1": 0.7656, "f2": 0.8194, "mcc": 0.4354, "accuracy": 0.717, "tp": 49, "fp": 22, "tn": 27, "fn": 8, "aleatoric_mean": 5.5e-05, "epistemic_mean": 0.000109, "confidence_mean": 0.9998, "aleatoric_std": 3.2e-05, "epistemic_std": 6.4e-05}, {"fold": "fold_4", "regime": "Strong USD downturn", "sharpe": 7.4869, "sortino": 14.9908, "return_pct": 68.61, "equity": 1686.09, "max_dd": 1.81, "win_rate": 70.66, "profit_factor": 3.637, "ic": 0.5561, "hit": 70.24, "n": 168, "precision": 0.6947, "recall": 0.7674, "f1": 0.7293, "f2": 0.7517, "mcc": 0.4173, "accuracy": 0.7083, "tp": 66, "fp": 29, "tn": 53, "fn": 20, "aleatoric_mean": 7e-05, "epistemic_mean": 0.000141, "confidence_mean": 0.9998, "aleatoric_std": 5.6e-05, "epistemic_std": 0.000112}, {"fold": "fold_5", "regime": "Low-vol plateau", "sharpe": 7.9105, "sortino": 14.5289, "return_pct": 26.51, "equity": 1265.08, "max_dd": 1.43, "win_rate": 67.9, "profit_factor": 3.864, "ic": 0.5116, "hit": 67.9, "n": 162, "precision": 0.6935, "recall": 0.5658, "f1": 0.6232, "f2": 0.5874, "mcc": 0.3541, "accuracy": 0.679, "tp": 43, "fp": 19, "tn": 67, "fn": 33, "aleatoric_mean": 2.6e-05, "epistemic_mean": 5.3e-05, "confidence_mean": 0.9999, "aleatoric_std": 1.4e-05, "epistemic_std": 2.8e-05}, {"fold": "fold_6", "regime": "EUR crisis downturn", "sharpe": 7.4323, "sortino": 12.4895, "return_pct": 52.34, "equity": 1523.38, "max_dd": 2.68, "win_rate": 66.06, "profit_factor": 3.384, "ic": 0.5989, "hit": 66.06, "n": 165, "precision": 0.7059, "recall": 0.4675, "f1": 0.5625, "f2": 0.5014, "mcc": 0.3207, "accuracy": 0.6606, "tp": 36, "fp": 15, "tn": 73, "fn": 41, "aleatoric_mean": 4.4e-05, "epistemic_mean": 8.8e-05, "confidence_mean": 0.9999, "aleatoric_std": 3e-05, "epistemic_std": 6e-05}, {"fold": "fold_7", "regime": "Recent mixed/upturn", "sharpe": 3.9221, "sortino": 6.8838, "return_pct": 25.14, "equity": 1251.43, "max_dd": 2.6, "win_rate": 59.88, "profit_factor": 1.948, "ic": 0.5075, "hit": 59.88, "n": 162, "precision": 0.5588, "recall": 0.9383, "f1": 0.7005, "f2": 0.8261, "mcc": 0.2691, "accuracy": 0.5988, "tp": 76, "fp": 60, "tn": 21, "fn": 5, "aleatoric_mean": 3.3e-05, "epistemic_mean": 6.5e-05, "confidence_mean": 0.9999, "aleatoric_std": 1.9e-05, "epistemic_std": 3.8e-05}], "val_sharpe": 5.6734, "val_psr": 1.0, "val_equity": 3524.18, "val_sortino": 9.5177, "val_return_pct": 252.42, "val_max_dd": 4.44, "val_win_rate": 65.79, "val_profit_factor": 2.645, "val_ic": 0.4219, "val_hit": 65.36, "val_aleatoric_mean": 3e-05, "val_epistemic_mean": 6e-05, "val_confidence_mean": 0.9999, "val_precision": 0.6529, "val_recall": 0.6082, "val_f1": 0.6298, "val_f2": 0.6167, "val_mcc": 0.3171, "val_accuracy": 0.6602, "val_per_window": [{"fold": "fold_1", "regime": "Pre-crisis upturn + GFC onset", "sharpe": -0.1539, "sortino": -0.2321, "return_pct": -0.46, "equity": 995.39, "max_dd": 4.44, "win_rate": 50.93, "profit_factor": 0.975, "ic": 0.0018, "hit": 50.46, "n": 109, "precision": 0.5185, "recall": 0.5091, "f1": 0.5138, "f2": 0.5109, "mcc": 0.0276, "accuracy": 0.5138, "tp": 28, "fp": 26, "tn": 28, "fn": 27, "aleatoric_mean": 2.9e-05, "epistemic_mean": 5.8e-05, "confidence_mean": 0.9999, "aleatoric_std": 3.1e-05, "epistemic_std": 6.2e-05}, {"fold": "fold_2", "regime": "Post-crash recovery", "sharpe": 1.6874, "sortino": 2.9966, "return_pct": 8.19, "equity": 1081.91, "max_dd": 4.29, "win_rate": 51.85, "profit_factor": 1.305, "ic": 0.0753, "hit": 51.85, "n": 108, "precision": 0.6122, "recall": 0.4762, "f1": 0.5357, "f2": 0.4983, "mcc": 0.0534, "accuracy": 0.5185, "tp": 30, "fp": 19, "tn": 26, "fn": 33, "aleatoric_mean": 5.4e-05, "epistemic_mean": 0.000108, "confidence_mean": 0.9998, "aleatoric_std": 4.9e-05, "epistemic_std": 9.8e-05}, {"fold": "fold_3", "regime": "Eurozone debt plateau", "sharpe": 8.1642, "sortino": 20.7264, "return_pct": 33.89, "equity": 1338.9, "max_dd": 1.52, "win_rate": 74.31, "profit_factor": 3.865, "ic": 0.569, "hit": 72.97, "n": 111, "precision": 0.7568, "recall": 0.5957, "f1": 0.6667, "f2": 0.6222, "mcc": 0.477, "accuracy": 0.7477, "tp": 28, "fp": 9, "tn": 55, "fn": 19, "aleatoric_mean": 3.9e-05, "epistemic_mean": 7.8e-05, "confidence_mean": 0.9999, "aleatoric_std": 2.5e-05, "epistemic_std": 5e-05}, {"fold": "fold_4", "regime": "Strong USD downturn", "sharpe": 8.4343, "sortino": 18.1679, "return_pct": 29.37, "equity": 1293.71, "max_dd": 1.01, "win_rate": 73.39, "profit_factor": 4.207, "ic": 0.5388, "hit": 72.73, "n": 110, "precision": 0.6957, "recall": 0.6809, "f1": 0.6882, "f2": 0.6838, "mcc": 0.46, "accuracy": 0.7364, "tp": 32, "fp": 14, "tn": 49, "fn": 15, "aleatoric_mean": 2.7e-05, "epistemic_mean": 5.4e-05, "confidence_mean": 0.9999, "aleatoric_std": 2.2e-05, "epistemic_std": 4.4e-05}, {"fold": "fold_5", "regime": "Low-vol plateau", "sharpe": 10.1777, "sortino": 27.8415, "return_pct": 32.95, "equity": 1329.46, "max_dd": 0.8, "win_rate": 72.32, "profit_factor": 5.938, "ic": 0.6984, "hit": 72.32, "n": 112, "precision": 0.72, "recall": 0.6792, "f1": 0.699, "f2": 0.687, "mcc": 0.4439, "accuracy": 0.7232, "tp": 36, "fp": 14, "tn": 45, "fn": 17, "aleatoric_mean": 2.7e-05, "epistemic_mean": 5.3e-05, "confidence_mean": 0.9999, "aleatoric_std": 1.9e-05, "epistemic_std": 3.9e-05}, {"fold": "fold_6", "regime": "EUR crisis downturn", "sharpe": 9.0203, "sortino": 18.8443, "return_pct": 19.6, "equity": 1196.04, "max_dd": 0.61, "win_rate": 71.96, "profit_factor": 4.877, "ic": 0.6343, "hit": 71.3, "n": 108, "precision": 0.7073, "recall": 0.617, "f1": 0.6591, "f2": 0.6332, "mcc": 0.4294, "accuracy": 0.7222, "tp": 29, "fp": 12, "tn": 49, "fn": 18, "aleatoric_mean": 1.7e-05, "epistemic_mean": 3.4e-05, "confidence_mean": 0.9999, "aleatoric_std": 8e-06, "epistemic_std": 1.6e-05}, {"fold": "fold_7", "regime": "Recent mixed/upturn", "sharpe": 8.0933, "sortino": 21.3281, "return_pct": 18.81, "equity": 1188.14, "max_dd": 0.72, "win_rate": 65.45, "profit_factor": 3.755, "ic": 0.5225, "hit": 65.45, "n": 110, "precision": 0.619, "recall": 0.7358, "f1": 0.6724, "f2": 0.7091, "mcc": 0.318, "accuracy": 0.6545, "tp": 39, "fp": 24, "tn": 33, "fn": 14, "aleatoric_mean": 1.6e-05, "epistemic_mean": 3.3e-05, "confidence_mean": 1.0, "aleatoric_std": 1.1e-05, "epistemic_std": 2.3e-05}], "train_sharpe": 7.6235, "train_psr": 1.0, "train_equity": 4274442.5, "train_sortino": 23.2125, "train_return_pct": 427344.25, "train_max_dd": 3.27, "train_win_rate": 75.77, "train_profit_factor": 7.021, "train_ic": 0.7393, "train_hit": 75.46, "train_precision": 0.771, "train_recall": 0.7504, "train_f1": 0.7605, "train_f2": 0.7544, "train_mcc": 0.5143, "train_accuracy": 0.7571, "train_per_window": [{"fold": "all_train", "regime": "Training data", "sharpe": 7.6235, "sortino": 23.2125, "return_pct": 427344.25, "equity": 4274442.5, "max_dd": 3.27, "win_rate": 75.77, "profit_factor": 7.021, "ic": 0.7393, "hit": 75.46, "n": 2478, "precision": 0.771, "recall": 0.7504, "f1": 0.7605, "f2": 0.7544, "mcc": 0.5143, "accuracy": 0.7571, "tp": 956, "fp": 284, "tn": 920, "fn": 318}], "experiment_num": 101, "status": "DISCARD"}
{"backbone": "mlp", "description": "mlp: Exp45 huber=0.3 more robust to crisis fat tails (Huber1964) seed=0", "config": {"seq_len": 10, "lr": 0.0005, "batch_size": 32, "epochs": 50, "weight_decay": 1e-05, "patience": 10, "grad_clip": 1.0, "warmup_epochs": 0, "huber_delta": 0.3, "head_dropout": 0.15, "seed": 0, "het_loss": false}, "composite": 5.218, "test_pos_folds": 7, "val_pos_folds": 5, "val_loss": 3.9e-05, "elapsed_sec": 37.5, "timestamp": "2026-04-19T17:37:10", "sharpe": 6.217, "psr": 1.0, "equity": 11032.17, "sortino": 11.2041, "return_pct": 1003.22, "max_dd": 4.19, "win_rate": 69.45, "profit_factor": 3.299, "ic": 0.4907, "hit": 69.17, "aleatoric_mean": 2.6e-05, "epistemic_mean": 5.2e-05, "confidence_mean": 0.9999, "precision": 0.6791, "recall": 0.7173, "f1": 0.6977, "f2": 0.7093, "mcc": 0.3863, "accuracy": 0.6927, "per_window": [{"fold": "fold_1", "regime": "Pre-crisis upturn + GFC onset", "sharpe": 2.4253, "sortino": 6.7276, "return_pct": 19.47, "equity": 1194.69, "max_dd": 4.13, "win_rate": 58.82, "profit_factor": 1.789, "ic": 0.1717, "hit": 58.25, "n": 103, "precision": 0.6087, "recall": 0.5283, "f1": 0.5657, "f2": 0.5426, "mcc": 0.1692, "accuracy": 0.5825, "tp": 28, "fp": 18, "tn": 32, "fn": 25, "aleatoric_mean": 5.3e-05, "epistemic_mean": 0.000106, "confidence_mean": 0.9998, "aleatoric_std": 7.1e-05, "epistemic_std": 0.000142}, {"fold": "fold_2", "regime": "Post-crash recovery", "sharpe": 0.3961, "sortino": 0.6923, "return_pct": 1.64, "equity": 1016.43, "max_dd": 3.3, "win_rate": 51.4, "profit_factor": 1.064, "ic": 0.0676, "hit": 51.4, "n": 107, "precision": 0.4932, "recall": 0.7059, "f1": 0.5806, "f2": 0.6498, "mcc": 0.0485, "accuracy": 0.514, "tp": 36, "fp": 37, "tn": 19, "fn": 15, "aleatoric_mean": 2.1e-05, "epistemic_mean": 4.2e-05, "confidence_mean": 0.9999, "aleatoric_std": 1.6e-05, "epistemic_std": 3.1e-05}, {"fold": "fold_3", "regime": "Eurozone debt plateau", "sharpe": 9.8874, "sortino": 16.7668, "return_pct": 34.51, "equity": 1345.06, "max_dd": 1.61, "win_rate": 76.92, "profit_factor": 4.86, "ic": 0.5901, "hit": 75.47, "n": 106, "precision": 0.7183, "recall": 0.8947, "f1": 0.7969, "f2": 0.8528, "mcc": 0.5158, "accuracy": 0.7547, "tp": 51, "fp": 20, "tn": 29, "fn": 6, "aleatoric_mean": 2.7e-05, "epistemic_mean": 5.4e-05, "confidence_mean": 0.9999, "aleatoric_std": 1.4e-05, "epistemic_std": 2.8e-05}, {"fold": "fold_4", "regime": "Strong USD downturn", "sharpe": 10.0685, "sortino": 20.0167, "return_pct": 92.92, "equity": 1929.21, "max_dd": 1.81, "win_rate": 75.45, "profit_factor": 5.994, "ic": 0.6794, "hit": 75.0, "n": 168, "precision": 0.7528, "recall": 0.7791, "f1": 0.7657, "f2": 0.7737, "mcc": 0.5115, "accuracy": 0.756, "tp": 67, "fp": 22, "tn": 60, "fn": 19, "aleatoric_mean": 3.6e-05, "epistemic_mean": 7.2e-05, "confidence_mean": 0.9999, "aleatoric_std": 2.9e-05, "epistemic_std": 5.8e-05}, {"fold": "fold_5", "regime": "Low-vol plateau", "sharpe": 9.0527, "sortino": 16.878, "return_pct": 29.86, "equity": 1298.57, "max_dd": 1.43, "win_rate": 70.99, "profit_factor": 4.781, "ic": 0.6436, "hit": 70.99, "n": 162, "precision": 0.7377, "recall": 0.5921, "f1": 0.6569, "f2": 0.6164, "mcc": 0.4182, "accuracy": 0.7099, "tp": 45, "fp": 16, "tn": 70, "fn": 31, "aleatoric_mean": 1.2e-05, "epistemic_mean": 2.5e-05, "confidence_mean": 1.0, "aleatoric_std": 7e-06, "epistemic_std": 1.4e-05}, {"fold": "fold_6", "regime": "EUR crisis downturn", "sharpe": 10.3982, "sortino": 21.3203, "return_pct": 72.43, "equity": 1724.33, "max_dd": 1.89, "win_rate": 72.73, "profit_factor": 5.728, "ic": 0.6452, "hit": 72.73, "n": 165, "precision": 0.7667, "recall": 0.5974, "f1": 0.6715, "f2": 0.625, "mcc": 0.4546, "accuracy": 0.7273, "tp": 46, "fp": 14, "tn": 74, "fn": 31, "aleatoric_mean": 2.4e-05, "epistemic_mean": 4.8e-05, "confidence_mean": 0.9999, "aleatoric_std": 1.6e-05, "epistemic_std": 3.2e-05}, {"fold": "fold_7", "regime": "Recent mixed/upturn", "sharpe": 8.5715, "sortino": 14.3397, "return_pct": 56.36, "equity": 1563.57, "max_dd": 1.64, "win_rate": 72.22, "profit_factor": 4.511, "ic": 0.627, "hit": 72.22, "n": 162, "precision": 0.6667, "recall": 0.8889, "f1": 0.7619, "f2": 0.8333, "mcc": 0.4714, "accuracy": 0.7222, "tp": 72, "fp": 36, "tn": 45, "fn": 9, "aleatoric_mean": 1.7e-05, "epistemic_mean": 3.4e-05, "confidence_mean": 0.9999, "aleatoric_std": 1e-05, "epistemic_std": 2e-05}], "val_sharpe": 5.418, "val_psr": 1.0, "val_equity": 3348.8, "val_sortino": 7.9936, "val_return_pct": 234.88, "val_max_dd": 10.85, "val_win_rate": 65.79, "val_profit_factor": 2.528, "val_ic": 0.4536, "val_hit": 65.36, "val_aleatoric_mean": 1.5e-05, "val_epistemic_mean": 3e-05, "val_confidence_mean": 1.0, "val_precision": 0.6576, "val_recall": 0.5945, "val_f1": 0.6245, "val_f2": 0.6061, "val_mcc": 0.3169, "val_accuracy": 0.6602, "val_per_window": [{"fold": "fold_1", "regime": "Pre-crisis upturn + GFC onset", "sharpe": -0.7063, "sortino": -1.1092, "return_pct": -1.84, "equity": 981.62, "max_dd": 3.0, "win_rate": 45.37, "profit_factor": 0.889, "ic": -0.0838, "hit": 44.95, "n": 109, "precision": 0.4643, "recall": 0.4727, "f1": 0.4685, "f2": 0.471, "mcc": -0.0829, "accuracy": 0.4587, "tp": 26, "fp": 30, "tn": 24, "fn": 29, "aleatoric_mean": 1.5e-05, "epistemic_mean": 3.1e-05, "confidence_mean": 1.0, "aleatoric_std": 1.9e-05, "epistemic_std": 3.9e-05}, {"fold": "fold_2", "regime": "Post-crash recovery", "sharpe": -1.5317, "sortino": -2.3508, "return_pct": -7.39, "equity": 926.08, "max_dd": 10.85, "win_rate": 45.37, "profit_factor": 0.785, "ic": 0.026, "hit": 45.37, "n": 108, "precision": 0.55, "recall": 0.3492, "f1": 0.4272, "f2": 0.3767, "mcc": -0.0519, "accuracy": 0.4537, "tp": 22, "fp": 18, "tn": 27, "fn": 41, "aleatoric_mean": 2.7e-05, "epistemic_mean": 5.4e-05, "confidence_mean": 0.9999, "aleatoric_std": 2.2e-05, "epistemic_std": 4.4e-05}, {"fold": "fold_3", "regime": "Eurozone debt plateau", "sharpe": 11.3987, "sortino": 30.8483, "return_pct": 45.16, "equity": 1451.65, "max_dd": 0.84, "win_rate": 79.82, "profit_factor": 7.033, "ic": 0.671, "hit": 78.38, "n": 111, "precision": 0.7551, "recall": 0.7872, "f1": 0.7708, "f2": 0.7806, "mcc": 0.5968, "accuracy": 0.8018, "tp": 37, "fp": 12, "tn": 52, "fn": 10, "aleatoric_mean": 1.8e-05, "epistemic_mean": 3.6e-05, "confidence_mean": 0.9999, "aleatoric_std": 1.3e-05, "epistemic_std": 2.6e-05}, {"fold": "fold_4", "regime": "Strong USD downturn", "sharpe": 8.62, "sortino": 17.9146, "return_pct": 29.94, "equity": 1299.43, "max_dd": 0.92, "win_rate": 73.39, "profit_factor": 4.353, "ic": 0.6069, "hit": 72.73, "n": 110, "precision": 0.6957, "recall": 0.6809, "f1": 0.6882, "f2": 0.6838, "mcc": 0.46, "accuracy": 0.7364, "tp": 32, "fp": 14, "tn": 49, "fn": 15, "aleatoric_mean": 1.4e-05, "epistemic_mean": 2.8e-05, "confidence_mean": 1.0, "aleatoric_std": 1.3e-05, "epistemic_std": 2.6e-05}, {"fold": "fold_5", "regime": "Low-vol plateau", "sharpe": 10.5961, "sortino": 28.9438, "return_pct": 34.04, "equity": 1340.39, "max_dd": 0.62, "win_rate": 75.0, "profit_factor": 6.466, "ic": 0.7241, "hit": 75.0, "n": 112, "precision": 0.766, "recall": 0.6792, "f1": 0.72, "f2": 0.695, "mcc": 0.4986, "accuracy": 0.75, "tp": 36, "fp": 11, "tn": 48, "fn": 17, "aleatoric_mean": 1.3e-05, "epistemic_mean": 2.7e-05, "confidence_mean": 1.0, "aleatoric_std": 1e-05, "epistemic_std": 2.1e-05}, {"fold": "fold_6", "regime": "EUR crisis downturn", "sharpe": 9.2328, "sortino": 21.6819, "return_pct": 19.98, "equity": 1199.84, "max_dd": 0.82, "win_rate": 70.09, "profit_factor": 5.086, "ic": 0.7109, "hit": 69.44, "n": 108, "precision": 0.7419, "recall": 0.4894, "f1": 0.5897, "f2": 0.5251, "mcc": 0.3926, "accuracy": 0.7037, "tp": 23, "fp": 8, "tn": 53, "fn": 24, "aleatoric_mean": 8e-06, "epistemic_mean": 1.6e-05, "confidence_mean": 1.0, "aleatoric_std": 4e-06, "epistemic_std": 8e-06}, {"fold": "fold_7", "regime": "Recent mixed/upturn", "sharpe": 9.4466, "sortino": 25.4555, "return_pct": 21.43, "equity": 1214.31, "max_dd": 0.72, "win_rate": 70.91, "profit_factor": 4.752, "ic": 0.5961, "hit": 70.91, "n": 110, "precision": 0.6721, "recall": 0.7736, "f1": 0.7193, "f2": 0.7509, "mcc": 0.425, "accuracy": 0.7091, "tp": 41, "fp": 20, "tn": 37, "fn": 12, "aleatoric_mean": 9e-06, "epistemic_mean": 1.8e-05, "confidence_mean": 1.0, "aleatoric_std": 5e-06, "epistemic_std": 1.1e-05}], "train_sharpe": 7.9786, "train_psr": 1.0, "train_equity": 5857654.5, "train_sortino": 23.6512, "train_return_pct": 585665.45, "train_max_dd": 4.07, "train_win_rate": 78.32, "train_profit_factor": 8.038, "train_ic": 0.7589, "train_hit": 78.01, "train_precision": 0.7933, "train_recall": 0.7802, "train_f1": 0.7867, "train_f2": 0.7828, "train_mcc": 0.5649, "train_accuracy": 0.7825, "train_per_window": [{"fold": "all_train", "regime": "Training data", "sharpe": 7.9786, "sortino": 23.6512, "return_pct": 585665.45, "equity": 5857654.5, "max_dd": 4.07, "win_rate": 78.32, "profit_factor": 8.038, "ic": 0.7589, "hit": 78.01, "n": 2478, "precision": 0.7933, "recall": 0.7802, "f1": 0.7867, "f2": 0.7828, "mcc": 0.5649, "accuracy": 0.7825, "tp": 994, "fp": 259, "tn": 945, "fn": 280}], "experiment_num": 102, "status": "DISCARD"}
