{"backbone": "xlstm", "description": "xlstm: Exp5 hidden=256", "config": {"seq_len": 10, "lr": 0.0005, "batch_size": 16, "epochs": 80, "weight_decay": 0.001, "patience": 15, "grad_clip": 1.0, "warmup_epochs": 5, "huber_delta": 1.0, "head_dropout": 0.1, "seed": 42, "hidden_size": 256, "het_loss": false}, "composite": -0.4817, "test_pos_folds": 5, "val_pos_folds": 4, "val_loss": 5.3e-05, "elapsed_sec": 364.0, "timestamp": "2026-04-21T13:58:56", "sharpe": 0.5849, "psr": 0.8744, "equity": 1248.55, "sortino": 0.7882, "return_pct": 24.85, "max_dd": 18.08, "win_rate": 52.84, "profit_factor": 1.114, "ic": 0.0452, "hit": 52.62, "aleatoric_mean": 3.5e-05, "epistemic_mean": 7e-05, "confidence_mean": 0.9999, "precision": 0.5172, "recall": 0.657, "f1": 0.5788, "f2": 0.6233, "mcc": 0.0593, "accuracy": 0.5272, "per_window": [{"fold": "fold_1", "regime": "Pre-crisis upturn + GFC onset", "sharpe": 0.2165, "sortino": 0.252, "return_pct": 0.95, "equity": 1009.49, "max_dd": 7.65, "win_rate": 56.86, "profit_factor": 1.052, "ic": 0.0734, "hit": 56.31, "n": 103, "precision": 0.5488, "recall": 0.8491, "f1": 0.6667, "f2": 0.7653, "mcc": 0.1353, "accuracy": 0.5631, "tp": 45, "fp": 37, "tn": 13, "fn": 8, "aleatoric_mean": 5.2e-05, "epistemic_mean": 0.000103, "confidence_mean": 0.9998, "aleatoric_std": 2e-05, "epistemic_std": 4.1e-05}, {"fold": "fold_2", "regime": "Post-crash recovery", "sharpe": 1.6661, "sortino": 2.6535, "return_pct": 7.99, "equity": 1079.86, "max_dd": 4.7, "win_rate": 53.27, "profit_factor": 1.298, "ic": 0.0839, "hit": 53.27, "n": 107, "precision": 0.5098, "recall": 0.5098, "f1": 0.5098, "f2": 0.5098, "mcc": 0.0634, "accuracy": 0.5327, "tp": 26, "fp": 25, "tn": 31, "fn": 25, "aleatoric_mean": 4.2e-05, "epistemic_mean": 8.4e-05, "confidence_mean": 0.9999, "aleatoric_std": 1.3e-05, "epistemic_std": 2.6e-05}, {"fold": "fold_3", "regime": "Eurozone debt plateau", "sharpe": -1.4542, "sortino": -2.2763, "return_pct": -5.15, "equity": 948.47, "max_dd": 7.86, "win_rate": 53.85, "profit_factor": 0.796, "ic": 0.0335, "hit": 52.83, "n": 106, "precision": 0.5408, "recall": 0.9298, "f1": 0.6839, "f2": 0.8129, "mcc": 0.0216, "accuracy": 0.5377, "tp": 53, "fp": 45, "tn": 4, "fn": 4, "aleatoric_mean": 4.1e-05, "epistemic_mean": 8.1e-05, "confidence_mean": 0.9999, "aleatoric_std": 1.5e-05, "epistemic_std": 3e-05}, {"fold": "fold_4", "regime": "Strong USD downturn", "sharpe": 1.3203, "sortino": 2.0009, "return_pct": 10.28, "equity": 1102.79, "max_dd": 13.42, "win_rate": 50.3, "profit_factor": 1.248, "ic": 0.1381, "hit": 50.0, "n": 168, "precision": 0.5091, "recall": 0.6512, "f1": 0.5714, "f2": 0.6167, "mcc": -0.0078, "accuracy": 0.5, "tp": 56, "fp": 54, "tn": 28, "fn": 30, "aleatoric_mean": 3.4e-05, "epistemic_mean": 6.8e-05, "confidence_mean": 0.9999, "aleatoric_std": 1.3e-05, "epistemic_std": 2.6e-05}, {"fold": "fold_5", "regime": "Low-vol plateau", "sharpe": 0.0491, "sortino": 0.0673, "return_pct": 0.08, "equity": 1000.77, "max_dd": 5.39, "win_rate": 51.23, "profit_factor": 1.008, "ic": 0.0193, "hit": 51.23, "n": 162, "precision": 0.4789, "recall": 0.4474, "f1": 0.4626, "f2": 0.4533, "mcc": 0.0172, "accuracy": 0.5123, "tp": 34, "fp": 37, "tn": 49, "fn": 42, "aleatoric_mean": 2.5e-05, "epistemic_mean": 4.9e-05, "confidence_mean": 0.9999, "aleatoric_std": 9e-06, "epistemic_std": 1.9e-05}, {"fold": "fold_6", "regime": "EUR crisis downturn", "sharpe": -0.5298, "sortino": -0.8404, "return_pct": -3.57, "equity": 964.27, "max_dd": 10.31, "win_rate": 46.06, "profit_factor": 0.918, "ic": 0.0001, "hit": 46.06, "n": 165, "precision": 0.4516, "recall": 0.7273, "f1": 0.5572, "f2": 0.6481, "mcc": -0.0525, "accuracy": 0.4606, "tp": 56, "fp": 68, "tn": 20, "fn": 21, "aleatoric_mean": 3.4e-05, "epistemic_mean": 6.7e-05, "confidence_mean": 0.9999, "aleatoric_std": 1.3e-05, "epistemic_std": 2.5e-05}, {"fold": "fold_7", "regime": "Recent mixed/upturn", "sharpe": 2.1864, "sortino": 2.9186, "return_pct": 13.47, "equity": 1134.71, "max_dd": 4.99, "win_rate": 60.49, "profit_factor": 1.448, "ic": 0.1566, "hit": 60.49, "n": 162, "precision": 0.6133, "recall": 0.5679, "f1": 0.5897, "f2": 0.5764, "mcc": 0.2105, "accuracy": 0.6049, "tp": 46, "fp": 29, "tn": 52, "fn": 35, "aleatoric_mean": 3e-05, "epistemic_mean": 5.9e-05, "confidence_mean": 0.9999, "aleatoric_std": 1.1e-05, "epistemic_std": 2.2e-05}], "val_sharpe": 0.0183, "val_psr": 0.5127, "val_equity": 995.11, "val_sortino": 0.0271, "val_return_pct": -0.49, "val_max_dd": 16.14, "val_win_rate": 51.51, "val_profit_factor": 1.003, "val_ic": 0.0239, "val_hit": 51.17, "val_aleatoric_mean": 2.8e-05, "val_epistemic_mean": 5.5e-05, "val_confidence_mean": 0.9999, "val_precision": 0.4894, "val_recall": 0.4411, "val_f1": 0.464, "val_f2": 0.45, "val_mcc": 0.0244, "val_accuracy": 0.5156, "val_per_window": [{"fold": "fold_1", "regime": "Pre-crisis upturn + GFC onset", "sharpe": -1.2536, "sortino": -1.8493, "return_pct": -3.18, "equity": 968.22, "max_dd": 4.32, "win_rate": 47.22, "profit_factor": 0.812, "ic": -0.0077, "hit": 46.79, "n": 109, "precision": 0.4722, "recall": 0.3091, "f1": 0.3736, "f2": 0.332, "mcc": -0.0455, "accuracy": 0.4771, "tp": 17, "fp": 19, "tn": 35, "fn": 38, "aleatoric_mean": 2.5e-05, "epistemic_mean": 5e-05, "confidence_mean": 0.9999, "aleatoric_std": 1.2e-05, "epistemic_std": 2.3e-05}, {"fold": "fold_2", "regime": "Post-crash recovery", "sharpe": 0.1912, "sortino": 0.3106, "return_pct": 0.66, "equity": 1006.55, "max_dd": 7.8, "win_rate": 53.7, "profit_factor": 1.031, "ic": 0.0382, "hit": 53.7, "n": 108, "precision": 0.6383, "recall": 0.4762, "f1": 0.5455, "f2": 0.5017, "mcc": 0.0979, "accuracy": 0.537, "tp": 30, "fp": 17, "tn": 28, "fn": 33, "aleatoric_mean": 4.2e-05, "epistemic_mean": 8.3e-05, "confidence_mean": 0.9999, "aleatoric_std": 1.7e-05, "epistemic_std": 3.3e-05}, {"fold": "fold_3", "regime": "Eurozone debt plateau", "sharpe": -0.4035, "sortino": -0.6345, "return_pct": -1.8, "equity": 981.99, "max_dd": 7.11, "win_rate": 53.21, "profit_factor": 0.937, "ic": 0.0618, "hit": 52.25, "n": 111, "precision": 0.3913, "recall": 0.1915, "f1": 0.2571, "f2": 0.2133, "mcc": -0.0332, "accuracy": 0.5315, "tp": 9, "fp": 14, "tn": 50, "fn": 38, "aleatoric_mean": 3.3e-05, "epistemic_mean": 6.5e-05, "confidence_mean": 0.9999, "aleatoric_std": 1.2e-05, "epistemic_std": 2.4e-05}, {"fold": "fold_4", "regime": "Strong USD downturn", "sharpe": -2.6872, "sortino": -3.6903, "return_pct": -8.92, "equity": 910.76, "max_dd": 9.62, "win_rate": 44.95, "profit_factor": 0.641, "ic": 0.1785, "hit": 44.55, "n": 110, "precision": 0.43, "recall": 0.9149, "f1": 0.585, "f2": 0.7465, "mcc": 0.0174, "accuracy": 0.4455, "tp": 43, "fp": 57, "tn": 6, "fn": 4, "aleatoric_mean": 2.6e-05, "epistemic_mean": 5.3e-05, "confidence_mean": 0.9999, "aleatoric_std": 1e-05, "epistemic_std": 2e-05}, {"fold": "fold_5", "regime": "Low-vol plateau", "sharpe": 1.8995, "sortino": 3.7099, "return_pct": 6.37, "equity": 1063.65, "max_dd": 4.2, "win_rate": 54.46, "profit_factor": 1.372, "ic": 0.044, "hit": 54.46, "n": 112, "precision": 0.5294, "recall": 0.3396, "f1": 0.4138, "f2": 0.3659, "mcc": 0.0743, "accuracy": 0.5446, "tp": 18, "fp": 16, "tn": 43, "fn": 35, "aleatoric_mean": 2.2e-05, "epistemic_mean": 4.5e-05, "confidence_mean": 0.9999, "aleatoric_std": 7e-06, "epistemic_std": 1.5e-05}, {"fold": "fold_6", "regime": "EUR crisis downturn", "sharpe": 1.8158, "sortino": 2.8832, "return_pct": 4.15, "equity": 1041.55, "max_dd": 2.55, "win_rate": 57.01, "profit_factor": 1.358, "ic": 0.0205, "hit": 56.48, "n": 108, "precision": 0.5385, "recall": 0.1489, "f1": 0.2333, "f2": 0.1741, "mcc": 0.0771, "accuracy": 0.5741, "tp": 7, "fp": 6, "tn": 55, "fn": 40, "aleatoric_mean": 2e-05, "epistemic_mean": 4.1e-05, "confidence_mean": 0.9999, "aleatoric_std": 7e-06, "epistemic_std": 1.5e-05}, {"fold": "fold_7", "regime": "Recent mixed/upturn", "sharpe": 1.2857, "sortino": 2.202, "return_pct": 3.06, "equity": 1030.56, "max_dd": 3.35, "win_rate": 50.0, "profit_factor": 1.23, "ic": 0.0793, "hit": 50.0, "n": 110, "precision": 0.4868, "recall": 0.6981, "f1": 0.5736, "f2": 0.6424, "mcc": 0.015, "accuracy": 0.5, "tp": 37, "fp": 39, "tn": 18, "fn": 16, "aleatoric_mean": 2.6e-05, "epistemic_mean": 5.2e-05, "confidence_mean": 0.9999, "aleatoric_std": 1.1e-05, "epistemic_std": 2.1e-05}], "train_sharpe": 2.2926, "train_psr": 1.0, "train_equity": 15044.65, "train_sortino": 4.9425, "train_return_pct": 1404.47, "train_max_dd": 8.35, "train_win_rate": 56.28, "train_profit_factor": 1.659, "train_ic": 0.2111, "train_hit": 56.05, "train_precision": 0.5712, "train_recall": 0.5981, "train_f1": 0.5844, "train_f2": 0.5925, "train_mcc": 0.1233, "train_accuracy": 0.5626, "train_per_window": [{"fold": "all_train", "regime": "Training data", "sharpe": 2.2926, "sortino": 4.9425, "return_pct": 1404.47, "equity": 15044.65, "max_dd": 8.35, "win_rate": 56.28, "profit_factor": 1.659, "ic": 0.2111, "hit": 56.05, "n": 2478, "precision": 0.5712, "recall": 0.5981, "f1": 0.5844, "f2": 0.5925, "mcc": 0.1233, "accuracy": 0.5626, "tp": 762, "fp": 572, "tn": 632, "fn": 512}], "experiment_num": 263, "status": "DISCARD"}
{"backbone": "xlstm", "description": "xlstm: Exp6 seed=0", "config": {"seq_len": 10, "lr": 0.0005, "batch_size": 16, "epochs": 80, "weight_decay": 0.001, "patience": 15, "grad_clip": 1.0, "warmup_epochs": 5, "huber_delta": 1.0, "head_dropout": 0.1, "seed": 0, "het_loss": false}, "composite": -0.3317, "test_pos_folds": 5, "val_pos_folds": 5, "val_loss": 4.2e-05, "elapsed_sec": 430.1, "timestamp": "2026-04-21T14:06:18", "sharpe": 0.0683, "psr": 0.5534, "equity": 1005.94, "sortino": 0.0937, "return_pct": 0.59, "max_dd": 16.12, "win_rate": 50.77, "profit_factor": 1.013, "ic": 0.0481, "hit": 50.57, "aleatoric_mean": 1.8e-05, "epistemic_mean": 3.7e-05, "confidence_mean": 0.9999, "precision": 0.5027, "recall": 0.5821, "f1": 0.5395, "f2": 0.5643, "mcc": 0.0193, "accuracy": 0.5087, "per_window": [{"fold": "fold_1", "regime": "Pre-crisis upturn + GFC onset", "sharpe": 1.1651, "sortino": 1.4092, "return_pct": 8.59, "equity": 1085.86, "max_dd": 7.03, "win_rate": 51.96, "profit_factor": 1.318, "ic": 0.2581, "hit": 51.46, "n": 103, "precision": 0.5155, "recall": 0.9434, "f1": 0.6667, "f2": 0.8091, "mcc": 0.0072, "accuracy": 0.5146, "tp": 50, "fp": 47, "tn": 3, "fn": 3, "aleatoric_mean": 3.4e-05, "epistemic_mean": 6.7e-05, "confidence_mean": 0.9999, "aleatoric_std": 1.9e-05, "epistemic_std": 3.9e-05}, {"fold": "fold_2", "regime": "Post-crash recovery", "sharpe": -0.5132, "sortino": -0.8483, "return_pct": -2.7, "equity": 973.03, "max_dd": 7.31, "win_rate": 52.34, "profit_factor": 0.923, "ic": -0.0356, "hit": 52.34, "n": 107, "precision": 0.5, "recall": 0.5098, "f1": 0.5049, "f2": 0.5078, "mcc": 0.0455, "accuracy": 0.5234, "tp": 26, "fp": 26, "tn": 30, "fn": 25, "aleatoric_mean": 2.1e-05, "epistemic_mean": 4.1e-05, "confidence_mean": 0.9999, "aleatoric_std": 9e-06, "epistemic_std": 1.8e-05}, {"fold": "fold_3", "regime": "Eurozone debt plateau", "sharpe": 0.0035, "sortino": 0.0059, "return_pct": -0.14, "equity": 998.63, "max_dd": 6.2, "win_rate": 48.08, "profit_factor": 1.001, "ic": -0.0513, "hit": 47.17, "n": 106, "precision": 0.5273, "recall": 0.5088, "f1": 0.5179, "f2": 0.5124, "mcc": -0.0218, "accuracy": 0.4906, "tp": 29, "fp": 26, "tn": 23, "fn": 28, "aleatoric_mean": 2.4e-05, "epistemic_mean": 4.7e-05, "confidence_mean": 0.9999, "aleatoric_std": 1.2e-05, "epistemic_std": 2.3e-05}, {"fold": "fold_4", "regime": "Strong USD downturn", "sharpe": -1.1765, "sortino": -1.6279, "return_pct": -9.14, "equity": 908.6, "max_dd": 14.18, "win_rate": 48.5, "profit_factor": 0.821, "ic": 0.0475, "hit": 48.21, "n": 168, "precision": 0.5, "recall": 0.7558, "f1": 0.6019, "f2": 0.6857, "mcc": -0.0441, "accuracy": 0.4881, "tp": 65, "fp": 65, "tn": 17, "fn": 21, "aleatoric_mean": 1.8e-05, "epistemic_mean": 3.6e-05, "confidence_mean": 0.9999, "aleatoric_std": 9e-06, "epistemic_std": 1.8e-05}, {"fold": "fold_5", "regime": "Low-vol plateau", "sharpe": 0.1506, "sortino": 0.2231, "return_pct": 0.42, "equity": 1004.16, "max_dd": 4.35, "win_rate": 51.23, "profit_factor": 1.025, "ic": -0.0375, "hit": 51.23, "n": 162, "precision": 0.4819, "recall": 0.5263, "f1": 0.5031, "f2": 0.5168, "mcc": 0.0263, "accuracy": 0.5123, "tp": 40, "fp": 43, "tn": 43, "fn": 36, "aleatoric_mean": 1.1e-05, "epistemic_mean": 2.2e-05, "confidence_mean": 1.0, "aleatoric_std": 4e-06, "epistemic_std": 8e-06}, {"fold": "fold_6", "regime": "EUR crisis downturn", "sharpe": 0.3254, "sortino": 0.5343, "return_pct": 1.76, "equity": 1017.61, "max_dd": 10.12, "win_rate": 52.12, "profit_factor": 1.054, "ic": 0.1194, "hit": 52.12, "n": 165, "precision": 0.4909, "recall": 0.7013, "f1": 0.5775, "f2": 0.6459, "mcc": 0.0687, "accuracy": 0.5212, "tp": 54, "fp": 56, "tn": 32, "fn": 23, "aleatoric_mean": 1.6e-05, "epistemic_mean": 3.1e-05, "confidence_mean": 1.0, "aleatoric_std": 8e-06, "epistemic_std": 1.6e-05}, {"fold": "fold_7", "regime": "Recent mixed/upturn", "sharpe": 0.4908, "sortino": 0.7877, "return_pct": 2.68, "equity": 1026.85, "max_dd": 7.05, "win_rate": 51.23, "profit_factor": 1.086, "ic": 0.1885, "hit": 51.23, "n": 162, "precision": 0.5333, "recall": 0.1975, "f1": 0.2883, "f2": 0.226, "mcc": 0.0318, "accuracy": 0.5123, "tp": 16, "fp": 14, "tn": 67, "fn": 65, "aleatoric_mean": 1.5e-05, "epistemic_mean": 3e-05, "confidence_mean": 1.0, "aleatoric_std": 6e-06, "epistemic_std": 1.1e-05}], "val_sharpe": 0.3416, "val_psr": 0.7242, "val_equity": 1074.5, "val_sortino": 0.5022, "val_return_pct": 7.45, "val_max_dd": 10.57, "val_win_rate": 53.87, "val_profit_factor": 1.059, "val_ic": 0.0604, "val_hit": 53.52, "val_aleatoric_mean": 1.3e-05, "val_epistemic_mean": 2.7e-05, "val_confidence_mean": 1.0, "val_precision": 0.5204, "val_recall": 0.4192, "val_f1": 0.4643, "val_f2": 0.4361, "val_mcc": 0.0712, "val_accuracy": 0.5404, "val_per_window": [{"fold": "fold_1", "regime": "Pre-crisis upturn + GFC onset", "sharpe": -1.472, "sortino": -2.1498, "return_pct": -3.7, "equity": 962.95, "max_dd": 5.99, "win_rate": 50.93, "profit_factor": 0.783, "ic": -0.1077, "hit": 50.46, "n": 109, "precision": 0.5217, "recall": 0.4364, "f1": 0.4752, "f2": 0.4511, "mcc": 0.0293, "accuracy": 0.5138, "tp": 24, "fp": 22, "tn": 32, "fn": 31, "aleatoric_mean": 1.3e-05, "epistemic_mean": 2.6e-05, "confidence_mean": 1.0, "aleatoric_std": 1.1e-05, "epistemic_std": 2.2e-05}, {"fold": "fold_2", "regime": "Post-crash recovery", "sharpe": 1.043, "sortino": 1.608, "return_pct": 4.89, "equity": 1048.94, "max_dd": 7.73, "win_rate": 53.7, "profit_factor": 1.179, "ic": 0.1587, "hit": 53.7, "n": 108, "precision": 0.5942, "recall": 0.6508, "f1": 0.6212, "f2": 0.6386, "mcc": 0.0293, "accuracy": 0.537, "tp": 41, "fp": 28, "tn": 17, "fn": 22, "aleatoric_mean": 1.9e-05, "epistemic_mean": 3.7e-05, "confidence_mean": 0.9999, "aleatoric_std": 8e-06, "epistemic_std": 1.6e-05}, {"fold": "fold_3", "regime": "Eurozone debt plateau", "sharpe": -1.0399, "sortino": -1.7109, "return_pct": -4.29, "equity": 957.11, "max_dd": 9.1, "win_rate": 48.62, "profit_factor": 0.845, "ic": 0.0717, "hit": 47.75, "n": 111, "precision": 0.3529, "recall": 0.2553, "f1": 0.2963, "f2": 0.2703, "mcc": -0.0948, "accuracy": 0.4865, "tp": 12, "fp": 22, "tn": 42, "fn": 35, "aleatoric_mean": 1.4e-05, "epistemic_mean": 2.9e-05, "confidence_mean": 1.0, "aleatoric_std": 6e-06, "epistemic_std": 1.2e-05}, {"fold": "fold_4", "regime": "Strong USD downturn", "sharpe": 0.7408, "sortino": 0.9805, "return_pct": 2.46, "equity": 1024.63, "max_dd": 7.15, "win_rate": 60.55, "profit_factor": 1.13, "ic": 0.1174, "hit": 60.0, "n": 110, "precision": 0.5333, "recall": 0.6809, "f1": 0.5981, "f2": 0.6452, "mcc": 0.2349, "accuracy": 0.6091, "tp": 32, "fp": 28, "tn": 35, "fn": 15, "aleatoric_mean": 1.3e-05, "epistemic_mean": 2.6e-05, "confidence_mean": 1.0, "aleatoric_std": 6e-06, "epistemic_std": 1.3e-05}, {"fold": "fold_5", "regime": "Low-vol plateau", "sharpe": 1.0258, "sortino": 1.877, "return_pct": 3.35, "equity": 1033.47, "max_dd": 2.6, "win_rate": 50.89, "profit_factor": 1.186, "ic": -0.0305, "hit": 50.89, "n": 112, "precision": 0.4773, "recall": 0.3962, "f1": 0.433, "f2": 0.4102, "mcc": 0.0065, "accuracy": 0.5089, "tp": 21, "fp": 23, "tn": 36, "fn": 32, "aleatoric_mean": 1.1e-05, "epistemic_mean": 2.2e-05, "confidence_mean": 1.0, "aleatoric_std": 7e-06, "epistemic_std": 1.3e-05}, {"fold": "fold_6", "regime": "EUR crisis downturn", "sharpe": 0.997, "sortino": 1.5721, "return_pct": 2.24, "equity": 1022.43, "max_dd": 2.7, "win_rate": 56.07, "profit_factor": 1.183, "ic": 0.0524, "hit": 55.56, "n": 108, "precision": 0.5, "recall": 0.1702, "f1": 0.254, "f2": 0.1961, "mcc": 0.0545, "accuracy": 0.5648, "tp": 8, "fp": 8, "tn": 53, "fn": 39, "aleatoric_mean": 9e-06, "epistemic_mean": 1.9e-05, "confidence_mean": 1.0, "aleatoric_std": 3e-06, "epistemic_std": 6e-06}, {"fold": "fold_7", "regime": "Recent mixed/upturn", "sharpe": 1.123, "sortino": 1.7071, "return_pct": 2.66, "equity": 1026.57, "max_dd": 2.99, "win_rate": 56.36, "profit_factor": 1.198, "ic": 0.175, "hit": 56.36, "n": 110, "precision": 0.6, "recall": 0.283, "f1": 0.3846, "f2": 0.3165, "mcc": 0.1283, "accuracy": 0.5636, "tp": 15, "fp": 10, "tn": 47, "fn": 38, "aleatoric_mean": 1.4e-05, "epistemic_mean": 2.8e-05, "confidence_mean": 1.0, "aleatoric_std": 8e-06, "epistemic_std": 1.6e-05}], "train_sharpe": 3.7944, "train_psr": 1.0, "train_equity": 86110.84, "train_sortino": 10.0571, "train_return_pct": 8511.08, "train_max_dd": 4.2, "train_win_rate": 60.25, "train_profit_factor": 2.351, "train_ic": 0.3381, "train_hit": 60.01, "train_precision": 0.6114, "train_recall": 0.6162, "train_f1": 0.6138, "train_f2": 0.6152, "train_mcc": 0.2018, "train_accuracy": 0.6013, "train_per_window": [{"fold": "all_train", "regime": "Training data", "sharpe": 3.7944, "sortino": 10.0571, "return_pct": 8511.08, "equity": 86110.84, "max_dd": 4.2, "win_rate": 60.25, "profit_factor": 2.351, "ic": 0.3381, "hit": 60.01, "n": 2478, "precision": 0.6114, "recall": 0.6162, "f1": 0.6138, "f2": 0.6152, "mcc": 0.2018, "accuracy": 0.6013, "tp": 785, "fp": 499, "tn": 705, "fn": 489}], "experiment_num": 264, "status": "DISCARD"}
