{"backbone": "lstm", "description": "lstm: Exp22 wd=2e-3 push L2 further", "config": {"seq_len": 10, "lr": 0.001, "batch_size": 32, "epochs": 100, "weight_decay": 0.002, "patience": 15, "grad_clip": 1.0, "warmup_epochs": 0, "huber_delta": 1.0, "head_dropout": 0.25, "seed": 0, "het_loss": false}, "composite": 6.192, "test_pos_folds": 7, "val_pos_folds": 6, "val_loss": 2.8e-05, "elapsed_sec": 31.4, "timestamp": "2026-04-19T19:25:19", "sharpe": 6.4644, "psr": 1.0, "equity": 11986.1, "sortino": 11.6563, "return_pct": 1098.61, "max_dd": 5.84, "win_rate": 71.83, "profit_factor": 3.475, "ic": 0.5555, "hit": 71.53, "aleatoric_mean": 1.2e-05, "epistemic_mean": 2.3e-05, "confidence_mean": 1.0, "precision": 0.7537, "recall": 0.6362, "f1": 0.69, "f2": 0.6567, "mcc": 0.4389, "accuracy": 0.7174, "per_window": [{"fold": "fold_1", "regime": "Pre-crisis upturn + GFC onset", "sharpe": 2.0743, "sortino": 5.863, "return_pct": 16.37, "equity": 1163.71, "max_dd": 5.84, "win_rate": 55.88, "profit_factor": 1.641, "ic": 0.1563, "hit": 55.34, "n": 103, "precision": 0.5574, "recall": 0.6415, "f1": 0.5965, "f2": 0.6227, "mcc": 0.1032, "accuracy": 0.5534, "tp": 34, "fp": 27, "tn": 23, "fn": 19, "aleatoric_mean": 2.1e-05, "epistemic_mean": 4.3e-05, "confidence_mean": 0.9999, "aleatoric_std": 1.9e-05, "epistemic_std": 3.8e-05}, {"fold": "fold_2", "regime": "Post-crash recovery", "sharpe": 1.6623, "sortino": 3.0701, "return_pct": 7.97, "equity": 1079.67, "max_dd": 5.39, "win_rate": 57.01, "profit_factor": 1.298, "ic": 0.1084, "hit": 57.01, "n": 107, "precision": 0.5397, "recall": 0.6667, "f1": 0.5965, "f2": 0.6367, "mcc": 0.151, "accuracy": 0.5701, "tp": 34, "fp": 29, "tn": 27, "fn": 17, "aleatoric_mean": 1.3e-05, "epistemic_mean": 2.6e-05, "confidence_mean": 1.0, "aleatoric_std": 7e-06, "epistemic_std": 1.5e-05}, {"fold": "fold_3", "regime": "Eurozone debt plateau", "sharpe": 10.5797, "sortino": 19.5806, "return_pct": 36.48, "equity": 1364.83, "max_dd": 1.32, "win_rate": 81.73, "profit_factor": 5.472, "ic": 0.6853, "hit": 80.19, "n": 106, "precision": 0.8246, "recall": 0.8246, "f1": 0.8246, "f2": 0.8246, "mcc": 0.6205, "accuracy": 0.8113, "tp": 47, "fp": 10, "tn": 39, "fn": 10, "aleatoric_mean": 1.4e-05, "epistemic_mean": 2.7e-05, "confidence_mean": 1.0, "aleatoric_std": 7e-06, "epistemic_std": 1.4e-05}, {"fold": "fold_4", "regime": "Strong USD downturn", "sharpe": 9.2877, "sortino": 17.0105, "return_pct": 85.76, "equity": 1857.61, "max_dd": 1.81, "win_rate": 76.65, "profit_factor": 5.121, "ic": 0.7417, "hit": 76.19, "n": 168, "precision": 0.9434, "recall": 0.5814, "f1": 0.7194, "f2": 0.6297, "mcc": 0.586, "accuracy": 0.7679, "tp": 50, "fp": 3, "tn": 79, "fn": 36, "aleatoric_mean": 1e-05, "epistemic_mean": 2e-05, "confidence_mean": 1.0, "aleatoric_std": 5e-06, "epistemic_std": 1e-05}, {"fold": "fold_5", "regime": "Low-vol plateau", "sharpe": 10.8112, "sortino": 31.7036, "return_pct": 34.58, "equity": 1345.81, "max_dd": 0.49, "win_rate": 75.31, "profit_factor": 6.788, "ic": 0.7394, "hit": 75.31, "n": 162, "precision": 0.8103, "recall": 0.6184, "f1": 0.7015, "f2": 0.6492, "mcc": 0.5106, "accuracy": 0.7531, "tp": 47, "fp": 11, "tn": 75, "fn": 29, "aleatoric_mean": 6e-06, "epistemic_mean": 1.3e-05, "confidence_mean": 1.0, "aleatoric_std": 2e-06, "epistemic_std": 4e-06}, {"fold": "fold_6", "regime": "EUR crisis downturn", "sharpe": 12.2285, "sortino": 43.7502, "return_pct": 83.52, "equity": 1835.18, "max_dd": 0.82, "win_rate": 76.97, "profit_factor": 8.202, "ic": 0.7767, "hit": 76.97, "n": 165, "precision": 0.8679, "recall": 0.5974, "f1": 0.7077, "f2": 0.6371, "mcc": 0.5533, "accuracy": 0.7697, "tp": 46, "fp": 7, "tn": 81, "fn": 31, "aleatoric_mean": 1.1e-05, "epistemic_mean": 2.2e-05, "confidence_mean": 1.0, "aleatoric_std": 6e-06, "epistemic_std": 1.2e-05}, {"fold": "fold_7", "regime": "Recent mixed/upturn", "sharpe": 7.9481, "sortino": 12.1484, "return_pct": 52.35, "equity": 1523.52, "max_dd": 1.64, "win_rate": 71.6, "profit_factor": 4.004, "ic": 0.6555, "hit": 71.6, "n": 162, "precision": 0.7869, "recall": 0.5926, "f1": 0.6761, "f2": 0.6234, "mcc": 0.4459, "accuracy": 0.716, "tp": 48, "fp": 13, "tn": 68, "fn": 33, "aleatoric_mean": 1.1e-05, "epistemic_mean": 2.2e-05, "confidence_mean": 1.0, "aleatoric_std": 4e-06, "epistemic_std": 9e-06}], "val_sharpe": 6.292, "val_psr": 1.0, "val_equity": 3975.02, "val_sortino": 9.2914, "val_return_pct": 297.5, "val_max_dd": 9.22, "val_win_rate": 67.76, "val_profit_factor": 2.953, "val_ic": 0.5206, "val_hit": 67.32, "val_aleatoric_mean": 8e-06, "val_epistemic_mean": 1.7e-05, "val_confidence_mean": 1.0, "val_precision": 0.6933, "val_recall": 0.5699, "val_f1": 0.6256, "val_f2": 0.5909, "val_mcc": 0.3496, "val_accuracy": 0.6758, "val_per_window": [{"fold": "fold_1", "regime": "Pre-crisis upturn + GFC onset", "sharpe": 0.0832, "sortino": 0.1329, "return_pct": 0.14, "equity": 1001.36, "max_dd": 3.8, "win_rate": 46.3, "profit_factor": 1.014, "ic": 0.0031, "hit": 45.87, "n": 109, "precision": 0.4706, "recall": 0.4364, "f1": 0.4528, "f2": 0.4428, "mcc": -0.0638, "accuracy": 0.4679, "tp": 24, "fp": 27, "tn": 27, "fn": 31, "aleatoric_mean": 9e-06, "epistemic_mean": 1.7e-05, "confidence_mean": 1.0, "aleatoric_std": 5e-06, "epistemic_std": 1e-05}, {"fold": "fold_2", "regime": "Post-crash recovery", "sharpe": -0.8186, "sortino": -1.3326, "return_pct": -4.16, "equity": 958.44, "max_dd": 9.22, "win_rate": 46.3, "profit_factor": 0.879, "ic": -0.0112, "hit": 46.3, "n": 108, "precision": 0.5676, "recall": 0.3333, "f1": 0.42, "f2": 0.3633, "mcc": -0.0231, "accuracy": 0.463, "tp": 21, "fp": 16, "tn": 29, "fn": 42, "aleatoric_mean": 1.2e-05, "epistemic_mean": 2.4e-05, "confidence_mean": 1.0, "aleatoric_std": 7e-06, "epistemic_std": 1.3e-05}, {"fold": "fold_3", "regime": "Eurozone debt plateau", "sharpe": 10.6379, "sortino": 25.3536, "return_pct": 42.71, "equity": 1427.09, "max_dd": 0.94, "win_rate": 71.56, "profit_factor": 6.062, "ic": 0.7927, "hit": 70.27, "n": 111, "precision": 0.6, "recall": 0.8936, "f1": 0.7179, "f2": 0.814, "mcc": 0.467, "accuracy": 0.7027, "tp": 42, "fp": 28, "tn": 36, "fn": 5, "aleatoric_mean": 8e-06, "epistemic_mean": 1.6e-05, "confidence_mean": 1.0, "aleatoric_std": 3e-06, "epistemic_std": 7e-06}, {"fold": "fold_4", "regime": "Strong USD downturn", "sharpe": 12.6634, "sortino": 34.1571, "return_pct": 40.88, "equity": 1408.77, "max_dd": 0.82, "win_rate": 79.82, "profit_factor": 10.024, "ic": 0.7394, "hit": 79.09, "n": 110, "precision": 0.931, "recall": 0.5745, "f1": 0.7105, "f2": 0.6221, "mcc": 0.6093, "accuracy": 0.8, "tp": 27, "fp": 2, "tn": 61, "fn": 20, "aleatoric_mean": 8e-06, "epistemic_mean": 1.6e-05, "confidence_mean": 1.0, "aleatoric_std": 3e-06, "epistemic_std": 6e-06}, {"fold": "fold_5", "regime": "Low-vol plateau", "sharpe": 11.3728, "sortino": 31.5409, "return_pct": 35.99, "equity": 1359.85, "max_dd": 1.2, "win_rate": 73.21, "profit_factor": 7.621, "ic": 0.7756, "hit": 73.21, "n": 112, "precision": 0.8485, "recall": 0.5283, "f1": 0.6512, "f2": 0.5714, "mcc": 0.4858, "accuracy": 0.7321, "tp": 28, "fp": 5, "tn": 54, "fn": 25, "aleatoric_mean": 7e-06, "epistemic_mean": 1.3e-05, "confidence_mean": 1.0, "aleatoric_std": 3e-06, "epistemic_std": 7e-06}, {"fold": "fold_6", "regime": "EUR crisis downturn", "sharpe": 11.9986, "sortino": 31.82, "return_pct": 24.44, "equity": 1244.36, "max_dd": 0.77, "win_rate": 77.57, "profit_factor": 9.266, "ic": 0.8497, "hit": 76.85, "n": 108, "precision": 0.8056, "recall": 0.617, "f1": 0.6988, "f2": 0.6473, "mcc": 0.5282, "accuracy": 0.7685, "tp": 29, "fp": 7, "tn": 54, "fn": 18, "aleatoric_mean": 6e-06, "epistemic_mean": 1.1e-05, "confidence_mean": 1.0, "aleatoric_std": 2e-06, "epistemic_std": 4e-06}, {"fold": "fold_7", "regime": "Recent mixed/upturn", "sharpe": 9.618, "sortino": 19.5931, "return_pct": 21.75, "equity": 1217.46, "max_dd": 0.79, "win_rate": 79.09, "profit_factor": 4.899, "ic": 0.696, "hit": 79.09, "n": 110, "precision": 0.8409, "recall": 0.6981, "f1": 0.7629, "f2": 0.7227, "mcc": 0.5868, "accuracy": 0.7909, "tp": 37, "fp": 7, "tn": 50, "fn": 16, "aleatoric_mean": 1e-05, "epistemic_mean": 1.9e-05, "confidence_mean": 1.0, "aleatoric_std": 4e-06, "epistemic_std": 9e-06}], "train_sharpe": 6.8676, "train_psr": 1.0, "train_equity": 2125906.5, "train_sortino": 17.3069, "train_return_pct": 212490.65, "train_max_dd": 4.01, "train_win_rate": 74.07, "train_profit_factor": 5.42, "train_ic": 0.6931, "train_hit": 73.77, "train_precision": 0.8017, "train_recall": 0.657, "train_f1": 0.7222, "train_f2": 0.6816, "train_mcc": 0.491, "train_accuracy": 0.7401, "train_per_window": [{"fold": "all_train", "regime": "Training data", "sharpe": 6.8676, "sortino": 17.3069, "return_pct": 212490.65, "equity": 2125906.5, "max_dd": 4.01, "win_rate": 74.07, "profit_factor": 5.42, "ic": 0.6931, "hit": 73.77, "n": 2478, "precision": 0.8017, "recall": 0.657, "f1": 0.7222, "f2": 0.6816, "mcc": 0.491, "accuracy": 0.7401, "tp": 837, "fp": 207, "tn": 997, "fn": 437}], "experiment_num": 127, "status": "DISCARD"}
{"backbone": "lstm", "description": "lstm: Exp23 lr=1.5e-3 faster convergence", "config": {"seq_len": 10, "lr": 0.0015, "batch_size": 32, "epochs": 100, "weight_decay": 0.001, "patience": 15, "grad_clip": 1.0, "warmup_epochs": 0, "huber_delta": 1.0, "head_dropout": 0.25, "seed": 0, "het_loss": false}, "composite": 5.553, "test_pos_folds": 7, "val_pos_folds": 7, "val_loss": 2.8e-05, "elapsed_sec": 31.1, "timestamp": "2026-04-19T19:26:14", "sharpe": 5.553, "psr": 1.0, "equity": 8770.48, "sortino": 6.6781, "return_pct": 777.05, "max_dd": 8.42, "win_rate": 68.42, "profit_factor": 2.877, "ic": 0.5259, "hit": 68.14, "aleatoric_mean": 8e-06, "epistemic_mean": 1.6e-05, "confidence_mean": 1.0, "precision": 0.7048, "recall": 0.6154, "f1": 0.657, "f2": 0.6314, "mcc": 0.3668, "accuracy": 0.6824, "per_window": [{"fold": "fold_1", "regime": "Pre-crisis upturn + GFC onset", "sharpe": 0.2733, "sortino": 0.2932, "return_pct": 1.38, "equity": 1013.84, "max_dd": 8.42, "win_rate": 54.9, "profit_factor": 1.067, "ic": 0.0778, "hit": 54.37, "n": 103, "precision": 0.5455, "recall": 0.6792, "f1": 0.605, "f2": 0.6475, "mcc": 0.0826, "accuracy": 0.5437, "tp": 36, "fp": 30, "tn": 20, "fn": 17, "aleatoric_mean": 1.4e-05, "epistemic_mean": 2.7e-05, "confidence_mean": 1.0, "aleatoric_std": 1.1e-05, "epistemic_std": 2.2e-05}, {"fold": "fold_2", "regime": "Post-crash recovery", "sharpe": 0.1024, "sortino": 0.1802, "return_pct": 0.22, "equity": 1002.2, "max_dd": 4.95, "win_rate": 48.6, "profit_factor": 1.016, "ic": 0.0391, "hit": 48.6, "n": 107, "precision": 0.4667, "recall": 0.549, "f1": 0.5045, "f2": 0.5303, "mcc": -0.0226, "accuracy": 0.486, "tp": 28, "fp": 32, "tn": 24, "fn": 23, "aleatoric_mean": 8e-06, "epistemic_mean": 1.6e-05, "confidence_mean": 1.0, "aleatoric_std": 4e-06, "epistemic_std": 7e-06}, {"fold": "fold_3", "regime": "Eurozone debt plateau", "sharpe": 8.8413, "sortino": 15.2101, "return_pct": 31.35, "equity": 1313.51, "max_dd": 2.22, "win_rate": 77.88, "profit_factor": 4.079, "ic": 0.6535, "hit": 76.42, "n": 106, "precision": 0.7222, "recall": 0.9123, "f1": 0.8062, "f2": 0.8667, "mcc": 0.5385, "accuracy": 0.7642, "tp": 52, "fp": 20, "tn": 29, "fn": 5, "aleatoric_mean": 9e-06, "epistemic_mean": 1.7e-05, "confidence_mean": 1.0, "aleatoric_std": 4e-06, "epistemic_std": 7e-06}, {"fold": "fold_4", "regime": "Strong USD downturn", "sharpe": 9.3078, "sortino": 20.9883, "return_pct": 85.95, "equity": 1859.48, "max_dd": 2.3, "win_rate": 74.25, "profit_factor": 5.141, "ic": 0.7712, "hit": 73.81, "n": 168, "precision": 0.9216, "recall": 0.5465, "f1": 0.6861, "f2": 0.5949, "mcc": 0.5411, "accuracy": 0.744, "tp": 47, "fp": 4, "tn": 78, "fn": 39, "aleatoric_mean": 7e-06, "epistemic_mean": 1.4e-05, "confidence_mean": 1.0, "aleatoric_std": 3e-06, "epistemic_std": 5e-06}, {"fold": "fold_5", "regime": "Low-vol plateau", "sharpe": 9.8113, "sortino": 30.6183, "return_pct": 31.96, "equity": 1319.61, "max_dd": 0.54, "win_rate": 69.75, "profit_factor": 5.539, "ic": 0.7218, "hit": 69.75, "n": 162, "precision": 0.7455, "recall": 0.5395, "f1": 0.626, "f2": 0.571, "mcc": 0.397, "accuracy": 0.6975, "tp": 41, "fp": 14, "tn": 72, "fn": 35, "aleatoric_mean": 5e-06, "epistemic_mean": 1e-05, "confidence_mean": 1.0, "aleatoric_std": 2e-06, "epistemic_std": 4e-06}, {"fold": "fold_6", "regime": "EUR crisis downturn", "sharpe": 11.0302, "sortino": 22.4622, "return_pct": 76.39, "equity": 1763.87, "max_dd": 2.56, "win_rate": 75.15, "profit_factor": 6.458, "ic": 0.7337, "hit": 75.15, "n": 165, "precision": 0.7647, "recall": 0.6753, "f1": 0.7172, "f2": 0.6915, "mcc": 0.5002, "accuracy": 0.7515, "tp": 52, "fp": 16, "tn": 72, "fn": 25, "aleatoric_mean": 9e-06, "epistemic_mean": 1.9e-05, "confidence_mean": 1.0, "aleatoric_std": 5e-06, "epistemic_std": 1e-05}, {"fold": "fold_7", "regime": "Recent mixed/upturn", "sharpe": 7.8679, "sortino": 13.8979, "return_pct": 51.83, "equity": 1518.3, "max_dd": 1.69, "win_rate": 69.75, "profit_factor": 3.944, "ic": 0.7338, "hit": 69.75, "n": 162, "precision": 0.8333, "recall": 0.4938, "f1": 0.6202, "f2": 0.5376, "mcc": 0.4326, "accuracy": 0.6975, "tp": 40, "fp": 8, "tn": 73, "fn": 41, "aleatoric_mean": 7e-06, "epistemic_mean": 1.5e-05, "confidence_mean": 1.0, "aleatoric_std": 3e-06, "epistemic_std": 5e-06}], "val_sharpe": 6.8567, "val_psr": 1.0, "val_equity": 4418.48, "val_sortino": 9.9737, "val_return_pct": 341.85, "val_max_dd": 5.88, "val_win_rate": 69.99, "val_profit_factor": 3.271, "val_ic": 0.5323, "val_hit": 69.53, "val_aleatoric_mean": 6e-06, "val_epistemic_mean": 1.2e-05, "val_confidence_mean": 1.0, "val_precision": 0.7528, "val_recall": 0.5507, "val_f1": 0.6361, "val_f2": 0.5819, "val_mcc": 0.4057, "val_accuracy": 0.7005, "val_per_window": [{"fold": "fold_1", "regime": "Pre-crisis upturn + GFC onset", "sharpe": 1.0311, "sortino": 1.7601, "return_pct": 2.56, "equity": 1025.57, "max_dd": 3.41, "win_rate": 48.15, "profit_factor": 1.186, "ic": -0.0247, "hit": 47.71, "n": 109, "precision": 0.4865, "recall": 0.3273, "f1": 0.3913, "f2": 0.3502, "mcc": -0.026, "accuracy": 0.4862, "tp": 18, "fp": 19, "tn": 35, "fn": 37, "aleatoric_mean": 6e-06, "epistemic_mean": 1.1e-05, "confidence_mean": 1.0, "aleatoric_std": 2e-06, "epistemic_std": 5e-06}, {"fold": "fold_2", "regime": "Post-crash recovery", "sharpe": 0.4486, "sortino": 0.7057, "return_pct": 1.92, "equity": 1019.2, "max_dd": 5.88, "win_rate": 52.78, "profit_factor": 1.073, "ic": -0.0074, "hit": 52.78, "n": 108, "precision": 0.6579, "recall": 0.3968, "f1": 0.495, "f2": 0.431, "mcc": 0.1114, "accuracy": 0.5278, "tp": 25, "fp": 13, "tn": 32, "fn": 38, "aleatoric_mean": 1e-05, "epistemic_mean": 2e-05, "confidence_mean": 1.0, "aleatoric_std": 6e-06, "epistemic_std": 1.2e-05}, {"fold": "fold_3", "regime": "Eurozone debt plateau", "sharpe": 12.5354, "sortino": 25.342, "return_pct": 48.6, "equity": 1486.05, "max_dd": 0.94, "win_rate": 81.65, "profit_factor": 8.9, "ic": 0.7859, "hit": 80.18, "n": 111, "precision": 0.7407, "recall": 0.8511, "f1": 0.7921, "f2": 0.8264, "mcc": 0.6251, "accuracy": 0.8108, "tp": 40, "fp": 14, "tn": 50, "fn": 7, "aleatoric_mean": 5e-06, "epistemic_mean": 1.1e-05, "confidence_mean": 1.0, "aleatoric_std": 2e-06, "epistemic_std": 4e-06}, {"fold": "fold_4", "regime": "Strong USD downturn", "sharpe": 12.933, "sortino": 35.2958, "return_pct": 41.5, "equity": 1415.01, "max_dd": 0.64, "win_rate": 81.65, "profit_factor": 10.703, "ic": 0.7456, "hit": 80.91, "n": 110, "precision": 0.8293, "recall": 0.7234, "f1": 0.7727, "f2": 0.7424, "mcc": 0.6264, "accuracy": 0.8182, "tp": 34, "fp": 7, "tn": 56, "fn": 13, "aleatoric_mean": 6e-06, "epistemic_mean": 1.2e-05, "confidence_mean": 1.0, "aleatoric_std": 2e-06, "epistemic_std": 5e-06}, {"fold": "fold_5", "regime": "Low-vol plateau", "sharpe": 11.302, "sortino": 35.026, "return_pct": 35.81, "equity": 1358.12, "max_dd": 0.62, "win_rate": 72.32, "profit_factor": 7.504, "ic": 0.8008, "hit": 72.32, "n": 112, "precision": 0.7895, "recall": 0.566, "f1": 0.6593, "f2": 0.6, "mcc": 0.4539, "accuracy": 0.7232, "tp": 30, "fp": 8, "tn": 51, "fn": 23, "aleatoric_mean": 4e-06, "epistemic_mean": 9e-06, "confidence_mean": 1.0, "aleatoric_std": 1e-06, "epistemic_std": 3e-06}, {"fold": "fold_6", "regime": "EUR crisis downturn", "sharpe": 13.5252, "sortino": 52.4779, "return_pct": 26.51, "equity": 1265.15, "max_dd": 0.39, "win_rate": 81.31, "profit_factor": 13.928, "ic": 0.8867, "hit": 80.56, "n": 108, "precision": 0.8857, "recall": 0.6596, "f1": 0.7561, "f2": 0.6951, "mcc": 0.6292, "accuracy": 0.8148, "tp": 31, "fp": 4, "tn": 57, "fn": 16, "aleatoric_mean": 5e-06, "epistemic_mean": 9e-06, "confidence_mean": 1.0, "aleatoric_std": 2e-06, "epistemic_std": 3e-06}, {"fold": "fold_7", "regime": "Recent mixed/upturn", "sharpe": 7.2146, "sortino": 14.961, "return_pct": 17.0, "equity": 1169.97, "max_dd": 1.05, "win_rate": 71.82, "profit_factor": 3.235, "ic": 0.6966, "hit": 71.82, "n": 110, "precision": 0.9583, "recall": 0.434, "f1": 0.5974, "f2": 0.4873, "mcc": 0.5038, "accuracy": 0.7182, "tp": 23, "fp": 1, "tn": 56, "fn": 30, "aleatoric_mean": 6e-06, "epistemic_mean": 1.3e-05, "confidence_mean": 1.0, "aleatoric_std": 2e-06, "epistemic_std": 4e-06}], "train_sharpe": 6.777, "train_psr": 1.0, "train_equity": 1950377.12, "train_sortino": 17.5973, "train_return_pct": 194937.71, "train_max_dd": 5.85, "train_win_rate": 73.58, "train_profit_factor": 5.266, "train_ic": 0.6829, "train_hit": 73.28, "train_precision": 0.8204, "train_recall": 0.6201, "train_f1": 0.7063, "train_f2": 0.6519, "train_mcc": 0.4885, "train_accuracy": 0.7349, "train_per_window": [{"fold": "all_train", "regime": "Training data", "sharpe": 6.777, "sortino": 17.5973, "return_pct": 194937.71, "equity": 1950377.12, "max_dd": 5.85, "win_rate": 73.58, "profit_factor": 5.266, "ic": 0.6829, "hit": 73.28, "n": 2478, "precision": 0.8204, "recall": 0.6201, "f1": 0.7063, "f2": 0.6519, "mcc": 0.4885, "accuracy": 0.7349, "tp": 790, "fp": 173, "tn": 1031, "fn": 484}], "experiment_num": 128, "status": "DISCARD"}
