{"backbone": "mamba", "description": "mamba: Exp14 dmamba expand=4 seed=7 variance", "config": {"seq_len": 10, "lr": 0.0005, "batch_size": 32, "epochs": 100, "weight_decay": 0.1, "patience": 20, "grad_clip": 1.0, "warmup_epochs": 10, "huber_delta": 1.0, "head_dropout": 0.1, "seed": 7, "mamba_variant": "dmamba", "mamba_expand": 4, "het_loss": false}, "composite": 3.4425, "test_pos_folds": 6, "val_pos_folds": 6, "val_loss": 4e-05, "elapsed_sec": 253.0, "timestamp": "2026-04-20T01:41:26", "sharpe": 4.4939, "psr": 1.0, "equity": 5974.99, "sortino": 8.218, "return_pct": 497.5, "max_dd": 11.26, "win_rate": 63.36, "profit_factor": 2.33, "ic": 0.4125, "hit": 63.1, "aleatoric_mean": 2.1e-05, "epistemic_mean": 4.3e-05, "confidence_mean": 0.9999, "precision": 0.5849, "recall": 0.8877, "f1": 0.7052, "f2": 0.8044, "mcc": 0.314, "accuracy": 0.6331, "per_window": [{"fold": "fold_1", "regime": "Pre-crisis upturn + GFC onset", "sharpe": 3.7431, "sortino": 11.8899, "return_pct": 31.52, "equity": 1315.19, "max_dd": 3.8, "win_rate": 56.86, "profit_factor": 2.508, "ic": 0.2742, "hit": 56.31, "n": 103, "precision": 0.5417, "recall": 0.9811, "f1": 0.698, "f2": 0.8442, "mcc": 0.2008, "accuracy": 0.5631, "tp": 52, "fp": 44, "tn": 6, "fn": 1, "aleatoric_mean": 3.4e-05, "epistemic_mean": 6.7e-05, "confidence_mean": 0.9999, "aleatoric_std": 2.2e-05, "epistemic_std": 4.4e-05}, {"fold": "fold_2", "regime": "Post-crash recovery", "sharpe": -1.3788, "sortino": -2.244, "return_pct": -6.64, "equity": 933.65, "max_dd": 8.27, "win_rate": 48.6, "profit_factor": 0.806, "ic": 0.0379, "hit": 48.6, "n": 107, "precision": 0.4783, "recall": 0.8627, "f1": 0.6154, "f2": 0.7432, "mcc": 0.0081, "accuracy": 0.486, "tp": 44, "fp": 48, "tn": 8, "fn": 7, "aleatoric_mean": 2.8e-05, "epistemic_mean": 5.6e-05, "confidence_mean": 0.9999, "aleatoric_std": 1.8e-05, "epistemic_std": 3.5e-05}, {"fold": "fold_3", "regime": "Eurozone debt plateau", "sharpe": 4.4626, "sortino": 8.2001, "return_pct": 16.3, "equity": 1163.01, "max_dd": 4.81, "win_rate": 65.38, "profit_factor": 2.017, "ic": 0.2936, "hit": 64.15, "n": 106, "precision": 0.6471, "recall": 0.7719, "f1": 0.704, "f2": 0.7432, "mcc": 0.2933, "accuracy": 0.6509, "tp": 44, "fp": 24, "tn": 25, "fn": 13, "aleatoric_mean": 2.9e-05, "epistemic_mean": 5.8e-05, "confidence_mean": 0.9999, "aleatoric_std": 2.2e-05, "epistemic_std": 4.5e-05}, {"fold": "fold_4", "regime": "Strong USD downturn", "sharpe": 7.5161, "sortino": 9.9912, "return_pct": 68.89, "equity": 1688.91, "max_dd": 4.54, "win_rate": 76.05, "profit_factor": 3.657, "ic": 0.6268, "hit": 75.6, "n": 168, "precision": 0.7054, "recall": 0.9186, "f1": 0.798, "f2": 0.8662, "mcc": 0.5473, "accuracy": 0.7619, "tp": 79, "fp": 33, "tn": 49, "fn": 7, "aleatoric_mean": 2.3e-05, "epistemic_mean": 4.5e-05, "confidence_mean": 0.9999, "aleatoric_std": 1.7e-05, "epistemic_std": 3.4e-05}, {"fold": "fold_5", "regime": "Low-vol plateau", "sharpe": 1.4869, "sortino": 2.6019, "return_pct": 4.97, "equity": 1049.68, "max_dd": 2.77, "win_rate": 51.85, "profit_factor": 1.281, "ic": 0.5598, "hit": 51.85, "n": 162, "precision": 0.4934, "recall": 0.9868, "f1": 0.6579, "f2": 0.8224, "mcc": 0.1897, "accuracy": 0.5185, "tp": 75, "fp": 77, "tn": 9, "fn": 1, "aleatoric_mean": 1.1e-05, "epistemic_mean": 2.3e-05, "confidence_mean": 1.0, "aleatoric_std": 8e-06, "epistemic_std": 1.6e-05}, {"fold": "fold_6", "regime": "EUR crisis downturn", "sharpe": 6.2109, "sortino": 11.2108, "return_pct": 43.52, "equity": 1435.17, "max_dd": 3.7, "win_rate": 64.24, "profit_factor": 2.754, "ic": 0.5512, "hit": 64.24, "n": 165, "precision": 0.5849, "recall": 0.8052, "f1": 0.6776, "f2": 0.7488, "mcc": 0.3177, "accuracy": 0.6424, "tp": 62, "fp": 44, "tn": 44, "fn": 15, "aleatoric_mean": 2.3e-05, "epistemic_mean": 4.6e-05, "confidence_mean": 0.9999, "aleatoric_std": 1.5e-05, "epistemic_std": 3e-05}, {"fold": "fold_7", "regime": "Recent mixed/upturn", "sharpe": 9.8796, "sortino": 24.2174, "return_pct": 64.44, "equity": 1644.43, "max_dd": 1.31, "win_rate": 73.46, "profit_factor": 5.861, "ic": 0.6319, "hit": 73.46, "n": 162, "precision": 0.6827, "recall": 0.8765, "f1": 0.7676, "f2": 0.8294, "mcc": 0.4893, "accuracy": 0.7346, "tp": 71, "fp": 33, "tn": 48, "fn": 10, "aleatoric_mean": 1.2e-05, "epistemic_mean": 2.3e-05, "confidence_mean": 1.0, "aleatoric_std": 6e-06, "epistemic_std": 1.1e-05}], "val_sharpe": 3.6425, "val_psr": 1.0, "val_equity": 2302.43, "val_sortino": 5.8682, "val_return_pct": 130.24, "val_max_dd": 10.05, "val_win_rate": 58.06, "val_profit_factor": 1.857, "val_ic": 0.3572, "val_hit": 57.68, "val_aleatoric_mean": 1.6e-05, "val_epistemic_mean": 3.1e-05, "val_confidence_mean": 1.0, "val_precision": 0.5345, "val_recall": 0.8712, "val_f1": 0.6625, "val_f2": 0.7737, "val_mcc": 0.2198, "val_accuracy": 0.5781, "val_per_window": [{"fold": "fold_1", "regime": "Pre-crisis upturn + GFC onset", "sharpe": 1.4417, "sortino": 2.5425, "return_pct": 3.62, "equity": 1036.16, "max_dd": 2.74, "win_rate": 49.07, "profit_factor": 1.27, "ic": -0.1952, "hit": 48.62, "n": 109, "precision": 0.4951, "recall": 0.9273, "f1": 0.6456, "f2": 0.7895, "mcc": -0.0782, "accuracy": 0.4862, "tp": 51, "fp": 52, "tn": 2, "fn": 4, "aleatoric_mean": 1.8e-05, "epistemic_mean": 3.6e-05, "confidence_mean": 0.9999, "aleatoric_std": 2e-05, "epistemic_std": 3.9e-05}, {"fold": "fold_2", "regime": "Post-crash recovery", "sharpe": -0.2423, "sortino": -0.3673, "return_pct": -1.44, "equity": 985.58, "max_dd": 10.05, "win_rate": 50.0, "profit_factor": 0.962, "ic": -0.0709, "hit": 50.0, "n": 108, "precision": 0.5556, "recall": 0.7143, "f1": 0.625, "f2": 0.6757, "mcc": -0.0976, "accuracy": 0.5, "tp": 45, "fp": 36, "tn": 9, "fn": 18, "aleatoric_mean": 2.6e-05, "epistemic_mean": 5.3e-05, "confidence_mean": 0.9999, "aleatoric_std": 1.5e-05, "epistemic_std": 3.1e-05}, {"fold": "fold_3", "regime": "Eurozone debt plateau", "sharpe": 6.2032, "sortino": 15.3506, "return_pct": 26.1, "equity": 1260.96, "max_dd": 1.6, "win_rate": 60.55, "profit_factor": 2.764, "ic": 0.6351, "hit": 59.46, "n": 111, "precision": 0.5114, "recall": 0.9574, "f1": 0.6667, "f2": 0.8152, "mcc": 0.3481, "accuracy": 0.5946, "tp": 45, "fp": 43, "tn": 21, "fn": 2, "aleatoric_mean": 1.9e-05, "epistemic_mean": 3.9e-05, "confidence_mean": 0.9999, "aleatoric_std": 1.4e-05, "epistemic_std": 2.7e-05}, {"fold": "fold_4", "regime": "Strong USD downturn", "sharpe": 5.5484, "sortino": 12.6691, "return_pct": 19.8, "equity": 1198.03, "max_dd": 2.31, "win_rate": 62.39, "profit_factor": 2.528, "ic": 0.7069, "hit": 61.82, "n": 110, "precision": 0.5294, "recall": 0.9574, "f1": 0.6818, "f2": 0.8242, "mcc": 0.3807, "accuracy": 0.6182, "tp": 45, "fp": 40, "tn": 23, "fn": 2, "aleatoric_mean": 1.2e-05, "epistemic_mean": 2.4e-05, "confidence_mean": 1.0, "aleatoric_std": 8e-06, "epistemic_std": 1.7e-05}, {"fold": "fold_5", "regime": "Low-vol plateau", "sharpe": 3.9947, "sortino": 8.0022, "return_pct": 13.66, "equity": 1136.64, "max_dd": 5.19, "win_rate": 58.93, "profit_factor": 1.949, "ic": 0.4306, "hit": 58.93, "n": 112, "precision": 0.5385, "recall": 0.9245, "f1": 0.6806, "f2": 0.8086, "mcc": 0.272, "accuracy": 0.5893, "tp": 49, "fp": 42, "tn": 17, "fn": 4, "aleatoric_mean": 1.2e-05, "epistemic_mean": 2.4e-05, "confidence_mean": 1.0, "aleatoric_std": 8e-06, "epistemic_std": 1.6e-05}, {"fold": "fold_6", "regime": "EUR crisis downturn", "sharpe": 9.6902, "sortino": 25.9863, "return_pct": 20.78, "equity": 1207.83, "max_dd": 0.77, "win_rate": 67.29, "profit_factor": 5.574, "ic": 0.6996, "hit": 66.67, "n": 108, "precision": 0.5833, "recall": 0.8936, "f1": 0.7059, "f2": 0.8077, "mcc": 0.4226, "accuracy": 0.6759, "tp": 42, "fp": 30, "tn": 31, "fn": 5, "aleatoric_mean": 9e-06, "epistemic_mean": 1.8e-05, "confidence_mean": 1.0, "aleatoric_std": 4e-06, "epistemic_std": 7e-06}, {"fold": "fold_7", "regime": "Recent mixed/upturn", "sharpe": 3.5962, "sortino": 6.7331, "return_pct": 8.71, "equity": 1087.1, "max_dd": 2.3, "win_rate": 58.18, "profit_factor": 1.785, "ic": 0.4087, "hit": 58.18, "n": 110, "precision": 0.5467, "recall": 0.7736, "f1": 0.6406, "f2": 0.7143, "mcc": 0.19, "accuracy": 0.5818, "tp": 41, "fp": 34, "tn": 23, "fn": 12, "aleatoric_mean": 1.3e-05, "epistemic_mean": 2.6e-05, "confidence_mean": 1.0, "aleatoric_std": 9e-06, "epistemic_std": 1.8e-05}], "train_sharpe": 5.1294, "train_psr": 1.0, "train_equity": 371153.09, "train_sortino": 13.9388, "train_return_pct": 37015.31, "train_max_dd": 6.86, "train_win_rate": 65.32, "train_profit_factor": 3.284, "train_ic": 0.6776, "train_hit": 65.05, "train_precision": 0.5965, "train_recall": 0.9898, "train_f1": 0.7444, "train_f2": 0.8745, "train_mcc": 0.3972, "train_accuracy": 0.6505, "train_per_window": [{"fold": "all_train", "regime": "Training data", "sharpe": 5.1294, "sortino": 13.9388, "return_pct": 37015.31, "equity": 371153.09, "max_dd": 6.86, "win_rate": 65.32, "profit_factor": 3.284, "ic": 0.6776, "hit": 65.05, "n": 2478, "precision": 0.5965, "recall": 0.9898, "f1": 0.7444, "f2": 0.8745, "mcc": 0.3972, "accuracy": 0.6505, "tp": 1261, "fp": 853, "tn": 351, "fn": 13}], "experiment_num": 165, "status": "DISCARD"}
{"backbone": "mamba", "description": "mamba: Exp15 dmamba expand=4 seed=2024 variance", "config": {"seq_len": 10, "lr": 0.0005, "batch_size": 32, "epochs": 100, "weight_decay": 0.1, "patience": 20, "grad_clip": 1.0, "warmup_epochs": 10, "huber_delta": 1.0, "head_dropout": 0.1, "seed": 2024, "mamba_variant": "dmamba", "mamba_expand": 4, "het_loss": false}, "composite": 4.4761, "test_pos_folds": 7, "val_pos_folds": 5, "val_loss": 3.8e-05, "elapsed_sec": 310.3, "timestamp": "2026-04-20T01:47:05", "sharpe": 5.4398, "psr": 1.0, "equity": 8426.73, "sortino": 6.6285, "return_pct": 742.67, "max_dd": 9.94, "win_rate": 67.8, "profit_factor": 2.812, "ic": 0.4638, "hit": 67.52, "aleatoric_mean": 1.3e-05, "epistemic_mean": 2.6e-05, "confidence_mean": 1.0, "precision": 0.6436, "recall": 0.7734, "f1": 0.7025, "f2": 0.7434, "mcc": 0.3611, "accuracy": 0.6763, "per_window": [{"fold": "fold_1", "regime": "Pre-crisis upturn + GFC onset", "sharpe": 0.1273, "sortino": 0.1478, "return_pct": 0.25, "equity": 1002.5, "max_dd": 9.94, "win_rate": 47.06, "profit_factor": 1.031, "ic": -0.0523, "hit": 46.6, "n": 103, "precision": 0.4833, "recall": 0.5472, "f1": 0.5133, "f2": 0.5331, "mcc": -0.0738, "accuracy": 0.466, "tp": 29, "fp": 31, "tn": 19, "fn": 24, "aleatoric_mean": 2.8e-05, "epistemic_mean": 5.5e-05, "confidence_mean": 0.9999, "aleatoric_std": 2.8e-05, "epistemic_std": 5.5e-05}, {"fold": "fold_2", "regime": "Post-crash recovery", "sharpe": 1.1218, "sortino": 1.9842, "return_pct": 5.23, "equity": 1052.33, "max_dd": 3.31, "win_rate": 56.07, "profit_factor": 1.192, "ic": 0.0084, "hit": 56.07, "n": 107, "precision": 0.5345, "recall": 0.6078, "f1": 0.5688, "f2": 0.5916, "mcc": 0.126, "accuracy": 0.5607, "tp": 31, "fp": 27, "tn": 29, "fn": 20, "aleatoric_mean": 1.1e-05, "epistemic_mean": 2.2e-05, "confidence_mean": 1.0, "aleatoric_std": 9e-06, "epistemic_std": 1.7e-05}, {"fold": "fold_3", "regime": "Eurozone debt plateau", "sharpe": 6.464, "sortino": 11.2643, "return_pct": 23.49, "equity": 1234.95, "max_dd": 3.61, "win_rate": 66.35, "profit_factor": 2.773, "ic": 0.4398, "hit": 65.09, "n": 106, "precision": 0.6667, "recall": 0.7018, "f1": 0.6838, "f2": 0.6944, "mcc": 0.2953, "accuracy": 0.6509, "tp": 40, "fp": 20, "tn": 29, "fn": 17, "aleatoric_mean": 1.7e-05, "epistemic_mean": 3.5e-05, "confidence_mean": 0.9999, "aleatoric_std": 1.4e-05, "epistemic_std": 2.8e-05}, {"fold": "fold_4", "regime": "Strong USD downturn", "sharpe": 10.8196, "sortino": 25.3066, "return_pct": 99.61, "equity": 1996.1, "max_dd": 1.69, "win_rate": 79.04, "profit_factor": 7.027, "ic": 0.6733, "hit": 78.57, "n": 168, "precision": 0.8148, "recall": 0.7674, "f1": 0.7904, "f2": 0.7765, "mcc": 0.5847, "accuracy": 0.7917, "tp": 66, "fp": 15, "tn": 67, "fn": 20, "aleatoric_mean": 1.4e-05, "epistemic_mean": 2.8e-05, "confidence_mean": 1.0, "aleatoric_std": 1.5e-05, "epistemic_std": 2.9e-05}, {"fold": "fold_5", "regime": "Low-vol plateau", "sharpe": 6.5602, "sortino": 11.8613, "return_pct": 22.29, "equity": 1222.91, "max_dd": 1.12, "win_rate": 63.58, "profit_factor": 3.034, "ic": 0.6071, "hit": 63.58, "n": 162, "precision": 0.578, "recall": 0.8289, "f1": 0.6811, "f2": 0.7627, "mcc": 0.3128, "accuracy": 0.6358, "tp": 63, "fp": 46, "tn": 40, "fn": 13, "aleatoric_mean": 5e-06, "epistemic_mean": 9e-06, "confidence_mean": 1.0, "aleatoric_std": 2e-06, "epistemic_std": 5e-06}, {"fold": "fold_6", "regime": "EUR crisis downturn", "sharpe": 10.5995, "sortino": 21.0021, "return_pct": 73.71, "equity": 1737.06, "max_dd": 1.5, "win_rate": 74.55, "profit_factor": 5.949, "ic": 0.7209, "hit": 74.55, "n": 165, "precision": 0.6699, "recall": 0.8961, "f1": 0.7667, "f2": 0.8394, "mcc": 0.5251, "accuracy": 0.7455, "tp": 69, "fp": 34, "tn": 54, "fn": 8, "aleatoric_mean": 1.4e-05, "epistemic_mean": 2.8e-05, "confidence_mean": 1.0, "aleatoric_std": 1.3e-05, "epistemic_std": 2.6e-05}, {"fold": "fold_7", "regime": "Recent mixed/upturn", "sharpe": 7.9773, "sortino": 10.7653, "return_pct": 52.54, "equity": 1525.41, "max_dd": 2.73, "win_rate": 75.31, "profit_factor": 4.026, "ic": 0.6609, "hit": 75.31, "n": 162, "precision": 0.6916, "recall": 0.9136, "f1": 0.7872, "f2": 0.8585, "mcc": 0.5345, "accuracy": 0.7531, "tp": 74, "fp": 33, "tn": 48, "fn": 7, "aleatoric_mean": 9e-06, "epistemic_mean": 1.8e-05, "confidence_mean": 1.0, "aleatoric_std": 1e-05, "epistemic_std": 2.1e-05}], "val_sharpe": 4.6761, "val_psr": 1.0, "val_equity": 2875.17, "val_sortino": 7.3414, "val_return_pct": 187.52, "val_max_dd": 10.4, "val_win_rate": 60.68, "val_profit_factor": 2.22, "val_ic": 0.44, "val_hit": 60.29, "val_aleatoric_mean": 8e-06, "val_epistemic_mean": 1.6e-05, "val_confidence_mean": 1.0, "val_precision": 0.5672, "val_recall": 0.7397, "val_f1": 0.6421, "val_f2": 0.6973, "val_mcc": 0.2351, "val_accuracy": 0.6081, "val_per_window": [{"fold": "fold_1", "regime": "Pre-crisis upturn + GFC onset", "sharpe": -0.9841, "sortino": -1.4638, "return_pct": -2.52, "equity": 974.78, "max_dd": 5.14, "win_rate": 48.15, "profit_factor": 0.849, "ic": -0.0401, "hit": 47.71, "n": 109, "precision": 0.4935, "recall": 0.6909, "f1": 0.5758, "f2": 0.6397, "mcc": -0.0344, "accuracy": 0.4862, "tp": 38, "fp": 39, "tn": 15, "fn": 17, "aleatoric_mean": 1.1e-05, "epistemic_mean": 2.2e-05, "confidence_mean": 1.0, "aleatoric_std": 1.9e-05, "epistemic_std": 3.7e-05}, {"fold": "fold_2", "regime": "Post-crash recovery", "sharpe": -1.0838, "sortino": -1.6847, "return_pct": -5.38, "equity": 946.24, "max_dd": 10.26, "win_rate": 47.22, "profit_factor": 0.843, "ic": -0.0197, "hit": 47.22, "n": 108, "precision": 0.5484, "recall": 0.5397, "f1": 0.544, "f2": 0.5414, "mcc": -0.0823, "accuracy": 0.4722, "tp": 34, "fp": 28, "tn": 17, "fn": 29, "aleatoric_mean": 9e-06, "epistemic_mean": 1.8e-05, "confidence_mean": 1.0, "aleatoric_std": 6e-06, "epistemic_std": 1.2e-05}, {"fold": "fold_3", "regime": "Eurozone debt plateau", "sharpe": 9.8085, "sortino": 25.0812, "return_pct": 39.89, "equity": 1398.91, "max_dd": 1.79, "win_rate": 72.48, "profit_factor": 5.189, "ic": 0.6762, "hit": 71.17, "n": 111, "precision": 0.6333, "recall": 0.8085, "f1": 0.7103, "f2": 0.7661, "mcc": 0.4608, "accuracy": 0.7207, "tp": 38, "fp": 22, "tn": 42, "fn": 9, "aleatoric_mean": 8e-06, "epistemic_mean": 1.6e-05, "confidence_mean": 1.0, "aleatoric_std": 5e-06, "epistemic_std": 1e-05}, {"fold": "fold_4", "regime": "Strong USD downturn", "sharpe": 6.2998, "sortino": 14.5184, "return_pct": 22.4, "equity": 1224.03, "max_dd": 1.94, "win_rate": 61.47, "profit_factor": 2.877, "ic": 0.6711, "hit": 60.91, "n": 110, "precision": 0.5316, "recall": 0.8936, "f1": 0.6667, "f2": 0.7865, "mcc": 0.3368, "accuracy": 0.6182, "tp": 42, "fp": 37, "tn": 26, "fn": 5, "aleatoric_mean": 1.1e-05, "epistemic_mean": 2.1e-05, "confidence_mean": 1.0, "aleatoric_std": 1e-05, "epistemic_std": 2e-05}, {"fold": "fold_5", "regime": "Low-vol plateau", "sharpe": 9.038, "sortino": 25.2445, "return_pct": 29.82, "equity": 1298.16, "max_dd": 0.92, "win_rate": 66.07, "profit_factor": 4.755, "ic": 0.6834, "hit": 66.07, "n": 112, "precision": 0.6271, "recall": 0.6981, "f1": 0.6607, "f2": 0.6827, "mcc": 0.3252, "accuracy": 0.6607, "tp": 37, "fp": 22, "tn": 37, "fn": 16, "aleatoric_mean": 7e-06, "epistemic_mean": 1.4e-05, "confidence_mean": 1.0, "aleatoric_std": 7e-06, "epistemic_std": 1.4e-05}, {"fold": "fold_6", "regime": "EUR crisis downturn", "sharpe": 10.3292, "sortino": 37.4347, "return_pct": 21.86, "equity": 1218.58, "max_dd": 0.76, "win_rate": 69.16, "profit_factor": 6.361, "ic": 0.7092, "hit": 68.52, "n": 108, "precision": 0.64, "recall": 0.6809, "f1": 0.6598, "f2": 0.6723, "mcc": 0.3836, "accuracy": 0.6944, "tp": 32, "fp": 18, "tn": 43, "fn": 15, "aleatoric_mean": 4e-06, "epistemic_mean": 7e-06, "confidence_mean": 1.0, "aleatoric_std": 1e-06, "epistemic_std": 3e-06}, {"fold": "fold_7", "regime": "Recent mixed/upturn", "sharpe": 6.3286, "sortino": 16.0106, "return_pct": 15.08, "equity": 1150.77, "max_dd": 1.39, "win_rate": 60.0, "profit_factor": 2.79, "ic": 0.5891, "hit": 60.0, "n": 110, "precision": 0.5506, "recall": 0.9245, "f1": 0.6901, "f2": 0.814, "mcc": 0.2832, "accuracy": 0.6, "tp": 49, "fp": 40, "tn": 17, "fn": 4, "aleatoric_mean": 6e-06, "epistemic_mean": 1.2e-05, "confidence_mean": 1.0, "aleatoric_std": 4e-06, "epistemic_std": 9e-06}], "train_sharpe": 7.8492, "train_psr": 1.0, "train_equity": 5227232.5, "train_sortino": 24.6597, "train_return_pct": 522623.25, "train_max_dd": 2.98, "train_win_rate": 77.47, "train_profit_factor": 7.642, "train_ic": 0.7467, "train_hit": 77.16, "train_precision": 0.7336, "train_recall": 0.8776, "train_f1": 0.7991, "train_f2": 0.8444, "train_mcc": 0.555, "train_accuracy": 0.7732, "train_per_window": [{"fold": "all_train", "regime": "Training data", "sharpe": 7.8492, "sortino": 24.6597, "return_pct": 522623.25, "equity": 5227232.5, "max_dd": 2.98, "win_rate": 77.47, "profit_factor": 7.642, "ic": 0.7467, "hit": 77.16, "n": 2478, "precision": 0.7336, "recall": 0.8776, "f1": 0.7991, "f2": 0.8444, "mcc": 0.555, "accuracy": 0.7732, "tp": 1118, "fp": 406, "tn": 798, "fn": 156}], "experiment_num": 166, "status": "DISCARD"}
