{"backbone": "lfm2-350m", "description": "lfm2: H-Exp19 ep=40 more convergence time", "config": {"seq_len": 60, "lr": 3e-05, "batch_size": 32, "epochs": 40, "weight_decay": 1e-05, "patience": 8, "grad_clip": 1.0, "warmup_epochs": 3, "huber_delta": 1.0, "head_dropout": 0.1}, "composite": -1.0998, "test_pos_folds": 2, "val_pos_folds": 6, "val_loss": -1.806634, "elapsed_sec": 506.1, "timestamp": "2026-04-12T10:54:13", "sharpe": -0.4998, "psr": 0.2155, "equity": 880.09, "sortino": -0.735, "return_pct": -11.99, "max_dd": 22.62, "win_rate": 47.5, "profit_factor": 0.92, "ic": 0.003, "hit": 47.19, "aleatoric_mean": 0.058144, "epistemic_mean": 0.007147, "confidence_mean": 0.9421, "per_window": [{"fold": "fold_1", "regime": "Pre-crisis upturn + GFC onset", "sharpe": -2.851, "sortino": -4.8392, "return_pct": -5.86, "equity": 941.36, "max_dd": 10.32, "win_rate": 42.31, "profit_factor": 0.646, "ic": -0.1672, "hit": 41.51, "n": 53, "aleatoric_mean": 0.152058, "epistemic_mean": 0.004701, "confidence_mean": 0.8693, "aleatoric_std": 0.089377, "epistemic_std": 0.001881}, {"fold": "fold_2", "regime": "Post-crash recovery", "sharpe": -0.0486, "sortino": -0.0762, "return_pct": -0.32, "equity": 996.81, "max_dd": 7.96, "win_rate": 52.63, "profit_factor": 0.992, "ic": 0.1226, "hit": 52.63, "n": 57, "aleatoric_mean": 0.121489, "epistemic_mean": 0.007565, "confidence_mean": 0.8925, "aleatoric_std": 0.108622, "epistemic_std": 0.002641}, {"fold": "fold_3", "regime": "Eurozone debt plateau", "sharpe": 2.7984, "sortino": 4.9934, "return_pct": 4.94, "equity": 1049.37, "max_dd": 2.46, "win_rate": 55.56, "profit_factor": 1.563, "ic": 0.2289, "hit": 53.57, "n": 56, "aleatoric_mean": 0.070683, "epistemic_mean": 0.006337, "confidence_mean": 0.9305, "aleatoric_std": 0.05245, "epistemic_std": 0.002651}, {"fold": "fold_4", "regime": "Strong USD downturn", "sharpe": -2.8509, "sortino": -3.9701, "return_pct": -13.47, "equity": 865.26, "max_dd": 17.56, "win_rate": 41.88, "profit_factor": 0.619, "ic": -0.0943, "hit": 41.53, "n": 118, "aleatoric_mean": 0.037438, "epistemic_mean": 0.007508, "confidence_mean": 0.9583, "aleatoric_std": 0.042363, "epistemic_std": 0.003234}, {"fold": "fold_5", "regime": "Low-vol plateau", "sharpe": -0.3178, "sortino": -0.5306, "return_pct": -0.77, "equity": 992.3, "max_dd": 2.87, "win_rate": 47.32, "profit_factor": 0.949, "ic": 0.0748, "hit": 47.32, "n": 112, "aleatoric_mean": 0.021624, "epistemic_mean": 0.007002, "confidence_mean": 0.9725, "aleatoric_std": 0.018865, "epistemic_std": 0.003426}, {"fold": "fold_6", "regime": "EUR crisis downturn", "sharpe": 1.8075, "sortino": 3.2054, "return_pct": 8.19, "equity": 1081.88, "max_dd": 3.95, "win_rate": 51.3, "profit_factor": 1.331, "ic": 0.0676, "hit": 51.3, "n": 115, "aleatoric_mean": 0.066065, "epistemic_mean": 0.007176, "confidence_mean": 0.934, "aleatoric_std": 0.055221, "epistemic_std": 0.00264}, {"fold": "fold_7", "regime": "Recent mixed/upturn", "sharpe": -0.8865, "sortino": -1.2539, "return_pct": -3.78, "equity": 962.19, "max_dd": 6.58, "win_rate": 45.54, "profit_factor": 0.859, "ic": 0.0248, "hit": 45.54, "n": 112, "aleatoric_mean": 0.025397, "epistemic_mean": 0.008231, "confidence_mean": 0.9683, "aleatoric_std": 0.032901, "epistemic_std": 0.003295}], "val_sharpe": 1.4117, "val_psr": 0.9661, "val_equity": 1186.95, "val_sortino": 2.2555, "val_return_pct": 18.69, "val_max_dd": 4.01, "val_win_rate": 54.09, "val_profit_factor": 1.265, "val_ic": 0.0283, "val_hit": 53.83, "val_aleatoric_mean": 0.062178, "val_epistemic_mean": 0.007331, "val_confidence_mean": 0.9419, "val_per_window": [{"fold": "fold_1", "regime": "Pre-crisis upturn + GFC onset", "sharpe": 2.7624, "sortino": 4.1628, "return_pct": 4.35, "equity": 1043.54, "max_dd": 1.44, "win_rate": 56.9, "profit_factor": 1.577, "ic": 0.0947, "hit": 55.93, "n": 59, "aleatoric_mean": 0.219825, "epistemic_mean": 0.00458, "confidence_mean": 0.8371, "aleatoric_std": 0.201378, "epistemic_std": 0.002207}, {"fold": "fold_2", "regime": "Post-crash recovery", "sharpe": 0.3501, "sortino": 0.5856, "return_pct": 0.61, "equity": 1006.05, "max_dd": 3.16, "win_rate": 51.72, "profit_factor": 1.058, "ic": 0.0062, "hit": 51.72, "n": 58, "aleatoric_mean": 0.092889, "epistemic_mean": 0.00769, "confidence_mean": 0.9104, "aleatoric_std": 0.051652, "epistemic_std": 0.00355}, {"fold": "fold_3", "regime": "Eurozone debt plateau", "sharpe": 1.1664, "sortino": 2.2085, "return_pct": 2.67, "equity": 1026.69, "max_dd": 3.94, "win_rate": 45.9, "profit_factor": 1.215, "ic": -0.2797, "hit": 45.9, "n": 61, "aleatoric_mean": 0.024026, "epistemic_mean": 0.010126, "confidence_mean": 0.9673, "aleatoric_std": 0.019743, "epistemic_std": 0.004879}, {"fold": "fold_4", "regime": "Strong USD downturn", "sharpe": 3.6004, "sortino": 6.6095, "return_pct": 7.88, "equity": 1078.84, "max_dd": 3.58, "win_rate": 61.67, "profit_factor": 1.737, "ic": 0.0933, "hit": 61.67, "n": 60, "aleatoric_mean": 0.027294, "epistemic_mean": 0.006745, "confidence_mean": 0.9677, "aleatoric_std": 0.02744, "epistemic_std": 0.002651}, {"fold": "fold_5", "regime": "Low-vol plateau", "sharpe": 1.8015, "sortino": 2.4924, "return_pct": 3.1, "equity": 1030.95, "max_dd": 2.61, "win_rate": 58.06, "profit_factor": 1.339, "ic": 0.0611, "hit": 58.06, "n": 62, "aleatoric_mean": 0.015108, "epistemic_mean": 0.00794, "confidence_mean": 0.9776, "aleatoric_std": 0.011344, "epistemic_std": 0.003143}, {"fold": "fold_6", "regime": "EUR crisis downturn", "sharpe": 0.946, "sortino": 1.6597, "return_pct": 0.97, "equity": 1009.66, "max_dd": 1.59, "win_rate": 52.63, "profit_factor": 1.168, "ic": 0.1676, "hit": 51.72, "n": 58, "aleatoric_mean": 0.008698, "epistemic_mean": 0.006974, "confidence_mean": 0.9846, "aleatoric_std": 0.00492, "epistemic_std": 0.002756}, {"fold": "fold_7", "regime": "Recent mixed/upturn", "sharpe": -1.5113, "sortino": -1.9785, "return_pct": -1.94, "equity": 980.59, "max_dd": 3.85, "win_rate": 51.67, "profit_factor": 0.781, "ic": 0.1117, "hit": 51.67, "n": 60, "aleatoric_mean": 0.051479, "epistemic_mean": 0.007151, "confidence_mean": 0.9458, "aleatoric_std": 0.039015, "epistemic_std": 0.003396}], "train_sharpe": 0.2343, "train_psr": 0.6949, "train_equity": 1125.14, "train_sortino": 0.2088, "train_return_pct": 12.51, "train_max_dd": 33.92, "train_win_rate": 52.95, "train_profit_factor": 1.055, "train_ic": 0.1035, "train_hit": 52.68, "train_per_window": [{"fold": "all_train", "regime": "Training data", "sharpe": 0.2343, "sortino": 0.2088, "return_pct": 12.51, "equity": 1125.14, "max_dd": 33.92, "win_rate": 52.95, "profit_factor": 1.055, "ic": 0.1035, "hit": 52.68, "n": 1382}], "experiment_num": 41, "status": "DISCARD"}
{"backbone": "lfm2-350m", "description": "lfm2: H-Exp20 wd=3e-5 moderate L2 with warmup", "config": {"seq_len": 60, "lr": 3e-05, "batch_size": 32, "epochs": 30, "weight_decay": 3e-05, "patience": 8, "grad_clip": 1.0, "warmup_epochs": 3, "huber_delta": 1.0, "head_dropout": 0.1}, "composite": -0.7012, "test_pos_folds": 5, "val_pos_folds": 4, "val_loss": -1.663381, "elapsed_sec": 397.2, "timestamp": "2026-04-12T11:01:14", "sharpe": 1.5751, "psr": 0.994, "equity": 1426.32, "sortino": 2.6137, "return_pct": 42.63, "max_dd": 12.17, "win_rate": 53.15, "profit_factor": 1.303, "ic": 0.0595, "hit": 52.81, "aleatoric_mean": 0.087194, "epistemic_mean": 0.007281, "confidence_mean": 0.9203, "per_window": [{"fold": "fold_1", "regime": "Pre-crisis upturn + GFC onset", "sharpe": -0.9355, "sortino": -1.6306, "return_pct": -2.06, "equity": 979.39, "max_dd": 5.88, "win_rate": 44.23, "profit_factor": 0.866, "ic": -0.0757, "hit": 43.4, "n": 53, "aleatoric_mean": 0.177029, "epistemic_mean": 0.00525, "confidence_mean": 0.8563, "aleatoric_std": 0.144805, "epistemic_std": 0.001992}, {"fold": "fold_2", "regime": "Post-crash recovery", "sharpe": -2.6742, "sortino": -3.9722, "return_pct": -7.43, "equity": 925.71, "max_dd": 7.92, "win_rate": 50.88, "profit_factor": 0.651, "ic": -0.0672, "hit": 50.88, "n": 57, "aleatoric_mean": 0.203799, "epistemic_mean": 0.007258, "confidence_mean": 0.8377, "aleatoric_std": 0.156951, "epistemic_std": 0.002634}, {"fold": "fold_3", "regime": "Eurozone debt plateau", "sharpe": 1.265, "sortino": 1.9449, "return_pct": 2.19, "equity": 1021.9, "max_dd": 5.51, "win_rate": 51.85, "profit_factor": 1.223, "ic": 0.1897, "hit": 50.0, "n": 56, "aleatoric_mean": 0.098415, "epistemic_mean": 0.007717, "confidence_mean": 0.9074, "aleatoric_std": 0.070802, "epistemic_std": 0.003641}, {"fold": "fold_4", "regime": "Strong USD downturn", "sharpe": 3.0235, "sortino": 8.0281, "return_pct": 15.9, "equity": 1159.01, "max_dd": 3.99, "win_rate": 51.28, "profit_factor": 1.663, "ic": 0.0684, "hit": 50.85, "n": 118, "aleatoric_mean": 0.082109, "epistemic_mean": 0.007314, "confidence_mean": 0.9221, "aleatoric_std": 0.079331, "epistemic_std": 0.003428}, {"fold": "fold_5", "regime": "Low-vol plateau", "sharpe": 4.0487, "sortino": 7.4233, "return_pct": 9.18, "equity": 1091.8, "max_dd": 1.67, "win_rate": 62.5, "profit_factor": 1.968, "ic": 0.1817, "hit": 62.5, "n": 112, "aleatoric_mean": 0.024556, "epistemic_mean": 0.008025, "confidence_mean": 0.969, "aleatoric_std": 0.025161, "epistemic_std": 0.00296}, {"fold": "fold_6", "regime": "EUR crisis downturn", "sharpe": 1.8765, "sortino": 3.3663, "return_pct": 8.52, "equity": 1085.18, "max_dd": 3.37, "win_rate": 50.43, "profit_factor": 1.346, "ic": -0.1441, "hit": 50.43, "n": 115, "aleatoric_mean": 0.106046, "epistemic_mean": 0.006426, "confidence_mean": 0.9035, "aleatoric_std": 0.085447, "epistemic_std": 0.002213}, {"fold": "fold_7", "regime": "Recent mixed/upturn", "sharpe": 2.8548, "sortino": 5.1095, "return_pct": 12.11, "equity": 1121.09, "max_dd": 3.65, "win_rate": 54.46, "profit_factor": 1.634, "ic": 0.1705, "hit": 54.46, "n": 112, "aleatoric_mean": 0.028369, "epistemic_mean": 0.008135, "confidence_mean": 0.9657, "aleatoric_std": 0.035041, "epistemic_std": 0.003387}], "val_sharpe": -0.2012, "val_psr": 0.3978, "val_equity": 970.52, "val_sortino": -0.2971, "val_return_pct": -2.95, "val_max_dd": 8.41, "val_win_rate": 50.72, "val_profit_factor": 0.967, "val_ic": 0.0038, "val_hit": 50.48, "val_aleatoric_mean": 0.094047, "val_epistemic_mean": 0.007342, "val_confidence_mean": 0.9223, "val_per_window": [{"fold": "fold_1", "regime": "Pre-crisis upturn + GFC onset", "sharpe": -2.412, "sortino": -3.5277, "return_pct": -3.76, "equity": 962.37, "max_dd": 4.49, "win_rate": 50.0, "profit_factor": 0.672, "ic": -0.2382, "hit": 49.15, "n": 59, "aleatoric_mean": 0.331531, "epistemic_mean": 0.005585, "confidence_mean": 0.7895, "aleatoric_std": 0.330052, "epistemic_std": 0.003002}, {"fold": "fold_2", "regime": "Post-crash recovery", "sharpe": 1.1699, "sortino": 2.2474, "return_pct": 2.23, "equity": 1022.3, "max_dd": 2.59, "win_rate": 48.28, "profit_factor": 1.208, "ic": -0.0171, "hit": 48.28, "n": 58, "aleatoric_mean": 0.145153, "epistemic_mean": 0.006354, "confidence_mean": 0.8733, "aleatoric_std": 0.092114, "epistemic_std": 0.003197}, {"fold": "fold_3", "regime": "Eurozone debt plateau", "sharpe": -1.4445, "sortino": -1.9421, "return_pct": -3.45, "equity": 965.46, "max_dd": 4.24, "win_rate": 45.9, "profit_factor": 0.786, "ic": -0.1251, "hit": 45.9, "n": 61, "aleatoric_mean": 0.041989, "epistemic_mean": 0.009547, "confidence_mean": 0.9519, "aleatoric_std": 0.034628, "epistemic_std": 0.003842}, {"fold": "fold_4", "regime": "Strong USD downturn", "sharpe": 1.3344, "sortino": 2.2582, "return_pct": 2.85, "equity": 1028.51, "max_dd": 2.93, "win_rate": 56.67, "profit_factor": 1.227, "ic": 0.1704, "hit": 56.67, "n": 60, "aleatoric_mean": 0.043924, "epistemic_mean": 0.006938, "confidence_mean": 0.9534, "aleatoric_std": 0.049118, "epistemic_std": 0.00296}, {"fold": "fold_5", "regime": "Low-vol plateau", "sharpe": -1.9271, "sortino": -2.7877, "return_pct": -3.33, "equity": 966.72, "max_dd": 5.56, "win_rate": 43.55, "profit_factor": 0.732, "ic": -0.0313, "hit": 43.55, "n": 62, "aleatoric_mean": 0.022541, "epistemic_mean": 0.006996, "confidence_mean": 0.9717, "aleatoric_std": 0.020294, "epistemic_std": 0.002928}, {"fold": "fold_6", "regime": "EUR crisis downturn", "sharpe": 1.6842, "sortino": 2.74, "return_pct": 1.74, "equity": 1017.39, "max_dd": 1.29, "win_rate": 57.89, "profit_factor": 1.318, "ic": 0.0363, "hit": 56.9, "n": 58, "aleatoric_mean": 0.013554, "epistemic_mean": 0.008122, "confidence_mean": 0.9789, "aleatoric_std": 0.009743, "epistemic_std": 0.003042}, {"fold": "fold_7", "regime": "Recent mixed/upturn", "sharpe": 0.8114, "sortino": 1.4537, "return_pct": 1.01, "equity": 1010.08, "max_dd": 2.02, "win_rate": 53.33, "profit_factor": 1.141, "ic": 0.2232, "hit": 53.33, "n": 60, "aleatoric_mean": 0.065866, "epistemic_mean": 0.007787, "confidence_mean": 0.9335, "aleatoric_std": 0.052887, "epistemic_std": 0.002687}], "train_sharpe": 0.439, "train_psr": 0.8563, "train_equity": 1306.77, "train_sortino": 0.5972, "train_return_pct": 30.68, "train_max_dd": 15.2, "train_win_rate": 49.75, "train_profit_factor": 1.106, "train_ic": 0.0245, "train_hit": 49.49, "train_per_window": [{"fold": "all_train", "regime": "Training data", "sharpe": 0.439, "sortino": 0.5972, "return_pct": 30.68, "equity": 1306.77, "max_dd": 15.2, "win_rate": 49.75, "profit_factor": 1.106, "ic": 0.0245, "hit": 49.49, "n": 1382}], "experiment_num": 42, "status": "DISCARD"}
{"backbone": "lfm2-350m", "description": "lfm2: H-Exp21 REPRODUCE champion run 1/3", "config": {"seq_len": 60, "lr": 3e-05, "batch_size": 32, "epochs": 30, "weight_decay": 1e-05, "patience": 8, "grad_clip": 1.0, "warmup_epochs": 3, "huber_delta": 1.0, "head_dropout": 0.1}, "composite": -1.0989, "test_pos_folds": 3, "val_pos_folds": 3, "val_loss": -1.623254, "elapsed_sec": 370.1, "timestamp": "2026-04-12T11:15:52", "sharpe": 0.0085, "psr": 0.5054, "equity": 991.0, "sortino": 0.0129, "return_pct": -0.9, "max_dd": 15.02, "win_rate": 52.02, "profit_factor": 1.001, "ic": -0.0096, "hit": 51.69, "aleatoric_mean": 0.0852, "epistemic_mean": 0.007434, "confidence_mean": 0.9216, "per_window": [{"fold": "fold_1", "regime": "Pre-crisis upturn + GFC onset", "sharpe": 0.3174, "sortino": 0.5821, "return_pct": 0.57, "equity": 1005.67, "max_dd": 4.54, "win_rate": 50.0, "profit_factor": 1.05, "ic": -0.0728, "hit": 49.06, "n": 53, "aleatoric_mean": 0.192904, "epistemic_mean": 0.007028, "confidence_mean": 0.8434, "aleatoric_std": 0.141523, "epistemic_std": 0.002837}, {"fold": "fold_2", "regime": "Post-crash recovery", "sharpe": -1.6327, "sortino": -2.3826, "return_pct": -4.71, "equity": 952.91, "max_dd": 10.71, "win_rate": 49.12, "profit_factor": 0.77, "ic": 0.0631, "hit": 49.12, "n": 57, "aleatoric_mean": 0.169402, "epistemic_mean": 0.006294, "confidence_mean": 0.8626, "aleatoric_std": 0.159738, "epistemic_std": 0.002496}, {"fold": "fold_3", "regime": "Eurozone debt plateau", "sharpe": 1.8803, "sortino": 3.0374, "return_pct": 3.3, "equity": 1032.95, "max_dd": 2.53, "win_rate": 59.26, "profit_factor": 1.35, "ic": 0.3026, "hit": 57.14, "n": 56, "aleatoric_mean": 0.122752, "epistemic_mean": 0.006461, "confidence_mean": 0.8903, "aleatoric_std": 0.085644, "epistemic_std": 0.002329}, {"fold": "fold_4", "regime": "Strong USD downturn", "sharpe": 2.7038, "sortino": 7.1865, "return_pct": 14.13, "equity": 1141.28, "max_dd": 5.18, "win_rate": 57.26, "profit_factor": 1.575, "ic": 0.1214, "hit": 56.78, "n": 118, "aleatoric_mean": 0.056297, "epistemic_mean": 0.007187, "confidence_mean": 0.9435, "aleatoric_std": 0.068507, "epistemic_std": 0.00268}, {"fold": "fold_5", "regime": "Low-vol plateau", "sharpe": -0.0971, "sortino": -0.1347, "return_pct": -0.28, "equity": 997.24, "max_dd": 3.04, "win_rate": 50.89, "profit_factor": 0.984, "ic": -0.09, "hit": 50.89, "n": 112, "aleatoric_mean": 0.025894, "epistemic_mean": 0.00953, "confidence_mean": 0.9665, "aleatoric_std": 0.030483, "epistemic_std": 0.004554}, {"fold": "fold_6", "regime": "EUR crisis downturn", "sharpe": -1.8552, "sortino": -2.7098, "return_pct": -8.17, "equity": 918.27, "max_dd": 9.94, "win_rate": 48.7, "profit_factor": 0.746, "ic": -0.1682, "hit": 48.7, "n": 115, "aleatoric_mean": 0.110191, "epistemic_mean": 0.005672, "confidence_mean": 0.9006, "aleatoric_std": 0.083244, "epistemic_std": 0.002405}, {"fold": "fold_7", "regime": "Recent mixed/upturn", "sharpe": -0.9948, "sortino": -1.296, "return_pct": -4.21, "equity": 957.91, "max_dd": 5.68, "win_rate": 50.0, "profit_factor": 0.843, "ic": -0.1747, "hit": 50.0, "n": 112, "aleatoric_mean": 0.036702, "epistemic_mean": 0.008666, "confidence_mean": 0.9577, "aleatoric_std": 0.038591, "epistemic_std": 0.003301}], "val_sharpe": -0.2989, "val_psr": 0.3499, "val_equity": 958.72, "val_sortino": -0.4273, "val_return_pct": -4.13, "val_max_dd": 10.07, "val_win_rate": 52.16, "val_profit_factor": 0.951, "val_ic": -0.0161, "val_hit": 51.91, "val_aleatoric_mean": 0.091034, "val_epistemic_mean": 0.008168, "val_confidence_mean": 0.9225, "val_per_window": [{"fold": "fold_1", "regime": "Pre-crisis upturn + GFC onset", "sharpe": 1.1871, "sortino": 1.7411, "return_pct": 1.84, "equity": 1018.4, "max_dd": 4.13, "win_rate": 55.17, "profit_factor": 1.216, "ic": -0.0539, "hit": 54.24, "n": 59, "aleatoric_mean": 0.268645, "epistemic_mean": 0.007144, "confidence_mean": 0.8189, "aleatoric_std": 0.293543, "epistemic_std": 0.004354}, {"fold": "fold_2", "regime": "Post-crash recovery", "sharpe": 0.69, "sortino": 1.1467, "return_pct": 1.28, "equity": 1012.77, "max_dd": 1.63, "win_rate": 51.72, "profit_factor": 1.118, "ic": -0.1583, "hit": 51.72, "n": 58, "aleatoric_mean": 0.182727, "epistemic_mean": 0.006553, "confidence_mean": 0.8509, "aleatoric_std": 0.144687, "epistemic_std": 0.003183}, {"fold": "fold_3", "regime": "Eurozone debt plateau", "sharpe": 1.1388, "sortino": 1.4572, "return_pct": 2.6, "equity": 1026.02, "max_dd": 3.49, "win_rate": 62.3, "profit_factor": 1.209, "ic": 0.1355, "hit": 62.3, "n": 61, "aleatoric_mean": 0.032274, "epistemic_mean": 0.010694, "confidence_mean": 0.9592, "aleatoric_std": 0.023156, "epistemic_std": 0.007037}, {"fold": "fold_4", "regime": "Strong USD downturn", "sharpe": -0.7329, "sortino": -1.1194, "return_pct": -1.69, "equity": 983.1, "max_dd": 4.58, "win_rate": 53.33, "profit_factor": 0.894, "ic": 0.0431, "hit": 53.33, "n": 60, "aleatoric_mean": 0.047952, "epistemic_mean": 0.006828, "confidence_mean": 0.9507, "aleatoric_std": 0.060833, "epistemic_std": 0.003023}, {"fold": "fold_5", "regime": "Low-vol plateau", "sharpe": -3.5672, "sortino": -5.2338, "return_pct": -5.92, "equity": 940.75, "max_dd": 6.91, "win_rate": 40.32, "profit_factor": 0.56, "ic": -0.2085, "hit": 40.32, "n": 62, "aleatoric_mean": 0.020243, "epistemic_mean": 0.008949, "confidence_mean": 0.9718, "aleatoric_std": 0.015782, "epistemic_std": 0.003362}, {"fold": "fold_6", "regime": "EUR crisis downturn", "sharpe": -0.7039, "sortino": -1.1727, "return_pct": -0.75, "equity": 992.45, "max_dd": 2.03, "win_rate": 52.63, "profit_factor": 0.891, "ic": -0.4374, "hit": 51.72, "n": 58, "aleatoric_mean": 0.015669, "epistemic_mean": 0.00889, "confidence_mean": 0.9761, "aleatoric_std": 0.010304, "epistemic_std": 0.003772}, {"fold": "fold_7", "regime": "Recent mixed/upturn", "sharpe": -0.9974, "sortino": -1.6053, "return_pct": -1.3, "equity": 987.0, "max_dd": 4.62, "win_rate": 50.0, "profit_factor": 0.85, "ic": -0.0623, "hit": 50.0, "n": 60, "aleatoric_mean": 0.076572, "epistemic_mean": 0.008001, "confidence_mean": 0.9255, "aleatoric_std": 0.071564, "epistemic_std": 0.003588}], "train_sharpe": 0.4388, "train_psr": 0.8561, "train_equity": 1306.52, "train_sortino": 0.5977, "train_return_pct": 30.65, "train_max_dd": 19.67, "train_win_rate": 49.53, "train_profit_factor": 1.106, "train_ic": 0.0321, "train_hit": 49.28, "train_per_window": [{"fold": "all_train", "regime": "Training data", "sharpe": 0.4388, "sortino": 0.5977, "return_pct": 30.65, "equity": 1306.52, "max_dd": 19.67, "win_rate": 49.53, "profit_factor": 1.106, "ic": 0.0321, "hit": 49.28, "n": 1382}], "experiment_num": 43, "status": "DISCARD"}
