{"backbone": "mamba", "description": "mamba: Exp2 s_mamba variant (Liu 2024 arXiv 2403.11144)", "config": {"seq_len": 10, "lr": 0.0005, "batch_size": 32, "epochs": 100, "weight_decay": 0.1, "patience": 20, "grad_clip": 1.0, "warmup_epochs": 10, "huber_delta": 1.0, "head_dropout": 0.1, "seed": 42, "mamba_variant": "s_mamba", "het_loss": false}, "composite": 5.2714, "test_pos_folds": 6, "val_pos_folds": 7, "val_loss": 3.8e-05, "elapsed_sec": 370.4, "timestamp": "2026-04-19T22:29:26", "sharpe": 5.3714, "psr": 1.0, "equity": 8227.1, "sortino": 10.2816, "return_pct": 722.71, "max_dd": 7.43, "win_rate": 66.46, "profit_factor": 2.774, "ic": 0.4476, "hit": 66.19, "aleatoric_mean": 1.5e-05, "epistemic_mean": 2.9e-05, "confidence_mean": 1.0, "precision": 0.6842, "recall": 0.5946, "f1": 0.6363, "f2": 0.6106, "mcc": 0.3296, "accuracy": 0.6639, "per_window": [{"fold": "fold_1", "regime": "Pre-crisis upturn + GFC onset", "sharpe": 2.8839, "sortino": 8.0473, "return_pct": 23.59, "equity": 1235.94, "max_dd": 3.97, "win_rate": 53.92, "profit_factor": 2.007, "ic": 0.1665, "hit": 53.4, "n": 103, "precision": 0.5362, "recall": 0.6981, "f1": 0.6066, "f2": 0.6584, "mcc": 0.0618, "accuracy": 0.534, "tp": 37, "fp": 32, "tn": 18, "fn": 16, "aleatoric_mean": 2.1e-05, "epistemic_mean": 4.2e-05, "confidence_mean": 0.9999, "aleatoric_std": 1.1e-05, "epistemic_std": 2.2e-05}, {"fold": "fold_2", "regime": "Post-crash recovery", "sharpe": -0.9821, "sortino": -1.7836, "return_pct": -4.86, "equity": 951.45, "max_dd": 7.32, "win_rate": 42.99, "profit_factor": 0.857, "ic": -0.0949, "hit": 42.99, "n": 107, "precision": 0.4138, "recall": 0.4706, "f1": 0.4404, "f2": 0.458, "mcc": -0.1369, "accuracy": 0.4299, "tp": 24, "fp": 34, "tn": 22, "fn": 27, "aleatoric_mean": 1.8e-05, "epistemic_mean": 3.6e-05, "confidence_mean": 0.9999, "aleatoric_std": 8e-06, "epistemic_std": 1.5e-05}, {"fold": "fold_3", "regime": "Eurozone debt plateau", "sharpe": 7.6719, "sortino": 13.7229, "return_pct": 27.6, "equity": 1275.98, "max_dd": 2.7, "win_rate": 71.15, "profit_factor": 3.368, "ic": 0.5395, "hit": 69.81, "n": 106, "precision": 0.7826, "recall": 0.6316, "f1": 0.699, "f2": 0.6569, "mcc": 0.43, "accuracy": 0.7075, "tp": 36, "fp": 10, "tn": 39, "fn": 21, "aleatoric_mean": 2.1e-05, "epistemic_mean": 4.2e-05, "confidence_mean": 0.9999, "aleatoric_std": 1e-05, "epistemic_std": 2.1e-05}, {"fold": "fold_4", "regime": "Strong USD downturn", "sharpe": 8.1212, "sortino": 16.1982, "return_pct": 74.73, "equity": 1747.33, "max_dd": 3.02, "win_rate": 73.65, "profit_factor": 4.092, "ic": 0.5935, "hit": 73.21, "n": 168, "precision": 0.7386, "recall": 0.7558, "f1": 0.7471, "f2": 0.7523, "mcc": 0.4757, "accuracy": 0.7381, "tp": 65, "fp": 23, "tn": 59, "fn": 21, "aleatoric_mean": 1.7e-05, "epistemic_mean": 3.3e-05, "confidence_mean": 0.9999, "aleatoric_std": 9e-06, "epistemic_std": 1.8e-05}, {"fold": "fold_5", "regime": "Low-vol plateau", "sharpe": 8.3883, "sortino": 15.2793, "return_pct": 27.94, "equity": 1279.35, "max_dd": 1.76, "win_rate": 72.84, "profit_factor": 4.22, "ic": 0.6161, "hit": 72.84, "n": 162, "precision": 0.8077, "recall": 0.5526, "f1": 0.6563, "f2": 0.5899, "mcc": 0.4664, "accuracy": 0.7284, "tp": 42, "fp": 10, "tn": 76, "fn": 34, "aleatoric_mean": 7e-06, "epistemic_mean": 1.5e-05, "confidence_mean": 1.0, "aleatoric_std": 6e-06, "epistemic_std": 1.2e-05}, {"fold": "fold_6", "regime": "EUR crisis downturn", "sharpe": 10.2623, "sortino": 27.2269, "return_pct": 71.57, "equity": 1715.66, "max_dd": 1.17, "win_rate": 69.09, "profit_factor": 5.585, "ic": 0.6392, "hit": 69.09, "n": 165, "precision": 0.7031, "recall": 0.5844, "f1": 0.6383, "f2": 0.6048, "mcc": 0.3773, "accuracy": 0.6909, "tp": 45, "fp": 19, "tn": 69, "fn": 32, "aleatoric_mean": 1.5e-05, "epistemic_mean": 3e-05, "confidence_mean": 1.0, "aleatoric_std": 8e-06, "epistemic_std": 1.7e-05}, {"fold": "fold_7", "regime": "Recent mixed/upturn", "sharpe": 6.5316, "sortino": 11.2717, "return_pct": 42.96, "equity": 1429.63, "max_dd": 1.72, "win_rate": 70.37, "profit_factor": 3.083, "ic": 0.6545, "hit": 70.37, "n": 162, "precision": 0.9024, "recall": 0.4568, "f1": 0.6066, "f2": 0.5068, "mcc": 0.4685, "accuracy": 0.7037, "tp": 37, "fp": 4, "tn": 77, "fn": 44, "aleatoric_mean": 9e-06, "epistemic_mean": 1.9e-05, "confidence_mean": 1.0, "aleatoric_std": 5e-06, "epistemic_std": 1e-05}], "val_sharpe": 6.3009, "val_psr": 1.0, "val_equity": 3981.77, "val_sortino": 9.4159, "val_return_pct": 298.18, "val_max_dd": 4.59, "val_win_rate": 68.81, "val_profit_factor": 2.958, "val_ic": 0.4869, "val_hit": 68.36, "val_aleatoric_mean": 1e-05, "val_epistemic_mean": 2.1e-05, "val_confidence_mean": 1.0, "val_precision": 0.6606, "val_recall": 0.6986, "val_f1": 0.6791, "val_f2": 0.6907, "val_mcc": 0.3731, "val_accuracy": 0.6862, "val_per_window": [{"fold": "fold_1", "regime": "Pre-crisis upturn + GFC onset", "sharpe": 0.8929, "sortino": 1.7267, "return_pct": 2.2, "equity": 1022.02, "max_dd": 3.17, "win_rate": 48.15, "profit_factor": 1.16, "ic": -0.0003, "hit": 47.71, "n": 109, "precision": 0.4857, "recall": 0.6182, "f1": 0.544, "f2": 0.5862, "mcc": -0.0506, "accuracy": 0.4771, "tp": 34, "fp": 36, "tn": 18, "fn": 21, "aleatoric_mean": 9e-06, "epistemic_mean": 1.8e-05, "confidence_mean": 1.0, "aleatoric_std": 7e-06, "epistemic_std": 1.4e-05}, {"fold": "fold_2", "regime": "Post-crash recovery", "sharpe": 1.366, "sortino": 2.1522, "return_pct": 6.54, "equity": 1065.38, "max_dd": 4.52, "win_rate": 57.41, "profit_factor": 1.241, "ic": 0.0953, "hit": 57.41, "n": 108, "precision": 0.6308, "recall": 0.6508, "f1": 0.6406, "f2": 0.6467, "mcc": 0.1183, "accuracy": 0.5741, "tp": 41, "fp": 24, "tn": 21, "fn": 22, "aleatoric_mean": 1.8e-05, "epistemic_mean": 3.6e-05, "confidence_mean": 0.9999, "aleatoric_std": 7e-06, "epistemic_std": 1.4e-05}, {"fold": "fold_3", "regime": "Eurozone debt plateau", "sharpe": 9.1798, "sortino": 16.2457, "return_pct": 37.66, "equity": 1376.6, "max_dd": 1.51, "win_rate": 73.39, "profit_factor": 4.627, "ic": 0.6248, "hit": 72.07, "n": 111, "precision": 0.6735, "recall": 0.7021, "f1": 0.6875, "f2": 0.6962, "mcc": 0.4499, "accuracy": 0.7297, "tp": 33, "fp": 16, "tn": 48, "fn": 14, "aleatoric_mean": 1.5e-05, "epistemic_mean": 3e-05, "confidence_mean": 1.0, "aleatoric_std": 7e-06, "epistemic_std": 1.4e-05}, {"fold": "fold_4", "regime": "Strong USD downturn", "sharpe": 10.2935, "sortino": 21.5147, "return_pct": 34.83, "equity": 1348.27, "max_dd": 1.79, "win_rate": 77.98, "profit_factor": 5.997, "ic": 0.6943, "hit": 77.27, "n": 110, "precision": 0.7447, "recall": 0.7447, "f1": 0.7447, "f2": 0.7447, "mcc": 0.5542, "accuracy": 0.7818, "tp": 35, "fp": 12, "tn": 51, "fn": 12, "aleatoric_mean": 1.1e-05, "epistemic_mean": 2.1e-05, "confidence_mean": 1.0, "aleatoric_std": 1e-05, "epistemic_std": 2.1e-05}, {"fold": "fold_5", "regime": "Low-vol plateau", "sharpe": 8.1153, "sortino": 18.681, "return_pct": 27.12, "equity": 1271.21, "max_dd": 1.28, "win_rate": 65.18, "profit_factor": 4.003, "ic": 0.5914, "hit": 65.18, "n": 112, "precision": 0.625, "recall": 0.6604, "f1": 0.6422, "f2": 0.653, "mcc": 0.304, "accuracy": 0.6518, "tp": 35, "fp": 21, "tn": 38, "fn": 18, "aleatoric_mean": 9e-06, "epistemic_mean": 1.8e-05, "confidence_mean": 1.0, "aleatoric_std": 7e-06, "epistemic_std": 1.4e-05}, {"fold": "fold_6", "regime": "EUR crisis downturn", "sharpe": 14.366, "sortino": 64.7972, "return_pct": 27.55, "equity": 1275.52, "max_dd": 0.22, "win_rate": 86.92, "profit_factor": 18.235, "ic": 0.8331, "hit": 86.11, "n": 108, "precision": 0.8636, "recall": 0.8085, "f1": 0.8352, "f2": 0.819, "mcc": 0.7166, "accuracy": 0.8611, "tp": 38, "fp": 6, "tn": 55, "fn": 9, "aleatoric_mean": 5e-06, "epistemic_mean": 1e-05, "confidence_mean": 1.0, "aleatoric_std": 1e-06, "epistemic_std": 3e-06}, {"fold": "fold_7", "regime": "Recent mixed/upturn", "sharpe": 9.4911, "sortino": 21.3436, "return_pct": 21.51, "equity": 1215.13, "max_dd": 0.93, "win_rate": 72.73, "profit_factor": 4.79, "ic": 0.6473, "hit": 72.73, "n": 110, "precision": 0.7091, "recall": 0.7358, "f1": 0.7222, "f2": 0.7303, "mcc": 0.4548, "accuracy": 0.7273, "tp": 39, "fp": 16, "tn": 41, "fn": 14, "aleatoric_mean": 7e-06, "epistemic_mean": 1.3e-05, "confidence_mean": 1.0, "aleatoric_std": 3e-06, "epistemic_std": 7e-06}], "train_sharpe": 7.9577, "train_psr": 1.0, "train_equity": 5751280.0, "train_sortino": 21.601, "train_return_pct": 575028.0, "train_max_dd": 3.08, "train_win_rate": 77.96, "train_profit_factor": 7.972, "train_ic": 0.7556, "train_hit": 77.64, "train_precision": 0.794, "train_recall": 0.7684, "train_f1": 0.781, "train_f2": 0.7734, "train_mcc": 0.5573, "train_accuracy": 0.7785, "train_per_window": [{"fold": "all_train", "regime": "Training data", "sharpe": 7.9577, "sortino": 21.601, "return_pct": 575028.0, "equity": 5751280.0, "max_dd": 3.08, "win_rate": 77.96, "profit_factor": 7.972, "ic": 0.7556, "hit": 77.64, "n": 2478, "precision": 0.794, "recall": 0.7684, "f1": 0.781, "f2": 0.7734, "mcc": 0.5573, "accuracy": 0.7785, "tp": 979, "fp": 254, "tn": 950, "fn": 295}], "experiment_num": 153, "status": "DISCARD"}
{"backbone": "mamba", "description": "mamba: Exp3 s_mamba PROPERLY IMPLEMENTED variate-axis scan (Liu 2024)", "config": {"seq_len": 10, "lr": 0.0005, "batch_size": 32, "epochs": 100, "weight_decay": 0.1, "patience": 20, "grad_clip": 1.0, "warmup_epochs": 10, "huber_delta": 1.0, "head_dropout": 0.1, "seed": 42, "mamba_variant": "s_mamba", "het_loss": false}, "composite": 5.1861, "test_pos_folds": 6, "val_pos_folds": 7, "val_loss": 3.9e-05, "elapsed_sec": 6999.6, "timestamp": "2026-04-20T00:28:21", "sharpe": 5.2861, "psr": 1.0, "equity": 7980.56, "sortino": 9.8862, "return_pct": 698.06, "max_dd": 11.49, "win_rate": 65.63, "profit_factor": 2.726, "ic": 0.4512, "hit": 65.36, "aleatoric_mean": 1.5e-05, "epistemic_mean": 3e-05, "confidence_mean": 1.0, "precision": 0.6825, "recall": 0.5676, "f1": 0.6198, "f2": 0.5873, "mcc": 0.3144, "accuracy": 0.6557, "per_window": [{"fold": "fold_1", "regime": "Pre-crisis upturn + GFC onset", "sharpe": 3.096, "sortino": 8.8067, "return_pct": 25.53, "equity": 1255.28, "max_dd": 3.25, "win_rate": 54.9, "profit_factor": 2.118, "ic": 0.1741, "hit": 54.37, "n": 103, "precision": 0.5517, "recall": 0.6038, "f1": 0.5766, "f2": 0.5926, "mcc": 0.0844, "accuracy": 0.5437, "tp": 32, "fp": 26, "tn": 24, "fn": 21, "aleatoric_mean": 2.1e-05, "epistemic_mean": 4.3e-05, "confidence_mean": 0.9999, "aleatoric_std": 1.2e-05, "epistemic_std": 2.4e-05}, {"fold": "fold_2", "regime": "Post-crash recovery", "sharpe": -1.8413, "sortino": -3.155, "return_pct": -8.65, "equity": 913.46, "max_dd": 10.65, "win_rate": 42.06, "profit_factor": 0.749, "ic": -0.083, "hit": 42.06, "n": 107, "precision": 0.4098, "recall": 0.4902, "f1": 0.4464, "f2": 0.4717, "mcc": -0.154, "accuracy": 0.4206, "tp": 25, "fp": 36, "tn": 20, "fn": 26, "aleatoric_mean": 1.9e-05, "epistemic_mean": 3.8e-05, "confidence_mean": 0.9999, "aleatoric_std": 8e-06, "epistemic_std": 1.6e-05}, {"fold": "fold_3", "regime": "Eurozone debt plateau", "sharpe": 8.1069, "sortino": 14.9121, "return_pct": 29.02, "equity": 1290.21, "max_dd": 2.25, "win_rate": 71.15, "profit_factor": 3.615, "ic": 0.4658, "hit": 69.81, "n": 106, "precision": 0.7955, "recall": 0.614, "f1": 0.6931, "f2": 0.6434, "mcc": 0.4355, "accuracy": 0.7075, "tp": 35, "fp": 9, "tn": 40, "fn": 22, "aleatoric_mean": 2.2e-05, "epistemic_mean": 4.4e-05, "confidence_mean": 0.9999, "aleatoric_std": 1.1e-05, "epistemic_std": 2.3e-05}, {"fold": "fold_4", "regime": "Strong USD downturn", "sharpe": 8.972, "sortino": 16.2947, "return_pct": 82.81, "equity": 1828.12, "max_dd": 3.02, "win_rate": 75.45, "profit_factor": 4.813, "ic": 0.6194, "hit": 75.0, "n": 168, "precision": 0.7528, "recall": 0.7791, "f1": 0.7657, "f2": 0.7737, "mcc": 0.5115, "accuracy": 0.756, "tp": 67, "fp": 22, "tn": 60, "fn": 19, "aleatoric_mean": 1.8e-05, "epistemic_mean": 3.5e-05, "confidence_mean": 0.9999, "aleatoric_std": 1e-05, "epistemic_std": 2.1e-05}, {"fold": "fold_5", "regime": "Low-vol plateau", "sharpe": 8.6253, "sortino": 19.0043, "return_pct": 28.63, "equity": 1286.29, "max_dd": 1.76, "win_rate": 70.37, "profit_factor": 4.41, "ic": 0.6147, "hit": 70.37, "n": 162, "precision": 0.7414, "recall": 0.5658, "f1": 0.6418, "f2": 0.5939, "mcc": 0.4074, "accuracy": 0.7037, "tp": 43, "fp": 15, "tn": 71, "fn": 33, "aleatoric_mean": 7e-06, "epistemic_mean": 1.4e-05, "confidence_mean": 1.0, "aleatoric_std": 6e-06, "epistemic_std": 1.2e-05}, {"fold": "fold_6", "regime": "EUR crisis downturn", "sharpe": 9.0184, "sortino": 19.1242, "return_pct": 63.37, "equity": 1633.73, "max_dd": 1.62, "win_rate": 68.48, "profit_factor": 4.457, "ic": 0.6776, "hit": 68.48, "n": 165, "precision": 0.7358, "recall": 0.5065, "f1": 0.6, "f2": 0.5402, "mcc": 0.3712, "accuracy": 0.6848, "tp": 39, "fp": 14, "tn": 74, "fn": 38, "aleatoric_mean": 1.6e-05, "epistemic_mean": 3.2e-05, "confidence_mean": 1.0, "aleatoric_std": 9e-06, "epistemic_std": 1.9e-05}, {"fold": "fold_7", "regime": "Recent mixed/upturn", "sharpe": 6.1553, "sortino": 10.9833, "return_pct": 40.42, "equity": 1404.17, "max_dd": 2.6, "win_rate": 66.67, "profit_factor": 2.882, "ic": 0.6511, "hit": 66.67, "n": 162, "precision": 0.8649, "recall": 0.3951, "f1": 0.5424, "f2": 0.4432, "mcc": 0.397, "accuracy": 0.6667, "tp": 32, "fp": 5, "tn": 76, "fn": 49, "aleatoric_mean": 9e-06, "epistemic_mean": 1.7e-05, "confidence_mean": 1.0, "aleatoric_std": 6e-06, "epistemic_std": 1.2e-05}], "val_sharpe": 6.7125, "val_psr": 1.0, "val_equity": 4302.38, "val_sortino": 9.4577, "val_return_pct": 330.24, "val_max_dd": 4.71, "val_win_rate": 70.38, "val_profit_factor": 3.186, "val_ic": 0.5095, "val_hit": 69.92, "val_aleatoric_mean": 1e-05, "val_epistemic_mean": 2e-05, "val_confidence_mean": 1.0, "val_precision": 0.6789, "val_recall": 0.7068, "val_f1": 0.6926, "val_f2": 0.7011, "val_mcc": 0.4036, "val_accuracy": 0.7018, "val_per_window": [{"fold": "fold_1", "regime": "Pre-crisis upturn + GFC onset", "sharpe": 1.0765, "sortino": 2.1408, "return_pct": 2.67, "equity": 1026.74, "max_dd": 2.52, "win_rate": 50.0, "profit_factor": 1.195, "ic": 0.0084, "hit": 49.54, "n": 109, "precision": 0.5, "recall": 0.6364, "f1": 0.56, "f2": 0.6034, "mcc": -0.0123, "accuracy": 0.4954, "tp": 35, "fp": 35, "tn": 19, "fn": 20, "aleatoric_mean": 9e-06, "epistemic_mean": 1.8e-05, "confidence_mean": 1.0, "aleatoric_std": 8e-06, "epistemic_std": 1.6e-05}, {"fold": "fold_2", "regime": "Post-crash recovery", "sharpe": 1.7144, "sortino": 2.6609, "return_pct": 8.33, "equity": 1083.3, "max_dd": 4.71, "win_rate": 60.19, "profit_factor": 1.311, "ic": 0.1427, "hit": 60.19, "n": 108, "precision": 0.6613, "recall": 0.6508, "f1": 0.656, "f2": 0.6529, "mcc": 0.1836, "accuracy": 0.6019, "tp": 41, "fp": 21, "tn": 24, "fn": 22, "aleatoric_mean": 1.9e-05, "epistemic_mean": 3.8e-05, "confidence_mean": 0.9999, "aleatoric_std": 8e-06, "epistemic_std": 1.7e-05}, {"fold": "fold_3", "regime": "Eurozone debt plateau", "sharpe": 8.2323, "sortino": 10.9405, "return_pct": 34.15, "equity": 1341.48, "max_dd": 1.72, "win_rate": 75.23, "profit_factor": 3.911, "ic": 0.6507, "hit": 73.87, "n": 111, "precision": 0.7021, "recall": 0.7021, "f1": 0.7021, "f2": 0.7021, "mcc": 0.4834, "accuracy": 0.7477, "tp": 33, "fp": 14, "tn": 50, "fn": 14, "aleatoric_mean": 1.5e-05, "epistemic_mean": 3.1e-05, "confidence_mean": 1.0, "aleatoric_std": 7e-06, "epistemic_std": 1.5e-05}, {"fold": "fold_4", "regime": "Strong USD downturn", "sharpe": 11.897, "sortino": 25.8938, "return_pct": 39.03, "equity": 1390.32, "max_dd": 1.2, "win_rate": 82.57, "profit_factor": 8.399, "ic": 0.7348, "hit": 81.82, "n": 110, "precision": 0.8182, "recall": 0.766, "f1": 0.7912, "f2": 0.7759, "mcc": 0.6452, "accuracy": 0.8273, "tp": 36, "fp": 8, "tn": 55, "fn": 11, "aleatoric_mean": 9e-06, "epistemic_mean": 1.8e-05, "confidence_mean": 1.0, "aleatoric_std": 9e-06, "epistemic_std": 1.7e-05}, {"fold": "fold_5", "regime": "Low-vol plateau", "sharpe": 10.4741, "sortino": 37.4417, "return_pct": 33.72, "equity": 1337.23, "max_dd": 1.09, "win_rate": 67.86, "profit_factor": 6.306, "ic": 0.6178, "hit": 67.86, "n": 112, "precision": 0.6545, "recall": 0.6792, "f1": 0.6667, "f2": 0.6742, "mcc": 0.3568, "accuracy": 0.6786, "tp": 36, "fp": 19, "tn": 40, "fn": 17, "aleatoric_mean": 9e-06, "epistemic_mean": 1.8e-05, "confidence_mean": 1.0, "aleatoric_std": 8e-06, "epistemic_std": 1.5e-05}, {"fold": "fold_6", "regime": "EUR crisis downturn", "sharpe": 13.0411, "sortino": 44.7321, "return_pct": 25.88, "equity": 1258.84, "max_dd": 0.26, "win_rate": 81.31, "profit_factor": 12.128, "ic": 0.8031, "hit": 80.56, "n": 108, "precision": 0.8095, "recall": 0.7234, "f1": 0.764, "f2": 0.7391, "mcc": 0.6023, "accuracy": 0.8056, "tp": 34, "fp": 8, "tn": 53, "fn": 13, "aleatoric_mean": 5e-06, "epistemic_mean": 9e-06, "confidence_mean": 1.0, "aleatoric_std": 2e-06, "epistemic_std": 3e-06}, {"fold": "fold_7", "regime": "Recent mixed/upturn", "sharpe": 10.4385, "sortino": 22.9802, "return_pct": 23.2, "equity": 1232.04, "max_dd": 0.93, "win_rate": 75.45, "profit_factor": 5.685, "ic": 0.7064, "hit": 75.45, "n": 110, "precision": 0.7167, "recall": 0.8113, "f1": 0.7611, "f2": 0.7904, "mcc": 0.5149, "accuracy": 0.7545, "tp": 43, "fp": 17, "tn": 40, "fn": 10, "aleatoric_mean": 6e-06, "epistemic_mean": 1.2e-05, "confidence_mean": 1.0, "aleatoric_std": 3e-06, "epistemic_std": 7e-06}], "train_sharpe": 7.8771, "train_psr": 1.0, "train_equity": 5357926.0, "train_sortino": 23.1765, "train_return_pct": 535692.6, "train_max_dd": 2.03, "train_win_rate": 77.67, "train_profit_factor": 7.725, "train_ic": 0.7529, "train_hit": 77.36, "train_precision": 0.7809, "train_recall": 0.7834, "train_f1": 0.7821, "train_f2": 0.7829, "train_mcc": 0.5509, "train_accuracy": 0.7756, "train_per_window": [{"fold": "all_train", "regime": "Training data", "sharpe": 7.8771, "sortino": 23.1765, "return_pct": 535692.6, "equity": 5357926.0, "max_dd": 2.03, "win_rate": 77.67, "profit_factor": 7.725, "ic": 0.7529, "hit": 77.36, "n": 2478, "precision": 0.7809, "recall": 0.7834, "f1": 0.7821, "f2": 0.7829, "mcc": 0.5509, "accuracy": 0.7756, "tp": 998, "fp": 280, "tn": 924, "fn": 276}], "experiment_num": 154, "status": "DISCARD"}
