{"backbone": "lstm", "description": "lstm: Exp46 champion seed=77 variance", "config": {"seq_len": 10, "lr": 0.001, "batch_size": 16, "epochs": 100, "weight_decay": 0.0007, "patience": 15, "grad_clip": 1.0, "warmup_epochs": 0, "huber_delta": 1.0, "head_dropout": 0.25, "seed": 77, "het_loss": false}, "composite": 5.5699, "test_pos_folds": 7, "val_pos_folds": 6, "val_loss": 2.9e-05, "elapsed_sec": 62.3, "timestamp": "2026-04-19T21:00:24", "sharpe": 6.0367, "psr": 1.0, "equity": 10373.46, "sortino": 7.1453, "return_pct": 937.35, "max_dd": 7.54, "win_rate": 69.76, "profit_factor": 3.177, "ic": 0.595, "hit": 69.48, "aleatoric_mean": 8e-06, "epistemic_mean": 1.6e-05, "confidence_mean": 1.0, "precision": 0.8026, "recall": 0.5156, "f1": 0.6278, "f2": 0.5553, "mcc": 0.4206, "accuracy": 0.6978, "per_window": [{"fold": "fold_1", "regime": "Pre-crisis upturn + GFC onset", "sharpe": 0.9764, "sortino": 0.9958, "return_pct": 7.02, "equity": 1070.2, "max_dd": 7.54, "win_rate": 60.78, "profit_factor": 1.26, "ic": 0.2239, "hit": 60.19, "n": 103, "precision": 0.697, "recall": 0.434, "f1": 0.5349, "f2": 0.4694, "mcc": 0.2506, "accuracy": 0.6117, "tp": 23, "fp": 10, "tn": 40, "fn": 30, "aleatoric_mean": 1.2e-05, "epistemic_mean": 2.3e-05, "confidence_mean": 1.0, "aleatoric_std": 5e-06, "epistemic_std": 1.1e-05}, {"fold": "fold_2", "regime": "Post-crash recovery", "sharpe": 1.9042, "sortino": 3.2243, "return_pct": 9.2, "equity": 1092.04, "max_dd": 4.74, "win_rate": 54.21, "profit_factor": 1.348, "ic": 0.0315, "hit": 54.21, "n": 107, "precision": 0.5294, "recall": 0.3529, "f1": 0.4235, "f2": 0.3782, "mcc": 0.0721, "accuracy": 0.5421, "tp": 18, "fp": 16, "tn": 40, "fn": 33, "aleatoric_mean": 9e-06, "epistemic_mean": 1.8e-05, "confidence_mean": 1.0, "aleatoric_std": 4e-06, "epistemic_std": 8e-06}, {"fold": "fold_3", "regime": "Eurozone debt plateau", "sharpe": 10.0442, "sortino": 18.7731, "return_pct": 34.96, "equity": 1349.62, "max_dd": 1.32, "win_rate": 73.08, "profit_factor": 4.991, "ic": 0.6724, "hit": 71.7, "n": 106, "precision": 0.85, "recall": 0.5965, "f1": 0.701, "f2": 0.6343, "mcc": 0.4876, "accuracy": 0.7264, "tp": 34, "fp": 6, "tn": 43, "fn": 23, "aleatoric_mean": 9e-06, "epistemic_mean": 1.9e-05, "confidence_mean": 1.0, "aleatoric_std": 4e-06, "epistemic_std": 9e-06}, {"fold": "fold_4", "regime": "Strong USD downturn", "sharpe": 12.0668, "sortino": 28.8827, "return_pct": 110.23, "equity": 2102.28, "max_dd": 0.97, "win_rate": 83.23, "profit_factor": 9.351, "ic": 0.7975, "hit": 82.74, "n": 168, "precision": 0.8816, "recall": 0.7791, "f1": 0.8272, "f2": 0.7976, "mcc": 0.6722, "accuracy": 0.8333, "tp": 67, "fp": 9, "tn": 73, "fn": 19, "aleatoric_mean": 8e-06, "epistemic_mean": 1.5e-05, "confidence_mean": 1.0, "aleatoric_std": 4e-06, "epistemic_std": 7e-06}, {"fold": "fold_5", "regime": "Low-vol plateau", "sharpe": 7.4429, "sortino": 10.8544, "return_pct": 25.08, "equity": 1250.78, "max_dd": 1.55, "win_rate": 69.14, "profit_factor": 3.55, "ic": 0.7672, "hit": 69.14, "n": 162, "precision": 0.9333, "recall": 0.3684, "f1": 0.5283, "f2": 0.4192, "mcc": 0.4434, "accuracy": 0.6914, "tp": 28, "fp": 2, "tn": 84, "fn": 48, "aleatoric_mean": 5e-06, "epistemic_mean": 1.1e-05, "confidence_mean": 1.0, "aleatoric_std": 2e-06, "epistemic_std": 4e-06}, {"fold": "fold_6", "regime": "EUR crisis downturn", "sharpe": 10.986, "sortino": 21.8044, "return_pct": 76.11, "equity": 1761.14, "max_dd": 1.64, "win_rate": 72.12, "profit_factor": 6.403, "ic": 0.7818, "hit": 72.12, "n": 165, "precision": 0.7719, "recall": 0.5714, "f1": 0.6567, "f2": 0.6027, "mcc": 0.4445, "accuracy": 0.7212, "tp": 44, "fp": 13, "tn": 75, "fn": 33, "aleatoric_mean": 7e-06, "epistemic_mean": 1.4e-05, "confidence_mean": 1.0, "aleatoric_std": 2e-06, "epistemic_std": 5e-06}, {"fold": "fold_7", "regime": "Recent mixed/upturn", "sharpe": 6.3918, "sortino": 11.4015, "return_pct": 42.02, "equity": 1420.19, "max_dd": 2.09, "win_rate": 67.9, "profit_factor": 3.007, "ic": 0.7272, "hit": 67.9, "n": 162, "precision": 0.8718, "recall": 0.4198, "f1": 0.5667, "f2": 0.4683, "mcc": 0.4187, "accuracy": 0.679, "tp": 34, "fp": 5, "tn": 76, "fn": 47, "aleatoric_mean": 8e-06, "epistemic_mean": 1.6e-05, "confidence_mean": 1.0, "aleatoric_std": 3e-06, "epistemic_std": 6e-06}], "val_sharpe": 5.6699, "val_psr": 1.0, "val_equity": 3521.75, "val_sortino": 8.8845, "val_return_pct": 252.17, "val_max_dd": 6.82, "val_win_rate": 65.53, "val_profit_factor": 2.643, "val_ic": 0.5961, "val_hit": 65.1, "val_aleatoric_mean": 7e-06, "val_epistemic_mean": 1.3e-05, "val_confidence_mean": 1.0, "val_precision": 0.7802, "val_recall": 0.389, "val_f1": 0.5192, "val_f2": 0.4324, "val_mcc": 0.3403, "val_accuracy": 0.6576, "val_per_window": [{"fold": "fold_1", "regime": "Pre-crisis upturn + GFC onset", "sharpe": -1.9622, "sortino": -3.0024, "return_pct": -4.87, "equity": 951.31, "max_dd": 5.88, "win_rate": 43.52, "profit_factor": 0.722, "ic": 0.0386, "hit": 43.12, "n": 109, "precision": 0.35, "recall": 0.1273, "f1": 0.1867, "f2": 0.1458, "mcc": -0.1466, "accuracy": 0.4404, "tp": 7, "fp": 13, "tn": 41, "fn": 48, "aleatoric_mean": 6e-06, "epistemic_mean": 1.2e-05, "confidence_mean": 1.0, "aleatoric_std": 2e-06, "epistemic_std": 5e-06}, {"fold": "fold_2", "regime": "Post-crash recovery", "sharpe": 0.5121, "sortino": 0.8128, "return_pct": 2.23, "equity": 1022.34, "max_dd": 5.52, "win_rate": 49.07, "profit_factor": 1.084, "ic": 0.0886, "hit": 49.07, "n": 108, "precision": 0.6176, "recall": 0.3333, "f1": 0.433, "f2": 0.3671, "mcc": 0.0472, "accuracy": 0.4907, "tp": 21, "fp": 13, "tn": 32, "fn": 42, "aleatoric_mean": 9e-06, "epistemic_mean": 1.8e-05, "confidence_mean": 1.0, "aleatoric_std": 4e-06, "epistemic_std": 8e-06}, {"fold": "fold_3", "regime": "Eurozone debt plateau", "sharpe": 12.4234, "sortino": 30.1428, "return_pct": 48.28, "equity": 1482.78, "max_dd": 0.78, "win_rate": 80.73, "profit_factor": 8.689, "ic": 0.8061, "hit": 79.28, "n": 111, "precision": 0.7955, "recall": 0.7447, "f1": 0.7692, "f2": 0.7543, "mcc": 0.6102, "accuracy": 0.8108, "tp": 35, "fp": 9, "tn": 55, "fn": 12, "aleatoric_mean": 6e-06, "epistemic_mean": 1.2e-05, "confidence_mean": 1.0, "aleatoric_std": 2e-06, "epistemic_std": 5e-06}, {"fold": "fold_4", "regime": "Strong USD downturn", "sharpe": 9.129, "sortino": 24.0503, "return_pct": 31.48, "equity": 1314.81, "max_dd": 1.28, "win_rate": 70.64, "profit_factor": 4.787, "ic": 0.822, "hit": 70.0, "n": 110, "precision": 1.0, "recall": 0.3191, "f1": 0.4839, "f2": 0.3695, "mcc": 0.4601, "accuracy": 0.7091, "tp": 15, "fp": 0, "tn": 63, "fn": 32, "aleatoric_mean": 6e-06, "epistemic_mean": 1.2e-05, "confidence_mean": 1.0, "aleatoric_std": 2e-06, "epistemic_std": 4e-06}, {"fold": "fold_5", "regime": "Low-vol plateau", "sharpe": 11.9593, "sortino": 36.5901, "return_pct": 37.39, "equity": 1373.86, "max_dd": 0.81, "win_rate": 75.0, "profit_factor": 8.685, "ic": 0.8962, "hit": 75.0, "n": 112, "precision": 0.8788, "recall": 0.5472, "f1": 0.6744, "f2": 0.5918, "mcc": 0.525, "accuracy": 0.75, "tp": 29, "fp": 4, "tn": 55, "fn": 24, "aleatoric_mean": 6e-06, "epistemic_mean": 1.2e-05, "confidence_mean": 1.0, "aleatoric_std": 2e-06, "epistemic_std": 4e-06}, {"fold": "fold_6", "regime": "EUR crisis downturn", "sharpe": 6.417, "sortino": 12.7483, "return_pct": 14.53, "equity": 1145.28, "max_dd": 1.38, "win_rate": 66.36, "profit_factor": 3.004, "ic": 0.8416, "hit": 65.74, "n": 108, "precision": 1.0, "recall": 0.234, "f1": 0.3793, "f2": 0.2764, "mcc": 0.3836, "accuracy": 0.6667, "tp": 11, "fp": 0, "tn": 61, "fn": 36, "aleatoric_mean": 6e-06, "epistemic_mean": 1.1e-05, "confidence_mean": 1.0, "aleatoric_std": 2e-06, "epistemic_std": 4e-06}, {"fold": "fold_7", "regime": "Recent mixed/upturn", "sharpe": 7.7154, "sortino": 14.7251, "return_pct": 18.04, "equity": 1180.43, "max_dd": 1.09, "win_rate": 72.73, "profit_factor": 3.52, "ic": 0.7774, "hit": 72.73, "n": 110, "precision": 0.96, "recall": 0.4528, "f1": 0.6154, "f2": 0.5063, "mcc": 0.519, "accuracy": 0.7273, "tp": 24, "fp": 1, "tn": 56, "fn": 29, "aleatoric_mean": 7e-06, "epistemic_mean": 1.3e-05, "confidence_mean": 1.0, "aleatoric_std": 3e-06, "epistemic_std": 5e-06}], "train_sharpe": 6.0714, "train_psr": 1.0, "train_equity": 978488.88, "train_sortino": 15.7854, "train_return_pct": 97748.89, "train_max_dd": 5.37, "train_win_rate": 69.89, "train_profit_factor": 4.255, "train_ic": 0.7251, "train_hit": 69.61, "train_precision": 0.885, "train_recall": 0.4772, "train_f1": 0.6201, "train_f2": 0.5257, "train_mcc": 0.4596, "train_accuracy": 0.6994, "train_per_window": [{"fold": "all_train", "regime": "Training data", "sharpe": 6.0714, "sortino": 15.7854, "return_pct": 97748.89, "equity": 978488.88, "max_dd": 5.37, "win_rate": 69.89, "profit_factor": 4.255, "ic": 0.7251, "hit": 69.61, "n": 2478, "precision": 0.885, "recall": 0.4772, "f1": 0.6201, "f2": 0.5257, "mcc": 0.4596, "accuracy": 0.6994, "tp": 608, "fp": 79, "tn": 1125, "fn": 666}], "experiment_num": 151, "status": "DISCARD"}
{"backbone": "mamba", "description": "mamba: Exp1 vanilla canonical Mamba SOTA recipe (Gu Dao 2024)", "config": {"seq_len": 10, "lr": 0.0005, "batch_size": 32, "epochs": 100, "weight_decay": 0.1, "patience": 20, "grad_clip": 1.0, "warmup_epochs": 10, "huber_delta": 1.0, "head_dropout": 0.1, "seed": 42, "mamba_variant": "vanilla", "het_loss": false}, "composite": 5.2714, "test_pos_folds": 6, "val_pos_folds": 7, "val_loss": 3.8e-05, "elapsed_sec": 359.0, "timestamp": "2026-04-19T22:20:26", "sharpe": 5.3714, "psr": 1.0, "equity": 8227.1, "sortino": 10.2816, "return_pct": 722.71, "max_dd": 7.43, "win_rate": 66.46, "profit_factor": 2.774, "ic": 0.4476, "hit": 66.19, "aleatoric_mean": 1.5e-05, "epistemic_mean": 2.9e-05, "confidence_mean": 1.0, "precision": 0.6842, "recall": 0.5946, "f1": 0.6363, "f2": 0.6106, "mcc": 0.3296, "accuracy": 0.6639, "per_window": [{"fold": "fold_1", "regime": "Pre-crisis upturn + GFC onset", "sharpe": 2.8839, "sortino": 8.0473, "return_pct": 23.59, "equity": 1235.94, "max_dd": 3.97, "win_rate": 53.92, "profit_factor": 2.007, "ic": 0.1665, "hit": 53.4, "n": 103, "precision": 0.5362, "recall": 0.6981, "f1": 0.6066, "f2": 0.6584, "mcc": 0.0618, "accuracy": 0.534, "tp": 37, "fp": 32, "tn": 18, "fn": 16, "aleatoric_mean": 2.1e-05, "epistemic_mean": 4.2e-05, "confidence_mean": 0.9999, "aleatoric_std": 1.1e-05, "epistemic_std": 2.2e-05}, {"fold": "fold_2", "regime": "Post-crash recovery", "sharpe": -0.9821, "sortino": -1.7836, "return_pct": -4.86, "equity": 951.45, "max_dd": 7.32, "win_rate": 42.99, "profit_factor": 0.857, "ic": -0.0949, "hit": 42.99, "n": 107, "precision": 0.4138, "recall": 0.4706, "f1": 0.4404, "f2": 0.458, "mcc": -0.1369, "accuracy": 0.4299, "tp": 24, "fp": 34, "tn": 22, "fn": 27, "aleatoric_mean": 1.8e-05, "epistemic_mean": 3.6e-05, "confidence_mean": 0.9999, "aleatoric_std": 8e-06, "epistemic_std": 1.5e-05}, {"fold": "fold_3", "regime": "Eurozone debt plateau", "sharpe": 7.6719, "sortino": 13.7229, "return_pct": 27.6, "equity": 1275.98, "max_dd": 2.7, "win_rate": 71.15, "profit_factor": 3.368, "ic": 0.5395, "hit": 69.81, "n": 106, "precision": 0.7826, "recall": 0.6316, "f1": 0.699, "f2": 0.6569, "mcc": 0.43, "accuracy": 0.7075, "tp": 36, "fp": 10, "tn": 39, "fn": 21, "aleatoric_mean": 2.1e-05, "epistemic_mean": 4.2e-05, "confidence_mean": 0.9999, "aleatoric_std": 1e-05, "epistemic_std": 2.1e-05}, {"fold": "fold_4", "regime": "Strong USD downturn", "sharpe": 8.1212, "sortino": 16.1982, "return_pct": 74.73, "equity": 1747.33, "max_dd": 3.02, "win_rate": 73.65, "profit_factor": 4.092, "ic": 0.5935, "hit": 73.21, "n": 168, "precision": 0.7386, "recall": 0.7558, "f1": 0.7471, "f2": 0.7523, "mcc": 0.4757, "accuracy": 0.7381, "tp": 65, "fp": 23, "tn": 59, "fn": 21, "aleatoric_mean": 1.7e-05, "epistemic_mean": 3.3e-05, "confidence_mean": 0.9999, "aleatoric_std": 9e-06, "epistemic_std": 1.8e-05}, {"fold": "fold_5", "regime": "Low-vol plateau", "sharpe": 8.3883, "sortino": 15.2793, "return_pct": 27.94, "equity": 1279.35, "max_dd": 1.76, "win_rate": 72.84, "profit_factor": 4.22, "ic": 0.6161, "hit": 72.84, "n": 162, "precision": 0.8077, "recall": 0.5526, "f1": 0.6563, "f2": 0.5899, "mcc": 0.4664, "accuracy": 0.7284, "tp": 42, "fp": 10, "tn": 76, "fn": 34, "aleatoric_mean": 7e-06, "epistemic_mean": 1.5e-05, "confidence_mean": 1.0, "aleatoric_std": 6e-06, "epistemic_std": 1.2e-05}, {"fold": "fold_6", "regime": "EUR crisis downturn", "sharpe": 10.2623, "sortino": 27.2269, "return_pct": 71.57, "equity": 1715.66, "max_dd": 1.17, "win_rate": 69.09, "profit_factor": 5.585, "ic": 0.6392, "hit": 69.09, "n": 165, "precision": 0.7031, "recall": 0.5844, "f1": 0.6383, "f2": 0.6048, "mcc": 0.3773, "accuracy": 0.6909, "tp": 45, "fp": 19, "tn": 69, "fn": 32, "aleatoric_mean": 1.5e-05, "epistemic_mean": 3e-05, "confidence_mean": 1.0, "aleatoric_std": 8e-06, "epistemic_std": 1.7e-05}, {"fold": "fold_7", "regime": "Recent mixed/upturn", "sharpe": 6.5316, "sortino": 11.2717, "return_pct": 42.96, "equity": 1429.63, "max_dd": 1.72, "win_rate": 70.37, "profit_factor": 3.083, "ic": 0.6545, "hit": 70.37, "n": 162, "precision": 0.9024, "recall": 0.4568, "f1": 0.6066, "f2": 0.5068, "mcc": 0.4685, "accuracy": 0.7037, "tp": 37, "fp": 4, "tn": 77, "fn": 44, "aleatoric_mean": 9e-06, "epistemic_mean": 1.9e-05, "confidence_mean": 1.0, "aleatoric_std": 5e-06, "epistemic_std": 1e-05}], "val_sharpe": 6.3009, "val_psr": 1.0, "val_equity": 3981.77, "val_sortino": 9.4159, "val_return_pct": 298.18, "val_max_dd": 4.59, "val_win_rate": 68.81, "val_profit_factor": 2.958, "val_ic": 0.4869, "val_hit": 68.36, "val_aleatoric_mean": 1e-05, "val_epistemic_mean": 2.1e-05, "val_confidence_mean": 1.0, "val_precision": 0.6606, "val_recall": 0.6986, "val_f1": 0.6791, "val_f2": 0.6907, "val_mcc": 0.3731, "val_accuracy": 0.6862, "val_per_window": [{"fold": "fold_1", "regime": "Pre-crisis upturn + GFC onset", "sharpe": 0.8929, "sortino": 1.7267, "return_pct": 2.2, "equity": 1022.02, "max_dd": 3.17, "win_rate": 48.15, "profit_factor": 1.16, "ic": -0.0003, "hit": 47.71, "n": 109, "precision": 0.4857, "recall": 0.6182, "f1": 0.544, "f2": 0.5862, "mcc": -0.0506, "accuracy": 0.4771, "tp": 34, "fp": 36, "tn": 18, "fn": 21, "aleatoric_mean": 9e-06, "epistemic_mean": 1.8e-05, "confidence_mean": 1.0, "aleatoric_std": 7e-06, "epistemic_std": 1.4e-05}, {"fold": "fold_2", "regime": "Post-crash recovery", "sharpe": 1.366, "sortino": 2.1522, "return_pct": 6.54, "equity": 1065.38, "max_dd": 4.52, "win_rate": 57.41, "profit_factor": 1.241, "ic": 0.0953, "hit": 57.41, "n": 108, "precision": 0.6308, "recall": 0.6508, "f1": 0.6406, "f2": 0.6467, "mcc": 0.1183, "accuracy": 0.5741, "tp": 41, "fp": 24, "tn": 21, "fn": 22, "aleatoric_mean": 1.8e-05, "epistemic_mean": 3.6e-05, "confidence_mean": 0.9999, "aleatoric_std": 7e-06, "epistemic_std": 1.4e-05}, {"fold": "fold_3", "regime": "Eurozone debt plateau", "sharpe": 9.1798, "sortino": 16.2457, "return_pct": 37.66, "equity": 1376.6, "max_dd": 1.51, "win_rate": 73.39, "profit_factor": 4.627, "ic": 0.6248, "hit": 72.07, "n": 111, "precision": 0.6735, "recall": 0.7021, "f1": 0.6875, "f2": 0.6962, "mcc": 0.4499, "accuracy": 0.7297, "tp": 33, "fp": 16, "tn": 48, "fn": 14, "aleatoric_mean": 1.5e-05, "epistemic_mean": 3e-05, "confidence_mean": 1.0, "aleatoric_std": 7e-06, "epistemic_std": 1.4e-05}, {"fold": "fold_4", "regime": "Strong USD downturn", "sharpe": 10.2935, "sortino": 21.5147, "return_pct": 34.83, "equity": 1348.27, "max_dd": 1.79, "win_rate": 77.98, "profit_factor": 5.997, "ic": 0.6943, "hit": 77.27, "n": 110, "precision": 0.7447, "recall": 0.7447, "f1": 0.7447, "f2": 0.7447, "mcc": 0.5542, "accuracy": 0.7818, "tp": 35, "fp": 12, "tn": 51, "fn": 12, "aleatoric_mean": 1.1e-05, "epistemic_mean": 2.1e-05, "confidence_mean": 1.0, "aleatoric_std": 1e-05, "epistemic_std": 2.1e-05}, {"fold": "fold_5", "regime": "Low-vol plateau", "sharpe": 8.1153, "sortino": 18.681, "return_pct": 27.12, "equity": 1271.21, "max_dd": 1.28, "win_rate": 65.18, "profit_factor": 4.003, "ic": 0.5914, "hit": 65.18, "n": 112, "precision": 0.625, "recall": 0.6604, "f1": 0.6422, "f2": 0.653, "mcc": 0.304, "accuracy": 0.6518, "tp": 35, "fp": 21, "tn": 38, "fn": 18, "aleatoric_mean": 9e-06, "epistemic_mean": 1.8e-05, "confidence_mean": 1.0, "aleatoric_std": 7e-06, "epistemic_std": 1.4e-05}, {"fold": "fold_6", "regime": "EUR crisis downturn", "sharpe": 14.366, "sortino": 64.7972, "return_pct": 27.55, "equity": 1275.52, "max_dd": 0.22, "win_rate": 86.92, "profit_factor": 18.235, "ic": 0.8331, "hit": 86.11, "n": 108, "precision": 0.8636, "recall": 0.8085, "f1": 0.8352, "f2": 0.819, "mcc": 0.7166, "accuracy": 0.8611, "tp": 38, "fp": 6, "tn": 55, "fn": 9, "aleatoric_mean": 5e-06, "epistemic_mean": 1e-05, "confidence_mean": 1.0, "aleatoric_std": 1e-06, "epistemic_std": 3e-06}, {"fold": "fold_7", "regime": "Recent mixed/upturn", "sharpe": 9.4911, "sortino": 21.3436, "return_pct": 21.51, "equity": 1215.13, "max_dd": 0.93, "win_rate": 72.73, "profit_factor": 4.79, "ic": 0.6473, "hit": 72.73, "n": 110, "precision": 0.7091, "recall": 0.7358, "f1": 0.7222, "f2": 0.7303, "mcc": 0.4548, "accuracy": 0.7273, "tp": 39, "fp": 16, "tn": 41, "fn": 14, "aleatoric_mean": 7e-06, "epistemic_mean": 1.3e-05, "confidence_mean": 1.0, "aleatoric_std": 3e-06, "epistemic_std": 7e-06}], "train_sharpe": 7.9577, "train_psr": 1.0, "train_equity": 5751280.0, "train_sortino": 21.601, "train_return_pct": 575028.0, "train_max_dd": 3.08, "train_win_rate": 77.96, "train_profit_factor": 7.972, "train_ic": 0.7556, "train_hit": 77.64, "train_precision": 0.794, "train_recall": 0.7684, "train_f1": 0.781, "train_f2": 0.7734, "train_mcc": 0.5573, "train_accuracy": 0.7785, "train_per_window": [{"fold": "all_train", "regime": "Training data", "sharpe": 7.9577, "sortino": 21.601, "return_pct": 575028.0, "equity": 5751280.0, "max_dd": 3.08, "win_rate": 77.96, "profit_factor": 7.972, "ic": 0.7556, "hit": 77.64, "n": 2478, "precision": 0.794, "recall": 0.7684, "f1": 0.781, "f2": 0.7734, "mcc": 0.5573, "accuracy": 0.7785, "tp": 979, "fp": 254, "tn": 950, "fn": 295}], "experiment_num": 152, "status": "DISCARD"}
