{"backbone": "lstm", "description": "lstm: Exp34 het_loss at champion config (Kendall Gal 2017 retry)", "config": {"seq_len": 10, "lr": 0.001, "batch_size": 16, "epochs": 100, "weight_decay": 0.001, "patience": 15, "grad_clip": 1.0, "warmup_epochs": 0, "huber_delta": 1.0, "head_dropout": 0.25, "seed": 42, "het_loss": true}, "composite": 6.1212, "test_pos_folds": 7, "val_pos_folds": 6, "val_loss": -2.988715, "elapsed_sec": 49.4, "timestamp": "2026-04-19T19:47:04", "sharpe": 6.2212, "psr": 1.0, "equity": 11044.73, "sortino": 7.531, "return_pct": 1004.47, "max_dd": 8.42, "win_rate": 69.45, "profit_factor": 3.301, "ic": 0.5402, "hit": 69.17, "aleatoric_mean": 0.002486, "epistemic_mean": 2.2e-05, "confidence_mean": 0.9975, "precision": 0.7241, "recall": 0.6112, "f1": 0.6629, "f2": 0.6309, "mcc": 0.3889, "accuracy": 0.6927, "per_window": [{"fold": "fold_1", "regime": "Pre-crisis upturn + GFC onset", "sharpe": 1.7907, "sortino": 1.9888, "return_pct": 13.88, "equity": 1138.75, "max_dd": 8.42, "win_rate": 51.96, "profit_factor": 1.532, "ic": 0.1572, "hit": 51.46, "n": 103, "precision": 0.5217, "recall": 0.6792, "f1": 0.5902, "f2": 0.6406, "mcc": 0.0205, "accuracy": 0.5146, "tp": 36, "fp": 33, "tn": 17, "fn": 17, "aleatoric_mean": 0.002483, "epistemic_mean": 2.4e-05, "confidence_mean": 0.9975, "aleatoric_std": 1.6e-05, "epistemic_std": 8e-06}, {"fold": "fold_2", "regime": "Post-crash recovery", "sharpe": 2.315, "sortino": 4.1015, "return_pct": 11.32, "equity": 1113.22, "max_dd": 4.7, "win_rate": 57.01, "profit_factor": 1.437, "ic": 0.1177, "hit": 57.01, "n": 107, "precision": 0.549, "recall": 0.549, "f1": 0.549, "f2": 0.549, "mcc": 0.1383, "accuracy": 0.5701, "tp": 28, "fp": 23, "tn": 33, "fn": 23, "aleatoric_mean": 0.002485, "epistemic_mean": 2.3e-05, "confidence_mean": 0.9975, "aleatoric_std": 2.3e-05, "epistemic_std": 8e-06}, {"fold": "fold_3", "regime": "Eurozone debt plateau", "sharpe": 8.2997, "sortino": 12.8335, "return_pct": 29.64, "equity": 1296.42, "max_dd": 2.66, "win_rate": 74.04, "profit_factor": 3.731, "ic": 0.5577, "hit": 72.64, "n": 106, "precision": 0.7231, "recall": 0.8246, "f1": 0.7705, "f2": 0.802, "mcc": 0.4681, "accuracy": 0.7358, "tp": 47, "fp": 18, "tn": 31, "fn": 10, "aleatoric_mean": 0.002486, "epistemic_mean": 2.3e-05, "confidence_mean": 0.9975, "aleatoric_std": 2.7e-05, "epistemic_std": 7e-06}, {"fold": "fold_4", "regime": "Strong USD downturn", "sharpe": 9.9664, "sortino": 22.7974, "return_pct": 92.0, "equity": 1919.97, "max_dd": 2.65, "win_rate": 76.05, "profit_factor": 5.87, "ic": 0.7518, "hit": 75.6, "n": 168, "precision": 0.8947, "recall": 0.593, "f1": 0.7133, "f2": 0.6359, "mcc": 0.5488, "accuracy": 0.756, "tp": 51, "fp": 6, "tn": 76, "fn": 35, "aleatoric_mean": 0.002486, "epistemic_mean": 2.1e-05, "confidence_mean": 0.9975, "aleatoric_std": 2.9e-05, "epistemic_std": 7e-06}, {"fold": "fold_5", "regime": "Low-vol plateau", "sharpe": 7.5391, "sortino": 14.6561, "return_pct": 25.38, "equity": 1253.75, "max_dd": 1.76, "win_rate": 67.28, "profit_factor": 3.612, "ic": 0.7192, "hit": 67.28, "n": 162, "precision": 0.8286, "recall": 0.3816, "f1": 0.5225, "f2": 0.4277, "mcc": 0.3781, "accuracy": 0.6728, "tp": 29, "fp": 6, "tn": 80, "fn": 47, "aleatoric_mean": 0.002485, "epistemic_mean": 2e-05, "confidence_mean": 0.9975, "aleatoric_std": 2.8e-05, "epistemic_std": 7e-06}, {"fold": "fold_6", "regime": "EUR crisis downturn", "sharpe": 11.0353, "sortino": 21.9152, "return_pct": 76.42, "equity": 1764.18, "max_dd": 1.53, "win_rate": 75.15, "profit_factor": 6.464, "ic": 0.7135, "hit": 75.15, "n": 165, "precision": 0.7903, "recall": 0.6364, "f1": 0.705, "f2": 0.6622, "mcc": 0.5033, "accuracy": 0.7515, "tp": 49, "fp": 13, "tn": 75, "fn": 28, "aleatoric_mean": 0.002486, "epistemic_mean": 2.2e-05, "confidence_mean": 0.9975, "aleatoric_std": 2.9e-05, "epistemic_std": 7e-06}, {"fold": "fold_7", "regime": "Recent mixed/upturn", "sharpe": 8.8717, "sortino": 14.1445, "return_pct": 58.25, "equity": 1582.53, "max_dd": 2.31, "win_rate": 75.31, "profit_factor": 4.783, "ic": 0.68, "hit": 75.31, "n": 162, "precision": 0.806, "recall": 0.6667, "f1": 0.7297, "f2": 0.6905, "mcc": 0.5139, "accuracy": 0.7531, "tp": 54, "fp": 13, "tn": 68, "fn": 27, "aleatoric_mean": 0.002487, "epistemic_mean": 2.2e-05, "confidence_mean": 0.9975, "aleatoric_std": 2.7e-05, "epistemic_std": 7e-06}], "val_sharpe": 6.3742, "val_psr": 1.0, "val_equity": 4037.71, "val_sortino": 9.9571, "val_return_pct": 303.77, "val_max_dd": 5.61, "val_win_rate": 67.76, "val_profit_factor": 2.997, "val_ic": 0.5268, "val_hit": 67.32, "val_aleatoric_mean": 0.002484, "val_epistemic_mean": 2.1e-05, "val_confidence_mean": 0.9975, "val_precision": 0.7438, "val_recall": 0.4932, "val_f1": 0.5931, "val_f2": 0.5288, "val_mcc": 0.3647, "val_accuracy": 0.6784, "val_per_window": [{"fold": "fold_1", "regime": "Pre-crisis upturn + GFC onset", "sharpe": -0.57, "sortino": -0.8218, "return_pct": -1.5, "equity": 984.99, "max_dd": 3.9, "win_rate": 49.07, "profit_factor": 0.91, "ic": 0.0035, "hit": 48.62, "n": 109, "precision": 0.4884, "recall": 0.3818, "f1": 0.4286, "f2": 0.3992, "mcc": -0.0262, "accuracy": 0.4862, "tp": 21, "fp": 22, "tn": 32, "fn": 34, "aleatoric_mean": 0.002486, "epistemic_mean": 2.1e-05, "confidence_mean": 0.9975, "aleatoric_std": 3.7e-05, "epistemic_std": 7e-06}, {"fold": "fold_2", "regime": "Post-crash recovery", "sharpe": 1.908, "sortino": 3.0263, "return_pct": 9.33, "equity": 1093.34, "max_dd": 5.61, "win_rate": 53.7, "profit_factor": 1.352, "ic": 0.0342, "hit": 53.7, "n": 108, "precision": 0.6226, "recall": 0.5238, "f1": 0.569, "f2": 0.541, "mcc": 0.0783, "accuracy": 0.537, "tp": 33, "fp": 20, "tn": 25, "fn": 30, "aleatoric_mean": 0.002481, "epistemic_mean": 2.3e-05, "confidence_mean": 0.9975, "aleatoric_std": 1.1e-05, "epistemic_std": 7e-06}, {"fold": "fold_3", "regime": "Eurozone debt plateau", "sharpe": 12.4184, "sortino": 25.4302, "return_pct": 48.26, "equity": 1482.64, "max_dd": 0.94, "win_rate": 83.49, "profit_factor": 8.68, "ic": 0.7858, "hit": 81.98, "n": 111, "precision": 0.8537, "recall": 0.7447, "f1": 0.7955, "f2": 0.7642, "mcc": 0.6664, "accuracy": 0.8378, "tp": 35, "fp": 6, "tn": 58, "fn": 12, "aleatoric_mean": 0.002486, "epistemic_mean": 2.2e-05, "confidence_mean": 0.9975, "aleatoric_std": 2.1e-05, "epistemic_std": 8e-06}, {"fold": "fold_4", "regime": "Strong USD downturn", "sharpe": 12.5495, "sortino": 36.0222, "return_pct": 40.61, "equity": 1406.09, "max_dd": 0.68, "win_rate": 79.82, "profit_factor": 9.756, "ic": 0.7546, "hit": 79.09, "n": 110, "precision": 0.9032, "recall": 0.5957, "f1": 0.7179, "f2": 0.6393, "mcc": 0.6027, "accuracy": 0.8, "tp": 28, "fp": 3, "tn": 60, "fn": 19, "aleatoric_mean": 0.002482, "epistemic_mean": 2.1e-05, "confidence_mean": 0.9975, "aleatoric_std": 1.4e-05, "epistemic_std": 7e-06}, {"fold": "fold_5", "regime": "Low-vol plateau", "sharpe": 8.5348, "sortino": 24.8919, "return_pct": 28.36, "equity": 1283.63, "max_dd": 0.55, "win_rate": 66.07, "profit_factor": 4.326, "ic": 0.7935, "hit": 66.07, "n": 112, "precision": 0.8571, "recall": 0.3396, "f1": 0.4865, "f2": 0.3863, "mcc": 0.3694, "accuracy": 0.6607, "tp": 18, "fp": 3, "tn": 56, "fn": 35, "aleatoric_mean": 0.002482, "epistemic_mean": 2e-05, "confidence_mean": 0.9975, "aleatoric_std": 1.3e-05, "epistemic_std": 7e-06}, {"fold": "fold_6", "regime": "EUR crisis downturn", "sharpe": 8.2562, "sortino": 17.45, "return_pct": 18.19, "equity": 1181.94, "max_dd": 0.75, "win_rate": 71.96, "profit_factor": 4.21, "ic": 0.8086, "hit": 71.3, "n": 108, "precision": 1.0, "recall": 0.3617, "f1": 0.5312, "f2": 0.4146, "mcc": 0.4924, "accuracy": 0.7222, "tp": 17, "fp": 0, "tn": 61, "fn": 30, "aleatoric_mean": 0.002489, "epistemic_mean": 2.1e-05, "confidence_mean": 0.9975, "aleatoric_std": 4.4e-05, "epistemic_std": 7e-06}, {"fold": "fold_7", "regime": "Recent mixed/upturn", "sharpe": 7.9581, "sortino": 17.2537, "return_pct": 18.54, "equity": 1185.4, "max_dd": 1.09, "win_rate": 70.0, "profit_factor": 3.669, "ic": 0.6389, "hit": 70.0, "n": 110, "precision": 0.7778, "recall": 0.5283, "f1": 0.6292, "f2": 0.5645, "mcc": 0.4131, "accuracy": 0.7, "tp": 28, "fp": 8, "tn": 49, "fn": 25, "aleatoric_mean": 0.002484, "epistemic_mean": 2.1e-05, "confidence_mean": 0.9975, "aleatoric_std": 1.8e-05, "epistemic_std": 7e-06}], "train_sharpe": 5.8773, "train_psr": 1.0, "train_equity": 804950.75, "train_sortino": 13.8717, "train_return_pct": 80395.07, "train_max_dd": 4.57, "train_win_rate": 69.98, "train_profit_factor": 4.026, "train_ic": 0.6415, "train_hit": 69.69, "train_precision": 0.8101, "train_recall": 0.5424, "train_f1": 0.6497, "train_f2": 0.5808, "train_mcc": 0.429, "train_accuracy": 0.6994, "train_per_window": [{"fold": "all_train", "regime": "Training data", "sharpe": 5.8773, "sortino": 13.8717, "return_pct": 80395.07, "equity": 804950.75, "max_dd": 4.57, "win_rate": 69.98, "profit_factor": 4.026, "ic": 0.6415, "hit": 69.69, "n": 2478, "precision": 0.8101, "recall": 0.5424, "f1": 0.6497, "f2": 0.5808, "mcc": 0.429, "accuracy": 0.6994, "tp": 691, "fp": 162, "tn": 1042, "fn": 583}], "experiment_num": 139, "status": "DISCARD"}
{"backbone": "lstm", "description": "lstm: Exp35 wd=7e-4 fine-grained around champion", "config": {"seq_len": 10, "lr": 0.001, "batch_size": 16, "epochs": 100, "weight_decay": 0.0007, "patience": 15, "grad_clip": 1.0, "warmup_epochs": 0, "huber_delta": 1.0, "head_dropout": 0.25, "seed": 42, "het_loss": false}, "composite": 6.4242, "test_pos_folds": 7, "val_pos_folds": 6, "val_loss": 2.8e-05, "elapsed_sec": 52.1, "timestamp": "2026-04-19T19:48:20", "sharpe": 6.5242, "psr": 1.0, "equity": 12222.92, "sortino": 7.2971, "return_pct": 1122.29, "max_dd": 7.54, "win_rate": 73.07, "profit_factor": 3.519, "ic": 0.5598, "hit": 72.76, "aleatoric_mean": 6e-06, "epistemic_mean": 1.1e-05, "confidence_mean": 1.0, "precision": 0.7348, "recall": 0.7027, "f1": 0.7184, "f2": 0.7089, "mcc": 0.4554, "accuracy": 0.7276, "per_window": [{"fold": "fold_1", "regime": "Pre-crisis upturn + GFC onset", "sharpe": 0.9135, "sortino": 1.0158, "return_pct": 6.5, "equity": 1065.05, "max_dd": 7.54, "win_rate": 51.96, "profit_factor": 1.241, "ic": 0.1287, "hit": 51.46, "n": 103, "precision": 0.5405, "recall": 0.3774, "f1": 0.4444, "f2": 0.4016, "mcc": 0.0389, "accuracy": 0.5146, "tp": 20, "fp": 17, "tn": 33, "fn": 33, "aleatoric_mean": 7e-06, "epistemic_mean": 1.5e-05, "confidence_mean": 1.0, "aleatoric_std": 3e-06, "epistemic_std": 6e-06}, {"fold": "fold_2", "regime": "Post-crash recovery", "sharpe": 0.4024, "sortino": 0.7304, "return_pct": 1.67, "equity": 1016.74, "max_dd": 6.09, "win_rate": 52.34, "profit_factor": 1.065, "ic": 0.0797, "hit": 52.34, "n": 107, "precision": 0.5, "recall": 0.4902, "f1": 0.495, "f2": 0.4921, "mcc": 0.0438, "accuracy": 0.5234, "tp": 25, "fp": 25, "tn": 31, "fn": 26, "aleatoric_mean": 8e-06, "epistemic_mean": 1.5e-05, "confidence_mean": 1.0, "aleatoric_std": 5e-06, "epistemic_std": 9e-06}, {"fold": "fold_3", "regime": "Eurozone debt plateau", "sharpe": 9.7509, "sortino": 15.7593, "return_pct": 34.11, "equity": 1341.06, "max_dd": 2.22, "win_rate": 76.92, "profit_factor": 4.749, "ic": 0.5752, "hit": 75.47, "n": 106, "precision": 0.7313, "recall": 0.8596, "f1": 0.7903, "f2": 0.8305, "mcc": 0.509, "accuracy": 0.7547, "tp": 49, "fp": 18, "tn": 31, "fn": 8, "aleatoric_mean": 6e-06, "epistemic_mean": 1.2e-05, "confidence_mean": 1.0, "aleatoric_std": 3e-06, "epistemic_std": 6e-06}, {"fold": "fold_4", "regime": "Strong USD downturn", "sharpe": 11.378, "sortino": 17.832, "return_pct": 104.44, "equity": 2044.42, "max_dd": 1.81, "win_rate": 84.43, "profit_factor": 7.955, "ic": 0.7704, "hit": 83.93, "n": 168, "precision": 0.8831, "recall": 0.7907, "f1": 0.8344, "f2": 0.8076, "mcc": 0.6831, "accuracy": 0.8393, "tp": 68, "fp": 9, "tn": 73, "fn": 18, "aleatoric_mean": 5e-06, "epistemic_mean": 9e-06, "confidence_mean": 1.0, "aleatoric_std": 2e-06, "epistemic_std": 4e-06}, {"fold": "fold_5", "regime": "Low-vol plateau", "sharpe": 13.5237, "sortino": 51.3119, "return_pct": 40.82, "equity": 1408.16, "max_dd": 0.24, "win_rate": 79.63, "profit_factor": 12.907, "ic": 0.8019, "hit": 79.63, "n": 162, "precision": 0.7945, "recall": 0.7632, "f1": 0.7785, "f2": 0.7692, "mcc": 0.5905, "accuracy": 0.7963, "tp": 58, "fp": 15, "tn": 71, "fn": 18, "aleatoric_mean": 4e-06, "epistemic_mean": 7e-06, "confidence_mean": 1.0, "aleatoric_std": 1e-06, "epistemic_std": 2e-06}, {"fold": "fold_6", "regime": "EUR crisis downturn", "sharpe": 12.328, "sortino": 30.1131, "return_pct": 84.09, "equity": 1840.88, "max_dd": 1.31, "win_rate": 76.97, "profit_factor": 8.374, "ic": 0.7608, "hit": 76.97, "n": 165, "precision": 0.7671, "recall": 0.7273, "f1": 0.7467, "f2": 0.7349, "mcc": 0.5365, "accuracy": 0.7697, "tp": 56, "fp": 17, "tn": 71, "fn": 21, "aleatoric_mean": 5e-06, "epistemic_mean": 1e-05, "confidence_mean": 1.0, "aleatoric_std": 2e-06, "epistemic_std": 4e-06}, {"fold": "fold_7", "regime": "Recent mixed/upturn", "sharpe": 8.962, "sortino": 14.7354, "return_pct": 58.82, "equity": 1588.18, "max_dd": 1.64, "win_rate": 75.31, "profit_factor": 4.868, "ic": 0.6658, "hit": 75.31, "n": 162, "precision": 0.747, "recall": 0.7654, "f1": 0.7561, "f2": 0.7617, "mcc": 0.5063, "accuracy": 0.7531, "tp": 62, "fp": 21, "tn": 60, "fn": 19, "aleatoric_mean": 6e-06, "epistemic_mean": 1.3e-05, "confidence_mean": 1.0, "aleatoric_std": 2e-06, "epistemic_std": 4e-06}], "val_sharpe": 7.1539, "val_psr": 1.0, "val_equity": 4663.84, "val_sortino": 9.8643, "val_return_pct": 366.38, "val_max_dd": 7.34, "val_win_rate": 71.3, "val_profit_factor": 3.454, "val_ic": 0.5638, "val_hit": 70.83, "val_aleatoric_mean": 5e-06, "val_epistemic_mean": 9e-06, "val_confidence_mean": 1.0, "val_precision": 0.6973, "val_recall": 0.7068, "val_f1": 0.702, "val_f2": 0.7049, "val_mcc": 0.4287, "val_accuracy": 0.7148, "val_per_window": [{"fold": "fold_1", "regime": "Pre-crisis upturn + GFC onset", "sharpe": 0.4646, "sortino": 0.7365, "return_pct": 1.1, "equity": 1011.05, "max_dd": 5.33, "win_rate": 47.22, "profit_factor": 1.08, "ic": 0.0285, "hit": 46.79, "n": 109, "precision": 0.4839, "recall": 0.5455, "f1": 0.5128, "f2": 0.5319, "mcc": -0.0476, "accuracy": 0.4771, "tp": 30, "fp": 32, "tn": 22, "fn": 25, "aleatoric_mean": 5e-06, "epistemic_mean": 9e-06, "confidence_mean": 1.0, "aleatoric_std": 2e-06, "epistemic_std": 4e-06}, {"fold": "fold_2", "regime": "Post-crash recovery", "sharpe": -0.0006, "sortino": -0.0009, "return_pct": -0.28, "equity": 997.22, "max_dd": 7.34, "win_rate": 49.07, "profit_factor": 1.0, "ic": 0.009, "hit": 49.07, "n": 108, "precision": 0.5714, "recall": 0.5079, "f1": 0.5378, "f2": 0.5195, "mcc": -0.0251, "accuracy": 0.4907, "tp": 32, "fp": 24, "tn": 21, "fn": 31, "aleatoric_mean": 7e-06, "epistemic_mean": 1.5e-05, "confidence_mean": 1.0, "aleatoric_std": 3e-06, "epistemic_std": 6e-06}, {"fold": "fold_3", "regime": "Eurozone debt plateau", "sharpe": 13.807, "sortino": 28.1214, "return_pct": 52.13, "equity": 1521.32, "max_dd": 0.7, "win_rate": 88.07, "profit_factor": 11.906, "ic": 0.8019, "hit": 86.49, "n": 111, "precision": 0.8542, "recall": 0.8723, "f1": 0.8632, "f2": 0.8686, "mcc": 0.7609, "accuracy": 0.8829, "tp": 41, "fp": 7, "tn": 57, "fn": 6, "aleatoric_mean": 4e-06, "epistemic_mean": 8e-06, "confidence_mean": 1.0, "aleatoric_std": 2e-06, "epistemic_std": 3e-06}, {"fold": "fold_4", "regime": "Strong USD downturn", "sharpe": 13.5837, "sortino": 34.2603, "return_pct": 42.96, "equity": 1429.56, "max_dd": 0.82, "win_rate": 82.57, "profit_factor": 12.645, "ic": 0.8085, "hit": 81.82, "n": 110, "precision": 0.7917, "recall": 0.8085, "f1": 0.8, "f2": 0.8051, "mcc": 0.6481, "accuracy": 0.8273, "tp": 38, "fp": 10, "tn": 53, "fn": 9, "aleatoric_mean": 4e-06, "epistemic_mean": 8e-06, "confidence_mean": 1.0, "aleatoric_std": 2e-06, "epistemic_std": 3e-06}, {"fold": "fold_5", "regime": "Low-vol plateau", "sharpe": 10.8261, "sortino": 28.1787, "return_pct": 34.63, "equity": 1346.26, "max_dd": 0.7, "win_rate": 75.89, "profit_factor": 6.782, "ic": 0.7903, "hit": 75.89, "n": 112, "precision": 0.825, "recall": 0.6226, "f1": 0.7097, "f2": 0.6548, "mcc": 0.5252, "accuracy": 0.7589, "tp": 33, "fp": 7, "tn": 52, "fn": 20, "aleatoric_mean": 3e-06, "epistemic_mean": 7e-06, "confidence_mean": 1.0, "aleatoric_std": 1e-06, "epistemic_std": 3e-06}, {"fold": "fold_6", "regime": "EUR crisis downturn", "sharpe": 13.8743, "sortino": 54.687, "return_pct": 26.95, "equity": 1269.55, "max_dd": 0.25, "win_rate": 83.18, "profit_factor": 15.497, "ic": 0.8853, "hit": 82.41, "n": 108, "precision": 0.8222, "recall": 0.7872, "f1": 0.8043, "f2": 0.794, "mcc": 0.6598, "accuracy": 0.8333, "tp": 37, "fp": 8, "tn": 53, "fn": 10, "aleatoric_mean": 3e-06, "epistemic_mean": 7e-06, "confidence_mean": 1.0, "aleatoric_std": 1e-06, "epistemic_std": 2e-06}, {"fold": "fold_7", "regime": "Recent mixed/upturn", "sharpe": 11.1786, "sortino": 25.1001, "return_pct": 24.45, "equity": 1244.46, "max_dd": 0.69, "win_rate": 72.73, "profit_factor": 6.53, "ic": 0.7118, "hit": 72.73, "n": 110, "precision": 0.662, "recall": 0.8868, "f1": 0.7581, "f2": 0.8304, "mcc": 0.4865, "accuracy": 0.7273, "tp": 47, "fp": 24, "tn": 33, "fn": 6, "aleatoric_mean": 5e-06, "epistemic_mean": 1e-05, "confidence_mean": 1.0, "aleatoric_std": 2e-06, "epistemic_std": 4e-06}], "train_sharpe": 7.0973, "train_psr": 1.0, "train_equity": 2639122.25, "train_sortino": 18.4888, "train_return_pct": 263812.22, "train_max_dd": 6.87, "train_win_rate": 75.61, "train_profit_factor": 5.843, "train_ic": 0.696, "train_hit": 75.3, "train_precision": 0.7932, "train_recall": 0.7104, "train_f1": 0.7495, "train_f2": 0.7255, "train_mcc": 0.5158, "train_accuracy": 0.7559, "train_per_window": [{"fold": "all_train", "regime": "Training data", "sharpe": 7.0973, "sortino": 18.4888, "return_pct": 263812.22, "equity": 2639122.25, "max_dd": 6.87, "win_rate": 75.61, "profit_factor": 5.843, "ic": 0.696, "hit": 75.3, "n": 2478, "precision": 0.7932, "recall": 0.7104, "f1": 0.7495, "f2": 0.7255, "mcc": 0.5158, "accuracy": 0.7559, "tp": 905, "fp": 236, "tn": 968, "fn": 369}], "experiment_num": 140, "status": "KEEP"}
