{"backbone": "mamba", "description": "mamba: Exp10 dmamba expand=4 num_layers=1 (depth axis low end)", "config": {"seq_len": 10, "lr": 0.0005, "batch_size": 32, "epochs": 100, "weight_decay": 0.1, "patience": 20, "grad_clip": 1.0, "warmup_epochs": 10, "huber_delta": 1.0, "head_dropout": 0.1, "seed": 42, "num_layers": 1, "mamba_variant": "dmamba", "mamba_expand": 4, "het_loss": false}, "composite": 5.5989, "test_pos_folds": 7, "val_pos_folds": 5, "val_loss": 3.6e-05, "elapsed_sec": 173.2, "timestamp": "2026-04-20T01:20:20", "sharpe": 5.8818, "psr": 1.0, "equity": 9838.58, "sortino": 11.4375, "return_pct": 883.86, "max_dd": 6.77, "win_rate": 67.6, "profit_factor": 3.077, "ic": 0.475, "hit": 67.32, "aleatoric_mean": 2e-05, "epistemic_mean": 4e-05, "confidence_mean": 0.9999, "precision": 0.693, "recall": 0.6195, "f1": 0.6542, "f2": 0.633, "mcc": 0.3536, "accuracy": 0.6763, "per_window": [{"fold": "fold_1", "regime": "Pre-crisis upturn + GFC onset", "sharpe": 1.8164, "sortino": 5.5252, "return_pct": 14.13, "equity": 1141.29, "max_dd": 5.41, "win_rate": 50.0, "profit_factor": 1.541, "ic": 0.0933, "hit": 49.51, "n": 103, "precision": 0.5312, "recall": 0.3208, "f1": 0.4, "f2": 0.3484, "mcc": 0.0224, "accuracy": 0.5049, "tp": 17, "fp": 15, "tn": 35, "fn": 36, "aleatoric_mean": 3e-05, "epistemic_mean": 6e-05, "confidence_mean": 0.9999, "aleatoric_std": 2.2e-05, "epistemic_std": 4.4e-05}, {"fold": "fold_2", "regime": "Post-crash recovery", "sharpe": 1.3423, "sortino": 2.346, "return_pct": 6.34, "equity": 1063.43, "max_dd": 5.79, "win_rate": 50.47, "profit_factor": 1.234, "ic": 0.097, "hit": 50.47, "n": 107, "precision": 0.48, "recall": 0.4706, "f1": 0.4752, "f2": 0.4724, "mcc": 0.0063, "accuracy": 0.5047, "tp": 24, "fp": 26, "tn": 30, "fn": 27, "aleatoric_mean": 2.2e-05, "epistemic_mean": 4.5e-05, "confidence_mean": 0.9999, "aleatoric_std": 1.1e-05, "epistemic_std": 2.3e-05}, {"fold": "fold_3", "regime": "Eurozone debt plateau", "sharpe": 6.213, "sortino": 12.1059, "return_pct": 22.62, "equity": 1226.16, "max_dd": 1.57, "win_rate": 63.46, "profit_factor": 2.664, "ic": 0.4555, "hit": 62.26, "n": 106, "precision": 0.65, "recall": 0.6842, "f1": 0.6667, "f2": 0.6771, "mcc": 0.2572, "accuracy": 0.6321, "tp": 39, "fp": 21, "tn": 28, "fn": 18, "aleatoric_mean": 2.7e-05, "epistemic_mean": 5.4e-05, "confidence_mean": 0.9999, "aleatoric_std": 1.6e-05, "epistemic_std": 3.2e-05}, {"fold": "fold_4", "regime": "Strong USD downturn", "sharpe": 9.074, "sortino": 23.3332, "return_pct": 83.77, "equity": 1837.68, "max_dd": 2.83, "win_rate": 74.25, "profit_factor": 4.91, "ic": 0.7025, "hit": 73.81, "n": 168, "precision": 0.8413, "recall": 0.6163, "f1": 0.7114, "f2": 0.6511, "mcc": 0.5104, "accuracy": 0.744, "tp": 53, "fp": 10, "tn": 72, "fn": 33, "aleatoric_mean": 2.3e-05, "epistemic_mean": 4.6e-05, "confidence_mean": 0.9999, "aleatoric_std": 1.5e-05, "epistemic_std": 3e-05}, {"fold": "fold_5", "regime": "Low-vol plateau", "sharpe": 8.8628, "sortino": 23.1081, "return_pct": 29.32, "equity": 1293.15, "max_dd": 1.19, "win_rate": 69.75, "profit_factor": 4.612, "ic": 0.638, "hit": 69.75, "n": 162, "precision": 0.7015, "recall": 0.6184, "f1": 0.6573, "f2": 0.6334, "mcc": 0.391, "accuracy": 0.6975, "tp": 47, "fp": 20, "tn": 66, "fn": 29, "aleatoric_mean": 1.1e-05, "epistemic_mean": 2.2e-05, "confidence_mean": 1.0, "aleatoric_std": 8e-06, "epistemic_std": 1.7e-05}, {"fold": "fold_6", "regime": "EUR crisis downturn", "sharpe": 11.2886, "sortino": 20.766, "return_pct": 77.97, "equity": 1779.65, "max_dd": 1.62, "win_rate": 78.18, "profit_factor": 6.79, "ic": 0.7125, "hit": 78.18, "n": 165, "precision": 0.8596, "recall": 0.6364, "f1": 0.7313, "f2": 0.6712, "mcc": 0.5723, "accuracy": 0.7818, "tp": 49, "fp": 8, "tn": 80, "fn": 28, "aleatoric_mean": 2.1e-05, "epistemic_mean": 4.2e-05, "confidence_mean": 0.9999, "aleatoric_std": 1.3e-05, "epistemic_std": 2.5e-05}, {"fold": "fold_7", "regime": "Recent mixed/upturn", "sharpe": 8.5662, "sortino": 14.2041, "return_pct": 56.32, "equity": 1563.24, "max_dd": 1.64, "win_rate": 72.84, "profit_factor": 4.506, "ic": 0.6268, "hit": 72.84, "n": 162, "precision": 0.6832, "recall": 0.8519, "f1": 0.7582, "f2": 0.8118, "mcc": 0.4714, "accuracy": 0.7284, "tp": 69, "fp": 32, "tn": 49, "fn": 12, "aleatoric_mean": 1.2e-05, "epistemic_mean": 2.5e-05, "confidence_mean": 1.0, "aleatoric_std": 7e-06, "epistemic_std": 1.4e-05}], "val_sharpe": 5.7989, "val_psr": 1.0, "val_equity": 3612.69, "val_sortino": 9.0243, "val_return_pct": 261.27, "val_max_dd": 9.48, "val_win_rate": 66.45, "val_profit_factor": 2.704, "val_ic": 0.416, "val_hit": 66.02, "val_aleatoric_mean": 1.4e-05, "val_epistemic_mean": 2.9e-05, "val_confidence_mean": 1.0, "val_precision": 0.6569, "val_recall": 0.6137, "val_f1": 0.6346, "val_f2": 0.6219, "val_mcc": 0.325, "val_accuracy": 0.6641, "val_per_window": [{"fold": "fold_1", "regime": "Pre-crisis upturn + GFC onset", "sharpe": -0.0882, "sortino": -0.1526, "return_pct": -0.3, "equity": 997.04, "max_dd": 2.11, "win_rate": 45.37, "profit_factor": 0.985, "ic": -0.0652, "hit": 44.95, "n": 109, "precision": 0.4615, "recall": 0.5455, "f1": 0.5, "f2": 0.5263, "mcc": -0.1046, "accuracy": 0.4495, "tp": 30, "fp": 35, "tn": 19, "fn": 25, "aleatoric_mean": 1.3e-05, "epistemic_mean": 2.7e-05, "confidence_mean": 1.0, "aleatoric_std": 1.3e-05, "epistemic_std": 2.5e-05}, {"fold": "fold_2", "regime": "Post-crash recovery", "sharpe": -0.3913, "sortino": -0.6441, "return_pct": -2.15, "equity": 978.49, "max_dd": 8.72, "win_rate": 45.37, "profit_factor": 0.94, "ic": -0.0323, "hit": 45.37, "n": 108, "precision": 0.5588, "recall": 0.3016, "f1": 0.3918, "f2": 0.3322, "mcc": -0.0337, "accuracy": 0.4537, "tp": 19, "fp": 15, "tn": 30, "fn": 44, "aleatoric_mean": 2.4e-05, "epistemic_mean": 4.8e-05, "confidence_mean": 0.9999, "aleatoric_std": 1.6e-05, "epistemic_std": 3.2e-05}, {"fold": "fold_3", "regime": "Eurozone debt plateau", "sharpe": 10.4364, "sortino": 24.9534, "return_pct": 42.04, "equity": 1420.38, "max_dd": 0.74, "win_rate": 79.82, "profit_factor": 5.834, "ic": 0.6678, "hit": 78.38, "n": 111, "precision": 0.7727, "recall": 0.7234, "f1": 0.7473, "f2": 0.7328, "mcc": 0.5729, "accuracy": 0.7928, "tp": 34, "fp": 10, "tn": 54, "fn": 13, "aleatoric_mean": 2e-05, "epistemic_mean": 3.9e-05, "confidence_mean": 0.9999, "aleatoric_std": 1.2e-05, "epistemic_std": 2.4e-05}, {"fold": "fold_4", "regime": "Strong USD downturn", "sharpe": 9.1699, "sortino": 21.4306, "return_pct": 31.6, "equity": 1316.03, "max_dd": 1.11, "win_rate": 73.39, "profit_factor": 4.824, "ic": 0.5841, "hit": 72.73, "n": 110, "precision": 0.7143, "recall": 0.6383, "f1": 0.6742, "f2": 0.6522, "mcc": 0.456, "accuracy": 0.7364, "tp": 30, "fp": 12, "tn": 51, "fn": 17, "aleatoric_mean": 1.4e-05, "epistemic_mean": 2.8e-05, "confidence_mean": 1.0, "aleatoric_std": 9e-06, "epistemic_std": 1.9e-05}, {"fold": "fold_5", "regime": "Low-vol plateau", "sharpe": 11.3396, "sortino": 25.6361, "return_pct": 35.9, "equity": 1359.04, "max_dd": 0.95, "win_rate": 76.79, "profit_factor": 7.566, "ic": 0.7033, "hit": 76.79, "n": 112, "precision": 0.7755, "recall": 0.717, "f1": 0.7451, "f2": 0.728, "mcc": 0.534, "accuracy": 0.7679, "tp": 38, "fp": 11, "tn": 48, "fn": 15, "aleatoric_mean": 1.4e-05, "epistemic_mean": 2.8e-05, "confidence_mean": 1.0, "aleatoric_std": 1e-05, "epistemic_std": 2e-05}, {"fold": "fold_6", "regime": "EUR crisis downturn", "sharpe": 9.5426, "sortino": 21.8873, "return_pct": 20.53, "equity": 1205.28, "max_dd": 0.67, "win_rate": 71.96, "profit_factor": 5.41, "ic": 0.678, "hit": 71.3, "n": 108, "precision": 0.6809, "recall": 0.6809, "f1": 0.6809, "f2": 0.6809, "mcc": 0.4349, "accuracy": 0.7222, "tp": 32, "fp": 15, "tn": 46, "fn": 15, "aleatoric_mean": 8e-06, "epistemic_mean": 1.6e-05, "confidence_mean": 1.0, "aleatoric_std": 3e-06, "epistemic_std": 5e-06}, {"fold": "fold_7", "regime": "Recent mixed/upturn", "sharpe": 9.184, "sortino": 22.4296, "return_pct": 20.94, "equity": 1209.41, "max_dd": 1.04, "win_rate": 71.82, "profit_factor": 4.536, "ic": 0.6518, "hit": 71.82, "n": 110, "precision": 0.6833, "recall": 0.7736, "f1": 0.7257, "f2": 0.7537, "mcc": 0.4418, "accuracy": 0.7182, "tp": 41, "fp": 19, "tn": 38, "fn": 12, "aleatoric_mean": 8e-06, "epistemic_mean": 1.6e-05, "confidence_mean": 1.0, "aleatoric_std": 3e-06, "epistemic_std": 7e-06}], "train_sharpe": 6.8675, "train_psr": 1.0, "train_equity": 2125832.25, "train_sortino": 18.9305, "train_return_pct": 212483.23, "train_max_dd": 3.66, "train_win_rate": 73.5, "train_profit_factor": 5.42, "train_ic": 0.6945, "train_hit": 73.2, "train_precision": 0.795, "train_recall": 0.6515, "train_f1": 0.7161, "train_f2": 0.6759, "train_mcc": 0.4795, "train_accuracy": 0.7345, "train_per_window": [{"fold": "all_train", "regime": "Training data", "sharpe": 6.8675, "sortino": 18.9305, "return_pct": 212483.23, "equity": 2125832.25, "max_dd": 3.66, "win_rate": 73.5, "profit_factor": 5.42, "ic": 0.6945, "hit": 73.2, "n": 2478, "precision": 0.795, "recall": 0.6515, "f1": 0.7161, "f2": 0.6759, "mcc": 0.4795, "accuracy": 0.7345, "tp": 830, "fp": 214, "tn": 990, "fn": 444}], "experiment_num": 161, "status": "DISCARD"}
{"backbone": "mamba", "description": "mamba: Exp11 dmamba expand=4 num_layers=3 (depth axis high end)", "config": {"seq_len": 10, "lr": 0.0005, "batch_size": 32, "epochs": 100, "weight_decay": 0.1, "patience": 20, "grad_clip": 1.0, "warmup_epochs": 10, "huber_delta": 1.0, "head_dropout": 0.1, "seed": 42, "num_layers": 3, "mamba_variant": "dmamba", "mamba_expand": 4, "het_loss": false}, "composite": 4.8264, "test_pos_folds": 7, "val_pos_folds": 6, "val_loss": 4e-05, "elapsed_sec": 330.2, "timestamp": "2026-04-20T01:26:54", "sharpe": 5.269, "psr": 1.0, "equity": 7931.73, "sortino": 9.9875, "return_pct": 693.17, "max_dd": 4.72, "win_rate": 65.84, "profit_factor": 2.717, "ic": 0.4377, "hit": 65.57, "aleatoric_mean": 3.6e-05, "epistemic_mean": 7.2e-05, "confidence_mean": 0.9999, "precision": 0.6609, "recall": 0.632, "f1": 0.6461, "f2": 0.6376, "mcc": 0.3154, "accuracy": 0.6578, "per_window": [{"fold": "fold_1", "regime": "Pre-crisis upturn + GFC onset", "sharpe": 2.9207, "sortino": 8.9126, "return_pct": 23.93, "equity": 1239.28, "max_dd": 3.73, "win_rate": 52.94, "profit_factor": 2.026, "ic": 0.1459, "hit": 52.43, "n": 103, "precision": 0.5476, "recall": 0.434, "f1": 0.4842, "f2": 0.4528, "mcc": 0.0549, "accuracy": 0.5243, "tp": 23, "fp": 19, "tn": 31, "fn": 30, "aleatoric_mean": 5.3e-05, "epistemic_mean": 0.000106, "confidence_mean": 0.9998, "aleatoric_std": 4.7e-05, "epistemic_std": 9.4e-05}, {"fold": "fold_2", "regime": "Post-crash recovery", "sharpe": 1.3286, "sortino": 2.545, "return_pct": 6.27, "equity": 1062.74, "max_dd": 4.72, "win_rate": 51.4, "profit_factor": 1.231, "ic": 0.0603, "hit": 51.4, "n": 107, "precision": 0.4865, "recall": 0.3529, "f1": 0.4091, "f2": 0.3734, "mcc": 0.0143, "accuracy": 0.514, "tp": 18, "fp": 19, "tn": 37, "fn": 33, "aleatoric_mean": 4e-05, "epistemic_mean": 7.9e-05, "confidence_mean": 0.9999, "aleatoric_std": 2.3e-05, "epistemic_std": 4.6e-05}, {"fold": "fold_3", "regime": "Eurozone debt plateau", "sharpe": 5.4382, "sortino": 9.5769, "return_pct": 19.86, "equity": 1198.58, "max_dd": 3.85, "win_rate": 65.38, "profit_factor": 2.354, "ic": 0.477, "hit": 64.15, "n": 106, "precision": 0.6562, "recall": 0.7368, "f1": 0.6942, "f2": 0.7192, "mcc": 0.2934, "accuracy": 0.6509, "tp": 42, "fp": 22, "tn": 27, "fn": 15, "aleatoric_mean": 5.1e-05, "epistemic_mean": 0.000102, "confidence_mean": 0.9998, "aleatoric_std": 4e-05, "epistemic_std": 8e-05}, {"fold": "fold_4", "regime": "Strong USD downturn", "sharpe": 6.7383, "sortino": 13.5004, "return_pct": 61.31, "equity": 1613.08, "max_dd": 2.63, "win_rate": 68.86, "profit_factor": 3.175, "ic": 0.5502, "hit": 68.45, "n": 168, "precision": 0.75, "recall": 0.593, "f1": 0.6623, "f2": 0.6189, "mcc": 0.3928, "accuracy": 0.6905, "tp": 51, "fp": 17, "tn": 65, "fn": 35, "aleatoric_mean": 3.7e-05, "epistemic_mean": 7.4e-05, "confidence_mean": 0.9999, "aleatoric_std": 3.4e-05, "epistemic_std": 6.8e-05}, {"fold": "fold_5", "regime": "Low-vol plateau", "sharpe": 6.5452, "sortino": 12.277, "return_pct": 22.24, "equity": 1222.43, "max_dd": 1.15, "win_rate": 64.81, "profit_factor": 3.026, "ic": 0.4568, "hit": 64.81, "n": 162, "precision": 0.6508, "recall": 0.5395, "f1": 0.5899, "f2": 0.5586, "mcc": 0.2904, "accuracy": 0.6481, "tp": 41, "fp": 22, "tn": 64, "fn": 35, "aleatoric_mean": 1.9e-05, "epistemic_mean": 3.7e-05, "confidence_mean": 0.9999, "aleatoric_std": 6e-06, "epistemic_std": 1.2e-05}, {"fold": "fold_6", "regime": "EUR crisis downturn", "sharpe": 9.5498, "sortino": 17.0558, "return_pct": 66.93, "equity": 1669.28, "max_dd": 1.61, "win_rate": 71.52, "profit_factor": 4.902, "ic": 0.69, "hit": 71.52, "n": 165, "precision": 0.6596, "recall": 0.8052, "f1": 0.7251, "f2": 0.7711, "mcc": 0.4449, "accuracy": 0.7152, "tp": 62, "fp": 32, "tn": 56, "fn": 15, "aleatoric_mean": 3.6e-05, "epistemic_mean": 7.3e-05, "confidence_mean": 0.9999, "aleatoric_std": 2.6e-05, "epistemic_std": 5.2e-05}, {"fold": "fold_7", "regime": "Recent mixed/upturn", "sharpe": 7.9942, "sortino": 10.7538, "return_pct": 52.65, "equity": 1526.51, "max_dd": 2.81, "win_rate": 75.93, "profit_factor": 4.039, "ic": 0.6199, "hit": 75.93, "n": 162, "precision": 0.7283, "recall": 0.8272, "f1": 0.7746, "f2": 0.8053, "mcc": 0.5234, "accuracy": 0.7593, "tp": 67, "fp": 25, "tn": 56, "fn": 14, "aleatoric_mean": 2.8e-05, "epistemic_mean": 5.5e-05, "confidence_mean": 0.9999, "aleatoric_std": 2.6e-05, "epistemic_std": 5.1e-05}], "val_sharpe": 4.9264, "val_psr": 1.0, "val_equity": 3029.08, "val_sortino": 7.4089, "val_return_pct": 202.91, "val_max_dd": 10.4, "val_win_rate": 66.32, "val_profit_factor": 2.319, "val_ic": 0.4264, "val_hit": 65.89, "val_aleatoric_mean": 2.6e-05, "val_epistemic_mean": 5.1e-05, "val_confidence_mean": 0.9999, "val_precision": 0.6893, "val_recall": 0.5288, "val_f1": 0.5984, "val_f2": 0.5546, "val_mcc": 0.3246, "val_accuracy": 0.6628, "val_per_window": [{"fold": "fold_1", "regime": "Pre-crisis upturn + GFC onset", "sharpe": 0.813, "sortino": 1.279, "return_pct": 2.0, "equity": 1019.96, "max_dd": 3.0, "win_rate": 52.78, "profit_factor": 1.144, "ic": 0.006, "hit": 52.29, "n": 109, "precision": 0.5231, "recall": 0.6182, "f1": 0.5667, "f2": 0.5965, "mcc": 0.0449, "accuracy": 0.5229, "tp": 34, "fp": 31, "tn": 23, "fn": 21, "aleatoric_mean": 2.3e-05, "epistemic_mean": 4.6e-05, "confidence_mean": 0.9999, "aleatoric_std": 1.4e-05, "epistemic_std": 2.9e-05}, {"fold": "fold_2", "regime": "Post-crash recovery", "sharpe": -1.5105, "sortino": -2.404, "return_pct": -7.3, "equity": 927.03, "max_dd": 10.4, "win_rate": 45.37, "profit_factor": 0.788, "ic": 0.012, "hit": 45.37, "n": 108, "precision": 0.5833, "recall": 0.2222, "f1": 0.3218, "f2": 0.2536, "mcc": 0.0, "accuracy": 0.4537, "tp": 14, "fp": 10, "tn": 35, "fn": 49, "aleatoric_mean": 3.8e-05, "epistemic_mean": 7.5e-05, "confidence_mean": 0.9999, "aleatoric_std": 2.4e-05, "epistemic_std": 4.8e-05}, {"fold": "fold_3", "regime": "Eurozone debt plateau", "sharpe": 8.0593, "sortino": 18.9, "return_pct": 33.49, "equity": 1334.89, "max_dd": 1.35, "win_rate": 72.48, "profit_factor": 3.795, "ic": 0.6472, "hit": 71.17, "n": 111, "precision": 0.7105, "recall": 0.5745, "f1": 0.6353, "f2": 0.5973, "mcc": 0.4192, "accuracy": 0.7207, "tp": 27, "fp": 11, "tn": 53, "fn": 20, "aleatoric_mean": 3e-05, "epistemic_mean": 5.9e-05, "confidence_mean": 0.9999, "aleatoric_std": 2e-05, "epistemic_std": 4.1e-05}, {"fold": "fold_4", "regime": "Strong USD downturn", "sharpe": 9.2991, "sortino": 16.4562, "return_pct": 31.99, "equity": 1319.85, "max_dd": 1.55, "win_rate": 76.15, "profit_factor": 4.943, "ic": 0.5663, "hit": 75.45, "n": 110, "precision": 0.7561, "recall": 0.6596, "f1": 0.7045, "f2": 0.6769, "mcc": 0.5124, "accuracy": 0.7636, "tp": 31, "fp": 10, "tn": 53, "fn": 16, "aleatoric_mean": 2.7e-05, "epistemic_mean": 5.5e-05, "confidence_mean": 0.9999, "aleatoric_std": 2e-05, "epistemic_std": 3.9e-05}, {"fold": "fold_5", "regime": "Low-vol plateau", "sharpe": 7.8392, "sortino": 21.2258, "return_pct": 26.29, "equity": 1262.88, "max_dd": 1.14, "win_rate": 67.86, "profit_factor": 3.807, "ic": 0.6576, "hit": 67.86, "n": 112, "precision": 0.84, "recall": 0.3962, "f1": 0.5385, "f2": 0.443, "mcc": 0.3938, "accuracy": 0.6786, "tp": 21, "fp": 4, "tn": 55, "fn": 32, "aleatoric_mean": 2.2e-05, "epistemic_mean": 4.4e-05, "confidence_mean": 0.9999, "aleatoric_std": 1.2e-05, "epistemic_std": 2.5e-05}, {"fold": "fold_6", "regime": "EUR crisis downturn", "sharpe": 9.6251, "sortino": 21.3242, "return_pct": 20.67, "equity": 1206.71, "max_dd": 0.82, "win_rate": 76.64, "profit_factor": 5.501, "ic": 0.6967, "hit": 75.93, "n": 108, "precision": 0.7619, "recall": 0.6809, "f1": 0.7191, "f2": 0.6957, "mcc": 0.5257, "accuracy": 0.7685, "tp": 32, "fp": 10, "tn": 51, "fn": 15, "aleatoric_mean": 1.8e-05, "epistemic_mean": 3.7e-05, "confidence_mean": 0.9999, "aleatoric_std": 7e-06, "epistemic_std": 1.3e-05}, {"fold": "fold_7", "regime": "Recent mixed/upturn", "sharpe": 8.3441, "sortino": 17.7473, "return_pct": 19.32, "equity": 1193.16, "max_dd": 1.01, "win_rate": 72.73, "profit_factor": 3.92, "ic": 0.5698, "hit": 72.73, "n": 110, "precision": 0.7556, "recall": 0.6415, "f1": 0.6939, "f2": 0.6615, "mcc": 0.4558, "accuracy": 0.7273, "tp": 34, "fp": 11, "tn": 46, "fn": 19, "aleatoric_mean": 2.1e-05, "epistemic_mean": 4.2e-05, "confidence_mean": 0.9999, "aleatoric_std": 9e-06, "epistemic_std": 1.8e-05}], "train_sharpe": 6.2082, "train_psr": 1.0, "train_equity": 1121268.5, "train_sortino": 16.087, "train_return_pct": 112026.85, "train_max_dd": 5.3, "train_win_rate": 70.75, "train_profit_factor": 4.428, "train_ic": 0.6675, "train_hit": 70.46, "train_precision": 0.8311, "train_recall": 0.5408, "train_f1": 0.6553, "train_f2": 0.5814, "train_mcc": 0.4497, "train_accuracy": 0.7074, "train_per_window": [{"fold": "all_train", "regime": "Training data", "sharpe": 6.2082, "sortino": 16.087, "return_pct": 112026.85, "equity": 1121268.5, "max_dd": 5.3, "win_rate": 70.75, "profit_factor": 4.428, "ic": 0.6675, "hit": 70.46, "n": 2478, "precision": 0.8311, "recall": 0.5408, "f1": 0.6553, "f2": 0.5814, "mcc": 0.4497, "accuracy": 0.7074, "tp": 689, "fp": 140, "tn": 1064, "fn": 585}], "experiment_num": 162, "status": "DISCARD"}
