{"backbone": "lstm", "description": "lstm: Exp9 wd=1e-4 stronger L2 regularization", "config": {"seq_len": 10, "lr": 0.001, "batch_size": 32, "epochs": 100, "weight_decay": 0.0001, "patience": 15, "grad_clip": 1.0, "warmup_epochs": 0, "huber_delta": 1.0, "head_dropout": 0.25, "seed": 0, "het_loss": false}, "composite": 6.1035, "test_pos_folds": 7, "val_pos_folds": 6, "val_loss": 2.8e-05, "elapsed_sec": 29.9, "timestamp": "2026-04-19T18:15:43", "sharpe": 6.2956, "psr": 1.0, "equity": 11328.08, "sortino": 11.3891, "return_pct": 1032.81, "max_dd": 5.84, "win_rate": 71.21, "profit_factor": 3.353, "ic": 0.5553, "hit": 70.91, "aleatoric_mean": 1.2e-05, "epistemic_mean": 2.3e-05, "confidence_mean": 1.0, "precision": 0.7525, "recall": 0.6195, "f1": 0.6796, "f2": 0.6422, "mcc": 0.4278, "accuracy": 0.7112, "per_window": [{"fold": "fold_1", "regime": "Pre-crisis upturn + GFC onset", "sharpe": 2.0743, "sortino": 5.863, "return_pct": 16.37, "equity": 1163.71, "max_dd": 5.84, "win_rate": 55.88, "profit_factor": 1.641, "ic": 0.1567, "hit": 55.34, "n": 103, "precision": 0.5574, "recall": 0.6415, "f1": 0.5965, "f2": 0.6227, "mcc": 0.1032, "accuracy": 0.5534, "tp": 34, "fp": 27, "tn": 23, "fn": 19, "aleatoric_mean": 2.1e-05, "epistemic_mean": 4.3e-05, "confidence_mean": 0.9999, "aleatoric_std": 1.9e-05, "epistemic_std": 3.8e-05}, {"fold": "fold_2", "regime": "Post-crash recovery", "sharpe": 1.6623, "sortino": 3.0701, "return_pct": 7.97, "equity": 1079.67, "max_dd": 5.39, "win_rate": 57.01, "profit_factor": 1.298, "ic": 0.1097, "hit": 57.01, "n": 107, "precision": 0.5397, "recall": 0.6667, "f1": 0.5965, "f2": 0.6367, "mcc": 0.151, "accuracy": 0.5701, "tp": 34, "fp": 29, "tn": 27, "fn": 17, "aleatoric_mean": 1.3e-05, "epistemic_mean": 2.6e-05, "confidence_mean": 1.0, "aleatoric_std": 7e-06, "epistemic_std": 1.5e-05}, {"fold": "fold_3", "regime": "Eurozone debt plateau", "sharpe": 11.2617, "sortino": 20.8779, "return_pct": 38.34, "equity": 1383.44, "max_dd": 1.32, "win_rate": 82.69, "profit_factor": 6.166, "ic": 0.6847, "hit": 81.13, "n": 106, "precision": 0.8393, "recall": 0.8246, "f1": 0.8319, "f2": 0.8275, "mcc": 0.6401, "accuracy": 0.8208, "tp": 47, "fp": 9, "tn": 40, "fn": 10, "aleatoric_mean": 1.4e-05, "epistemic_mean": 2.7e-05, "confidence_mean": 1.0, "aleatoric_std": 7e-06, "epistemic_std": 1.4e-05}, {"fold": "fold_4", "regime": "Strong USD downturn", "sharpe": 8.4098, "sortino": 15.5046, "return_pct": 77.49, "equity": 1774.93, "max_dd": 1.81, "win_rate": 73.65, "profit_factor": 4.321, "ic": 0.741, "hit": 73.21, "n": 168, "precision": 0.9375, "recall": 0.5233, "f1": 0.6716, "f2": 0.574, "mcc": 0.5385, "accuracy": 0.7381, "tp": 45, "fp": 3, "tn": 79, "fn": 41, "aleatoric_mean": 1e-05, "epistemic_mean": 2e-05, "confidence_mean": 1.0, "aleatoric_std": 5e-06, "epistemic_std": 1e-05}, {"fold": "fold_5", "regime": "Low-vol plateau", "sharpe": 10.5283, "sortino": 27.8635, "return_pct": 33.86, "equity": 1338.57, "max_dd": 0.81, "win_rate": 75.31, "profit_factor": 6.4, "ic": 0.738, "hit": 75.31, "n": 162, "precision": 0.8214, "recall": 0.6053, "f1": 0.697, "f2": 0.6389, "mcc": 0.5131, "accuracy": 0.7531, "tp": 46, "fp": 10, "tn": 76, "fn": 30, "aleatoric_mean": 6e-06, "epistemic_mean": 1.3e-05, "confidence_mean": 1.0, "aleatoric_std": 2e-06, "epistemic_std": 4e-06}, {"fold": "fold_6", "regime": "EUR crisis downturn", "sharpe": 12.2285, "sortino": 43.7502, "return_pct": 83.52, "equity": 1835.18, "max_dd": 0.82, "win_rate": 76.97, "profit_factor": 8.202, "ic": 0.7765, "hit": 76.97, "n": 165, "precision": 0.8679, "recall": 0.5974, "f1": 0.7077, "f2": 0.6371, "mcc": 0.5533, "accuracy": 0.7697, "tp": 46, "fp": 7, "tn": 81, "fn": 31, "aleatoric_mean": 1.1e-05, "epistemic_mean": 2.2e-05, "confidence_mean": 1.0, "aleatoric_std": 6e-06, "epistemic_std": 1.2e-05}, {"fold": "fold_7", "regime": "Recent mixed/upturn", "sharpe": 7.5079, "sortino": 11.6986, "return_pct": 49.47, "equity": 1494.72, "max_dd": 1.64, "win_rate": 70.37, "profit_factor": 3.687, "ic": 0.6561, "hit": 70.37, "n": 162, "precision": 0.7797, "recall": 0.5679, "f1": 0.6571, "f2": 0.6005, "mcc": 0.4233, "accuracy": 0.7037, "tp": 46, "fp": 13, "tn": 68, "fn": 35, "aleatoric_mean": 1.1e-05, "epistemic_mean": 2.2e-05, "confidence_mean": 1.0, "aleatoric_std": 4e-06, "epistemic_std": 9e-06}], "val_sharpe": 6.2035, "val_psr": 1.0, "val_equity": 3908.28, "val_sortino": 9.2321, "val_return_pct": 290.83, "val_max_dd": 9.22, "val_win_rate": 67.37, "val_profit_factor": 2.907, "val_ic": 0.5202, "val_hit": 66.93, "val_aleatoric_mean": 8e-06, "val_epistemic_mean": 1.7e-05, "val_confidence_mean": 1.0, "val_precision": 0.6969, "val_recall": 0.5479, "val_f1": 0.6135, "val_f2": 0.5724, "val_mcc": 0.3428, "val_accuracy": 0.6719, "val_per_window": [{"fold": "fold_1", "regime": "Pre-crisis upturn + GFC onset", "sharpe": 0.1168, "sortino": 0.1861, "return_pct": 0.22, "equity": 1002.21, "max_dd": 3.71, "win_rate": 46.3, "profit_factor": 1.02, "ic": 0.0011, "hit": 45.87, "n": 109, "precision": 0.4694, "recall": 0.4182, "f1": 0.4423, "f2": 0.4275, "mcc": -0.0636, "accuracy": 0.4679, "tp": 23, "fp": 26, "tn": 28, "fn": 32, "aleatoric_mean": 9e-06, "epistemic_mean": 1.7e-05, "confidence_mean": 1.0, "aleatoric_std": 5e-06, "epistemic_std": 1e-05}, {"fold": "fold_2", "regime": "Post-crash recovery", "sharpe": -0.8186, "sortino": -1.3326, "return_pct": -4.16, "equity": 958.44, "max_dd": 9.22, "win_rate": 46.3, "profit_factor": 0.879, "ic": -0.0137, "hit": 46.3, "n": 108, "precision": 0.5676, "recall": 0.3333, "f1": 0.42, "f2": 0.3633, "mcc": -0.0231, "accuracy": 0.463, "tp": 21, "fp": 16, "tn": 29, "fn": 42, "aleatoric_mean": 1.2e-05, "epistemic_mean": 2.4e-05, "confidence_mean": 1.0, "aleatoric_std": 7e-06, "epistemic_std": 1.3e-05}, {"fold": "fold_3", "regime": "Eurozone debt plateau", "sharpe": 11.1461, "sortino": 25.7167, "return_pct": 44.36, "equity": 1443.63, "max_dd": 0.94, "win_rate": 73.39, "profit_factor": 6.69, "ic": 0.7919, "hit": 72.07, "n": 111, "precision": 0.6176, "recall": 0.8936, "f1": 0.7304, "f2": 0.8203, "mcc": 0.4943, "accuracy": 0.7207, "tp": 42, "fp": 26, "tn": 38, "fn": 5, "aleatoric_mean": 8e-06, "epistemic_mean": 1.6e-05, "confidence_mean": 1.0, "aleatoric_std": 3e-06, "epistemic_std": 7e-06}, {"fold": "fold_4", "regime": "Strong USD downturn", "sharpe": 12.2128, "sortino": 32.7167, "return_pct": 39.8, "equity": 1398.05, "max_dd": 0.82, "win_rate": 78.9, "profit_factor": 9.02, "ic": 0.7393, "hit": 78.18, "n": 110, "precision": 0.9286, "recall": 0.5532, "f1": 0.6933, "f2": 0.6019, "mcc": 0.5922, "accuracy": 0.7909, "tp": 26, "fp": 2, "tn": 61, "fn": 21, "aleatoric_mean": 8e-06, "epistemic_mean": 1.6e-05, "confidence_mean": 1.0, "aleatoric_std": 3e-06, "epistemic_std": 6e-06}, {"fold": "fold_5", "regime": "Low-vol plateau", "sharpe": 11.2272, "sortino": 31.4775, "return_pct": 35.63, "equity": 1356.29, "max_dd": 1.2, "win_rate": 74.11, "profit_factor": 7.384, "ic": 0.7765, "hit": 74.11, "n": 112, "precision": 0.9, "recall": 0.5094, "f1": 0.6506, "f2": 0.5579, "mcc": 0.517, "accuracy": 0.7411, "tp": 27, "fp": 3, "tn": 56, "fn": 26, "aleatoric_mean": 7e-06, "epistemic_mean": 1.3e-05, "confidence_mean": 1.0, "aleatoric_std": 3e-06, "epistemic_std": 7e-06}, {"fold": "fold_6", "regime": "EUR crisis downturn", "sharpe": 11.2094, "sortino": 29.4831, "return_pct": 23.26, "equity": 1232.58, "max_dd": 0.77, "win_rate": 74.77, "profit_factor": 7.705, "ic": 0.8503, "hit": 74.07, "n": 108, "precision": 0.7879, "recall": 0.5532, "f1": 0.65, "f2": 0.5882, "mcc": 0.4719, "accuracy": 0.7407, "tp": 26, "fp": 7, "tn": 54, "fn": 21, "aleatoric_mean": 6e-06, "epistemic_mean": 1.2e-05, "confidence_mean": 1.0, "aleatoric_std": 2e-06, "epistemic_std": 4e-06}, {"fold": "fold_7", "regime": "Recent mixed/upturn", "sharpe": 8.9995, "sortino": 18.7907, "return_pct": 20.59, "equity": 1205.91, "max_dd": 0.79, "win_rate": 77.27, "profit_factor": 4.392, "ic": 0.6955, "hit": 77.27, "n": 110, "precision": 0.8333, "recall": 0.6604, "f1": 0.7368, "f2": 0.689, "mcc": 0.5529, "accuracy": 0.7727, "tp": 35, "fp": 7, "tn": 50, "fn": 18, "aleatoric_mean": 1e-05, "epistemic_mean": 1.9e-05, "confidence_mean": 1.0, "aleatoric_std": 4e-06, "epistemic_std": 9e-06}], "train_sharpe": 6.7199, "train_psr": 1.0, "train_equity": 1846762.25, "train_sortino": 16.6723, "train_return_pct": 184576.23, "train_max_dd": 4.82, "train_win_rate": 73.66, "train_profit_factor": 5.172, "train_ic": 0.6931, "train_hit": 73.37, "train_precision": 0.8125, "train_recall": 0.6327, "train_f1": 0.7114, "train_f2": 0.662, "train_mcc": 0.4878, "train_accuracy": 0.7361, "train_per_window": [{"fold": "all_train", "regime": "Training data", "sharpe": 6.7199, "sortino": 16.6723, "return_pct": 184576.23, "equity": 1846762.25, "max_dd": 4.82, "win_rate": 73.66, "profit_factor": 5.172, "ic": 0.6931, "hit": 73.37, "n": 2478, "precision": 0.8125, "recall": 0.6327, "f1": 0.7114, "f2": 0.662, "mcc": 0.4878, "accuracy": 0.7361, "tp": 806, "fp": 186, "tn": 1018, "fn": 468}], "experiment_num": 113, "status": "KEEP"}
{"backbone": "lstm", "description": "lstm: Exp10 lr=5e-4 flatter minimum (Lewkowycz2020)", "config": {"seq_len": 10, "lr": 0.0005, "batch_size": 32, "epochs": 100, "weight_decay": 0.0001, "patience": 15, "grad_clip": 1.0, "warmup_epochs": 0, "huber_delta": 1.0, "head_dropout": 0.25, "seed": 0, "het_loss": false}, "composite": 4.9527, "test_pos_folds": 5, "val_pos_folds": 7, "val_loss": 2.8e-05, "elapsed_sec": 35.5, "timestamp": "2026-04-19T18:17:23", "sharpe": 5.1527, "psr": 1.0, "equity": 7605.22, "sortino": 6.1617, "return_pct": 660.52, "max_dd": 10.89, "win_rate": 67.8, "profit_factor": 2.654, "ic": 0.478, "hit": 67.52, "aleatoric_mean": 1.9e-05, "epistemic_mean": 3.8e-05, "confidence_mean": 0.9999, "precision": 0.6765, "recall": 0.6694, "f1": 0.6729, "f2": 0.6708, "mcc": 0.3565, "accuracy": 0.6783, "per_window": [{"fold": "fold_1", "regime": "Pre-crisis upturn + GFC onset", "sharpe": -0.6036, "sortino": -0.7097, "return_pct": -5.24, "equity": 947.57, "max_dd": 8.7, "win_rate": 46.08, "profit_factor": 0.867, "ic": 0.0205, "hit": 45.63, "n": 103, "precision": 0.4634, "recall": 0.3585, "f1": 0.4043, "f2": 0.3755, "mcc": -0.0832, "accuracy": 0.4563, "tp": 19, "fp": 22, "tn": 28, "fn": 34, "aleatoric_mean": 4.5e-05, "epistemic_mean": 8.9e-05, "confidence_mean": 0.9999, "aleatoric_std": 5e-05, "epistemic_std": 0.000101}, {"fold": "fold_2", "regime": "Post-crash recovery", "sharpe": -1.0756, "sortino": -1.7157, "return_pct": -5.28, "equity": 947.21, "max_dd": 6.95, "win_rate": 51.4, "profit_factor": 0.845, "ic": 0.0188, "hit": 51.4, "n": 107, "precision": 0.4941, "recall": 0.8235, "f1": 0.6176, "f2": 0.7266, "mcc": 0.0688, "accuracy": 0.514, "tp": 42, "fp": 43, "tn": 13, "fn": 9, "aleatoric_mean": 2.1e-05, "epistemic_mean": 4.2e-05, "confidence_mean": 0.9999, "aleatoric_std": 1e-05, "epistemic_std": 2e-05}, {"fold": "fold_3", "regime": "Eurozone debt plateau", "sharpe": 8.3459, "sortino": 14.3241, "return_pct": 29.79, "equity": 1297.9, "max_dd": 1.65, "win_rate": 76.92, "profit_factor": 3.759, "ic": 0.608, "hit": 75.47, "n": 106, "precision": 0.7538, "recall": 0.8596, "f1": 0.8033, "f2": 0.8362, "mcc": 0.5458, "accuracy": 0.7736, "tp": 49, "fp": 16, "tn": 33, "fn": 8, "aleatoric_mean": 2e-05, "epistemic_mean": 4e-05, "confidence_mean": 0.9999, "aleatoric_std": 8e-06, "epistemic_std": 1.6e-05}, {"fold": "fold_4", "regime": "Strong USD downturn", "sharpe": 9.1558, "sortino": 15.7324, "return_pct": 84.53, "equity": 1845.32, "max_dd": 4.83, "win_rate": 76.65, "profit_factor": 4.989, "ic": 0.7205, "hit": 76.19, "n": 168, "precision": 0.8852, "recall": 0.6279, "f1": 0.7347, "f2": 0.6667, "mcc": 0.5639, "accuracy": 0.7679, "tp": 54, "fp": 7, "tn": 75, "fn": 32, "aleatoric_mean": 1.5e-05, "epistemic_mean": 3.1e-05, "confidence_mean": 1.0, "aleatoric_std": 7e-06, "epistemic_std": 1.3e-05}, {"fold": "fold_5", "regime": "Low-vol plateau", "sharpe": 9.6745, "sortino": 26.7532, "return_pct": 31.59, "equity": 1315.89, "max_dd": 0.79, "win_rate": 68.52, "profit_factor": 5.391, "ic": 0.6331, "hit": 68.52, "n": 162, "precision": 0.6582, "recall": 0.6842, "f1": 0.671, "f2": 0.6789, "mcc": 0.3697, "accuracy": 0.6852, "tp": 52, "fp": 27, "tn": 59, "fn": 24, "aleatoric_mean": 9e-06, "epistemic_mean": 1.9e-05, "confidence_mean": 1.0, "aleatoric_std": 4e-06, "epistemic_std": 8e-06}, {"fold": "fold_6", "regime": "EUR crisis downturn", "sharpe": 10.4702, "sortino": 22.8779, "return_pct": 72.89, "equity": 1728.9, "max_dd": 1.76, "win_rate": 73.33, "profit_factor": 5.806, "ic": 0.706, "hit": 73.33, "n": 165, "precision": 0.7089, "recall": 0.7273, "f1": 0.7179, "f2": 0.7235, "mcc": 0.4653, "accuracy": 0.7333, "tp": 56, "fp": 23, "tn": 65, "fn": 21, "aleatoric_mean": 1.7e-05, "epistemic_mean": 3.4e-05, "confidence_mean": 0.9999, "aleatoric_std": 9e-06, "epistemic_std": 1.8e-05}, {"fold": "fold_7", "regime": "Recent mixed/upturn", "sharpe": 8.4383, "sortino": 14.8449, "return_pct": 55.51, "equity": 1555.09, "max_dd": 1.64, "win_rate": 70.99, "profit_factor": 4.396, "ic": 0.64, "hit": 70.99, "n": 162, "precision": 0.7576, "recall": 0.6173, "f1": 0.6803, "f2": 0.641, "mcc": 0.4271, "accuracy": 0.7099, "tp": 50, "fp": 16, "tn": 65, "fn": 31, "aleatoric_mean": 1.8e-05, "epistemic_mean": 3.5e-05, "confidence_mean": 0.9999, "aleatoric_std": 7e-06, "epistemic_std": 1.4e-05}], "val_sharpe": 6.8772, "val_psr": 1.0, "val_equity": 4435.17, "val_sortino": 10.2934, "val_return_pct": 343.52, "val_max_dd": 4.77, "val_win_rate": 69.07, "val_profit_factor": 3.283, "val_ic": 0.5146, "val_hit": 68.62, "val_aleatoric_mean": 1.3e-05, "val_epistemic_mean": 2.6e-05, "val_confidence_mean": 1.0, "val_precision": 0.6522, "val_recall": 0.7397, "val_f1": 0.6932, "val_f2": 0.7204, "val_mcc": 0.3831, "val_accuracy": 0.6888, "val_per_window": [{"fold": "fold_1", "regime": "Pre-crisis upturn + GFC onset", "sharpe": 2.9895, "sortino": 4.9038, "return_pct": 7.62, "equity": 1076.21, "max_dd": 2.43, "win_rate": 56.48, "profit_factor": 1.644, "ic": 0.1755, "hit": 55.96, "n": 109, "precision": 0.5538, "recall": 0.6545, "f1": 0.6, "f2": 0.6316, "mcc": 0.1197, "accuracy": 0.5596, "tp": 36, "fp": 29, "tn": 25, "fn": 19, "aleatoric_mean": 1.3e-05, "epistemic_mean": 2.7e-05, "confidence_mean": 1.0, "aleatoric_std": 8e-06, "epistemic_std": 1.6e-05}, {"fold": "fold_2", "regime": "Post-crash recovery", "sharpe": 1.6016, "sortino": 2.5838, "return_pct": 7.75, "equity": 1077.48, "max_dd": 4.77, "win_rate": 52.78, "profit_factor": 1.288, "ic": 0.1239, "hit": 52.78, "n": 108, "precision": 0.6364, "recall": 0.4444, "f1": 0.5234, "f2": 0.473, "mcc": 0.0892, "accuracy": 0.5278, "tp": 28, "fp": 16, "tn": 29, "fn": 35, "aleatoric_mean": 1.7e-05, "epistemic_mean": 3.5e-05, "confidence_mean": 0.9999, "aleatoric_std": 7e-06, "epistemic_std": 1.5e-05}, {"fold": "fold_3", "regime": "Eurozone debt plateau", "sharpe": 6.9679, "sortino": 14.7496, "return_pct": 29.21, "equity": 1292.08, "max_dd": 1.65, "win_rate": 63.3, "profit_factor": 3.145, "ic": 0.7096, "hit": 62.16, "n": 111, "precision": 0.5385, "recall": 0.8936, "f1": 0.672, "f2": 0.7895, "mcc": 0.3579, "accuracy": 0.6306, "tp": 42, "fp": 36, "tn": 28, "fn": 5, "aleatoric_mean": 1.2e-05, "epistemic_mean": 2.5e-05, "confidence_mean": 1.0, "aleatoric_std": 5e-06, "epistemic_std": 9e-06}, {"fold": "fold_4", "regime": "Strong USD downturn", "sharpe": 11.5509, "sortino": 25.3214, "return_pct": 38.16, "equity": 1381.64, "max_dd": 1.14, "win_rate": 78.9, "profit_factor": 7.784, "ic": 0.7804, "hit": 78.18, "n": 110, "precision": 0.6716, "recall": 0.9574, "f1": 0.7895, "f2": 0.8824, "mcc": 0.6166, "accuracy": 0.7818, "tp": 45, "fp": 22, "tn": 41, "fn": 2, "aleatoric_mean": 1.3e-05, "epistemic_mean": 2.5e-05, "confidence_mean": 1.0, "aleatoric_std": 5e-06, "epistemic_std": 9e-06}, {"fold": "fold_5", "regime": "Low-vol plateau", "sharpe": 11.6374, "sortino": 39.3248, "return_pct": 36.62, "equity": 1366.24, "max_dd": 0.52, "win_rate": 72.32, "profit_factor": 8.077, "ic": 0.7898, "hit": 72.32, "n": 112, "precision": 0.6964, "recall": 0.7358, "f1": 0.7156, "f2": 0.7276, "mcc": 0.4471, "accuracy": 0.7232, "tp": 39, "fp": 17, "tn": 42, "fn": 14, "aleatoric_mean": 9e-06, "epistemic_mean": 1.8e-05, "confidence_mean": 1.0, "aleatoric_std": 4e-06, "epistemic_std": 7e-06}, {"fold": "fold_6", "regime": "EUR crisis downturn", "sharpe": 12.7109, "sortino": 38.8776, "return_pct": 25.44, "equity": 1254.38, "max_dd": 0.59, "win_rate": 77.57, "profit_factor": 11.095, "ic": 0.7946, "hit": 76.85, "n": 108, "precision": 0.7447, "recall": 0.7447, "f1": 0.7447, "f2": 0.7447, "mcc": 0.548, "accuracy": 0.7778, "tp": 35, "fp": 12, "tn": 49, "fn": 12, "aleatoric_mean": 9e-06, "epistemic_mean": 1.9e-05, "confidence_mean": 1.0, "aleatoric_std": 3e-06, "epistemic_std": 7e-06}, {"fold": "fold_7", "regime": "Recent mixed/upturn", "sharpe": 11.5316, "sortino": 21.5261, "return_pct": 25.01, "equity": 1250.14, "max_dd": 0.57, "win_rate": 81.82, "profit_factor": 6.989, "ic": 0.6686, "hit": 81.82, "n": 110, "precision": 0.7895, "recall": 0.8491, "f1": 0.8182, "f2": 0.8364, "mcc": 0.6385, "accuracy": 0.8182, "tp": 45, "fp": 12, "tn": 45, "fn": 8, "aleatoric_mean": 1.6e-05, "epistemic_mean": 3.1e-05, "confidence_mean": 1.0, "aleatoric_std": 7e-06, "epistemic_std": 1.3e-05}], "train_sharpe": 6.583, "train_psr": 1.0, "train_equity": 1618498.0, "train_sortino": 14.5578, "train_return_pct": 161749.8, "train_max_dd": 4.88, "train_win_rate": 74.31, "train_profit_factor": 4.956, "train_ic": 0.6635, "train_hit": 74.01, "train_precision": 0.7696, "train_recall": 0.7104, "train_f1": 0.7388, "train_f2": 0.7215, "train_mcc": 0.4857, "train_accuracy": 0.7417, "train_per_window": [{"fold": "all_train", "regime": "Training data", "sharpe": 6.583, "sortino": 14.5578, "return_pct": 161749.8, "equity": 1618498.0, "max_dd": 4.88, "win_rate": 74.31, "profit_factor": 4.956, "ic": 0.6635, "hit": 74.01, "n": 2478, "precision": 0.7696, "recall": 0.7104, "f1": 0.7388, "f2": 0.7215, "mcc": 0.4857, "accuracy": 0.7417, "tp": 905, "fp": 271, "tn": 933, "fn": 369}], "experiment_num": 114, "status": "DISCARD"}
