{"backbone": "itransformer", "description": "itransformer: Exp4 seq=30", "config": {"seq_len": 30, "lr": 5e-05, "batch_size": 32, "epochs": 100, "weight_decay": 0.0, "patience": 20, "grad_clip": 1.0, "warmup_epochs": 10, "huber_delta": 1.0, "head_dropout": 0.1, "seed": 42, "het_loss": false}, "composite": -0.796, "test_pos_folds": 4, "val_pos_folds": 3, "val_loss": 3.2e-05, "elapsed_sec": 107.7, "timestamp": "2026-04-21T12:49:54", "sharpe": -0.096, "psr": 0.4307, "equity": 954.74, "sortino": -0.1471, "return_pct": -4.53, "max_dd": 16.25, "win_rate": 48.37, "profit_factor": 0.984, "ic": -0.0023, "hit": 48.14, "aleatoric_mean": 8.2e-05, "epistemic_mean": 0.000165, "confidence_mean": 0.9998, "precision": 0.4814, "recall": 0.5012, "f1": 0.4911, "f2": 0.4971, "mcc": -0.0298, "accuracy": 0.485, "per_window": [{"fold": "fold_1", "regime": "Pre-crisis upturn + GFC onset", "sharpe": 0.4497, "sortino": 0.7999, "return_pct": 1.37, "equity": 1013.72, "max_dd": 4.01, "win_rate": 46.34, "profit_factor": 1.075, "ic": 0.0056, "hit": 45.78, "n": 83, "precision": 0.4898, "recall": 0.5581, "f1": 0.5217, "f2": 0.543, "mcc": -0.0679, "accuracy": 0.4699, "tp": 24, "fp": 25, "tn": 15, "fn": 19, "aleatoric_mean": 0.000383, "epistemic_mean": 0.000767, "confidence_mean": 0.9989, "aleatoric_std": 0.00068, "epistemic_std": 0.00136}, {"fold": "fold_2", "regime": "Post-crash recovery", "sharpe": -0.3463, "sortino": -0.6829, "return_pct": -1.59, "equity": 984.08, "max_dd": 6.67, "win_rate": 44.83, "profit_factor": 0.947, "ic": -0.0197, "hit": 44.83, "n": 87, "precision": 0.4737, "recall": 0.3913, "f1": 0.4286, "f2": 0.4054, "mcc": -0.0971, "accuracy": 0.4483, "tp": 18, "fp": 20, "tn": 21, "fn": 28, "aleatoric_mean": 4.2e-05, "epistemic_mean": 8.4e-05, "confidence_mean": 0.9999, "aleatoric_std": 1.6e-05, "epistemic_std": 3.1e-05}, {"fold": "fold_3", "regime": "Eurozone debt plateau", "sharpe": 0.8652, "sortino": 1.5758, "return_pct": 2.44, "equity": 1024.39, "max_dd": 3.73, "win_rate": 48.81, "profit_factor": 1.146, "ic": 0.0023, "hit": 47.67, "n": 86, "precision": 0.5455, "recall": 0.5106, "f1": 0.5275, "f2": 0.5172, "mcc": -0.0022, "accuracy": 0.5, "tp": 24, "fp": 20, "tn": 19, "fn": 23, "aleatoric_mean": 5.3e-05, "epistemic_mean": 0.000106, "confidence_mean": 0.9998, "aleatoric_std": 1.9e-05, "epistemic_std": 3.7e-05}, {"fold": "fold_4", "regime": "Strong USD downturn", "sharpe": 0.4435, "sortino": 0.6162, "return_pct": 2.71, "equity": 1027.12, "max_dd": 8.03, "win_rate": 54.42, "profit_factor": 1.079, "ic": 0.0645, "hit": 54.05, "n": 148, "precision": 0.5375, "recall": 0.5811, "f1": 0.5584, "f2": 0.5718, "mcc": 0.0813, "accuracy": 0.5405, "tp": 43, "fp": 37, "tn": 37, "fn": 31, "aleatoric_mean": 5e-05, "epistemic_mean": 0.0001, "confidence_mean": 0.9999, "aleatoric_std": 1.8e-05, "epistemic_std": 3.6e-05}, {"fold": "fold_5", "regime": "Low-vol plateau", "sharpe": 1.6133, "sortino": 3.1025, "return_pct": 4.63, "equity": 1046.28, "max_dd": 2.38, "win_rate": 50.7, "profit_factor": 1.311, "ic": 0.1173, "hit": 50.7, "n": 142, "precision": 0.4706, "recall": 0.4848, "f1": 0.4776, "f2": 0.4819, "mcc": 0.0111, "accuracy": 0.507, "tp": 32, "fp": 36, "tn": 40, "fn": 34, "aleatoric_mean": 4.9e-05, "epistemic_mean": 9.9e-05, "confidence_mean": 0.9999, "aleatoric_std": 1.8e-05, "epistemic_std": 3.7e-05}, {"fold": "fold_6", "regime": "EUR crisis downturn", "sharpe": -1.6234, "sortino": -2.8414, "return_pct": -9.07, "equity": 909.33, "max_dd": 12.3, "win_rate": 46.21, "profit_factor": 0.771, "ic": -0.1251, "hit": 46.21, "n": 145, "precision": 0.4211, "recall": 0.4848, "f1": 0.4507, "f2": 0.4706, "mcc": -0.0719, "accuracy": 0.4621, "tp": 32, "fp": 44, "tn": 35, "fn": 34, "aleatoric_mean": 5.3e-05, "epistemic_mean": 0.000106, "confidence_mean": 0.9998, "aleatoric_std": 1.9e-05, "epistemic_std": 3.7e-05}, {"fold": "fold_7", "regime": "Recent mixed/upturn", "sharpe": -0.7998, "sortino": -1.0958, "return_pct": -4.39, "equity": 956.05, "max_dd": 7.86, "win_rate": 45.07, "profit_factor": 0.874, "ic": -0.0495, "hit": 45.07, "n": 142, "precision": 0.4533, "recall": 0.4789, "f1": 0.4658, "f2": 0.4735, "mcc": -0.0987, "accuracy": 0.4507, "tp": 34, "fp": 41, "tn": 30, "fn": 37, "aleatoric_mean": 4.5e-05, "epistemic_mean": 9.1e-05, "confidence_mean": 0.9999, "aleatoric_std": 1.7e-05, "epistemic_std": 3.3e-05}], "val_sharpe": 0.0547, "val_psr": 0.5344, "val_equity": 1003.02, "val_sortino": 0.0849, "val_return_pct": 0.3, "val_max_dd": 14.41, "val_win_rate": 49.68, "val_profit_factor": 1.009, "val_ic": 0.0056, "val_hit": 49.36, "val_aleatoric_mean": 4.5e-05, "val_epistemic_mean": 9e-05, "val_confidence_mean": 0.9999, "val_precision": 0.4751, "val_recall": 0.4735, "val_f1": 0.4743, "val_f2": 0.4738, "val_mcc": -0.0112, "val_accuracy": 0.4952, "val_per_window": [{"fold": "fold_1", "regime": "Pre-crisis upturn + GFC onset", "sharpe": -1.8692, "sortino": -2.7775, "return_pct": -3.96, "equity": 960.37, "max_dd": 5.23, "win_rate": 43.18, "profit_factor": 0.729, "ic": -0.1528, "hit": 42.7, "n": 89, "precision": 0.4194, "recall": 0.2826, "f1": 0.3377, "f2": 0.3023, "mcc": -0.1426, "accuracy": 0.427, "tp": 13, "fp": 18, "tn": 25, "fn": 33, "aleatoric_mean": 3.6e-05, "epistemic_mean": 7.3e-05, "confidence_mean": 0.9999, "aleatoric_std": 1.3e-05, "epistemic_std": 2.5e-05}, {"fold": "fold_2", "regime": "Post-crash recovery", "sharpe": 1.3614, "sortino": 2.3066, "return_pct": 4.93, "equity": 1049.31, "max_dd": 4.07, "win_rate": 55.68, "profit_factor": 1.242, "ic": 0.113, "hit": 55.68, "n": 88, "precision": 0.6122, "recall": 0.6, "f1": 0.6061, "f2": 0.6024, "mcc": 0.0997, "accuracy": 0.5568, "tp": 30, "fp": 19, "tn": 19, "fn": 20, "aleatoric_mean": 5.9e-05, "epistemic_mean": 0.000118, "confidence_mean": 0.9998, "aleatoric_std": 2.3e-05, "epistemic_std": 4.6e-05}, {"fold": "fold_3", "regime": "Eurozone debt plateau", "sharpe": 1.9965, "sortino": 3.8434, "return_pct": 6.97, "equity": 1069.69, "max_dd": 5.02, "win_rate": 50.0, "profit_factor": 1.384, "ic": 0.1873, "hit": 49.45, "n": 91, "precision": 0.4222, "recall": 0.4872, "f1": 0.4524, "f2": 0.4726, "mcc": -0.0127, "accuracy": 0.4945, "tp": 19, "fp": 26, "tn": 26, "fn": 20, "aleatoric_mean": 4.5e-05, "epistemic_mean": 9.1e-05, "confidence_mean": 0.9999, "aleatoric_std": 1.6e-05, "epistemic_std": 3.2e-05}, {"fold": "fold_4", "regime": "Strong USD downturn", "sharpe": -1.6328, "sortino": -2.6622, "return_pct": -5.02, "equity": 949.83, "max_dd": 7.04, "win_rate": 46.07, "profit_factor": 0.769, "ic": -0.1252, "hit": 45.56, "n": 90, "precision": 0.4314, "recall": 0.5366, "f1": 0.4783, "f2": 0.5116, "mcc": -0.0555, "accuracy": 0.4667, "tp": 22, "fp": 29, "tn": 20, "fn": 19, "aleatoric_mean": 4.8e-05, "epistemic_mean": 9.5e-05, "confidence_mean": 0.9999, "aleatoric_std": 1.8e-05, "epistemic_std": 3.7e-05}, {"fold": "fold_5", "regime": "Low-vol plateau", "sharpe": -2.199, "sortino": -2.8633, "return_pct": -5.98, "equity": 940.24, "max_dd": 8.72, "win_rate": 51.09, "profit_factor": 0.688, "ic": -0.0335, "hit": 51.09, "n": 92, "precision": 0.5106, "recall": 0.5217, "f1": 0.5161, "f2": 0.5195, "mcc": 0.0217, "accuracy": 0.5109, "tp": 24, "fp": 23, "tn": 23, "fn": 22, "aleatoric_mean": 4.5e-05, "epistemic_mean": 9e-05, "confidence_mean": 0.9999, "aleatoric_std": 1.7e-05, "epistemic_std": 3.4e-05}, {"fold": "fold_6", "regime": "EUR crisis downturn", "sharpe": -0.5192, "sortino": -0.7542, "return_pct": -0.94, "equity": 990.65, "max_dd": 2.61, "win_rate": 49.43, "profit_factor": 0.917, "ic": 0.0512, "hit": 48.86, "n": 88, "precision": 0.4, "recall": 0.5, "f1": 0.4444, "f2": 0.4762, "mcc": -0.0189, "accuracy": 0.4886, "tp": 18, "fp": 27, "tn": 25, "fn": 18, "aleatoric_mean": 4.3e-05, "epistemic_mean": 8.6e-05, "confidence_mean": 0.9999, "aleatoric_std": 1.5e-05, "epistemic_std": 3e-05}, {"fold": "fold_7", "regime": "Recent mixed/upturn", "sharpe": 2.5763, "sortino": 4.826, "return_pct": 5.17, "equity": 1051.72, "max_dd": 1.61, "win_rate": 52.22, "profit_factor": 1.516, "ic": 0.0382, "hit": 52.22, "n": 90, "precision": 0.5152, "recall": 0.3864, "f1": 0.4416, "f2": 0.4067, "mcc": 0.04, "accuracy": 0.5222, "tp": 17, "fp": 16, "tn": 30, "fn": 27, "aleatoric_mean": 4e-05, "epistemic_mean": 8e-05, "confidence_mean": 0.9999, "aleatoric_std": 1.4e-05, "epistemic_std": 2.8e-05}], "train_sharpe": 1.4273, "train_psr": 1.0, "train_equity": 3728.36, "train_sortino": 2.9088, "train_return_pct": 272.84, "train_max_dd": 17.04, "train_win_rate": 54.65, "train_profit_factor": 1.36, "train_ic": 0.1253, "train_hit": 54.43, "train_precision": 0.5683, "train_recall": 0.5353, "train_f1": 0.5513, "train_f2": 0.5416, "train_mcc": 0.0955, "train_accuracy": 0.5473, "train_per_window": [{"fold": "all_train", "regime": "Training data", "sharpe": 1.4273, "sortino": 2.9088, "return_pct": 272.84, "equity": 3728.36, "max_dd": 17.04, "win_rate": 54.65, "profit_factor": 1.36, "ic": 0.1253, "hit": 54.43, "n": 1988, "precision": 0.5683, "recall": 0.5353, "f1": 0.5513, "f2": 0.5416, "mcc": 0.0955, "accuracy": 0.5473, "tp": 553, "fp": 420, "tn": 535, "fn": 480}], "experiment_num": 255, "status": "DISCARD"}
{"backbone": "itransformer", "description": "itransformer: Exp5 hidden=256 num_layers=3", "config": {"seq_len": 60, "lr": 5e-05, "batch_size": 32, "epochs": 100, "weight_decay": 0.0, "patience": 20, "grad_clip": 1.0, "warmup_epochs": 10, "huber_delta": 1.0, "head_dropout": 0.1, "seed": 42, "hidden_size": 256, "num_layers": 3, "het_loss": false}, "composite": 0.0011, "test_pos_folds": 5, "val_pos_folds": 3, "val_loss": 3.8e-05, "elapsed_sec": 93.2, "timestamp": "2026-04-21T12:51:38", "sharpe": 0.6011, "psr": 0.8268, "equity": 1137.97, "sortino": 0.9021, "return_pct": 13.8, "max_dd": 7.68, "win_rate": 52.02, "profit_factor": 1.106, "ic": 0.0234, "hit": 51.69, "aleatoric_mean": 0.000102, "epistemic_mean": 0.000205, "confidence_mean": 0.9997, "precision": 0.5256, "recall": 0.3968, "f1": 0.4522, "f2": 0.4172, "mcc": 0.0435, "accuracy": 0.5217, "per_window": [{"fold": "fold_1", "regime": "Pre-crisis upturn + GFC onset", "sharpe": 1.5125, "sortino": 2.6404, "return_pct": 3.13, "equity": 1031.27, "max_dd": 2.5, "win_rate": 55.77, "profit_factor": 1.261, "ic": 0.0574, "hit": 54.72, "n": 53, "precision": 0.5652, "recall": 0.5, "f1": 0.5306, "f2": 0.5118, "mcc": 0.1308, "accuracy": 0.566, "tp": 13, "fp": 10, "tn": 17, "fn": 13, "aleatoric_mean": 0.000628, "epistemic_mean": 0.001255, "confidence_mean": 0.9981, "aleatoric_std": 0.000446, "epistemic_std": 0.000892}, {"fold": "fold_2", "regime": "Post-crash recovery", "sharpe": 0.8163, "sortino": 1.3588, "return_pct": 2.17, "equity": 1021.73, "max_dd": 4.96, "win_rate": 54.39, "profit_factor": 1.14, "ic": -0.0178, "hit": 54.39, "n": 57, "precision": 0.5862, "recall": 0.5484, "f1": 0.5667, "f2": 0.5556, "mcc": 0.0865, "accuracy": 0.5439, "tp": 17, "fp": 12, "tn": 14, "fn": 14, "aleatoric_mean": 4.7e-05, "epistemic_mean": 9.3e-05, "confidence_mean": 0.9999, "aleatoric_std": 1.7e-05, "epistemic_std": 3.3e-05}, {"fold": "fold_3", "regime": "Eurozone debt plateau", "sharpe": 0.0091, "sortino": 0.0141, "return_pct": -0.05, "equity": 999.45, "max_dd": 2.85, "win_rate": 53.7, "profit_factor": 1.001, "ic": 0.0091, "hit": 51.79, "n": 56, "precision": 0.6071, "recall": 0.5312, "f1": 0.5667, "f2": 0.5449, "mcc": 0.0722, "accuracy": 0.5357, "tp": 17, "fp": 11, "tn": 13, "fn": 15, "aleatoric_mean": 5.6e-05, "epistemic_mean": 0.000111, "confidence_mean": 0.9998, "aleatoric_std": 1.6e-05, "epistemic_std": 3.2e-05}, {"fold": "fold_4", "regime": "Strong USD downturn", "sharpe": 0.7897, "sortino": 1.1503, "return_pct": 3.79, "equity": 1037.87, "max_dd": 5.95, "win_rate": 52.14, "profit_factor": 1.142, "ic": 0.1021, "hit": 51.69, "n": 118, "precision": 0.5833, "recall": 0.2333, "f1": 0.3333, "f2": 0.2652, "mcc": 0.0757, "accuracy": 0.5254, "tp": 14, "fp": 10, "tn": 48, "fn": 46, "aleatoric_mean": 5.1e-05, "epistemic_mean": 0.000102, "confidence_mean": 0.9998, "aleatoric_std": 1.9e-05, "epistemic_std": 3.7e-05}, {"fold": "fold_5", "regime": "Low-vol plateau", "sharpe": -1.143, "sortino": -1.7737, "return_pct": -2.59, "equity": 974.08, "max_dd": 3.68, "win_rate": 50.0, "profit_factor": 0.827, "ic": -0.0234, "hit": 50.0, "n": 112, "precision": 0.4615, "recall": 0.5882, "f1": 0.5172, "f2": 0.5576, "mcc": 0.0146, "accuracy": 0.5, "tp": 30, "fp": 35, "tn": 26, "fn": 21, "aleatoric_mean": 4.8e-05, "epistemic_mean": 9.7e-05, "confidence_mean": 0.9999, "aleatoric_std": 1.7e-05, "epistemic_std": 3.3e-05}, {"fold": "fold_6", "regime": "EUR crisis downturn", "sharpe": 2.4465, "sortino": 4.3143, "return_pct": 11.26, "equity": 1112.64, "max_dd": 3.44, "win_rate": 52.17, "profit_factor": 1.473, "ic": 0.0295, "hit": 52.17, "n": 115, "precision": 0.4643, "recall": 0.2453, "f1": 0.321, "f2": 0.2708, "mcc": 0.0039, "accuracy": 0.5217, "tp": 13, "fp": 15, "tn": 47, "fn": 40, "aleatoric_mean": 6.6e-05, "epistemic_mean": 0.000131, "confidence_mean": 0.9998, "aleatoric_std": 2.4e-05, "epistemic_std": 4.7e-05}, {"fold": "fold_7", "regime": "Recent mixed/upturn", "sharpe": -0.9252, "sortino": -1.2459, "return_pct": -3.93, "equity": 960.66, "max_dd": 5.13, "win_rate": 50.0, "profit_factor": 0.853, "ic": -0.0605, "hit": 50.0, "n": 112, "precision": 0.5135, "recall": 0.3333, "f1": 0.4043, "f2": 0.3585, "mcc": 0.0064, "accuracy": 0.5, "tp": 19, "fp": 18, "tn": 37, "fn": 38, "aleatoric_mean": 5.1e-05, "epistemic_mean": 0.000102, "confidence_mean": 0.9998, "aleatoric_std": 1.8e-05, "epistemic_std": 3.6e-05}], "val_sharpe": 0.6914, "val_psr": 0.8117, "val_equity": 1085.22, "val_sortino": 0.9962, "val_return_pct": 8.52, "val_max_dd": 5.67, "val_win_rate": 52.4, "val_profit_factor": 1.122, "val_ic": 0.0539, "val_hit": 52.15, "val_aleatoric_mean": 4.9e-05, "val_epistemic_mean": 9.8e-05, "val_confidence_mean": 0.9999, "val_precision": 0.5179, "val_recall": 0.5631, "val_f1": 0.5395, "val_f2": 0.5534, "val_mcc": 0.0538, "val_accuracy": 0.5263, "val_per_window": [{"fold": "fold_1", "regime": "Pre-crisis upturn + GFC onset", "sharpe": -0.0539, "sortino": -0.0812, "return_pct": -0.14, "equity": 998.61, "max_dd": 2.82, "win_rate": 50.0, "profit_factor": 0.991, "ic": -0.0271, "hit": 49.15, "n": 59, "precision": 0.5417, "recall": 0.4194, "f1": 0.4727, "f2": 0.4392, "mcc": 0.0269, "accuracy": 0.5085, "tp": 13, "fp": 11, "tn": 17, "fn": 18, "aleatoric_mean": 4.3e-05, "epistemic_mean": 8.5e-05, "confidence_mean": 0.9999, "aleatoric_std": 1.1e-05, "epistemic_std": 2.3e-05}, {"fold": "fold_2", "regime": "Post-crash recovery", "sharpe": 1.8833, "sortino": 2.5887, "return_pct": 3.65, "equity": 1036.51, "max_dd": 2.25, "win_rate": 60.34, "profit_factor": 1.356, "ic": 0.1928, "hit": 60.34, "n": 58, "precision": 0.6053, "recall": 0.7419, "f1": 0.6667, "f2": 0.7099, "mcc": 0.1956, "accuracy": 0.6034, "tp": 23, "fp": 15, "tn": 12, "fn": 8, "aleatoric_mean": 5.8e-05, "epistemic_mean": 0.000116, "confidence_mean": 0.9998, "aleatoric_std": 2.5e-05, "epistemic_std": 5e-05}, {"fold": "fold_3", "regime": "Eurozone debt plateau", "sharpe": -0.3059, "sortino": -0.3798, "return_pct": -0.84, "equity": 991.65, "max_dd": 3.75, "win_rate": 52.46, "profit_factor": 0.95, "ic": 0.0188, "hit": 52.46, "n": 61, "precision": 0.4722, "recall": 0.6296, "f1": 0.5397, "f2": 0.5903, "mcc": 0.0715, "accuracy": 0.5246, "tp": 17, "fp": 19, "tn": 15, "fn": 10, "aleatoric_mean": 5.1e-05, "epistemic_mean": 0.000103, "confidence_mean": 0.9998, "aleatoric_std": 1.6e-05, "epistemic_std": 3.1e-05}, {"fold": "fold_4", "regime": "Strong USD downturn", "sharpe": 3.2333, "sortino": 7.6909, "return_pct": 7.08, "equity": 1070.77, "max_dd": 3.58, "win_rate": 56.67, "profit_factor": 1.642, "ic": 0.1747, "hit": 56.67, "n": 60, "precision": 0.5405, "recall": 0.6897, "f1": 0.6061, "f2": 0.6536, "mcc": 0.1452, "accuracy": 0.5667, "tp": 20, "fp": 17, "tn": 14, "fn": 9, "aleatoric_mean": 5.3e-05, "epistemic_mean": 0.000106, "confidence_mean": 0.9998, "aleatoric_std": 1.5e-05, "epistemic_std": 3.1e-05}, {"fold": "fold_5", "regime": "Low-vol plateau", "sharpe": -1.4892, "sortino": -2.0401, "return_pct": -2.6, "equity": 973.97, "max_dd": 2.78, "win_rate": 48.39, "profit_factor": 0.785, "ic": -0.1261, "hit": 48.39, "n": 62, "precision": 0.5, "recall": 0.4375, "f1": 0.4667, "f2": 0.4487, "mcc": -0.0293, "accuracy": 0.4839, "tp": 14, "fp": 14, "tn": 16, "fn": 18, "aleatoric_mean": 4.8e-05, "epistemic_mean": 9.6e-05, "confidence_mean": 0.9999, "aleatoric_std": 1.9e-05, "epistemic_std": 3.9e-05}, {"fold": "fold_6", "regime": "EUR crisis downturn", "sharpe": -2.0191, "sortino": -3.1995, "return_pct": -2.09, "equity": 979.08, "max_dd": 2.4, "win_rate": 43.86, "profit_factor": 0.718, "ic": -0.1356, "hit": 43.1, "n": 58, "precision": 0.375, "recall": 0.5, "f1": 0.4286, "f2": 0.4688, "mcc": -0.0874, "accuracy": 0.4483, "tp": 12, "fp": 20, "tn": 14, "fn": 12, "aleatoric_mean": 4.5e-05, "epistemic_mean": 9e-05, "confidence_mean": 0.9999, "aleatoric_std": 1.4e-05, "epistemic_std": 2.7e-05}, {"fold": "fold_7", "regime": "Recent mixed/upturn", "sharpe": 2.7914, "sortino": 5.079, "return_pct": 3.54, "equity": 1035.45, "max_dd": 1.4, "win_rate": 55.0, "profit_factor": 1.578, "ic": 0.1639, "hit": 55.0, "n": 60, "precision": 0.5862, "recall": 0.5312, "f1": 0.5574, "f2": 0.5414, "mcc": 0.1025, "accuracy": 0.55, "tp": 17, "fp": 12, "tn": 16, "fn": 15, "aleatoric_mean": 4.4e-05, "epistemic_mean": 8.8e-05, "confidence_mean": 0.9999, "aleatoric_std": 1.3e-05, "epistemic_std": 2.7e-05}], "train_sharpe": 2.1817, "train_psr": 1.0, "train_equity": 4477.45, "train_sortino": 5.2895, "train_return_pct": 347.74, "train_max_dd": 6.01, "train_win_rate": 56.29, "train_profit_factor": 1.662, "train_ic": 0.1979, "train_hit": 56.01, "train_precision": 0.6025, "train_recall": 0.4672, "train_f1": 0.5263, "train_f2": 0.4892, "train_mcc": 0.1374, "train_accuracy": 0.5637, "train_per_window": [{"fold": "all_train", "regime": "Training data", "sharpe": 2.1817, "sortino": 5.2895, "return_pct": 347.74, "equity": 4477.45, "max_dd": 6.01, "win_rate": 56.29, "profit_factor": 1.662, "ic": 0.1979, "hit": 56.01, "n": 1382, "precision": 0.6025, "recall": 0.4672, "f1": 0.5263, "f2": 0.4892, "mcc": 0.1374, "accuracy": 0.5637, "tp": 335, "fp": 221, "tn": 444, "fn": 382}], "experiment_num": 256, "status": "DISCARD"}
