{"backbone": "itransformer", "description": "itransformer: Exp6 hd=0.25", "config": {"seq_len": 60, "lr": 5e-05, "batch_size": 32, "epochs": 100, "weight_decay": 0.0, "patience": 20, "grad_clip": 1.0, "warmup_epochs": 10, "huber_delta": 1.0, "head_dropout": 0.25, "seed": 42, "het_loss": false}, "composite": -0.8378, "test_pos_folds": 4, "val_pos_folds": 3, "val_loss": 3.4e-05, "elapsed_sec": 81.5, "timestamp": "2026-04-21T12:53:11", "sharpe": 0.0225, "psr": 0.5141, "equity": 994.24, "sortino": 0.0335, "return_pct": -0.58, "max_dd": 11.21, "win_rate": 52.34, "profit_factor": 1.004, "ic": 0.003, "hit": 52.01, "aleatoric_mean": 0.000299, "epistemic_mean": 0.000598, "confidence_mean": 0.9991, "precision": 0.524, "recall": 0.529, "f1": 0.5265, "f2": 0.528, "mcc": 0.053, "accuracy": 0.5265, "per_window": [{"fold": "fold_1", "regime": "Pre-crisis upturn + GFC onset", "sharpe": -2.1524, "sortino": -3.777, "return_pct": -4.51, "equity": 954.86, "max_dd": 5.2, "win_rate": 42.31, "profit_factor": 0.719, "ic": -0.1276, "hit": 41.51, "n": 53, "precision": 0.4333, "recall": 0.5, "f1": 0.4643, "f2": 0.4851, "mcc": -0.1308, "accuracy": 0.434, "tp": 13, "fp": 17, "tn": 10, "fn": 13, "aleatoric_mean": 0.001777, "epistemic_mean": 0.003554, "confidence_mean": 0.9947, "aleatoric_std": 0.001254, "epistemic_std": 0.002509}, {"fold": "fold_2", "regime": "Post-crash recovery", "sharpe": -1.3477, "sortino": -2.158, "return_pct": -3.94, "equity": 960.6, "max_dd": 7.34, "win_rate": 49.12, "profit_factor": 0.806, "ic": 0.0169, "hit": 49.12, "n": 57, "precision": 0.5238, "recall": 0.7097, "f1": 0.6027, "f2": 0.6627, "mcc": -0.0674, "accuracy": 0.4912, "tp": 22, "fp": 20, "tn": 6, "fn": 9, "aleatoric_mean": 0.000159, "epistemic_mean": 0.000318, "confidence_mean": 0.9995, "aleatoric_std": 8.2e-05, "epistemic_std": 0.000165}, {"fold": "fold_3", "regime": "Eurozone debt plateau", "sharpe": 2.1485, "sortino": 3.0606, "return_pct": 3.78, "equity": 1037.76, "max_dd": 2.51, "win_rate": 57.41, "profit_factor": 1.409, "ic": 0.1207, "hit": 55.36, "n": 56, "precision": 0.6957, "recall": 0.5, "f1": 0.5818, "f2": 0.5298, "mcc": 0.2096, "accuracy": 0.5893, "tp": 16, "fp": 7, "tn": 17, "fn": 16, "aleatoric_mean": 0.000176, "epistemic_mean": 0.000351, "confidence_mean": 0.9995, "aleatoric_std": 6.7e-05, "epistemic_std": 0.000134}, {"fold": "fold_4", "regime": "Strong USD downturn", "sharpe": -0.9549, "sortino": -1.2544, "return_pct": -4.97, "equity": 950.3, "max_dd": 6.68, "win_rate": 48.72, "profit_factor": 0.852, "ic": -0.0695, "hit": 48.31, "n": 118, "precision": 0.5, "recall": 0.4, "f1": 0.4444, "f2": 0.4167, "mcc": -0.014, "accuracy": 0.4915, "tp": 24, "fp": 24, "tn": 34, "fn": 36, "aleatoric_mean": 0.000155, "epistemic_mean": 0.00031, "confidence_mean": 0.9995, "aleatoric_std": 4.5e-05, "epistemic_std": 9e-05}, {"fold": "fold_5", "regime": "Low-vol plateau", "sharpe": 0.7057, "sortino": 1.0782, "return_pct": 1.54, "equity": 1015.43, "max_dd": 1.71, "win_rate": 57.14, "profit_factor": 1.125, "ic": 0.0085, "hit": 57.14, "n": 112, "precision": 0.5238, "recall": 0.6471, "f1": 0.5789, "f2": 0.618, "mcc": 0.1559, "accuracy": 0.5714, "tp": 33, "fp": 30, "tn": 31, "fn": 18, "aleatoric_mean": 0.000161, "epistemic_mean": 0.000322, "confidence_mean": 0.9995, "aleatoric_std": 5.9e-05, "epistemic_std": 0.000118}, {"fold": "fold_6", "regime": "EUR crisis downturn", "sharpe": 1.0392, "sortino": 1.9515, "return_pct": 4.55, "equity": 1045.51, "max_dd": 4.01, "win_rate": 50.43, "profit_factor": 1.179, "ic": 0.1069, "hit": 50.43, "n": 115, "precision": 0.4655, "recall": 0.5094, "f1": 0.4865, "f2": 0.5, "mcc": 0.0094, "accuracy": 0.5043, "tp": 27, "fp": 31, "tn": 31, "fn": 26, "aleatoric_mean": 0.000179, "epistemic_mean": 0.000359, "confidence_mean": 0.9995, "aleatoric_std": 6.5e-05, "epistemic_std": 0.000129}, {"fold": "fold_7", "regime": "Recent mixed/upturn", "sharpe": 0.8866, "sortino": 1.5406, "return_pct": 3.53, "equity": 1035.31, "max_dd": 5.46, "win_rate": 57.14, "profit_factor": 1.164, "ic": 0.0956, "hit": 57.14, "n": 112, "precision": 0.5918, "recall": 0.5088, "f1": 0.5472, "f2": 0.5235, "mcc": 0.1463, "accuracy": 0.5714, "tp": 29, "fp": 20, "tn": 35, "fn": 28, "aleatoric_mean": 0.000146, "epistemic_mean": 0.000292, "confidence_mean": 0.9996, "aleatoric_std": 6.1e-05, "epistemic_std": 0.000123}], "val_sharpe": -0.1378, "val_psr": 0.4296, "val_equity": 978.25, "val_sortino": -0.1939, "val_return_pct": -2.18, "val_max_dd": 11.76, "val_win_rate": 54.33, "val_profit_factor": 0.977, "val_ic": -0.0145, "val_hit": 54.07, "val_aleatoric_mean": 0.000147, "val_epistemic_mean": 0.000293, "val_confidence_mean": 0.9996, "val_precision": 0.5359, "val_recall": 0.5437, "val_f1": 0.5398, "val_f2": 0.5421, "val_mcc": 0.0861, "val_accuracy": 0.5431, "val_per_window": [{"fold": "fold_1", "regime": "Pre-crisis upturn + GFC onset", "sharpe": -0.1424, "sortino": -0.2111, "return_pct": -0.28, "equity": 997.21, "max_dd": 3.83, "win_rate": 53.45, "profit_factor": 0.977, "ic": -0.0083, "hit": 52.54, "n": 59, "precision": 0.5517, "recall": 0.5161, "f1": 0.5333, "f2": 0.5229, "mcc": 0.0518, "accuracy": 0.5254, "tp": 16, "fp": 13, "tn": 15, "fn": 15, "aleatoric_mean": 0.000115, "epistemic_mean": 0.00023, "confidence_mean": 0.9997, "aleatoric_std": 4e-05, "epistemic_std": 8e-05}, {"fold": "fold_2", "regime": "Post-crash recovery", "sharpe": -0.2187, "sortino": -0.3231, "return_pct": -0.51, "equity": 994.89, "max_dd": 5.46, "win_rate": 51.72, "profit_factor": 0.965, "ic": -0.0585, "hit": 51.72, "n": 58, "precision": 0.56, "recall": 0.4516, "f1": 0.5, "f2": 0.4698, "mcc": 0.0445, "accuracy": 0.5172, "tp": 14, "fp": 11, "tn": 16, "fn": 17, "aleatoric_mean": 0.000185, "epistemic_mean": 0.000369, "confidence_mean": 0.9994, "aleatoric_std": 6.7e-05, "epistemic_std": 0.000133}, {"fold": "fold_3", "regime": "Eurozone debt plateau", "sharpe": -1.1313, "sortino": -1.7004, "return_pct": -2.74, "equity": 972.56, "max_dd": 3.96, "win_rate": 45.9, "profit_factor": 0.828, "ic": -0.0744, "hit": 45.9, "n": 61, "precision": 0.3929, "recall": 0.4074, "f1": 0.4, "f2": 0.4044, "mcc": -0.0923, "accuracy": 0.459, "tp": 11, "fp": 17, "tn": 17, "fn": 16, "aleatoric_mean": 0.000152, "epistemic_mean": 0.000305, "confidence_mean": 0.9995, "aleatoric_std": 4.6e-05, "epistemic_std": 9.2e-05}, {"fold": "fold_4", "regime": "Strong USD downturn", "sharpe": -2.5917, "sortino": -3.767, "return_pct": -5.54, "equity": 944.57, "max_dd": 7.28, "win_rate": 48.33, "profit_factor": 0.672, "ic": -0.2483, "hit": 48.33, "n": 60, "precision": 0.4688, "recall": 0.5172, "f1": 0.4918, "f2": 0.5068, "mcc": -0.0312, "accuracy": 0.4833, "tp": 15, "fp": 17, "tn": 14, "fn": 14, "aleatoric_mean": 0.000174, "epistemic_mean": 0.000347, "confidence_mean": 0.9995, "aleatoric_std": 6e-05, "epistemic_std": 0.00012}, {"fold": "fold_5", "regime": "Low-vol plateau", "sharpe": 1.9379, "sortino": 3.1472, "return_pct": 3.33, "equity": 1033.35, "max_dd": 1.74, "win_rate": 59.68, "profit_factor": 1.369, "ic": 0.1951, "hit": 59.68, "n": 62, "precision": 0.5897, "recall": 0.7188, "f1": 0.6479, "f2": 0.6886, "mcc": 0.1918, "accuracy": 0.5968, "tp": 23, "fp": 16, "tn": 14, "fn": 9, "aleatoric_mean": 0.000128, "epistemic_mean": 0.000256, "confidence_mean": 0.9996, "aleatoric_std": 4.6e-05, "epistemic_std": 9.1e-05}, {"fold": "fold_6", "regime": "EUR crisis downturn", "sharpe": 2.459, "sortino": 3.6567, "return_pct": 2.54, "equity": 1025.44, "max_dd": 1.5, "win_rate": 61.4, "profit_factor": 1.497, "ic": 0.1684, "hit": 60.34, "n": 58, "precision": 0.5333, "recall": 0.6667, "f1": 0.5926, "f2": 0.6349, "mcc": 0.2512, "accuracy": 0.6207, "tp": 16, "fp": 14, "tn": 20, "fn": 8, "aleatoric_mean": 0.00015, "epistemic_mean": 0.0003, "confidence_mean": 0.9995, "aleatoric_std": 5.1e-05, "epistemic_std": 0.000102}, {"fold": "fold_7", "regime": "Recent mixed/upturn", "sharpe": 1.0333, "sortino": 1.7149, "return_pct": 1.29, "equity": 1012.93, "max_dd": 2.62, "win_rate": 60.0, "profit_factor": 1.184, "ic": 0.1299, "hit": 60.0, "n": 60, "precision": 0.6538, "recall": 0.5312, "f1": 0.5862, "f2": 0.5519, "mcc": 0.2112, "accuracy": 0.6, "tp": 17, "fp": 9, "tn": 19, "fn": 15, "aleatoric_mean": 0.000124, "epistemic_mean": 0.000247, "confidence_mean": 0.9996, "aleatoric_std": 4.1e-05, "epistemic_std": 8.2e-05}], "train_sharpe": 1.3717, "train_psr": 1.0, "train_equity": 2538.47, "train_sortino": 3.212, "train_return_pct": 153.85, "train_max_dd": 14.2, "train_win_rate": 52.87, "train_profit_factor": 1.373, "train_ic": 0.1016, "train_hit": 52.6, "train_precision": 0.5447, "train_recall": 0.5523, "train_f1": 0.5485, "train_f2": 0.5508, "train_mcc": 0.0546, "train_accuracy": 0.5282, "train_per_window": [{"fold": "all_train", "regime": "Training data", "sharpe": 1.3717, "sortino": 3.212, "return_pct": 153.85, "equity": 2538.47, "max_dd": 14.2, "win_rate": 52.87, "profit_factor": 1.373, "ic": 0.1016, "hit": 52.6, "n": 1382, "precision": 0.5447, "recall": 0.5523, "f1": 0.5485, "f2": 0.5508, "mcc": 0.0546, "accuracy": 0.5282, "tp": 396, "fp": 331, "tn": 334, "fn": 321}], "experiment_num": 257, "status": "DISCARD"}
{"backbone": "itransformer", "description": "itransformer: Exp7 seed=0", "config": {"seq_len": 60, "lr": 5e-05, "batch_size": 32, "epochs": 100, "weight_decay": 0.0, "patience": 20, "grad_clip": 1.0, "warmup_epochs": 10, "huber_delta": 1.0, "head_dropout": 0.1, "seed": 0, "het_loss": false}, "composite": -0.4556, "test_pos_folds": 4, "val_pos_folds": 4, "val_loss": 5.1e-05, "elapsed_sec": 78.7, "timestamp": "2026-04-21T12:54:41", "sharpe": 0.6253, "psr": 0.8372, "equity": 1144.43, "sortino": 0.9606, "return_pct": 14.44, "max_dd": 12.98, "win_rate": 51.7, "profit_factor": 1.111, "ic": 0.0218, "hit": 51.36, "aleatoric_mean": 0.000225, "epistemic_mean": 0.00045, "confidence_mean": 0.9993, "precision": 0.5106, "recall": 0.5452, "f1": 0.5273, "f2": 0.5379, "mcc": 0.0276, "accuracy": 0.5136, "per_window": [{"fold": "fold_1", "regime": "Pre-crisis upturn + GFC onset", "sharpe": 0.9154, "sortino": 1.605, "return_pct": 1.84, "equity": 1018.44, "max_dd": 4.05, "win_rate": 55.77, "profit_factor": 1.151, "ic": 0.0824, "hit": 54.72, "n": 53, "precision": 0.5357, "recall": 0.5769, "f1": 0.5556, "f2": 0.5682, "mcc": 0.0956, "accuracy": 0.5472, "tp": 15, "fp": 13, "tn": 14, "fn": 11, "aleatoric_mean": 0.000899, "epistemic_mean": 0.001799, "confidence_mean": 0.9973, "aleatoric_std": 0.000531, "epistemic_std": 0.001063}, {"fold": "fold_2", "regime": "Post-crash recovery", "sharpe": 0.1636, "sortino": 0.2695, "return_pct": 0.29, "equity": 1002.88, "max_dd": 6.97, "win_rate": 49.12, "profit_factor": 1.027, "ic": 0.0673, "hit": 49.12, "n": 57, "precision": 0.5333, "recall": 0.5161, "f1": 0.5246, "f2": 0.5195, "mcc": -0.0223, "accuracy": 0.4912, "tp": 16, "fp": 14, "tn": 12, "fn": 15, "aleatoric_mean": 0.000144, "epistemic_mean": 0.000288, "confidence_mean": 0.9996, "aleatoric_std": 4.7e-05, "epistemic_std": 9.4e-05}, {"fold": "fold_3", "regime": "Eurozone debt plateau", "sharpe": -2.6626, "sortino": -4.3396, "return_pct": -4.62, "equity": 953.8, "max_dd": 6.69, "win_rate": 42.59, "profit_factor": 0.654, "ic": -0.1303, "hit": 41.07, "n": 56, "precision": 0.48, "recall": 0.375, "f1": 0.4211, "f2": 0.3922, "mcc": -0.1659, "accuracy": 0.4107, "tp": 12, "fp": 13, "tn": 11, "fn": 20, "aleatoric_mean": 0.000161, "epistemic_mean": 0.000322, "confidence_mean": 0.9995, "aleatoric_std": 5.4e-05, "epistemic_std": 0.000107}, {"fold": "fold_4", "regime": "Strong USD downturn", "sharpe": 1.9072, "sortino": 2.5889, "return_pct": 9.75, "equity": 1097.54, "max_dd": 3.73, "win_rate": 61.54, "profit_factor": 1.377, "ic": 0.1031, "hit": 61.02, "n": 118, "precision": 0.6167, "recall": 0.6167, "f1": 0.6167, "f2": 0.6167, "mcc": 0.2201, "accuracy": 0.6102, "tp": 37, "fp": 23, "tn": 35, "fn": 23, "aleatoric_mean": 0.000154, "epistemic_mean": 0.000308, "confidence_mean": 0.9995, "aleatoric_std": 5.1e-05, "epistemic_std": 0.000101}, {"fold": "fold_5", "regime": "Low-vol plateau", "sharpe": -1.681, "sortino": -2.5855, "return_pct": -3.75, "equity": 962.48, "max_dd": 6.21, "win_rate": 45.54, "profit_factor": 0.756, "ic": -0.1301, "hit": 45.54, "n": 112, "precision": 0.4194, "recall": 0.5098, "f1": 0.4602, "f2": 0.4887, "mcc": -0.0805, "accuracy": 0.4554, "tp": 26, "fp": 36, "tn": 25, "fn": 25, "aleatoric_mean": 0.000171, "epistemic_mean": 0.000343, "confidence_mean": 0.9995, "aleatoric_std": 6.8e-05, "epistemic_std": 0.000137}, {"fold": "fold_6", "regime": "EUR crisis downturn", "sharpe": -0.4605, "sortino": -0.7633, "return_pct": -2.27, "equity": 977.29, "max_dd": 5.96, "win_rate": 47.83, "profit_factor": 0.93, "ic": -0.1174, "hit": 47.83, "n": 115, "precision": 0.4364, "recall": 0.4528, "f1": 0.4444, "f2": 0.4494, "mcc": -0.0471, "accuracy": 0.4783, "tp": 24, "fp": 31, "tn": 31, "fn": 29, "aleatoric_mean": 0.000179, "epistemic_mean": 0.000357, "confidence_mean": 0.9995, "aleatoric_std": 6.4e-05, "epistemic_std": 0.000127}, {"fold": "fold_7", "regime": "Recent mixed/upturn", "sharpe": 3.2348, "sortino": 5.6246, "return_pct": 13.79, "equity": 1137.91, "max_dd": 2.93, "win_rate": 55.36, "profit_factor": 1.745, "ic": 0.1736, "hit": 55.36, "n": 112, "precision": 0.5493, "recall": 0.6842, "f1": 0.6094, "f2": 0.6522, "mcc": 0.1063, "accuracy": 0.5536, "tp": 39, "fp": 32, "tn": 23, "fn": 18, "aleatoric_mean": 0.000156, "epistemic_mean": 0.000312, "confidence_mean": 0.9995, "aleatoric_std": 5.9e-05, "epistemic_std": 0.000118}], "val_sharpe": 0.1444, "val_psr": 0.5736, "val_equity": 1013.44, "val_sortino": 0.2089, "val_return_pct": 1.34, "val_max_dd": 12.52, "val_win_rate": 52.88, "val_profit_factor": 1.024, "val_ic": 0.0278, "val_hit": 52.63, "val_aleatoric_mean": 0.000159, "val_epistemic_mean": 0.000317, "val_confidence_mean": 0.9995, "val_precision": 0.5183, "val_recall": 0.5485, "val_f1": 0.533, "val_f2": 0.5422, "val_mcc": 0.0533, "val_accuracy": 0.5263, "val_per_window": [{"fold": "fold_1", "regime": "Pre-crisis upturn + GFC onset", "sharpe": 1.7441, "sortino": 2.745, "return_pct": 2.73, "equity": 1027.32, "max_dd": 2.6, "win_rate": 58.62, "profit_factor": 1.333, "ic": 0.0861, "hit": 57.63, "n": 59, "precision": 0.5882, "recall": 0.6452, "f1": 0.6154, "f2": 0.6329, "mcc": 0.1467, "accuracy": 0.5763, "tp": 20, "fp": 14, "tn": 14, "fn": 11, "aleatoric_mean": 0.000137, "epistemic_mean": 0.000274, "confidence_mean": 0.9996, "aleatoric_std": 4.1e-05, "epistemic_std": 8.2e-05}, {"fold": "fold_2", "regime": "Post-crash recovery", "sharpe": 1.0683, "sortino": 1.8432, "return_pct": 2.03, "equity": 1020.28, "max_dd": 3.94, "win_rate": 53.45, "profit_factor": 1.189, "ic": 0.0652, "hit": 53.45, "n": 58, "precision": 0.5556, "recall": 0.6452, "f1": 0.597, "f2": 0.625, "mcc": 0.054, "accuracy": 0.5345, "tp": 20, "fp": 16, "tn": 11, "fn": 11, "aleatoric_mean": 0.00019, "epistemic_mean": 0.00038, "confidence_mean": 0.9994, "aleatoric_std": 6.6e-05, "epistemic_std": 0.000131}, {"fold": "fold_3", "regime": "Eurozone debt plateau", "sharpe": -3.2946, "sortino": -4.2226, "return_pct": -7.45, "equity": 925.52, "max_dd": 6.73, "win_rate": 44.26, "profit_factor": 0.576, "ic": -0.0996, "hit": 44.26, "n": 61, "precision": 0.3871, "recall": 0.4444, "f1": 0.4138, "f2": 0.4317, "mcc": -0.1136, "accuracy": 0.4426, "tp": 12, "fp": 19, "tn": 15, "fn": 15, "aleatoric_mean": 0.00017, "epistemic_mean": 0.000341, "confidence_mean": 0.9995, "aleatoric_std": 6.5e-05, "epistemic_std": 0.00013}, {"fold": "fold_4", "regime": "Strong USD downturn", "sharpe": -0.0902, "sortino": -0.1568, "return_pct": -0.3, "equity": 997.02, "max_dd": 4.36, "win_rate": 55.0, "profit_factor": 0.986, "ic": 0.0305, "hit": 55.0, "n": 60, "precision": 0.5294, "recall": 0.6207, "f1": 0.5714, "f2": 0.6, "mcc": 0.1054, "accuracy": 0.55, "tp": 18, "fp": 16, "tn": 15, "fn": 11, "aleatoric_mean": 0.000187, "epistemic_mean": 0.000374, "confidence_mean": 0.9994, "aleatoric_std": 8.1e-05, "epistemic_std": 0.000161}, {"fold": "fold_5", "regime": "Low-vol plateau", "sharpe": 1.5576, "sortino": 3.1613, "return_pct": 2.67, "equity": 1026.66, "max_dd": 1.96, "win_rate": 48.39, "profit_factor": 1.287, "ic": 0.0718, "hit": 48.39, "n": 62, "precision": 0.5, "recall": 0.4375, "f1": 0.4667, "f2": 0.4487, "mcc": -0.0293, "accuracy": 0.4839, "tp": 14, "fp": 14, "tn": 16, "fn": 18, "aleatoric_mean": 0.000133, "epistemic_mean": 0.000267, "confidence_mean": 0.9996, "aleatoric_std": 3.8e-05, "epistemic_std": 7.6e-05}, {"fold": "fold_6", "regime": "EUR crisis downturn", "sharpe": -0.5481, "sortino": -0.9036, "return_pct": -0.59, "equity": 994.07, "max_dd": 3.24, "win_rate": 47.37, "profit_factor": 0.914, "ic": -0.1249, "hit": 46.55, "n": 58, "precision": 0.3333, "recall": 0.2917, "f1": 0.3111, "f2": 0.2991, "mcc": -0.1231, "accuracy": 0.4655, "tp": 7, "fp": 14, "tn": 20, "fn": 17, "aleatoric_mean": 0.000159, "epistemic_mean": 0.000318, "confidence_mean": 0.9995, "aleatoric_std": 4.6e-05, "epistemic_std": 9.2e-05}, {"fold": "fold_7", "regime": "Recent mixed/upturn", "sharpe": 2.1029, "sortino": 2.8861, "return_pct": 2.67, "equity": 1026.68, "max_dd": 1.73, "win_rate": 63.33, "profit_factor": 1.41, "ic": 0.0922, "hit": 63.33, "n": 60, "precision": 0.6471, "recall": 0.6875, "f1": 0.6667, "f2": 0.679, "mcc": 0.2607, "accuracy": 0.6333, "tp": 22, "fp": 12, "tn": 16, "fn": 10, "aleatoric_mean": 0.000135, "epistemic_mean": 0.000271, "confidence_mean": 0.9996, "aleatoric_std": 4.9e-05, "epistemic_std": 9.9e-05}], "train_sharpe": 1.5522, "train_psr": 1.0, "train_equity": 2882.96, "train_sortino": 3.6888, "train_return_pct": 188.3, "train_max_dd": 9.26, "train_win_rate": 54.62, "train_profit_factor": 1.432, "train_ic": 0.1491, "train_hit": 54.34, "train_precision": 0.5541, "train_recall": 0.636, "train_f1": 0.5922, "train_f2": 0.6177, "train_mcc": 0.0856, "train_accuracy": 0.5456, "train_per_window": [{"fold": "all_train", "regime": "Training data", "sharpe": 1.5522, "sortino": 3.6888, "return_pct": 188.3, "equity": 2882.96, "max_dd": 9.26, "win_rate": 54.62, "profit_factor": 1.432, "ic": 0.1491, "hit": 54.34, "n": 1382, "precision": 0.5541, "recall": 0.636, "f1": 0.5922, "f2": 0.6177, "mcc": 0.0856, "accuracy": 0.5456, "tp": 456, "fp": 367, "tn": 298, "fn": 261}], "experiment_num": 258, "status": "DISCARD"}
