{"backbone": "xgboost", "description": "xgboost: Exp1 SOTA recipe (Chen Guestrin 2016 arXiv 1603.02754)", "config": {"seq_len": 10, "lr": 0.0003, "batch_size": 32, "epochs": 20, "weight_decay": 1e-05, "patience": 5, "grad_clip": 1.0, "warmup_epochs": 0, "huber_delta": 1.0, "head_dropout": 0.1, "seed": 42, "het_loss": false}, "composite": 7.1686, "test_pos_folds": 7, "val_pos_folds": 5, "val_loss": 0.0, "elapsed_sec": 117.8, "timestamp": "2026-04-20T10:57:53", "sharpe": 7.8464, "psr": 1.0, "equity": 18573.41, "sortino": 7.7462, "return_pct": 1757.34, "max_dd": 8.03, "win_rate": 78.53, "profit_factor": 4.71, "ic": 0.6812, "hit": 78.21, "precision": 0.8059, "recall": 0.7422, "f1": 0.7727, "f2": 0.7541, "mcc": 0.5697, "accuracy": 0.7842, "per_window": [{"fold": "fold_1", "regime": "Pre-crisis upturn + GFC onset", "sharpe": 0.3697, "sortino": 0.4092, "return_pct": 2.14, "equity": 1021.41, "max_dd": 7.54, "win_rate": 51.96, "profit_factor": 1.091, "ic": 0.2175, "hit": 51.46, "n": 103, "precision": 0.6, "recall": 0.2264, "f1": 0.3288, "f2": 0.2586, "mcc": 0.0839, "accuracy": 0.5243, "tp": 12, "fp": 8, "tn": 42, "fn": 41}, {"fold": "fold_2", "regime": "Post-crash recovery", "sharpe": 0.2339, "sortino": 0.4098, "return_pct": 0.86, "equity": 1008.55, "max_dd": 8.03, "win_rate": 50.47, "profit_factor": 1.037, "ic": -0.0464, "hit": 50.47, "n": 107, "precision": 0.4808, "recall": 0.4902, "f1": 0.4854, "f2": 0.4883, "mcc": 0.008, "accuracy": 0.5047, "tp": 25, "fp": 27, "tn": 29, "fn": 26}, {"fold": "fold_3", "regime": "Eurozone debt plateau", "sharpe": 14.5536, "sortino": 25.5938, "return_pct": 46.13, "equity": 1461.3, "max_dd": 1.32, "win_rate": 85.58, "profit_factor": 11.655, "ic": 0.7743, "hit": 83.96, "n": 106, "precision": 0.8448, "recall": 0.8596, "f1": 0.8522, "f2": 0.8566, "mcc": 0.6771, "accuracy": 0.8396, "tp": 49, "fp": 9, "tn": 40, "fn": 8}, {"fold": "fold_4", "regime": "Strong USD downturn", "sharpe": 16.0378, "sortino": 51.3729, "return_pct": 139.51, "equity": 2395.09, "max_dd": 0.55, "win_rate": 92.22, "profit_factor": 37.1, "ic": 0.8994, "hit": 91.67, "n": 168, "precision": 0.9506, "recall": 0.8953, "f1": 0.9222, "f2": 0.9059, "mcc": 0.8469, "accuracy": 0.9226, "tp": 77, "fp": 4, "tn": 78, "fn": 9}, {"fold": "fold_5", "regime": "Low-vol plateau", "sharpe": 15.206, "sortino": 74.425, "return_pct": 44.08, "equity": 1440.76, "max_dd": 0.23, "win_rate": 83.33, "profit_factor": 22.062, "ic": 0.8914, "hit": 83.33, "n": 162, "precision": 0.8451, "recall": 0.7895, "f1": 0.8163, "f2": 0.8, "mcc": 0.6654, "accuracy": 0.8333, "tp": 60, "fp": 11, "tn": 75, "fn": 16}, {"fold": "fold_6", "regime": "EUR crisis downturn", "sharpe": 14.8765, "sortino": 42.1137, "return_pct": 97.52, "equity": 1975.22, "max_dd": 0.87, "win_rate": 82.42, "profit_factor": 15.258, "ic": 0.8858, "hit": 82.42, "n": 165, "precision": 0.8243, "recall": 0.7922, "f1": 0.8079, "f2": 0.7984, "mcc": 0.6465, "accuracy": 0.8242, "tp": 61, "fp": 13, "tn": 75, "fn": 16}, {"fold": "fold_7", "regime": "Recent mixed/upturn", "sharpe": 12.8728, "sortino": 17.1128, "return_pct": 81.02, "equity": 1810.2, "max_dd": 1.64, "win_rate": 86.42, "profit_factor": 11.865, "ic": 0.8361, "hit": 86.42, "n": 162, "precision": 0.8391, "recall": 0.9012, "f1": 0.869, "f2": 0.8881, "mcc": 0.7304, "accuracy": 0.8642, "tp": 73, "fp": 14, "tn": 67, "fn": 8}], "val_sharpe": 7.3686, "val_psr": 1.0, "val_equity": 4846.2, "val_sortino": 9.0125, "val_return_pct": 384.62, "val_max_dd": 17.18, "val_win_rate": 74.57, "val_profit_factor": 3.593, "val_ic": 0.6669, "val_hit": 74.09, "val_precision": 0.7043, "val_recall": 0.8027, "val_f1": 0.7503, "val_f2": 0.7809, "val_mcc": 0.4987, "val_accuracy": 0.7461, "val_per_window": [{"fold": "fold_1", "regime": "Pre-crisis upturn + GFC onset", "sharpe": -0.5064, "sortino": -0.8016, "return_pct": -1.34, "equity": 986.57, "max_dd": 3.96, "win_rate": 45.37, "profit_factor": 0.919, "ic": 0.0608, "hit": 44.95, "n": 109, "precision": 0.4737, "recall": 0.8182, "f1": 0.6, "f2": 0.7143, "mcc": -0.161, "accuracy": 0.4495, "tp": 45, "fp": 50, "tn": 4, "fn": 10}, {"fold": "fold_2", "regime": "Post-crash recovery", "sharpe": -2.242, "sortino": -3.4174, "return_pct": -10.47, "equity": 895.34, "max_dd": 15.66, "win_rate": 49.07, "profit_factor": 0.702, "ic": -0.2189, "hit": 49.07, "n": 108, "precision": 0.5667, "recall": 0.5397, "f1": 0.5528, "f2": 0.5449, "mcc": -0.0378, "accuracy": 0.4907, "tp": 34, "fp": 26, "tn": 19, "fn": 29}, {"fold": "fold_3", "regime": "Eurozone debt plateau", "sharpe": 14.7318, "sortino": 40.9926, "return_pct": 54.49, "equity": 1544.92, "max_dd": 0.62, "win_rate": 84.4, "profit_factor": 15.115, "ic": 0.8546, "hit": 82.88, "n": 111, "precision": 0.7679, "recall": 0.9149, "f1": 0.835, "f2": 0.8811, "mcc": 0.7034, "accuracy": 0.8468, "tp": 43, "fp": 13, "tn": 51, "fn": 4}, {"fold": "fold_4", "regime": "Strong USD downturn", "sharpe": 15.5627, "sortino": 48.9794, "return_pct": 46.95, "equity": 1469.47, "max_dd": 0.64, "win_rate": 87.16, "profit_factor": 23.671, "ic": 0.9209, "hit": 86.36, "n": 110, "precision": 0.8837, "recall": 0.8085, "f1": 0.8444, "f2": 0.8225, "mcc": 0.7392, "accuracy": 0.8727, "tp": 38, "fp": 5, "tn": 58, "fn": 9}, {"fold": "fold_5", "regime": "Low-vol plateau", "sharpe": 15.7118, "sortino": 85.904, "return_pct": 45.0, "equity": 1449.96, "max_dd": 0.25, "win_rate": 85.71, "profit_factor": 26.644, "ic": 0.9235, "hit": 85.71, "n": 112, "precision": 0.8364, "recall": 0.8679, "f1": 0.8519, "f2": 0.8614, "mcc": 0.7145, "accuracy": 0.8571, "tp": 46, "fp": 9, "tn": 50, "fn": 7}, {"fold": "fold_6", "regime": "EUR crisis downturn", "sharpe": 15.8351, "sortino": 103.8813, "return_pct": 29.2, "equity": 1291.97, "max_dd": 0.15, "win_rate": 88.79, "profit_factor": 34.128, "ic": 0.9181, "hit": 87.96, "n": 108, "precision": 0.8723, "recall": 0.8723, "f1": 0.8723, "f2": 0.8723, "mcc": 0.774, "accuracy": 0.8889, "tp": 41, "fp": 6, "tn": 55, "fn": 6}, {"fold": "fold_7", "regime": "Recent mixed/upturn", "sharpe": 14.3361, "sortino": 40.8512, "return_pct": 29.01, "equity": 1290.06, "max_dd": 0.5, "win_rate": 80.91, "profit_factor": 12.783, "ic": 0.8529, "hit": 80.91, "n": 110, "precision": 0.7667, "recall": 0.8679, "f1": 0.8142, "f2": 0.8456, "mcc": 0.6245, "accuracy": 0.8091, "tp": 46, "fp": 14, "tn": 43, "fn": 7}], "train_sharpe": 11.1849, "train_psr": 1.0, "train_equity": 69410064.0, "train_sortino": 470.6752, "train_return_pct": 6940906.4, "train_max_dd": 0.07, "train_win_rate": 98.5, "train_profit_factor": 1593.439, "train_ic": 0.9985, "train_hit": 98.1, "train_precision": 0.9827, "train_recall": 0.9835, "train_f1": 0.9831, "train_f2": 0.9834, "train_mcc": 0.9653, "train_accuracy": 0.9826, "train_per_window": [{"fold": "all_train", "regime": "Training data", "sharpe": 11.1849, "sortino": 470.6752, "return_pct": 6940906.4, "equity": 69410064.0, "max_dd": 0.07, "win_rate": 98.5, "profit_factor": 1593.439, "ic": 0.9985, "hit": 98.1, "n": 2478, "precision": 0.9827, "recall": 0.9835, "f1": 0.9831, "f2": 0.9834, "mcc": 0.9653, "accuracy": 0.9826, "tp": 1253, "fp": 22, "tn": 1182, "fn": 21}], "experiment_num": 175, "status": "KEEP"}
{"backbone": "xgboost", "description": "xgboost: Exp2 SOTA recipe seed=0 variance", "config": {"seq_len": 10, "lr": 0.0003, "batch_size": 32, "epochs": 20, "weight_decay": 1e-05, "patience": 5, "grad_clip": 1.0, "warmup_epochs": 0, "huber_delta": 1.0, "head_dropout": 0.1, "seed": 0, "het_loss": false}, "composite": 7.1686, "test_pos_folds": 7, "val_pos_folds": 5, "val_loss": 0.0, "elapsed_sec": 119.7, "timestamp": "2026-04-20T11:01:16", "sharpe": 7.8464, "psr": 1.0, "equity": 18573.41, "sortino": 7.7462, "return_pct": 1757.34, "max_dd": 8.03, "win_rate": 78.53, "profit_factor": 4.71, "ic": 0.6812, "hit": 78.21, "precision": 0.8059, "recall": 0.7422, "f1": 0.7727, "f2": 0.7541, "mcc": 0.5697, "accuracy": 0.7842, "per_window": [{"fold": "fold_1", "regime": "Pre-crisis upturn + GFC onset", "sharpe": 0.3697, "sortino": 0.4092, "return_pct": 2.14, "equity": 1021.41, "max_dd": 7.54, "win_rate": 51.96, "profit_factor": 1.091, "ic": 0.2175, "hit": 51.46, "n": 103, "precision": 0.6, "recall": 0.2264, "f1": 0.3288, "f2": 0.2586, "mcc": 0.0839, "accuracy": 0.5243, "tp": 12, "fp": 8, "tn": 42, "fn": 41}, {"fold": "fold_2", "regime": "Post-crash recovery", "sharpe": 0.2339, "sortino": 0.4098, "return_pct": 0.86, "equity": 1008.55, "max_dd": 8.03, "win_rate": 50.47, "profit_factor": 1.037, "ic": -0.0464, "hit": 50.47, "n": 107, "precision": 0.4808, "recall": 0.4902, "f1": 0.4854, "f2": 0.4883, "mcc": 0.008, "accuracy": 0.5047, "tp": 25, "fp": 27, "tn": 29, "fn": 26}, {"fold": "fold_3", "regime": "Eurozone debt plateau", "sharpe": 14.5536, "sortino": 25.5938, "return_pct": 46.13, "equity": 1461.3, "max_dd": 1.32, "win_rate": 85.58, "profit_factor": 11.655, "ic": 0.7743, "hit": 83.96, "n": 106, "precision": 0.8448, "recall": 0.8596, "f1": 0.8522, "f2": 0.8566, "mcc": 0.6771, "accuracy": 0.8396, "tp": 49, "fp": 9, "tn": 40, "fn": 8}, {"fold": "fold_4", "regime": "Strong USD downturn", "sharpe": 16.0378, "sortino": 51.3729, "return_pct": 139.51, "equity": 2395.09, "max_dd": 0.55, "win_rate": 92.22, "profit_factor": 37.1, "ic": 0.8994, "hit": 91.67, "n": 168, "precision": 0.9506, "recall": 0.8953, "f1": 0.9222, "f2": 0.9059, "mcc": 0.8469, "accuracy": 0.9226, "tp": 77, "fp": 4, "tn": 78, "fn": 9}, {"fold": "fold_5", "regime": "Low-vol plateau", "sharpe": 15.206, "sortino": 74.425, "return_pct": 44.08, "equity": 1440.76, "max_dd": 0.23, "win_rate": 83.33, "profit_factor": 22.062, "ic": 0.8914, "hit": 83.33, "n": 162, "precision": 0.8451, "recall": 0.7895, "f1": 0.8163, "f2": 0.8, "mcc": 0.6654, "accuracy": 0.8333, "tp": 60, "fp": 11, "tn": 75, "fn": 16}, {"fold": "fold_6", "regime": "EUR crisis downturn", "sharpe": 14.8765, "sortino": 42.1137, "return_pct": 97.52, "equity": 1975.22, "max_dd": 0.87, "win_rate": 82.42, "profit_factor": 15.258, "ic": 0.8858, "hit": 82.42, "n": 165, "precision": 0.8243, "recall": 0.7922, "f1": 0.8079, "f2": 0.7984, "mcc": 0.6465, "accuracy": 0.8242, "tp": 61, "fp": 13, "tn": 75, "fn": 16}, {"fold": "fold_7", "regime": "Recent mixed/upturn", "sharpe": 12.8728, "sortino": 17.1128, "return_pct": 81.02, "equity": 1810.2, "max_dd": 1.64, "win_rate": 86.42, "profit_factor": 11.865, "ic": 0.8361, "hit": 86.42, "n": 162, "precision": 0.8391, "recall": 0.9012, "f1": 0.869, "f2": 0.8881, "mcc": 0.7304, "accuracy": 0.8642, "tp": 73, "fp": 14, "tn": 67, "fn": 8}], "val_sharpe": 7.3686, "val_psr": 1.0, "val_equity": 4846.2, "val_sortino": 9.0125, "val_return_pct": 384.62, "val_max_dd": 17.18, "val_win_rate": 74.57, "val_profit_factor": 3.593, "val_ic": 0.6669, "val_hit": 74.09, "val_precision": 0.7043, "val_recall": 0.8027, "val_f1": 0.7503, "val_f2": 0.7809, "val_mcc": 0.4987, "val_accuracy": 0.7461, "val_per_window": [{"fold": "fold_1", "regime": "Pre-crisis upturn + GFC onset", "sharpe": -0.5064, "sortino": -0.8016, "return_pct": -1.34, "equity": 986.57, "max_dd": 3.96, "win_rate": 45.37, "profit_factor": 0.919, "ic": 0.0608, "hit": 44.95, "n": 109, "precision": 0.4737, "recall": 0.8182, "f1": 0.6, "f2": 0.7143, "mcc": -0.161, "accuracy": 0.4495, "tp": 45, "fp": 50, "tn": 4, "fn": 10}, {"fold": "fold_2", "regime": "Post-crash recovery", "sharpe": -2.242, "sortino": -3.4174, "return_pct": -10.47, "equity": 895.34, "max_dd": 15.66, "win_rate": 49.07, "profit_factor": 0.702, "ic": -0.2189, "hit": 49.07, "n": 108, "precision": 0.5667, "recall": 0.5397, "f1": 0.5528, "f2": 0.5449, "mcc": -0.0378, "accuracy": 0.4907, "tp": 34, "fp": 26, "tn": 19, "fn": 29}, {"fold": "fold_3", "regime": "Eurozone debt plateau", "sharpe": 14.7318, "sortino": 40.9926, "return_pct": 54.49, "equity": 1544.92, "max_dd": 0.62, "win_rate": 84.4, "profit_factor": 15.115, "ic": 0.8546, "hit": 82.88, "n": 111, "precision": 0.7679, "recall": 0.9149, "f1": 0.835, "f2": 0.8811, "mcc": 0.7034, "accuracy": 0.8468, "tp": 43, "fp": 13, "tn": 51, "fn": 4}, {"fold": "fold_4", "regime": "Strong USD downturn", "sharpe": 15.5627, "sortino": 48.9794, "return_pct": 46.95, "equity": 1469.47, "max_dd": 0.64, "win_rate": 87.16, "profit_factor": 23.671, "ic": 0.9209, "hit": 86.36, "n": 110, "precision": 0.8837, "recall": 0.8085, "f1": 0.8444, "f2": 0.8225, "mcc": 0.7392, "accuracy": 0.8727, "tp": 38, "fp": 5, "tn": 58, "fn": 9}, {"fold": "fold_5", "regime": "Low-vol plateau", "sharpe": 15.7118, "sortino": 85.904, "return_pct": 45.0, "equity": 1449.96, "max_dd": 0.25, "win_rate": 85.71, "profit_factor": 26.644, "ic": 0.9235, "hit": 85.71, "n": 112, "precision": 0.8364, "recall": 0.8679, "f1": 0.8519, "f2": 0.8614, "mcc": 0.7145, "accuracy": 0.8571, "tp": 46, "fp": 9, "tn": 50, "fn": 7}, {"fold": "fold_6", "regime": "EUR crisis downturn", "sharpe": 15.8351, "sortino": 103.8813, "return_pct": 29.2, "equity": 1291.97, "max_dd": 0.15, "win_rate": 88.79, "profit_factor": 34.128, "ic": 0.9181, "hit": 87.96, "n": 108, "precision": 0.8723, "recall": 0.8723, "f1": 0.8723, "f2": 0.8723, "mcc": 0.774, "accuracy": 0.8889, "tp": 41, "fp": 6, "tn": 55, "fn": 6}, {"fold": "fold_7", "regime": "Recent mixed/upturn", "sharpe": 14.3361, "sortino": 40.8512, "return_pct": 29.01, "equity": 1290.06, "max_dd": 0.5, "win_rate": 80.91, "profit_factor": 12.783, "ic": 0.8529, "hit": 80.91, "n": 110, "precision": 0.7667, "recall": 0.8679, "f1": 0.8142, "f2": 0.8456, "mcc": 0.6245, "accuracy": 0.8091, "tp": 46, "fp": 14, "tn": 43, "fn": 7}], "train_sharpe": 11.1849, "train_psr": 1.0, "train_equity": 69410064.0, "train_sortino": 470.6752, "train_return_pct": 6940906.4, "train_max_dd": 0.07, "train_win_rate": 98.5, "train_profit_factor": 1593.439, "train_ic": 0.9985, "train_hit": 98.1, "train_precision": 0.9827, "train_recall": 0.9835, "train_f1": 0.9831, "train_f2": 0.9834, "train_mcc": 0.9653, "train_accuracy": 0.9826, "train_per_window": [{"fold": "all_train", "regime": "Training data", "sharpe": 11.1849, "sortino": 470.6752, "return_pct": 6940906.4, "equity": 69410064.0, "max_dd": 0.07, "win_rate": 98.5, "profit_factor": 1593.439, "ic": 0.9985, "hit": 98.1, "n": 2478, "precision": 0.9827, "recall": 0.9835, "f1": 0.9831, "f2": 0.9834, "mcc": 0.9653, "accuracy": 0.9826, "tp": 1253, "fp": 22, "tn": 1182, "fn": 21}], "experiment_num": 176, "status": "DISCARD"}
{"backbone": "xgboost", "description": "xgboost: Exp3 n_estimators=500 sanity check", "config": {"seq_len": 10, "lr": 0.0003, "batch_size": 32, "epochs": 20, "weight_decay": 1e-05, "patience": 5, "grad_clip": 1.0, "warmup_epochs": 0, "huber_delta": 1.0, "head_dropout": 0.1, "seed": 0, "n_estimators": 500, "het_loss": false}, "composite": 7.1324, "test_pos_folds": 6, "val_pos_folds": 5, "val_loss": 0.0, "elapsed_sec": 75.9, "timestamp": "2026-04-20T11:03:48", "sharpe": 7.7926, "psr": 1.0, "equity": 18274.3, "sortino": 7.7027, "return_pct": 1727.43, "max_dd": 8.26, "win_rate": 78.53, "profit_factor": 4.652, "ic": 0.6823, "hit": 78.21, "precision": 0.8059, "recall": 0.7422, "f1": 0.7727, "f2": 0.7541, "mcc": 0.5697, "accuracy": 0.7842, "per_window": [{"fold": "fold_1", "regime": "Pre-crisis upturn + GFC onset", "sharpe": 0.3697, "sortino": 0.4092, "return_pct": 2.14, "equity": 1021.41, "max_dd": 7.54, "win_rate": 51.96, "profit_factor": 1.091, "ic": 0.2281, "hit": 51.46, "n": 103, "precision": 0.6, "recall": 0.2264, "f1": 0.3288, "f2": 0.2586, "mcc": 0.0839, "accuracy": 0.5243, "tp": 12, "fp": 8, "tn": 42, "fn": 41}, {"fold": "fold_2", "regime": "Post-crash recovery", "sharpe": -0.0544, "sortino": -0.0956, "return_pct": -0.53, "equity": 994.69, "max_dd": 8.26, "win_rate": 49.53, "profit_factor": 0.992, "ic": -0.0473, "hit": 49.53, "n": 107, "precision": 0.4706, "recall": 0.4706, "f1": 0.4706, "f2": 0.4706, "mcc": -0.0116, "accuracy": 0.4953, "tp": 24, "fp": 27, "tn": 29, "fn": 27}, {"fold": "fold_3", "regime": "Eurozone debt plateau", "sharpe": 14.3891, "sortino": 26.0331, "return_pct": 45.79, "equity": 1457.86, "max_dd": 1.32, "win_rate": 84.62, "profit_factor": 11.251, "ic": 0.7747, "hit": 83.02, "n": 106, "precision": 0.8305, "recall": 0.8596, "f1": 0.8448, "f2": 0.8537, "mcc": 0.6579, "accuracy": 0.8302, "tp": 49, "fp": 10, "tn": 39, "fn": 8}, {"fold": "fold_4", "regime": "Strong USD downturn", "sharpe": 16.0378, "sortino": 51.3729, "return_pct": 139.51, "equity": 2395.09, "max_dd": 0.55, "win_rate": 92.22, "profit_factor": 37.1, "ic": 0.8991, "hit": 91.67, "n": 168, "precision": 0.9506, "recall": 0.8953, "f1": 0.9222, "f2": 0.9059, "mcc": 0.8469, "accuracy": 0.9226, "tp": 77, "fp": 4, "tn": 78, "fn": 9}, {"fold": "fold_5", "regime": "Low-vol plateau", "sharpe": 14.9543, "sortino": 62.1812, "return_pct": 43.62, "equity": 1436.16, "max_dd": 0.23, "win_rate": 83.33, "profit_factor": 20.119, "ic": 0.8951, "hit": 83.33, "n": 162, "precision": 0.8451, "recall": 0.7895, "f1": 0.8163, "f2": 0.8, "mcc": 0.6654, "accuracy": 0.8333, "tp": 60, "fp": 11, "tn": 75, "fn": 16}, {"fold": "fold_6", "regime": "EUR crisis downturn", "sharpe": 14.8765, "sortino": 42.1137, "return_pct": 97.52, "equity": 1975.22, "max_dd": 0.87, "win_rate": 82.42, "profit_factor": 15.258, "ic": 0.8861, "hit": 82.42, "n": 165, "precision": 0.8243, "recall": 0.7922, "f1": 0.8079, "f2": 0.7984, "mcc": 0.6465, "accuracy": 0.8242, "tp": 61, "fp": 13, "tn": 75, "fn": 16}, {"fold": "fold_7", "regime": "Recent mixed/upturn", "sharpe": 12.9865, "sortino": 16.6117, "return_pct": 81.59, "equity": 1815.93, "max_dd": 1.64, "win_rate": 87.65, "profit_factor": 12.246, "ic": 0.8355, "hit": 87.65, "n": 162, "precision": 0.8506, "recall": 0.9136, "f1": 0.881, "f2": 0.9002, "mcc": 0.7552, "accuracy": 0.8765, "tp": 74, "fp": 13, "tn": 68, "fn": 7}], "val_sharpe": 7.4324, "val_psr": 1.0, "val_equity": 4901.18, "val_sortino": 9.03, "val_return_pct": 390.12, "val_max_dd": 17.1, "val_win_rate": 74.97, "val_profit_factor": 3.636, "val_ic": 0.6681, "val_hit": 74.48, "val_precision": 0.7074, "val_recall": 0.8082, "val_f1": 0.7545, "val_f2": 0.7858, "val_mcc": 0.5067, "val_accuracy": 0.75, "val_per_window": [{"fold": "fold_1", "regime": "Pre-crisis upturn + GFC onset", "sharpe": -0.5064, "sortino": -0.8016, "return_pct": -1.34, "equity": 986.57, "max_dd": 3.96, "win_rate": 45.37, "profit_factor": 0.919, "ic": 0.0604, "hit": 44.95, "n": 109, "precision": 0.4737, "recall": 0.8182, "f1": 0.6, "f2": 0.7143, "mcc": -0.161, "accuracy": 0.4495, "tp": 45, "fp": 50, "tn": 4, "fn": 10}, {"fold": "fold_2", "regime": "Post-crash recovery", "sharpe": -2.2222, "sortino": -3.4122, "return_pct": -10.38, "equity": 896.17, "max_dd": 15.58, "win_rate": 50.0, "profit_factor": 0.704, "ic": -0.2191, "hit": 50.0, "n": 108, "precision": 0.5738, "recall": 0.5556, "f1": 0.5645, "f2": 0.5591, "mcc": -0.0221, "accuracy": 0.5, "tp": 35, "fp": 26, "tn": 19, "fn": 28}, {"fold": "fold_3", "regime": "Eurozone debt plateau", "sharpe": 14.7318, "sortino": 40.9926, "return_pct": 54.49, "equity": 1544.92, "max_dd": 0.62, "win_rate": 84.4, "profit_factor": 15.115, "ic": 0.8546, "hit": 82.88, "n": 111, "precision": 0.7679, "recall": 0.9149, "f1": 0.835, "f2": 0.8811, "mcc": 0.7034, "accuracy": 0.8468, "tp": 43, "fp": 13, "tn": 51, "fn": 4}, {"fold": "fold_4", "regime": "Strong USD downturn", "sharpe": 15.8713, "sortino": 48.393, "return_pct": 47.51, "equity": 1475.14, "max_dd": 0.39, "win_rate": 88.07, "profit_factor": 26.813, "ic": 0.9246, "hit": 87.27, "n": 110, "precision": 0.9048, "recall": 0.8085, "f1": 0.8539, "f2": 0.8261, "mcc": 0.7586, "accuracy": 0.8818, "tp": 38, "fp": 4, "tn": 59, "fn": 9}, {"fold": "fold_5", "regime": "Low-vol plateau", "sharpe": 15.5817, "sortino": 78.6603, "return_pct": 44.77, "equity": 1447.69, "max_dd": 0.25, "win_rate": 85.71, "profit_factor": 25.229, "ic": 0.9186, "hit": 85.71, "n": 112, "precision": 0.8364, "recall": 0.8679, "f1": 0.8519, "f2": 0.8614, "mcc": 0.7145, "accuracy": 0.8571, "tp": 46, "fp": 9, "tn": 50, "fn": 7}, {"fold": "fold_6", "regime": "EUR crisis downturn", "sharpe": 15.763, "sortino": 104.1791, "return_pct": 29.12, "equity": 1291.21, "max_dd": 0.15, "win_rate": 87.85, "profit_factor": 32.844, "ic": 0.9165, "hit": 87.04, "n": 108, "precision": 0.8696, "recall": 0.8511, "f1": 0.8602, "f2": 0.8547, "mcc": 0.7547, "accuracy": 0.8796, "tp": 40, "fp": 6, "tn": 55, "fn": 7}, {"fold": "fold_7", "regime": "Recent mixed/upturn", "sharpe": 15.2573, "sortino": 70.0271, "return_pct": 30.13, "equity": 1301.28, "max_dd": 0.26, "win_rate": 82.73, "profit_factor": 16.223, "ic": 0.8576, "hit": 82.73, "n": 110, "precision": 0.7742, "recall": 0.9057, "f1": 0.8348, "f2": 0.8759, "mcc": 0.665, "accuracy": 0.8273, "tp": 48, "fp": 14, "tn": 43, "fn": 5}], "train_sharpe": 11.1256, "train_psr": 1.0, "train_equity": 66697584.0, "train_sortino": 242.9649, "train_return_pct": 6669658.4, "train_max_dd": 0.2, "train_win_rate": 96.88, "train_profit_factor": 415.447, "train_ic": 0.9938, "train_hit": 96.49, "train_precision": 0.9635, "train_recall": 0.9733, "train_f1": 0.9684, "train_f2": 0.9713, "train_mcc": 0.9346, "train_accuracy": 0.9673, "train_per_window": [{"fold": "all_train", "regime": "Training data", "sharpe": 11.1256, "sortino": 242.9649, "return_pct": 6669658.4, "equity": 66697584.0, "max_dd": 0.2, "win_rate": 96.88, "profit_factor": 415.447, "ic": 0.9938, "hit": 96.49, "n": 2478, "precision": 0.9635, "recall": 0.9733, "f1": 0.9684, "f2": 0.9713, "mcc": 0.9346, "accuracy": 0.9673, "tp": 1240, "fp": 47, "tn": 1157, "fn": 34}], "experiment_num": 177, "status": "DISCARD"}
