{"backbone": "lstm", "description": "lstm: Exp14 GRU cell (Cho2014 Chung2014)", "config": {"seq_len": 10, "lr": 0.001, "batch_size": 32, "epochs": 100, "weight_decay": 0.0001, "patience": 15, "grad_clip": 1.0, "warmup_epochs": 0, "huber_delta": 1.0, "head_dropout": 0.25, "seed": 0, "rnn_cell": "gru", "het_loss": false}, "composite": 4.5904, "test_pos_folds": 7, "val_pos_folds": 5, "val_loss": 3.7e-05, "elapsed_sec": 33.7, "timestamp": "2026-04-19T19:09:29", "sharpe": 5.3459, "psr": 1.0, "equity": 8152.61, "sortino": 9.4704, "return_pct": 715.26, "max_dd": 7.12, "win_rate": 67.49, "profit_factor": 2.759, "ic": 0.4577, "hit": 67.21, "aleatoric_mean": 2.8e-05, "epistemic_mean": 5.5e-05, "confidence_mean": 0.9999, "precision": 0.6839, "recall": 0.6341, "f1": 0.658, "f2": 0.6435, "mcc": 0.3487, "accuracy": 0.6742, "per_window": [{"fold": "fold_1", "regime": "Pre-crisis upturn + GFC onset", "sharpe": 1.6279, "sortino": 4.7067, "return_pct": 12.51, "equity": 1125.1, "max_dd": 7.12, "win_rate": 50.0, "profit_factor": 1.473, "ic": 0.0586, "hit": 49.51, "n": 103, "precision": 0.5238, "recall": 0.4151, "f1": 0.4632, "f2": 0.4331, "mcc": 0.0154, "accuracy": 0.5049, "tp": 22, "fp": 20, "tn": 30, "fn": 31, "aleatoric_mean": 3.5e-05, "epistemic_mean": 7.1e-05, "confidence_mean": 0.9999, "aleatoric_std": 1.9e-05, "epistemic_std": 3.7e-05}, {"fold": "fold_2", "regime": "Post-crash recovery", "sharpe": 0.8309, "sortino": 1.3495, "return_pct": 3.78, "equity": 1037.82, "max_dd": 4.7, "win_rate": 53.27, "profit_factor": 1.139, "ic": 0.1636, "hit": 53.27, "n": 107, "precision": 0.5063, "recall": 0.7843, "f1": 0.6154, "f2": 0.7067, "mcc": 0.0999, "accuracy": 0.5327, "tp": 40, "fp": 39, "tn": 17, "fn": 11, "aleatoric_mean": 3.1e-05, "epistemic_mean": 6.2e-05, "confidence_mean": 0.9999, "aleatoric_std": 1.3e-05, "epistemic_std": 2.6e-05}, {"fold": "fold_3", "regime": "Eurozone debt plateau", "sharpe": 7.4807, "sortino": 14.1199, "return_pct": 26.96, "equity": 1269.63, "max_dd": 2.51, "win_rate": 67.31, "profit_factor": 3.265, "ic": 0.4927, "hit": 66.04, "n": 106, "precision": 0.7442, "recall": 0.5614, "f1": 0.64, "f2": 0.5904, "mcc": 0.3421, "accuracy": 0.6604, "tp": 32, "fp": 11, "tn": 38, "fn": 25, "aleatoric_mean": 3.3e-05, "epistemic_mean": 6.6e-05, "confidence_mean": 0.9999, "aleatoric_std": 1.3e-05, "epistemic_std": 2.7e-05}, {"fold": "fold_4", "regime": "Strong USD downturn", "sharpe": 8.4243, "sortino": 13.4565, "return_pct": 77.63, "equity": 1776.3, "max_dd": 2.3, "win_rate": 74.25, "profit_factor": 4.332, "ic": 0.7092, "hit": 73.81, "n": 168, "precision": 0.8116, "recall": 0.6512, "f1": 0.7226, "f2": 0.678, "mcc": 0.5005, "accuracy": 0.744, "tp": 56, "fp": 13, "tn": 69, "fn": 30, "aleatoric_mean": 3.4e-05, "epistemic_mean": 6.8e-05, "confidence_mean": 0.9999, "aleatoric_std": 1.6e-05, "epistemic_std": 3.2e-05}, {"fold": "fold_5", "regime": "Low-vol plateau", "sharpe": 9.1394, "sortino": 15.2159, "return_pct": 30.1, "equity": 1301.02, "max_dd": 1.15, "win_rate": 75.31, "profit_factor": 4.861, "ic": 0.684, "hit": 75.31, "n": 162, "precision": 0.6765, "recall": 0.9079, "f1": 0.7753, "f2": 0.8498, "mcc": 0.5417, "accuracy": 0.7531, "tp": 69, "fp": 33, "tn": 53, "fn": 7, "aleatoric_mean": 1.4e-05, "epistemic_mean": 2.8e-05, "confidence_mean": 1.0, "aleatoric_std": 7e-06, "epistemic_std": 1.4e-05}, {"fold": "fold_6", "regime": "EUR crisis downturn", "sharpe": 10.5517, "sortino": 19.4727, "return_pct": 73.4, "equity": 1734.05, "max_dd": 1.25, "win_rate": 75.15, "profit_factor": 5.895, "ic": 0.6449, "hit": 75.15, "n": 165, "precision": 0.7812, "recall": 0.6494, "f1": 0.7092, "f2": 0.672, "mcc": 0.502, "accuracy": 0.7515, "tp": 50, "fp": 14, "tn": 74, "fn": 27, "aleatoric_mean": 3.1e-05, "epistemic_mean": 6.1e-05, "confidence_mean": 0.9999, "aleatoric_std": 1.8e-05, "epistemic_std": 3.6e-05}, {"fold": "fold_7", "regime": "Recent mixed/upturn", "sharpe": 5.6869, "sortino": 10.359, "return_pct": 37.23, "equity": 1372.29, "max_dd": 2.66, "win_rate": 65.43, "profit_factor": 2.651, "ic": 0.5761, "hit": 65.43, "n": 162, "precision": 0.766, "recall": 0.4444, "f1": 0.5625, "f2": 0.4852, "mcc": 0.34, "accuracy": 0.6543, "tp": 36, "fp": 11, "tn": 70, "fn": 45, "aleatoric_mean": 2e-05, "epistemic_mean": 4.1e-05, "confidence_mean": 0.9999, "aleatoric_std": 8e-06, "epistemic_std": 1.6e-05}], "val_sharpe": 4.7904, "val_psr": 1.0, "val_equity": 2944.7, "val_sortino": 7.3103, "val_return_pct": 194.47, "val_max_dd": 14.19, "val_win_rate": 62.91, "val_profit_factor": 2.265, "val_ic": 0.3939, "val_hit": 62.5, "val_aleatoric_mean": 2e-05, "val_epistemic_mean": 4e-05, "val_confidence_mean": 0.9999, "val_precision": 0.6116, "val_recall": 0.6082, "val_f1": 0.6099, "val_f2": 0.6089, "val_mcc": 0.2584, "val_accuracy": 0.6302, "val_per_window": [{"fold": "fold_1", "regime": "Pre-crisis upturn + GFC onset", "sharpe": -0.3728, "sortino": -0.7066, "return_pct": -1.01, "equity": 989.9, "max_dd": 4.8, "win_rate": 40.74, "profit_factor": 0.94, "ic": -0.0228, "hit": 40.37, "n": 109, "precision": 0.4306, "recall": 0.5636, "f1": 0.4882, "f2": 0.5308, "mcc": -0.2066, "accuracy": 0.4037, "tp": 31, "fp": 41, "tn": 13, "fn": 24, "aleatoric_mean": 2.1e-05, "epistemic_mean": 4.1e-05, "confidence_mean": 0.9999, "aleatoric_std": 2.2e-05, "epistemic_std": 4.4e-05}, {"fold": "fold_2", "regime": "Post-crash recovery", "sharpe": -1.8441, "sortino": -2.8825, "return_pct": -8.76, "equity": 912.37, "max_dd": 14.19, "win_rate": 43.52, "profit_factor": 0.747, "ic": -0.0722, "hit": 43.52, "n": 108, "precision": 0.5278, "recall": 0.3016, "f1": 0.3838, "f2": 0.3299, "mcc": -0.0797, "accuracy": 0.4352, "tp": 19, "fp": 17, "tn": 28, "fn": 44, "aleatoric_mean": 3.2e-05, "epistemic_mean": 6.3e-05, "confidence_mean": 0.9999, "aleatoric_std": 1.4e-05, "epistemic_std": 2.9e-05}, {"fold": "fold_3", "regime": "Eurozone debt plateau", "sharpe": 7.4236, "sortino": 14.1042, "return_pct": 31.02, "equity": 1310.2, "max_dd": 2.03, "win_rate": 67.89, "profit_factor": 3.4, "ic": 0.5924, "hit": 66.67, "n": 111, "precision": 0.62, "recall": 0.6596, "f1": 0.6392, "f2": 0.6513, "mcc": 0.3602, "accuracy": 0.6847, "tp": 31, "fp": 19, "tn": 45, "fn": 16, "aleatoric_mean": 3.1e-05, "epistemic_mean": 6.2e-05, "confidence_mean": 0.9999, "aleatoric_std": 1.3e-05, "epistemic_std": 2.5e-05}, {"fold": "fold_4", "regime": "Strong USD downturn", "sharpe": 8.7818, "sortino": 20.7592, "return_pct": 30.44, "equity": 1304.37, "max_dd": 1.68, "win_rate": 69.72, "profit_factor": 4.486, "ic": 0.6114, "hit": 69.09, "n": 110, "precision": 0.6296, "recall": 0.7234, "f1": 0.6733, "f2": 0.7025, "mcc": 0.4017, "accuracy": 0.7, "tp": 34, "fp": 20, "tn": 43, "fn": 13, "aleatoric_mean": 1.7e-05, "epistemic_mean": 3.3e-05, "confidence_mean": 0.9999, "aleatoric_std": 8e-06, "epistemic_std": 1.7e-05}, {"fold": "fold_5", "regime": "Low-vol plateau", "sharpe": 10.9758, "sortino": 39.394, "return_pct": 35.0, "equity": 1350.03, "max_dd": 0.55, "win_rate": 74.11, "profit_factor": 6.999, "ic": 0.7266, "hit": 74.11, "n": 112, "precision": 0.6935, "recall": 0.8113, "f1": 0.7478, "f2": 0.7847, "mcc": 0.4914, "accuracy": 0.7411, "tp": 43, "fp": 19, "tn": 40, "fn": 10, "aleatoric_mean": 1.2e-05, "epistemic_mean": 2.4e-05, "confidence_mean": 1.0, "aleatoric_std": 5e-06, "epistemic_std": 9e-06}, {"fold": "fold_6", "regime": "EUR crisis downturn", "sharpe": 8.597, "sortino": 16.083, "return_pct": 18.83, "equity": 1188.31, "max_dd": 1.0, "win_rate": 72.9, "profit_factor": 4.493, "ic": 0.7331, "hit": 72.22, "n": 108, "precision": 0.725, "recall": 0.617, "f1": 0.6667, "f2": 0.636, "mcc": 0.4483, "accuracy": 0.7315, "tp": 29, "fp": 11, "tn": 50, "fn": 18, "aleatoric_mean": 1.1e-05, "epistemic_mean": 2.1e-05, "confidence_mean": 1.0, "aleatoric_std": 4e-06, "epistemic_std": 8e-06}, {"fold": "fold_7", "regime": "Recent mixed/upturn", "sharpe": 8.1469, "sortino": 17.3071, "return_pct": 18.92, "equity": 1189.22, "max_dd": 0.97, "win_rate": 70.91, "profit_factor": 3.789, "ic": 0.5738, "hit": 70.91, "n": 110, "precision": 0.7143, "recall": 0.6604, "f1": 0.6863, "f2": 0.6705, "mcc": 0.417, "accuracy": 0.7091, "tp": 35, "fp": 14, "tn": 43, "fn": 18, "aleatoric_mean": 1.7e-05, "epistemic_mean": 3.3e-05, "confidence_mean": 0.9999, "aleatoric_std": 8e-06, "epistemic_std": 1.7e-05}], "train_sharpe": 5.9987, "train_psr": 1.0, "train_equity": 909756.12, "train_sortino": 15.3971, "train_return_pct": 90875.61, "train_max_dd": 5.26, "train_win_rate": 69.81, "train_profit_factor": 4.167, "train_ic": 0.5878, "train_hit": 69.53, "train_precision": 0.7091, "train_recall": 0.7002, "train_f1": 0.7046, "train_f2": 0.7019, "train_mcc": 0.3961, "train_accuracy": 0.6981, "train_per_window": [{"fold": "all_train", "regime": "Training data", "sharpe": 5.9987, "sortino": 15.3971, "return_pct": 90875.61, "equity": 909756.12, "max_dd": 5.26, "win_rate": 69.81, "profit_factor": 4.167, "ic": 0.5878, "hit": 69.53, "n": 2478, "precision": 0.7091, "recall": 0.7002, "f1": 0.7046, "f2": 0.7019, "mcc": 0.3961, "accuracy": 0.6981, "tp": 892, "fp": 366, "tn": 838, "fn": 382}], "experiment_num": 119, "status": "DISCARD"}
{"backbone": "lstm", "description": "lstm: Exp15 input LayerNorm stabilize gate activations (Ba2016)", "config": {"seq_len": 10, "lr": 0.001, "batch_size": 32, "epochs": 100, "weight_decay": 0.0001, "patience": 15, "grad_clip": 1.0, "warmup_epochs": 0, "huber_delta": 1.0, "head_dropout": 0.25, "seed": 0, "input_layernorm": true, "het_loss": false}, "composite": 4.513, "test_pos_folds": 5, "val_pos_folds": 6, "val_loss": 2.7e-05, "elapsed_sec": 28.2, "timestamp": "2026-04-19T19:15:53", "sharpe": 4.813, "psr": 1.0, "equity": 6721.65, "sortino": 5.9693, "return_pct": 572.17, "max_dd": 18.84, "win_rate": 65.53, "profit_factor": 2.481, "ic": 0.4483, "hit": 65.26, "aleatoric_mean": 2.3e-05, "epistemic_mean": 4.6e-05, "confidence_mean": 0.9999, "precision": 0.6306, "recall": 0.7277, "f1": 0.6757, "f2": 0.7059, "mcc": 0.3141, "accuracy": 0.6547, "per_window": [{"fold": "fold_1", "regime": "Pre-crisis upturn + GFC onset", "sharpe": -1.612, "sortino": -1.9195, "return_pct": -12.28, "equity": 877.19, "max_dd": 14.99, "win_rate": 43.14, "profit_factor": 0.682, "ic": -0.0505, "hit": 42.72, "n": 103, "precision": 0.4062, "recall": 0.2453, "f1": 0.3059, "f2": 0.2664, "mcc": -0.1455, "accuracy": 0.4272, "tp": 13, "fp": 19, "tn": 31, "fn": 40, "aleatoric_mean": 2.9e-05, "epistemic_mean": 5.9e-05, "confidence_mean": 0.9999, "aleatoric_std": 1.7e-05, "epistemic_std": 3.4e-05}, {"fold": "fold_2", "regime": "Post-crash recovery", "sharpe": -0.539, "sortino": -0.905, "return_pct": -2.82, "equity": 971.83, "max_dd": 5.51, "win_rate": 52.34, "profit_factor": 0.919, "ic": 0.0673, "hit": 52.34, "n": 107, "precision": 0.5, "recall": 0.8824, "f1": 0.6383, "f2": 0.7653, "mcc": 0.1076, "accuracy": 0.5234, "tp": 45, "fp": 45, "tn": 11, "fn": 6, "aleatoric_mean": 2.6e-05, "epistemic_mean": 5.1e-05, "confidence_mean": 0.9999, "aleatoric_std": 9e-06, "epistemic_std": 1.8e-05}, {"fold": "fold_3", "regime": "Eurozone debt plateau", "sharpe": 8.9745, "sortino": 12.7254, "return_pct": 31.76, "equity": 1317.64, "max_dd": 2.54, "win_rate": 75.96, "profit_factor": 4.17, "ic": 0.65, "hit": 74.53, "n": 106, "precision": 0.7424, "recall": 0.8596, "f1": 0.7967, "f2": 0.8333, "mcc": 0.5274, "accuracy": 0.7642, "tp": 49, "fp": 17, "tn": 32, "fn": 8, "aleatoric_mean": 2.7e-05, "epistemic_mean": 5.3e-05, "confidence_mean": 0.9999, "aleatoric_std": 1.1e-05, "epistemic_std": 2.1e-05}, {"fold": "fold_4", "regime": "Strong USD downturn", "sharpe": 9.825, "sortino": 24.8142, "return_pct": 90.71, "equity": 1907.1, "max_dd": 1.81, "win_rate": 73.65, "profit_factor": 5.703, "ic": 0.6763, "hit": 73.21, "n": 168, "precision": 0.7204, "recall": 0.7791, "f1": 0.7486, "f2": 0.7666, "mcc": 0.4645, "accuracy": 0.7321, "tp": 67, "fp": 26, "tn": 56, "fn": 19, "aleatoric_mean": 2.2e-05, "epistemic_mean": 4.5e-05, "confidence_mean": 0.9999, "aleatoric_std": 9e-06, "epistemic_std": 1.7e-05}, {"fold": "fold_5", "regime": "Low-vol plateau", "sharpe": 7.2059, "sortino": 17.3355, "return_pct": 24.34, "equity": 1243.4, "max_dd": 0.79, "win_rate": 63.58, "profit_factor": 3.403, "ic": 0.5855, "hit": 63.58, "n": 162, "precision": 0.5859, "recall": 0.7632, "f1": 0.6629, "f2": 0.7196, "mcc": 0.2932, "accuracy": 0.6358, "tp": 58, "fp": 41, "tn": 45, "fn": 18, "aleatoric_mean": 1.9e-05, "epistemic_mean": 3.7e-05, "confidence_mean": 0.9999, "aleatoric_std": 7e-06, "epistemic_std": 1.4e-05}, {"fold": "fold_6", "regime": "EUR crisis downturn", "sharpe": 8.9123, "sortino": 18.8685, "return_pct": 62.65, "equity": 1626.54, "max_dd": 2.24, "win_rate": 69.7, "profit_factor": 4.374, "ic": 0.6573, "hit": 69.7, "n": 165, "precision": 0.6517, "recall": 0.7532, "f1": 0.6988, "f2": 0.7305, "mcc": 0.4013, "accuracy": 0.697, "tp": 58, "fp": 31, "tn": 57, "fn": 19, "aleatoric_mean": 2.4e-05, "epistemic_mean": 4.7e-05, "confidence_mean": 0.9999, "aleatoric_std": 1e-05, "epistemic_std": 2e-05}, {"fold": "fold_7", "regime": "Recent mixed/upturn", "sharpe": 8.3819, "sortino": 13.3318, "return_pct": 55.15, "equity": 1551.49, "max_dd": 2.01, "win_rate": 70.99, "profit_factor": 4.349, "ic": 0.6204, "hit": 70.99, "n": 162, "precision": 0.6977, "recall": 0.7407, "f1": 0.7186, "f2": 0.7317, "mcc": 0.4206, "accuracy": 0.7099, "tp": 60, "fp": 26, "tn": 55, "fn": 21, "aleatoric_mean": 1.8e-05, "epistemic_mean": 3.7e-05, "confidence_mean": 0.9999, "aleatoric_std": 6e-06, "epistemic_std": 1.3e-05}], "val_sharpe": 5.0624, "val_psr": 1.0, "val_equity": 3115.22, "val_sortino": 8.3102, "val_return_pct": 211.52, "val_max_dd": 6.32, "val_win_rate": 62.52, "val_profit_factor": 2.375, "val_ic": 0.4258, "val_hit": 62.11, "val_aleatoric_mean": 1.9e-05, "val_epistemic_mean": 3.9e-05, "val_confidence_mean": 0.9999, "val_precision": 0.5769, "val_recall": 0.7808, "val_f1": 0.6636, "val_f2": 0.7293, "val_mcc": 0.2733, "val_accuracy": 0.6237, "val_per_window": [{"fold": "fold_1", "regime": "Pre-crisis upturn + GFC onset", "sharpe": 1.766, "sortino": 3.2343, "return_pct": 4.45, "equity": 1044.55, "max_dd": 2.91, "win_rate": 47.22, "profit_factor": 1.341, "ic": 0.1607, "hit": 46.79, "n": 109, "precision": 0.4819, "recall": 0.7273, "f1": 0.5797, "f2": 0.6601, "mcc": -0.081, "accuracy": 0.4679, "tp": 40, "fp": 43, "tn": 11, "fn": 15, "aleatoric_mean": 1.9e-05, "epistemic_mean": 3.8e-05, "confidence_mean": 0.9999, "aleatoric_std": 1e-05, "epistemic_std": 1.9e-05}, {"fold": "fold_2", "regime": "Post-crash recovery", "sharpe": -0.2528, "sortino": -0.4202, "return_pct": -1.49, "equity": 985.09, "max_dd": 6.32, "win_rate": 43.52, "profit_factor": 0.961, "ic": 0.0301, "hit": 43.52, "n": 108, "precision": 0.52, "recall": 0.4127, "f1": 0.4602, "f2": 0.4305, "mcc": -0.1193, "accuracy": 0.4352, "tp": 26, "fp": 24, "tn": 21, "fn": 37, "aleatoric_mean": 2.6e-05, "epistemic_mean": 5.1e-05, "confidence_mean": 0.9999, "aleatoric_std": 1.6e-05, "epistemic_std": 3.3e-05}, {"fold": "fold_3", "regime": "Eurozone debt plateau", "sharpe": 6.3375, "sortino": 15.0105, "return_pct": 26.65, "equity": 1266.49, "max_dd": 1.76, "win_rate": 58.72, "profit_factor": 2.827, "ic": 0.672, "hit": 57.66, "n": 111, "precision": 0.5, "recall": 0.9574, "f1": 0.6569, "f2": 0.8094, "mcc": 0.3208, "accuracy": 0.5766, "tp": 45, "fp": 45, "tn": 19, "fn": 2, "aleatoric_mean": 1.7e-05, "epistemic_mean": 3.5e-05, "confidence_mean": 0.9999, "aleatoric_std": 7e-06, "epistemic_std": 1.3e-05}, {"fold": "fold_4", "regime": "Strong USD downturn", "sharpe": 7.2686, "sortino": 17.7987, "return_pct": 25.65, "equity": 1256.51, "max_dd": 1.79, "win_rate": 68.81, "profit_factor": 3.41, "ic": 0.6326, "hit": 68.18, "n": 110, "precision": 0.5844, "recall": 0.9574, "f1": 0.7258, "f2": 0.8491, "mcc": 0.4852, "accuracy": 0.6909, "tp": 45, "fp": 32, "tn": 31, "fn": 2, "aleatoric_mean": 1.9e-05, "epistemic_mean": 3.9e-05, "confidence_mean": 0.9999, "aleatoric_std": 7e-06, "epistemic_std": 1.4e-05}, {"fold": "fold_5", "regime": "Low-vol plateau", "sharpe": 8.4543, "sortino": 21.5859, "return_pct": 28.13, "equity": 1281.27, "max_dd": 1.24, "win_rate": 69.64, "profit_factor": 4.261, "ic": 0.6624, "hit": 69.64, "n": 112, "precision": 0.6338, "recall": 0.8491, "f1": 0.7258, "f2": 0.7951, "mcc": 0.4233, "accuracy": 0.6964, "tp": 45, "fp": 26, "tn": 33, "fn": 8, "aleatoric_mean": 1.9e-05, "epistemic_mean": 3.8e-05, "confidence_mean": 0.9999, "aleatoric_std": 7e-06, "epistemic_std": 1.4e-05}, {"fold": "fold_6", "regime": "EUR crisis downturn", "sharpe": 10.8212, "sortino": 30.2366, "return_pct": 22.65, "equity": 1226.52, "max_dd": 0.98, "win_rate": 71.96, "profit_factor": 7.069, "ic": 0.7591, "hit": 71.3, "n": 108, "precision": 0.6393, "recall": 0.8298, "f1": 0.7222, "f2": 0.7831, "mcc": 0.4691, "accuracy": 0.7222, "tp": 39, "fp": 22, "tn": 39, "fn": 8, "aleatoric_mean": 1.6e-05, "epistemic_mean": 3.3e-05, "confidence_mean": 1.0, "aleatoric_std": 5e-06, "epistemic_std": 1e-05}, {"fold": "fold_7", "regime": "Recent mixed/upturn", "sharpe": 9.2479, "sortino": 19.9643, "return_pct": 21.06, "equity": 1210.61, "max_dd": 0.72, "win_rate": 77.27, "profit_factor": 4.588, "ic": 0.568, "hit": 77.27, "n": 110, "precision": 0.7258, "recall": 0.8491, "f1": 0.7826, "f2": 0.8212, "mcc": 0.555, "accuracy": 0.7727, "tp": 45, "fp": 17, "tn": 40, "fn": 8, "aleatoric_mean": 1.9e-05, "epistemic_mean": 3.9e-05, "confidence_mean": 0.9999, "aleatoric_std": 7e-06, "epistemic_std": 1.3e-05}], "train_sharpe": 5.9922, "train_psr": 1.0, "train_equity": 903833.69, "train_sortino": 13.523, "train_return_pct": 90283.37, "train_max_dd": 4.24, "train_win_rate": 71.64, "train_profit_factor": 4.16, "train_ic": 0.5969, "train_hit": 71.35, "train_precision": 0.6978, "train_recall": 0.7865, "train_f1": 0.7395, "train_f2": 0.767, "train_mcc": 0.4314, "train_accuracy": 0.7151, "train_per_window": [{"fold": "all_train", "regime": "Training data", "sharpe": 5.9922, "sortino": 13.523, "return_pct": 90283.37, "equity": 903833.69, "max_dd": 4.24, "win_rate": 71.64, "profit_factor": 4.16, "ic": 0.5969, "hit": 71.35, "n": 2478, "precision": 0.6978, "recall": 0.7865, "f1": 0.7395, "f2": 0.767, "mcc": 0.4314, "accuracy": 0.7151, "tp": 1002, "fp": 434, "tn": 770, "fn": 272}], "experiment_num": 120, "status": "DISCARD"}
