{"backbone": "catboost", "description": "catboost: Exp8 l2_leaf_reg=10", "config": {"seq_len": 10, "lr": 0.0003, "batch_size": 32, "epochs": 20, "weight_decay": 1e-05, "patience": 5, "grad_clip": 1.0, "warmup_epochs": 0, "huber_delta": 1.0, "head_dropout": 0.1, "seed": 42, "gbm_lr": 0.01, "depth": 4, "l2_leaf_reg": 10.0, "het_loss": false}, "composite": 7.6264, "test_pos_folds": 6, "val_pos_folds": 6, "val_loss": 0.0, "elapsed_sec": 251.9, "timestamp": "2026-04-21T09:53:17", "sharpe": 7.8264, "psr": 1.0, "equity": 18461.64, "sortino": 7.6723, "return_pct": 1746.16, "max_dd": 7.54, "win_rate": 78.95, "profit_factor": 4.689, "ic": 0.6901, "hit": 78.62, "precision": 0.8018, "recall": 0.7568, "f1": 0.7786, "f2": 0.7653, "mcc": 0.5751, "accuracy": 0.7873, "per_window": [{"fold": "fold_1", "regime": "Pre-crisis upturn + GFC onset", "sharpe": -0.355, "sortino": -0.4162, "return_pct": -3.41, "equity": 965.89, "max_dd": 7.54, "win_rate": 45.1, "profit_factor": 0.92, "ic": 0.0348, "hit": 44.66, "n": 103, "precision": 0.4524, "recall": 0.3585, "f1": 0.4, "f2": 0.374, "mcc": -0.1032, "accuracy": 0.4466, "tp": 19, "fp": 23, "tn": 27, "fn": 34}, {"fold": "fold_2", "regime": "Post-crash recovery", "sharpe": 1.134, "sortino": 1.9929, "return_pct": 5.29, "equity": 1052.94, "max_dd": 4.72, "win_rate": 53.27, "profit_factor": 1.194, "ic": 0.012, "hit": 53.27, "n": 107, "precision": 0.5116, "recall": 0.4314, "f1": 0.4681, "f2": 0.4453, "mcc": 0.0574, "accuracy": 0.5327, "tp": 22, "fp": 21, "tn": 35, "fn": 29}, {"fold": "fold_3", "regime": "Eurozone debt plateau", "sharpe": 15.3448, "sortino": 24.2019, "return_pct": 47.72, "equity": 1477.23, "max_dd": 1.32, "win_rate": 87.5, "profit_factor": 13.916, "ic": 0.7931, "hit": 85.85, "n": 106, "precision": 0.9038, "recall": 0.8246, "f1": 0.8624, "f2": 0.8393, "mcc": 0.7206, "accuracy": 0.8585, "tp": 47, "fp": 5, "tn": 44, "fn": 10}, {"fold": "fold_4", "regime": "Strong USD downturn", "sharpe": 15.8069, "sortino": 45.6085, "return_pct": 138.0, "equity": 2379.99, "max_dd": 0.56, "win_rate": 91.62, "profit_factor": 32.717, "ic": 0.8988, "hit": 91.07, "n": 168, "precision": 0.9286, "recall": 0.907, "f1": 0.9176, "f2": 0.9112, "mcc": 0.8336, "accuracy": 0.9167, "tp": 78, "fp": 6, "tn": 76, "fn": 8}, {"fold": "fold_5", "regime": "Low-vol plateau", "sharpe": 15.9282, "sortino": 82.5225, "return_pct": 45.34, "equity": 1453.44, "max_dd": 0.16, "win_rate": 86.42, "profit_factor": 29.837, "ic": 0.9226, "hit": 86.42, "n": 162, "precision": 0.8375, "recall": 0.8816, "f1": 0.859, "f2": 0.8724, "mcc": 0.7291, "accuracy": 0.8642, "tp": 67, "fp": 13, "tn": 73, "fn": 9}, {"fold": "fold_6", "regime": "EUR crisis downturn", "sharpe": 14.7049, "sortino": 42.2789, "return_pct": 96.69, "equity": 1966.87, "max_dd": 0.76, "win_rate": 82.42, "profit_factor": 14.571, "ic": 0.886, "hit": 82.42, "n": 165, "precision": 0.8333, "recall": 0.7792, "f1": 0.8054, "f2": 0.7895, "mcc": 0.6467, "accuracy": 0.8242, "tp": 60, "fp": 12, "tn": 76, "fn": 17}, {"fold": "fold_7", "regime": "Recent mixed/upturn", "sharpe": 12.7922, "sortino": 15.0111, "return_pct": 80.61, "equity": 1806.1, "max_dd": 1.64, "win_rate": 87.65, "profit_factor": 11.605, "ic": 0.8411, "hit": 87.65, "n": 162, "precision": 0.8765, "recall": 0.8765, "f1": 0.8765, "f2": 0.8765, "mcc": 0.7531, "accuracy": 0.8765, "tp": 71, "fp": 10, "tn": 71, "fn": 10}], "val_sharpe": 7.9727, "val_psr": 1.0, "val_equity": 5381.29, "val_sortino": 9.904, "val_return_pct": 438.13, "val_max_dd": 12.95, "val_win_rate": 76.15, "val_profit_factor": 4.023, "val_ic": 0.6796, "val_hit": 75.65, "val_precision": 0.723, "val_recall": 0.8082, "val_f1": 0.7633, "val_f2": 0.7896, "val_mcc": 0.5282, "val_accuracy": 0.7617, "val_per_window": [{"fold": "fold_1", "regime": "Pre-crisis upturn + GFC onset", "sharpe": 1.388, "sortino": 2.4094, "return_pct": 3.48, "equity": 1034.77, "max_dd": 4.11, "win_rate": 50.0, "profit_factor": 1.259, "ic": 0.0053, "hit": 49.54, "n": 109, "precision": 0.5, "recall": 0.8364, "f1": 0.6259, "f2": 0.7372, "mcc": -0.0213, "accuracy": 0.4954, "tp": 46, "fp": 46, "tn": 8, "fn": 9}, {"fold": "fold_2", "regime": "Post-crash recovery", "sharpe": -1.5634, "sortino": -2.4598, "return_pct": -7.53, "equity": 924.68, "max_dd": 12.95, "win_rate": 44.44, "profit_factor": 0.781, "ic": -0.0538, "hit": 44.44, "n": 108, "precision": 0.5246, "recall": 0.5079, "f1": 0.5161, "f2": 0.5112, "mcc": -0.1357, "accuracy": 0.4444, "tp": 32, "fp": 29, "tn": 16, "fn": 31}, {"fold": "fold_3", "regime": "Eurozone debt plateau", "sharpe": 15.2328, "sortino": 30.3699, "return_pct": 55.7, "equity": 1557.01, "max_dd": 0.7, "win_rate": 88.07, "profit_factor": 17.438, "ic": 0.854, "hit": 86.49, "n": 111, "precision": 0.8269, "recall": 0.9149, "f1": 0.8687, "f2": 0.8958, "mcc": 0.7667, "accuracy": 0.8829, "tp": 43, "fp": 9, "tn": 55, "fn": 4}, {"fold": "fold_4", "regime": "Strong USD downturn", "sharpe": 15.8372, "sortino": 43.3569, "return_pct": 47.45, "equity": 1474.52, "max_dd": 0.64, "win_rate": 89.91, "profit_factor": 26.432, "ic": 0.9297, "hit": 89.09, "n": 110, "precision": 0.9091, "recall": 0.8511, "f1": 0.8791, "f2": 0.8621, "mcc": 0.7953, "accuracy": 0.9, "tp": 40, "fp": 4, "tn": 59, "fn": 7}, {"fold": "fold_5", "regime": "Low-vol plateau", "sharpe": 15.498, "sortino": 72.0102, "return_pct": 44.62, "equity": 1446.21, "max_dd": 0.25, "win_rate": 85.71, "profit_factor": 24.384, "ic": 0.929, "hit": 85.71, "n": 112, "precision": 0.8491, "recall": 0.8491, "f1": 0.8491, "f2": 0.8491, "mcc": 0.7135, "accuracy": 0.8571, "tp": 45, "fp": 8, "tn": 51, "fn": 8}, {"fold": "fold_6", "regime": "EUR crisis downturn", "sharpe": 15.1711, "sortino": 62.1128, "return_pct": 28.48, "equity": 1284.79, "max_dd": 0.25, "win_rate": 86.92, "profit_factor": 24.842, "ic": 0.9301, "hit": 86.11, "n": 108, "precision": 0.8235, "recall": 0.8936, "f1": 0.8571, "f2": 0.8787, "mcc": 0.7409, "accuracy": 0.8704, "tp": 42, "fp": 9, "tn": 52, "fn": 5}, {"fold": "fold_7", "regime": "Recent mixed/upturn", "sharpe": 16.8194, "sortino": 65.9182, "return_pct": 31.84, "equity": 1318.39, "max_dd": 0.23, "win_rate": 87.27, "profit_factor": 26.63, "ic": 0.9007, "hit": 87.27, "n": 110, "precision": 0.8545, "recall": 0.8868, "f1": 0.8704, "f2": 0.8801, "mcc": 0.7459, "accuracy": 0.8727, "tp": 47, "fp": 8, "tn": 49, "fn": 6}], "train_sharpe": 7.9717, "train_psr": 1.0, "train_equity": 5822453.0, "train_sortino": 22.9427, "train_return_pct": 582145.3, "train_max_dd": 4.5, "train_win_rate": 79.54, "train_profit_factor": 8.016, "train_ic": 0.7808, "train_hit": 79.22, "train_precision": 0.7834, "train_recall": 0.8289, "train_f1": 0.8055, "train_f2": 0.8194, "train_mcc": 0.5884, "train_accuracy": 0.7942, "train_per_window": [{"fold": "all_train", "regime": "Training data", "sharpe": 7.9717, "sortino": 22.9427, "return_pct": 582145.3, "equity": 5822453.0, "max_dd": 4.5, "win_rate": 79.54, "profit_factor": 8.016, "ic": 0.7808, "hit": 79.22, "n": 2478, "precision": 0.7834, "recall": 0.8289, "f1": 0.8055, "f2": 0.8194, "mcc": 0.5884, "accuracy": 0.7942, "tp": 1056, "fp": 292, "tn": 912, "fn": 218}], "experiment_num": 229, "status": "DISCARD"}
{"backbone": "catboost", "description": "catboost: Exp9 bagging_temperature=0 (no ordered boosting noise)", "config": {"seq_len": 10, "lr": 0.0003, "batch_size": 32, "epochs": 20, "weight_decay": 1e-05, "patience": 5, "grad_clip": 1.0, "warmup_epochs": 0, "huber_delta": 1.0, "head_dropout": 0.1, "seed": 42, "gbm_lr": 0.01, "depth": 4, "bagging_temperature": 0.0, "het_loss": false}, "composite": 7.5994, "test_pos_folds": 6, "val_pos_folds": 6, "val_loss": 0.0, "elapsed_sec": 251.7, "timestamp": "2026-04-21T09:57:39", "sharpe": 7.8627, "psr": 1.0, "equity": 18665.05, "sortino": 7.5922, "return_pct": 1766.51, "max_dd": 7.54, "win_rate": 79.26, "profit_factor": 4.728, "ic": 0.6929, "hit": 78.93, "precision": 0.8117, "recall": 0.7526, "f1": 0.781, "f2": 0.7637, "mcc": 0.5839, "accuracy": 0.7914, "per_window": [{"fold": "fold_1", "regime": "Pre-crisis upturn + GFC onset", "sharpe": -0.1555, "sortino": -0.1765, "return_pct": -1.91, "equity": 980.86, "max_dd": 7.54, "win_rate": 49.02, "profit_factor": 0.964, "ic": 0.1532, "hit": 48.54, "n": 103, "precision": 0.5161, "recall": 0.3019, "f1": 0.381, "f2": 0.3292, "mcc": 0.0021, "accuracy": 0.4951, "tp": 16, "fp": 15, "tn": 35, "fn": 37}, {"fold": "fold_2", "regime": "Post-crash recovery", "sharpe": 2.0854, "sortino": 3.6532, "return_pct": 10.14, "equity": 1101.36, "max_dd": 5.58, "win_rate": 57.94, "profit_factor": 1.387, "ic": 0.0242, "hit": 57.94, "n": 107, "precision": 0.5682, "recall": 0.4902, "f1": 0.5263, "f2": 0.504, "mcc": 0.1532, "accuracy": 0.5794, "tp": 25, "fp": 19, "tn": 37, "fn": 26}, {"fold": "fold_3", "regime": "Eurozone debt plateau", "sharpe": 14.9856, "sortino": 25.1928, "return_pct": 47.01, "equity": 1470.12, "max_dd": 1.32, "win_rate": 84.62, "profit_factor": 12.818, "ic": 0.7975, "hit": 83.02, "n": 106, "precision": 0.8545, "recall": 0.8246, "f1": 0.8393, "f2": 0.8304, "mcc": 0.6599, "accuracy": 0.8302, "tp": 47, "fp": 8, "tn": 41, "fn": 10}, {"fold": "fold_4", "regime": "Strong USD downturn", "sharpe": 14.3002, "sortino": 17.0511, "return_pct": 127.56, "equity": 2275.64, "max_dd": 1.81, "win_rate": 92.22, "profit_factor": 17.57, "ic": 0.8756, "hit": 91.67, "n": 168, "precision": 0.9506, "recall": 0.8953, "f1": 0.9222, "f2": 0.9059, "mcc": 0.8469, "accuracy": 0.9226, "tp": 77, "fp": 4, "tn": 78, "fn": 9}, {"fold": "fold_5", "regime": "Low-vol plateau", "sharpe": 15.7327, "sortino": 77.7482, "return_pct": 45.01, "equity": 1450.08, "max_dd": 0.23, "win_rate": 86.42, "profit_factor": 27.318, "ic": 0.9118, "hit": 86.42, "n": 162, "precision": 0.8462, "recall": 0.8684, "f1": 0.8571, "f2": 0.8639, "mcc": 0.728, "accuracy": 0.8642, "tp": 66, "fp": 12, "tn": 74, "fn": 10}, {"fold": "fold_6", "regime": "EUR crisis downturn", "sharpe": 14.5416, "sortino": 44.0529, "return_pct": 95.88, "equity": 1958.84, "max_dd": 0.76, "win_rate": 80.61, "profit_factor": 13.96, "ic": 0.8814, "hit": 80.61, "n": 165, "precision": 0.8, "recall": 0.7792, "f1": 0.7895, "f2": 0.7833, "mcc": 0.6099, "accuracy": 0.8061, "tp": 60, "fp": 15, "tn": 73, "fn": 17}, {"fold": "fold_7", "regime": "Recent mixed/upturn", "sharpe": 13.0319, "sortino": 17.3932, "return_pct": 81.82, "equity": 1818.2, "max_dd": 1.64, "win_rate": 87.04, "profit_factor": 12.403, "ic": 0.8403, "hit": 87.04, "n": 162, "precision": 0.8659, "recall": 0.8765, "f1": 0.8712, "f2": 0.8744, "mcc": 0.7408, "accuracy": 0.8704, "tp": 71, "fp": 11, "tn": 70, "fn": 10}], "val_sharpe": 7.7994, "val_psr": 1.0, "val_equity": 5224.53, "val_sortino": 9.9396, "val_return_pct": 422.45, "val_max_dd": 12.16, "val_win_rate": 75.62, "val_profit_factor": 3.894, "val_ic": 0.6743, "val_hit": 75.13, "val_precision": 0.7192, "val_recall": 0.8, "val_f1": 0.7575, "val_f2": 0.7824, "val_mcc": 0.5173, "val_accuracy": 0.7565, "val_per_window": [{"fold": "fold_1", "regime": "Pre-crisis upturn + GFC onset", "sharpe": 1.3332, "sortino": 2.5459, "return_pct": 3.34, "equity": 1033.36, "max_dd": 3.04, "win_rate": 49.07, "profit_factor": 1.247, "ic": 0.0082, "hit": 48.62, "n": 109, "precision": 0.4943, "recall": 0.7818, "f1": 0.6056, "f2": 0.7003, "mcc": -0.0411, "accuracy": 0.4862, "tp": 43, "fp": 44, "tn": 10, "fn": 12}, {"fold": "fold_2", "regime": "Post-crash recovery", "sharpe": -1.6712, "sortino": -2.6612, "return_pct": -8.01, "equity": 919.93, "max_dd": 12.16, "win_rate": 45.37, "profit_factor": 0.768, "ic": -0.1194, "hit": 45.37, "n": 108, "precision": 0.5333, "recall": 0.5079, "f1": 0.5203, "f2": 0.5128, "mcc": -0.1134, "accuracy": 0.4537, "tp": 32, "fp": 28, "tn": 17, "fn": 31}, {"fold": "fold_3", "regime": "Eurozone debt plateau", "sharpe": 14.2493, "sortino": 31.2092, "return_pct": 53.28, "equity": 1532.82, "max_dd": 0.7, "win_rate": 85.32, "profit_factor": 13.299, "ic": 0.8536, "hit": 83.78, "n": 111, "precision": 0.7818, "recall": 0.9149, "f1": 0.8431, "f2": 0.8848, "mcc": 0.7188, "accuracy": 0.8559, "tp": 43, "fp": 12, "tn": 52, "fn": 4}, {"fold": "fold_4", "regime": "Strong USD downturn", "sharpe": 16.6669, "sortino": 51.2627, "return_pct": 48.91, "equity": 1489.1, "max_dd": 0.64, "win_rate": 91.74, "profit_factor": 39.408, "ic": 0.934, "hit": 90.91, "n": 110, "precision": 0.9318, "recall": 0.8723, "f1": 0.9011, "f2": 0.8836, "mcc": 0.8328, "accuracy": 0.9182, "tp": 41, "fp": 3, "tn": 60, "fn": 6}, {"fold": "fold_5", "regime": "Low-vol plateau", "sharpe": 15.498, "sortino": 72.0102, "return_pct": 44.62, "equity": 1446.21, "max_dd": 0.25, "win_rate": 85.71, "profit_factor": 24.384, "ic": 0.9157, "hit": 85.71, "n": 112, "precision": 0.8491, "recall": 0.8491, "f1": 0.8491, "f2": 0.8491, "mcc": 0.7135, "accuracy": 0.8571, "tp": 45, "fp": 8, "tn": 51, "fn": 8}, {"fold": "fold_6", "regime": "EUR crisis downturn", "sharpe": 15.7595, "sortino": 102.738, "return_pct": 29.12, "equity": 1291.17, "max_dd": 0.15, "win_rate": 87.85, "profit_factor": 32.784, "ic": 0.9318, "hit": 87.04, "n": 108, "precision": 0.84, "recall": 0.8936, "f1": 0.866, "f2": 0.8824, "mcc": 0.7581, "accuracy": 0.8796, "tp": 42, "fp": 8, "tn": 53, "fn": 5}, {"fold": "fold_7", "regime": "Recent mixed/upturn", "sharpe": 14.2893, "sortino": 35.9623, "return_pct": 28.95, "equity": 1289.47, "max_dd": 0.5, "win_rate": 83.64, "profit_factor": 12.638, "ic": 0.8796, "hit": 83.64, "n": 110, "precision": 0.807, "recall": 0.8679, "f1": 0.8364, "f2": 0.855, "mcc": 0.6749, "accuracy": 0.8364, "tp": 46, "fp": 11, "tn": 46, "fn": 7}], "train_sharpe": 9.5104, "train_psr": 1.0, "train_equity": 20722566.0, "train_sortino": 37.8065, "train_return_pct": 2072156.6, "train_max_dd": 2.83, "train_win_rate": 85.49, "train_profit_factor": 17.375, "train_ic": 0.8744, "train_hit": 85.15, "train_precision": 0.8502, "train_recall": 0.8689, "train_f1": 0.8595, "train_f2": 0.8651, "train_mcc": 0.7076, "train_accuracy": 0.8539, "train_per_window": [{"fold": "all_train", "regime": "Training data", "sharpe": 9.5104, "sortino": 37.8065, "return_pct": 2072156.6, "equity": 20722566.0, "max_dd": 2.83, "win_rate": 85.49, "profit_factor": 17.375, "ic": 0.8744, "hit": 85.15, "n": 2478, "precision": 0.8502, "recall": 0.8689, "f1": 0.8595, "f2": 0.8651, "mcc": 0.7076, "accuracy": 0.8539, "tp": 1107, "fp": 195, "tn": 1009, "fn": 167}], "experiment_num": 230, "status": "DISCARD"}
{"backbone": "catboost", "description": "catboost: Exp10 random_strength=10", "config": {"seq_len": 10, "lr": 0.0003, "batch_size": 32, "epochs": 20, "weight_decay": 1e-05, "patience": 5, "grad_clip": 1.0, "warmup_epochs": 0, "huber_delta": 1.0, "head_dropout": 0.1, "seed": 42, "gbm_lr": 0.01, "depth": 4, "random_strength": 10.0, "het_loss": false}, "composite": 7.7824, "test_pos_folds": 7, "val_pos_folds": 6, "val_loss": 0.0, "elapsed_sec": 253.6, "timestamp": "2026-04-21T10:02:03", "sharpe": 7.9137, "psr": 1.0, "equity": 18953.6, "sortino": 7.9274, "return_pct": 1795.36, "max_dd": 7.54, "win_rate": 78.12, "profit_factor": 4.784, "ic": 0.695, "hit": 77.8, "precision": 0.7917, "recall": 0.7505, "f1": 0.7705, "f2": 0.7584, "mcc": 0.5585, "accuracy": 0.779, "per_window": [{"fold": "fold_1", "regime": "Pre-crisis upturn + GFC onset", "sharpe": 0.6367, "sortino": 0.7112, "return_pct": 4.26, "equity": 1042.63, "max_dd": 7.54, "win_rate": 50.98, "profit_factor": 1.162, "ic": 0.1168, "hit": 50.49, "n": 103, "precision": 0.5278, "recall": 0.3585, "f1": 0.427, "f2": 0.3831, "mcc": 0.0194, "accuracy": 0.5049, "tp": 19, "fp": 17, "tn": 33, "fn": 34}, {"fold": "fold_2", "regime": "Post-crash recovery", "sharpe": 0.8532, "sortino": 1.5097, "return_pct": 3.89, "equity": 1038.93, "max_dd": 3.79, "win_rate": 50.47, "profit_factor": 1.143, "ic": -0.0048, "hit": 50.47, "n": 107, "precision": 0.4792, "recall": 0.451, "f1": 0.4646, "f2": 0.4563, "mcc": 0.0046, "accuracy": 0.5047, "tp": 23, "fp": 25, "tn": 31, "fn": 28}, {"fold": "fold_3", "regime": "Eurozone debt plateau", "sharpe": 14.9565, "sortino": 24.8761, "return_pct": 46.95, "equity": 1469.54, "max_dd": 1.32, "win_rate": 85.58, "profit_factor": 12.734, "ic": 0.7882, "hit": 83.96, "n": 106, "precision": 0.8704, "recall": 0.8246, "f1": 0.8468, "f2": 0.8333, "mcc": 0.6799, "accuracy": 0.8396, "tp": 47, "fp": 7, "tn": 42, "fn": 10}, {"fold": "fold_4", "regime": "Strong USD downturn", "sharpe": 15.8069, "sortino": 45.6085, "return_pct": 138.0, "equity": 2379.99, "max_dd": 0.56, "win_rate": 91.62, "profit_factor": 32.717, "ic": 0.8948, "hit": 91.07, "n": 168, "precision": 0.9286, "recall": 0.907, "f1": 0.9176, "f2": 0.9112, "mcc": 0.8336, "accuracy": 0.9167, "tp": 78, "fp": 6, "tn": 76, "fn": 8}, {"fold": "fold_5", "regime": "Low-vol plateau", "sharpe": 15.1605, "sortino": 69.8959, "return_pct": 43.99, "equity": 1439.93, "max_dd": 0.2, "win_rate": 84.57, "profit_factor": 21.689, "ic": 0.9135, "hit": 84.57, "n": 162, "precision": 0.8148, "recall": 0.8684, "f1": 0.8408, "f2": 0.8571, "mcc": 0.6927, "accuracy": 0.8457, "tp": 66, "fp": 15, "tn": 71, "fn": 10}, {"fold": "fold_6", "regime": "EUR crisis downturn", "sharpe": 14.4891, "sortino": 43.9056, "return_pct": 95.62, "equity": 1956.24, "max_dd": 0.76, "win_rate": 81.21, "profit_factor": 13.771, "ic": 0.8794, "hit": 81.21, "n": 165, "precision": 0.8026, "recall": 0.7922, "f1": 0.7974, "f2": 0.7943, "mcc": 0.6223, "accuracy": 0.8121, "tp": 61, "fp": 15, "tn": 73, "fn": 16}, {"fold": "fold_7", "regime": "Recent mixed/upturn", "sharpe": 12.2118, "sortino": 15.8774, "return_pct": 77.61, "equity": 1776.05, "max_dd": 1.64, "win_rate": 85.19, "profit_factor": 9.962, "ic": 0.8409, "hit": 85.19, "n": 162, "precision": 0.8701, "recall": 0.8272, "f1": 0.8481, "f2": 0.8354, "mcc": 0.7046, "accuracy": 0.8519, "tp": 67, "fp": 10, "tn": 71, "fn": 14}], "val_sharpe": 7.8824, "val_psr": 1.0, "val_equity": 5299.27, "val_sortino": 9.9137, "val_return_pct": 429.93, "val_max_dd": 12.52, "val_win_rate": 75.1, "val_profit_factor": 3.955, "val_ic": 0.6851, "val_hit": 74.61, "val_precision": 0.7088, "val_recall": 0.8137, "val_f1": 0.7577, "val_f2": 0.7903, "val_mcc": 0.5125, "val_accuracy": 0.7526, "val_per_window": [{"fold": "fold_1", "regime": "Pre-crisis upturn + GFC onset", "sharpe": 1.1416, "sortino": 2.0087, "return_pct": 2.84, "equity": 1028.41, "max_dd": 4.11, "win_rate": 48.15, "profit_factor": 1.208, "ic": -0.0079, "hit": 47.71, "n": 109, "precision": 0.4944, "recall": 0.8, "f1": 0.6111, "f2": 0.712, "mcc": -0.0431, "accuracy": 0.4862, "tp": 44, "fp": 45, "tn": 9, "fn": 11}, {"fold": "fold_2", "regime": "Post-crash recovery", "sharpe": -1.6042, "sortino": -2.529, "return_pct": -7.71, "equity": 922.88, "max_dd": 12.52, "win_rate": 44.44, "profit_factor": 0.776, "ic": -0.066, "hit": 44.44, "n": 108, "precision": 0.5238, "recall": 0.5238, "f1": 0.5238, "f2": 0.5238, "mcc": -0.1429, "accuracy": 0.4444, "tp": 33, "fp": 30, "tn": 15, "fn": 30}, {"fold": "fold_3", "regime": "Eurozone debt plateau", "sharpe": 15.0867, "sortino": 31.2781, "return_pct": 55.35, "equity": 1553.53, "max_dd": 0.7, "win_rate": 86.24, "profit_factor": 16.706, "ic": 0.8578, "hit": 84.68, "n": 111, "precision": 0.7963, "recall": 0.9149, "f1": 0.8515, "f2": 0.8884, "mcc": 0.7345, "accuracy": 0.8649, "tp": 43, "fp": 11, "tn": 53, "fn": 4}, {"fold": "fold_4", "regime": "Strong USD downturn", "sharpe": 15.8865, "sortino": 42.1348, "return_pct": 47.54, "equity": 1475.41, "max_dd": 0.64, "win_rate": 89.91, "profit_factor": 26.985, "ic": 0.9344, "hit": 89.09, "n": 110, "precision": 0.9091, "recall": 0.8511, "f1": 0.8791, "f2": 0.8621, "mcc": 0.7953, "accuracy": 0.9, "tp": 40, "fp": 4, "tn": 59, "fn": 7}, {"fold": "fold_5", "regime": "Low-vol plateau", "sharpe": 15.6704, "sortino": 78.819, "return_pct": 44.92, "equity": 1449.24, "max_dd": 0.29, "win_rate": 84.82, "profit_factor": 26.179, "ic": 0.9202, "hit": 84.82, "n": 112, "precision": 0.8, "recall": 0.9057, "f1": 0.8496, "f2": 0.8824, "mcc": 0.7031, "accuracy": 0.8482, "tp": 48, "fp": 12, "tn": 47, "fn": 5}, {"fold": "fold_6", "regime": "EUR crisis downturn", "sharpe": 15.9794, "sortino": 101.4068, "return_pct": 29.35, "equity": 1293.47, "max_dd": 0.15, "win_rate": 87.85, "profit_factor": 36.983, "ic": 0.9305, "hit": 87.04, "n": 108, "precision": 0.8269, "recall": 0.9149, "f1": 0.8687, "f2": 0.8958, "mcc": 0.7614, "accuracy": 0.8796, "tp": 43, "fp": 9, "tn": 52, "fn": 4}, {"fold": "fold_7", "regime": "Recent mixed/upturn", "sharpe": 15.1053, "sortino": 37.0823, "return_pct": 29.95, "equity": 1299.49, "max_dd": 0.5, "win_rate": 83.64, "profit_factor": 15.566, "ic": 0.8929, "hit": 83.64, "n": 110, "precision": 0.807, "recall": 0.8679, "f1": 0.8364, "f2": 0.855, "mcc": 0.6749, "accuracy": 0.8364, "tp": 46, "fp": 11, "tn": 46, "fn": 7}], "train_sharpe": 8.3395, "train_psr": 1.0, "train_equity": 7999484.5, "train_sortino": 25.7141, "train_return_pct": 799848.45, "train_max_dd": 3.35, "train_win_rate": 80.67, "train_profit_factor": 9.333, "train_ic": 0.8112, "train_hit": 80.35, "train_precision": 0.8006, "train_recall": 0.8289, "train_f1": 0.8145, "train_f2": 0.8231, "train_mcc": 0.6115, "train_accuracy": 0.8059, "train_per_window": [{"fold": "all_train", "regime": "Training data", "sharpe": 8.3395, "sortino": 25.7141, "return_pct": 799848.45, "equity": 7999484.5, "max_dd": 3.35, "win_rate": 80.67, "profit_factor": 9.333, "ic": 0.8112, "hit": 80.35, "n": 2478, "precision": 0.8006, "recall": 0.8289, "f1": 0.8145, "f2": 0.8231, "mcc": 0.6115, "accuracy": 0.8059, "tp": 1056, "fp": 263, "tn": 941, "fn": 218}], "experiment_num": 231, "status": "DISCARD"}
