{"backbone": "lightgbm", "description": "lgbm: Exp14 seed=0 variance", "config": {"seq_len": 10, "lr": 0.0003, "batch_size": 32, "epochs": 20, "weight_decay": 1e-05, "patience": 5, "grad_clip": 1.0, "warmup_epochs": 0, "huber_delta": 1.0, "head_dropout": 0.1, "seed": 0, "max_depth": 4, "gbm_lr": 0.01, "het_loss": false}, "composite": 7.2296, "test_pos_folds": 6, "val_pos_folds": 6, "val_loss": 0.0, "elapsed_sec": 38.7, "timestamp": "2026-04-21T07:11:55", "sharpe": 7.4296, "psr": 1.0, "equity": 16347.53, "sortino": 7.5993, "return_pct": 1534.75, "max_dd": 8.1, "win_rate": 77.4, "profit_factor": 4.285, "ic": 0.6597, "hit": 77.08, "precision": 0.7897, "recall": 0.7339, "f1": 0.7608, "f2": 0.7444, "mcc": 0.5446, "accuracy": 0.7718, "per_window": [{"fold": "fold_1", "regime": "Pre-crisis upturn + GFC onset", "sharpe": -0.4046, "sortino": -0.476, "return_pct": -3.78, "equity": 962.21, "max_dd": 7.54, "win_rate": 46.08, "profit_factor": 0.909, "ic": 0.0431, "hit": 45.63, "n": 103, "precision": 0.4516, "recall": 0.2642, "f1": 0.3333, "f2": 0.2881, "mcc": -0.0826, "accuracy": 0.4563, "tp": 14, "fp": 17, "tn": 33, "fn": 39}, {"fold": "fold_2", "regime": "Post-crash recovery", "sharpe": 0.2229, "sortino": 0.3953, "return_pct": 0.8, "equity": 1008.02, "max_dd": 8.1, "win_rate": 52.34, "profit_factor": 1.036, "ic": -0.0243, "hit": 52.34, "n": 107, "precision": 0.5, "recall": 0.4706, "f1": 0.4848, "f2": 0.4762, "mcc": 0.0422, "accuracy": 0.5234, "tp": 24, "fp": 24, "tn": 32, "fn": 27}, {"fold": "fold_3", "regime": "Eurozone debt plateau", "sharpe": 14.6011, "sortino": 24.1159, "return_pct": 46.23, "equity": 1462.29, "max_dd": 1.32, "win_rate": 84.62, "profit_factor": 11.775, "ic": 0.7987, "hit": 83.02, "n": 106, "precision": 0.8545, "recall": 0.8246, "f1": 0.8393, "f2": 0.8304, "mcc": 0.6599, "accuracy": 0.8302, "tp": 47, "fp": 8, "tn": 41, "fn": 10}, {"fold": "fold_4", "regime": "Strong USD downturn", "sharpe": 14.1135, "sortino": 32.5385, "return_pct": 126.2, "equity": 2262.01, "max_dd": 0.97, "win_rate": 89.82, "profit_factor": 16.515, "ic": 0.8759, "hit": 89.29, "n": 168, "precision": 0.9367, "recall": 0.8605, "f1": 0.897, "f2": 0.8747, "mcc": 0.8007, "accuracy": 0.8988, "tp": 74, "fp": 5, "tn": 77, "fn": 12}, {"fold": "fold_5", "regime": "Low-vol plateau", "sharpe": 15.5014, "sortino": 74.3765, "return_pct": 44.6, "equity": 1446.04, "max_dd": 0.23, "win_rate": 85.19, "profit_factor": 24.775, "ic": 0.8992, "hit": 85.19, "n": 162, "precision": 0.8333, "recall": 0.8553, "f1": 0.8442, "f2": 0.8508, "mcc": 0.7032, "accuracy": 0.8519, "tp": 65, "fp": 13, "tn": 73, "fn": 11}, {"fold": "fold_6", "regime": "EUR crisis downturn", "sharpe": 15.0979, "sortino": 63.1062, "return_pct": 98.58, "equity": 1985.83, "max_dd": 0.43, "win_rate": 81.21, "profit_factor": 16.221, "ic": 0.8674, "hit": 81.21, "n": 165, "precision": 0.8108, "recall": 0.7792, "f1": 0.7947, "f2": 0.7853, "mcc": 0.6221, "accuracy": 0.8121, "tp": 60, "fp": 14, "tn": 74, "fn": 17}, {"fold": "fold_7", "regime": "Recent mixed/upturn", "sharpe": 12.1816, "sortino": 16.0534, "return_pct": 77.45, "equity": 1774.46, "max_dd": 1.64, "win_rate": 84.57, "profit_factor": 9.887, "ic": 0.8146, "hit": 84.57, "n": 162, "precision": 0.8415, "recall": 0.8519, "f1": 0.8466, "f2": 0.8498, "mcc": 0.6914, "accuracy": 0.8457, "tp": 69, "fp": 13, "tn": 68, "fn": 12}], "val_sharpe": 7.604, "val_psr": 1.0, "val_equity": 5050.84, "val_sortino": 9.8842, "val_return_pct": 405.08, "val_max_dd": 15.53, "val_win_rate": 73.79, "val_profit_factor": 3.754, "val_ic": 0.6633, "val_hit": 73.31, "val_precision": 0.6916, "val_recall": 0.811, "val_f1": 0.7465, "val_f2": 0.7839, "val_mcc": 0.486, "val_accuracy": 0.7383, "val_per_window": [{"fold": "fold_1", "regime": "Pre-crisis upturn + GFC onset", "sharpe": 1.0247, "sortino": 1.9716, "return_pct": 2.54, "equity": 1025.4, "max_dd": 3.02, "win_rate": 46.3, "profit_factor": 1.185, "ic": 0.0293, "hit": 45.87, "n": 109, "precision": 0.4783, "recall": 0.8, "f1": 0.5986, "f2": 0.7051, "mcc": -0.1225, "accuracy": 0.4587, "tp": 44, "fp": 48, "tn": 6, "fn": 11}, {"fold": "fold_2", "regime": "Post-crash recovery", "sharpe": -1.9621, "sortino": -3.1163, "return_pct": -9.27, "equity": 907.27, "max_dd": 15.53, "win_rate": 43.52, "profit_factor": 0.734, "ic": -0.1023, "hit": 43.52, "n": 108, "precision": 0.5156, "recall": 0.5238, "f1": 0.5197, "f2": 0.5222, "mcc": -0.1656, "accuracy": 0.4352, "tp": 33, "fp": 31, "tn": 14, "fn": 30}, {"fold": "fold_3", "regime": "Eurozone debt plateau", "sharpe": 14.4119, "sortino": 30.9043, "return_pct": 53.69, "equity": 1536.95, "max_dd": 0.7, "win_rate": 85.32, "profit_factor": 13.872, "ic": 0.8492, "hit": 83.78, "n": 111, "precision": 0.7818, "recall": 0.9149, "f1": 0.8431, "f2": 0.8848, "mcc": 0.7188, "accuracy": 0.8559, "tp": 43, "fp": 12, "tn": 52, "fn": 4}, {"fold": "fold_4", "regime": "Strong USD downturn", "sharpe": 15.7867, "sortino": 55.8472, "return_pct": 47.36, "equity": 1473.6, "max_dd": 0.59, "win_rate": 88.07, "profit_factor": 25.885, "ic": 0.9274, "hit": 87.27, "n": 110, "precision": 0.8696, "recall": 0.8511, "f1": 0.8602, "f2": 0.8547, "mcc": 0.758, "accuracy": 0.8818, "tp": 40, "fp": 6, "tn": 57, "fn": 7}, {"fold": "fold_5", "regime": "Low-vol plateau", "sharpe": 14.8344, "sortino": 66.4952, "return_pct": 43.41, "equity": 1434.15, "max_dd": 0.29, "win_rate": 82.14, "profit_factor": 19.074, "ic": 0.9214, "hit": 82.14, "n": 112, "precision": 0.7895, "recall": 0.8491, "f1": 0.8182, "f2": 0.8364, "mcc": 0.6448, "accuracy": 0.8214, "tp": 45, "fp": 12, "tn": 47, "fn": 8}, {"fold": "fold_6", "regime": "EUR crisis downturn", "sharpe": 15.8013, "sortino": 103.4637, "return_pct": 29.16, "equity": 1291.61, "max_dd": 0.19, "win_rate": 86.92, "profit_factor": 33.514, "ic": 0.9308, "hit": 86.11, "n": 108, "precision": 0.8, "recall": 0.9362, "f1": 0.8627, "f2": 0.9053, "mcc": 0.7496, "accuracy": 0.8704, "tp": 44, "fp": 11, "tn": 50, "fn": 3}, {"fold": "fold_7", "regime": "Recent mixed/upturn", "sharpe": 14.659, "sortino": 36.2819, "return_pct": 29.41, "equity": 1294.1, "max_dd": 0.5, "win_rate": 83.64, "profit_factor": 13.853, "ic": 0.8755, "hit": 83.64, "n": 110, "precision": 0.7966, "recall": 0.8868, "f1": 0.8393, "f2": 0.8672, "mcc": 0.6776, "accuracy": 0.8364, "tp": 47, "fp": 12, "tn": 45, "fn": 6}], "train_sharpe": 10.0979, "train_psr": 1.0, "train_equity": 32307898.0, "train_sortino": 57.7398, "train_return_pct": 3230689.8, "train_max_dd": 0.7, "train_win_rate": 87.72, "train_profit_factor": 27.852, "train_ic": 0.9073, "train_hit": 87.37, "train_precision": 0.8653, "train_recall": 0.8972, "train_f1": 0.8809, "train_f2": 0.8906, "train_mcc": 0.7507, "train_accuracy": 0.8753, "train_per_window": [{"fold": "all_train", "regime": "Training data", "sharpe": 10.0979, "sortino": 57.7398, "return_pct": 3230689.8, "equity": 32307898.0, "max_dd": 0.7, "win_rate": 87.72, "profit_factor": 27.852, "ic": 0.9073, "hit": 87.37, "n": 2478, "precision": 0.8653, "recall": 0.8972, "f1": 0.8809, "f2": 0.8906, "mcc": 0.7507, "accuracy": 0.8753, "tp": 1143, "fp": 178, "tn": 1026, "fn": 131}], "experiment_num": 217, "status": "DISCARD"}
{"backbone": "lightgbm", "description": "lgbm: Exp15 seed=13 variance", "config": {"seq_len": 10, "lr": 0.0003, "batch_size": 32, "epochs": 20, "weight_decay": 1e-05, "patience": 5, "grad_clip": 1.0, "warmup_epochs": 0, "huber_delta": 1.0, "head_dropout": 0.1, "seed": 13, "max_depth": 4, "gbm_lr": 0.01, "het_loss": false}, "composite": 7.3631, "test_pos_folds": 6, "val_pos_folds": 6, "val_loss": 0.0, "elapsed_sec": 38.8, "timestamp": "2026-04-21T07:12:44", "sharpe": 7.5631, "psr": 1.0, "equity": 17037.13, "sortino": 7.7754, "return_pct": 1603.71, "max_dd": 8.97, "win_rate": 77.19, "profit_factor": 4.416, "ic": 0.6604, "hit": 76.88, "precision": 0.7862, "recall": 0.7339, "f1": 0.7591, "f2": 0.7438, "mcc": 0.5403, "accuracy": 0.7698, "per_window": [{"fold": "fold_1", "regime": "Pre-crisis upturn + GFC onset", "sharpe": -0.8772, "sortino": -1.0574, "return_pct": -7.21, "equity": 927.85, "max_dd": 8.97, "win_rate": 42.16, "profit_factor": 0.813, "ic": 0.0455, "hit": 41.75, "n": 103, "precision": 0.3939, "recall": 0.2453, "f1": 0.3023, "f2": 0.2653, "mcc": -0.1657, "accuracy": 0.4175, "tp": 13, "fp": 20, "tn": 30, "fn": 40}, {"fold": "fold_2", "regime": "Post-crash recovery", "sharpe": 1.7119, "sortino": 3.0018, "return_pct": 8.22, "equity": 1082.2, "max_dd": 4.72, "win_rate": 54.21, "profit_factor": 1.308, "ic": -0.0227, "hit": 54.21, "n": 107, "precision": 0.5238, "recall": 0.4314, "f1": 0.4731, "f2": 0.4472, "mcc": 0.0759, "accuracy": 0.5421, "tp": 22, "fp": 20, "tn": 36, "fn": 29}, {"fold": "fold_3", "regime": "Eurozone debt plateau", "sharpe": 14.9183, "sortino": 23.4506, "return_pct": 46.88, "equity": 1468.77, "max_dd": 1.32, "win_rate": 85.58, "profit_factor": 12.626, "ic": 0.809, "hit": 83.96, "n": 106, "precision": 0.8846, "recall": 0.807, "f1": 0.844, "f2": 0.8214, "mcc": 0.6827, "accuracy": 0.8396, "tp": 46, "fp": 6, "tn": 43, "fn": 11}, {"fold": "fold_4", "regime": "Strong USD downturn", "sharpe": 14.1771, "sortino": 32.5915, "return_pct": 126.67, "equity": 2266.68, "max_dd": 0.97, "win_rate": 89.82, "profit_factor": 16.863, "ic": 0.8809, "hit": 89.29, "n": 168, "precision": 0.9259, "recall": 0.8721, "f1": 0.8982, "f2": 0.8824, "mcc": 0.7992, "accuracy": 0.8988, "tp": 75, "fp": 6, "tn": 76, "fn": 11}, {"fold": "fold_5", "regime": "Low-vol plateau", "sharpe": 15.2597, "sortino": 71.1416, "return_pct": 44.17, "equity": 1441.73, "max_dd": 0.23, "win_rate": 84.57, "profit_factor": 22.518, "ic": 0.8989, "hit": 84.57, "n": 162, "precision": 0.8228, "recall": 0.8553, "f1": 0.8387, "f2": 0.8486, "mcc": 0.6914, "accuracy": 0.8457, "tp": 65, "fp": 14, "tn": 72, "fn": 11}, {"fold": "fold_6", "regime": "EUR crisis downturn", "sharpe": 14.8713, "sortino": 61.0506, "return_pct": 97.5, "equity": 1974.96, "max_dd": 0.43, "win_rate": 81.21, "profit_factor": 15.237, "ic": 0.8716, "hit": 81.21, "n": 165, "precision": 0.8026, "recall": 0.7922, "f1": 0.7974, "f2": 0.7943, "mcc": 0.6223, "accuracy": 0.8121, "tp": 61, "fp": 15, "tn": 73, "fn": 16}, {"fold": "fold_7", "regime": "Recent mixed/upturn", "sharpe": 12.4764, "sortino": 17.7817, "return_pct": 78.99, "equity": 1789.89, "max_dd": 1.64, "win_rate": 84.57, "profit_factor": 10.665, "ic": 0.8263, "hit": 84.57, "n": 162, "precision": 0.8256, "recall": 0.8765, "f1": 0.8503, "f2": 0.8659, "mcc": 0.6927, "accuracy": 0.8457, "tp": 71, "fp": 15, "tn": 66, "fn": 10}], "val_sharpe": 7.9243, "val_psr": 1.0, "val_equity": 5337.25, "val_sortino": 10.2782, "val_return_pct": 433.73, "val_max_dd": 13.93, "val_win_rate": 74.18, "val_profit_factor": 3.986, "val_ic": 0.6576, "val_hit": 73.7, "val_precision": 0.6939, "val_recall": 0.8137, "val_f1": 0.7491, "val_f2": 0.7865, "val_mcc": 0.4913, "val_accuracy": 0.7409, "val_per_window": [{"fold": "fold_1", "regime": "Pre-crisis upturn + GFC onset", "sharpe": 2.1986, "sortino": 4.5473, "return_pct": 5.58, "equity": 1055.76, "max_dd": 2.37, "win_rate": 49.07, "profit_factor": 1.441, "ic": 0.041, "hit": 48.62, "n": 109, "precision": 0.4945, "recall": 0.8182, "f1": 0.6164, "f2": 0.7235, "mcc": -0.0453, "accuracy": 0.4862, "tp": 45, "fp": 46, "tn": 8, "fn": 10}, {"fold": "fold_2", "regime": "Post-crash recovery", "sharpe": -1.426, "sortino": -2.2491, "return_pct": -6.92, "equity": 930.79, "max_dd": 13.93, "win_rate": 45.37, "profit_factor": 0.798, "ic": -0.1255, "hit": 45.37, "n": 108, "precision": 0.5312, "recall": 0.5397, "f1": 0.5354, "f2": 0.538, "mcc": -0.1274, "accuracy": 0.4537, "tp": 34, "fp": 30, "tn": 15, "fn": 29}, {"fold": "fold_3", "regime": "Eurozone debt plateau", "sharpe": 14.5192, "sortino": 31.4337, "return_pct": 53.96, "equity": 1539.64, "max_dd": 0.7, "win_rate": 84.4, "profit_factor": 14.271, "ic": 0.8459, "hit": 82.88, "n": 111, "precision": 0.7544, "recall": 0.9149, "f1": 0.8269, "f2": 0.8776, "mcc": 0.6882, "accuracy": 0.8378, "tp": 43, "fp": 14, "tn": 50, "fn": 4}, {"fold": "fold_4", "regime": "Strong USD downturn", "sharpe": 15.7283, "sortino": 65.9947, "return_pct": 47.25, "equity": 1472.53, "max_dd": 0.66, "win_rate": 87.16, "profit_factor": 25.275, "ic": 0.9277, "hit": 86.36, "n": 110, "precision": 0.8511, "recall": 0.8511, "f1": 0.8511, "f2": 0.8511, "mcc": 0.74, "accuracy": 0.8727, "tp": 40, "fp": 7, "tn": 56, "fn": 7}, {"fold": "fold_5", "regime": "Low-vol plateau", "sharpe": 14.9787, "sortino": 65.1591, "return_pct": 43.68, "equity": 1436.83, "max_dd": 0.29, "win_rate": 83.04, "profit_factor": 20.055, "ic": 0.9203, "hit": 83.04, "n": 112, "precision": 0.8036, "recall": 0.8491, "f1": 0.8257, "f2": 0.8396, "mcc": 0.6617, "accuracy": 0.8304, "tp": 45, "fp": 11, "tn": 48, "fn": 8}, {"fold": "fold_6", "regime": "EUR crisis downturn", "sharpe": 15.8249, "sortino": 104.7227, "return_pct": 29.19, "equity": 1291.86, "max_dd": 0.19, "win_rate": 86.92, "profit_factor": 33.941, "ic": 0.93, "hit": 86.11, "n": 108, "precision": 0.8113, "recall": 0.9149, "f1": 0.86, "f2": 0.8921, "mcc": 0.7448, "accuracy": 0.8704, "tp": 43, "fp": 10, "tn": 51, "fn": 4}, {"fold": "fold_7", "regime": "Recent mixed/upturn", "sharpe": 14.3797, "sortino": 36.8394, "return_pct": 29.06, "equity": 1290.62, "max_dd": 0.5, "win_rate": 82.73, "profit_factor": 12.92, "ic": 0.8738, "hit": 82.73, "n": 110, "precision": 0.7833, "recall": 0.8868, "f1": 0.8319, "f2": 0.864, "mcc": 0.661, "accuracy": 0.8273, "tp": 47, "fp": 13, "tn": 44, "fn": 6}], "train_sharpe": 10.1836, "train_psr": 1.0, "train_equity": 34406980.0, "train_sortino": 57.5005, "train_return_pct": 3440598.0, "train_max_dd": 1.02, "train_win_rate": 88.21, "train_profit_factor": 30.39, "train_ic": 0.908, "train_hit": 87.85, "train_precision": 0.8715, "train_recall": 0.8995, "train_f1": 0.8853, "train_f2": 0.8938, "train_mcc": 0.7603, "train_accuracy": 0.8801, "train_per_window": [{"fold": "all_train", "regime": "Training data", "sharpe": 10.1836, "sortino": 57.5005, "return_pct": 3440598.0, "equity": 34406980.0, "max_dd": 1.02, "win_rate": 88.21, "profit_factor": 30.39, "ic": 0.908, "hit": 87.85, "n": 2478, "precision": 0.8715, "recall": 0.8995, "f1": 0.8853, "f2": 0.8938, "mcc": 0.7603, "accuracy": 0.8801, "tp": 1146, "fp": 169, "tn": 1035, "fn": 128}], "experiment_num": 218, "status": "DISCARD"}
{"backbone": "catboost", "description": "catboost: Exp1 SOTA baseline (Prokhorenkova 2018)", "config": {"seq_len": 10, "lr": 0.0003, "batch_size": 32, "epochs": 20, "weight_decay": 1e-05, "patience": 5, "grad_clip": 1.0, "warmup_epochs": 0, "huber_delta": 1.0, "head_dropout": 0.1, "seed": 42, "het_loss": false}, "composite": 7.5671, "test_pos_folds": 7, "val_pos_folds": 6, "val_loss": 0.0, "elapsed_sec": 811.2, "timestamp": "2026-04-21T07:26:26", "sharpe": 7.6671, "psr": 1.0, "equity": 17589.41, "sortino": 7.7572, "return_pct": 1658.94, "max_dd": 7.54, "win_rate": 77.71, "profit_factor": 4.521, "ic": 0.6975, "hit": 77.39, "precision": 0.7995, "recall": 0.7297, "f1": 0.763, "f2": 0.7427, "mcc": 0.5535, "accuracy": 0.776, "per_window": [{"fold": "fold_1", "regime": "Pre-crisis upturn + GFC onset", "sharpe": 0.037, "sortino": 0.0421, "return_pct": -0.45, "equity": 995.54, "max_dd": 7.54, "win_rate": 49.02, "profit_factor": 1.009, "ic": 0.178, "hit": 48.54, "n": 103, "precision": 0.5217, "recall": 0.2264, "f1": 0.3158, "f2": 0.2553, "mcc": 0.0077, "accuracy": 0.4951, "tp": 12, "fp": 11, "tn": 39, "fn": 41}, {"fold": "fold_2", "regime": "Post-crash recovery", "sharpe": 0.0823, "sortino": 0.1502, "return_pct": 0.12, "equity": 1001.24, "max_dd": 5.34, "win_rate": 48.6, "profit_factor": 1.013, "ic": -0.0278, "hit": 48.6, "n": 107, "precision": 0.4565, "recall": 0.4118, "f1": 0.433, "f2": 0.42, "mcc": -0.035, "accuracy": 0.486, "tp": 21, "fp": 25, "tn": 31, "fn": 30}, {"fold": "fold_3", "regime": "Eurozone debt plateau", "sharpe": 15.2372, "sortino": 25.0, "return_pct": 47.51, "equity": 1475.12, "max_dd": 1.32, "win_rate": 85.58, "profit_factor": 13.573, "ic": 0.8082, "hit": 83.96, "n": 106, "precision": 0.8448, "recall": 0.8596, "f1": 0.8522, "f2": 0.8566, "mcc": 0.6771, "accuracy": 0.8396, "tp": 49, "fp": 9, "tn": 40, "fn": 8}, {"fold": "fold_4", "regime": "Strong USD downturn", "sharpe": 15.4065, "sortino": 49.4607, "return_pct": 135.33, "equity": 2353.25, "max_dd": 0.56, "win_rate": 90.42, "profit_factor": 26.968, "ic": 0.898, "hit": 89.88, "n": 168, "precision": 0.9487, "recall": 0.8605, "f1": 0.9024, "f2": 0.8768, "mcc": 0.8135, "accuracy": 0.9048, "tp": 74, "fp": 4, "tn": 78, "fn": 12}, {"fold": "fold_5", "regime": "Low-vol plateau", "sharpe": 15.2312, "sortino": 71.4515, "return_pct": 44.12, "equity": 1441.21, "max_dd": 0.23, "win_rate": 84.57, "profit_factor": 22.274, "ic": 0.8986, "hit": 84.57, "n": 162, "precision": 0.84, "recall": 0.8289, "f1": 0.8344, "f2": 0.8311, "mcc": 0.69, "accuracy": 0.8457, "tp": 63, "fp": 12, "tn": 74, "fn": 13}, {"fold": "fold_6", "regime": "EUR crisis downturn", "sharpe": 15.1277, "sortino": 61.7817, "return_pct": 98.72, "equity": 1987.25, "max_dd": 0.43, "win_rate": 81.82, "profit_factor": 16.357, "ic": 0.8774, "hit": 81.82, "n": 165, "precision": 0.8052, "recall": 0.8052, "f1": 0.8052, "f2": 0.8052, "mcc": 0.6347, "accuracy": 0.8182, "tp": 62, "fp": 15, "tn": 73, "fn": 15}, {"fold": "fold_7", "regime": "Recent mixed/upturn", "sharpe": 12.1904, "sortino": 15.7088, "return_pct": 77.49, "equity": 1774.92, "max_dd": 1.64, "win_rate": 85.8, "profit_factor": 9.909, "ic": 0.8446, "hit": 85.8, "n": 162, "precision": 0.8537, "recall": 0.8642, "f1": 0.8589, "f2": 0.8621, "mcc": 0.7161, "accuracy": 0.858, "tp": 70, "fp": 12, "tn": 69, "fn": 11}], "val_sharpe": 8.121, "val_psr": 1.0, "val_equity": 5517.5, "val_sortino": 10.3349, "val_return_pct": 451.75, "val_max_dd": 11.56, "val_win_rate": 74.84, "val_profit_factor": 4.138, "val_ic": 0.6773, "val_hit": 74.35, "val_precision": 0.7057, "val_recall": 0.8082, "val_f1": 0.7535, "val_f2": 0.7854, "val_mcc": 0.5044, "val_accuracy": 0.7487, "val_per_window": [{"fold": "fold_1", "regime": "Pre-crisis upturn + GFC onset", "sharpe": 2.8265, "sortino": 6.0002, "return_pct": 7.2, "equity": 1072.01, "max_dd": 2.28, "win_rate": 49.07, "profit_factor": 1.6, "ic": 0.0497, "hit": 48.62, "n": 109, "precision": 0.4941, "recall": 0.7636, "f1": 0.6, "f2": 0.6885, "mcc": -0.0394, "accuracy": 0.4862, "tp": 42, "fp": 43, "tn": 11, "fn": 13}, {"fold": "fold_2", "regime": "Post-crash recovery", "sharpe": -1.3238, "sortino": -2.1116, "return_pct": -6.46, "equity": 935.37, "max_dd": 11.56, "win_rate": 50.93, "profit_factor": 0.811, "ic": -0.1413, "hit": 50.93, "n": 108, "precision": 0.5781, "recall": 0.5873, "f1": 0.5827, "f2": 0.5854, "mcc": -0.0127, "accuracy": 0.5093, "tp": 37, "fp": 27, "tn": 18, "fn": 26}, {"fold": "fold_3", "regime": "Eurozone debt plateau", "sharpe": 15.1463, "sortino": 42.2629, "return_pct": 55.5, "equity": 1554.96, "max_dd": 0.64, "win_rate": 83.49, "profit_factor": 16.998, "ic": 0.8591, "hit": 81.98, "n": 111, "precision": 0.7544, "recall": 0.9149, "f1": 0.8269, "f2": 0.8776, "mcc": 0.6882, "accuracy": 0.8378, "tp": 43, "fp": 14, "tn": 50, "fn": 4}, {"fold": "fold_4", "regime": "Strong USD downturn", "sharpe": 15.4032, "sortino": 49.6927, "return_pct": 46.65, "equity": 1466.48, "max_dd": 0.59, "win_rate": 87.16, "profit_factor": 22.282, "ic": 0.9302, "hit": 86.36, "n": 110, "precision": 0.8837, "recall": 0.8085, "f1": 0.8444, "f2": 0.8225, "mcc": 0.7392, "accuracy": 0.8727, "tp": 38, "fp": 5, "tn": 58, "fn": 9}, {"fold": "fold_5", "regime": "Low-vol plateau", "sharpe": 14.7722, "sortino": 67.6044, "return_pct": 43.3, "equity": 1432.98, "max_dd": 0.29, "win_rate": 83.04, "profit_factor": 18.675, "ic": 0.915, "hit": 83.04, "n": 112, "precision": 0.7931, "recall": 0.8679, "f1": 0.8288, "f2": 0.8519, "mcc": 0.664, "accuracy": 0.8304, "tp": 46, "fp": 12, "tn": 47, "fn": 7}, {"fold": "fold_6", "regime": "EUR crisis downturn", "sharpe": 15.9013, "sortino": 96.7323, "return_pct": 29.27, "equity": 1292.66, "max_dd": 0.15, "win_rate": 87.85, "profit_factor": 35.386, "ic": 0.9287, "hit": 87.04, "n": 108, "precision": 0.84, "recall": 0.8936, "f1": 0.866, "f2": 0.8824, "mcc": 0.7581, "accuracy": 0.8796, "tp": 42, "fp": 8, "tn": 53, "fn": 5}, {"fold": "fold_7", "regime": "Recent mixed/upturn", "sharpe": 15.3782, "sortino": 61.1785, "return_pct": 30.27, "equity": 1302.69, "max_dd": 0.24, "win_rate": 81.82, "profit_factor": 16.777, "ic": 0.8752, "hit": 81.82, "n": 110, "precision": 0.7705, "recall": 0.8868, "f1": 0.8246, "f2": 0.8608, "mcc": 0.6446, "accuracy": 0.8182, "tp": 47, "fp": 14, "tn": 43, "fn": 6}], "train_sharpe": 11.1004, "train_psr": 1.0, "train_equity": 65572460.0, "train_sortino": 229.1352, "train_return_pct": 6557146.0, "train_max_dd": 0.2, "train_win_rate": 96.27, "train_profit_factor": 315.632, "train_ic": 0.9905, "train_hit": 95.88, "train_precision": 0.9587, "train_recall": 0.9655, "train_f1": 0.9621, "train_f2": 0.9641, "train_mcc": 0.9217, "train_accuracy": 0.9609, "train_per_window": [{"fold": "all_train", "regime": "Training data", "sharpe": 11.1004, "sortino": 229.1352, "return_pct": 6557146.0, "equity": 65572460.0, "max_dd": 0.2, "win_rate": 96.27, "profit_factor": 315.632, "ic": 0.9905, "hit": 95.88, "n": 2478, "precision": 0.9587, "recall": 0.9655, "f1": 0.9621, "f2": 0.9641, "mcc": 0.9217, "accuracy": 0.9609, "tp": 1230, "fp": 53, "tn": 1151, "fn": 44}], "experiment_num": 219, "status": "DISCARD"}
