{"backbone": "dlinear", "description": "dlinear: Exp1 SOTA baseline seq=10", "config": {"seq_len": 10, "lr": 0.001, "batch_size": 32, "epochs": 100, "weight_decay": 0.0001, "patience": 20, "grad_clip": 1.0, "warmup_epochs": 0, "huber_delta": 1.0, "head_dropout": 0.15, "seed": 42, "het_loss": false}, "composite": 3.158, "test_pos_folds": 7, "val_pos_folds": 6, "val_loss": 5.1e-05, "elapsed_sec": 41.6, "timestamp": "2026-04-21T12:26:54", "sharpe": 3.258, "psr": 1.0, "equity": 3719.23, "sortino": 5.5605, "return_pct": 271.92, "max_dd": 8.12, "win_rate": 62.02, "profit_factor": 1.836, "ic": 0.2428, "hit": 61.77, "aleatoric_mean": 9e-06, "epistemic_mean": 1.7e-05, "confidence_mean": 1.0, "precision": 0.6118, "recall": 0.6258, "f1": 0.6187, "f2": 0.6229, "mcc": 0.2376, "accuracy": 0.6187, "per_window": [{"fold": "fold_1", "regime": "Pre-crisis upturn + GFC onset", "sharpe": 1.1645, "sortino": 3.4699, "return_pct": 8.6, "equity": 1086.04, "max_dd": 8.12, "win_rate": 49.02, "profit_factor": 1.318, "ic": -0.0597, "hit": 48.54, "n": 103, "precision": 0.5, "recall": 0.4151, "f1": 0.4536, "f2": 0.4297, "mcc": -0.0252, "accuracy": 0.4854, "tp": 22, "fp": 22, "tn": 28, "fn": 31, "aleatoric_mean": 1e-05, "epistemic_mean": 2.1e-05, "confidence_mean": 1.0, "aleatoric_std": 6e-06, "epistemic_std": 1.3e-05}, {"fold": "fold_2", "regime": "Post-crash recovery", "sharpe": 0.8875, "sortino": 1.518, "return_pct": 4.06, "equity": 1040.63, "max_dd": 6.41, "win_rate": 56.07, "profit_factor": 1.149, "ic": 0.0705, "hit": 56.07, "n": 107, "precision": 0.5345, "recall": 0.6078, "f1": 0.5688, "f2": 0.5916, "mcc": 0.126, "accuracy": 0.5607, "tp": 31, "fp": 27, "tn": 29, "fn": 20, "aleatoric_mean": 8e-06, "epistemic_mean": 1.7e-05, "confidence_mean": 1.0, "aleatoric_std": 4e-06, "epistemic_std": 8e-06}, {"fold": "fold_3", "regime": "Eurozone debt plateau", "sharpe": 6.0663, "sortino": 11.7401, "return_pct": 22.1, "equity": 1221.0, "max_dd": 2.29, "win_rate": 67.31, "profit_factor": 2.602, "ic": 0.3178, "hit": 66.04, "n": 106, "precision": 0.6981, "recall": 0.6491, "f1": 0.6727, "f2": 0.6584, "mcc": 0.3217, "accuracy": 0.6604, "tp": 37, "fp": 16, "tn": 33, "fn": 20, "aleatoric_mean": 1e-05, "epistemic_mean": 2e-05, "confidence_mean": 1.0, "aleatoric_std": 5e-06, "epistemic_std": 1.1e-05}, {"fold": "fold_4", "regime": "Strong USD downturn", "sharpe": 4.5114, "sortino": 7.1405, "return_pct": 39.54, "equity": 1395.37, "max_dd": 5.22, "win_rate": 64.07, "profit_factor": 2.147, "ic": 0.3405, "hit": 63.69, "n": 168, "precision": 0.6667, "recall": 0.6047, "f1": 0.6341, "f2": 0.6161, "mcc": 0.2882, "accuracy": 0.6429, "tp": 52, "fp": 26, "tn": 56, "fn": 34, "aleatoric_mean": 1.1e-05, "epistemic_mean": 2.2e-05, "confidence_mean": 1.0, "aleatoric_std": 6e-06, "epistemic_std": 1.3e-05}, {"fold": "fold_5", "regime": "Low-vol plateau", "sharpe": 4.5863, "sortino": 8.3012, "return_pct": 15.72, "equity": 1157.2, "max_dd": 1.69, "win_rate": 61.73, "profit_factor": 2.157, "ic": 0.4516, "hit": 61.73, "n": 162, "precision": 0.566, "recall": 0.7895, "f1": 0.6593, "f2": 0.7317, "mcc": 0.2671, "accuracy": 0.6173, "tp": 60, "fp": 46, "tn": 40, "fn": 16, "aleatoric_mean": 4e-06, "epistemic_mean": 9e-06, "confidence_mean": 1.0, "aleatoric_std": 2e-06, "epistemic_std": 4e-06}, {"fold": "fold_6", "regime": "EUR crisis downturn", "sharpe": 5.0365, "sortino": 8.8637, "return_pct": 34.9, "equity": 1348.98, "max_dd": 2.8, "win_rate": 63.64, "profit_factor": 2.267, "ic": 0.2967, "hit": 63.64, "n": 165, "precision": 0.6349, "recall": 0.5195, "f1": 0.5714, "f2": 0.5391, "mcc": 0.2651, "accuracy": 0.6364, "tp": 40, "fp": 23, "tn": 65, "fn": 37, "aleatoric_mean": 1.1e-05, "epistemic_mean": 2.3e-05, "confidence_mean": 1.0, "aleatoric_std": 7e-06, "epistemic_std": 1.4e-05}, {"fold": "fold_7", "regime": "Recent mixed/upturn", "sharpe": 3.716, "sortino": 4.4593, "return_pct": 23.74, "equity": 1237.35, "max_dd": 7.44, "win_rate": 67.28, "profit_factor": 1.88, "ic": 0.3558, "hit": 67.28, "n": 162, "precision": 0.6556, "recall": 0.7284, "f1": 0.6901, "f2": 0.7126, "mcc": 0.3478, "accuracy": 0.6728, "tp": 59, "fp": 31, "tn": 50, "fn": 22, "aleatoric_mean": 6e-06, "epistemic_mean": 1.1e-05, "confidence_mean": 1.0, "aleatoric_std": 3e-06, "epistemic_std": 6e-06}], "val_sharpe": 3.3043, "val_psr": 1.0, "val_equity": 2136.35, "val_sortino": 5.4541, "val_return_pct": 113.64, "val_max_dd": 7.42, "val_win_rate": 57.93, "val_profit_factor": 1.752, "val_ic": 0.2234, "val_hit": 57.55, "val_aleatoric_mean": 6e-06, "val_epistemic_mean": 1.2e-05, "val_confidence_mean": 1.0, "val_precision": 0.5469, "val_recall": 0.6548, "val_f1": 0.596, "val_f2": 0.6299, "val_mcc": 0.1649, "val_accuracy": 0.5781, "val_per_window": [{"fold": "fold_1", "regime": "Pre-crisis upturn + GFC onset", "sharpe": -0.1084, "sortino": -0.1659, "return_pct": -0.35, "equity": 996.53, "max_dd": 3.51, "win_rate": 47.22, "profit_factor": 0.982, "ic": -0.0922, "hit": 46.79, "n": 109, "precision": 0.4839, "recall": 0.8182, "f1": 0.6081, "f2": 0.7188, "mcc": -0.0999, "accuracy": 0.4679, "tp": 45, "fp": 48, "tn": 6, "fn": 10, "aleatoric_mean": 8e-06, "epistemic_mean": 1.7e-05, "confidence_mean": 1.0, "aleatoric_std": 1.1e-05, "epistemic_std": 2.1e-05}, {"fold": "fold_2", "regime": "Post-crash recovery", "sharpe": 0.1719, "sortino": 0.3143, "return_pct": 0.56, "equity": 1005.62, "max_dd": 7.42, "win_rate": 43.52, "profit_factor": 1.028, "ic": -0.0604, "hit": 43.52, "n": 108, "precision": 0.5357, "recall": 0.2381, "f1": 0.3297, "f2": 0.2679, "mcc": -0.0571, "accuracy": 0.4352, "tp": 15, "fp": 13, "tn": 32, "fn": 48, "aleatoric_mean": 7e-06, "epistemic_mean": 1.4e-05, "confidence_mean": 1.0, "aleatoric_std": 5e-06, "epistemic_std": 9e-06}, {"fold": "fold_3", "regime": "Eurozone debt plateau", "sharpe": 5.5281, "sortino": 11.9388, "return_pct": 23.29, "equity": 1232.86, "max_dd": 2.41, "win_rate": 63.3, "profit_factor": 2.469, "ic": 0.4249, "hit": 62.16, "n": 111, "precision": 0.5484, "recall": 0.7234, "f1": 0.6239, "f2": 0.68, "mcc": 0.2845, "accuracy": 0.6306, "tp": 34, "fp": 28, "tn": 36, "fn": 13, "aleatoric_mean": 8e-06, "epistemic_mean": 1.6e-05, "confidence_mean": 1.0, "aleatoric_std": 4e-06, "epistemic_std": 7e-06}, {"fold": "fold_4", "regime": "Strong USD downturn", "sharpe": 2.8206, "sortino": 4.2316, "return_pct": 9.98, "equity": 1099.82, "max_dd": 2.88, "win_rate": 58.72, "profit_factor": 1.596, "ic": 0.2097, "hit": 58.18, "n": 110, "precision": 0.5085, "recall": 0.6383, "f1": 0.566, "f2": 0.6073, "mcc": 0.1766, "accuracy": 0.5818, "tp": 30, "fp": 29, "tn": 34, "fn": 17, "aleatoric_mean": 5e-06, "epistemic_mean": 1.1e-05, "confidence_mean": 1.0, "aleatoric_std": 2e-06, "epistemic_std": 4e-06}, {"fold": "fold_5", "regime": "Low-vol plateau", "sharpe": 8.1004, "sortino": 15.364, "return_pct": 27.08, "equity": 1270.76, "max_dd": 1.82, "win_rate": 70.54, "profit_factor": 3.992, "ic": 0.5611, "hit": 70.54, "n": 112, "precision": 0.6471, "recall": 0.8302, "f1": 0.7273, "f2": 0.7857, "mcc": 0.4329, "accuracy": 0.7054, "tp": 44, "fp": 24, "tn": 35, "fn": 9, "aleatoric_mean": 5e-06, "epistemic_mean": 1.1e-05, "confidence_mean": 1.0, "aleatoric_std": 4e-06, "epistemic_std": 7e-06}, {"fold": "fold_6", "regime": "EUR crisis downturn", "sharpe": 6.259, "sortino": 12.7505, "return_pct": 14.2, "equity": 1141.97, "max_dd": 1.22, "win_rate": 66.36, "profit_factor": 2.92, "ic": 0.4786, "hit": 65.74, "n": 108, "precision": 0.6222, "recall": 0.5957, "f1": 0.6087, "f2": 0.6009, "mcc": 0.3188, "accuracy": 0.6667, "tp": 28, "fp": 17, "tn": 44, "fn": 19, "aleatoric_mean": 4e-06, "epistemic_mean": 8e-06, "confidence_mean": 1.0, "aleatoric_std": 1e-06, "epistemic_std": 2e-06}, {"fold": "fold_7", "regime": "Recent mixed/upturn", "sharpe": 3.4442, "sortino": 7.2332, "return_pct": 8.34, "equity": 1083.42, "max_dd": 2.82, "win_rate": 55.45, "profit_factor": 1.741, "ic": 0.2558, "hit": 55.45, "n": 110, "precision": 0.5244, "recall": 0.8113, "f1": 0.637, "f2": 0.7313, "mcc": 0.1458, "accuracy": 0.5545, "tp": 43, "fp": 39, "tn": 18, "fn": 10, "aleatoric_mean": 4e-06, "epistemic_mean": 8e-06, "confidence_mean": 1.0, "aleatoric_std": 2e-06, "epistemic_std": 4e-06}], "train_sharpe": 6.3472, "train_psr": 1.0, "train_equity": 1286212.88, "train_sortino": 18.7244, "train_return_pct": 128521.29, "train_max_dd": 3.56, "train_win_rate": 70.42, "train_profit_factor": 4.614, "train_ic": 0.6031, "train_hit": 70.14, "train_precision": 0.684, "train_recall": 0.7865, "train_f1": 0.7317, "train_f2": 0.7636, "train_mcc": 0.4086, "train_accuracy": 0.7034, "train_per_window": [{"fold": "all_train", "regime": "Training data", "sharpe": 6.3472, "sortino": 18.7244, "return_pct": 128521.29, "equity": 1286212.88, "max_dd": 3.56, "win_rate": 70.42, "profit_factor": 4.614, "ic": 0.6031, "hit": 70.14, "n": 2478, "precision": 0.684, "recall": 0.7865, "f1": 0.7317, "f2": 0.7636, "mcc": 0.4086, "accuracy": 0.7034, "tp": 1002, "fp": 463, "tn": 741, "fn": 272}], "experiment_num": 237, "status": "DISCARD"}
{"backbone": "dlinear", "description": "dlinear: Exp2 seq=60 (GBM-winning)", "config": {"seq_len": 60, "lr": 0.001, "batch_size": 32, "epochs": 100, "weight_decay": 0.0001, "patience": 20, "grad_clip": 1.0, "warmup_epochs": 0, "huber_delta": 1.0, "head_dropout": 0.15, "seed": 42, "het_loss": false}, "composite": -0.2546, "test_pos_folds": 7, "val_pos_folds": 4, "val_loss": 0.000109, "elapsed_sec": 18.0, "timestamp": "2026-04-21T12:27:24", "sharpe": 1.1245, "psr": 0.9623, "equity": 1285.28, "sortino": 1.7674, "return_pct": 28.53, "max_dd": 5.44, "win_rate": 53.8, "profit_factor": 1.208, "ic": 0.1077, "hit": 53.45, "aleatoric_mean": 0.00015, "epistemic_mean": 0.000299, "confidence_mean": 0.9996, "precision": 0.5401, "recall": 0.4774, "f1": 0.5068, "f2": 0.4888, "mcc": 0.0754, "accuracy": 0.5377, "per_window": [{"fold": "fold_1", "regime": "Pre-crisis upturn + GFC onset", "sharpe": 0.298, "sortino": 0.5847, "return_pct": 0.53, "equity": 1005.25, "max_dd": 5.37, "win_rate": 50.0, "profit_factor": 1.047, "ic": 0.0189, "hit": 49.06, "n": 53, "precision": 0.5, "recall": 0.5385, "f1": 0.5185, "f2": 0.5303, "mcc": 0.02, "accuracy": 0.5094, "tp": 14, "fp": 14, "tn": 13, "fn": 12, "aleatoric_mean": 8.6e-05, "epistemic_mean": 0.000173, "confidence_mean": 0.9997, "aleatoric_std": 3.4e-05, "epistemic_std": 6.8e-05}, {"fold": "fold_2", "regime": "Post-crash recovery", "sharpe": 1.533, "sortino": 2.3268, "return_pct": 4.27, "equity": 1042.7, "max_dd": 4.7, "win_rate": 63.16, "profit_factor": 1.279, "ic": 0.3669, "hit": 63.16, "n": 57, "precision": 0.5962, "recall": 1.0, "f1": 0.747, "f2": 0.8807, "mcc": 0.3386, "accuracy": 0.6316, "tp": 31, "fp": 21, "tn": 5, "fn": 0, "aleatoric_mean": 0.000138, "epistemic_mean": 0.000276, "confidence_mean": 0.9996, "aleatoric_std": 7.3e-05, "epistemic_std": 0.000146}, {"fold": "fold_3", "regime": "Eurozone debt plateau", "sharpe": 1.1033, "sortino": 1.7706, "return_pct": 1.9, "equity": 1019.0, "max_dd": 2.47, "win_rate": 48.15, "profit_factor": 1.192, "ic": 0.101, "hit": 46.43, "n": 56, "precision": 0.5556, "recall": 0.4688, "f1": 0.5085, "f2": 0.4839, "mcc": -0.0309, "accuracy": 0.4821, "tp": 15, "fp": 12, "tn": 12, "fn": 17, "aleatoric_mean": 0.000256, "epistemic_mean": 0.000511, "confidence_mean": 0.9992, "aleatoric_std": 0.000182, "epistemic_std": 0.000365}, {"fold": "fold_4", "regime": "Strong USD downturn", "sharpe": 2.1175, "sortino": 3.9385, "return_pct": 10.9, "equity": 1109.03, "max_dd": 3.91, "win_rate": 53.85, "profit_factor": 1.427, "ic": 0.1613, "hit": 53.39, "n": 118, "precision": 0.5397, "recall": 0.5667, "f1": 0.5528, "f2": 0.5611, "mcc": 0.0668, "accuracy": 0.5339, "tp": 34, "fp": 29, "tn": 29, "fn": 26, "aleatoric_mean": 0.00014, "epistemic_mean": 0.000279, "confidence_mean": 0.9996, "aleatoric_std": 6.7e-05, "epistemic_std": 0.000134}, {"fold": "fold_5", "regime": "Low-vol plateau", "sharpe": 0.3929, "sortino": 0.5536, "return_pct": 0.83, "equity": 1008.31, "max_dd": 3.48, "win_rate": 50.89, "profit_factor": 1.068, "ic": 0.0742, "hit": 50.89, "n": 112, "precision": 0.4286, "recall": 0.2353, "f1": 0.3038, "f2": 0.2586, "mcc": -0.0311, "accuracy": 0.5089, "tp": 12, "fp": 16, "tn": 45, "fn": 39, "aleatoric_mean": 6.4e-05, "epistemic_mean": 0.000128, "confidence_mean": 0.9998, "aleatoric_std": 2e-05, "epistemic_std": 4e-05}, {"fold": "fold_6", "regime": "EUR crisis downturn", "sharpe": 1.2287, "sortino": 1.9012, "return_pct": 5.44, "equity": 1054.41, "max_dd": 4.26, "win_rate": 56.52, "profit_factor": 1.214, "ic": -0.0263, "hit": 56.52, "n": 115, "precision": 0.5455, "recall": 0.3396, "f1": 0.4186, "f2": 0.3673, "mcc": 0.1076, "accuracy": 0.5652, "tp": 18, "fp": 15, "tn": 47, "fn": 35, "aleatoric_mean": 0.000266, "epistemic_mean": 0.000532, "confidence_mean": 0.9992, "aleatoric_std": 0.000181, "epistemic_std": 0.000361}, {"fold": "fold_7", "regime": "Recent mixed/upturn", "sharpe": 0.539, "sortino": 0.8707, "return_pct": 2.06, "equity": 1020.57, "max_dd": 5.44, "win_rate": 53.57, "profit_factor": 1.097, "ic": 0.0923, "hit": 53.57, "n": 112, "precision": 0.5581, "recall": 0.4211, "f1": 0.48, "f2": 0.4428, "mcc": 0.0777, "accuracy": 0.5357, "tp": 24, "fp": 19, "tn": 36, "fn": 33, "aleatoric_mean": 0.000109, "epistemic_mean": 0.000217, "confidence_mean": 0.9997, "aleatoric_std": 6.3e-05, "epistemic_std": 0.000126}], "val_sharpe": 0.0454, "val_psr": 0.5233, "val_equity": 1000.96, "val_sortino": 0.0743, "val_return_pct": 0.1, "val_max_dd": 10.29, "val_win_rate": 47.12, "val_profit_factor": 1.008, "val_ic": -0.0106, "val_hit": 46.89, "val_aleatoric_mean": 8.7e-05, "val_epistemic_mean": 0.000175, "val_confidence_mean": 0.9997, "val_precision": 0.4675, "val_recall": 0.5243, "val_f1": 0.4943, "val_f2": 0.5118, "val_mcc": -0.0562, "val_accuracy": 0.4713, "val_per_window": [{"fold": "fold_1", "regime": "Pre-crisis upturn + GFC onset", "sharpe": 2.4125, "sortino": 3.879, "return_pct": 3.8, "equity": 1037.99, "max_dd": 2.89, "win_rate": 55.17, "profit_factor": 1.488, "ic": 0.033, "hit": 54.24, "n": 59, "precision": 0.537, "recall": 0.9355, "f1": 0.6824, "f2": 0.8146, "mcc": 0.0764, "accuracy": 0.5424, "tp": 29, "fp": 25, "tn": 3, "fn": 2, "aleatoric_mean": 0.00015, "epistemic_mean": 0.000299, "confidence_mean": 0.9996, "aleatoric_std": 0.000163, "epistemic_std": 0.000326}, {"fold": "fold_2", "regime": "Post-crash recovery", "sharpe": -0.6053, "sortino": -1.0161, "return_pct": -1.26, "equity": 987.38, "max_dd": 3.43, "win_rate": 46.55, "profit_factor": 0.907, "ic": -0.2046, "hit": 46.55, "n": 58, "precision": 0.5, "recall": 0.6774, "f1": 0.5753, "f2": 0.6325, "mcc": -0.112, "accuracy": 0.4655, "tp": 21, "fp": 21, "tn": 6, "fn": 10, "aleatoric_mean": 0.000101, "epistemic_mean": 0.000201, "confidence_mean": 0.9997, "aleatoric_std": 4.3e-05, "epistemic_std": 8.6e-05}, {"fold": "fold_3", "regime": "Eurozone debt plateau", "sharpe": 0.5421, "sortino": 1.1519, "return_pct": 1.17, "equity": 1011.72, "max_dd": 3.34, "win_rate": 42.62, "profit_factor": 1.095, "ic": -0.0246, "hit": 42.62, "n": 61, "precision": 0.413, "recall": 0.7037, "f1": 0.5205, "f2": 0.6169, "mcc": -0.1043, "accuracy": 0.4262, "tp": 19, "fp": 27, "tn": 7, "fn": 8, "aleatoric_mean": 0.000105, "epistemic_mean": 0.00021, "confidence_mean": 0.9997, "aleatoric_std": 4.5e-05, "epistemic_std": 9e-05}, {"fold": "fold_4", "regime": "Strong USD downturn", "sharpe": -1.6191, "sortino": -2.5308, "return_pct": -3.56, "equity": 964.37, "max_dd": 5.9, "win_rate": 46.67, "profit_factor": 0.78, "ic": -0.2287, "hit": 46.67, "n": 60, "precision": 0.3846, "recall": 0.1724, "f1": 0.2381, "f2": 0.1938, "mcc": -0.1039, "accuracy": 0.4667, "tp": 5, "fp": 8, "tn": 23, "fn": 24, "aleatoric_mean": 6.6e-05, "epistemic_mean": 0.000133, "confidence_mean": 0.9998, "aleatoric_std": 2.9e-05, "epistemic_std": 5.8e-05}, {"fold": "fold_5", "regime": "Low-vol plateau", "sharpe": -1.4519, "sortino": -2.3924, "return_pct": -2.54, "equity": 974.6, "max_dd": 5.09, "win_rate": 45.16, "profit_factor": 0.79, "ic": -0.1005, "hit": 45.16, "n": 62, "precision": 0.4375, "recall": 0.2188, "f1": 0.2917, "f2": 0.2431, "mcc": -0.0928, "accuracy": 0.4516, "tp": 7, "fp": 9, "tn": 21, "fn": 25, "aleatoric_mean": 6e-05, "epistemic_mean": 0.00012, "confidence_mean": 0.9998, "aleatoric_std": 2e-05, "epistemic_std": 3.9e-05}, {"fold": "fold_6", "regime": "EUR crisis downturn", "sharpe": 0.4982, "sortino": 0.8073, "return_pct": 0.5, "equity": 1004.97, "max_dd": 2.79, "win_rate": 49.12, "profit_factor": 1.085, "ic": 0.0994, "hit": 48.28, "n": 58, "precision": 0.381, "recall": 0.3333, "f1": 0.3556, "f2": 0.3419, "mcc": -0.0502, "accuracy": 0.5, "tp": 8, "fp": 13, "tn": 21, "fn": 16, "aleatoric_mean": 5.6e-05, "epistemic_mean": 0.000111, "confidence_mean": 0.9998, "aleatoric_std": 2e-05, "epistemic_std": 3.9e-05}, {"fold": "fold_7", "regime": "Recent mixed/upturn", "sharpe": 1.7391, "sortino": 3.8306, "return_pct": 2.2, "equity": 1022.02, "max_dd": 1.78, "win_rate": 45.0, "profit_factor": 1.328, "ic": -0.0485, "hit": 45.0, "n": 60, "precision": 0.4872, "recall": 0.5938, "f1": 0.5352, "f2": 0.5689, "mcc": -0.1261, "accuracy": 0.45, "tp": 19, "fp": 20, "tn": 8, "fn": 13, "aleatoric_mean": 7.5e-05, "epistemic_mean": 0.000151, "confidence_mean": 0.9998, "aleatoric_std": 3.6e-05, "epistemic_std": 7.2e-05}], "train_sharpe": 4.0544, "train_psr": 1.0, "train_equity": 15809.64, "train_sortino": 12.4257, "train_return_pct": 1480.96, "train_max_dd": 3.83, "train_win_rate": 60.87, "train_profit_factor": 2.649, "train_ic": 0.3808, "train_hit": 60.56, "train_precision": 0.6642, "train_recall": 0.4965, "train_f1": 0.5682, "train_f2": 0.5229, "train_mcc": 0.2316, "train_accuracy": 0.6085, "train_per_window": [{"fold": "all_train", "regime": "Training data", "sharpe": 4.0544, "sortino": 12.4257, "return_pct": 1480.96, "equity": 15809.64, "max_dd": 3.83, "win_rate": 60.87, "profit_factor": 2.649, "ic": 0.3808, "hit": 60.56, "n": 1382, "precision": 0.6642, "recall": 0.4965, "f1": 0.5682, "f2": 0.5229, "mcc": 0.2316, "accuracy": 0.6085, "tp": 356, "fp": 180, "tn": 485, "fn": 361}], "experiment_num": 238, "status": "DISCARD"}
