{"backbone": "mamba", "description": "mamba: Exp22 dmamba expand=4 head_dropout=0.2 (Srivastava 2014 stronger reg)", "config": {"seq_len": 10, "lr": 0.0005, "batch_size": 32, "epochs": 100, "weight_decay": 0.1, "patience": 20, "grad_clip": 1.0, "warmup_epochs": 10, "huber_delta": 1.0, "head_dropout": 0.2, "seed": 42, "mamba_variant": "dmamba", "mamba_expand": 4, "het_loss": false}, "composite": 3.0213, "test_pos_folds": 6, "val_pos_folds": 5, "val_loss": 3.1e-05, "elapsed_sec": 225.6, "timestamp": "2026-04-20T02:23:52", "sharpe": 4.4374, "psr": 1.0, "equity": 5850.3, "sortino": 8.4319, "return_pct": 485.03, "max_dd": 5.94, "win_rate": 62.23, "profit_factor": 2.304, "ic": 0.3477, "hit": 61.97, "aleatoric_mean": 4.3e-05, "epistemic_mean": 8.6e-05, "confidence_mean": 0.9999, "precision": 0.6081, "recall": 0.6549, "f1": 0.6306, "f2": 0.645, "mcc": 0.2428, "accuracy": 0.6208, "per_window": [{"fold": "fold_1", "regime": "Pre-crisis upturn + GFC onset", "sharpe": 2.4262, "sortino": 7.6769, "return_pct": 19.48, "equity": 1194.78, "max_dd": 4.77, "win_rate": 49.02, "profit_factor": 1.79, "ic": -0.0063, "hit": 48.54, "n": 103, "precision": 0.5, "recall": 0.6981, "f1": 0.5827, "f2": 0.6469, "mcc": -0.0465, "accuracy": 0.4854, "tp": 37, "fp": 37, "tn": 13, "fn": 16, "aleatoric_mean": 6.7e-05, "epistemic_mean": 0.000133, "confidence_mean": 0.9998, "aleatoric_std": 6.6e-05, "epistemic_std": 0.000133}, {"fold": "fold_2", "regime": "Post-crash recovery", "sharpe": -0.0895, "sortino": -0.157, "return_pct": -0.7, "equity": 993.02, "max_dd": 5.81, "win_rate": 49.53, "profit_factor": 0.986, "ic": 0.0278, "hit": 49.53, "n": 107, "precision": 0.4776, "recall": 0.6275, "f1": 0.5424, "f2": 0.5904, "mcc": 0.0025, "accuracy": 0.4953, "tp": 32, "fp": 35, "tn": 21, "fn": 19, "aleatoric_mean": 3.9e-05, "epistemic_mean": 7.8e-05, "confidence_mean": 0.9999, "aleatoric_std": 1.7e-05, "epistemic_std": 3.4e-05}, {"fold": "fold_3", "regime": "Eurozone debt plateau", "sharpe": 6.7925, "sortino": 13.5973, "return_pct": 24.63, "equity": 1246.32, "max_dd": 2.24, "win_rate": 67.31, "profit_factor": 2.923, "ic": 0.5198, "hit": 66.04, "n": 106, "precision": 0.7115, "recall": 0.6491, "f1": 0.6789, "f2": 0.6607, "mcc": 0.3421, "accuracy": 0.6698, "tp": 37, "fp": 15, "tn": 34, "fn": 20, "aleatoric_mean": 5.7e-05, "epistemic_mean": 0.000113, "confidence_mean": 0.9998, "aleatoric_std": 3.7e-05, "epistemic_std": 7.5e-05}, {"fold": "fold_4", "regime": "Strong USD downturn", "sharpe": 5.6935, "sortino": 9.6253, "return_pct": 51.06, "equity": 1510.6, "max_dd": 3.17, "win_rate": 64.67, "profit_factor": 2.637, "ic": 0.4604, "hit": 64.29, "n": 168, "precision": 0.6585, "recall": 0.6279, "f1": 0.6429, "f2": 0.6338, "mcc": 0.2864, "accuracy": 0.6429, "tp": 54, "fp": 28, "tn": 54, "fn": 32, "aleatoric_mean": 5.1e-05, "epistemic_mean": 0.000102, "confidence_mean": 0.9998, "aleatoric_std": 4e-05, "epistemic_std": 8e-05}, {"fold": "fold_5", "regime": "Low-vol plateau", "sharpe": 2.8646, "sortino": 4.7738, "return_pct": 9.76, "equity": 1097.58, "max_dd": 1.44, "win_rate": 58.02, "profit_factor": 1.613, "ic": 0.2682, "hit": 58.02, "n": 162, "precision": 0.5488, "recall": 0.5921, "f1": 0.5696, "f2": 0.5829, "mcc": 0.1616, "accuracy": 0.5802, "tp": 45, "fp": 37, "tn": 49, "fn": 31, "aleatoric_mean": 2.4e-05, "epistemic_mean": 4.7e-05, "confidence_mean": 0.9999, "aleatoric_std": 9e-06, "epistemic_std": 1.9e-05}, {"fold": "fold_6", "regime": "EUR crisis downturn", "sharpe": 8.0583, "sortino": 15.4615, "return_pct": 56.76, "equity": 1567.61, "max_dd": 1.93, "win_rate": 67.27, "profit_factor": 3.768, "ic": 0.5328, "hit": 67.27, "n": 165, "precision": 0.6769, "recall": 0.5714, "f1": 0.6197, "f2": 0.5898, "mcc": 0.3398, "accuracy": 0.6727, "tp": 44, "fp": 21, "tn": 67, "fn": 33, "aleatoric_mean": 4.3e-05, "epistemic_mean": 8.6e-05, "confidence_mean": 0.9999, "aleatoric_std": 2.8e-05, "epistemic_std": 5.6e-05}, {"fold": "fold_7", "regime": "Recent mixed/upturn", "sharpe": 7.9282, "sortino": 13.1424, "return_pct": 52.22, "equity": 1522.23, "max_dd": 2.31, "win_rate": 72.22, "profit_factor": 3.989, "ic": 0.5215, "hit": 72.22, "n": 162, "precision": 0.6875, "recall": 0.8148, "f1": 0.7458, "f2": 0.7857, "mcc": 0.4523, "accuracy": 0.7222, "tp": 66, "fp": 30, "tn": 51, "fn": 15, "aleatoric_mean": 3.2e-05, "epistemic_mean": 6.4e-05, "confidence_mean": 0.9999, "aleatoric_std": 1.4e-05, "epistemic_std": 2.9e-05}], "val_sharpe": 3.3213, "val_psr": 1.0, "val_equity": 2144.45, "val_sortino": 5.2068, "val_return_pct": 114.44, "val_max_dd": 19.48, "val_win_rate": 59.37, "val_profit_factor": 1.757, "val_ic": 0.3008, "val_hit": 58.98, "val_aleatoric_mean": 3e-05, "val_epistemic_mean": 6.1e-05, "val_confidence_mean": 0.9999, "val_precision": 0.5586, "val_recall": 0.6795, "val_f1": 0.6131, "val_f2": 0.6513, "val_mcc": 0.1953, "val_accuracy": 0.5924, "val_per_window": [{"fold": "fold_1", "regime": "Pre-crisis upturn + GFC onset", "sharpe": -1.5492, "sortino": -2.5006, "return_pct": -3.89, "equity": 961.1, "max_dd": 6.26, "win_rate": 48.15, "profit_factor": 0.773, "ic": -0.0758, "hit": 47.71, "n": 109, "precision": 0.4872, "recall": 0.6909, "f1": 0.5714, "f2": 0.6376, "mcc": -0.0552, "accuracy": 0.4771, "tp": 38, "fp": 40, "tn": 14, "fn": 17, "aleatoric_mean": 3.1e-05, "epistemic_mean": 6.3e-05, "confidence_mean": 0.9999, "aleatoric_std": 3.4e-05, "epistemic_std": 6.7e-05}, {"fold": "fold_2", "regime": "Post-crash recovery", "sharpe": -2.8705, "sortino": -4.5847, "return_pct": -13.06, "equity": 869.43, "max_dd": 16.47, "win_rate": 40.74, "profit_factor": 0.635, "ic": -0.103, "hit": 40.74, "n": 108, "precision": 0.4923, "recall": 0.5079, "f1": 0.5, "f2": 0.5047, "mcc": -0.227, "accuracy": 0.4074, "tp": 32, "fp": 33, "tn": 12, "fn": 31, "aleatoric_mean": 4.1e-05, "epistemic_mean": 8.1e-05, "confidence_mean": 0.9999, "aleatoric_std": 2.1e-05, "epistemic_std": 4.2e-05}, {"fold": "fold_3", "regime": "Eurozone debt plateau", "sharpe": 8.7531, "sortino": 23.4216, "return_pct": 36.1, "equity": 1361.01, "max_dd": 1.13, "win_rate": 68.81, "profit_factor": 4.287, "ic": 0.5762, "hit": 67.57, "n": 111, "precision": 0.62, "recall": 0.6596, "f1": 0.6392, "f2": 0.6513, "mcc": 0.3602, "accuracy": 0.6847, "tp": 31, "fp": 19, "tn": 45, "fn": 16, "aleatoric_mean": 3.5e-05, "epistemic_mean": 7e-05, "confidence_mean": 0.9999, "aleatoric_std": 1.7e-05, "epistemic_std": 3.3e-05}, {"fold": "fold_4", "regime": "Strong USD downturn", "sharpe": 4.936, "sortino": 11.1157, "return_pct": 17.64, "equity": 1176.39, "max_dd": 1.66, "win_rate": 59.63, "profit_factor": 2.277, "ic": 0.4127, "hit": 59.09, "n": 110, "precision": 0.5152, "recall": 0.7234, "f1": 0.6018, "f2": 0.6693, "mcc": 0.2176, "accuracy": 0.5909, "tp": 34, "fp": 32, "tn": 31, "fn": 13, "aleatoric_mean": 2.8e-05, "epistemic_mean": 5.6e-05, "confidence_mean": 0.9999, "aleatoric_std": 1.4e-05, "epistemic_std": 2.8e-05}, {"fold": "fold_5", "regime": "Low-vol plateau", "sharpe": 6.3509, "sortino": 11.604, "return_pct": 21.6, "equity": 1216.03, "max_dd": 1.55, "win_rate": 66.07, "profit_factor": 2.92, "ic": 0.5093, "hit": 66.07, "n": 112, "precision": 0.619, "recall": 0.7358, "f1": 0.6724, "f2": 0.7091, "mcc": 0.3312, "accuracy": 0.6607, "tp": 39, "fp": 24, "tn": 35, "fn": 14, "aleatoric_mean": 3e-05, "epistemic_mean": 5.9e-05, "confidence_mean": 0.9999, "aleatoric_std": 1.7e-05, "epistemic_std": 3.3e-05}, {"fold": "fold_6", "regime": "EUR crisis downturn", "sharpe": 6.2063, "sortino": 8.7323, "return_pct": 14.09, "equity": 1140.86, "max_dd": 1.4, "win_rate": 67.29, "profit_factor": 2.893, "ic": 0.5359, "hit": 66.67, "n": 108, "precision": 0.6034, "recall": 0.7447, "f1": 0.6667, "f2": 0.7114, "mcc": 0.3655, "accuracy": 0.6759, "tp": 35, "fp": 23, "tn": 38, "fn": 12, "aleatoric_mean": 2.2e-05, "epistemic_mean": 4.5e-05, "confidence_mean": 0.9999, "aleatoric_std": 7e-06, "epistemic_std": 1.4e-05}, {"fold": "fold_7", "regime": "Recent mixed/upturn", "sharpe": 6.5375, "sortino": 14.0605, "return_pct": 15.54, "equity": 1155.37, "max_dd": 0.9, "win_rate": 64.55, "profit_factor": 2.889, "ic": 0.4826, "hit": 64.55, "n": 110, "precision": 0.6094, "recall": 0.7358, "f1": 0.6667, "f2": 0.7065, "mcc": 0.3011, "accuracy": 0.6455, "tp": 39, "fp": 25, "tn": 32, "fn": 14, "aleatoric_mean": 2.5e-05, "epistemic_mean": 5e-05, "confidence_mean": 0.9999, "aleatoric_std": 1e-05, "epistemic_std": 1.9e-05}], "train_sharpe": 5.971, "train_psr": 1.0, "train_equity": 884761.0, "train_sortino": 13.8986, "train_return_pct": 88376.1, "train_max_dd": 5.08, "train_win_rate": 70.54, "train_profit_factor": 4.134, "train_ic": 0.5814, "train_hit": 70.26, "train_precision": 0.7093, "train_recall": 0.7221, "train_f1": 0.7157, "train_f2": 0.7195, "train_mcc": 0.4093, "train_accuracy": 0.705, "train_per_window": [{"fold": "all_train", "regime": "Training data", "sharpe": 5.971, "sortino": 13.8986, "return_pct": 88376.1, "equity": 884761.0, "max_dd": 5.08, "win_rate": 70.54, "profit_factor": 4.134, "ic": 0.5814, "hit": 70.26, "n": 2478, "precision": 0.7093, "recall": 0.7221, "f1": 0.7157, "f2": 0.7195, "mcc": 0.4093, "accuracy": 0.705, "tp": 920, "fp": 377, "tn": 827, "fn": 354}], "experiment_num": 173, "status": "DISCARD"}
{"backbone": "xgboost", "description": "xgboost: Exp1 SOTA recipe (Chen Guestrin 2016 arXiv 1603.02754)", "config": {"seq_len": 10, "lr": 0.0003, "batch_size": 32, "epochs": 20, "weight_decay": 1e-05, "patience": 5, "grad_clip": 1.0, "warmup_epochs": 0, "huber_delta": 1.0, "head_dropout": 0.1, "seed": 42, "het_loss": false}, "composite": -1.6105, "test_pos_folds": 1, "val_pos_folds": 3, "val_loss": 0.0, "elapsed_sec": 127.3, "timestamp": "2026-04-20T10:54:19", "sharpe": -0.6105, "psr": 0.1151, "equity": 757.22, "sortino": -0.8274, "return_pct": -24.28, "max_dd": 26.2, "win_rate": 47.16, "profit_factor": 0.893, "ic": -0.0413, "hit": 46.97, "precision": 0.4703, "recall": 0.526, "f1": 0.4966, "f2": 0.5138, "mcc": -0.0536, "accuracy": 0.4728, "per_window": [{"fold": "fold_1", "regime": "Pre-crisis upturn + GFC onset", "sharpe": -0.7021, "sortino": -0.7937, "return_pct": -5.96, "equity": 940.42, "max_dd": 8.42, "win_rate": 50.98, "profit_factor": 0.847, "ic": -0.0151, "hit": 50.49, "n": 103, "precision": 0.6, "recall": 0.1698, "f1": 0.2647, "f2": 0.1982, "mcc": 0.0706, "accuracy": 0.5146, "tp": 9, "fp": 6, "tn": 44, "fn": 44}, {"fold": "fold_2", "regime": "Post-crash recovery", "sharpe": 0.7509, "sortino": 1.2034, "return_pct": 3.39, "equity": 1033.85, "max_dd": 3.17, "win_rate": 51.4, "profit_factor": 1.125, "ic": 0.0034, "hit": 51.4, "n": 107, "precision": 0.4928, "recall": 0.6667, "f1": 0.5667, "f2": 0.6227, "mcc": 0.0435, "accuracy": 0.514, "tp": 34, "fp": 35, "tn": 21, "fn": 17}, {"fold": "fold_3", "regime": "Eurozone debt plateau", "sharpe": -1.0167, "sortino": -1.5939, "return_pct": -3.68, "equity": 963.18, "max_dd": 5.8, "win_rate": 50.0, "profit_factor": 0.852, "ic": 0.0517, "hit": 49.06, "n": 106, "precision": 0.525, "recall": 0.7368, "f1": 0.6131, "f2": 0.6818, "mcc": -0.0448, "accuracy": 0.5, "tp": 42, "fp": 38, "tn": 11, "fn": 15}, {"fold": "fold_4", "regime": "Strong USD downturn", "sharpe": -0.3735, "sortino": -0.6289, "return_pct": -3.3, "equity": 966.97, "max_dd": 10.25, "win_rate": 45.51, "profit_factor": 0.939, "ic": 0.0364, "hit": 45.24, "n": 168, "precision": 0.4648, "recall": 0.3837, "f1": 0.4204, "f2": 0.3976, "mcc": -0.0806, "accuracy": 0.4583, "tp": 33, "fp": 38, "tn": 44, "fn": 53}, {"fold": "fold_5", "regime": "Low-vol plateau", "sharpe": -1.6843, "sortino": -2.6538, "return_pct": -5.51, "equity": 944.88, "max_dd": 6.8, "win_rate": 44.44, "profit_factor": 0.755, "ic": -0.0636, "hit": 44.44, "n": 162, "precision": 0.4255, "recall": 0.5263, "f1": 0.4706, "f2": 0.5025, "mcc": -0.1027, "accuracy": 0.4444, "tp": 40, "fp": 54, "tn": 32, "fn": 36}, {"fold": "fold_6", "regime": "EUR crisis downturn", "sharpe": -1.0876, "sortino": -1.7203, "return_pct": -6.89, "equity": 931.11, "max_dd": 11.8, "win_rate": 47.27, "profit_factor": 0.839, "ic": -0.0951, "hit": 47.27, "n": 165, "precision": 0.4597, "recall": 0.7403, "f1": 0.5672, "f2": 0.6597, "mcc": -0.0244, "accuracy": 0.4727, "tp": 57, "fp": 67, "tn": 21, "fn": 20}, {"fold": "fold_7", "regime": "Recent mixed/upturn", "sharpe": -0.8063, "sortino": -1.0955, "return_pct": -4.95, "equity": 950.48, "max_dd": 8.14, "win_rate": 44.44, "profit_factor": 0.873, "ic": -0.016, "hit": 44.44, "n": 162, "precision": 0.4471, "recall": 0.4691, "f1": 0.4578, "f2": 0.4645, "mcc": -0.1112, "accuracy": 0.4444, "tp": 38, "fp": 47, "tn": 34, "fn": 43}], "val_sharpe": -0.5201, "val_psr": 0.1808, "val_equity": 875.7, "val_sortino": -0.7284, "val_return_pct": -12.43, "val_max_dd": 30.18, "val_win_rate": 50.2, "val_profit_factor": 0.916, "val_ic": -0.0372, "val_hit": 49.87, "val_precision": 0.4766, "val_recall": 0.5589, "val_f1": 0.5145, "val_f2": 0.5403, "val_mcc": 0.0031, "val_accuracy": 0.4987, "val_per_window": [{"fold": "fold_1", "regime": "Pre-crisis upturn + GFC onset", "sharpe": 1.8453, "sortino": 3.15, "return_pct": 4.66, "equity": 1046.6, "max_dd": 2.17, "win_rate": 54.63, "profit_factor": 1.358, "ic": 0.0653, "hit": 54.13, "n": 109, "precision": 0.5333, "recall": 0.7273, "f1": 0.6154, "f2": 0.678, "mcc": 0.0854, "accuracy": 0.5413, "tp": 40, "fp": 35, "tn": 19, "fn": 15}, {"fold": "fold_2", "regime": "Post-crash recovery", "sharpe": 1.379, "sortino": 2.1661, "return_pct": 6.6, "equity": 1066.05, "max_dd": 4.94, "win_rate": 53.7, "profit_factor": 1.243, "ic": 0.1031, "hit": 53.7, "n": 108, "precision": 0.6327, "recall": 0.4921, "f1": 0.5536, "f2": 0.515, "mcc": 0.0912, "accuracy": 0.537, "tp": 31, "fp": 18, "tn": 27, "fn": 32}, {"fold": "fold_3", "regime": "Eurozone debt plateau", "sharpe": -2.0812, "sortino": -2.9702, "return_pct": -8.18, "equity": 918.2, "max_dd": 11.74, "win_rate": 51.38, "profit_factor": 0.713, "ic": -0.1605, "hit": 50.45, "n": 111, "precision": 0.4, "recall": 0.3404, "f1": 0.3678, "f2": 0.3509, "mcc": -0.0356, "accuracy": 0.5045, "tp": 16, "fp": 24, "tn": 40, "fn": 31}, {"fold": "fold_4", "regime": "Strong USD downturn", "sharpe": -3.7085, "sortino": -4.9878, "return_pct": -11.92, "equity": 880.81, "max_dd": 13.08, "win_rate": 42.2, "profit_factor": 0.54, "ic": -0.1242, "hit": 41.82, "n": 110, "precision": 0.3836, "recall": 0.5957, "f1": 0.4667, "f2": 0.5364, "mcc": -0.1241, "accuracy": 0.4182, "tp": 28, "fp": 45, "tn": 18, "fn": 19}, {"fold": "fold_5", "regime": "Low-vol plateau", "sharpe": -1.1604, "sortino": -1.5323, "return_pct": -3.91, "equity": 960.89, "max_dd": 8.99, "win_rate": 50.0, "profit_factor": 0.825, "ic": -0.0966, "hit": 50.0, "n": 112, "precision": 0.4805, "recall": 0.6981, "f1": 0.5692, "f2": 0.6401, "mcc": 0.0217, "accuracy": 0.5, "tp": 37, "fp": 40, "tn": 19, "fn": 16}, {"fold": "fold_6", "regime": "EUR crisis downturn", "sharpe": -1.9928, "sortino": -3.0305, "return_pct": -4.49, "equity": 955.14, "max_dd": 4.55, "win_rate": 43.93, "profit_factor": 0.715, "ic": -0.1503, "hit": 43.52, "n": 108, "precision": 0.3333, "recall": 0.2979, "f1": 0.3146, "f2": 0.3043, "mcc": -0.1639, "accuracy": 0.4352, "tp": 14, "fp": 28, "tn": 33, "fn": 33}, {"fold": "fold_7", "regime": "Recent mixed/upturn", "sharpe": 2.3785, "sortino": 4.2428, "return_pct": 5.74, "equity": 1057.38, "max_dd": 1.71, "win_rate": 55.45, "profit_factor": 1.466, "ic": 0.1433, "hit": 55.45, "n": 110, "precision": 0.5278, "recall": 0.717, "f1": 0.608, "f2": 0.669, "mcc": 0.1266, "accuracy": 0.5545, "tp": 38, "fp": 34, "tn": 23, "fn": 15}], "train_sharpe": -0.4975, "train_psr": 0.0438, "train_equity": 501.66, "train_sortino": -0.5082, "train_return_pct": -49.83, "train_max_dd": 56.45, "train_win_rate": 48.82, "train_profit_factor": 0.897, "train_ic": -0.0304, "train_hit": 48.63, "train_precision": 0.5016, "train_recall": 0.5008, "train_f1": 0.5012, "train_f2": 0.5009, "train_mcc": -0.0258, "train_accuracy": 0.4875, "train_per_window": [{"fold": "all_train", "regime": "Training data", "sharpe": -0.4975, "sortino": -0.5082, "return_pct": -49.83, "equity": 501.66, "max_dd": 56.45, "win_rate": 48.82, "profit_factor": 0.897, "ic": -0.0304, "hit": 48.63, "n": 2478, "precision": 0.5016, "recall": 0.5008, "f1": 0.5012, "f2": 0.5009, "mcc": -0.0258, "accuracy": 0.4875, "tp": 638, "fp": 634, "tn": 570, "fn": 636}], "experiment_num": 174, "status": "DISCARD"}
