{"backbone": "lstm", "description": "lstm: Exp24 Exp21 champion seed=42 (variance study)", "config": {"seq_len": 10, "lr": 0.001, "batch_size": 32, "epochs": 100, "weight_decay": 0.001, "patience": 15, "grad_clip": 1.0, "warmup_epochs": 0, "huber_delta": 1.0, "head_dropout": 0.25, "seed": 42, "het_loss": false}, "composite": 6.3571, "test_pos_folds": 7, "val_pos_folds": 6, "val_loss": 2.9e-05, "elapsed_sec": 37.6, "timestamp": "2026-04-19T19:27:35", "sharpe": 6.4571, "psr": 1.0, "equity": 11953.64, "sortino": 7.4987, "return_pct": 1095.36, "max_dd": 8.42, "win_rate": 71.41, "profit_factor": 3.469, "ic": 0.5654, "hit": 71.12, "aleatoric_mean": 9e-06, "epistemic_mean": 1.7e-05, "confidence_mean": 1.0, "precision": 0.7416, "recall": 0.6445, "f1": 0.6897, "f2": 0.6618, "mcc": 0.4292, "accuracy": 0.7133, "per_window": [{"fold": "fold_1", "regime": "Pre-crisis upturn + GFC onset", "sharpe": 1.4127, "sortino": 1.5766, "return_pct": 10.65, "equity": 1106.52, "max_dd": 8.42, "win_rate": 51.96, "profit_factor": 1.398, "ic": 0.1722, "hit": 51.46, "n": 103, "precision": 0.5556, "recall": 0.3774, "f1": 0.4494, "f2": 0.4032, "mcc": 0.0601, "accuracy": 0.5243, "tp": 20, "fp": 16, "tn": 34, "fn": 33, "aleatoric_mean": 1.3e-05, "epistemic_mean": 2.6e-05, "confidence_mean": 1.0, "aleatoric_std": 6e-06, "epistemic_std": 1.3e-05}, {"fold": "fold_2", "regime": "Post-crash recovery", "sharpe": 2.0822, "sortino": 3.5811, "return_pct": 10.12, "equity": 1101.2, "max_dd": 5.45, "win_rate": 56.07, "profit_factor": 1.386, "ic": 0.1419, "hit": 56.07, "n": 107, "precision": 0.5323, "recall": 0.6471, "f1": 0.5841, "f2": 0.6203, "mcc": 0.1307, "accuracy": 0.5607, "tp": 33, "fp": 29, "tn": 27, "fn": 18, "aleatoric_mean": 1e-05, "epistemic_mean": 2e-05, "confidence_mean": 1.0, "aleatoric_std": 4e-06, "epistemic_std": 9e-06}, {"fold": "fold_3", "regime": "Eurozone debt plateau", "sharpe": 7.5559, "sortino": 12.592, "return_pct": 27.21, "equity": 1272.14, "max_dd": 3.54, "win_rate": 71.15, "profit_factor": 3.305, "ic": 0.6107, "hit": 69.81, "n": 106, "precision": 0.6866, "recall": 0.807, "f1": 0.7419, "f2": 0.7797, "mcc": 0.3913, "accuracy": 0.6981, "tp": 46, "fp": 21, "tn": 28, "fn": 11, "aleatoric_mean": 1e-05, "epistemic_mean": 1.9e-05, "confidence_mean": 1.0, "aleatoric_std": 4e-06, "epistemic_std": 8e-06}, {"fold": "fold_4", "regime": "Strong USD downturn", "sharpe": 10.5318, "sortino": 18.9522, "return_pct": 97.07, "equity": 1970.71, "max_dd": 2.28, "win_rate": 78.44, "profit_factor": 6.605, "ic": 0.7624, "hit": 77.98, "n": 168, "precision": 0.8378, "recall": 0.7209, "f1": 0.775, "f2": 0.7416, "mcc": 0.5785, "accuracy": 0.7857, "tp": 62, "fp": 12, "tn": 70, "fn": 24, "aleatoric_mean": 8e-06, "epistemic_mean": 1.5e-05, "confidence_mean": 1.0, "aleatoric_std": 3e-06, "epistemic_std": 6e-06}, {"fold": "fold_5", "regime": "Low-vol plateau", "sharpe": 10.4966, "sortino": 27.2145, "return_pct": 33.78, "equity": 1337.75, "max_dd": 0.89, "win_rate": 76.54, "profit_factor": 6.358, "ic": 0.7124, "hit": 76.54, "n": 162, "precision": 0.8958, "recall": 0.5658, "f1": 0.6935, "f2": 0.6108, "mcc": 0.5548, "accuracy": 0.7654, "tp": 43, "fp": 5, "tn": 81, "fn": 33, "aleatoric_mean": 5e-06, "epistemic_mean": 1.1e-05, "confidence_mean": 1.0, "aleatoric_std": 2e-06, "epistemic_std": 4e-06}, {"fold": "fold_6", "regime": "EUR crisis downturn", "sharpe": 12.3853, "sortino": 26.9799, "return_pct": 84.42, "equity": 1844.15, "max_dd": 1.99, "win_rate": 76.97, "profit_factor": 8.475, "ic": 0.7435, "hit": 76.97, "n": 165, "precision": 0.8, "recall": 0.6753, "f1": 0.7324, "f2": 0.6971, "mcc": 0.5387, "accuracy": 0.7697, "tp": 52, "fp": 13, "tn": 75, "fn": 25, "aleatoric_mean": 9e-06, "epistemic_mean": 1.8e-05, "confidence_mean": 1.0, "aleatoric_std": 3e-06, "epistemic_std": 7e-06}, {"fold": "fold_7", "regime": "Recent mixed/upturn", "sharpe": 8.9297, "sortino": 14.1937, "return_pct": 58.62, "equity": 1586.16, "max_dd": 2.23, "win_rate": 75.93, "profit_factor": 4.837, "ic": 0.6638, "hit": 75.93, "n": 162, "precision": 0.8182, "recall": 0.6667, "f1": 0.7347, "f2": 0.6923, "mcc": 0.5276, "accuracy": 0.7593, "tp": 54, "fp": 12, "tn": 69, "fn": 27, "aleatoric_mean": 9e-06, "epistemic_mean": 1.8e-05, "confidence_mean": 1.0, "aleatoric_std": 3e-06, "epistemic_std": 6e-06}], "val_sharpe": 6.9565, "val_psr": 1.0, "val_equity": 4499.99, "val_sortino": 9.7889, "val_return_pct": 350.0, "val_max_dd": 9.48, "val_win_rate": 71.3, "val_profit_factor": 3.331, "val_ic": 0.5565, "val_hit": 70.83, "val_aleatoric_mean": 7e-06, "val_epistemic_mean": 1.3e-05, "val_confidence_mean": 1.0, "val_precision": 0.7287, "val_recall": 0.6329, "val_f1": 0.6774, "val_f2": 0.65, "val_mcc": 0.4255, "val_accuracy": 0.7135, "val_per_window": [{"fold": "fold_1", "regime": "Pre-crisis upturn + GFC onset", "sharpe": 0.096, "sortino": 0.1613, "return_pct": 0.17, "equity": 1001.69, "max_dd": 3.69, "win_rate": 50.93, "profit_factor": 1.016, "ic": -0.0353, "hit": 50.46, "n": 109, "precision": 0.5167, "recall": 0.5636, "f1": 0.5391, "f2": 0.5536, "mcc": 0.0267, "accuracy": 0.5138, "tp": 31, "fp": 29, "tn": 25, "fn": 24, "aleatoric_mean": 7e-06, "epistemic_mean": 1.3e-05, "confidence_mean": 1.0, "aleatoric_std": 4e-06, "epistemic_std": 8e-06}, {"fold": "fold_2", "regime": "Post-crash recovery", "sharpe": -0.1722, "sortino": -0.2696, "return_pct": -1.11, "equity": 988.95, "max_dd": 9.48, "win_rate": 49.07, "profit_factor": 0.973, "ic": -0.0654, "hit": 49.07, "n": 108, "precision": 0.5741, "recall": 0.4921, "f1": 0.5299, "f2": 0.5065, "mcc": -0.0188, "accuracy": 0.4907, "tp": 31, "fp": 23, "tn": 22, "fn": 32, "aleatoric_mean": 9e-06, "epistemic_mean": 1.8e-05, "confidence_mean": 1.0, "aleatoric_std": 4e-06, "epistemic_std": 7e-06}, {"fold": "fold_3", "regime": "Eurozone debt plateau", "sharpe": 12.5428, "sortino": 28.4706, "return_pct": 48.63, "equity": 1486.26, "max_dd": 0.7, "win_rate": 83.49, "profit_factor": 8.915, "ic": 0.7622, "hit": 81.98, "n": 111, "precision": 0.78, "recall": 0.8298, "f1": 0.8041, "f2": 0.8193, "mcc": 0.6534, "accuracy": 0.8288, "tp": 39, "fp": 11, "tn": 53, "fn": 8, "aleatoric_mean": 6e-06, "epistemic_mean": 1.1e-05, "confidence_mean": 1.0, "aleatoric_std": 2e-06, "epistemic_std": 4e-06}, {"fold": "fold_4", "regime": "Strong USD downturn", "sharpe": 14.2798, "sortino": 33.9019, "return_pct": 44.43, "equity": 1444.32, "max_dd": 0.64, "win_rate": 84.4, "profit_factor": 15.376, "ic": 0.811, "hit": 83.64, "n": 110, "precision": 0.8571, "recall": 0.766, "f1": 0.809, "f2": 0.7826, "mcc": 0.6829, "accuracy": 0.8455, "tp": 36, "fp": 6, "tn": 57, "fn": 11, "aleatoric_mean": 7e-06, "epistemic_mean": 1.4e-05, "confidence_mean": 1.0, "aleatoric_std": 2e-06, "epistemic_std": 5e-06}, {"fold": "fold_5", "regime": "Low-vol plateau", "sharpe": 10.6496, "sortino": 32.7415, "return_pct": 34.18, "equity": 1341.76, "max_dd": 0.55, "win_rate": 73.21, "profit_factor": 6.538, "ic": 0.7762, "hit": 73.21, "n": 112, "precision": 0.8286, "recall": 0.5472, "f1": 0.6591, "f2": 0.587, "mcc": 0.4799, "accuracy": 0.7321, "tp": 29, "fp": 6, "tn": 53, "fn": 24, "aleatoric_mean": 5e-06, "epistemic_mean": 1e-05, "confidence_mean": 1.0, "aleatoric_std": 2e-06, "epistemic_std": 3e-06}, {"fold": "fold_6", "regime": "EUR crisis downturn", "sharpe": 13.3693, "sortino": 57.4378, "return_pct": 26.31, "equity": 1263.14, "max_dd": 0.25, "win_rate": 81.31, "profit_factor": 13.306, "ic": 0.8839, "hit": 80.56, "n": 108, "precision": 0.8857, "recall": 0.6596, "f1": 0.7561, "f2": 0.6951, "mcc": 0.6292, "accuracy": 0.8148, "tp": 31, "fp": 4, "tn": 57, "fn": 16, "aleatoric_mean": 5e-06, "epistemic_mean": 1.1e-05, "confidence_mean": 1.0, "aleatoric_std": 2e-06, "epistemic_std": 3e-06}, {"fold": "fold_7", "regime": "Recent mixed/upturn", "sharpe": 11.4339, "sortino": 23.6986, "return_pct": 24.86, "equity": 1248.58, "max_dd": 0.56, "win_rate": 76.36, "profit_factor": 6.858, "ic": 0.7635, "hit": 76.36, "n": 110, "precision": 0.8293, "recall": 0.6415, "f1": 0.7234, "f2": 0.6719, "mcc": 0.536, "accuracy": 0.7636, "tp": 34, "fp": 7, "tn": 50, "fn": 19, "aleatoric_mean": 8e-06, "epistemic_mean": 1.6e-05, "confidence_mean": 1.0, "aleatoric_std": 3e-06, "epistemic_std": 6e-06}], "train_sharpe": 7.1305, "train_psr": 1.0, "train_equity": 2722277.0, "train_sortino": 18.9308, "train_return_pct": 272127.7, "train_max_dd": 6.12, "train_win_rate": 74.88, "train_profit_factor": 5.908, "train_ic": 0.7128, "train_hit": 74.58, "train_precision": 0.7989, "train_recall": 0.6829, "train_f1": 0.7364, "train_f2": 0.7033, "train_mcc": 0.5045, "train_accuracy": 0.7486, "train_per_window": [{"fold": "all_train", "regime": "Training data", "sharpe": 7.1305, "sortino": 18.9308, "return_pct": 272127.7, "equity": 2722277.0, "max_dd": 6.12, "win_rate": 74.88, "profit_factor": 5.908, "ic": 0.7128, "hit": 74.58, "n": 2478, "precision": 0.7989, "recall": 0.6829, "f1": 0.7364, "f2": 0.7033, "mcc": 0.5045, "accuracy": 0.7486, "tp": 870, "fp": 219, "tn": 985, "fn": 404}], "experiment_num": 129, "status": "KEEP"}
{"backbone": "lstm", "description": "lstm: Exp25 Exp21 champion seed=99 (variance study)", "config": {"seq_len": 10, "lr": 0.001, "batch_size": 32, "epochs": 100, "weight_decay": 0.001, "patience": 15, "grad_clip": 1.0, "warmup_epochs": 0, "huber_delta": 1.0, "head_dropout": 0.25, "seed": 99, "het_loss": false}, "composite": 6.2399, "test_pos_folds": 7, "val_pos_folds": 7, "val_loss": 3e-05, "elapsed_sec": 43.3, "timestamp": "2026-04-19T19:28:48", "sharpe": 6.2399, "psr": 1.0, "equity": 11114.57, "sortino": 7.283, "return_pct": 1011.46, "max_dd": 9.48, "win_rate": 70.38, "profit_factor": 3.314, "ic": 0.5781, "hit": 70.09, "aleatoric_mean": 8e-06, "epistemic_mean": 1.6e-05, "confidence_mean": 1.0, "precision": 0.7533, "recall": 0.5904, "f1": 0.662, "f2": 0.6171, "mcc": 0.412, "accuracy": 0.702, "per_window": [{"fold": "fold_1", "regime": "Pre-crisis upturn + GFC onset", "sharpe": 0.2203, "sortino": 0.2513, "return_pct": 0.97, "equity": 1009.71, "max_dd": 9.48, "win_rate": 48.04, "profit_factor": 1.053, "ic": 0.0491, "hit": 47.57, "n": 103, "precision": 0.4894, "recall": 0.434, "f1": 0.46, "f2": 0.444, "mcc": -0.0462, "accuracy": 0.4757, "tp": 23, "fp": 24, "tn": 26, "fn": 30, "aleatoric_mean": 1.7e-05, "epistemic_mean": 3.5e-05, "confidence_mean": 0.9999, "aleatoric_std": 1.1e-05, "epistemic_std": 2.1e-05}, {"fold": "fold_2", "regime": "Post-crash recovery", "sharpe": 1.9083, "sortino": 3.337, "return_pct": 9.23, "equity": 1092.25, "max_dd": 5.37, "win_rate": 54.21, "profit_factor": 1.349, "ic": 0.1482, "hit": 54.21, "n": 107, "precision": 0.5172, "recall": 0.5882, "f1": 0.5505, "f2": 0.5725, "mcc": 0.0885, "accuracy": 0.5421, "tp": 30, "fp": 28, "tn": 28, "fn": 21, "aleatoric_mean": 8e-06, "epistemic_mean": 1.7e-05, "confidence_mean": 1.0, "aleatoric_std": 4e-06, "epistemic_std": 8e-06}, {"fold": "fold_3", "regime": "Eurozone debt plateau", "sharpe": 10.722, "sortino": 16.7651, "return_pct": 36.88, "equity": 1368.79, "max_dd": 2.24, "win_rate": 76.92, "profit_factor": 5.608, "ic": 0.7321, "hit": 75.47, "n": 106, "precision": 0.7818, "recall": 0.7544, "f1": 0.7679, "f2": 0.7597, "mcc": 0.5084, "accuracy": 0.7547, "tp": 43, "fp": 12, "tn": 37, "fn": 14, "aleatoric_mean": 8e-06, "epistemic_mean": 1.6e-05, "confidence_mean": 1.0, "aleatoric_std": 3e-06, "epistemic_std": 5e-06}, {"fold": "fold_4", "regime": "Strong USD downturn", "sharpe": 12.1079, "sortino": 27.976, "return_pct": 110.57, "equity": 2105.66, "max_dd": 1.11, "win_rate": 83.23, "profit_factor": 9.444, "ic": 0.7916, "hit": 82.74, "n": 168, "precision": 0.8222, "recall": 0.8605, "f1": 0.8409, "f2": 0.8525, "mcc": 0.6669, "accuracy": 0.8333, "tp": 74, "fp": 16, "tn": 66, "fn": 12, "aleatoric_mean": 6e-06, "epistemic_mean": 1.1e-05, "confidence_mean": 1.0, "aleatoric_std": 3e-06, "epistemic_std": 5e-06}, {"fold": "fold_5", "regime": "Low-vol plateau", "sharpe": 8.9484, "sortino": 17.7487, "return_pct": 29.56, "equity": 1295.6, "max_dd": 0.89, "win_rate": 71.6, "profit_factor": 4.687, "ic": 0.7705, "hit": 71.6, "n": 162, "precision": 0.8571, "recall": 0.4737, "f1": 0.6102, "f2": 0.5202, "mcc": 0.46, "accuracy": 0.716, "tp": 36, "fp": 6, "tn": 80, "fn": 40, "aleatoric_mean": 4e-06, "epistemic_mean": 8e-06, "confidence_mean": 1.0, "aleatoric_std": 1e-06, "epistemic_std": 3e-06}, {"fold": "fold_6", "regime": "EUR crisis downturn", "sharpe": 12.7232, "sortino": 27.0403, "return_pct": 86.32, "equity": 1863.19, "max_dd": 1.25, "win_rate": 75.76, "profit_factor": 9.106, "ic": 0.8228, "hit": 75.76, "n": 165, "precision": 0.9111, "recall": 0.5325, "f1": 0.6721, "f2": 0.5807, "mcc": 0.5455, "accuracy": 0.7576, "tp": 41, "fp": 4, "tn": 84, "fn": 36, "aleatoric_mean": 7e-06, "epistemic_mean": 1.5e-05, "confidence_mean": 1.0, "aleatoric_std": 3e-06, "epistemic_std": 7e-06}, {"fold": "fold_7", "regime": "Recent mixed/upturn", "sharpe": 6.8125, "sortino": 11.0398, "return_pct": 44.85, "equity": 1448.51, "max_dd": 3.26, "win_rate": 70.99, "profit_factor": 3.244, "ic": 0.7367, "hit": 70.99, "n": 162, "precision": 0.925, "recall": 0.4568, "f1": 0.6116, "f2": 0.5082, "mcc": 0.4867, "accuracy": 0.7099, "tp": 37, "fp": 3, "tn": 78, "fn": 44, "aleatoric_mean": 9e-06, "epistemic_mean": 1.8e-05, "confidence_mean": 1.0, "aleatoric_std": 4e-06, "epistemic_std": 7e-06}], "val_sharpe": 6.7233, "val_psr": 1.0, "val_equity": 4311.02, "val_sortino": 10.3052, "val_return_pct": 331.1, "val_max_dd": 4.71, "val_win_rate": 67.89, "val_profit_factor": 3.193, "val_ic": 0.5712, "val_hit": 67.45, "val_aleatoric_mean": 6e-06, "val_epistemic_mean": 1.2e-05, "val_confidence_mean": 1.0, "val_precision": 0.7511, "val_recall": 0.4877, "val_f1": 0.5914, "val_f2": 0.5245, "val_mcc": 0.369, "val_accuracy": 0.6797, "val_per_window": [{"fold": "fold_1", "regime": "Pre-crisis upturn + GFC onset", "sharpe": 0.1368, "sortino": 0.2209, "return_pct": 0.27, "equity": 1002.72, "max_dd": 3.67, "win_rate": 51.85, "profit_factor": 1.023, "ic": -0.0671, "hit": 51.38, "n": 109, "precision": 0.56, "recall": 0.2545, "f1": 0.35, "f2": 0.2857, "mcc": 0.0605, "accuracy": 0.5229, "tp": 14, "fp": 11, "tn": 43, "fn": 41, "aleatoric_mean": 6e-06, "epistemic_mean": 1.1e-05, "confidence_mean": 1.0, "aleatoric_std": 3e-06, "epistemic_std": 6e-06}, {"fold": "fold_2", "regime": "Post-crash recovery", "sharpe": 1.9512, "sortino": 2.9557, "return_pct": 9.56, "equity": 1095.58, "max_dd": 4.71, "win_rate": 53.7, "profit_factor": 1.361, "ic": 0.1733, "hit": 53.7, "n": 108, "precision": 0.6444, "recall": 0.4603, "f1": 0.537, "f2": 0.4882, "mcc": 0.1048, "accuracy": 0.537, "tp": 29, "fp": 16, "tn": 29, "fn": 34, "aleatoric_mean": 9e-06, "epistemic_mean": 1.8e-05, "confidence_mean": 1.0, "aleatoric_std": 3e-06, "epistemic_std": 6e-06}, {"fold": "fold_3", "regime": "Eurozone debt plateau", "sharpe": 12.3049, "sortino": 27.3942, "return_pct": 47.93, "equity": 1479.3, "max_dd": 1.25, "win_rate": 78.9, "profit_factor": 8.472, "ic": 0.7982, "hit": 77.48, "n": 111, "precision": 0.7018, "recall": 0.8511, "f1": 0.7692, "f2": 0.8163, "mcc": 0.5787, "accuracy": 0.7838, "tp": 40, "fp": 17, "tn": 47, "fn": 7, "aleatoric_mean": 6e-06, "epistemic_mean": 1.1e-05, "confidence_mean": 1.0, "aleatoric_std": 2e-06, "epistemic_std": 4e-06}, {"fold": "fold_4", "regime": "Strong USD downturn", "sharpe": 14.1099, "sortino": 43.4363, "return_pct": 44.08, "equity": 1440.79, "max_dd": 0.54, "win_rate": 81.65, "profit_factor": 14.631, "ic": 0.8449, "hit": 80.91, "n": 110, "precision": 0.8462, "recall": 0.7021, "f1": 0.7674, "f2": 0.7269, "mcc": 0.6276, "accuracy": 0.8182, "tp": 33, "fp": 6, "tn": 57, "fn": 14, "aleatoric_mean": 6e-06, "epistemic_mean": 1.3e-05, "confidence_mean": 1.0, "aleatoric_std": 2e-06, "epistemic_std": 4e-06}, {"fold": "fold_5", "regime": "Low-vol plateau", "sharpe": 10.0439, "sortino": 26.1708, "return_pct": 32.59, "equity": 1325.9, "max_dd": 0.75, "win_rate": 73.21, "profit_factor": 5.782, "ic": 0.8061, "hit": 73.21, "n": 112, "precision": 0.871, "recall": 0.5094, "f1": 0.6429, "f2": 0.5556, "mcc": 0.4928, "accuracy": 0.7321, "tp": 27, "fp": 4, "tn": 55, "fn": 26, "aleatoric_mean": 4e-06, "epistemic_mean": 8e-06, "confidence_mean": 1.0, "aleatoric_std": 2e-06, "epistemic_std": 3e-06}, {"fold": "fold_6", "regime": "EUR crisis downturn", "sharpe": 7.3488, "sortino": 14.936, "return_pct": 16.43, "equity": 1164.32, "max_dd": 1.38, "win_rate": 68.22, "profit_factor": 3.556, "ic": 0.8732, "hit": 67.59, "n": 108, "precision": 1.0, "recall": 0.2766, "f1": 0.4333, "f2": 0.3234, "mcc": 0.4214, "accuracy": 0.6852, "tp": 13, "fp": 0, "tn": 61, "fn": 34, "aleatoric_mean": 4e-06, "epistemic_mean": 8e-06, "confidence_mean": 1.0, "aleatoric_std": 1e-06, "epistemic_std": 3e-06}, {"fold": "fold_7", "regime": "Recent mixed/upturn", "sharpe": 8.319, "sortino": 20.8645, "return_pct": 19.27, "equity": 1192.66, "max_dd": 2.08, "win_rate": 67.27, "profit_factor": 3.903, "ic": 0.7396, "hit": 67.27, "n": 110, "precision": 0.8148, "recall": 0.4151, "f1": 0.55, "f2": 0.4603, "mcc": 0.3801, "accuracy": 0.6727, "tp": 22, "fp": 5, "tn": 52, "fn": 31, "aleatoric_mean": 7e-06, "epistemic_mean": 1.4e-05, "confidence_mean": 1.0, "aleatoric_std": 3e-06, "epistemic_std": 6e-06}], "train_sharpe": 6.8918, "train_psr": 1.0, "train_equity": 2175326.5, "train_sortino": 19.2543, "train_return_pct": 217432.65, "train_max_dd": 5.2, "train_win_rate": 73.87, "train_profit_factor": 5.463, "train_ic": 0.7219, "train_hit": 73.57, "train_precision": 0.8451, "train_recall": 0.6036, "train_f1": 0.7042, "train_f2": 0.6402, "train_mcc": 0.5044, "train_accuracy": 0.7393, "train_per_window": [{"fold": "all_train", "regime": "Training data", "sharpe": 6.8918, "sortino": 19.2543, "return_pct": 217432.65, "equity": 2175326.5, "max_dd": 5.2, "win_rate": 73.87, "profit_factor": 5.463, "ic": 0.7219, "hit": 73.57, "n": 2478, "precision": 0.8451, "recall": 0.6036, "f1": 0.7042, "f2": 0.6402, "mcc": 0.5044, "accuracy": 0.7393, "tp": 769, "fp": 141, "tn": 1063, "fn": 505}], "experiment_num": 130, "status": "DISCARD"}
