{"backbone": "lstm", "description": "lstm: Exp26 Exp21 champion seed=7 (variance study)", "config": {"seq_len": 10, "lr": 0.001, "batch_size": 32, "epochs": 100, "weight_decay": 0.001, "patience": 15, "grad_clip": 1.0, "warmup_epochs": 0, "huber_delta": 1.0, "head_dropout": 0.25, "seed": 7, "het_loss": false}, "composite": 5.1742, "test_pos_folds": 7, "val_pos_folds": 6, "val_loss": 2.7e-05, "elapsed_sec": 27.6, "timestamp": "2026-04-19T19:30:04", "sharpe": 5.2742, "psr": 1.0, "equity": 7944.21, "sortino": 6.3246, "return_pct": 694.42, "max_dd": 10.22, "win_rate": 68.73, "profit_factor": 2.72, "ic": 0.4671, "hit": 68.45, "aleatoric_mean": 2.1e-05, "epistemic_mean": 4.3e-05, "confidence_mean": 0.9999, "precision": 0.6903, "recall": 0.6674, "f1": 0.6786, "f2": 0.6718, "mcc": 0.375, "accuracy": 0.6876, "per_window": [{"fold": "fold_1", "regime": "Pre-crisis upturn + GFC onset", "sharpe": 0.094, "sortino": 0.1004, "return_pct": -0.01, "equity": 999.92, "max_dd": 9.69, "win_rate": 55.88, "profit_factor": 1.022, "ic": 0.0894, "hit": 55.34, "n": 103, "precision": 0.5897, "recall": 0.434, "f1": 0.5, "f2": 0.4582, "mcc": 0.1174, "accuracy": 0.5534, "tp": 23, "fp": 16, "tn": 34, "fn": 30, "aleatoric_mean": 3.1e-05, "epistemic_mean": 6.1e-05, "confidence_mean": 0.9999, "aleatoric_std": 1.3e-05, "epistemic_std": 2.6e-05}, {"fold": "fold_2", "regime": "Post-crash recovery", "sharpe": 0.812, "sortino": 1.6103, "return_pct": 3.69, "equity": 1036.88, "max_dd": 5.82, "win_rate": 53.27, "profit_factor": 1.136, "ic": 0.0339, "hit": 53.27, "n": 107, "precision": 0.5091, "recall": 0.549, "f1": 0.5283, "f2": 0.5405, "mcc": 0.0668, "accuracy": 0.5327, "tp": 28, "fp": 27, "tn": 29, "fn": 23, "aleatoric_mean": 3e-05, "epistemic_mean": 5.9e-05, "confidence_mean": 0.9999, "aleatoric_std": 1.5e-05, "epistemic_std": 3.1e-05}, {"fold": "fold_3", "regime": "Eurozone debt plateau", "sharpe": 8.3294, "sortino": 16.7849, "return_pct": 29.74, "equity": 1297.37, "max_dd": 1.77, "win_rate": 68.27, "profit_factor": 3.749, "ic": 0.5333, "hit": 66.98, "n": 106, "precision": 0.8333, "recall": 0.5263, "f1": 0.6452, "f2": 0.5682, "mcc": 0.4252, "accuracy": 0.6887, "tp": 30, "fp": 6, "tn": 43, "fn": 27, "aleatoric_mean": 2.6e-05, "epistemic_mean": 5.2e-05, "confidence_mean": 0.9999, "aleatoric_std": 1e-05, "epistemic_std": 2.1e-05}, {"fold": "fold_4", "regime": "Strong USD downturn", "sharpe": 8.5723, "sortino": 14.5841, "return_pct": 79.04, "equity": 1790.38, "max_dd": 2.07, "win_rate": 77.25, "profit_factor": 4.456, "ic": 0.6339, "hit": 76.79, "n": 168, "precision": 0.7449, "recall": 0.8488, "f1": 0.7935, "f2": 0.8258, "mcc": 0.5515, "accuracy": 0.7738, "tp": 73, "fp": 25, "tn": 57, "fn": 13, "aleatoric_mean": 1.9e-05, "epistemic_mean": 3.9e-05, "confidence_mean": 0.9999, "aleatoric_std": 8e-06, "epistemic_std": 1.6e-05}, {"fold": "fold_5", "regime": "Low-vol plateau", "sharpe": 9.4555, "sortino": 23.7375, "return_pct": 30.99, "equity": 1309.86, "max_dd": 0.63, "win_rate": 72.84, "profit_factor": 5.166, "ic": 0.644, "hit": 72.84, "n": 162, "precision": 0.82, "recall": 0.5395, "f1": 0.6508, "f2": 0.5791, "mcc": 0.4698, "accuracy": 0.7284, "tp": 41, "fp": 9, "tn": 77, "fn": 35, "aleatoric_mean": 1.2e-05, "epistemic_mean": 2.4e-05, "confidence_mean": 1.0, "aleatoric_std": 6e-06, "epistemic_std": 1.1e-05}, {"fold": "fold_6", "regime": "EUR crisis downturn", "sharpe": 9.1978, "sortino": 18.958, "return_pct": 64.58, "equity": 1645.82, "max_dd": 1.55, "win_rate": 69.09, "profit_factor": 4.602, "ic": 0.6364, "hit": 69.09, "n": 165, "precision": 0.6444, "recall": 0.7532, "f1": 0.6946, "f2": 0.7286, "mcc": 0.3904, "accuracy": 0.6909, "tp": 58, "fp": 32, "tn": 56, "fn": 19, "aleatoric_mean": 2.2e-05, "epistemic_mean": 4.3e-05, "confidence_mean": 0.9999, "aleatoric_std": 1.1e-05, "epistemic_std": 2.2e-05}, {"fold": "fold_7", "regime": "Recent mixed/upturn", "sharpe": 8.0507, "sortino": 12.3222, "return_pct": 53.02, "equity": 1530.17, "max_dd": 1.64, "win_rate": 74.07, "profit_factor": 4.082, "ic": 0.64, "hit": 74.07, "n": 162, "precision": 0.701, "recall": 0.8395, "f1": 0.764, "f2": 0.8076, "mcc": 0.4912, "accuracy": 0.7407, "tp": 68, "fp": 29, "tn": 52, "fn": 13, "aleatoric_mean": 1.8e-05, "epistemic_mean": 3.6e-05, "confidence_mean": 0.9999, "aleatoric_std": 7e-06, "epistemic_std": 1.3e-05}], "val_sharpe": 6.1084, "val_psr": 1.0, "val_equity": 3837.32, "val_sortino": 8.9735, "val_return_pct": 283.73, "val_max_dd": 5.04, "val_win_rate": 69.72, "val_profit_factor": 2.858, "val_ic": 0.4753, "val_hit": 69.27, "val_aleatoric_mean": 1.8e-05, "val_epistemic_mean": 3.6e-05, "val_confidence_mean": 0.9999, "val_precision": 0.6962, "val_recall": 0.6466, "val_f1": 0.6705, "val_f2": 0.6559, "val_mcc": 0.3932, "val_accuracy": 0.6979, "val_per_window": [{"fold": "fold_1", "regime": "Pre-crisis upturn + GFC onset", "sharpe": -0.6108, "sortino": -1.0051, "return_pct": -1.6, "equity": 983.98, "max_dd": 4.12, "win_rate": 50.93, "profit_factor": 0.904, "ic": -0.059, "hit": 50.46, "n": 109, "precision": 0.5179, "recall": 0.5273, "f1": 0.5225, "f2": 0.5254, "mcc": 0.0273, "accuracy": 0.5138, "tp": 29, "fp": 27, "tn": 27, "fn": 26, "aleatoric_mean": 1.6e-05, "epistemic_mean": 3.3e-05, "confidence_mean": 1.0, "aleatoric_std": 9e-06, "epistemic_std": 1.8e-05}, {"fold": "fold_2", "regime": "Post-crash recovery", "sharpe": 0.3932, "sortino": 0.6004, "return_pct": 1.65, "equity": 1016.46, "max_dd": 5.04, "win_rate": 51.85, "profit_factor": 1.064, "ic": 0.04, "hit": 51.85, "n": 108, "precision": 0.5932, "recall": 0.5556, "f1": 0.5738, "f2": 0.5627, "mcc": 0.022, "accuracy": 0.5185, "tp": 35, "fp": 24, "tn": 21, "fn": 28, "aleatoric_mean": 3.1e-05, "epistemic_mean": 6.3e-05, "confidence_mean": 0.9999, "aleatoric_std": 1.2e-05, "epistemic_std": 2.3e-05}, {"fold": "fold_3", "regime": "Eurozone debt plateau", "sharpe": 12.1045, "sortino": 30.8984, "return_pct": 47.33, "equity": 1473.33, "max_dd": 1.19, "win_rate": 81.65, "profit_factor": 8.122, "ic": 0.7081, "hit": 80.18, "n": 111, "precision": 0.7708, "recall": 0.7872, "f1": 0.7789, "f2": 0.7839, "mcc": 0.6137, "accuracy": 0.8108, "tp": 37, "fp": 11, "tn": 53, "fn": 10, "aleatoric_mean": 2e-05, "epistemic_mean": 4.1e-05, "confidence_mean": 0.9999, "aleatoric_std": 7e-06, "epistemic_std": 1.4e-05}, {"fold": "fold_4", "regime": "Strong USD downturn", "sharpe": 10.2331, "sortino": 23.4453, "return_pct": 34.66, "equity": 1346.6, "max_dd": 1.04, "win_rate": 77.98, "profit_factor": 5.925, "ic": 0.718, "hit": 77.27, "n": 110, "precision": 0.7255, "recall": 0.7872, "f1": 0.7551, "f2": 0.7741, "mcc": 0.5605, "accuracy": 0.7818, "tp": 37, "fp": 14, "tn": 49, "fn": 10, "aleatoric_mean": 1.7e-05, "epistemic_mean": 3.4e-05, "confidence_mean": 0.9999, "aleatoric_std": 5e-06, "epistemic_std": 1.1e-05}, {"fold": "fold_5", "regime": "Low-vol plateau", "sharpe": 10.5504, "sortino": 23.4873, "return_pct": 33.92, "equity": 1339.21, "max_dd": 0.83, "win_rate": 78.57, "profit_factor": 6.405, "ic": 0.751, "hit": 78.57, "n": 112, "precision": 0.8222, "recall": 0.6981, "f1": 0.7551, "f2": 0.7198, "mcc": 0.5729, "accuracy": 0.7857, "tp": 37, "fp": 8, "tn": 51, "fn": 16, "aleatoric_mean": 1.3e-05, "epistemic_mean": 2.5e-05, "confidence_mean": 1.0, "aleatoric_std": 5e-06, "epistemic_std": 9e-06}, {"fold": "fold_6", "regime": "EUR crisis downturn", "sharpe": 9.6816, "sortino": 26.0066, "return_pct": 20.77, "equity": 1207.68, "max_dd": 0.64, "win_rate": 71.96, "profit_factor": 5.564, "ic": 0.6395, "hit": 71.3, "n": 108, "precision": 0.7297, "recall": 0.5745, "f1": 0.6429, "f2": 0.6, "mcc": 0.4289, "accuracy": 0.7222, "tp": 27, "fp": 10, "tn": 51, "fn": 20, "aleatoric_mean": 1.1e-05, "epistemic_mean": 2.3e-05, "confidence_mean": 1.0, "aleatoric_std": 4e-06, "epistemic_std": 8e-06}, {"fold": "fold_7", "regime": "Recent mixed/upturn", "sharpe": 8.4709, "sortino": 14.4378, "return_pct": 19.57, "equity": 1195.67, "max_dd": 1.15, "win_rate": 74.55, "profit_factor": 4.006, "ic": 0.575, "hit": 74.55, "n": 110, "precision": 0.7907, "recall": 0.6415, "f1": 0.7083, "f2": 0.6667, "mcc": 0.4952, "accuracy": 0.7455, "tp": 34, "fp": 9, "tn": 48, "fn": 19, "aleatoric_mean": 1.6e-05, "epistemic_mean": 3.3e-05, "confidence_mean": 1.0, "aleatoric_std": 7e-06, "epistemic_std": 1.5e-05}], "train_sharpe": 5.9963, "train_psr": 1.0, "train_equity": 907526.38, "train_sortino": 14.6587, "train_return_pct": 90652.64, "train_max_dd": 6.34, "train_win_rate": 70.42, "train_profit_factor": 4.164, "train_ic": 0.6053, "train_hit": 70.14, "train_precision": 0.7572, "train_recall": 0.6217, "train_f1": 0.6828, "train_f2": 0.6447, "train_mcc": 0.4156, "train_accuracy": 0.703, "train_per_window": [{"fold": "all_train", "regime": "Training data", "sharpe": 5.9963, "sortino": 14.6587, "return_pct": 90652.64, "equity": 907526.38, "max_dd": 6.34, "win_rate": 70.42, "profit_factor": 4.164, "ic": 0.6053, "hit": 70.14, "n": 2478, "precision": 0.7572, "recall": 0.6217, "f1": 0.6828, "f2": 0.6447, "mcc": 0.4156, "accuracy": 0.703, "tp": 792, "fp": 254, "tn": 950, "fn": 482}], "experiment_num": 131, "status": "DISCARD"}
{"backbone": "lstm", "description": "lstm: Exp27 grad_clip=2.0 looser (xLSTM Beck2024 inspired)", "config": {"seq_len": 10, "lr": 0.001, "batch_size": 32, "epochs": 100, "weight_decay": 0.001, "patience": 15, "grad_clip": 2.0, "warmup_epochs": 0, "huber_delta": 1.0, "head_dropout": 0.25, "seed": 42, "het_loss": false}, "composite": 6.3304, "test_pos_folds": 7, "val_pos_folds": 6, "val_loss": 2.9e-05, "elapsed_sec": 34.8, "timestamp": "2026-04-19T19:31:04", "sharpe": 6.4304, "psr": 1.0, "equity": 11847.85, "sortino": 7.4688, "return_pct": 1084.78, "max_dd": 8.42, "win_rate": 71.41, "profit_factor": 3.45, "ic": 0.5655, "hit": 71.12, "aleatoric_mean": 9e-06, "epistemic_mean": 1.7e-05, "confidence_mean": 1.0, "precision": 0.7405, "recall": 0.6466, "f1": 0.6903, "f2": 0.6634, "mcc": 0.429, "accuracy": 0.7133, "per_window": [{"fold": "fold_1", "regime": "Pre-crisis upturn + GFC onset", "sharpe": 1.4127, "sortino": 1.5766, "return_pct": 10.65, "equity": 1106.52, "max_dd": 8.42, "win_rate": 51.96, "profit_factor": 1.398, "ic": 0.1682, "hit": 51.46, "n": 103, "precision": 0.5556, "recall": 0.3774, "f1": 0.4494, "f2": 0.4032, "mcc": 0.0601, "accuracy": 0.5243, "tp": 20, "fp": 16, "tn": 34, "fn": 33, "aleatoric_mean": 1.3e-05, "epistemic_mean": 2.6e-05, "confidence_mean": 1.0, "aleatoric_std": 6e-06, "epistemic_std": 1.3e-05}, {"fold": "fold_2", "regime": "Post-crash recovery", "sharpe": 1.7961, "sortino": 3.1255, "return_pct": 8.65, "equity": 1086.5, "max_dd": 5.45, "win_rate": 55.14, "profit_factor": 1.325, "ic": 0.1416, "hit": 55.14, "n": 107, "precision": 0.5238, "recall": 0.6471, "f1": 0.5789, "f2": 0.618, "mcc": 0.113, "accuracy": 0.5514, "tp": 33, "fp": 30, "tn": 26, "fn": 18, "aleatoric_mean": 1e-05, "epistemic_mean": 2e-05, "confidence_mean": 1.0, "aleatoric_std": 4e-06, "epistemic_std": 9e-06}, {"fold": "fold_3", "regime": "Eurozone debt plateau", "sharpe": 7.5559, "sortino": 12.592, "return_pct": 27.21, "equity": 1272.14, "max_dd": 3.54, "win_rate": 71.15, "profit_factor": 3.305, "ic": 0.6088, "hit": 69.81, "n": 106, "precision": 0.6866, "recall": 0.807, "f1": 0.7419, "f2": 0.7797, "mcc": 0.3913, "accuracy": 0.6981, "tp": 46, "fp": 21, "tn": 28, "fn": 11, "aleatoric_mean": 1e-05, "epistemic_mean": 1.9e-05, "confidence_mean": 1.0, "aleatoric_std": 4e-06, "epistemic_std": 9e-06}, {"fold": "fold_4", "regime": "Strong USD downturn", "sharpe": 10.5318, "sortino": 18.9522, "return_pct": 97.07, "equity": 1970.71, "max_dd": 2.28, "win_rate": 78.44, "profit_factor": 6.605, "ic": 0.7635, "hit": 77.98, "n": 168, "precision": 0.8378, "recall": 0.7209, "f1": 0.775, "f2": 0.7416, "mcc": 0.5785, "accuracy": 0.7857, "tp": 62, "fp": 12, "tn": 70, "fn": 24, "aleatoric_mean": 8e-06, "epistemic_mean": 1.5e-05, "confidence_mean": 1.0, "aleatoric_std": 3e-06, "epistemic_std": 6e-06}, {"fold": "fold_5", "regime": "Low-vol plateau", "sharpe": 10.7339, "sortino": 27.51, "return_pct": 34.38, "equity": 1343.84, "max_dd": 0.89, "win_rate": 77.16, "profit_factor": 6.679, "ic": 0.7118, "hit": 77.16, "n": 162, "precision": 0.898, "recall": 0.5789, "f1": 0.704, "f2": 0.6232, "mcc": 0.5658, "accuracy": 0.7716, "tp": 44, "fp": 5, "tn": 81, "fn": 32, "aleatoric_mean": 5e-06, "epistemic_mean": 1.1e-05, "confidence_mean": 1.0, "aleatoric_std": 2e-06, "epistemic_std": 4e-06}, {"fold": "fold_6", "regime": "EUR crisis downturn", "sharpe": 12.3853, "sortino": 26.9799, "return_pct": 84.42, "equity": 1844.15, "max_dd": 1.99, "win_rate": 76.97, "profit_factor": 8.475, "ic": 0.7439, "hit": 76.97, "n": 165, "precision": 0.8, "recall": 0.6753, "f1": 0.7324, "f2": 0.6971, "mcc": 0.5387, "accuracy": 0.7697, "tp": 52, "fp": 13, "tn": 75, "fn": 25, "aleatoric_mean": 9e-06, "epistemic_mean": 1.8e-05, "confidence_mean": 1.0, "aleatoric_std": 3e-06, "epistemic_std": 7e-06}, {"fold": "fold_7", "regime": "Recent mixed/upturn", "sharpe": 8.9297, "sortino": 14.1937, "return_pct": 58.62, "equity": 1586.16, "max_dd": 2.23, "win_rate": 75.93, "profit_factor": 4.837, "ic": 0.6635, "hit": 75.93, "n": 162, "precision": 0.8182, "recall": 0.6667, "f1": 0.7347, "f2": 0.6923, "mcc": 0.5276, "accuracy": 0.7593, "tp": 54, "fp": 12, "tn": 69, "fn": 27, "aleatoric_mean": 9e-06, "epistemic_mean": 1.8e-05, "confidence_mean": 1.0, "aleatoric_std": 3e-06, "epistemic_std": 6e-06}], "val_sharpe": 7.0661, "val_psr": 1.0, "val_equity": 4590.51, "val_sortino": 9.8311, "val_return_pct": 359.05, "val_max_dd": 9.05, "val_win_rate": 71.82, "val_profit_factor": 3.399, "val_ic": 0.5556, "val_hit": 71.35, "val_aleatoric_mean": 7e-06, "val_epistemic_mean": 1.3e-05, "val_confidence_mean": 1.0, "val_precision": 0.7307, "val_recall": 0.6466, "val_f1": 0.686, "val_f2": 0.6618, "val_mcc": 0.4357, "val_accuracy": 0.7188, "val_per_window": [{"fold": "fold_1", "regime": "Pre-crisis upturn + GFC onset", "sharpe": 0.3178, "sortino": 0.5291, "return_pct": 0.73, "equity": 1007.31, "max_dd": 3.62, "win_rate": 51.85, "profit_factor": 1.054, "ic": -0.0381, "hit": 51.38, "n": 109, "precision": 0.5238, "recall": 0.6, "f1": 0.5593, "f2": 0.583, "mcc": 0.045, "accuracy": 0.5229, "tp": 33, "fp": 30, "tn": 24, "fn": 22, "aleatoric_mean": 7e-06, "epistemic_mean": 1.3e-05, "confidence_mean": 1.0, "aleatoric_std": 4e-06, "epistemic_std": 8e-06}, {"fold": "fold_2", "regime": "Post-crash recovery", "sharpe": -0.0753, "sortino": -0.1174, "return_pct": -0.64, "equity": 993.61, "max_dd": 9.05, "win_rate": 50.0, "profit_factor": 0.988, "ic": -0.067, "hit": 50.0, "n": 108, "precision": 0.5818, "recall": 0.5079, "f1": 0.5424, "f2": 0.5212, "mcc": -0.0031, "accuracy": 0.5, "tp": 32, "fp": 23, "tn": 22, "fn": 31, "aleatoric_mean": 9e-06, "epistemic_mean": 1.8e-05, "confidence_mean": 1.0, "aleatoric_std": 4e-06, "epistemic_std": 7e-06}, {"fold": "fold_3", "regime": "Eurozone debt plateau", "sharpe": 12.5428, "sortino": 28.4706, "return_pct": 48.63, "equity": 1486.26, "max_dd": 0.7, "win_rate": 83.49, "profit_factor": 8.915, "ic": 0.7631, "hit": 81.98, "n": 111, "precision": 0.78, "recall": 0.8298, "f1": 0.8041, "f2": 0.8193, "mcc": 0.6534, "accuracy": 0.8288, "tp": 39, "fp": 11, "tn": 53, "fn": 8, "aleatoric_mean": 6e-06, "epistemic_mean": 1.1e-05, "confidence_mean": 1.0, "aleatoric_std": 2e-06, "epistemic_std": 4e-06}, {"fold": "fold_4", "regime": "Strong USD downturn", "sharpe": 14.9751, "sortino": 33.5526, "return_pct": 45.83, "equity": 1458.28, "max_dd": 0.64, "win_rate": 86.24, "profit_factor": 19.149, "ic": 0.8098, "hit": 85.45, "n": 110, "precision": 0.8636, "recall": 0.8085, "f1": 0.8352, "f2": 0.819, "mcc": 0.7202, "accuracy": 0.8636, "tp": 38, "fp": 6, "tn": 57, "fn": 9, "aleatoric_mean": 7e-06, "epistemic_mean": 1.4e-05, "confidence_mean": 1.0, "aleatoric_std": 2e-06, "epistemic_std": 5e-06}, {"fold": "fold_5", "regime": "Low-vol plateau", "sharpe": 10.6496, "sortino": 32.7415, "return_pct": 34.18, "equity": 1341.76, "max_dd": 0.55, "win_rate": 73.21, "profit_factor": 6.538, "ic": 0.7737, "hit": 73.21, "n": 112, "precision": 0.8286, "recall": 0.5472, "f1": 0.6591, "f2": 0.587, "mcc": 0.4799, "accuracy": 0.7321, "tp": 29, "fp": 6, "tn": 53, "fn": 24, "aleatoric_mean": 5e-06, "epistemic_mean": 1e-05, "confidence_mean": 1.0, "aleatoric_std": 2e-06, "epistemic_std": 3e-06}, {"fold": "fold_6", "regime": "EUR crisis downturn", "sharpe": 13.3693, "sortino": 57.4378, "return_pct": 26.31, "equity": 1263.14, "max_dd": 0.25, "win_rate": 81.31, "profit_factor": 13.306, "ic": 0.8839, "hit": 80.56, "n": 108, "precision": 0.8857, "recall": 0.6596, "f1": 0.7561, "f2": 0.6951, "mcc": 0.6292, "accuracy": 0.8148, "tp": 31, "fp": 4, "tn": 57, "fn": 16, "aleatoric_mean": 5e-06, "epistemic_mean": 1.1e-05, "confidence_mean": 1.0, "aleatoric_std": 2e-06, "epistemic_std": 3e-06}, {"fold": "fold_7", "regime": "Recent mixed/upturn", "sharpe": 11.4339, "sortino": 23.6986, "return_pct": 24.86, "equity": 1248.58, "max_dd": 0.56, "win_rate": 76.36, "profit_factor": 6.858, "ic": 0.763, "hit": 76.36, "n": 110, "precision": 0.8293, "recall": 0.6415, "f1": 0.7234, "f2": 0.6719, "mcc": 0.536, "accuracy": 0.7636, "tp": 34, "fp": 7, "tn": 50, "fn": 19, "aleatoric_mean": 8e-06, "epistemic_mean": 1.6e-05, "confidence_mean": 1.0, "aleatoric_std": 3e-06, "epistemic_std": 6e-06}], "train_sharpe": 7.154, "train_psr": 1.0, "train_equity": 2782400.25, "train_sortino": 18.9403, "train_return_pct": 278140.03, "train_max_dd": 5.63, "train_win_rate": 75.04, "train_profit_factor": 5.955, "train_ic": 0.7126, "train_hit": 74.74, "train_precision": 0.7985, "train_recall": 0.6876, "train_f1": 0.7389, "train_f2": 0.7073, "train_mcc": 0.5072, "train_accuracy": 0.7502, "train_per_window": [{"fold": "all_train", "regime": "Training data", "sharpe": 7.154, "sortino": 18.9403, "return_pct": 278140.03, "equity": 2782400.25, "max_dd": 5.63, "win_rate": 75.04, "profit_factor": 5.955, "ic": 0.7126, "hit": 74.74, "n": 2478, "precision": 0.7985, "recall": 0.6876, "f1": 0.7389, "f2": 0.7073, "mcc": 0.5072, "accuracy": 0.7502, "tp": 876, "fp": 221, "tn": 983, "fn": 398}], "experiment_num": 132, "status": "DISCARD"}
