{"backbone": "mlp", "description": "mlp: Exp46 hd=0.10 less head reg explore capacity (Srivastava2014) seed=0", "config": {"seq_len": 10, "lr": 0.0005, "batch_size": 32, "epochs": 50, "weight_decay": 1e-05, "patience": 10, "grad_clip": 1.0, "warmup_epochs": 0, "huber_delta": 0.5, "head_dropout": 0.1, "seed": 0, "het_loss": false}, "composite": 4.1546, "test_pos_folds": 7, "val_pos_folds": 7, "val_loss": 4.3e-05, "elapsed_sec": 24.1, "timestamp": "2026-04-19T17:38:40", "sharpe": 4.1546, "psr": 1.0, "equity": 5259.33, "sortino": 7.1894, "return_pct": 425.93, "max_dd": 5.63, "win_rate": 63.67, "profit_factor": 2.181, "ic": 0.3444, "hit": 63.41, "aleatoric_mean": 4.2e-05, "epistemic_mean": 8.5e-05, "confidence_mean": 0.9999, "precision": 0.6243, "recall": 0.6632, "f1": 0.6431, "f2": 0.655, "mcc": 0.2733, "accuracy": 0.6362, "per_window": [{"fold": "fold_1", "regime": "Pre-crisis upturn + GFC onset", "sharpe": 2.4277, "sortino": 6.5136, "return_pct": 19.49, "equity": 1194.9, "max_dd": 4.77, "win_rate": 60.78, "profit_factor": 1.79, "ic": 0.1612, "hit": 60.19, "n": 103, "precision": 0.6034, "recall": 0.6604, "f1": 0.6306, "f2": 0.6481, "mcc": 0.2019, "accuracy": 0.6019, "tp": 35, "fp": 23, "tn": 27, "fn": 18, "aleatoric_mean": 7.1e-05, "epistemic_mean": 0.000142, "confidence_mean": 0.9998, "aleatoric_std": 7.5e-05, "epistemic_std": 0.00015}, {"fold": "fold_2", "regime": "Post-crash recovery", "sharpe": 1.508, "sortino": 2.6626, "return_pct": 7.18, "equity": 1071.82, "max_dd": 5.63, "win_rate": 55.14, "profit_factor": 1.267, "ic": 0.0855, "hit": 55.14, "n": 107, "precision": 0.5185, "recall": 0.8235, "f1": 0.6364, "f2": 0.7368, "mcc": 0.148, "accuracy": 0.5514, "tp": 42, "fp": 39, "tn": 17, "fn": 9, "aleatoric_mean": 3e-05, "epistemic_mean": 5.9e-05, "confidence_mean": 0.9999, "aleatoric_std": 1.6e-05, "epistemic_std": 3.2e-05}, {"fold": "fold_3", "regime": "Eurozone debt plateau", "sharpe": 3.2667, "sortino": 5.045, "return_pct": 11.86, "equity": 1118.61, "max_dd": 4.3, "win_rate": 64.42, "profit_factor": 1.671, "ic": 0.354, "hit": 63.21, "n": 106, "precision": 0.6145, "recall": 0.8947, "f1": 0.7286, "f2": 0.8199, "mcc": 0.2923, "accuracy": 0.6415, "tp": 51, "fp": 32, "tn": 17, "fn": 6, "aleatoric_mean": 4.6e-05, "epistemic_mean": 9.2e-05, "confidence_mean": 0.9999, "aleatoric_std": 2.3e-05, "epistemic_std": 4.7e-05}, {"fold": "fold_4", "regime": "Strong USD downturn", "sharpe": 6.1631, "sortino": 9.7791, "return_pct": 55.67, "equity": 1556.67, "max_dd": 4.07, "win_rate": 67.66, "profit_factor": 2.865, "ic": 0.4931, "hit": 67.26, "n": 168, "precision": 0.7, "recall": 0.6512, "f1": 0.6747, "f2": 0.6604, "mcc": 0.3588, "accuracy": 0.6786, "tp": 56, "fp": 24, "tn": 58, "fn": 30, "aleatoric_mean": 6.1e-05, "epistemic_mean": 0.000122, "confidence_mean": 0.9998, "aleatoric_std": 4.3e-05, "epistemic_std": 8.6e-05}, {"fold": "fold_5", "regime": "Low-vol plateau", "sharpe": 6.446, "sortino": 9.1812, "return_pct": 21.92, "equity": 1219.22, "max_dd": 1.43, "win_rate": 64.2, "profit_factor": 2.974, "ic": 0.4619, "hit": 64.2, "n": 162, "precision": 0.65, "recall": 0.5132, "f1": 0.5735, "f2": 0.5357, "mcc": 0.278, "accuracy": 0.642, "tp": 39, "fp": 21, "tn": 65, "fn": 37, "aleatoric_mean": 2.5e-05, "epistemic_mean": 5e-05, "confidence_mean": 0.9999, "aleatoric_std": 1.2e-05, "epistemic_std": 2.5e-05}, {"fold": "fold_6", "regime": "EUR crisis downturn", "sharpe": 6.1746, "sortino": 10.3123, "return_pct": 43.25, "equity": 1432.51, "max_dd": 3.35, "win_rate": 65.45, "profit_factor": 2.738, "ic": 0.4826, "hit": 65.45, "n": 165, "precision": 0.7083, "recall": 0.4416, "f1": 0.544, "f2": 0.4775, "mcc": 0.3103, "accuracy": 0.6545, "tp": 34, "fp": 14, "tn": 74, "fn": 43, "aleatoric_mean": 4.1e-05, "epistemic_mean": 8.2e-05, "confidence_mean": 0.9999, "aleatoric_std": 3.2e-05, "epistemic_std": 6.3e-05}, {"fold": "fold_7", "regime": "Recent mixed/upturn", "sharpe": 5.3648, "sortino": 8.9361, "return_pct": 35.03, "equity": 1350.26, "max_dd": 2.72, "win_rate": 64.2, "profit_factor": 2.504, "ic": 0.4352, "hit": 64.2, "n": 162, "precision": 0.6139, "recall": 0.7654, "f1": 0.6813, "f2": 0.7294, "mcc": 0.293, "accuracy": 0.642, "tp": 62, "fp": 39, "tn": 42, "fn": 19, "aleatoric_mean": 3e-05, "epistemic_mean": 6e-05, "confidence_mean": 0.9999, "aleatoric_std": 2.1e-05, "epistemic_std": 4.1e-05}], "val_sharpe": 5.0861, "val_psr": 1.0, "val_equity": 3130.36, "val_sortino": 8.2105, "val_return_pct": 213.04, "val_max_dd": 5.23, "val_win_rate": 62.78, "val_profit_factor": 2.385, "val_ic": 0.3898, "val_hit": 62.37, "val_aleatoric_mean": 2.6e-05, "val_epistemic_mean": 5.2e-05, "val_confidence_mean": 0.9999, "val_precision": 0.6042, "val_recall": 0.6274, "val_f1": 0.6156, "val_f2": 0.6226, "val_mcc": 0.2549, "val_accuracy": 0.6276, "val_per_window": [{"fold": "fold_1", "regime": "Pre-crisis upturn + GFC onset", "sharpe": 1.3342, "sortino": 2.4559, "return_pct": 3.34, "equity": 1033.38, "max_dd": 5.23, "win_rate": 46.3, "profit_factor": 1.248, "ic": 0.0866, "hit": 45.87, "n": 109, "precision": 0.4776, "recall": 0.5818, "f1": 0.5246, "f2": 0.5575, "mcc": -0.0681, "accuracy": 0.4679, "tp": 32, "fp": 35, "tn": 19, "fn": 23, "aleatoric_mean": 2.6e-05, "epistemic_mean": 5.2e-05, "confidence_mean": 0.9999, "aleatoric_std": 2.8e-05, "epistemic_std": 5.6e-05}, {"fold": "fold_2", "regime": "Post-crash recovery", "sharpe": 0.981, "sortino": 1.5414, "return_pct": 4.58, "equity": 1045.81, "max_dd": 5.03, "win_rate": 50.93, "profit_factor": 1.168, "ic": 0.1986, "hit": 50.93, "n": 108, "precision": 0.6316, "recall": 0.381, "f1": 0.4752, "f2": 0.4138, "mcc": 0.0721, "accuracy": 0.5093, "tp": 24, "fp": 14, "tn": 31, "fn": 39, "aleatoric_mean": 4.5e-05, "epistemic_mean": 8.9e-05, "confidence_mean": 0.9999, "aleatoric_std": 3.7e-05, "epistemic_std": 7.3e-05}, {"fold": "fold_3", "regime": "Eurozone debt plateau", "sharpe": 7.4753, "sortino": 16.9342, "return_pct": 31.22, "equity": 1312.23, "max_dd": 1.46, "win_rate": 66.97, "profit_factor": 3.43, "ic": 0.557, "hit": 65.77, "n": 111, "precision": 0.5672, "recall": 0.8085, "f1": 0.6667, "f2": 0.7451, "mcc": 0.359, "accuracy": 0.6577, "tp": 38, "fp": 29, "tn": 35, "fn": 9, "aleatoric_mean": 3.2e-05, "epistemic_mean": 6.3e-05, "confidence_mean": 0.9999, "aleatoric_std": 1.7e-05, "epistemic_std": 3.4e-05}, {"fold": "fold_4", "regime": "Strong USD downturn", "sharpe": 5.9989, "sortino": 13.6095, "return_pct": 21.37, "equity": 1213.7, "max_dd": 1.41, "win_rate": 65.14, "profit_factor": 2.731, "ic": 0.5203, "hit": 64.55, "n": 110, "precision": 0.5738, "recall": 0.7447, "f1": 0.6481, "f2": 0.7028, "mcc": 0.3304, "accuracy": 0.6545, "tp": 35, "fp": 26, "tn": 37, "fn": 12, "aleatoric_mean": 2.6e-05, "epistemic_mean": 5.1e-05, "confidence_mean": 0.9999, "aleatoric_std": 2e-05, "epistemic_std": 4e-05}, {"fold": "fold_5", "regime": "Low-vol plateau", "sharpe": 9.8348, "sortino": 18.6095, "return_pct": 32.03, "equity": 1320.28, "max_dd": 1.09, "win_rate": 74.11, "profit_factor": 5.547, "ic": 0.6596, "hit": 74.11, "n": 112, "precision": 0.7308, "recall": 0.717, "f1": 0.7238, "f2": 0.7197, "mcc": 0.4802, "accuracy": 0.7411, "tp": 38, "fp": 14, "tn": 45, "fn": 15, "aleatoric_mean": 2.4e-05, "epistemic_mean": 4.9e-05, "confidence_mean": 0.9999, "aleatoric_std": 1.8e-05, "epistemic_std": 3.6e-05}, {"fold": "fold_6", "regime": "EUR crisis downturn", "sharpe": 8.4021, "sortino": 19.574, "return_pct": 18.47, "equity": 1184.68, "max_dd": 1.19, "win_rate": 71.03, "profit_factor": 4.329, "ic": 0.5886, "hit": 70.37, "n": 108, "precision": 0.7353, "recall": 0.5319, "f1": 0.6173, "f2": 0.5631, "mcc": 0.4103, "accuracy": 0.713, "tp": 25, "fp": 9, "tn": 52, "fn": 22, "aleatoric_mean": 1.5e-05, "epistemic_mean": 2.9e-05, "confidence_mean": 1.0, "aleatoric_std": 5e-06, "epistemic_std": 1.1e-05}, {"fold": "fold_7", "regime": "Recent mixed/upturn", "sharpe": 6.8776, "sortino": 15.211, "return_pct": 16.28, "equity": 1162.76, "max_dd": 1.4, "win_rate": 64.55, "profit_factor": 3.057, "ic": 0.389, "hit": 64.55, "n": 110, "precision": 0.6167, "recall": 0.6981, "f1": 0.6549, "f2": 0.6801, "mcc": 0.2956, "accuracy": 0.6455, "tp": 37, "fp": 23, "tn": 34, "fn": 16, "aleatoric_mean": 1.7e-05, "epistemic_mean": 3.3e-05, "confidence_mean": 1.0, "aleatoric_std": 1.1e-05, "epistemic_std": 2.2e-05}], "train_sharpe": 6.673, "train_psr": 1.0, "train_equity": 1765428.25, "train_sortino": 19.0306, "train_return_pct": 176442.82, "train_max_dd": 3.03, "train_win_rate": 72.29, "train_profit_factor": 5.097, "train_ic": 0.6303, "train_hit": 71.99, "train_precision": 0.7349, "train_recall": 0.7182, "train_f1": 0.7265, "train_f2": 0.7215, "train_mcc": 0.444, "train_accuracy": 0.722, "train_per_window": [{"fold": "all_train", "regime": "Training data", "sharpe": 6.673, "sortino": 19.0306, "return_pct": 176442.82, "equity": 1765428.25, "max_dd": 3.03, "win_rate": 72.29, "profit_factor": 5.097, "ic": 0.6303, "hit": 71.99, "n": 2478, "precision": 0.7349, "recall": 0.7182, "f1": 0.7265, "f2": 0.7215, "mcc": 0.444, "accuracy": 0.722, "tp": 915, "fp": 330, "tn": 874, "fn": 359}], "experiment_num": 103, "status": "DISCARD"}
{"backbone": "mlp", "description": "mlp: Exp47 hidden=192 more capacity break trade-off (Tan2019 width scaling) seed=0", "config": {"seq_len": 10, "lr": 0.0005, "batch_size": 32, "epochs": 50, "weight_decay": 1e-05, "patience": 10, "grad_clip": 1.0, "warmup_epochs": 0, "huber_delta": 0.5, "head_dropout": 0.15, "seed": 0, "hidden_size": 192, "het_loss": false}, "composite": 4.5891, "test_pos_folds": 6, "val_pos_folds": 7, "val_loss": 3.8e-05, "elapsed_sec": 36.5, "timestamp": "2026-04-19T17:40:48", "sharpe": 4.6891, "psr": 1.0, "equity": 6423.79, "sortino": 8.5851, "return_pct": 542.38, "max_dd": 20.78, "win_rate": 65.33, "profit_factor": 2.421, "ic": 0.4123, "hit": 65.06, "aleatoric_mean": 3.9e-05, "epistemic_mean": 7.8e-05, "confidence_mean": 0.9999, "precision": 0.6231, "recall": 0.7526, "f1": 0.6817, "f2": 0.7226, "mcc": 0.3134, "accuracy": 0.6526, "per_window": [{"fold": "fold_1", "regime": "Pre-crisis upturn + GFC onset", "sharpe": 0.9214, "sortino": 2.6355, "return_pct": 6.6, "equity": 1065.99, "max_dd": 6.69, "win_rate": 50.0, "profit_factor": 1.244, "ic": 0.042, "hit": 49.51, "n": 103, "precision": 0.5192, "recall": 0.5094, "f1": 0.5143, "f2": 0.5114, "mcc": 0.0094, "accuracy": 0.5049, "tp": 27, "fp": 25, "tn": 25, "fn": 26, "aleatoric_mean": 8e-05, "epistemic_mean": 0.000161, "confidence_mean": 0.9998, "aleatoric_std": 0.000111, "epistemic_std": 0.000222}, {"fold": "fold_2", "regime": "Post-crash recovery", "sharpe": -1.7829, "sortino": -2.9663, "return_pct": -8.4, "equity": 915.97, "max_dd": 14.49, "win_rate": 46.73, "profit_factor": 0.756, "ic": -0.091, "hit": 46.73, "n": 107, "precision": 0.4516, "recall": 0.549, "f1": 0.4956, "f2": 0.5263, "mcc": -0.0588, "accuracy": 0.4673, "tp": 28, "fp": 34, "tn": 22, "fn": 23, "aleatoric_mean": 3.1e-05, "epistemic_mean": 6.1e-05, "confidence_mean": 0.9999, "aleatoric_std": 2.1e-05, "epistemic_std": 4.1e-05}, {"fold": "fold_3", "regime": "Eurozone debt plateau", "sharpe": 6.2573, "sortino": 11.0235, "return_pct": 22.77, "equity": 1227.72, "max_dd": 2.2, "win_rate": 66.35, "profit_factor": 2.682, "ic": 0.4885, "hit": 65.09, "n": 106, "precision": 0.6786, "recall": 0.6667, "f1": 0.6726, "f2": 0.669, "mcc": 0.2989, "accuracy": 0.6509, "tp": 38, "fp": 18, "tn": 31, "fn": 19, "aleatoric_mean": 3.8e-05, "epistemic_mean": 7.6e-05, "confidence_mean": 0.9999, "aleatoric_std": 1.9e-05, "epistemic_std": 3.9e-05}, {"fold": "fold_4", "regime": "Strong USD downturn", "sharpe": 8.3246, "sortino": 15.2565, "return_pct": 76.68, "equity": 1766.8, "max_dd": 2.3, "win_rate": 73.65, "profit_factor": 4.251, "ic": 0.5433, "hit": 73.21, "n": 168, "precision": 0.7019, "recall": 0.8488, "f1": 0.7684, "f2": 0.8147, "mcc": 0.4846, "accuracy": 0.7381, "tp": 73, "fp": 31, "tn": 51, "fn": 13, "aleatoric_mean": 5.3e-05, "epistemic_mean": 0.000106, "confidence_mean": 0.9998, "aleatoric_std": 3.5e-05, "epistemic_std": 7e-05}, {"fold": "fold_5", "regime": "Low-vol plateau", "sharpe": 7.4848, "sortino": 17.0407, "return_pct": 25.21, "equity": 1252.07, "max_dd": 1.19, "win_rate": 67.28, "profit_factor": 3.577, "ic": 0.5278, "hit": 67.28, "n": 162, "precision": 0.6186, "recall": 0.7895, "f1": 0.6936, "f2": 0.7481, "mcc": 0.3658, "accuracy": 0.6728, "tp": 60, "fp": 37, "tn": 49, "fn": 16, "aleatoric_mean": 2.1e-05, "epistemic_mean": 4.1e-05, "confidence_mean": 0.9999, "aleatoric_std": 1.2e-05, "epistemic_std": 2.4e-05}, {"fold": "fold_6", "regime": "EUR crisis downturn", "sharpe": 9.2503, "sortino": 19.6858, "return_pct": 64.93, "equity": 1649.34, "max_dd": 1.5, "win_rate": 73.33, "profit_factor": 4.645, "ic": 0.5953, "hit": 73.33, "n": 165, "precision": 0.6897, "recall": 0.7792, "f1": 0.7317, "f2": 0.7595, "mcc": 0.4721, "accuracy": 0.7333, "tp": 60, "fp": 27, "tn": 61, "fn": 17, "aleatoric_mean": 3.6e-05, "epistemic_mean": 7.3e-05, "confidence_mean": 0.9999, "aleatoric_std": 2.8e-05, "epistemic_std": 5.6e-05}, {"fold": "fold_7", "regime": "Recent mixed/upturn", "sharpe": 7.1144, "sortino": 13.3521, "return_pct": 46.87, "equity": 1468.68, "max_dd": 2.75, "win_rate": 67.9, "profit_factor": 3.428, "ic": 0.5662, "hit": 67.9, "n": 162, "precision": 0.6179, "recall": 0.9383, "f1": 0.7451, "f2": 0.8501, "mcc": 0.4187, "accuracy": 0.679, "tp": 76, "fp": 47, "tn": 34, "fn": 5, "aleatoric_mean": 2.6e-05, "epistemic_mean": 5.1e-05, "confidence_mean": 0.9999, "aleatoric_std": 1.6e-05, "epistemic_std": 3.2e-05}], "val_sharpe": 5.3442, "val_psr": 1.0, "val_equity": 3299.37, "val_sortino": 8.7353, "val_return_pct": 229.94, "val_max_dd": 4.3, "val_win_rate": 62.78, "val_profit_factor": 2.496, "val_ic": 0.4081, "val_hit": 62.37, "val_aleatoric_mean": 2e-05, "val_epistemic_mean": 4e-05, "val_confidence_mean": 0.9999, "val_precision": 0.5841, "val_recall": 0.7425, "val_f1": 0.6538, "val_f2": 0.7043, "val_mcc": 0.2691, "val_accuracy": 0.6263, "val_per_window": [{"fold": "fold_1", "regime": "Pre-crisis upturn + GFC onset", "sharpe": 0.5226, "sortino": 0.9463, "return_pct": 1.25, "equity": 1012.53, "max_dd": 3.57, "win_rate": 47.22, "profit_factor": 1.091, "ic": -0.0856, "hit": 46.79, "n": 109, "precision": 0.48, "recall": 0.6545, "f1": 0.5538, "f2": 0.6102, "mcc": -0.073, "accuracy": 0.4679, "tp": 36, "fp": 39, "tn": 15, "fn": 19, "aleatoric_mean": 2e-05, "epistemic_mean": 4.1e-05, "confidence_mean": 0.9999, "aleatoric_std": 2e-05, "epistemic_std": 4e-05}, {"fold": "fold_2", "regime": "Post-crash recovery", "sharpe": 0.8414, "sortino": 1.2974, "return_pct": 3.88, "equity": 1038.78, "max_dd": 4.3, "win_rate": 52.78, "profit_factor": 1.142, "ic": -0.0812, "hit": 52.78, "n": 108, "precision": 0.5789, "recall": 0.6984, "f1": 0.6331, "f2": 0.6707, "mcc": -0.0137, "accuracy": 0.5278, "tp": 44, "fp": 32, "tn": 13, "fn": 19, "aleatoric_mean": 3.3e-05, "epistemic_mean": 6.6e-05, "confidence_mean": 0.9999, "aleatoric_std": 2.2e-05, "epistemic_std": 4.5e-05}, {"fold": "fold_3", "regime": "Eurozone debt plateau", "sharpe": 9.2054, "sortino": 22.717, "return_pct": 37.75, "equity": 1377.53, "max_dd": 2.41, "win_rate": 70.64, "profit_factor": 4.649, "ic": 0.631, "hit": 69.37, "n": 111, "precision": 0.6207, "recall": 0.766, "f1": 0.6857, "f2": 0.7317, "mcc": 0.4177, "accuracy": 0.7027, "tp": 36, "fp": 22, "tn": 42, "fn": 11, "aleatoric_mean": 2.5e-05, "epistemic_mean": 5e-05, "confidence_mean": 0.9999, "aleatoric_std": 1.4e-05, "epistemic_std": 2.8e-05}, {"fold": "fold_4", "regime": "Strong USD downturn", "sharpe": 9.6336, "sortino": 24.3971, "return_pct": 32.96, "equity": 1329.61, "max_dd": 1.26, "win_rate": 71.56, "profit_factor": 5.27, "ic": 0.6439, "hit": 70.91, "n": 110, "precision": 0.7, "recall": 0.5957, "f1": 0.6437, "f2": 0.614, "mcc": 0.4168, "accuracy": 0.7182, "tp": 28, "fp": 12, "tn": 51, "fn": 19, "aleatoric_mean": 2.1e-05, "epistemic_mean": 4.2e-05, "confidence_mean": 0.9999, "aleatoric_std": 2.1e-05, "epistemic_std": 4.2e-05}, {"fold": "fold_5", "regime": "Low-vol plateau", "sharpe": 7.5765, "sortino": 20.4901, "return_pct": 25.48, "equity": 1254.84, "max_dd": 2.58, "win_rate": 64.29, "profit_factor": 3.63, "ic": 0.609, "hit": 64.29, "n": 112, "precision": 0.614, "recall": 0.6604, "f1": 0.6364, "f2": 0.6506, "mcc": 0.2871, "accuracy": 0.6429, "tp": 35, "fp": 22, "tn": 37, "fn": 18, "aleatoric_mean": 1.7e-05, "epistemic_mean": 3.4e-05, "confidence_mean": 0.9999, "aleatoric_std": 9e-06, "epistemic_std": 1.9e-05}, {"fold": "fold_6", "regime": "EUR crisis downturn", "sharpe": 7.8557, "sortino": 17.5719, "return_pct": 17.43, "equity": 1174.27, "max_dd": 0.77, "win_rate": 68.22, "profit_factor": 3.905, "ic": 0.66, "hit": 67.59, "n": 108, "precision": 0.5833, "recall": 0.8936, "f1": 0.7059, "f2": 0.8077, "mcc": 0.4226, "accuracy": 0.6759, "tp": 42, "fp": 30, "tn": 31, "fn": 5, "aleatoric_mean": 1.2e-05, "epistemic_mean": 2.5e-05, "confidence_mean": 1.0, "aleatoric_std": 5e-06, "epistemic_std": 9e-06}, {"fold": "fold_7", "regime": "Recent mixed/upturn", "sharpe": 6.8557, "sortino": 15.6312, "return_pct": 16.23, "equity": 1162.29, "max_dd": 1.7, "win_rate": 64.55, "profit_factor": 3.046, "ic": 0.5013, "hit": 64.55, "n": 110, "precision": 0.5814, "recall": 0.9434, "f1": 0.7194, "f2": 0.8389, "mcc": 0.3772, "accuracy": 0.6455, "tp": 50, "fp": 36, "tn": 21, "fn": 3, "aleatoric_mean": 1.2e-05, "epistemic_mean": 2.4e-05, "confidence_mean": 1.0, "aleatoric_std": 8e-06, "epistemic_std": 1.7e-05}], "train_sharpe": 7.4307, "train_psr": 1.0, "train_equity": 3589900.0, "train_sortino": 23.5042, "train_return_pct": 358890.0, "train_max_dd": 3.15, "train_win_rate": 74.27, "train_profit_factor": 6.551, "train_ic": 0.7023, "train_hit": 73.97, "train_precision": 0.7327, "train_recall": 0.781, "train_f1": 0.7561, "train_f2": 0.7708, "train_mcc": 0.4815, "train_accuracy": 0.7409, "train_per_window": [{"fold": "all_train", "regime": "Training data", "sharpe": 7.4307, "sortino": 23.5042, "return_pct": 358890.0, "equity": 3589900.0, "max_dd": 3.15, "win_rate": 74.27, "profit_factor": 6.551, "ic": 0.7023, "hit": 73.97, "n": 2478, "precision": 0.7327, "recall": 0.781, "f1": 0.7561, "f2": 0.7708, "mcc": 0.4815, "accuracy": 0.7409, "tp": 995, "fp": 363, "tn": 841, "fn": 279}], "experiment_num": 104, "status": "DISCARD"}
