{"backbone": "nbeats", "description": "nbeats: Exp1 baseline seq=10", "config": {"seq_len": 10, "lr": 0.001, "batch_size": 32, "epochs": 100, "weight_decay": 0.0001, "patience": 20, "grad_clip": 1.0, "warmup_epochs": 0, "huber_delta": 1.0, "head_dropout": 0.1, "seed": 42, "het_loss": false}, "composite": -0.1521, "test_pos_folds": 4, "val_pos_folds": 5, "val_loss": 3.8e-05, "elapsed_sec": 79.4, "timestamp": "2026-04-21T12:31:35", "sharpe": 0.3479, "psr": 0.7533, "equity": 1130.8, "sortino": 0.4845, "return_pct": 13.08, "max_dd": 10.85, "win_rate": 52.63, "profit_factor": 1.066, "ic": 0.0359, "hit": 52.42, "aleatoric_mean": 0.000104, "epistemic_mean": 0.000209, "confidence_mean": 0.9997, "precision": 0.5126, "recall": 0.763, "f1": 0.6132, "f2": 0.6951, "mcc": 0.0608, "accuracy": 0.5242, "per_window": [{"fold": "fold_1", "regime": "Pre-crisis upturn + GFC onset", "sharpe": 1.0026, "sortino": 1.1965, "return_pct": 7.24, "equity": 1072.43, "max_dd": 6.87, "win_rate": 53.92, "profit_factor": 1.268, "ic": 0.0934, "hit": 53.4, "n": 103, "precision": 0.5253, "recall": 0.9811, "f1": 0.6842, "f2": 0.836, "mcc": 0.1064, "accuracy": 0.534, "tp": 52, "fp": 47, "tn": 3, "fn": 1, "aleatoric_mean": 0.000103, "epistemic_mean": 0.000207, "confidence_mean": 0.9997, "aleatoric_std": 3.5e-05, "epistemic_std": 7.1e-05}, {"fold": "fold_2", "regime": "Post-crash recovery", "sharpe": -1.5129, "sortino": -2.3866, "return_pct": -7.23, "equity": 927.73, "max_dd": 8.6, "win_rate": 52.34, "profit_factor": 0.789, "ic": -0.0272, "hit": 52.34, "n": 107, "precision": 0.5, "recall": 0.8824, "f1": 0.6383, "f2": 0.7653, "mcc": 0.1076, "accuracy": 0.5234, "tp": 45, "fp": 45, "tn": 11, "fn": 6, "aleatoric_mean": 0.000108, "epistemic_mean": 0.000216, "confidence_mean": 0.9997, "aleatoric_std": 3.7e-05, "epistemic_std": 7.4e-05}, {"fold": "fold_3", "regime": "Eurozone debt plateau", "sharpe": -0.458, "sortino": -0.758, "return_pct": -1.76, "equity": 982.41, "max_dd": 4.59, "win_rate": 52.88, "profit_factor": 0.931, "ic": -0.129, "hit": 51.89, "n": 106, "precision": 0.5349, "recall": 0.807, "f1": 0.6434, "f2": 0.7325, "mcc": -0.0119, "accuracy": 0.5189, "tp": 46, "fp": 40, "tn": 9, "fn": 11, "aleatoric_mean": 0.000105, "epistemic_mean": 0.00021, "confidence_mean": 0.9997, "aleatoric_std": 3e-05, "epistemic_std": 6e-05}, {"fold": "fold_4", "regime": "Strong USD downturn", "sharpe": 1.0455, "sortino": 1.7168, "return_pct": 7.97, "equity": 1079.66, "max_dd": 6.51, "win_rate": 50.3, "profit_factor": 1.192, "ic": 0.0711, "hit": 50.0, "n": 168, "precision": 0.5074, "recall": 0.8023, "f1": 0.6216, "f2": 0.7187, "mcc": -0.0188, "accuracy": 0.5, "tp": 69, "fp": 67, "tn": 15, "fn": 17, "aleatoric_mean": 0.000105, "epistemic_mean": 0.000209, "confidence_mean": 0.9997, "aleatoric_std": 3.2e-05, "epistemic_std": 6.3e-05}, {"fold": "fold_5", "regime": "Low-vol plateau", "sharpe": 1.382, "sortino": 1.8913, "return_pct": 4.61, "equity": 1046.06, "max_dd": 2.31, "win_rate": 58.02, "profit_factor": 1.259, "ic": 0.1442, "hit": 58.02, "n": 162, "precision": 0.5588, "recall": 0.5, "f1": 0.5278, "f2": 0.5108, "mcc": 0.1529, "accuracy": 0.5802, "tp": 38, "fp": 30, "tn": 56, "fn": 38, "aleatoric_mean": 0.000102, "epistemic_mean": 0.000204, "confidence_mean": 0.9997, "aleatoric_std": 3.4e-05, "epistemic_std": 6.8e-05}, {"fold": "fold_6", "regime": "EUR crisis downturn", "sharpe": -0.8769, "sortino": -1.3495, "return_pct": -5.65, "equity": 943.48, "max_dd": 9.39, "win_rate": 48.48, "profit_factor": 0.868, "ic": 0.0595, "hit": 48.48, "n": 165, "precision": 0.4697, "recall": 0.8052, "f1": 0.5933, "f2": 0.7045, "mcc": 0.0121, "accuracy": 0.4848, "tp": 62, "fp": 70, "tn": 18, "fn": 15, "aleatoric_mean": 0.000106, "epistemic_mean": 0.000213, "confidence_mean": 0.9997, "aleatoric_std": 3.6e-05, "epistemic_std": 7.3e-05}, {"fold": "fold_7", "regime": "Recent mixed/upturn", "sharpe": 1.4317, "sortino": 2.4906, "return_pct": 8.57, "equity": 1085.75, "max_dd": 4.65, "win_rate": 53.09, "profit_factor": 1.274, "ic": -0.0175, "hit": 53.09, "n": 162, "precision": 0.5238, "recall": 0.679, "f1": 0.5914, "f2": 0.641, "mcc": 0.0646, "accuracy": 0.5309, "tp": 55, "fp": 50, "tn": 31, "fn": 26, "aleatoric_mean": 0.000103, "epistemic_mean": 0.000206, "confidence_mean": 0.9997, "aleatoric_std": 3.6e-05, "epistemic_std": 7.3e-05}], "val_sharpe": 1.6492, "val_psr": 0.9981, "val_equity": 1462.82, "val_sortino": 2.6361, "val_return_pct": 46.28, "val_max_dd": 6.62, "val_win_rate": 52.16, "val_profit_factor": 1.322, "val_ic": 0.1281, "val_hit": 51.82, "val_aleatoric_mean": 0.000102, "val_epistemic_mean": 0.000205, "val_confidence_mean": 0.9997, "val_precision": 0.4979, "val_recall": 0.6521, "val_f1": 0.5647, "val_f2": 0.614, "val_mcc": 0.0582, "val_accuracy": 0.5221, "val_per_window": [{"fold": "fold_1", "regime": "Pre-crisis upturn + GFC onset", "sharpe": -0.1767, "sortino": -0.2735, "return_pct": -0.52, "equity": 994.82, "max_dd": 6.62, "win_rate": 43.52, "profit_factor": 0.971, "ic": 0.0295, "hit": 43.12, "n": 109, "precision": 0.45, "recall": 0.4909, "f1": 0.4696, "f2": 0.4821, "mcc": -0.1208, "accuracy": 0.4404, "tp": 27, "fp": 33, "tn": 21, "fn": 28, "aleatoric_mean": 0.0001, "epistemic_mean": 0.000199, "confidence_mean": 0.9997, "aleatoric_std": 3.1e-05, "epistemic_std": 6.3e-05}, {"fold": "fold_2", "regime": "Post-crash recovery", "sharpe": 2.5686, "sortino": 4.0544, "return_pct": 12.79, "equity": 1127.92, "max_dd": 5.4, "win_rate": 61.11, "profit_factor": 1.5, "ic": 0.1523, "hit": 61.11, "n": 108, "precision": 0.604, "recall": 0.9683, "f1": 0.7439, "f2": 0.864, "mcc": 0.1589, "accuracy": 0.6111, "tp": 61, "fp": 40, "tn": 5, "fn": 2, "aleatoric_mean": 0.000108, "epistemic_mean": 0.000216, "confidence_mean": 0.9997, "aleatoric_std": 3.4e-05, "epistemic_std": 6.8e-05}, {"fold": "fold_3", "regime": "Eurozone debt plateau", "sharpe": 3.4804, "sortino": 7.3369, "return_pct": 14.53, "equity": 1145.31, "max_dd": 3.86, "win_rate": 54.13, "profit_factor": 1.762, "ic": 0.2149, "hit": 53.15, "n": 111, "precision": 0.4744, "recall": 0.7872, "f1": 0.592, "f2": 0.6955, "mcc": 0.1585, "accuracy": 0.5405, "tp": 37, "fp": 41, "tn": 23, "fn": 10, "aleatoric_mean": 0.000102, "epistemic_mean": 0.000205, "confidence_mean": 0.9997, "aleatoric_std": 3.3e-05, "epistemic_std": 6.7e-05}, {"fold": "fold_4", "regime": "Strong USD downturn", "sharpe": 0.2686, "sortino": 0.363, "return_pct": 0.8, "equity": 1007.98, "max_dd": 4.98, "win_rate": 58.72, "profit_factor": 1.045, "ic": 0.1227, "hit": 58.18, "n": 110, "precision": 0.507, "recall": 0.766, "f1": 0.6102, "f2": 0.695, "mcc": 0.2176, "accuracy": 0.5818, "tp": 36, "fp": 35, "tn": 28, "fn": 11, "aleatoric_mean": 0.000105, "epistemic_mean": 0.00021, "confidence_mean": 0.9997, "aleatoric_std": 3.5e-05, "epistemic_std": 7e-05}, {"fold": "fold_5", "regime": "Low-vol plateau", "sharpe": 2.5821, "sortino": 5.5178, "return_pct": 8.74, "equity": 1087.44, "max_dd": 2.24, "win_rate": 48.21, "profit_factor": 1.537, "ic": 0.1999, "hit": 48.21, "n": 112, "precision": 0.451, "recall": 0.434, "f1": 0.4423, "f2": 0.4373, "mcc": -0.0407, "accuracy": 0.4821, "tp": 23, "fp": 28, "tn": 31, "fn": 30, "aleatoric_mean": 0.000101, "epistemic_mean": 0.000202, "confidence_mean": 0.9997, "aleatoric_std": 3.2e-05, "epistemic_std": 6.4e-05}, {"fold": "fold_6", "regime": "EUR crisis downturn", "sharpe": 1.846, "sortino": 3.2795, "return_pct": 4.23, "equity": 1042.25, "max_dd": 2.67, "win_rate": 52.34, "profit_factor": 1.365, "ic": 0.1309, "hit": 51.85, "n": 108, "precision": 0.463, "recall": 0.5319, "f1": 0.495, "f2": 0.5165, "mcc": 0.056, "accuracy": 0.5278, "tp": 25, "fp": 29, "tn": 32, "fn": 22, "aleatoric_mean": 0.000101, "epistemic_mean": 0.000201, "confidence_mean": 0.9997, "aleatoric_std": 3.5e-05, "epistemic_std": 7e-05}, {"fold": "fold_7", "regime": "Recent mixed/upturn", "sharpe": -0.1245, "sortino": -0.19, "return_pct": -0.36, "equity": 996.36, "max_dd": 4.82, "win_rate": 47.27, "profit_factor": 0.98, "ic": -0.0885, "hit": 47.27, "n": 110, "precision": 0.4603, "recall": 0.5472, "f1": 0.5, "f2": 0.5273, "mcc": -0.0498, "accuracy": 0.4727, "tp": 29, "fp": 34, "tn": 23, "fn": 24, "aleatoric_mean": 0.0001, "epistemic_mean": 0.0002, "confidence_mean": 0.9997, "aleatoric_std": 3e-05, "epistemic_std": 6e-05}], "train_sharpe": 0.7957, "train_psr": 0.9944, "train_equity": 2458.14, "train_sortino": 1.0173, "train_return_pct": 145.81, "train_max_dd": 19.16, "train_win_rate": 53.61, "train_profit_factor": 1.19, "train_ic": 0.0943, "train_hit": 53.39, "train_precision": 0.5292, "train_recall": 0.8611, "train_f1": 0.6555, "train_f2": 0.7651, "train_mcc": 0.0682, "train_accuracy": 0.5347, "train_per_window": [{"fold": "all_train", "regime": "Training data", "sharpe": 0.7957, "sortino": 1.0173, "return_pct": 145.81, "equity": 2458.14, "max_dd": 19.16, "win_rate": 53.61, "profit_factor": 1.19, "ic": 0.0943, "hit": 53.39, "n": 2478, "precision": 0.5292, "recall": 0.8611, "f1": 0.6555, "f2": 0.7651, "mcc": 0.0682, "accuracy": 0.5347, "tp": 1097, "fp": 976, "tn": 228, "fn": 177}], "experiment_num": 243, "status": "DISCARD"}
{"backbone": "nbeats", "description": "nbeats: Exp2 seq=60 (GBM-winning)", "config": {"seq_len": 60, "lr": 0.001, "batch_size": 32, "epochs": 100, "weight_decay": 0.0001, "patience": 20, "grad_clip": 1.0, "warmup_epochs": 0, "huber_delta": 1.0, "head_dropout": 0.1, "seed": 42, "het_loss": false}, "composite": -0.9695, "test_pos_folds": 4, "val_pos_folds": 5, "val_loss": 3.9e-05, "elapsed_sec": 65.9, "timestamp": "2026-04-21T12:32:52", "sharpe": -0.4695, "psr": 0.2308, "equity": 886.35, "sortino": -0.7128, "return_pct": -11.37, "max_dd": 19.69, "win_rate": 49.92, "profit_factor": 0.924, "ic": -0.0095, "hit": 49.6, "aleatoric_mean": 2.9e-05, "epistemic_mean": 5.8e-05, "confidence_mean": 0.9999, "precision": 0.4968, "recall": 0.9935, "f1": 0.6624, "f2": 0.828, "mcc": -0.0235, "accuracy": 0.496, "per_window": [{"fold": "fold_1", "regime": "Pre-crisis upturn + GFC onset", "sharpe": 0.2736, "sortino": 0.4793, "return_pct": 0.47, "equity": 1004.73, "max_dd": 3.8, "win_rate": 50.0, "profit_factor": 1.043, "ic": -0.0518, "hit": 49.06, "n": 53, "precision": 0.4906, "recall": 1.0, "f1": 0.6582, "f2": 0.828, "mcc": 0.0, "accuracy": 0.4906, "tp": 26, "fp": 27, "tn": 0, "fn": 0, "aleatoric_mean": 2.7e-05, "epistemic_mean": 5.5e-05, "confidence_mean": 0.9999, "aleatoric_std": 8e-06, "epistemic_std": 1.6e-05}, {"fold": "fold_2", "regime": "Post-crash recovery", "sharpe": -2.3923, "sortino": -3.7055, "return_pct": -6.71, "equity": 932.92, "max_dd": 10.16, "win_rate": 52.63, "profit_factor": 0.681, "ic": -0.2191, "hit": 52.63, "n": 57, "precision": 0.5357, "recall": 0.9677, "f1": 0.6897, "f2": 0.8333, "mcc": -0.1224, "accuracy": 0.5263, "tp": 30, "fp": 26, "tn": 0, "fn": 1, "aleatoric_mean": 2.7e-05, "epistemic_mean": 5.5e-05, "confidence_mean": 0.9999, "aleatoric_std": 8e-06, "epistemic_std": 1.6e-05}, {"fold": "fold_3", "regime": "Eurozone debt plateau", "sharpe": 0.0728, "sortino": 0.1274, "return_pct": 0.06, "equity": 1000.58, "max_dd": 3.38, "win_rate": 57.41, "profit_factor": 1.012, "ic": 0.071, "hit": 55.36, "n": 56, "precision": 0.5636, "recall": 0.9688, "f1": 0.7126, "f2": 0.847, "mcc": -0.1168, "accuracy": 0.5536, "tp": 31, "fp": 24, "tn": 0, "fn": 1, "aleatoric_mean": 2.9e-05, "epistemic_mean": 5.8e-05, "confidence_mean": 0.9999, "aleatoric_std": 9e-06, "epistemic_std": 1.9e-05}, {"fold": "fold_4", "regime": "Strong USD downturn", "sharpe": 0.5256, "sortino": 0.8077, "return_pct": 2.41, "equity": 1024.13, "max_dd": 7.26, "win_rate": 52.14, "profit_factor": 1.092, "ic": 0.0434, "hit": 51.69, "n": 118, "precision": 0.5128, "recall": 1.0, "f1": 0.678, "f2": 0.8403, "mcc": 0.094, "accuracy": 0.5169, "tp": 60, "fp": 57, "tn": 1, "fn": 0, "aleatoric_mean": 3e-05, "epistemic_mean": 6.1e-05, "confidence_mean": 0.9999, "aleatoric_std": 9e-06, "epistemic_std": 1.9e-05}, {"fold": "fold_5", "regime": "Low-vol plateau", "sharpe": -0.8514, "sortino": -1.4406, "return_pct": -1.95, "equity": 980.46, "max_dd": 3.56, "win_rate": 45.54, "profit_factor": 0.868, "ic": -0.0551, "hit": 45.54, "n": 112, "precision": 0.4554, "recall": 1.0, "f1": 0.6258, "f2": 0.807, "mcc": 0.0, "accuracy": 0.4554, "tp": 51, "fp": 61, "tn": 0, "fn": 0, "aleatoric_mean": 2.9e-05, "epistemic_mean": 5.8e-05, "confidence_mean": 0.9999, "aleatoric_std": 9e-06, "epistemic_std": 1.9e-05}, {"fold": "fold_6", "regime": "EUR crisis downturn", "sharpe": -2.6087, "sortino": -4.1455, "return_pct": -11.15, "equity": 888.5, "max_dd": 12.71, "win_rate": 46.09, "profit_factor": 0.662, "ic": -0.01, "hit": 46.09, "n": 115, "precision": 0.4609, "recall": 1.0, "f1": 0.631, "f2": 0.8104, "mcc": 0.0, "accuracy": 0.4609, "tp": 53, "fp": 62, "tn": 0, "fn": 0, "aleatoric_mean": 2.9e-05, "epistemic_mean": 5.8e-05, "confidence_mean": 0.9999, "aleatoric_std": 1.1e-05, "epistemic_std": 2.1e-05}, {"fold": "fold_7", "regime": "Recent mixed/upturn", "sharpe": 1.4445, "sortino": 2.5657, "return_pct": 5.93, "equity": 1059.28, "max_dd": 3.84, "win_rate": 50.89, "profit_factor": 1.281, "ic": 0.1115, "hit": 50.89, "n": 112, "precision": 0.5089, "recall": 1.0, "f1": 0.6746, "f2": 0.8382, "mcc": 0.0, "accuracy": 0.5089, "tp": 57, "fp": 55, "tn": 0, "fn": 0, "aleatoric_mean": 2.9e-05, "epistemic_mean": 5.9e-05, "confidence_mean": 0.9999, "aleatoric_std": 1e-05, "epistemic_std": 1.9e-05}], "val_sharpe": 0.5363, "val_psr": 0.7556, "val_equity": 1064.39, "val_sortino": 0.859, "val_return_pct": 6.44, "val_max_dd": 8.0, "val_win_rate": 49.52, "val_profit_factor": 1.093, "val_ic": -0.0132, "val_hit": 49.28, "val_aleatoric_mean": 2.9e-05, "val_epistemic_mean": 5.8e-05, "val_confidence_mean": 0.9999, "val_precision": 0.4928, "val_recall": 0.9951, "val_f1": 0.6592, "val_f2": 0.8266, "val_mcc": -0.001, "val_accuracy": 0.4928, "val_per_window": [{"fold": "fold_1", "regime": "Pre-crisis upturn + GFC onset", "sharpe": 2.4882, "sortino": 3.9734, "return_pct": 3.92, "equity": 1039.19, "max_dd": 2.96, "win_rate": 53.45, "profit_factor": 1.507, "ic": -0.09, "hit": 52.54, "n": 59, "precision": 0.5254, "recall": 1.0, "f1": 0.6889, "f2": 0.847, "mcc": 0.0, "accuracy": 0.5254, "tp": 31, "fp": 28, "tn": 0, "fn": 0, "aleatoric_mean": 2.9e-05, "epistemic_mean": 5.8e-05, "confidence_mean": 0.9999, "aleatoric_std": 8e-06, "epistemic_std": 1.6e-05}, {"fold": "fold_2", "regime": "Post-crash recovery", "sharpe": 1.1362, "sortino": 1.73, "return_pct": 2.16, "equity": 1021.63, "max_dd": 2.18, "win_rate": 53.45, "profit_factor": 1.202, "ic": -0.0182, "hit": 53.45, "n": 58, "precision": 0.5345, "recall": 1.0, "f1": 0.6966, "f2": 0.8516, "mcc": 0.0, "accuracy": 0.5345, "tp": 31, "fp": 27, "tn": 0, "fn": 0, "aleatoric_mean": 2.8e-05, "epistemic_mean": 5.6e-05, "confidence_mean": 0.9999, "aleatoric_std": 1e-05, "epistemic_std": 1.9e-05}, {"fold": "fold_3", "regime": "Eurozone debt plateau", "sharpe": 1.4609, "sortino": 3.0985, "return_pct": 3.38, "equity": 1033.79, "max_dd": 4.16, "win_rate": 42.62, "profit_factor": 1.276, "ic": -0.0287, "hit": 42.62, "n": 61, "precision": 0.4333, "recall": 0.963, "f1": 0.5977, "f2": 0.7738, "mcc": -0.1449, "accuracy": 0.4262, "tp": 26, "fp": 34, "tn": 0, "fn": 1, "aleatoric_mean": 2.9e-05, "epistemic_mean": 5.8e-05, "confidence_mean": 0.9999, "aleatoric_std": 9e-06, "epistemic_std": 1.7e-05}, {"fold": "fold_4", "regime": "Strong USD downturn", "sharpe": -2.0736, "sortino": -3.4372, "return_pct": -4.5, "equity": 955.01, "max_dd": 5.02, "win_rate": 48.33, "profit_factor": 0.728, "ic": 0.0824, "hit": 48.33, "n": 60, "precision": 0.4833, "recall": 1.0, "f1": 0.6517, "f2": 0.8239, "mcc": 0.0, "accuracy": 0.4833, "tp": 29, "fp": 31, "tn": 0, "fn": 0, "aleatoric_mean": 2.9e-05, "epistemic_mean": 5.8e-05, "confidence_mean": 0.9999, "aleatoric_std": 8e-06, "epistemic_std": 1.5e-05}, {"fold": "fold_5", "regime": "Low-vol plateau", "sharpe": 0.1064, "sortino": 0.1658, "return_pct": 0.12, "equity": 1001.23, "max_dd": 3.51, "win_rate": 51.61, "profit_factor": 1.017, "ic": -0.0961, "hit": 51.61, "n": 62, "precision": 0.5161, "recall": 1.0, "f1": 0.6809, "f2": 0.8421, "mcc": 0.0, "accuracy": 0.5161, "tp": 32, "fp": 30, "tn": 0, "fn": 0, "aleatoric_mean": 3.1e-05, "epistemic_mean": 6.3e-05, "confidence_mean": 0.9999, "aleatoric_std": 1e-05, "epistemic_std": 2e-05}, {"fold": "fold_6", "regime": "EUR crisis downturn", "sharpe": -2.2431, "sortino": -3.1162, "return_pct": -2.31, "equity": 976.86, "max_dd": 2.74, "win_rate": 42.11, "profit_factor": 0.692, "ic": 0.0808, "hit": 41.38, "n": 58, "precision": 0.4138, "recall": 1.0, "f1": 0.5854, "f2": 0.7792, "mcc": 0.0, "accuracy": 0.4138, "tp": 24, "fp": 34, "tn": 0, "fn": 0, "aleatoric_mean": 2.7e-05, "epistemic_mean": 5.5e-05, "confidence_mean": 0.9999, "aleatoric_std": 1e-05, "epistemic_std": 2e-05}, {"fold": "fold_7", "regime": "Recent mixed/upturn", "sharpe": 3.0134, "sortino": 6.492, "return_pct": 3.83, "equity": 1038.25, "max_dd": 1.69, "win_rate": 55.0, "profit_factor": 1.636, "ic": 0.0538, "hit": 55.0, "n": 60, "precision": 0.5424, "recall": 1.0, "f1": 0.7033, "f2": 0.8556, "mcc": 0.1392, "accuracy": 0.55, "tp": 32, "fp": 27, "tn": 1, "fn": 0, "aleatoric_mean": 2.9e-05, "epistemic_mean": 5.8e-05, "confidence_mean": 0.9999, "aleatoric_std": 1.1e-05, "epistemic_std": 2.1e-05}], "train_sharpe": 0.3601, "train_psr": 0.8075, "train_equity": 1235.2, "train_sortino": 0.4683, "train_return_pct": 23.52, "train_max_dd": 18.43, "train_win_rate": 52.15, "train_profit_factor": 1.086, "train_ic": 0.0875, "train_hit": 51.88, "train_precision": 0.5188, "train_recall": 1.0, "train_f1": 0.6832, "train_f2": 0.8435, "train_mcc": 0.0, "train_accuracy": 0.5188, "train_per_window": [{"fold": "all_train", "regime": "Training data", "sharpe": 0.3601, "sortino": 0.4683, "return_pct": 23.52, "equity": 1235.2, "max_dd": 18.43, "win_rate": 52.15, "profit_factor": 1.086, "ic": 0.0875, "hit": 51.88, "n": 1382, "precision": 0.5188, "recall": 1.0, "f1": 0.6832, "f2": 0.8435, "mcc": 0.0, "accuracy": 0.5188, "tp": 717, "fp": 665, "tn": 0, "fn": 0}], "experiment_num": 244, "status": "DISCARD"}
