{"backbone": "mamba", "description": "mamba: Exp4 dmamba decomposition variant (Liu 2025 arXiv 2602.09081)", "config": {"seq_len": 10, "lr": 0.0005, "batch_size": 32, "epochs": 100, "weight_decay": 0.1, "patience": 20, "grad_clip": 1.0, "warmup_epochs": 10, "huber_delta": 1.0, "head_dropout": 0.1, "seed": 42, "mamba_variant": "dmamba", "het_loss": false}, "composite": 5.3641, "test_pos_folds": 6, "val_pos_folds": 6, "val_loss": 3.5e-05, "elapsed_sec": 269.7, "timestamp": "2026-04-20T00:43:52", "sharpe": 5.5641, "psr": 1.0, "equity": 8807.56, "sortino": 10.1834, "return_pct": 780.76, "max_dd": 13.04, "win_rate": 67.7, "profit_factor": 2.884, "ic": 0.4468, "hit": 67.42, "aleatoric_mean": 2.7e-05, "epistemic_mean": 5.4e-05, "confidence_mean": 0.9999, "precision": 0.6708, "recall": 0.6819, "f1": 0.6763, "f2": 0.6797, "mcc": 0.3547, "accuracy": 0.6773, "per_window": [{"fold": "fold_1", "regime": "Pre-crisis upturn + GFC onset", "sharpe": 2.0906, "sortino": 6.0105, "return_pct": 16.51, "equity": 1165.14, "max_dd": 9.04, "win_rate": 50.98, "profit_factor": 1.648, "ic": 0.1346, "hit": 50.49, "n": 103, "precision": 0.5273, "recall": 0.5472, "f1": 0.537, "f2": 0.5431, "mcc": 0.0272, "accuracy": 0.5146, "tp": 29, "fp": 26, "tn": 24, "fn": 24, "aleatoric_mean": 4.3e-05, "epistemic_mean": 8.6e-05, "confidence_mean": 0.9999, "aleatoric_std": 2.3e-05, "epistemic_std": 4.6e-05}, {"fold": "fold_2", "regime": "Post-crash recovery", "sharpe": -0.457, "sortino": -0.8058, "return_pct": -2.43, "equity": 975.66, "max_dd": 6.76, "win_rate": 45.79, "profit_factor": 0.931, "ic": -0.0293, "hit": 45.79, "n": 107, "precision": 0.4386, "recall": 0.4902, "f1": 0.463, "f2": 0.4789, "mcc": -0.0813, "accuracy": 0.4579, "tp": 25, "fp": 32, "tn": 24, "fn": 26, "aleatoric_mean": 3e-05, "epistemic_mean": 5.9e-05, "confidence_mean": 0.9999, "aleatoric_std": 1.6e-05, "epistemic_std": 3.1e-05}, {"fold": "fold_3", "regime": "Eurozone debt plateau", "sharpe": 5.4507, "sortino": 9.0968, "return_pct": 19.9, "equity": 1199.03, "max_dd": 2.39, "win_rate": 70.19, "profit_factor": 2.359, "ic": 0.53, "hit": 68.87, "n": 106, "precision": 0.6761, "recall": 0.8421, "f1": 0.75, "f2": 0.8027, "mcc": 0.3951, "accuracy": 0.6981, "tp": 48, "fp": 23, "tn": 26, "fn": 9, "aleatoric_mean": 2.8e-05, "epistemic_mean": 5.6e-05, "confidence_mean": 0.9999, "aleatoric_std": 1.4e-05, "epistemic_std": 2.8e-05}, {"fold": "fold_4", "regime": "Strong USD downturn", "sharpe": 9.648, "sortino": 22.9449, "return_pct": 89.09, "equity": 1890.9, "max_dd": 1.69, "win_rate": 77.84, "profit_factor": 5.502, "ic": 0.6554, "hit": 77.38, "n": 168, "precision": 0.8101, "recall": 0.7442, "f1": 0.7758, "f2": 0.7565, "mcc": 0.5621, "accuracy": 0.7798, "tp": 64, "fp": 15, "tn": 67, "fn": 22, "aleatoric_mean": 2.7e-05, "epistemic_mean": 5.5e-05, "confidence_mean": 0.9999, "aleatoric_std": 1.9e-05, "epistemic_std": 3.8e-05}, {"fold": "fold_5", "regime": "Low-vol plateau", "sharpe": 7.6832, "sortino": 14.2954, "return_pct": 25.82, "equity": 1258.17, "max_dd": 1.38, "win_rate": 67.28, "profit_factor": 3.708, "ic": 0.5293, "hit": 67.28, "n": 162, "precision": 0.6667, "recall": 0.6053, "f1": 0.6345, "f2": 0.6166, "mcc": 0.3409, "accuracy": 0.6728, "tp": 46, "fp": 23, "tn": 63, "fn": 30, "aleatoric_mean": 1.5e-05, "epistemic_mean": 3e-05, "confidence_mean": 1.0, "aleatoric_std": 9e-06, "epistemic_std": 1.8e-05}, {"fold": "fold_6", "regime": "EUR crisis downturn", "sharpe": 10.2475, "sortino": 17.3561, "return_pct": 71.47, "equity": 1714.71, "max_dd": 2.15, "win_rate": 73.94, "profit_factor": 5.57, "ic": 0.6412, "hit": 73.94, "n": 165, "precision": 0.75, "recall": 0.6623, "f1": 0.7034, "f2": 0.6782, "mcc": 0.4755, "accuracy": 0.7394, "tp": 51, "fp": 17, "tn": 71, "fn": 26, "aleatoric_mean": 3e-05, "epistemic_mean": 6e-05, "confidence_mean": 0.9999, "aleatoric_std": 1.7e-05, "epistemic_std": 3.4e-05}, {"fold": "fold_7", "regime": "Recent mixed/upturn", "sharpe": 8.8949, "sortino": 13.382, "return_pct": 58.4, "equity": 1583.98, "max_dd": 2.86, "win_rate": 74.69, "profit_factor": 4.804, "ic": 0.614, "hit": 74.69, "n": 162, "precision": 0.7222, "recall": 0.8025, "f1": 0.7602, "f2": 0.785, "mcc": 0.4969, "accuracy": 0.7469, "tp": 65, "fp": 25, "tn": 56, "fn": 16, "aleatoric_mean": 2.3e-05, "epistemic_mean": 4.5e-05, "confidence_mean": 0.9999, "aleatoric_std": 1.7e-05, "epistemic_std": 3.5e-05}], "val_sharpe": 5.6787, "val_psr": 1.0, "val_equity": 3527.87, "val_sortino": 8.5721, "val_return_pct": 252.79, "val_max_dd": 6.54, "val_win_rate": 67.37, "val_profit_factor": 2.647, "val_ic": 0.4218, "val_hit": 66.93, "val_aleatoric_mean": 1.8e-05, "val_epistemic_mean": 3.6e-05, "val_confidence_mean": 0.9999, "val_precision": 0.6593, "val_recall": 0.6521, "val_f1": 0.6556, "val_f2": 0.6535, "val_mcc": 0.347, "val_accuracy": 0.6745, "val_per_window": [{"fold": "fold_1", "regime": "Pre-crisis upturn + GFC onset", "sharpe": -1.1764, "sortino": -1.7867, "return_pct": -2.99, "equity": 970.09, "max_dd": 4.46, "win_rate": 49.07, "profit_factor": 0.823, "ic": -0.0457, "hit": 48.62, "n": 109, "precision": 0.5, "recall": 0.5636, "f1": 0.5299, "f2": 0.5496, "mcc": -0.0105, "accuracy": 0.4954, "tp": 31, "fp": 31, "tn": 23, "fn": 24, "aleatoric_mean": 1.9e-05, "epistemic_mean": 3.8e-05, "confidence_mean": 0.9999, "aleatoric_std": 1.7e-05, "epistemic_std": 3.4e-05}, {"fold": "fold_2", "regime": "Post-crash recovery", "sharpe": 0.9223, "sortino": 1.4359, "return_pct": 4.28, "equity": 1042.85, "max_dd": 4.26, "win_rate": 53.7, "profit_factor": 1.157, "ic": 0.1166, "hit": 53.7, "n": 108, "precision": 0.6102, "recall": 0.5714, "f1": 0.5902, "f2": 0.5788, "mcc": 0.0597, "accuracy": 0.537, "tp": 36, "fp": 23, "tn": 22, "fn": 27, "aleatoric_mean": 2.6e-05, "epistemic_mean": 5.3e-05, "confidence_mean": 0.9999, "aleatoric_std": 1.2e-05, "epistemic_std": 2.4e-05}, {"fold": "fold_3", "regime": "Eurozone debt plateau", "sharpe": 12.0692, "sortino": 28.0119, "return_pct": 47.23, "equity": 1472.27, "max_dd": 1.19, "win_rate": 82.57, "profit_factor": 8.063, "ic": 0.6817, "hit": 81.08, "n": 111, "precision": 0.7917, "recall": 0.8085, "f1": 0.8, "f2": 0.8051, "mcc": 0.6505, "accuracy": 0.8288, "tp": 38, "fp": 10, "tn": 54, "fn": 9, "aleatoric_mean": 2e-05, "epistemic_mean": 4e-05, "confidence_mean": 0.9999, "aleatoric_std": 1.1e-05, "epistemic_std": 2.2e-05}, {"fold": "fold_4", "regime": "Strong USD downturn", "sharpe": 9.7084, "sortino": 17.5322, "return_pct": 33.18, "equity": 1331.77, "max_dd": 1.32, "win_rate": 77.98, "profit_factor": 5.346, "ic": 0.6363, "hit": 77.27, "n": 110, "precision": 0.7115, "recall": 0.7872, "f1": 0.7475, "f2": 0.7708, "mcc": 0.5441, "accuracy": 0.7727, "tp": 37, "fp": 15, "tn": 48, "fn": 10, "aleatoric_mean": 1.8e-05, "epistemic_mean": 3.6e-05, "confidence_mean": 0.9999, "aleatoric_std": 1.4e-05, "epistemic_std": 2.7e-05}, {"fold": "fold_5", "regime": "Low-vol plateau", "sharpe": 8.134, "sortino": 17.1793, "return_pct": 27.18, "equity": 1271.77, "max_dd": 1.88, "win_rate": 67.86, "profit_factor": 4.017, "ic": 0.5425, "hit": 67.86, "n": 112, "precision": 0.7576, "recall": 0.4717, "f1": 0.5814, "f2": 0.5102, "mcc": 0.3681, "accuracy": 0.6786, "tp": 25, "fp": 8, "tn": 51, "fn": 28, "aleatoric_mean": 1.5e-05, "epistemic_mean": 3.1e-05, "confidence_mean": 1.0, "aleatoric_std": 1.2e-05, "epistemic_std": 2.4e-05}, {"fold": "fold_6", "regime": "EUR crisis downturn", "sharpe": 9.5249, "sortino": 20.6593, "return_pct": 20.5, "equity": 1204.97, "max_dd": 0.87, "win_rate": 73.83, "profit_factor": 5.391, "ic": 0.663, "hit": 73.15, "n": 108, "precision": 0.7568, "recall": 0.5957, "f1": 0.6667, "f2": 0.6222, "mcc": 0.4682, "accuracy": 0.7407, "tp": 28, "fp": 9, "tn": 52, "fn": 19, "aleatoric_mean": 1e-05, "epistemic_mean": 2e-05, "confidence_mean": 1.0, "aleatoric_std": 4e-06, "epistemic_std": 8e-06}, {"fold": "fold_7", "regime": "Recent mixed/upturn", "sharpe": 6.7765, "sortino": 14.6132, "return_pct": 16.06, "equity": 1160.58, "max_dd": 1.64, "win_rate": 66.36, "profit_factor": 3.006, "ic": 0.4394, "hit": 66.36, "n": 110, "precision": 0.6143, "recall": 0.8113, "f1": 0.6992, "f2": 0.7624, "mcc": 0.3507, "accuracy": 0.6636, "tp": 43, "fp": 27, "tn": 30, "fn": 10, "aleatoric_mean": 1.9e-05, "epistemic_mean": 3.7e-05, "confidence_mean": 0.9999, "aleatoric_std": 1.5e-05, "epistemic_std": 2.9e-05}], "train_sharpe": 7.623, "train_psr": 1.0, "train_equity": 4272721.0, "train_sortino": 20.4756, "train_return_pct": 427172.1, "train_max_dd": 4.47, "train_win_rate": 77.55, "train_profit_factor": 7.02, "train_ic": 0.7158, "train_hit": 77.24, "train_precision": 0.7497, "train_recall": 0.8414, "train_f1": 0.7929, "train_f2": 0.8213, "train_mcc": 0.5505, "train_accuracy": 0.774, "train_per_window": [{"fold": "all_train", "regime": "Training data", "sharpe": 7.623, "sortino": 20.4756, "return_pct": 427172.1, "equity": 4272721.0, "max_dd": 4.47, "win_rate": 77.55, "profit_factor": 7.02, "ic": 0.7158, "hit": 77.24, "n": 2478, "precision": 0.7497, "recall": 0.8414, "f1": 0.7929, "f2": 0.8213, "mcc": 0.5505, "accuracy": 0.774, "tp": 1072, "fp": 358, "tn": 846, "fn": 202}], "experiment_num": 155, "status": "DISCARD"}
{"backbone": "mamba", "description": "mamba: Exp5 dmamba d_state=32 (Gu Dao 2024 sec 4.5)", "config": {"seq_len": 10, "lr": 0.0005, "batch_size": 32, "epochs": 100, "weight_decay": 0.1, "patience": 20, "grad_clip": 1.0, "warmup_epochs": 10, "huber_delta": 1.0, "head_dropout": 0.1, "seed": 42, "mamba_variant": "dmamba", "mamba_d_state": 32, "het_loss": false}, "composite": 4.1995, "test_pos_folds": 6, "val_pos_folds": 5, "val_loss": 3.4e-05, "elapsed_sec": 259.1, "timestamp": "2026-04-20T00:49:24", "sharpe": 4.4995, "psr": 1.0, "equity": 5985.77, "sortino": 5.4627, "return_pct": 498.58, "max_dd": 8.7, "win_rate": 65.43, "profit_factor": 2.333, "ic": 0.4442, "hit": 65.16, "aleatoric_mean": 2.6e-05, "epistemic_mean": 5.1e-05, "confidence_mean": 0.9999, "precision": 0.6954, "recall": 0.5364, "f1": 0.6056, "f2": 0.5621, "mcc": 0.3157, "accuracy": 0.6547, "per_window": [{"fold": "fold_1", "regime": "Pre-crisis upturn + GFC onset", "sharpe": -0.6721, "sortino": -0.7947, "return_pct": -5.74, "equity": 942.59, "max_dd": 8.7, "win_rate": 45.1, "profit_factor": 0.853, "ic": -0.0431, "hit": 44.66, "n": 103, "precision": 0.4615, "recall": 0.3396, "f1": 0.3913, "f2": 0.3586, "mcc": -0.0828, "accuracy": 0.4563, "tp": 18, "fp": 21, "tn": 29, "fn": 35, "aleatoric_mean": 3.5e-05, "epistemic_mean": 7e-05, "confidence_mean": 0.9999, "aleatoric_std": 2.4e-05, "epistemic_std": 4.8e-05}, {"fold": "fold_2", "regime": "Post-crash recovery", "sharpe": 2.0261, "sortino": 3.2439, "return_pct": 9.83, "equity": 1098.3, "max_dd": 3.94, "win_rate": 58.88, "profit_factor": 1.374, "ic": 0.1522, "hit": 58.88, "n": 107, "precision": 0.5714, "recall": 0.549, "f1": 0.56, "f2": 0.5534, "mcc": 0.1744, "accuracy": 0.5888, "tp": 28, "fp": 21, "tn": 35, "fn": 23, "aleatoric_mean": 3.7e-05, "epistemic_mean": 7.3e-05, "confidence_mean": 0.9999, "aleatoric_std": 2.3e-05, "epistemic_std": 4.5e-05}, {"fold": "fold_3", "regime": "Eurozone debt plateau", "sharpe": 7.3316, "sortino": 13.0516, "return_pct": 26.46, "equity": 1264.64, "max_dd": 1.57, "win_rate": 71.15, "profit_factor": 3.188, "ic": 0.6028, "hit": 69.81, "n": 106, "precision": 0.7407, "recall": 0.7018, "f1": 0.7207, "f2": 0.7092, "mcc": 0.4149, "accuracy": 0.7075, "tp": 40, "fp": 14, "tn": 35, "fn": 17, "aleatoric_mean": 2.9e-05, "epistemic_mean": 5.8e-05, "confidence_mean": 0.9999, "aleatoric_std": 1.5e-05, "epistemic_std": 2.9e-05}, {"fold": "fold_4", "regime": "Strong USD downturn", "sharpe": 8.4337, "sortino": 14.8955, "return_pct": 77.72, "equity": 1777.2, "max_dd": 4.07, "win_rate": 73.65, "profit_factor": 4.34, "ic": 0.5923, "hit": 73.21, "n": 168, "precision": 0.8182, "recall": 0.6279, "f1": 0.7105, "f2": 0.6585, "mcc": 0.4929, "accuracy": 0.7381, "tp": 54, "fp": 12, "tn": 70, "fn": 32, "aleatoric_mean": 2.7e-05, "epistemic_mean": 5.3e-05, "confidence_mean": 0.9999, "aleatoric_std": 1.7e-05, "epistemic_std": 3.5e-05}, {"fold": "fold_5", "regime": "Low-vol plateau", "sharpe": 7.0666, "sortino": 14.8645, "return_pct": 23.9, "equity": 1239.03, "max_dd": 1.66, "win_rate": 64.81, "profit_factor": 3.319, "ic": 0.5697, "hit": 64.81, "n": 162, "precision": 0.7317, "recall": 0.3947, "f1": 0.5128, "f2": 0.4348, "mcc": 0.3063, "accuracy": 0.6481, "tp": 30, "fp": 11, "tn": 75, "fn": 46, "aleatoric_mean": 1.1e-05, "epistemic_mean": 2.2e-05, "confidence_mean": 1.0, "aleatoric_std": 5e-06, "epistemic_std": 9e-06}, {"fold": "fold_6", "regime": "EUR crisis downturn", "sharpe": 10.9854, "sortino": 17.416, "return_pct": 76.11, "equity": 1761.11, "max_dd": 1.51, "win_rate": 77.58, "profit_factor": 6.402, "ic": 0.6934, "hit": 77.58, "n": 165, "precision": 0.7273, "recall": 0.8312, "f1": 0.7758, "f2": 0.8081, "mcc": 0.5584, "accuracy": 0.7758, "tp": 64, "fp": 24, "tn": 64, "fn": 13, "aleatoric_mean": 3.2e-05, "epistemic_mean": 6.4e-05, "confidence_mean": 0.9999, "aleatoric_std": 2.6e-05, "epistemic_std": 5.2e-05}, {"fold": "fold_7", "regime": "Recent mixed/upturn", "sharpe": 2.8526, "sortino": 3.9005, "return_pct": 17.9, "equity": 1178.98, "max_dd": 5.29, "win_rate": 58.64, "profit_factor": 1.622, "ic": 0.5246, "hit": 58.64, "n": 162, "precision": 0.7059, "recall": 0.2963, "f1": 0.4174, "f2": 0.3352, "mcc": 0.2122, "accuracy": 0.5864, "tp": 24, "fp": 10, "tn": 71, "fn": 57, "aleatoric_mean": 1.7e-05, "epistemic_mean": 3.5e-05, "confidence_mean": 0.9999, "aleatoric_std": 1.3e-05, "epistemic_std": 2.6e-05}], "val_sharpe": 5.4511, "val_psr": 1.0, "val_equity": 3371.23, "val_sortino": 8.3037, "val_return_pct": 237.12, "val_max_dd": 9.68, "val_win_rate": 67.37, "val_profit_factor": 2.543, "val_ic": 0.4371, "val_hit": 66.93, "val_aleatoric_mean": 1.6e-05, "val_epistemic_mean": 3.2e-05, "val_confidence_mean": 1.0, "val_precision": 0.6861, "val_recall": 0.5808, "val_f1": 0.6291, "val_f2": 0.5992, "val_mcc": 0.3464, "val_accuracy": 0.6745, "val_per_window": [{"fold": "fold_1", "regime": "Pre-crisis upturn + GFC onset", "sharpe": -0.6149, "sortino": -0.9858, "return_pct": -1.61, "equity": 983.88, "max_dd": 5.15, "win_rate": 48.15, "profit_factor": 0.903, "ic": -0.0502, "hit": 47.71, "n": 109, "precision": 0.4909, "recall": 0.4909, "f1": 0.4909, "f2": 0.4909, "mcc": -0.0276, "accuracy": 0.4862, "tp": 27, "fp": 28, "tn": 26, "fn": 28, "aleatoric_mean": 1.7e-05, "epistemic_mean": 3.4e-05, "confidence_mean": 0.9999, "aleatoric_std": 1.6e-05, "epistemic_std": 3.2e-05}, {"fold": "fold_2", "regime": "Post-crash recovery", "sharpe": -0.694, "sortino": -1.1067, "return_pct": -3.58, "equity": 964.23, "max_dd": 8.08, "win_rate": 48.15, "profit_factor": 0.896, "ic": -0.0563, "hit": 48.15, "n": 108, "precision": 0.5636, "recall": 0.4921, "f1": 0.5254, "f2": 0.5049, "mcc": -0.0407, "accuracy": 0.4815, "tp": 31, "fp": 24, "tn": 21, "fn": 32, "aleatoric_mean": 2.2e-05, "epistemic_mean": 4.5e-05, "confidence_mean": 0.9999, "aleatoric_std": 1.1e-05, "epistemic_std": 2.3e-05}, {"fold": "fold_3", "regime": "Eurozone debt plateau", "sharpe": 10.4104, "sortino": 25.854, "return_pct": 41.95, "equity": 1419.5, "max_dd": 1.93, "win_rate": 78.9, "profit_factor": 5.806, "ic": 0.6921, "hit": 77.48, "n": 111, "precision": 0.717, "recall": 0.8085, "f1": 0.76, "f2": 0.7884, "mcc": 0.5679, "accuracy": 0.7838, "tp": 38, "fp": 15, "tn": 49, "fn": 9, "aleatoric_mean": 1.7e-05, "epistemic_mean": 3.4e-05, "confidence_mean": 0.9999, "aleatoric_std": 9e-06, "epistemic_std": 1.7e-05}, {"fold": "fold_4", "regime": "Strong USD downturn", "sharpe": 11.3675, "sortino": 26.0428, "return_pct": 37.7, "equity": 1376.95, "max_dd": 0.92, "win_rate": 78.9, "profit_factor": 7.483, "ic": 0.6821, "hit": 78.18, "n": 110, "precision": 0.8158, "recall": 0.6596, "f1": 0.7294, "f2": 0.6858, "mcc": 0.5706, "accuracy": 0.7909, "tp": 31, "fp": 7, "tn": 56, "fn": 16, "aleatoric_mean": 1.7e-05, "epistemic_mean": 3.4e-05, "confidence_mean": 0.9999, "aleatoric_std": 9e-06, "epistemic_std": 1.9e-05}, {"fold": "fold_5", "regime": "Low-vol plateau", "sharpe": 9.7336, "sortino": 25.4691, "return_pct": 31.75, "equity": 1317.53, "max_dd": 0.64, "win_rate": 73.21, "profit_factor": 5.437, "ic": 0.6452, "hit": 73.21, "n": 112, "precision": 0.6949, "recall": 0.7736, "f1": 0.7321, "f2": 0.7565, "mcc": 0.4685, "accuracy": 0.7321, "tp": 41, "fp": 18, "tn": 41, "fn": 12, "aleatoric_mean": 1.3e-05, "epistemic_mean": 2.7e-05, "confidence_mean": 1.0, "aleatoric_std": 9e-06, "epistemic_std": 1.7e-05}, {"fold": "fold_6", "regime": "EUR crisis downturn", "sharpe": 7.8613, "sortino": 15.3673, "return_pct": 17.44, "equity": 1174.38, "max_dd": 1.0, "win_rate": 71.96, "profit_factor": 3.909, "ic": 0.7392, "hit": 71.3, "n": 108, "precision": 1.0, "recall": 0.3617, "f1": 0.5312, "f2": 0.4146, "mcc": 0.4924, "accuracy": 0.7222, "tp": 17, "fp": 0, "tn": 61, "fn": 30, "aleatoric_mean": 1e-05, "epistemic_mean": 2e-05, "confidence_mean": 1.0, "aleatoric_std": 3e-06, "epistemic_std": 7e-06}, {"fold": "fold_7", "regime": "Recent mixed/upturn", "sharpe": 7.4539, "sortino": 16.0662, "return_pct": 17.5, "equity": 1175.01, "max_dd": 1.6, "win_rate": 71.82, "profit_factor": 3.368, "ic": 0.5603, "hit": 71.82, "n": 110, "precision": 0.8438, "recall": 0.5094, "f1": 0.6353, "f2": 0.5533, "mcc": 0.464, "accuracy": 0.7182, "tp": 27, "fp": 5, "tn": 52, "fn": 26, "aleatoric_mean": 1.3e-05, "epistemic_mean": 2.6e-05, "confidence_mean": 1.0, "aleatoric_std": 6e-06, "epistemic_std": 1.2e-05}], "train_sharpe": 6.7304, "train_psr": 1.0, "train_equity": 1865346.62, "train_sortino": 20.3613, "train_return_pct": 186434.66, "train_max_dd": 2.59, "train_win_rate": 71.96, "train_profit_factor": 5.189, "train_ic": 0.7066, "train_hit": 71.67, "train_precision": 0.8459, "train_recall": 0.5557, "train_f1": 0.6708, "train_f2": 0.5967, "train_mcc": 0.4741, "train_accuracy": 0.7195, "train_per_window": [{"fold": "all_train", "regime": "Training data", "sharpe": 6.7304, "sortino": 20.3613, "return_pct": 186434.66, "equity": 1865346.62, "max_dd": 2.59, "win_rate": 71.96, "profit_factor": 5.189, "ic": 0.7066, "hit": 71.67, "n": 2478, "precision": 0.8459, "recall": 0.5557, "f1": 0.6708, "f2": 0.5967, "mcc": 0.4741, "accuracy": 0.7195, "tp": 708, "fp": 129, "tn": 1075, "fn": 566}], "experiment_num": 156, "status": "DISCARD"}
