{"backbone": "lfm2-350m", "description": "lfm2: H-Exp16 huber=0.5 robust to GFC tails", "config": {"seq_len": 60, "lr": 3e-05, "batch_size": 32, "epochs": 30, "weight_decay": 1e-05, "patience": 8, "grad_clip": 1.0, "warmup_epochs": 3, "huber_delta": 0.5, "head_dropout": 0.1}, "composite": -0.3973, "test_pos_folds": 5, "val_pos_folds": 4, "val_loss": -1.591197, "elapsed_sec": 397.9, "timestamp": "2026-04-12T10:32:03", "sharpe": 0.1027, "psr": 0.5642, "equity": 1013.05, "sortino": 0.1712, "return_pct": 1.31, "max_dd": 14.92, "win_rate": 49.11, "profit_factor": 1.017, "ic": 0.0037, "hit": 48.8, "aleatoric_mean": 0.088406, "epistemic_mean": 0.009011, "confidence_mean": 0.9171, "per_window": [{"fold": "fold_1", "regime": "Pre-crisis upturn + GFC onset", "sharpe": 3.413, "sortino": 5.6432, "return_pct": 7.2, "equity": 1072.01, "max_dd": 2.09, "win_rate": 57.69, "profit_factor": 1.688, "ic": 0.1674, "hit": 56.6, "n": 53, "aleatoric_mean": 0.196803, "epistemic_mean": 0.005977, "confidence_mean": 0.8392, "aleatoric_std": 0.127075, "epistemic_std": 0.002814}, {"fold": "fold_2", "regime": "Post-crash recovery", "sharpe": 1.6266, "sortino": 3.0372, "return_pct": 4.55, "equity": 1045.46, "max_dd": 2.46, "win_rate": 50.88, "profit_factor": 1.298, "ic": 0.07, "hit": 50.88, "n": 57, "aleatoric_mean": 0.210723, "epistemic_mean": 0.0077, "confidence_mean": 0.8309, "aleatoric_std": 0.143024, "epistemic_std": 0.002776}, {"fold": "fold_3", "regime": "Eurozone debt plateau", "sharpe": 0.4273, "sortino": 0.6462, "return_pct": 0.69, "equity": 1006.89, "max_dd": 4.13, "win_rate": 55.56, "profit_factor": 1.07, "ic": 0.0823, "hit": 53.57, "n": 56, "aleatoric_mean": 0.094085, "epistemic_mean": 0.007753, "confidence_mean": 0.9112, "aleatoric_std": 0.07656, "epistemic_std": 0.003723}, {"fold": "fold_4", "regime": "Strong USD downturn", "sharpe": -2.2187, "sortino": -3.7927, "return_pct": -10.77, "equity": 892.34, "max_dd": 12.04, "win_rate": 40.17, "profit_factor": 0.689, "ic": -0.1629, "hit": 39.83, "n": 118, "aleatoric_mean": 0.071032, "epistemic_mean": 0.009483, "confidence_mean": 0.9276, "aleatoric_std": 0.055712, "epistemic_std": 0.004055}, {"fold": "fold_5", "regime": "Low-vol plateau", "sharpe": 1.1004, "sortino": 2.0586, "return_pct": 2.45, "equity": 1024.46, "max_dd": 3.5, "win_rate": 50.0, "profit_factor": 1.201, "ic": 0.0347, "hit": 50.0, "n": 112, "aleatoric_mean": 0.026898, "epistemic_mean": 0.011318, "confidence_mean": 0.9635, "aleatoric_std": 0.0208, "epistemic_std": 0.004822}, {"fold": "fold_6", "regime": "EUR crisis downturn", "sharpe": 0.4459, "sortino": 0.7808, "return_pct": 1.8, "equity": 1018.02, "max_dd": 6.83, "win_rate": 55.65, "profit_factor": 1.073, "ic": 0.1401, "hit": 55.65, "n": 115, "aleatoric_mean": 0.106535, "epistemic_mean": 0.008462, "confidence_mean": 0.9011, "aleatoric_std": 0.08378, "epistemic_std": 0.003781}, {"fold": "fold_7", "regime": "Recent mixed/upturn", "sharpe": -0.8251, "sortino": -1.528, "return_pct": -3.54, "equity": 964.64, "max_dd": 8.39, "win_rate": 42.86, "profit_factor": 0.868, "ic": 0.0821, "hit": 42.86, "n": 112, "aleatoric_mean": 0.033222, "epistemic_mean": 0.009499, "confidence_mean": 0.9599, "aleatoric_std": 0.034943, "epistemic_std": 0.003665}], "val_sharpe": 0.2071, "val_psr": 0.6048, "val_equity": 1021.43, "val_sortino": 0.2983, "val_return_pct": 2.14, "val_max_dd": 7.9, "val_win_rate": 53.85, "val_profit_factor": 1.035, "val_ic": 0.0119, "val_hit": 53.59, "val_aleatoric_mean": 0.074682, "val_epistemic_mean": 0.009557, "val_confidence_mean": 0.9291, "val_per_window": [{"fold": "fold_1", "regime": "Pre-crisis upturn + GFC onset", "sharpe": -1.0601, "sortino": -1.6847, "return_pct": -1.72, "equity": 982.84, "max_dd": 3.45, "win_rate": 48.28, "profit_factor": 0.84, "ic": -0.1103, "hit": 47.46, "n": 59, "aleatoric_mean": 0.202532, "epistemic_mean": 0.00609, "confidence_mean": 0.8475, "aleatoric_std": 0.199645, "epistemic_std": 0.002941}, {"fold": "fold_2", "regime": "Post-crash recovery", "sharpe": -0.1801, "sortino": -0.2882, "return_pct": -0.44, "equity": 995.64, "max_dd": 4.17, "win_rate": 50.0, "profit_factor": 0.971, "ic": 0.0532, "hit": 50.0, "n": 58, "aleatoric_mean": 0.132791, "epistemic_mean": 0.007246, "confidence_mean": 0.8814, "aleatoric_std": 0.081362, "epistemic_std": 0.003574}, {"fold": "fold_3", "regime": "Eurozone debt plateau", "sharpe": -1.5604, "sortino": -2.1648, "return_pct": -3.72, "equity": 962.85, "max_dd": 5.11, "win_rate": 54.1, "profit_factor": 0.771, "ic": -0.0537, "hit": 54.1, "n": 61, "aleatoric_mean": 0.041701, "epistemic_mean": 0.010542, "confidence_mean": 0.9513, "aleatoric_std": 0.03367, "epistemic_std": 0.004332}, {"fold": "fold_4", "regime": "Strong USD downturn", "sharpe": 1.1411, "sortino": 1.7387, "return_pct": 2.42, "equity": 1024.2, "max_dd": 3.06, "win_rate": 60.0, "profit_factor": 1.191, "ic": 0.1119, "hit": 60.0, "n": 60, "aleatoric_mean": 0.052721, "epistemic_mean": 0.009488, "confidence_mean": 0.943, "aleatoric_std": 0.047086, "epistemic_std": 0.004554}, {"fold": "fold_5", "regime": "Low-vol plateau", "sharpe": 0.9803, "sortino": 1.6538, "return_pct": 1.65, "equity": 1016.52, "max_dd": 3.74, "win_rate": 53.23, "profit_factor": 1.172, "ic": -0.019, "hit": 53.23, "n": 62, "aleatoric_mean": 0.023351, "epistemic_mean": 0.011175, "confidence_mean": 0.9668, "aleatoric_std": 0.015296, "epistemic_std": 0.004486}, {"fold": "fold_6", "regime": "EUR crisis downturn", "sharpe": 3.1981, "sortino": 5.1305, "return_pct": 3.3, "equity": 1033.01, "max_dd": 1.44, "win_rate": 61.4, "profit_factor": 1.691, "ic": 0.3103, "hit": 60.34, "n": 58, "aleatoric_mean": 0.016075, "epistemic_mean": 0.013739, "confidence_mean": 0.9712, "aleatoric_std": 0.010933, "epistemic_std": 0.006067}, {"fold": "fold_7", "regime": "Recent mixed/upturn", "sharpe": 0.6494, "sortino": 1.1932, "return_pct": 0.8, "equity": 1007.99, "max_dd": 1.58, "win_rate": 50.0, "profit_factor": 1.112, "ic": -0.0339, "hit": 50.0, "n": 60, "aleatoric_mean": 0.05798, "epistemic_mean": 0.008552, "confidence_mean": 0.9393, "aleatoric_std": 0.048212, "epistemic_std": 0.003464}], "train_sharpe": 1.3207, "train_psr": 1.0, "train_equity": 2448.62, "train_sortino": 2.9277, "train_return_pct": 144.86, "train_max_dd": 12.17, "train_win_rate": 53.38, "train_profit_factor": 1.357, "train_ic": 0.0961, "train_hit": 53.11, "train_per_window": [{"fold": "all_train", "regime": "Training data", "sharpe": 1.3207, "sortino": 2.9277, "return_pct": 144.86, "equity": 2448.62, "max_dd": 12.17, "win_rate": 53.38, "profit_factor": 1.357, "ic": 0.0961, "hit": 53.11, "n": 1382}], "experiment_num": 38, "status": "DISCARD"}
{"backbone": "lfm2-350m", "description": "lfm2: H-Exp17 seq=45 more training samples", "config": {"seq_len": 45, "lr": 3e-05, "batch_size": 32, "epochs": 30, "weight_decay": 1e-05, "patience": 8, "grad_clip": 1.0, "warmup_epochs": 3, "huber_delta": 1.0, "head_dropout": 0.1}, "composite": -0.2707, "test_pos_folds": 3, "val_pos_folds": 7, "val_loss": -1.829707, "elapsed_sec": 377.5, "timestamp": "2026-04-12T10:38:46", "sharpe": 0.1293, "psr": 0.5869, "equity": 1022.78, "sortino": 0.1938, "return_pct": 2.28, "max_dd": 14.62, "win_rate": 50.55, "profit_factor": 1.022, "ic": 0.0354, "hit": 50.27, "aleatoric_mean": 0.050691, "epistemic_mean": 0.007457, "confidence_mean": 0.9473, "per_window": [{"fold": "fold_1", "regime": "Pre-crisis upturn + GFC onset", "sharpe": -3.8702, "sortino": -5.68, "return_pct": -10.42, "equity": 895.84, "max_dd": 12.0, "win_rate": 43.28, "profit_factor": 0.546, "ic": 0.0186, "hit": 42.65, "n": 68, "aleatoric_mean": 0.124591, "epistemic_mean": 0.007021, "confidence_mean": 0.8896, "aleatoric_std": 0.10466, "epistemic_std": 0.002871}, {"fold": "fold_2", "regime": "Post-crash recovery", "sharpe": -0.0631, "sortino": -0.1009, "return_pct": -0.43, "equity": 995.73, "max_dd": 7.23, "win_rate": 52.78, "profit_factor": 0.99, "ic": 0.0125, "hit": 52.78, "n": 72, "aleatoric_mean": 0.058026, "epistemic_mean": 0.009446, "confidence_mean": 0.9376, "aleatoric_std": 0.031906, "epistemic_std": 0.00385}, {"fold": "fold_3", "regime": "Eurozone debt plateau", "sharpe": 3.809, "sortino": 7.3226, "return_pct": 9.01, "equity": 1090.06, "max_dd": 1.88, "win_rate": 56.52, "profit_factor": 1.819, "ic": 0.3423, "hit": 54.93, "n": 71, "aleatoric_mean": 0.069784, "epistemic_mean": 0.006247, "confidence_mean": 0.9305, "aleatoric_std": 0.039214, "epistemic_std": 0.002463}, {"fold": "fold_4", "regime": "Strong USD downturn", "sharpe": -0.5188, "sortino": -0.792, "return_pct": -3.42, "equity": 965.8, "max_dd": 11.32, "win_rate": 50.0, "profit_factor": 0.915, "ic": -0.1155, "hit": 49.62, "n": 133, "aleatoric_mean": 0.034255, "epistemic_mean": 0.008593, "confidence_mean": 0.96, "aleatoric_std": 0.039649, "epistemic_std": 0.003464}, {"fold": "fold_5", "regime": "Low-vol plateau", "sharpe": 1.2157, "sortino": 1.7467, "return_pct": 3.08, "equity": 1030.83, "max_dd": 2.29, "win_rate": 49.61, "profit_factor": 1.222, "ic": 0.0299, "hit": 49.61, "n": 127, "aleatoric_mean": 0.019973, "epistemic_mean": 0.007651, "confidence_mean": 0.9734, "aleatoric_std": 0.020094, "epistemic_std": 0.00288}, {"fold": "fold_6", "regime": "EUR crisis downturn", "sharpe": -0.0729, "sortino": -0.1126, "return_pct": -0.6, "equity": 993.99, "max_dd": 9.29, "win_rate": 52.31, "profit_factor": 0.989, "ic": 0.1674, "hit": 52.31, "n": 130, "aleatoric_mean": 0.072073, "epistemic_mean": 0.006435, "confidence_mean": 0.9291, "aleatoric_std": 0.050252, "epistemic_std": 0.002187}, {"fold": "fold_7", "regime": "Recent mixed/upturn", "sharpe": 1.3657, "sortino": 2.6919, "return_pct": 6.29, "equity": 1062.92, "max_dd": 3.34, "win_rate": 49.61, "profit_factor": 1.262, "ic": 0.1118, "hit": 49.61, "n": 127, "aleatoric_mean": 0.022335, "epistemic_mean": 0.006904, "confidence_mean": 0.972, "aleatoric_std": 0.022645, "epistemic_std": 0.002573}], "val_sharpe": 1.0918, "val_psr": 0.9403, "val_equity": 1185.99, "val_sortino": 1.5795, "val_return_pct": 18.6, "val_max_dd": 8.25, "val_win_rate": 54.81, "val_profit_factor": 1.202, "val_ic": 0.1006, "val_hit": 54.49, "val_aleatoric_mean": 0.042588, "val_epistemic_mean": 0.007257, "val_confidence_mean": 0.9549, "val_per_window": [{"fold": "fold_1", "regime": "Pre-crisis upturn + GFC onset", "sharpe": 0.2751, "sortino": 0.4173, "return_pct": 0.46, "equity": 1004.58, "max_dd": 3.14, "win_rate": 47.95, "profit_factor": 1.047, "ic": 0.1453, "hit": 47.3, "n": 74, "aleatoric_mean": 0.094546, "epistemic_mean": 0.005418, "confidence_mean": 0.9165, "aleatoric_std": 0.104013, "epistemic_std": 0.002524}, {"fold": "fold_2", "regime": "Post-crash recovery", "sharpe": 0.9982, "sortino": 1.6265, "return_pct": 2.63, "equity": 1026.29, "max_dd": 4.55, "win_rate": 52.05, "profit_factor": 1.174, "ic": -0.028, "hit": 52.05, "n": 73, "aleatoric_mean": 0.092712, "epistemic_mean": 0.006284, "confidence_mean": 0.9117, "aleatoric_std": 0.050087, "epistemic_std": 0.002906}, {"fold": "fold_3", "regime": "Eurozone debt plateau", "sharpe": 0.1862, "sortino": 0.2789, "return_pct": 0.4, "equity": 1004.04, "max_dd": 5.86, "win_rate": 58.67, "profit_factor": 1.031, "ic": 0.0723, "hit": 57.89, "n": 76, "aleatoric_mean": 0.029407, "epistemic_mean": 0.008316, "confidence_mean": 0.9639, "aleatoric_std": 0.016701, "epistemic_std": 0.003607}, {"fold": "fold_4", "regime": "Strong USD downturn", "sharpe": 0.562, "sortino": 0.9217, "return_pct": 1.43, "equity": 1014.33, "max_dd": 8.25, "win_rate": 52.0, "profit_factor": 1.092, "ic": 0.0525, "hit": 52.0, "n": 75, "aleatoric_mean": 0.030672, "epistemic_mean": 0.008085, "confidence_mean": 0.9636, "aleatoric_std": 0.033776, "epistemic_std": 0.002961}, {"fold": "fold_5", "regime": "Low-vol plateau", "sharpe": 0.5094, "sortino": 0.6493, "return_pct": 1.12, "equity": 1011.16, "max_dd": 2.3, "win_rate": 55.84, "profit_factor": 1.091, "ic": 0.0804, "hit": 55.84, "n": 77, "aleatoric_mean": 0.019389, "epistemic_mean": 0.007629, "confidence_mean": 0.9739, "aleatoric_std": 0.014359, "epistemic_std": 0.002806}, {"fold": "fold_6", "regime": "EUR crisis downturn", "sharpe": 2.7507, "sortino": 4.959, "return_pct": 3.94, "equity": 1039.36, "max_dd": 1.64, "win_rate": 58.33, "profit_factor": 1.596, "ic": 0.0404, "hit": 57.53, "n": 73, "aleatoric_mean": 0.009668, "epistemic_mean": 0.008045, "confidence_mean": 0.9826, "aleatoric_std": 0.005551, "epistemic_std": 0.002545}, {"fold": "fold_7", "regime": "Recent mixed/upturn", "sharpe": 4.3972, "sortino": 8.9608, "return_pct": 7.48, "equity": 1074.75, "max_dd": 1.69, "win_rate": 58.67, "profit_factor": 2.045, "ic": 0.2496, "hit": 58.67, "n": 75, "aleatoric_mean": 0.023666, "epistemic_mean": 0.00697, "confidence_mean": 0.9706, "aleatoric_std": 0.018878, "epistemic_std": 0.002043}], "train_sharpe": 1.7998, "train_psr": 1.0, "train_equity": 4212.48, "train_sortino": 3.6794, "train_return_pct": 321.25, "train_max_dd": 12.93, "train_win_rate": 54.81, "train_profit_factor": 1.494, "train_ic": 0.1169, "train_hit": 54.57, "train_per_window": [{"fold": "all_train", "regime": "Training data", "sharpe": 1.7998, "sortino": 3.6794, "return_pct": 321.25, "equity": 4212.48, "max_dd": 12.93, "win_rate": 54.81, "profit_factor": 1.494, "ic": 0.1169, "hit": 54.57, "n": 1651}], "experiment_num": 39, "status": "DISCARD"}
{"backbone": "lfm2-350m", "description": "lfm2: H-Exp18 bs=64 smoother het-gradients", "config": {"seq_len": 60, "lr": 3e-05, "batch_size": 64, "epochs": 30, "weight_decay": 1e-05, "patience": 8, "grad_clip": 1.0, "warmup_epochs": 3, "huber_delta": 1.0, "head_dropout": 0.1}, "composite": -0.3951, "test_pos_folds": 5, "val_pos_folds": 4, "val_loss": -1.498412, "elapsed_sec": 347.0, "timestamp": "2026-04-12T10:45:16", "sharpe": 0.4652, "psr": 0.7676, "equity": 1102.5, "sortino": 0.7062, "return_pct": 10.25, "max_dd": 20.13, "win_rate": 50.73, "profit_factor": 1.081, "ic": 0.0168, "hit": 50.4, "aleatoric_mean": 0.112368, "epistemic_mean": 0.008001, "confidence_mean": 0.9009, "per_window": [{"fold": "fold_1", "regime": "Pre-crisis upturn + GFC onset", "sharpe": 1.1739, "sortino": 2.0502, "return_pct": 2.4, "equity": 1023.99, "max_dd": 2.53, "win_rate": 55.77, "profit_factor": 1.197, "ic": 0.0381, "hit": 54.72, "n": 53, "aleatoric_mean": 0.240587, "epistemic_mean": 0.006281, "confidence_mean": 0.8127, "aleatoric_std": 0.153035, "epistemic_std": 0.003526}, {"fold": "fold_2", "regime": "Post-crash recovery", "sharpe": 0.5931, "sortino": 0.9426, "return_pct": 1.53, "equity": 1015.25, "max_dd": 4.33, "win_rate": 47.37, "profit_factor": 1.1, "ic": 0.0413, "hit": 47.37, "n": 57, "aleatoric_mean": 0.261518, "epistemic_mean": 0.007229, "confidence_mean": 0.8038, "aleatoric_std": 0.193416, "epistemic_std": 0.003886}, {"fold": "fold_3", "regime": "Eurozone debt plateau", "sharpe": -0.6802, "sortino": -1.0309, "return_pct": -1.27, "equity": 987.31, "max_dd": 5.59, "win_rate": 48.15, "profit_factor": 0.897, "ic": -0.0435, "hit": 46.43, "n": 56, "aleatoric_mean": 0.112532, "epistemic_mean": 0.008133, "confidence_mean": 0.8955, "aleatoric_std": 0.070935, "epistemic_std": 0.004064}, {"fold": "fold_4", "regime": "Strong USD downturn", "sharpe": -2.6306, "sortino": -3.8192, "return_pct": -12.55, "equity": 874.54, "max_dd": 13.54, "win_rate": 44.44, "profit_factor": 0.643, "ic": -0.2218, "hit": 44.07, "n": 118, "aleatoric_mean": 0.08605, "epistemic_mean": 0.007572, "confidence_mean": 0.9183, "aleatoric_std": 0.077768, "epistemic_std": 0.003544}, {"fold": "fold_5", "regime": "Low-vol plateau", "sharpe": 1.223, "sortino": 2.3038, "return_pct": 2.73, "equity": 1027.27, "max_dd": 1.86, "win_rate": 50.0, "profit_factor": 1.226, "ic": -0.019, "hit": 50.0, "n": 112, "aleatoric_mean": 0.041041, "epistemic_mean": 0.009331, "confidence_mean": 0.9533, "aleatoric_std": 0.041765, "epistemic_std": 0.004389}, {"fold": "fold_6", "regime": "EUR crisis downturn", "sharpe": 0.6008, "sortino": 0.988, "return_pct": 2.51, "equity": 1025.14, "max_dd": 5.54, "win_rate": 50.43, "profit_factor": 1.1, "ic": 0.18, "hit": 50.43, "n": 115, "aleatoric_mean": 0.135246, "epistemic_mean": 0.006836, "confidence_mean": 0.8809, "aleatoric_std": 0.094587, "epistemic_std": 0.003906}, {"fold": "fold_7", "regime": "Recent mixed/upturn", "sharpe": 3.8759, "sortino": 6.9504, "return_pct": 16.63, "equity": 1166.29, "max_dd": 2.66, "win_rate": 58.93, "profit_factor": 1.952, "ic": 0.3082, "hit": 58.93, "n": 112, "aleatoric_mean": 0.051267, "epistemic_mean": 0.009458, "confidence_mean": 0.9447, "aleatoric_std": 0.053192, "epistemic_std": 0.00351}], "val_sharpe": 0.1049, "val_psr": 0.5537, "val_equity": 1008.45, "val_sortino": 0.156, "val_return_pct": 0.84, "val_max_dd": 12.22, "val_win_rate": 51.2, "val_profit_factor": 1.018, "val_ic": 0.0198, "val_hit": 50.96, "val_aleatoric_mean": 0.098582, "val_epistemic_mean": 0.008931, "val_confidence_mean": 0.9146, "val_per_window": [{"fold": "fold_1", "regime": "Pre-crisis upturn + GFC onset", "sharpe": 3.2878, "sortino": 6.2821, "return_pct": 5.18, "equity": 1051.82, "max_dd": 1.93, "win_rate": 55.17, "profit_factor": 1.721, "ic": 0.1396, "hit": 54.24, "n": 59, "aleatoric_mean": 0.271141, "epistemic_mean": 0.007674, "confidence_mean": 0.8129, "aleatoric_std": 0.271907, "epistemic_std": 0.00577}, {"fold": "fold_2", "regime": "Post-crash recovery", "sharpe": -2.2461, "sortino": -3.6136, "return_pct": -4.35, "equity": 956.5, "max_dd": 8.22, "win_rate": 39.66, "profit_factor": 0.695, "ic": -0.1501, "hit": 39.66, "n": 58, "aleatoric_mean": 0.171056, "epistemic_mean": 0.007205, "confidence_mean": 0.8563, "aleatoric_std": 0.121575, "epistemic_std": 0.003222}, {"fold": "fold_3", "regime": "Eurozone debt plateau", "sharpe": 0.3786, "sortino": 0.6656, "return_pct": 0.78, "equity": 1007.82, "max_dd": 2.91, "win_rate": 55.74, "profit_factor": 1.065, "ic": -0.0497, "hit": 55.74, "n": 61, "aleatoric_mean": 0.052978, "epistemic_mean": 0.008993, "confidence_mean": 0.9435, "aleatoric_std": 0.049555, "epistemic_std": 0.003655}, {"fold": "fold_4", "regime": "Strong USD downturn", "sharpe": -2.3544, "sortino": -3.5684, "return_pct": -5.07, "equity": 949.32, "max_dd": 6.12, "win_rate": 46.67, "profit_factor": 0.697, "ic": -0.0305, "hit": 46.67, "n": 60, "aleatoric_mean": 0.060027, "epistemic_mean": 0.009869, "confidence_mean": 0.9371, "aleatoric_std": 0.059272, "epistemic_std": 0.0047}, {"fold": "fold_5", "regime": "Low-vol plateau", "sharpe": 1.0244, "sortino": 1.605, "return_pct": 1.73, "equity": 1017.29, "max_dd": 2.84, "win_rate": 51.61, "profit_factor": 1.181, "ic": 0.1418, "hit": 51.61, "n": 62, "aleatoric_mean": 0.026855, "epistemic_mean": 0.011281, "confidence_mean": 0.9636, "aleatoric_std": 0.022807, "epistemic_std": 0.004495}, {"fold": "fold_6", "regime": "EUR crisis downturn", "sharpe": -1.0919, "sortino": -1.5682, "return_pct": -1.15, "equity": 988.46, "max_dd": 1.8, "win_rate": 47.37, "profit_factor": 0.836, "ic": -0.0417, "hit": 46.55, "n": 58, "aleatoric_mean": 0.019002, "epistemic_mean": 0.010522, "confidence_mean": 0.9715, "aleatoric_std": 0.014684, "epistemic_std": 0.004008}, {"fold": "fold_7", "regime": "Recent mixed/upturn", "sharpe": 3.3037, "sortino": 4.0373, "return_pct": 4.19, "equity": 1041.9, "max_dd": 1.69, "win_rate": 61.67, "profit_factor": 1.716, "ic": 0.3306, "hit": 61.67, "n": 60, "aleatoric_mean": 0.094805, "epistemic_mean": 0.00687, "confidence_mean": 0.9133, "aleatoric_std": 0.094586, "epistemic_std": 0.003174}], "train_sharpe": 0.9364, "train_psr": 0.9877, "train_equity": 1861.89, "train_sortino": 1.2478, "train_return_pct": 86.19, "train_max_dd": 15.2, "train_win_rate": 51.05, "train_profit_factor": 1.241, "train_ic": 0.0561, "train_hit": 50.8, "train_per_window": [{"fold": "all_train", "regime": "Training data", "sharpe": 0.9364, "sortino": 1.2478, "return_pct": 86.19, "equity": 1861.89, "max_dd": 15.2, "win_rate": 51.05, "profit_factor": 1.241, "ic": 0.0561, "hit": 50.8, "n": 1382}], "experiment_num": 40, "status": "DISCARD"}
