{"backbone": "mlp", "description": "mlp: Exp36 POST-BIOS verify champion must be +6.21", "config": {"seq_len": 10, "lr": 0.0005, "batch_size": 32, "epochs": 50, "weight_decay": 1e-05, "patience": 10, "grad_clip": 1.0, "warmup_epochs": 0, "huber_delta": 0.5, "head_dropout": 0.15, "seed": 0, "het_loss": false}, "composite": 5.499, "test_pos_folds": 7, "val_pos_folds": 6, "val_loss": 3.8e-05, "elapsed_sec": 19.6, "timestamp": "2026-04-19T16:52:21", "sharpe": 6.2113, "psr": 1.0, "equity": 11010.87, "sortino": 11.3103, "return_pct": 1001.09, "max_dd": 4.13, "win_rate": 69.35, "profit_factor": 3.295, "ic": 0.4846, "hit": 69.06, "aleatoric_mean": 2.6e-05, "epistemic_mean": 5.2e-05, "confidence_mean": 0.9999, "per_window": [{"fold": "fold_1", "regime": "Pre-crisis upturn + GFC onset", "sharpe": 2.4608, "sortino": 6.7778, "return_pct": 19.79, "equity": 1197.85, "max_dd": 3.29, "win_rate": 60.78, "profit_factor": 1.805, "ic": 0.1877, "hit": 60.19, "n": 103, "aleatoric_mean": 5.3e-05, "epistemic_mean": 0.000106, "confidence_mean": 0.9998, "aleatoric_std": 7e-05, "epistemic_std": 0.000141}, {"fold": "fold_2", "regime": "Post-crash recovery", "sharpe": 1.1722, "sortino": 2.0218, "return_pct": 5.49, "equity": 1054.86, "max_dd": 3.47, "win_rate": 53.27, "profit_factor": 1.202, "ic": 0.0824, "hit": 53.27, "n": 107, "aleatoric_mean": 2.1e-05, "epistemic_mean": 4.3e-05, "confidence_mean": 0.9999, "aleatoric_std": 1.5e-05, "epistemic_std": 3.1e-05}, {"fold": "fold_3", "regime": "Eurozone debt plateau", "sharpe": 9.7583, "sortino": 18.8138, "return_pct": 34.13, "equity": 1341.27, "max_dd": 1.32, "win_rate": 75.96, "profit_factor": 4.755, "ic": 0.5836, "hit": 74.53, "n": 106, "aleatoric_mean": 2.8e-05, "epistemic_mean": 5.5e-05, "confidence_mean": 0.9999, "aleatoric_std": 1.4e-05, "epistemic_std": 2.9e-05}, {"fold": "fold_4", "regime": "Strong USD downturn", "sharpe": 9.7799, "sortino": 19.4179, "return_pct": 90.3, "equity": 1902.97, "max_dd": 1.81, "win_rate": 75.45, "profit_factor": 5.651, "ic": 0.6667, "hit": 75.0, "n": 168, "aleatoric_mean": 3.6e-05, "epistemic_mean": 7.2e-05, "confidence_mean": 0.9999, "aleatoric_std": 2.9e-05, "epistemic_std": 5.8e-05}, {"fold": "fold_5", "regime": "Low-vol plateau", "sharpe": 8.8545, "sortino": 16.1387, "return_pct": 29.29, "equity": 1292.92, "max_dd": 1.43, "win_rate": 70.99, "profit_factor": 4.604, "ic": 0.638, "hit": 70.99, "n": 162, "aleatoric_mean": 1.2e-05, "epistemic_mean": 2.5e-05, "confidence_mean": 1.0, "aleatoric_std": 7e-06, "epistemic_std": 1.3e-05}, {"fold": "fold_6", "regime": "EUR crisis downturn", "sharpe": 9.9474, "sortino": 21.0105, "return_pct": 69.54, "equity": 1695.35, "max_dd": 2.27, "win_rate": 70.91, "profit_factor": 5.27, "ic": 0.641, "hit": 70.91, "n": 165, "aleatoric_mean": 2.4e-05, "epistemic_mean": 4.9e-05, "confidence_mean": 0.9999, "aleatoric_std": 1.7e-05, "epistemic_std": 3.3e-05}, {"fold": "fold_7", "regime": "Recent mixed/upturn", "sharpe": 8.4769, "sortino": 14.3598, "return_pct": 55.75, "equity": 1557.55, "max_dd": 1.64, "win_rate": 71.6, "profit_factor": 4.429, "ic": 0.6222, "hit": 71.6, "n": 162, "aleatoric_mean": 1.7e-05, "epistemic_mean": 3.4e-05, "confidence_mean": 0.9999, "aleatoric_std": 1e-05, "epistemic_std": 2e-05}], "val_sharpe": 5.599, "val_psr": 1.0, "val_equity": 3472.42, "val_sortino": 8.4457, "val_return_pct": 247.24, "val_max_dd": 7.43, "val_win_rate": 66.19, "val_profit_factor": 2.61, "val_ic": 0.4582, "val_hit": 65.76, "val_aleatoric_mean": 1.5e-05, "val_epistemic_mean": 3e-05, "val_confidence_mean": 1.0, "val_per_window": [{"fold": "fold_1", "regime": "Pre-crisis upturn + GFC onset", "sharpe": 0.0212, "sortino": 0.0342, "return_pct": -0.02, "equity": 999.8, "max_dd": 2.91, "win_rate": 47.22, "profit_factor": 1.004, "ic": -0.0659, "hit": 46.79, "n": 109, "aleatoric_mean": 1.6e-05, "epistemic_mean": 3.1e-05, "confidence_mean": 1.0, "aleatoric_std": 2e-05, "epistemic_std": 4.1e-05}, {"fold": "fold_2", "regime": "Post-crash recovery", "sharpe": -0.6284, "sortino": -0.9753, "return_pct": -3.27, "equity": 967.3, "max_dd": 7.43, "win_rate": 47.22, "profit_factor": 0.906, "ic": 0.0432, "hit": 47.22, "n": 108, "aleatoric_mean": 2.7e-05, "epistemic_mean": 5.5e-05, "confidence_mean": 0.9999, "aleatoric_std": 2.2e-05, "epistemic_std": 4.3e-05}, {"fold": "fold_3", "regime": "Eurozone debt plateau", "sharpe": 11.0234, "sortino": 30.4677, "return_pct": 43.97, "equity": 1439.69, "max_dd": 0.84, "win_rate": 78.9, "profit_factor": 6.531, "ic": 0.6702, "hit": 77.48, "n": 111, "aleatoric_mean": 1.8e-05, "epistemic_mean": 3.6e-05, "confidence_mean": 0.9999, "aleatoric_std": 1.3e-05, "epistemic_std": 2.5e-05}, {"fold": "fold_4", "regime": "Strong USD downturn", "sharpe": 7.8607, "sortino": 16.5925, "return_pct": 27.57, "equity": 1275.68, "max_dd": 1.08, "win_rate": 71.56, "profit_factor": 3.79, "ic": 0.6035, "hit": 70.91, "n": 110, "aleatoric_mean": 1.4e-05, "epistemic_mean": 2.7e-05, "confidence_mean": 1.0, "aleatoric_std": 1.2e-05, "epistemic_std": 2.5e-05}, {"fold": "fold_5", "regime": "Low-vol plateau", "sharpe": 10.5961, "sortino": 28.9438, "return_pct": 34.04, "equity": 1340.39, "max_dd": 0.62, "win_rate": 75.0, "profit_factor": 6.466, "ic": 0.7232, "hit": 75.0, "n": 112, "aleatoric_mean": 1.3e-05, "epistemic_mean": 2.6e-05, "confidence_mean": 1.0, "aleatoric_std": 1e-05, "epistemic_std": 2e-05}, {"fold": "fold_6", "regime": "EUR crisis downturn", "sharpe": 9.2138, "sortino": 21.1712, "return_pct": 19.95, "equity": 1199.5, "max_dd": 0.82, "win_rate": 71.03, "profit_factor": 5.067, "ic": 0.717, "hit": 70.37, "n": 108, "aleatoric_mean": 8e-06, "epistemic_mean": 1.6e-05, "confidence_mean": 1.0, "aleatoric_std": 4e-06, "epistemic_std": 8e-06}, {"fold": "fold_7", "regime": "Recent mixed/upturn", "sharpe": 9.5361, "sortino": 25.4132, "return_pct": 21.6, "equity": 1215.96, "max_dd": 0.72, "win_rate": 71.82, "profit_factor": 4.828, "ic": 0.5963, "hit": 71.82, "n": 110, "aleatoric_mean": 9e-06, "epistemic_mean": 1.8e-05, "confidence_mean": 1.0, "aleatoric_std": 6e-06, "epistemic_std": 1.1e-05}], "train_sharpe": 7.9415, "train_psr": 1.0, "train_equity": 5670149.5, "train_sortino": 23.2561, "train_return_pct": 566914.95, "train_max_dd": 4.92, "train_win_rate": 78.04, "train_profit_factor": 7.921, "train_ic": 0.7556, "train_hit": 77.72, "train_per_window": [{"fold": "all_train", "regime": "Training data", "sharpe": 7.9415, "sortino": 23.2561, "return_pct": 566914.95, "equity": 5670149.5, "max_dd": 4.92, "win_rate": 78.04, "profit_factor": 7.921, "ic": 0.7556, "hit": 77.72, "n": 2478}], "experiment_num": 92, "status": "KEEP"}
{"backbone": "mlp", "description": "mlp: Exp37 bs=64 larger batch smoother gradients seed=0", "config": {"seq_len": 10, "lr": 0.0005, "batch_size": 64, "epochs": 50, "weight_decay": 1e-05, "patience": 10, "grad_clip": 1.0, "warmup_epochs": 0, "huber_delta": 0.5, "head_dropout": 0.15, "seed": 0, "het_loss": false}, "composite": 4.0901, "test_pos_folds": 7, "val_pos_folds": 6, "val_loss": 4.2e-05, "elapsed_sec": 9.2, "timestamp": "2026-04-19T16:52:42", "sharpe": 4.1901, "psr": 1.0, "equity": 5330.5, "sortino": 7.5857, "return_pct": 433.05, "max_dd": 5.49, "win_rate": 63.36, "profit_factor": 2.196, "ic": 0.3635, "hit": 63.1, "aleatoric_mean": 6.7e-05, "epistemic_mean": 0.000134, "confidence_mean": 0.9998, "per_window": [{"fold": "fold_1", "regime": "Pre-crisis upturn + GFC onset", "sharpe": 2.6134, "sortino": 7.1406, "return_pct": 21.15, "equity": 1211.51, "max_dd": 3.85, "win_rate": 58.82, "profit_factor": 1.875, "ic": 0.1457, "hit": 58.25, "n": 103, "aleatoric_mean": 0.000129, "epistemic_mean": 0.000258, "confidence_mean": 0.9996, "aleatoric_std": 0.000201, "epistemic_std": 0.000401}, {"fold": "fold_2", "regime": "Post-crash recovery", "sharpe": 1.9823, "sortino": 3.3447, "return_pct": 9.61, "equity": 1096.05, "max_dd": 3.51, "win_rate": 60.75, "profit_factor": 1.364, "ic": 0.1203, "hit": 60.75, "n": 107, "aleatoric_mean": 4.3e-05, "epistemic_mean": 8.7e-05, "confidence_mean": 0.9999, "aleatoric_std": 3.1e-05, "epistemic_std": 6.2e-05}, {"fold": "fold_3", "regime": "Eurozone debt plateau", "sharpe": 5.668, "sortino": 11.2999, "return_pct": 20.68, "equity": 1206.83, "max_dd": 1.72, "win_rate": 66.35, "profit_factor": 2.442, "ic": 0.3966, "hit": 65.09, "n": 106, "aleatoric_mean": 7.5e-05, "epistemic_mean": 0.00015, "confidence_mean": 0.9998, "aleatoric_std": 4.7e-05, "epistemic_std": 9.4e-05}, {"fold": "fold_4", "regime": "Strong USD downturn", "sharpe": 5.7253, "sortino": 9.7995, "return_pct": 51.37, "equity": 1513.72, "max_dd": 4.07, "win_rate": 65.27, "profit_factor": 2.652, "ic": 0.5069, "hit": 64.88, "n": 168, "aleatoric_mean": 9.5e-05, "epistemic_mean": 0.00019, "confidence_mean": 0.9997, "aleatoric_std": 6.3e-05, "epistemic_std": 0.000127}, {"fold": "fold_5", "regime": "Low-vol plateau", "sharpe": 5.9628, "sortino": 10.0645, "return_pct": 20.35, "equity": 1203.46, "max_dd": 1.48, "win_rate": 65.43, "profit_factor": 2.733, "ic": 0.4807, "hit": 65.43, "n": 162, "aleatoric_mean": 3.7e-05, "epistemic_mean": 7.3e-05, "confidence_mean": 0.9999, "aleatoric_std": 1.9e-05, "epistemic_std": 3.7e-05}, {"fold": "fold_6", "regime": "EUR crisis downturn", "sharpe": 6.933, "sortino": 11.9702, "return_pct": 48.76, "equity": 1487.58, "max_dd": 1.62, "win_rate": 67.27, "profit_factor": 3.109, "ic": 0.5468, "hit": 67.27, "n": 165, "aleatoric_mean": 5.9e-05, "epistemic_mean": 0.000117, "confidence_mean": 0.9998, "aleatoric_std": 4.1e-05, "epistemic_std": 8.1e-05}, {"fold": "fold_7", "regime": "Recent mixed/upturn", "sharpe": 3.5702, "sortino": 6.145, "return_pct": 22.74, "equity": 1227.45, "max_dd": 3.1, "win_rate": 58.02, "profit_factor": 1.834, "ic": 0.4433, "hit": 58.02, "n": 162, "aleatoric_mean": 4.8e-05, "epistemic_mean": 9.6e-05, "confidence_mean": 0.9999, "aleatoric_std": 3e-05, "epistemic_std": 6e-05}], "val_sharpe": 4.989, "val_psr": 1.0, "val_equity": 3068.48, "val_sortino": 7.6642, "val_return_pct": 206.85, "val_max_dd": 6.58, "val_win_rate": 65.27, "val_profit_factor": 2.345, "val_ic": 0.3864, "val_hit": 64.84, "val_aleatoric_mean": 3.9e-05, "val_epistemic_mean": 7.7e-05, "val_confidence_mean": 0.9999, "val_per_window": [{"fold": "fold_1", "regime": "Pre-crisis upturn + GFC onset", "sharpe": -0.1913, "sortino": -0.2979, "return_pct": -0.56, "equity": 994.45, "max_dd": 4.62, "win_rate": 48.15, "profit_factor": 0.969, "ic": 0.0094, "hit": 47.71, "n": 109, "aleatoric_mean": 3.9e-05, "epistemic_mean": 7.8e-05, "confidence_mean": 0.9999, "aleatoric_std": 4e-05, "epistemic_std": 7.9e-05}, {"fold": "fold_2", "regime": "Post-crash recovery", "sharpe": 0.3684, "sortino": 0.5821, "return_pct": 1.52, "equity": 1015.25, "max_dd": 6.07, "win_rate": 51.85, "profit_factor": 1.06, "ic": 0.0774, "hit": 51.85, "n": 108, "aleatoric_mean": 6.3e-05, "epistemic_mean": 0.000126, "confidence_mean": 0.9998, "aleatoric_std": 4.6e-05, "epistemic_std": 9.1e-05}, {"fold": "fold_3", "regime": "Eurozone debt plateau", "sharpe": 8.4825, "sortino": 17.5895, "return_pct": 35.09, "equity": 1350.93, "max_dd": 1.75, "win_rate": 77.06, "profit_factor": 4.087, "ic": 0.5286, "hit": 75.68, "n": 111, "aleatoric_mean": 4.5e-05, "epistemic_mean": 9.1e-05, "confidence_mean": 0.9999, "aleatoric_std": 3e-05, "epistemic_std": 6e-05}, {"fold": "fold_4", "regime": "Strong USD downturn", "sharpe": 8.4761, "sortino": 22.1467, "return_pct": 29.5, "equity": 1295.0, "max_dd": 1.02, "win_rate": 71.56, "profit_factor": 4.239, "ic": 0.5693, "hit": 70.91, "n": 110, "aleatoric_mean": 3.7e-05, "epistemic_mean": 7.5e-05, "confidence_mean": 0.9999, "aleatoric_std": 2.9e-05, "epistemic_std": 5.8e-05}, {"fold": "fold_5", "regime": "Low-vol plateau", "sharpe": 9.914, "sortino": 21.039, "return_pct": 32.24, "equity": 1322.42, "max_dd": 1.43, "win_rate": 74.11, "profit_factor": 5.634, "ic": 0.7024, "hit": 74.11, "n": 112, "aleatoric_mean": 3.8e-05, "epistemic_mean": 7.5e-05, "confidence_mean": 0.9999, "aleatoric_std": 3e-05, "epistemic_std": 6e-05}, {"fold": "fold_6", "regime": "EUR crisis downturn", "sharpe": 7.4755, "sortino": 13.1641, "return_pct": 16.68, "equity": 1166.83, "max_dd": 0.83, "win_rate": 71.03, "profit_factor": 3.639, "ic": 0.5219, "hit": 70.37, "n": 108, "aleatoric_mean": 2.3e-05, "epistemic_mean": 4.5e-05, "confidence_mean": 0.9999, "aleatoric_std": 1e-05, "epistemic_std": 2e-05}, {"fold": "fold_7", "regime": "Recent mixed/upturn", "sharpe": 5.2301, "sortino": 8.9511, "return_pct": 12.59, "equity": 1125.88, "max_dd": 1.53, "win_rate": 62.73, "profit_factor": 2.329, "ic": 0.3961, "hit": 62.73, "n": 110, "aleatoric_mean": 2.6e-05, "epistemic_mean": 5.2e-05, "confidence_mean": 0.9999, "aleatoric_std": 1.8e-05, "epistemic_std": 3.7e-05}], "train_sharpe": 7.281, "train_psr": 1.0, "train_equity": 3129510.0, "train_sortino": 20.5547, "train_return_pct": 312851.0, "train_max_dd": 4.14, "train_win_rate": 75.77, "train_profit_factor": 6.218, "train_ic": 0.6944, "train_hit": 75.46, "train_per_window": [{"fold": "all_train", "regime": "Training data", "sharpe": 7.281, "sortino": 20.5547, "return_pct": 312851.0, "equity": 3129510.0, "max_dd": 4.14, "win_rate": 75.77, "profit_factor": 6.218, "ic": 0.6944, "hit": 75.46, "n": 2478}], "experiment_num": 93, "status": "DISCARD"}
{"backbone": "mlp", "description": "mlp: Exp38 warmup=3 stabilize high-LR (Goyal2017) seed=0", "config": {"seq_len": 10, "lr": 0.0005, "batch_size": 32, "epochs": 50, "weight_decay": 1e-05, "patience": 10, "grad_clip": 1.0, "warmup_epochs": 3, "huber_delta": 0.5, "head_dropout": 0.15, "seed": 0, "het_loss": false}, "composite": 4.894, "test_pos_folds": 7, "val_pos_folds": 6, "val_loss": 4.1e-05, "elapsed_sec": 15.8, "timestamp": "2026-04-19T16:53:45", "sharpe": 4.994, "psr": 1.0, "equity": 7182.88, "sortino": 9.162, "return_pct": 618.29, "max_dd": 4.61, "win_rate": 65.53, "profit_factor": 2.572, "ic": 0.4229, "hit": 65.26, "aleatoric_mean": 5e-05, "epistemic_mean": 9.9e-05, "confidence_mean": 0.9999, "per_window": [{"fold": "fold_1", "regime": "Pre-crisis upturn + GFC onset", "sharpe": 2.6127, "sortino": 7.1563, "return_pct": 21.14, "equity": 1211.44, "max_dd": 2.32, "win_rate": 60.78, "profit_factor": 1.875, "ic": 0.1623, "hit": 60.19, "n": 103, "aleatoric_mean": 9.6e-05, "epistemic_mean": 0.000193, "confidence_mean": 0.9997, "aleatoric_std": 0.000122, "epistemic_std": 0.000245}, {"fold": "fold_2", "regime": "Post-crash recovery", "sharpe": 2.4138, "sortino": 4.0436, "return_pct": 11.83, "equity": 1118.34, "max_dd": 3.36, "win_rate": 58.88, "profit_factor": 1.46, "ic": 0.1525, "hit": 58.88, "n": 107, "aleatoric_mean": 3.5e-05, "epistemic_mean": 7.1e-05, "confidence_mean": 0.9999, "aleatoric_std": 2.4e-05, "epistemic_std": 4.8e-05}, {"fold": "fold_3", "regime": "Eurozone debt plateau", "sharpe": 8.531, "sortino": 16.2589, "return_pct": 30.38, "equity": 1303.78, "max_dd": 1.36, "win_rate": 73.08, "profit_factor": 3.875, "ic": 0.5764, "hit": 71.7, "n": 106, "aleatoric_mean": 5.5e-05, "epistemic_mean": 0.000109, "confidence_mean": 0.9998, "aleatoric_std": 3.2e-05, "epistemic_std": 6.4e-05}, {"fold": "fold_4", "regime": "Strong USD downturn", "sharpe": 7.4869, "sortino": 14.9908, "return_pct": 68.61, "equity": 1686.09, "max_dd": 1.81, "win_rate": 70.66, "profit_factor": 3.637, "ic": 0.5561, "hit": 70.24, "n": 168, "aleatoric_mean": 7e-05, "epistemic_mean": 0.000141, "confidence_mean": 0.9998, "aleatoric_std": 5.6e-05, "epistemic_std": 0.000112}, {"fold": "fold_5", "regime": "Low-vol plateau", "sharpe": 7.9105, "sortino": 14.5289, "return_pct": 26.51, "equity": 1265.08, "max_dd": 1.43, "win_rate": 67.9, "profit_factor": 3.864, "ic": 0.5116, "hit": 67.9, "n": 162, "aleatoric_mean": 2.6e-05, "epistemic_mean": 5.3e-05, "confidence_mean": 0.9999, "aleatoric_std": 1.4e-05, "epistemic_std": 2.8e-05}, {"fold": "fold_6", "regime": "EUR crisis downturn", "sharpe": 7.4323, "sortino": 12.4895, "return_pct": 52.34, "equity": 1523.38, "max_dd": 2.68, "win_rate": 66.06, "profit_factor": 3.384, "ic": 0.5989, "hit": 66.06, "n": 165, "aleatoric_mean": 4.4e-05, "epistemic_mean": 8.8e-05, "confidence_mean": 0.9999, "aleatoric_std": 3e-05, "epistemic_std": 6e-05}, {"fold": "fold_7", "regime": "Recent mixed/upturn", "sharpe": 3.9221, "sortino": 6.8838, "return_pct": 25.14, "equity": 1251.43, "max_dd": 2.6, "win_rate": 59.88, "profit_factor": 1.948, "ic": 0.5075, "hit": 59.88, "n": 162, "aleatoric_mean": 3.3e-05, "epistemic_mean": 6.5e-05, "confidence_mean": 0.9999, "aleatoric_std": 1.9e-05, "epistemic_std": 3.8e-05}], "val_sharpe": 5.6734, "val_psr": 1.0, "val_equity": 3524.18, "val_sortino": 9.5177, "val_return_pct": 252.42, "val_max_dd": 4.44, "val_win_rate": 65.79, "val_profit_factor": 2.645, "val_ic": 0.4219, "val_hit": 65.36, "val_aleatoric_mean": 3e-05, "val_epistemic_mean": 6e-05, "val_confidence_mean": 0.9999, "val_per_window": [{"fold": "fold_1", "regime": "Pre-crisis upturn + GFC onset", "sharpe": -0.1539, "sortino": -0.2321, "return_pct": -0.46, "equity": 995.39, "max_dd": 4.44, "win_rate": 50.93, "profit_factor": 0.975, "ic": 0.0018, "hit": 50.46, "n": 109, "aleatoric_mean": 2.9e-05, "epistemic_mean": 5.8e-05, "confidence_mean": 0.9999, "aleatoric_std": 3.1e-05, "epistemic_std": 6.2e-05}, {"fold": "fold_2", "regime": "Post-crash recovery", "sharpe": 1.6874, "sortino": 2.9966, "return_pct": 8.19, "equity": 1081.91, "max_dd": 4.29, "win_rate": 51.85, "profit_factor": 1.305, "ic": 0.0753, "hit": 51.85, "n": 108, "aleatoric_mean": 5.4e-05, "epistemic_mean": 0.000108, "confidence_mean": 0.9998, "aleatoric_std": 4.9e-05, "epistemic_std": 9.8e-05}, {"fold": "fold_3", "regime": "Eurozone debt plateau", "sharpe": 8.1642, "sortino": 20.7264, "return_pct": 33.89, "equity": 1338.9, "max_dd": 1.52, "win_rate": 74.31, "profit_factor": 3.865, "ic": 0.569, "hit": 72.97, "n": 111, "aleatoric_mean": 3.9e-05, "epistemic_mean": 7.8e-05, "confidence_mean": 0.9999, "aleatoric_std": 2.5e-05, "epistemic_std": 5e-05}, {"fold": "fold_4", "regime": "Strong USD downturn", "sharpe": 8.4343, "sortino": 18.1679, "return_pct": 29.37, "equity": 1293.71, "max_dd": 1.01, "win_rate": 73.39, "profit_factor": 4.207, "ic": 0.5388, "hit": 72.73, "n": 110, "aleatoric_mean": 2.7e-05, "epistemic_mean": 5.4e-05, "confidence_mean": 0.9999, "aleatoric_std": 2.2e-05, "epistemic_std": 4.4e-05}, {"fold": "fold_5", "regime": "Low-vol plateau", "sharpe": 10.1777, "sortino": 27.8415, "return_pct": 32.95, "equity": 1329.46, "max_dd": 0.8, "win_rate": 72.32, "profit_factor": 5.938, "ic": 0.6984, "hit": 72.32, "n": 112, "aleatoric_mean": 2.7e-05, "epistemic_mean": 5.3e-05, "confidence_mean": 0.9999, "aleatoric_std": 1.9e-05, "epistemic_std": 3.9e-05}, {"fold": "fold_6", "regime": "EUR crisis downturn", "sharpe": 9.0203, "sortino": 18.8443, "return_pct": 19.6, "equity": 1196.04, "max_dd": 0.61, "win_rate": 71.96, "profit_factor": 4.877, "ic": 0.6343, "hit": 71.3, "n": 108, "aleatoric_mean": 1.7e-05, "epistemic_mean": 3.4e-05, "confidence_mean": 0.9999, "aleatoric_std": 8e-06, "epistemic_std": 1.6e-05}, {"fold": "fold_7", "regime": "Recent mixed/upturn", "sharpe": 8.0933, "sortino": 21.3281, "return_pct": 18.81, "equity": 1188.14, "max_dd": 0.72, "win_rate": 65.45, "profit_factor": 3.755, "ic": 0.5225, "hit": 65.45, "n": 110, "aleatoric_mean": 1.6e-05, "epistemic_mean": 3.3e-05, "confidence_mean": 1.0, "aleatoric_std": 1.1e-05, "epistemic_std": 2.3e-05}], "train_sharpe": 7.6235, "train_psr": 1.0, "train_equity": 4274442.5, "train_sortino": 23.2125, "train_return_pct": 427344.25, "train_max_dd": 3.27, "train_win_rate": 75.77, "train_profit_factor": 7.021, "train_ic": 0.7393, "train_hit": 75.46, "train_per_window": [{"fold": "all_train", "regime": "Training data", "sharpe": 7.6235, "sortino": 23.2125, "return_pct": 427344.25, "equity": 4274442.5, "max_dd": 3.27, "win_rate": 75.77, "profit_factor": 7.021, "ic": 0.7393, "hit": 75.46, "n": 2478}], "experiment_num": 94, "status": "DISCARD"}
