{"backbone": "lstm", "description": "lstm: Exp44 champion seed=2024 variance", "config": {"seq_len": 10, "lr": 0.001, "batch_size": 16, "epochs": 100, "weight_decay": 0.0007, "patience": 15, "grad_clip": 1.0, "warmup_epochs": 0, "huber_delta": 1.0, "head_dropout": 0.25, "seed": 2024, "het_loss": false}, "composite": 6.0089, "test_pos_folds": 7, "val_pos_folds": 6, "val_loss": 3e-05, "elapsed_sec": 53.4, "timestamp": "2026-04-19T20:00:13", "sharpe": 6.1089, "psr": 1.0, "equity": 10631.8, "sortino": 7.2256, "return_pct": 963.18, "max_dd": 9.63, "win_rate": 70.49, "profit_factor": 3.225, "ic": 0.5594, "hit": 70.2, "aleatoric_mean": 7e-06, "epistemic_mean": 1.4e-05, "confidence_mean": 1.0, "precision": 0.733, "recall": 0.6279, "f1": 0.6764, "f2": 0.6464, "mcc": 0.4091, "accuracy": 0.703, "per_window": [{"fold": "fold_1", "regime": "Pre-crisis upturn + GFC onset", "sharpe": 0.7717, "sortino": 0.8435, "return_pct": 5.35, "equity": 1053.51, "max_dd": 9.63, "win_rate": 53.92, "profit_factor": 1.2, "ic": -0.0313, "hit": 53.4, "n": 103, "precision": 0.5342, "recall": 0.7358, "f1": 0.619, "f2": 0.6842, "mcc": 0.0614, "accuracy": 0.534, "tp": 39, "fp": 34, "tn": 16, "fn": 14, "aleatoric_mean": 1.4e-05, "epistemic_mean": 2.8e-05, "confidence_mean": 1.0, "aleatoric_std": 9e-06, "epistemic_std": 1.8e-05}, {"fold": "fold_2", "regime": "Post-crash recovery", "sharpe": 1.379, "sortino": 2.4077, "return_pct": 6.53, "equity": 1065.28, "max_dd": 4.7, "win_rate": 54.21, "profit_factor": 1.241, "ic": 0.0601, "hit": 54.21, "n": 107, "precision": 0.5278, "recall": 0.3725, "f1": 0.4368, "f2": 0.3958, "mcc": 0.0729, "accuracy": 0.5421, "tp": 19, "fp": 17, "tn": 39, "fn": 32, "aleatoric_mean": 7e-06, "epistemic_mean": 1.4e-05, "confidence_mean": 1.0, "aleatoric_std": 3e-06, "epistemic_std": 6e-06}, {"fold": "fold_3", "regime": "Eurozone debt plateau", "sharpe": 7.5959, "sortino": 11.9255, "return_pct": 27.35, "equity": 1273.47, "max_dd": 3.54, "win_rate": 74.04, "profit_factor": 3.327, "ic": 0.5833, "hit": 72.64, "n": 106, "precision": 0.7, "recall": 0.8596, "f1": 0.7717, "f2": 0.8221, "mcc": 0.4538, "accuracy": 0.7264, "tp": 49, "fp": 21, "tn": 28, "fn": 8, "aleatoric_mean": 8e-06, "epistemic_mean": 1.6e-05, "confidence_mean": 1.0, "aleatoric_std": 3e-06, "epistemic_std": 7e-06}, {"fold": "fold_4", "regime": "Strong USD downturn", "sharpe": 12.4355, "sortino": 30.459, "return_pct": 113.24, "equity": 2132.42, "max_dd": 0.97, "win_rate": 83.23, "profit_factor": 10.245, "ic": 0.8385, "hit": 82.74, "n": 168, "precision": 0.9143, "recall": 0.7442, "f1": 0.8205, "f2": 0.7729, "mcc": 0.6803, "accuracy": 0.8333, "tp": 64, "fp": 6, "tn": 76, "fn": 22, "aleatoric_mean": 5e-06, "epistemic_mean": 1e-05, "confidence_mean": 1.0, "aleatoric_std": 2e-06, "epistemic_std": 4e-06}, {"fold": "fold_5", "regime": "Low-vol plateau", "sharpe": 9.4836, "sortino": 15.566, "return_pct": 31.06, "equity": 1310.64, "max_dd": 1.43, "win_rate": 74.07, "profit_factor": 5.194, "ic": 0.7376, "hit": 74.07, "n": 162, "precision": 0.8542, "recall": 0.5395, "f1": 0.6613, "f2": 0.5824, "mcc": 0.5006, "accuracy": 0.7407, "tp": 41, "fp": 7, "tn": 79, "fn": 35, "aleatoric_mean": 4e-06, "epistemic_mean": 9e-06, "confidence_mean": 1.0, "aleatoric_std": 2e-06, "epistemic_std": 3e-06}, {"fold": "fold_6", "regime": "EUR crisis downturn", "sharpe": 12.6738, "sortino": 36.4837, "return_pct": 86.04, "equity": 1860.43, "max_dd": 1.01, "win_rate": 75.76, "profit_factor": 9.01, "ic": 0.7892, "hit": 75.76, "n": 165, "precision": 0.8033, "recall": 0.6364, "f1": 0.7101, "f2": 0.664, "mcc": 0.5167, "accuracy": 0.7576, "tp": 49, "fp": 12, "tn": 76, "fn": 28, "aleatoric_mean": 7e-06, "epistemic_mean": 1.3e-05, "confidence_mean": 1.0, "aleatoric_std": 3e-06, "epistemic_std": 6e-06}, {"fold": "fold_7", "regime": "Recent mixed/upturn", "sharpe": 6.5474, "sortino": 11.8828, "return_pct": 43.07, "equity": 1430.69, "max_dd": 2.24, "win_rate": 67.28, "profit_factor": 3.092, "ic": 0.6583, "hit": 67.28, "n": 162, "precision": 0.7593, "recall": 0.5062, "f1": 0.6074, "f2": 0.5423, "mcc": 0.3666, "accuracy": 0.6728, "tp": 41, "fp": 13, "tn": 68, "fn": 40, "aleatoric_mean": 6e-06, "epistemic_mean": 1.2e-05, "confidence_mean": 1.0, "aleatoric_std": 2e-06, "epistemic_std": 4e-06}], "val_sharpe": 6.7079, "val_psr": 1.0, "val_equity": 4298.73, "val_sortino": 9.3195, "val_return_pct": 329.87, "val_max_dd": 8.56, "val_win_rate": 71.04, "val_profit_factor": 3.184, "val_ic": 0.5683, "val_hit": 70.57, "val_aleatoric_mean": 5e-06, "val_epistemic_mean": 1.1e-05, "val_confidence_mean": 1.0, "val_precision": 0.7647, "val_recall": 0.5699, "val_f1": 0.6531, "val_f2": 0.6005, "val_mcc": 0.4292, "val_accuracy": 0.7122, "val_per_window": [{"fold": "fold_1", "regime": "Pre-crisis upturn + GFC onset", "sharpe": 0.7518, "sortino": 1.2686, "return_pct": 1.84, "equity": 1018.39, "max_dd": 2.21, "win_rate": 49.07, "profit_factor": 1.133, "ic": 0.0617, "hit": 48.62, "n": 109, "precision": 0.5, "recall": 0.4909, "f1": 0.4954, "f2": 0.4927, "mcc": -0.0091, "accuracy": 0.4954, "tp": 27, "fp": 27, "tn": 27, "fn": 28, "aleatoric_mean": 5e-06, "epistemic_mean": 1e-05, "confidence_mean": 1.0, "aleatoric_std": 2e-06, "epistemic_std": 4e-06}, {"fold": "fold_2", "regime": "Post-crash recovery", "sharpe": -1.1974, "sortino": -1.8695, "return_pct": -5.89, "equity": 941.07, "max_dd": 7.06, "win_rate": 48.15, "profit_factor": 0.828, "ic": 0.0104, "hit": 48.15, "n": 108, "precision": 0.6061, "recall": 0.3175, "f1": 0.4167, "f2": 0.3509, "mcc": 0.0306, "accuracy": 0.4815, "tp": 20, "fp": 13, "tn": 32, "fn": 43, "aleatoric_mean": 9e-06, "epistemic_mean": 1.7e-05, "confidence_mean": 1.0, "aleatoric_std": 5e-06, "epistemic_std": 9e-06}, {"fold": "fold_3", "regime": "Eurozone debt plateau", "sharpe": 13.1057, "sortino": 29.4444, "return_pct": 50.23, "equity": 1502.28, "max_dd": 0.88, "win_rate": 85.32, "profit_factor": 10.097, "ic": 0.8055, "hit": 83.78, "n": 111, "precision": 0.8444, "recall": 0.8085, "f1": 0.8261, "f2": 0.8155, "mcc": 0.7036, "accuracy": 0.8559, "tp": 38, "fp": 7, "tn": 57, "fn": 9, "aleatoric_mean": 5e-06, "epistemic_mean": 1e-05, "confidence_mean": 1.0, "aleatoric_std": 2e-06, "epistemic_std": 4e-06}, {"fold": "fold_4", "regime": "Strong USD downturn", "sharpe": 12.2641, "sortino": 33.172, "return_pct": 39.93, "equity": 1399.29, "max_dd": 0.76, "win_rate": 80.73, "profit_factor": 9.127, "ic": 0.7731, "hit": 80.0, "n": 110, "precision": 0.9062, "recall": 0.617, "f1": 0.7342, "f2": 0.6591, "mcc": 0.6202, "accuracy": 0.8091, "tp": 29, "fp": 3, "tn": 60, "fn": 18, "aleatoric_mean": 5e-06, "epistemic_mean": 1e-05, "confidence_mean": 1.0, "aleatoric_std": 2e-06, "epistemic_std": 4e-06}, {"fold": "fold_5", "regime": "Low-vol plateau", "sharpe": 12.7286, "sortino": 38.3866, "return_pct": 39.13, "equity": 1391.33, "max_dd": 0.62, "win_rate": 81.25, "profit_factor": 10.424, "ic": 0.8227, "hit": 81.25, "n": 112, "precision": 0.9, "recall": 0.6792, "f1": 0.7742, "f2": 0.7143, "mcc": 0.6371, "accuracy": 0.8125, "tp": 36, "fp": 4, "tn": 55, "fn": 17, "aleatoric_mean": 4e-06, "epistemic_mean": 9e-06, "confidence_mean": 1.0, "aleatoric_std": 1e-06, "epistemic_std": 2e-06}, {"fold": "fold_6", "regime": "EUR crisis downturn", "sharpe": 12.6855, "sortino": 54.2335, "return_pct": 25.4, "equity": 1254.04, "max_dd": 0.25, "win_rate": 78.5, "profit_factor": 11.021, "ic": 0.8485, "hit": 77.78, "n": 108, "precision": 0.8333, "recall": 0.6383, "f1": 0.7229, "f2": 0.6696, "mcc": 0.5679, "accuracy": 0.787, "tp": 30, "fp": 6, "tn": 55, "fn": 17, "aleatoric_mean": 4e-06, "epistemic_mean": 9e-06, "confidence_mean": 1.0, "aleatoric_std": 1e-06, "epistemic_std": 3e-06}, {"fold": "fold_7", "regime": "Recent mixed/upturn", "sharpe": 9.9207, "sortino": 22.5394, "return_pct": 22.29, "equity": 1222.93, "max_dd": 0.63, "win_rate": 73.64, "profit_factor": 5.173, "ic": 0.7768, "hit": 73.64, "n": 110, "precision": 0.875, "recall": 0.5283, "f1": 0.6588, "f2": 0.5738, "mcc": 0.504, "accuracy": 0.7364, "tp": 28, "fp": 4, "tn": 53, "fn": 25, "aleatoric_mean": 5e-06, "epistemic_mean": 1.1e-05, "confidence_mean": 1.0, "aleatoric_std": 2e-06, "epistemic_std": 4e-06}], "train_sharpe": 6.81, "train_psr": 1.0, "train_equity": 2012637.62, "train_sortino": 17.8471, "train_return_pct": 201163.76, "train_max_dd": 9.19, "train_win_rate": 73.58, "train_profit_factor": 5.322, "train_ic": 0.7169, "train_hit": 73.28, "train_precision": 0.8324, "train_recall": 0.6083, "train_f1": 0.7029, "train_f2": 0.6429, "train_mcc": 0.4941, "train_accuracy": 0.7357, "train_per_window": [{"fold": "all_train", "regime": "Training data", "sharpe": 6.81, "sortino": 17.8471, "return_pct": 201163.76, "equity": 2012637.62, "max_dd": 9.19, "win_rate": 73.58, "profit_factor": 5.322, "ic": 0.7169, "hit": 73.28, "n": 2478, "precision": 0.8324, "recall": 0.6083, "f1": 0.7029, "f2": 0.6429, "mcc": 0.4941, "accuracy": 0.7357, "tp": 775, "fp": 156, "tn": 1048, "fn": 499}], "experiment_num": 149, "status": "DISCARD"}
{"backbone": "lstm", "description": "lstm: Exp45 champion seed=13 variance (mechanical)", "config": {"seq_len": 10, "lr": 0.001, "batch_size": 16, "epochs": 100, "weight_decay": 0.0007, "patience": 15, "grad_clip": 1.0, "warmup_epochs": 0, "huber_delta": 1.0, "head_dropout": 0.25, "seed": 13, "het_loss": false}, "composite": 3.8424, "test_pos_folds": 6, "val_pos_folds": 6, "val_loss": 2.9e-05, "elapsed_sec": 42.1, "timestamp": "2026-04-19T20:43:07", "sharpe": 4.7593, "psr": 1.0, "equity": 6590.44, "sortino": 5.8736, "return_pct": 559.04, "max_dd": 8.7, "win_rate": 66.05, "profit_factor": 2.455, "ic": 0.4769, "hit": 65.78, "aleatoric_mean": 1.5e-05, "epistemic_mean": 3e-05, "confidence_mean": 1.0, "precision": 0.736, "recall": 0.4927, "f1": 0.5903, "f2": 0.5276, "mcc": 0.34, "accuracy": 0.6619, "per_window": [{"fold": "fold_1", "regime": "Pre-crisis upturn + GFC onset", "sharpe": 0.0337, "sortino": 0.0386, "return_pct": -0.47, "equity": 995.28, "max_dd": 8.7, "win_rate": 49.02, "profit_factor": 1.008, "ic": 0.1258, "hit": 48.54, "n": 103, "precision": 0.52, "recall": 0.2453, "f1": 0.3333, "f2": 0.2743, "mcc": 0.0062, "accuracy": 0.4951, "tp": 13, "fp": 12, "tn": 38, "fn": 40, "aleatoric_mean": 2e-05, "epistemic_mean": 4.1e-05, "confidence_mean": 0.9999, "aleatoric_std": 1e-05, "epistemic_std": 2e-05}, {"fold": "fold_2", "regime": "Post-crash recovery", "sharpe": -0.5656, "sortino": -0.9484, "return_pct": -2.94, "equity": 970.59, "max_dd": 7.12, "win_rate": 50.47, "profit_factor": 0.915, "ic": -0.0064, "hit": 50.47, "n": 107, "precision": 0.4773, "recall": 0.4118, "f1": 0.4421, "f2": 0.4234, "mcc": 0.0011, "accuracy": 0.5047, "tp": 21, "fp": 23, "tn": 33, "fn": 30, "aleatoric_mean": 1.5e-05, "epistemic_mean": 3.1e-05, "confidence_mean": 1.0, "aleatoric_std": 7e-06, "epistemic_std": 1.3e-05}, {"fold": "fold_3", "regime": "Eurozone debt plateau", "sharpe": 6.4984, "sortino": 12.9535, "return_pct": 23.61, "equity": 1236.15, "max_dd": 2.51, "win_rate": 64.42, "profit_factor": 2.788, "ic": 0.4875, "hit": 63.21, "n": 106, "precision": 0.7632, "recall": 0.5088, "f1": 0.6105, "f2": 0.5451, "mcc": 0.338, "accuracy": 0.6509, "tp": 29, "fp": 9, "tn": 40, "fn": 28, "aleatoric_mean": 2e-05, "epistemic_mean": 3.9e-05, "confidence_mean": 0.9999, "aleatoric_std": 8e-06, "epistemic_std": 1.6e-05}, {"fold": "fold_4", "regime": "Strong USD downturn", "sharpe": 8.59, "sortino": 14.0342, "return_pct": 79.21, "equity": 1792.06, "max_dd": 4.83, "win_rate": 77.25, "profit_factor": 4.472, "ic": 0.71, "hit": 76.79, "n": 168, "precision": 0.9, "recall": 0.6279, "f1": 0.7397, "f2": 0.6683, "mcc": 0.5787, "accuracy": 0.7738, "tp": 54, "fp": 6, "tn": 76, "fn": 32, "aleatoric_mean": 1.3e-05, "epistemic_mean": 2.6e-05, "confidence_mean": 1.0, "aleatoric_std": 5e-06, "epistemic_std": 1e-05}, {"fold": "fold_5", "regime": "Low-vol plateau", "sharpe": 7.8286, "sortino": 15.1451, "return_pct": 26.26, "equity": 1262.61, "max_dd": 1.43, "win_rate": 67.9, "profit_factor": 3.807, "ic": 0.5606, "hit": 67.9, "n": 162, "precision": 0.74, "recall": 0.4868, "f1": 0.5873, "f2": 0.5226, "mcc": 0.3626, "accuracy": 0.679, "tp": 37, "fp": 13, "tn": 73, "fn": 39, "aleatoric_mean": 1.1e-05, "epistemic_mean": 2.2e-05, "confidence_mean": 1.0, "aleatoric_std": 4e-06, "epistemic_std": 8e-06}, {"fold": "fold_6", "regime": "EUR crisis downturn", "sharpe": 8.622, "sortino": 17.4163, "return_pct": 60.67, "equity": 1606.71, "max_dd": 2.3, "win_rate": 66.06, "profit_factor": 4.156, "ic": 0.6695, "hit": 66.06, "n": 165, "precision": 0.7838, "recall": 0.3766, "f1": 0.5088, "f2": 0.4203, "mcc": 0.3418, "accuracy": 0.6606, "tp": 29, "fp": 8, "tn": 80, "fn": 48, "aleatoric_mean": 1.3e-05, "epistemic_mean": 2.6e-05, "confidence_mean": 1.0, "aleatoric_std": 5e-06, "epistemic_std": 1e-05}, {"fold": "fold_7", "regime": "Recent mixed/upturn", "sharpe": 7.8649, "sortino": 12.8533, "return_pct": 51.81, "equity": 1518.11, "max_dd": 1.64, "win_rate": 74.69, "profit_factor": 3.941, "ic": 0.6362, "hit": 74.69, "n": 162, "precision": 0.7941, "recall": 0.6667, "f1": 0.7248, "f2": 0.6888, "mcc": 0.5003, "accuracy": 0.7469, "tp": 54, "fp": 14, "tn": 67, "fn": 27, "aleatoric_mean": 1.6e-05, "epistemic_mean": 3.2e-05, "confidence_mean": 1.0, "aleatoric_std": 6e-06, "epistemic_std": 1.2e-05}], "val_sharpe": 4.0424, "val_psr": 1.0, "val_equity": 2512.26, "val_sortino": 6.1745, "val_return_pct": 151.23, "val_max_dd": 13.98, "val_win_rate": 63.17, "val_profit_factor": 1.989, "val_ic": 0.4247, "val_hit": 62.76, "val_aleatoric_mean": 1.3e-05, "val_epistemic_mean": 2.5e-05, "val_confidence_mean": 1.0, "val_precision": 0.6842, "val_recall": 0.4274, "val_f1": 0.5261, "val_f2": 0.4621, "val_mcc": 0.2719, "val_accuracy": 0.6341, "val_per_window": [{"fold": "fold_1", "regime": "Pre-crisis upturn + GFC onset", "sharpe": 1.7122, "sortino": 2.6659, "return_pct": 4.32, "equity": 1043.15, "max_dd": 2.67, "win_rate": 54.63, "profit_factor": 1.329, "ic": 0.0365, "hit": 54.13, "n": 109, "precision": 0.56, "recall": 0.5091, "f1": 0.5333, "f2": 0.5185, "mcc": 0.102, "accuracy": 0.5505, "tp": 28, "fp": 22, "tn": 32, "fn": 27, "aleatoric_mean": 1.2e-05, "epistemic_mean": 2.4e-05, "confidence_mean": 1.0, "aleatoric_std": 5e-06, "epistemic_std": 9e-06}, {"fold": "fold_2", "regime": "Post-crash recovery", "sharpe": -1.9668, "sortino": -3.1132, "return_pct": -9.29, "equity": 907.07, "max_dd": 13.98, "win_rate": 45.37, "profit_factor": 0.733, "ic": -0.0005, "hit": 45.37, "n": 108, "precision": 0.5625, "recall": 0.2857, "f1": 0.3789, "f2": 0.3169, "mcc": -0.0274, "accuracy": 0.4537, "tp": 18, "fp": 14, "tn": 31, "fn": 45, "aleatoric_mean": 1.6e-05, "epistemic_mean": 3.2e-05, "confidence_mean": 1.0, "aleatoric_std": 6e-06, "epistemic_std": 1.3e-05}, {"fold": "fold_3", "regime": "Eurozone debt plateau", "sharpe": 7.2645, "sortino": 14.0056, "return_pct": 30.39, "equity": 1303.91, "max_dd": 2.74, "win_rate": 74.31, "profit_factor": 3.309, "ic": 0.7128, "hit": 72.97, "n": 111, "precision": 0.88, "recall": 0.4681, "f1": 0.6111, "f2": 0.5164, "mcc": 0.4982, "accuracy": 0.7477, "tp": 22, "fp": 3, "tn": 61, "fn": 25, "aleatoric_mean": 1.2e-05, "epistemic_mean": 2.4e-05, "confidence_mean": 1.0, "aleatoric_std": 4e-06, "epistemic_std": 8e-06}, {"fold": "fold_4", "regime": "Strong USD downturn", "sharpe": 7.0143, "sortino": 17.7032, "return_pct": 24.81, "equity": 1248.11, "max_dd": 1.42, "win_rate": 65.14, "profit_factor": 3.26, "ic": 0.5345, "hit": 64.55, "n": 110, "precision": 0.6452, "recall": 0.4255, "f1": 0.5128, "f2": 0.4566, "mcc": 0.2759, "accuracy": 0.6545, "tp": 20, "fp": 11, "tn": 52, "fn": 27, "aleatoric_mean": 1.3e-05, "epistemic_mean": 2.6e-05, "confidence_mean": 1.0, "aleatoric_std": 4e-06, "epistemic_std": 9e-06}, {"fold": "fold_5", "regime": "Low-vol plateau", "sharpe": 6.0123, "sortino": 14.0306, "return_pct": 20.5, "equity": 1204.96, "max_dd": 1.88, "win_rate": 65.18, "profit_factor": 2.753, "ic": 0.7378, "hit": 65.18, "n": 112, "precision": 0.9375, "recall": 0.283, "f1": 0.4348, "f2": 0.3289, "mcc": 0.3796, "accuracy": 0.6518, "tp": 15, "fp": 1, "tn": 58, "fn": 38, "aleatoric_mean": 1e-05, "epistemic_mean": 2e-05, "confidence_mean": 1.0, "aleatoric_std": 4e-06, "epistemic_std": 7e-06}, {"fold": "fold_6", "regime": "EUR crisis downturn", "sharpe": 6.4615, "sortino": 12.685, "return_pct": 14.62, "equity": 1146.21, "max_dd": 1.05, "win_rate": 65.42, "profit_factor": 3.028, "ic": 0.608, "hit": 64.81, "n": 108, "precision": 0.75, "recall": 0.3191, "f1": 0.4478, "f2": 0.3606, "mcc": 0.3027, "accuracy": 0.6574, "tp": 15, "fp": 5, "tn": 56, "fn": 32, "aleatoric_mean": 1.1e-05, "epistemic_mean": 2.2e-05, "confidence_mean": 1.0, "aleatoric_std": 3e-06, "epistemic_std": 7e-06}, {"fold": "fold_7", "regime": "Recent mixed/upturn", "sharpe": 7.7543, "sortino": 15.111, "return_pct": 18.12, "equity": 1181.24, "max_dd": 0.96, "win_rate": 71.82, "profit_factor": 3.544, "ic": 0.5556, "hit": 71.82, "n": 110, "precision": 0.7037, "recall": 0.717, "f1": 0.7103, "f2": 0.7143, "mcc": 0.4361, "accuracy": 0.7182, "tp": 38, "fp": 16, "tn": 41, "fn": 15, "aleatoric_mean": 1.4e-05, "epistemic_mean": 2.8e-05, "confidence_mean": 1.0, "aleatoric_std": 6e-06, "epistemic_std": 1.2e-05}], "train_sharpe": 5.4241, "train_psr": 1.0, "train_equity": 505593.12, "train_sortino": 13.2804, "train_return_pct": 50459.31, "train_max_dd": 4.19, "train_win_rate": 67.91, "train_profit_factor": 3.552, "train_ic": 0.5981, "train_hit": 67.64, "train_precision": 0.8109, "train_recall": 0.4914, "train_f1": 0.6119, "train_f2": 0.5334, "train_mcc": 0.3994, "train_accuracy": 0.6796, "train_per_window": [{"fold": "all_train", "regime": "Training data", "sharpe": 5.4241, "sortino": 13.2804, "return_pct": 50459.31, "equity": 505593.12, "max_dd": 4.19, "win_rate": 67.91, "profit_factor": 3.552, "ic": 0.5981, "hit": 67.64, "n": 2478, "precision": 0.8109, "recall": 0.4914, "f1": 0.6119, "f2": 0.5334, "mcc": 0.3994, "accuracy": 0.6796, "tp": 626, "fp": 146, "tn": 1058, "fn": 648}], "experiment_num": 150, "status": "DISCARD"}
