{"backbone": "itransformer", "description": "itransformer: Exp2 seq=60 (GBM-winning)", "config": {"seq_len": 60, "lr": 5e-05, "batch_size": 32, "epochs": 100, "weight_decay": 0.0, "patience": 20, "grad_clip": 1.0, "warmup_epochs": 10, "huber_delta": 1.0, "head_dropout": 0.1, "seed": 42, "het_loss": false}, "composite": -0.5342, "test_pos_folds": 4, "val_pos_folds": 3, "val_loss": 3.7e-05, "elapsed_sec": 77.5, "timestamp": "2026-04-21T12:46:26", "sharpe": 0.1658, "psr": 0.6027, "equity": 1028.08, "sortino": 0.2442, "return_pct": 2.81, "max_dd": 14.9, "win_rate": 50.89, "profit_factor": 1.028, "ic": 0.0154, "hit": 50.56, "aleatoric_mean": 0.000185, "epistemic_mean": 0.000369, "confidence_mean": 0.9994, "precision": 0.5048, "recall": 0.5065, "f1": 0.5056, "f2": 0.5061, "mcc": 0.0144, "accuracy": 0.5072, "per_window": [{"fold": "fold_1", "regime": "Pre-crisis upturn + GFC onset", "sharpe": -3.0467, "sortino": -5.2915, "return_pct": -6.23, "equity": 937.66, "max_dd": 6.43, "win_rate": 36.54, "profit_factor": 0.627, "ic": -0.1312, "hit": 35.85, "n": 53, "precision": 0.3793, "recall": 0.4231, "f1": 0.4, "f2": 0.4135, "mcc": -0.2446, "accuracy": 0.3774, "tp": 11, "fp": 18, "tn": 9, "fn": 15, "aleatoric_mean": 0.000828, "epistemic_mean": 0.001656, "confidence_mean": 0.9975, "aleatoric_std": 0.000563, "epistemic_std": 0.001126}, {"fold": "fold_2", "regime": "Post-crash recovery", "sharpe": -1.0299, "sortino": -1.6342, "return_pct": -3.07, "equity": 969.29, "max_dd": 8.45, "win_rate": 50.88, "profit_factor": 0.848, "ic": -0.0496, "hit": 50.88, "n": 57, "precision": 0.5385, "recall": 0.6774, "f1": 0.6, "f2": 0.6442, "mcc": -0.016, "accuracy": 0.5088, "tp": 21, "fp": 18, "tn": 8, "fn": 10, "aleatoric_mean": 0.000123, "epistemic_mean": 0.000247, "confidence_mean": 0.9996, "aleatoric_std": 4.8e-05, "epistemic_std": 9.6e-05}, {"fold": "fold_3", "regime": "Eurozone debt plateau", "sharpe": 0.7776, "sortino": 1.2295, "return_pct": 1.32, "equity": 1013.16, "max_dd": 1.86, "win_rate": 51.85, "profit_factor": 1.132, "ic": 0.0504, "hit": 50.0, "n": 56, "precision": 0.5667, "recall": 0.5312, "f1": 0.5484, "f2": 0.538, "mcc": -0.0103, "accuracy": 0.5, "tp": 17, "fp": 13, "tn": 11, "fn": 15, "aleatoric_mean": 0.000126, "epistemic_mean": 0.000252, "confidence_mean": 0.9996, "aleatoric_std": 4e-05, "epistemic_std": 8e-05}, {"fold": "fold_4", "regime": "Strong USD downturn", "sharpe": -1.0594, "sortino": -1.3842, "return_pct": -5.47, "equity": 945.32, "max_dd": 7.16, "win_rate": 46.15, "profit_factor": 0.837, "ic": -0.0242, "hit": 45.76, "n": 118, "precision": 0.4615, "recall": 0.4, "f1": 0.4286, "f2": 0.411, "mcc": -0.0833, "accuracy": 0.4576, "tp": 24, "fp": 28, "tn": 30, "fn": 36, "aleatoric_mean": 0.000126, "epistemic_mean": 0.000251, "confidence_mean": 0.9996, "aleatoric_std": 3.7e-05, "epistemic_std": 7.4e-05}, {"fold": "fold_5", "regime": "Low-vol plateau", "sharpe": 0.3802, "sortino": 0.5921, "return_pct": 0.8, "equity": 1008.03, "max_dd": 2.86, "win_rate": 51.79, "profit_factor": 1.065, "ic": -0.0045, "hit": 51.79, "n": 112, "precision": 0.4746, "recall": 0.549, "f1": 0.5091, "f2": 0.5323, "mcc": 0.0407, "accuracy": 0.5179, "tp": 28, "fp": 31, "tn": 30, "fn": 23, "aleatoric_mean": 0.000115, "epistemic_mean": 0.00023, "confidence_mean": 0.9997, "aleatoric_std": 4.3e-05, "epistemic_std": 8.5e-05}, {"fold": "fold_6", "regime": "EUR crisis downturn", "sharpe": 0.8532, "sortino": 1.5125, "return_pct": 3.68, "equity": 1036.83, "max_dd": 5.6, "win_rate": 47.83, "profit_factor": 1.144, "ic": 0.0783, "hit": 47.83, "n": 115, "precision": 0.4255, "recall": 0.3774, "f1": 0.4, "f2": 0.3861, "mcc": -0.0589, "accuracy": 0.4783, "tp": 20, "fp": 27, "tn": 35, "fn": 33, "aleatoric_mean": 0.000136, "epistemic_mean": 0.000271, "confidence_mean": 0.9996, "aleatoric_std": 4.2e-05, "epistemic_std": 8.4e-05}, {"fold": "fold_7", "regime": "Recent mixed/upturn", "sharpe": 3.0568, "sortino": 5.1509, "return_pct": 13.0, "equity": 1130.03, "max_dd": 4.01, "win_rate": 64.29, "profit_factor": 1.692, "ic": 0.2129, "hit": 64.29, "n": 112, "precision": 0.6545, "recall": 0.6316, "f1": 0.6429, "f2": 0.636, "mcc": 0.2861, "accuracy": 0.6429, "tp": 36, "fp": 19, "tn": 36, "fn": 21, "aleatoric_mean": 0.000122, "epistemic_mean": 0.000245, "confidence_mean": 0.9996, "aleatoric_std": 4.3e-05, "epistemic_std": 8.6e-05}], "val_sharpe": 0.2397, "val_psr": 0.6212, "val_equity": 1025.61, "val_sortino": 0.3745, "val_return_pct": 2.56, "val_max_dd": 10.44, "val_win_rate": 53.37, "val_profit_factor": 1.041, "val_ic": 0.0225, "val_hit": 53.11, "val_aleatoric_mean": 0.000122, "val_epistemic_mean": 0.000244, "val_confidence_mean": 0.9996, "val_precision": 0.5263, "val_recall": 0.534, "val_f1": 0.5301, "val_f2": 0.5324, "val_mcc": 0.067, "val_accuracy": 0.5335, "val_per_window": [{"fold": "fold_1", "regime": "Pre-crisis upturn + GFC onset", "sharpe": -5.0548, "sortino": -6.8611, "return_pct": -7.4, "equity": 925.97, "max_dd": 7.91, "win_rate": 39.66, "profit_factor": 0.432, "ic": -0.1436, "hit": 38.98, "n": 59, "precision": 0.4138, "recall": 0.3871, "f1": 0.4, "f2": 0.3922, "mcc": -0.2198, "accuracy": 0.3898, "tp": 12, "fp": 17, "tn": 11, "fn": 19, "aleatoric_mean": 9.7e-05, "epistemic_mean": 0.000194, "confidence_mean": 0.9997, "aleatoric_std": 2.8e-05, "epistemic_std": 5.6e-05}, {"fold": "fold_2", "regime": "Post-crash recovery", "sharpe": -1.1493, "sortino": -1.739, "return_pct": -2.31, "equity": 976.94, "max_dd": 5.12, "win_rate": 50.0, "profit_factor": 0.83, "ic": -0.0313, "hit": 50.0, "n": 58, "precision": 0.5357, "recall": 0.4839, "f1": 0.5085, "f2": 0.4934, "mcc": 0.0024, "accuracy": 0.5, "tp": 15, "fp": 13, "tn": 14, "fn": 16, "aleatoric_mean": 0.000154, "epistemic_mean": 0.000309, "confidence_mean": 0.9995, "aleatoric_std": 5.4e-05, "epistemic_std": 0.000108}, {"fold": "fold_3", "regime": "Eurozone debt plateau", "sharpe": 1.942, "sortino": 3.2301, "return_pct": 4.54, "equity": 1045.41, "max_dd": 4.72, "win_rate": 54.1, "profit_factor": 1.383, "ic": 0.0175, "hit": 54.1, "n": 61, "precision": 0.4828, "recall": 0.5185, "f1": 0.5, "f2": 0.5109, "mcc": 0.0769, "accuracy": 0.541, "tp": 14, "fp": 15, "tn": 19, "fn": 13, "aleatoric_mean": 0.000131, "epistemic_mean": 0.000263, "confidence_mean": 0.9996, "aleatoric_std": 4.7e-05, "epistemic_std": 9.4e-05}, {"fold": "fold_4", "regime": "Strong USD downturn", "sharpe": -0.2569, "sortino": -0.4761, "return_pct": -0.66, "equity": 993.39, "max_dd": 4.84, "win_rate": 48.33, "profit_factor": 0.961, "ic": -0.0665, "hit": 48.33, "n": 60, "precision": 0.4688, "recall": 0.5172, "f1": 0.4918, "f2": 0.5068, "mcc": -0.0312, "accuracy": 0.4833, "tp": 15, "fp": 17, "tn": 14, "fn": 14, "aleatoric_mean": 0.000129, "epistemic_mean": 0.000258, "confidence_mean": 0.9996, "aleatoric_std": 4.1e-05, "epistemic_std": 8.2e-05}, {"fold": "fold_5", "regime": "Low-vol plateau", "sharpe": 3.001, "sortino": 5.1743, "return_pct": 5.19, "equity": 1051.91, "max_dd": 1.49, "win_rate": 59.68, "profit_factor": 1.628, "ic": 0.2387, "hit": 59.68, "n": 62, "precision": 0.6, "recall": 0.6562, "f1": 0.6269, "f2": 0.6442, "mcc": 0.1911, "accuracy": 0.5968, "tp": 21, "fp": 14, "tn": 16, "fn": 11, "aleatoric_mean": 0.000111, "epistemic_mean": 0.000222, "confidence_mean": 0.9997, "aleatoric_std": 4.1e-05, "epistemic_std": 8.2e-05}, {"fold": "fold_6", "regime": "EUR crisis downturn", "sharpe": 4.1711, "sortino": 6.5259, "return_pct": 4.28, "equity": 1042.75, "max_dd": 0.73, "win_rate": 68.42, "profit_factor": 1.987, "ic": 0.2966, "hit": 67.24, "n": 58, "precision": 0.6071, "recall": 0.7083, "f1": 0.6538, "f2": 0.6855, "mcc": 0.3793, "accuracy": 0.6897, "tp": 17, "fp": 11, "tn": 23, "fn": 7, "aleatoric_mean": 0.000123, "epistemic_mean": 0.000246, "confidence_mean": 0.9996, "aleatoric_std": 4.4e-05, "epistemic_std": 8.8e-05}, {"fold": "fold_7", "regime": "Recent mixed/upturn", "sharpe": -0.3418, "sortino": -0.5918, "return_pct": -0.47, "equity": 995.3, "max_dd": 2.88, "win_rate": 53.33, "profit_factor": 0.946, "ic": -0.0307, "hit": 53.33, "n": 60, "precision": 0.5714, "recall": 0.5, "f1": 0.5333, "f2": 0.5128, "mcc": 0.0714, "accuracy": 0.5333, "tp": 16, "fp": 12, "tn": 16, "fn": 16, "aleatoric_mean": 0.000109, "epistemic_mean": 0.000218, "confidence_mean": 0.9997, "aleatoric_std": 3.3e-05, "epistemic_std": 6.7e-05}], "train_sharpe": 1.2711, "train_psr": 1.0, "train_equity": 2364.25, "train_sortino": 2.9494, "train_return_pct": 136.43, "train_max_dd": 13.98, "train_win_rate": 52.87, "train_profit_factor": 1.341, "train_ic": 0.1243, "train_hit": 52.6, "train_precision": 0.5433, "train_recall": 0.569, "train_f1": 0.5559, "train_f2": 0.5637, "train_mcc": 0.0534, "train_accuracy": 0.5282, "train_per_window": [{"fold": "all_train", "regime": "Training data", "sharpe": 1.2711, "sortino": 2.9494, "return_pct": 136.43, "equity": 2364.25, "max_dd": 13.98, "win_rate": 52.87, "profit_factor": 1.341, "ic": 0.1243, "hit": 52.6, "n": 1382, "precision": 0.5433, "recall": 0.569, "f1": 0.5559, "f2": 0.5637, "mcc": 0.0534, "accuracy": 0.5282, "tp": 408, "fp": 343, "tn": 322, "fn": 309}], "experiment_num": 253, "status": "DISCARD"}
{"backbone": "itransformer", "description": "itransformer: Exp3 lr=1e-4", "config": {"seq_len": 60, "lr": 0.0001, "batch_size": 32, "epochs": 100, "weight_decay": 0.0, "patience": 20, "grad_clip": 1.0, "warmup_epochs": 10, "huber_delta": 1.0, "head_dropout": 0.1, "seed": 42, "het_loss": false}, "composite": -0.3925, "test_pos_folds": 4, "val_pos_folds": 4, "val_loss": 3.3e-05, "elapsed_sec": 77.8, "timestamp": "2026-04-21T12:47:54", "sharpe": 0.7441, "psr": 0.8778, "equity": 1176.53, "sortino": 1.0859, "return_pct": 17.65, "max_dd": 11.82, "win_rate": 53.63, "profit_factor": 1.133, "ic": 0.0364, "hit": 53.29, "aleatoric_mean": 0.000111, "epistemic_mean": 0.000221, "confidence_mean": 0.9997, "precision": 0.5344, "recall": 0.5516, "f1": 0.5429, "f2": 0.5481, "mcc": 0.0756, "accuracy": 0.5377, "per_window": [{"fold": "fold_1", "regime": "Pre-crisis upturn + GFC onset", "sharpe": -0.1168, "sortino": -0.2067, "return_pct": -0.35, "equity": 996.47, "max_dd": 2.48, "win_rate": 46.15, "profit_factor": 0.982, "ic": -0.1025, "hit": 45.28, "n": 53, "precision": 0.4688, "recall": 0.5769, "f1": 0.5172, "f2": 0.5515, "mcc": -0.0539, "accuracy": 0.4717, "tp": 15, "fp": 17, "tn": 10, "fn": 11, "aleatoric_mean": 0.000703, "epistemic_mean": 0.001406, "confidence_mean": 0.9979, "aleatoric_std": 0.000549, "epistemic_std": 0.001097}, {"fold": "fold_2", "regime": "Post-crash recovery", "sharpe": -0.0682, "sortino": -0.1081, "return_pct": -0.38, "equity": 996.25, "max_dd": 8.47, "win_rate": 52.63, "profit_factor": 0.989, "ic": -0.0505, "hit": 52.63, "n": 57, "precision": 0.55, "recall": 0.7097, "f1": 0.6197, "f2": 0.6707, "mcc": 0.0189, "accuracy": 0.5263, "tp": 22, "fp": 18, "tn": 8, "fn": 9, "aleatoric_mean": 5.3e-05, "epistemic_mean": 0.000106, "confidence_mean": 0.9998, "aleatoric_std": 2.2e-05, "epistemic_std": 4.4e-05}, {"fold": "fold_3", "regime": "Eurozone debt plateau", "sharpe": 0.873, "sortino": 1.3431, "return_pct": 1.49, "equity": 1014.87, "max_dd": 1.84, "win_rate": 51.85, "profit_factor": 1.149, "ic": 0.1072, "hit": 50.0, "n": 56, "precision": 0.5862, "recall": 0.5312, "f1": 0.5574, "f2": 0.5414, "mcc": 0.0309, "accuracy": 0.5179, "tp": 17, "fp": 12, "tn": 12, "fn": 15, "aleatoric_mean": 5.9e-05, "epistemic_mean": 0.000118, "confidence_mean": 0.9998, "aleatoric_std": 2e-05, "epistemic_std": 3.9e-05}, {"fold": "fold_4", "regime": "Strong USD downturn", "sharpe": -1.0568, "sortino": -1.3569, "return_pct": -5.46, "equity": 945.44, "max_dd": 7.3, "win_rate": 49.57, "profit_factor": 0.838, "ic": -0.0525, "hit": 49.15, "n": 118, "precision": 0.5088, "recall": 0.4833, "f1": 0.4957, "f2": 0.4882, "mcc": 0.0006, "accuracy": 0.5, "tp": 29, "fp": 28, "tn": 30, "fn": 31, "aleatoric_mean": 5.5e-05, "epistemic_mean": 0.000111, "confidence_mean": 0.9998, "aleatoric_std": 1.6e-05, "epistemic_std": 3.2e-05}, {"fold": "fold_5", "regime": "Low-vol plateau", "sharpe": 1.7296, "sortino": 2.7523, "return_pct": 3.89, "equity": 1038.91, "max_dd": 2.19, "win_rate": 56.25, "profit_factor": 1.334, "ic": 0.0923, "hit": 56.25, "n": 112, "precision": 0.5161, "recall": 0.6275, "f1": 0.5664, "f2": 0.6015, "mcc": 0.1359, "accuracy": 0.5625, "tp": 32, "fp": 30, "tn": 31, "fn": 19, "aleatoric_mean": 5.1e-05, "epistemic_mean": 0.000102, "confidence_mean": 0.9998, "aleatoric_std": 1.8e-05, "epistemic_std": 3.5e-05}, {"fold": "fold_6", "regime": "EUR crisis downturn", "sharpe": 1.5442, "sortino": 2.7396, "return_pct": 6.93, "equity": 1069.33, "max_dd": 2.99, "win_rate": 52.17, "profit_factor": 1.277, "ic": 0.0989, "hit": 52.17, "n": 115, "precision": 0.4783, "recall": 0.4151, "f1": 0.4444, "f2": 0.4264, "mcc": 0.0285, "accuracy": 0.5217, "tp": 22, "fp": 24, "tn": 38, "fn": 31, "aleatoric_mean": 6.2e-05, "epistemic_mean": 0.000125, "confidence_mean": 0.9998, "aleatoric_std": 1.9e-05, "epistemic_std": 3.8e-05}, {"fold": "fold_7", "regime": "Recent mixed/upturn", "sharpe": 2.645, "sortino": 4.4734, "return_pct": 11.18, "equity": 1111.83, "max_dd": 3.72, "win_rate": 61.61, "profit_factor": 1.576, "ic": 0.2226, "hit": 61.61, "n": 112, "precision": 0.6296, "recall": 0.5965, "f1": 0.6126, "f2": 0.6028, "mcc": 0.233, "accuracy": 0.6161, "tp": 34, "fp": 20, "tn": 35, "fn": 23, "aleatoric_mean": 5.3e-05, "epistemic_mean": 0.000107, "confidence_mean": 0.9998, "aleatoric_std": 1.9e-05, "epistemic_std": 3.8e-05}], "val_sharpe": 0.2075, "val_psr": 0.6052, "val_equity": 1021.48, "val_sortino": 0.3059, "val_return_pct": 2.15, "val_max_dd": 7.24, "val_win_rate": 53.85, "val_profit_factor": 1.035, "val_ic": 0.033, "val_hit": 53.59, "val_aleatoric_mean": 5.3e-05, "val_epistemic_mean": 0.000106, "val_confidence_mean": 0.9998, "val_precision": 0.5294, "val_recall": 0.568, "val_f1": 0.548, "val_f2": 0.5598, "val_mcc": 0.0775, "val_accuracy": 0.5383, "val_per_window": [{"fold": "fold_1", "regime": "Pre-crisis upturn + GFC onset", "sharpe": -3.0629, "sortino": -4.2655, "return_pct": -4.71, "equity": 952.92, "max_dd": 5.23, "win_rate": 44.83, "profit_factor": 0.603, "ic": -0.1812, "hit": 44.07, "n": 59, "precision": 0.4667, "recall": 0.4516, "f1": 0.459, "f2": 0.4545, "mcc": -0.1197, "accuracy": 0.4407, "tp": 14, "fp": 16, "tn": 12, "fn": 17, "aleatoric_mean": 4e-05, "epistemic_mean": 7.9e-05, "confidence_mean": 0.9999, "aleatoric_std": 1.3e-05, "epistemic_std": 2.7e-05}, {"fold": "fold_2", "regime": "Post-crash recovery", "sharpe": -0.7382, "sortino": -1.0666, "return_pct": -1.52, "equity": 984.81, "max_dd": 5.24, "win_rate": 53.45, "profit_factor": 0.887, "ic": -0.0073, "hit": 53.45, "n": 58, "precision": 0.5714, "recall": 0.5161, "f1": 0.5424, "f2": 0.5263, "mcc": 0.0716, "accuracy": 0.5345, "tp": 16, "fp": 12, "tn": 15, "fn": 15, "aleatoric_mean": 6.7e-05, "epistemic_mean": 0.000135, "confidence_mean": 0.9998, "aleatoric_std": 2e-05, "epistemic_std": 4e-05}, {"fold": "fold_3", "regime": "Eurozone debt plateau", "sharpe": 0.3439, "sortino": 0.5538, "return_pct": 0.7, "equity": 1007.0, "max_dd": 4.91, "win_rate": 49.18, "profit_factor": 1.059, "ic": -0.0033, "hit": 49.18, "n": 61, "precision": 0.4333, "recall": 0.4815, "f1": 0.4561, "f2": 0.471, "mcc": -0.0184, "accuracy": 0.4918, "tp": 13, "fp": 17, "tn": 17, "fn": 14, "aleatoric_mean": 6e-05, "epistemic_mean": 0.000119, "confidence_mean": 0.9998, "aleatoric_std": 2.1e-05, "epistemic_std": 4.3e-05}, {"fold": "fold_4", "regime": "Strong USD downturn", "sharpe": -1.1412, "sortino": -1.8638, "return_pct": -2.56, "equity": 974.4, "max_dd": 3.87, "win_rate": 46.67, "profit_factor": 0.839, "ic": 0.0495, "hit": 46.67, "n": 60, "precision": 0.4634, "recall": 0.6552, "f1": 0.5429, "f2": 0.6051, "mcc": -0.0586, "accuracy": 0.4667, "tp": 19, "fp": 22, "tn": 9, "fn": 10, "aleatoric_mean": 6.1e-05, "epistemic_mean": 0.000122, "confidence_mean": 0.9998, "aleatoric_std": 1.9e-05, "epistemic_std": 3.8e-05}, {"fold": "fold_5", "regime": "Low-vol plateau", "sharpe": 2.943, "sortino": 4.7521, "return_pct": 5.09, "equity": 1050.91, "max_dd": 1.68, "win_rate": 58.06, "profit_factor": 1.613, "ic": 0.3347, "hit": 58.06, "n": 62, "precision": 0.5833, "recall": 0.6562, "f1": 0.6176, "f2": 0.6402, "mcc": 0.1582, "accuracy": 0.5806, "tp": 21, "fp": 15, "tn": 15, "fn": 11, "aleatoric_mean": 4.6e-05, "epistemic_mean": 9.3e-05, "confidence_mean": 0.9999, "aleatoric_std": 1.8e-05, "epistemic_std": 3.7e-05}, {"fold": "fold_6", "regime": "EUR crisis downturn", "sharpe": 2.5486, "sortino": 4.8427, "return_pct": 2.64, "equity": 1026.36, "max_dd": 1.52, "win_rate": 61.4, "profit_factor": 1.519, "ic": 0.1511, "hit": 60.34, "n": 58, "precision": 0.5333, "recall": 0.6667, "f1": 0.5926, "f2": 0.6349, "mcc": 0.2512, "accuracy": 0.6207, "tp": 16, "fp": 14, "tn": 20, "fn": 8, "aleatoric_mean": 5.1e-05, "epistemic_mean": 0.000103, "confidence_mean": 0.9998, "aleatoric_std": 1.7e-05, "epistemic_std": 3.4e-05}, {"fold": "fold_7", "regime": "Recent mixed/upturn", "sharpe": 2.2424, "sortino": 3.6467, "return_pct": 2.85, "equity": 1028.46, "max_dd": 1.91, "win_rate": 63.33, "profit_factor": 1.442, "ic": 0.0552, "hit": 63.33, "n": 60, "precision": 0.6923, "recall": 0.5625, "f1": 0.6207, "f2": 0.5844, "mcc": 0.2787, "accuracy": 0.6333, "tp": 18, "fp": 8, "tn": 20, "fn": 14, "aleatoric_mean": 4.5e-05, "epistemic_mean": 8.9e-05, "confidence_mean": 0.9999, "aleatoric_std": 1.5e-05, "epistemic_std": 3e-05}], "train_sharpe": 1.9497, "train_psr": 1.0, "train_equity": 3809.44, "train_sortino": 4.7281, "train_return_pct": 280.94, "train_max_dd": 8.24, "train_win_rate": 55.93, "train_profit_factor": 1.573, "train_ic": 0.1732, "train_hit": 55.64, "train_precision": 0.569, "train_recall": 0.6151, "train_f1": 0.5912, "train_f2": 0.6053, "train_mcc": 0.1136, "train_accuracy": 0.5586, "train_per_window": [{"fold": "all_train", "regime": "Training data", "sharpe": 1.9497, "sortino": 4.7281, "return_pct": 280.94, "equity": 3809.44, "max_dd": 8.24, "win_rate": 55.93, "profit_factor": 1.573, "ic": 0.1732, "hit": 55.64, "n": 1382, "precision": 0.569, "recall": 0.6151, "f1": 0.5912, "f2": 0.6053, "mcc": 0.1136, "accuracy": 0.5586, "tp": 441, "fp": 334, "tn": 331, "fn": 276}], "experiment_num": 254, "status": "DISCARD"}
