{"backbone": "lstm", "description": "lstm: Exp36 wd=8e-4 fine-grained between 7e-4 and 1e-3", "config": {"seq_len": 10, "lr": 0.001, "batch_size": 16, "epochs": 100, "weight_decay": 0.0008, "patience": 15, "grad_clip": 1.0, "warmup_epochs": 0, "huber_delta": 1.0, "head_dropout": 0.25, "seed": 42, "het_loss": false}, "composite": 6.4242, "test_pos_folds": 7, "val_pos_folds": 6, "val_loss": 2.8e-05, "elapsed_sec": 54.0, "timestamp": "2026-04-19T19:50:15", "sharpe": 6.5242, "psr": 1.0, "equity": 12222.92, "sortino": 7.2971, "return_pct": 1122.29, "max_dd": 7.54, "win_rate": 73.07, "profit_factor": 3.519, "ic": 0.5599, "hit": 72.76, "aleatoric_mean": 6e-06, "epistemic_mean": 1.1e-05, "confidence_mean": 1.0, "precision": 0.7348, "recall": 0.7027, "f1": 0.7184, "f2": 0.7089, "mcc": 0.4554, "accuracy": 0.7276, "per_window": [{"fold": "fold_1", "regime": "Pre-crisis upturn + GFC onset", "sharpe": 0.9135, "sortino": 1.0158, "return_pct": 6.5, "equity": 1065.05, "max_dd": 7.54, "win_rate": 51.96, "profit_factor": 1.241, "ic": 0.1287, "hit": 51.46, "n": 103, "precision": 0.5405, "recall": 0.3774, "f1": 0.4444, "f2": 0.4016, "mcc": 0.0389, "accuracy": 0.5146, "tp": 20, "fp": 17, "tn": 33, "fn": 33, "aleatoric_mean": 7e-06, "epistemic_mean": 1.5e-05, "confidence_mean": 1.0, "aleatoric_std": 3e-06, "epistemic_std": 6e-06}, {"fold": "fold_2", "regime": "Post-crash recovery", "sharpe": 0.4024, "sortino": 0.7304, "return_pct": 1.67, "equity": 1016.74, "max_dd": 6.09, "win_rate": 52.34, "profit_factor": 1.065, "ic": 0.0788, "hit": 52.34, "n": 107, "precision": 0.5, "recall": 0.4902, "f1": 0.495, "f2": 0.4921, "mcc": 0.0438, "accuracy": 0.5234, "tp": 25, "fp": 25, "tn": 31, "fn": 26, "aleatoric_mean": 8e-06, "epistemic_mean": 1.5e-05, "confidence_mean": 1.0, "aleatoric_std": 5e-06, "epistemic_std": 9e-06}, {"fold": "fold_3", "regime": "Eurozone debt plateau", "sharpe": 9.7509, "sortino": 15.7593, "return_pct": 34.11, "equity": 1341.06, "max_dd": 2.22, "win_rate": 76.92, "profit_factor": 4.749, "ic": 0.5759, "hit": 75.47, "n": 106, "precision": 0.7313, "recall": 0.8596, "f1": 0.7903, "f2": 0.8305, "mcc": 0.509, "accuracy": 0.7547, "tp": 49, "fp": 18, "tn": 31, "fn": 8, "aleatoric_mean": 6e-06, "epistemic_mean": 1.2e-05, "confidence_mean": 1.0, "aleatoric_std": 3e-06, "epistemic_std": 6e-06}, {"fold": "fold_4", "regime": "Strong USD downturn", "sharpe": 11.378, "sortino": 17.832, "return_pct": 104.44, "equity": 2044.42, "max_dd": 1.81, "win_rate": 84.43, "profit_factor": 7.955, "ic": 0.7704, "hit": 83.93, "n": 168, "precision": 0.8831, "recall": 0.7907, "f1": 0.8344, "f2": 0.8076, "mcc": 0.6831, "accuracy": 0.8393, "tp": 68, "fp": 9, "tn": 73, "fn": 18, "aleatoric_mean": 5e-06, "epistemic_mean": 9e-06, "confidence_mean": 1.0, "aleatoric_std": 2e-06, "epistemic_std": 4e-06}, {"fold": "fold_5", "regime": "Low-vol plateau", "sharpe": 13.5237, "sortino": 51.3119, "return_pct": 40.82, "equity": 1408.16, "max_dd": 0.24, "win_rate": 79.63, "profit_factor": 12.907, "ic": 0.8019, "hit": 79.63, "n": 162, "precision": 0.7945, "recall": 0.7632, "f1": 0.7785, "f2": 0.7692, "mcc": 0.5905, "accuracy": 0.7963, "tp": 58, "fp": 15, "tn": 71, "fn": 18, "aleatoric_mean": 4e-06, "epistemic_mean": 7e-06, "confidence_mean": 1.0, "aleatoric_std": 1e-06, "epistemic_std": 2e-06}, {"fold": "fold_6", "regime": "EUR crisis downturn", "sharpe": 12.328, "sortino": 30.1131, "return_pct": 84.09, "equity": 1840.88, "max_dd": 1.31, "win_rate": 76.97, "profit_factor": 8.374, "ic": 0.7608, "hit": 76.97, "n": 165, "precision": 0.7671, "recall": 0.7273, "f1": 0.7467, "f2": 0.7349, "mcc": 0.5365, "accuracy": 0.7697, "tp": 56, "fp": 17, "tn": 71, "fn": 21, "aleatoric_mean": 5e-06, "epistemic_mean": 1e-05, "confidence_mean": 1.0, "aleatoric_std": 2e-06, "epistemic_std": 4e-06}, {"fold": "fold_7", "regime": "Recent mixed/upturn", "sharpe": 8.962, "sortino": 14.7354, "return_pct": 58.82, "equity": 1588.18, "max_dd": 1.64, "win_rate": 75.31, "profit_factor": 4.868, "ic": 0.6659, "hit": 75.31, "n": 162, "precision": 0.747, "recall": 0.7654, "f1": 0.7561, "f2": 0.7617, "mcc": 0.5063, "accuracy": 0.7531, "tp": 62, "fp": 21, "tn": 60, "fn": 19, "aleatoric_mean": 6e-06, "epistemic_mean": 1.3e-05, "confidence_mean": 1.0, "aleatoric_std": 2e-06, "epistemic_std": 4e-06}], "val_sharpe": 7.1539, "val_psr": 1.0, "val_equity": 4663.84, "val_sortino": 9.8643, "val_return_pct": 366.38, "val_max_dd": 7.34, "val_win_rate": 71.3, "val_profit_factor": 3.454, "val_ic": 0.5637, "val_hit": 70.83, "val_aleatoric_mean": 5e-06, "val_epistemic_mean": 9e-06, "val_confidence_mean": 1.0, "val_precision": 0.6973, "val_recall": 0.7068, "val_f1": 0.702, "val_f2": 0.7049, "val_mcc": 0.4287, "val_accuracy": 0.7148, "val_per_window": [{"fold": "fold_1", "regime": "Pre-crisis upturn + GFC onset", "sharpe": 0.4646, "sortino": 0.7365, "return_pct": 1.1, "equity": 1011.05, "max_dd": 5.33, "win_rate": 47.22, "profit_factor": 1.08, "ic": 0.0292, "hit": 46.79, "n": 109, "precision": 0.4839, "recall": 0.5455, "f1": 0.5128, "f2": 0.5319, "mcc": -0.0476, "accuracy": 0.4771, "tp": 30, "fp": 32, "tn": 22, "fn": 25, "aleatoric_mean": 5e-06, "epistemic_mean": 9e-06, "confidence_mean": 1.0, "aleatoric_std": 2e-06, "epistemic_std": 4e-06}, {"fold": "fold_2", "regime": "Post-crash recovery", "sharpe": -0.0006, "sortino": -0.0009, "return_pct": -0.28, "equity": 997.22, "max_dd": 7.34, "win_rate": 49.07, "profit_factor": 1.0, "ic": 0.0086, "hit": 49.07, "n": 108, "precision": 0.5714, "recall": 0.5079, "f1": 0.5378, "f2": 0.5195, "mcc": -0.0251, "accuracy": 0.4907, "tp": 32, "fp": 24, "tn": 21, "fn": 31, "aleatoric_mean": 7e-06, "epistemic_mean": 1.5e-05, "confidence_mean": 1.0, "aleatoric_std": 3e-06, "epistemic_std": 6e-06}, {"fold": "fold_3", "regime": "Eurozone debt plateau", "sharpe": 13.807, "sortino": 28.1214, "return_pct": 52.13, "equity": 1521.32, "max_dd": 0.7, "win_rate": 88.07, "profit_factor": 11.906, "ic": 0.8019, "hit": 86.49, "n": 111, "precision": 0.8542, "recall": 0.8723, "f1": 0.8632, "f2": 0.8686, "mcc": 0.7609, "accuracy": 0.8829, "tp": 41, "fp": 7, "tn": 57, "fn": 6, "aleatoric_mean": 4e-06, "epistemic_mean": 8e-06, "confidence_mean": 1.0, "aleatoric_std": 2e-06, "epistemic_std": 3e-06}, {"fold": "fold_4", "regime": "Strong USD downturn", "sharpe": 13.5837, "sortino": 34.2603, "return_pct": 42.96, "equity": 1429.56, "max_dd": 0.82, "win_rate": 82.57, "profit_factor": 12.645, "ic": 0.8086, "hit": 81.82, "n": 110, "precision": 0.7917, "recall": 0.8085, "f1": 0.8, "f2": 0.8051, "mcc": 0.6481, "accuracy": 0.8273, "tp": 38, "fp": 10, "tn": 53, "fn": 9, "aleatoric_mean": 4e-06, "epistemic_mean": 8e-06, "confidence_mean": 1.0, "aleatoric_std": 2e-06, "epistemic_std": 3e-06}, {"fold": "fold_5", "regime": "Low-vol plateau", "sharpe": 10.8261, "sortino": 28.1787, "return_pct": 34.63, "equity": 1346.26, "max_dd": 0.7, "win_rate": 75.89, "profit_factor": 6.782, "ic": 0.7904, "hit": 75.89, "n": 112, "precision": 0.825, "recall": 0.6226, "f1": 0.7097, "f2": 0.6548, "mcc": 0.5252, "accuracy": 0.7589, "tp": 33, "fp": 7, "tn": 52, "fn": 20, "aleatoric_mean": 3e-06, "epistemic_mean": 7e-06, "confidence_mean": 1.0, "aleatoric_std": 1e-06, "epistemic_std": 3e-06}, {"fold": "fold_6", "regime": "EUR crisis downturn", "sharpe": 13.8743, "sortino": 54.687, "return_pct": 26.95, "equity": 1269.55, "max_dd": 0.25, "win_rate": 83.18, "profit_factor": 15.497, "ic": 0.8853, "hit": 82.41, "n": 108, "precision": 0.8222, "recall": 0.7872, "f1": 0.8043, "f2": 0.794, "mcc": 0.6598, "accuracy": 0.8333, "tp": 37, "fp": 8, "tn": 53, "fn": 10, "aleatoric_mean": 3e-06, "epistemic_mean": 7e-06, "confidence_mean": 1.0, "aleatoric_std": 1e-06, "epistemic_std": 2e-06}, {"fold": "fold_7", "regime": "Recent mixed/upturn", "sharpe": 11.1786, "sortino": 25.1001, "return_pct": 24.45, "equity": 1244.46, "max_dd": 0.69, "win_rate": 72.73, "profit_factor": 6.53, "ic": 0.7112, "hit": 72.73, "n": 110, "precision": 0.662, "recall": 0.8868, "f1": 0.7581, "f2": 0.8304, "mcc": 0.4865, "accuracy": 0.7273, "tp": 47, "fp": 24, "tn": 33, "fn": 6, "aleatoric_mean": 5e-06, "epistemic_mean": 1e-05, "confidence_mean": 1.0, "aleatoric_std": 2e-06, "epistemic_std": 4e-06}], "train_sharpe": 7.0973, "train_psr": 1.0, "train_equity": 2639122.25, "train_sortino": 18.4888, "train_return_pct": 263812.22, "train_max_dd": 6.87, "train_win_rate": 75.61, "train_profit_factor": 5.843, "train_ic": 0.696, "train_hit": 75.3, "train_precision": 0.7932, "train_recall": 0.7104, "train_f1": 0.7495, "train_f2": 0.7255, "train_mcc": 0.5158, "train_accuracy": 0.7559, "train_per_window": [{"fold": "all_train", "regime": "Training data", "sharpe": 7.0973, "sortino": 18.4888, "return_pct": 263812.22, "equity": 2639122.25, "max_dd": 6.87, "win_rate": 75.61, "profit_factor": 5.843, "ic": 0.696, "hit": 75.3, "n": 2478, "precision": 0.7932, "recall": 0.7104, "f1": 0.7495, "f2": 0.7255, "mcc": 0.5158, "accuracy": 0.7559, "tp": 905, "fp": 236, "tn": 968, "fn": 369}], "experiment_num": 141, "status": "KEEP"}
{"backbone": "lstm", "description": "lstm: Exp37 hd=0.22 fine-grained at new champion", "config": {"seq_len": 10, "lr": 0.001, "batch_size": 16, "epochs": 100, "weight_decay": 0.0007, "patience": 15, "grad_clip": 1.0, "warmup_epochs": 0, "huber_delta": 1.0, "head_dropout": 0.22, "seed": 42, "het_loss": false}, "composite": 5.6822, "test_pos_folds": 7, "val_pos_folds": 5, "val_loss": 2.7e-05, "elapsed_sec": 49.3, "timestamp": "2026-04-19T19:51:29", "sharpe": 5.8822, "psr": 1.0, "equity": 9837.1, "sortino": 6.8445, "return_pct": 883.71, "max_dd": 7.54, "win_rate": 70.28, "profit_factor": 3.077, "ic": 0.572, "hit": 69.99, "aleatoric_mean": 5e-06, "epistemic_mean": 1e-05, "confidence_mean": 1.0, "precision": 0.7493, "recall": 0.5967, "f1": 0.6644, "f2": 0.622, "mcc": 0.4109, "accuracy": 0.702, "per_window": [{"fold": "fold_1", "regime": "Pre-crisis upturn + GFC onset", "sharpe": 0.2994, "sortino": 0.3341, "return_pct": 1.59, "equity": 1015.89, "max_dd": 7.54, "win_rate": 51.96, "profit_factor": 1.073, "ic": 0.1944, "hit": 51.46, "n": 103, "precision": 0.5667, "recall": 0.3208, "f1": 0.4096, "f2": 0.3512, "mcc": 0.0668, "accuracy": 0.5243, "tp": 17, "fp": 13, "tn": 37, "fn": 36, "aleatoric_mean": 7e-06, "epistemic_mean": 1.5e-05, "confidence_mean": 1.0, "aleatoric_std": 3e-06, "epistemic_std": 6e-06}, {"fold": "fold_2", "regime": "Post-crash recovery", "sharpe": 1.0097, "sortino": 1.7867, "return_pct": 4.67, "equity": 1046.72, "max_dd": 4.7, "win_rate": 52.34, "profit_factor": 1.171, "ic": 0.1155, "hit": 52.34, "n": 107, "precision": 0.5, "recall": 0.451, "f1": 0.4742, "f2": 0.46, "mcc": 0.0406, "accuracy": 0.5234, "tp": 23, "fp": 23, "tn": 33, "fn": 28, "aleatoric_mean": 6e-06, "epistemic_mean": 1.3e-05, "confidence_mean": 1.0, "aleatoric_std": 4e-06, "epistemic_std": 8e-06}, {"fold": "fold_3", "regime": "Eurozone debt plateau", "sharpe": 7.2735, "sortino": 11.723, "return_pct": 26.27, "equity": 1262.69, "max_dd": 4.18, "win_rate": 72.12, "profit_factor": 3.158, "ic": 0.5191, "hit": 70.75, "n": 106, "precision": 0.6857, "recall": 0.8421, "f1": 0.7559, "f2": 0.8054, "mcc": 0.4139, "accuracy": 0.7075, "tp": 48, "fp": 22, "tn": 27, "fn": 9, "aleatoric_mean": 6e-06, "epistemic_mean": 1.3e-05, "confidence_mean": 1.0, "aleatoric_std": 3e-06, "epistemic_std": 6e-06}, {"fold": "fold_4", "regime": "Strong USD downturn", "sharpe": 10.5896, "sortino": 17.8795, "return_pct": 97.58, "equity": 1975.83, "max_dd": 1.81, "win_rate": 81.44, "profit_factor": 6.687, "ic": 0.7828, "hit": 80.95, "n": 168, "precision": 0.9104, "recall": 0.7093, "f1": 0.7974, "f2": 0.7421, "mcc": 0.6494, "accuracy": 0.8155, "tp": 61, "fp": 6, "tn": 76, "fn": 25, "aleatoric_mean": 4e-06, "epistemic_mean": 9e-06, "confidence_mean": 1.0, "aleatoric_std": 2e-06, "epistemic_std": 4e-06}, {"fold": "fold_5", "regime": "Low-vol plateau", "sharpe": 9.3276, "sortino": 25.4853, "return_pct": 30.63, "equity": 1306.31, "max_dd": 0.79, "win_rate": 69.75, "profit_factor": 5.04, "ic": 0.8235, "hit": 69.75, "n": 162, "precision": 0.9355, "recall": 0.3816, "f1": 0.5421, "f2": 0.4328, "mcc": 0.4546, "accuracy": 0.6975, "tp": 29, "fp": 2, "tn": 84, "fn": 47, "aleatoric_mean": 3e-06, "epistemic_mean": 7e-06, "confidence_mean": 1.0, "aleatoric_std": 1e-06, "epistemic_std": 2e-06}, {"fold": "fold_6", "regime": "EUR crisis downturn", "sharpe": 12.5514, "sortino": 27.7447, "return_pct": 85.36, "equity": 1853.56, "max_dd": 1.64, "win_rate": 75.76, "profit_factor": 8.777, "ic": 0.7467, "hit": 75.76, "n": 165, "precision": 0.7937, "recall": 0.6494, "f1": 0.7143, "f2": 0.6739, "mcc": 0.5151, "accuracy": 0.7576, "tp": 50, "fp": 13, "tn": 75, "fn": 27, "aleatoric_mean": 5e-06, "epistemic_mean": 1e-05, "confidence_mean": 1.0, "aleatoric_std": 2e-06, "epistemic_std": 4e-06}, {"fold": "fold_7", "regime": "Recent mixed/upturn", "sharpe": 8.0699, "sortino": 11.5645, "return_pct": 53.14, "equity": 1531.41, "max_dd": 3.68, "win_rate": 75.93, "profit_factor": 4.097, "ic": 0.687, "hit": 75.93, "n": 162, "precision": 0.7763, "recall": 0.7284, "f1": 0.7516, "f2": 0.7375, "mcc": 0.5195, "accuracy": 0.7593, "tp": 59, "fp": 17, "tn": 64, "fn": 22, "aleatoric_mean": 6e-06, "epistemic_mean": 1.1e-05, "confidence_mean": 1.0, "aleatoric_std": 2e-06, "epistemic_std": 4e-06}], "val_sharpe": 6.2488, "val_psr": 1.0, "val_equity": 3942.34, "val_sortino": 9.4473, "val_return_pct": 294.23, "val_max_dd": 6.56, "val_win_rate": 68.55, "val_profit_factor": 2.931, "val_ic": 0.5658, "val_hit": 68.1, "val_aleatoric_mean": 4e-06, "val_epistemic_mean": 9e-06, "val_confidence_mean": 1.0, "val_precision": 0.7682, "val_recall": 0.4904, "val_f1": 0.5987, "val_f2": 0.5286, "val_mcc": 0.3872, "val_accuracy": 0.6875, "val_per_window": [{"fold": "fold_1", "regime": "Pre-crisis upturn + GFC onset", "sharpe": -0.211, "sortino": -0.332, "return_pct": -0.6, "equity": 993.95, "max_dd": 3.84, "win_rate": 48.15, "profit_factor": 0.966, "ic": -0.0078, "hit": 47.71, "n": 109, "precision": 0.4783, "recall": 0.2, "f1": 0.2821, "f2": 0.2263, "mcc": -0.0272, "accuracy": 0.4862, "tp": 11, "fp": 12, "tn": 42, "fn": 44, "aleatoric_mean": 4e-06, "epistemic_mean": 9e-06, "confidence_mean": 1.0, "aleatoric_std": 2e-06, "epistemic_std": 4e-06}, {"fold": "fold_2", "regime": "Post-crash recovery", "sharpe": -0.2192, "sortino": -0.3557, "return_pct": -1.33, "equity": 986.69, "max_dd": 6.56, "win_rate": 47.22, "profit_factor": 0.966, "ic": 0.0482, "hit": 47.22, "n": 108, "precision": 0.5789, "recall": 0.3492, "f1": 0.4356, "f2": 0.3793, "mcc": -0.0066, "accuracy": 0.4722, "tp": 22, "fp": 16, "tn": 29, "fn": 41, "aleatoric_mean": 6e-06, "epistemic_mean": 1.2e-05, "confidence_mean": 1.0, "aleatoric_std": 2e-06, "epistemic_std": 5e-06}, {"fold": "fold_3", "regime": "Eurozone debt plateau", "sharpe": 12.645, "sortino": 31.2455, "return_pct": 48.92, "equity": 1489.22, "max_dd": 0.7, "win_rate": 85.32, "profit_factor": 9.115, "ic": 0.7996, "hit": 83.78, "n": 111, "precision": 0.878, "recall": 0.766, "f1": 0.8182, "f2": 0.786, "mcc": 0.7042, "accuracy": 0.8559, "tp": 36, "fp": 5, "tn": 59, "fn": 11, "aleatoric_mean": 4e-06, "epistemic_mean": 8e-06, "confidence_mean": 1.0, "aleatoric_std": 2e-06, "epistemic_std": 3e-06}, {"fold": "fold_4", "regime": "Strong USD downturn", "sharpe": 13.791, "sortino": 40.7111, "return_pct": 43.4, "equity": 1434.04, "max_dd": 0.43, "win_rate": 83.49, "profit_factor": 13.375, "ic": 0.8118, "hit": 82.73, "n": 110, "precision": 0.9143, "recall": 0.6809, "f1": 0.7805, "f2": 0.7175, "mcc": 0.6725, "accuracy": 0.8364, "tp": 32, "fp": 3, "tn": 60, "fn": 15, "aleatoric_mean": 4e-06, "epistemic_mean": 8e-06, "confidence_mean": 1.0, "aleatoric_std": 1e-06, "epistemic_std": 3e-06}, {"fold": "fold_5", "regime": "Low-vol plateau", "sharpe": 8.2996, "sortino": 23.3363, "return_pct": 27.67, "equity": 1276.7, "max_dd": 1.17, "win_rate": 66.96, "profit_factor": 4.141, "ic": 0.7853, "hit": 66.96, "n": 112, "precision": 0.8333, "recall": 0.3774, "f1": 0.5195, "f2": 0.4237, "mcc": 0.3767, "accuracy": 0.6696, "tp": 20, "fp": 4, "tn": 55, "fn": 33, "aleatoric_mean": 4e-06, "epistemic_mean": 7e-06, "confidence_mean": 1.0, "aleatoric_std": 1e-06, "epistemic_std": 3e-06}, {"fold": "fold_6", "regime": "EUR crisis downturn", "sharpe": 9.3866, "sortino": 23.6618, "return_pct": 20.26, "equity": 1202.56, "max_dd": 0.75, "win_rate": 73.83, "profit_factor": 5.244, "ic": 0.8716, "hit": 73.15, "n": 108, "precision": 1.0, "recall": 0.4043, "f1": 0.5758, "f2": 0.4589, "mcc": 0.5264, "accuracy": 0.7407, "tp": 19, "fp": 0, "tn": 61, "fn": 28, "aleatoric_mean": 4e-06, "epistemic_mean": 7e-06, "confidence_mean": 1.0, "aleatoric_std": 1e-06, "epistemic_std": 2e-06}, {"fold": "fold_7", "regime": "Recent mixed/upturn", "sharpe": 10.093, "sortino": 21.2991, "return_pct": 22.6, "equity": 1226.0, "max_dd": 0.69, "win_rate": 74.55, "profit_factor": 5.336, "ic": 0.7043, "hit": 74.55, "n": 110, "precision": 0.7358, "recall": 0.7358, "f1": 0.7358, "f2": 0.7358, "mcc": 0.4902, "accuracy": 0.7455, "tp": 39, "fp": 14, "tn": 43, "fn": 14, "aleatoric_mean": 5e-06, "epistemic_mean": 1e-05, "confidence_mean": 1.0, "aleatoric_std": 2e-06, "epistemic_std": 4e-06}], "train_sharpe": 6.433, "train_psr": 1.0, "train_equity": 1399037.25, "train_sortino": 17.6647, "train_return_pct": 139803.73, "train_max_dd": 5.08, "train_win_rate": 70.83, "train_profit_factor": 4.735, "train_ic": 0.7101, "train_hit": 70.54, "train_precision": 0.8632, "train_recall": 0.5149, "train_f1": 0.645, "train_f2": 0.5601, "train_mcc": 0.4645, "train_accuracy": 0.7086, "train_per_window": [{"fold": "all_train", "regime": "Training data", "sharpe": 6.433, "sortino": 17.6647, "return_pct": 139803.73, "equity": 1399037.25, "max_dd": 5.08, "win_rate": 70.83, "profit_factor": 4.735, "ic": 0.7101, "hit": 70.54, "n": 2478, "precision": 0.8632, "recall": 0.5149, "f1": 0.645, "f2": 0.5601, "mcc": 0.4645, "accuracy": 0.7086, "tp": 656, "fp": 104, "tn": 1100, "fn": 618}], "experiment_num": 142, "status": "DISCARD"}
