{"backbone": "lfm2-350m", "description": "H-Exp1: lr=2e-5 heteroscedastic baseline", "config": {"seq_len": 60, "lr": 2e-05, "batch_size": 32, "epochs": 20, "weight_decay": 1e-05, "patience": 5, "grad_clip": 1.0, "warmup_epochs": 0, "huber_delta": 1.0, "head_dropout": 0.1}, "composite": -0.9382, "test_pos_folds": 4, "val_pos_folds": 5, "val_loss": -1.384581, "elapsed_sec": 301.6, "timestamp": "2026-04-12T08:44:43", "sharpe": -0.4382, "psr": 0.2451, "equity": 892.83, "sortino": -0.6284, "return_pct": -10.72, "max_dd": 19.38, "win_rate": 50.08, "profit_factor": 0.929, "ic": -0.045, "hit": 49.76, "aleatoric_mean": 0.15481, "epistemic_mean": 0.008085, "confidence_mean": 0.8725, "per_window": [{"fold": "fold_1", "regime": "Pre-crisis upturn + GFC onset", "sharpe": 1.505, "sortino": 2.6997, "return_pct": 3.11, "equity": 1031.11, "max_dd": 2.95, "win_rate": 50.0, "profit_factor": 1.26, "ic": -0.012, "hit": 49.06, "n": 53, "aleatoric_mean": 0.283604, "epistemic_mean": 0.004416, "confidence_mean": 0.7884, "aleatoric_std": 0.167561, "epistemic_std": 0.00236}, {"fold": "fold_2", "regime": "Post-crash recovery", "sharpe": -0.5255, "sortino": -0.8333, "return_pct": -1.67, "equity": 983.32, "max_dd": 6.47, "win_rate": 50.88, "profit_factor": 0.919, "ic": -0.0286, "hit": 50.88, "n": 57, "aleatoric_mean": 0.318946, "epistemic_mean": 0.005496, "confidence_mean": 0.7724, "aleatoric_std": 0.213464, "epistemic_std": 0.002841}, {"fold": "fold_3", "regime": "Eurozone debt plateau", "sharpe": -1.3875, "sortino": -2.0204, "return_pct": -2.49, "equity": 975.08, "max_dd": 5.4, "win_rate": 50.0, "profit_factor": 0.802, "ic": -0.1458, "hit": 48.21, "n": 56, "aleatoric_mean": 0.170873, "epistemic_mean": 0.006272, "confidence_mean": 0.8567, "aleatoric_std": 0.113019, "epistemic_std": 0.002889}, {"fold": "fold_4", "regime": "Strong USD downturn", "sharpe": 0.6285, "sortino": 0.7477, "return_pct": 2.95, "equity": 1029.46, "max_dd": 7.41, "win_rate": 57.26, "profit_factor": 1.111, "ic": 0.0666, "hit": 56.78, "n": 118, "aleatoric_mean": 0.124858, "epistemic_mean": 0.008635, "confidence_mean": 0.8898, "aleatoric_std": 0.115499, "epistemic_std": 0.004604}, {"fold": "fold_5", "regime": "Low-vol plateau", "sharpe": 0.4766, "sortino": 0.7086, "return_pct": 1.02, "equity": 1010.21, "max_dd": 2.07, "win_rate": 48.21, "profit_factor": 1.082, "ic": -0.0122, "hit": 48.21, "n": 112, "aleatoric_mean": 0.068565, "epistemic_mean": 0.009986, "confidence_mean": 0.9304, "aleatoric_std": 0.070688, "epistemic_std": 0.004683}, {"fold": "fold_6", "regime": "EUR crisis downturn", "sharpe": -3.9543, "sortino": -6.5782, "return_pct": -16.06, "equity": 839.35, "max_dd": 16.59, "win_rate": 40.87, "profit_factor": 0.534, "ic": -0.2312, "hit": 40.87, "n": 115, "aleatoric_mean": 0.207156, "epistemic_mean": 0.006903, "confidence_mean": 0.8365, "aleatoric_std": 0.169915, "epistemic_std": 0.003489}, {"fold": "fold_7", "regime": "Recent mixed/upturn", "sharpe": 0.8696, "sortino": 1.4757, "return_pct": 3.46, "equity": 1034.58, "max_dd": 5.15, "win_rate": 53.57, "profit_factor": 1.161, "ic": 0.103, "hit": 53.57, "n": 112, "aleatoric_mean": 0.06635, "epistemic_mean": 0.010778, "confidence_mean": 0.9318, "aleatoric_std": 0.074545, "epistemic_std": 0.004576}], "val_sharpe": 0.7844, "val_psr": 0.8443, "val_equity": 1097.9, "val_sortino": 1.2579, "val_return_pct": 9.79, "val_max_dd": 11.62, "val_win_rate": 52.64, "val_profit_factor": 1.14, "val_ic": 0.0699, "val_hit": 52.39, "val_aleatoric_mean": 0.147519, "val_epistemic_mean": 0.008658, "val_confidence_mean": 0.8858, "val_per_window": [{"fold": "fold_1", "regime": "Pre-crisis upturn + GFC onset", "sharpe": -1.2115, "sortino": -1.945, "return_pct": -1.95, "equity": 980.5, "max_dd": 4.8, "win_rate": 53.45, "profit_factor": 0.819, "ic": -0.0853, "hit": 52.54, "n": 59, "aleatoric_mean": 0.395816, "epistemic_mean": 0.007048, "confidence_mean": 0.7606, "aleatoric_std": 0.389404, "epistemic_std": 0.005642}, {"fold": "fold_2", "regime": "Post-crash recovery", "sharpe": -4.1005, "sortino": -6.0232, "return_pct": -7.57, "equity": 924.29, "max_dd": 9.38, "win_rate": 39.66, "profit_factor": 0.514, "ic": -0.1949, "hit": 39.66, "n": 58, "aleatoric_mean": 0.263961, "epistemic_mean": 0.005776, "confidence_mean": 0.8043, "aleatoric_std": 0.203266, "epistemic_std": 0.002824}, {"fold": "fold_3", "regime": "Eurozone debt plateau", "sharpe": 2.0865, "sortino": 3.7659, "return_pct": 4.89, "equity": 1048.9, "max_dd": 1.94, "win_rate": 50.82, "profit_factor": 1.417, "ic": 0.1173, "hit": 50.82, "n": 61, "aleatoric_mean": 0.07241, "epistemic_mean": 0.008529, "confidence_mean": 0.928, "aleatoric_std": 0.064468, "epistemic_std": 0.003818}, {"fold": "fold_4", "regime": "Strong USD downturn", "sharpe": 4.0841, "sortino": 8.717, "return_pct": 8.94, "equity": 1089.38, "max_dd": 2.35, "win_rate": 63.33, "profit_factor": 1.871, "ic": 0.2217, "hit": 63.33, "n": 60, "aleatoric_mean": 0.067522, "epistemic_mean": 0.009045, "confidence_mean": 0.9318, "aleatoric_std": 0.065191, "epistemic_std": 0.003742}, {"fold": "fold_5", "regime": "Low-vol plateau", "sharpe": 1.7223, "sortino": 2.9083, "return_pct": 2.96, "equity": 1029.56, "max_dd": 2.21, "win_rate": 50.0, "profit_factor": 1.322, "ic": 0.1901, "hit": 50.0, "n": 62, "aleatoric_mean": 0.044564, "epistemic_mean": 0.010611, "confidence_mean": 0.9489, "aleatoric_std": 0.040829, "epistemic_std": 0.004931}, {"fold": "fold_6", "regime": "EUR crisis downturn", "sharpe": 2.0682, "sortino": 3.1726, "return_pct": 2.14, "equity": 1021.39, "max_dd": 1.18, "win_rate": 57.89, "profit_factor": 1.404, "ic": 0.1162, "hit": 56.9, "n": 58, "aleatoric_mean": 0.031563, "epistemic_mean": 0.011752, "confidence_mean": 0.9588, "aleatoric_std": 0.022166, "epistemic_std": 0.005419}, {"fold": "fold_7", "regime": "Recent mixed/upturn", "sharpe": 0.6664, "sortino": 0.9139, "return_pct": 0.82, "equity": 1008.21, "max_dd": 2.05, "win_rate": 53.33, "profit_factor": 1.115, "ic": -0.138, "hit": 53.33, "n": 60, "aleatoric_mean": 0.165633, "epistemic_mean": 0.007764, "confidence_mean": 0.8629, "aleatoric_std": 0.147662, "epistemic_std": 0.004097}], "train_sharpe": 0.2095, "train_psr": 0.6832, "train_equity": 1107.18, "train_sortino": 0.2274, "train_return_pct": 10.72, "train_max_dd": 23.22, "train_win_rate": 50.25, "train_profit_factor": 1.049, "train_ic": 0.0647, "train_hit": 50.0, "train_per_window": [{"fold": "all_train", "regime": "Training data", "sharpe": 0.2095, "sortino": 0.2274, "return_pct": 10.72, "equity": 1107.18, "max_dd": 23.22, "win_rate": 50.25, "profit_factor": 1.049, "ic": 0.0647, "hit": 50.0, "n": 1382}], "experiment_num": 23, "status": "DISCARD"}
{"backbone": "lfm2-350m", "description": "H-Exp2: lr=1e-5 slower for het-loss", "config": {"seq_len": 60, "lr": 1e-05, "batch_size": 32, "epochs": 20, "weight_decay": 1e-05, "patience": 5, "grad_clip": 1.0, "warmup_epochs": 0, "huber_delta": 1.0, "head_dropout": 0.1}, "composite": -1.4465, "test_pos_folds": 4, "val_pos_folds": 3, "val_loss": -1.142206, "elapsed_sec": 275.9, "timestamp": "2026-04-12T08:49:44", "sharpe": -0.2464, "psr": 0.3491, "equity": 933.71, "sortino": -0.3632, "return_pct": -6.63, "max_dd": 15.67, "win_rate": 48.79, "profit_factor": 0.959, "ic": -0.0757, "hit": 48.48, "aleatoric_mean": 0.319425, "epistemic_mean": 0.007072, "confidence_mean": 0.7889, "per_window": [{"fold": "fold_1", "regime": "Pre-crisis upturn + GFC onset", "sharpe": -0.3819, "sortino": -0.6923, "return_pct": -0.91, "equity": 990.9, "max_dd": 4.33, "win_rate": 48.08, "profit_factor": 0.943, "ic": 0.0109, "hit": 47.17, "n": 53, "aleatoric_mean": 0.626279, "epistemic_mean": 0.003668, "confidence_mean": 0.6325, "aleatoric_std": 0.294853, "epistemic_std": 0.001541}, {"fold": "fold_2", "regime": "Post-crash recovery", "sharpe": 1.7908, "sortino": 3.4455, "return_pct": 5.03, "equity": 1050.3, "max_dd": 3.82, "win_rate": 47.37, "profit_factor": 1.333, "ic": -0.0795, "hit": 47.37, "n": 57, "aleatoric_mean": 0.822454, "epistemic_mean": 0.005324, "confidence_mean": 0.5869, "aleatoric_std": 0.460331, "epistemic_std": 0.002717}, {"fold": "fold_3", "regime": "Eurozone debt plateau", "sharpe": 1.0077, "sortino": 1.7566, "return_pct": 1.73, "equity": 1017.28, "max_dd": 2.4, "win_rate": 55.56, "profit_factor": 1.174, "ic": 0.0333, "hit": 53.57, "n": 56, "aleatoric_mean": 0.411341, "epistemic_mean": 0.006144, "confidence_mean": 0.7224, "aleatoric_std": 0.225851, "epistemic_std": 0.002677}, {"fold": "fold_4", "regime": "Strong USD downturn", "sharpe": -1.4364, "sortino": -1.8739, "return_pct": -7.24, "equity": 927.62, "max_dd": 10.26, "win_rate": 46.15, "profit_factor": 0.786, "ic": -0.0861, "hit": 45.76, "n": 118, "aleatoric_mean": 0.276333, "epistemic_mean": 0.005939, "confidence_mean": 0.7982, "aleatoric_std": 0.211244, "epistemic_std": 0.003058}, {"fold": "fold_5", "regime": "Low-vol plateau", "sharpe": 0.3631, "sortino": 0.6299, "return_pct": 0.76, "equity": 1007.64, "max_dd": 3.42, "win_rate": 50.89, "profit_factor": 1.062, "ic": 0.0444, "hit": 50.89, "n": 112, "aleatoric_mean": 0.065839, "epistemic_mean": 0.011314, "confidence_mean": 0.9316, "aleatoric_std": 0.070558, "epistemic_std": 0.004565}, {"fold": "fold_6", "regime": "EUR crisis downturn", "sharpe": 0.1773, "sortino": 0.3169, "return_pct": 0.58, "equity": 1005.78, "max_dd": 7.56, "win_rate": 50.43, "profit_factor": 1.028, "ic": -0.1535, "hit": 50.43, "n": 115, "aleatoric_mean": 0.363837, "epistemic_mean": 0.005016, "confidence_mean": 0.7464, "aleatoric_std": 0.213965, "epistemic_std": 0.002355}, {"fold": "fold_7", "regime": "Recent mixed/upturn", "sharpe": -1.5047, "sortino": -1.9619, "return_pct": -6.19, "equity": 938.1, "max_dd": 7.36, "win_rate": 45.54, "profit_factor": 0.773, "ic": -0.1966, "hit": 45.54, "n": 112, "aleatoric_mean": 0.125639, "epistemic_mean": 0.009098, "confidence_mean": 0.8902, "aleatoric_std": 0.133396, "epistemic_std": 0.004322}], "val_sharpe": -0.7465, "val_psr": 0.1676, "val_equity": 906.54, "val_sortino": -1.1036, "val_return_pct": -9.35, "val_max_dd": 13.74, "val_win_rate": 49.04, "val_profit_factor": 0.883, "val_ic": -0.0715, "val_hit": 48.8, "val_aleatoric_mean": 0.203585, "val_epistemic_mean": 0.008996, "val_confidence_mean": 0.8497, "val_per_window": [{"fold": "fold_1", "regime": "Pre-crisis upturn + GFC onset", "sharpe": -3.8441, "sortino": -5.3881, "return_pct": -5.8, "equity": 941.97, "max_dd": 5.5, "win_rate": 53.45, "profit_factor": 0.53, "ic": -0.1669, "hit": 52.54, "n": 59, "aleatoric_mean": 0.358529, "epistemic_mean": 0.008269, "confidence_mean": 0.7684, "aleatoric_std": 0.324794, "epistemic_std": 0.005823}, {"fold": "fold_2", "regime": "Post-crash recovery", "sharpe": -0.1826, "sortino": -0.3049, "return_pct": -0.44, "equity": 995.59, "max_dd": 4.07, "win_rate": 48.28, "profit_factor": 0.971, "ic": -0.1102, "hit": 48.28, "n": 58, "aleatoric_mean": 0.439282, "epistemic_mean": 0.005401, "confidence_mean": 0.722, "aleatoric_std": 0.334647, "epistemic_std": 0.002491}, {"fold": "fold_3", "regime": "Eurozone debt plateau", "sharpe": 0.1057, "sortino": 0.1431, "return_pct": 0.13, "equity": 1001.34, "max_dd": 3.98, "win_rate": 52.46, "profit_factor": 1.018, "ic": -0.0272, "hit": 52.46, "n": 61, "aleatoric_mean": 0.226309, "epistemic_mean": 0.008909, "confidence_mean": 0.826, "aleatoric_std": 0.193492, "epistemic_std": 0.004368}, {"fold": "fold_4", "regime": "Strong USD downturn", "sharpe": -3.252, "sortino": -5.3067, "return_pct": -6.83, "equity": 931.67, "max_dd": 7.08, "win_rate": 36.67, "profit_factor": 0.607, "ic": -0.1076, "hit": 36.67, "n": 60, "aleatoric_mean": 0.154705, "epistemic_mean": 0.007281, "confidence_mean": 0.8693, "aleatoric_std": 0.130909, "epistemic_std": 0.00269}, {"fold": "fold_5", "regime": "Low-vol plateau", "sharpe": 1.5386, "sortino": 2.9214, "return_pct": 2.63, "equity": 1026.33, "max_dd": 3.28, "win_rate": 45.16, "profit_factor": 1.283, "ic": 0.0659, "hit": 45.16, "n": 62, "aleatoric_mean": 0.056431, "epistemic_mean": 0.011143, "confidence_mean": 0.9385, "aleatoric_std": 0.05103, "epistemic_std": 0.004826}, {"fold": "fold_6", "regime": "EUR crisis downturn", "sharpe": 3.1281, "sortino": 5.2446, "return_pct": 3.23, "equity": 1032.3, "max_dd": 1.56, "win_rate": 59.65, "profit_factor": 1.672, "ic": 0.1533, "hit": 58.62, "n": 58, "aleatoric_mean": 0.031214, "epistemic_mean": 0.01408, "confidence_mean": 0.9573, "aleatoric_std": 0.02956, "epistemic_std": 0.005599}, {"fold": "fold_7", "regime": "Recent mixed/upturn", "sharpe": -1.7234, "sortino": -2.9426, "return_pct": -2.2, "equity": 977.98, "max_dd": 4.11, "win_rate": 48.33, "profit_factor": 0.755, "ic": -0.259, "hit": 48.33, "n": 60, "aleatoric_mean": 0.167843, "epistemic_mean": 0.007854, "confidence_mean": 0.8617, "aleatoric_std": 0.152766, "epistemic_std": 0.003724}], "train_sharpe": 0.0008, "train_psr": 0.5007, "train_equity": 953.91, "train_sortino": 0.0008, "train_return_pct": -4.61, "train_max_dd": 23.04, "train_win_rate": 50.11, "train_profit_factor": 1.0, "train_ic": 0.0131, "train_hit": 49.86, "train_per_window": [{"fold": "all_train", "regime": "Training data", "sharpe": 0.0008, "sortino": 0.0008, "return_pct": -4.61, "equity": 953.91, "max_dd": 23.04, "win_rate": 50.11, "profit_factor": 1.0, "ic": 0.0131, "hit": 49.86, "n": 1382}], "experiment_num": 24, "status": "DISCARD"}
{"backbone": "lfm2-350m", "description": "H-Exp3: lr=3e-5 stronger mean signal", "config": {"seq_len": 60, "lr": 3e-05, "batch_size": 32, "epochs": 20, "weight_decay": 1e-05, "patience": 5, "grad_clip": 1.0, "warmup_epochs": 0, "huber_delta": 1.0, "head_dropout": 0.1}, "composite": -0.2489, "test_pos_folds": 4, "val_pos_folds": 5, "val_loss": -1.498637, "elapsed_sec": 276.4, "timestamp": "2026-04-12T08:54:48", "sharpe": 0.2511, "psr": 0.6533, "equity": 1048.75, "sortino": 0.3751, "return_pct": 4.88, "max_dd": 11.87, "win_rate": 51.86, "profit_factor": 1.043, "ic": 0.0395, "hit": 51.52, "aleatoric_mean": 0.106116, "epistemic_mean": 0.008804, "confidence_mean": 0.9045, "per_window": [{"fold": "fold_1", "regime": "Pre-crisis upturn + GFC onset", "sharpe": 2.4849, "sortino": 4.2663, "return_pct": 5.22, "equity": 1052.19, "max_dd": 2.26, "win_rate": 65.38, "profit_factor": 1.464, "ic": 0.1867, "hit": 64.15, "n": 53, "aleatoric_mean": 0.189694, "epistemic_mean": 0.007784, "confidence_mean": 0.8415, "aleatoric_std": 0.112484, "epistemic_std": 0.003192}, {"fold": "fold_2", "regime": "Post-crash recovery", "sharpe": -1.37, "sortino": -2.297, "return_pct": -4.0, "equity": 960.0, "max_dd": 6.84, "win_rate": 43.86, "profit_factor": 0.803, "ic": -0.144, "hit": 43.86, "n": 57, "aleatoric_mean": 0.250357, "epistemic_mean": 0.00851, "confidence_mean": 0.813, "aleatoric_std": 0.207868, "epistemic_std": 0.003901}, {"fold": "fold_3", "regime": "Eurozone debt plateau", "sharpe": -2.0704, "sortino": -3.2882, "return_pct": -3.65, "equity": 963.55, "max_dd": 6.27, "win_rate": 38.89, "profit_factor": 0.719, "ic": -0.1852, "hit": 37.5, "n": 56, "aleatoric_mean": 0.116553, "epistemic_mean": 0.008033, "confidence_mean": 0.8927, "aleatoric_std": 0.075696, "epistemic_std": 0.003925}, {"fold": "fold_4", "regime": "Strong USD downturn", "sharpe": 1.701, "sortino": 3.3786, "return_pct": 8.64, "equity": 1086.39, "max_dd": 3.31, "win_rate": 52.14, "profit_factor": 1.33, "ic": 0.1778, "hit": 51.69, "n": 118, "aleatoric_mean": 0.089654, "epistemic_mean": 0.009048, "confidence_mean": 0.9145, "aleatoric_std": 0.08241, "epistemic_std": 0.004418}, {"fold": "fold_5", "regime": "Low-vol plateau", "sharpe": 0.7351, "sortino": 1.095, "return_pct": 1.61, "equity": 1016.1, "max_dd": 4.22, "win_rate": 52.68, "profit_factor": 1.13, "ic": 0.0629, "hit": 52.68, "n": 112, "aleatoric_mean": 0.048529, "epistemic_mean": 0.009643, "confidence_mean": 0.9464, "aleatoric_std": 0.043847, "epistemic_std": 0.003714}, {"fold": "fold_6", "regime": "EUR crisis downturn", "sharpe": 0.6535, "sortino": 0.9745, "return_pct": 2.76, "equity": 1027.57, "max_dd": 7.33, "win_rate": 57.39, "profit_factor": 1.109, "ic": 0.0857, "hit": 57.39, "n": 115, "aleatoric_mean": 0.12983, "epistemic_mean": 0.006842, "confidence_mean": 0.8849, "aleatoric_std": 0.092919, "epistemic_std": 0.003398}, {"fold": "fold_7", "regime": "Recent mixed/upturn", "sharpe": -1.1978, "sortino": -1.4876, "return_pct": -5.0, "equity": 949.95, "max_dd": 5.94, "win_rate": 49.11, "profit_factor": 0.814, "ic": -0.1106, "hit": 49.11, "n": 112, "aleatoric_mean": 0.038521, "epistemic_mean": 0.010743, "confidence_mean": 0.9545, "aleatoric_std": 0.0443, "epistemic_std": 0.004554}], "val_sharpe": 1.5538, "val_psr": 0.9779, "val_equity": 1207.98, "val_sortino": 2.536, "val_return_pct": 20.8, "val_max_dd": 4.99, "val_win_rate": 52.64, "val_profit_factor": 1.296, "val_ic": 0.1079, "val_hit": 52.39, "val_aleatoric_mean": 0.106346, "val_epistemic_mean": 0.00968, "val_confidence_mean": 0.909, "val_per_window": [{"fold": "fold_1", "regime": "Pre-crisis upturn + GFC onset", "sharpe": -1.0201, "sortino": -1.7401, "return_pct": -1.65, "equity": 983.46, "max_dd": 3.94, "win_rate": 41.38, "profit_factor": 0.845, "ic": -0.0664, "hit": 40.68, "n": 59, "aleatoric_mean": 0.296683, "epistemic_mean": 0.008284, "confidence_mean": 0.8015, "aleatoric_std": 0.296842, "epistemic_std": 0.004934}, {"fold": "fold_2", "regime": "Post-crash recovery", "sharpe": -0.2453, "sortino": -0.3764, "return_pct": -0.56, "equity": 994.37, "max_dd": 3.0, "win_rate": 50.0, "profit_factor": 0.961, "ic": 0.0773, "hit": 50.0, "n": 58, "aleatoric_mean": 0.191753, "epistemic_mean": 0.006673, "confidence_mean": 0.8428, "aleatoric_std": 0.127718, "epistemic_std": 0.002823}, {"fold": "fold_3", "regime": "Eurozone debt plateau", "sharpe": 2.1363, "sortino": 3.8266, "return_pct": 5.01, "equity": 1050.1, "max_dd": 4.99, "win_rate": 57.38, "profit_factor": 1.428, "ic": 0.234, "hit": 57.38, "n": 61, "aleatoric_mean": 0.05464, "epistemic_mean": 0.011464, "confidence_mean": 0.9396, "aleatoric_std": 0.046869, "epistemic_std": 0.005043}, {"fold": "fold_4", "regime": "Strong USD downturn", "sharpe": 2.8858, "sortino": 4.801, "return_pct": 6.31, "equity": 1063.08, "max_dd": 1.83, "win_rate": 60.0, "profit_factor": 1.557, "ic": 0.266, "hit": 60.0, "n": 60, "aleatoric_mean": 0.053916, "epistemic_mean": 0.010574, "confidence_mean": 0.9406, "aleatoric_std": 0.04055, "epistemic_std": 0.003994}, {"fold": "fold_5", "regime": "Low-vol plateau", "sharpe": 1.3171, "sortino": 2.2945, "return_pct": 2.24, "equity": 1022.44, "max_dd": 4.44, "win_rate": 50.0, "profit_factor": 1.238, "ic": 0.1275, "hit": 50.0, "n": 62, "aleatoric_mean": 0.03416, "epistemic_mean": 0.010101, "confidence_mean": 0.9582, "aleatoric_std": 0.026545, "epistemic_std": 0.00416}, {"fold": "fold_6", "regime": "EUR crisis downturn", "sharpe": 5.6134, "sortino": 16.9225, "return_pct": 5.65, "equity": 1056.53, "max_dd": 0.94, "win_rate": 59.65, "profit_factor": 2.531, "ic": 0.2266, "hit": 58.62, "n": 58, "aleatoric_mean": 0.024893, "epistemic_mean": 0.010983, "confidence_mean": 0.9655, "aleatoric_std": 0.015408, "epistemic_std": 0.003759}, {"fold": "fold_7", "regime": "Recent mixed/upturn", "sharpe": 1.9196, "sortino": 4.1409, "return_pct": 2.43, "equity": 1024.33, "max_dd": 1.78, "win_rate": 50.0, "profit_factor": 1.368, "ic": -0.1843, "hit": 50.0, "n": 60, "aleatoric_mean": 0.094949, "epistemic_mean": 0.009556, "confidence_mean": 0.9109, "aleatoric_std": 0.0999, "epistemic_std": 0.004377}], "train_sharpe": 0.9183, "train_psr": 0.9662, "train_equity": 1834.54, "train_sortino": 0.9686, "train_return_pct": 83.45, "train_max_dd": 18.31, "train_win_rate": 54.55, "train_profit_factor": 1.236, "train_ic": 0.1488, "train_hit": 54.27, "train_per_window": [{"fold": "all_train", "regime": "Training data", "sharpe": 0.9183, "sortino": 0.9686, "return_pct": 83.45, "equity": 1834.54, "max_dd": 18.31, "win_rate": 54.55, "profit_factor": 1.236, "ic": 0.1488, "hit": 54.27, "n": 1382}], "experiment_num": 25, "status": "DISCARD"}
