{"backbone": "catboost", "description": "catboost: Exp5 depth=4 iter=3000", "config": {"seq_len": 10, "lr": 0.0003, "batch_size": 32, "epochs": 20, "weight_decay": 1e-05, "patience": 5, "grad_clip": 1.0, "warmup_epochs": 0, "huber_delta": 1.0, "head_dropout": 0.1, "seed": 42, "gbm_lr": 0.01, "iterations": 3000, "depth": 4, "het_loss": false}, "composite": 7.863, "test_pos_folds": 7, "val_pos_folds": 6, "val_loss": 0.0, "elapsed_sec": 382.6, "timestamp": "2026-04-21T09:36:04", "sharpe": 7.963, "psr": 1.0, "equity": 19235.12, "sortino": 7.825, "return_pct": 1823.51, "max_dd": 7.54, "win_rate": 78.84, "profit_factor": 4.839, "ic": 0.6971, "hit": 78.52, "precision": 0.81, "recall": 0.7443, "f1": 0.7757, "f2": 0.7566, "mcc": 0.5759, "accuracy": 0.7873, "per_window": [{"fold": "fold_1", "regime": "Pre-crisis upturn + GFC onset", "sharpe": 0.3306, "sortino": 0.3714, "return_pct": 1.83, "equity": 1018.33, "max_dd": 7.54, "win_rate": 50.0, "profit_factor": 1.081, "ic": 0.1959, "hit": 49.51, "n": 103, "precision": 0.5385, "recall": 0.2642, "f1": 0.3544, "f2": 0.2941, "mcc": 0.0278, "accuracy": 0.5049, "tp": 14, "fp": 12, "tn": 38, "fn": 39}, {"fold": "fold_2", "regime": "Post-crash recovery", "sharpe": 1.2839, "sortino": 2.26, "return_pct": 6.05, "equity": 1060.48, "max_dd": 5.68, "win_rate": 54.21, "profit_factor": 1.223, "ic": -0.0103, "hit": 54.21, "n": 107, "precision": 0.5238, "recall": 0.4314, "f1": 0.4731, "f2": 0.4472, "mcc": 0.0759, "accuracy": 0.5421, "tp": 22, "fp": 20, "tn": 36, "fn": 29}, {"fold": "fold_3", "regime": "Eurozone debt plateau", "sharpe": 13.9916, "sortino": 23.5773, "return_pct": 44.94, "equity": 1449.36, "max_dd": 1.32, "win_rate": 84.62, "profit_factor": 10.352, "ic": 0.8073, "hit": 83.02, "n": 106, "precision": 0.8679, "recall": 0.807, "f1": 0.8364, "f2": 0.8185, "mcc": 0.6623, "accuracy": 0.8302, "tp": 46, "fp": 7, "tn": 42, "fn": 11}, {"fold": "fold_4", "regime": "Strong USD downturn", "sharpe": 16.4696, "sortino": 44.6822, "return_pct": 142.27, "equity": 2422.7, "max_dd": 0.56, "win_rate": 94.61, "profit_factor": 48.848, "ic": 0.9036, "hit": 94.05, "n": 168, "precision": 0.9639, "recall": 0.9302, "f1": 0.9467, "f2": 0.9368, "mcc": 0.8935, "accuracy": 0.9464, "tp": 80, "fp": 3, "tn": 79, "fn": 6}, {"fold": "fold_5", "regime": "Low-vol plateau", "sharpe": 15.0464, "sortino": 69.7052, "return_pct": 43.79, "equity": 1437.85, "max_dd": 0.23, "win_rate": 83.95, "profit_factor": 20.797, "ic": 0.9128, "hit": 83.95, "n": 162, "precision": 0.8125, "recall": 0.8553, "f1": 0.8333, "f2": 0.8464, "mcc": 0.6796, "accuracy": 0.8395, "tp": 65, "fp": 15, "tn": 71, "fn": 11}, {"fold": "fold_6", "regime": "EUR crisis downturn", "sharpe": 15.139, "sortino": 60.6836, "return_pct": 98.78, "equity": 1987.79, "max_dd": 0.43, "win_rate": 82.42, "profit_factor": 16.41, "ic": 0.8791, "hit": 82.42, "n": 165, "precision": 0.8158, "recall": 0.8052, "f1": 0.8105, "f2": 0.8073, "mcc": 0.6467, "accuracy": 0.8242, "tp": 62, "fp": 14, "tn": 74, "fn": 15}, {"fold": "fold_7", "regime": "Recent mixed/upturn", "sharpe": 12.1876, "sortino": 16.1091, "return_pct": 77.48, "equity": 1774.77, "max_dd": 1.64, "win_rate": 84.57, "profit_factor": 9.902, "ic": 0.8406, "hit": 84.57, "n": 162, "precision": 0.8415, "recall": 0.8519, "f1": 0.8466, "f2": 0.8498, "mcc": 0.6914, "accuracy": 0.8457, "tp": 69, "fp": 13, "tn": 68, "fn": 12}], "val_sharpe": 8.0526, "val_psr": 1.0, "val_equity": 5454.44, "val_sortino": 9.9904, "val_return_pct": 445.44, "val_max_dd": 11.29, "val_win_rate": 75.75, "val_profit_factor": 4.084, "val_ic": 0.6829, "val_hit": 75.26, "val_precision": 0.7228, "val_recall": 0.8, "val_f1": 0.7594, "val_f2": 0.7833, "val_mcc": 0.5222, "val_accuracy": 0.7591, "val_per_window": [{"fold": "fold_1", "regime": "Pre-crisis upturn + GFC onset", "sharpe": 1.7234, "sortino": 3.0291, "return_pct": 4.34, "equity": 1043.45, "max_dd": 4.12, "win_rate": 49.07, "profit_factor": 1.331, "ic": 0.0706, "hit": 48.62, "n": 109, "precision": 0.5, "recall": 0.8364, "f1": 0.6259, "f2": 0.7372, "mcc": -0.0213, "accuracy": 0.4954, "tp": 46, "fp": 46, "tn": 8, "fn": 9}, {"fold": "fold_2", "regime": "Post-crash recovery", "sharpe": -1.4709, "sortino": -2.3103, "return_pct": -7.12, "equity": 928.79, "max_dd": 11.29, "win_rate": 46.3, "profit_factor": 0.793, "ic": -0.0783, "hit": 46.3, "n": 108, "precision": 0.5455, "recall": 0.4762, "f1": 0.5085, "f2": 0.4886, "mcc": -0.0783, "accuracy": 0.463, "tp": 30, "fp": 25, "tn": 20, "fn": 33}, {"fold": "fold_3", "regime": "Eurozone debt plateau", "sharpe": 14.8505, "sortino": 31.8802, "return_pct": 54.78, "equity": 1547.83, "max_dd": 0.7, "win_rate": 86.24, "profit_factor": 15.62, "ic": 0.8521, "hit": 84.68, "n": 111, "precision": 0.8077, "recall": 0.8936, "f1": 0.8485, "f2": 0.875, "mcc": 0.7301, "accuracy": 0.8649, "tp": 42, "fp": 10, "tn": 54, "fn": 5}, {"fold": "fold_4", "regime": "Strong USD downturn", "sharpe": 16.3668, "sortino": 52.869, "return_pct": 48.39, "equity": 1483.94, "max_dd": 0.64, "win_rate": 90.83, "profit_factor": 33.631, "ic": 0.9311, "hit": 90.0, "n": 110, "precision": 0.9302, "recall": 0.8511, "f1": 0.8889, "f2": 0.8658, "mcc": 0.8145, "accuracy": 0.9091, "tp": 40, "fp": 3, "tn": 60, "fn": 7}, {"fold": "fold_5", "regime": "Low-vol plateau", "sharpe": 15.3528, "sortino": 72.5635, "return_pct": 44.36, "equity": 1443.63, "max_dd": 0.25, "win_rate": 83.93, "profit_factor": 23.028, "ic": 0.9208, "hit": 83.93, "n": 112, "precision": 0.8182, "recall": 0.8491, "f1": 0.8333, "f2": 0.8427, "mcc": 0.6787, "accuracy": 0.8393, "tp": 45, "fp": 10, "tn": 49, "fn": 8}, {"fold": "fold_6", "regime": "EUR crisis downturn", "sharpe": 15.7595, "sortino": 102.738, "return_pct": 29.12, "equity": 1291.17, "max_dd": 0.15, "win_rate": 87.85, "profit_factor": 32.784, "ic": 0.9325, "hit": 87.04, "n": 108, "precision": 0.84, "recall": 0.8936, "f1": 0.866, "f2": 0.8824, "mcc": 0.7581, "accuracy": 0.8796, "tp": 42, "fp": 8, "tn": 53, "fn": 5}, {"fold": "fold_7", "regime": "Recent mixed/upturn", "sharpe": 16.4525, "sortino": 67.5308, "return_pct": 31.46, "equity": 1314.58, "max_dd": 0.23, "win_rate": 85.45, "profit_factor": 23.364, "ic": 0.8915, "hit": 85.45, "n": 110, "precision": 0.8246, "recall": 0.8868, "f1": 0.8545, "f2": 0.8736, "mcc": 0.7114, "accuracy": 0.8545, "tp": 47, "fp": 10, "tn": 47, "fn": 6}], "train_sharpe": 9.6241, "train_psr": 1.0, "train_equity": 22621990.0, "train_sortino": 42.9324, "train_return_pct": 2262099.0, "train_max_dd": 2.83, "train_win_rate": 85.37, "train_profit_factor": 18.794, "train_ic": 0.8821, "train_hit": 85.03, "train_precision": 0.8462, "train_recall": 0.8721, "train_f1": 0.8589, "train_f2": 0.8667, "train_mcc": 0.7053, "train_accuracy": 0.8527, "train_per_window": [{"fold": "all_train", "regime": "Training data", "sharpe": 9.6241, "sortino": 42.9324, "return_pct": 2262099.0, "equity": 22621990.0, "max_dd": 2.83, "win_rate": 85.37, "profit_factor": 18.794, "ic": 0.8821, "hit": 85.03, "n": 2478, "precision": 0.8462, "recall": 0.8721, "f1": 0.8589, "f2": 0.8667, "mcc": 0.7053, "accuracy": 0.8527, "tp": 1111, "fp": 202, "tn": 1002, "fn": 163}], "experiment_num": 226, "status": "DISCARD"}
{"backbone": "catboost", "description": "catboost: Exp6 seq_len=20", "config": {"seq_len": 20, "lr": 0.0003, "batch_size": 32, "epochs": 20, "weight_decay": 1e-05, "patience": 5, "grad_clip": 1.0, "warmup_epochs": 0, "huber_delta": 1.0, "head_dropout": 0.1, "seed": 42, "gbm_lr": 0.01, "depth": 4, "het_loss": false}, "composite": 7.6848, "test_pos_folds": 6, "val_pos_folds": 6, "val_loss": 0.0, "elapsed_sec": 496.9, "timestamp": "2026-04-21T09:44:31", "sharpe": 7.8848, "psr": 1.0, "equity": 15928.64, "sortino": 7.6469, "return_pct": 1492.86, "max_dd": 7.54, "win_rate": 78.87, "profit_factor": 4.817, "ic": 0.7026, "hit": 78.52, "precision": 0.7929, "recall": 0.7624, "f1": 0.7774, "f2": 0.7684, "mcc": 0.5724, "accuracy": 0.7863, "per_window": [{"fold": "fold_1", "regime": "Pre-crisis upturn + GFC onset", "sharpe": -0.0977, "sortino": -0.1121, "return_pct": -1.41, "equity": 985.92, "max_dd": 7.54, "win_rate": 46.74, "profit_factor": 0.977, "ic": 0.048, "hit": 46.24, "n": 93, "precision": 0.475, "recall": 0.3958, "f1": 0.4318, "f2": 0.4095, "mcc": -0.0715, "accuracy": 0.4624, "tp": 19, "fp": 21, "tn": 24, "fn": 29}, {"fold": "fold_2", "regime": "Post-crash recovery", "sharpe": 0.6753, "sortino": 1.2075, "return_pct": 2.78, "equity": 1027.8, "max_dd": 4.45, "win_rate": 51.55, "profit_factor": 1.111, "ic": -0.0088, "hit": 51.55, "n": 97, "precision": 0.5, "recall": 0.4043, "f1": 0.4471, "f2": 0.4204, "mcc": 0.0248, "accuracy": 0.5155, "tp": 19, "fp": 19, "tn": 31, "fn": 28}, {"fold": "fold_3", "regime": "Eurozone debt plateau", "sharpe": 15.5209, "sortino": 25.5081, "return_pct": 43.89, "equity": 1438.86, "max_dd": 1.32, "win_rate": 87.23, "profit_factor": 14.463, "ic": 0.8215, "hit": 85.42, "n": 96, "precision": 0.875, "recall": 0.84, "f1": 0.8571, "f2": 0.8468, "mcc": 0.7089, "accuracy": 0.8542, "tp": 42, "fp": 6, "tn": 40, "fn": 8}, {"fold": "fold_4", "regime": "Strong USD downturn", "sharpe": 16.0198, "sortino": 51.03, "return_pct": 130.0, "equity": 2300.0, "max_dd": 0.56, "win_rate": 91.72, "profit_factor": 39.306, "ic": 0.8961, "hit": 91.14, "n": 158, "precision": 0.9342, "recall": 0.8987, "f1": 0.9161, "f2": 0.9056, "mcc": 0.836, "accuracy": 0.9177, "tp": 71, "fp": 5, "tn": 74, "fn": 8}, {"fold": "fold_5", "regime": "Low-vol plateau", "sharpe": 15.2944, "sortino": 68.6741, "return_pct": 40.13, "equity": 1401.29, "max_dd": 0.23, "win_rate": 84.87, "profit_factor": 22.179, "ic": 0.9149, "hit": 84.87, "n": 152, "precision": 0.8133, "recall": 0.8714, "f1": 0.8414, "f2": 0.8592, "mcc": 0.6986, "accuracy": 0.8487, "tp": 61, "fp": 14, "tn": 68, "fn": 9}, {"fold": "fold_6", "regime": "EUR crisis downturn", "sharpe": 14.6227, "sortino": 43.3048, "return_pct": 90.31, "equity": 1903.06, "max_dd": 0.76, "win_rate": 81.29, "profit_factor": 14.146, "ic": 0.8833, "hit": 81.29, "n": 155, "precision": 0.8028, "recall": 0.7917, "f1": 0.7972, "f2": 0.7939, "mcc": 0.6236, "accuracy": 0.8129, "tp": 57, "fp": 14, "tn": 69, "fn": 15}, {"fold": "fold_7", "regime": "Recent mixed/upturn", "sharpe": 13.6471, "sortino": 15.0752, "return_pct": 78.11, "equity": 1781.15, "max_dd": 1.64, "win_rate": 88.82, "profit_factor": 14.346, "ic": 0.8684, "hit": 88.82, "n": 152, "precision": 0.8831, "recall": 0.8947, "f1": 0.8889, "f2": 0.8924, "mcc": 0.7764, "accuracy": 0.8882, "tp": 68, "fp": 9, "tn": 67, "fn": 8}], "val_sharpe": 8.5376, "val_psr": 1.0, "val_equity": 5062.14, "val_sortino": 11.1872, "val_return_pct": 406.21, "val_max_dd": 8.69, "val_win_rate": 76.77, "val_profit_factor": 4.461, "val_ic": 0.689, "val_hit": 76.22, "val_precision": 0.7278, "val_recall": 0.8182, "val_f1": 0.7703, "val_f2": 0.7983, "val_mcc": 0.544, "val_accuracy": 0.7693, "val_per_window": [{"fold": "fold_1", "regime": "Pre-crisis upturn + GFC onset", "sharpe": 0.7722, "sortino": 1.4047, "return_pct": 1.75, "equity": 1017.51, "max_dd": 4.11, "win_rate": 44.9, "profit_factor": 1.137, "ic": 0.0407, "hit": 44.44, "n": 99, "precision": 0.4675, "recall": 0.7347, "f1": 0.5714, "f2": 0.6593, "mcc": -0.1026, "accuracy": 0.4545, "tp": 36, "fp": 41, "tn": 9, "fn": 13}, {"fold": "fold_2", "regime": "Post-crash recovery", "sharpe": -0.4632, "sortino": -0.7387, "return_pct": -2.16, "equity": 978.4, "max_dd": 8.69, "win_rate": 47.96, "profit_factor": 0.929, "ic": -0.0705, "hit": 47.96, "n": 98, "precision": 0.55, "recall": 0.5789, "f1": 0.5641, "f2": 0.5729, "mcc": -0.0806, "accuracy": 0.4796, "tp": 33, "fp": 27, "tn": 14, "fn": 24}, {"fold": "fold_3", "regime": "Eurozone debt plateau", "sharpe": 15.5403, "sortino": 30.9769, "return_pct": 52.2, "equity": 1522.04, "max_dd": 0.7, "win_rate": 86.87, "profit_factor": 19.318, "ic": 0.8557, "hit": 85.15, "n": 101, "precision": 0.7872, "recall": 0.925, "f1": 0.8506, "f2": 0.8937, "mcc": 0.7462, "accuracy": 0.8713, "tp": 37, "fp": 10, "tn": 51, "fn": 3}, {"fold": "fold_4", "regime": "Strong USD downturn", "sharpe": 16.987, "sortino": 52.4305, "return_pct": 46.1, "equity": 1461.03, "max_dd": 0.64, "win_rate": 90.91, "profit_factor": 37.352, "ic": 0.937, "hit": 90.0, "n": 100, "precision": 0.9487, "recall": 0.8409, "f1": 0.8916, "f2": 0.8605, "mcc": 0.8195, "accuracy": 0.91, "tp": 37, "fp": 2, "tn": 54, "fn": 7}, {"fold": "fold_5", "regime": "Low-vol plateau", "sharpe": 15.7313, "sortino": 81.7554, "return_pct": 41.02, "equity": 1410.16, "max_dd": 0.25, "win_rate": 88.24, "profit_factor": 30.005, "ic": 0.9153, "hit": 88.24, "n": 102, "precision": 0.8491, "recall": 0.9184, "f1": 0.8824, "f2": 0.9036, "mcc": 0.7674, "accuracy": 0.8824, "tp": 45, "fp": 8, "tn": 45, "fn": 4}, {"fold": "fold_6", "regime": "EUR crisis downturn", "sharpe": 16.7989, "sortino": 109.2324, "return_pct": 27.2, "equity": 1271.98, "max_dd": 0.15, "win_rate": 91.75, "profit_factor": 57.23, "ic": 0.937, "hit": 90.82, "n": 98, "precision": 0.8864, "recall": 0.9286, "f1": 0.907, "f2": 0.9198, "mcc": 0.835, "accuracy": 0.9184, "tp": 39, "fp": 5, "tn": 51, "fn": 3}, {"fold": "fold_7", "regime": "Recent mixed/upturn", "sharpe": 15.6171, "sortino": 36.2363, "return_pct": 27.48, "equity": 1274.81, "max_dd": 0.5, "win_rate": 86.0, "profit_factor": 17.819, "ic": 0.8929, "hit": 86.0, "n": 100, "precision": 0.8431, "recall": 0.8776, "f1": 0.86, "f2": 0.8704, "mcc": 0.7207, "accuracy": 0.86, "tp": 43, "fp": 8, "tn": 43, "fn": 6}], "train_sharpe": 9.1837, "train_psr": 1.0, "train_equity": 7393252.0, "train_sortino": 38.2743, "train_return_pct": 739225.2, "train_max_dd": 2.28, "train_win_rate": 84.26, "train_profit_factor": 15.895, "train_ic": 0.8583, "train_hit": 83.88, "train_precision": 0.8368, "train_recall": 0.8566, "train_f1": 0.8466, "train_f2": 0.8526, "train_mcc": 0.682, "train_accuracy": 0.8411, "train_per_window": [{"fold": "all_train", "regime": "Training data", "sharpe": 9.1837, "sortino": 38.2743, "return_pct": 739225.2, "equity": 7393252.0, "max_dd": 2.28, "win_rate": 84.26, "profit_factor": 15.895, "ic": 0.8583, "hit": 83.88, "n": 2221, "precision": 0.8368, "recall": 0.8566, "f1": 0.8466, "f2": 0.8526, "mcc": 0.682, "accuracy": 0.8411, "tp": 974, "fp": 190, "tn": 894, "fn": 163}], "experiment_num": 227, "status": "DISCARD"}
{"backbone": "catboost", "description": "catboost: Exp7 l2_leaf_reg=1", "config": {"seq_len": 10, "lr": 0.0003, "batch_size": 32, "epochs": 20, "weight_decay": 1e-05, "patience": 5, "grad_clip": 1.0, "warmup_epochs": 0, "huber_delta": 1.0, "head_dropout": 0.1, "seed": 42, "gbm_lr": 0.01, "depth": 4, "l2_leaf_reg": 1.0, "het_loss": false}, "composite": 8.0341, "test_pos_folds": 7, "val_pos_folds": 6, "val_loss": 0.0, "elapsed_sec": 254.0, "timestamp": "2026-04-21T09:48:55", "sharpe": 8.1341, "psr": 1.0, "equity": 20238.02, "sortino": 7.9681, "return_pct": 1923.8, "max_dd": 7.54, "win_rate": 78.95, "profit_factor": 5.037, "ic": 0.6969, "hit": 78.62, "precision": 0.8049, "recall": 0.7547, "f1": 0.779, "f2": 0.7642, "mcc": 0.5773, "accuracy": 0.7883, "per_window": [{"fold": "fold_1", "regime": "Pre-crisis upturn + GFC onset", "sharpe": 0.4645, "sortino": 0.5168, "return_pct": 2.89, "equity": 1028.89, "max_dd": 7.54, "win_rate": 50.98, "profit_factor": 1.116, "ic": 0.2011, "hit": 50.49, "n": 103, "precision": 0.5556, "recall": 0.283, "f1": 0.375, "f2": 0.3138, "mcc": 0.0489, "accuracy": 0.5146, "tp": 15, "fp": 12, "tn": 38, "fn": 38}, {"fold": "fold_2", "regime": "Post-crash recovery", "sharpe": 2.1301, "sortino": 3.6635, "return_pct": 10.37, "equity": 1103.67, "max_dd": 3.43, "win_rate": 57.01, "profit_factor": 1.396, "ic": -0.0002, "hit": 57.01, "n": 107, "precision": 0.551, "recall": 0.5294, "f1": 0.54, "f2": 0.5336, "mcc": 0.1369, "accuracy": 0.5701, "tp": 27, "fp": 22, "tn": 34, "fn": 24}, {"fold": "fold_3", "regime": "Eurozone debt plateau", "sharpe": 15.1083, "sortino": 24.8273, "return_pct": 47.26, "equity": 1472.58, "max_dd": 1.32, "win_rate": 86.54, "profit_factor": 13.179, "ic": 0.8105, "hit": 84.91, "n": 106, "precision": 0.8868, "recall": 0.8246, "f1": 0.8545, "f2": 0.8363, "mcc": 0.7001, "accuracy": 0.8491, "tp": 47, "fp": 6, "tn": 43, "fn": 10}, {"fold": "fold_4", "regime": "Strong USD downturn", "sharpe": 16.0159, "sortino": 42.9709, "return_pct": 139.37, "equity": 2393.67, "max_dd": 0.56, "win_rate": 92.81, "profit_factor": 36.641, "ic": 0.8981, "hit": 92.26, "n": 168, "precision": 0.9405, "recall": 0.9186, "f1": 0.9294, "f2": 0.9229, "mcc": 0.8574, "accuracy": 0.9286, "tp": 79, "fp": 5, "tn": 77, "fn": 7}, {"fold": "fold_5", "regime": "Low-vol plateau", "sharpe": 15.0464, "sortino": 69.7052, "return_pct": 43.79, "equity": 1437.85, "max_dd": 0.23, "win_rate": 83.95, "profit_factor": 20.797, "ic": 0.9121, "hit": 83.95, "n": 162, "precision": 0.8125, "recall": 0.8553, "f1": 0.8333, "f2": 0.8464, "mcc": 0.6796, "accuracy": 0.8395, "tp": 65, "fp": 15, "tn": 71, "fn": 11}, {"fold": "fold_6", "regime": "EUR crisis downturn", "sharpe": 14.4094, "sortino": 43.0168, "return_pct": 95.23, "equity": 1952.26, "max_dd": 0.76, "win_rate": 81.21, "profit_factor": 13.492, "ic": 0.8805, "hit": 81.21, "n": 165, "precision": 0.8026, "recall": 0.7922, "f1": 0.7974, "f2": 0.7943, "mcc": 0.6223, "accuracy": 0.8121, "tp": 61, "fp": 15, "tn": 73, "fn": 16}, {"fold": "fold_7", "regime": "Recent mixed/upturn", "sharpe": 12.6962, "sortino": 18.4069, "return_pct": 80.12, "equity": 1801.21, "max_dd": 1.64, "win_rate": 84.57, "profit_factor": 11.307, "ic": 0.8424, "hit": 84.57, "n": 162, "precision": 0.8415, "recall": 0.8519, "f1": 0.8466, "f2": 0.8498, "mcc": 0.6914, "accuracy": 0.8457, "tp": 69, "fp": 13, "tn": 68, "fn": 12}], "val_sharpe": 8.2657, "val_psr": 1.0, "val_equity": 5652.21, "val_sortino": 10.1997, "val_return_pct": 465.22, "val_max_dd": 10.75, "val_win_rate": 76.54, "val_profit_factor": 4.253, "val_ic": 0.6805, "val_hit": 76.04, "val_precision": 0.7273, "val_recall": 0.811, "val_f1": 0.7668, "val_f2": 0.7927, "val_mcc": 0.5358, "val_accuracy": 0.7656, "val_per_window": [{"fold": "fold_1", "regime": "Pre-crisis upturn + GFC onset", "sharpe": 1.7118, "sortino": 3.0135, "return_pct": 4.31, "equity": 1043.15, "max_dd": 4.05, "win_rate": 49.07, "profit_factor": 1.328, "ic": 0.0325, "hit": 48.62, "n": 109, "precision": 0.4945, "recall": 0.8182, "f1": 0.6164, "f2": 0.7235, "mcc": -0.0453, "accuracy": 0.4862, "tp": 45, "fp": 46, "tn": 8, "fn": 10}, {"fold": "fold_2", "regime": "Post-crash recovery", "sharpe": -0.7965, "sortino": -1.2512, "return_pct": -4.05, "equity": 959.46, "max_dd": 10.75, "win_rate": 50.0, "profit_factor": 0.882, "ic": -0.0871, "hit": 50.0, "n": 108, "precision": 0.5789, "recall": 0.5238, "f1": 0.55, "f2": 0.534, "mcc": -0.0094, "accuracy": 0.5, "tp": 33, "fp": 24, "tn": 21, "fn": 30}, {"fold": "fold_3", "regime": "Eurozone debt plateau", "sharpe": 14.8341, "sortino": 32.0143, "return_pct": 54.74, "equity": 1547.43, "max_dd": 0.7, "win_rate": 85.32, "profit_factor": 15.549, "ic": 0.8528, "hit": 83.78, "n": 111, "precision": 0.7925, "recall": 0.8936, "f1": 0.84, "f2": 0.8714, "mcc": 0.714, "accuracy": 0.8559, "tp": 42, "fp": 11, "tn": 53, "fn": 5}, {"fold": "fold_4", "regime": "Strong USD downturn", "sharpe": 16.5986, "sortino": 50.5375, "return_pct": 48.79, "equity": 1487.94, "max_dd": 0.64, "win_rate": 91.74, "profit_factor": 37.945, "ic": 0.9306, "hit": 90.91, "n": 110, "precision": 0.9524, "recall": 0.8511, "f1": 0.8989, "f2": 0.8696, "mcc": 0.8342, "accuracy": 0.9182, "tp": 40, "fp": 2, "tn": 61, "fn": 7}, {"fold": "fold_5", "regime": "Low-vol plateau", "sharpe": 15.4638, "sortino": 71.0234, "return_pct": 44.56, "equity": 1445.6, "max_dd": 0.25, "win_rate": 84.82, "profit_factor": 24.053, "ic": 0.921, "hit": 84.82, "n": 112, "precision": 0.8214, "recall": 0.8679, "f1": 0.844, "f2": 0.8582, "mcc": 0.6974, "accuracy": 0.8482, "tp": 46, "fp": 10, "tn": 49, "fn": 7}, {"fold": "fold_6", "regime": "EUR crisis downturn", "sharpe": 16.0045, "sortino": 104.0188, "return_pct": 29.37, "equity": 1293.73, "max_dd": 0.15, "win_rate": 88.79, "profit_factor": 37.522, "ic": 0.9326, "hit": 87.96, "n": 108, "precision": 0.8431, "recall": 0.9149, "f1": 0.8776, "f2": 0.8996, "mcc": 0.7783, "accuracy": 0.8889, "tp": 43, "fp": 8, "tn": 53, "fn": 4}, {"fold": "fold_7", "regime": "Recent mixed/upturn", "sharpe": 16.1615, "sortino": 65.5065, "return_pct": 31.15, "equity": 1311.46, "max_dd": 0.23, "win_rate": 85.45, "profit_factor": 21.216, "ic": 0.8959, "hit": 85.45, "n": 110, "precision": 0.8246, "recall": 0.8868, "f1": 0.8545, "f2": 0.8736, "mcc": 0.7114, "accuracy": 0.8545, "tp": 47, "fp": 10, "tn": 47, "fn": 6}], "train_sharpe": 9.3175, "train_psr": 1.0, "train_equity": 17824580.0, "train_sortino": 37.033, "train_return_pct": 1782358.0, "train_max_dd": 2.7, "train_win_rate": 84.24, "train_profit_factor": 15.36, "train_ic": 0.8623, "train_hit": 83.9, "train_precision": 0.8333, "train_recall": 0.8634, "train_f1": 0.8481, "train_f2": 0.8572, "train_mcc": 0.6819, "train_accuracy": 0.841, "train_per_window": [{"fold": "all_train", "regime": "Training data", "sharpe": 9.3175, "sortino": 37.033, "return_pct": 1782358.0, "equity": 17824580.0, "max_dd": 2.7, "win_rate": 84.24, "profit_factor": 15.36, "ic": 0.8623, "hit": 83.9, "n": 2478, "precision": 0.8333, "recall": 0.8634, "f1": 0.8481, "f2": 0.8572, "mcc": 0.6819, "accuracy": 0.841, "tp": 1100, "fp": 220, "tn": 984, "fn": 174}], "experiment_num": 228, "status": "DISCARD"}
