{"backbone": "patchtst", "description": "patchtst: Exp1 SOTA baseline lr=1e-4 ep=100 pat=20 (Nie2023)", "config": {"seq_len": 10, "lr": 0.0001, "batch_size": 32, "epochs": 100, "weight_decay": 1e-05, "patience": 20, "grad_clip": 1.0, "warmup_epochs": 0, "huber_delta": 1.0, "head_dropout": 0.15, "seed": 0, "het_loss": false}, "composite": -1.7238, "test_pos_folds": 2, "val_pos_folds": 3, "val_loss": 3.2e-05, "elapsed_sec": 419.5, "timestamp": "2026-04-19T18:29:24", "sharpe": -0.8238, "psr": 0.053, "equity": 692.71, "sortino": -1.11, "return_pct": -30.73, "max_dd": 34.99, "win_rate": 47.57, "profit_factor": 0.859, "ic": -0.0496, "hit": 47.38, "aleatoric_mean": 8e-06, "epistemic_mean": 1.6e-05, "confidence_mean": 1.0, "precision": 0.4744, "recall": 0.5198, "f1": 0.496, "f2": 0.51, "mcc": -0.0434, "accuracy": 0.4779, "per_window": [{"fold": "fold_1", "regime": "Pre-crisis upturn + GFC onset", "sharpe": -0.4237, "sortino": -0.4943, "return_pct": -3.92, "equity": 960.79, "max_dd": 9.67, "win_rate": 45.1, "profit_factor": 0.905, "ic": -0.1074, "hit": 44.66, "n": 103, "precision": 0.4681, "recall": 0.4151, "f1": 0.44, "f2": 0.4247, "mcc": -0.0852, "accuracy": 0.4563, "tp": 22, "fp": 25, "tn": 25, "fn": 31, "aleatoric_mean": 7e-06, "epistemic_mean": 1.4e-05, "confidence_mean": 1.0, "aleatoric_std": 2e-06, "epistemic_std": 5e-06}, {"fold": "fold_2", "regime": "Post-crash recovery", "sharpe": -2.316, "sortino": -3.8236, "return_pct": -10.66, "equity": 893.39, "max_dd": 12.2, "win_rate": 39.25, "profit_factor": 0.696, "ic": -0.1592, "hit": 39.25, "n": 107, "precision": 0.36, "recall": 0.3529, "f1": 0.3564, "f2": 0.3543, "mcc": -0.2187, "accuracy": 0.3925, "tp": 18, "fp": 32, "tn": 24, "fn": 33, "aleatoric_mean": 8e-06, "epistemic_mean": 1.5e-05, "confidence_mean": 1.0, "aleatoric_std": 3e-06, "epistemic_std": 6e-06}, {"fold": "fold_3", "regime": "Eurozone debt plateau", "sharpe": -0.3875, "sortino": -0.687, "return_pct": -1.51, "equity": 984.87, "max_dd": 5.29, "win_rate": 53.85, "profit_factor": 0.941, "ic": 0.0097, "hit": 52.83, "n": 106, "precision": 0.5882, "recall": 0.5263, "f1": 0.5556, "f2": 0.5376, "mcc": 0.0975, "accuracy": 0.5472, "tp": 30, "fp": 21, "tn": 28, "fn": 27, "aleatoric_mean": 8e-06, "epistemic_mean": 1.7e-05, "confidence_mean": 1.0, "aleatoric_std": 5e-06, "epistemic_std": 9e-06}, {"fold": "fold_4", "regime": "Strong USD downturn", "sharpe": -1.8426, "sortino": -2.6692, "return_pct": -13.67, "equity": 863.31, "max_dd": 18.88, "win_rate": 46.11, "profit_factor": 0.734, "ic": -0.0991, "hit": 45.83, "n": 168, "precision": 0.4767, "recall": 0.4767, "f1": 0.4767, "f2": 0.4767, "mcc": -0.072, "accuracy": 0.4643, "tp": 41, "fp": 45, "tn": 37, "fn": 45, "aleatoric_mean": 9e-06, "epistemic_mean": 1.7e-05, "confidence_mean": 1.0, "aleatoric_std": 4e-06, "epistemic_std": 8e-06}, {"fold": "fold_5", "regime": "Low-vol plateau", "sharpe": 1.8767, "sortino": 2.682, "return_pct": 6.32, "equity": 1063.17, "max_dd": 3.03, "win_rate": 58.02, "profit_factor": 1.367, "ic": 0.1789, "hit": 58.02, "n": 162, "precision": 0.5408, "recall": 0.6974, "f1": 0.6092, "f2": 0.6592, "mcc": 0.1777, "accuracy": 0.5802, "tp": 53, "fp": 45, "tn": 41, "fn": 23, "aleatoric_mean": 7e-06, "epistemic_mean": 1.4e-05, "confidence_mean": 1.0, "aleatoric_std": 3e-06, "epistemic_std": 6e-06}, {"fold": "fold_6", "regime": "EUR crisis downturn", "sharpe": -1.9172, "sortino": -3.0369, "return_pct": -11.57, "equity": 884.34, "max_dd": 15.73, "win_rate": 45.45, "profit_factor": 0.733, "ic": -0.0425, "hit": 45.45, "n": 165, "precision": 0.4381, "recall": 0.5974, "f1": 0.5055, "f2": 0.5569, "mcc": -0.0758, "accuracy": 0.4545, "tp": 46, "fp": 59, "tn": 29, "fn": 31, "aleatoric_mean": 8e-06, "epistemic_mean": 1.7e-05, "confidence_mean": 1.0, "aleatoric_std": 3e-06, "epistemic_std": 7e-06}, {"fold": "fold_7", "regime": "Recent mixed/upturn", "sharpe": 0.2052, "sortino": 0.372, "return_pct": 0.95, "equity": 1009.52, "max_dd": 6.93, "win_rate": 43.83, "profit_factor": 1.035, "ic": -0.0456, "hit": 43.83, "n": 162, "precision": 0.4444, "recall": 0.4938, "f1": 0.4678, "f2": 0.4831, "mcc": -0.1242, "accuracy": 0.4383, "tp": 40, "fp": 50, "tn": 31, "fn": 41, "aleatoric_mean": 7e-06, "epistemic_mean": 1.5e-05, "confidence_mean": 1.0, "aleatoric_std": 3e-06, "epistemic_std": 7e-06}], "val_sharpe": -0.0668, "val_psr": 0.4536, "val_equity": 975.19, "val_sortino": -0.095, "val_return_pct": -2.48, "val_max_dd": 22.1, "val_win_rate": 49.8, "val_profit_factor": 0.989, "val_ic": 0.012, "val_hit": 49.48, "val_aleatoric_mean": 8e-06, "val_epistemic_mean": 1.5e-05, "val_confidence_mean": 1.0, "val_precision": 0.4751, "val_recall": 0.5233, "val_f1": 0.498, "val_f2": 0.5129, "val_mcc": -0.0003, "val_accuracy": 0.4987, "val_per_window": [{"fold": "fold_1", "regime": "Pre-crisis upturn + GFC onset", "sharpe": -0.726, "sortino": -1.236, "return_pct": -1.89, "equity": 981.13, "max_dd": 2.77, "win_rate": 43.52, "profit_factor": 0.887, "ic": -0.1238, "hit": 43.12, "n": 109, "precision": 0.4407, "recall": 0.4727, "f1": 0.4561, "f2": 0.4659, "mcc": -0.1389, "accuracy": 0.4312, "tp": 26, "fp": 33, "tn": 21, "fn": 29, "aleatoric_mean": 8e-06, "epistemic_mean": 1.6e-05, "confidence_mean": 1.0, "aleatoric_std": 3e-06, "epistemic_std": 6e-06}, {"fold": "fold_2", "regime": "Post-crash recovery", "sharpe": -0.8521, "sortino": -1.349, "return_pct": -4.31, "equity": 956.88, "max_dd": 6.17, "win_rate": 44.44, "profit_factor": 0.874, "ic": -0.0101, "hit": 44.44, "n": 108, "precision": 0.5306, "recall": 0.4127, "f1": 0.4643, "f2": 0.4319, "mcc": -0.0975, "accuracy": 0.4444, "tp": 26, "fp": 23, "tn": 22, "fn": 37, "aleatoric_mean": 7e-06, "epistemic_mean": 1.5e-05, "confidence_mean": 1.0, "aleatoric_std": 3e-06, "epistemic_std": 6e-06}, {"fold": "fold_3", "regime": "Eurozone debt plateau", "sharpe": -1.4223, "sortino": -1.9384, "return_pct": -5.75, "equity": 942.55, "max_dd": 9.52, "win_rate": 49.54, "profit_factor": 0.794, "ic": 0.0546, "hit": 48.65, "n": 111, "precision": 0.4211, "recall": 0.5106, "f1": 0.4615, "f2": 0.4898, "mcc": -0.0049, "accuracy": 0.4955, "tp": 24, "fp": 33, "tn": 31, "fn": 23, "aleatoric_mean": 9e-06, "epistemic_mean": 1.9e-05, "confidence_mean": 1.0, "aleatoric_std": 4e-06, "epistemic_std": 9e-06}, {"fold": "fold_4", "regime": "Strong USD downturn", "sharpe": -1.9754, "sortino": -2.738, "return_pct": -6.72, "equity": 932.84, "max_dd": 7.65, "win_rate": 41.28, "profit_factor": 0.721, "ic": -0.1551, "hit": 40.91, "n": 110, "precision": 0.3509, "recall": 0.4255, "f1": 0.3846, "f2": 0.4082, "mcc": -0.1602, "accuracy": 0.4182, "tp": 20, "fp": 37, "tn": 26, "fn": 27, "aleatoric_mean": 7e-06, "epistemic_mean": 1.4e-05, "confidence_mean": 1.0, "aleatoric_std": 3e-06, "epistemic_std": 6e-06}, {"fold": "fold_5", "regime": "Low-vol plateau", "sharpe": 0.8299, "sortino": 1.5128, "return_pct": 2.68, "equity": 1026.77, "max_dd": 4.75, "win_rate": 48.21, "profit_factor": 1.148, "ic": 0.0849, "hit": 48.21, "n": 112, "precision": 0.4603, "recall": 0.5472, "f1": 0.5, "f2": 0.5273, "mcc": -0.0293, "accuracy": 0.4821, "tp": 29, "fp": 34, "tn": 25, "fn": 24, "aleatoric_mean": 8e-06, "epistemic_mean": 1.5e-05, "confidence_mean": 1.0, "aleatoric_std": 3e-06, "epistemic_std": 7e-06}, {"fold": "fold_6", "regime": "EUR crisis downturn", "sharpe": 3.3004, "sortino": 4.5967, "return_pct": 7.62, "equity": 1076.16, "max_dd": 1.45, "win_rate": 63.55, "profit_factor": 1.747, "ic": 0.1371, "hit": 62.96, "n": 108, "precision": 0.5833, "recall": 0.5957, "f1": 0.5895, "f2": 0.5932, "mcc": 0.2673, "accuracy": 0.6389, "tp": 28, "fp": 20, "tn": 41, "fn": 19, "aleatoric_mean": 7e-06, "epistemic_mean": 1.4e-05, "confidence_mean": 1.0, "aleatoric_std": 3e-06, "epistemic_std": 5e-06}, {"fold": "fold_7", "regime": "Recent mixed/upturn", "sharpe": 2.8593, "sortino": 5.292, "return_pct": 6.92, "equity": 1069.16, "max_dd": 1.73, "win_rate": 58.18, "profit_factor": 1.584, "ic": 0.1646, "hit": 58.18, "n": 110, "precision": 0.5507, "recall": 0.717, "f1": 0.623, "f2": 0.6762, "mcc": 0.1789, "accuracy": 0.5818, "tp": 38, "fp": 31, "tn": 26, "fn": 15, "aleatoric_mean": 8e-06, "epistemic_mean": 1.6e-05, "confidence_mean": 1.0, "aleatoric_std": 4e-06, "epistemic_std": 8e-06}], "train_sharpe": 1.4159, "train_psr": 1.0, "train_equity": 5243.96, "train_sortino": 2.8997, "train_return_pct": 424.4, "train_max_dd": 12.04, "train_win_rate": 52.39, "train_profit_factor": 1.364, "train_ic": 0.0819, "train_hit": 52.18, "train_precision": 0.5332, "train_recall": 0.5856, "train_f1": 0.5582, "train_f2": 0.5743, "train_mcc": 0.0435, "train_accuracy": 0.5234, "train_per_window": [{"fold": "all_train", "regime": "Training data", "sharpe": 1.4159, "sortino": 2.8997, "return_pct": 424.4, "equity": 5243.96, "max_dd": 12.04, "win_rate": 52.39, "profit_factor": 1.364, "ic": 0.0819, "hit": 52.18, "n": 2478, "precision": 0.5332, "recall": 0.5856, "f1": 0.5582, "f2": 0.5743, "mcc": 0.0435, "accuracy": 0.5234, "tp": 746, "fp": 653, "tn": 551, "fn": 528}], "experiment_num": 117, "status": "KEEP"}
{"backbone": "lstm", "description": "lstm: Exp13 3-layer stacked BiLSTM (Graves2013)", "config": {"seq_len": 10, "lr": 0.001, "batch_size": 32, "epochs": 100, "weight_decay": 0.0001, "patience": 15, "grad_clip": 1.0, "warmup_epochs": 0, "huber_delta": 1.0, "head_dropout": 0.25, "seed": 0, "num_layers": 3, "het_loss": false}, "composite": 1.6439, "test_pos_folds": 5, "val_pos_folds": 6, "val_loss": 3.1e-05, "elapsed_sec": 33.2, "timestamp": "2026-04-19T19:06:44", "sharpe": 1.9439, "psr": 0.9998, "equity": 2192.22, "sortino": 2.4273, "return_pct": 119.22, "max_dd": 9.95, "win_rate": 57.17, "profit_factor": 1.434, "ic": 0.3798, "hit": 56.94, "aleatoric_mean": 1.8e-05, "epistemic_mean": 3.6e-05, "confidence_mean": 0.9999, "precision": 0.6923, "recall": 0.2432, "f1": 0.36, "f2": 0.2795, "mcc": 0.1815, "accuracy": 0.5725, "per_window": [{"fold": "fold_1", "regime": "Pre-crisis upturn + GFC onset", "sharpe": -0.5448, "sortino": -0.6104, "return_pct": -4.81, "equity": 951.87, "max_dd": 8.6, "win_rate": 50.98, "profit_factor": 0.879, "ic": 0.1674, "hit": 50.49, "n": 103, "precision": 0.6, "recall": 0.1132, "f1": 0.1905, "f2": 0.1351, "mcc": 0.0561, "accuracy": 0.5049, "tp": 6, "fp": 4, "tn": 46, "fn": 47, "aleatoric_mean": 2.5e-05, "epistemic_mean": 5e-05, "confidence_mean": 0.9999, "aleatoric_std": 9e-06, "epistemic_std": 1.8e-05}, {"fold": "fold_2", "regime": "Post-crash recovery", "sharpe": -0.1855, "sortino": -0.3135, "return_pct": -1.15, "equity": 988.45, "max_dd": 5.89, "win_rate": 50.47, "profit_factor": 0.971, "ic": 0.0198, "hit": 50.47, "n": 107, "precision": 0.4667, "recall": 0.2745, "f1": 0.3457, "f2": 0.2991, "mcc": -0.0125, "accuracy": 0.5047, "tp": 14, "fp": 16, "tn": 40, "fn": 37, "aleatoric_mean": 1.8e-05, "epistemic_mean": 3.7e-05, "confidence_mean": 0.9999, "aleatoric_std": 7e-06, "epistemic_std": 1.5e-05}, {"fold": "fold_3", "regime": "Eurozone debt plateau", "sharpe": 3.6886, "sortino": 7.2985, "return_pct": 13.43, "equity": 1134.34, "max_dd": 2.56, "win_rate": 55.77, "profit_factor": 1.785, "ic": 0.3177, "hit": 54.72, "n": 106, "precision": 0.6571, "recall": 0.4035, "f1": 0.5, "f2": 0.4373, "mcc": 0.1682, "accuracy": 0.566, "tp": 23, "fp": 12, "tn": 37, "fn": 34, "aleatoric_mean": 1.7e-05, "epistemic_mean": 3.5e-05, "confidence_mean": 0.9999, "aleatoric_std": 5e-06, "epistemic_std": 1.1e-05}, {"fold": "fold_4", "regime": "Strong USD downturn", "sharpe": 0.9645, "sortino": 1.3793, "return_pct": 7.29, "equity": 1072.91, "max_dd": 5.08, "win_rate": 52.69, "profit_factor": 1.176, "ic": 0.6289, "hit": 52.38, "n": 168, "precision": 0.8889, "recall": 0.093, "f1": 0.1684, "f2": 0.1133, "mcc": 0.1794, "accuracy": 0.5298, "tp": 8, "fp": 1, "tn": 81, "fn": 78, "aleatoric_mean": 1.5e-05, "epistemic_mean": 3.1e-05, "confidence_mean": 1.0, "aleatoric_std": 5e-06, "epistemic_std": 1e-05}, {"fold": "fold_5", "regime": "Low-vol plateau", "sharpe": 6.0799, "sortino": 9.2405, "return_pct": 20.73, "equity": 1207.31, "max_dd": 1.22, "win_rate": 65.43, "profit_factor": 2.789, "ic": 0.5239, "hit": 65.43, "n": 162, "precision": 0.8846, "recall": 0.3026, "f1": 0.451, "f2": 0.3485, "mcc": 0.364, "accuracy": 0.6543, "tp": 23, "fp": 3, "tn": 83, "fn": 53, "aleatoric_mean": 1.6e-05, "epistemic_mean": 3.3e-05, "confidence_mean": 1.0, "aleatoric_std": 5e-06, "epistemic_std": 1e-05}, {"fold": "fold_6", "regime": "EUR crisis downturn", "sharpe": 7.1557, "sortino": 12.844, "return_pct": 50.36, "equity": 1503.6, "max_dd": 1.99, "win_rate": 64.24, "profit_factor": 3.229, "ic": 0.6086, "hit": 64.24, "n": 165, "precision": 0.8, "recall": 0.3117, "f1": 0.4486, "f2": 0.355, "mcc": 0.315, "accuracy": 0.6424, "tp": 24, "fp": 6, "tn": 82, "fn": 53, "aleatoric_mean": 1.8e-05, "epistemic_mean": 3.5e-05, "confidence_mean": 0.9999, "aleatoric_std": 6e-06, "epistemic_std": 1.3e-05}, {"fold": "fold_7", "regime": "Recent mixed/upturn", "sharpe": 0.9401, "sortino": 1.2066, "return_pct": 5.46, "equity": 1054.62, "max_dd": 6.44, "win_rate": 55.56, "profit_factor": 1.172, "ic": 0.4533, "hit": 55.56, "n": 162, "precision": 0.6552, "recall": 0.2346, "f1": 0.3455, "f2": 0.2691, "mcc": 0.1449, "accuracy": 0.5556, "tp": 19, "fp": 10, "tn": 71, "fn": 62, "aleatoric_mean": 1.9e-05, "epistemic_mean": 3.7e-05, "confidence_mean": 0.9999, "aleatoric_std": 6e-06, "epistemic_std": 1.3e-05}], "val_sharpe": 3.0735, "val_psr": 1.0, "val_equity": 2028.78, "val_sortino": 4.7704, "val_return_pct": 102.88, "val_max_dd": 11.87, "val_win_rate": 59.37, "val_profit_factor": 1.684, "val_ic": 0.4221, "val_hit": 58.98, "val_aleatoric_mean": 1.6e-05, "val_epistemic_mean": 3.3e-05, "val_confidence_mean": 1.0, "val_precision": 0.7077, "val_recall": 0.2521, "val_f1": 0.3717, "val_f2": 0.2893, "val_mcc": 0.2101, "val_accuracy": 0.5951, "val_per_window": [{"fold": "fold_1", "regime": "Pre-crisis upturn + GFC onset", "sharpe": 0.4113, "sortino": 0.6809, "return_pct": 0.97, "equity": 1009.69, "max_dd": 3.37, "win_rate": 47.22, "profit_factor": 1.071, "ic": 0.1993, "hit": 46.79, "n": 109, "precision": 0.4688, "recall": 0.2727, "f1": 0.3448, "f2": 0.2976, "mcc": -0.0462, "accuracy": 0.4771, "tp": 15, "fp": 17, "tn": 37, "fn": 40, "aleatoric_mean": 1.6e-05, "epistemic_mean": 3.3e-05, "confidence_mean": 1.0, "aleatoric_std": 7e-06, "epistemic_std": 1.3e-05}, {"fold": "fold_2", "regime": "Post-crash recovery", "sharpe": -1.0038, "sortino": -1.5789, "return_pct": -5.01, "equity": 949.9, "max_dd": 11.87, "win_rate": 48.15, "profit_factor": 0.853, "ic": 0.0407, "hit": 48.15, "n": 108, "precision": 0.6667, "recall": 0.2222, "f1": 0.3333, "f2": 0.2564, "mcc": 0.083, "accuracy": 0.4815, "tp": 14, "fp": 7, "tn": 38, "fn": 49, "aleatoric_mean": 1.8e-05, "epistemic_mean": 3.6e-05, "confidence_mean": 0.9999, "aleatoric_std": 7e-06, "epistemic_std": 1.3e-05}, {"fold": "fold_3", "regime": "Eurozone debt plateau", "sharpe": 7.1592, "sortino": 14.4695, "return_pct": 29.97, "equity": 1299.72, "max_dd": 2.03, "win_rate": 74.31, "profit_factor": 3.25, "ic": 0.6616, "hit": 72.97, "n": 111, "precision": 0.875, "recall": 0.4468, "f1": 0.5915, "f2": 0.4953, "mcc": 0.48, "accuracy": 0.7387, "tp": 21, "fp": 3, "tn": 61, "fn": 26, "aleatoric_mean": 1.6e-05, "epistemic_mean": 3.2e-05, "confidence_mean": 1.0, "aleatoric_std": 5e-06, "epistemic_std": 1e-05}, {"fold": "fold_4", "regime": "Strong USD downturn", "sharpe": 5.135, "sortino": 8.64, "return_pct": 18.35, "equity": 1183.46, "max_dd": 1.82, "win_rate": 62.39, "profit_factor": 2.356, "ic": 0.596, "hit": 61.82, "n": 110, "precision": 0.875, "recall": 0.1489, "f1": 0.2545, "f2": 0.1786, "mcc": 0.2535, "accuracy": 0.6273, "tp": 7, "fp": 1, "tn": 62, "fn": 40, "aleatoric_mean": 1.6e-05, "epistemic_mean": 3.3e-05, "confidence_mean": 1.0, "aleatoric_std": 5e-06, "epistemic_std": 1.1e-05}, {"fold": "fold_5", "regime": "Low-vol plateau", "sharpe": 3.1808, "sortino": 6.4352, "return_pct": 10.83, "equity": 1108.34, "max_dd": 3.14, "win_rate": 55.36, "profit_factor": 1.699, "ic": 0.6125, "hit": 55.36, "n": 112, "precision": 0.7143, "recall": 0.0943, "f1": 0.1667, "f2": 0.1142, "mcc": 0.1247, "accuracy": 0.5536, "tp": 5, "fp": 2, "tn": 57, "fn": 48, "aleatoric_mean": 1.5e-05, "epistemic_mean": 3e-05, "confidence_mean": 1.0, "aleatoric_std": 5e-06, "epistemic_std": 1.1e-05}, {"fold": "fold_6", "regime": "EUR crisis downturn", "sharpe": 4.4757, "sortino": 7.5821, "return_pct": 10.3, "equity": 1103.02, "max_dd": 1.32, "win_rate": 63.55, "profit_factor": 2.137, "ic": 0.6254, "hit": 62.96, "n": 108, "precision": 0.9, "recall": 0.1915, "f1": 0.3158, "f2": 0.2273, "mcc": 0.2995, "accuracy": 0.6389, "tp": 9, "fp": 1, "tn": 60, "fn": 38, "aleatoric_mean": 1.4e-05, "epistemic_mean": 2.8e-05, "confidence_mean": 1.0, "aleatoric_std": 5e-06, "epistemic_std": 9e-06}, {"fold": "fold_7", "regime": "Recent mixed/upturn", "sharpe": 5.1871, "sortino": 10.314, "return_pct": 12.49, "equity": 1124.88, "max_dd": 1.44, "win_rate": 64.55, "profit_factor": 2.312, "ic": 0.3518, "hit": 64.55, "n": 110, "precision": 0.75, "recall": 0.3962, "f1": 0.5185, "f2": 0.4375, "mcc": 0.3136, "accuracy": 0.6455, "tp": 21, "fp": 7, "tn": 50, "fn": 32, "aleatoric_mean": 1.8e-05, "epistemic_mean": 3.7e-05, "confidence_mean": 0.9999, "aleatoric_std": 7e-06, "epistemic_std": 1.4e-05}], "train_sharpe": 3.377, "train_psr": 1.0, "train_equity": 53527.78, "train_sortino": 8.4521, "train_return_pct": 5252.78, "train_max_dd": 8.17, "train_win_rate": 58.43, "train_profit_factor": 2.129, "train_ic": 0.5432, "train_hit": 58.19, "train_precision": 0.844, "train_recall": 0.2378, "train_f1": 0.3711, "train_f2": 0.2777, "train_mcc": 0.2717, "train_accuracy": 0.5856, "train_per_window": [{"fold": "all_train", "regime": "Training data", "sharpe": 3.377, "sortino": 8.4521, "return_pct": 5252.78, "equity": 53527.78, "max_dd": 8.17, "win_rate": 58.43, "profit_factor": 2.129, "ic": 0.5432, "hit": 58.19, "n": 2478, "precision": 0.844, "recall": 0.2378, "f1": 0.3711, "f2": 0.2777, "mcc": 0.2717, "accuracy": 0.5856, "tp": 303, "fp": 56, "tn": 1148, "fn": 971}], "experiment_num": 118, "status": "KEEP"}
