{"backbone": "mamba", "description": "mamba: Exp20 dmamba expand=4 wd=0.05 (half default)", "config": {"seq_len": 10, "lr": 0.0005, "batch_size": 32, "epochs": 100, "weight_decay": 0.05, "patience": 20, "grad_clip": 1.0, "warmup_epochs": 10, "huber_delta": 1.0, "head_dropout": 0.1, "seed": 42, "mamba_variant": "dmamba", "mamba_expand": 4, "het_loss": false}, "composite": 5.3026, "test_pos_folds": 7, "val_pos_folds": 6, "val_loss": 3.7e-05, "elapsed_sec": 260.3, "timestamp": "2026-04-20T02:14:14", "sharpe": 5.4026, "psr": 1.0, "equity": 8318.77, "sortino": 9.7018, "return_pct": 731.88, "max_dd": 6.87, "win_rate": 67.39, "profit_factor": 2.791, "ic": 0.431, "hit": 67.11, "aleatoric_mean": 3.3e-05, "epistemic_mean": 6.6e-05, "confidence_mean": 0.9999, "precision": 0.673, "recall": 0.659, "f1": 0.666, "f2": 0.6618, "mcc": 0.3462, "accuracy": 0.6732, "per_window": [{"fold": "fold_1", "regime": "Pre-crisis upturn + GFC onset", "sharpe": 2.5456, "sortino": 7.7426, "return_pct": 20.54, "equity": 1205.43, "max_dd": 6.87, "win_rate": 50.98, "profit_factor": 1.843, "ic": 0.0447, "hit": 50.49, "n": 103, "precision": 0.5135, "recall": 0.717, "f1": 0.5984, "f2": 0.6643, "mcc": -0.0034, "accuracy": 0.5049, "tp": 38, "fp": 36, "tn": 14, "fn": 15, "aleatoric_mean": 5.5e-05, "epistemic_mean": 0.000111, "confidence_mean": 0.9998, "aleatoric_std": 4.1e-05, "epistemic_std": 8.3e-05}, {"fold": "fold_2", "regime": "Post-crash recovery", "sharpe": 2.5347, "sortino": 4.4175, "return_pct": 12.46, "equity": 1124.62, "max_dd": 3.96, "win_rate": 57.01, "profit_factor": 1.488, "ic": 0.1653, "hit": 57.01, "n": 107, "precision": 0.5439, "recall": 0.6078, "f1": 0.5741, "f2": 0.5939, "mcc": 0.1437, "accuracy": 0.5701, "tp": 31, "fp": 26, "tn": 30, "fn": 20, "aleatoric_mean": 3.4e-05, "epistemic_mean": 6.9e-05, "confidence_mean": 0.9999, "aleatoric_std": 1.8e-05, "epistemic_std": 3.6e-05}, {"fold": "fold_3", "regime": "Eurozone debt plateau", "sharpe": 7.1881, "sortino": 13.0165, "return_pct": 25.98, "equity": 1259.81, "max_dd": 2.17, "win_rate": 69.23, "profit_factor": 3.115, "ic": 0.4668, "hit": 67.92, "n": 106, "precision": 0.6818, "recall": 0.7895, "f1": 0.7317, "f2": 0.7653, "mcc": 0.3712, "accuracy": 0.6887, "tp": 45, "fp": 21, "tn": 28, "fn": 12, "aleatoric_mean": 4.4e-05, "epistemic_mean": 8.8e-05, "confidence_mean": 0.9999, "aleatoric_std": 2.6e-05, "epistemic_std": 5.2e-05}, {"fold": "fold_4", "regime": "Strong USD downturn", "sharpe": 5.1205, "sortino": 7.4942, "return_pct": 45.45, "equity": 1454.53, "max_dd": 3.03, "win_rate": 67.66, "profit_factor": 2.386, "ic": 0.5532, "hit": 67.26, "n": 168, "precision": 0.7667, "recall": 0.5349, "f1": 0.6301, "f2": 0.5693, "mcc": 0.3799, "accuracy": 0.6786, "tp": 46, "fp": 14, "tn": 68, "fn": 40, "aleatoric_mean": 3.6e-05, "epistemic_mean": 7.2e-05, "confidence_mean": 0.9999, "aleatoric_std": 1.9e-05, "epistemic_std": 3.9e-05}, {"fold": "fold_5", "regime": "Low-vol plateau", "sharpe": 7.1089, "sortino": 13.2075, "return_pct": 24.04, "equity": 1240.36, "max_dd": 1.36, "win_rate": 68.52, "profit_factor": 3.344, "ic": 0.4497, "hit": 68.52, "n": 162, "precision": 0.6812, "recall": 0.6184, "f1": 0.6483, "f2": 0.63, "mcc": 0.366, "accuracy": 0.6852, "tp": 47, "fp": 22, "tn": 64, "fn": 29, "aleatoric_mean": 1.9e-05, "epistemic_mean": 3.8e-05, "confidence_mean": 0.9999, "aleatoric_std": 8e-06, "epistemic_std": 1.6e-05}, {"fold": "fold_6", "regime": "EUR crisis downturn", "sharpe": 10.3494, "sortino": 24.5892, "return_pct": 72.12, "equity": 1721.22, "max_dd": 2.3, "win_rate": 73.94, "profit_factor": 5.676, "ic": 0.6632, "hit": 73.94, "n": 165, "precision": 0.7576, "recall": 0.6494, "f1": 0.6993, "f2": 0.6684, "mcc": 0.4761, "accuracy": 0.7394, "tp": 50, "fp": 16, "tn": 72, "fn": 27, "aleatoric_mean": 3e-05, "epistemic_mean": 6.1e-05, "confidence_mean": 0.9999, "aleatoric_std": 1.6e-05, "epistemic_std": 3.2e-05}, {"fold": "fold_7", "regime": "Recent mixed/upturn", "sharpe": 8.6497, "sortino": 15.988, "return_pct": 56.85, "equity": 1568.54, "max_dd": 1.93, "win_rate": 75.31, "profit_factor": 4.58, "ic": 0.6046, "hit": 75.31, "n": 162, "precision": 0.7595, "recall": 0.7407, "f1": 0.75, "f2": 0.7444, "mcc": 0.5063, "accuracy": 0.7531, "tp": 60, "fp": 19, "tn": 62, "fn": 21, "aleatoric_mean": 2.5e-05, "epistemic_mean": 5e-05, "confidence_mean": 0.9999, "aleatoric_std": 1.2e-05, "epistemic_std": 2.4e-05}], "val_sharpe": 5.6365, "val_psr": 1.0, "val_equity": 3498.45, "val_sortino": 9.1217, "val_return_pct": 249.85, "val_max_dd": 7.5, "val_win_rate": 64.88, "val_profit_factor": 2.628, "val_ic": 0.4112, "val_hit": 64.45, "val_aleatoric_mean": 2.4e-05, "val_epistemic_mean": 4.8e-05, "val_confidence_mean": 0.9999, "val_precision": 0.6234, "val_recall": 0.6575, "val_f1": 0.64, "val_f2": 0.6504, "val_mcc": 0.2974, "val_accuracy": 0.6484, "val_per_window": [{"fold": "fold_1", "regime": "Pre-crisis upturn + GFC onset", "sharpe": -0.579, "sortino": -1.0431, "return_pct": -1.52, "equity": 984.77, "max_dd": 3.78, "win_rate": 47.22, "profit_factor": 0.908, "ic": -0.1395, "hit": 46.79, "n": 109, "precision": 0.4783, "recall": 0.6, "f1": 0.5323, "f2": 0.5709, "mcc": -0.0692, "accuracy": 0.4679, "tp": 33, "fp": 36, "tn": 18, "fn": 22, "aleatoric_mean": 2.3e-05, "epistemic_mean": 4.7e-05, "confidence_mean": 0.9999, "aleatoric_std": 1.9e-05, "epistemic_std": 3.8e-05}, {"fold": "fold_2", "regime": "Post-crash recovery", "sharpe": 0.1918, "sortino": 0.3272, "return_pct": 0.66, "equity": 1006.58, "max_dd": 7.5, "win_rate": 46.3, "profit_factor": 1.031, "ic": -0.021, "hit": 46.3, "n": 108, "precision": 0.5385, "recall": 0.5556, "f1": 0.5469, "f2": 0.5521, "mcc": -0.1119, "accuracy": 0.463, "tp": 35, "fp": 30, "tn": 15, "fn": 28, "aleatoric_mean": 3.8e-05, "epistemic_mean": 7.6e-05, "confidence_mean": 0.9999, "aleatoric_std": 1.8e-05, "epistemic_std": 3.5e-05}, {"fold": "fold_3", "regime": "Eurozone debt plateau", "sharpe": 9.5505, "sortino": 19.3406, "return_pct": 38.99, "equity": 1389.85, "max_dd": 1.15, "win_rate": 77.06, "profit_factor": 4.949, "ic": 0.5614, "hit": 75.68, "n": 111, "precision": 0.7692, "recall": 0.6383, "f1": 0.6977, "f2": 0.6608, "mcc": 0.5151, "accuracy": 0.7658, "tp": 30, "fp": 9, "tn": 55, "fn": 17, "aleatoric_mean": 2.9e-05, "epistemic_mean": 5.9e-05, "confidence_mean": 0.9999, "aleatoric_std": 1.4e-05, "epistemic_std": 2.8e-05}, {"fold": "fold_4", "regime": "Strong USD downturn", "sharpe": 9.2941, "sortino": 20.9223, "return_pct": 31.97, "equity": 1319.7, "max_dd": 1.48, "win_rate": 70.64, "profit_factor": 4.938, "ic": 0.6018, "hit": 70.0, "n": 110, "precision": 0.6471, "recall": 0.7021, "f1": 0.6735, "f2": 0.6904, "mcc": 0.4131, "accuracy": 0.7091, "tp": 33, "fp": 18, "tn": 45, "fn": 14, "aleatoric_mean": 2.1e-05, "epistemic_mean": 4.2e-05, "confidence_mean": 0.9999, "aleatoric_std": 1.1e-05, "epistemic_std": 2.2e-05}, {"fold": "fold_5", "regime": "Low-vol plateau", "sharpe": 10.2959, "sortino": 28.8148, "return_pct": 33.26, "equity": 1332.58, "max_dd": 0.97, "win_rate": 67.86, "profit_factor": 6.082, "ic": 0.7182, "hit": 67.86, "n": 112, "precision": 0.6441, "recall": 0.717, "f1": 0.6786, "f2": 0.7011, "mcc": 0.361, "accuracy": 0.6786, "tp": 38, "fp": 21, "tn": 38, "fn": 15, "aleatoric_mean": 2.1e-05, "epistemic_mean": 4.2e-05, "confidence_mean": 0.9999, "aleatoric_std": 1.2e-05, "epistemic_std": 2.3e-05}, {"fold": "fold_6", "regime": "EUR crisis downturn", "sharpe": 11.7011, "sortino": 29.4516, "return_pct": 24.0, "equity": 1240.01, "max_dd": 0.58, "win_rate": 79.44, "profit_factor": 8.63, "ic": 0.7387, "hit": 78.7, "n": 108, "precision": 0.7907, "recall": 0.7234, "f1": 0.7556, "f2": 0.7359, "mcc": 0.5832, "accuracy": 0.7963, "tp": 34, "fp": 9, "tn": 52, "fn": 13, "aleatoric_mean": 1.7e-05, "epistemic_mean": 3.4e-05, "confidence_mean": 0.9999, "aleatoric_std": 5e-06, "epistemic_std": 1e-05}, {"fold": "fold_7", "regime": "Recent mixed/upturn", "sharpe": 6.9569, "sortino": 15.0911, "return_pct": 16.45, "equity": 1164.47, "max_dd": 0.91, "win_rate": 65.45, "profit_factor": 3.098, "ic": 0.5366, "hit": 65.45, "n": 110, "precision": 0.6271, "recall": 0.6981, "f1": 0.6607, "f2": 0.6827, "mcc": 0.3128, "accuracy": 0.6545, "tp": 37, "fp": 22, "tn": 35, "fn": 16, "aleatoric_mean": 2e-05, "epistemic_mean": 3.9e-05, "confidence_mean": 0.9999, "aleatoric_std": 8e-06, "epistemic_std": 1.5e-05}], "train_sharpe": 6.9478, "train_psr": 1.0, "train_equity": 2293669.75, "train_sortino": 17.3699, "train_return_pct": 229266.98, "train_max_dd": 4.37, "train_win_rate": 74.35, "train_profit_factor": 5.563, "train_ic": 0.672, "train_hit": 74.05, "train_precision": 0.7672, "train_recall": 0.719, "train_f1": 0.7423, "train_f2": 0.7281, "train_mcc": 0.4882, "train_accuracy": 0.7433, "train_per_window": [{"fold": "all_train", "regime": "Training data", "sharpe": 6.9478, "sortino": 17.3699, "return_pct": 229266.98, "equity": 2293669.75, "max_dd": 4.37, "win_rate": 74.35, "profit_factor": 5.563, "ic": 0.672, "hit": 74.05, "n": 2478, "precision": 0.7672, "recall": 0.719, "f1": 0.7423, "f2": 0.7281, "mcc": 0.4882, "accuracy": 0.7433, "tp": 916, "fp": 278, "tn": 926, "fn": 358}], "experiment_num": 171, "status": "DISCARD"}
{"backbone": "mamba", "description": "mamba: Exp21 dmamba expand=4 wd=0.2 (double default)", "config": {"seq_len": 10, "lr": 0.0005, "batch_size": 32, "epochs": 100, "weight_decay": 0.2, "patience": 20, "grad_clip": 1.0, "warmup_epochs": 10, "huber_delta": 1.0, "head_dropout": 0.1, "seed": 42, "mamba_variant": "dmamba", "mamba_expand": 4, "het_loss": false}, "composite": 5.1657, "test_pos_folds": 7, "val_pos_folds": 6, "val_loss": 3.8e-05, "elapsed_sec": 268.4, "timestamp": "2026-04-20T02:19:09", "sharpe": 5.3289, "psr": 1.0, "equity": 8101.18, "sortino": 6.593, "return_pct": 710.12, "max_dd": 7.54, "win_rate": 66.56, "profit_factor": 2.75, "ic": 0.4478, "hit": 66.29, "aleatoric_mean": 2.7e-05, "epistemic_mean": 5.4e-05, "confidence_mean": 0.9999, "precision": 0.6566, "recall": 0.6757, "f1": 0.666, "f2": 0.6718, "mcc": 0.3302, "accuracy": 0.665, "per_window": [{"fold": "fold_1", "regime": "Pre-crisis upturn + GFC onset", "sharpe": 0.3991, "sortino": 0.438, "return_pct": 2.37, "equity": 1023.72, "max_dd": 7.54, "win_rate": 52.94, "profit_factor": 1.099, "ic": 0.0688, "hit": 52.43, "n": 103, "precision": 0.5345, "recall": 0.5849, "f1": 0.5586, "f2": 0.5741, "mcc": 0.0452, "accuracy": 0.5243, "tp": 31, "fp": 27, "tn": 23, "fn": 22, "aleatoric_mean": 4.4e-05, "epistemic_mean": 8.8e-05, "confidence_mean": 0.9999, "aleatoric_std": 2.6e-05, "epistemic_std": 5.2e-05}, {"fold": "fold_2", "regime": "Post-crash recovery", "sharpe": 2.4215, "sortino": 4.7089, "return_pct": 11.87, "equity": 1118.74, "max_dd": 3.27, "win_rate": 55.14, "profit_factor": 1.462, "ic": 0.1502, "hit": 55.14, "n": 107, "precision": 0.5556, "recall": 0.2941, "f1": 0.3846, "f2": 0.3247, "mcc": 0.0918, "accuracy": 0.5514, "tp": 15, "fp": 12, "tn": 44, "fn": 36, "aleatoric_mean": 2.9e-05, "epistemic_mean": 5.8e-05, "confidence_mean": 0.9999, "aleatoric_std": 1.5e-05, "epistemic_std": 3.1e-05}, {"fold": "fold_3", "regime": "Eurozone debt plateau", "sharpe": 6.2327, "sortino": 10.5247, "return_pct": 22.69, "equity": 1226.86, "max_dd": 1.42, "win_rate": 72.12, "profit_factor": 2.672, "ic": 0.5218, "hit": 70.75, "n": 106, "precision": 0.7077, "recall": 0.807, "f1": 0.7541, "f2": 0.785, "mcc": 0.4292, "accuracy": 0.717, "tp": 46, "fp": 19, "tn": 30, "fn": 11, "aleatoric_mean": 3.8e-05, "epistemic_mean": 7.6e-05, "confidence_mean": 0.9999, "aleatoric_std": 2.2e-05, "epistemic_std": 4.4e-05}, {"fold": "fold_4", "regime": "Strong USD downturn", "sharpe": 7.9149, "sortino": 13.1831, "return_pct": 72.75, "equity": 1727.49, "max_dd": 2.62, "win_rate": 71.86, "profit_factor": 3.937, "ic": 0.5957, "hit": 71.43, "n": 168, "precision": 0.7468, "recall": 0.686, "f1": 0.7152, "f2": 0.6974, "mcc": 0.4428, "accuracy": 0.7202, "tp": 59, "fp": 20, "tn": 62, "fn": 27, "aleatoric_mean": 3.1e-05, "epistemic_mean": 6.3e-05, "confidence_mean": 0.9999, "aleatoric_std": 1.5e-05, "epistemic_std": 2.9e-05}, {"fold": "fold_5", "regime": "Low-vol plateau", "sharpe": 8.2065, "sortino": 21.256, "return_pct": 27.4, "equity": 1273.97, "max_dd": 1.36, "win_rate": 64.2, "profit_factor": 4.08, "ic": 0.5482, "hit": 64.2, "n": 162, "precision": 0.5938, "recall": 0.75, "f1": 0.6628, "f2": 0.7125, "mcc": 0.3012, "accuracy": 0.642, "tp": 57, "fp": 39, "tn": 47, "fn": 19, "aleatoric_mean": 1.3e-05, "epistemic_mean": 2.6e-05, "confidence_mean": 1.0, "aleatoric_std": 6e-06, "epistemic_std": 1.1e-05}, {"fold": "fold_6", "regime": "EUR crisis downturn", "sharpe": 9.4426, "sortino": 18.1909, "return_pct": 66.22, "equity": 1662.18, "max_dd": 2.3, "win_rate": 69.09, "profit_factor": 4.808, "ic": 0.6239, "hit": 69.09, "n": 165, "precision": 0.7031, "recall": 0.5844, "f1": 0.6383, "f2": 0.6048, "mcc": 0.3773, "accuracy": 0.6909, "tp": 45, "fp": 19, "tn": 69, "fn": 32, "aleatoric_mean": 2.6e-05, "epistemic_mean": 5.2e-05, "confidence_mean": 0.9999, "aleatoric_std": 1.4e-05, "epistemic_std": 2.7e-05}, {"fold": "fold_7", "regime": "Recent mixed/upturn", "sharpe": 8.7698, "sortino": 17.2361, "return_pct": 57.61, "equity": 1576.12, "max_dd": 2.24, "win_rate": 73.46, "profit_factor": 4.688, "ic": 0.5868, "hit": 73.46, "n": 162, "precision": 0.6792, "recall": 0.8889, "f1": 0.7701, "f2": 0.8372, "mcc": 0.4932, "accuracy": 0.7346, "tp": 72, "fp": 34, "tn": 47, "fn": 9, "aleatoric_mean": 1.9e-05, "epistemic_mean": 3.8e-05, "confidence_mean": 0.9999, "aleatoric_std": 1.1e-05, "epistemic_std": 2.2e-05}], "val_sharpe": 5.2657, "val_psr": 1.0, "val_equity": 3247.3, "val_sortino": 8.1576, "val_return_pct": 224.73, "val_max_dd": 7.83, "val_win_rate": 63.56, "val_profit_factor": 2.461, "val_ic": 0.4298, "val_hit": 63.15, "val_aleatoric_mean": 2e-05, "val_epistemic_mean": 4e-05, "val_confidence_mean": 0.9999, "val_precision": 0.5874, "val_recall": 0.7644, "val_f1": 0.6643, "val_f2": 0.7209, "val_mcc": 0.2858, "val_accuracy": 0.6328, "val_per_window": [{"fold": "fold_1", "regime": "Pre-crisis upturn + GFC onset", "sharpe": 1.7042, "sortino": 3.2892, "return_pct": 4.29, "equity": 1042.95, "max_dd": 2.04, "win_rate": 48.15, "profit_factor": 1.327, "ic": -0.0359, "hit": 47.71, "n": 109, "precision": 0.4896, "recall": 0.8545, "f1": 0.6225, "f2": 0.7437, "mcc": -0.0815, "accuracy": 0.4771, "tp": 47, "fp": 49, "tn": 5, "fn": 8, "aleatoric_mean": 1.7e-05, "epistemic_mean": 3.4e-05, "confidence_mean": 0.9999, "aleatoric_std": 1.5e-05, "epistemic_std": 3e-05}, {"fold": "fold_2", "regime": "Post-crash recovery", "sharpe": -1.4454, "sortino": -2.3323, "return_pct": -7.01, "equity": 929.92, "max_dd": 7.51, "win_rate": 45.37, "profit_factor": 0.796, "ic": -0.0883, "hit": 45.37, "n": 108, "precision": 0.5323, "recall": 0.5238, "f1": 0.528, "f2": 0.5255, "mcc": -0.1203, "accuracy": 0.4537, "tp": 33, "fp": 29, "tn": 16, "fn": 30, "aleatoric_mean": 3.7e-05, "epistemic_mean": 7.3e-05, "confidence_mean": 0.9999, "aleatoric_std": 2.1e-05, "epistemic_std": 4.3e-05}, {"fold": "fold_3", "regime": "Eurozone debt plateau", "sharpe": 9.9602, "sortino": 26.9629, "return_pct": 40.42, "equity": 1404.17, "max_dd": 1.04, "win_rate": 74.31, "profit_factor": 5.336, "ic": 0.6526, "hit": 72.97, "n": 111, "precision": 0.6809, "recall": 0.6809, "f1": 0.6809, "f2": 0.6809, "mcc": 0.4465, "accuracy": 0.7297, "tp": 32, "fp": 15, "tn": 49, "fn": 15, "aleatoric_mean": 2.3e-05, "epistemic_mean": 4.6e-05, "confidence_mean": 0.9999, "aleatoric_std": 1.3e-05, "epistemic_std": 2.5e-05}, {"fold": "fold_4", "regime": "Strong USD downturn", "sharpe": 7.9528, "sortino": 15.1016, "return_pct": 27.86, "equity": 1278.61, "max_dd": 1.2, "win_rate": 67.89, "profit_factor": 3.854, "ic": 0.6549, "hit": 67.27, "n": 110, "precision": 0.6, "recall": 0.766, "f1": 0.6729, "f2": 0.7258, "mcc": 0.3825, "accuracy": 0.6818, "tp": 36, "fp": 24, "tn": 39, "fn": 11, "aleatoric_mean": 1.9e-05, "epistemic_mean": 3.7e-05, "confidence_mean": 0.9999, "aleatoric_std": 1.1e-05, "epistemic_std": 2.2e-05}, {"fold": "fold_5", "regime": "Low-vol plateau", "sharpe": 10.7346, "sortino": 31.7876, "return_pct": 34.39, "equity": 1343.93, "max_dd": 1.45, "win_rate": 73.21, "profit_factor": 6.654, "ic": 0.7648, "hit": 73.21, "n": 112, "precision": 0.6825, "recall": 0.8113, "f1": 0.7414, "f2": 0.7818, "mcc": 0.4754, "accuracy": 0.7321, "tp": 43, "fp": 20, "tn": 39, "fn": 10, "aleatoric_mean": 1.9e-05, "epistemic_mean": 3.7e-05, "confidence_mean": 0.9999, "aleatoric_std": 1.3e-05, "epistemic_std": 2.6e-05}, {"fold": "fold_6", "regime": "EUR crisis downturn", "sharpe": 9.5981, "sortino": 16.4827, "return_pct": 20.62, "equity": 1206.24, "max_dd": 0.87, "win_rate": 73.83, "profit_factor": 5.471, "ic": 0.7179, "hit": 73.15, "n": 108, "precision": 0.65, "recall": 0.8298, "f1": 0.729, "f2": 0.7863, "mcc": 0.4844, "accuracy": 0.7315, "tp": 39, "fp": 21, "tn": 40, "fn": 8, "aleatoric_mean": 1.1e-05, "epistemic_mean": 2.2e-05, "confidence_mean": 1.0, "aleatoric_std": 5e-06, "epistemic_std": 9e-06}, {"fold": "fold_7", "regime": "Recent mixed/upturn", "sharpe": 6.3111, "sortino": 13.8266, "return_pct": 15.04, "equity": 1150.38, "max_dd": 1.32, "win_rate": 61.82, "profit_factor": 2.782, "ic": 0.5247, "hit": 61.82, "n": 110, "precision": 0.5632, "recall": 0.9245, "f1": 0.7, "f2": 0.8194, "mcc": 0.3168, "accuracy": 0.6182, "tp": 49, "fp": 38, "tn": 19, "fn": 4, "aleatoric_mean": 1.4e-05, "epistemic_mean": 2.9e-05, "confidence_mean": 1.0, "aleatoric_std": 7e-06, "epistemic_std": 1.4e-05}], "train_sharpe": 7.3814, "train_psr": 1.0, "train_equity": 3431860.5, "train_sortino": 19.3167, "train_return_pct": 343086.05, "train_max_dd": 3.84, "train_win_rate": 76.7, "train_profit_factor": 6.438, "train_ic": 0.7153, "train_hit": 76.39, "train_precision": 0.7838, "train_recall": 0.7543, "train_f1": 0.7688, "train_f2": 0.76, "train_mcc": 0.534, "train_accuracy": 0.7667, "train_per_window": [{"fold": "all_train", "regime": "Training data", "sharpe": 7.3814, "sortino": 19.3167, "return_pct": 343086.05, "equity": 3431860.5, "max_dd": 3.84, "win_rate": 76.7, "profit_factor": 6.438, "ic": 0.7153, "hit": 76.39, "n": 2478, "precision": 0.7838, "recall": 0.7543, "f1": 0.7688, "f2": 0.76, "mcc": 0.534, "accuracy": 0.7667, "tp": 961, "fp": 265, "tn": 939, "fn": 313}], "experiment_num": 172, "status": "DISCARD"}
