{"backbone": "lfm2-350m", "description": "wd=5e-5: halfway between 1e-5(best) and 1e-4(kills fold5/7). Interpolating to find L2 sweet spot", "config": {"seq_len": 60, "lr": 3e-05, "batch_size": 32, "epochs": 20, "weight_decay": 5e-05, "patience": 5, "grad_clip": 1.0}, "composite": 0.8106, "test_pos_folds": 5, "val_pos_folds": 7, "val_loss": 0.000944, "elapsed_sec": 190.6, "timestamp": "2026-04-11T10:24:23", "sharpe": 1.4696, "psr": 0.9898, "equity": 1392.04, "sortino": 2.3488, "return_pct": 39.2, "max_dd": 10.55, "win_rate": 54.77, "profit_factor": 1.28, "ic": 0.088, "hit": 54.41, "per_window": [{"fold": "fold_1", "regime": "Pre-crisis upturn + GFC onset", "sharpe": -2.8323, "sortino": -5.5429, "return_pct": -5.83, "equity": 941.71, "max_dd": 7.74, "win_rate": 46.15, "profit_factor": 0.648, "ic": -0.1039, "hit": 45.28, "n": 53}, {"fold": "fold_2", "regime": "Post-crash recovery", "sharpe": 1.2986, "sortino": 2.0956, "return_pct": 3.58, "equity": 1035.82, "max_dd": 4.2, "win_rate": 50.88, "profit_factor": 1.231, "ic": -0.102, "hit": 50.88, "n": 57}, {"fold": "fold_3", "regime": "Eurozone debt plateau", "sharpe": 0.6528, "sortino": 0.947, "return_pct": 1.09, "equity": 1010.92, "max_dd": 2.9, "win_rate": 55.56, "profit_factor": 1.11, "ic": 0.1592, "hit": 53.57, "n": 56}, {"fold": "fold_4", "regime": "Strong USD downturn", "sharpe": 2.714, "sortino": 5.9359, "return_pct": 14.18, "equity": 1141.84, "max_dd": 3.18, "win_rate": 50.43, "profit_factor": 1.578, "ic": 0.1422, "hit": 50.0, "n": 118}, {"fold": "fold_5", "regime": "Low-vol plateau", "sharpe": 2.3268, "sortino": 3.768, "return_pct": 5.26, "equity": 1052.64, "max_dd": 1.83, "win_rate": 60.71, "profit_factor": 1.473, "ic": 0.1165, "hit": 60.71, "n": 112}, {"fold": "fold_6", "regime": "EUR crisis downturn", "sharpe": 4.2014, "sortino": 7.3072, "return_pct": 19.82, "equity": 1198.17, "max_dd": 3.66, "win_rate": 62.61, "profit_factor": 1.946, "ic": 0.2709, "hit": 62.61, "n": 115}, {"fold": "fold_7", "regime": "Recent mixed/upturn", "sharpe": -0.4364, "sortino": -0.5757, "return_pct": -1.98, "equity": 980.22, "max_dd": 3.77, "win_rate": 50.89, "profit_factor": 0.928, "ic": 0.367, "hit": 50.89, "n": 112}], "val_sharpe": 1.0106, "val_psr": 0.9034, "val_equity": 1129.29, "val_sortino": 1.5674, "val_return_pct": 12.93, "val_max_dd": 5.96, "val_win_rate": 51.2, "val_profit_factor": 1.183, "val_ic": 0.0604, "val_hit": 50.96, "val_per_window": [{"fold": "fold_1", "regime": "Pre-crisis upturn + GFC onset", "sharpe": 1.2505, "sortino": 1.9105, "return_pct": 1.94, "equity": 1019.42, "max_dd": 3.84, "win_rate": 55.17, "profit_factor": 1.229, "ic": -0.038, "hit": 54.24, "n": 59}, {"fold": "fold_2", "regime": "Post-crash recovery", "sharpe": 1.5793, "sortino": 3.0053, "return_pct": 3.05, "equity": 1030.45, "max_dd": 2.82, "win_rate": 51.72, "profit_factor": 1.291, "ic": -0.0132, "hit": 51.72, "n": 58}, {"fold": "fold_3", "regime": "Eurozone debt plateau", "sharpe": 1.5425, "sortino": 2.5689, "return_pct": 3.58, "equity": 1035.76, "max_dd": 2.71, "win_rate": 49.18, "profit_factor": 1.293, "ic": 0.0874, "hit": 49.18, "n": 61}, {"fold": "fold_4", "regime": "Strong USD downturn", "sharpe": 0.7027, "sortino": 1.1714, "return_pct": 1.45, "equity": 1014.47, "max_dd": 5.61, "win_rate": 51.67, "profit_factor": 1.114, "ic": 0.0552, "hit": 51.67, "n": 60}, {"fold": "fold_5", "regime": "Low-vol plateau", "sharpe": 0.5188, "sortino": 0.6952, "return_pct": 0.84, "equity": 1008.43, "max_dd": 2.35, "win_rate": 54.84, "profit_factor": 1.088, "ic": 0.0014, "hit": 54.84, "n": 62}, {"fold": "fold_6", "regime": "EUR crisis downturn", "sharpe": 0.0546, "sortino": 0.0904, "return_pct": 0.03, "equity": 1000.33, "max_dd": 2.52, "win_rate": 49.12, "profit_factor": 1.009, "ic": 0.0578, "hit": 48.28, "n": 58}, {"fold": "fold_7", "regime": "Recent mixed/upturn", "sharpe": 1.134, "sortino": 1.6789, "return_pct": 1.42, "equity": 1014.23, "max_dd": 3.25, "win_rate": 46.67, "profit_factor": 1.203, "ic": 0.1712, "hit": 46.67, "n": 60}], "train_sharpe": 2.2513, "train_psr": 1.0, "train_equity": 4698.81, "train_sortino": 5.3251, "train_return_pct": 369.88, "train_max_dd": 6.54, "train_win_rate": 56.07, "train_profit_factor": 1.69, "train_ic": 0.1812, "train_hit": 55.79, "train_per_window": [{"fold": "all_train", "regime": "Training data", "sharpe": 2.2513, "sortino": 5.3251, "return_pct": 369.88, "equity": 4698.81, "max_dd": 6.54, "win_rate": 56.07, "profit_factor": 1.69, "ic": 0.1812, "hit": 55.79, "n": 1382}], "experiment_num": 11, "status": "DISCARD"}
{"backbone": "lfm2-350m", "description": "epochs=30 patience=7: let model converge more, best lr=3e-5. Prior best stopped at epoch 8-12, more runway may stabilize fold 7", "config": {"seq_len": 60, "lr": 3e-05, "batch_size": 32, "epochs": 30, "weight_decay": 1e-05, "patience": 7, "grad_clip": 1.0}, "composite": 0.5729, "test_pos_folds": 4, "val_pos_folds": 5, "val_loss": 0.00077, "elapsed_sec": 305.2, "timestamp": "2026-04-11T14:57:45", "sharpe": 1.7404, "psr": 0.9972, "equity": 1481.53, "sortino": 2.9598, "return_pct": 48.15, "max_dd": 11.68, "win_rate": 54.28, "profit_factor": 1.34, "ic": 0.0758, "hit": 53.93, "per_window": [{"fold": "fold_1", "regime": "Pre-crisis upturn + GFC onset", "sharpe": 0.0583, "sortino": 0.1087, "return_pct": 0.02, "equity": 1000.17, "max_dd": 6.46, "win_rate": 42.31, "profit_factor": 1.009, "ic": 0.0354, "hit": 41.51, "n": 53}, {"fold": "fold_2", "regime": "Post-crash recovery", "sharpe": -1.7319, "sortino": -3.3298, "return_pct": -4.97, "equity": 950.26, "max_dd": 7.31, "win_rate": 40.35, "profit_factor": 0.758, "ic": -0.1861, "hit": 40.35, "n": 57}, {"fold": "fold_3", "regime": "Eurozone debt plateau", "sharpe": 3.7465, "sortino": 7.3185, "return_pct": 6.61, "equity": 1066.08, "max_dd": 1.82, "win_rate": 57.41, "profit_factor": 1.819, "ic": 0.0534, "hit": 55.36, "n": 56}, {"fold": "fold_4", "regime": "Strong USD downturn", "sharpe": 5.1287, "sortino": 12.7527, "return_pct": 27.66, "equity": 1276.63, "max_dd": 2.18, "win_rate": 64.96, "profit_factor": 2.384, "ic": 0.2602, "hit": 64.41, "n": 118}, {"fold": "fold_5", "regime": "Low-vol plateau", "sharpe": -0.2873, "sortino": -0.4262, "return_pct": -0.7, "equity": 992.98, "max_dd": 3.69, "win_rate": 50.89, "profit_factor": 0.953, "ic": 0.0831, "hit": 50.89, "n": 112}, {"fold": "fold_6", "regime": "EUR crisis downturn", "sharpe": 3.3601, "sortino": 6.1222, "return_pct": 15.71, "equity": 1157.09, "max_dd": 2.73, "win_rate": 60.0, "profit_factor": 1.702, "ic": 0.1275, "hit": 60.0, "n": 115}, {"fold": "fold_7", "regime": "Recent mixed/upturn", "sharpe": -0.0294, "sortino": -0.0396, "return_pct": -0.31, "equity": 996.86, "max_dd": 4.97, "win_rate": 51.79, "profit_factor": 0.995, "ic": 0.196, "hit": 51.79, "n": 112}], "val_sharpe": 1.0729, "val_psr": 0.9155, "val_equity": 1138.06, "val_sortino": 1.6862, "val_return_pct": 13.81, "val_max_dd": 8.33, "val_win_rate": 50.96, "val_profit_factor": 1.196, "val_ic": 0.0981, "val_hit": 50.72, "val_per_window": [{"fold": "fold_1", "regime": "Pre-crisis upturn + GFC onset", "sharpe": -0.9618, "sortino": -1.6141, "return_pct": -1.56, "equity": 984.36, "max_dd": 4.5, "win_rate": 46.55, "profit_factor": 0.854, "ic": 0.158, "hit": 45.76, "n": 59}, {"fold": "fold_2", "regime": "Post-crash recovery", "sharpe": -1.6371, "sortino": -2.9206, "return_pct": -3.23, "equity": 967.75, "max_dd": 4.67, "win_rate": 34.48, "profit_factor": 0.767, "ic": -0.145, "hit": 34.48, "n": 58}, {"fold": "fold_3", "regime": "Eurozone debt plateau", "sharpe": 0.9158, "sortino": 1.1915, "return_pct": 2.07, "equity": 1020.66, "max_dd": 3.99, "win_rate": 60.66, "profit_factor": 1.165, "ic": 0.3754, "hit": 60.66, "n": 61}, {"fold": "fold_4", "regime": "Strong USD downturn", "sharpe": 1.5562, "sortino": 3.0149, "return_pct": 3.35, "equity": 1033.46, "max_dd": 2.84, "win_rate": 50.0, "profit_factor": 1.27, "ic": 0.0216, "hit": 50.0, "n": 60}, {"fold": "fold_5", "regime": "Low-vol plateau", "sharpe": 4.6927, "sortino": 7.6836, "return_pct": 8.06, "equity": 1080.65, "max_dd": 1.17, "win_rate": 61.29, "profit_factor": 2.148, "ic": 0.2278, "hit": 61.29, "n": 62}, {"fold": "fold_6", "regime": "EUR crisis downturn", "sharpe": 1.6633, "sortino": 3.3692, "return_pct": 1.72, "equity": 1017.17, "max_dd": 2.09, "win_rate": 54.39, "profit_factor": 1.314, "ic": 0.0745, "hit": 53.45, "n": 58}, {"fold": "fold_7", "regime": "Recent mixed/upturn", "sharpe": 2.3924, "sortino": 5.1278, "return_pct": 3.04, "equity": 1030.38, "max_dd": 1.44, "win_rate": 48.33, "profit_factor": 1.478, "ic": -0.0113, "hit": 48.33, "n": 60}], "train_sharpe": 2.7718, "train_psr": 1.0, "train_equity": 6721.75, "train_sortino": 7.0081, "train_return_pct": 572.17, "train_max_dd": 11.62, "train_win_rate": 58.47, "train_profit_factor": 1.916, "train_ic": 0.2578, "train_hit": 58.18, "train_per_window": [{"fold": "all_train", "regime": "Training data", "sharpe": 2.7718, "sortino": 7.0081, "return_pct": 572.17, "equity": 6721.75, "max_dd": 11.62, "win_rate": 58.47, "profit_factor": 1.916, "ic": 0.2578, "hit": 58.18, "n": 1382}], "experiment_num": 12, "status": "DISCARD"}
{"backbone": "lfm2-350m", "description": "warmup=3 at winner lr=3e-5/wd=1e-5: Devlin(2019)+Hu(2022) show warmup stabilises adapter layers. Targeting fold7 test variance (std=1.94, IC positive 10/12 but Sharpe unstable). Projection layer receives 1% lr for 3 epochs before full strength. Prediction: fold7 test improves toward +1.0-2.0, composite beats +1.61", "config": {"seq_len": 60, "lr": 3e-05, "batch_size": 32, "epochs": 20, "weight_decay": 1e-05, "patience": 5, "grad_clip": 1.0, "warmup_epochs": 3}, "composite": -0.6451, "test_pos_folds": 4, "val_pos_folds": 4, "val_loss": 0.001214, "elapsed_sec": 204.2, "timestamp": "2026-04-11T15:38:05", "sharpe": -0.0451, "psr": 0.4718, "equity": 978.65, "sortino": -0.0652, "return_pct": -2.13, "max_dd": 12.5, "win_rate": 50.08, "profit_factor": 0.992, "ic": 0.0193, "hit": 49.76, "per_window": [{"fold": "fold_1", "regime": "Pre-crisis upturn + GFC onset", "sharpe": -0.2736, "sortino": -0.4913, "return_pct": -0.68, "equity": 993.17, "max_dd": 3.55, "win_rate": 50.0, "profit_factor": 0.959, "ic": 0.1521, "hit": 49.06, "n": 53}, {"fold": "fold_2", "regime": "Post-crash recovery", "sharpe": 0.0813, "sortino": 0.133, "return_pct": 0.05, "equity": 1000.52, "max_dd": 3.71, "win_rate": 47.37, "profit_factor": 1.013, "ic": -0.041, "hit": 47.37, "n": 57}, {"fold": "fold_3", "regime": "Eurozone debt plateau", "sharpe": -1.6955, "sortino": -2.789, "return_pct": -3.02, "equity": 969.84, "max_dd": 5.27, "win_rate": 53.7, "profit_factor": 0.763, "ic": -0.0804, "hit": 51.79, "n": 56}, {"fold": "fold_4", "regime": "Strong USD downturn", "sharpe": -0.5347, "sortino": -0.7394, "return_pct": -2.93, "equity": 970.66, "max_dd": 7.36, "win_rate": 48.72, "profit_factor": 0.914, "ic": -0.0753, "hit": 48.31, "n": 118}, {"fold": "fold_5", "regime": "Low-vol plateau", "sharpe": 0.9458, "sortino": 1.6811, "return_pct": 2.09, "equity": 1020.92, "max_dd": 2.3, "win_rate": 51.79, "profit_factor": 1.17, "ic": 0.1844, "hit": 51.79, "n": 112}, {"fold": "fold_6", "regime": "EUR crisis downturn", "sharpe": 0.2516, "sortino": 0.4111, "return_pct": 0.92, "equity": 1009.15, "max_dd": 8.24, "win_rate": 45.22, "profit_factor": 1.041, "ic": 0.1286, "hit": 45.22, "n": 115}, {"fold": "fold_7", "regime": "Recent mixed/upturn", "sharpe": 0.4178, "sortino": 0.5402, "return_pct": 1.55, "equity": 1015.46, "max_dd": 5.22, "win_rate": 54.46, "profit_factor": 1.074, "ic": 0.26, "hit": 54.46, "n": 112}], "val_sharpe": 0.0776, "val_psr": 0.5398, "val_equity": 1005.01, "val_sortino": 0.1293, "val_return_pct": 0.5, "val_max_dd": 10.56, "val_win_rate": 48.56, "val_profit_factor": 1.013, "val_ic": -0.0083, "val_hit": 48.33, "val_per_window": [{"fold": "fold_1", "regime": "Pre-crisis upturn + GFC onset", "sharpe": -3.512, "sortino": -5.0403, "return_pct": -5.34, "equity": 946.56, "max_dd": 5.29, "win_rate": 44.83, "profit_factor": 0.56, "ic": -0.1113, "hit": 44.07, "n": 59}, {"fold": "fold_2", "regime": "Post-crash recovery", "sharpe": -2.7628, "sortino": -4.6142, "return_pct": -5.28, "equity": 947.2, "max_dd": 6.25, "win_rate": 43.1, "profit_factor": 0.639, "ic": -0.2238, "hit": 43.1, "n": 58}, {"fold": "fold_3", "regime": "Eurozone debt plateau", "sharpe": 2.3853, "sortino": 5.3332, "return_pct": 5.61, "equity": 1056.12, "max_dd": 2.16, "win_rate": 42.62, "profit_factor": 1.489, "ic": 0.1962, "hit": 42.62, "n": 61}, {"fold": "fold_4", "regime": "Strong USD downturn", "sharpe": -0.5757, "sortino": -1.0208, "return_pct": -1.35, "equity": 986.49, "max_dd": 5.23, "win_rate": 41.67, "profit_factor": 0.915, "ic": -0.0802, "hit": 41.67, "n": 60}, {"fold": "fold_5", "regime": "Low-vol plateau", "sharpe": 0.2968, "sortino": 0.5147, "return_pct": 0.46, "equity": 1004.55, "max_dd": 3.7, "win_rate": 50.0, "profit_factor": 1.049, "ic": 0.0289, "hit": 50.0, "n": 62}, {"fold": "fold_6", "regime": "EUR crisis downturn", "sharpe": 2.6443, "sortino": 3.8416, "return_pct": 2.73, "equity": 1027.35, "max_dd": 1.63, "win_rate": 61.4, "profit_factor": 1.544, "ic": 0.3158, "hit": 60.34, "n": 58}, {"fold": "fold_7", "regime": "Recent mixed/upturn", "sharpe": 3.3532, "sortino": 5.9884, "return_pct": 4.25, "equity": 1042.52, "max_dd": 2.07, "win_rate": 56.67, "profit_factor": 1.73, "ic": 0.1727, "hit": 56.67, "n": 60}], "train_sharpe": 1.5569, "train_psr": 1.0, "train_equity": 2892.39, "train_sortino": 3.5897, "train_return_pct": 189.24, "train_max_dd": 15.94, "train_win_rate": 53.24, "train_profit_factor": 1.434, "train_ic": 0.1291, "train_hit": 52.97, "train_per_window": [{"fold": "all_train", "regime": "Training data", "sharpe": 1.5569, "sortino": 3.5897, "return_pct": 189.24, "equity": 2892.39, "max_dd": 15.94, "win_rate": 53.24, "profit_factor": 1.434, "ic": 0.1291, "hit": 52.97, "n": 1382}], "experiment_num": 13, "status": "DISCARD"}
{"backbone": "lfm2-350m", "description": "Exp14: huber_delta=0.5. delta=1.0 puts all FX returns in MSE zone (vol~60bps). delta=0.5=1sigma makes loss robust to fold2 fat tails. Cite: Huber1964", "config": {"seq_len": 60, "lr": 3e-05, "batch_size": 32, "epochs": 20, "weight_decay": 1e-05, "patience": 5, "grad_clip": 1.0, "warmup_epochs": 0, "huber_delta": 0.5}, "composite": 1.3326, "test_pos_folds": 6, "val_pos_folds": 6, "val_loss": 0.001129, "elapsed_sec": 175.4, "timestamp": "2026-04-11T19:45:32", "sharpe": 1.5704, "psr": 0.9932, "equity": 1424.74, "sortino": 2.4729, "return_pct": 42.47, "max_dd": 9.8, "win_rate": 53.96, "profit_factor": 1.302, "ic": 0.0909, "hit": 53.61, "per_window": [{"fold": "fold_1", "regime": "Pre-crisis upturn + GFC onset", "sharpe": 0.4078, "sortino": 0.8, "return_pct": 0.76, "equity": 1007.59, "max_dd": 3.2, "win_rate": 48.08, "profit_factor": 1.065, "ic": -0.1073, "hit": 47.17, "n": 53}, {"fold": "fold_2", "regime": "Post-crash recovery", "sharpe": -1.5333, "sortino": -2.2093, "return_pct": -4.44, "equity": 955.57, "max_dd": 7.44, "win_rate": 52.63, "profit_factor": 0.782, "ic": 0.0195, "hit": 52.63, "n": 57}, {"fold": "fold_3", "regime": "Eurozone debt plateau", "sharpe": 5.2447, "sortino": 7.9556, "return_pct": 9.16, "equity": 1091.6, "max_dd": 1.87, "win_rate": 62.96, "profit_factor": 2.316, "ic": 0.2443, "hit": 60.71, "n": 56}, {"fold": "fold_4", "regime": "Strong USD downturn", "sharpe": 2.272, "sortino": 3.5508, "return_pct": 11.75, "equity": 1117.47, "max_dd": 3.65, "win_rate": 55.56, "profit_factor": 1.465, "ic": 0.1019, "hit": 55.08, "n": 118}, {"fold": "fold_5", "regime": "Low-vol plateau", "sharpe": 1.5723, "sortino": 2.9794, "return_pct": 3.53, "equity": 1035.3, "max_dd": 2.1, "win_rate": 55.36, "profit_factor": 1.299, "ic": 0.1002, "hit": 55.36, "n": 112}, {"fold": "fold_6", "regime": "EUR crisis downturn", "sharpe": 1.4097, "sortino": 2.5006, "return_pct": 6.3, "equity": 1062.95, "max_dd": 4.85, "win_rate": 49.57, "profit_factor": 1.25, "ic": 0.0326, "hit": 49.57, "n": 115}, {"fold": "fold_7", "regime": "Recent mixed/upturn", "sharpe": 2.4294, "sortino": 4.9211, "return_pct": 10.23, "equity": 1102.32, "max_dd": 3.79, "win_rate": 54.46, "profit_factor": 1.518, "ic": 0.3068, "hit": 54.46, "n": 112}], "val_sharpe": 1.5326, "val_psr": 0.9775, "val_equity": 1204.82, "val_sortino": 2.6358, "val_return_pct": 20.48, "val_max_dd": 6.4, "val_win_rate": 54.33, "val_profit_factor": 1.291, "val_ic": 0.0843, "val_hit": 54.07, "val_per_window": [{"fold": "fold_1", "regime": "Pre-crisis upturn + GFC onset", "sharpe": -3.4875, "sortino": -5.2412, "return_pct": -5.31, "equity": 946.91, "max_dd": 5.19, "win_rate": 43.1, "profit_factor": 0.562, "ic": -0.2655, "hit": 42.37, "n": 59}, {"fold": "fold_2", "regime": "Post-crash recovery", "sharpe": 2.3485, "sortino": 3.7486, "return_pct": 4.58, "equity": 1045.76, "max_dd": 3.5, "win_rate": 60.34, "profit_factor": 1.463, "ic": 0.1396, "hit": 60.34, "n": 58}, {"fold": "fold_3", "regime": "Eurozone debt plateau", "sharpe": 1.3993, "sortino": 2.735, "return_pct": 3.23, "equity": 1032.3, "max_dd": 4.08, "win_rate": 49.18, "profit_factor": 1.263, "ic": 0.0799, "hit": 49.18, "n": 61}, {"fold": "fold_4", "regime": "Strong USD downturn", "sharpe": 4.3277, "sortino": 12.0178, "return_pct": 9.46, "equity": 1094.64, "max_dd": 1.61, "win_rate": 56.67, "profit_factor": 1.942, "ic": 0.1612, "hit": 56.67, "n": 60}, {"fold": "fold_5", "regime": "Low-vol plateau", "sharpe": 0.2095, "sortino": 0.3231, "return_pct": 0.3, "equity": 1003.03, "max_dd": 4.11, "win_rate": 54.84, "profit_factor": 1.035, "ic": -0.095, "hit": 54.84, "n": 62}, {"fold": "fold_6", "regime": "EUR crisis downturn", "sharpe": 6.2182, "sortino": 10.0468, "return_pct": 6.2, "equity": 1062.03, "max_dd": 0.74, "win_rate": 64.91, "profit_factor": 2.805, "ic": 0.3047, "hit": 63.79, "n": 58}, {"fold": "fold_7", "regime": "Recent mixed/upturn", "sharpe": 0.8653, "sortino": 1.4918, "return_pct": 1.08, "equity": 1010.77, "max_dd": 3.78, "win_rate": 51.67, "profit_factor": 1.152, "ic": 0.161, "hit": 51.67, "n": 60}], "train_sharpe": 1.6887, "train_psr": 1.0, "train_equity": 3173.12, "train_sortino": 3.7836, "train_return_pct": 217.31, "train_max_dd": 7.81, "train_win_rate": 53.75, "train_profit_factor": 1.479, "train_ic": 0.1117, "train_hit": 53.47, "train_per_window": [{"fold": "all_train", "regime": "Training data", "sharpe": 1.6887, "sortino": 3.7836, "return_pct": 217.31, "equity": 3173.12, "max_dd": 7.81, "win_rate": 53.75, "profit_factor": 1.479, "ic": 0.1117, "hit": 53.47, "n": 1382}], "experiment_num": 14, "status": "DISCARD"}
