{"backbone": "lfm2-350m", "description": "lfm2: H-Exp13 warmup=3 stabilize het-init", "config": {"seq_len": 60, "lr": 3e-05, "batch_size": 32, "epochs": 30, "weight_decay": 1e-05, "patience": 8, "grad_clip": 1.0, "warmup_epochs": 3, "huber_delta": 1.0, "head_dropout": 0.1}, "composite": 1.6005, "test_pos_folds": 6, "val_pos_folds": 6, "val_loss": -1.670378, "elapsed_sec": 381.0, "timestamp": "2026-04-12T10:08:51", "sharpe": 1.8005, "psr": 0.9978, "equity": 1502.07, "sortino": 2.9974, "return_pct": 50.21, "max_dd": 7.71, "win_rate": 54.93, "profit_factor": 1.353, "ic": 0.1487, "hit": 54.57, "aleatoric_mean": 0.06525, "epistemic_mean": 0.007301, "confidence_mean": 0.9364, "per_window": [{"fold": "fold_1", "regime": "Pre-crisis upturn + GFC onset", "sharpe": -3.2572, "sortino": -5.6109, "return_pct": -6.63, "equity": 933.73, "max_dd": 7.11, "win_rate": 40.38, "profit_factor": 0.607, "ic": -0.1068, "hit": 39.62, "n": 53, "aleatoric_mean": 0.172007, "epistemic_mean": 0.005812, "confidence_mean": 0.857, "aleatoric_std": 0.125248, "epistemic_std": 0.003127}, {"fold": "fold_2", "regime": "Post-crash recovery", "sharpe": 3.4586, "sortino": 6.7487, "return_pct": 9.94, "equity": 1099.45, "max_dd": 3.13, "win_rate": 52.63, "profit_factor": 1.743, "ic": 0.2337, "hit": 52.63, "n": 57, "aleatoric_mean": 0.12038, "epistemic_mean": 0.007045, "confidence_mean": 0.8919, "aleatoric_std": 0.092872, "epistemic_std": 0.002976}, {"fold": "fold_3", "regime": "Eurozone debt plateau", "sharpe": 3.2003, "sortino": 6.6063, "return_pct": 5.65, "equity": 1056.49, "max_dd": 2.47, "win_rate": 57.41, "profit_factor": 1.667, "ic": 0.1512, "hit": 55.36, "n": 56, "aleatoric_mean": 0.071592, "epistemic_mean": 0.00711, "confidence_mean": 0.9292, "aleatoric_std": 0.054988, "epistemic_std": 0.002908}, {"fold": "fold_4", "regime": "Strong USD downturn", "sharpe": 0.359, "sortino": 0.5179, "return_pct": 1.55, "equity": 1015.54, "max_dd": 5.24, "win_rate": 55.56, "profit_factor": 1.062, "ic": 0.0742, "hit": 55.08, "n": 118, "aleatoric_mean": 0.045411, "epistemic_mean": 0.008621, "confidence_mean": 0.9506, "aleatoric_std": 0.051995, "epistemic_std": 0.00377}, {"fold": "fold_5", "regime": "Low-vol plateau", "sharpe": 1.3262, "sortino": 2.4006, "return_pct": 2.96, "equity": 1029.64, "max_dd": 2.64, "win_rate": 52.68, "profit_factor": 1.247, "ic": 0.0566, "hit": 52.68, "n": 112, "aleatoric_mean": 0.024287, "epistemic_mean": 0.008173, "confidence_mean": 0.969, "aleatoric_std": 0.022957, "epistemic_std": 0.003274}, {"fold": "fold_6", "regime": "EUR crisis downturn", "sharpe": 4.3712, "sortino": 8.2343, "return_pct": 20.65, "equity": 1206.45, "max_dd": 2.3, "win_rate": 58.26, "profit_factor": 1.999, "ic": 0.2951, "hit": 58.26, "n": 115, "aleatoric_mean": 0.084878, "epistemic_mean": 0.005939, "confidence_mean": 0.9199, "aleatoric_std": 0.068656, "epistemic_std": 0.002298}, {"fold": "fold_7", "regime": "Recent mixed/upturn", "sharpe": 2.3274, "sortino": 4.7008, "return_pct": 9.78, "equity": 1097.83, "max_dd": 4.31, "win_rate": 59.82, "profit_factor": 1.491, "ic": 0.2013, "hit": 59.82, "n": 112, "aleatoric_mean": 0.025216, "epistemic_mean": 0.007369, "confidence_mean": 0.9695, "aleatoric_std": 0.036943, "epistemic_std": 0.002631}], "val_sharpe": 2.5823, "val_psr": 0.9996, "val_equity": 1369.55, "val_sortino": 4.2318, "val_return_pct": 36.96, "val_max_dd": 4.34, "val_win_rate": 54.09, "val_profit_factor": 1.539, "val_ic": 0.1207, "val_hit": 53.83, "val_aleatoric_mean": 0.067528, "val_epistemic_mean": 0.007975, "val_confidence_mean": 0.9375, "val_per_window": [{"fold": "fold_1", "regime": "Pre-crisis upturn + GFC onset", "sharpe": 1.5106, "sortino": 2.5787, "return_pct": 2.36, "equity": 1023.58, "max_dd": 3.73, "win_rate": 46.55, "profit_factor": 1.282, "ic": -0.1031, "hit": 45.76, "n": 59, "aleatoric_mean": 0.216563, "epistemic_mean": 0.006636, "confidence_mean": 0.8408, "aleatoric_std": 0.220665, "epistemic_std": 0.003635}, {"fold": "fold_2", "regime": "Post-crash recovery", "sharpe": 0.8302, "sortino": 1.1981, "return_pct": 1.55, "equity": 1015.55, "max_dd": 3.59, "win_rate": 53.45, "profit_factor": 1.144, "ic": -0.0326, "hit": 53.45, "n": 58, "aleatoric_mean": 0.1153, "epistemic_mean": 0.007453, "confidence_mean": 0.8942, "aleatoric_std": 0.075541, "epistemic_std": 0.003166}, {"fold": "fold_3", "regime": "Eurozone debt plateau", "sharpe": 5.4003, "sortino": 12.429, "return_pct": 12.71, "equity": 1127.14, "max_dd": 1.61, "win_rate": 57.38, "profit_factor": 2.484, "ic": 0.3406, "hit": 57.38, "n": 61, "aleatoric_mean": 0.025515, "epistemic_mean": 0.009791, "confidence_mean": 0.9662, "aleatoric_std": 0.019008, "epistemic_std": 0.004513}, {"fold": "fold_4", "regime": "Strong USD downturn", "sharpe": 0.1931, "sortino": 0.337, "return_pct": 0.32, "equity": 1003.23, "max_dd": 4.34, "win_rate": 45.0, "profit_factor": 1.03, "ic": 0.0533, "hit": 45.0, "n": 60, "aleatoric_mean": 0.033215, "epistemic_mean": 0.007585, "confidence_mean": 0.9619, "aleatoric_std": 0.03766, "epistemic_std": 0.003043}, {"fold": "fold_5", "regime": "Low-vol plateau", "sharpe": 7.0939, "sortino": 11.4402, "return_pct": 11.84, "equity": 1118.39, "max_dd": 1.07, "win_rate": 67.74, "profit_factor": 3.209, "ic": 0.4364, "hit": 67.74, "n": 62, "aleatoric_mean": 0.01948, "epistemic_mean": 0.008992, "confidence_mean": 0.9725, "aleatoric_std": 0.014413, "epistemic_std": 0.003409}, {"fold": "fold_6", "regime": "EUR crisis downturn", "sharpe": 4.3189, "sortino": 8.5688, "return_pct": 4.42, "equity": 1044.2, "max_dd": 1.77, "win_rate": 59.65, "profit_factor": 2.037, "ic": 0.1939, "hit": 58.62, "n": 58, "aleatoric_mean": 0.011805, "epistemic_mean": 0.007476, "confidence_mean": 0.9811, "aleatoric_std": 0.00719, "epistemic_std": 0.003155}, {"fold": "fold_7", "regime": "Recent mixed/upturn", "sharpe": -0.1534, "sortino": -0.2232, "return_pct": -0.23, "equity": 997.7, "max_dd": 2.92, "win_rate": 48.33, "profit_factor": 0.975, "ic": -0.054, "hit": 48.33, "n": 60, "aleatoric_mean": 0.055338, "epistemic_mean": 0.007771, "confidence_mean": 0.9425, "aleatoric_std": 0.050204, "epistemic_std": 0.003028}], "train_sharpe": 0.477, "train_psr": 0.8501, "train_equity": 1339.93, "train_sortino": 0.4962, "train_return_pct": 33.99, "train_max_dd": 19.95, "train_win_rate": 54.33, "train_profit_factor": 1.116, "train_ic": 0.0998, "train_hit": 54.05, "train_per_window": [{"fold": "all_train", "regime": "Training data", "sharpe": 0.477, "sortino": 0.4962, "return_pct": 33.99, "equity": 1339.93, "max_dd": 19.95, "win_rate": 54.33, "profit_factor": 1.116, "ic": 0.0998, "hit": 54.05, "n": 1382}], "experiment_num": 35, "status": "DISCARD"}
{"backbone": "lfm2-350m", "description": "lfm2: H-Exp14 warmup=5 more stabilization", "config": {"seq_len": 60, "lr": 3e-05, "batch_size": 32, "epochs": 30, "weight_decay": 1e-05, "patience": 8, "grad_clip": 1.0, "warmup_epochs": 5, "huber_delta": 1.0, "head_dropout": 0.1}, "composite": 0.3197, "test_pos_folds": 5, "val_pos_folds": 4, "val_loss": -1.637183, "elapsed_sec": 394.0, "timestamp": "2026-04-12T10:17:52", "sharpe": 1.0045, "psr": 0.9435, "equity": 1249.99, "sortino": 1.5723, "return_pct": 25.0, "max_dd": 9.18, "win_rate": 52.83, "profit_factor": 1.184, "ic": 0.032, "hit": 52.49, "aleatoric_mean": 0.077268, "epistemic_mean": 0.008223, "confidence_mean": 0.9255, "per_window": [{"fold": "fold_1", "regime": "Pre-crisis upturn + GFC onset", "sharpe": 0.707, "sortino": 1.284, "return_pct": 1.4, "equity": 1013.98, "max_dd": 5.34, "win_rate": 55.77, "profit_factor": 1.115, "ic": 0.0025, "hit": 54.72, "n": 53, "aleatoric_mean": 0.190004, "epistemic_mean": 0.00604, "confidence_mean": 0.8415, "aleatoric_std": 0.099779, "epistemic_std": 0.002319}, {"fold": "fold_2", "regime": "Post-crash recovery", "sharpe": -0.2023, "sortino": -0.3436, "return_pct": -0.76, "equity": 992.44, "max_dd": 4.74, "win_rate": 56.14, "profit_factor": 0.968, "ic": 0.0567, "hit": 56.14, "n": 57, "aleatoric_mean": 0.133822, "epistemic_mean": 0.008708, "confidence_mean": 0.88, "aleatoric_std": 0.086881, "epistemic_std": 0.003468}, {"fold": "fold_3", "regime": "Eurozone debt plateau", "sharpe": -1.0386, "sortino": -1.6851, "return_pct": -1.89, "equity": 981.09, "max_dd": 7.02, "win_rate": 53.7, "profit_factor": 0.847, "ic": -0.12, "hit": 51.79, "n": 56, "aleatoric_mean": 0.086351, "epistemic_mean": 0.006827, "confidence_mean": 0.9174, "aleatoric_std": 0.062232, "epistemic_std": 0.002972}, {"fold": "fold_4", "regime": "Strong USD downturn", "sharpe": 0.6892, "sortino": 1.1543, "return_pct": 3.26, "equity": 1032.63, "max_dd": 3.06, "win_rate": 51.28, "profit_factor": 1.122, "ic": 0.0457, "hit": 50.85, "n": 118, "aleatoric_mean": 0.054193, "epistemic_mean": 0.009122, "confidence_mean": 0.9424, "aleatoric_std": 0.052787, "epistemic_std": 0.003219}, {"fold": "fold_5", "regime": "Low-vol plateau", "sharpe": 0.8525, "sortino": 1.2209, "return_pct": 1.88, "equity": 1018.78, "max_dd": 2.75, "win_rate": 48.21, "profit_factor": 1.152, "ic": 0.141, "hit": 48.21, "n": 112, "aleatoric_mean": 0.035149, "epistemic_mean": 0.008913, "confidence_mean": 0.9586, "aleatoric_std": 0.031842, "epistemic_std": 0.004402}, {"fold": "fold_6", "regime": "EUR crisis downturn", "sharpe": 3.3404, "sortino": 5.0245, "return_pct": 15.61, "equity": 1156.12, "max_dd": 5.55, "win_rate": 58.26, "profit_factor": 1.697, "ic": 0.164, "hit": 58.26, "n": 115, "aleatoric_mean": 0.106796, "epistemic_mean": 0.006805, "confidence_mean": 0.9019, "aleatoric_std": 0.079377, "epistemic_std": 0.00329}, {"fold": "fold_7", "regime": "Recent mixed/upturn", "sharpe": 1.0189, "sortino": 1.8868, "return_pct": 4.1, "equity": 1040.96, "max_dd": 5.51, "win_rate": 50.0, "profit_factor": 1.191, "ic": 0.0435, "hit": 50.0, "n": 112, "aleatoric_mean": 0.026705, "epistemic_mean": 0.009524, "confidence_mean": 0.9656, "aleatoric_std": 0.026417, "epistemic_std": 0.003336}], "val_sharpe": 0.8197, "val_psr": 0.8553, "val_equity": 1102.73, "val_sortino": 1.3316, "val_return_pct": 10.27, "val_max_dd": 6.02, "val_win_rate": 51.92, "val_profit_factor": 1.146, "val_ic": 0.0705, "val_hit": 51.67, "val_aleatoric_mean": 0.068713, "val_epistemic_mean": 0.008809, "val_confidence_mean": 0.9343, "val_per_window": [{"fold": "fold_1", "regime": "Pre-crisis upturn + GFC onset", "sharpe": 0.2131, "sortino": 0.3473, "return_pct": 0.28, "equity": 1002.85, "max_dd": 4.08, "win_rate": 51.72, "profit_factor": 1.036, "ic": 0.1142, "hit": 50.85, "n": 59, "aleatoric_mean": 0.211473, "epistemic_mean": 0.006078, "confidence_mean": 0.8411, "aleatoric_std": 0.197507, "epistemic_std": 0.003575}, {"fold": "fold_2", "regime": "Post-crash recovery", "sharpe": 1.6254, "sortino": 2.6911, "return_pct": 3.14, "equity": 1031.37, "max_dd": 3.09, "win_rate": 51.72, "profit_factor": 1.301, "ic": 0.1307, "hit": 51.72, "n": 58, "aleatoric_mean": 0.099098, "epistemic_mean": 0.006446, "confidence_mean": 0.906, "aleatoric_std": 0.044671, "epistemic_std": 0.002772}, {"fold": "fold_3", "regime": "Eurozone debt plateau", "sharpe": 3.0991, "sortino": 5.5368, "return_pct": 7.33, "equity": 1073.3, "max_dd": 1.9, "win_rate": 54.1, "profit_factor": 1.679, "ic": 0.1628, "hit": 54.1, "n": 61, "aleatoric_mean": 0.037616, "epistemic_mean": 0.010237, "confidence_mean": 0.9551, "aleatoric_std": 0.031847, "epistemic_std": 0.004231}, {"fold": "fold_4", "regime": "Strong USD downturn", "sharpe": -0.6824, "sortino": -1.1516, "return_pct": -1.58, "equity": 984.19, "max_dd": 4.6, "win_rate": 50.0, "profit_factor": 0.901, "ic": -0.0013, "hit": 50.0, "n": 60, "aleatoric_mean": 0.043792, "epistemic_mean": 0.010097, "confidence_mean": 0.9501, "aleatoric_std": 0.041015, "epistemic_std": 0.003992}, {"fold": "fold_5", "regime": "Low-vol plateau", "sharpe": -0.5302, "sortino": -0.8125, "return_pct": -0.98, "equity": 990.23, "max_dd": 4.84, "win_rate": 48.39, "profit_factor": 0.918, "ic": 0.0341, "hit": 48.39, "n": 62, "aleatoric_mean": 0.028405, "epistemic_mean": 0.010276, "confidence_mean": 0.9632, "aleatoric_std": 0.025353, "epistemic_std": 0.004964}, {"fold": "fold_6", "regime": "EUR crisis downturn", "sharpe": 3.4106, "sortino": 6.9657, "return_pct": 3.52, "equity": 1035.16, "max_dd": 1.45, "win_rate": 63.16, "profit_factor": 1.752, "ic": 0.0206, "hit": 62.07, "n": 58, "aleatoric_mean": 0.016679, "epistemic_mean": 0.009103, "confidence_mean": 0.975, "aleatoric_std": 0.010548, "epistemic_std": 0.003043}, {"fold": "fold_7", "regime": "Recent mixed/upturn", "sharpe": -1.1865, "sortino": -2.1868, "return_pct": -1.54, "equity": 984.64, "max_dd": 2.27, "win_rate": 45.0, "profit_factor": 0.824, "ic": -0.1655, "hit": 45.0, "n": 60, "aleatoric_mean": 0.047449, "epistemic_mean": 0.009239, "confidence_mean": 0.9476, "aleatoric_std": 0.040227, "epistemic_std": 0.003405}], "train_sharpe": 1.4557, "train_psr": 0.9995, "train_equity": 2689.12, "train_sortino": 1.8615, "train_return_pct": 168.91, "train_max_dd": 13.94, "train_win_rate": 55.64, "train_profit_factor": 1.4, "train_ic": 0.1482, "train_hit": 55.35, "train_per_window": [{"fold": "all_train", "regime": "Training data", "sharpe": 1.4557, "sortino": 1.8615, "return_pct": 168.91, "equity": 2689.12, "max_dd": 13.94, "win_rate": 55.64, "profit_factor": 1.4, "ic": 0.1482, "hit": 55.35, "n": 1382}], "experiment_num": 36, "status": "DISCARD"}
{"backbone": "lfm2-350m", "description": "lfm2: H-Exp15 warmup=1 minimal stabilization", "config": {"seq_len": 60, "lr": 3e-05, "batch_size": 32, "epochs": 30, "weight_decay": 1e-05, "patience": 8, "grad_clip": 1.0, "warmup_epochs": 1, "huber_delta": 1.0, "head_dropout": 0.1}, "composite": -0.875, "test_pos_folds": 4, "val_pos_folds": 3, "val_loss": -1.658677, "elapsed_sec": 401.4, "timestamp": "2026-04-12T10:24:55", "sharpe": 0.3525, "psr": 0.7102, "equity": 1073.88, "sortino": 0.5482, "return_pct": 7.39, "max_dd": 12.55, "win_rate": 49.76, "profit_factor": 1.061, "ic": 0.0016, "hit": 49.44, "aleatoric_mean": 0.074987, "epistemic_mean": 0.008452, "confidence_mean": 0.9267, "per_window": [{"fold": "fold_1", "regime": "Pre-crisis upturn + GFC onset", "sharpe": 3.8102, "sortino": 7.0171, "return_pct": 8.04, "equity": 1080.39, "max_dd": 1.78, "win_rate": 57.69, "profit_factor": 1.794, "ic": 0.16, "hit": 56.6, "n": 53, "aleatoric_mean": 0.135209, "epistemic_mean": 0.006644, "confidence_mean": 0.8819, "aleatoric_std": 0.104697, "epistemic_std": 0.002697}, {"fold": "fold_2", "regime": "Post-crash recovery", "sharpe": -1.8337, "sortino": -3.0939, "return_pct": -5.25, "equity": 947.54, "max_dd": 8.31, "win_rate": 38.6, "profit_factor": 0.745, "ic": -0.2154, "hit": 38.6, "n": 57, "aleatoric_mean": 0.142575, "epistemic_mean": 0.00771, "confidence_mean": 0.8749, "aleatoric_std": 0.099152, "epistemic_std": 0.003061}, {"fold": "fold_3", "regime": "Eurozone debt plateau", "sharpe": 4.1722, "sortino": 8.0633, "return_pct": 7.35, "equity": 1073.46, "max_dd": 2.08, "win_rate": 62.96, "profit_factor": 1.948, "ic": 0.2887, "hit": 60.71, "n": 56, "aleatoric_mean": 0.088691, "epistemic_mean": 0.007699, "confidence_mean": 0.9145, "aleatoric_std": 0.058327, "epistemic_std": 0.003717}, {"fold": "fold_4", "regime": "Strong USD downturn", "sharpe": -1.4067, "sortino": -2.3615, "return_pct": -7.1, "equity": 929.01, "max_dd": 12.55, "win_rate": 39.32, "profit_factor": 0.79, "ic": -0.1078, "hit": 38.98, "n": 118, "aleatoric_mean": 0.069444, "epistemic_mean": 0.008154, "confidence_mean": 0.9303, "aleatoric_std": 0.058239, "epistemic_std": 0.003461}, {"fold": "fold_5", "regime": "Low-vol plateau", "sharpe": 0.5189, "sortino": 0.8675, "return_pct": 1.12, "equity": 1011.18, "max_dd": 4.4, "win_rate": 50.89, "profit_factor": 1.09, "ic": 0.0183, "hit": 50.89, "n": 112, "aleatoric_mean": 0.019515, "epistemic_mean": 0.010969, "confidence_mean": 0.9706, "aleatoric_std": 0.015255, "epistemic_std": 0.003778}, {"fold": "fold_6", "regime": "EUR crisis downturn", "sharpe": 1.8679, "sortino": 3.461, "return_pct": 8.48, "equity": 1084.78, "max_dd": 3.04, "win_rate": 53.91, "profit_factor": 1.344, "ic": -0.0128, "hit": 53.91, "n": 115, "aleatoric_mean": 0.101206, "epistemic_mean": 0.007792, "confidence_mean": 0.9047, "aleatoric_std": 0.066961, "epistemic_std": 0.003118}, {"fold": "fold_7", "regime": "Recent mixed/upturn", "sharpe": -0.9682, "sortino": -1.247, "return_pct": -4.1, "equity": 958.96, "max_dd": 5.87, "win_rate": 50.89, "profit_factor": 0.847, "ic": 0.0186, "hit": 50.89, "n": 112, "aleatoric_mean": 0.039629, "epistemic_mean": 0.008539, "confidence_mean": 0.9554, "aleatoric_std": 0.042874, "epistemic_std": 0.00336}], "val_sharpe": -0.175, "val_psr": 0.4108, "val_equity": 973.7, "val_sortino": -0.2515, "val_return_pct": -2.63, "val_max_dd": 15.48, "val_win_rate": 51.44, "val_profit_factor": 0.971, "val_ic": 0.0428, "val_hit": 51.2, "val_aleatoric_mean": 0.083536, "val_epistemic_mean": 0.008983, "val_confidence_mean": 0.9254, "val_per_window": [{"fold": "fold_1", "regime": "Pre-crisis upturn + GFC onset", "sharpe": -0.3838, "sortino": -0.6046, "return_pct": -0.66, "equity": 993.4, "max_dd": 3.84, "win_rate": 56.9, "profit_factor": 0.939, "ic": 0.0057, "hit": 55.93, "n": 59, "aleatoric_mean": 0.256531, "epistemic_mean": 0.005573, "confidence_mean": 0.8201, "aleatoric_std": 0.247255, "epistemic_std": 0.003192}, {"fold": "fold_2", "regime": "Post-crash recovery", "sharpe": -1.1147, "sortino": -1.8088, "return_pct": -2.24, "equity": 977.6, "max_dd": 3.53, "win_rate": 50.0, "profit_factor": 0.835, "ic": 0.0123, "hit": 50.0, "n": 58, "aleatoric_mean": 0.172261, "epistemic_mean": 0.006264, "confidence_mean": 0.8536, "aleatoric_std": 0.096122, "epistemic_std": 0.003197}, {"fold": "fold_3", "regime": "Eurozone debt plateau", "sharpe": -5.6804, "sortino": -7.0573, "return_pct": -11.98, "equity": 880.24, "max_dd": 10.8, "win_rate": 44.26, "profit_factor": 0.383, "ic": -0.1952, "hit": 44.26, "n": 61, "aleatoric_mean": 0.03657, "epistemic_mean": 0.011139, "confidence_mean": 0.955, "aleatoric_std": 0.02713, "epistemic_std": 0.004836}, {"fold": "fold_4", "regime": "Strong USD downturn", "sharpe": 1.5524, "sortino": 2.8008, "return_pct": 3.34, "equity": 1033.37, "max_dd": 3.29, "win_rate": 48.33, "profit_factor": 1.269, "ic": 0.0409, "hit": 48.33, "n": 60, "aleatoric_mean": 0.037198, "epistemic_mean": 0.009843, "confidence_mean": 0.9561, "aleatoric_std": 0.037393, "epistemic_std": 0.004096}, {"fold": "fold_5", "regime": "Low-vol plateau", "sharpe": 3.4431, "sortino": 6.2275, "return_pct": 5.95, "equity": 1059.54, "max_dd": 2.74, "win_rate": 56.45, "profit_factor": 1.75, "ic": 0.2156, "hit": 56.45, "n": 62, "aleatoric_mean": 0.022298, "epistemic_mean": 0.010403, "confidence_mean": 0.9685, "aleatoric_std": 0.016793, "epistemic_std": 0.004946}, {"fold": "fold_6", "regime": "EUR crisis downturn", "sharpe": -1.191, "sortino": -2.1591, "return_pct": -1.26, "equity": 987.45, "max_dd": 3.3, "win_rate": 42.11, "profit_factor": 0.823, "ic": -0.0441, "hit": 41.38, "n": 58, "aleatoric_mean": 0.013322, "epistemic_mean": 0.010836, "confidence_mean": 0.9765, "aleatoric_std": 0.008054, "epistemic_std": 0.004162}, {"fold": "fold_7", "regime": "Recent mixed/upturn", "sharpe": 4.2469, "sortino": 8.4682, "return_pct": 5.35, "equity": 1053.54, "max_dd": 1.47, "win_rate": 61.67, "profit_factor": 2.005, "ic": 0.283, "hit": 61.67, "n": 60, "aleatoric_mean": 0.052899, "epistemic_mean": 0.008657, "confidence_mean": 0.9435, "aleatoric_std": 0.046549, "epistemic_std": 0.004243}], "train_sharpe": 1.2116, "train_psr": 0.9977, "train_equity": 2263.1, "train_sortino": 1.5798, "train_return_pct": 126.31, "train_max_dd": 15.99, "train_win_rate": 54.04, "train_profit_factor": 1.323, "train_ic": 0.1271, "train_hit": 53.76, "train_per_window": [{"fold": "all_train", "regime": "Training data", "sharpe": 1.2116, "sortino": 1.5798, "return_pct": 126.31, "equity": 2263.1, "max_dd": 15.99, "win_rate": 54.04, "profit_factor": 1.323, "ic": 0.1271, "hit": 53.76, "n": 1382}], "experiment_num": 37, "status": "DISCARD"}
