{"backbone": "xgboost", "description": "xgboost: Exp4 shallow max_depth=2 n=100 leakage check", "config": {"seq_len": 10, "lr": 0.0003, "batch_size": 32, "epochs": 20, "weight_decay": 1e-05, "patience": 5, "grad_clip": 1.0, "warmup_epochs": 0, "huber_delta": 1.0, "head_dropout": 0.1, "seed": 0, "n_estimators": 100, "max_depth": 2, "het_loss": false}, "composite": 7.0995, "test_pos_folds": 6, "val_pos_folds": 5, "val_loss": 0.0, "elapsed_sec": 3.9, "timestamp": "2026-04-20T11:04:25", "sharpe": 7.6115, "psr": 1.0, "equity": 17292.26, "sortino": 7.5316, "return_pct": 1629.23, "max_dd": 8.36, "win_rate": 78.33, "profit_factor": 4.464, "ic": 0.6489, "hit": 78.01, "precision": 0.8032, "recall": 0.738, "f1": 0.7692, "f2": 0.7502, "mcc": 0.5635, "accuracy": 0.7811, "per_window": [{"fold": "fold_1", "regime": "Pre-crisis upturn + GFC onset", "sharpe": -0.2754, "sortino": -0.3086, "return_pct": -2.82, "equity": 971.83, "max_dd": 8.36, "win_rate": 50.98, "profit_factor": 0.937, "ic": 0.0255, "hit": 50.49, "n": 103, "precision": 0.52, "recall": 0.4906, "f1": 0.5049, "f2": 0.4962, "mcc": 0.0106, "accuracy": 0.5049, "tp": 26, "fp": 24, "tn": 26, "fn": 27}, {"fold": "fold_2", "regime": "Post-crash recovery", "sharpe": 1.71, "sortino": 3.199, "return_pct": 8.21, "equity": 1082.11, "max_dd": 4.41, "win_rate": 55.14, "profit_factor": 1.307, "ic": 0.0152, "hit": 55.14, "n": 107, "precision": 0.5366, "recall": 0.4314, "f1": 0.4783, "f2": 0.449, "mcc": 0.0946, "accuracy": 0.5514, "tp": 22, "fp": 19, "tn": 37, "fn": 29}, {"fold": "fold_3", "regime": "Eurozone debt plateau", "sharpe": 13.3239, "sortino": 22.4286, "return_pct": 43.45, "equity": 1434.47, "max_dd": 1.32, "win_rate": 83.65, "profit_factor": 9.049, "ic": 0.7104, "hit": 82.08, "n": 106, "precision": 0.88, "recall": 0.7719, "f1": 0.8224, "f2": 0.7914, "mcc": 0.6487, "accuracy": 0.8208, "tp": 44, "fp": 6, "tn": 43, "fn": 13}, {"fold": "fold_4", "regime": "Strong USD downturn", "sharpe": 14.1575, "sortino": 19.2473, "return_pct": 126.52, "equity": 2265.23, "max_dd": 1.81, "win_rate": 89.22, "profit_factor": 16.754, "ic": 0.8653, "hit": 88.69, "n": 168, "precision": 0.925, "recall": 0.8605, "f1": 0.8916, "f2": 0.8726, "mcc": 0.788, "accuracy": 0.8929, "tp": 74, "fp": 6, "tn": 76, "fn": 12}, {"fold": "fold_5", "regime": "Low-vol plateau", "sharpe": 15.7143, "sortino": 85.4999, "return_pct": 44.98, "equity": 1449.76, "max_dd": 0.23, "win_rate": 85.19, "profit_factor": 27.099, "ic": 0.9192, "hit": 85.19, "n": 162, "precision": 0.8514, "recall": 0.8289, "f1": 0.84, "f2": 0.8333, "mcc": 0.7023, "accuracy": 0.8519, "tp": 63, "fp": 11, "tn": 75, "fn": 13}, {"fold": "fold_6", "regime": "EUR crisis downturn", "sharpe": 14.613, "sortino": 43.2879, "return_pct": 96.24, "equity": 1962.36, "max_dd": 0.76, "win_rate": 81.21, "profit_factor": 14.222, "ic": 0.8838, "hit": 81.21, "n": 165, "precision": 0.8382, "recall": 0.7403, "f1": 0.7862, "f2": 0.758, "mcc": 0.6236, "accuracy": 0.8121, "tp": 57, "fp": 11, "tn": 77, "fn": 20}, {"fold": "fold_7", "regime": "Recent mixed/upturn", "sharpe": 12.2627, "sortino": 14.6232, "return_pct": 77.87, "equity": 1778.73, "max_dd": 1.64, "win_rate": 86.42, "profit_factor": 10.092, "ic": 0.8144, "hit": 86.42, "n": 162, "precision": 0.8734, "recall": 0.8519, "f1": 0.8625, "f2": 0.8561, "mcc": 0.7286, "accuracy": 0.8642, "tp": 69, "fp": 10, "tn": 71, "fn": 12}], "val_sharpe": 7.3995, "val_psr": 1.0, "val_equity": 4872.81, "val_sortino": 9.4641, "val_return_pct": 387.28, "val_max_dd": 14.89, "val_win_rate": 74.31, "val_profit_factor": 3.614, "val_ic": 0.6181, "val_hit": 73.83, "val_precision": 0.7315, "val_recall": 0.7315, "val_f1": 0.7315, "val_f2": 0.7315, "val_mcc": 0.4883, "val_accuracy": 0.7448, "val_per_window": [{"fold": "fold_1", "regime": "Pre-crisis upturn + GFC onset", "sharpe": -1.0814, "sortino": -1.742, "return_pct": -2.76, "equity": 972.41, "max_dd": 6.04, "win_rate": 43.52, "profit_factor": 0.836, "ic": -0.0788, "hit": 43.12, "n": 109, "precision": 0.4483, "recall": 0.4727, "f1": 0.4602, "f2": 0.4676, "mcc": -0.1201, "accuracy": 0.4404, "tp": 26, "fp": 32, "tn": 22, "fn": 29}, {"fold": "fold_2", "regime": "Post-crash recovery", "sharpe": -1.5176, "sortino": -2.3704, "return_pct": -7.33, "equity": 926.71, "max_dd": 14.89, "win_rate": 43.52, "profit_factor": 0.787, "ic": -0.0581, "hit": 43.52, "n": 108, "precision": 0.5172, "recall": 0.4762, "f1": 0.4959, "f2": 0.4839, "mcc": -0.1444, "accuracy": 0.4352, "tp": 30, "fp": 28, "tn": 17, "fn": 33}, {"fold": "fold_3", "regime": "Eurozone debt plateau", "sharpe": 14.8328, "sortino": 30.8187, "return_pct": 54.74, "equity": 1547.4, "max_dd": 0.7, "win_rate": 87.16, "profit_factor": 15.543, "ic": 0.8391, "hit": 85.59, "n": 111, "precision": 0.8113, "recall": 0.9149, "f1": 0.86, "f2": 0.8921, "mcc": 0.7505, "accuracy": 0.8739, "tp": 43, "fp": 10, "tn": 54, "fn": 4}, {"fold": "fold_4", "regime": "Strong USD downturn", "sharpe": 14.6251, "sortino": 28.3572, "return_pct": 45.13, "equity": 1451.35, "max_dd": 0.66, "win_rate": 88.07, "profit_factor": 17.086, "ic": 0.9034, "hit": 87.27, "n": 110, "precision": 0.925, "recall": 0.7872, "f1": 0.8506, "f2": 0.8114, "mcc": 0.7606, "accuracy": 0.8818, "tp": 37, "fp": 3, "tn": 60, "fn": 10}, {"fold": "fold_5", "regime": "Low-vol plateau", "sharpe": 15.498, "sortino": 72.0102, "return_pct": 44.62, "equity": 1446.21, "max_dd": 0.25, "win_rate": 85.71, "profit_factor": 24.384, "ic": 0.9337, "hit": 85.71, "n": 112, "precision": 0.8491, "recall": 0.8491, "f1": 0.8491, "f2": 0.8491, "mcc": 0.7135, "accuracy": 0.8571, "tp": 45, "fp": 8, "tn": 51, "fn": 8}, {"fold": "fold_6", "regime": "EUR crisis downturn", "sharpe": 15.1711, "sortino": 62.1128, "return_pct": 28.48, "equity": 1284.79, "max_dd": 0.25, "win_rate": 86.92, "profit_factor": 24.842, "ic": 0.9234, "hit": 86.11, "n": 108, "precision": 0.8235, "recall": 0.8936, "f1": 0.8571, "f2": 0.8787, "mcc": 0.7409, "accuracy": 0.8704, "tp": 42, "fp": 9, "tn": 52, "fn": 5}, {"fold": "fold_7", "regime": "Recent mixed/upturn", "sharpe": 14.8012, "sortino": 32.0265, "return_pct": 29.58, "equity": 1295.84, "max_dd": 0.5, "win_rate": 84.55, "profit_factor": 14.366, "ic": 0.8815, "hit": 84.55, "n": 110, "precision": 0.8462, "recall": 0.8302, "f1": 0.8381, "f2": 0.8333, "mcc": 0.6904, "accuracy": 0.8455, "tp": 44, "fp": 8, "tn": 49, "fn": 9}], "train_sharpe": 6.6658, "train_psr": 1.0, "train_equity": 1753111.0, "train_sortino": 13.5101, "train_return_pct": 175211.1, "train_max_dd": 11.11, "train_win_rate": 76.78, "train_profit_factor": 5.085, "train_ic": 0.675, "train_hit": 76.47, "train_precision": 0.7831, "train_recall": 0.7567, "train_f1": 0.7697, "train_f2": 0.7618, "train_mcc": 0.5347, "train_accuracy": 0.7672, "train_per_window": [{"fold": "all_train", "regime": "Training data", "sharpe": 6.6658, "sortino": 13.5101, "return_pct": 175211.1, "equity": 1753111.0, "max_dd": 11.11, "win_rate": 76.78, "profit_factor": 5.085, "ic": 0.675, "hit": 76.47, "n": 2478, "precision": 0.7831, "recall": 0.7567, "f1": 0.7697, "f2": 0.7618, "mcc": 0.5347, "accuracy": 0.7672, "tp": 964, "fp": 267, "tn": 937, "fn": 310}], "experiment_num": 178, "status": "DISCARD"}
{"backbone": "xgboost", "description": "xgboost: Exp2 SOTA recipe seed=0 variance (plumbing fixed)", "config": {"seq_len": 10, "lr": 0.0003, "batch_size": 32, "epochs": 20, "weight_decay": 1e-05, "patience": 5, "grad_clip": 1.0, "warmup_epochs": 0, "huber_delta": 1.0, "head_dropout": 0.1, "seed": 0, "het_loss": false}, "composite": 7.1686, "test_pos_folds": 7, "val_pos_folds": 5, "val_loss": 0.0, "elapsed_sec": 119.6, "timestamp": "2026-04-20T22:03:20", "sharpe": 7.8464, "psr": 1.0, "equity": 18573.41, "sortino": 7.7462, "return_pct": 1757.34, "max_dd": 8.03, "win_rate": 78.53, "profit_factor": 4.71, "ic": 0.6812, "hit": 78.21, "precision": 0.8059, "recall": 0.7422, "f1": 0.7727, "f2": 0.7541, "mcc": 0.5697, "accuracy": 0.7842, "per_window": [{"fold": "fold_1", "regime": "Pre-crisis upturn + GFC onset", "sharpe": 0.3697, "sortino": 0.4092, "return_pct": 2.14, "equity": 1021.41, "max_dd": 7.54, "win_rate": 51.96, "profit_factor": 1.091, "ic": 0.2175, "hit": 51.46, "n": 103, "precision": 0.6, "recall": 0.2264, "f1": 0.3288, "f2": 0.2586, "mcc": 0.0839, "accuracy": 0.5243, "tp": 12, "fp": 8, "tn": 42, "fn": 41}, {"fold": "fold_2", "regime": "Post-crash recovery", "sharpe": 0.2339, "sortino": 0.4098, "return_pct": 0.86, "equity": 1008.55, "max_dd": 8.03, "win_rate": 50.47, "profit_factor": 1.037, "ic": -0.0464, "hit": 50.47, "n": 107, "precision": 0.4808, "recall": 0.4902, "f1": 0.4854, "f2": 0.4883, "mcc": 0.008, "accuracy": 0.5047, "tp": 25, "fp": 27, "tn": 29, "fn": 26}, {"fold": "fold_3", "regime": "Eurozone debt plateau", "sharpe": 14.5536, "sortino": 25.5938, "return_pct": 46.13, "equity": 1461.3, "max_dd": 1.32, "win_rate": 85.58, "profit_factor": 11.655, "ic": 0.7743, "hit": 83.96, "n": 106, "precision": 0.8448, "recall": 0.8596, "f1": 0.8522, "f2": 0.8566, "mcc": 0.6771, "accuracy": 0.8396, "tp": 49, "fp": 9, "tn": 40, "fn": 8}, {"fold": "fold_4", "regime": "Strong USD downturn", "sharpe": 16.0378, "sortino": 51.3729, "return_pct": 139.51, "equity": 2395.09, "max_dd": 0.55, "win_rate": 92.22, "profit_factor": 37.1, "ic": 0.8994, "hit": 91.67, "n": 168, "precision": 0.9506, "recall": 0.8953, "f1": 0.9222, "f2": 0.9059, "mcc": 0.8469, "accuracy": 0.9226, "tp": 77, "fp": 4, "tn": 78, "fn": 9}, {"fold": "fold_5", "regime": "Low-vol plateau", "sharpe": 15.206, "sortino": 74.425, "return_pct": 44.08, "equity": 1440.76, "max_dd": 0.23, "win_rate": 83.33, "profit_factor": 22.062, "ic": 0.8914, "hit": 83.33, "n": 162, "precision": 0.8451, "recall": 0.7895, "f1": 0.8163, "f2": 0.8, "mcc": 0.6654, "accuracy": 0.8333, "tp": 60, "fp": 11, "tn": 75, "fn": 16}, {"fold": "fold_6", "regime": "EUR crisis downturn", "sharpe": 14.8765, "sortino": 42.1137, "return_pct": 97.52, "equity": 1975.22, "max_dd": 0.87, "win_rate": 82.42, "profit_factor": 15.258, "ic": 0.8858, "hit": 82.42, "n": 165, "precision": 0.8243, "recall": 0.7922, "f1": 0.8079, "f2": 0.7984, "mcc": 0.6465, "accuracy": 0.8242, "tp": 61, "fp": 13, "tn": 75, "fn": 16}, {"fold": "fold_7", "regime": "Recent mixed/upturn", "sharpe": 12.8728, "sortino": 17.1128, "return_pct": 81.02, "equity": 1810.2, "max_dd": 1.64, "win_rate": 86.42, "profit_factor": 11.865, "ic": 0.8361, "hit": 86.42, "n": 162, "precision": 0.8391, "recall": 0.9012, "f1": 0.869, "f2": 0.8881, "mcc": 0.7304, "accuracy": 0.8642, "tp": 73, "fp": 14, "tn": 67, "fn": 8}], "val_sharpe": 7.3686, "val_psr": 1.0, "val_equity": 4846.2, "val_sortino": 9.0125, "val_return_pct": 384.62, "val_max_dd": 17.18, "val_win_rate": 74.57, "val_profit_factor": 3.593, "val_ic": 0.6669, "val_hit": 74.09, "val_precision": 0.7043, "val_recall": 0.8027, "val_f1": 0.7503, "val_f2": 0.7809, "val_mcc": 0.4987, "val_accuracy": 0.7461, "val_per_window": [{"fold": "fold_1", "regime": "Pre-crisis upturn + GFC onset", "sharpe": -0.5064, "sortino": -0.8016, "return_pct": -1.34, "equity": 986.57, "max_dd": 3.96, "win_rate": 45.37, "profit_factor": 0.919, "ic": 0.0608, "hit": 44.95, "n": 109, "precision": 0.4737, "recall": 0.8182, "f1": 0.6, "f2": 0.7143, "mcc": -0.161, "accuracy": 0.4495, "tp": 45, "fp": 50, "tn": 4, "fn": 10}, {"fold": "fold_2", "regime": "Post-crash recovery", "sharpe": -2.242, "sortino": -3.4174, "return_pct": -10.47, "equity": 895.34, "max_dd": 15.66, "win_rate": 49.07, "profit_factor": 0.702, "ic": -0.2189, "hit": 49.07, "n": 108, "precision": 0.5667, "recall": 0.5397, "f1": 0.5528, "f2": 0.5449, "mcc": -0.0378, "accuracy": 0.4907, "tp": 34, "fp": 26, "tn": 19, "fn": 29}, {"fold": "fold_3", "regime": "Eurozone debt plateau", "sharpe": 14.7318, "sortino": 40.9926, "return_pct": 54.49, "equity": 1544.92, "max_dd": 0.62, "win_rate": 84.4, "profit_factor": 15.115, "ic": 0.8546, "hit": 82.88, "n": 111, "precision": 0.7679, "recall": 0.9149, "f1": 0.835, "f2": 0.8811, "mcc": 0.7034, "accuracy": 0.8468, "tp": 43, "fp": 13, "tn": 51, "fn": 4}, {"fold": "fold_4", "regime": "Strong USD downturn", "sharpe": 15.5627, "sortino": 48.9794, "return_pct": 46.95, "equity": 1469.47, "max_dd": 0.64, "win_rate": 87.16, "profit_factor": 23.671, "ic": 0.9209, "hit": 86.36, "n": 110, "precision": 0.8837, "recall": 0.8085, "f1": 0.8444, "f2": 0.8225, "mcc": 0.7392, "accuracy": 0.8727, "tp": 38, "fp": 5, "tn": 58, "fn": 9}, {"fold": "fold_5", "regime": "Low-vol plateau", "sharpe": 15.7118, "sortino": 85.904, "return_pct": 45.0, "equity": 1449.96, "max_dd": 0.25, "win_rate": 85.71, "profit_factor": 26.644, "ic": 0.9235, "hit": 85.71, "n": 112, "precision": 0.8364, "recall": 0.8679, "f1": 0.8519, "f2": 0.8614, "mcc": 0.7145, "accuracy": 0.8571, "tp": 46, "fp": 9, "tn": 50, "fn": 7}, {"fold": "fold_6", "regime": "EUR crisis downturn", "sharpe": 15.8351, "sortino": 103.8813, "return_pct": 29.2, "equity": 1291.97, "max_dd": 0.15, "win_rate": 88.79, "profit_factor": 34.128, "ic": 0.9181, "hit": 87.96, "n": 108, "precision": 0.8723, "recall": 0.8723, "f1": 0.8723, "f2": 0.8723, "mcc": 0.774, "accuracy": 0.8889, "tp": 41, "fp": 6, "tn": 55, "fn": 6}, {"fold": "fold_7", "regime": "Recent mixed/upturn", "sharpe": 14.3361, "sortino": 40.8512, "return_pct": 29.01, "equity": 1290.06, "max_dd": 0.5, "win_rate": 80.91, "profit_factor": 12.783, "ic": 0.8529, "hit": 80.91, "n": 110, "precision": 0.7667, "recall": 0.8679, "f1": 0.8142, "f2": 0.8456, "mcc": 0.6245, "accuracy": 0.8091, "tp": 46, "fp": 14, "tn": 43, "fn": 7}], "train_sharpe": 11.1849, "train_psr": 1.0, "train_equity": 69410064.0, "train_sortino": 470.6752, "train_return_pct": 6940906.4, "train_max_dd": 0.07, "train_win_rate": 98.5, "train_profit_factor": 1593.439, "train_ic": 0.9985, "train_hit": 98.1, "train_precision": 0.9827, "train_recall": 0.9835, "train_f1": 0.9831, "train_f2": 0.9834, "train_mcc": 0.9653, "train_accuracy": 0.9826, "train_per_window": [{"fold": "all_train", "regime": "Training data", "sharpe": 11.1849, "sortino": 470.6752, "return_pct": 6940906.4, "equity": 69410064.0, "max_dd": 0.07, "win_rate": 98.5, "profit_factor": 1593.439, "ic": 0.9985, "hit": 98.1, "n": 2478, "precision": 0.9827, "recall": 0.9835, "f1": 0.9831, "f2": 0.9834, "mcc": 0.9653, "accuracy": 0.9826, "tp": 1253, "fp": 22, "tn": 1182, "fn": 21}], "experiment_num": 179, "status": "DISCARD"}
{"backbone": "xgboost", "description": "xgboost: Exp3 max_depth=4 shallower trees", "config": {"seq_len": 10, "lr": 0.0003, "batch_size": 32, "epochs": 20, "weight_decay": 1e-05, "patience": 5, "grad_clip": 1.0, "warmup_epochs": 0, "huber_delta": 1.0, "head_dropout": 0.1, "seed": 42, "max_depth": 4, "het_loss": false}, "composite": 7.6919, "test_pos_folds": 7, "val_pos_folds": 7, "val_loss": 0.0, "elapsed_sec": 89.2, "timestamp": "2026-04-20T22:05:53", "sharpe": 7.6919, "psr": 1.0, "equity": 17723.1, "sortino": 7.6616, "return_pct": 1672.31, "max_dd": 7.54, "win_rate": 78.12, "profit_factor": 4.546, "ic": 0.6786, "hit": 77.8, "precision": 0.7934, "recall": 0.7505, "f1": 0.7714, "f2": 0.7587, "mcc": 0.5606, "accuracy": 0.7801, "per_window": [{"fold": "fold_1", "regime": "Pre-crisis upturn + GFC onset", "sharpe": 0.1137, "sortino": 0.1262, "return_pct": 0.14, "equity": 1001.44, "max_dd": 7.54, "win_rate": 51.96, "profit_factor": 1.027, "ic": 0.2759, "hit": 51.46, "n": 103, "precision": 0.625, "recall": 0.1887, "f1": 0.2899, "f2": 0.2193, "mcc": 0.0948, "accuracy": 0.5243, "tp": 10, "fp": 6, "tn": 44, "fn": 43}, {"fold": "fold_2", "regime": "Post-crash recovery", "sharpe": 0.7763, "sortino": 1.4518, "return_pct": 3.51, "equity": 1035.12, "max_dd": 5.82, "win_rate": 52.34, "profit_factor": 1.129, "ic": -0.0138, "hit": 52.34, "n": 107, "precision": 0.5, "recall": 0.5686, "f1": 0.5321, "f2": 0.5534, "mcc": 0.0509, "accuracy": 0.5234, "tp": 29, "fp": 29, "tn": 27, "fn": 22}, {"fold": "fold_3", "regime": "Eurozone debt plateau", "sharpe": 14.5536, "sortino": 25.5938, "return_pct": 46.13, "equity": 1461.3, "max_dd": 1.32, "win_rate": 85.58, "profit_factor": 11.655, "ic": 0.7451, "hit": 83.96, "n": 106, "precision": 0.8448, "recall": 0.8596, "f1": 0.8522, "f2": 0.8566, "mcc": 0.6771, "accuracy": 0.8396, "tp": 49, "fp": 9, "tn": 40, "fn": 8}, {"fold": "fold_4", "regime": "Strong USD downturn", "sharpe": 14.4728, "sortino": 18.1556, "return_pct": 128.81, "equity": 2288.11, "max_dd": 1.81, "win_rate": 91.02, "profit_factor": 18.646, "ic": 0.8902, "hit": 90.48, "n": 168, "precision": 0.9277, "recall": 0.8953, "f1": 0.9112, "f2": 0.9016, "mcc": 0.822, "accuracy": 0.9107, "tp": 77, "fp": 6, "tn": 76, "fn": 9}, {"fold": "fold_5", "regime": "Low-vol plateau", "sharpe": 14.8742, "sortino": 68.7986, "return_pct": 43.47, "equity": 1434.67, "max_dd": 0.23, "win_rate": 82.72, "profit_factor": 19.56, "ic": 0.8993, "hit": 82.72, "n": 162, "precision": 0.8243, "recall": 0.8026, "f1": 0.8133, "f2": 0.8069, "mcc": 0.6527, "accuracy": 0.8272, "tp": 61, "fp": 13, "tn": 73, "fn": 15}, {"fold": "fold_6", "regime": "EUR crisis downturn", "sharpe": 15.0461, "sortino": 62.8352, "return_pct": 98.34, "equity": 1983.36, "max_dd": 0.43, "win_rate": 81.82, "profit_factor": 15.987, "ic": 0.8804, "hit": 81.82, "n": 165, "precision": 0.7975, "recall": 0.8182, "f1": 0.8077, "f2": 0.814, "mcc": 0.6355, "accuracy": 0.8182, "tp": 63, "fp": 16, "tn": 72, "fn": 14}, {"fold": "fold_7", "regime": "Recent mixed/upturn", "sharpe": 12.6144, "sortino": 17.5709, "return_pct": 79.7, "equity": 1797.02, "max_dd": 1.64, "win_rate": 85.19, "profit_factor": 11.061, "ic": 0.8299, "hit": 85.19, "n": 162, "precision": 0.8276, "recall": 0.8889, "f1": 0.8571, "f2": 0.8759, "mcc": 0.7056, "accuracy": 0.8519, "tp": 72, "fp": 15, "tn": 66, "fn": 9}], "val_sharpe": 8.4579, "val_psr": 1.0, "val_equity": 5833.74, "val_sortino": 10.9881, "val_return_pct": 483.37, "val_max_dd": 8.23, "val_win_rate": 74.97, "val_profit_factor": 4.413, "val_ic": 0.6698, "val_hit": 74.48, "val_precision": 0.7055, "val_recall": 0.8137, "val_f1": 0.7557, "val_f2": 0.7895, "val_mcc": 0.5077, "val_accuracy": 0.75, "val_per_window": [{"fold": "fold_1", "regime": "Pre-crisis upturn + GFC onset", "sharpe": 3.5248, "sortino": 7.6131, "return_pct": 9.0, "equity": 1089.97, "max_dd": 2.41, "win_rate": 50.93, "profit_factor": 1.798, "ic": 0.0987, "hit": 50.46, "n": 109, "precision": 0.5109, "recall": 0.8545, "f1": 0.6395, "f2": 0.7532, "mcc": 0.0292, "accuracy": 0.5138, "tp": 47, "fp": 45, "tn": 9, "fn": 8}, {"fold": "fold_2", "regime": "Post-crash recovery", "sharpe": 0.2024, "sortino": 0.3129, "return_pct": 0.71, "equity": 1007.1, "max_dd": 8.23, "win_rate": 55.56, "profit_factor": 1.032, "ic": -0.093, "hit": 55.56, "n": 108, "precision": 0.623, "recall": 0.6032, "f1": 0.6129, "f2": 0.607, "mcc": 0.0915, "accuracy": 0.5556, "tp": 38, "fp": 23, "tn": 22, "fn": 25}, {"fold": "fold_3", "regime": "Eurozone debt plateau", "sharpe": 14.6919, "sortino": 38.9837, "return_pct": 54.39, "equity": 1543.94, "max_dd": 0.64, "win_rate": 83.49, "profit_factor": 14.951, "ic": 0.8405, "hit": 81.98, "n": 111, "precision": 0.7414, "recall": 0.9149, "f1": 0.819, "f2": 0.874, "mcc": 0.6732, "accuracy": 0.8288, "tp": 43, "fp": 15, "tn": 49, "fn": 4}, {"fold": "fold_4", "regime": "Strong USD downturn", "sharpe": 15.5901, "sortino": 49.4315, "return_pct": 47.0, "equity": 1469.98, "max_dd": 0.64, "win_rate": 86.24, "profit_factor": 23.925, "ic": 0.9124, "hit": 85.45, "n": 110, "precision": 0.881, "recall": 0.7872, "f1": 0.8315, "f2": 0.8043, "mcc": 0.7208, "accuracy": 0.8636, "tp": 37, "fp": 5, "tn": 58, "fn": 10}, {"fold": "fold_5", "regime": "Low-vol plateau", "sharpe": 14.0398, "sortino": 62.02, "return_pct": 41.88, "equity": 1418.82, "max_dd": 0.29, "win_rate": 81.25, "profit_factor": 14.827, "ic": 0.9009, "hit": 81.25, "n": 112, "precision": 0.7963, "recall": 0.8113, "f1": 0.8037, "f2": 0.8083, "mcc": 0.6244, "accuracy": 0.8125, "tp": 43, "fp": 11, "tn": 48, "fn": 10}, {"fold": "fold_6", "regime": "EUR crisis downturn", "sharpe": 14.9046, "sortino": 65.1825, "return_pct": 28.18, "equity": 1281.79, "max_dd": 0.25, "win_rate": 85.05, "profit_factor": 22.264, "ic": 0.9171, "hit": 84.26, "n": 108, "precision": 0.8039, "recall": 0.8723, "f1": 0.8367, "f2": 0.8577, "mcc": 0.7035, "accuracy": 0.8519, "tp": 41, "fp": 10, "tn": 51, "fn": 6}, {"fold": "fold_7", "regime": "Recent mixed/upturn", "sharpe": 14.1409, "sortino": 44.6192, "return_pct": 28.76, "equity": 1287.58, "max_dd": 0.35, "win_rate": 81.82, "profit_factor": 12.195, "ic": 0.8592, "hit": 81.82, "n": 110, "precision": 0.7619, "recall": 0.9057, "f1": 0.8276, "f2": 0.8727, "mcc": 0.649, "accuracy": 0.8182, "tp": 48, "fp": 15, "tn": 42, "fn": 5}], "train_sharpe": 11.1779, "train_psr": 1.0, "train_equity": 69083768.0, "train_sortino": 419.1886, "train_return_pct": 6908276.8, "train_max_dd": 0.08, "train_win_rate": 98.01, "train_profit_factor": 1193.888, "train_ic": 0.9978, "train_hit": 97.62, "train_precision": 0.9765, "train_recall": 0.9796, "train_f1": 0.9781, "train_f2": 0.979, "train_mcc": 0.9548, "train_accuracy": 0.9774, "train_per_window": [{"fold": "all_train", "regime": "Training data", "sharpe": 11.1779, "sortino": 419.1886, "return_pct": 6908276.8, "equity": 69083768.0, "max_dd": 0.08, "win_rate": 98.01, "profit_factor": 1193.888, "ic": 0.9978, "hit": 97.62, "n": 2478, "precision": 0.9765, "recall": 0.9796, "f1": 0.9781, "f2": 0.979, "mcc": 0.9548, "accuracy": 0.9774, "tp": 1248, "fp": 30, "tn": 1174, "fn": 26}], "experiment_num": 180, "status": "KEEP"}
