{"backbone": "dlinear", "description": "dlinear: Exp3 seq=30", "config": {"seq_len": 30, "lr": 0.001, "batch_size": 32, "epochs": 100, "weight_decay": 0.0001, "patience": 20, "grad_clip": 1.0, "warmup_epochs": 0, "huber_delta": 1.0, "head_dropout": 0.15, "seed": 42, "het_loss": false}, "composite": 0.9379, "test_pos_folds": 6, "val_pos_folds": 7, "val_loss": 6.7e-05, "elapsed_sec": 27.2, "timestamp": "2026-04-21T12:28:02", "sharpe": 1.0379, "psr": 0.9702, "equity": 1372.14, "sortino": 1.5476, "return_pct": 37.21, "max_dd": 12.15, "win_rate": 54.28, "profit_factor": 1.191, "ic": 0.0574, "hit": 54.02, "aleatoric_mean": 1.3e-05, "epistemic_mean": 2.6e-05, "confidence_mean": 1.0, "precision": 0.5399, "recall": 0.5569, "f1": 0.5483, "f2": 0.5534, "mcc": 0.0903, "accuracy": 0.545, "per_window": [{"fold": "fold_1", "regime": "Pre-crisis upturn + GFC onset", "sharpe": 3.4468, "sortino": 5.3019, "return_pct": 12.04, "equity": 1120.4, "max_dd": 2.56, "win_rate": 59.76, "profit_factor": 1.737, "ic": 0.1375, "hit": 59.04, "n": 83, "precision": 0.5962, "recall": 0.7209, "f1": 0.6526, "f2": 0.692, "mcc": 0.2024, "accuracy": 0.6024, "tp": 31, "fp": 21, "tn": 19, "fn": 12, "aleatoric_mean": 1.9e-05, "epistemic_mean": 3.7e-05, "confidence_mean": 0.9999, "aleatoric_std": 1e-05, "epistemic_std": 2.1e-05}, {"fold": "fold_2", "regime": "Post-crash recovery", "sharpe": 2.4481, "sortino": 4.5634, "return_pct": 9.85, "equity": 1098.47, "max_dd": 2.54, "win_rate": 52.87, "profit_factor": 1.472, "ic": 0.0845, "hit": 52.87, "n": 87, "precision": 0.5439, "recall": 0.6739, "f1": 0.6019, "f2": 0.6432, "mcc": 0.0418, "accuracy": 0.5287, "tp": 31, "fp": 26, "tn": 15, "fn": 15, "aleatoric_mean": 1.1e-05, "epistemic_mean": 2.2e-05, "confidence_mean": 1.0, "aleatoric_std": 6e-06, "epistemic_std": 1.2e-05}, {"fold": "fold_3", "regime": "Eurozone debt plateau", "sharpe": 1.252, "sortino": 2.0038, "return_pct": 3.6, "equity": 1036.0, "max_dd": 2.86, "win_rate": 57.14, "profit_factor": 1.218, "ic": 0.1264, "hit": 55.81, "n": 86, "precision": 0.6341, "recall": 0.5532, "f1": 0.5909, "f2": 0.5677, "mcc": 0.168, "accuracy": 0.5814, "tp": 26, "fp": 15, "tn": 24, "fn": 21, "aleatoric_mean": 2.4e-05, "epistemic_mean": 4.8e-05, "confidence_mean": 0.9999, "aleatoric_std": 1.4e-05, "epistemic_std": 2.7e-05}, {"fold": "fold_4", "regime": "Strong USD downturn", "sharpe": 0.4246, "sortino": 0.711, "return_pct": 2.58, "equity": 1025.78, "max_dd": 6.3, "win_rate": 50.34, "profit_factor": 1.075, "ic": 0.0121, "hit": 50.0, "n": 148, "precision": 0.5046, "recall": 0.7432, "f1": 0.6011, "f2": 0.679, "mcc": 0.0153, "accuracy": 0.5068, "tp": 55, "fp": 54, "tn": 20, "fn": 19, "aleatoric_mean": 1.6e-05, "epistemic_mean": 3.3e-05, "confidence_mean": 1.0, "aleatoric_std": 1.1e-05, "epistemic_std": 2.2e-05}, {"fold": "fold_5", "regime": "Low-vol plateau", "sharpe": 4.4692, "sortino": 7.452, "return_pct": 13.03, "equity": 1130.29, "max_dd": 1.78, "win_rate": 61.97, "profit_factor": 2.127, "ic": 0.1339, "hit": 61.97, "n": 142, "precision": 0.6667, "recall": 0.3636, "f1": 0.4706, "f2": 0.4, "mcc": 0.2359, "accuracy": 0.6197, "tp": 24, "fp": 12, "tn": 64, "fn": 42, "aleatoric_mean": 6e-06, "epistemic_mean": 1.2e-05, "confidence_mean": 1.0, "aleatoric_std": 4e-06, "epistemic_std": 7e-06}, {"fold": "fold_6", "regime": "EUR crisis downturn", "sharpe": 0.0833, "sortino": 0.1265, "return_pct": 0.19, "equity": 1001.92, "max_dd": 8.99, "win_rate": 51.72, "profit_factor": 1.013, "ic": 0.0844, "hit": 51.72, "n": 145, "precision": 0.48, "recall": 0.7273, "f1": 0.5783, "f2": 0.6593, "mcc": 0.0743, "accuracy": 0.5172, "tp": 48, "fp": 52, "tn": 27, "fn": 18, "aleatoric_mean": 1.4e-05, "epistemic_mean": 2.7e-05, "confidence_mean": 1.0, "aleatoric_std": 9e-06, "epistemic_std": 1.8e-05}, {"fold": "fold_7", "regime": "Recent mixed/upturn", "sharpe": -1.3972, "sortino": -1.8179, "return_pct": -7.36, "equity": 926.4, "max_dd": 9.73, "win_rate": 49.3, "profit_factor": 0.79, "ic": 0.0464, "hit": 49.3, "n": 142, "precision": 0.4839, "recall": 0.2113, "f1": 0.2941, "f2": 0.2381, "mcc": -0.017, "accuracy": 0.493, "tp": 15, "fp": 16, "tn": 55, "fn": 56, "aleatoric_mean": 8e-06, "epistemic_mean": 1.5e-05, "confidence_mean": 1.0, "aleatoric_std": 4e-06, "epistemic_std": 8e-06}], "val_sharpe": 1.2919, "val_psr": 0.9798, "val_equity": 1276.43, "val_sortino": 2.0984, "val_return_pct": 27.64, "val_max_dd": 4.01, "val_win_rate": 50.8, "val_profit_factor": 1.244, "val_ic": 0.1073, "val_hit": 50.48, "val_aleatoric_mean": 7e-06, "val_epistemic_mean": 1.5e-05, "val_confidence_mean": 1.0, "val_precision": 0.492, "val_recall": 0.6126, "val_f1": 0.5457, "val_f2": 0.584, "val_mcc": 0.0272, "val_accuracy": 0.5096, "val_per_window": [{"fold": "fold_1", "regime": "Pre-crisis upturn + GFC onset", "sharpe": 1.2009, "sortino": 2.1499, "return_pct": 2.53, "equity": 1025.33, "max_dd": 2.2, "win_rate": 48.86, "profit_factor": 1.224, "ic": 0.1392, "hit": 48.31, "n": 89, "precision": 0.5122, "recall": 0.4565, "f1": 0.4828, "f2": 0.4667, "mcc": -0.0086, "accuracy": 0.4944, "tp": 21, "fp": 20, "tn": 23, "fn": 25, "aleatoric_mean": 9e-06, "epistemic_mean": 1.8e-05, "confidence_mean": 1.0, "aleatoric_std": 1.2e-05, "epistemic_std": 2.4e-05}, {"fold": "fold_2", "regime": "Post-crash recovery", "sharpe": 1.2437, "sortino": 2.0944, "return_pct": 4.48, "equity": 1044.81, "max_dd": 3.74, "win_rate": 52.27, "profit_factor": 1.219, "ic": 0.0074, "hit": 52.27, "n": 88, "precision": 0.5571, "recall": 0.78, "f1": 0.65, "f2": 0.7222, "mcc": -0.0439, "accuracy": 0.5227, "tp": 39, "fp": 31, "tn": 7, "fn": 11, "aleatoric_mean": 1.2e-05, "epistemic_mean": 2.5e-05, "confidence_mean": 1.0, "aleatoric_std": 9e-06, "epistemic_std": 1.9e-05}, {"fold": "fold_3", "regime": "Eurozone debt plateau", "sharpe": 1.7746, "sortino": 3.244, "return_pct": 6.16, "equity": 1061.62, "max_dd": 3.16, "win_rate": 45.56, "profit_factor": 1.335, "ic": 0.2608, "hit": 45.05, "n": 91, "precision": 0.4353, "recall": 0.9487, "f1": 0.5968, "f2": 0.7676, "mcc": 0.0511, "accuracy": 0.4505, "tp": 37, "fp": 48, "tn": 4, "fn": 2, "aleatoric_mean": 9e-06, "epistemic_mean": 1.8e-05, "confidence_mean": 1.0, "aleatoric_std": 5e-06, "epistemic_std": 9e-06}, {"fold": "fold_4", "regime": "Strong USD downturn", "sharpe": 1.3079, "sortino": 2.4994, "return_pct": 3.97, "equity": 1039.67, "max_dd": 3.46, "win_rate": 53.93, "profit_factor": 1.234, "ic": 0.138, "hit": 53.33, "n": 90, "precision": 0.5, "recall": 0.5854, "f1": 0.5393, "f2": 0.566, "mcc": 0.0954, "accuracy": 0.5444, "tp": 24, "fp": 24, "tn": 25, "fn": 17, "aleatoric_mean": 5e-06, "epistemic_mean": 1.1e-05, "confidence_mean": 1.0, "aleatoric_std": 2e-06, "epistemic_std": 4e-06}, {"fold": "fold_5", "regime": "Low-vol plateau", "sharpe": 0.8078, "sortino": 1.0973, "return_pct": 2.16, "equity": 1021.6, "max_dd": 3.92, "win_rate": 47.83, "profit_factor": 1.147, "ic": 0.1211, "hit": 47.83, "n": 92, "precision": 0.4808, "recall": 0.5435, "f1": 0.5102, "f2": 0.5297, "mcc": -0.0439, "accuracy": 0.4783, "tp": 25, "fp": 27, "tn": 19, "fn": 21, "aleatoric_mean": 5e-06, "epistemic_mean": 1e-05, "confidence_mean": 1.0, "aleatoric_std": 3e-06, "epistemic_std": 5e-06}, {"fold": "fold_6", "regime": "EUR crisis downturn", "sharpe": 2.4124, "sortino": 4.4791, "return_pct": 4.16, "equity": 1041.64, "max_dd": 2.4, "win_rate": 55.17, "profit_factor": 1.496, "ic": 0.055, "hit": 54.55, "n": 88, "precision": 0.4595, "recall": 0.4722, "f1": 0.4658, "f2": 0.4696, "mcc": 0.0873, "accuracy": 0.5568, "tp": 17, "fp": 20, "tn": 32, "fn": 19, "aleatoric_mean": 4e-06, "epistemic_mean": 9e-06, "confidence_mean": 1.0, "aleatoric_std": 1e-06, "epistemic_std": 3e-06}, {"fold": "fold_7", "regime": "Recent mixed/upturn", "sharpe": 0.7451, "sortino": 1.4458, "return_pct": 1.45, "equity": 1014.47, "max_dd": 2.11, "win_rate": 52.22, "profit_factor": 1.128, "ic": 0.0426, "hit": 52.22, "n": 90, "precision": 0.5116, "recall": 0.5, "f1": 0.5057, "f2": 0.5023, "mcc": 0.0435, "accuracy": 0.5222, "tp": 22, "fp": 21, "tn": 25, "fn": 22, "aleatoric_mean": 6e-06, "epistemic_mean": 1.2e-05, "confidence_mean": 1.0, "aleatoric_std": 3e-06, "epistemic_std": 6e-06}], "train_sharpe": 6.5865, "train_psr": 1.0, "train_equity": 336399.16, "train_sortino": 20.5165, "train_return_pct": 33539.92, "train_max_dd": 2.72, "train_win_rate": 69.49, "train_profit_factor": 4.753, "train_ic": 0.6165, "train_hit": 69.22, "train_precision": 0.6946, "train_recall": 0.7309, "train_f1": 0.7123, "train_f2": 0.7233, "train_mcc": 0.3846, "train_accuracy": 0.6932, "train_per_window": [{"fold": "all_train", "regime": "Training data", "sharpe": 6.5865, "sortino": 20.5165, "return_pct": 33539.92, "equity": 336399.16, "max_dd": 2.72, "win_rate": 69.49, "profit_factor": 4.753, "ic": 0.6165, "hit": 69.22, "n": 1988, "precision": 0.6946, "recall": 0.7309, "f1": 0.7123, "f2": 0.7233, "mcc": 0.3846, "accuracy": 0.6932, "tp": 755, "fp": 332, "tn": 623, "fn": 278}], "experiment_num": 239, "status": "DISCARD"}
{"backbone": "dlinear", "description": "dlinear: Exp4 lr=3e-4 slower", "config": {"seq_len": 60, "lr": 0.0003, "batch_size": 32, "epochs": 100, "weight_decay": 0.0001, "patience": 20, "grad_clip": 1.0, "warmup_epochs": 0, "huber_delta": 1.0, "head_dropout": 0.15, "seed": 42, "het_loss": false}, "composite": -0.6308, "test_pos_folds": 4, "val_pos_folds": 3, "val_loss": 0.000124, "elapsed_sec": 31.0, "timestamp": "2026-04-21T12:28:44", "sharpe": 0.0692, "psr": 0.5433, "equity": 1005.13, "sortino": 0.1019, "return_pct": 0.51, "max_dd": 16.52, "win_rate": 52.18, "profit_factor": 1.012, "ic": -0.0057, "hit": 51.85, "aleatoric_mean": 0.000165, "epistemic_mean": 0.00033, "confidence_mean": 0.9995, "precision": 0.5165, "recall": 0.6065, "f1": 0.5579, "f2": 0.586, "mcc": 0.0448, "accuracy": 0.5217, "per_window": [{"fold": "fold_1", "regime": "Pre-crisis upturn + GFC onset", "sharpe": 0.4096, "sortino": 0.7223, "return_pct": 0.76, "equity": 1007.63, "max_dd": 3.29, "win_rate": 55.77, "profit_factor": 1.065, "ic": -0.0535, "hit": 54.72, "n": 53, "precision": 0.5714, "recall": 0.4615, "f1": 0.5106, "f2": 0.48, "mcc": 0.131, "accuracy": 0.566, "tp": 12, "fp": 9, "tn": 18, "fn": 14, "aleatoric_mean": 0.000161, "epistemic_mean": 0.000322, "confidence_mean": 0.9995, "aleatoric_std": 7.4e-05, "epistemic_std": 0.000148}, {"fold": "fold_2", "regime": "Post-crash recovery", "sharpe": 3.25, "sortino": 5.1538, "return_pct": 9.33, "equity": 1093.32, "max_dd": 2.96, "win_rate": 68.42, "profit_factor": 1.685, "ic": 0.178, "hit": 68.42, "n": 57, "precision": 0.6757, "recall": 0.8065, "f1": 0.7353, "f2": 0.7764, "mcc": 0.36, "accuracy": 0.6842, "tp": 25, "fp": 12, "tn": 14, "fn": 6, "aleatoric_mean": 0.000107, "epistemic_mean": 0.000214, "confidence_mean": 0.9997, "aleatoric_std": 5e-05, "epistemic_std": 0.0001}, {"fold": "fold_3", "regime": "Eurozone debt plateau", "sharpe": 0.2699, "sortino": 0.3719, "return_pct": 0.41, "equity": 1004.09, "max_dd": 2.81, "win_rate": 53.7, "profit_factor": 1.044, "ic": 0.1533, "hit": 51.79, "n": 56, "precision": 0.5882, "recall": 0.625, "f1": 0.6061, "f2": 0.6173, "mcc": 0.0422, "accuracy": 0.5357, "tp": 20, "fp": 14, "tn": 10, "fn": 12, "aleatoric_mean": 0.000232, "epistemic_mean": 0.000464, "confidence_mean": 0.9993, "aleatoric_std": 0.000105, "epistemic_std": 0.00021}, {"fold": "fold_4", "regime": "Strong USD downturn", "sharpe": -0.3115, "sortino": -0.4867, "return_pct": -1.83, "equity": 981.68, "max_dd": 9.4, "win_rate": 48.72, "profit_factor": 0.949, "ic": -0.0497, "hit": 48.31, "n": 118, "precision": 0.494, "recall": 0.6833, "f1": 0.5734, "f2": 0.6347, "mcc": -0.0447, "accuracy": 0.4831, "tp": 41, "fp": 42, "tn": 16, "fn": 19, "aleatoric_mean": 0.000176, "epistemic_mean": 0.000352, "confidence_mean": 0.9995, "aleatoric_std": 7.6e-05, "epistemic_std": 0.000153}, {"fold": "fold_5", "regime": "Low-vol plateau", "sharpe": -0.6304, "sortino": -0.8962, "return_pct": -1.47, "equity": 985.34, "max_dd": 5.21, "win_rate": 50.89, "profit_factor": 0.9, "ic": -0.1017, "hit": 50.89, "n": 112, "precision": 0.4412, "recall": 0.2941, "f1": 0.3529, "f2": 0.3151, "mcc": -0.0188, "accuracy": 0.5089, "tp": 15, "fp": 19, "tn": 42, "fn": 36, "aleatoric_mean": 6e-05, "epistemic_mean": 0.00012, "confidence_mean": 0.9998, "aleatoric_std": 2.2e-05, "epistemic_std": 4.4e-05}, {"fold": "fold_6", "regime": "EUR crisis downturn", "sharpe": -1.8259, "sortino": -3.013, "return_pct": -8.05, "equity": 919.47, "max_dd": 10.98, "win_rate": 46.96, "profit_factor": 0.749, "ic": -0.0369, "hit": 46.96, "n": 115, "precision": 0.463, "recall": 0.9434, "f1": 0.6211, "f2": 0.7813, "mcc": 0.0165, "accuracy": 0.4696, "tp": 50, "fp": 58, "tn": 4, "fn": 3, "aleatoric_mean": 0.000315, "epistemic_mean": 0.000629, "confidence_mean": 0.9991, "aleatoric_std": 0.000238, "epistemic_std": 0.000475}, {"fold": "fold_7", "regime": "Recent mixed/upturn", "sharpe": 0.5653, "sortino": 0.7562, "return_pct": 2.17, "equity": 1021.67, "max_dd": 3.4, "win_rate": 51.79, "profit_factor": 1.102, "ic": 0.0449, "hit": 51.79, "n": 112, "precision": 0.5319, "recall": 0.4386, "f1": 0.4808, "f2": 0.4545, "mcc": 0.0391, "accuracy": 0.5179, "tp": 25, "fp": 22, "tn": 33, "fn": 32, "aleatoric_mean": 0.000104, "epistemic_mean": 0.000208, "confidence_mean": 0.9997, "aleatoric_std": 5.6e-05, "epistemic_std": 0.000112}], "val_sharpe": 0.2568, "val_psr": 0.6296, "val_equity": 1027.81, "val_sortino": 0.4163, "val_return_pct": 2.78, "val_max_dd": 8.9, "val_win_rate": 49.76, "val_profit_factor": 1.044, "val_ic": 0.0714, "val_hit": 49.52, "val_aleatoric_mean": 6.8e-05, "val_epistemic_mean": 0.000137, "val_confidence_mean": 0.9998, "val_precision": 0.4882, "val_recall": 0.4029, "val_f1": 0.4415, "val_f2": 0.4175, "val_mcc": -0.0076, "val_accuracy": 0.4976, "val_per_window": [{"fold": "fold_1", "regime": "Pre-crisis upturn + GFC onset", "sharpe": 0.8871, "sortino": 1.3362, "return_pct": 1.36, "equity": 1013.6, "max_dd": 2.74, "win_rate": 55.17, "profit_factor": 1.157, "ic": 0.1313, "hit": 54.24, "n": 59, "precision": 0.5435, "recall": 0.8065, "f1": 0.6494, "f2": 0.7353, "mcc": 0.068, "accuracy": 0.5424, "tp": 25, "fp": 21, "tn": 7, "fn": 6, "aleatoric_mean": 0.000123, "epistemic_mean": 0.000245, "confidence_mean": 0.9996, "aleatoric_std": 0.000173, "epistemic_std": 0.000347}, {"fold": "fold_2", "regime": "Post-crash recovery", "sharpe": -0.8296, "sortino": -1.3341, "return_pct": -1.69, "equity": 983.05, "max_dd": 6.07, "win_rate": 48.28, "profit_factor": 0.874, "ic": 0.0024, "hit": 48.28, "n": 58, "precision": 0.5333, "recall": 0.2581, "f1": 0.3478, "f2": 0.2878, "mcc": -0.0014, "accuracy": 0.4828, "tp": 8, "fp": 7, "tn": 20, "fn": 23, "aleatoric_mean": 6.5e-05, "epistemic_mean": 0.000131, "confidence_mean": 0.9998, "aleatoric_std": 3.4e-05, "epistemic_std": 6.8e-05}, {"fold": "fold_3", "regime": "Eurozone debt plateau", "sharpe": 4.392, "sortino": 6.7008, "return_pct": 10.39, "equity": 1103.95, "max_dd": 1.9, "win_rate": 60.66, "profit_factor": 2.09, "ic": 0.2966, "hit": 60.66, "n": 61, "precision": 0.5385, "recall": 0.7778, "f1": 0.6364, "f2": 0.7143, "mcc": 0.2569, "accuracy": 0.6066, "tp": 21, "fp": 18, "tn": 16, "fn": 6, "aleatoric_mean": 8.4e-05, "epistemic_mean": 0.000169, "confidence_mean": 0.9997, "aleatoric_std": 3.7e-05, "epistemic_std": 7.3e-05}, {"fold": "fold_4", "regime": "Strong USD downturn", "sharpe": -0.8623, "sortino": -1.9136, "return_pct": -1.97, "equity": 980.33, "max_dd": 5.03, "win_rate": 46.67, "profit_factor": 0.876, "ic": -0.0457, "hit": 46.67, "n": 60, "precision": 0.4118, "recall": 0.2414, "f1": 0.3043, "f2": 0.2632, "mcc": -0.0901, "accuracy": 0.4667, "tp": 7, "fp": 10, "tn": 21, "fn": 22, "aleatoric_mean": 4.8e-05, "epistemic_mean": 9.6e-05, "confidence_mean": 0.9999, "aleatoric_std": 1.7e-05, "epistemic_std": 3.4e-05}, {"fold": "fold_5", "regime": "Low-vol plateau", "sharpe": -0.2695, "sortino": -0.4192, "return_pct": -0.53, "equity": 994.72, "max_dd": 3.51, "win_rate": 45.16, "profit_factor": 0.957, "ic": 0.0492, "hit": 45.16, "n": 62, "precision": 0.4737, "recall": 0.5625, "f1": 0.5143, "f2": 0.5422, "mcc": -0.1069, "accuracy": 0.4516, "tp": 18, "fp": 20, "tn": 10, "fn": 14, "aleatoric_mean": 4.8e-05, "epistemic_mean": 9.6e-05, "confidence_mean": 0.9999, "aleatoric_std": 1.5e-05, "epistemic_std": 3.1e-05}, {"fold": "fold_6", "regime": "EUR crisis downturn", "sharpe": 1.4461, "sortino": 2.8901, "return_pct": 1.49, "equity": 1014.9, "max_dd": 2.07, "win_rate": 52.63, "profit_factor": 1.268, "ic": 0.1405, "hit": 51.72, "n": 58, "precision": 0.0, "recall": 0.0, "f1": 0.0, "f2": 0.0, "mcc": -0.1962, "accuracy": 0.5345, "tp": 0, "fp": 3, "tn": 31, "fn": 24, "aleatoric_mean": 5e-05, "epistemic_mean": 0.0001, "confidence_mean": 0.9999, "aleatoric_std": 1.7e-05, "epistemic_std": 3.3e-05}, {"fold": "fold_7", "regime": "Recent mixed/upturn", "sharpe": -4.6562, "sortino": -6.346, "return_pct": -5.59, "equity": 944.11, "max_dd": 6.2, "win_rate": 40.0, "profit_factor": 0.466, "ic": -0.1131, "hit": 40.0, "n": 60, "precision": 0.3333, "recall": 0.125, "f1": 0.1818, "f2": 0.1429, "mcc": -0.2004, "accuracy": 0.4, "tp": 4, "fp": 8, "tn": 20, "fn": 28, "aleatoric_mean": 6e-05, "epistemic_mean": 0.000119, "confidence_mean": 0.9998, "aleatoric_std": 2.8e-05, "epistemic_std": 5.7e-05}], "train_sharpe": 5.6136, "train_psr": 1.0, "train_equity": 41871.19, "train_sortino": 18.9743, "train_return_pct": 4087.12, "train_max_dd": 3.63, "train_win_rate": 67.27, "train_profit_factor": 4.112, "train_ic": 0.6771, "train_hit": 66.93, "train_precision": 0.8393, "train_recall": 0.4589, "train_f1": 0.5933, "train_f2": 0.5046, "train_mcc": 0.4036, "train_accuracy": 0.6737, "train_per_window": [{"fold": "all_train", "regime": "Training data", "sharpe": 5.6136, "sortino": 18.9743, "return_pct": 4087.12, "equity": 41871.19, "max_dd": 3.63, "win_rate": 67.27, "profit_factor": 4.112, "ic": 0.6771, "hit": 66.93, "n": 1382, "precision": 0.8393, "recall": 0.4589, "f1": 0.5933, "f2": 0.5046, "mcc": 0.4036, "accuracy": 0.6737, "tp": 329, "fp": 63, "tn": 602, "fn": 388}], "experiment_num": 240, "status": "DISCARD"}
