{"backbone": "mlp", "description": "mlp: Exp9 BN+dropout=0.2 code change seed=0 (Ioffe2015)", "config": {"seq_len": 10, "lr": 0.0003, "batch_size": 32, "epochs": 50, "weight_decay": 1e-05, "patience": 10, "grad_clip": 1.0, "warmup_epochs": 0, "huber_delta": 1.0, "head_dropout": 0.1, "seed": 0, "het_loss": false}, "composite": -1.3117, "test_pos_folds": 3, "val_pos_folds": 4, "val_loss": 3.7e-05, "elapsed_sec": 14.7, "timestamp": "2026-04-12T17:38:59", "sharpe": -0.6117, "psr": 0.1142, "equity": 756.82, "sortino": -0.8144, "return_pct": -24.32, "max_dd": 32.56, "win_rate": 49.23, "profit_factor": 0.893, "ic": -0.0663, "hit": 49.02, "aleatoric_mean": 6.7e-05, "epistemic_mean": 0.000133, "confidence_mean": 0.9998, "per_window": [{"fold": "fold_1", "regime": "Pre-crisis upturn + GFC onset", "sharpe": 1.2147, "sortino": 1.2612, "return_pct": 8.99, "equity": 1089.91, "max_dd": 9.69, "win_rate": 58.82, "profit_factor": 1.334, "ic": 0.1097, "hit": 58.25, "n": 103, "aleatoric_mean": 4.7e-05, "epistemic_mean": 9.5e-05, "confidence_mean": 0.9999, "aleatoric_std": 2.7e-05, "epistemic_std": 5.4e-05}, {"fold": "fold_2", "regime": "Post-crash recovery", "sharpe": -1.8035, "sortino": -3.2765, "return_pct": -8.49, "equity": 915.09, "max_dd": 13.04, "win_rate": 44.86, "profit_factor": 0.754, "ic": -0.1401, "hit": 44.86, "n": 107, "aleatoric_mean": 5.7e-05, "epistemic_mean": 0.000113, "confidence_mean": 0.9998, "aleatoric_std": 3.7e-05, "epistemic_std": 7.5e-05}, {"fold": "fold_3", "regime": "Eurozone debt plateau", "sharpe": -3.3181, "sortino": -5.8539, "return_pct": -11.02, "equity": 889.77, "max_dd": 13.49, "win_rate": 42.31, "profit_factor": 0.594, "ic": -0.3485, "hit": 41.51, "n": 106, "aleatoric_mean": 7.4e-05, "epistemic_mean": 0.000148, "confidence_mean": 0.9998, "aleatoric_std": 3.2e-05, "epistemic_std": 6.4e-05}, {"fold": "fold_4", "regime": "Strong USD downturn", "sharpe": 0.8197, "sortino": 1.2242, "return_pct": 6.09, "equity": 1060.94, "max_dd": 9.16, "win_rate": 53.29, "profit_factor": 1.148, "ic": -0.0019, "hit": 52.98, "n": 168, "aleatoric_mean": 7.5e-05, "epistemic_mean": 0.00015, "confidence_mean": 0.9998, "aleatoric_std": 3.6e-05, "epistemic_std": 7.3e-05}, {"fold": "fold_5", "regime": "Low-vol plateau", "sharpe": 0.834, "sortino": 1.2169, "return_pct": 2.73, "equity": 1027.26, "max_dd": 3.73, "win_rate": 56.79, "profit_factor": 1.149, "ic": 0.0591, "hit": 56.79, "n": 162, "aleatoric_mean": 7e-05, "epistemic_mean": 0.00014, "confidence_mean": 0.9998, "aleatoric_std": 3.2e-05, "epistemic_std": 6.5e-05}, {"fold": "fold_6", "regime": "EUR crisis downturn", "sharpe": -1.726, "sortino": -2.5492, "return_pct": -10.52, "equity": 894.84, "max_dd": 12.57, "win_rate": 44.24, "profit_factor": 0.756, "ic": -0.0849, "hit": 44.24, "n": 165, "aleatoric_mean": 7e-05, "epistemic_mean": 0.00014, "confidence_mean": 0.9998, "aleatoric_std": 3.2e-05, "epistemic_std": 6.5e-05}, {"fold": "fold_7", "regime": "Recent mixed/upturn", "sharpe": -2.2245, "sortino": -2.9894, "return_pct": -12.55, "equity": 874.47, "max_dd": 13.37, "win_rate": 43.83, "profit_factor": 0.686, "ic": -0.0475, "hit": 43.83, "n": 162, "aleatoric_mean": 6.5e-05, "epistemic_mean": 0.000131, "confidence_mean": 0.9998, "aleatoric_std": 3.7e-05, "epistemic_std": 7.4e-05}], "val_sharpe": 0.4493, "val_psr": 0.7824, "val_equity": 1102.31, "val_sortino": 0.6378, "val_return_pct": 10.23, "val_max_dd": 8.97, "val_win_rate": 50.85, "val_profit_factor": 1.079, "val_ic": 0.0673, "val_hit": 50.52, "val_aleatoric_mean": 6.7e-05, "val_epistemic_mean": 0.000135, "val_confidence_mean": 0.9998, "val_per_window": [{"fold": "fold_1", "regime": "Pre-crisis upturn + GFC onset", "sharpe": 1.9124, "sortino": 3.3659, "return_pct": 4.83, "equity": 1048.34, "max_dd": 2.56, "win_rate": 50.93, "profit_factor": 1.374, "ic": 0.0671, "hit": 50.46, "n": 109, "aleatoric_mean": 4.9e-05, "epistemic_mean": 9.8e-05, "confidence_mean": 0.9999, "aleatoric_std": 2.9e-05, "epistemic_std": 5.7e-05}, {"fold": "fold_2", "regime": "Post-crash recovery", "sharpe": -1.0815, "sortino": -1.6688, "return_pct": -5.37, "equity": 946.34, "max_dd": 8.97, "win_rate": 44.44, "profit_factor": 0.843, "ic": -0.0003, "hit": 44.44, "n": 108, "aleatoric_mean": 6.4e-05, "epistemic_mean": 0.000128, "confidence_mean": 0.9998, "aleatoric_std": 3.1e-05, "epistemic_std": 6.1e-05}, {"fold": "fold_3", "regime": "Eurozone debt plateau", "sharpe": 1.7549, "sortino": 2.6506, "return_pct": 7.11, "equity": 1071.12, "max_dd": 3.9, "win_rate": 54.13, "profit_factor": 1.33, "ic": 0.1039, "hit": 53.15, "n": 111, "aleatoric_mean": 6.9e-05, "epistemic_mean": 0.000138, "confidence_mean": 0.9998, "aleatoric_std": 3.2e-05, "epistemic_std": 6.4e-05}, {"fold": "fold_4", "regime": "Strong USD downturn", "sharpe": -1.5913, "sortino": -2.3453, "return_pct": -5.49, "equity": 945.14, "max_dd": 7.28, "win_rate": 41.28, "profit_factor": 0.768, "ic": -0.0678, "hit": 40.91, "n": 110, "aleatoric_mean": 8.3e-05, "epistemic_mean": 0.000166, "confidence_mean": 0.9998, "aleatoric_std": 3.9e-05, "epistemic_std": 7.9e-05}, {"fold": "fold_5", "regime": "Low-vol plateau", "sharpe": 1.7542, "sortino": 2.3597, "return_pct": 5.86, "equity": 1058.6, "max_dd": 3.13, "win_rate": 55.36, "profit_factor": 1.339, "ic": 0.2089, "hit": 55.36, "n": 112, "aleatoric_mean": 7.2e-05, "epistemic_mean": 0.000144, "confidence_mean": 0.9998, "aleatoric_std": 3.6e-05, "epistemic_std": 7.2e-05}, {"fold": "fold_6", "regime": "EUR crisis downturn", "sharpe": 2.348, "sortino": 3.4695, "return_pct": 5.4, "equity": 1054.0, "max_dd": 2.27, "win_rate": 57.94, "profit_factor": 1.486, "ic": 0.1992, "hit": 57.41, "n": 108, "aleatoric_mean": 7.1e-05, "epistemic_mean": 0.000142, "confidence_mean": 0.9998, "aleatoric_std": 3.2e-05, "epistemic_std": 6.3e-05}, {"fold": "fold_7", "regime": "Recent mixed/upturn", "sharpe": -0.659, "sortino": -1.0206, "return_pct": -1.63, "equity": 983.67, "max_dd": 3.48, "win_rate": 51.82, "profit_factor": 0.9, "ic": 0.0319, "hit": 51.82, "n": 110, "aleatoric_mean": 6.2e-05, "epistemic_mean": 0.000124, "confidence_mean": 0.9998, "aleatoric_std": 2.7e-05, "epistemic_std": 5.3e-05}], "train_sharpe": 1.9038, "train_psr": 1.0, "train_equity": 9451.59, "train_sortino": 3.9627, "train_return_pct": 845.16, "train_max_dd": 9.47, "train_win_rate": 55.31, "train_profit_factor": 1.52, "train_ic": 0.1518, "train_hit": 55.08, "train_per_window": [{"fold": "all_train", "regime": "Training data", "sharpe": 1.9038, "sortino": 3.9627, "return_pct": 845.16, "equity": 9451.59, "max_dd": 9.47, "win_rate": 55.31, "profit_factor": 1.52, "ic": 0.1518, "hit": 55.08, "n": 2478}], "experiment_num": 65, "status": "DISCARD"}
{"backbone": "mlp", "description": "mlp: Exp10 residual MLP skip connection (He2016) seed=0", "config": {"seq_len": 10, "lr": 0.0003, "batch_size": 32, "epochs": 50, "weight_decay": 1e-05, "patience": 10, "grad_clip": 1.0, "warmup_epochs": 0, "huber_delta": 1.0, "head_dropout": 0.1, "seed": 0, "het_loss": false}, "composite": 4.6738, "test_pos_folds": 7, "val_pos_folds": 6, "val_loss": 4.2e-05, "elapsed_sec": 14.2, "timestamp": "2026-04-12T17:40:07", "sharpe": 4.7738, "psr": 1.0, "equity": 6627.57, "sortino": 8.6025, "return_pct": 562.76, "max_dd": 5.05, "win_rate": 65.63, "profit_factor": 2.462, "ic": 0.4129, "hit": 65.36, "aleatoric_mean": 4e-05, "epistemic_mean": 8e-05, "confidence_mean": 0.9999, "per_window": [{"fold": "fold_1", "regime": "Pre-crisis upturn + GFC onset", "sharpe": 2.5088, "sortino": 6.9669, "return_pct": 20.21, "equity": 1202.14, "max_dd": 3.16, "win_rate": 60.78, "profit_factor": 1.827, "ic": 0.1989, "hit": 60.19, "n": 103, "aleatoric_mean": 7.2e-05, "epistemic_mean": 0.000143, "confidence_mean": 0.9998, "aleatoric_std": 7.4e-05, "epistemic_std": 0.000149}, {"fold": "fold_2", "regime": "Post-crash recovery", "sharpe": 1.0024, "sortino": 1.6747, "return_pct": 4.64, "equity": 1046.36, "max_dd": 4.54, "win_rate": 57.01, "profit_factor": 1.17, "ic": 0.1346, "hit": 57.01, "n": 107, "aleatoric_mean": 2.9e-05, "epistemic_mean": 5.8e-05, "confidence_mean": 0.9999, "aleatoric_std": 1.7e-05, "epistemic_std": 3.4e-05}, {"fold": "fold_3", "regime": "Eurozone debt plateau", "sharpe": 6.5537, "sortino": 12.4915, "return_pct": 23.81, "equity": 1238.07, "max_dd": 2.69, "win_rate": 70.19, "profit_factor": 2.813, "ic": 0.5088, "hit": 68.87, "n": 106, "aleatoric_mean": 4.6e-05, "epistemic_mean": 9.2e-05, "confidence_mean": 0.9999, "aleatoric_std": 2.7e-05, "epistemic_std": 5.3e-05}, {"fold": "fold_4", "regime": "Strong USD downturn", "sharpe": 7.5799, "sortino": 14.972, "return_pct": 69.51, "equity": 1695.12, "max_dd": 2.14, "win_rate": 70.06, "profit_factor": 3.7, "ic": 0.5576, "hit": 69.64, "n": 168, "aleatoric_mean": 5.6e-05, "epistemic_mean": 0.000112, "confidence_mean": 0.9998, "aleatoric_std": 4.1e-05, "epistemic_std": 8.3e-05}, {"fold": "fold_5", "regime": "Low-vol plateau", "sharpe": 8.697, "sortino": 16.1393, "return_pct": 28.84, "equity": 1288.37, "max_dd": 1.43, "win_rate": 70.99, "profit_factor": 4.47, "ic": 0.5237, "hit": 70.99, "n": 162, "aleatoric_mean": 2.2e-05, "epistemic_mean": 4.3e-05, "confidence_mean": 0.9999, "aleatoric_std": 1.3e-05, "epistemic_std": 2.6e-05}, {"fold": "fold_6", "regime": "EUR crisis downturn", "sharpe": 7.4975, "sortino": 11.733, "return_pct": 52.8, "equity": 1528.02, "max_dd": 2.68, "win_rate": 68.48, "profit_factor": 3.422, "ic": 0.5885, "hit": 68.48, "n": 165, "aleatoric_mean": 3.7e-05, "epistemic_mean": 7.3e-05, "confidence_mean": 0.9999, "aleatoric_std": 2.3e-05, "epistemic_std": 4.6e-05}, {"fold": "fold_7", "regime": "Recent mixed/upturn", "sharpe": 4.271, "sortino": 7.6733, "return_pct": 27.53, "equity": 1275.28, "max_dd": 2.77, "win_rate": 58.64, "profit_factor": 2.069, "ic": 0.5149, "hit": 58.64, "n": 162, "aleatoric_mean": 2.7e-05, "epistemic_mean": 5.4e-05, "confidence_mean": 0.9999, "aleatoric_std": 1.6e-05, "epistemic_std": 3.2e-05}], "val_sharpe": 5.129, "val_psr": 1.0, "val_equity": 3158.01, "val_sortino": 7.9643, "val_return_pct": 215.8, "val_max_dd": 8.08, "val_win_rate": 64.09, "val_profit_factor": 2.403, "val_ic": 0.4171, "val_hit": 63.67, "val_aleatoric_mean": 2.4e-05, "val_epistemic_mean": 4.8e-05, "val_confidence_mean": 0.9999, "val_per_window": [{"fold": "fold_1", "regime": "Pre-crisis upturn + GFC onset", "sharpe": -0.1265, "sortino": -0.2083, "return_pct": -0.39, "equity": 996.08, "max_dd": 4.82, "win_rate": 46.3, "profit_factor": 0.979, "ic": -0.003, "hit": 45.87, "n": 109, "aleatoric_mean": 2.5e-05, "epistemic_mean": 4.9e-05, "confidence_mean": 0.9999, "aleatoric_std": 3e-05, "epistemic_std": 5.9e-05}, {"fold": "fold_2", "regime": "Post-crash recovery", "sharpe": 0.8488, "sortino": 1.2901, "return_pct": 3.92, "equity": 1039.15, "max_dd": 8.08, "win_rate": 54.63, "profit_factor": 1.143, "ic": 0.077, "hit": 54.63, "n": 108, "aleatoric_mean": 4e-05, "epistemic_mean": 7.9e-05, "confidence_mean": 0.9999, "aleatoric_std": 3.2e-05, "epistemic_std": 6.4e-05}, {"fold": "fold_3", "regime": "Eurozone debt plateau", "sharpe": 8.5459, "sortino": 17.9391, "return_pct": 35.33, "equity": 1353.3, "max_dd": 1.52, "win_rate": 76.15, "profit_factor": 4.133, "ic": 0.6135, "hit": 74.77, "n": 111, "aleatoric_mean": 3.3e-05, "epistemic_mean": 6.6e-05, "confidence_mean": 0.9999, "aleatoric_std": 2.4e-05, "epistemic_std": 4.8e-05}, {"fold": "fold_4", "regime": "Strong USD downturn", "sharpe": 8.6601, "sortino": 20.6472, "return_pct": 30.07, "equity": 1300.66, "max_dd": 0.92, "win_rate": 73.39, "profit_factor": 4.386, "ic": 0.5514, "hit": 72.73, "n": 110, "aleatoric_mean": 2.2e-05, "epistemic_mean": 4.5e-05, "confidence_mean": 0.9999, "aleatoric_std": 2.1e-05, "epistemic_std": 4.1e-05}, {"fold": "fold_5", "regime": "Low-vol plateau", "sharpe": 8.6078, "sortino": 19.1262, "return_pct": 28.58, "equity": 1285.77, "max_dd": 1.22, "win_rate": 69.64, "profit_factor": 4.385, "ic": 0.6406, "hit": 69.64, "n": 112, "aleatoric_mean": 2.3e-05, "epistemic_mean": 4.6e-05, "confidence_mean": 0.9999, "aleatoric_std": 2e-05, "epistemic_std": 4.1e-05}, {"fold": "fold_6", "regime": "EUR crisis downturn", "sharpe": 7.1262, "sortino": 12.2806, "return_pct": 15.99, "equity": 1159.85, "max_dd": 0.86, "win_rate": 68.22, "profit_factor": 3.414, "ic": 0.6095, "hit": 67.59, "n": 108, "aleatoric_mean": 1.3e-05, "epistemic_mean": 2.6e-05, "confidence_mean": 1.0, "aleatoric_std": 5e-06, "epistemic_std": 1e-05}, {"fold": "fold_7", "regime": "Recent mixed/upturn", "sharpe": 6.8561, "sortino": 18.1436, "return_pct": 16.23, "equity": 1162.3, "max_dd": 1.23, "win_rate": 60.0, "profit_factor": 3.046, "ic": 0.5295, "hit": 60.0, "n": 110, "aleatoric_mean": 1.4e-05, "epistemic_mean": 2.9e-05, "confidence_mean": 1.0, "aleatoric_std": 1.1e-05, "epistemic_std": 2.2e-05}], "train_sharpe": 8.0082, "train_psr": 1.0, "train_equity": 6011076.0, "train_sortino": 24.9501, "train_return_pct": 601007.6, "train_max_dd": 4.03, "train_win_rate": 78.12, "train_profit_factor": 8.133, "train_ic": 0.7707, "train_hit": 77.8, "train_per_window": [{"fold": "all_train", "regime": "Training data", "sharpe": 8.0082, "sortino": 24.9501, "return_pct": 601007.6, "equity": 6011076.0, "max_dd": 4.03, "win_rate": 78.12, "profit_factor": 8.133, "ic": 0.7707, "hit": 77.8, "n": 2478}], "experiment_num": 66, "status": "KEEP"}
{"backbone": "mlp", "description": "mlp: Exp11 residual MLP REPRODUCE seed=42", "config": {"seq_len": 10, "lr": 0.0003, "batch_size": 32, "epochs": 50, "weight_decay": 1e-05, "patience": 10, "grad_clip": 1.0, "warmup_epochs": 0, "huber_delta": 1.0, "head_dropout": 0.1, "seed": 42, "het_loss": false}, "composite": 3.7609, "test_pos_folds": 6, "val_pos_folds": 6, "val_loss": 4.7e-05, "elapsed_sec": 18.8, "timestamp": "2026-04-12T17:44:03", "sharpe": 4.236, "psr": 1.0, "equity": 5422.4, "sortino": 5.4648, "return_pct": 442.24, "max_dd": 9.54, "win_rate": 63.05, "profit_factor": 2.216, "ic": 0.3583, "hit": 62.8, "aleatoric_mean": 4.6e-05, "epistemic_mean": 9.2e-05, "confidence_mean": 0.9999, "per_window": [{"fold": "fold_1", "regime": "Pre-crisis upturn + GFC onset", "sharpe": -0.0506, "sortino": -0.0567, "return_pct": -1.12, "equity": 988.83, "max_dd": 9.54, "win_rate": 50.98, "profit_factor": 0.988, "ic": 0.0899, "hit": 50.49, "n": 103, "aleatoric_mean": 9e-05, "epistemic_mean": 0.00018, "confidence_mean": 0.9997, "aleatoric_std": 0.000105, "epistemic_std": 0.000209}, {"fold": "fold_2", "regime": "Post-crash recovery", "sharpe": 3.2776, "sortino": 5.6958, "return_pct": 16.34, "equity": 1163.44, "max_dd": 4.52, "win_rate": 59.81, "profit_factor": 1.672, "ic": 0.1041, "hit": 59.81, "n": 107, "aleatoric_mean": 3.7e-05, "epistemic_mean": 7.5e-05, "confidence_mean": 0.9999, "aleatoric_std": 2.8e-05, "epistemic_std": 5.5e-05}, {"fold": "fold_3", "regime": "Eurozone debt plateau", "sharpe": 6.0815, "sortino": 11.97, "return_pct": 22.15, "equity": 1221.54, "max_dd": 1.73, "win_rate": 66.35, "profit_factor": 2.608, "ic": 0.4132, "hit": 65.09, "n": 106, "aleatoric_mean": 5e-05, "epistemic_mean": 0.0001, "confidence_mean": 0.9998, "aleatoric_std": 3e-05, "epistemic_std": 6e-05}, {"fold": "fold_4", "regime": "Strong USD downturn", "sharpe": 6.8198, "sortino": 10.5388, "return_pct": 62.1, "equity": 1621.04, "max_dd": 5.33, "win_rate": 70.66, "profit_factor": 3.221, "ic": 0.4991, "hit": 70.24, "n": 168, "aleatoric_mean": 5.9e-05, "epistemic_mean": 0.000117, "confidence_mean": 0.9998, "aleatoric_std": 3.5e-05, "epistemic_std": 7e-05}, {"fold": "fold_5", "regime": "Low-vol plateau", "sharpe": 4.6432, "sortino": 7.3098, "return_pct": 15.91, "equity": 1159.15, "max_dd": 1.72, "win_rate": 61.73, "profit_factor": 2.178, "ic": 0.3612, "hit": 61.73, "n": 162, "aleatoric_mean": 2.5e-05, "epistemic_mean": 5e-05, "confidence_mean": 0.9999, "aleatoric_std": 1.9e-05, "epistemic_std": 3.8e-05}, {"fold": "fold_6", "regime": "EUR crisis downturn", "sharpe": 6.8967, "sortino": 14.2772, "return_pct": 48.5, "equity": 1484.97, "max_dd": 2.26, "win_rate": 62.42, "profit_factor": 3.09, "ic": 0.5033, "hit": 62.42, "n": 165, "aleatoric_mean": 4.5e-05, "epistemic_mean": 8.9e-05, "confidence_mean": 0.9999, "aleatoric_std": 2.8e-05, "epistemic_std": 5.6e-05}, {"fold": "fold_7", "regime": "Recent mixed/upturn", "sharpe": 5.8415, "sortino": 11.4333, "return_pct": 38.28, "equity": 1382.83, "max_dd": 1.9, "win_rate": 64.81, "profit_factor": 2.725, "ic": 0.4969, "hit": 64.81, "n": 162, "aleatoric_mean": 2.9e-05, "epistemic_mean": 5.9e-05, "confidence_mean": 0.9999, "aleatoric_std": 1.6e-05, "epistemic_std": 3.1e-05}], "val_sharpe": 3.9609, "val_psr": 1.0, "val_equity": 2468.29, "val_sortino": 6.004, "val_return_pct": 146.83, "val_max_dd": 13.68, "val_win_rate": 61.07, "val_profit_factor": 1.961, "val_ic": 0.3553, "val_hit": 60.68, "val_aleatoric_mean": 2.9e-05, "val_epistemic_mean": 5.7e-05, "val_confidence_mean": 0.9999, "val_per_window": [{"fold": "fold_1", "regime": "Pre-crisis upturn + GFC onset", "sharpe": 1.7413, "sortino": 2.982, "return_pct": 4.39, "equity": 1043.91, "max_dd": 3.47, "win_rate": 50.93, "profit_factor": 1.335, "ic": 0.0912, "hit": 50.46, "n": 109, "aleatoric_mean": 2.9e-05, "epistemic_mean": 5.8e-05, "confidence_mean": 0.9999, "aleatoric_std": 3.7e-05, "epistemic_std": 7.4e-05}, {"fold": "fold_2", "regime": "Post-crash recovery", "sharpe": -1.8189, "sortino": -2.7967, "return_pct": -8.65, "equity": 913.47, "max_dd": 13.68, "win_rate": 47.22, "profit_factor": 0.75, "ic": -0.0932, "hit": 47.22, "n": 108, "aleatoric_mean": 5.6e-05, "epistemic_mean": 0.000112, "confidence_mean": 0.9998, "aleatoric_std": 5.9e-05, "epistemic_std": 0.000118}, {"fold": "fold_3", "regime": "Eurozone debt plateau", "sharpe": 7.5723, "sortino": 16.9426, "return_pct": 31.6, "equity": 1316.04, "max_dd": 1.58, "win_rate": 70.64, "profit_factor": 3.488, "ic": 0.5406, "hit": 69.37, "n": 111, "aleatoric_mean": 3.6e-05, "epistemic_mean": 7.2e-05, "confidence_mean": 0.9999, "aleatoric_std": 2.1e-05, "epistemic_std": 4.2e-05}, {"fold": "fold_4", "regime": "Strong USD downturn", "sharpe": 8.2934, "sortino": 21.3139, "return_pct": 28.93, "equity": 1289.33, "max_dd": 1.02, "win_rate": 70.64, "profit_factor": 4.1, "ic": 0.5085, "hit": 70.0, "n": 110, "aleatoric_mean": 2.7e-05, "epistemic_mean": 5.4e-05, "confidence_mean": 0.9999, "aleatoric_std": 2.1e-05, "epistemic_std": 4.2e-05}, {"fold": "fold_5", "regime": "Low-vol plateau", "sharpe": 6.4618, "sortino": 11.4233, "return_pct": 21.96, "equity": 1219.62, "max_dd": 1.21, "win_rate": 66.07, "profit_factor": 2.978, "ic": 0.5475, "hit": 66.07, "n": 112, "aleatoric_mean": 2.3e-05, "epistemic_mean": 4.5e-05, "confidence_mean": 0.9999, "aleatoric_std": 1.3e-05, "epistemic_std": 2.6e-05}, {"fold": "fold_6", "regime": "EUR crisis downturn", "sharpe": 6.1633, "sortino": 10.2706, "return_pct": 13.99, "equity": 1139.95, "max_dd": 1.18, "win_rate": 65.42, "profit_factor": 2.871, "ic": 0.5587, "hit": 64.81, "n": 108, "aleatoric_mean": 1.5e-05, "epistemic_mean": 3e-05, "confidence_mean": 1.0, "aleatoric_std": 6e-06, "epistemic_std": 1.2e-05}, {"fold": "fold_7", "regime": "Recent mixed/upturn", "sharpe": 4.016, "sortino": 7.1375, "return_pct": 9.72, "equity": 1097.22, "max_dd": 1.93, "win_rate": 56.36, "profit_factor": 1.911, "ic": 0.4601, "hit": 56.36, "n": 110, "aleatoric_mean": 1.5e-05, "epistemic_mean": 2.9e-05, "confidence_mean": 1.0, "aleatoric_std": 8e-06, "epistemic_std": 1.6e-05}], "train_sharpe": 7.1996, "train_psr": 1.0, "train_equity": 2902868.75, "train_sortino": 22.2641, "train_return_pct": 290186.88, "train_max_dd": 3.42, "train_win_rate": 73.74, "train_profit_factor": 6.048, "train_ic": 0.6815, "train_hit": 73.45, "train_per_window": [{"fold": "all_train", "regime": "Training data", "sharpe": 7.1996, "sortino": 22.2641, "return_pct": 290186.88, "equity": 2902868.75, "max_dd": 3.42, "win_rate": 73.74, "profit_factor": 6.048, "ic": 0.6815, "hit": 73.45, "n": 2478}], "experiment_num": 67, "status": "DISCARD"}
