{"backbone": "mlp", "description": "mlp: Exp27 hidden=64 properly wired seed=0", "config": {"seq_len": 10, "lr": 0.0005, "batch_size": 32, "epochs": 50, "weight_decay": 1e-05, "patience": 10, "grad_clip": 1.0, "warmup_epochs": 0, "huber_delta": 1.0, "head_dropout": 0.15, "seed": 0, "hidden_size": 64, "het_loss": false}, "composite": 3.7003, "test_pos_folds": 6, "val_pos_folds": 6, "val_loss": 4.1e-05, "elapsed_sec": 23.6, "timestamp": "2026-04-14T17:17:47", "sharpe": 3.9003, "psr": 1.0, "equity": 4773.46, "sortino": 6.9931, "return_pct": 377.35, "max_dd": 10.0, "win_rate": 62.23, "profit_factor": 2.076, "ic": 0.3303, "hit": 61.97, "aleatoric_mean": 3.8e-05, "epistemic_mean": 7.6e-05, "confidence_mean": 0.9999, "per_window": [{"fold": "fold_1", "regime": "Pre-crisis upturn + GFC onset", "sharpe": 2.4028, "sortino": 6.9333, "return_pct": 19.27, "equity": 1192.69, "max_dd": 6.72, "win_rate": 54.9, "profit_factor": 1.779, "ic": 0.1198, "hit": 54.37, "n": 103, "aleatoric_mean": 6.9e-05, "epistemic_mean": 0.000139, "confidence_mean": 0.9998, "aleatoric_std": 8.3e-05, "epistemic_std": 0.000165}, {"fold": "fold_2", "regime": "Post-crash recovery", "sharpe": -0.2181, "sortino": -0.3528, "return_pct": -1.31, "equity": 986.9, "max_dd": 5.7, "win_rate": 51.4, "profit_factor": 0.966, "ic": -0.0074, "hit": 51.4, "n": 107, "aleatoric_mean": 2.8e-05, "epistemic_mean": 5.6e-05, "confidence_mean": 0.9999, "aleatoric_std": 1.4e-05, "epistemic_std": 2.7e-05}, {"fold": "fold_3", "regime": "Eurozone debt plateau", "sharpe": 4.471, "sortino": 7.6318, "return_pct": 16.33, "equity": 1163.32, "max_dd": 2.39, "win_rate": 67.31, "profit_factor": 2.02, "ic": 0.389, "hit": 66.04, "n": 106, "aleatoric_mean": 4e-05, "epistemic_mean": 7.9e-05, "confidence_mean": 0.9999, "aleatoric_std": 2.6e-05, "epistemic_std": 5.3e-05}, {"fold": "fold_4", "regime": "Strong USD downturn", "sharpe": 5.2478, "sortino": 8.4121, "return_pct": 46.7, "equity": 1466.96, "max_dd": 4.77, "win_rate": 64.67, "profit_factor": 2.439, "ic": 0.4132, "hit": 64.29, "n": 168, "aleatoric_mean": 5.6e-05, "epistemic_mean": 0.000111, "confidence_mean": 0.9998, "aleatoric_std": 5e-05, "epistemic_std": 0.0001}, {"fold": "fold_5", "regime": "Low-vol plateau", "sharpe": 6.9539, "sortino": 14.1721, "return_pct": 23.55, "equity": 1235.48, "max_dd": 1.03, "win_rate": 67.9, "profit_factor": 3.253, "ic": 0.4541, "hit": 67.9, "n": 162, "aleatoric_mean": 1.8e-05, "epistemic_mean": 3.6e-05, "confidence_mean": 0.9999, "aleatoric_std": 1.1e-05, "epistemic_std": 2.1e-05}, {"fold": "fold_6", "regime": "EUR crisis downturn", "sharpe": 5.1975, "sortino": 9.9359, "return_pct": 36.08, "equity": 1360.83, "max_dd": 2.39, "win_rate": 60.61, "profit_factor": 2.328, "ic": 0.4386, "hit": 60.61, "n": 165, "aleatoric_mean": 3.7e-05, "epistemic_mean": 7.4e-05, "confidence_mean": 0.9999, "aleatoric_std": 3.3e-05, "epistemic_std": 6.5e-05}, {"fold": "fold_7", "regime": "Recent mixed/upturn", "sharpe": 6.292, "sortino": 11.4822, "return_pct": 41.34, "equity": 1413.44, "max_dd": 2.76, "win_rate": 64.2, "profit_factor": 2.953, "ic": 0.444, "hit": 64.2, "n": 162, "aleatoric_mean": 2.7e-05, "epistemic_mean": 5.5e-05, "confidence_mean": 0.9999, "aleatoric_std": 1.7e-05, "epistemic_std": 3.5e-05}], "val_sharpe": 4.7419, "val_psr": 1.0, "val_equity": 2915.06, "val_sortino": 7.472, "val_return_pct": 191.51, "val_max_dd": 6.21, "val_win_rate": 62.78, "val_profit_factor": 2.246, "val_ic": 0.3766, "val_hit": 62.37, "val_aleatoric_mean": 2.2e-05, "val_epistemic_mean": 4.3e-05, "val_confidence_mean": 0.9999, "val_per_window": [{"fold": "fold_1", "regime": "Pre-crisis upturn + GFC onset", "sharpe": -0.9038, "sortino": -1.5761, "return_pct": -2.32, "equity": 976.75, "max_dd": 4.17, "win_rate": 46.3, "profit_factor": 0.861, "ic": 0.0163, "hit": 45.87, "n": 109, "aleatoric_mean": 2.1e-05, "epistemic_mean": 4.2e-05, "confidence_mean": 0.9999, "aleatoric_std": 2.1e-05, "epistemic_std": 4.2e-05}, {"fold": "fold_2", "regime": "Post-crash recovery", "sharpe": 0.1892, "sortino": 0.3085, "return_pct": 0.65, "equity": 1006.45, "max_dd": 6.21, "win_rate": 46.3, "profit_factor": 1.03, "ic": 0.0163, "hit": 46.3, "n": 108, "aleatoric_mean": 3.5e-05, "epistemic_mean": 7e-05, "confidence_mean": 0.9999, "aleatoric_std": 2.8e-05, "epistemic_std": 5.5e-05}, {"fold": "fold_3", "regime": "Eurozone debt plateau", "sharpe": 8.1511, "sortino": 14.0203, "return_pct": 33.84, "equity": 1338.4, "max_dd": 2.74, "win_rate": 71.56, "profit_factor": 3.856, "ic": 0.5567, "hit": 70.27, "n": 111, "aleatoric_mean": 3e-05, "epistemic_mean": 5.9e-05, "confidence_mean": 0.9999, "aleatoric_std": 1.7e-05, "epistemic_std": 3.4e-05}, {"fold": "fold_4", "regime": "Strong USD downturn", "sharpe": 7.8364, "sortino": 17.2701, "return_pct": 27.49, "equity": 1274.9, "max_dd": 1.88, "win_rate": 73.39, "profit_factor": 3.774, "ic": 0.5973, "hit": 72.73, "n": 110, "aleatoric_mean": 2e-05, "epistemic_mean": 4e-05, "confidence_mean": 0.9999, "aleatoric_std": 2e-05, "epistemic_std": 4e-05}, {"fold": "fold_5", "regime": "Low-vol plateau", "sharpe": 8.3978, "sortino": 20.6802, "return_pct": 27.96, "equity": 1279.61, "max_dd": 1.04, "win_rate": 65.18, "profit_factor": 4.217, "ic": 0.5176, "hit": 65.18, "n": 112, "aleatoric_mean": 1.9e-05, "epistemic_mean": 3.8e-05, "confidence_mean": 0.9999, "aleatoric_std": 1.1e-05, "epistemic_std": 2.2e-05}, {"fold": "fold_6", "regime": "EUR crisis downturn", "sharpe": 8.4319, "sortino": 13.6574, "return_pct": 18.52, "equity": 1185.24, "max_dd": 0.9, "win_rate": 72.9, "profit_factor": 4.353, "ic": 0.5913, "hit": 72.22, "n": 108, "aleatoric_mean": 1.2e-05, "epistemic_mean": 2.3e-05, "confidence_mean": 1.0, "aleatoric_std": 4e-06, "epistemic_std": 9e-06}, {"fold": "fold_7", "regime": "Recent mixed/upturn", "sharpe": 6.1072, "sortino": 10.5586, "return_pct": 14.58, "equity": 1145.84, "max_dd": 1.53, "win_rate": 63.64, "profit_factor": 2.69, "ic": 0.4523, "hit": 63.64, "n": 110, "aleatoric_mean": 1.6e-05, "epistemic_mean": 3.2e-05, "confidence_mean": 1.0, "aleatoric_std": 8e-06, "epistemic_std": 1.6e-05}], "train_sharpe": 6.3356, "train_psr": 1.0, "train_equity": 1271566.75, "train_sortino": 16.9244, "train_return_pct": 127056.67, "train_max_dd": 4.78, "train_win_rate": 71.8, "train_profit_factor": 4.598, "train_ic": 0.6065, "train_hit": 71.51, "train_per_window": [{"fold": "all_train", "regime": "Training data", "sharpe": 6.3356, "sortino": 16.9244, "return_pct": 127056.67, "equity": 1271566.75, "max_dd": 4.78, "win_rate": 71.8, "profit_factor": 4.598, "ic": 0.6065, "hit": 71.51, "n": 2478}], "experiment_num": 83, "status": "DISCARD"}
{"backbone": "mlp", "description": "mlp: Exp28 champion seed=2024", "config": {"seq_len": 10, "lr": 0.0005, "batch_size": 32, "epochs": 50, "weight_decay": 1e-05, "patience": 10, "grad_clip": 1.0, "warmup_epochs": 0, "huber_delta": 1.0, "head_dropout": 0.15, "seed": 2024, "het_loss": false}, "composite": 4.2596, "test_pos_folds": 7, "val_pos_folds": 5, "val_loss": 4.2e-05, "elapsed_sec": 22.9, "timestamp": "2026-04-14T17:18:44", "sharpe": 4.562, "psr": 1.0, "equity": 6126.79, "sortino": 5.7565, "return_pct": 512.68, "max_dd": 8.19, "win_rate": 64.71, "profit_factor": 2.361, "ic": 0.4059, "hit": 64.44, "aleatoric_mean": 4e-05, "epistemic_mean": 8.1e-05, "confidence_mean": 0.9999, "per_window": [{"fold": "fold_1", "regime": "Pre-crisis upturn + GFC onset", "sharpe": 0.1985, "sortino": 0.2202, "return_pct": 0.8, "equity": 1008.01, "max_dd": 8.19, "win_rate": 51.96, "profit_factor": 1.048, "ic": 0.0943, "hit": 51.46, "n": 103, "aleatoric_mean": 7.8e-05, "epistemic_mean": 0.000155, "confidence_mean": 0.9998, "aleatoric_std": 0.000108, "epistemic_std": 0.000216}, {"fold": "fold_2", "regime": "Post-crash recovery", "sharpe": 0.4368, "sortino": 0.7725, "return_pct": 1.84, "equity": 1018.42, "max_dd": 4.87, "win_rate": 53.27, "profit_factor": 1.071, "ic": -0.0367, "hit": 53.27, "n": 107, "aleatoric_mean": 2.7e-05, "epistemic_mean": 5.4e-05, "confidence_mean": 0.9999, "aleatoric_std": 1.3e-05, "epistemic_std": 2.6e-05}, {"fold": "fold_3", "regime": "Eurozone debt plateau", "sharpe": 6.5024, "sortino": 11.8913, "return_pct": 23.63, "equity": 1236.28, "max_dd": 3.63, "win_rate": 71.15, "profit_factor": 2.79, "ic": 0.5002, "hit": 69.81, "n": 106, "aleatoric_mean": 4.3e-05, "epistemic_mean": 8.6e-05, "confidence_mean": 0.9999, "aleatoric_std": 2.6e-05, "epistemic_std": 5.2e-05}, {"fold": "fold_4", "regime": "Strong USD downturn", "sharpe": 7.8198, "sortino": 13.6878, "return_pct": 71.83, "equity": 1718.32, "max_dd": 2.07, "win_rate": 72.46, "profit_factor": 3.868, "ic": 0.5455, "hit": 72.02, "n": 168, "aleatoric_mean": 5.6e-05, "epistemic_mean": 0.000112, "confidence_mean": 0.9998, "aleatoric_std": 4e-05, "epistemic_std": 8e-05}, {"fold": "fold_5", "regime": "Low-vol plateau", "sharpe": 6.222, "sortino": 11.4921, "return_pct": 21.2, "equity": 1211.95, "max_dd": 1.21, "win_rate": 63.58, "profit_factor": 2.859, "ic": 0.516, "hit": 63.58, "n": 162, "aleatoric_mean": 2.2e-05, "epistemic_mean": 4.4e-05, "confidence_mean": 0.9999, "aleatoric_std": 1.3e-05, "epistemic_std": 2.6e-05}, {"fold": "fold_6", "regime": "EUR crisis downturn", "sharpe": 7.8492, "sortino": 15.7235, "return_pct": 55.29, "equity": 1552.93, "max_dd": 2.26, "win_rate": 67.88, "profit_factor": 3.634, "ic": 0.5297, "hit": 67.88, "n": 165, "aleatoric_mean": 4e-05, "epistemic_mean": 7.9e-05, "confidence_mean": 0.9999, "aleatoric_std": 2.8e-05, "epistemic_std": 5.6e-05}, {"fold": "fold_7", "regime": "Recent mixed/upturn", "sharpe": 7.4777, "sortino": 13.2687, "return_pct": 49.27, "equity": 1492.74, "max_dd": 1.95, "win_rate": 66.05, "profit_factor": 3.666, "ic": 0.5715, "hit": 66.05, "n": 162, "aleatoric_mean": 2.7e-05, "epistemic_mean": 5.3e-05, "confidence_mean": 0.9999, "aleatoric_std": 1.4e-05, "epistemic_std": 2.8e-05}], "val_sharpe": 4.4596, "val_psr": 1.0, "val_equity": 2746.91, "val_sortino": 6.8759, "val_return_pct": 174.69, "val_max_dd": 12.8, "val_win_rate": 60.29, "val_profit_factor": 2.138, "val_ic": 0.378, "val_hit": 59.9, "val_aleatoric_mean": 2.3e-05, "val_epistemic_mean": 4.6e-05, "val_confidence_mean": 0.9999, "val_per_window": [{"fold": "fold_1", "regime": "Pre-crisis upturn + GFC onset", "sharpe": -1.3721, "sortino": -2.0903, "return_pct": -3.46, "equity": 965.36, "max_dd": 4.89, "win_rate": 43.52, "profit_factor": 0.796, "ic": -0.1425, "hit": 43.12, "n": 109, "aleatoric_mean": 2.3e-05, "epistemic_mean": 4.5e-05, "confidence_mean": 0.9999, "aleatoric_std": 2.1e-05, "epistemic_std": 4.1e-05}, {"fold": "fold_2", "regime": "Post-crash recovery", "sharpe": -1.2398, "sortino": -1.8685, "return_pct": -6.08, "equity": 939.15, "max_dd": 9.61, "win_rate": 45.37, "profit_factor": 0.822, "ic": -0.1691, "hit": 45.37, "n": 108, "aleatoric_mean": 3.5e-05, "epistemic_mean": 7.1e-05, "confidence_mean": 0.9999, "aleatoric_std": 2.4e-05, "epistemic_std": 4.9e-05}, {"fold": "fold_3", "regime": "Eurozone debt plateau", "sharpe": 11.1049, "sortino": 36.7416, "return_pct": 44.23, "equity": 1442.31, "max_dd": 0.81, "win_rate": 69.72, "profit_factor": 6.636, "ic": 0.6495, "hit": 68.47, "n": 111, "aleatoric_mean": 2.9e-05, "epistemic_mean": 5.8e-05, "confidence_mean": 0.9999, "aleatoric_std": 1.5e-05, "epistemic_std": 3e-05}, {"fold": "fold_4", "regime": "Strong USD downturn", "sharpe": 4.9957, "sortino": 10.8064, "return_pct": 17.85, "equity": 1178.52, "max_dd": 2.23, "win_rate": 60.55, "profit_factor": 2.301, "ic": 0.6271, "hit": 60.0, "n": 110, "aleatoric_mean": 2.2e-05, "epistemic_mean": 4.5e-05, "confidence_mean": 0.9999, "aleatoric_std": 1.9e-05, "epistemic_std": 3.9e-05}, {"fold": "fold_5", "regime": "Low-vol plateau", "sharpe": 9.3165, "sortino": 24.1013, "return_pct": 30.6, "equity": 1306.01, "max_dd": 1.24, "win_rate": 70.54, "profit_factor": 5.014, "ic": 0.6384, "hit": 70.54, "n": 112, "aleatoric_mean": 2.1e-05, "epistemic_mean": 4.3e-05, "confidence_mean": 0.9999, "aleatoric_std": 1.3e-05, "epistemic_std": 2.7e-05}, {"fold": "fold_6", "regime": "EUR crisis downturn", "sharpe": 8.4357, "sortino": 11.9878, "return_pct": 18.53, "equity": 1185.31, "max_dd": 1.62, "win_rate": 72.9, "profit_factor": 4.357, "ic": 0.6078, "hit": 72.22, "n": 108, "aleatoric_mean": 1.4e-05, "epistemic_mean": 2.8e-05, "confidence_mean": 1.0, "aleatoric_std": 5e-06, "epistemic_std": 1.1e-05}, {"fold": "fold_7", "regime": "Recent mixed/upturn", "sharpe": 6.3592, "sortino": 16.3176, "return_pct": 15.14, "equity": 1151.45, "max_dd": 1.44, "win_rate": 59.09, "profit_factor": 2.805, "ic": 0.5574, "hit": 59.09, "n": 110, "aleatoric_mean": 1.6e-05, "epistemic_mean": 3.3e-05, "confidence_mean": 1.0, "aleatoric_std": 1e-05, "epistemic_std": 1.9e-05}], "train_sharpe": 6.5114, "train_psr": 1.0, "train_equity": 1510015.5, "train_sortino": 18.8878, "train_return_pct": 150901.55, "train_max_dd": 3.46, "train_win_rate": 71.43, "train_profit_factor": 4.849, "train_ic": 0.6709, "train_hit": 71.15, "train_per_window": [{"fold": "all_train", "regime": "Training data", "sharpe": 6.5114, "sortino": 18.8878, "return_pct": 150901.55, "equity": 1510015.5, "max_dd": 3.46, "win_rate": 71.43, "profit_factor": 4.849, "ic": 0.6709, "hit": 71.15, "n": 2478}], "experiment_num": 84, "status": "DISCARD"}
{"backbone": "mlp", "description": "mlp: Exp29 residual huber=0.5 robust to tails seed=0", "config": {"seq_len": 10, "lr": 0.0005, "batch_size": 32, "epochs": 50, "weight_decay": 1e-05, "patience": 10, "grad_clip": 1.0, "warmup_epochs": 0, "huber_delta": 0.5, "head_dropout": 0.15, "seed": 0, "het_loss": false}, "composite": 5.499, "test_pos_folds": 7, "val_pos_folds": 6, "val_loss": 3.8e-05, "elapsed_sec": 29.7, "timestamp": "2026-04-14T17:19:44", "sharpe": 6.2113, "psr": 1.0, "equity": 11010.87, "sortino": 11.3103, "return_pct": 1001.09, "max_dd": 4.13, "win_rate": 69.35, "profit_factor": 3.295, "ic": 0.4846, "hit": 69.06, "aleatoric_mean": 2.6e-05, "epistemic_mean": 5.2e-05, "confidence_mean": 0.9999, "per_window": [{"fold": "fold_1", "regime": "Pre-crisis upturn + GFC onset", "sharpe": 2.4608, "sortino": 6.7778, "return_pct": 19.79, "equity": 1197.85, "max_dd": 3.29, "win_rate": 60.78, "profit_factor": 1.805, "ic": 0.1877, "hit": 60.19, "n": 103, "aleatoric_mean": 5.3e-05, "epistemic_mean": 0.000106, "confidence_mean": 0.9998, "aleatoric_std": 7e-05, "epistemic_std": 0.000141}, {"fold": "fold_2", "regime": "Post-crash recovery", "sharpe": 1.1722, "sortino": 2.0218, "return_pct": 5.49, "equity": 1054.86, "max_dd": 3.47, "win_rate": 53.27, "profit_factor": 1.202, "ic": 0.0824, "hit": 53.27, "n": 107, "aleatoric_mean": 2.1e-05, "epistemic_mean": 4.3e-05, "confidence_mean": 0.9999, "aleatoric_std": 1.5e-05, "epistemic_std": 3.1e-05}, {"fold": "fold_3", "regime": "Eurozone debt plateau", "sharpe": 9.7583, "sortino": 18.8138, "return_pct": 34.13, "equity": 1341.27, "max_dd": 1.32, "win_rate": 75.96, "profit_factor": 4.755, "ic": 0.5836, "hit": 74.53, "n": 106, "aleatoric_mean": 2.8e-05, "epistemic_mean": 5.5e-05, "confidence_mean": 0.9999, "aleatoric_std": 1.4e-05, "epistemic_std": 2.9e-05}, {"fold": "fold_4", "regime": "Strong USD downturn", "sharpe": 9.7799, "sortino": 19.4179, "return_pct": 90.3, "equity": 1902.97, "max_dd": 1.81, "win_rate": 75.45, "profit_factor": 5.651, "ic": 0.6667, "hit": 75.0, "n": 168, "aleatoric_mean": 3.6e-05, "epistemic_mean": 7.2e-05, "confidence_mean": 0.9999, "aleatoric_std": 2.9e-05, "epistemic_std": 5.8e-05}, {"fold": "fold_5", "regime": "Low-vol plateau", "sharpe": 8.8545, "sortino": 16.1387, "return_pct": 29.29, "equity": 1292.92, "max_dd": 1.43, "win_rate": 70.99, "profit_factor": 4.604, "ic": 0.638, "hit": 70.99, "n": 162, "aleatoric_mean": 1.2e-05, "epistemic_mean": 2.5e-05, "confidence_mean": 1.0, "aleatoric_std": 7e-06, "epistemic_std": 1.3e-05}, {"fold": "fold_6", "regime": "EUR crisis downturn", "sharpe": 9.9474, "sortino": 21.0105, "return_pct": 69.54, "equity": 1695.35, "max_dd": 2.27, "win_rate": 70.91, "profit_factor": 5.27, "ic": 0.641, "hit": 70.91, "n": 165, "aleatoric_mean": 2.4e-05, "epistemic_mean": 4.9e-05, "confidence_mean": 0.9999, "aleatoric_std": 1.7e-05, "epistemic_std": 3.3e-05}, {"fold": "fold_7", "regime": "Recent mixed/upturn", "sharpe": 8.4769, "sortino": 14.3598, "return_pct": 55.75, "equity": 1557.55, "max_dd": 1.64, "win_rate": 71.6, "profit_factor": 4.429, "ic": 0.6222, "hit": 71.6, "n": 162, "aleatoric_mean": 1.7e-05, "epistemic_mean": 3.4e-05, "confidence_mean": 0.9999, "aleatoric_std": 1e-05, "epistemic_std": 2e-05}], "val_sharpe": 5.599, "val_psr": 1.0, "val_equity": 3472.42, "val_sortino": 8.4457, "val_return_pct": 247.24, "val_max_dd": 7.43, "val_win_rate": 66.19, "val_profit_factor": 2.61, "val_ic": 0.4582, "val_hit": 65.76, "val_aleatoric_mean": 1.5e-05, "val_epistemic_mean": 3e-05, "val_confidence_mean": 1.0, "val_per_window": [{"fold": "fold_1", "regime": "Pre-crisis upturn + GFC onset", "sharpe": 0.0212, "sortino": 0.0342, "return_pct": -0.02, "equity": 999.8, "max_dd": 2.91, "win_rate": 47.22, "profit_factor": 1.004, "ic": -0.0659, "hit": 46.79, "n": 109, "aleatoric_mean": 1.6e-05, "epistemic_mean": 3.1e-05, "confidence_mean": 1.0, "aleatoric_std": 2e-05, "epistemic_std": 4.1e-05}, {"fold": "fold_2", "regime": "Post-crash recovery", "sharpe": -0.6284, "sortino": -0.9753, "return_pct": -3.27, "equity": 967.3, "max_dd": 7.43, "win_rate": 47.22, "profit_factor": 0.906, "ic": 0.0432, "hit": 47.22, "n": 108, "aleatoric_mean": 2.7e-05, "epistemic_mean": 5.5e-05, "confidence_mean": 0.9999, "aleatoric_std": 2.2e-05, "epistemic_std": 4.3e-05}, {"fold": "fold_3", "regime": "Eurozone debt plateau", "sharpe": 11.0234, "sortino": 30.4677, "return_pct": 43.97, "equity": 1439.69, "max_dd": 0.84, "win_rate": 78.9, "profit_factor": 6.531, "ic": 0.6702, "hit": 77.48, "n": 111, "aleatoric_mean": 1.8e-05, "epistemic_mean": 3.6e-05, "confidence_mean": 0.9999, "aleatoric_std": 1.3e-05, "epistemic_std": 2.5e-05}, {"fold": "fold_4", "regime": "Strong USD downturn", "sharpe": 7.8607, "sortino": 16.5925, "return_pct": 27.57, "equity": 1275.68, "max_dd": 1.08, "win_rate": 71.56, "profit_factor": 3.79, "ic": 0.6035, "hit": 70.91, "n": 110, "aleatoric_mean": 1.4e-05, "epistemic_mean": 2.7e-05, "confidence_mean": 1.0, "aleatoric_std": 1.2e-05, "epistemic_std": 2.5e-05}, {"fold": "fold_5", "regime": "Low-vol plateau", "sharpe": 10.5961, "sortino": 28.9438, "return_pct": 34.04, "equity": 1340.39, "max_dd": 0.62, "win_rate": 75.0, "profit_factor": 6.466, "ic": 0.7232, "hit": 75.0, "n": 112, "aleatoric_mean": 1.3e-05, "epistemic_mean": 2.6e-05, "confidence_mean": 1.0, "aleatoric_std": 1e-05, "epistemic_std": 2e-05}, {"fold": "fold_6", "regime": "EUR crisis downturn", "sharpe": 9.2138, "sortino": 21.1712, "return_pct": 19.95, "equity": 1199.5, "max_dd": 0.82, "win_rate": 71.03, "profit_factor": 5.067, "ic": 0.717, "hit": 70.37, "n": 108, "aleatoric_mean": 8e-06, "epistemic_mean": 1.6e-05, "confidence_mean": 1.0, "aleatoric_std": 4e-06, "epistemic_std": 8e-06}, {"fold": "fold_7", "regime": "Recent mixed/upturn", "sharpe": 9.5361, "sortino": 25.4132, "return_pct": 21.6, "equity": 1215.96, "max_dd": 0.72, "win_rate": 71.82, "profit_factor": 4.828, "ic": 0.5963, "hit": 71.82, "n": 110, "aleatoric_mean": 9e-06, "epistemic_mean": 1.8e-05, "confidence_mean": 1.0, "aleatoric_std": 6e-06, "epistemic_std": 1.1e-05}], "train_sharpe": 7.9415, "train_psr": 1.0, "train_equity": 5670149.5, "train_sortino": 23.2561, "train_return_pct": 566914.95, "train_max_dd": 4.92, "train_win_rate": 78.04, "train_profit_factor": 7.921, "train_ic": 0.7556, "train_hit": 77.72, "train_per_window": [{"fold": "all_train", "regime": "Training data", "sharpe": 7.9415, "sortino": 23.2561, "return_pct": 566914.95, "equity": 5670149.5, "max_dd": 4.92, "win_rate": 78.04, "profit_factor": 7.921, "ic": 0.7556, "hit": 77.72, "n": 2478}], "experiment_num": 85, "status": "KEEP"}
