{"backbone": "dlinear", "description": "dlinear: Exp7 seq=60 hd=0.25", "config": {"seq_len": 60, "lr": 0.001, "batch_size": 32, "epochs": 100, "weight_decay": 0.0001, "patience": 20, "grad_clip": 1.0, "warmup_epochs": 0, "huber_delta": 1.0, "head_dropout": 0.25, "seed": 42, "het_loss": false}, "composite": 0.9227, "test_pos_folds": 6, "val_pos_folds": 6, "val_loss": 7.6e-05, "elapsed_sec": 21.0, "timestamp": "2026-04-21T12:40:46", "sharpe": 1.1227, "psr": 0.9624, "equity": 1284.74, "sortino": 1.8186, "return_pct": 28.47, "max_dd": 5.24, "win_rate": 55.25, "profit_factor": 1.207, "ic": 0.0555, "hit": 54.9, "aleatoric_mean": 4.9e-05, "epistemic_mean": 9.8e-05, "confidence_mean": 0.9999, "precision": 0.5481, "recall": 0.5516, "f1": 0.5498, "f2": 0.5509, "mcc": 0.1011, "accuracy": 0.5506, "per_window": [{"fold": "fold_1", "regime": "Pre-crisis upturn + GFC onset", "sharpe": -0.8285, "sortino": -1.5889, "return_pct": -1.84, "equity": 981.6, "max_dd": 4.15, "win_rate": 50.0, "profit_factor": 0.881, "ic": -0.1522, "hit": 49.06, "n": 53, "precision": 0.5, "recall": 0.3462, "f1": 0.4091, "f2": 0.3689, "mcc": 0.0135, "accuracy": 0.5094, "tp": 9, "fp": 9, "tn": 18, "fn": 17, "aleatoric_mean": 4e-05, "epistemic_mean": 8.1e-05, "confidence_mean": 0.9999, "aleatoric_std": 2.2e-05, "epistemic_std": 4.5e-05}, {"fold": "fold_2", "regime": "Post-crash recovery", "sharpe": 1.5744, "sortino": 2.3699, "return_pct": 4.39, "equity": 1043.92, "max_dd": 5.24, "win_rate": 63.16, "profit_factor": 1.287, "ic": 0.2285, "hit": 63.16, "n": 57, "precision": 0.6087, "recall": 0.9032, "f1": 0.7273, "f2": 0.8235, "mcc": 0.2662, "accuracy": 0.6316, "tp": 28, "fp": 18, "tn": 8, "fn": 3, "aleatoric_mean": 5.2e-05, "epistemic_mean": 0.000103, "confidence_mean": 0.9998, "aleatoric_std": 2.1e-05, "epistemic_std": 4.3e-05}, {"fold": "fold_3", "regime": "Eurozone debt plateau", "sharpe": 0.5606, "sortino": 0.9359, "return_pct": 0.93, "equity": 1009.27, "max_dd": 3.21, "win_rate": 51.85, "profit_factor": 1.093, "ic": 0.2157, "hit": 50.0, "n": 56, "precision": 0.5455, "recall": 0.75, "f1": 0.6316, "f2": 0.6977, "mcc": -0.1005, "accuracy": 0.5, "tp": 24, "fp": 20, "tn": 4, "fn": 8, "aleatoric_mean": 6e-05, "epistemic_mean": 0.000121, "confidence_mean": 0.9998, "aleatoric_std": 2.9e-05, "epistemic_std": 5.7e-05}, {"fold": "fold_4", "regime": "Strong USD downturn", "sharpe": 1.5697, "sortino": 3.0144, "return_pct": 7.93, "equity": 1079.31, "max_dd": 3.77, "win_rate": 52.14, "profit_factor": 1.301, "ic": -0.003, "hit": 51.69, "n": 118, "precision": 0.52, "recall": 0.65, "f1": 0.5778, "f2": 0.619, "mcc": 0.0304, "accuracy": 0.5169, "tp": 39, "fp": 36, "tn": 22, "fn": 21, "aleatoric_mean": 4.8e-05, "epistemic_mean": 9.6e-05, "confidence_mean": 0.9999, "aleatoric_std": 2e-05, "epistemic_std": 4e-05}, {"fold": "fold_5", "regime": "Low-vol plateau", "sharpe": 0.7762, "sortino": 1.0907, "return_pct": 1.7, "equity": 1017.04, "max_dd": 2.37, "win_rate": 55.36, "profit_factor": 1.138, "ic": 0.0193, "hit": 55.36, "n": 112, "precision": 0.5385, "recall": 0.1373, "f1": 0.2188, "f2": 0.1613, "mcc": 0.0605, "accuracy": 0.5536, "tp": 7, "fp": 6, "tn": 55, "fn": 44, "aleatoric_mean": 2.7e-05, "epistemic_mean": 5.3e-05, "confidence_mean": 0.9999, "aleatoric_std": 1e-05, "epistemic_std": 1.9e-05}, {"fold": "fold_6", "regime": "EUR crisis downturn", "sharpe": 1.9496, "sortino": 3.1241, "return_pct": 8.87, "equity": 1088.68, "max_dd": 4.55, "win_rate": 60.0, "profit_factor": 1.361, "ic": 0.1541, "hit": 60.0, "n": 115, "precision": 0.5412, "recall": 0.8679, "f1": 0.6667, "f2": 0.7744, "mcc": 0.2712, "accuracy": 0.6, "tp": 46, "fp": 39, "tn": 23, "fn": 7, "aleatoric_mean": 7.7e-05, "epistemic_mean": 0.000153, "confidence_mean": 0.9998, "aleatoric_std": 5.1e-05, "epistemic_std": 0.000102}, {"fold": "fold_7", "regime": "Recent mixed/upturn", "sharpe": 0.9845, "sortino": 1.785, "return_pct": 3.95, "equity": 1039.49, "max_dd": 3.67, "win_rate": 53.57, "profit_factor": 1.184, "ic": 0.083, "hit": 53.57, "n": 112, "precision": 0.5806, "recall": 0.3158, "f1": 0.4091, "f2": 0.3475, "mcc": 0.0887, "accuracy": 0.5357, "tp": 18, "fp": 13, "tn": 42, "fn": 39, "aleatoric_mean": 4.1e-05, "epistemic_mean": 8.1e-05, "confidence_mean": 0.9999, "aleatoric_std": 2.4e-05, "epistemic_std": 4.8e-05}], "val_sharpe": 1.2592, "val_psr": 0.9483, "val_equity": 1164.72, "val_sortino": 2.0498, "val_return_pct": 16.47, "val_max_dd": 3.74, "val_win_rate": 50.96, "val_profit_factor": 1.234, "val_ic": 0.0999, "val_hit": 50.72, "val_aleatoric_mean": 3.3e-05, "val_epistemic_mean": 6.7e-05, "val_confidence_mean": 0.9999, "val_precision": 0.5034, "val_recall": 0.3592, "val_f1": 0.4193, "val_f2": 0.3811, "val_mcc": 0.0156, "val_accuracy": 0.5096, "val_per_window": [{"fold": "fold_1", "regime": "Pre-crisis upturn + GFC onset", "sharpe": 2.3509, "sortino": 4.2773, "return_pct": 3.7, "equity": 1037.01, "max_dd": 1.57, "win_rate": 51.72, "profit_factor": 1.473, "ic": 0.0572, "hit": 50.85, "n": 59, "precision": 0.5294, "recall": 0.5806, "f1": 0.5538, "f2": 0.5696, "mcc": 0.0093, "accuracy": 0.5085, "tp": 18, "fp": 16, "tn": 12, "fn": 13, "aleatoric_mean": 5.8e-05, "epistemic_mean": 0.000115, "confidence_mean": 0.9998, "aleatoric_std": 8.7e-05, "epistemic_std": 0.000174}, {"fold": "fold_2", "regime": "Post-crash recovery", "sharpe": 1.8537, "sortino": 3.2262, "return_pct": 3.59, "equity": 1035.92, "max_dd": 3.74, "win_rate": 60.34, "profit_factor": 1.35, "ic": 0.1231, "hit": 60.34, "n": 58, "precision": 0.6538, "recall": 0.5484, "f1": 0.5965, "f2": 0.5667, "mcc": 0.2157, "accuracy": 0.6034, "tp": 17, "fp": 9, "tn": 18, "fn": 14, "aleatoric_mean": 4e-05, "epistemic_mean": 7.9e-05, "confidence_mean": 0.9999, "aleatoric_std": 1.9e-05, "epistemic_std": 3.8e-05}, {"fold": "fold_3", "regime": "Eurozone debt plateau", "sharpe": 0.5514, "sortino": 0.9093, "return_pct": 1.19, "equity": 1011.94, "max_dd": 2.73, "win_rate": 45.9, "profit_factor": 1.096, "ic": 0.0551, "hit": 45.9, "n": 61, "precision": 0.4286, "recall": 0.6667, "f1": 0.5217, "f2": 0.6, "mcc": -0.0421, "accuracy": 0.459, "tp": 18, "fp": 24, "tn": 10, "fn": 9, "aleatoric_mean": 3.5e-05, "epistemic_mean": 6.9e-05, "confidence_mean": 0.9999, "aleatoric_std": 1.8e-05, "epistemic_std": 3.6e-05}, {"fold": "fold_4", "regime": "Strong USD downturn", "sharpe": 2.2414, "sortino": 4.2502, "return_pct": 4.87, "equity": 1048.75, "max_dd": 1.82, "win_rate": 53.33, "profit_factor": 1.41, "ic": 0.0178, "hit": 53.33, "n": 60, "precision": 1.0, "recall": 0.0345, "f1": 0.0667, "f2": 0.0427, "mcc": 0.1346, "accuracy": 0.5333, "tp": 1, "fp": 0, "tn": 31, "fn": 28, "aleatoric_mean": 2.2e-05, "epistemic_mean": 4.3e-05, "confidence_mean": 0.9999, "aleatoric_std": 8e-06, "epistemic_std": 1.5e-05}, {"fold": "fold_5", "regime": "Low-vol plateau", "sharpe": -0.113, "sortino": -0.1822, "return_pct": -0.26, "equity": 997.43, "max_dd": 3.26, "win_rate": 46.77, "profit_factor": 0.982, "ic": 0.3974, "hit": 46.77, "n": 62, "precision": 0.0, "recall": 0.0, "f1": 0.0, "f2": 0.0, "mcc": -0.1322, "accuracy": 0.4677, "tp": 0, "fp": 1, "tn": 29, "fn": 32, "aleatoric_mean": 2.4e-05, "epistemic_mean": 4.7e-05, "confidence_mean": 0.9999, "aleatoric_std": 8e-06, "epistemic_std": 1.7e-05}, {"fold": "fold_6", "regime": "EUR crisis downturn", "sharpe": 2.0207, "sortino": 3.3689, "return_pct": 2.09, "equity": 1020.9, "max_dd": 1.74, "win_rate": 56.14, "profit_factor": 1.393, "ic": 0.0548, "hit": 55.17, "n": 58, "precision": 0.4545, "recall": 0.2083, "f1": 0.2857, "f2": 0.2336, "mcc": 0.04, "accuracy": 0.569, "tp": 5, "fp": 6, "tn": 28, "fn": 19, "aleatoric_mean": 1.8e-05, "epistemic_mean": 3.6e-05, "confidence_mean": 0.9999, "aleatoric_std": 6e-06, "epistemic_std": 1.2e-05}, {"fold": "fold_7", "regime": "Recent mixed/upturn", "sharpe": 0.2828, "sortino": 0.4296, "return_pct": 0.33, "equity": 1003.28, "max_dd": 1.78, "win_rate": 43.33, "profit_factor": 1.047, "ic": -0.1018, "hit": 43.33, "n": 60, "precision": 0.4688, "recall": 0.4688, "f1": 0.4688, "f2": 0.4688, "mcc": -0.1384, "accuracy": 0.4333, "tp": 15, "fp": 17, "tn": 11, "fn": 17, "aleatoric_mean": 3.8e-05, "epistemic_mean": 7.7e-05, "confidence_mean": 0.9999, "aleatoric_std": 2.8e-05, "epistemic_std": 5.5e-05}], "train_sharpe": 4.2884, "train_psr": 1.0, "train_equity": 18389.45, "train_sortino": 11.9413, "train_return_pct": 1738.94, "train_max_dd": 3.43, "train_win_rate": 63.93, "train_profit_factor": 2.818, "train_ic": 0.4637, "train_hit": 63.6, "train_precision": 0.7218, "train_recall": 0.4993, "train_f1": 0.5903, "train_f2": 0.5321, "train_mcc": 0.3039, "train_accuracy": 0.6404, "train_per_window": [{"fold": "all_train", "regime": "Training data", "sharpe": 4.2884, "sortino": 11.9413, "return_pct": 1738.94, "equity": 18389.45, "max_dd": 3.43, "win_rate": 63.93, "profit_factor": 2.818, "ic": 0.4637, "hit": 63.6, "n": 1382, "precision": 0.7218, "recall": 0.4993, "f1": 0.5903, "f2": 0.5321, "mcc": 0.3039, "accuracy": 0.6404, "tp": 358, "fp": 138, "tn": 527, "fn": 359}], "experiment_num": 251, "status": "DISCARD"}
{"backbone": "itransformer", "description": "itransformer: Exp1 SOTA baseline seq=10", "config": {"seq_len": 10, "lr": 5e-05, "batch_size": 32, "epochs": 100, "weight_decay": 0.0, "patience": 20, "grad_clip": 1.0, "warmup_epochs": 10, "huber_delta": 1.0, "head_dropout": 0.1, "seed": 42, "het_loss": false}, "composite": -1.0141, "test_pos_folds": 2, "val_pos_folds": 3, "val_loss": 3.2e-05, "elapsed_sec": 128.0, "timestamp": "2026-04-21T12:44:57", "sharpe": -0.1141, "psr": 0.4112, "equity": 931.91, "sortino": -0.1486, "return_pct": -6.81, "max_dd": 18.38, "win_rate": 50.15, "profit_factor": 0.979, "ic": 0.0019, "hit": 49.95, "aleatoric_mean": 5.5e-05, "epistemic_mean": 0.00011, "confidence_mean": 0.9998, "precision": 0.4957, "recall": 0.4782, "f1": 0.4868, "f2": 0.4816, "mcc": 0.0026, "accuracy": 0.5015, "per_window": [{"fold": "fold_1", "regime": "Pre-crisis upturn + GFC onset", "sharpe": 0.4069, "sortino": 0.4244, "return_pct": 2.43, "equity": 1024.34, "max_dd": 10.27, "win_rate": 57.84, "profit_factor": 1.101, "ic": 0.0618, "hit": 57.28, "n": 103, "precision": 0.5818, "recall": 0.6038, "f1": 0.5926, "f2": 0.5993, "mcc": 0.144, "accuracy": 0.5728, "tp": 32, "fp": 23, "tn": 27, "fn": 21, "aleatoric_mean": 0.000165, "epistemic_mean": 0.00033, "confidence_mean": 0.9995, "aleatoric_std": 0.0004, "epistemic_std": 0.0008}, {"fold": "fold_2", "regime": "Post-crash recovery", "sharpe": -0.5188, "sortino": -0.8009, "return_pct": -2.72, "equity": 972.77, "max_dd": 7.06, "win_rate": 52.34, "profit_factor": 0.922, "ic": -0.0065, "hit": 52.34, "n": 107, "precision": 0.5, "recall": 0.6275, "f1": 0.5565, "f2": 0.597, "mcc": 0.0571, "accuracy": 0.5234, "tp": 32, "fp": 32, "tn": 24, "fn": 19, "aleatoric_mean": 3.6e-05, "epistemic_mean": 7.1e-05, "confidence_mean": 0.9999, "aleatoric_std": 1.4e-05, "epistemic_std": 2.8e-05}, {"fold": "fold_3", "regime": "Eurozone debt plateau", "sharpe": -0.827, "sortino": -1.5345, "return_pct": -3.03, "equity": 969.66, "max_dd": 7.83, "win_rate": 47.12, "profit_factor": 0.878, "ic": -0.0438, "hit": 46.23, "n": 106, "precision": 0.5098, "recall": 0.4561, "f1": 0.4815, "f2": 0.4659, "mcc": -0.0539, "accuracy": 0.4717, "tp": 26, "fp": 25, "tn": 24, "fn": 31, "aleatoric_mean": 4.6e-05, "epistemic_mean": 9.2e-05, "confidence_mean": 0.9999, "aleatoric_std": 2e-05, "epistemic_std": 4.1e-05}, {"fold": "fold_4", "regime": "Strong USD downturn", "sharpe": 0.5564, "sortino": 0.8264, "return_pct": 3.95, "equity": 1039.49, "max_dd": 9.66, "win_rate": 53.29, "profit_factor": 1.098, "ic": 0.0238, "hit": 52.98, "n": 168, "precision": 0.5526, "recall": 0.4884, "f1": 0.5185, "f2": 0.5, "mcc": 0.0741, "accuracy": 0.5357, "tp": 42, "fp": 34, "tn": 48, "fn": 44, "aleatoric_mean": 4.1e-05, "epistemic_mean": 8.3e-05, "confidence_mean": 0.9999, "aleatoric_std": 2e-05, "epistemic_std": 4.1e-05}, {"fold": "fold_5", "regime": "Low-vol plateau", "sharpe": -0.5449, "sortino": -0.7747, "return_pct": -1.88, "equity": 981.16, "max_dd": 3.47, "win_rate": 48.15, "profit_factor": 0.913, "ic": -0.0553, "hit": 48.15, "n": 162, "precision": 0.4444, "recall": 0.4211, "f1": 0.4324, "f2": 0.4255, "mcc": -0.0443, "accuracy": 0.4815, "tp": 32, "fp": 40, "tn": 46, "fn": 44, "aleatoric_mean": 3.6e-05, "epistemic_mean": 7.2e-05, "confidence_mean": 0.9999, "aleatoric_std": 1.3e-05, "epistemic_std": 2.6e-05}, {"fold": "fold_6", "regime": "EUR crisis downturn", "sharpe": -0.3068, "sortino": -0.471, "return_pct": -2.21, "equity": 977.89, "max_dd": 6.1, "win_rate": 47.27, "profit_factor": 0.952, "ic": 0.0017, "hit": 47.27, "n": 165, "precision": 0.4359, "recall": 0.4416, "f1": 0.4387, "f2": 0.4404, "mcc": -0.0584, "accuracy": 0.4727, "tp": 34, "fp": 44, "tn": 44, "fn": 43, "aleatoric_mean": 5.1e-05, "epistemic_mean": 0.000102, "confidence_mean": 0.9998, "aleatoric_std": 2.7e-05, "epistemic_std": 5.5e-05}, {"fold": "fold_7", "regime": "Recent mixed/upturn", "sharpe": -0.5155, "sortino": -0.7028, "return_pct": -3.29, "equity": 967.06, "max_dd": 10.59, "win_rate": 47.53, "profit_factor": 0.917, "ic": 0.0016, "hit": 47.53, "n": 162, "precision": 0.4706, "recall": 0.3951, "f1": 0.4295, "f2": 0.4082, "mcc": -0.05, "accuracy": 0.4753, "tp": 32, "fp": 36, "tn": 45, "fn": 49, "aleatoric_mean": 3.9e-05, "epistemic_mean": 7.9e-05, "confidence_mean": 0.9999, "aleatoric_std": 1.8e-05, "epistemic_std": 3.6e-05}], "val_sharpe": 0.6387, "val_psr": 0.8678, "val_equity": 1152.96, "val_sortino": 0.9838, "val_return_pct": 15.3, "val_max_dd": 9.3, "val_win_rate": 52.16, "val_profit_factor": 1.114, "val_ic": 0.0613, "val_hit": 51.82, "val_aleatoric_mean": 3.8e-05, "val_epistemic_mean": 7.6e-05, "val_confidence_mean": 0.9999, "val_precision": 0.496, "val_recall": 0.5096, "val_f1": 0.5027, "val_f2": 0.5068, "val_mcc": 0.0406, "val_accuracy": 0.5208, "val_per_window": [{"fold": "fold_1", "regime": "Pre-crisis upturn + GFC onset", "sharpe": -0.1177, "sortino": -0.1921, "return_pct": -0.37, "equity": 996.3, "max_dd": 4.74, "win_rate": 49.07, "profit_factor": 0.981, "ic": 0.0274, "hit": 48.62, "n": 109, "precision": 0.4909, "recall": 0.4909, "f1": 0.4909, "f2": 0.4909, "mcc": -0.0276, "accuracy": 0.4862, "tp": 27, "fp": 28, "tn": 26, "fn": 28, "aleatoric_mean": 3.2e-05, "epistemic_mean": 6.5e-05, "confidence_mean": 0.9999, "aleatoric_std": 1.2e-05, "epistemic_std": 2.3e-05}, {"fold": "fold_2", "regime": "Post-crash recovery", "sharpe": 0.2878, "sortino": 0.4608, "return_pct": 1.13, "equity": 1011.28, "max_dd": 6.09, "win_rate": 54.63, "profit_factor": 1.046, "ic": -0.0042, "hit": 54.63, "n": 108, "precision": 0.6094, "recall": 0.619, "f1": 0.6142, "f2": 0.6171, "mcc": 0.0637, "accuracy": 0.5463, "tp": 39, "fp": 25, "tn": 20, "fn": 24, "aleatoric_mean": 5.5e-05, "epistemic_mean": 0.000111, "confidence_mean": 0.9998, "aleatoric_std": 3.1e-05, "epistemic_std": 6.1e-05}, {"fold": "fold_3", "regime": "Eurozone debt plateau", "sharpe": 3.8906, "sortino": 6.0067, "return_pct": 16.3, "equity": 1163.01, "max_dd": 1.72, "win_rate": 62.39, "profit_factor": 1.884, "ic": 0.2472, "hit": 61.26, "n": 111, "precision": 0.549, "recall": 0.5957, "f1": 0.5714, "f2": 0.5858, "mcc": 0.2344, "accuracy": 0.6216, "tp": 28, "fp": 23, "tn": 41, "fn": 19, "aleatoric_mean": 3.7e-05, "epistemic_mean": 7.4e-05, "confidence_mean": 0.9999, "aleatoric_std": 1.2e-05, "epistemic_std": 2.4e-05}, {"fold": "fold_4", "regime": "Strong USD downturn", "sharpe": -0.0569, "sortino": -0.0939, "return_pct": -0.34, "equity": 996.64, "max_dd": 4.68, "win_rate": 45.87, "profit_factor": 0.991, "ic": -0.0797, "hit": 45.45, "n": 110, "precision": 0.375, "recall": 0.383, "f1": 0.3789, "f2": 0.3814, "mcc": -0.093, "accuracy": 0.4636, "tp": 18, "fp": 30, "tn": 33, "fn": 29, "aleatoric_mean": 4e-05, "epistemic_mean": 7.9e-05, "confidence_mean": 0.9999, "aleatoric_std": 1.4e-05, "epistemic_std": 2.8e-05}, {"fold": "fold_5", "regime": "Low-vol plateau", "sharpe": -0.6725, "sortino": -1.141, "return_pct": -2.34, "equity": 976.6, "max_dd": 5.12, "win_rate": 50.0, "profit_factor": 0.894, "ic": 0.0056, "hit": 50.0, "n": 112, "precision": 0.4694, "recall": 0.434, "f1": 0.451, "f2": 0.4406, "mcc": -0.0068, "accuracy": 0.5, "tp": 23, "fp": 26, "tn": 33, "fn": 30, "aleatoric_mean": 3.4e-05, "epistemic_mean": 6.7e-05, "confidence_mean": 0.9999, "aleatoric_std": 1.3e-05, "epistemic_std": 2.6e-05}, {"fold": "fold_6", "regime": "EUR crisis downturn", "sharpe": 1.3233, "sortino": 2.0968, "return_pct": 3.0, "equity": 1030.04, "max_dd": 2.85, "win_rate": 53.27, "profit_factor": 1.25, "ic": 0.0656, "hit": 52.78, "n": 108, "precision": 0.4615, "recall": 0.5106, "f1": 0.4848, "f2": 0.5, "mcc": 0.0512, "accuracy": 0.5278, "tp": 24, "fp": 28, "tn": 33, "fn": 23, "aleatoric_mean": 3.5e-05, "epistemic_mean": 6.9e-05, "confidence_mean": 0.9999, "aleatoric_std": 1.2e-05, "epistemic_std": 2.3e-05}, {"fold": "fold_7", "regime": "Recent mixed/upturn", "sharpe": -0.7541, "sortino": -1.2577, "return_pct": -1.86, "equity": 981.44, "max_dd": 6.52, "win_rate": 50.0, "profit_factor": 0.886, "ic": 0.032, "hit": 50.0, "n": 110, "precision": 0.4821, "recall": 0.5094, "f1": 0.4954, "f2": 0.5037, "mcc": 0.0007, "accuracy": 0.5, "tp": 27, "fp": 29, "tn": 28, "fn": 26, "aleatoric_mean": 3.2e-05, "epistemic_mean": 6.5e-05, "confidence_mean": 0.9999, "aleatoric_std": 1.2e-05, "epistemic_std": 2.4e-05}], "train_sharpe": 1.1674, "train_psr": 1.0, "train_equity": 3877.36, "train_sortino": 2.6309, "train_return_pct": 287.74, "train_max_dd": 12.84, "train_win_rate": 50.89, "train_profit_factor": 1.291, "train_ic": 0.0946, "train_hit": 50.69, "train_precision": 0.5269, "train_recall": 0.4529, "train_f1": 0.4871, "train_f2": 0.466, "train_mcc": 0.0228, "train_accuracy": 0.5097, "train_per_window": [{"fold": "all_train", "regime": "Training data", "sharpe": 1.1674, "sortino": 2.6309, "return_pct": 287.74, "equity": 3877.36, "max_dd": 12.84, "win_rate": 50.89, "profit_factor": 1.291, "ic": 0.0946, "hit": 50.69, "n": 2478, "precision": 0.5269, "recall": 0.4529, "f1": 0.4871, "f2": 0.466, "mcc": 0.0228, "accuracy": 0.5097, "tp": 577, "fp": 518, "tn": 686, "fn": 697}], "experiment_num": 252, "status": "DISCARD"}
