{"backbone": "lstm", "description": "lstm: Exp30 bs=8 even smaller batch (Keskar 2017 continuation)", "config": {"seq_len": 10, "lr": 0.001, "batch_size": 8, "epochs": 100, "weight_decay": 0.001, "patience": 15, "grad_clip": 1.0, "warmup_epochs": 0, "huber_delta": 1.0, "head_dropout": 0.25, "seed": 42, "het_loss": false}, "composite": 5.8423, "test_pos_folds": 6, "val_pos_folds": 6, "val_loss": 2.8e-05, "elapsed_sec": 99.9, "timestamp": "2026-04-19T19:41:50", "sharpe": 6.0423, "psr": 1.0, "equity": 10393.22, "sortino": 7.1103, "return_pct": 939.32, "max_dd": 8.42, "win_rate": 70.07, "profit_factor": 3.181, "ic": 0.578, "hit": 69.78, "aleatoric_mean": 2e-06, "epistemic_mean": 4e-06, "confidence_mean": 1.0, "precision": 0.6556, "recall": 0.8233, "f1": 0.73, "f2": 0.7832, "mcc": 0.4127, "accuracy": 0.6989, "per_window": [{"fold": "fold_1", "regime": "Pre-crisis upturn + GFC onset", "sharpe": 0.9836, "sortino": 1.1427, "return_pct": 7.08, "equity": 1070.79, "max_dd": 8.42, "win_rate": 47.06, "profit_factor": 1.262, "ic": 0.1002, "hit": 46.6, "n": 103, "precision": 0.4844, "recall": 0.5849, "f1": 0.5299, "f2": 0.5616, "mcc": -0.0774, "accuracy": 0.466, "tp": 31, "fp": 33, "tn": 17, "fn": 22, "aleatoric_mean": 2e-06, "epistemic_mean": 5e-06, "confidence_mean": 1.0, "aleatoric_std": 1e-06, "epistemic_std": 3e-06}, {"fold": "fold_2", "regime": "Post-crash recovery", "sharpe": -1.3305, "sortino": -2.2722, "return_pct": -6.42, "equity": 935.79, "max_dd": 7.69, "win_rate": 46.73, "profit_factor": 0.812, "ic": 0.0619, "hit": 46.73, "n": 107, "precision": 0.4667, "recall": 0.8235, "f1": 0.5957, "f2": 0.7143, "mcc": -0.0459, "accuracy": 0.4673, "tp": 42, "fp": 48, "tn": 8, "fn": 9, "aleatoric_mean": 3e-06, "epistemic_mean": 5e-06, "confidence_mean": 1.0, "aleatoric_std": 1e-06, "epistemic_std": 2e-06}, {"fold": "fold_3", "regime": "Eurozone debt plateau", "sharpe": 9.847, "sortino": 15.189, "return_pct": 34.39, "equity": 1343.88, "max_dd": 2.22, "win_rate": 77.88, "profit_factor": 4.827, "ic": 0.6947, "hit": 76.42, "n": 106, "precision": 0.7162, "recall": 0.9298, "f1": 0.8092, "f2": 0.8775, "mcc": 0.5444, "accuracy": 0.7642, "tp": 53, "fp": 21, "tn": 28, "fn": 4, "aleatoric_mean": 3e-06, "epistemic_mean": 5e-06, "confidence_mean": 1.0, "aleatoric_std": 1e-06, "epistemic_std": 2e-06}, {"fold": "fold_4", "regime": "Strong USD downturn", "sharpe": 11.2638, "sortino": 26.1407, "return_pct": 103.46, "equity": 2034.64, "max_dd": 1.17, "win_rate": 81.44, "profit_factor": 7.752, "ic": 0.7576, "hit": 80.95, "n": 168, "precision": 0.809, "recall": 0.8372, "f1": 0.8229, "f2": 0.8314, "mcc": 0.6308, "accuracy": 0.8155, "tp": 72, "fp": 17, "tn": 65, "fn": 14, "aleatoric_mean": 2e-06, "epistemic_mean": 3e-06, "confidence_mean": 1.0, "aleatoric_std": 1e-06, "epistemic_std": 1e-06}, {"fold": "fold_5", "regime": "Low-vol plateau", "sharpe": 10.0074, "sortino": 23.597, "return_pct": 32.49, "equity": 1324.88, "max_dd": 0.7, "win_rate": 71.6, "profit_factor": 5.758, "ic": 0.8196, "hit": 71.6, "n": 162, "precision": 0.6339, "recall": 0.9342, "f1": 0.7553, "f2": 0.8534, "mcc": 0.4942, "accuracy": 0.716, "tp": 71, "fp": 41, "tn": 45, "fn": 5, "aleatoric_mean": 1e-06, "epistemic_mean": 3e-06, "confidence_mean": 1.0, "aleatoric_std": 1e-06, "epistemic_std": 1e-06}, {"fold": "fold_6", "regime": "EUR crisis downturn", "sharpe": 12.4232, "sortino": 33.7501, "return_pct": 84.63, "equity": 1846.3, "max_dd": 0.89, "win_rate": 76.97, "profit_factor": 8.543, "ic": 0.7844, "hit": 76.97, "n": 165, "precision": 0.7294, "recall": 0.8052, "f1": 0.7654, "f2": 0.7888, "mcc": 0.5429, "accuracy": 0.7697, "tp": 62, "fp": 23, "tn": 65, "fn": 15, "aleatoric_mean": 2e-06, "epistemic_mean": 4e-06, "confidence_mean": 1.0, "aleatoric_std": 1e-06, "epistemic_std": 1e-06}, {"fold": "fold_7", "regime": "Recent mixed/upturn", "sharpe": 8.3702, "sortino": 12.0847, "return_pct": 55.07, "equity": 1550.74, "max_dd": 2.1, "win_rate": 74.69, "profit_factor": 4.339, "ic": 0.6772, "hit": 74.69, "n": 162, "precision": 0.7222, "recall": 0.8025, "f1": 0.7602, "f2": 0.785, "mcc": 0.4969, "accuracy": 0.7469, "tp": 65, "fp": 25, "tn": 56, "fn": 16, "aleatoric_mean": 2e-06, "epistemic_mean": 4e-06, "confidence_mean": 1.0, "aleatoric_std": 1e-06, "epistemic_std": 1e-06}], "val_sharpe": 6.9248, "val_psr": 1.0, "val_equity": 4473.99, "val_sortino": 10.0067, "val_return_pct": 347.4, "val_max_dd": 8.32, "val_win_rate": 68.81, "val_profit_factor": 3.312, "val_ic": 0.5813, "val_hit": 68.36, "val_aleatoric_mean": 2e-06, "val_epistemic_mean": 4e-06, "val_confidence_mean": 1.0, "val_precision": 0.6194, "val_recall": 0.874, "val_f1": 0.725, "val_f2": 0.8076, "val_mcc": 0.4119, "val_accuracy": 0.6849, "val_per_window": [{"fold": "fold_1", "regime": "Pre-crisis upturn + GFC onset", "sharpe": 2.1356, "sortino": 3.642, "return_pct": 5.41, "equity": 1054.12, "max_dd": 2.95, "win_rate": 52.78, "profit_factor": 1.426, "ic": -0.0069, "hit": 52.29, "n": 109, "precision": 0.5158, "recall": 0.8909, "f1": 0.6533, "f2": 0.7778, "mcc": 0.0584, "accuracy": 0.5229, "tp": 49, "fp": 46, "tn": 8, "fn": 6, "aleatoric_mean": 2e-06, "epistemic_mean": 4e-06, "confidence_mean": 1.0, "aleatoric_std": 1e-06, "epistemic_std": 2e-06}, {"fold": "fold_2", "regime": "Post-crash recovery", "sharpe": -0.803, "sortino": -1.2917, "return_pct": -4.08, "equity": 959.16, "max_dd": 8.32, "win_rate": 46.3, "profit_factor": 0.881, "ic": 0.0159, "hit": 46.3, "n": 108, "precision": 0.5373, "recall": 0.5714, "f1": 0.5538, "f2": 0.5643, "mcc": -0.1193, "accuracy": 0.463, "tp": 36, "fp": 31, "tn": 14, "fn": 27, "aleatoric_mean": 3e-06, "epistemic_mean": 5e-06, "confidence_mean": 1.0, "aleatoric_std": 1e-06, "epistemic_std": 2e-06}, {"fold": "fold_3", "regime": "Eurozone debt plateau", "sharpe": 10.8809, "sortino": 26.9614, "return_pct": 43.51, "equity": 1435.07, "max_dd": 1.13, "win_rate": 70.64, "profit_factor": 6.353, "ic": 0.84, "hit": 69.37, "n": 111, "precision": 0.5897, "recall": 0.9787, "f1": 0.736, "f2": 0.8647, "mcc": 0.5175, "accuracy": 0.7027, "tp": 46, "fp": 32, "tn": 32, "fn": 1, "aleatoric_mean": 2e-06, "epistemic_mean": 4e-06, "confidence_mean": 1.0, "aleatoric_std": 1e-06, "epistemic_std": 1e-06}, {"fold": "fold_4", "regime": "Strong USD downturn", "sharpe": 12.9037, "sortino": 34.6374, "return_pct": 41.43, "equity": 1414.34, "max_dd": 0.84, "win_rate": 79.82, "profit_factor": 10.626, "ic": 0.8785, "hit": 79.09, "n": 110, "precision": 0.6765, "recall": 0.9787, "f1": 0.8, "f2": 0.8984, "mcc": 0.641, "accuracy": 0.7909, "tp": 46, "fp": 22, "tn": 41, "fn": 1, "aleatoric_mean": 2e-06, "epistemic_mean": 3e-06, "confidence_mean": 1.0, "aleatoric_std": 1e-06, "epistemic_std": 1e-06}, {"fold": "fold_5", "regime": "Low-vol plateau", "sharpe": 13.1482, "sortino": 55.9665, "return_pct": 40.04, "equity": 1400.43, "max_dd": 0.52, "win_rate": 79.46, "profit_factor": 11.592, "ic": 0.8193, "hit": 79.46, "n": 112, "precision": 0.7273, "recall": 0.9057, "f1": 0.8067, "f2": 0.8633, "mcc": 0.6095, "accuracy": 0.7946, "tp": 48, "fp": 18, "tn": 41, "fn": 5, "aleatoric_mean": 1e-06, "epistemic_mean": 2e-06, "confidence_mean": 1.0, "aleatoric_std": 0.0, "epistemic_std": 1e-06}, {"fold": "fold_6", "regime": "EUR crisis downturn", "sharpe": 13.6299, "sortino": 53.7276, "return_pct": 26.65, "equity": 1266.48, "max_dd": 0.26, "win_rate": 79.44, "profit_factor": 14.372, "ic": 0.9129, "hit": 78.7, "n": 108, "precision": 0.6765, "recall": 0.9787, "f1": 0.8, "f2": 0.8984, "mcc": 0.6345, "accuracy": 0.787, "tp": 46, "fp": 22, "tn": 39, "fn": 1, "aleatoric_mean": 1e-06, "epistemic_mean": 3e-06, "confidence_mean": 1.0, "aleatoric_std": 0.0, "epistemic_std": 1e-06}, {"fold": "fold_7", "regime": "Recent mixed/upturn", "sharpe": 10.2755, "sortino": 24.0326, "return_pct": 22.92, "equity": 1229.21, "max_dd": 0.72, "win_rate": 72.73, "profit_factor": 5.517, "ic": 0.6836, "hit": 72.73, "n": 110, "precision": 0.6575, "recall": 0.9057, "f1": 0.7619, "f2": 0.8421, "mcc": 0.494, "accuracy": 0.7273, "tp": 48, "fp": 25, "tn": 32, "fn": 5, "aleatoric_mean": 2e-06, "epistemic_mean": 4e-06, "confidence_mean": 1.0, "aleatoric_std": 1e-06, "epistemic_std": 2e-06}], "train_sharpe": 7.1225, "train_psr": 1.0, "train_equity": 2701866.0, "train_sortino": 18.6545, "train_return_pct": 270086.6, "train_max_dd": 5.71, "train_win_rate": 74.59, "train_profit_factor": 5.893, "train_ic": 0.7236, "train_hit": 74.29, "train_precision": 0.6881, "train_recall": 0.9144, "train_f1": 0.7853, "train_f2": 0.858, "train_mcc": 0.5113, "train_accuracy": 0.7429, "train_per_window": [{"fold": "all_train", "regime": "Training data", "sharpe": 7.1225, "sortino": 18.6545, "return_pct": 270086.6, "equity": 2701866.0, "max_dd": 5.71, "win_rate": 74.59, "profit_factor": 5.893, "ic": 0.7236, "hit": 74.29, "n": 2478, "precision": 0.6881, "recall": 0.9144, "f1": 0.7853, "f2": 0.858, "mcc": 0.5113, "accuracy": 0.7429, "tp": 1165, "fp": 528, "tn": 676, "fn": 109}], "experiment_num": 135, "status": "DISCARD"}
{"backbone": "lstm", "description": "lstm: Exp31 bs=16 seed=0 variance check of Exp29 champion", "config": {"seq_len": 10, "lr": 0.001, "batch_size": 16, "epochs": 100, "weight_decay": 0.001, "patience": 15, "grad_clip": 1.0, "warmup_epochs": 0, "huber_delta": 1.0, "head_dropout": 0.25, "seed": 0, "het_loss": false}, "composite": 4.2405, "test_pos_folds": 5, "val_pos_folds": 6, "val_loss": 2.9e-05, "elapsed_sec": 47.5, "timestamp": "2026-04-19T19:43:02", "sharpe": 4.5405, "psr": 1.0, "equity": 6077.92, "sortino": 5.6537, "return_pct": 507.79, "max_dd": 13.75, "win_rate": 65.43, "profit_factor": 2.351, "ic": 0.5278, "hit": 65.16, "aleatoric_mean": 9e-06, "epistemic_mean": 1.8e-05, "confidence_mean": 1.0, "precision": 0.8017, "recall": 0.4033, "f1": 0.5367, "f2": 0.4478, "mcc": 0.3537, "accuracy": 0.6557, "per_window": [{"fold": "fold_1", "regime": "Pre-crisis upturn + GFC onset", "sharpe": -0.7538, "sortino": -0.8495, "return_pct": -6.33, "equity": 936.69, "max_dd": 10.55, "win_rate": 50.98, "profit_factor": 0.837, "ic": 0.1897, "hit": 50.49, "n": 103, "precision": 0.8, "recall": 0.0755, "f1": 0.1379, "f2": 0.0922, "mcc": 0.129, "accuracy": 0.5146, "tp": 4, "fp": 1, "tn": 49, "fn": 49, "aleatoric_mean": 1.3e-05, "epistemic_mean": 2.7e-05, "confidence_mean": 1.0, "aleatoric_std": 1e-05, "epistemic_std": 2e-05}, {"fold": "fold_2", "regime": "Post-crash recovery", "sharpe": -0.9511, "sortino": -1.5855, "return_pct": -4.71, "equity": 952.85, "max_dd": 8.18, "win_rate": 46.73, "profit_factor": 0.862, "ic": 0.0314, "hit": 46.73, "n": 107, "precision": 0.4464, "recall": 0.4902, "f1": 0.4673, "f2": 0.4808, "mcc": -0.0634, "accuracy": 0.4673, "tp": 25, "fp": 31, "tn": 25, "fn": 26, "aleatoric_mean": 1.1e-05, "epistemic_mean": 2.2e-05, "confidence_mean": 1.0, "aleatoric_std": 6e-06, "epistemic_std": 1.2e-05}, {"fold": "fold_3", "regime": "Eurozone debt plateau", "sharpe": 9.7962, "sortino": 18.1489, "return_pct": 34.24, "equity": 1342.39, "max_dd": 1.32, "win_rate": 73.08, "profit_factor": 4.785, "ic": 0.6453, "hit": 71.7, "n": 106, "precision": 0.9143, "recall": 0.5614, "f1": 0.6957, "f2": 0.6084, "mcc": 0.5303, "accuracy": 0.7358, "tp": 32, "fp": 3, "tn": 46, "fn": 25, "aleatoric_mean": 1.1e-05, "epistemic_mean": 2.2e-05, "confidence_mean": 1.0, "aleatoric_std": 6e-06, "epistemic_std": 1.1e-05}, {"fold": "fold_4", "regime": "Strong USD downturn", "sharpe": 7.7174, "sortino": 14.7278, "return_pct": 70.84, "equity": 1708.43, "max_dd": 2.97, "win_rate": 71.26, "profit_factor": 3.795, "ic": 0.6973, "hit": 70.83, "n": 168, "precision": 0.9318, "recall": 0.4767, "f1": 0.6308, "f2": 0.5284, "mcc": 0.5004, "accuracy": 0.7143, "tp": 41, "fp": 3, "tn": 79, "fn": 45, "aleatoric_mean": 7e-06, "epistemic_mean": 1.5e-05, "confidence_mean": 1.0, "aleatoric_std": 3e-06, "epistemic_std": 6e-06}, {"fold": "fold_5", "regime": "Low-vol plateau", "sharpe": 8.253, "sortino": 16.4154, "return_pct": 27.53, "equity": 1275.35, "max_dd": 0.92, "win_rate": 69.75, "profit_factor": 4.115, "ic": 0.7574, "hit": 69.75, "n": 162, "precision": 0.9355, "recall": 0.3816, "f1": 0.5421, "f2": 0.4328, "mcc": 0.4546, "accuracy": 0.6975, "tp": 29, "fp": 2, "tn": 84, "fn": 47, "aleatoric_mean": 6e-06, "epistemic_mean": 1.2e-05, "confidence_mean": 1.0, "aleatoric_std": 2e-06, "epistemic_std": 4e-06}, {"fold": "fold_6", "regime": "EUR crisis downturn", "sharpe": 9.3648, "sortino": 22.2176, "return_pct": 65.7, "equity": 1657.0, "max_dd": 1.25, "win_rate": 68.48, "profit_factor": 4.741, "ic": 0.7886, "hit": 68.48, "n": 165, "precision": 0.9032, "recall": 0.3636, "f1": 0.5185, "f2": 0.413, "mcc": 0.4209, "accuracy": 0.6848, "tp": 28, "fp": 3, "tn": 85, "fn": 49, "aleatoric_mean": 9e-06, "epistemic_mean": 1.8e-05, "confidence_mean": 1.0, "aleatoric_std": 4e-06, "epistemic_std": 8e-06}, {"fold": "fold_7", "regime": "Recent mixed/upturn", "sharpe": 6.1691, "sortino": 10.4166, "return_pct": 40.51, "equity": 1405.11, "max_dd": 2.24, "win_rate": 68.52, "profit_factor": 2.889, "ic": 0.723, "hit": 68.52, "n": 162, "precision": 0.875, "recall": 0.4321, "f1": 0.5785, "f2": 0.4808, "mcc": 0.4294, "accuracy": 0.6852, "tp": 35, "fp": 5, "tn": 76, "fn": 46, "aleatoric_mean": 8e-06, "epistemic_mean": 1.5e-05, "confidence_mean": 1.0, "aleatoric_std": 2e-06, "epistemic_std": 4e-06}], "val_sharpe": 4.8426, "val_psr": 1.0, "val_equity": 2976.86, "val_sortino": 7.4932, "val_return_pct": 197.69, "val_max_dd": 12.92, "val_win_rate": 64.35, "val_profit_factor": 2.285, "val_ic": 0.5355, "val_hit": 63.93, "val_aleatoric_mean": 7e-06, "val_epistemic_mean": 1.5e-05, "val_confidence_mean": 1.0, "val_precision": 0.8079, "val_recall": 0.3342, "val_f1": 0.4729, "val_f2": 0.3786, "val_mcc": 0.3296, "val_accuracy": 0.6458, "val_per_window": [{"fold": "fold_1", "regime": "Pre-crisis upturn + GFC onset", "sharpe": 0.2815, "sortino": 0.491, "return_pct": 0.64, "equity": 1006.39, "max_dd": 4.21, "win_rate": 47.22, "profit_factor": 1.048, "ic": 0.032, "hit": 46.79, "n": 109, "precision": 0.4583, "recall": 0.2, "f1": 0.2785, "f2": 0.2254, "mcc": -0.0492, "accuracy": 0.4771, "tp": 11, "fp": 13, "tn": 41, "fn": 44, "aleatoric_mean": 7e-06, "epistemic_mean": 1.5e-05, "confidence_mean": 1.0, "aleatoric_std": 3e-06, "epistemic_std": 6e-06}, {"fold": "fold_2", "regime": "Post-crash recovery", "sharpe": -1.3428, "sortino": -2.1351, "return_pct": -6.55, "equity": 934.51, "max_dd": 11.93, "win_rate": 48.15, "profit_factor": 0.809, "ic": 0.0079, "hit": 48.15, "n": 108, "precision": 0.7333, "recall": 0.1746, "f1": 0.2821, "f2": 0.206, "mcc": 0.1222, "accuracy": 0.4815, "tp": 11, "fp": 4, "tn": 41, "fn": 52, "aleatoric_mean": 1e-05, "epistemic_mean": 2e-05, "confidence_mean": 1.0, "aleatoric_std": 5e-06, "epistemic_std": 1e-05}, {"fold": "fold_3", "regime": "Eurozone debt plateau", "sharpe": 10.6463, "sortino": 23.8496, "return_pct": 42.74, "equity": 1427.36, "max_dd": 0.94, "win_rate": 77.06, "profit_factor": 6.072, "ic": 0.734, "hit": 75.68, "n": 111, "precision": 0.7895, "recall": 0.6383, "f1": 0.7059, "f2": 0.6637, "mcc": 0.5345, "accuracy": 0.7748, "tp": 30, "fp": 8, "tn": 56, "fn": 17, "aleatoric_mean": 7e-06, "epistemic_mean": 1.4e-05, "confidence_mean": 1.0, "aleatoric_std": 2e-06, "epistemic_std": 5e-06}, {"fold": "fold_4", "regime": "Strong USD downturn", "sharpe": 9.355, "sortino": 21.9765, "return_pct": 32.15, "equity": 1321.5, "max_dd": 1.28, "win_rate": 73.39, "profit_factor": 4.996, "ic": 0.8063, "hit": 72.73, "n": 110, "precision": 0.95, "recall": 0.4043, "f1": 0.5672, "f2": 0.4567, "mcc": 0.4981, "accuracy": 0.7364, "tp": 19, "fp": 1, "tn": 62, "fn": 28, "aleatoric_mean": 7e-06, "epistemic_mean": 1.5e-05, "confidence_mean": 1.0, "aleatoric_std": 3e-06, "epistemic_std": 6e-06}, {"fold": "fold_5", "regime": "Low-vol plateau", "sharpe": 6.8425, "sortino": 16.0888, "return_pct": 23.18, "equity": 1231.85, "max_dd": 1.28, "win_rate": 66.07, "profit_factor": 3.184, "ic": 0.825, "hit": 66.07, "n": 112, "precision": 0.9412, "recall": 0.3019, "f1": 0.4571, "f2": 0.3493, "mcc": 0.3965, "accuracy": 0.6607, "tp": 16, "fp": 1, "tn": 58, "fn": 37, "aleatoric_mean": 6e-06, "epistemic_mean": 1.2e-05, "confidence_mean": 1.0, "aleatoric_std": 2e-06, "epistemic_std": 4e-06}, {"fold": "fold_6", "regime": "EUR crisis downturn", "sharpe": 9.0886, "sortino": 18.7131, "return_pct": 19.73, "equity": 1197.27, "max_dd": 0.75, "win_rate": 72.9, "profit_factor": 4.943, "ic": 0.8603, "hit": 72.22, "n": 108, "precision": 1.0, "recall": 0.383, "f1": 0.5538, "f2": 0.4369, "mcc": 0.5095, "accuracy": 0.7315, "tp": 18, "fp": 0, "tn": 61, "fn": 29, "aleatoric_mean": 6e-06, "epistemic_mean": 1.2e-05, "confidence_mean": 1.0, "aleatoric_std": 2e-06, "epistemic_std": 5e-06}, {"fold": "fold_7", "regime": "Recent mixed/upturn", "sharpe": 5.7491, "sortino": 11.6723, "return_pct": 13.78, "equity": 1137.78, "max_dd": 1.4, "win_rate": 65.45, "profit_factor": 2.536, "ic": 0.7043, "hit": 65.45, "n": 110, "precision": 0.8947, "recall": 0.3208, "f1": 0.4722, "f2": 0.368, "mcc": 0.3776, "accuracy": 0.6545, "tp": 17, "fp": 2, "tn": 55, "fn": 36, "aleatoric_mean": 8e-06, "epistemic_mean": 1.7e-05, "confidence_mean": 1.0, "aleatoric_std": 3e-06, "epistemic_std": 6e-06}], "train_sharpe": 4.5518, "train_psr": 1.0, "train_equity": 199609.7, "train_sortino": 11.687, "train_return_pct": 19860.97, "train_max_dd": 5.77, "train_win_rate": 63.05, "train_profit_factor": 2.831, "train_ic": 0.6536, "train_hit": 62.79, "train_precision": 0.8689, "train_recall": 0.3328, "train_f1": 0.4813, "train_f2": 0.3797, "train_mcc": 0.3515, "train_accuracy": 0.6312, "train_per_window": [{"fold": "all_train", "regime": "Training data", "sharpe": 4.5518, "sortino": 11.687, "return_pct": 19860.97, "equity": 199609.7, "max_dd": 5.77, "win_rate": 63.05, "profit_factor": 2.831, "ic": 0.6536, "hit": 62.79, "n": 2478, "precision": 0.8689, "recall": 0.3328, "f1": 0.4813, "f2": 0.3797, "mcc": 0.3515, "accuracy": 0.6312, "tp": 424, "fp": 64, "tn": 1140, "fn": 850}], "experiment_num": 136, "status": "DISCARD"}
