{"backbone": "mlp", "description": "mlp: lr=5e-5 seed=42", "config": {"seq_len": 10, "lr": 5e-05, "batch_size": 32, "epochs": 20, "weight_decay": 1e-05, "patience": 5, "grad_clip": 1.0, "warmup_epochs": 0, "huber_delta": 1.0, "head_dropout": 0.1, "seed": 42, "het_loss": false}, "composite": -0.4664, "test_pos_folds": 5, "val_pos_folds": 4, "val_loss": 0.000312, "elapsed_sec": 7.3, "timestamp": "2026-04-12T17:25:18", "sharpe": 0.0336, "psr": 0.5263, "equity": 991.33, "sortino": 0.0434, "return_pct": -0.87, "max_dd": 13.52, "win_rate": 52.22, "profit_factor": 1.006, "ic": 0.0211, "hit": 52.0, "aleatoric_mean": 0.000824, "epistemic_mean": 0.001648, "confidence_mean": 0.9975, "per_window": [{"fold": "fold_1", "regime": "Pre-crisis upturn + GFC onset", "sharpe": 0.6442, "sortino": 0.746, "return_pct": 4.32, "equity": 1043.23, "max_dd": 7.76, "win_rate": 49.02, "profit_factor": 1.164, "ic": 0.0716, "hit": 48.54, "n": 103, "aleatoric_mean": 0.00111, "epistemic_mean": 0.002219, "confidence_mean": 0.9967, "aleatoric_std": 0.000432, "epistemic_std": 0.000864}, {"fold": "fold_2", "regime": "Post-crash recovery", "sharpe": -1.6089, "sortino": -2.7823, "return_pct": -7.65, "equity": 923.53, "max_dd": 10.27, "win_rate": 48.6, "profit_factor": 0.777, "ic": -0.0577, "hit": 48.6, "n": 107, "aleatoric_mean": 0.000805, "epistemic_mean": 0.00161, "confidence_mean": 0.9976, "aleatoric_std": 0.000325, "epistemic_std": 0.00065}, {"fold": "fold_3", "regime": "Eurozone debt plateau", "sharpe": 0.5861, "sortino": 1.1482, "return_pct": 1.95, "equity": 1019.48, "max_dd": 4.64, "win_rate": 54.81, "profit_factor": 1.096, "ic": 0.0435, "hit": 53.77, "n": 106, "aleatoric_mean": 0.000868, "epistemic_mean": 0.001737, "confidence_mean": 0.9974, "aleatoric_std": 0.000317, "epistemic_std": 0.000634}, {"fold": "fold_4", "regime": "Strong USD downturn", "sharpe": -0.4423, "sortino": -0.5683, "return_pct": -3.82, "equity": 961.78, "max_dd": 8.84, "win_rate": 53.29, "profit_factor": 0.928, "ic": 0.0035, "hit": 52.98, "n": 168, "aleatoric_mean": 0.000884, "epistemic_mean": 0.001769, "confidence_mean": 0.9974, "aleatoric_std": 0.000304, "epistemic_std": 0.000608}, {"fold": "fold_5", "regime": "Low-vol plateau", "sharpe": 0.7035, "sortino": 1.0627, "return_pct": 2.28, "equity": 1022.82, "max_dd": 3.93, "win_rate": 50.62, "profit_factor": 1.124, "ic": 0.14, "hit": 50.62, "n": 162, "aleatoric_mean": 0.000644, "epistemic_mean": 0.001288, "confidence_mean": 0.9981, "aleatoric_std": 0.000248, "epistemic_std": 0.000497}, {"fold": "fold_6", "regime": "EUR crisis downturn", "sharpe": 0.1198, "sortino": 0.1922, "return_pct": 0.45, "equity": 1004.52, "max_dd": 9.07, "win_rate": 51.52, "profit_factor": 1.02, "ic": 0.0711, "hit": 51.52, "n": 165, "aleatoric_mean": 0.000908, "epistemic_mean": 0.001816, "confidence_mean": 0.9973, "aleatoric_std": 0.000355, "epistemic_std": 0.000709}, {"fold": "fold_7", "regime": "Recent mixed/upturn", "sharpe": 0.4009, "sortino": 0.5427, "return_pct": 2.13, "equity": 1021.35, "max_dd": 7.03, "win_rate": 56.17, "profit_factor": 1.07, "ic": 0.0405, "hit": 56.17, "n": 162, "aleatoric_mean": 0.000657, "epistemic_mean": 0.001314, "confidence_mean": 0.998, "aleatoric_std": 0.000248, "epistemic_std": 0.000496}], "val_sharpe": 0.235, "val_psr": 0.6593, "val_equity": 1047.65, "val_sortino": 0.3731, "val_return_pct": 4.77, "val_max_dd": 8.92, "val_win_rate": 50.59, "val_profit_factor": 1.04, "val_ic": 0.0363, "val_hit": 50.26, "val_aleatoric_mean": 0.000646, "val_epistemic_mean": 0.001292, "val_confidence_mean": 0.9981, "val_per_window": [{"fold": "fold_1", "regime": "Pre-crisis upturn + GFC onset", "sharpe": -0.5761, "sortino": -0.811, "return_pct": -1.52, "equity": 984.84, "max_dd": 4.87, "win_rate": 49.07, "profit_factor": 0.909, "ic": 0.0212, "hit": 48.62, "n": 109, "aleatoric_mean": 0.00059, "epistemic_mean": 0.001179, "confidence_mean": 0.9982, "aleatoric_std": 0.000252, "epistemic_std": 0.000504}, {"fold": "fold_2", "regime": "Post-crash recovery", "sharpe": -0.28, "sortino": -0.4897, "return_pct": -1.62, "equity": 983.79, "max_dd": 7.36, "win_rate": 48.15, "profit_factor": 0.957, "ic": -0.0025, "hit": 48.15, "n": 108, "aleatoric_mean": 0.000769, "epistemic_mean": 0.001538, "confidence_mean": 0.9977, "aleatoric_std": 0.000287, "epistemic_std": 0.000573}, {"fold": "fold_3", "regime": "Eurozone debt plateau", "sharpe": 0.8974, "sortino": 1.7469, "return_pct": 3.5, "equity": 1034.99, "max_dd": 5.1, "win_rate": 51.38, "profit_factor": 1.157, "ic": 0.1641, "hit": 50.45, "n": 111, "aleatoric_mean": 0.000744, "epistemic_mean": 0.001489, "confidence_mean": 0.9978, "aleatoric_std": 0.0003, "epistemic_std": 0.000601}, {"fold": "fold_4", "regime": "Strong USD downturn", "sharpe": 1.2905, "sortino": 1.8806, "return_pct": 4.43, "equity": 1044.28, "max_dd": 4.72, "win_rate": 59.63, "profit_factor": 1.238, "ic": 0.1679, "hit": 59.09, "n": 110, "aleatoric_mean": 0.000693, "epistemic_mean": 0.001386, "confidence_mean": 0.9979, "aleatoric_std": 0.000297, "epistemic_std": 0.000595}, {"fold": "fold_5", "regime": "Low-vol plateau", "sharpe": 1.2016, "sortino": 2.2544, "return_pct": 3.95, "equity": 1039.51, "max_dd": 5.97, "win_rate": 49.11, "profit_factor": 1.221, "ic": 0.027, "hit": 49.11, "n": 112, "aleatoric_mean": 0.000648, "epistemic_mean": 0.001296, "confidence_mean": 0.9981, "aleatoric_std": 0.000246, "epistemic_std": 0.000491}, {"fold": "fold_6", "regime": "EUR crisis downturn", "sharpe": -2.7079, "sortino": -4.0754, "return_pct": -5.99, "equity": 940.12, "max_dd": 7.61, "win_rate": 42.99, "profit_factor": 0.633, "ic": -0.1067, "hit": 42.59, "n": 108, "aleatoric_mean": 0.000496, "epistemic_mean": 0.000993, "confidence_mean": 0.9985, "aleatoric_std": 0.000183, "epistemic_std": 0.000366}, {"fold": "fold_7", "regime": "Recent mixed/upturn", "sharpe": 1.0069, "sortino": 1.5646, "return_pct": 2.37, "equity": 1023.74, "max_dd": 3.37, "win_rate": 53.64, "profit_factor": 1.176, "ic": 0.0201, "hit": 53.64, "n": 110, "aleatoric_mean": 0.000578, "epistemic_mean": 0.001156, "confidence_mean": 0.9983, "aleatoric_std": 0.00019, "epistemic_std": 0.00038}], "train_sharpe": 2.9734, "train_psr": 1.0, "train_equity": 33554.9, "train_sortino": 6.8412, "train_return_pct": 3255.49, "train_max_dd": 6.78, "train_win_rate": 58.06, "train_profit_factor": 1.938, "train_ic": 0.2201, "train_hit": 57.83, "train_per_window": [{"fold": "all_train", "regime": "Training data", "sharpe": 2.9734, "sortino": 6.8412, "return_pct": 3255.49, "equity": 33554.9, "max_dd": 6.78, "win_rate": 58.06, "profit_factor": 1.938, "ic": 0.2201, "hit": 57.83, "n": 2478}], "experiment_num": 56, "status": "DISCARD"}
{"backbone": "mlp", "description": "mlp: lr=5e-5 seed=99", "config": {"seq_len": 10, "lr": 5e-05, "batch_size": 32, "epochs": 20, "weight_decay": 1e-05, "patience": 5, "grad_clip": 1.0, "warmup_epochs": 0, "huber_delta": 1.0, "head_dropout": 0.1, "seed": 99, "het_loss": false}, "composite": -0.7432, "test_pos_folds": 4, "val_pos_folds": 3, "val_loss": 0.000288, "elapsed_sec": 7.1, "timestamp": "2026-04-12T17:25:28", "sharpe": 0.1149, "psr": 0.5891, "equity": 1025.66, "sortino": 0.155, "return_pct": 2.57, "max_dd": 19.36, "win_rate": 49.85, "profit_factor": 1.021, "ic": 0.0154, "hit": 49.64, "aleatoric_mean": 0.000831, "epistemic_mean": 0.001661, "confidence_mean": 0.9975, "per_window": [{"fold": "fold_1", "regime": "Pre-crisis upturn + GFC onset", "sharpe": -1.3753, "sortino": -1.6653, "return_pct": -10.69, "equity": 893.13, "max_dd": 13.42, "win_rate": 40.2, "profit_factor": 0.722, "ic": -0.1348, "hit": 39.81, "n": 103, "aleatoric_mean": 0.000997, "epistemic_mean": 0.001995, "confidence_mean": 0.997, "aleatoric_std": 0.00041, "epistemic_std": 0.000819}, {"fold": "fold_2", "regime": "Post-crash recovery", "sharpe": 0.0522, "sortino": 0.0963, "return_pct": -0.02, "equity": 999.79, "max_dd": 6.92, "win_rate": 47.66, "profit_factor": 1.008, "ic": -0.0253, "hit": 47.66, "n": 107, "aleatoric_mean": 0.000888, "epistemic_mean": 0.001777, "confidence_mean": 0.9973, "aleatoric_std": 0.000353, "epistemic_std": 0.000707}, {"fold": "fold_3", "regime": "Eurozone debt plateau", "sharpe": -0.0678, "sortino": -0.1215, "return_pct": -0.39, "equity": 996.1, "max_dd": 5.54, "win_rate": 50.0, "profit_factor": 0.989, "ic": -0.0754, "hit": 49.06, "n": 106, "aleatoric_mean": 0.000946, "epistemic_mean": 0.001891, "confidence_mean": 0.9972, "aleatoric_std": 0.000358, "epistemic_std": 0.000716}, {"fold": "fold_4", "regime": "Strong USD downturn", "sharpe": 1.8896, "sortino": 3.0099, "return_pct": 15.2, "equity": 1151.97, "max_dd": 5.81, "win_rate": 55.09, "profit_factor": 1.374, "ic": 0.1819, "hit": 54.76, "n": 168, "aleatoric_mean": 0.000896, "epistemic_mean": 0.001791, "confidence_mean": 0.9973, "aleatoric_std": 0.000371, "epistemic_std": 0.000741}, {"fold": "fold_5", "regime": "Low-vol plateau", "sharpe": 0.2299, "sortino": 0.353, "return_pct": 0.68, "equity": 1006.82, "max_dd": 4.41, "win_rate": 50.0, "profit_factor": 1.039, "ic": -0.0518, "hit": 50.0, "n": 162, "aleatoric_mean": 0.000622, "epistemic_mean": 0.001245, "confidence_mean": 0.9981, "aleatoric_std": 0.000229, "epistemic_std": 0.000458}, {"fold": "fold_6", "regime": "EUR crisis downturn", "sharpe": 0.101, "sortino": 0.1519, "return_pct": 0.33, "equity": 1003.34, "max_dd": 6.08, "win_rate": 52.12, "profit_factor": 1.016, "ic": 0.0428, "hit": 52.12, "n": 165, "aleatoric_mean": 0.000955, "epistemic_mean": 0.001911, "confidence_mean": 0.9971, "aleatoric_std": 0.000428, "epistemic_std": 0.000855}, {"fold": "fold_7", "regime": "Recent mixed/upturn", "sharpe": -0.1067, "sortino": -0.1477, "return_pct": -0.91, "equity": 990.91, "max_dd": 8.27, "win_rate": 49.38, "profit_factor": 0.982, "ic": 0.0451, "hit": 49.38, "n": 162, "aleatoric_mean": 0.000625, "epistemic_mean": 0.001251, "confidence_mean": 0.9981, "aleatoric_std": 0.000224, "epistemic_std": 0.000448}], "val_sharpe": -0.0432, "val_psr": 0.4699, "val_equity": 980.67, "val_sortino": -0.067, "val_return_pct": -1.93, "val_max_dd": 16.9, "val_win_rate": 48.62, "val_profit_factor": 0.993, "val_ic": -0.0134, "val_hit": 48.31, "val_aleatoric_mean": 0.000651, "val_epistemic_mean": 0.001302, "val_confidence_mean": 0.9981, "val_per_window": [{"fold": "fold_1", "regime": "Pre-crisis upturn + GFC onset", "sharpe": -0.0468, "sortino": -0.0659, "return_pct": -0.19, "equity": 998.08, "max_dd": 4.52, "win_rate": 52.78, "profit_factor": 0.992, "ic": 0.0279, "hit": 52.29, "n": 109, "aleatoric_mean": 0.000564, "epistemic_mean": 0.001128, "confidence_mean": 0.9983, "aleatoric_std": 0.000232, "epistemic_std": 0.000465}, {"fold": "fold_2", "regime": "Post-crash recovery", "sharpe": 0.4145, "sortino": 0.7603, "return_pct": 1.75, "equity": 1017.52, "max_dd": 9.27, "win_rate": 50.0, "profit_factor": 1.068, "ic": -0.0525, "hit": 50.0, "n": 108, "aleatoric_mean": 0.000956, "epistemic_mean": 0.001912, "confidence_mean": 0.9971, "aleatoric_std": 0.000372, "epistemic_std": 0.000744}, {"fold": "fold_3", "regime": "Eurozone debt plateau", "sharpe": -1.1998, "sortino": -1.7086, "return_pct": -4.9, "equity": 950.98, "max_dd": 10.88, "win_rate": 46.79, "profit_factor": 0.823, "ic": -0.0406, "hit": 45.95, "n": 111, "aleatoric_mean": 0.000739, "epistemic_mean": 0.001477, "confidence_mean": 0.9978, "aleatoric_std": 0.000319, "epistemic_std": 0.000638}, {"fold": "fold_4", "regime": "Strong USD downturn", "sharpe": 2.148, "sortino": 3.7388, "return_pct": 7.53, "equity": 1075.31, "max_dd": 3.38, "win_rate": 53.21, "profit_factor": 1.427, "ic": 0.0039, "hit": 52.73, "n": 110, "aleatoric_mean": 0.000593, "epistemic_mean": 0.001187, "confidence_mean": 0.9982, "aleatoric_std": 0.000199, "epistemic_std": 0.000398}, {"fold": "fold_5", "regime": "Low-vol plateau", "sharpe": -0.5941, "sortino": -1.1022, "return_pct": -2.08, "equity": 979.15, "max_dd": 4.39, "win_rate": 45.54, "profit_factor": 0.906, "ic": -0.006, "hit": 45.54, "n": 112, "aleatoric_mean": 0.000648, "epistemic_mean": 0.001297, "confidence_mean": 0.9981, "aleatoric_std": 0.000286, "epistemic_std": 0.000573}, {"fold": "fold_6", "regime": "EUR crisis downturn", "sharpe": -2.9956, "sortino": -4.4272, "return_pct": -6.58, "equity": 934.23, "max_dd": 6.48, "win_rate": 42.06, "profit_factor": 0.603, "ic": -0.1075, "hit": 41.67, "n": 108, "aleatoric_mean": 0.000527, "epistemic_mean": 0.001054, "confidence_mean": 0.9984, "aleatoric_std": 0.00017, "epistemic_std": 0.000341}, {"fold": "fold_7", "regime": "Recent mixed/upturn", "sharpe": 1.3567, "sortino": 2.0563, "return_pct": 3.23, "equity": 1032.29, "max_dd": 3.27, "win_rate": 50.0, "profit_factor": 1.244, "ic": 0.0906, "hit": 50.0, "n": 110, "aleatoric_mean": 0.000531, "epistemic_mean": 0.001061, "confidence_mean": 0.9984, "aleatoric_std": 0.000197, "epistemic_std": 0.000395}], "train_sharpe": 2.225, "train_psr": 1.0, "train_equity": 13881.36, "train_sortino": 4.622, "train_return_pct": 1288.14, "train_max_dd": 12.62, "train_win_rate": 56.44, "train_profit_factor": 1.634, "train_ic": 0.2048, "train_hit": 56.21, "train_per_window": [{"fold": "all_train", "regime": "Training data", "sharpe": 2.225, "sortino": 4.622, "return_pct": 1288.14, "equity": 13881.36, "max_dd": 12.62, "win_rate": 56.44, "profit_factor": 1.634, "ic": 0.2048, "hit": 56.21, "n": 2478}], "experiment_num": 57, "status": "DISCARD"}
{"backbone": "mlp", "description": "mlp: Exp2 lr=1e-4 reduce overfit (gap=2.37 at 3e-4)", "config": {"seq_len": 10, "lr": 0.0001, "batch_size": 32, "epochs": 20, "weight_decay": 1e-05, "patience": 5, "grad_clip": 1.0, "warmup_epochs": 0, "huber_delta": 1.0, "head_dropout": 0.1, "seed": 42, "het_loss": false}, "composite": -0.4997, "test_pos_folds": 4, "val_pos_folds": 4, "val_loss": 0.000143, "elapsed_sec": 6.9, "timestamp": "2026-04-12T17:27:21", "sharpe": 0.1003, "psr": 0.5779, "equity": 1019.41, "sortino": 0.1308, "return_pct": 1.94, "max_dd": 17.04, "win_rate": 52.01, "profit_factor": 1.019, "ic": 0.0369, "hit": 51.8, "aleatoric_mean": 0.000494, "epistemic_mean": 0.000988, "confidence_mean": 0.9985, "per_window": [{"fold": "fold_1", "regime": "Pre-crisis upturn + GFC onset", "sharpe": 1.2618, "sortino": 1.374, "return_pct": 9.38, "equity": 1093.85, "max_dd": 9.34, "win_rate": 54.9, "profit_factor": 1.349, "ic": 0.1219, "hit": 54.37, "n": 103, "aleatoric_mean": 0.000625, "epistemic_mean": 0.00125, "confidence_mean": 0.9981, "aleatoric_std": 0.000247, "epistemic_std": 0.000494}, {"fold": "fold_2", "regime": "Post-crash recovery", "sharpe": -2.146, "sortino": -3.7755, "return_pct": -9.95, "equity": 900.5, "max_dd": 12.55, "win_rate": 45.79, "profit_factor": 0.714, "ic": -0.0462, "hit": 45.79, "n": 107, "aleatoric_mean": 0.000485, "epistemic_mean": 0.000969, "confidence_mean": 0.9985, "aleatoric_std": 0.00019, "epistemic_std": 0.00038}, {"fold": "fold_3", "regime": "Eurozone debt plateau", "sharpe": -0.3129, "sortino": -0.5811, "return_pct": -1.25, "equity": 987.48, "max_dd": 4.91, "win_rate": 52.88, "profit_factor": 0.952, "ic": 0.0547, "hit": 51.89, "n": 106, "aleatoric_mean": 0.000515, "epistemic_mean": 0.00103, "confidence_mean": 0.9985, "aleatoric_std": 0.000187, "epistemic_std": 0.000374}, {"fold": "fold_4", "regime": "Strong USD downturn", "sharpe": 0.0436, "sortino": 0.0573, "return_pct": -0.12, "equity": 998.84, "max_dd": 8.53, "win_rate": 53.89, "profit_factor": 1.007, "ic": 0.0377, "hit": 53.57, "n": 168, "aleatoric_mean": 0.000524, "epistemic_mean": 0.001047, "confidence_mean": 0.9984, "aleatoric_std": 0.000178, "epistemic_std": 0.000356}, {"fold": "fold_5", "regime": "Low-vol plateau", "sharpe": 1.7368, "sortino": 2.6127, "return_pct": 5.83, "equity": 1058.32, "max_dd": 4.24, "win_rate": 53.09, "profit_factor": 1.335, "ic": 0.1526, "hit": 53.09, "n": 162, "aleatoric_mean": 0.000394, "epistemic_mean": 0.000788, "confidence_mean": 0.9988, "aleatoric_std": 0.000133, "epistemic_std": 0.000265}, {"fold": "fold_6", "regime": "EUR crisis downturn", "sharpe": -1.3292, "sortino": -2.2592, "return_pct": -8.28, "equity": 917.18, "max_dd": 14.77, "win_rate": 45.45, "profit_factor": 0.807, "ic": 0.0398, "hit": 45.45, "n": 165, "aleatoric_mean": 0.000559, "epistemic_mean": 0.001117, "confidence_mean": 0.9983, "aleatoric_std": 0.000231, "epistemic_std": 0.000463}, {"fold": "fold_7", "regime": "Recent mixed/upturn", "sharpe": 1.3572, "sortino": 1.8275, "return_pct": 8.1, "equity": 1080.98, "max_dd": 6.76, "win_rate": 57.41, "profit_factor": 1.258, "ic": 0.1368, "hit": 57.41, "n": 162, "aleatoric_mean": 0.000408, "epistemic_mean": 0.000816, "confidence_mean": 0.9988, "aleatoric_std": 0.000146, "epistemic_std": 0.000292}], "val_sharpe": 0.6305, "val_psr": 0.8657, "val_equity": 1150.71, "val_sortino": 1.0333, "val_return_pct": 15.07, "val_max_dd": 6.95, "val_win_rate": 48.75, "val_profit_factor": 1.112, "val_ic": 0.0173, "val_hit": 48.44, "val_aleatoric_mean": 0.000414, "val_epistemic_mean": 0.000828, "val_confidence_mean": 0.9988, "val_per_window": [{"fold": "fold_1", "regime": "Pre-crisis upturn + GFC onset", "sharpe": -1.4048, "sortino": -2.1566, "return_pct": -3.54, "equity": 964.57, "max_dd": 4.67, "win_rate": 44.44, "profit_factor": 0.792, "ic": -0.0949, "hit": 44.04, "n": 109, "aleatoric_mean": 0.000407, "epistemic_mean": 0.000814, "confidence_mean": 0.9988, "aleatoric_std": 0.000169, "epistemic_std": 0.000337}, {"fold": "fold_2", "regime": "Post-crash recovery", "sharpe": -0.0395, "sortino": -0.0698, "return_pct": -0.47, "equity": 995.34, "max_dd": 4.72, "win_rate": 47.22, "profit_factor": 0.994, "ic": -0.0257, "hit": 47.22, "n": 108, "aleatoric_mean": 0.000434, "epistemic_mean": 0.000867, "confidence_mean": 0.9987, "aleatoric_std": 0.000152, "epistemic_std": 0.000303}, {"fold": "fold_3", "regime": "Eurozone debt plateau", "sharpe": 2.2757, "sortino": 4.6305, "return_pct": 9.34, "equity": 1093.38, "max_dd": 2.67, "win_rate": 52.29, "profit_factor": 1.447, "ic": 0.1521, "hit": 51.35, "n": 111, "aleatoric_mean": 0.000452, "epistemic_mean": 0.000904, "confidence_mean": 0.9986, "aleatoric_std": 0.000163, "epistemic_std": 0.000326}, {"fold": "fold_4", "regime": "Strong USD downturn", "sharpe": 0.7458, "sortino": 1.0965, "return_pct": 2.48, "equity": 1024.81, "max_dd": 5.15, "win_rate": 54.13, "profit_factor": 1.131, "ic": 0.1112, "hit": 53.64, "n": 110, "aleatoric_mean": 0.000441, "epistemic_mean": 0.000883, "confidence_mean": 0.9987, "aleatoric_std": 0.000164, "epistemic_std": 0.000328}, {"fold": "fold_5", "regime": "Low-vol plateau", "sharpe": 2.0908, "sortino": 4.3625, "return_pct": 7.03, "equity": 1070.31, "max_dd": 3.97, "win_rate": 49.11, "profit_factor": 1.416, "ic": -0.0152, "hit": 49.11, "n": 112, "aleatoric_mean": 0.000412, "epistemic_mean": 0.000824, "confidence_mean": 0.9988, "aleatoric_std": 0.000137, "epistemic_std": 0.000274}, {"fold": "fold_6", "regime": "EUR crisis downturn", "sharpe": -1.3855, "sortino": -2.1125, "return_pct": -3.17, "equity": 968.29, "max_dd": 4.97, "win_rate": 43.93, "profit_factor": 0.792, "ic": -0.1069, "hit": 43.52, "n": 108, "aleatoric_mean": 0.000356, "epistemic_mean": 0.000712, "confidence_mean": 0.9989, "aleatoric_std": 0.000124, "epistemic_std": 0.000247}, {"fold": "fold_7", "regime": "Recent mixed/upturn", "sharpe": 1.3494, "sortino": 2.1085, "return_pct": 3.21, "equity": 1032.11, "max_dd": 3.16, "win_rate": 50.0, "profit_factor": 1.242, "ic": 0.0407, "hit": 50.0, "n": 110, "aleatoric_mean": 0.000394, "epistemic_mean": 0.000787, "confidence_mean": 0.9988, "aleatoric_std": 0.000117, "epistemic_std": 0.000235}], "train_sharpe": 3.1315, "train_psr": 1.0, "train_equity": 40325.02, "train_sortino": 7.6169, "train_return_pct": 3932.5, "train_max_dd": 6.9, "train_win_rate": 58.14, "train_profit_factor": 2.01, "train_ic": 0.2677, "train_hit": 57.91, "train_per_window": [{"fold": "all_train", "regime": "Training data", "sharpe": 3.1315, "sortino": 7.6169, "return_pct": 3932.5, "equity": 40325.02, "max_dd": 6.9, "win_rate": 58.14, "profit_factor": 2.01, "ic": 0.2677, "hit": 57.91, "n": 2478}], "experiment_num": 58, "status": "DISCARD"}
