{"backbone": "mlp", "description": "mlp: Exp12 residual MLP REPRODUCE seed=99", "config": {"seq_len": 10, "lr": 0.0003, "batch_size": 32, "epochs": 50, "weight_decay": 1e-05, "patience": 10, "grad_clip": 1.0, "warmup_epochs": 0, "huber_delta": 1.0, "head_dropout": 0.1, "seed": 99, "het_loss": false}, "composite": 3.1712, "test_pos_folds": 6, "val_pos_folds": 5, "val_loss": 4.4e-05, "elapsed_sec": 18.1, "timestamp": "2026-04-12T18:11:38", "sharpe": 3.4712, "psr": 1.0, "equity": 4042.18, "sortino": 4.598, "return_pct": 304.22, "max_dd": 19.28, "win_rate": 61.4, "profit_factor": 1.912, "ic": 0.2867, "hit": 61.15, "aleatoric_mean": 4.9e-05, "epistemic_mean": 9.9e-05, "confidence_mean": 0.9999, "per_window": [{"fold": "fold_1", "regime": "Pre-crisis upturn + GFC onset", "sharpe": -1.4759, "sortino": -1.7264, "return_pct": -11.37, "equity": 886.31, "max_dd": 14.08, "win_rate": 45.1, "profit_factor": 0.704, "ic": -0.1481, "hit": 44.66, "n": 103, "aleatoric_mean": 7.9e-05, "epistemic_mean": 0.000159, "confidence_mean": 0.9998, "aleatoric_std": 7.4e-05, "epistemic_std": 0.000149}, {"fold": "fold_2", "regime": "Post-crash recovery", "sharpe": 0.9029, "sortino": 1.5678, "return_pct": 4.14, "equity": 1041.4, "max_dd": 10.92, "win_rate": 54.21, "profit_factor": 1.152, "ic": 0.0036, "hit": 54.21, "n": 107, "aleatoric_mean": 3.7e-05, "epistemic_mean": 7.4e-05, "confidence_mean": 0.9999, "aleatoric_std": 2.4e-05, "epistemic_std": 4.8e-05}, {"fold": "fold_3", "regime": "Eurozone debt plateau", "sharpe": 4.5372, "sortino": 8.1415, "return_pct": 16.58, "equity": 1165.76, "max_dd": 2.34, "win_rate": 65.38, "profit_factor": 2.041, "ic": 0.379, "hit": 64.15, "n": 106, "aleatoric_mean": 5e-05, "epistemic_mean": 0.0001, "confidence_mean": 0.9998, "aleatoric_std": 2.3e-05, "epistemic_std": 4.7e-05}, {"fold": "fold_4", "regime": "Strong USD downturn", "sharpe": 6.3309, "sortino": 14.2301, "return_pct": 57.32, "equity": 1573.15, "max_dd": 2.92, "win_rate": 64.07, "profit_factor": 2.951, "ic": 0.4584, "hit": 63.69, "n": 168, "aleatoric_mean": 6.7e-05, "epistemic_mean": 0.000135, "confidence_mean": 0.9998, "aleatoric_std": 4.4e-05, "epistemic_std": 8.8e-05}, {"fold": "fold_5", "regime": "Low-vol plateau", "sharpe": 6.0691, "sortino": 10.9491, "return_pct": 20.7, "equity": 1206.95, "max_dd": 1.5, "win_rate": 66.05, "profit_factor": 2.784, "ic": 0.4843, "hit": 66.05, "n": 162, "aleatoric_mean": 3.1e-05, "epistemic_mean": 6.2e-05, "confidence_mean": 0.9999, "aleatoric_std": 1.8e-05, "epistemic_std": 3.7e-05}, {"fold": "fold_6", "regime": "EUR crisis downturn", "sharpe": 5.3176, "sortino": 10.9769, "return_pct": 36.97, "equity": 1369.66, "max_dd": 2.2, "win_rate": 58.18, "profit_factor": 2.375, "ic": 0.4536, "hit": 58.18, "n": 165, "aleatoric_mean": 5.5e-05, "epistemic_mean": 0.000109, "confidence_mean": 0.9998, "aleatoric_std": 3.7e-05, "epistemic_std": 7.3e-05}, {"fold": "fold_7", "regime": "Recent mixed/upturn", "sharpe": 6.7535, "sortino": 11.3174, "return_pct": 44.46, "equity": 1444.55, "max_dd": 2.5, "win_rate": 69.75, "profit_factor": 3.21, "ic": 0.5287, "hit": 69.75, "n": 162, "aleatoric_mean": 3.2e-05, "epistemic_mean": 6.5e-05, "confidence_mean": 0.9999, "aleatoric_std": 2.3e-05, "epistemic_std": 4.5e-05}], "val_sharpe": 4.9413, "val_psr": 1.0, "val_equity": 3038.42, "val_sortino": 7.2887, "val_return_pct": 203.84, "val_max_dd": 11.01, "val_win_rate": 65.27, "val_profit_factor": 2.325, "val_ic": 0.4148, "val_hit": 64.84, "val_aleatoric_mean": 3e-05, "val_epistemic_mean": 6e-05, "val_confidence_mean": 0.9999, "val_per_window": [{"fold": "fold_1", "regime": "Pre-crisis upturn + GFC onset", "sharpe": -0.3291, "sortino": -0.5288, "return_pct": -0.9, "equity": 990.99, "max_dd": 3.89, "win_rate": 46.3, "profit_factor": 0.947, "ic": -0.0451, "hit": 45.87, "n": 109, "aleatoric_mean": 2.7e-05, "epistemic_mean": 5.4e-05, "confidence_mean": 0.9999, "aleatoric_std": 2.5e-05, "epistemic_std": 5.1e-05}, {"fold": "fold_2", "regime": "Post-crash recovery", "sharpe": -1.22, "sortino": -1.8518, "return_pct": -6.0, "equity": 940.05, "max_dd": 9.67, "win_rate": 47.22, "profit_factor": 0.825, "ic": -0.0521, "hit": 47.22, "n": 108, "aleatoric_mean": 4.6e-05, "epistemic_mean": 9.3e-05, "confidence_mean": 0.9999, "aleatoric_std": 3.6e-05, "epistemic_std": 7.1e-05}, {"fold": "fold_3", "regime": "Eurozone debt plateau", "sharpe": 8.7876, "sortino": 19.7562, "return_pct": 36.23, "equity": 1362.28, "max_dd": 1.3, "win_rate": 67.89, "profit_factor": 4.314, "ic": 0.6389, "hit": 66.67, "n": 111, "aleatoric_mean": 4e-05, "epistemic_mean": 8e-05, "confidence_mean": 0.9999, "aleatoric_std": 2.3e-05, "epistemic_std": 4.7e-05}, {"fold": "fold_4", "regime": "Strong USD downturn", "sharpe": 7.7018, "sortino": 19.6826, "return_pct": 27.06, "equity": 1270.58, "max_dd": 1.85, "win_rate": 69.72, "profit_factor": 3.684, "ic": 0.5327, "hit": 69.09, "n": 110, "aleatoric_mean": 3e-05, "epistemic_mean": 6.1e-05, "confidence_mean": 0.9999, "aleatoric_std": 2.3e-05, "epistemic_std": 4.7e-05}, {"fold": "fold_5", "regime": "Low-vol plateau", "sharpe": 8.1971, "sortino": 14.4598, "return_pct": 27.37, "equity": 1273.65, "max_dd": 1.69, "win_rate": 74.11, "profit_factor": 4.064, "ic": 0.6547, "hit": 74.11, "n": 112, "aleatoric_mean": 3.1e-05, "epistemic_mean": 6.1e-05, "confidence_mean": 0.9999, "aleatoric_std": 2.1e-05, "epistemic_std": 4.2e-05}, {"fold": "fold_6", "regime": "EUR crisis downturn", "sharpe": 10.7143, "sortino": 24.276, "return_pct": 22.48, "equity": 1224.82, "max_dd": 0.49, "win_rate": 75.7, "profit_factor": 6.907, "ic": 0.6073, "hit": 75.0, "n": 108, "aleatoric_mean": 1.7e-05, "epistemic_mean": 3.5e-05, "confidence_mean": 0.9999, "aleatoric_std": 6e-06, "epistemic_std": 1.2e-05}, {"fold": "fold_7", "regime": "Recent mixed/upturn", "sharpe": 9.1043, "sortino": 20.4363, "return_pct": 20.79, "equity": 1207.9, "max_dd": 0.63, "win_rate": 75.45, "profit_factor": 4.473, "ic": 0.5681, "hit": 75.45, "n": 110, "aleatoric_mean": 1.7e-05, "epistemic_mean": 3.4e-05, "confidence_mean": 0.9999, "aleatoric_std": 8e-06, "epistemic_std": 1.7e-05}], "train_sharpe": 7.003, "train_psr": 1.0, "train_equity": 2416106.0, "train_sortino": 21.3049, "train_return_pct": 241510.6, "train_max_dd": 3.82, "train_win_rate": 72.81, "train_profit_factor": 5.664, "train_ic": 0.6827, "train_hit": 72.52, "train_per_window": [{"fold": "all_train", "regime": "Training data", "sharpe": 7.003, "sortino": 21.3049, "return_pct": 241510.6, "equity": 2416106.0, "max_dd": 3.82, "win_rate": 72.81, "profit_factor": 5.664, "ic": 0.6827, "hit": 72.52, "n": 2478}], "experiment_num": 68, "status": "DISCARD"}
{"backbone": "mlp", "description": "mlp: Exp13 residual hd=0.15 fold1 robustness seed=0", "config": {"seq_len": 10, "lr": 0.0003, "batch_size": 32, "epochs": 50, "weight_decay": 1e-05, "patience": 10, "grad_clip": 1.0, "warmup_epochs": 0, "huber_delta": 1.0, "head_dropout": 0.15, "seed": 0, "het_loss": false}, "composite": 5.1305, "test_pos_folds": 7, "val_pos_folds": 6, "val_loss": 4e-05, "elapsed_sec": 14.4, "timestamp": "2026-04-12T18:13:19", "sharpe": 5.2305, "psr": 1.0, "equity": 7823.14, "sortino": 9.515, "return_pct": 682.31, "max_dd": 4.55, "win_rate": 65.94, "profit_factor": 2.696, "ic": 0.4418, "hit": 65.67, "aleatoric_mean": 4.6e-05, "epistemic_mean": 9.2e-05, "confidence_mean": 0.9999, "per_window": [{"fold": "fold_1", "regime": "Pre-crisis upturn + GFC onset", "sharpe": 2.5471, "sortino": 6.8756, "return_pct": 20.56, "equity": 1205.57, "max_dd": 2.99, "win_rate": 60.78, "profit_factor": 1.844, "ic": 0.1889, "hit": 60.19, "n": 103, "aleatoric_mean": 8.9e-05, "epistemic_mean": 0.000179, "confidence_mean": 0.9997, "aleatoric_std": 0.000115, "epistemic_std": 0.00023}, {"fold": "fold_2", "regime": "Post-crash recovery", "sharpe": 2.2016, "sortino": 3.7306, "return_pct": 10.74, "equity": 1107.36, "max_dd": 3.36, "win_rate": 57.01, "profit_factor": 1.412, "ic": 0.1253, "hit": 57.01, "n": 107, "aleatoric_mean": 3.4e-05, "epistemic_mean": 6.8e-05, "confidence_mean": 0.9999, "aleatoric_std": 2.3e-05, "epistemic_std": 4.7e-05}, {"fold": "fold_3", "regime": "Eurozone debt plateau", "sharpe": 8.089, "sortino": 15.551, "return_pct": 28.96, "equity": 1289.63, "max_dd": 1.36, "win_rate": 72.12, "profit_factor": 3.605, "ic": 0.5717, "hit": 70.75, "n": 106, "aleatoric_mean": 5.1e-05, "epistemic_mean": 0.000102, "confidence_mean": 0.9998, "aleatoric_std": 2.9e-05, "epistemic_std": 5.8e-05}, {"fold": "fold_4", "regime": "Strong USD downturn", "sharpe": 8.6677, "sortino": 18.0664, "return_pct": 79.94, "equity": 1799.43, "max_dd": 1.81, "win_rate": 71.86, "profit_factor": 4.539, "ic": 0.5874, "hit": 71.43, "n": 168, "aleatoric_mean": 6.4e-05, "epistemic_mean": 0.000127, "confidence_mean": 0.9998, "aleatoric_std": 5e-05, "epistemic_std": 0.0001}, {"fold": "fold_5", "regime": "Low-vol plateau", "sharpe": 8.9333, "sortino": 16.5199, "return_pct": 29.52, "equity": 1295.17, "max_dd": 1.29, "win_rate": 70.37, "profit_factor": 4.674, "ic": 0.5557, "hit": 70.37, "n": 162, "aleatoric_mean": 2.3e-05, "epistemic_mean": 4.6e-05, "confidence_mean": 0.9999, "aleatoric_std": 1.2e-05, "epistemic_std": 2.5e-05}, {"fold": "fold_6", "regime": "EUR crisis downturn", "sharpe": 7.7494, "sortino": 12.4178, "return_pct": 54.59, "equity": 1545.89, "max_dd": 2.4, "win_rate": 68.48, "profit_factor": 3.573, "ic": 0.6094, "hit": 68.48, "n": 165, "aleatoric_mean": 4.3e-05, "epistemic_mean": 8.5e-05, "confidence_mean": 0.9999, "aleatoric_std": 2.9e-05, "epistemic_std": 5.7e-05}, {"fold": "fold_7", "regime": "Recent mixed/upturn", "sharpe": 4.0657, "sortino": 7.0447, "return_pct": 26.12, "equity": 1261.24, "max_dd": 3.15, "win_rate": 58.02, "profit_factor": 1.997, "ic": 0.5242, "hit": 58.02, "n": 162, "aleatoric_mean": 3.1e-05, "epistemic_mean": 6.2e-05, "confidence_mean": 0.9999, "aleatoric_std": 1.8e-05, "epistemic_std": 3.5e-05}], "val_sharpe": 5.4705, "val_psr": 1.0, "val_equity": 3384.35, "val_sortino": 8.7119, "val_return_pct": 238.44, "val_max_dd": 5.46, "val_win_rate": 64.88, "val_profit_factor": 2.552, "val_ic": 0.4216, "val_hit": 64.45, "val_aleatoric_mean": 2.8e-05, "val_epistemic_mean": 5.5e-05, "val_confidence_mean": 0.9999, "val_per_window": [{"fold": "fold_1", "regime": "Pre-crisis upturn + GFC onset", "sharpe": -0.6079, "sortino": -0.925, "return_pct": -1.59, "equity": 984.05, "max_dd": 3.48, "win_rate": 47.22, "profit_factor": 0.904, "ic": -0.0178, "hit": 46.79, "n": 109, "aleatoric_mean": 2.7e-05, "epistemic_mean": 5.5e-05, "confidence_mean": 0.9999, "aleatoric_std": 3e-05, "epistemic_std": 6.1e-05}, {"fold": "fold_2", "regime": "Post-crash recovery", "sharpe": 0.9435, "sortino": 1.536, "return_pct": 4.39, "equity": 1043.92, "max_dd": 5.46, "win_rate": 52.78, "profit_factor": 1.161, "ic": 0.0403, "hit": 52.78, "n": 108, "aleatoric_mean": 4.9e-05, "epistemic_mean": 9.8e-05, "confidence_mean": 0.9999, "aleatoric_std": 4e-05, "epistemic_std": 7.9e-05}, {"fold": "fold_3", "regime": "Eurozone debt plateau", "sharpe": 8.9996, "sortino": 20.2732, "return_pct": 37.01, "equity": 1370.06, "max_dd": 1.52, "win_rate": 75.23, "profit_factor": 4.48, "ic": 0.5941, "hit": 73.87, "n": 111, "aleatoric_mean": 3.6e-05, "epistemic_mean": 7.2e-05, "confidence_mean": 0.9999, "aleatoric_std": 2.4e-05, "epistemic_std": 4.8e-05}, {"fold": "fold_4", "regime": "Strong USD downturn", "sharpe": 8.4095, "sortino": 18.0449, "return_pct": 29.29, "equity": 1292.94, "max_dd": 1.01, "win_rate": 72.48, "profit_factor": 4.188, "ic": 0.5487, "hit": 71.82, "n": 110, "aleatoric_mean": 2.5e-05, "epistemic_mean": 5e-05, "confidence_mean": 0.9999, "aleatoric_std": 2.1e-05, "epistemic_std": 4.3e-05}, {"fold": "fold_5", "regime": "Low-vol plateau", "sharpe": 9.8369, "sortino": 27.4629, "return_pct": 32.03, "equity": 1320.33, "max_dd": 0.8, "win_rate": 70.54, "profit_factor": 5.549, "ic": 0.691, "hit": 70.54, "n": 112, "aleatoric_mean": 2.4e-05, "epistemic_mean": 4.9e-05, "confidence_mean": 0.9999, "aleatoric_std": 1.8e-05, "epistemic_std": 3.6e-05}, {"fold": "fold_6", "regime": "EUR crisis downturn", "sharpe": 8.2557, "sortino": 17.8094, "return_pct": 18.19, "equity": 1181.93, "max_dd": 0.74, "win_rate": 70.09, "profit_factor": 4.21, "ic": 0.6209, "hit": 69.44, "n": 108, "aleatoric_mean": 1.5e-05, "epistemic_mean": 3e-05, "confidence_mean": 1.0, "aleatoric_std": 7e-06, "epistemic_std": 1.4e-05}, {"fold": "fold_7", "regime": "Recent mixed/upturn", "sharpe": 8.2747, "sortino": 22.0245, "return_pct": 19.18, "equity": 1191.78, "max_dd": 0.72, "win_rate": 65.45, "profit_factor": 3.873, "ic": 0.5431, "hit": 65.45, "n": 110, "aleatoric_mean": 1.6e-05, "epistemic_mean": 3.2e-05, "confidence_mean": 1.0, "aleatoric_std": 1.1e-05, "epistemic_std": 2.1e-05}], "train_sharpe": 7.6865, "train_psr": 1.0, "train_equity": 4523138.0, "train_sortino": 23.0763, "train_return_pct": 452213.8, "train_max_dd": 3.64, "train_win_rate": 76.7, "train_profit_factor": 7.186, "train_ic": 0.74, "train_hit": 76.39, "train_per_window": [{"fold": "all_train", "regime": "Training data", "sharpe": 7.6865, "sortino": 23.0763, "return_pct": 452213.8, "equity": 4523138.0, "max_dd": 3.64, "win_rate": 76.7, "profit_factor": 7.186, "ic": 0.74, "hit": 76.39, "n": 2478}], "experiment_num": 69, "status": "KEEP"}
{"backbone": "mlp", "description": "mlp: Exp14 residual hd=0.15 REPRODUCE seed=42", "config": {"seq_len": 10, "lr": 0.0003, "batch_size": 32, "epochs": 50, "weight_decay": 1e-05, "patience": 10, "grad_clip": 1.0, "warmup_epochs": 0, "huber_delta": 1.0, "head_dropout": 0.15, "seed": 42, "het_loss": false}, "composite": 4.3181, "test_pos_folds": 7, "val_pos_folds": 6, "val_loss": 4.3e-05, "elapsed_sec": 20.1, "timestamp": "2026-04-14T16:04:43", "sharpe": 4.4181, "psr": 1.0, "equity": 5806.47, "sortino": 5.5908, "return_pct": 480.65, "max_dd": 7.94, "win_rate": 64.71, "profit_factor": 2.296, "ic": 0.4034, "hit": 64.44, "aleatoric_mean": 5.3e-05, "epistemic_mean": 0.000106, "confidence_mean": 0.9998, "per_window": [{"fold": "fold_1", "regime": "Pre-crisis upturn + GFC onset", "sharpe": 0.074, "sortino": 0.0821, "return_pct": -0.16, "equity": 998.38, "max_dd": 7.94, "win_rate": 51.96, "profit_factor": 1.018, "ic": 0.0866, "hit": 51.46, "n": 103, "aleatoric_mean": 0.000108, "epistemic_mean": 0.000216, "confidence_mean": 0.9997, "aleatoric_std": 0.000117, "epistemic_std": 0.000234}, {"fold": "fold_2", "regime": "Post-crash recovery", "sharpe": 0.6201, "sortino": 1.0131, "return_pct": 2.74, "equity": 1027.4, "max_dd": 6.8, "win_rate": 55.14, "profit_factor": 1.102, "ic": 0.1072, "hit": 55.14, "n": 107, "aleatoric_mean": 3.7e-05, "epistemic_mean": 7.5e-05, "confidence_mean": 0.9999, "aleatoric_std": 2.4e-05, "epistemic_std": 4.9e-05}, {"fold": "fold_3", "regime": "Eurozone debt plateau", "sharpe": 7.5105, "sortino": 13.4173, "return_pct": 27.06, "equity": 1270.63, "max_dd": 2.22, "win_rate": 72.12, "profit_factor": 3.281, "ic": 0.4886, "hit": 70.75, "n": 106, "aleatoric_mean": 5.9e-05, "epistemic_mean": 0.000118, "confidence_mean": 0.9998, "aleatoric_std": 3.5e-05, "epistemic_std": 7.1e-05}, {"fold": "fold_4", "regime": "Strong USD downturn", "sharpe": 8.4104, "sortino": 15.0813, "return_pct": 77.5, "equity": 1774.98, "max_dd": 2.37, "win_rate": 73.65, "profit_factor": 4.321, "ic": 0.6003, "hit": 73.21, "n": 168, "aleatoric_mean": 7.1e-05, "epistemic_mean": 0.000142, "confidence_mean": 0.9998, "aleatoric_std": 5.1e-05, "epistemic_std": 0.000102}, {"fold": "fold_5", "regime": "Low-vol plateau", "sharpe": 6.0661, "sortino": 9.1967, "return_pct": 20.69, "equity": 1206.85, "max_dd": 2.22, "win_rate": 68.52, "profit_factor": 2.783, "ic": 0.428, "hit": 68.52, "n": 162, "aleatoric_mean": 2.6e-05, "epistemic_mean": 5.1e-05, "confidence_mean": 0.9999, "aleatoric_std": 1.9e-05, "epistemic_std": 3.9e-05}, {"fold": "fold_6", "regime": "EUR crisis downturn", "sharpe": 8.1817, "sortino": 17.9024, "return_pct": 57.62, "equity": 1576.24, "max_dd": 1.46, "win_rate": 64.85, "profit_factor": 3.849, "ic": 0.5992, "hit": 64.85, "n": 165, "aleatoric_mean": 5e-05, "epistemic_mean": 0.000101, "confidence_mean": 0.9998, "aleatoric_std": 3.2e-05, "epistemic_std": 6.3e-05}, {"fold": "fold_7", "regime": "Recent mixed/upturn", "sharpe": 4.9148, "sortino": 9.6355, "return_pct": 31.94, "equity": 1319.42, "max_dd": 2.05, "win_rate": 61.11, "profit_factor": 2.314, "ic": 0.5077, "hit": 61.11, "n": 162, "aleatoric_mean": 3.5e-05, "epistemic_mean": 7e-05, "confidence_mean": 0.9999, "aleatoric_std": 2e-05, "epistemic_std": 4e-05}], "val_sharpe": 5.2759, "val_psr": 1.0, "val_equity": 3254.02, "val_sortino": 7.8118, "val_return_pct": 225.4, "val_max_dd": 9.02, "val_win_rate": 65.79, "val_profit_factor": 2.466, "val_ic": 0.414, "val_hit": 65.36, "val_aleatoric_mean": 3.1e-05, "val_epistemic_mean": 6.2e-05, "val_confidence_mean": 0.9999, "val_per_window": [{"fold": "fold_1", "regime": "Pre-crisis upturn + GFC onset", "sharpe": 0.8043, "sortino": 1.2933, "return_pct": 1.97, "equity": 1019.74, "max_dd": 3.21, "win_rate": 52.78, "profit_factor": 1.143, "ic": 0.0505, "hit": 52.29, "n": 109, "aleatoric_mean": 3.2e-05, "epistemic_mean": 6.4e-05, "confidence_mean": 0.9999, "aleatoric_std": 3.7e-05, "epistemic_std": 7.4e-05}, {"fold": "fold_2", "regime": "Post-crash recovery", "sharpe": -0.2972, "sortino": -0.4522, "return_pct": -1.7, "equity": 982.96, "max_dd": 9.02, "win_rate": 50.0, "profit_factor": 0.954, "ic": -0.0507, "hit": 50.0, "n": 108, "aleatoric_mean": 6e-05, "epistemic_mean": 0.00012, "confidence_mean": 0.9998, "aleatoric_std": 6.2e-05, "epistemic_std": 0.000123}, {"fold": "fold_3", "regime": "Eurozone debt plateau", "sharpe": 8.1144, "sortino": 19.5348, "return_pct": 33.7, "equity": 1337.0, "max_dd": 1.87, "win_rate": 67.89, "profit_factor": 3.832, "ic": 0.5818, "hit": 66.67, "n": 111, "aleatoric_mean": 4e-05, "epistemic_mean": 7.9e-05, "confidence_mean": 0.9999, "aleatoric_std": 2.5e-05, "epistemic_std": 5e-05}, {"fold": "fold_4", "regime": "Strong USD downturn", "sharpe": 7.6345, "sortino": 16.1841, "return_pct": 26.84, "equity": 1268.42, "max_dd": 1.76, "win_rate": 70.64, "profit_factor": 3.639, "ic": 0.5525, "hit": 70.0, "n": 110, "aleatoric_mean": 2.9e-05, "epistemic_mean": 5.7e-05, "confidence_mean": 0.9999, "aleatoric_std": 2.7e-05, "epistemic_std": 5.5e-05}, {"fold": "fold_5", "regime": "Low-vol plateau", "sharpe": 10.7688, "sortino": 27.1556, "return_pct": 34.48, "equity": 1344.81, "max_dd": 0.81, "win_rate": 73.21, "profit_factor": 6.701, "ic": 0.6578, "hit": 73.21, "n": 112, "aleatoric_mean": 2.6e-05, "epistemic_mean": 5.2e-05, "confidence_mean": 0.9999, "aleatoric_std": 1.9e-05, "epistemic_std": 3.9e-05}, {"fold": "fold_6", "regime": "EUR crisis downturn", "sharpe": 10.9639, "sortino": 18.8553, "return_pct": 22.88, "equity": 1228.77, "max_dd": 0.63, "win_rate": 79.44, "profit_factor": 7.294, "ic": 0.6791, "hit": 78.7, "n": 108, "aleatoric_mean": 1.6e-05, "epistemic_mean": 3.1e-05, "confidence_mean": 1.0, "aleatoric_std": 8e-06, "epistemic_std": 1.6e-05}, {"fold": "fold_7", "regime": "Recent mixed/upturn", "sharpe": 6.6775, "sortino": 11.3607, "return_pct": 15.84, "equity": 1158.43, "max_dd": 1.29, "win_rate": 66.36, "profit_factor": 2.957, "ic": 0.5496, "hit": 66.36, "n": 110, "aleatoric_mean": 1.7e-05, "epistemic_mean": 3.4e-05, "confidence_mean": 0.9999, "aleatoric_std": 1e-05, "epistemic_std": 2.1e-05}], "train_sharpe": 7.8493, "train_psr": 1.0, "train_equity": 5227906.0, "train_sortino": 24.2196, "train_return_pct": 522690.6, "train_max_dd": 2.64, "train_win_rate": 77.27, "train_profit_factor": 7.642, "train_ic": 0.7378, "train_hit": 76.96, "train_per_window": [{"fold": "all_train", "regime": "Training data", "sharpe": 7.8493, "sortino": 24.2196, "return_pct": 522690.6, "equity": 5227906.0, "max_dd": 2.64, "win_rate": 77.27, "profit_factor": 7.642, "ic": 0.7378, "hit": 76.96, "n": 2478}], "experiment_num": 70, "status": "DISCARD"}
