{"backbone": "lstm", "description": "lstm: Exp38 lr=8e-4 fine-grained at champion", "config": {"seq_len": 10, "lr": 0.0008, "batch_size": 16, "epochs": 100, "weight_decay": 0.0007, "patience": 15, "grad_clip": 1.0, "warmup_epochs": 0, "huber_delta": 1.0, "head_dropout": 0.25, "seed": 42, "het_loss": false}, "composite": 5.2039, "test_pos_folds": 7, "val_pos_folds": 5, "val_loss": 2.8e-05, "elapsed_sec": 55.0, "timestamp": "2026-04-19T19:52:46", "sharpe": 5.9585, "psr": 1.0, "equity": 10099.17, "sortino": 7.0985, "return_pct": 909.92, "max_dd": 7.54, "win_rate": 69.76, "profit_factor": 3.126, "ic": 0.5781, "hit": 69.48, "aleatoric_mean": 8e-06, "epistemic_mean": 1.5e-05, "confidence_mean": 1.0, "precision": 0.7987, "recall": 0.5198, "f1": 0.6297, "f2": 0.5588, "mcc": 0.4192, "accuracy": 0.6978, "per_window": [{"fold": "fold_1", "regime": "Pre-crisis upturn + GFC onset", "sharpe": 0.0744, "sortino": 0.0829, "return_pct": -0.16, "equity": 998.41, "max_dd": 7.54, "win_rate": 51.96, "profit_factor": 1.018, "ic": 0.1563, "hit": 51.46, "n": 103, "precision": 0.6667, "recall": 0.1509, "f1": 0.2462, "f2": 0.1786, "mcc": 0.1105, "accuracy": 0.5243, "tp": 8, "fp": 4, "tn": 46, "fn": 45, "aleatoric_mean": 1e-05, "epistemic_mean": 2e-05, "confidence_mean": 1.0, "aleatoric_std": 4e-06, "epistemic_std": 8e-06}, {"fold": "fold_2", "regime": "Post-crash recovery", "sharpe": 2.2031, "sortino": 4.2702, "return_pct": 10.74, "equity": 1107.44, "max_dd": 4.21, "win_rate": 53.27, "profit_factor": 1.412, "ic": 0.0796, "hit": 53.27, "n": 107, "precision": 0.5172, "recall": 0.2941, "f1": 0.375, "f2": 0.3219, "mcc": 0.0496, "accuracy": 0.5327, "tp": 15, "fp": 14, "tn": 42, "fn": 36, "aleatoric_mean": 1e-05, "epistemic_mean": 1.9e-05, "confidence_mean": 1.0, "aleatoric_std": 6e-06, "epistemic_std": 1.2e-05}, {"fold": "fold_3", "regime": "Eurozone debt plateau", "sharpe": 8.9573, "sortino": 14.4293, "return_pct": 31.71, "equity": 1317.11, "max_dd": 2.22, "win_rate": 75.96, "profit_factor": 4.158, "ic": 0.5721, "hit": 74.53, "n": 106, "precision": 0.7627, "recall": 0.7895, "f1": 0.7759, "f2": 0.784, "mcc": 0.5056, "accuracy": 0.7547, "tp": 45, "fp": 14, "tn": 35, "fn": 12, "aleatoric_mean": 8e-06, "epistemic_mean": 1.6e-05, "confidence_mean": 1.0, "aleatoric_std": 4e-06, "epistemic_std": 7e-06}, {"fold": "fold_4", "regime": "Strong USD downturn", "sharpe": 9.4398, "sortino": 18.7058, "return_pct": 87.17, "equity": 1871.71, "max_dd": 1.81, "win_rate": 74.85, "profit_factor": 5.277, "ic": 0.7938, "hit": 74.4, "n": 168, "precision": 0.9231, "recall": 0.5581, "f1": 0.6957, "f2": 0.6061, "mcc": 0.5507, "accuracy": 0.75, "tp": 48, "fp": 4, "tn": 78, "fn": 38, "aleatoric_mean": 7e-06, "epistemic_mean": 1.3e-05, "confidence_mean": 1.0, "aleatoric_std": 3e-06, "epistemic_std": 6e-06}, {"fold": "fold_5", "regime": "Low-vol plateau", "sharpe": 10.2599, "sortino": 29.0588, "return_pct": 33.16, "equity": 1331.58, "max_dd": 0.89, "win_rate": 72.22, "profit_factor": 6.059, "ic": 0.7935, "hit": 72.22, "n": 162, "precision": 0.8974, "recall": 0.4605, "f1": 0.6087, "f2": 0.5102, "mcc": 0.4833, "accuracy": 0.7222, "tp": 35, "fp": 4, "tn": 82, "fn": 41, "aleatoric_mean": 5e-06, "epistemic_mean": 1.1e-05, "confidence_mean": 1.0, "aleatoric_std": 2e-06, "epistemic_std": 4e-06}, {"fold": "fold_6", "regime": "EUR crisis downturn", "sharpe": 12.154, "sortino": 26.2911, "return_pct": 83.09, "equity": 1830.89, "max_dd": 1.53, "win_rate": 75.76, "profit_factor": 8.077, "ic": 0.7748, "hit": 75.76, "n": 165, "precision": 0.8136, "recall": 0.6234, "f1": 0.7059, "f2": 0.654, "mcc": 0.5188, "accuracy": 0.7576, "tp": 48, "fp": 11, "tn": 77, "fn": 29, "aleatoric_mean": 7e-06, "epistemic_mean": 1.4e-05, "confidence_mean": 1.0, "aleatoric_std": 3e-06, "epistemic_std": 5e-06}, {"fold": "fold_7", "regime": "Recent mixed/upturn", "sharpe": 7.8898, "sortino": 12.6427, "return_pct": 51.97, "equity": 1519.73, "max_dd": 1.94, "win_rate": 74.07, "profit_factor": 3.96, "ic": 0.6536, "hit": 74.07, "n": 162, "precision": 0.8095, "recall": 0.6296, "f1": 0.7083, "f2": 0.6589, "mcc": 0.4938, "accuracy": 0.7407, "tp": 51, "fp": 12, "tn": 69, "fn": 30, "aleatoric_mean": 9e-06, "epistemic_mean": 1.9e-05, "confidence_mean": 1.0, "aleatoric_std": 3e-06, "epistemic_std": 6e-06}], "val_sharpe": 5.4039, "val_psr": 1.0, "val_equity": 3339.31, "val_sortino": 8.1628, "val_return_pct": 233.93, "val_max_dd": 11.84, "val_win_rate": 66.19, "val_profit_factor": 2.522, "val_ic": 0.5491, "val_hit": 65.76, "val_aleatoric_mean": 6e-06, "val_epistemic_mean": 1.3e-05, "val_confidence_mean": 1.0, "val_precision": 0.7716, "val_recall": 0.4164, "val_f1": 0.5409, "val_f2": 0.4587, "val_mcc": 0.3485, "val_accuracy": 0.6641, "val_per_window": [{"fold": "fold_1", "regime": "Pre-crisis upturn + GFC onset", "sharpe": -0.5442, "sortino": -0.7882, "return_pct": -1.44, "equity": 985.63, "max_dd": 3.84, "win_rate": 50.0, "profit_factor": 0.914, "ic": 0.0343, "hit": 49.54, "n": 109, "precision": 0.5217, "recall": 0.2182, "f1": 0.3077, "f2": 0.2469, "mcc": 0.0177, "accuracy": 0.5046, "tp": 12, "fp": 11, "tn": 43, "fn": 43, "aleatoric_mean": 7e-06, "epistemic_mean": 1.3e-05, "confidence_mean": 1.0, "aleatoric_std": 3e-06, "epistemic_std": 6e-06}, {"fold": "fold_2", "regime": "Post-crash recovery", "sharpe": -1.0459, "sortino": -1.6929, "return_pct": -5.2, "equity": 947.97, "max_dd": 11.84, "win_rate": 44.44, "profit_factor": 0.848, "ic": -0.0111, "hit": 44.44, "n": 108, "precision": 0.5556, "recall": 0.2381, "f1": 0.3333, "f2": 0.2688, "mcc": -0.0325, "accuracy": 0.4444, "tp": 15, "fp": 12, "tn": 33, "fn": 48, "aleatoric_mean": 9e-06, "epistemic_mean": 1.9e-05, "confidence_mean": 1.0, "aleatoric_std": 4e-06, "epistemic_std": 7e-06}, {"fold": "fold_3", "regime": "Eurozone debt plateau", "sharpe": 9.5164, "sortino": 22.712, "return_pct": 38.86, "equity": 1388.65, "max_dd": 0.86, "win_rate": 78.9, "profit_factor": 4.918, "ic": 0.7952, "hit": 77.48, "n": 111, "precision": 0.9286, "recall": 0.5532, "f1": 0.6933, "f2": 0.6019, "mcc": 0.5938, "accuracy": 0.7928, "tp": 26, "fp": 2, "tn": 62, "fn": 21, "aleatoric_mean": 6e-06, "epistemic_mean": 1.2e-05, "confidence_mean": 1.0, "aleatoric_std": 2e-06, "epistemic_std": 4e-06}, {"fold": "fold_4", "regime": "Strong USD downturn", "sharpe": 11.0116, "sortino": 26.0364, "return_pct": 36.77, "equity": 1367.68, "max_dd": 0.77, "win_rate": 76.15, "profit_factor": 6.942, "ic": 0.7762, "hit": 75.45, "n": 110, "precision": 0.8889, "recall": 0.5106, "f1": 0.6486, "f2": 0.5581, "mcc": 0.5322, "accuracy": 0.7636, "tp": 24, "fp": 3, "tn": 60, "fn": 23, "aleatoric_mean": 5e-06, "epistemic_mean": 1.1e-05, "confidence_mean": 1.0, "aleatoric_std": 2e-06, "epistemic_std": 4e-06}, {"fold": "fold_5", "regime": "Low-vol plateau", "sharpe": 8.0201, "sortino": 22.2063, "return_pct": 26.84, "equity": 1268.35, "max_dd": 1.17, "win_rate": 65.18, "profit_factor": 3.934, "ic": 0.7901, "hit": 65.18, "n": 112, "precision": 0.7917, "recall": 0.3585, "f1": 0.4935, "f2": 0.4025, "mcc": 0.3331, "accuracy": 0.6518, "tp": 19, "fp": 5, "tn": 54, "fn": 34, "aleatoric_mean": 5e-06, "epistemic_mean": 1e-05, "confidence_mean": 1.0, "aleatoric_std": 2e-06, "epistemic_std": 4e-06}, {"fold": "fold_6", "regime": "EUR crisis downturn", "sharpe": 11.3275, "sortino": 33.3002, "return_pct": 23.44, "equity": 1234.39, "max_dd": 0.45, "win_rate": 77.57, "profit_factor": 7.914, "ic": 0.8685, "hit": 76.85, "n": 108, "precision": 0.96, "recall": 0.5106, "f1": 0.6667, "f2": 0.5634, "mcc": 0.581, "accuracy": 0.7778, "tp": 24, "fp": 1, "tn": 60, "fn": 23, "aleatoric_mean": 5e-06, "epistemic_mean": 1e-05, "confidence_mean": 1.0, "aleatoric_std": 2e-06, "epistemic_std": 4e-06}, {"fold": "fold_7", "regime": "Recent mixed/upturn", "sharpe": 8.7916, "sortino": 18.0631, "return_pct": 20.19, "equity": 1201.93, "max_dd": 1.34, "win_rate": 70.91, "profit_factor": 4.235, "ic": 0.6986, "hit": 70.91, "n": 110, "precision": 0.7442, "recall": 0.6038, "f1": 0.6667, "f2": 0.6275, "mcc": 0.4207, "accuracy": 0.7091, "tp": 32, "fp": 11, "tn": 46, "fn": 21, "aleatoric_mean": 8e-06, "epistemic_mean": 1.5e-05, "confidence_mean": 1.0, "aleatoric_std": 3e-06, "epistemic_std": 6e-06}], "train_sharpe": 5.8047, "train_psr": 1.0, "train_equity": 747787.06, "train_sortino": 15.1347, "train_return_pct": 74678.71, "train_max_dd": 4.24, "train_win_rate": 68.6, "train_profit_factor": 3.944, "train_ic": 0.6973, "train_hit": 68.32, "train_precision": 0.8854, "train_recall": 0.449, "train_f1": 0.5958, "train_f2": 0.4981, "train_mcc": 0.4412, "train_accuracy": 0.6868, "train_per_window": [{"fold": "all_train", "regime": "Training data", "sharpe": 5.8047, "sortino": 15.1347, "return_pct": 74678.71, "equity": 747787.06, "max_dd": 4.24, "win_rate": 68.6, "profit_factor": 3.944, "ic": 0.6973, "hit": 68.32, "n": 2478, "precision": 0.8854, "recall": 0.449, "f1": 0.5958, "f2": 0.4981, "mcc": 0.4412, "accuracy": 0.6868, "tp": 572, "fp": 74, "tn": 1130, "fn": 702}], "experiment_num": 143, "status": "DISCARD"}
{"backbone": "lstm", "description": "lstm: Exp39 num_layers=1 simpler architecture (vs 2-layer)", "config": {"seq_len": 10, "lr": 0.001, "batch_size": 16, "epochs": 100, "weight_decay": 0.0007, "patience": 15, "grad_clip": 1.0, "warmup_epochs": 0, "huber_delta": 1.0, "head_dropout": 0.25, "seed": 42, "num_layers": 1, "het_loss": false}, "composite": 3.5685, "test_pos_folds": 6, "val_pos_folds": 7, "val_loss": 3.2e-05, "elapsed_sec": 43.3, "timestamp": "2026-04-19T19:53:53", "sharpe": 3.6685, "psr": 1.0, "equity": 4365.58, "sortino": 6.393, "return_pct": 336.56, "max_dd": 13.28, "win_rate": 61.82, "profit_factor": 1.986, "ic": 0.3868, "hit": 61.56, "aleatoric_mean": 1.1e-05, "epistemic_mean": 2.3e-05, "confidence_mean": 1.0, "precision": 0.7455, "recall": 0.341, "f1": 0.4679, "f2": 0.3825, "mcc": 0.2715, "accuracy": 0.6166, "per_window": [{"fold": "fold_1", "regime": "Pre-crisis upturn + GFC onset", "sharpe": 1.5392, "sortino": 4.5212, "return_pct": 11.75, "equity": 1117.54, "max_dd": 5.87, "win_rate": 51.96, "profit_factor": 1.441, "ic": 0.0535, "hit": 51.46, "n": 103, "precision": 0.5714, "recall": 0.2264, "f1": 0.3243, "f2": 0.2575, "mcc": 0.0576, "accuracy": 0.5146, "tp": 12, "fp": 9, "tn": 41, "fn": 41, "aleatoric_mean": 1.3e-05, "epistemic_mean": 2.6e-05, "confidence_mean": 1.0, "aleatoric_std": 6e-06, "epistemic_std": 1.2e-05}, {"fold": "fold_2", "regime": "Post-crash recovery", "sharpe": 2.6075, "sortino": 5.058, "return_pct": 12.84, "equity": 1128.41, "max_dd": 4.42, "win_rate": 52.34, "profit_factor": 1.505, "ic": -0.0151, "hit": 52.34, "n": 107, "precision": 0.5, "recall": 0.2353, "f1": 0.32, "f2": 0.2632, "mcc": 0.0252, "accuracy": 0.5234, "tp": 12, "fp": 12, "tn": 44, "fn": 39, "aleatoric_mean": 1.4e-05, "epistemic_mean": 2.7e-05, "confidence_mean": 1.0, "aleatoric_std": 7e-06, "epistemic_std": 1.4e-05}, {"fold": "fold_3", "regime": "Eurozone debt plateau", "sharpe": 7.4636, "sortino": 13.9932, "return_pct": 26.91, "equity": 1269.06, "max_dd": 2.03, "win_rate": 66.35, "profit_factor": 3.256, "ic": 0.495, "hit": 65.09, "n": 106, "precision": 0.7, "recall": 0.614, "f1": 0.6542, "f2": 0.6295, "mcc": 0.3075, "accuracy": 0.6509, "tp": 35, "fp": 15, "tn": 34, "fn": 22, "aleatoric_mean": 1.7e-05, "epistemic_mean": 3.5e-05, "confidence_mean": 0.9999, "aleatoric_std": 8e-06, "epistemic_std": 1.6e-05}, {"fold": "fold_4", "regime": "Strong USD downturn", "sharpe": 5.9536, "sortino": 9.3197, "return_pct": 53.61, "equity": 1536.11, "max_dd": 4.83, "win_rate": 68.86, "profit_factor": 2.76, "ic": 0.6157, "hit": 68.45, "n": 168, "precision": 0.8864, "recall": 0.4535, "f1": 0.6, "f2": 0.5026, "mcc": 0.4462, "accuracy": 0.6905, "tp": 39, "fp": 5, "tn": 77, "fn": 47, "aleatoric_mean": 1.2e-05, "epistemic_mean": 2.3e-05, "confidence_mean": 1.0, "aleatoric_std": 4e-06, "epistemic_std": 9e-06}, {"fold": "fold_5", "regime": "Low-vol plateau", "sharpe": 5.2779, "sortino": 7.4903, "return_pct": 18.07, "equity": 1180.67, "max_dd": 2.39, "win_rate": 65.43, "profit_factor": 2.428, "ic": 0.6283, "hit": 65.43, "n": 162, "precision": 0.9167, "recall": 0.2895, "f1": 0.44, "f2": 0.3354, "mcc": 0.374, "accuracy": 0.6543, "tp": 22, "fp": 2, "tn": 84, "fn": 54, "aleatoric_mean": 7e-06, "epistemic_mean": 1.5e-05, "confidence_mean": 1.0, "aleatoric_std": 3e-06, "epistemic_std": 6e-06}, {"fold": "fold_6", "regime": "EUR crisis downturn", "sharpe": 8.6304, "sortino": 14.5372, "return_pct": 60.73, "equity": 1607.29, "max_dd": 1.99, "win_rate": 70.91, "profit_factor": 4.162, "ic": 0.5892, "hit": 70.91, "n": 165, "precision": 0.7636, "recall": 0.5455, "f1": 0.6364, "f2": 0.5785, "mcc": 0.4209, "accuracy": 0.7091, "tp": 42, "fp": 13, "tn": 75, "fn": 35, "aleatoric_mean": 1.2e-05, "epistemic_mean": 2.3e-05, "confidence_mean": 1.0, "aleatoric_std": 6e-06, "epistemic_std": 1.2e-05}, {"fold": "fold_7", "regime": "Recent mixed/upturn", "sharpe": -1.0686, "sortino": -1.4526, "return_pct": -6.42, "equity": 935.81, "max_dd": 13.21, "win_rate": 51.23, "profit_factor": 0.835, "ic": 0.5778, "hit": 51.23, "n": 162, "precision": 1.0, "recall": 0.0247, "f1": 0.0482, "f2": 0.0307, "mcc": 0.1118, "accuracy": 0.5123, "tp": 2, "fp": 0, "tn": 81, "fn": 79, "aleatoric_mean": 9e-06, "epistemic_mean": 1.8e-05, "confidence_mean": 1.0, "aleatoric_std": 4e-06, "epistemic_std": 7e-06}], "val_sharpe": 4.9711, "val_psr": 1.0, "val_equity": 3057.18, "val_sortino": 8.0581, "val_return_pct": 205.72, "val_max_dd": 4.95, "val_win_rate": 66.06, "val_profit_factor": 2.337, "val_ic": 0.4718, "val_hit": 65.62, "val_aleatoric_mean": 8e-06, "val_epistemic_mean": 1.7e-05, "val_confidence_mean": 1.0, "val_precision": 0.7838, "val_recall": 0.3973, "val_f1": 0.5273, "val_f2": 0.4407, "val_mcc": 0.348, "val_accuracy": 0.6615, "val_per_window": [{"fold": "fold_1", "regime": "Pre-crisis upturn + GFC onset", "sharpe": 0.0612, "sortino": 0.0939, "return_pct": 0.08, "equity": 1000.81, "max_dd": 4.95, "win_rate": 52.78, "profit_factor": 1.01, "ic": -0.0525, "hit": 52.29, "n": 109, "precision": 0.5405, "recall": 0.3636, "f1": 0.4348, "f2": 0.3891, "mcc": 0.0515, "accuracy": 0.5229, "tp": 20, "fp": 17, "tn": 37, "fn": 35, "aleatoric_mean": 8e-06, "epistemic_mean": 1.5e-05, "confidence_mean": 1.0, "aleatoric_std": 4e-06, "epistemic_std": 8e-06}, {"fold": "fold_2", "regime": "Post-crash recovery", "sharpe": 1.717, "sortino": 2.9343, "return_pct": 8.34, "equity": 1083.44, "max_dd": 4.55, "win_rate": 54.63, "profit_factor": 1.311, "ic": 0.1414, "hit": 54.63, "n": 108, "precision": 0.7188, "recall": 0.3651, "f1": 0.4842, "f2": 0.4049, "mcc": 0.1782, "accuracy": 0.5463, "tp": 23, "fp": 9, "tn": 36, "fn": 40, "aleatoric_mean": 1.3e-05, "epistemic_mean": 2.7e-05, "confidence_mean": 1.0, "aleatoric_std": 5e-06, "epistemic_std": 1e-05}, {"fold": "fold_3", "regime": "Eurozone debt plateau", "sharpe": 8.3086, "sortino": 15.9333, "return_pct": 34.44, "equity": 1344.38, "max_dd": 1.58, "win_rate": 77.06, "profit_factor": 3.964, "ic": 0.6527, "hit": 75.68, "n": 111, "precision": 0.8667, "recall": 0.5532, "f1": 0.6753, "f2": 0.5963, "mcc": 0.5459, "accuracy": 0.7748, "tp": 26, "fp": 4, "tn": 60, "fn": 21, "aleatoric_mean": 1e-05, "epistemic_mean": 2e-05, "confidence_mean": 1.0, "aleatoric_std": 5e-06, "epistemic_std": 1e-05}, {"fold": "fold_4", "regime": "Strong USD downturn", "sharpe": 10.6745, "sortino": 23.6412, "return_pct": 35.87, "equity": 1358.69, "max_dd": 1.28, "win_rate": 78.9, "profit_factor": 6.476, "ic": 0.7497, "hit": 78.18, "n": 110, "precision": 0.9615, "recall": 0.5319, "f1": 0.6849, "f2": 0.5841, "mcc": 0.6009, "accuracy": 0.7909, "tp": 25, "fp": 1, "tn": 62, "fn": 22, "aleatoric_mean": 8e-06, "epistemic_mean": 1.6e-05, "confidence_mean": 1.0, "aleatoric_std": 4e-06, "epistemic_std": 7e-06}, {"fold": "fold_5", "regime": "Low-vol plateau", "sharpe": 8.6812, "sortino": 16.3762, "return_pct": 28.79, "equity": 1287.9, "max_dd": 1.33, "win_rate": 70.54, "profit_factor": 4.445, "ic": 0.6354, "hit": 70.54, "n": 112, "precision": 0.7632, "recall": 0.5472, "f1": 0.6374, "f2": 0.58, "mcc": 0.4161, "accuracy": 0.7054, "tp": 29, "fp": 9, "tn": 50, "fn": 24, "aleatoric_mean": 8e-06, "epistemic_mean": 1.5e-05, "confidence_mean": 1.0, "aleatoric_std": 4e-06, "epistemic_std": 7e-06}, {"fold": "fold_6", "regime": "EUR crisis downturn", "sharpe": 6.2074, "sortino": 12.7036, "return_pct": 14.09, "equity": 1140.88, "max_dd": 1.77, "win_rate": 67.29, "profit_factor": 2.893, "ic": 0.7461, "hit": 66.67, "n": 108, "precision": 1.0, "recall": 0.2553, "f1": 0.4068, "f2": 0.3, "mcc": 0.4028, "accuracy": 0.6759, "tp": 12, "fp": 0, "tn": 61, "fn": 35, "aleatoric_mean": 6e-06, "epistemic_mean": 1.2e-05, "confidence_mean": 1.0, "aleatoric_std": 2e-06, "epistemic_std": 4e-06}, {"fold": "fold_7", "regime": "Recent mixed/upturn", "sharpe": 2.0988, "sortino": 3.7076, "return_pct": 5.05, "equity": 1050.51, "max_dd": 2.27, "win_rate": 60.91, "profit_factor": 1.401, "ic": 0.601, "hit": 60.91, "n": 110, "precision": 1.0, "recall": 0.1887, "f1": 0.3175, "f2": 0.2252, "mcc": 0.3279, "accuracy": 0.6091, "tp": 10, "fp": 0, "tn": 57, "fn": 43, "aleatoric_mean": 7e-06, "epistemic_mean": 1.5e-05, "confidence_mean": 1.0, "aleatoric_std": 3e-06, "epistemic_std": 6e-06}], "train_sharpe": 6.0208, "train_psr": 1.0, "train_equity": 930215.19, "train_sortino": 16.6424, "train_return_pct": 92921.52, "train_max_dd": 5.01, "train_win_rate": 69.04, "train_profit_factor": 4.194, "train_ic": 0.6645, "train_hit": 68.77, "train_precision": 0.8215, "train_recall": 0.5094, "train_f1": 0.6289, "train_f2": 0.5513, "train_mcc": 0.4208, "train_accuracy": 0.6909, "train_per_window": [{"fold": "all_train", "regime": "Training data", "sharpe": 6.0208, "sortino": 16.6424, "return_pct": 92921.52, "equity": 930215.19, "max_dd": 5.01, "win_rate": 69.04, "profit_factor": 4.194, "ic": 0.6645, "hit": 68.77, "n": 2478, "precision": 0.8215, "recall": 0.5094, "f1": 0.6289, "f2": 0.5513, "mcc": 0.4208, "accuracy": 0.6909, "tp": 649, "fp": 141, "tn": 1063, "fn": 625}], "experiment_num": 144, "status": "DISCARD"}
