{"backbone": "mlp", "description": "mlp: Exp18 residual lr=5e-4 hd=0.15 REPRODUCE seed=42", "config": {"seq_len": 10, "lr": 0.0005, "batch_size": 32, "epochs": 50, "weight_decay": 1e-05, "patience": 10, "grad_clip": 1.0, "warmup_epochs": 0, "huber_delta": 1.0, "head_dropout": 0.15, "seed": 42, "het_loss": false}, "composite": 4.4068, "test_pos_folds": 6, "val_pos_folds": 5, "val_loss": 4.1e-05, "elapsed_sec": 12.9, "timestamp": "2026-04-14T16:07:37", "sharpe": 4.7068, "psr": 1.0, "equity": 6464.11, "sortino": 5.8522, "return_pct": 546.41, "max_dd": 7.54, "win_rate": 65.43, "profit_factor": 2.43, "ic": 0.4126, "hit": 65.16, "aleatoric_mean": 3.4e-05, "epistemic_mean": 6.8e-05, "confidence_mean": 0.9999, "per_window": [{"fold": "fold_1", "regime": "Pre-crisis upturn + GFC onset", "sharpe": 0.5758, "sortino": 0.6308, "return_pct": 3.78, "equity": 1037.75, "max_dd": 7.54, "win_rate": 52.94, "profit_factor": 1.146, "ic": 0.1207, "hit": 52.43, "n": 103, "aleatoric_mean": 6.9e-05, "epistemic_mean": 0.000139, "confidence_mean": 0.9998, "aleatoric_std": 8.3e-05, "epistemic_std": 0.000166}, {"fold": "fold_2", "regime": "Post-crash recovery", "sharpe": -0.0044, "sortino": -0.0071, "return_pct": -0.29, "equity": 997.08, "max_dd": 5.31, "win_rate": 54.21, "profit_factor": 0.999, "ic": 0.1266, "hit": 54.21, "n": 107, "aleatoric_mean": 2.7e-05, "epistemic_mean": 5.4e-05, "confidence_mean": 0.9999, "aleatoric_std": 1.7e-05, "epistemic_std": 3.4e-05}, {"fold": "fold_3", "regime": "Eurozone debt plateau", "sharpe": 6.368, "sortino": 12.965, "return_pct": 23.16, "equity": 1231.6, "max_dd": 2.22, "win_rate": 66.35, "profit_factor": 2.73, "ic": 0.4482, "hit": 65.09, "n": 106, "aleatoric_mean": 3.6e-05, "epistemic_mean": 7.2e-05, "confidence_mean": 0.9999, "aleatoric_std": 1.8e-05, "epistemic_std": 3.7e-05}, {"fold": "fold_4", "regime": "Strong USD downturn", "sharpe": 7.8117, "sortino": 14.8471, "return_pct": 71.75, "equity": 1717.54, "max_dd": 2.37, "win_rate": 71.86, "profit_factor": 3.862, "ic": 0.6229, "hit": 71.43, "n": 168, "aleatoric_mean": 4.7e-05, "epistemic_mean": 9.3e-05, "confidence_mean": 0.9999, "aleatoric_std": 3e-05, "epistemic_std": 5.9e-05}, {"fold": "fold_5", "regime": "Low-vol plateau", "sharpe": 7.3713, "sortino": 10.8554, "return_pct": 24.86, "equity": 1248.56, "max_dd": 1.32, "win_rate": 67.9, "profit_factor": 3.505, "ic": 0.4769, "hit": 67.9, "n": 162, "aleatoric_mean": 1.6e-05, "epistemic_mean": 3.2e-05, "confidence_mean": 1.0, "aleatoric_std": 1.3e-05, "epistemic_std": 2.5e-05}, {"fold": "fold_6", "regime": "EUR crisis downturn", "sharpe": 9.2272, "sortino": 18.4503, "return_pct": 64.78, "equity": 1647.79, "max_dd": 1.54, "win_rate": 69.7, "profit_factor": 4.626, "ic": 0.595, "hit": 69.7, "n": 165, "aleatoric_mean": 3.2e-05, "epistemic_mean": 6.4e-05, "confidence_mean": 0.9999, "aleatoric_std": 2.1e-05, "epistemic_std": 4.1e-05}, {"fold": "fold_7", "regime": "Recent mixed/upturn", "sharpe": 6.6185, "sortino": 12.4891, "return_pct": 43.55, "equity": 1435.48, "max_dd": 1.64, "win_rate": 66.67, "profit_factor": 3.132, "ic": 0.5276, "hit": 66.67, "n": 162, "aleatoric_mean": 2.1e-05, "epistemic_mean": 4.2e-05, "confidence_mean": 0.9999, "aleatoric_std": 1e-05, "epistemic_std": 2.1e-05}], "val_sharpe": 4.7601, "val_psr": 1.0, "val_equity": 2926.15, "val_sortino": 7.3615, "val_return_pct": 192.61, "val_max_dd": 13.12, "val_win_rate": 62.25, "val_profit_factor": 2.253, "val_ic": 0.4153, "val_hit": 61.85, "val_aleatoric_mean": 2.1e-05, "val_epistemic_mean": 4.1e-05, "val_confidence_mean": 0.9999, "val_per_window": [{"fold": "fold_1", "regime": "Pre-crisis upturn + GFC onset", "sharpe": -0.5639, "sortino": -0.8871, "return_pct": -1.49, "equity": 985.14, "max_dd": 6.28, "win_rate": 46.3, "profit_factor": 0.911, "ic": 0.0029, "hit": 45.87, "n": 109, "aleatoric_mean": 1.9e-05, "epistemic_mean": 3.8e-05, "confidence_mean": 0.9999, "aleatoric_std": 2.2e-05, "epistemic_std": 4.5e-05}, {"fold": "fold_2", "regime": "Post-crash recovery", "sharpe": -1.8792, "sortino": -3.0212, "return_pct": -8.91, "equity": 910.85, "max_dd": 13.12, "win_rate": 39.81, "profit_factor": 0.743, "ic": -0.0621, "hit": 39.81, "n": 108, "aleatoric_mean": 3.9e-05, "epistemic_mean": 7.8e-05, "confidence_mean": 0.9999, "aleatoric_std": 4.3e-05, "epistemic_std": 8.5e-05}, {"fold": "fold_3", "regime": "Eurozone debt plateau", "sharpe": 9.2674, "sortino": 22.1248, "return_pct": 37.98, "equity": 1379.76, "max_dd": 1.3, "win_rate": 71.56, "profit_factor": 4.701, "ic": 0.6433, "hit": 70.27, "n": 111, "aleatoric_mean": 2.6e-05, "epistemic_mean": 5.2e-05, "confidence_mean": 0.9999, "aleatoric_std": 1.6e-05, "epistemic_std": 3.2e-05}, {"fold": "fold_4", "regime": "Strong USD downturn", "sharpe": 6.3359, "sortino": 13.7393, "return_pct": 22.53, "equity": 1225.27, "max_dd": 1.51, "win_rate": 64.22, "profit_factor": 2.895, "ic": 0.5217, "hit": 63.64, "n": 110, "aleatoric_mean": 1.9e-05, "epistemic_mean": 3.9e-05, "confidence_mean": 0.9999, "aleatoric_std": 1.7e-05, "epistemic_std": 3.3e-05}, {"fold": "fold_5", "regime": "Low-vol plateau", "sharpe": 8.5898, "sortino": 20.628, "return_pct": 28.52, "equity": 1285.24, "max_dd": 1.12, "win_rate": 66.07, "profit_factor": 4.37, "ic": 0.5953, "hit": 66.07, "n": 112, "aleatoric_mean": 1.8e-05, "epistemic_mean": 3.5e-05, "confidence_mean": 0.9999, "aleatoric_std": 1.1e-05, "epistemic_std": 2.1e-05}, {"fold": "fold_6", "regime": "EUR crisis downturn", "sharpe": 11.5516, "sortino": 25.1989, "return_pct": 23.78, "equity": 1237.78, "max_dd": 0.77, "win_rate": 78.5, "profit_factor": 8.333, "ic": 0.7673, "hit": 77.78, "n": 108, "aleatoric_mean": 1.1e-05, "epistemic_mean": 2.1e-05, "confidence_mean": 1.0, "aleatoric_std": 4e-06, "epistemic_std": 8e-06}, {"fold": "fold_7", "regime": "Recent mixed/upturn", "sharpe": 9.3495, "sortino": 23.9674, "return_pct": 21.25, "equity": 1212.51, "max_dd": 0.55, "win_rate": 69.09, "profit_factor": 4.671, "ic": 0.6567, "hit": 69.09, "n": 110, "aleatoric_mean": 1.3e-05, "epistemic_mean": 2.5e-05, "confidence_mean": 1.0, "aleatoric_std": 7e-06, "epistemic_std": 1.5e-05}], "train_sharpe": 7.5681, "train_psr": 1.0, "train_equity": 4066406.75, "train_sortino": 21.8658, "train_return_pct": 406540.67, "train_max_dd": 3.89, "train_win_rate": 75.93, "train_profit_factor": 6.881, "train_ic": 0.7261, "train_hit": 75.63, "train_per_window": [{"fold": "all_train", "regime": "Training data", "sharpe": 7.5681, "sortino": 21.8658, "return_pct": 406540.67, "equity": 4066406.75, "max_dd": 3.89, "win_rate": 75.93, "profit_factor": 6.881, "ic": 0.7261, "hit": 75.63, "n": 2478}], "experiment_num": 74, "status": "DISCARD"}
{"backbone": "mlp", "description": "mlp: Exp19 residual lr=5e-4 hd=0.15 seed=99", "config": {"seq_len": 10, "lr": 0.0005, "batch_size": 32, "epochs": 50, "weight_decay": 1e-05, "patience": 10, "grad_clip": 1.0, "warmup_epochs": 0, "huber_delta": 1.0, "head_dropout": 0.15, "seed": 99, "het_loss": false}, "composite": 4.4045, "test_pos_folds": 6, "val_pos_folds": 5, "val_loss": 3.9e-05, "elapsed_sec": 33.7, "timestamp": "2026-04-14T16:13:20", "sharpe": 4.7045, "psr": 1.0, "equity": 6458.55, "sortino": 5.7525, "return_pct": 545.86, "max_dd": 11.01, "win_rate": 66.56, "profit_factor": 2.428, "ic": 0.4154, "hit": 66.29, "aleatoric_mean": 3e-05, "epistemic_mean": 6.1e-05, "confidence_mean": 0.9999, "per_window": [{"fold": "fold_1", "regime": "Pre-crisis upturn + GFC onset", "sharpe": -0.9958, "sortino": -1.1033, "return_pct": -8.06, "equity": 919.44, "max_dd": 11.01, "win_rate": 50.98, "profit_factor": 0.79, "ic": -0.0979, "hit": 50.49, "n": 103, "aleatoric_mean": 6e-05, "epistemic_mean": 0.000121, "confidence_mean": 0.9998, "aleatoric_std": 8.1e-05, "epistemic_std": 0.000162}, {"fold": "fold_2", "regime": "Post-crash recovery", "sharpe": 1.7647, "sortino": 2.8566, "return_pct": 8.49, "equity": 1084.89, "max_dd": 6.43, "win_rate": 58.88, "profit_factor": 1.319, "ic": 0.1143, "hit": 58.88, "n": 107, "aleatoric_mean": 2.1e-05, "epistemic_mean": 4.1e-05, "confidence_mean": 0.9999, "aleatoric_std": 1.3e-05, "epistemic_std": 2.6e-05}, {"fold": "fold_3", "regime": "Eurozone debt plateau", "sharpe": 5.1753, "sortino": 10.1395, "return_pct": 18.91, "equity": 1189.08, "max_dd": 1.87, "win_rate": 65.38, "profit_factor": 2.258, "ic": 0.425, "hit": 64.15, "n": 106, "aleatoric_mean": 2.9e-05, "epistemic_mean": 5.7e-05, "confidence_mean": 0.9999, "aleatoric_std": 1.5e-05, "epistemic_std": 3e-05}, {"fold": "fold_4", "regime": "Strong USD downturn", "sharpe": 9.0313, "sortino": 18.4791, "return_pct": 83.37, "equity": 1833.68, "max_dd": 1.83, "win_rate": 73.05, "profit_factor": 4.869, "ic": 0.6327, "hit": 72.62, "n": 168, "aleatoric_mean": 4.7e-05, "epistemic_mean": 9.3e-05, "confidence_mean": 0.9999, "aleatoric_std": 3.4e-05, "epistemic_std": 6.8e-05}, {"fold": "fold_5", "regime": "Low-vol plateau", "sharpe": 6.9239, "sortino": 9.3614, "return_pct": 23.45, "equity": 1234.52, "max_dd": 1.55, "win_rate": 68.52, "profit_factor": 3.236, "ic": 0.5578, "hit": 68.52, "n": 162, "aleatoric_mean": 1.6e-05, "epistemic_mean": 3.3e-05, "confidence_mean": 1.0, "aleatoric_std": 9e-06, "epistemic_std": 1.8e-05}, {"fold": "fold_6", "regime": "EUR crisis downturn", "sharpe": 8.7068, "sortino": 18.092, "return_pct": 61.25, "equity": 1612.53, "max_dd": 1.88, "win_rate": 69.7, "profit_factor": 4.219, "ic": 0.6418, "hit": 69.7, "n": 165, "aleatoric_mean": 3e-05, "epistemic_mean": 5.9e-05, "confidence_mean": 0.9999, "aleatoric_std": 2.2e-05, "epistemic_std": 4.4e-05}, {"fold": "fold_7", "regime": "Recent mixed/upturn", "sharpe": 7.4623, "sortino": 13.5486, "return_pct": 49.17, "equity": 1491.72, "max_dd": 1.67, "win_rate": 70.37, "profit_factor": 3.656, "ic": 0.595, "hit": 70.37, "n": 162, "aleatoric_mean": 1.7e-05, "epistemic_mean": 3.4e-05, "confidence_mean": 0.9999, "aleatoric_std": 1e-05, "epistemic_std": 2.1e-05}], "val_sharpe": 5.7572, "val_psr": 1.0, "val_equity": 3583.11, "val_sortino": 8.5027, "val_return_pct": 258.31, "val_max_dd": 11.47, "val_win_rate": 66.97, "val_profit_factor": 2.685, "val_ic": 0.4558, "val_hit": 66.54, "val_aleatoric_mean": 1.8e-05, "val_epistemic_mean": 3.5e-05, "val_confidence_mean": 0.9999, "val_per_window": [{"fold": "fold_1", "regime": "Pre-crisis upturn + GFC onset", "sharpe": -0.5979, "sortino": -1.1233, "return_pct": -1.57, "equity": 984.3, "max_dd": 6.09, "win_rate": 42.59, "profit_factor": 0.906, "ic": -0.0396, "hit": 42.2, "n": 109, "aleatoric_mean": 1.6e-05, "epistemic_mean": 3.2e-05, "confidence_mean": 1.0, "aleatoric_std": 1.6e-05, "epistemic_std": 3.3e-05}, {"fold": "fold_2", "regime": "Post-crash recovery", "sharpe": -1.2708, "sortino": -1.9403, "return_pct": -6.22, "equity": 937.75, "max_dd": 11.45, "win_rate": 46.3, "profit_factor": 0.818, "ic": -0.117, "hit": 46.3, "n": 108, "aleatoric_mean": 2.9e-05, "epistemic_mean": 5.9e-05, "confidence_mean": 0.9999, "aleatoric_std": 2.5e-05, "epistemic_std": 5e-05}, {"fold": "fold_3", "regime": "Eurozone debt plateau", "sharpe": 10.7472, "sortino": 24.3525, "return_pct": 43.07, "equity": 1430.69, "max_dd": 0.78, "win_rate": 72.48, "profit_factor": 6.191, "ic": 0.6885, "hit": 71.17, "n": 111, "aleatoric_mean": 2.3e-05, "epistemic_mean": 4.5e-05, "confidence_mean": 0.9999, "aleatoric_std": 1.3e-05, "epistemic_std": 2.7e-05}, {"fold": "fold_4", "regime": "Strong USD downturn", "sharpe": 10.7346, "sortino": 26.4906, "return_pct": 36.03, "equity": 1360.31, "max_dd": 0.64, "win_rate": 77.06, "profit_factor": 6.556, "ic": 0.6956, "hit": 76.36, "n": 110, "aleatoric_mean": 1.7e-05, "epistemic_mean": 3.4e-05, "confidence_mean": 0.9999, "aleatoric_std": 1.4e-05, "epistemic_std": 2.9e-05}, {"fold": "fold_5", "regime": "Low-vol plateau", "sharpe": 10.1157, "sortino": 28.8765, "return_pct": 32.78, "equity": 1327.81, "max_dd": 0.54, "win_rate": 75.0, "profit_factor": 5.865, "ic": 0.6939, "hit": 75.0, "n": 112, "aleatoric_mean": 1.9e-05, "epistemic_mean": 3.7e-05, "confidence_mean": 0.9999, "aleatoric_std": 1.4e-05, "epistemic_std": 2.9e-05}, {"fold": "fold_6", "regime": "EUR crisis downturn", "sharpe": 11.1806, "sortino": 26.3802, "return_pct": 23.21, "equity": 1232.14, "max_dd": 0.77, "win_rate": 77.57, "profit_factor": 7.656, "ic": 0.7171, "hit": 76.85, "n": 108, "aleatoric_mean": 1e-05, "epistemic_mean": 2.1e-05, "confidence_mean": 1.0, "aleatoric_std": 4e-06, "epistemic_std": 8e-06}, {"fold": "fold_7", "regime": "Recent mixed/upturn", "sharpe": 9.7119, "sortino": 20.4098, "return_pct": 21.92, "equity": 1219.17, "max_dd": 0.75, "win_rate": 77.27, "profit_factor": 4.982, "ic": 0.6611, "hit": 77.27, "n": 110, "aleatoric_mean": 1e-05, "epistemic_mean": 2e-05, "confidence_mean": 1.0, "aleatoric_std": 6e-06, "epistemic_std": 1.1e-05}], "train_sharpe": 7.7387, "train_psr": 1.0, "train_equity": 4739120.5, "train_sortino": 22.3186, "train_return_pct": 473812.05, "train_max_dd": 4.66, "train_win_rate": 77.59, "train_profit_factor": 7.328, "train_ic": 0.7321, "train_hit": 77.28, "train_per_window": [{"fold": "all_train", "regime": "Training data", "sharpe": 7.7387, "sortino": 22.3186, "return_pct": 473812.05, "equity": 4739120.5, "max_dd": 4.66, "win_rate": 77.59, "profit_factor": 7.328, "ic": 0.7321, "hit": 77.28, "n": 2478}], "experiment_num": 75, "status": "DISCARD"}
{"backbone": "mlp", "description": "mlp: Exp20 residual lr=7e-4 push higher (Smith2018) seed=0", "config": {"seq_len": 10, "lr": 0.0007, "batch_size": 32, "epochs": 50, "weight_decay": 1e-05, "patience": 10, "grad_clip": 1.0, "warmup_epochs": 0, "huber_delta": 1.0, "head_dropout": 0.15, "seed": 0, "het_loss": false}, "composite": 4.8198, "test_pos_folds": 7, "val_pos_folds": 7, "val_loss": 3.8e-05, "elapsed_sec": 20.4, "timestamp": "2026-04-14T16:14:04", "sharpe": 4.9909, "psr": 1.0, "equity": 7174.82, "sortino": 9.3924, "return_pct": 617.48, "max_dd": 5.97, "win_rate": 64.29, "profit_factor": 2.57, "ic": 0.4084, "hit": 64.03, "aleatoric_mean": 3.4e-05, "epistemic_mean": 6.7e-05, "confidence_mean": 0.9999, "per_window": [{"fold": "fold_1", "regime": "Pre-crisis upturn + GFC onset", "sharpe": 3.3606, "sortino": 9.2657, "return_pct": 27.96, "equity": 1279.62, "max_dd": 4.18, "win_rate": 62.75, "profit_factor": 2.268, "ic": 0.1731, "hit": 62.14, "n": 103, "aleatoric_mean": 6e-05, "epistemic_mean": 0.000121, "confidence_mean": 0.9998, "aleatoric_std": 8e-05, "epistemic_std": 0.000161}, {"fold": "fold_2", "regime": "Post-crash recovery", "sharpe": 1.0927, "sortino": 2.1514, "return_pct": 5.09, "equity": 1050.87, "max_dd": 5.97, "win_rate": 54.21, "profit_factor": 1.187, "ic": 0.0844, "hit": 54.21, "n": 107, "aleatoric_mean": 2.4e-05, "epistemic_mean": 4.8e-05, "confidence_mean": 0.9999, "aleatoric_std": 1.2e-05, "epistemic_std": 2.3e-05}, {"fold": "fold_3", "regime": "Eurozone debt plateau", "sharpe": 4.262, "sortino": 6.8681, "return_pct": 15.56, "equity": 1155.61, "max_dd": 2.19, "win_rate": 62.5, "profit_factor": 1.954, "ic": 0.4454, "hit": 61.32, "n": 106, "aleatoric_mean": 3.8e-05, "epistemic_mean": 7.6e-05, "confidence_mean": 0.9999, "aleatoric_std": 2.3e-05, "epistemic_std": 4.5e-05}, {"fold": "fold_4", "regime": "Strong USD downturn", "sharpe": 8.6101, "sortino": 16.1054, "return_pct": 79.4, "equity": 1793.97, "max_dd": 1.81, "win_rate": 73.65, "profit_factor": 4.489, "ic": 0.5969, "hit": 73.21, "n": 168, "aleatoric_mean": 4.8e-05, "epistemic_mean": 9.5e-05, "confidence_mean": 0.9999, "aleatoric_std": 3.2e-05, "epistemic_std": 6.3e-05}, {"fold": "fold_5", "regime": "Low-vol plateau", "sharpe": 6.1362, "sortino": 9.3401, "return_pct": 20.91, "equity": 1209.15, "max_dd": 1.79, "win_rate": 61.73, "profit_factor": 2.817, "ic": 0.4981, "hit": 61.73, "n": 162, "aleatoric_mean": 1.9e-05, "epistemic_mean": 3.7e-05, "confidence_mean": 0.9999, "aleatoric_std": 1e-05, "epistemic_std": 1.9e-05}, {"fold": "fold_6", "regime": "EUR crisis downturn", "sharpe": 6.0473, "sortino": 9.9915, "return_pct": 42.32, "equity": 1423.21, "max_dd": 3.35, "win_rate": 64.85, "profit_factor": 2.68, "ic": 0.5358, "hit": 64.85, "n": 165, "aleatoric_mean": 3.3e-05, "epistemic_mean": 6.6e-05, "confidence_mean": 0.9999, "aleatoric_std": 2.4e-05, "epistemic_std": 4.9e-05}, {"fold": "fold_7", "regime": "Recent mixed/upturn", "sharpe": 7.5205, "sortino": 15.2672, "return_pct": 49.56, "equity": 1495.56, "max_dd": 1.76, "win_rate": 65.43, "profit_factor": 3.696, "ic": 0.512, "hit": 65.43, "n": 162, "aleatoric_mean": 2.1e-05, "epistemic_mean": 4.2e-05, "confidence_mean": 0.9999, "aleatoric_std": 1.4e-05, "epistemic_std": 2.8e-05}], "val_sharpe": 4.8198, "val_psr": 1.0, "val_equity": 2962.81, "val_sortino": 7.7875, "val_return_pct": 196.28, "val_max_dd": 6.77, "val_win_rate": 62.12, "val_profit_factor": 2.276, "val_ic": 0.3959, "val_hit": 61.72, "val_aleatoric_mean": 2e-05, "val_epistemic_mean": 4.1e-05, "val_confidence_mean": 0.9999, "val_per_window": [{"fold": "fold_1", "regime": "Pre-crisis upturn + GFC onset", "sharpe": 0.1113, "sortino": 0.1631, "return_pct": 0.21, "equity": 1002.08, "max_dd": 2.7, "win_rate": 48.15, "profit_factor": 1.019, "ic": 0.0136, "hit": 47.71, "n": 109, "aleatoric_mean": 2e-05, "epistemic_mean": 4e-05, "confidence_mean": 0.9999, "aleatoric_std": 2.1e-05, "epistemic_std": 4.3e-05}, {"fold": "fold_2", "regime": "Post-crash recovery", "sharpe": 0.8347, "sortino": 1.3734, "return_pct": 3.84, "equity": 1038.44, "max_dd": 6.77, "win_rate": 52.78, "profit_factor": 1.141, "ic": 0.1844, "hit": 52.78, "n": 108, "aleatoric_mean": 3.6e-05, "epistemic_mean": 7.2e-05, "confidence_mean": 0.9999, "aleatoric_std": 2.5e-05, "epistemic_std": 5e-05}, {"fold": "fold_3", "regime": "Eurozone debt plateau", "sharpe": 6.74, "sortino": 14.3776, "return_pct": 28.29, "equity": 1282.89, "max_dd": 1.94, "win_rate": 66.97, "profit_factor": 3.026, "ic": 0.5652, "hit": 65.77, "n": 111, "aleatoric_mean": 2.4e-05, "epistemic_mean": 4.8e-05, "confidence_mean": 0.9999, "aleatoric_std": 1.3e-05, "epistemic_std": 2.7e-05}, {"fold": "fold_4", "regime": "Strong USD downturn", "sharpe": 6.8624, "sortino": 15.897, "return_pct": 24.3, "equity": 1243.05, "max_dd": 1.41, "win_rate": 65.14, "profit_factor": 3.174, "ic": 0.525, "hit": 64.55, "n": 110, "aleatoric_mean": 2e-05, "epistemic_mean": 4.1e-05, "confidence_mean": 0.9999, "aleatoric_std": 1.6e-05, "epistemic_std": 3.3e-05}, {"fold": "fold_5", "regime": "Low-vol plateau", "sharpe": 10.2814, "sortino": 22.7442, "return_pct": 33.22, "equity": 1332.2, "max_dd": 1.21, "win_rate": 73.21, "profit_factor": 6.064, "ic": 0.6998, "hit": 73.21, "n": 112, "aleatoric_mean": 1.8e-05, "epistemic_mean": 3.6e-05, "confidence_mean": 0.9999, "aleatoric_std": 1.1e-05, "epistemic_std": 2.2e-05}, {"fold": "fold_6", "regime": "EUR crisis downturn", "sharpe": 8.7962, "sortino": 20.4659, "return_pct": 19.2, "equity": 1191.97, "max_dd": 0.82, "win_rate": 70.09, "profit_factor": 4.669, "ic": 0.662, "hit": 69.44, "n": 108, "aleatoric_mean": 1.1e-05, "epistemic_mean": 2.2e-05, "confidence_mean": 1.0, "aleatoric_std": 4e-06, "epistemic_std": 9e-06}, {"fold": "fold_7", "regime": "Recent mixed/upturn", "sharpe": 5.1649, "sortino": 12.6922, "return_pct": 12.44, "equity": 1124.36, "max_dd": 1.23, "win_rate": 58.18, "profit_factor": 2.304, "ic": 0.3548, "hit": 58.18, "n": 110, "aleatoric_mean": 1.3e-05, "epistemic_mean": 2.6e-05, "confidence_mean": 1.0, "aleatoric_std": 1e-05, "epistemic_std": 2e-05}], "train_sharpe": 6.5018, "train_psr": 1.0, "train_equity": 1496048.62, "train_sortino": 17.3677, "train_return_pct": 149504.86, "train_max_dd": 3.72, "train_win_rate": 71.84, "train_profit_factor": 4.835, "train_ic": 0.6275, "train_hit": 71.55, "train_per_window": [{"fold": "all_train", "regime": "Training data", "sharpe": 6.5018, "sortino": 17.3677, "return_pct": 149504.86, "equity": 1496048.62, "max_dd": 3.72, "win_rate": 71.84, "profit_factor": 4.835, "ic": 0.6275, "hit": 71.55, "n": 2478}], "experiment_num": 76, "status": "DISCARD"}
