{"backbone": "lfm2-350m", "description": "H-Exp10: lr=4e-5 ep=30 higher peak LR", "config": {"seq_len": 60, "lr": 4e-05, "batch_size": 32, "epochs": 30, "weight_decay": 1e-05, "patience": 8, "grad_clip": 1.0, "warmup_epochs": 0, "huber_delta": 1.0, "head_dropout": 0.1}, "composite": -0.4658, "test_pos_folds": 5, "val_pos_folds": 3, "val_loss": -1.793993, "elapsed_sec": 402.8, "timestamp": "2026-04-12T09:47:17", "sharpe": 0.1342, "psr": 0.5834, "equity": 1020.5, "sortino": 0.2031, "return_pct": 2.05, "max_dd": 11.64, "win_rate": 50.24, "profit_factor": 1.023, "ic": 0.0168, "hit": 49.92, "aleatoric_mean": 0.045382, "epistemic_mean": 0.006208, "confidence_mean": 0.9526, "per_window": [{"fold": "fold_1", "regime": "Pre-crisis upturn + GFC onset", "sharpe": -4.7555, "sortino": -8.3519, "return_pct": -9.28, "equity": 907.15, "max_dd": 11.03, "win_rate": 38.46, "profit_factor": 0.482, "ic": -0.2961, "hit": 37.74, "n": 53, "aleatoric_mean": 0.086196, "epistemic_mean": 0.005286, "confidence_mean": 0.9178, "aleatoric_std": 0.048559, "epistemic_std": 0.002168}, {"fold": "fold_2", "regime": "Post-crash recovery", "sharpe": 0.7546, "sortino": 1.416, "return_pct": 1.99, "equity": 1019.94, "max_dd": 3.13, "win_rate": 45.61, "profit_factor": 1.129, "ic": 0.0025, "hit": 45.61, "n": 57, "aleatoric_mean": 0.076821, "epistemic_mean": 0.006436, "confidence_mean": 0.9251, "aleatoric_std": 0.052517, "epistemic_std": 0.002208}, {"fold": "fold_3", "regime": "Eurozone debt plateau", "sharpe": 1.3081, "sortino": 2.8386, "return_pct": 2.27, "equity": 1022.68, "max_dd": 1.57, "win_rate": 48.15, "profit_factor": 1.232, "ic": 0.0748, "hit": 46.43, "n": 56, "aleatoric_mean": 0.062433, "epistemic_mean": 0.005822, "confidence_mean": 0.9373, "aleatoric_std": 0.040271, "epistemic_std": 0.002768}, {"fold": "fold_4", "regime": "Strong USD downturn", "sharpe": 1.9022, "sortino": 2.7406, "return_pct": 9.73, "equity": 1097.28, "max_dd": 5.8, "win_rate": 55.56, "profit_factor": 1.376, "ic": 0.1556, "hit": 55.08, "n": 118, "aleatoric_mean": 0.039042, "epistemic_mean": 0.006008, "confidence_mean": 0.9583, "aleatoric_std": 0.044728, "epistemic_std": 0.002639}, {"fold": "fold_5", "regime": "Low-vol plateau", "sharpe": 1.736, "sortino": 3.3784, "return_pct": 3.91, "equity": 1039.06, "max_dd": 2.94, "win_rate": 51.79, "profit_factor": 1.335, "ic": 0.0909, "hit": 51.79, "n": 112, "aleatoric_mean": 0.014549, "epistemic_mean": 0.007015, "confidence_mean": 0.9791, "aleatoric_std": 0.015238, "epistemic_std": 0.002626}, {"fold": "fold_6", "regime": "EUR crisis downturn", "sharpe": 0.2273, "sortino": 0.3689, "return_pct": 0.8, "equity": 1008.05, "max_dd": 7.44, "win_rate": 53.04, "profit_factor": 1.037, "ic": 0.0312, "hit": 53.04, "n": 115, "aleatoric_mean": 0.065368, "epistemic_mean": 0.005769, "confidence_mean": 0.9353, "aleatoric_std": 0.048452, "epistemic_std": 0.002286}, {"fold": "fold_7", "regime": "Recent mixed/upturn", "sharpe": -1.4973, "sortino": -1.9451, "return_pct": -6.16, "equity": 938.39, "max_dd": 6.69, "win_rate": 49.11, "profit_factor": 0.774, "ic": 0.0488, "hit": 49.11, "n": 112, "aleatoric_mean": 0.018536, "epistemic_mean": 0.006578, "confidence_mean": 0.9761, "aleatoric_std": 0.02885, "epistemic_std": 0.002361}], "val_sharpe": 0.2957, "val_psr": 0.6477, "val_equity": 1032.82, "val_sortino": 0.4141, "val_return_pct": 3.28, "val_max_dd": 9.33, "val_win_rate": 54.57, "val_profit_factor": 1.051, "val_ic": 0.0132, "val_hit": 54.31, "val_aleatoric_mean": 0.047048, "val_epistemic_mean": 0.006355, "val_confidence_mean": 0.9534, "val_per_window": [{"fold": "fold_1", "regime": "Pre-crisis upturn + GFC onset", "sharpe": 0.7409, "sortino": 1.1512, "return_pct": 1.13, "equity": 1011.26, "max_dd": 2.18, "win_rate": 55.17, "profit_factor": 1.13, "ic": -0.0694, "hit": 54.24, "n": 59, "aleatoric_mean": 0.156905, "epistemic_mean": 0.005431, "confidence_mean": 0.8735, "aleatoric_std": 0.15012, "epistemic_std": 0.002677}, {"fold": "fold_2", "regime": "Post-crash recovery", "sharpe": -2.5838, "sortino": -3.5747, "return_pct": -4.96, "equity": 950.4, "max_dd": 9.33, "win_rate": 51.72, "profit_factor": 0.658, "ic": -0.0419, "hit": 51.72, "n": 58, "aleatoric_mean": 0.065068, "epistemic_mean": 0.005734, "confidence_mean": 0.9347, "aleatoric_std": 0.033644, "epistemic_std": 0.002608}, {"fold": "fold_3", "regime": "Eurozone debt plateau", "sharpe": 3.9602, "sortino": 5.1907, "return_pct": 9.38, "equity": 1093.8, "max_dd": 2.63, "win_rate": 67.21, "profit_factor": 1.942, "ic": 0.3743, "hit": 67.21, "n": 61, "aleatoric_mean": 0.023871, "epistemic_mean": 0.007343, "confidence_mean": 0.97, "aleatoric_std": 0.017029, "epistemic_std": 0.003031}, {"fold": "fold_4", "regime": "Strong USD downturn", "sharpe": -1.2217, "sortino": -1.9395, "return_pct": -2.73, "equity": 972.7, "max_dd": 4.88, "win_rate": 56.67, "profit_factor": 0.829, "ic": -0.052, "hit": 56.67, "n": 60, "aleatoric_mean": 0.03401, "epistemic_mean": 0.006057, "confidence_mean": 0.9627, "aleatoric_std": 0.04024, "epistemic_std": 0.002209}, {"fold": "fold_5", "regime": "Low-vol plateau", "sharpe": 2.539, "sortino": 3.5611, "return_pct": 4.39, "equity": 1043.87, "max_dd": 3.35, "win_rate": 61.29, "profit_factor": 1.51, "ic": 0.1302, "hit": 61.29, "n": 62, "aleatoric_mean": 0.014391, "epistemic_mean": 0.007433, "confidence_mean": 0.9787, "aleatoric_std": 0.010127, "epistemic_std": 0.002772}, {"fold": "fold_6", "regime": "EUR crisis downturn", "sharpe": -2.609, "sortino": -3.553, "return_pct": -2.67, "equity": 973.26, "max_dd": 3.25, "win_rate": 42.11, "profit_factor": 0.652, "ic": -0.0612, "hit": 41.38, "n": 58, "aleatoric_mean": 0.011938, "epistemic_mean": 0.006534, "confidence_mean": 0.9819, "aleatoric_std": 0.008209, "epistemic_std": 0.002714}, {"fold": "fold_7", "regime": "Recent mixed/upturn", "sharpe": -0.4297, "sortino": -0.7891, "return_pct": -0.58, "equity": 994.18, "max_dd": 3.96, "win_rate": 46.67, "profit_factor": 0.932, "ic": -0.1008, "hit": 46.67, "n": 60, "aleatoric_mean": 0.025892, "epistemic_mean": 0.00587, "confidence_mean": 0.9697, "aleatoric_std": 0.024631, "epistemic_std": 0.001617}], "train_sharpe": 1.2535, "train_psr": 0.9982, "train_equity": 2331.22, "train_sortino": 1.6666, "train_return_pct": 133.12, "train_max_dd": 13.35, "train_win_rate": 53.09, "train_profit_factor": 1.336, "train_ic": 0.1353, "train_hit": 52.82, "train_per_window": [{"fold": "all_train", "regime": "Training data", "sharpe": 1.2535, "sortino": 1.6666, "return_pct": 133.12, "equity": 2331.22, "max_dd": 13.35, "win_rate": 53.09, "profit_factor": 1.336, "ic": 0.1353, "hit": 52.82, "n": 1382}], "experiment_num": 32, "status": "DISCARD"}
{"backbone": "lfm2-350m", "description": "H-Exp11: logvar clamp [-6,2] Stirn2023 fix", "config": {"seq_len": 60, "lr": 3e-05, "batch_size": 32, "epochs": 30, "weight_decay": 1e-05, "patience": 8, "grad_clip": 1.0, "warmup_epochs": 0, "huber_delta": 1.0, "head_dropout": 0.1}, "composite": -0.3128, "test_pos_folds": 4, "val_pos_folds": 5, "val_loss": -1.674173, "elapsed_sec": 400.7, "timestamp": "2026-04-12T09:54:36", "sharpe": 0.2278, "psr": 0.6398, "equity": 1043.08, "sortino": 0.3463, "return_pct": 4.31, "max_dd": 14.24, "win_rate": 48.79, "profit_factor": 1.039, "ic": 0.0391, "hit": 48.48, "aleatoric_mean": 0.060941, "epistemic_mean": 0.008089, "confidence_mean": 0.9383, "per_window": [{"fold": "fold_1", "regime": "Pre-crisis upturn + GFC onset", "sharpe": -0.2095, "sortino": -0.3657, "return_pct": -0.55, "equity": 994.52, "max_dd": 4.02, "win_rate": 46.15, "profit_factor": 0.968, "ic": 0.0043, "hit": 45.28, "n": 53, "aleatoric_mean": 0.129243, "epistemic_mean": 0.007692, "confidence_mean": 0.8827, "aleatoric_std": 0.070703, "epistemic_std": 0.003111}, {"fold": "fold_2", "regime": "Post-crash recovery", "sharpe": -0.0466, "sortino": -0.0722, "return_pct": -0.31, "equity": 996.86, "max_dd": 6.7, "win_rate": 45.61, "profit_factor": 0.993, "ic": -0.0128, "hit": 45.61, "n": 57, "aleatoric_mean": 0.128717, "epistemic_mean": 0.007732, "confidence_mean": 0.8855, "aleatoric_std": 0.095374, "epistemic_std": 0.003141}, {"fold": "fold_3", "regime": "Eurozone debt plateau", "sharpe": 0.3171, "sortino": 0.5829, "return_pct": 0.49, "equity": 1004.93, "max_dd": 2.96, "win_rate": 48.15, "profit_factor": 1.052, "ic": 0.1066, "hit": 46.43, "n": 56, "aleatoric_mean": 0.081074, "epistemic_mean": 0.007311, "confidence_mean": 0.9206, "aleatoric_std": 0.05129, "epistemic_std": 0.002989}, {"fold": "fold_4", "regime": "Strong USD downturn", "sharpe": -2.4764, "sortino": -4.0829, "return_pct": -11.89, "equity": 881.14, "max_dd": 11.91, "win_rate": 41.03, "profit_factor": 0.66, "ic": -0.1988, "hit": 40.68, "n": 118, "aleatoric_mean": 0.04464, "epistemic_mean": 0.009478, "confidence_mean": 0.9498, "aleatoric_std": 0.038551, "epistemic_std": 0.00377}, {"fold": "fold_5", "regime": "Low-vol plateau", "sharpe": 1.072, "sortino": 1.4371, "return_pct": 2.38, "equity": 1023.81, "max_dd": 2.72, "win_rate": 56.25, "profit_factor": 1.195, "ic": 0.0877, "hit": 56.25, "n": 112, "aleatoric_mean": 0.019293, "epistemic_mean": 0.009335, "confidence_mean": 0.9725, "aleatoric_std": 0.019713, "epistemic_std": 0.003863}, {"fold": "fold_6", "regime": "EUR crisis downturn", "sharpe": 2.5613, "sortino": 4.7634, "return_pct": 11.82, "equity": 1118.2, "max_dd": 3.42, "win_rate": 47.83, "profit_factor": 1.5, "ic": 0.176, "hit": 47.83, "n": 115, "aleatoric_mean": 0.074271, "epistemic_mean": 0.006195, "confidence_mean": 0.9279, "aleatoric_std": 0.058016, "epistemic_std": 0.002621}, {"fold": "fold_7", "regime": "Recent mixed/upturn", "sharpe": 0.9472, "sortino": 1.2284, "return_pct": 3.79, "equity": 1037.88, "max_dd": 4.88, "win_rate": 53.57, "profit_factor": 1.176, "ic": 0.128, "hit": 53.57, "n": 112, "aleatoric_mean": 0.029193, "epistemic_mean": 0.008085, "confidence_mean": 0.9649, "aleatoric_std": 0.032718, "epistemic_std": 0.00317}], "val_sharpe": 0.1872, "val_psr": 0.595, "val_equity": 1018.89, "val_sortino": 0.2717, "val_return_pct": 1.89, "val_max_dd": 11.46, "val_win_rate": 51.2, "val_profit_factor": 1.032, "val_ic": 0.0341, "val_hit": 50.96, "val_aleatoric_mean": 0.067361, "val_epistemic_mean": 0.00814, "val_confidence_mean": 0.9367, "val_per_window": [{"fold": "fold_1", "regime": "Pre-crisis upturn + GFC onset", "sharpe": 0.6446, "sortino": 1.1727, "return_pct": 0.97, "equity": 1009.72, "max_dd": 2.86, "win_rate": 46.55, "profit_factor": 1.112, "ic": 0.0402, "hit": 45.76, "n": 59, "aleatoric_mean": 0.212356, "epistemic_mean": 0.005382, "confidence_mean": 0.8414, "aleatoric_std": 0.200139, "epistemic_std": 0.002983}, {"fold": "fold_2", "regime": "Post-crash recovery", "sharpe": -3.0744, "sortino": -4.5403, "return_pct": -5.83, "equity": 941.71, "max_dd": 6.9, "win_rate": 37.93, "profit_factor": 0.608, "ic": -0.2951, "hit": 37.93, "n": 58, "aleatoric_mean": 0.128409, "epistemic_mean": 0.006872, "confidence_mean": 0.8828, "aleatoric_std": 0.05499, "epistemic_std": 0.003038}, {"fold": "fold_3", "regime": "Eurozone debt plateau", "sharpe": -1.5508, "sortino": -2.0119, "return_pct": -3.69, "equity": 963.06, "max_dd": 6.22, "win_rate": 52.46, "profit_factor": 0.772, "ic": 0.0045, "hit": 52.46, "n": 61, "aleatoric_mean": 0.027772, "epistemic_mean": 0.010672, "confidence_mean": 0.9633, "aleatoric_std": 0.020061, "epistemic_std": 0.004586}, {"fold": "fold_4", "regime": "Strong USD downturn", "sharpe": 1.8072, "sortino": 4.042, "return_pct": 3.91, "equity": 1039.06, "max_dd": 2.18, "win_rate": 50.0, "profit_factor": 1.319, "ic": 0.0447, "hit": 50.0, "n": 60, "aleatoric_mean": 0.028534, "epistemic_mean": 0.009292, "confidence_mean": 0.964, "aleatoric_std": 0.022233, "epistemic_std": 0.003299}, {"fold": "fold_5", "regime": "Low-vol plateau", "sharpe": 2.6197, "sortino": 3.6791, "return_pct": 4.53, "equity": 1045.28, "max_dd": 2.36, "win_rate": 62.9, "profit_factor": 1.53, "ic": 0.2292, "hit": 62.9, "n": 62, "aleatoric_mean": 0.018434, "epistemic_mean": 0.008732, "confidence_mean": 0.9737, "aleatoric_std": 0.013296, "epistemic_std": 0.004169}, {"fold": "fold_6", "regime": "EUR crisis downturn", "sharpe": 1.99, "sortino": 3.0378, "return_pct": 2.06, "equity": 1020.58, "max_dd": 1.16, "win_rate": 57.89, "profit_factor": 1.386, "ic": 0.1536, "hit": 56.9, "n": 58, "aleatoric_mean": 0.011074, "epistemic_mean": 0.008618, "confidence_mean": 0.9807, "aleatoric_std": 0.007802, "epistemic_std": 0.002849}, {"fold": "fold_7", "regime": "Recent mixed/upturn", "sharpe": 0.321, "sortino": 0.4417, "return_pct": 0.38, "equity": 1003.77, "max_dd": 2.12, "win_rate": 50.0, "profit_factor": 1.054, "ic": 0.1493, "hit": 50.0, "n": 60, "aleatoric_mean": 0.049816, "epistemic_mean": 0.00728, "confidence_mean": 0.9475, "aleatoric_std": 0.044635, "epistemic_std": 0.0026}], "train_sharpe": 1.389, "train_psr": 1.0, "train_equity": 2569.55, "train_sortino": 3.0153, "train_return_pct": 156.95, "train_max_dd": 10.2, "train_win_rate": 54.91, "train_profit_factor": 1.379, "train_ic": 0.0976, "train_hit": 54.63, "train_per_window": [{"fold": "all_train", "regime": "Training data", "sharpe": 1.389, "sortino": 3.0153, "return_pct": 156.95, "equity": 2569.55, "max_dd": 10.2, "win_rate": 54.91, "profit_factor": 1.379, "ic": 0.0976, "hit": 54.63, "n": 1382}], "experiment_num": 33, "status": "DISCARD"}
{"backbone": "lfm2-350m", "description": "H-Exp12: reproduce H-Exp5 (same config)", "config": {"seq_len": 60, "lr": 3e-05, "batch_size": 32, "epochs": 30, "weight_decay": 1e-05, "patience": 8, "grad_clip": 1.0, "warmup_epochs": 0, "huber_delta": 1.0, "head_dropout": 0.1}, "composite": 0.0706, "test_pos_folds": 6, "val_pos_folds": 3, "val_loss": -1.646018, "elapsed_sec": 393.8, "timestamp": "2026-04-12T10:01:36", "sharpe": 1.065, "psr": 0.9542, "equity": 1267.66, "sortino": 1.7186, "return_pct": 26.77, "max_dd": 12.74, "win_rate": 52.5, "profit_factor": 1.196, "ic": 0.0566, "hit": 52.17, "aleatoric_mean": 0.058752, "epistemic_mean": 0.007202, "confidence_mean": 0.9409, "per_window": [{"fold": "fold_1", "regime": "Pre-crisis upturn + GFC onset", "sharpe": 0.1958, "sortino": 0.3328, "return_pct": 0.31, "equity": 1003.08, "max_dd": 4.68, "win_rate": 48.08, "profit_factor": 1.03, "ic": 0.0194, "hit": 47.17, "n": 53, "aleatoric_mean": 0.150155, "epistemic_mean": 0.005502, "confidence_mean": 0.8718, "aleatoric_std": 0.106271, "epistemic_std": 0.002547}, {"fold": "fold_2", "regime": "Post-crash recovery", "sharpe": 0.6253, "sortino": 1.0166, "return_pct": 1.62, "equity": 1016.18, "max_dd": 4.31, "win_rate": 57.89, "profit_factor": 1.105, "ic": 0.093, "hit": 57.89, "n": 57, "aleatoric_mean": 0.086202, "epistemic_mean": 0.007331, "confidence_mean": 0.9162, "aleatoric_std": 0.049837, "epistemic_std": 0.002863}, {"fold": "fold_3", "regime": "Eurozone debt plateau", "sharpe": 4.172, "sortino": 6.5754, "return_pct": 7.35, "equity": 1073.45, "max_dd": 1.65, "win_rate": 68.52, "profit_factor": 1.948, "ic": 0.295, "hit": 66.07, "n": 56, "aleatoric_mean": 0.076594, "epistemic_mean": 0.008311, "confidence_mean": 0.9237, "aleatoric_std": 0.052902, "epistemic_std": 0.004689}, {"fold": "fold_4", "regime": "Strong USD downturn", "sharpe": -0.4332, "sortino": -0.7364, "return_pct": -2.43, "equity": 975.66, "max_dd": 12.74, "win_rate": 49.57, "profit_factor": 0.93, "ic": 0.0066, "hit": 49.15, "n": 118, "aleatoric_mean": 0.044507, "epistemic_mean": 0.00745, "confidence_mean": 0.9519, "aleatoric_std": 0.041906, "epistemic_std": 0.003017}, {"fold": "fold_5", "regime": "Low-vol plateau", "sharpe": 0.7691, "sortino": 1.4066, "return_pct": 1.69, "equity": 1016.88, "max_dd": 2.5, "win_rate": 47.32, "profit_factor": 1.136, "ic": 0.0131, "hit": 47.32, "n": 112, "aleatoric_mean": 0.022615, "epistemic_mean": 0.007228, "confidence_mean": 0.9714, "aleatoric_std": 0.021071, "epistemic_std": 0.003283}, {"fold": "fold_6", "regime": "EUR crisis downturn", "sharpe": 3.0576, "sortino": 5.7289, "return_pct": 14.23, "equity": 1142.33, "max_dd": 2.49, "win_rate": 53.04, "profit_factor": 1.623, "ic": 0.2236, "hit": 53.04, "n": 115, "aleatoric_mean": 0.077476, "epistemic_mean": 0.006156, "confidence_mean": 0.9251, "aleatoric_std": 0.055728, "epistemic_std": 0.002693}, {"fold": "fold_7", "regime": "Recent mixed/upturn", "sharpe": 0.5782, "sortino": 0.9864, "return_pct": 2.22, "equity": 1022.23, "max_dd": 5.77, "win_rate": 51.79, "profit_factor": 1.104, "ic": -0.068, "hit": 51.79, "n": 112, "aleatoric_mean": 0.024528, "epistemic_mean": 0.008171, "confidence_mean": 0.969, "aleatoric_std": 0.027629, "epistemic_std": 0.003899}], "val_sharpe": 0.5706, "val_psr": 0.7673, "val_equity": 1068.96, "val_sortino": 0.8168, "val_return_pct": 6.9, "val_max_dd": 9.94, "val_win_rate": 53.85, "val_profit_factor": 1.1, "val_ic": 0.0408, "val_hit": 53.59, "val_aleatoric_mean": 0.061898, "val_epistemic_mean": 0.00725, "val_confidence_mean": 0.9408, "val_per_window": [{"fold": "fold_1", "regime": "Pre-crisis upturn + GFC onset", "sharpe": -0.2827, "sortino": -0.4002, "return_pct": -0.5, "equity": 994.99, "max_dd": 1.98, "win_rate": 53.45, "profit_factor": 0.955, "ic": 0.1371, "hit": 52.54, "n": 59, "aleatoric_mean": 0.187489, "epistemic_mean": 0.00572, "confidence_mean": 0.8536, "aleatoric_std": 0.169941, "epistemic_std": 0.002488}, {"fold": "fold_2", "regime": "Post-crash recovery", "sharpe": -0.5631, "sortino": -0.856, "return_pct": -1.18, "equity": 988.19, "max_dd": 6.33, "win_rate": 56.9, "profit_factor": 0.913, "ic": -0.0779, "hit": 56.9, "n": 58, "aleatoric_mean": 0.11005, "epistemic_mean": 0.007677, "confidence_mean": 0.8964, "aleatoric_std": 0.051832, "epistemic_std": 0.003308}, {"fold": "fold_3", "regime": "Eurozone debt plateau", "sharpe": -0.2645, "sortino": -0.3482, "return_pct": -0.74, "equity": 992.62, "max_dd": 5.57, "win_rate": 50.82, "profit_factor": 0.957, "ic": 0.0181, "hit": 50.82, "n": 61, "aleatoric_mean": 0.024778, "epistemic_mean": 0.007881, "confidence_mean": 0.9686, "aleatoric_std": 0.018434, "epistemic_std": 0.003408}, {"fold": "fold_4", "regime": "Strong USD downturn", "sharpe": 1.4447, "sortino": 2.7894, "return_pct": 3.1, "equity": 1030.97, "max_dd": 2.92, "win_rate": 53.33, "profit_factor": 1.248, "ic": -0.0681, "hit": 53.33, "n": 60, "aleatoric_mean": 0.044932, "epistemic_mean": 0.006315, "confidence_mean": 0.9529, "aleatoric_std": 0.045893, "epistemic_std": 0.002593}, {"fold": "fold_5", "regime": "Low-vol plateau", "sharpe": 2.2352, "sortino": 3.9188, "return_pct": 3.86, "equity": 1038.56, "max_dd": 1.94, "win_rate": 54.84, "profit_factor": 1.437, "ic": -0.0122, "hit": 54.84, "n": 62, "aleatoric_mean": 0.01673, "epistemic_mean": 0.006742, "confidence_mean": 0.9772, "aleatoric_std": 0.014148, "epistemic_std": 0.002515}, {"fold": "fold_6", "regime": "EUR crisis downturn", "sharpe": 2.5979, "sortino": 3.6263, "return_pct": 2.69, "equity": 1026.87, "max_dd": 1.68, "win_rate": 61.4, "profit_factor": 1.532, "ic": 0.2491, "hit": 60.34, "n": 58, "aleatoric_mean": 0.012401, "epistemic_mean": 0.006802, "confidence_mean": 0.9813, "aleatoric_std": 0.010903, "epistemic_std": 0.002101}, {"fold": "fold_7", "regime": "Recent mixed/upturn", "sharpe": -0.2746, "sortino": -0.3859, "return_pct": -0.39, "equity": 996.15, "max_dd": 2.51, "win_rate": 46.67, "profit_factor": 0.956, "ic": 0.0425, "hit": 46.67, "n": 60, "aleatoric_mean": 0.041077, "epistemic_mean": 0.009595, "confidence_mean": 0.9524, "aleatoric_std": 0.026095, "epistemic_std": 0.004169}], "train_sharpe": 1.2034, "train_psr": 0.9879, "train_equity": 2245.85, "train_sortino": 1.2981, "train_return_pct": 124.58, "train_max_dd": 21.69, "train_win_rate": 54.47, "train_profit_factor": 1.32, "train_ic": 0.1333, "train_hit": 54.2, "train_per_window": [{"fold": "all_train", "regime": "Training data", "sharpe": 1.2034, "sortino": 1.2981, "return_pct": 124.58, "equity": 2245.85, "max_dd": 21.69, "win_rate": 54.47, "profit_factor": 1.32, "ic": 0.1333, "hit": 54.2, "n": 1382}], "experiment_num": 34, "status": "DISCARD"}
