{"backbone": "mamba", "description": "mamba: Exp16 dmamba expand=4 seed=13 variance", "config": {"seq_len": 10, "lr": 0.0005, "batch_size": 32, "epochs": 100, "weight_decay": 0.1, "patience": 20, "grad_clip": 1.0, "warmup_epochs": 10, "huber_delta": 1.0, "head_dropout": 0.1, "seed": 13, "mamba_variant": "dmamba", "mamba_expand": 4, "het_loss": false}, "composite": 5.5374, "test_pos_folds": 7, "val_pos_folds": 6, "val_loss": 3.8e-05, "elapsed_sec": 294.7, "timestamp": "2026-04-20T01:52:26", "sharpe": 5.6374, "psr": 1.0, "equity": 9034.61, "sortino": 7.0953, "return_pct": 803.46, "max_dd": 7.54, "win_rate": 67.08, "profit_factor": 2.927, "ic": 0.4904, "hit": 66.8, "aleatoric_mean": 2e-05, "epistemic_mean": 4e-05, "confidence_mean": 0.9999, "precision": 0.6408, "recall": 0.7568, "f1": 0.694, "f2": 0.7303, "mcc": 0.347, "accuracy": 0.6701, "per_window": [{"fold": "fold_1", "regime": "Pre-crisis upturn + GFC onset", "sharpe": 0.6959, "sortino": 0.8091, "return_pct": 4.74, "equity": 1047.39, "max_dd": 7.54, "win_rate": 47.06, "profit_factor": 1.179, "ic": 0.1423, "hit": 46.6, "n": 103, "precision": 0.4872, "recall": 0.3585, "f1": 0.413, "f2": 0.3785, "mcc": -0.0428, "accuracy": 0.4757, "tp": 19, "fp": 20, "tn": 30, "fn": 34, "aleatoric_mean": 4.7e-05, "epistemic_mean": 9.4e-05, "confidence_mean": 0.9999, "aleatoric_std": 4.5e-05, "epistemic_std": 9e-05}, {"fold": "fold_2", "regime": "Post-crash recovery", "sharpe": 1.0721, "sortino": 1.8683, "return_pct": 4.98, "equity": 1049.84, "max_dd": 4.81, "win_rate": 54.21, "profit_factor": 1.183, "ic": 0.0484, "hit": 54.21, "n": 107, "precision": 0.5143, "recall": 0.7059, "f1": 0.595, "f2": 0.6569, "mcc": 0.1037, "accuracy": 0.5421, "tp": 36, "fp": 34, "tn": 22, "fn": 15, "aleatoric_mean": 2.6e-05, "epistemic_mean": 5.2e-05, "confidence_mean": 0.9999, "aleatoric_std": 1.9e-05, "epistemic_std": 3.8e-05}, {"fold": "fold_3", "regime": "Eurozone debt plateau", "sharpe": 6.9009, "sortino": 12.4633, "return_pct": 25.0, "equity": 1250.03, "max_dd": 2.1, "win_rate": 69.23, "profit_factor": 2.974, "ic": 0.6252, "hit": 67.92, "n": 106, "precision": 0.6494, "recall": 0.8772, "f1": 0.7463, "f2": 0.8197, "mcc": 0.3648, "accuracy": 0.6792, "tp": 50, "fp": 27, "tn": 22, "fn": 7, "aleatoric_mean": 2.6e-05, "epistemic_mean": 5.1e-05, "confidence_mean": 0.9999, "aleatoric_std": 1.5e-05, "epistemic_std": 3e-05}, {"fold": "fold_4", "regime": "Strong USD downturn", "sharpe": 9.1517, "sortino": 21.0447, "return_pct": 84.49, "equity": 1844.94, "max_dd": 1.69, "win_rate": 73.05, "profit_factor": 4.985, "ic": 0.6262, "hit": 72.62, "n": 168, "precision": 0.7303, "recall": 0.7558, "f1": 0.7429, "f2": 0.7506, "mcc": 0.4638, "accuracy": 0.7321, "tp": 65, "fp": 24, "tn": 58, "fn": 21, "aleatoric_mean": 1.6e-05, "epistemic_mean": 3.2e-05, "confidence_mean": 1.0, "aleatoric_std": 1.4e-05, "epistemic_std": 2.7e-05}, {"fold": "fold_5", "regime": "Low-vol plateau", "sharpe": 7.4852, "sortino": 15.9163, "return_pct": 25.21, "equity": 1252.09, "max_dd": 1.42, "win_rate": 68.52, "profit_factor": 3.578, "ic": 0.6373, "hit": 68.52, "n": 162, "precision": 0.6238, "recall": 0.8289, "f1": 0.7119, "f2": 0.7778, "mcc": 0.3987, "accuracy": 0.6852, "tp": 63, "fp": 38, "tn": 48, "fn": 13, "aleatoric_mean": 8e-06, "epistemic_mean": 1.5e-05, "confidence_mean": 1.0, "aleatoric_std": 6e-06, "epistemic_std": 1.2e-05}, {"fold": "fold_6", "regime": "EUR crisis downturn", "sharpe": 12.1859, "sortino": 32.1366, "return_pct": 83.27, "equity": 1832.73, "max_dd": 1.01, "win_rate": 75.76, "profit_factor": 8.13, "ic": 0.768, "hit": 75.76, "n": 165, "precision": 0.7681, "recall": 0.6883, "f1": 0.726, "f2": 0.7029, "mcc": 0.5123, "accuracy": 0.7576, "tp": 53, "fp": 16, "tn": 72, "fn": 24, "aleatoric_mean": 2.1e-05, "epistemic_mean": 4.1e-05, "confidence_mean": 0.9999, "aleatoric_std": 1.8e-05, "epistemic_std": 3.6e-05}, {"fold": "fold_7", "regime": "Recent mixed/upturn", "sharpe": 8.398, "sortino": 16.0882, "return_pct": 55.25, "equity": 1552.52, "max_dd": 1.64, "win_rate": 70.37, "profit_factor": 4.362, "ic": 0.6655, "hit": 70.37, "n": 162, "precision": 0.6341, "recall": 0.963, "f1": 0.7647, "f2": 0.8725, "mcc": 0.4765, "accuracy": 0.7037, "tp": 78, "fp": 45, "tn": 36, "fn": 3, "aleatoric_mean": 1.2e-05, "epistemic_mean": 2.5e-05, "confidence_mean": 1.0, "aleatoric_std": 1.2e-05, "epistemic_std": 2.4e-05}], "val_sharpe": 5.9678, "val_psr": 1.0, "val_equity": 3734.13, "val_sortino": 9.3256, "val_return_pct": 273.41, "val_max_dd": 4.98, "val_win_rate": 65.4, "val_profit_factor": 2.787, "val_ic": 0.4734, "val_hit": 64.97, "val_aleatoric_mean": 1.1e-05, "val_epistemic_mean": 2.2e-05, "val_confidence_mean": 1.0, "val_precision": 0.5968, "val_recall": 0.8192, "val_f1": 0.6905, "val_f2": 0.7624, "val_mcc": 0.3334, "val_accuracy": 0.651, "val_per_window": [{"fold": "fold_1", "regime": "Pre-crisis upturn + GFC onset", "sharpe": -0.382, "sortino": -0.6063, "return_pct": -1.03, "equity": 989.67, "max_dd": 2.75, "win_rate": 45.37, "profit_factor": 0.939, "ic": -0.154, "hit": 44.95, "n": 109, "precision": 0.4675, "recall": 0.6545, "f1": 0.5455, "f2": 0.6061, "mcc": -0.115, "accuracy": 0.4495, "tp": 36, "fp": 41, "tn": 13, "fn": 19, "aleatoric_mean": 1.1e-05, "epistemic_mean": 2.2e-05, "confidence_mean": 1.0, "aleatoric_std": 1.4e-05, "epistemic_std": 2.7e-05}, {"fold": "fold_2", "regime": "Post-crash recovery", "sharpe": 0.9833, "sortino": 1.5697, "return_pct": 4.59, "equity": 1045.93, "max_dd": 4.68, "win_rate": 53.7, "profit_factor": 1.168, "ic": 0.1049, "hit": 53.7, "n": 108, "precision": 0.597, "recall": 0.6349, "f1": 0.6154, "f2": 0.627, "mcc": 0.0355, "accuracy": 0.537, "tp": 40, "fp": 27, "tn": 18, "fn": 23, "aleatoric_mean": 1.9e-05, "epistemic_mean": 3.9e-05, "confidence_mean": 0.9999, "aleatoric_std": 1.2e-05, "epistemic_std": 2.3e-05}, {"fold": "fold_3", "regime": "Eurozone debt plateau", "sharpe": 11.5684, "sortino": 28.6281, "return_pct": 45.7, "equity": 1456.96, "max_dd": 1.02, "win_rate": 77.98, "profit_factor": 7.276, "ic": 0.6843, "hit": 76.58, "n": 111, "precision": 0.6567, "recall": 0.9362, "f1": 0.7719, "f2": 0.8627, "mcc": 0.5826, "accuracy": 0.7658, "tp": 44, "fp": 23, "tn": 41, "fn": 3, "aleatoric_mean": 1.5e-05, "epistemic_mean": 3e-05, "confidence_mean": 1.0, "aleatoric_std": 1.1e-05, "epistemic_std": 2.2e-05}, {"fold": "fold_4", "regime": "Strong USD downturn", "sharpe": 9.3299, "sortino": 18.7685, "return_pct": 32.08, "equity": 1320.76, "max_dd": 1.26, "win_rate": 74.31, "profit_factor": 4.972, "ic": 0.7362, "hit": 73.64, "n": 110, "precision": 0.6377, "recall": 0.9362, "f1": 0.7586, "f2": 0.856, "mcc": 0.5518, "accuracy": 0.7455, "tp": 44, "fp": 25, "tn": 38, "fn": 3, "aleatoric_mean": 1.1e-05, "epistemic_mean": 2.1e-05, "confidence_mean": 1.0, "aleatoric_std": 1.1e-05, "epistemic_std": 2.1e-05}, {"fold": "fold_5", "regime": "Low-vol plateau", "sharpe": 9.7288, "sortino": 26.4758, "return_pct": 31.74, "equity": 1317.4, "max_dd": 0.56, "win_rate": 71.43, "profit_factor": 5.432, "ic": 0.61, "hit": 71.43, "n": 112, "precision": 0.678, "recall": 0.7547, "f1": 0.7143, "f2": 0.738, "mcc": 0.4327, "accuracy": 0.7143, "tp": 40, "fp": 19, "tn": 40, "fn": 13, "aleatoric_mean": 7e-06, "epistemic_mean": 1.4e-05, "confidence_mean": 1.0, "aleatoric_std": 5e-06, "epistemic_std": 1e-05}, {"fold": "fold_6", "regime": "EUR crisis downturn", "sharpe": 11.5408, "sortino": 31.7841, "return_pct": 23.76, "equity": 1237.62, "max_dd": 0.67, "win_rate": 74.77, "profit_factor": 8.312, "ic": 0.7905, "hit": 74.07, "n": 108, "precision": 0.6338, "recall": 0.9574, "f1": 0.7627, "f2": 0.8687, "mcc": 0.555, "accuracy": 0.7407, "tp": 45, "fp": 26, "tn": 35, "fn": 2, "aleatoric_mean": 5e-06, "epistemic_mean": 1e-05, "confidence_mean": 1.0, "aleatoric_std": 2e-06, "epistemic_std": 4e-06}, {"fold": "fold_7", "regime": "Recent mixed/upturn", "sharpe": 6.2847, "sortino": 13.8606, "return_pct": 14.98, "equity": 1149.8, "max_dd": 0.94, "win_rate": 60.0, "profit_factor": 2.77, "ic": 0.6424, "hit": 60.0, "n": 110, "precision": 0.5495, "recall": 0.9434, "f1": 0.6944, "f2": 0.8251, "mcc": 0.2962, "accuracy": 0.6, "tp": 50, "fp": 41, "tn": 16, "fn": 3, "aleatoric_mean": 8e-06, "epistemic_mean": 1.6e-05, "confidence_mean": 1.0, "aleatoric_std": 6e-06, "epistemic_std": 1.1e-05}], "train_sharpe": 7.6212, "train_psr": 1.0, "train_equity": 4265647.0, "train_sortino": 23.3359, "train_return_pct": 426464.7, "train_max_dd": 2.81, "train_win_rate": 76.46, "train_profit_factor": 7.015, "train_ic": 0.7479, "train_hit": 76.15, "train_precision": 0.7324, "train_recall": 0.8485, "train_f1": 0.7862, "train_f2": 0.8224, "train_mcc": 0.53, "train_accuracy": 0.7627, "train_per_window": [{"fold": "all_train", "regime": "Training data", "sharpe": 7.6212, "sortino": 23.3359, "return_pct": 426464.7, "equity": 4265647.0, "max_dd": 2.81, "win_rate": 76.46, "profit_factor": 7.015, "ic": 0.7479, "hit": 76.15, "n": 2478, "precision": 0.7324, "recall": 0.8485, "f1": 0.7862, "f2": 0.8224, "mcc": 0.53, "accuracy": 0.7627, "tp": 1081, "fp": 395, "tn": 809, "fn": 193}], "experiment_num": 167, "status": "DISCARD"}
{"backbone": "mamba", "description": "mamba: Exp17 dmamba expand=4 seed=77 variance", "config": {"seq_len": 10, "lr": 0.0005, "batch_size": 32, "epochs": 100, "weight_decay": 0.1, "patience": 20, "grad_clip": 1.0, "warmup_epochs": 10, "huber_delta": 1.0, "head_dropout": 0.1, "seed": 77, "mamba_variant": "dmamba", "mamba_expand": 4, "het_loss": false}, "composite": 4.3896, "test_pos_folds": 6, "val_pos_folds": 7, "val_loss": 3.2e-05, "elapsed_sec": 261.8, "timestamp": "2026-04-20T01:57:17", "sharpe": 4.4896, "psr": 1.0, "equity": 5965.4, "sortino": 8.4681, "return_pct": 496.54, "max_dd": 14.26, "win_rate": 62.44, "profit_factor": 2.328, "ic": 0.3679, "hit": 62.18, "aleatoric_mean": 2.6e-05, "epistemic_mean": 5.2e-05, "confidence_mean": 0.9999, "precision": 0.6011, "recall": 0.7048, "f1": 0.6488, "f2": 0.6813, "mcc": 0.2506, "accuracy": 0.6228, "per_window": [{"fold": "fold_1", "regime": "Pre-crisis upturn + GFC onset", "sharpe": 2.0238, "sortino": 6.2622, "return_pct": 15.93, "equity": 1159.3, "max_dd": 8.47, "win_rate": 44.12, "profit_factor": 1.621, "ic": 0.0376, "hit": 43.69, "n": 103, "precision": 0.4419, "recall": 0.3585, "f1": 0.3958, "f2": 0.3725, "mcc": -0.1231, "accuracy": 0.4369, "tp": 19, "fp": 24, "tn": 26, "fn": 34, "aleatoric_mean": 5.8e-05, "epistemic_mean": 0.000115, "confidence_mean": 0.9998, "aleatoric_std": 7.3e-05, "epistemic_std": 0.000146}, {"fold": "fold_2", "regime": "Post-crash recovery", "sharpe": -0.5946, "sortino": -0.9411, "return_pct": -3.08, "equity": 969.24, "max_dd": 9.48, "win_rate": 52.34, "profit_factor": 0.911, "ic": 0.0953, "hit": 52.34, "n": 107, "precision": 0.5, "recall": 0.8235, "f1": 0.6222, "f2": 0.7292, "mcc": 0.0894, "accuracy": 0.5234, "tp": 42, "fp": 42, "tn": 14, "fn": 9, "aleatoric_mean": 2.6e-05, "epistemic_mean": 5.2e-05, "confidence_mean": 0.9999, "aleatoric_std": 1.7e-05, "epistemic_std": 3.5e-05}, {"fold": "fold_3", "regime": "Eurozone debt plateau", "sharpe": 8.1731, "sortino": 14.2108, "return_pct": 29.24, "equity": 1292.35, "max_dd": 1.51, "win_rate": 71.15, "profit_factor": 3.655, "ic": 0.5427, "hit": 69.81, "n": 106, "precision": 0.7358, "recall": 0.6842, "f1": 0.7091, "f2": 0.694, "mcc": 0.3974, "accuracy": 0.6981, "tp": 39, "fp": 14, "tn": 35, "fn": 18, "aleatoric_mean": 3.3e-05, "epistemic_mean": 6.6e-05, "confidence_mean": 0.9999, "aleatoric_std": 3e-05, "epistemic_std": 5.9e-05}, {"fold": "fold_4", "regime": "Strong USD downturn", "sharpe": 8.8338, "sortino": 23.1332, "return_pct": 81.51, "equity": 1815.12, "max_dd": 1.58, "win_rate": 70.66, "profit_factor": 4.686, "ic": 0.6412, "hit": 70.24, "n": 168, "precision": 0.6529, "recall": 0.9186, "f1": 0.7633, "f2": 0.8495, "mcc": 0.4526, "accuracy": 0.7083, "tp": 79, "fp": 42, "tn": 40, "fn": 7, "aleatoric_mean": 1.8e-05, "epistemic_mean": 3.7e-05, "confidence_mean": 0.9999, "aleatoric_std": 1.7e-05, "epistemic_std": 3.5e-05}, {"fold": "fold_5", "regime": "Low-vol plateau", "sharpe": 4.1264, "sortino": 7.7178, "return_pct": 14.14, "equity": 1141.4, "max_dd": 1.86, "win_rate": 58.02, "profit_factor": 1.995, "ic": 0.5464, "hit": 58.02, "n": 162, "precision": 0.5312, "recall": 0.8947, "f1": 0.6667, "f2": 0.787, "mcc": 0.2415, "accuracy": 0.5802, "tp": 68, "fp": 60, "tn": 26, "fn": 8, "aleatoric_mean": 1.2e-05, "epistemic_mean": 2.4e-05, "confidence_mean": 1.0, "aleatoric_std": 6e-06, "epistemic_std": 1.1e-05}, {"fold": "fold_6", "regime": "EUR crisis downturn", "sharpe": 7.8897, "sortino": 14.0043, "return_pct": 55.58, "equity": 1555.78, "max_dd": 3.04, "win_rate": 66.67, "profit_factor": 3.66, "ic": 0.5374, "hit": 66.67, "n": 165, "precision": 0.617, "recall": 0.7532, "f1": 0.6784, "f2": 0.7214, "mcc": 0.3468, "accuracy": 0.6667, "tp": 58, "fp": 36, "tn": 52, "fn": 19, "aleatoric_mean": 2.6e-05, "epistemic_mean": 5.2e-05, "confidence_mean": 0.9999, "aleatoric_std": 2.1e-05, "epistemic_std": 4.2e-05}, {"fold": "fold_7", "regime": "Recent mixed/upturn", "sharpe": 4.2595, "sortino": 6.6313, "return_pct": 27.45, "equity": 1274.5, "max_dd": 4.45, "win_rate": 66.67, "profit_factor": 2.065, "ic": 0.4345, "hit": 66.67, "n": 162, "precision": 0.8293, "recall": 0.4198, "f1": 0.5574, "f2": 0.4658, "mcc": 0.3833, "accuracy": 0.6667, "tp": 34, "fp": 7, "tn": 74, "fn": 47, "aleatoric_mean": 2.4e-05, "epistemic_mean": 4.8e-05, "confidence_mean": 0.9999, "aleatoric_std": 2.8e-05, "epistemic_std": 5.5e-05}], "val_sharpe": 5.3803, "val_psr": 1.0, "val_equity": 3323.49, "val_sortino": 8.7509, "val_return_pct": 232.35, "val_max_dd": 5.48, "val_win_rate": 64.22, "val_profit_factor": 2.511, "val_ic": 0.4486, "val_hit": 63.8, "val_aleatoric_mean": 1.7e-05, "val_epistemic_mean": 3.3e-05, "val_confidence_mean": 0.9999, "val_precision": 0.5888, "val_recall": 0.8082, "val_f1": 0.6813, "val_f2": 0.7522, "val_mcc": 0.3115, "val_accuracy": 0.6406, "val_per_window": [{"fold": "fold_1", "regime": "Pre-crisis upturn + GFC onset", "sharpe": 2.8896, "sortino": 4.7339, "return_pct": 7.36, "equity": 1073.64, "max_dd": 2.49, "win_rate": 54.63, "profit_factor": 1.617, "ic": 0.187, "hit": 54.13, "n": 109, "precision": 0.5375, "recall": 0.7818, "f1": 0.637, "f2": 0.7167, "mcc": 0.1093, "accuracy": 0.5505, "tp": 43, "fp": 37, "tn": 17, "fn": 12, "aleatoric_mean": 2.1e-05, "epistemic_mean": 4.3e-05, "confidence_mean": 0.9999, "aleatoric_std": 2.9e-05, "epistemic_std": 5.7e-05}, {"fold": "fold_2", "regime": "Post-crash recovery", "sharpe": 2.2904, "sortino": 4.0985, "return_pct": 11.33, "equity": 1113.3, "max_dd": 5.48, "win_rate": 58.33, "profit_factor": 1.436, "ic": 0.1097, "hit": 58.33, "n": 108, "precision": 0.6216, "recall": 0.7302, "f1": 0.6715, "f2": 0.7055, "mcc": 0.1146, "accuracy": 0.5833, "tp": 46, "fp": 28, "tn": 17, "fn": 17, "aleatoric_mean": 2e-05, "epistemic_mean": 4e-05, "confidence_mean": 0.9999, "aleatoric_std": 1.4e-05, "epistemic_std": 2.9e-05}, {"fold": "fold_3", "regime": "Eurozone debt plateau", "sharpe": 5.8333, "sortino": 10.649, "return_pct": 24.56, "equity": 1245.63, "max_dd": 2.04, "win_rate": 62.39, "profit_factor": 2.598, "ic": 0.6257, "hit": 61.26, "n": 111, "precision": 0.5227, "recall": 0.9787, "f1": 0.6815, "f2": 0.8333, "mcc": 0.3931, "accuracy": 0.6126, "tp": 46, "fp": 42, "tn": 22, "fn": 1, "aleatoric_mean": 1.7e-05, "epistemic_mean": 3.3e-05, "confidence_mean": 1.0, "aleatoric_std": 1e-05, "epistemic_std": 2.1e-05}, {"fold": "fold_4", "regime": "Strong USD downturn", "sharpe": 5.6044, "sortino": 12.8807, "return_pct": 20.0, "equity": 1199.99, "max_dd": 1.54, "win_rate": 63.3, "profit_factor": 2.552, "ic": 0.5849, "hit": 62.73, "n": 110, "precision": 0.5467, "recall": 0.8723, "f1": 0.6721, "f2": 0.7795, "mcc": 0.3533, "accuracy": 0.6364, "tp": 41, "fp": 34, "tn": 29, "fn": 6, "aleatoric_mean": 1.5e-05, "epistemic_mean": 3.1e-05, "confidence_mean": 1.0, "aleatoric_std": 1e-05, "epistemic_std": 2e-05}, {"fold": "fold_5", "regime": "Low-vol plateau", "sharpe": 8.3952, "sortino": 17.1432, "return_pct": 27.95, "equity": 1279.53, "max_dd": 1.85, "win_rate": 67.86, "profit_factor": 4.215, "ic": 0.6106, "hit": 67.86, "n": 112, "precision": 0.6349, "recall": 0.7547, "f1": 0.6897, "f2": 0.7273, "mcc": 0.3672, "accuracy": 0.6786, "tp": 40, "fp": 23, "tn": 36, "fn": 13, "aleatoric_mean": 1.5e-05, "epistemic_mean": 3e-05, "confidence_mean": 1.0, "aleatoric_std": 1.6e-05, "epistemic_std": 3.2e-05}, {"fold": "fold_6", "regime": "EUR crisis downturn", "sharpe": 11.4883, "sortino": 33.1345, "return_pct": 23.68, "equity": 1236.83, "max_dd": 0.48, "win_rate": 76.64, "profit_factor": 8.212, "ic": 0.7552, "hit": 75.93, "n": 108, "precision": 0.6522, "recall": 0.9574, "f1": 0.7759, "f2": 0.8755, "mcc": 0.5822, "accuracy": 0.7593, "tp": 45, "fp": 24, "tn": 37, "fn": 2, "aleatoric_mean": 1e-05, "epistemic_mean": 1.9e-05, "confidence_mean": 1.0, "aleatoric_std": 4e-06, "epistemic_std": 9e-06}, {"fold": "fold_7", "regime": "Recent mixed/upturn", "sharpe": 7.4741, "sortino": 14.5812, "return_pct": 17.54, "equity": 1175.43, "max_dd": 1.94, "win_rate": 66.36, "profit_factor": 3.38, "ic": 0.4555, "hit": 66.36, "n": 110, "precision": 0.6538, "recall": 0.6415, "f1": 0.6476, "f2": 0.6439, "mcc": 0.326, "accuracy": 0.6636, "tp": 34, "fp": 18, "tn": 39, "fn": 19, "aleatoric_mean": 1.9e-05, "epistemic_mean": 3.8e-05, "confidence_mean": 0.9999, "aleatoric_std": 1.8e-05, "epistemic_std": 3.7e-05}], "train_sharpe": 6.2401, "train_psr": 1.0, "train_equity": 1157251.38, "train_sortino": 15.5933, "train_return_pct": 115625.14, "train_max_dd": 3.35, "train_win_rate": 70.62, "train_profit_factor": 4.47, "train_ic": 0.6745, "train_hit": 70.34, "train_precision": 0.6538, "train_recall": 0.9011, "train_f1": 0.7578, "train_f2": 0.8377, "train_mcc": 0.4357, "train_accuracy": 0.7038, "train_per_window": [{"fold": "all_train", "regime": "Training data", "sharpe": 6.2401, "sortino": 15.5933, "return_pct": 115625.14, "equity": 1157251.38, "max_dd": 3.35, "win_rate": 70.62, "profit_factor": 4.47, "ic": 0.6745, "hit": 70.34, "n": 2478, "precision": 0.6538, "recall": 0.9011, "f1": 0.7578, "f2": 0.8377, "mcc": 0.4357, "accuracy": 0.7038, "tp": 1148, "fp": 608, "tn": 596, "fn": 126}], "experiment_num": 168, "status": "DISCARD"}
