{"backbone": "lstm", "description": "lstm: Exp3 SOTA ep=100 pat=15 (Fischer&Krauss2018 proper) seed=0", "config": {"seq_len": 10, "lr": 0.001, "batch_size": 32, "epochs": 100, "weight_decay": 1e-05, "patience": 15, "grad_clip": 1.0, "warmup_epochs": 0, "huber_delta": 1.0, "head_dropout": 0.15, "seed": 0, "het_loss": false}, "composite": 5.0568, "test_pos_folds": 6, "val_pos_folds": 5, "val_loss": 3.1e-05, "elapsed_sec": 31.4, "timestamp": "2026-04-19T17:56:01", "sharpe": 5.8052, "psr": 1.0, "equity": 9581.25, "sortino": 10.455, "return_pct": 858.12, "max_dd": 12.94, "win_rate": 69.87, "profit_factor": 3.029, "ic": 0.4812, "hit": 69.58, "aleatoric_mean": 1.4e-05, "epistemic_mean": 2.9e-05, "confidence_mean": 1.0, "precision": 0.6987, "recall": 0.6798, "f1": 0.6891, "f2": 0.6835, "mcc": 0.3935, "accuracy": 0.6968, "per_window": [{"fold": "fold_1", "regime": "Pre-crisis upturn + GFC onset", "sharpe": 1.8683, "sortino": 5.5895, "return_pct": 14.58, "equity": 1145.77, "max_dd": 4.44, "win_rate": 50.0, "profit_factor": 1.561, "ic": 0.0909, "hit": 49.51, "n": 103, "precision": 0.5091, "recall": 0.5283, "f1": 0.5185, "f2": 0.5243, "mcc": -0.0117, "accuracy": 0.4951, "tp": 28, "fp": 27, "tn": 23, "fn": 25, "aleatoric_mean": 2.5e-05, "epistemic_mean": 5.1e-05, "confidence_mean": 0.9999, "aleatoric_std": 1.9e-05, "epistemic_std": 3.8e-05}, {"fold": "fold_2", "regime": "Post-crash recovery", "sharpe": -1.7505, "sortino": -2.895, "return_pct": -8.26, "equity": 917.37, "max_dd": 10.44, "win_rate": 50.47, "profit_factor": 0.76, "ic": 0.0036, "hit": 50.47, "n": 107, "precision": 0.4878, "recall": 0.7843, "f1": 0.6015, "f2": 0.6993, "mcc": 0.0405, "accuracy": 0.5047, "tp": 40, "fp": 42, "tn": 14, "fn": 11, "aleatoric_mean": 1.7e-05, "epistemic_mean": 3.5e-05, "confidence_mean": 0.9999, "aleatoric_std": 9e-06, "epistemic_std": 1.7e-05}, {"fold": "fold_3", "regime": "Eurozone debt plateau", "sharpe": 7.3278, "sortino": 13.253, "return_pct": 26.45, "equity": 1264.51, "max_dd": 1.36, "win_rate": 75.0, "profit_factor": 3.186, "ic": 0.628, "hit": 73.58, "n": 106, "precision": 0.6933, "recall": 0.9123, "f1": 0.7879, "f2": 0.8581, "mcc": 0.4854, "accuracy": 0.7358, "tp": 52, "fp": 23, "tn": 26, "fn": 5, "aleatoric_mean": 1.7e-05, "epistemic_mean": 3.4e-05, "confidence_mean": 0.9999, "aleatoric_std": 8e-06, "epistemic_std": 1.5e-05}, {"fold": "fold_4", "regime": "Strong USD downturn", "sharpe": 9.4796, "sortino": 16.616, "return_pct": 87.54, "equity": 1875.39, "max_dd": 2.43, "win_rate": 78.44, "profit_factor": 5.32, "ic": 0.6902, "hit": 77.98, "n": 168, "precision": 0.9032, "recall": 0.6512, "f1": 0.7568, "f2": 0.6897, "mcc": 0.5987, "accuracy": 0.7857, "tp": 56, "fp": 6, "tn": 76, "fn": 30, "aleatoric_mean": 1.2e-05, "epistemic_mean": 2.4e-05, "confidence_mean": 1.0, "aleatoric_std": 5e-06, "epistemic_std": 1.1e-05}, {"fold": "fold_5", "regime": "Low-vol plateau", "sharpe": 10.8745, "sortino": 34.3916, "return_pct": 34.74, "equity": 1347.41, "max_dd": 0.5, "win_rate": 75.31, "profit_factor": 6.878, "ic": 0.6894, "hit": 75.31, "n": 162, "precision": 0.7571, "recall": 0.6974, "f1": 0.726, "f2": 0.7086, "mcc": 0.5034, "accuracy": 0.7531, "tp": 53, "fp": 17, "tn": 69, "fn": 23, "aleatoric_mean": 8e-06, "epistemic_mean": 1.7e-05, "confidence_mean": 1.0, "aleatoric_std": 3e-06, "epistemic_std": 6e-06}, {"fold": "fold_6", "regime": "EUR crisis downturn", "sharpe": 11.4138, "sortino": 28.2772, "return_pct": 78.72, "equity": 1787.23, "max_dd": 1.52, "win_rate": 76.36, "profit_factor": 6.959, "ic": 0.7087, "hit": 76.36, "n": 165, "precision": 0.8276, "recall": 0.6234, "f1": 0.7111, "f2": 0.6557, "mcc": 0.5326, "accuracy": 0.7636, "tp": 48, "fp": 10, "tn": 78, "fn": 29, "aleatoric_mean": 1.4e-05, "epistemic_mean": 2.8e-05, "confidence_mean": 1.0, "aleatoric_std": 6e-06, "epistemic_std": 1.3e-05}, {"fold": "fold_7", "regime": "Recent mixed/upturn", "sharpe": 9.0903, "sortino": 21.3819, "return_pct": 59.62, "equity": 1596.19, "max_dd": 1.12, "win_rate": 70.99, "profit_factor": 4.994, "ic": 0.6379, "hit": 70.99, "n": 162, "precision": 0.7576, "recall": 0.6173, "f1": 0.6803, "f2": 0.641, "mcc": 0.4271, "accuracy": 0.7099, "tp": 50, "fp": 16, "tn": 65, "fn": 31, "aleatoric_mean": 1.2e-05, "epistemic_mean": 2.5e-05, "confidence_mean": 1.0, "aleatoric_std": 5e-06, "epistemic_std": 9e-06}], "val_sharpe": 5.3568, "val_psr": 1.0, "val_equity": 3307.77, "val_sortino": 8.3877, "val_return_pct": 230.78, "val_max_dd": 8.39, "val_win_rate": 63.83, "val_profit_factor": 2.501, "val_ic": 0.4595, "val_hit": 63.41, "val_aleatoric_mean": 1e-05, "val_epistemic_mean": 2e-05, "val_confidence_mean": 1.0, "val_precision": 0.6103, "val_recall": 0.6521, "val_f1": 0.6305, "val_f2": 0.6432, "val_mcc": 0.2746, "val_accuracy": 0.6367, "val_per_window": [{"fold": "fold_1", "regime": "Pre-crisis upturn + GFC onset", "sharpe": -0.2798, "sortino": -0.459, "return_pct": -0.78, "equity": 992.23, "max_dd": 4.74, "win_rate": 48.15, "profit_factor": 0.955, "ic": 0.003, "hit": 47.71, "n": 109, "precision": 0.4861, "recall": 0.6364, "f1": 0.5512, "f2": 0.5993, "mcc": -0.0515, "accuracy": 0.4771, "tp": 35, "fp": 37, "tn": 17, "fn": 20, "aleatoric_mean": 1e-05, "epistemic_mean": 2e-05, "confidence_mean": 1.0, "aleatoric_std": 5e-06, "epistemic_std": 9e-06}, {"fold": "fold_2", "regime": "Post-crash recovery", "sharpe": -0.2561, "sortino": -0.3965, "return_pct": -1.51, "equity": 984.92, "max_dd": 8.39, "win_rate": 48.15, "profit_factor": 0.96, "ic": 0.0744, "hit": 48.15, "n": 108, "precision": 0.5493, "recall": 0.619, "f1": 0.5821, "f2": 0.6037, "mcc": -0.0956, "accuracy": 0.4815, "tp": 39, "fp": 32, "tn": 13, "fn": 24, "aleatoric_mean": 1.3e-05, "epistemic_mean": 2.7e-05, "confidence_mean": 1.0, "aleatoric_std": 6e-06, "epistemic_std": 1.2e-05}, {"fold": "fold_3", "regime": "Eurozone debt plateau", "sharpe": 7.5917, "sortino": 20.8117, "return_pct": 31.68, "equity": 1316.8, "max_dd": 1.24, "win_rate": 59.63, "profit_factor": 3.5, "ic": 0.748, "hit": 58.56, "n": 111, "precision": 0.5059, "recall": 0.9149, "f1": 0.6515, "f2": 0.7875, "mcc": 0.3017, "accuracy": 0.5856, "tp": 43, "fp": 42, "tn": 22, "fn": 4, "aleatoric_mean": 1.1e-05, "epistemic_mean": 2.1e-05, "confidence_mean": 1.0, "aleatoric_std": 4e-06, "epistemic_std": 9e-06}, {"fold": "fold_4", "regime": "Strong USD downturn", "sharpe": 11.3172, "sortino": 31.181, "return_pct": 37.57, "equity": 1375.65, "max_dd": 0.82, "win_rate": 77.06, "profit_factor": 7.403, "ic": 0.7133, "hit": 76.36, "n": 110, "precision": 0.8056, "recall": 0.617, "f1": 0.6988, "f2": 0.6473, "mcc": 0.5334, "accuracy": 0.7727, "tp": 29, "fp": 7, "tn": 56, "fn": 18, "aleatoric_mean": 1e-05, "epistemic_mean": 1.9e-05, "confidence_mean": 1.0, "aleatoric_std": 4e-06, "epistemic_std": 8e-06}, {"fold": "fold_5", "regime": "Low-vol plateau", "sharpe": 9.8353, "sortino": 25.7572, "return_pct": 32.03, "equity": 1320.29, "max_dd": 1.39, "win_rate": 70.54, "profit_factor": 5.547, "ic": 0.7679, "hit": 70.54, "n": 112, "precision": 0.7632, "recall": 0.5472, "f1": 0.6374, "f2": 0.58, "mcc": 0.4161, "accuracy": 0.7054, "tp": 29, "fp": 9, "tn": 50, "fn": 24, "aleatoric_mean": 8e-06, "epistemic_mean": 1.6e-05, "confidence_mean": 1.0, "aleatoric_std": 3e-06, "epistemic_std": 6e-06}, {"fold": "fold_6", "regime": "EUR crisis downturn", "sharpe": 12.2926, "sortino": 43.6821, "return_pct": 24.86, "equity": 1248.57, "max_dd": 0.77, "win_rate": 78.5, "profit_factor": 9.964, "ic": 0.8166, "hit": 77.78, "n": 108, "precision": 0.7857, "recall": 0.7021, "f1": 0.7416, "f2": 0.7174, "mcc": 0.564, "accuracy": 0.787, "tp": 33, "fp": 9, "tn": 52, "fn": 14, "aleatoric_mean": 8e-06, "epistemic_mean": 1.6e-05, "confidence_mean": 1.0, "aleatoric_std": 3e-06, "epistemic_std": 5e-06}, {"fold": "fold_7", "regime": "Recent mixed/upturn", "sharpe": 5.5601, "sortino": 11.7964, "return_pct": 13.35, "equity": 1133.47, "max_dd": 1.31, "win_rate": 64.55, "profit_factor": 2.458, "ic": 0.435, "hit": 64.55, "n": 110, "precision": 0.6522, "recall": 0.566, "f1": 0.6061, "f2": 0.5814, "mcc": 0.289, "accuracy": 0.6455, "tp": 30, "fp": 16, "tn": 41, "fn": 23, "aleatoric_mean": 1.1e-05, "epistemic_mean": 2.3e-05, "confidence_mean": 1.0, "aleatoric_std": 4e-06, "epistemic_std": 9e-06}], "train_sharpe": 6.8225, "train_psr": 1.0, "train_equity": 2036879.38, "train_sortino": 17.0901, "train_return_pct": 203587.94, "train_max_dd": 4.67, "train_win_rate": 74.19, "train_profit_factor": 5.343, "train_ic": 0.6537, "train_hit": 73.89, "train_precision": 0.7314, "train_recall": 0.7802, "train_f1": 0.755, "train_f2": 0.7699, "train_mcc": 0.4791, "train_accuracy": 0.7397, "train_per_window": [{"fold": "all_train", "regime": "Training data", "sharpe": 6.8225, "sortino": 17.0901, "return_pct": 203587.94, "equity": 2036879.38, "max_dd": 4.67, "win_rate": 74.19, "profit_factor": 5.343, "ic": 0.6537, "hit": 73.89, "n": 2478, "precision": 0.7314, "recall": 0.7802, "f1": 0.755, "f2": 0.7699, "mcc": 0.4791, "accuracy": 0.7397, "tp": 994, "fp": 365, "tn": 839, "fn": 280}], "experiment_num": 107, "status": "KEEP"}
{"backbone": "lstm", "description": "lstm: Exp4 hd=0.25 more head reg (Srivastava2014) seed=0", "config": {"seq_len": 10, "lr": 0.001, "batch_size": 32, "epochs": 100, "weight_decay": 1e-05, "patience": 15, "grad_clip": 1.0, "warmup_epochs": 0, "huber_delta": 1.0, "head_dropout": 0.25, "seed": 0, "het_loss": false}, "composite": 6.0725, "test_pos_folds": 7, "val_pos_folds": 6, "val_loss": 2.8e-05, "elapsed_sec": 29.2, "timestamp": "2026-04-19T17:57:19", "sharpe": 6.2282, "psr": 1.0, "equity": 11073.96, "sortino": 11.2711, "return_pct": 1007.4, "max_dd": 5.84, "win_rate": 70.9, "profit_factor": 3.306, "ic": 0.5553, "hit": 70.61, "aleatoric_mean": 1.2e-05, "epistemic_mean": 2.3e-05, "confidence_mean": 1.0, "precision": 0.7506, "recall": 0.6133, "f1": 0.6751, "f2": 0.6366, "mcc": 0.422, "accuracy": 0.7081, "per_window": [{"fold": "fold_1", "regime": "Pre-crisis upturn + GFC onset", "sharpe": 2.0743, "sortino": 5.863, "return_pct": 16.37, "equity": 1163.71, "max_dd": 5.84, "win_rate": 55.88, "profit_factor": 1.641, "ic": 0.1573, "hit": 55.34, "n": 103, "precision": 0.5574, "recall": 0.6415, "f1": 0.5965, "f2": 0.6227, "mcc": 0.1032, "accuracy": 0.5534, "tp": 34, "fp": 27, "tn": 23, "fn": 19, "aleatoric_mean": 2.1e-05, "epistemic_mean": 4.3e-05, "confidence_mean": 0.9999, "aleatoric_std": 1.9e-05, "epistemic_std": 3.8e-05}, {"fold": "fold_2", "regime": "Post-crash recovery", "sharpe": 1.6623, "sortino": 3.0701, "return_pct": 7.97, "equity": 1079.67, "max_dd": 5.39, "win_rate": 57.01, "profit_factor": 1.298, "ic": 0.1097, "hit": 57.01, "n": 107, "precision": 0.5397, "recall": 0.6667, "f1": 0.5965, "f2": 0.6367, "mcc": 0.151, "accuracy": 0.5701, "tp": 34, "fp": 29, "tn": 27, "fn": 17, "aleatoric_mean": 1.3e-05, "epistemic_mean": 2.6e-05, "confidence_mean": 1.0, "aleatoric_std": 7e-06, "epistemic_std": 1.5e-05}, {"fold": "fold_3", "regime": "Eurozone debt plateau", "sharpe": 11.2617, "sortino": 20.8779, "return_pct": 38.34, "equity": 1383.44, "max_dd": 1.32, "win_rate": 82.69, "profit_factor": 6.166, "ic": 0.6848, "hit": 81.13, "n": 106, "precision": 0.8393, "recall": 0.8246, "f1": 0.8319, "f2": 0.8275, "mcc": 0.6401, "accuracy": 0.8208, "tp": 47, "fp": 9, "tn": 40, "fn": 10, "aleatoric_mean": 1.4e-05, "epistemic_mean": 2.7e-05, "confidence_mean": 1.0, "aleatoric_std": 7e-06, "epistemic_std": 1.4e-05}, {"fold": "fold_4", "regime": "Strong USD downturn", "sharpe": 8.4098, "sortino": 15.5046, "return_pct": 77.49, "equity": 1774.93, "max_dd": 1.81, "win_rate": 73.65, "profit_factor": 4.321, "ic": 0.741, "hit": 73.21, "n": 168, "precision": 0.9375, "recall": 0.5233, "f1": 0.6716, "f2": 0.574, "mcc": 0.5385, "accuracy": 0.7381, "tp": 45, "fp": 3, "tn": 79, "fn": 41, "aleatoric_mean": 1e-05, "epistemic_mean": 2e-05, "confidence_mean": 1.0, "aleatoric_std": 5e-06, "epistemic_std": 1e-05}, {"fold": "fold_5", "regime": "Low-vol plateau", "sharpe": 10.3101, "sortino": 27.9836, "return_pct": 33.29, "equity": 1332.89, "max_dd": 0.81, "win_rate": 74.07, "profit_factor": 6.121, "ic": 0.7382, "hit": 74.07, "n": 162, "precision": 0.8148, "recall": 0.5789, "f1": 0.6769, "f2": 0.6145, "mcc": 0.4898, "accuracy": 0.7407, "tp": 44, "fp": 10, "tn": 76, "fn": 32, "aleatoric_mean": 6e-06, "epistemic_mean": 1.3e-05, "confidence_mean": 1.0, "aleatoric_std": 2e-06, "epistemic_std": 4e-06}, {"fold": "fold_6", "regime": "EUR crisis downturn", "sharpe": 12.2285, "sortino": 43.7502, "return_pct": 83.52, "equity": 1835.18, "max_dd": 0.82, "win_rate": 76.97, "profit_factor": 8.202, "ic": 0.7769, "hit": 76.97, "n": 165, "precision": 0.8679, "recall": 0.5974, "f1": 0.7077, "f2": 0.6371, "mcc": 0.5533, "accuracy": 0.7697, "tp": 46, "fp": 7, "tn": 81, "fn": 31, "aleatoric_mean": 1.1e-05, "epistemic_mean": 2.2e-05, "confidence_mean": 1.0, "aleatoric_std": 6e-06, "epistemic_std": 1.2e-05}, {"fold": "fold_7", "regime": "Recent mixed/upturn", "sharpe": 7.0955, "sortino": 10.9279, "return_pct": 46.74, "equity": 1467.41, "max_dd": 2.24, "win_rate": 69.75, "profit_factor": 3.417, "ic": 0.6558, "hit": 69.75, "n": 162, "precision": 0.7759, "recall": 0.5556, "f1": 0.6475, "f2": 0.589, "mcc": 0.412, "accuracy": 0.6975, "tp": 45, "fp": 13, "tn": 68, "fn": 36, "aleatoric_mean": 1.1e-05, "epistemic_mean": 2.2e-05, "confidence_mean": 1.0, "aleatoric_std": 4e-06, "epistemic_std": 9e-06}], "val_sharpe": 6.1725, "val_psr": 1.0, "val_equity": 3885.06, "val_sortino": 9.2104, "val_return_pct": 288.51, "val_max_dd": 9.22, "val_win_rate": 67.23, "val_profit_factor": 2.891, "val_ic": 0.5201, "val_hit": 66.8, "val_aleatoric_mean": 8e-06, "val_epistemic_mean": 1.7e-05, "val_confidence_mean": 1.0, "val_precision": 0.6958, "val_recall": 0.5452, "val_f1": 0.6114, "val_f2": 0.5699, "val_mcc": 0.3402, "val_accuracy": 0.6706, "val_per_window": [{"fold": "fold_1", "regime": "Pre-crisis upturn + GFC onset", "sharpe": 0.1168, "sortino": 0.1861, "return_pct": 0.22, "equity": 1002.21, "max_dd": 3.71, "win_rate": 46.3, "profit_factor": 1.02, "ic": 0.0017, "hit": 45.87, "n": 109, "precision": 0.4694, "recall": 0.4182, "f1": 0.4423, "f2": 0.4275, "mcc": -0.0636, "accuracy": 0.4679, "tp": 23, "fp": 26, "tn": 28, "fn": 32, "aleatoric_mean": 9e-06, "epistemic_mean": 1.7e-05, "confidence_mean": 1.0, "aleatoric_std": 5e-06, "epistemic_std": 1e-05}, {"fold": "fold_2", "regime": "Post-crash recovery", "sharpe": -0.8186, "sortino": -1.3326, "return_pct": -4.16, "equity": 958.44, "max_dd": 9.22, "win_rate": 46.3, "profit_factor": 0.879, "ic": -0.0131, "hit": 46.3, "n": 108, "precision": 0.5676, "recall": 0.3333, "f1": 0.42, "f2": 0.3633, "mcc": -0.0231, "accuracy": 0.463, "tp": 21, "fp": 16, "tn": 29, "fn": 42, "aleatoric_mean": 1.2e-05, "epistemic_mean": 2.4e-05, "confidence_mean": 1.0, "aleatoric_std": 7e-06, "epistemic_std": 1.3e-05}, {"fold": "fold_3", "regime": "Eurozone debt plateau", "sharpe": 11.1461, "sortino": 25.7167, "return_pct": 44.36, "equity": 1443.63, "max_dd": 0.94, "win_rate": 73.39, "profit_factor": 6.69, "ic": 0.7921, "hit": 72.07, "n": 111, "precision": 0.6176, "recall": 0.8936, "f1": 0.7304, "f2": 0.8203, "mcc": 0.4943, "accuracy": 0.7207, "tp": 42, "fp": 26, "tn": 38, "fn": 5, "aleatoric_mean": 8e-06, "epistemic_mean": 1.6e-05, "confidence_mean": 1.0, "aleatoric_std": 3e-06, "epistemic_std": 7e-06}, {"fold": "fold_4", "regime": "Strong USD downturn", "sharpe": 12.2128, "sortino": 32.7167, "return_pct": 39.8, "equity": 1398.05, "max_dd": 0.82, "win_rate": 78.9, "profit_factor": 9.02, "ic": 0.7391, "hit": 78.18, "n": 110, "precision": 0.9286, "recall": 0.5532, "f1": 0.6933, "f2": 0.6019, "mcc": 0.5922, "accuracy": 0.7909, "tp": 26, "fp": 2, "tn": 61, "fn": 21, "aleatoric_mean": 8e-06, "epistemic_mean": 1.6e-05, "confidence_mean": 1.0, "aleatoric_std": 3e-06, "epistemic_std": 6e-06}, {"fold": "fold_5", "regime": "Low-vol plateau", "sharpe": 10.9039, "sortino": 30.918, "return_pct": 34.82, "equity": 1348.23, "max_dd": 1.2, "win_rate": 73.21, "profit_factor": 6.894, "ic": 0.7762, "hit": 73.21, "n": 112, "precision": 0.8966, "recall": 0.4906, "f1": 0.6341, "f2": 0.5394, "mcc": 0.5012, "accuracy": 0.7321, "tp": 26, "fp": 3, "tn": 56, "fn": 27, "aleatoric_mean": 7e-06, "epistemic_mean": 1.3e-05, "confidence_mean": 1.0, "aleatoric_std": 3e-06, "epistemic_std": 7e-06}, {"fold": "fold_6", "regime": "EUR crisis downturn", "sharpe": 11.2094, "sortino": 29.4831, "return_pct": 23.26, "equity": 1232.58, "max_dd": 0.77, "win_rate": 74.77, "profit_factor": 7.705, "ic": 0.8499, "hit": 74.07, "n": 108, "precision": 0.7879, "recall": 0.5532, "f1": 0.65, "f2": 0.5882, "mcc": 0.4719, "accuracy": 0.7407, "tp": 26, "fp": 7, "tn": 54, "fn": 21, "aleatoric_mean": 6e-06, "epistemic_mean": 1.2e-05, "confidence_mean": 1.0, "aleatoric_std": 2e-06, "epistemic_std": 4e-06}, {"fold": "fold_7", "regime": "Recent mixed/upturn", "sharpe": 8.9995, "sortino": 18.7907, "return_pct": 20.59, "equity": 1205.91, "max_dd": 0.79, "win_rate": 77.27, "profit_factor": 4.392, "ic": 0.6951, "hit": 77.27, "n": 110, "precision": 0.8333, "recall": 0.6604, "f1": 0.7368, "f2": 0.689, "mcc": 0.5529, "accuracy": 0.7727, "tp": 35, "fp": 7, "tn": 50, "fn": 18, "aleatoric_mean": 1e-05, "epistemic_mean": 1.9e-05, "confidence_mean": 1.0, "aleatoric_std": 4e-06, "epistemic_std": 9e-06}], "train_sharpe": 6.7494, "train_psr": 1.0, "train_equity": 1899551.38, "train_sortino": 16.798, "train_return_pct": 189855.14, "train_max_dd": 4.82, "train_win_rate": 73.7, "train_profit_factor": 5.22, "train_ic": 0.6932, "train_hit": 73.41, "train_precision": 0.8152, "train_recall": 0.6303, "train_f1": 0.7109, "train_f2": 0.6603, "train_mcc": 0.4893, "train_accuracy": 0.7365, "train_per_window": [{"fold": "all_train", "regime": "Training data", "sharpe": 6.7494, "sortino": 16.798, "return_pct": 189855.14, "equity": 1899551.38, "max_dd": 4.82, "win_rate": 73.7, "profit_factor": 5.22, "ic": 0.6932, "hit": 73.41, "n": 2478, "precision": 0.8152, "recall": 0.6303, "f1": 0.7109, "f2": 0.6603, "mcc": 0.4893, "accuracy": 0.7365, "tp": 803, "fp": 182, "tn": 1022, "fn": 471}], "experiment_num": 108, "status": "KEEP"}
