{"backbone": "mamba", "description": "mamba: Exp18 dmamba expand=4 lr=3e-4 (Lewkowycz 2020 lower LR)", "config": {"seq_len": 10, "lr": 0.0003, "batch_size": 32, "epochs": 100, "weight_decay": 0.1, "patience": 20, "grad_clip": 1.0, "warmup_epochs": 10, "huber_delta": 1.0, "head_dropout": 0.1, "seed": 42, "mamba_variant": "dmamba", "mamba_expand": 4, "het_loss": false}, "composite": 4.1448, "test_pos_folds": 6, "val_pos_folds": 5, "val_loss": 4.1e-05, "elapsed_sec": 305.6, "timestamp": "2026-04-20T02:04:01", "sharpe": 4.4448, "psr": 1.0, "equity": 5864.86, "sortino": 5.7084, "return_pct": 486.49, "max_dd": 9.46, "win_rate": 63.78, "profit_factor": 2.308, "ic": 0.4139, "hit": 63.51, "aleatoric_mean": 3.5e-05, "epistemic_mean": 7.1e-05, "confidence_mean": 0.9999, "precision": 0.6286, "recall": 0.6403, "f1": 0.6344, "f2": 0.6379, "mcc": 0.2704, "accuracy": 0.6351, "per_window": [{"fold": "fold_1", "regime": "Pre-crisis upturn + GFC onset", "sharpe": -0.3968, "sortino": -0.4537, "return_pct": -3.72, "equity": 962.79, "max_dd": 9.46, "win_rate": 48.04, "profit_factor": 0.911, "ic": -0.0044, "hit": 47.57, "n": 103, "precision": 0.4928, "recall": 0.6415, "f1": 0.5574, "f2": 0.605, "mcc": -0.0622, "accuracy": 0.4757, "tp": 34, "fp": 35, "tn": 15, "fn": 19, "aleatoric_mean": 5.4e-05, "epistemic_mean": 0.000109, "confidence_mean": 0.9998, "aleatoric_std": 4.3e-05, "epistemic_std": 8.7e-05}, {"fold": "fold_2", "regime": "Post-crash recovery", "sharpe": 2.4259, "sortino": 4.6206, "return_pct": 11.9, "equity": 1118.97, "max_dd": 3.82, "win_rate": 54.21, "profit_factor": 1.463, "ic": 0.1439, "hit": 54.21, "n": 107, "precision": 0.5312, "recall": 0.3333, "f1": 0.4096, "f2": 0.3602, "mcc": 0.0714, "accuracy": 0.5421, "tp": 17, "fp": 15, "tn": 41, "fn": 34, "aleatoric_mean": 3.7e-05, "epistemic_mean": 7.5e-05, "confidence_mean": 0.9999, "aleatoric_std": 1.8e-05, "epistemic_std": 3.6e-05}, {"fold": "fold_3", "regime": "Eurozone debt plateau", "sharpe": 6.0323, "sortino": 11.4228, "return_pct": 21.98, "equity": 1219.8, "max_dd": 2.74, "win_rate": 65.38, "profit_factor": 2.588, "ic": 0.4444, "hit": 64.15, "n": 106, "precision": 0.6727, "recall": 0.6491, "f1": 0.6607, "f2": 0.6537, "mcc": 0.2812, "accuracy": 0.6415, "tp": 37, "fp": 18, "tn": 31, "fn": 20, "aleatoric_mean": 4.8e-05, "epistemic_mean": 9.6e-05, "confidence_mean": 0.9999, "aleatoric_std": 2.8e-05, "epistemic_std": 5.6e-05}, {"fold": "fold_4", "regime": "Strong USD downturn", "sharpe": 5.8341, "sortino": 9.7254, "return_pct": 52.44, "equity": 1524.39, "max_dd": 3.03, "win_rate": 65.87, "profit_factor": 2.703, "ic": 0.5678, "hit": 65.48, "n": 168, "precision": 0.7059, "recall": 0.5581, "f1": 0.6234, "f2": 0.5825, "mcc": 0.32, "accuracy": 0.6548, "tp": 48, "fp": 20, "tn": 62, "fn": 38, "aleatoric_mean": 4.2e-05, "epistemic_mean": 8.3e-05, "confidence_mean": 0.9999, "aleatoric_std": 2.3e-05, "epistemic_std": 4.7e-05}, {"fold": "fold_5", "regime": "Low-vol plateau", "sharpe": 4.7683, "sortino": 8.381, "return_pct": 16.34, "equity": 1163.42, "max_dd": 1.36, "win_rate": 63.58, "profit_factor": 2.225, "ic": 0.4399, "hit": 63.58, "n": 162, "precision": 0.6024, "recall": 0.6579, "f1": 0.6289, "f2": 0.646, "mcc": 0.2737, "accuracy": 0.6358, "tp": 50, "fp": 33, "tn": 53, "fn": 26, "aleatoric_mean": 2e-05, "epistemic_mean": 3.9e-05, "confidence_mean": 0.9999, "aleatoric_std": 8e-06, "epistemic_std": 1.6e-05}, {"fold": "fold_6", "regime": "EUR crisis downturn", "sharpe": 9.8114, "sortino": 20.865, "return_pct": 68.65, "equity": 1686.49, "max_dd": 1.74, "win_rate": 71.52, "profit_factor": 5.14, "ic": 0.6217, "hit": 71.52, "n": 165, "precision": 0.7083, "recall": 0.6623, "f1": 0.6846, "f2": 0.6711, "mcc": 0.4262, "accuracy": 0.7152, "tp": 51, "fp": 21, "tn": 67, "fn": 26, "aleatoric_mean": 3.2e-05, "epistemic_mean": 6.5e-05, "confidence_mean": 0.9999, "aleatoric_std": 1.7e-05, "epistemic_std": 3.4e-05}, {"fold": "fold_7", "regime": "Recent mixed/upturn", "sharpe": 7.4684, "sortino": 14.0859, "return_pct": 49.21, "equity": 1492.13, "max_dd": 2.75, "win_rate": 69.14, "profit_factor": 3.66, "ic": 0.6373, "hit": 69.14, "n": 162, "precision": 0.6396, "recall": 0.8765, "f1": 0.7396, "f2": 0.8161, "mcc": 0.412, "accuracy": 0.6914, "tp": 71, "fp": 40, "tn": 41, "fn": 10, "aleatoric_mean": 2.7e-05, "epistemic_mean": 5.3e-05, "confidence_mean": 0.9999, "aleatoric_std": 1.3e-05, "epistemic_std": 2.6e-05}], "val_sharpe": 4.61, "val_psr": 1.0, "val_equity": 2835.57, "val_sortino": 7.3598, "val_return_pct": 183.56, "val_max_dd": 7.77, "val_win_rate": 61.34, "val_profit_factor": 2.195, "val_ic": 0.3778, "val_hit": 60.94, "val_aleatoric_mean": 2.6e-05, "val_epistemic_mean": 5.3e-05, "val_confidence_mean": 0.9999, "val_precision": 0.5794, "val_recall": 0.6795, "val_f1": 0.6255, "val_f2": 0.6568, "val_mcc": 0.2341, "val_accuracy": 0.6133, "val_per_window": [{"fold": "fold_1", "regime": "Pre-crisis upturn + GFC onset", "sharpe": -0.8772, "sortino": -1.3492, "return_pct": -2.26, "equity": 977.41, "max_dd": 3.85, "win_rate": 45.37, "profit_factor": 0.865, "ic": -0.1167, "hit": 44.95, "n": 109, "precision": 0.4658, "recall": 0.6182, "f1": 0.5312, "f2": 0.5802, "mcc": -0.1106, "accuracy": 0.4495, "tp": 34, "fp": 39, "tn": 15, "fn": 21, "aleatoric_mean": 2.5e-05, "epistemic_mean": 4.9e-05, "confidence_mean": 0.9999, "aleatoric_std": 1.7e-05, "epistemic_std": 3.5e-05}, {"fold": "fold_2", "regime": "Post-crash recovery", "sharpe": -0.4954, "sortino": -0.8639, "return_pct": -2.64, "equity": 973.56, "max_dd": 5.24, "win_rate": 47.22, "profit_factor": 0.925, "ic": -0.0435, "hit": 47.22, "n": 108, "precision": 0.5429, "recall": 0.6032, "f1": 0.5714, "f2": 0.5901, "mcc": -0.1114, "accuracy": 0.4722, "tp": 38, "fp": 32, "tn": 13, "fn": 25, "aleatoric_mean": 4.2e-05, "epistemic_mean": 8.3e-05, "confidence_mean": 0.9999, "aleatoric_std": 2e-05, "epistemic_std": 4.1e-05}, {"fold": "fold_3", "regime": "Eurozone debt plateau", "sharpe": 6.8176, "sortino": 12.3011, "return_pct": 28.6, "equity": 1286.03, "max_dd": 2.62, "win_rate": 69.72, "profit_factor": 3.066, "ic": 0.4927, "hit": 68.47, "n": 111, "precision": 0.6757, "recall": 0.5319, "f1": 0.5952, "f2": 0.5556, "mcc": 0.361, "accuracy": 0.6937, "tp": 25, "fp": 12, "tn": 52, "fn": 22, "aleatoric_mean": 3e-05, "epistemic_mean": 6e-05, "confidence_mean": 0.9999, "aleatoric_std": 1.5e-05, "epistemic_std": 3e-05}, {"fold": "fold_4", "regime": "Strong USD downturn", "sharpe": 8.6262, "sortino": 16.6622, "return_pct": 29.96, "equity": 1299.62, "max_dd": 0.98, "win_rate": 68.81, "profit_factor": 4.358, "ic": 0.5954, "hit": 68.18, "n": 110, "precision": 0.6327, "recall": 0.6596, "f1": 0.6458, "f2": 0.654, "mcc": 0.3721, "accuracy": 0.6909, "tp": 31, "fp": 18, "tn": 45, "fn": 16, "aleatoric_mean": 2.5e-05, "epistemic_mean": 5.1e-05, "confidence_mean": 0.9999, "aleatoric_std": 1.2e-05, "epistemic_std": 2.4e-05}, {"fold": "fold_5", "regime": "Low-vol plateau", "sharpe": 9.3671, "sortino": 23.0197, "return_pct": 30.74, "equity": 1307.43, "max_dd": 0.75, "win_rate": 69.64, "profit_factor": 5.064, "ic": 0.6821, "hit": 69.64, "n": 112, "precision": 0.661, "recall": 0.7358, "f1": 0.6964, "f2": 0.7196, "mcc": 0.3969, "accuracy": 0.6964, "tp": 39, "fp": 20, "tn": 39, "fn": 14, "aleatoric_mean": 2.4e-05, "epistemic_mean": 4.9e-05, "confidence_mean": 0.9999, "aleatoric_std": 1.3e-05, "epistemic_std": 2.6e-05}, {"fold": "fold_6", "regime": "EUR crisis downturn", "sharpe": 9.5424, "sortino": 25.0095, "return_pct": 20.53, "equity": 1205.28, "max_dd": 0.73, "win_rate": 70.09, "profit_factor": 5.41, "ic": 0.6393, "hit": 69.44, "n": 108, "precision": 0.6316, "recall": 0.766, "f1": 0.6923, "f2": 0.7347, "mcc": 0.4188, "accuracy": 0.7037, "tp": 36, "fp": 21, "tn": 40, "fn": 11, "aleatoric_mean": 1.7e-05, "epistemic_mean": 3.4e-05, "confidence_mean": 0.9999, "aleatoric_std": 6e-06, "epistemic_std": 1.3e-05}, {"fold": "fold_7", "regime": "Recent mixed/upturn", "sharpe": 5.4714, "sortino": 13.5997, "return_pct": 13.14, "equity": 1131.44, "max_dd": 1.44, "win_rate": 58.18, "profit_factor": 2.423, "ic": 0.513, "hit": 58.18, "n": 110, "precision": 0.5422, "recall": 0.8491, "f1": 0.6618, "f2": 0.7627, "mcc": 0.2118, "accuracy": 0.5818, "tp": 45, "fp": 38, "tn": 19, "fn": 8, "aleatoric_mean": 2.1e-05, "epistemic_mean": 4.2e-05, "confidence_mean": 0.9999, "aleatoric_std": 9e-06, "epistemic_std": 1.7e-05}], "train_sharpe": 7.5267, "train_psr": 1.0, "train_equity": 3917201.5, "train_sortino": 21.0295, "train_return_pct": 391620.15, "train_max_dd": 3.35, "train_win_rate": 75.81, "train_profit_factor": 6.779, "train_ic": 0.7163, "train_hit": 75.5, "train_precision": 0.7687, "train_recall": 0.7567, "train_f1": 0.7627, "train_f2": 0.7591, "train_mcc": 0.5156, "train_accuracy": 0.7579, "train_per_window": [{"fold": "all_train", "regime": "Training data", "sharpe": 7.5267, "sortino": 21.0295, "return_pct": 391620.15, "equity": 3917201.5, "max_dd": 3.35, "win_rate": 75.81, "profit_factor": 6.779, "ic": 0.7163, "hit": 75.5, "n": 2478, "precision": 0.7687, "recall": 0.7567, "f1": 0.7627, "f2": 0.7591, "mcc": 0.5156, "accuracy": 0.7579, "tp": 964, "fp": 290, "tn": 914, "fn": 310}], "experiment_num": 169, "status": "DISCARD"}
{"backbone": "mamba", "description": "mamba: Exp19 dmamba expand=4 lr=1e-3 (LSTM-style upper bound)", "config": {"seq_len": 10, "lr": 0.001, "batch_size": 32, "epochs": 100, "weight_decay": 0.1, "patience": 20, "grad_clip": 1.0, "warmup_epochs": 10, "huber_delta": 1.0, "head_dropout": 0.1, "seed": 42, "mamba_variant": "dmamba", "mamba_expand": 4, "het_loss": false}, "composite": 4.805, "test_pos_folds": 7, "val_pos_folds": 7, "val_loss": 3.6e-05, "elapsed_sec": 222.4, "timestamp": "2026-04-20T02:08:39", "sharpe": 4.805, "psr": 1.0, "equity": 6703.96, "sortino": 8.6483, "return_pct": 570.4, "max_dd": 11.67, "win_rate": 64.5, "profit_factor": 2.477, "ic": 0.4146, "hit": 64.23, "aleatoric_mean": 2.2e-05, "epistemic_mean": 4.4e-05, "confidence_mean": 0.9999, "precision": 0.6419, "recall": 0.6299, "f1": 0.6359, "f2": 0.6323, "mcc": 0.2866, "accuracy": 0.6434, "per_window": [{"fold": "fold_1", "regime": "Pre-crisis upturn + GFC onset", "sharpe": 0.9613, "sortino": 2.8142, "return_pct": 6.93, "equity": 1069.26, "max_dd": 10.63, "win_rate": 46.08, "profit_factor": 1.255, "ic": 0.0104, "hit": 45.63, "n": 103, "precision": 0.4717, "recall": 0.4717, "f1": 0.4717, "f2": 0.4717, "mcc": -0.0883, "accuracy": 0.4563, "tp": 25, "fp": 28, "tn": 22, "fn": 28, "aleatoric_mean": 3.6e-05, "epistemic_mean": 7.2e-05, "confidence_mean": 0.9999, "aleatoric_std": 2.8e-05, "epistemic_std": 5.7e-05}, {"fold": "fold_2", "regime": "Post-crash recovery", "sharpe": 3.6119, "sortino": 7.0346, "return_pct": 18.1, "equity": 1181.0, "max_dd": 2.63, "win_rate": 57.94, "profit_factor": 1.762, "ic": 0.1044, "hit": 57.94, "n": 107, "precision": 0.5938, "recall": 0.3725, "f1": 0.4578, "f2": 0.4025, "mcc": 0.1532, "accuracy": 0.5794, "tp": 19, "fp": 13, "tn": 43, "fn": 32, "aleatoric_mean": 2.5e-05, "epistemic_mean": 5e-05, "confidence_mean": 0.9999, "aleatoric_std": 1.4e-05, "epistemic_std": 2.9e-05}, {"fold": "fold_3", "regime": "Eurozone debt plateau", "sharpe": 6.3769, "sortino": 13.2725, "return_pct": 23.19, "equity": 1231.91, "max_dd": 2.51, "win_rate": 69.23, "profit_factor": 2.734, "ic": 0.5225, "hit": 67.92, "n": 106, "precision": 0.7091, "recall": 0.6842, "f1": 0.6964, "f2": 0.689, "mcc": 0.3569, "accuracy": 0.6792, "tp": 39, "fp": 16, "tn": 33, "fn": 18, "aleatoric_mean": 3e-05, "epistemic_mean": 6.1e-05, "confidence_mean": 0.9999, "aleatoric_std": 1.6e-05, "epistemic_std": 3.3e-05}, {"fold": "fold_4", "regime": "Strong USD downturn", "sharpe": 5.6789, "sortino": 8.4193, "return_pct": 50.92, "equity": 1509.17, "max_dd": 3.03, "win_rate": 68.86, "profit_factor": 2.63, "ic": 0.5843, "hit": 68.45, "n": 168, "precision": 0.7742, "recall": 0.5581, "f1": 0.6486, "f2": 0.5911, "mcc": 0.4013, "accuracy": 0.6905, "tp": 48, "fp": 14, "tn": 68, "fn": 38, "aleatoric_mean": 2.6e-05, "epistemic_mean": 5.2e-05, "confidence_mean": 0.9999, "aleatoric_std": 1.4e-05, "epistemic_std": 2.9e-05}, {"fold": "fold_5", "regime": "Low-vol plateau", "sharpe": 6.5867, "sortino": 13.2428, "return_pct": 22.38, "equity": 1223.76, "max_dd": 1.42, "win_rate": 62.96, "profit_factor": 3.048, "ic": 0.5357, "hit": 62.96, "n": 162, "precision": 0.5741, "recall": 0.8158, "f1": 0.6739, "f2": 0.7524, "mcc": 0.2974, "accuracy": 0.6296, "tp": 62, "fp": 46, "tn": 40, "fn": 14, "aleatoric_mean": 1e-05, "epistemic_mean": 2e-05, "confidence_mean": 1.0, "aleatoric_std": 4e-06, "epistemic_std": 9e-06}, {"fold": "fold_6", "regime": "EUR crisis downturn", "sharpe": 7.7582, "sortino": 13.4045, "return_pct": 54.65, "equity": 1546.51, "max_dd": 2.4, "win_rate": 67.27, "profit_factor": 3.578, "ic": 0.5827, "hit": 67.27, "n": 165, "precision": 0.7018, "recall": 0.5195, "f1": 0.597, "f2": 0.5479, "mcc": 0.3423, "accuracy": 0.6727, "tp": 40, "fp": 17, "tn": 71, "fn": 37, "aleatoric_mean": 2.2e-05, "epistemic_mean": 4.3e-05, "confidence_mean": 0.9999, "aleatoric_std": 1.2e-05, "epistemic_std": 2.3e-05}, {"fold": "fold_7", "regime": "Recent mixed/upturn", "sharpe": 7.7223, "sortino": 12.0872, "return_pct": 50.88, "equity": 1508.8, "max_dd": 2.71, "win_rate": 71.6, "profit_factor": 3.837, "ic": 0.5793, "hit": 71.6, "n": 162, "precision": 0.6667, "recall": 0.8642, "f1": 0.7527, "f2": 0.8159, "mcc": 0.4524, "accuracy": 0.716, "tp": 70, "fp": 35, "tn": 46, "fn": 11, "aleatoric_mean": 1.4e-05, "epistemic_mean": 2.8e-05, "confidence_mean": 1.0, "aleatoric_std": 8e-06, "epistemic_std": 1.5e-05}], "val_sharpe": 5.6247, "val_psr": 1.0, "val_equity": 3490.28, "val_sortino": 8.8863, "val_return_pct": 249.03, "val_max_dd": 7.24, "val_win_rate": 65.01, "val_profit_factor": 2.622, "val_ic": 0.4541, "val_hit": 64.58, "val_aleatoric_mean": 1.5e-05, "val_epistemic_mean": 3e-05, "val_confidence_mean": 1.0, "val_precision": 0.5937, "val_recall": 0.8247, "val_f1": 0.6904, "val_f2": 0.7651, "val_mcc": 0.3305, "val_accuracy": 0.6484, "val_per_window": [{"fold": "fold_1", "regime": "Pre-crisis upturn + GFC onset", "sharpe": 2.1513, "sortino": 3.8649, "return_pct": 5.45, "equity": 1054.53, "max_dd": 2.44, "win_rate": 51.85, "profit_factor": 1.429, "ic": 0.0726, "hit": 51.38, "n": 109, "precision": 0.51, "recall": 0.9273, "f1": 0.6581, "f2": 0.7969, "mcc": 0.0361, "accuracy": 0.5138, "tp": 51, "fp": 49, "tn": 5, "fn": 4, "aleatoric_mean": 1.3e-05, "epistemic_mean": 2.6e-05, "confidence_mean": 1.0, "aleatoric_std": 1.2e-05, "epistemic_std": 2.4e-05}, {"fold": "fold_2", "regime": "Post-crash recovery", "sharpe": 0.0618, "sortino": 0.1022, "return_pct": 0.02, "equity": 1000.25, "max_dd": 7.24, "win_rate": 47.22, "profit_factor": 1.01, "ic": -0.0024, "hit": 47.22, "n": 108, "precision": 0.5556, "recall": 0.4762, "f1": 0.5128, "f2": 0.4902, "mcc": -0.0563, "accuracy": 0.4722, "tp": 30, "fp": 24, "tn": 21, "fn": 33, "aleatoric_mean": 2.7e-05, "epistemic_mean": 5.4e-05, "confidence_mean": 0.9999, "aleatoric_std": 1.5e-05, "epistemic_std": 2.9e-05}, {"fold": "fold_3", "regime": "Eurozone debt plateau", "sharpe": 10.2538, "sortino": 24.2522, "return_pct": 41.42, "equity": 1414.22, "max_dd": 1.58, "win_rate": 76.15, "profit_factor": 5.637, "ic": 0.6757, "hit": 74.77, "n": 111, "precision": 0.6863, "recall": 0.7447, "f1": 0.7143, "f2": 0.7322, "mcc": 0.4905, "accuracy": 0.7477, "tp": 35, "fp": 16, "tn": 48, "fn": 12, "aleatoric_mean": 1.7e-05, "epistemic_mean": 3.4e-05, "confidence_mean": 0.9999, "aleatoric_std": 9e-06, "epistemic_std": 1.8e-05}, {"fold": "fold_4", "regime": "Strong USD downturn", "sharpe": 7.8425, "sortino": 16.9409, "return_pct": 27.51, "equity": 1275.1, "max_dd": 1.14, "win_rate": 68.81, "profit_factor": 3.778, "ic": 0.6852, "hit": 68.18, "n": 110, "precision": 0.589, "recall": 0.9149, "f1": 0.7167, "f2": 0.8238, "mcc": 0.4593, "accuracy": 0.6909, "tp": 43, "fp": 30, "tn": 33, "fn": 4, "aleatoric_mean": 1.4e-05, "epistemic_mean": 2.8e-05, "confidence_mean": 1.0, "aleatoric_std": 7e-06, "epistemic_std": 1.5e-05}, {"fold": "fold_5", "regime": "Low-vol plateau", "sharpe": 11.3064, "sortino": 27.5185, "return_pct": 35.82, "equity": 1358.23, "max_dd": 1.18, "win_rate": 77.68, "profit_factor": 7.512, "ic": 0.7323, "hit": 77.68, "n": 112, "precision": 0.7188, "recall": 0.8679, "f1": 0.7863, "f2": 0.8333, "mcc": 0.5679, "accuracy": 0.7768, "tp": 46, "fp": 18, "tn": 41, "fn": 7, "aleatoric_mean": 1.3e-05, "epistemic_mean": 2.7e-05, "confidence_mean": 1.0, "aleatoric_std": 9e-06, "epistemic_std": 1.7e-05}, {"fold": "fold_6", "regime": "EUR crisis downturn", "sharpe": 8.1607, "sortino": 10.6317, "return_pct": 18.01, "equity": 1180.13, "max_dd": 1.08, "win_rate": 73.83, "profit_factor": 4.135, "ic": 0.772, "hit": 73.15, "n": 108, "precision": 0.6338, "recall": 0.9574, "f1": 0.7627, "f2": 0.8687, "mcc": 0.555, "accuracy": 0.7407, "tp": 45, "fp": 26, "tn": 35, "fn": 2, "aleatoric_mean": 9e-06, "epistemic_mean": 1.8e-05, "confidence_mean": 1.0, "aleatoric_std": 4e-06, "epistemic_std": 8e-06}, {"fold": "fold_7", "regime": "Recent mixed/upturn", "sharpe": 6.0608, "sortino": 15.0664, "return_pct": 14.48, "equity": 1144.8, "max_dd": 0.9, "win_rate": 59.09, "profit_factor": 2.669, "ic": 0.6468, "hit": 59.09, "n": 110, "precision": 0.5426, "recall": 0.9623, "f1": 0.6939, "f2": 0.8333, "mcc": 0.2946, "accuracy": 0.5909, "tp": 51, "fp": 43, "tn": 14, "fn": 2, "aleatoric_mean": 1.1e-05, "epistemic_mean": 2.2e-05, "confidence_mean": 1.0, "aleatoric_std": 4e-06, "epistemic_std": 9e-06}], "train_sharpe": 6.7191, "train_psr": 1.0, "train_equity": 1845209.38, "train_sortino": 14.95, "train_return_pct": 184420.94, "train_max_dd": 3.25, "train_win_rate": 73.78, "train_profit_factor": 5.171, "train_ic": 0.6505, "train_hit": 73.49, "train_precision": 0.7285, "train_recall": 0.7771, "train_f1": 0.752, "train_f2": 0.7668, "train_mcc": 0.4726, "train_accuracy": 0.7365, "train_per_window": [{"fold": "all_train", "regime": "Training data", "sharpe": 6.7191, "sortino": 14.95, "return_pct": 184420.94, "equity": 1845209.38, "max_dd": 3.25, "win_rate": 73.78, "profit_factor": 5.171, "ic": 0.6505, "hit": 73.49, "n": 2478, "precision": 0.7285, "recall": 0.7771, "f1": 0.752, "f2": 0.7668, "mcc": 0.4726, "accuracy": 0.7365, "tp": 990, "fp": 369, "tn": 835, "fn": 284}], "experiment_num": 170, "status": "DISCARD"}
