{"backbone": "mlp", "description": "mlp: lr=1e-4 seed=42", "config": {"seq_len": 10, "lr": 0.0001, "batch_size": 32, "epochs": 20, "weight_decay": 1e-05, "patience": 5, "grad_clip": 1.0, "warmup_epochs": 0, "huber_delta": 1.0, "head_dropout": 0.1, "seed": 42, "het_loss": false}, "composite": -0.4997, "test_pos_folds": 4, "val_pos_folds": 4, "val_loss": 0.000143, "elapsed_sec": 7.3, "timestamp": "2026-04-12T17:24:46", "sharpe": 0.1003, "psr": 0.5779, "equity": 1019.41, "sortino": 0.1308, "return_pct": 1.94, "max_dd": 17.04, "win_rate": 52.01, "profit_factor": 1.019, "ic": 0.0369, "hit": 51.8, "aleatoric_mean": 0.000494, "epistemic_mean": 0.000988, "confidence_mean": 0.9985, "per_window": [{"fold": "fold_1", "regime": "Pre-crisis upturn + GFC onset", "sharpe": 1.2618, "sortino": 1.374, "return_pct": 9.38, "equity": 1093.85, "max_dd": 9.34, "win_rate": 54.9, "profit_factor": 1.349, "ic": 0.1219, "hit": 54.37, "n": 103, "aleatoric_mean": 0.000625, "epistemic_mean": 0.00125, "confidence_mean": 0.9981, "aleatoric_std": 0.000247, "epistemic_std": 0.000494}, {"fold": "fold_2", "regime": "Post-crash recovery", "sharpe": -2.146, "sortino": -3.7755, "return_pct": -9.95, "equity": 900.5, "max_dd": 12.55, "win_rate": 45.79, "profit_factor": 0.714, "ic": -0.0462, "hit": 45.79, "n": 107, "aleatoric_mean": 0.000485, "epistemic_mean": 0.000969, "confidence_mean": 0.9985, "aleatoric_std": 0.00019, "epistemic_std": 0.00038}, {"fold": "fold_3", "regime": "Eurozone debt plateau", "sharpe": -0.3129, "sortino": -0.5811, "return_pct": -1.25, "equity": 987.48, "max_dd": 4.91, "win_rate": 52.88, "profit_factor": 0.952, "ic": 0.0547, "hit": 51.89, "n": 106, "aleatoric_mean": 0.000515, "epistemic_mean": 0.00103, "confidence_mean": 0.9985, "aleatoric_std": 0.000187, "epistemic_std": 0.000374}, {"fold": "fold_4", "regime": "Strong USD downturn", "sharpe": 0.0436, "sortino": 0.0573, "return_pct": -0.12, "equity": 998.84, "max_dd": 8.53, "win_rate": 53.89, "profit_factor": 1.007, "ic": 0.0377, "hit": 53.57, "n": 168, "aleatoric_mean": 0.000524, "epistemic_mean": 0.001047, "confidence_mean": 0.9984, "aleatoric_std": 0.000178, "epistemic_std": 0.000356}, {"fold": "fold_5", "regime": "Low-vol plateau", "sharpe": 1.7368, "sortino": 2.6127, "return_pct": 5.83, "equity": 1058.32, "max_dd": 4.24, "win_rate": 53.09, "profit_factor": 1.335, "ic": 0.1526, "hit": 53.09, "n": 162, "aleatoric_mean": 0.000394, "epistemic_mean": 0.000788, "confidence_mean": 0.9988, "aleatoric_std": 0.000133, "epistemic_std": 0.000265}, {"fold": "fold_6", "regime": "EUR crisis downturn", "sharpe": -1.3292, "sortino": -2.2592, "return_pct": -8.28, "equity": 917.18, "max_dd": 14.77, "win_rate": 45.45, "profit_factor": 0.807, "ic": 0.0398, "hit": 45.45, "n": 165, "aleatoric_mean": 0.000559, "epistemic_mean": 0.001117, "confidence_mean": 0.9983, "aleatoric_std": 0.000231, "epistemic_std": 0.000463}, {"fold": "fold_7", "regime": "Recent mixed/upturn", "sharpe": 1.3572, "sortino": 1.8275, "return_pct": 8.1, "equity": 1080.98, "max_dd": 6.76, "win_rate": 57.41, "profit_factor": 1.258, "ic": 0.1368, "hit": 57.41, "n": 162, "aleatoric_mean": 0.000408, "epistemic_mean": 0.000816, "confidence_mean": 0.9988, "aleatoric_std": 0.000146, "epistemic_std": 0.000292}], "val_sharpe": 0.6305, "val_psr": 0.8657, "val_equity": 1150.71, "val_sortino": 1.0333, "val_return_pct": 15.07, "val_max_dd": 6.95, "val_win_rate": 48.75, "val_profit_factor": 1.112, "val_ic": 0.0173, "val_hit": 48.44, "val_aleatoric_mean": 0.000414, "val_epistemic_mean": 0.000828, "val_confidence_mean": 0.9988, "val_per_window": [{"fold": "fold_1", "regime": "Pre-crisis upturn + GFC onset", "sharpe": -1.4048, "sortino": -2.1566, "return_pct": -3.54, "equity": 964.57, "max_dd": 4.67, "win_rate": 44.44, "profit_factor": 0.792, "ic": -0.0949, "hit": 44.04, "n": 109, "aleatoric_mean": 0.000407, "epistemic_mean": 0.000814, "confidence_mean": 0.9988, "aleatoric_std": 0.000169, "epistemic_std": 0.000337}, {"fold": "fold_2", "regime": "Post-crash recovery", "sharpe": -0.0395, "sortino": -0.0698, "return_pct": -0.47, "equity": 995.34, "max_dd": 4.72, "win_rate": 47.22, "profit_factor": 0.994, "ic": -0.0257, "hit": 47.22, "n": 108, "aleatoric_mean": 0.000434, "epistemic_mean": 0.000867, "confidence_mean": 0.9987, "aleatoric_std": 0.000152, "epistemic_std": 0.000303}, {"fold": "fold_3", "regime": "Eurozone debt plateau", "sharpe": 2.2757, "sortino": 4.6305, "return_pct": 9.34, "equity": 1093.38, "max_dd": 2.67, "win_rate": 52.29, "profit_factor": 1.447, "ic": 0.1521, "hit": 51.35, "n": 111, "aleatoric_mean": 0.000452, "epistemic_mean": 0.000904, "confidence_mean": 0.9986, "aleatoric_std": 0.000163, "epistemic_std": 0.000326}, {"fold": "fold_4", "regime": "Strong USD downturn", "sharpe": 0.7458, "sortino": 1.0965, "return_pct": 2.48, "equity": 1024.81, "max_dd": 5.15, "win_rate": 54.13, "profit_factor": 1.131, "ic": 0.1112, "hit": 53.64, "n": 110, "aleatoric_mean": 0.000441, "epistemic_mean": 0.000883, "confidence_mean": 0.9987, "aleatoric_std": 0.000164, "epistemic_std": 0.000328}, {"fold": "fold_5", "regime": "Low-vol plateau", "sharpe": 2.0908, "sortino": 4.3625, "return_pct": 7.03, "equity": 1070.31, "max_dd": 3.97, "win_rate": 49.11, "profit_factor": 1.416, "ic": -0.0152, "hit": 49.11, "n": 112, "aleatoric_mean": 0.000412, "epistemic_mean": 0.000824, "confidence_mean": 0.9988, "aleatoric_std": 0.000137, "epistemic_std": 0.000274}, {"fold": "fold_6", "regime": "EUR crisis downturn", "sharpe": -1.3855, "sortino": -2.1125, "return_pct": -3.17, "equity": 968.29, "max_dd": 4.97, "win_rate": 43.93, "profit_factor": 0.792, "ic": -0.1069, "hit": 43.52, "n": 108, "aleatoric_mean": 0.000356, "epistemic_mean": 0.000712, "confidence_mean": 0.9989, "aleatoric_std": 0.000124, "epistemic_std": 0.000247}, {"fold": "fold_7", "regime": "Recent mixed/upturn", "sharpe": 1.3494, "sortino": 2.1085, "return_pct": 3.21, "equity": 1032.11, "max_dd": 3.16, "win_rate": 50.0, "profit_factor": 1.242, "ic": 0.0407, "hit": 50.0, "n": 110, "aleatoric_mean": 0.000394, "epistemic_mean": 0.000787, "confidence_mean": 0.9988, "aleatoric_std": 0.000117, "epistemic_std": 0.000235}], "train_sharpe": 3.1315, "train_psr": 1.0, "train_equity": 40325.02, "train_sortino": 7.6169, "train_return_pct": 3932.5, "train_max_dd": 6.9, "train_win_rate": 58.14, "train_profit_factor": 2.01, "train_ic": 0.2677, "train_hit": 57.91, "train_per_window": [{"fold": "all_train", "regime": "Training data", "sharpe": 3.1315, "sortino": 7.6169, "return_pct": 3932.5, "equity": 40325.02, "max_dd": 6.9, "win_rate": 58.14, "profit_factor": 2.01, "ic": 0.2677, "hit": 57.91, "n": 2478}], "experiment_num": 53, "status": "DISCARD"}
{"backbone": "mlp", "description": "mlp: lr=1e-4 seed=99", "config": {"seq_len": 10, "lr": 0.0001, "batch_size": 32, "epochs": 20, "weight_decay": 1e-05, "patience": 5, "grad_clip": 1.0, "warmup_epochs": 0, "huber_delta": 1.0, "head_dropout": 0.1, "seed": 99, "het_loss": false}, "composite": -1.1839, "test_pos_folds": 5, "val_pos_folds": 3, "val_loss": 0.000143, "elapsed_sec": 6.4, "timestamp": "2026-04-12T17:24:57", "sharpe": 0.6165, "psr": 0.8967, "equity": 1265.43, "sortino": 1.0692, "return_pct": 26.54, "max_dd": 15.74, "win_rate": 50.36, "profit_factor": 1.121, "ic": 0.0291, "hit": 50.15, "aleatoric_mean": 0.000489, "epistemic_mean": 0.000977, "confidence_mean": 0.9985, "per_window": [{"fold": "fold_1", "regime": "Pre-crisis upturn + GFC onset", "sharpe": 0.7352, "sortino": 2.2077, "return_pct": 5.09, "equity": 1050.86, "max_dd": 10.74, "win_rate": 43.14, "profit_factor": 1.19, "ic": -0.1472, "hit": 42.72, "n": 103, "aleatoric_mean": 0.00057, "epistemic_mean": 0.001139, "confidence_mean": 0.9983, "aleatoric_std": 0.000251, "epistemic_std": 0.000501}, {"fold": "fold_2", "regime": "Post-crash recovery", "sharpe": 0.1981, "sortino": 0.3636, "return_pct": 0.68, "equity": 1006.82, "max_dd": 6.26, "win_rate": 47.66, "profit_factor": 1.032, "ic": -0.0579, "hit": 47.66, "n": 107, "aleatoric_mean": 0.000495, "epistemic_mean": 0.000989, "confidence_mean": 0.9985, "aleatoric_std": 0.00019, "epistemic_std": 0.00038}, {"fold": "fold_3", "regime": "Eurozone debt plateau", "sharpe": -0.0952, "sortino": -0.1715, "return_pct": -0.49, "equity": 995.13, "max_dd": 4.89, "win_rate": 50.0, "profit_factor": 0.985, "ic": -0.0467, "hit": 49.06, "n": 106, "aleatoric_mean": 0.000541, "epistemic_mean": 0.001082, "confidence_mean": 0.9984, "aleatoric_std": 0.000207, "epistemic_std": 0.000413}, {"fold": "fold_4", "regime": "Strong USD downturn", "sharpe": 2.1067, "sortino": 3.0939, "return_pct": 17.11, "equity": 1171.13, "max_dd": 5.81, "win_rate": 57.49, "profit_factor": 1.425, "ic": 0.2083, "hit": 57.14, "n": 168, "aleatoric_mean": 0.000521, "epistemic_mean": 0.001043, "confidence_mean": 0.9984, "aleatoric_std": 0.00022, "epistemic_std": 0.00044}, {"fold": "fold_5", "regime": "Low-vol plateau", "sharpe": -0.1047, "sortino": -0.1717, "return_pct": -0.43, "equity": 995.66, "max_dd": 5.03, "win_rate": 46.3, "profit_factor": 0.983, "ic": -0.0623, "hit": 46.3, "n": 162, "aleatoric_mean": 0.000382, "epistemic_mean": 0.000765, "confidence_mean": 0.9989, "aleatoric_std": 0.000123, "epistemic_std": 0.000246}, {"fold": "fold_6", "regime": "EUR crisis downturn", "sharpe": 0.5199, "sortino": 0.8011, "return_pct": 3.01, "equity": 1030.14, "max_dd": 6.09, "win_rate": 53.94, "profit_factor": 1.088, "ic": 0.0563, "hit": 53.94, "n": 165, "aleatoric_mean": 0.000569, "epistemic_mean": 0.001138, "confidence_mean": 0.9983, "aleatoric_std": 0.000246, "epistemic_std": 0.000492}, {"fold": "fold_7", "regime": "Recent mixed/upturn", "sharpe": 0.0561, "sortino": 0.0782, "return_pct": 0.06, "equity": 1000.58, "max_dd": 8.14, "win_rate": 50.0, "profit_factor": 1.01, "ic": 0.0422, "hit": 50.0, "n": 162, "aleatoric_mean": 0.000389, "epistemic_mean": 0.000778, "confidence_mean": 0.9988, "aleatoric_std": 0.000143, "epistemic_std": 0.000287}], "val_sharpe": -0.5839, "val_psr": 0.1553, "val_equity": 862.58, "val_sortino": -0.9102, "val_return_pct": -13.74, "val_max_dd": 18.46, "val_win_rate": 46.13, "val_profit_factor": 0.906, "val_ic": -0.0282, "val_hit": 45.83, "val_aleatoric_mean": 0.000396, "val_epistemic_mean": 0.000792, "val_confidence_mean": 0.9988, "val_per_window": [{"fold": "fold_1", "regime": "Pre-crisis upturn + GFC onset", "sharpe": -1.242, "sortino": -1.7897, "return_pct": -3.15, "equity": 968.5, "max_dd": 6.55, "win_rate": 48.15, "profit_factor": 0.814, "ic": -0.0099, "hit": 47.71, "n": 109, "aleatoric_mean": 0.000369, "epistemic_mean": 0.000738, "confidence_mean": 0.9989, "aleatoric_std": 0.000135, "epistemic_std": 0.000271}, {"fold": "fold_2", "regime": "Post-crash recovery", "sharpe": 0.187, "sortino": 0.352, "return_pct": 0.64, "equity": 1006.35, "max_dd": 8.6, "win_rate": 50.0, "profit_factor": 1.03, "ic": -0.0683, "hit": 50.0, "n": 108, "aleatoric_mean": 0.000496, "epistemic_mean": 0.000992, "confidence_mean": 0.9985, "aleatoric_std": 0.000183, "epistemic_std": 0.000366}, {"fold": "fold_3", "regime": "Eurozone debt plateau", "sharpe": 0.1528, "sortino": 0.2454, "return_pct": 0.43, "equity": 1004.33, "max_dd": 9.34, "win_rate": 44.95, "profit_factor": 1.025, "ic": -0.0042, "hit": 44.14, "n": 111, "aleatoric_mean": 0.000433, "epistemic_mean": 0.000866, "confidence_mean": 0.9987, "aleatoric_std": 0.000169, "epistemic_std": 0.000339}, {"fold": "fold_4", "regime": "Strong USD downturn", "sharpe": -1.3614, "sortino": -1.9257, "return_pct": -4.74, "equity": 952.62, "max_dd": 5.37, "win_rate": 44.95, "profit_factor": 0.798, "ic": -0.0014, "hit": 44.55, "n": 110, "aleatoric_mean": 0.000381, "epistemic_mean": 0.000761, "confidence_mean": 0.9989, "aleatoric_std": 0.00014, "epistemic_std": 0.00028}, {"fold": "fold_5", "regime": "Low-vol plateau", "sharpe": -0.1469, "sortino": -0.2774, "return_pct": -0.61, "equity": 993.86, "max_dd": 4.62, "win_rate": 44.64, "profit_factor": 0.976, "ic": -0.006, "hit": 44.64, "n": 112, "aleatoric_mean": 0.000398, "epistemic_mean": 0.000796, "confidence_mean": 0.9988, "aleatoric_std": 0.00016, "epistemic_std": 0.000321}, {"fold": "fold_6", "regime": "EUR crisis downturn", "sharpe": -3.2143, "sortino": -4.6464, "return_pct": -7.02, "equity": 929.82, "max_dd": 6.92, "win_rate": 42.99, "profit_factor": 0.581, "ic": -0.1149, "hit": 42.59, "n": 108, "aleatoric_mean": 0.000343, "epistemic_mean": 0.000687, "confidence_mean": 0.999, "aleatoric_std": 0.000105, "epistemic_std": 0.00021}, {"fold": "fold_7", "regime": "Recent mixed/upturn", "sharpe": 0.0681, "sortino": 0.0987, "return_pct": 0.1, "equity": 1000.97, "max_dd": 4.6, "win_rate": 47.27, "profit_factor": 1.011, "ic": 0.0328, "hit": 47.27, "n": 110, "aleatoric_mean": 0.000351, "epistemic_mean": 0.000702, "confidence_mean": 0.9989, "aleatoric_std": 0.000121, "epistemic_std": 0.000242}], "train_sharpe": 3.3553, "train_psr": 1.0, "train_equity": 52207.18, "train_sortino": 8.0175, "train_return_pct": 5120.72, "train_max_dd": 4.6, "train_win_rate": 59.52, "train_profit_factor": 2.118, "train_ic": 0.2928, "train_hit": 59.28, "train_per_window": [{"fold": "all_train", "regime": "Training data", "sharpe": 3.3553, "sortino": 8.0175, "return_pct": 5120.72, "equity": 52207.18, "max_dd": 4.6, "win_rate": 59.52, "profit_factor": 2.118, "ic": 0.2928, "hit": 59.28, "n": 2478}], "experiment_num": 54, "status": "DISCARD"}
{"backbone": "mlp", "description": "mlp: lr=5e-5 seed=0", "config": {"seq_len": 10, "lr": 5e-05, "batch_size": 32, "epochs": 20, "weight_decay": 1e-05, "patience": 5, "grad_clip": 1.0, "warmup_epochs": 0, "huber_delta": 1.0, "head_dropout": 0.1, "seed": 0, "het_loss": false}, "composite": -0.8646, "test_pos_folds": 4, "val_pos_folds": 4, "val_loss": 0.000357, "elapsed_sec": 6.8, "timestamp": "2026-04-12T17:25:07", "sharpe": 0.2265, "psr": 0.671, "equity": 1074.69, "sortino": 0.2918, "return_pct": 7.47, "max_dd": 16.16, "win_rate": 51.6, "profit_factor": 1.043, "ic": 0.0318, "hit": 51.39, "aleatoric_mean": 0.000907, "epistemic_mean": 0.001814, "confidence_mean": 0.9973, "per_window": [{"fold": "fold_1", "regime": "Pre-crisis upturn + GFC onset", "sharpe": -0.6878, "sortino": -0.7583, "return_pct": -5.86, "equity": 941.45, "max_dd": 9.69, "win_rate": 50.98, "profit_factor": 0.85, "ic": -0.019, "hit": 50.49, "n": 103, "aleatoric_mean": 0.001328, "epistemic_mean": 0.002656, "confidence_mean": 0.996, "aleatoric_std": 0.000593, "epistemic_std": 0.001185}, {"fold": "fold_2", "regime": "Post-crash recovery", "sharpe": -1.9285, "sortino": -3.1849, "return_pct": -9.03, "equity": 909.72, "max_dd": 12.51, "win_rate": 46.73, "profit_factor": 0.739, "ic": 0.0168, "hit": 46.73, "n": 107, "aleatoric_mean": 0.000839, "epistemic_mean": 0.001678, "confidence_mean": 0.9975, "aleatoric_std": 0.000318, "epistemic_std": 0.000636}, {"fold": "fold_3", "regime": "Eurozone debt plateau", "sharpe": 1.9105, "sortino": 3.1974, "return_pct": 6.81, "equity": 1068.05, "max_dd": 6.09, "win_rate": 54.81, "profit_factor": 1.35, "ic": 0.0221, "hit": 53.77, "n": 106, "aleatoric_mean": 0.00098, "epistemic_mean": 0.00196, "confidence_mean": 0.9971, "aleatoric_std": 0.000287, "epistemic_std": 0.000575}, {"fold": "fold_4", "regime": "Strong USD downturn", "sharpe": -0.5389, "sortino": -0.7369, "return_pct": -4.54, "equity": 954.6, "max_dd": 10.15, "win_rate": 50.3, "profit_factor": 0.913, "ic": -0.0329, "hit": 50.0, "n": 168, "aleatoric_mean": 0.000898, "epistemic_mean": 0.001796, "confidence_mean": 0.9973, "aleatoric_std": 0.000346, "epistemic_std": 0.000692}, {"fold": "fold_5", "regime": "Low-vol plateau", "sharpe": 1.4746, "sortino": 2.8384, "return_pct": 4.93, "equity": 1049.25, "max_dd": 2.57, "win_rate": 50.62, "profit_factor": 1.278, "ic": 0.0312, "hit": 50.62, "n": 162, "aleatoric_mean": 0.000727, "epistemic_mean": 0.001455, "confidence_mean": 0.9978, "aleatoric_std": 0.000301, "epistemic_std": 0.000601}, {"fold": "fold_6", "regime": "EUR crisis downturn", "sharpe": 1.0769, "sortino": 1.9027, "return_pct": 6.68, "equity": 1066.78, "max_dd": 5.61, "win_rate": 50.3, "profit_factor": 1.19, "ic": 0.0591, "hit": 50.3, "n": 165, "aleatoric_mean": 0.000993, "epistemic_mean": 0.001986, "confidence_mean": 0.997, "aleatoric_std": 0.000472, "epistemic_std": 0.000945}, {"fold": "fold_7", "regime": "Recent mixed/upturn", "sharpe": 1.6467, "sortino": 2.2858, "return_pct": 9.95, "equity": 1099.54, "max_dd": 4.49, "win_rate": 56.79, "profit_factor": 1.321, "ic": 0.0767, "hit": 56.79, "n": 162, "aleatoric_mean": 0.000739, "epistemic_mean": 0.001477, "confidence_mean": 0.9978, "aleatoric_std": 0.000259, "epistemic_std": 0.000517}], "val_sharpe": -0.2646, "val_psr": 0.3218, "val_equity": 930.43, "val_sortino": -0.3738, "val_return_pct": -6.96, "val_max_dd": 21.54, "val_win_rate": 50.85, "val_profit_factor": 0.956, "val_ic": 0.0254, "val_hit": 50.52, "val_aleatoric_mean": 0.000725, "val_epistemic_mean": 0.00145, "val_confidence_mean": 0.9978, "val_per_window": [{"fold": "fold_1", "regime": "Pre-crisis upturn + GFC onset", "sharpe": 0.6336, "sortino": 1.0707, "return_pct": 1.54, "equity": 1015.37, "max_dd": 2.51, "win_rate": 50.93, "profit_factor": 1.111, "ic": 0.0187, "hit": 50.46, "n": 109, "aleatoric_mean": 0.0007, "epistemic_mean": 0.001399, "confidence_mean": 0.9979, "aleatoric_std": 0.000336, "epistemic_std": 0.000672}, {"fold": "fold_2", "regime": "Post-crash recovery", "sharpe": -2.2799, "sortino": -3.78, "return_pct": -10.63, "equity": 893.74, "max_dd": 13.06, "win_rate": 41.67, "profit_factor": 0.698, "ic": -0.0716, "hit": 41.67, "n": 108, "aleatoric_mean": 0.00092, "epistemic_mean": 0.00184, "confidence_mean": 0.9972, "aleatoric_std": 0.000356, "epistemic_std": 0.000712}, {"fold": "fold_3", "regime": "Eurozone debt plateau", "sharpe": -1.4236, "sortino": -2.085, "return_pct": -5.75, "equity": 942.5, "max_dd": 6.89, "win_rate": 48.62, "profit_factor": 0.794, "ic": 0.0195, "hit": 47.75, "n": 111, "aleatoric_mean": 0.000799, "epistemic_mean": 0.001598, "confidence_mean": 0.9976, "aleatoric_std": 0.00034, "epistemic_std": 0.00068}, {"fold": "fold_4", "regime": "Strong USD downturn", "sharpe": 0.1122, "sortino": 0.1626, "return_pct": 0.25, "equity": 1002.52, "max_dd": 5.34, "win_rate": 52.29, "profit_factor": 1.019, "ic": 0.122, "hit": 51.82, "n": 110, "aleatoric_mean": 0.000693, "epistemic_mean": 0.001387, "confidence_mean": 0.9979, "aleatoric_std": 0.000276, "epistemic_std": 0.000552}, {"fold": "fold_5", "regime": "Low-vol plateau", "sharpe": 1.9155, "sortino": 2.5475, "return_pct": 6.42, "equity": 1064.21, "max_dd": 3.04, "win_rate": 56.25, "profit_factor": 1.375, "ic": 0.1512, "hit": 56.25, "n": 112, "aleatoric_mean": 0.000719, "epistemic_mean": 0.001439, "confidence_mean": 0.9978, "aleatoric_std": 0.000262, "epistemic_std": 0.000524}, {"fold": "fold_6", "regime": "EUR crisis downturn", "sharpe": -1.2959, "sortino": -1.8601, "return_pct": -2.97, "equity": 970.26, "max_dd": 4.79, "win_rate": 47.66, "profit_factor": 0.804, "ic": -0.0016, "hit": 47.22, "n": 108, "aleatoric_mean": 0.000594, "epistemic_mean": 0.001188, "confidence_mean": 0.9982, "aleatoric_std": 0.000187, "epistemic_std": 0.000375}, {"fold": "fold_7", "regime": "Recent mixed/upturn", "sharpe": 2.1145, "sortino": 3.334, "return_pct": 5.09, "equity": 1050.9, "max_dd": 2.13, "win_rate": 58.18, "profit_factor": 1.405, "ic": 0.1675, "hit": 58.18, "n": 110, "aleatoric_mean": 0.000648, "epistemic_mean": 0.001297, "confidence_mean": 0.9981, "aleatoric_std": 0.000266, "epistemic_std": 0.000532}], "train_sharpe": 2.6889, "train_psr": 1.0, "train_equity": 24047.78, "train_sortino": 5.8199, "train_return_pct": 2304.78, "train_max_dd": 8.96, "train_win_rate": 57.62, "train_profit_factor": 1.815, "train_ic": 0.2532, "train_hit": 57.38, "train_per_window": [{"fold": "all_train", "regime": "Training data", "sharpe": 2.6889, "sortino": 5.8199, "return_pct": 2304.78, "equity": 24047.78, "max_dd": 8.96, "win_rate": 57.62, "profit_factor": 1.815, "ic": 0.2532, "hit": 57.38, "n": 2478}], "experiment_num": 55, "status": "DISCARD"}
