{"backbone": "mamba", "description": "mamba: Exp8 dmamba expand=8 (test wider trend, EfficientNet width scaling)", "config": {"seq_len": 10, "lr": 0.0005, "batch_size": 32, "epochs": 100, "weight_decay": 0.1, "patience": 20, "grad_clip": 1.0, "warmup_epochs": 10, "huber_delta": 1.0, "head_dropout": 0.1, "seed": 42, "mamba_variant": "dmamba", "mamba_expand": 8, "het_loss": false}, "composite": 4.1225, "test_pos_folds": 7, "val_pos_folds": 5, "val_loss": 4e-05, "elapsed_sec": 210.7, "timestamp": "2026-04-20T01:06:37", "sharpe": 4.3225, "psr": 1.0, "equity": 5602.02, "sortino": 5.3354, "return_pct": 460.2, "max_dd": 9.72, "win_rate": 64.29, "profit_factor": 2.253, "ic": 0.4195, "hit": 64.03, "aleatoric_mean": 3.3e-05, "epistemic_mean": 6.5e-05, "confidence_mean": 0.9999, "precision": 0.6071, "recall": 0.7775, "f1": 0.6819, "f2": 0.7362, "mcc": 0.2964, "accuracy": 0.6413, "per_window": [{"fold": "fold_1", "regime": "Pre-crisis upturn + GFC onset", "sharpe": 0.5657, "sortino": 0.5995, "return_pct": 3.69, "equity": 1036.95, "max_dd": 9.72, "win_rate": 55.88, "profit_factor": 1.143, "ic": 0.1209, "hit": 55.34, "n": 103, "precision": 0.5636, "recall": 0.5849, "f1": 0.5741, "f2": 0.5805, "mcc": 0.1051, "accuracy": 0.5534, "tp": 31, "fp": 24, "tn": 26, "fn": 22, "aleatoric_mean": 5.9e-05, "epistemic_mean": 0.000118, "confidence_mean": 0.9998, "aleatoric_std": 5.7e-05, "epistemic_std": 0.000114}, {"fold": "fold_2", "regime": "Post-crash recovery", "sharpe": 0.0849, "sortino": 0.1369, "return_pct": 0.14, "equity": 1001.36, "max_dd": 7.3, "win_rate": 50.47, "profit_factor": 1.013, "ic": 0.0609, "hit": 50.47, "n": 107, "precision": 0.4853, "recall": 0.6471, "f1": 0.5546, "f2": 0.6066, "mcc": 0.0229, "accuracy": 0.5047, "tp": 33, "fp": 35, "tn": 21, "fn": 18, "aleatoric_mean": 3.4e-05, "epistemic_mean": 6.8e-05, "confidence_mean": 0.9999, "aleatoric_std": 1.5e-05, "epistemic_std": 3e-05}, {"fold": "fold_3", "regime": "Eurozone debt plateau", "sharpe": 4.9731, "sortino": 8.0511, "return_pct": 18.17, "equity": 1181.72, "max_dd": 3.7, "win_rate": 66.35, "profit_factor": 2.187, "ic": 0.4879, "hit": 65.09, "n": 106, "precision": 0.6429, "recall": 0.7895, "f1": 0.7087, "f2": 0.755, "mcc": 0.294, "accuracy": 0.6509, "tp": 45, "fp": 25, "tn": 24, "fn": 12, "aleatoric_mean": 3.6e-05, "epistemic_mean": 7.1e-05, "confidence_mean": 0.9999, "aleatoric_std": 2.5e-05, "epistemic_std": 4.9e-05}, {"fold": "fold_4", "regime": "Strong USD downturn", "sharpe": 5.9139, "sortino": 9.9577, "return_pct": 53.22, "equity": 1532.22, "max_dd": 3.45, "win_rate": 65.87, "profit_factor": 2.741, "ic": 0.4696, "hit": 65.48, "n": 168, "precision": 0.6355, "recall": 0.7907, "f1": 0.7047, "f2": 0.7539, "mcc": 0.3275, "accuracy": 0.6607, "tp": 68, "fp": 39, "tn": 43, "fn": 18, "aleatoric_mean": 3.3e-05, "epistemic_mean": 6.7e-05, "confidence_mean": 0.9999, "aleatoric_std": 2.3e-05, "epistemic_std": 4.7e-05}, {"fold": "fold_5", "regime": "Low-vol plateau", "sharpe": 6.7887, "sortino": 12.3633, "return_pct": 23.02, "equity": 1230.23, "max_dd": 1.36, "win_rate": 66.05, "profit_factor": 3.159, "ic": 0.588, "hit": 66.05, "n": 162, "precision": 0.5868, "recall": 0.9342, "f1": 0.7208, "f2": 0.8353, "mcc": 0.405, "accuracy": 0.6605, "tp": 71, "fp": 50, "tn": 36, "fn": 5, "aleatoric_mean": 2e-05, "epistemic_mean": 4e-05, "confidence_mean": 0.9999, "aleatoric_std": 7e-06, "epistemic_std": 1.4e-05}, {"fold": "fold_6", "regime": "EUR crisis downturn", "sharpe": 10.8247, "sortino": 22.9169, "return_pct": 75.12, "equity": 1751.15, "max_dd": 1.03, "win_rate": 73.94, "profit_factor": 6.208, "ic": 0.654, "hit": 73.94, "n": 165, "precision": 0.75, "recall": 0.6623, "f1": 0.7034, "f2": 0.6782, "mcc": 0.4755, "accuracy": 0.7394, "tp": 51, "fp": 17, "tn": 71, "fn": 26, "aleatoric_mean": 3.5e-05, "epistemic_mean": 7.1e-05, "confidence_mean": 0.9999, "aleatoric_std": 2.3e-05, "epistemic_std": 4.6e-05}, {"fold": "fold_7", "regime": "Recent mixed/upturn", "sharpe": 5.8453, "sortino": 10.2977, "return_pct": 38.31, "equity": 1383.09, "max_dd": 2.1, "win_rate": 64.2, "profit_factor": 2.727, "ic": 0.5226, "hit": 64.2, "n": 162, "precision": 0.5906, "recall": 0.9259, "f1": 0.7212, "f2": 0.8315, "mcc": 0.345, "accuracy": 0.642, "tp": 75, "fp": 52, "tn": 29, "fn": 6, "aleatoric_mean": 2.2e-05, "epistemic_mean": 4.5e-05, "confidence_mean": 0.9999, "aleatoric_std": 1.4e-05, "epistemic_std": 2.9e-05}], "val_sharpe": 4.4282, "val_psr": 1.0, "val_equity": 2728.7, "val_sortino": 6.9002, "val_return_pct": 172.87, "val_max_dd": 6.44, "val_win_rate": 61.21, "val_profit_factor": 2.126, "val_ic": 0.3642, "val_hit": 60.81, "val_aleatoric_mean": 2.5e-05, "val_epistemic_mean": 5e-05, "val_confidence_mean": 0.9999, "val_precision": 0.5685, "val_recall": 0.7726, "val_f1": 0.6551, "val_f2": 0.7209, "val_mcc": 0.2523, "val_accuracy": 0.6133, "val_per_window": [{"fold": "fold_1", "regime": "Pre-crisis upturn + GFC onset", "sharpe": -1.1278, "sortino": -1.789, "return_pct": -2.87, "equity": 971.28, "max_dd": 5.11, "win_rate": 43.52, "profit_factor": 0.829, "ic": -0.106, "hit": 43.12, "n": 109, "precision": 0.4651, "recall": 0.7273, "f1": 0.5674, "f2": 0.6536, "mcc": -0.1527, "accuracy": 0.4404, "tp": 40, "fp": 46, "tn": 8, "fn": 15, "aleatoric_mean": 3.2e-05, "epistemic_mean": 6.4e-05, "confidence_mean": 0.9999, "aleatoric_std": 3.1e-05, "epistemic_std": 6.2e-05}, {"fold": "fold_2", "regime": "Post-crash recovery", "sharpe": -0.1196, "sortino": -0.1883, "return_pct": -0.85, "equity": 991.48, "max_dd": 3.84, "win_rate": 46.3, "profit_factor": 0.981, "ic": 0.0138, "hit": 46.3, "n": 108, "precision": 0.5455, "recall": 0.4762, "f1": 0.5085, "f2": 0.4886, "mcc": -0.0783, "accuracy": 0.463, "tp": 30, "fp": 25, "tn": 20, "fn": 33, "aleatoric_mean": 3.2e-05, "epistemic_mean": 6.3e-05, "confidence_mean": 0.9999, "aleatoric_std": 1.4e-05, "epistemic_std": 2.9e-05}, {"fold": "fold_3", "regime": "Eurozone debt plateau", "sharpe": 8.2217, "sortino": 14.2935, "return_pct": 34.11, "equity": 1341.08, "max_dd": 1.93, "win_rate": 73.39, "profit_factor": 3.904, "ic": 0.5941, "hit": 72.07, "n": 111, "precision": 0.6349, "recall": 0.8511, "f1": 0.7273, "f2": 0.7968, "mcc": 0.4904, "accuracy": 0.7297, "tp": 40, "fp": 23, "tn": 41, "fn": 7, "aleatoric_mean": 2.8e-05, "epistemic_mean": 5.6e-05, "confidence_mean": 0.9999, "aleatoric_std": 1.7e-05, "epistemic_std": 3.3e-05}, {"fold": "fold_4", "regime": "Strong USD downturn", "sharpe": 6.4273, "sortino": 13.1609, "return_pct": 22.84, "equity": 1228.38, "max_dd": 2.55, "win_rate": 68.81, "profit_factor": 2.942, "ic": 0.5837, "hit": 68.18, "n": 110, "precision": 0.5844, "recall": 0.9574, "f1": 0.7258, "f2": 0.8491, "mcc": 0.4852, "accuracy": 0.6909, "tp": 45, "fp": 32, "tn": 31, "fn": 2, "aleatoric_mean": 2.5e-05, "epistemic_mean": 4.9e-05, "confidence_mean": 0.9999, "aleatoric_std": 1.6e-05, "epistemic_std": 3.3e-05}, {"fold": "fold_5", "regime": "Low-vol plateau", "sharpe": 8.1447, "sortino": 18.4219, "return_pct": 27.21, "equity": 1272.09, "max_dd": 1.97, "win_rate": 66.96, "profit_factor": 4.025, "ic": 0.621, "hit": 66.96, "n": 112, "precision": 0.6212, "recall": 0.7736, "f1": 0.6891, "f2": 0.7374, "mcc": 0.3551, "accuracy": 0.6696, "tp": 41, "fp": 25, "tn": 34, "fn": 12, "aleatoric_mean": 2.2e-05, "epistemic_mean": 4.5e-05, "confidence_mean": 0.9999, "aleatoric_std": 1.4e-05, "epistemic_std": 2.8e-05}, {"fold": "fold_6", "regime": "EUR crisis downturn", "sharpe": 9.4947, "sortino": 19.6089, "return_pct": 20.44, "equity": 1204.45, "max_dd": 0.86, "win_rate": 71.03, "profit_factor": 5.358, "ic": 0.6158, "hit": 70.37, "n": 108, "precision": 0.6379, "recall": 0.7872, "f1": 0.7048, "f2": 0.752, "mcc": 0.4404, "accuracy": 0.713, "tp": 37, "fp": 21, "tn": 40, "fn": 10, "aleatoric_mean": 1.8e-05, "epistemic_mean": 3.6e-05, "confidence_mean": 0.9999, "aleatoric_std": 6e-06, "epistemic_std": 1.2e-05}, {"fold": "fold_7", "regime": "Recent mixed/upturn", "sharpe": 5.0902, "sortino": 11.1878, "return_pct": 12.26, "equity": 1122.63, "max_dd": 1.78, "win_rate": 58.18, "profit_factor": 2.276, "ic": 0.4158, "hit": 58.18, "n": 110, "precision": 0.5385, "recall": 0.9245, "f1": 0.6806, "f2": 0.8086, "mcc": 0.2481, "accuracy": 0.5818, "tp": 49, "fp": 42, "tn": 15, "fn": 4, "aleatoric_mean": 2e-05, "epistemic_mean": 4e-05, "confidence_mean": 0.9999, "aleatoric_std": 8e-06, "epistemic_std": 1.6e-05}], "train_sharpe": 6.9277, "train_psr": 1.0, "train_equity": 2250479.25, "train_sortino": 20.4752, "train_return_pct": 224947.92, "train_max_dd": 3.64, "train_win_rate": 73.1, "train_profit_factor": 5.527, "train_ic": 0.6713, "train_hit": 72.8, "train_precision": 0.6887, "train_recall": 0.8666, "train_f1": 0.7675, "train_f2": 0.824, "train_mcc": 0.4728, "train_accuracy": 0.73, "train_per_window": [{"fold": "all_train", "regime": "Training data", "sharpe": 6.9277, "sortino": 20.4752, "return_pct": 224947.92, "equity": 2250479.25, "max_dd": 3.64, "win_rate": 73.1, "profit_factor": 5.527, "ic": 0.6713, "hit": 72.8, "n": 2478, "precision": 0.6887, "recall": 0.8666, "f1": 0.7675, "f2": 0.824, "mcc": 0.4728, "accuracy": 0.73, "tp": 1104, "fp": 499, "tn": 705, "fn": 170}], "experiment_num": 159, "status": "DISCARD"}
{"backbone": "mamba", "description": "mamba: Exp9 dmamba expand=4 bs=16 (Keskar 2017 flat-minima trick)", "config": {"seq_len": 10, "lr": 0.0005, "batch_size": 16, "epochs": 100, "weight_decay": 0.1, "patience": 20, "grad_clip": 1.0, "warmup_epochs": 10, "huber_delta": 1.0, "head_dropout": 0.1, "seed": 42, "mamba_variant": "dmamba", "mamba_expand": 4, "het_loss": false}, "composite": 5.5669, "test_pos_folds": 7, "val_pos_folds": 7, "val_loss": 3.5e-05, "elapsed_sec": 485.3, "timestamp": "2026-04-20T01:16:16", "sharpe": 5.5669, "psr": 1.0, "equity": 8816.21, "sortino": 10.2729, "return_pct": 781.62, "max_dd": 4.95, "win_rate": 67.08, "profit_factor": 2.885, "ic": 0.4788, "hit": 66.8, "aleatoric_mean": 1.1e-05, "epistemic_mean": 2.1e-05, "confidence_mean": 1.0, "precision": 0.7154, "recall": 0.5489, "f1": 0.6212, "f2": 0.5757, "mcc": 0.3457, "accuracy": 0.6691, "per_window": [{"fold": "fold_1", "regime": "Pre-crisis upturn + GFC onset", "sharpe": 2.6159, "sortino": 7.6711, "return_pct": 21.17, "equity": 1211.73, "max_dd": 4.54, "win_rate": 55.88, "profit_factor": 1.876, "ic": 0.0923, "hit": 55.34, "n": 103, "precision": 0.5556, "recall": 0.6604, "f1": 0.6034, "f2": 0.6364, "mcc": 0.1029, "accuracy": 0.5534, "tp": 35, "fp": 28, "tn": 22, "fn": 18, "aleatoric_mean": 2e-05, "epistemic_mean": 4e-05, "confidence_mean": 0.9999, "aleatoric_std": 1.4e-05, "epistemic_std": 2.8e-05}, {"fold": "fold_2", "regime": "Post-crash recovery", "sharpe": 2.6537, "sortino": 5.0367, "return_pct": 13.08, "equity": 1130.82, "max_dd": 4.95, "win_rate": 54.21, "profit_factor": 1.516, "ic": 0.1368, "hit": 54.21, "n": 107, "precision": 0.5238, "recall": 0.4314, "f1": 0.4731, "f2": 0.4472, "mcc": 0.0759, "accuracy": 0.5421, "tp": 22, "fp": 20, "tn": 36, "fn": 29, "aleatoric_mean": 1.3e-05, "epistemic_mean": 2.6e-05, "confidence_mean": 1.0, "aleatoric_std": 1e-05, "epistemic_std": 2e-05}, {"fold": "fold_3", "regime": "Eurozone debt plateau", "sharpe": 9.1057, "sortino": 15.903, "return_pct": 32.17, "equity": 1321.67, "max_dd": 1.07, "win_rate": 75.96, "profit_factor": 4.262, "ic": 0.6409, "hit": 74.53, "n": 106, "precision": 0.7143, "recall": 0.8772, "f1": 0.7874, "f2": 0.8389, "mcc": 0.4938, "accuracy": 0.7453, "tp": 50, "fp": 20, "tn": 29, "fn": 7, "aleatoric_mean": 1.5e-05, "epistemic_mean": 2.9e-05, "confidence_mean": 1.0, "aleatoric_std": 1.1e-05, "epistemic_std": 2.1e-05}, {"fold": "fold_4", "regime": "Strong USD downturn", "sharpe": 6.7353, "sortino": 10.6637, "return_pct": 61.28, "equity": 1612.77, "max_dd": 3.03, "win_rate": 70.06, "profit_factor": 3.173, "ic": 0.6496, "hit": 69.64, "n": 168, "precision": 0.8333, "recall": 0.5233, "f1": 0.6429, "f2": 0.5653, "mcc": 0.4426, "accuracy": 0.7024, "tp": 45, "fp": 9, "tn": 73, "fn": 41, "aleatoric_mean": 1.1e-05, "epistemic_mean": 2.3e-05, "confidence_mean": 1.0, "aleatoric_std": 7e-06, "epistemic_std": 1.4e-05}, {"fold": "fold_5", "regime": "Low-vol plateau", "sharpe": 6.8977, "sortino": 12.7889, "return_pct": 23.37, "equity": 1233.69, "max_dd": 1.76, "win_rate": 67.28, "profit_factor": 3.221, "ic": 0.6967, "hit": 67.28, "n": 162, "precision": 0.8485, "recall": 0.3684, "f1": 0.5138, "f2": 0.4154, "mcc": 0.3845, "accuracy": 0.6728, "tp": 28, "fp": 5, "tn": 81, "fn": 48, "aleatoric_mean": 4e-06, "epistemic_mean": 7e-06, "confidence_mean": 1.0, "aleatoric_std": 2e-06, "epistemic_std": 4e-06}, {"fold": "fold_6", "regime": "EUR crisis downturn", "sharpe": 9.2006, "sortino": 18.3384, "return_pct": 64.6, "equity": 1646.01, "max_dd": 2.3, "win_rate": 67.88, "profit_factor": 4.604, "ic": 0.6624, "hit": 67.88, "n": 165, "precision": 0.74, "recall": 0.4805, "f1": 0.5827, "f2": 0.5168, "mcc": 0.3613, "accuracy": 0.6788, "tp": 37, "fp": 13, "tn": 75, "fn": 40, "aleatoric_mean": 1e-05, "epistemic_mean": 2e-05, "confidence_mean": 1.0, "aleatoric_std": 7e-06, "epistemic_std": 1.4e-05}, {"fold": "fold_7", "regime": "Recent mixed/upturn", "sharpe": 7.3821, "sortino": 12.0937, "return_pct": 48.64, "equity": 1486.43, "max_dd": 2.24, "win_rate": 72.84, "profit_factor": 3.602, "ic": 0.6139, "hit": 72.84, "n": 162, "precision": 0.8246, "recall": 0.5802, "f1": 0.6812, "f2": 0.6168, "mcc": 0.4783, "accuracy": 0.7284, "tp": 47, "fp": 10, "tn": 71, "fn": 34, "aleatoric_mean": 7e-06, "epistemic_mean": 1.4e-05, "confidence_mean": 1.0, "aleatoric_std": 6e-06, "epistemic_std": 1.1e-05}], "val_sharpe": 6.292, "val_psr": 1.0, "val_equity": 3975.0, "val_sortino": 9.9625, "val_return_pct": 297.5, "val_max_dd": 5.21, "val_win_rate": 66.71, "val_profit_factor": 2.953, "val_ic": 0.5318, "val_hit": 66.28, "val_aleatoric_mean": 6e-06, "val_epistemic_mean": 1.2e-05, "val_confidence_mean": 1.0, "val_precision": 0.7037, "val_recall": 0.5205, "val_f1": 0.5984, "val_f2": 0.5491, "val_mcc": 0.3368, "val_accuracy": 0.668, "val_per_window": [{"fold": "fold_1", "regime": "Pre-crisis upturn + GFC onset", "sharpe": 1.4317, "sortino": 2.7639, "return_pct": 3.59, "equity": 1035.9, "max_dd": 2.15, "win_rate": 48.15, "profit_factor": 1.268, "ic": 0.0819, "hit": 47.71, "n": 109, "precision": 0.4833, "recall": 0.5273, "f1": 0.5043, "f2": 0.5179, "mcc": -0.047, "accuracy": 0.4771, "tp": 29, "fp": 31, "tn": 23, "fn": 26, "aleatoric_mean": 6e-06, "epistemic_mean": 1.1e-05, "confidence_mean": 1.0, "aleatoric_std": 6e-06, "epistemic_std": 1.1e-05}, {"fold": "fold_2", "regime": "Post-crash recovery", "sharpe": 0.2629, "sortino": 0.4411, "return_pct": 1.01, "equity": 1010.06, "max_dd": 4.89, "win_rate": 46.3, "profit_factor": 1.042, "ic": 0.0397, "hit": 46.3, "n": 108, "precision": 0.549, "recall": 0.4444, "f1": 0.4912, "f2": 0.462, "mcc": -0.0658, "accuracy": 0.463, "tp": 28, "fp": 23, "tn": 22, "fn": 35, "aleatoric_mean": 1e-05, "epistemic_mean": 2e-05, "confidence_mean": 1.0, "aleatoric_std": 7e-06, "epistemic_std": 1.3e-05}, {"fold": "fold_3", "regime": "Eurozone debt plateau", "sharpe": 11.0024, "sortino": 20.7179, "return_pct": 43.9, "equity": 1439.01, "max_dd": 1.58, "win_rate": 80.73, "profit_factor": 6.504, "ic": 0.7368, "hit": 79.28, "n": 111, "precision": 0.8095, "recall": 0.7234, "f1": 0.764, "f2": 0.7391, "mcc": 0.6097, "accuracy": 0.8108, "tp": 34, "fp": 8, "tn": 56, "fn": 13, "aleatoric_mean": 8e-06, "epistemic_mean": 1.6e-05, "confidence_mean": 1.0, "aleatoric_std": 5e-06, "epistemic_std": 1.1e-05}, {"fold": "fold_4", "regime": "Strong USD downturn", "sharpe": 12.0131, "sortino": 33.8927, "return_pct": 39.32, "equity": 1393.18, "max_dd": 0.68, "win_rate": 77.06, "profit_factor": 8.62, "ic": 0.7725, "hit": 76.36, "n": 110, "precision": 0.8438, "recall": 0.5745, "f1": 0.6835, "f2": 0.6136, "mcc": 0.5393, "accuracy": 0.7727, "tp": 27, "fp": 5, "tn": 58, "fn": 20, "aleatoric_mean": 5e-06, "epistemic_mean": 1.1e-05, "confidence_mean": 1.0, "aleatoric_std": 3e-06, "epistemic_std": 7e-06}, {"fold": "fold_5", "regime": "Low-vol plateau", "sharpe": 10.245, "sortino": 26.869, "return_pct": 33.12, "equity": 1331.24, "max_dd": 0.88, "win_rate": 72.32, "profit_factor": 6.019, "ic": 0.7579, "hit": 72.32, "n": 112, "precision": 0.8438, "recall": 0.5094, "f1": 0.6353, "f2": 0.5533, "mcc": 0.4694, "accuracy": 0.7232, "tp": 27, "fp": 5, "tn": 54, "fn": 26, "aleatoric_mean": 6e-06, "epistemic_mean": 1.1e-05, "confidence_mean": 1.0, "aleatoric_std": 5e-06, "epistemic_std": 1.1e-05}, {"fold": "fold_6", "regime": "EUR crisis downturn", "sharpe": 7.0443, "sortino": 13.7474, "return_pct": 15.82, "equity": 1158.2, "max_dd": 1.38, "win_rate": 68.22, "profit_factor": 3.363, "ic": 0.8628, "hit": 67.59, "n": 108, "precision": 1.0, "recall": 0.2766, "f1": 0.4333, "f2": 0.3234, "mcc": 0.4214, "accuracy": 0.6852, "tp": 13, "fp": 0, "tn": 61, "fn": 34, "aleatoric_mean": 3e-06, "epistemic_mean": 6e-06, "confidence_mean": 1.0, "aleatoric_std": 2e-06, "epistemic_std": 4e-06}, {"fold": "fold_7", "regime": "Recent mixed/upturn", "sharpe": 10.2654, "sortino": 23.9196, "return_pct": 22.9, "equity": 1229.03, "max_dd": 0.8, "win_rate": 73.64, "profit_factor": 5.507, "ic": 0.7431, "hit": 73.64, "n": 110, "precision": 0.8, "recall": 0.6038, "f1": 0.6882, "f2": 0.6349, "mcc": 0.4814, "accuracy": 0.7364, "tp": 32, "fp": 8, "tn": 49, "fn": 21, "aleatoric_mean": 4e-06, "epistemic_mean": 8e-06, "confidence_mean": 1.0, "aleatoric_std": 2e-06, "epistemic_std": 5e-06}], "train_sharpe": 6.3094, "train_psr": 1.0, "train_equity": 1239283.25, "train_sortino": 16.513, "train_return_pct": 123828.32, "train_max_dd": 3.71, "train_win_rate": 70.99, "train_profit_factor": 4.563, "train_ic": 0.727, "train_hit": 70.7, "train_precision": 0.8641, "train_recall": 0.5188, "train_f1": 0.6484, "train_f2": 0.5639, "train_mcc": 0.4679, "train_accuracy": 0.7107, "train_per_window": [{"fold": "all_train", "regime": "Training data", "sharpe": 6.3094, "sortino": 16.513, "return_pct": 123828.32, "equity": 1239283.25, "max_dd": 3.71, "win_rate": 70.99, "profit_factor": 4.563, "ic": 0.727, "hit": 70.7, "n": 2478, "precision": 0.8641, "recall": 0.5188, "f1": 0.6484, "f2": 0.5639, "mcc": 0.4679, "accuracy": 0.7107, "tp": 661, "fp": 104, "tn": 1100, "fn": 613}], "experiment_num": 160, "status": "DISCARD"}
