{"backbone": "nbeats", "description": "nbeats: Exp3 seq=30", "config": {"seq_len": 30, "lr": 0.001, "batch_size": 32, "epochs": 100, "weight_decay": 0.0001, "patience": 20, "grad_clip": 1.0, "warmup_epochs": 0, "huber_delta": 1.0, "head_dropout": 0.1, "seed": 42, "het_loss": false}, "composite": -0.9505, "test_pos_folds": 3, "val_pos_folds": 3, "val_loss": 4.1e-05, "elapsed_sec": 86.0, "timestamp": "2026-04-21T12:34:30", "sharpe": -0.1505, "psr": 0.3921, "equity": 938.21, "sortino": -0.2197, "return_pct": -6.18, "max_dd": 13.48, "win_rate": 50.42, "profit_factor": 0.975, "ic": 0.0362, "hit": 50.18, "aleatoric_mean": 1.2e-05, "epistemic_mean": 2.5e-05, "confidence_mean": 1.0, "precision": 0.5156, "recall": 0.0799, "f1": 0.1384, "f2": 0.0962, "mcc": 0.0114, "accuracy": 0.5066, "per_window": [{"fold": "fold_1", "regime": "Pre-crisis upturn + GFC onset", "sharpe": -2.9608, "sortino": -4.6031, "return_pct": -9.66, "equity": 903.42, "max_dd": 10.97, "win_rate": 43.9, "profit_factor": 0.622, "ic": -0.1376, "hit": 43.37, "n": 83, "precision": 0.3333, "recall": 0.0698, "f1": 0.1154, "f2": 0.0829, "mcc": -0.1289, "accuracy": 0.4458, "tp": 3, "fp": 6, "tn": 34, "fn": 40, "aleatoric_mean": 1.3e-05, "epistemic_mean": 2.5e-05, "confidence_mean": 1.0, "aleatoric_std": 4e-06, "epistemic_std": 9e-06}, {"fold": "fold_2", "regime": "Post-crash recovery", "sharpe": 0.6618, "sortino": 1.2322, "return_pct": 2.43, "equity": 1024.29, "max_dd": 4.42, "win_rate": 47.13, "profit_factor": 1.11, "ic": 0.0998, "hit": 47.13, "n": 87, "precision": 0.5, "recall": 0.1522, "f1": 0.2333, "f2": 0.1768, "mcc": -0.0252, "accuracy": 0.4713, "tp": 7, "fp": 7, "tn": 34, "fn": 39, "aleatoric_mean": 1.3e-05, "epistemic_mean": 2.7e-05, "confidence_mean": 1.0, "aleatoric_std": 4e-06, "epistemic_std": 8e-06}, {"fold": "fold_3", "regime": "Eurozone debt plateau", "sharpe": -1.0237, "sortino": -1.7635, "return_pct": -3.08, "equity": 969.24, "max_dd": 6.06, "win_rate": 44.05, "profit_factor": 0.851, "ic": 0.0011, "hit": 43.02, "n": 86, "precision": 0.5, "recall": 0.234, "f1": 0.3188, "f2": 0.2619, "mcc": -0.0548, "accuracy": 0.4535, "tp": 11, "fp": 11, "tn": 28, "fn": 36, "aleatoric_mean": 1.3e-05, "epistemic_mean": 2.6e-05, "confidence_mean": 1.0, "aleatoric_std": 5e-06, "epistemic_std": 9e-06}, {"fold": "fold_4", "regime": "Strong USD downturn", "sharpe": -0.0555, "sortino": -0.0766, "return_pct": -0.8, "equity": 992.02, "max_dd": 6.4, "win_rate": 51.7, "profit_factor": 0.991, "ic": 0.1418, "hit": 51.35, "n": 148, "precision": 0.6154, "recall": 0.1081, "f1": 0.1839, "f2": 0.1294, "mcc": 0.0716, "accuracy": 0.5203, "tp": 8, "fp": 5, "tn": 69, "fn": 66, "aleatoric_mean": 1.3e-05, "epistemic_mean": 2.5e-05, "confidence_mean": 1.0, "aleatoric_std": 5e-06, "epistemic_std": 9e-06}, {"fold": "fold_5", "regime": "Low-vol plateau", "sharpe": 1.1106, "sortino": 1.6354, "return_pct": 3.15, "equity": 1031.49, "max_dd": 2.39, "win_rate": 54.93, "profit_factor": 1.205, "ic": 0.0332, "hit": 54.93, "n": 142, "precision": 1.0, "recall": 0.0303, "f1": 0.0588, "f2": 0.0376, "mcc": 0.1283, "accuracy": 0.5493, "tp": 2, "fp": 0, "tn": 76, "fn": 64, "aleatoric_mean": 1.2e-05, "epistemic_mean": 2.3e-05, "confidence_mean": 1.0, "aleatoric_std": 4e-06, "epistemic_std": 8e-06}, {"fold": "fold_6", "regime": "EUR crisis downturn", "sharpe": 2.3468, "sortino": 3.9802, "return_pct": 13.85, "equity": 1138.52, "max_dd": 3.68, "win_rate": 54.48, "profit_factor": 1.456, "ic": -0.0084, "hit": 54.48, "n": 145, "precision": 0.5, "recall": 0.0303, "f1": 0.0571, "f2": 0.0373, "mcc": 0.0152, "accuracy": 0.5448, "tp": 2, "fp": 2, "tn": 77, "fn": 64, "aleatoric_mean": 1.1e-05, "epistemic_mean": 2.3e-05, "confidence_mean": 1.0, "aleatoric_std": 4e-06, "epistemic_std": 7e-06}, {"fold": "fold_7", "regime": "Recent mixed/upturn", "sharpe": -1.9958, "sortino": -2.581, "return_pct": -10.21, "equity": 897.9, "max_dd": 12.32, "win_rate": 50.0, "profit_factor": 0.713, "ic": 0.1005, "hit": 50.0, "n": 142, "precision": 0.0, "recall": 0.0, "f1": 0.0, "f2": 0.0, "mcc": 0.0, "accuracy": 0.5, "tp": 0, "fp": 0, "tn": 71, "fn": 71, "aleatoric_mean": 1.2e-05, "epistemic_mean": 2.5e-05, "confidence_mean": 1.0, "aleatoric_std": 4e-06, "epistemic_std": 7e-06}], "val_sharpe": 0.3146, "val_psr": 0.6902, "val_equity": 1055.3, "val_sortino": 0.4799, "val_return_pct": 5.53, "val_max_dd": 11.07, "val_win_rate": 52.4, "val_profit_factor": 1.055, "val_ic": 0.0613, "val_hit": 52.07, "val_aleatoric_mean": 1.2e-05, "val_epistemic_mean": 2.4e-05, "val_confidence_mean": 1.0, "val_precision": 0.6471, "val_recall": 0.0364, "val_f1": 0.069, "val_f2": 0.0449, "val_mcc": 0.0555, "val_accuracy": 0.5271, "val_per_window": [{"fold": "fold_1", "regime": "Pre-crisis upturn + GFC onset", "sharpe": -1.2402, "sortino": -1.8348, "return_pct": -2.68, "equity": 973.22, "max_dd": 4.88, "win_rate": 48.86, "profit_factor": 0.811, "ic": -0.0526, "hit": 48.31, "n": 89, "precision": 1.0, "recall": 0.0217, "f1": 0.0426, "f2": 0.027, "mcc": 0.1031, "accuracy": 0.4944, "tp": 1, "fp": 0, "tn": 43, "fn": 45, "aleatoric_mean": 1.3e-05, "epistemic_mean": 2.5e-05, "confidence_mean": 1.0, "aleatoric_std": 4e-06, "epistemic_std": 8e-06}, {"fold": "fold_2", "regime": "Post-crash recovery", "sharpe": -1.3659, "sortino": -2.3178, "return_pct": -5.09, "equity": 949.13, "max_dd": 5.7, "win_rate": 46.59, "profit_factor": 0.804, "ic": -0.0762, "hit": 46.59, "n": 88, "precision": 0.6667, "recall": 0.12, "f1": 0.2034, "f2": 0.1435, "mcc": 0.0671, "accuracy": 0.4659, "tp": 6, "fp": 3, "tn": 35, "fn": 44, "aleatoric_mean": 1.3e-05, "epistemic_mean": 2.5e-05, "confidence_mean": 1.0, "aleatoric_std": 4e-06, "epistemic_std": 7e-06}, {"fold": "fold_3", "regime": "Eurozone debt plateau", "sharpe": -0.2157, "sortino": -0.3061, "return_pct": -0.92, "equity": 990.84, "max_dd": 7.13, "win_rate": 56.67, "profit_factor": 0.965, "ic": 0.2499, "hit": 56.04, "n": 91, "precision": 0.5, "recall": 0.0769, "f1": 0.1333, "f2": 0.0926, "mcc": 0.0383, "accuracy": 0.5714, "tp": 3, "fp": 3, "tn": 49, "fn": 36, "aleatoric_mean": 1.2e-05, "epistemic_mean": 2.4e-05, "confidence_mean": 1.0, "aleatoric_std": 4e-06, "epistemic_std": 8e-06}, {"fold": "fold_4", "regime": "Strong USD downturn", "sharpe": 3.2019, "sortino": 6.0362, "return_pct": 10.03, "equity": 1100.26, "max_dd": 1.82, "win_rate": 53.93, "profit_factor": 1.676, "ic": 0.0733, "hit": 53.33, "n": 90, "precision": 0.0, "recall": 0.0, "f1": 0.0, "f2": 0.0, "mcc": 0.0, "accuracy": 0.5444, "tp": 0, "fp": 0, "tn": 49, "fn": 41, "aleatoric_mean": 1.2e-05, "epistemic_mean": 2.3e-05, "confidence_mean": 1.0, "aleatoric_std": 5e-06, "epistemic_std": 9e-06}, {"fold": "fold_5", "regime": "Low-vol plateau", "sharpe": 0.5807, "sortino": 1.0449, "return_pct": 1.52, "equity": 1015.19, "max_dd": 3.26, "win_rate": 51.09, "profit_factor": 1.103, "ic": 0.1276, "hit": 51.09, "n": 92, "precision": 1.0, "recall": 0.0217, "f1": 0.0426, "f2": 0.027, "mcc": 0.1048, "accuracy": 0.5109, "tp": 1, "fp": 0, "tn": 46, "fn": 45, "aleatoric_mean": 1.2e-05, "epistemic_mean": 2.3e-05, "confidence_mean": 1.0, "aleatoric_std": 4e-06, "epistemic_std": 8e-06}, {"fold": "fold_6", "regime": "EUR crisis downturn", "sharpe": 3.3713, "sortino": 7.3295, "return_pct": 5.82, "equity": 1058.2, "max_dd": 1.77, "win_rate": 58.62, "profit_factor": 1.757, "ic": 0.0934, "hit": 57.95, "n": 88, "precision": 0.0, "recall": 0.0, "f1": 0.0, "f2": 0.0, "mcc": 0.0, "accuracy": 0.5909, "tp": 0, "fp": 0, "tn": 52, "fn": 36, "aleatoric_mean": 1.2e-05, "epistemic_mean": 2.3e-05, "confidence_mean": 1.0, "aleatoric_std": 4e-06, "epistemic_std": 8e-06}, {"fold": "fold_7", "regime": "Recent mixed/upturn", "sharpe": -1.2126, "sortino": -1.785, "return_pct": -2.45, "equity": 975.5, "max_dd": 4.09, "win_rate": 51.11, "profit_factor": 0.822, "ic": 0.0511, "hit": 51.11, "n": 90, "precision": 0.0, "recall": 0.0, "f1": 0.0, "f2": 0.0, "mcc": 0.0, "accuracy": 0.5111, "tp": 0, "fp": 0, "tn": 46, "fn": 44, "aleatoric_mean": 1.2e-05, "epistemic_mean": 2.4e-05, "confidence_mean": 1.0, "aleatoric_std": 4e-06, "epistemic_std": 9e-06}], "train_sharpe": 1.0875, "train_psr": 0.9999, "train_equity": 2693.81, "train_sortino": 2.3992, "train_return_pct": 169.38, "train_max_dd": 19.64, "train_win_rate": 50.61, "train_profit_factor": 1.263, "train_ic": 0.4177, "train_hit": 50.4, "train_precision": 0.8481, "train_recall": 0.0649, "train_f1": 0.1205, "train_f2": 0.0796, "train_mcc": 0.1337, "train_accuracy": 0.508, "train_per_window": [{"fold": "all_train", "regime": "Training data", "sharpe": 1.0875, "sortino": 2.3992, "return_pct": 169.38, "equity": 2693.81, "max_dd": 19.64, "win_rate": 50.61, "profit_factor": 1.263, "ic": 0.4177, "hit": 50.4, "n": 1988, "precision": 0.8481, "recall": 0.0649, "f1": 0.1205, "f2": 0.0796, "mcc": 0.1337, "accuracy": 0.508, "tp": 67, "fp": 12, "tn": 943, "fn": 966}], "experiment_num": 245, "status": "DISCARD"}
{"backbone": "nbeats", "description": "nbeats: Exp4 lr=5e-4", "config": {"seq_len": 60, "lr": 0.0005, "batch_size": 32, "epochs": 100, "weight_decay": 0.0001, "patience": 20, "grad_clip": 1.0, "warmup_epochs": 0, "huber_delta": 1.0, "head_dropout": 0.1, "seed": 42, "het_loss": false}, "composite": -0.7606, "test_pos_folds": 2, "val_pos_folds": 5, "val_loss": 4.3e-05, "elapsed_sec": 47.8, "timestamp": "2026-04-21T12:35:29", "sharpe": -0.0606, "psr": 0.4621, "equity": 975.15, "sortino": -0.101, "return_pct": -2.49, "max_dd": 16.02, "win_rate": 49.92, "profit_factor": 0.99, "ic": -0.0426, "hit": 49.6, "aleatoric_mean": 0.000221, "epistemic_mean": 0.000441, "confidence_mean": 0.9993, "precision": 0.4974, "recall": 0.6194, "f1": 0.5517, "f2": 0.5904, "mcc": -0.0005, "accuracy": 0.4992, "per_window": [{"fold": "fold_1", "regime": "Pre-crisis upturn + GFC onset", "sharpe": -0.9391, "sortino": -1.5899, "return_pct": -2.07, "equity": 979.32, "max_dd": 5.95, "win_rate": 48.08, "profit_factor": 0.866, "ic": -0.1023, "hit": 47.17, "n": 53, "precision": 0.4762, "recall": 0.7692, "f1": 0.5882, "f2": 0.6849, "mcc": -0.0562, "accuracy": 0.4717, "tp": 20, "fp": 22, "tn": 5, "fn": 6, "aleatoric_mean": 0.000204, "epistemic_mean": 0.000407, "confidence_mean": 0.9994, "aleatoric_std": 7.1e-05, "epistemic_std": 0.000142}, {"fold": "fold_2", "regime": "Post-crash recovery", "sharpe": -1.5636, "sortino": -2.6638, "return_pct": -4.52, "equity": 954.76, "max_dd": 8.15, "win_rate": 43.86, "profit_factor": 0.778, "ic": -0.0865, "hit": 43.86, "n": 57, "precision": 0.4857, "recall": 0.5484, "f1": 0.5152, "f2": 0.5346, "mcc": -0.1472, "accuracy": 0.4386, "tp": 17, "fp": 18, "tn": 8, "fn": 14, "aleatoric_mean": 0.000233, "epistemic_mean": 0.000466, "confidence_mean": 0.9993, "aleatoric_std": 7.8e-05, "epistemic_std": 0.000155}, {"fold": "fold_3", "regime": "Eurozone debt plateau", "sharpe": -5.1654, "sortino": -7.931, "return_pct": -8.41, "equity": 915.89, "max_dd": 8.58, "win_rate": 42.59, "profit_factor": 0.437, "ic": -0.2499, "hit": 41.07, "n": 56, "precision": 0.5, "recall": 0.3125, "f1": 0.3846, "f2": 0.3378, "mcc": -0.1076, "accuracy": 0.4286, "tp": 10, "fp": 10, "tn": 14, "fn": 22, "aleatoric_mean": 0.00022, "epistemic_mean": 0.00044, "confidence_mean": 0.9993, "aleatoric_std": 7.9e-05, "epistemic_std": 0.000157}, {"fold": "fold_4", "regime": "Strong USD downturn", "sharpe": 1.8223, "sortino": 3.4435, "return_pct": 9.3, "equity": 1092.95, "max_dd": 3.14, "win_rate": 54.7, "profit_factor": 1.358, "ic": 0.0617, "hit": 54.24, "n": 118, "precision": 0.5432, "recall": 0.7333, "f1": 0.6241, "f2": 0.6854, "mcc": 0.1028, "accuracy": 0.5508, "tp": 44, "fp": 37, "tn": 21, "fn": 16, "aleatoric_mean": 0.000229, "epistemic_mean": 0.000458, "confidence_mean": 0.9993, "aleatoric_std": 8.2e-05, "epistemic_std": 0.000163}, {"fold": "fold_5", "regime": "Low-vol plateau", "sharpe": -0.7232, "sortino": -1.2054, "return_pct": -1.67, "equity": 983.29, "max_dd": 2.63, "win_rate": 50.0, "profit_factor": 0.887, "ic": -0.0423, "hit": 50.0, "n": 112, "precision": 0.4648, "recall": 0.6471, "f1": 0.541, "f2": 0.6, "mcc": 0.0249, "accuracy": 0.5, "tp": 33, "fp": 38, "tn": 23, "fn": 18, "aleatoric_mean": 0.000222, "epistemic_mean": 0.000444, "confidence_mean": 0.9993, "aleatoric_std": 6.7e-05, "epistemic_std": 0.000134}, {"fold": "fold_6", "regime": "EUR crisis downturn", "sharpe": -0.114, "sortino": -0.2036, "return_pct": -0.73, "equity": 992.67, "max_dd": 4.09, "win_rate": 46.09, "profit_factor": 0.982, "ic": -0.0895, "hit": 46.09, "n": 115, "precision": 0.4151, "recall": 0.4151, "f1": 0.4151, "f2": 0.4151, "mcc": -0.0849, "accuracy": 0.4609, "tp": 22, "fp": 31, "tn": 31, "fn": 31, "aleatoric_mean": 0.000219, "epistemic_mean": 0.000439, "confidence_mean": 0.9993, "aleatoric_std": 7.5e-05, "epistemic_std": 0.000151}, {"fold": "fold_7", "regime": "Recent mixed/upturn", "sharpe": 1.6312, "sortino": 2.7352, "return_pct": 6.74, "equity": 1067.37, "max_dd": 2.8, "win_rate": 56.25, "profit_factor": 1.323, "ic": -0.0202, "hit": 56.25, "n": 112, "precision": 0.5476, "recall": 0.807, "f1": 0.6525, "f2": 0.7372, "mcc": 0.134, "accuracy": 0.5625, "tp": 46, "fp": 38, "tn": 17, "fn": 11, "aleatoric_mean": 0.000213, "epistemic_mean": 0.000427, "confidence_mean": 0.9994, "aleatoric_std": 6.5e-05, "epistemic_std": 0.00013}], "val_sharpe": 0.7942, "val_psr": 0.8491, "val_equity": 1099.25, "val_sortino": 1.3978, "val_return_pct": 9.92, "val_max_dd": 7.31, "val_win_rate": 49.28, "val_profit_factor": 1.142, "val_ic": -0.0119, "val_hit": 49.04, "val_aleatoric_mean": 0.000225, "val_epistemic_mean": 0.000451, "val_confidence_mean": 0.9993, "val_precision": 0.487, "val_recall": 0.6359, "val_f1": 0.5516, "val_f2": 0.5993, "val_mcc": -0.0157, "val_accuracy": 0.4904, "val_per_window": [{"fold": "fold_1", "regime": "Pre-crisis upturn + GFC onset", "sharpe": 1.0102, "sortino": 1.5719, "return_pct": 1.56, "equity": 1015.57, "max_dd": 3.2, "win_rate": 55.17, "profit_factor": 1.181, "ic": -0.0297, "hit": 54.24, "n": 59, "precision": 0.5588, "recall": 0.6129, "f1": 0.5846, "f2": 0.6013, "mcc": 0.078, "accuracy": 0.5424, "tp": 19, "fp": 15, "tn": 13, "fn": 12, "aleatoric_mean": 0.000219, "epistemic_mean": 0.000439, "confidence_mean": 0.9993, "aleatoric_std": 7.9e-05, "epistemic_std": 0.000157}, {"fold": "fold_2", "regime": "Post-crash recovery", "sharpe": 4.3715, "sortino": 7.5698, "return_pct": 8.53, "equity": 1085.3, "max_dd": 2.18, "win_rate": 58.62, "profit_factor": 2.035, "ic": -0.0598, "hit": 58.62, "n": 58, "precision": 0.5714, "recall": 0.9032, "f1": 0.7, "f2": 0.8092, "mcc": 0.1728, "accuracy": 0.5862, "tp": 28, "fp": 21, "tn": 6, "fn": 3, "aleatoric_mean": 0.000215, "epistemic_mean": 0.00043, "confidence_mean": 0.9994, "aleatoric_std": 7.7e-05, "epistemic_std": 0.000154}, {"fold": "fold_3", "regime": "Eurozone debt plateau", "sharpe": 0.1364, "sortino": 0.2586, "return_pct": 0.21, "equity": 1002.08, "max_dd": 4.4, "win_rate": 47.54, "profit_factor": 1.023, "ic": -0.0528, "hit": 47.54, "n": 61, "precision": 0.4419, "recall": 0.7037, "f1": 0.5429, "f2": 0.6291, "mcc": -0.0024, "accuracy": 0.4754, "tp": 19, "fp": 24, "tn": 10, "fn": 8, "aleatoric_mean": 0.000246, "epistemic_mean": 0.000491, "confidence_mean": 0.9993, "aleatoric_std": 7.5e-05, "epistemic_std": 0.000149}, {"fold": "fold_4", "regime": "Strong USD downturn", "sharpe": 1.5732, "sortino": 3.428, "return_pct": 3.38, "equity": 1033.84, "max_dd": 2.63, "win_rate": 51.67, "profit_factor": 1.273, "ic": 0.1102, "hit": 51.67, "n": 60, "precision": 0.5, "recall": 0.5517, "f1": 0.5246, "f2": 0.5405, "mcc": 0.0357, "accuracy": 0.5167, "tp": 16, "fp": 16, "tn": 15, "fn": 13, "aleatoric_mean": 0.000223, "epistemic_mean": 0.000446, "confidence_mean": 0.9993, "aleatoric_std": 6.4e-05, "epistemic_std": 0.000129}, {"fold": "fold_5", "regime": "Low-vol plateau", "sharpe": -0.0553, "sortino": -0.0931, "return_pct": -0.16, "equity": 998.43, "max_dd": 4.84, "win_rate": 51.61, "profit_factor": 0.991, "ic": -0.1023, "hit": 51.61, "n": 62, "precision": 0.5278, "recall": 0.5938, "f1": 0.5588, "f2": 0.5793, "mcc": 0.0274, "accuracy": 0.5161, "tp": 19, "fp": 17, "tn": 13, "fn": 13, "aleatoric_mean": 0.000219, "epistemic_mean": 0.000437, "confidence_mean": 0.9993, "aleatoric_std": 7e-05, "epistemic_std": 0.00014}, {"fold": "fold_6", "regime": "EUR crisis downturn", "sharpe": -3.8829, "sortino": -5.4115, "return_pct": -3.88, "equity": 961.18, "max_dd": 3.95, "win_rate": 36.84, "profit_factor": 0.528, "ic": -0.1614, "hit": 36.21, "n": 58, "precision": 0.2903, "recall": 0.375, "f1": 0.3273, "f2": 0.3543, "mcc": -0.2686, "accuracy": 0.3621, "tp": 9, "fp": 22, "tn": 12, "fn": 15, "aleatoric_mean": 0.000229, "epistemic_mean": 0.000458, "confidence_mean": 0.9993, "aleatoric_std": 7.5e-05, "epistemic_std": 0.00015}, {"fold": "fold_7", "regime": "Recent mixed/upturn", "sharpe": 0.2718, "sortino": 0.5549, "return_pct": 0.31, "equity": 1003.14, "max_dd": 2.03, "win_rate": 43.33, "profit_factor": 1.045, "ic": -0.0524, "hit": 43.33, "n": 60, "precision": 0.4773, "recall": 0.6562, "f1": 0.5526, "f2": 0.6105, "mcc": -0.1863, "accuracy": 0.4333, "tp": 21, "fp": 23, "tn": 5, "fn": 11, "aleatoric_mean": 0.000227, "epistemic_mean": 0.000454, "confidence_mean": 0.9993, "aleatoric_std": 6.2e-05, "epistemic_std": 0.000124}], "train_sharpe": 0.508, "train_psr": 0.8909, "train_equity": 1372.61, "train_sortino": 0.6587, "train_return_pct": 37.26, "train_max_dd": 13.35, "train_win_rate": 52.8, "train_profit_factor": 1.124, "train_ic": 0.0565, "train_hit": 52.53, "train_precision": 0.5261, "train_recall": 0.8731, "train_f1": 0.6565, "train_f2": 0.7713, "train_mcc": 0.0361, "train_accuracy": 0.526, "train_per_window": [{"fold": "all_train", "regime": "Training data", "sharpe": 0.508, "sortino": 0.6587, "return_pct": 37.26, "equity": 1372.61, "max_dd": 13.35, "win_rate": 52.8, "profit_factor": 1.124, "ic": 0.0565, "hit": 52.53, "n": 1382, "precision": 0.5261, "recall": 0.8731, "f1": 0.6565, "f2": 0.7713, "mcc": 0.0361, "accuracy": 0.526, "tp": 626, "fp": 564, "tn": 101, "fn": 91}], "experiment_num": 246, "status": "DISCARD"}
