{"backbone": "mamba", "description": "mamba: Exp12 dmamba expand=4 seed=0 variance", "config": {"seq_len": 10, "lr": 0.0005, "batch_size": 32, "epochs": 100, "weight_decay": 0.1, "patience": 20, "grad_clip": 1.0, "warmup_epochs": 10, "huber_delta": 1.0, "head_dropout": 0.1, "seed": 0, "mamba_variant": "dmamba", "mamba_expand": 4, "het_loss": false}, "composite": 3.8873, "test_pos_folds": 6, "val_pos_folds": 6, "val_loss": 3.5e-05, "elapsed_sec": 228.0, "timestamp": "2026-04-20T01:31:56", "sharpe": 4.0873, "psr": 1.0, "equity": 5126.86, "sortino": 7.6827, "return_pct": 412.69, "max_dd": 8.86, "win_rate": 63.57, "profit_factor": 2.153, "ic": 0.3365, "hit": 63.31, "aleatoric_mean": 4e-05, "epistemic_mean": 7.9e-05, "confidence_mean": 0.9999, "precision": 0.6364, "recall": 0.6112, "f1": 0.6235, "f2": 0.6161, "mcc": 0.2701, "accuracy": 0.6351, "per_window": [{"fold": "fold_1", "regime": "Pre-crisis upturn + GFC onset", "sharpe": 2.6213, "sortino": 8.2049, "return_pct": 21.22, "equity": 1212.22, "max_dd": 5.69, "win_rate": 54.9, "profit_factor": 1.879, "ic": 0.0633, "hit": 54.37, "n": 103, "precision": 0.5946, "recall": 0.4151, "f1": 0.4889, "f2": 0.4418, "mcc": 0.1199, "accuracy": 0.5534, "tp": 22, "fp": 15, "tn": 35, "fn": 31, "aleatoric_mean": 6.5e-05, "epistemic_mean": 0.000131, "confidence_mean": 0.9998, "aleatoric_std": 5e-05, "epistemic_std": 0.0001}, {"fold": "fold_2", "regime": "Post-crash recovery", "sharpe": -1.3503, "sortino": -2.4268, "return_pct": -6.51, "equity": 934.91, "max_dd": 7.19, "win_rate": 49.53, "profit_factor": 0.809, "ic": -0.0287, "hit": 49.53, "n": 107, "precision": 0.4783, "recall": 0.6471, "f1": 0.55, "f2": 0.6044, "mcc": 0.0044, "accuracy": 0.4953, "tp": 33, "fp": 36, "tn": 20, "fn": 18, "aleatoric_mean": 3.6e-05, "epistemic_mean": 7.2e-05, "confidence_mean": 0.9999, "aleatoric_std": 1.3e-05, "epistemic_std": 2.6e-05}, {"fold": "fold_3", "regime": "Eurozone debt plateau", "sharpe": 5.4733, "sortino": 8.6153, "return_pct": 19.98, "equity": 1199.84, "max_dd": 2.24, "win_rate": 68.27, "profit_factor": 2.368, "ic": 0.4129, "hit": 66.98, "n": 106, "precision": 0.6833, "recall": 0.7193, "f1": 0.7009, "f2": 0.7118, "mcc": 0.3335, "accuracy": 0.6698, "tp": 41, "fp": 19, "tn": 30, "fn": 16, "aleatoric_mean": 4.2e-05, "epistemic_mean": 8.4e-05, "confidence_mean": 0.9999, "aleatoric_std": 2.4e-05, "epistemic_std": 4.9e-05}, {"fold": "fold_4", "regime": "Strong USD downturn", "sharpe": 5.8721, "sortino": 10.4428, "return_pct": 52.81, "equity": 1528.12, "max_dd": 3.88, "win_rate": 68.26, "profit_factor": 2.721, "ic": 0.4935, "hit": 67.86, "n": 168, "precision": 0.6774, "recall": 0.7326, "f1": 0.7039, "f2": 0.7208, "mcc": 0.3687, "accuracy": 0.6845, "tp": 63, "fp": 30, "tn": 52, "fn": 23, "aleatoric_mean": 4.1e-05, "epistemic_mean": 8.2e-05, "confidence_mean": 0.9999, "aleatoric_std": 2.3e-05, "epistemic_std": 4.6e-05}, {"fold": "fold_5", "regime": "Low-vol plateau", "sharpe": 6.5815, "sortino": 15.2086, "return_pct": 22.36, "equity": 1223.59, "max_dd": 1.34, "win_rate": 66.67, "profit_factor": 3.046, "ic": 0.3856, "hit": 66.67, "n": 162, "precision": 0.6667, "recall": 0.5789, "f1": 0.6197, "f2": 0.5946, "mcc": 0.3282, "accuracy": 0.6667, "tp": 44, "fp": 22, "tn": 64, "fn": 32, "aleatoric_mean": 2.8e-05, "epistemic_mean": 5.6e-05, "confidence_mean": 0.9999, "aleatoric_std": 1.1e-05, "epistemic_std": 2.1e-05}, {"fold": "fold_6", "regime": "EUR crisis downturn", "sharpe": 5.9467, "sortino": 11.0215, "return_pct": 41.58, "equity": 1415.84, "max_dd": 2.34, "win_rate": 62.42, "profit_factor": 2.636, "ic": 0.4746, "hit": 62.42, "n": 165, "precision": 0.6154, "recall": 0.5195, "f1": 0.5634, "f2": 0.5362, "mcc": 0.2403, "accuracy": 0.6242, "tp": 40, "fp": 25, "tn": 63, "fn": 37, "aleatoric_mean": 3.5e-05, "epistemic_mean": 7e-05, "confidence_mean": 0.9999, "aleatoric_std": 1.8e-05, "epistemic_std": 3.6e-05}, {"fold": "fold_7", "regime": "Recent mixed/upturn", "sharpe": 6.4509, "sortino": 11.8305, "return_pct": 42.42, "equity": 1424.18, "max_dd": 2.73, "win_rate": 68.52, "profit_factor": 3.039, "ic": 0.4905, "hit": 68.52, "n": 162, "precision": 0.7083, "recall": 0.6296, "f1": 0.6667, "f2": 0.6439, "mcc": 0.3727, "accuracy": 0.6852, "tp": 51, "fp": 21, "tn": 60, "fn": 30, "aleatoric_mean": 3.9e-05, "epistemic_mean": 7.8e-05, "confidence_mean": 0.9999, "aleatoric_std": 1.6e-05, "epistemic_std": 3.1e-05}], "val_sharpe": 4.9873, "val_psr": 1.0, "val_equity": 3067.43, "val_sortino": 8.1978, "val_return_pct": 206.74, "val_max_dd": 5.73, "val_win_rate": 62.52, "val_profit_factor": 2.344, "val_ic": 0.3643, "val_hit": 62.11, "val_aleatoric_mean": 3e-05, "val_epistemic_mean": 5.9e-05, "val_confidence_mean": 0.9999, "val_precision": 0.6145, "val_recall": 0.5589, "val_f1": 0.5854, "val_f2": 0.5692, "val_mcc": 0.2432, "val_accuracy": 0.6237, "val_per_window": [{"fold": "fold_1", "regime": "Pre-crisis upturn + GFC onset", "sharpe": -0.1999, "sortino": -0.327, "return_pct": -0.58, "equity": 994.23, "max_dd": 2.82, "win_rate": 47.22, "profit_factor": 0.967, "ic": -0.0493, "hit": 46.79, "n": 109, "precision": 0.4688, "recall": 0.2727, "f1": 0.3448, "f2": 0.2976, "mcc": -0.0462, "accuracy": 0.4771, "tp": 15, "fp": 17, "tn": 37, "fn": 40, "aleatoric_mean": 2.9e-05, "epistemic_mean": 5.8e-05, "confidence_mean": 0.9999, "aleatoric_std": 1.3e-05, "epistemic_std": 2.6e-05}, {"fold": "fold_2", "regime": "Post-crash recovery", "sharpe": 1.2827, "sortino": 2.0178, "return_pct": 6.11, "equity": 1061.12, "max_dd": 4.61, "win_rate": 51.85, "profit_factor": 1.224, "ic": 0.0727, "hit": 51.85, "n": 108, "precision": 0.6122, "recall": 0.4762, "f1": 0.5357, "f2": 0.4983, "mcc": 0.0534, "accuracy": 0.5185, "tp": 30, "fp": 19, "tn": 26, "fn": 33, "aleatoric_mean": 3.3e-05, "epistemic_mean": 6.7e-05, "confidence_mean": 0.9999, "aleatoric_std": 1.6e-05, "epistemic_std": 3.3e-05}, {"fold": "fold_3", "regime": "Eurozone debt plateau", "sharpe": 8.2903, "sortino": 20.1425, "return_pct": 34.37, "equity": 1343.69, "max_dd": 1.76, "win_rate": 67.89, "profit_factor": 3.951, "ic": 0.5677, "hit": 66.67, "n": 111, "precision": 0.5926, "recall": 0.6809, "f1": 0.6337, "f2": 0.6612, "mcc": 0.3332, "accuracy": 0.6667, "tp": 32, "fp": 22, "tn": 42, "fn": 15, "aleatoric_mean": 3.1e-05, "epistemic_mean": 6.2e-05, "confidence_mean": 0.9999, "aleatoric_std": 1.4e-05, "epistemic_std": 2.8e-05}, {"fold": "fold_4", "regime": "Strong USD downturn", "sharpe": 9.6146, "sortino": 20.2565, "return_pct": 32.91, "equity": 1329.06, "max_dd": 1.21, "win_rate": 74.31, "profit_factor": 5.25, "ic": 0.6727, "hit": 73.64, "n": 110, "precision": 0.7317, "recall": 0.6383, "f1": 0.6818, "f2": 0.655, "mcc": 0.4744, "accuracy": 0.7455, "tp": 30, "fp": 11, "tn": 52, "fn": 17, "aleatoric_mean": 2.9e-05, "epistemic_mean": 5.8e-05, "confidence_mean": 0.9999, "aleatoric_std": 1.8e-05, "epistemic_std": 3.5e-05}, {"fold": "fold_5", "regime": "Low-vol plateau", "sharpe": 7.1181, "sortino": 16.578, "return_pct": 24.06, "equity": 1240.57, "max_dd": 1.59, "win_rate": 68.75, "profit_factor": 3.344, "ic": 0.4924, "hit": 68.75, "n": 112, "precision": 0.6957, "recall": 0.6038, "f1": 0.6465, "f2": 0.6202, "mcc": 0.3719, "accuracy": 0.6875, "tp": 32, "fp": 14, "tn": 45, "fn": 21, "aleatoric_mean": 2.7e-05, "epistemic_mean": 5.4e-05, "confidence_mean": 0.9999, "aleatoric_std": 9e-06, "epistemic_std": 1.8e-05}, {"fold": "fold_6", "regime": "EUR crisis downturn", "sharpe": 7.6911, "sortino": 16.9346, "return_pct": 17.11, "equity": 1171.07, "max_dd": 1.21, "win_rate": 65.42, "profit_factor": 3.787, "ic": 0.6129, "hit": 64.81, "n": 108, "precision": 0.5789, "recall": 0.7021, "f1": 0.6346, "f2": 0.6735, "mcc": 0.3066, "accuracy": 0.6481, "tp": 33, "fp": 24, "tn": 37, "fn": 14, "aleatoric_mean": 2.4e-05, "epistemic_mean": 4.9e-05, "confidence_mean": 0.9999, "aleatoric_std": 9e-06, "epistemic_std": 1.7e-05}, {"fold": "fold_7", "regime": "Recent mixed/upturn", "sharpe": 5.0056, "sortino": 10.5238, "return_pct": 12.07, "equity": 1120.66, "max_dd": 1.93, "win_rate": 61.82, "profit_factor": 2.245, "ic": 0.3936, "hit": 61.82, "n": 110, "precision": 0.6038, "recall": 0.6038, "f1": 0.6038, "f2": 0.6038, "mcc": 0.2354, "accuracy": 0.6182, "tp": 32, "fp": 21, "tn": 36, "fn": 21, "aleatoric_mean": 3.3e-05, "epistemic_mean": 6.5e-05, "confidence_mean": 0.9999, "aleatoric_std": 1.3e-05, "epistemic_std": 2.7e-05}], "train_sharpe": 6.1064, "train_psr": 1.0, "train_equity": 1013362.44, "train_sortino": 15.8728, "train_return_pct": 101236.24, "train_max_dd": 4.67, "train_win_rate": 70.02, "train_profit_factor": 4.299, "train_ic": 0.6278, "train_hit": 69.73, "train_precision": 0.769, "train_recall": 0.5958, "train_f1": 0.6714, "train_f2": 0.6239, "train_mcc": 0.4149, "train_accuracy": 0.7002, "train_per_window": [{"fold": "all_train", "regime": "Training data", "sharpe": 6.1064, "sortino": 15.8728, "return_pct": 101236.24, "equity": 1013362.44, "max_dd": 4.67, "win_rate": 70.02, "profit_factor": 4.299, "ic": 0.6278, "hit": 69.73, "n": 2478, "precision": 0.769, "recall": 0.5958, "f1": 0.6714, "f2": 0.6239, "mcc": 0.4149, "accuracy": 0.7002, "tp": 759, "fp": 228, "tn": 976, "fn": 515}], "experiment_num": 163, "status": "DISCARD"}
{"backbone": "mamba", "description": "mamba: Exp13 dmamba expand=4 seed=99 variance", "config": {"seq_len": 10, "lr": 0.0005, "batch_size": 32, "epochs": 100, "weight_decay": 0.1, "patience": 20, "grad_clip": 1.0, "warmup_epochs": 10, "huber_delta": 1.0, "head_dropout": 0.1, "seed": 99, "mamba_variant": "dmamba", "mamba_expand": 4, "het_loss": false}, "composite": 3.8246, "test_pos_folds": 7, "val_pos_folds": 6, "val_loss": 3.1e-05, "elapsed_sec": 205.5, "timestamp": "2026-04-20T01:36:36", "sharpe": 5.0793, "psr": 1.0, "equity": 7408.37, "sortino": 9.4851, "return_pct": 640.84, "max_dd": 4.98, "win_rate": 64.09, "profit_factor": 2.616, "ic": 0.3991, "hit": 63.82, "aleatoric_mean": 3.8e-05, "epistemic_mean": 7.7e-05, "confidence_mean": 0.9999, "precision": 0.6289, "recall": 0.6694, "f1": 0.6485, "f2": 0.6609, "mcc": 0.2836, "accuracy": 0.6413, "per_window": [{"fold": "fold_1", "regime": "Pre-crisis upturn + GFC onset", "sharpe": 3.6515, "sortino": 11.6657, "return_pct": 30.66, "equity": 1306.63, "max_dd": 2.97, "win_rate": 53.92, "profit_factor": 2.448, "ic": 0.2124, "hit": 53.4, "n": 103, "precision": 0.5652, "recall": 0.4906, "f1": 0.5253, "f2": 0.5039, "mcc": 0.091, "accuracy": 0.5437, "tp": 26, "fp": 20, "tn": 30, "fn": 27, "aleatoric_mean": 8.2e-05, "epistemic_mean": 0.000164, "confidence_mean": 0.9998, "aleatoric_std": 5.7e-05, "epistemic_std": 0.000114}, {"fold": "fold_2", "regime": "Post-crash recovery", "sharpe": 1.4536, "sortino": 2.4843, "return_pct": 6.91, "equity": 1069.06, "max_dd": 4.74, "win_rate": 55.14, "profit_factor": 1.256, "ic": 0.1109, "hit": 55.14, "n": 107, "precision": 0.5217, "recall": 0.7059, "f1": 0.6, "f2": 0.6593, "mcc": 0.1217, "accuracy": 0.5514, "tp": 36, "fp": 33, "tn": 23, "fn": 15, "aleatoric_mean": 3.4e-05, "epistemic_mean": 6.7e-05, "confidence_mean": 0.9999, "aleatoric_std": 1.7e-05, "epistemic_std": 3.4e-05}, {"fold": "fold_3", "regime": "Eurozone debt plateau", "sharpe": 3.5477, "sortino": 6.365, "return_pct": 12.91, "equity": 1129.09, "max_dd": 3.54, "win_rate": 62.5, "profit_factor": 1.746, "ic": 0.4203, "hit": 61.32, "n": 106, "precision": 0.6349, "recall": 0.7018, "f1": 0.6667, "f2": 0.6873, "mcc": 0.2359, "accuracy": 0.6226, "tp": 40, "fp": 23, "tn": 26, "fn": 17, "aleatoric_mean": 4.6e-05, "epistemic_mean": 9.2e-05, "confidence_mean": 0.9999, "aleatoric_std": 2.8e-05, "epistemic_std": 5.6e-05}, {"fold": "fold_4", "regime": "Strong USD downturn", "sharpe": 8.2992, "sortino": 18.984, "return_pct": 76.44, "equity": 1764.38, "max_dd": 2.37, "win_rate": 70.66, "profit_factor": 4.231, "ic": 0.6256, "hit": 70.24, "n": 168, "precision": 0.7229, "recall": 0.6977, "f1": 0.7101, "f2": 0.7026, "mcc": 0.4171, "accuracy": 0.7083, "tp": 60, "fp": 23, "tn": 59, "fn": 26, "aleatoric_mean": 3.8e-05, "epistemic_mean": 7.5e-05, "confidence_mean": 0.9999, "aleatoric_std": 3.4e-05, "epistemic_std": 6.9e-05}, {"fold": "fold_5", "regime": "Low-vol plateau", "sharpe": 7.465, "sortino": 14.812, "return_pct": 25.15, "equity": 1251.46, "max_dd": 1.62, "win_rate": 65.43, "profit_factor": 3.564, "ic": 0.4894, "hit": 65.43, "n": 162, "precision": 0.6136, "recall": 0.7105, "f1": 0.6585, "f2": 0.6888, "mcc": 0.3158, "accuracy": 0.6543, "tp": 54, "fp": 34, "tn": 52, "fn": 22, "aleatoric_mean": 1.8e-05, "epistemic_mean": 3.7e-05, "confidence_mean": 0.9999, "aleatoric_std": 8e-06, "epistemic_std": 1.6e-05}, {"fold": "fold_6", "regime": "EUR crisis downturn", "sharpe": 8.0496, "sortino": 14.1532, "return_pct": 56.7, "equity": 1567.0, "max_dd": 2.4, "win_rate": 67.88, "profit_factor": 3.762, "ic": 0.514, "hit": 67.88, "n": 165, "precision": 0.6304, "recall": 0.7532, "f1": 0.6864, "f2": 0.725, "mcc": 0.3685, "accuracy": 0.6788, "tp": 58, "fp": 34, "tn": 54, "fn": 19, "aleatoric_mean": 3.6e-05, "epistemic_mean": 7.2e-05, "confidence_mean": 0.9999, "aleatoric_std": 2.4e-05, "epistemic_std": 4.7e-05}, {"fold": "fold_7", "regime": "Recent mixed/upturn", "sharpe": 5.4716, "sortino": 7.3166, "return_pct": 35.76, "equity": 1357.55, "max_dd": 4.98, "win_rate": 65.43, "profit_factor": 2.552, "ic": 0.4011, "hit": 65.43, "n": 162, "precision": 0.6761, "recall": 0.5926, "f1": 0.6316, "f2": 0.6076, "mcc": 0.311, "accuracy": 0.6543, "tp": 48, "fp": 23, "tn": 58, "fn": 33, "aleatoric_mean": 3.2e-05, "epistemic_mean": 6.4e-05, "confidence_mean": 0.9999, "aleatoric_std": 2.3e-05, "epistemic_std": 4.7e-05}], "val_sharpe": 3.9246, "val_psr": 1.0, "val_equity": 2448.89, "val_sortino": 5.8156, "val_return_pct": 144.89, "val_max_dd": 8.02, "val_win_rate": 60.68, "val_profit_factor": 1.949, "val_ic": 0.3173, "val_hit": 60.29, "val_aleatoric_mean": 2.6e-05, "val_epistemic_mean": 5.2e-05, "val_confidence_mean": 0.9999, "val_precision": 0.5793, "val_recall": 0.6301, "val_f1": 0.6037, "val_f2": 0.6193, "val_mcc": 0.2156, "val_accuracy": 0.6068, "val_per_window": [{"fold": "fold_1", "regime": "Pre-crisis upturn + GFC onset", "sharpe": 0.6284, "sortino": 1.0649, "return_pct": 1.52, "equity": 1015.23, "max_dd": 2.47, "win_rate": 46.3, "profit_factor": 1.11, "ic": -0.0609, "hit": 45.87, "n": 109, "precision": 0.4697, "recall": 0.5636, "f1": 0.5124, "f2": 0.542, "mcc": -0.0865, "accuracy": 0.4587, "tp": 31, "fp": 35, "tn": 19, "fn": 24, "aleatoric_mean": 2.6e-05, "epistemic_mean": 5.2e-05, "confidence_mean": 0.9999, "aleatoric_std": 2e-05, "epistemic_std": 4e-05}, {"fold": "fold_2", "regime": "Post-crash recovery", "sharpe": -0.8918, "sortino": -1.3833, "return_pct": -4.5, "equity": 955.05, "max_dd": 7.71, "win_rate": 45.37, "profit_factor": 0.869, "ic": -0.0303, "hit": 45.37, "n": 108, "precision": 0.5417, "recall": 0.4127, "f1": 0.4685, "f2": 0.4333, "mcc": -0.0756, "accuracy": 0.4537, "tp": 26, "fp": 22, "tn": 23, "fn": 37, "aleatoric_mean": 4e-05, "epistemic_mean": 7.9e-05, "confidence_mean": 0.9999, "aleatoric_std": 1.7e-05, "epistemic_std": 3.4e-05}, {"fold": "fold_3", "regime": "Eurozone debt plateau", "sharpe": 6.7581, "sortino": 15.4985, "return_pct": 28.36, "equity": 1283.63, "max_dd": 1.76, "win_rate": 66.06, "profit_factor": 3.035, "ic": 0.491, "hit": 64.86, "n": 111, "precision": 0.5926, "recall": 0.6809, "f1": 0.6337, "f2": 0.6612, "mcc": 0.3332, "accuracy": 0.6667, "tp": 32, "fp": 22, "tn": 42, "fn": 15, "aleatoric_mean": 2.9e-05, "epistemic_mean": 5.8e-05, "confidence_mean": 0.9999, "aleatoric_std": 1.4e-05, "epistemic_std": 2.8e-05}, {"fold": "fold_4", "regime": "Strong USD downturn", "sharpe": 4.5388, "sortino": 6.4725, "return_pct": 16.22, "equity": 1162.19, "max_dd": 2.6, "win_rate": 63.3, "profit_factor": 2.129, "ic": 0.5216, "hit": 62.73, "n": 110, "precision": 0.5429, "recall": 0.8085, "f1": 0.6496, "f2": 0.7364, "mcc": 0.3091, "accuracy": 0.6273, "tp": 38, "fp": 32, "tn": 31, "fn": 9, "aleatoric_mean": 2.6e-05, "epistemic_mean": 5.2e-05, "confidence_mean": 0.9999, "aleatoric_std": 1.7e-05, "epistemic_std": 3.4e-05}, {"fold": "fold_5", "regime": "Low-vol plateau", "sharpe": 7.655, "sortino": 13.6538, "return_pct": 25.73, "equity": 1257.25, "max_dd": 1.56, "win_rate": 69.64, "profit_factor": 3.682, "ic": 0.5297, "hit": 69.64, "n": 112, "precision": 0.6792, "recall": 0.6792, "f1": 0.6792, "f2": 0.6792, "mcc": 0.3911, "accuracy": 0.6964, "tp": 36, "fp": 17, "tn": 42, "fn": 17, "aleatoric_mean": 2.2e-05, "epistemic_mean": 4.3e-05, "confidence_mean": 0.9999, "aleatoric_std": 1.1e-05, "epistemic_std": 2.2e-05}, {"fold": "fold_6", "regime": "EUR crisis downturn", "sharpe": 6.2031, "sortino": 8.5132, "return_pct": 14.08, "equity": 1140.79, "max_dd": 1.14, "win_rate": 69.16, "profit_factor": 2.891, "ic": 0.5341, "hit": 68.52, "n": 108, "precision": 0.6458, "recall": 0.6596, "f1": 0.6526, "f2": 0.6568, "mcc": 0.38, "accuracy": 0.6944, "tp": 31, "fp": 17, "tn": 44, "fn": 16, "aleatoric_mean": 1.7e-05, "epistemic_mean": 3.5e-05, "confidence_mean": 0.9999, "aleatoric_std": 7e-06, "epistemic_std": 1.5e-05}, {"fold": "fold_7", "regime": "Recent mixed/upturn", "sharpe": 7.7144, "sortino": 20.3128, "return_pct": 18.04, "equity": 1180.42, "max_dd": 0.81, "win_rate": 64.55, "profit_factor": 3.52, "ic": 0.4773, "hit": 64.55, "n": 110, "precision": 0.6207, "recall": 0.6792, "f1": 0.6486, "f2": 0.6667, "mcc": 0.2935, "accuracy": 0.6455, "tp": 36, "fp": 22, "tn": 35, "fn": 17, "aleatoric_mean": 2.2e-05, "epistemic_mean": 4.4e-05, "confidence_mean": 0.9999, "aleatoric_std": 1e-05, "epistemic_std": 2e-05}], "train_sharpe": 6.4475, "train_psr": 1.0, "train_equity": 1418962.25, "train_sortino": 16.9203, "train_return_pct": 141796.23, "train_max_dd": 3.71, "train_win_rate": 71.8, "train_profit_factor": 4.756, "train_ic": 0.6139, "train_hit": 71.51, "train_precision": 0.7145, "train_recall": 0.7465, "train_f1": 0.7301, "train_f2": 0.7398, "train_mcc": 0.4319, "train_accuracy": 0.7163, "train_per_window": [{"fold": "all_train", "regime": "Training data", "sharpe": 6.4475, "sortino": 16.9203, "return_pct": 141796.23, "equity": 1418962.25, "max_dd": 3.71, "win_rate": 71.8, "profit_factor": 4.756, "ic": 0.6139, "hit": 71.51, "n": 2478, "precision": 0.7145, "recall": 0.7465, "f1": 0.7301, "f2": 0.7398, "mcc": 0.4319, "accuracy": 0.7163, "tp": 951, "fp": 380, "tn": 824, "fn": 323}], "experiment_num": 164, "status": "DISCARD"}
