{"backbone": "xgboost", "description": "xgboost: Exp13 reg_lambda=0.1", "config": {"seq_len": 10, "lr": 0.0003, "batch_size": 32, "epochs": 20, "weight_decay": 1e-05, "patience": 5, "grad_clip": 1.0, "warmup_epochs": 0, "huber_delta": 1.0, "head_dropout": 0.1, "seed": 42, "max_depth": 4, "gbm_lr": 0.01, "het_loss": false}, "composite": 7.7601, "test_pos_folds": 7, "val_pos_folds": 6, "val_loss": 0.0, "elapsed_sec": 87.0, "timestamp": "2026-04-21T06:21:49", "sharpe": 7.8601, "psr": 1.0, "equity": 18650.4, "sortino": 7.6462, "return_pct": 1765.04, "max_dd": 7.54, "win_rate": 79.05, "profit_factor": 4.725, "ic": 0.682, "hit": 78.73, "precision": 0.8151, "recall": 0.7422, "f1": 0.7769, "f2": 0.7557, "mcc": 0.5804, "accuracy": 0.7893, "per_window": [{"fold": "fold_1", "regime": "Pre-crisis upturn + GFC onset", "sharpe": 0.1917, "sortino": 0.2067, "return_pct": 0.75, "equity": 1007.49, "max_dd": 7.54, "win_rate": 54.9, "profit_factor": 1.046, "ic": 0.2682, "hit": 54.37, "n": 103, "precision": 0.7333, "recall": 0.2075, "f1": 0.3235, "f2": 0.2423, "mcc": 0.1807, "accuracy": 0.5534, "tp": 11, "fp": 4, "tn": 46, "fn": 42}, {"fold": "fold_2", "regime": "Post-crash recovery", "sharpe": 2.2866, "sortino": 4.2367, "return_pct": 11.18, "equity": 1111.76, "max_dd": 5.33, "win_rate": 56.07, "profit_factor": 1.431, "ic": 0.0635, "hit": 56.07, "n": 107, "precision": 0.54, "recall": 0.5294, "f1": 0.5347, "f2": 0.5315, "mcc": 0.1188, "accuracy": 0.5607, "tp": 27, "fp": 23, "tn": 33, "fn": 24}, {"fold": "fold_3", "regime": "Eurozone debt plateau", "sharpe": 14.2841, "sortino": 23.8993, "return_pct": 45.56, "equity": 1455.64, "max_dd": 1.32, "win_rate": 84.62, "profit_factor": 11.003, "ic": 0.7503, "hit": 83.02, "n": 106, "precision": 0.8421, "recall": 0.8421, "f1": 0.8421, "f2": 0.8421, "mcc": 0.6584, "accuracy": 0.8302, "tp": 48, "fp": 9, "tn": 40, "fn": 9}, {"fold": "fold_4", "regime": "Strong USD downturn", "sharpe": 14.3348, "sortino": 18.3618, "return_pct": 127.82, "equity": 2278.16, "max_dd": 1.81, "win_rate": 90.42, "profit_factor": 17.778, "ic": 0.8761, "hit": 89.88, "n": 168, "precision": 0.9268, "recall": 0.8837, "f1": 0.9048, "f2": 0.892, "mcc": 0.8106, "accuracy": 0.9048, "tp": 76, "fp": 6, "tn": 76, "fn": 10}, {"fold": "fold_5", "regime": "Low-vol plateau", "sharpe": 15.3677, "sortino": 70.0515, "return_pct": 44.37, "equity": 1443.66, "max_dd": 0.23, "win_rate": 85.19, "profit_factor": 23.481, "ic": 0.9033, "hit": 85.19, "n": 162, "precision": 0.8421, "recall": 0.8421, "f1": 0.8421, "f2": 0.8421, "mcc": 0.7026, "accuracy": 0.8519, "tp": 64, "fp": 12, "tn": 74, "fn": 12}, {"fold": "fold_6", "regime": "EUR crisis downturn", "sharpe": 14.8522, "sortino": 59.1985, "return_pct": 97.4, "equity": 1974.04, "max_dd": 0.43, "win_rate": 81.21, "profit_factor": 15.158, "ic": 0.882, "hit": 81.21, "n": 165, "precision": 0.8026, "recall": 0.7922, "f1": 0.7974, "f2": 0.7943, "mcc": 0.6223, "accuracy": 0.8121, "tp": 61, "fp": 15, "tn": 73, "fn": 16}, {"fold": "fold_7", "regime": "Recent mixed/upturn", "sharpe": 11.9456, "sortino": 14.8836, "return_pct": 76.19, "equity": 1761.9, "max_dd": 1.64, "win_rate": 85.8, "profit_factor": 9.321, "ic": 0.8226, "hit": 85.8, "n": 162, "precision": 0.8537, "recall": 0.8642, "f1": 0.8589, "f2": 0.8621, "mcc": 0.7161, "accuracy": 0.858, "tp": 70, "fp": 12, "tn": 69, "fn": 11}], "val_sharpe": 7.951, "val_psr": 1.0, "val_equity": 5361.49, "val_sortino": 10.0084, "val_return_pct": 436.15, "val_max_dd": 13.01, "val_win_rate": 74.18, "val_profit_factor": 4.007, "val_ic": 0.6819, "val_hit": 73.7, "val_precision": 0.7022, "val_recall": 0.7945, "val_f1": 0.7455, "val_f2": 0.7742, "val_mcc": 0.4901, "val_accuracy": 0.7422, "val_per_window": [{"fold": "fold_1", "regime": "Pre-crisis upturn + GFC onset", "sharpe": 2.4874, "sortino": 4.6043, "return_pct": 6.32, "equity": 1063.24, "max_dd": 2.99, "win_rate": 49.07, "profit_factor": 1.512, "ic": 0.0042, "hit": 48.62, "n": 109, "precision": 0.4945, "recall": 0.8182, "f1": 0.6164, "f2": 0.7235, "mcc": -0.0453, "accuracy": 0.4862, "tp": 45, "fp": 46, "tn": 8, "fn": 10}, {"fold": "fold_2", "regime": "Post-crash recovery", "sharpe": -1.7209, "sortino": -2.6664, "return_pct": -8.23, "equity": 917.75, "max_dd": 13.01, "win_rate": 47.22, "profit_factor": 0.762, "ic": -0.0656, "hit": 47.22, "n": 108, "precision": 0.5517, "recall": 0.5079, "f1": 0.5289, "f2": 0.5161, "mcc": -0.0691, "accuracy": 0.4722, "tp": 32, "fp": 26, "tn": 19, "fn": 31}, {"fold": "fold_3", "regime": "Eurozone debt plateau", "sharpe": 15.2555, "sortino": 41.6013, "return_pct": 55.75, "equity": 1557.55, "max_dd": 0.64, "win_rate": 86.24, "profit_factor": 17.556, "ic": 0.8488, "hit": 84.68, "n": 111, "precision": 0.7963, "recall": 0.9149, "f1": 0.8515, "f2": 0.8884, "mcc": 0.7345, "accuracy": 0.8649, "tp": 43, "fp": 11, "tn": 53, "fn": 4}, {"fold": "fold_4", "regime": "Strong USD downturn", "sharpe": 15.4774, "sortino": 49.7788, "return_pct": 46.79, "equity": 1467.88, "max_dd": 0.64, "win_rate": 86.24, "profit_factor": 22.911, "ic": 0.9261, "hit": 85.45, "n": 110, "precision": 0.881, "recall": 0.7872, "f1": 0.8315, "f2": 0.8043, "mcc": 0.7208, "accuracy": 0.8636, "tp": 37, "fp": 5, "tn": 58, "fn": 10}, {"fold": "fold_5", "regime": "Low-vol plateau", "sharpe": 15.0602, "sortino": 76.4187, "return_pct": 43.83, "equity": 1438.33, "max_dd": 0.25, "win_rate": 83.04, "profit_factor": 20.646, "ic": 0.9169, "hit": 83.04, "n": 112, "precision": 0.8036, "recall": 0.8491, "f1": 0.8257, "f2": 0.8396, "mcc": 0.6617, "accuracy": 0.8304, "tp": 45, "fp": 11, "tn": 48, "fn": 8}, {"fold": "fold_6", "regime": "EUR crisis downturn", "sharpe": 15.4214, "sortino": 107.4093, "return_pct": 28.75, "equity": 1287.54, "max_dd": 0.15, "win_rate": 85.05, "profit_factor": 27.765, "ic": 0.9222, "hit": 84.26, "n": 108, "precision": 0.8039, "recall": 0.8723, "f1": 0.8367, "f2": 0.8577, "mcc": 0.7035, "accuracy": 0.8519, "tp": 41, "fp": 10, "tn": 51, "fn": 6}, {"fold": "fold_7", "regime": "Recent mixed/upturn", "sharpe": 14.9572, "sortino": 56.163, "return_pct": 29.77, "equity": 1297.72, "max_dd": 0.34, "win_rate": 81.82, "profit_factor": 14.963, "ic": 0.8748, "hit": 81.82, "n": 110, "precision": 0.7705, "recall": 0.8868, "f1": 0.8246, "f2": 0.8608, "mcc": 0.6446, "accuracy": 0.8182, "tp": 47, "fp": 14, "tn": 43, "fn": 6}], "train_sharpe": 10.6086, "train_psr": 1.0, "train_equity": 46694892.0, "train_sortino": 83.0623, "train_return_pct": 4669389.2, "train_max_dd": 0.53, "train_win_rate": 90.92, "train_profit_factor": 53.741, "train_ic": 0.9492, "train_hit": 90.56, "train_precision": 0.9017, "train_recall": 0.9215, "train_f1": 0.9115, "train_f2": 0.9175, "train_mcc": 0.8159, "train_accuracy": 0.908, "train_per_window": [{"fold": "all_train", "regime": "Training data", "sharpe": 10.6086, "sortino": 83.0623, "return_pct": 4669389.2, "equity": 46694892.0, "max_dd": 0.53, "win_rate": 90.92, "profit_factor": 53.741, "ic": 0.9492, "hit": 90.56, "n": 2478, "precision": 0.9017, "recall": 0.9215, "f1": 0.9115, "f2": 0.9175, "mcc": 0.8159, "accuracy": 0.908, "tp": 1174, "fp": 128, "tn": 1076, "fn": 100}], "experiment_num": 190, "status": "DISCARD"}
{"backbone": "xgboost", "description": "xgboost: Exp14 min_child_weight=5", "config": {"seq_len": 10, "lr": 0.0003, "batch_size": 32, "epochs": 20, "weight_decay": 1e-05, "patience": 5, "grad_clip": 1.0, "warmup_epochs": 0, "huber_delta": 1.0, "head_dropout": 0.1, "seed": 42, "max_depth": 4, "gbm_lr": 0.01, "het_loss": false}, "composite": 7.7601, "test_pos_folds": 7, "val_pos_folds": 6, "val_loss": 0.0, "elapsed_sec": 85.7, "timestamp": "2026-04-21T06:23:26", "sharpe": 7.8601, "psr": 1.0, "equity": 18650.4, "sortino": 7.6462, "return_pct": 1765.04, "max_dd": 7.54, "win_rate": 79.05, "profit_factor": 4.725, "ic": 0.682, "hit": 78.73, "precision": 0.8151, "recall": 0.7422, "f1": 0.7769, "f2": 0.7557, "mcc": 0.5804, "accuracy": 0.7893, "per_window": [{"fold": "fold_1", "regime": "Pre-crisis upturn + GFC onset", "sharpe": 0.1917, "sortino": 0.2067, "return_pct": 0.75, "equity": 1007.49, "max_dd": 7.54, "win_rate": 54.9, "profit_factor": 1.046, "ic": 0.2682, "hit": 54.37, "n": 103, "precision": 0.7333, "recall": 0.2075, "f1": 0.3235, "f2": 0.2423, "mcc": 0.1807, "accuracy": 0.5534, "tp": 11, "fp": 4, "tn": 46, "fn": 42}, {"fold": "fold_2", "regime": "Post-crash recovery", "sharpe": 2.2866, "sortino": 4.2367, "return_pct": 11.18, "equity": 1111.76, "max_dd": 5.33, "win_rate": 56.07, "profit_factor": 1.431, "ic": 0.0635, "hit": 56.07, "n": 107, "precision": 0.54, "recall": 0.5294, "f1": 0.5347, "f2": 0.5315, "mcc": 0.1188, "accuracy": 0.5607, "tp": 27, "fp": 23, "tn": 33, "fn": 24}, {"fold": "fold_3", "regime": "Eurozone debt plateau", "sharpe": 14.2841, "sortino": 23.8993, "return_pct": 45.56, "equity": 1455.64, "max_dd": 1.32, "win_rate": 84.62, "profit_factor": 11.003, "ic": 0.7503, "hit": 83.02, "n": 106, "precision": 0.8421, "recall": 0.8421, "f1": 0.8421, "f2": 0.8421, "mcc": 0.6584, "accuracy": 0.8302, "tp": 48, "fp": 9, "tn": 40, "fn": 9}, {"fold": "fold_4", "regime": "Strong USD downturn", "sharpe": 14.3348, "sortino": 18.3618, "return_pct": 127.82, "equity": 2278.16, "max_dd": 1.81, "win_rate": 90.42, "profit_factor": 17.778, "ic": 0.8761, "hit": 89.88, "n": 168, "precision": 0.9268, "recall": 0.8837, "f1": 0.9048, "f2": 0.892, "mcc": 0.8106, "accuracy": 0.9048, "tp": 76, "fp": 6, "tn": 76, "fn": 10}, {"fold": "fold_5", "regime": "Low-vol plateau", "sharpe": 15.3677, "sortino": 70.0515, "return_pct": 44.37, "equity": 1443.66, "max_dd": 0.23, "win_rate": 85.19, "profit_factor": 23.481, "ic": 0.9033, "hit": 85.19, "n": 162, "precision": 0.8421, "recall": 0.8421, "f1": 0.8421, "f2": 0.8421, "mcc": 0.7026, "accuracy": 0.8519, "tp": 64, "fp": 12, "tn": 74, "fn": 12}, {"fold": "fold_6", "regime": "EUR crisis downturn", "sharpe": 14.8522, "sortino": 59.1985, "return_pct": 97.4, "equity": 1974.04, "max_dd": 0.43, "win_rate": 81.21, "profit_factor": 15.158, "ic": 0.882, "hit": 81.21, "n": 165, "precision": 0.8026, "recall": 0.7922, "f1": 0.7974, "f2": 0.7943, "mcc": 0.6223, "accuracy": 0.8121, "tp": 61, "fp": 15, "tn": 73, "fn": 16}, {"fold": "fold_7", "regime": "Recent mixed/upturn", "sharpe": 11.9456, "sortino": 14.8836, "return_pct": 76.19, "equity": 1761.9, "max_dd": 1.64, "win_rate": 85.8, "profit_factor": 9.321, "ic": 0.8226, "hit": 85.8, "n": 162, "precision": 0.8537, "recall": 0.8642, "f1": 0.8589, "f2": 0.8621, "mcc": 0.7161, "accuracy": 0.858, "tp": 70, "fp": 12, "tn": 69, "fn": 11}], "val_sharpe": 7.951, "val_psr": 1.0, "val_equity": 5361.49, "val_sortino": 10.0084, "val_return_pct": 436.15, "val_max_dd": 13.01, "val_win_rate": 74.18, "val_profit_factor": 4.007, "val_ic": 0.6819, "val_hit": 73.7, "val_precision": 0.7022, "val_recall": 0.7945, "val_f1": 0.7455, "val_f2": 0.7742, "val_mcc": 0.4901, "val_accuracy": 0.7422, "val_per_window": [{"fold": "fold_1", "regime": "Pre-crisis upturn + GFC onset", "sharpe": 2.4874, "sortino": 4.6043, "return_pct": 6.32, "equity": 1063.24, "max_dd": 2.99, "win_rate": 49.07, "profit_factor": 1.512, "ic": 0.0042, "hit": 48.62, "n": 109, "precision": 0.4945, "recall": 0.8182, "f1": 0.6164, "f2": 0.7235, "mcc": -0.0453, "accuracy": 0.4862, "tp": 45, "fp": 46, "tn": 8, "fn": 10}, {"fold": "fold_2", "regime": "Post-crash recovery", "sharpe": -1.7209, "sortino": -2.6664, "return_pct": -8.23, "equity": 917.75, "max_dd": 13.01, "win_rate": 47.22, "profit_factor": 0.762, "ic": -0.0656, "hit": 47.22, "n": 108, "precision": 0.5517, "recall": 0.5079, "f1": 0.5289, "f2": 0.5161, "mcc": -0.0691, "accuracy": 0.4722, "tp": 32, "fp": 26, "tn": 19, "fn": 31}, {"fold": "fold_3", "regime": "Eurozone debt plateau", "sharpe": 15.2555, "sortino": 41.6013, "return_pct": 55.75, "equity": 1557.55, "max_dd": 0.64, "win_rate": 86.24, "profit_factor": 17.556, "ic": 0.8488, "hit": 84.68, "n": 111, "precision": 0.7963, "recall": 0.9149, "f1": 0.8515, "f2": 0.8884, "mcc": 0.7345, "accuracy": 0.8649, "tp": 43, "fp": 11, "tn": 53, "fn": 4}, {"fold": "fold_4", "regime": "Strong USD downturn", "sharpe": 15.4774, "sortino": 49.7788, "return_pct": 46.79, "equity": 1467.88, "max_dd": 0.64, "win_rate": 86.24, "profit_factor": 22.911, "ic": 0.9261, "hit": 85.45, "n": 110, "precision": 0.881, "recall": 0.7872, "f1": 0.8315, "f2": 0.8043, "mcc": 0.7208, "accuracy": 0.8636, "tp": 37, "fp": 5, "tn": 58, "fn": 10}, {"fold": "fold_5", "regime": "Low-vol plateau", "sharpe": 15.0602, "sortino": 76.4187, "return_pct": 43.83, "equity": 1438.33, "max_dd": 0.25, "win_rate": 83.04, "profit_factor": 20.646, "ic": 0.9169, "hit": 83.04, "n": 112, "precision": 0.8036, "recall": 0.8491, "f1": 0.8257, "f2": 0.8396, "mcc": 0.6617, "accuracy": 0.8304, "tp": 45, "fp": 11, "tn": 48, "fn": 8}, {"fold": "fold_6", "regime": "EUR crisis downturn", "sharpe": 15.4214, "sortino": 107.4093, "return_pct": 28.75, "equity": 1287.54, "max_dd": 0.15, "win_rate": 85.05, "profit_factor": 27.765, "ic": 0.9222, "hit": 84.26, "n": 108, "precision": 0.8039, "recall": 0.8723, "f1": 0.8367, "f2": 0.8577, "mcc": 0.7035, "accuracy": 0.8519, "tp": 41, "fp": 10, "tn": 51, "fn": 6}, {"fold": "fold_7", "regime": "Recent mixed/upturn", "sharpe": 14.9572, "sortino": 56.163, "return_pct": 29.77, "equity": 1297.72, "max_dd": 0.34, "win_rate": 81.82, "profit_factor": 14.963, "ic": 0.8748, "hit": 81.82, "n": 110, "precision": 0.7705, "recall": 0.8868, "f1": 0.8246, "f2": 0.8608, "mcc": 0.6446, "accuracy": 0.8182, "tp": 47, "fp": 14, "tn": 43, "fn": 6}], "train_sharpe": 10.6086, "train_psr": 1.0, "train_equity": 46694892.0, "train_sortino": 83.0623, "train_return_pct": 4669389.2, "train_max_dd": 0.53, "train_win_rate": 90.92, "train_profit_factor": 53.741, "train_ic": 0.9492, "train_hit": 90.56, "train_precision": 0.9017, "train_recall": 0.9215, "train_f1": 0.9115, "train_f2": 0.9175, "train_mcc": 0.8159, "train_accuracy": 0.908, "train_per_window": [{"fold": "all_train", "regime": "Training data", "sharpe": 10.6086, "sortino": 83.0623, "return_pct": 4669389.2, "equity": 46694892.0, "max_dd": 0.53, "win_rate": 90.92, "profit_factor": 53.741, "ic": 0.9492, "hit": 90.56, "n": 2478, "precision": 0.9017, "recall": 0.9215, "f1": 0.9115, "f2": 0.9175, "mcc": 0.8159, "accuracy": 0.908, "tp": 1174, "fp": 128, "tn": 1076, "fn": 100}], "experiment_num": 191, "status": "DISCARD"}
{"backbone": "xgboost", "description": "Exp15 seq=20", "config": {"seq_len": 20, "lr": 0.0003, "batch_size": 32, "epochs": 20, "weight_decay": 1e-05, "patience": 5, "grad_clip": 1.0, "warmup_epochs": 0, "huber_delta": 1.0, "head_dropout": 0.1, "seed": 42, "max_depth": 4, "gbm_lr": 0.01, "het_loss": false}, "composite": 7.9395, "test_pos_folds": 7, "val_pos_folds": 6, "val_loss": 0.0, "elapsed_sec": 168.2, "timestamp": "2026-04-21T06:26:43", "sharpe": 8.0395, "psr": 1.0, "equity": 16639.35, "sortino": 7.7668, "return_pct": 1563.93, "max_dd": 7.54, "win_rate": 78.98, "profit_factor": 4.996, "ic": 0.6993, "hit": 78.63, "precision": 0.7953, "recall": 0.7647, "f1": 0.7797, "f2": 0.7706, "mcc": 0.5769, "accuracy": 0.7885, "per_window": [{"fold": "fold_1", "regime": "Pre-crisis upturn + GFC onset", "sharpe": 0.5367, "sortino": 0.6017, "return_pct": 3.21, "equity": 1032.14, "max_dd": 7.54, "win_rate": 48.91, "profit_factor": 1.138, "ic": 0.0148, "hit": 48.39, "n": 93, "precision": 0.5128, "recall": 0.4167, "f1": 0.4598, "f2": 0.4329, "mcc": -0.0056, "accuracy": 0.4946, "tp": 20, "fp": 19, "tn": 26, "fn": 28}, {"fold": "fold_2", "regime": "Post-crash recovery", "sharpe": 0.662, "sortino": 1.1696, "return_pct": 2.72, "equity": 1027.2, "max_dd": 5.82, "win_rate": 51.55, "profit_factor": 1.109, "ic": -0.0295, "hit": 51.55, "n": 97, "precision": 0.5, "recall": 0.4894, "f1": 0.4946, "f2": 0.4915, "mcc": 0.0294, "accuracy": 0.5155, "tp": 23, "fp": 23, "tn": 27, "fn": 24}, {"fold": "fold_3", "regime": "Eurozone debt plateau", "sharpe": 15.7131, "sortino": 25.6256, "return_pct": 44.22, "equity": 1442.17, "max_dd": 1.32, "win_rate": 86.17, "profit_factor": 15.144, "ic": 0.8277, "hit": 84.38, "n": 96, "precision": 0.8571, "recall": 0.84, "f1": 0.8485, "f2": 0.8434, "mcc": 0.6874, "accuracy": 0.8438, "tp": 42, "fp": 7, "tn": 39, "fn": 8}, {"fold": "fold_4", "regime": "Strong USD downturn", "sharpe": 15.5064, "sortino": 48.9452, "return_pct": 126.89, "equity": 2268.88, "max_dd": 0.56, "win_rate": 91.08, "profit_factor": 29.731, "ic": 0.8963, "hit": 90.51, "n": 158, "precision": 0.9333, "recall": 0.8861, "f1": 0.9091, "f2": 0.8951, "mcc": 0.8238, "accuracy": 0.9114, "tp": 70, "fp": 5, "tn": 74, "fn": 9}, {"fold": "fold_5", "regime": "Low-vol plateau", "sharpe": 15.8589, "sortino": 82.9173, "return_pct": 41.01, "equity": 1410.15, "max_dd": 0.23, "win_rate": 86.18, "profit_factor": 27.88, "ic": 0.9073, "hit": 86.18, "n": 152, "precision": 0.8551, "recall": 0.8429, "f1": 0.8489, "f2": 0.8453, "mcc": 0.7217, "accuracy": 0.8618, "tp": 59, "fp": 10, "tn": 72, "fn": 11}, {"fold": "fold_6", "regime": "EUR crisis downturn", "sharpe": 15.0463, "sortino": 63.2137, "return_pct": 92.21, "equity": 1922.06, "max_dd": 0.43, "win_rate": 81.29, "profit_factor": 15.848, "ic": 0.881, "hit": 81.29, "n": 155, "precision": 0.8116, "recall": 0.7778, "f1": 0.7943, "f2": 0.7843, "mcc": 0.6233, "accuracy": 0.8129, "tp": 56, "fp": 13, "tn": 70, "fn": 16}, {"fold": "fold_7", "regime": "Recent mixed/upturn", "sharpe": 13.385, "sortino": 15.4032, "return_pct": 76.96, "equity": 1769.64, "max_dd": 1.64, "win_rate": 88.16, "profit_factor": 13.281, "ic": 0.8669, "hit": 88.16, "n": 152, "precision": 0.8718, "recall": 0.8947, "f1": 0.8831, "f2": 0.8901, "mcc": 0.7634, "accuracy": 0.8816, "tp": 68, "fp": 10, "tn": 66, "fn": 8}], "val_sharpe": 8.6509, "val_psr": 1.0, "val_equity": 5147.35, "val_sortino": 11.0011, "val_return_pct": 414.73, "val_max_dd": 12.2, "val_win_rate": 77.49, "val_profit_factor": 4.56, "val_ic": 0.6841, "val_hit": 76.93, "val_precision": 0.7364, "val_recall": 0.8212, "val_f1": 0.7765, "val_f2": 0.8027, "val_mcc": 0.5576, "val_accuracy": 0.7765, "val_per_window": [{"fold": "fold_1", "regime": "Pre-crisis upturn + GFC onset", "sharpe": 2.8034, "sortino": 5.2001, "return_pct": 6.6, "equity": 1066.02, "max_dd": 3.91, "win_rate": 51.02, "profit_factor": 1.595, "ic": 0.0183, "hit": 50.51, "n": 99, "precision": 0.5062, "recall": 0.8367, "f1": 0.6308, "f2": 0.7401, "mcc": 0.0476, "accuracy": 0.5152, "tp": 41, "fp": 40, "tn": 10, "fn": 8}, {"fold": "fold_2", "regime": "Post-crash recovery", "sharpe": -0.7616, "sortino": -1.1878, "return_pct": -3.38, "equity": 966.18, "max_dd": 12.2, "win_rate": 51.02, "profit_factor": 0.886, "ic": -0.0779, "hit": 51.02, "n": 98, "precision": 0.5849, "recall": 0.5439, "f1": 0.5636, "f2": 0.5516, "mcc": 0.0072, "accuracy": 0.5102, "tp": 31, "fp": 22, "tn": 19, "fn": 26}, {"fold": "fold_3", "regime": "Eurozone debt plateau", "sharpe": 15.9726, "sortino": 45.6327, "return_pct": 53.1, "equity": 1531.0, "max_dd": 0.62, "win_rate": 85.86, "profit_factor": 22.286, "ic": 0.8478, "hit": 84.16, "n": 101, "precision": 0.7826, "recall": 0.9, "f1": 0.8372, "f2": 0.8738, "mcc": 0.7229, "accuracy": 0.8614, "tp": 36, "fp": 10, "tn": 51, "fn": 4}, {"fold": "fold_4", "regime": "Strong USD downturn", "sharpe": 16.1528, "sortino": 39.6117, "return_pct": 44.79, "equity": 1447.85, "max_dd": 0.64, "win_rate": 89.9, "profit_factor": 25.765, "ic": 0.9255, "hit": 89.0, "n": 100, "precision": 0.9474, "recall": 0.8182, "f1": 0.878, "f2": 0.8411, "mcc": 0.8002, "accuracy": 0.9, "tp": 36, "fp": 2, "tn": 54, "fn": 8}, {"fold": "fold_5", "regime": "Low-vol plateau", "sharpe": 15.1577, "sortino": 73.772, "return_pct": 40.1, "equity": 1401.0, "max_dd": 0.49, "win_rate": 86.27, "profit_factor": 23.334, "ic": 0.9157, "hit": 86.27, "n": 102, "precision": 0.8182, "recall": 0.9184, "f1": 0.8654, "f2": 0.8964, "mcc": 0.7314, "accuracy": 0.8627, "tp": 45, "fp": 10, "tn": 43, "fn": 4}, {"fold": "fold_6", "regime": "EUR crisis downturn", "sharpe": 16.984, "sortino": 103.1241, "return_pct": 27.36, "equity": 1273.56, "max_dd": 0.15, "win_rate": 92.78, "profit_factor": 67.097, "ic": 0.9377, "hit": 91.84, "n": 98, "precision": 0.907, "recall": 0.9286, "f1": 0.9176, "f2": 0.9242, "mcc": 0.8548, "accuracy": 0.9286, "tp": 39, "fp": 4, "tn": 52, "fn": 3}, {"fold": "fold_7", "regime": "Recent mixed/upturn", "sharpe": 14.5555, "sortino": 31.1558, "return_pct": 26.36, "equity": 1263.58, "max_dd": 0.5, "win_rate": 85.0, "profit_factor": 13.415, "ic": 0.8682, "hit": 85.0, "n": 100, "precision": 0.8269, "recall": 0.8776, "f1": 0.8515, "f2": 0.8669, "mcc": 0.7015, "accuracy": 0.85, "tp": 43, "fp": 9, "tn": 42, "fn": 6}], "train_sharpe": 10.5426, "train_psr": 1.0, "train_equity": 18940498.0, "train_sortino": 106.4508, "train_return_pct": 1893949.8, "train_max_dd": 0.5, "train_win_rate": 92.27, "train_profit_factor": 75.942, "train_ic": 0.9642, "train_hit": 91.85, "train_precision": 0.9161, "train_recall": 0.9314, "train_f1": 0.9237, "train_f2": 0.9283, "train_mcc": 0.8424, "train_accuracy": 0.9212, "train_per_window": [{"fold": "all_train", "regime": "Training data", "sharpe": 10.5426, "sortino": 106.4508, "return_pct": 1893949.8, "equity": 18940498.0, "max_dd": 0.5, "win_rate": 92.27, "profit_factor": 75.942, "ic": 0.9642, "hit": 91.85, "n": 2221, "precision": 0.9161, "recall": 0.9314, "f1": 0.9237, "f2": 0.9283, "mcc": 0.8424, "accuracy": 0.9212, "tp": 1059, "fp": 97, "tn": 987, "fn": 78}], "experiment_num": 192, "status": "KEEP"}
