{"backbone": "xgboost", "description": "Exp25 seq=20 depth=3", "config": {"seq_len": 20, "lr": 0.0003, "batch_size": 32, "epochs": 20, "weight_decay": 1e-05, "patience": 5, "grad_clip": 1.0, "warmup_epochs": 0, "huber_delta": 1.0, "head_dropout": 0.1, "seed": 42, "max_depth": 3, "gbm_lr": 0.01, "het_loss": false}, "composite": 7.788, "test_pos_folds": 7, "val_pos_folds": 6, "val_loss": 0.0, "elapsed_sec": 99.1, "timestamp": "2026-04-21T06:51:24", "sharpe": 7.888, "psr": 1.0, "equity": 15943.0, "sortino": 7.5997, "return_pct": 1494.3, "max_dd": 7.54, "win_rate": 78.75, "profit_factor": 4.82, "ic": 0.6949, "hit": 78.41, "precision": 0.7916, "recall": 0.7647, "f1": 0.7779, "f2": 0.7699, "mcc": 0.5724, "accuracy": 0.7863, "per_window": [{"fold": "fold_1", "regime": "Pre-crisis upturn + GFC onset", "sharpe": 0.3777, "sortino": 0.4278, "return_pct": 2.04, "equity": 1020.37, "max_dd": 7.54, "win_rate": 47.83, "profit_factor": 1.095, "ic": -0.005, "hit": 47.31, "n": 93, "precision": 0.5, "recall": 0.4167, "f1": 0.4545, "f2": 0.431, "mcc": -0.028, "accuracy": 0.4839, "tp": 20, "fp": 20, "tn": 25, "fn": 28}, {"fold": "fold_2", "regime": "Post-crash recovery", "sharpe": 1.3333, "sortino": 2.3852, "return_pct": 5.81, "equity": 1058.12, "max_dd": 3.43, "win_rate": 54.64, "profit_factor": 1.232, "ic": -0.0257, "hit": 54.64, "n": 97, "precision": 0.5333, "recall": 0.5106, "f1": 0.5217, "f2": 0.515, "mcc": 0.0908, "accuracy": 0.5464, "tp": 24, "fp": 21, "tn": 29, "fn": 23}, {"fold": "fold_3", "regime": "Eurozone debt plateau", "sharpe": 16.2047, "sortino": 24.2575, "return_pct": 45.04, "equity": 1450.37, "max_dd": 1.32, "win_rate": 88.3, "profit_factor": 17.123, "ic": 0.8147, "hit": 86.46, "n": 96, "precision": 0.8776, "recall": 0.86, "f1": 0.8687, "f2": 0.8635, "mcc": 0.7291, "accuracy": 0.8646, "tp": 43, "fp": 6, "tn": 40, "fn": 7}, {"fold": "fold_4", "regime": "Strong USD downturn", "sharpe": 13.5209, "sortino": 17.8501, "return_pct": 113.81, "equity": 2138.14, "max_dd": 1.81, "win_rate": 88.54, "profit_factor": 14.1, "ic": 0.8847, "hit": 87.97, "n": 158, "precision": 0.9067, "recall": 0.8608, "f1": 0.8831, "f2": 0.8696, "mcc": 0.7731, "accuracy": 0.8861, "tp": 68, "fp": 7, "tn": 72, "fn": 11}, {"fold": "fold_5", "regime": "Low-vol plateau", "sharpe": 15.5373, "sortino": 72.8982, "return_pct": 40.51, "equity": 1405.15, "max_dd": 0.23, "win_rate": 85.53, "profit_factor": 24.367, "ic": 0.9099, "hit": 85.53, "n": 152, "precision": 0.8429, "recall": 0.8429, "f1": 0.8429, "f2": 0.8429, "mcc": 0.7087, "accuracy": 0.8553, "tp": 59, "fp": 11, "tn": 71, "fn": 11}, {"fold": "fold_6", "regime": "EUR crisis downturn", "sharpe": 14.8113, "sortino": 64.6314, "return_pct": 91.16, "equity": 1911.59, "max_dd": 0.43, "win_rate": 80.0, "profit_factor": 14.868, "ic": 0.8821, "hit": 80.0, "n": 155, "precision": 0.7971, "recall": 0.7639, "f1": 0.7801, "f2": 0.7703, "mcc": 0.5973, "accuracy": 0.8, "tp": 55, "fp": 14, "tn": 69, "fn": 17}, {"fold": "fold_7", "regime": "Recent mixed/upturn", "sharpe": 13.4553, "sortino": 15.1019, "return_pct": 77.27, "equity": 1772.75, "max_dd": 1.64, "win_rate": 88.82, "profit_factor": 13.554, "ic": 0.8667, "hit": 88.82, "n": 152, "precision": 0.8734, "recall": 0.9079, "f1": 0.8903, "f2": 0.9008, "mcc": 0.7769, "accuracy": 0.8882, "tp": 69, "fp": 10, "tn": 66, "fn": 7}], "val_sharpe": 7.969, "val_psr": 1.0, "val_equity": 4644.5, "val_sortino": 10.6028, "val_return_pct": 364.45, "val_max_dd": 12.53, "val_win_rate": 75.61, "val_profit_factor": 4.004, "val_ic": 0.6697, "val_hit": 75.07, "val_precision": 0.7205, "val_recall": 0.797, "val_f1": 0.7568, "val_f2": 0.7804, "val_mcc": 0.5196, "val_accuracy": 0.7579, "val_per_window": [{"fold": "fold_1", "regime": "Pre-crisis upturn + GFC onset", "sharpe": 0.795, "sortino": 1.4478, "return_pct": 1.81, "equity": 1018.05, "max_dd": 4.12, "win_rate": 45.92, "profit_factor": 1.141, "ic": 0.0348, "hit": 45.45, "n": 99, "precision": 0.4744, "recall": 0.7551, "f1": 0.5827, "f2": 0.6752, "mcc": -0.0794, "accuracy": 0.4646, "tp": 37, "fp": 41, "tn": 9, "fn": 12}, {"fold": "fold_2", "regime": "Post-crash recovery", "sharpe": -1.6921, "sortino": -2.6925, "return_pct": -7.07, "equity": 929.3, "max_dd": 12.53, "win_rate": 44.9, "profit_factor": 0.764, "ic": -0.0705, "hit": 44.9, "n": 98, "precision": 0.5263, "recall": 0.5263, "f1": 0.5263, "f2": 0.5263, "mcc": -0.1322, "accuracy": 0.449, "tp": 30, "fp": 27, "tn": 14, "fn": 27}, {"fold": "fold_3", "regime": "Eurozone debt plateau", "sharpe": 15.0459, "sortino": 42.8157, "return_pct": 51.14, "equity": 1511.4, "max_dd": 0.62, "win_rate": 84.85, "profit_factor": 16.632, "ic": 0.8486, "hit": 83.17, "n": 101, "precision": 0.7907, "recall": 0.85, "f1": 0.8193, "f2": 0.8374, "mcc": 0.6948, "accuracy": 0.8515, "tp": 34, "fp": 9, "tn": 52, "fn": 6}, {"fold": "fold_4", "regime": "Strong USD downturn", "sharpe": 15.7139, "sortino": 39.3732, "return_pct": 44.05, "equity": 1440.54, "max_dd": 0.92, "win_rate": 89.9, "profit_factor": 21.9, "ic": 0.9208, "hit": 89.0, "n": 100, "precision": 0.9722, "recall": 0.7955, "f1": 0.875, "f2": 0.8255, "mcc": 0.8041, "accuracy": 0.9, "tp": 35, "fp": 1, "tn": 55, "fn": 9}, {"fold": "fold_5", "regime": "Low-vol plateau", "sharpe": 15.1577, "sortino": 73.772, "return_pct": 40.1, "equity": 1401.0, "max_dd": 0.49, "win_rate": 86.27, "profit_factor": 23.334, "ic": 0.9148, "hit": 86.27, "n": 102, "precision": 0.8182, "recall": 0.9184, "f1": 0.8654, "f2": 0.8964, "mcc": 0.7314, "accuracy": 0.8627, "tp": 45, "fp": 10, "tn": 43, "fn": 4}, {"fold": "fold_6", "regime": "EUR crisis downturn", "sharpe": 16.7287, "sortino": 111.4243, "return_pct": 27.14, "equity": 1271.37, "max_dd": 0.15, "win_rate": 90.72, "profit_factor": 54.162, "ic": 0.9333, "hit": 89.8, "n": 98, "precision": 0.8667, "recall": 0.9286, "f1": 0.8966, "f2": 0.9155, "mcc": 0.8157, "accuracy": 0.9082, "tp": 39, "fp": 6, "tn": 50, "fn": 3}, {"fold": "fold_7", "regime": "Recent mixed/upturn", "sharpe": 14.7664, "sortino": 30.4249, "return_pct": 26.59, "equity": 1265.9, "max_dd": 0.5, "win_rate": 86.0, "profit_factor": 14.147, "ic": 0.8562, "hit": 86.0, "n": 100, "precision": 0.8431, "recall": 0.8776, "f1": 0.86, "f2": 0.8704, "mcc": 0.7207, "accuracy": 0.86, "tp": 43, "fp": 8, "tn": 43, "fn": 6}], "train_sharpe": 9.8924, "train_psr": 1.0, "train_equity": 12239795.0, "train_sortino": 55.8152, "train_return_pct": 1223879.5, "train_max_dd": 1.19, "train_win_rate": 87.97, "train_profit_factor": 28.04, "train_ic": 0.9126, "train_hit": 87.57, "train_precision": 0.8747, "train_recall": 0.8901, "train_f1": 0.8823, "train_f2": 0.8869, "train_mcc": 0.7567, "train_accuracy": 0.8784, "train_per_window": [{"fold": "all_train", "regime": "Training data", "sharpe": 9.8924, "sortino": 55.8152, "return_pct": 1223879.5, "equity": 12239795.0, "max_dd": 1.19, "win_rate": 87.97, "profit_factor": 28.04, "ic": 0.9126, "hit": 87.57, "n": 2221, "precision": 0.8747, "recall": 0.8901, "f1": 0.8823, "f2": 0.8869, "mcc": 0.7567, "accuracy": 0.8784, "tp": 1012, "fp": 145, "tn": 939, "fn": 125}], "experiment_num": 202, "status": "DISCARD"}
{"backbone": "xgboost", "description": "xgboost: Exp26 seq=60 (extend upward trend)", "config": {"seq_len": 60, "lr": 0.0003, "batch_size": 32, "epochs": 20, "weight_decay": 1e-05, "patience": 5, "grad_clip": 1.0, "warmup_epochs": 0, "huber_delta": 1.0, "head_dropout": 0.1, "seed": 42, "max_depth": 4, "gbm_lr": 0.01, "het_loss": false}, "composite": 9.186, "test_pos_folds": 6, "val_pos_folds": 7, "val_loss": 0.0, "elapsed_sec": 440.8, "timestamp": "2026-04-21T06:59:31", "sharpe": 9.645, "psr": 1.0, "equity": 6782.06, "sortino": 13.4952, "return_pct": 578.21, "max_dd": 3.68, "win_rate": 79.64, "profit_factor": 5.49, "ic": 0.6981, "hit": 79.13, "precision": 0.7929, "recall": 0.7903, "f1": 0.7916, "f2": 0.7908, "mcc": 0.5859, "accuracy": 0.7929, "per_window": [{"fold": "fold_1", "regime": "Pre-crisis upturn + GFC onset", "sharpe": -0.9539, "sortino": -1.7887, "return_pct": -2.1, "equity": 979.01, "max_dd": 3.6, "win_rate": 44.23, "profit_factor": 0.864, "ic": -0.0103, "hit": 43.4, "n": 53, "precision": 0.4333, "recall": 0.5, "f1": 0.4643, "f2": 0.4851, "mcc": -0.1308, "accuracy": 0.434, "tp": 13, "fp": 17, "tn": 10, "fn": 13}, {"fold": "fold_2", "regime": "Post-crash recovery", "sharpe": 0.9638, "sortino": 1.6314, "return_pct": 2.6, "equity": 1026.03, "max_dd": 3.68, "win_rate": 56.14, "profit_factor": 1.167, "ic": 0.0003, "hit": 56.14, "n": 57, "precision": 0.6071, "recall": 0.5484, "f1": 0.5763, "f2": 0.5592, "mcc": 0.1248, "accuracy": 0.5614, "tp": 17, "fp": 11, "tn": 15, "fn": 14}, {"fold": "fold_3", "regime": "Eurozone debt plateau", "sharpe": 15.8366, "sortino": 59.0058, "return_pct": 21.92, "equity": 1219.22, "max_dd": 0.29, "win_rate": 85.19, "profit_factor": 17.749, "ic": 0.8712, "hit": 82.14, "n": 56, "precision": 0.8929, "recall": 0.7812, "f1": 0.8333, "f2": 0.8013, "mcc": 0.6495, "accuracy": 0.8214, "tp": 25, "fp": 3, "tn": 21, "fn": 7}, {"fold": "fold_4", "regime": "Strong USD downturn", "sharpe": 14.6898, "sortino": 46.0189, "return_pct": 72.09, "equity": 1720.88, "max_dd": 0.66, "win_rate": 89.74, "profit_factor": 19.774, "ic": 0.8944, "hit": 88.98, "n": 118, "precision": 0.9138, "recall": 0.8833, "f1": 0.8983, "f2": 0.8893, "mcc": 0.7971, "accuracy": 0.8983, "tp": 53, "fp": 5, "tn": 53, "fn": 7}, {"fold": "fold_5", "regime": "Low-vol plateau", "sharpe": 14.7889, "sortino": 57.0424, "return_pct": 27.54, "equity": 1275.4, "max_dd": 0.23, "win_rate": 83.93, "profit_factor": 18.928, "ic": 0.9, "hit": 83.93, "n": 112, "precision": 0.8, "recall": 0.8627, "f1": 0.8302, "f2": 0.8494, "mcc": 0.6798, "accuracy": 0.8393, "tp": 44, "fp": 11, "tn": 50, "fn": 7}, {"fold": "fold_6", "regime": "EUR crisis downturn", "sharpe": 15.4896, "sortino": 39.301, "return_pct": 64.44, "equity": 1644.35, "max_dd": 0.76, "win_rate": 82.61, "profit_factor": 15.193, "ic": 0.8756, "hit": 82.61, "n": 115, "precision": 0.8235, "recall": 0.7925, "f1": 0.8077, "f2": 0.7985, "mcc": 0.6495, "accuracy": 0.8261, "tp": 42, "fp": 9, "tn": 53, "fn": 11}, {"fold": "fold_7", "regime": "Recent mixed/upturn", "sharpe": 13.758, "sortino": 24.3851, "return_pct": 53.44, "equity": 1534.4, "max_dd": 1.02, "win_rate": 87.5, "profit_factor": 17.266, "ic": 0.8945, "hit": 87.5, "n": 112, "precision": 0.8644, "recall": 0.8947, "f1": 0.8793, "f2": 0.8885, "mcc": 0.7502, "accuracy": 0.875, "tp": 51, "fp": 8, "tn": 47, "fn": 6}], "val_sharpe": 9.286, "val_psr": 1.0, "val_equity": 2715.85, "val_sortino": 14.5149, "val_return_pct": 171.58, "val_max_dd": 4.22, "val_win_rate": 75.24, "val_profit_factor": 5.021, "val_ic": 0.6825, "val_hit": 74.88, "val_precision": 0.7137, "val_recall": 0.835, "val_f1": 0.7696, "val_f2": 0.8075, "val_mcc": 0.5155, "val_accuracy": 0.7536, "val_per_window": [{"fold": "fold_1", "regime": "Pre-crisis upturn + GFC onset", "sharpe": 0.0726, "sortino": 0.1237, "return_pct": 0.06, "equity": 1000.62, "max_dd": 3.61, "win_rate": 41.38, "profit_factor": 1.012, "ic": -0.0603, "hit": 40.68, "n": 59, "precision": 0.4595, "recall": 0.5484, "f1": 0.5, "f2": 0.528, "mcc": -0.1713, "accuracy": 0.4237, "tp": 17, "fp": 20, "tn": 8, "fn": 14}, {"fold": "fold_2", "regime": "Post-crash recovery", "sharpe": 1.59, "sortino": 2.5419, "return_pct": 3.07, "equity": 1030.66, "max_dd": 2.67, "win_rate": 53.45, "profit_factor": 1.294, "ic": 0.0406, "hit": 53.45, "n": 58, "precision": 0.5526, "recall": 0.6774, "f1": 0.6087, "f2": 0.6481, "mcc": 0.0502, "accuracy": 0.5345, "tp": 21, "fp": 17, "tn": 10, "fn": 10}, {"fold": "fold_3", "regime": "Eurozone debt plateau", "sharpe": 13.0481, "sortino": 40.5119, "return_pct": 26.75, "equity": 1267.55, "max_dd": 0.45, "win_rate": 80.33, "profit_factor": 11.492, "ic": 0.921, "hit": 80.33, "n": 61, "precision": 0.6923, "recall": 1.0, "f1": 0.8182, "f2": 0.9184, "mcc": 0.6693, "accuracy": 0.8033, "tp": 27, "fp": 12, "tn": 22, "fn": 0}, {"fold": "fold_4", "regime": "Strong USD downturn", "sharpe": 18.4142, "sortino": 51.1192, "return_pct": 29.99, "equity": 1299.9, "max_dd": 0.39, "win_rate": 90.0, "profit_factor": 24.703, "ic": 0.9395, "hit": 90.0, "n": 60, "precision": 0.871, "recall": 0.931, "f1": 0.9, "f2": 0.9184, "mcc": 0.802, "accuracy": 0.9, "tp": 27, "fp": 4, "tn": 27, "fn": 2}, {"fold": "fold_5", "regime": "Low-vol plateau", "sharpe": 16.8606, "sortino": 91.2445, "return_pct": 22.16, "equity": 1221.6, "max_dd": 0.2, "win_rate": 87.1, "profit_factor": 30.514, "ic": 0.9157, "hit": 87.1, "n": 62, "precision": 0.8529, "recall": 0.9062, "f1": 0.8788, "f2": 0.8951, "mcc": 0.7427, "accuracy": 0.871, "tp": 29, "fp": 5, "tn": 25, "fn": 3}, {"fold": "fold_6", "regime": "EUR crisis downturn", "sharpe": 17.9229, "sortino": 164.6578, "return_pct": 13.18, "equity": 1131.76, "max_dd": 0.06, "win_rate": 91.23, "profit_factor": 74.946, "ic": 0.8987, "hit": 89.66, "n": 58, "precision": 0.8519, "recall": 0.9583, "f1": 0.902, "f2": 0.935, "mcc": 0.8301, "accuracy": 0.9138, "tp": 23, "fp": 4, "tn": 30, "fn": 1}, {"fold": "fold_7", "regime": "Recent mixed/upturn", "sharpe": 16.2535, "sortino": 107.1227, "return_pct": 15.6, "equity": 1156.01, "max_dd": 0.15, "win_rate": 81.67, "profit_factor": 26.03, "ic": 0.855, "hit": 81.67, "n": 60, "precision": 0.8, "recall": 0.875, "f1": 0.8358, "f2": 0.8589, "mcc": 0.6325, "accuracy": 0.8167, "tp": 28, "fp": 7, "tn": 21, "fn": 4}], "train_sharpe": 10.2494, "train_psr": 1.0, "train_equity": 447534.84, "train_sortino": 216.5501, "train_return_pct": 44653.48, "train_max_dd": 0.17, "train_win_rate": 94.84, "train_profit_factor": 209.356, "train_ic": 0.9868, "train_hit": 94.36, "train_precision": 0.9422, "train_recall": 0.9554, "train_f1": 0.9488, "train_f2": 0.9527, "train_mcc": 0.8928, "train_accuracy": 0.9465, "train_per_window": [{"fold": "all_train", "regime": "Training data", "sharpe": 10.2494, "sortino": 216.5501, "return_pct": 44653.48, "equity": 447534.84, "max_dd": 0.17, "win_rate": 94.84, "profit_factor": 209.356, "ic": 0.9868, "hit": 94.36, "n": 1382, "precision": 0.9422, "recall": 0.9554, "f1": 0.9488, "f2": 0.9527, "mcc": 0.8928, "accuracy": 0.9465, "tp": 685, "fp": 42, "tn": 623, "fn": 32}], "experiment_num": 203, "status": "KEEP"}
{"backbone": "lightgbm", "description": "lgbm: Exp1 SOTA baseline (Ke 2017)", "config": {"seq_len": 10, "lr": 0.0003, "batch_size": 32, "epochs": 20, "weight_decay": 1e-05, "patience": 5, "grad_clip": 1.0, "warmup_epochs": 0, "huber_delta": 1.0, "head_dropout": 0.1, "seed": 42, "het_loss": false}, "composite": 7.4954, "test_pos_folds": 6, "val_pos_folds": 6, "val_loss": 0.0, "elapsed_sec": 39.9, "timestamp": "2026-04-21T07:00:21", "sharpe": 7.7533, "psr": 1.0, "equity": 18057.9, "sortino": 7.7852, "return_pct": 1705.79, "max_dd": 7.74, "win_rate": 78.33, "profit_factor": 4.611, "ic": 0.6442, "hit": 78.01, "precision": 0.8078, "recall": 0.7339, "f1": 0.7691, "f2": 0.7476, "mcc": 0.5661, "accuracy": 0.7821, "per_window": [{"fold": "fold_1", "regime": "Pre-crisis upturn + GFC onset", "sharpe": -0.6861, "sortino": -0.8061, "return_pct": -5.84, "equity": 941.58, "max_dd": 7.74, "win_rate": 46.08, "profit_factor": 0.85, "ic": 0.024, "hit": 45.63, "n": 103, "precision": 0.4545, "recall": 0.1887, "f1": 0.2667, "f2": 0.2137, "mcc": -0.0626, "accuracy": 0.466, "tp": 10, "fp": 12, "tn": 38, "fn": 43}, {"fold": "fold_2", "regime": "Post-crash recovery", "sharpe": 1.9799, "sortino": 3.5455, "return_pct": 9.59, "equity": 1095.93, "max_dd": 3.43, "win_rate": 53.27, "profit_factor": 1.364, "ic": -0.0184, "hit": 53.27, "n": 107, "precision": 0.5128, "recall": 0.3922, "f1": 0.4444, "f2": 0.4115, "mcc": 0.0549, "accuracy": 0.5327, "tp": 20, "fp": 19, "tn": 37, "fn": 31}, {"fold": "fold_3", "regime": "Eurozone debt plateau", "sharpe": 14.0785, "sortino": 21.5449, "return_pct": 45.12, "equity": 1451.24, "max_dd": 1.38, "win_rate": 86.54, "profit_factor": 10.539, "ic": 0.8061, "hit": 84.91, "n": 106, "precision": 0.902, "recall": 0.807, "f1": 0.8519, "f2": 0.8244, "mcc": 0.7035, "accuracy": 0.8491, "tp": 46, "fp": 5, "tn": 44, "fn": 11}, {"fold": "fold_4", "regime": "Strong USD downturn", "sharpe": 14.3402, "sortino": 29.7976, "return_pct": 127.85, "equity": 2278.55, "max_dd": 0.97, "win_rate": 90.42, "profit_factor": 17.81, "ic": 0.883, "hit": 89.88, "n": 168, "precision": 0.9167, "recall": 0.8953, "f1": 0.9059, "f2": 0.8995, "mcc": 0.8098, "accuracy": 0.9048, "tp": 77, "fp": 7, "tn": 75, "fn": 9}, {"fold": "fold_5", "regime": "Low-vol plateau", "sharpe": 15.5098, "sortino": 74.0256, "return_pct": 44.62, "equity": 1446.18, "max_dd": 0.23, "win_rate": 84.57, "profit_factor": 24.859, "ic": 0.9022, "hit": 84.57, "n": 162, "precision": 0.8228, "recall": 0.8553, "f1": 0.8387, "f2": 0.8486, "mcc": 0.6914, "accuracy": 0.8457, "tp": 65, "fp": 14, "tn": 72, "fn": 11}, {"fold": "fold_6", "regime": "EUR crisis downturn", "sharpe": 15.181, "sortino": 62.6508, "return_pct": 98.98, "equity": 1989.78, "max_dd": 0.43, "win_rate": 81.21, "profit_factor": 16.607, "ic": 0.8586, "hit": 81.21, "n": 165, "precision": 0.8026, "recall": 0.7922, "f1": 0.7974, "f2": 0.7943, "mcc": 0.6223, "accuracy": 0.8121, "tp": 61, "fp": 15, "tn": 73, "fn": 16}, {"fold": "fold_7", "regime": "Recent mixed/upturn", "sharpe": 13.4548, "sortino": 16.797, "return_pct": 83.91, "equity": 1839.08, "max_dd": 1.64, "win_rate": 88.27, "profit_factor": 14.033, "ic": 0.8075, "hit": 88.27, "n": 162, "precision": 0.8605, "recall": 0.9136, "f1": 0.8862, "f2": 0.9024, "mcc": 0.7669, "accuracy": 0.8827, "tp": 74, "fp": 12, "tn": 69, "fn": 7}], "val_sharpe": 7.6954, "val_psr": 1.0, "val_equity": 5131.71, "val_sortino": 9.6572, "val_return_pct": 413.17, "val_max_dd": 14.42, "val_win_rate": 74.05, "val_profit_factor": 3.819, "val_ic": 0.6367, "val_hit": 73.57, "val_precision": 0.6871, "val_recall": 0.8301, "val_f1": 0.7519, "val_f2": 0.7969, "val_mcc": 0.4926, "val_accuracy": 0.7396, "val_per_window": [{"fold": "fold_1", "regime": "Pre-crisis upturn + GFC onset", "sharpe": 0.545, "sortino": 0.9876, "return_pct": 1.31, "equity": 1013.1, "max_dd": 2.88, "win_rate": 43.52, "profit_factor": 1.095, "ic": -0.1155, "hit": 43.12, "n": 109, "precision": 0.4615, "recall": 0.7636, "f1": 0.5753, "f2": 0.6752, "mcc": -0.1936, "accuracy": 0.4312, "tp": 42, "fp": 49, "tn": 5, "fn": 13}, {"fold": "fold_2", "regime": "Post-crash recovery", "sharpe": -1.6092, "sortino": -2.4267, "return_pct": -7.73, "equity": 922.66, "max_dd": 14.42, "win_rate": 48.15, "profit_factor": 0.776, "ic": -0.1488, "hit": 48.15, "n": 108, "precision": 0.5522, "recall": 0.5873, "f1": 0.5692, "f2": 0.5799, "mcc": -0.0806, "accuracy": 0.4815, "tp": 37, "fp": 30, "tn": 15, "fn": 26}, {"fold": "fold_3", "regime": "Eurozone debt plateau", "sharpe": 15.2385, "sortino": 41.4383, "return_pct": 55.71, "equity": 1557.15, "max_dd": 0.64, "win_rate": 85.32, "profit_factor": 17.467, "ic": 0.844, "hit": 83.78, "n": 111, "precision": 0.7679, "recall": 0.9149, "f1": 0.835, "f2": 0.8811, "mcc": 0.7034, "accuracy": 0.8468, "tp": 43, "fp": 13, "tn": 51, "fn": 4}, {"fold": "fold_4", "regime": "Strong USD downturn", "sharpe": 15.7309, "sortino": 48.7482, "return_pct": 47.26, "equity": 1472.58, "max_dd": 0.59, "win_rate": 88.07, "profit_factor": 25.302, "ic": 0.9147, "hit": 87.27, "n": 110, "precision": 0.8542, "recall": 0.8723, "f1": 0.8632, "f2": 0.8686, "mcc": 0.7593, "accuracy": 0.8818, "tp": 41, "fp": 7, "tn": 56, "fn": 6}, {"fold": "fold_5", "regime": "Low-vol plateau", "sharpe": 14.9444, "sortino": 68.1615, "return_pct": 43.62, "equity": 1436.19, "max_dd": 0.3, "win_rate": 83.93, "profit_factor": 19.815, "ic": 0.9036, "hit": 83.93, "n": 112, "precision": 0.807, "recall": 0.8679, "f1": 0.8364, "f2": 0.855, "mcc": 0.6806, "accuracy": 0.8393, "tp": 46, "fp": 11, "tn": 48, "fn": 7}, {"fold": "fold_6", "regime": "EUR crisis downturn", "sharpe": 15.0507, "sortino": 64.2422, "return_pct": 28.34, "equity": 1283.44, "max_dd": 0.25, "win_rate": 85.05, "profit_factor": 23.618, "ic": 0.9097, "hit": 84.26, "n": 108, "precision": 0.7818, "recall": 0.9149, "f1": 0.8431, "f2": 0.8848, "mcc": 0.7122, "accuracy": 0.8519, "tp": 43, "fp": 12, "tn": 49, "fn": 4}, {"fold": "fold_7", "regime": "Recent mixed/upturn", "sharpe": 15.0546, "sortino": 56.4575, "return_pct": 29.89, "equity": 1298.89, "max_dd": 0.34, "win_rate": 83.64, "profit_factor": 15.355, "ic": 0.8745, "hit": 83.64, "n": 110, "precision": 0.7612, "recall": 0.9623, "f1": 0.85, "f2": 0.914, "mcc": 0.6979, "accuracy": 0.8364, "tp": 51, "fp": 16, "tn": 41, "fn": 2}], "train_sharpe": 11.1314, "train_psr": 1.0, "train_equity": 66958728.0, "train_sortino": 277.7088, "train_return_pct": 6695772.8, "train_max_dd": 0.12, "train_win_rate": 96.76, "train_profit_factor": 447.96, "train_ic": 0.9925, "train_hit": 96.37, "train_precision": 0.9583, "train_recall": 0.9741, "train_f1": 0.9661, "train_f2": 0.9709, "train_mcc": 0.9298, "train_accuracy": 0.9649, "train_per_window": [{"fold": "all_train", "regime": "Training data", "sharpe": 11.1314, "sortino": 277.7088, "return_pct": 6695772.8, "equity": 66958728.0, "max_dd": 0.12, "win_rate": 96.76, "profit_factor": 447.96, "ic": 0.9925, "hit": 96.37, "n": 2478, "precision": 0.9583, "recall": 0.9741, "f1": 0.9661, "f2": 0.9709, "mcc": 0.9298, "accuracy": 0.9649, "tp": 1241, "fp": 54, "tn": 1150, "fn": 33}], "experiment_num": 204, "status": "DISCARD"}
