{"backbone": "lfm2-350m", "description": "lfm2: H-Exp28 plain-Huber seed=99 (final seed)", "config": {"seq_len": 60, "lr": 2e-05, "batch_size": 32, "epochs": 20, "weight_decay": 1e-05, "patience": 5, "grad_clip": 1.0, "warmup_epochs": 0, "huber_delta": 1.0, "head_dropout": 0.1, "seed": 99, "het_loss": false}, "composite": 0.6779, "test_pos_folds": 6, "val_pos_folds": 5, "val_loss": 0.001112, "elapsed_sec": 259.6, "timestamp": "2026-04-12T14:12:38", "sharpe": 1.3962, "psr": 0.9853, "equity": 1368.66, "sortino": 2.0855, "return_pct": 36.87, "max_dd": 8.67, "win_rate": 53.96, "profit_factor": 1.264, "ic": 0.1151, "hit": 53.61, "aleatoric_mean": 0.001453, "epistemic_mean": 0.002905, "confidence_mean": 0.9957, "per_window": [{"fold": "fold_1", "regime": "Pre-crisis upturn + GFC onset", "sharpe": -1.1729, "sortino": -2.0346, "return_pct": -2.55, "equity": 974.52, "max_dd": 5.3, "win_rate": 48.08, "profit_factor": 0.835, "ic": -0.0572, "hit": 47.17, "n": 53, "aleatoric_mean": 0.001341, "epistemic_mean": 0.002681, "confidence_mean": 0.996, "aleatoric_std": 0.000531, "epistemic_std": 0.001062}, {"fold": "fold_2", "regime": "Post-crash recovery", "sharpe": 0.2199, "sortino": 0.3543, "return_pct": 0.45, "equity": 1004.49, "max_dd": 6.23, "win_rate": 52.63, "profit_factor": 1.036, "ic": -0.0915, "hit": 52.63, "n": 57, "aleatoric_mean": 0.001619, "epistemic_mean": 0.003239, "confidence_mean": 0.9952, "aleatoric_std": 0.000535, "epistemic_std": 0.001069}, {"fold": "fold_3", "regime": "Eurozone debt plateau", "sharpe": 2.7403, "sortino": 3.9069, "return_pct": 4.83, "equity": 1048.33, "max_dd": 3.4, "win_rate": 59.26, "profit_factor": 1.548, "ic": 0.2259, "hit": 57.14, "n": 56, "aleatoric_mean": 0.001452, "epistemic_mean": 0.002903, "confidence_mean": 0.9957, "aleatoric_std": 0.000528, "epistemic_std": 0.001056}, {"fold": "fold_4", "regime": "Strong USD downturn", "sharpe": 0.5649, "sortino": 0.801, "return_pct": 2.62, "equity": 1026.16, "max_dd": 6.94, "win_rate": 47.01, "profit_factor": 1.099, "ic": 0.1309, "hit": 46.61, "n": 118, "aleatoric_mean": 0.001445, "epistemic_mean": 0.002889, "confidence_mean": 0.9957, "aleatoric_std": 0.000566, "epistemic_std": 0.001133}, {"fold": "fold_5", "regime": "Low-vol plateau", "sharpe": 1.174, "sortino": 1.8806, "return_pct": 2.61, "equity": 1026.15, "max_dd": 2.52, "win_rate": 55.36, "profit_factor": 1.216, "ic": -0.0473, "hit": 55.36, "n": 112, "aleatoric_mean": 0.001519, "epistemic_mean": 0.003038, "confidence_mean": 0.9955, "aleatoric_std": 0.000568, "epistemic_std": 0.001136}, {"fold": "fold_6", "regime": "EUR crisis downturn", "sharpe": 2.8612, "sortino": 4.6127, "return_pct": 13.28, "equity": 1132.76, "max_dd": 5.15, "win_rate": 58.26, "profit_factor": 1.573, "ic": 0.2589, "hit": 58.26, "n": 115, "aleatoric_mean": 0.001513, "epistemic_mean": 0.003025, "confidence_mean": 0.9955, "aleatoric_std": 0.000667, "epistemic_std": 0.001334}, {"fold": "fold_7", "regime": "Recent mixed/upturn", "sharpe": 2.7879, "sortino": 4.9557, "return_pct": 11.81, "equity": 1118.14, "max_dd": 3.84, "win_rate": 56.25, "profit_factor": 1.615, "ic": 0.2865, "hit": 56.25, "n": 112, "aleatoric_mean": 0.001302, "epistemic_mean": 0.002605, "confidence_mean": 0.9961, "aleatoric_std": 0.000508, "epistemic_std": 0.001016}], "val_sharpe": 0.9779, "val_psr": 0.8975, "val_equity": 1124.7, "val_sortino": 1.6066, "val_return_pct": 12.47, "val_max_dd": 5.2, "val_win_rate": 51.68, "val_profit_factor": 1.177, "val_ic": 0.0002, "val_hit": 51.44, "val_aleatoric_mean": 0.001342, "val_epistemic_mean": 0.002684, "val_confidence_mean": 0.996, "val_per_window": [{"fold": "fold_1", "regime": "Pre-crisis upturn + GFC onset", "sharpe": 1.2826, "sortino": 1.8441, "return_pct": 1.99, "equity": 1019.93, "max_dd": 4.13, "win_rate": 58.62, "profit_factor": 1.235, "ic": 0.0199, "hit": 57.63, "n": 59, "aleatoric_mean": 0.001388, "epistemic_mean": 0.002776, "confidence_mean": 0.9959, "aleatoric_std": 0.000515, "epistemic_std": 0.00103}, {"fold": "fold_2", "regime": "Post-crash recovery", "sharpe": -1.1759, "sortino": -1.7999, "return_pct": -2.36, "equity": 976.44, "max_dd": 5.2, "win_rate": 44.83, "profit_factor": 0.827, "ic": -0.1685, "hit": 44.83, "n": 58, "aleatoric_mean": 0.001478, "epistemic_mean": 0.002956, "confidence_mean": 0.9956, "aleatoric_std": 0.000587, "epistemic_std": 0.001173}, {"fold": "fold_3", "regime": "Eurozone debt plateau", "sharpe": 3.0873, "sortino": 6.4555, "return_pct": 7.3, "equity": 1073.02, "max_dd": 2.73, "win_rate": 52.46, "profit_factor": 1.676, "ic": -0.0135, "hit": 52.46, "n": 61, "aleatoric_mean": 0.001325, "epistemic_mean": 0.00265, "confidence_mean": 0.996, "aleatoric_std": 0.000543, "epistemic_std": 0.001087}, {"fold": "fold_4", "regime": "Strong USD downturn", "sharpe": 1.9581, "sortino": 3.5749, "return_pct": 4.24, "equity": 1042.43, "max_dd": 2.61, "win_rate": 53.33, "profit_factor": 1.35, "ic": 0.1264, "hit": 53.33, "n": 60, "aleatoric_mean": 0.001294, "epistemic_mean": 0.002588, "confidence_mean": 0.9961, "aleatoric_std": 0.000533, "epistemic_std": 0.001066}, {"fold": "fold_5", "regime": "Low-vol plateau", "sharpe": -1.6357, "sortino": -2.5175, "return_pct": -2.85, "equity": 971.53, "max_dd": 4.0, "win_rate": 43.55, "profit_factor": 0.767, "ic": -0.1923, "hit": 43.55, "n": 62, "aleatoric_mean": 0.001379, "epistemic_mean": 0.002758, "confidence_mean": 0.9959, "aleatoric_std": 0.00059, "epistemic_std": 0.00118}, {"fold": "fold_6", "regime": "EUR crisis downturn", "sharpe": 2.2207, "sortino": 4.1347, "return_pct": 2.3, "equity": 1022.97, "max_dd": 1.19, "win_rate": 56.14, "profit_factor": 1.44, "ic": 0.1259, "hit": 55.17, "n": 58, "aleatoric_mean": 0.001079, "epistemic_mean": 0.002158, "confidence_mean": 0.9968, "aleatoric_std": 0.000366, "epistemic_std": 0.000733}, {"fold": "fold_7", "regime": "Recent mixed/upturn", "sharpe": 1.2627, "sortino": 2.2565, "return_pct": 1.59, "equity": 1015.89, "max_dd": 1.4, "win_rate": 53.33, "profit_factor": 1.229, "ic": 0.0692, "hit": 53.33, "n": 60, "aleatoric_mean": 0.001447, "epistemic_mean": 0.002893, "confidence_mean": 0.9957, "aleatoric_std": 0.000536, "epistemic_std": 0.001072}], "train_sharpe": 2.5877, "train_psr": 1.0, "train_equity": 5925.84, "train_sortino": 6.0835, "train_return_pct": 492.58, "train_max_dd": 5.03, "train_win_rate": 59.2, "train_profit_factor": 1.832, "train_ic": 0.1954, "train_hit": 58.9, "train_per_window": [{"fold": "all_train", "regime": "Training data", "sharpe": 2.5877, "sortino": 6.0835, "return_pct": 492.58, "equity": 5925.84, "max_dd": 5.03, "win_rate": 59.2, "profit_factor": 1.832, "ic": 0.1954, "hit": 58.9, "n": 1382}], "experiment_num": 50, "status": "DISCARD"}
{"backbone": "mlp", "description": "mlp: Exp1 baseline lr=3e-4 seed=42", "config": {"seq_len": 10, "lr": 0.0003, "batch_size": 32, "epochs": 20, "weight_decay": 1e-05, "patience": 5, "grad_clip": 1.0, "warmup_epochs": 0, "huber_delta": 1.0, "head_dropout": 0.1, "seed": 42, "het_loss": false}, "composite": -0.5088, "test_pos_folds": 6, "val_pos_folds": 4, "val_loss": 6.3e-05, "elapsed_sec": 11.4, "timestamp": "2026-04-12T17:24:10", "sharpe": 0.9254, "psr": 0.9726, "equity": 1439.41, "sortino": 1.5325, "return_pct": 43.94, "max_dd": 11.84, "win_rate": 53.04, "profit_factor": 1.187, "ic": 0.067, "hit": 52.83, "aleatoric_mean": 0.000218, "epistemic_mean": 0.000436, "confidence_mean": 0.9993, "per_window": [{"fold": "fold_1", "regime": "Pre-crisis upturn + GFC onset", "sharpe": 2.0207, "sortino": 6.2786, "return_pct": 15.9, "equity": 1159.02, "max_dd": 5.71, "win_rate": 49.02, "profit_factor": 1.62, "ic": 0.0119, "hit": 48.54, "n": 103, "aleatoric_mean": 0.000239, "epistemic_mean": 0.000478, "confidence_mean": 0.9993, "aleatoric_std": 8.5e-05, "epistemic_std": 0.000171}, {"fold": "fold_2", "regime": "Post-crash recovery", "sharpe": 0.921, "sortino": 1.5992, "return_pct": 4.23, "equity": 1042.29, "max_dd": 4.06, "win_rate": 50.47, "profit_factor": 1.155, "ic": 0.148, "hit": 50.47, "n": 107, "aleatoric_mean": 0.000229, "epistemic_mean": 0.000457, "confidence_mean": 0.9993, "aleatoric_std": 7.6e-05, "epistemic_std": 0.000152}, {"fold": "fold_3", "regime": "Eurozone debt plateau", "sharpe": 1.7155, "sortino": 3.0657, "return_pct": 6.08, "equity": 1060.83, "max_dd": 4.32, "win_rate": 56.73, "profit_factor": 1.309, "ic": 0.1306, "hit": 55.66, "n": 106, "aleatoric_mean": 0.000224, "epistemic_mean": 0.000447, "confidence_mean": 0.9993, "aleatoric_std": 7.1e-05, "epistemic_std": 0.000142}, {"fold": "fold_4", "regime": "Strong USD downturn", "sharpe": -1.1806, "sortino": -1.5585, "return_pct": -9.17, "equity": 908.31, "max_dd": 11.84, "win_rate": 50.9, "profit_factor": 0.82, "ic": 0.0047, "hit": 50.6, "n": 168, "aleatoric_mean": 0.000237, "epistemic_mean": 0.000475, "confidence_mean": 0.9993, "aleatoric_std": 7.4e-05, "epistemic_std": 0.000148}, {"fold": "fold_5", "regime": "Low-vol plateau", "sharpe": 0.3725, "sortino": 0.5449, "return_pct": 1.16, "equity": 1011.62, "max_dd": 5.65, "win_rate": 53.7, "profit_factor": 1.064, "ic": 0.0793, "hit": 53.7, "n": 162, "aleatoric_mean": 0.000178, "epistemic_mean": 0.000357, "confidence_mean": 0.9995, "aleatoric_std": 5.9e-05, "epistemic_std": 0.000117}, {"fold": "fold_6", "regime": "EUR crisis downturn", "sharpe": 2.5154, "sortino": 4.2203, "return_pct": 16.59, "equity": 1165.86, "max_dd": 5.45, "win_rate": 55.15, "profit_factor": 1.502, "ic": 0.1406, "hit": 55.15, "n": 165, "aleatoric_mean": 0.000253, "epistemic_mean": 0.000507, "confidence_mean": 0.9992, "aleatoric_std": 9.8e-05, "epistemic_std": 0.000197}, {"fold": "fold_7", "regime": "Recent mixed/upturn", "sharpe": 0.8417, "sortino": 1.1851, "return_pct": 4.85, "equity": 1048.49, "max_dd": 8.26, "win_rate": 54.32, "profit_factor": 1.153, "ic": 0.0731, "hit": 54.32, "n": 162, "aleatoric_mean": 0.000178, "epistemic_mean": 0.000357, "confidence_mean": 0.9995, "aleatoric_std": 6.2e-05, "epistemic_std": 0.000125}], "val_sharpe": -0.1088, "val_psr": 0.4247, "val_equity": 965.51, "val_sortino": -0.1667, "val_return_pct": -3.45, "val_max_dd": 14.53, "val_win_rate": 49.28, "val_profit_factor": 0.982, "val_ic": 0.0139, "val_hit": 48.96, "val_aleatoric_mean": 0.000189, "val_epistemic_mean": 0.000379, "val_confidence_mean": 0.9994, "val_per_window": [{"fold": "fold_1", "regime": "Pre-crisis upturn + GFC onset", "sharpe": -0.7649, "sortino": -1.1124, "return_pct": -1.98, "equity": 980.17, "max_dd": 4.8, "win_rate": 49.07, "profit_factor": 0.881, "ic": -0.0002, "hit": 48.62, "n": 109, "aleatoric_mean": 0.000186, "epistemic_mean": 0.000371, "confidence_mean": 0.9994, "aleatoric_std": 7.5e-05, "epistemic_std": 0.00015}, {"fold": "fold_2", "regime": "Post-crash recovery", "sharpe": -1.5283, "sortino": -2.6319, "return_pct": -7.38, "equity": 926.24, "max_dd": 10.06, "win_rate": 46.3, "profit_factor": 0.786, "ic": -0.099, "hit": 46.3, "n": 108, "aleatoric_mean": 0.000211, "epistemic_mean": 0.000422, "confidence_mean": 0.9994, "aleatoric_std": 7.2e-05, "epistemic_std": 0.000143}, {"fold": "fold_3", "regime": "Eurozone debt plateau", "sharpe": 0.0567, "sortino": 0.0893, "return_pct": 0.04, "equity": 1000.44, "max_dd": 6.54, "win_rate": 51.38, "profit_factor": 1.009, "ic": 0.0709, "hit": 50.45, "n": 111, "aleatoric_mean": 0.000205, "epistemic_mean": 0.00041, "confidence_mean": 0.9994, "aleatoric_std": 6.8e-05, "epistemic_std": 0.000136}, {"fold": "fold_4", "regime": "Strong USD downturn", "sharpe": 0.5172, "sortino": 0.9488, "return_pct": 1.67, "equity": 1016.73, "max_dd": 3.88, "win_rate": 47.71, "profit_factor": 1.089, "ic": 0.0334, "hit": 47.27, "n": 110, "aleatoric_mean": 0.000186, "epistemic_mean": 0.000373, "confidence_mean": 0.9994, "aleatoric_std": 6.5e-05, "epistemic_std": 0.000131}, {"fold": "fold_5", "regime": "Low-vol plateau", "sharpe": 0.8581, "sortino": 1.5031, "return_pct": 2.77, "equity": 1027.73, "max_dd": 3.58, "win_rate": 50.0, "profit_factor": 1.153, "ic": 0.0882, "hit": 50.0, "n": 112, "aleatoric_mean": 0.000195, "epistemic_mean": 0.00039, "confidence_mean": 0.9994, "aleatoric_std": 7.1e-05, "epistemic_std": 0.000141}, {"fold": "fold_6", "regime": "EUR crisis downturn", "sharpe": -1.1436, "sortino": -1.8524, "return_pct": -2.64, "equity": 973.62, "max_dd": 4.07, "win_rate": 42.99, "profit_factor": 0.825, "ic": -0.0492, "hit": 42.59, "n": 108, "aleatoric_mean": 0.00017, "epistemic_mean": 0.000341, "confidence_mean": 0.9995, "aleatoric_std": 5.4e-05, "epistemic_std": 0.000109}, {"fold": "fold_7", "regime": "Recent mixed/upturn", "sharpe": 1.8699, "sortino": 2.5419, "return_pct": 4.49, "equity": 1044.89, "max_dd": 2.9, "win_rate": 57.27, "profit_factor": 1.351, "ic": 0.19, "hit": 57.27, "n": 110, "aleatoric_mean": 0.000172, "epistemic_mean": 0.000343, "confidence_mean": 0.9995, "aleatoric_std": 5.8e-05, "epistemic_std": 0.000117}], "train_sharpe": 3.3016, "train_psr": 1.0, "train_equity": 49080.77, "train_sortino": 7.5576, "train_return_pct": 4808.08, "train_max_dd": 6.72, "train_win_rate": 59.64, "train_profit_factor": 2.092, "train_ic": 0.3062, "train_hit": 59.4, "train_per_window": [{"fold": "all_train", "regime": "Training data", "sharpe": 3.3016, "sortino": 7.5576, "return_pct": 4808.08, "equity": 49080.77, "max_dd": 6.72, "win_rate": 59.64, "profit_factor": 2.092, "ic": 0.3062, "hit": 59.4, "n": 2478}], "experiment_num": 51, "status": "KEEP"}
{"backbone": "mlp", "description": "mlp: lr=1e-4 seed=0", "config": {"seq_len": 10, "lr": 0.0001, "batch_size": 32, "epochs": 20, "weight_decay": 1e-05, "patience": 5, "grad_clip": 1.0, "warmup_epochs": 0, "huber_delta": 1.0, "head_dropout": 0.1, "seed": 0, "het_loss": false}, "composite": 0.507, "test_pos_folds": 5, "val_pos_folds": 5, "val_loss": 0.000164, "elapsed_sec": 7.0, "timestamp": "2026-04-12T17:24:35", "sharpe": 0.9117, "psr": 0.9606, "equity": 1430.85, "sortino": 1.2419, "return_pct": 43.09, "max_dd": 14.01, "win_rate": 52.53, "profit_factor": 1.184, "ic": 0.061, "hit": 52.31, "aleatoric_mean": 0.000531, "epistemic_mean": 0.001061, "confidence_mean": 0.9984, "per_window": [{"fold": "fold_1", "regime": "Pre-crisis upturn + GFC onset", "sharpe": -0.1768, "sortino": -0.1883, "return_pct": -2.07, "equity": 979.25, "max_dd": 9.69, "win_rate": 54.9, "profit_factor": 0.959, "ic": -0.0211, "hit": 54.37, "n": 103, "aleatoric_mean": 0.000745, "epistemic_mean": 0.00149, "confidence_mean": 0.9978, "aleatoric_std": 0.000316, "epistemic_std": 0.000632}, {"fold": "fold_2", "regime": "Post-crash recovery", "sharpe": 0.8175, "sortino": 1.4008, "return_pct": 3.72, "equity": 1037.15, "max_dd": 7.12, "win_rate": 52.34, "profit_factor": 1.137, "ic": 0.0816, "hit": 52.34, "n": 107, "aleatoric_mean": 0.000476, "epistemic_mean": 0.000952, "confidence_mean": 0.9986, "aleatoric_std": 0.000177, "epistemic_std": 0.000353}, {"fold": "fold_3", "regime": "Eurozone debt plateau", "sharpe": 0.5394, "sortino": 0.9343, "return_pct": 1.78, "equity": 1017.8, "max_dd": 6.09, "win_rate": 51.92, "profit_factor": 1.088, "ic": 0.0404, "hit": 50.94, "n": 106, "aleatoric_mean": 0.000577, "epistemic_mean": 0.001153, "confidence_mean": 0.9983, "aleatoric_std": 0.00018, "epistemic_std": 0.00036}, {"fold": "fold_4", "regime": "Strong USD downturn", "sharpe": -0.2286, "sortino": -0.3545, "return_pct": -2.21, "equity": 977.92, "max_dd": 11.74, "win_rate": 47.31, "profit_factor": 0.962, "ic": -0.0549, "hit": 47.02, "n": 168, "aleatoric_mean": 0.000534, "epistemic_mean": 0.001068, "confidence_mean": 0.9984, "aleatoric_std": 0.000189, "epistemic_std": 0.000378}, {"fold": "fold_5", "regime": "Low-vol plateau", "sharpe": 1.1701, "sortino": 2.0108, "return_pct": 3.88, "equity": 1038.77, "max_dd": 2.0, "win_rate": 52.47, "profit_factor": 1.215, "ic": 0.0523, "hit": 52.47, "n": 162, "aleatoric_mean": 0.000417, "epistemic_mean": 0.000834, "confidence_mean": 0.9988, "aleatoric_std": 0.000156, "epistemic_std": 0.000313}, {"fold": "fold_6", "regime": "EUR crisis downturn", "sharpe": 2.5781, "sortino": 4.9294, "return_pct": 17.03, "equity": 1170.3, "max_dd": 3.33, "win_rate": 55.15, "profit_factor": 1.518, "ic": 0.1262, "hit": 55.15, "n": 165, "aleatoric_mean": 0.000613, "epistemic_mean": 0.001226, "confidence_mean": 0.9982, "aleatoric_std": 0.000304, "epistemic_std": 0.000609}, {"fold": "fold_7", "regime": "Recent mixed/upturn", "sharpe": 2.6335, "sortino": 5.437, "return_pct": 16.43, "equity": 1164.34, "max_dd": 2.46, "win_rate": 54.32, "profit_factor": 1.562, "ic": 0.1063, "hit": 54.32, "n": 162, "aleatoric_mean": 0.000427, "epistemic_mean": 0.000855, "confidence_mean": 0.9987, "aleatoric_std": 0.000139, "epistemic_std": 0.000279}], "val_sharpe": 0.907, "val_psr": 0.9419, "val_equity": 1228.51, "val_sortino": 1.3041, "val_return_pct": 22.85, "val_max_dd": 8.53, "val_win_rate": 53.87, "val_profit_factor": 1.166, "val_ic": 0.0664, "val_hit": 53.52, "val_aleatoric_mean": 0.000443, "val_epistemic_mean": 0.000886, "val_confidence_mean": 0.9987, "val_per_window": [{"fold": "fold_1", "regime": "Pre-crisis upturn + GFC onset", "sharpe": 1.7636, "sortino": 3.2992, "return_pct": 4.45, "equity": 1044.49, "max_dd": 2.27, "win_rate": 49.07, "profit_factor": 1.34, "ic": 0.0278, "hit": 48.62, "n": 109, "aleatoric_mean": 0.000451, "epistemic_mean": 0.000902, "confidence_mean": 0.9986, "aleatoric_std": 0.00019, "epistemic_std": 0.00038}, {"fold": "fold_2", "regime": "Post-crash recovery", "sharpe": 0.5708, "sortino": 0.9716, "return_pct": 2.53, "equity": 1025.26, "max_dd": 4.59, "win_rate": 50.0, "profit_factor": 1.094, "ic": 0.0418, "hit": 50.0, "n": 108, "aleatoric_mean": 0.000523, "epistemic_mean": 0.001046, "confidence_mean": 0.9984, "aleatoric_std": 0.000201, "epistemic_std": 0.000402}, {"fold": "fold_3", "regime": "Eurozone debt plateau", "sharpe": -0.5751, "sortino": -0.8085, "return_pct": -2.48, "equity": 975.2, "max_dd": 5.25, "win_rate": 52.29, "profit_factor": 0.911, "ic": 0.0161, "hit": 51.35, "n": 111, "aleatoric_mean": 0.000465, "epistemic_mean": 0.00093, "confidence_mean": 0.9986, "aleatoric_std": 0.000181, "epistemic_std": 0.000361}, {"fold": "fold_4", "regime": "Strong USD downturn", "sharpe": 0.8681, "sortino": 1.3737, "return_pct": 2.92, "equity": 1029.16, "max_dd": 4.12, "win_rate": 55.05, "profit_factor": 1.154, "ic": 0.1203, "hit": 54.55, "n": 110, "aleatoric_mean": 0.000423, "epistemic_mean": 0.000847, "confidence_mean": 0.9987, "aleatoric_std": 0.000145, "epistemic_std": 0.00029}, {"fold": "fold_5", "regime": "Low-vol plateau", "sharpe": 1.5004, "sortino": 2.0453, "return_pct": 4.98, "equity": 1049.81, "max_dd": 3.04, "win_rate": 55.36, "profit_factor": 1.283, "ic": 0.1591, "hit": 55.36, "n": 112, "aleatoric_mean": 0.000445, "epistemic_mean": 0.000889, "confidence_mean": 0.9987, "aleatoric_std": 0.000157, "epistemic_std": 0.000315}, {"fold": "fold_6", "regime": "EUR crisis downturn", "sharpe": -0.1156, "sortino": -0.1587, "return_pct": -0.33, "equity": 996.75, "max_dd": 2.36, "win_rate": 52.34, "profit_factor": 0.981, "ic": 0.1236, "hit": 51.85, "n": 108, "aleatoric_mean": 0.000385, "epistemic_mean": 0.00077, "confidence_mean": 0.9988, "aleatoric_std": 0.000125, "epistemic_std": 0.00025}, {"fold": "fold_7", "regime": "Recent mixed/upturn", "sharpe": 3.8137, "sortino": 5.8807, "return_pct": 9.24, "equity": 1092.36, "max_dd": 1.35, "win_rate": 62.73, "profit_factor": 1.849, "ic": 0.2189, "hit": 62.73, "n": 110, "aleatoric_mean": 0.00041, "epistemic_mean": 0.000819, "confidence_mean": 0.9988, "aleatoric_std": 0.00016, "epistemic_std": 0.000319}], "train_sharpe": 3.1742, "train_psr": 1.0, "train_equity": 42364.91, "train_sortino": 7.2977, "train_return_pct": 4136.49, "train_max_dd": 9.22, "train_win_rate": 59.0, "train_profit_factor": 2.03, "train_ic": 0.3265, "train_hit": 58.76, "train_per_window": [{"fold": "all_train", "regime": "Training data", "sharpe": 3.1742, "sortino": 7.2977, "return_pct": 4136.49, "equity": 42364.91, "max_dd": 9.22, "win_rate": 59.0, "profit_factor": 2.03, "ic": 0.3265, "hit": 58.76, "n": 2478}], "experiment_num": 52, "status": "KEEP"}
