{"backbone": "lfm2-350m", "description": "lfm2: H-Exp22 REPRODUCE champion run 2/3", "config": {"seq_len": 60, "lr": 3e-05, "batch_size": 32, "epochs": 30, "weight_decay": 1e-05, "patience": 8, "grad_clip": 1.0, "warmup_epochs": 3, "huber_delta": 1.0, "head_dropout": 0.1}, "composite": -0.5365, "test_pos_folds": 3, "val_pos_folds": 5, "val_loss": -1.609331, "elapsed_sec": 369.9, "timestamp": "2026-04-12T11:22:40", "sharpe": 0.0635, "psr": 0.5397, "equity": 1003.8, "sortino": 0.0984, "return_pct": 0.38, "max_dd": 18.15, "win_rate": 50.08, "profit_factor": 1.011, "ic": 0.03, "hit": 49.76, "aleatoric_mean": 0.092594, "epistemic_mean": 0.008344, "confidence_mean": 0.9166, "per_window": [{"fold": "fold_1", "regime": "Pre-crisis upturn + GFC onset", "sharpe": 0.8276, "sortino": 1.601, "return_pct": 1.66, "equity": 1016.56, "max_dd": 4.55, "win_rate": 50.0, "profit_factor": 1.135, "ic": 0.0955, "hit": 49.06, "n": 53, "aleatoric_mean": 0.18968, "epistemic_mean": 0.005543, "confidence_mean": 0.8428, "aleatoric_std": 0.108695, "epistemic_std": 0.002412}, {"fold": "fold_2", "regime": "Post-crash recovery", "sharpe": 0.7113, "sortino": 1.0732, "return_pct": 1.87, "equity": 1018.68, "max_dd": 7.42, "win_rate": 57.89, "profit_factor": 1.121, "ic": 0.1801, "hit": 57.89, "n": 57, "aleatoric_mean": 0.298202, "epistemic_mean": 0.005917, "confidence_mean": 0.7856, "aleatoric_std": 0.218865, "epistemic_std": 0.002303}, {"fold": "fold_3", "regime": "Eurozone debt plateau", "sharpe": -0.1277, "sortino": -0.2092, "return_pct": -0.3, "equity": 997.03, "max_dd": 3.92, "win_rate": 44.44, "profit_factor": 0.98, "ic": -0.0966, "hit": 42.86, "n": 56, "aleatoric_mean": 0.085734, "epistemic_mean": 0.007219, "confidence_mean": 0.918, "aleatoric_std": 0.068667, "epistemic_std": 0.003762}, {"fold": "fold_4", "regime": "Strong USD downturn", "sharpe": -0.8654, "sortino": -1.3093, "return_pct": -4.54, "equity": 954.6, "max_dd": 10.41, "win_rate": 47.01, "profit_factor": 0.865, "ic": 0.0371, "hit": 46.61, "n": 118, "aleatoric_mean": 0.069422, "epistemic_mean": 0.008554, "confidence_mean": 0.9316, "aleatoric_std": 0.081736, "epistemic_std": 0.004861}, {"fold": "fold_5", "regime": "Low-vol plateau", "sharpe": -1.6882, "sortino": -2.4617, "return_pct": -3.77, "equity": 962.33, "max_dd": 5.86, "win_rate": 44.64, "profit_factor": 0.755, "ic": -0.0334, "hit": 44.64, "n": 112, "aleatoric_mean": 0.026856, "epistemic_mean": 0.01104, "confidence_mean": 0.9639, "aleatoric_std": 0.022467, "epistemic_std": 0.004923}, {"fold": "fold_6", "regime": "EUR crisis downturn", "sharpe": -1.0148, "sortino": -1.6771, "return_pct": -4.67, "equity": 953.27, "max_dd": 7.23, "win_rate": 52.17, "profit_factor": 0.852, "ic": -0.0763, "hit": 52.17, "n": 115, "aleatoric_mean": 0.101731, "epistemic_mean": 0.006973, "confidence_mean": 0.906, "aleatoric_std": 0.080369, "epistemic_std": 0.003368}, {"fold": "fold_7", "regime": "Recent mixed/upturn", "sharpe": 2.6086, "sortino": 4.9931, "return_pct": 11.02, "equity": 1110.22, "max_dd": 4.22, "win_rate": 55.36, "profit_factor": 1.566, "ic": 0.0676, "hit": 55.36, "n": 112, "aleatoric_mean": 0.026211, "epistemic_mean": 0.009956, "confidence_mean": 0.9655, "aleatoric_std": 0.021827, "epistemic_std": 0.003471}], "val_sharpe": 1.1405, "val_psr": 0.9263, "val_equity": 1147.67, "val_sortino": 1.6405, "val_return_pct": 14.77, "val_max_dd": 5.13, "val_win_rate": 53.85, "val_profit_factor": 1.209, "val_ic": 0.0749, "val_hit": 53.59, "val_aleatoric_mean": 0.076802, "val_epistemic_mean": 0.008546, "val_confidence_mean": 0.9294, "val_per_window": [{"fold": "fold_1", "regime": "Pre-crisis upturn + GFC onset", "sharpe": 0.4459, "sortino": 0.7152, "return_pct": 0.66, "equity": 1006.55, "max_dd": 4.03, "win_rate": 46.55, "profit_factor": 1.076, "ic": -0.0282, "hit": 45.76, "n": 59, "aleatoric_mean": 0.227798, "epistemic_mean": 0.00609, "confidence_mean": 0.8338, "aleatoric_std": 0.224142, "epistemic_std": 0.002999}, {"fold": "fold_2", "regime": "Post-crash recovery", "sharpe": 0.5888, "sortino": 0.9356, "return_pct": 1.08, "equity": 1010.76, "max_dd": 3.39, "win_rate": 50.0, "profit_factor": 1.1, "ic": -0.0081, "hit": 50.0, "n": 58, "aleatoric_mean": 0.120474, "epistemic_mean": 0.005951, "confidence_mean": 0.8928, "aleatoric_std": 0.092021, "epistemic_std": 0.002384}, {"fold": "fold_3", "regime": "Eurozone debt plateau", "sharpe": -0.584, "sortino": -0.7149, "return_pct": -1.48, "equity": 985.16, "max_dd": 4.18, "win_rate": 59.02, "profit_factor": 0.907, "ic": 0.0974, "hit": 59.02, "n": 61, "aleatoric_mean": 0.044526, "epistemic_mean": 0.009122, "confidence_mean": 0.9504, "aleatoric_std": 0.04075, "epistemic_std": 0.00341}, {"fold": "fold_4", "regime": "Strong USD downturn", "sharpe": 4.44, "sortino": 8.7941, "return_pct": 9.71, "equity": 1097.06, "max_dd": 1.4, "win_rate": 60.0, "profit_factor": 1.976, "ic": 0.253, "hit": 60.0, "n": 60, "aleatoric_mean": 0.045541, "epistemic_mean": 0.011155, "confidence_mean": 0.9483, "aleatoric_std": 0.054144, "epistemic_std": 0.005518}, {"fold": "fold_5", "regime": "Low-vol plateau", "sharpe": 2.5049, "sortino": 3.7628, "return_pct": 4.33, "equity": 1043.28, "max_dd": 2.94, "win_rate": 59.68, "profit_factor": 1.502, "ic": 0.1282, "hit": 59.68, "n": 62, "aleatoric_mean": 0.02409, "epistemic_mean": 0.009429, "confidence_mean": 0.9679, "aleatoric_std": 0.02225, "epistemic_std": 0.003685}, {"fold": "fold_6", "regime": "EUR crisis downturn", "sharpe": -0.5814, "sortino": -0.7906, "return_pct": -0.63, "equity": 993.72, "max_dd": 1.85, "win_rate": 49.12, "profit_factor": 0.909, "ic": 0.0755, "hit": 48.28, "n": 58, "aleatoric_mean": 0.017441, "epistemic_mean": 0.010084, "confidence_mean": 0.9734, "aleatoric_std": 0.013824, "epistemic_std": 0.003304}, {"fold": "fold_7", "regime": "Recent mixed/upturn", "sharpe": 0.5545, "sortino": 0.854, "return_pct": 0.68, "equity": 1006.77, "max_dd": 3.21, "win_rate": 51.67, "profit_factor": 1.095, "ic": -0.0473, "hit": 51.67, "n": 60, "aleatoric_mean": 0.062031, "epistemic_mean": 0.007874, "confidence_mean": 0.936, "aleatoric_std": 0.042224, "epistemic_std": 0.002507}], "train_sharpe": 1.47, "train_psr": 0.9996, "train_equity": 2716.36, "train_sortino": 1.9624, "train_return_pct": 171.64, "train_max_dd": 13.35, "train_win_rate": 53.24, "train_profit_factor": 1.405, "train_ic": 0.1523, "train_hit": 52.97, "train_per_window": [{"fold": "all_train", "regime": "Training data", "sharpe": 1.47, "sortino": 1.9624, "return_pct": 171.64, "equity": 2716.36, "max_dd": 13.35, "win_rate": 53.24, "profit_factor": 1.405, "ic": 0.1523, "hit": 52.97, "n": 1382}], "experiment_num": 44, "status": "DISCARD"}
{"backbone": "lfm2-350m", "description": "lfm2: H-Exp23 champion seed=42", "config": {"seq_len": 60, "lr": 3e-05, "batch_size": 32, "epochs": 30, "weight_decay": 1e-05, "patience": 8, "grad_clip": 1.0, "warmup_epochs": 3, "huber_delta": 1.0, "head_dropout": 0.1, "seed": 42}, "composite": -1.0849, "test_pos_folds": 3, "val_pos_folds": 3, "val_loss": -1.703019, "elapsed_sec": 400.1, "timestamp": "2026-04-12T11:30:49", "sharpe": -0.2849, "psr": 0.3277, "equity": 925.38, "sortino": -0.4567, "return_pct": -7.46, "max_dd": 15.56, "win_rate": 49.92, "profit_factor": 0.953, "ic": -0.0326, "hit": 49.6, "aleatoric_mean": 0.066474, "epistemic_mean": 0.008447, "confidence_mean": 0.9338, "per_window": [{"fold": "fold_1", "regime": "Pre-crisis upturn + GFC onset", "sharpe": -0.1988, "sortino": -0.355, "return_pct": -0.53, "equity": 994.74, "max_dd": 3.8, "win_rate": 48.08, "profit_factor": 0.97, "ic": -0.141, "hit": 47.17, "n": 53, "aleatoric_mean": 0.158866, "epistemic_mean": 0.006349, "confidence_mean": 0.8633, "aleatoric_std": 0.095108, "epistemic_std": 0.002669}, {"fold": "fold_2", "regime": "Post-crash recovery", "sharpe": 0.005, "sortino": 0.0094, "return_pct": -0.17, "equity": 998.34, "max_dd": 5.84, "win_rate": 47.37, "profit_factor": 1.001, "ic": -0.0124, "hit": 47.37, "n": 57, "aleatoric_mean": 0.135966, "epistemic_mean": 0.008575, "confidence_mean": 0.8779, "aleatoric_std": 0.081204, "epistemic_std": 0.003143}, {"fold": "fold_3", "regime": "Eurozone debt plateau", "sharpe": 1.1445, "sortino": 1.9783, "return_pct": 1.97, "equity": 1019.74, "max_dd": 3.24, "win_rate": 61.11, "profit_factor": 1.2, "ic": 0.322, "hit": 58.93, "n": 56, "aleatoric_mean": 0.079516, "epistemic_mean": 0.007053, "confidence_mean": 0.922, "aleatoric_std": 0.047447, "epistemic_std": 0.003151}, {"fold": "fold_4", "regime": "Strong USD downturn", "sharpe": -0.0624, "sortino": -0.1094, "return_pct": -0.59, "equity": 994.13, "max_dd": 9.15, "win_rate": 47.01, "profit_factor": 0.99, "ic": -0.0537, "hit": 46.61, "n": 118, "aleatoric_mean": 0.058397, "epistemic_mean": 0.008507, "confidence_mean": 0.9399, "aleatoric_std": 0.060943, "epistemic_std": 0.003487}, {"fold": "fold_5", "regime": "Low-vol plateau", "sharpe": -0.1354, "sortino": -0.1902, "return_pct": -0.36, "equity": 996.38, "max_dd": 3.47, "win_rate": 53.57, "profit_factor": 0.978, "ic": -0.0721, "hit": 53.57, "n": 112, "aleatoric_mean": 0.018313, "epistemic_mean": 0.010218, "confidence_mean": 0.9725, "aleatoric_std": 0.016647, "epistemic_std": 0.004624}, {"fold": "fold_6", "regime": "EUR crisis downturn", "sharpe": -2.996, "sortino": -4.465, "return_pct": -12.62, "equity": 873.81, "max_dd": 12.06, "win_rate": 45.22, "profit_factor": 0.622, "ic": -0.1736, "hit": 45.22, "n": 115, "aleatoric_mean": 0.074762, "epistemic_mean": 0.00682, "confidence_mean": 0.9268, "aleatoric_std": 0.054938, "epistemic_std": 0.002828}, {"fold": "fold_7", "regime": "Recent mixed/upturn", "sharpe": 1.3624, "sortino": 2.4397, "return_pct": 5.57, "equity": 1055.73, "max_dd": 3.84, "win_rate": 50.89, "profit_factor": 1.263, "ic": -0.0252, "hit": 50.89, "n": 112, "aleatoric_mean": 0.029028, "epistemic_mean": 0.00991, "confidence_mean": 0.9636, "aleatoric_std": 0.03732, "epistemic_std": 0.004128}], "val_sharpe": -0.1057, "val_psr": 0.4459, "val_equity": 982.2, "val_sortino": -0.1596, "val_return_pct": -1.78, "val_max_dd": 13.49, "val_win_rate": 49.52, "val_profit_factor": 0.983, "val_ic": 0.0131, "val_hit": 49.28, "val_aleatoric_mean": 0.070801, "val_epistemic_mean": 0.008998, "val_confidence_mean": 0.9327, "val_per_window": [{"fold": "fold_1", "regime": "Pre-crisis upturn + GFC onset", "sharpe": -0.3934, "sortino": -0.5642, "return_pct": -0.68, "equity": 993.25, "max_dd": 2.77, "win_rate": 53.45, "profit_factor": 0.937, "ic": -0.0046, "hit": 52.54, "n": 59, "aleatoric_mean": 0.20653, "epistemic_mean": 0.007454, "confidence_mean": 0.8394, "aleatoric_std": 0.171766, "epistemic_std": 0.003026}, {"fold": "fold_2", "regime": "Post-crash recovery", "sharpe": 2.9226, "sortino": 5.2212, "return_pct": 5.71, "equity": 1057.13, "max_dd": 2.35, "win_rate": 55.17, "profit_factor": 1.606, "ic": 0.2537, "hit": 55.17, "n": 58, "aleatoric_mean": 0.147591, "epistemic_mean": 0.008644, "confidence_mean": 0.8671, "aleatoric_std": 0.061488, "epistemic_std": 0.004985}, {"fold": "fold_3", "regime": "Eurozone debt plateau", "sharpe": -0.8072, "sortino": -1.1506, "return_pct": -2.0, "equity": 979.99, "max_dd": 7.63, "win_rate": 50.82, "profit_factor": 0.874, "ic": 0.0732, "hit": 50.82, "n": 61, "aleatoric_mean": 0.03728, "epistemic_mean": 0.010485, "confidence_mean": 0.9552, "aleatoric_std": 0.031463, "epistemic_std": 0.004343}, {"fold": "fold_4", "regime": "Strong USD downturn", "sharpe": 2.0339, "sortino": 3.5414, "return_pct": 4.41, "equity": 1044.12, "max_dd": 2.99, "win_rate": 61.67, "profit_factor": 1.366, "ic": 0.2091, "hit": 61.67, "n": 60, "aleatoric_mean": 0.033396, "epistemic_mean": 0.007582, "confidence_mean": 0.9619, "aleatoric_std": 0.040609, "epistemic_std": 0.002839}, {"fold": "fold_5", "regime": "Low-vol plateau", "sharpe": -3.8571, "sortino": -5.4245, "return_pct": -6.36, "equity": 936.39, "max_dd": 6.53, "win_rate": 35.48, "profit_factor": 0.534, "ic": -0.1974, "hit": 35.48, "n": 62, "aleatoric_mean": 0.017119, "epistemic_mean": 0.008835, "confidence_mean": 0.9749, "aleatoric_std": 0.013437, "epistemic_std": 0.003034}, {"fold": "fold_6", "regime": "EUR crisis downturn", "sharpe": -5.921, "sortino": -7.9348, "return_pct": -5.65, "equity": 943.53, "max_dd": 5.73, "win_rate": 36.84, "profit_factor": 0.375, "ic": -0.3893, "hit": 36.21, "n": 58, "aleatoric_mean": 0.01006, "epistemic_mean": 0.008779, "confidence_mean": 0.9816, "aleatoric_std": 0.006888, "epistemic_std": 0.002904}, {"fold": "fold_7", "regime": "Recent mixed/upturn", "sharpe": 2.7347, "sortino": 5.8324, "return_pct": 3.47, "equity": 1034.73, "max_dd": 1.69, "win_rate": 53.33, "profit_factor": 1.563, "ic": -0.0103, "hit": 53.33, "n": 60, "aleatoric_mean": 0.048777, "epistemic_mean": 0.01114, "confidence_mean": 0.9447, "aleatoric_std": 0.038795, "epistemic_std": 0.003858}], "train_sharpe": 0.7191, "train_psr": 0.9119, "train_equity": 1589.71, "train_sortino": 0.633, "train_return_pct": 58.97, "train_max_dd": 29.25, "train_win_rate": 55.49, "train_profit_factor": 1.18, "train_ic": 0.1346, "train_hit": 55.21, "train_per_window": [{"fold": "all_train", "regime": "Training data", "sharpe": 0.7191, "sortino": 0.633, "return_pct": 58.97, "equity": 1589.71, "max_dd": 29.25, "win_rate": 55.49, "profit_factor": 1.18, "ic": 0.1346, "hit": 55.21, "n": 1382}], "experiment_num": 45, "status": "DISCARD"}
{"backbone": "lfm2-350m", "description": "lfm2: H-Exp24 champion seed=123", "config": {"seq_len": 60, "lr": 3e-05, "batch_size": 32, "epochs": 30, "weight_decay": 1e-05, "patience": 8, "grad_clip": 1.0, "warmup_epochs": 3, "huber_delta": 1.0, "head_dropout": 0.1, "seed": 123}, "composite": -1.1439, "test_pos_folds": 3, "val_pos_folds": 3, "val_loss": -1.570455, "elapsed_sec": 407.5, "timestamp": "2026-04-12T11:37:55", "sharpe": 0.0177, "psr": 0.5111, "equity": 993.12, "sortino": 0.0259, "return_pct": -0.69, "max_dd": 18.26, "win_rate": 50.24, "profit_factor": 1.003, "ic": 0.0486, "hit": 49.92, "aleatoric_mean": 0.087105, "epistemic_mean": 0.010046, "confidence_mean": 0.9175, "per_window": [{"fold": "fold_1", "regime": "Pre-crisis upturn + GFC onset", "sharpe": -0.8253, "sortino": -1.4682, "return_pct": -1.83, "equity": 981.67, "max_dd": 4.53, "win_rate": 50.0, "profit_factor": 0.881, "ic": 0.0659, "hit": 49.06, "n": 53, "aleatoric_mean": 0.129724, "epistemic_mean": 0.01169, "confidence_mean": 0.8799, "aleatoric_std": 0.08052, "epistemic_std": 0.004691}, {"fold": "fold_2", "regime": "Post-crash recovery", "sharpe": -2.13, "sortino": -3.3557, "return_pct": -6.03, "equity": 939.73, "max_dd": 10.95, "win_rate": 50.88, "profit_factor": 0.711, "ic": 0.024, "hit": 50.88, "n": 57, "aleatoric_mean": 0.249421, "epistemic_mean": 0.008158, "confidence_mean": 0.8099, "aleatoric_std": 0.190446, "epistemic_std": 0.00419}, {"fold": "fold_3", "regime": "Eurozone debt plateau", "sharpe": 1.6923, "sortino": 2.861, "return_pct": 2.96, "equity": 1029.58, "max_dd": 4.17, "win_rate": 46.3, "profit_factor": 1.31, "ic": 0.2273, "hit": 44.64, "n": 56, "aleatoric_mean": 0.093867, "epistemic_mean": 0.009977, "confidence_mean": 0.9084, "aleatoric_std": 0.062428, "epistemic_std": 0.00476}, {"fold": "fold_4", "regime": "Strong USD downturn", "sharpe": -1.5718, "sortino": -2.1446, "return_pct": -7.86, "equity": 921.37, "max_dd": 11.1, "win_rate": 47.86, "profit_factor": 0.768, "ic": -0.1443, "hit": 47.46, "n": 118, "aleatoric_mean": 0.069275, "epistemic_mean": 0.009047, "confidence_mean": 0.9307, "aleatoric_std": 0.075888, "epistemic_std": 0.00368}, {"fold": "fold_5", "regime": "Low-vol plateau", "sharpe": -1.6143, "sortino": -2.2438, "return_pct": -3.61, "equity": 963.91, "max_dd": 6.64, "win_rate": 44.64, "profit_factor": 0.764, "ic": -0.0786, "hit": 44.64, "n": 112, "aleatoric_mean": 0.029882, "epistemic_mean": 0.01143, "confidence_mean": 0.9609, "aleatoric_std": 0.026585, "epistemic_std": 0.005022}, {"fold": "fold_6", "regime": "EUR crisis downturn", "sharpe": 0.9112, "sortino": 1.4696, "return_pct": 3.95, "equity": 1039.53, "max_dd": 7.02, "win_rate": 52.17, "profit_factor": 1.155, "ic": 0.0565, "hit": 52.17, "n": 115, "aleatoric_mean": 0.110339, "epistemic_mean": 0.008334, "confidence_mean": 0.8978, "aleatoric_std": 0.078009, "epistemic_std": 0.004023}, {"fold": "fold_7", "regime": "Recent mixed/upturn", "sharpe": 3.1144, "sortino": 5.5884, "return_pct": 13.26, "equity": 1132.58, "max_dd": 3.84, "win_rate": 58.04, "profit_factor": 1.709, "ic": 0.2511, "hit": 58.04, "n": 112, "aleatoric_mean": 0.033098, "epistemic_mean": 0.011689, "confidence_mean": 0.9577, "aleatoric_std": 0.027787, "epistemic_std": 0.004428}], "val_sharpe": -0.3439, "val_psr": 0.329, "val_equity": 953.34, "val_sortino": -0.5201, "val_return_pct": -4.67, "val_max_dd": 13.49, "val_win_rate": 47.36, "val_profit_factor": 0.944, "val_ic": -0.0096, "val_hit": 47.13, "val_aleatoric_mean": 0.100976, "val_epistemic_mean": 0.010167, "val_confidence_mean": 0.9149, "val_per_window": [{"fold": "fold_1", "regime": "Pre-crisis upturn + GFC onset", "sharpe": 3.3538, "sortino": 6.1853, "return_pct": 5.28, "equity": 1052.85, "max_dd": 1.7, "win_rate": 51.72, "profit_factor": 1.74, "ic": -0.0612, "hit": 50.85, "n": 59, "aleatoric_mean": 0.342035, "epistemic_mean": 0.008642, "confidence_mean": 0.7843, "aleatoric_std": 0.357478, "epistemic_std": 0.006148}, {"fold": "fold_2", "regime": "Post-crash recovery", "sharpe": -2.7689, "sortino": -4.4704, "return_pct": -5.29, "equity": 947.1, "max_dd": 4.46, "win_rate": 39.66, "profit_factor": 0.638, "ic": -0.2195, "hit": 39.66, "n": 58, "aleatoric_mean": 0.157426, "epistemic_mean": 0.008047, "confidence_mean": 0.8626, "aleatoric_std": 0.092391, "epistemic_std": 0.00329}, {"fold": "fold_3", "regime": "Eurozone debt plateau", "sharpe": -0.238, "sortino": -0.3385, "return_pct": -0.68, "equity": 993.24, "max_dd": 5.16, "win_rate": 52.46, "profit_factor": 0.961, "ic": 0.0969, "hit": 52.46, "n": 61, "aleatoric_mean": 0.04414, "epistemic_mean": 0.011996, "confidence_mean": 0.9477, "aleatoric_std": 0.034611, "epistemic_std": 0.005833}, {"fold": "fold_4", "regime": "Strong USD downturn", "sharpe": 0.369, "sortino": 0.7193, "return_pct": 0.71, "equity": 1007.1, "max_dd": 4.76, "win_rate": 53.33, "profit_factor": 1.058, "ic": 0.1114, "hit": 53.33, "n": 60, "aleatoric_mean": 0.044287, "epistemic_mean": 0.011714, "confidence_mean": 0.9486, "aleatoric_std": 0.048449, "epistemic_std": 0.004348}, {"fold": "fold_5", "regime": "Low-vol plateau", "sharpe": -4.0478, "sortino": -6.0932, "return_pct": -6.64, "equity": 933.56, "max_dd": 6.65, "win_rate": 37.1, "profit_factor": 0.518, "ic": -0.234, "hit": 37.1, "n": 62, "aleatoric_mean": 0.029035, "epistemic_mean": 0.010994, "confidence_mean": 0.9619, "aleatoric_std": 0.023744, "epistemic_std": 0.004771}, {"fold": "fold_6", "regime": "EUR crisis downturn", "sharpe": 3.8279, "sortino": 6.3, "return_pct": 3.94, "equity": 1039.35, "max_dd": 1.33, "win_rate": 57.89, "profit_factor": 1.877, "ic": 0.1802, "hit": 56.9, "n": 58, "aleatoric_mean": 0.017842, "epistemic_mean": 0.009962, "confidence_mean": 0.9731, "aleatoric_std": 0.012739, "epistemic_std": 0.003172}, {"fold": "fold_7", "regime": "Recent mixed/upturn", "sharpe": -1.1538, "sortino": -1.7051, "return_pct": -1.5, "equity": 985.04, "max_dd": 2.88, "win_rate": 40.0, "profit_factor": 0.828, "ic": -0.0071, "hit": 40.0, "n": 60, "aleatoric_mean": 0.078546, "epistemic_mean": 0.009654, "confidence_mean": 0.9223, "aleatoric_std": 0.072701, "epistemic_std": 0.004233}], "train_sharpe": 0.6509, "train_psr": 0.9427, "train_equity": 1519.76, "train_sortino": 0.847, "train_return_pct": 51.98, "train_max_dd": 22.77, "train_win_rate": 52.87, "train_profit_factor": 1.162, "train_ic": 0.0439, "train_hit": 52.6, "train_per_window": [{"fold": "all_train", "regime": "Training data", "sharpe": 0.6509, "sortino": 0.847, "return_pct": 51.98, "equity": 1519.76, "max_dd": 22.77, "win_rate": 52.87, "profit_factor": 1.162, "ic": 0.0439, "hit": 52.6, "n": 1382}], "experiment_num": 46, "status": "DISCARD"}
