{"backbone": "mlp", "description": "mlp: Exp21 residual seq=15 3wk context (Mosquera2020) seed=0", "config": {"seq_len": 15, "lr": 0.0005, "batch_size": 32, "epochs": 50, "weight_decay": 1e-05, "patience": 10, "grad_clip": 1.0, "warmup_epochs": 0, "huber_delta": 1.0, "head_dropout": 0.15, "seed": 0, "het_loss": false}, "composite": 4.3705, "test_pos_folds": 6, "val_pos_folds": 6, "val_loss": 4.3e-05, "elapsed_sec": 28.7, "timestamp": "2026-04-14T16:14:59", "sharpe": 4.5705, "psr": 1.0, "equity": 5855.69, "sortino": 8.8022, "return_pct": 485.57, "max_dd": 10.5, "win_rate": 63.7, "profit_factor": 2.369, "ic": 0.3685, "hit": 63.43, "aleatoric_mean": 4.7e-05, "epistemic_mean": 9.4e-05, "confidence_mean": 0.9999, "per_window": [{"fold": "fold_1", "regime": "Pre-crisis upturn + GFC onset", "sharpe": 2.8279, "sortino": 8.8265, "return_pct": 22.26, "equity": 1222.6, "max_dd": 4.96, "win_rate": 50.52, "profit_factor": 1.998, "ic": 0.0911, "hit": 50.0, "n": 98, "aleatoric_mean": 0.000104, "epistemic_mean": 0.000207, "confidence_mean": 0.9997, "aleatoric_std": 0.000134, "epistemic_std": 0.000267}, {"fold": "fold_2", "regime": "Post-crash recovery", "sharpe": -1.8958, "sortino": -3.0636, "return_pct": -8.55, "equity": 914.47, "max_dd": 10.5, "win_rate": 48.04, "profit_factor": 0.744, "ic": -0.0117, "hit": 48.04, "n": 102, "aleatoric_mean": 3.3e-05, "epistemic_mean": 6.5e-05, "confidence_mean": 0.9999, "aleatoric_std": 1.6e-05, "epistemic_std": 3.1e-05}, {"fold": "fold_3", "regime": "Eurozone debt plateau", "sharpe": 5.3011, "sortino": 9.5084, "return_pct": 18.55, "equity": 1185.52, "max_dd": 1.53, "win_rate": 68.69, "profit_factor": 2.299, "ic": 0.4443, "hit": 67.33, "n": 101, "aleatoric_mean": 4.9e-05, "epistemic_mean": 9.9e-05, "confidence_mean": 0.9999, "aleatoric_std": 2.3e-05, "epistemic_std": 4.5e-05}, {"fold": "fold_4", "regime": "Strong USD downturn", "sharpe": 7.5545, "sortino": 18.6512, "return_pct": 67.34, "equity": 1673.44, "max_dd": 3.37, "win_rate": 69.75, "profit_factor": 3.693, "ic": 0.4944, "hit": 69.33, "n": 163, "aleatoric_mean": 6.6e-05, "epistemic_mean": 0.000133, "confidence_mean": 0.9998, "aleatoric_std": 4.7e-05, "epistemic_std": 9.4e-05}, {"fold": "fold_5", "regime": "Low-vol plateau", "sharpe": 6.7236, "sortino": 12.1218, "return_pct": 21.47, "equity": 1214.73, "max_dd": 1.43, "win_rate": 66.24, "profit_factor": 3.11, "ic": 0.5569, "hit": 66.24, "n": 157, "aleatoric_mean": 2.3e-05, "epistemic_mean": 4.6e-05, "confidence_mean": 0.9999, "aleatoric_std": 1.1e-05, "epistemic_std": 2.1e-05}, {"fold": "fold_6", "regime": "EUR crisis downturn", "sharpe": 9.1787, "sortino": 20.8249, "return_pct": 63.07, "equity": 1630.73, "max_dd": 2.26, "win_rate": 69.38, "profit_factor": 4.54, "ic": 0.5818, "hit": 69.38, "n": 160, "aleatoric_mean": 4.3e-05, "epistemic_mean": 8.6e-05, "confidence_mean": 0.9999, "aleatoric_std": 2.6e-05, "epistemic_std": 5.2e-05}, {"fold": "fold_7", "regime": "Recent mixed/upturn", "sharpe": 5.2146, "sortino": 8.8438, "return_pct": 33.27, "equity": 1332.73, "max_dd": 2.47, "win_rate": 64.33, "profit_factor": 2.427, "ic": 0.4586, "hit": 64.33, "n": 157, "aleatoric_mean": 2.6e-05, "epistemic_mean": 5.3e-05, "confidence_mean": 0.9999, "aleatoric_std": 1.4e-05, "epistemic_std": 2.9e-05}], "val_sharpe": 4.5888, "val_psr": 1.0, "val_equity": 2717.89, "val_sortino": 7.3719, "val_return_pct": 171.79, "val_max_dd": 8.27, "val_win_rate": 62.09, "val_profit_factor": 2.185, "val_ic": 0.3678, "val_hit": 61.66, "val_aleatoric_mean": 2.8e-05, "val_epistemic_mean": 5.5e-05, "val_confidence_mean": 0.9999, "val_per_window": [{"fold": "fold_1", "regime": "Pre-crisis upturn + GFC onset", "sharpe": 0.7992, "sortino": 1.4119, "return_pct": 1.9, "equity": 1018.96, "max_dd": 3.3, "win_rate": 50.49, "profit_factor": 1.142, "ic": 0.092, "hit": 50.0, "n": 104, "aleatoric_mean": 2.8e-05, "epistemic_mean": 5.6e-05, "confidence_mean": 0.9999, "aleatoric_std": 2.4e-05, "epistemic_std": 4.7e-05}, {"fold": "fold_2", "regime": "Post-crash recovery", "sharpe": -0.5803, "sortino": -0.9088, "return_pct": -2.91, "equity": 970.86, "max_dd": 8.27, "win_rate": 43.69, "profit_factor": 0.912, "ic": -0.0524, "hit": 43.69, "n": 103, "aleatoric_mean": 4.4e-05, "epistemic_mean": 8.8e-05, "confidence_mean": 0.9999, "aleatoric_std": 2.6e-05, "epistemic_std": 5.3e-05}, {"fold": "fold_3", "regime": "Eurozone debt plateau", "sharpe": 7.4451, "sortino": 14.4638, "return_pct": 30.04, "equity": 1300.39, "max_dd": 1.38, "win_rate": 64.42, "profit_factor": 3.398, "ic": 0.5339, "hit": 63.21, "n": 106, "aleatoric_mean": 3.1e-05, "epistemic_mean": 6.3e-05, "confidence_mean": 0.9999, "aleatoric_std": 1.3e-05, "epistemic_std": 2.6e-05}, {"fold": "fold_4", "regime": "Strong USD downturn", "sharpe": 7.864, "sortino": 19.9563, "return_pct": 26.62, "equity": 1266.24, "max_dd": 1.55, "win_rate": 70.19, "profit_factor": 3.793, "ic": 0.537, "hit": 69.52, "n": 105, "aleatoric_mean": 2.6e-05, "epistemic_mean": 5.2e-05, "confidence_mean": 0.9999, "aleatoric_std": 1.9e-05, "epistemic_std": 3.7e-05}, {"fold": "fold_5", "regime": "Low-vol plateau", "sharpe": 9.7107, "sortino": 27.7608, "return_pct": 30.68, "equity": 1306.84, "max_dd": 1.24, "win_rate": 72.9, "profit_factor": 5.324, "ic": 0.6711, "hit": 72.9, "n": 107, "aleatoric_mean": 2.8e-05, "epistemic_mean": 5.6e-05, "confidence_mean": 0.9999, "aleatoric_std": 1.9e-05, "epistemic_std": 3.8e-05}, {"fold": "fold_6", "regime": "EUR crisis downturn", "sharpe": 8.1872, "sortino": 18.1327, "return_pct": 17.27, "equity": 1172.67, "max_dd": 0.86, "win_rate": 70.59, "profit_factor": 4.099, "ic": 0.6343, "hit": 69.9, "n": 103, "aleatoric_mean": 1.6e-05, "epistemic_mean": 3.2e-05, "confidence_mean": 1.0, "aleatoric_std": 6e-06, "epistemic_std": 1.2e-05}, {"fold": "fold_7", "regime": "Recent mixed/upturn", "sharpe": 3.8842, "sortino": 8.0264, "return_pct": 8.87, "equity": 1088.74, "max_dd": 1.4, "win_rate": 61.9, "profit_factor": 1.872, "ic": 0.3611, "hit": 61.9, "n": 105, "aleatoric_mean": 1.9e-05, "epistemic_mean": 3.9e-05, "confidence_mean": 0.9999, "aleatoric_std": 1e-05, "epistemic_std": 1.9e-05}], "train_sharpe": 7.2338, "train_psr": 1.0, "train_equity": 2152743.75, "train_sortino": 23.4293, "train_return_pct": 215174.38, "train_max_dd": 3.64, "train_win_rate": 73.91, "train_profit_factor": 6.268, "train_ic": 0.7079, "train_hit": 73.59, "train_per_window": [{"fold": "all_train", "regime": "Training data", "sharpe": 7.2338, "sortino": 23.4293, "return_pct": 215174.38, "equity": 2152743.75, "max_dd": 3.64, "win_rate": 73.91, "profit_factor": 6.268, "ic": 0.7079, "hit": 73.59, "n": 2348}], "experiment_num": 77, "status": "DISCARD"}
{"backbone": "mlp", "description": "mlp: Exp22 residual ep=75 pat=15 more convergence seed=0", "config": {"seq_len": 10, "lr": 0.0005, "batch_size": 32, "epochs": 75, "weight_decay": 1e-05, "patience": 15, "grad_clip": 1.0, "warmup_epochs": 0, "huber_delta": 1.0, "head_dropout": 0.15, "seed": 0, "het_loss": false}, "composite": 4.6504, "test_pos_folds": 7, "val_pos_folds": 6, "val_loss": 4.1e-05, "elapsed_sec": 23.2, "timestamp": "2026-04-14T16:16:05", "sharpe": 4.7504, "psr": 1.0, "equity": 6570.75, "sortino": 8.5577, "return_pct": 557.08, "max_dd": 7.24, "win_rate": 64.6, "profit_factor": 2.451, "ic": 0.3785, "hit": 64.34, "aleatoric_mean": 4e-05, "epistemic_mean": 8.1e-05, "confidence_mean": 0.9999, "per_window": [{"fold": "fold_1", "regime": "Pre-crisis upturn + GFC onset", "sharpe": 2.9987, "sortino": 8.0454, "return_pct": 24.64, "equity": 1246.38, "max_dd": 7.24, "win_rate": 63.73, "profit_factor": 2.066, "ic": 0.1759, "hit": 63.11, "n": 103, "aleatoric_mean": 7.3e-05, "epistemic_mean": 0.000146, "confidence_mean": 0.9998, "aleatoric_std": 9e-05, "epistemic_std": 0.000179}, {"fold": "fold_2", "regime": "Post-crash recovery", "sharpe": 4.2131, "sortino": 7.8871, "return_pct": 21.26, "equity": 1212.61, "max_dd": 3.1, "win_rate": 66.36, "profit_factor": 1.937, "ic": 0.1901, "hit": 66.36, "n": 107, "aleatoric_mean": 2.9e-05, "epistemic_mean": 5.9e-05, "confidence_mean": 0.9999, "aleatoric_std": 1.5e-05, "epistemic_std": 3e-05}, {"fold": "fold_3", "regime": "Eurozone debt plateau", "sharpe": 3.3888, "sortino": 5.2509, "return_pct": 12.32, "equity": 1123.17, "max_dd": 4.62, "win_rate": 65.38, "profit_factor": 1.703, "ic": 0.3884, "hit": 64.15, "n": 106, "aleatoric_mean": 4.4e-05, "epistemic_mean": 8.7e-05, "confidence_mean": 0.9999, "aleatoric_std": 2.4e-05, "epistemic_std": 4.7e-05}, {"fold": "fold_4", "regime": "Strong USD downturn", "sharpe": 7.94, "sortino": 12.4385, "return_pct": 72.99, "equity": 1729.9, "max_dd": 2.08, "win_rate": 73.05, "profit_factor": 3.955, "ic": 0.5288, "hit": 72.62, "n": 168, "aleatoric_mean": 5.5e-05, "epistemic_mean": 0.00011, "confidence_mean": 0.9998, "aleatoric_std": 3.6e-05, "epistemic_std": 7.3e-05}, {"fold": "fold_5", "regime": "Low-vol plateau", "sharpe": 4.0314, "sortino": 5.7007, "return_pct": 13.81, "equity": 1138.12, "max_dd": 2.45, "win_rate": 60.49, "profit_factor": 1.963, "ic": 0.5085, "hit": 60.49, "n": 162, "aleatoric_mean": 2.1e-05, "epistemic_mean": 4.1e-05, "confidence_mean": 0.9999, "aleatoric_std": 1e-05, "epistemic_std": 2e-05}, {"fold": "fold_6", "regime": "EUR crisis downturn", "sharpe": 6.4695, "sortino": 11.0909, "return_pct": 45.4, "equity": 1454.01, "max_dd": 3.35, "win_rate": 62.42, "profit_factor": 2.876, "ic": 0.5015, "hit": 62.42, "n": 165, "aleatoric_mean": 4.3e-05, "epistemic_mean": 8.6e-05, "confidence_mean": 0.9999, "aleatoric_std": 2.9e-05, "epistemic_std": 5.8e-05}, {"fold": "fold_7", "regime": "Recent mixed/upturn", "sharpe": 5.3923, "sortino": 9.5807, "return_pct": 35.21, "equity": 1352.14, "max_dd": 2.7, "win_rate": 61.11, "profit_factor": 2.517, "ic": 0.5137, "hit": 61.11, "n": 162, "aleatoric_mean": 2.7e-05, "epistemic_mean": 5.3e-05, "confidence_mean": 0.9999, "aleatoric_std": 1.4e-05, "epistemic_std": 2.7e-05}], "val_sharpe": 4.84, "val_psr": 1.0, "val_equity": 2975.29, "val_sortino": 7.898, "val_return_pct": 197.53, "val_max_dd": 6.7, "val_win_rate": 62.39, "val_profit_factor": 2.284, "val_ic": 0.4069, "val_hit": 61.98, "val_aleatoric_mean": 2.5e-05, "val_epistemic_mean": 4.9e-05, "val_confidence_mean": 0.9999, "val_per_window": [{"fold": "fold_1", "regime": "Pre-crisis upturn + GFC onset", "sharpe": -0.41, "sortino": -0.6713, "return_pct": -1.1, "equity": 988.98, "max_dd": 4.16, "win_rate": 46.3, "profit_factor": 0.934, "ic": 0.0216, "hit": 45.87, "n": 109, "aleatoric_mean": 2.1e-05, "epistemic_mean": 4.3e-05, "confidence_mean": 0.9999, "aleatoric_std": 2.1e-05, "epistemic_std": 4.2e-05}, {"fold": "fold_2", "regime": "Post-crash recovery", "sharpe": 1.0196, "sortino": 1.6278, "return_pct": 4.78, "equity": 1047.76, "max_dd": 6.7, "win_rate": 52.78, "profit_factor": 1.175, "ic": 0.1353, "hit": 52.78, "n": 108, "aleatoric_mean": 4.2e-05, "epistemic_mean": 8.3e-05, "confidence_mean": 0.9999, "aleatoric_std": 2.9e-05, "epistemic_std": 5.8e-05}, {"fold": "fold_3", "regime": "Eurozone debt plateau", "sharpe": 8.8621, "sortino": 19.4881, "return_pct": 36.5, "equity": 1365.02, "max_dd": 1.74, "win_rate": 69.72, "profit_factor": 4.371, "ic": 0.6018, "hit": 68.47, "n": 111, "aleatoric_mean": 3.3e-05, "epistemic_mean": 6.7e-05, "confidence_mean": 0.9999, "aleatoric_std": 2e-05, "epistemic_std": 3.9e-05}, {"fold": "fold_4", "regime": "Strong USD downturn", "sharpe": 7.1283, "sortino": 16.3253, "return_pct": 25.19, "equity": 1251.89, "max_dd": 1.58, "win_rate": 68.81, "profit_factor": 3.326, "ic": 0.5543, "hit": 68.18, "n": 110, "aleatoric_mean": 2.5e-05, "epistemic_mean": 5e-05, "confidence_mean": 0.9999, "aleatoric_std": 1.8e-05, "epistemic_std": 3.6e-05}, {"fold": "fold_5", "regime": "Low-vol plateau", "sharpe": 7.8089, "sortino": 15.823, "return_pct": 26.2, "equity": 1261.96, "max_dd": 1.23, "win_rate": 67.86, "profit_factor": 3.786, "ic": 0.7085, "hit": 67.86, "n": 112, "aleatoric_mean": 2.4e-05, "epistemic_mean": 4.8e-05, "confidence_mean": 0.9999, "aleatoric_std": 1.8e-05, "epistemic_std": 3.5e-05}, {"fold": "fold_6", "regime": "EUR crisis downturn", "sharpe": 7.33, "sortino": 15.177, "return_pct": 16.39, "equity": 1163.94, "max_dd": 1.77, "win_rate": 67.29, "profit_factor": 3.543, "ic": 0.552, "hit": 66.67, "n": 108, "aleatoric_mean": 1.3e-05, "epistemic_mean": 2.5e-05, "confidence_mean": 1.0, "aleatoric_std": 5e-06, "epistemic_std": 9e-06}, {"fold": "fold_7", "regime": "Recent mixed/upturn", "sharpe": 6.0221, "sortino": 14.0289, "return_pct": 14.39, "equity": 1143.94, "max_dd": 1.14, "win_rate": 63.64, "profit_factor": 2.652, "ic": 0.3616, "hit": 63.64, "n": 110, "aleatoric_mean": 1.5e-05, "epistemic_mean": 3.1e-05, "confidence_mean": 1.0, "aleatoric_std": 1.1e-05, "epistemic_std": 2.2e-05}], "train_sharpe": 6.0307, "train_psr": 1.0, "train_equity": 939442.31, "train_sortino": 16.3712, "train_return_pct": 93844.23, "train_max_dd": 5.23, "train_win_rate": 69.21, "train_profit_factor": 4.206, "train_ic": 0.5879, "train_hit": 68.93, "train_per_window": [{"fold": "all_train", "regime": "Training data", "sharpe": 6.0307, "sortino": 16.3712, "return_pct": 93844.23, "equity": 939442.31, "max_dd": 5.23, "win_rate": 69.21, "profit_factor": 4.206, "ic": 0.5879, "hit": 68.93, "n": 2478}], "experiment_num": 78, "status": "DISCARD"}
{"backbone": "mlp", "description": "mlp: Exp23 residual lr=1e-3 aggressive (Smith2018) seed=0", "config": {"seq_len": 10, "lr": 0.001, "batch_size": 32, "epochs": 50, "weight_decay": 1e-05, "patience": 10, "grad_clip": 1.0, "warmup_epochs": 0, "huber_delta": 1.0, "head_dropout": 0.15, "seed": 0, "het_loss": false}, "composite": 5.1738, "test_pos_folds": 7, "val_pos_folds": 6, "val_loss": 3.8e-05, "elapsed_sec": 21.8, "timestamp": "2026-04-14T16:16:47", "sharpe": 5.2738, "psr": 1.0, "equity": 7945.55, "sortino": 10.0171, "return_pct": 694.56, "max_dd": 7.89, "win_rate": 65.53, "profit_factor": 2.72, "ic": 0.4236, "hit": 65.26, "aleatoric_mean": 2.6e-05, "epistemic_mean": 5.2e-05, "confidence_mean": 0.9999, "per_window": [{"fold": "fold_1", "regime": "Pre-crisis upturn + GFC onset", "sharpe": 3.0017, "sortino": 8.1025, "return_pct": 24.67, "equity": 1246.65, "max_dd": 5.15, "win_rate": 62.75, "profit_factor": 2.068, "ic": 0.1395, "hit": 62.14, "n": 103, "aleatoric_mean": 4.3e-05, "epistemic_mean": 8.6e-05, "confidence_mean": 0.9999, "aleatoric_std": 5.4e-05, "epistemic_std": 0.000108}, {"fold": "fold_2", "regime": "Post-crash recovery", "sharpe": 1.3161, "sortino": 2.5516, "return_pct": 6.21, "equity": 1062.11, "max_dd": 7.89, "win_rate": 51.4, "profit_factor": 1.229, "ic": 0.0507, "hit": 51.4, "n": 107, "aleatoric_mean": 2e-05, "epistemic_mean": 4.1e-05, "confidence_mean": 0.9999, "aleatoric_std": 1.2e-05, "epistemic_std": 2.3e-05}, {"fold": "fold_3", "regime": "Eurozone debt plateau", "sharpe": 6.1111, "sortino": 9.5218, "return_pct": 22.26, "equity": 1222.58, "max_dd": 1.96, "win_rate": 67.31, "profit_factor": 2.621, "ic": 0.498, "hit": 66.04, "n": 106, "aleatoric_mean": 3e-05, "epistemic_mean": 6e-05, "confidence_mean": 0.9999, "aleatoric_std": 1.8e-05, "epistemic_std": 3.7e-05}, {"fold": "fold_4", "regime": "Strong USD downturn", "sharpe": 9.4841, "sortino": 21.1953, "return_pct": 87.58, "equity": 1875.81, "max_dd": 1.7, "win_rate": 76.65, "profit_factor": 5.324, "ic": 0.6252, "hit": 76.19, "n": 168, "aleatoric_mean": 3.7e-05, "epistemic_mean": 7.3e-05, "confidence_mean": 0.9999, "aleatoric_std": 2.5e-05, "epistemic_std": 5.1e-05}, {"fold": "fold_5", "regime": "Low-vol plateau", "sharpe": 6.7367, "sortino": 10.0855, "return_pct": 22.86, "equity": 1228.57, "max_dd": 1.85, "win_rate": 63.58, "profit_factor": 3.13, "ic": 0.4762, "hit": 63.58, "n": 162, "aleatoric_mean": 1.5e-05, "epistemic_mean": 3e-05, "confidence_mean": 1.0, "aleatoric_std": 7e-06, "epistemic_std": 1.5e-05}, {"fold": "fold_6", "regime": "EUR crisis downturn", "sharpe": 8.1182, "sortino": 15.1209, "return_pct": 57.18, "equity": 1571.81, "max_dd": 2.1, "win_rate": 67.88, "profit_factor": 3.807, "ic": 0.5653, "hit": 67.88, "n": 165, "aleatoric_mean": 2.7e-05, "epistemic_mean": 5.3e-05, "confidence_mean": 0.9999, "aleatoric_std": 1.8e-05, "epistemic_std": 3.5e-05}, {"fold": "fold_7", "regime": "Recent mixed/upturn", "sharpe": 5.4344, "sortino": 9.4487, "return_pct": 35.5, "equity": 1355.02, "max_dd": 2.47, "win_rate": 63.58, "profit_factor": 2.535, "ic": 0.4571, "hit": 63.58, "n": 162, "aleatoric_mean": 1.6e-05, "epistemic_mean": 3.3e-05, "confidence_mean": 1.0, "aleatoric_std": 1e-05, "epistemic_std": 2.1e-05}], "val_sharpe": 5.2917, "val_psr": 1.0, "val_equity": 3264.47, "val_sortino": 8.2867, "val_return_pct": 226.45, "val_max_dd": 8.08, "val_win_rate": 64.09, "val_profit_factor": 2.473, "val_ic": 0.39, "val_hit": 63.67, "val_aleatoric_mean": 1.6e-05, "val_epistemic_mean": 3.2e-05, "val_confidence_mean": 1.0, "val_per_window": [{"fold": "fold_1", "regime": "Pre-crisis upturn + GFC onset", "sharpe": -0.3435, "sortino": -0.5377, "return_pct": -0.94, "equity": 990.63, "max_dd": 4.29, "win_rate": 45.37, "profit_factor": 0.945, "ic": -0.0235, "hit": 44.95, "n": 109, "aleatoric_mean": 1.5e-05, "epistemic_mean": 3.1e-05, "confidence_mean": 1.0, "aleatoric_std": 1.8e-05, "epistemic_std": 3.5e-05}, {"fold": "fold_2", "regime": "Post-crash recovery", "sharpe": 0.0936, "sortino": 0.1454, "return_pct": 0.18, "equity": 1001.79, "max_dd": 8.08, "win_rate": 51.85, "profit_factor": 1.015, "ic": 0.1089, "hit": 51.85, "n": 108, "aleatoric_mean": 2.8e-05, "epistemic_mean": 5.6e-05, "confidence_mean": 0.9999, "aleatoric_std": 1.8e-05, "epistemic_std": 3.7e-05}, {"fold": "fold_3", "regime": "Eurozone debt plateau", "sharpe": 10.212, "sortino": 27.9246, "return_pct": 41.28, "equity": 1412.8, "max_dd": 0.87, "win_rate": 76.15, "profit_factor": 5.593, "ic": 0.5853, "hit": 74.77, "n": 111, "aleatoric_mean": 1.9e-05, "epistemic_mean": 3.8e-05, "confidence_mean": 0.9999, "aleatoric_std": 1.1e-05, "epistemic_std": 2.2e-05}, {"fold": "fold_4", "regime": "Strong USD downturn", "sharpe": 6.7448, "sortino": 15.7086, "return_pct": 23.91, "equity": 1239.11, "max_dd": 1.41, "win_rate": 64.22, "profit_factor": 3.109, "ic": 0.521, "hit": 63.64, "n": 110, "aleatoric_mean": 1.7e-05, "epistemic_mean": 3.4e-05, "confidence_mean": 0.9999, "aleatoric_std": 1.4e-05, "epistemic_std": 2.8e-05}, {"fold": "fold_5", "regime": "Low-vol plateau", "sharpe": 10.5142, "sortino": 30.8774, "return_pct": 33.83, "equity": 1338.27, "max_dd": 1.12, "win_rate": 72.32, "profit_factor": 6.358, "ic": 0.6545, "hit": 72.32, "n": 112, "aleatoric_mean": 1.4e-05, "epistemic_mean": 2.8e-05, "confidence_mean": 1.0, "aleatoric_std": 8e-06, "epistemic_std": 1.6e-05}, {"fold": "fold_6", "regime": "EUR crisis downturn", "sharpe": 11.3562, "sortino": 29.7253, "return_pct": 23.48, "equity": 1234.83, "max_dd": 0.93, "win_rate": 77.57, "profit_factor": 7.966, "ic": 0.7088, "hit": 76.85, "n": 108, "aleatoric_mean": 9e-06, "epistemic_mean": 1.8e-05, "confidence_mean": 1.0, "aleatoric_std": 4e-06, "epistemic_std": 8e-06}, {"fold": "fold_7", "regime": "Recent mixed/upturn", "sharpe": 5.7172, "sortino": 13.8685, "return_pct": 13.71, "equity": 1137.05, "max_dd": 1.23, "win_rate": 60.91, "profit_factor": 2.522, "ic": 0.3958, "hit": 60.91, "n": 110, "aleatoric_mean": 1.1e-05, "epistemic_mean": 2.2e-05, "confidence_mean": 1.0, "aleatoric_std": 9e-06, "epistemic_std": 1.8e-05}], "train_sharpe": 6.9119, "train_psr": 1.0, "train_equity": 2217236.0, "train_sortino": 18.4005, "train_return_pct": 221623.6, "train_max_dd": 3.5, "train_win_rate": 73.7, "train_profit_factor": 5.499, "train_ic": 0.6607, "train_hit": 73.41, "train_per_window": [{"fold": "all_train", "regime": "Training data", "sharpe": 6.9119, "sortino": 18.4005, "return_pct": 221623.6, "equity": 2217236.0, "max_dd": 3.5, "win_rate": 73.7, "profit_factor": 5.499, "ic": 0.6607, "hit": 73.41, "n": 2478}], "experiment_num": 79, "status": "DISCARD"}
