{"backbone": "lstm", "description": "lstm: Exp16 seq=5 shorter memory (test boundary)", "config": {"seq_len": 5, "lr": 0.001, "batch_size": 32, "epochs": 100, "weight_decay": 0.0001, "patience": 15, "grad_clip": 1.0, "warmup_epochs": 0, "huber_delta": 1.0, "head_dropout": 0.25, "seed": 0, "het_loss": false}, "composite": 5.702, "test_pos_folds": 7, "val_pos_folds": 6, "val_loss": 2.9e-05, "elapsed_sec": 33.9, "timestamp": "2026-04-19T19:17:23", "sharpe": 5.802, "psr": 1.0, "equity": 10232.21, "sortino": 7.1759, "return_pct": 923.22, "max_dd": 8.66, "win_rate": 67.73, "profit_factor": 3.011, "ic": 0.5533, "hit": 67.46, "aleatoric_mean": 1.7e-05, "epistemic_mean": 3.4e-05, "confidence_mean": 0.9999, "precision": 0.7884, "recall": 0.4676, "f1": 0.587, "f2": 0.509, "mcc": 0.382, "accuracy": 0.6776, "per_window": [{"fold": "fold_1", "regime": "Pre-crisis upturn + GFC onset", "sharpe": 0.0181, "sortino": 0.0206, "return_pct": -0.59, "equity": 994.06, "max_dd": 8.66, "win_rate": 48.6, "profit_factor": 1.004, "ic": 0.024, "hit": 48.15, "n": 108, "precision": 0.4815, "recall": 0.2407, "f1": 0.321, "f2": 0.2675, "mcc": -0.0214, "accuracy": 0.4907, "tp": 13, "fp": 14, "tn": 40, "fn": 41, "aleatoric_mean": 3e-05, "epistemic_mean": 6.1e-05, "confidence_mean": 0.9999, "aleatoric_std": 1.8e-05, "epistemic_std": 3.6e-05}, {"fold": "fold_2", "regime": "Post-crash recovery", "sharpe": 3.6966, "sortino": 6.1951, "return_pct": 19.24, "equity": 1192.42, "max_dd": 3.14, "win_rate": 60.71, "profit_factor": 1.787, "ic": 0.1905, "hit": 60.71, "n": 112, "precision": 0.625, "recall": 0.463, "f1": 0.5319, "f2": 0.4883, "mcc": 0.2131, "accuracy": 0.6071, "tp": 25, "fp": 15, "tn": 43, "fn": 29, "aleatoric_mean": 1.9e-05, "epistemic_mean": 3.9e-05, "confidence_mean": 0.9999, "aleatoric_std": 8e-06, "epistemic_std": 1.5e-05}, {"fold": "fold_3", "regime": "Eurozone debt plateau", "sharpe": 10.178, "sortino": 14.6685, "return_pct": 38.99, "equity": 1389.93, "max_dd": 1.93, "win_rate": 78.9, "profit_factor": 5.204, "ic": 0.6946, "hit": 77.48, "n": 111, "precision": 0.7903, "recall": 0.8167, "f1": 0.8033, "f2": 0.8113, "mcc": 0.5638, "accuracy": 0.7838, "tp": 49, "fp": 13, "tn": 38, "fn": 11, "aleatoric_mean": 2e-05, "epistemic_mean": 3.9e-05, "confidence_mean": 0.9999, "aleatoric_std": 9e-06, "epistemic_std": 1.8e-05}, {"fold": "fold_4", "regime": "Strong USD downturn", "sharpe": 10.5038, "sortino": 29.7274, "return_pct": 100.46, "equity": 2004.65, "max_dd": 0.97, "win_rate": 75.58, "profit_factor": 6.45, "ic": 0.801, "hit": 75.14, "n": 173, "precision": 0.9592, "recall": 0.5402, "f1": 0.6912, "f2": 0.5919, "mcc": 0.5737, "accuracy": 0.7572, "tp": 47, "fp": 2, "tn": 84, "fn": 40, "aleatoric_mean": 1.7e-05, "epistemic_mean": 3.3e-05, "confidence_mean": 1.0, "aleatoric_std": 9e-06, "epistemic_std": 1.8e-05}, {"fold": "fold_5", "regime": "Low-vol plateau", "sharpe": 8.1506, "sortino": 16.3803, "return_pct": 28.24, "equity": 1282.45, "max_dd": 1.17, "win_rate": 67.66, "profit_factor": 4.002, "ic": 0.6946, "hit": 67.66, "n": 167, "precision": 0.7895, "recall": 0.3947, "f1": 0.5263, "f2": 0.4386, "mcc": 0.3644, "accuracy": 0.6766, "tp": 30, "fp": 8, "tn": 83, "fn": 46, "aleatoric_mean": 9e-06, "epistemic_mean": 1.9e-05, "confidence_mean": 1.0, "aleatoric_std": 4e-06, "epistemic_std": 7e-06}, {"fold": "fold_6", "regime": "EUR crisis downturn", "sharpe": 10.4143, "sortino": 23.6807, "return_pct": 74.93, "equity": 1749.3, "max_dd": 1.25, "win_rate": 70.0, "profit_factor": 5.694, "ic": 0.7656, "hit": 70.0, "n": 170, "precision": 0.8222, "recall": 0.4625, "f1": 0.592, "f2": 0.5068, "mcc": 0.4227, "accuracy": 0.7, "tp": 37, "fp": 8, "tn": 82, "fn": 43, "aleatoric_mean": 1.7e-05, "epistemic_mean": 3.4e-05, "confidence_mean": 0.9999, "aleatoric_std": 9e-06, "epistemic_std": 1.7e-05}, {"fold": "fold_7", "regime": "Recent mixed/upturn", "sharpe": 5.7006, "sortino": 9.9176, "return_pct": 38.1, "equity": 1380.99, "max_dd": 3.26, "win_rate": 67.07, "profit_factor": 2.67, "ic": 0.7116, "hit": 67.07, "n": 167, "precision": 0.9375, "recall": 0.3614, "f1": 0.5217, "f2": 0.4121, "mcc": 0.4289, "accuracy": 0.6707, "tp": 30, "fp": 2, "tn": 82, "fn": 53, "aleatoric_mean": 1.3e-05, "epistemic_mean": 2.7e-05, "confidence_mean": 1.0, "aleatoric_std": 6e-06, "epistemic_std": 1.1e-05}], "val_sharpe": 6.733, "val_psr": 1.0, "val_equity": 4561.48, "val_sortino": 9.7514, "val_return_pct": 356.15, "val_max_dd": 6.17, "val_win_rate": 71.3, "val_profit_factor": 3.197, "val_ic": 0.5546, "val_hit": 70.86, "val_aleatoric_mean": 1.2e-05, "val_epistemic_mean": 2.3e-05, "val_confidence_mean": 1.0, "val_precision": 0.8054, "val_recall": 0.5363, "val_f1": 0.6439, "val_f2": 0.5747, "val_mcc": 0.4459, "val_accuracy": 0.7148, "val_per_window": [{"fold": "fold_1", "regime": "Pre-crisis upturn + GFC onset", "sharpe": 1.2158, "sortino": 2.0774, "return_pct": 3.16, "equity": 1031.59, "max_dd": 3.23, "win_rate": 54.87, "profit_factor": 1.223, "ic": 0.0677, "hit": 54.39, "n": 114, "precision": 0.6154, "recall": 0.4, "f1": 0.4848, "f2": 0.4301, "mcc": 0.1286, "accuracy": 0.5526, "tp": 24, "fp": 15, "tn": 39, "fn": 36, "aleatoric_mean": 1e-05, "epistemic_mean": 2e-05, "confidence_mean": 1.0, "aleatoric_std": 5e-06, "epistemic_std": 1.1e-05}, {"fold": "fold_2", "regime": "Post-crash recovery", "sharpe": -0.2371, "sortino": -0.3797, "return_pct": -1.46, "equity": 985.41, "max_dd": 6.17, "win_rate": 48.67, "profit_factor": 0.963, "ic": -0.0245, "hit": 48.67, "n": 113, "precision": 0.5833, "recall": 0.3281, "f1": 0.42, "f2": 0.3596, "mcc": 0.0234, "accuracy": 0.4867, "tp": 21, "fp": 15, "tn": 34, "fn": 43, "aleatoric_mean": 1.9e-05, "epistemic_mean": 3.8e-05, "confidence_mean": 0.9999, "aleatoric_std": 1e-05, "epistemic_std": 2e-05}, {"fold": "fold_3", "regime": "Eurozone debt plateau", "sharpe": 11.4092, "sortino": 28.9811, "return_pct": 47.57, "equity": 1475.73, "max_dd": 0.78, "win_rate": 80.7, "profit_factor": 6.932, "ic": 0.7663, "hit": 79.31, "n": 116, "precision": 0.8333, "recall": 0.7, "f1": 0.7609, "f2": 0.7231, "mcc": 0.612, "accuracy": 0.8103, "tp": 35, "fp": 7, "tn": 59, "fn": 15, "aleatoric_mean": 1.4e-05, "epistemic_mean": 2.8e-05, "confidence_mean": 1.0, "aleatoric_std": 6e-06, "epistemic_std": 1.2e-05}, {"fold": "fold_4", "regime": "Strong USD downturn", "sharpe": 11.9013, "sortino": 25.5506, "return_pct": 40.2, "equity": 1401.97, "max_dd": 0.65, "win_rate": 82.46, "profit_factor": 8.712, "ic": 0.8131, "hit": 81.74, "n": 115, "precision": 0.9412, "recall": 0.64, "f1": 0.7619, "f2": 0.6838, "mcc": 0.6618, "accuracy": 0.8261, "tp": 32, "fp": 2, "tn": 63, "fn": 18, "aleatoric_mean": 1.1e-05, "epistemic_mean": 2.1e-05, "confidence_mean": 1.0, "aleatoric_std": 5e-06, "epistemic_std": 1e-05}, {"fold": "fold_5", "regime": "Low-vol plateau", "sharpe": 12.9696, "sortino": 36.0547, "return_pct": 41.1, "equity": 1411.04, "max_dd": 0.81, "win_rate": 78.63, "profit_factor": 10.957, "ic": 0.8241, "hit": 78.63, "n": 117, "precision": 0.8478, "recall": 0.6842, "f1": 0.7573, "f2": 0.7117, "mcc": 0.5808, "accuracy": 0.7863, "tp": 39, "fp": 7, "tn": 53, "fn": 18, "aleatoric_mean": 8e-06, "epistemic_mean": 1.6e-05, "confidence_mean": 1.0, "aleatoric_std": 4e-06, "epistemic_std": 7e-06}, {"fold": "fold_6", "regime": "EUR crisis downturn", "sharpe": 10.1665, "sortino": 27.9698, "return_pct": 22.47, "equity": 1224.69, "max_dd": 0.72, "win_rate": 74.11, "profit_factor": 6.023, "ic": 0.8253, "hit": 73.45, "n": 113, "precision": 0.9231, "recall": 0.4706, "f1": 0.6234, "f2": 0.5217, "mcc": 0.5182, "accuracy": 0.7434, "tp": 24, "fp": 2, "tn": 60, "fn": 27, "aleatoric_mean": 7e-06, "epistemic_mean": 1.4e-05, "confidence_mean": 1.0, "aleatoric_std": 2e-06, "epistemic_std": 5e-06}, {"fold": "fold_7", "regime": "Recent mixed/upturn", "sharpe": 10.6862, "sortino": 21.7133, "return_pct": 25.51, "equity": 1255.09, "max_dd": 0.66, "win_rate": 79.13, "profit_factor": 6.237, "ic": 0.7463, "hit": 79.13, "n": 115, "precision": 0.9412, "recall": 0.5926, "f1": 0.7273, "f2": 0.64, "mcc": 0.6122, "accuracy": 0.7913, "tp": 32, "fp": 2, "tn": 59, "fn": 22, "aleatoric_mean": 1.2e-05, "epistemic_mean": 2.3e-05, "confidence_mean": 1.0, "aleatoric_std": 6e-06, "epistemic_std": 1.3e-05}], "train_sharpe": 6.1751, "train_psr": 1.0, "train_equity": 1685656.12, "train_sortino": 16.2116, "train_return_pct": 168465.61, "train_max_dd": 5.58, "train_win_rate": 70.43, "train_profit_factor": 4.412, "train_ic": 0.6944, "train_hit": 70.13, "train_precision": 0.877, "train_recall": 0.4981, "train_f1": 0.6354, "train_f2": 0.5452, "train_mcc": 0.4653, "train_accuracy": 0.7051, "train_per_window": [{"fold": "all_train", "regime": "Training data", "sharpe": 6.1751, "sortino": 16.2116, "return_pct": 168465.61, "equity": 1685656.12, "max_dd": 5.58, "win_rate": 70.43, "profit_factor": 4.412, "ic": 0.6944, "hit": 70.13, "n": 2608, "precision": 0.877, "recall": 0.4981, "f1": 0.6354, "f2": 0.5452, "mcc": 0.4653, "accuracy": 0.7051, "tp": 670, "fp": 94, "tn": 1169, "fn": 675}], "experiment_num": 121, "status": "DISCARD"}
{"backbone": "lstm", "description": "lstm: Exp17 warmup=3 from champion (Goyal2017)", "config": {"seq_len": 10, "lr": 0.001, "batch_size": 32, "epochs": 100, "weight_decay": 0.0001, "patience": 15, "grad_clip": 1.0, "warmup_epochs": 3, "huber_delta": 1.0, "head_dropout": 0.25, "seed": 0, "het_loss": false}, "composite": 4.3721, "test_pos_folds": 6, "val_pos_folds": 7, "val_loss": 3e-05, "elapsed_sec": 37.9, "timestamp": "2026-04-19T19:18:26", "sharpe": 4.7346, "psr": 1.0, "equity": 6532.49, "sortino": 8.5218, "return_pct": 553.25, "max_dd": 14.62, "win_rate": 64.91, "profit_factor": 2.443, "ic": 0.4563, "hit": 64.65, "aleatoric_mean": 1.8e-05, "epistemic_mean": 3.6e-05, "confidence_mean": 0.9999, "precision": 0.6015, "recall": 0.8565, "f1": 0.7067, "f2": 0.7896, "mcc": 0.3304, "accuracy": 0.6485, "per_window": [{"fold": "fold_1", "regime": "Pre-crisis upturn + GFC onset", "sharpe": 1.5341, "sortino": 4.5087, "return_pct": 11.71, "equity": 1117.11, "max_dd": 5.89, "win_rate": 48.04, "profit_factor": 1.44, "ic": 0.016, "hit": 47.57, "n": 103, "precision": 0.4921, "recall": 0.5849, "f1": 0.5345, "f2": 0.5636, "mcc": -0.0565, "accuracy": 0.4757, "tp": 31, "fp": 32, "tn": 18, "fn": 22, "aleatoric_mean": 3.6e-05, "epistemic_mean": 7.3e-05, "confidence_mean": 0.9999, "aleatoric_std": 3e-05, "epistemic_std": 6e-05}, {"fold": "fold_2", "regime": "Post-crash recovery", "sharpe": -2.7884, "sortino": -4.3839, "return_pct": -12.59, "equity": 874.1, "max_dd": 12.84, "win_rate": 45.79, "profit_factor": 0.646, "ic": 0.0673, "hit": 45.79, "n": 107, "precision": 0.4653, "recall": 0.9216, "f1": 0.6184, "f2": 0.7705, "mcc": -0.0927, "accuracy": 0.4579, "tp": 47, "fp": 54, "tn": 2, "fn": 4, "aleatoric_mean": 2.1e-05, "epistemic_mean": 4.2e-05, "confidence_mean": 0.9999, "aleatoric_std": 1.2e-05, "epistemic_std": 2.3e-05}, {"fold": "fold_3", "regime": "Eurozone debt plateau", "sharpe": 2.6895, "sortino": 4.5019, "return_pct": 9.71, "equity": 1097.06, "max_dd": 3.75, "win_rate": 62.5, "profit_factor": 1.526, "ic": 0.597, "hit": 61.32, "n": 106, "precision": 0.5977, "recall": 0.9123, "f1": 0.7222, "f2": 0.8254, "mcc": 0.2574, "accuracy": 0.6226, "tp": 52, "fp": 35, "tn": 14, "fn": 5, "aleatoric_mean": 2e-05, "epistemic_mean": 4.1e-05, "confidence_mean": 0.9999, "aleatoric_std": 8e-06, "epistemic_std": 1.5e-05}, {"fold": "fold_4", "regime": "Strong USD downturn", "sharpe": 10.8195, "sortino": 24.3965, "return_pct": 99.61, "equity": 1996.09, "max_dd": 1.25, "win_rate": 77.84, "profit_factor": 7.027, "ic": 0.74, "hit": 77.38, "n": 168, "precision": 0.7579, "recall": 0.8372, "f1": 0.7956, "f2": 0.82, "mcc": 0.5614, "accuracy": 0.7798, "tp": 72, "fp": 23, "tn": 59, "fn": 14, "aleatoric_mean": 1.5e-05, "epistemic_mean": 3e-05, "confidence_mean": 1.0, "aleatoric_std": 7e-06, "epistemic_std": 1.4e-05}, {"fold": "fold_5", "regime": "Low-vol plateau", "sharpe": 5.7595, "sortino": 12.2043, "return_pct": 19.67, "equity": 1196.75, "max_dd": 2.17, "win_rate": 60.49, "profit_factor": 2.638, "ic": 0.6512, "hit": 60.49, "n": 162, "precision": 0.5469, "recall": 0.9211, "f1": 0.6863, "f2": 0.8102, "mcc": 0.3022, "accuracy": 0.6049, "tp": 70, "fp": 58, "tn": 28, "fn": 6, "aleatoric_mean": 9e-06, "epistemic_mean": 1.9e-05, "confidence_mean": 1.0, "aleatoric_std": 4e-06, "epistemic_std": 7e-06}, {"fold": "fold_6", "regime": "EUR crisis downturn", "sharpe": 7.3761, "sortino": 12.7375, "return_pct": 51.94, "equity": 1519.37, "max_dd": 3.04, "win_rate": 69.09, "profit_factor": 3.352, "ic": 0.6913, "hit": 69.09, "n": 165, "precision": 0.6083, "recall": 0.9481, "f1": 0.7411, "f2": 0.8528, "mcc": 0.4637, "accuracy": 0.6909, "tp": 73, "fp": 47, "tn": 41, "fn": 4, "aleatoric_mean": 1.5e-05, "epistemic_mean": 3.1e-05, "confidence_mean": 1.0, "aleatoric_std": 9e-06, "epistemic_std": 1.7e-05}, {"fold": "fold_7", "regime": "Recent mixed/upturn", "sharpe": 10.4834, "sortino": 18.0311, "return_pct": 68.01, "equity": 1680.12, "max_dd": 1.64, "win_rate": 76.54, "profit_factor": 6.66, "ic": 0.686, "hit": 76.54, "n": 162, "precision": 0.7363, "recall": 0.8272, "f1": 0.7791, "f2": 0.8072, "mcc": 0.535, "accuracy": 0.7654, "tp": 67, "fp": 24, "tn": 57, "fn": 14, "aleatoric_mean": 1.7e-05, "epistemic_mean": 3.3e-05, "confidence_mean": 1.0, "aleatoric_std": 7e-06, "epistemic_std": 1.4e-05}], "val_sharpe": 4.4721, "val_psr": 1.0, "val_equity": 2754.24, "val_sortino": 7.1611, "val_return_pct": 175.42, "val_max_dd": 6.85, "val_win_rate": 59.24, "val_profit_factor": 2.143, "val_ic": 0.5061, "val_hit": 58.85, "val_aleatoric_mean": 1.2e-05, "val_epistemic_mean": 2.5e-05, "val_confidence_mean": 1.0, "val_precision": 0.5405, "val_recall": 0.8959, "val_f1": 0.6742, "val_f2": 0.7918, "val_mcc": 0.2517, "val_accuracy": 0.5885, "val_per_window": [{"fold": "fold_1", "regime": "Pre-crisis upturn + GFC onset", "sharpe": 0.9672, "sortino": 1.5942, "return_pct": 2.39, "equity": 1023.92, "max_dd": 4.51, "win_rate": 47.22, "profit_factor": 1.174, "ic": 0.1218, "hit": 46.79, "n": 109, "precision": 0.4842, "recall": 0.8364, "f1": 0.6133, "f2": 0.7302, "mcc": -0.1062, "accuracy": 0.4679, "tp": 46, "fp": 49, "tn": 5, "fn": 9, "aleatoric_mean": 1.1e-05, "epistemic_mean": 2.3e-05, "confidence_mean": 1.0, "aleatoric_std": 6e-06, "epistemic_std": 1.2e-05}, {"fold": "fold_2", "regime": "Post-crash recovery", "sharpe": 1.4074, "sortino": 2.1793, "return_pct": 6.75, "equity": 1067.5, "max_dd": 6.85, "win_rate": 52.78, "profit_factor": 1.249, "ic": 0.1291, "hit": 52.78, "n": 108, "precision": 0.5857, "recall": 0.6508, "f1": 0.6165, "f2": 0.6366, "mcc": 0.0066, "accuracy": 0.5278, "tp": 41, "fp": 29, "tn": 16, "fn": 22, "aleatoric_mean": 1.9e-05, "epistemic_mean": 3.8e-05, "confidence_mean": 0.9999, "aleatoric_std": 8e-06, "epistemic_std": 1.6e-05}, {"fold": "fold_3", "regime": "Eurozone debt plateau", "sharpe": 4.8587, "sortino": 10.0632, "return_pct": 20.45, "equity": 1204.53, "max_dd": 2.04, "win_rate": 53.21, "profit_factor": 2.21, "ic": 0.708, "hit": 52.25, "n": 111, "precision": 0.4694, "recall": 0.9787, "f1": 0.6345, "f2": 0.8042, "mcc": 0.2554, "accuracy": 0.5225, "tp": 46, "fp": 52, "tn": 12, "fn": 1, "aleatoric_mean": 1.2e-05, "epistemic_mean": 2.5e-05, "confidence_mean": 1.0, "aleatoric_std": 5e-06, "epistemic_std": 1e-05}, {"fold": "fold_4", "regime": "Strong USD downturn", "sharpe": 4.8185, "sortino": 9.0547, "return_pct": 17.22, "equity": 1172.2, "max_dd": 3.08, "win_rate": 61.47, "profit_factor": 2.232, "ic": 0.7425, "hit": 60.91, "n": 110, "precision": 0.5222, "recall": 1.0, "f1": 0.6861, "f2": 0.8453, "mcc": 0.4072, "accuracy": 0.6091, "tp": 47, "fp": 43, "tn": 20, "fn": 0, "aleatoric_mean": 1.2e-05, "epistemic_mean": 2.4e-05, "confidence_mean": 1.0, "aleatoric_std": 5e-06, "epistemic_std": 1e-05}, {"fold": "fold_5", "regime": "Low-vol plateau", "sharpe": 7.6558, "sortino": 17.1168, "return_pct": 25.73, "equity": 1257.28, "max_dd": 1.12, "win_rate": 66.96, "profit_factor": 3.682, "ic": 0.778, "hit": 66.96, "n": 112, "precision": 0.5909, "recall": 0.9811, "f1": 0.7376, "f2": 0.8667, "mcc": 0.4514, "accuracy": 0.6696, "tp": 52, "fp": 36, "tn": 23, "fn": 1, "aleatoric_mean": 8e-06, "epistemic_mean": 1.7e-05, "confidence_mean": 1.0, "aleatoric_std": 3e-06, "epistemic_std": 6e-06}, {"fold": "fold_6", "regime": "EUR crisis downturn", "sharpe": 10.0427, "sortino": 30.1988, "return_pct": 21.38, "equity": 1213.82, "max_dd": 0.59, "win_rate": 69.16, "profit_factor": 5.991, "ic": 0.815, "hit": 68.52, "n": 108, "precision": 0.5823, "recall": 0.9787, "f1": 0.7302, "f2": 0.8614, "mcc": 0.4897, "accuracy": 0.6852, "tp": 46, "fp": 33, "tn": 28, "fn": 1, "aleatoric_mean": 8e-06, "epistemic_mean": 1.7e-05, "confidence_mean": 1.0, "aleatoric_std": 3e-06, "epistemic_std": 6e-06}, {"fold": "fold_7", "regime": "Recent mixed/upturn", "sharpe": 7.1871, "sortino": 17.8798, "return_pct": 16.94, "equity": 1169.39, "max_dd": 0.94, "win_rate": 63.64, "profit_factor": 3.22, "ic": 0.6493, "hit": 63.64, "n": 110, "precision": 0.5765, "recall": 0.9245, "f1": 0.7101, "f2": 0.8249, "mcc": 0.3493, "accuracy": 0.6364, "tp": 49, "fp": 36, "tn": 21, "fn": 4, "aleatoric_mean": 1.4e-05, "epistemic_mean": 2.9e-05, "confidence_mean": 1.0, "aleatoric_std": 7e-06, "epistemic_std": 1.3e-05}], "train_sharpe": 5.6295, "train_psr": 1.0, "train_equity": 625147.31, "train_sortino": 14.0959, "train_return_pct": 62414.73, "train_max_dd": 5.74, "train_win_rate": 68.88, "train_profit_factor": 3.757, "train_ic": 0.6556, "train_hit": 68.6, "train_precision": 0.6294, "train_recall": 0.9466, "train_f1": 0.7561, "train_f2": 0.86, "train_mcc": 0.426, "train_accuracy": 0.686, "train_per_window": [{"fold": "all_train", "regime": "Training data", "sharpe": 5.6295, "sortino": 14.0959, "return_pct": 62414.73, "equity": 625147.31, "max_dd": 5.74, "win_rate": 68.88, "profit_factor": 3.757, "ic": 0.6556, "hit": 68.6, "n": 2478, "precision": 0.6294, "recall": 0.9466, "f1": 0.7561, "f2": 0.86, "mcc": 0.426, "accuracy": 0.686, "tp": 1206, "fp": 710, "tn": 494, "fn": 68}], "experiment_num": 122, "status": "DISCARD"}
