{"backbone": "xlstm", "description": "xlstm: Exp1 SOTA baseline seq=10", "config": {"seq_len": 10, "lr": 0.0005, "batch_size": 16, "epochs": 80, "weight_decay": 0.001, "patience": 15, "grad_clip": 1.0, "warmup_epochs": 5, "huber_delta": 1.0, "head_dropout": 0.1, "seed": 42, "het_loss": false}, "composite": 0.5282, "test_pos_folds": 5, "val_pos_folds": 5, "val_loss": 4.6e-05, "elapsed_sec": 501.1, "timestamp": "2026-04-21T13:03:13", "sharpe": 0.9282, "psr": 0.9627, "equity": 1440.74, "sortino": 1.2172, "return_pct": 44.07, "max_dd": 13.49, "win_rate": 54.18, "profit_factor": 1.187, "ic": 0.0782, "hit": 53.96, "aleatoric_mean": 8e-06, "epistemic_mean": 1.6e-05, "confidence_mean": 1.0, "precision": 0.539, "recall": 0.5177, "f1": 0.5281, "f2": 0.5218, "mcc": 0.0848, "accuracy": 0.5427, "per_window": [{"fold": "fold_1", "regime": "Pre-crisis upturn + GFC onset", "sharpe": -0.1989, "sortino": -0.213, "return_pct": -2.24, "equity": 977.59, "max_dd": 8.34, "win_rate": 55.88, "profit_factor": 0.954, "ic": 0.066, "hit": 55.34, "n": 103, "precision": 0.7059, "recall": 0.2264, "f1": 0.3429, "f2": 0.262, "mcc": 0.1702, "accuracy": 0.5534, "tp": 12, "fp": 5, "tn": 45, "fn": 41, "aleatoric_mean": 1.8e-05, "epistemic_mean": 3.6e-05, "confidence_mean": 0.9999, "aleatoric_std": 1.6e-05, "epistemic_std": 3.2e-05}, {"fold": "fold_2", "regime": "Post-crash recovery", "sharpe": 2.7476, "sortino": 5.0258, "return_pct": 13.57, "equity": 1135.71, "max_dd": 3.82, "win_rate": 54.21, "profit_factor": 1.538, "ic": 0.0282, "hit": 54.21, "n": 107, "precision": 0.5556, "recall": 0.1961, "f1": 0.2899, "f2": 0.2252, "mcc": 0.0711, "accuracy": 0.5421, "tp": 10, "fp": 8, "tn": 48, "fn": 41, "aleatoric_mean": 8e-06, "epistemic_mean": 1.7e-05, "confidence_mean": 1.0, "aleatoric_std": 4e-06, "epistemic_std": 9e-06}, {"fold": "fold_3", "regime": "Eurozone debt plateau", "sharpe": 1.184, "sortino": 2.0273, "return_pct": 4.12, "equity": 1041.24, "max_dd": 3.13, "win_rate": 51.92, "profit_factor": 1.204, "ic": 0.1025, "hit": 50.94, "n": 106, "precision": 0.5686, "recall": 0.5088, "f1": 0.537, "f2": 0.5197, "mcc": 0.0597, "accuracy": 0.5283, "tp": 29, "fp": 22, "tn": 27, "fn": 28, "aleatoric_mean": 9e-06, "epistemic_mean": 1.7e-05, "confidence_mean": 1.0, "aleatoric_std": 3e-06, "epistemic_std": 7e-06}, {"fold": "fold_4", "regime": "Strong USD downturn", "sharpe": 2.5707, "sortino": 4.0164, "return_pct": 21.28, "equity": 1212.81, "max_dd": 6.02, "win_rate": 61.68, "profit_factor": 1.542, "ic": 0.2019, "hit": 61.31, "n": 168, "precision": 0.6222, "recall": 0.6512, "f1": 0.6364, "f2": 0.6452, "mcc": 0.2371, "accuracy": 0.619, "tp": 56, "fp": 34, "tn": 48, "fn": 30, "aleatoric_mean": 7e-06, "epistemic_mean": 1.5e-05, "confidence_mean": 1.0, "aleatoric_std": 4e-06, "epistemic_std": 7e-06}, {"fold": "fold_5", "regime": "Low-vol plateau", "sharpe": 0.7233, "sortino": 1.1187, "return_pct": 2.35, "equity": 1023.49, "max_dd": 2.13, "win_rate": 53.7, "profit_factor": 1.128, "ic": 0.0921, "hit": 53.7, "n": 162, "precision": 0.504, "recall": 0.8289, "f1": 0.6269, "f2": 0.7343, "mcc": 0.1284, "accuracy": 0.537, "tp": 63, "fp": 62, "tn": 24, "fn": 13, "aleatoric_mean": 4e-06, "epistemic_mean": 8e-06, "confidence_mean": 1.0, "aleatoric_std": 2e-06, "epistemic_std": 3e-06}, {"fold": "fold_6", "regime": "EUR crisis downturn", "sharpe": -1.1522, "sortino": -1.7461, "return_pct": -7.26, "equity": 927.36, "max_dd": 13.49, "win_rate": 48.48, "profit_factor": 0.83, "ic": 0.03, "hit": 48.48, "n": 165, "precision": 0.4565, "recall": 0.5455, "f1": 0.497, "f2": 0.525, "mcc": -0.0228, "accuracy": 0.4848, "tp": 42, "fp": 50, "tn": 38, "fn": 35, "aleatoric_mean": 9e-06, "epistemic_mean": 1.7e-05, "confidence_mean": 1.0, "aleatoric_std": 5e-06, "epistemic_std": 9e-06}, {"fold": "fold_7", "regime": "Recent mixed/upturn", "sharpe": 1.3833, "sortino": 1.8925, "return_pct": 8.26, "equity": 1082.64, "max_dd": 6.73, "win_rate": 53.09, "profit_factor": 1.263, "ic": 0.1124, "hit": 53.09, "n": 162, "precision": 0.5362, "recall": 0.4568, "f1": 0.4933, "f2": 0.4707, "mcc": 0.0624, "accuracy": 0.5309, "tp": 37, "fp": 32, "tn": 49, "fn": 44, "aleatoric_mean": 7e-06, "epistemic_mean": 1.4e-05, "confidence_mean": 1.0, "aleatoric_std": 3e-06, "epistemic_std": 6e-06}], "val_sharpe": 0.9449, "val_psr": 0.9513, "val_equity": 1239.58, "val_sortino": 1.5166, "val_return_pct": 23.96, "val_max_dd": 9.87, "val_win_rate": 51.77, "val_profit_factor": 1.173, "val_ic": 0.0669, "val_hit": 51.43, "val_aleatoric_mean": 5e-06, "val_epistemic_mean": 1.1e-05, "val_confidence_mean": 1.0, "val_precision": 0.4934, "val_recall": 0.6137, "val_f1": 0.547, "val_f2": 0.5852, "val_mcc": 0.0437, "val_accuracy": 0.5169, "val_per_window": [{"fold": "fold_1", "regime": "Pre-crisis upturn + GFC onset", "sharpe": -0.3786, "sortino": -0.5558, "return_pct": -1.02, "equity": 989.76, "max_dd": 3.7, "win_rate": 54.63, "profit_factor": 0.939, "ic": -0.0962, "hit": 54.13, "n": 109, "precision": 0.5469, "recall": 0.6364, "f1": 0.5882, "f2": 0.6162, "mcc": 0.1009, "accuracy": 0.5505, "tp": 35, "fp": 29, "tn": 25, "fn": 20, "aleatoric_mean": 5e-06, "epistemic_mean": 1e-05, "confidence_mean": 1.0, "aleatoric_std": 4e-06, "epistemic_std": 9e-06}, {"fold": "fold_2", "regime": "Post-crash recovery", "sharpe": 2.1487, "sortino": 4.0245, "return_pct": 10.59, "equity": 1105.89, "max_dd": 3.37, "win_rate": 54.63, "profit_factor": 1.404, "ic": 0.1355, "hit": 54.63, "n": 108, "precision": 0.6, "recall": 0.6667, "f1": 0.6316, "f2": 0.6522, "mcc": 0.0459, "accuracy": 0.5463, "tp": 42, "fp": 28, "tn": 17, "fn": 21, "aleatoric_mean": 1e-05, "epistemic_mean": 1.9e-05, "confidence_mean": 1.0, "aleatoric_std": 4e-06, "epistemic_std": 8e-06}, {"fold": "fold_3", "regime": "Eurozone debt plateau", "sharpe": 1.9979, "sortino": 4.5253, "return_pct": 8.15, "equity": 1081.49, "max_dd": 3.59, "win_rate": 46.79, "profit_factor": 1.383, "ic": 0.1223, "hit": 45.95, "n": 111, "precision": 0.4198, "recall": 0.7234, "f1": 0.5312, "f2": 0.632, "mcc": -0.0122, "accuracy": 0.4595, "tp": 34, "fp": 47, "tn": 17, "fn": 13, "aleatoric_mean": 5e-06, "epistemic_mean": 1.1e-05, "confidence_mean": 1.0, "aleatoric_std": 2e-06, "epistemic_std": 5e-06}, {"fold": "fold_4", "regime": "Strong USD downturn", "sharpe": 0.3615, "sortino": 0.5236, "return_pct": 1.12, "equity": 1011.24, "max_dd": 3.71, "win_rate": 51.38, "profit_factor": 1.062, "ic": 0.1562, "hit": 50.91, "n": 110, "precision": 0.4507, "recall": 0.6809, "f1": 0.5424, "f2": 0.6178, "mcc": 0.0639, "accuracy": 0.5091, "tp": 32, "fp": 39, "tn": 24, "fn": 15, "aleatoric_mean": 5e-06, "epistemic_mean": 1e-05, "confidence_mean": 1.0, "aleatoric_std": 2e-06, "epistemic_std": 4e-06}, {"fold": "fold_5", "regime": "Low-vol plateau", "sharpe": -1.8195, "sortino": -2.3887, "return_pct": -5.97, "equity": 940.26, "max_dd": 6.4, "win_rate": 46.43, "profit_factor": 0.739, "ic": -0.0525, "hit": 46.43, "n": 112, "precision": 0.4568, "recall": 0.6981, "f1": 0.5522, "f2": 0.6314, "mcc": -0.0532, "accuracy": 0.4643, "tp": 37, "fp": 44, "tn": 15, "fn": 16, "aleatoric_mean": 4e-06, "epistemic_mean": 7e-06, "confidence_mean": 1.0, "aleatoric_std": 2e-06, "epistemic_std": 3e-06}, {"fold": "fold_6", "regime": "EUR crisis downturn", "sharpe": 2.2006, "sortino": 3.723, "return_pct": 5.06, "equity": 1050.55, "max_dd": 1.59, "win_rate": 57.94, "profit_factor": 1.449, "ic": 0.1944, "hit": 57.41, "n": 108, "precision": 0.5556, "recall": 0.2128, "f1": 0.3077, "f2": 0.2427, "mcc": 0.1086, "accuracy": 0.5833, "tp": 10, "fp": 8, "tn": 53, "fn": 37, "aleatoric_mean": 3e-06, "epistemic_mean": 6e-06, "confidence_mean": 1.0, "aleatoric_std": 1e-06, "epistemic_std": 2e-06}, {"fold": "fold_7", "regime": "Recent mixed/upturn", "sharpe": 2.0098, "sortino": 3.7224, "return_pct": 4.83, "equity": 1048.33, "max_dd": 1.64, "win_rate": 50.91, "profit_factor": 1.382, "ic": 0.0903, "hit": 50.91, "n": 110, "precision": 0.4928, "recall": 0.6415, "f1": 0.5574, "f2": 0.605, "mcc": 0.0284, "accuracy": 0.5091, "tp": 34, "fp": 35, "tn": 22, "fn": 19, "aleatoric_mean": 6e-06, "epistemic_mean": 1.2e-05, "confidence_mean": 1.0, "aleatoric_std": 2e-06, "epistemic_std": 5e-06}], "train_sharpe": 3.8808, "train_psr": 1.0, "train_equity": 94914.74, "train_sortino": 10.0705, "train_return_pct": 9391.47, "train_max_dd": 3.87, "train_win_rate": 60.62, "train_profit_factor": 2.4, "train_ic": 0.3624, "train_hit": 60.37, "train_precision": 0.5881, "train_recall": 0.7677, "train_f1": 0.666, "train_f2": 0.7235, "train_mcc": 0.2114, "train_accuracy": 0.6041, "train_per_window": [{"fold": "all_train", "regime": "Training data", "sharpe": 3.8808, "sortino": 10.0705, "return_pct": 9391.47, "equity": 94914.74, "max_dd": 3.87, "win_rate": 60.62, "profit_factor": 2.4, "ic": 0.3624, "hit": 60.37, "n": 2478, "precision": 0.5881, "recall": 0.7677, "f1": 0.666, "f2": 0.7235, "mcc": 0.2114, "accuracy": 0.6041, "tp": 978, "fp": 685, "tn": 519, "fn": 296}], "experiment_num": 259, "status": "DISCARD"}
{"backbone": "xlstm", "description": "xlstm: Exp2 seq=60", "config": {"seq_len": 60, "lr": 0.0005, "batch_size": 16, "epochs": 80, "weight_decay": 0.001, "patience": 15, "grad_clip": 1.0, "warmup_epochs": 5, "huber_delta": 1.0, "head_dropout": 0.1, "seed": 42, "het_loss": false}, "composite": -1.7697, "test_pos_folds": 2, "val_pos_folds": 2, "val_loss": 0.000136, "elapsed_sec": 2133.7, "timestamp": "2026-04-21T13:38:59", "sharpe": -0.7697, "psr": 0.1123, "equity": 826.46, "sortino": -1.0993, "return_pct": -17.35, "max_dd": 22.25, "win_rate": 48.63, "profit_factor": 0.879, "ic": -0.0297, "hit": 48.31, "aleatoric_mean": 1.9e-05, "epistemic_mean": 3.8e-05, "confidence_mean": 0.9999, "precision": 0.48, "recall": 0.4258, "f1": 0.4513, "f2": 0.4356, "mcc": -0.0313, "accuracy": 0.4848, "per_window": [{"fold": "fold_1", "regime": "Pre-crisis upturn + GFC onset", "sharpe": -0.2736, "sortino": -0.4913, "return_pct": -0.68, "equity": 993.17, "max_dd": 3.55, "win_rate": 50.0, "profit_factor": 0.959, "ic": -0.1764, "hit": 49.06, "n": 53, "precision": 0.0, "recall": 0.0, "f1": 0.0, "f2": 0.0, "mcc": 0.0, "accuracy": 0.5094, "tp": 0, "fp": 0, "tn": 27, "fn": 26, "aleatoric_mean": 3.9e-05, "epistemic_mean": 7.8e-05, "confidence_mean": 0.9999, "aleatoric_std": 1.9e-05, "epistemic_std": 3.7e-05}, {"fold": "fold_2", "regime": "Post-crash recovery", "sharpe": -2.3468, "sortino": -3.4941, "return_pct": -6.59, "equity": 934.09, "max_dd": 10.33, "win_rate": 42.11, "profit_factor": 0.686, "ic": -0.112, "hit": 42.11, "n": 57, "precision": 0.45, "recall": 0.2903, "f1": 0.3529, "f2": 0.3125, "mcc": -0.1385, "accuracy": 0.4211, "tp": 9, "fp": 11, "tn": 15, "fn": 22, "aleatoric_mean": 2e-05, "epistemic_mean": 4e-05, "confidence_mean": 0.9999, "aleatoric_std": 7e-06, "epistemic_std": 1.4e-05}, {"fold": "fold_3", "regime": "Eurozone debt plateau", "sharpe": -0.1865, "sortino": -0.348, "return_pct": -0.4, "equity": 995.99, "max_dd": 2.81, "win_rate": 44.44, "profit_factor": 0.971, "ic": 0.0164, "hit": 42.86, "n": 56, "precision": 0.5, "recall": 0.3438, "f1": 0.4074, "f2": 0.3667, "mcc": -0.1161, "accuracy": 0.4286, "tp": 11, "fp": 11, "tn": 13, "fn": 21, "aleatoric_mean": 3.1e-05, "epistemic_mean": 6.2e-05, "confidence_mean": 0.9999, "aleatoric_std": 1.4e-05, "epistemic_std": 2.9e-05}, {"fold": "fold_4", "regime": "Strong USD downturn", "sharpe": -0.7819, "sortino": -1.0019, "return_pct": -4.14, "equity": 958.62, "max_dd": 10.27, "win_rate": 48.72, "profit_factor": 0.877, "ic": 0.0248, "hit": 48.31, "n": 118, "precision": 0.4946, "recall": 0.7667, "f1": 0.6013, "f2": 0.6907, "mcc": -0.0534, "accuracy": 0.4831, "tp": 46, "fp": 47, "tn": 11, "fn": 14, "aleatoric_mean": 1.2e-05, "epistemic_mean": 2.4e-05, "confidence_mean": 1.0, "aleatoric_std": 6e-06, "epistemic_std": 1.2e-05}, {"fold": "fold_5", "regime": "Low-vol plateau", "sharpe": 0.3637, "sortino": 0.5229, "return_pct": 0.77, "equity": 1007.65, "max_dd": 3.16, "win_rate": 50.0, "profit_factor": 1.062, "ic": -0.0504, "hit": 50.0, "n": 112, "precision": 0.3529, "recall": 0.1176, "f1": 0.1765, "f2": 0.1357, "mcc": -0.087, "accuracy": 0.5, "tp": 6, "fp": 11, "tn": 50, "fn": 45, "aleatoric_mean": 1e-05, "epistemic_mean": 2e-05, "confidence_mean": 1.0, "aleatoric_std": 4e-06, "epistemic_std": 7e-06}, {"fold": "fold_6", "regime": "EUR crisis downturn", "sharpe": -1.8803, "sortino": -2.9741, "return_pct": -8.27, "equity": 917.26, "max_dd": 11.63, "win_rate": 51.3, "profit_factor": 0.743, "ic": 0.0967, "hit": 51.3, "n": 115, "precision": 0.486, "recall": 0.9811, "f1": 0.65, "f2": 0.815, "mcc": 0.1842, "accuracy": 0.513, "tp": 52, "fp": 55, "tn": 7, "fn": 1, "aleatoric_mean": 2.2e-05, "epistemic_mean": 4.4e-05, "confidence_mean": 0.9999, "aleatoric_std": 1e-05, "epistemic_std": 2e-05}, {"fold": "fold_7", "regime": "Recent mixed/upturn", "sharpe": 0.2749, "sortino": 0.4731, "return_pct": 0.95, "equity": 1009.49, "max_dd": 5.68, "win_rate": 49.11, "profit_factor": 1.048, "ic": 0.1249, "hit": 49.11, "n": 112, "precision": 0.5, "recall": 0.1404, "f1": 0.2192, "f2": 0.1639, "mcc": -0.0073, "accuracy": 0.4911, "tp": 8, "fp": 8, "tn": 47, "fn": 49, "aleatoric_mean": 1.5e-05, "epistemic_mean": 3.1e-05, "confidence_mean": 1.0, "aleatoric_std": 7e-06, "epistemic_std": 1.4e-05}], "val_sharpe": -0.2088, "val_psr": 0.3944, "val_equity": 969.6, "val_sortino": -0.3515, "val_return_pct": -3.04, "val_max_dd": 7.52, "val_win_rate": 46.88, "val_profit_factor": 0.966, "val_ic": 0.0074, "val_hit": 46.65, "val_aleatoric_mean": 1.5e-05, "val_epistemic_mean": 3.1e-05, "val_confidence_mean": 1.0, "val_precision": 0.4623, "val_recall": 0.4757, "val_f1": 0.4689, "val_f2": 0.473, "val_mcc": -0.062, "val_accuracy": 0.4689, "val_per_window": [{"fold": "fold_1", "regime": "Pre-crisis upturn + GFC onset", "sharpe": -1.7724, "sortino": -2.7084, "return_pct": -2.81, "equity": 971.93, "max_dd": 3.52, "win_rate": 48.28, "profit_factor": 0.747, "ic": 0.0049, "hit": 47.46, "n": 59, "precision": 0.5, "recall": 0.0323, "f1": 0.0606, "f2": 0.0397, "mcc": -0.0095, "accuracy": 0.4746, "tp": 1, "fp": 1, "tn": 27, "fn": 30, "aleatoric_mean": 1.5e-05, "epistemic_mean": 3e-05, "confidence_mean": 1.0, "aleatoric_std": 8e-06, "epistemic_std": 1.5e-05}, {"fold": "fold_2", "regime": "Post-crash recovery", "sharpe": -0.067, "sortino": -0.1116, "return_pct": -0.21, "equity": 997.85, "max_dd": 3.71, "win_rate": 46.55, "profit_factor": 0.989, "ic": 0.005, "hit": 46.55, "n": 58, "precision": 0.5, "recall": 0.6129, "f1": 0.5507, "f2": 0.5864, "mcc": -0.0953, "accuracy": 0.4655, "tp": 19, "fp": 19, "tn": 8, "fn": 12, "aleatoric_mean": 2.4e-05, "epistemic_mean": 4.9e-05, "confidence_mean": 0.9999, "aleatoric_std": 1e-05, "epistemic_std": 1.9e-05}, {"fold": "fold_3", "regime": "Eurozone debt plateau", "sharpe": -0.0337, "sortino": -0.063, "return_pct": -0.19, "equity": 998.06, "max_dd": 3.96, "win_rate": 39.34, "profit_factor": 0.994, "ic": -0.0504, "hit": 39.34, "n": 61, "precision": 0.3913, "recall": 0.6667, "f1": 0.4932, "f2": 0.5844, "mcc": -0.1809, "accuracy": 0.3934, "tp": 18, "fp": 28, "tn": 6, "fn": 9, "aleatoric_mean": 1.8e-05, "epistemic_mean": 3.5e-05, "confidence_mean": 0.9999, "aleatoric_std": 7e-06, "epistemic_std": 1.3e-05}, {"fold": "fold_4", "regime": "Strong USD downturn", "sharpe": 0.7892, "sortino": 1.5267, "return_pct": 1.64, "equity": 1016.39, "max_dd": 4.28, "win_rate": 45.0, "profit_factor": 1.129, "ic": -0.0425, "hit": 45.0, "n": 60, "precision": 0.3889, "recall": 0.2414, "f1": 0.2979, "f2": 0.2612, "mcc": -0.1237, "accuracy": 0.45, "tp": 7, "fp": 11, "tn": 20, "fn": 22, "aleatoric_mean": 1.6e-05, "epistemic_mean": 3.2e-05, "confidence_mean": 1.0, "aleatoric_std": 6e-06, "epistemic_std": 1.2e-05}, {"fold": "fold_5", "regime": "Low-vol plateau", "sharpe": 0.2989, "sortino": 0.4686, "return_pct": 0.46, "equity": 1004.59, "max_dd": 3.51, "win_rate": 51.61, "profit_factor": 1.05, "ic": 0.1246, "hit": 51.61, "n": 62, "precision": 0.5179, "recall": 0.9062, "f1": 0.6591, "f2": 0.788, "mcc": 0.0106, "accuracy": 0.5161, "tp": 29, "fp": 27, "tn": 3, "fn": 3, "aleatoric_mean": 9e-06, "epistemic_mean": 1.9e-05, "confidence_mean": 1.0, "aleatoric_std": 3e-06, "epistemic_std": 7e-06}, {"fold": "fold_6", "regime": "EUR crisis downturn", "sharpe": -1.5503, "sortino": -2.2347, "return_pct": -1.62, "equity": 983.79, "max_dd": 2.3, "win_rate": 54.39, "profit_factor": 0.776, "ic": 0.0767, "hit": 53.45, "n": 58, "precision": 0.4, "recall": 0.1667, "f1": 0.2353, "f2": 0.1887, "mcc": -0.0128, "accuracy": 0.5517, "tp": 4, "fp": 6, "tn": 28, "fn": 20, "aleatoric_mean": 8e-06, "epistemic_mean": 1.7e-05, "confidence_mean": 1.0, "aleatoric_std": 3e-06, "epistemic_std": 6e-06}, {"fold": "fold_7", "regime": "Recent mixed/upturn", "sharpe": -0.192, "sortino": -0.3941, "return_pct": -0.28, "equity": 997.2, "max_dd": 2.01, "win_rate": 43.33, "profit_factor": 0.969, "ic": -0.0726, "hit": 43.33, "n": 60, "precision": 0.4762, "recall": 0.625, "f1": 0.5405, "f2": 0.5882, "mcc": -0.175, "accuracy": 0.4333, "tp": 20, "fp": 22, "tn": 6, "fn": 12, "aleatoric_mean": 1.7e-05, "epistemic_mean": 3.5e-05, "confidence_mean": 0.9999, "aleatoric_std": 8e-06, "epistemic_std": 1.6e-05}], "train_sharpe": 1.6625, "train_psr": 1.0, "train_equity": 3115.43, "train_sortino": 4.2414, "train_return_pct": 211.54, "train_max_dd": 7.78, "train_win_rate": 51.93, "train_profit_factor": 1.47, "train_ic": 0.4573, "train_hit": 51.66, "train_precision": 0.8043, "train_recall": 0.1032, "train_f1": 0.1829, "train_f2": 0.125, "train_mcc": 0.1526, "train_accuracy": 0.5217, "train_per_window": [{"fold": "all_train", "regime": "Training data", "sharpe": 1.6625, "sortino": 4.2414, "return_pct": 211.54, "equity": 3115.43, "max_dd": 7.78, "win_rate": 51.93, "profit_factor": 1.47, "ic": 0.4573, "hit": 51.66, "n": 1382, "precision": 0.8043, "recall": 0.1032, "f1": 0.1829, "f2": 0.125, "mcc": 0.1526, "accuracy": 0.5217, "tp": 74, "fp": 18, "tn": 647, "fn": 643}], "experiment_num": 260, "status": "DISCARD"}
