{"backbone": "lfm2-350m", "description": "epochs=30 patience=8 (now wired)", "config": {"seq_len": 60, "lr": 3e-05, "batch_size": 32, "epochs": 30, "weight_decay": 1e-05, "patience": 8, "grad_clip": 1.0, "warmup_epochs": 0, "huber_delta": 1.0, "head_dropout": 0.1}, "composite": 0.7538, "test_pos_folds": 5, "val_pos_folds": 5, "val_loss": 0.000576, "elapsed_sec": 378.0, "timestamp": "2026-04-11T20:25:22", "sharpe": 1.705, "psr": 0.9957, "equity": 1469.51, "sortino": 2.4167, "return_pct": 46.95, "max_dd": 12.01, "win_rate": 56.87, "profit_factor": 1.332, "ic": 0.1555, "hit": 56.5, "per_window": [{"fold": "fold_1", "regime": "Pre-crisis upturn + GFC onset", "sharpe": -1.2366, "sortino": -2.3032, "return_pct": -2.68, "equity": 973.22, "max_dd": 5.07, "win_rate": 46.15, "profit_factor": 0.827, "ic": -0.0173, "hit": 45.28, "n": 53}, {"fold": "fold_2", "regime": "Post-crash recovery", "sharpe": -2.2353, "sortino": -3.5167, "return_pct": -6.3, "equity": 936.98, "max_dd": 10.52, "win_rate": 56.14, "profit_factor": 0.699, "ic": 0.0487, "hit": 56.14, "n": 57}, {"fold": "fold_3", "regime": "Eurozone debt plateau", "sharpe": 3.0559, "sortino": 5.3151, "return_pct": 5.39, "equity": 1053.94, "max_dd": 1.58, "win_rate": 55.56, "profit_factor": 1.628, "ic": 0.1128, "hit": 53.57, "n": 56}, {"fold": "fold_4", "regime": "Strong USD downturn", "sharpe": 3.3874, "sortino": 4.7268, "return_pct": 17.93, "equity": 1179.27, "max_dd": 6.14, "win_rate": 64.96, "profit_factor": 1.769, "ic": 0.2637, "hit": 64.41, "n": 118}, {"fold": "fold_5", "regime": "Low-vol plateau", "sharpe": 1.9068, "sortino": 3.2961, "return_pct": 4.3, "equity": 1042.99, "max_dd": 2.43, "win_rate": 53.57, "profit_factor": 1.374, "ic": 0.1935, "hit": 53.57, "n": 112}, {"fold": "fold_6", "regime": "EUR crisis downturn", "sharpe": 4.3795, "sortino": 7.4261, "return_pct": 20.69, "equity": 1206.85, "max_dd": 3.63, "win_rate": 60.87, "profit_factor": 2.002, "ic": 0.3121, "hit": 60.87, "n": 115}, {"fold": "fold_7", "regime": "Recent mixed/upturn", "sharpe": 0.764, "sortino": 0.9701, "return_pct": 3.01, "equity": 1030.08, "max_dd": 4.44, "win_rate": 53.57, "profit_factor": 1.14, "ic": 0.1289, "hit": 53.57, "n": 112}], "val_sharpe": 1.1538, "val_psr": 0.9312, "val_equity": 1149.58, "val_sortino": 1.7617, "val_return_pct": 14.96, "val_max_dd": 6.41, "val_win_rate": 54.09, "val_profit_factor": 1.212, "val_ic": 0.1453, "val_hit": 53.83, "val_per_window": [{"fold": "fold_1", "regime": "Pre-crisis upturn + GFC onset", "sharpe": 1.5061, "sortino": 2.3984, "return_pct": 2.35, "equity": 1023.51, "max_dd": 3.04, "win_rate": 51.72, "profit_factor": 1.282, "ic": 0.0825, "hit": 50.85, "n": 59}, {"fold": "fold_2", "regime": "Post-crash recovery", "sharpe": 0.4286, "sortino": 0.7098, "return_pct": 0.76, "equity": 1007.6, "max_dd": 3.25, "win_rate": 55.17, "profit_factor": 1.072, "ic": 0.0321, "hit": 55.17, "n": 58}, {"fold": "fold_3", "regime": "Eurozone debt plateau", "sharpe": 6.317, "sortino": 13.1721, "return_pct": 14.75, "equity": 1147.48, "max_dd": 1.9, "win_rate": 65.57, "profit_factor": 2.914, "ic": 0.3416, "hit": 65.57, "n": 61}, {"fold": "fold_4", "regime": "Strong USD downturn", "sharpe": -2.1024, "sortino": -2.9986, "return_pct": -4.56, "equity": 954.42, "max_dd": 5.57, "win_rate": 50.0, "profit_factor": 0.724, "ic": 0.1458, "hit": 50.0, "n": 60}, {"fold": "fold_5", "regime": "Low-vol plateau", "sharpe": 0.6395, "sortino": 1.0023, "return_pct": 1.05, "equity": 1010.54, "max_dd": 5.97, "win_rate": 51.61, "profit_factor": 1.109, "ic": 0.1361, "hit": 51.61, "n": 62}, {"fold": "fold_6", "regime": "EUR crisis downturn", "sharpe": 1.1403, "sortino": 1.6649, "return_pct": 1.17, "equity": 1011.7, "max_dd": 1.69, "win_rate": 57.89, "profit_factor": 1.206, "ic": 0.2149, "hit": 56.9, "n": 58}, {"fold": "fold_7", "regime": "Recent mixed/upturn", "sharpe": -0.3209, "sortino": -0.458, "return_pct": -0.44, "equity": 995.56, "max_dd": 2.62, "win_rate": 46.67, "profit_factor": 0.949, "ic": 0.07, "hit": 46.67, "n": 60}], "train_sharpe": 2.9598, "train_psr": 1.0, "train_equity": 7639.19, "train_sortino": 7.2898, "train_return_pct": 663.92, "train_max_dd": 6.83, "train_win_rate": 60.58, "train_profit_factor": 2.006, "train_ic": 0.2815, "train_hit": 60.27, "train_per_window": [{"fold": "all_train", "regime": "Training data", "sharpe": 2.9598, "sortino": 7.2898, "return_pct": 663.92, "equity": 7639.19, "max_dd": 6.83, "win_rate": 60.58, "profit_factor": 2.006, "ic": 0.2815, "hit": 60.27, "n": 1382}], "experiment_num": 19, "status": "DISCARD"}
{"backbone": "lfm2-350m", "description": "lr=2e-5 fine-grained search", "config": {"seq_len": 60, "lr": 2e-05, "batch_size": 32, "epochs": 20, "weight_decay": 1e-05, "patience": 5, "grad_clip": 1.0, "warmup_epochs": 0, "huber_delta": 1.0, "head_dropout": 0.1}, "composite": 1.7653, "test_pos_folds": 6, "val_pos_folds": 5, "val_loss": 0.001429, "elapsed_sec": 320.1, "timestamp": "2026-04-11T20:31:06", "sharpe": 2.0653, "psr": 0.9995, "equity": 1595.74, "sortino": 3.3492, "return_pct": 59.57, "max_dd": 7.39, "win_rate": 55.74, "profit_factor": 1.415, "ic": 0.1284, "hit": 55.38, "per_window": [{"fold": "fold_1", "regime": "Pre-crisis upturn + GFC onset", "sharpe": -0.5224, "sortino": -0.8497, "return_pct": -1.2, "equity": 987.96, "max_dd": 5.74, "win_rate": 46.15, "profit_factor": 0.923, "ic": 0.0826, "hit": 45.28, "n": 53}, {"fold": "fold_2", "regime": "Post-crash recovery", "sharpe": 0.3264, "sortino": 0.5518, "return_pct": 0.76, "equity": 1007.55, "max_dd": 6.52, "win_rate": 52.63, "profit_factor": 1.054, "ic": 0.0926, "hit": 52.63, "n": 57}, {"fold": "fold_3", "regime": "Eurozone debt plateau", "sharpe": 3.77, "sortino": 7.1535, "return_pct": 6.65, "equity": 1066.49, "max_dd": 1.43, "win_rate": 55.56, "profit_factor": 1.826, "ic": 0.005, "hit": 53.57, "n": 56}, {"fold": "fold_4", "regime": "Strong USD downturn", "sharpe": 2.224, "sortino": 3.9083, "return_pct": 11.48, "equity": 1114.85, "max_dd": 4.29, "win_rate": 55.56, "profit_factor": 1.453, "ic": 0.1297, "hit": 55.08, "n": 118}, {"fold": "fold_5", "regime": "Low-vol plateau", "sharpe": 3.2889, "sortino": 4.706, "return_pct": 7.47, "equity": 1074.65, "max_dd": 1.58, "win_rate": 59.82, "profit_factor": 1.731, "ic": 0.1594, "hit": 59.82, "n": 112}, {"fold": "fold_6", "regime": "EUR crisis downturn", "sharpe": 3.8378, "sortino": 6.7647, "return_pct": 18.04, "equity": 1180.42, "max_dd": 4.27, "win_rate": 58.26, "profit_factor": 1.837, "ic": 0.1446, "hit": 58.26, "n": 115}, {"fold": "fold_7", "regime": "Recent mixed/upturn", "sharpe": 1.5273, "sortino": 2.7408, "return_pct": 6.29, "equity": 1062.87, "max_dd": 3.62, "win_rate": 55.36, "profit_factor": 1.299, "ic": 0.1658, "hit": 55.36, "n": 112}], "val_sharpe": 2.2962, "val_psr": 0.9986, "val_equity": 1322.98, "val_sortino": 3.7878, "val_return_pct": 32.3, "val_max_dd": 8.08, "val_win_rate": 56.49, "val_profit_factor": 1.467, "val_ic": 0.1649, "val_hit": 56.22, "val_per_window": [{"fold": "fold_1", "regime": "Pre-crisis upturn + GFC onset", "sharpe": -0.7895, "sortino": -1.3199, "return_pct": -1.3, "equity": 987.04, "max_dd": 4.58, "win_rate": 51.72, "profit_factor": 0.878, "ic": -0.0461, "hit": 50.85, "n": 59}, {"fold": "fold_2", "regime": "Post-crash recovery", "sharpe": -0.3084, "sortino": -0.4582, "return_pct": -0.69, "equity": 993.14, "max_dd": 2.42, "win_rate": 51.72, "profit_factor": 0.951, "ic": -0.0557, "hit": 51.72, "n": 58}, {"fold": "fold_3", "regime": "Eurozone debt plateau", "sharpe": 4.4355, "sortino": 9.407, "return_pct": 10.5, "equity": 1104.97, "max_dd": 1.8, "win_rate": 57.38, "profit_factor": 2.105, "ic": 0.4121, "hit": 57.38, "n": 61}, {"fold": "fold_4", "regime": "Strong USD downturn", "sharpe": 5.0886, "sortino": 9.5585, "return_pct": 11.08, "equity": 1110.83, "max_dd": 1.66, "win_rate": 70.0, "profit_factor": 2.183, "ic": 0.3684, "hit": 70.0, "n": 60}, {"fold": "fold_5", "regime": "Low-vol plateau", "sharpe": 4.3605, "sortino": 7.2858, "return_pct": 7.51, "equity": 1075.12, "max_dd": 1.5, "win_rate": 59.68, "profit_factor": 2.034, "ic": 0.4156, "hit": 59.68, "n": 62}, {"fold": "fold_6", "regime": "EUR crisis downturn", "sharpe": 0.4904, "sortino": 0.7407, "return_pct": 0.49, "equity": 1004.89, "max_dd": 1.6, "win_rate": 54.39, "profit_factor": 1.084, "ic": 0.1076, "hit": 53.45, "n": 58}, {"fold": "fold_7", "regime": "Recent mixed/upturn", "sharpe": 1.4069, "sortino": 2.0465, "return_pct": 1.77, "equity": 1017.74, "max_dd": 1.64, "win_rate": 50.0, "profit_factor": 1.258, "ic": 0.0385, "hit": 50.0, "n": 60}], "train_sharpe": 1.8404, "train_psr": 1.0, "train_equity": 3529.37, "train_sortino": 4.229, "train_return_pct": 252.94, "train_max_dd": 5.7, "train_win_rate": 54.47, "train_profit_factor": 1.533, "train_ic": 0.1439, "train_hit": 54.2, "train_per_window": [{"fold": "all_train", "regime": "Training data", "sharpe": 1.8404, "sortino": 4.229, "return_pct": 252.94, "equity": 3529.37, "max_dd": 5.7, "win_rate": 54.47, "profit_factor": 1.533, "ic": 0.1439, "hit": 54.2, "n": 1382}], "experiment_num": 20, "status": "KEEP"}
{"backbone": "lfm2-350m", "description": "uncertainty-aware champion re-train", "config": {"seq_len": 60, "lr": 2e-05, "batch_size": 32, "epochs": 20, "weight_decay": 1e-05, "patience": 5, "grad_clip": 1.0, "warmup_epochs": 0, "huber_delta": 1.0, "head_dropout": 0.1}, "composite": 0.4204, "test_pos_folds": 4, "val_pos_folds": 5, "val_loss": -1.285066, "elapsed_sec": 455.4, "timestamp": "2026-04-12T08:07:32", "sharpe": 1.5276, "psr": 0.9922, "equity": 1410.78, "sortino": 2.4652, "return_pct": 41.08, "max_dd": 9.74, "win_rate": 53.15, "profit_factor": 1.293, "ic": 0.1322, "hit": 52.81, "aleatoric_mean": 0.222578, "epistemic_mean": 0.008614, "confidence_mean": 0.8372, "per_window": [{"fold": "fold_1", "regime": "Pre-crisis upturn + GFC onset", "sharpe": -0.4807, "sortino": -0.8809, "return_pct": -1.12, "equity": 988.83, "max_dd": 4.73, "win_rate": 50.0, "profit_factor": 0.929, "ic": 0.1025, "hit": 49.06, "n": 53, "aleatoric_mean": 0.416323, "epistemic_mean": 0.006341, "confidence_mean": 0.7164, "aleatoric_std": 0.206244, "epistemic_std": 0.002911}, {"fold": "fold_2", "regime": "Post-crash recovery", "sharpe": -1.6023, "sortino": -2.6699, "return_pct": -4.63, "equity": 953.72, "max_dd": 6.53, "win_rate": 43.86, "profit_factor": 0.773, "ic": 0.0074, "hit": 43.86, "n": 57, "aleatoric_mean": 0.603855, "epistemic_mean": 0.006693, "confidence_mean": 0.6545, "aleatoric_std": 0.396171, "epistemic_std": 0.002906}, {"fold": "fold_3", "regime": "Eurozone debt plateau", "sharpe": 0.1749, "sortino": 0.2897, "return_pct": 0.24, "equity": 1002.4, "max_dd": 4.03, "win_rate": 44.44, "profit_factor": 1.028, "ic": -0.0078, "hit": 42.86, "n": 56, "aleatoric_mean": 0.250043, "epistemic_mean": 0.007353, "confidence_mean": 0.8052, "aleatoric_std": 0.144997, "epistemic_std": 0.003641}, {"fold": "fold_4", "regime": "Strong USD downturn", "sharpe": 2.4922, "sortino": 3.8606, "return_pct": 12.96, "equity": 1129.58, "max_dd": 6.31, "win_rate": 59.83, "profit_factor": 1.52, "ic": 0.1503, "hit": 59.32, "n": 118, "aleatoric_mean": 0.170939, "epistemic_mean": 0.009031, "confidence_mean": 0.8589, "aleatoric_std": 0.155083, "epistemic_std": 0.004473}, {"fold": "fold_5", "regime": "Low-vol plateau", "sharpe": -0.4829, "sortino": -0.7807, "return_pct": -1.14, "equity": 988.62, "max_dd": 4.25, "win_rate": 47.32, "profit_factor": 0.923, "ic": 0.0428, "hit": 47.32, "n": 112, "aleatoric_mean": 0.049067, "epistemic_mean": 0.01237, "confidence_mean": 0.944, "aleatoric_std": 0.052975, "epistemic_std": 0.005241}, {"fold": "fold_6", "regime": "EUR crisis downturn", "sharpe": 5.2245, "sortino": 9.2846, "return_pct": 24.78, "equity": 1247.82, "max_dd": 3.24, "win_rate": 63.48, "profit_factor": 2.291, "ic": 0.4161, "hit": 63.48, "n": 115, "aleatoric_mean": 0.291563, "epistemic_mean": 0.005937, "confidence_mean": 0.7886, "aleatoric_std": 0.218258, "epistemic_std": 0.003132}, {"fold": "fold_7", "regime": "Recent mixed/upturn", "sharpe": 1.7138, "sortino": 3.0316, "return_pct": 7.1, "equity": 1070.97, "max_dd": 3.9, "win_rate": 51.79, "profit_factor": 1.342, "ic": 0.1273, "hit": 51.79, "n": 112, "aleatoric_mean": 0.080206, "epistemic_mean": 0.009854, "confidence_mean": 0.9234, "aleatoric_std": 0.1053, "epistemic_std": 0.004303}], "val_sharpe": 0.9204, "val_psr": 0.8833, "val_equity": 1116.67, "val_sortino": 1.5204, "val_return_pct": 11.67, "val_max_dd": 5.38, "val_win_rate": 51.68, "val_profit_factor": 1.166, "val_ic": 0.0726, "val_hit": 51.44, "val_aleatoric_mean": 0.156598, "val_epistemic_mean": 0.010146, "val_confidence_mean": 0.8764, "val_per_window": [{"fold": "fold_1", "regime": "Pre-crisis upturn + GFC onset", "sharpe": -0.816, "sortino": -1.2942, "return_pct": -1.34, "equity": 986.63, "max_dd": 3.03, "win_rate": 44.83, "profit_factor": 0.874, "ic": -0.1111, "hit": 44.07, "n": 59, "aleatoric_mean": 0.328502, "epistemic_mean": 0.00922, "confidence_mean": 0.7907, "aleatoric_std": 0.349545, "epistemic_std": 0.005569}, {"fold": "fold_2", "regime": "Post-crash recovery", "sharpe": 2.4774, "sortino": 4.3114, "return_pct": 4.83, "equity": 1048.32, "max_dd": 4.43, "win_rate": 55.17, "profit_factor": 1.494, "ic": 0.2202, "hit": 55.17, "n": 58, "aleatoric_mean": 0.291846, "epistemic_mean": 0.007081, "confidence_mean": 0.7865, "aleatoric_std": 0.215198, "epistemic_std": 0.003141}, {"fold": "fold_3", "regime": "Eurozone debt plateau", "sharpe": 2.0566, "sortino": 4.0509, "return_pct": 4.82, "equity": 1048.18, "max_dd": 5.36, "win_rate": 55.74, "profit_factor": 1.409, "ic": 0.1424, "hit": 55.74, "n": 61, "aleatoric_mean": 0.124816, "epistemic_mean": 0.011841, "confidence_mean": 0.8866, "aleatoric_std": 0.106798, "epistemic_std": 0.006493}, {"fold": "fold_4", "regime": "Strong USD downturn", "sharpe": 0.6531, "sortino": 1.1152, "return_pct": 1.34, "equity": 1013.37, "max_dd": 3.1, "win_rate": 51.67, "profit_factor": 1.105, "ic": 0.1571, "hit": 51.67, "n": 60, "aleatoric_mean": 0.148319, "epistemic_mean": 0.008299, "confidence_mean": 0.8738, "aleatoric_std": 0.134918, "epistemic_std": 0.004058}, {"fold": "fold_5", "regime": "Low-vol plateau", "sharpe": -0.4093, "sortino": -0.655, "return_pct": -0.77, "equity": 992.31, "max_dd": 3.47, "win_rate": 45.16, "profit_factor": 0.936, "ic": -0.1331, "hit": 45.16, "n": 62, "aleatoric_mean": 0.049105, "epistemic_mean": 0.012594, "confidence_mean": 0.9433, "aleatoric_std": 0.0448, "epistemic_std": 0.006305}, {"fold": "fold_6", "regime": "EUR crisis downturn", "sharpe": 1.4667, "sortino": 3.1794, "return_pct": 1.51, "equity": 1015.12, "max_dd": 2.51, "win_rate": 52.63, "profit_factor": 1.272, "ic": 0.0604, "hit": 51.72, "n": 58, "aleatoric_mean": 0.026722, "epistemic_mean": 0.013162, "confidence_mean": 0.962, "aleatoric_std": 0.022844, "epistemic_std": 0.004793}, {"fold": "fold_7", "regime": "Recent mixed/upturn", "sharpe": 0.7313, "sortino": 1.0121, "return_pct": 0.9, "equity": 1009.04, "max_dd": 2.82, "win_rate": 56.67, "profit_factor": 1.127, "ic": 0.2507, "hit": 56.67, "n": 60, "aleatoric_mean": 0.134029, "epistemic_mean": 0.0087, "confidence_mean": 0.8878, "aleatoric_std": 0.168798, "epistemic_std": 0.004191}], "train_sharpe": 1.3195, "train_psr": 0.9988, "train_equity": 2442.68, "train_sortino": 1.7119, "train_return_pct": 144.27, "train_max_dd": 15.51, "train_win_rate": 55.05, "train_profit_factor": 1.356, "train_ic": 0.1376, "train_hit": 54.78, "train_per_window": [{"fold": "all_train", "regime": "Training data", "sharpe": 1.3195, "sortino": 1.7119, "return_pct": 144.27, "equity": 2442.68, "max_dd": 15.51, "win_rate": 55.05, "profit_factor": 1.356, "ic": 0.1376, "hit": 54.78, "n": 1382}], "experiment_num": 21, "status": "DISCARD"}
{"backbone": "lfm2-350m", "description": "lr=2e-5 fine-grained search", "config": {"seq_len": 60, "lr": 2e-05, "batch_size": 32, "epochs": 20, "weight_decay": 1e-05, "patience": 5, "grad_clip": 1.0, "warmup_epochs": 0, "huber_delta": 1.0, "head_dropout": 0.1}, "composite": -1.5259, "test_pos_folds": 6, "val_pos_folds": 2, "val_loss": 0.001275, "elapsed_sec": 40679.0, "timestamp": "2026-04-12T08:26:20", "sharpe": 1.2047, "psr": 0.9694, "equity": 1309.37, "sortino": 1.7744, "return_pct": 30.94, "max_dd": 6.56, "win_rate": 53.96, "profit_factor": 1.224, "ic": 0.0848, "hit": 53.61, "per_window": [{"fold": "fold_1", "regime": "Pre-crisis upturn + GFC onset", "sharpe": 0.7641, "sortino": 1.3112, "return_pct": 1.52, "equity": 1015.2, "max_dd": 3.8, "win_rate": 51.92, "profit_factor": 1.124, "ic": 0.1942, "hit": 50.94, "n": 53}, {"fold": "fold_2", "regime": "Post-crash recovery", "sharpe": -0.5722, "sortino": -0.822, "return_pct": -1.8, "equity": 982.01, "max_dd": 5.18, "win_rate": 57.89, "profit_factor": 0.912, "ic": 0.1283, "hit": 57.89, "n": 57}, {"fold": "fold_3", "regime": "Eurozone debt plateau", "sharpe": 0.8877, "sortino": 1.5836, "return_pct": 1.51, "equity": 1015.13, "max_dd": 3.12, "win_rate": 55.56, "profit_factor": 1.152, "ic": -0.0847, "hit": 53.57, "n": 56}, {"fold": "fold_4", "regime": "Strong USD downturn", "sharpe": 1.0018, "sortino": 1.6644, "return_pct": 4.9, "equity": 1049.02, "max_dd": 5.42, "win_rate": 47.01, "profit_factor": 1.183, "ic": 0.0658, "hit": 46.61, "n": 118}, {"fold": "fold_5", "regime": "Low-vol plateau", "sharpe": 1.7814, "sortino": 2.898, "return_pct": 4.01, "equity": 1040.1, "max_dd": 2.78, "win_rate": 55.36, "profit_factor": 1.345, "ic": 0.1391, "hit": 55.36, "n": 112}, {"fold": "fold_6", "regime": "EUR crisis downturn", "sharpe": 1.3228, "sortino": 2.3746, "return_pct": 5.88, "equity": 1058.85, "max_dd": 4.53, "win_rate": 54.78, "profit_factor": 1.233, "ic": 0.0558, "hit": 54.78, "n": 115}, {"fold": "fold_7", "regime": "Recent mixed/upturn", "sharpe": 2.8284, "sortino": 3.6181, "return_pct": 11.99, "equity": 1119.91, "max_dd": 3.04, "win_rate": 57.14, "profit_factor": 1.626, "ic": 0.3038, "hit": 57.14, "n": 112}], "val_sharpe": -0.9259, "val_psr": 0.1164, "val_equity": 886.49, "val_sortino": -1.379, "val_return_pct": -11.35, "val_max_dd": 16.66, "val_win_rate": 46.88, "val_profit_factor": 0.857, "val_ic": -0.0198, "val_hit": 46.65, "val_per_window": [{"fold": "fold_1", "regime": "Pre-crisis upturn + GFC onset", "sharpe": -3.3428, "sortino": -4.9938, "return_pct": -5.11, "equity": 948.94, "max_dd": 5.95, "win_rate": 39.66, "profit_factor": 0.576, "ic": -0.1503, "hit": 38.98, "n": 59}, {"fold": "fold_2", "regime": "Post-crash recovery", "sharpe": 1.1362, "sortino": 1.73, "return_pct": 2.16, "equity": 1021.63, "max_dd": 2.18, "win_rate": 53.45, "profit_factor": 1.202, "ic": 0.0863, "hit": 53.45, "n": 58}, {"fold": "fold_3", "regime": "Eurozone debt plateau", "sharpe": -1.5326, "sortino": -2.3024, "return_pct": -3.65, "equity": 963.48, "max_dd": 8.8, "win_rate": 49.18, "profit_factor": 0.774, "ic": 0.0735, "hit": 49.18, "n": 61}, {"fold": "fold_4", "regime": "Strong USD downturn", "sharpe": -2.3316, "sortino": -3.7828, "return_pct": -5.02, "equity": 949.78, "max_dd": 5.82, "win_rate": 43.33, "profit_factor": 0.699, "ic": -0.0179, "hit": 43.33, "n": 60}, {"fold": "fold_5", "regime": "Low-vol plateau", "sharpe": -1.7544, "sortino": -2.7943, "return_pct": -3.04, "equity": 969.57, "max_dd": 3.49, "win_rate": 43.55, "profit_factor": 0.752, "ic": -0.1932, "hit": 43.55, "n": 62}, {"fold": "fold_6", "regime": "EUR crisis downturn", "sharpe": -0.3629, "sortino": -0.5895, "return_pct": -0.4, "equity": 995.99, "max_dd": 2.82, "win_rate": 47.37, "profit_factor": 0.942, "ic": -0.2005, "hit": 46.55, "n": 58}, {"fold": "fold_7", "regime": "Recent mixed/upturn", "sharpe": 2.738, "sortino": 5.8672, "return_pct": 3.48, "equity": 1034.77, "max_dd": 1.78, "win_rate": 51.67, "profit_factor": 1.564, "ic": 0.143, "hit": 51.67, "n": 60}], "train_sharpe": 1.4144, "train_psr": 1.0, "train_equity": 2616.01, "train_sortino": 3.1786, "train_return_pct": 161.6, "train_max_dd": 10.11, "train_win_rate": 53.67, "train_profit_factor": 1.387, "train_ic": 0.1365, "train_hit": 53.4, "train_per_window": [{"fold": "all_train", "regime": "Training data", "sharpe": 1.4144, "sortino": 3.1786, "return_pct": 161.6, "equity": 2616.01, "max_dd": 10.11, "win_rate": 53.67, "profit_factor": 1.387, "ic": 0.1365, "hit": 53.4, "n": 1382}], "experiment_num": 22, "status": "DISCARD"}
