{"backbone": "mamba", "description": "mamba: Exp6 dmamba d_state=8 (half state regularise, Cai 2024)", "config": {"seq_len": 10, "lr": 0.0005, "batch_size": 32, "epochs": 100, "weight_decay": 0.1, "patience": 20, "grad_clip": 1.0, "warmup_epochs": 10, "huber_delta": 1.0, "head_dropout": 0.1, "seed": 42, "mamba_variant": "dmamba", "mamba_d_state": 8, "het_loss": false}, "composite": 4.5319, "test_pos_folds": 6, "val_pos_folds": 7, "val_loss": 3.6e-05, "elapsed_sec": 297.2, "timestamp": "2026-04-20T00:56:00", "sharpe": 4.6319, "psr": 1.0, "equity": 6287.67, "sortino": 5.7957, "return_pct": 528.77, "max_dd": 7.54, "win_rate": 65.84, "profit_factor": 2.394, "ic": 0.3932, "hit": 65.57, "aleatoric_mean": 3.2e-05, "epistemic_mean": 6.4e-05, "confidence_mean": 0.9999, "precision": 0.6423, "recall": 0.6944, "f1": 0.6673, "f2": 0.6833, "mcc": 0.3171, "accuracy": 0.6578, "per_window": [{"fold": "fold_1", "regime": "Pre-crisis upturn + GFC onset", "sharpe": -0.026, "sortino": -0.0297, "return_pct": -0.93, "equity": 990.71, "max_dd": 7.54, "win_rate": 49.02, "profit_factor": 0.994, "ic": 0.0337, "hit": 48.54, "n": 103, "precision": 0.5, "recall": 0.3585, "f1": 0.4176, "f2": 0.38, "mcc": -0.0223, "accuracy": 0.4854, "tp": 19, "fp": 19, "tn": 31, "fn": 34, "aleatoric_mean": 5e-05, "epistemic_mean": 9.9e-05, "confidence_mean": 0.9999, "aleatoric_std": 2.8e-05, "epistemic_std": 5.5e-05}, {"fold": "fold_2", "regime": "Post-crash recovery", "sharpe": 1.9302, "sortino": 3.6114, "return_pct": 9.34, "equity": 1093.38, "max_dd": 4.07, "win_rate": 51.4, "profit_factor": 1.353, "ic": 0.0913, "hit": 51.4, "n": 107, "precision": 0.4915, "recall": 0.5686, "f1": 0.5273, "f2": 0.5513, "mcc": 0.0331, "accuracy": 0.514, "tp": 29, "fp": 30, "tn": 26, "fn": 22, "aleatoric_mean": 4.7e-05, "epistemic_mean": 9.4e-05, "confidence_mean": 0.9999, "aleatoric_std": 3e-05, "epistemic_std": 6.1e-05}, {"fold": "fold_3", "regime": "Eurozone debt plateau", "sharpe": 5.0027, "sortino": 8.3614, "return_pct": 18.28, "equity": 1182.8, "max_dd": 1.6, "win_rate": 66.35, "profit_factor": 2.197, "ic": 0.5329, "hit": 65.09, "n": 106, "precision": 0.6364, "recall": 0.8596, "f1": 0.7313, "f2": 0.8033, "mcc": 0.3223, "accuracy": 0.6604, "tp": 49, "fp": 28, "tn": 21, "fn": 8, "aleatoric_mean": 4.7e-05, "epistemic_mean": 9.3e-05, "confidence_mean": 0.9999, "aleatoric_std": 2.6e-05, "epistemic_std": 5.3e-05}, {"fold": "fold_4", "regime": "Strong USD downturn", "sharpe": 6.1482, "sortino": 10.6236, "return_pct": 55.52, "equity": 1555.21, "max_dd": 4.41, "win_rate": 66.47, "profit_factor": 2.857, "ic": 0.4729, "hit": 66.07, "n": 168, "precision": 0.6667, "recall": 0.6977, "f1": 0.6818, "f2": 0.6912, "mcc": 0.3326, "accuracy": 0.6667, "tp": 60, "fp": 30, "tn": 52, "fn": 26, "aleatoric_mean": 3.3e-05, "epistemic_mean": 6.6e-05, "confidence_mean": 0.9999, "aleatoric_std": 1.8e-05, "epistemic_std": 3.6e-05}, {"fold": "fold_5", "regime": "Low-vol plateau", "sharpe": 8.5504, "sortino": 18.8082, "return_pct": 28.41, "equity": 1284.11, "max_dd": 0.86, "win_rate": 70.37, "profit_factor": 4.349, "ic": 0.5821, "hit": 70.37, "n": 162, "precision": 0.6458, "recall": 0.8158, "f1": 0.7209, "f2": 0.775, "mcc": 0.427, "accuracy": 0.7037, "tp": 62, "fp": 34, "tn": 52, "fn": 14, "aleatoric_mean": 1.3e-05, "epistemic_mean": 2.6e-05, "confidence_mean": 1.0, "aleatoric_std": 8e-06, "epistemic_std": 1.6e-05}, {"fold": "fold_6", "regime": "EUR crisis downturn", "sharpe": 9.9095, "sortino": 18.4217, "return_pct": 69.29, "equity": 1692.89, "max_dd": 1.76, "win_rate": 75.15, "profit_factor": 5.233, "ic": 0.6356, "hit": 75.15, "n": 165, "precision": 0.7045, "recall": 0.8052, "f1": 0.7515, "f2": 0.7828, "mcc": 0.5097, "accuracy": 0.7515, "tp": 62, "fp": 26, "tn": 62, "fn": 15, "aleatoric_mean": 3.2e-05, "epistemic_mean": 6.3e-05, "confidence_mean": 0.9999, "aleatoric_std": 1.8e-05, "epistemic_std": 3.6e-05}, {"fold": "fold_7", "regime": "Recent mixed/upturn", "sharpe": 6.8582, "sortino": 12.0982, "return_pct": 45.16, "equity": 1451.57, "max_dd": 1.8, "win_rate": 70.99, "profit_factor": 3.271, "ic": 0.5537, "hit": 70.99, "n": 162, "precision": 0.7361, "recall": 0.6543, "f1": 0.6928, "f2": 0.6692, "mcc": 0.4224, "accuracy": 0.7099, "tp": 53, "fp": 19, "tn": 62, "fn": 28, "aleatoric_mean": 1.9e-05, "epistemic_mean": 3.8e-05, "confidence_mean": 0.9999, "aleatoric_std": 1.3e-05, "epistemic_std": 2.6e-05}], "val_sharpe": 4.8315, "val_psr": 1.0, "val_equity": 2970.06, "val_sortino": 8.0593, "val_return_pct": 197.01, "val_max_dd": 7.31, "val_win_rate": 61.86, "val_profit_factor": 2.281, "val_ic": 0.3816, "val_hit": 61.46, "val_aleatoric_mean": 2.3e-05, "val_epistemic_mean": 4.7e-05, "val_confidence_mean": 0.9999, "val_precision": 0.5763, "val_recall": 0.7342, "val_f1": 0.6458, "val_f2": 0.6961, "val_mcc": 0.2508, "val_accuracy": 0.6172, "val_per_window": [{"fold": "fold_1", "regime": "Pre-crisis upturn + GFC onset", "sharpe": 0.015, "sortino": 0.0259, "return_pct": -0.04, "equity": 999.64, "max_dd": 3.31, "win_rate": 49.07, "profit_factor": 1.002, "ic": -0.006, "hit": 48.62, "n": 109, "precision": 0.4941, "recall": 0.7636, "f1": 0.6, "f2": 0.6885, "mcc": -0.0394, "accuracy": 0.4862, "tp": 42, "fp": 43, "tn": 11, "fn": 13, "aleatoric_mean": 2.5e-05, "epistemic_mean": 4.9e-05, "confidence_mean": 0.9999, "aleatoric_std": 3.2e-05, "epistemic_std": 6.4e-05}, {"fold": "fold_2", "regime": "Post-crash recovery", "sharpe": 1.2679, "sortino": 2.0401, "return_pct": 6.04, "equity": 1060.37, "max_dd": 7.31, "win_rate": 50.93, "profit_factor": 1.222, "ic": 0.1197, "hit": 50.93, "n": 108, "precision": 0.6923, "recall": 0.2857, "f1": 0.4045, "f2": 0.3237, "mcc": 0.1245, "accuracy": 0.5093, "tp": 18, "fp": 8, "tn": 37, "fn": 45, "aleatoric_mean": 4.7e-05, "epistemic_mean": 9.3e-05, "confidence_mean": 0.9999, "aleatoric_std": 2.1e-05, "epistemic_std": 4.2e-05}, {"fold": "fold_3", "regime": "Eurozone debt plateau", "sharpe": 9.2418, "sortino": 23.8099, "return_pct": 37.88, "equity": 1378.84, "max_dd": 1.58, "win_rate": 71.56, "profit_factor": 4.679, "ic": 0.6169, "hit": 70.27, "n": 111, "precision": 0.6154, "recall": 0.8511, "f1": 0.7143, "f2": 0.7905, "mcc": 0.4618, "accuracy": 0.7117, "tp": 40, "fp": 25, "tn": 39, "fn": 7, "aleatoric_mean": 3.1e-05, "epistemic_mean": 6.1e-05, "confidence_mean": 0.9999, "aleatoric_std": 1.6e-05, "epistemic_std": 3.1e-05}, {"fold": "fold_4", "regime": "Strong USD downturn", "sharpe": 5.5093, "sortino": 10.9642, "return_pct": 19.67, "equity": 1196.66, "max_dd": 2.6, "win_rate": 66.06, "profit_factor": 2.511, "ic": 0.6561, "hit": 65.45, "n": 110, "precision": 0.5641, "recall": 0.9362, "f1": 0.704, "f2": 0.8271, "mcc": 0.4318, "accuracy": 0.6636, "tp": 44, "fp": 34, "tn": 29, "fn": 3, "aleatoric_mean": 2.2e-05, "epistemic_mean": 4.3e-05, "confidence_mean": 0.9999, "aleatoric_std": 2e-05, "epistemic_std": 4e-05}, {"fold": "fold_5", "regime": "Low-vol plateau", "sharpe": 7.4037, "sortino": 17.6914, "return_pct": 24.95, "equity": 1249.5, "max_dd": 1.24, "win_rate": 66.07, "profit_factor": 3.519, "ic": 0.5118, "hit": 66.07, "n": 112, "precision": 0.6316, "recall": 0.6792, "f1": 0.6545, "f2": 0.6691, "mcc": 0.3229, "accuracy": 0.6607, "tp": 36, "fp": 21, "tn": 38, "fn": 17, "aleatoric_mean": 1.5e-05, "epistemic_mean": 2.9e-05, "confidence_mean": 1.0, "aleatoric_std": 1e-05, "epistemic_std": 2.1e-05}, {"fold": "fold_6", "regime": "EUR crisis downturn", "sharpe": 10.3253, "sortino": 27.8204, "return_pct": 21.85, "equity": 1218.52, "max_dd": 0.77, "win_rate": 71.03, "profit_factor": 6.355, "ic": 0.6525, "hit": 70.37, "n": 108, "precision": 0.623, "recall": 0.8085, "f1": 0.7037, "f2": 0.7631, "mcc": 0.4315, "accuracy": 0.7037, "tp": 38, "fp": 23, "tn": 38, "fn": 9, "aleatoric_mean": 1.1e-05, "epistemic_mean": 2.1e-05, "confidence_mean": 1.0, "aleatoric_std": 4e-06, "epistemic_std": 8e-06}, {"fold": "fold_7", "regime": "Recent mixed/upturn", "sharpe": 4.779, "sortino": 10.2143, "return_pct": 11.54, "equity": 1115.35, "max_dd": 1.78, "win_rate": 58.18, "profit_factor": 2.163, "ic": 0.4422, "hit": 58.18, "n": 110, "precision": 0.5376, "recall": 0.9434, "f1": 0.6849, "f2": 0.8197, "mcc": 0.2613, "accuracy": 0.5818, "tp": 50, "fp": 43, "tn": 14, "fn": 3, "aleatoric_mean": 1.4e-05, "epistemic_mean": 2.9e-05, "confidence_mean": 1.0, "aleatoric_std": 9e-06, "epistemic_std": 1.7e-05}], "train_sharpe": 7.0288, "train_psr": 1.0, "train_equity": 2475370.5, "train_sortino": 18.3359, "train_return_pct": 247437.05, "train_max_dd": 3.72, "train_win_rate": 74.35, "train_profit_factor": 5.712, "train_ic": 0.6822, "train_hit": 74.05, "train_precision": 0.7213, "train_recall": 0.8124, "train_f1": 0.7641, "train_f2": 0.7924, "train_mcc": 0.4861, "train_accuracy": 0.7421, "train_per_window": [{"fold": "all_train", "regime": "Training data", "sharpe": 7.0288, "sortino": 18.3359, "return_pct": 247437.05, "equity": 2475370.5, "max_dd": 3.72, "win_rate": 74.35, "profit_factor": 5.712, "ic": 0.6822, "hit": 74.05, "n": 2478, "precision": 0.7213, "recall": 0.8124, "f1": 0.7641, "f2": 0.7924, "mcc": 0.4861, "accuracy": 0.7421, "tp": 1035, "fp": 400, "tn": 804, "fn": 239}], "experiment_num": 157, "status": "DISCARD"}
{"backbone": "mamba", "description": "mamba: Exp7 dmamba expand=4 (double inner dim, Gu Dao 2024)", "config": {"seq_len": 10, "lr": 0.0005, "batch_size": 32, "epochs": 100, "weight_decay": 0.1, "patience": 20, "grad_clip": 1.0, "warmup_epochs": 10, "huber_delta": 1.0, "head_dropout": 0.1, "seed": 42, "mamba_variant": "dmamba", "mamba_expand": 4, "het_loss": false}, "composite": 5.5996, "test_pos_folds": 7, "val_pos_folds": 7, "val_loss": 3.8e-05, "elapsed_sec": 263.4, "timestamp": "2026-04-20T01:01:52", "sharpe": 5.5996, "psr": 1.0, "equity": 8917.92, "sortino": 10.4299, "return_pct": 791.79, "max_dd": 5.21, "win_rate": 66.67, "profit_factor": 2.905, "ic": 0.4333, "hit": 66.39, "aleatoric_mean": 3.5e-05, "epistemic_mean": 6.9e-05, "confidence_mean": 0.9999, "precision": 0.6439, "recall": 0.7256, "f1": 0.6823, "f2": 0.7076, "mcc": 0.3355, "accuracy": 0.666, "per_window": [{"fold": "fold_1", "regime": "Pre-crisis upturn + GFC onset", "sharpe": 3.4004, "sortino": 10.5138, "return_pct": 28.33, "equity": 1283.3, "max_dd": 5.21, "win_rate": 53.92, "profit_factor": 2.292, "ic": 0.0564, "hit": 53.4, "n": 103, "precision": 0.5325, "recall": 0.7736, "f1": 0.6308, "f2": 0.7093, "mcc": 0.0617, "accuracy": 0.534, "tp": 41, "fp": 36, "tn": 14, "fn": 12, "aleatoric_mean": 5.8e-05, "epistemic_mean": 0.000116, "confidence_mean": 0.9998, "aleatoric_std": 4.1e-05, "epistemic_std": 8.2e-05}, {"fold": "fold_2", "regime": "Post-crash recovery", "sharpe": 3.7551, "sortino": 6.8786, "return_pct": 18.85, "equity": 1188.53, "max_dd": 3.96, "win_rate": 59.81, "profit_factor": 1.802, "ic": 0.1989, "hit": 59.81, "n": 107, "precision": 0.569, "recall": 0.6471, "f1": 0.6055, "f2": 0.6298, "mcc": 0.2011, "accuracy": 0.5981, "tp": 33, "fp": 25, "tn": 31, "fn": 18, "aleatoric_mean": 3.4e-05, "epistemic_mean": 6.9e-05, "confidence_mean": 0.9999, "aleatoric_std": 1.7e-05, "epistemic_std": 3.4e-05}, {"fold": "fold_3", "regime": "Eurozone debt plateau", "sharpe": 5.8826, "sortino": 9.8923, "return_pct": 21.45, "equity": 1214.48, "max_dd": 2.17, "win_rate": 69.23, "profit_factor": 2.527, "ic": 0.4917, "hit": 67.92, "n": 106, "precision": 0.6579, "recall": 0.8772, "f1": 0.7519, "f2": 0.8224, "mcc": 0.3836, "accuracy": 0.6887, "tp": 50, "fp": 26, "tn": 23, "fn": 7, "aleatoric_mean": 4.5e-05, "epistemic_mean": 9.1e-05, "confidence_mean": 0.9999, "aleatoric_std": 2.6e-05, "epistemic_std": 5.1e-05}, {"fold": "fold_4", "regime": "Strong USD downturn", "sharpe": 5.483, "sortino": 8.0679, "return_pct": 49.0, "equity": 1489.97, "max_dd": 3.41, "win_rate": 67.66, "profit_factor": 2.541, "ic": 0.5332, "hit": 67.26, "n": 168, "precision": 0.7353, "recall": 0.5814, "f1": 0.6494, "f2": 0.6068, "mcc": 0.3685, "accuracy": 0.6786, "tp": 50, "fp": 18, "tn": 64, "fn": 36, "aleatoric_mean": 3.9e-05, "epistemic_mean": 7.9e-05, "confidence_mean": 0.9999, "aleatoric_std": 2e-05, "epistemic_std": 4.1e-05}, {"fold": "fold_5", "regime": "Low-vol plateau", "sharpe": 5.9372, "sortino": 12.3821, "return_pct": 20.26, "equity": 1202.62, "max_dd": 1.36, "win_rate": 62.96, "profit_factor": 2.721, "ic": 0.4539, "hit": 62.96, "n": 162, "precision": 0.587, "recall": 0.7105, "f1": 0.6429, "f2": 0.6818, "mcc": 0.2707, "accuracy": 0.6296, "tp": 54, "fp": 38, "tn": 48, "fn": 22, "aleatoric_mean": 2e-05, "epistemic_mean": 3.9e-05, "confidence_mean": 0.9999, "aleatoric_std": 9e-06, "epistemic_std": 1.7e-05}, {"fold": "fold_6", "regime": "EUR crisis downturn", "sharpe": 10.8128, "sortino": 24.9183, "return_pct": 75.04, "equity": 1750.42, "max_dd": 1.74, "win_rate": 74.55, "profit_factor": 6.194, "ic": 0.667, "hit": 74.55, "n": 165, "precision": 0.7333, "recall": 0.7143, "f1": 0.7237, "f2": 0.718, "mcc": 0.488, "accuracy": 0.7455, "tp": 55, "fp": 20, "tn": 68, "fn": 22, "aleatoric_mean": 3.2e-05, "epistemic_mean": 6.3e-05, "confidence_mean": 0.9999, "aleatoric_std": 1.6e-05, "epistemic_std": 3.3e-05}, {"fold": "fold_7", "regime": "Recent mixed/upturn", "sharpe": 8.1243, "sortino": 16.0086, "return_pct": 53.49, "equity": 1534.93, "max_dd": 1.93, "win_rate": 72.22, "profit_factor": 4.14, "ic": 0.591, "hit": 72.22, "n": 162, "precision": 0.6875, "recall": 0.8148, "f1": 0.7458, "f2": 0.7857, "mcc": 0.4523, "accuracy": 0.7222, "tp": 66, "fp": 30, "tn": 51, "fn": 15, "aleatoric_mean": 2.6e-05, "epistemic_mean": 5.2e-05, "confidence_mean": 0.9999, "aleatoric_std": 1.3e-05, "epistemic_std": 2.5e-05}], "val_sharpe": 5.8259, "val_psr": 1.0, "val_equity": 3631.91, "val_sortino": 9.8576, "val_return_pct": 263.19, "val_max_dd": 4.87, "val_win_rate": 63.56, "val_profit_factor": 2.717, "val_ic": 0.4146, "val_hit": 63.15, "val_aleatoric_mean": 2.5e-05, "val_epistemic_mean": 5.1e-05, "val_confidence_mean": 0.9999, "val_precision": 0.5852, "val_recall": 0.7808, "val_f1": 0.669, "val_f2": 0.7319, "val_mcc": 0.2899, "val_accuracy": 0.6328, "val_per_window": [{"fold": "fold_1", "regime": "Pre-crisis upturn + GFC onset", "sharpe": 0.4976, "sortino": 0.9649, "return_pct": 1.19, "equity": 1011.89, "max_dd": 3.69, "win_rate": 44.44, "profit_factor": 1.086, "ic": -0.175, "hit": 44.04, "n": 109, "precision": 0.4659, "recall": 0.7455, "f1": 0.5734, "f2": 0.6656, "mcc": -0.1584, "accuracy": 0.4404, "tp": 41, "fp": 47, "tn": 7, "fn": 14, "aleatoric_mean": 2.4e-05, "epistemic_mean": 4.8e-05, "confidence_mean": 0.9999, "aleatoric_std": 1.9e-05, "epistemic_std": 3.7e-05}, {"fold": "fold_2", "regime": "Post-crash recovery", "sharpe": 2.5416, "sortino": 4.2167, "return_pct": 12.65, "equity": 1126.5, "max_dd": 2.97, "win_rate": 53.7, "profit_factor": 1.494, "ic": -0.0199, "hit": 53.7, "n": 108, "precision": 0.5844, "recall": 0.7143, "f1": 0.6429, "f2": 0.6839, "mcc": 0.0035, "accuracy": 0.537, "tp": 45, "fp": 32, "tn": 13, "fn": 18, "aleatoric_mean": 4.2e-05, "epistemic_mean": 8.3e-05, "confidence_mean": 0.9999, "aleatoric_std": 1.9e-05, "epistemic_std": 3.8e-05}, {"fold": "fold_3", "regime": "Eurozone debt plateau", "sharpe": 8.6234, "sortino": 18.0722, "return_pct": 35.62, "equity": 1356.19, "max_dd": 1.58, "win_rate": 75.23, "profit_factor": 4.19, "ic": 0.6009, "hit": 73.87, "n": 111, "precision": 0.6957, "recall": 0.6809, "f1": 0.6882, "f2": 0.6838, "mcc": 0.4635, "accuracy": 0.7387, "tp": 32, "fp": 14, "tn": 50, "fn": 15, "aleatoric_mean": 3.1e-05, "epistemic_mean": 6.2e-05, "confidence_mean": 0.9999, "aleatoric_std": 1.5e-05, "epistemic_std": 3e-05}, {"fold": "fold_4", "regime": "Strong USD downturn", "sharpe": 6.2326, "sortino": 12.9996, "return_pct": 22.17, "equity": 1221.74, "max_dd": 1.97, "win_rate": 63.3, "profit_factor": 2.844, "ic": 0.589, "hit": 62.73, "n": 110, "precision": 0.5556, "recall": 0.7447, "f1": 0.6364, "f2": 0.6972, "mcc": 0.3002, "accuracy": 0.6364, "tp": 35, "fp": 28, "tn": 35, "fn": 12, "aleatoric_mean": 2.2e-05, "epistemic_mean": 4.4e-05, "confidence_mean": 0.9999, "aleatoric_std": 1.1e-05, "epistemic_std": 2.2e-05}, {"fold": "fold_5", "regime": "Low-vol plateau", "sharpe": 10.717, "sortino": 30.1831, "return_pct": 34.35, "equity": 1343.49, "max_dd": 1.28, "win_rate": 68.75, "profit_factor": 6.63, "ic": 0.7258, "hit": 68.75, "n": 112, "precision": 0.6324, "recall": 0.8113, "f1": 0.7107, "f2": 0.7679, "mcc": 0.3962, "accuracy": 0.6875, "tp": 43, "fp": 25, "tn": 34, "fn": 10, "aleatoric_mean": 2.2e-05, "epistemic_mean": 4.4e-05, "confidence_mean": 0.9999, "aleatoric_std": 1.2e-05, "epistemic_std": 2.5e-05}, {"fold": "fold_6", "regime": "EUR crisis downturn", "sharpe": 11.4259, "sortino": 22.9605, "return_pct": 23.59, "equity": 1235.89, "max_dd": 0.51, "win_rate": 79.44, "profit_factor": 8.094, "ic": 0.7282, "hit": 78.7, "n": 108, "precision": 0.7069, "recall": 0.8723, "f1": 0.781, "f2": 0.8333, "mcc": 0.5903, "accuracy": 0.787, "tp": 41, "fp": 17, "tn": 44, "fn": 6, "aleatoric_mean": 1.7e-05, "epistemic_mean": 3.4e-05, "confidence_mean": 0.9999, "aleatoric_std": 5e-06, "epistemic_std": 1.1e-05}, {"fold": "fold_7", "regime": "Recent mixed/upturn", "sharpe": 6.664, "sortino": 16.6785, "return_pct": 15.81, "equity": 1158.14, "max_dd": 1.13, "win_rate": 60.0, "profit_factor": 2.95, "ic": 0.5457, "hit": 60.0, "n": 110, "precision": 0.5517, "recall": 0.9057, "f1": 0.6857, "f2": 0.8027, "mcc": 0.2721, "accuracy": 0.6, "tp": 48, "fp": 39, "tn": 18, "fn": 5, "aleatoric_mean": 2e-05, "epistemic_mean": 4.1e-05, "confidence_mean": 0.9999, "aleatoric_std": 8e-06, "epistemic_std": 1.7e-05}], "train_sharpe": 7.1565, "train_psr": 1.0, "train_equity": 2788788.5, "train_sortino": 17.5034, "train_return_pct": 278778.85, "train_max_dd": 3.71, "train_win_rate": 76.3, "train_profit_factor": 5.96, "train_ic": 0.6909, "train_hit": 75.99, "train_precision": 0.7241, "train_recall": 0.8673, "train_f1": 0.7893, "train_f2": 0.8343, "train_mcc": 0.5319, "train_accuracy": 0.7619, "train_per_window": [{"fold": "all_train", "regime": "Training data", "sharpe": 7.1565, "sortino": 17.5034, "return_pct": 278778.85, "equity": 2788788.5, "max_dd": 3.71, "win_rate": 76.3, "profit_factor": 5.96, "ic": 0.6909, "hit": 75.99, "n": 2478, "precision": 0.7241, "recall": 0.8673, "f1": 0.7893, "f2": 0.8343, "mcc": 0.5319, "accuracy": 0.7619, "tp": 1105, "fp": 421, "tn": 783, "fn": 169}], "experiment_num": 158, "status": "DISCARD"}
