{"backbone": "mlp", "description": "mlp: Exp39 smoke-test new metrics + trade CSV", "config": {"seq_len": 10, "lr": 0.0005, "batch_size": 32, "epochs": 10, "weight_decay": 1e-05, "patience": 10, "grad_clip": 1.0, "warmup_epochs": 0, "huber_delta": 0.5, "head_dropout": 0.15, "seed": 0, "het_loss": false}, "composite": 1.354, "test_pos_folds": 6, "val_pos_folds": 5, "val_loss": 7.7e-05, "elapsed_sec": 4.2, "timestamp": "2026-04-19T16:59:35", "sharpe": 1.654, "psr": 0.999, "equity": 1946.26, "sortino": 2.2317, "return_pct": 94.63, "max_dd": 10.93, "win_rate": 54.7, "profit_factor": 1.358, "ic": 0.1858, "hit": 54.47, "aleatoric_mean": 0.000197, "epistemic_mean": 0.000395, "confidence_mean": 0.9994, "precision": 0.5441, "recall": 0.5385, "f1": 0.5413, "f2": 0.5396, "mcc": 0.0974, "accuracy": 0.5488, "per_window": [{"fold": "fold_1", "regime": "Pre-crisis upturn + GFC onset", "sharpe": 1.2598, "sortino": 1.2653, "return_pct": 9.37, "equity": 1093.68, "max_dd": 10.93, "win_rate": 61.76, "profit_factor": 1.348, "ic": 0.199, "hit": 61.17, "n": 103, "precision": 0.6296, "recall": 0.6415, "f1": 0.6355, "f2": 0.6391, "mcc": 0.2417, "accuracy": 0.6214, "tp": 34, "fp": 20, "tn": 30, "fn": 19, "aleatoric_mean": 0.000303, "epistemic_mean": 0.000606, "confidence_mean": 0.9991, "aleatoric_std": 0.000229, "epistemic_std": 0.000458}, {"fold": "fold_2", "regime": "Post-crash recovery", "sharpe": -0.5031, "sortino": -0.835, "return_pct": -2.65, "equity": 973.5, "max_dd": 6.29, "win_rate": 49.53, "profit_factor": 0.924, "ic": 0.0451, "hit": 49.53, "n": 107, "precision": 0.4667, "recall": 0.4118, "f1": 0.4375, "f2": 0.4217, "mcc": -0.017, "accuracy": 0.4953, "tp": 21, "fp": 24, "tn": 32, "fn": 30, "aleatoric_mean": 0.000162, "epistemic_mean": 0.000324, "confidence_mean": 0.9995, "aleatoric_std": 8.8e-05, "epistemic_std": 0.000175}, {"fold": "fold_3", "regime": "Eurozone debt plateau", "sharpe": 1.6269, "sortino": 2.8214, "return_pct": 5.76, "equity": 1057.55, "max_dd": 3.74, "win_rate": 54.81, "profit_factor": 1.291, "ic": 0.1949, "hit": 53.77, "n": 106, "precision": 0.5781, "recall": 0.6491, "f1": 0.6116, "f2": 0.6336, "mcc": 0.1, "accuracy": 0.5566, "tp": 37, "fp": 27, "tn": 22, "fn": 20, "aleatoric_mean": 0.000238, "epistemic_mean": 0.000475, "confidence_mean": 0.9993, "aleatoric_std": 0.000107, "epistemic_std": 0.000215}, {"fold": "fold_4", "regime": "Strong USD downturn", "sharpe": 3.3506, "sortino": 5.8026, "return_pct": 28.48, "equity": 1284.78, "max_dd": 5.16, "win_rate": 57.49, "profit_factor": 1.76, "ic": 0.2786, "hit": 57.14, "n": 168, "precision": 0.5926, "recall": 0.5581, "f1": 0.5749, "f2": 0.5647, "mcc": 0.1558, "accuracy": 0.5774, "tp": 48, "fp": 33, "tn": 49, "fn": 38, "aleatoric_mean": 0.000257, "epistemic_mean": 0.000515, "confidence_mean": 0.9992, "aleatoric_std": 0.000179, "epistemic_std": 0.000359}, {"fold": "fold_5", "regime": "Low-vol plateau", "sharpe": 1.3446, "sortino": 2.3125, "return_pct": 4.48, "equity": 1044.77, "max_dd": 2.72, "win_rate": 48.77, "profit_factor": 1.251, "ic": 0.1479, "hit": 48.77, "n": 162, "precision": 0.4444, "recall": 0.3684, "f1": 0.4029, "f2": 0.3815, "mcc": -0.0395, "accuracy": 0.4877, "tp": 28, "fp": 35, "tn": 51, "fn": 48, "aleatoric_mean": 0.000128, "epistemic_mean": 0.000257, "confidence_mean": 0.9996, "aleatoric_std": 6.4e-05, "epistemic_std": 0.000128}, {"fold": "fold_6", "regime": "EUR crisis downturn", "sharpe": 3.2759, "sortino": 5.2511, "return_pct": 22.02, "equity": 1220.24, "max_dd": 3.45, "win_rate": 59.39, "profit_factor": 1.7, "ic": 0.21, "hit": 59.39, "n": 165, "precision": 0.6316, "recall": 0.3117, "f1": 0.4174, "f2": 0.3468, "mcc": 0.1808, "accuracy": 0.5939, "tp": 24, "fp": 14, "tn": 74, "fn": 53, "aleatoric_mean": 0.000206, "epistemic_mean": 0.000413, "confidence_mean": 0.9994, "aleatoric_std": 0.000134, "epistemic_std": 0.000268}, {"fold": "fold_7", "regime": "Recent mixed/upturn", "sharpe": 0.9508, "sortino": 1.5681, "return_pct": 5.53, "equity": 1055.31, "max_dd": 5.27, "win_rate": 51.85, "profit_factor": 1.174, "ic": 0.1242, "hit": 51.85, "n": 162, "precision": 0.5115, "recall": 0.8272, "f1": 0.6321, "f2": 0.7363, "mcc": 0.0471, "accuracy": 0.5185, "tp": 67, "fp": 64, "tn": 17, "fn": 14, "aleatoric_mean": 0.000125, "epistemic_mean": 0.000251, "confidence_mean": 0.9996, "aleatoric_std": 6.5e-05, "epistemic_std": 0.000131}], "val_sharpe": 2.4431, "val_psr": 1.0, "val_equity": 1758.14, "val_sortino": 4.0106, "val_return_pct": 75.81, "val_max_dd": 8.51, "val_win_rate": 56.88, "val_profit_factor": 1.512, "val_ic": 0.1792, "val_hit": 56.51, "val_aleatoric_mean": 0.000135, "val_epistemic_mean": 0.00027, "val_confidence_mean": 0.9996, "val_precision": 0.5467, "val_recall": 0.5452, "val_f1": 0.546, "val_f2": 0.5455, "val_mcc": 0.1358, "val_accuracy": 0.569, "val_per_window": [{"fold": "fold_1", "regime": "Pre-crisis upturn + GFC onset", "sharpe": -0.789, "sortino": -1.2616, "return_pct": -2.04, "equity": 979.58, "max_dd": 4.36, "win_rate": 44.44, "profit_factor": 0.877, "ic": -0.1319, "hit": 44.04, "n": 109, "precision": 0.459, "recall": 0.5091, "f1": 0.4828, "f2": 0.4982, "mcc": -0.1027, "accuracy": 0.4495, "tp": 28, "fp": 33, "tn": 21, "fn": 27, "aleatoric_mean": 0.000133, "epistemic_mean": 0.000266, "confidence_mean": 0.9996, "aleatoric_std": 9.8e-05, "epistemic_std": 0.000196}, {"fold": "fold_2", "regime": "Post-crash recovery", "sharpe": -0.1462, "sortino": -0.2361, "return_pct": -0.98, "equity": 990.2, "max_dd": 6.13, "win_rate": 50.0, "profit_factor": 0.977, "ic": 0.1313, "hit": 50.0, "n": 108, "precision": 0.6286, "recall": 0.3492, "f1": 0.449, "f2": 0.3833, "mcc": 0.0635, "accuracy": 0.5, "tp": 22, "fp": 13, "tn": 32, "fn": 41, "aleatoric_mean": 0.000195, "epistemic_mean": 0.00039, "confidence_mean": 0.9994, "aleatoric_std": 0.00011, "epistemic_std": 0.00022}, {"fold": "fold_3", "regime": "Eurozone debt plateau", "sharpe": 4.2752, "sortino": 10.9548, "return_pct": 17.96, "equity": 1179.56, "max_dd": 2.92, "win_rate": 64.22, "profit_factor": 2.007, "ic": 0.2871, "hit": 63.06, "n": 111, "precision": 0.575, "recall": 0.4894, "f1": 0.5287, "f2": 0.5044, "mcc": 0.2303, "accuracy": 0.6306, "tp": 23, "fp": 17, "tn": 47, "fn": 24, "aleatoric_mean": 0.000156, "epistemic_mean": 0.000312, "confidence_mean": 0.9995, "aleatoric_std": 7.8e-05, "epistemic_std": 0.000156}, {"fold": "fold_4", "regime": "Strong USD downturn", "sharpe": 5.4871, "sortino": 12.9822, "return_pct": 19.59, "equity": 1195.88, "max_dd": 1.75, "win_rate": 62.39, "profit_factor": 2.502, "ic": 0.3807, "hit": 61.82, "n": 110, "precision": 0.55, "recall": 0.7021, "f1": 0.6168, "f2": 0.6653, "mcc": 0.2718, "accuracy": 0.6273, "tp": 33, "fp": 27, "tn": 36, "fn": 14, "aleatoric_mean": 0.000136, "epistemic_mean": 0.000272, "confidence_mean": 0.9996, "aleatoric_std": 7e-05, "epistemic_std": 0.000139}, {"fold": "fold_5", "regime": "Low-vol plateau", "sharpe": 5.2508, "sortino": 9.9833, "return_pct": 17.96, "equity": 1179.59, "max_dd": 2.84, "win_rate": 66.07, "profit_factor": 2.414, "ic": 0.3791, "hit": 66.07, "n": 112, "precision": 0.6829, "recall": 0.5283, "f1": 0.5957, "f2": 0.5534, "mcc": 0.3192, "accuracy": 0.6607, "tp": 28, "fp": 13, "tn": 46, "fn": 25, "aleatoric_mean": 0.000139, "epistemic_mean": 0.000279, "confidence_mean": 0.9996, "aleatoric_std": 8.1e-05, "epistemic_std": 0.000163}, {"fold": "fold_6", "regime": "EUR crisis downturn", "sharpe": 2.1159, "sortino": 3.1771, "return_pct": 4.86, "equity": 1048.57, "max_dd": 1.26, "win_rate": 58.88, "profit_factor": 1.428, "ic": 0.2339, "hit": 58.33, "n": 108, "precision": 0.5254, "recall": 0.6596, "f1": 0.5849, "f2": 0.6275, "mcc": 0.1997, "accuracy": 0.5926, "tp": 31, "fp": 28, "tn": 33, "fn": 16, "aleatoric_mean": 8e-05, "epistemic_mean": 0.00016, "confidence_mean": 0.9998, "aleatoric_std": 3.3e-05, "epistemic_std": 6.6e-05}, {"fold": "fold_7", "regime": "Recent mixed/upturn", "sharpe": 1.6245, "sortino": 2.4645, "return_pct": 3.89, "equity": 1038.86, "max_dd": 2.97, "win_rate": 51.82, "profit_factor": 1.298, "ic": 0.123, "hit": 51.82, "n": 110, "precision": 0.5, "recall": 0.6415, "f1": 0.562, "f2": 0.6071, "mcc": 0.0463, "accuracy": 0.5182, "tp": 34, "fp": 34, "tn": 23, "fn": 19, "aleatoric_mean": 0.000105, "epistemic_mean": 0.00021, "confidence_mean": 0.9997, "aleatoric_std": 8.3e-05, "epistemic_std": 0.000166}], "train_sharpe": 3.6351, "train_psr": 1.0, "train_equity": 71886.0, "train_sortino": 8.0374, "train_return_pct": 7088.6, "train_max_dd": 6.68, "train_win_rate": 61.91, "train_profit_factor": 2.263, "train_ic": 0.3536, "train_hit": 61.66, "train_precision": 0.6347, "train_recall": 0.6083, "train_f1": 0.6212, "train_f2": 0.6134, "train_mcc": 0.2378, "train_accuracy": 0.6186, "train_per_window": [{"fold": "all_train", "regime": "Training data", "sharpe": 3.6351, "sortino": 8.0374, "return_pct": 7088.6, "equity": 71886.0, "max_dd": 6.68, "win_rate": 61.91, "profit_factor": 2.263, "ic": 0.3536, "hit": 61.66, "n": 2478, "precision": 0.6347, "recall": 0.6083, "f1": 0.6212, "f2": 0.6134, "mcc": 0.2378, "accuracy": 0.6186, "tp": 775, "fp": 446, "tn": 758, "fn": 499}], "experiment_num": 95, "status": "DISCARD"}
{"backbone": "mlp", "description": "mlp: Exp40 RECOMPUTE champion Exp32 with new ML metrics", "config": {"seq_len": 10, "lr": 0.0005, "batch_size": 32, "epochs": 50, "weight_decay": 1e-05, "patience": 10, "grad_clip": 1.0, "warmup_epochs": 0, "huber_delta": 0.5, "head_dropout": 0.15, "seed": 0, "het_loss": false}, "composite": 5.499, "test_pos_folds": 7, "val_pos_folds": 6, "val_loss": 3.8e-05, "elapsed_sec": 15.1, "timestamp": "2026-04-19T17:02:57", "sharpe": 6.2113, "psr": 1.0, "equity": 11010.87, "sortino": 11.3103, "return_pct": 1001.09, "max_dd": 4.13, "win_rate": 69.35, "profit_factor": 3.295, "ic": 0.4846, "hit": 69.06, "aleatoric_mean": 2.6e-05, "epistemic_mean": 5.2e-05, "confidence_mean": 0.9999, "precision": 0.6778, "recall": 0.7173, "f1": 0.697, "f2": 0.709, "mcc": 0.3843, "accuracy": 0.6917, "per_window": [{"fold": "fold_1", "regime": "Pre-crisis upturn + GFC onset", "sharpe": 2.4608, "sortino": 6.7778, "return_pct": 19.79, "equity": 1197.85, "max_dd": 3.29, "win_rate": 60.78, "profit_factor": 1.805, "ic": 0.1877, "hit": 60.19, "n": 103, "precision": 0.625, "recall": 0.566, "f1": 0.5941, "f2": 0.5769, "mcc": 0.2064, "accuracy": 0.6019, "tp": 30, "fp": 18, "tn": 32, "fn": 23, "aleatoric_mean": 5.3e-05, "epistemic_mean": 0.000106, "confidence_mean": 0.9998, "aleatoric_std": 7e-05, "epistemic_std": 0.000141}, {"fold": "fold_2", "regime": "Post-crash recovery", "sharpe": 1.1722, "sortino": 2.0218, "return_pct": 5.49, "equity": 1054.86, "max_dd": 3.47, "win_rate": 53.27, "profit_factor": 1.202, "ic": 0.0824, "hit": 53.27, "n": 107, "precision": 0.5067, "recall": 0.7451, "f1": 0.6032, "f2": 0.681, "mcc": 0.0921, "accuracy": 0.5327, "tp": 38, "fp": 37, "tn": 19, "fn": 13, "aleatoric_mean": 2.1e-05, "epistemic_mean": 4.3e-05, "confidence_mean": 0.9999, "aleatoric_std": 1.5e-05, "epistemic_std": 3.1e-05}, {"fold": "fold_3", "regime": "Eurozone debt plateau", "sharpe": 9.7583, "sortino": 18.8138, "return_pct": 34.13, "equity": 1341.27, "max_dd": 1.32, "win_rate": 75.96, "profit_factor": 4.755, "ic": 0.5836, "hit": 74.53, "n": 106, "precision": 0.7143, "recall": 0.8772, "f1": 0.7874, "f2": 0.8389, "mcc": 0.4938, "accuracy": 0.7453, "tp": 50, "fp": 20, "tn": 29, "fn": 7, "aleatoric_mean": 2.8e-05, "epistemic_mean": 5.5e-05, "confidence_mean": 0.9999, "aleatoric_std": 1.4e-05, "epistemic_std": 2.9e-05}, {"fold": "fold_4", "regime": "Strong USD downturn", "sharpe": 9.7799, "sortino": 19.4179, "return_pct": 90.3, "equity": 1902.97, "max_dd": 1.81, "win_rate": 75.45, "profit_factor": 5.651, "ic": 0.6667, "hit": 75.0, "n": 168, "precision": 0.7528, "recall": 0.7791, "f1": 0.7657, "f2": 0.7737, "mcc": 0.5115, "accuracy": 0.756, "tp": 67, "fp": 22, "tn": 60, "fn": 19, "aleatoric_mean": 3.6e-05, "epistemic_mean": 7.2e-05, "confidence_mean": 0.9999, "aleatoric_std": 2.9e-05, "epistemic_std": 5.8e-05}, {"fold": "fold_5", "regime": "Low-vol plateau", "sharpe": 8.8545, "sortino": 16.1387, "return_pct": 29.29, "equity": 1292.92, "max_dd": 1.43, "win_rate": 70.99, "profit_factor": 4.604, "ic": 0.638, "hit": 70.99, "n": 162, "precision": 0.7458, "recall": 0.5789, "f1": 0.6519, "f2": 0.6061, "mcc": 0.4195, "accuracy": 0.7099, "tp": 44, "fp": 15, "tn": 71, "fn": 32, "aleatoric_mean": 1.2e-05, "epistemic_mean": 2.5e-05, "confidence_mean": 1.0, "aleatoric_std": 7e-06, "epistemic_std": 1.3e-05}, {"fold": "fold_6", "regime": "EUR crisis downturn", "sharpe": 9.9474, "sortino": 21.0105, "return_pct": 69.54, "equity": 1695.35, "max_dd": 2.27, "win_rate": 70.91, "profit_factor": 5.27, "ic": 0.641, "hit": 70.91, "n": 165, "precision": 0.7458, "recall": 0.5714, "f1": 0.6471, "f2": 0.5995, "mcc": 0.4174, "accuracy": 0.7091, "tp": 44, "fp": 15, "tn": 73, "fn": 33, "aleatoric_mean": 2.4e-05, "epistemic_mean": 4.9e-05, "confidence_mean": 0.9999, "aleatoric_std": 1.7e-05, "epistemic_std": 3.3e-05}, {"fold": "fold_7", "regime": "Recent mixed/upturn", "sharpe": 8.4769, "sortino": 14.3598, "return_pct": 55.75, "equity": 1557.55, "max_dd": 1.64, "win_rate": 71.6, "profit_factor": 4.429, "ic": 0.6222, "hit": 71.6, "n": 162, "precision": 0.6606, "recall": 0.8889, "f1": 0.7579, "f2": 0.8314, "mcc": 0.4605, "accuracy": 0.716, "tp": 72, "fp": 37, "tn": 44, "fn": 9, "aleatoric_mean": 1.7e-05, "epistemic_mean": 3.4e-05, "confidence_mean": 0.9999, "aleatoric_std": 1e-05, "epistemic_std": 2e-05}], "val_sharpe": 5.599, "val_psr": 1.0, "val_equity": 3472.42, "val_sortino": 8.4457, "val_return_pct": 247.24, "val_max_dd": 7.43, "val_win_rate": 66.19, "val_profit_factor": 2.61, "val_ic": 0.4582, "val_hit": 65.76, "val_aleatoric_mean": 1.5e-05, "val_epistemic_mean": 3e-05, "val_confidence_mean": 1.0, "val_precision": 0.6588, "val_recall": 0.6082, "val_f1": 0.6325, "val_f2": 0.6177, "val_mcc": 0.3249, "val_accuracy": 0.6641, "val_per_window": [{"fold": "fold_1", "regime": "Pre-crisis upturn + GFC onset", "sharpe": 0.0212, "sortino": 0.0342, "return_pct": -0.02, "equity": 999.8, "max_dd": 2.91, "win_rate": 47.22, "profit_factor": 1.004, "ic": -0.0659, "hit": 46.79, "n": 109, "precision": 0.4833, "recall": 0.5273, "f1": 0.5043, "f2": 0.5179, "mcc": -0.047, "accuracy": 0.4771, "tp": 29, "fp": 31, "tn": 23, "fn": 26, "aleatoric_mean": 1.6e-05, "epistemic_mean": 3.1e-05, "confidence_mean": 1.0, "aleatoric_std": 2e-05, "epistemic_std": 4.1e-05}, {"fold": "fold_2", "regime": "Post-crash recovery", "sharpe": -0.6284, "sortino": -0.9753, "return_pct": -3.27, "equity": 967.3, "max_dd": 7.43, "win_rate": 47.22, "profit_factor": 0.906, "ic": 0.0432, "hit": 47.22, "n": 108, "precision": 0.5789, "recall": 0.3492, "f1": 0.4356, "f2": 0.3793, "mcc": -0.0066, "accuracy": 0.4722, "tp": 22, "fp": 16, "tn": 29, "fn": 41, "aleatoric_mean": 2.7e-05, "epistemic_mean": 5.5e-05, "confidence_mean": 0.9999, "aleatoric_std": 2.2e-05, "epistemic_std": 4.3e-05}, {"fold": "fold_3", "regime": "Eurozone debt plateau", "sharpe": 11.0234, "sortino": 30.4677, "return_pct": 43.97, "equity": 1439.69, "max_dd": 0.84, "win_rate": 78.9, "profit_factor": 6.531, "ic": 0.6702, "hit": 77.48, "n": 111, "precision": 0.74, "recall": 0.7872, "f1": 0.7629, "f2": 0.7773, "mcc": 0.5801, "accuracy": 0.7928, "tp": 37, "fp": 13, "tn": 51, "fn": 10, "aleatoric_mean": 1.8e-05, "epistemic_mean": 3.6e-05, "confidence_mean": 0.9999, "aleatoric_std": 1.3e-05, "epistemic_std": 2.5e-05}, {"fold": "fold_4", "regime": "Strong USD downturn", "sharpe": 7.8607, "sortino": 16.5925, "return_pct": 27.57, "equity": 1275.68, "max_dd": 1.08, "win_rate": 71.56, "profit_factor": 3.79, "ic": 0.6035, "hit": 70.91, "n": 110, "precision": 0.6667, "recall": 0.6809, "f1": 0.6737, "f2": 0.678, "mcc": 0.4258, "accuracy": 0.7182, "tp": 32, "fp": 16, "tn": 47, "fn": 15, "aleatoric_mean": 1.4e-05, "epistemic_mean": 2.7e-05, "confidence_mean": 1.0, "aleatoric_std": 1.2e-05, "epistemic_std": 2.5e-05}, {"fold": "fold_5", "regime": "Low-vol plateau", "sharpe": 10.5961, "sortino": 28.9438, "return_pct": 34.04, "equity": 1340.39, "max_dd": 0.62, "win_rate": 75.0, "profit_factor": 6.466, "ic": 0.7232, "hit": 75.0, "n": 112, "precision": 0.766, "recall": 0.6792, "f1": 0.72, "f2": 0.695, "mcc": 0.4986, "accuracy": 0.75, "tp": 36, "fp": 11, "tn": 48, "fn": 17, "aleatoric_mean": 1.3e-05, "epistemic_mean": 2.6e-05, "confidence_mean": 1.0, "aleatoric_std": 1e-05, "epistemic_std": 2e-05}, {"fold": "fold_6", "regime": "EUR crisis downturn", "sharpe": 9.2138, "sortino": 21.1712, "return_pct": 19.95, "equity": 1199.5, "max_dd": 0.82, "win_rate": 71.03, "profit_factor": 5.067, "ic": 0.717, "hit": 70.37, "n": 108, "precision": 0.7353, "recall": 0.5319, "f1": 0.6173, "f2": 0.5631, "mcc": 0.4103, "accuracy": 0.713, "tp": 25, "fp": 9, "tn": 52, "fn": 22, "aleatoric_mean": 8e-06, "epistemic_mean": 1.6e-05, "confidence_mean": 1.0, "aleatoric_std": 4e-06, "epistemic_std": 8e-06}, {"fold": "fold_7", "regime": "Recent mixed/upturn", "sharpe": 9.5361, "sortino": 25.4132, "return_pct": 21.6, "equity": 1215.96, "max_dd": 0.72, "win_rate": 71.82, "profit_factor": 4.828, "ic": 0.5963, "hit": 71.82, "n": 110, "precision": 0.6833, "recall": 0.7736, "f1": 0.7257, "f2": 0.7537, "mcc": 0.4418, "accuracy": 0.7182, "tp": 41, "fp": 19, "tn": 38, "fn": 12, "aleatoric_mean": 9e-06, "epistemic_mean": 1.8e-05, "confidence_mean": 1.0, "aleatoric_std": 6e-06, "epistemic_std": 1.1e-05}], "train_sharpe": 7.9415, "train_psr": 1.0, "train_equity": 5670149.5, "train_sortino": 23.2561, "train_return_pct": 566914.95, "train_max_dd": 4.92, "train_win_rate": 78.04, "train_profit_factor": 7.921, "train_ic": 0.7556, "train_hit": 77.72, "train_precision": 0.794, "train_recall": 0.7716, "train_f1": 0.7826, "train_f2": 0.776, "train_mcc": 0.5596, "train_accuracy": 0.7797, "train_per_window": [{"fold": "all_train", "regime": "Training data", "sharpe": 7.9415, "sortino": 23.2561, "return_pct": 566914.95, "equity": 5670149.5, "max_dd": 4.92, "win_rate": 78.04, "profit_factor": 7.921, "ic": 0.7556, "hit": 77.72, "n": 2478, "precision": 0.794, "recall": 0.7716, "f1": 0.7826, "f2": 0.776, "mcc": 0.5596, "accuracy": 0.7797, "tp": 983, "fp": 255, "tn": 949, "fn": 291}], "experiment_num": 96, "status": "KEEP"}
