{"backbone": "lstm", "description": "lstm: Exp7 hidden=64 WIRED Gu2020 reduced-capacity (dead param fixed)", "config": {"seq_len": 10, "lr": 0.001, "batch_size": 32, "epochs": 100, "weight_decay": 1e-05, "patience": 15, "grad_clip": 1.0, "warmup_epochs": 0, "huber_delta": 1.0, "head_dropout": 0.25, "seed": 0, "hidden_size": 64, "het_loss": false}, "composite": 4.4631, "test_pos_folds": 6, "val_pos_folds": 5, "val_loss": 2.7e-05, "elapsed_sec": 33.6, "timestamp": "2026-04-19T18:12:31", "sharpe": 4.7631, "psr": 1.0, "equity": 6599.59, "sortino": 5.7526, "return_pct": 559.96, "max_dd": 15.02, "win_rate": 66.36, "profit_factor": 2.457, "ic": 0.4168, "hit": 66.08, "aleatoric_mean": 1e-05, "epistemic_mean": 1.9e-05, "confidence_mean": 1.0, "precision": 0.6246, "recall": 0.7921, "f1": 0.6984, "f2": 0.7518, "mcc": 0.3377, "accuracy": 0.6619, "per_window": [{"fold": "fold_1", "regime": "Pre-crisis upturn + GFC onset", "sharpe": 0.1666, "sortino": 0.1874, "return_pct": 0.55, "equity": 1005.54, "max_dd": 7.54, "win_rate": 50.98, "profit_factor": 1.04, "ic": -0.0363, "hit": 50.49, "n": 103, "precision": 0.5161, "recall": 0.6038, "f1": 0.5565, "f2": 0.5839, "mcc": 0.0039, "accuracy": 0.5049, "tp": 32, "fp": 30, "tn": 20, "fn": 21, "aleatoric_mean": 1.7e-05, "epistemic_mean": 3.4e-05, "confidence_mean": 0.9999, "aleatoric_std": 1e-05, "epistemic_std": 2e-05}, {"fold": "fold_2", "regime": "Post-crash recovery", "sharpe": -2.0734, "sortino": -3.3505, "return_pct": -9.64, "equity": 903.56, "max_dd": 10.97, "win_rate": 49.53, "profit_factor": 0.723, "ic": -0.0538, "hit": 49.53, "n": 107, "precision": 0.4824, "recall": 0.8039, "f1": 0.6029, "f2": 0.7093, "mcc": 0.0225, "accuracy": 0.4953, "tp": 41, "fp": 44, "tn": 12, "fn": 10, "aleatoric_mean": 1.1e-05, "epistemic_mean": 2.2e-05, "confidence_mean": 1.0, "aleatoric_std": 5e-06, "epistemic_std": 9e-06}, {"fold": "fold_3", "regime": "Eurozone debt plateau", "sharpe": 7.9214, "sortino": 14.907, "return_pct": 28.42, "equity": 1284.19, "max_dd": 2.03, "win_rate": 70.19, "profit_factor": 3.508, "ic": 0.5002, "hit": 68.87, "n": 106, "precision": 0.7, "recall": 0.7368, "f1": 0.7179, "f2": 0.7292, "mcc": 0.3717, "accuracy": 0.6887, "tp": 42, "fp": 18, "tn": 31, "fn": 15, "aleatoric_mean": 1e-05, "epistemic_mean": 2.1e-05, "confidence_mean": 1.0, "aleatoric_std": 4e-06, "epistemic_std": 8e-06}, {"fold": "fold_4", "regime": "Strong USD downturn", "sharpe": 8.718, "sortino": 16.6214, "return_pct": 80.42, "equity": 1804.19, "max_dd": 1.81, "win_rate": 74.25, "profit_factor": 4.583, "ic": 0.6691, "hit": 73.81, "n": 168, "precision": 0.7216, "recall": 0.814, "f1": 0.765, "f2": 0.7937, "mcc": 0.4905, "accuracy": 0.744, "tp": 70, "fp": 27, "tn": 55, "fn": 16, "aleatoric_mean": 8e-06, "epistemic_mean": 1.6e-05, "confidence_mean": 1.0, "aleatoric_std": 3e-06, "epistemic_std": 6e-06}, {"fold": "fold_5", "regime": "Low-vol plateau", "sharpe": 8.5314, "sortino": 22.0167, "return_pct": 28.36, "equity": 1283.55, "max_dd": 0.67, "win_rate": 67.9, "profit_factor": 4.333, "ic": 0.5728, "hit": 67.9, "n": 162, "precision": 0.6333, "recall": 0.75, "f1": 0.6867, "f2": 0.7234, "mcc": 0.3679, "accuracy": 0.679, "tp": 57, "fp": 33, "tn": 53, "fn": 19, "aleatoric_mean": 6e-06, "epistemic_mean": 1.2e-05, "confidence_mean": 1.0, "aleatoric_std": 2e-06, "epistemic_std": 4e-06}, {"fold": "fold_6", "regime": "EUR crisis downturn", "sharpe": 9.0298, "sortino": 18.607, "return_pct": 63.45, "equity": 1634.5, "max_dd": 2.24, "win_rate": 72.12, "profit_factor": 4.466, "ic": 0.6367, "hit": 72.12, "n": 165, "precision": 0.6476, "recall": 0.8831, "f1": 0.7473, "f2": 0.8232, "mcc": 0.4798, "accuracy": 0.7212, "tp": 68, "fp": 37, "tn": 51, "fn": 9, "aleatoric_mean": 9e-06, "epistemic_mean": 1.9e-05, "confidence_mean": 1.0, "aleatoric_std": 4e-06, "epistemic_std": 8e-06}, {"fold": "fold_7", "regime": "Recent mixed/upturn", "sharpe": 7.5026, "sortino": 9.9023, "return_pct": 49.44, "equity": 1494.36, "max_dd": 3.73, "win_rate": 69.14, "profit_factor": 3.683, "ic": 0.6438, "hit": 69.14, "n": 162, "precision": 0.6396, "recall": 0.8765, "f1": 0.7396, "f2": 0.8161, "mcc": 0.412, "accuracy": 0.6914, "tp": 71, "fp": 40, "tn": 41, "fn": 10, "aleatoric_mean": 1e-05, "epistemic_mean": 2e-05, "confidence_mean": 1.0, "aleatoric_std": 4e-06, "epistemic_std": 8e-06}], "val_sharpe": 5.2411, "val_psr": 1.0, "val_equity": 3231.05, "val_sortino": 7.8155, "val_return_pct": 223.1, "val_max_dd": 11.79, "val_win_rate": 64.22, "val_profit_factor": 2.451, "val_ic": 0.4714, "val_hit": 63.8, "val_aleatoric_mean": 7e-06, "val_epistemic_mean": 1.5e-05, "val_confidence_mean": 1.0, "val_precision": 0.5934, "val_recall": 0.7918, "val_f1": 0.6784, "val_f2": 0.7422, "val_mcc": 0.3115, "val_accuracy": 0.6432, "val_per_window": [{"fold": "fold_1", "regime": "Pre-crisis upturn + GFC onset", "sharpe": -0.1058, "sortino": -0.1757, "return_pct": -0.34, "equity": 996.6, "max_dd": 4.06, "win_rate": 42.59, "profit_factor": 0.983, "ic": 0.0062, "hit": 42.2, "n": 109, "precision": 0.4507, "recall": 0.5818, "f1": 0.5079, "f2": 0.5498, "mcc": -0.1473, "accuracy": 0.4312, "tp": 32, "fp": 39, "tn": 15, "fn": 23, "aleatoric_mean": 7e-06, "epistemic_mean": 1.5e-05, "confidence_mean": 1.0, "aleatoric_std": 3e-06, "epistemic_std": 6e-06}, {"fold": "fold_2", "regime": "Post-crash recovery", "sharpe": -1.1036, "sortino": -1.6737, "return_pct": -5.47, "equity": 945.34, "max_dd": 11.1, "win_rate": 47.22, "profit_factor": 0.84, "ic": 0.0163, "hit": 47.22, "n": 108, "precision": 0.5455, "recall": 0.5714, "f1": 0.5581, "f2": 0.566, "mcc": -0.0963, "accuracy": 0.4722, "tp": 36, "fp": 30, "tn": 15, "fn": 27, "aleatoric_mean": 1.1e-05, "epistemic_mean": 2.1e-05, "confidence_mean": 1.0, "aleatoric_std": 5e-06, "epistemic_std": 9e-06}, {"fold": "fold_3", "regime": "Eurozone debt plateau", "sharpe": 9.7863, "sortino": 21.8241, "return_pct": 39.81, "equity": 1398.14, "max_dd": 2.04, "win_rate": 71.56, "profit_factor": 5.167, "ic": 0.7204, "hit": 70.27, "n": 111, "precision": 0.6053, "recall": 0.9787, "f1": 0.748, "f2": 0.8712, "mcc": 0.5423, "accuracy": 0.7207, "tp": 46, "fp": 30, "tn": 34, "fn": 1, "aleatoric_mean": 6e-06, "epistemic_mean": 1.2e-05, "confidence_mean": 1.0, "aleatoric_std": 2e-06, "epistemic_std": 5e-06}, {"fold": "fold_4", "regime": "Strong USD downturn", "sharpe": 9.0295, "sortino": 17.6589, "return_pct": 31.18, "equity": 1311.84, "max_dd": 0.92, "win_rate": 75.23, "profit_factor": 4.698, "ic": 0.6752, "hit": 74.55, "n": 110, "precision": 0.6786, "recall": 0.8085, "f1": 0.7379, "f2": 0.7787, "mcc": 0.5173, "accuracy": 0.7545, "tp": 38, "fp": 18, "tn": 45, "fn": 9, "aleatoric_mean": 8e-06, "epistemic_mean": 1.5e-05, "confidence_mean": 1.0, "aleatoric_std": 3e-06, "epistemic_std": 6e-06}, {"fold": "fold_5", "regime": "Low-vol plateau", "sharpe": 10.6156, "sortino": 29.3525, "return_pct": 34.09, "equity": 1340.89, "max_dd": 1.24, "win_rate": 76.79, "profit_factor": 6.492, "ic": 0.7265, "hit": 76.79, "n": 112, "precision": 0.7213, "recall": 0.8302, "f1": 0.7719, "f2": 0.8059, "mcc": 0.5434, "accuracy": 0.7679, "tp": 44, "fp": 17, "tn": 42, "fn": 9, "aleatoric_mean": 6e-06, "epistemic_mean": 1.3e-05, "confidence_mean": 1.0, "aleatoric_std": 2e-06, "epistemic_std": 5e-06}, {"fold": "fold_6", "regime": "EUR crisis downturn", "sharpe": 9.3345, "sortino": 21.2304, "return_pct": 20.16, "equity": 1201.64, "max_dd": 0.86, "win_rate": 70.09, "profit_factor": 5.189, "ic": 0.6999, "hit": 69.44, "n": 108, "precision": 0.6, "recall": 0.8936, "f1": 0.7179, "f2": 0.814, "mcc": 0.4512, "accuracy": 0.6944, "tp": 42, "fp": 28, "tn": 33, "fn": 5, "aleatoric_mean": 6e-06, "epistemic_mean": 1.2e-05, "confidence_mean": 1.0, "aleatoric_std": 2e-06, "epistemic_std": 4e-06}, {"fold": "fold_7", "regime": "Recent mixed/upturn", "sharpe": 6.7723, "sortino": 15.0933, "return_pct": 16.05, "equity": 1160.49, "max_dd": 1.32, "win_rate": 65.45, "profit_factor": 3.004, "ic": 0.5872, "hit": 65.45, "n": 110, "precision": 0.5862, "recall": 0.9623, "f1": 0.7286, "f2": 0.8528, "mcc": 0.4063, "accuracy": 0.6545, "tp": 51, "fp": 36, "tn": 21, "fn": 2, "aleatoric_mean": 8e-06, "epistemic_mean": 1.7e-05, "confidence_mean": 1.0, "aleatoric_std": 3e-06, "epistemic_std": 7e-06}], "train_sharpe": 6.0876, "train_psr": 1.0, "train_equity": 994463.5, "train_sortino": 15.2824, "train_return_pct": 99346.35, "train_max_dd": 7.91, "train_win_rate": 70.83, "train_profit_factor": 4.275, "train_ic": 0.618, "train_hit": 70.54, "train_precision": 0.6651, "train_recall": 0.8634, "train_f1": 0.7514, "train_f2": 0.8148, "train_mcc": 0.4278, "train_accuracy": 0.7062, "train_per_window": [{"fold": "all_train", "regime": "Training data", "sharpe": 6.0876, "sortino": 15.2824, "return_pct": 99346.35, "equity": 994463.5, "max_dd": 7.91, "win_rate": 70.83, "profit_factor": 4.275, "ic": 0.618, "hit": 70.54, "n": 2478, "precision": 0.6651, "recall": 0.8634, "f1": 0.7514, "f2": 0.8148, "mcc": 0.4278, "accuracy": 0.7062, "tp": 1100, "fp": 554, "tn": 650, "fn": 174}], "experiment_num": 111, "status": "DISCARD"}
{"backbone": "lstm", "description": "lstm: Exp8 bs=64 smoother grads (Zaremba2014)", "config": {"seq_len": 10, "lr": 0.001, "batch_size": 64, "epochs": 100, "weight_decay": 1e-05, "patience": 15, "grad_clip": 1.0, "warmup_epochs": 0, "huber_delta": 1.0, "head_dropout": 0.25, "seed": 0, "het_loss": false}, "composite": 4.3043, "test_pos_folds": 6, "val_pos_folds": 6, "val_loss": 2.7e-05, "elapsed_sec": 21.8, "timestamp": "2026-04-19T18:14:55", "sharpe": 4.5043, "psr": 1.0, "equity": 5996.53, "sortino": 5.7113, "return_pct": 499.65, "max_dd": 10.96, "win_rate": 64.81, "profit_factor": 2.335, "ic": 0.4293, "hit": 64.54, "aleatoric_mean": 2e-05, "epistemic_mean": 4e-05, "confidence_mean": 0.9999, "precision": 0.7244, "recall": 0.4699, "f1": 0.57, "f2": 0.5054, "mcc": 0.3161, "accuracy": 0.6495, "per_window": [{"fold": "fold_1", "regime": "Pre-crisis upturn + GFC onset", "sharpe": -0.51, "sortino": -0.5851, "return_pct": -4.56, "equity": 954.43, "max_dd": 10.96, "win_rate": 48.04, "profit_factor": 0.887, "ic": -0.0184, "hit": 47.57, "n": 103, "precision": 0.5, "recall": 0.0943, "f1": 0.1587, "f2": 0.1126, "mcc": -0.0096, "accuracy": 0.4854, "tp": 5, "fp": 5, "tn": 45, "fn": 48, "aleatoric_mean": 2.8e-05, "epistemic_mean": 5.6e-05, "confidence_mean": 0.9999, "aleatoric_std": 1.8e-05, "epistemic_std": 3.7e-05}, {"fold": "fold_2", "regime": "Post-crash recovery", "sharpe": 0.3319, "sortino": 0.6151, "return_pct": 1.33, "equity": 1013.3, "max_dd": 7.87, "win_rate": 51.4, "profit_factor": 1.053, "ic": 0.081, "hit": 51.4, "n": 107, "precision": 0.4923, "recall": 0.6275, "f1": 0.5517, "f2": 0.5948, "mcc": 0.039, "accuracy": 0.514, "tp": 32, "fp": 33, "tn": 23, "fn": 19, "aleatoric_mean": 3.3e-05, "epistemic_mean": 6.5e-05, "confidence_mean": 0.9999, "aleatoric_std": 1.8e-05, "epistemic_std": 3.7e-05}, {"fold": "fold_3", "regime": "Eurozone debt plateau", "sharpe": 6.9542, "sortino": 12.9036, "return_pct": 25.19, "equity": 1251.86, "max_dd": 1.32, "win_rate": 69.23, "profit_factor": 2.999, "ic": 0.5645, "hit": 67.92, "n": 106, "precision": 0.7451, "recall": 0.6667, "f1": 0.7037, "f2": 0.681, "mcc": 0.4005, "accuracy": 0.6981, "tp": 38, "fp": 13, "tn": 36, "fn": 19, "aleatoric_mean": 2.3e-05, "epistemic_mean": 4.5e-05, "confidence_mean": 0.9999, "aleatoric_std": 1.1e-05, "epistemic_std": 2.3e-05}, {"fold": "fold_4", "regime": "Strong USD downturn", "sharpe": 6.7692, "sortino": 12.2069, "return_pct": 61.61, "equity": 1616.1, "max_dd": 3.07, "win_rate": 68.26, "profit_factor": 3.192, "ic": 0.6322, "hit": 67.86, "n": 168, "precision": 0.9024, "recall": 0.4302, "f1": 0.5827, "f2": 0.4805, "mcc": 0.4439, "accuracy": 0.6845, "tp": 37, "fp": 4, "tn": 78, "fn": 49, "aleatoric_mean": 1.9e-05, "epistemic_mean": 3.8e-05, "confidence_mean": 0.9999, "aleatoric_std": 1e-05, "epistemic_std": 2e-05}, {"fold": "fold_5", "regime": "Low-vol plateau", "sharpe": 6.5981, "sortino": 13.2505, "return_pct": 22.41, "equity": 1224.13, "max_dd": 1.1, "win_rate": 65.43, "profit_factor": 3.055, "ic": 0.6519, "hit": 65.43, "n": 162, "precision": 0.8846, "recall": 0.3026, "f1": 0.451, "f2": 0.3485, "mcc": 0.364, "accuracy": 0.6543, "tp": 23, "fp": 3, "tn": 83, "fn": 53, "aleatoric_mean": 1e-05, "epistemic_mean": 2.1e-05, "confidence_mean": 1.0, "aleatoric_std": 4e-06, "epistemic_std": 7e-06}, {"fold": "fold_6", "regime": "EUR crisis downturn", "sharpe": 8.8933, "sortino": 20.9508, "return_pct": 62.53, "equity": 1625.25, "max_dd": 1.62, "win_rate": 67.27, "profit_factor": 4.36, "ic": 0.6921, "hit": 67.27, "n": 165, "precision": 0.7447, "recall": 0.4545, "f1": 0.5645, "f2": 0.493, "mcc": 0.3517, "accuracy": 0.6727, "tp": 35, "fp": 12, "tn": 76, "fn": 42, "aleatoric_mean": 1.9e-05, "epistemic_mean": 3.9e-05, "confidence_mean": 0.9999, "aleatoric_std": 1e-05, "epistemic_std": 2e-05}, {"fold": "fold_7", "regime": "Recent mixed/upturn", "sharpe": 8.21, "sortino": 13.0024, "return_pct": 54.05, "equity": 1540.45, "max_dd": 2.31, "win_rate": 74.69, "profit_factor": 4.208, "ic": 0.555, "hit": 74.69, "n": 162, "precision": 0.7778, "recall": 0.6914, "f1": 0.732, "f2": 0.7071, "mcc": 0.4969, "accuracy": 0.7469, "tp": 56, "fp": 16, "tn": 65, "fn": 25, "aleatoric_mean": 1.6e-05, "epistemic_mean": 3.2e-05, "confidence_mean": 1.0, "aleatoric_std": 6e-06, "epistemic_std": 1.2e-05}], "val_sharpe": 5.0111, "val_psr": 1.0, "val_equity": 3082.51, "val_sortino": 7.7351, "val_return_pct": 208.25, "val_max_dd": 10.24, "val_win_rate": 63.83, "val_profit_factor": 2.354, "val_ic": 0.4672, "val_hit": 63.41, "val_aleatoric_mean": 1.5e-05, "val_epistemic_mean": 2.9e-05, "val_confidence_mean": 1.0, "val_precision": 0.7014, "val_recall": 0.4247, "val_f1": 0.529, "val_f2": 0.461, "val_mcc": 0.2878, "val_accuracy": 0.6406, "val_per_window": [{"fold": "fold_1", "regime": "Pre-crisis upturn + GFC onset", "sharpe": 0.5016, "sortino": 0.8386, "return_pct": 1.2, "equity": 1011.99, "max_dd": 3.24, "win_rate": 45.37, "profit_factor": 1.087, "ic": 0.086, "hit": 44.95, "n": 109, "precision": 0.4583, "recall": 0.4, "f1": 0.4272, "f2": 0.4104, "mcc": -0.0821, "accuracy": 0.4587, "tp": 22, "fp": 26, "tn": 28, "fn": 33, "aleatoric_mean": 1.6e-05, "epistemic_mean": 3.3e-05, "confidence_mean": 1.0, "aleatoric_std": 1.4e-05, "epistemic_std": 2.8e-05}, {"fold": "fold_2", "regime": "Post-crash recovery", "sharpe": -1.0159, "sortino": -1.6198, "return_pct": -5.07, "equity": 949.34, "max_dd": 10.24, "win_rate": 45.37, "profit_factor": 0.852, "ic": -0.0584, "hit": 45.37, "n": 108, "precision": 0.5714, "recall": 0.254, "f1": 0.3516, "f2": 0.2857, "mcc": -0.0143, "accuracy": 0.4537, "tp": 16, "fp": 12, "tn": 33, "fn": 47, "aleatoric_mean": 2e-05, "epistemic_mean": 3.9e-05, "confidence_mean": 0.9999, "aleatoric_std": 8e-06, "epistemic_std": 1.5e-05}, {"fold": "fold_3", "regime": "Eurozone debt plateau", "sharpe": 10.3162, "sortino": 21.6145, "return_pct": 41.63, "equity": 1416.33, "max_dd": 0.98, "win_rate": 76.15, "profit_factor": 5.703, "ic": 0.6833, "hit": 74.77, "n": 111, "precision": 0.7333, "recall": 0.7021, "f1": 0.7174, "f2": 0.7082, "mcc": 0.5179, "accuracy": 0.7658, "tp": 33, "fp": 12, "tn": 52, "fn": 14, "aleatoric_mean": 1.7e-05, "epistemic_mean": 3.5e-05, "confidence_mean": 0.9999, "aleatoric_std": 8e-06, "epistemic_std": 1.7e-05}, {"fold": "fold_4", "regime": "Strong USD downturn", "sharpe": 11.5924, "sortino": 32.1044, "return_pct": 38.27, "equity": 1382.69, "max_dd": 0.94, "win_rate": 77.06, "profit_factor": 7.855, "ic": 0.82, "hit": 76.36, "n": 110, "precision": 0.9231, "recall": 0.5106, "f1": 0.6575, "f2": 0.5607, "mcc": 0.5576, "accuracy": 0.7727, "tp": 24, "fp": 2, "tn": 61, "fn": 23, "aleatoric_mean": 1.3e-05, "epistemic_mean": 2.5e-05, "confidence_mean": 1.0, "aleatoric_std": 5e-06, "epistemic_std": 9e-06}, {"fold": "fold_5", "regime": "Low-vol plateau", "sharpe": 7.3105, "sortino": 15.5355, "return_pct": 24.66, "equity": 1246.6, "max_dd": 3.14, "win_rate": 67.86, "profit_factor": 3.46, "ic": 0.7093, "hit": 67.86, "n": 112, "precision": 0.9048, "recall": 0.3585, "f1": 0.5135, "f2": 0.4077, "mcc": 0.4152, "accuracy": 0.6786, "tp": 19, "fp": 2, "tn": 57, "fn": 34, "aleatoric_mean": 1.1e-05, "epistemic_mean": 2.2e-05, "confidence_mean": 1.0, "aleatoric_std": 4e-06, "epistemic_std": 9e-06}, {"fold": "fold_6", "regime": "EUR crisis downturn", "sharpe": 9.3871, "sortino": 21.0225, "return_pct": 20.26, "equity": 1202.56, "max_dd": 1.05, "win_rate": 72.9, "profit_factor": 5.244, "ic": 0.7068, "hit": 72.22, "n": 108, "precision": 0.95, "recall": 0.4043, "f1": 0.5672, "f2": 0.4567, "mcc": 0.495, "accuracy": 0.7315, "tp": 19, "fp": 1, "tn": 60, "fn": 28, "aleatoric_mean": 1e-05, "epistemic_mean": 1.9e-05, "confidence_mean": 1.0, "aleatoric_std": 3e-06, "epistemic_std": 7e-06}, {"fold": "fold_7", "regime": "Recent mixed/upturn", "sharpe": 3.836, "sortino": 6.8793, "return_pct": 9.29, "equity": 1092.89, "max_dd": 2.0, "win_rate": 61.82, "profit_factor": 1.856, "ic": 0.4484, "hit": 61.82, "n": 110, "precision": 0.6667, "recall": 0.4151, "f1": 0.5116, "f2": 0.449, "mcc": 0.2422, "accuracy": 0.6182, "tp": 22, "fp": 11, "tn": 46, "fn": 31, "aleatoric_mean": 1.6e-05, "epistemic_mean": 3.2e-05, "confidence_mean": 1.0, "aleatoric_std": 7e-06, "epistemic_std": 1.3e-05}], "train_sharpe": 5.386, "train_psr": 1.0, "train_equity": 485900.47, "train_sortino": 12.8545, "train_return_pct": 48490.05, "train_max_dd": 10.88, "train_win_rate": 67.95, "train_profit_factor": 3.516, "train_ic": 0.6502, "train_hit": 67.68, "train_precision": 0.8385, "train_recall": 0.4686, "train_f1": 0.6012, "train_f2": 0.5139, "train_mcc": 0.4121, "train_accuracy": 0.6804, "train_per_window": [{"fold": "all_train", "regime": "Training data", "sharpe": 5.386, "sortino": 12.8545, "return_pct": 48490.05, "equity": 485900.47, "max_dd": 10.88, "win_rate": 67.95, "profit_factor": 3.516, "ic": 0.6502, "hit": 67.68, "n": 2478, "precision": 0.8385, "recall": 0.4686, "f1": 0.6012, "f2": 0.5139, "mcc": 0.4121, "accuracy": 0.6804, "tp": 597, "fp": 115, "tn": 1089, "fn": 677}], "experiment_num": 112, "status": "DISCARD"}
