{"backbone": "mlp", "description": "mlp: Exp41 RESAVE champion with scaler for portability", "config": {"seq_len": 10, "lr": 0.0005, "batch_size": 32, "epochs": 50, "weight_decay": 1e-05, "patience": 10, "grad_clip": 1.0, "warmup_epochs": 0, "huber_delta": 0.5, "head_dropout": 0.15, "seed": 0, "het_loss": false}, "composite": 5.499, "test_pos_folds": 7, "val_pos_folds": 6, "val_loss": 3.8e-05, "elapsed_sec": 14.4, "timestamp": "2026-04-19T17:05:53", "sharpe": 6.2113, "psr": 1.0, "equity": 11010.87, "sortino": 11.3103, "return_pct": 1001.09, "max_dd": 4.13, "win_rate": 69.35, "profit_factor": 3.295, "ic": 0.4846, "hit": 69.06, "aleatoric_mean": 2.6e-05, "epistemic_mean": 5.2e-05, "confidence_mean": 0.9999, "precision": 0.6778, "recall": 0.7173, "f1": 0.697, "f2": 0.709, "mcc": 0.3843, "accuracy": 0.6917, "per_window": [{"fold": "fold_1", "regime": "Pre-crisis upturn + GFC onset", "sharpe": 2.4608, "sortino": 6.7778, "return_pct": 19.79, "equity": 1197.85, "max_dd": 3.29, "win_rate": 60.78, "profit_factor": 1.805, "ic": 0.1877, "hit": 60.19, "n": 103, "precision": 0.625, "recall": 0.566, "f1": 0.5941, "f2": 0.5769, "mcc": 0.2064, "accuracy": 0.6019, "tp": 30, "fp": 18, "tn": 32, "fn": 23, "aleatoric_mean": 5.3e-05, "epistemic_mean": 0.000106, "confidence_mean": 0.9998, "aleatoric_std": 7e-05, "epistemic_std": 0.000141}, {"fold": "fold_2", "regime": "Post-crash recovery", "sharpe": 1.1722, "sortino": 2.0218, "return_pct": 5.49, "equity": 1054.86, "max_dd": 3.47, "win_rate": 53.27, "profit_factor": 1.202, "ic": 0.0824, "hit": 53.27, "n": 107, "precision": 0.5067, "recall": 0.7451, "f1": 0.6032, "f2": 0.681, "mcc": 0.0921, "accuracy": 0.5327, "tp": 38, "fp": 37, "tn": 19, "fn": 13, "aleatoric_mean": 2.1e-05, "epistemic_mean": 4.3e-05, "confidence_mean": 0.9999, "aleatoric_std": 1.5e-05, "epistemic_std": 3.1e-05}, {"fold": "fold_3", "regime": "Eurozone debt plateau", "sharpe": 9.7583, "sortino": 18.8138, "return_pct": 34.13, "equity": 1341.27, "max_dd": 1.32, "win_rate": 75.96, "profit_factor": 4.755, "ic": 0.5836, "hit": 74.53, "n": 106, "precision": 0.7143, "recall": 0.8772, "f1": 0.7874, "f2": 0.8389, "mcc": 0.4938, "accuracy": 0.7453, "tp": 50, "fp": 20, "tn": 29, "fn": 7, "aleatoric_mean": 2.8e-05, "epistemic_mean": 5.5e-05, "confidence_mean": 0.9999, "aleatoric_std": 1.4e-05, "epistemic_std": 2.9e-05}, {"fold": "fold_4", "regime": "Strong USD downturn", "sharpe": 9.7799, "sortino": 19.4179, "return_pct": 90.3, "equity": 1902.97, "max_dd": 1.81, "win_rate": 75.45, "profit_factor": 5.651, "ic": 0.6667, "hit": 75.0, "n": 168, "precision": 0.7528, "recall": 0.7791, "f1": 0.7657, "f2": 0.7737, "mcc": 0.5115, "accuracy": 0.756, "tp": 67, "fp": 22, "tn": 60, "fn": 19, "aleatoric_mean": 3.6e-05, "epistemic_mean": 7.2e-05, "confidence_mean": 0.9999, "aleatoric_std": 2.9e-05, "epistemic_std": 5.8e-05}, {"fold": "fold_5", "regime": "Low-vol plateau", "sharpe": 8.8545, "sortino": 16.1387, "return_pct": 29.29, "equity": 1292.92, "max_dd": 1.43, "win_rate": 70.99, "profit_factor": 4.604, "ic": 0.638, "hit": 70.99, "n": 162, "precision": 0.7458, "recall": 0.5789, "f1": 0.6519, "f2": 0.6061, "mcc": 0.4195, "accuracy": 0.7099, "tp": 44, "fp": 15, "tn": 71, "fn": 32, "aleatoric_mean": 1.2e-05, "epistemic_mean": 2.5e-05, "confidence_mean": 1.0, "aleatoric_std": 7e-06, "epistemic_std": 1.3e-05}, {"fold": "fold_6", "regime": "EUR crisis downturn", "sharpe": 9.9474, "sortino": 21.0105, "return_pct": 69.54, "equity": 1695.35, "max_dd": 2.27, "win_rate": 70.91, "profit_factor": 5.27, "ic": 0.641, "hit": 70.91, "n": 165, "precision": 0.7458, "recall": 0.5714, "f1": 0.6471, "f2": 0.5995, "mcc": 0.4174, "accuracy": 0.7091, "tp": 44, "fp": 15, "tn": 73, "fn": 33, "aleatoric_mean": 2.4e-05, "epistemic_mean": 4.9e-05, "confidence_mean": 0.9999, "aleatoric_std": 1.7e-05, "epistemic_std": 3.3e-05}, {"fold": "fold_7", "regime": "Recent mixed/upturn", "sharpe": 8.4769, "sortino": 14.3598, "return_pct": 55.75, "equity": 1557.55, "max_dd": 1.64, "win_rate": 71.6, "profit_factor": 4.429, "ic": 0.6222, "hit": 71.6, "n": 162, "precision": 0.6606, "recall": 0.8889, "f1": 0.7579, "f2": 0.8314, "mcc": 0.4605, "accuracy": 0.716, "tp": 72, "fp": 37, "tn": 44, "fn": 9, "aleatoric_mean": 1.7e-05, "epistemic_mean": 3.4e-05, "confidence_mean": 0.9999, "aleatoric_std": 1e-05, "epistemic_std": 2e-05}], "val_sharpe": 5.599, "val_psr": 1.0, "val_equity": 3472.42, "val_sortino": 8.4457, "val_return_pct": 247.24, "val_max_dd": 7.43, "val_win_rate": 66.19, "val_profit_factor": 2.61, "val_ic": 0.4582, "val_hit": 65.76, "val_aleatoric_mean": 1.5e-05, "val_epistemic_mean": 3e-05, "val_confidence_mean": 1.0, "val_precision": 0.6588, "val_recall": 0.6082, "val_f1": 0.6325, "val_f2": 0.6177, "val_mcc": 0.3249, "val_accuracy": 0.6641, "val_per_window": [{"fold": "fold_1", "regime": "Pre-crisis upturn + GFC onset", "sharpe": 0.0212, "sortino": 0.0342, "return_pct": -0.02, "equity": 999.8, "max_dd": 2.91, "win_rate": 47.22, "profit_factor": 1.004, "ic": -0.0659, "hit": 46.79, "n": 109, "precision": 0.4833, "recall": 0.5273, "f1": 0.5043, "f2": 0.5179, "mcc": -0.047, "accuracy": 0.4771, "tp": 29, "fp": 31, "tn": 23, "fn": 26, "aleatoric_mean": 1.6e-05, "epistemic_mean": 3.1e-05, "confidence_mean": 1.0, "aleatoric_std": 2e-05, "epistemic_std": 4.1e-05}, {"fold": "fold_2", "regime": "Post-crash recovery", "sharpe": -0.6284, "sortino": -0.9753, "return_pct": -3.27, "equity": 967.3, "max_dd": 7.43, "win_rate": 47.22, "profit_factor": 0.906, "ic": 0.0432, "hit": 47.22, "n": 108, "precision": 0.5789, "recall": 0.3492, "f1": 0.4356, "f2": 0.3793, "mcc": -0.0066, "accuracy": 0.4722, "tp": 22, "fp": 16, "tn": 29, "fn": 41, "aleatoric_mean": 2.7e-05, "epistemic_mean": 5.5e-05, "confidence_mean": 0.9999, "aleatoric_std": 2.2e-05, "epistemic_std": 4.3e-05}, {"fold": "fold_3", "regime": "Eurozone debt plateau", "sharpe": 11.0234, "sortino": 30.4677, "return_pct": 43.97, "equity": 1439.69, "max_dd": 0.84, "win_rate": 78.9, "profit_factor": 6.531, "ic": 0.6702, "hit": 77.48, "n": 111, "precision": 0.74, "recall": 0.7872, "f1": 0.7629, "f2": 0.7773, "mcc": 0.5801, "accuracy": 0.7928, "tp": 37, "fp": 13, "tn": 51, "fn": 10, "aleatoric_mean": 1.8e-05, "epistemic_mean": 3.6e-05, "confidence_mean": 0.9999, "aleatoric_std": 1.3e-05, "epistemic_std": 2.5e-05}, {"fold": "fold_4", "regime": "Strong USD downturn", "sharpe": 7.8607, "sortino": 16.5925, "return_pct": 27.57, "equity": 1275.68, "max_dd": 1.08, "win_rate": 71.56, "profit_factor": 3.79, "ic": 0.6035, "hit": 70.91, "n": 110, "precision": 0.6667, "recall": 0.6809, "f1": 0.6737, "f2": 0.678, "mcc": 0.4258, "accuracy": 0.7182, "tp": 32, "fp": 16, "tn": 47, "fn": 15, "aleatoric_mean": 1.4e-05, "epistemic_mean": 2.7e-05, "confidence_mean": 1.0, "aleatoric_std": 1.2e-05, "epistemic_std": 2.5e-05}, {"fold": "fold_5", "regime": "Low-vol plateau", "sharpe": 10.5961, "sortino": 28.9438, "return_pct": 34.04, "equity": 1340.39, "max_dd": 0.62, "win_rate": 75.0, "profit_factor": 6.466, "ic": 0.7232, "hit": 75.0, "n": 112, "precision": 0.766, "recall": 0.6792, "f1": 0.72, "f2": 0.695, "mcc": 0.4986, "accuracy": 0.75, "tp": 36, "fp": 11, "tn": 48, "fn": 17, "aleatoric_mean": 1.3e-05, "epistemic_mean": 2.6e-05, "confidence_mean": 1.0, "aleatoric_std": 1e-05, "epistemic_std": 2e-05}, {"fold": "fold_6", "regime": "EUR crisis downturn", "sharpe": 9.2138, "sortino": 21.1712, "return_pct": 19.95, "equity": 1199.5, "max_dd": 0.82, "win_rate": 71.03, "profit_factor": 5.067, "ic": 0.717, "hit": 70.37, "n": 108, "precision": 0.7353, "recall": 0.5319, "f1": 0.6173, "f2": 0.5631, "mcc": 0.4103, "accuracy": 0.713, "tp": 25, "fp": 9, "tn": 52, "fn": 22, "aleatoric_mean": 8e-06, "epistemic_mean": 1.6e-05, "confidence_mean": 1.0, "aleatoric_std": 4e-06, "epistemic_std": 8e-06}, {"fold": "fold_7", "regime": "Recent mixed/upturn", "sharpe": 9.5361, "sortino": 25.4132, "return_pct": 21.6, "equity": 1215.96, "max_dd": 0.72, "win_rate": 71.82, "profit_factor": 4.828, "ic": 0.5963, "hit": 71.82, "n": 110, "precision": 0.6833, "recall": 0.7736, "f1": 0.7257, "f2": 0.7537, "mcc": 0.4418, "accuracy": 0.7182, "tp": 41, "fp": 19, "tn": 38, "fn": 12, "aleatoric_mean": 9e-06, "epistemic_mean": 1.8e-05, "confidence_mean": 1.0, "aleatoric_std": 6e-06, "epistemic_std": 1.1e-05}], "train_sharpe": 7.9415, "train_psr": 1.0, "train_equity": 5670149.5, "train_sortino": 23.2561, "train_return_pct": 566914.95, "train_max_dd": 4.92, "train_win_rate": 78.04, "train_profit_factor": 7.921, "train_ic": 0.7556, "train_hit": 77.72, "train_precision": 0.794, "train_recall": 0.7716, "train_f1": 0.7826, "train_f2": 0.776, "train_mcc": 0.5596, "train_accuracy": 0.7797, "train_per_window": [{"fold": "all_train", "regime": "Training data", "sharpe": 7.9415, "sortino": 23.2561, "return_pct": 566914.95, "equity": 5670149.5, "max_dd": 4.92, "win_rate": 78.04, "profit_factor": 7.921, "ic": 0.7556, "hit": 77.72, "n": 2478, "precision": 0.794, "recall": 0.7716, "f1": 0.7826, "f2": 0.776, "mcc": 0.5596, "accuracy": 0.7797, "tp": 983, "fp": 255, "tn": 949, "fn": 291}], "experiment_num": 97, "status": "KEEP"}
{"backbone": "mlp", "description": "mlp: Exp42 POST-CRASH safe-cores verify Exp41 (must match composite=5.499 tsh=6.2113)", "config": {"seq_len": 10, "lr": 0.0005, "batch_size": 32, "epochs": 50, "weight_decay": 1e-05, "patience": 10, "grad_clip": 1.0, "warmup_epochs": 0, "huber_delta": 0.5, "head_dropout": 0.15, "seed": 0, "het_loss": false}, "composite": 5.499, "test_pos_folds": 7, "val_pos_folds": 6, "val_loss": 3.8e-05, "elapsed_sec": 24.9, "timestamp": "2026-04-19T17:19:45", "sharpe": 6.2113, "psr": 1.0, "equity": 11010.87, "sortino": 11.3103, "return_pct": 1001.09, "max_dd": 4.13, "win_rate": 69.35, "profit_factor": 3.295, "ic": 0.4846, "hit": 69.06, "aleatoric_mean": 2.6e-05, "epistemic_mean": 5.2e-05, "confidence_mean": 0.9999, "precision": 0.6778, "recall": 0.7173, "f1": 0.697, "f2": 0.709, "mcc": 0.3843, "accuracy": 0.6917, "per_window": [{"fold": "fold_1", "regime": "Pre-crisis upturn + GFC onset", "sharpe": 2.4608, "sortino": 6.7778, "return_pct": 19.79, "equity": 1197.85, "max_dd": 3.29, "win_rate": 60.78, "profit_factor": 1.805, "ic": 0.1877, "hit": 60.19, "n": 103, "precision": 0.625, "recall": 0.566, "f1": 0.5941, "f2": 0.5769, "mcc": 0.2064, "accuracy": 0.6019, "tp": 30, "fp": 18, "tn": 32, "fn": 23, "aleatoric_mean": 5.3e-05, "epistemic_mean": 0.000106, "confidence_mean": 0.9998, "aleatoric_std": 7e-05, "epistemic_std": 0.000141}, {"fold": "fold_2", "regime": "Post-crash recovery", "sharpe": 1.1722, "sortino": 2.0218, "return_pct": 5.49, "equity": 1054.86, "max_dd": 3.47, "win_rate": 53.27, "profit_factor": 1.202, "ic": 0.0824, "hit": 53.27, "n": 107, "precision": 0.5067, "recall": 0.7451, "f1": 0.6032, "f2": 0.681, "mcc": 0.0921, "accuracy": 0.5327, "tp": 38, "fp": 37, "tn": 19, "fn": 13, "aleatoric_mean": 2.1e-05, "epistemic_mean": 4.3e-05, "confidence_mean": 0.9999, "aleatoric_std": 1.5e-05, "epistemic_std": 3.1e-05}, {"fold": "fold_3", "regime": "Eurozone debt plateau", "sharpe": 9.7583, "sortino": 18.8138, "return_pct": 34.13, "equity": 1341.27, "max_dd": 1.32, "win_rate": 75.96, "profit_factor": 4.755, "ic": 0.5836, "hit": 74.53, "n": 106, "precision": 0.7143, "recall": 0.8772, "f1": 0.7874, "f2": 0.8389, "mcc": 0.4938, "accuracy": 0.7453, "tp": 50, "fp": 20, "tn": 29, "fn": 7, "aleatoric_mean": 2.8e-05, "epistemic_mean": 5.5e-05, "confidence_mean": 0.9999, "aleatoric_std": 1.4e-05, "epistemic_std": 2.9e-05}, {"fold": "fold_4", "regime": "Strong USD downturn", "sharpe": 9.7799, "sortino": 19.4179, "return_pct": 90.3, "equity": 1902.97, "max_dd": 1.81, "win_rate": 75.45, "profit_factor": 5.651, "ic": 0.6667, "hit": 75.0, "n": 168, "precision": 0.7528, "recall": 0.7791, "f1": 0.7657, "f2": 0.7737, "mcc": 0.5115, "accuracy": 0.756, "tp": 67, "fp": 22, "tn": 60, "fn": 19, "aleatoric_mean": 3.6e-05, "epistemic_mean": 7.2e-05, "confidence_mean": 0.9999, "aleatoric_std": 2.9e-05, "epistemic_std": 5.8e-05}, {"fold": "fold_5", "regime": "Low-vol plateau", "sharpe": 8.8545, "sortino": 16.1387, "return_pct": 29.29, "equity": 1292.92, "max_dd": 1.43, "win_rate": 70.99, "profit_factor": 4.604, "ic": 0.638, "hit": 70.99, "n": 162, "precision": 0.7458, "recall": 0.5789, "f1": 0.6519, "f2": 0.6061, "mcc": 0.4195, "accuracy": 0.7099, "tp": 44, "fp": 15, "tn": 71, "fn": 32, "aleatoric_mean": 1.2e-05, "epistemic_mean": 2.5e-05, "confidence_mean": 1.0, "aleatoric_std": 7e-06, "epistemic_std": 1.3e-05}, {"fold": "fold_6", "regime": "EUR crisis downturn", "sharpe": 9.9474, "sortino": 21.0105, "return_pct": 69.54, "equity": 1695.35, "max_dd": 2.27, "win_rate": 70.91, "profit_factor": 5.27, "ic": 0.641, "hit": 70.91, "n": 165, "precision": 0.7458, "recall": 0.5714, "f1": 0.6471, "f2": 0.5995, "mcc": 0.4174, "accuracy": 0.7091, "tp": 44, "fp": 15, "tn": 73, "fn": 33, "aleatoric_mean": 2.4e-05, "epistemic_mean": 4.9e-05, "confidence_mean": 0.9999, "aleatoric_std": 1.7e-05, "epistemic_std": 3.3e-05}, {"fold": "fold_7", "regime": "Recent mixed/upturn", "sharpe": 8.4769, "sortino": 14.3598, "return_pct": 55.75, "equity": 1557.55, "max_dd": 1.64, "win_rate": 71.6, "profit_factor": 4.429, "ic": 0.6222, "hit": 71.6, "n": 162, "precision": 0.6606, "recall": 0.8889, "f1": 0.7579, "f2": 0.8314, "mcc": 0.4605, "accuracy": 0.716, "tp": 72, "fp": 37, "tn": 44, "fn": 9, "aleatoric_mean": 1.7e-05, "epistemic_mean": 3.4e-05, "confidence_mean": 0.9999, "aleatoric_std": 1e-05, "epistemic_std": 2e-05}], "val_sharpe": 5.599, "val_psr": 1.0, "val_equity": 3472.42, "val_sortino": 8.4457, "val_return_pct": 247.24, "val_max_dd": 7.43, "val_win_rate": 66.19, "val_profit_factor": 2.61, "val_ic": 0.4582, "val_hit": 65.76, "val_aleatoric_mean": 1.5e-05, "val_epistemic_mean": 3e-05, "val_confidence_mean": 1.0, "val_precision": 0.6588, "val_recall": 0.6082, "val_f1": 0.6325, "val_f2": 0.6177, "val_mcc": 0.3249, "val_accuracy": 0.6641, "val_per_window": [{"fold": "fold_1", "regime": "Pre-crisis upturn + GFC onset", "sharpe": 0.0212, "sortino": 0.0342, "return_pct": -0.02, "equity": 999.8, "max_dd": 2.91, "win_rate": 47.22, "profit_factor": 1.004, "ic": -0.0659, "hit": 46.79, "n": 109, "precision": 0.4833, "recall": 0.5273, "f1": 0.5043, "f2": 0.5179, "mcc": -0.047, "accuracy": 0.4771, "tp": 29, "fp": 31, "tn": 23, "fn": 26, "aleatoric_mean": 1.6e-05, "epistemic_mean": 3.1e-05, "confidence_mean": 1.0, "aleatoric_std": 2e-05, "epistemic_std": 4.1e-05}, {"fold": "fold_2", "regime": "Post-crash recovery", "sharpe": -0.6284, "sortino": -0.9753, "return_pct": -3.27, "equity": 967.3, "max_dd": 7.43, "win_rate": 47.22, "profit_factor": 0.906, "ic": 0.0432, "hit": 47.22, "n": 108, "precision": 0.5789, "recall": 0.3492, "f1": 0.4356, "f2": 0.3793, "mcc": -0.0066, "accuracy": 0.4722, "tp": 22, "fp": 16, "tn": 29, "fn": 41, "aleatoric_mean": 2.7e-05, "epistemic_mean": 5.5e-05, "confidence_mean": 0.9999, "aleatoric_std": 2.2e-05, "epistemic_std": 4.3e-05}, {"fold": "fold_3", "regime": "Eurozone debt plateau", "sharpe": 11.0234, "sortino": 30.4677, "return_pct": 43.97, "equity": 1439.69, "max_dd": 0.84, "win_rate": 78.9, "profit_factor": 6.531, "ic": 0.6702, "hit": 77.48, "n": 111, "precision": 0.74, "recall": 0.7872, "f1": 0.7629, "f2": 0.7773, "mcc": 0.5801, "accuracy": 0.7928, "tp": 37, "fp": 13, "tn": 51, "fn": 10, "aleatoric_mean": 1.8e-05, "epistemic_mean": 3.6e-05, "confidence_mean": 0.9999, "aleatoric_std": 1.3e-05, "epistemic_std": 2.5e-05}, {"fold": "fold_4", "regime": "Strong USD downturn", "sharpe": 7.8607, "sortino": 16.5925, "return_pct": 27.57, "equity": 1275.68, "max_dd": 1.08, "win_rate": 71.56, "profit_factor": 3.79, "ic": 0.6035, "hit": 70.91, "n": 110, "precision": 0.6667, "recall": 0.6809, "f1": 0.6737, "f2": 0.678, "mcc": 0.4258, "accuracy": 0.7182, "tp": 32, "fp": 16, "tn": 47, "fn": 15, "aleatoric_mean": 1.4e-05, "epistemic_mean": 2.7e-05, "confidence_mean": 1.0, "aleatoric_std": 1.2e-05, "epistemic_std": 2.5e-05}, {"fold": "fold_5", "regime": "Low-vol plateau", "sharpe": 10.5961, "sortino": 28.9438, "return_pct": 34.04, "equity": 1340.39, "max_dd": 0.62, "win_rate": 75.0, "profit_factor": 6.466, "ic": 0.7232, "hit": 75.0, "n": 112, "precision": 0.766, "recall": 0.6792, "f1": 0.72, "f2": 0.695, "mcc": 0.4986, "accuracy": 0.75, "tp": 36, "fp": 11, "tn": 48, "fn": 17, "aleatoric_mean": 1.3e-05, "epistemic_mean": 2.6e-05, "confidence_mean": 1.0, "aleatoric_std": 1e-05, "epistemic_std": 2e-05}, {"fold": "fold_6", "regime": "EUR crisis downturn", "sharpe": 9.2138, "sortino": 21.1712, "return_pct": 19.95, "equity": 1199.5, "max_dd": 0.82, "win_rate": 71.03, "profit_factor": 5.067, "ic": 0.717, "hit": 70.37, "n": 108, "precision": 0.7353, "recall": 0.5319, "f1": 0.6173, "f2": 0.5631, "mcc": 0.4103, "accuracy": 0.713, "tp": 25, "fp": 9, "tn": 52, "fn": 22, "aleatoric_mean": 8e-06, "epistemic_mean": 1.6e-05, "confidence_mean": 1.0, "aleatoric_std": 4e-06, "epistemic_std": 8e-06}, {"fold": "fold_7", "regime": "Recent mixed/upturn", "sharpe": 9.5361, "sortino": 25.4132, "return_pct": 21.6, "equity": 1215.96, "max_dd": 0.72, "win_rate": 71.82, "profit_factor": 4.828, "ic": 0.5963, "hit": 71.82, "n": 110, "precision": 0.6833, "recall": 0.7736, "f1": 0.7257, "f2": 0.7537, "mcc": 0.4418, "accuracy": 0.7182, "tp": 41, "fp": 19, "tn": 38, "fn": 12, "aleatoric_mean": 9e-06, "epistemic_mean": 1.8e-05, "confidence_mean": 1.0, "aleatoric_std": 6e-06, "epistemic_std": 1.1e-05}], "train_sharpe": 7.9415, "train_psr": 1.0, "train_equity": 5670149.5, "train_sortino": 23.2561, "train_return_pct": 566914.95, "train_max_dd": 4.92, "train_win_rate": 78.04, "train_profit_factor": 7.921, "train_ic": 0.7556, "train_hit": 77.72, "train_precision": 0.794, "train_recall": 0.7716, "train_f1": 0.7826, "train_f2": 0.776, "train_mcc": 0.5596, "train_accuracy": 0.7797, "train_per_window": [{"fold": "all_train", "regime": "Training data", "sharpe": 7.9415, "sortino": 23.2561, "return_pct": 566914.95, "equity": 5670149.5, "max_dd": 4.92, "win_rate": 78.04, "profit_factor": 7.921, "ic": 0.7556, "hit": 77.72, "n": 2478, "precision": 0.794, "recall": 0.7716, "f1": 0.7826, "f2": 0.776, "mcc": 0.5596, "accuracy": 0.7797, "tp": 983, "fp": 255, "tn": 949, "fn": 291}], "experiment_num": 98, "status": "KEEP"}
