{"backbone": "mlp", "description": "mlp: Exp15 residual hd=0.15 REPRODUCE seed=99", "config": {"seq_len": 10, "lr": 0.0003, "batch_size": 32, "epochs": 50, "weight_decay": 1e-05, "patience": 10, "grad_clip": 1.0, "warmup_epochs": 0, "huber_delta": 1.0, "head_dropout": 0.15, "seed": 99, "het_loss": false}, "composite": 3.7325, "test_pos_folds": 6, "val_pos_folds": 6, "val_loss": 4.1e-05, "elapsed_sec": 13.3, "timestamp": "2026-04-14T16:05:08", "sharpe": 3.9325, "psr": 1.0, "equity": 4831.37, "sortino": 5.0713, "return_pct": 383.14, "max_dd": 10.79, "win_rate": 63.36, "profit_factor": 2.089, "ic": 0.34, "hit": 63.1, "aleatoric_mean": 5.1e-05, "epistemic_mean": 0.000102, "confidence_mean": 0.9998, "per_window": [{"fold": "fold_1", "regime": "Pre-crisis upturn + GFC onset", "sharpe": -0.9591, "sortino": -1.0839, "return_pct": -7.8, "equity": 922.03, "max_dd": 10.79, "win_rate": 50.0, "profit_factor": 0.797, "ic": -0.1356, "hit": 49.51, "n": 103, "aleatoric_mean": 9.5e-05, "epistemic_mean": 0.00019, "confidence_mean": 0.9997, "aleatoric_std": 0.000103, "epistemic_std": 0.000206}, {"fold": "fold_2", "regime": "Post-crash recovery", "sharpe": 1.5952, "sortino": 2.7012, "return_pct": 7.63, "equity": 1076.25, "max_dd": 6.76, "win_rate": 57.01, "profit_factor": 1.284, "ic": 0.1177, "hit": 57.01, "n": 107, "aleatoric_mean": 3.5e-05, "epistemic_mean": 7e-05, "confidence_mean": 0.9999, "aleatoric_std": 2.5e-05, "epistemic_std": 4.9e-05}, {"fold": "fold_3", "regime": "Eurozone debt plateau", "sharpe": 5.0291, "sortino": 10.1912, "return_pct": 18.38, "equity": 1183.76, "max_dd": 1.8, "win_rate": 60.58, "profit_factor": 2.207, "ic": 0.3411, "hit": 59.43, "n": 106, "aleatoric_mean": 4.7e-05, "epistemic_mean": 9.5e-05, "confidence_mean": 0.9999, "aleatoric_std": 2.4e-05, "epistemic_std": 4.9e-05}, {"fold": "fold_4", "regime": "Strong USD downturn", "sharpe": 7.5883, "sortino": 16.7032, "return_pct": 69.59, "equity": 1695.94, "max_dd": 2.92, "win_rate": 68.26, "profit_factor": 3.706, "ic": 0.5475, "hit": 67.86, "n": 168, "aleatoric_mean": 7.7e-05, "epistemic_mean": 0.000154, "confidence_mean": 0.9998, "aleatoric_std": 5.2e-05, "epistemic_std": 0.000105}, {"fold": "fold_5", "regime": "Low-vol plateau", "sharpe": 5.9405, "sortino": 8.4624, "return_pct": 20.27, "equity": 1202.73, "max_dd": 1.55, "win_rate": 66.67, "profit_factor": 2.723, "ic": 0.4796, "hit": 66.67, "n": 162, "aleatoric_mean": 2.9e-05, "epistemic_mean": 5.8e-05, "confidence_mean": 0.9999, "aleatoric_std": 1.6e-05, "epistemic_std": 3.3e-05}, {"fold": "fold_6", "regime": "EUR crisis downturn", "sharpe": 6.6974, "sortino": 12.865, "return_pct": 47.06, "equity": 1470.55, "max_dd": 3.68, "win_rate": 64.85, "profit_factor": 2.988, "ic": 0.5991, "hit": 64.85, "n": 165, "aleatoric_mean": 5.3e-05, "epistemic_mean": 0.000106, "confidence_mean": 0.9998, "aleatoric_std": 3.9e-05, "epistemic_std": 7.9e-05}, {"fold": "fold_7", "regime": "Recent mixed/upturn", "sharpe": 5.6706, "sortino": 9.4737, "return_pct": 37.12, "equity": 1371.17, "max_dd": 2.77, "win_rate": 67.9, "profit_factor": 2.643, "ic": 0.5539, "hit": 67.9, "n": 162, "aleatoric_mean": 3e-05, "epistemic_mean": 6e-05, "confidence_mean": 0.9999, "aleatoric_std": 1.9e-05, "epistemic_std": 3.9e-05}], "val_sharpe": 5.436, "val_psr": 1.0, "val_equity": 3360.96, "val_sortino": 8.2383, "val_return_pct": 236.1, "val_max_dd": 8.14, "val_win_rate": 66.06, "val_profit_factor": 2.536, "val_ic": 0.4167, "val_hit": 65.62, "val_aleatoric_mean": 3e-05, "val_epistemic_mean": 6e-05, "val_confidence_mean": 0.9999, "val_per_window": [{"fold": "fold_1", "regime": "Pre-crisis upturn + GFC onset", "sharpe": 0.3112, "sortino": 0.5716, "return_pct": 0.71, "equity": 1007.14, "max_dd": 4.16, "win_rate": 48.15, "profit_factor": 1.053, "ic": -0.0526, "hit": 47.71, "n": 109, "aleatoric_mean": 2.7e-05, "epistemic_mean": 5.3e-05, "confidence_mean": 0.9999, "aleatoric_std": 2.5e-05, "epistemic_std": 5e-05}, {"fold": "fold_2", "regime": "Post-crash recovery", "sharpe": -0.4753, "sortino": -0.7383, "return_pct": -2.55, "equity": 974.51, "max_dd": 8.14, "win_rate": 47.22, "profit_factor": 0.928, "ic": -0.0984, "hit": 47.22, "n": 108, "aleatoric_mean": 4.8e-05, "epistemic_mean": 9.7e-05, "confidence_mean": 0.9999, "aleatoric_std": 4e-05, "epistemic_std": 8e-05}, {"fold": "fold_3", "regime": "Eurozone debt plateau", "sharpe": 9.4511, "sortino": 20.5345, "return_pct": 38.63, "equity": 1386.33, "max_dd": 0.84, "win_rate": 69.72, "profit_factor": 4.86, "ic": 0.6552, "hit": 68.47, "n": 111, "aleatoric_mean": 3.9e-05, "epistemic_mean": 7.9e-05, "confidence_mean": 0.9999, "aleatoric_std": 2.2e-05, "epistemic_std": 4.4e-05}, {"fold": "fold_4", "regime": "Strong USD downturn", "sharpe": 10.4738, "sortino": 24.6157, "return_pct": 35.32, "equity": 1353.23, "max_dd": 0.94, "win_rate": 78.9, "profit_factor": 6.218, "ic": 0.6227, "hit": 78.18, "n": 110, "aleatoric_mean": 3e-05, "epistemic_mean": 6e-05, "confidence_mean": 0.9999, "aleatoric_std": 2.7e-05, "epistemic_std": 5.3e-05}, {"fold": "fold_5", "regime": "Low-vol plateau", "sharpe": 7.8253, "sortino": 15.2554, "return_pct": 26.25, "equity": 1262.45, "max_dd": 1.61, "win_rate": 69.64, "profit_factor": 3.797, "ic": 0.6194, "hit": 69.64, "n": 112, "aleatoric_mean": 3.1e-05, "epistemic_mean": 6.2e-05, "confidence_mean": 0.9999, "aleatoric_std": 2.4e-05, "epistemic_std": 4.9e-05}, {"fold": "fold_6", "regime": "EUR crisis downturn", "sharpe": 10.5425, "sortino": 26.6502, "return_pct": 22.21, "equity": 1222.06, "max_dd": 0.77, "win_rate": 74.77, "profit_factor": 6.656, "ic": 0.6514, "hit": 74.07, "n": 108, "aleatoric_mean": 1.7e-05, "epistemic_mean": 3.5e-05, "confidence_mean": 0.9999, "aleatoric_std": 7e-06, "epistemic_std": 1.5e-05}, {"fold": "fold_7", "regime": "Recent mixed/upturn", "sharpe": 7.8476, "sortino": 16.7405, "return_pct": 18.32, "equity": 1183.15, "max_dd": 1.17, "win_rate": 73.64, "profit_factor": 3.6, "ic": 0.5486, "hit": 73.64, "n": 110, "aleatoric_mean": 1.8e-05, "epistemic_mean": 3.6e-05, "confidence_mean": 0.9999, "aleatoric_std": 1.1e-05, "epistemic_std": 2.1e-05}], "train_sharpe": 7.4032, "train_psr": 1.0, "train_equity": 3500864.75, "train_sortino": 20.7038, "train_return_pct": 349986.48, "train_max_dd": 4.49, "train_win_rate": 75.97, "train_profit_factor": 6.488, "train_ic": 0.7093, "train_hit": 75.67, "train_per_window": [{"fold": "all_train", "regime": "Training data", "sharpe": 7.4032, "sortino": 20.7038, "return_pct": 349986.48, "equity": 3500864.75, "max_dd": 4.49, "win_rate": 75.97, "profit_factor": 6.488, "ic": 0.7093, "hit": 75.67, "n": 2478}], "experiment_num": 71, "status": "DISCARD"}
{"backbone": "mlp", "description": "mlp: Exp16 residual hd=0.15 RERUN seed=0 (verify)", "config": {"seq_len": 10, "lr": 0.0003, "batch_size": 32, "epochs": 50, "weight_decay": 1e-05, "patience": 10, "grad_clip": 1.0, "warmup_epochs": 0, "huber_delta": 1.0, "head_dropout": 0.15, "seed": 0, "het_loss": false}, "composite": 5.1305, "test_pos_folds": 7, "val_pos_folds": 6, "val_loss": 4e-05, "elapsed_sec": 14.0, "timestamp": "2026-04-14T16:05:37", "sharpe": 5.2305, "psr": 1.0, "equity": 7823.14, "sortino": 9.515, "return_pct": 682.31, "max_dd": 4.55, "win_rate": 65.94, "profit_factor": 2.696, "ic": 0.4418, "hit": 65.67, "aleatoric_mean": 4.6e-05, "epistemic_mean": 9.2e-05, "confidence_mean": 0.9999, "per_window": [{"fold": "fold_1", "regime": "Pre-crisis upturn + GFC onset", "sharpe": 2.5471, "sortino": 6.8756, "return_pct": 20.56, "equity": 1205.57, "max_dd": 2.99, "win_rate": 60.78, "profit_factor": 1.844, "ic": 0.1889, "hit": 60.19, "n": 103, "aleatoric_mean": 8.9e-05, "epistemic_mean": 0.000179, "confidence_mean": 0.9997, "aleatoric_std": 0.000115, "epistemic_std": 0.00023}, {"fold": "fold_2", "regime": "Post-crash recovery", "sharpe": 2.2016, "sortino": 3.7306, "return_pct": 10.74, "equity": 1107.36, "max_dd": 3.36, "win_rate": 57.01, "profit_factor": 1.412, "ic": 0.1253, "hit": 57.01, "n": 107, "aleatoric_mean": 3.4e-05, "epistemic_mean": 6.8e-05, "confidence_mean": 0.9999, "aleatoric_std": 2.3e-05, "epistemic_std": 4.7e-05}, {"fold": "fold_3", "regime": "Eurozone debt plateau", "sharpe": 8.089, "sortino": 15.551, "return_pct": 28.96, "equity": 1289.63, "max_dd": 1.36, "win_rate": 72.12, "profit_factor": 3.605, "ic": 0.5717, "hit": 70.75, "n": 106, "aleatoric_mean": 5.1e-05, "epistemic_mean": 0.000102, "confidence_mean": 0.9998, "aleatoric_std": 2.9e-05, "epistemic_std": 5.8e-05}, {"fold": "fold_4", "regime": "Strong USD downturn", "sharpe": 8.6677, "sortino": 18.0664, "return_pct": 79.94, "equity": 1799.43, "max_dd": 1.81, "win_rate": 71.86, "profit_factor": 4.539, "ic": 0.5874, "hit": 71.43, "n": 168, "aleatoric_mean": 6.4e-05, "epistemic_mean": 0.000127, "confidence_mean": 0.9998, "aleatoric_std": 5e-05, "epistemic_std": 0.0001}, {"fold": "fold_5", "regime": "Low-vol plateau", "sharpe": 8.9333, "sortino": 16.5199, "return_pct": 29.52, "equity": 1295.17, "max_dd": 1.29, "win_rate": 70.37, "profit_factor": 4.674, "ic": 0.5557, "hit": 70.37, "n": 162, "aleatoric_mean": 2.3e-05, "epistemic_mean": 4.6e-05, "confidence_mean": 0.9999, "aleatoric_std": 1.2e-05, "epistemic_std": 2.5e-05}, {"fold": "fold_6", "regime": "EUR crisis downturn", "sharpe": 7.7494, "sortino": 12.4178, "return_pct": 54.59, "equity": 1545.89, "max_dd": 2.4, "win_rate": 68.48, "profit_factor": 3.573, "ic": 0.6094, "hit": 68.48, "n": 165, "aleatoric_mean": 4.3e-05, "epistemic_mean": 8.5e-05, "confidence_mean": 0.9999, "aleatoric_std": 2.9e-05, "epistemic_std": 5.7e-05}, {"fold": "fold_7", "regime": "Recent mixed/upturn", "sharpe": 4.0657, "sortino": 7.0447, "return_pct": 26.12, "equity": 1261.24, "max_dd": 3.15, "win_rate": 58.02, "profit_factor": 1.997, "ic": 0.5242, "hit": 58.02, "n": 162, "aleatoric_mean": 3.1e-05, "epistemic_mean": 6.2e-05, "confidence_mean": 0.9999, "aleatoric_std": 1.8e-05, "epistemic_std": 3.5e-05}], "val_sharpe": 5.4705, "val_psr": 1.0, "val_equity": 3384.35, "val_sortino": 8.7119, "val_return_pct": 238.44, "val_max_dd": 5.46, "val_win_rate": 64.88, "val_profit_factor": 2.552, "val_ic": 0.4216, "val_hit": 64.45, "val_aleatoric_mean": 2.8e-05, "val_epistemic_mean": 5.5e-05, "val_confidence_mean": 0.9999, "val_per_window": [{"fold": "fold_1", "regime": "Pre-crisis upturn + GFC onset", "sharpe": -0.6079, "sortino": -0.925, "return_pct": -1.59, "equity": 984.05, "max_dd": 3.48, "win_rate": 47.22, "profit_factor": 0.904, "ic": -0.0178, "hit": 46.79, "n": 109, "aleatoric_mean": 2.7e-05, "epistemic_mean": 5.5e-05, "confidence_mean": 0.9999, "aleatoric_std": 3e-05, "epistemic_std": 6.1e-05}, {"fold": "fold_2", "regime": "Post-crash recovery", "sharpe": 0.9435, "sortino": 1.536, "return_pct": 4.39, "equity": 1043.92, "max_dd": 5.46, "win_rate": 52.78, "profit_factor": 1.161, "ic": 0.0403, "hit": 52.78, "n": 108, "aleatoric_mean": 4.9e-05, "epistemic_mean": 9.8e-05, "confidence_mean": 0.9999, "aleatoric_std": 4e-05, "epistemic_std": 7.9e-05}, {"fold": "fold_3", "regime": "Eurozone debt plateau", "sharpe": 8.9996, "sortino": 20.2732, "return_pct": 37.01, "equity": 1370.06, "max_dd": 1.52, "win_rate": 75.23, "profit_factor": 4.48, "ic": 0.5941, "hit": 73.87, "n": 111, "aleatoric_mean": 3.6e-05, "epistemic_mean": 7.2e-05, "confidence_mean": 0.9999, "aleatoric_std": 2.4e-05, "epistemic_std": 4.8e-05}, {"fold": "fold_4", "regime": "Strong USD downturn", "sharpe": 8.4095, "sortino": 18.0449, "return_pct": 29.29, "equity": 1292.94, "max_dd": 1.01, "win_rate": 72.48, "profit_factor": 4.188, "ic": 0.5487, "hit": 71.82, "n": 110, "aleatoric_mean": 2.5e-05, "epistemic_mean": 5e-05, "confidence_mean": 0.9999, "aleatoric_std": 2.1e-05, "epistemic_std": 4.3e-05}, {"fold": "fold_5", "regime": "Low-vol plateau", "sharpe": 9.8369, "sortino": 27.4629, "return_pct": 32.03, "equity": 1320.33, "max_dd": 0.8, "win_rate": 70.54, "profit_factor": 5.549, "ic": 0.691, "hit": 70.54, "n": 112, "aleatoric_mean": 2.4e-05, "epistemic_mean": 4.9e-05, "confidence_mean": 0.9999, "aleatoric_std": 1.8e-05, "epistemic_std": 3.6e-05}, {"fold": "fold_6", "regime": "EUR crisis downturn", "sharpe": 8.2557, "sortino": 17.8094, "return_pct": 18.19, "equity": 1181.93, "max_dd": 0.74, "win_rate": 70.09, "profit_factor": 4.21, "ic": 0.6209, "hit": 69.44, "n": 108, "aleatoric_mean": 1.5e-05, "epistemic_mean": 3e-05, "confidence_mean": 1.0, "aleatoric_std": 7e-06, "epistemic_std": 1.4e-05}, {"fold": "fold_7", "regime": "Recent mixed/upturn", "sharpe": 8.2747, "sortino": 22.0245, "return_pct": 19.18, "equity": 1191.78, "max_dd": 0.72, "win_rate": 65.45, "profit_factor": 3.873, "ic": 0.5431, "hit": 65.45, "n": 110, "aleatoric_mean": 1.6e-05, "epistemic_mean": 3.2e-05, "confidence_mean": 1.0, "aleatoric_std": 1.1e-05, "epistemic_std": 2.1e-05}], "train_sharpe": 7.6865, "train_psr": 1.0, "train_equity": 4523138.0, "train_sortino": 23.0763, "train_return_pct": 452213.8, "train_max_dd": 3.64, "train_win_rate": 76.7, "train_profit_factor": 7.186, "train_ic": 0.74, "train_hit": 76.39, "train_per_window": [{"fold": "all_train", "regime": "Training data", "sharpe": 7.6865, "sortino": 23.0763, "return_pct": 452213.8, "equity": 4523138.0, "max_dd": 3.64, "win_rate": 76.7, "profit_factor": 7.186, "ic": 0.74, "hit": 76.39, "n": 2478}], "experiment_num": 72, "status": "KEEP"}
{"backbone": "mlp", "description": "mlp: Exp17 residual lr=5e-4 higher LR (He2016) seed=0", "config": {"seq_len": 10, "lr": 0.0005, "batch_size": 32, "epochs": 50, "weight_decay": 1e-05, "patience": 10, "grad_clip": 1.0, "warmup_epochs": 0, "huber_delta": 1.0, "head_dropout": 0.15, "seed": 0, "het_loss": false}, "composite": 5.4022, "test_pos_folds": 7, "val_pos_folds": 6, "val_loss": 3.8e-05, "elapsed_sec": 13.8, "timestamp": "2026-04-14T16:06:39", "sharpe": 6.1205, "psr": 1.0, "equity": 10677.08, "sortino": 11.1215, "return_pct": 967.71, "max_dd": 4.13, "win_rate": 69.14, "profit_factor": 3.233, "ic": 0.4846, "hit": 68.86, "aleatoric_mean": 2.6e-05, "epistemic_mean": 5.2e-05, "confidence_mean": 0.9999, "per_window": [{"fold": "fold_1", "regime": "Pre-crisis upturn + GFC onset", "sharpe": 2.4608, "sortino": 6.7778, "return_pct": 19.79, "equity": 1197.85, "max_dd": 3.29, "win_rate": 60.78, "profit_factor": 1.805, "ic": 0.1893, "hit": 60.19, "n": 103, "aleatoric_mean": 5.3e-05, "epistemic_mean": 0.000105, "confidence_mean": 0.9998, "aleatoric_std": 7e-05, "epistemic_std": 0.00014}, {"fold": "fold_2", "regime": "Post-crash recovery", "sharpe": 0.4393, "sortino": 0.7648, "return_pct": 1.85, "equity": 1018.54, "max_dd": 3.47, "win_rate": 51.4, "profit_factor": 1.071, "ic": 0.0821, "hit": 51.4, "n": 107, "aleatoric_mean": 2.1e-05, "epistemic_mean": 4.2e-05, "confidence_mean": 0.9999, "aleatoric_std": 1.5e-05, "epistemic_std": 3e-05}, {"fold": "fold_3", "regime": "Eurozone debt plateau", "sharpe": 9.7583, "sortino": 18.8138, "return_pct": 34.13, "equity": 1341.27, "max_dd": 1.32, "win_rate": 75.96, "profit_factor": 4.755, "ic": 0.5838, "hit": 74.53, "n": 106, "aleatoric_mean": 2.8e-05, "epistemic_mean": 5.5e-05, "confidence_mean": 0.9999, "aleatoric_std": 1.4e-05, "epistemic_std": 2.9e-05}, {"fold": "fold_4", "regime": "Strong USD downturn", "sharpe": 9.7799, "sortino": 19.4179, "return_pct": 90.3, "equity": 1902.97, "max_dd": 1.81, "win_rate": 75.45, "profit_factor": 5.651, "ic": 0.6653, "hit": 75.0, "n": 168, "aleatoric_mean": 3.6e-05, "epistemic_mean": 7.3e-05, "confidence_mean": 0.9999, "aleatoric_std": 2.9e-05, "epistemic_std": 5.8e-05}, {"fold": "fold_5", "regime": "Low-vol plateau", "sharpe": 8.8545, "sortino": 16.1387, "return_pct": 29.29, "equity": 1292.92, "max_dd": 1.43, "win_rate": 70.99, "profit_factor": 4.604, "ic": 0.6397, "hit": 70.99, "n": 162, "aleatoric_mean": 1.2e-05, "epistemic_mean": 2.5e-05, "confidence_mean": 1.0, "aleatoric_std": 7e-06, "epistemic_std": 1.3e-05}, {"fold": "fold_6", "regime": "EUR crisis downturn", "sharpe": 10.2166, "sortino": 21.4343, "return_pct": 71.27, "equity": 1712.74, "max_dd": 2.27, "win_rate": 71.52, "profit_factor": 5.538, "ic": 0.6433, "hit": 71.52, "n": 165, "aleatoric_mean": 2.5e-05, "epistemic_mean": 4.9e-05, "confidence_mean": 0.9999, "aleatoric_std": 1.7e-05, "epistemic_std": 3.3e-05}, {"fold": "fold_7", "regime": "Recent mixed/upturn", "sharpe": 8.3325, "sortino": 14.3213, "return_pct": 54.83, "equity": 1548.32, "max_dd": 1.64, "win_rate": 70.99, "profit_factor": 4.308, "ic": 0.6209, "hit": 70.99, "n": 162, "aleatoric_mean": 1.7e-05, "epistemic_mean": 3.4e-05, "confidence_mean": 0.9999, "aleatoric_std": 1e-05, "epistemic_std": 2e-05}], "val_sharpe": 5.5022, "val_psr": 1.0, "val_equity": 3405.94, "val_sortino": 8.2572, "val_return_pct": 240.59, "val_max_dd": 9.21, "val_win_rate": 66.06, "val_profit_factor": 2.566, "val_ic": 0.4576, "val_hit": 65.62, "val_aleatoric_mean": 1.5e-05, "val_epistemic_mean": 3e-05, "val_confidence_mean": 1.0, "val_per_window": [{"fold": "fold_1", "regime": "Pre-crisis upturn + GFC onset", "sharpe": 0.0212, "sortino": 0.0342, "return_pct": -0.02, "equity": 999.8, "max_dd": 2.91, "win_rate": 47.22, "profit_factor": 1.004, "ic": -0.0694, "hit": 46.79, "n": 109, "aleatoric_mean": 1.6e-05, "epistemic_mean": 3.1e-05, "confidence_mean": 1.0, "aleatoric_std": 2e-05, "epistemic_std": 4e-05}, {"fold": "fold_2", "regime": "Post-crash recovery", "sharpe": -1.0281, "sortino": -1.5972, "return_pct": -5.12, "equity": 948.78, "max_dd": 9.21, "win_rate": 46.3, "profit_factor": 0.85, "ic": 0.0431, "hit": 46.3, "n": 108, "aleatoric_mean": 2.8e-05, "epistemic_mean": 5.5e-05, "confidence_mean": 0.9999, "aleatoric_std": 2.2e-05, "epistemic_std": 4.3e-05}, {"fold": "fold_3", "regime": "Eurozone debt plateau", "sharpe": 11.0234, "sortino": 30.4677, "return_pct": 43.97, "equity": 1439.69, "max_dd": 0.84, "win_rate": 78.9, "profit_factor": 6.531, "ic": 0.6739, "hit": 77.48, "n": 111, "aleatoric_mean": 1.8e-05, "epistemic_mean": 3.6e-05, "confidence_mean": 0.9999, "aleatoric_std": 1.3e-05, "epistemic_std": 2.5e-05}, {"fold": "fold_4", "regime": "Strong USD downturn", "sharpe": 7.8607, "sortino": 16.5925, "return_pct": 27.57, "equity": 1275.68, "max_dd": 1.08, "win_rate": 71.56, "profit_factor": 3.79, "ic": 0.6028, "hit": 70.91, "n": 110, "aleatoric_mean": 1.4e-05, "epistemic_mean": 2.7e-05, "confidence_mean": 1.0, "aleatoric_std": 1.2e-05, "epistemic_std": 2.5e-05}, {"fold": "fold_5", "regime": "Low-vol plateau", "sharpe": 10.5961, "sortino": 28.9438, "return_pct": 34.04, "equity": 1340.39, "max_dd": 0.62, "win_rate": 75.0, "profit_factor": 6.466, "ic": 0.724, "hit": 75.0, "n": 112, "aleatoric_mean": 1.3e-05, "epistemic_mean": 2.6e-05, "confidence_mean": 1.0, "aleatoric_std": 1e-05, "epistemic_std": 1.9e-05}, {"fold": "fold_6", "regime": "EUR crisis downturn", "sharpe": 9.2138, "sortino": 21.1712, "return_pct": 19.95, "equity": 1199.5, "max_dd": 0.82, "win_rate": 71.03, "profit_factor": 5.067, "ic": 0.721, "hit": 70.37, "n": 108, "aleatoric_mean": 8e-06, "epistemic_mean": 1.6e-05, "confidence_mean": 1.0, "aleatoric_std": 4e-06, "epistemic_std": 8e-06}, {"fold": "fold_7", "regime": "Recent mixed/upturn", "sharpe": 9.5361, "sortino": 25.4132, "return_pct": 21.6, "equity": 1215.96, "max_dd": 0.72, "win_rate": 71.82, "profit_factor": 4.828, "ic": 0.6004, "hit": 71.82, "n": 110, "aleatoric_mean": 9e-06, "epistemic_mean": 1.8e-05, "confidence_mean": 1.0, "aleatoric_std": 6e-06, "epistemic_std": 1.1e-05}], "train_sharpe": 7.9764, "train_psr": 1.0, "train_equity": 5846122.0, "train_sortino": 23.4815, "train_return_pct": 584512.2, "train_max_dd": 4.92, "train_win_rate": 78.24, "train_profit_factor": 8.03, "train_ic": 0.7554, "train_hit": 77.93, "train_per_window": [{"fold": "all_train", "regime": "Training data", "sharpe": 7.9764, "sortino": 23.4815, "return_pct": 584512.2, "equity": 5846122.0, "max_dd": 4.92, "win_rate": 78.24, "profit_factor": 8.03, "ic": 0.7554, "hit": 77.93, "n": 2478}], "experiment_num": 73, "status": "KEEP"}
