{"backbone": "nbeats", "description": "nbeats: Exp5 head_dropout=0.25", "config": {"seq_len": 60, "lr": 0.001, "batch_size": 32, "epochs": 100, "weight_decay": 0.0001, "patience": 20, "grad_clip": 1.0, "warmup_epochs": 0, "huber_delta": 1.0, "head_dropout": 0.25, "seed": 42, "het_loss": false}, "composite": -0.4269, "test_pos_folds": 5, "val_pos_folds": 4, "val_loss": 3.1e-05, "elapsed_sec": 64.3, "timestamp": "2026-04-21T12:36:44", "sharpe": 0.9498, "psr": 0.933, "equity": 1234.21, "sortino": 1.4922, "return_pct": 23.42, "max_dd": 15.2, "win_rate": 52.99, "profit_factor": 1.173, "ic": 0.0236, "hit": 52.65, "aleatoric_mean": 2.9e-05, "epistemic_mean": 5.7e-05, "confidence_mean": 0.9999, "precision": 0.521, "recall": 0.6, "f1": 0.5577, "f2": 0.5823, "mcc": 0.0543, "accuracy": 0.5265, "per_window": [{"fold": "fold_1", "regime": "Pre-crisis upturn + GFC onset", "sharpe": -4.5368, "sortino": -7.2387, "return_pct": -8.91, "equity": 910.87, "max_dd": 8.6, "win_rate": 38.46, "profit_factor": 0.499, "ic": -0.3309, "hit": 37.74, "n": 53, "precision": 0.3871, "recall": 0.4615, "f1": 0.4211, "f2": 0.4444, "mcc": -0.2457, "accuracy": 0.3774, "tp": 12, "fp": 19, "tn": 8, "fn": 14, "aleatoric_mean": 2.9e-05, "epistemic_mean": 5.9e-05, "confidence_mean": 0.9999, "aleatoric_std": 8e-06, "epistemic_std": 1.6e-05}, {"fold": "fold_2", "regime": "Post-crash recovery", "sharpe": -1.7659, "sortino": -2.8684, "return_pct": -5.07, "equity": 949.35, "max_dd": 6.95, "win_rate": 42.11, "profit_factor": 0.753, "ic": -0.1038, "hit": 42.11, "n": 57, "precision": 0.475, "recall": 0.6129, "f1": 0.5352, "f2": 0.5793, "mcc": -0.2121, "accuracy": 0.4211, "tp": 19, "fp": 21, "tn": 5, "fn": 12, "aleatoric_mean": 2.9e-05, "epistemic_mean": 5.7e-05, "confidence_mean": 0.9999, "aleatoric_std": 8e-06, "epistemic_std": 1.6e-05}, {"fold": "fold_3", "regime": "Eurozone debt plateau", "sharpe": 2.4133, "sortino": 4.5277, "return_pct": 4.25, "equity": 1042.5, "max_dd": 2.56, "win_rate": 61.11, "profit_factor": 1.469, "ic": 0.1069, "hit": 58.93, "n": 56, "precision": 0.6216, "recall": 0.7188, "f1": 0.6667, "f2": 0.697, "mcc": 0.1415, "accuracy": 0.5893, "tp": 23, "fp": 14, "tn": 10, "fn": 9, "aleatoric_mean": 3e-05, "epistemic_mean": 5.9e-05, "confidence_mean": 0.9999, "aleatoric_std": 1.1e-05, "epistemic_std": 2.2e-05}, {"fold": "fold_4", "regime": "Strong USD downturn", "sharpe": 0.1642, "sortino": 0.2616, "return_pct": 0.56, "equity": 1005.59, "max_dd": 7.28, "win_rate": 52.14, "profit_factor": 1.028, "ic": 0.0007, "hit": 51.69, "n": 118, "precision": 0.519, "recall": 0.6833, "f1": 0.5899, "f2": 0.6426, "mcc": 0.0299, "accuracy": 0.5169, "tp": 41, "fp": 38, "tn": 20, "fn": 19, "aleatoric_mean": 3e-05, "epistemic_mean": 5.9e-05, "confidence_mean": 0.9999, "aleatoric_std": 9e-06, "epistemic_std": 1.8e-05}, {"fold": "fold_5", "regime": "Low-vol plateau", "sharpe": 1.489, "sortino": 2.132, "return_pct": 3.34, "equity": 1033.38, "max_dd": 3.82, "win_rate": 54.46, "profit_factor": 1.281, "ic": 0.1638, "hit": 54.46, "n": 112, "precision": 0.5, "recall": 0.4902, "f1": 0.495, "f2": 0.4921, "mcc": 0.0805, "accuracy": 0.5446, "tp": 25, "fp": 25, "tn": 36, "fn": 26, "aleatoric_mean": 2.6e-05, "epistemic_mean": 5.2e-05, "confidence_mean": 0.9999, "aleatoric_std": 9e-06, "epistemic_std": 1.8e-05}, {"fold": "fold_6", "regime": "EUR crisis downturn", "sharpe": 4.6814, "sortino": 8.0871, "return_pct": 22.15, "equity": 1221.54, "max_dd": 2.17, "win_rate": 60.87, "profit_factor": 2.101, "ic": 0.1813, "hit": 60.87, "n": 115, "precision": 0.5606, "recall": 0.6981, "f1": 0.6218, "f2": 0.6655, "mcc": 0.2322, "accuracy": 0.6087, "tp": 37, "fp": 29, "tn": 33, "fn": 16, "aleatoric_mean": 2.9e-05, "epistemic_mean": 5.8e-05, "confidence_mean": 0.9999, "aleatoric_std": 9e-06, "epistemic_std": 1.8e-05}, {"fold": "fold_7", "regime": "Recent mixed/upturn", "sharpe": 1.8877, "sortino": 3.565, "return_pct": 7.86, "equity": 1078.55, "max_dd": 4.37, "win_rate": 52.68, "profit_factor": 1.383, "ic": 0.0426, "hit": 52.68, "n": 112, "precision": 0.537, "recall": 0.5088, "f1": 0.5225, "f2": 0.5142, "mcc": 0.0543, "accuracy": 0.5268, "tp": 29, "fp": 25, "tn": 30, "fn": 28, "aleatoric_mean": 3e-05, "epistemic_mean": 5.9e-05, "confidence_mean": 0.9999, "aleatoric_std": 9e-06, "epistemic_std": 1.9e-05}], "val_sharpe": 0.0731, "val_psr": 0.5375, "val_equity": 1004.44, "val_sortino": 0.1134, "val_return_pct": 0.44, "val_max_dd": 7.13, "val_win_rate": 49.76, "val_profit_factor": 1.012, "val_ic": -0.005, "val_hit": 49.52, "val_aleatoric_mean": 2.9e-05, "val_epistemic_mean": 5.7e-05, "val_confidence_mean": 0.9999, "val_precision": 0.4917, "val_recall": 0.5728, "val_f1": 0.5291, "val_f2": 0.5545, "val_mcc": -0.0027, "val_accuracy": 0.4976, "val_per_window": [{"fold": "fold_1", "regime": "Pre-crisis upturn + GFC onset", "sharpe": 0.1774, "sortino": 0.3074, "return_pct": 0.23, "equity": 1002.28, "max_dd": 2.92, "win_rate": 48.28, "profit_factor": 1.03, "ic": 0.0077, "hit": 47.46, "n": 59, "precision": 0.5, "recall": 0.5161, "f1": 0.5079, "f2": 0.5128, "mcc": -0.0554, "accuracy": 0.4746, "tp": 16, "fp": 16, "tn": 12, "fn": 15, "aleatoric_mean": 2.9e-05, "epistemic_mean": 5.8e-05, "confidence_mean": 0.9999, "aleatoric_std": 9e-06, "epistemic_std": 1.9e-05}, {"fold": "fold_2", "regime": "Post-crash recovery", "sharpe": 1.2946, "sortino": 1.876, "return_pct": 2.48, "equity": 1024.78, "max_dd": 2.18, "win_rate": 56.9, "profit_factor": 1.233, "ic": -0.0102, "hit": 56.9, "n": 58, "precision": 0.5652, "recall": 0.8387, "f1": 0.6753, "f2": 0.7647, "mcc": 0.1206, "accuracy": 0.569, "tp": 26, "fp": 20, "tn": 7, "fn": 5, "aleatoric_mean": 2.6e-05, "epistemic_mean": 5.2e-05, "confidence_mean": 0.9999, "aleatoric_std": 9e-06, "epistemic_std": 1.8e-05}, {"fold": "fold_3", "regime": "Eurozone debt plateau", "sharpe": -0.2706, "sortino": -0.4429, "return_pct": -0.75, "equity": 992.48, "max_dd": 3.94, "win_rate": 47.54, "profit_factor": 0.956, "ic": -0.1084, "hit": 47.54, "n": 61, "precision": 0.4419, "recall": 0.7037, "f1": 0.5429, "f2": 0.6291, "mcc": -0.0024, "accuracy": 0.4754, "tp": 19, "fp": 24, "tn": 10, "fn": 8, "aleatoric_mean": 2.8e-05, "epistemic_mean": 5.6e-05, "confidence_mean": 0.9999, "aleatoric_std": 8e-06, "epistemic_std": 1.7e-05}, {"fold": "fold_4", "regime": "Strong USD downturn", "sharpe": 0.056, "sortino": 0.0918, "return_pct": 0.02, "equity": 1000.22, "max_dd": 3.31, "win_rate": 53.33, "profit_factor": 1.009, "ic": -0.0178, "hit": 53.33, "n": 60, "precision": 0.5152, "recall": 0.5862, "f1": 0.5484, "f2": 0.5705, "mcc": 0.0704, "accuracy": 0.5333, "tp": 17, "fp": 16, "tn": 15, "fn": 12, "aleatoric_mean": 3e-05, "epistemic_mean": 6.1e-05, "confidence_mean": 0.9999, "aleatoric_std": 1e-05, "epistemic_std": 1.9e-05}, {"fold": "fold_5", "regime": "Low-vol plateau", "sharpe": 2.8919, "sortino": 4.6664, "return_pct": 5.0, "equity": 1050.02, "max_dd": 1.44, "win_rate": 58.06, "profit_factor": 1.599, "ic": 0.2085, "hit": 58.06, "n": 62, "precision": 0.5882, "recall": 0.625, "f1": 0.6061, "f2": 0.6173, "mcc": 0.159, "accuracy": 0.5806, "tp": 20, "fp": 14, "tn": 16, "fn": 12, "aleatoric_mean": 2.9e-05, "epistemic_mean": 5.7e-05, "confidence_mean": 0.9999, "aleatoric_std": 9e-06, "epistemic_std": 1.8e-05}, {"fold": "fold_6", "regime": "EUR crisis downturn", "sharpe": -2.332, "sortino": -3.3424, "return_pct": -2.4, "equity": 975.98, "max_dd": 3.23, "win_rate": 45.61, "profit_factor": 0.682, "ic": -0.1555, "hit": 44.83, "n": 58, "precision": 0.3793, "recall": 0.4583, "f1": 0.4151, "f2": 0.44, "mcc": -0.07, "accuracy": 0.4655, "tp": 11, "fp": 18, "tn": 16, "fn": 13, "aleatoric_mean": 3e-05, "epistemic_mean": 6e-05, "confidence_mean": 0.9999, "aleatoric_std": 1e-05, "epistemic_std": 1.9e-05}, {"fold": "fold_7", "regime": "Recent mixed/upturn", "sharpe": -3.118, "sortino": -5.2931, "return_pct": -3.87, "equity": 961.28, "max_dd": 4.48, "win_rate": 38.33, "profit_factor": 0.601, "ic": -0.1835, "hit": 38.33, "n": 60, "precision": 0.3913, "recall": 0.2812, "f1": 0.3273, "f2": 0.298, "mcc": -0.2245, "accuracy": 0.3833, "tp": 9, "fp": 14, "tn": 14, "fn": 23, "aleatoric_mean": 2.9e-05, "epistemic_mean": 5.7e-05, "confidence_mean": 0.9999, "aleatoric_std": 9e-06, "epistemic_std": 1.8e-05}], "train_sharpe": 0.4409, "train_psr": 0.8569, "train_equity": 1308.45, "train_sortino": 0.5725, "train_return_pct": 30.84, "train_max_dd": 15.6, "train_win_rate": 52.07, "train_profit_factor": 1.107, "train_ic": 0.0369, "train_hit": 51.81, "train_precision": 0.5234, "train_recall": 0.7964, "train_f1": 0.6316, "train_f2": 0.7211, "train_mcc": 0.0177, "train_accuracy": 0.5181, "train_per_window": [{"fold": "all_train", "regime": "Training data", "sharpe": 0.4409, "sortino": 0.5725, "return_pct": 30.84, "equity": 1308.45, "max_dd": 15.6, "win_rate": 52.07, "profit_factor": 1.107, "ic": 0.0369, "hit": 51.81, "n": 1382, "precision": 0.5234, "recall": 0.7964, "f1": 0.6316, "f2": 0.7211, "mcc": 0.0177, "accuracy": 0.5181, "tp": 571, "fp": 520, "tn": 145, "fn": 146}], "experiment_num": 247, "status": "DISCARD"}
{"backbone": "nbeats", "description": "nbeats: Exp6 wd=1e-3", "config": {"seq_len": 60, "lr": 0.001, "batch_size": 32, "epochs": 100, "weight_decay": 0.001, "patience": 20, "grad_clip": 1.0, "warmup_epochs": 0, "huber_delta": 1.0, "head_dropout": 0.1, "seed": 42, "het_loss": false}, "composite": -1.143, "test_pos_folds": 2, "val_pos_folds": 4, "val_loss": 3.4e-05, "elapsed_sec": 68.6, "timestamp": "2026-04-21T12:38:04", "sharpe": -0.343, "psr": 0.2944, "equity": 912.88, "sortino": -0.4805, "return_pct": -8.71, "max_dd": 15.3, "win_rate": 51.7, "profit_factor": 0.944, "ic": -0.003, "hit": 51.36, "aleatoric_mean": 3.1e-05, "epistemic_mean": 6.1e-05, "confidence_mean": 0.9999, "precision": 0.5089, "recall": 0.7355, "f1": 0.6016, "f2": 0.6754, "mcc": 0.0363, "accuracy": 0.5152, "per_window": [{"fold": "fold_1", "regime": "Pre-crisis upturn + GFC onset", "sharpe": -1.2409, "sortino": -2.5952, "return_pct": -2.69, "equity": 973.13, "max_dd": 4.96, "win_rate": 48.08, "profit_factor": 0.827, "ic": 0.0002, "hit": 47.17, "n": 53, "precision": 0.4783, "recall": 0.4231, "f1": 0.449, "f2": 0.4331, "mcc": -0.0216, "accuracy": 0.4906, "tp": 11, "fp": 12, "tn": 15, "fn": 15, "aleatoric_mean": 2.9e-05, "epistemic_mean": 5.8e-05, "confidence_mean": 0.9999, "aleatoric_std": 9e-06, "epistemic_std": 1.8e-05}, {"fold": "fold_2", "regime": "Post-crash recovery", "sharpe": -2.6766, "sortino": -4.3301, "return_pct": -7.44, "equity": 925.65, "max_dd": 10.04, "win_rate": 43.86, "profit_factor": 0.651, "ic": -0.2373, "hit": 43.86, "n": 57, "precision": 0.4889, "recall": 0.7097, "f1": 0.5789, "f2": 0.6509, "mcc": -0.2137, "accuracy": 0.4386, "tp": 22, "fp": 23, "tn": 3, "fn": 9, "aleatoric_mean": 2.9e-05, "epistemic_mean": 5.9e-05, "confidence_mean": 0.9999, "aleatoric_std": 9e-06, "epistemic_std": 1.8e-05}, {"fold": "fold_3", "regime": "Eurozone debt plateau", "sharpe": 2.0326, "sortino": 3.138, "return_pct": 3.57, "equity": 1035.68, "max_dd": 2.03, "win_rate": 61.11, "profit_factor": 1.383, "ic": 0.0865, "hit": 58.93, "n": 56, "precision": 0.6364, "recall": 0.6562, "f1": 0.6462, "f2": 0.6522, "mcc": 0.1572, "accuracy": 0.5893, "tp": 21, "fp": 12, "tn": 12, "fn": 11, "aleatoric_mean": 3e-05, "epistemic_mean": 6.1e-05, "confidence_mean": 0.9999, "aleatoric_std": 1e-05, "epistemic_std": 2e-05}, {"fold": "fold_4", "regime": "Strong USD downturn", "sharpe": -0.6728, "sortino": -0.7884, "return_pct": -3.61, "equity": 963.91, "max_dd": 9.28, "win_rate": 55.56, "profit_factor": 0.893, "ic": 0.068, "hit": 55.08, "n": 118, "precision": 0.5422, "recall": 0.75, "f1": 0.6294, "f2": 0.6966, "mcc": 0.1038, "accuracy": 0.5508, "tp": 45, "fp": 38, "tn": 20, "fn": 15, "aleatoric_mean": 3.1e-05, "epistemic_mean": 6.3e-05, "confidence_mean": 0.9999, "aleatoric_std": 1e-05, "epistemic_std": 2e-05}, {"fold": "fold_5", "regime": "Low-vol plateau", "sharpe": -0.148, "sortino": -0.2496, "return_pct": -0.39, "equity": 996.1, "max_dd": 2.82, "win_rate": 48.21, "profit_factor": 0.976, "ic": -0.0513, "hit": 48.21, "n": 112, "precision": 0.4598, "recall": 0.7843, "f1": 0.5797, "f2": 0.6873, "mcc": 0.0165, "accuracy": 0.4821, "tp": 40, "fp": 47, "tn": 14, "fn": 11, "aleatoric_mean": 3e-05, "epistemic_mean": 6e-05, "confidence_mean": 0.9999, "aleatoric_std": 1e-05, "epistemic_std": 1.9e-05}, {"fold": "fold_6", "regime": "EUR crisis downturn", "sharpe": -0.5439, "sortino": -0.8341, "return_pct": -2.64, "equity": 973.63, "max_dd": 7.79, "win_rate": 52.17, "profit_factor": 0.918, "ic": -0.014, "hit": 52.17, "n": 115, "precision": 0.4898, "recall": 0.9057, "f1": 0.6358, "f2": 0.7742, "mcc": 0.1393, "accuracy": 0.5217, "tp": 48, "fp": 50, "tn": 12, "fn": 5, "aleatoric_mean": 3.1e-05, "epistemic_mean": 6.2e-05, "confidence_mean": 0.9999, "aleatoric_std": 1.1e-05, "epistemic_std": 2.2e-05}, {"fold": "fold_7", "regime": "Recent mixed/upturn", "sharpe": 1.1536, "sortino": 1.8968, "return_pct": 4.67, "equity": 1046.73, "max_dd": 3.61, "win_rate": 51.79, "profit_factor": 1.219, "ic": 0.0964, "hit": 51.79, "n": 112, "precision": 0.519, "recall": 0.7193, "f1": 0.6029, "f2": 0.6678, "mcc": 0.0311, "accuracy": 0.5179, "tp": 41, "fp": 38, "tn": 17, "fn": 16, "aleatoric_mean": 3.1e-05, "epistemic_mean": 6.2e-05, "confidence_mean": 0.9999, "aleatoric_std": 1e-05, "epistemic_std": 2.1e-05}], "val_sharpe": -0.1723, "val_psr": 0.4121, "val_equity": 974.03, "val_sortino": -0.2455, "val_return_pct": -2.6, "val_max_dd": 11.12, "val_win_rate": 50.96, "val_profit_factor": 0.972, "val_ic": -0.0278, "val_hit": 50.72, "val_aleatoric_mean": 3e-05, "val_epistemic_mean": 6.1e-05, "val_confidence_mean": 0.9999, "val_precision": 0.5017, "val_recall": 0.7087, "val_f1": 0.5875, "val_f2": 0.6547, "val_mcc": 0.0269, "val_accuracy": 0.5096, "val_per_window": [{"fold": "fold_1", "regime": "Pre-crisis upturn + GFC onset", "sharpe": 0.3398, "sortino": 0.5401, "return_pct": 0.49, "equity": 1004.86, "max_dd": 3.18, "win_rate": 50.0, "profit_factor": 1.058, "ic": -0.0651, "hit": 49.15, "n": 59, "precision": 0.525, "recall": 0.6774, "f1": 0.5915, "f2": 0.6402, "mcc": -0.0012, "accuracy": 0.5085, "tp": 21, "fp": 19, "tn": 9, "fn": 10, "aleatoric_mean": 3e-05, "epistemic_mean": 6e-05, "confidence_mean": 0.9999, "aleatoric_std": 9e-06, "epistemic_std": 1.7e-05}, {"fold": "fold_2", "regime": "Post-crash recovery", "sharpe": 0.5289, "sortino": 0.8936, "return_pct": 0.96, "equity": 1009.58, "max_dd": 6.39, "win_rate": 50.0, "profit_factor": 1.089, "ic": -0.0694, "hit": 50.0, "n": 58, "precision": 0.5294, "recall": 0.5806, "f1": 0.5538, "f2": 0.5696, "mcc": -0.0121, "accuracy": 0.5, "tp": 18, "fp": 16, "tn": 11, "fn": 13, "aleatoric_mean": 2.9e-05, "epistemic_mean": 5.8e-05, "confidence_mean": 0.9999, "aleatoric_std": 1e-05, "epistemic_std": 1.9e-05}, {"fold": "fold_3", "regime": "Eurozone debt plateau", "sharpe": -2.2884, "sortino": -2.9901, "return_pct": -5.32, "equity": 946.78, "max_dd": 6.17, "win_rate": 47.54, "profit_factor": 0.682, "ic": -0.0255, "hit": 47.54, "n": 61, "precision": 0.4194, "recall": 0.4815, "f1": 0.4483, "f2": 0.4676, "mcc": -0.0476, "accuracy": 0.4754, "tp": 13, "fp": 18, "tn": 16, "fn": 14, "aleatoric_mean": 3e-05, "epistemic_mean": 5.9e-05, "confidence_mean": 0.9999, "aleatoric_std": 1e-05, "epistemic_std": 1.9e-05}, {"fold": "fold_4", "regime": "Strong USD downturn", "sharpe": -1.0887, "sortino": -1.6488, "return_pct": -2.45, "equity": 975.51, "max_dd": 5.39, "win_rate": 50.0, "profit_factor": 0.846, "ic": 0.0037, "hit": 50.0, "n": 60, "precision": 0.4894, "recall": 0.7931, "f1": 0.6053, "f2": 0.7055, "mcc": 0.0229, "accuracy": 0.5, "tp": 23, "fp": 24, "tn": 7, "fn": 6, "aleatoric_mean": 3e-05, "epistemic_mean": 6.1e-05, "confidence_mean": 0.9999, "aleatoric_std": 8e-06, "epistemic_std": 1.6e-05}, {"fold": "fold_5", "regime": "Low-vol plateau", "sharpe": -1.3571, "sortino": -2.1018, "return_pct": -2.38, "equity": 976.19, "max_dd": 5.55, "win_rate": 48.39, "profit_factor": 0.803, "ic": -0.1394, "hit": 48.39, "n": 62, "precision": 0.5, "recall": 0.8125, "f1": 0.619, "f2": 0.7222, "mcc": -0.0736, "accuracy": 0.4839, "tp": 26, "fp": 26, "tn": 4, "fn": 6, "aleatoric_mean": 3.3e-05, "epistemic_mean": 6.7e-05, "confidence_mean": 0.9999, "aleatoric_std": 1e-05, "epistemic_std": 2e-05}, {"fold": "fold_6", "regime": "EUR crisis downturn", "sharpe": 2.3069, "sortino": 5.0273, "return_pct": 2.39, "equity": 1023.87, "max_dd": 0.67, "win_rate": 50.88, "profit_factor": 1.46, "ic": 0.1061, "hit": 50.0, "n": 58, "precision": 0.4359, "recall": 0.7083, "f1": 0.5397, "f2": 0.6296, "mcc": 0.0643, "accuracy": 0.5, "tp": 17, "fp": 22, "tn": 12, "fn": 7, "aleatoric_mean": 2.9e-05, "epistemic_mean": 5.8e-05, "confidence_mean": 0.9999, "aleatoric_std": 1.1e-05, "epistemic_std": 2.1e-05}, {"fold": "fold_7", "regime": "Recent mixed/upturn", "sharpe": 3.1585, "sortino": 7.4284, "return_pct": 4.01, "equity": 1040.08, "max_dd": 1.02, "win_rate": 60.0, "profit_factor": 1.676, "ic": 0.0511, "hit": 60.0, "n": 60, "precision": 0.5833, "recall": 0.875, "f1": 0.7, "f2": 0.7955, "mcc": 0.2004, "accuracy": 0.6, "tp": 28, "fp": 20, "tn": 8, "fn": 4, "aleatoric_mean": 3.1e-05, "epistemic_mean": 6.2e-05, "confidence_mean": 0.9999, "aleatoric_std": 1.1e-05, "epistemic_std": 2.2e-05}], "train_sharpe": 1.0628, "train_psr": 0.9943, "train_equity": 2036.79, "train_sortino": 1.4106, "train_return_pct": 103.68, "train_max_dd": 13.35, "train_win_rate": 54.04, "train_profit_factor": 1.278, "train_ic": 0.0918, "train_hit": 53.76, "train_precision": 0.5384, "train_recall": 0.7922, "train_f1": 0.6411, "train_f2": 0.7239, "train_mcc": 0.0704, "train_accuracy": 0.5398, "train_per_window": [{"fold": "all_train", "regime": "Training data", "sharpe": 1.0628, "sortino": 1.4106, "return_pct": 103.68, "equity": 2036.79, "max_dd": 13.35, "win_rate": 54.04, "profit_factor": 1.278, "ic": 0.0918, "hit": 53.76, "n": 1382, "precision": 0.5384, "recall": 0.7922, "f1": 0.6411, "f2": 0.7239, "mcc": 0.0704, "accuracy": 0.5398, "tp": 568, "fp": 487, "tn": 178, "fn": 149}], "experiment_num": 248, "status": "DISCARD"}
