{"experiment_num": 6, "description": "lr=5e-6 minimal", "status": "DISCARD", "config": {"seq_len": 60, "lr": 5e-06, "batch_size": 32, "epochs": 20, "weight_decay": 1e-05, "patience": 5, "grad_clip": 1.0}, "composite": 0.7074, "test_pos_folds": 6, "val_pos_folds": 7, "sharpe": 0.8074, "psr": 0.8998, "equity": 1194.03, "ic": 0.0186, "hit": 50.08, "per_window": [{"fold": "fold_1", "regime": "Pre-crisis upturn + GFC onset", "sharpe": 0.1154, "sortino": 0.2026, "return_pct": 0.14, "equity": 1001.38, "max_dd": 3.8, "win_rate": 48.08, "profit_factor": 1.018, "ic": 0.2011, "hit": 47.17, "n": 53}, {"fold": "fold_2", "regime": "Post-crash recovery", "sharpe": 0.1054, "sortino": 0.1862, "return_pct": 0.12, "equity": 1001.21, "max_dd": 5.21, "win_rate": 43.86, "profit_factor": 1.017, "ic": -0.0746, "hit": 43.86, "n": 57}, {"fold": "fold_3", "regime": "Eurozone debt plateau", "sharpe": 6.3264, "sortino": 14.9229, "return_pct": 10.91, "equity": 1109.12, "max_dd": 2.02, "win_rate": 55.56, "profit_factor": 2.761, "ic": 0.3075, "hit": 53.57, "n": 56}, {"fold": "fold_4", "regime": "Strong USD downturn", "sharpe": 2.1803, "sortino": 4.1476, "return_pct": 11.25, "equity": 1112.46, "max_dd": 4.34, "win_rate": 52.99, "profit_factor": 1.442, "ic": 0.1449, "hit": 52.54, "n": 118}, {"fold": "fold_5", "regime": "Low-vol plateau", "sharpe": 0.7214, "sortino": 1.2382, "return_pct": 1.58, "equity": 1015.79, "max_dd": 2.98, "win_rate": 51.79, "profit_factor": 1.127, "ic": 0.071, "hit": 51.79, "n": 112}, {"fold": "fold_6", "regime": "EUR crisis downturn", "sharpe": 0.0726, "sortino": 0.1133, "return_pct": 0.1, "equity": 1001.05, "max_dd": 7.31, "win_rate": 52.17, "profit_factor": 1.012, "ic": -0.0052, "hit": 52.17, "n": 115}, {"fold": "fold_7", "regime": "Recent mixed/upturn", "sharpe": -1.2169, "sortino": -2.148, "return_pct": -5.08, "equity": 949.23, "max_dd": 8.74, "win_rate": 46.43, "profit_factor": 0.812, "ic": -0.2178, "hit": 46.43, "n": 112}], "val_loss": 0.002534, "val_sharpe": 1.0301, "val_ic": 0.103, "val_hit": 53.35, "val_per_window": [{"fold": "fold_1", "regime": "Pre-crisis upturn + GFC onset", "sharpe": 0.386, "sortino": 0.6576, "return_pct": 0.56, "equity": 1005.6, "max_dd": 2.71, "win_rate": 50.0, "profit_factor": 1.066, "ic": 0.0379, "hit": 49.15, "n": 59}, {"fold": "fold_2", "regime": "Post-crash recovery", "sharpe": 1.2001, "sortino": 1.8835, "return_pct": 2.29, "equity": 1022.9, "max_dd": 2.18, "win_rate": 51.72, "profit_factor": 1.214, "ic": -0.0441, "hit": 51.72, "n": 58}, {"fold": "fold_3", "regime": "Eurozone debt plateau", "sharpe": 0.928, "sortino": 1.1923, "return_pct": 2.1, "equity": 1020.95, "max_dd": 2.73, "win_rate": 54.1, "profit_factor": 1.167, "ic": 0.1491, "hit": 54.1, "n": 61}, {"fold": "fold_4", "regime": "Strong USD downturn", "sharpe": 2.4935, "sortino": 4.6603, "return_pct": 5.44, "equity": 1054.36, "max_dd": 1.92, "win_rate": 51.67, "profit_factor": 1.466, "ic": 0.2048, "hit": 51.67, "n": 60}, {"fold": "fold_5", "regime": "Low-vol plateau", "sharpe": 0.2327, "sortino": 0.3398, "return_pct": 0.34, "equity": 1003.43, "max_dd": 3.99, "win_rate": 53.23, "profit_factor": 1.038, "ic": -0.0345, "hit": 53.23, "n": 62}, {"fold": "fold_6", "regime": "EUR crisis downturn", "sharpe": 1.2957, "sortino": 2.4735, "return_pct": 1.33, "equity": 1013.33, "max_dd": 1.77, "win_rate": 56.14, "profit_factor": 1.237, "ic": -0.0048, "hit": 55.17, "n": 58}, {"fold": "fold_7", "regime": "Recent mixed/upturn", "sharpe": 0.4523, "sortino": 0.7422, "return_pct": 0.55, "equity": 1005.46, "max_dd": 2.36, "win_rate": 58.33, "profit_factor": 1.077, "ic": 0.0852, "hit": 58.33, "n": 60}], "train_sharpe": 0.1967, "train_ic": 0.0433, "train_per_window": [{"fold": "all_train", "regime": "Training data (holed)", "sharpe": 0.1967, "sortino": 0.2141, "return_pct": 9.72, "equity": 1097.16, "max_dd": 21.67, "win_rate": 51.2, "profit_factor": 1.046, "ic": 0.0433, "hit": 50.94, "n": 1382}], "elapsed_sec": 222.3, "timestamp": "2026-04-11T09:59:41"}
{"experiment_num": 7, "description": "bs=16 more gradient noise", "status": "DISCARD", "config": {"seq_len": 60, "lr": 3e-05, "batch_size": 16, "epochs": 20, "weight_decay": 1e-05, "patience": 5, "grad_clip": 1.0}, "composite": -0.3363, "test_pos_folds": 4, "val_pos_folds": 5, "sharpe": 0.1637, "psr": 0.6014, "equity": 1027.56, "ic": 0.0798, "hit": 51.85, "per_window": [{"fold": "fold_1", "regime": "Pre-crisis upturn + GFC onset", "sharpe": -1.7147, "sortino": -3.102, "return_pct": -3.65, "equity": 963.55, "max_dd": 6.01, "win_rate": 44.23, "profit_factor": 0.769, "ic": -0.1229, "hit": 43.4, "n": 53}, {"fold": "fold_2", "regime": "Post-crash recovery", "sharpe": -3.5258, "sortino": -5.4894, "return_pct": -9.54, "equity": 904.65, "max_dd": 9.94, "win_rate": 47.37, "profit_factor": 0.568, "ic": -0.0312, "hit": 47.37, "n": 57}, {"fold": "fold_3", "regime": "Eurozone debt plateau", "sharpe": -1.288, "sortino": -2.1461, "return_pct": -2.32, "equity": 976.79, "max_dd": 4.94, "win_rate": 44.44, "profit_factor": 0.814, "ic": 0.0527, "hit": 42.86, "n": 56}, {"fold": "fold_4", "regime": "Strong USD downturn", "sharpe": 0.5683, "sortino": 0.9075, "return_pct": 2.63, "equity": 1026.35, "max_dd": 6.94, "win_rate": 54.7, "profit_factor": 1.1, "ic": 0.1216, "hit": 54.24, "n": 118}, {"fold": "fold_5", "regime": "Low-vol plateau", "sharpe": 2.2471, "sortino": 3.2223, "return_pct": 5.08, "equity": 1050.81, "max_dd": 2.38, "win_rate": 58.93, "profit_factor": 1.454, "ic": 0.0611, "hit": 58.93, "n": 112}, {"fold": "fold_6", "regime": "EUR crisis downturn", "sharpe": 2.0211, "sortino": 3.4501, "return_pct": 9.21, "equity": 1092.12, "max_dd": 3.57, "win_rate": 52.17, "profit_factor": 1.377, "ic": 0.142, "hit": 52.17, "n": 115}, {"fold": "fold_7", "regime": "Recent mixed/upturn", "sharpe": 0.6352, "sortino": 0.7908, "return_pct": 2.46, "equity": 1024.62, "max_dd": 3.36, "win_rate": 52.68, "profit_factor": 1.115, "ic": 0.1114, "hit": 52.68, "n": 112}], "val_loss": 0.000803, "val_sharpe": 1.4894, "val_ic": 0.0631, "val_hit": 53.35, "val_per_window": [{"fold": "fold_1", "regime": "Pre-crisis upturn + GFC onset", "sharpe": 1.3008, "sortino": 1.8865, "return_pct": 2.02, "equity": 1020.22, "max_dd": 3.54, "win_rate": 51.72, "profit_factor": 1.239, "ic": -0.1023, "hit": 50.85, "n": 59}, {"fold": "fold_2", "regime": "Post-crash recovery", "sharpe": 4.7481, "sortino": 9.4491, "return_pct": 9.24, "equity": 1092.44, "max_dd": 1.63, "win_rate": 60.34, "profit_factor": 2.164, "ic": 0.1241, "hit": 60.34, "n": 58}, {"fold": "fold_3", "regime": "Eurozone debt plateau", "sharpe": 0.7044, "sortino": 1.294, "return_pct": 1.56, "equity": 1015.6, "max_dd": 3.55, "win_rate": 44.26, "profit_factor": 1.125, "ic": 0.0107, "hit": 44.26, "n": 61}, {"fold": "fold_4", "regime": "Strong USD downturn", "sharpe": -0.2627, "sortino": -0.4604, "return_pct": -0.67, "equity": 993.26, "max_dd": 4.98, "win_rate": 51.67, "profit_factor": 0.961, "ic": -0.1079, "hit": 51.67, "n": 60}, {"fold": "fold_5", "regime": "Low-vol plateau", "sharpe": 3.4938, "sortino": 6.5272, "return_pct": 6.04, "equity": 1060.41, "max_dd": 2.6, "win_rate": 64.52, "profit_factor": 1.764, "ic": 0.2975, "hit": 64.52, "n": 62}, {"fold": "fold_6", "regime": "EUR crisis downturn", "sharpe": 1.4969, "sortino": 2.9736, "return_pct": 1.54, "equity": 1015.43, "max_dd": 1.62, "win_rate": 56.14, "profit_factor": 1.278, "ic": -0.1901, "hit": 55.17, "n": 58}, {"fold": "fold_7", "regime": "Recent mixed/upturn", "sharpe": -0.7672, "sortino": -1.0407, "return_pct": -1.01, "equity": 989.9, "max_dd": 2.55, "win_rate": 46.67, "profit_factor": 0.882, "ic": -0.0157, "hit": 46.67, "n": 60}], "train_sharpe": 2.5775, "train_ic": 0.2451, "train_per_window": [{"fold": "all_train", "regime": "Training data (holed)", "sharpe": 2.5775, "sortino": 6.1495, "return_pct": 488.47, "equity": 5884.74, "max_dd": 6.26, "win_rate": 57.24, "profit_factor": 1.828, "ic": 0.2451, "hit": 56.95, "n": 1382}], "elapsed_sec": 426.4, "timestamp": "2026-04-11T10:06:47"}
{"backbone": "lfm2-350m", "description": "bs=16 at best lr=3e-5: smaller batch = more gradient noise = implicit regularization for 2738 training samples", "config": {"seq_len": 60, "lr": 3e-05, "batch_size": 16, "epochs": 20, "weight_decay": 1e-05, "patience": 5, "grad_clip": 1.0}, "composite": -0.7855, "test_pos_folds": 4, "val_pos_folds": 4, "val_loss": 0.000827, "elapsed_sec": 730.9, "timestamp": "2026-04-11T10:13:23", "sharpe": 1.4165, "psr": 0.9877, "equity": 1375.11, "sortino": 2.2735, "return_pct": 37.51, "max_dd": 16.64, "win_rate": 54.28, "profit_factor": 1.269, "ic": 0.0925, "hit": 53.93, "per_window": [{"fold": "fold_1", "regime": "Pre-crisis upturn + GFC onset", "sharpe": -2.7442, "sortino": -4.9784, "return_pct": -5.66, "equity": 943.39, "max_dd": 9.5, "win_rate": 44.23, "profit_factor": 0.657, "ic": -0.0354, "hit": 43.4, "n": 53}, {"fold": "fold_2", "regime": "Post-crash recovery", "sharpe": -1.9999, "sortino": -3.1782, "return_pct": -5.69, "equity": 943.15, "max_dd": 10.84, "win_rate": 43.86, "profit_factor": 0.726, "ic": -0.1536, "hit": 43.86, "n": 57}, {"fold": "fold_3", "regime": "Eurozone debt plateau", "sharpe": 4.2252, "sortino": 7.1176, "return_pct": 7.44, "equity": 1074.37, "max_dd": 1.9, "win_rate": 57.41, "profit_factor": 1.964, "ic": 0.289, "hit": 55.36, "n": 56}, {"fold": "fold_4", "regime": "Strong USD downturn", "sharpe": 3.0059, "sortino": 5.8466, "return_pct": 15.8, "equity": 1158.03, "max_dd": 4.96, "win_rate": 54.7, "profit_factor": 1.658, "ic": 0.1062, "hit": 54.24, "n": 118}, {"fold": "fold_5", "regime": "Low-vol plateau", "sharpe": 2.0357, "sortino": 3.8449, "return_pct": 4.6, "equity": 1045.95, "max_dd": 3.04, "win_rate": 53.57, "profit_factor": 1.403, "ic": 0.1292, "hit": 53.57, "n": 112}, {"fold": "fold_6", "regime": "EUR crisis downturn", "sharpe": -1.2346, "sortino": -1.9558, "return_pct": -5.61, "equity": 943.94, "max_dd": 8.42, "win_rate": 48.7, "profit_factor": 0.823, "ic": 0.1557, "hit": 48.7, "n": 115}, {"fold": "fold_7", "regime": "Recent mixed/upturn", "sharpe": 5.9825, "sortino": 11.0138, "return_pct": 25.82, "equity": 1258.16, "max_dd": 1.94, "win_rate": 68.75, "profit_factor": 2.842, "ic": 0.492, "hit": 68.75, "n": 112}], "val_sharpe": -0.1855, "val_psr": 0.4056, "val_equity": 972.43, "val_sortino": -0.2715, "val_return_pct": -2.76, "val_max_dd": 14.51, "val_win_rate": 51.44, "val_profit_factor": 0.97, "val_ic": 0.0237, "val_hit": 51.2, "val_per_window": [{"fold": "fold_1", "regime": "Pre-crisis upturn + GFC onset", "sharpe": -1.351, "sortino": -2.2877, "return_pct": -2.16, "equity": 978.35, "max_dd": 5.47, "win_rate": 48.28, "profit_factor": 0.801, "ic": 0.0551, "hit": 47.46, "n": 59}, {"fold": "fold_2", "regime": "Post-crash recovery", "sharpe": 1.0567, "sortino": 1.7126, "return_pct": 2.0, "equity": 1020.05, "max_dd": 2.79, "win_rate": 56.9, "profit_factor": 1.186, "ic": 0.1197, "hit": 56.9, "n": 58}, {"fold": "fold_3", "regime": "Eurozone debt plateau", "sharpe": -4.5907, "sortino": -5.9732, "return_pct": -10.0, "equity": 899.98, "max_dd": 11.03, "win_rate": 44.26, "profit_factor": 0.463, "ic": -0.0117, "hit": 44.26, "n": 61}, {"fold": "fold_4", "regime": "Strong USD downturn", "sharpe": 1.3617, "sortino": 2.4559, "return_pct": 2.91, "equity": 1029.12, "max_dd": 1.79, "win_rate": 56.67, "profit_factor": 1.232, "ic": 0.0755, "hit": 56.67, "n": 60}, {"fold": "fold_5", "regime": "Low-vol plateau", "sharpe": 1.6359, "sortino": 2.847, "return_pct": 2.8, "equity": 1028.04, "max_dd": 2.02, "win_rate": 53.23, "profit_factor": 1.304, "ic": 0.1348, "hit": 53.23, "n": 62}, {"fold": "fold_6", "regime": "EUR crisis downturn", "sharpe": -0.981, "sortino": -1.4873, "return_pct": -1.04, "equity": 989.6, "max_dd": 2.18, "win_rate": 45.61, "profit_factor": 0.851, "ic": 0.0336, "hit": 44.83, "n": 58}, {"fold": "fold_7", "regime": "Recent mixed/upturn", "sharpe": 2.6868, "sortino": 4.9398, "return_pct": 3.41, "equity": 1034.12, "max_dd": 0.84, "win_rate": 55.0, "profit_factor": 1.551, "ic": 0.1272, "hit": 55.0, "n": 60}], "train_sharpe": 2.6818, "train_psr": 1.0, "train_equity": 6320.65, "train_sortino": 6.2738, "train_return_pct": 532.06, "train_max_dd": 5.17, "train_win_rate": 57.6, "train_profit_factor": 1.874, "train_ic": 0.2478, "train_hit": 57.31, "train_per_window": [{"fold": "all_train", "regime": "Training data", "sharpe": 2.6818, "sortino": 6.2738, "return_pct": 532.06, "equity": 6320.65, "max_dd": 5.17, "win_rate": 57.6, "profit_factor": 1.874, "ic": 0.2478, "hit": 57.31, "n": 1382}], "experiment_num": 8, "status": "DISCARD"}
{"backbone": "lfm2-350m", "description": "seq=40 at lr=3e-5: shorter window = more training samples + less stale context, FX autocorrelation decays in 5-10d", "config": {"seq_len": 40, "lr": 3e-05, "batch_size": 32, "epochs": 20, "weight_decay": 1e-05, "patience": 5, "grad_clip": 1.0}, "composite": -0.2209, "test_pos_folds": 6, "val_pos_folds": 3, "val_loss": 0.000664, "elapsed_sec": 626.9, "timestamp": "2026-04-11T10:18:09", "sharpe": 1.9513, "psr": 0.9996, "equity": 1732.6, "sortino": 3.0048, "return_pct": 73.26, "max_dd": 8.08, "win_rate": 57.18, "profit_factor": 1.388, "ic": 0.1342, "hit": 56.88, "per_window": [{"fold": "fold_1", "regime": "Pre-crisis upturn + GFC onset", "sharpe": 1.8633, "sortino": 3.0777, "return_pct": 5.69, "equity": 1056.95, "max_dd": 4.54, "win_rate": 54.17, "profit_factor": 1.345, "ic": 0.1169, "hit": 53.42, "n": 73}, {"fold": "fold_2", "regime": "Post-crash recovery", "sharpe": -0.4104, "sortino": -0.6353, "return_pct": -1.67, "equity": 983.32, "max_dd": 8.08, "win_rate": 51.95, "profit_factor": 0.937, "ic": -0.0651, "hit": 51.95, "n": 77}, {"fold": "fold_3", "regime": "Eurozone debt plateau", "sharpe": 4.0121, "sortino": 5.8492, "return_pct": 10.42, "equity": 1104.21, "max_dd": 1.89, "win_rate": 67.57, "profit_factor": 1.877, "ic": 0.2212, "hit": 65.79, "n": 76}, {"fold": "fold_4", "regime": "Strong USD downturn", "sharpe": 4.0438, "sortino": 6.0043, "return_pct": 27.77, "equity": 1277.7, "max_dd": 4.1, "win_rate": 62.77, "profit_factor": 2.003, "ic": 0.297, "hit": 62.32, "n": 138}, {"fold": "fold_5", "regime": "Low-vol plateau", "sharpe": 1.7542, "sortino": 2.6597, "return_pct": 4.8, "equity": 1048.04, "max_dd": 2.11, "win_rate": 56.82, "profit_factor": 1.339, "ic": 0.1232, "hit": 56.82, "n": 132}, {"fold": "fold_6", "regime": "EUR crisis downturn", "sharpe": 1.5282, "sortino": 2.5327, "return_pct": 8.04, "equity": 1080.41, "max_dd": 6.95, "win_rate": 56.3, "profit_factor": 1.274, "ic": 0.2301, "hit": 56.3, "n": 135}, {"fold": "fold_7", "regime": "Recent mixed/upturn", "sharpe": 0.94, "sortino": 1.7196, "return_pct": 4.35, "equity": 1043.53, "max_dd": 5.41, "win_rate": 51.52, "profit_factor": 1.173, "ic": 0.1162, "hit": 51.52, "n": 132}], "val_sharpe": 0.2791, "val_psr": 0.6609, "val_equity": 1042.43, "val_sortino": 0.4203, "val_return_pct": 4.24, "val_max_dd": 11.78, "val_win_rate": 52.35, "val_profit_factor": 1.048, "val_ic": 0.0611, "val_hit": 51.97, "val_per_window": [{"fold": "fold_1", "regime": "Pre-crisis upturn + GFC onset", "sharpe": -2.7909, "sortino": -3.9262, "return_pct": -5.4, "equity": 945.95, "max_dd": 7.75, "win_rate": 44.87, "profit_factor": 0.628, "ic": -0.0839, "hit": 44.3, "n": 79}, {"fold": "fold_2", "regime": "Post-crash recovery", "sharpe": -0.2544, "sortino": -0.4255, "return_pct": -0.92, "equity": 990.82, "max_dd": 6.76, "win_rate": 48.72, "profit_factor": 0.96, "ic": -0.0096, "hit": 48.72, "n": 78}, {"fold": "fold_3", "regime": "Eurozone debt plateau", "sharpe": 3.0146, "sortino": 5.74, "return_pct": 9.51, "equity": 1095.07, "max_dd": 4.74, "win_rate": 60.0, "profit_factor": 1.643, "ic": 0.1587, "hit": 59.26, "n": 81}, {"fold": "fold_4", "regime": "Strong USD downturn", "sharpe": -0.4334, "sortino": -0.6402, "return_pct": -1.36, "equity": 986.38, "max_dd": 4.76, "win_rate": 53.16, "profit_factor": 0.934, "ic": 0.0427, "hit": 52.5, "n": 80}, {"fold": "fold_5", "regime": "Low-vol plateau", "sharpe": 1.6144, "sortino": 2.0338, "return_pct": 3.94, "equity": 1039.43, "max_dd": 3.89, "win_rate": 57.32, "profit_factor": 1.314, "ic": 0.2543, "hit": 57.32, "n": 82}, {"fold": "fold_6", "regime": "EUR crisis downturn", "sharpe": 1.5096, "sortino": 2.7306, "return_pct": 2.31, "equity": 1023.07, "max_dd": 1.09, "win_rate": 58.44, "profit_factor": 1.289, "ic": 0.0896, "hit": 57.69, "n": 78}, {"fold": "fold_7", "regime": "Recent mixed/upturn", "sharpe": -1.7669, "sortino": -2.6274, "return_pct": -3.17, "equity": 968.26, "max_dd": 5.95, "win_rate": 43.75, "profit_factor": 0.752, "ic": -0.0565, "hit": 43.75, "n": 80}], "train_sharpe": 2.2976, "train_psr": 1.0, "train_equity": 6972.07, "train_sortino": 4.9011, "train_return_pct": 597.21, "train_max_dd": 10.85, "train_win_rate": 56.1, "train_profit_factor": 1.661, "train_ic": 0.2023, "train_hit": 55.88, "train_per_window": [{"fold": "all_train", "regime": "Training data", "sharpe": 2.2976, "sortino": 4.9011, "return_pct": 597.21, "equity": 6972.07, "max_dd": 10.85, "win_rate": 56.1, "profit_factor": 1.661, "ic": 0.2023, "hit": 55.88, "n": 1761}], "experiment_num": 9, "status": "DISCARD"}
{"backbone": "lfm2-350m", "description": "wd=1e-4 at best: 10x stronger L2 to prevent head overfitting to majority regime patterns (Lopez de Prado 2018)", "config": {"seq_len": 60, "lr": 3e-05, "batch_size": 32, "epochs": 20, "weight_decay": 0.0001, "patience": 5, "grad_clip": 1.0}, "composite": -0.2134, "test_pos_folds": 5, "val_pos_folds": 4, "val_loss": 0.001166, "elapsed_sec": 347.9, "timestamp": "2026-04-11T10:20:29", "sharpe": 1.0224, "psr": 0.9439, "equity": 1255.16, "sortino": 1.4654, "return_pct": 25.52, "max_dd": 11.24, "win_rate": 54.12, "profit_factor": 1.187, "ic": 0.0696, "hit": 53.77, "per_window": [{"fold": "fold_1", "regime": "Pre-crisis upturn + GFC onset", "sharpe": 1.6904, "sortino": 3.379, "return_pct": 3.51, "equity": 1035.1, "max_dd": 2.46, "win_rate": 55.77, "profit_factor": 1.296, "ic": -0.0626, "hit": 54.72, "n": 53}, {"fold": "fold_2", "regime": "Post-crash recovery", "sharpe": 0.4212, "sortino": 0.6386, "return_pct": 1.03, "equity": 1010.28, "max_dd": 4.82, "win_rate": 52.63, "profit_factor": 1.07, "ic": 0.1006, "hit": 52.63, "n": 57}, {"fold": "fold_3", "regime": "Eurozone debt plateau", "sharpe": 2.9845, "sortino": 4.6935, "return_pct": 5.27, "equity": 1052.67, "max_dd": 3.12, "win_rate": 64.81, "profit_factor": 1.61, "ic": 0.135, "hit": 62.5, "n": 56}, {"fold": "fold_4", "regime": "Strong USD downturn", "sharpe": 1.3756, "sortino": 1.9609, "return_pct": 6.89, "equity": 1068.88, "max_dd": 6.14, "win_rate": 56.41, "profit_factor": 1.26, "ic": 0.1924, "hit": 55.93, "n": 118}, {"fold": "fold_5", "regime": "Low-vol plateau", "sharpe": -0.8906, "sortino": -1.3945, "return_pct": -2.04, "equity": 979.6, "max_dd": 3.64, "win_rate": 45.54, "profit_factor": 0.862, "ic": 0.1151, "hit": 45.54, "n": 112}, {"fold": "fold_6", "regime": "EUR crisis downturn", "sharpe": 2.7386, "sortino": 4.3232, "return_pct": 12.68, "equity": 1126.8, "max_dd": 5.56, "win_rate": 59.13, "profit_factor": 1.542, "ic": 0.1361, "hit": 59.13, "n": 115}, {"fold": "fold_7", "regime": "Recent mixed/upturn", "sharpe": -0.7805, "sortino": -0.9924, "return_pct": -3.36, "equity": 966.4, "max_dd": 9.58, "win_rate": 50.0, "profit_factor": 0.875, "ic": -0.0193, "hit": 50.0, "n": 112}], "val_sharpe": 0.2866, "val_psr": 0.6438, "val_equity": 1031.65, "val_sortino": 0.4481, "val_return_pct": 3.16, "val_max_dd": 9.41, "val_win_rate": 48.56, "val_profit_factor": 1.049, "val_ic": 0.0456, "val_hit": 48.33, "val_per_window": [{"fold": "fold_1", "regime": "Pre-crisis upturn + GFC onset", "sharpe": -1.8863, "sortino": -2.7116, "return_pct": -2.98, "equity": 970.21, "max_dd": 5.79, "win_rate": 46.55, "profit_factor": 0.733, "ic": -0.0347, "hit": 45.76, "n": 59}, {"fold": "fold_2", "regime": "Post-crash recovery", "sharpe": 1.4602, "sortino": 2.5031, "return_pct": 2.81, "equity": 1028.08, "max_dd": 3.19, "win_rate": 53.45, "profit_factor": 1.267, "ic": 0.0494, "hit": 53.45, "n": 58}, {"fold": "fold_3", "regime": "Eurozone debt plateau", "sharpe": -0.9744, "sortino": -1.3706, "return_pct": -2.39, "equity": 976.15, "max_dd": 5.81, "win_rate": 42.62, "profit_factor": 0.85, "ic": -0.049, "hit": 42.62, "n": 61}, {"fold": "fold_4", "regime": "Strong USD downturn", "sharpe": 1.2774, "sortino": 2.5489, "return_pct": 2.72, "equity": 1027.24, "max_dd": 4.71, "win_rate": 48.33, "profit_factor": 1.216, "ic": -0.049, "hit": 48.33, "n": 60}, {"fold": "fold_5", "regime": "Low-vol plateau", "sharpe": 0.6557, "sortino": 1.0666, "return_pct": 1.08, "equity": 1010.83, "max_dd": 2.65, "win_rate": 53.23, "profit_factor": 1.112, "ic": 0.1753, "hit": 53.23, "n": 62}, {"fold": "fold_6", "regime": "EUR crisis downturn", "sharpe": -0.9157, "sortino": -1.6172, "return_pct": -0.97, "equity": 990.27, "max_dd": 2.1, "win_rate": 47.37, "profit_factor": 0.861, "ic": 0.0075, "hit": 46.55, "n": 58}, {"fold": "fold_7", "regime": "Recent mixed/upturn", "sharpe": 2.3966, "sortino": 5.3084, "return_pct": 3.04, "equity": 1030.43, "max_dd": 1.78, "win_rate": 48.33, "profit_factor": 1.479, "ic": 0.0053, "hit": 48.33, "n": 60}], "train_sharpe": 2.0609, "train_psr": 1.0, "train_equity": 4116.59, "train_sortino": 4.7803, "train_return_pct": 311.66, "train_max_dd": 8.69, "train_win_rate": 56.95, "train_profit_factor": 1.615, "train_ic": 0.2101, "train_hit": 56.66, "train_per_window": [{"fold": "all_train", "regime": "Training data", "sharpe": 2.0609, "sortino": 4.7803, "return_pct": 311.66, "equity": 4116.59, "max_dd": 8.69, "win_rate": 56.95, "profit_factor": 1.615, "ic": 0.2101, "hit": 56.66, "n": 1382}], "experiment_num": 10, "status": "DISCARD"}
