{"backbone": "xlstm", "description": "xlstm: Exp3 lr=1e-3 hd=0.25", "config": {"seq_len": 10, "lr": 0.001, "batch_size": 16, "epochs": 80, "weight_decay": 0.001, "patience": 15, "grad_clip": 1.0, "warmup_epochs": 5, "huber_delta": 1.0, "head_dropout": 0.25, "seed": 42, "het_loss": false}, "composite": -0.6334, "test_pos_folds": 3, "val_pos_folds": 4, "val_loss": 4.1e-05, "elapsed_sec": 324.8, "timestamp": "2026-04-21T13:44:35", "sharpe": 0.5403, "psr": 0.8541, "equity": 1225.47, "sortino": 0.7563, "return_pct": 22.55, "max_dd": 13.6, "win_rate": 50.15, "profit_factor": 1.105, "ic": 0.0382, "hit": 49.95, "aleatoric_mean": 2.3e-05, "epistemic_mean": 4.6e-05, "confidence_mean": 0.9999, "precision": 0.4971, "recall": 0.7193, "f1": 0.5879, "f2": 0.6603, "mcc": 0.0088, "accuracy": 0.5015, "per_window": [{"fold": "fold_1", "regime": "Pre-crisis upturn + GFC onset", "sharpe": -0.4176, "sortino": -0.472, "return_pct": -3.88, "equity": 961.24, "max_dd": 7.96, "win_rate": 50.98, "profit_factor": 0.906, "ic": 0.0571, "hit": 50.49, "n": 103, "precision": 0.5312, "recall": 0.3208, "f1": 0.4, "f2": 0.3484, "mcc": 0.0224, "accuracy": 0.5049, "tp": 17, "fp": 15, "tn": 35, "fn": 36, "aleatoric_mean": 4.2e-05, "epistemic_mean": 8.3e-05, "confidence_mean": 0.9999, "aleatoric_std": 4.4e-05, "epistemic_std": 8.7e-05}, {"fold": "fold_2", "regime": "Post-crash recovery", "sharpe": 2.8017, "sortino": 4.8032, "return_pct": 13.85, "equity": 1138.53, "max_dd": 6.23, "win_rate": 54.21, "profit_factor": 1.551, "ic": -0.0498, "hit": 54.21, "n": 107, "precision": 0.5417, "recall": 0.2549, "f1": 0.3467, "f2": 0.2851, "mcc": 0.07, "accuracy": 0.5421, "tp": 13, "fp": 11, "tn": 45, "fn": 38, "aleatoric_mean": 2.6e-05, "epistemic_mean": 5.1e-05, "confidence_mean": 0.9999, "aleatoric_std": 1e-05, "epistemic_std": 1.9e-05}, {"fold": "fold_3", "regime": "Eurozone debt plateau", "sharpe": -0.4573, "sortino": -0.749, "return_pct": -1.76, "equity": 982.43, "max_dd": 6.79, "win_rate": 45.19, "profit_factor": 0.931, "ic": -0.0339, "hit": 44.34, "n": 106, "precision": 0.4921, "recall": 0.5439, "f1": 0.5167, "f2": 0.5326, "mcc": -0.1109, "accuracy": 0.4528, "tp": 31, "fp": 32, "tn": 17, "fn": 26, "aleatoric_mean": 2.5e-05, "epistemic_mean": 5e-05, "confidence_mean": 0.9999, "aleatoric_std": 1.1e-05, "epistemic_std": 2.1e-05}, {"fold": "fold_4", "regime": "Strong USD downturn", "sharpe": 1.7306, "sortino": 2.9873, "return_pct": 13.81, "equity": 1138.08, "max_dd": 6.22, "win_rate": 53.89, "profit_factor": 1.338, "ic": 0.1084, "hit": 53.57, "n": 168, "precision": 0.5338, "recall": 0.8256, "f1": 0.6484, "f2": 0.7442, "mcc": 0.0855, "accuracy": 0.5417, "tp": 71, "fp": 62, "tn": 20, "fn": 15, "aleatoric_mean": 2e-05, "epistemic_mean": 3.9e-05, "confidence_mean": 0.9999, "aleatoric_std": 1e-05, "epistemic_std": 1.9e-05}, {"fold": "fold_5", "regime": "Low-vol plateau", "sharpe": -0.537, "sortino": -0.8462, "return_pct": -1.86, "equity": 981.42, "max_dd": 3.56, "win_rate": 47.53, "profit_factor": 0.915, "ic": -0.0052, "hit": 47.53, "n": 162, "precision": 0.4717, "recall": 0.9868, "f1": 0.6383, "f2": 0.8099, "mcc": 0.0374, "accuracy": 0.4753, "tp": 75, "fp": 84, "tn": 2, "fn": 1, "aleatoric_mean": 1.1e-05, "epistemic_mean": 2.2e-05, "confidence_mean": 1.0, "aleatoric_std": 5e-06, "epistemic_std": 9e-06}, {"fold": "fold_6", "regime": "EUR crisis downturn", "sharpe": -1.1733, "sortino": -1.8159, "return_pct": -7.39, "equity": 926.14, "max_dd": 12.88, "win_rate": 50.91, "profit_factor": 0.827, "ic": 0.0395, "hit": 50.91, "n": 165, "precision": 0.4857, "recall": 0.8831, "f1": 0.6267, "f2": 0.7589, "mcc": 0.0904, "accuracy": 0.5091, "tp": 68, "fp": 72, "tn": 16, "fn": 9, "aleatoric_mean": 2.6e-05, "epistemic_mean": 5.3e-05, "confidence_mean": 0.9999, "aleatoric_std": 1.2e-05, "epistemic_std": 2.4e-05}, {"fold": "fold_7", "regime": "Recent mixed/upturn", "sharpe": 1.6821, "sortino": 3.2437, "return_pct": 10.18, "equity": 1101.84, "max_dd": 5.01, "win_rate": 48.15, "profit_factor": 1.329, "ic": 0.0352, "hit": 48.15, "n": 162, "precision": 0.4897, "recall": 0.8765, "f1": 0.6283, "f2": 0.7569, "mcc": -0.0604, "accuracy": 0.4815, "tp": 71, "fp": 74, "tn": 7, "fn": 10, "aleatoric_mean": 2.1e-05, "epistemic_mean": 4.2e-05, "confidence_mean": 0.9999, "aleatoric_std": 1e-05, "epistemic_std": 2e-05}], "val_sharpe": 0.0666, "val_psr": 0.5463, "val_equity": 1006.59, "val_sortino": 0.1029, "val_return_pct": 0.66, "val_max_dd": 14.7, "val_win_rate": 47.97, "val_profit_factor": 1.011, "val_ic": 0.057, "val_hit": 47.66, "val_aleatoric_mean": 1.6e-05, "val_epistemic_mean": 3.1e-05, "val_confidence_mean": 1.0, "val_precision": 0.4735, "val_recall": 0.8822, "val_f1": 0.6163, "val_f2": 0.7523, "val_mcc": -0.0096, "val_accuracy": 0.4779, "val_per_window": [{"fold": "fold_1", "regime": "Pre-crisis upturn + GFC onset", "sharpe": -0.2975, "sortino": -0.476, "return_pct": -0.82, "equity": 991.78, "max_dd": 3.72, "win_rate": 44.44, "profit_factor": 0.952, "ic": -0.054, "hit": 44.04, "n": 109, "precision": 0.4731, "recall": 0.8, "f1": 0.5946, "f2": 0.7029, "mcc": -0.1517, "accuracy": 0.4495, "tp": 44, "fp": 49, "tn": 5, "fn": 11, "aleatoric_mean": 1.6e-05, "epistemic_mean": 3.1e-05, "confidence_mean": 1.0, "aleatoric_std": 1.2e-05, "epistemic_std": 2.4e-05}, {"fold": "fold_2", "regime": "Post-crash recovery", "sharpe": 2.1135, "sortino": 3.5417, "return_pct": 10.4, "equity": 1104.04, "max_dd": 5.19, "win_rate": 56.48, "profit_factor": 1.396, "ic": 0.0478, "hit": 56.48, "n": 108, "precision": 0.593, "recall": 0.8095, "f1": 0.6846, "f2": 0.7544, "mcc": 0.0389, "accuracy": 0.5648, "tp": 51, "fp": 35, "tn": 10, "fn": 12, "aleatoric_mean": 2.5e-05, "epistemic_mean": 4.9e-05, "confidence_mean": 0.9999, "aleatoric_std": 9e-06, "epistemic_std": 1.8e-05}, {"fold": "fold_3", "regime": "Eurozone debt plateau", "sharpe": 0.5217, "sortino": 0.9608, "return_pct": 1.94, "equity": 1019.43, "max_dd": 5.02, "win_rate": 44.04, "profit_factor": 1.088, "ic": 0.2015, "hit": 43.24, "n": 111, "precision": 0.4216, "recall": 0.9149, "f1": 0.5772, "f2": 0.7414, "mcc": -0.0126, "accuracy": 0.4324, "tp": 43, "fp": 59, "tn": 5, "fn": 4, "aleatoric_mean": 1.6e-05, "epistemic_mean": 3.3e-05, "confidence_mean": 1.0, "aleatoric_std": 7e-06, "epistemic_std": 1.3e-05}, {"fold": "fold_4", "regime": "Strong USD downturn", "sharpe": -1.951, "sortino": -2.9505, "return_pct": -6.64, "equity": 933.61, "max_dd": 7.4, "win_rate": 44.04, "profit_factor": 0.724, "ic": 0.0157, "hit": 43.64, "n": 110, "precision": 0.4118, "recall": 0.7447, "f1": 0.5303, "f2": 0.641, "mcc": -0.0578, "accuracy": 0.4364, "tp": 35, "fp": 50, "tn": 13, "fn": 12, "aleatoric_mean": 1.6e-05, "epistemic_mean": 3.2e-05, "confidence_mean": 1.0, "aleatoric_std": 6e-06, "epistemic_std": 1.3e-05}, {"fold": "fold_5", "regime": "Low-vol plateau", "sharpe": -1.6028, "sortino": -2.1916, "return_pct": -5.3, "equity": 946.97, "max_dd": 7.65, "win_rate": 47.32, "profit_factor": 0.766, "ic": 0.0462, "hit": 47.32, "n": 112, "precision": 0.4732, "recall": 1.0, "f1": 0.6424, "f2": 0.8179, "mcc": 0.0, "accuracy": 0.4732, "tp": 53, "fp": 59, "tn": 0, "fn": 0, "aleatoric_mean": 1.2e-05, "epistemic_mean": 2.3e-05, "confidence_mean": 1.0, "aleatoric_std": 4e-06, "epistemic_std": 8e-06}, {"fold": "fold_6", "regime": "EUR crisis downturn", "sharpe": 0.168, "sortino": 0.2372, "return_pct": 0.32, "equity": 1003.24, "max_dd": 3.97, "win_rate": 50.47, "profit_factor": 1.029, "ic": 0.202, "hit": 50.0, "n": 108, "precision": 0.4639, "recall": 0.9574, "f1": 0.625, "f2": 0.7895, "mcc": 0.1721, "accuracy": 0.5, "tp": 45, "fp": 52, "tn": 9, "fn": 2, "aleatoric_mean": 9e-06, "epistemic_mean": 1.9e-05, "confidence_mean": 1.0, "aleatoric_std": 4e-06, "epistemic_std": 7e-06}, {"fold": "fold_7", "regime": "Recent mixed/upturn", "sharpe": 0.7176, "sortino": 1.2318, "return_pct": 1.67, "equity": 1016.68, "max_dd": 2.2, "win_rate": 49.09, "profit_factor": 1.122, "ic": 0.0069, "hit": 49.09, "n": 110, "precision": 0.4857, "recall": 0.9623, "f1": 0.6456, "f2": 0.8044, "mcc": 0.0357, "accuracy": 0.4909, "tp": 51, "fp": 54, "tn": 3, "fn": 2, "aleatoric_mean": 1.6e-05, "epistemic_mean": 3.2e-05, "confidence_mean": 1.0, "aleatoric_std": 6e-06, "epistemic_std": 1.3e-05}], "train_sharpe": 1.9773, "train_psr": 1.0, "train_equity": 10324.03, "train_sortino": 4.4354, "train_return_pct": 932.4, "train_max_dd": 9.28, "train_win_rate": 54.42, "train_profit_factor": 1.546, "train_ic": 0.2117, "train_hit": 54.2, "train_precision": 0.5309, "train_recall": 0.9364, "train_f1": 0.6776, "train_f2": 0.8123, "train_mcc": 0.1049, "train_accuracy": 0.542, "train_per_window": [{"fold": "all_train", "regime": "Training data", "sharpe": 1.9773, "sortino": 4.4354, "return_pct": 932.4, "equity": 10324.03, "max_dd": 9.28, "win_rate": 54.42, "profit_factor": 1.546, "ic": 0.2117, "hit": 54.2, "n": 2478, "precision": 0.5309, "recall": 0.9364, "f1": 0.6776, "f2": 0.8123, "mcc": 0.1049, "accuracy": 0.542, "tp": 1193, "fp": 1054, "tn": 150, "fn": 81}], "experiment_num": 261, "status": "DISCARD"}
{"backbone": "xlstm", "description": "xlstm: Exp4 num_layers=3", "config": {"seq_len": 10, "lr": 0.0005, "batch_size": 16, "epochs": 80, "weight_decay": 0.001, "patience": 15, "grad_clip": 1.0, "warmup_epochs": 5, "huber_delta": 1.0, "head_dropout": 0.1, "seed": 42, "num_layers": 3, "het_loss": false}, "composite": -0.9386, "test_pos_folds": 5, "val_pos_folds": 3, "val_loss": 4.2e-05, "elapsed_sec": 474.0, "timestamp": "2026-04-21T13:52:41", "sharpe": 0.2529, "psr": 0.6906, "equity": 1086.74, "sortino": 0.3566, "return_pct": 8.67, "max_dd": 9.8, "win_rate": 50.88, "profit_factor": 1.048, "ic": -0.0056, "hit": 50.67, "aleatoric_mean": 1.4e-05, "epistemic_mean": 2.8e-05, "confidence_mean": 1.0, "precision": 0.5025, "recall": 0.6154, "f1": 0.5533, "f2": 0.5889, "mcc": 0.0203, "accuracy": 0.5087, "per_window": [{"fold": "fold_1", "regime": "Pre-crisis upturn + GFC onset", "sharpe": 0.3514, "sortino": 0.4483, "return_pct": 2.0, "equity": 1020.04, "max_dd": 7.03, "win_rate": 47.06, "profit_factor": 1.087, "ic": -0.1602, "hit": 46.6, "n": 103, "precision": 0.4861, "recall": 0.6604, "f1": 0.56, "f2": 0.6162, "mcc": -0.0868, "accuracy": 0.466, "tp": 35, "fp": 37, "tn": 13, "fn": 18, "aleatoric_mean": 1.9e-05, "epistemic_mean": 3.7e-05, "confidence_mean": 0.9999, "aleatoric_std": 1.2e-05, "epistemic_std": 2.4e-05}, {"fold": "fold_2", "regime": "Post-crash recovery", "sharpe": 0.0151, "sortino": 0.0268, "return_pct": -0.2, "equity": 998.02, "max_dd": 6.68, "win_rate": 47.66, "profit_factor": 1.002, "ic": -0.1024, "hit": 47.66, "n": 107, "precision": 0.451, "recall": 0.451, "f1": 0.451, "f2": 0.451, "mcc": -0.049, "accuracy": 0.4766, "tp": 23, "fp": 28, "tn": 28, "fn": 28, "aleatoric_mean": 1.5e-05, "epistemic_mean": 3e-05, "confidence_mean": 1.0, "aleatoric_std": 8e-06, "epistemic_std": 1.5e-05}, {"fold": "fold_3", "regime": "Eurozone debt plateau", "sharpe": -0.3704, "sortino": -0.607, "return_pct": -1.45, "equity": 985.46, "max_dd": 5.72, "win_rate": 52.88, "profit_factor": 0.944, "ic": 0.009, "hit": 51.89, "n": 106, "precision": 0.5541, "recall": 0.7193, "f1": 0.626, "f2": 0.6788, "mcc": 0.0498, "accuracy": 0.5377, "tp": 41, "fp": 33, "tn": 16, "fn": 16, "aleatoric_mean": 1.5e-05, "epistemic_mean": 3.1e-05, "confidence_mean": 1.0, "aleatoric_std": 6e-06, "epistemic_std": 1.3e-05}, {"fold": "fold_4", "regime": "Strong USD downturn", "sharpe": 0.5504, "sortino": 0.8066, "return_pct": 3.9, "equity": 1039.0, "max_dd": 5.75, "win_rate": 52.1, "profit_factor": 1.097, "ic": 0.0093, "hit": 51.79, "n": 168, "precision": 0.5217, "recall": 0.6977, "f1": 0.597, "f2": 0.6536, "mcc": 0.029, "accuracy": 0.5179, "tp": 60, "fp": 55, "tn": 27, "fn": 26, "aleatoric_mean": 1.2e-05, "epistemic_mean": 2.3e-05, "confidence_mean": 1.0, "aleatoric_std": 5e-06, "epistemic_std": 9e-06}, {"fold": "fold_5", "regime": "Low-vol plateau", "sharpe": 0.5069, "sortino": 0.7238, "return_pct": 1.62, "equity": 1016.15, "max_dd": 3.05, "win_rate": 54.94, "profit_factor": 1.088, "ic": 0.1339, "hit": 54.94, "n": 162, "precision": 0.5143, "recall": 0.7105, "f1": 0.5967, "f2": 0.6601, "mcc": 0.1228, "accuracy": 0.5494, "tp": 54, "fp": 51, "tn": 35, "fn": 22, "aleatoric_mean": 1e-05, "epistemic_mean": 2e-05, "confidence_mean": 1.0, "aleatoric_std": 4e-06, "epistemic_std": 7e-06}, {"fold": "fold_6", "regime": "EUR crisis downturn", "sharpe": 1.3147, "sortino": 2.4039, "return_pct": 8.27, "equity": 1082.74, "max_dd": 4.99, "win_rate": 52.12, "profit_factor": 1.237, "ic": 0.1302, "hit": 52.12, "n": 165, "precision": 0.49, "recall": 0.6364, "f1": 0.5537, "f2": 0.6005, "mcc": 0.058, "accuracy": 0.5212, "tp": 49, "fp": 51, "tn": 37, "fn": 28, "aleatoric_mean": 1.4e-05, "epistemic_mean": 2.8e-05, "confidence_mean": 1.0, "aleatoric_std": 6e-06, "epistemic_std": 1.1e-05}, {"fold": "fold_7", "regime": "Recent mixed/upturn", "sharpe": -0.8574, "sortino": -1.2668, "return_pct": -5.24, "equity": 947.61, "max_dd": 9.8, "win_rate": 47.53, "profit_factor": 0.865, "ic": -0.0789, "hit": 47.53, "n": 162, "precision": 0.4722, "recall": 0.4198, "f1": 0.4444, "f2": 0.4293, "mcc": -0.0497, "accuracy": 0.4753, "tp": 34, "fp": 38, "tn": 43, "fn": 47, "aleatoric_mean": 1.6e-05, "epistemic_mean": 3.2e-05, "confidence_mean": 1.0, "aleatoric_std": 7e-06, "epistemic_std": 1.4e-05}], "val_sharpe": -0.3386, "val_psr": 0.2778, "val_equity": 914.25, "val_sortino": -0.5213, "val_return_pct": -8.57, "val_max_dd": 20.91, "val_win_rate": 49.02, "val_profit_factor": 0.944, "val_ic": -0.039, "val_hit": 48.7, "val_aleatoric_mean": 1.2e-05, "val_epistemic_mean": 2.3e-05, "val_confidence_mean": 1.0, "val_precision": 0.4743, "val_recall": 0.6822, "val_f1": 0.5596, "val_f2": 0.6272, "val_mcc": -0.0029, "val_accuracy": 0.4896, "val_per_window": [{"fold": "fold_1", "regime": "Pre-crisis upturn + GFC onset", "sharpe": 1.0833, "sortino": 1.6528, "return_pct": 2.69, "equity": 1026.91, "max_dd": 2.96, "win_rate": 50.0, "profit_factor": 1.197, "ic": -0.0454, "hit": 49.54, "n": 109, "precision": 0.5, "recall": 0.7273, "f1": 0.5926, "f2": 0.6667, "mcc": -0.0152, "accuracy": 0.4954, "tp": 40, "fp": 40, "tn": 14, "fn": 15, "aleatoric_mean": 1.1e-05, "epistemic_mean": 2.1e-05, "confidence_mean": 1.0, "aleatoric_std": 5e-06, "epistemic_std": 1e-05}, {"fold": "fold_2", "regime": "Post-crash recovery", "sharpe": 0.8792, "sortino": 1.6747, "return_pct": 4.07, "equity": 1040.69, "max_dd": 4.25, "win_rate": 47.22, "profit_factor": 1.149, "ic": -0.0936, "hit": 47.22, "n": 108, "precision": 0.5536, "recall": 0.4921, "f1": 0.521, "f2": 0.5032, "mcc": -0.0626, "accuracy": 0.4722, "tp": 31, "fp": 25, "tn": 20, "fn": 32, "aleatoric_mean": 1.6e-05, "epistemic_mean": 3.2e-05, "confidence_mean": 1.0, "aleatoric_std": 6e-06, "epistemic_std": 1.3e-05}, {"fold": "fold_3", "regime": "Eurozone debt plateau", "sharpe": -1.3651, "sortino": -2.0762, "return_pct": -5.53, "equity": 944.71, "max_dd": 8.4, "win_rate": 46.79, "profit_factor": 0.801, "ic": -0.0567, "hit": 45.95, "n": 111, "precision": 0.4091, "recall": 0.5745, "f1": 0.4779, "f2": 0.5315, "mcc": -0.0351, "accuracy": 0.4685, "tp": 27, "fp": 39, "tn": 25, "fn": 20, "aleatoric_mean": 1e-05, "epistemic_mean": 2.1e-05, "confidence_mean": 1.0, "aleatoric_std": 5e-06, "epistemic_std": 9e-06}, {"fold": "fold_4", "regime": "Strong USD downturn", "sharpe": -2.3849, "sortino": -3.3886, "return_pct": -8.0, "equity": 920.02, "max_dd": 9.42, "win_rate": 45.87, "profit_factor": 0.674, "ic": -0.0243, "hit": 45.45, "n": 110, "precision": 0.4318, "recall": 0.8085, "f1": 0.563, "f2": 0.6884, "mcc": 0.0184, "accuracy": 0.4636, "tp": 38, "fp": 50, "tn": 13, "fn": 9, "aleatoric_mean": 1.3e-05, "epistemic_mean": 2.5e-05, "confidence_mean": 1.0, "aleatoric_std": 5e-06, "epistemic_std": 1.1e-05}, {"fold": "fold_5", "regime": "Low-vol plateau", "sharpe": -1.5144, "sortino": -2.5422, "return_pct": -5.03, "equity": 949.73, "max_dd": 5.48, "win_rate": 41.07, "profit_factor": 0.777, "ic": -0.019, "hit": 41.07, "n": 112, "precision": 0.4253, "recall": 0.6981, "f1": 0.5286, "f2": 0.6187, "mcc": -0.1791, "accuracy": 0.4107, "tp": 37, "fp": 50, "tn": 9, "fn": 16, "aleatoric_mean": 1e-05, "epistemic_mean": 1.9e-05, "confidence_mean": 1.0, "aleatoric_std": 4e-06, "epistemic_std": 8e-06}, {"fold": "fold_6", "regime": "EUR crisis downturn", "sharpe": -0.328, "sortino": -0.4786, "return_pct": -0.81, "equity": 991.91, "max_dd": 2.74, "win_rate": 52.34, "profit_factor": 0.946, "ic": -0.0514, "hit": 51.85, "n": 108, "precision": 0.4691, "recall": 0.8085, "f1": 0.5938, "f2": 0.7063, "mcc": 0.1186, "accuracy": 0.5185, "tp": 38, "fp": 43, "tn": 18, "fn": 9, "aleatoric_mean": 9e-06, "epistemic_mean": 1.9e-05, "confidence_mean": 1.0, "aleatoric_std": 3e-06, "epistemic_std": 5e-06}, {"fold": "fold_7", "regime": "Recent mixed/upturn", "sharpe": 1.8678, "sortino": 3.3248, "return_pct": 4.48, "equity": 1044.84, "max_dd": 1.9, "win_rate": 60.0, "profit_factor": 1.35, "ic": 0.0756, "hit": 60.0, "n": 110, "precision": 0.5672, "recall": 0.717, "f1": 0.6333, "f2": 0.681, "mcc": 0.2132, "accuracy": 0.6, "tp": 38, "fp": 29, "tn": 28, "fn": 15, "aleatoric_mean": 1.3e-05, "epistemic_mean": 2.6e-05, "confidence_mean": 1.0, "aleatoric_std": 5e-06, "epistemic_std": 1e-05}], "train_sharpe": 1.8668, "train_psr": 1.0, "train_equity": 9034.33, "train_sortino": 3.2596, "train_return_pct": 803.43, "train_max_dd": 10.08, "train_win_rate": 54.62, "train_profit_factor": 1.508, "train_ic": 0.1513, "train_hit": 54.4, "train_precision": 0.5481, "train_recall": 0.6664, "train_f1": 0.6015, "train_f2": 0.6388, "train_mcc": 0.0878, "train_accuracy": 0.546, "train_per_window": [{"fold": "all_train", "regime": "Training data", "sharpe": 1.8668, "sortino": 3.2596, "return_pct": 803.43, "equity": 9034.33, "max_dd": 10.08, "win_rate": 54.62, "profit_factor": 1.508, "ic": 0.1513, "hit": 54.4, "n": 2478, "precision": 0.5481, "recall": 0.6664, "f1": 0.6015, "f2": 0.6388, "mcc": 0.0878, "accuracy": 0.546, "tp": 849, "fp": 700, "tn": 504, "fn": 425}], "experiment_num": 262, "status": "DISCARD"}
