{"backbone": "mlp", "description": "mlp: Exp33 seq=20 monthly context (Bao2017) seed=0", "config": {"seq_len": 20, "lr": 0.0005, "batch_size": 32, "epochs": 50, "weight_decay": 1e-05, "patience": 10, "grad_clip": 1.0, "warmup_epochs": 0, "huber_delta": 0.5, "head_dropout": 0.15, "seed": 0, "het_loss": false}, "composite": 2.4851, "test_pos_folds": 6, "val_pos_folds": 7, "val_loss": 4.6e-05, "elapsed_sec": 44.7, "timestamp": "2026-04-14T20:28:38", "sharpe": 2.5851, "psr": 1.0, "equity": 2681.96, "sortino": 5.0038, "return_pct": 168.2, "max_dd": 11.29, "win_rate": 56.62, "profit_factor": 1.622, "ic": 0.2432, "hit": 56.37, "aleatoric_mean": 6.5e-05, "epistemic_mean": 0.000129, "confidence_mean": 0.9998, "per_window": [{"fold": "fold_1", "regime": "Pre-crisis upturn + GFC onset", "sharpe": 3.4093, "sortino": 11.0118, "return_pct": 26.37, "equity": 1263.66, "max_dd": 5.8, "win_rate": 56.52, "profit_factor": 2.335, "ic": 0.1382, "hit": 55.91, "n": 93, "aleatoric_mean": 0.000121, "epistemic_mean": 0.000243, "confidence_mean": 0.9996, "aleatoric_std": 0.000118, "epistemic_std": 0.000236}, {"fold": "fold_2", "regime": "Post-crash recovery", "sharpe": -1.4672, "sortino": -2.4274, "return_pct": -6.53, "equity": 934.72, "max_dd": 11.11, "win_rate": 46.39, "profit_factor": 0.795, "ic": 0.0182, "hit": 46.39, "n": 97, "aleatoric_mean": 4e-05, "epistemic_mean": 8e-05, "confidence_mean": 0.9999, "aleatoric_std": 2.6e-05, "epistemic_std": 5.1e-05}, {"fold": "fold_3", "regime": "Eurozone debt plateau", "sharpe": 3.254, "sortino": 6.0999, "return_pct": 10.9, "equity": 1109.05, "max_dd": 3.44, "win_rate": 60.64, "profit_factor": 1.667, "ic": 0.3129, "hit": 59.38, "n": 96, "aleatoric_mean": 9.1e-05, "epistemic_mean": 0.000183, "confidence_mean": 0.9997, "aleatoric_std": 5.7e-05, "epistemic_std": 0.000115}, {"fold": "fold_4", "regime": "Strong USD downturn", "sharpe": 4.0776, "sortino": 7.4747, "return_pct": 33.49, "equity": 1334.93, "max_dd": 3.54, "win_rate": 60.51, "profit_factor": 1.998, "ic": 0.3266, "hit": 60.13, "n": 158, "aleatoric_mean": 0.000102, "epistemic_mean": 0.000204, "confidence_mean": 0.9997, "aleatoric_std": 8.1e-05, "epistemic_std": 0.000162}, {"fold": "fold_5", "regime": "Low-vol plateau", "sharpe": 3.3727, "sortino": 5.0348, "return_pct": 10.57, "equity": 1105.74, "max_dd": 1.76, "win_rate": 59.87, "profit_factor": 1.754, "ic": 0.367, "hit": 59.87, "n": 152, "aleatoric_mean": 2.7e-05, "epistemic_mean": 5.4e-05, "confidence_mean": 0.9999, "aleatoric_std": 1.8e-05, "epistemic_std": 3.6e-05}, {"fold": "fold_6", "regime": "EUR crisis downturn", "sharpe": 3.3006, "sortino": 6.3413, "return_pct": 21.08, "equity": 1210.8, "max_dd": 3.57, "win_rate": 56.13, "profit_factor": 1.706, "ic": 0.3443, "hit": 56.13, "n": 155, "aleatoric_mean": 6.5e-05, "epistemic_mean": 0.00013, "confidence_mean": 0.9998, "aleatoric_std": 5.2e-05, "epistemic_std": 0.000104}, {"fold": "fold_7", "regime": "Recent mixed/upturn", "sharpe": 2.5016, "sortino": 4.6667, "return_pct": 14.55, "equity": 1145.53, "max_dd": 3.77, "win_rate": 53.95, "profit_factor": 1.524, "ic": 0.3228, "hit": 53.95, "n": 152, "aleatoric_mean": 2.7e-05, "epistemic_mean": 5.5e-05, "confidence_mean": 0.9999, "aleatoric_std": 1.7e-05, "epistemic_std": 3.4e-05}], "val_sharpe": 4.1597, "val_psr": 1.0, "val_equity": 2372.54, "val_sortino": 6.8337, "val_return_pct": 137.25, "val_max_dd": 5.75, "val_win_rate": 60.32, "val_profit_factor": 2.026, "val_ic": 0.313, "val_hit": 59.89, "val_aleatoric_mean": 3e-05, "val_epistemic_mean": 5.9e-05, "val_confidence_mean": 0.9999, "val_per_window": [{"fold": "fold_1", "regime": "Pre-crisis upturn + GFC onset", "sharpe": 1.193, "sortino": 2.0356, "return_pct": 2.75, "equity": 1027.53, "max_dd": 3.58, "win_rate": 51.02, "profit_factor": 1.219, "ic": 0.0246, "hit": 50.51, "n": 99, "aleatoric_mean": 3.5e-05, "epistemic_mean": 7e-05, "confidence_mean": 0.9999, "aleatoric_std": 4.6e-05, "epistemic_std": 9.3e-05}, {"fold": "fold_2", "regime": "Post-crash recovery", "sharpe": 0.9858, "sortino": 1.6214, "return_pct": 4.0, "equity": 1040.02, "max_dd": 5.75, "win_rate": 52.04, "profit_factor": 1.17, "ic": -0.0623, "hit": 52.04, "n": 98, "aleatoric_mean": 4.6e-05, "epistemic_mean": 9.2e-05, "confidence_mean": 0.9999, "aleatoric_std": 4.1e-05, "epistemic_std": 8.1e-05}, {"fold": "fold_3", "regime": "Eurozone debt plateau", "sharpe": 4.7492, "sortino": 7.3292, "return_pct": 18.65, "equity": 1186.54, "max_dd": 4.34, "win_rate": 59.6, "profit_factor": 2.172, "ic": 0.4681, "hit": 58.42, "n": 101, "aleatoric_mean": 3.6e-05, "epistemic_mean": 7.2e-05, "confidence_mean": 0.9999, "aleatoric_std": 2.1e-05, "epistemic_std": 4.2e-05}, {"fold": "fold_4", "regime": "Strong USD downturn", "sharpe": 8.7488, "sortino": 23.6618, "return_pct": 28.4, "equity": 1284.04, "max_dd": 0.77, "win_rate": 69.7, "profit_factor": 4.35, "ic": 0.6334, "hit": 69.0, "n": 100, "aleatoric_mean": 3e-05, "epistemic_mean": 5.9e-05, "confidence_mean": 0.9999, "aleatoric_std": 2.2e-05, "epistemic_std": 4.4e-05}, {"fold": "fold_5", "regime": "Low-vol plateau", "sharpe": 5.8945, "sortino": 14.0161, "return_pct": 18.46, "equity": 1184.57, "max_dd": 1.54, "win_rate": 62.75, "profit_factor": 2.722, "ic": 0.4421, "hit": 62.75, "n": 102, "aleatoric_mean": 2.7e-05, "epistemic_mean": 5.4e-05, "confidence_mean": 0.9999, "aleatoric_std": 2e-05, "epistemic_std": 4e-05}, {"fold": "fold_6", "regime": "EUR crisis downturn", "sharpe": 7.1475, "sortino": 14.9191, "return_pct": 14.53, "equity": 1145.28, "max_dd": 1.77, "win_rate": 64.95, "profit_factor": 3.4, "ic": 0.5208, "hit": 64.29, "n": 98, "aleatoric_mean": 1.3e-05, "epistemic_mean": 2.7e-05, "confidence_mean": 1.0, "aleatoric_std": 5e-06, "epistemic_std": 1e-05}, {"fold": "fold_7", "regime": "Recent mixed/upturn", "sharpe": 3.3705, "sortino": 6.928, "return_pct": 7.41, "equity": 1074.1, "max_dd": 1.78, "win_rate": 62.0, "profit_factor": 1.72, "ic": 0.238, "hit": 62.0, "n": 100, "aleatoric_mean": 2e-05, "epistemic_mean": 3.9e-05, "confidence_mean": 0.9999, "aleatoric_std": 1.8e-05, "epistemic_std": 3.5e-05}], "train_sharpe": 5.2854, "train_psr": 1.0, "train_equity": 268847.16, "train_sortino": 14.8235, "train_return_pct": 26784.72, "train_max_dd": 4.44, "train_win_rate": 65.99, "train_profit_factor": 3.506, "train_ic": 0.5293, "train_hit": 65.69, "train_per_window": [{"fold": "all_train", "regime": "Training data", "sharpe": 5.2854, "sortino": 14.8235, "return_pct": 26784.72, "equity": 268847.16, "max_dd": 4.44, "win_rate": 65.99, "profit_factor": 3.506, "ic": 0.5293, "hit": 65.69, "n": 2221}], "experiment_num": 89, "status": "DISCARD"}
{"backbone": "mlp", "description": "mlp: Exp34 ep=100 pat=15 longer cosine (Loshchilov2016) seed=0", "config": {"seq_len": 10, "lr": 0.0005, "batch_size": 32, "epochs": 100, "weight_decay": 1e-05, "patience": 15, "grad_clip": 1.0, "warmup_epochs": 0, "huber_delta": 0.5, "head_dropout": 0.15, "seed": 0, "het_loss": false}, "composite": 5.169, "test_pos_folds": 7, "val_pos_folds": 7, "val_loss": 4.1e-05, "elapsed_sec": 16.4, "timestamp": "2026-04-14T20:43:08", "sharpe": 5.169, "psr": 1.0, "equity": 7652.01, "sortino": 9.0552, "return_pct": 665.2, "max_dd": 7.36, "win_rate": 66.25, "profit_factor": 2.663, "ic": 0.4404, "hit": 65.98, "aleatoric_mean": 3e-05, "epistemic_mean": 5.9e-05, "confidence_mean": 0.9999, "per_window": [{"fold": "fold_1", "regime": "Pre-crisis upturn + GFC onset", "sharpe": 2.1992, "sortino": 6.0567, "return_pct": 17.47, "equity": 1174.67, "max_dd": 7.36, "win_rate": 55.88, "profit_factor": 1.692, "ic": 0.168, "hit": 55.34, "n": 103, "aleatoric_mean": 5.6e-05, "epistemic_mean": 0.000111, "confidence_mean": 0.9998, "aleatoric_std": 6.2e-05, "epistemic_std": 0.000123}, {"fold": "fold_2", "regime": "Post-crash recovery", "sharpe": 0.0412, "sortino": 0.0651, "return_pct": -0.07, "equity": 999.26, "max_dd": 4.93, "win_rate": 54.21, "profit_factor": 1.006, "ic": 0.0717, "hit": 54.21, "n": 107, "aleatoric_mean": 2.3e-05, "epistemic_mean": 4.5e-05, "confidence_mean": 0.9999, "aleatoric_std": 1.5e-05, "epistemic_std": 3e-05}, {"fold": "fold_3", "regime": "Eurozone debt plateau", "sharpe": 6.4845, "sortino": 10.2556, "return_pct": 23.57, "equity": 1235.66, "max_dd": 3.13, "win_rate": 72.12, "profit_factor": 2.782, "ic": 0.5489, "hit": 70.75, "n": 106, "aleatoric_mean": 3.3e-05, "epistemic_mean": 6.5e-05, "confidence_mean": 0.9999, "aleatoric_std": 2e-05, "epistemic_std": 4e-05}, {"fold": "fold_4", "regime": "Strong USD downturn", "sharpe": 8.7078, "sortino": 16.685, "return_pct": 80.32, "equity": 1803.22, "max_dd": 2.43, "win_rate": 74.25, "profit_factor": 4.574, "ic": 0.6083, "hit": 73.81, "n": 168, "aleatoric_mean": 4.3e-05, "epistemic_mean": 8.5e-05, "confidence_mean": 0.9999, "aleatoric_std": 2.9e-05, "epistemic_std": 5.9e-05}, {"fold": "fold_5", "regime": "Low-vol plateau", "sharpe": 6.9281, "sortino": 10.1424, "return_pct": 23.47, "equity": 1234.66, "max_dd": 1.43, "win_rate": 67.28, "profit_factor": 3.238, "ic": 0.5716, "hit": 67.28, "n": 162, "aleatoric_mean": 1.5e-05, "epistemic_mean": 3.1e-05, "confidence_mean": 1.0, "aleatoric_std": 8e-06, "epistemic_std": 1.7e-05}, {"fold": "fold_6", "regime": "EUR crisis downturn", "sharpe": 9.2902, "sortino": 16.8265, "return_pct": 65.2, "equity": 1652.01, "max_dd": 2.81, "win_rate": 70.3, "profit_factor": 4.678, "ic": 0.5723, "hit": 70.3, "n": 165, "aleatoric_mean": 2.8e-05, "epistemic_mean": 5.6e-05, "confidence_mean": 0.9999, "aleatoric_std": 1.8e-05, "epistemic_std": 3.5e-05}, {"fold": "fold_7", "regime": "Recent mixed/upturn", "sharpe": 6.6026, "sortino": 11.6093, "return_pct": 43.44, "equity": 1434.41, "max_dd": 2.2, "win_rate": 63.58, "profit_factor": 3.123, "ic": 0.582, "hit": 63.58, "n": 162, "aleatoric_mean": 1.8e-05, "epistemic_mean": 3.7e-05, "confidence_mean": 0.9999, "aleatoric_std": 1.1e-05, "epistemic_std": 2.1e-05}], "val_sharpe": 5.3835, "val_psr": 1.0, "val_equity": 3325.62, "val_sortino": 8.2232, "val_return_pct": 232.56, "val_max_dd": 6.51, "val_win_rate": 65.79, "val_profit_factor": 2.513, "val_ic": 0.4384, "val_hit": 65.36, "val_aleatoric_mean": 1.8e-05, "val_epistemic_mean": 3.5e-05, "val_confidence_mean": 0.9999, "val_per_window": [{"fold": "fold_1", "regime": "Pre-crisis upturn + GFC onset", "sharpe": 1.2509, "sortino": 1.9644, "return_pct": 3.12, "equity": 1031.23, "max_dd": 3.74, "win_rate": 52.78, "profit_factor": 1.231, "ic": 0.0284, "hit": 52.29, "n": 109, "aleatoric_mean": 1.7e-05, "epistemic_mean": 3.3e-05, "confidence_mean": 1.0, "aleatoric_std": 1.9e-05, "epistemic_std": 3.8e-05}, {"fold": "fold_2", "regime": "Post-crash recovery", "sharpe": 0.2566, "sortino": 0.4077, "return_pct": 0.98, "equity": 1009.75, "max_dd": 6.51, "win_rate": 51.85, "profit_factor": 1.041, "ic": 0.0116, "hit": 51.85, "n": 108, "aleatoric_mean": 3.2e-05, "epistemic_mean": 6.3e-05, "confidence_mean": 0.9999, "aleatoric_std": 2.3e-05, "epistemic_std": 4.6e-05}, {"fold": "fold_3", "regime": "Eurozone debt plateau", "sharpe": 9.1792, "sortino": 17.7812, "return_pct": 37.66, "equity": 1376.58, "max_dd": 1.16, "win_rate": 77.06, "profit_factor": 4.627, "ic": 0.6393, "hit": 75.68, "n": 111, "aleatoric_mean": 2.2e-05, "epistemic_mean": 4.4e-05, "confidence_mean": 0.9999, "aleatoric_std": 1.4e-05, "epistemic_std": 2.8e-05}, {"fold": "fold_4", "regime": "Strong USD downturn", "sharpe": 9.1717, "sortino": 20.4941, "return_pct": 31.61, "equity": 1316.08, "max_dd": 0.93, "win_rate": 74.31, "profit_factor": 4.825, "ic": 0.5986, "hit": 73.64, "n": 110, "aleatoric_mean": 1.7e-05, "epistemic_mean": 3.4e-05, "confidence_mean": 0.9999, "aleatoric_std": 1.2e-05, "epistemic_std": 2.4e-05}, {"fold": "fold_5", "regime": "Low-vol plateau", "sharpe": 9.0749, "sortino": 20.4558, "return_pct": 29.92, "equity": 1299.21, "max_dd": 0.91, "win_rate": 69.64, "profit_factor": 4.788, "ic": 0.6302, "hit": 69.64, "n": 112, "aleatoric_mean": 1.6e-05, "epistemic_mean": 3.2e-05, "confidence_mean": 1.0, "aleatoric_std": 1.1e-05, "epistemic_std": 2.2e-05}, {"fold": "fold_6", "regime": "EUR crisis downturn", "sharpe": 7.0236, "sortino": 13.2269, "return_pct": 15.78, "equity": 1157.78, "max_dd": 1.0, "win_rate": 69.16, "profit_factor": 3.351, "ic": 0.7047, "hit": 68.52, "n": 108, "aleatoric_mean": 1e-05, "epistemic_mean": 2e-05, "confidence_mean": 1.0, "aleatoric_std": 4e-06, "epistemic_std": 8e-06}, {"fold": "fold_7", "regime": "Recent mixed/upturn", "sharpe": 7.3093, "sortino": 16.8449, "return_pct": 17.2, "equity": 1171.97, "max_dd": 0.89, "win_rate": 65.45, "profit_factor": 3.287, "ic": 0.5705, "hit": 65.45, "n": 110, "aleatoric_mean": 1e-05, "epistemic_mean": 2.1e-05, "confidence_mean": 1.0, "aleatoric_std": 6e-06, "epistemic_std": 1.2e-05}], "train_sharpe": 6.5087, "train_psr": 1.0, "train_equity": 1506080.75, "train_sortino": 17.6319, "train_return_pct": 150508.08, "train_max_dd": 5.55, "train_win_rate": 71.64, "train_profit_factor": 4.845, "train_ic": 0.6305, "train_hit": 71.35, "train_per_window": [{"fold": "all_train", "regime": "Training data", "sharpe": 6.5087, "sortino": 17.6319, "return_pct": 150508.08, "equity": 1506080.75, "max_dd": 5.55, "win_rate": 71.64, "profit_factor": 4.845, "ic": 0.6305, "hit": 71.35, "n": 2478}], "experiment_num": 90, "status": "DISCARD"}
{"backbone": "mlp", "description": "mlp: Exp35 bs=16 gradient noise reg (Smith2018) seed=0", "config": {"seq_len": 10, "lr": 0.0005, "batch_size": 16, "epochs": 50, "weight_decay": 1e-05, "patience": 10, "grad_clip": 1.0, "warmup_epochs": 0, "huber_delta": 0.5, "head_dropout": 0.15, "seed": 0, "het_loss": false}, "composite": 5.3995, "test_pos_folds": 7, "val_pos_folds": 5, "val_loss": 3.8e-05, "elapsed_sec": 18.9, "timestamp": "2026-04-14T21:32:46", "sharpe": 6.3617, "psr": 1.0, "equity": 11582.22, "sortino": 12.5317, "return_pct": 1058.22, "max_dd": 6.51, "win_rate": 68.32, "profit_factor": 3.4, "ic": 0.5027, "hit": 68.04, "aleatoric_mean": 1.2e-05, "epistemic_mean": 2.4e-05, "confidence_mean": 1.0, "per_window": [{"fold": "fold_1", "regime": "Pre-crisis upturn + GFC onset", "sharpe": 2.2152, "sortino": 6.3638, "return_pct": 17.61, "equity": 1176.08, "max_dd": 4.33, "win_rate": 50.98, "profit_factor": 1.699, "ic": 0.0956, "hit": 50.49, "n": 103, "aleatoric_mean": 2.1e-05, "epistemic_mean": 4.3e-05, "confidence_mean": 0.9999, "aleatoric_std": 2.4e-05, "epistemic_std": 4.8e-05}, {"fold": "fold_2", "regime": "Post-crash recovery", "sharpe": 1.4317, "sortino": 2.9985, "return_pct": 6.8, "equity": 1067.96, "max_dd": 5.94, "win_rate": 51.4, "profit_factor": 1.251, "ic": 0.0541, "hit": 51.4, "n": 107, "aleatoric_mean": 1e-05, "epistemic_mean": 2e-05, "confidence_mean": 1.0, "aleatoric_std": 7e-06, "epistemic_std": 1.3e-05}, {"fold": "fold_3", "regime": "Eurozone debt plateau", "sharpe": 10.7574, "sortino": 23.8781, "return_pct": 36.98, "equity": 1369.76, "max_dd": 1.76, "win_rate": 75.0, "profit_factor": 5.643, "ic": 0.628, "hit": 73.58, "n": 106, "aleatoric_mean": 1.3e-05, "epistemic_mean": 2.6e-05, "confidence_mean": 1.0, "aleatoric_std": 8e-06, "epistemic_std": 1.5e-05}, {"fold": "fold_4", "regime": "Strong USD downturn", "sharpe": 10.7478, "sortino": 22.6677, "return_pct": 98.98, "equity": 1989.8, "max_dd": 2.3, "win_rate": 80.24, "profit_factor": 6.919, "ic": 0.678, "hit": 79.76, "n": 168, "aleatoric_mean": 1.8e-05, "epistemic_mean": 3.5e-05, "confidence_mean": 0.9999, "aleatoric_std": 1.4e-05, "epistemic_std": 2.8e-05}, {"fold": "fold_5", "regime": "Low-vol plateau", "sharpe": 8.3055, "sortino": 17.6987, "return_pct": 27.69, "equity": 1276.9, "max_dd": 1.0, "win_rate": 66.67, "profit_factor": 4.155, "ic": 0.6453, "hit": 66.67, "n": 162, "aleatoric_mean": 6e-06, "epistemic_mean": 1.3e-05, "confidence_mean": 1.0, "aleatoric_std": 3e-06, "epistemic_std": 7e-06}, {"fold": "fold_6", "regime": "EUR crisis downturn", "sharpe": 13.7807, "sortino": 50.292, "return_pct": 92.02, "equity": 1920.21, "max_dd": 0.63, "win_rate": 80.0, "profit_factor": 11.559, "ic": 0.7331, "hit": 80.0, "n": 165, "aleatoric_mean": 1.1e-05, "epistemic_mean": 2.2e-05, "confidence_mean": 1.0, "aleatoric_std": 8e-06, "epistemic_std": 1.6e-05}, {"fold": "fold_7", "regime": "Recent mixed/upturn", "sharpe": 5.7983, "sortino": 9.7094, "return_pct": 37.99, "equity": 1379.88, "max_dd": 2.49, "win_rate": 63.58, "profit_factor": 2.704, "ic": 0.6866, "hit": 63.58, "n": 162, "aleatoric_mean": 8e-06, "epistemic_mean": 1.5e-05, "confidence_mean": 1.0, "aleatoric_std": 4e-06, "epistemic_std": 9e-06}], "val_sharpe": 5.5995, "val_psr": 1.0, "val_equity": 3472.76, "val_sortino": 8.3963, "val_return_pct": 247.28, "val_max_dd": 11.94, "val_win_rate": 65.79, "val_profit_factor": 2.611, "val_ic": 0.4422, "val_hit": 65.36, "val_aleatoric_mean": 7e-06, "val_epistemic_mean": 1.4e-05, "val_confidence_mean": 1.0, "val_per_window": [{"fold": "fold_1", "regime": "Pre-crisis upturn + GFC onset", "sharpe": -0.015, "sortino": -0.0245, "return_pct": -0.11, "equity": 998.89, "max_dd": 2.69, "win_rate": 47.22, "profit_factor": 0.998, "ic": -0.0779, "hit": 46.79, "n": 109, "aleatoric_mean": 7e-06, "epistemic_mean": 1.4e-05, "confidence_mean": 1.0, "aleatoric_std": 8e-06, "epistemic_std": 1.6e-05}, {"fold": "fold_2", "regime": "Post-crash recovery", "sharpe": -1.6272, "sortino": -2.5615, "return_pct": -7.81, "equity": 921.86, "max_dd": 11.94, "win_rate": 45.37, "profit_factor": 0.773, "ic": -0.0175, "hit": 45.37, "n": 108, "aleatoric_mean": 1.2e-05, "epistemic_mean": 2.4e-05, "confidence_mean": 1.0, "aleatoric_std": 9e-06, "epistemic_std": 1.7e-05}, {"fold": "fold_3", "regime": "Eurozone debt plateau", "sharpe": 11.3823, "sortino": 27.4525, "return_pct": 45.11, "equity": 1451.13, "max_dd": 0.7, "win_rate": 79.82, "profit_factor": 7.01, "ic": 0.7097, "hit": 78.38, "n": 111, "aleatoric_mean": 8e-06, "epistemic_mean": 1.7e-05, "confidence_mean": 1.0, "aleatoric_std": 5e-06, "epistemic_std": 1e-05}, {"fold": "fold_4", "regime": "Strong USD downturn", "sharpe": 11.6368, "sortino": 35.1207, "return_pct": 38.38, "equity": 1383.81, "max_dd": 0.77, "win_rate": 77.98, "profit_factor": 7.931, "ic": 0.7071, "hit": 77.27, "n": 110, "aleatoric_mean": 6e-06, "epistemic_mean": 1.3e-05, "confidence_mean": 1.0, "aleatoric_std": 6e-06, "epistemic_std": 1.2e-05}, {"fold": "fold_5", "regime": "Low-vol plateau", "sharpe": 10.4975, "sortino": 26.6143, "return_pct": 33.78, "equity": 1337.84, "max_dd": 0.54, "win_rate": 75.0, "profit_factor": 6.336, "ic": 0.7019, "hit": 75.0, "n": 112, "aleatoric_mean": 6e-06, "epistemic_mean": 1.2e-05, "confidence_mean": 1.0, "aleatoric_std": 5e-06, "epistemic_std": 9e-06}, {"fold": "fold_6", "regime": "EUR crisis downturn", "sharpe": 10.9494, "sortino": 31.3251, "return_pct": 22.85, "equity": 1228.54, "max_dd": 0.71, "win_rate": 72.9, "profit_factor": 7.271, "ic": 0.7847, "hit": 72.22, "n": 108, "aleatoric_mean": 4e-06, "epistemic_mean": 8e-06, "confidence_mean": 1.0, "aleatoric_std": 2e-06, "epistemic_std": 3e-06}, {"fold": "fold_7", "regime": "Recent mixed/upturn", "sharpe": 5.9648, "sortino": 13.8873, "return_pct": 14.26, "equity": 1142.65, "max_dd": 1.78, "win_rate": 61.82, "profit_factor": 2.627, "ic": 0.6062, "hit": 61.82, "n": 110, "aleatoric_mean": 5e-06, "epistemic_mean": 9e-06, "confidence_mean": 1.0, "aleatoric_std": 3e-06, "epistemic_std": 6e-06}], "train_sharpe": 7.7987, "train_psr": 1.0, "train_equity": 4998454.5, "train_sortino": 24.7009, "train_return_pct": 499745.45, "train_max_dd": 2.8, "train_win_rate": 76.34, "train_profit_factor": 7.496, "train_ic": 0.7119, "train_hit": 76.03, "train_per_window": [{"fold": "all_train", "regime": "Training data", "sharpe": 7.7987, "sortino": 24.7009, "return_pct": 499745.45, "equity": 4998454.5, "max_dd": 2.8, "win_rate": 76.34, "profit_factor": 7.496, "ic": 0.7119, "hit": 76.03, "n": 2478}], "experiment_num": 91, "status": "DISCARD"}
