{"backbone": "lstm", "description": "lstm: Exp28 hidden=256 larger capacity (Gu Kelly Xiu 2020 RFS)", "config": {"seq_len": 10, "lr": 0.001, "batch_size": 32, "epochs": 100, "weight_decay": 0.001, "patience": 15, "grad_clip": 1.0, "warmup_epochs": 0, "huber_delta": 1.0, "head_dropout": 0.25, "seed": 0, "hidden_size": 256, "het_loss": false}, "composite": 4.2735, "test_pos_folds": 7, "val_pos_folds": 5, "val_loss": 2.9e-05, "elapsed_sec": 36.4, "timestamp": "2026-04-19T19:35:59", "sharpe": 4.6721, "psr": 1.0, "equity": 6381.81, "sortino": 5.8639, "return_pct": 538.18, "max_dd": 8.42, "win_rate": 65.43, "profit_factor": 2.413, "ic": 0.459, "hit": 65.16, "aleatoric_mean": 2.1e-05, "epistemic_mean": 4.1e-05, "confidence_mean": 0.9999, "precision": 0.7757, "recall": 0.4241, "f1": 0.5484, "f2": 0.4664, "mcc": 0.3425, "accuracy": 0.6547, "per_window": [{"fold": "fold_1", "regime": "Pre-crisis upturn + GFC onset", "sharpe": 0.2271, "sortino": 0.2453, "return_pct": 1.02, "equity": 1010.24, "max_dd": 8.42, "win_rate": 54.9, "profit_factor": 1.055, "ic": 0.1594, "hit": 54.37, "n": 103, "precision": 0.6364, "recall": 0.2642, "f1": 0.3733, "f2": 0.2991, "mcc": 0.127, "accuracy": 0.5437, "tp": 14, "fp": 8, "tn": 42, "fn": 39, "aleatoric_mean": 2.5e-05, "epistemic_mean": 5e-05, "confidence_mean": 0.9999, "aleatoric_std": 1e-05, "epistemic_std": 2e-05}, {"fold": "fold_2", "regime": "Post-crash recovery", "sharpe": 1.1043, "sortino": 2.2777, "return_pct": 5.15, "equity": 1051.46, "max_dd": 3.97, "win_rate": 47.66, "profit_factor": 1.189, "ic": -0.0191, "hit": 47.66, "n": 107, "precision": 0.4242, "recall": 0.2745, "f1": 0.3333, "f2": 0.2954, "mcc": -0.0701, "accuracy": 0.4766, "tp": 14, "fp": 19, "tn": 37, "fn": 37, "aleatoric_mean": 2.7e-05, "epistemic_mean": 5.3e-05, "confidence_mean": 0.9999, "aleatoric_std": 1e-05, "epistemic_std": 2e-05}, {"fold": "fold_3", "regime": "Eurozone debt plateau", "sharpe": 8.4555, "sortino": 15.528, "return_pct": 30.14, "equity": 1301.39, "max_dd": 1.47, "win_rate": 66.35, "profit_factor": 3.828, "ic": 0.5561, "hit": 65.09, "n": 106, "precision": 0.775, "recall": 0.5439, "f1": 0.6392, "f2": 0.5784, "mcc": 0.3705, "accuracy": 0.6698, "tp": 31, "fp": 9, "tn": 40, "fn": 26, "aleatoric_mean": 2.1e-05, "epistemic_mean": 4.3e-05, "confidence_mean": 0.9999, "aleatoric_std": 7e-06, "epistemic_std": 1.5e-05}, {"fold": "fold_4", "regime": "Strong USD downturn", "sharpe": 8.1597, "sortino": 13.3276, "return_pct": 75.1, "equity": 1751.02, "max_dd": 4.07, "win_rate": 77.25, "profit_factor": 4.121, "ic": 0.63, "hit": 76.79, "n": 168, "precision": 0.8871, "recall": 0.6395, "f1": 0.7432, "f2": 0.6773, "mcc": 0.574, "accuracy": 0.7738, "tp": 55, "fp": 7, "tn": 75, "fn": 31, "aleatoric_mean": 1.8e-05, "epistemic_mean": 3.6e-05, "confidence_mean": 0.9999, "aleatoric_std": 6e-06, "epistemic_std": 1.2e-05}, {"fold": "fold_5", "regime": "Low-vol plateau", "sharpe": 4.3463, "sortino": 6.621, "return_pct": 14.9, "equity": 1148.97, "max_dd": 2.39, "win_rate": 62.96, "profit_factor": 2.071, "ic": 0.4063, "hit": 62.96, "n": 162, "precision": 0.8333, "recall": 0.2632, "f1": 0.4, "f2": 0.3049, "mcc": 0.3043, "accuracy": 0.6296, "tp": 20, "fp": 4, "tn": 82, "fn": 56, "aleatoric_mean": 1.6e-05, "epistemic_mean": 3.1e-05, "confidence_mean": 1.0, "aleatoric_std": 6e-06, "epistemic_std": 1.1e-05}, {"fold": "fold_6", "regime": "EUR crisis downturn", "sharpe": 8.3524, "sortino": 15.6778, "return_pct": 58.81, "equity": 1588.11, "max_dd": 1.6, "win_rate": 69.09, "profit_factor": 3.965, "ic": 0.7092, "hit": 69.09, "n": 165, "precision": 0.8824, "recall": 0.3896, "f1": 0.5405, "f2": 0.4386, "mcc": 0.4245, "accuracy": 0.6909, "tp": 30, "fp": 4, "tn": 84, "fn": 47, "aleatoric_mean": 2e-05, "epistemic_mean": 4.1e-05, "confidence_mean": 0.9999, "aleatoric_std": 8e-06, "epistemic_std": 1.7e-05}, {"fold": "fold_7", "regime": "Recent mixed/upturn", "sharpe": 6.7588, "sortino": 10.4269, "return_pct": 44.49, "equity": 1444.91, "max_dd": 3.75, "win_rate": 69.75, "profit_factor": 3.213, "ic": 0.5967, "hit": 69.75, "n": 162, "precision": 0.8333, "recall": 0.4938, "f1": 0.6202, "f2": 0.5376, "mcc": 0.4326, "accuracy": 0.6975, "tp": 40, "fp": 8, "tn": 73, "fn": 41, "aleatoric_mean": 2.2e-05, "epistemic_mean": 4.3e-05, "confidence_mean": 0.9999, "aleatoric_std": 8e-06, "epistemic_std": 1.5e-05}], "val_sharpe": 4.4735, "val_psr": 1.0, "val_equity": 2755.03, "val_sortino": 6.8528, "val_return_pct": 175.5, "val_max_dd": 15.98, "val_win_rate": 64.48, "val_profit_factor": 2.143, "val_ic": 0.4284, "val_hit": 64.06, "val_aleatoric_mean": 1.9e-05, "val_epistemic_mean": 3.8e-05, "val_confidence_mean": 0.9999, "val_precision": 0.7009, "val_recall": 0.4493, "val_f1": 0.5476, "val_f2": 0.4841, "val_mcc": 0.299, "val_accuracy": 0.6471, "val_per_window": [{"fold": "fold_1", "regime": "Pre-crisis upturn + GFC onset", "sharpe": -0.6056, "sortino": -0.9298, "return_pct": -1.59, "equity": 984.11, "max_dd": 4.12, "win_rate": 47.22, "profit_factor": 0.904, "ic": -0.0425, "hit": 46.79, "n": 109, "precision": 0.4783, "recall": 0.4, "f1": 0.4356, "f2": 0.4135, "mcc": -0.045, "accuracy": 0.4771, "tp": 22, "fp": 24, "tn": 30, "fn": 33, "aleatoric_mean": 1.9e-05, "epistemic_mean": 3.9e-05, "confidence_mean": 0.9999, "aleatoric_std": 8e-06, "epistemic_std": 1.6e-05}, {"fold": "fold_2", "regime": "Post-crash recovery", "sharpe": -1.7235, "sortino": -2.7935, "return_pct": -8.24, "equity": 917.64, "max_dd": 15.98, "win_rate": 43.52, "profit_factor": 0.762, "ic": -0.085, "hit": 43.52, "n": 108, "precision": 0.5278, "recall": 0.3016, "f1": 0.3838, "f2": 0.3299, "mcc": -0.0797, "accuracy": 0.4352, "tp": 19, "fp": 17, "tn": 28, "fn": 44, "aleatoric_mean": 2.7e-05, "epistemic_mean": 5.4e-05, "confidence_mean": 0.9999, "aleatoric_std": 1.1e-05, "epistemic_std": 2.2e-05}, {"fold": "fold_3", "regime": "Eurozone debt plateau", "sharpe": 8.549, "sortino": 19.9933, "return_pct": 35.34, "equity": 1353.42, "max_dd": 2.03, "win_rate": 73.39, "profit_factor": 4.135, "ic": 0.6346, "hit": 72.07, "n": 111, "precision": 0.75, "recall": 0.5745, "f1": 0.6506, "f2": 0.6027, "mcc": 0.4579, "accuracy": 0.7387, "tp": 27, "fp": 9, "tn": 55, "fn": 20, "aleatoric_mean": 1.7e-05, "epistemic_mean": 3.5e-05, "confidence_mean": 0.9999, "aleatoric_std": 6e-06, "epistemic_std": 1.2e-05}, {"fold": "fold_4", "regime": "Strong USD downturn", "sharpe": 9.1974, "sortino": 18.8693, "return_pct": 31.68, "equity": 1316.84, "max_dd": 0.95, "win_rate": 76.15, "profit_factor": 4.849, "ic": 0.6536, "hit": 75.45, "n": 110, "precision": 0.7692, "recall": 0.6383, "f1": 0.6977, "f2": 0.6608, "mcc": 0.5123, "accuracy": 0.7636, "tp": 30, "fp": 9, "tn": 54, "fn": 17, "aleatoric_mean": 1.8e-05, "epistemic_mean": 3.6e-05, "confidence_mean": 0.9999, "aleatoric_std": 6e-06, "epistemic_std": 1.3e-05}, {"fold": "fold_5", "regime": "Low-vol plateau", "sharpe": 8.1334, "sortino": 17.7504, "return_pct": 27.18, "equity": 1271.75, "max_dd": 1.43, "win_rate": 68.75, "profit_factor": 4.016, "ic": 0.5775, "hit": 68.75, "n": 112, "precision": 0.875, "recall": 0.3962, "f1": 0.5455, "f2": 0.4449, "mcc": 0.4203, "accuracy": 0.6875, "tp": 21, "fp": 3, "tn": 56, "fn": 32, "aleatoric_mean": 1.6e-05, "epistemic_mean": 3.2e-05, "confidence_mean": 1.0, "aleatoric_std": 5e-06, "epistemic_std": 1.1e-05}, {"fold": "fold_6", "regime": "EUR crisis downturn", "sharpe": 6.2421, "sortino": 11.7089, "return_pct": 14.16, "equity": 1141.61, "max_dd": 1.0, "win_rate": 68.22, "profit_factor": 2.911, "ic": 0.6513, "hit": 67.59, "n": 108, "precision": 1.0, "recall": 0.2766, "f1": 0.4333, "f2": 0.3234, "mcc": 0.4214, "accuracy": 0.6852, "tp": 13, "fp": 0, "tn": 61, "fn": 34, "aleatoric_mean": 1.7e-05, "epistemic_mean": 3.3e-05, "confidence_mean": 1.0, "aleatoric_std": 5e-06, "epistemic_std": 1e-05}, {"fold": "fold_7", "regime": "Recent mixed/upturn", "sharpe": 7.6475, "sortino": 12.4902, "return_pct": 17.9, "equity": 1179.03, "max_dd": 1.17, "win_rate": 73.64, "profit_factor": 3.48, "ic": 0.6648, "hit": 73.64, "n": 110, "precision": 0.8, "recall": 0.6038, "f1": 0.6882, "f2": 0.6349, "mcc": 0.4814, "accuracy": 0.7364, "tp": 32, "fp": 8, "tn": 49, "fn": 21, "aleatoric_mean": 1.9e-05, "epistemic_mean": 3.8e-05, "confidence_mean": 0.9999, "aleatoric_std": 7e-06, "epistemic_std": 1.3e-05}], "train_sharpe": 4.5031, "train_psr": 1.0, "train_equity": 189266.19, "train_sortino": 11.1672, "train_return_pct": 18826.62, "train_max_dd": 7.99, "train_win_rate": 63.37, "train_profit_factor": 2.797, "train_ic": 0.6085, "train_hit": 63.12, "train_precision": 0.8183, "train_recall": 0.3713, "train_f1": 0.5108, "train_f2": 0.4168, "train_mcc": 0.3357, "train_accuracy": 0.6344, "train_per_window": [{"fold": "all_train", "regime": "Training data", "sharpe": 4.5031, "sortino": 11.1672, "return_pct": 18826.62, "equity": 189266.19, "max_dd": 7.99, "win_rate": 63.37, "profit_factor": 2.797, "ic": 0.6085, "hit": 63.12, "n": 2478, "precision": 0.8183, "recall": 0.3713, "f1": 0.5108, "f2": 0.4168, "mcc": 0.3357, "accuracy": 0.6344, "tp": 473, "fp": 105, "tn": 1099, "fn": 801}], "experiment_num": 133, "status": "DISCARD"}
{"backbone": "lstm", "description": "lstm: Exp29 bs=16 smaller batch (Keskar 2017 flat minima)", "config": {"seq_len": 10, "lr": 0.001, "batch_size": 16, "epochs": 100, "weight_decay": 0.001, "patience": 15, "grad_clip": 1.0, "warmup_epochs": 0, "huber_delta": 1.0, "head_dropout": 0.25, "seed": 42, "het_loss": false}, "composite": 6.3701, "test_pos_folds": 7, "val_pos_folds": 5, "val_loss": 2.8e-05, "elapsed_sec": 53.6, "timestamp": "2026-04-19T19:38:10", "sharpe": 6.5701, "psr": 1.0, "equity": 12409.65, "sortino": 7.333, "return_pct": 1140.96, "max_dd": 7.54, "win_rate": 73.17, "profit_factor": 3.553, "ic": 0.56, "hit": 72.87, "aleatoric_mean": 6e-06, "epistemic_mean": 1.1e-05, "confidence_mean": 1.0, "precision": 0.7354, "recall": 0.7048, "f1": 0.7197, "f2": 0.7107, "mcc": 0.4574, "accuracy": 0.7287, "per_window": [{"fold": "fold_1", "regime": "Pre-crisis upturn + GFC onset", "sharpe": 0.9135, "sortino": 1.0158, "return_pct": 6.5, "equity": 1065.05, "max_dd": 7.54, "win_rate": 51.96, "profit_factor": 1.241, "ic": 0.1296, "hit": 51.46, "n": 103, "precision": 0.5405, "recall": 0.3774, "f1": 0.4444, "f2": 0.4016, "mcc": 0.0389, "accuracy": 0.5146, "tp": 20, "fp": 17, "tn": 33, "fn": 33, "aleatoric_mean": 7e-06, "epistemic_mean": 1.5e-05, "confidence_mean": 1.0, "aleatoric_std": 3e-06, "epistemic_std": 6e-06}, {"fold": "fold_2", "regime": "Post-crash recovery", "sharpe": 0.4024, "sortino": 0.7304, "return_pct": 1.67, "equity": 1016.74, "max_dd": 6.09, "win_rate": 52.34, "profit_factor": 1.065, "ic": 0.0791, "hit": 52.34, "n": 107, "precision": 0.5, "recall": 0.4902, "f1": 0.495, "f2": 0.4921, "mcc": 0.0438, "accuracy": 0.5234, "tp": 25, "fp": 25, "tn": 31, "fn": 26, "aleatoric_mean": 8e-06, "epistemic_mean": 1.5e-05, "confidence_mean": 1.0, "aleatoric_std": 5e-06, "epistemic_std": 9e-06}, {"fold": "fold_3", "regime": "Eurozone debt plateau", "sharpe": 9.7509, "sortino": 15.7593, "return_pct": 34.11, "equity": 1341.06, "max_dd": 2.22, "win_rate": 76.92, "profit_factor": 4.749, "ic": 0.5756, "hit": 75.47, "n": 106, "precision": 0.7313, "recall": 0.8596, "f1": 0.7903, "f2": 0.8305, "mcc": 0.509, "accuracy": 0.7547, "tp": 49, "fp": 18, "tn": 31, "fn": 8, "aleatoric_mean": 6e-06, "epistemic_mean": 1.2e-05, "confidence_mean": 1.0, "aleatoric_std": 3e-06, "epistemic_std": 6e-06}, {"fold": "fold_4", "regime": "Strong USD downturn", "sharpe": 11.378, "sortino": 17.832, "return_pct": 104.44, "equity": 2044.42, "max_dd": 1.81, "win_rate": 84.43, "profit_factor": 7.955, "ic": 0.7705, "hit": 83.93, "n": 168, "precision": 0.8831, "recall": 0.7907, "f1": 0.8344, "f2": 0.8076, "mcc": 0.6831, "accuracy": 0.8393, "tp": 68, "fp": 9, "tn": 73, "fn": 18, "aleatoric_mean": 5e-06, "epistemic_mean": 9e-06, "confidence_mean": 1.0, "aleatoric_std": 2e-06, "epistemic_std": 4e-06}, {"fold": "fold_5", "regime": "Low-vol plateau", "sharpe": 13.5237, "sortino": 51.3119, "return_pct": 40.82, "equity": 1408.16, "max_dd": 0.24, "win_rate": 79.63, "profit_factor": 12.907, "ic": 0.8017, "hit": 79.63, "n": 162, "precision": 0.7945, "recall": 0.7632, "f1": 0.7785, "f2": 0.7692, "mcc": 0.5905, "accuracy": 0.7963, "tp": 58, "fp": 15, "tn": 71, "fn": 18, "aleatoric_mean": 4e-06, "epistemic_mean": 7e-06, "confidence_mean": 1.0, "aleatoric_std": 1e-06, "epistemic_std": 2e-06}, {"fold": "fold_6", "regime": "EUR crisis downturn", "sharpe": 12.8279, "sortino": 34.143, "return_pct": 86.9, "equity": 1869.0, "max_dd": 1.31, "win_rate": 77.58, "profit_factor": 9.314, "ic": 0.7608, "hit": 77.58, "n": 165, "precision": 0.7703, "recall": 0.7403, "f1": 0.755, "f2": 0.7461, "mcc": 0.5488, "accuracy": 0.7758, "tp": 57, "fp": 17, "tn": 71, "fn": 20, "aleatoric_mean": 5e-06, "epistemic_mean": 1e-05, "confidence_mean": 1.0, "aleatoric_std": 2e-06, "epistemic_std": 4e-06}, {"fold": "fold_7", "regime": "Recent mixed/upturn", "sharpe": 8.962, "sortino": 14.7354, "return_pct": 58.82, "equity": 1588.18, "max_dd": 1.64, "win_rate": 75.31, "profit_factor": 4.868, "ic": 0.6657, "hit": 75.31, "n": 162, "precision": 0.747, "recall": 0.7654, "f1": 0.7561, "f2": 0.7617, "mcc": 0.5063, "accuracy": 0.7531, "tp": 62, "fp": 21, "tn": 60, "fn": 19, "aleatoric_mean": 6e-06, "epistemic_mean": 1.3e-05, "confidence_mean": 1.0, "aleatoric_std": 2e-06, "epistemic_std": 4e-06}], "val_sharpe": 7.0945, "val_psr": 1.0, "val_equity": 4614.14, "val_sortino": 9.7604, "val_return_pct": 361.41, "val_max_dd": 7.34, "val_win_rate": 71.3, "val_profit_factor": 3.416, "val_ic": 0.5637, "val_hit": 70.83, "val_aleatoric_mean": 5e-06, "val_epistemic_mean": 9e-06, "val_confidence_mean": 1.0, "val_precision": 0.6962, "val_recall": 0.7096, "val_f1": 0.7028, "val_f2": 0.7069, "val_mcc": 0.4289, "val_accuracy": 0.7148, "val_per_window": [{"fold": "fold_1", "regime": "Pre-crisis upturn + GFC onset", "sharpe": -0.102, "sortino": -0.158, "return_pct": -0.33, "equity": 996.69, "max_dd": 6.68, "win_rate": 46.3, "profit_factor": 0.983, "ic": 0.0287, "hit": 45.87, "n": 109, "precision": 0.4762, "recall": 0.5455, "f1": 0.5085, "f2": 0.53, "mcc": -0.0665, "accuracy": 0.4679, "tp": 30, "fp": 33, "tn": 21, "fn": 25, "aleatoric_mean": 5e-06, "epistemic_mean": 9e-06, "confidence_mean": 1.0, "aleatoric_std": 2e-06, "epistemic_std": 4e-06}, {"fold": "fold_2", "regime": "Post-crash recovery", "sharpe": -0.0006, "sortino": -0.0009, "return_pct": -0.28, "equity": 997.22, "max_dd": 7.34, "win_rate": 49.07, "profit_factor": 1.0, "ic": 0.0089, "hit": 49.07, "n": 108, "precision": 0.5714, "recall": 0.5079, "f1": 0.5378, "f2": 0.5195, "mcc": -0.0251, "accuracy": 0.4907, "tp": 32, "fp": 24, "tn": 21, "fn": 31, "aleatoric_mean": 7e-06, "epistemic_mean": 1.5e-05, "confidence_mean": 1.0, "aleatoric_std": 3e-06, "epistemic_std": 6e-06}, {"fold": "fold_3", "regime": "Eurozone debt plateau", "sharpe": 13.807, "sortino": 28.1214, "return_pct": 52.13, "equity": 1521.32, "max_dd": 0.7, "win_rate": 88.07, "profit_factor": 11.906, "ic": 0.802, "hit": 86.49, "n": 111, "precision": 0.8542, "recall": 0.8723, "f1": 0.8632, "f2": 0.8686, "mcc": 0.7609, "accuracy": 0.8829, "tp": 41, "fp": 7, "tn": 57, "fn": 6, "aleatoric_mean": 4e-06, "epistemic_mean": 8e-06, "confidence_mean": 1.0, "aleatoric_std": 2e-06, "epistemic_std": 3e-06}, {"fold": "fold_4", "regime": "Strong USD downturn", "sharpe": 13.5837, "sortino": 34.2603, "return_pct": 42.96, "equity": 1429.56, "max_dd": 0.82, "win_rate": 82.57, "profit_factor": 12.645, "ic": 0.8084, "hit": 81.82, "n": 110, "precision": 0.7917, "recall": 0.8085, "f1": 0.8, "f2": 0.8051, "mcc": 0.6481, "accuracy": 0.8273, "tp": 38, "fp": 10, "tn": 53, "fn": 9, "aleatoric_mean": 4e-06, "epistemic_mean": 8e-06, "confidence_mean": 1.0, "aleatoric_std": 2e-06, "epistemic_std": 3e-06}, {"fold": "fold_5", "regime": "Low-vol plateau", "sharpe": 10.8261, "sortino": 28.1787, "return_pct": 34.63, "equity": 1346.26, "max_dd": 0.7, "win_rate": 75.89, "profit_factor": 6.782, "ic": 0.791, "hit": 75.89, "n": 112, "precision": 0.825, "recall": 0.6226, "f1": 0.7097, "f2": 0.6548, "mcc": 0.5252, "accuracy": 0.7589, "tp": 33, "fp": 7, "tn": 52, "fn": 20, "aleatoric_mean": 3e-06, "epistemic_mean": 7e-06, "confidence_mean": 1.0, "aleatoric_std": 1e-06, "epistemic_std": 3e-06}, {"fold": "fold_6", "regime": "EUR crisis downturn", "sharpe": 14.2479, "sortino": 57.1651, "return_pct": 27.41, "equity": 1274.11, "max_dd": 0.25, "win_rate": 84.11, "profit_factor": 17.51, "ic": 0.8853, "hit": 83.33, "n": 108, "precision": 0.8261, "recall": 0.8085, "f1": 0.8172, "f2": 0.812, "mcc": 0.6791, "accuracy": 0.8426, "tp": 38, "fp": 8, "tn": 53, "fn": 9, "aleatoric_mean": 3e-06, "epistemic_mean": 7e-06, "confidence_mean": 1.0, "aleatoric_std": 1e-06, "epistemic_std": 2e-06}, {"fold": "fold_7", "regime": "Recent mixed/upturn", "sharpe": 11.1786, "sortino": 25.1001, "return_pct": 24.45, "equity": 1244.46, "max_dd": 0.69, "win_rate": 72.73, "profit_factor": 6.53, "ic": 0.7107, "hit": 72.73, "n": 110, "precision": 0.662, "recall": 0.8868, "f1": 0.7581, "f2": 0.8304, "mcc": 0.4865, "accuracy": 0.7273, "tp": 47, "fp": 24, "tn": 33, "fn": 6, "aleatoric_mean": 5e-06, "epistemic_mean": 1e-05, "confidence_mean": 1.0, "aleatoric_std": 2e-06, "epistemic_std": 4e-06}], "train_sharpe": 7.1336, "train_psr": 1.0, "train_equity": 2729962.25, "train_sortino": 18.7296, "train_return_pct": 272896.22, "train_max_dd": 6.87, "train_win_rate": 75.65, "train_profit_factor": 5.914, "train_ic": 0.6961, "train_hit": 75.34, "train_precision": 0.7928, "train_recall": 0.7119, "train_f1": 0.7502, "train_f2": 0.7268, "train_mcc": 0.5164, "train_accuracy": 0.7563, "train_per_window": [{"fold": "all_train", "regime": "Training data", "sharpe": 7.1336, "sortino": 18.7296, "return_pct": 272896.22, "equity": 2729962.25, "max_dd": 6.87, "win_rate": 75.65, "profit_factor": 5.914, "ic": 0.6961, "hit": 75.34, "n": 2478, "precision": 0.7928, "recall": 0.7119, "f1": 0.7502, "f2": 0.7268, "mcc": 0.5164, "accuracy": 0.7563, "tp": 907, "fp": 237, "tn": 967, "fn": 367}], "experiment_num": 134, "status": "KEEP"}
