{"backbone": "xgboost", "description": "xgboost: Exp7 depth=4 lr=0.1 faster", "config": {"seq_len": 10, "lr": 0.0003, "batch_size": 32, "epochs": 20, "weight_decay": 1e-05, "patience": 5, "grad_clip": 1.0, "warmup_epochs": 0, "huber_delta": 1.0, "head_dropout": 0.1, "seed": 42, "max_depth": 4, "gbm_lr": 0.1, "het_loss": false}, "composite": 7.2644, "test_pos_folds": 6, "val_pos_folds": 6, "val_loss": 0.0, "elapsed_sec": 44.1, "timestamp": "2026-04-20T22:13:07", "sharpe": 7.4644, "psr": 1.0, "equity": 16525.03, "sortino": 7.4775, "return_pct": 1552.5, "max_dd": 7.54, "win_rate": 78.22, "profit_factor": 4.319, "ic": 0.66, "hit": 77.9, "precision": 0.8004, "recall": 0.7422, "f1": 0.7702, "f2": 0.7532, "mcc": 0.5632, "accuracy": 0.7811, "per_window": [{"fold": "fold_1", "regime": "Pre-crisis upturn + GFC onset", "sharpe": 0.4237, "sortino": 0.4635, "return_pct": 2.57, "equity": 1025.67, "max_dd": 7.54, "win_rate": 53.92, "profit_factor": 1.105, "ic": 0.2903, "hit": 53.4, "n": 103, "precision": 0.6667, "recall": 0.2264, "f1": 0.338, "f2": 0.2609, "mcc": 0.14, "accuracy": 0.5437, "tp": 12, "fp": 6, "tn": 44, "fn": 41}, {"fold": "fold_2", "regime": "Post-crash recovery", "sharpe": -0.1133, "sortino": -0.2059, "return_pct": -0.81, "equity": 991.88, "max_dd": 5.83, "win_rate": 50.47, "profit_factor": 0.982, "ic": -0.0782, "hit": 50.47, "n": 107, "precision": 0.4815, "recall": 0.5098, "f1": 0.4952, "f2": 0.5039, "mcc": 0.0098, "accuracy": 0.5047, "tp": 26, "fp": 28, "tn": 28, "fn": 25}, {"fold": "fold_3", "regime": "Eurozone debt plateau", "sharpe": 14.4774, "sortino": 23.4409, "return_pct": 45.97, "equity": 1459.71, "max_dd": 1.32, "win_rate": 85.58, "profit_factor": 11.465, "ic": 0.7443, "hit": 83.96, "n": 106, "precision": 0.8448, "recall": 0.8596, "f1": 0.8522, "f2": 0.8566, "mcc": 0.6771, "accuracy": 0.8396, "tp": 49, "fp": 9, "tn": 40, "fn": 8}, {"fold": "fold_4", "regime": "Strong USD downturn", "sharpe": 13.6516, "sortino": 19.0365, "return_pct": 122.76, "equity": 2227.58, "max_dd": 1.81, "win_rate": 89.22, "profit_factor": 14.298, "ic": 0.8757, "hit": 88.69, "n": 168, "precision": 0.9359, "recall": 0.8488, "f1": 0.8902, "f2": 0.8649, "mcc": 0.7897, "accuracy": 0.8929, "tp": 73, "fp": 5, "tn": 77, "fn": 13}, {"fold": "fold_5", "regime": "Low-vol plateau", "sharpe": 15.7773, "sortino": 80.8343, "return_pct": 45.08, "equity": 1450.85, "max_dd": 0.23, "win_rate": 86.42, "profit_factor": 27.859, "ic": 0.8823, "hit": 86.42, "n": 162, "precision": 0.8649, "recall": 0.8421, "f1": 0.8533, "f2": 0.8466, "mcc": 0.7272, "accuracy": 0.8642, "tp": 64, "fp": 10, "tn": 76, "fn": 12}, {"fold": "fold_6", "regime": "EUR crisis downturn", "sharpe": 14.1211, "sortino": 47.9479, "return_pct": 93.77, "equity": 1937.74, "max_dd": 0.51, "win_rate": 81.21, "profit_factor": 12.551, "ic": 0.8664, "hit": 81.21, "n": 165, "precision": 0.8026, "recall": 0.7922, "f1": 0.7974, "f2": 0.7943, "mcc": 0.6223, "accuracy": 0.8121, "tp": 61, "fp": 15, "tn": 73, "fn": 16}, {"fold": "fold_7", "regime": "Recent mixed/upturn", "sharpe": 12.2274, "sortino": 17.8589, "return_pct": 77.69, "equity": 1776.87, "max_dd": 1.64, "win_rate": 84.57, "profit_factor": 10.002, "ic": 0.8275, "hit": 84.57, "n": 162, "precision": 0.8182, "recall": 0.8889, "f1": 0.8521, "f2": 0.8738, "mcc": 0.694, "accuracy": 0.8457, "tp": 72, "fp": 16, "tn": 65, "fn": 9}], "val_sharpe": 7.892, "val_psr": 1.0, "val_equity": 5307.97, "val_sortino": 10.7793, "val_return_pct": 430.8, "val_max_dd": 9.26, "val_win_rate": 73.79, "val_profit_factor": 3.962, "val_ic": 0.6402, "val_hit": 73.31, "val_precision": 0.704, "val_recall": 0.7753, "val_f1": 0.7379, "val_f2": 0.7599, "val_mcc": 0.48, "val_accuracy": 0.7383, "val_per_window": [{"fold": "fold_1", "regime": "Pre-crisis upturn + GFC onset", "sharpe": 2.2822, "sortino": 3.8757, "return_pct": 5.79, "equity": 1057.92, "max_dd": 3.46, "win_rate": 52.78, "profit_factor": 1.461, "ic": 0.0383, "hit": 52.29, "n": 109, "precision": 0.5181, "recall": 0.7818, "f1": 0.6232, "f2": 0.7096, "mcc": 0.0482, "accuracy": 0.5229, "tp": 43, "fp": 40, "tn": 14, "fn": 12}, {"fold": "fold_2", "regime": "Post-crash recovery", "sharpe": -0.9217, "sortino": -1.5694, "return_pct": -4.63, "equity": 953.68, "max_dd": 9.26, "win_rate": 47.22, "profit_factor": 0.865, "ic": -0.0962, "hit": 47.22, "n": 108, "precision": 0.5652, "recall": 0.4127, "f1": 0.4771, "f2": 0.4362, "mcc": -0.0317, "accuracy": 0.4722, "tp": 26, "fp": 20, "tn": 25, "fn": 37}, {"fold": "fold_3", "regime": "Eurozone debt plateau", "sharpe": 14.2655, "sortino": 39.823, "return_pct": 53.32, "equity": 1533.23, "max_dd": 0.64, "win_rate": 83.49, "profit_factor": 13.354, "ic": 0.8292, "hit": 81.98, "n": 111, "precision": 0.7544, "recall": 0.9149, "f1": 0.8269, "f2": 0.8776, "mcc": 0.6882, "accuracy": 0.8378, "tp": 43, "fp": 14, "tn": 50, "fn": 4}, {"fold": "fold_4", "regime": "Strong USD downturn", "sharpe": 15.3342, "sortino": 55.3417, "return_pct": 46.52, "equity": 1465.18, "max_dd": 0.64, "win_rate": 85.32, "profit_factor": 21.722, "ic": 0.9063, "hit": 84.55, "n": 110, "precision": 0.8444, "recall": 0.8085, "f1": 0.8261, "f2": 0.8155, "mcc": 0.7017, "accuracy": 0.8545, "tp": 38, "fp": 7, "tn": 56, "fn": 9}, {"fold": "fold_5", "regime": "Low-vol plateau", "sharpe": 14.4912, "sortino": 73.0966, "return_pct": 42.76, "equity": 1427.65, "max_dd": 0.31, "win_rate": 81.25, "profit_factor": 17.029, "ic": 0.8993, "hit": 81.25, "n": 112, "precision": 0.7759, "recall": 0.8491, "f1": 0.8108, "f2": 0.8333, "mcc": 0.6282, "accuracy": 0.8125, "tp": 45, "fp": 13, "tn": 46, "fn": 8}, {"fold": "fold_6", "regime": "EUR crisis downturn", "sharpe": 14.7732, "sortino": 60.9636, "return_pct": 28.03, "equity": 1280.29, "max_dd": 0.26, "win_rate": 85.05, "profit_factor": 21.153, "ic": 0.902, "hit": 84.26, "n": 108, "precision": 0.8298, "recall": 0.8298, "f1": 0.8298, "f2": 0.8298, "mcc": 0.6986, "accuracy": 0.8519, "tp": 39, "fp": 8, "tn": 53, "fn": 8}, {"fold": "fold_7", "regime": "Recent mixed/upturn", "sharpe": 13.6618, "sortino": 56.1088, "return_pct": 28.13, "equity": 1281.29, "max_dd": 0.32, "win_rate": 80.91, "profit_factor": 10.907, "ic": 0.8328, "hit": 80.91, "n": 110, "precision": 0.7424, "recall": 0.9245, "f1": 0.8235, "f2": 0.8813, "mcc": 0.6388, "accuracy": 0.8091, "tp": 49, "fp": 17, "tn": 40, "fn": 4}], "train_sharpe": 11.1838, "train_psr": 1.0, "train_equity": 69359696.0, "train_sortino": 448.7559, "train_return_pct": 6935869.6, "train_max_dd": 0.08, "train_win_rate": 98.42, "train_profit_factor": 1515.159, "train_ic": 0.9984, "train_hit": 98.02, "train_precision": 0.9812, "train_recall": 0.9827, "train_f1": 0.982, "train_f2": 0.9824, "train_mcc": 0.9628, "train_accuracy": 0.9814, "train_per_window": [{"fold": "all_train", "regime": "Training data", "sharpe": 11.1838, "sortino": 448.7559, "return_pct": 6935869.6, "equity": 69359696.0, "max_dd": 0.08, "win_rate": 98.42, "profit_factor": 1515.159, "ic": 0.9984, "hit": 98.02, "n": 2478, "precision": 0.9812, "recall": 0.9827, "f1": 0.982, "f2": 0.9824, "mcc": 0.9628, "accuracy": 0.9814, "tp": 1252, "fp": 24, "tn": 1180, "fn": 22}], "experiment_num": 184, "status": "DISCARD"}
{"backbone": "xgboost", "description": "xgboost: Exp8 depth=4 lr=0.005 very slow", "config": {"seq_len": 10, "lr": 0.0003, "batch_size": 32, "epochs": 20, "weight_decay": 1e-05, "patience": 5, "grad_clip": 1.0, "warmup_epochs": 0, "huber_delta": 1.0, "head_dropout": 0.1, "seed": 42, "max_depth": 4, "gbm_lr": 0.005, "het_loss": false}, "composite": 7.6765, "test_pos_folds": 7, "val_pos_folds": 6, "val_loss": 0.0, "elapsed_sec": 79.8, "timestamp": "2026-04-20T22:14:38", "sharpe": 7.8002, "psr": 1.0, "equity": 18316.28, "sortino": 7.5818, "return_pct": 1731.63, "max_dd": 7.54, "win_rate": 78.95, "profit_factor": 4.66, "ic": 0.6839, "hit": 78.62, "precision": 0.8161, "recall": 0.738, "f1": 0.7751, "f2": 0.7524, "mcc": 0.5787, "accuracy": 0.7883, "per_window": [{"fold": "fold_1", "regime": "Pre-crisis upturn + GFC onset", "sharpe": 0.159, "sortino": 0.175, "return_pct": 0.49, "equity": 1004.95, "max_dd": 7.54, "win_rate": 52.94, "profit_factor": 1.038, "ic": 0.1896, "hit": 52.43, "n": 103, "precision": 0.6316, "recall": 0.2264, "f1": 0.3333, "f2": 0.2597, "mcc": 0.1114, "accuracy": 0.534, "tp": 12, "fp": 7, "tn": 43, "fn": 41}, {"fold": "fold_2", "regime": "Post-crash recovery", "sharpe": 1.6144, "sortino": 2.778, "return_pct": 7.72, "equity": 1077.23, "max_dd": 4.94, "win_rate": 55.14, "profit_factor": 1.288, "ic": 0.0173, "hit": 55.14, "n": 107, "precision": 0.5319, "recall": 0.4902, "f1": 0.5102, "f2": 0.498, "mcc": 0.098, "accuracy": 0.5514, "tp": 25, "fp": 22, "tn": 34, "fn": 26}, {"fold": "fold_3", "regime": "Eurozone debt plateau", "sharpe": 13.7355, "sortino": 23.3382, "return_pct": 44.37, "equity": 1443.74, "max_dd": 1.32, "win_rate": 85.58, "profit_factor": 9.824, "ic": 0.7486, "hit": 83.96, "n": 106, "precision": 0.8704, "recall": 0.8246, "f1": 0.8468, "f2": 0.8333, "mcc": 0.6799, "accuracy": 0.8396, "tp": 47, "fp": 7, "tn": 42, "fn": 10}, {"fold": "fold_4", "regime": "Strong USD downturn", "sharpe": 14.976, "sortino": 16.7945, "return_pct": 132.37, "equity": 2323.7, "max_dd": 1.81, "win_rate": 92.81, "profit_factor": 22.489, "ic": 0.8793, "hit": 92.26, "n": 168, "precision": 0.9405, "recall": 0.9186, "f1": 0.9294, "f2": 0.9229, "mcc": 0.8574, "accuracy": 0.9286, "tp": 79, "fp": 5, "tn": 77, "fn": 7}, {"fold": "fold_5", "regime": "Low-vol plateau", "sharpe": 15.1713, "sortino": 68.6856, "return_pct": 44.01, "equity": 1440.13, "max_dd": 0.23, "win_rate": 84.57, "profit_factor": 21.776, "ic": 0.91, "hit": 84.57, "n": 162, "precision": 0.8228, "recall": 0.8553, "f1": 0.8387, "f2": 0.8486, "mcc": 0.6914, "accuracy": 0.8457, "tp": 65, "fp": 14, "tn": 72, "fn": 11}, {"fold": "fold_6", "regime": "EUR crisis downturn", "sharpe": 14.2542, "sortino": 43.5521, "return_pct": 94.45, "equity": 1944.48, "max_dd": 0.87, "win_rate": 80.0, "profit_factor": 12.973, "ic": 0.8857, "hit": 80.0, "n": 165, "precision": 0.8056, "recall": 0.7532, "f1": 0.7785, "f2": 0.7632, "mcc": 0.5977, "accuracy": 0.8, "tp": 58, "fp": 14, "tn": 74, "fn": 19}, {"fold": "fold_7", "regime": "Recent mixed/upturn", "sharpe": 12.6918, "sortino": 16.7738, "return_pct": 80.1, "equity": 1800.99, "max_dd": 1.64, "win_rate": 85.8, "profit_factor": 11.293, "ic": 0.8277, "hit": 85.8, "n": 162, "precision": 0.8625, "recall": 0.8519, "f1": 0.8571, "f2": 0.854, "mcc": 0.7161, "accuracy": 0.858, "tp": 69, "fp": 11, "tn": 70, "fn": 12}], "val_sharpe": 7.7765, "val_psr": 1.0, "val_equity": 5203.99, "val_sortino": 9.5518, "val_return_pct": 420.4, "val_max_dd": 15.24, "val_win_rate": 75.62, "val_profit_factor": 3.877, "val_ic": 0.6853, "val_hit": 75.13, "val_precision": 0.7178, "val_recall": 0.8082, "val_f1": 0.7603, "val_f2": 0.7883, "val_mcc": 0.521, "val_accuracy": 0.7578, "val_per_window": [{"fold": "fold_1", "regime": "Pre-crisis upturn + GFC onset", "sharpe": 0.3322, "sortino": 0.5508, "return_pct": 0.77, "equity": 1007.68, "max_dd": 4.6, "win_rate": 47.22, "profit_factor": 1.057, "ic": -0.0717, "hit": 46.79, "n": 109, "precision": 0.4884, "recall": 0.7636, "f1": 0.5957, "f2": 0.6863, "mcc": -0.0627, "accuracy": 0.4771, "tp": 42, "fp": 44, "tn": 10, "fn": 13}, {"fold": "fold_2", "regime": "Post-crash recovery", "sharpe": -1.8011, "sortino": -2.8033, "return_pct": -8.58, "equity": 914.25, "max_dd": 15.24, "win_rate": 46.3, "profit_factor": 0.752, "ic": -0.0609, "hit": 46.3, "n": 108, "precision": 0.5397, "recall": 0.5397, "f1": 0.5397, "f2": 0.5397, "mcc": -0.1048, "accuracy": 0.463, "tp": 34, "fp": 29, "tn": 16, "fn": 29}, {"fold": "fold_3", "regime": "Eurozone debt plateau", "sharpe": 15.0867, "sortino": 31.2781, "return_pct": 55.35, "equity": 1553.53, "max_dd": 0.7, "win_rate": 86.24, "profit_factor": 16.706, "ic": 0.8547, "hit": 84.68, "n": 111, "precision": 0.7963, "recall": 0.9149, "f1": 0.8515, "f2": 0.8884, "mcc": 0.7345, "accuracy": 0.8649, "tp": 43, "fp": 11, "tn": 53, "fn": 4}, {"fold": "fold_4", "regime": "Strong USD downturn", "sharpe": 16.5475, "sortino": 51.5874, "return_pct": 48.71, "equity": 1487.06, "max_dd": 0.64, "win_rate": 90.83, "profit_factor": 36.912, "ic": 0.9371, "hit": 90.0, "n": 110, "precision": 0.9302, "recall": 0.8511, "f1": 0.8889, "f2": 0.8658, "mcc": 0.8145, "accuracy": 0.9091, "tp": 40, "fp": 3, "tn": 60, "fn": 7}, {"fold": "fold_5", "regime": "Low-vol plateau", "sharpe": 15.3622, "sortino": 73.795, "return_pct": 44.38, "equity": 1443.79, "max_dd": 0.25, "win_rate": 84.82, "profit_factor": 23.111, "ic": 0.9214, "hit": 84.82, "n": 112, "precision": 0.8333, "recall": 0.8491, "f1": 0.8411, "f2": 0.8459, "mcc": 0.696, "accuracy": 0.8482, "tp": 45, "fp": 9, "tn": 50, "fn": 8}, {"fold": "fold_6", "regime": "EUR crisis downturn", "sharpe": 15.9201, "sortino": 102.5078, "return_pct": 29.29, "equity": 1292.86, "max_dd": 0.15, "win_rate": 86.92, "profit_factor": 35.76, "ic": 0.9305, "hit": 86.11, "n": 108, "precision": 0.8113, "recall": 0.9149, "f1": 0.86, "f2": 0.8921, "mcc": 0.7448, "accuracy": 0.8704, "tp": 43, "fp": 10, "tn": 51, "fn": 4}, {"fold": "fold_7", "regime": "Recent mixed/upturn", "sharpe": 16.0201, "sortino": 58.2441, "return_pct": 30.99, "equity": 1309.92, "max_dd": 0.34, "win_rate": 86.36, "profit_factor": 20.286, "ic": 0.8895, "hit": 86.36, "n": 110, "precision": 0.8276, "recall": 0.9057, "f1": 0.8649, "f2": 0.8889, "mcc": 0.7308, "accuracy": 0.8636, "tp": 48, "fp": 10, "tn": 47, "fn": 5}], "train_sharpe": 9.1026, "train_psr": 1.0, "train_equity": 15027707.0, "train_sortino": 34.3453, "train_return_pct": 1502670.7, "train_max_dd": 2.45, "train_win_rate": 83.47, "train_profit_factor": 13.551, "train_ic": 0.8552, "train_hit": 83.13, "train_precision": 0.8279, "train_recall": 0.8532, "train_f1": 0.8404, "train_f2": 0.848, "train_mcc": 0.6664, "train_accuracy": 0.8333, "train_per_window": [{"fold": "all_train", "regime": "Training data", "sharpe": 9.1026, "sortino": 34.3453, "return_pct": 1502670.7, "equity": 15027707.0, "max_dd": 2.45, "win_rate": 83.47, "profit_factor": 13.551, "ic": 0.8552, "hit": 83.13, "n": 2478, "precision": 0.8279, "recall": 0.8532, "f1": 0.8404, "f2": 0.848, "mcc": 0.6664, "accuracy": 0.8333, "tp": 1087, "fp": 226, "tn": 978, "fn": 187}], "experiment_num": 185, "status": "DISCARD"}
{"backbone": "xgboost", "description": "xgboost: Exp9 subsample=0.5 more row sampling", "config": {"seq_len": 10, "lr": 0.0003, "batch_size": 32, "epochs": 20, "weight_decay": 1e-05, "patience": 5, "grad_clip": 1.0, "warmup_epochs": 0, "huber_delta": 1.0, "head_dropout": 0.1, "seed": 42, "max_depth": 4, "gbm_lr": 0.01, "subsample": 0.5, "het_loss": false}, "composite": 7.5322, "test_pos_folds": 7, "val_pos_folds": 6, "val_loss": 0.0, "elapsed_sec": 78.6, "timestamp": "2026-04-20T22:16:18", "sharpe": 7.6322, "psr": 1.0, "equity": 17402.88, "sortino": 7.497, "return_pct": 1640.29, "max_dd": 7.54, "win_rate": 78.43, "profit_factor": 4.485, "ic": 0.6702, "hit": 78.11, "precision": 0.8027, "recall": 0.7443, "f1": 0.7724, "f2": 0.7553, "mcc": 0.5674, "accuracy": 0.7831, "per_window": [{"fold": "fold_1", "regime": "Pre-crisis upturn + GFC onset", "sharpe": 0.3705, "sortino": 0.4039, "return_pct": 2.15, "equity": 1021.47, "max_dd": 7.54, "win_rate": 53.92, "profit_factor": 1.091, "ic": 0.2475, "hit": 53.4, "n": 103, "precision": 0.6364, "recall": 0.2642, "f1": 0.3733, "f2": 0.2991, "mcc": 0.127, "accuracy": 0.5437, "tp": 14, "fp": 8, "tn": 42, "fn": 39}, {"fold": "fold_2", "regime": "Post-crash recovery", "sharpe": 0.6355, "sortino": 1.0844, "return_pct": 2.82, "equity": 1028.16, "max_dd": 5.94, "win_rate": 52.34, "profit_factor": 1.105, "ic": -0.0087, "hit": 52.34, "n": 107, "precision": 0.5, "recall": 0.4706, "f1": 0.4848, "f2": 0.4762, "mcc": 0.0422, "accuracy": 0.5234, "tp": 24, "fp": 24, "tn": 32, "fn": 27}, {"fold": "fold_3", "regime": "Eurozone debt plateau", "sharpe": 12.9698, "sortino": 22.3167, "return_pct": 42.63, "equity": 1426.26, "max_dd": 1.32, "win_rate": 83.65, "profit_factor": 8.447, "ic": 0.7263, "hit": 82.08, "n": 106, "precision": 0.8393, "recall": 0.8246, "f1": 0.8319, "f2": 0.8275, "mcc": 0.6401, "accuracy": 0.8208, "tp": 47, "fp": 9, "tn": 40, "fn": 10}, {"fold": "fold_4", "regime": "Strong USD downturn", "sharpe": 14.713, "sortino": 17.3692, "return_pct": 130.52, "equity": 2305.24, "max_dd": 1.81, "win_rate": 92.22, "profit_factor": 20.333, "ic": 0.8754, "hit": 91.67, "n": 168, "precision": 0.9294, "recall": 0.9186, "f1": 0.924, "f2": 0.9207, "mcc": 0.8453, "accuracy": 0.9226, "tp": 79, "fp": 6, "tn": 76, "fn": 7}, {"fold": "fold_5", "regime": "Low-vol plateau", "sharpe": 15.7022, "sortino": 79.0586, "return_pct": 44.96, "equity": 1449.55, "max_dd": 0.23, "win_rate": 85.8, "profit_factor": 26.957, "ic": 0.9121, "hit": 85.8, "n": 162, "precision": 0.8354, "recall": 0.8684, "f1": 0.8516, "f2": 0.8616, "mcc": 0.7161, "accuracy": 0.858, "tp": 66, "fp": 13, "tn": 73, "fn": 10}, {"fold": "fold_6", "regime": "EUR crisis downturn", "sharpe": 14.109, "sortino": 43.5504, "return_pct": 93.71, "equity": 1937.12, "max_dd": 0.87, "win_rate": 79.39, "profit_factor": 12.514, "ic": 0.8765, "hit": 79.39, "n": 165, "precision": 0.8028, "recall": 0.7403, "f1": 0.7703, "f2": 0.752, "mcc": 0.5856, "accuracy": 0.7939, "tp": 57, "fp": 14, "tn": 74, "fn": 20}, {"fold": "fold_7", "regime": "Recent mixed/upturn", "sharpe": 12.5724, "sortino": 16.9362, "return_pct": 79.49, "equity": 1794.86, "max_dd": 1.64, "win_rate": 85.19, "profit_factor": 10.939, "ic": 0.8211, "hit": 85.19, "n": 162, "precision": 0.8353, "recall": 0.8765, "f1": 0.8554, "f2": 0.868, "mcc": 0.7046, "accuracy": 0.8519, "tp": 71, "fp": 14, "tn": 67, "fn": 10}], "val_sharpe": 7.6592, "val_psr": 1.0, "val_equity": 5099.62, "val_sortino": 9.8073, "val_return_pct": 409.96, "val_max_dd": 15.93, "val_win_rate": 74.44, "val_profit_factor": 3.793, "val_ic": 0.6627, "val_hit": 73.96, "val_precision": 0.7125, "val_recall": 0.7808, "val_f1": 0.7451, "val_f2": 0.7661, "val_mcc": 0.4953, "val_accuracy": 0.7461, "val_per_window": [{"fold": "fold_1", "regime": "Pre-crisis upturn + GFC onset", "sharpe": 1.6823, "sortino": 3.0335, "return_pct": 4.24, "equity": 1042.38, "max_dd": 3.22, "win_rate": 48.15, "profit_factor": 1.322, "ic": 0.047, "hit": 47.71, "n": 109, "precision": 0.4944, "recall": 0.8, "f1": 0.6111, "f2": 0.712, "mcc": -0.0431, "accuracy": 0.4862, "tp": 44, "fp": 45, "tn": 9, "fn": 11}, {"fold": "fold_2", "regime": "Post-crash recovery", "sharpe": -1.9178, "sortino": -3.0276, "return_pct": -9.08, "equity": 909.18, "max_dd": 15.93, "win_rate": 44.44, "profit_factor": 0.739, "ic": -0.1012, "hit": 44.44, "n": 108, "precision": 0.5263, "recall": 0.4762, "f1": 0.5, "f2": 0.4854, "mcc": -0.1223, "accuracy": 0.4444, "tp": 30, "fp": 27, "tn": 18, "fn": 33}, {"fold": "fold_3", "regime": "Eurozone debt plateau", "sharpe": 14.6491, "sortino": 41.835, "return_pct": 54.29, "equity": 1542.88, "max_dd": 0.62, "win_rate": 84.4, "profit_factor": 14.778, "ic": 0.8405, "hit": 82.88, "n": 111, "precision": 0.8, "recall": 0.8511, "f1": 0.8247, "f2": 0.8403, "mcc": 0.69, "accuracy": 0.8468, "tp": 40, "fp": 10, "tn": 54, "fn": 7}, {"fold": "fold_4", "regime": "Strong USD downturn", "sharpe": 14.1266, "sortino": 27.8898, "return_pct": 44.11, "equity": 1441.14, "max_dd": 0.66, "win_rate": 87.16, "profit_factor": 14.702, "ic": 0.8976, "hit": 86.36, "n": 110, "precision": 0.9024, "recall": 0.7872, "f1": 0.8409, "f2": 0.8079, "mcc": 0.7404, "accuracy": 0.8727, "tp": 37, "fp": 4, "tn": 59, "fn": 10}, {"fold": "fold_5", "regime": "Low-vol plateau", "sharpe": 15.498, "sortino": 72.0102, "return_pct": 44.62, "equity": 1446.21, "max_dd": 0.25, "win_rate": 85.71, "profit_factor": 24.384, "ic": 0.912, "hit": 85.71, "n": 112, "precision": 0.8491, "recall": 0.8491, "f1": 0.8491, "f2": 0.8491, "mcc": 0.7135, "accuracy": 0.8571, "tp": 45, "fp": 8, "tn": 51, "fn": 8}, {"fold": "fold_6", "regime": "EUR crisis downturn", "sharpe": 15.7595, "sortino": 102.738, "return_pct": 29.12, "equity": 1291.17, "max_dd": 0.15, "win_rate": 87.85, "profit_factor": 32.784, "ic": 0.9301, "hit": 87.04, "n": 108, "precision": 0.84, "recall": 0.8936, "f1": 0.866, "f2": 0.8824, "mcc": 0.7581, "accuracy": 0.8796, "tp": 42, "fp": 8, "tn": 53, "fn": 5}, {"fold": "fold_7", "regime": "Recent mixed/upturn", "sharpe": 14.8146, "sortino": 55.6352, "return_pct": 29.6, "equity": 1296.0, "max_dd": 0.34, "win_rate": 82.73, "profit_factor": 14.416, "ic": 0.8745, "hit": 82.73, "n": 110, "precision": 0.7833, "recall": 0.8868, "f1": 0.8319, "f2": 0.864, "mcc": 0.661, "accuracy": 0.8273, "tp": 47, "fp": 13, "tn": 44, "fn": 6}], "train_sharpe": 10.2708, "train_psr": 1.0, "train_equity": 36666936.0, "train_sortino": 61.1574, "train_return_pct": 3666593.6, "train_max_dd": 1.02, "train_win_rate": 88.7, "train_profit_factor": 33.451, "train_ic": 0.9155, "train_hit": 88.34, "train_precision": 0.8785, "train_recall": 0.9027, "train_f1": 0.8904, "train_f2": 0.8977, "train_mcc": 0.7715, "train_accuracy": 0.8858, "train_per_window": [{"fold": "all_train", "regime": "Training data", "sharpe": 10.2708, "sortino": 61.1574, "return_pct": 3666593.6, "equity": 36666936.0, "max_dd": 1.02, "win_rate": 88.7, "profit_factor": 33.451, "ic": 0.9155, "hit": 88.34, "n": 2478, "precision": 0.8785, "recall": 0.9027, "f1": 0.8904, "f2": 0.8977, "mcc": 0.7715, "accuracy": 0.8858, "tp": 1150, "fp": 159, "tn": 1045, "fn": 124}], "experiment_num": 186, "status": "DISCARD"}
