{"backbone": "lightgbm", "description": "lgbm: Exp16 seq=60 (ensemble matching)", "config": {"seq_len": 60, "lr": 0.0003, "batch_size": 32, "epochs": 20, "weight_decay": 1e-05, "patience": 5, "grad_clip": 1.0, "warmup_epochs": 0, "huber_delta": 1.0, "head_dropout": 0.1, "seed": 42, "max_depth": 4, "gbm_lr": 0.01, "het_loss": false}, "composite": 9.0501, "test_pos_folds": 5, "val_pos_folds": 7, "val_loss": 0.0, "elapsed_sec": 139.0, "timestamp": "2026-04-21T10:33:23", "sharpe": 9.2501, "psr": 1.0, "equity": 6396.55, "sortino": 12.7965, "return_pct": 539.65, "max_dd": 6.55, "win_rate": 78.03, "profit_factor": 5.075, "ic": 0.6783, "hit": 77.53, "precision": 0.7714, "recall": 0.7839, "f1": 0.7776, "f2": 0.7814, "mcc": 0.5539, "accuracy": 0.7769, "per_window": [{"fold": "fold_1", "regime": "Pre-crisis upturn + GFC onset", "sharpe": -0.3944, "sortino": -0.7356, "return_pct": -0.94, "equity": 990.64, "max_dd": 2.53, "win_rate": 46.15, "profit_factor": 0.941, "ic": -0.0986, "hit": 45.28, "n": 53, "precision": 0.4444, "recall": 0.4615, "f1": 0.4528, "f2": 0.458, "mcc": -0.094, "accuracy": 0.4528, "tp": 12, "fp": 15, "tn": 12, "fn": 14}, {"fold": "fold_2", "regime": "Post-crash recovery", "sharpe": -1.0132, "sortino": -1.5955, "return_pct": -3.02, "equity": 969.75, "max_dd": 6.55, "win_rate": 50.88, "profit_factor": 0.85, "ic": -0.0017, "hit": 50.88, "n": 57, "precision": 0.56, "recall": 0.4516, "f1": 0.5, "f2": 0.4698, "mcc": 0.0286, "accuracy": 0.5088, "tp": 14, "fp": 11, "tn": 15, "fn": 17}, {"fold": "fold_3", "regime": "Eurozone debt plateau", "sharpe": 15.1628, "sortino": 56.072, "return_pct": 21.39, "equity": 1213.89, "max_dd": 0.29, "win_rate": 81.48, "profit_factor": 14.83, "ic": 0.8164, "hit": 78.57, "n": 56, "precision": 0.8846, "recall": 0.7188, "f1": 0.7931, "f2": 0.7468, "mcc": 0.5892, "accuracy": 0.7857, "tp": 23, "fp": 3, "tn": 21, "fn": 9}, {"fold": "fold_4", "regime": "Strong USD downturn", "sharpe": 13.5544, "sortino": 42.5826, "return_pct": 68.01, "equity": 1680.12, "max_dd": 0.56, "win_rate": 87.18, "profit_factor": 13.708, "ic": 0.8663, "hit": 86.44, "n": 118, "precision": 0.8689, "recall": 0.8833, "f1": 0.876, "f2": 0.8804, "mcc": 0.7457, "accuracy": 0.8729, "tp": 53, "fp": 8, "tn": 50, "fn": 7}, {"fold": "fold_5", "regime": "Low-vol plateau", "sharpe": 13.9146, "sortino": 46.5733, "return_pct": 26.52, "equity": 1265.18, "max_dd": 0.44, "win_rate": 82.14, "profit_factor": 14.38, "ic": 0.8673, "hit": 82.14, "n": 112, "precision": 0.7627, "recall": 0.8824, "f1": 0.8182, "f2": 0.8555, "mcc": 0.6512, "accuracy": 0.8214, "tp": 45, "fp": 14, "tn": 47, "fn": 6}, {"fold": "fold_6", "regime": "EUR crisis downturn", "sharpe": 16.2835, "sortino": 62.3465, "return_pct": 66.53, "equity": 1665.26, "max_dd": 0.43, "win_rate": 83.48, "profit_factor": 18.736, "ic": 0.8598, "hit": 83.48, "n": 115, "precision": 0.8148, "recall": 0.8302, "f1": 0.8224, "f2": 0.8271, "mcc": 0.6681, "accuracy": 0.8348, "tp": 44, "fp": 10, "tn": 52, "fn": 9}, {"fold": "fold_7", "regime": "Recent mixed/upturn", "sharpe": 14.3241, "sortino": 44.6993, "return_pct": 54.96, "equity": 1549.58, "max_dd": 0.57, "win_rate": 85.71, "profit_factor": 21.443, "ic": 0.8916, "hit": 85.71, "n": 112, "precision": 0.8254, "recall": 0.9123, "f1": 0.8667, "f2": 0.8935, "mcc": 0.7178, "accuracy": 0.8571, "tp": 52, "fp": 11, "tn": 44, "fn": 5}], "val_sharpe": 9.406, "val_psr": 1.0, "val_equity": 2742.09, "val_sortino": 14.8578, "val_return_pct": 174.21, "val_max_dd": 4.39, "val_win_rate": 76.2, "val_profit_factor": 5.14, "val_ic": 0.671, "val_hit": 75.84, "val_precision": 0.7208, "val_recall": 0.8398, "val_f1": 0.7758, "val_f2": 0.813, "val_mcc": 0.5296, "val_accuracy": 0.7608, "val_per_window": [{"fold": "fold_1", "regime": "Pre-crisis upturn + GFC onset", "sharpe": 0.9973, "sortino": 1.7656, "return_pct": 1.54, "equity": 1015.36, "max_dd": 4.39, "win_rate": 46.55, "profit_factor": 1.178, "ic": -0.1782, "hit": 45.76, "n": 59, "precision": 0.4878, "recall": 0.6452, "f1": 0.5556, "f2": 0.6061, "mcc": -0.1137, "accuracy": 0.4576, "tp": 20, "fp": 21, "tn": 7, "fn": 11}, {"fold": "fold_2", "regime": "Post-crash recovery", "sharpe": 1.7924, "sortino": 2.8175, "return_pct": 3.47, "equity": 1034.7, "max_dd": 2.67, "win_rate": 56.9, "profit_factor": 1.337, "ic": 0.0317, "hit": 56.9, "n": 58, "precision": 0.5833, "recall": 0.6774, "f1": 0.6269, "f2": 0.6562, "mcc": 0.1253, "accuracy": 0.569, "tp": 21, "fp": 15, "tn": 12, "fn": 10}, {"fold": "fold_3", "regime": "Eurozone debt plateau", "sharpe": 15.973, "sortino": 67.1252, "return_pct": 30.34, "equity": 1303.38, "max_dd": 0.33, "win_rate": 88.52, "profit_factor": 31.353, "ic": 0.8981, "hit": 88.52, "n": 61, "precision": 0.8125, "recall": 0.963, "f1": 0.8814, "f2": 0.9286, "mcc": 0.7822, "accuracy": 0.8852, "tp": 26, "fp": 6, "tn": 28, "fn": 1}, {"fold": "fold_4", "regime": "Strong USD downturn", "sharpe": 16.827, "sortino": 49.0282, "return_pct": 28.64, "equity": 1286.41, "max_dd": 0.56, "win_rate": 88.33, "profit_factor": 16.49, "ic": 0.9267, "hit": 88.33, "n": 60, "precision": 0.8235, "recall": 0.9655, "f1": 0.8889, "f2": 0.9333, "mcc": 0.7785, "accuracy": 0.8833, "tp": 28, "fp": 6, "tn": 25, "fn": 1}, {"fold": "fold_5", "regime": "Low-vol plateau", "sharpe": 15.3401, "sortino": 63.47, "return_pct": 21.05, "equity": 1210.48, "max_dd": 0.29, "win_rate": 83.87, "profit_factor": 17.843, "ic": 0.9009, "hit": 83.87, "n": 62, "precision": 0.8056, "recall": 0.9062, "f1": 0.8529, "f2": 0.8841, "mcc": 0.6815, "accuracy": 0.8387, "tp": 29, "fp": 7, "tn": 23, "fn": 3}, {"fold": "fold_6", "regime": "EUR crisis downturn", "sharpe": 17.3939, "sortino": 127.7825, "return_pct": 12.99, "equity": 1129.89, "max_dd": 0.08, "win_rate": 89.47, "profit_factor": 49.906, "ic": 0.9109, "hit": 87.93, "n": 58, "precision": 0.8214, "recall": 0.9583, "f1": 0.8846, "f2": 0.9274, "mcc": 0.7996, "accuracy": 0.8966, "tp": 23, "fp": 5, "tn": 29, "fn": 1}, {"fold": "fold_7", "regime": "Recent mixed/upturn", "sharpe": 13.1791, "sortino": 32.2258, "return_pct": 13.82, "equity": 1138.15, "max_dd": 0.74, "win_rate": 78.33, "profit_factor": 10.548, "ic": 0.8089, "hit": 78.33, "n": 60, "precision": 0.7879, "recall": 0.8125, "f1": 0.8, "f2": 0.8075, "mcc": 0.5641, "accuracy": 0.7833, "tp": 26, "fp": 7, "tn": 21, "fn": 6}], "train_sharpe": 9.971, "train_psr": 1.0, "train_equity": 397212.31, "train_sortino": 96.9074, "train_return_pct": 39621.23, "train_max_dd": 0.39, "train_win_rate": 91.71, "train_profit_factor": 68.624, "train_ic": 0.9569, "train_hit": 91.24, "train_precision": 0.8989, "train_recall": 0.9428, "train_f1": 0.9204, "train_f2": 0.9337, "train_mcc": 0.8312, "train_accuracy": 0.9153, "train_per_window": [{"fold": "all_train", "regime": "Training data", "sharpe": 9.971, "sortino": 96.9074, "return_pct": 39621.23, "equity": 397212.31, "max_dd": 0.39, "win_rate": 91.71, "profit_factor": 68.624, "ic": 0.9569, "hit": 91.24, "n": 1382, "precision": 0.8989, "recall": 0.9428, "f1": 0.9204, "f2": 0.9337, "mcc": 0.8312, "accuracy": 0.9153, "tp": 676, "fp": 76, "tn": 589, "fn": 41}], "experiment_num": 235, "status": "DISCARD"}
{"backbone": "catboost", "description": "catboost: Exp16 seq=60 (ensemble matching)", "config": {"seq_len": 60, "lr": 0.0003, "batch_size": 32, "epochs": 20, "weight_decay": 1e-05, "patience": 5, "grad_clip": 1.0, "warmup_epochs": 0, "huber_delta": 1.0, "head_dropout": 0.1, "seed": 42, "gbm_lr": 0.01, "depth": 4, "l2_leaf_reg": 1.0, "het_loss": false}, "composite": 8.875, "test_pos_folds": 6, "val_pos_folds": 6, "val_loss": 0.0, "elapsed_sec": 1434.3, "timestamp": "2026-04-21T11:46:52", "sharpe": 9.7031, "psr": 1.0, "equity": 6839.7, "sortino": 13.4999, "return_pct": 583.97, "max_dd": 3.9, "win_rate": 79.81, "profit_factor": 5.554, "ic": 0.7066, "hit": 79.29, "precision": 0.8074, "recall": 0.771, "f1": 0.7888, "f2": 0.778, "mcc": 0.5896, "accuracy": 0.7945, "per_window": [{"fold": "fold_1", "regime": "Pre-crisis upturn + GFC onset", "sharpe": -0.847, "sortino": -1.6494, "return_pct": -1.88, "equity": 981.22, "max_dd": 3.27, "win_rate": 46.15, "profit_factor": 0.878, "ic": -0.0785, "hit": 45.28, "n": 53, "precision": 0.4483, "recall": 0.5, "f1": 0.4727, "f2": 0.4887, "mcc": -0.093, "accuracy": 0.4528, "tp": 13, "fp": 16, "tn": 11, "fn": 13}, {"fold": "fold_2", "regime": "Post-crash recovery", "sharpe": 0.6778, "sortino": 1.1146, "return_pct": 1.77, "equity": 1017.71, "max_dd": 3.68, "win_rate": 52.63, "profit_factor": 1.115, "ic": 0.0158, "hit": 52.63, "n": 57, "precision": 0.5909, "recall": 0.4194, "f1": 0.4906, "f2": 0.4452, "mcc": 0.0749, "accuracy": 0.5263, "tp": 13, "fp": 9, "tn": 17, "fn": 18}, {"fold": "fold_3", "regime": "Eurozone debt plateau", "sharpe": 14.3739, "sortino": 37.9973, "return_pct": 20.72, "equity": 1207.24, "max_dd": 0.29, "win_rate": 83.33, "profit_factor": 12.244, "ic": 0.8468, "hit": 80.36, "n": 56, "precision": 0.8889, "recall": 0.75, "f1": 0.8136, "f2": 0.7742, "mcc": 0.619, "accuracy": 0.8036, "tp": 24, "fp": 3, "tn": 21, "fn": 8}, {"fold": "fold_4", "regime": "Strong USD downturn", "sharpe": 15.6021, "sortino": 44.9177, "return_pct": 75.12, "equity": 1751.24, "max_dd": 0.56, "win_rate": 93.16, "profit_factor": 28.716, "ic": 0.8822, "hit": 92.37, "n": 118, "precision": 0.9643, "recall": 0.9, "f1": 0.931, "f2": 0.9122, "mcc": 0.8665, "accuracy": 0.9322, "tp": 54, "fp": 2, "tn": 56, "fn": 6}, {"fold": "fold_5", "regime": "Low-vol plateau", "sharpe": 14.4055, "sortino": 59.1565, "return_pct": 27.1, "equity": 1271.01, "max_dd": 0.23, "win_rate": 82.14, "profit_factor": 16.688, "ic": 0.9117, "hit": 82.14, "n": 112, "precision": 0.7925, "recall": 0.8235, "f1": 0.8077, "f2": 0.8171, "mcc": 0.6416, "accuracy": 0.8214, "tp": 42, "fp": 11, "tn": 50, "fn": 9}, {"fold": "fold_6", "regime": "EUR crisis downturn", "sharpe": 16.0348, "sortino": 58.4986, "return_pct": 65.89, "equity": 1658.85, "max_dd": 0.43, "win_rate": 82.61, "profit_factor": 17.501, "ic": 0.8815, "hit": 82.61, "n": 115, "precision": 0.8235, "recall": 0.7925, "f1": 0.8077, "f2": 0.7985, "mcc": 0.6495, "accuracy": 0.8261, "tp": 42, "fp": 9, "tn": 53, "fn": 11}, {"fold": "fold_7", "regime": "Recent mixed/upturn", "sharpe": 13.8371, "sortino": 23.7814, "return_pct": 53.66, "equity": 1536.56, "max_dd": 1.02, "win_rate": 88.39, "profit_factor": 17.765, "ic": 0.8911, "hit": 88.39, "n": 112, "precision": 0.8793, "recall": 0.8947, "f1": 0.887, "f2": 0.8916, "mcc": 0.7678, "accuracy": 0.8839, "tp": 51, "fp": 7, "tn": 48, "fn": 6}], "val_sharpe": 9.075, "val_psr": 1.0, "val_equity": 2669.69, "val_sortino": 13.7388, "val_return_pct": 166.97, "val_max_dd": 6.18, "val_win_rate": 75.48, "val_profit_factor": 4.821, "val_ic": 0.6735, "val_hit": 75.12, "val_precision": 0.7191, "val_recall": 0.8204, "val_f1": 0.7664, "val_f2": 0.7979, "val_mcc": 0.513, "val_accuracy": 0.7536, "val_per_window": [{"fold": "fold_1", "regime": "Pre-crisis upturn + GFC onset", "sharpe": 0.519, "sortino": 0.899, "return_pct": 0.77, "equity": 1007.72, "max_dd": 4.39, "win_rate": 43.1, "profit_factor": 1.089, "ic": -0.1193, "hit": 42.37, "n": 59, "precision": 0.4651, "recall": 0.6452, "f1": 0.5405, "f2": 0.5988, "mcc": -0.198, "accuracy": 0.4237, "tp": 20, "fp": 23, "tn": 5, "fn": 11}, {"fold": "fold_2", "regime": "Post-crash recovery", "sharpe": -0.88, "sortino": -1.4264, "return_pct": -1.79, "equity": 982.09, "max_dd": 4.9, "win_rate": 48.28, "profit_factor": 0.867, "ic": -0.0026, "hit": 48.28, "n": 58, "precision": 0.5152, "recall": 0.5484, "f1": 0.5312, "f2": 0.5414, "mcc": -0.0445, "accuracy": 0.4828, "tp": 17, "fp": 16, "tn": 11, "fn": 14}, {"fold": "fold_3", "regime": "Eurozone debt plateau", "sharpe": 15.716, "sortino": 56.5026, "return_pct": 30.06, "equity": 1300.58, "max_dd": 0.33, "win_rate": 88.52, "profit_factor": 27.814, "ic": 0.9205, "hit": 88.52, "n": 61, "precision": 0.7941, "recall": 1.0, "f1": 0.8852, "f2": 0.9507, "mcc": 0.7941, "accuracy": 0.8852, "tp": 27, "fp": 7, "tn": 27, "fn": 0}, {"fold": "fold_4", "regime": "Strong USD downturn", "sharpe": 18.7508, "sortino": 62.5207, "return_pct": 30.25, "equity": 1302.53, "max_dd": 0.39, "win_rate": 88.33, "profit_factor": 27.274, "ic": 0.9474, "hit": 88.33, "n": 60, "precision": 0.8667, "recall": 0.8966, "f1": 0.8814, "f2": 0.8904, "mcc": 0.7671, "accuracy": 0.8833, "tp": 26, "fp": 4, "tn": 27, "fn": 3}, {"fold": "fold_5", "regime": "Low-vol plateau", "sharpe": 16.8606, "sortino": 91.2445, "return_pct": 22.16, "equity": 1221.6, "max_dd": 0.2, "win_rate": 87.1, "profit_factor": 30.514, "ic": 0.9318, "hit": 87.1, "n": 62, "precision": 0.8529, "recall": 0.9062, "f1": 0.8788, "f2": 0.8951, "mcc": 0.7427, "accuracy": 0.871, "tp": 29, "fp": 5, "tn": 25, "fn": 3}, {"fold": "fold_6", "regime": "EUR crisis downturn", "sharpe": 18.2908, "sortino": 174.0297, "return_pct": 13.3, "equity": 1133.0, "max_dd": 0.06, "win_rate": 92.98, "profit_factor": 112.014, "ic": 0.9259, "hit": 91.38, "n": 58, "precision": 0.8846, "recall": 0.9583, "f1": 0.92, "f2": 0.9426, "mcc": 0.8617, "accuracy": 0.931, "tp": 23, "fp": 3, "tn": 31, "fn": 1}, {"fold": "fold_7", "regime": "Recent mixed/upturn", "sharpe": 15.2116, "sortino": 87.8698, "return_pct": 15.05, "equity": 1150.5, "max_dd": 0.15, "win_rate": 78.33, "profit_factor": 18.148, "ic": 0.8496, "hit": 78.33, "n": 60, "precision": 0.7714, "recall": 0.8438, "f1": 0.806, "f2": 0.8282, "mcc": 0.5647, "accuracy": 0.7833, "tp": 27, "fp": 8, "tn": 20, "fn": 5}], "train_sharpe": 9.7504, "train_psr": 1.0, "train_equity": 360655.62, "train_sortino": 82.9787, "train_return_pct": 35965.56, "train_max_dd": 0.5, "train_win_rate": 89.6, "train_profit_factor": 44.166, "train_ic": 0.9388, "train_hit": 89.15, "train_precision": 0.8863, "train_recall": 0.9135, "train_f1": 0.8997, "train_f2": 0.908, "train_mcc": 0.7886, "train_accuracy": 0.8944, "train_per_window": [{"fold": "all_train", "regime": "Training data", "sharpe": 9.7504, "sortino": 82.9787, "return_pct": 35965.56, "equity": 360655.62, "max_dd": 0.5, "win_rate": 89.6, "profit_factor": 44.166, "ic": 0.9388, "hit": 89.15, "n": 1382, "precision": 0.8863, "recall": 0.9135, "f1": 0.8997, "f2": 0.908, "mcc": 0.7886, "accuracy": 0.8944, "tp": 655, "fp": 84, "tn": 581, "fn": 62}], "experiment_num": 236, "status": "DISCARD"}
