{"backbone": "lfm2-350m", "description": "lfm2: H-Exp25 plain-Huber seed=42 (proven config)", "config": {"seq_len": 60, "lr": 2e-05, "batch_size": 32, "epochs": 20, "weight_decay": 1e-05, "patience": 5, "grad_clip": 1.0, "warmup_epochs": 0, "huber_delta": 1.0, "head_dropout": 0.1, "seed": 42, "het_loss": false}, "composite": -1.5241, "test_pos_folds": 3, "val_pos_folds": 3, "val_loss": 0.001337, "elapsed_sec": 286.0, "timestamp": "2026-04-12T11:46:19", "sharpe": -0.7241, "psr": 0.1283, "equity": 835.28, "sortino": -1.0968, "return_pct": -16.47, "max_dd": 23.36, "win_rate": 48.95, "profit_factor": 0.886, "ic": -0.0087, "hit": 48.64, "aleatoric_mean": 0.001534, "epistemic_mean": 0.003067, "confidence_mean": 0.9954, "per_window": [{"fold": "fold_1", "regime": "Pre-crisis upturn + GFC onset", "sharpe": -0.8609, "sortino": -1.544, "return_pct": -1.91, "equity": 980.93, "max_dd": 3.8, "win_rate": 46.15, "profit_factor": 0.876, "ic": -0.0259, "hit": 45.28, "n": 53, "aleatoric_mean": 0.001514, "epistemic_mean": 0.003028, "confidence_mean": 0.9955, "aleatoric_std": 0.000628, "epistemic_std": 0.001256}, {"fold": "fold_2", "regime": "Post-crash recovery", "sharpe": -0.854, "sortino": -1.3728, "return_pct": -2.58, "equity": 974.15, "max_dd": 6.28, "win_rate": 52.63, "profit_factor": 0.872, "ic": 0.0186, "hit": 52.63, "n": 57, "aleatoric_mean": 0.001389, "epistemic_mean": 0.002779, "confidence_mean": 0.9959, "aleatoric_std": 0.000516, "epistemic_std": 0.001032}, {"fold": "fold_3", "regime": "Eurozone debt plateau", "sharpe": 3.3924, "sortino": 5.5888, "return_pct": 5.99, "equity": 1059.88, "max_dd": 1.54, "win_rate": 64.81, "profit_factor": 1.719, "ic": 0.3918, "hit": 62.5, "n": 56, "aleatoric_mean": 0.001275, "epistemic_mean": 0.00255, "confidence_mean": 0.9962, "aleatoric_std": 0.000508, "epistemic_std": 0.001017}, {"fold": "fold_4", "regime": "Strong USD downturn", "sharpe": -2.2519, "sortino": -3.449, "return_pct": -10.91, "equity": 890.88, "max_dd": 16.03, "win_rate": 40.17, "profit_factor": 0.685, "ic": -0.114, "hit": 39.83, "n": 118, "aleatoric_mean": 0.001563, "epistemic_mean": 0.003127, "confidence_mean": 0.9953, "aleatoric_std": 0.000601, "epistemic_std": 0.001202}, {"fold": "fold_5", "regime": "Low-vol plateau", "sharpe": 0.175, "sortino": 0.2346, "return_pct": 0.34, "equity": 1003.38, "max_dd": 3.17, "win_rate": 53.57, "profit_factor": 1.03, "ic": 0.0441, "hit": 53.57, "n": 112, "aleatoric_mean": 0.001814, "epistemic_mean": 0.003627, "confidence_mean": 0.9946, "aleatoric_std": 0.000793, "epistemic_std": 0.001586}, {"fold": "fold_6", "regime": "EUR crisis downturn", "sharpe": -3.0717, "sortino": -4.8774, "return_pct": -12.9, "equity": 870.99, "max_dd": 12.51, "win_rate": 43.48, "profit_factor": 0.615, "ic": -0.0813, "hit": 43.48, "n": 115, "aleatoric_mean": 0.001467, "epistemic_mean": 0.002933, "confidence_mean": 0.9956, "aleatoric_std": 0.000559, "epistemic_std": 0.001119}, {"fold": "fold_7", "regime": "Recent mixed/upturn", "sharpe": 1.4445, "sortino": 2.5657, "return_pct": 5.93, "equity": 1059.28, "max_dd": 3.84, "win_rate": 50.89, "profit_factor": 1.281, "ic": -0.0898, "hit": 50.89, "n": 112, "aleatoric_mean": 0.001503, "epistemic_mean": 0.003005, "confidence_mean": 0.9955, "aleatoric_std": 0.000453, "epistemic_std": 0.000906}], "val_sharpe": -0.0352, "val_psr": 0.4819, "val_equity": 990.9, "val_sortino": -0.0601, "val_return_pct": -0.91, "val_max_dd": 10.45, "val_win_rate": 50.0, "val_profit_factor": 0.994, "val_ic": -0.0262, "val_hit": 49.76, "val_aleatoric_mean": 0.001562, "val_epistemic_mean": 0.003125, "val_confidence_mean": 0.9953, "val_per_window": [{"fold": "fold_1", "regime": "Pre-crisis upturn + GFC onset", "sharpe": -1.2189, "sortino": -1.7575, "return_pct": -1.96, "equity": 980.38, "max_dd": 4.02, "win_rate": 50.0, "profit_factor": 0.818, "ic": -0.0229, "hit": 49.15, "n": 59, "aleatoric_mean": 0.001712, "epistemic_mean": 0.003425, "confidence_mean": 0.9949, "aleatoric_std": 0.000874, "epistemic_std": 0.001748}, {"fold": "fold_2", "regime": "Post-crash recovery", "sharpe": 4.3598, "sortino": 7.5695, "return_pct": 8.51, "equity": 1085.08, "max_dd": 2.74, "win_rate": 60.34, "profit_factor": 2.031, "ic": 0.2539, "hit": 60.34, "n": 58, "aleatoric_mean": 0.001985, "epistemic_mean": 0.00397, "confidence_mean": 0.9941, "aleatoric_std": 0.000716, "epistemic_std": 0.001432}, {"fold": "fold_3", "regime": "Eurozone debt plateau", "sharpe": -1.6152, "sortino": -3.1217, "return_pct": -3.84, "equity": 961.63, "max_dd": 8.15, "win_rate": 42.62, "profit_factor": 0.764, "ic": -0.013, "hit": 42.62, "n": 61, "aleatoric_mean": 0.001311, "epistemic_mean": 0.002623, "confidence_mean": 0.9961, "aleatoric_std": 0.000447, "epistemic_std": 0.000894}, {"fold": "fold_4", "regime": "Strong USD downturn", "sharpe": 2.705, "sortino": 5.8753, "return_pct": 5.91, "equity": 1059.07, "max_dd": 2.23, "win_rate": 61.67, "profit_factor": 1.514, "ic": 0.1412, "hit": 61.67, "n": 60, "aleatoric_mean": 0.001186, "epistemic_mean": 0.002372, "confidence_mean": 0.9965, "aleatoric_std": 0.000424, "epistemic_std": 0.000848}, {"fold": "fold_5", "regime": "Low-vol plateau", "sharpe": -2.7508, "sortino": -4.0807, "return_pct": -4.66, "equity": 953.42, "max_dd": 5.74, "win_rate": 43.55, "profit_factor": 0.64, "ic": -0.1648, "hit": 43.55, "n": 62, "aleatoric_mean": 0.00143, "epistemic_mean": 0.002861, "confidence_mean": 0.9957, "aleatoric_std": 0.000565, "epistemic_std": 0.00113}, {"fold": "fold_6", "regime": "EUR crisis downturn", "sharpe": -4.9993, "sortino": -6.959, "return_pct": -4.88, "equity": 951.23, "max_dd": 4.96, "win_rate": 42.11, "profit_factor": 0.438, "ic": -0.4677, "hit": 41.38, "n": 58, "aleatoric_mean": 0.001287, "epistemic_mean": 0.002574, "confidence_mean": 0.9962, "aleatoric_std": 0.000553, "epistemic_std": 0.001106}, {"fold": "fold_7", "regime": "Recent mixed/upturn", "sharpe": 0.6885, "sortino": 1.4809, "return_pct": 0.85, "equity": 1008.49, "max_dd": 2.27, "win_rate": 50.0, "profit_factor": 1.119, "ic": -0.2096, "hit": 50.0, "n": 60, "aleatoric_mean": 0.002041, "epistemic_mean": 0.004083, "confidence_mean": 0.9939, "aleatoric_std": 0.000876, "epistemic_std": 0.001751}], "train_sharpe": 1.5507, "train_psr": 1.0, "train_equity": 2879.8, "train_sortino": 3.4863, "train_return_pct": 187.98, "train_max_dd": 10.4, "train_win_rate": 54.47, "train_profit_factor": 1.432, "train_ic": 0.1437, "train_hit": 54.2, "train_per_window": [{"fold": "all_train", "regime": "Training data", "sharpe": 1.5507, "sortino": 3.4863, "return_pct": 187.98, "equity": 2879.8, "max_dd": 10.4, "win_rate": 54.47, "profit_factor": 1.432, "ic": 0.1437, "hit": 54.2, "n": 1382}], "experiment_num": 47, "status": "DISCARD"}
{"backbone": "lfm2-350m", "description": "lfm2: H-Exp26 plain-Huber seed=0", "config": {"seq_len": 60, "lr": 2e-05, "batch_size": 32, "epochs": 20, "weight_decay": 1e-05, "patience": 5, "grad_clip": 1.0, "warmup_epochs": 0, "huber_delta": 1.0, "head_dropout": 0.1, "seed": 0, "het_loss": false}, "composite": 1.1338, "test_pos_folds": 5, "val_pos_folds": 6, "val_loss": 0.001144, "elapsed_sec": 286.5, "timestamp": "2026-04-12T11:51:45", "sharpe": 1.743, "psr": 0.9972, "equity": 1482.39, "sortino": 2.8236, "return_pct": 48.24, "max_dd": 13.21, "win_rate": 52.5, "profit_factor": 1.34, "ic": 0.0929, "hit": 52.17, "aleatoric_mean": 0.001748, "epistemic_mean": 0.003496, "confidence_mean": 0.9948, "per_window": [{"fold": "fold_1", "regime": "Pre-crisis upturn + GFC onset", "sharpe": 1.4114, "sortino": 2.9029, "return_pct": 2.91, "equity": 1029.09, "max_dd": 2.46, "win_rate": 46.15, "profit_factor": 1.242, "ic": 0.0048, "hit": 45.28, "n": 53, "aleatoric_mean": 0.002094, "epistemic_mean": 0.004187, "confidence_mean": 0.9938, "aleatoric_std": 0.000697, "epistemic_std": 0.001394}, {"fold": "fold_2", "regime": "Post-crash recovery", "sharpe": -3.3762, "sortino": -4.68, "return_pct": -9.17, "equity": 908.26, "max_dd": 13.21, "win_rate": 40.35, "profit_factor": 0.582, "ic": -0.0703, "hit": 40.35, "n": 57, "aleatoric_mean": 0.001839, "epistemic_mean": 0.003679, "confidence_mean": 0.9945, "aleatoric_std": 0.000729, "epistemic_std": 0.001458}, {"fold": "fold_3", "regime": "Eurozone debt plateau", "sharpe": 2.2621, "sortino": 3.8921, "return_pct": 3.98, "equity": 1039.8, "max_dd": 2.09, "win_rate": 46.3, "profit_factor": 1.434, "ic": 0.236, "hit": 44.64, "n": 56, "aleatoric_mean": 0.001622, "epistemic_mean": 0.003244, "confidence_mean": 0.9952, "aleatoric_std": 0.000574, "epistemic_std": 0.001149}, {"fold": "fold_4", "regime": "Strong USD downturn", "sharpe": 3.773, "sortino": 8.3551, "return_pct": 20.08, "equity": 1200.84, "max_dd": 2.32, "win_rate": 55.56, "profit_factor": 1.889, "ic": 0.1569, "hit": 55.08, "n": 118, "aleatoric_mean": 0.001853, "epistemic_mean": 0.003707, "confidence_mean": 0.9945, "aleatoric_std": 0.000708, "epistemic_std": 0.001416}, {"fold": "fold_5", "regime": "Low-vol plateau", "sharpe": 2.4503, "sortino": 3.9404, "return_pct": 5.55, "equity": 1055.48, "max_dd": 2.24, "win_rate": 54.46, "profit_factor": 1.504, "ic": 0.2037, "hit": 54.46, "n": 112, "aleatoric_mean": 0.00174, "epistemic_mean": 0.00348, "confidence_mean": 0.9948, "aleatoric_std": 0.000708, "epistemic_std": 0.001417}, {"fold": "fold_6", "regime": "EUR crisis downturn", "sharpe": -0.5136, "sortino": -0.8987, "return_pct": -2.5, "equity": 974.96, "max_dd": 7.02, "win_rate": 46.96, "profit_factor": 0.922, "ic": -0.0525, "hit": 46.96, "n": 115, "aleatoric_mean": 0.001828, "epistemic_mean": 0.003657, "confidence_mean": 0.9945, "aleatoric_std": 0.000656, "epistemic_std": 0.001312}, {"fold": "fold_7", "regime": "Recent mixed/upturn", "sharpe": 5.4274, "sortino": 9.2568, "return_pct": 23.43, "equity": 1234.31, "max_dd": 1.49, "win_rate": 65.18, "profit_factor": 2.571, "ic": 0.3547, "hit": 65.18, "n": 112, "aleatoric_mean": 0.001416, "epistemic_mean": 0.002832, "confidence_mean": 0.9958, "aleatoric_std": 0.000536, "epistemic_std": 0.001072}], "val_sharpe": 1.4338, "val_psr": 0.9666, "val_equity": 1190.18, "val_sortino": 2.1939, "val_return_pct": 19.02, "val_max_dd": 4.62, "val_win_rate": 55.29, "val_profit_factor": 1.27, "val_ic": 0.1088, "val_hit": 55.02, "val_aleatoric_mean": 0.001689, "val_epistemic_mean": 0.003378, "val_confidence_mean": 0.995, "val_per_window": [{"fold": "fold_1", "regime": "Pre-crisis upturn + GFC onset", "sharpe": 0.572, "sortino": 0.8274, "return_pct": 0.86, "equity": 1008.56, "max_dd": 2.23, "win_rate": 60.34, "profit_factor": 1.099, "ic": 0.1963, "hit": 59.32, "n": 59, "aleatoric_mean": 0.001687, "epistemic_mean": 0.003374, "confidence_mean": 0.995, "aleatoric_std": 0.000715, "epistemic_std": 0.001429}, {"fold": "fold_2", "regime": "Post-crash recovery", "sharpe": 2.8187, "sortino": 4.6936, "return_pct": 5.51, "equity": 1055.08, "max_dd": 1.63, "win_rate": 58.62, "profit_factor": 1.579, "ic": -0.1603, "hit": 58.62, "n": 58, "aleatoric_mean": 0.001725, "epistemic_mean": 0.003449, "confidence_mean": 0.9949, "aleatoric_std": 0.000662, "epistemic_std": 0.001324}, {"fold": "fold_3", "regime": "Eurozone debt plateau", "sharpe": 0.1248, "sortino": 0.162, "return_pct": 0.18, "equity": 1001.79, "max_dd": 4.62, "win_rate": 55.74, "profit_factor": 1.021, "ic": 0.1828, "hit": 55.74, "n": 61, "aleatoric_mean": 0.001745, "epistemic_mean": 0.003489, "confidence_mean": 0.9948, "aleatoric_std": 0.000624, "epistemic_std": 0.001248}, {"fold": "fold_4", "regime": "Strong USD downturn", "sharpe": 3.83, "sortino": 9.7486, "return_pct": 8.39, "equity": 1083.86, "max_dd": 1.47, "win_rate": 56.67, "profit_factor": 1.799, "ic": 0.2582, "hit": 56.67, "n": 60, "aleatoric_mean": 0.001752, "epistemic_mean": 0.003504, "confidence_mean": 0.9948, "aleatoric_std": 0.000686, "epistemic_std": 0.001372}, {"fold": "fold_5", "regime": "Low-vol plateau", "sharpe": 0.6452, "sortino": 0.9955, "return_pct": 1.06, "equity": 1010.64, "max_dd": 3.14, "win_rate": 54.84, "profit_factor": 1.11, "ic": 0.1938, "hit": 54.84, "n": 62, "aleatoric_mean": 0.001926, "epistemic_mean": 0.003852, "confidence_mean": 0.9943, "aleatoric_std": 0.000848, "epistemic_std": 0.001697}, {"fold": "fold_6", "regime": "EUR crisis downturn", "sharpe": -1.869, "sortino": -2.8159, "return_pct": -1.94, "equity": 980.58, "max_dd": 3.51, "win_rate": 45.61, "profit_factor": 0.736, "ic": -0.0011, "hit": 44.83, "n": 58, "aleatoric_mean": 0.001421, "epistemic_mean": 0.002842, "confidence_mean": 0.9958, "aleatoric_std": 0.000602, "epistemic_std": 0.001205}, {"fold": "fold_7", "regime": "Recent mixed/upturn", "sharpe": 3.106, "sortino": 5.7802, "return_pct": 3.94, "equity": 1039.42, "max_dd": 1.56, "win_rate": 55.0, "profit_factor": 1.662, "ic": 0.2895, "hit": 55.0, "n": 60, "aleatoric_mean": 0.001553, "epistemic_mean": 0.003105, "confidence_mean": 0.9954, "aleatoric_std": 0.000549, "epistemic_std": 0.001098}], "train_sharpe": 2.1214, "train_psr": 1.0, "train_equity": 4293.65, "train_sortino": 5.0598, "train_return_pct": 329.36, "train_max_dd": 9.22, "train_win_rate": 56.29, "train_profit_factor": 1.638, "train_ic": 0.1781, "train_hit": 56.01, "train_per_window": [{"fold": "all_train", "regime": "Training data", "sharpe": 2.1214, "sortino": 5.0598, "return_pct": 329.36, "equity": 4293.65, "max_dd": 9.22, "win_rate": 56.29, "profit_factor": 1.638, "ic": 0.1781, "hit": 56.01, "n": 1382}], "experiment_num": 48, "status": "DISCARD"}
{"backbone": "lfm2-350m", "description": "lfm2: H-Exp27 plain-Huber seed=7 variance study", "config": {"seq_len": 60, "lr": 2e-05, "batch_size": 32, "epochs": 20, "weight_decay": 1e-05, "patience": 5, "grad_clip": 1.0, "warmup_epochs": 0, "huber_delta": 1.0, "head_dropout": 0.1, "seed": 7, "het_loss": false}, "composite": 0.1114, "test_pos_folds": 5, "val_pos_folds": 5, "val_loss": 0.001379, "elapsed_sec": 260.4, "timestamp": "2026-04-12T14:07:21", "sharpe": 0.5114, "psr": 0.7898, "equity": 1114.45, "sortino": 0.8267, "return_pct": 11.45, "max_dd": 16.69, "win_rate": 50.08, "profit_factor": 1.09, "ic": 0.0224, "hit": 49.76, "aleatoric_mean": 0.001579, "epistemic_mean": 0.003158, "confidence_mean": 0.9953, "per_window": [{"fold": "fold_1", "regime": "Pre-crisis upturn + GFC onset", "sharpe": 1.6493, "sortino": 2.89, "return_pct": 3.42, "equity": 1034.22, "max_dd": 4.54, "win_rate": 55.77, "profit_factor": 1.288, "ic": 0.063, "hit": 54.72, "n": 53, "aleatoric_mean": 0.001579, "epistemic_mean": 0.003159, "confidence_mean": 0.9953, "aleatoric_std": 0.000569, "epistemic_std": 0.001138}, {"fold": "fold_2", "regime": "Post-crash recovery", "sharpe": 1.0689, "sortino": 1.8796, "return_pct": 2.91, "equity": 1029.1, "max_dd": 3.47, "win_rate": 54.39, "profit_factor": 1.187, "ic": 0.0626, "hit": 54.39, "n": 57, "aleatoric_mean": 0.001899, "epistemic_mean": 0.003797, "confidence_mean": 0.9943, "aleatoric_std": 0.000762, "epistemic_std": 0.001524}, {"fold": "fold_3", "regime": "Eurozone debt plateau", "sharpe": 4.9857, "sortino": 12.3223, "return_pct": 8.73, "equity": 1087.29, "max_dd": 1.46, "win_rate": 50.0, "profit_factor": 2.221, "ic": 0.2614, "hit": 48.21, "n": 56, "aleatoric_mean": 0.001873, "epistemic_mean": 0.003746, "confidence_mean": 0.9944, "aleatoric_std": 0.000713, "epistemic_std": 0.001426}, {"fold": "fold_4", "regime": "Strong USD downturn", "sharpe": -2.7339, "sortino": -4.1868, "return_pct": -12.98, "equity": 870.17, "max_dd": 14.26, "win_rate": 41.03, "profit_factor": 0.632, "ic": -0.2828, "hit": 40.68, "n": 118, "aleatoric_mean": 0.001595, "epistemic_mean": 0.00319, "confidence_mean": 0.9952, "aleatoric_std": 0.000719, "epistemic_std": 0.001438}, {"fold": "fold_5", "regime": "Low-vol plateau", "sharpe": -0.9581, "sortino": -1.3078, "return_pct": -2.19, "equity": 978.12, "max_dd": 3.95, "win_rate": 48.21, "profit_factor": 0.853, "ic": -0.0714, "hit": 48.21, "n": 112, "aleatoric_mean": 0.001207, "epistemic_mean": 0.002413, "confidence_mean": 0.9964, "aleatoric_std": 0.000456, "epistemic_std": 0.000912}, {"fold": "fold_6", "regime": "EUR crisis downturn", "sharpe": 1.8005, "sortino": 3.3035, "return_pct": 8.16, "equity": 1081.55, "max_dd": 3.37, "win_rate": 54.78, "profit_factor": 1.329, "ic": 0.146, "hit": 54.78, "n": 115, "aleatoric_mean": 0.001793, "epistemic_mean": 0.003586, "confidence_mean": 0.9947, "aleatoric_std": 0.000739, "epistemic_std": 0.001478}, {"fold": "fold_7", "regime": "Recent mixed/upturn", "sharpe": 1.1406, "sortino": 2.0967, "return_pct": 4.62, "equity": 1046.18, "max_dd": 5.48, "win_rate": 51.79, "profit_factor": 1.216, "ic": 0.0275, "hit": 51.79, "n": 112, "aleatoric_mean": 0.001404, "epistemic_mean": 0.002808, "confidence_mean": 0.9958, "aleatoric_std": 0.000446, "epistemic_std": 0.000893}], "val_sharpe": 0.7257, "val_psr": 0.8251, "val_equity": 1089.88, "val_sortino": 1.1624, "val_return_pct": 8.99, "val_max_dd": 8.21, "val_win_rate": 51.44, "val_profit_factor": 1.129, "val_ic": 0.0947, "val_hit": 51.2, "val_aleatoric_mean": 0.001499, "val_epistemic_mean": 0.002998, "val_confidence_mean": 0.9955, "val_per_window": [{"fold": "fold_1", "regime": "Pre-crisis upturn + GFC onset", "sharpe": 0.4311, "sortino": 0.6712, "return_pct": 0.63, "equity": 1006.32, "max_dd": 2.78, "win_rate": 51.72, "profit_factor": 1.074, "ic": -0.0473, "hit": 50.85, "n": 59, "aleatoric_mean": 0.001636, "epistemic_mean": 0.003272, "confidence_mean": 0.9951, "aleatoric_std": 0.00073, "epistemic_std": 0.00146}, {"fold": "fold_2", "regime": "Post-crash recovery", "sharpe": -2.657, "sortino": -4.3565, "return_pct": -5.09, "equity": 949.09, "max_dd": 8.21, "win_rate": 43.1, "profit_factor": 0.65, "ic": -0.0089, "hit": 43.1, "n": 58, "aleatoric_mean": 0.001945, "epistemic_mean": 0.00389, "confidence_mean": 0.9942, "aleatoric_std": 0.000731, "epistemic_std": 0.001462}, {"fold": "fold_3", "regime": "Eurozone debt plateau", "sharpe": 2.8265, "sortino": 4.2025, "return_pct": 6.67, "equity": 1066.75, "max_dd": 2.04, "win_rate": 60.66, "profit_factor": 1.604, "ic": 0.2679, "hit": 60.66, "n": 61, "aleatoric_mean": 0.001531, "epistemic_mean": 0.003062, "confidence_mean": 0.9954, "aleatoric_std": 0.000513, "epistemic_std": 0.001027}, {"fold": "fold_4", "regime": "Strong USD downturn", "sharpe": 2.7286, "sortino": 5.9462, "return_pct": 5.96, "equity": 1059.59, "max_dd": 2.07, "win_rate": 53.33, "profit_factor": 1.52, "ic": 0.1225, "hit": 53.33, "n": 60, "aleatoric_mean": 0.001564, "epistemic_mean": 0.003127, "confidence_mean": 0.9953, "aleatoric_std": 0.000615, "epistemic_std": 0.00123}, {"fold": "fold_5", "regime": "Low-vol plateau", "sharpe": 0.411, "sortino": 0.6924, "return_pct": 0.65, "equity": 1006.55, "max_dd": 2.61, "win_rate": 50.0, "profit_factor": 1.069, "ic": 0.155, "hit": 50.0, "n": 62, "aleatoric_mean": 0.001349, "epistemic_mean": 0.002699, "confidence_mean": 0.996, "aleatoric_std": 0.000521, "epistemic_std": 0.001043}, {"fold": "fold_6", "regime": "EUR crisis downturn", "sharpe": -2.1305, "sortino": -2.9425, "return_pct": -2.2, "equity": 977.97, "max_dd": 4.24, "win_rate": 45.61, "profit_factor": 0.705, "ic": -0.0905, "hit": 44.83, "n": 58, "aleatoric_mean": 0.001269, "epistemic_mean": 0.002538, "confidence_mean": 0.9962, "aleatoric_std": 0.000444, "epistemic_std": 0.000887}, {"fold": "fold_7", "regime": "Recent mixed/upturn", "sharpe": 2.0181, "sortino": 2.8466, "return_pct": 2.56, "equity": 1025.59, "max_dd": 1.78, "win_rate": 55.0, "profit_factor": 1.39, "ic": 0.2208, "hit": 55.0, "n": 60, "aleatoric_mean": 0.001214, "epistemic_mean": 0.002428, "confidence_mean": 0.9964, "aleatoric_std": 0.00052, "epistemic_std": 0.00104}], "train_sharpe": 1.4426, "train_psr": 1.0, "train_equity": 2668.7, "train_sortino": 3.4298, "train_return_pct": 166.87, "train_max_dd": 10.55, "train_win_rate": 52.87, "train_profit_factor": 1.396, "train_ic": 0.109, "train_hit": 52.6, "train_per_window": [{"fold": "all_train", "regime": "Training data", "sharpe": 1.4426, "sortino": 3.4298, "return_pct": 166.87, "equity": 2668.7, "max_dd": 10.55, "win_rate": 52.87, "profit_factor": 1.396, "ic": 0.109, "hit": 52.6, "n": 1382}], "experiment_num": 49, "status": "DISCARD"}
