{"backbone": "xgboost", "description": "xgboost: Exp10 colsample=1.0 no column drop", "config": {"seq_len": 10, "lr": 0.0003, "batch_size": 32, "epochs": 20, "weight_decay": 1e-05, "patience": 5, "grad_clip": 1.0, "warmup_epochs": 0, "huber_delta": 1.0, "head_dropout": 0.1, "seed": 42, "max_depth": 4, "gbm_lr": 0.01, "colsample_bytree": 1.0, "het_loss": false}, "composite": 7.3612, "test_pos_folds": 6, "val_pos_folds": 6, "val_loss": 0.0, "elapsed_sec": 96.2, "timestamp": "2026-04-20T22:18:04", "sharpe": 7.5612, "psr": 1.0, "equity": 17027.38, "sortino": 7.4948, "return_pct": 1602.74, "max_dd": 8.43, "win_rate": 78.43, "profit_factor": 4.414, "ic": 0.6793, "hit": 78.11, "precision": 0.8096, "recall": 0.7339, "f1": 0.7699, "f2": 0.7479, "mcc": 0.5682, "accuracy": 0.7831, "per_window": [{"fold": "fold_1", "regime": "Pre-crisis upturn + GFC onset", "sharpe": -0.6793, "sortino": -0.7684, "return_pct": -5.79, "equity": 942.06, "max_dd": 7.93, "win_rate": 50.0, "profit_factor": 0.852, "ic": 0.2457, "hit": 49.51, "n": 103, "precision": 0.5833, "recall": 0.1321, "f1": 0.2154, "f2": 0.1562, "mcc": 0.05, "accuracy": 0.5049, "tp": 7, "fp": 5, "tn": 45, "fn": 46}, {"fold": "fold_2", "regime": "Post-crash recovery", "sharpe": 1.5295, "sortino": 2.9374, "return_pct": 7.29, "equity": 1072.91, "max_dd": 6.65, "win_rate": 54.21, "profit_factor": 1.271, "ic": 0.0178, "hit": 54.21, "n": 107, "precision": 0.52, "recall": 0.5098, "f1": 0.5149, "f2": 0.5118, "mcc": 0.0813, "accuracy": 0.5421, "tp": 26, "fp": 24, "tn": 32, "fn": 25}, {"fold": "fold_3", "regime": "Eurozone debt plateau", "sharpe": 14.293, "sortino": 23.9095, "return_pct": 45.58, "equity": 1455.83, "max_dd": 1.32, "win_rate": 85.58, "profit_factor": 11.024, "ic": 0.751, "hit": 83.96, "n": 106, "precision": 0.8448, "recall": 0.8596, "f1": 0.8522, "f2": 0.8566, "mcc": 0.6771, "accuracy": 0.8396, "tp": 49, "fp": 9, "tn": 40, "fn": 8}, {"fold": "fold_4", "regime": "Strong USD downturn", "sharpe": 14.7342, "sortino": 18.1753, "return_pct": 130.67, "equity": 2306.74, "max_dd": 1.81, "win_rate": 91.02, "profit_factor": 20.494, "ic": 0.885, "hit": 90.48, "n": 168, "precision": 0.9176, "recall": 0.907, "f1": 0.9123, "f2": 0.9091, "mcc": 0.8214, "accuracy": 0.9107, "tp": 78, "fp": 7, "tn": 75, "fn": 8}, {"fold": "fold_5", "regime": "Low-vol plateau", "sharpe": 15.3094, "sortino": 69.6579, "return_pct": 44.26, "equity": 1442.62, "max_dd": 0.23, "win_rate": 85.19, "profit_factor": 22.953, "ic": 0.909, "hit": 85.19, "n": 162, "precision": 0.8514, "recall": 0.8289, "f1": 0.84, "f2": 0.8333, "mcc": 0.7023, "accuracy": 0.8519, "tp": 63, "fp": 11, "tn": 75, "fn": 13}, {"fold": "fold_6", "regime": "EUR crisis downturn", "sharpe": 14.527, "sortino": 43.3909, "return_pct": 95.81, "equity": 1958.11, "max_dd": 0.87, "win_rate": 80.61, "profit_factor": 13.907, "ic": 0.8824, "hit": 80.61, "n": 165, "precision": 0.8169, "recall": 0.7532, "f1": 0.7838, "f2": 0.7652, "mcc": 0.6101, "accuracy": 0.8061, "tp": 58, "fp": 13, "tn": 75, "fn": 19}, {"fold": "fold_7", "regime": "Recent mixed/upturn", "sharpe": 12.2078, "sortino": 16.3554, "return_pct": 77.58, "equity": 1775.84, "max_dd": 1.64, "win_rate": 85.8, "profit_factor": 9.952, "ic": 0.83, "hit": 85.8, "n": 162, "precision": 0.8372, "recall": 0.8889, "f1": 0.8623, "f2": 0.878, "mcc": 0.7174, "accuracy": 0.858, "tp": 72, "fp": 14, "tn": 67, "fn": 9}], "val_sharpe": 7.7999, "val_psr": 1.0, "val_equity": 5224.98, "val_sortino": 9.7056, "val_return_pct": 422.5, "val_max_dd": 16.3, "val_win_rate": 74.44, "val_profit_factor": 3.894, "val_ic": 0.681, "val_hit": 73.96, "val_precision": 0.7017, "val_recall": 0.8055, "val_f1": 0.75, "val_f2": 0.7823, "val_mcc": 0.4968, "val_accuracy": 0.7448, "val_per_window": [{"fold": "fold_1", "regime": "Pre-crisis upturn + GFC onset", "sharpe": 2.6366, "sortino": 5.1893, "return_pct": 6.71, "equity": 1067.1, "max_dd": 2.35, "win_rate": 49.07, "profit_factor": 1.55, "ic": 0.067, "hit": 48.62, "n": 109, "precision": 0.4947, "recall": 0.8545, "f1": 0.6267, "f2": 0.746, "mcc": -0.0513, "accuracy": 0.4862, "tp": 47, "fp": 48, "tn": 6, "fn": 8}, {"fold": "fold_2", "regime": "Post-crash recovery", "sharpe": -2.4657, "sortino": -3.8073, "return_pct": -11.4, "equity": 885.98, "max_dd": 16.3, "win_rate": 45.37, "profit_factor": 0.677, "ic": -0.0962, "hit": 45.37, "n": 108, "precision": 0.5357, "recall": 0.4762, "f1": 0.5042, "f2": 0.487, "mcc": -0.1002, "accuracy": 0.4537, "tp": 30, "fp": 26, "tn": 19, "fn": 33}, {"fold": "fold_3", "regime": "Eurozone debt plateau", "sharpe": 15.2605, "sortino": 41.5373, "return_pct": 55.77, "equity": 1557.67, "max_dd": 0.64, "win_rate": 85.32, "profit_factor": 17.582, "ic": 0.8554, "hit": 83.78, "n": 111, "precision": 0.7818, "recall": 0.9149, "f1": 0.8431, "f2": 0.8848, "mcc": 0.7188, "accuracy": 0.8559, "tp": 43, "fp": 12, "tn": 52, "fn": 4}, {"fold": "fold_4", "regime": "Strong USD downturn", "sharpe": 15.5256, "sortino": 49.1466, "return_pct": 46.88, "equity": 1468.78, "max_dd": 0.64, "win_rate": 87.16, "profit_factor": 23.335, "ic": 0.9275, "hit": 86.36, "n": 110, "precision": 0.8837, "recall": 0.8085, "f1": 0.8444, "f2": 0.8225, "mcc": 0.7392, "accuracy": 0.8727, "tp": 38, "fp": 5, "tn": 58, "fn": 9}, {"fold": "fold_5", "regime": "Low-vol plateau", "sharpe": 15.2574, "sortino": 75.2179, "return_pct": 44.19, "equity": 1441.91, "max_dd": 0.25, "win_rate": 83.93, "profit_factor": 22.203, "ic": 0.9188, "hit": 83.93, "n": 112, "precision": 0.8182, "recall": 0.8491, "f1": 0.8333, "f2": 0.8427, "mcc": 0.6787, "accuracy": 0.8393, "tp": 45, "fp": 10, "tn": 49, "fn": 8}, {"fold": "fold_6", "regime": "EUR crisis downturn", "sharpe": 15.8953, "sortino": 107.2037, "return_pct": 29.26, "equity": 1292.6, "max_dd": 0.15, "win_rate": 87.85, "profit_factor": 35.269, "ic": 0.9278, "hit": 87.04, "n": 108, "precision": 0.8269, "recall": 0.9149, "f1": 0.8687, "f2": 0.8958, "mcc": 0.7614, "accuracy": 0.8796, "tp": 43, "fp": 9, "tn": 52, "fn": 4}, {"fold": "fold_7", "regime": "Recent mixed/upturn", "sharpe": 14.8198, "sortino": 55.5919, "return_pct": 29.61, "equity": 1296.06, "max_dd": 0.34, "win_rate": 81.82, "profit_factor": 14.435, "ic": 0.8778, "hit": 81.82, "n": 110, "precision": 0.7619, "recall": 0.9057, "f1": 0.8276, "f2": 0.8727, "mcc": 0.649, "accuracy": 0.8182, "tp": 48, "fp": 15, "tn": 42, "fn": 5}], "train_sharpe": 10.6159, "train_psr": 1.0, "train_equity": 46935508.0, "train_sortino": 81.2664, "train_return_pct": 4693450.8, "train_max_dd": 0.53, "train_win_rate": 91.09, "train_profit_factor": 54.435, "train_ic": 0.9512, "train_hit": 90.72, "train_precision": 0.9044, "train_recall": 0.9207, "train_f1": 0.9125, "train_f2": 0.9174, "train_mcc": 0.8183, "train_accuracy": 0.9092, "train_per_window": [{"fold": "all_train", "regime": "Training data", "sharpe": 10.6159, "sortino": 81.2664, "return_pct": 4693450.8, "equity": 46935508.0, "max_dd": 0.53, "win_rate": 91.09, "profit_factor": 54.435, "ic": 0.9512, "hit": 90.72, "n": 2478, "precision": 0.9044, "recall": 0.9207, "f1": 0.9125, "f2": 0.9174, "mcc": 0.8183, "accuracy": 0.9092, "tp": 1173, "fp": 124, "tn": 1080, "fn": 101}], "experiment_num": 187, "status": "DISCARD"}
{"backbone": "xgboost", "description": "xgboost: Exp11 reg_lambda=5", "config": {"seq_len": 10, "lr": 0.0003, "batch_size": 32, "epochs": 20, "weight_decay": 1e-05, "patience": 5, "grad_clip": 1.0, "warmup_epochs": 0, "huber_delta": 1.0, "head_dropout": 0.1, "seed": 42, "max_depth": 4, "gbm_lr": 0.01, "het_loss": false}, "composite": 7.7601, "test_pos_folds": 7, "val_pos_folds": 6, "val_loss": 0.0, "elapsed_sec": 86.9, "timestamp": "2026-04-21T06:18:36", "sharpe": 7.8601, "psr": 1.0, "equity": 18650.4, "sortino": 7.6462, "return_pct": 1765.04, "max_dd": 7.54, "win_rate": 79.05, "profit_factor": 4.725, "ic": 0.682, "hit": 78.73, "precision": 0.8151, "recall": 0.7422, "f1": 0.7769, "f2": 0.7557, "mcc": 0.5804, "accuracy": 0.7893, "per_window": [{"fold": "fold_1", "regime": "Pre-crisis upturn + GFC onset", "sharpe": 0.1917, "sortino": 0.2067, "return_pct": 0.75, "equity": 1007.49, "max_dd": 7.54, "win_rate": 54.9, "profit_factor": 1.046, "ic": 0.2682, "hit": 54.37, "n": 103, "precision": 0.7333, "recall": 0.2075, "f1": 0.3235, "f2": 0.2423, "mcc": 0.1807, "accuracy": 0.5534, "tp": 11, "fp": 4, "tn": 46, "fn": 42}, {"fold": "fold_2", "regime": "Post-crash recovery", "sharpe": 2.2866, "sortino": 4.2367, "return_pct": 11.18, "equity": 1111.76, "max_dd": 5.33, "win_rate": 56.07, "profit_factor": 1.431, "ic": 0.0635, "hit": 56.07, "n": 107, "precision": 0.54, "recall": 0.5294, "f1": 0.5347, "f2": 0.5315, "mcc": 0.1188, "accuracy": 0.5607, "tp": 27, "fp": 23, "tn": 33, "fn": 24}, {"fold": "fold_3", "regime": "Eurozone debt plateau", "sharpe": 14.2841, "sortino": 23.8993, "return_pct": 45.56, "equity": 1455.64, "max_dd": 1.32, "win_rate": 84.62, "profit_factor": 11.003, "ic": 0.7503, "hit": 83.02, "n": 106, "precision": 0.8421, "recall": 0.8421, "f1": 0.8421, "f2": 0.8421, "mcc": 0.6584, "accuracy": 0.8302, "tp": 48, "fp": 9, "tn": 40, "fn": 9}, {"fold": "fold_4", "regime": "Strong USD downturn", "sharpe": 14.3348, "sortino": 18.3618, "return_pct": 127.82, "equity": 2278.16, "max_dd": 1.81, "win_rate": 90.42, "profit_factor": 17.778, "ic": 0.8761, "hit": 89.88, "n": 168, "precision": 0.9268, "recall": 0.8837, "f1": 0.9048, "f2": 0.892, "mcc": 0.8106, "accuracy": 0.9048, "tp": 76, "fp": 6, "tn": 76, "fn": 10}, {"fold": "fold_5", "regime": "Low-vol plateau", "sharpe": 15.3677, "sortino": 70.0515, "return_pct": 44.37, "equity": 1443.66, "max_dd": 0.23, "win_rate": 85.19, "profit_factor": 23.481, "ic": 0.9033, "hit": 85.19, "n": 162, "precision": 0.8421, "recall": 0.8421, "f1": 0.8421, "f2": 0.8421, "mcc": 0.7026, "accuracy": 0.8519, "tp": 64, "fp": 12, "tn": 74, "fn": 12}, {"fold": "fold_6", "regime": "EUR crisis downturn", "sharpe": 14.8522, "sortino": 59.1985, "return_pct": 97.4, "equity": 1974.04, "max_dd": 0.43, "win_rate": 81.21, "profit_factor": 15.158, "ic": 0.882, "hit": 81.21, "n": 165, "precision": 0.8026, "recall": 0.7922, "f1": 0.7974, "f2": 0.7943, "mcc": 0.6223, "accuracy": 0.8121, "tp": 61, "fp": 15, "tn": 73, "fn": 16}, {"fold": "fold_7", "regime": "Recent mixed/upturn", "sharpe": 11.9456, "sortino": 14.8836, "return_pct": 76.19, "equity": 1761.9, "max_dd": 1.64, "win_rate": 85.8, "profit_factor": 9.321, "ic": 0.8226, "hit": 85.8, "n": 162, "precision": 0.8537, "recall": 0.8642, "f1": 0.8589, "f2": 0.8621, "mcc": 0.7161, "accuracy": 0.858, "tp": 70, "fp": 12, "tn": 69, "fn": 11}], "val_sharpe": 7.951, "val_psr": 1.0, "val_equity": 5361.49, "val_sortino": 10.0084, "val_return_pct": 436.15, "val_max_dd": 13.01, "val_win_rate": 74.18, "val_profit_factor": 4.007, "val_ic": 0.6819, "val_hit": 73.7, "val_precision": 0.7022, "val_recall": 0.7945, "val_f1": 0.7455, "val_f2": 0.7742, "val_mcc": 0.4901, "val_accuracy": 0.7422, "val_per_window": [{"fold": "fold_1", "regime": "Pre-crisis upturn + GFC onset", "sharpe": 2.4874, "sortino": 4.6043, "return_pct": 6.32, "equity": 1063.24, "max_dd": 2.99, "win_rate": 49.07, "profit_factor": 1.512, "ic": 0.0042, "hit": 48.62, "n": 109, "precision": 0.4945, "recall": 0.8182, "f1": 0.6164, "f2": 0.7235, "mcc": -0.0453, "accuracy": 0.4862, "tp": 45, "fp": 46, "tn": 8, "fn": 10}, {"fold": "fold_2", "regime": "Post-crash recovery", "sharpe": -1.7209, "sortino": -2.6664, "return_pct": -8.23, "equity": 917.75, "max_dd": 13.01, "win_rate": 47.22, "profit_factor": 0.762, "ic": -0.0656, "hit": 47.22, "n": 108, "precision": 0.5517, "recall": 0.5079, "f1": 0.5289, "f2": 0.5161, "mcc": -0.0691, "accuracy": 0.4722, "tp": 32, "fp": 26, "tn": 19, "fn": 31}, {"fold": "fold_3", "regime": "Eurozone debt plateau", "sharpe": 15.2555, "sortino": 41.6013, "return_pct": 55.75, "equity": 1557.55, "max_dd": 0.64, "win_rate": 86.24, "profit_factor": 17.556, "ic": 0.8488, "hit": 84.68, "n": 111, "precision": 0.7963, "recall": 0.9149, "f1": 0.8515, "f2": 0.8884, "mcc": 0.7345, "accuracy": 0.8649, "tp": 43, "fp": 11, "tn": 53, "fn": 4}, {"fold": "fold_4", "regime": "Strong USD downturn", "sharpe": 15.4774, "sortino": 49.7788, "return_pct": 46.79, "equity": 1467.88, "max_dd": 0.64, "win_rate": 86.24, "profit_factor": 22.911, "ic": 0.9261, "hit": 85.45, "n": 110, "precision": 0.881, "recall": 0.7872, "f1": 0.8315, "f2": 0.8043, "mcc": 0.7208, "accuracy": 0.8636, "tp": 37, "fp": 5, "tn": 58, "fn": 10}, {"fold": "fold_5", "regime": "Low-vol plateau", "sharpe": 15.0602, "sortino": 76.4187, "return_pct": 43.83, "equity": 1438.33, "max_dd": 0.25, "win_rate": 83.04, "profit_factor": 20.646, "ic": 0.9169, "hit": 83.04, "n": 112, "precision": 0.8036, "recall": 0.8491, "f1": 0.8257, "f2": 0.8396, "mcc": 0.6617, "accuracy": 0.8304, "tp": 45, "fp": 11, "tn": 48, "fn": 8}, {"fold": "fold_6", "regime": "EUR crisis downturn", "sharpe": 15.4214, "sortino": 107.4093, "return_pct": 28.75, "equity": 1287.54, "max_dd": 0.15, "win_rate": 85.05, "profit_factor": 27.765, "ic": 0.9222, "hit": 84.26, "n": 108, "precision": 0.8039, "recall": 0.8723, "f1": 0.8367, "f2": 0.8577, "mcc": 0.7035, "accuracy": 0.8519, "tp": 41, "fp": 10, "tn": 51, "fn": 6}, {"fold": "fold_7", "regime": "Recent mixed/upturn", "sharpe": 14.9572, "sortino": 56.163, "return_pct": 29.77, "equity": 1297.72, "max_dd": 0.34, "win_rate": 81.82, "profit_factor": 14.963, "ic": 0.8748, "hit": 81.82, "n": 110, "precision": 0.7705, "recall": 0.8868, "f1": 0.8246, "f2": 0.8608, "mcc": 0.6446, "accuracy": 0.8182, "tp": 47, "fp": 14, "tn": 43, "fn": 6}], "train_sharpe": 10.6086, "train_psr": 1.0, "train_equity": 46694892.0, "train_sortino": 83.0623, "train_return_pct": 4669389.2, "train_max_dd": 0.53, "train_win_rate": 90.92, "train_profit_factor": 53.741, "train_ic": 0.9492, "train_hit": 90.56, "train_precision": 0.9017, "train_recall": 0.9215, "train_f1": 0.9115, "train_f2": 0.9175, "train_mcc": 0.8159, "train_accuracy": 0.908, "train_per_window": [{"fold": "all_train", "regime": "Training data", "sharpe": 10.6086, "sortino": 83.0623, "return_pct": 4669389.2, "equity": 46694892.0, "max_dd": 0.53, "win_rate": 90.92, "profit_factor": 53.741, "ic": 0.9492, "hit": 90.56, "n": 2478, "precision": 0.9017, "recall": 0.9215, "f1": 0.9115, "f2": 0.9175, "mcc": 0.8159, "accuracy": 0.908, "tp": 1174, "fp": 128, "tn": 1076, "fn": 100}], "experiment_num": 188, "status": "DISCARD"}
{"backbone": "xgboost", "description": "xgboost: Exp12 reg_lambda=10", "config": {"seq_len": 10, "lr": 0.0003, "batch_size": 32, "epochs": 20, "weight_decay": 1e-05, "patience": 5, "grad_clip": 1.0, "warmup_epochs": 0, "huber_delta": 1.0, "head_dropout": 0.1, "seed": 42, "max_depth": 4, "gbm_lr": 0.01, "het_loss": false}, "composite": 7.7601, "test_pos_folds": 7, "val_pos_folds": 6, "val_loss": 0.0, "elapsed_sec": 84.7, "timestamp": "2026-04-21T06:20:11", "sharpe": 7.8601, "psr": 1.0, "equity": 18650.4, "sortino": 7.6462, "return_pct": 1765.04, "max_dd": 7.54, "win_rate": 79.05, "profit_factor": 4.725, "ic": 0.682, "hit": 78.73, "precision": 0.8151, "recall": 0.7422, "f1": 0.7769, "f2": 0.7557, "mcc": 0.5804, "accuracy": 0.7893, "per_window": [{"fold": "fold_1", "regime": "Pre-crisis upturn + GFC onset", "sharpe": 0.1917, "sortino": 0.2067, "return_pct": 0.75, "equity": 1007.49, "max_dd": 7.54, "win_rate": 54.9, "profit_factor": 1.046, "ic": 0.2682, "hit": 54.37, "n": 103, "precision": 0.7333, "recall": 0.2075, "f1": 0.3235, "f2": 0.2423, "mcc": 0.1807, "accuracy": 0.5534, "tp": 11, "fp": 4, "tn": 46, "fn": 42}, {"fold": "fold_2", "regime": "Post-crash recovery", "sharpe": 2.2866, "sortino": 4.2367, "return_pct": 11.18, "equity": 1111.76, "max_dd": 5.33, "win_rate": 56.07, "profit_factor": 1.431, "ic": 0.0635, "hit": 56.07, "n": 107, "precision": 0.54, "recall": 0.5294, "f1": 0.5347, "f2": 0.5315, "mcc": 0.1188, "accuracy": 0.5607, "tp": 27, "fp": 23, "tn": 33, "fn": 24}, {"fold": "fold_3", "regime": "Eurozone debt plateau", "sharpe": 14.2841, "sortino": 23.8993, "return_pct": 45.56, "equity": 1455.64, "max_dd": 1.32, "win_rate": 84.62, "profit_factor": 11.003, "ic": 0.7503, "hit": 83.02, "n": 106, "precision": 0.8421, "recall": 0.8421, "f1": 0.8421, "f2": 0.8421, "mcc": 0.6584, "accuracy": 0.8302, "tp": 48, "fp": 9, "tn": 40, "fn": 9}, {"fold": "fold_4", "regime": "Strong USD downturn", "sharpe": 14.3348, "sortino": 18.3618, "return_pct": 127.82, "equity": 2278.16, "max_dd": 1.81, "win_rate": 90.42, "profit_factor": 17.778, "ic": 0.8761, "hit": 89.88, "n": 168, "precision": 0.9268, "recall": 0.8837, "f1": 0.9048, "f2": 0.892, "mcc": 0.8106, "accuracy": 0.9048, "tp": 76, "fp": 6, "tn": 76, "fn": 10}, {"fold": "fold_5", "regime": "Low-vol plateau", "sharpe": 15.3677, "sortino": 70.0515, "return_pct": 44.37, "equity": 1443.66, "max_dd": 0.23, "win_rate": 85.19, "profit_factor": 23.481, "ic": 0.9033, "hit": 85.19, "n": 162, "precision": 0.8421, "recall": 0.8421, "f1": 0.8421, "f2": 0.8421, "mcc": 0.7026, "accuracy": 0.8519, "tp": 64, "fp": 12, "tn": 74, "fn": 12}, {"fold": "fold_6", "regime": "EUR crisis downturn", "sharpe": 14.8522, "sortino": 59.1985, "return_pct": 97.4, "equity": 1974.04, "max_dd": 0.43, "win_rate": 81.21, "profit_factor": 15.158, "ic": 0.882, "hit": 81.21, "n": 165, "precision": 0.8026, "recall": 0.7922, "f1": 0.7974, "f2": 0.7943, "mcc": 0.6223, "accuracy": 0.8121, "tp": 61, "fp": 15, "tn": 73, "fn": 16}, {"fold": "fold_7", "regime": "Recent mixed/upturn", "sharpe": 11.9456, "sortino": 14.8836, "return_pct": 76.19, "equity": 1761.9, "max_dd": 1.64, "win_rate": 85.8, "profit_factor": 9.321, "ic": 0.8226, "hit": 85.8, "n": 162, "precision": 0.8537, "recall": 0.8642, "f1": 0.8589, "f2": 0.8621, "mcc": 0.7161, "accuracy": 0.858, "tp": 70, "fp": 12, "tn": 69, "fn": 11}], "val_sharpe": 7.951, "val_psr": 1.0, "val_equity": 5361.49, "val_sortino": 10.0084, "val_return_pct": 436.15, "val_max_dd": 13.01, "val_win_rate": 74.18, "val_profit_factor": 4.007, "val_ic": 0.6819, "val_hit": 73.7, "val_precision": 0.7022, "val_recall": 0.7945, "val_f1": 0.7455, "val_f2": 0.7742, "val_mcc": 0.4901, "val_accuracy": 0.7422, "val_per_window": [{"fold": "fold_1", "regime": "Pre-crisis upturn + GFC onset", "sharpe": 2.4874, "sortino": 4.6043, "return_pct": 6.32, "equity": 1063.24, "max_dd": 2.99, "win_rate": 49.07, "profit_factor": 1.512, "ic": 0.0042, "hit": 48.62, "n": 109, "precision": 0.4945, "recall": 0.8182, "f1": 0.6164, "f2": 0.7235, "mcc": -0.0453, "accuracy": 0.4862, "tp": 45, "fp": 46, "tn": 8, "fn": 10}, {"fold": "fold_2", "regime": "Post-crash recovery", "sharpe": -1.7209, "sortino": -2.6664, "return_pct": -8.23, "equity": 917.75, "max_dd": 13.01, "win_rate": 47.22, "profit_factor": 0.762, "ic": -0.0656, "hit": 47.22, "n": 108, "precision": 0.5517, "recall": 0.5079, "f1": 0.5289, "f2": 0.5161, "mcc": -0.0691, "accuracy": 0.4722, "tp": 32, "fp": 26, "tn": 19, "fn": 31}, {"fold": "fold_3", "regime": "Eurozone debt plateau", "sharpe": 15.2555, "sortino": 41.6013, "return_pct": 55.75, "equity": 1557.55, "max_dd": 0.64, "win_rate": 86.24, "profit_factor": 17.556, "ic": 0.8488, "hit": 84.68, "n": 111, "precision": 0.7963, "recall": 0.9149, "f1": 0.8515, "f2": 0.8884, "mcc": 0.7345, "accuracy": 0.8649, "tp": 43, "fp": 11, "tn": 53, "fn": 4}, {"fold": "fold_4", "regime": "Strong USD downturn", "sharpe": 15.4774, "sortino": 49.7788, "return_pct": 46.79, "equity": 1467.88, "max_dd": 0.64, "win_rate": 86.24, "profit_factor": 22.911, "ic": 0.9261, "hit": 85.45, "n": 110, "precision": 0.881, "recall": 0.7872, "f1": 0.8315, "f2": 0.8043, "mcc": 0.7208, "accuracy": 0.8636, "tp": 37, "fp": 5, "tn": 58, "fn": 10}, {"fold": "fold_5", "regime": "Low-vol plateau", "sharpe": 15.0602, "sortino": 76.4187, "return_pct": 43.83, "equity": 1438.33, "max_dd": 0.25, "win_rate": 83.04, "profit_factor": 20.646, "ic": 0.9169, "hit": 83.04, "n": 112, "precision": 0.8036, "recall": 0.8491, "f1": 0.8257, "f2": 0.8396, "mcc": 0.6617, "accuracy": 0.8304, "tp": 45, "fp": 11, "tn": 48, "fn": 8}, {"fold": "fold_6", "regime": "EUR crisis downturn", "sharpe": 15.4214, "sortino": 107.4093, "return_pct": 28.75, "equity": 1287.54, "max_dd": 0.15, "win_rate": 85.05, "profit_factor": 27.765, "ic": 0.9222, "hit": 84.26, "n": 108, "precision": 0.8039, "recall": 0.8723, "f1": 0.8367, "f2": 0.8577, "mcc": 0.7035, "accuracy": 0.8519, "tp": 41, "fp": 10, "tn": 51, "fn": 6}, {"fold": "fold_7", "regime": "Recent mixed/upturn", "sharpe": 14.9572, "sortino": 56.163, "return_pct": 29.77, "equity": 1297.72, "max_dd": 0.34, "win_rate": 81.82, "profit_factor": 14.963, "ic": 0.8748, "hit": 81.82, "n": 110, "precision": 0.7705, "recall": 0.8868, "f1": 0.8246, "f2": 0.8608, "mcc": 0.6446, "accuracy": 0.8182, "tp": 47, "fp": 14, "tn": 43, "fn": 6}], "train_sharpe": 10.6086, "train_psr": 1.0, "train_equity": 46694892.0, "train_sortino": 83.0623, "train_return_pct": 4669389.2, "train_max_dd": 0.53, "train_win_rate": 90.92, "train_profit_factor": 53.741, "train_ic": 0.9492, "train_hit": 90.56, "train_precision": 0.9017, "train_recall": 0.9215, "train_f1": 0.9115, "train_f2": 0.9175, "train_mcc": 0.8159, "train_accuracy": 0.908, "train_per_window": [{"fold": "all_train", "regime": "Training data", "sharpe": 10.6086, "sortino": 83.0623, "return_pct": 4669389.2, "equity": 46694892.0, "max_dd": 0.53, "win_rate": 90.92, "profit_factor": 53.741, "ic": 0.9492, "hit": 90.56, "n": 2478, "precision": 0.9017, "recall": 0.9215, "f1": 0.9115, "f2": 0.9175, "mcc": 0.8159, "accuracy": 0.908, "tp": 1174, "fp": 128, "tn": 1076, "fn": 100}], "experiment_num": 189, "status": "DISCARD"}
