{"backbone": "lightgbm", "description": "lgbm: Exp8 seq_len=20 (mirror XGB champ)", "config": {"seq_len": 20, "lr": 0.0003, "batch_size": 32, "epochs": 20, "weight_decay": 1e-05, "patience": 5, "grad_clip": 1.0, "warmup_epochs": 0, "huber_delta": 1.0, "head_dropout": 0.1, "seed": 42, "max_depth": 4, "gbm_lr": 0.01, "het_loss": false}, "composite": 7.0349, "test_pos_folds": 5, "val_pos_folds": 5, "val_loss": 0.0, "elapsed_sec": 66.5, "timestamp": "2026-04-21T07:06:48", "sharpe": 7.4349, "psr": 1.0, "equity": 13988.93, "sortino": 7.578, "return_pct": 1298.89, "max_dd": 7.54, "win_rate": 76.86, "profit_factor": 4.342, "ic": 0.6563, "hit": 76.52, "precision": 0.7757, "recall": 0.7353, "f1": 0.7549, "f2": 0.743, "mcc": 0.5327, "accuracy": 0.7663, "per_window": [{"fold": "fold_1", "regime": "Pre-crisis upturn + GFC onset", "sharpe": -0.0043, "sortino": -0.0048, "return_pct": -0.74, "equity": 992.6, "max_dd": 7.54, "win_rate": 48.91, "profit_factor": 0.999, "ic": -0.0751, "hit": 48.39, "n": 93, "precision": 0.5, "recall": 0.4375, "f1": 0.4667, "f2": 0.4487, "mcc": -0.0293, "accuracy": 0.4839, "tp": 21, "fp": 21, "tn": 24, "fn": 27}, {"fold": "fold_2", "regime": "Post-crash recovery", "sharpe": -0.7085, "sortino": -1.2815, "return_pct": -3.35, "equity": 966.54, "max_dd": 6.93, "win_rate": 45.36, "profit_factor": 0.895, "ic": -0.1322, "hit": 45.36, "n": 97, "precision": 0.4167, "recall": 0.3191, "f1": 0.3614, "f2": 0.3348, "mcc": -0.1043, "accuracy": 0.4536, "tp": 15, "fp": 21, "tn": 29, "fn": 32}, {"fold": "fold_3", "regime": "Eurozone debt plateau", "sharpe": 13.3697, "sortino": 21.8067, "return_pct": 39.82, "equity": 1398.17, "max_dd": 1.38, "win_rate": 84.04, "profit_factor": 9.114, "ic": 0.7585, "hit": 82.29, "n": 96, "precision": 0.8511, "recall": 0.8, "f1": 0.8247, "f2": 0.8097, "mcc": 0.6474, "accuracy": 0.8229, "tp": 40, "fp": 7, "tn": 39, "fn": 10}, {"fold": "fold_4", "regime": "Strong USD downturn", "sharpe": 14.8275, "sortino": 44.5796, "return_pct": 122.61, "equity": 2226.05, "max_dd": 0.84, "win_rate": 90.45, "profit_factor": 22.064, "ic": 0.8892, "hit": 89.87, "n": 158, "precision": 0.9211, "recall": 0.8861, "f1": 0.9032, "f2": 0.8929, "mcc": 0.8107, "accuracy": 0.9051, "tp": 70, "fp": 6, "tn": 73, "fn": 9}, {"fold": "fold_5", "regime": "Low-vol plateau", "sharpe": 15.2321, "sortino": 73.1151, "return_pct": 40.03, "equity": 1400.28, "max_dd": 0.23, "win_rate": 84.21, "profit_factor": 21.671, "ic": 0.9081, "hit": 84.21, "n": 152, "precision": 0.8194, "recall": 0.8429, "f1": 0.831, "f2": 0.8381, "mcc": 0.6831, "accuracy": 0.8421, "tp": 59, "fp": 13, "tn": 69, "fn": 11}, {"fold": "fold_6", "regime": "EUR crisis downturn", "sharpe": 14.2398, "sortino": 44.1305, "return_pct": 88.54, "equity": 1885.41, "max_dd": 1.01, "win_rate": 79.35, "profit_factor": 12.835, "ic": 0.8618, "hit": 79.35, "n": 155, "precision": 0.803, "recall": 0.7361, "f1": 0.7681, "f2": 0.7486, "mcc": 0.5845, "accuracy": 0.7935, "tp": 53, "fp": 13, "tn": 70, "fn": 19}, {"fold": "fold_7", "regime": "Recent mixed/upturn", "sharpe": 13.4952, "sortino": 18.5872, "return_pct": 77.45, "equity": 1774.51, "max_dd": 1.64, "win_rate": 85.53, "profit_factor": 13.713, "ic": 0.8635, "hit": 85.53, "n": 152, "precision": 0.8375, "recall": 0.8816, "f1": 0.859, "f2": 0.8724, "mcc": 0.7115, "accuracy": 0.8553, "tp": 67, "fp": 13, "tn": 63, "fn": 9}], "val_sharpe": 7.4789, "val_psr": 1.0, "val_equity": 4299.13, "val_sortino": 10.1014, "val_return_pct": 329.91, "val_max_dd": 17.1, "val_win_rate": 73.88, "val_profit_factor": 3.654, "val_ic": 0.6582, "val_hit": 73.35, "val_precision": 0.6968, "val_recall": 0.7939, "val_f1": 0.7422, "val_f2": 0.7724, "val_mcc": 0.4849, "val_accuracy": 0.7393, "val_per_window": [{"fold": "fold_1", "regime": "Pre-crisis upturn + GFC onset", "sharpe": -1.3698, "sortino": -2.1824, "return_pct": -3.21, "equity": 967.88, "max_dd": 6.66, "win_rate": 42.86, "profit_factor": 0.796, "ic": -0.0201, "hit": 42.42, "n": 99, "precision": 0.4487, "recall": 0.7143, "f1": 0.5512, "f2": 0.6387, "mcc": -0.1782, "accuracy": 0.4242, "tp": 35, "fp": 43, "tn": 7, "fn": 14}, {"fold": "fold_2", "regime": "Post-crash recovery", "sharpe": -2.1127, "sortino": -3.4269, "return_pct": -8.67, "equity": 913.29, "max_dd": 14.45, "win_rate": 42.86, "profit_factor": 0.714, "ic": -0.1264, "hit": 42.86, "n": 98, "precision": 0.5098, "recall": 0.4561, "f1": 0.4815, "f2": 0.4659, "mcc": -0.1517, "accuracy": 0.4286, "tp": 26, "fp": 25, "tn": 16, "fn": 31}, {"fold": "fold_3", "regime": "Eurozone debt plateau", "sharpe": 15.3625, "sortino": 31.0307, "return_pct": 51.83, "equity": 1518.26, "max_dd": 0.7, "win_rate": 86.87, "profit_factor": 18.278, "ic": 0.8624, "hit": 85.15, "n": 101, "precision": 0.8, "recall": 0.9, "f1": 0.8471, "f2": 0.878, "mcc": 0.7404, "accuracy": 0.8713, "tp": 36, "fp": 9, "tn": 52, "fn": 4}, {"fold": "fold_4", "regime": "Strong USD downturn", "sharpe": 15.8315, "sortino": 45.5522, "return_pct": 44.25, "equity": 1442.53, "max_dd": 0.59, "win_rate": 89.9, "profit_factor": 22.836, "ic": 0.9327, "hit": 89.0, "n": 100, "precision": 0.9048, "recall": 0.8636, "f1": 0.8837, "f2": 0.8716, "mcc": 0.7967, "accuracy": 0.9, "tp": 38, "fp": 4, "tn": 52, "fn": 6}, {"fold": "fold_5", "regime": "Low-vol plateau", "sharpe": 14.9482, "sortino": 71.2904, "return_pct": 39.75, "equity": 1397.54, "max_dd": 0.25, "win_rate": 84.31, "profit_factor": 21.5, "ic": 0.9223, "hit": 84.31, "n": 102, "precision": 0.8, "recall": 0.898, "f1": 0.8462, "f2": 0.8765, "mcc": 0.692, "accuracy": 0.8431, "tp": 44, "fp": 11, "tn": 42, "fn": 5}, {"fold": "fold_6", "regime": "EUR crisis downturn", "sharpe": 15.656, "sortino": 61.0619, "return_pct": 26.16, "equity": 1261.63, "max_dd": 0.25, "win_rate": 86.6, "profit_factor": 28.819, "ic": 0.9332, "hit": 85.71, "n": 98, "precision": 0.7843, "recall": 0.9524, "f1": 0.8602, "f2": 0.9132, "mcc": 0.7488, "accuracy": 0.8673, "tp": 40, "fp": 11, "tn": 45, "fn": 2}, {"fold": "fold_7", "regime": "Recent mixed/upturn", "sharpe": 14.189, "sortino": 36.6191, "return_pct": 25.95, "equity": 1259.47, "max_dd": 0.5, "win_rate": 83.0, "profit_factor": 12.268, "ic": 0.8663, "hit": 83.0, "n": 100, "precision": 0.7963, "recall": 0.8776, "f1": 0.835, "f2": 0.86, "mcc": 0.6639, "accuracy": 0.83, "tp": 43, "fp": 11, "tn": 40, "fn": 6}], "train_sharpe": 10.0267, "train_psr": 1.0, "train_equity": 13421754.0, "train_sortino": 59.2061, "train_return_pct": 1342075.4, "train_max_dd": 1.02, "train_win_rate": 88.06, "train_profit_factor": 32.435, "train_ic": 0.9155, "train_hit": 87.66, "train_precision": 0.8703, "train_recall": 0.8971, "train_f1": 0.8835, "train_f2": 0.8916, "train_mcc": 0.7578, "train_accuracy": 0.8789, "train_per_window": [{"fold": "all_train", "regime": "Training data", "sharpe": 10.0267, "sortino": 59.2061, "return_pct": 1342075.4, "equity": 13421754.0, "max_dd": 1.02, "win_rate": 88.06, "profit_factor": 32.435, "ic": 0.9155, "hit": 87.66, "n": 2221, "precision": 0.8703, "recall": 0.8971, "f1": 0.8835, "f2": 0.8916, "mcc": 0.7578, "accuracy": 0.8789, "tp": 1020, "fp": 152, "tn": 932, "fn": 117}], "experiment_num": 211, "status": "DISCARD"}
{"backbone": "lightgbm", "description": "lgbm: Exp9 min_data_in_leaf=50", "config": {"seq_len": 10, "lr": 0.0003, "batch_size": 32, "epochs": 20, "weight_decay": 1e-05, "patience": 5, "grad_clip": 1.0, "warmup_epochs": 0, "huber_delta": 1.0, "head_dropout": 0.1, "seed": 42, "gbm_lr": 0.01, "min_data_in_leaf": 50, "het_loss": false}, "composite": 7.5811, "test_pos_folds": 7, "val_pos_folds": 6, "val_loss": 0.0, "elapsed_sec": 50.2, "timestamp": "2026-04-21T07:07:48", "sharpe": 7.7666, "psr": 1.0, "equity": 18130.83, "sortino": 7.9569, "return_pct": 1713.08, "max_dd": 7.54, "win_rate": 77.3, "profit_factor": 4.625, "ic": 0.669, "hit": 76.98, "precision": 0.7937, "recall": 0.7277, "f1": 0.7592, "f2": 0.74, "mcc": 0.545, "accuracy": 0.7718, "per_window": [{"fold": "fold_1", "regime": "Pre-crisis upturn + GFC onset", "sharpe": 0.0383, "sortino": 0.0451, "return_pct": -0.44, "equity": 995.64, "max_dd": 7.54, "win_rate": 45.1, "profit_factor": 1.009, "ic": 0.0983, "hit": 44.66, "n": 103, "precision": 0.4483, "recall": 0.2453, "f1": 0.3171, "f2": 0.2697, "mcc": -0.083, "accuracy": 0.4563, "tp": 13, "fp": 16, "tn": 34, "fn": 40}, {"fold": "fold_2", "regime": "Post-crash recovery", "sharpe": 0.822, "sortino": 1.4662, "return_pct": 3.74, "equity": 1037.38, "max_dd": 5.78, "win_rate": 50.47, "profit_factor": 1.137, "ic": 0.0034, "hit": 50.47, "n": 107, "precision": 0.4762, "recall": 0.3922, "f1": 0.4301, "f2": 0.4065, "mcc": -0.0007, "accuracy": 0.5047, "tp": 20, "fp": 22, "tn": 34, "fn": 31}, {"fold": "fold_3", "regime": "Eurozone debt plateau", "sharpe": 15.1601, "sortino": 22.7287, "return_pct": 47.36, "equity": 1473.6, "max_dd": 1.32, "win_rate": 87.5, "profit_factor": 13.335, "ic": 0.8263, "hit": 85.85, "n": 106, "precision": 0.9038, "recall": 0.8246, "f1": 0.8624, "f2": 0.8393, "mcc": 0.7206, "accuracy": 0.8585, "tp": 47, "fp": 5, "tn": 44, "fn": 10}, {"fold": "fold_4", "regime": "Strong USD downturn", "sharpe": 14.6852, "sortino": 41.9029, "return_pct": 130.33, "equity": 2303.28, "max_dd": 0.82, "win_rate": 89.82, "profit_factor": 20.124, "ic": 0.8637, "hit": 89.29, "n": 168, "precision": 0.9259, "recall": 0.8721, "f1": 0.8982, "f2": 0.8824, "mcc": 0.7992, "accuracy": 0.8988, "tp": 75, "fp": 6, "tn": 76, "fn": 11}, {"fold": "fold_5", "regime": "Low-vol plateau", "sharpe": 14.8611, "sortino": 53.4324, "return_pct": 43.44, "equity": 1434.43, "max_dd": 0.35, "win_rate": 83.33, "profit_factor": 19.471, "ic": 0.9022, "hit": 83.33, "n": 162, "precision": 0.8267, "recall": 0.8158, "f1": 0.8212, "f2": 0.8179, "mcc": 0.6652, "accuracy": 0.8333, "tp": 62, "fp": 13, "tn": 73, "fn": 14}, {"fold": "fold_6", "regime": "EUR crisis downturn", "sharpe": 15.2987, "sortino": 58.8518, "return_pct": 99.53, "equity": 1995.32, "max_dd": 0.46, "win_rate": 83.03, "profit_factor": 17.178, "ic": 0.8595, "hit": 83.03, "n": 165, "precision": 0.8267, "recall": 0.8052, "f1": 0.8158, "f2": 0.8094, "mcc": 0.6587, "accuracy": 0.8303, "tp": 62, "fp": 13, "tn": 75, "fn": 15}, {"fold": "fold_7", "regime": "Recent mixed/upturn", "sharpe": 12.8098, "sortino": 18.5952, "return_pct": 80.7, "equity": 1807.01, "max_dd": 1.64, "win_rate": 83.95, "profit_factor": 11.661, "ic": 0.8269, "hit": 83.95, "n": 162, "precision": 0.8161, "recall": 0.8765, "f1": 0.8452, "f2": 0.8637, "mcc": 0.6809, "accuracy": 0.8395, "tp": 71, "fp": 16, "tn": 65, "fn": 10}], "val_sharpe": 7.6811, "val_psr": 1.0, "val_equity": 5118.94, "val_sortino": 9.6487, "val_return_pct": 411.89, "val_max_dd": 14.19, "val_win_rate": 73.66, "val_profit_factor": 3.808, "val_ic": 0.6519, "val_hit": 73.18, "val_precision": 0.6831, "val_recall": 0.8329, "val_f1": 0.7506, "val_f2": 0.7979, "val_mcc": 0.4886, "val_accuracy": 0.737, "val_per_window": [{"fold": "fold_1", "regime": "Pre-crisis upturn + GFC onset", "sharpe": 0.6843, "sortino": 1.2197, "return_pct": 1.67, "equity": 1016.66, "max_dd": 3.11, "win_rate": 43.52, "profit_factor": 1.12, "ic": -0.053, "hit": 43.12, "n": 109, "precision": 0.4615, "recall": 0.7636, "f1": 0.5753, "f2": 0.6752, "mcc": -0.1936, "accuracy": 0.4312, "tp": 42, "fp": 49, "tn": 5, "fn": 13}, {"fold": "fold_2", "regime": "Post-crash recovery", "sharpe": -1.4838, "sortino": -2.2185, "return_pct": -7.18, "equity": 928.21, "max_dd": 13.8, "win_rate": 47.22, "profit_factor": 0.791, "ic": -0.1951, "hit": 47.22, "n": 108, "precision": 0.5395, "recall": 0.6508, "f1": 0.5899, "f2": 0.625, "mcc": -0.1371, "accuracy": 0.4722, "tp": 41, "fp": 35, "tn": 10, "fn": 22}, {"fold": "fold_3", "regime": "Eurozone debt plateau", "sharpe": 14.3699, "sortino": 31.6085, "return_pct": 53.59, "equity": 1535.89, "max_dd": 0.7, "win_rate": 84.4, "profit_factor": 13.72, "ic": 0.8454, "hit": 82.88, "n": 111, "precision": 0.7778, "recall": 0.8936, "f1": 0.8317, "f2": 0.8678, "mcc": 0.698, "accuracy": 0.8468, "tp": 42, "fp": 12, "tn": 52, "fn": 5}, {"fold": "fold_4", "regime": "Strong USD downturn", "sharpe": 15.0996, "sortino": 51.5102, "return_pct": 46.07, "equity": 1460.69, "max_dd": 0.59, "win_rate": 86.24, "profit_factor": 19.982, "ic": 0.9244, "hit": 85.45, "n": 110, "precision": 0.8333, "recall": 0.8511, "f1": 0.8421, "f2": 0.8475, "mcc": 0.7223, "accuracy": 0.8636, "tp": 40, "fp": 8, "tn": 55, "fn": 7}, {"fold": "fold_5", "regime": "Low-vol plateau", "sharpe": 15.5465, "sortino": 81.166, "return_pct": 44.71, "equity": 1447.07, "max_dd": 0.25, "win_rate": 84.82, "profit_factor": 24.868, "ic": 0.9177, "hit": 84.82, "n": 112, "precision": 0.8214, "recall": 0.8679, "f1": 0.844, "f2": 0.8582, "mcc": 0.6974, "accuracy": 0.8482, "tp": 46, "fp": 10, "tn": 49, "fn": 7}, {"fold": "fold_6", "regime": "EUR crisis downturn", "sharpe": 15.8656, "sortino": 116.6481, "return_pct": 29.23, "equity": 1292.29, "max_dd": 0.14, "win_rate": 85.98, "profit_factor": 34.699, "ic": 0.9266, "hit": 85.19, "n": 108, "precision": 0.7963, "recall": 0.9149, "f1": 0.8515, "f2": 0.8884, "mcc": 0.7284, "accuracy": 0.8611, "tp": 43, "fp": 11, "tn": 50, "fn": 4}, {"fold": "fold_7", "regime": "Recent mixed/upturn", "sharpe": 14.5685, "sortino": 53.3473, "return_pct": 29.3, "equity": 1292.98, "max_dd": 0.37, "win_rate": 82.73, "profit_factor": 13.54, "ic": 0.8826, "hit": 82.73, "n": 110, "precision": 0.7576, "recall": 0.9434, "f1": 0.8403, "f2": 0.8993, "mcc": 0.6759, "accuracy": 0.8273, "tp": 50, "fp": 16, "tn": 41, "fn": 3}], "train_sharpe": 10.5782, "train_psr": 1.0, "train_equity": 45702892.0, "train_sortino": 67.2459, "train_return_pct": 4570189.2, "train_max_dd": 1.47, "train_win_rate": 90.92, "train_profit_factor": 51.02, "train_ic": 0.9493, "train_hit": 90.56, "train_precision": 0.8955, "train_recall": 0.9278, "train_f1": 0.9113, "train_f2": 0.9211, "train_mcc": 0.8146, "train_accuracy": 0.9072, "train_per_window": [{"fold": "all_train", "regime": "Training data", "sharpe": 10.5782, "sortino": 67.2459, "return_pct": 4570189.2, "equity": 45702892.0, "max_dd": 1.47, "win_rate": 90.92, "profit_factor": 51.02, "ic": 0.9493, "hit": 90.56, "n": 2478, "precision": 0.8955, "recall": 0.9278, "f1": 0.9113, "f2": 0.9211, "mcc": 0.8146, "accuracy": 0.9072, "tp": 1182, "fp": 138, "tn": 1066, "fn": 92}], "experiment_num": 212, "status": "DISCARD"}
{"backbone": "lightgbm", "description": "lgbm: Exp10 feature_fraction=0.5 aggressive", "config": {"seq_len": 10, "lr": 0.0003, "batch_size": 32, "epochs": 20, "weight_decay": 1e-05, "patience": 5, "grad_clip": 1.0, "warmup_epochs": 0, "huber_delta": 1.0, "head_dropout": 0.1, "seed": 42, "gbm_lr": 0.01, "feature_fraction": 0.5, "het_loss": false}, "composite": 7.1799, "test_pos_folds": 6, "val_pos_folds": 6, "val_loss": 0.0, "elapsed_sec": 40.6, "timestamp": "2026-04-21T07:08:39", "sharpe": 7.3799, "psr": 1.0, "equity": 16096.18, "sortino": 7.6317, "return_pct": 1509.62, "max_dd": 7.54, "win_rate": 76.99, "profit_factor": 4.238, "ic": 0.6383, "hit": 76.67, "precision": 0.7972, "recall": 0.711, "f1": 0.7516, "f2": 0.7267, "mcc": 0.5379, "accuracy": 0.7677, "per_window": [{"fold": "fold_1", "regime": "Pre-crisis upturn + GFC onset", "sharpe": -0.3125, "sortino": -0.365, "return_pct": -3.09, "equity": 969.06, "max_dd": 7.54, "win_rate": 47.06, "profit_factor": 0.929, "ic": 0.0443, "hit": 46.6, "n": 103, "precision": 0.4615, "recall": 0.2264, "f1": 0.3038, "f2": 0.2521, "mcc": -0.0617, "accuracy": 0.466, "tp": 12, "fp": 14, "tn": 36, "fn": 41}, {"fold": "fold_2", "regime": "Post-crash recovery", "sharpe": 1.052, "sortino": 1.8498, "return_pct": 4.88, "equity": 1048.84, "max_dd": 5.34, "win_rate": 52.34, "profit_factor": 1.179, "ic": -0.0279, "hit": 52.34, "n": 107, "precision": 0.5, "recall": 0.451, "f1": 0.4742, "f2": 0.46, "mcc": 0.0406, "accuracy": 0.5234, "tp": 23, "fp": 23, "tn": 33, "fn": 28}, {"fold": "fold_3", "regime": "Eurozone debt plateau", "sharpe": 12.496, "sortino": 18.8354, "return_pct": 41.49, "equity": 1414.91, "max_dd": 1.38, "win_rate": 82.69, "profit_factor": 7.72, "ic": 0.7881, "hit": 81.13, "n": 106, "precision": 0.8936, "recall": 0.7368, "f1": 0.8077, "f2": 0.7636, "mcc": 0.6371, "accuracy": 0.8113, "tp": 42, "fp": 5, "tn": 44, "fn": 15}, {"fold": "fold_4", "regime": "Strong USD downturn", "sharpe": 14.1892, "sortino": 32.9332, "return_pct": 126.76, "equity": 2267.56, "max_dd": 0.97, "win_rate": 89.22, "profit_factor": 16.93, "ic": 0.8503, "hit": 88.69, "n": 168, "precision": 0.925, "recall": 0.8605, "f1": 0.8916, "f2": 0.8726, "mcc": 0.788, "accuracy": 0.8929, "tp": 74, "fp": 6, "tn": 76, "fn": 12}, {"fold": "fold_5", "regime": "Low-vol plateau", "sharpe": 15.2254, "sortino": 70.9069, "return_pct": 44.11, "equity": 1441.11, "max_dd": 0.23, "win_rate": 83.95, "profit_factor": 22.225, "ic": 0.9086, "hit": 83.95, "n": 162, "precision": 0.8378, "recall": 0.8158, "f1": 0.8267, "f2": 0.8201, "mcc": 0.6775, "accuracy": 0.8395, "tp": 62, "fp": 12, "tn": 74, "fn": 14}, {"fold": "fold_6", "regime": "EUR crisis downturn", "sharpe": 14.5595, "sortino": 41.9026, "return_pct": 95.97, "equity": 1959.72, "max_dd": 0.76, "win_rate": 81.82, "profit_factor": 14.025, "ic": 0.8614, "hit": 81.82, "n": 165, "precision": 0.8133, "recall": 0.7922, "f1": 0.8026, "f2": 0.7963, "mcc": 0.6343, "accuracy": 0.8182, "tp": 61, "fp": 14, "tn": 74, "fn": 16}, {"fold": "fold_7", "regime": "Recent mixed/upturn", "sharpe": 11.684, "sortino": 15.3589, "return_pct": 74.78, "equity": 1747.77, "max_dd": 1.64, "win_rate": 83.95, "profit_factor": 8.747, "ic": 0.7983, "hit": 83.95, "n": 162, "precision": 0.8395, "recall": 0.8395, "f1": 0.8395, "f2": 0.8395, "mcc": 0.679, "accuracy": 0.8395, "tp": 68, "fp": 13, "tn": 68, "fn": 13}], "val_sharpe": 7.5976, "val_psr": 1.0, "val_equity": 5045.24, "val_sortino": 9.4069, "val_return_pct": 404.52, "val_max_dd": 18.49, "val_win_rate": 74.44, "val_profit_factor": 3.749, "val_ic": 0.6513, "val_hit": 73.96, "val_precision": 0.6925, "val_recall": 0.8329, "val_f1": 0.7562, "val_f2": 0.8004, "val_mcc": 0.5025, "val_accuracy": 0.7448, "val_per_window": [{"fold": "fold_1", "regime": "Pre-crisis upturn + GFC onset", "sharpe": 1.3811, "sortino": 2.533, "return_pct": 3.46, "equity": 1034.59, "max_dd": 2.59, "win_rate": 47.22, "profit_factor": 1.257, "ic": -0.0825, "hit": 46.79, "n": 109, "precision": 0.4848, "recall": 0.8727, "f1": 0.6234, "f2": 0.7524, "mcc": -0.1242, "accuracy": 0.4679, "tp": 48, "fp": 51, "tn": 3, "fn": 7}, {"fold": "fold_2", "regime": "Post-crash recovery", "sharpe": -2.7226, "sortino": -4.1824, "return_pct": -12.46, "equity": 875.41, "max_dd": 18.49, "win_rate": 42.59, "profit_factor": 0.65, "ic": -0.1626, "hit": 42.59, "n": 108, "precision": 0.5079, "recall": 0.5079, "f1": 0.5079, "f2": 0.5079, "mcc": -0.181, "accuracy": 0.4259, "tp": 32, "fp": 31, "tn": 14, "fn": 31}, {"fold": "fold_3", "regime": "Eurozone debt plateau", "sharpe": 14.5962, "sortino": 31.0965, "return_pct": 54.16, "equity": 1541.57, "max_dd": 0.7, "win_rate": 84.4, "profit_factor": 14.568, "ic": 0.8486, "hit": 82.88, "n": 111, "precision": 0.7679, "recall": 0.9149, "f1": 0.835, "f2": 0.8811, "mcc": 0.7034, "accuracy": 0.8468, "tp": 43, "fp": 13, "tn": 51, "fn": 4}, {"fold": "fold_4", "regime": "Strong USD downturn", "sharpe": 16.4538, "sortino": 69.1963, "return_pct": 48.54, "equity": 1485.45, "max_dd": 0.39, "win_rate": 88.99, "profit_factor": 35.143, "ic": 0.9281, "hit": 88.18, "n": 110, "precision": 0.8723, "recall": 0.8723, "f1": 0.8723, "f2": 0.8723, "mcc": 0.7771, "accuracy": 0.8909, "tp": 41, "fp": 6, "tn": 57, "fn": 6}, {"fold": "fold_5", "regime": "Low-vol plateau", "sharpe": 15.4238, "sortino": 72.9152, "return_pct": 44.49, "equity": 1444.89, "max_dd": 0.29, "win_rate": 85.71, "profit_factor": 23.674, "ic": 0.9171, "hit": 85.71, "n": 112, "precision": 0.8246, "recall": 0.8868, "f1": 0.8545, "f2": 0.8736, "mcc": 0.7164, "accuracy": 0.8571, "tp": 47, "fp": 10, "tn": 49, "fn": 6}, {"fold": "fold_6", "regime": "EUR crisis downturn", "sharpe": 15.0596, "sortino": 64.1337, "return_pct": 28.35, "equity": 1283.54, "max_dd": 0.25, "win_rate": 85.05, "profit_factor": 23.705, "ic": 0.9238, "hit": 84.26, "n": 108, "precision": 0.7925, "recall": 0.8936, "f1": 0.84, "f2": 0.8714, "mcc": 0.7074, "accuracy": 0.8519, "tp": 42, "fp": 11, "tn": 50, "fn": 5}, {"fold": "fold_7", "regime": "Recent mixed/upturn", "sharpe": 16.1826, "sortino": 59.4734, "return_pct": 31.17, "equity": 1311.69, "max_dd": 0.34, "win_rate": 86.36, "profit_factor": 21.361, "ic": 0.8831, "hit": 86.36, "n": 110, "precision": 0.7969, "recall": 0.9623, "f1": 0.8718, "f2": 0.9239, "mcc": 0.7437, "accuracy": 0.8636, "tp": 51, "fp": 13, "tn": 44, "fn": 2}], "train_sharpe": 10.8051, "train_psr": 1.0, "train_equity": 53573212.0, "train_sortino": 98.2758, "train_return_pct": 5357221.2, "train_max_dd": 0.45, "train_win_rate": 92.79, "train_profit_factor": 81.287, "train_ic": 0.9671, "train_hit": 92.41, "train_precision": 0.9199, "train_recall": 0.9372, "train_f1": 0.9285, "train_f2": 0.9337, "train_mcc": 0.8515, "train_accuracy": 0.9257, "train_per_window": [{"fold": "all_train", "regime": "Training data", "sharpe": 10.8051, "sortino": 98.2758, "return_pct": 5357221.2, "equity": 53573212.0, "max_dd": 0.45, "win_rate": 92.79, "profit_factor": 81.287, "ic": 0.9671, "hit": 92.41, "n": 2478, "precision": 0.9199, "recall": 0.9372, "f1": 0.9285, "f2": 0.9337, "mcc": 0.8515, "accuracy": 0.9257, "tp": 1194, "fp": 104, "tn": 1100, "fn": 80}], "experiment_num": 213, "status": "DISCARD"}
