{"backbone": "xgboost", "description": "Exp19 depth=4 gamma=0.5", "config": {"seq_len": 10, "lr": 0.0003, "batch_size": 32, "epochs": 20, "weight_decay": 1e-05, "patience": 5, "grad_clip": 1.0, "warmup_epochs": 0, "huber_delta": 1.0, "head_dropout": 0.1, "seed": 42, "max_depth": 4, "gbm_lr": 0.01, "gamma": 0.5, "het_loss": false}, "composite": -0.8968, "test_pos_folds": 3, "val_pos_folds": 4, "val_loss": 0.0, "elapsed_sec": 17.1, "timestamp": "2026-04-21T06:32:46", "sharpe": -0.1968, "psr": 0.35, "equity": 900.29, "sortino": -0.2772, "return_pct": -9.97, "max_dd": 26.89, "win_rate": 49.64, "profit_factor": 0.964, "ic": NaN, "hit": 49.43, "precision": 0.4943, "recall": 1.0, "f1": 0.6616, "f2": 0.8302, "mcc": 0.0, "accuracy": 0.4943, "per_window": [{"fold": "fold_1", "regime": "Pre-crisis upturn + GFC onset", "sharpe": 1.037, "sortino": 1.2544, "return_pct": 7.53, "equity": 1075.27, "max_dd": 7.03, "win_rate": 51.96, "profit_factor": 1.278, "ic": NaN, "hit": 51.46, "n": 103, "precision": 0.5146, "recall": 1.0, "f1": 0.6795, "f2": 0.8413, "mcc": 0.0, "accuracy": 0.5146, "tp": 53, "fp": 50, "tn": 0, "fn": 0}, {"fold": "fold_2", "regime": "Post-crash recovery", "sharpe": -2.2436, "sortino": -3.4797, "return_pct": -10.36, "equity": 896.41, "max_dd": 11.8, "win_rate": 47.66, "profit_factor": 0.704, "ic": NaN, "hit": 47.66, "n": 107, "precision": 0.4766, "recall": 1.0, "f1": 0.6456, "f2": 0.8199, "mcc": 0.0, "accuracy": 0.4766, "tp": 51, "fp": 56, "tn": 0, "fn": 0}, {"fold": "fold_3", "regime": "Eurozone debt plateau", "sharpe": -1.0059, "sortino": -1.6352, "return_pct": -3.65, "equity": 963.54, "max_dd": 7.21, "win_rate": 54.81, "profit_factor": 0.854, "ic": NaN, "hit": 53.77, "n": 106, "precision": 0.5377, "recall": 1.0, "f1": 0.6994, "f2": 0.8533, "mcc": 0.0, "accuracy": 0.5377, "tp": 57, "fp": 49, "tn": 0, "fn": 0}, {"fold": "fold_4", "regime": "Strong USD downturn", "sharpe": 0.4295, "sortino": 0.6767, "return_pct": 2.93, "equity": 1029.29, "max_dd": 7.26, "win_rate": 51.5, "profit_factor": 1.075, "ic": NaN, "hit": 51.19, "n": 168, "precision": 0.5119, "recall": 1.0, "f1": 0.6772, "f2": 0.8398, "mcc": 0.0, "accuracy": 0.5119, "tp": 86, "fp": 82, "tn": 0, "fn": 0}, {"fold": "fold_5", "regime": "Low-vol plateau", "sharpe": -0.7405, "sortino": -1.1728, "return_pct": -2.52, "equity": 974.8, "max_dd": 3.96, "win_rate": 46.91, "profit_factor": 0.884, "ic": NaN, "hit": 46.91, "n": 162, "precision": 0.4691, "recall": 1.0, "f1": 0.6387, "f2": 0.8155, "mcc": 0.0, "accuracy": 0.4691, "tp": 76, "fp": 86, "tn": 0, "fn": 0}, {"fold": "fold_6", "regime": "EUR crisis downturn", "sharpe": -2.2023, "sortino": -3.4211, "return_pct": -13.1, "equity": 868.98, "max_dd": 16.09, "win_rate": 46.67, "profit_factor": 0.7, "ic": NaN, "hit": 46.67, "n": 165, "precision": 0.4667, "recall": 1.0, "f1": 0.6364, "f2": 0.814, "mcc": 0.0, "accuracy": 0.4667, "tp": 77, "fp": 88, "tn": 0, "fn": 0}, {"fold": "fold_7", "regime": "Recent mixed/upturn", "sharpe": 1.8356, "sortino": 3.3274, "return_pct": 11.18, "equity": 1111.79, "max_dd": 3.84, "win_rate": 50.0, "profit_factor": 1.364, "ic": NaN, "hit": 50.0, "n": 162, "precision": 0.5, "recall": 1.0, "f1": 0.6667, "f2": 0.8333, "mcc": 0.0, "accuracy": 0.5, "tp": 81, "fp": 81, "tn": 0, "fn": 0}], "val_sharpe": -0.1042, "val_psr": 0.4278, "val_equity": 966.56, "val_sortino": -0.1558, "val_return_pct": -3.34, "val_max_dd": 20.73, "val_win_rate": 47.84, "val_profit_factor": 0.983, "val_ic": NaN, "val_hit": 47.53, "val_precision": 0.4753, "val_recall": 1.0, "val_f1": 0.6443, "val_f2": 0.8191, "val_mcc": 0.0, "val_accuracy": 0.4753, "val_per_window": [{"fold": "fold_1", "regime": "Pre-crisis upturn + GFC onset", "sharpe": 1.6183, "sortino": 2.6686, "return_pct": 4.07, "equity": 1040.73, "max_dd": 2.96, "win_rate": 50.93, "profit_factor": 1.308, "ic": NaN, "hit": 50.46, "n": 109, "precision": 0.5046, "recall": 1.0, "f1": 0.6707, "f2": 0.8359, "mcc": 0.0, "accuracy": 0.5046, "tp": 55, "fp": 54, "tn": 0, "fn": 0}, {"fold": "fold_2", "regime": "Post-crash recovery", "sharpe": 1.9981, "sortino": 3.1781, "return_pct": 9.8, "equity": 1098.03, "max_dd": 3.66, "win_rate": 58.33, "profit_factor": 1.371, "ic": NaN, "hit": 58.33, "n": 108, "precision": 0.5833, "recall": 1.0, "f1": 0.7368, "f2": 0.875, "mcc": 0.0, "accuracy": 0.5833, "tp": 63, "fp": 45, "tn": 0, "fn": 0}, {"fold": "fold_3", "regime": "Eurozone debt plateau", "sharpe": 0.3283, "sortino": 0.5863, "return_pct": 1.15, "equity": 1011.49, "max_dd": 6.82, "win_rate": 43.12, "profit_factor": 1.055, "ic": NaN, "hit": 42.34, "n": 111, "precision": 0.4234, "recall": 1.0, "f1": 0.5949, "f2": 0.786, "mcc": 0.0, "accuracy": 0.4234, "tp": 47, "fp": 64, "tn": 0, "fn": 0}, {"fold": "fold_4", "regime": "Strong USD downturn", "sharpe": -3.3948, "sortino": -4.7644, "return_pct": -11.02, "equity": 889.78, "max_dd": 10.7, "win_rate": 43.12, "profit_factor": 0.569, "ic": NaN, "hit": 42.73, "n": 110, "precision": 0.4273, "recall": 1.0, "f1": 0.5987, "f2": 0.7886, "mcc": 0.0, "accuracy": 0.4273, "tp": 47, "fp": 63, "tn": 0, "fn": 0}, {"fold": "fold_5", "regime": "Low-vol plateau", "sharpe": -1.6028, "sortino": -2.1916, "return_pct": -5.3, "equity": 946.97, "max_dd": 7.65, "win_rate": 47.32, "profit_factor": 0.766, "ic": NaN, "hit": 47.32, "n": 112, "precision": 0.4732, "recall": 1.0, "f1": 0.6424, "f2": 0.8179, "mcc": 0.0, "accuracy": 0.4732, "tp": 53, "fp": 59, "tn": 0, "fn": 0}, {"fold": "fold_6", "regime": "EUR crisis downturn", "sharpe": -1.5255, "sortino": -2.1361, "return_pct": -3.48, "equity": 965.23, "max_dd": 5.77, "win_rate": 43.93, "profit_factor": 0.773, "ic": NaN, "hit": 43.52, "n": 108, "precision": 0.4352, "recall": 1.0, "f1": 0.6065, "f2": 0.7939, "mcc": 0.0, "accuracy": 0.4352, "tp": 47, "fp": 61, "tn": 0, "fn": 0}, {"fold": "fold_7", "regime": "Recent mixed/upturn", "sharpe": 1.1889, "sortino": 2.0748, "return_pct": 2.82, "equity": 1028.18, "max_dd": 2.17, "win_rate": 48.18, "profit_factor": 1.211, "ic": NaN, "hit": 48.18, "n": 110, "precision": 0.4818, "recall": 1.0, "f1": 0.6503, "f2": 0.823, "mcc": 0.0, "accuracy": 0.4818, "tp": 53, "fp": 57, "tn": 0, "fn": 0}], "train_sharpe": 0.3982, "train_psr": 0.8988, "train_equity": 1510.84, "train_sortino": 0.5194, "train_return_pct": 51.08, "train_max_dd": 19.16, "train_win_rate": 51.62, "train_profit_factor": 1.091, "train_ic": NaN, "train_hit": 51.41, "train_precision": 0.5141, "train_recall": 1.0, "train_f1": 0.6791, "train_f2": 0.841, "train_mcc": 0.0, "train_accuracy": 0.5141, "train_per_window": [{"fold": "all_train", "regime": "Training data", "sharpe": 0.3982, "sortino": 0.5194, "return_pct": 51.08, "equity": 1510.84, "max_dd": 19.16, "win_rate": 51.62, "profit_factor": 1.091, "ic": NaN, "hit": 51.41, "n": 2478, "precision": 0.5141, "recall": 1.0, "f1": 0.6791, "f2": 0.841, "mcc": 0.0, "accuracy": 0.5141, "tp": 1274, "fp": 1204, "tn": 0, "fn": 0}], "experiment_num": 196, "status": "DISCARD"}
{"backbone": "xgboost", "description": "Exp20 depth=4 subsample=1", "config": {"seq_len": 10, "lr": 0.0003, "batch_size": 32, "epochs": 20, "weight_decay": 1e-05, "patience": 5, "grad_clip": 1.0, "warmup_epochs": 0, "huber_delta": 1.0, "head_dropout": 0.1, "seed": 42, "max_depth": 4, "gbm_lr": 0.01, "subsample": 1.0, "het_loss": false}, "composite": 7.4828, "test_pos_folds": 7, "val_pos_folds": 6, "val_loss": 0.0, "elapsed_sec": 86.2, "timestamp": "2026-04-21T06:34:21", "sharpe": 7.757, "psr": 1.0, "equity": 18077.78, "sortino": 7.645, "return_pct": 1707.78, "max_dd": 8.96, "win_rate": 78.64, "profit_factor": 4.614, "ic": 0.688, "hit": 78.31, "precision": 0.8036, "recall": 0.7484, "f1": 0.775, "f2": 0.7589, "mcc": 0.5713, "accuracy": 0.7852, "per_window": [{"fold": "fold_1", "regime": "Pre-crisis upturn + GFC onset", "sharpe": 0.8214, "sortino": 0.9045, "return_pct": 5.75, "equity": 1057.54, "max_dd": 8.96, "win_rate": 51.96, "profit_factor": 1.214, "ic": 0.2031, "hit": 51.46, "n": 103, "precision": 0.5625, "recall": 0.3396, "f1": 0.4235, "f2": 0.3689, "mcc": 0.0644, "accuracy": 0.5243, "tp": 18, "fp": 14, "tn": 36, "fn": 35}, {"fold": "fold_2", "regime": "Post-crash recovery", "sharpe": 0.9127, "sortino": 1.6397, "return_pct": 4.19, "equity": 1041.88, "max_dd": 6.4, "win_rate": 53.27, "profit_factor": 1.154, "ic": -0.0125, "hit": 53.27, "n": 107, "precision": 0.5106, "recall": 0.4706, "f1": 0.4898, "f2": 0.4781, "mcc": 0.0603, "accuracy": 0.5327, "tp": 24, "fp": 23, "tn": 33, "fn": 27}, {"fold": "fold_3", "regime": "Eurozone debt plateau", "sharpe": 15.0641, "sortino": 24.4675, "return_pct": 47.17, "equity": 1471.69, "max_dd": 1.32, "win_rate": 87.5, "profit_factor": 13.047, "ic": 0.8094, "hit": 85.85, "n": 106, "precision": 0.8889, "recall": 0.8421, "f1": 0.8649, "f2": 0.8511, "mcc": 0.7177, "accuracy": 0.8585, "tp": 48, "fp": 6, "tn": 43, "fn": 9}, {"fold": "fold_4", "regime": "Strong USD downturn", "sharpe": 13.6797, "sortino": 18.4245, "return_pct": 122.97, "equity": 2229.71, "max_dd": 1.81, "win_rate": 89.82, "profit_factor": 14.419, "ic": 0.8737, "hit": 89.29, "n": 168, "precision": 0.9059, "recall": 0.8953, "f1": 0.9006, "f2": 0.8974, "mcc": 0.7976, "accuracy": 0.8988, "tp": 77, "fp": 8, "tn": 74, "fn": 9}, {"fold": "fold_5", "regime": "Low-vol plateau", "sharpe": 14.9902, "sortino": 60.1957, "return_pct": 43.68, "equity": 1436.82, "max_dd": 0.23, "win_rate": 84.57, "profit_factor": 20.379, "ic": 0.9035, "hit": 84.57, "n": 162, "precision": 0.84, "recall": 0.8289, "f1": 0.8344, "f2": 0.8311, "mcc": 0.69, "accuracy": 0.8457, "tp": 63, "fp": 12, "tn": 74, "fn": 13}, {"fold": "fold_6", "regime": "EUR crisis downturn", "sharpe": 14.6615, "sortino": 43.0892, "return_pct": 96.47, "equity": 1964.74, "max_dd": 0.87, "win_rate": 81.21, "profit_factor": 14.404, "ic": 0.884, "hit": 81.21, "n": 165, "precision": 0.8108, "recall": 0.7792, "f1": 0.7947, "f2": 0.7853, "mcc": 0.6221, "accuracy": 0.8121, "tp": 60, "fp": 14, "tn": 74, "fn": 17}, {"fold": "fold_7", "regime": "Recent mixed/upturn", "sharpe": 12.1192, "sortino": 16.2051, "return_pct": 77.12, "equity": 1771.16, "max_dd": 1.64, "win_rate": 86.42, "profit_factor": 9.732, "ic": 0.8244, "hit": 86.42, "n": 162, "precision": 0.8642, "recall": 0.8642, "f1": 0.8642, "f2": 0.8642, "mcc": 0.7284, "accuracy": 0.8642, "tp": 70, "fp": 11, "tn": 70, "fn": 11}], "val_sharpe": 7.5828, "val_psr": 1.0, "val_equity": 5032.22, "val_sortino": 9.4802, "val_return_pct": 403.22, "val_max_dd": 17.82, "val_win_rate": 74.44, "val_profit_factor": 3.739, "val_ic": 0.6731, "val_hit": 73.96, "val_precision": 0.7157, "val_recall": 0.7726, "val_f1": 0.7431, "val_f2": 0.7605, "val_mcc": 0.4942, "val_accuracy": 0.7461, "val_per_window": [{"fold": "fold_1", "regime": "Pre-crisis upturn + GFC onset", "sharpe": 2.4199, "sortino": 4.8296, "return_pct": 6.15, "equity": 1061.49, "max_dd": 2.16, "win_rate": 50.0, "profit_factor": 1.495, "ic": 0.0448, "hit": 49.54, "n": 109, "precision": 0.5059, "recall": 0.7818, "f1": 0.6143, "f2": 0.7049, "mcc": 0.0049, "accuracy": 0.5046, "tp": 43, "fp": 42, "tn": 12, "fn": 12}, {"fold": "fold_2", "regime": "Post-crash recovery", "sharpe": -2.4623, "sortino": -3.8616, "return_pct": -11.39, "equity": 886.11, "max_dd": 17.82, "win_rate": 49.07, "profit_factor": 0.678, "ic": -0.0825, "hit": 49.07, "n": 108, "precision": 0.5909, "recall": 0.4127, "f1": 0.486, "f2": 0.4392, "mcc": 0.0127, "accuracy": 0.4907, "tp": 26, "fp": 18, "tn": 27, "fn": 37}, {"fold": "fold_3", "regime": "Eurozone debt plateau", "sharpe": 14.028, "sortino": 39.0427, "return_pct": 52.71, "equity": 1527.12, "max_dd": 0.64, "win_rate": 83.49, "profit_factor": 12.573, "ic": 0.8319, "hit": 81.98, "n": 111, "precision": 0.7736, "recall": 0.8723, "f1": 0.82, "f2": 0.8506, "mcc": 0.6774, "accuracy": 0.8378, "tp": 41, "fp": 12, "tn": 52, "fn": 6}, {"fold": "fold_4", "regime": "Strong USD downturn", "sharpe": 15.3551, "sortino": 50.9621, "return_pct": 46.56, "equity": 1465.58, "max_dd": 0.64, "win_rate": 85.32, "profit_factor": 21.889, "ic": 0.9151, "hit": 84.55, "n": 110, "precision": 0.878, "recall": 0.766, "f1": 0.8182, "f2": 0.786, "mcc": 0.7024, "accuracy": 0.8545, "tp": 36, "fp": 5, "tn": 58, "fn": 11}, {"fold": "fold_5", "regime": "Low-vol plateau", "sharpe": 14.8598, "sortino": 58.9128, "return_pct": 43.46, "equity": 1434.62, "max_dd": 0.34, "win_rate": 83.93, "profit_factor": 19.241, "ic": 0.9217, "hit": 83.93, "n": 112, "precision": 0.7966, "recall": 0.8868, "f1": 0.8393, "f2": 0.8672, "mcc": 0.6834, "accuracy": 0.8393, "tp": 47, "fp": 12, "tn": 47, "fn": 6}, {"fold": "fold_6", "regime": "EUR crisis downturn", "sharpe": 15.7165, "sortino": 109.9015, "return_pct": 29.07, "equity": 1290.71, "max_dd": 0.15, "win_rate": 86.92, "profit_factor": 32.06, "ic": 0.9235, "hit": 86.11, "n": 108, "precision": 0.8235, "recall": 0.8936, "f1": 0.8571, "f2": 0.8787, "mcc": 0.7409, "accuracy": 0.8704, "tp": 42, "fp": 9, "tn": 52, "fn": 5}, {"fold": "fold_7", "regime": "Recent mixed/upturn", "sharpe": 14.4055, "sortino": 38.9922, "return_pct": 29.09, "equity": 1290.94, "max_dd": 0.5, "win_rate": 81.82, "profit_factor": 13.003, "ic": 0.8804, "hit": 81.82, "n": 110, "precision": 0.7705, "recall": 0.8868, "f1": 0.8246, "f2": 0.8608, "mcc": 0.6446, "accuracy": 0.8182, "tp": 47, "fp": 14, "tn": 43, "fn": 6}], "train_sharpe": 10.6792, "train_psr": 1.0, "train_equity": 49073128.0, "train_sortino": 84.8025, "train_return_pct": 4907212.8, "train_max_dd": 0.53, "train_win_rate": 91.45, "train_profit_factor": 61.278, "train_ic": 0.9558, "train_hit": 91.08, "train_precision": 0.9076, "train_recall": 0.9254, "train_f1": 0.9164, "train_f2": 0.9218, "train_mcc": 0.8264, "train_accuracy": 0.9132, "train_per_window": [{"fold": "all_train", "regime": "Training data", "sharpe": 10.6792, "sortino": 84.8025, "return_pct": 4907212.8, "equity": 49073128.0, "max_dd": 0.53, "win_rate": 91.45, "profit_factor": 61.278, "ic": 0.9558, "hit": 91.08, "n": 2478, "precision": 0.9076, "recall": 0.9254, "f1": 0.9164, "f2": 0.9218, "mcc": 0.8264, "accuracy": 0.9132, "tp": 1179, "fp": 120, "tn": 1084, "fn": 95}], "experiment_num": 197, "status": "DISCARD"}
{"backbone": "xgboost", "description": "Exp21 seq=30", "config": {"seq_len": 30, "lr": 0.0003, "batch_size": 32, "epochs": 20, "weight_decay": 1e-05, "patience": 5, "grad_clip": 1.0, "warmup_epochs": 0, "huber_delta": 1.0, "head_dropout": 0.1, "seed": 42, "max_depth": 4, "gbm_lr": 0.01, "het_loss": false}, "composite": 8.4538, "test_pos_folds": 7, "val_pos_folds": 6, "val_loss": 0.0, "elapsed_sec": 234.8, "timestamp": "2026-04-21T06:39:17", "sharpe": 9.52, "psr": 1.0, "equity": 13477.16, "sortino": 13.2292, "return_pct": 1247.72, "max_dd": 5.74, "win_rate": 79.13, "profit_factor": 5.403, "ic": 0.7055, "hit": 78.75, "precision": 0.8036, "recall": 0.7627, "f1": 0.7826, "f2": 0.7705, "mcc": 0.5804, "accuracy": 0.7899, "per_window": [{"fold": "fold_1", "regime": "Pre-crisis upturn + GFC onset", "sharpe": 0.9237, "sortino": 1.4794, "return_pct": 3.03, "equity": 1030.28, "max_dd": 3.64, "win_rate": 51.22, "profit_factor": 1.159, "ic": 0.0273, "hit": 50.6, "n": 83, "precision": 0.5385, "recall": 0.4884, "f1": 0.5122, "f2": 0.4976, "mcc": 0.0384, "accuracy": 0.5181, "tp": 21, "fp": 18, "tn": 22, "fn": 22}, {"fold": "fold_2", "regime": "Post-crash recovery", "sharpe": 0.4999, "sortino": 0.8768, "return_pct": 1.77, "equity": 1017.73, "max_dd": 4.51, "win_rate": 51.72, "profit_factor": 1.082, "ic": -0.0113, "hit": 51.72, "n": 87, "precision": 0.5526, "recall": 0.4565, "f1": 0.5, "f2": 0.473, "mcc": 0.0422, "accuracy": 0.5172, "tp": 21, "fp": 17, "tn": 24, "fn": 25}, {"fold": "fold_3", "regime": "Eurozone debt plateau", "sharpe": 15.2442, "sortino": 24.2285, "return_pct": 37.91, "equity": 1379.06, "max_dd": 1.32, "win_rate": 85.71, "profit_factor": 13.751, "ic": 0.8153, "hit": 83.72, "n": 86, "precision": 0.9024, "recall": 0.7872, "f1": 0.8409, "f2": 0.8079, "mcc": 0.6824, "accuracy": 0.8372, "tp": 37, "fp": 4, "tn": 35, "fn": 10}, {"fold": "fold_4", "regime": "Strong USD downturn", "sharpe": 14.5927, "sortino": 44.8236, "return_pct": 110.57, "equity": 2105.73, "max_dd": 0.56, "win_rate": 89.12, "profit_factor": 23.673, "ic": 0.8758, "hit": 88.51, "n": 148, "precision": 0.9143, "recall": 0.8649, "f1": 0.8889, "f2": 0.8743, "mcc": 0.7849, "accuracy": 0.8919, "tp": 64, "fp": 6, "tn": 68, "fn": 10}, {"fold": "fold_5", "regime": "Low-vol plateau", "sharpe": 15.0597, "sortino": 69.1549, "return_pct": 36.64, "equity": 1366.39, "max_dd": 0.23, "win_rate": 84.51, "profit_factor": 22.615, "ic": 0.8928, "hit": 84.51, "n": 142, "precision": 0.8235, "recall": 0.8485, "f1": 0.8358, "f2": 0.8434, "mcc": 0.6895, "accuracy": 0.8451, "tp": 56, "fp": 12, "tn": 64, "fn": 10}, {"fold": "fold_6", "regime": "EUR crisis downturn", "sharpe": 15.6476, "sortino": 63.7907, "return_pct": 88.41, "equity": 1884.1, "max_dd": 0.43, "win_rate": 82.07, "profit_factor": 17.384, "ic": 0.888, "hit": 82.07, "n": 145, "precision": 0.8125, "recall": 0.7879, "f1": 0.8, "f2": 0.7927, "mcc": 0.6378, "accuracy": 0.8207, "tp": 52, "fp": 12, "tn": 67, "fn": 14}, {"fold": "fold_7", "regime": "Recent mixed/upturn", "sharpe": 13.4199, "sortino": 14.4547, "return_pct": 71.93, "equity": 1719.27, "max_dd": 1.64, "win_rate": 89.44, "profit_factor": 13.908, "ic": 0.8597, "hit": 89.44, "n": 142, "precision": 0.8889, "recall": 0.9014, "f1": 0.8951, "f2": 0.8989, "mcc": 0.7888, "accuracy": 0.8944, "tp": 64, "fp": 8, "tn": 63, "fn": 7}], "val_sharpe": 8.5538, "val_psr": 1.0, "val_equity": 4325.06, "val_sortino": 11.5682, "val_return_pct": 332.51, "val_max_dd": 11.57, "val_win_rate": 75.8, "val_profit_factor": 4.499, "val_ic": 0.6798, "val_hit": 75.32, "val_precision": 0.7188, "val_recall": 0.8212, "val_f1": 0.7666, "val_f2": 0.7985, "val_mcc": 0.5258, "val_accuracy": 0.7596, "val_per_window": [{"fold": "fold_1", "regime": "Pre-crisis upturn + GFC onset", "sharpe": 1.8515, "sortino": 3.0086, "return_pct": 3.95, "equity": 1039.52, "max_dd": 3.03, "win_rate": 50.0, "profit_factor": 1.367, "ic": -0.0122, "hit": 49.44, "n": 89, "precision": 0.5128, "recall": 0.8696, "f1": 0.6452, "f2": 0.7634, "mcc": -0.0215, "accuracy": 0.5056, "tp": 40, "fp": 38, "tn": 5, "fn": 6}, {"fold": "fold_2", "regime": "Post-crash recovery", "sharpe": -0.5438, "sortino": -0.8638, "return_pct": -2.18, "equity": 978.22, "max_dd": 11.57, "win_rate": 45.45, "profit_factor": 0.917, "ic": -0.0466, "hit": 45.45, "n": 88, "precision": 0.5179, "recall": 0.58, "f1": 0.5472, "f2": 0.5664, "mcc": -0.1344, "accuracy": 0.4545, "tp": 29, "fp": 27, "tn": 11, "fn": 21}, {"fold": "fold_3", "regime": "Eurozone debt plateau", "sharpe": 14.9916, "sortino": 40.2637, "return_pct": 45.97, "equity": 1459.7, "max_dd": 0.62, "win_rate": 85.56, "profit_factor": 16.702, "ic": 0.8652, "hit": 84.62, "n": 91, "precision": 0.825, "recall": 0.8462, "f1": 0.8354, "f2": 0.8418, "mcc": 0.7094, "accuracy": 0.8571, "tp": 33, "fp": 7, "tn": 45, "fn": 6}, {"fold": "fold_4", "regime": "Strong USD downturn", "sharpe": 15.4763, "sortino": 43.7921, "return_pct": 40.59, "equity": 1405.95, "max_dd": 0.71, "win_rate": 85.39, "profit_factor": 17.436, "ic": 0.9129, "hit": 84.44, "n": 90, "precision": 0.9118, "recall": 0.7561, "f1": 0.8267, "f2": 0.7828, "mcc": 0.7138, "accuracy": 0.8556, "tp": 31, "fp": 3, "tn": 46, "fn": 10}, {"fold": "fold_5", "regime": "Low-vol plateau", "sharpe": 15.3613, "sortino": 74.4664, "return_pct": 35.78, "equity": 1357.75, "max_dd": 0.29, "win_rate": 88.04, "profit_factor": 30.228, "ic": 0.9157, "hit": 88.04, "n": 92, "precision": 0.8431, "recall": 0.9348, "f1": 0.8866, "f2": 0.9149, "mcc": 0.7654, "accuracy": 0.8804, "tp": 43, "fp": 8, "tn": 38, "fn": 3}, {"fold": "fold_6", "regime": "EUR crisis downturn", "sharpe": 16.3801, "sortino": 97.04, "return_pct": 21.72, "equity": 1217.24, "max_dd": 0.15, "win_rate": 89.66, "profit_factor": 38.315, "ic": 0.9269, "hit": 88.64, "n": 88, "precision": 0.8649, "recall": 0.8889, "f1": 0.8767, "f2": 0.884, "mcc": 0.7896, "accuracy": 0.8977, "tp": 32, "fp": 5, "tn": 47, "fn": 4}, {"fold": "fold_7", "regime": "Recent mixed/upturn", "sharpe": 16.1345, "sortino": 68.2348, "return_pct": 25.4, "equity": 1253.99, "max_dd": 0.23, "win_rate": 85.56, "profit_factor": 22.032, "ic": 0.8946, "hit": 85.56, "n": 90, "precision": 0.8163, "recall": 0.9091, "f1": 0.8602, "f2": 0.8889, "mcc": 0.7161, "accuracy": 0.8556, "tp": 40, "fp": 9, "tn": 37, "fn": 4}], "train_sharpe": 11.1022, "train_psr": 1.0, "train_equity": 6181128.5, "train_sortino": 109.2078, "train_return_pct": 618012.85, "train_max_dd": 0.5, "train_win_rate": 92.27, "train_profit_factor": 81.047, "train_ic": 0.9692, "train_hit": 91.9, "train_precision": 0.9179, "train_recall": 0.9313, "train_f1": 0.9246, "train_f2": 0.9286, "train_mcc": 0.8418, "train_accuracy": 0.921, "train_per_window": [{"fold": "all_train", "regime": "Training data", "sharpe": 11.1022, "sortino": 109.2078, "return_pct": 618012.85, "equity": 6181128.5, "max_dd": 0.5, "win_rate": 92.27, "profit_factor": 81.047, "ic": 0.9692, "hit": 91.9, "n": 1988, "precision": 0.9179, "recall": 0.9313, "f1": 0.9246, "f2": 0.9286, "mcc": 0.8418, "accuracy": 0.921, "tp": 962, "fp": 86, "tn": 869, "fn": 71}], "experiment_num": 198, "status": "KEEP"}
