{"backbone": "lstm", "description": "lstm: Exp20 wd=5e-4 extreme L2 (Zaremba2014)", "config": {"seq_len": 10, "lr": 0.001, "batch_size": 32, "epochs": 100, "weight_decay": 0.0005, "patience": 15, "grad_clip": 1.0, "warmup_epochs": 0, "huber_delta": 1.0, "head_dropout": 0.25, "seed": 0, "het_loss": false}, "composite": 6.1312, "test_pos_folds": 7, "val_pos_folds": 6, "val_loss": 2.8e-05, "elapsed_sec": 30.6, "timestamp": "2026-04-19T19:21:19", "sharpe": 6.3363, "psr": 1.0, "equity": 11484.03, "sortino": 11.4483, "return_pct": 1048.4, "max_dd": 5.84, "win_rate": 71.31, "profit_factor": 3.382, "ic": 0.5553, "hit": 71.02, "aleatoric_mean": 1.2e-05, "epistemic_mean": 2.3e-05, "confidence_mean": 1.0, "precision": 0.7531, "recall": 0.6216, "f1": 0.6811, "f2": 0.6441, "mcc": 0.4297, "accuracy": 0.7122, "per_window": [{"fold": "fold_1", "regime": "Pre-crisis upturn + GFC onset", "sharpe": 2.0743, "sortino": 5.863, "return_pct": 16.37, "equity": 1163.71, "max_dd": 5.84, "win_rate": 55.88, "profit_factor": 1.641, "ic": 0.157, "hit": 55.34, "n": 103, "precision": 0.5574, "recall": 0.6415, "f1": 0.5965, "f2": 0.6227, "mcc": 0.1032, "accuracy": 0.5534, "tp": 34, "fp": 27, "tn": 23, "fn": 19, "aleatoric_mean": 2.1e-05, "epistemic_mean": 4.3e-05, "confidence_mean": 0.9999, "aleatoric_std": 1.9e-05, "epistemic_std": 3.8e-05}, {"fold": "fold_2", "regime": "Post-crash recovery", "sharpe": 1.6623, "sortino": 3.0701, "return_pct": 7.97, "equity": 1079.67, "max_dd": 5.39, "win_rate": 57.01, "profit_factor": 1.298, "ic": 0.11, "hit": 57.01, "n": 107, "precision": 0.5397, "recall": 0.6667, "f1": 0.5965, "f2": 0.6367, "mcc": 0.151, "accuracy": 0.5701, "tp": 34, "fp": 29, "tn": 27, "fn": 17, "aleatoric_mean": 1.3e-05, "epistemic_mean": 2.6e-05, "confidence_mean": 1.0, "aleatoric_std": 7e-06, "epistemic_std": 1.5e-05}, {"fold": "fold_3", "regime": "Eurozone debt plateau", "sharpe": 11.2617, "sortino": 20.8779, "return_pct": 38.34, "equity": 1383.44, "max_dd": 1.32, "win_rate": 82.69, "profit_factor": 6.166, "ic": 0.6852, "hit": 81.13, "n": 106, "precision": 0.8393, "recall": 0.8246, "f1": 0.8319, "f2": 0.8275, "mcc": 0.6401, "accuracy": 0.8208, "tp": 47, "fp": 9, "tn": 40, "fn": 10, "aleatoric_mean": 1.4e-05, "epistemic_mean": 2.7e-05, "confidence_mean": 1.0, "aleatoric_std": 7e-06, "epistemic_std": 1.4e-05}, {"fold": "fold_4", "regime": "Strong USD downturn", "sharpe": 8.4098, "sortino": 15.5046, "return_pct": 77.49, "equity": 1774.93, "max_dd": 1.81, "win_rate": 73.65, "profit_factor": 4.321, "ic": 0.7409, "hit": 73.21, "n": 168, "precision": 0.9375, "recall": 0.5233, "f1": 0.6716, "f2": 0.574, "mcc": 0.5385, "accuracy": 0.7381, "tp": 45, "fp": 3, "tn": 79, "fn": 41, "aleatoric_mean": 1e-05, "epistemic_mean": 2e-05, "confidence_mean": 1.0, "aleatoric_std": 5e-06, "epistemic_std": 1e-05}, {"fold": "fold_5", "regime": "Low-vol plateau", "sharpe": 10.5283, "sortino": 27.8635, "return_pct": 33.86, "equity": 1338.57, "max_dd": 0.81, "win_rate": 75.31, "profit_factor": 6.4, "ic": 0.7383, "hit": 75.31, "n": 162, "precision": 0.8214, "recall": 0.6053, "f1": 0.697, "f2": 0.6389, "mcc": 0.5131, "accuracy": 0.7531, "tp": 46, "fp": 10, "tn": 76, "fn": 30, "aleatoric_mean": 6e-06, "epistemic_mean": 1.3e-05, "confidence_mean": 1.0, "aleatoric_std": 2e-06, "epistemic_std": 4e-06}, {"fold": "fold_6", "regime": "EUR crisis downturn", "sharpe": 12.2285, "sortino": 43.7502, "return_pct": 83.52, "equity": 1835.18, "max_dd": 0.82, "win_rate": 76.97, "profit_factor": 8.202, "ic": 0.7765, "hit": 76.97, "n": 165, "precision": 0.8679, "recall": 0.5974, "f1": 0.7077, "f2": 0.6371, "mcc": 0.5533, "accuracy": 0.7697, "tp": 46, "fp": 7, "tn": 81, "fn": 31, "aleatoric_mean": 1.1e-05, "epistemic_mean": 2.2e-05, "confidence_mean": 1.0, "aleatoric_std": 6e-06, "epistemic_std": 1.2e-05}, {"fold": "fold_7", "regime": "Recent mixed/upturn", "sharpe": 7.8219, "sortino": 12.1216, "return_pct": 51.53, "equity": 1515.3, "max_dd": 1.64, "win_rate": 70.99, "profit_factor": 3.91, "ic": 0.6558, "hit": 70.99, "n": 162, "precision": 0.7833, "recall": 0.5802, "f1": 0.6667, "f2": 0.612, "mcc": 0.4346, "accuracy": 0.7099, "tp": 47, "fp": 13, "tn": 68, "fn": 34, "aleatoric_mean": 1.1e-05, "epistemic_mean": 2.2e-05, "confidence_mean": 1.0, "aleatoric_std": 4e-06, "epistemic_std": 9e-06}], "val_sharpe": 6.2312, "val_psr": 1.0, "val_equity": 3929.06, "val_sortino": 9.2622, "val_return_pct": 292.91, "val_max_dd": 9.22, "val_win_rate": 67.37, "val_profit_factor": 2.921, "val_ic": 0.5204, "val_hit": 66.93, "val_aleatoric_mean": 8e-06, "val_epistemic_mean": 1.7e-05, "val_confidence_mean": 1.0, "val_precision": 0.6955, "val_recall": 0.5507, "val_f1": 0.6147, "val_f2": 0.5746, "val_mcc": 0.3426, "val_accuracy": 0.6719, "val_per_window": [{"fold": "fold_1", "regime": "Pre-crisis upturn + GFC onset", "sharpe": 0.0354, "sortino": 0.0566, "return_pct": 0.02, "equity": 1000.16, "max_dd": 3.91, "win_rate": 45.37, "profit_factor": 1.006, "ic": 0.0007, "hit": 44.95, "n": 109, "precision": 0.46, "recall": 0.4182, "f1": 0.4381, "f2": 0.4259, "mcc": -0.0821, "accuracy": 0.4587, "tp": 23, "fp": 27, "tn": 27, "fn": 32, "aleatoric_mean": 9e-06, "epistemic_mean": 1.7e-05, "confidence_mean": 1.0, "aleatoric_std": 5e-06, "epistemic_std": 1e-05}, {"fold": "fold_2", "regime": "Post-crash recovery", "sharpe": -0.8186, "sortino": -1.3326, "return_pct": -4.16, "equity": 958.44, "max_dd": 9.22, "win_rate": 46.3, "profit_factor": 0.879, "ic": -0.0131, "hit": 46.3, "n": 108, "precision": 0.5676, "recall": 0.3333, "f1": 0.42, "f2": 0.3633, "mcc": -0.0231, "accuracy": 0.463, "tp": 21, "fp": 16, "tn": 29, "fn": 42, "aleatoric_mean": 1.2e-05, "epistemic_mean": 2.4e-05, "confidence_mean": 1.0, "aleatoric_std": 7e-06, "epistemic_std": 1.3e-05}, {"fold": "fold_3", "regime": "Eurozone debt plateau", "sharpe": 11.1461, "sortino": 25.7167, "return_pct": 44.36, "equity": 1443.63, "max_dd": 0.94, "win_rate": 73.39, "profit_factor": 6.69, "ic": 0.7919, "hit": 72.07, "n": 111, "precision": 0.6176, "recall": 0.8936, "f1": 0.7304, "f2": 0.8203, "mcc": 0.4943, "accuracy": 0.7207, "tp": 42, "fp": 26, "tn": 38, "fn": 5, "aleatoric_mean": 8e-06, "epistemic_mean": 1.6e-05, "confidence_mean": 1.0, "aleatoric_std": 3e-06, "epistemic_std": 7e-06}, {"fold": "fold_4", "regime": "Strong USD downturn", "sharpe": 12.2128, "sortino": 32.7167, "return_pct": 39.8, "equity": 1398.05, "max_dd": 0.82, "win_rate": 78.9, "profit_factor": 9.02, "ic": 0.7395, "hit": 78.18, "n": 110, "precision": 0.9286, "recall": 0.5532, "f1": 0.6933, "f2": 0.6019, "mcc": 0.5922, "accuracy": 0.7909, "tp": 26, "fp": 2, "tn": 61, "fn": 21, "aleatoric_mean": 8e-06, "epistemic_mean": 1.6e-05, "confidence_mean": 1.0, "aleatoric_std": 3e-06, "epistemic_std": 6e-06}, {"fold": "fold_5", "regime": "Low-vol plateau", "sharpe": 11.2272, "sortino": 31.4775, "return_pct": 35.63, "equity": 1356.29, "max_dd": 1.2, "win_rate": 74.11, "profit_factor": 7.384, "ic": 0.7767, "hit": 74.11, "n": 112, "precision": 0.9, "recall": 0.5094, "f1": 0.6506, "f2": 0.5579, "mcc": 0.517, "accuracy": 0.7411, "tp": 27, "fp": 3, "tn": 56, "fn": 26, "aleatoric_mean": 7e-06, "epistemic_mean": 1.3e-05, "confidence_mean": 1.0, "aleatoric_std": 3e-06, "epistemic_std": 7e-06}, {"fold": "fold_6", "regime": "EUR crisis downturn", "sharpe": 11.2094, "sortino": 29.4831, "return_pct": 23.26, "equity": 1232.58, "max_dd": 0.77, "win_rate": 74.77, "profit_factor": 7.705, "ic": 0.8503, "hit": 74.07, "n": 108, "precision": 0.7879, "recall": 0.5532, "f1": 0.65, "f2": 0.5882, "mcc": 0.4719, "accuracy": 0.7407, "tp": 26, "fp": 7, "tn": 54, "fn": 21, "aleatoric_mean": 6e-06, "epistemic_mean": 1.2e-05, "confidence_mean": 1.0, "aleatoric_std": 2e-06, "epistemic_std": 4e-06}, {"fold": "fold_7", "regime": "Recent mixed/upturn", "sharpe": 9.4743, "sortino": 19.5558, "return_pct": 21.48, "equity": 1214.82, "max_dd": 0.79, "win_rate": 78.18, "profit_factor": 4.775, "ic": 0.695, "hit": 78.18, "n": 110, "precision": 0.8372, "recall": 0.6792, "f1": 0.75, "f2": 0.7059, "mcc": 0.5698, "accuracy": 0.7818, "tp": 36, "fp": 7, "tn": 50, "fn": 17, "aleatoric_mean": 1e-05, "epistemic_mean": 1.9e-05, "confidence_mean": 1.0, "aleatoric_std": 4e-06, "epistemic_std": 9e-06}], "train_sharpe": 6.7606, "train_psr": 1.0, "train_equity": 1920063.38, "train_sortino": 16.7985, "train_return_pct": 191906.34, "train_max_dd": 4.82, "train_win_rate": 73.78, "train_profit_factor": 5.239, "train_ic": 0.6931, "train_hit": 73.49, "train_precision": 0.8112, "train_recall": 0.6374, "train_f1": 0.7138, "train_f2": 0.6659, "train_mcc": 0.4893, "train_accuracy": 0.7373, "train_per_window": [{"fold": "all_train", "regime": "Training data", "sharpe": 6.7606, "sortino": 16.7985, "return_pct": 191906.34, "equity": 1920063.38, "max_dd": 4.82, "win_rate": 73.78, "profit_factor": 5.239, "ic": 0.6931, "hit": 73.49, "n": 2478, "precision": 0.8112, "recall": 0.6374, "f1": 0.7138, "f2": 0.6659, "mcc": 0.4893, "accuracy": 0.7373, "tp": 812, "fp": 189, "tn": 1015, "fn": 462}], "experiment_num": 125, "status": "KEEP"}
{"backbone": "lstm", "description": "lstm: Exp21 wd=1e-3 push L2 further (Zaremba2014)", "config": {"seq_len": 10, "lr": 0.001, "batch_size": 32, "epochs": 100, "weight_decay": 0.001, "patience": 15, "grad_clip": 1.0, "warmup_epochs": 0, "huber_delta": 1.0, "head_dropout": 0.25, "seed": 0, "het_loss": false}, "composite": 6.1938, "test_pos_folds": 7, "val_pos_folds": 6, "val_loss": 2.8e-05, "elapsed_sec": 33.1, "timestamp": "2026-04-19T19:24:14", "sharpe": 6.3987, "psr": 1.0, "equity": 11726.51, "sortino": 11.4852, "return_pct": 1072.65, "max_dd": 5.84, "win_rate": 71.62, "profit_factor": 3.427, "ic": 0.5554, "hit": 71.33, "aleatoric_mean": 1.2e-05, "epistemic_mean": 2.3e-05, "confidence_mean": 1.0, "precision": 0.755, "recall": 0.6279, "f1": 0.6856, "f2": 0.6497, "mcc": 0.4356, "accuracy": 0.7153, "per_window": [{"fold": "fold_1", "regime": "Pre-crisis upturn + GFC onset", "sharpe": 2.0743, "sortino": 5.863, "return_pct": 16.37, "equity": 1163.71, "max_dd": 5.84, "win_rate": 55.88, "profit_factor": 1.641, "ic": 0.1571, "hit": 55.34, "n": 103, "precision": 0.5574, "recall": 0.6415, "f1": 0.5965, "f2": 0.6227, "mcc": 0.1032, "accuracy": 0.5534, "tp": 34, "fp": 27, "tn": 23, "fn": 19, "aleatoric_mean": 2.1e-05, "epistemic_mean": 4.3e-05, "confidence_mean": 0.9999, "aleatoric_std": 1.9e-05, "epistemic_std": 3.8e-05}, {"fold": "fold_2", "regime": "Post-crash recovery", "sharpe": 1.6623, "sortino": 3.0701, "return_pct": 7.97, "equity": 1079.67, "max_dd": 5.39, "win_rate": 57.01, "profit_factor": 1.298, "ic": 0.1091, "hit": 57.01, "n": 107, "precision": 0.5397, "recall": 0.6667, "f1": 0.5965, "f2": 0.6367, "mcc": 0.151, "accuracy": 0.5701, "tp": 34, "fp": 29, "tn": 27, "fn": 17, "aleatoric_mean": 1.3e-05, "epistemic_mean": 2.6e-05, "confidence_mean": 1.0, "aleatoric_std": 7e-06, "epistemic_std": 1.5e-05}, {"fold": "fold_3", "regime": "Eurozone debt plateau", "sharpe": 11.2617, "sortino": 20.8779, "return_pct": 38.34, "equity": 1383.44, "max_dd": 1.32, "win_rate": 82.69, "profit_factor": 6.166, "ic": 0.6853, "hit": 81.13, "n": 106, "precision": 0.8393, "recall": 0.8246, "f1": 0.8319, "f2": 0.8275, "mcc": 0.6401, "accuracy": 0.8208, "tp": 47, "fp": 9, "tn": 40, "fn": 10, "aleatoric_mean": 1.4e-05, "epistemic_mean": 2.7e-05, "confidence_mean": 1.0, "aleatoric_std": 7e-06, "epistemic_std": 1.4e-05}, {"fold": "fold_4", "regime": "Strong USD downturn", "sharpe": 8.5414, "sortino": 15.5165, "return_pct": 78.74, "equity": 1787.44, "max_dd": 1.81, "win_rate": 74.25, "profit_factor": 4.43, "ic": 0.7412, "hit": 73.81, "n": 168, "precision": 0.9388, "recall": 0.5349, "f1": 0.6815, "f2": 0.5852, "mcc": 0.548, "accuracy": 0.744, "tp": 46, "fp": 3, "tn": 79, "fn": 40, "aleatoric_mean": 1e-05, "epistemic_mean": 2e-05, "confidence_mean": 1.0, "aleatoric_std": 5e-06, "epistemic_std": 1e-05}, {"fold": "fold_5", "regime": "Low-vol plateau", "sharpe": 10.9753, "sortino": 31.6559, "return_pct": 34.99, "equity": 1349.94, "max_dd": 0.49, "win_rate": 75.93, "profit_factor": 7.027, "ic": 0.7389, "hit": 75.93, "n": 162, "precision": 0.8246, "recall": 0.6184, "f1": 0.7068, "f2": 0.651, "mcc": 0.5247, "accuracy": 0.7593, "tp": 47, "fp": 10, "tn": 76, "fn": 29, "aleatoric_mean": 6e-06, "epistemic_mean": 1.3e-05, "confidence_mean": 1.0, "aleatoric_std": 2e-06, "epistemic_std": 4e-06}, {"fold": "fold_6", "regime": "EUR crisis downturn", "sharpe": 12.2285, "sortino": 43.7502, "return_pct": 83.52, "equity": 1835.18, "max_dd": 0.82, "win_rate": 76.97, "profit_factor": 8.202, "ic": 0.7762, "hit": 76.97, "n": 165, "precision": 0.8679, "recall": 0.5974, "f1": 0.7077, "f2": 0.6371, "mcc": 0.5533, "accuracy": 0.7697, "tp": 46, "fp": 7, "tn": 81, "fn": 31, "aleatoric_mean": 1.1e-05, "epistemic_mean": 2.2e-05, "confidence_mean": 1.0, "aleatoric_std": 6e-06, "epistemic_std": 1.2e-05}, {"fold": "fold_7", "regime": "Recent mixed/upturn", "sharpe": 7.9481, "sortino": 12.1484, "return_pct": 52.35, "equity": 1523.52, "max_dd": 1.64, "win_rate": 71.6, "profit_factor": 4.004, "ic": 0.656, "hit": 71.6, "n": 162, "precision": 0.7869, "recall": 0.5926, "f1": 0.6761, "f2": 0.6234, "mcc": 0.4459, "accuracy": 0.716, "tp": 48, "fp": 13, "tn": 68, "fn": 33, "aleatoric_mean": 1.1e-05, "epistemic_mean": 2.2e-05, "confidence_mean": 1.0, "aleatoric_std": 4e-06, "epistemic_std": 9e-06}], "val_sharpe": 6.2938, "val_psr": 1.0, "val_equity": 3976.34, "val_sortino": 9.3032, "val_return_pct": 297.63, "val_max_dd": 9.22, "val_win_rate": 67.76, "val_profit_factor": 2.954, "val_ic": 0.5204, "val_hit": 67.32, "val_aleatoric_mean": 8e-06, "val_epistemic_mean": 1.7e-05, "val_confidence_mean": 1.0, "val_precision": 0.6959, "val_recall": 0.5644, "val_f1": 0.6233, "val_f2": 0.5866, "val_mcc": 0.35, "val_accuracy": 0.6758, "val_per_window": [{"fold": "fold_1", "regime": "Pre-crisis upturn + GFC onset", "sharpe": 0.0832, "sortino": 0.1329, "return_pct": 0.14, "equity": 1001.36, "max_dd": 3.8, "win_rate": 46.3, "profit_factor": 1.014, "ic": 0.0008, "hit": 45.87, "n": 109, "precision": 0.4706, "recall": 0.4364, "f1": 0.4528, "f2": 0.4428, "mcc": -0.0638, "accuracy": 0.4679, "tp": 24, "fp": 27, "tn": 27, "fn": 31, "aleatoric_mean": 9e-06, "epistemic_mean": 1.7e-05, "confidence_mean": 1.0, "aleatoric_std": 5e-06, "epistemic_std": 1e-05}, {"fold": "fold_2", "regime": "Post-crash recovery", "sharpe": -0.8186, "sortino": -1.3326, "return_pct": -4.16, "equity": 958.44, "max_dd": 9.22, "win_rate": 46.3, "profit_factor": 0.879, "ic": -0.012, "hit": 46.3, "n": 108, "precision": 0.5676, "recall": 0.3333, "f1": 0.42, "f2": 0.3633, "mcc": -0.0231, "accuracy": 0.463, "tp": 21, "fp": 16, "tn": 29, "fn": 42, "aleatoric_mean": 1.2e-05, "epistemic_mean": 2.4e-05, "confidence_mean": 1.0, "aleatoric_std": 7e-06, "epistemic_std": 1.3e-05}, {"fold": "fold_3", "regime": "Eurozone debt plateau", "sharpe": 11.0003, "sortino": 25.8877, "return_pct": 43.89, "equity": 1438.94, "max_dd": 0.94, "win_rate": 72.48, "profit_factor": 6.502, "ic": 0.7913, "hit": 71.17, "n": 111, "precision": 0.6087, "recall": 0.8936, "f1": 0.7241, "f2": 0.8171, "mcc": 0.4806, "accuracy": 0.7117, "tp": 42, "fp": 27, "tn": 37, "fn": 5, "aleatoric_mean": 8e-06, "epistemic_mean": 1.6e-05, "confidence_mean": 1.0, "aleatoric_std": 3e-06, "epistemic_std": 7e-06}, {"fold": "fold_4", "regime": "Strong USD downturn", "sharpe": 12.6634, "sortino": 34.1571, "return_pct": 40.88, "equity": 1408.77, "max_dd": 0.82, "win_rate": 79.82, "profit_factor": 10.024, "ic": 0.7404, "hit": 79.09, "n": 110, "precision": 0.931, "recall": 0.5745, "f1": 0.7105, "f2": 0.6221, "mcc": 0.6093, "accuracy": 0.8, "tp": 27, "fp": 2, "tn": 61, "fn": 20, "aleatoric_mean": 8e-06, "epistemic_mean": 1.6e-05, "confidence_mean": 1.0, "aleatoric_std": 3e-06, "epistemic_std": 6e-06}, {"fold": "fold_5", "regime": "Low-vol plateau", "sharpe": 11.3792, "sortino": 31.6641, "return_pct": 36.0, "equity": 1360.01, "max_dd": 1.2, "win_rate": 74.11, "profit_factor": 7.631, "ic": 0.7766, "hit": 74.11, "n": 112, "precision": 0.875, "recall": 0.5283, "f1": 0.6588, "f2": 0.5738, "mcc": 0.509, "accuracy": 0.7411, "tp": 28, "fp": 4, "tn": 55, "fn": 25, "aleatoric_mean": 7e-06, "epistemic_mean": 1.3e-05, "confidence_mean": 1.0, "aleatoric_std": 3e-06, "epistemic_std": 7e-06}, {"fold": "fold_6", "regime": "EUR crisis downturn", "sharpe": 11.3267, "sortino": 29.2281, "return_pct": 23.44, "equity": 1234.38, "max_dd": 0.77, "win_rate": 75.7, "profit_factor": 7.913, "ic": 0.8503, "hit": 75.0, "n": 108, "precision": 0.7941, "recall": 0.5745, "f1": 0.6667, "f2": 0.6081, "mcc": 0.4907, "accuracy": 0.75, "tp": 27, "fp": 7, "tn": 54, "fn": 20, "aleatoric_mean": 6e-06, "epistemic_mean": 1.1e-05, "confidence_mean": 1.0, "aleatoric_std": 2e-06, "epistemic_std": 4e-06}, {"fold": "fold_7", "regime": "Recent mixed/upturn", "sharpe": 9.618, "sortino": 19.5931, "return_pct": 21.75, "equity": 1217.46, "max_dd": 0.79, "win_rate": 79.09, "profit_factor": 4.899, "ic": 0.6959, "hit": 79.09, "n": 110, "precision": 0.8409, "recall": 0.6981, "f1": 0.7629, "f2": 0.7227, "mcc": 0.5868, "accuracy": 0.7909, "tp": 37, "fp": 7, "tn": 50, "fn": 16, "aleatoric_mean": 1e-05, "epistemic_mean": 1.9e-05, "confidence_mean": 1.0, "aleatoric_std": 4e-06, "epistemic_std": 9e-06}], "train_sharpe": 6.7609, "train_psr": 1.0, "train_equity": 1920563.12, "train_sortino": 16.7791, "train_return_pct": 191956.31, "train_max_dd": 4.82, "train_win_rate": 73.87, "train_profit_factor": 5.239, "train_ic": 0.693, "train_hit": 73.57, "train_precision": 0.8085, "train_recall": 0.6429, "train_f1": 0.7162, "train_f2": 0.6703, "train_mcc": 0.4898, "train_accuracy": 0.7381, "train_per_window": [{"fold": "all_train", "regime": "Training data", "sharpe": 6.7609, "sortino": 16.7791, "return_pct": 191956.31, "equity": 1920563.12, "max_dd": 4.82, "win_rate": 73.87, "profit_factor": 5.239, "ic": 0.693, "hit": 73.57, "n": 2478, "precision": 0.8085, "recall": 0.6429, "f1": 0.7162, "f2": 0.6703, "mcc": 0.4898, "accuracy": 0.7381, "tp": 819, "fp": 194, "tn": 1010, "fn": 455}], "experiment_num": 126, "status": "KEEP"}
