{"backbone": "lstm", "description": "lstm: Exp11 unidirectional causal (Qin2017 single-direction trading)", "config": {"seq_len": 10, "lr": 0.001, "batch_size": 32, "epochs": 100, "weight_decay": 0.0001, "patience": 15, "grad_clip": 1.0, "warmup_epochs": 0, "huber_delta": 1.0, "head_dropout": 0.25, "seed": 0, "bidirectional": false, "het_loss": false}, "composite": 5.0015, "test_pos_folds": 6, "val_pos_folds": 6, "val_loss": 3e-05, "elapsed_sec": 34.9, "timestamp": "2026-04-19T18:20:19", "sharpe": 5.2015, "psr": 1.0, "equity": 7739.86, "sortino": 6.4534, "return_pct": 673.99, "max_dd": 10.93, "win_rate": 67.49, "profit_factor": 2.68, "ic": 0.4727, "hit": 67.21, "aleatoric_mean": 7e-06, "epistemic_mean": 1.4e-05, "confidence_mean": 1.0, "precision": 0.6723, "recall": 0.6611, "f1": 0.6667, "f2": 0.6633, "mcc": 0.3462, "accuracy": 0.6732, "per_window": [{"fold": "fold_1", "regime": "Pre-crisis upturn + GFC onset", "sharpe": 1.4245, "sortino": 1.5441, "return_pct": 10.75, "equity": 1107.52, "max_dd": 9.69, "win_rate": 54.9, "profit_factor": 1.402, "ic": 0.1398, "hit": 54.37, "n": 103, "precision": 0.5455, "recall": 0.6792, "f1": 0.605, "f2": 0.6475, "mcc": 0.0826, "accuracy": 0.5437, "tp": 36, "fp": 30, "tn": 20, "fn": 17, "aleatoric_mean": 1.4e-05, "epistemic_mean": 2.8e-05, "confidence_mean": 1.0, "aleatoric_std": 1.4e-05, "epistemic_std": 2.7e-05}, {"fold": "fold_2", "regime": "Post-crash recovery", "sharpe": -1.3761, "sortino": -2.1498, "return_pct": -6.62, "equity": 933.76, "max_dd": 10.93, "win_rate": 48.6, "profit_factor": 0.806, "ic": 0.0579, "hit": 48.6, "n": 107, "precision": 0.4773, "recall": 0.8235, "f1": 0.6043, "f2": 0.7192, "mcc": 0.0027, "accuracy": 0.486, "tp": 42, "fp": 46, "tn": 10, "fn": 9, "aleatoric_mean": 8e-06, "epistemic_mean": 1.5e-05, "confidence_mean": 1.0, "aleatoric_std": 3e-06, "epistemic_std": 6e-06}, {"fold": "fold_3", "regime": "Eurozone debt plateau", "sharpe": 6.8785, "sortino": 12.7746, "return_pct": 24.93, "equity": 1249.27, "max_dd": 1.93, "win_rate": 72.12, "profit_factor": 2.963, "ic": 0.6747, "hit": 70.75, "n": 106, "precision": 0.6667, "recall": 0.9123, "f1": 0.7704, "f2": 0.8497, "mcc": 0.4316, "accuracy": 0.7075, "tp": 52, "fp": 26, "tn": 23, "fn": 5, "aleatoric_mean": 7e-06, "epistemic_mean": 1.4e-05, "confidence_mean": 1.0, "aleatoric_std": 3e-06, "epistemic_std": 5e-06}, {"fold": "fold_4", "regime": "Strong USD downturn", "sharpe": 9.528, "sortino": 26.1941, "return_pct": 87.99, "equity": 1879.86, "max_dd": 2.07, "win_rate": 75.45, "profit_factor": 5.371, "ic": 0.7013, "hit": 75.0, "n": 168, "precision": 0.8, "recall": 0.6977, "f1": 0.7453, "f2": 0.716, "mcc": 0.5176, "accuracy": 0.756, "tp": 60, "fp": 15, "tn": 67, "fn": 26, "aleatoric_mean": 6e-06, "epistemic_mean": 1.2e-05, "confidence_mean": 1.0, "aleatoric_std": 2e-06, "epistemic_std": 5e-06}, {"fold": "fold_5", "regime": "Low-vol plateau", "sharpe": 6.235, "sortino": 9.3898, "return_pct": 21.24, "equity": 1212.38, "max_dd": 1.76, "win_rate": 67.9, "profit_factor": 2.866, "ic": 0.5463, "hit": 67.9, "n": 162, "precision": 0.7609, "recall": 0.4605, "f1": 0.5738, "f2": 0.5, "mcc": 0.3681, "accuracy": 0.679, "tp": 35, "fp": 11, "tn": 75, "fn": 41, "aleatoric_mean": 5e-06, "epistemic_mean": 1.1e-05, "confidence_mean": 1.0, "aleatoric_std": 2e-06, "epistemic_std": 4e-06}, {"fold": "fold_6", "regime": "EUR crisis downturn", "sharpe": 11.1654, "sortino": 24.2265, "return_pct": 77.22, "equity": 1772.16, "max_dd": 1.03, "win_rate": 75.15, "profit_factor": 6.629, "ic": 0.7024, "hit": 75.15, "n": 165, "precision": 0.7903, "recall": 0.6364, "f1": 0.705, "f2": 0.6622, "mcc": 0.5033, "accuracy": 0.7515, "tp": 49, "fp": 13, "tn": 75, "fn": 28, "aleatoric_mean": 7e-06, "epistemic_mean": 1.4e-05, "confidence_mean": 1.0, "aleatoric_std": 2e-06, "epistemic_std": 5e-06}, {"fold": "fold_7", "regime": "Recent mixed/upturn", "sharpe": 7.3345, "sortino": 14.4472, "return_pct": 48.33, "equity": 1483.29, "max_dd": 2.82, "win_rate": 68.52, "profit_factor": 3.57, "ic": 0.5978, "hit": 68.52, "n": 162, "precision": 0.7586, "recall": 0.5432, "f1": 0.6331, "f2": 0.5759, "mcc": 0.3863, "accuracy": 0.6852, "tp": 44, "fp": 14, "tn": 67, "fn": 37, "aleatoric_mean": 6e-06, "epistemic_mean": 1.3e-05, "confidence_mean": 1.0, "aleatoric_std": 2e-06, "epistemic_std": 4e-06}], "val_sharpe": 5.6241, "val_psr": 1.0, "val_equity": 3489.88, "val_sortino": 8.9335, "val_return_pct": 248.99, "val_max_dd": 5.07, "val_win_rate": 65.92, "val_profit_factor": 2.622, "val_ic": 0.4817, "val_hit": 65.49, "val_aleatoric_mean": 6e-06, "val_epistemic_mean": 1.1e-05, "val_confidence_mean": 1.0, "val_precision": 0.6548, "val_recall": 0.6027, "val_f1": 0.6277, "val_f2": 0.6125, "val_mcc": 0.317, "val_accuracy": 0.6602, "val_per_window": [{"fold": "fold_1", "regime": "Pre-crisis upturn + GFC onset", "sharpe": -0.1938, "sortino": -0.3025, "return_pct": -0.56, "equity": 994.39, "max_dd": 3.39, "win_rate": 48.15, "profit_factor": 0.968, "ic": 0.0944, "hit": 47.71, "n": 109, "precision": 0.4912, "recall": 0.5091, "f1": 0.5, "f2": 0.5054, "mcc": -0.028, "accuracy": 0.4862, "tp": 28, "fp": 29, "tn": 25, "fn": 27, "aleatoric_mean": 6e-06, "epistemic_mean": 1.2e-05, "confidence_mean": 1.0, "aleatoric_std": 3e-06, "epistemic_std": 5e-06}, {"fold": "fold_2", "regime": "Post-crash recovery", "sharpe": 2.0191, "sortino": 3.0825, "return_pct": 9.91, "equity": 1099.12, "max_dd": 5.07, "win_rate": 57.41, "profit_factor": 1.376, "ic": 0.2089, "hit": 57.41, "n": 108, "precision": 0.6269, "recall": 0.6667, "f1": 0.6462, "f2": 0.6583, "mcc": 0.1129, "accuracy": 0.5741, "tp": 42, "fp": 25, "tn": 20, "fn": 21, "aleatoric_mean": 7e-06, "epistemic_mean": 1.3e-05, "confidence_mean": 1.0, "aleatoric_std": 3e-06, "epistemic_std": 5e-06}, {"fold": "fold_3", "regime": "Eurozone debt plateau", "sharpe": 8.8373, "sortino": 20.7063, "return_pct": 36.41, "equity": 1364.11, "max_dd": 2.03, "win_rate": 69.72, "profit_factor": 4.352, "ic": 0.6458, "hit": 68.47, "n": 111, "precision": 0.6066, "recall": 0.7872, "f1": 0.6852, "f2": 0.743, "mcc": 0.4094, "accuracy": 0.6937, "tp": 37, "fp": 24, "tn": 40, "fn": 10, "aleatoric_mean": 6e-06, "epistemic_mean": 1.1e-05, "confidence_mean": 1.0, "aleatoric_std": 2e-06, "epistemic_std": 4e-06}, {"fold": "fold_4", "regime": "Strong USD downturn", "sharpe": 11.5935, "sortino": 27.3269, "return_pct": 38.27, "equity": 1382.72, "max_dd": 0.61, "win_rate": 80.73, "profit_factor": 7.856, "ic": 0.6814, "hit": 80.0, "n": 110, "precision": 0.7955, "recall": 0.7447, "f1": 0.7692, "f2": 0.7543, "mcc": 0.6077, "accuracy": 0.8091, "tp": 35, "fp": 9, "tn": 54, "fn": 12, "aleatoric_mean": 5e-06, "epistemic_mean": 1.1e-05, "confidence_mean": 1.0, "aleatoric_std": 2e-06, "epistemic_std": 4e-06}, {"fold": "fold_5", "regime": "Low-vol plateau", "sharpe": 8.2113, "sortino": 20.2905, "return_pct": 27.41, "equity": 1274.08, "max_dd": 1.28, "win_rate": 68.75, "profit_factor": 4.074, "ic": 0.629, "hit": 68.75, "n": 112, "precision": 0.75, "recall": 0.5094, "f1": 0.6067, "f2": 0.5444, "mcc": 0.3815, "accuracy": 0.6875, "tp": 27, "fp": 9, "tn": 50, "fn": 26, "aleatoric_mean": 5e-06, "epistemic_mean": 9e-06, "confidence_mean": 1.0, "aleatoric_std": 2e-06, "epistemic_std": 3e-06}, {"fold": "fold_6", "regime": "EUR crisis downturn", "sharpe": 4.9081, "sortino": 9.4788, "return_pct": 11.27, "equity": 1112.7, "max_dd": 1.38, "win_rate": 62.62, "profit_factor": 2.303, "ic": 0.7766, "hit": 62.04, "n": 108, "precision": 1.0, "recall": 0.1489, "f1": 0.2593, "f2": 0.1795, "mcc": 0.2999, "accuracy": 0.6296, "tp": 7, "fp": 0, "tn": 61, "fn": 40, "aleatoric_mean": 5e-06, "epistemic_mean": 1e-05, "confidence_mean": 1.0, "aleatoric_std": 2e-06, "epistemic_std": 3e-06}, {"fold": "fold_7", "regime": "Recent mixed/upturn", "sharpe": 8.3934, "sortino": 16.9969, "return_pct": 19.41, "equity": 1194.14, "max_dd": 1.01, "win_rate": 73.64, "profit_factor": 3.953, "ic": 0.5138, "hit": 73.64, "n": 110, "precision": 0.6875, "recall": 0.8302, "f1": 0.7521, "f2": 0.7971, "mcc": 0.4855, "accuracy": 0.7364, "tp": 44, "fp": 20, "tn": 37, "fn": 9, "aleatoric_mean": 6e-06, "epistemic_mean": 1.1e-05, "confidence_mean": 1.0, "aleatoric_std": 2e-06, "epistemic_std": 4e-06}], "train_sharpe": 6.3043, "train_psr": 1.0, "train_equity": 1232990.38, "train_sortino": 16.0824, "train_return_pct": 123199.04, "train_max_dd": 5.31, "train_win_rate": 71.76, "train_profit_factor": 4.556, "train_ic": 0.6141, "train_hit": 71.47, "train_precision": 0.7463, "train_recall": 0.679, "train_f1": 0.7111, "train_f2": 0.6914, "train_mcc": 0.4355, "train_accuracy": 0.7163, "train_per_window": [{"fold": "all_train", "regime": "Training data", "sharpe": 6.3043, "sortino": 16.0824, "return_pct": 123199.04, "equity": 1232990.38, "max_dd": 5.31, "win_rate": 71.76, "profit_factor": 4.556, "ic": 0.6141, "hit": 71.47, "n": 2478, "precision": 0.7463, "recall": 0.679, "f1": 0.7111, "f2": 0.6914, "mcc": 0.4355, "accuracy": 0.7163, "tp": 865, "fp": 294, "tn": 910, "fn": 409}], "experiment_num": 115, "status": "DISCARD"}
{"backbone": "lstm", "description": "lstm: Exp12 seq=20 longer temporal context (Bao2017)", "config": {"seq_len": 20, "lr": 0.001, "batch_size": 32, "epochs": 100, "weight_decay": 0.0001, "patience": 15, "grad_clip": 1.0, "warmup_epochs": 0, "huber_delta": 1.0, "head_dropout": 0.25, "seed": 0, "het_loss": false}, "composite": 4.2497, "test_pos_folds": 6, "val_pos_folds": 6, "val_loss": 2.9e-05, "elapsed_sec": 23.3, "timestamp": "2026-04-19T18:21:46", "sharpe": 4.4497, "psr": 1.0, "equity": 5317.21, "sortino": 5.3171, "return_pct": 431.72, "max_dd": 10.96, "win_rate": 66.52, "profit_factor": 2.323, "ic": 0.3941, "hit": 66.22, "aleatoric_mean": 2.9e-05, "epistemic_mean": 5.9e-05, "confidence_mean": 0.9999, "precision": 0.6707, "recall": 0.6222, "f1": 0.6455, "f2": 0.6313, "mcc": 0.3307, "accuracy": 0.6656, "per_window": [{"fold": "fold_1", "regime": "Pre-crisis upturn + GFC onset", "sharpe": 0.2425, "sortino": 0.2678, "return_pct": 1.05, "equity": 1010.45, "max_dd": 10.96, "win_rate": 51.09, "profit_factor": 1.06, "ic": -0.0184, "hit": 50.54, "n": 93, "precision": 0.5385, "recall": 0.2917, "f1": 0.3784, "f2": 0.3211, "mcc": 0.0278, "accuracy": 0.5054, "tp": 14, "fp": 12, "tn": 33, "fn": 34, "aleatoric_mean": 4.1e-05, "epistemic_mean": 8.2e-05, "confidence_mean": 0.9999, "aleatoric_std": 2.3e-05, "epistemic_std": 4.6e-05}, {"fold": "fold_2", "regime": "Post-crash recovery", "sharpe": -1.4268, "sortino": -2.373, "return_pct": -6.36, "equity": 936.37, "max_dd": 9.29, "win_rate": 50.52, "profit_factor": 0.8, "ic": 0.0533, "hit": 50.52, "n": 97, "precision": 0.4925, "recall": 0.7021, "f1": 0.5789, "f2": 0.6471, "mcc": 0.0239, "accuracy": 0.5052, "tp": 33, "fp": 34, "tn": 16, "fn": 14, "aleatoric_mean": 3.2e-05, "epistemic_mean": 6.3e-05, "confidence_mean": 0.9999, "aleatoric_std": 1.4e-05, "epistemic_std": 2.8e-05}, {"fold": "fold_3", "regime": "Eurozone debt plateau", "sharpe": 10.8647, "sortino": 20.8706, "return_pct": 34.14, "equity": 1341.36, "max_dd": 1.28, "win_rate": 79.79, "profit_factor": 5.743, "ic": 0.6179, "hit": 78.12, "n": 96, "precision": 0.8163, "recall": 0.8, "f1": 0.8081, "f2": 0.8032, "mcc": 0.604, "accuracy": 0.8021, "tp": 40, "fp": 9, "tn": 37, "fn": 10, "aleatoric_mean": 2.9e-05, "epistemic_mean": 5.7e-05, "confidence_mean": 0.9999, "aleatoric_std": 1.1e-05, "epistemic_std": 2.2e-05}, {"fold": "fold_4", "regime": "Strong USD downturn", "sharpe": 6.7677, "sortino": 16.1417, "return_pct": 58.07, "equity": 1580.75, "max_dd": 2.3, "win_rate": 64.33, "profit_factor": 3.208, "ic": 0.536, "hit": 63.92, "n": 158, "precision": 0.6825, "recall": 0.5443, "f1": 0.6056, "f2": 0.5673, "mcc": 0.2973, "accuracy": 0.6456, "tp": 43, "fp": 20, "tn": 59, "fn": 36, "aleatoric_mean": 2.8e-05, "epistemic_mean": 5.6e-05, "confidence_mean": 0.9999, "aleatoric_std": 1.1e-05, "epistemic_std": 2.2e-05}, {"fold": "fold_5", "regime": "Low-vol plateau", "sharpe": 7.4013, "sortino": 12.8509, "return_pct": 22.77, "equity": 1227.74, "max_dd": 1.08, "win_rate": 71.05, "profit_factor": 3.509, "ic": 0.56, "hit": 71.05, "n": 152, "precision": 0.7167, "recall": 0.6143, "f1": 0.6615, "f2": 0.6324, "mcc": 0.415, "accuracy": 0.7105, "tp": 43, "fp": 17, "tn": 65, "fn": 27, "aleatoric_mean": 2.2e-05, "epistemic_mean": 4.4e-05, "confidence_mean": 0.9999, "aleatoric_std": 7e-06, "epistemic_std": 1.4e-05}, {"fold": "fold_6", "regime": "EUR crisis downturn", "sharpe": 8.8136, "sortino": 16.1736, "return_pct": 58.44, "equity": 1584.36, "max_dd": 1.63, "win_rate": 71.61, "profit_factor": 4.289, "ic": 0.5735, "hit": 71.61, "n": 155, "precision": 0.7188, "recall": 0.6389, "f1": 0.6765, "f2": 0.6534, "mcc": 0.4275, "accuracy": 0.7161, "tp": 46, "fp": 18, "tn": 65, "fn": 26, "aleatoric_mean": 2.8e-05, "epistemic_mean": 5.5e-05, "confidence_mean": 0.9999, "aleatoric_std": 9e-06, "epistemic_std": 1.8e-05}, {"fold": "fold_7", "regime": "Recent mixed/upturn", "sharpe": 5.9451, "sortino": 6.8678, "return_pct": 36.25, "equity": 1362.54, "max_dd": 3.27, "win_rate": 70.39, "profit_factor": 2.759, "ic": 0.4958, "hit": 70.39, "n": 152, "precision": 0.6914, "recall": 0.7368, "f1": 0.7134, "f2": 0.7273, "mcc": 0.4088, "accuracy": 0.7039, "tp": 56, "fp": 25, "tn": 51, "fn": 20, "aleatoric_mean": 3.1e-05, "epistemic_mean": 6.2e-05, "confidence_mean": 0.9999, "aleatoric_std": 1e-05, "epistemic_std": 2.1e-05}], "val_sharpe": 5.1482, "val_psr": 1.0, "val_equity": 2867.08, "val_sortino": 8.389, "val_return_pct": 186.71, "val_max_dd": 7.21, "val_win_rate": 63.35, "val_profit_factor": 2.406, "val_ic": 0.3844, "val_hit": 62.89, "val_aleatoric_mean": 2.6e-05, "val_epistemic_mean": 5.3e-05, "val_confidence_mean": 0.9999, "val_precision": 0.6111, "val_recall": 0.6, "val_f1": 0.6055, "val_f2": 0.6022, "val_mcc": 0.2579, "val_accuracy": 0.6304, "val_per_window": [{"fold": "fold_1", "regime": "Pre-crisis upturn + GFC onset", "sharpe": 4.0198, "sortino": 9.1131, "return_pct": 9.48, "equity": 1094.76, "max_dd": 1.37, "win_rate": 55.1, "profit_factor": 1.957, "ic": 0.1662, "hit": 54.55, "n": 99, "precision": 0.5312, "recall": 0.6939, "f1": 0.6018, "f2": 0.6538, "mcc": 0.0982, "accuracy": 0.5455, "tp": 34, "fp": 30, "tn": 20, "fn": 15, "aleatoric_mean": 2.6e-05, "epistemic_mean": 5.2e-05, "confidence_mean": 0.9999, "aleatoric_std": 1e-05, "epistemic_std": 2e-05}, {"fold": "fold_2", "regime": "Post-crash recovery", "sharpe": -1.444, "sortino": -2.3603, "return_pct": -6.11, "equity": 938.94, "max_dd": 7.21, "win_rate": 40.82, "profit_factor": 0.795, "ic": -0.0346, "hit": 40.82, "n": 98, "precision": 0.4815, "recall": 0.2281, "f1": 0.3095, "f2": 0.2549, "mcc": -0.1252, "accuracy": 0.4082, "tp": 13, "fp": 14, "tn": 27, "fn": 44, "aleatoric_mean": 3e-05, "epistemic_mean": 6.1e-05, "confidence_mean": 0.9999, "aleatoric_std": 1.2e-05, "epistemic_std": 2.4e-05}, {"fold": "fold_3", "regime": "Eurozone debt plateau", "sharpe": 9.6653, "sortino": 21.0241, "return_pct": 36.59, "equity": 1365.89, "max_dd": 2.03, "win_rate": 72.73, "profit_factor": 5.065, "ic": 0.622, "hit": 71.29, "n": 101, "precision": 0.6222, "recall": 0.7, "f1": 0.6588, "f2": 0.6829, "mcc": 0.4146, "accuracy": 0.7129, "tp": 28, "fp": 17, "tn": 44, "fn": 12, "aleatoric_mean": 2.4e-05, "epistemic_mean": 4.8e-05, "confidence_mean": 0.9999, "aleatoric_std": 9e-06, "epistemic_std": 1.7e-05}, {"fold": "fold_4", "regime": "Strong USD downturn", "sharpe": 6.996, "sortino": 14.4797, "return_pct": 23.2, "equity": 1232.04, "max_dd": 1.54, "win_rate": 71.72, "profit_factor": 3.194, "ic": 0.5628, "hit": 71.0, "n": 100, "precision": 0.6316, "recall": 0.8182, "f1": 0.7129, "f2": 0.7725, "mcc": 0.4444, "accuracy": 0.71, "tp": 36, "fp": 21, "tn": 35, "fn": 8, "aleatoric_mean": 2.6e-05, "epistemic_mean": 5.2e-05, "confidence_mean": 0.9999, "aleatoric_std": 9e-06, "epistemic_std": 1.9e-05}, {"fold": "fold_5", "regime": "Low-vol plateau", "sharpe": 5.431, "sortino": 12.5242, "return_pct": 17.05, "equity": 1170.49, "max_dd": 1.46, "win_rate": 56.86, "profit_factor": 2.51, "ic": 0.4353, "hit": 56.86, "n": 102, "precision": 0.5581, "recall": 0.4898, "f1": 0.5217, "f2": 0.5021, "mcc": 0.1328, "accuracy": 0.5686, "tp": 24, "fp": 19, "tn": 34, "fn": 25, "aleatoric_mean": 2.3e-05, "epistemic_mean": 4.6e-05, "confidence_mean": 0.9999, "aleatoric_std": 8e-06, "epistemic_std": 1.6e-05}, {"fold": "fold_6", "regime": "EUR crisis downturn", "sharpe": 12.1539, "sortino": 46.1323, "return_pct": 22.28, "equity": 1222.78, "max_dd": 0.28, "win_rate": 74.23, "profit_factor": 9.399, "ic": 0.756, "hit": 73.47, "n": 98, "precision": 0.7297, "recall": 0.6429, "f1": 0.6835, "f2": 0.6585, "mcc": 0.474, "accuracy": 0.7449, "tp": 27, "fp": 10, "tn": 46, "fn": 15, "aleatoric_mean": 2.3e-05, "epistemic_mean": 4.6e-05, "confidence_mean": 0.9999, "aleatoric_std": 7e-06, "epistemic_std": 1.5e-05}, {"fold": "fold_7", "regime": "Recent mixed/upturn", "sharpe": 7.4431, "sortino": 14.1559, "return_pct": 15.8, "equity": 1158.05, "max_dd": 1.98, "win_rate": 72.0, "profit_factor": 3.357, "ic": 0.5164, "hit": 72.0, "n": 100, "precision": 0.7059, "recall": 0.7347, "f1": 0.72, "f2": 0.7287, "mcc": 0.4406, "accuracy": 0.72, "tp": 36, "fp": 15, "tn": 36, "fn": 13, "aleatoric_mean": 3.2e-05, "epistemic_mean": 6.4e-05, "confidence_mean": 0.9999, "aleatoric_std": 1.1e-05, "epistemic_std": 2.2e-05}], "train_sharpe": 5.1998, "train_psr": 1.0, "train_equity": 247478.91, "train_sortino": 13.0947, "train_return_pct": 24647.89, "train_max_dd": 4.67, "train_win_rate": 67.8, "train_profit_factor": 3.425, "train_ic": 0.5008, "train_hit": 67.49, "train_precision": 0.7018, "train_recall": 0.6438, "train_f1": 0.6716, "train_f2": 0.6546, "train_mcc": 0.3575, "train_accuracy": 0.6776, "train_per_window": [{"fold": "all_train", "regime": "Training data", "sharpe": 5.1998, "sortino": 13.0947, "return_pct": 24647.89, "equity": 247478.91, "max_dd": 4.67, "win_rate": 67.8, "profit_factor": 3.425, "ic": 0.5008, "hit": 67.49, "n": 2221, "precision": 0.7018, "recall": 0.6438, "f1": 0.6716, "f2": 0.6546, "mcc": 0.3575, "accuracy": 0.6776, "tp": 732, "fp": 311, "tn": 773, "fn": 405}], "experiment_num": 116, "status": "DISCARD"}
