{"backbone": "xgboost", "description": "Exp16 seq=5", "config": {"seq_len": 5, "lr": 0.0003, "batch_size": 32, "epochs": 20, "weight_decay": 1e-05, "patience": 5, "grad_clip": 1.0, "warmup_epochs": 0, "huber_delta": 1.0, "head_dropout": 0.1, "seed": 42, "max_depth": 4, "gbm_lr": 0.01, "het_loss": false}, "composite": 7.3409, "test_pos_folds": 7, "val_pos_folds": 6, "val_loss": 0.0, "elapsed_sec": 44.2, "timestamp": "2026-04-21T06:27:37", "sharpe": 7.8217, "psr": 1.0, "equity": 20102.84, "sortino": 7.9333, "return_pct": 1910.28, "max_dd": 8.32, "win_rate": 77.89, "profit_factor": 4.643, "ic": 0.6864, "hit": 77.58, "precision": 0.7948, "recall": 0.7368, "f1": 0.7647, "f2": 0.7477, "mcc": 0.5562, "accuracy": 0.7778, "per_window": [{"fold": "fold_1", "regime": "Pre-crisis upturn + GFC onset", "sharpe": 0.4435, "sortino": 0.4966, "return_pct": 2.82, "equity": 1028.16, "max_dd": 7.54, "win_rate": 51.4, "profit_factor": 1.11, "ic": 0.1741, "hit": 50.93, "n": 108, "precision": 0.5333, "recall": 0.2963, "f1": 0.381, "f2": 0.3252, "mcc": 0.0413, "accuracy": 0.5185, "tp": 16, "fp": 14, "tn": 40, "fn": 38}, {"fold": "fold_2", "regime": "Post-crash recovery", "sharpe": 0.8191, "sortino": 1.4436, "return_pct": 3.86, "equity": 1038.57, "max_dd": 8.32, "win_rate": 55.36, "profit_factor": 1.137, "ic": 0.0098, "hit": 55.36, "n": 112, "precision": 0.5455, "recall": 0.4444, "f1": 0.4898, "f2": 0.4615, "mcc": 0.1019, "accuracy": 0.5536, "tp": 24, "fp": 20, "tn": 38, "fn": 30}, {"fold": "fold_3", "regime": "Eurozone debt plateau", "sharpe": 15.8288, "sortino": 27.5506, "return_pct": 53.92, "equity": 1539.18, "max_dd": 1.32, "win_rate": 86.24, "profit_factor": 16.613, "ic": 0.8179, "hit": 84.68, "n": 111, "precision": 0.8525, "recall": 0.8667, "f1": 0.8595, "f2": 0.8638, "mcc": 0.6913, "accuracy": 0.8468, "tp": 52, "fp": 9, "tn": 42, "fn": 8}, {"fold": "fold_4", "regime": "Strong USD downturn", "sharpe": 14.3551, "sortino": 32.5936, "return_pct": 133.1, "equity": 2331.05, "max_dd": 0.97, "win_rate": 87.79, "profit_factor": 17.049, "ic": 0.8655, "hit": 87.28, "n": 173, "precision": 0.875, "recall": 0.8851, "f1": 0.88, "f2": 0.883, "mcc": 0.7573, "accuracy": 0.8786, "tp": 77, "fp": 11, "tn": 75, "fn": 10}, {"fold": "fold_5", "regime": "Low-vol plateau", "sharpe": 15.6196, "sortino": 75.7248, "return_pct": 46.59, "equity": 1465.91, "max_dd": 0.23, "win_rate": 85.03, "profit_factor": 24.484, "ic": 0.9048, "hit": 85.03, "n": 167, "precision": 0.84, "recall": 0.8289, "f1": 0.8344, "f2": 0.8311, "mcc": 0.6979, "accuracy": 0.8503, "tp": 63, "fp": 12, "tn": 79, "fn": 13}, {"fold": "fold_6", "regime": "EUR crisis downturn", "sharpe": 15.1681, "sortino": 63.1077, "return_pct": 102.4, "equity": 2024.02, "max_dd": 0.43, "win_rate": 81.18, "profit_factor": 16.112, "ic": 0.8778, "hit": 81.18, "n": 170, "precision": 0.8243, "recall": 0.7625, "f1": 0.7922, "f2": 0.7741, "mcc": 0.6222, "accuracy": 0.8118, "tp": 61, "fp": 13, "tn": 77, "fn": 19}, {"fold": "fold_7", "regime": "Recent mixed/upturn", "sharpe": 11.743, "sortino": 16.8954, "return_pct": 76.85, "equity": 1768.46, "max_dd": 1.64, "win_rate": 83.83, "profit_factor": 9.03, "ic": 0.8122, "hit": 83.83, "n": 167, "precision": 0.8256, "recall": 0.8554, "f1": 0.8402, "f2": 0.8493, "mcc": 0.6771, "accuracy": 0.8383, "tp": 71, "fp": 15, "tn": 69, "fn": 12}], "val_sharpe": 7.4409, "val_psr": 1.0, "val_equity": 5209.27, "val_sortino": 9.2318, "val_return_pct": 420.93, "val_max_dd": 19.61, "val_win_rate": 74.94, "val_profit_factor": 3.64, "val_ic": 0.6722, "val_hit": 74.47, "val_precision": 0.7126, "val_recall": 0.8031, "val_f1": 0.7552, "val_f2": 0.7832, "val_mcc": 0.5047, "val_accuracy": 0.7497, "val_per_window": [{"fold": "fold_1", "regime": "Pre-crisis upturn + GFC onset", "sharpe": 2.3051, "sortino": 4.2639, "return_pct": 6.1, "equity": 1060.99, "max_dd": 1.89, "win_rate": 52.21, "profit_factor": 1.465, "ic": 0.0523, "hit": 51.75, "n": 114, "precision": 0.5275, "recall": 0.8, "f1": 0.6358, "f2": 0.7251, "mcc": 0.0046, "accuracy": 0.5175, "tp": 48, "fp": 43, "tn": 11, "fn": 12}, {"fold": "fold_2", "regime": "Post-crash recovery", "sharpe": -3.6346, "sortino": -5.6284, "return_pct": -16.52, "equity": 834.8, "max_dd": 18.77, "win_rate": 40.71, "profit_factor": 0.563, "ic": -0.1681, "hit": 40.71, "n": 113, "precision": 0.4769, "recall": 0.4844, "f1": 0.4806, "f2": 0.4829, "mcc": -0.21, "accuracy": 0.4071, "tp": 31, "fp": 34, "tn": 15, "fn": 33}, {"fold": "fold_3", "regime": "Eurozone debt plateau", "sharpe": 15.1766, "sortino": 42.1708, "return_pct": 58.59, "equity": 1585.87, "max_dd": 0.64, "win_rate": 86.84, "profit_factor": 16.47, "ic": 0.8522, "hit": 85.34, "n": 116, "precision": 0.8182, "recall": 0.9, "f1": 0.8571, "f2": 0.8824, "mcc": 0.7423, "accuracy": 0.8707, "tp": 45, "fp": 10, "tn": 56, "fn": 5}, {"fold": "fold_4", "regime": "Strong USD downturn", "sharpe": 15.7797, "sortino": 61.8783, "return_pct": 48.79, "equity": 1487.86, "max_dd": 0.34, "win_rate": 88.6, "profit_factor": 28.957, "ic": 0.9236, "hit": 87.83, "n": 115, "precision": 0.8776, "recall": 0.86, "f1": 0.8687, "f2": 0.8635, "mcc": 0.7696, "accuracy": 0.887, "tp": 43, "fp": 6, "tn": 59, "fn": 7}, {"fold": "fold_5", "regime": "Low-vol plateau", "sharpe": 14.7809, "sortino": 59.6931, "return_pct": 44.91, "equity": 1449.12, "max_dd": 0.34, "win_rate": 82.91, "profit_factor": 18.399, "ic": 0.9163, "hit": 82.91, "n": 117, "precision": 0.8136, "recall": 0.8421, "f1": 0.8276, "f2": 0.8362, "mcc": 0.6586, "accuracy": 0.8291, "tp": 48, "fp": 11, "tn": 49, "fn": 9}, {"fold": "fold_6", "regime": "EUR crisis downturn", "sharpe": 16.3069, "sortino": 104.0331, "return_pct": 30.93, "equity": 1309.31, "max_dd": 0.15, "win_rate": 89.29, "profit_factor": 39.218, "ic": 0.9297, "hit": 88.5, "n": 113, "precision": 0.8545, "recall": 0.9216, "f1": 0.8868, "f2": 0.9073, "mcc": 0.7891, "accuracy": 0.8938, "tp": 47, "fp": 8, "tn": 54, "fn": 4}, {"fold": "fold_7", "regime": "Recent mixed/upturn", "sharpe": 14.3385, "sortino": 38.9266, "return_pct": 31.37, "equity": 1313.72, "max_dd": 0.5, "win_rate": 83.48, "profit_factor": 14.22, "ic": 0.8525, "hit": 83.48, "n": 115, "precision": 0.7869, "recall": 0.8889, "f1": 0.8348, "f2": 0.8664, "mcc": 0.6758, "accuracy": 0.8348, "tp": 48, "fp": 13, "tn": 48, "fn": 6}], "train_sharpe": 10.4885, "train_psr": 1.0, "train_equity": 84025728.0, "train_sortino": 76.8999, "train_return_pct": 8402472.8, "train_max_dd": 1.02, "train_win_rate": 90.37, "train_profit_factor": 47.348, "train_ic": 0.9395, "train_hit": 89.99, "train_precision": 0.8977, "train_recall": 0.913, "train_f1": 0.9053, "train_f2": 0.9099, "train_mcc": 0.8027, "train_accuracy": 0.9015, "train_per_window": [{"fold": "all_train", "regime": "Training data", "sharpe": 10.4885, "sortino": 76.8999, "return_pct": 8402472.8, "equity": 84025728.0, "max_dd": 1.02, "win_rate": 90.37, "profit_factor": 47.348, "ic": 0.9395, "hit": 89.99, "n": 2608, "precision": 0.8977, "recall": 0.913, "f1": 0.9053, "f2": 0.9099, "mcc": 0.8027, "accuracy": 0.9015, "tp": 1228, "fp": 140, "tn": 1123, "fn": 117}], "experiment_num": 193, "status": "DISCARD"}
{"backbone": "xgboost", "description": "Exp17 n_est=3000", "config": {"seq_len": 10, "lr": 0.0003, "batch_size": 32, "epochs": 20, "weight_decay": 1e-05, "patience": 5, "grad_clip": 1.0, "warmup_epochs": 0, "huber_delta": 1.0, "head_dropout": 0.1, "seed": 42, "n_estimators": 3000, "max_depth": 4, "gbm_lr": 0.01, "het_loss": false}, "composite": 7.7389, "test_pos_folds": 6, "val_pos_folds": 6, "val_loss": 0.0, "elapsed_sec": 172.4, "timestamp": "2026-04-21T06:30:40", "sharpe": 7.9389, "psr": 1.0, "equity": 19096.93, "sortino": 7.7745, "return_pct": 1809.69, "max_dd": 7.54, "win_rate": 78.84, "profit_factor": 4.812, "ic": 0.6775, "hit": 78.52, "precision": 0.8128, "recall": 0.7401, "f1": 0.7748, "f2": 0.7536, "mcc": 0.5763, "accuracy": 0.7873, "per_window": [{"fold": "fold_1", "regime": "Pre-crisis upturn + GFC onset", "sharpe": -0.0403, "sortino": -0.0442, "return_pct": -1.04, "equity": 989.62, "max_dd": 7.54, "win_rate": 52.94, "profit_factor": 0.991, "ic": 0.2517, "hit": 52.43, "n": 103, "precision": 0.6923, "recall": 0.1698, "f1": 0.2727, "f2": 0.2, "mcc": 0.1352, "accuracy": 0.534, "tp": 9, "fp": 4, "tn": 46, "fn": 44}, {"fold": "fold_2", "regime": "Post-crash recovery", "sharpe": 2.6895, "sortino": 5.0832, "return_pct": 13.27, "equity": 1132.68, "max_dd": 4.23, "win_rate": 57.94, "profit_factor": 1.524, "ic": 0.0614, "hit": 57.94, "n": 107, "precision": 0.5577, "recall": 0.5686, "f1": 0.5631, "f2": 0.5664, "mcc": 0.1578, "accuracy": 0.5794, "tp": 29, "fp": 23, "tn": 33, "fn": 22}, {"fold": "fold_3", "regime": "Eurozone debt plateau", "sharpe": 14.293, "sortino": 23.9095, "return_pct": 45.58, "equity": 1455.83, "max_dd": 1.32, "win_rate": 85.58, "profit_factor": 11.024, "ic": 0.7475, "hit": 83.96, "n": 106, "precision": 0.8448, "recall": 0.8596, "f1": 0.8522, "f2": 0.8566, "mcc": 0.6771, "accuracy": 0.8396, "tp": 49, "fp": 9, "tn": 40, "fn": 8}, {"fold": "fold_4", "regime": "Strong USD downturn", "sharpe": 14.5648, "sortino": 19.1118, "return_pct": 129.47, "equity": 2294.7, "max_dd": 1.81, "win_rate": 89.82, "profit_factor": 19.263, "ic": 0.876, "hit": 89.29, "n": 168, "precision": 0.9157, "recall": 0.8837, "f1": 0.8994, "f2": 0.8899, "mcc": 0.7982, "accuracy": 0.8988, "tp": 76, "fp": 7, "tn": 75, "fn": 10}, {"fold": "fold_5", "regime": "Low-vol plateau", "sharpe": 14.9953, "sortino": 72.8264, "return_pct": 43.69, "equity": 1436.91, "max_dd": 0.23, "win_rate": 83.33, "profit_factor": 20.416, "ic": 0.8922, "hit": 83.33, "n": 162, "precision": 0.8356, "recall": 0.8026, "f1": 0.8188, "f2": 0.809, "mcc": 0.6651, "accuracy": 0.8333, "tp": 61, "fp": 12, "tn": 74, "fn": 15}, {"fold": "fold_6", "regime": "EUR crisis downturn", "sharpe": 14.9342, "sortino": 59.4528, "return_pct": 97.8, "equity": 1978.0, "max_dd": 0.43, "win_rate": 81.82, "profit_factor": 15.501, "ic": 0.8835, "hit": 81.82, "n": 165, "precision": 0.8052, "recall": 0.8052, "f1": 0.8052, "f2": 0.8052, "mcc": 0.6347, "accuracy": 0.8182, "tp": 62, "fp": 15, "tn": 73, "fn": 15}, {"fold": "fold_7", "regime": "Recent mixed/upturn", "sharpe": 12.5615, "sortino": 16.6955, "return_pct": 79.43, "equity": 1794.29, "max_dd": 1.64, "win_rate": 85.8, "profit_factor": 10.907, "ic": 0.8193, "hit": 85.8, "n": 162, "precision": 0.8537, "recall": 0.8642, "f1": 0.8589, "f2": 0.8621, "mcc": 0.7161, "accuracy": 0.858, "tp": 70, "fp": 12, "tn": 69, "fn": 11}], "val_sharpe": 8.2305, "val_psr": 1.0, "val_equity": 5619.21, "val_sortino": 10.3359, "val_return_pct": 461.92, "val_max_dd": 11.1, "val_win_rate": 74.84, "val_profit_factor": 4.225, "val_ic": 0.6746, "val_hit": 74.35, "val_precision": 0.7048, "val_recall": 0.811, "val_f1": 0.7541, "val_f2": 0.7872, "val_mcc": 0.5049, "val_accuracy": 0.7487, "val_per_window": [{"fold": "fold_1", "regime": "Pre-crisis upturn + GFC onset", "sharpe": 2.6195, "sortino": 4.9882, "return_pct": 6.67, "equity": 1066.66, "max_dd": 2.28, "win_rate": 48.15, "profit_factor": 1.545, "ic": 0.0149, "hit": 47.71, "n": 109, "precision": 0.4891, "recall": 0.8182, "f1": 0.6122, "f2": 0.7212, "mcc": -0.0719, "accuracy": 0.4771, "tp": 45, "fp": 47, "tn": 7, "fn": 10}, {"fold": "fold_2", "regime": "Post-crash recovery", "sharpe": -0.6618, "sortino": -1.0103, "return_pct": -3.43, "equity": 965.73, "max_dd": 11.1, "win_rate": 52.78, "profit_factor": 0.901, "ic": -0.0699, "hit": 52.78, "n": 108, "precision": 0.6, "recall": 0.5714, "f1": 0.5854, "f2": 0.5769, "mcc": 0.0378, "accuracy": 0.5278, "tp": 36, "fp": 24, "tn": 21, "fn": 27}, {"fold": "fold_3", "regime": "Eurozone debt plateau", "sharpe": 14.728, "sortino": 41.4295, "return_pct": 54.48, "equity": 1544.83, "max_dd": 0.64, "win_rate": 83.49, "profit_factor": 15.099, "ic": 0.8443, "hit": 81.98, "n": 111, "precision": 0.7636, "recall": 0.8936, "f1": 0.8235, "f2": 0.8642, "mcc": 0.6824, "accuracy": 0.8378, "tp": 42, "fp": 13, "tn": 51, "fn": 5}, {"fold": "fold_4", "regime": "Strong USD downturn", "sharpe": 15.7275, "sortino": 46.8596, "return_pct": 47.25, "equity": 1472.51, "max_dd": 0.59, "win_rate": 88.99, "profit_factor": 25.266, "ic": 0.9081, "hit": 88.18, "n": 110, "precision": 0.907, "recall": 0.8298, "f1": 0.8667, "f2": 0.8442, "mcc": 0.7769, "accuracy": 0.8909, "tp": 39, "fp": 4, "tn": 59, "fn": 8}, {"fold": "fold_5", "regime": "Low-vol plateau", "sharpe": 15.0859, "sortino": 78.1811, "return_pct": 43.88, "equity": 1438.8, "max_dd": 0.25, "win_rate": 83.04, "profit_factor": 20.839, "ic": 0.9134, "hit": 83.04, "n": 112, "precision": 0.7931, "recall": 0.8679, "f1": 0.8288, "f2": 0.8519, "mcc": 0.664, "accuracy": 0.8304, "tp": 46, "fp": 12, "tn": 47, "fn": 7}, {"fold": "fold_6", "regime": "EUR crisis downturn", "sharpe": 15.478, "sortino": 107.9943, "return_pct": 28.82, "equity": 1288.16, "max_dd": 0.15, "win_rate": 85.98, "profit_factor": 28.508, "ic": 0.9224, "hit": 85.19, "n": 108, "precision": 0.82, "recall": 0.8723, "f1": 0.8454, "f2": 0.8613, "mcc": 0.7207, "accuracy": 0.8611, "tp": 41, "fp": 9, "tn": 52, "fn": 6}, {"fold": "fold_7", "regime": "Recent mixed/upturn", "sharpe": 14.6394, "sortino": 55.9827, "return_pct": 29.39, "equity": 1293.86, "max_dd": 0.34, "win_rate": 80.91, "profit_factor": 13.784, "ic": 0.8637, "hit": 80.91, "n": 110, "precision": 0.7581, "recall": 0.8868, "f1": 0.8174, "f2": 0.8577, "mcc": 0.6283, "accuracy": 0.8091, "tp": 47, "fp": 15, "tn": 42, "fn": 6}], "train_sharpe": 11.0826, "train_psr": 1.0, "train_equity": 64790748.0, "train_sortino": 222.7351, "train_return_pct": 6478974.8, "train_max_dd": 0.2, "train_win_rate": 95.75, "train_profit_factor": 269.852, "train_ic": 0.9907, "train_hit": 95.36, "train_precision": 0.9491, "train_recall": 0.9655, "train_f1": 0.9572, "train_f2": 0.9621, "train_mcc": 0.9112, "train_accuracy": 0.9556, "train_per_window": [{"fold": "all_train", "regime": "Training data", "sharpe": 11.0826, "sortino": 222.7351, "return_pct": 6478974.8, "equity": 64790748.0, "max_dd": 0.2, "win_rate": 95.75, "profit_factor": 269.852, "ic": 0.9907, "hit": 95.36, "n": 2478, "precision": 0.9491, "recall": 0.9655, "f1": 0.9572, "f2": 0.9621, "mcc": 0.9112, "accuracy": 0.9556, "tp": 1230, "fp": 66, "tn": 1138, "fn": 44}], "experiment_num": 194, "status": "DISCARD"}
{"backbone": "xgboost", "description": "Exp18 depth=4 lr=0.02", "config": {"seq_len": 10, "lr": 0.0003, "batch_size": 32, "epochs": 20, "weight_decay": 1e-05, "patience": 5, "grad_clip": 1.0, "warmup_epochs": 0, "huber_delta": 1.0, "head_dropout": 0.1, "seed": 42, "max_depth": 4, "gbm_lr": 0.02, "het_loss": false}, "composite": 7.4875, "test_pos_folds": 6, "val_pos_folds": 6, "val_loss": 0.0, "elapsed_sec": 87.1, "timestamp": "2026-04-21T06:32:18", "sharpe": 7.6875, "psr": 1.0, "equity": 17699.69, "sortino": 7.6345, "return_pct": 1669.97, "max_dd": 7.54, "win_rate": 78.02, "profit_factor": 4.542, "ic": 0.6738, "hit": 77.7, "precision": 0.7995, "recall": 0.738, "f1": 0.7676, "f2": 0.7496, "mcc": 0.5593, "accuracy": 0.779, "per_window": [{"fold": "fold_1", "regime": "Pre-crisis upturn + GFC onset", "sharpe": -0.4212, "sortino": -0.4733, "return_pct": -3.9, "equity": 960.97, "max_dd": 7.54, "win_rate": 50.0, "profit_factor": 0.905, "ic": 0.2321, "hit": 49.51, "n": 103, "precision": 0.5625, "recall": 0.1698, "f1": 0.2609, "f2": 0.1974, "mcc": 0.0411, "accuracy": 0.5049, "tp": 9, "fp": 7, "tn": 43, "fn": 44}, {"fold": "fold_2", "regime": "Post-crash recovery", "sharpe": 2.3142, "sortino": 4.4734, "return_pct": 11.32, "equity": 1113.18, "max_dd": 4.23, "win_rate": 56.07, "profit_factor": 1.437, "ic": 0.0573, "hit": 56.07, "n": 107, "precision": 0.5385, "recall": 0.549, "f1": 0.5437, "f2": 0.5469, "mcc": 0.1204, "accuracy": 0.5607, "tp": 28, "fp": 24, "tn": 32, "fn": 23}, {"fold": "fold_3", "regime": "Eurozone debt plateau", "sharpe": 14.9837, "sortino": 24.7528, "return_pct": 47.01, "equity": 1470.09, "max_dd": 1.32, "win_rate": 85.58, "profit_factor": 12.812, "ic": 0.7527, "hit": 83.96, "n": 106, "precision": 0.8448, "recall": 0.8596, "f1": 0.8522, "f2": 0.8566, "mcc": 0.6771, "accuracy": 0.8396, "tp": 49, "fp": 9, "tn": 40, "fn": 8}, {"fold": "fold_4", "regime": "Strong USD downturn", "sharpe": 14.0379, "sortino": 16.9383, "return_pct": 125.64, "equity": 2256.44, "max_dd": 1.81, "win_rate": 91.02, "profit_factor": 16.116, "ic": 0.8724, "hit": 90.48, "n": 168, "precision": 0.9176, "recall": 0.907, "f1": 0.9123, "f2": 0.9091, "mcc": 0.8214, "accuracy": 0.9107, "tp": 78, "fp": 7, "tn": 75, "fn": 8}, {"fold": "fold_5", "regime": "Low-vol plateau", "sharpe": 14.8541, "sortino": 74.2209, "return_pct": 43.43, "equity": 1434.3, "max_dd": 0.23, "win_rate": 82.1, "profit_factor": 19.423, "ic": 0.9011, "hit": 82.1, "n": 162, "precision": 0.8133, "recall": 0.8026, "f1": 0.8079, "f2": 0.8047, "mcc": 0.6404, "accuracy": 0.821, "tp": 61, "fp": 14, "tn": 72, "fn": 15}, {"fold": "fold_6", "regime": "EUR crisis downturn", "sharpe": 14.9354, "sortino": 61.8942, "return_pct": 97.81, "equity": 1978.05, "max_dd": 0.43, "win_rate": 80.61, "profit_factor": 15.505, "ic": 0.885, "hit": 80.61, "n": 165, "precision": 0.8082, "recall": 0.7662, "f1": 0.7867, "f2": 0.7743, "mcc": 0.6098, "accuracy": 0.8061, "tp": 59, "fp": 14, "tn": 74, "fn": 18}, {"fold": "fold_7", "regime": "Recent mixed/upturn", "sharpe": 11.8749, "sortino": 15.0146, "return_pct": 75.81, "equity": 1758.1, "max_dd": 1.64, "win_rate": 85.19, "profit_factor": 9.161, "ic": 0.8202, "hit": 85.19, "n": 162, "precision": 0.8353, "recall": 0.8765, "f1": 0.8554, "f2": 0.868, "mcc": 0.7046, "accuracy": 0.8519, "tp": 71, "fp": 14, "tn": 67, "fn": 10}], "val_sharpe": 7.744, "val_psr": 1.0, "val_equity": 5174.98, "val_sortino": 9.6179, "val_return_pct": 417.5, "val_max_dd": 13.84, "val_win_rate": 74.71, "val_profit_factor": 3.854, "val_ic": 0.6736, "val_hit": 74.22, "val_precision": 0.708, "val_recall": 0.7973, "val_f1": 0.75, "val_f2": 0.7777, "val_mcc": 0.5001, "val_accuracy": 0.7474, "val_per_window": [{"fold": "fold_1", "regime": "Pre-crisis upturn + GFC onset", "sharpe": 1.9822, "sortino": 3.6714, "return_pct": 5.01, "equity": 1050.15, "max_dd": 2.41, "win_rate": 48.15, "profit_factor": 1.39, "ic": 0.018, "hit": 47.71, "n": 109, "precision": 0.4889, "recall": 0.8, "f1": 0.6069, "f2": 0.7097, "mcc": -0.0683, "accuracy": 0.4771, "tp": 44, "fp": 46, "tn": 8, "fn": 11}, {"fold": "fold_2", "regime": "Post-crash recovery", "sharpe": -2.2473, "sortino": -3.4773, "return_pct": -10.49, "equity": 895.11, "max_dd": 13.84, "win_rate": 46.3, "profit_factor": 0.701, "ic": -0.1222, "hit": 46.3, "n": 108, "precision": 0.5424, "recall": 0.5079, "f1": 0.5246, "f2": 0.5145, "mcc": -0.0912, "accuracy": 0.463, "tp": 32, "fp": 27, "tn": 18, "fn": 31}, {"fold": "fold_3", "regime": "Eurozone debt plateau", "sharpe": 14.7247, "sortino": 39.0492, "return_pct": 54.47, "equity": 1544.75, "max_dd": 0.64, "win_rate": 85.32, "profit_factor": 15.086, "ic": 0.8448, "hit": 83.78, "n": 111, "precision": 0.7925, "recall": 0.8936, "f1": 0.84, "f2": 0.8714, "mcc": 0.714, "accuracy": 0.8559, "tp": 42, "fp": 11, "tn": 53, "fn": 5}, {"fold": "fold_4", "regime": "Strong USD downturn", "sharpe": 15.9251, "sortino": 45.5947, "return_pct": 47.61, "equity": 1476.11, "max_dd": 0.59, "win_rate": 88.99, "profit_factor": 27.434, "ic": 0.9183, "hit": 88.18, "n": 110, "precision": 0.907, "recall": 0.8298, "f1": 0.8667, "f2": 0.8442, "mcc": 0.7769, "accuracy": 0.8909, "tp": 39, "fp": 4, "tn": 59, "fn": 8}, {"fold": "fold_5", "regime": "Low-vol plateau", "sharpe": 14.6451, "sortino": 59.3112, "return_pct": 43.06, "equity": 1430.58, "max_dd": 0.34, "win_rate": 83.04, "profit_factor": 17.9, "ic": 0.9044, "hit": 83.04, "n": 112, "precision": 0.7931, "recall": 0.8679, "f1": 0.8288, "f2": 0.8519, "mcc": 0.664, "accuracy": 0.8304, "tp": 46, "fp": 12, "tn": 47, "fn": 7}, {"fold": "fold_6", "regime": "EUR crisis downturn", "sharpe": 16.05, "sortino": 97.435, "return_pct": 29.42, "equity": 1294.2, "max_dd": 0.15, "win_rate": 86.92, "profit_factor": 38.538, "ic": 0.9245, "hit": 86.11, "n": 108, "precision": 0.8367, "recall": 0.8723, "f1": 0.8542, "f2": 0.865, "mcc": 0.7381, "accuracy": 0.8704, "tp": 41, "fp": 8, "tn": 53, "fn": 6}, {"fold": "fold_7", "regime": "Recent mixed/upturn", "sharpe": 15.4948, "sortino": 60.1533, "return_pct": 30.4, "equity": 1304.03, "max_dd": 0.23, "win_rate": 83.64, "profit_factor": 17.34, "ic": 0.8715, "hit": 83.64, "n": 110, "precision": 0.7966, "recall": 0.8868, "f1": 0.8393, "f2": 0.8672, "mcc": 0.6776, "accuracy": 0.8364, "tp": 47, "fp": 12, "tn": 45, "fn": 6}], "train_sharpe": 11.0674, "train_psr": 1.0, "train_equity": 64124816.0, "train_sortino": 184.4487, "train_return_pct": 6412381.6, "train_max_dd": 0.21, "train_win_rate": 95.66, "train_profit_factor": 239.859, "train_ic": 0.9903, "train_hit": 95.28, "train_precision": 0.949, "train_recall": 0.9647, "train_f1": 0.9568, "train_f2": 0.9615, "train_mcc": 0.9104, "train_accuracy": 0.9552, "train_per_window": [{"fold": "all_train", "regime": "Training data", "sharpe": 11.0674, "sortino": 184.4487, "return_pct": 6412381.6, "equity": 64124816.0, "max_dd": 0.21, "win_rate": 95.66, "profit_factor": 239.859, "ic": 0.9903, "hit": 95.28, "n": 2478, "precision": 0.949, "recall": 0.9647, "f1": 0.9568, "f2": 0.9615, "mcc": 0.9104, "accuracy": 0.9552, "tp": 1229, "fp": 66, "tn": 1138, "fn": 45}], "experiment_num": 195, "status": "DISCARD"}
