{"backbone": "dlinear", "description": "dlinear: Exp5 hidden=256", "config": {"seq_len": 60, "lr": 0.001, "batch_size": 32, "epochs": 100, "weight_decay": 0.0001, "patience": 20, "grad_clip": 1.0, "warmup_epochs": 0, "huber_delta": 1.0, "head_dropout": 0.15, "seed": 42, "hidden_size": 256, "het_loss": false}, "composite": -0.4016, "test_pos_folds": 4, "val_pos_folds": 4, "val_loss": 0.000142, "elapsed_sec": 35.4, "timestamp": "2026-04-21T12:29:31", "sharpe": 0.7713, "psr": 0.8872, "equity": 1184.03, "sortino": 1.1892, "return_pct": 18.4, "max_dd": 13.42, "win_rate": 51.05, "profit_factor": 1.138, "ic": 0.0812, "hit": 50.72, "aleatoric_mean": 4.3e-05, "epistemic_mean": 8.6e-05, "confidence_mean": 0.9999, "precision": 0.5226, "recall": 0.2613, "f1": 0.3484, "f2": 0.2903, "mcc": 0.0288, "accuracy": 0.5136, "per_window": [{"fold": "fold_1", "regime": "Pre-crisis upturn + GFC onset", "sharpe": 4.3815, "sortino": 10.508, "return_pct": 9.23, "equity": 1092.31, "max_dd": 1.67, "win_rate": 57.69, "profit_factor": 1.958, "ic": 0.3141, "hit": 56.6, "n": 53, "precision": 0.5909, "recall": 0.5, "f1": 0.5417, "f2": 0.5159, "mcc": 0.1691, "accuracy": 0.5849, "tp": 13, "fp": 9, "tn": 18, "fn": 13, "aleatoric_mean": 4.5e-05, "epistemic_mean": 9e-05, "confidence_mean": 0.9999, "aleatoric_std": 3.2e-05, "epistemic_std": 6.5e-05}, {"fold": "fold_2", "regime": "Post-crash recovery", "sharpe": 2.1969, "sortino": 3.6287, "return_pct": 6.23, "equity": 1062.27, "max_dd": 3.4, "win_rate": 52.63, "profit_factor": 1.422, "ic": 0.1393, "hit": 52.63, "n": 57, "precision": 0.5909, "recall": 0.4194, "f1": 0.4906, "f2": 0.4452, "mcc": 0.0749, "accuracy": 0.5263, "tp": 13, "fp": 9, "tn": 17, "fn": 18, "aleatoric_mean": 4.5e-05, "epistemic_mean": 8.9e-05, "confidence_mean": 0.9999, "aleatoric_std": 3.3e-05, "epistemic_std": 6.7e-05}, {"fold": "fold_3", "regime": "Eurozone debt plateau", "sharpe": -0.8691, "sortino": -1.4522, "return_pct": -1.6, "equity": 984.02, "max_dd": 4.22, "win_rate": 40.74, "profit_factor": 0.871, "ic": -0.0157, "hit": 39.29, "n": 56, "precision": 0.5, "recall": 0.0625, "f1": 0.1111, "f2": 0.0758, "mcc": -0.04, "accuracy": 0.4286, "tp": 2, "fp": 2, "tn": 22, "fn": 30, "aleatoric_mean": 7.8e-05, "epistemic_mean": 0.000156, "confidence_mean": 0.9998, "aleatoric_std": 3.8e-05, "epistemic_std": 7.5e-05}, {"fold": "fold_4", "regime": "Strong USD downturn", "sharpe": 0.5639, "sortino": 0.8936, "return_pct": 2.61, "equity": 1026.12, "max_dd": 11.04, "win_rate": 52.14, "profit_factor": 1.099, "ic": 0.0972, "hit": 51.69, "n": 118, "precision": 0.5667, "recall": 0.2833, "f1": 0.3778, "f2": 0.3148, "mcc": 0.068, "accuracy": 0.5254, "tp": 17, "fp": 13, "tn": 45, "fn": 43, "aleatoric_mean": 4.9e-05, "epistemic_mean": 9.9e-05, "confidence_mean": 0.9999, "aleatoric_std": 3.1e-05, "epistemic_std": 6.3e-05}, {"fold": "fold_5", "regime": "Low-vol plateau", "sharpe": -1.6409, "sortino": -2.2337, "return_pct": -3.67, "equity": 963.34, "max_dd": 3.9, "win_rate": 45.54, "profit_factor": 0.761, "ic": -0.0149, "hit": 45.54, "n": 112, "precision": 0.3958, "recall": 0.3725, "f1": 0.3838, "f2": 0.377, "mcc": -0.1035, "accuracy": 0.4554, "tp": 19, "fp": 29, "tn": 32, "fn": 32, "aleatoric_mean": 2.2e-05, "epistemic_mean": 4.4e-05, "confidence_mean": 0.9999, "aleatoric_std": 9e-06, "epistemic_std": 1.8e-05}, {"fold": "fold_6", "regime": "EUR crisis downturn", "sharpe": 1.835, "sortino": 3.116, "return_pct": 8.32, "equity": 1083.2, "max_dd": 4.8, "win_rate": 53.91, "profit_factor": 1.337, "ic": 0.1127, "hit": 53.91, "n": 115, "precision": 0.5, "recall": 0.0755, "f1": 0.1311, "f2": 0.0909, "mcc": 0.0215, "accuracy": 0.5391, "tp": 4, "fp": 4, "tn": 58, "fn": 49, "aleatoric_mean": 6e-05, "epistemic_mean": 0.00012, "confidence_mean": 0.9998, "aleatoric_std": 3e-05, "epistemic_std": 6e-05}, {"fold": "fold_7", "regime": "Recent mixed/upturn", "sharpe": -0.7283, "sortino": -0.933, "return_pct": -3.15, "equity": 968.48, "max_dd": 5.71, "win_rate": 53.57, "profit_factor": 0.883, "ic": 0.0086, "hit": 53.57, "n": 112, "precision": 0.619, "recall": 0.2281, "f1": 0.3333, "f2": 0.261, "mcc": 0.1058, "accuracy": 0.5357, "tp": 13, "fp": 8, "tn": 47, "fn": 44, "aleatoric_mean": 2.1e-05, "epistemic_mean": 4.3e-05, "confidence_mean": 0.9999, "aleatoric_std": 1.1e-05, "epistemic_std": 2.1e-05}], "val_sharpe": 0.1984, "val_psr": 0.6005, "val_equity": 1020.32, "val_sortino": 0.282, "val_return_pct": 2.03, "val_max_dd": 7.34, "val_win_rate": 54.33, "val_profit_factor": 1.034, "val_ic": 0.0724, "val_hit": 54.07, "val_aleatoric_mean": 2.2e-05, "val_epistemic_mean": 4.5e-05, "val_confidence_mean": 0.9999, "val_precision": 0.5397, "val_recall": 0.4951, "val_f1": 0.5165, "val_f2": 0.5035, "val_mcc": 0.0852, "val_accuracy": 0.5431, "val_per_window": [{"fold": "fold_1", "regime": "Pre-crisis upturn + GFC onset", "sharpe": -0.3214, "sortino": -0.4606, "return_pct": -0.56, "equity": 994.38, "max_dd": 2.96, "win_rate": 51.72, "profit_factor": 0.948, "ic": -0.1077, "hit": 50.85, "n": 59, "precision": 0.5385, "recall": 0.6774, "f1": 0.6, "f2": 0.6442, "mcc": 0.0365, "accuracy": 0.5254, "tp": 21, "fp": 18, "tn": 10, "fn": 10, "aleatoric_mean": 3.8e-05, "epistemic_mean": 7.5e-05, "confidence_mean": 0.9999, "aleatoric_std": 4.2e-05, "epistemic_std": 8.3e-05}, {"fold": "fold_2", "regime": "Post-crash recovery", "sharpe": 0.1069, "sortino": 0.1727, "return_pct": 0.13, "equity": 1001.26, "max_dd": 2.21, "win_rate": 50.0, "profit_factor": 1.017, "ic": -0.0724, "hit": 50.0, "n": 58, "precision": 0.52, "recall": 0.8387, "f1": 0.642, "f2": 0.7471, "mcc": -0.0726, "accuracy": 0.5, "tp": 26, "fp": 24, "tn": 3, "fn": 5, "aleatoric_mean": 2.2e-05, "epistemic_mean": 4.4e-05, "confidence_mean": 0.9999, "aleatoric_std": 1.1e-05, "epistemic_std": 2.2e-05}, {"fold": "fold_3", "regime": "Eurozone debt plateau", "sharpe": -1.0038, "sortino": -1.2536, "return_pct": -2.45, "equity": 975.47, "max_dd": 6.97, "win_rate": 57.38, "profit_factor": 0.846, "ic": 0.2981, "hit": 57.38, "n": 61, "precision": 0.5714, "recall": 0.1481, "f1": 0.2353, "f2": 0.1739, "mcc": 0.0934, "accuracy": 0.5738, "tp": 4, "fp": 3, "tn": 31, "fn": 23, "aleatoric_mean": 1.9e-05, "epistemic_mean": 3.9e-05, "confidence_mean": 0.9999, "aleatoric_std": 9e-06, "epistemic_std": 1.8e-05}, {"fold": "fold_4", "regime": "Strong USD downturn", "sharpe": 0.2352, "sortino": 0.4486, "return_pct": 0.42, "equity": 1004.15, "max_dd": 5.09, "win_rate": 53.33, "profit_factor": 1.037, "ic": 0.1385, "hit": 53.33, "n": 60, "precision": 0.5172, "recall": 0.5172, "f1": 0.5172, "f2": 0.5172, "mcc": 0.0656, "accuracy": 0.5333, "tp": 15, "fp": 14, "tn": 17, "fn": 14, "aleatoric_mean": 2.2e-05, "epistemic_mean": 4.3e-05, "confidence_mean": 0.9999, "aleatoric_std": 8e-06, "epistemic_std": 1.7e-05}, {"fold": "fold_5", "regime": "Low-vol plateau", "sharpe": -0.8678, "sortino": -1.4108, "return_pct": -1.55, "equity": 984.46, "max_dd": 2.98, "win_rate": 45.16, "profit_factor": 0.869, "ic": 0.0894, "hit": 45.16, "n": 62, "precision": 0.4444, "recall": 0.25, "f1": 0.32, "f2": 0.274, "mcc": -0.0917, "accuracy": 0.4516, "tp": 8, "fp": 10, "tn": 20, "fn": 24, "aleatoric_mean": 2.2e-05, "epistemic_mean": 4.4e-05, "confidence_mean": 0.9999, "aleatoric_std": 9e-06, "epistemic_std": 1.9e-05}, {"fold": "fold_6", "regime": "EUR crisis downturn", "sharpe": 4.7721, "sortino": 7.6989, "return_pct": 4.86, "equity": 1048.6, "max_dd": 1.02, "win_rate": 66.67, "profit_factor": 2.197, "ic": 0.3782, "hit": 65.52, "n": 58, "precision": 0.6, "recall": 0.5, "f1": 0.5455, "f2": 0.5172, "mcc": 0.2743, "accuracy": 0.6552, "tp": 12, "fp": 8, "tn": 26, "fn": 12, "aleatoric_mean": 1.4e-05, "epistemic_mean": 2.7e-05, "confidence_mean": 1.0, "aleatoric_std": 6e-06, "epistemic_std": 1.1e-05}, {"fold": "fold_7", "regime": "Recent mixed/upturn", "sharpe": 1.0757, "sortino": 1.737, "return_pct": 1.35, "equity": 1013.48, "max_dd": 1.69, "win_rate": 56.67, "profit_factor": 1.192, "ic": 0.2033, "hit": 56.67, "n": 60, "precision": 0.6154, "recall": 0.5, "f1": 0.5517, "f2": 0.5195, "mcc": 0.1438, "accuracy": 0.5667, "tp": 16, "fp": 10, "tn": 18, "fn": 16, "aleatoric_mean": 2.1e-05, "epistemic_mean": 4.2e-05, "confidence_mean": 0.9999, "aleatoric_std": 1.2e-05, "epistemic_std": 2.4e-05}], "train_sharpe": 8.4148, "train_psr": 1.0, "train_equity": 193308.34, "train_sortino": 44.9876, "train_return_pct": 19230.83, "train_max_dd": 1.66, "train_win_rate": 80.22, "train_profit_factor": 12.816, "train_ic": 0.8325, "train_hit": 79.81, "train_precision": 0.8011, "train_recall": 0.8201, "train_f1": 0.8105, "train_f2": 0.8162, "train_mcc": 0.6013, "train_accuracy": 0.801, "train_per_window": [{"fold": "all_train", "regime": "Training data", "sharpe": 8.4148, "sortino": 44.9876, "return_pct": 19230.83, "equity": 193308.34, "max_dd": 1.66, "win_rate": 80.22, "profit_factor": 12.816, "ic": 0.8325, "hit": 79.81, "n": 1382, "precision": 0.8011, "recall": 0.8201, "f1": 0.8105, "f2": 0.8162, "mcc": 0.6013, "accuracy": 0.801, "tp": 588, "fp": 146, "tn": 519, "fn": 129}], "experiment_num": 241, "status": "DISCARD"}
{"backbone": "dlinear", "description": "dlinear: Exp6 seed=0", "config": {"seq_len": 60, "lr": 0.001, "batch_size": 32, "epochs": 100, "weight_decay": 0.0001, "patience": 20, "grad_clip": 1.0, "warmup_epochs": 0, "huber_delta": 1.0, "head_dropout": 0.15, "seed": 0, "het_loss": false}, "composite": -0.9142, "test_pos_folds": 4, "val_pos_folds": 4, "val_loss": 9.8e-05, "elapsed_sec": 22.5, "timestamp": "2026-04-21T12:30:05", "sharpe": -0.3142, "psr": 0.3104, "equity": 919.04, "sortino": -0.4475, "return_pct": -8.1, "max_dd": 18.66, "win_rate": 50.08, "profit_factor": 0.949, "ic": -0.0024, "hit": 49.76, "aleatoric_mean": 6.5e-05, "epistemic_mean": 0.00013, "confidence_mean": 0.9998, "precision": 0.4983, "recall": 0.4871, "f1": 0.4927, "f2": 0.4893, "mcc": 0.0015, "accuracy": 0.5008, "per_window": [{"fold": "fold_1", "regime": "Pre-crisis upturn + GFC onset", "sharpe": 0.584, "sortino": 1.1338, "return_pct": 1.13, "equity": 1011.35, "max_dd": 3.97, "win_rate": 55.77, "profit_factor": 1.094, "ic": 0.0447, "hit": 54.72, "n": 53, "precision": 0.5238, "recall": 0.8462, "f1": 0.6471, "f2": 0.7534, "mcc": 0.1299, "accuracy": 0.5472, "tp": 22, "fp": 20, "tn": 7, "fn": 4, "aleatoric_mean": 6.2e-05, "epistemic_mean": 0.000125, "confidence_mean": 0.9998, "aleatoric_std": 3.2e-05, "epistemic_std": 6.3e-05}, {"fold": "fold_2", "regime": "Post-crash recovery", "sharpe": -1.92, "sortino": -2.894, "return_pct": -5.47, "equity": 945.26, "max_dd": 8.18, "win_rate": 42.11, "profit_factor": 0.735, "ic": -0.0556, "hit": 42.11, "n": 57, "precision": 0.4444, "recall": 0.2581, "f1": 0.3265, "f2": 0.2817, "mcc": -0.1356, "accuracy": 0.4211, "tp": 8, "fp": 10, "tn": 16, "fn": 23, "aleatoric_mean": 7.1e-05, "epistemic_mean": 0.000141, "confidence_mean": 0.9998, "aleatoric_std": 3.1e-05, "epistemic_std": 6.3e-05}, {"fold": "fold_3", "regime": "Eurozone debt plateau", "sharpe": 2.7659, "sortino": 5.5543, "return_pct": 4.88, "equity": 1048.79, "max_dd": 2.81, "win_rate": 53.7, "profit_factor": 1.555, "ic": 0.0247, "hit": 51.79, "n": 56, "precision": 0.6129, "recall": 0.5938, "f1": 0.6032, "f2": 0.5975, "mcc": 0.0933, "accuracy": 0.5536, "tp": 19, "fp": 12, "tn": 12, "fn": 13, "aleatoric_mean": 0.0001, "epistemic_mean": 0.000199, "confidence_mean": 0.9997, "aleatoric_std": 4.2e-05, "epistemic_std": 8.4e-05}, {"fold": "fold_4", "regime": "Strong USD downturn", "sharpe": -1.1259, "sortino": -1.4218, "return_pct": -5.78, "equity": 942.17, "max_dd": 9.33, "win_rate": 47.86, "profit_factor": 0.828, "ic": 0.0285, "hit": 47.46, "n": 118, "precision": 0.4808, "recall": 0.4167, "f1": 0.4464, "f2": 0.4281, "mcc": -0.0492, "accuracy": 0.4746, "tp": 25, "fp": 27, "tn": 31, "fn": 35, "aleatoric_mean": 7.1e-05, "epistemic_mean": 0.000143, "confidence_mean": 0.9998, "aleatoric_std": 3.7e-05, "epistemic_std": 7.4e-05}, {"fold": "fold_5", "regime": "Low-vol plateau", "sharpe": 0.8631, "sortino": 1.1967, "return_pct": 1.9, "equity": 1019.03, "max_dd": 2.39, "win_rate": 54.46, "profit_factor": 1.154, "ic": -0.0019, "hit": 54.46, "n": 112, "precision": 0.5, "recall": 0.0196, "f1": 0.0377, "f2": 0.0243, "mcc": 0.0121, "accuracy": 0.5446, "tp": 1, "fp": 1, "tn": 60, "fn": 50, "aleatoric_mean": 3e-05, "epistemic_mean": 6e-05, "confidence_mean": 0.9999, "aleatoric_std": 9e-06, "epistemic_std": 1.8e-05}, {"fold": "fold_6", "regime": "EUR crisis downturn", "sharpe": -2.3662, "sortino": -3.6487, "return_pct": -10.21, "equity": 897.91, "max_dd": 11.82, "win_rate": 44.35, "profit_factor": 0.688, "ic": -0.0314, "hit": 44.35, "n": 115, "precision": 0.4433, "recall": 0.8113, "f1": 0.5733, "f2": 0.6958, "mcc": -0.0818, "accuracy": 0.4435, "tp": 43, "fp": 54, "tn": 8, "fn": 10, "aleatoric_mean": 0.000105, "epistemic_mean": 0.00021, "confidence_mean": 0.9997, "aleatoric_std": 7.6e-05, "epistemic_std": 0.000153}, {"fold": "fold_7", "regime": "Recent mixed/upturn", "sharpe": 1.537, "sortino": 2.7067, "return_pct": 6.33, "equity": 1063.28, "max_dd": 4.74, "win_rate": 53.57, "profit_factor": 1.302, "ic": 0.1045, "hit": 53.57, "n": 112, "precision": 0.541, "recall": 0.5789, "f1": 0.5593, "f2": 0.5709, "mcc": 0.0701, "accuracy": 0.5357, "tp": 33, "fp": 28, "tn": 27, "fn": 24, "aleatoric_mean": 3.2e-05, "epistemic_mean": 6.5e-05, "confidence_mean": 0.9999, "aleatoric_std": 1.6e-05, "epistemic_std": 3.2e-05}], "val_sharpe": 0.5589, "val_psr": 0.764, "val_equity": 1067.4, "val_sortino": 0.8732, "val_return_pct": 6.74, "val_max_dd": 9.49, "val_win_rate": 50.72, "val_profit_factor": 1.098, "val_ic": 0.0432, "val_hit": 50.48, "val_aleatoric_mean": 3.7e-05, "val_epistemic_mean": 7.4e-05, "val_confidence_mean": 0.9999, "val_precision": 0.5, "val_recall": 0.466, "val_f1": 0.4824, "val_f2": 0.4724, "val_mcc": 0.0132, "val_accuracy": 0.5072, "val_per_window": [{"fold": "fold_1", "regime": "Pre-crisis upturn + GFC onset", "sharpe": 2.599, "sortino": 4.195, "return_pct": 4.1, "equity": 1040.95, "max_dd": 2.74, "win_rate": 53.45, "profit_factor": 1.535, "ic": 0.1112, "hit": 52.54, "n": 59, "precision": 0.5306, "recall": 0.8387, "f1": 0.65, "f2": 0.7514, "mcc": 0.023, "accuracy": 0.5254, "tp": 26, "fp": 23, "tn": 5, "fn": 5, "aleatoric_mean": 3.9e-05, "epistemic_mean": 7.7e-05, "confidence_mean": 0.9999, "aleatoric_std": 2.6e-05, "epistemic_std": 5.3e-05}, {"fold": "fold_2", "regime": "Post-crash recovery", "sharpe": -0.4277, "sortino": -0.7093, "return_pct": -0.92, "equity": 990.82, "max_dd": 3.1, "win_rate": 46.55, "profit_factor": 0.933, "ic": 0.079, "hit": 46.55, "n": 58, "precision": 0.5, "recall": 0.7097, "f1": 0.5867, "f2": 0.6548, "mcc": -0.1226, "accuracy": 0.4655, "tp": 22, "fp": 22, "tn": 5, "fn": 9, "aleatoric_mean": 3.6e-05, "epistemic_mean": 7.2e-05, "confidence_mean": 0.9999, "aleatoric_std": 1.3e-05, "epistemic_std": 2.7e-05}, {"fold": "fold_3", "regime": "Eurozone debt plateau", "sharpe": -1.403, "sortino": -2.2738, "return_pct": -3.36, "equity": 966.39, "max_dd": 5.56, "win_rate": 47.54, "profit_factor": 0.791, "ic": -0.0567, "hit": 47.54, "n": 61, "precision": 0.3077, "recall": 0.1481, "f1": 0.2, "f2": 0.1653, "mcc": -0.1414, "accuracy": 0.4754, "tp": 4, "fp": 9, "tn": 25, "fn": 23, "aleatoric_mean": 3.8e-05, "epistemic_mean": 7.5e-05, "confidence_mean": 0.9999, "aleatoric_std": 1.2e-05, "epistemic_std": 2.5e-05}, {"fold": "fold_4", "regime": "Strong USD downturn", "sharpe": -0.3717, "sortino": -0.6312, "return_pct": -0.91, "equity": 990.9, "max_dd": 3.05, "win_rate": 46.67, "profit_factor": 0.945, "ic": -0.1065, "hit": 46.67, "n": 60, "precision": 0.4286, "recall": 0.3103, "f1": 0.36, "f2": 0.3285, "mcc": -0.0804, "accuracy": 0.4667, "tp": 9, "fp": 12, "tn": 19, "fn": 20, "aleatoric_mean": 4.9e-05, "epistemic_mean": 9.8e-05, "confidence_mean": 0.9999, "aleatoric_std": 1.9e-05, "epistemic_std": 3.8e-05}, {"fold": "fold_5", "regime": "Low-vol plateau", "sharpe": 1.9537, "sortino": 3.2622, "return_pct": 3.36, "equity": 1033.62, "max_dd": 2.76, "win_rate": 54.84, "profit_factor": 1.373, "ic": 0.0742, "hit": 54.84, "n": 62, "precision": 0.5714, "recall": 0.5, "f1": 0.5333, "f2": 0.5128, "mcc": 0.1004, "accuracy": 0.5484, "tp": 16, "fp": 12, "tn": 18, "fn": 16, "aleatoric_mean": 4.5e-05, "epistemic_mean": 8.9e-05, "confidence_mean": 0.9999, "aleatoric_std": 1.9e-05, "epistemic_std": 3.9e-05}, {"fold": "fold_6", "regime": "EUR crisis downturn", "sharpe": 3.0359, "sortino": 5.8979, "return_pct": 3.14, "equity": 1031.36, "max_dd": 1.19, "win_rate": 59.65, "profit_factor": 1.647, "ic": 0.1228, "hit": 58.62, "n": 58, "precision": 0.6667, "recall": 0.0833, "f1": 0.1481, "f2": 0.101, "mcc": 0.1199, "accuracy": 0.6034, "tp": 2, "fp": 1, "tn": 33, "fn": 22, "aleatoric_mean": 2.1e-05, "epistemic_mean": 4.3e-05, "confidence_mean": 0.9999, "aleatoric_std": 7e-06, "epistemic_std": 1.5e-05}, {"fold": "fold_7", "regime": "Recent mixed/upturn", "sharpe": 1.0993, "sortino": 2.218, "return_pct": 1.38, "equity": 1013.78, "max_dd": 2.02, "win_rate": 46.67, "profit_factor": 1.196, "ic": 0.0548, "hit": 46.67, "n": 60, "precision": 0.5, "recall": 0.5312, "f1": 0.5152, "f2": 0.5247, "mcc": -0.0764, "accuracy": 0.4667, "tp": 17, "fp": 17, "tn": 11, "fn": 15, "aleatoric_mean": 2.9e-05, "epistemic_mean": 5.9e-05, "confidence_mean": 0.9999, "aleatoric_std": 1.6e-05, "epistemic_std": 3.2e-05}], "train_sharpe": 6.2162, "train_psr": 1.0, "train_equity": 59655.9, "train_sortino": 21.7673, "train_return_pct": 5865.59, "train_max_dd": 3.3, "train_win_rate": 72.0, "train_profit_factor": 4.985, "train_ic": 0.6313, "train_hit": 71.64, "train_precision": 0.6953, "train_recall": 0.8117, "train_f1": 0.749, "train_f2": 0.7854, "train_mcc": 0.4378, "train_accuracy": 0.7178, "train_per_window": [{"fold": "all_train", "regime": "Training data", "sharpe": 6.2162, "sortino": 21.7673, "return_pct": 5865.59, "equity": 59655.9, "max_dd": 3.3, "win_rate": 72.0, "profit_factor": 4.985, "ic": 0.6313, "hit": 71.64, "n": 1382, "precision": 0.6953, "recall": 0.8117, "f1": 0.749, "f2": 0.7854, "mcc": 0.4378, "accuracy": 0.7178, "tp": 582, "fp": 255, "tn": 410, "fn": 135}], "experiment_num": 242, "status": "DISCARD"}
