{"backbone": "mlp", "description": "mlp: Exp6 champion seed=99 (variance)", "config": {"seq_len": 10, "lr": 0.0003, "batch_size": 32, "epochs": 50, "weight_decay": 1e-05, "patience": 10, "grad_clip": 1.0, "warmup_epochs": 0, "huber_delta": 1.0, "head_dropout": 0.1, "seed": 99, "het_loss": false}, "composite": -0.4738, "test_pos_folds": 5, "val_pos_folds": 2, "val_loss": 3.6e-05, "elapsed_sec": 13.2, "timestamp": "2026-04-12T17:33:14", "sharpe": 0.4689, "psr": 0.8294, "equity": 1189.72, "sortino": 0.7928, "return_pct": 18.97, "max_dd": 11.9, "win_rate": 51.39, "profit_factor": 1.09, "ic": 0.0775, "hit": 51.18, "aleatoric_mean": 5.5e-05, "epistemic_mean": 0.000109, "confidence_mean": 0.9998, "per_window": [{"fold": "fold_1", "regime": "Pre-crisis upturn + GFC onset", "sharpe": 2.3819, "sortino": 7.2341, "return_pct": 19.08, "equity": 1190.84, "max_dd": 4.9, "win_rate": 54.9, "profit_factor": 1.77, "ic": 0.1045, "hit": 54.37, "n": 103, "aleatoric_mean": 9e-05, "epistemic_mean": 0.000181, "confidence_mean": 0.9997, "aleatoric_std": 5.8e-05, "epistemic_std": 0.000116}, {"fold": "fold_2", "regime": "Post-crash recovery", "sharpe": -1.67, "sortino": -2.7066, "return_pct": -7.91, "equity": 920.86, "max_dd": 7.68, "win_rate": 46.73, "profit_factor": 0.77, "ic": -0.0844, "hit": 46.73, "n": 107, "aleatoric_mean": 5.9e-05, "epistemic_mean": 0.000117, "confidence_mean": 0.9998, "aleatoric_std": 2.5e-05, "epistemic_std": 5.1e-05}, {"fold": "fold_3", "regime": "Eurozone debt plateau", "sharpe": 0.8524, "sortino": 1.5192, "return_pct": 2.91, "equity": 1029.14, "max_dd": 4.59, "win_rate": 50.0, "profit_factor": 1.143, "ic": 0.0622, "hit": 49.06, "n": 106, "aleatoric_mean": 5.9e-05, "epistemic_mean": 0.000118, "confidence_mean": 0.9998, "aleatoric_std": 2.9e-05, "epistemic_std": 5.7e-05}, {"fold": "fold_4", "regime": "Strong USD downturn", "sharpe": 0.7332, "sortino": 1.013, "return_pct": 5.38, "equity": 1053.84, "max_dd": 11.37, "win_rate": 55.69, "profit_factor": 1.131, "ic": 0.1764, "hit": 55.36, "n": 168, "aleatoric_mean": 5.8e-05, "epistemic_mean": 0.000115, "confidence_mean": 0.9998, "aleatoric_std": 2.8e-05, "epistemic_std": 5.5e-05}, {"fold": "fold_5", "regime": "Low-vol plateau", "sharpe": 0.7245, "sortino": 1.0677, "return_pct": 2.35, "equity": 1023.53, "max_dd": 4.37, "win_rate": 53.09, "profit_factor": 1.128, "ic": 0.1447, "hit": 53.09, "n": 162, "aleatoric_mean": 3.7e-05, "epistemic_mean": 7.3e-05, "confidence_mean": 0.9999, "aleatoric_std": 1.6e-05, "epistemic_std": 3.2e-05}, {"fold": "fold_6", "regime": "EUR crisis downturn", "sharpe": 0.2279, "sortino": 0.3525, "return_pct": 1.14, "equity": 1011.38, "max_dd": 6.63, "win_rate": 50.91, "profit_factor": 1.038, "ic": 0.1227, "hit": 50.91, "n": 165, "aleatoric_mean": 5.6e-05, "epistemic_mean": 0.000113, "confidence_mean": 0.9998, "aleatoric_std": 3.2e-05, "epistemic_std": 6.3e-05}, {"fold": "fold_7", "regime": "Recent mixed/upturn", "sharpe": -0.5281, "sortino": -0.8538, "return_pct": -3.37, "equity": 966.35, "max_dd": 9.49, "win_rate": 47.53, "profit_factor": 0.915, "ic": -0.0255, "hit": 47.53, "n": 162, "aleatoric_mean": 3.9e-05, "epistemic_mean": 7.8e-05, "confidence_mean": 0.9999, "aleatoric_std": 1.5e-05, "epistemic_std": 3e-05}], "val_sharpe": 0.2262, "val_psr": 0.6536, "val_equity": 1045.47, "val_sortino": 0.3582, "val_return_pct": 4.55, "val_max_dd": 12.9, "val_win_rate": 49.02, "val_profit_factor": 1.039, "val_ic": 0.0523, "val_hit": 48.7, "val_aleatoric_mean": 4.1e-05, "val_epistemic_mean": 8.3e-05, "val_confidence_mean": 0.9999, "val_per_window": [{"fold": "fold_1", "regime": "Pre-crisis upturn + GFC onset", "sharpe": -0.6309, "sortino": -0.9859, "return_pct": -1.65, "equity": 983.48, "max_dd": 4.26, "win_rate": 49.07, "profit_factor": 0.901, "ic": -0.0726, "hit": 48.62, "n": 109, "aleatoric_mean": 4.2e-05, "epistemic_mean": 8.4e-05, "confidence_mean": 0.9999, "aleatoric_std": 2.2e-05, "epistemic_std": 4.4e-05}, {"fold": "fold_2", "regime": "Post-crash recovery", "sharpe": -0.883, "sortino": -1.4774, "return_pct": -4.45, "equity": 955.46, "max_dd": 9.6, "win_rate": 46.3, "profit_factor": 0.87, "ic": 0.0619, "hit": 46.3, "n": 108, "aleatoric_mean": 5.3e-05, "epistemic_mean": 0.000106, "confidence_mean": 0.9998, "aleatoric_std": 2e-05, "epistemic_std": 3.9e-05}, {"fold": "fold_3", "regime": "Eurozone debt plateau", "sharpe": 2.9814, "sortino": 6.1025, "return_pct": 12.38, "equity": 1123.76, "max_dd": 3.86, "win_rate": 51.38, "profit_factor": 1.624, "ic": 0.2252, "hit": 50.45, "n": 111, "aleatoric_mean": 4.7e-05, "epistemic_mean": 9.5e-05, "confidence_mean": 0.9999, "aleatoric_std": 1.8e-05, "epistemic_std": 3.7e-05}, {"fold": "fold_4", "regime": "Strong USD downturn", "sharpe": -2.7521, "sortino": -3.8642, "return_pct": -9.12, "equity": 908.79, "max_dd": 10.06, "win_rate": 43.12, "profit_factor": 0.634, "ic": -0.0259, "hit": 42.73, "n": 110, "aleatoric_mean": 3.8e-05, "epistemic_mean": 7.7e-05, "confidence_mean": 0.9999, "aleatoric_std": 1.5e-05, "epistemic_std": 3.1e-05}, {"fold": "fold_5", "regime": "Low-vol plateau", "sharpe": 4.0006, "sortino": 7.5266, "return_pct": 13.68, "equity": 1136.84, "max_dd": 2.39, "win_rate": 64.29, "profit_factor": 1.951, "ic": 0.1749, "hit": 64.29, "n": 112, "aleatoric_mean": 3.9e-05, "epistemic_mean": 7.8e-05, "confidence_mean": 0.9999, "aleatoric_std": 1.6e-05, "epistemic_std": 3.2e-05}, {"fold": "fold_6", "regime": "EUR crisis downturn", "sharpe": -1.5501, "sortino": -2.3423, "return_pct": -3.53, "equity": 964.69, "max_dd": 6.73, "win_rate": 44.86, "profit_factor": 0.77, "ic": -0.0726, "hit": 44.44, "n": 108, "aleatoric_mean": 3.1e-05, "epistemic_mean": 6.3e-05, "confidence_mean": 0.9999, "aleatoric_std": 1e-05, "epistemic_std": 2e-05}, {"fold": "fold_7", "regime": "Recent mixed/upturn", "sharpe": -0.2497, "sortino": -0.4372, "return_pct": -0.66, "equity": 993.37, "max_dd": 3.56, "win_rate": 43.64, "profit_factor": 0.961, "ic": 0.0289, "hit": 43.64, "n": 110, "aleatoric_mean": 3.8e-05, "epistemic_mean": 7.7e-05, "confidence_mean": 0.9999, "aleatoric_std": 1.6e-05, "epistemic_std": 3.2e-05}], "train_sharpe": 4.4892, "train_psr": 1.0, "train_equity": 186415.78, "train_sortino": 11.4181, "train_return_pct": 18541.58, "train_max_dd": 6.17, "train_win_rate": 63.57, "train_profit_factor": 2.787, "train_ic": 0.4262, "train_hit": 63.32, "train_per_window": [{"fold": "all_train", "regime": "Training data", "sharpe": 4.4892, "sortino": 11.4181, "return_pct": 18541.58, "equity": 186415.78, "max_dd": 6.17, "win_rate": 63.57, "profit_factor": 2.787, "ic": 0.4262, "hit": 63.32, "n": 2478}], "experiment_num": 62, "status": "DISCARD"}
{"backbone": "mlp", "description": "mlp: Exp7 lr=1e-4 ep=100 flat minima (Lewkowycz2020)", "config": {"seq_len": 10, "lr": 0.0001, "batch_size": 32, "epochs": 100, "weight_decay": 1e-05, "patience": 15, "grad_clip": 1.0, "warmup_epochs": 0, "huber_delta": 1.0, "head_dropout": 0.1, "seed": 0, "het_loss": false}, "composite": 0.4111, "test_pos_folds": 5, "val_pos_folds": 6, "val_loss": 4.1e-05, "elapsed_sec": 28.2, "timestamp": "2026-04-12T17:34:30", "sharpe": 0.7111, "psr": 0.9282, "equity": 1316.4, "sortino": 1.1846, "return_pct": 31.64, "max_dd": 19.19, "win_rate": 52.84, "profit_factor": 1.14, "ic": 0.1006, "hit": 52.62, "aleatoric_mean": 7.8e-05, "epistemic_mean": 0.000157, "confidence_mean": 0.9998, "per_window": [{"fold": "fold_1", "regime": "Pre-crisis upturn + GFC onset", "sharpe": 0.8942, "sortino": 2.6012, "return_pct": 6.38, "equity": 1063.78, "max_dd": 10.57, "win_rate": 46.08, "profit_factor": 1.236, "ic": -0.133, "hit": 45.63, "n": 103, "aleatoric_mean": 0.000113, "epistemic_mean": 0.000227, "confidence_mean": 0.9997, "aleatoric_std": 6.5e-05, "epistemic_std": 0.000129}, {"fold": "fold_2", "regime": "Post-crash recovery", "sharpe": -1.2812, "sortino": -1.9258, "return_pct": -6.2, "equity": 937.98, "max_dd": 10.66, "win_rate": 52.34, "profit_factor": 0.818, "ic": 0.1146, "hit": 52.34, "n": 107, "aleatoric_mean": 8.4e-05, "epistemic_mean": 0.000169, "confidence_mean": 0.9997, "aleatoric_std": 4.3e-05, "epistemic_std": 8.6e-05}, {"fold": "fold_3", "regime": "Eurozone debt plateau", "sharpe": 0.8826, "sortino": 1.4578, "return_pct": 3.02, "equity": 1030.23, "max_dd": 6.24, "win_rate": 53.85, "profit_factor": 1.149, "ic": 0.1265, "hit": 52.83, "n": 106, "aleatoric_mean": 9e-05, "epistemic_mean": 0.00018, "confidence_mean": 0.9997, "aleatoric_std": 5.3e-05, "epistemic_std": 0.000107}, {"fold": "fold_4", "regime": "Strong USD downturn", "sharpe": 2.2993, "sortino": 3.7593, "return_pct": 18.83, "equity": 1188.32, "max_dd": 6.08, "win_rate": 58.08, "profit_factor": 1.473, "ic": 0.1632, "hit": 57.74, "n": 168, "aleatoric_mean": 8.8e-05, "epistemic_mean": 0.000175, "confidence_mean": 0.9997, "aleatoric_std": 4e-05, "epistemic_std": 8.1e-05}, {"fold": "fold_5", "regime": "Low-vol plateau", "sharpe": 0.8208, "sortino": 1.342, "return_pct": 2.68, "equity": 1026.81, "max_dd": 3.97, "win_rate": 51.85, "profit_factor": 1.146, "ic": 0.1461, "hit": 51.85, "n": 162, "aleatoric_mean": 5.3e-05, "epistemic_mean": 0.000107, "confidence_mean": 0.9998, "aleatoric_std": 1.8e-05, "epistemic_std": 3.6e-05}, {"fold": "fold_6", "regime": "EUR crisis downturn", "sharpe": 2.1577, "sortino": 3.4039, "return_pct": 14.07, "equity": 1140.69, "max_dd": 5.27, "win_rate": 56.97, "profit_factor": 1.418, "ic": 0.2738, "hit": 56.97, "n": 165, "aleatoric_mean": 8e-05, "epistemic_mean": 0.00016, "confidence_mean": 0.9998, "aleatoric_std": 4.5e-05, "epistemic_std": 9e-05}, {"fold": "fold_7", "regime": "Recent mixed/upturn", "sharpe": -1.3557, "sortino": -1.737, "return_pct": -7.99, "equity": 920.06, "max_dd": 13.96, "win_rate": 48.15, "profit_factor": 0.795, "ic": 0.001, "hit": 48.15, "n": 162, "aleatoric_mean": 5.8e-05, "epistemic_mean": 0.000117, "confidence_mean": 0.9998, "aleatoric_std": 2.2e-05, "epistemic_std": 4.4e-05}], "val_sharpe": 1.0789, "val_psr": 0.9705, "val_equity": 1279.43, "val_sortino": 1.6619, "val_return_pct": 27.94, "val_max_dd": 15.31, "val_win_rate": 53.6, "val_profit_factor": 1.2, "val_ic": 0.0948, "val_hit": 53.26, "val_aleatoric_mean": 6.1e-05, "val_epistemic_mean": 0.000122, "val_confidence_mean": 0.9998, "val_per_window": [{"fold": "fold_1", "regime": "Pre-crisis upturn + GFC onset", "sharpe": 3.2523, "sortino": 5.7905, "return_pct": 8.3, "equity": 1082.98, "max_dd": 2.35, "win_rate": 55.56, "profit_factor": 1.718, "ic": 0.244, "hit": 55.05, "n": 109, "aleatoric_mean": 7.6e-05, "epistemic_mean": 0.000152, "confidence_mean": 0.9998, "aleatoric_std": 6.4e-05, "epistemic_std": 0.000129}, {"fold": "fold_2", "regime": "Post-crash recovery", "sharpe": -2.2622, "sortino": -3.7371, "return_pct": -10.55, "equity": 894.49, "max_dd": 11.29, "win_rate": 45.37, "profit_factor": 0.7, "ic": -0.1719, "hit": 45.37, "n": 108, "aleatoric_mean": 7.3e-05, "epistemic_mean": 0.000145, "confidence_mean": 0.9998, "aleatoric_std": 2.7e-05, "epistemic_std": 5.4e-05}, {"fold": "fold_3", "regime": "Eurozone debt plateau", "sharpe": 0.6395, "sortino": 1.1635, "return_pct": 2.43, "equity": 1024.29, "max_dd": 5.54, "win_rate": 52.29, "profit_factor": 1.109, "ic": 0.1054, "hit": 51.35, "n": 111, "aleatoric_mean": 7.4e-05, "epistemic_mean": 0.000149, "confidence_mean": 0.9998, "aleatoric_std": 3.2e-05, "epistemic_std": 6.4e-05}, {"fold": "fold_4", "regime": "Strong USD downturn", "sharpe": 4.2543, "sortino": 6.6525, "return_pct": 15.19, "equity": 1151.95, "max_dd": 4.32, "win_rate": 66.06, "profit_factor": 2.029, "ic": 0.3164, "hit": 65.45, "n": 110, "aleatoric_mean": 5.2e-05, "epistemic_mean": 0.000104, "confidence_mean": 0.9998, "aleatoric_std": 2.1e-05, "epistemic_std": 4.2e-05}, {"fold": "fold_5", "regime": "Low-vol plateau", "sharpe": 3.3929, "sortino": 6.9539, "return_pct": 11.57, "equity": 1115.73, "max_dd": 2.31, "win_rate": 52.68, "profit_factor": 1.761, "ic": 0.2058, "hit": 52.68, "n": 112, "aleatoric_mean": 5.2e-05, "epistemic_mean": 0.000103, "confidence_mean": 0.9998, "aleatoric_std": 2.2e-05, "epistemic_std": 4.4e-05}, {"fold": "fold_6", "regime": "EUR crisis downturn", "sharpe": 0.1899, "sortino": 0.2727, "return_pct": 0.37, "equity": 1003.74, "max_dd": 4.68, "win_rate": 55.14, "profit_factor": 1.032, "ic": 0.0018, "hit": 54.63, "n": 108, "aleatoric_mean": 4.8e-05, "epistemic_mean": 9.5e-05, "confidence_mean": 0.9999, "aleatoric_std": 1.4e-05, "epistemic_std": 2.7e-05}, {"fold": "fold_7", "regime": "Recent mixed/upturn", "sharpe": 0.0067, "sortino": 0.0109, "return_pct": -0.05, "equity": 999.5, "max_dd": 3.25, "win_rate": 48.18, "profit_factor": 1.001, "ic": 0.0097, "hit": 48.18, "n": 110, "aleatoric_mean": 5.1e-05, "epistemic_mean": 0.000102, "confidence_mean": 0.9998, "aleatoric_std": 1.8e-05, "epistemic_std": 3.6e-05}], "train_sharpe": 4.1162, "train_psr": 1.0, "train_equity": 123515.12, "train_sortino": 10.1204, "train_return_pct": 12251.51, "train_max_dd": 4.58, "train_win_rate": 61.91, "train_profit_factor": 2.541, "train_ic": 0.3943, "train_hit": 61.66, "train_per_window": [{"fold": "all_train", "regime": "Training data", "sharpe": 4.1162, "sortino": 10.1204, "return_pct": 12251.51, "equity": 123515.12, "max_dd": 4.58, "win_rate": 61.91, "profit_factor": 2.541, "ic": 0.3943, "hit": 61.66, "n": 2478}], "experiment_num": 63, "status": "DISCARD"}
{"backbone": "mlp", "description": "mlp: Exp8 hd=0.2 reduce head overfit (Srivastava2014) seed=0", "config": {"seq_len": 10, "lr": 0.0003, "batch_size": 32, "epochs": 50, "weight_decay": 1e-05, "patience": 10, "grad_clip": 1.0, "warmup_epochs": 0, "huber_delta": 1.0, "head_dropout": 0.2, "seed": 0, "het_loss": false}, "composite": 0.3846, "test_pos_folds": 6, "val_pos_folds": 5, "val_loss": 3.3e-05, "elapsed_sec": 13.3, "timestamp": "2026-04-12T17:37:32", "sharpe": 0.9804, "psr": 0.9799, "equity": 1472.79, "sortino": 1.6896, "return_pct": 47.28, "max_dd": 15.98, "win_rate": 52.32, "profit_factor": 1.199, "ic": 0.0841, "hit": 52.11, "aleatoric_mean": 4.3e-05, "epistemic_mean": 8.5e-05, "confidence_mean": 0.9999, "per_window": [{"fold": "fold_1", "regime": "Pre-crisis upturn + GFC onset", "sharpe": 1.2961, "sortino": 3.7221, "return_pct": 9.7, "equity": 1097.03, "max_dd": 11.12, "win_rate": 50.0, "profit_factor": 1.36, "ic": 0.0479, "hit": 49.51, "n": 103, "aleatoric_mean": 5.7e-05, "epistemic_mean": 0.000114, "confidence_mean": 0.9998, "aleatoric_std": 2.4e-05, "epistemic_std": 4.7e-05}, {"fold": "fold_2", "regime": "Post-crash recovery", "sharpe": 1.4404, "sortino": 2.5652, "return_pct": 6.84, "equity": 1068.39, "max_dd": 4.82, "win_rate": 57.01, "profit_factor": 1.253, "ic": 0.2337, "hit": 57.01, "n": 107, "aleatoric_mean": 4.7e-05, "epistemic_mean": 9.5e-05, "confidence_mean": 0.9999, "aleatoric_std": 2.1e-05, "epistemic_std": 4.3e-05}, {"fold": "fold_3", "regime": "Eurozone debt plateau", "sharpe": -1.109, "sortino": -1.8036, "return_pct": -4.0, "equity": 960.05, "max_dd": 9.64, "win_rate": 50.0, "profit_factor": 0.84, "ic": 0.0694, "hit": 49.06, "n": 106, "aleatoric_mean": 4.8e-05, "epistemic_mean": 9.6e-05, "confidence_mean": 0.9999, "aleatoric_std": 2.2e-05, "epistemic_std": 4.5e-05}, {"fold": "fold_4", "regime": "Strong USD downturn", "sharpe": 1.0186, "sortino": 1.409, "return_pct": 7.74, "equity": 1077.4, "max_dd": 5.09, "win_rate": 55.09, "profit_factor": 1.187, "ic": 0.0751, "hit": 54.76, "n": 168, "aleatoric_mean": 5e-05, "epistemic_mean": 9.9e-05, "confidence_mean": 0.9999, "aleatoric_std": 2.2e-05, "epistemic_std": 4.3e-05}, {"fold": "fold_5", "regime": "Low-vol plateau", "sharpe": 1.0501, "sortino": 1.844, "return_pct": 3.46, "equity": 1034.65, "max_dd": 2.84, "win_rate": 49.38, "profit_factor": 1.191, "ic": 0.0502, "hit": 49.38, "n": 162, "aleatoric_mean": 2.9e-05, "epistemic_mean": 5.7e-05, "confidence_mean": 0.9999, "aleatoric_std": 1.1e-05, "epistemic_std": 2.2e-05}, {"fold": "fold_6", "regime": "EUR crisis downturn", "sharpe": 1.814, "sortino": 2.6596, "return_pct": 11.68, "equity": 1116.82, "max_dd": 4.65, "win_rate": 54.55, "profit_factor": 1.341, "ic": 0.1811, "hit": 54.55, "n": 165, "aleatoric_mean": 4.7e-05, "epistemic_mean": 9.3e-05, "confidence_mean": 0.9999, "aleatoric_std": 2.6e-05, "epistemic_std": 5.2e-05}, {"fold": "fold_7", "regime": "Recent mixed/upturn", "sharpe": 0.8874, "sortino": 1.711, "return_pct": 5.14, "equity": 1051.35, "max_dd": 5.2, "win_rate": 50.0, "profit_factor": 1.162, "ic": -0.0472, "hit": 50.0, "n": 162, "aleatoric_mean": 3e-05, "epistemic_mean": 6e-05, "confidence_mean": 0.9999, "aleatoric_std": 1.3e-05, "epistemic_std": 2.5e-05}], "val_sharpe": 0.6846, "val_psr": 0.8836, "val_equity": 1165.55, "val_sortino": 1.0385, "val_return_pct": 16.55, "val_max_dd": 8.16, "val_win_rate": 52.56, "val_profit_factor": 1.123, "val_ic": 0.0288, "val_hit": 52.21, "val_aleatoric_mean": 3.3e-05, "val_epistemic_mean": 6.7e-05, "val_confidence_mean": 0.9999, "val_per_window": [{"fold": "fold_1", "regime": "Pre-crisis upturn + GFC onset", "sharpe": 0.8969, "sortino": 1.538, "return_pct": 2.21, "equity": 1022.12, "max_dd": 3.11, "win_rate": 53.7, "profit_factor": 1.16, "ic": 0.0042, "hit": 53.21, "n": 109, "aleatoric_mean": 3.6e-05, "epistemic_mean": 7.2e-05, "confidence_mean": 0.9999, "aleatoric_std": 2.7e-05, "epistemic_std": 5.4e-05}, {"fold": "fold_2", "regime": "Post-crash recovery", "sharpe": 0.7823, "sortino": 1.2455, "return_pct": 3.58, "equity": 1035.81, "max_dd": 6.98, "win_rate": 52.78, "profit_factor": 1.131, "ic": 0.03, "hit": 52.78, "n": 108, "aleatoric_mean": 4.5e-05, "epistemic_mean": 9e-05, "confidence_mean": 0.9999, "aleatoric_std": 2.1e-05, "epistemic_std": 4.3e-05}, {"fold": "fold_3", "regime": "Eurozone debt plateau", "sharpe": 0.9271, "sortino": 1.5533, "return_pct": 3.62, "equity": 1036.22, "max_dd": 2.82, "win_rate": 48.62, "profit_factor": 1.162, "ic": 0.0677, "hit": 47.75, "n": 111, "aleatoric_mean": 4.1e-05, "epistemic_mean": 8.2e-05, "confidence_mean": 0.9999, "aleatoric_std": 1.6e-05, "epistemic_std": 3.1e-05}, {"fold": "fold_4", "regime": "Strong USD downturn", "sharpe": -0.27, "sortino": -0.3924, "return_pct": -1.07, "equity": 989.29, "max_dd": 8.16, "win_rate": 53.21, "profit_factor": 0.956, "ic": -0.0065, "hit": 52.73, "n": 110, "aleatoric_mean": 3e-05, "epistemic_mean": 6e-05, "confidence_mean": 0.9999, "aleatoric_std": 1.3e-05, "epistemic_std": 2.6e-05}, {"fold": "fold_5", "regime": "Low-vol plateau", "sharpe": 2.064, "sortino": 3.2888, "return_pct": 6.94, "equity": 1069.37, "max_dd": 2.29, "win_rate": 63.39, "profit_factor": 1.41, "ic": 0.096, "hit": 63.39, "n": 112, "aleatoric_mean": 3e-05, "epistemic_mean": 5.9e-05, "confidence_mean": 0.9999, "aleatoric_std": 1.4e-05, "epistemic_std": 2.8e-05}, {"fold": "fold_6", "regime": "EUR crisis downturn", "sharpe": -0.2052, "sortino": -0.3393, "return_pct": -0.53, "equity": 994.7, "max_dd": 3.61, "win_rate": 46.73, "profit_factor": 0.966, "ic": 0.0149, "hit": 46.3, "n": 108, "aleatoric_mean": 2.2e-05, "epistemic_mean": 4.5e-05, "confidence_mean": 0.9999, "aleatoric_std": 9e-06, "epistemic_std": 1.7e-05}, {"fold": "fold_7", "regime": "Recent mixed/upturn", "sharpe": 0.4256, "sortino": 0.7083, "return_pct": 0.96, "equity": 1009.6, "max_dd": 2.82, "win_rate": 49.09, "profit_factor": 1.071, "ic": -0.0613, "hit": 49.09, "n": 110, "aleatoric_mean": 2.9e-05, "epistemic_mean": 5.8e-05, "confidence_mean": 0.9999, "aleatoric_std": 1.2e-05, "epistemic_std": 2.4e-05}], "train_sharpe": 2.9949, "train_psr": 1.0, "train_equity": 34403.92, "train_sortino": 6.9924, "train_return_pct": 3340.39, "train_max_dd": 6.53, "train_win_rate": 57.82, "train_profit_factor": 1.948, "train_ic": 0.3069, "train_hit": 57.59, "train_per_window": [{"fold": "all_train", "regime": "Training data", "sharpe": 2.9949, "sortino": 6.9924, "return_pct": 3340.39, "equity": 34403.92, "max_dd": 6.53, "win_rate": 57.82, "profit_factor": 1.948, "ic": 0.3069, "hit": 57.59, "n": 2478}], "experiment_num": 64, "status": "DISCARD"}
