{"backbone": "mlp", "description": "mlp: Exp30 residual huber=0.5 REPRODUCE seed=42", "config": {"seq_len": 10, "lr": 0.0005, "batch_size": 32, "epochs": 50, "weight_decay": 1e-05, "patience": 10, "grad_clip": 1.0, "warmup_epochs": 0, "huber_delta": 0.5, "head_dropout": 0.15, "seed": 42, "het_loss": false}, "composite": 4.4532, "test_pos_folds": 7, "val_pos_folds": 5, "val_loss": 4.1e-05, "elapsed_sec": 28.8, "timestamp": "2026-04-14T17:20:52", "sharpe": 4.6908, "psr": 1.0, "equity": 6426.12, "sortino": 5.8412, "return_pct": 542.61, "max_dd": 7.54, "win_rate": 65.33, "profit_factor": 2.422, "ic": 0.4161, "hit": 65.06, "aleatoric_mean": 3.3e-05, "epistemic_mean": 6.6e-05, "confidence_mean": 0.9999, "per_window": [{"fold": "fold_1", "regime": "Pre-crisis upturn + GFC onset", "sharpe": 0.5758, "sortino": 0.6308, "return_pct": 3.78, "equity": 1037.75, "max_dd": 7.54, "win_rate": 52.94, "profit_factor": 1.146, "ic": 0.128, "hit": 52.43, "n": 103, "aleatoric_mean": 6.8e-05, "epistemic_mean": 0.000137, "confidence_mean": 0.9998, "aleatoric_std": 8.2e-05, "epistemic_std": 0.000164}, {"fold": "fold_2", "regime": "Post-crash recovery", "sharpe": 0.0931, "sortino": 0.1486, "return_pct": 0.18, "equity": 1001.75, "max_dd": 5.31, "win_rate": 55.14, "profit_factor": 1.015, "ic": 0.1277, "hit": 55.14, "n": 107, "aleatoric_mean": 2.7e-05, "epistemic_mean": 5.3e-05, "confidence_mean": 0.9999, "aleatoric_std": 1.7e-05, "epistemic_std": 3.3e-05}, {"fold": "fold_3", "regime": "Eurozone debt plateau", "sharpe": 5.9242, "sortino": 12.1057, "return_pct": 21.6, "equity": 1215.96, "max_dd": 2.22, "win_rate": 65.38, "profit_factor": 2.544, "ic": 0.4482, "hit": 64.15, "n": 106, "aleatoric_mean": 3.5e-05, "epistemic_mean": 7.1e-05, "confidence_mean": 0.9999, "aleatoric_std": 1.8e-05, "epistemic_std": 3.6e-05}, {"fold": "fold_4", "regime": "Strong USD downturn", "sharpe": 7.9397, "sortino": 15.0465, "return_pct": 72.99, "equity": 1729.88, "max_dd": 2.37, "win_rate": 71.86, "profit_factor": 3.955, "ic": 0.6265, "hit": 71.43, "n": 168, "aleatoric_mean": 4.6e-05, "epistemic_mean": 9.2e-05, "confidence_mean": 0.9999, "aleatoric_std": 2.9e-05, "epistemic_std": 5.8e-05}, {"fold": "fold_5", "regime": "Low-vol plateau", "sharpe": 7.5136, "sortino": 10.9204, "return_pct": 25.3, "equity": 1252.96, "max_dd": 1.32, "win_rate": 68.52, "profit_factor": 3.596, "ic": 0.4804, "hit": 68.52, "n": 162, "aleatoric_mean": 1.6e-05, "epistemic_mean": 3.2e-05, "confidence_mean": 1.0, "aleatoric_std": 1.2e-05, "epistemic_std": 2.5e-05}, {"fold": "fold_6", "regime": "EUR crisis downturn", "sharpe": 9.2272, "sortino": 18.4503, "return_pct": 64.78, "equity": 1647.79, "max_dd": 1.54, "win_rate": 69.7, "profit_factor": 4.626, "ic": 0.5986, "hit": 69.7, "n": 165, "aleatoric_mean": 3.1e-05, "epistemic_mean": 6.2e-05, "confidence_mean": 0.9999, "aleatoric_std": 2e-05, "epistemic_std": 4e-05}, {"fold": "fold_7", "regime": "Recent mixed/upturn", "sharpe": 6.4388, "sortino": 12.3929, "return_pct": 42.34, "equity": 1423.37, "max_dd": 1.64, "win_rate": 65.43, "profit_factor": 3.032, "ic": 0.5284, "hit": 65.43, "n": 162, "aleatoric_mean": 2e-05, "epistemic_mean": 4.1e-05, "confidence_mean": 0.9999, "aleatoric_std": 1e-05, "epistemic_std": 2e-05}], "val_sharpe": 4.6532, "val_psr": 1.0, "val_equity": 2861.4, "val_sortino": 7.2346, "val_return_pct": 186.14, "val_max_dd": 14.96, "val_win_rate": 61.99, "val_profit_factor": 2.211, "val_ic": 0.4177, "val_hit": 61.59, "val_aleatoric_mean": 2e-05, "val_epistemic_mean": 4e-05, "val_confidence_mean": 0.9999, "val_per_window": [{"fold": "fold_1", "regime": "Pre-crisis upturn + GFC onset", "sharpe": -1.2231, "sortino": -1.9276, "return_pct": -3.1, "equity": 968.96, "max_dd": 6.3, "win_rate": 45.37, "profit_factor": 0.816, "ic": -0.0023, "hit": 44.95, "n": 109, "aleatoric_mean": 1.9e-05, "epistemic_mean": 3.7e-05, "confidence_mean": 0.9999, "aleatoric_std": 2.2e-05, "epistemic_std": 4.3e-05}, {"fold": "fold_2", "regime": "Post-crash recovery", "sharpe": -2.0241, "sortino": -3.2705, "return_pct": -9.54, "equity": 904.61, "max_dd": 13.12, "win_rate": 38.89, "profit_factor": 0.726, "ic": -0.0799, "hit": 38.89, "n": 108, "aleatoric_mean": 3.8e-05, "epistemic_mean": 7.6e-05, "confidence_mean": 0.9999, "aleatoric_std": 4.1e-05, "epistemic_std": 8.2e-05}, {"fold": "fold_3", "regime": "Eurozone debt plateau", "sharpe": 9.5858, "sortino": 22.4537, "return_pct": 39.11, "equity": 1391.1, "max_dd": 1.3, "win_rate": 72.48, "profit_factor": 4.981, "ic": 0.6495, "hit": 71.17, "n": 111, "aleatoric_mean": 2.5e-05, "epistemic_mean": 5.1e-05, "confidence_mean": 0.9999, "aleatoric_std": 1.6e-05, "epistemic_std": 3.1e-05}, {"fold": "fold_4", "regime": "Strong USD downturn", "sharpe": 6.3359, "sortino": 13.7393, "return_pct": 22.53, "equity": 1225.27, "max_dd": 1.51, "win_rate": 64.22, "profit_factor": 2.895, "ic": 0.5241, "hit": 63.64, "n": 110, "aleatoric_mean": 1.9e-05, "epistemic_mean": 3.8e-05, "confidence_mean": 0.9999, "aleatoric_std": 1.6e-05, "epistemic_std": 3.3e-05}, {"fold": "fold_5", "regime": "Low-vol plateau", "sharpe": 8.5898, "sortino": 20.628, "return_pct": 28.52, "equity": 1285.24, "max_dd": 1.12, "win_rate": 66.07, "profit_factor": 4.37, "ic": 0.5974, "hit": 66.07, "n": 112, "aleatoric_mean": 1.7e-05, "epistemic_mean": 3.4e-05, "confidence_mean": 0.9999, "aleatoric_std": 1.1e-05, "epistemic_std": 2.1e-05}, {"fold": "fold_6", "regime": "EUR crisis downturn", "sharpe": 11.5516, "sortino": 25.1989, "return_pct": 23.78, "equity": 1237.78, "max_dd": 0.77, "win_rate": 78.5, "profit_factor": 8.333, "ic": 0.7665, "hit": 77.78, "n": 108, "aleatoric_mean": 1e-05, "epistemic_mean": 2.1e-05, "confidence_mean": 1.0, "aleatoric_std": 4e-06, "epistemic_std": 7e-06}, {"fold": "fold_7", "regime": "Recent mixed/upturn", "sharpe": 8.8945, "sortino": 22.4843, "return_pct": 20.39, "equity": 1203.91, "max_dd": 0.75, "win_rate": 68.18, "profit_factor": 4.312, "ic": 0.6568, "hit": 68.18, "n": 110, "aleatoric_mean": 1.2e-05, "epistemic_mean": 2.5e-05, "confidence_mean": 1.0, "aleatoric_std": 7e-06, "epistemic_std": 1.5e-05}], "train_sharpe": 7.6385, "train_psr": 1.0, "train_equity": 4332369.0, "train_sortino": 21.8717, "train_return_pct": 433136.9, "train_max_dd": 3.89, "train_win_rate": 76.34, "train_profit_factor": 7.06, "train_ic": 0.7293, "train_hit": 76.03, "train_per_window": [{"fold": "all_train", "regime": "Training data", "sharpe": 7.6385, "sortino": 21.8717, "return_pct": 433136.9, "equity": 4332369.0, "max_dd": 3.89, "win_rate": 76.34, "profit_factor": 7.06, "ic": 0.7293, "hit": 76.03, "n": 2478}], "experiment_num": 86, "status": "DISCARD"}
{"backbone": "mlp", "description": "mlp: Exp31 residual huber=0.5 seed=99", "config": {"seq_len": 10, "lr": 0.0005, "batch_size": 32, "epochs": 50, "weight_decay": 1e-05, "patience": 10, "grad_clip": 1.0, "warmup_epochs": 0, "huber_delta": 0.5, "head_dropout": 0.15, "seed": 99, "het_loss": false}, "composite": 4.4552, "test_pos_folds": 6, "val_pos_folds": 5, "val_loss": 3.9e-05, "elapsed_sec": 28.1, "timestamp": "2026-04-14T17:21:42", "sharpe": 4.7552, "psr": 1.0, "equity": 6580.5, "sortino": 5.8369, "return_pct": 558.05, "max_dd": 10.96, "win_rate": 66.77, "profit_factor": 2.453, "ic": 0.4161, "hit": 66.5, "aleatoric_mean": 3e-05, "epistemic_mean": 6e-05, "confidence_mean": 0.9999, "per_window": [{"fold": "fold_1", "regime": "Pre-crisis upturn + GFC onset", "sharpe": -0.9886, "sortino": -1.095, "return_pct": -8.01, "equity": 919.94, "max_dd": 10.96, "win_rate": 50.98, "profit_factor": 0.791, "ic": -0.0982, "hit": 50.49, "n": 103, "aleatoric_mean": 5.9e-05, "epistemic_mean": 0.000118, "confidence_mean": 0.9998, "aleatoric_std": 7.7e-05, "epistemic_std": 0.000155}, {"fold": "fold_2", "regime": "Post-crash recovery", "sharpe": 2.1182, "sortino": 3.6739, "return_pct": 10.31, "equity": 1103.05, "max_dd": 6.43, "win_rate": 59.81, "profit_factor": 1.394, "ic": 0.1213, "hit": 59.81, "n": 107, "aleatoric_mean": 2e-05, "epistemic_mean": 4e-05, "confidence_mean": 0.9999, "aleatoric_std": 1.3e-05, "epistemic_std": 2.5e-05}, {"fold": "fold_3", "regime": "Eurozone debt plateau", "sharpe": 5.1753, "sortino": 10.1395, "return_pct": 18.91, "equity": 1189.08, "max_dd": 1.87, "win_rate": 65.38, "profit_factor": 2.258, "ic": 0.4263, "hit": 64.15, "n": 106, "aleatoric_mean": 2.8e-05, "epistemic_mean": 5.7e-05, "confidence_mean": 0.9999, "aleatoric_std": 1.5e-05, "epistemic_std": 3e-05}, {"fold": "fold_4", "regime": "Strong USD downturn", "sharpe": 9.3313, "sortino": 18.5214, "return_pct": 86.17, "equity": 1861.65, "max_dd": 1.83, "win_rate": 74.25, "profit_factor": 5.165, "ic": 0.6307, "hit": 73.81, "n": 168, "aleatoric_mean": 4.6e-05, "epistemic_mean": 9.1e-05, "confidence_mean": 0.9999, "aleatoric_std": 3.2e-05, "epistemic_std": 6.5e-05}, {"fold": "fold_5", "regime": "Low-vol plateau", "sharpe": 6.9469, "sortino": 9.3415, "return_pct": 23.53, "equity": 1235.25, "max_dd": 1.55, "win_rate": 69.14, "profit_factor": 3.249, "ic": 0.5603, "hit": 69.14, "n": 162, "aleatoric_mean": 1.6e-05, "epistemic_mean": 3.2e-05, "confidence_mean": 1.0, "aleatoric_std": 9e-06, "epistemic_std": 1.8e-05}, {"fold": "fold_6", "regime": "EUR crisis downturn", "sharpe": 8.4377, "sortino": 17.6292, "return_pct": 59.4, "equity": 1594.01, "max_dd": 1.88, "win_rate": 69.09, "profit_factor": 4.024, "ic": 0.6418, "hit": 69.09, "n": 165, "aleatoric_mean": 2.9e-05, "epistemic_mean": 5.8e-05, "confidence_mean": 0.9999, "aleatoric_std": 2.1e-05, "epistemic_std": 4.3e-05}, {"fold": "fold_7", "regime": "Recent mixed/upturn", "sharpe": 7.4029, "sortino": 13.5443, "return_pct": 48.78, "equity": 1487.81, "max_dd": 1.67, "win_rate": 69.75, "profit_factor": 3.616, "ic": 0.5959, "hit": 69.75, "n": 162, "aleatoric_mean": 1.7e-05, "epistemic_mean": 3.3e-05, "confidence_mean": 1.0, "aleatoric_std": 1e-05, "epistemic_std": 2e-05}], "val_sharpe": 5.8163, "val_psr": 1.0, "val_equity": 3625.06, "val_sortino": 8.6788, "val_return_pct": 262.51, "val_max_dd": 11.45, "val_win_rate": 66.58, "val_profit_factor": 2.713, "val_ic": 0.4559, "val_hit": 66.15, "val_aleatoric_mean": 1.7e-05, "val_epistemic_mean": 3.5e-05, "val_confidence_mean": 0.9999, "val_per_window": [{"fold": "fold_1", "regime": "Pre-crisis upturn + GFC onset", "sharpe": -0.3614, "sortino": -0.6724, "return_pct": -0.98, "equity": 990.19, "max_dd": 5.49, "win_rate": 43.52, "profit_factor": 0.942, "ic": -0.0447, "hit": 43.12, "n": 109, "aleatoric_mean": 1.6e-05, "epistemic_mean": 3.2e-05, "confidence_mean": 1.0, "aleatoric_std": 1.6e-05, "epistemic_std": 3.2e-05}, {"fold": "fold_2", "regime": "Post-crash recovery", "sharpe": -0.8825, "sortino": -1.3435, "return_pct": -4.45, "equity": 955.48, "max_dd": 11.45, "win_rate": 46.3, "profit_factor": 0.87, "ic": -0.1168, "hit": 46.3, "n": 108, "aleatoric_mean": 2.9e-05, "epistemic_mean": 5.7e-05, "confidence_mean": 0.9999, "aleatoric_std": 2.5e-05, "epistemic_std": 5e-05}, {"fold": "fold_3", "regime": "Eurozone debt plateau", "sharpe": 10.7472, "sortino": 24.3525, "return_pct": 43.07, "equity": 1430.69, "max_dd": 0.78, "win_rate": 72.48, "profit_factor": 6.191, "ic": 0.6885, "hit": 71.17, "n": 111, "aleatoric_mean": 2.2e-05, "epistemic_mean": 4.4e-05, "confidence_mean": 0.9999, "aleatoric_std": 1.3e-05, "epistemic_std": 2.6e-05}, {"fold": "fold_4", "regime": "Strong USD downturn", "sharpe": 10.7346, "sortino": 26.4906, "return_pct": 36.03, "equity": 1360.31, "max_dd": 0.64, "win_rate": 77.06, "profit_factor": 6.556, "ic": 0.702, "hit": 76.36, "n": 110, "aleatoric_mean": 1.7e-05, "epistemic_mean": 3.4e-05, "confidence_mean": 0.9999, "aleatoric_std": 1.4e-05, "epistemic_std": 2.8e-05}, {"fold": "fold_5", "regime": "Low-vol plateau", "sharpe": 10.0239, "sortino": 28.852, "return_pct": 32.54, "equity": 1325.37, "max_dd": 0.54, "win_rate": 74.11, "profit_factor": 5.758, "ic": 0.6981, "hit": 74.11, "n": 112, "aleatoric_mean": 1.8e-05, "epistemic_mean": 3.6e-05, "confidence_mean": 0.9999, "aleatoric_std": 1.4e-05, "epistemic_std": 2.8e-05}, {"fold": "fold_6", "regime": "EUR crisis downturn", "sharpe": 10.805, "sortino": 26.4102, "return_pct": 22.63, "equity": 1226.27, "max_dd": 0.77, "win_rate": 75.7, "profit_factor": 7.044, "ic": 0.7213, "hit": 75.0, "n": 108, "aleatoric_mean": 1e-05, "epistemic_mean": 2e-05, "confidence_mean": 1.0, "aleatoric_std": 4e-06, "epistemic_std": 8e-06}, {"fold": "fold_7", "regime": "Recent mixed/upturn", "sharpe": 9.288, "sortino": 19.8571, "return_pct": 21.14, "equity": 1211.36, "max_dd": 0.75, "win_rate": 76.36, "profit_factor": 4.62, "ic": 0.6632, "hit": 76.36, "n": 110, "aleatoric_mean": 1e-05, "epistemic_mean": 1.9e-05, "confidence_mean": 1.0, "aleatoric_std": 6e-06, "epistemic_std": 1.1e-05}], "train_sharpe": 7.7791, "train_psr": 1.0, "train_equity": 4912580.5, "train_sortino": 22.4069, "train_return_pct": 491158.05, "train_max_dd": 4.66, "train_win_rate": 77.8, "train_profit_factor": 7.44, "train_ic": 0.7335, "train_hit": 77.48, "train_per_window": [{"fold": "all_train", "regime": "Training data", "sharpe": 7.7791, "sortino": 22.4069, "return_pct": 491158.05, "equity": 4912580.5, "max_dd": 4.66, "win_rate": 77.8, "profit_factor": 7.44, "ic": 0.7335, "hit": 77.48, "n": 2478}], "experiment_num": 87, "status": "DISCARD"}
{"backbone": "mlp", "description": "mlp: Exp32 VERIFY champion seed=0 (must match Exp29)", "config": {"seq_len": 10, "lr": 0.0005, "batch_size": 32, "epochs": 50, "weight_decay": 1e-05, "patience": 10, "grad_clip": 1.0, "warmup_epochs": 0, "huber_delta": 0.5, "head_dropout": 0.15, "seed": 0, "het_loss": false}, "composite": 5.499, "test_pos_folds": 7, "val_pos_folds": 6, "val_loss": 3.8e-05, "elapsed_sec": 36.4, "timestamp": "2026-04-14T17:30:21", "sharpe": 6.2113, "psr": 1.0, "equity": 11010.87, "sortino": 11.3103, "return_pct": 1001.09, "max_dd": 4.13, "win_rate": 69.35, "profit_factor": 3.295, "ic": 0.4846, "hit": 69.06, "aleatoric_mean": 2.6e-05, "epistemic_mean": 5.2e-05, "confidence_mean": 0.9999, "per_window": [{"fold": "fold_1", "regime": "Pre-crisis upturn + GFC onset", "sharpe": 2.4608, "sortino": 6.7778, "return_pct": 19.79, "equity": 1197.85, "max_dd": 3.29, "win_rate": 60.78, "profit_factor": 1.805, "ic": 0.1877, "hit": 60.19, "n": 103, "aleatoric_mean": 5.3e-05, "epistemic_mean": 0.000106, "confidence_mean": 0.9998, "aleatoric_std": 7e-05, "epistemic_std": 0.000141}, {"fold": "fold_2", "regime": "Post-crash recovery", "sharpe": 1.1722, "sortino": 2.0218, "return_pct": 5.49, "equity": 1054.86, "max_dd": 3.47, "win_rate": 53.27, "profit_factor": 1.202, "ic": 0.0824, "hit": 53.27, "n": 107, "aleatoric_mean": 2.1e-05, "epistemic_mean": 4.3e-05, "confidence_mean": 0.9999, "aleatoric_std": 1.5e-05, "epistemic_std": 3.1e-05}, {"fold": "fold_3", "regime": "Eurozone debt plateau", "sharpe": 9.7583, "sortino": 18.8138, "return_pct": 34.13, "equity": 1341.27, "max_dd": 1.32, "win_rate": 75.96, "profit_factor": 4.755, "ic": 0.5836, "hit": 74.53, "n": 106, "aleatoric_mean": 2.8e-05, "epistemic_mean": 5.5e-05, "confidence_mean": 0.9999, "aleatoric_std": 1.4e-05, "epistemic_std": 2.9e-05}, {"fold": "fold_4", "regime": "Strong USD downturn", "sharpe": 9.7799, "sortino": 19.4179, "return_pct": 90.3, "equity": 1902.97, "max_dd": 1.81, "win_rate": 75.45, "profit_factor": 5.651, "ic": 0.6667, "hit": 75.0, "n": 168, "aleatoric_mean": 3.6e-05, "epistemic_mean": 7.2e-05, "confidence_mean": 0.9999, "aleatoric_std": 2.9e-05, "epistemic_std": 5.8e-05}, {"fold": "fold_5", "regime": "Low-vol plateau", "sharpe": 8.8545, "sortino": 16.1387, "return_pct": 29.29, "equity": 1292.92, "max_dd": 1.43, "win_rate": 70.99, "profit_factor": 4.604, "ic": 0.638, "hit": 70.99, "n": 162, "aleatoric_mean": 1.2e-05, "epistemic_mean": 2.5e-05, "confidence_mean": 1.0, "aleatoric_std": 7e-06, "epistemic_std": 1.3e-05}, {"fold": "fold_6", "regime": "EUR crisis downturn", "sharpe": 9.9474, "sortino": 21.0105, "return_pct": 69.54, "equity": 1695.35, "max_dd": 2.27, "win_rate": 70.91, "profit_factor": 5.27, "ic": 0.641, "hit": 70.91, "n": 165, "aleatoric_mean": 2.4e-05, "epistemic_mean": 4.9e-05, "confidence_mean": 0.9999, "aleatoric_std": 1.7e-05, "epistemic_std": 3.3e-05}, {"fold": "fold_7", "regime": "Recent mixed/upturn", "sharpe": 8.4769, "sortino": 14.3598, "return_pct": 55.75, "equity": 1557.55, "max_dd": 1.64, "win_rate": 71.6, "profit_factor": 4.429, "ic": 0.6222, "hit": 71.6, "n": 162, "aleatoric_mean": 1.7e-05, "epistemic_mean": 3.4e-05, "confidence_mean": 0.9999, "aleatoric_std": 1e-05, "epistemic_std": 2e-05}], "val_sharpe": 5.599, "val_psr": 1.0, "val_equity": 3472.42, "val_sortino": 8.4457, "val_return_pct": 247.24, "val_max_dd": 7.43, "val_win_rate": 66.19, "val_profit_factor": 2.61, "val_ic": 0.4582, "val_hit": 65.76, "val_aleatoric_mean": 1.5e-05, "val_epistemic_mean": 3e-05, "val_confidence_mean": 1.0, "val_per_window": [{"fold": "fold_1", "regime": "Pre-crisis upturn + GFC onset", "sharpe": 0.0212, "sortino": 0.0342, "return_pct": -0.02, "equity": 999.8, "max_dd": 2.91, "win_rate": 47.22, "profit_factor": 1.004, "ic": -0.0659, "hit": 46.79, "n": 109, "aleatoric_mean": 1.6e-05, "epistemic_mean": 3.1e-05, "confidence_mean": 1.0, "aleatoric_std": 2e-05, "epistemic_std": 4.1e-05}, {"fold": "fold_2", "regime": "Post-crash recovery", "sharpe": -0.6284, "sortino": -0.9753, "return_pct": -3.27, "equity": 967.3, "max_dd": 7.43, "win_rate": 47.22, "profit_factor": 0.906, "ic": 0.0432, "hit": 47.22, "n": 108, "aleatoric_mean": 2.7e-05, "epistemic_mean": 5.5e-05, "confidence_mean": 0.9999, "aleatoric_std": 2.2e-05, "epistemic_std": 4.3e-05}, {"fold": "fold_3", "regime": "Eurozone debt plateau", "sharpe": 11.0234, "sortino": 30.4677, "return_pct": 43.97, "equity": 1439.69, "max_dd": 0.84, "win_rate": 78.9, "profit_factor": 6.531, "ic": 0.6702, "hit": 77.48, "n": 111, "aleatoric_mean": 1.8e-05, "epistemic_mean": 3.6e-05, "confidence_mean": 0.9999, "aleatoric_std": 1.3e-05, "epistemic_std": 2.5e-05}, {"fold": "fold_4", "regime": "Strong USD downturn", "sharpe": 7.8607, "sortino": 16.5925, "return_pct": 27.57, "equity": 1275.68, "max_dd": 1.08, "win_rate": 71.56, "profit_factor": 3.79, "ic": 0.6035, "hit": 70.91, "n": 110, "aleatoric_mean": 1.4e-05, "epistemic_mean": 2.7e-05, "confidence_mean": 1.0, "aleatoric_std": 1.2e-05, "epistemic_std": 2.5e-05}, {"fold": "fold_5", "regime": "Low-vol plateau", "sharpe": 10.5961, "sortino": 28.9438, "return_pct": 34.04, "equity": 1340.39, "max_dd": 0.62, "win_rate": 75.0, "profit_factor": 6.466, "ic": 0.7232, "hit": 75.0, "n": 112, "aleatoric_mean": 1.3e-05, "epistemic_mean": 2.6e-05, "confidence_mean": 1.0, "aleatoric_std": 1e-05, "epistemic_std": 2e-05}, {"fold": "fold_6", "regime": "EUR crisis downturn", "sharpe": 9.2138, "sortino": 21.1712, "return_pct": 19.95, "equity": 1199.5, "max_dd": 0.82, "win_rate": 71.03, "profit_factor": 5.067, "ic": 0.717, "hit": 70.37, "n": 108, "aleatoric_mean": 8e-06, "epistemic_mean": 1.6e-05, "confidence_mean": 1.0, "aleatoric_std": 4e-06, "epistemic_std": 8e-06}, {"fold": "fold_7", "regime": "Recent mixed/upturn", "sharpe": 9.5361, "sortino": 25.4132, "return_pct": 21.6, "equity": 1215.96, "max_dd": 0.72, "win_rate": 71.82, "profit_factor": 4.828, "ic": 0.5963, "hit": 71.82, "n": 110, "aleatoric_mean": 9e-06, "epistemic_mean": 1.8e-05, "confidence_mean": 1.0, "aleatoric_std": 6e-06, "epistemic_std": 1.1e-05}], "train_sharpe": 7.9415, "train_psr": 1.0, "train_equity": 5670149.5, "train_sortino": 23.2561, "train_return_pct": 566914.95, "train_max_dd": 4.92, "train_win_rate": 78.04, "train_profit_factor": 7.921, "train_ic": 0.7556, "train_hit": 77.72, "train_per_window": [{"fold": "all_train", "regime": "Training data", "sharpe": 7.9415, "sortino": 23.2561, "return_pct": 566914.95, "equity": 5670149.5, "max_dd": 4.92, "win_rate": 78.04, "profit_factor": 7.921, "ic": 0.7556, "hit": 77.72, "n": 2478}], "experiment_num": 88, "status": "KEEP"}
