{"backbone": "lstm", "description": "lstm: Exp18 hd=0.20 fine-grained dropout (between 0.15 and 0.25)", "config": {"seq_len": 10, "lr": 0.001, "batch_size": 32, "epochs": 100, "weight_decay": 0.0001, "patience": 15, "grad_clip": 1.0, "warmup_epochs": 0, "huber_delta": 1.0, "head_dropout": 0.2, "seed": 0, "het_loss": false}, "composite": 5.5311, "test_pos_folds": 7, "val_pos_folds": 7, "val_loss": 2.8e-05, "elapsed_sec": 32.1, "timestamp": "2026-04-19T19:19:35", "sharpe": 5.5311, "psr": 1.0, "equity": 8705.54, "sortino": 10.0903, "return_pct": 770.55, "max_dd": 4.83, "win_rate": 67.29, "profit_factor": 2.864, "ic": 0.4677, "hit": 67.01, "aleatoric_mean": 1.8e-05, "epistemic_mean": 3.6e-05, "confidence_mean": 0.9999, "precision": 0.6674, "recall": 0.6715, "f1": 0.6694, "f2": 0.6707, "mcc": 0.3443, "accuracy": 0.6721, "per_window": [{"fold": "fold_1", "regime": "Pre-crisis upturn + GFC onset", "sharpe": 2.9248, "sortino": 8.2809, "return_pct": 23.97, "equity": 1239.65, "max_dd": 3.84, "win_rate": 57.84, "profit_factor": 2.028, "ic": 0.1395, "hit": 57.28, "n": 103, "precision": 0.5818, "recall": 0.6038, "f1": 0.5926, "f2": 0.5993, "mcc": 0.144, "accuracy": 0.5728, "tp": 32, "fp": 23, "tn": 27, "fn": 21, "aleatoric_mean": 3.2e-05, "epistemic_mean": 6.5e-05, "confidence_mean": 0.9999, "aleatoric_std": 2.4e-05, "epistemic_std": 4.8e-05}, {"fold": "fold_2", "regime": "Post-crash recovery", "sharpe": 0.4878, "sortino": 0.809, "return_pct": 2.09, "equity": 1020.91, "max_dd": 4.81, "win_rate": 53.27, "profit_factor": 1.079, "ic": 0.0566, "hit": 53.27, "n": 107, "precision": 0.5067, "recall": 0.7451, "f1": 0.6032, "f2": 0.681, "mcc": 0.0921, "accuracy": 0.5327, "tp": 38, "fp": 37, "tn": 19, "fn": 13, "aleatoric_mean": 2e-05, "epistemic_mean": 3.9e-05, "confidence_mean": 0.9999, "aleatoric_std": 9e-06, "epistemic_std": 1.8e-05}, {"fold": "fold_3", "regime": "Eurozone debt plateau", "sharpe": 6.5983, "sortino": 11.6283, "return_pct": 23.96, "equity": 1239.61, "max_dd": 3.11, "win_rate": 71.15, "profit_factor": 2.833, "ic": 0.5739, "hit": 69.81, "n": 106, "precision": 0.7167, "recall": 0.7544, "f1": 0.735, "f2": 0.7465, "mcc": 0.4099, "accuracy": 0.7075, "tp": 43, "fp": 17, "tn": 32, "fn": 14, "aleatoric_mean": 2.2e-05, "epistemic_mean": 4.4e-05, "confidence_mean": 0.9999, "aleatoric_std": 8e-06, "epistemic_std": 1.7e-05}, {"fold": "fold_4", "regime": "Strong USD downturn", "sharpe": 7.7055, "sortino": 13.6763, "return_pct": 70.73, "equity": 1707.27, "max_dd": 4.83, "win_rate": 74.25, "profit_factor": 3.787, "ic": 0.6679, "hit": 73.81, "n": 168, "precision": 0.8909, "recall": 0.5698, "f1": 0.695, "f2": 0.614, "mcc": 0.529, "accuracy": 0.744, "tp": 49, "fp": 6, "tn": 76, "fn": 37, "aleatoric_mean": 1.6e-05, "epistemic_mean": 3.2e-05, "confidence_mean": 1.0, "aleatoric_std": 7e-06, "epistemic_std": 1.4e-05}, {"fold": "fold_5", "regime": "Low-vol plateau", "sharpe": 8.3304, "sortino": 24.352, "return_pct": 27.76, "equity": 1277.64, "max_dd": 1.51, "win_rate": 65.43, "profit_factor": 4.175, "ic": 0.5593, "hit": 65.43, "n": 162, "precision": 0.6136, "recall": 0.7105, "f1": 0.6585, "f2": 0.6888, "mcc": 0.3158, "accuracy": 0.6543, "tp": 54, "fp": 34, "tn": 52, "fn": 22, "aleatoric_mean": 1.2e-05, "epistemic_mean": 2.3e-05, "confidence_mean": 1.0, "aleatoric_std": 4e-06, "epistemic_std": 8e-06}, {"fold": "fold_6", "regime": "EUR crisis downturn", "sharpe": 9.1394, "sortino": 17.6609, "return_pct": 64.19, "equity": 1641.89, "max_dd": 1.95, "win_rate": 72.12, "profit_factor": 4.554, "ic": 0.612, "hit": 72.12, "n": 165, "precision": 0.7313, "recall": 0.6364, "f1": 0.6806, "f2": 0.6533, "mcc": 0.4387, "accuracy": 0.7212, "tp": 49, "fp": 18, "tn": 70, "fn": 28, "aleatoric_mean": 1.7e-05, "epistemic_mean": 3.4e-05, "confidence_mean": 0.9999, "aleatoric_std": 7e-06, "epistemic_std": 1.3e-05}, {"fold": "fold_7", "regime": "Recent mixed/upturn", "sharpe": 8.3494, "sortino": 15.7256, "return_pct": 54.94, "equity": 1549.41, "max_dd": 1.64, "win_rate": 69.75, "profit_factor": 4.322, "ic": 0.6162, "hit": 69.75, "n": 162, "precision": 0.6905, "recall": 0.716, "f1": 0.703, "f2": 0.7108, "mcc": 0.3953, "accuracy": 0.6975, "tp": 58, "fp": 26, "tn": 55, "fn": 23, "aleatoric_mean": 1.6e-05, "epistemic_mean": 3.2e-05, "confidence_mean": 1.0, "aleatoric_std": 6e-06, "epistemic_std": 1.1e-05}], "val_sharpe": 6.0077, "val_psr": 1.0, "val_equity": 3763.25, "val_sortino": 9.2284, "val_return_pct": 276.32, "val_max_dd": 8.39, "val_win_rate": 65.79, "val_profit_factor": 2.807, "val_ic": 0.4413, "val_hit": 65.36, "val_aleatoric_mean": 1.4e-05, "val_epistemic_mean": 2.8e-05, "val_confidence_mean": 1.0, "val_precision": 0.6366, "val_recall": 0.6384, "val_f1": 0.6375, "val_f2": 0.638, "val_mcc": 0.3083, "val_accuracy": 0.6549, "val_per_window": [{"fold": "fold_1", "regime": "Pre-crisis upturn + GFC onset", "sharpe": 2.2571, "sortino": 3.7258, "return_pct": 5.73, "equity": 1057.27, "max_dd": 1.68, "win_rate": 53.7, "profit_factor": 1.455, "ic": 0.1146, "hit": 53.21, "n": 109, "precision": 0.55, "recall": 0.4, "f1": 0.4632, "f2": 0.4231, "mcc": 0.0692, "accuracy": 0.5321, "tp": 22, "fp": 18, "tn": 36, "fn": 33, "aleatoric_mean": 1.4e-05, "epistemic_mean": 2.8e-05, "confidence_mean": 1.0, "aleatoric_std": 7e-06, "epistemic_std": 1.4e-05}, {"fold": "fold_2", "regime": "Post-crash recovery", "sharpe": 0.6387, "sortino": 0.981, "return_pct": 2.86, "equity": 1028.64, "max_dd": 8.39, "win_rate": 50.93, "profit_factor": 1.106, "ic": 0.0543, "hit": 50.93, "n": 108, "precision": 0.6389, "recall": 0.3651, "f1": 0.4646, "f2": 0.3993, "mcc": 0.0797, "accuracy": 0.5093, "tp": 23, "fp": 13, "tn": 32, "fn": 40, "aleatoric_mean": 1.9e-05, "epistemic_mean": 3.7e-05, "confidence_mean": 0.9999, "aleatoric_std": 7e-06, "epistemic_std": 1.5e-05}, {"fold": "fold_3", "regime": "Eurozone debt plateau", "sharpe": 9.341, "sortino": 21.4725, "return_pct": 38.24, "equity": 1382.4, "max_dd": 0.91, "win_rate": 70.64, "profit_factor": 4.764, "ic": 0.7048, "hit": 69.37, "n": 111, "precision": 0.5844, "recall": 0.9574, "f1": 0.7258, "f2": 0.8491, "mcc": 0.4903, "accuracy": 0.6937, "tp": 45, "fp": 32, "tn": 32, "fn": 2, "aleatoric_mean": 1.4e-05, "epistemic_mean": 2.8e-05, "confidence_mean": 1.0, "aleatoric_std": 6e-06, "epistemic_std": 1.1e-05}, {"fold": "fold_4", "regime": "Strong USD downturn", "sharpe": 8.7924, "sortino": 20.5534, "return_pct": 30.47, "equity": 1304.7, "max_dd": 1.11, "win_rate": 76.15, "profit_factor": 4.495, "ic": 0.5998, "hit": 75.45, "n": 110, "precision": 0.7442, "recall": 0.6809, "f1": 0.7111, "f2": 0.6926, "mcc": 0.5132, "accuracy": 0.7636, "tp": 32, "fp": 11, "tn": 52, "fn": 15, "aleatoric_mean": 1.3e-05, "epistemic_mean": 2.7e-05, "confidence_mean": 1.0, "aleatoric_std": 6e-06, "epistemic_std": 1.1e-05}, {"fold": "fold_5", "regime": "Low-vol plateau", "sharpe": 10.7177, "sortino": 29.8002, "return_pct": 34.35, "equity": 1343.5, "max_dd": 1.22, "win_rate": 74.11, "profit_factor": 6.63, "ic": 0.7301, "hit": 74.11, "n": 112, "precision": 0.7609, "recall": 0.6604, "f1": 0.7071, "f2": 0.6783, "mcc": 0.481, "accuracy": 0.7411, "tp": 35, "fp": 11, "tn": 48, "fn": 18, "aleatoric_mean": 1.1e-05, "epistemic_mean": 2.3e-05, "confidence_mean": 1.0, "aleatoric_std": 4e-06, "epistemic_std": 8e-06}, {"fold": "fold_6", "regime": "EUR crisis downturn", "sharpe": 11.4795, "sortino": 44.522, "return_pct": 23.67, "equity": 1236.7, "max_dd": 0.42, "win_rate": 72.9, "profit_factor": 8.195, "ic": 0.7802, "hit": 72.22, "n": 108, "precision": 0.6269, "recall": 0.8936, "f1": 0.7368, "f2": 0.8235, "mcc": 0.4942, "accuracy": 0.7222, "tp": 42, "fp": 25, "tn": 36, "fn": 5, "aleatoric_mean": 1.1e-05, "epistemic_mean": 2.2e-05, "confidence_mean": 1.0, "aleatoric_std": 3e-06, "epistemic_std": 7e-06}, {"fold": "fold_7", "regime": "Recent mixed/upturn", "sharpe": 6.5069, "sortino": 15.3267, "return_pct": 15.47, "equity": 1154.7, "max_dd": 1.05, "win_rate": 61.82, "profit_factor": 2.874, "ic": 0.4754, "hit": 61.82, "n": 110, "precision": 0.5965, "recall": 0.6415, "f1": 0.6182, "f2": 0.632, "mcc": 0.238, "accuracy": 0.6182, "tp": 34, "fp": 23, "tn": 34, "fn": 19, "aleatoric_mean": 1.5e-05, "epistemic_mean": 3e-05, "confidence_mean": 1.0, "aleatoric_std": 6e-06, "epistemic_std": 1.3e-05}], "train_sharpe": 6.4182, "train_psr": 1.0, "train_equity": 1378907.25, "train_sortino": 15.0066, "train_return_pct": 137790.73, "train_max_dd": 5.92, "train_win_rate": 72.41, "train_profit_factor": 4.714, "train_ic": 0.6158, "train_hit": 72.11, "train_precision": 0.7498, "train_recall": 0.6892, "train_f1": 0.7182, "train_f2": 0.7005, "train_mcc": 0.4463, "train_accuracy": 0.722, "train_per_window": [{"fold": "all_train", "regime": "Training data", "sharpe": 6.4182, "sortino": 15.0066, "return_pct": 137790.73, "equity": 1378907.25, "max_dd": 5.92, "win_rate": 72.41, "profit_factor": 4.714, "ic": 0.6158, "hit": 72.11, "n": 2478, "precision": 0.7498, "recall": 0.6892, "f1": 0.7182, "f2": 0.7005, "mcc": 0.4463, "accuracy": 0.722, "tp": 878, "fp": 293, "tn": 911, "fn": 396}], "experiment_num": 123, "status": "DISCARD"}
{"backbone": "lstm", "description": "lstm: Exp19 grad_clip=0.5 tighter clipping (Pascanu2013)", "config": {"seq_len": 10, "lr": 0.001, "batch_size": 32, "epochs": 100, "weight_decay": 0.0001, "patience": 15, "grad_clip": 0.5, "warmup_epochs": 0, "huber_delta": 1.0, "head_dropout": 0.25, "seed": 0, "het_loss": false}, "composite": 5.4587, "test_pos_folds": 6, "val_pos_folds": 7, "val_loss": 2.6e-05, "elapsed_sec": 28.2, "timestamp": "2026-04-19T19:20:26", "sharpe": 5.8755, "psr": 1.0, "equity": 9817.2, "sortino": 10.5638, "return_pct": 881.72, "max_dd": 9.51, "win_rate": 68.52, "profit_factor": 3.073, "ic": 0.5117, "hit": 68.24, "aleatoric_mean": 1.6e-05, "epistemic_mean": 3.1e-05, "confidence_mean": 1.0, "precision": 0.6325, "recall": 0.8586, "f1": 0.7284, "f2": 0.8013, "mcc": 0.3946, "accuracy": 0.6835, "per_window": [{"fold": "fold_1", "regime": "Pre-crisis upturn + GFC onset", "sharpe": 2.8484, "sortino": 8.2353, "return_pct": 23.27, "equity": 1232.72, "max_dd": 5.32, "win_rate": 55.88, "profit_factor": 1.989, "ic": 0.1858, "hit": 55.34, "n": 103, "precision": 0.5432, "recall": 0.8302, "f1": 0.6567, "f2": 0.7509, "mcc": 0.11, "accuracy": 0.5534, "tp": 44, "fp": 37, "tn": 13, "fn": 9, "aleatoric_mean": 2.9e-05, "epistemic_mean": 5.7e-05, "confidence_mean": 0.9999, "aleatoric_std": 2.3e-05, "epistemic_std": 4.5e-05}, {"fold": "fold_2", "regime": "Post-crash recovery", "sharpe": -0.7597, "sortino": -1.2164, "return_pct": -3.84, "equity": 961.61, "max_dd": 6.43, "win_rate": 54.21, "profit_factor": 0.888, "ic": -0.0048, "hit": 54.21, "n": 107, "precision": 0.5109, "recall": 0.9216, "f1": 0.6573, "f2": 0.7939, "mcc": 0.1698, "accuracy": 0.5421, "tp": 47, "fp": 45, "tn": 11, "fn": 4, "aleatoric_mean": 1.6e-05, "epistemic_mean": 3.1e-05, "confidence_mean": 1.0, "aleatoric_std": 8e-06, "epistemic_std": 1.5e-05}, {"fold": "fold_3", "regime": "Eurozone debt plateau", "sharpe": 4.3808, "sortino": 7.2954, "return_pct": 16.0, "equity": 1159.99, "max_dd": 3.81, "win_rate": 68.27, "profit_factor": 1.991, "ic": 0.624, "hit": 66.98, "n": 106, "precision": 0.625, "recall": 0.9649, "f1": 0.7586, "f2": 0.8703, "mcc": 0.387, "accuracy": 0.6698, "tp": 55, "fp": 33, "tn": 16, "fn": 2, "aleatoric_mean": 1.7e-05, "epistemic_mean": 3.4e-05, "confidence_mean": 0.9999, "aleatoric_std": 7e-06, "epistemic_std": 1.3e-05}, {"fold": "fold_4", "regime": "Strong USD downturn", "sharpe": 11.5279, "sortino": 26.6805, "return_pct": 105.72, "equity": 2057.18, "max_dd": 1.24, "win_rate": 80.24, "profit_factor": 8.232, "ic": 0.7252, "hit": 79.76, "n": 168, "precision": 0.7789, "recall": 0.8605, "f1": 0.8177, "f2": 0.8428, "mcc": 0.6094, "accuracy": 0.8036, "tp": 74, "fp": 21, "tn": 61, "fn": 12, "aleatoric_mean": 1.3e-05, "epistemic_mean": 2.6e-05, "confidence_mean": 1.0, "aleatoric_std": 5e-06, "epistemic_std": 1e-05}, {"fold": "fold_5", "regime": "Low-vol plateau", "sharpe": 8.4191, "sortino": 23.2968, "return_pct": 28.03, "equity": 1280.26, "max_dd": 1.03, "win_rate": 65.43, "profit_factor": 4.244, "ic": 0.6826, "hit": 65.43, "n": 162, "precision": 0.5877, "recall": 0.8816, "f1": 0.7053, "f2": 0.8014, "mcc": 0.3662, "accuracy": 0.6543, "tp": 67, "fp": 47, "tn": 39, "fn": 9, "aleatoric_mean": 1e-05, "epistemic_mean": 2e-05, "confidence_mean": 1.0, "aleatoric_std": 3e-06, "epistemic_std": 6e-06}, {"fold": "fold_6", "regime": "EUR crisis downturn", "sharpe": 11.943, "sortino": 31.9016, "return_pct": 81.86, "equity": 1818.64, "max_dd": 1.31, "win_rate": 76.97, "profit_factor": 7.735, "ic": 0.7393, "hit": 76.97, "n": 165, "precision": 0.701, "recall": 0.8831, "f1": 0.7816, "f2": 0.8395, "mcc": 0.5611, "accuracy": 0.7697, "tp": 68, "fp": 29, "tn": 59, "fn": 9, "aleatoric_mean": 1.5e-05, "epistemic_mean": 3e-05, "confidence_mean": 1.0, "aleatoric_std": 8e-06, "epistemic_std": 1.5e-05}, {"fold": "fold_7", "regime": "Recent mixed/upturn", "sharpe": 7.4448, "sortino": 12.221, "return_pct": 49.06, "equity": 1490.57, "max_dd": 2.86, "win_rate": 68.52, "profit_factor": 3.644, "ic": 0.6198, "hit": 68.52, "n": 162, "precision": 0.6744, "recall": 0.716, "f1": 0.6946, "f2": 0.7073, "mcc": 0.3711, "accuracy": 0.6852, "tp": 58, "fp": 28, "tn": 53, "fn": 23, "aleatoric_mean": 1.5e-05, "epistemic_mean": 3e-05, "confidence_mean": 1.0, "aleatoric_std": 6e-06, "epistemic_std": 1.1e-05}], "val_sharpe": 5.5587, "val_psr": 1.0, "val_equity": 3444.63, "val_sortino": 8.5653, "val_return_pct": 244.46, "val_max_dd": 5.27, "val_win_rate": 63.56, "val_profit_factor": 2.592, "val_ic": 0.5147, "val_hit": 63.15, "val_aleatoric_mean": 1.2e-05, "val_epistemic_mean": 2.4e-05, "val_confidence_mean": 1.0, "val_precision": 0.5806, "val_recall": 0.8192, "val_f1": 0.6795, "val_f2": 0.757, "val_mcc": 0.3009, "val_accuracy": 0.6328, "val_per_window": [{"fold": "fold_1", "regime": "Pre-crisis upturn + GFC onset", "sharpe": 1.6617, "sortino": 2.8958, "return_pct": 4.18, "equity": 1041.85, "max_dd": 2.39, "win_rate": 45.37, "profit_factor": 1.317, "ic": 0.1605, "hit": 44.95, "n": 109, "precision": 0.4699, "recall": 0.7091, "f1": 0.5652, "f2": 0.6436, "mcc": -0.124, "accuracy": 0.4495, "tp": 39, "fp": 44, "tn": 10, "fn": 16, "aleatoric_mean": 1.2e-05, "epistemic_mean": 2.4e-05, "confidence_mean": 1.0, "aleatoric_std": 5e-06, "epistemic_std": 9e-06}, {"fold": "fold_2", "regime": "Post-crash recovery", "sharpe": 0.3282, "sortino": 0.5221, "return_pct": 1.33, "equity": 1013.27, "max_dd": 5.27, "win_rate": 50.0, "profit_factor": 1.053, "ic": 0.0792, "hit": 50.0, "n": 108, "precision": 0.5692, "recall": 0.5873, "f1": 0.5781, "f2": 0.5836, "mcc": -0.0352, "accuracy": 0.5, "tp": 37, "fp": 28, "tn": 17, "fn": 26, "aleatoric_mean": 1.6e-05, "epistemic_mean": 3.2e-05, "confidence_mean": 1.0, "aleatoric_std": 7e-06, "epistemic_std": 1.4e-05}, {"fold": "fold_3", "regime": "Eurozone debt plateau", "sharpe": 5.1327, "sortino": 10.3736, "return_pct": 21.62, "equity": 1216.17, "max_dd": 2.78, "win_rate": 56.88, "profit_factor": 2.312, "ic": 0.7541, "hit": 55.86, "n": 111, "precision": 0.4894, "recall": 0.9787, "f1": 0.6525, "f2": 0.8156, "mcc": 0.3138, "accuracy": 0.5586, "tp": 46, "fp": 48, "tn": 16, "fn": 1, "aleatoric_mean": 1e-05, "epistemic_mean": 2.1e-05, "confidence_mean": 1.0, "aleatoric_std": 4e-06, "epistemic_std": 8e-06}, {"fold": "fold_4", "regime": "Strong USD downturn", "sharpe": 9.9504, "sortino": 22.7011, "return_pct": 33.87, "equity": 1338.67, "max_dd": 0.63, "win_rate": 75.23, "profit_factor": 5.604, "ic": 0.7441, "hit": 74.55, "n": 110, "precision": 0.6515, "recall": 0.9149, "f1": 0.7611, "f2": 0.8465, "mcc": 0.5552, "accuracy": 0.7545, "tp": 43, "fp": 23, "tn": 40, "fn": 4, "aleatoric_mean": 1.3e-05, "epistemic_mean": 2.5e-05, "confidence_mean": 1.0, "aleatoric_std": 5e-06, "epistemic_std": 1e-05}, {"fold": "fold_5", "regime": "Low-vol plateau", "sharpe": 9.8388, "sortino": 27.8196, "return_pct": 32.04, "equity": 1320.39, "max_dd": 0.98, "win_rate": 70.54, "profit_factor": 5.551, "ic": 0.7587, "hit": 70.54, "n": 112, "precision": 0.6429, "recall": 0.8491, "f1": 0.7317, "f2": 0.7979, "mcc": 0.4386, "accuracy": 0.7054, "tp": 45, "fp": 25, "tn": 34, "fn": 8, "aleatoric_mean": 9e-06, "epistemic_mean": 1.9e-05, "confidence_mean": 1.0, "aleatoric_std": 4e-06, "epistemic_std": 8e-06}, {"fold": "fold_6", "regime": "EUR crisis downturn", "sharpe": 12.4784, "sortino": 45.6607, "return_pct": 25.12, "equity": 1251.18, "max_dd": 0.42, "win_rate": 77.57, "profit_factor": 10.444, "ic": 0.8464, "hit": 76.85, "n": 108, "precision": 0.6667, "recall": 0.9362, "f1": 0.7788, "f2": 0.8661, "mcc": 0.5853, "accuracy": 0.7685, "tp": 44, "fp": 22, "tn": 39, "fn": 3, "aleatoric_mean": 9e-06, "epistemic_mean": 1.8e-05, "confidence_mean": 1.0, "aleatoric_std": 3e-06, "epistemic_std": 6e-06}, {"fold": "fold_7", "regime": "Recent mixed/upturn", "sharpe": 9.3859, "sortino": 24.6632, "return_pct": 21.32, "equity": 1213.18, "max_dd": 0.98, "win_rate": 69.09, "profit_factor": 4.701, "ic": 0.638, "hit": 69.09, "n": 110, "precision": 0.6338, "recall": 0.8491, "f1": 0.7258, "f2": 0.7951, "mcc": 0.4104, "accuracy": 0.6909, "tp": 45, "fp": 26, "tn": 31, "fn": 8, "aleatoric_mean": 1.3e-05, "epistemic_mean": 2.7e-05, "confidence_mean": 1.0, "aleatoric_std": 5e-06, "epistemic_std": 1e-05}], "train_sharpe": 6.3631, "train_psr": 1.0, "train_equity": 1306465.88, "train_sortino": 15.572, "train_return_pct": 130546.59, "train_max_dd": 4.65, "train_win_rate": 72.04, "train_profit_factor": 4.636, "train_ic": 0.6691, "train_hit": 71.75, "train_precision": 0.6716, "train_recall": 0.8846, "train_f1": 0.7636, "train_f2": 0.8319, "train_mcc": 0.4564, "train_accuracy": 0.7183, "train_per_window": [{"fold": "all_train", "regime": "Training data", "sharpe": 6.3631, "sortino": 15.572, "return_pct": 130546.59, "equity": 1306465.88, "max_dd": 4.65, "win_rate": 72.04, "profit_factor": 4.636, "ic": 0.6691, "hit": 71.75, "n": 2478, "precision": 0.6716, "recall": 0.8846, "f1": 0.7636, "f2": 0.8319, "mcc": 0.4564, "accuracy": 0.7183, "tp": 1127, "fp": 551, "tn": 653, "fn": 147}], "experiment_num": 124, "status": "DISCARD"}
