{"backbone": "lightgbm", "description": "lgbm: Exp11 bagging_fraction=0.5", "config": {"seq_len": 10, "lr": 0.0003, "batch_size": 32, "epochs": 20, "weight_decay": 1e-05, "patience": 5, "grad_clip": 1.0, "warmup_epochs": 0, "huber_delta": 1.0, "head_dropout": 0.1, "seed": 42, "gbm_lr": 0.01, "bagging_fraction": 0.5, "het_loss": false}, "composite": 7.4744, "test_pos_folds": 6, "val_pos_folds": 6, "val_loss": 0.0, "elapsed_sec": 47.3, "timestamp": "2026-04-21T07:09:37", "sharpe": 7.6744, "psr": 1.0, "equity": 17628.72, "sortino": 7.803, "return_pct": 1662.87, "max_dd": 7.54, "win_rate": 77.61, "profit_factor": 4.528, "ic": 0.6523, "hit": 77.29, "precision": 0.7986, "recall": 0.7256, "f1": 0.7603, "f2": 0.7391, "mcc": 0.5495, "accuracy": 0.7739, "per_window": [{"fold": "fold_1", "regime": "Pre-crisis upturn + GFC onset", "sharpe": -0.3368, "sortino": -0.3982, "return_pct": -3.28, "equity": 967.25, "max_dd": 7.54, "win_rate": 45.1, "profit_factor": 0.924, "ic": 0.0386, "hit": 44.66, "n": 103, "precision": 0.4333, "recall": 0.2453, "f1": 0.3133, "f2": 0.2686, "mcc": -0.1042, "accuracy": 0.4466, "tp": 13, "fp": 17, "tn": 33, "fn": 40}, {"fold": "fold_2", "regime": "Post-crash recovery", "sharpe": 1.1426, "sortino": 1.9962, "return_pct": 5.34, "equity": 1053.37, "max_dd": 5.3, "win_rate": 53.27, "profit_factor": 1.196, "ic": -0.0225, "hit": 53.27, "n": 107, "precision": 0.5116, "recall": 0.4314, "f1": 0.4681, "f2": 0.4453, "mcc": 0.0574, "accuracy": 0.5327, "tp": 22, "fp": 21, "tn": 35, "fn": 29}, {"fold": "fold_3", "regime": "Eurozone debt plateau", "sharpe": 14.7169, "sortino": 23.9624, "return_pct": 46.47, "equity": 1464.67, "max_dd": 1.32, "win_rate": 84.62, "profit_factor": 12.076, "ic": 0.8145, "hit": 83.02, "n": 106, "precision": 0.8824, "recall": 0.7895, "f1": 0.8333, "f2": 0.8065, "mcc": 0.6656, "accuracy": 0.8302, "tp": 45, "fp": 6, "tn": 43, "fn": 12}, {"fold": "fold_4", "regime": "Strong USD downturn", "sharpe": 14.3805, "sortino": 32.3998, "return_pct": 128.15, "equity": 2281.47, "max_dd": 0.97, "win_rate": 89.82, "profit_factor": 18.057, "ic": 0.8654, "hit": 89.29, "n": 168, "precision": 0.9367, "recall": 0.8605, "f1": 0.897, "f2": 0.8747, "mcc": 0.8007, "accuracy": 0.8988, "tp": 74, "fp": 5, "tn": 77, "fn": 12}, {"fold": "fold_5", "regime": "Low-vol plateau", "sharpe": 15.4065, "sortino": 74.7485, "return_pct": 44.44, "equity": 1444.35, "max_dd": 0.23, "win_rate": 85.19, "profit_factor": 23.845, "ic": 0.9053, "hit": 85.19, "n": 162, "precision": 0.8421, "recall": 0.8421, "f1": 0.8421, "f2": 0.8421, "mcc": 0.7026, "accuracy": 0.8519, "tp": 64, "fp": 12, "tn": 74, "fn": 12}, {"fold": "fold_6", "regime": "EUR crisis downturn", "sharpe": 15.1128, "sortino": 59.8743, "return_pct": 98.65, "equity": 1986.54, "max_dd": 0.43, "win_rate": 81.82, "profit_factor": 16.289, "ic": 0.8581, "hit": 81.82, "n": 165, "precision": 0.8133, "recall": 0.7922, "f1": 0.8026, "f2": 0.7963, "mcc": 0.6343, "accuracy": 0.8182, "tp": 61, "fp": 14, "tn": 74, "fn": 16}, {"fold": "fold_7", "regime": "Recent mixed/upturn", "sharpe": 12.7621, "sortino": 17.4615, "return_pct": 80.46, "equity": 1804.58, "max_dd": 1.64, "win_rate": 85.19, "profit_factor": 11.51, "ic": 0.808, "hit": 85.19, "n": 162, "precision": 0.8434, "recall": 0.8642, "f1": 0.8537, "f2": 0.86, "mcc": 0.7039, "accuracy": 0.8519, "tp": 70, "fp": 13, "tn": 68, "fn": 11}], "val_sharpe": 7.8032, "val_psr": 1.0, "val_equity": 5227.89, "val_sortino": 9.7999, "val_return_pct": 422.79, "val_max_dd": 13.57, "val_win_rate": 75.36, "val_profit_factor": 3.897, "val_ic": 0.663, "val_hit": 74.87, "val_precision": 0.7157, "val_recall": 0.8, "val_f1": 0.7555, "val_f2": 0.7816, "val_mcc": 0.5125, "val_accuracy": 0.7539, "val_per_window": [{"fold": "fold_1", "regime": "Pre-crisis upturn + GFC onset", "sharpe": 1.0299, "sortino": 1.9156, "return_pct": 2.55, "equity": 1025.54, "max_dd": 3.65, "win_rate": 47.22, "profit_factor": 1.186, "ic": -0.0853, "hit": 46.79, "n": 109, "precision": 0.4835, "recall": 0.8, "f1": 0.6027, "f2": 0.7074, "mcc": -0.0948, "accuracy": 0.4679, "tp": 44, "fp": 47, "tn": 7, "fn": 11}, {"fold": "fold_2", "regime": "Post-crash recovery", "sharpe": -1.1339, "sortino": -1.7597, "return_pct": -5.6, "equity": 943.95, "max_dd": 13.57, "win_rate": 51.85, "profit_factor": 0.836, "ic": -0.0515, "hit": 51.85, "n": 108, "precision": 0.617, "recall": 0.4603, "f1": 0.5273, "f2": 0.4849, "mcc": 0.06, "accuracy": 0.5185, "tp": 29, "fp": 18, "tn": 27, "fn": 34}, {"fold": "fold_3", "regime": "Eurozone debt plateau", "sharpe": 14.9602, "sortino": 31.3563, "return_pct": 55.05, "equity": 1550.49, "max_dd": 0.7, "win_rate": 86.24, "profit_factor": 16.111, "ic": 0.8421, "hit": 84.68, "n": 111, "precision": 0.8077, "recall": 0.8936, "f1": 0.8485, "f2": 0.875, "mcc": 0.7301, "accuracy": 0.8649, "tp": 42, "fp": 10, "tn": 54, "fn": 5}, {"fold": "fold_4", "regime": "Strong USD downturn", "sharpe": 14.864, "sortino": 47.987, "return_pct": 45.61, "equity": 1456.1, "max_dd": 0.59, "win_rate": 87.16, "profit_factor": 18.452, "ic": 0.92, "hit": 86.36, "n": 110, "precision": 0.8367, "recall": 0.8723, "f1": 0.8542, "f2": 0.865, "mcc": 0.7419, "accuracy": 0.8727, "tp": 41, "fp": 8, "tn": 55, "fn": 6}, {"fold": "fold_5", "regime": "Low-vol plateau", "sharpe": 14.8573, "sortino": 66.7146, "return_pct": 43.46, "equity": 1434.57, "max_dd": 0.29, "win_rate": 83.93, "profit_factor": 19.224, "ic": 0.9173, "hit": 83.93, "n": 112, "precision": 0.807, "recall": 0.8679, "f1": 0.8364, "f2": 0.855, "mcc": 0.6806, "accuracy": 0.8393, "tp": 46, "fp": 11, "tn": 48, "fn": 7}, {"fold": "fold_6", "regime": "EUR crisis downturn", "sharpe": 15.3347, "sortino": 61.6284, "return_pct": 28.66, "equity": 1286.6, "max_dd": 0.25, "win_rate": 85.98, "profit_factor": 26.688, "ic": 0.9115, "hit": 85.19, "n": 108, "precision": 0.7963, "recall": 0.9149, "f1": 0.8515, "f2": 0.8884, "mcc": 0.7284, "accuracy": 0.8611, "tp": 43, "fp": 11, "tn": 50, "fn": 4}, {"fold": "fold_7", "regime": "Recent mixed/upturn", "sharpe": 14.8131, "sortino": 37.4999, "return_pct": 29.6, "equity": 1295.98, "max_dd": 0.5, "win_rate": 84.55, "profit_factor": 14.411, "ic": 0.88, "hit": 84.55, "n": 110, "precision": 0.8103, "recall": 0.8868, "f1": 0.8468, "f2": 0.8704, "mcc": 0.6944, "accuracy": 0.8455, "tp": 47, "fp": 11, "tn": 46, "fn": 6}], "train_sharpe": 10.5841, "train_psr": 1.0, "train_equity": 45895416.0, "train_sortino": 75.6039, "train_return_pct": 4589441.6, "train_max_dd": 0.51, "train_win_rate": 90.88, "train_profit_factor": 51.531, "train_ic": 0.9496, "train_hit": 90.52, "train_precision": 0.8966, "train_recall": 0.9254, "train_f1": 0.9108, "train_f2": 0.9195, "train_mcc": 0.8137, "train_accuracy": 0.9068, "train_per_window": [{"fold": "all_train", "regime": "Training data", "sharpe": 10.5841, "sortino": 75.6039, "return_pct": 4589441.6, "equity": 45895416.0, "max_dd": 0.51, "win_rate": 90.88, "profit_factor": 51.531, "ic": 0.9496, "hit": 90.52, "n": 2478, "precision": 0.8966, "recall": 0.9254, "f1": 0.9108, "f2": 0.9195, "mcc": 0.8137, "accuracy": 0.9068, "tp": 1179, "fp": 136, "tn": 1068, "fn": 95}], "experiment_num": 214, "status": "DISCARD"}
{"backbone": "lightgbm", "description": "lgbm: Exp12 reg_lambda=10 strong L2", "config": {"seq_len": 10, "lr": 0.0003, "batch_size": 32, "epochs": 20, "weight_decay": 1e-05, "patience": 5, "grad_clip": 1.0, "warmup_epochs": 0, "huber_delta": 1.0, "head_dropout": 0.1, "seed": 42, "gbm_lr": 0.01, "reg_lambda": 10.0, "het_loss": false}, "composite": 7.3983, "test_pos_folds": 6, "val_pos_folds": 6, "val_loss": 0.0, "elapsed_sec": 58.2, "timestamp": "2026-04-21T07:10:45", "sharpe": 7.5983, "psr": 1.0, "equity": 17222.79, "sortino": 7.6649, "return_pct": 1622.28, "max_dd": 8.24, "win_rate": 78.02, "profit_factor": 4.451, "ic": 0.653, "hit": 77.7, "precision": 0.7964, "recall": 0.7401, "f1": 0.7672, "f2": 0.7507, "mcc": 0.557, "accuracy": 0.778, "per_window": [{"fold": "fold_1", "regime": "Pre-crisis upturn + GFC onset", "sharpe": -0.6857, "sortino": -0.8046, "return_pct": -5.84, "equity": 941.61, "max_dd": 8.24, "win_rate": 46.08, "profit_factor": 0.85, "ic": 0.0197, "hit": 45.63, "n": 103, "precision": 0.4516, "recall": 0.2642, "f1": 0.3333, "f2": 0.2881, "mcc": -0.0826, "accuracy": 0.4563, "tp": 14, "fp": 17, "tn": 33, "fn": 39}, {"fold": "fold_2", "regime": "Post-crash recovery", "sharpe": 0.8577, "sortino": 1.5388, "return_pct": 3.92, "equity": 1039.15, "max_dd": 5.48, "win_rate": 50.47, "profit_factor": 1.144, "ic": 0.0056, "hit": 50.47, "n": 107, "precision": 0.4783, "recall": 0.4314, "f1": 0.4536, "f2": 0.44, "mcc": 0.0028, "accuracy": 0.5047, "tp": 22, "fp": 24, "tn": 32, "fn": 29}, {"fold": "fold_3", "regime": "Eurozone debt plateau", "sharpe": 15.1388, "sortino": 22.6727, "return_pct": 47.32, "equity": 1473.18, "max_dd": 1.32, "win_rate": 87.5, "profit_factor": 13.27, "ic": 0.8001, "hit": 85.85, "n": 106, "precision": 0.9038, "recall": 0.8246, "f1": 0.8624, "f2": 0.8393, "mcc": 0.7206, "accuracy": 0.8585, "tp": 47, "fp": 5, "tn": 44, "fn": 10}, {"fold": "fold_4", "regime": "Strong USD downturn", "sharpe": 15.1288, "sortino": 30.6764, "return_pct": 133.43, "equity": 2334.28, "max_dd": 0.97, "win_rate": 91.62, "profit_factor": 23.924, "ic": 0.8784, "hit": 91.07, "n": 168, "precision": 0.9286, "recall": 0.907, "f1": 0.9176, "f2": 0.9112, "mcc": 0.8336, "accuracy": 0.9167, "tp": 78, "fp": 6, "tn": 76, "fn": 8}, {"fold": "fold_5", "regime": "Low-vol plateau", "sharpe": 15.2328, "sortino": 67.6779, "return_pct": 44.12, "equity": 1441.24, "max_dd": 0.23, "win_rate": 85.19, "profit_factor": 22.288, "ic": 0.9073, "hit": 85.19, "n": 162, "precision": 0.8333, "recall": 0.8553, "f1": 0.8442, "f2": 0.8508, "mcc": 0.7032, "accuracy": 0.8519, "tp": 65, "fp": 13, "tn": 73, "fn": 11}, {"fold": "fold_6", "regime": "EUR crisis downturn", "sharpe": 14.3122, "sortino": 42.9471, "return_pct": 94.74, "equity": 1947.4, "max_dd": 0.87, "win_rate": 80.61, "profit_factor": 13.164, "ic": 0.8659, "hit": 80.61, "n": 165, "precision": 0.8082, "recall": 0.7662, "f1": 0.7867, "f2": 0.7743, "mcc": 0.6098, "accuracy": 0.8061, "tp": 59, "fp": 14, "tn": 74, "fn": 18}, {"fold": "fold_7", "regime": "Recent mixed/upturn", "sharpe": 13.1423, "sortino": 17.6405, "return_pct": 82.37, "equity": 1823.71, "max_dd": 1.64, "win_rate": 86.42, "profit_factor": 12.8, "ic": 0.8138, "hit": 86.42, "n": 162, "precision": 0.8554, "recall": 0.8765, "f1": 0.8659, "f2": 0.8722, "mcc": 0.7286, "accuracy": 0.8642, "tp": 71, "fp": 12, "tn": 69, "fn": 10}], "val_sharpe": 7.6072, "val_psr": 1.0, "val_equity": 5053.74, "val_sortino": 9.5222, "val_return_pct": 405.37, "val_max_dd": 14.12, "val_win_rate": 74.57, "val_profit_factor": 3.756, "val_ic": 0.654, "val_hit": 74.09, "val_precision": 0.7005, "val_recall": 0.8137, "val_f1": 0.7529, "val_f2": 0.7882, "val_mcc": 0.5007, "val_accuracy": 0.7461, "val_per_window": [{"fold": "fold_1", "regime": "Pre-crisis upturn + GFC onset", "sharpe": 0.5019, "sortino": 0.919, "return_pct": 1.2, "equity": 1012.0, "max_dd": 2.73, "win_rate": 43.52, "profit_factor": 1.087, "ic": -0.0783, "hit": 43.12, "n": 109, "precision": 0.4615, "recall": 0.7636, "f1": 0.5753, "f2": 0.6752, "mcc": -0.1936, "accuracy": 0.4312, "tp": 42, "fp": 49, "tn": 5, "fn": 13}, {"fold": "fold_2", "regime": "Post-crash recovery", "sharpe": -1.9966, "sortino": -3.072, "return_pct": -9.42, "equity": 905.79, "max_dd": 14.12, "win_rate": 46.3, "profit_factor": 0.73, "ic": -0.1408, "hit": 46.3, "n": 108, "precision": 0.541, "recall": 0.5238, "f1": 0.5323, "f2": 0.5272, "mcc": -0.0979, "accuracy": 0.463, "tp": 33, "fp": 28, "tn": 17, "fn": 30}, {"fold": "fold_3", "regime": "Eurozone debt plateau", "sharpe": 14.6115, "sortino": 30.9451, "return_pct": 54.19, "equity": 1541.95, "max_dd": 0.7, "win_rate": 85.32, "profit_factor": 14.629, "ic": 0.8519, "hit": 83.78, "n": 111, "precision": 0.7818, "recall": 0.9149, "f1": 0.8431, "f2": 0.8848, "mcc": 0.7188, "accuracy": 0.8559, "tp": 43, "fp": 12, "tn": 52, "fn": 4}, {"fold": "fold_4", "regime": "Strong USD downturn", "sharpe": 15.2924, "sortino": 51.7568, "return_pct": 46.44, "equity": 1464.39, "max_dd": 0.64, "win_rate": 86.24, "profit_factor": 21.394, "ic": 0.9261, "hit": 85.45, "n": 110, "precision": 0.8636, "recall": 0.8085, "f1": 0.8352, "f2": 0.819, "mcc": 0.7202, "accuracy": 0.8636, "tp": 38, "fp": 6, "tn": 57, "fn": 9}, {"fold": "fold_5", "regime": "Low-vol plateau", "sharpe": 15.4574, "sortino": 72.314, "return_pct": 44.55, "equity": 1445.49, "max_dd": 0.25, "win_rate": 85.71, "profit_factor": 23.991, "ic": 0.9166, "hit": 85.71, "n": 112, "precision": 0.8364, "recall": 0.8679, "f1": 0.8519, "f2": 0.8614, "mcc": 0.7145, "accuracy": 0.8571, "tp": 46, "fp": 9, "tn": 50, "fn": 7}, {"fold": "fold_6", "regime": "EUR crisis downturn", "sharpe": 15.2652, "sortino": 61.8658, "return_pct": 28.58, "equity": 1285.83, "max_dd": 0.25, "win_rate": 85.98, "profit_factor": 25.877, "ic": 0.9297, "hit": 85.19, "n": 108, "precision": 0.7857, "recall": 0.9362, "f1": 0.8544, "f2": 0.9016, "mcc": 0.7337, "accuracy": 0.8611, "tp": 44, "fp": 12, "tn": 49, "fn": 3}, {"fold": "fold_7", "regime": "Recent mixed/upturn", "sharpe": 16.3652, "sortino": 60.561, "return_pct": 31.37, "equity": 1313.65, "max_dd": 0.34, "win_rate": 88.18, "profit_factor": 22.684, "ic": 0.8829, "hit": 88.18, "n": 110, "precision": 0.8226, "recall": 0.9623, "f1": 0.887, "f2": 0.9307, "mcc": 0.7751, "accuracy": 0.8818, "tp": 51, "fp": 11, "tn": 46, "fn": 2}], "train_sharpe": 10.8666, "train_psr": 1.0, "train_equity": 55903548.0, "train_sortino": 111.0927, "train_return_pct": 5590254.8, "train_max_dd": 0.5, "train_win_rate": 93.23, "train_profit_factor": 96.488, "train_ic": 0.9691, "train_hit": 92.86, "train_precision": 0.9238, "train_recall": 0.9427, "train_f1": 0.9332, "train_f2": 0.9389, "train_mcc": 0.8612, "train_accuracy": 0.9306, "train_per_window": [{"fold": "all_train", "regime": "Training data", "sharpe": 10.8666, "sortino": 111.0927, "return_pct": 5590254.8, "equity": 55903548.0, "max_dd": 0.5, "win_rate": 93.23, "profit_factor": 96.488, "ic": 0.9691, "hit": 92.86, "n": 2478, "precision": 0.9238, "recall": 0.9427, "f1": 0.9332, "f2": 0.9389, "mcc": 0.8612, "accuracy": 0.9306, "tp": 1201, "fp": 99, "tn": 1105, "fn": 73}], "experiment_num": 215, "status": "DISCARD"}
{"backbone": "lightgbm", "description": "lgbm: Exp13 reg_alpha=1 L1", "config": {"seq_len": 10, "lr": 0.0003, "batch_size": 32, "epochs": 20, "weight_decay": 1e-05, "patience": 5, "grad_clip": 1.0, "warmup_epochs": 0, "huber_delta": 1.0, "head_dropout": 0.1, "seed": 42, "gbm_lr": 0.01, "reg_alpha": 1.0, "het_loss": false}, "composite": 6.9941, "test_pos_folds": 6, "val_pos_folds": 5, "val_loss": 0.0, "elapsed_sec": 11.3, "timestamp": "2026-04-21T07:11:06", "sharpe": 7.2941, "psr": 1.0, "equity": 15666.3, "sortino": 5.889, "return_pct": 1466.63, "max_dd": 16.64, "win_rate": 78.53, "profit_factor": 4.158, "ic": 0.6431, "hit": 78.21, "precision": 0.8, "recall": 0.7484, "f1": 0.7734, "f2": 0.7582, "mcc": 0.5671, "accuracy": 0.7831, "per_window": [{"fold": "fold_1", "regime": "Pre-crisis upturn + GFC onset", "sharpe": -2.2509, "sortino": -1.9717, "return_pct": -16.43, "equity": 835.73, "max_dd": 16.64, "win_rate": 49.02, "profit_factor": 0.584, "ic": -0.0189, "hit": 48.54, "n": 103, "precision": 0.5, "recall": 0.5283, "f1": 0.5138, "f2": 0.5224, "mcc": -0.0318, "accuracy": 0.4854, "tp": 28, "fp": 28, "tn": 22, "fn": 25}, {"fold": "fold_2", "regime": "Post-crash recovery", "sharpe": 0.9822, "sortino": 1.7039, "return_pct": 4.53, "equity": 1045.35, "max_dd": 4.41, "win_rate": 54.21, "profit_factor": 1.166, "ic": 0.0005, "hit": 54.21, "n": 107, "precision": 0.5238, "recall": 0.4314, "f1": 0.4731, "f2": 0.4472, "mcc": 0.0759, "accuracy": 0.5421, "tp": 22, "fp": 20, "tn": 36, "fn": 29}, {"fold": "fold_3", "regime": "Eurozone debt plateau", "sharpe": 15.3073, "sortino": 24.6357, "return_pct": 47.65, "equity": 1476.5, "max_dd": 1.32, "win_rate": 85.58, "profit_factor": 13.796, "ic": 0.8158, "hit": 83.96, "n": 106, "precision": 0.9, "recall": 0.7895, "f1": 0.8411, "f2": 0.8094, "mcc": 0.6866, "accuracy": 0.8396, "tp": 45, "fp": 5, "tn": 44, "fn": 12}, {"fold": "fold_4", "regime": "Strong USD downturn", "sharpe": 15.5655, "sortino": 47.9124, "return_pct": 136.4, "equity": 2363.95, "max_dd": 0.56, "win_rate": 90.42, "profit_factor": 29.023, "ic": 0.866, "hit": 89.88, "n": 168, "precision": 0.9375, "recall": 0.8721, "f1": 0.9036, "f2": 0.8844, "mcc": 0.8118, "accuracy": 0.9048, "tp": 75, "fp": 5, "tn": 77, "fn": 11}, {"fold": "fold_5", "regime": "Low-vol plateau", "sharpe": 15.7143, "sortino": 85.4999, "return_pct": 44.98, "equity": 1449.76, "max_dd": 0.23, "win_rate": 85.19, "profit_factor": 27.099, "ic": 0.9127, "hit": 85.19, "n": 162, "precision": 0.8514, "recall": 0.8289, "f1": 0.84, "f2": 0.8333, "mcc": 0.7023, "accuracy": 0.8519, "tp": 63, "fp": 11, "tn": 75, "fn": 13}, {"fold": "fold_6", "regime": "EUR crisis downturn", "sharpe": 14.613, "sortino": 43.2879, "return_pct": 96.24, "equity": 1962.36, "max_dd": 0.76, "win_rate": 81.21, "profit_factor": 14.222, "ic": 0.8483, "hit": 81.21, "n": 165, "precision": 0.8382, "recall": 0.7403, "f1": 0.7862, "f2": 0.758, "mcc": 0.6236, "accuracy": 0.8121, "tp": 57, "fp": 11, "tn": 77, "fn": 20}, {"fold": "fold_7", "regime": "Recent mixed/upturn", "sharpe": 12.788, "sortino": 15.1988, "return_pct": 80.59, "equity": 1805.89, "max_dd": 1.64, "win_rate": 87.04, "profit_factor": 11.592, "ic": 0.8298, "hit": 87.04, "n": 162, "precision": 0.875, "recall": 0.8642, "f1": 0.8696, "f2": 0.8663, "mcc": 0.7408, "accuracy": 0.8704, "tp": 70, "fp": 10, "tn": 71, "fn": 11}], "val_sharpe": 7.5474, "val_psr": 1.0, "val_equity": 5001.21, "val_sortino": 9.6027, "val_return_pct": 400.12, "val_max_dd": 14.89, "val_win_rate": 74.44, "val_profit_factor": 3.715, "val_ic": 0.5956, "val_hit": 73.96, "val_precision": 0.7297, "val_recall": 0.7397, "val_f1": 0.7347, "val_f2": 0.7377, "val_mcc": 0.4913, "val_accuracy": 0.7461, "val_per_window": [{"fold": "fold_1", "regime": "Pre-crisis upturn + GFC onset", "sharpe": -1.1995, "sortino": -1.9424, "return_pct": -3.05, "equity": 969.53, "max_dd": 6.04, "win_rate": 42.59, "profit_factor": 0.82, "ic": -0.0898, "hit": 42.2, "n": 109, "precision": 0.4407, "recall": 0.4727, "f1": 0.4561, "f2": 0.4659, "mcc": -0.1389, "accuracy": 0.4312, "tp": 26, "fp": 33, "tn": 21, "fn": 29}, {"fold": "fold_2", "regime": "Post-crash recovery", "sharpe": -1.5176, "sortino": -2.3704, "return_pct": -7.33, "equity": 926.71, "max_dd": 14.89, "win_rate": 43.52, "profit_factor": 0.787, "ic": -0.108, "hit": 43.52, "n": 108, "precision": 0.5172, "recall": 0.4762, "f1": 0.4959, "f2": 0.4839, "mcc": -0.1444, "accuracy": 0.4352, "tp": 30, "fp": 28, "tn": 17, "fn": 33}, {"fold": "fold_3", "regime": "Eurozone debt plateau", "sharpe": 14.8328, "sortino": 30.8187, "return_pct": 54.74, "equity": 1547.4, "max_dd": 0.7, "win_rate": 87.16, "profit_factor": 15.543, "ic": 0.823, "hit": 85.59, "n": 111, "precision": 0.8113, "recall": 0.9149, "f1": 0.86, "f2": 0.8921, "mcc": 0.7505, "accuracy": 0.8739, "tp": 43, "fp": 10, "tn": 54, "fn": 4}, {"fold": "fold_4", "regime": "Strong USD downturn", "sharpe": 16.316, "sortino": 56.7221, "return_pct": 48.31, "equity": 1483.05, "max_dd": 0.64, "win_rate": 88.99, "profit_factor": 32.798, "ic": 0.9038, "hit": 88.18, "n": 110, "precision": 0.907, "recall": 0.8298, "f1": 0.8667, "f2": 0.8442, "mcc": 0.7769, "accuracy": 0.8909, "tp": 39, "fp": 4, "tn": 59, "fn": 8}, {"fold": "fold_5", "regime": "Low-vol plateau", "sharpe": 15.498, "sortino": 72.0102, "return_pct": 44.62, "equity": 1446.21, "max_dd": 0.25, "win_rate": 85.71, "profit_factor": 24.384, "ic": 0.9148, "hit": 85.71, "n": 112, "precision": 0.8491, "recall": 0.8491, "f1": 0.8491, "f2": 0.8491, "mcc": 0.7135, "accuracy": 0.8571, "tp": 45, "fp": 8, "tn": 51, "fn": 8}, {"fold": "fold_6", "regime": "EUR crisis downturn", "sharpe": 15.1711, "sortino": 62.1128, "return_pct": 28.48, "equity": 1284.79, "max_dd": 0.25, "win_rate": 86.92, "profit_factor": 24.842, "ic": 0.9183, "hit": 86.11, "n": 108, "precision": 0.8235, "recall": 0.8936, "f1": 0.8571, "f2": 0.8787, "mcc": 0.7409, "accuracy": 0.8704, "tp": 42, "fp": 9, "tn": 52, "fn": 5}, {"fold": "fold_7", "regime": "Recent mixed/upturn", "sharpe": 15.6153, "sortino": 38.0056, "return_pct": 30.54, "equity": 1305.41, "max_dd": 0.5, "win_rate": 85.45, "profit_factor": 17.954, "ic": 0.8884, "hit": 85.45, "n": 110, "precision": 0.8491, "recall": 0.8491, "f1": 0.8491, "f2": 0.8491, "mcc": 0.7087, "accuracy": 0.8545, "tp": 45, "fp": 8, "tn": 49, "fn": 8}], "train_sharpe": 5.6234, "train_psr": 1.0, "train_equity": 617730.88, "train_sortino": 4.0517, "train_return_pct": 61673.09, "train_max_dd": 41.9, "train_win_rate": 76.3, "train_profit_factor": 3.751, "train_ic": 0.6329, "train_hit": 75.99, "train_precision": 0.7764, "train_recall": 0.7551, "train_f1": 0.7656, "train_f2": 0.7593, "train_mcc": 0.5248, "train_accuracy": 0.7623, "train_per_window": [{"fold": "all_train", "regime": "Training data", "sharpe": 5.6234, "sortino": 4.0517, "return_pct": 61673.09, "equity": 617730.88, "max_dd": 41.9, "win_rate": 76.3, "profit_factor": 3.751, "ic": 0.6329, "hit": 75.99, "n": 2478, "precision": 0.7764, "recall": 0.7551, "f1": 0.7656, "f2": 0.7593, "mcc": 0.5248, "accuracy": 0.7623, "tp": 962, "fp": 277, "tn": 927, "fn": 312}], "experiment_num": 216, "status": "DISCARD"}
