{"backbone": "lstm", "description": "lstm: Exp1 SOTA baseline lr=1e-3 (Fischer&Krauss2018) seed=0", "config": {"seq_len": 10, "lr": 0.001, "batch_size": 32, "epochs": 50, "weight_decay": 1e-05, "patience": 10, "grad_clip": 1.0, "warmup_epochs": 0, "huber_delta": 1.0, "head_dropout": 0.15, "seed": 0, "het_loss": false}, "composite": 4.1198, "test_pos_folds": 6, "val_pos_folds": 6, "val_loss": 2.9e-05, "elapsed_sec": 27.4, "timestamp": "2026-04-19T17:52:06", "sharpe": 4.3198, "psr": 1.0, "equity": 5596.32, "sortino": 5.2915, "return_pct": 459.63, "max_dd": 10.24, "win_rate": 66.05, "profit_factor": 2.252, "ic": 0.493, "hit": 65.78, "aleatoric_mean": 1.5e-05, "epistemic_mean": 3.1e-05, "confidence_mean": 1.0, "precision": 0.7404, "recall": 0.4802, "f1": 0.5826, "f2": 0.5165, "mcc": 0.3381, "accuracy": 0.6598, "per_window": [{"fold": "fold_1", "regime": "Pre-crisis upturn + GFC onset", "sharpe": 0.1034, "sortino": 0.1169, "return_pct": 0.06, "equity": 1000.65, "max_dd": 7.54, "win_rate": 50.0, "profit_factor": 1.025, "ic": 0.0571, "hit": 49.51, "n": 103, "precision": 0.5111, "recall": 0.434, "f1": 0.4694, "f2": 0.4475, "mcc": -0.0061, "accuracy": 0.4951, "tp": 23, "fp": 22, "tn": 28, "fn": 30, "aleatoric_mean": 3e-05, "epistemic_mean": 6e-05, "confidence_mean": 0.9999, "aleatoric_std": 2.4e-05, "epistemic_std": 4.8e-05}, {"fold": "fold_2", "regime": "Post-crash recovery", "sharpe": -1.7641, "sortino": -3.1686, "return_pct": -8.32, "equity": 916.79, "max_dd": 8.38, "win_rate": 49.53, "profit_factor": 0.758, "ic": 0.0358, "hit": 49.53, "n": 107, "precision": 0.4746, "recall": 0.549, "f1": 0.5091, "f2": 0.5323, "mcc": -0.0046, "accuracy": 0.4953, "tp": 28, "fp": 31, "tn": 25, "fn": 23, "aleatoric_mean": 1.8e-05, "epistemic_mean": 3.6e-05, "confidence_mean": 0.9999, "aleatoric_std": 9e-06, "epistemic_std": 1.8e-05}, {"fold": "fold_3", "regime": "Eurozone debt plateau", "sharpe": 10.6566, "sortino": 18.6696, "return_pct": 36.7, "equity": 1366.97, "max_dd": 1.73, "win_rate": 77.88, "profit_factor": 5.545, "ic": 0.7011, "hit": 76.42, "n": 106, "precision": 0.8235, "recall": 0.7368, "f1": 0.7778, "f2": 0.7527, "mcc": 0.552, "accuracy": 0.7736, "tp": 42, "fp": 9, "tn": 40, "fn": 15, "aleatoric_mean": 1.6e-05, "epistemic_mean": 3.2e-05, "confidence_mean": 1.0, "aleatoric_std": 6e-06, "epistemic_std": 1.3e-05}, {"fold": "fold_4", "regime": "Strong USD downturn", "sharpe": 6.662, "sortino": 10.6435, "return_pct": 60.56, "equity": 1605.59, "max_dd": 4.83, "win_rate": 69.46, "profit_factor": 3.131, "ic": 0.7003, "hit": 69.05, "n": 168, "precision": 0.9487, "recall": 0.4302, "f1": 0.592, "f2": 0.483, "mcc": 0.4805, "accuracy": 0.6964, "tp": 37, "fp": 2, "tn": 80, "fn": 49, "aleatoric_mean": 1.3e-05, "epistemic_mean": 2.6e-05, "confidence_mean": 1.0, "aleatoric_std": 5e-06, "epistemic_std": 1.1e-05}, {"fold": "fold_5", "regime": "Low-vol plateau", "sharpe": 8.8464, "sortino": 22.8916, "return_pct": 29.27, "equity": 1292.68, "max_dd": 0.63, "win_rate": 70.37, "profit_factor": 4.597, "ic": 0.7138, "hit": 70.37, "n": 162, "precision": 0.9375, "recall": 0.3947, "f1": 0.5556, "f2": 0.4464, "mcc": 0.4656, "accuracy": 0.7037, "tp": 30, "fp": 2, "tn": 84, "fn": 46, "aleatoric_mean": 9e-06, "epistemic_mean": 1.8e-05, "confidence_mean": 1.0, "aleatoric_std": 4e-06, "epistemic_std": 8e-06}, {"fold": "fold_6", "regime": "EUR crisis downturn", "sharpe": 8.6418, "sortino": 18.85, "return_pct": 60.81, "equity": 1608.07, "max_dd": 2.31, "win_rate": 70.3, "profit_factor": 4.171, "ic": 0.6676, "hit": 70.3, "n": 165, "precision": 0.85, "recall": 0.4416, "f1": 0.5812, "f2": 0.4885, "mcc": 0.4347, "accuracy": 0.703, "tp": 34, "fp": 6, "tn": 82, "fn": 43, "aleatoric_mean": 1.5e-05, "epistemic_mean": 3.1e-05, "confidence_mean": 1.0, "aleatoric_std": 7e-06, "epistemic_std": 1.4e-05}, {"fold": "fold_7", "regime": "Recent mixed/upturn", "sharpe": 5.1726, "sortino": 8.0933, "return_pct": 33.71, "equity": 1337.09, "max_dd": 1.7, "win_rate": 67.28, "profit_factor": 2.421, "ic": 0.6236, "hit": 67.28, "n": 162, "precision": 0.8043, "recall": 0.4568, "f1": 0.5827, "f2": 0.5, "mcc": 0.3833, "accuracy": 0.6728, "tp": 37, "fp": 9, "tn": 72, "fn": 44, "aleatoric_mean": 1.3e-05, "epistemic_mean": 2.6e-05, "confidence_mean": 1.0, "aleatoric_std": 5e-06, "epistemic_std": 1e-05}], "val_sharpe": 5.0833, "val_psr": 1.0, "val_equity": 3128.57, "val_sortino": 7.8218, "val_return_pct": 212.86, "val_max_dd": 7.98, "val_win_rate": 64.09, "val_profit_factor": 2.384, "val_ic": 0.4763, "val_hit": 63.67, "val_aleatoric_mean": 1.1e-05, "val_epistemic_mean": 2.2e-05, "val_confidence_mean": 1.0, "val_precision": 0.6745, "val_recall": 0.4712, "val_f1": 0.5548, "val_f2": 0.5015, "val_mcc": 0.2813, "val_accuracy": 0.6406, "val_per_window": [{"fold": "fold_1", "regime": "Pre-crisis upturn + GFC onset", "sharpe": 0.5257, "sortino": 0.7895, "return_pct": 1.26, "equity": 1012.61, "max_dd": 2.47, "win_rate": 53.7, "profit_factor": 1.091, "ic": 0.0853, "hit": 53.21, "n": 109, "precision": 0.5476, "recall": 0.4182, "f1": 0.4742, "f2": 0.4389, "mcc": 0.0681, "accuracy": 0.5321, "tp": 23, "fp": 19, "tn": 35, "fn": 32, "aleatoric_mean": 1.1e-05, "epistemic_mean": 2.2e-05, "confidence_mean": 1.0, "aleatoric_std": 5e-06, "epistemic_std": 1e-05}, {"fold": "fold_2", "regime": "Post-crash recovery", "sharpe": -0.4184, "sortino": -0.6441, "return_pct": -2.28, "equity": 977.2, "max_dd": 7.98, "win_rate": 47.22, "profit_factor": 0.936, "ic": 0.0579, "hit": 47.22, "n": 108, "precision": 0.55, "recall": 0.5238, "f1": 0.5366, "f2": 0.5288, "mcc": -0.0756, "accuracy": 0.4722, "tp": 33, "fp": 27, "tn": 18, "fn": 30, "aleatoric_mean": 1.5e-05, "epistemic_mean": 3e-05, "confidence_mean": 1.0, "aleatoric_std": 8e-06, "epistemic_std": 1.5e-05}, {"fold": "fold_3", "regime": "Eurozone debt plateau", "sharpe": 9.7609, "sortino": 23.8462, "return_pct": 39.73, "equity": 1397.25, "max_dd": 0.78, "win_rate": 73.39, "profit_factor": 5.143, "ic": 0.7213, "hit": 72.07, "n": 111, "precision": 0.6232, "recall": 0.9149, "f1": 0.7414, "f2": 0.8366, "mcc": 0.5182, "accuracy": 0.7297, "tp": 43, "fp": 26, "tn": 38, "fn": 4, "aleatoric_mean": 1.1e-05, "epistemic_mean": 2.3e-05, "confidence_mean": 1.0, "aleatoric_std": 5e-06, "epistemic_std": 9e-06}, {"fold": "fold_4", "regime": "Strong USD downturn", "sharpe": 10.0333, "sortino": 24.0544, "return_pct": 34.1, "equity": 1341.01, "max_dd": 1.28, "win_rate": 75.23, "profit_factor": 5.696, "ic": 0.7641, "hit": 74.55, "n": 110, "precision": 1.0, "recall": 0.4255, "f1": 0.597, "f2": 0.4808, "mcc": 0.5458, "accuracy": 0.7545, "tp": 20, "fp": 0, "tn": 63, "fn": 27, "aleatoric_mean": 1.1e-05, "epistemic_mean": 2.1e-05, "confidence_mean": 1.0, "aleatoric_std": 5e-06, "epistemic_std": 9e-06}, {"fold": "fold_5", "regime": "Low-vol plateau", "sharpe": 7.4509, "sortino": 16.4911, "return_pct": 25.1, "equity": 1250.96, "max_dd": 1.69, "win_rate": 66.07, "profit_factor": 3.549, "ic": 0.7463, "hit": 66.07, "n": 112, "precision": 0.9412, "recall": 0.3019, "f1": 0.4571, "f2": 0.3493, "mcc": 0.3965, "accuracy": 0.6607, "tp": 16, "fp": 1, "tn": 58, "fn": 37, "aleatoric_mean": 9e-06, "epistemic_mean": 1.7e-05, "confidence_mean": 1.0, "aleatoric_std": 3e-06, "epistemic_std": 7e-06}, {"fold": "fold_6", "regime": "EUR crisis downturn", "sharpe": 7.9537, "sortino": 16.8445, "return_pct": 17.62, "equity": 1176.17, "max_dd": 1.39, "win_rate": 68.22, "profit_factor": 3.977, "ic": 0.8164, "hit": 67.59, "n": 108, "precision": 0.8824, "recall": 0.3191, "f1": 0.4688, "f2": 0.3659, "mcc": 0.3898, "accuracy": 0.6852, "tp": 15, "fp": 2, "tn": 59, "fn": 32, "aleatoric_mean": 8e-06, "epistemic_mean": 1.6e-05, "confidence_mean": 1.0, "aleatoric_std": 3e-06, "epistemic_std": 6e-06}, {"fold": "fold_7", "regime": "Recent mixed/upturn", "sharpe": 6.1516, "sortino": 13.5193, "return_pct": 14.68, "equity": 1146.83, "max_dd": 1.85, "win_rate": 64.55, "profit_factor": 2.71, "ic": 0.5407, "hit": 64.55, "n": 110, "precision": 0.7333, "recall": 0.4151, "f1": 0.5301, "f2": 0.4545, "mcc": 0.3082, "accuracy": 0.6455, "tp": 22, "fp": 8, "tn": 49, "fn": 31, "aleatoric_mean": 1.1e-05, "epistemic_mean": 2.3e-05, "confidence_mean": 1.0, "aleatoric_std": 4e-06, "epistemic_std": 9e-06}], "train_sharpe": 6.1765, "train_psr": 1.0, "train_equity": 1086572.5, "train_sortino": 17.4705, "train_return_pct": 108557.25, "train_max_dd": 5.6, "train_win_rate": 70.02, "train_profit_factor": 4.387, "train_ic": 0.6468, "train_hit": 69.73, "train_precision": 0.8138, "train_recall": 0.5385, "train_f1": 0.6481, "train_f2": 0.5775, "train_mcc": 0.4305, "train_accuracy": 0.6994, "train_per_window": [{"fold": "all_train", "regime": "Training data", "sharpe": 6.1765, "sortino": 17.4705, "return_pct": 108557.25, "equity": 1086572.5, "max_dd": 5.6, "win_rate": 70.02, "profit_factor": 4.387, "ic": 0.6468, "hit": 69.73, "n": 2478, "precision": 0.8138, "recall": 0.5385, "f1": 0.6481, "f2": 0.5775, "mcc": 0.4305, "accuracy": 0.6994, "tp": 686, "fp": 157, "tn": 1047, "fn": 588}], "experiment_num": 105, "status": "KEEP"}
{"backbone": "lstm", "description": "lstm: Exp2 GPU huber=0.5 robust fat tails (Huber1964) seed=0", "config": {"seq_len": 10, "lr": 0.001, "batch_size": 32, "epochs": 50, "weight_decay": 1e-05, "patience": 10, "grad_clip": 1.0, "warmup_epochs": 0, "huber_delta": 0.5, "head_dropout": 0.15, "seed": 0, "het_loss": false}, "composite": 3.9847, "test_pos_folds": 6, "val_pos_folds": 6, "val_loss": 2.9e-05, "elapsed_sec": 26.8, "timestamp": "2026-04-19T17:54:43", "sharpe": 4.1847, "psr": 1.0, "equity": 5318.09, "sortino": 5.1806, "return_pct": 431.81, "max_dd": 9.12, "win_rate": 65.22, "profit_factor": 2.194, "ic": 0.494, "hit": 64.95, "aleatoric_mean": 1.6e-05, "epistemic_mean": 3.1e-05, "confidence_mean": 1.0, "precision": 0.7432, "recall": 0.4511, "f1": 0.5614, "f2": 0.4896, "mcc": 0.3259, "accuracy": 0.6516, "per_window": [{"fold": "fold_1", "regime": "Pre-crisis upturn + GFC onset", "sharpe": 0.1945, "sortino": 0.2178, "return_pct": 0.77, "equity": 1007.7, "max_dd": 7.54, "win_rate": 50.98, "profit_factor": 1.047, "ic": 0.054, "hit": 50.49, "n": 103, "precision": 0.5227, "recall": 0.434, "f1": 0.4742, "f2": 0.4492, "mcc": 0.0141, "accuracy": 0.5049, "tp": 23, "fp": 21, "tn": 29, "fn": 30, "aleatoric_mean": 3e-05, "epistemic_mean": 6e-05, "confidence_mean": 0.9999, "aleatoric_std": 2.4e-05, "epistemic_std": 4.8e-05}, {"fold": "fold_2", "regime": "Post-crash recovery", "sharpe": -1.6511, "sortino": -2.9663, "return_pct": -7.83, "equity": 921.69, "max_dd": 7.89, "win_rate": 50.47, "profit_factor": 0.772, "ic": 0.0422, "hit": 50.47, "n": 107, "precision": 0.4833, "recall": 0.5686, "f1": 0.5225, "f2": 0.5492, "mcc": 0.0152, "accuracy": 0.5047, "tp": 29, "fp": 31, "tn": 25, "fn": 22, "aleatoric_mean": 1.8e-05, "epistemic_mean": 3.7e-05, "confidence_mean": 0.9999, "aleatoric_std": 9e-06, "epistemic_std": 1.8e-05}, {"fold": "fold_3", "regime": "Eurozone debt plateau", "sharpe": 10.6812, "sortino": 18.4896, "return_pct": 36.77, "equity": 1367.66, "max_dd": 1.73, "win_rate": 76.92, "profit_factor": 5.569, "ic": 0.7032, "hit": 75.47, "n": 106, "precision": 0.8333, "recall": 0.7018, "f1": 0.7619, "f2": 0.7246, "mcc": 0.5394, "accuracy": 0.7642, "tp": 40, "fp": 8, "tn": 41, "fn": 17, "aleatoric_mean": 1.6e-05, "epistemic_mean": 3.2e-05, "confidence_mean": 1.0, "aleatoric_std": 6e-06, "epistemic_std": 1.2e-05}, {"fold": "fold_4", "regime": "Strong USD downturn", "sharpe": 6.1638, "sortino": 10.1344, "return_pct": 55.67, "equity": 1556.74, "max_dd": 4.83, "win_rate": 67.07, "profit_factor": 2.865, "ic": 0.7031, "hit": 66.67, "n": 168, "precision": 0.9429, "recall": 0.3837, "f1": 0.5455, "f2": 0.4354, "mcc": 0.4423, "accuracy": 0.6726, "tp": 33, "fp": 2, "tn": 80, "fn": 53, "aleatoric_mean": 1.3e-05, "epistemic_mean": 2.7e-05, "confidence_mean": 1.0, "aleatoric_std": 5e-06, "epistemic_std": 1.1e-05}, {"fold": "fold_5", "regime": "Low-vol plateau", "sharpe": 8.8673, "sortino": 22.8867, "return_pct": 29.33, "equity": 1293.28, "max_dd": 0.63, "win_rate": 70.99, "profit_factor": 4.616, "ic": 0.7225, "hit": 70.99, "n": 162, "precision": 1.0, "recall": 0.3816, "f1": 0.5524, "f2": 0.4354, "mcc": 0.4967, "accuracy": 0.7099, "tp": 29, "fp": 0, "tn": 86, "fn": 47, "aleatoric_mean": 9e-06, "epistemic_mean": 1.9e-05, "confidence_mean": 1.0, "aleatoric_std": 4e-06, "epistemic_std": 8e-06}, {"fold": "fold_6", "regime": "EUR crisis downturn", "sharpe": 8.3755, "sortino": 18.6586, "return_pct": 58.97, "equity": 1589.71, "max_dd": 2.31, "win_rate": 68.48, "profit_factor": 3.981, "ic": 0.664, "hit": 68.48, "n": 165, "precision": 0.8378, "recall": 0.4026, "f1": 0.5439, "f2": 0.4493, "mcc": 0.4, "accuracy": 0.6848, "tp": 31, "fp": 6, "tn": 82, "fn": 46, "aleatoric_mean": 1.6e-05, "epistemic_mean": 3.1e-05, "confidence_mean": 1.0, "aleatoric_std": 7e-06, "epistemic_std": 1.3e-05}, {"fold": "fold_7", "regime": "Recent mixed/upturn", "sharpe": 4.7496, "sortino": 7.6559, "return_pct": 30.81, "equity": 1308.09, "max_dd": 2.22, "win_rate": 65.43, "profit_factor": 2.249, "ic": 0.6315, "hit": 65.43, "n": 162, "precision": 0.8205, "recall": 0.3951, "f1": 0.5333, "f2": 0.4408, "mcc": 0.361, "accuracy": 0.6543, "tp": 32, "fp": 7, "tn": 74, "fn": 49, "aleatoric_mean": 1.3e-05, "epistemic_mean": 2.6e-05, "confidence_mean": 1.0, "aleatoric_std": 5e-06, "epistemic_std": 1e-05}], "val_sharpe": 5.1657, "val_psr": 1.0, "val_equity": 3181.8, "val_sortino": 7.9356, "val_return_pct": 218.18, "val_max_dd": 7.98, "val_win_rate": 64.88, "val_profit_factor": 2.418, "val_ic": 0.4806, "val_hit": 64.45, "val_aleatoric_mean": 1.1e-05, "val_epistemic_mean": 2.2e-05, "val_confidence_mean": 1.0, "val_precision": 0.7056, "val_recall": 0.4466, "val_f1": 0.547, "val_f2": 0.482, "val_mcc": 0.3026, "val_accuracy": 0.6484, "val_per_window": [{"fold": "fold_1", "regime": "Pre-crisis upturn + GFC onset", "sharpe": 0.7246, "sortino": 1.0562, "return_pct": 1.77, "equity": 1017.69, "max_dd": 3.01, "win_rate": 54.63, "profit_factor": 1.128, "ic": 0.0846, "hit": 54.13, "n": 109, "precision": 0.5676, "recall": 0.3818, "f1": 0.4565, "f2": 0.4086, "mcc": 0.0903, "accuracy": 0.5413, "tp": 21, "fp": 16, "tn": 38, "fn": 34, "aleatoric_mean": 1.1e-05, "epistemic_mean": 2.2e-05, "confidence_mean": 1.0, "aleatoric_std": 5e-06, "epistemic_std": 1e-05}, {"fold": "fold_2", "regime": "Post-crash recovery", "sharpe": -0.3306, "sortino": -0.5144, "return_pct": -1.86, "equity": 981.37, "max_dd": 7.98, "win_rate": 49.07, "profit_factor": 0.949, "ic": 0.061, "hit": 49.07, "n": 108, "precision": 0.5741, "recall": 0.4921, "f1": 0.5299, "f2": 0.5065, "mcc": -0.0188, "accuracy": 0.4907, "tp": 31, "fp": 23, "tn": 22, "fn": 32, "aleatoric_mean": 1.5e-05, "epistemic_mean": 2.9e-05, "confidence_mean": 1.0, "aleatoric_std": 7e-06, "epistemic_std": 1.5e-05}, {"fold": "fold_3", "regime": "Eurozone debt plateau", "sharpe": 11.3146, "sortino": 27.5942, "return_pct": 44.9, "equity": 1448.99, "max_dd": 0.78, "win_rate": 78.9, "profit_factor": 6.916, "ic": 0.7262, "hit": 77.48, "n": 111, "precision": 0.6825, "recall": 0.9149, "f1": 0.7818, "f2": 0.8566, "mcc": 0.6008, "accuracy": 0.7838, "tp": 43, "fp": 20, "tn": 44, "fn": 4, "aleatoric_mean": 1.2e-05, "epistemic_mean": 2.3e-05, "confidence_mean": 1.0, "aleatoric_std": 5e-06, "epistemic_std": 1e-05}, {"fold": "fold_4", "regime": "Strong USD downturn", "sharpe": 9.0614, "sortino": 21.9702, "return_pct": 31.28, "equity": 1312.8, "max_dd": 1.59, "win_rate": 72.48, "profit_factor": 4.726, "ic": 0.7596, "hit": 71.82, "n": 110, "precision": 1.0, "recall": 0.3617, "f1": 0.5312, "f2": 0.4146, "mcc": 0.495, "accuracy": 0.7273, "tp": 17, "fp": 0, "tn": 63, "fn": 30, "aleatoric_mean": 1.1e-05, "epistemic_mean": 2.2e-05, "confidence_mean": 1.0, "aleatoric_std": 4e-06, "epistemic_std": 9e-06}, {"fold": "fold_5", "regime": "Low-vol plateau", "sharpe": 7.2204, "sortino": 16.2627, "return_pct": 24.38, "equity": 1243.78, "max_dd": 1.69, "win_rate": 65.18, "profit_factor": 3.405, "ic": 0.7474, "hit": 65.18, "n": 112, "precision": 0.9375, "recall": 0.283, "f1": 0.4348, "f2": 0.3289, "mcc": 0.3796, "accuracy": 0.6518, "tp": 15, "fp": 1, "tn": 58, "fn": 38, "aleatoric_mean": 9e-06, "epistemic_mean": 1.8e-05, "confidence_mean": 1.0, "aleatoric_std": 3e-06, "epistemic_std": 7e-06}, {"fold": "fold_6", "regime": "EUR crisis downturn", "sharpe": 7.6988, "sortino": 16.6194, "return_pct": 17.12, "equity": 1171.22, "max_dd": 1.39, "win_rate": 67.29, "profit_factor": 3.793, "ic": 0.8233, "hit": 66.67, "n": 108, "precision": 0.875, "recall": 0.2979, "f1": 0.4444, "f2": 0.3431, "mcc": 0.37, "accuracy": 0.6759, "tp": 14, "fp": 2, "tn": 59, "fn": 33, "aleatoric_mean": 8e-06, "epistemic_mean": 1.7e-05, "confidence_mean": 1.0, "aleatoric_std": 3e-06, "epistemic_std": 6e-06}, {"fold": "fold_7", "regime": "Recent mixed/upturn", "sharpe": 6.2793, "sortino": 13.7702, "return_pct": 14.97, "equity": 1149.68, "max_dd": 1.85, "win_rate": 66.36, "profit_factor": 2.768, "ic": 0.5446, "hit": 66.36, "n": 110, "precision": 0.7857, "recall": 0.4151, "f1": 0.5432, "f2": 0.4583, "mcc": 0.3554, "accuracy": 0.6636, "tp": 22, "fp": 6, "tn": 51, "fn": 31, "aleatoric_mean": 1.2e-05, "epistemic_mean": 2.3e-05, "confidence_mean": 1.0, "aleatoric_std": 4e-06, "epistemic_std": 9e-06}], "train_sharpe": 5.9376, "train_psr": 1.0, "train_equity": 855551.56, "train_sortino": 16.832, "train_return_pct": 85455.16, "train_max_dd": 5.46, "train_win_rate": 68.76, "train_profit_factor": 4.095, "train_ic": 0.6508, "train_hit": 68.48, "train_precision": 0.8298, "train_recall": 0.4937, "train_f1": 0.6191, "train_f2": 0.5372, "train_mcc": 0.4193, "train_accuracy": 0.6877, "train_per_window": [{"fold": "all_train", "regime": "Training data", "sharpe": 5.9376, "sortino": 16.832, "return_pct": 85455.16, "equity": 855551.56, "max_dd": 5.46, "win_rate": 68.76, "profit_factor": 4.095, "ic": 0.6508, "hit": 68.48, "n": 2478, "precision": 0.8298, "recall": 0.4937, "f1": 0.6191, "f2": 0.5372, "mcc": 0.4193, "accuracy": 0.6877, "tp": 629, "fp": 129, "tn": 1075, "fn": 645}], "experiment_num": 106, "status": "DISCARD"}
