{"backbone": "catboost", "description": "catboost: Exp2 depth=4 (mirror XGB winning depth)", "config": {"seq_len": 10, "lr": 0.0003, "batch_size": 32, "epochs": 20, "weight_decay": 1e-05, "patience": 5, "grad_clip": 1.0, "warmup_epochs": 0, "huber_delta": 1.0, "head_dropout": 0.1, "seed": 42, "depth": 4, "het_loss": false}, "composite": 7.3519, "test_pos_folds": 6, "val_pos_folds": 6, "val_loss": 0.0, "elapsed_sec": 256.8, "timestamp": "2026-04-21T08:36:42", "sharpe": 7.8494, "psr": 1.0, "equity": 18590.6, "sortino": 7.6857, "return_pct": 1759.06, "max_dd": 7.69, "win_rate": 79.05, "profit_factor": 4.713, "ic": 0.6926, "hit": 78.73, "precision": 0.804, "recall": 0.7588, "f1": 0.7807, "f2": 0.7675, "mcc": 0.5792, "accuracy": 0.7893, "per_window": [{"fold": "fold_1", "regime": "Pre-crisis upturn + GFC onset", "sharpe": 0.4009, "sortino": 0.4432, "return_pct": 2.39, "equity": 1023.86, "max_dd": 7.54, "win_rate": 51.96, "profit_factor": 1.099, "ic": 0.2038, "hit": 51.46, "n": 103, "precision": 0.5714, "recall": 0.3019, "f1": 0.3951, "f2": 0.3333, "mcc": 0.0695, "accuracy": 0.5243, "tp": 16, "fp": 12, "tn": 38, "fn": 37}, {"fold": "fold_2", "regime": "Post-crash recovery", "sharpe": -0.036, "sortino": -0.065, "return_pct": -0.44, "equity": 995.57, "max_dd": 7.69, "win_rate": 49.53, "profit_factor": 0.994, "ic": -0.0128, "hit": 49.53, "n": 107, "precision": 0.4681, "recall": 0.4314, "f1": 0.449, "f2": 0.4382, "mcc": -0.0152, "accuracy": 0.4953, "tp": 22, "fp": 25, "tn": 31, "fn": 29}, {"fold": "fold_3", "regime": "Eurozone debt plateau", "sharpe": 15.776, "sortino": 25.8525, "return_pct": 48.55, "equity": 1485.49, "max_dd": 1.32, "win_rate": 87.5, "profit_factor": 15.427, "ic": 0.8048, "hit": 85.85, "n": 106, "precision": 0.8621, "recall": 0.8772, "f1": 0.8696, "f2": 0.8741, "mcc": 0.7151, "accuracy": 0.8585, "tp": 50, "fp": 8, "tn": 41, "fn": 7}, {"fold": "fold_4", "regime": "Strong USD downturn", "sharpe": 16.2628, "sortino": 48.6724, "return_pct": 140.96, "equity": 2409.58, "max_dd": 0.56, "win_rate": 94.01, "profit_factor": 42.495, "ic": 0.8999, "hit": 93.45, "n": 168, "precision": 0.975, "recall": 0.907, "f1": 0.9398, "f2": 0.9198, "mcc": 0.8833, "accuracy": 0.9405, "tp": 78, "fp": 2, "tn": 80, "fn": 8}, {"fold": "fold_5", "regime": "Low-vol plateau", "sharpe": 15.3233, "sortino": 66.4618, "return_pct": 44.29, "equity": 1442.87, "max_dd": 0.23, "win_rate": 85.8, "profit_factor": 23.077, "ic": 0.9017, "hit": 85.8, "n": 162, "precision": 0.8354, "recall": 0.8684, "f1": 0.8516, "f2": 0.8616, "mcc": 0.7161, "accuracy": 0.858, "tp": 66, "fp": 13, "tn": 73, "fn": 10}, {"fold": "fold_6", "regime": "EUR crisis downturn", "sharpe": 15.1344, "sortino": 61.4062, "return_pct": 98.76, "equity": 1987.57, "max_dd": 0.43, "win_rate": 82.42, "profit_factor": 16.389, "ic": 0.8822, "hit": 82.42, "n": 165, "precision": 0.8077, "recall": 0.8182, "f1": 0.8129, "f2": 0.8161, "mcc": 0.6472, "accuracy": 0.8242, "tp": 63, "fp": 15, "tn": 73, "fn": 14}, {"fold": "fold_7", "regime": "Recent mixed/upturn", "sharpe": 12.2247, "sortino": 16.0145, "return_pct": 77.67, "equity": 1776.73, "max_dd": 1.64, "win_rate": 84.57, "profit_factor": 9.995, "ic": 0.8461, "hit": 84.57, "n": 162, "precision": 0.8333, "recall": 0.8642, "f1": 0.8485, "f2": 0.8578, "mcc": 0.6918, "accuracy": 0.8457, "tp": 70, "fp": 14, "tn": 67, "fn": 11}], "val_sharpe": 7.5519, "val_psr": 1.0, "val_equity": 5005.14, "val_sortino": 9.4101, "val_return_pct": 400.51, "val_max_dd": 16.61, "val_win_rate": 75.23, "val_profit_factor": 3.718, "val_ic": 0.6695, "val_hit": 74.74, "val_precision": 0.7226, "val_recall": 0.7781, "val_f1": 0.7493, "val_f2": 0.7663, "val_mcc": 0.5071, "val_accuracy": 0.7526, "val_per_window": [{"fold": "fold_1", "regime": "Pre-crisis upturn + GFC onset", "sharpe": 2.2009, "sortino": 4.4489, "return_pct": 5.58, "equity": 1055.82, "max_dd": 2.61, "win_rate": 50.93, "profit_factor": 1.441, "ic": 0.0592, "hit": 50.46, "n": 109, "precision": 0.5055, "recall": 0.8364, "f1": 0.6301, "f2": 0.7395, "mcc": 0.0041, "accuracy": 0.5046, "tp": 46, "fp": 45, "tn": 9, "fn": 9}, {"fold": "fold_2", "regime": "Post-crash recovery", "sharpe": -2.7097, "sortino": -4.2862, "return_pct": -12.41, "equity": 875.94, "max_dd": 16.33, "win_rate": 46.3, "profit_factor": 0.652, "ic": -0.0903, "hit": 46.3, "n": 108, "precision": 0.5532, "recall": 0.4127, "f1": 0.4727, "f2": 0.4348, "mcc": -0.0537, "accuracy": 0.463, "tp": 26, "fp": 21, "tn": 24, "fn": 37}, {"fold": "fold_3", "regime": "Eurozone debt plateau", "sharpe": 14.493, "sortino": 36.2022, "return_pct": 53.9, "equity": 1538.99, "max_dd": 0.64, "win_rate": 85.32, "profit_factor": 14.172, "ic": 0.8488, "hit": 83.78, "n": 111, "precision": 0.8039, "recall": 0.8723, "f1": 0.8367, "f2": 0.8577, "mcc": 0.71, "accuracy": 0.8559, "tp": 41, "fp": 10, "tn": 54, "fn": 6}, {"fold": "fold_4", "regime": "Strong USD downturn", "sharpe": 13.8121, "sortino": 28.7839, "return_pct": 43.45, "equity": 1434.49, "max_dd": 0.66, "win_rate": 86.24, "profit_factor": 13.453, "ic": 0.9083, "hit": 85.45, "n": 110, "precision": 0.9444, "recall": 0.7234, "f1": 0.8193, "f2": 0.7589, "mcc": 0.7292, "accuracy": 0.8636, "tp": 34, "fp": 2, "tn": 61, "fn": 13}, {"fold": "fold_5", "regime": "Low-vol plateau", "sharpe": 15.1619, "sortino": 71.3703, "return_pct": 44.02, "equity": 1440.18, "max_dd": 0.29, "win_rate": 83.93, "profit_factor": 21.426, "ic": 0.9265, "hit": 83.93, "n": 112, "precision": 0.7966, "recall": 0.8868, "f1": 0.8393, "f2": 0.8672, "mcc": 0.6834, "accuracy": 0.8393, "tp": 47, "fp": 12, "tn": 47, "fn": 6}, {"fold": "fold_6", "regime": "EUR crisis downturn", "sharpe": 16.3079, "sortino": 118.8775, "return_pct": 29.68, "equity": 1296.83, "max_dd": 0.15, "win_rate": 88.79, "profit_factor": 45.368, "ic": 0.9287, "hit": 87.96, "n": 108, "precision": 0.8431, "recall": 0.9149, "f1": 0.8776, "f2": 0.8996, "mcc": 0.7783, "accuracy": 0.8889, "tp": 43, "fp": 8, "tn": 53, "fn": 4}, {"fold": "fold_7", "regime": "Recent mixed/upturn", "sharpe": 16.2631, "sortino": 69.9921, "return_pct": 31.26, "equity": 1312.56, "max_dd": 0.22, "win_rate": 84.55, "profit_factor": 21.928, "ic": 0.8893, "hit": 84.55, "n": 110, "precision": 0.8103, "recall": 0.8868, "f1": 0.8468, "f2": 0.8704, "mcc": 0.6944, "accuracy": 0.8455, "tp": 47, "fp": 11, "tn": 46, "fn": 6}], "train_sharpe": 10.5987, "train_psr": 1.0, "train_equity": 46372192.0, "train_sortino": 81.5911, "train_return_pct": 4637119.2, "train_max_dd": 0.71, "train_win_rate": 91.0, "train_profit_factor": 52.832, "train_ic": 0.9495, "train_hit": 90.64, "train_precision": 0.9075, "train_recall": 0.916, "train_f1": 0.9117, "train_f2": 0.9143, "train_mcc": 0.8174, "train_accuracy": 0.9088, "train_per_window": [{"fold": "all_train", "regime": "Training data", "sharpe": 10.5987, "sortino": 81.5911, "return_pct": 4637119.2, "equity": 46372192.0, "max_dd": 0.71, "win_rate": 91.0, "profit_factor": 52.832, "ic": 0.9495, "hit": 90.64, "n": 2478, "precision": 0.9075, "recall": 0.916, "f1": 0.9117, "f2": 0.9143, "mcc": 0.8174, "accuracy": 0.9088, "tp": 1167, "fp": 119, "tn": 1085, "fn": 107}], "experiment_num": 223, "status": "DISCARD"}
{"backbone": "catboost", "description": "catboost: Exp3 depth=8 deeper", "config": {"seq_len": 10, "lr": 0.0003, "batch_size": 32, "epochs": 20, "weight_decay": 1e-05, "patience": 5, "grad_clip": 1.0, "warmup_epochs": 0, "huber_delta": 1.0, "head_dropout": 0.1, "seed": 42, "depth": 8, "het_loss": false}, "composite": 7.9609, "test_pos_folds": 7, "val_pos_folds": 6, "val_loss": 0.0, "elapsed_sec": 2864.1, "timestamp": "2026-04-21T09:24:36", "sharpe": 8.4694, "psr": 1.0, "equity": 22314.74, "sortino": 8.0872, "return_pct": 2131.47, "max_dd": 7.54, "win_rate": 80.39, "profit_factor": 5.457, "ic": 0.7203, "hit": 80.06, "precision": 0.8247, "recall": 0.763, "f1": 0.7927, "f2": 0.7746, "mcc": 0.6066, "accuracy": 0.8027, "per_window": [{"fold": "fold_1", "regime": "Pre-crisis upturn + GFC onset", "sharpe": 0.8027, "sortino": 0.8703, "return_pct": 5.6, "equity": 1056.02, "max_dd": 7.54, "win_rate": 53.92, "profit_factor": 1.209, "ic": 0.1533, "hit": 53.4, "n": 103, "precision": 0.5833, "recall": 0.3962, "f1": 0.4719, "f2": 0.4234, "mcc": 0.1009, "accuracy": 0.5437, "tp": 21, "fp": 15, "tn": 35, "fn": 32}, {"fold": "fold_2", "regime": "Post-crash recovery", "sharpe": 2.8492, "sortino": 5.4622, "return_pct": 14.1, "equity": 1141.01, "max_dd": 5.32, "win_rate": 59.81, "profit_factor": 1.563, "ic": 0.0293, "hit": 59.81, "n": 107, "precision": 0.5952, "recall": 0.4902, "f1": 0.5376, "f2": 0.5081, "mcc": 0.1909, "accuracy": 0.5981, "tp": 25, "fp": 17, "tn": 39, "fn": 26}, {"fold": "fold_3", "regime": "Eurozone debt plateau", "sharpe": 15.7211, "sortino": 25.9641, "return_pct": 48.45, "equity": 1484.45, "max_dd": 1.32, "win_rate": 86.54, "profit_factor": 15.221, "ic": 0.8243, "hit": 84.91, "n": 106, "precision": 0.8727, "recall": 0.8421, "f1": 0.8571, "f2": 0.8481, "mcc": 0.6978, "accuracy": 0.8491, "tp": 48, "fp": 7, "tn": 42, "fn": 9}, {"fold": "fold_4", "regime": "Strong USD downturn", "sharpe": 16.003, "sortino": 43.3988, "return_pct": 139.28, "equity": 2392.83, "max_dd": 0.56, "win_rate": 93.41, "profit_factor": 36.375, "ic": 0.9131, "hit": 92.86, "n": 168, "precision": 0.963, "recall": 0.907, "f1": 0.9341, "f2": 0.9176, "mcc": 0.8707, "accuracy": 0.9345, "tp": 78, "fp": 3, "tn": 79, "fn": 8}, {"fold": "fold_5", "regime": "Low-vol plateau", "sharpe": 15.8253, "sortino": 96.8757, "return_pct": 45.17, "equity": 1451.68, "max_dd": 0.23, "win_rate": 85.19, "profit_factor": 28.464, "ic": 0.903, "hit": 85.19, "n": 162, "precision": 0.8611, "recall": 0.8158, "f1": 0.8378, "f2": 0.8245, "mcc": 0.7025, "accuracy": 0.8519, "tp": 62, "fp": 10, "tn": 76, "fn": 14}, {"fold": "fold_6", "regime": "EUR crisis downturn", "sharpe": 14.6791, "sortino": 42.372, "return_pct": 96.56, "equity": 1965.61, "max_dd": 0.76, "win_rate": 82.42, "profit_factor": 14.472, "ic": 0.8834, "hit": 82.42, "n": 165, "precision": 0.8158, "recall": 0.8052, "f1": 0.8105, "f2": 0.8073, "mcc": 0.6467, "accuracy": 0.8242, "tp": 62, "fp": 14, "tn": 74, "fn": 15}, {"fold": "fold_7", "regime": "Recent mixed/upturn", "sharpe": 13.2125, "sortino": 17.654, "return_pct": 82.72, "equity": 1827.19, "max_dd": 1.64, "win_rate": 86.42, "profit_factor": 13.062, "ic": 0.8434, "hit": 86.42, "n": 162, "precision": 0.8554, "recall": 0.8765, "f1": 0.8659, "f2": 0.8722, "mcc": 0.7286, "accuracy": 0.8642, "tp": 71, "fp": 12, "tn": 69, "fn": 10}], "val_sharpe": 8.0609, "val_psr": 1.0, "val_equity": 5462.1, "val_sortino": 10.1164, "val_return_pct": 446.21, "val_max_dd": 9.86, "val_win_rate": 75.36, "val_profit_factor": 4.091, "val_ic": 0.691, "val_hit": 74.87, "val_precision": 0.7189, "val_recall": 0.7918, "val_f1": 0.7536, "val_f2": 0.776, "val_mcc": 0.5113, "val_accuracy": 0.7539, "val_per_window": [{"fold": "fold_1", "regime": "Pre-crisis upturn + GFC onset", "sharpe": 1.9485, "sortino": 3.643, "return_pct": 4.93, "equity": 1049.28, "max_dd": 3.18, "win_rate": 50.93, "profit_factor": 1.382, "ic": 0.0365, "hit": 50.46, "n": 109, "precision": 0.5116, "recall": 0.8, "f1": 0.6241, "f2": 0.719, "mcc": 0.0272, "accuracy": 0.5138, "tp": 44, "fp": 42, "tn": 12, "fn": 11}, {"fold": "fold_2", "regime": "Post-crash recovery", "sharpe": -1.2423, "sortino": -1.9066, "return_pct": -6.1, "equity": 939.04, "max_dd": 9.86, "win_rate": 46.3, "profit_factor": 0.822, "ic": -0.0677, "hit": 46.3, "n": 108, "precision": 0.5472, "recall": 0.4603, "f1": 0.5, "f2": 0.4754, "mcc": -0.072, "accuracy": 0.463, "tp": 29, "fp": 24, "tn": 21, "fn": 34}, {"fold": "fold_3", "regime": "Eurozone debt plateau", "sharpe": 15.1126, "sortino": 40.344, "return_pct": 55.42, "equity": 1554.15, "max_dd": 0.64, "win_rate": 85.32, "profit_factor": 16.832, "ic": 0.8579, "hit": 83.78, "n": 111, "precision": 0.7586, "recall": 0.9362, "f1": 0.8381, "f2": 0.8943, "mcc": 0.7097, "accuracy": 0.8468, "tp": 44, "fp": 14, "tn": 50, "fn": 3}, {"fold": "fold_4", "regime": "Strong USD downturn", "sharpe": 15.4546, "sortino": 45.7213, "return_pct": 46.75, "equity": 1467.45, "max_dd": 0.54, "win_rate": 88.07, "profit_factor": 22.714, "ic": 0.9262, "hit": 87.27, "n": 110, "precision": 0.925, "recall": 0.7872, "f1": 0.8506, "f2": 0.8114, "mcc": 0.7606, "accuracy": 0.8818, "tp": 37, "fp": 3, "tn": 60, "fn": 10}, {"fold": "fold_5", "regime": "Low-vol plateau", "sharpe": 14.944, "sortino": 66.4902, "return_pct": 43.62, "equity": 1436.19, "max_dd": 0.29, "win_rate": 83.93, "profit_factor": 19.812, "ic": 0.9199, "hit": 83.93, "n": 112, "precision": 0.8182, "recall": 0.8491, "f1": 0.8333, "f2": 0.8427, "mcc": 0.6787, "accuracy": 0.8393, "tp": 45, "fp": 10, "tn": 49, "fn": 8}, {"fold": "fold_6", "regime": "EUR crisis downturn", "sharpe": 15.7247, "sortino": 99.1461, "return_pct": 29.08, "equity": 1290.8, "max_dd": 0.15, "win_rate": 87.85, "profit_factor": 32.197, "ic": 0.9212, "hit": 87.04, "n": 108, "precision": 0.84, "recall": 0.8936, "f1": 0.866, "f2": 0.8824, "mcc": 0.7581, "accuracy": 0.8796, "tp": 42, "fp": 8, "tn": 53, "fn": 5}, {"fold": "fold_7", "regime": "Recent mixed/upturn", "sharpe": 16.1341, "sortino": 68.3994, "return_pct": 31.12, "equity": 1311.17, "max_dd": 0.24, "win_rate": 84.55, "profit_factor": 21.031, "ic": 0.8868, "hit": 84.55, "n": 110, "precision": 0.8, "recall": 0.9057, "f1": 0.8496, "f2": 0.8824, "mcc": 0.6976, "accuracy": 0.8455, "tp": 48, "fp": 12, "tn": 45, "fn": 5}], "train_sharpe": 11.1982, "train_psr": 1.0, "train_equity": 70034168.0, "train_sortino": 764.0941, "train_return_pct": 7003316.8, "train_max_dd": 0.04, "train_win_rate": 99.15, "train_profit_factor": 4367.902, "train_ic": 0.9995, "train_hit": 98.75, "train_precision": 0.989, "train_recall": 0.9906, "train_f1": 0.9898, "train_f2": 0.9903, "train_mcc": 0.979, "train_accuracy": 0.9895, "train_per_window": [{"fold": "all_train", "regime": "Training data", "sharpe": 11.1982, "sortino": 764.0941, "return_pct": 7003316.8, "equity": 70034168.0, "max_dd": 0.04, "win_rate": 99.15, "profit_factor": 4367.902, "ic": 0.9995, "hit": 98.75, "n": 2478, "precision": 0.989, "recall": 0.9906, "f1": 0.9898, "f2": 0.9903, "mcc": 0.979, "accuracy": 0.9895, "tp": 1262, "fp": 14, "tn": 1190, "fn": 12}], "experiment_num": 224, "status": "DISCARD"}
{"backbone": "catboost", "description": "catboost: Exp4 depth=4 lr=0.01", "config": {"seq_len": 10, "lr": 0.0003, "batch_size": 32, "epochs": 20, "weight_decay": 1e-05, "patience": 5, "grad_clip": 1.0, "warmup_epochs": 0, "huber_delta": 1.0, "head_dropout": 0.1, "seed": 42, "gbm_lr": 0.01, "depth": 4, "het_loss": false}, "composite": 7.7675, "test_pos_folds": 7, "val_pos_folds": 6, "val_loss": 0.0, "elapsed_sec": 253.1, "timestamp": "2026-04-21T09:28:59", "sharpe": 7.8675, "psr": 1.0, "equity": 18691.87, "sortino": 7.717, "return_pct": 1769.19, "max_dd": 7.54, "win_rate": 78.95, "profit_factor": 4.733, "ic": 0.6972, "hit": 78.62, "precision": 0.8086, "recall": 0.7464, "f1": 0.7762, "f2": 0.758, "mcc": 0.5758, "accuracy": 0.7873, "per_window": [{"fold": "fold_1", "regime": "Pre-crisis upturn + GFC onset", "sharpe": 0.0153, "sortino": 0.0173, "return_pct": -0.61, "equity": 993.87, "max_dd": 7.54, "win_rate": 49.02, "profit_factor": 1.004, "ic": 0.166, "hit": 48.54, "n": 103, "precision": 0.5, "recall": 0.283, "f1": 0.3614, "f2": 0.3099, "mcc": -0.0187, "accuracy": 0.4854, "tp": 15, "fp": 15, "tn": 35, "fn": 38}, {"fold": "fold_2", "regime": "Post-crash recovery", "sharpe": 1.0091, "sortino": 1.7853, "return_pct": 4.67, "equity": 1046.69, "max_dd": 4.62, "win_rate": 52.34, "profit_factor": 1.171, "ic": -0.0195, "hit": 52.34, "n": 107, "precision": 0.5, "recall": 0.4118, "f1": 0.4516, "f2": 0.4268, "mcc": 0.0376, "accuracy": 0.5234, "tp": 21, "fp": 21, "tn": 35, "fn": 30}, {"fold": "fold_3", "regime": "Eurozone debt plateau", "sharpe": 14.2707, "sortino": 22.9655, "return_pct": 45.54, "equity": 1455.36, "max_dd": 1.32, "win_rate": 86.54, "profit_factor": 10.972, "ic": 0.803, "hit": 84.91, "n": 106, "precision": 0.8868, "recall": 0.8246, "f1": 0.8545, "f2": 0.8363, "mcc": 0.7001, "accuracy": 0.8491, "tp": 47, "fp": 6, "tn": 43, "fn": 10}, {"fold": "fold_4", "regime": "Strong USD downturn", "sharpe": 16.032, "sortino": 42.961, "return_pct": 139.47, "equity": 2394.71, "max_dd": 0.56, "win_rate": 93.41, "profit_factor": 36.979, "ic": 0.8997, "hit": 92.86, "n": 168, "precision": 0.9518, "recall": 0.9186, "f1": 0.9349, "f2": 0.9251, "mcc": 0.8696, "accuracy": 0.9345, "tp": 79, "fp": 4, "tn": 78, "fn": 7}, {"fold": "fold_5", "regime": "Low-vol plateau", "sharpe": 15.0464, "sortino": 69.7052, "return_pct": 43.79, "equity": 1437.85, "max_dd": 0.23, "win_rate": 83.95, "profit_factor": 20.797, "ic": 0.9131, "hit": 83.95, "n": 162, "precision": 0.8125, "recall": 0.8553, "f1": 0.8333, "f2": 0.8464, "mcc": 0.6796, "accuracy": 0.8395, "tp": 65, "fp": 15, "tn": 71, "fn": 11}, {"fold": "fold_6", "regime": "EUR crisis downturn", "sharpe": 15.3519, "sortino": 60.9256, "return_pct": 99.78, "equity": 1997.81, "max_dd": 0.43, "win_rate": 83.03, "profit_factor": 17.446, "ic": 0.88, "hit": 83.03, "n": 165, "precision": 0.8267, "recall": 0.8052, "f1": 0.8158, "f2": 0.8094, "mcc": 0.6587, "accuracy": 0.8303, "tp": 62, "fp": 13, "tn": 75, "fn": 15}, {"fold": "fold_7", "regime": "Recent mixed/upturn", "sharpe": 12.5712, "sortino": 15.491, "return_pct": 79.48, "equity": 1794.79, "max_dd": 1.64, "win_rate": 86.42, "profit_factor": 10.935, "ic": 0.8403, "hit": 86.42, "n": 162, "precision": 0.8642, "recall": 0.8642, "f1": 0.8642, "f2": 0.8642, "mcc": 0.7284, "accuracy": 0.8642, "tp": 70, "fp": 11, "tn": 70, "fn": 11}], "val_sharpe": 8.219, "val_psr": 1.0, "val_equity": 5608.51, "val_sortino": 10.0306, "val_return_pct": 460.85, "val_max_dd": 13.05, "val_win_rate": 76.8, "val_profit_factor": 4.216, "val_ic": 0.6844, "val_hit": 76.3, "val_precision": 0.7315, "val_recall": 0.8137, "val_f1": 0.7704, "val_f2": 0.7958, "val_mcc": 0.5435, "val_accuracy": 0.7695, "val_per_window": [{"fold": "fold_1", "regime": "Pre-crisis upturn + GFC onset", "sharpe": 1.8353, "sortino": 3.2203, "return_pct": 4.63, "equity": 1046.34, "max_dd": 4.05, "win_rate": 50.93, "profit_factor": 1.356, "ic": 0.0216, "hit": 50.46, "n": 109, "precision": 0.5111, "recall": 0.8364, "f1": 0.6345, "f2": 0.7419, "mcc": 0.0284, "accuracy": 0.5138, "tp": 46, "fp": 44, "tn": 10, "fn": 9}, {"fold": "fold_2", "regime": "Post-crash recovery", "sharpe": -1.1225, "sortino": -1.7389, "return_pct": -5.55, "equity": 944.47, "max_dd": 13.05, "win_rate": 47.22, "profit_factor": 0.838, "ic": -0.0635, "hit": 47.22, "n": 108, "precision": 0.55, "recall": 0.5238, "f1": 0.5366, "f2": 0.5288, "mcc": -0.0756, "accuracy": 0.4722, "tp": 33, "fp": 27, "tn": 18, "fn": 30}, {"fold": "fold_3", "regime": "Eurozone debt plateau", "sharpe": 15.1035, "sortino": 31.0759, "return_pct": 55.39, "equity": 1553.94, "max_dd": 0.7, "win_rate": 87.16, "profit_factor": 16.787, "ic": 0.8551, "hit": 85.59, "n": 111, "precision": 0.8113, "recall": 0.9149, "f1": 0.86, "f2": 0.8921, "mcc": 0.7505, "accuracy": 0.8739, "tp": 43, "fp": 10, "tn": 54, "fn": 4}, {"fold": "fold_4", "regime": "Strong USD downturn", "sharpe": 16.3668, "sortino": 52.869, "return_pct": 48.39, "equity": 1483.94, "max_dd": 0.64, "win_rate": 90.83, "profit_factor": 33.631, "ic": 0.935, "hit": 90.0, "n": 110, "precision": 0.9302, "recall": 0.8511, "f1": 0.8889, "f2": 0.8658, "mcc": 0.8145, "accuracy": 0.9091, "tp": 40, "fp": 3, "tn": 60, "fn": 7}, {"fold": "fold_5", "regime": "Low-vol plateau", "sharpe": 15.498, "sortino": 72.0102, "return_pct": 44.62, "equity": 1446.21, "max_dd": 0.25, "win_rate": 85.71, "profit_factor": 24.384, "ic": 0.9221, "hit": 85.71, "n": 112, "precision": 0.8491, "recall": 0.8491, "f1": 0.8491, "f2": 0.8491, "mcc": 0.7135, "accuracy": 0.8571, "tp": 45, "fp": 8, "tn": 51, "fn": 8}, {"fold": "fold_6", "regime": "EUR crisis downturn", "sharpe": 16.0045, "sortino": 104.0188, "return_pct": 29.37, "equity": 1293.73, "max_dd": 0.15, "win_rate": 88.79, "profit_factor": 37.522, "ic": 0.933, "hit": 87.96, "n": 108, "precision": 0.8431, "recall": 0.9149, "f1": 0.8776, "f2": 0.8996, "mcc": 0.7783, "accuracy": 0.8889, "tp": 43, "fp": 8, "tn": 53, "fn": 4}, {"fold": "fold_7", "regime": "Recent mixed/upturn", "sharpe": 16.5309, "sortino": 66.8793, "return_pct": 31.54, "equity": 1315.4, "max_dd": 0.23, "win_rate": 86.36, "profit_factor": 24.004, "ic": 0.8965, "hit": 86.36, "n": 110, "precision": 0.8393, "recall": 0.8868, "f1": 0.8624, "f2": 0.8769, "mcc": 0.7285, "accuracy": 0.8636, "tp": 47, "fp": 9, "tn": 48, "fn": 6}], "train_sharpe": 8.6932, "train_psr": 1.0, "train_equity": 10765972.0, "train_sortino": 29.0714, "train_return_pct": 1076497.2, "train_max_dd": 3.59, "train_win_rate": 81.65, "train_profit_factor": 10.967, "train_ic": 0.832, "train_hit": 81.32, "train_precision": 0.8097, "train_recall": 0.8383, "train_f1": 0.8238, "train_f2": 0.8324, "train_mcc": 0.6309, "train_accuracy": 0.8156, "train_per_window": [{"fold": "all_train", "regime": "Training data", "sharpe": 8.6932, "sortino": 29.0714, "return_pct": 1076497.2, "equity": 10765972.0, "max_dd": 3.59, "win_rate": 81.65, "profit_factor": 10.967, "ic": 0.832, "hit": 81.32, "n": 2478, "precision": 0.8097, "recall": 0.8383, "f1": 0.8238, "f2": 0.8324, "mcc": 0.6309, "accuracy": 0.8156, "tp": 1068, "fp": 251, "tn": 953, "fn": 206}], "experiment_num": 225, "status": "DISCARD"}
